=== START OF INFORMATION SECTION ===
Model Family:     Western Digital Caviar Black
Device Model:     WDC WD7501AALS-00E8B0
Serial Number:    --
LU WWN Device Id: 5 0014ee ...
Firmware Version: 05.00K05
User Capacity:    750 156 374 016 bytes [750 GB]
Sector Size:      512 bytes logical/physical
Rotation Rate:    7200 rpm
Device is:        In smartctl database [for details use: -P show]
ATA Version is:   ATA8-ACS (minor revision not indicated)
SATA Version is:  SATA 2.5, 3.0 Gb/s
Local Time is:    Mon Nov  5 12:56:19 2018 MSK
SMART support is: Available - device has SMART capability.
SMART support is: Enabled
AAM feature is:   Disabled
APM feature is:   Unavailable
Rd look-ahead is: Enabled
Write cache is:   Enabled
ATA Security is:  Disabled, frozen [SEC2]
Wt Cache Reorder: Enabled

=== START OF READ SMART DATA SECTION ===
SMART overall-health self-assessment test result: PASSED

General SMART Values:
Offline data collection status:  (0x82)	Offline data collection activity
					was completed without error.
					Auto Offline Data Collection: Enabled.
Self-test execution status:      (   0)	The previous self-test routine completed
					without error or no self-test has ever 
					been run.
Total time to complete Offline 
data collection: 		(15480) seconds.
Offline data collection
capabilities: 			 (0x7b) SMART execute Offline immediate.
					Auto Offline data collection on/off support.
					Suspend Offline collection upon new
					command.
					Offline surface scan supported.
					Self-test supported.
					Conveyance Self-test supported.
					Selective Self-test supported.
SMART capabilities:            (0x0003)	Saves SMART data before entering
					power-saving mode.
					Supports SMART auto save timer.
Error logging capability:        (0x01)	Error logging supported.
					General Purpose Logging supported.
Short self-test routine 
recommended polling time: 	 (   2) minutes.
Extended self-test routine
recommended polling time: 	 ( 180) minutes.
Conveyance self-test routine
recommended polling time: 	 (   5) minutes.
SCT capabilities: 	       (0x303f)	SCT Status supported.
					SCT Error Recovery Control supported.
					SCT Feature Control supported.
					SCT Data Table supported.

SMART Attributes Data Structure revision number: 16
Vendor Specific SMART Attributes with Thresholds:
ID# ATTRIBUTE_NAME          FLAGS    VALUE WORST THRESH FAIL RAW_VALUE
  1 Raw_Read_Error_Rate     POSR-K   200   200   051    -    85
  3 Spin_Up_Time            POS--K   253   253   021    -    1358
  4 Start_Stop_Count        -O--CK   090   090   000    -    10673
  5 Reallocated_Sector_Ct   PO--CK   200   200   140    -    0
  7 Seek_Error_Rate         -OSR-K   200   200   000    -    0
  9 Power_On_Hours          -O--CK   056   056   000    -    32425
 10 Spin_Retry_Count        -O--CK   100   100   000    -    0
 11 Calibration_Retry_Count -O--CK   100   100   000    -    0
 12 Power_Cycle_Count       -O--CK   093   093   000    -    7368
192 Power-Off_Retract_Count -O--CK   199   199   000    -    1174
193 Load_Cycle_Count        -O--CK   197   197   000    -    10672
194 Temperature_Celsius     -O---K   105   085   000    -    45
196 Reallocated_Event_Count -O--CK   200   200   000    -    0
197 Current_Pending_Sector  -O--CK   200   200   000    -    0
198 Offline_Uncorrectable   ----CK   200   200   000    -    0
199 UDMA_CRC_Error_Count    -O--CK   200   200   000    -    0
200 Multi_Zone_Error_Rate   ---R--   200   200   000    -    1
                            ||||||_ K auto-keep
                            |||||__ C event count
                            ||||___ R error rate
                            |||____ S speed/performance
                            ||_____ O updated online
                            |______ P prefailure warning

General Purpose Log Directory Version 1
SMART           Log Directory Version 1 [multi-sector log support]
Address    Access  R/W   Size  Description
0x00       GPL,SL  R/O      1  Log Directory
0x01           SL  R/O      1  Summary SMART error log
0x02           SL  R/O      5  Comprehensive SMART error log
0x03       GPL     R/O      6  Ext. Comprehensive SMART error log
0x06           SL  R/O      1  SMART self-test log
0x07       GPL     R/O      1  Extended self-test log
0x09           SL  R/W      1  Selective self-test log
0x10       GPL     R/O      1  SATA NCQ Queued Error log
0x11       GPL     R/O      1  SATA Phy Event Counters log
0x80-0x9f  GPL,SL  R/W     16  Host vendor specific log
0xa0-0xa7  GPL,SL  VS      16  Device vendor specific log
0xa8-0xb5  GPL,SL  VS       1  Device vendor specific log
0xb6       GPL     VS       1  Device vendor specific log
0xb7       GPL,SL  VS       1  Device vendor specific log
0xc0       GPL,SL  VS       1  Device vendor specific log
0xc1       GPL     VS      24  Device vendor specific log
0xe0       GPL,SL  R/W      1  SCT Command/Status
0xe1       GPL,SL  R/W      1  SCT Data Transfer

SMART Extended Comprehensive Error Log Version: 1 (6 sectors)
Device Error Count: 10
	CR     = Command Register
	FEATR  = Features Register
	COUNT  = Count (was: Sector Count) Register
	LBA_48 = Upper bytes of LBA High/Mid/Low Registers ]  ATA-8
	LH     = LBA High (was: Cylinder High) Register    ]   LBA
	LM     = LBA Mid (was: Cylinder Low) Register      ] Register
	LL     = LBA Low (was: Sector Number) Register     ]
	DV     = Device (was: Device/Head) Register
	DC     = Device Control Register
	ER     = Error register
	ST     = Status register
Powered_Up_Time is measured from power on, and printed as
DDd+hh:mm:SS.sss where DD=days, hh=hours, mm=minutes,
SS=sec, and sss=millisec. It "wraps" after 49.710 days.

Error 10 [9] occurred at disk power-on lifetime: 22394 hours (933 days + 2 hours)
  When the command that caused the error occurred, the device was active or idle.

  After command completion occurred, registers were:
  ER -- ST COUNT  LBA_48  LH LM LL DV DC
  -- -- -- == -- == == == -- -- -- -- --
  40 -- 51 00 00 00 3f 96 00 1a 62 40 00  Error: UNC at LBA = 0x3f96001a62 = 273099528802

  Commands leading to the command that caused the error were:
  CR FEATR COUNT  LBA_48  LH LM LL DV DC  Powered_Up_Time  Command/Feature_Name
  -- == -- == -- == == == -- -- -- -- --  ---------------  --------------------
  60 00 80 00 90 00 00 3f 1a 96 5a 40 00     02:30:00.399  READ FPDMA QUEUED
  61 00 32 00 88 00 00 54 45 61 00 40 00     02:30:00.399  WRITE FPDMA QUEUED
  60 00 26 00 80 00 00 3f 1a 95 da 40 00     02:30:00.398  READ FPDMA QUEUED
  61 00 4e 00 78 00 00 54 45 60 b2 40 00     02:30:00.396  WRITE FPDMA QUEUED
  60 00 5a 00 70 00 00 3f 1a 94 00 40 00     02:30:00.396  READ FPDMA QUEUED

Error 9 [8] occurred at disk power-on lifetime: 21957 hours (914 days + 21 hours)
  When the command that caused the error occurred, the device was active or idle.

  After command completion occurred, registers were:
  ER -- ST COUNT  LBA_48  LH LM LL DV DC
  -- -- -- == -- == == == -- -- -- -- --
  40 -- 51 00 00 00 3f 80 00 1a b7 40 00  Error: UNC at LBA = 0x3f80001ab7 = 272730430135

  Commands leading to the command that caused the error were:
  CR FEATR COUNT  LBA_48  LH LM LL DV DC  Powered_Up_Time  Command/Feature_Name
  -- == -- == -- == == == -- -- -- -- --  ---------------  --------------------
  60 00 4e 00 78 00 00 3f 1a 80 b2 40 00     00:30:44.748  READ FPDMA QUEUED
  60 00 80 00 70 00 00 3f c1 08 fa 40 00     00:30:44.748  READ FPDMA QUEUED
  60 00 32 00 68 00 00 3f 1a 80 80 40 00     00:30:44.747  READ FPDMA QUEUED
  60 00 36 00 60 00 00 3f 1a 80 4a 40 00     00:30:44.745  READ FPDMA QUEUED
  60 00 80 00 58 00 00 3f c1 08 7a 40 00     00:30:44.745  READ FPDMA QUEUED

Error 8 [7] occurred at disk power-on lifetime: 21951 hours (914 days + 15 hours)
  When the command that caused the error occurred, the device was active or idle.

  After command completion occurred, registers were:
  ER -- ST COUNT  LBA_48  LH LM LL DV DC
  -- -- -- == -- == == == -- -- -- -- --
  40 -- 51 00 00 00 3f 9d 00 19 1b 40 00  Error: UNC at LBA = 0x3f9d00191b = 273216968987

  Commands leading to the command that caused the error were:
  CR FEATR COUNT  LBA_48  LH LM LL DV DC  Powered_Up_Time  Command/Feature_Name
  -- == -- == -- == == == -- -- -- -- --  ---------------  --------------------
  60 00 18 00 c0 00 00 3f 19 9d 0a 40 00     00:18:53.557  READ FPDMA QUEUED
  2f 00 00 00 01 00 00 00 00 00 10 40 00     00:18:53.556  READ LOG EXT
  60 00 18 00 b8 00 00 3f 19 9d 0a 40 00     00:18:50.652  READ FPDMA QUEUED
  ea 00 00 00 00 00 00 00 00 00 00 40 00     00:18:50.651  FLUSH CACHE EXT
  ec 00 00 00 00 00 00 00 00 00 00 00 00     00:18:50.552  IDENTIFY DEVICE

Error 7 [6] occurred at disk power-on lifetime: 21951 hours (914 days + 15 hours)
  When the command that caused the error occurred, the device was active or idle.

  After command completion occurred, registers were:
  ER -- ST COUNT  LBA_48  LH LM LL DV DC
  -- -- -- == -- == == == -- -- -- -- --
  40 -- 51 00 00 00 3f 9d 00 19 1b 40 00  Error: UNC at LBA = 0x3f9d00191b = 273216968987

  Commands leading to the command that caused the error were:
  CR FEATR COUNT  LBA_48  LH LM LL DV DC  Powered_Up_Time  Command/Feature_Name
  -- == -- == -- == == == -- -- -- -- --  ---------------  --------------------
  60 00 18 00 b8 00 00 3f 19 9d 0a 40 00     00:18:50.652  READ FPDMA QUEUED
  ea 00 00 00 00 00 00 00 00 00 00 40 00     00:18:50.651  FLUSH CACHE EXT
  ec 00 00 00 00 00 00 00 00 00 00 00 00     00:18:50.552  IDENTIFY DEVICE
  ef 00 02 00 00 00 00 00 00 00 00 a0 00     00:18:50.452  SET FEATURES [Enable write cache]
  61 00 01 00 90 00 00 57 54 66 ee 40 00     00:18:50.452  WRITE FPDMA QUEUED

Error 6 [5] occurred at disk power-on lifetime: 21951 hours (914 days + 15 hours)
  When the command that caused the error occurred, the device was active or idle.

  After command completion occurred, registers were:
  ER -- ST COUNT  LBA_48  LH LM LL DV DC
  -- -- -- == -- == == == -- -- -- -- --
  40 -- 51 00 00 00 3f 9d 00 19 1b 40 00  Error: UNC at LBA = 0x3f9d00191b = 273216968987

  Commands leading to the command that caused the error were:
  CR FEATR COUNT  LBA_48  LH LM LL DV DC  Powered_Up_Time  Command/Feature_Name
  -- == -- == -- == == == -- -- -- -- --  ---------------  --------------------
  60 00 66 00 80 00 00 3f 19 9d 1a 40 00     00:18:47.829  READ FPDMA QUEUED
  2f 00 00 00 01 00 00 00 00 00 10 40 00     00:18:47.829  READ LOG EXT
  60 00 6e 00 78 00 00 3f 19 9d 12 40 00     00:18:45.240  READ FPDMA QUEUED
  2f 00 00 00 01 00 00 00 00 00 10 40 00     00:18:45.240  READ LOG EXT
  60 00 76 00 70 00 00 3f 19 9d 0a 40 00     00:18:42.669  READ FPDMA QUEUED

Error 5 [4] occurred at disk power-on lifetime: 21951 hours (914 days + 15 hours)
  When the command that caused the error occurred, the device was active or idle.

  After command completion occurred, registers were:
  ER -- ST COUNT  LBA_48  LH LM LL DV DC
  -- -- -- == -- == == == -- -- -- -- --
  40 -- 51 00 00 00 3f 9d 00 19 1b 40 00  Error: UNC at LBA = 0x3f9d00191b = 273216968987

  Commands leading to the command that caused the error were:
  CR FEATR COUNT  LBA_48  LH LM LL DV DC  Powered_Up_Time  Command/Feature_Name
  -- == -- == -- == == == -- -- -- -- --  ---------------  --------------------
  60 00 6e 00 78 00 00 3f 19 9d 12 40 00     00:18:45.240  READ FPDMA QUEUED
  2f 00 00 00 01 00 00 00 00 00 10 40 00     00:18:45.240  READ LOG EXT
  60 00 76 00 70 00 00 3f 19 9d 0a 40 00     00:18:42.669  READ FPDMA QUEUED
  60 00 0a 00 68 00 00 3f 19 9d 00 40 00     00:18:42.651  READ FPDMA QUEUED
  2f 00 00 00 01 00 00 00 00 00 10 40 00     00:18:42.651  READ LOG EXT

Error 4 [3] occurred at disk power-on lifetime: 21951 hours (914 days + 15 hours)
  When the command that caused the error occurred, the device was active or idle.

  After command completion occurred, registers were:
  ER -- ST COUNT  LBA_48  LH LM LL DV DC
  -- -- -- == -- == == == -- -- -- -- --
  40 -- 51 00 00 00 3f 9d 00 19 1b 40 00  Error: UNC at LBA = 0x3f9d00191b = 273216968987

  Commands leading to the command that caused the error were:
  CR FEATR COUNT  LBA_48  LH LM LL DV DC  Powered_Up_Time  Command/Feature_Name
  -- == -- == -- == == == -- -- -- -- --  ---------------  --------------------
  60 00 76 00 70 00 00 3f 19 9d 0a 40 00     00:18:42.669  READ FPDMA QUEUED
  60 00 0a 00 68 00 00 3f 19 9d 00 40 00     00:18:42.651  READ FPDMA QUEUED
  2f 00 00 00 01 00 00 00 00 00 10 40 00     00:18:42.651  READ LOG EXT
  60 00 80 00 60 00 00 3f 19 9d 00 40 00     00:18:40.056  READ FPDMA QUEUED
  60 00 80 00 58 00 00 3f 19 9c 80 40 00     00:18:40.055  READ FPDMA QUEUED

Error 3 [2] occurred at disk power-on lifetime: 21951 hours (914 days + 15 hours)
  When the command that caused the error occurred, the device was active or idle.

  After command completion occurred, registers were:
  ER -- ST COUNT  LBA_48  LH LM LL DV DC
  -- -- -- == -- == == == -- -- -- -- --
  40 -- 51 00 00 00 3f 9d 00 19 1b 40 00  Error: UNC at LBA = 0x3f9d00191b = 273216968987

  Commands leading to the command that caused the error were:
  CR FEATR COUNT  LBA_48  LH LM LL DV DC  Powered_Up_Time  Command/Feature_Name
  -- == -- == -- == == == -- -- -- -- --  ---------------  --------------------
  60 00 80 00 60 00 00 3f 19 9d 00 40 00     00:18:40.056  READ FPDMA QUEUED
  60 00 80 00 58 00 00 3f 19 9c 80 40 00     00:18:40.055  READ FPDMA QUEUED
  60 00 42 00 50 00 00 55 ae 8e 00 40 00     00:18:40.055  READ FPDMA QUEUED
  60 00 42 00 48 00 00 55 ae 8d 80 40 00     00:18:40.055  READ FPDMA QUEUED
  60 00 42 00 40 00 00 55 ae 8d 00 40 00     00:18:40.054  READ FPDMA QUEUED

SMART Extended Self-test Log Version: 1 (1 sectors)
No self-tests have been logged.  [To run self-tests, use: smartctl -t]

SMART Selective self-test log data structure revision number 1
 SPAN  MIN_LBA  MAX_LBA  CURRENT_TEST_STATUS
    1        0        0  Not_testing
    2        0        0  Not_testing
    3        0        0  Not_testing
    4        0        0  Not_testing
    5        0        0  Not_testing
Selective self-test flags (0x0):
  After scanning selected spans, do NOT read-scan remainder of disk.
If Selective self-test is pending on power-up, resume after 0 minute delay.

SCT Status Version:                  2
SCT Version (vendor specific):       258 (0x0102)
SCT Support Level:                   1
Device State:                        Active (0)
Current Temperature:                    45 Celsius
Power Cycle Min/Max Temperature:     45/45 Celsius
Lifetime    Min/Max Temperature:     23/66 Celsius
Under/Over Temperature Limit Count:   0/0

SCT Temperature History Version:     2
Temperature Sampling Period:         1 minute
Temperature Logging Interval:        1 minute
Min/Max recommended Temperature:      0/60 Celsius
Min/Max Temperature Limit:           -41/85 Celsius
Temperature History Size (Index):    128 (99)

SCT Error Recovery Control:
           Read: Disabled
          Write: Disabled

Device Statistics (GP/SMART Log 0x04) not supported

SATA Phy Event Counters (GP Log 0x11)
ID      Size     Value  Description
0x0001  2            0  Command failed due to ICRC error
0x0002  2            0  R_ERR response for data FIS
0x0003  2            0  R_ERR response for device-to-host data FIS
0x0004  2            0  R_ERR response for host-to-device data FIS
0x0005  2            0  R_ERR response for non-data FIS
0x0006  2            0  R_ERR response for device-to-host non-data FIS
0x0007  2            0  R_ERR response for host-to-device non-data FIS
0x000a  2           20  Device-to-host register FISes sent due to a COMRESET
0x8000  4         2058  Vendor specific

