smartctl 7.4 2023-08-01 r5530 [x86_64-linux-6.10.0-desktop-1omv2490] (OpenMandriva Lx 7.4-1)
Copyright (C) 2002-23, Bruce Allen, Christian Franke, www.smartmontools.org

=== START OF INFORMATION SECTION ===
Model Family:     Toshiba 2.5" HDD MK..59GSXP (AF)
Device Model:     TOSHIBA MK7559GSXP
Serial Number:    --
LU WWN Device Id: 5 000039 ...
Firmware Version: GN003J
User Capacity:    750,156,374,016 bytes [750 GB]
Sector Sizes:     512 bytes logical, 4096 bytes physical
Rotation Rate:    5400 rpm
Form Factor:      2.5 inches
Device is:        In smartctl database
ATA Version is:   ATA8-ACS (minor revision not indicated)
SATA Version is:  SATA 2.6, 3.0 Gb/s (current: 3.0 Gb/s)
Local Time is:    Mon Aug 12 12:37:34 2024 IST
SMART support is: Available - device has SMART capability.
SMART support is: Enabled
AAM feature is:   Unavailable
APM level is:     128 (minimum power consumption without standby)
Rd look-ahead is: Enabled
Write cache is:   Enabled
DSN feature is:   Unavailable
ATA Security is:  Disabled, frozen [SEC2]
Wt Cache Reorder: Enabled

=== START OF READ SMART DATA SECTION ===
SMART overall-health self-assessment test result: PASSED

General SMART Values:
Offline data collection status:  (0x85)	Offline data collection activity
					was aborted by an interrupting command from host.
					Auto Offline Data Collection: Enabled.
Self-test execution status:      (   0)	The previous self-test routine completed
					without error or no self-test has ever 
					been run.
Total time to complete Offline 
data collection: 		(  120) seconds.
Offline data collection
capabilities: 			 (0x5b) SMART execute Offline immediate.
					Auto Offline data collection on/off support.
					Suspend Offline collection upon new
					command.
					Offline surface scan supported.
					Self-test supported.
					No Conveyance Self-test supported.
					Selective Self-test supported.
SMART capabilities:            (0x0003)	Saves SMART data before entering
					power-saving mode.
					Supports SMART auto save timer.
Error logging capability:        (0x01)	Error logging supported.
					General Purpose Logging supported.
Short self-test routine 
recommended polling time: 	 (   2) minutes.
Extended self-test routine
recommended polling time: 	 ( 193) minutes.
SCT capabilities: 	       (0x003d)	SCT Status supported.
					SCT Error Recovery Control supported.
					SCT Feature Control supported.
					SCT Data Table supported.

SMART Attributes Data Structure revision number: 16
Vendor Specific SMART Attributes with Thresholds:
ID# ATTRIBUTE_NAME          FLAGS    VALUE WORST THRESH FAIL RAW_VALUE
  1 Raw_Read_Error_Rate     PO-R--   100   100   050    -    0
  2 Throughput_Performance  P-S---   100   100   050    -    0
  3 Spin_Up_Time            POS--K   100   100   001    -    2094
  4 Start_Stop_Count        -O--CK   100   100   000    -    20989
  5 Reallocated_Sector_Ct   PO--CK   100   100   050    -    1208
  7 Seek_Error_Rate         PO-R--   100   100   050    -    0
  8 Seek_Time_Performance   P-S---   100   100   050    -    0
  9 Power_On_Hours          -O--CK   021   021   000    -    31758
 10 Spin_Retry_Count        PO--CK   253   100   030    -    0
 12 Power_Cycle_Count       -O--CK   100   100   000    -    9271
191 G-Sense_Error_Rate      -O--CK   100   100   000    -    12217
192 Power-Off_Retract_Count -O--CK   099   099   000    -    886
193 Load_Cycle_Count        -O--CK   065   065   000    -    354774
194 Temperature_Celsius     -O---K   100   100   000    -    51 (Min/Max 20/62)
196 Reallocated_Event_Count -O--CK   100   100   000    -    72
197 Current_Pending_Sector  -O--CK   100   100   000    -    0
198 Offline_Uncorrectable   ----CK   100   100   000    -    0
199 UDMA_CRC_Error_Count    -O--CK   200   200   000    -    8
220 Disk_Shift              -O----   100   100   000    -    62
222 Loaded_Hours            -O--CK   062   062   000    -    15538
223 Load_Retry_Count        -O--CK   100   100   000    -    0
224 Load_Friction           -O---K   100   100   000    -    0
226 Load-in_Time            -OS--K   100   100   000    -    301
240 Head_Flying_Hours       P-----   100   100   001    -    0
                            ||||||_ K auto-keep
                            |||||__ C event count
                            ||||___ R error rate
                            |||____ S speed/performance
                            ||_____ O updated online
                            |______ P prefailure warning

General Purpose Log Directory Version 1
SMART           Log Directory Version 1 [multi-sector log support]
Address    Access  R/W   Size  Description
0x00       GPL,SL  R/O      1  Log Directory
0x01           SL  R/O      1  Summary SMART error log
0x02           SL  R/O     51  Comprehensive SMART error log
0x03       GPL     R/O     64  Ext. Comprehensive SMART error log
0x06           SL  R/O      1  SMART self-test log
0x07       GPL     R/O      1  Extended self-test log
0x09           SL  R/W      1  Selective self-test log
0x10       GPL     R/O      1  NCQ Command Error log
0x11       GPL     R/O      1  SATA Phy Event Counters log
0x80-0x9f  GPL,SL  R/W     16  Host vendor specific log
0xe0       GPL,SL  R/W      1  SCT Command/Status
0xe1       GPL,SL  R/W      1  SCT Data Transfer

SMART Extended Comprehensive Error Log Version: 1 (64 sectors)
Device Error Count: 6837 (device log contains only the most recent 256 errors)
	CR     = Command Register
	FEATR  = Features Register
	COUNT  = Count (was: Sector Count) Register
	LBA_48 = Upper bytes of LBA High/Mid/Low Registers ]  ATA-8
	LH     = LBA High (was: Cylinder High) Register    ]   LBA
	LM     = LBA Mid (was: Cylinder Low) Register      ] Register
	LL     = LBA Low (was: Sector Number) Register     ]
	DV     = Device (was: Device/Head) Register
	DC     = Device Control Register
	ER     = Error register
	ST     = Status register
Powered_Up_Time is measured from power on, and printed as
DDd+hh:mm:SS.sss where DD=days, hh=hours, mm=minutes,
SS=sec, and sss=millisec. It "wraps" after 49.710 days.

Error 6837 [180] occurred at disk power-on lifetime: 31507 hours (1312 days + 19 hours)
  When the command that caused the error occurred, the device was active or idle.

  After command completion occurred, registers were:
  ER -- ST COUNT  LBA_48  LH LM LL DV DC
  -- -- -- == -- == == == -- -- -- -- --
  84 -- 41 00 8a 00 00 00 33 9f ff 60 00  Error: ICRC, ABRT at LBA = 0x00339fff = 3383295

  Commands leading to the command that caused the error were:
  CR FEATR COUNT  LBA_48  LH LM LL DV DC  Powered_Up_Time  Command/Feature_Name
  -- == -- == -- == == == -- -- -- -- --  ---------------  --------------------
  60 00 08 00 e0 00 00 00 67 61 c8 40 00     00:09:34.787  READ FPDMA QUEUED
  61 00 08 00 d8 00 00 00 05 dc b0 40 00     00:09:34.786  WRITE FPDMA QUEUED
  60 00 20 00 d0 00 00 04 17 5b 60 40 00     00:09:34.783  READ FPDMA QUEUED
  60 00 12 00 c8 00 00 00 33 a7 00 40 00     00:09:34.782  READ FPDMA QUEUED
  60 01 00 00 c0 00 00 00 33 a6 00 40 00     00:09:34.781  READ FPDMA QUEUED

Error 6836 [179] occurred at disk power-on lifetime: 31507 hours (1312 days + 19 hours)
  When the command that caused the error occurred, the device was active or idle.

  After command completion occurred, registers were:
  ER -- ST COUNT  LBA_48  LH LM LL DV DC
  -- -- -- == -- == == == -- -- -- -- --
  84 -- 41 00 6a 00 00 04 17 5b 7f 64 00  Error: ICRC, ABRT at LBA = 0x04175b7f = 68639615

  Commands leading to the command that caused the error were:
  CR FEATR COUNT  LBA_48  LH LM LL DV DC  Powered_Up_Time  Command/Feature_Name
  -- == -- == -- == == == -- -- -- -- --  ---------------  --------------------
  60 00 20 00 68 00 00 04 17 5b 60 40 00     00:09:33.500  READ FPDMA QUEUED
  60 00 20 00 60 00 00 04 17 5b 40 40 00     00:09:33.500  READ FPDMA QUEUED
  60 00 20 00 58 00 00 04 17 5b 20 40 00     00:09:33.500  READ FPDMA QUEUED
  60 00 20 00 50 00 00 04 17 5b 00 40 00     00:09:33.500  READ FPDMA QUEUED
  60 00 20 00 48 00 00 04 17 5a e0 40 00     00:09:33.500  READ FPDMA QUEUED

Error 6835 [178] occurred at disk power-on lifetime: 31507 hours (1312 days + 19 hours)
  When the command that caused the error occurred, the device was active or idle.

  After command completion occurred, registers were:
  ER -- ST COUNT  LBA_48  LH LM LL DV DC
  -- -- -- == -- == == == -- -- -- -- --
  84 -- 41 00 0a 00 00 00 63 26 f7 60 00  Error: ICRC, ABRT at LBA = 0x006326f7 = 6498039

  Commands leading to the command that caused the error were:
  CR FEATR COUNT  LBA_48  LH LM LL DV DC  Powered_Up_Time  Command/Feature_Name
  -- == -- == -- == == == -- -- -- -- --  ---------------  --------------------
  60 01 00 00 20 00 00 00 63 28 f8 40 00     00:09:32.186  READ FPDMA QUEUED
  60 01 00 00 18 00 00 00 63 27 f8 40 00     00:09:32.186  READ FPDMA QUEUED
  60 01 00 00 10 00 00 00 63 26 f8 40 00     00:09:32.186  READ FPDMA QUEUED
  60 01 00 00 08 00 00 00 63 25 f8 40 00     00:09:32.186  READ FPDMA QUEUED
  60 01 00 00 f8 00 00 00 63 24 f8 40 00     00:09:32.186  READ FPDMA QUEUED

Error 6834 [177] occurred at disk power-on lifetime: 31506 hours (1312 days + 18 hours)
  When the command that caused the error occurred, the device was active or idle.

  After command completion occurred, registers were:
  ER -- ST COUNT  LBA_48  LH LM LL DV DC
  -- -- -- == -- == == == -- -- -- -- --
  84 -- 41 00 c2 00 00 00 4f 9a a7 60 00  Error: ICRC, ABRT at LBA = 0x004f9aa7 = 5216935

  Commands leading to the command that caused the error were:
  CR FEATR COUNT  LBA_48  LH LM LL DV DC  Powered_Up_Time  Command/Feature_Name
  -- == -- == -- == == == -- -- -- -- --  ---------------  --------------------
  60 00 20 00 b8 00 00 00 58 86 00 40 00     00:05:47.569  READ FPDMA QUEUED
  60 00 20 00 b0 00 00 00 58 31 a0 40 00     00:05:47.568  READ FPDMA QUEUED
  60 00 20 00 a8 00 00 00 58 32 20 40 00     00:05:47.567  READ FPDMA QUEUED
  60 00 20 00 a0 00 00 00 58 8a a0 40 00     00:05:47.566  READ FPDMA QUEUED
  60 00 20 00 98 00 00 00 58 8a e0 40 00     00:05:47.565  READ FPDMA QUEUED

Error 6833 [176] occurred at disk power-on lifetime: 31506 hours (1312 days + 18 hours)
  When the command that caused the error occurred, the device was active or idle.

  After command completion occurred, registers were:
  ER -- ST COUNT  LBA_48  LH LM LL DV DC
  -- -- -- == -- == == == -- -- -- -- --
  84 -- 41 00 20 00 00 00 58 40 df 60 00  Error: ICRC, ABRT at LBA = 0x005840df = 5783775

  Commands leading to the command that caused the error were:
  CR FEATR COUNT  LBA_48  LH LM LL DV DC  Powered_Up_Time  Command/Feature_Name
  -- == -- == -- == == == -- -- -- -- --  ---------------  --------------------
  61 00 20 00 28 00 00 00 58 40 e0 40 00     00:05:46.191  WRITE FPDMA QUEUED
  61 00 20 00 20 00 00 00 58 40 c0 40 00     00:05:46.191  WRITE FPDMA QUEUED
  61 00 20 00 20 00 00 00 57 b4 c0 40 00     00:05:46.190  WRITE FPDMA QUEUED
  60 00 20 00 10 00 00 00 58 8b 00 40 00     00:05:46.190  READ FPDMA QUEUED
  60 00 20 00 e8 00 00 00 58 8a e0 40 00     00:05:46.189  READ FPDMA QUEUED

Error 6832 [175] occurred at disk power-on lifetime: 31506 hours (1312 days + 18 hours)
  When the command that caused the error occurred, the device was active or idle.

  After command completion occurred, registers were:
  ER -- ST COUNT  LBA_48  LH LM LL DV DC
  -- -- -- == -- == == == -- -- -- -- --
  84 -- 41 00 ea 00 00 00 58 a8 bf 60 00  Error: ICRC, ABRT at LBA = 0x0058a8bf = 5810367

  Commands leading to the command that caused the error were:
  CR FEATR COUNT  LBA_48  LH LM LL DV DC  Powered_Up_Time  Command/Feature_Name
  -- == -- == -- == == == -- -- -- -- --  ---------------  --------------------
  61 00 08 00 68 00 00 00 61 12 90 40 00     00:05:43.926  WRITE FPDMA QUEUED
  61 00 08 00 60 00 00 00 1f 2e 50 40 00     00:05:43.926  WRITE FPDMA QUEUED
  61 00 08 00 58 00 00 00 61 12 10 40 00     00:05:43.926  WRITE FPDMA QUEUED
  61 00 20 00 50 00 00 00 58 79 e0 40 00     00:05:43.925  WRITE FPDMA QUEUED
  61 00 08 00 48 00 00 00 61 12 90 40 00     00:05:43.923  WRITE FPDMA QUEUED

Error 6831 [174] occurred at disk power-on lifetime: 31506 hours (1312 days + 18 hours)
  When the command that caused the error occurred, the device was active or idle.

  After command completion occurred, registers were:
  ER -- ST COUNT  LBA_48  LH LM LL DV DC
  -- -- -- == -- == == == -- -- -- -- --
  84 -- 41 00 88 00 00 03 89 a0 97 63 00  Error: ICRC, ABRT at LBA = 0x0389a097 = 59351191

  Commands leading to the command that caused the error were:
  CR FEATR COUNT  LBA_48  LH LM LL DV DC  Powered_Up_Time  Command/Feature_Name
  -- == -- == -- == == == -- -- -- -- --  ---------------  --------------------
  61 00 08 00 88 00 00 03 89 a0 90 40 00     00:05:41.613  WRITE FPDMA QUEUED
  61 00 08 00 80 00 00 03 89 8b e0 40 00     00:05:41.613  WRITE FPDMA QUEUED
  61 00 08 00 78 00 00 03 89 72 68 40 00     00:05:41.613  WRITE FPDMA QUEUED
  61 00 08 00 70 00 00 03 89 2d 48 40 00     00:05:41.613  WRITE FPDMA QUEUED
  61 00 08 00 68 00 00 03 89 2c d0 40 00     00:05:41.613  WRITE FPDMA QUEUED

Error 6830 [173] occurred at disk power-on lifetime: 31506 hours (1312 days + 18 hours)
  When the command that caused the error occurred, the device was active or idle.

  After command completion occurred, registers were:
  ER -- ST COUNT  LBA_48  LH LM LL DV DC
  -- -- -- == -- == == == -- -- -- -- --
  84 -- 41 00 8a 00 00 00 2d f6 1f 60 00  Error: ICRC, ABRT at LBA = 0x002df61f = 3012127

  Commands leading to the command that caused the error were:
  CR FEATR COUNT  LBA_48  LH LM LL DV DC  Powered_Up_Time  Command/Feature_Name
  -- == -- == -- == == == -- -- -- -- --  ---------------  --------------------
  61 00 08 00 60 00 00 00 05 dc b0 40 00     00:05:32.529  WRITE FPDMA QUEUED
  61 00 08 00 58 00 00 06 09 ba e0 40 00     00:05:32.515  WRITE FPDMA QUEUED
  60 00 40 00 50 00 00 00 2e 0d 20 40 00     00:05:32.508  READ FPDMA QUEUED
  60 01 00 00 48 00 00 00 2e 0b 20 40 00     00:05:32.508  READ FPDMA QUEUED
  60 01 00 00 40 00 00 00 2e 0a 20 40 00     00:05:32.508  READ FPDMA QUEUED

SMART Extended Self-test Log Version: 1 (1 sectors)
Num  Test_Description    Status                  Remaining  LifeTime(hours)  LBA_of_first_error
# 1  Short offline       Completed without error       00%     28276         -
# 2  Short offline       Completed without error       00%     26598         -

SMART Selective self-test log data structure revision number 1
 SPAN  MIN_LBA  MAX_LBA  CURRENT_TEST_STATUS
    1        0        0  Not_testing
    2        0        0  Not_testing
    3        0        0  Not_testing
    4        0        0  Not_testing
    5        0        0  Not_testing
Selective self-test flags (0x0):
  After scanning selected spans, do NOT read-scan remainder of disk.
If Selective self-test is pending on power-up, resume after 0 minute delay.

SCT Status Version:                  2
SCT Version (vendor specific):       1 (0x0001)
Device State:                        Active (0)
Current Temperature:                    51 Celsius
Power Cycle Min/Max Temperature:     47/51 Celsius
Lifetime    Min/Max Temperature:     20/62 Celsius
Under/Over Temperature Limit Count:   0/1383

SCT Temperature History Version:     2
Temperature Sampling Period:         1 minute
Temperature Logging Interval:        1 minute
Min/Max recommended Temperature:      5/55 Celsius
Min/Max Temperature Limit:            5/55 Celsius
Temperature History Size (Index):    478 (114)

SCT Error Recovery Control:
           Read: Disabled
          Write: Disabled

Device Statistics (GP/SMART Log 0x04) not supported

Pending Defects log (GP Log 0x0c) not supported

SATA Phy Event Counters (GP Log 0x11)
ID      Size     Value  Description
0x0001  4            0  Command failed due to ICRC error
0x0002  4            0  R_ERR response for data FIS
0x0003  4            0  R_ERR response for device-to-host data FIS
0x0004  4            0  R_ERR response for host-to-device data FIS
0x0005  4            0  R_ERR response for non-data FIS
0x0006  4            0  R_ERR response for device-to-host non-data FIS
0x0007  4            0  R_ERR response for host-to-device non-data FIS
0x0008  4            0  Device-to-host non-data FIS retries
0x0009  4        16256  Transition from drive PhyRdy to drive PhyNRdy
0x000a  4           18  Device-to-host register FISes sent due to a COMRESET
0x000b  4            0  CRC errors within host-to-device FIS
0x000d  4            0  Non-CRC errors within host-to-device FIS
0x000f  4            0  R_ERR response for host-to-device data FIS, CRC
0x0010  4            0  R_ERR response for host-to-device data FIS, non-CRC
0x0012  4            0  R_ERR response for host-to-device non-data FIS, CRC
0x0013  4            0  R_ERR response for host-to-device non-data FIS, non-CRC

