smartctl 7.5 2025-04-30 r5714 [x86_64-linux-6.15.5-arch1-1] (local build)
Copyright (C) 2002-25, Bruce Allen, Christian Franke, www.smartmontools.org

=== START OF INFORMATION SECTION ===
Model Number:                       Samsung SSD 990 PRO 1TB
Serial Number:                      --
Firmware Version:                   4B2QJXD7
PCI Vendor/Subsystem ID:            0x144d
IEEE OUI Identifier:                0x002538
Total NVM Capacity:                 1,000,204,886,016 [1.00 TB]
Unallocated NVM Capacity:           0
Controller ID:                      1
NVMe Version:                       2.0
Number of Namespaces:               1
Namespace 1 Size/Capacity:          1,000,204,886,016 [1.00 TB]
Namespace 1 Utilization:            70,769,119,232 [70.7 GB]
Namespace 1 Formatted LBA Size:     512
Namespace 1 IEEE EUI-64:            002538 ...
Local Time is:                      Sun Jul 13 17:06:54 2025 EDT
Firmware Updates (0x16):            3 Slots, no Reset required
Optional Admin Commands (0x0017):   Security Format Frmw_DL Self_Test
Optional NVM Commands (0x0055):     Comp DS_Mngmt Sav/Sel_Feat Timestmp
Log Page Attributes (0x2f):         S/H_per_NS Cmd_Eff_Lg Ext_Get_Lg Telmtry_Lg Log0_FISE_MI
Maximum Data Transfer Size:         512 Pages
Warning  Comp. Temp. Threshold:     82 Celsius
Critical Comp. Temp. Threshold:     85 Celsius

Supported Power States
St Op     Max   Active     Idle   RL RT WL WT  Ent_Lat  Ex_Lat
 0 +     9.39W       -        -    0  0  0  0        0       0
 1 +     9.39W       -        -    1  1  1  1        0       0
 2 +     9.39W       -        -    2  2  2  2        0       0
 3 -   0.0400W       -        -    3  3  3  3     4200    6800
 4 -   0.0050W       -        -    4  4  4  4     2700   21800

Supported LBA Sizes (NSID 0x1)
Id Fmt  Data  Metadt  Rel_Perf
 0 +     512       0         0

=== START OF SMART DATA SECTION ===
SMART overall-health self-assessment test result: PASSED

SMART/Health Information (NVMe Log 0x02, NSID 0x1)
Critical Warning:                   0x00
Temperature:                        36 Celsius
Available Spare:                    100%
Available Spare Threshold:          10%
Percentage Used:                    1%
Data Units Read:                    7,992,060 [4.09 TB]
Data Units Written:                 6,903,790 [3.53 TB]
Host Read Commands:                 66,754,125
Host Write Commands:                176,532,299
Controller Busy Time:               795
Power Cycles:                       96
Power On Hours:                     2,957
Unsafe Shutdowns:                   26
Media and Data Integrity Errors:    0
Error Information Log Entries:      0
Warning  Comp. Temperature Time:    0
Critical Comp. Temperature Time:    0
Temperature Sensor 1:               36 Celsius
Temperature Sensor 2:               42 Celsius

Error Information (NVMe Log 0x01, 16 of 64 entries)
No Errors Logged

Self-test Log (NVMe Log 0x06, NSID 0xffffffff)
Self-test status: No self-test in progress
No Self-tests Logged

