smartctl 7.3 2022-02-28 r5338 [x86_64-linux-5.10.118-generic-2rosa2021.1-x86_64] (local build)
Copyright (C) 2002-22, Bruce Allen, Christian Franke, www.smartmontools.org

=== START OF INFORMATION SECTION ===
Device Model:     SPCC Solid State Disk
Serial Number:    --
LU WWN Device Id: 5 000000 ...
Firmware Version: H190117H
User Capacity:    128,035,676,160 bytes [128 GB]
Sector Size:      512 bytes logical/physical
Rotation Rate:    Solid State Device
Form Factor:      2.5 inches
TRIM Command:     Available, deterministic, zeroed
Device is:        Not in smartctl database 7.3/5319
ATA Version is:   ACS-2 (minor revision not indicated)
SATA Version is:  SATA 3.2, 6.0 Gb/s (current: 3.0 Gb/s)
Local Time is:    Tue Sep 13 18:42:41 2022 MSK
SMART support is: Available - device has SMART capability.
SMART support is: Enabled
AAM feature is:   Unavailable
APM feature is:   Unavailable
Rd look-ahead is: Enabled
Write cache is:   Enabled
DSN feature is:   Unavailable
ATA Security is:  Disabled, NOT FROZEN [SEC1]
Wt Cache Reorder: Enabled

=== START OF READ SMART DATA SECTION ===
SMART overall-health self-assessment test result: PASSED

General SMART Values:
Offline data collection status:  (0x00)	Offline data collection activity
					was never started.
					Auto Offline Data Collection: Disabled.
Self-test execution status:      (   0)	The previous self-test routine completed
					without error or no self-test has ever 
					been run.
Total time to complete Offline 
data collection: 		(   33) seconds.
Offline data collection
capabilities: 			 (0x7b) SMART execute Offline immediate.
					Auto Offline data collection on/off support.
					Suspend Offline collection upon new
					command.
					Offline surface scan supported.
					Self-test supported.
					Conveyance Self-test supported.
					Selective Self-test supported.
SMART capabilities:            (0x0003)	Saves SMART data before entering
					power-saving mode.
					Supports SMART auto save timer.
Error logging capability:        (0x01)	Error logging supported.
					General Purpose Logging supported.
Short self-test routine 
recommended polling time: 	 (   2) minutes.
Extended self-test routine
recommended polling time: 	 (   2) minutes.
Conveyance self-test routine
recommended polling time: 	 (   2) minutes.
SCT capabilities: 	       (0x0031)	SCT Status supported.
					SCT Feature Control supported.
					SCT Data Table supported.

SMART Attributes Data Structure revision number: 16
Vendor Specific SMART Attributes with Thresholds:
ID# ATTRIBUTE_NAME          FLAGS    VALUE WORST THRESH FAIL RAW_VALUE
  5 Reallocated_Sector_Ct   PO--C-   100   100   050    -    0
  9 Power_On_Hours          -O--C-   100   100   000    -    5455
 12 Power_Cycle_Count       -O--C-   100   100   000    -    1458
167 Unknown_Attribute       -O---K   100   100   000    -    0
168 Unknown_Attribute       -O--C-   100   100   000    -    6
169 Unknown_Attribute       PO--C-   096   096   010    -    3670030
171 Unknown_Attribute       -O--CK   000   000   000    -    0
172 Unknown_Attribute       -O--CK   000   000   000    -    0
173 Unknown_Attribute       -O--C-   200   200   000    -    549767151774
175 Program_Fail_Count_Chip -O---K   100   100   010    -    0
177 Wear_Leveling_Count     -O--C-   100   100   000    -    0
180 Unused_Rsvd_Blk_Cnt_Tot PO--CK   100   100   000    -    1644
187 Reported_Uncorrect      -O--CK   100   000   000    -    0
192 Power-Off_Retract_Count -O--C-   100   100   000    -    103
194 Temperature_Celsius     -O---K   048   048   000    -    48 (Min/Max 48/48)
199 UDMA_CRC_Error_Count    -O--C-   100   100   000    -    0
206 Unknown_SSD_Attribute   -O--CK   200   200   000    -    128
207 Unknown_SSD_Attribute   -O--CK   200   200   000    -    173
208 Unknown_SSD_Attribute   -O--CK   200   200   000    -    158
209 Unknown_SSD_Attribute   -O--CK   200   200   000    -    1465
210 Unknown_Attribute       -O--CK   200   200   000    -    2727
211 Unknown_Attribute       -O--CK   200   200   000    -    2150
231 Unknown_SSD_Attribute   PO---K   090   090   005    -    10
241 Total_LBAs_Written      -O--CK   100   100   000    -    9032
242 Total_LBAs_Read         -O--CK   100   100   000    -    11931
245 Unknown_Attribute       -O--CK   100   100   000    -    0
                            ||||||_ K auto-keep
                            |||||__ C event count
                            ||||___ R error rate
                            |||____ S speed/performance
                            ||_____ O updated online
                            |______ P prefailure warning

General Purpose Log Directory Version 1
SMART           Log Directory Version 1 [multi-sector log support]
Address    Access  R/W   Size  Description
0x00       GPL,SL  R/O      1  Log Directory
0x01           SL  R/O      1  Summary SMART error log
0x02           SL  R/O     51  Comprehensive SMART error log
0x03       GPL     R/O     64  Ext. Comprehensive SMART error log
0x04       GPL,SL  R/O      8  Device Statistics log
0x06           SL  R/O      1  SMART self-test log
0x07       GPL     R/O      1  Extended self-test log
0x09           SL  R/W      1  Selective self-test log
0x10       GPL     R/O      1  NCQ Command Error log
0x11       GPL     R/O      1  SATA Phy Event Counters log
0x30       GPL,SL  R/O      9  IDENTIFY DEVICE data log
0x80-0x9f  GPL,SL  R/W     16  Host vendor specific log
0xe0       GPL,SL  R/W      1  SCT Command/Status
0xe1       GPL,SL  R/W      1  SCT Data Transfer

SMART Extended Comprehensive Error Log Version: 1 (64 sectors)
Device Error Count: 6
	CR     = Command Register
	FEATR  = Features Register
	COUNT  = Count (was: Sector Count) Register
	LBA_48 = Upper bytes of LBA High/Mid/Low Registers ]  ATA-8
	LH     = LBA High (was: Cylinder High) Register    ]   LBA
	LM     = LBA Mid (was: Cylinder Low) Register      ] Register
	LL     = LBA Low (was: Sector Number) Register     ]
	DV     = Device (was: Device/Head) Register
	DC     = Device Control Register
	ER     = Error register
	ST     = Status register
Powered_Up_Time is measured from power on, and printed as
DDd+hh:mm:SS.sss where DD=days, hh=hours, mm=minutes,
SS=sec, and sss=millisec. It "wraps" after 49.710 days.

Error 6 [5] occurred at disk power-on lifetime: 5447 hours (226 days + 23 hours)
  When the command that caused the error occurred, the device was in an unknown state.

  After command completion occurred, registers were:
  ER -- ST COUNT  LBA_48  LH LM LL DV DC
  -- -- -- == -- == == == -- -- -- -- --
  84 -- 41 00 68 00 00 00 64 b1 40 40 00  Error: ABRT

  Commands leading to the command that caused the error were:
  CR FEATR COUNT  LBA_48  LH LM LL DV DC  Powered_Up_Time  Command/Feature_Name
  -- == -- == -- == == == -- -- -- -- --  ---------------  --------------------
  ef 00 02 00 00 00 00 00 00 00 00 a0 80     00:00:44.800  SET FEATURES [Enable write cache]
  ef 00 02 00 00 00 00 00 00 00 00 a0 ff     00:00:44.800  SET FEATURES [Enable write cache]
  ef 00 02 00 00 00 00 00 00 00 00 a0 80     00:00:43.700  SET FEATURES [Enable write cache]
  ea 00 00 00 00 00 00 00 00 00 00 a0 ff     00:00:43.700  FLUSH CACHE EXT
  ef 00 02 00 00 00 00 00 00 00 00 a0 80     00:00:43.300  SET FEATURES [Enable write cache]

Error 5 [4] occurred at disk power-on lifetime: 5447 hours (226 days + 23 hours)
  When the command that caused the error occurred, the device was in an unknown state.

  After command completion occurred, registers were:
  ER -- ST COUNT  LBA_48  LH LM LL DV DC
  -- -- -- == -- == == == -- -- -- -- --
  84 -- 41 00 f8 00 00 03 f5 fb 56 40 00

  Commands leading to the command that caused the error were:
  CR FEATR COUNT  LBA_48  LH LM LL DV DC  Powered_Up_Time  Command/Feature_Name
  -- == -- == -- == == == -- -- -- -- --  ---------------  --------------------
  ea 00 00 00 00 00 00 00 00 00 00 a0 80     00:00:38.200  FLUSH CACHE EXT
  ef 00 02 00 00 00 00 00 00 00 00 a0 80     00:00:38.100  SET FEATURES [Enable write cache]
  ea 00 00 00 00 00 00 00 00 00 00 a0 ff     00:00:38.100  FLUSH CACHE EXT
  ef 00 02 00 00 00 00 00 00 00 00 a0 80     00:00:38.000  SET FEATURES [Enable write cache]
  ea 00 00 00 00 00 00 00 00 00 00 a0 ff     00:00:38.000  FLUSH CACHE EXT

Error 4 [3] occurred at disk power-on lifetime: 5447 hours (226 days + 23 hours)
  When the command that caused the error occurred, the device was in an unknown state.

  After command completion occurred, registers were:
  ER -- ST COUNT  LBA_48  LH LM LL DV DC
  -- -- -- == -- == == == -- -- -- -- --
  84 -- 41 00 d0 00 00 03 e5 5c 2f 40 00

  Commands leading to the command that caused the error were:
  CR FEATR COUNT  LBA_48  LH LM LL DV DC  Powered_Up_Time  Command/Feature_Name
  -- == -- == -- == == == -- -- -- -- --  ---------------  --------------------
  ea 00 00 00 00 00 00 00 00 00 00 a0 80     00:00:36.000  FLUSH CACHE EXT
  ea 00 00 00 00 00 00 00 00 00 00 a0 80     00:00:36.000  FLUSH CACHE EXT
  ea 00 00 00 00 00 00 00 00 00 00 a0 80     00:00:36.000  FLUSH CACHE EXT
  ea 00 00 00 00 00 00 00 00 00 00 a0 80     00:00:36.000  FLUSH CACHE EXT
  ea 00 00 00 00 00 00 00 00 00 00 a0 80     00:00:36.000  FLUSH CACHE EXT

Error 3 [2] occurred at disk power-on lifetime: 5447 hours (226 days + 23 hours)
  When the command that caused the error occurred, the device was in an unknown state.

  After command completion occurred, registers were:
  ER -- ST COUNT  LBA_48  LH LM LL DV DC
  -- -- -- == -- == == == -- -- -- -- --
  84 -- 51 00 3f 00 00 00 00 00 00 60 00  Error: ICRC, ABRT 63 sectors at LBA = 0x00000000 = 0

  Commands leading to the command that caused the error were:
  CR FEATR COUNT  LBA_48  LH LM LL DV DC  Powered_Up_Time  Command/Feature_Name
  -- == -- == -- == == == -- -- -- -- --  ---------------  --------------------
  25 00 00 00 3f 00 00 00 00 00 00 60 80     00:00:21.000  READ DMA EXT
  25 00 00 00 33 00 00 08 c1 98 0d 60 ff     00:00:20.800  READ DMA EXT
  25 00 00 00 0d 00 00 08 c1 98 00 60 ff     00:00:20.700  READ DMA EXT
  25 00 00 00 35 00 00 08 c2 b9 40 60 80     00:00:20.600  READ DMA EXT
  25 00 00 00 3a 00 00 08 c1 b9 46 60 80     00:00:20.600  READ DMA EXT

Error 2 [1] occurred at disk power-on lifetime: 5447 hours (226 days + 23 hours)
  When the command that caused the error occurred, the device was in an unknown state.

  After command completion occurred, registers were:
  ER -- ST COUNT  LBA_48  LH LM LL DV DC
  -- -- -- == -- == == == -- -- -- -- --
  84 -- 41 00 a0 00 00 03 ec 42 92 40 00

  Commands leading to the command that caused the error were:
  CR FEATR COUNT  LBA_48  LH LM LL DV DC  Powered_Up_Time  Command/Feature_Name
  -- == -- == -- == == == -- -- -- -- --  ---------------  --------------------
  ea 00 00 00 00 00 00 00 00 00 00 a0 80     00:02:02.800  FLUSH CACHE EXT
  ef 00 02 00 00 00 00 00 00 00 00 a0 80     00:02:02.700  SET FEATURES [Enable write cache]
  ef 00 02 00 00 00 00 00 00 00 00 a0 ff     00:02:02.700  SET FEATURES [Enable write cache]
  ef 00 02 00 00 00 00 00 00 00 00 a0 80     00:02:01.800  SET FEATURES [Enable write cache]
  ea 00 00 00 00 00 00 00 00 00 00 a0 ff     00:02:01.700  FLUSH CACHE EXT

Error 1 [0] occurred at disk power-on lifetime: 5447 hours (226 days + 23 hours)
  When the command that caused the error occurred, the device was in an unknown state.

  After command completion occurred, registers were:
  ER -- ST COUNT  LBA_48  LH LM LL DV DC
  -- -- -- == -- == == == -- -- -- -- --
  84 -- 41 00 38 00 00 03 f9 f9 22 40 00  Error: ABRT

  Commands leading to the command that caused the error were:
  CR FEATR COUNT  LBA_48  LH LM LL DV DC  Powered_Up_Time  Command/Feature_Name
  -- == -- == -- == == == -- -- -- -- --  ---------------  --------------------
  ef 00 02 00 00 00 00 00 00 00 00 a0 80     00:02:01.800  SET FEATURES [Enable write cache]
  ea 00 00 00 00 00 00 00 00 00 00 a0 ff     00:02:01.700  FLUSH CACHE EXT
  ea 00 00 00 00 00 00 00 00 00 00 a0 80     00:02:01.600  FLUSH CACHE EXT
  ef 00 02 00 00 00 00 00 00 00 00 a0 80     00:02:00.600  SET FEATURES [Enable write cache]
  ef 00 02 00 00 00 00 00 00 00 00 a0 ff     00:02:00.600  SET FEATURES [Enable write cache]

SMART Extended Self-test Log Version: 1 (1 sectors)
Num  Test_Description    Status                  Remaining  LifeTime(hours)  LBA_of_first_error
# 1  Short offline       Interrupted (host reset)      00%      4141         -
# 2  Short offline       Interrupted (host reset)      00%      4089         -
# 3  Short offline       Interrupted (host reset)      00%      4067         -

SMART Selective self-test log data structure revision number 1
 SPAN  MIN_LBA  MAX_LBA  CURRENT_TEST_STATUS
    1        0        0  Not_testing
    2        0        0  Not_testing
    3        0        0  Not_testing
    4        0        0  Not_testing
    5        0        0  Not_testing
Selective self-test flags (0x0):
  After scanning selected spans, do NOT read-scan remainder of disk.
If Selective self-test is pending on power-up, resume after 0 minute delay.

SCT Status Version:                  3
SCT Version (vendor specific):       1 (0x0001)
Device State:                        Active (0)
Current Temperature:                    48 Celsius
Power Cycle Min/Max Temperature:      ?/48 Celsius
Lifetime    Min/Max Temperature:      ?/ ? Celsius
Under/Over Temperature Limit Count:   0/0

SCT Temperature History Version:     2
Temperature Sampling Period:         1 minute
Temperature Logging Interval:        1 minute
Min/Max recommended Temperature:     -127/127 Celsius
Min/Max Temperature Limit:           -127/127 Celsius
Temperature History Size (Index):    478 (235)

SCT Error Recovery Control command not supported

Device Statistics (GP Log 0x04)
Page  Offset Size        Value Flags Description
0x01  =====  =               =  ===  == General Statistics (rev 1) ==
0x01  0x008  4            1458  ---  Lifetime Power-On Resets
0x01  0x010  4            5455  ---  Power-on Hours
0x01  0x018  6     18941879678  ---  Logical Sectors Written
0x01  0x020  6       296686089  ---  Number of Write Commands
0x01  0x028  6     25022360984  ---  Logical Sectors Read
0x01  0x030  6       384064011  ---  Number of Read Commands
0x01  0x038  6   5027569804836  ---  Date and Time TimeStamp
0x07  =====  =               =  ===  == Solid State Device Statistics (rev 1) ==
0x07  0x008  1              23  N--  Percentage Used Endurance Indicator
                                |||_ C monitored condition met
                                ||__ D supports DSN
                                |___ N normalized value

Pending Defects log (GP Log 0x0c) not supported

SATA Phy Event Counters (GP Log 0x11)
ID      Size     Value  Description
0x0001  2            6  Command failed due to ICRC error
0x0003  2            0  R_ERR response for device-to-host data FIS
0x0004  2            0  R_ERR response for host-to-device data FIS
0x0006  2            0  R_ERR response for device-to-host non-data FIS
0x0007  2            0  R_ERR response for host-to-device non-data FIS
0x0008  2            0  Device-to-host non-data FIS retries
0x0009  4            0  Transition from drive PhyRdy to drive PhyNRdy
0x000a  4           15  Device-to-host register FISes sent due to a COMRESET
0x000f  2            0  R_ERR response for host-to-device data FIS, CRC
0x0010  2            0  R_ERR response for host-to-device data FIS, non-CRC
0x0012  2            0  R_ERR response for host-to-device non-data FIS, CRC
0x0013  2            0  R_ERR response for host-to-device non-data FIS, non-CRC

