smartctl 7.2 2020-12-30 r5155 [x86_64-linux-5.11.0-36-generic] (local build)
Copyright (C) 2002-20, Bruce Allen, Christian Franke, www.smartmontools.org

=== START OF INFORMATION SECTION ===
Model Family:     Western Digital Caviar Green
Device Model:     WDC WD10EADS-65M2B1
Serial Number:    --
LU WWN Device Id: 5 0014ee ...
Firmware Version: 01.00A01
User Capacity:    1,000,204,886,016 bytes [1.00 TB]
Sector Size:      512 bytes logical/physical
Device is:        In smartctl database [for details use: -P show]
ATA Version is:   ATA8-ACS (minor revision not indicated)
SATA Version is:  SATA 2.6, 3.0 Gb/s
Local Time is:    Thu Sep 23 23:22:47 2021 AEST
SMART support is: Available - device has SMART capability.
SMART support is: Enabled
AAM level is:     254 (maximum performance), recommended: 128
APM feature is:   Unavailable
Rd look-ahead is: Enabled
Write cache is:   Enabled
DSN feature is:   Unavailable
ATA Security is:  Unavailable
Wt Cache Reorder: Enabled

=== START OF READ SMART DATA SECTION ===
SMART overall-health self-assessment test result: PASSED

General SMART Values:
Offline data collection status:  (0x82)	Offline data collection activity
					was completed without error.
					Auto Offline Data Collection: Enabled.
Self-test execution status:      (   0)	The previous self-test routine completed
					without error or no self-test has ever 
					been run.
Total time to complete Offline 
data collection: 		(19560) seconds.
Offline data collection
capabilities: 			 (0x7b) SMART execute Offline immediate.
					Auto Offline data collection on/off support.
					Suspend Offline collection upon new
					command.
					Offline surface scan supported.
					Self-test supported.
					Conveyance Self-test supported.
					Selective Self-test supported.
SMART capabilities:            (0x0003)	Saves SMART data before entering
					power-saving mode.
					Supports SMART auto save timer.
Error logging capability:        (0x01)	Error logging supported.
					General Purpose Logging supported.
Short self-test routine 
recommended polling time: 	 (   2) minutes.
Extended self-test routine
recommended polling time: 	 ( 226) minutes.
Conveyance self-test routine
recommended polling time: 	 (   5) minutes.
SCT capabilities: 	       (0x3037)	SCT Status supported.
					SCT Feature Control supported.
					SCT Data Table supported.

SMART Attributes Data Structure revision number: 16
Vendor Specific SMART Attributes with Thresholds:
ID# ATTRIBUTE_NAME          FLAGS    VALUE WORST THRESH FAIL RAW_VALUE
  1 Raw_Read_Error_Rate     POSR-K   200   200   051    -    603
  3 Spin_Up_Time            POS--K   115   108   021    -    7241
  4 Start_Stop_Count        -O--CK   092   092   000    -    8550
  5 Reallocated_Sector_Ct   PO--CK   199   199   140    -    1
  7 Seek_Error_Rate         -OSR-K   100   253   000    -    0
  9 Power_On_Hours          -O--CK   062   062   000    -    28174
 10 Spin_Retry_Count        -O--CK   100   100   000    -    0
 11 Calibration_Retry_Count -O--CK   100   100   000    -    0
 12 Power_Cycle_Count       -O--CK   098   098   000    -    2058
192 Power-Off_Retract_Count -O--CK   199   199   000    -    1032
193 Load_Cycle_Count        -O--CK   056   056   000    -    434882
194 Temperature_Celsius     -O---K   111   090   000    -    36
196 Reallocated_Event_Count -O--CK   199   199   000    -    1
197 Current_Pending_Sector  -O--CK   200   200   000    -    10
198 Offline_Uncorrectable   ----CK   200   200   000    -    7
199 UDMA_CRC_Error_Count    -O--CK   200   200   000    -    0
200 Multi_Zone_Error_Rate   ---R--   200   200   000    -    10
                            ||||||_ K auto-keep
                            |||||__ C event count
                            ||||___ R error rate
                            |||____ S speed/performance
                            ||_____ O updated online
                            |______ P prefailure warning

General Purpose Log Directory Version 1
SMART           Log Directory Version 1 [multi-sector log support]
Address    Access  R/W   Size  Description
0x00       GPL,SL  R/O      1  Log Directory
0x01           SL  R/O      1  Summary SMART error log
0x02           SL  R/O      5  Comprehensive SMART error log
0x03       GPL     R/O      6  Ext. Comprehensive SMART error log
0x06           SL  R/O      1  SMART self-test log
0x07       GPL     R/O      1  Extended self-test log
0x09           SL  R/W      1  Selective self-test log
0x10       GPL     R/O      1  NCQ Command Error log
0x11       GPL     R/O      1  SATA Phy Event Counters log
0x80-0x9f  GPL,SL  R/W     16  Host vendor specific log
0xa0-0xa7  GPL,SL  VS      16  Device vendor specific log
0xa8-0xb7  GPL,SL  VS       1  Device vendor specific log
0xc0       GPL,SL  VS       1  Device vendor specific log
0xc1       GPL     VS      24  Device vendor specific log
0xe0       GPL,SL  R/W      1  SCT Command/Status
0xe1       GPL,SL  R/W      1  SCT Data Transfer

SMART Extended Comprehensive Error Log Version: 1 (6 sectors)
Device Error Count: 1903 (device log contains only the most recent 24 errors)
	CR     = Command Register
	FEATR  = Features Register
	COUNT  = Count (was: Sector Count) Register
	LBA_48 = Upper bytes of LBA High/Mid/Low Registers ]  ATA-8
	LH     = LBA High (was: Cylinder High) Register    ]   LBA
	LM     = LBA Mid (was: Cylinder Low) Register      ] Register
	LL     = LBA Low (was: Sector Number) Register     ]
	DV     = Device (was: Device/Head) Register
	DC     = Device Control Register
	ER     = Error register
	ST     = Status register
Powered_Up_Time is measured from power on, and printed as
DDd+hh:mm:SS.sss where DD=days, hh=hours, mm=minutes,
SS=sec, and sss=millisec. It "wraps" after 49.710 days.

Error 1903 [6] occurred at disk power-on lifetime: 28172 hours (1173 days + 20 hours)
  When the command that caused the error occurred, the device was active or idle.

  After command completion occurred, registers were:
  ER -- ST COUNT  LBA_48  LH LM LL DV DC
  -- -- -- == -- == == == -- -- -- -- --
  40 -- 51 00 40 00 11 00 2d 00 02 40 00  Error: UNC at LBA = 0x11002d0002 = 73017393154

  Commands leading to the command that caused the error were:
  CR FEATR COUNT  LBA_48  LH LM LL DV DC  Powered_Up_Time  Command/Feature_Name
  -- == -- == -- == == == -- -- -- -- --  ---------------  --------------------
  60 00 68 00 50 00 11 00 33 00 88 40 00 36d+10:02:04.269  READ FPDMA QUEUED
  60 00 40 00 48 00 11 00 2d 00 00 40 00 36d+10:02:04.267  READ FPDMA QUEUED
  60 00 08 00 40 00 11 00 2c 00 d8 40 00 36d+10:02:04.266  READ FPDMA QUEUED
  60 00 38 00 38 00 11 00 2b 00 20 40 00 36d+10:02:04.263  READ FPDMA QUEUED
  60 00 28 00 30 00 11 00 29 00 f0 40 00 36d+10:02:04.260  READ FPDMA QUEUED

Error 1902 [5] occurred at disk power-on lifetime: 20443 hours (851 days + 19 hours)
  When the command that caused the error occurred, the device was active or idle.

  After command completion occurred, registers were:
  ER -- ST COUNT  LBA_48  LH LM LL DV DC
  -- -- -- == -- == == == -- -- -- -- --
  40 -- 51 00 08 00 11 00 2d 00 00 e0 00  Error: UNC 8 sectors at LBA = 0x11002d0000 = 73017393152

  Commands leading to the command that caused the error were:
  CR FEATR COUNT  LBA_48  LH LM LL DV DC  Powered_Up_Time  Command/Feature_Name
  -- == -- == -- == == == -- -- -- -- --  ---------------  --------------------
  25 00 00 00 08 00 11 00 2d 00 00 e0 00     00:01:32.729  READ DMA EXT
  25 00 00 00 10 00 64 00 0e 18 60 e0 00     00:01:32.719  READ DMA EXT
  25 00 00 00 18 00 b1 00 00 03 90 e0 00     00:01:32.706  READ DMA EXT
  35 00 00 00 08 00 6f 00 b2 00 b0 e0 00     00:01:32.706  WRITE DMA EXT
  25 00 00 00 18 00 38 00 60 00 b8 e0 00     00:01:32.706  READ DMA EXT

Error 1901 [4] occurred at disk power-on lifetime: 20443 hours (851 days + 19 hours)
  When the command that caused the error occurred, the device was active or idle.

  After command completion occurred, registers were:
  ER -- ST COUNT  LBA_48  LH LM LL DV DC
  -- -- -- == -- == == == -- -- -- -- --
  40 -- 51 00 08 00 11 00 2d 00 00 e0 00  Error: UNC 8 sectors at LBA = 0x11002d0000 = 73017393152

  Commands leading to the command that caused the error were:
  CR FEATR COUNT  LBA_48  LH LM LL DV DC  Powered_Up_Time  Command/Feature_Name
  -- == -- == -- == == == -- -- -- -- --  ---------------  --------------------
  25 00 00 00 08 00 11 00 2d 00 00 e0 00     00:01:30.307  READ DMA EXT
  25 00 00 00 08 00 96 00 de 3c 78 e0 00     00:01:30.299  READ DMA EXT
  25 00 00 00 08 00 4c 00 04 27 68 e0 00     00:01:30.279  READ DMA EXT
  25 00 00 00 08 00 3c 00 b5 27 c8 e0 00     00:01:30.279  READ DMA EXT
  25 00 00 00 20 00 64 00 10 18 58 e0 00     00:01:30.267  READ DMA EXT

Error 1900 [3] occurred at disk power-on lifetime: 20443 hours (851 days + 19 hours)
  When the command that caused the error occurred, the device was active or idle.

  After command completion occurred, registers were:
  ER -- ST COUNT  LBA_48  LH LM LL DV DC
  -- -- -- == -- == == == -- -- -- -- --
  40 -- 51 00 08 00 11 00 2d 00 00 e0 00  Error: UNC 8 sectors at LBA = 0x11002d0000 = 73017393152

  Commands leading to the command that caused the error were:
  CR FEATR COUNT  LBA_48  LH LM LL DV DC  Powered_Up_Time  Command/Feature_Name
  -- == -- == -- == == == -- -- -- -- --  ---------------  --------------------
  25 00 00 00 08 00 11 00 2d 00 00 e0 00     00:01:27.834  READ DMA EXT
  35 00 00 00 08 00 10 00 f4 00 30 e0 00     00:01:27.834  WRITE DMA EXT
  35 00 00 00 08 00 10 00 2b 00 80 e0 00     00:01:27.833  WRITE DMA EXT
  25 00 00 00 08 00 4c 00 35 27 88 e0 00     00:01:27.823  READ DMA EXT
  25 00 00 00 08 00 39 00 61 27 30 e0 00     00:01:27.814  READ DMA EXT

Error 1899 [2] occurred at disk power-on lifetime: 20443 hours (851 days + 19 hours)
  When the command that caused the error occurred, the device was active or idle.

  After command completion occurred, registers were:
  ER -- ST COUNT  LBA_48  LH LM LL DV DC
  -- -- -- == -- == == == -- -- -- -- --
  40 -- 51 00 40 00 11 00 2d 00 00 e0 00  Error: UNC 64 sectors at LBA = 0x11002d0000 = 73017393152

  Commands leading to the command that caused the error were:
  CR FEATR COUNT  LBA_48  LH LM LL DV DC  Powered_Up_Time  Command/Feature_Name
  -- == -- == -- == == == -- -- -- -- --  ---------------  --------------------
  25 00 00 00 40 00 11 00 2d 00 00 e0 00     00:01:25.387  READ DMA EXT
  25 00 00 00 08 00 36 00 cc 27 b0 e0 00     00:01:25.371  READ DMA EXT
  25 00 00 00 30 00 64 00 0e 18 e8 e0 00     00:01:25.355  READ DMA EXT
  25 00 00 00 30 00 d4 00 22 0b 18 e0 00     00:01:25.339  READ DMA EXT
  25 00 00 00 30 00 b1 00 02 03 a8 e0 00     00:01:25.339  READ DMA EXT

Error 1898 [1] occurred at disk power-on lifetime: 20443 hours (851 days + 19 hours)
  When the command that caused the error occurred, the device was active or idle.

  After command completion occurred, registers were:
  ER -- ST COUNT  LBA_48  LH LM LL DV DC
  -- -- -- == -- == == == -- -- -- -- --
  40 -- 51 00 40 00 11 00 2d 00 00 e0 00  Error: UNC 64 sectors at LBA = 0x11002d0000 = 73017393152

  Commands leading to the command that caused the error were:
  CR FEATR COUNT  LBA_48  LH LM LL DV DC  Powered_Up_Time  Command/Feature_Name
  -- == -- == -- == == == -- -- -- -- --  ---------------  --------------------
  25 00 00 00 40 00 11 00 2d 00 00 e0 00     00:00:38.778  READ DMA EXT
  25 00 00 00 08 00 11 00 2c 00 d8 e0 00     00:00:38.777  READ DMA EXT
  25 00 00 00 38 00 11 00 2b 00 20 e0 00     00:00:38.775  READ DMA EXT
  25 00 00 00 28 00 11 00 29 00 f0 e0 00     00:00:38.772  READ DMA EXT
  25 00 00 00 08 00 11 00 1d 00 c0 e0 00     00:00:38.770  READ DMA EXT

Error 1897 [0] occurred at disk power-on lifetime: 17875 hours (744 days + 19 hours)
  When the command that caused the error occurred, the device was active or idle.

  After command completion occurred, registers were:
  ER -- ST COUNT  LBA_48  LH LM LL DV DC
  -- -- -- == -- == == == -- -- -- -- --
  40 -- 51 01 00 00 cd 00 b0 4d f0 e0 00  Error: UNC 256 sectors at LBA = 0xcd00b04df0 = 880479849968

  Commands leading to the command that caused the error were:
  CR FEATR COUNT  LBA_48  LH LM LL DV DC  Powered_Up_Time  Command/Feature_Name
  -- == -- == -- == == == -- -- -- -- --  ---------------  --------------------
  25 00 00 01 00 00 cd 00 b0 4d f0 e0 00  1d+14:57:42.485  READ DMA EXT
  25 00 00 01 00 00 cd 00 af 4d f0 e0 00  1d+14:57:42.484  READ DMA EXT
  25 00 00 01 00 00 cd 00 ae 4d f0 e0 00  1d+14:57:42.481  READ DMA EXT
  25 00 00 01 00 00 cd 00 ad 4d f0 e0 00  1d+14:57:42.480  READ DMA EXT
  25 00 00 01 00 00 cd 00 ac 4d f0 e0 00  1d+14:57:42.479  READ DMA EXT

Error 1896 [23] occurred at disk power-on lifetime: 17610 hours (733 days + 18 hours)
  When the command that caused the error occurred, the device was active or idle.

  After command completion occurred, registers were:
  ER -- ST COUNT  LBA_48  LH LM LL DV DC
  -- -- -- == -- == == == -- -- -- -- --
  40 -- 51 00 01 00 91 00 a7 3c d9 e0 00  Error: UNC 1 sectors at LBA = 0x9100a73cd9 = 622781218009

  Commands leading to the command that caused the error were:
  CR FEATR COUNT  LBA_48  LH LM LL DV DC  Powered_Up_Time  Command/Feature_Name
  -- == -- == -- == == == -- -- -- -- --  ---------------  --------------------
  25 00 00 00 01 00 91 00 a7 3c d9 e0 00     00:18:50.719  READ DMA EXT
  25 00 00 00 01 00 91 00 a7 3c d8 e0 00     00:18:50.719  READ DMA EXT
  25 00 00 00 01 00 91 00 a7 3c d7 e0 00     00:18:50.719  READ DMA EXT
  25 00 00 00 01 00 91 00 a7 3c d6 e0 00     00:18:50.718  READ DMA EXT
  25 00 00 00 01 00 91 00 a7 3c d5 e0 00     00:18:50.718  READ DMA EXT

SMART Extended Self-test Log Version: 1 (1 sectors)
No self-tests have been logged.  [To run self-tests, use: smartctl -t]

SMART Selective self-test log data structure revision number 1
 SPAN  MIN_LBA  MAX_LBA  CURRENT_TEST_STATUS
    1        0        0  Not_testing
    2        0        0  Not_testing
    3        0        0  Not_testing
    4        0        0  Not_testing
    5        0        0  Not_testing
Selective self-test flags (0x0):
  After scanning selected spans, do NOT read-scan remainder of disk.
If Selective self-test is pending on power-up, resume after 0 minute delay.

SCT Status Version:                  2
SCT Version (vendor specific):       258 (0x0102)
Device State:                        Active (0)
Current Temperature:                    36 Celsius
Power Cycle Min/Max Temperature:     20/44 Celsius
Lifetime    Min/Max Temperature:     36/57 Celsius
Under/Over Temperature Limit Count:   0/0

SCT Temperature History Version:     2
Temperature Sampling Period:         1 minute
Temperature Logging Interval:        1 minute
Min/Max recommended Temperature:      0/60 Celsius
Min/Max Temperature Limit:           -41/85 Celsius
Temperature History Size (Index):    478 (148)

SCT Error Recovery Control command not supported

Device Statistics (GP/SMART Log 0x04) not supported

Pending Defects log (GP Log 0x0c) not supported

SATA Phy Event Counters (GP Log 0x11)
ID      Size     Value  Description
0x0001  2            0  Command failed due to ICRC error
0x0002  2            0  R_ERR response for data FIS
0x0003  2            0  R_ERR response for device-to-host data FIS
0x0004  2            0  R_ERR response for host-to-device data FIS
0x0005  2            0  R_ERR response for non-data FIS
0x0006  2            0  R_ERR response for device-to-host non-data FIS
0x0007  2            0  R_ERR response for host-to-device non-data FIS
0x000a  2          641  Device-to-host register FISes sent due to a COMRESET
0x000b  2            0  CRC errors within host-to-device FIS
0x8000  4      3155010  Vendor specific



