smartctl 7.4 2023-08-01 r5530 [x86_64-linux-6.10.0-0.rc3.32.fc41.x86_64] (local build)
Copyright (C) 2002-23, Bruce Allen, Christian Franke, www.smartmontools.org

=== START OF INFORMATION SECTION ===
Model Family:     Crucial/Micron Client SSDs
Device Model:     MTFDDAV256TBN-1AR15ABHA
Serial Number:    --
LU WWN Device Id: 5 00a075 ...
Firmware Version: HPC0T14
User Capacity:    256,060,514,304 bytes [256 GB]
Sector Sizes:     512 bytes logical, 4096 bytes physical
Rotation Rate:    Solid State Device
Form Factor:      M.2
TRIM Command:     Available, deterministic, zeroed
Device is:        In smartctl database 7.3/5528
ATA Version is:   ACS-3 T13/2161-D revision 5
SATA Version is:  SATA 3.2, 6.0 Gb/s (current: 6.0 Gb/s)
Local Time is:    Tue Jun 18 11:53:27 2024 CEST
SMART support is: Available - device has SMART capability.
SMART support is: Enabled
AAM feature is:   Unavailable
APM feature is:   Unavailable
Rd look-ahead is: Enabled
Write cache is:   Enabled
DSN feature is:   Disabled
ATA Security is:  Disabled, frozen [SEC2]
Wt Cache Reorder: Enabled

=== START OF READ SMART DATA SECTION ===
SMART overall-health self-assessment test result: PASSED

General SMART Values:
Offline data collection status:  (0x00)	Offline data collection activity
					was never started.
					Auto Offline Data Collection: Disabled.
Self-test execution status:      (   0)	The previous self-test routine completed
					without error or no self-test has ever 
					been run.
Total time to complete Offline 
data collection: 		(  678) seconds.
Offline data collection
capabilities: 			 (0x5b) SMART execute Offline immediate.
					Auto Offline data collection on/off support.
					Suspend Offline collection upon new
					command.
					Offline surface scan supported.
					Self-test supported.
					No Conveyance Self-test supported.
					Selective Self-test supported.
SMART capabilities:            (0x0003)	Saves SMART data before entering
					power-saving mode.
					Supports SMART auto save timer.
Error logging capability:        (0x01)	Error logging supported.
					General Purpose Logging supported.
Short self-test routine 
recommended polling time: 	 (   2) minutes.
Extended self-test routine
recommended polling time: 	 (  12) minutes.
SCT capabilities: 	       (0x0035)	SCT Status supported.
					SCT Feature Control supported.
					SCT Data Table supported.

SMART Attributes Data Structure revision number: 32
Vendor Specific SMART Attributes with Thresholds:
ID# ATTRIBUTE_NAME          FLAGS    VALUE WORST THRESH FAIL RAW_VALUE
  1 Raw_Read_Error_Rate     POSR-K   100   100   050    -    0
  5 Reallocate_NAND_Blk_Cnt PO--CK   100   100   010    -    0
  9 Power_On_Hours          -O--CK   100   100   000    -    2113
 12 Power_Cycle_Count       -O--CK   100   100   000    -    413
171 Program_Fail_Count      -O--CK   100   100   000    -    0
172 Erase_Fail_Count        -O--CK   100   100   000    -    0
173 Ave_Block-Erase_Count   -O--CK   091   091   005    -    224
174 Unexpect_Power_Loss_Ct  -O--CK   100   100   000    -    103
176 Erase_Fail_Count_Chip   -O---K   100   100   000    -    1921
181 Program_Fail_Cnt_Total  -O---K   100   100   000    -    24459931226300
183 SATA_Interfac_Downshift -O--CK   100   100   000    -    0
184 Error_Correction_Count  PO-RCK   100   100   097    -    0
187 Reported_Uncorrect      -O--CK   100   100   000    -    0
188 Command_Timeout         -O--CK   100   100   000    -    644
194 Temperature_Celsius     -O---K   057   035   000    -    43 (Min/Max 12/65)
198 Offline_Uncorrectable   ----CK   100   100   000    -    0
199 UDMA_CRC_Error_Count    -O--CK   100   100   000    -    0
240 Unknown_SSD_Attribute   -O--CK   100   100   000    -    10798648 (0 0 103)
241 Total_LBAs_Written      -O--CK   100   100   000    -    55553303931
242 Total_LBAs_Read         -O--CK   100   100   000    -    32475037160
243 Unknown_Attribute       -O--CK   100   100   000    -    2342813700
                            ||||||_ K auto-keep
                            |||||__ C event count
                            ||||___ R error rate
                            |||____ S speed/performance
                            ||_____ O updated online
                            |______ P prefailure warning

General Purpose Log Directory Version 1
SMART           Log Directory Version 1 [multi-sector log support]
Address    Access  R/W   Size  Description
0x00       GPL,SL  R/O      1  Log Directory
0x01           SL  R/O      1  Summary SMART error log
0x02           SL  R/O     51  Comprehensive SMART error log
0x03       GPL     R/O  16383  Ext. Comprehensive SMART error log
0x04       GPL,SL  R/O      8  Device Statistics log
0x06           SL  R/O      1  SMART self-test log
0x07       GPL     R/O      1  Extended self-test log
0x09           SL  R/W      1  Selective self-test log
0x0a       GPL     R/W      8  Device Statistics Notification
0x10       GPL     R/O      1  NCQ Command Error log
0x11       GPL     R/O      1  SATA Phy Event Counters log
0x13       GPL     R/O      1  SATA NCQ Send and Receive log
0x24       GPL     R/O   8000  Current Device Internal Status Data log
0x25       GPL     R/O   8000  Saved Device Internal Status Data log
0x30       GPL,SL  R/O      9  IDENTIFY DEVICE data log
0x80-0x9f  GPL,SL  R/W     16  Host vendor specific log
0xa0       GPL     VS   35328  Device vendor specific log
0xa1       GPL,SL  VS       3  Device vendor specific log
0xa2       GPL,SL  VS       1  Device vendor specific log
0xa3       GPL     VS   13824  Device vendor specific log
0xa4       GPL     VS     354  Device vendor specific log
0xa4       SL      VS      98  Device vendor specific log
0xa5       GPL     VS    8000  Device vendor specific log
0xa5       SL      VS      64  Device vendor specific log
0xa6       GPL     VS    8000  Device vendor specific log
0xa6       SL      VS      64  Device vendor specific log
0xa7-0xdf  GPL,SL  VS       1  Device vendor specific log
0xe0       GPL,SL  R/W      1  SCT Command/Status
0xe1       GPL,SL  R/W      1  SCT Data Transfer

SMART Extended Comprehensive Error Log Version: 1 (16383 sectors)
No Errors Logged

SMART Extended Self-test Log Version: 1 (1 sectors)
Num  Test_Description    Status                  Remaining  LifeTime(hours)  LBA_of_first_error
# 1  Short offline       Completed without error       00%      2113         -
# 2  Short offline       Completed without error       00%      2111         -
# 3  Short offline       Completed without error       00%      2097         -
# 4  Short offline       Completed without error       00%      2094         -
# 5  Short offline       Completed without error       00%      2088         -
# 6  Short offline       Completed without error       00%      2082         -
# 7  Short offline       Completed without error       00%      2073         -
# 8  Short offline       Completed without error       00%      2070         -
# 9  Short offline       Completed without error       00%      2067         -
#10  Short offline       Completed without error       00%      2064         -
#11  Short offline       Completed without error       00%      2061         -
#12  Short offline       Completed without error       00%      2056         -
#13  Short offline       Completed without error       00%      2042         -
#14  Short offline       Aborted by host               00%      2027         -
#15  Short offline       Aborted by host               00%      2026         -
#16  Short offline       Completed without error       00%      2020         -
#17  Extended offline    Completed without error       00%      2019         -
#18  Short offline       Completed without error       00%      2019         -
#19  Vendor (0xff)       Completed without error       00%      1698         -

SMART Selective self-test log data structure revision number 1
 SPAN  MIN_LBA  MAX_LBA  CURRENT_TEST_STATUS
    1        0        0  Not_testing
    2        0        0  Not_testing
    3        0        0  Not_testing
    4        0        0  Not_testing
    5        0        0  Not_testing
Selective self-test flags (0x0):
  After scanning selected spans, do NOT read-scan remainder of disk.
If Selective self-test is pending on power-up, resume after 0 minute delay.

SCT Status Version:                  3
SCT Version (vendor specific):       1 (0x0001)
Device State:                        Active (0)
Current Temperature:                    43 Celsius
Power Cycle Min/Max Temperature:     42/47 Celsius
Lifetime    Min/Max Temperature:     12/65 Celsius
Specified Max Operating Temperature:    70 Celsius
Under/Over Temperature Limit Count:   0/0

SCT Temperature History Version:     2
Temperature Sampling Period:         1 minute
Temperature Logging Interval:        1 minute
Min/Max recommended Temperature:      0/70 Celsius
Min/Max Temperature Limit:           -5/75 Celsius
Temperature History Size (Index):    478 (26)

SCT Error Recovery Control command not supported

Device Statistics (GP Log 0x04)
Page  Offset Size        Value Flags Description
0x01  =====  =               =  ===  == General Statistics (rev 1) ==
0x01  0x008  4             413  -D-  Lifetime Power-On Resets
0x01  0x010  4            2113  -D-  Power-on Hours
0x01  0x018  6     55553303931  -D-  Logical Sectors Written
0x01  0x020  6      1631076151  -D-  Number of Write Commands
0x01  0x028  6     32475037160  -D-  Logical Sectors Read
0x01  0x030  6       867976542  -D-  Number of Read Commands
0x04  =====  =               =  ===  == General Errors Statistics (rev 1) ==
0x04  0x008  4               0  -D-  Number of Reported Uncorrectable Errors
0x04  0x010  4             644  -D-  Resets Between Cmd Acceptance and Completion
0x05  =====  =               =  ===  == Temperature Statistics (rev 1) ==
0x05  0x008  1              43  -D-  Current Temperature
0x05  0x010  1              40  -D-  Average Short Term Temperature
0x05  0x018  1              28  -D-  Average Long Term Temperature
0x05  0x020  1              65  -D-  Highest Temperature
0x05  0x028  1              12  -D-  Lowest Temperature
0x05  0x030  1              41  -D-  Highest Average Short Term Temperature
0x05  0x038  1              25  -D-  Lowest Average Short Term Temperature
0x05  0x040  1              28  -D-  Highest Average Long Term Temperature
0x05  0x048  1              28  -D-  Lowest Average Long Term Temperature
0x05  0x050  4               0  -D-  Time in Over-Temperature
0x05  0x058  1              70  -D-  Specified Maximum Operating Temperature
0x05  0x060  4               0  -D-  Time in Under-Temperature
0x05  0x068  1               0  -D-  Specified Minimum Operating Temperature
0x06  =====  =               =  ===  == Transport Statistics (rev 1) ==
0x06  0x008  4            5220  -D-  Number of Hardware Resets
0x06  0x010  4              24  -D-  Number of ASR Events
0x06  0x018  4               0  -D-  Number of Interface CRC Errors
0x07  =====  =               =  ===  == Solid State Device Statistics (rev 1) ==
0x07  0x008  1               9  -D-  Percentage Used Endurance Indicator
                                |||_ C monitored condition met
                                ||__ D supports DSN
                                |___ N normalized value

Pending Defects log (GP Log 0x0c) not supported

SATA Phy Event Counters (GP Log 0x11)
ID      Size     Value  Description
0x0001  4            0  Command failed due to ICRC error
0x000a  4            0  Device-to-host register FISes sent due to a COMRESET

