smartctl 7.4 2023-08-01 r5530 [x86_64-linux-6.6.2-desktop-1omv2390] (OpenMandriva Lx 7.4-1)
Copyright (C) 2002-23, Bruce Allen, Christian Franke, www.smartmontools.org

=== START OF INFORMATION SECTION ===
Model Family:     Western Digital Scorpio Blue Serial ATA
Device Model:     WDC WD1600BEVT-75A23T0
Serial Number:    --
LU WWN Device Id: 5 0014ee ...
Firmware Version: 01.01A01
User Capacity:    160,041,885,696 bytes [160 GB]
Sector Size:      512 bytes logical/physical
Rotation Rate:    5400 rpm
Device is:        In smartctl database
ATA Version is:   ATA8-ACS (minor revision not indicated)
SATA Version is:  SATA 2.6, 3.0 Gb/s
Local Time is:    Fri Dec 15 17:12:23 2023 CET
SMART support is: Available - device has SMART capability.
SMART support is: Enabled
AAM feature is:   Disabled
APM level is:     128 (minimum power consumption without standby)
Rd look-ahead is: Enabled
Write cache is:   Enabled
DSN feature is:   Unavailable
ATA Security is:  Disabled, frozen [SEC2]
Wt Cache Reorder: Enabled

=== START OF READ SMART DATA SECTION ===
SMART overall-health self-assessment test result: PASSED

General SMART Values:
Offline data collection status:  (0x82)	Offline data collection activity
					was completed without error.
					Auto Offline Data Collection: Enabled.
Self-test execution status:      ( 243)	Self-test routine in progress...
					30% of test remaining.
Total time to complete Offline 
data collection: 		( 6000) seconds.
Offline data collection
capabilities: 			 (0x7b) SMART execute Offline immediate.
					Auto Offline data collection on/off support.
					Suspend Offline collection upon new
					command.
					Offline surface scan supported.
					Self-test supported.
					Conveyance Self-test supported.
					Selective Self-test supported.
SMART capabilities:            (0x0003)	Saves SMART data before entering
					power-saving mode.
					Supports SMART auto save timer.
Error logging capability:        (0x01)	Error logging supported.
					General Purpose Logging supported.
Short self-test routine 
recommended polling time: 	 (   2) minutes.
Extended self-test routine
recommended polling time: 	 (  73) minutes.
Conveyance self-test routine
recommended polling time: 	 (   5) minutes.
SCT capabilities: 	       (0x7037)	SCT Status supported.
					SCT Feature Control supported.
					SCT Data Table supported.

SMART Attributes Data Structure revision number: 16
Vendor Specific SMART Attributes with Thresholds:
ID# ATTRIBUTE_NAME          FLAGS    VALUE WORST THRESH FAIL RAW_VALUE
  1 Raw_Read_Error_Rate     POSR-K   200   200   051    -    0
  3 Spin_Up_Time            POS--K   151   139   021    -    1441
  4 Start_Stop_Count        -O--CK   096   096   000    -    4540
  5 Reallocated_Sector_Ct   PO--CK   199   199   140    -    1
  7 Seek_Error_Rate         -OSR-K   200   200   000    -    0
  9 Power_On_Hours          -O--CK   090   090   000    -    7996
 10 Spin_Retry_Count        -O--CK   100   100   000    -    0
 11 Calibration_Retry_Count -O--CK   100   100   000    -    0
 12 Power_Cycle_Count       -O--CK   096   096   000    -    4445
191 G-Sense_Error_Rate      -O--CK   001   001   000    -    1601
192 Power-Off_Retract_Count -O--CK   199   199   000    -    1360
193 Load_Cycle_Count        -O--CK   001   001   000    -    1264850
194 Temperature_Celsius     -O---K   095   080   000    -    48
196 Reallocated_Event_Count -O--CK   199   199   000    -    1
197 Current_Pending_Sector  -O--CK   200   200   000    -    0
198 Offline_Uncorrectable   ----CK   200   200   000    -    0
199 UDMA_CRC_Error_Count    -O--CK   200   200   000    -    0
200 Multi_Zone_Error_Rate   ---R--   200   200   000    -    0
240 Head_Flying_Hours       -O--CK   092   092   000    -    6431
241 Total_LBAs_Written      -O--CK   200   200   000    -    19108304722
242 Total_LBAs_Read         -O--CK   200   200   000    -    15941732959
254 Free_Fall_Sensor        -O--CK   001   001   000    -    983
                            ||||||_ K auto-keep
                            |||||__ C event count
                            ||||___ R error rate
                            |||____ S speed/performance
                            ||_____ O updated online
                            |______ P prefailure warning

General Purpose Log Directory Version 1
SMART           Log Directory Version 1 [multi-sector log support]
Address    Access  R/W   Size  Description
0x00       GPL,SL  R/O      1  Log Directory
0x01           SL  R/O      1  Summary SMART error log
0x02           SL  R/O      5  Comprehensive SMART error log
0x03       GPL     R/O      6  Ext. Comprehensive SMART error log
0x06           SL  R/O      1  SMART self-test log
0x07       GPL     R/O      1  Extended self-test log
0x09           SL  R/W      1  Selective self-test log
0x10       GPL     R/O      1  NCQ Command Error log
0x11       GPL     R/O      1  SATA Phy Event Counters log
0x80-0x9f  GPL,SL  R/W     16  Host vendor specific log
0xa0-0xa7  GPL,SL  VS      16  Device vendor specific log
0xa8-0xb7  GPL,SL  VS       1  Device vendor specific log
0xc0       GPL,SL  VS       1  Device vendor specific log
0xc1       GPL     VS      24  Device vendor specific log
0xe0       GPL,SL  R/W      1  SCT Command/Status
0xe1       GPL,SL  R/W      1  SCT Data Transfer

SMART Extended Comprehensive Error Log Version: 1 (6 sectors)
Device Error Count: 6943 (device log contains only the most recent 24 errors)
	CR     = Command Register
	FEATR  = Features Register
	COUNT  = Count (was: Sector Count) Register
	LBA_48 = Upper bytes of LBA High/Mid/Low Registers ]  ATA-8
	LH     = LBA High (was: Cylinder High) Register    ]   LBA
	LM     = LBA Mid (was: Cylinder Low) Register      ] Register
	LL     = LBA Low (was: Sector Number) Register     ]
	DV     = Device (was: Device/Head) Register
	DC     = Device Control Register
	ER     = Error register
	ST     = Status register
Powered_Up_Time is measured from power on, and printed as
DDd+hh:mm:SS.sss where DD=days, hh=hours, mm=minutes,
SS=sec, and sss=millisec. It "wraps" after 49.710 days.

Error 6943 [6] occurred at disk power-on lifetime: 5162 hours (215 days + 2 hours)
  When the command that caused the error occurred, the device was active or idle.

  After command completion occurred, registers were:
  ER -- ST COUNT  LBA_48  LH LM LL DV DC
  -- -- -- == -- == == == -- -- -- -- --
  04 -- 41 00 40 00 00 01 e6 db 1a 40 00  Error: ABRT at LBA = 0x01e6db1a = 31906586

  Commands leading to the command that caused the error were:
  CR FEATR COUNT  LBA_48  LH LM LL DV DC  Powered_Up_Time  Command/Feature_Name
  -- == -- == -- == == == -- -- -- -- --  ---------------  --------------------
  61 00 01 00 18 00 00 02 24 c0 b0 40 00     05:52:06.809  WRITE FPDMA QUEUED
  61 00 08 00 10 00 00 01 d9 a5 90 40 00     05:52:06.809  WRITE FPDMA QUEUED
  60 00 08 00 08 00 00 05 6f f2 e0 40 00     05:52:06.809  READ FPDMA QUEUED
  60 00 80 00 00 00 00 05 6c 72 98 40 00     05:52:06.809  READ FPDMA QUEUED
  60 00 08 00 f8 00 00 05 6f 5d 70 40 00     05:52:06.809  READ FPDMA QUEUED

Error 6942 [5] occurred at disk power-on lifetime: 5027 hours (209 days + 11 hours)
  When the command that caused the error occurred, the device was active or idle.

  After command completion occurred, registers were:
  ER -- ST COUNT  LBA_48  LH LM LL DV DC
  -- -- -- == -- == == == -- -- -- -- --
  04 -- 41 00 00 00 00 05 6b c4 e8 40 00  Error: ABRT at LBA = 0x056bc4e8 = 90948840

  Commands leading to the command that caused the error were:
  CR FEATR COUNT  LBA_48  LH LM LL DV DC  Powered_Up_Time  Command/Feature_Name
  -- == -- == -- == == == -- -- -- -- --  ---------------  --------------------
  60 00 38 00 e8 00 00 05 6b c4 e8 40 00     00:45:57.582  READ FPDMA QUEUED
  b0 00 d0 00 00 00 00 00 c2 4f 00 40 00     00:45:48.946  SMART READ DATA
  e5 00 00 00 00 00 00 00 00 00 00 40 00     00:45:48.946  CHECK POWER MODE
  b0 00 d0 00 00 00 00 00 c2 4f 00 40 00     00:45:48.939  SMART READ DATA
  e5 00 00 00 00 00 00 00 00 00 00 40 00     00:45:48.939  CHECK POWER MODE

Error 6941 [4] occurred at disk power-on lifetime: 4500 hours (187 days + 12 hours)
  When the command that caused the error occurred, the device was active or idle.

  After command completion occurred, registers were:
  ER -- ST COUNT  LBA_48  LH LM LL DV DC
  -- -- -- == -- == == == -- -- -- -- --
  04 -- 61 00 00 00 00 00 00 00 00 40 00  Device Fault; Error: ABRT at LBA = 0x00000000 = 0

  Commands leading to the command that caused the error were:
  CR FEATR COUNT  LBA_48  LH LM LL DV DC  Powered_Up_Time  Command/Feature_Name
  -- == -- == -- == == == -- -- -- -- --  ---------------  --------------------
  60 00 21 00 b8 00 00 01 dc 37 80 40 00     00:08:12.994  READ FPDMA QUEUED
  b0 00 da 00 00 00 00 00 c2 4f 00 40 00     00:08:12.879  SMART RETURN STATUS
  e5 00 00 00 00 00 00 00 00 00 00 40 00     00:08:12.879  CHECK POWER MODE
  2f 00 00 00 01 00 00 00 00 00 10 40 00     00:08:12.878  READ LOG EXT
  61 00 08 00 e8 00 00 0a f8 7f 88 40 00     00:08:12.746  WRITE FPDMA QUEUED

Error 6940 [3] occurred at disk power-on lifetime: 4500 hours (187 days + 12 hours)
  When the command that caused the error occurred, the device was active or idle.

  After command completion occurred, registers were:
  ER -- ST COUNT  LBA_48  LH LM LL DV DC
  -- -- -- == -- == == == -- -- -- -- --
  04 -- 61 00 01 00 00 00 00 00 00 40 00  Device Fault; Error: ABRT at LBA = 0x00000000 = 0

  Commands leading to the command that caused the error were:
  CR FEATR COUNT  LBA_48  LH LM LL DV DC  Powered_Up_Time  Command/Feature_Name
  -- == -- == -- == == == -- -- -- -- --  ---------------  --------------------
  61 00 08 00 e8 00 00 0a f8 7f 88 40 00     00:08:12.746  WRITE FPDMA QUEUED
  2f 00 00 00 01 00 00 00 00 00 10 40 00     00:08:12.745  READ LOG EXT
  61 01 00 00 50 00 00 05 70 5d 68 40 00     00:08:12.612  WRITE FPDMA QUEUED
  2f 00 00 00 01 00 00 00 00 00 10 40 00     00:08:12.612  READ LOG EXT
  61 00 10 00 b0 00 00 02 0a 5e 78 40 00     00:08:12.479  WRITE FPDMA QUEUED

Error 6939 [2] occurred at disk power-on lifetime: 4500 hours (187 days + 12 hours)
  When the command that caused the error occurred, the device was active or idle.

  After command completion occurred, registers were:
  ER -- ST COUNT  LBA_48  LH LM LL DV DC
  -- -- -- == -- == == == -- -- -- -- --
  04 -- 61 00 01 00 00 00 00 00 00 40 00  Device Fault; Error: ABRT at LBA = 0x00000000 = 0

  Commands leading to the command that caused the error were:
  CR FEATR COUNT  LBA_48  LH LM LL DV DC  Powered_Up_Time  Command/Feature_Name
  -- == -- == -- == == == -- -- -- -- --  ---------------  --------------------
  61 01 00 00 50 00 00 05 70 5d 68 40 00     00:08:12.612  WRITE FPDMA QUEUED
  2f 00 00 00 01 00 00 00 00 00 10 40 00     00:08:12.612  READ LOG EXT
  61 00 10 00 b0 00 00 02 0a 5e 78 40 00     00:08:12.479  WRITE FPDMA QUEUED
  2f 00 00 00 01 00 00 00 00 00 10 40 00     00:08:12.479  READ LOG EXT
  61 01 00 00 10 00 00 05 70 58 28 40 00     00:08:12.346  WRITE FPDMA QUEUED

Error 6938 [1] occurred at disk power-on lifetime: 4500 hours (187 days + 12 hours)
  When the command that caused the error occurred, the device was active or idle.

  After command completion occurred, registers were:
  ER -- ST COUNT  LBA_48  LH LM LL DV DC
  -- -- -- == -- == == == -- -- -- -- --
  04 -- 61 00 01 00 00 00 00 00 00 40 00  Device Fault; Error: ABRT at LBA = 0x00000000 = 0

  Commands leading to the command that caused the error were:
  CR FEATR COUNT  LBA_48  LH LM LL DV DC  Powered_Up_Time  Command/Feature_Name
  -- == -- == -- == == == -- -- -- -- --  ---------------  --------------------
  61 00 10 00 b0 00 00 02 0a 5e 78 40 00     00:08:12.479  WRITE FPDMA QUEUED
  2f 00 00 00 01 00 00 00 00 00 10 40 00     00:08:12.479  READ LOG EXT
  61 01 00 00 10 00 00 05 70 58 28 40 00     00:08:12.346  WRITE FPDMA QUEUED
  2f 00 00 00 01 00 00 00 00 00 10 40 00     00:08:12.346  READ LOG EXT
  61 00 05 00 70 00 00 04 23 75 48 40 00     00:08:12.213  WRITE FPDMA QUEUED

Error 6937 [0] occurred at disk power-on lifetime: 4500 hours (187 days + 12 hours)
  When the command that caused the error occurred, the device was active or idle.

  After command completion occurred, registers were:
  ER -- ST COUNT  LBA_48  LH LM LL DV DC
  -- -- -- == -- == == == -- -- -- -- --
  04 -- 61 00 01 00 00 00 00 00 00 40 00  Device Fault; Error: ABRT at LBA = 0x00000000 = 0

  Commands leading to the command that caused the error were:
  CR FEATR COUNT  LBA_48  LH LM LL DV DC  Powered_Up_Time  Command/Feature_Name
  -- == -- == -- == == == -- -- -- -- --  ---------------  --------------------
  61 01 00 00 10 00 00 05 70 58 28 40 00     00:08:12.346  WRITE FPDMA QUEUED
  2f 00 00 00 01 00 00 00 00 00 10 40 00     00:08:12.346  READ LOG EXT
  61 00 05 00 70 00 00 04 23 75 48 40 00     00:08:12.213  WRITE FPDMA QUEUED
  2f 00 00 00 01 00 00 00 00 00 10 40 00     00:08:12.212  READ LOG EXT
  61 00 20 00 d0 00 00 01 dc f3 50 40 00     00:08:12.080  WRITE FPDMA QUEUED

Error 6936 [23] occurred at disk power-on lifetime: 4500 hours (187 days + 12 hours)
  When the command that caused the error occurred, the device was active or idle.

  After command completion occurred, registers were:
  ER -- ST COUNT  LBA_48  LH LM LL DV DC
  -- -- -- == -- == == == -- -- -- -- --
  04 -- 61 00 01 00 00 00 00 00 00 40 00  Device Fault; Error: ABRT at LBA = 0x00000000 = 0

  Commands leading to the command that caused the error were:
  CR FEATR COUNT  LBA_48  LH LM LL DV DC  Powered_Up_Time  Command/Feature_Name
  -- == -- == -- == == == -- -- -- -- --  ---------------  --------------------
  61 00 05 00 70 00 00 04 23 75 48 40 00     00:08:12.213  WRITE FPDMA QUEUED
  2f 00 00 00 01 00 00 00 00 00 10 40 00     00:08:12.212  READ LOG EXT
  61 00 20 00 d0 00 00 01 dc f3 50 40 00     00:08:12.080  WRITE FPDMA QUEUED
  2f 00 00 00 01 00 00 00 00 00 10 40 00     00:08:12.079  READ LOG EXT
  60 00 40 00 30 00 00 02 15 6c 32 40 00     00:08:11.946  READ FPDMA QUEUED

SMART Extended Self-test Log Version: 1 (1 sectors)
Num  Test_Description    Status                  Remaining  LifeTime(hours)  LBA_of_first_error
# 1  Short offline       Completed without error       00%      7994         -
# 2  Short offline       Completed without error       00%      7979         -
# 3  Short offline       Completed without error       00%      7786         -
# 4  Short offline       Completed without error       00%      7786         -
# 5  Short offline       Completed without error       00%      7773         -
# 6  Short offline       Completed without error       00%      7773         -
# 7  Short offline       Completed without error       00%      7239         -
# 8  Short offline       Completed without error       00%      7004         -
# 9  Short offline       Completed without error       00%      6763         -
#10  Short offline       Completed: read failure       90%      6400         297393234
#11  Short offline       Completed without error       00%      6369         -
#12  Short offline       Completed without error       00%      5686         -
#13  Short offline       Completed without error       00%      5685         -
#14  Short offline       Completed without error       00%      5590         -
#15  Short offline       Completed without error       00%      5513         -
#16  Short offline       Completed without error       00%      5513         -
#17  Short offline       Completed without error       00%      5474         -
#18  Short offline       Completed without error       00%      5103         -

SMART Selective self-test log data structure revision number 1
 SPAN  MIN_LBA  MAX_LBA  CURRENT_TEST_STATUS
    1        0        0  Not_testing
    2        0        0  Not_testing
    3        0        0  Not_testing
    4        0        0  Not_testing
    5        0        0  Not_testing
Selective self-test flags (0x0):
  After scanning selected spans, do NOT read-scan remainder of disk.
If Selective self-test is pending on power-up, resume after 0 minute delay.

SCT Status Version:                  3
SCT Version (vendor specific):       258 (0x0102)
Device State:                        DST executing in background (3)
Current Temperature:                    48 Celsius
Power Cycle Min/Max Temperature:     48/49 Celsius
Lifetime    Min/Max Temperature:     48/62 Celsius
Specified Max Operating Temperature:    28 Celsius
Under/Over Temperature Limit Count:   0/0
Vendor specific:
01 00 00 00 00 00 00 00 00 00 00 00 00 00 00 00
00 00 00 00 00 00 00 00 00 00 00 00 00 00 00 00

SCT Temperature History Version:     2
Temperature Sampling Period:         1 minute
Temperature Logging Interval:        1 minute
Min/Max recommended Temperature:      0/60 Celsius
Min/Max Temperature Limit:           -41/85 Celsius
Temperature History Size (Index):    128 (19)

SCT Error Recovery Control command not supported

Device Statistics (GP/SMART Log 0x04) not supported

Pending Defects log (GP Log 0x0c) not supported

SATA Phy Event Counters (GP Log 0x11)
ID      Size     Value  Description
0x0001  2            0  Command failed due to ICRC error
0x0002  2            0  R_ERR response for data FIS
0x0003  2            0  R_ERR response for device-to-host data FIS
0x0004  2            0  R_ERR response for host-to-device data FIS
0x0005  2            0  R_ERR response for non-data FIS
0x0006  2            0  R_ERR response for device-to-host non-data FIS
0x0007  2            0  R_ERR response for host-to-device non-data FIS
0x000a  2            2  Device-to-host register FISes sent due to a COMRESET
0x000b  2            0  CRC errors within host-to-device FIS
0x8000  4          456  Vendor specific

