smartctl 7.3 2022-02-28 r5338 [x86_64-linux-6.1.0-28-amd64] (local build)
Copyright (C) 2002-22, Bruce Allen, Christian Franke, www.smartmontools.org

=== START OF INFORMATION SECTION ===
Model Family:     Crucial/Micron Client SSDs
Device Model:     Crucial_CT525MX300SSD1
Serial Number:    --
LU WWN Device Id: 5 00a075 ...
Firmware Version: M0CR040
User Capacity:    525,112,713,216 bytes [525 GB]
Sector Size:      512 bytes logical/physical
Rotation Rate:    Solid State Device
Form Factor:      2.5 inches
TRIM Command:     Available, deterministic, zeroed
Device is:        In smartctl database 7.3/5319
ATA Version is:   ACS-3 T13/2161-D revision 5
SATA Version is:  SATA 3.2, 6.0 Gb/s (current: 3.0 Gb/s)
Local Time is:    Fri Dec 27 14:34:49 2024 CET
SMART support is: Available - device has SMART capability.
SMART support is: Enabled
AAM feature is:   Unavailable
APM level is:     254 (maximum performance)
Rd look-ahead is: Enabled
Write cache is:   Enabled
DSN feature is:   Unavailable
ATA Security is:  Unavailable
Wt Cache Reorder: Enabled

=== START OF READ SMART DATA SECTION ===
SMART overall-health self-assessment test result: PASSED

General SMART Values:
Offline data collection status:  (0x00)	Offline data collection activity
					was never started.
					Auto Offline Data Collection: Disabled.
Self-test execution status:      (   0)	The previous self-test routine completed
					without error or no self-test has ever 
					been run.
Total time to complete Offline 
data collection: 		( 1391) seconds.
Offline data collection
capabilities: 			 (0x7b) SMART execute Offline immediate.
					Auto Offline data collection on/off support.
					Suspend Offline collection upon new
					command.
					Offline surface scan supported.
					Self-test supported.
					Conveyance Self-test supported.
					Selective Self-test supported.
SMART capabilities:            (0x0003)	Saves SMART data before entering
					power-saving mode.
					Supports SMART auto save timer.
Error logging capability:        (0x01)	Error logging supported.
					General Purpose Logging supported.
Short self-test routine 
recommended polling time: 	 (   2) minutes.
Extended self-test routine
recommended polling time: 	 (   7) minutes.
Conveyance self-test routine
recommended polling time: 	 (   3) minutes.
SCT capabilities: 	       (0x0035)	SCT Status supported.
					SCT Feature Control supported.
					SCT Data Table supported.

SMART Attributes Data Structure revision number: 16
Vendor Specific SMART Attributes with Thresholds:
ID# ATTRIBUTE_NAME          FLAGS    VALUE WORST THRESH FAIL RAW_VALUE
  1 Raw_Read_Error_Rate     POSR-K   100   100   000    -    4133
  5 Reallocate_NAND_Blk_Cnt -O--CK   032   032   010    -    1158
  9 Power_On_Hours          -O--CK   100   100   000    -    13078
 12 Power_Cycle_Count       -O--CK   100   100   000    -    5043
171 Program_Fail_Count      -O--CK   100   100   000    -    97
172 Erase_Fail_Count        -O--CK   100   100   000    -    0
173 Ave_Block-Erase_Count   -O--CK   097   097   000    -    53
174 Unexpect_Power_Loss_Ct  -O--CK   100   100   000    -    456
183 SATA_Interfac_Downshift -O--CK   100   100   000    -    2
184 Error_Correction_Count  -O--CK   100   100   000    -    0
187 Reported_Uncorrect      -O--CK   100   100   000    -    21419
194 Temperature_Celsius     -O---K   060   040   000    -    40 (Min/Max 9/60)
196 Reallocated_Event_Count -O--CK   100   100   000    -    1142
197 Current_Pending_ECC_Cnt -O--CK   100   100   000    -    0
198 Offline_Uncorrectable   ----CK   100   100   000    -    1
199 UDMA_CRC_Error_Count    -O--CK   100   100   000    -    7
202 Percent_Lifetime_Remain ----CK   097   097   001    -    3
206 Write_Error_Rate        -OSR--   100   100   000    -    97
246 Total_LBAs_Written      -O--CK   100   100   000    -    21797910782
247 Host_Program_Page_Count -O--CK   100   100   000    -    682539848
248 FTL_Program_Page_Count  -O--CK   100   100   000    -    795664497
180 Unused_Reserve_NAND_Blk PO--CK   000   000   000    -    802
210 Success_RAIN_Recov_Cnt  -O--CK   100   100   000    -    2806
                            ||||||_ K auto-keep
                            |||||__ C event count
                            ||||___ R error rate
                            |||____ S speed/performance
                            ||_____ O updated online
                            |______ P prefailure warning

General Purpose Log Directory Version 1
SMART           Log Directory Version 1 [multi-sector log support]
Address    Access  R/W   Size  Description
0x00       GPL,SL  R/O      1  Log Directory
0x01           SL  R/O      1  Summary SMART error log
0x02           SL  R/O     51  Comprehensive SMART error log
0x03       GPL     R/O  16383  Ext. Comprehensive SMART error log
0x04       GPL,SL  R/O      8  Device Statistics log
0x06           SL  R/O      1  SMART self-test log
0x07       GPL     R/O      1  Extended self-test log
0x09           SL  R/W      1  Selective self-test log
0x10       GPL     R/O      1  NCQ Command Error log
0x11       GPL     R/O      1  SATA Phy Event Counters log
0x13       GPL     R/O      1  SATA NCQ Send and Receive log
0x24       GPL     R/O   8000  Current Device Internal Status Data log
0x25       GPL     R/O   8000  Saved Device Internal Status Data log
0x30       GPL,SL  R/O      9  IDENTIFY DEVICE data log
0x80-0x9f  GPL,SL  R/W     16  Host vendor specific log
0xa0       GPL     VS   35328  Device vendor specific log
0xa1       GPL,SL  VS       3  Device vendor specific log
0xa2       GPL,SL  VS       1  Device vendor specific log
0xa3       GPL     VS   13824  Device vendor specific log
0xa4       GPL     VS     354  Device vendor specific log
0xa4       SL      VS      98  Device vendor specific log
0xa5       GPL     VS    8000  Device vendor specific log
0xa5       SL      VS      64  Device vendor specific log
0xa6       GPL     VS    8000  Device vendor specific log
0xa6       SL      VS      64  Device vendor specific log
0xa7-0xdf  GPL,SL  VS       1  Device vendor specific log
0xe0       GPL,SL  R/W      1  SCT Command/Status
0xe1       GPL,SL  R/W      1  SCT Data Transfer

SMART Extended Comprehensive Error Log Version: 1 (16383 sectors)
Device Error Count: 21419
	CR     = Command Register
	FEATR  = Features Register
	COUNT  = Count (was: Sector Count) Register
	LBA_48 = Upper bytes of LBA High/Mid/Low Registers ]  ATA-8
	LH     = LBA High (was: Cylinder High) Register    ]   LBA
	LM     = LBA Mid (was: Cylinder Low) Register      ] Register
	LL     = LBA Low (was: Sector Number) Register     ]
	DV     = Device (was: Device/Head) Register
	DC     = Device Control Register
	ER     = Error register
	ST     = Status register
Powered_Up_Time is measured from power on, and printed as
DDd+hh:mm:SS.sss where DD=days, hh=hours, mm=minutes,
SS=sec, and sss=millisec. It "wraps" after 49.710 days.

Error 21419 [21418] occurred at disk power-on lifetime: 12798 hours (533 days + 6 hours)
  When the command that caused the error occurred, the device was active or idle.

  After command completion occurred, registers were:
  ER -- ST COUNT  LBA_48  LH LM LL DV DC
  -- -- -- == -- == == == -- -- -- -- --
  40 -- 51 00 08 00 00 03 37 84 70 40 08  Error: UNC at LBA = 0x03378470 = 53970032

  Commands leading to the command that caused the error were:
  CR FEATR COUNT  LBA_48  LH LM LL DV DC  Powered_Up_Time  Command/Feature_Name
  -- == -- == -- == == == -- -- -- -- --  ---------------  --------------------
  60 00 00 00 08 00 00 03 37 84 70 40 08 36d+04:18:07.040  READ FPDMA QUEUED
  47 00 00 00 01 00 00 00 00 06 30 e0 08 36d+04:18:07.040  READ LOG DMA EXT
  47 00 00 00 01 00 00 00 00 00 30 e0 08 36d+04:18:07.040  READ LOG DMA EXT
  47 00 00 00 01 00 00 00 00 00 00 e0 08 36d+04:18:07.040  READ LOG DMA EXT
  47 00 00 00 01 00 00 00 00 08 30 e0 08 36d+04:18:07.040  READ LOG DMA EXT

Error 21418 [21417] occurred at disk power-on lifetime: 12798 hours (533 days + 6 hours)
  When the command that caused the error occurred, the device was active or idle.

  After command completion occurred, registers were:
  ER -- ST COUNT  LBA_48  LH LM LL DV DC
  -- -- -- == -- == == == -- -- -- -- --
  40 -- 51 00 08 00 00 03 37 84 70 40 08  Error: UNC at LBA = 0x03378470 = 53970032

  Commands leading to the command that caused the error were:
  CR FEATR COUNT  LBA_48  LH LM LL DV DC  Powered_Up_Time  Command/Feature_Name
  -- == -- == -- == == == -- -- -- -- --  ---------------  --------------------
  60 00 00 00 08 00 00 03 37 84 70 40 08 36d+04:18:07.040  READ FPDMA QUEUED
  60 00 00 00 08 00 00 03 37 84 68 40 08 36d+04:18:07.040  READ FPDMA QUEUED
  60 00 00 00 08 00 00 03 37 84 60 40 08 36d+04:18:07.040  READ FPDMA QUEUED
  60 00 00 00 08 00 00 03 37 84 58 40 08 36d+04:18:07.040  READ FPDMA QUEUED
  60 00 00 00 08 00 00 03 37 84 50 40 08 36d+04:18:07.040  READ FPDMA QUEUED

Error 21417 [21416] occurred at disk power-on lifetime: 12798 hours (533 days + 6 hours)
  When the command that caused the error occurred, the device was active or idle.

  After command completion occurred, registers were:
  ER -- ST COUNT  LBA_48  LH LM LL DV DC
  -- -- -- == -- == == == -- -- -- -- --
  40 -- 51 01 00 00 00 03 37 83 c0 40 08  Error: UNC at LBA = 0x033783c0 = 53969856

  Commands leading to the command that caused the error were:
  CR FEATR COUNT  LBA_48  LH LM LL DV DC  Powered_Up_Time  Command/Feature_Name
  -- == -- == -- == == == -- -- -- -- --  ---------------  --------------------
  60 00 00 01 00 00 00 03 37 83 c0 40 08 36d+04:18:07.040  READ FPDMA QUEUED
  60 00 00 01 00 00 00 03 37 82 c0 40 08 36d+04:18:07.040  READ FPDMA QUEUED
  60 00 00 01 00 00 00 03 37 81 c0 40 08 36d+04:18:07.040  READ FPDMA QUEUED
  60 00 00 01 00 00 00 03 37 80 c0 40 08 36d+04:18:07.040  READ FPDMA QUEUED
  60 00 00 01 00 00 00 03 37 7f c0 40 08 36d+04:18:07.040  READ FPDMA QUEUED

Error 21416 [21415] occurred at disk power-on lifetime: 12798 hours (533 days + 6 hours)
  When the command that caused the error occurred, the device was active or idle.

  After command completion occurred, registers were:
  ER -- ST COUNT  LBA_48  LH LM LL DV DC
  -- -- -- == -- == == == -- -- -- -- --
  40 -- 51 00 08 00 00 37 65 7d 88 40 08  Error: UNC at LBA = 0x37657d88 = 929398152

  Commands leading to the command that caused the error were:
  CR FEATR COUNT  LBA_48  LH LM LL DV DC  Powered_Up_Time  Command/Feature_Name
  -- == -- == -- == == == -- -- -- -- --  ---------------  --------------------
  60 00 00 00 08 00 00 37 65 7d 88 40 08 36d+04:06:07.040  READ FPDMA QUEUED
  47 00 00 00 01 00 00 00 00 06 30 e0 08 36d+04:06:07.040  READ LOG DMA EXT
  47 00 00 00 01 00 00 00 00 00 30 e0 08 36d+04:06:07.040  READ LOG DMA EXT
  47 00 00 00 01 00 00 00 00 00 00 e0 08 36d+04:06:07.040  READ LOG DMA EXT
  47 00 00 00 01 00 00 00 00 08 30 e0 08 36d+04:06:07.040  READ LOG DMA EXT

Error 21415 [21414] occurred at disk power-on lifetime: 12798 hours (533 days + 6 hours)
  When the command that caused the error occurred, the device was active or idle.

  After command completion occurred, registers were:
  ER -- ST COUNT  LBA_48  LH LM LL DV DC
  -- -- -- == -- == == == -- -- -- -- --
  40 -- 51 00 08 00 00 37 65 7d 88 40 08  Error: UNC at LBA = 0x37657d88 = 929398152

  Commands leading to the command that caused the error were:
  CR FEATR COUNT  LBA_48  LH LM LL DV DC  Powered_Up_Time  Command/Feature_Name
  -- == -- == -- == == == -- -- -- -- --  ---------------  --------------------
  60 00 00 00 08 00 00 37 65 7d 88 40 08 36d+04:06:07.040  READ FPDMA QUEUED
  60 00 00 00 08 00 00 37 65 7d 80 40 08 36d+04:06:07.040  READ FPDMA QUEUED
  60 00 00 00 08 00 00 37 65 7d 78 40 08 36d+04:06:07.040  READ FPDMA QUEUED
  60 00 00 00 08 00 00 37 65 7d 70 40 08 36d+04:06:07.040  READ FPDMA QUEUED
  60 00 00 00 08 00 00 37 65 7d 68 40 08 36d+04:06:07.040  READ FPDMA QUEUED

Error 21414 [21413] occurred at disk power-on lifetime: 12798 hours (533 days + 6 hours)
  When the command that caused the error occurred, the device was active or idle.

  After command completion occurred, registers were:
  ER -- ST COUNT  LBA_48  LH LM LL DV DC
  -- -- -- == -- == == == -- -- -- -- --
  40 -- 51 01 00 00 00 37 65 7d 40 40 08  Error: UNC at LBA = 0x37657d40 = 929398080

  Commands leading to the command that caused the error were:
  CR FEATR COUNT  LBA_48  LH LM LL DV DC  Powered_Up_Time  Command/Feature_Name
  -- == -- == -- == == == -- -- -- -- --  ---------------  --------------------
  60 00 00 01 00 00 00 37 65 7d 40 40 08 36d+04:06:07.040  READ FPDMA QUEUED
  60 00 03 01 00 00 00 37 65 7c 40 40 08 36d+04:06:07.040  READ FPDMA QUEUED
  60 00 00 01 00 00 00 37 65 7b 40 40 08 36d+04:06:07.040  READ FPDMA QUEUED
  60 00 00 01 00 00 00 37 65 7a 40 40 08 36d+04:06:07.040  READ FPDMA QUEUED
  60 00 00 01 00 00 00 37 65 79 40 40 08 36d+04:06:07.040  READ FPDMA QUEUED

Error 21413 [21412] occurred at disk power-on lifetime: 12798 hours (533 days + 6 hours)
  When the command that caused the error occurred, the device was active or idle.

  After command completion occurred, registers were:
  ER -- ST COUNT  LBA_48  LH LM LL DV DC
  -- -- -- == -- == == == -- -- -- -- --
  40 -- 51 00 08 00 00 02 b9 b0 58 40 08  Error: UNC at LBA = 0x02b9b058 = 45723736

  Commands leading to the command that caused the error were:
  CR FEATR COUNT  LBA_48  LH LM LL DV DC  Powered_Up_Time  Command/Feature_Name
  -- == -- == -- == == == -- -- -- -- --  ---------------  --------------------
  60 00 00 00 08 00 00 02 b9 b0 58 40 08 36d+04:04:07.040  READ FPDMA QUEUED
  60 00 00 01 00 00 00 06 65 41 40 40 08 36d+04:04:07.040  READ FPDMA QUEUED
  60 00 00 01 00 00 00 35 70 d4 40 40 08 36d+04:04:07.040  READ FPDMA QUEUED
  60 00 00 01 00 00 00 35 70 d5 40 40 08 36d+04:04:07.040  READ FPDMA QUEUED
  60 00 00 01 00 00 00 06 65 42 40 40 08 36d+04:04:07.040  READ FPDMA QUEUED

Error 21412 [21411] occurred at disk power-on lifetime: 12798 hours (533 days + 6 hours)
  When the command that caused the error occurred, the device was active or idle.

  After command completion occurred, registers were:
  ER -- ST COUNT  LBA_48  LH LM LL DV DC
  -- -- -- == -- == == == -- -- -- -- --
  40 -- 51 01 00 00 00 02 b9 b0 58 40 08  Error: UNC at LBA = 0x02b9b058 = 45723736

  Commands leading to the command that caused the error were:
  CR FEATR COUNT  LBA_48  LH LM LL DV DC  Powered_Up_Time  Command/Feature_Name
  -- == -- == -- == == == -- -- -- -- --  ---------------  --------------------
  60 00 00 01 00 00 00 06 65 41 40 40 08 36d+04:04:07.040  READ FPDMA QUEUED
  60 00 00 00 08 00 00 02 b9 b0 58 40 08 36d+04:04:07.040  READ FPDMA QUEUED
  60 00 00 01 00 00 00 06 65 40 40 40 08 36d+04:04:07.040  READ FPDMA QUEUED
  60 00 00 01 00 00 00 35 70 d3 40 40 08 36d+04:04:07.040  READ FPDMA QUEUED
  60 00 00 01 00 00 00 35 70 d2 40 40 08 36d+04:04:07.040  READ FPDMA QUEUED

SMART Extended Self-test Log Version: 1 (1 sectors)
Num  Test_Description    Status                  Remaining  LifeTime(hours)  LBA_of_first_error
# 1  Short offline       Completed: read failure       40%      9846         1023106056
# 2  Short offline       Completed without error       00%      9390         -
# 3  Vendor (0xff)       Completed without error       00%      4068         -
# 4  Vendor (0xff)       Completed without error       00%      2801         -
# 5  Vendor (0xff)       Completed without error       00%      1575         -

SMART Selective self-test log data structure revision number 1
 SPAN  MIN_LBA  MAX_LBA  CURRENT_TEST_STATUS
    1        0        0  Not_testing
    2        0        0  Not_testing
    3        0        0  Not_testing
    4        0        0  Not_testing
    5        0        0  Not_testing
Selective self-test flags (0x0):
  After scanning selected spans, do NOT read-scan remainder of disk.
If Selective self-test is pending on power-up, resume after 0 minute delay.

SCT Status Version:                  3
SCT Version (vendor specific):       1 (0x0001)
Device State:                        Active (0)
Current Temperature:                    40 Celsius
Power Cycle Min/Max Temperature:     30/40 Celsius
Lifetime    Min/Max Temperature:      9/60 Celsius
Under/Over Temperature Limit Count:   0/0

SCT Temperature History Version:     2
Temperature Sampling Period:         1 minute
Temperature Logging Interval:        1 minute
Min/Max recommended Temperature:      0/70 Celsius
Min/Max Temperature Limit:           -5/75 Celsius
Temperature History Size (Index):    478 (139)

SCT Error Recovery Control command not supported

Device Statistics (GP Log 0x04)
Page  Offset Size        Value Flags Description
0x01  =====  =               =  ===  == General Statistics (rev 1) ==
0x01  0x008  4            5043  ---  Lifetime Power-On Resets
0x01  0x010  4           13078  ---  Power-on Hours
0x01  0x018  6     21797910782  ---  Logical Sectors Written
0x01  0x020  6       105268339  ---  Number of Write Commands
0x01  0x028  6     17837753257  ---  Logical Sectors Read
0x01  0x030  6       191912424  ---  Number of Read Commands
0x04  =====  =               =  ===  == General Errors Statistics (rev 1) ==
0x04  0x008  4           21419  ---  Number of Reported Uncorrectable Errors
0x04  0x010  4            5957  ---  Resets Between Cmd Acceptance and Completion
0x05  =====  =               =  ===  == Temperature Statistics (rev 1) ==
0x05  0x008  1              40  ---  Current Temperature
0x05  0x010  1              41  ---  Average Short Term Temperature
0x05  0x018  1              40  ---  Average Long Term Temperature
0x05  0x020  1              60  ---  Highest Temperature
0x05  0x028  1               9  ---  Lowest Temperature
0x05  0x030  1              47  ---  Highest Average Short Term Temperature
0x05  0x038  1              35  ---  Lowest Average Short Term Temperature
0x05  0x040  1              40  ---  Highest Average Long Term Temperature
0x05  0x048  1              37  ---  Lowest Average Long Term Temperature
0x05  0x050  4               0  ---  Time in Over-Temperature
0x05  0x058  1              70  ---  Specified Maximum Operating Temperature
0x05  0x060  4               0  ---  Time in Under-Temperature
0x05  0x068  1               0  ---  Specified Minimum Operating Temperature
0x06  =====  =               =  ===  == Transport Statistics (rev 1) ==
0x06  0x008  4           30665  ---  Number of Hardware Resets
0x06  0x010  4            3191  ---  Number of ASR Events
0x06  0x018  4               7  ---  Number of Interface CRC Errors
0x07  =====  =               =  ===  == Solid State Device Statistics (rev 1) ==
0x07  0x008  1               3  N--  Percentage Used Endurance Indicator
                                |||_ C monitored condition met
                                ||__ D supports DSN
                                |___ N normalized value

Pending Defects log (GP Log 0x0c) not supported

SATA Phy Event Counters (GP Log 0x11)
ID      Size     Value  Description
0x0001  4            0  Command failed due to ICRC error
0x000a  4            7  Device-to-host register FISes sent due to a COMRESET

