smartctl 7.1 2020-04-05 r5049 [x86_64-linux-4.18.0-240.22.1.el8_3.x86_64] (local build)
Copyright (C) 2002-19, Bruce Allen, Christian Franke, www.smartmontools.org

=== START OF INFORMATION SECTION ===
Device Model:     HUH728080ALE601
Serial Number:    --
LU WWN Device Id: 5 000cca ...
Firmware Version: A4GL0003
User Capacity:    8,001,563,222,016 bytes [8.00 TB]
Sector Sizes:     512 bytes logical, 4096 bytes physical
Rotation Rate:    7200 rpm
Form Factor:      3.5 inches
Device is:        Not in smartctl database [for details use: -P showall]
ATA Version is:   ACS-2, ATA8-ACS T13/1699-D revision 4
SATA Version is:  SATA 3.1, 6.0 Gb/s (current: 6.0 Gb/s)
Local Time is:    Mon Nov 15 17:28:03 2021 EST
SMART support is: Available - device has SMART capability.
SMART support is: Enabled
AAM feature is:   Unavailable
APM feature is:   Disabled
Rd look-ahead is: Enabled
Write cache is:   Enabled
DSN feature is:   Unavailable
ATA Security is:  Disabled, NOT FROZEN [SEC1]
Write SCT (Get) Feature Control Command failed: scsi error aborted command
Wt Cache Reorder: Unknown (SCT Feature Control command failed)

=== START OF READ SMART DATA SECTION ===
SMART overall-health self-assessment test result: PASSED

General SMART Values:
Offline data collection status:  (0x82)	Offline data collection activity
					was completed without error.
					Auto Offline Data Collection: Enabled.
Self-test execution status:      (   0)	The previous self-test routine completed
					without error or no self-test has ever 
					been run.
Total time to complete Offline 
data collection: 		(  101) seconds.
Offline data collection
capabilities: 			 (0x5b) SMART execute Offline immediate.
					Auto Offline data collection on/off support.
					Suspend Offline collection upon new
					command.
					Offline surface scan supported.
					Self-test supported.
					No Conveyance Self-test supported.
					Selective Self-test supported.
SMART capabilities:            (0x0003)	Saves SMART data before entering
					power-saving mode.
					Supports SMART auto save timer.
Error logging capability:        (0x01)	Error logging supported.
					General Purpose Logging supported.
Short self-test routine 
recommended polling time: 	 (   1) minutes.
Extended self-test routine
recommended polling time: 	 (   1) minutes.
SCT capabilities: 	       (0x003d)	SCT Status supported.
					SCT Error Recovery Control supported.
					SCT Feature Control supported.
					SCT Data Table supported.

SMART Attributes Data Structure revision number: 16
Vendor Specific SMART Attributes with Thresholds:
ID# ATTRIBUTE_NAME          FLAGS    VALUE WORST THRESH FAIL RAW_VALUE
  1 Raw_Read_Error_Rate     PO-R--   100   100   016    -    0
  2 Throughput_Performance  P-S---   134   134   054    -    104
  3 Spin_Up_Time            POS---   253   253   024    -    0 (Average 133)
  4 Start_Stop_Count        -O--C-   100   100   000    -    156
  5 Reallocated_Sector_Ct   PO--CK   100   100   005    -    1
  7 Seek_Error_Rate         PO-R--   100   100   067    -    0
  8 Seek_Time_Performance   P-S---   140   140   020    -    15
  9 Power_On_Hours          -O--C-   095   095   000    -    38274
 10 Spin_Retry_Count        PO--C-   100   100   060    -    0
 12 Power_Cycle_Count       -O--CK   100   100   000    -    107
 22 Unknown_Attribute       PO---K   100   100   025    -    100
 45 Unknown_Attribute       PO---K   100   100   001    -    1095233372415
192 Power-Off_Retract_Count -O--CK   100   100   000    -    740
193 Load_Cycle_Count        -O--C-   100   100   000    -    740
194 Temperature_Celsius     -O----   187   187   000    -    32 (Min/Max 19/53)
196 Reallocated_Event_Count -O--CK   100   100   000    -    1
197 Current_Pending_Sector  -O---K   100   100   000    -    0
198 Offline_Uncorrectable   ---R--   100   100   000    -    0
199 UDMA_CRC_Error_Count    -O-R--   199   199   000    -    197
231 Temperature_Celsius     -O--CK   100   100   000    -    0
241 Total_LBAs_Written      -O--C-   100   100   000    -    1874040985343
242 Total_LBAs_Read         -O--C-   100   100   000    -    2262912959759
                            ||||||_ K auto-keep
                            |||||__ C event count
                            ||||___ R error rate
                            |||____ S speed/performance
                            ||_____ O updated online
                            |______ P prefailure warning

General Purpose Log Directory Version 1
SMART           Log Directory Version 1 [multi-sector log support]
Address    Access  R/W   Size  Description
0x00       GPL,SL  R/O      1  Log Directory
0x01           SL  R/O      1  Summary SMART error log
0x02           SL  R/O      1  Comprehensive SMART error log
0x03       GPL     R/O      1  Ext. Comprehensive SMART error log
0x04       GPL,SL  R/O      8  Device Statistics log
0x06           SL  R/O      1  SMART self-test log
0x07       GPL     R/O      1  Extended self-test log
0x08       GPL     R/O      2  Power Conditions log
0x09           SL  R/W      1  Selective self-test log
0x10       GPL     R/O      1  NCQ Command Error log
0x11       GPL     R/O      1  SATA Phy Event Counters log
0x12       GPL     R/O      1  SATA NCQ Non-Data log
0x13       GPL     R/O      1  SATA NCQ Send and Receive log
0x15       GPL     R/W      1  Rebuild Assist log
0x21       GPL     R/O      1  Write stream error log
0x22       GPL     R/O      1  Read stream error log
0x24       GPL     R/O    256  Current Device Internal Status Data log
0x25       GPL     R/O    256  Saved Device Internal Status Data log
0x30       GPL,SL  R/O      9  IDENTIFY DEVICE data log
0x80       GPL     R/W    688  Host vendor specific log
0x81-0x9f  GPL,SL  R/W     16  Host vendor specific log
0xb2       GPL     VS     688  Device vendor specific log
0xc8       GPL     VS      12  Device vendor specific log
0xe0       GPL,SL  R/W      1  SCT Command/Status
0xe1       GPL,SL  R/W      1  SCT Data Transfer

SMART Extended Comprehensive Error Log Version: 1 (1 sectors)
Device Error Count: 197 (device log contains only the most recent 4 errors)
	CR     = Command Register
	FEATR  = Features Register
	COUNT  = Count (was: Sector Count) Register
	LBA_48 = Upper bytes of LBA High/Mid/Low Registers ]  ATA-8
	LH     = LBA High (was: Cylinder High) Register    ]   LBA
	LM     = LBA Mid (was: Cylinder Low) Register      ] Register
	LL     = LBA Low (was: Sector Number) Register     ]
	DV     = Device (was: Device/Head) Register
	DC     = Device Control Register
	ER     = Error register
	ST     = Status register
Powered_Up_Time is measured from power on, and printed as
DDd+hh:mm:SS.sss where DD=days, hh=hours, mm=minutes,
SS=sec, and sss=millisec. It "wraps" after 49.710 days.

Error 197 [0] occurred at disk power-on lifetime: 38274 hours (1594 days + 18 hours)
  When the command that caused the error occurred, the device was active or idle.

  After command completion occurred, registers were:
  ER -- ST COUNT  LBA_48  LH LM LL DV DC
  -- -- -- == -- == == == -- -- -- -- --
  84 -- 53 00 00 00 00 00 00 00 00 00 00  Error: ABRT

  Commands leading to the command that caused the error were:
  CR FEATR COUNT  LBA_48  LH LM LL DV DC  Powered_Up_Time  Command/Feature_Name
  -- == -- == -- == == == -- -- -- -- --  ---------------  --------------------
  b0 00 d6 00 01 00 00 00 c2 4f e0 00 08     00:32:09.663  SMART WRITE LOG
  b0 00 d5 00 01 00 00 00 c2 4f e0 00 08     00:32:09.662  SMART READ LOG
  ec 00 00 00 01 00 00 00 00 00 00 00 08     00:32:09.650  IDENTIFY DEVICE
  ec 00 00 00 01 00 00 00 00 00 00 00 08     00:32:09.650  IDENTIFY DEVICE
  ec 00 00 00 01 00 00 00 00 00 00 40 08     00:31:02.217  IDENTIFY DEVICE

Error 196 [3] occurred at disk power-on lifetime: 38109 hours (1587 days + 21 hours)
  When the command that caused the error occurred, the device was active or idle.

  After command completion occurred, registers were:
  ER -- ST COUNT  LBA_48  LH LM LL DV DC
  -- -- -- == -- == == == -- -- -- -- --
  84 -- 53 05 30 00 00 00 00 2d 6f 40 00  Error: ICRC, ABRT 1328 sectors at LBA = 0x00002d6f = 11631

  Commands leading to the command that caused the error were:
  CR FEATR COUNT  LBA_48  LH LM LL DV DC  Powered_Up_Time  Command/Feature_Name
  -- == -- == -- == == == -- -- -- -- --  ---------------  --------------------
  25 00 00 0a 00 00 00 00 00 28 a0 e0 08     03:36:26.014  READ DMA EXT
  25 00 00 0a 00 00 00 00 00 1e a0 e0 08     03:36:26.010  READ DMA EXT
  25 00 00 08 00 00 00 00 00 16 a0 e0 08     03:36:26.008  READ DMA EXT
  25 00 00 04 00 00 00 00 00 12 a0 e0 08     03:36:26.006  READ DMA EXT
  25 00 00 02 00 00 00 00 00 10 a0 e0 08     03:36:26.005  READ DMA EXT

Error 195 [2] occurred at disk power-on lifetime: 38106 hours (1587 days + 18 hours)
  When the command that caused the error occurred, the device was active or idle.

  After command completion occurred, registers were:
  ER -- ST COUNT  LBA_48  LH LM LL DV DC
  -- -- -- == -- == == == -- -- -- -- --
  84 -- 43 00 00 00 00 00 00 00 00 00 00  Error: ICRC, ABRT at LBA = 0x00000000 = 0

  Commands leading to the command that caused the error were:
  CR FEATR COUNT  LBA_48  LH LM LL DV DC  Powered_Up_Time  Command/Feature_Name
  -- == -- == -- == == == -- -- -- -- --  ---------------  --------------------
  60 00 08 00 e8 00 00 00 00 00 08 40 08     00:09:09.337  READ FPDMA QUEUED
  60 00 08 00 e0 00 00 00 00 00 00 40 08     00:09:09.320  READ FPDMA QUEUED
  47 00 00 00 01 00 00 00 00 06 30 a0 08     00:09:09.254  READ LOG DMA EXT
  47 00 00 00 01 00 00 00 00 00 30 a0 08     00:09:09.254  READ LOG DMA EXT
  47 00 00 00 01 00 00 00 00 00 00 a0 08     00:09:09.254  READ LOG DMA EXT

Error 194 [1] occurred at disk power-on lifetime: 38005 hours (1583 days + 13 hours)
  When the command that caused the error occurred, the device was active or idle.

  After command completion occurred, registers were:
  ER -- ST COUNT  LBA_48  LH LM LL DV DC
  -- -- -- == -- == == == -- -- -- -- --
  84 -- 43 00 00 00 00 00 00 00 00 00 00  Error: ICRC, ABRT at LBA = 0x00000000 = 0

  Commands leading to the command that caused the error were:
  CR FEATR COUNT  LBA_48  LH LM LL DV DC  Powered_Up_Time  Command/Feature_Name
  -- == -- == -- == == == -- -- -- -- --  ---------------  --------------------
  61 05 40 00 d0 00 00 00 00 25 08 40 08  2d+18:25:18.857  WRITE FPDMA QUEUED
  60 00 08 00 08 00 03 a3 81 03 f0 40 08  2d+18:25:18.856  READ FPDMA QUEUED
  61 05 40 00 f8 00 00 00 00 1f c8 40 08  2d+18:25:18.856  WRITE FPDMA QUEUED
  61 05 40 00 e0 00 00 00 00 1a 88 40 08  2d+18:25:18.856  WRITE FPDMA QUEUED
  61 02 e0 00 d8 00 00 00 00 2a 48 40 08  2d+18:25:18.856  WRITE FPDMA QUEUED

SMART Extended Self-test Log Version: 1 (1 sectors)
Num  Test_Description    Status                  Remaining  LifeTime(hours)  LBA_of_first_error
# 1  Short offline       Completed without error       00%     37339         -
# 2  Short offline       Completed without error       00%     37337         -
# 3  Vendor (0x70)       Completed without error       00%     37285         -
# 4  Vendor (0x71)       Completed without error       00%     37285         -

SMART Selective self-test log data structure revision number 1
 SPAN  MIN_LBA  MAX_LBA  CURRENT_TEST_STATUS
    1        0        0  Not_testing
    2        0        0  Not_testing
    3        0        0  Not_testing
    4        0        0  Not_testing
    5        0        0  Not_testing
Selective self-test flags (0x0):
  After scanning selected spans, do NOT read-scan remainder of disk.
If Selective self-test is pending on power-up, resume after 0 minute delay.

SCT Status Version:                  3
SCT Version (vendor specific):       256 (0x0100)
Device State:                        Active (0)
Current Temperature:                    32 Celsius
Power Cycle Min/Max Temperature:     27/32 Celsius
Lifetime    Min/Max Temperature:     19/53 Celsius
Under/Over Temperature Limit Count:   0/0

Write SCT Data Table failed: scsi error aborted command
Read SCT Temperature History failed

Write SCT (Get) Error Recovery Control Command failed: scsi error aborted command
SCT (Get) Error Recovery Control command failed

Device Statistics (GP Log 0x04)
Page  Offset Size        Value Flags Description
0x01  =====  =               =  ===  == General Statistics (rev 2) ==
0x01  0x008  4             107  ---  Lifetime Power-On Resets
0x01  0x010  4           38274  ---  Power-on Hours
0x01  0x018  6   1874040985343  ---  Logical Sectors Written
0x01  0x020  6      2765440091  ---  Number of Write Commands
0x01  0x028  6   2262912959759  ---  Logical Sectors Read
0x01  0x030  6      3726854224  ---  Number of Read Commands
0x01  0x038  6    137788591900  ---  Date and Time TimeStamp
0x03  =====  =               =  ===  == Rotating Media Statistics (rev 1) ==
0x03  0x008  4           38245  ---  Spindle Motor Power-on Hours
0x03  0x010  4           38245  ---  Head Flying Hours
0x03  0x018  4             740  ---  Head Load Events
0x03  0x020  4               1  ---  Number of Reallocated Logical Sectors
0x03  0x028  4         1052513  ---  Read Recovery Attempts
0x03  0x030  4               0  ---  Number of Mechanical Start Failures
0x04  =====  =               =  ===  == General Errors Statistics (rev 1) ==
0x04  0x008  4               0  ---  Number of Reported Uncorrectable Errors
0x04  0x010  4            2419  ---  Resets Between Cmd Acceptance and Completion
0x05  =====  =               =  ===  == Temperature Statistics (rev 1) ==
0x05  0x008  1              32  ---  Current Temperature
0x05  0x010  1              34  N--  Average Short Term Temperature
0x05  0x018  1              35  N--  Average Long Term Temperature
0x05  0x020  1              53  ---  Highest Temperature
0x05  0x028  1              19  ---  Lowest Temperature
0x05  0x030  1              51  N--  Highest Average Short Term Temperature
0x05  0x038  1              25  N--  Lowest Average Short Term Temperature
0x05  0x040  1              49  N--  Highest Average Long Term Temperature
0x05  0x048  1              25  N--  Lowest Average Long Term Temperature
0x05  0x050  4               0  ---  Time in Over-Temperature
0x05  0x058  1              60  ---  Specified Maximum Operating Temperature
0x05  0x060  4               0  ---  Time in Under-Temperature
0x05  0x068  1               0  ---  Specified Minimum Operating Temperature
0x06  =====  =               =  ===  == Transport Statistics (rev 1) ==
0x06  0x008  4              17  ---  Number of Hardware Resets
0x06  0x010  4             242  ---  Number of ASR Events
0x06  0x018  4             199  ---  Number of Interface CRC Errors
                                |||_ C monitored condition met
                                ||__ D supports DSN
                                |___ N normalized value

Pending Defects log (GP Log 0x0c) not supported

SATA Phy Event Counters (GP Log 0x11)
ID      Size     Value  Description
0x0001  2            3  Command failed due to ICRC error
0x0002  2            3  R_ERR response for data FIS
0x0003  2            0  R_ERR response for device-to-host data FIS
0x0004  2            3  R_ERR response for host-to-device data FIS
0x0005  2           20  R_ERR response for non-data FIS
0x0006  2            0  R_ERR response for device-to-host non-data FIS
0x0007  2           20  R_ERR response for host-to-device non-data FIS
0x0008  2            0  Device-to-host non-data FIS retries
0x0009  2           16  Transition from drive PhyRdy to drive PhyNRdy
0x000a  2           16  Device-to-host register FISes sent due to a COMRESET
0x000b  2           23  CRC errors within host-to-device FIS
0x000d  2            0  Non-CRC errors within host-to-device FIS



