smartctl 7.3 2022-02-28 r5338 [x86_64-linux-6.2.6-desktop-1omv2390] (OpenMandriva Lx 7.3-3)
Copyright (C) 2002-22, Bruce Allen, Christian Franke, www.smartmontools.org

=== START OF INFORMATION SECTION ===
Model Family:     Seagate Barracuda 7200.14 (AF)
Device Model:     ST320DM000-1BD14C
Serial Number:    --
LU WWN Device Id: 5 000c50 ...
Firmware Version: KC45
User Capacity:    320,072,933,376 bytes [320 GB]
Sector Sizes:     512 bytes logical, 4096 bytes physical
Rotation Rate:    7200 rpm
Device is:        In smartctl database
ATA Version is:   ATA8-ACS T13/1699-D revision 4
SATA Version is:  SATA 3.0, 6.0 Gb/s (current: 3.0 Gb/s)
Local Time is:    Fri Mar 31 00:28:17 2023 MSK
SMART support is: Available - device has SMART capability.
SMART support is: Enabled
AAM level is:     208 (intermediate), recommended: 208
APM feature is:   Unavailable
Rd look-ahead is: Enabled
Write cache is:   Enabled
DSN feature is:   Unavailable
ATA Security is:  Disabled, frozen [SEC2]
Wt Cache Reorder: Enabled

=== START OF READ SMART DATA SECTION ===
SMART overall-health self-assessment test result: PASSED

General SMART Values:
Offline data collection status:  (0x82)	Offline data collection activity
					was completed without error.
					Auto Offline Data Collection: Enabled.
Self-test execution status:      (   0)	The previous self-test routine completed
					without error or no self-test has ever 
					been run.
Total time to complete Offline 
data collection: 		(  609) seconds.
Offline data collection
capabilities: 			 (0x7b) SMART execute Offline immediate.
					Auto Offline data collection on/off support.
					Suspend Offline collection upon new
					command.
					Offline surface scan supported.
					Self-test supported.
					Conveyance Self-test supported.
					Selective Self-test supported.
SMART capabilities:            (0x0003)	Saves SMART data before entering
					power-saving mode.
					Supports SMART auto save timer.
Error logging capability:        (0x01)	Error logging supported.
					General Purpose Logging supported.
Short self-test routine 
recommended polling time: 	 (   1) minutes.
Extended self-test routine
recommended polling time: 	 (  59) minutes.
Conveyance self-test routine
recommended polling time: 	 (   2) minutes.
SCT capabilities: 	       (0x303f)	SCT Status supported.
					SCT Error Recovery Control supported.
					SCT Feature Control supported.
					SCT Data Table supported.

SMART Attributes Data Structure revision number: 10
Vendor Specific SMART Attributes with Thresholds:
ID# ATTRIBUTE_NAME          FLAGS    VALUE WORST THRESH FAIL RAW_VALUE
  1 Raw_Read_Error_Rate     POSR--   102   099   006    -    4456760
  3 Spin_Up_Time            PO----   100   099   000    -    0
  4 Start_Stop_Count        -O--CK   096   096   020    -    4511
  5 Reallocated_Sector_Ct   PO--CK   093   093   036    -    2352
  7 Seek_Error_Rate         POSR--   073   060   030    -    30238621077
  9 Power_On_Hours          -O--CK   082   082   000    -    15798
 10 Spin_Retry_Count        PO--C-   100   100   097    -    0
 12 Power_Cycle_Count       -O--CK   096   096   020    -    4773
183 Runtime_Bad_Block       -O--CK   100   100   000    -    0
184 End-to-End_Error        -O--CK   100   100   099    -    0
187 Reported_Uncorrect      -O--CK   009   009   000    -    91
188 Command_Timeout         -O--CK   100   099   000    -    1 1 27
189 High_Fly_Writes         -O-RCK   100   100   000    -    0
190 Airflow_Temperature_Cel -O---K   068   050   045    -    32 (Min/Max 25/32)
194 Temperature_Celsius     -O---K   032   050   000    -    32 (0 9 0 0 0)
195 Hardware_ECC_Recovered  -O-RC-   052   036   000    -    4456760
197 Current_Pending_Sector  -O--C-   100   090   000    -    0
198 Offline_Uncorrectable   ----C-   100   090   000    -    0
199 UDMA_CRC_Error_Count    -OSRCK   200   194   000    -    2828
240 Head_Flying_Hours       ------   100   253   000    -    15565h+56m+56.142s
241 Total_LBAs_Written      ------   100   253   000    -    4156827955
242 Total_LBAs_Read         ------   100   253   000    -    28177522
                            ||||||_ K auto-keep
                            |||||__ C event count
                            ||||___ R error rate
                            |||____ S speed/performance
                            ||_____ O updated online
                            |______ P prefailure warning

General Purpose Log Directory Version 1
SMART           Log Directory Version 1 [multi-sector log support]
Address    Access  R/W   Size  Description
0x00       GPL,SL  R/O      1  Log Directory
0x01           SL  R/O      1  Summary SMART error log
0x02           SL  R/O      5  Comprehensive SMART error log
0x03       GPL     R/O      5  Ext. Comprehensive SMART error log
0x06           SL  R/O      1  SMART self-test log
0x07       GPL     R/O      1  Extended self-test log
0x09           SL  R/W      1  Selective self-test log
0x10       GPL     R/O      1  NCQ Command Error log
0x11       GPL     R/O      1  SATA Phy Event Counters log
0x21       GPL     R/O      1  Write stream error log
0x22       GPL     R/O      1  Read stream error log
0x80-0x9f  GPL,SL  R/W     16  Host vendor specific log
0xa1       GPL,SL  VS      20  Device vendor specific log
0xa2       GPL     VS    2248  Device vendor specific log
0xa8       GPL,SL  VS     129  Device vendor specific log
0xa9       GPL,SL  VS       1  Device vendor specific log
0xab       GPL     VS       1  Device vendor specific log
0xb0       GPL     VS    2928  Device vendor specific log
0xbd       GPL     VS     252  Device vendor specific log
0xbe-0xbf  GPL     VS   65535  Device vendor specific log
0xc0       GPL,SL  VS       1  Device vendor specific log
0xe0       GPL,SL  R/W      1  SCT Command/Status
0xe1       GPL,SL  R/W      1  SCT Data Transfer

SMART Extended Comprehensive Error Log Version: 1 (5 sectors)
Device Error Count: 90 (device log contains only the most recent 20 errors)
	CR     = Command Register
	FEATR  = Features Register
	COUNT  = Count (was: Sector Count) Register
	LBA_48 = Upper bytes of LBA High/Mid/Low Registers ]  ATA-8
	LH     = LBA High (was: Cylinder High) Register    ]   LBA
	LM     = LBA Mid (was: Cylinder Low) Register      ] Register
	LL     = LBA Low (was: Sector Number) Register     ]
	DV     = Device (was: Device/Head) Register
	DC     = Device Control Register
	ER     = Error register
	ST     = Status register
Powered_Up_Time is measured from power on, and printed as
DDd+hh:mm:SS.sss where DD=days, hh=hours, mm=minutes,
SS=sec, and sss=millisec. It "wraps" after 49.710 days.

Error 90 [9] occurred at disk power-on lifetime: 15197 hours (633 days + 5 hours)
  When the command that caused the error occurred, the device was active or idle.

  After command completion occurred, registers were:
  ER -- ST COUNT  LBA_48  LH LM LL DV DC
  -- -- -- == -- == == == -- -- -- -- --
  40 -- 51 00 00 00 00 01 ca 3b 80 00 00  Error: UNC at LBA = 0x01ca3b80 = 30030720

  Commands leading to the command that caused the error were:
  CR FEATR COUNT  LBA_48  LH LM LL DV DC  Powered_Up_Time  Command/Feature_Name
  -- == -- == -- == == == -- -- -- -- --  ---------------  --------------------
  60 00 00 00 c0 00 00 01 ca 3c 68 40 00     00:01:52.208  READ FPDMA QUEUED
  60 00 00 01 00 00 00 01 ca 3b 68 40 00     00:01:52.208  READ FPDMA QUEUED
  ea 00 00 00 00 00 00 00 00 00 00 a0 00     00:01:52.197  FLUSH CACHE EXT
  60 00 00 01 00 00 00 01 ca 3a 68 40 00     00:01:52.195  READ FPDMA QUEUED
  60 00 00 01 00 00 00 01 ca 39 68 40 00     00:01:52.194  READ FPDMA QUEUED

Error 89 [8] occurred at disk power-on lifetime: 15197 hours (633 days + 5 hours)
  When the command that caused the error occurred, the device was active or idle.

  After command completion occurred, registers were:
  ER -- ST COUNT  LBA_48  LH LM LL DV DC
  -- -- -- == -- == == == -- -- -- -- --
  40 -- 51 00 00 00 00 01 ca 24 38 00 00  Error: WP at LBA = 0x01ca2438 = 30024760

  Commands leading to the command that caused the error were:
  CR FEATR COUNT  LBA_48  LH LM LL DV DC  Powered_Up_Time  Command/Feature_Name
  -- == -- == -- == == == -- -- -- -- --  ---------------  --------------------
  61 00 00 00 20 00 00 05 d4 90 38 40 00     00:01:48.298  WRITE FPDMA QUEUED
  60 00 00 00 08 00 00 01 ca 24 38 40 00     00:01:48.297  READ FPDMA QUEUED
  27 00 00 00 00 00 00 00 00 00 00 e0 00     00:01:48.296  READ NATIVE MAX ADDRESS EXT [OBS-ACS-3]
  ec 00 00 00 00 00 00 00 00 00 00 a0 00     00:01:48.295  IDENTIFY DEVICE
  ef 00 03 00 46 00 00 00 00 00 00 a0 00     00:01:48.295  SET FEATURES [Set transfer mode]

Error 88 [7] occurred at disk power-on lifetime: 15197 hours (633 days + 5 hours)
  When the command that caused the error occurred, the device was active or idle.

  After command completion occurred, registers were:
  ER -- ST COUNT  LBA_48  LH LM LL DV DC
  -- -- -- == -- == == == -- -- -- -- --
  40 -- 51 00 00 00 00 01 ca 24 38 00 00  Error: UNC at LBA = 0x01ca2438 = 30024760

  Commands leading to the command that caused the error were:
  CR FEATR COUNT  LBA_48  LH LM LL DV DC  Powered_Up_Time  Command/Feature_Name
  -- == -- == -- == == == -- -- -- -- --  ---------------  --------------------
  60 00 00 00 08 00 00 01 ca 24 38 40 00     00:01:44.434  READ FPDMA QUEUED
  61 00 00 00 b0 00 00 03 04 28 30 40 00     00:01:44.434  WRITE FPDMA QUEUED
  27 00 00 00 00 00 00 00 00 00 00 e0 00     00:01:44.434  READ NATIVE MAX ADDRESS EXT [OBS-ACS-3]
  ec 00 00 00 00 00 00 00 00 00 00 a0 00     00:01:44.432  IDENTIFY DEVICE
  ef 00 10 00 06 00 00 00 00 00 00 00 00     00:01:44.432  SET FEATURES [Enable SATA feature]

Error 87 [6] occurred at disk power-on lifetime: 15197 hours (633 days + 5 hours)
  When the command that caused the error occurred, the device was active or idle.

  After command completion occurred, registers were:
  ER -- ST COUNT  LBA_48  LH LM LL DV DC
  -- -- -- == -- == == == -- -- -- -- --
  40 -- 51 00 00 00 00 01 ca 24 38 00 00  Error: UNC at LBA = 0x01ca2438 = 30024760

  Commands leading to the command that caused the error were:
  CR FEATR COUNT  LBA_48  LH LM LL DV DC  Powered_Up_Time  Command/Feature_Name
  -- == -- == -- == == == -- -- -- -- --  ---------------  --------------------
  60 00 00 00 08 00 00 01 ca 24 38 40 00     00:01:40.278  READ FPDMA QUEUED
  60 00 00 00 08 00 00 01 ca 24 30 40 00     00:01:40.278  READ FPDMA QUEUED
  60 00 00 00 08 00 00 01 ca 24 28 40 00     00:01:40.278  READ FPDMA QUEUED
  60 00 00 00 08 00 00 01 ca 24 20 40 00     00:01:40.277  READ FPDMA QUEUED
  60 00 00 00 08 00 00 01 ca 24 18 40 00     00:01:40.277  READ FPDMA QUEUED

Error 86 [5] occurred at disk power-on lifetime: 15197 hours (633 days + 5 hours)
  When the command that caused the error occurred, the device was active or idle.

  After command completion occurred, registers were:
  ER -- ST COUNT  LBA_48  LH LM LL DV DC
  -- -- -- == -- == == == -- -- -- -- --
  40 -- 51 00 00 00 00 01 ca 24 38 00 00  Error: UNC at LBA = 0x01ca2438 = 30024760

  Commands leading to the command that caused the error were:
  CR FEATR COUNT  LBA_48  LH LM LL DV DC  Powered_Up_Time  Command/Feature_Name
  -- == -- == -- == == == -- -- -- -- --  ---------------  --------------------
  60 00 00 01 00 00 00 01 ca 1b 00 40 00     00:01:36.029  READ FPDMA QUEUED
  60 00 00 01 00 00 00 01 ca 1a 00 40 00     00:01:36.026  READ FPDMA QUEUED
  60 00 00 01 00 00 00 01 c9 86 a8 40 00     00:01:35.997  READ FPDMA QUEUED
  60 00 00 01 00 00 00 01 c9 85 a8 40 00     00:01:35.996  READ FPDMA QUEUED
  60 00 00 01 00 00 00 00 7c 33 e8 40 00     00:01:35.974  READ FPDMA QUEUED

Error 85 [4] occurred at disk power-on lifetime: 15197 hours (633 days + 5 hours)
  When the command that caused the error occurred, the device was active or idle.

  After command completion occurred, registers were:
  ER -- ST COUNT  LBA_48  LH LM LL DV DC
  -- -- -- == -- == == == -- -- -- -- --
  40 -- 51 00 00 00 00 01 ca 34 30 00 00  Error: UNC at LBA = 0x01ca3430 = 30028848

  Commands leading to the command that caused the error were:
  CR FEATR COUNT  LBA_48  LH LM LL DV DC  Powered_Up_Time  Command/Feature_Name
  -- == -- == -- == == == -- -- -- -- --  ---------------  --------------------
  60 00 00 00 08 00 00 01 ca 34 30 40 00     00:01:31.513  READ FPDMA QUEUED
  61 00 00 00 08 00 00 05 d4 2e d0 40 00     00:01:31.513  WRITE FPDMA QUEUED
  61 00 00 00 08 00 00 03 04 27 f8 40 00     00:01:31.513  WRITE FPDMA QUEUED
  ea 00 00 00 00 00 00 00 00 00 00 a0 00     00:01:31.512  FLUSH CACHE EXT
  27 00 00 00 00 00 00 00 00 00 00 e0 00     00:01:31.512  READ NATIVE MAX ADDRESS EXT [OBS-ACS-3]

Error 84 [3] occurred at disk power-on lifetime: 15197 hours (633 days + 5 hours)
  When the command that caused the error occurred, the device was active or idle.

  After command completion occurred, registers were:
  ER -- ST COUNT  LBA_48  LH LM LL DV DC
  -- -- -- == -- == == == -- -- -- -- --
  40 -- 51 00 00 00 00 01 ca 34 30 00 00  Error: UNC at LBA = 0x01ca3430 = 30028848

  Commands leading to the command that caused the error were:
  CR FEATR COUNT  LBA_48  LH LM LL DV DC  Powered_Up_Time  Command/Feature_Name
  -- == -- == -- == == == -- -- -- -- --  ---------------  --------------------
  60 00 00 00 08 00 00 01 ca 34 30 40 00     00:01:27.602  READ FPDMA QUEUED
  61 00 00 00 08 00 00 05 d4 2d e0 40 00     00:01:27.601  WRITE FPDMA QUEUED
  60 00 00 00 08 00 00 01 ca 34 28 40 00     00:01:27.600  READ FPDMA QUEUED
  61 00 00 00 d0 00 00 03 04 27 28 40 00     00:01:27.600  WRITE FPDMA QUEUED
  60 00 00 00 08 00 00 01 ca 34 20 40 00     00:01:27.600  READ FPDMA QUEUED

Error 83 [2] occurred at disk power-on lifetime: 15197 hours (633 days + 5 hours)
  When the command that caused the error occurred, the device was active or idle.

  After command completion occurred, registers were:
  ER -- ST COUNT  LBA_48  LH LM LL DV DC
  -- -- -- == -- == == == -- -- -- -- --
  40 -- 51 00 00 00 00 01 ca 34 30 00 00  Error: UNC at LBA = 0x01ca3430 = 30028848

  Commands leading to the command that caused the error were:
  CR FEATR COUNT  LBA_48  LH LM LL DV DC  Powered_Up_Time  Command/Feature_Name
  -- == -- == -- == == == -- -- -- -- --  ---------------  --------------------
  60 00 00 00 e8 00 00 01 ca 34 18 40 00     00:01:23.444  READ FPDMA QUEUED
  60 00 00 00 08 00 00 01 c4 18 f0 40 00     00:01:23.437  READ FPDMA QUEUED
  60 00 00 00 08 00 00 01 c9 97 10 40 00     00:01:23.424  READ FPDMA QUEUED
  60 00 00 00 08 00 00 01 c6 12 f8 40 00     00:01:23.414  READ FPDMA QUEUED
  60 00 00 00 20 00 00 01 c4 18 c0 40 00     00:01:23.374  READ FPDMA QUEUED

SMART Extended Self-test Log Version: 1 (1 sectors)
Num  Test_Description    Status                  Remaining  LifeTime(hours)  LBA_of_first_error
# 1  Short offline       Completed without error       00%     15761         -

SMART Selective self-test log data structure revision number 1
 SPAN  MIN_LBA  MAX_LBA  CURRENT_TEST_STATUS
    1        0        0  Not_testing
    2        0        0  Not_testing
    3        0        0  Not_testing
    4        0        0  Not_testing
    5        0        0  Not_testing
Selective self-test flags (0x0):
  After scanning selected spans, do NOT read-scan remainder of disk.
If Selective self-test is pending on power-up, resume after 0 minute delay.

SCT Status Version:                  3
SCT Version (vendor specific):       522 (0x020a)
Device State:                        Active (0)
Current Temperature:                    32 Celsius
Power Cycle Min/Max Temperature:     25/32 Celsius
Lifetime    Min/Max Temperature:      9/49 Celsius
Under/Over Temperature Limit Count:   0/0

SCT Temperature History Version:     2
Temperature Sampling Period:         1 minute
Temperature Logging Interval:        59 minutes
Min/Max recommended Temperature:     14/55 Celsius
Min/Max Temperature Limit:           10/60 Celsius
Temperature History Size (Index):    128 (97)

SCT Error Recovery Control:
           Read: Disabled
          Write: Disabled

Device Statistics (GP/SMART Log 0x04) not supported

Pending Defects log (GP Log 0x0c) not supported

SATA Phy Event Counters (GP Log 0x11)
ID      Size     Value  Description
0x000a  2           13  Device-to-host register FISes sent due to a COMRESET
0x0001  2            0  Command failed due to ICRC error
0x0003  2            0  R_ERR response for device-to-host data FIS
0x0004  2            0  R_ERR response for host-to-device data FIS
0x0006  2            0  R_ERR response for device-to-host non-data FIS
0x0007  2            0  R_ERR response for host-to-device non-data FIS



