=== START OF INFORMATION SECTION ===
Model Family:     Seagate Barracuda 7200.14 (AF)
Device Model:     ST320DM000-1BD14C
Serial Number:    --
LU WWN Device Id: 5 000c50 ...
Firmware Version: KC45
User Capacity:    320 072 933 376 bytes [320 GB]
Sector Sizes:     512 bytes logical, 4096 bytes physical
Rotation Rate:    7200 rpm
Device is:        In smartctl database [for details use: -P show]
ATA Version is:   ATA8-ACS T13/1699-D revision 4
SATA Version is:  SATA 3.0, 6.0 Gb/s (current: 3.0 Gb/s)
Local Time is:    Sun Jun 17 16:57:03 2018 +10
SMART support is: Available - device has SMART capability.
SMART support is: Enabled
AAM feature is:   Disabled
APM feature is:   Unavailable
Rd look-ahead is: Enabled
Write cache is:   Enabled
ATA Security is:  Disabled, frozen [SEC2]
Wt Cache Reorder: Enabled

=== START OF READ SMART DATA SECTION ===
SMART overall-health self-assessment test result: PASSED

General SMART Values:
Offline data collection status:  (0x82)	Offline data collection activity
					was completed without error.
					Auto Offline Data Collection: Enabled.
Self-test execution status:      (   0)	The previous self-test routine completed
					without error or no self-test has ever 
					been run.
Total time to complete Offline 
data collection: 		(  617) seconds.
Offline data collection
capabilities: 			 (0x7b) SMART execute Offline immediate.
					Auto Offline data collection on/off support.
					Suspend Offline collection upon new
					command.
					Offline surface scan supported.
					Self-test supported.
					Conveyance Self-test supported.
					Selective Self-test supported.
SMART capabilities:            (0x0003)	Saves SMART data before entering
					power-saving mode.
					Supports SMART auto save timer.
Error logging capability:        (0x01)	Error logging supported.
					General Purpose Logging supported.
Short self-test routine 
recommended polling time: 	 (   1) minutes.
Extended self-test routine
recommended polling time: 	 (  59) minutes.
Conveyance self-test routine
recommended polling time: 	 (   2) minutes.
SCT capabilities: 	       (0x303f)	SCT Status supported.
					SCT Error Recovery Control supported.
					SCT Feature Control supported.
					SCT Data Table supported.

SMART Attributes Data Structure revision number: 10
Vendor Specific SMART Attributes with Thresholds:
ID# ATTRIBUTE_NAME          FLAGS    VALUE WORST THRESH FAIL RAW_VALUE
  1 Raw_Read_Error_Rate     POSR--   114   096   006    -    59249824
  3 Spin_Up_Time            PO----   100   097   000    -    0
  4 Start_Stop_Count        -O--CK   090   090   020    -    10361
  5 Reallocated_Sector_Ct   PO--CK   100   100   036    -    0
  7 Seek_Error_Rate         POSR--   075   060   030    -    30346115693
  9 Power_On_Hours          -O--CK   080   080   000    -    18008
 10 Spin_Retry_Count        PO--C-   100   100   097    -    0
 12 Power_Cycle_Count       -O--CK   095   095   020    -    5703
183 Runtime_Bad_Block       -O--CK   100   100   000    -    0
184 End-to-End_Error        -O--CK   100   100   099    -    0
187 Reported_Uncorrect      -O--CK   052   052   000    -    48
188 Command_Timeout         -O--CK   100   099   000    -    2 2 72
189 High_Fly_Writes         -O-RCK   100   100   000    -    0
190 Airflow_Temperature_Cel -O---K   064   052   045    -    36 (Min/Max 35/38)
194 Temperature_Celsius     -O---K   036   048   000    -    36 (0 12 0 0 0)
195 Hardware_ECC_Recovered  -O-RC-   057   040   000    -    59249824
197 Current_Pending_Sector  -O--C-   100   100   000    -    0
198 Offline_Uncorrectable   ----C-   100   100   000    -    0
199 UDMA_CRC_Error_Count    -OSRCK   200   200   000    -    0
240 Head_Flying_Hours       ------   100   253   000    -    18148h+12m+11.345s
241 Total_LBAs_Written      ------   100   253   000    -    583136749
242 Total_LBAs_Read         ------   100   253   000    -    4084033030
                            ||||||_ K auto-keep
                            |||||__ C event count
                            ||||___ R error rate
                            |||____ S speed/performance
                            ||_____ O updated online
                            |______ P prefailure warning

General Purpose Log Directory Version 1
SMART           Log Directory Version 1 [multi-sector log support]
Address    Access  R/W   Size  Description
0x00       GPL,SL  R/O      1  Log Directory
0x01           SL  R/O      1  Summary SMART error log
0x02           SL  R/O      5  Comprehensive SMART error log
0x03       GPL     R/O      5  Ext. Comprehensive SMART error log
0x06           SL  R/O      1  SMART self-test log
0x07       GPL     R/O      1  Extended self-test log
0x09           SL  R/W      1  Selective self-test log
0x10       GPL     R/O      1  SATA NCQ Queued Error log
0x11       GPL     R/O      1  SATA Phy Event Counters log
0x21       GPL     R/O      1  Write stream error log
0x22       GPL     R/O      1  Read stream error log
0x80-0x9f  GPL,SL  R/W     16  Host vendor specific log
0xa1       GPL,SL  VS      20  Device vendor specific log
0xa2       GPL     VS    2248  Device vendor specific log
0xa8       GPL,SL  VS     129  Device vendor specific log
0xa9       GPL,SL  VS       1  Device vendor specific log
0xab       GPL     VS       1  Device vendor specific log
0xb0       GPL     VS    2928  Device vendor specific log
0xbd       GPL     VS     252  Device vendor specific log
0xbe-0xbf  GPL     VS   65535  Device vendor specific log
0xc0       GPL,SL  VS       1  Device vendor specific log
0xe0       GPL,SL  R/W      1  SCT Command/Status
0xe1       GPL,SL  R/W      1  SCT Data Transfer

SMART Extended Comprehensive Error Log Version: 1 (5 sectors)
Device Error Count: 33 (device log contains only the most recent 20 errors)
	CR     = Command Register
	FEATR  = Features Register
	COUNT  = Count (was: Sector Count) Register
	LBA_48 = Upper bytes of LBA High/Mid/Low Registers ]  ATA-8
	LH     = LBA High (was: Cylinder High) Register    ]   LBA
	LM     = LBA Mid (was: Cylinder Low) Register      ] Register
	LL     = LBA Low (was: Sector Number) Register     ]
	DV     = Device (was: Device/Head) Register
	DC     = Device Control Register
	ER     = Error register
	ST     = Status register
Powered_Up_Time is measured from power on, and printed as
DDd+hh:mm:SS.sss where DD=days, hh=hours, mm=minutes,
SS=sec, and sss=millisec. It "wraps" after 49.710 days.

Error 33 [12] occurred at disk power-on lifetime: 6575 hours (273 days + 23 hours)
  When the command that caused the error occurred, the device was in an unknown state.

  After command completion occurred, registers were:
  ER -- ST COUNT  LBA_48  LH LM LL DV DC
  -- -- -- == -- == == == -- -- -- -- --
  40 -- 51 00 00 00 00 00 00 00 00 00 00  Error: 

  Commands leading to the command that caused the error were:
  CR FEATR COUNT  LBA_48  LH LM LL DV DC  Powered_Up_Time  Command/Feature_Name
  -- == -- == -- == == == -- -- -- -- --  ---------------  --------------------

Error 32 [11] occurred at disk power-on lifetime: 6575 hours (273 days + 23 hours)
  When the command that caused the error occurred, the device was in an unknown state.

  After command completion occurred, registers were:
  ER -- ST COUNT  LBA_48  LH LM LL DV DC
  -- -- -- == -- == == == -- -- -- -- --
  40 -- 51 00 00 00 00 00 00 00 00 00 00  Error: 

  Commands leading to the command that caused the error were:
  CR FEATR COUNT  LBA_48  LH LM LL DV DC  Powered_Up_Time  Command/Feature_Name
  -- == -- == -- == == == -- -- -- -- --  ---------------  --------------------

Error 31 [10] occurred at disk power-on lifetime: 6465 hours (269 days + 9 hours)
  When the command that caused the error occurred, the device was active or idle.

  After command completion occurred, registers were:
  ER -- ST COUNT  LBA_48  LH LM LL DV DC
  -- -- -- == -- == == == -- -- -- -- --
  40 -- 51 00 00 00 00 11 96 bc 80 00 00  Error: UNC at LBA = 0x1196bc80 = 295091328

  Commands leading to the command that caused the error were:
  CR FEATR COUNT  LBA_48  LH LM LL DV DC  Powered_Up_Time  Command/Feature_Name
  -- == -- == -- == == == -- -- -- -- --  ---------------  --------------------
  25 00 00 00 28 00 00 11 96 bc 60 e0 00     00:55:47.024  READ DMA EXT
  35 00 00 01 00 00 00 01 38 38 c8 e0 00     00:55:47.021  WRITE DMA EXT
  35 00 00 01 00 00 00 01 38 37 c8 e0 00     00:55:47.018  WRITE DMA EXT
  35 00 00 01 00 00 00 01 38 36 c8 e0 00     00:55:47.017  WRITE DMA EXT
  35 00 00 01 00 00 00 01 38 35 c8 e0 00     00:55:47.016  WRITE DMA EXT

Error 30 [9] occurred at disk power-on lifetime: 6465 hours (269 days + 9 hours)
  When the command that caused the error occurred, the device was active or idle.

  After command completion occurred, registers were:
  ER -- ST COUNT  LBA_48  LH LM LL DV DC
  -- -- -- == -- == == == -- -- -- -- --
  40 -- 51 00 00 00 00 11 96 bc 80 00 00  Error: UNC at LBA = 0x1196bc80 = 295091328

  Commands leading to the command that caused the error were:
  CR FEATR COUNT  LBA_48  LH LM LL DV DC  Powered_Up_Time  Command/Feature_Name
  -- == -- == -- == == == -- -- -- -- --  ---------------  --------------------
  25 00 00 00 28 00 00 11 96 bc 60 e0 00     00:55:43.252  READ DMA EXT
  35 00 00 00 08 00 00 03 07 e3 b0 e0 00     00:55:43.250  WRITE DMA EXT
  35 00 00 01 00 00 00 01 38 2c c8 e0 00     00:55:43.250  WRITE DMA EXT
  35 00 00 01 00 00 00 01 38 2b c8 e0 00     00:55:43.249  WRITE DMA EXT
  35 00 00 01 00 00 00 01 38 2a c8 e0 00     00:55:43.248  WRITE DMA EXT

Error 29 [8] occurred at disk power-on lifetime: 6465 hours (269 days + 9 hours)
  When the command that caused the error occurred, the device was active or idle.

  After command completion occurred, registers were:
  ER -- ST COUNT  LBA_48  LH LM LL DV DC
  -- -- -- == -- == == == -- -- -- -- --
  40 -- 51 00 00 00 00 11 96 bc 80 00 00  Error: UNC at LBA = 0x1196bc80 = 295091328

  Commands leading to the command that caused the error were:
  CR FEATR COUNT  LBA_48  LH LM LL DV DC  Powered_Up_Time  Command/Feature_Name
  -- == -- == -- == == == -- -- -- -- --  ---------------  --------------------
  25 00 00 00 68 00 00 11 96 bc 20 e0 00     00:55:39.196  READ DMA EXT
  35 00 00 00 08 00 00 03 b5 2a 80 e0 00     00:55:39.195  WRITE DMA EXT
  35 00 00 01 00 00 00 01 38 08 c8 e0 00     00:55:39.193  WRITE DMA EXT
  35 00 00 01 00 00 00 01 38 07 c8 e0 00     00:55:39.183  WRITE DMA EXT
  35 00 00 01 00 00 00 01 38 06 c8 e0 00     00:55:39.183  WRITE DMA EXT

Error 28 [7] occurred at disk power-on lifetime: 6465 hours (269 days + 9 hours)
  When the command that caused the error occurred, the device was active or idle.

  After command completion occurred, registers were:
  ER -- ST COUNT  LBA_48  LH LM LL DV DC
  -- -- -- == -- == == == -- -- -- -- --
  40 -- 51 00 00 00 00 11 96 bc 80 00 00  Error: UNC at LBA = 0x1196bc80 = 295091328

  Commands leading to the command that caused the error were:
  CR FEATR COUNT  LBA_48  LH LM LL DV DC  Powered_Up_Time  Command/Feature_Name
  -- == -- == -- == == == -- -- -- -- --  ---------------  --------------------
  25 00 00 00 68 00 00 11 96 bc 20 e0 00     00:55:35.360  READ DMA EXT
  35 00 00 00 10 00 00 03 b5 2a d8 e0 00     00:55:35.359  WRITE DMA EXT
  35 00 00 01 00 00 00 01 37 f8 c8 e0 00     00:55:35.356  WRITE DMA EXT
  35 00 00 01 00 00 00 01 37 f7 c8 e0 00     00:55:35.351  WRITE DMA EXT
  35 00 00 01 00 00 00 01 37 f6 c8 e0 00     00:55:35.350  WRITE DMA EXT

Error 27 [6] occurred at disk power-on lifetime: 6465 hours (269 days + 9 hours)
  When the command that caused the error occurred, the device was active or idle.

  After command completion occurred, registers were:
  ER -- ST COUNT  LBA_48  LH LM LL DV DC
  -- -- -- == -- == == == -- -- -- -- --
  40 -- 51 00 00 00 00 11 96 bc 80 00 00  Error: UNC at LBA = 0x1196bc80 = 295091328

  Commands leading to the command that caused the error were:
  CR FEATR COUNT  LBA_48  LH LM LL DV DC  Powered_Up_Time  Command/Feature_Name
  -- == -- == -- == == == -- -- -- -- --  ---------------  --------------------
  25 00 00 00 68 00 00 11 96 bc 20 e0 00     00:55:31.339  READ DMA EXT
  35 00 00 01 00 00 00 01 37 e8 c8 e0 00     00:55:31.336  WRITE DMA EXT
  35 00 00 01 00 00 00 01 37 e7 c8 e0 00     00:55:31.327  WRITE DMA EXT
  35 00 00 01 00 00 00 01 37 e6 c8 e0 00     00:55:31.326  WRITE DMA EXT
  35 00 00 01 00 00 00 01 37 e5 c8 e0 00     00:55:31.325  WRITE DMA EXT

Error 26 [5] occurred at disk power-on lifetime: 6465 hours (269 days + 9 hours)
  When the command that caused the error occurred, the device was active or idle.

  After command completion occurred, registers were:
  ER -- ST COUNT  LBA_48  LH LM LL DV DC
  -- -- -- == -- == == == -- -- -- -- --
  40 -- 51 00 00 00 00 11 96 bc 80 00 00  Error: UNC at LBA = 0x1196bc80 = 295091328

  Commands leading to the command that caused the error were:
  CR FEATR COUNT  LBA_48  LH LM LL DV DC  Powered_Up_Time  Command/Feature_Name
  -- == -- == -- == == == -- -- -- -- --  ---------------  --------------------
  25 00 00 00 68 00 00 11 96 bc 20 e0 00     00:55:27.532  READ DMA EXT
  35 00 00 01 00 00 00 01 37 d8 c8 e0 00     00:55:27.529  WRITE DMA EXT
  35 00 00 01 00 00 00 01 37 d7 c8 e0 00     00:55:27.506  WRITE DMA EXT
  35 00 00 01 00 00 00 01 37 d6 c8 e0 00     00:55:27.505  WRITE DMA EXT
  35 00 00 01 00 00 00 01 37 d5 c8 e0 00     00:55:27.503  WRITE DMA EXT

SMART Extended Self-test Log Version: 1 (1 sectors)
Num  Test_Description    Status                  Remaining  LifeTime(hours)  LBA_of_first_error
# 1  Extended offline    Aborted by host               80%      1489         -

SMART Selective self-test log data structure revision number 1
 SPAN  MIN_LBA  MAX_LBA  CURRENT_TEST_STATUS
    1        0        0  Not_testing
    2        0        0  Not_testing
    3        0        0  Not_testing
    4        0        0  Not_testing
    5        0        0  Not_testing
Selective self-test flags (0x0):
  After scanning selected spans, do NOT read-scan remainder of disk.
If Selective self-test is pending on power-up, resume after 0 minute delay.

SCT Status Version:                  3
SCT Version (vendor specific):       522 (0x020a)
SCT Support Level:                   1
Device State:                        Active (0)
Current Temperature:                    36 Celsius
Power Cycle Min/Max Temperature:     35/38 Celsius
Lifetime    Min/Max Temperature:     12/48 Celsius
Under/Over Temperature Limit Count:   0/0

SCT Temperature History Version:     2
Temperature Sampling Period:         1 minute
Temperature Logging Interval:        59 minutes
Min/Max recommended Temperature:     14/55 Celsius
Min/Max Temperature Limit:           10/60 Celsius
Temperature History Size (Index):    128 (27)

SCT Error Recovery Control:
           Read: Disabled
          Write: Disabled

Device Statistics (GP/SMART Log 0x04) not supported

SATA Phy Event Counters (GP Log 0x11)
ID      Size     Value  Description
0x000a  2           18  Device-to-host register FISes sent due to a COMRESET
0x0001  2            0  Command failed due to ICRC error
0x0003  2            0  R_ERR response for device-to-host data FIS
0x0004  2            0  R_ERR response for host-to-device data FIS
0x0006  2            0  R_ERR response for device-to-host non-data FIS
0x0007  2            0  R_ERR response for host-to-device non-data FIS

