smartctl 7.2 2020-12-30 r5155 [x86_64-linux-5.16.7-desktop-1omv4003] (OpenMandriva Lx 7.2-2)
Copyright (C) 2002-20, Bruce Allen, Christian Franke, www.smartmontools.org

=== START OF INFORMATION SECTION ===
Model Family:     Seagate Barracuda 7200.10
Device Model:     ST3160215A
Serial Number:    --
Firmware Version: 3.AAD
User Capacity:    160,041,885,696 bytes [160 GB]
Sector Size:      512 bytes logical/physical
Device is:        In smartctl database [for details use: -P show]
ATA Version is:   ATA/ATAPI-7 (minor revision not indicated)
Local Time is:    Sun Feb 13 09:31:55 2022 GMT
SMART support is: Available - device has SMART capability.
SMART support is: Enabled
AAM feature is:   Unavailable
APM feature is:   Unavailable
Rd look-ahead is: Enabled
Write cache is:   Enabled
DSN feature is:   Unavailable
ATA Security is:  Disabled, frozen [SEC2]
Wt Cache Reorder: Unavailable

=== START OF READ SMART DATA SECTION ===
SMART overall-health self-assessment test result: FAILED!
Drive failure expected in less than 24 hours. SAVE ALL DATA.
See vendor-specific Attribute list for failed Attributes.

General SMART Values:
Offline data collection status:  (0x82)	Offline data collection activity
					was completed without error.
					Auto Offline Data Collection: Enabled.
Self-test execution status:      (  73)	The previous self-test completed having
					a test element that failed and the test
					element that failed is not known.
Total time to complete Offline 
data collection: 		(  430) seconds.
Offline data collection
capabilities: 			 (0x5b) SMART execute Offline immediate.
					Auto Offline data collection on/off support.
					Suspend Offline collection upon new
					command.
					Offline surface scan supported.
					Self-test supported.
					No Conveyance Self-test supported.
					Selective Self-test supported.
SMART capabilities:            (0x0003)	Saves SMART data before entering
					power-saving mode.
					Supports SMART auto save timer.
Error logging capability:        (0x01)	Error logging supported.
					General Purpose Logging supported.
Short self-test routine 
recommended polling time: 	 (   1) minutes.
Extended self-test routine
recommended polling time: 	 (  54) minutes.

SMART Attributes Data Structure revision number: 10
Vendor Specific SMART Attributes with Thresholds:
ID# ATTRIBUTE_NAME          FLAGS    VALUE WORST THRESH FAIL RAW_VALUE
  1 Raw_Read_Error_Rate     POSR--   117   082   006    -    138652227
  3 Spin_Up_Time            PO----   099   097   000    -    0
  4 Start_Stop_Count        -O--CK   092   092   020    -    8311
  5 Reallocated_Sector_Ct   PO--CK   001   001   036    NOW  28775
  7 Seek_Error_Rate         POSR--   081   060   030    -    143859713
  9 Power_On_Hours          -O--CK   092   092   000    -    7653
 10 Spin_Retry_Count        PO--C-   100   100   097    -    0
 12 Power_Cycle_Count       -O--CK   093   093   020    -    7236
187 Reported_Uncorrect      -O--CK   001   001   000    -    502
189 High_Fly_Writes         -O-RCK   100   100   000    -    0
190 Airflow_Temperature_Cel -O---K   057   032   045    Past 43 (Min/Max 43/43)
194 Temperature_Celsius     -O---K   043   068   000    -    43 (0 9 0 0 0)
195 Hardware_ECC_Recovered  -O-RC-   093   046   000    -    48418511
197 Current_Pending_Sector  -O--C-   002   002   000    -    2023
198 Offline_Uncorrectable   ----C-   002   002   000    -    2023
199 UDMA_CRC_Error_Count    -OSRCK   200   188   000    -    5198
200 Multi_Zone_Error_Rate   ------   100   253   000    -    0
202 Data_Address_Mark_Errs  -O--CK   100   253   000    -    0
                            ||||||_ K auto-keep
                            |||||__ C event count
                            ||||___ R error rate
                            |||____ S speed/performance
                            ||_____ O updated online
                            |______ P prefailure warning

General Purpose Log Directory Version 1
SMART           Log Directory Version 1 [multi-sector log support]
Address    Access  R/W   Size  Description
0x00       GPL,SL  R/O      1  Log Directory
0x01       GPL,SL  R/O      1  Summary SMART error log
0x02       GPL,SL  R/O      5  Comprehensive SMART error log
0x03       GPL,SL  R/O      5  Ext. Comprehensive SMART error log
0x06       GPL,SL  R/O      1  SMART self-test log
0x07       GPL,SL  R/O      1  Extended self-test log
0x09       GPL,SL  R/W      1  Selective self-test log
0x20       GPL,SL  R/O      1  Streaming performance log [OBS-8]
0x21       GPL,SL  R/O      1  Write stream error log
0x22       GPL,SL  R/O      1  Read stream error log
0x23       GPL,SL  R/O      1  Delayed sector log [OBS-8]
0x80-0x9f  GPL,SL  R/W     16  Host vendor specific log
0xa0       GPL,SL  VS       1  Device vendor specific log
0xa1       GPL,SL  VS      20  Device vendor specific log
0xa2       GPL,SL  VS     101  Device vendor specific log
0xa8       GPL,SL  VS      20  Device vendor specific log
0xa9       GPL,SL  VS       1  Device vendor specific log
0xe0       GPL,SL  R/W      1  SCT Command/Status
0xe1       GPL,SL  R/W      1  SCT Data Transfer
0xff       GPL     -    23552  Reserved

SMART Extended Comprehensive Error Log Version: 1 (5 sectors)
Device Error Count: 4969 (device log contains only the most recent 20 errors)
	CR     = Command Register
	FEATR  = Features Register
	COUNT  = Count (was: Sector Count) Register
	LBA_48 = Upper bytes of LBA High/Mid/Low Registers ]  ATA-8
	LH     = LBA High (was: Cylinder High) Register    ]   LBA
	LM     = LBA Mid (was: Cylinder Low) Register      ] Register
	LL     = LBA Low (was: Sector Number) Register     ]
	DV     = Device (was: Device/Head) Register
	DC     = Device Control Register
	ER     = Error register
	ST     = Status register
Powered_Up_Time is measured from power on, and printed as
DDd+hh:mm:SS.sss where DD=days, hh=hours, mm=minutes,
SS=sec, and sss=millisec. It "wraps" after 49.710 days.

Error 4969 [8] occurred at disk power-on lifetime: 7602 hours (316 days + 18 hours)
  When the command that caused the error occurred, the device was active or idle.

  After command completion occurred, registers were:
  ER -- ST COUNT  LBA_48  LH LM LL DV DC
  -- -- -- == -- == == == -- -- -- -- --
  84 -- 51 80 00 00 00 00 00 00 00 e0 00  Error: ICRC, ABRT 32768 sectors at LBA = 0x00000000 = 0

  Commands leading to the command that caused the error were:
  CR FEATR COUNT  LBA_48  LH LM LL DV DC  Powered_Up_Time  Command/Feature_Name
  -- == -- == -- == == == -- -- -- -- --  ---------------  --------------------
  c8 00 00 00 80 00 00 21 00 00 41 e0 00     00:07:09.883  READ DMA
  c8 00 00 00 01 00 00 21 00 00 40 e0 00     00:07:09.727  READ DMA
  c8 00 00 00 01 00 00 20 00 00 52 e0 00     00:07:08.671  READ DMA
  c8 00 00 00 68 00 00 20 00 00 d8 e0 00     00:07:08.671  READ DMA
  c8 00 00 00 06 00 00 20 00 00 d2 e0 00     00:07:08.670  READ DMA

Error 4968 [7] occurred at disk power-on lifetime: 7618 hours (317 days + 10 hours)
  When the command that caused the error occurred, the device was active or idle.

  After command completion occurred, registers were:
  ER -- ST COUNT  LBA_48  LH LM LL DV DC
  -- -- -- == -- == == == -- -- -- -- --
  84 -- 51 20 00 4f 00 00 00 00 00 e5 00  Error: ICRC, ABRT 8192 sectors at LBA = 0x4f0005000000 = 86861502480384

  Commands leading to the command that caused the error were:
  CR FEATR COUNT  LBA_48  LH LM LL DV DC  Powered_Up_Time  Command/Feature_Name
  -- == -- == -- == == == -- -- -- -- --  ---------------  --------------------
  c8 00 00 00 20 00 05 5f 00 4f 40 e5 00     00:16:15.603  READ DMA
  c8 00 00 00 3f 00 05 53 00 4f c1 e5 00     00:16:15.602  READ DMA
  c8 00 00 00 01 00 05 53 00 4f c0 e5 00     00:16:15.595  READ DMA
  c8 00 00 00 3f 00 05 52 00 4f 81 e5 00     00:16:15.593  READ DMA
  c8 00 00 00 01 00 05 52 00 4f 80 e5 00     00:16:15.589  READ DMA

Error 4967 [6] occurred at disk power-on lifetime: 7618 hours (317 days + 10 hours)
  When the command that caused the error occurred, the device was active or idle.

  After command completion occurred, registers were:
  ER -- ST COUNT  LBA_48  LH LM LL DV DC
  -- -- -- == -- == == == -- -- -- -- --
  84 -- 51 20 00 c0 00 00 00 00 00 e3 00  Error: ICRC, ABRT 8192 sectors at LBA = 0xc00003000000 = 211106282864640

  Commands leading to the command that caused the error were:
  CR FEATR COUNT  LBA_48  LH LM LL DV DC  Powered_Up_Time  Command/Feature_Name
  -- == -- == -- == == == -- -- -- -- --  ---------------  --------------------
  c8 00 00 00 20 00 03 9b 00 c0 40 e3 00     00:13:55.719  READ DMA
  c8 00 00 00 20 00 03 59 00 d9 00 e3 00     00:13:55.554  READ DMA
  c8 00 00 00 20 00 03 99 00 c0 40 e3 00     00:13:55.090  READ DMA
  c8 00 00 00 08 00 03 1c 00 c3 00 e3 00     00:13:55.089  READ DMA
  27 00 00 00 00 00 00 00 00 00 00 e0 00     00:13:55.087  READ NATIVE MAX ADDRESS EXT [OBS-ACS-3]

Error 4966 [5] occurred at disk power-on lifetime: 7618 hours (317 days + 10 hours)
  When the command that caused the error occurred, the device was active or idle.

  After command completion occurred, registers were:
  ER -- ST COUNT  LBA_48  LH LM LL DV DC
  -- -- -- == -- == == == -- -- -- -- --
  84 -- 51 20 00 c3 00 00 00 00 00 e3 00  Error: ICRC, ABRT 8192 sectors at LBA = 0xc30003000000 = 214404817747968

  Commands leading to the command that caused the error were:
  CR FEATR COUNT  LBA_48  LH LM LL DV DC  Powered_Up_Time  Command/Feature_Name
  -- == -- == -- == == == -- -- -- -- --  ---------------  --------------------
  c8 00 00 00 20 00 03 1c 00 c3 00 e3 00     00:13:54.929  READ DMA
  c8 00 00 00 3f 00 03 2c 00 ba c1 e3 00     00:13:54.924  READ DMA
  c8 00 00 00 01 00 03 2c 00 ba c0 e3 00     00:13:55.090  READ DMA
  c8 00 00 00 20 00 03 88 00 b7 40 e3 00     00:13:55.089  READ DMA
  c8 00 00 00 20 00 06 b2 00 36 80 e6 00     00:13:55.087  READ DMA

Error 4965 [4] occurred at disk power-on lifetime: 7602 hours (316 days + 18 hours)
  When the command that caused the error occurred, the device was active or idle.

  After command completion occurred, registers were:
  ER -- ST COUNT  LBA_48  LH LM LL DV DC
  -- -- -- == -- == == == -- -- -- -- --
  84 -- 51 80 00 00 00 00 00 00 00 e0 00  Error: ICRC, ABRT 32768 sectors at LBA = 0x00000000 = 0

  Commands leading to the command that caused the error were:
  CR FEATR COUNT  LBA_48  LH LM LL DV DC  Powered_Up_Time  Command/Feature_Name
  -- == -- == -- == == == -- -- -- -- --  ---------------  --------------------
  c8 00 00 00 80 00 00 21 00 00 41 e0 00     00:07:09.883  READ DMA
  c8 00 00 00 01 00 00 21 00 00 40 e0 00     00:07:09.727  READ DMA
  c8 00 00 00 01 00 00 20 00 00 52 e0 00     00:07:08.671  READ DMA
  c8 00 00 00 68 00 00 20 00 00 d8 e0 00     00:07:08.671  READ DMA
  c8 00 00 00 06 00 00 20 00 00 d2 e0 00     00:07:08.670  READ DMA

Error 4964 [3] occurred at disk power-on lifetime: 7618 hours (317 days + 10 hours)
  When the command that caused the error occurred, the device was active or idle.

  After command completion occurred, registers were:
  ER -- ST COUNT  LBA_48  LH LM LL DV DC
  -- -- -- == -- == == == -- -- -- -- --
  84 -- 51 20 00 4f 00 00 00 00 00 e5 00  Error: ICRC, ABRT 8192 sectors at LBA = 0x4f0005000000 = 86861502480384

  Commands leading to the command that caused the error were:
  CR FEATR COUNT  LBA_48  LH LM LL DV DC  Powered_Up_Time  Command/Feature_Name
  -- == -- == -- == == == -- -- -- -- --  ---------------  --------------------
  c8 00 00 00 20 00 05 5f 00 4f 40 e5 00     00:16:15.603  READ DMA
  c8 00 00 00 3f 00 05 53 00 4f c1 e5 00     00:16:15.602  READ DMA
  c8 00 00 00 01 00 05 53 00 4f c0 e5 00     00:16:15.595  READ DMA
  c8 00 00 00 3f 00 05 52 00 4f 81 e5 00     00:16:15.593  READ DMA
  c8 00 00 00 01 00 05 52 00 4f 80 e5 00     00:16:15.589  READ DMA

Error 4963 [2] occurred at disk power-on lifetime: 7618 hours (317 days + 10 hours)
  When the command that caused the error occurred, the device was active or idle.

  After command completion occurred, registers were:
  ER -- ST COUNT  LBA_48  LH LM LL DV DC
  -- -- -- == -- == == == -- -- -- -- --
  84 -- 51 20 00 c0 00 00 00 00 00 e3 00  Error: ICRC, ABRT 8192 sectors at LBA = 0xc00003000000 = 211106282864640

  Commands leading to the command that caused the error were:
  CR FEATR COUNT  LBA_48  LH LM LL DV DC  Powered_Up_Time  Command/Feature_Name
  -- == -- == -- == == == -- -- -- -- --  ---------------  --------------------
  c8 00 00 00 20 00 03 9b 00 c0 40 e3 00     00:13:55.719  READ DMA
  c8 00 00 00 20 00 03 59 00 d9 00 e3 00     00:13:55.554  READ DMA
  c8 00 00 00 20 00 03 99 00 c0 40 e3 00     00:13:55.090  READ DMA
  c8 00 00 00 08 00 03 1c 00 c3 00 e3 00     00:13:55.089  READ DMA
  27 00 00 00 00 00 00 00 00 00 00 e0 00     00:13:55.087  READ NATIVE MAX ADDRESS EXT [OBS-ACS-3]

Error 4962 [1] occurred at disk power-on lifetime: 7618 hours (317 days + 10 hours)
  When the command that caused the error occurred, the device was active or idle.

  After command completion occurred, registers were:
  ER -- ST COUNT  LBA_48  LH LM LL DV DC
  -- -- -- == -- == == == -- -- -- -- --
  84 -- 51 20 00 c3 00 00 00 00 00 e3 00  Error: ICRC, ABRT 8192 sectors at LBA = 0xc30003000000 = 214404817747968

  Commands leading to the command that caused the error were:
  CR FEATR COUNT  LBA_48  LH LM LL DV DC  Powered_Up_Time  Command/Feature_Name
  -- == -- == -- == == == -- -- -- -- --  ---------------  --------------------
  c8 00 00 00 20 00 03 1c 00 c3 00 e3 00     00:13:54.929  READ DMA
  c8 00 00 00 3f 00 03 2c 00 ba c1 e3 00     00:13:54.924  READ DMA
  c8 00 00 00 01 00 03 2c 00 ba c0 e3 00     00:13:55.090  READ DMA
  c8 00 00 00 20 00 03 88 00 b7 40 e3 00     00:13:55.089  READ DMA
  c8 00 00 00 20 00 06 b2 00 36 80 e6 00     00:13:55.087  READ DMA

SMART Extended Self-test Log Version: 1 (1 sectors)
Num  Test_Description    Status                  Remaining  LifeTime(hours)  LBA_of_first_error
# 1  Short offline       Completed: unknown failure    90%      7616         257844352906
# 2  Extended offline    Completed: unknown failure    90%      7612         13799777850908
# 3  Short offline       Completed: unknown failure    90%      7612         257731295797
# 4  Short offline       Completed: unknown failure    90%      7516         257870232752
# 5  Extended offline    Completed: unknown failure    90%      7516         13799852113813
# 6  Short offline       Completed: unknown failure    90%      7513         257827202485
# 7  Extended offline    Completed: unknown failure    90%      7466         13799813515828
# 8  Short offline       Completed: unknown failure    90%      7466         257722716451
# 9  Extended offline    Completed: unknown failure    90%      7454         13799816996784
#10  Extended offline    Completed: unknown failure    90%      7454         13799992464709
#11  Extended offline    Completed: unknown failure    90%      7454         13799962608146
#12  Extended offline    Completed: unknown failure    90%      7454         13799835989376
#13  Short offline       Completed: unknown failure    90%      7454         257810491813
#14  Short offline       Completed: unknown failure    90%      7451         257786193495
#15  Extended offline    Completed: unknown failure    90%      7416         13799936281528
#16  Extended offline    Completed: unknown failure    90%      7416         13800036114217
#17  Extended offline    Completed: unknown failure    90%      7386         13799965553781
#18  Extended offline    Completed: unknown failure    90%      7386         13799972596523
#19  Extended offline    Completed: unknown failure    90%      7386         13800011611495

SMART Selective self-test log data structure revision number 1
 SPAN  MIN_LBA  MAX_LBA  CURRENT_TEST_STATUS
    1        0        0  Not_testing
    2        0        0  Not_testing
    3        0        0  Not_testing
    4        0        0  Not_testing
    5        0        0  Not_testing
Selective self-test flags (0x0):
  After scanning selected spans, do NOT read-scan remainder of disk.
If Selective self-test is pending on power-up, resume after 0 minute delay.

SCT Commands not supported

Device Statistics (GP/SMART Log 0x04) not supported

Pending Defects log (GP Log 0x0c) not supported

SATA Phy Event Counters (GP Log 0x11) not supported



