=== START OF INFORMATION SECTION ===
Model Family:     Seagate Barracuda 7200.10
Device Model:     ST3160215A
Serial Number:    --
Firmware Version: 3.AAC
User Capacity:    160 040 803 840 bytes [160 GB]
Sector Size:      512 bytes logical/physical
Device is:        In smartctl database [for details use: -P show]
ATA Version is:   ATA/ATAPI-7 (minor revision not indicated)
Local Time is:    Sun Mar 27 18:30:39 2016 KRAT
SMART support is: Available - device has SMART capability.
SMART support is: Enabled
AAM feature is:   Unavailable
APM feature is:   Unavailable
Rd look-ahead is: Enabled
Write cache is:   Enabled
ATA Security is:  Disabled, frozen [SEC2]
Wt Cache Reorder: Unavailable

=== START OF READ SMART DATA SECTION ===
SMART overall-health self-assessment test result: PASSED

General SMART Values:
Offline data collection status:  (0x82)	Offline data collection activity
					was completed without error.
					Auto Offline Data Collection: Enabled.
Self-test execution status:      (   0)	The previous self-test routine completed
					without error or no self-test has ever 
					been run.
Total time to complete Offline 
data collection: 		(  430) seconds.
Offline data collection
capabilities: 			 (0x5b) SMART execute Offline immediate.
					Auto Offline data collection on/off support.
					Suspend Offline collection upon new
					command.
					Offline surface scan supported.
					Self-test supported.
					No Conveyance Self-test supported.
					Selective Self-test supported.
SMART capabilities:            (0x0003)	Saves SMART data before entering
					power-saving mode.
					Supports SMART auto save timer.
Error logging capability:        (0x01)	Error logging supported.
					General Purpose Logging supported.
Short self-test routine 
recommended polling time: 	 (   1) minutes.
Extended self-test routine
recommended polling time: 	 (  54) minutes.

SMART Attributes Data Structure revision number: 10
Vendor Specific SMART Attributes with Thresholds:
ID# ATTRIBUTE_NAME          FLAGS    VALUE WORST THRESH FAIL RAW_VALUE
  1 Raw_Read_Error_Rate     POSR--   117   093   006    -    128256046
  3 Spin_Up_Time            PO----   097   097   000    -    0
  4 Start_Stop_Count        -O--CK   094   094   020    -    6168
  5 Reallocated_Sector_Ct   PO--CK   100   100   036    -    0
  7 Seek_Error_Rate         POSR--   088   060   030    -    723756108
  9 Power_On_Hours          -O--CK   074   074   000    -    23526
 10 Spin_Retry_Count        PO--C-   100   100   097    -    0
 12 Power_Cycle_Count       -O--CK   095   095   020    -    5938
187 Reported_Uncorrect      -O--CK   100   100   000    -    0
189 High_Fly_Writes         -O-RCK   100   100   000    -    0
190 Airflow_Temperature_Cel -O---K   059   048   045    -    41 (Min/Max 40/41)
194 Temperature_Celsius     -O---K   041   052   000    -    41 (0 15 0 0 0)
195 Hardware_ECC_Recovered  -O-RC-   087   073   000    -    138508490
197 Current_Pending_Sector  -O--C-   100   100   000    -    0
198 Offline_Uncorrectable   ----C-   100   100   000    -    0
199 UDMA_CRC_Error_Count    -OSRCK   200   178   000    -    3122
200 Multi_Zone_Error_Rate   ------   100   253   000    -    0
202 Data_Address_Mark_Errs  -O--CK   100   253   000    -    0
                            ||||||_ K auto-keep
                            |||||__ C event count
                            ||||___ R error rate
                            |||____ S speed/performance
                            ||_____ O updated online
                            |______ P prefailure warning

General Purpose Log Directory Version 1
SMART           Log Directory Version 1 [multi-sector log support]
Address    Access  R/W   Size  Description
0x00       GPL,SL  R/O      1  Log Directory
0x01       GPL,SL  R/O      1  Summary SMART error log
0x02       GPL,SL  R/O      5  Comprehensive SMART error log
0x03       GPL,SL  R/O      5  Ext. Comprehensive SMART error log
0x06       GPL,SL  R/O      1  SMART self-test log
0x07       GPL,SL  R/O      1  Extended self-test log
0x09       GPL,SL  R/W      1  Selective self-test log
0x20       GPL,SL  R/O      1  Streaming performance log [OBS-8]
0x21       GPL,SL  R/O      1  Write stream error log
0x22       GPL,SL  R/O      1  Read stream error log
0x23       GPL,SL  R/O      1  Delayed sector log [OBS-8]
0x80-0x9f  GPL,SL  R/W     16  Host vendor specific log
0xa0       GPL,SL  VS       1  Device vendor specific log
0xa1       GPL,SL  VS      20  Device vendor specific log
0xa2       GPL,SL  VS     101  Device vendor specific log
0xa8       GPL,SL  VS      20  Device vendor specific log
0xa9       GPL,SL  VS       1  Device vendor specific log
0xe0       GPL,SL  R/W      1  SCT Command/Status
0xe1       GPL,SL  R/W      1  SCT Data Transfer
0xff       GPL     -    23552  Reserved

SMART Extended Comprehensive Error Log Version: 1 (5 sectors)
Device Error Count: 3376 (device log contains only the most recent 20 errors)
	CR     = Command Register
	FEATR  = Features Register
	COUNT  = Count (was: Sector Count) Register
	LBA_48 = Upper bytes of LBA High/Mid/Low Registers ]  ATA-8
	LH     = LBA High (was: Cylinder High) Register    ]   LBA
	LM     = LBA Mid (was: Cylinder Low) Register      ] Register
	LL     = LBA Low (was: Sector Number) Register     ]
	DV     = Device (was: Device/Head) Register
	DC     = Device Control Register
	ER     = Error register
	ST     = Status register
Powered_Up_Time is measured from power on, and printed as
DDd+hh:mm:SS.sss where DD=days, hh=hours, mm=minutes,
SS=sec, and sss=millisec. It "wraps" after 49.710 days.

Error 3376 [15] occurred at disk power-on lifetime: 9879 hours (411 days + 15 hours)
  When the command that caused the error occurred, the device was active or idle.

  After command completion occurred, registers were:
  ER -- ST COUNT  LBA_48  LH LM LL DV DC
  -- -- -- == -- == == == -- -- -- -- --
  84 -- 51 01 01 00 00 00 00 00 00 b0 00  Error: ICRC, ABRT 257 sectors at LBA = 0x00000000 = 0

  Commands leading to the command that caused the error were:
  CR FEATR COUNT  LBA_48  LH LM LL DV DC  Powered_Up_Time  Command/Feature_Name
  -- == -- == -- == == == -- -- -- -- --  ---------------  --------------------
  c8 00 20 00 01 00 00 00 00 00 00 b0 00     00:00:08.717  READ DMA
  ef 00 03 00 42 00 00 3f 00 00 00 b0 00     00:00:07.537  SET FEATURES [Set transfer mode]
  ef 00 03 00 0c 00 00 3f 00 00 00 b0 00     00:00:06.999  SET FEATURES [Set transfer mode]
  c6 00 da 00 10 00 02 17 00 fd 10 b0 00     00:00:04.254  SET MULTIPLE MODE
  b0 00 da 01 00 00 02 17 00 fd 10 b0 00     09:10:38.209  SMART RETURN STATUS

Error 3375 [14] occurred at disk power-on lifetime: 9879 hours (411 days + 15 hours)
  When the command that caused the error occurred, the device was active or idle.

  After command completion occurred, registers were:
  ER -- ST COUNT  LBA_48  LH LM LL DV DC
  -- -- -- == -- == == == -- -- -- -- --
  84 -- 51 01 01 00 00 00 00 00 00 b0 00  Error: ICRC, ABRT 257 sectors at LBA = 0x00000000 = 0

  Commands leading to the command that caused the error were:
  CR FEATR COUNT  LBA_48  LH LM LL DV DC  Powered_Up_Time  Command/Feature_Name
  -- == -- == -- == == == -- -- -- -- --  ---------------  --------------------
  c8 00 20 00 01 00 00 00 00 00 00 b0 00     00:01:08.727  READ DMA
  ef 00 03 00 42 00 00 3f 00 00 00 b0 00     00:01:08.722  SET FEATURES [Set transfer mode]
  ef 00 03 00 0c 00 00 3f 00 00 00 b0 00     00:01:07.535  SET FEATURES [Set transfer mode]
  c6 00 da 00 10 00 02 17 00 fd 10 b0 00     00:01:06.991  SET MULTIPLE MODE
  b0 00 da 01 00 00 02 17 00 fd 10 b0 00     00:01:00.225  SMART RETURN STATUS

Error 3374 [13] occurred at disk power-on lifetime: 9879 hours (411 days + 15 hours)
  When the command that caused the error occurred, the device was active or idle.

  After command completion occurred, registers were:
  ER -- ST COUNT  LBA_48  LH LM LL DV DC
  -- -- -- == -- == == == -- -- -- -- --
  84 -- 51 01 01 00 00 00 00 00 00 b0 00  Error: ICRC, ABRT 257 sectors at LBA = 0x00000000 = 0

  Commands leading to the command that caused the error were:
  CR FEATR COUNT  LBA_48  LH LM LL DV DC  Powered_Up_Time  Command/Feature_Name
  -- == -- == -- == == == -- -- -- -- --  ---------------  --------------------
  c8 00 20 00 01 00 00 00 00 00 00 b0 00     00:00:44.919  READ DMA
  ef 00 03 00 42 00 00 3f 00 00 00 b0 00     00:00:44.919  SET FEATURES [Set transfer mode]
  ef 00 03 00 0c 00 00 3f 00 00 00 b0 00     00:00:44.913  SET FEATURES [Set transfer mode]
  c6 00 da 00 10 00 02 17 00 fd 10 b0 00     00:00:43.824  SET MULTIPLE MODE
  b0 00 da 01 00 00 02 17 00 fd 10 b0 00     00:00:43.790  SMART RETURN STATUS

Error 3373 [12] occurred at disk power-on lifetime: 9879 hours (411 days + 15 hours)
  When the command that caused the error occurred, the device was active or idle.

  After command completion occurred, registers were:
  ER -- ST COUNT  LBA_48  LH LM LL DV DC
  -- -- -- == -- == == == -- -- -- -- --
  84 -- 51 01 01 00 00 00 00 00 00 b0 00  Error: ICRC, ABRT 257 sectors at LBA = 0x00000000 = 0

  Commands leading to the command that caused the error were:
  CR FEATR COUNT  LBA_48  LH LM LL DV DC  Powered_Up_Time  Command/Feature_Name
  -- == -- == -- == == == -- -- -- -- --  ---------------  --------------------
  c8 00 20 00 01 00 00 00 00 00 00 b0 00     00:00:08.157  READ DMA
  ef 00 03 00 42 00 00 3f 00 00 00 b0 00     00:00:07.065  SET FEATURES [Set transfer mode]
  ef 00 03 00 0c 00 00 3f 00 00 00 b0 00     00:00:07.031  SET FEATURES [Set transfer mode]
  c6 00 da 00 10 00 02 17 00 fd 10 b0 00     00:00:04.229  SET MULTIPLE MODE
  b0 00 da 01 00 00 02 17 00 fd 10 b0 00     09:10:38.209  SMART RETURN STATUS

Error 3372 [11] occurred at disk power-on lifetime: 3167 hours (131 days + 23 hours)
  When the command that caused the error occurred, the device was active or idle.

  After command completion occurred, registers were:
  ER -- ST COUNT  LBA_48  LH LM LL DV DC
  -- -- -- == -- == == == -- -- -- -- --
  84 -- 51 00 00 00 00 00 00 00 00 e0 00  Error: ICRC, ABRT at LBA = 0x00000000 = 0

  Commands leading to the command that caused the error were:
  CR FEATR COUNT  LBA_48  LH LM LL DV DC  Powered_Up_Time  Command/Feature_Name
  -- == -- == -- == == == -- -- -- -- --  ---------------  --------------------
  25 00 00 00 08 00 00 de 00 61 cf e0 00     00:00:53.240  READ DMA EXT
  35 00 00 00 80 00 04 7d 00 4a e7 e0 00     00:00:53.058  WRITE DMA EXT
  35 00 00 00 80 00 04 7d 00 4a 67 e0 00     00:00:53.058  WRITE DMA EXT
  25 00 00 00 08 00 00 de 00 61 cf e0 00     00:00:53.058  READ DMA EXT
  35 00 00 00 08 00 00 00 00 5e 37 e0 00     00:00:52.775  WRITE DMA EXT

Error 3371 [10] occurred at disk power-on lifetime: 3167 hours (131 days + 23 hours)
  When the command that caused the error occurred, the device was active or idle.

  After command completion occurred, registers were:
  ER -- ST COUNT  LBA_48  LH LM LL DV DC
  -- -- -- == -- == == == -- -- -- -- --
  84 -- 51 00 00 00 00 00 00 00 00 e0 00  Error: ICRC, ABRT at LBA = 0x00000000 = 0

  Commands leading to the command that caused the error were:
  CR FEATR COUNT  LBA_48  LH LM LL DV DC  Powered_Up_Time  Command/Feature_Name
  -- == -- == -- == == == -- -- -- -- --  ---------------  --------------------
  25 00 00 00 08 00 00 de 00 61 cf e0 00     00:00:53.240  READ DMA EXT
  35 00 00 00 08 00 00 00 00 5e 37 e0 00     00:00:53.058  WRITE DMA EXT
  35 00 00 00 08 00 00 00 00 5e 3f e0 00     00:00:53.058  WRITE DMA EXT
  35 00 00 00 08 00 00 8a 00 5e 77 e0 00     00:00:53.058  WRITE DMA EXT
  25 00 00 00 01 00 00 00 00 00 00 e0 00     00:00:52.775  READ DMA EXT

Error 3370 [9] occurred at disk power-on lifetime: 3167 hours (131 days + 23 hours)
  When the command that caused the error occurred, the device was active or idle.

  After command completion occurred, registers were:
  ER -- ST COUNT  LBA_48  LH LM LL DV DC
  -- -- -- == -- == == == -- -- -- -- --
  84 -- 51 00 00 00 00 00 00 00 00 e0 00  Error: ICRC, ABRT at LBA = 0x00000000 = 0

  Commands leading to the command that caused the error were:
  CR FEATR COUNT  LBA_48  LH LM LL DV DC  Powered_Up_Time  Command/Feature_Name
  -- == -- == -- == == == -- -- -- -- --  ---------------  --------------------
  25 00 00 00 08 00 00 de 00 61 cf e0 00     00:00:51.350  READ DMA EXT
  25 00 00 00 01 00 00 00 00 00 00 e0 00     00:00:50.919  READ DMA EXT
  25 00 00 00 40 00 0c 6a 00 81 57 e0 00     00:00:50.458  READ DMA EXT
  35 00 00 00 80 00 04 7b 00 4a e7 e0 00     00:00:50.458  WRITE DMA EXT
  35 00 00 00 80 00 04 7b 00 4a 67 e0 00     00:00:50.457  WRITE DMA EXT

Error 3369 [8] occurred at disk power-on lifetime: 3167 hours (131 days + 23 hours)
  When the command that caused the error occurred, the device was active or idle.

  After command completion occurred, registers were:
  ER -- ST COUNT  LBA_48  LH LM LL DV DC
  -- -- -- == -- == == == -- -- -- -- --
  84 -- 51 00 00 00 00 00 00 00 00 e0 00  Error: ICRC, ABRT at LBA = 0x00000000 = 0

  Commands leading to the command that caused the error were:
  CR FEATR COUNT  LBA_48  LH LM LL DV DC  Powered_Up_Time  Command/Feature_Name
  -- == -- == -- == == == -- -- -- -- --  ---------------  --------------------
  25 00 00 00 40 00 0c 6a 00 81 57 e0 00     00:00:51.350  READ DMA EXT
  35 00 00 00 80 00 04 7b 00 4a e7 e0 00     00:00:50.919  WRITE DMA EXT
  35 00 00 00 80 00 04 7b 00 4a 67 e0 00     00:00:50.458  WRITE DMA EXT
  25 00 00 00 01 00 00 00 00 00 00 e0 00     00:00:50.458  READ DMA EXT
  25 00 00 00 01 00 00 00 00 00 00 e0 00     00:00:50.457  READ DMA EXT

SMART Extended Self-test Log Version: 1 (1 sectors)

SMART Selective self-test log data structure revision number 1
 SPAN  MIN_LBA  MAX_LBA  CURRENT_TEST_STATUS
    1        0        0  Not_testing
    2        0        0  Not_testing
    3        0        0  Not_testing
    4        0        0  Not_testing
    5        0        0  Not_testing
Selective self-test flags (0x0):
  After scanning selected spans, do NOT read-scan remainder of disk.
If Selective self-test is pending on power-up, resume after 0 minute delay.

SCT Commands not supported

Device Statistics (GP Log 0x04) not supported

SATA Phy Event Counters (GP Log 0x11) not supported

