smartctl 7.2 2020-12-30 r5155 [x86_64-linux-5.15.0-94-generic] (local build)
Copyright (C) 2002-20, Bruce Allen, Christian Franke, www.smartmontools.org

=== START OF INFORMATION SECTION ===
Model Family:     Seagate Barracuda 7200.9
Device Model:     ST3160212AS
Serial Number:    --
Firmware Version: 3.AAE
User Capacity:    160,041,885,696 bytes [160 GB]
Sector Size:      512 bytes logical/physical
Device is:        In smartctl database [for details use: -P show]
ATA Version is:   ATA/ATAPI-7 (minor revision not indicated)
Local Time is:    Sat Feb 17 09:22:26 2024 CET
SMART support is: Available - device has SMART capability.
SMART support is: Enabled
AAM feature is:   Unavailable
APM feature is:   Unavailable
Rd look-ahead is: Enabled
Write cache is:   Enabled
DSN feature is:   Unavailable
ATA Security is:  Disabled, frozen [SEC2]
Wt Cache Reorder: Unavailable

=== START OF READ SMART DATA SECTION ===
SMART overall-health self-assessment test result: PASSED
See vendor-specific Attribute list for marginal Attributes.

General SMART Values:
Offline data collection status:  (0x82)	Offline data collection activity
					was completed without error.
					Auto Offline Data Collection: Enabled.
Self-test execution status:      (   0)	The previous self-test routine completed
					without error or no self-test has ever 
					been run.
Total time to complete Offline 
data collection: 		(  430) seconds.
Offline data collection
capabilities: 			 (0x5b) SMART execute Offline immediate.
					Auto Offline data collection on/off support.
					Suspend Offline collection upon new
					command.
					Offline surface scan supported.
					Self-test supported.
					No Conveyance Self-test supported.
					Selective Self-test supported.
SMART capabilities:            (0x0003)	Saves SMART data before entering
					power-saving mode.
					Supports SMART auto save timer.
Error logging capability:        (0x01)	Error logging supported.
					General Purpose Logging supported.
Short self-test routine 
recommended polling time: 	 (   1) minutes.
Extended self-test routine
recommended polling time: 	 (  54) minutes.

SMART Attributes Data Structure revision number: 10
Vendor Specific SMART Attributes with Thresholds:
ID# ATTRIBUTE_NAME          FLAGS    VALUE WORST THRESH FAIL RAW_VALUE
  1 Raw_Read_Error_Rate     POSR--   115   070   006    -    91110548
  3 Spin_Up_Time            PO----   094   092   000    -    0
  4 Start_Stop_Count        -O--CK   082   082   020    -    18996
  5 Reallocated_Sector_Ct   PO--CK   100   100   036    -    12
  7 Seek_Error_Rate         POSR--   089   060   030    -    924954776
  9 Power_On_Hours          -O--CK   038   038   000    -    55066
 10 Spin_Retry_Count        PO--C-   100   099   097    -    0
 12 Power_Cycle_Count       -O--CK   086   086   020    -    14404
187 Reported_Uncorrect      -O--CK   001   001   000    -    1539
189 High_Fly_Writes         -O-RCK   014   014   000    -    86
190 Airflow_Temperature_Cel -O---K   069   038   045    Past 31 (1 101 31 11 0)
194 Temperature_Celsius     -O---K   031   062   000    -    31
195 Hardware_ECC_Recovered  -O-RC-   053   045   000    -    2446547
197 Current_Pending_Sector  -O--C-   100   001   000    -    2
198 Offline_Uncorrectable   ----C-   100   001   000    -    2
199 UDMA_CRC_Error_Count    -OSRCK   200   194   000    -    227
200 Multi_Zone_Error_Rate   ------   100   253   000    -    0
202 Data_Address_Mark_Errs  -O--CK   100   253   000    -    0
                            ||||||_ K auto-keep
                            |||||__ C event count
                            ||||___ R error rate
                            |||____ S speed/performance
                            ||_____ O updated online
                            |______ P prefailure warning

General Purpose Log Directory Version 1
SMART           Log Directory Version 1 [multi-sector log support]
Address    Access  R/W   Size  Description
0x00       GPL,SL  R/O      1  Log Directory
0x01       GPL,SL  R/O      1  Summary SMART error log
0x02       GPL,SL  R/O      5  Comprehensive SMART error log
0x03       GPL,SL  R/O      5  Ext. Comprehensive SMART error log
0x06       GPL,SL  R/O      1  SMART self-test log
0x07       GPL,SL  R/O      1  Extended self-test log
0x09       GPL,SL  R/W      1  Selective self-test log
0x10       GPL,SL  R/O      1  NCQ Command Error log
0x11       GPL,SL  R/O      1  SATA Phy Event Counters log
0x20       GPL,SL  R/O      1  Streaming performance log [OBS-8]
0x21       GPL,SL  R/O      1  Write stream error log
0x22       GPL,SL  R/O      1  Read stream error log
0x23       GPL,SL  R/O      1  Delayed sector log [OBS-8]
0x80-0x9f  GPL,SL  R/W     16  Host vendor specific log
0xa0       GPL,SL  VS       1  Device vendor specific log
0xa1       GPL,SL  VS      20  Device vendor specific log
0xa2       GPL,SL  VS     101  Device vendor specific log
0xa8       GPL,SL  VS      20  Device vendor specific log
0xa9       GPL,SL  VS       1  Device vendor specific log
0xe0       GPL,SL  R/W      1  SCT Command/Status
0xe1       GPL,SL  R/W      1  SCT Data Transfer
0xff       GPL     -    23040  Reserved

SMART Extended Comprehensive Error Log Version: 1 (5 sectors)
Device Error Count: 157 (device log contains only the most recent 20 errors)
	CR     = Command Register
	FEATR  = Features Register
	COUNT  = Count (was: Sector Count) Register
	LBA_48 = Upper bytes of LBA High/Mid/Low Registers ]  ATA-8
	LH     = LBA High (was: Cylinder High) Register    ]   LBA
	LM     = LBA Mid (was: Cylinder Low) Register      ] Register
	LL     = LBA Low (was: Sector Number) Register     ]
	DV     = Device (was: Device/Head) Register
	DC     = Device Control Register
	ER     = Error register
	ST     = Status register
Powered_Up_Time is measured from power on, and printed as
DDd+hh:mm:SS.sss where DD=days, hh=hours, mm=minutes,
SS=sec, and sss=millisec. It "wraps" after 49.710 days.

Error 157 [16] occurred at disk power-on lifetime: 45471 hours (1894 days + 15 hours)
  When the command that caused the error occurred, the device was active or idle.

  After command completion occurred, registers were:
  ER -- ST COUNT  LBA_48  LH LM LL DV DC
  -- -- -- == -- == == == -- -- -- -- --
  84 -- 51 00 0f 00 00 00 00 00 00 e0 00  Error: ICRC, ABRT 15 sectors at LBA = 0x00000000 = 0

  Commands leading to the command that caused the error were:
  CR FEATR COUNT  LBA_48  LH LM LL DV DC  Powered_Up_Time  Command/Feature_Name
  -- == -- == -- == == == -- -- -- -- --  ---------------  --------------------
  25 00 00 01 00 00 0a 02 00 5a 00 e0 00     00:25:51.945  READ DMA EXT
  29 00 00 01 00 00 0a 01 00 5a 00 e0 00     00:25:51.945  READ MULTIPLE EXT
  25 00 00 01 00 00 0a 01 00 5a 00 e0 00     00:25:51.597  READ DMA EXT
  25 00 00 01 00 00 0a 00 00 5a 00 e0 00     00:25:54.052  READ DMA EXT
  25 00 00 01 00 00 0a ff 00 59 00 e0 00     00:25:53.992  READ DMA EXT

Error 156 [15] occurred at disk power-on lifetime: 45471 hours (1894 days + 15 hours)
  When the command that caused the error occurred, the device was active or idle.

  After command completion occurred, registers were:
  ER -- ST COUNT  LBA_48  LH LM LL DV DC
  -- -- -- == -- == == == -- -- -- -- --
  84 -- 51 00 00 00 00 00 00 00 00 e0 00  Error: ABRT at LBA = 0x00000000 = 0

  Commands leading to the command that caused the error were:
  CR FEATR COUNT  LBA_48  LH LM LL DV DC  Powered_Up_Time  Command/Feature_Name
  -- == -- == -- == == == -- -- -- -- --  ---------------  --------------------
  29 00 00 01 00 00 0a 03 00 5a 00 e0 00     00:25:55.477  READ MULTIPLE EXT
  29 00 00 01 00 00 0a 02 00 5a 00 e0 00     00:25:54.976  READ MULTIPLE EXT
  25 00 00 01 00 00 0a 03 00 5a 00 e0 00     00:25:54.492  READ DMA EXT
  25 00 00 01 00 00 0a 02 00 5a 00 e0 00     00:25:54.052  READ DMA EXT
  29 00 00 01 00 00 0a 01 00 5a 00 e0 00     00:25:53.992  READ MULTIPLE EXT

Error 155 [14] occurred at disk power-on lifetime: 45471 hours (1894 days + 15 hours)
  When the command that caused the error occurred, the device was active or idle.

  After command completion occurred, registers were:
  ER -- ST COUNT  LBA_48  LH LM LL DV DC
  -- -- -- == -- == == == -- -- -- -- --
  84 -- 51 00 00 00 00 00 00 00 00 e0 00  Error: ABRT at LBA = 0x00000000 = 0

  Commands leading to the command that caused the error were:
  CR FEATR COUNT  LBA_48  LH LM LL DV DC  Powered_Up_Time  Command/Feature_Name
  -- == -- == -- == == == -- -- -- -- --  ---------------  --------------------
  29 00 00 01 00 00 0a 02 00 5a 00 e0 00     00:25:51.945  READ MULTIPLE EXT
  25 00 00 01 00 00 0a 03 00 5a 00 e0 00     00:25:54.976  READ DMA EXT
  25 00 00 01 00 00 0a 02 00 5a 00 e0 00     00:25:54.492  READ DMA EXT
  29 00 00 01 00 00 0a 01 00 5a 00 e0 00     00:25:54.052  READ MULTIPLE EXT
  25 00 00 01 00 00 0a 01 00 5a 00 e0 00     00:25:53.992  READ DMA EXT

Error 154 [13] occurred at disk power-on lifetime: 45471 hours (1894 days + 15 hours)
  When the command that caused the error occurred, the device was active or idle.

  After command completion occurred, registers were:
  ER -- ST COUNT  LBA_48  LH LM LL DV DC
  -- -- -- == -- == == == -- -- -- -- --
  84 -- 51 00 af 00 00 00 00 00 00 e0 00  Error: ICRC, ABRT 175 sectors at LBA = 0x00000000 = 0

  Commands leading to the command that caused the error were:
  CR FEATR COUNT  LBA_48  LH LM LL DV DC  Powered_Up_Time  Command/Feature_Name
  -- == -- == -- == == == -- -- -- -- --  ---------------  --------------------
  25 00 00 01 00 00 0a 03 00 5a 00 e0 00     00:25:51.945  READ DMA EXT
  25 00 00 01 00 00 0a 02 00 5a 00 e0 00     00:25:51.945  READ DMA EXT
  29 00 00 01 00 00 0a 01 00 5a 00 e0 00     00:25:54.492  READ MULTIPLE EXT
  25 00 00 01 00 00 0a 01 00 5a 00 e0 00     00:25:54.052  READ DMA EXT
  25 00 00 01 00 00 0a 00 00 5a 00 e0 00     00:25:53.992  READ DMA EXT

Error 153 [12] occurred at disk power-on lifetime: 45471 hours (1894 days + 15 hours)
  When the command that caused the error occurred, the device was active or idle.

  After command completion occurred, registers were:
  ER -- ST COUNT  LBA_48  LH LM LL DV DC
  -- -- -- == -- == == == -- -- -- -- --
  84 -- 51 00 0f 00 00 00 00 00 00 e0 00  Error: ICRC, ABRT 15 sectors at LBA = 0x00000000 = 0

  Commands leading to the command that caused the error were:
  CR FEATR COUNT  LBA_48  LH LM LL DV DC  Powered_Up_Time  Command/Feature_Name
  -- == -- == -- == == == -- -- -- -- --  ---------------  --------------------
  25 00 00 01 00 00 0a 02 00 5a 00 e0 00     00:25:51.945  READ DMA EXT
  29 00 00 01 00 00 0a 01 00 5a 00 e0 00     00:25:51.945  READ MULTIPLE EXT
  25 00 00 01 00 00 0a 01 00 5a 00 e0 00     00:25:51.597  READ DMA EXT
  25 00 00 01 00 00 0a 00 00 5a 00 e0 00     00:25:54.052  READ DMA EXT
  25 00 00 01 00 00 0a ff 00 59 00 e0 00     00:25:53.992  READ DMA EXT

Error 152 [11] occurred at disk power-on lifetime: 45471 hours (1894 days + 15 hours)
  When the command that caused the error occurred, the device was active or idle.

  After command completion occurred, registers were:
  ER -- ST COUNT  LBA_48  LH LM LL DV DC
  -- -- -- == -- == == == -- -- -- -- --
  84 -- 51 00 00 00 00 00 00 00 00 e0 00  Error: ABRT at LBA = 0x00000000 = 0

  Commands leading to the command that caused the error were:
  CR FEATR COUNT  LBA_48  LH LM LL DV DC  Powered_Up_Time  Command/Feature_Name
  -- == -- == -- == == == -- -- -- -- --  ---------------  --------------------
  29 00 00 01 00 00 0a 03 00 5a 00 e0 00     00:25:55.477  READ MULTIPLE EXT
  29 00 00 01 00 00 0a 02 00 5a 00 e0 00     00:25:54.976  READ MULTIPLE EXT
  25 00 00 01 00 00 0a 03 00 5a 00 e0 00     00:25:54.492  READ DMA EXT
  25 00 00 01 00 00 0a 02 00 5a 00 e0 00     00:25:54.052  READ DMA EXT
  29 00 00 01 00 00 0a 01 00 5a 00 e0 00     00:25:53.992  READ MULTIPLE EXT

Error 151 [10] occurred at disk power-on lifetime: 45471 hours (1894 days + 15 hours)
  When the command that caused the error occurred, the device was active or idle.

  After command completion occurred, registers were:
  ER -- ST COUNT  LBA_48  LH LM LL DV DC
  -- -- -- == -- == == == -- -- -- -- --
  84 -- 51 00 00 00 00 00 00 00 00 e0 00  Error: ABRT at LBA = 0x00000000 = 0

  Commands leading to the command that caused the error were:
  CR FEATR COUNT  LBA_48  LH LM LL DV DC  Powered_Up_Time  Command/Feature_Name
  -- == -- == -- == == == -- -- -- -- --  ---------------  --------------------
  29 00 00 01 00 00 0a 02 00 5a 00 e0 00     00:25:51.945  READ MULTIPLE EXT
  25 00 00 01 00 00 0a 03 00 5a 00 e0 00     00:25:54.976  READ DMA EXT
  25 00 00 01 00 00 0a 02 00 5a 00 e0 00     00:25:54.492  READ DMA EXT
  29 00 00 01 00 00 0a 01 00 5a 00 e0 00     00:25:54.052  READ MULTIPLE EXT
  25 00 00 01 00 00 0a 01 00 5a 00 e0 00     00:25:53.992  READ DMA EXT

Error 150 [9] occurred at disk power-on lifetime: 45471 hours (1894 days + 15 hours)
  When the command that caused the error occurred, the device was active or idle.

  After command completion occurred, registers were:
  ER -- ST COUNT  LBA_48  LH LM LL DV DC
  -- -- -- == -- == == == -- -- -- -- --
  84 -- 51 00 af 00 00 00 00 00 00 e0 00  Error: ICRC, ABRT 175 sectors at LBA = 0x00000000 = 0

  Commands leading to the command that caused the error were:
  CR FEATR COUNT  LBA_48  LH LM LL DV DC  Powered_Up_Time  Command/Feature_Name
  -- == -- == -- == == == -- -- -- -- --  ---------------  --------------------
  25 00 00 01 00 00 0a 03 00 5a 00 e0 00     00:25:51.945  READ DMA EXT
  25 00 00 01 00 00 0a 02 00 5a 00 e0 00     00:25:51.945  READ DMA EXT
  29 00 00 01 00 00 0a 01 00 5a 00 e0 00     00:25:54.492  READ MULTIPLE EXT
  25 00 00 01 00 00 0a 01 00 5a 00 e0 00     00:25:54.052  READ DMA EXT
  25 00 00 01 00 00 0a 00 00 5a 00 e0 00     00:25:53.992  READ DMA EXT

SMART Extended Self-test Log Version: 1 (1 sectors)
Num  Test_Description    Status                  Remaining  LifeTime(hours)  LBA_of_first_error
# 1  Short offline       Completed without error       00%     44873         -
# 2  Short offline       Completed without error       00%     32513         -
# 3  Short offline       Completed without error       00%     31838         -
# 4  Short offline       Completed without error       00%     16175         -
# 5  Short offline       Completed without error       00%      1533         -
# 6  Short offline       Completed without error       00%      1448         -
# 7  Short offline       Completed without error       00%      1400         -
# 8  Short offline       Completed without error       00%      1362         -
# 9  Short offline       Completed without error       00%      1362         -
#10  Short offline       Completed without error       00%      1360         -

SMART Selective self-test log data structure revision number 1
 SPAN  MIN_LBA  MAX_LBA  CURRENT_TEST_STATUS
    1        0        0  Not_testing
    2        0        0  Not_testing
    3        0        0  Not_testing
    4        0        0  Not_testing
    5        0        0  Not_testing
Selective self-test flags (0x0):
  After scanning selected spans, do NOT read-scan remainder of disk.
If Selective self-test is pending on power-up, resume after 0 minute delay.

SCT Commands not supported

Device Statistics (GP/SMART Log 0x04) not supported

Pending Defects log (GP Log 0x0c) not supported

SATA Phy Event Counters (GP Log 0x11)
ID      Size     Value  Description
0x000a  2            5  Device-to-host register FISes sent due to a COMRESET
0x0001  2            0  Command failed due to ICRC error
0x0003  2            0  R_ERR response for device-to-host data FIS
0x0004  2            0  R_ERR response for host-to-device data FIS
0x0006  2            0  R_ERR response for device-to-host non-data FIS
0x0007  2            0  R_ERR response for host-to-device non-data FIS

