smartctl 7.3 (build date Jul 25 2021) [x86_64-linux-5.15.12-051512-generic] (local build)
Copyright (C) 2002-21, Bruce Allen, Christian Franke, www.smartmontools.org

=== START OF INFORMATION SECTION ===
Model Family:     Hitachi/HGST Ultrastar 7K4000
Device Model:     HGST HUS724030ALA640
Serial Number:    --
LU WWN Device Id: 5 000cca ...
Firmware Version: MF8OAA70
User Capacity:    3,000,592,982,016 bytes [3.00 TB]
Sector Size:      512 bytes logical/physical
Rotation Rate:    7200 rpm
Form Factor:      3.5 inches
Device is:        In smartctl database
ATA Version is:   ATA8-ACS T13/1699-D revision 4
SATA Version is:  SATA 3.0, 6.0 Gb/s (current: 6.0 Gb/s)
Local Time is:    Tue Jan  4 23:42:04 2022 EET
SMART support is: Available - device has SMART capability.
SMART support is: Enabled
AAM feature is:   Unavailable
APM feature is:   Disabled
Rd look-ahead is: Enabled
Write cache is:   Enabled
DSN feature is:   Unavailable
ATA Security is:  Disabled, NOT FROZEN [SEC1]
Wt Cache Reorder: Enabled

=== START OF READ SMART DATA SECTION ===
SMART overall-health self-assessment test result: PASSED

General SMART Values:
Offline data collection status:  (0x80)	Offline data collection activity
					was never started.
					Auto Offline Data Collection: Enabled.
Self-test execution status:      (   0)	The previous self-test routine completed
					without error or no self-test has ever 
					been run.
Total time to complete Offline 
data collection: 		(   24) seconds.
Offline data collection
capabilities: 			 (0x5b) SMART execute Offline immediate.
					Auto Offline data collection on/off support.
					Suspend Offline collection upon new
					command.
					Offline surface scan supported.
					Self-test supported.
					No Conveyance Self-test supported.
					Selective Self-test supported.
SMART capabilities:            (0x0003)	Saves SMART data before entering
					power-saving mode.
					Supports SMART auto save timer.
Error logging capability:        (0x01)	Error logging supported.
					General Purpose Logging supported.
Short self-test routine 
recommended polling time: 	 (   1) minutes.
Extended self-test routine
recommended polling time: 	 ( 422) minutes.
SCT capabilities: 	       (0x003d)	SCT Status supported.
					SCT Error Recovery Control supported.
					SCT Feature Control supported.
					SCT Data Table supported.

SMART Attributes Data Structure revision number: 16
Vendor Specific SMART Attributes with Thresholds:
ID# ATTRIBUTE_NAME          FLAGS    VALUE WORST THRESH FAIL RAW_VALUE
  1 Raw_Read_Error_Rate     PO-R--   100   100   016    -    0
  2 Throughput_Performance  P-S---   137   137   054    -    78
  3 Spin_Up_Time            POS---   120   120   024    -    644 (Average 644)
  4 Start_Stop_Count        -O--C-   099   099   000    -    6922
  5 Reallocated_Sector_Ct   PO--CK   100   100   005    -    13
  7 Seek_Error_Rate         PO-R--   100   100   067    -    0
  8 Seek_Time_Performance   P-S---   140   140   020    -    26
  9 Power_On_Hours          -O--C-   098   098   000    -    19495
 10 Spin_Retry_Count        PO--C-   100   100   060    -    0
 12 Power_Cycle_Count       -O--CK   099   099   000    -    5557
192 Power-Off_Retract_Count -O--CK   089   089   000    -    13372
193 Load_Cycle_Count        -O--C-   089   089   000    -    13375
194 Temperature_Celsius     -O----   150   150   000    -    40 (Min/Max 14/59)
196 Reallocated_Event_Count -O--CK   100   100   000    -    21
197 Current_Pending_Sector  -O---K   100   100   000    -    0
198 Offline_Uncorrectable   ---R--   100   100   000    -    0
199 UDMA_CRC_Error_Count    -O-R--   200   200   000    -    2088
                            ||||||_ K auto-keep
                            |||||__ C event count
                            ||||___ R error rate
                            |||____ S speed/performance
                            ||_____ O updated online
                            |______ P prefailure warning

General Purpose Log Directory Version 1
SMART           Log Directory Version 1 [multi-sector log support]
Address    Access  R/W   Size  Description
0x00       GPL,SL  R/O      1  Log Directory
0x01           SL  R/O      1  Summary SMART error log
0x03       GPL     R/O      1  Ext. Comprehensive SMART error log
0x04       GPL     R/O      7  Device Statistics log
0x06           SL  R/O      1  SMART self-test log
0x07       GPL     R/O      1  Extended self-test log
0x08       GPL     R/O      2  Power Conditions log
0x09           SL  R/W      1  Selective self-test log
0x10       GPL     R/O      1  NCQ Command Error log
0x11       GPL     R/O      1  SATA Phy Event Counters log
0x20       GPL     R/O      1  Streaming performance log [OBS-8]
0x21       GPL     R/O      1  Write stream error log
0x22       GPL     R/O      1  Read stream error log
0x80-0x9f  GPL,SL  R/W     16  Host vendor specific log
0xe0       GPL,SL  R/W      1  SCT Command/Status
0xe1       GPL,SL  R/W      1  SCT Data Transfer

SMART Extended Comprehensive Error Log Version: 1 (1 sectors)
Device Error Count: 2088 (device log contains only the most recent 4 errors)
	CR     = Command Register
	FEATR  = Features Register
	COUNT  = Count (was: Sector Count) Register
	LBA_48 = Upper bytes of LBA High/Mid/Low Registers ]  ATA-8
	LH     = LBA High (was: Cylinder High) Register    ]   LBA
	LM     = LBA Mid (was: Cylinder Low) Register      ] Register
	LL     = LBA Low (was: Sector Number) Register     ]
	DV     = Device (was: Device/Head) Register
	DC     = Device Control Register
	ER     = Error register
	ST     = Status register
Powered_Up_Time is measured from power on, and printed as
DDd+hh:mm:SS.sss where DD=days, hh=hours, mm=minutes,
SS=sec, and sss=millisec. It "wraps" after 49.710 days.

Error 2088 [3] occurred at disk power-on lifetime: 11331 hours (472 days + 3 hours)
  When the command that caused the error occurred, the device was active or idle.

  After command completion occurred, registers were:
  ER -- ST COUNT  LBA_48  LH LM LL DV DC
  -- -- -- == -- == == == -- -- -- -- --
  84 -- 51 00 08 00 00 18 b2 bc 40 08 00  Error: ICRC, ABRT at LBA = 0x18b2bc40 = 414366784

  Commands leading to the command that caused the error were:
  CR FEATR COUNT  LBA_48  LH LM LL DV DC  Powered_Up_Time  Command/Feature_Name
  -- == -- == -- == == == -- -- -- -- --  ---------------  --------------------
  61 00 10 00 90 00 00 18 dd 5b 08 40 00  1d+21:34:00.124  WRITE FPDMA QUEUED
  61 00 08 00 88 00 00 18 b9 2e a0 40 00  1d+21:34:00.124  WRITE FPDMA QUEUED
  61 00 08 00 80 00 00 18 b9 2e 90 40 00  1d+21:34:00.124  WRITE FPDMA QUEUED
  61 00 48 00 78 00 00 18 b2 bc 90 40 00  1d+21:34:00.124  WRITE FPDMA QUEUED
  61 00 30 00 70 00 00 18 b2 bc 50 40 00  1d+21:34:00.124  WRITE FPDMA QUEUED

Error 2087 [2] occurred at disk power-on lifetime: 11331 hours (472 days + 3 hours)
  When the command that caused the error occurred, the device was active or idle.

  After command completion occurred, registers were:
  ER -- ST COUNT  LBA_48  LH LM LL DV DC
  -- -- -- == -- == == == -- -- -- -- --
  84 -- 51 00 10 00 00 3f 18 0c 98 0f 00  Error: ICRC, ABRT at LBA = 0x3f180c98 = 1058540696

  Commands leading to the command that caused the error were:
  CR FEATR COUNT  LBA_48  LH LM LL DV DC  Powered_Up_Time  Command/Feature_Name
  -- == -- == -- == == == -- -- -- -- --  ---------------  --------------------
  61 00 18 00 28 00 00 18 b2 bc 30 40 00  1d+21:33:59.785  WRITE FPDMA QUEUED
  61 00 30 00 20 00 00 18 b2 bc 50 40 00  1d+21:33:59.785  WRITE FPDMA QUEUED
  61 00 48 00 18 00 00 18 b2 bc 90 40 00  1d+21:33:59.785  WRITE FPDMA QUEUED
  61 00 08 00 10 00 00 18 b9 2e 90 40 00  1d+21:33:59.785  WRITE FPDMA QUEUED
  61 00 08 00 08 00 00 18 b9 2e a0 40 00  1d+21:33:59.785  WRITE FPDMA QUEUED

Error 2086 [1] occurred at disk power-on lifetime: 11331 hours (472 days + 3 hours)
  When the command that caused the error occurred, the device was active or idle.

  After command completion occurred, registers were:
  ER -- ST COUNT  LBA_48  LH LM LL DV DC
  -- -- -- == -- == == == -- -- -- -- --
  84 -- 51 00 08 00 00 18 b2 bc 40 08 00  Error: ICRC, ABRT at LBA = 0x18b2bc40 = 414366784

  Commands leading to the command that caused the error were:
  CR FEATR COUNT  LBA_48  LH LM LL DV DC  Powered_Up_Time  Command/Feature_Name
  -- == -- == -- == == == -- -- -- -- --  ---------------  --------------------
  61 00 08 00 98 00 00 3e fd d6 38 40 00  1d+21:33:59.441  WRITE FPDMA QUEUED
  61 00 08 00 90 00 00 3e fc ed 30 40 00  1d+21:33:59.441  WRITE FPDMA QUEUED
  61 00 10 00 88 00 00 18 dd 5b 08 40 00  1d+21:33:59.441  WRITE FPDMA QUEUED
  61 00 08 00 80 00 00 18 b9 2e a0 40 00  1d+21:33:59.441  WRITE FPDMA QUEUED
  61 00 08 00 78 00 00 18 b9 2e 90 40 00  1d+21:33:59.441  WRITE FPDMA QUEUED

Error 2085 [0] occurred at disk power-on lifetime: 11331 hours (472 days + 3 hours)
  When the command that caused the error occurred, the device was active or idle.

  After command completion occurred, registers were:
  ER -- ST COUNT  LBA_48  LH LM LL DV DC
  -- -- -- == -- == == == -- -- -- -- --
  84 -- 51 00 01 00 00 12 49 48 ef 02 00  Error: ICRC, ABRT at LBA = 0x124948ef = 306792687

  Commands leading to the command that caused the error were:
  CR FEATR COUNT  LBA_48  LH LM LL DV DC  Powered_Up_Time  Command/Feature_Name
  -- == -- == -- == == == -- -- -- -- --  ---------------  --------------------
  61 00 08 00 a8 00 00 91 42 d8 80 40 00  1d+21:25:15.902  WRITE FPDMA QUEUED
  61 00 08 00 a0 00 00 18 d0 bc 88 40 00  1d+21:25:15.902  WRITE FPDMA QUEUED
  61 00 08 00 98 00 00 18 ba 68 f8 40 00  1d+21:25:15.902  WRITE FPDMA QUEUED
  61 00 08 00 90 00 00 12 49 48 e8 40 00  1d+21:25:15.902  WRITE FPDMA QUEUED
  b0 00 da 00 00 00 00 00 c2 4f 00 00 00  1d+21:18:29.534  SMART RETURN STATUS

SMART Extended Self-test Log Version: 1 (1 sectors)
No self-tests have been logged.  [To run self-tests, use: smartctl -t]

SMART Selective self-test log data structure revision number 1
 SPAN  MIN_LBA  MAX_LBA  CURRENT_TEST_STATUS
    1        0        0  Not_testing
    2        0        0  Not_testing
    3        0        0  Not_testing
    4        0        0  Not_testing
    5        0        0  Not_testing
Selective self-test flags (0x0):
  After scanning selected spans, do NOT read-scan remainder of disk.
If Selective self-test is pending on power-up, resume after 0 minute delay.

SCT Status Version:                  3
SCT Version (vendor specific):       256 (0x0100)
Device State:                        Active (0)
Current Temperature:                    40 Celsius
Power Cycle Min/Max Temperature:     31/41 Celsius
Lifetime    Min/Max Temperature:     14/59 Celsius
Under/Over Temperature Limit Count:   0/0

SCT Temperature History Version:     2
Temperature Sampling Period:         1 minute
Temperature Logging Interval:        1 minute
Min/Max recommended Temperature:      0/60 Celsius
Min/Max Temperature Limit:           -40/70 Celsius
Temperature History Size (Index):    128 (23)

SCT Error Recovery Control:
           Read: Disabled
          Write: Disabled

Device Statistics (GP Log 0x04)
Page  Offset Size        Value Flags Description
0x01  =====  =               =  ===  == General Statistics (rev 2) ==
0x01  0x008  4            5557  ---  Lifetime Power-On Resets
0x01  0x018  6     47242358020  ---  Logical Sectors Written
0x01  0x020  6       287556237  ---  Number of Write Commands
0x01  0x028  6     57435026227  ---  Logical Sectors Read
0x01  0x030  6       519815814  ---  Number of Read Commands
0x03  =====  =               =  ===  == Rotating Media Statistics (rev 1) ==
0x03  0x008  4           17873  ---  Spindle Motor Power-on Hours
0x03  0x010  4           17872  ---  Head Flying Hours
0x03  0x018  4           13375  ---  Head Load Events
0x03  0x020  4              13  ---  Number of Reallocated Logical Sectors
0x03  0x028  4             250  ---  Read Recovery Attempts
0x03  0x030  4               0  ---  Number of Mechanical Start Failures
0x04  =====  =               =  ===  == General Errors Statistics (rev 1) ==
0x04  0x008  4               0  ---  Number of Reported Uncorrectable Errors
0x04  0x010  4             779  ---  Resets Between Cmd Acceptance and Completion
0x05  =====  =               =  ===  == Temperature Statistics (rev 1) ==
0x05  0x008  1              40  ---  Current Temperature
0x05  0x010  1              37  N--  Average Short Term Temperature
0x05  0x018  1              36  N--  Average Long Term Temperature
0x05  0x020  1              59  ---  Highest Temperature
0x05  0x028  1              14  ---  Lowest Temperature
0x05  0x030  1              54  N--  Highest Average Short Term Temperature
0x05  0x038  1              23  N--  Lowest Average Short Term Temperature
0x05  0x040  1              51  N--  Highest Average Long Term Temperature
0x05  0x048  1              25  N--  Lowest Average Long Term Temperature
0x05  0x050  4               0  ---  Time in Over-Temperature
0x05  0x058  1              60  ---  Specified Maximum Operating Temperature
0x05  0x060  4               0  ---  Time in Under-Temperature
0x05  0x068  1               0  ---  Specified Minimum Operating Temperature
0x06  =====  =               =  ===  == Transport Statistics (rev 1) ==
0x06  0x008  4          170914  ---  Number of Hardware Resets
0x06  0x010  4           17887  ---  Number of ASR Events
0x06  0x018  4            2088  ---  Number of Interface CRC Errors
                                |||_ C monitored condition met
                                ||__ D supports DSN
                                |___ N normalized value

Pending Defects log (GP Log 0x0c) not supported

SATA Phy Event Counters (GP Log 0x11)
ID      Size     Value  Description
0x0001  2            0  Command failed due to ICRC error
0x0002  2            0  R_ERR response for data FIS
0x0003  2            0  R_ERR response for device-to-host data FIS
0x0004  2            0  R_ERR response for host-to-device data FIS
0x0005  2            0  R_ERR response for non-data FIS
0x0006  2            0  R_ERR response for device-to-host non-data FIS
0x0007  2            0  R_ERR response for host-to-device non-data FIS
0x0009  2            3  Transition from drive PhyRdy to drive PhyNRdy
0x000a  2            0  Device-to-host register FISes sent due to a COMRESET
0x000b  2            0  CRC errors within host-to-device FIS
0x000d  2            0  Non-CRC errors within host-to-device FIS



