=== START OF INFORMATION SECTION ===
Model Family:     Maxtor DiamondMax D540X-4K
Device Model:     MAXTOR 4K040H2
Serial Number:    --
Firmware Version: A08.1500
User Capacity:    33,820,286,976 bytes [33.8 GB]
Sector Size:      512 bytes logical/physical
Device is:        In smartctl database [for details use: -P show]
ATA Version is:   ATA/ATAPI-5 T13/1321D revision 1
Local Time is:    Thu May  3 10:00:01 2018 +05
SMART support is: Available - device has SMART capability.
SMART support is: Enabled
AAM level is:     128 (quiet), recommended: 128
APM feature is:   Unavailable
Rd look-ahead is: Enabled
Write cache is:   Enabled
ATA Security is:  Disabled, frozen [SEC2]
Wt Cache Reorder: Unavailable

=== START OF READ SMART DATA SECTION ===
SMART overall-health self-assessment test result: PASSED

General SMART Values:
Offline data collection status:  (0x80)	Offline data collection activity
					was never started.
					Auto Offline Data Collection: Enabled.
Self-test execution status:      (   0)	The previous self-test routine completed
					without error or no self-test has ever 
					been run.
Total time to complete Offline 
data collection: 		(   44) seconds.
Offline data collection
capabilities: 			 (0x1b) SMART execute Offline immediate.
					Auto Offline data collection on/off support.
					Suspend Offline collection upon new
					command.
					Offline surface scan supported.
					Self-test supported.
					No Conveyance Self-test supported.
					No Selective Self-test supported.
SMART capabilities:            (0x0003)	Saves SMART data before entering
					power-saving mode.
					Supports SMART auto save timer.
Error logging capability:        (0x01)	Error logging supported.
					No General Purpose Logging support.
Short self-test routine 
recommended polling time: 	 (   2) minutes.
Extended self-test routine
recommended polling time: 	 (  22) minutes.

SMART Attributes Data Structure revision number: 11
Vendor Specific SMART Attributes with Thresholds:
ID# ATTRIBUTE_NAME          FLAGS    VALUE WORST THRESH FAIL RAW_VALUE
  1 Raw_Read_Error_Rate     P--R-K   100   253   020    -    0
  3 Spin_Up_Time            POS--K   087   084   020    -    1674
  4 Start_Stop_Count        -O--CK   092   092   008    -    5441
  5 Reallocated_Sector_Ct   PO--CK   095   091   020    -    28
  7 Seek_Error_Rate         PO-R--   100   093   023    -    0
  9 Power_On_Hours          -O--C-   090   090   001    -    7157
 10 Spin_Retry_Count        -OS--K   100   100   000    -    0
 11 Calibration_Retry_Count PO--C-   100   100   020    -    0
 12 Power_Cycle_Count       -O--CK   092   092   008    -    5322
 13 Read_Soft_Error_Rate    PO-R--   100   062   023    -    0
194 Temperature_Celsius     -O---K   088   084   042    -    32
195 Hardware_ECC_Recovered  -O-RC-   100   006   000    -    21699332
196 Reallocated_Event_Count ----C-   100   253   020    -    0
197 Current_Pending_Sector  -O--CK   100   097   020    -    0
198 Offline_Uncorrectable   ----C-   100   253   000    -    0
199 UDMA_CRC_Error_Count    -O-RC-   115   115   000    -    85
                            ||||||_ K auto-keep
                            |||||__ C event count
                            ||||___ R error rate
                            |||____ S speed/performance
                            ||_____ O updated online
                            |______ P prefailure warning

Read SMART Log Directory failed: scsi error badly formed scsi parameters

General Purpose Log Directory not supported

SMART Extended Comprehensive Error Log (GP Log 0x03) not supported

SMART Error Log Version: 1
ATA Error Count: 24 (device log contains only the most recent five errors)
	CR = Command Register [HEX]
	FR = Features Register [HEX]
	SC = Sector Count Register [HEX]
	SN = Sector Number Register [HEX]
	CL = Cylinder Low Register [HEX]
	CH = Cylinder High Register [HEX]
	DH = Device/Head Register [HEX]
	DC = Device Command Register [HEX]
	ER = Error register [HEX]
	ST = Status register [HEX]
Powered_Up_Time is measured from power on, and printed as
DDd+hh:mm:SS.sss where DD=days, hh=hours, mm=minutes,
SS=sec, and sss=millisec. It "wraps" after 49.710 days.

Error 24 occurred at disk power-on lifetime: 7116 hours (296 days + 12 hours)
  When the command that caused the error occurred, the device was in an unknown state.

  After command completion occurred, registers were:
  ER ST SC SN CL CH DH
  -- -- -- -- -- -- --
  40 d1 01 21 b8 07 f1  Error: UNC 1 sectors at LBA = 0x0107b821 = 17283105

  Commands leading to the command that caused the error were:
  CR FR SC SN CL CH DH DC   Powered_Up_Time  Command/Feature_Name
  -- -- -- -- -- -- -- --  ----------------  --------------------
  c8 01 01 21 b8 07 f1 07      00:08:23.808  READ DMA
  ca 01 01 20 b8 07 f1 07      00:08:23.808  WRITE DMA
  c8 20 01 20 b8 07 f1 00      00:08:23.808  READ DMA
  c8 01 01 21 b8 07 f1 07      00:08:19.785  READ DMA
  c8 01 01 20 b8 07 f1 07      00:08:19.785  READ DMA

Error 23 occurred at disk power-on lifetime: 7116 hours (296 days + 12 hours)
  When the command that caused the error occurred, the device was in an unknown state.

  After command completion occurred, registers were:
  ER ST SC SN CL CH DH
  -- -- -- -- -- -- --
  40 d1 01 21 b8 07 f1  Error: UNC 1 sectors at LBA = 0x0107b821 = 17283105

  Commands leading to the command that caused the error were:
  CR FR SC SN CL CH DH DC   Powered_Up_Time  Command/Feature_Name
  -- -- -- -- -- -- -- --  ----------------  --------------------
  c8 01 01 21 b8 07 f1 07      00:08:19.785  READ DMA
  c8 01 01 20 b8 07 f1 07      00:08:19.785  READ DMA
  c8 01 01 1f b8 07 f1 07      00:08:19.785  READ DMA
  c8 01 01 1e b8 07 f1 07      00:08:19.784  READ DMA
  c8 01 01 1d b8 07 f1 07      00:08:19.784  READ DMA

Error 22 occurred at disk power-on lifetime: 7116 hours (296 days + 12 hours)
  When the command that caused the error occurred, the device was in an unknown state.

  After command completion occurred, registers were:
  ER ST SC SN CL CH DH
  -- -- -- -- -- -- --
  40 59 09 21 b8 07 f1  Error: UNC 9 sectors at LBA = 0x0107b821 = 17283105

  Commands leading to the command that caused the error were:
  CR FR SC SN CL CH DH DC   Powered_Up_Time  Command/Feature_Name
  -- -- -- -- -- -- -- --  ----------------  --------------------
  c8 01 7f ab b7 07 f1 07      00:08:15.649  READ DMA
  c8 01 7f 2c b7 07 f1 07      00:08:15.648  READ DMA
  c8 01 7f ad b6 07 f1 07      00:08:15.646  READ DMA
  c8 01 7f 2e b6 07 f1 07      00:08:15.642  READ DMA
  c8 01 7f af b5 07 f1 07      00:08:15.640  READ DMA

Error 21 occurred at disk power-on lifetime: 7116 hours (296 days + 12 hours)
  When the command that caused the error occurred, the device was in an unknown state.

  After command completion occurred, registers were:
  ER ST SC SN CL CH DH
  -- -- -- -- -- -- --
  40 d1 01 ff c2 04 f1  Error: UNC 1 sectors at LBA = 0x0104c2ff = 17089279

  Commands leading to the command that caused the error were:
  CR FR SC SN CL CH DH DC   Powered_Up_Time  Command/Feature_Name
  -- -- -- -- -- -- -- --  ----------------  --------------------
  c8 01 01 ff c2 04 f1 04      00:08:01.514  READ DMA
  ca 01 01 fe c2 04 f1 04      00:08:01.514  WRITE DMA
  c8 20 01 fe c2 04 f1 00      00:08:01.514  READ DMA
  c8 01 01 ff c2 04 f1 04      00:07:57.494  READ DMA
  c8 01 01 fe c2 04 f1 04      00:07:57.494  READ DMA

Error 20 occurred at disk power-on lifetime: 7116 hours (296 days + 12 hours)
  When the command that caused the error occurred, the device was in an unknown state.

  After command completion occurred, registers were:
  ER ST SC SN CL CH DH
  -- -- -- -- -- -- --
  40 d1 01 ff c2 04 f1  Error: UNC 1 sectors at LBA = 0x0104c2ff = 17089279

  Commands leading to the command that caused the error were:
  CR FR SC SN CL CH DH DC   Powered_Up_Time  Command/Feature_Name
  -- -- -- -- -- -- -- --  ----------------  --------------------
  c8 01 01 ff c2 04 f1 04      00:07:57.494  READ DMA
  c8 01 01 fe c2 04 f1 04      00:07:57.494  READ DMA
  c8 01 01 fd c2 04 f1 04      00:07:57.493  READ DMA
  c8 20 01 fc c2 04 f1 00      00:07:57.493  READ DMA
  c8 20 01 fb c2 04 f1 00      00:07:57.493  READ DMA

SMART Extended Self-test Log (GP Log 0x07) not supported

SMART Self-test log structure revision number 1
No self-tests have been logged.  [To run self-tests, use: smartctl -t]

Selective Self-tests/Logging not supported

SCT Commands not supported

Device Statistics (GP/SMART Log 0x04) not supported

SATA Phy Event Counters (GP Log 0x11) not supported

