smartctl 7.2 2020-12-30 r5155 [x86_64-linux-5.10.4-zen2-1-zen] (local build)
Copyright (C) 2002-20, Bruce Allen, Christian Franke, www.smartmontools.org

=== START OF INFORMATION SECTION ===
Model Number:                       ZHITAI PC005 Active 1TB
Serial Number:                      --
Firmware Version:                   ZT00D212
PCI Vendor/Subsystem ID:            0x1e49
IEEE OUI Identifier:                0xa428b7
Total NVM Capacity:                 1,024,209,543,168 [1.02 TB]
Unallocated NVM Capacity:           0
Controller ID:                      1
NVMe Version:                       1.3
Number of Namespaces:               1
Namespace 1 Size/Capacity:          1,024,209,543,168 [1.02 TB]
Namespace 1 Utilization:            511,466,188,800 [511 GB]
Namespace 1 Formatted LBA Size:     512
Namespace 1 IEEE EUI-64:            a428b7 ...
Local Time is:                      Tue Jan  5 17:26:10 2021 PST
Firmware Updates (0x14):            2 Slots, no Reset required
Optional Admin Commands (0x0017):   Security Format Frmw_DL Self_Test
Optional NVM Commands (0x005f):     Comp Wr_Unc DS_Mngmt Wr_Zero Sav/Sel_Feat Timestmp
Log Page Attributes (0x0f):         S/H_per_NS Cmd_Eff_Lg Ext_Get_Lg Telmtry_Lg
Maximum Data Transfer Size:         64 Pages
Warning  Comp. Temp. Threshold:     75 Celsius
Critical Comp. Temp. Threshold:     80 Celsius

Supported Power States
St Op     Max   Active     Idle   RL RT WL WT  Ent_Lat  Ex_Lat
 0 +     9.00W       -        -    0  0  0  0        0       0
 1 +     4.60W       -        -    1  1  1  1        0       0
 2 +     3.80W       -        -    2  2  2  2        0       0
 3 -   0.0450W       -        -    3  3  3  3     2000    2000
 4 -   0.0040W       -        -    4  4  4  4    15000   15000

Supported LBA Sizes (NSID 0x1)
Id Fmt  Data  Metadt  Rel_Perf
 0 +     512       0         0

=== START OF SMART DATA SECTION ===
SMART overall-health self-assessment test result: PASSED

SMART/Health Information (NVMe Log 0x02)
Critical Warning:                   0x00
Temperature:                        28 Celsius
Available Spare:                    100%
Available Spare Threshold:          10%
Percentage Used:                    0%
Data Units Read:                    3,277,068 [1.67 TB]
Data Units Written:                 8,132,292 [4.16 TB]
Host Read Commands:                 33,609,908
Host Write Commands:                104,332,943
Controller Busy Time:               1,299
Power Cycles:                       26
Power On Hours:                     1,339
Unsafe Shutdowns:                   6
Media and Data Integrity Errors:    0
Error Information Log Entries:      0
Warning  Comp. Temperature Time:    0
Critical Comp. Temperature Time:    0
Temperature Sensor 1:               28 Celsius
Temperature Sensor 2:               27 Celsius
Temperature Sensor 3:               29 Celsius
Thermal Temp. 1 Transition Count:   2
Thermal Temp. 1 Total Time:         326

Error Information (NVMe Log 0x01, 16 of 256 entries)
No Errors Logged

