=== START OF INFORMATION SECTION ===
Model Family:     Seagate Barracuda 7200.7 and 7200.7 Plus
Device Model:     ST3200822AS
Serial Number:    --
Firmware Version: 3.01
User Capacity:    200,048,565,760 bytes [200 GB]
Sector Size:      512 bytes logical/physical
Device is:        In smartctl database [for details use: -P show]
ATA Version is:   ATA/ATAPI-6 T13/1410D revision 2
Local Time is:    Wed Jun  6 17:57:36 2018 MSK
SMART support is: Available - device has SMART capability.
SMART support is: Enabled
AAM feature is:   Unavailable
APM feature is:   Unavailable
Rd look-ahead is: Enabled
Write cache is:   Enabled
DSN feature is:   Unavailable
ATA Security is:  Disabled, NOT FROZEN [SEC1]
Wt Cache Reorder: Unavailable

=== START OF READ SMART DATA SECTION ===
SMART overall-health self-assessment test result: PASSED

General SMART Values:
Offline data collection status:  (0x82)	Offline data collection activity
					was completed without error.
					Auto Offline Data Collection: Enabled.
Self-test execution status:      (   0)	The previous self-test routine completed
					without error or no self-test has ever 
					been run.
Total time to complete Offline 
data collection: 		(  430) seconds.
Offline data collection
capabilities: 			 (0x5b) SMART execute Offline immediate.
					Auto Offline data collection on/off support.
					Suspend Offline collection upon new
					command.
					Offline surface scan supported.
					Self-test supported.
					No Conveyance Self-test supported.
					Selective Self-test supported.
SMART capabilities:            (0x0003)	Saves SMART data before entering
					power-saving mode.
					Supports SMART auto save timer.
Error logging capability:        (0x01)	Error logging supported.
					No General Purpose Logging support.
Short self-test routine 
recommended polling time: 	 (   1) minutes.
Extended self-test routine
recommended polling time: 	 ( 111) minutes.

SMART Attributes Data Structure revision number: 10
Vendor Specific SMART Attributes with Thresholds:
ID# ATTRIBUTE_NAME          FLAGS    VALUE WORST THRESH FAIL RAW_VALUE
  1 Raw_Read_Error_Rate     POSR--   061   049   006    -    102251279
  3 Spin_Up_Time            PO----   097   096   000    -    0
  4 Start_Stop_Count        -O--CK   097   097   020    -    4029
  5 Reallocated_Sector_Ct   PO--CK   100   100   036    -    0
  7 Seek_Error_Rate         POSR--   087   060   030    -    670906818
  9 Power_On_Hours          -O--CK   077   077   000    -    20164
 10 Spin_Retry_Count        PO--C-   100   100   097    -    0
 12 Power_Cycle_Count       -O--CK   097   097   020    -    3991
194 Temperature_Celsius     -O---K   045   065   000    -    45
195 Hardware_ECC_Recovered  -O-RC-   061   049   000    -    102251279
197 Current_Pending_Sector  -O--C-   100   100   000    -    0
198 Offline_Uncorrectable   ----C-   100   100   000    -    0
199 UDMA_CRC_Error_Count    -OSRCK   200   188   000    -    33
200 Multi_Zone_Error_Rate   ------   100   253   000    -    0
202 Data_Address_Mark_Errs  -O--CK   100   253   000    -    0
                            ||||||_ K auto-keep
                            |||||__ C event count
                            ||||___ R error rate
                            |||____ S speed/performance
                            ||_____ O updated online
                            |______ P prefailure warning

General Purpose Log Directory not supported

SMART Log Directory Version 1 [multi-sector log support]
Address    Access  R/W   Size  Description
0x00           SL  R/O      1  Log Directory
0x01           SL  R/O      1  Summary SMART error log
0x02           SL  R/O      5  Comprehensive SMART error log
0x03           SL  R/O      5  Ext. Comprehensive SMART error log
0x06           SL  R/O      1  SMART self-test log
0x07           SL  R/O      1  Extended self-test log
0x09           SL  R/W      1  Selective self-test log
0x20           SL  R/O      1  Streaming performance log [OBS-8]
0x21           SL  R/O      1  Write stream error log
0x22           SL  R/O      1  Read stream error log
0x23           SL  R/O      1  Delayed sector log [OBS-8]
0x80-0x9f      SL  R/W     16  Host vendor specific log
0xa0           SL  VS       1  Device vendor specific log
0xa1           SL  VS      20  Device vendor specific log
0xa2           SL  VS     101  Device vendor specific log
0xa8           SL  VS      20  Device vendor specific log
0xa9           SL  VS       1  Device vendor specific log
0xb0           SL  VS       1  Device vendor specific log
0xb4           SL  VS       4  Device vendor specific log
0xbe-0xbf      SL  VS       1  Device vendor specific log

SMART Extended Comprehensive Error Log (GP Log 0x03) not supported

SMART Error Log Version: 1
ATA Error Count: 9 (device log contains only the most recent five errors)
	CR = Command Register [HEX]
	FR = Features Register [HEX]
	SC = Sector Count Register [HEX]
	SN = Sector Number Register [HEX]
	CL = Cylinder Low Register [HEX]
	CH = Cylinder High Register [HEX]
	DH = Device/Head Register [HEX]
	DC = Device Command Register [HEX]
	ER = Error register [HEX]
	ST = Status register [HEX]
Powered_Up_Time is measured from power on, and printed as
DDd+hh:mm:SS.sss where DD=days, hh=hours, mm=minutes,
SS=sec, and sss=millisec. It "wraps" after 49.710 days.

Error 9 occurred at disk power-on lifetime: 1035 hours (43 days + 3 hours)
  When the command that caused the error occurred, the device was active or idle.

  After command completion occurred, registers were:
  ER ST SC SN CL CH DH
  -- -- -- -- -- -- --
  84 51 37 5e bc 2c e0  Error: ICRC, ABRT 55 sectors at LBA = 0x002cbc5e = 2931806

  Commands leading to the command that caused the error were:
  CR FR SC SN CL CH DH DC   Powered_Up_Time  Command/Feature_Name
  -- -- -- -- -- -- -- --  ----------------  --------------------
  25 d0 58 3d bc 2c e0 00      04:05:47.375  READ DMA EXT
  25 d0 60 dd bb 2c e0 00      04:05:46.091  READ DMA EXT
  25 d0 40 9d bb 2c e0 00      04:05:46.090  READ DMA EXT
  25 d0 18 85 bb 2c e0 00      04:05:44.915  READ DMA EXT
  25 d0 60 25 bb 2c e0 00      04:05:43.667  READ DMA EXT

Error 8 occurred at disk power-on lifetime: 1024 hours (42 days + 16 hours)
  When the command that caused the error occurred, the device was active or idle.

  After command completion occurred, registers were:
  ER ST SC SN CL CH DH
  -- -- -- -- -- -- --
  84 51 13 f5 ff ff e0  Error: ABRT at LBA = 0x00fffff5 = 16777205

  Commands leading to the command that caused the error were:
  CR FR SC SN CL CH DH DC   Powered_Up_Time  Command/Feature_Name
  -- -- -- -- -- -- -- --  ----------------  --------------------
  29 03 40 d5 98 2d e0 00      01:32:11.754  READ MULTIPLE EXT
  ef 03 46 01 10 00 a0 00      01:32:11.753  SET FEATURES [Set transfer mode]
  ef 03 0c 01 10 00 a0 00      01:32:11.732  SET FEATURES [Set transfer mode]
  c6 00 10 01 00 00 a0 00      01:32:11.728  SET MULTIPLE MODE
  91 00 3f 01 00 00 af 00      01:32:11.303  INITIALIZE DEVICE PARAMETERS [OBS-6]

Error 7 occurred at disk power-on lifetime: 1024 hours (42 days + 16 hours)
  When the command that caused the error occurred, the device was active or idle.

  After command completion occurred, registers were:
  ER ST SC SN CL CH DH
  -- -- -- -- -- -- --
  84 51 1f f6 98 2d e0  Error: ICRC, ABRT 31 sectors at LBA = 0x002d98f6 = 2988278

  Commands leading to the command that caused the error were:
  CR FR SC SN CL CH DH DC   Powered_Up_Time  Command/Feature_Name
  -- -- -- -- -- -- -- --  ----------------  --------------------
  25 00 40 d5 98 2d e0 00      01:32:11.754  READ DMA EXT
  25 00 01 66 79 1a e0 00      01:32:11.753  READ DMA EXT
  25 00 01 00 00 00 e0 00      01:32:11.732  READ DMA EXT
  25 00 01 00 00 00 e0 00      01:32:11.728  READ DMA EXT
  25 00 01 00 00 00 e0 00      01:32:11.303  READ DMA EXT

Error 6 occurred at disk power-on lifetime: 1024 hours (42 days + 16 hours)
  When the command that caused the error occurred, the device was active or idle.

  After command completion occurred, registers were:
  ER ST SC SN CL CH DH
  -- -- -- -- -- -- --
  84 51 00 14 99 2d e0  Error: ICRC, ABRT at LBA = 0x002d9914 = 2988308

  Commands leading to the command that caused the error were:
  CR FR SC SN CL CH DH DC   Powered_Up_Time  Command/Feature_Name
  -- -- -- -- -- -- -- --  ----------------  --------------------
  25 03 40 d5 98 2d e0 00      01:31:59.217  READ DMA EXT
  25 03 38 9d 98 2d e0 00      01:31:59.217  READ DMA EXT
  25 03 80 1d 99 2d e0 00      01:31:56.744  READ DMA EXT
  25 03 80 1d 98 2d e0 00      01:31:55.726  READ DMA EXT
  25 03 10 8d 97 2d e0 00      01:32:11.303  READ DMA EXT

Error 5 occurred at disk power-on lifetime: 1024 hours (42 days + 16 hours)
  When the command that caused the error occurred, the device was active or idle.

  After command completion occurred, registers were:
  ER ST SC SN CL CH DH
  -- -- -- -- -- -- --
  84 51 3f ce 88 06 e0  Error: ICRC, ABRT 63 sectors at LBA = 0x000688ce = 428238

  Commands leading to the command that caused the error were:
  CR FR SC SN CL CH DH DC   Powered_Up_Time  Command/Feature_Name
  -- -- -- -- -- -- -- --  ----------------  --------------------
  25 00 80 8d 88 06 e0 00      01:30:39.842  READ DMA EXT
  35 00 08 9d 79 78 e0 00      01:30:39.842  WRITE DMA EXT
  35 00 08 ad 79 78 e0 00      01:30:39.842  WRITE DMA EXT
  35 00 10 9d d9 78 e0 00      01:30:39.841  WRITE DMA EXT
  35 00 08 2f 00 5e e0 00      01:30:39.841  WRITE DMA EXT

SMART Extended Self-test Log (GP Log 0x07) not supported

SMART Self-test log structure revision number 1
No self-tests have been logged.  [To run self-tests, use: smartctl -t]

SMART Selective self-test log data structure revision number 1
 SPAN  MIN_LBA  MAX_LBA  CURRENT_TEST_STATUS
    1        0        0  Not_testing
    2        0        0  Not_testing
    3        0        0  Not_testing
    4        0        0  Not_testing
    5        0        0  Not_testing
Selective self-test flags (0x0):
  After scanning selected spans, do NOT read-scan remainder of disk.
If Selective self-test is pending on power-up, resume after 0 minute delay.

SCT Commands not supported

Device Statistics (GP/SMART Log 0x04) not supported

Pending Defects log (GP Log 0x0c) not supported

SATA Phy Event Counters (GP Log 0x11) not supported

