smartctl 7.5 2025-04-30 r5714 [x86_64-linux-6.12.13-generic-4rosa13-x86_64] (local build)
Copyright (C) 2002-25, Bruce Allen, Christian Franke, www.smartmontools.org

=== START OF INFORMATION SECTION ===
Model Family:     Western Digital Blue (CMR)
Device Model:     WDC WD10EZEX-08WN4A0
Serial Number:    --
LU WWN Device Id: 5 0014ee ...
Firmware Version: 02.01A02
User Capacity:    1,000,204,886,016 bytes [1.00 TB]
Sector Sizes:     512 bytes logical, 4096 bytes physical
Rotation Rate:    7200 rpm
Form Factor:      3.5 inches
Device is:        In smartctl database 7.5/5706
ATA Version is:   ACS-3 T13/2161-D revision 3b
SATA Version is:  SATA 3.1, 6.0 Gb/s (current: 6.0 Gb/s)
Local Time is:    Sat Jun 28 21:10:35 2025 MSK
SMART support is: Available - device has SMART capability.
SMART support is: Enabled
AAM feature is:   Unavailable
APM level is:     128 (minimum power consumption without standby)
Rd look-ahead is: Enabled
Write cache is:   Enabled
DSN feature is:   Unavailable
ATA Security is:  Disabled, frozen [SEC2]

=== START OF READ SMART DATA SECTION ===
SMART overall-health self-assessment test result: PASSED

General SMART Values:
Offline data collection status:  (0x82)	Offline data collection activity
					was completed without error.
					Auto Offline Data Collection: Enabled.
Self-test execution status:      (   0)	The previous self-test routine completed
					without error or no self-test has ever 
					been run.
Total time to complete Offline 
data collection: 		(11400) seconds.
Offline data collection
capabilities: 			 (0x7b) SMART execute Offline immediate.
					Auto Offline data collection on/off support.
					Suspend Offline collection upon new
					command.
					Offline surface scan supported.
					Self-test supported.
					Conveyance Self-test supported.
					Selective Self-test supported.
SMART capabilities:            (0x0003)	Saves SMART data before entering
					power-saving mode.
					Supports SMART auto save timer.
Error logging capability:        (0x01)	Error logging supported.
					General Purpose Logging supported.
Short self-test routine 
recommended polling time: 	 (   2) minutes.
Extended self-test routine
recommended polling time: 	 ( 118) minutes.
Conveyance self-test routine
recommended polling time: 	 (   5) minutes.
SCT capabilities: 	       (0x3035)	SCT Status supported.
					SCT Feature Control supported.
					SCT Data Table supported.

SMART Attributes Data Structure revision number: 16
Vendor Specific SMART Attributes with Thresholds:
ID# ATTRIBUTE_NAME          FLAGS    VALUE WORST THRESH FAIL RAW_VALUE
  1 Raw_Read_Error_Rate     POSR-K   200   200   051    -    0
  3 Spin_Up_Time            POS--K   182   171   021    -    1866
  4 Start_Stop_Count        -O--CK   097   097   000    -    3064
  5 Reallocated_Sector_Ct   PO--CK   194   194   140    -    274
  7 Seek_Error_Rate         -OSR-K   200   200   000    -    0
  9 Power_On_Hours          -O--CK   079   079   000    -    16026
 10 Spin_Retry_Count        -O--CK   100   100   000    -    0
 11 Calibration_Retry_Count -O--CK   100   100   000    -    0
 12 Power_Cycle_Count       -O--CK   099   099   000    -    1859
192 Power-Off_Retract_Count -O--CK   200   200   000    -    311
193 Load_Cycle_Count        -O--CK   195   195   000    -    16209
194 Temperature_Celsius     -O---K   110   090   000    -    33
196 Reallocated_Event_Count -O--CK   149   149   000    -    51
197 Current_Pending_Sector  -O--CK   200   200   000    -    0
198 Offline_Uncorrectable   ----CK   200   200   000    -    0
199 UDMA_CRC_Error_Count    -O--CK   200   200   000    -    1
200 Multi_Zone_Error_Rate   ---R--   200   200   000    -    0
                            ||||||_ K auto-keep
                            |||||__ C event count
                            ||||___ R error rate
                            |||____ S speed/performance
                            ||_____ O updated online
                            |______ P prefailure warning

General Purpose Log Directory Version 1
SMART           Log Directory Version 1 [multi-sector log support]
Address    Access  R/W   Size  Description
0x00       GPL,SL  R/O      1  Log Directory
0x01           SL  R/O      1  Summary SMART error log
0x02           SL  R/O      5  Comprehensive SMART error log
0x03       GPL     R/O      6  Ext. Comprehensive SMART error log
0x06           SL  R/O      1  SMART self-test log
0x07       GPL     R/O      1  Extended self-test log
0x09           SL  R/W      1  Selective self-test log
0x10       GPL     R/O      1  NCQ Command Error log
0x11       GPL     R/O      1  SATA Phy Event Counters log
0x30       GPL,SL  R/O      9  IDENTIFY DEVICE data log
0x80-0x9f  GPL,SL  R/W     16  Host vendor specific log
0xa0-0xa7  GPL,SL  VS      16  Device vendor specific log
0xa8-0xb6  GPL,SL  VS       1  Device vendor specific log
0xb7       GPL,SL  VS      48  Device vendor specific log
0xbd       GPL,SL  VS       1  Device vendor specific log
0xc0       GPL,SL  VS       1  Device vendor specific log
0xc1       GPL     VS      93  Device vendor specific log
0xdf       GPL,SL  VS       1  Device vendor specific log
0xe0       GPL,SL  R/W      1  SCT Command/Status
0xe1       GPL,SL  R/W      1  SCT Data Transfer

SMART Extended Comprehensive Error Log Version: 1 (6 sectors)
Device Error Count: 24
	CR     = Command Register
	FEATR  = Features Register
	COUNT  = Count (was: Sector Count) Register
	LBA_48 = Upper bytes of LBA High/Mid/Low Registers ]  ATA-8
	LH     = LBA High (was: Cylinder High) Register    ]   LBA
	LM     = LBA Mid (was: Cylinder Low) Register      ] Register
	LL     = LBA Low (was: Sector Number) Register     ]
	DV     = Device (was: Device/Head) Register
	DC     = Device Control Register
	ER     = Error register
	ST     = Status register
Powered_Up_Time is measured from power on, and printed as
DDd+hh:mm:SS.sss where DD=days, hh=hours, mm=minutes,
SS=sec, and sss=millisec. It "wraps" after 49.710 days.

Error 24 [23] occurred at disk power-on lifetime: 2745 hours (114 days + 9 hours)
  When the command that caused the error occurred, the device was active or idle.

  After command completion occurred, registers were:
  ER -- ST COUNT  LBA_48  LH LM LL DV DC
  -- -- -- == -- == == == -- -- -- -- --
  04 -- 61 00 03 00 00 00 00 00 00 00 00  Device Fault; Error: ABRT

  Commands leading to the command that caused the error were:
  CR FEATR COUNT  LBA_48  LH LM LL DV DC  Powered_Up_Time  Command/Feature_Name
  -- == -- == -- == == == -- -- -- -- --  ---------------  --------------------
  ef 00 10 00 03 00 00 00 00 00 00 00 00     00:01:09.619  SET FEATURES [Enable SATA feature]
  ef 00 10 00 02 00 00 00 00 00 00 00 00     00:01:09.598  SET FEATURES [Enable SATA feature]
  b1 00 c1 00 00 00 00 00 00 00 00 00 00     00:01:09.587  DEVICE CONFIGURATION FREEZE LOCK [OBS-ACS-3]
  f5 00 00 00 00 00 00 00 00 00 00 00 00     00:01:09.566  SECURITY FREEZE LOCK
  ef 00 10 00 06 00 00 00 00 00 00 00 00     00:01:09.555  SET FEATURES [Enable SATA feature]

Error 23 [22] occurred at disk power-on lifetime: 2745 hours (114 days + 9 hours)
  When the command that caused the error occurred, the device was active or idle.

  After command completion occurred, registers were:
  ER -- ST COUNT  LBA_48  LH LM LL DV DC
  -- -- -- == -- == == == -- -- -- -- --
  04 -- 61 00 02 00 00 00 00 00 00 00 00  Device Fault; Error: ABRT

  Commands leading to the command that caused the error were:
  CR FEATR COUNT  LBA_48  LH LM LL DV DC  Powered_Up_Time  Command/Feature_Name
  -- == -- == -- == == == -- -- -- -- --  ---------------  --------------------
  ef 00 10 00 02 00 00 00 00 00 00 00 00     00:01:09.598  SET FEATURES [Enable SATA feature]
  b1 00 c1 00 00 00 00 00 00 00 00 00 00     00:01:09.587  DEVICE CONFIGURATION FREEZE LOCK [OBS-ACS-3]
  f5 00 00 00 00 00 00 00 00 00 00 00 00     00:01:09.566  SECURITY FREEZE LOCK
  ef 00 10 00 06 00 00 00 00 00 00 00 00     00:01:09.555  SET FEATURES [Enable SATA feature]
  ec 00 00 00 00 00 00 00 00 00 00 00 00     00:01:09.523  IDENTIFY DEVICE

Error 22 [21] occurred at disk power-on lifetime: 2745 hours (114 days + 9 hours)
  When the command that caused the error occurred, the device was active or idle.

  After command completion occurred, registers were:
  ER -- ST COUNT  LBA_48  LH LM LL DV DC
  -- -- -- == -- == == == -- -- -- -- --
  04 -- 61 00 00 00 00 00 00 00 00 00 00

  Commands leading to the command that caused the error were:
  CR FEATR COUNT  LBA_48  LH LM LL DV DC  Powered_Up_Time  Command/Feature_Name
  -- == -- == -- == == == -- -- -- -- --  ---------------  --------------------
  b1 00 c1 00 00 00 00 00 00 00 00 00 00     00:01:09.587  DEVICE CONFIGURATION FREEZE LOCK [OBS-ACS-3]
  f5 00 00 00 00 00 00 00 00 00 00 00 00     00:01:09.566  SECURITY FREEZE LOCK
  ef 00 10 00 06 00 00 00 00 00 00 00 00     00:01:09.555  SET FEATURES [Enable SATA feature]
  ec 00 00 00 00 00 00 00 00 00 00 00 00     00:01:09.523  IDENTIFY DEVICE
  60 00 40 00 80 00 00 11 68 d7 a7 40 00     00:00:36.001  READ FPDMA QUEUED

Error 21 [20] occurred at disk power-on lifetime: 2745 hours (114 days + 9 hours)
  When the command that caused the error occurred, the device was active or idle.

  After command completion occurred, registers were:
  ER -- ST COUNT  LBA_48  LH LM LL DV DC
  -- -- -- == -- == == == -- -- -- -- --
  04 -- 61 00 00 00 00 00 00 00 00 00 00

  Commands leading to the command that caused the error were:
  CR FEATR COUNT  LBA_48  LH LM LL DV DC  Powered_Up_Time  Command/Feature_Name
  -- == -- == -- == == == -- -- -- -- --  ---------------  --------------------
  f5 00 00 00 00 00 00 00 00 00 00 00 00     00:01:09.566  SECURITY FREEZE LOCK
  ef 00 10 00 06 00 00 00 00 00 00 00 00     00:01:09.555  SET FEATURES [Enable SATA feature]
  ec 00 00 00 00 00 00 00 00 00 00 00 00     00:01:09.523  IDENTIFY DEVICE
  60 00 40 00 80 00 00 11 68 d7 a7 40 00     00:00:36.001  READ FPDMA QUEUED
  ea 00 00 00 00 00 00 00 00 00 00 40 00     00:00:03.377  FLUSH CACHE EXT

Error 20 [19] occurred at disk power-on lifetime: 2745 hours (114 days + 9 hours)
  When the command that caused the error occurred, the device was active or idle.

  After command completion occurred, registers were:
  ER -- ST COUNT  LBA_48  LH LM LL DV DC
  -- -- -- == -- == == == -- -- -- -- --
  04 -- 61 00 06 00 00 00 00 00 00 00 00  Device Fault; Error: ABRT

  Commands leading to the command that caused the error were:
  CR FEATR COUNT  LBA_48  LH LM LL DV DC  Powered_Up_Time  Command/Feature_Name
  -- == -- == -- == == == -- -- -- -- --  ---------------  --------------------
  ef 00 10 00 06 00 00 00 00 00 00 00 00     00:01:09.555  SET FEATURES [Enable SATA feature]
  ec 00 00 00 00 00 00 00 00 00 00 00 00     00:01:09.523  IDENTIFY DEVICE
  60 00 40 00 80 00 00 11 68 d7 a7 40 00     00:00:36.001  READ FPDMA QUEUED
  ea 00 00 00 00 00 00 00 00 00 00 40 00     00:00:03.377  FLUSH CACHE EXT
  60 00 40 00 70 00 00 11 68 d7 3f 40 00     00:00:03.362  READ FPDMA QUEUED

Error 19 [18] occurred at disk power-on lifetime: 2745 hours (114 days + 9 hours)
  When the command that caused the error occurred, the device was active or idle.

  After command completion occurred, registers were:
  ER -- ST COUNT  LBA_48  LH LM LL DV DC
  -- -- -- == -- == == == -- -- -- -- --
  04 -- 61 00 00 00 00 00 5b 1f 20 40 00  Device Fault; Error: ABRT at LBA = 0x005b1f20 = 5971744

  Commands leading to the command that caused the error were:
  CR FEATR COUNT  LBA_48  LH LM LL DV DC  Powered_Up_Time  Command/Feature_Name
  -- == -- == -- == == == -- -- -- -- --  ---------------  --------------------
  60 00 40 00 80 00 00 11 68 d7 a7 40 00     00:00:36.001  READ FPDMA QUEUED
  ea 00 00 00 00 00 00 00 00 00 00 40 00     00:00:03.377  FLUSH CACHE EXT
  60 00 40 00 70 00 00 11 68 d7 3f 40 00     00:00:03.362  READ FPDMA QUEUED
  61 00 18 00 68 00 00 00 5b 1f 18 40 00     00:00:03.361  WRITE FPDMA QUEUED
  60 00 40 00 60 00 00 11 68 d6 d7 40 00     00:00:03.361  READ FPDMA QUEUED

Error 18 [17] occurred at disk power-on lifetime: 2745 hours (114 days + 9 hours)
  When the command that caused the error occurred, the device was active or idle.

  After command completion occurred, registers were:
  ER -- ST COUNT  LBA_48  LH LM LL DV DC
  -- -- -- == -- == == == -- -- -- -- --
  04 -- 61 00 00 00 00 00 5b 1f 20 00 00

  Commands leading to the command that caused the error were:
  CR FEATR COUNT  LBA_48  LH LM LL DV DC  Powered_Up_Time  Command/Feature_Name
  -- == -- == -- == == == -- -- -- -- --  ---------------  --------------------
  ea 00 00 00 00 00 00 00 00 00 00 40 00     00:00:03.377  FLUSH CACHE EXT
  60 00 40 00 70 00 00 11 68 d7 3f 40 00     00:00:03.362  READ FPDMA QUEUED
  61 00 18 00 68 00 00 00 5b 1f 18 40 00     00:00:03.361  WRITE FPDMA QUEUED
  60 00 40 00 60 00 00 11 68 d6 d7 40 00     00:00:03.361  READ FPDMA QUEUED
  60 00 08 00 58 00 00 00 60 15 78 40 00     00:00:03.361  READ FPDMA QUEUED

Error 17 [16] occurred at disk power-on lifetime: 2744 hours (114 days + 8 hours)
  When the command that caused the error occurred, the device was active or idle.

  After command completion occurred, registers were:
  ER -- ST COUNT  LBA_48  LH LM LL DV DC
  -- -- -- == -- == == == -- -- -- -- --
  04 -- 41 00 01 00 00 0d 57 ca f8 40 00  Error: ABRT at LBA = 0x0d57caf8 = 223857400

  Commands leading to the command that caused the error were:
  CR FEATR COUNT  LBA_48  LH LM LL DV DC  Powered_Up_Time  Command/Feature_Name
  -- == -- == -- == == == -- -- -- -- --  ---------------  --------------------
  60 00 58 00 58 00 00 0d 57 ca f8 40 00     00:33:22.584  READ FPDMA QUEUED
  60 01 00 00 50 00 00 0d a7 0f e0 40 00     00:33:21.694  READ FPDMA QUEUED
  60 01 00 00 48 00 00 0d a7 0e e0 40 00     00:33:21.694  READ FPDMA QUEUED
  60 01 00 00 40 00 00 0d a7 0d e0 40 00     00:33:21.694  READ FPDMA QUEUED
  60 01 00 00 38 00 00 0d a7 0c e0 40 00     00:33:21.694  READ FPDMA QUEUED

SMART Extended Self-test Log Version: 1 (1 sectors)
Num  Test_Description    Status                  Remaining  LifeTime(hours)  LBA_of_first_error
# 1  Short offline       Completed without error       00%     16010         -
# 2  Short offline       Completed without error       00%     14771         -
# 3  Short offline       Completed without error       00%     14748         -
# 4  Short offline       Completed without error       00%     11948         -
# 5  Short offline       Completed without error       00%     11946         -
# 6  Extended offline    Completed without error       00%     10056         -

SMART Selective self-test log data structure revision number 1
 SPAN  MIN_LBA  MAX_LBA  CURRENT_TEST_STATUS
    1        0        0  Not_testing
    2        0        0  Not_testing
    3        0        0  Not_testing
    4        0        0  Not_testing
    5        0        0  Not_testing
Selective self-test flags (0x0):
  After scanning selected spans, do NOT read-scan remainder of disk.
If Selective self-test is pending on power-up, resume after 0 minute delay.

SCT Status Version:                  3
SCT Version (vendor specific):       258 (0x0102)
Device State:                        Active (0)
Current Temperature:                    33 Celsius
Power Cycle Min/Max Temperature:     26/33 Celsius
Lifetime    Min/Max Temperature:     20/54 Celsius
Under/Over Temperature Limit Count:   0/0
Vendor specific:
01 00 00 00 00 00 00 00 00 00 00 00 00 00 00 00
00 00 00 00 00 00 00 00 00 00 00 00 00 00 00 00

SCT Temperature History Version:     2
Temperature Sampling Period:         1 minute
Temperature Logging Interval:        1 minute
Min/Max recommended Temperature:      0/60 Celsius
Min/Max Temperature Limit:           -41/85 Celsius
Temperature History Size (Index):    478 (24)

SCT Error Recovery Control command not supported

Device Statistics (GP/SMART Log 0x04) not supported

Pending Defects log (GP Log 0x0c) not supported

SATA Phy Event Counters (GP Log 0x11)
ID      Size     Value  Description
0x0001  2            0  Command failed due to ICRC error
0x0002  2            0  R_ERR response for data FIS
0x0003  2            0  R_ERR response for device-to-host data FIS
0x0004  2            0  R_ERR response for host-to-device data FIS
0x0005  2            0  R_ERR response for non-data FIS
0x0006  2            0  R_ERR response for device-to-host non-data FIS
0x0007  2            0  R_ERR response for host-to-device non-data FIS
0x0008  2            0  Device-to-host non-data FIS retries
0x0009  2            5  Transition from drive PhyRdy to drive PhyNRdy
0x000a  2            6  Device-to-host register FISes sent due to a COMRESET
0x000b  2            0  CRC errors within host-to-device FIS
0x000d  2            0  Non-CRC errors within host-to-device FIS
0x000f  2            0  R_ERR response for host-to-device data FIS, CRC
0x0012  2            0  R_ERR response for host-to-device non-data FIS, CRC
0x8000  4         1038  Vendor specific

