=== START OF INFORMATION SECTION ===
Model Family:     Toshiba 2.5" HDD MK..37GSX
Device Model:     TOSHIBA MK1637GSX
Serial Number:    --
Firmware Version: DL050J
User Capacity:    160,041,885,696 bytes [160 GB]
Sector Size:      512 bytes logical/physical
Device is:        In smartctl database [for details use: -P show]
ATA Version is:   ATA/ATAPI-7 (minor revision not indicated)
Local Time is:    Thu Sep  1 06:31:09 2022 CEST
SMART support is: Available - device has SMART capability.
SMART support is: Enabled
AAM feature is:   Unavailable
APM level is:     128 (minimum power consumption without standby)
Rd look-ahead is: Enabled
Write cache is:   Enabled
DSN feature is:   Unavailable
ATA Security is:  Disabled, frozen [SEC2]
Wt Cache Reorder: Unavailable

=== START OF READ SMART DATA SECTION ===
SMART overall-health self-assessment test result: PASSED

General SMART Values:
Offline data collection status:  (0x82)	Offline data collection activity
					was completed without error.
					Auto Offline Data Collection: Enabled.
Self-test execution status:      (   0)	The previous self-test routine completed
					without error or no self-test has ever 
					been run.
Total time to complete Offline 
data collection: 		(  120) seconds.
Offline data collection
capabilities: 			 (0x5b) SMART execute Offline immediate.
					Auto Offline data collection on/off support.
					Suspend Offline collection upon new
					command.
					Offline surface scan supported.
					Self-test supported.
					No Conveyance Self-test supported.
					Selective Self-test supported.
SMART capabilities:            (0x0003)	Saves SMART data before entering
					power-saving mode.
					Supports SMART auto save timer.
Error logging capability:        (0x01)	Error logging supported.
					General Purpose Logging supported.
Short self-test routine 
recommended polling time: 	 (   2) minutes.
Extended self-test routine
recommended polling time: 	 (  92) minutes.
SCT capabilities: 	       (0x0001)	SCT Status supported.

SMART Attributes Data Structure revision number: 16
Vendor Specific SMART Attributes with Thresholds:
ID# ATTRIBUTE_NAME          FLAGS    VALUE WORST THRESH FAIL RAW_VALUE
  1 Raw_Read_Error_Rate     PO-R--   100   100   050    -    0
  2 Throughput_Performance  P-S---   100   100   050    -    0
  3 Spin_Up_Time            POS--K   100   100   001    -    1972
  4 Start_Stop_Count        -O--CK   100   100   000    -    5104
  5 Reallocated_Sector_Ct   PO--CK   100   100   050    -    0
  7 Seek_Error_Rate         PO-R--   100   100   050    -    0
  8 Seek_Time_Performance   P-S---   100   100   050    -    0
  9 Power_On_Hours          -O--CK   081   081   000    -    7824
 10 Spin_Retry_Count        PO--CK   201   100   030    -    0
 12 Power_Cycle_Count       -O--CK   100   100   000    -    5064
192 Power-Off_Retract_Count -O--CK   100   100   000    -    148
193 Load_Cycle_Count        -O--CK   095   095   000    -    57307
194 Temperature_Celsius     -O---K   100   100   000    -    38 (Min/Max 9/60)
196 Reallocated_Event_Count -O--CK   100   100   000    -    0
197 Current_Pending_Sector  -O--CK   100   100   000    -    0
198 Offline_Uncorrectable   ----CK   100   100   000    -    0
199 UDMA_CRC_Error_Count    -O--CK   200   200   000    -    0
220 Disk_Shift              -O----   100   100   000    -    194
222 Loaded_Hours            -O--CK   084   084   000    -    6463
223 Load_Retry_Count        -O--CK   100   100   000    -    0
224 Load_Friction           -O---K   100   100   000    -    0
226 Load-in_Time            -OS--K   100   100   000    -    316
240 Head_Flying_Hours       P-----   100   100   001    -    0
                            ||||||_ K auto-keep
                            |||||__ C event count
                            ||||___ R error rate
                            |||____ S speed/performance
                            ||_____ O updated online
                            |______ P prefailure warning

General Purpose Log Directory Version 1
SMART           Log Directory Version 1 [multi-sector log support]
Address    Access  R/W   Size  Description
0x00       GPL,SL  R/O      1  Log Directory
0x01           SL  R/O      1  Summary SMART error log
0x02           SL  R/O     51  Comprehensive SMART error log
0x03       GPL     R/O     64  Ext. Comprehensive SMART error log
0x06           SL  R/O      1  SMART self-test log
0x07       GPL     R/O      1  Extended self-test log
0x09           SL  R/W      1  Selective self-test log
0x10       GPL     R/O      1  NCQ Command Error log
0x11       GPL     R/O      1  SATA Phy Event Counters log
0x80-0x9f  GPL,SL  R/W     16  Host vendor specific log
0xe0       GPL,SL  R/W      1  SCT Command/Status
0xe1       GPL,SL  R/W      1  SCT Data Transfer

SMART Extended Comprehensive Error Log Version: 1 (64 sectors)
Device Error Count: 23
	CR     = Command Register
	FEATR  = Features Register
	COUNT  = Count (was: Sector Count) Register
	LBA_48 = Upper bytes of LBA High/Mid/Low Registers ]  ATA-8
	LH     = LBA High (was: Cylinder High) Register    ]   LBA
	LM     = LBA Mid (was: Cylinder Low) Register      ] Register
	LL     = LBA Low (was: Sector Number) Register     ]
	DV     = Device (was: Device/Head) Register
	DC     = Device Control Register
	ER     = Error register
	ST     = Status register
Powered_Up_Time is measured from power on, and printed as
DDd+hh:mm:SS.sss where DD=days, hh=hours, mm=minutes,
SS=sec, and sss=millisec. It "wraps" after 49.710 days.

Error 23 [22] occurred at disk power-on lifetime: 6819 hours (284 days + 3 hours)
  When the command that caused the error occurred, the device was active or idle.

  After command completion occurred, registers were:
  ER -- ST COUNT  LBA_48  LH LM LL DV DC
  -- -- -- == -- == == == -- -- -- -- --
  40 -- 51 00 d8 00 00 00 5f 1c c8 e0 00  Error: UNC 216 sectors at LBA = 0x005f1cc8 = 6233288

  Commands leading to the command that caused the error were:
  CR FEATR COUNT  LBA_48  LH LM LL DV DC  Powered_Up_Time  Command/Feature_Name
  -- == -- == -- == == == -- -- -- -- --  ---------------  --------------------
  25 00 00 01 00 00 00 00 5f 1c a0 e0 00     03:10:04.116  READ DMA EXT
  25 00 00 01 00 00 00 00 5f 1b a0 e0 00     03:10:04.114  READ DMA EXT
  25 00 00 01 00 00 00 00 5f 1a a0 e0 00     03:10:04.110  READ DMA EXT
  25 00 00 01 00 00 00 00 5f 19 a0 e0 00     03:10:04.102  READ DMA EXT
  35 00 00 00 18 00 00 00 64 ce 30 e0 00     03:10:04.067  WRITE DMA EXT

Error 22 [21] occurred at disk power-on lifetime: 6819 hours (284 days + 3 hours)
  When the command that caused the error occurred, the device was active or idle.

  After command completion occurred, registers were:
  ER -- ST COUNT  LBA_48  LH LM LL DV DC
  -- -- -- == -- == == == -- -- -- -- --
  40 -- 51 00 18 00 00 00 5f 1c c8 e0 00  Error: UNC 24 sectors at LBA = 0x005f1cc8 = 6233288

  Commands leading to the command that caused the error were:
  CR FEATR COUNT  LBA_48  LH LM LL DV DC  Powered_Up_Time  Command/Feature_Name
  -- == -- == -- == == == -- -- -- -- --  ---------------  --------------------
  25 00 00 00 20 00 00 00 5f 1c c0 e0 00     03:09:54.771  READ DMA EXT
  35 00 00 00 20 00 00 01 83 89 a0 e0 00     03:09:54.771  WRITE DMA EXT
  25 00 00 00 20 00 00 00 5f 1c a0 e0 00     03:09:54.721  READ DMA EXT
  35 00 00 00 20 00 00 01 83 89 80 e0 00     03:09:54.721  WRITE DMA EXT
  25 00 00 00 20 00 00 00 5f 1c 80 e0 00     03:09:54.721  READ DMA EXT

Error 21 [20] occurred at disk power-on lifetime: 6819 hours (284 days + 3 hours)
  When the command that caused the error occurred, the device was active or idle.

  After command completion occurred, registers were:
  ER -- ST COUNT  LBA_48  LH LM LL DV DC
  -- -- -- == -- == == == -- -- -- -- --
  40 -- 51 00 d8 00 00 00 5f 1c c8 e0 00  Error: UNC 216 sectors at LBA = 0x005f1cc8 = 6233288

  Commands leading to the command that caused the error were:
  CR FEATR COUNT  LBA_48  LH LM LL DV DC  Powered_Up_Time  Command/Feature_Name
  -- == -- == -- == == == -- -- -- -- --  ---------------  --------------------
  25 00 00 01 00 00 00 00 5f 1c a0 e0 00     03:09:42.538  READ DMA EXT
  25 00 00 01 00 00 00 00 5f 1b a0 e0 00     03:09:42.535  READ DMA EXT
  25 00 00 01 00 00 00 00 5f 1a a0 e0 00     03:09:42.531  READ DMA EXT
  25 00 00 01 00 00 00 00 5f 19 a0 e0 00     03:09:42.523  READ DMA EXT
  35 00 00 00 08 00 00 01 98 f1 48 e0 00     03:09:42.476  WRITE DMA EXT

Error 20 [19] occurred at disk power-on lifetime: 6819 hours (284 days + 3 hours)
  When the command that caused the error occurred, the device was active or idle.

  After command completion occurred, registers were:
  ER -- ST COUNT  LBA_48  LH LM LL DV DC
  -- -- -- == -- == == == -- -- -- -- --
  40 -- 51 00 18 00 00 00 5f 1c c8 e0 00  Error: UNC 24 sectors at LBA = 0x005f1cc8 = 6233288

  Commands leading to the command that caused the error were:
  CR FEATR COUNT  LBA_48  LH LM LL DV DC  Powered_Up_Time  Command/Feature_Name
  -- == -- == -- == == == -- -- -- -- --  ---------------  --------------------
  25 00 00 00 20 00 00 00 5f 1c c0 e0 00     03:09:38.128  READ DMA EXT
  35 00 00 00 20 00 00 00 0c ea c0 e0 00     03:09:38.078  WRITE DMA EXT
  35 00 00 00 08 00 00 01 d2 50 d0 e0 00     03:09:38.049  WRITE DMA EXT
  35 00 00 00 20 00 00 03 69 6d 20 e0 00     03:09:38.048  WRITE DMA EXT
  35 00 00 00 20 00 00 03 01 7e 80 e0 00     03:09:38.048  WRITE DMA EXT

Error 19 [18] occurred at disk power-on lifetime: 6819 hours (284 days + 3 hours)
  When the command that caused the error occurred, the device was active or idle.

  After command completion occurred, registers were:
  ER -- ST COUNT  LBA_48  LH LM LL DV DC
  -- -- -- == -- == == == -- -- -- -- --
  40 -- 51 00 d8 00 00 00 5f 1c c8 e0 00  Error: UNC 216 sectors at LBA = 0x005f1cc8 = 6233288

  Commands leading to the command that caused the error were:
  CR FEATR COUNT  LBA_48  LH LM LL DV DC  Powered_Up_Time  Command/Feature_Name
  -- == -- == -- == == == -- -- -- -- --  ---------------  --------------------
  25 00 00 01 00 00 00 00 5f 1c a0 e0 00     03:08:04.168  READ DMA EXT
  25 00 00 01 00 00 00 00 5f 1b a0 e0 00     03:08:04.166  READ DMA EXT
  25 00 00 01 00 00 00 00 5f 1a a0 e0 00     03:08:04.162  READ DMA EXT
  25 00 00 01 00 00 00 00 5f 19 a0 e0 00     03:08:04.137  READ DMA EXT
  35 00 00 00 20 00 00 02 7c 5a 20 e0 00     03:08:04.136  WRITE DMA EXT

Error 18 [17] occurred at disk power-on lifetime: 6819 hours (284 days + 3 hours)
  When the command that caused the error occurred, the device was active or idle.

  After command completion occurred, registers were:
  ER -- ST COUNT  LBA_48  LH LM LL DV DC
  -- -- -- == -- == == == -- -- -- -- --
  40 -- 51 00 08 00 00 00 5f 1c c8 e0 00  Error: UNC 8 sectors at LBA = 0x005f1cc8 = 6233288

  Commands leading to the command that caused the error were:
  CR FEATR COUNT  LBA_48  LH LM LL DV DC  Powered_Up_Time  Command/Feature_Name
  -- == -- == -- == == == -- -- -- -- --  ---------------  --------------------
  25 00 00 00 08 00 00 00 5f 1c c8 e0 00     03:08:00.143  READ DMA EXT
  25 00 00 00 57 00 00 00 db b8 d8 e0 00     03:08:00.108  READ DMA EXT
  25 00 00 00 08 00 00 00 db b8 d0 e0 00     03:08:00.093  READ DMA EXT
  25 00 00 00 08 00 00 00 5f 1c c0 e0 00     03:07:55.777  READ DMA EXT
  25 00 00 00 20 00 00 00 64 77 40 e0 00     03:07:55.723  READ DMA EXT

Error 17 [16] occurred at disk power-on lifetime: 6819 hours (284 days + 3 hours)
  When the command that caused the error occurred, the device was active or idle.

  After command completion occurred, registers were:
  ER -- ST COUNT  LBA_48  LH LM LL DV DC
  -- -- -- == -- == == == -- -- -- -- --
  40 -- 51 00 03 00 00 00 5f 1c c5 e0 00  Error: UNC 3 sectors at LBA = 0x005f1cc5 = 6233285

  Commands leading to the command that caused the error were:
  CR FEATR COUNT  LBA_48  LH LM LL DV DC  Powered_Up_Time  Command/Feature_Name
  -- == -- == -- == == == -- -- -- -- --  ---------------  --------------------
  25 00 00 00 08 00 00 00 5f 1c c0 e0 00     03:07:55.777  READ DMA EXT
  25 00 00 00 20 00 00 00 64 77 40 e0 00     03:07:55.723  READ DMA EXT
  35 00 00 00 08 00 00 00 64 75 18 e0 00     03:07:55.723  WRITE DMA EXT
  35 00 00 00 08 00 00 00 5f 20 88 e0 00     03:07:55.723  WRITE DMA EXT
  35 00 00 00 08 00 00 00 64 6e 20 e0 00     03:07:55.723  WRITE DMA EXT

Error 16 [15] occurred at disk power-on lifetime: 6819 hours (284 days + 3 hours)
  When the command that caused the error occurred, the device was active or idle.

  After command completion occurred, registers were:
  ER -- ST COUNT  LBA_48  LH LM LL DV DC
  -- -- -- == -- == == == -- -- -- -- --
  40 -- 51 00 fb 00 00 00 5f 1c c5 e0 00  Error: UNC 251 sectors at LBA = 0x005f1cc5 = 6233285

  Commands leading to the command that caused the error were:
  CR FEATR COUNT  LBA_48  LH LM LL DV DC  Powered_Up_Time  Command/Feature_Name
  -- == -- == -- == == == -- -- -- -- --  ---------------  --------------------
  25 00 00 01 00 00 00 00 5f 1c c0 e0 00     03:07:50.964  READ DMA EXT
  ea 00 00 00 00 63 be 8f 00 00 00 a0 00     03:07:50.906  FLUSH CACHE EXT
  35 00 00 00 b8 00 00 00 63 bd d8 e0 00     03:07:50.905  WRITE DMA EXT
  35 00 00 00 08 00 00 00 5f 20 90 e0 00     03:07:50.904  WRITE DMA EXT
  35 00 00 00 20 00 00 02 7c 5a 20 e0 00     03:07:50.904  WRITE DMA EXT

SMART Extended Self-test Log Version: 1 (1 sectors)
No self-tests have been logged.  [To run self-tests, use: smartctl -t]

SMART Selective self-test log data structure revision number 1
 SPAN  MIN_LBA  MAX_LBA  CURRENT_TEST_STATUS
    1        0        0  Not_testing
    2        0        0  Not_testing
    3        0        0  Not_testing
    4        0        0  Not_testing
    5        0        0  Not_testing
Selective self-test flags (0x0):
  After scanning selected spans, do NOT read-scan remainder of disk.
If Selective self-test is pending on power-up, resume after 0 minute delay.

SCT Status Version:                  2
SCT Version (vendor specific):       1 (0x0001)
Device State:                        Active (0)
Current Temperature:                    38 Celsius
Power Cycle Min/Max Temperature:     --/38 Celsius
Lifetime    Min/Max Temperature:     --/60 Celsius

SCT Data Table command not supported

SCT Error Recovery Control command not supported

Device Statistics (GP/SMART Log 0x04) not supported

Pending Defects log (GP Log 0x0c) not supported

SATA Phy Event Counters (GP Log 0x11)
ID      Size     Value  Description
0x0001  4            0  Command failed due to ICRC error
0x0002  4            0  R_ERR response for data FIS
0x0003  4            0  R_ERR response for device-to-host data FIS
0x0004  4            0  R_ERR response for host-to-device data FIS
0x0005  4            0  R_ERR response for non-data FIS
0x0006  4            0  R_ERR response for device-to-host non-data FIS
0x0007  4            0  R_ERR response for host-to-device non-data FIS
0x0008  4            0  Device-to-host non-data FIS retries
0x0009  4            1  Transition from drive PhyRdy to drive PhyNRdy
0x000a  4           11  Device-to-host register FISes sent due to a COMRESET
0x000b  4            0  CRC errors within host-to-device FIS
0x000d  4            0  Non-CRC errors within host-to-device FIS
0x000f  4            0  R_ERR response for host-to-device data FIS, CRC
0x0010  4            0  R_ERR response for host-to-device data FIS, non-CRC
0x0012  4            0  R_ERR response for host-to-device non-data FIS, CRC
0x0013  4            0  R_ERR response for host-to-device non-data FIS, non-CRC

