smartctl 7.4 2023-08-01 r5530 [x86_64-linux-6.6.2-desktop-1omv2390] (OpenMandriva Lx 7.4-1)
Copyright (C) 2002-23, Bruce Allen, Christian Franke, www.smartmontools.org

=== START OF INFORMATION SECTION ===
Model Number:                       KINGSTON OM8PDP3512B-A01
Serial Number:                      --
Firmware Version:                   EDFK0S03
PCI Vendor/Subsystem ID:            0x2646
IEEE OUI Identifier:                0x0026b7
Total NVM Capacity:                 512,110,190,592 [512 GB]
Unallocated NVM Capacity:           0
Controller ID:                      1
NVMe Version:                       1.3
Number of Namespaces:               1
Namespace 1 Size/Capacity:          512,110,190,592 [512 GB]
Namespace 1 Formatted LBA Size:     512
Namespace 1 IEEE EUI-64:            0026b7 ...
Local Time is:                      Sat Mar  1 00:00:09 2025 EST
Firmware Updates (0x12):            1 Slot, no Reset required
Optional Admin Commands (0x0017):   Security Format Frmw_DL Self_Test
Optional NVM Commands (0x005e):     Wr_Unc DS_Mngmt Wr_Zero Sav/Sel_Feat Timestmp
Log Page Attributes (0x0e):         Cmd_Eff_Lg Ext_Get_Lg Telmtry_Lg
Maximum Data Transfer Size:         64 Pages
Warning  Comp. Temp. Threshold:     85 Celsius
Critical Comp. Temp. Threshold:     95 Celsius

Supported Power States
St Op     Max   Active     Idle   RL RT WL WT  Ent_Lat  Ex_Lat
 0 +     4.50W       -        -    0  0  0  0        0       0
 1 +     2.70W       -        -    1  1  1  1        0       0
 2 +     2.16W       -        -    2  2  2  2        0       0
 3 -   0.0700W       -        -    3  3  3  3     1000    1000
 4 -   0.0025W       -        -    4  4  4  4     5000   45000

Supported LBA Sizes (NSID 0x1)
Id Fmt  Data  Metadt  Rel_Perf
 0 +     512       0         1
 1 -    4096       0         0

=== START OF SMART DATA SECTION ===
SMART overall-health self-assessment test result: PASSED

SMART/Health Information (NVMe Log 0x02)
Critical Warning:                   0x00
Temperature:                        57 Celsius
Available Spare:                    100%
Available Spare Threshold:          5%
Percentage Used:                    0%
Data Units Read:                    2,325,177 [1.19 TB]
Data Units Written:                 2,755,921 [1.41 TB]
Host Read Commands:                 9,553,051
Host Write Commands:                16,096,396
Controller Busy Time:               104
Power Cycles:                       22
Power On Hours:                     451
Unsafe Shutdowns:                   5
Media and Data Integrity Errors:    0
Error Information Log Entries:      125
Warning  Comp. Temperature Time:    0
Critical Comp. Temperature Time:    0

Error Information (NVMe Log 0x01, 16 of 16 entries)
Num   ErrCount  SQId   CmdId  Status  PELoc          LBA  NSID    VS  Message
  0        125     0  0x2004  0x4005  0x004            0     1     -  Invalid Field in Command
  1        124     0  0x0010  0x4005  0x028            0     0     -  Invalid Field in Command

Read Self-test Log failed: Invalid Field in Command (0x2002)

