=== START OF INFORMATION SECTION ===
Model Family:     Hitachi/HGST Travelstar 5K750
Device Model:     Hitachi HTS547550A9E384
Serial Number:    --
LU WWN Device Id: 5 000cca ...
Firmware Version: JE3OA50A
User Capacity:    500 107 862 016 bytes [500 GB]
Sector Sizes:     512 bytes logical, 4096 bytes physical
Rotation Rate:    5400 rpm
Form Factor:      2.5 inches
Device is:        In smartctl database [for details use: -P show]
ATA Version is:   ATA8-ACS T13/1699-D revision 6
SATA Version is:  SATA 2.6, 3.0 Gb/s
Local Time is:    Sun Apr  5 16:33:35 2015 YEKT
SMART support is: Available - device has SMART capability.
SMART support is: Enabled
AAM feature is:   Unavailable
APM level is:     128 (minimum power consumption without standby)
Rd look-ahead is: Enabled
Write cache is:   Enabled
ATA Security is:  Disabled, frozen [SEC2]
Wt Cache Reorder: Enabled

=== START OF READ SMART DATA SECTION ===
SMART overall-health self-assessment test result: PASSED

General SMART Values:
Offline data collection status:  (0x82)	Offline data collection activity
					was completed without error.
					Auto Offline Data Collection: Enabled.
Self-test execution status:      (   0)	The previous self-test routine completed
					without error or no self-test has ever 
					been run.
Total time to complete Offline 
data collection: 		(   45) seconds.
Offline data collection
capabilities: 			 (0x5b) SMART execute Offline immediate.
					Auto Offline data collection on/off support.
					Suspend Offline collection upon new
					command.
					Offline surface scan supported.
					Self-test supported.
					No Conveyance Self-test supported.
					Selective Self-test supported.
SMART capabilities:            (0x0003)	Saves SMART data before entering
					power-saving mode.
					Supports SMART auto save timer.
Error logging capability:        (0x01)	Error logging supported.
					General Purpose Logging supported.
Short self-test routine 
recommended polling time: 	 (   2) minutes.
Extended self-test routine
recommended polling time: 	 ( 134) minutes.
SCT capabilities: 	       (0x003d)	SCT Status supported.
					SCT Error Recovery Control supported.
					SCT Feature Control supported.
					SCT Data Table supported.

SMART Attributes Data Structure revision number: 16
Vendor Specific SMART Attributes with Thresholds:
ID# ATTRIBUTE_NAME          FLAGS    VALUE WORST THRESH FAIL RAW_VALUE
  1 Raw_Read_Error_Rate     PO-R--   100   100   062    -    0
  2 Throughput_Performance  P-S---   197   197   040    -    145
  3 Spin_Up_Time            POS---   174   174   033    -    1
  4 Start_Stop_Count        -O--C-   099   099   000    -    2731
  5 Reallocated_Sector_Ct   PO--CK   100   100   005    -    0
  7 Seek_Error_Rate         PO-R--   100   100   067    -    0
  8 Seek_Time_Performance   P-S---   120   120   040    -    32
  9 Power_On_Hours          -O--C-   095   095   000    -    2283
 10 Spin_Retry_Count        PO--C-   100   100   060    -    0
 12 Power_Cycle_Count       -O--CK   099   099   000    -    2421
191 G-Sense_Error_Rate      -O-R--   100   100   000    -    1
192 Power-Off_Retract_Count -O--CK   100   100   000    -    129
193 Load_Cycle_Count        -O--C-   080   080   000    -    204697
194 Temperature_Celsius     -O----   153   153   000    -    39 (Min/Max 14/55)
196 Reallocated_Event_Count -O--CK   100   100   000    -    0
197 Current_Pending_Sector  -O---K   100   100   000    -    0
198 Offline_Uncorrectable   ---R--   100   100   000    -    0
199 UDMA_CRC_Error_Count    -O-R--   200   200   000    -    0
223 Load_Retry_Count        -O-R--   100   100   000    -    0
                            ||||||_ K auto-keep
                            |||||__ C event count
                            ||||___ R error rate
                            |||____ S speed/performance
                            ||_____ O updated online
                            |______ P prefailure warning

General Purpose Log Directory Version 1
SMART           Log Directory Version 1 [multi-sector log support]
Address    Access  R/W   Size  Description
0x00       GPL,SL  R/O      1  Log Directory
0x01           SL  R/O      1  Summary SMART error log
0x02           SL  R/O      1  Comprehensive SMART error log
0x03       GPL     R/O      1  Ext. Comprehensive SMART error log
0x04       GPL     R/O      7  Device Statistics log
0x06           SL  R/O      1  SMART self-test log
0x07       GPL     R/O      1  Extended self-test log
0x09           SL  R/W      1  Selective self-test log
0x10       GPL     R/O      1  NCQ Command Error log
0x11       GPL     R/O      1  SATA Phy Event Counters
0x80-0x9f  GPL,SL  R/W     16  Host vendor specific log
0xe0       GPL,SL  R/W      1  SCT Command/Status
0xe1       GPL,SL  R/W      1  SCT Data Transfer

SMART Extended Comprehensive Error Log Version: 1 (1 sectors)
Device Error Count: 22 (device log contains only the most recent 4 errors)
	CR     = Command Register
	FEATR  = Features Register
	COUNT  = Count (was: Sector Count) Register
	LBA_48 = Upper bytes of LBA High/Mid/Low Registers ]  ATA-8
	LH     = LBA High (was: Cylinder High) Register    ]   LBA
	LM     = LBA Mid (was: Cylinder Low) Register      ] Register
	LL     = LBA Low (was: Sector Number) Register     ]
	DV     = Device (was: Device/Head) Register
	DC     = Device Control Register
	ER     = Error register
	ST     = Status register
Powered_Up_Time is measured from power on, and printed as
DDd+hh:mm:SS.sss where DD=days, hh=hours, mm=minutes,
SS=sec, and sss=millisec. It "wraps" after 49.710 days.

Error 22 [1] occurred at disk power-on lifetime: 1040 hours (43 days + 8 hours)
  When the command that caused the error occurred, the device was active or idle.

  After command completion occurred, registers were:
  ER -- ST COUNT  LBA_48  LH LM LL DV DC
  -- -- -- == -- == == == -- -- -- -- --
  10 -- 51 00 01 00 00 89 00 10 10 09 00  Error: IDNF at LBA = 0x89001010 = 2298482704

  Commands leading to the command that caused the error were:
  CR FEATR COUNT  LBA_48  LH LM LL DV DC  Powered_Up_Time  Command/Feature_Name
  -- == -- == -- == == == -- -- -- -- --  ---------------  --------------------
  60 00 01 00 08 00 00 89 00 10 10 40 00     00:12:18.728  READ FPDMA QUEUED
  2f 00 00 00 01 00 00 00 00 00 10 28 00     00:12:18.718  READ LOG EXT
  60 00 01 00 00 00 00 89 00 10 10 40 00     00:12:18.624  READ FPDMA QUEUED
  60 00 01 00 00 00 00 00 00 00 04 40 00     00:12:18.619  READ FPDMA QUEUED
  60 00 01 00 00 00 00 00 03 28 00 40 00     00:12:18.603  READ FPDMA QUEUED

Error 21 [0] occurred at disk power-on lifetime: 1040 hours (43 days + 8 hours)
  When the command that caused the error occurred, the device was active or idle.

  After command completion occurred, registers were:
  ER -- ST COUNT  LBA_48  LH LM LL DV DC
  -- -- -- == -- == == == -- -- -- -- --
  10 -- 51 00 01 00 00 89 00 10 10 09 00  Error: IDNF at LBA = 0x89001010 = 2298482704

  Commands leading to the command that caused the error were:
  CR FEATR COUNT  LBA_48  LH LM LL DV DC  Powered_Up_Time  Command/Feature_Name
  -- == -- == -- == == == -- -- -- -- --  ---------------  --------------------
  60 00 01 00 00 00 00 89 00 10 10 40 00     00:12:18.624  READ FPDMA QUEUED
  60 00 01 00 00 00 00 00 00 00 04 40 00     00:12:18.619  READ FPDMA QUEUED
  60 00 01 00 00 00 00 00 03 28 00 40 00     00:12:18.603  READ FPDMA QUEUED
  60 00 01 00 00 00 00 00 03 28 00 40 00     00:12:18.590  READ FPDMA QUEUED
  60 00 01 00 00 00 00 00 00 08 00 40 00     00:12:18.586  READ FPDMA QUEUED

Error 20 [3] occurred at disk power-on lifetime: 1040 hours (43 days + 8 hours)
  When the command that caused the error occurred, the device was active or idle.

  After command completion occurred, registers were:
  ER -- ST COUNT  LBA_48  LH LM LL DV DC
  -- -- -- == -- == == == -- -- -- -- --
  10 -- 51 00 01 00 00 89 00 10 10 09 00  Error: IDNF at LBA = 0x89001010 = 2298482704

  Commands leading to the command that caused the error were:
  CR FEATR COUNT  LBA_48  LH LM LL DV DC  Powered_Up_Time  Command/Feature_Name
  -- == -- == -- == == == -- -- -- -- --  ---------------  --------------------
  60 00 01 00 08 00 00 89 00 10 10 40 00     00:10:58.452  READ FPDMA QUEUED
  2f 00 00 00 01 00 00 00 00 00 10 28 00     00:10:58.446  READ LOG EXT
  60 00 01 00 00 00 00 89 00 10 10 40 00     00:10:58.353  READ FPDMA QUEUED
  60 00 01 00 00 00 00 00 00 00 04 40 00     00:10:58.345  READ FPDMA QUEUED
  60 00 01 00 00 00 00 00 03 28 00 40 00     00:10:58.331  READ FPDMA QUEUED

Error 19 [2] occurred at disk power-on lifetime: 1040 hours (43 days + 8 hours)
  When the command that caused the error occurred, the device was active or idle.

  After command completion occurred, registers were:
  ER -- ST COUNT  LBA_48  LH LM LL DV DC
  -- -- -- == -- == == == -- -- -- -- --
  10 -- 51 00 01 00 00 89 00 10 10 09 00  Error: IDNF at LBA = 0x89001010 = 2298482704

  Commands leading to the command that caused the error were:
  CR FEATR COUNT  LBA_48  LH LM LL DV DC  Powered_Up_Time  Command/Feature_Name
  -- == -- == -- == == == -- -- -- -- --  ---------------  --------------------
  60 00 01 00 00 00 00 89 00 10 10 40 00     00:10:58.353  READ FPDMA QUEUED
  60 00 01 00 00 00 00 00 00 00 04 40 00     00:10:58.345  READ FPDMA QUEUED
  60 00 01 00 00 00 00 00 03 28 00 40 00     00:10:58.331  READ FPDMA QUEUED
  60 00 40 00 00 00 00 00 06 ba 7a 40 00     00:10:58.320  READ FPDMA QUEUED
  60 00 01 00 08 00 00 00 03 28 00 40 00     00:10:58.307  READ FPDMA QUEUED

SMART Extended Self-test Log Version: 1 (1 sectors)
No self-tests have been logged.  [To run self-tests, use: smartctl -t]

SMART Selective self-test log data structure revision number 1
 SPAN  MIN_LBA  MAX_LBA  CURRENT_TEST_STATUS
    1        0        0  Not_testing
    2        0        0  Not_testing
    3        0        0  Not_testing
    4        0        0  Not_testing
    5        0        0  Not_testing
Selective self-test flags (0x0):
  After scanning selected spans, do NOT read-scan remainder of disk.
If Selective self-test is pending on power-up, resume after 0 minute delay.

SCT Status Version:                  3
SCT Version (vendor specific):       256 (0x0100)
SCT Support Level:                   1
Device State:                        Active (0)
Current Temperature:                    39 Celsius
Power Cycle Min/Max Temperature:     28/40 Celsius
Lifetime    Min/Max Temperature:     14/55 Celsius
Lifetime    Average Temperature:        36 Celsius
Under/Over Temperature Limit Count:   0/0

SCT Temperature History Version:     2
Temperature Sampling Period:         1 minute
Temperature Logging Interval:        1 minute
Min/Max recommended Temperature:      0/60 Celsius
Min/Max Temperature Limit:           -40/65 Celsius
Temperature History Size (Index):    128 (35)

SCT Error Recovery Control:
           Read: Disabled
          Write: Disabled

Device Statistics (GP Log 0x04)
Page Offset Size         Value  Description
  1  =====  =                =  == General Statistics (rev 1) ==
  1  0x008  4             2421  Lifetime Power-On Resets
  1  0x010  4             2283  Power-on Hours
  1  0x018  6       9209528497  Logical Sectors Written
  1  0x020  6        139084106  Number of Write Commands
  1  0x028  6      12564654538  Logical Sectors Read
  1  0x030  6        188448759  Number of Read Commands
  3  =====  =                =  == Rotating Media Statistics (rev 1) ==
  3  0x008  4             1557  Spindle Motor Power-on Hours
  3  0x010  4             1542  Head Flying Hours
  3  0x018  4           204697  Head Load Events
  3  0x020  4                0  Number of Reallocated Logical Sectors
  3  0x028  4              263  Read Recovery Attempts
  3  0x030  4                0  Number of Mechanical Start Failures
  4  =====  =                =  == General Errors Statistics (rev 1) ==
  4  0x008  4               22  Number of Reported Uncorrectable Errors
  4  0x010  4             4130  Resets Between Cmd Acceptance and Completion
  5  =====  =                =  == Temperature Statistics (rev 1) ==
  5  0x008  1               40  Current Temperature
  5  0x010  1               35~ Average Short Term Temperature
  5  0x018  1               36~ Average Long Term Temperature
  5  0x020  1               55  Highest Temperature
  5  0x028  1               14  Lowest Temperature
  5  0x030  1               40~ Highest Average Short Term Temperature
  5  0x038  1               25~ Lowest Average Short Term Temperature
  5  0x040  1               38~ Highest Average Long Term Temperature
  5  0x048  1               25~ Lowest Average Long Term Temperature
  5  0x050  4                0  Time in Over-Temperature
  5  0x058  1               60  Specified Maximum Operating Temperature
  5  0x060  4                0  Time in Under-Temperature
  5  0x068  1                0  Specified Minimum Operating Temperature
  6  =====  =                =  == Transport Statistics (rev 1) ==
  6  0x008  4            17307  Number of Hardware Resets
  6  0x010  4             3047  Number of ASR Events
  6  0x018  4                0  Number of Interface CRC Errors
                              |_ ~ normalized value

SATA Phy Event Counters (GP Log 0x11)
ID      Size     Value  Description
0x0001  2            0  Command failed due to ICRC error
0x0002  2            0  R_ERR response for data FIS
0x0003  2            0  R_ERR response for device-to-host data FIS
0x0004  2            0  R_ERR response for host-to-device data FIS
0x0005  2            0  R_ERR response for non-data FIS
0x0006  2            0  R_ERR response for device-to-host non-data FIS
0x0007  2            0  R_ERR response for host-to-device non-data FIS
0x0009  2            5  Transition from drive PhyRdy to drive PhyNRdy
0x000a  2            2  Device-to-host register FISes sent due to a COMRESET
0x000b  2            0  CRC errors within host-to-device FIS
0x000d  2            0  Non-CRC errors within host-to-device FIS

