=== START OF INFORMATION SECTION ===
Model Family:     Seagate Barracuda 7200.12
Device Model:     ST3500410AS
Serial Number:    --
LU WWN Device Id: 5 000c50 ...
Firmware Version: CC34
User Capacity:    500 107 862 016 bytes [500 GB]
Sector Size:      512 bytes logical/physical
Rotation Rate:    7200 rpm
Device is:        In smartctl database [for details use: -P show]
ATA Version is:   ATA8-ACS T13/1699-D revision 4
SATA Version is:  SATA 2.6, 3.0 Gb/s
Local Time is:    Fri Oct 23 02:03:07 2015 MSK

==> WARNING: A firmware update for this drive may be available,
see the following Seagate web pages:
http://knowledge.seagate.com/articles/en_US/FAQ/207931en
http://knowledge.seagate.com/articles/en_US/FAQ/213891en

SMART support is: Available - device has SMART capability.
SMART support is: Enabled
AAM level is:     0 (vendor specific), recommended: 254
APM feature is:   Unavailable
Rd look-ahead is: Enabled
Write cache is:   Enabled
ATA Security is:  Disabled, frozen [SEC2]
Wt Cache Reorder: Unknown

=== START OF READ SMART DATA SECTION ===
SMART overall-health self-assessment test result: FAILED!
Drive failure expected in less than 24 hours. SAVE ALL DATA.
See vendor-specific Attribute list for failed Attributes.

General SMART Values:
Offline data collection status:  (0x82)	Offline data collection activity
					was completed without error.
					Auto Offline Data Collection: Enabled.
Self-test execution status:      (   0)	The previous self-test routine completed
					without error or no self-test has ever 
					been run.
Total time to complete Offline 
data collection: 		(  592) seconds.
Offline data collection
capabilities: 			 (0x7b) SMART execute Offline immediate.
					Auto Offline data collection on/off support.
					Suspend Offline collection upon new
					command.
					Offline surface scan supported.
					Self-test supported.
					Conveyance Self-test supported.
					Selective Self-test supported.
SMART capabilities:            (0x0003)	Saves SMART data before entering
					power-saving mode.
					Supports SMART auto save timer.
Error logging capability:        (0x01)	Error logging supported.
					General Purpose Logging supported.
Short self-test routine 
recommended polling time: 	 (   1) minutes.
Extended self-test routine
recommended polling time: 	 (  94) minutes.
Conveyance self-test routine
recommended polling time: 	 (   2) minutes.
SCT capabilities: 	       (0x103f)	SCT Status supported.
					SCT Error Recovery Control supported.
					SCT Feature Control supported.
					SCT Data Table supported.

SMART Attributes Data Structure revision number: 10
Vendor Specific SMART Attributes with Thresholds:
ID# ATTRIBUTE_NAME          FLAGS    VALUE WORST THRESH FAIL RAW_VALUE
  1 Raw_Read_Error_Rate     POSR--   117   099   006    -    137121101
  3 Spin_Up_Time            PO----   097   097   000    -    0
  4 Start_Stop_Count        -O--CK   099   099   020    -    1394
  5 Reallocated_Sector_Ct   PO--CK   004   004   036    NOW  3955
  7 Seek_Error_Rate         POSR--   078   060   030    -    83817700
  9 Power_On_Hours          -O--CK   072   072   000    -    25121
 10 Spin_Retry_Count        PO--C-   100   100   097    -    0
 12 Power_Cycle_Count       -O--CK   099   099   020    -    1397
183 Runtime_Bad_Block       ------   100   100   000    -    0
184 End-to-End_Error        -O--CK   100   100   099    -    0
187 Reported_Uncorrect      -O--CK   100   100   000    -    0
188 Command_Timeout         -O--CK   100   043   000    -    670025121948
189 High_Fly_Writes         -O-RCK   077   077   000    -    23
190 Airflow_Temperature_Cel -O---K   068   046   045    -    32 (Min/Max 24/34)
194 Temperature_Celsius     -O---K   032   054   000    -    32 (0 14 0 0 0)
195 Hardware_ECC_Recovered  -O-RC-   021   017   000    -    137121101
197 Current_Pending_Sector  -O--C-   100   100   000    -    0
198 Offline_Uncorrectable   ----C-   100   100   000    -    0
199 UDMA_CRC_Error_Count    -OSRCK   200   200   000    -    0
240 Head_Flying_Hours       ------   100   253   000    -    28764 (178 122 0)
241 Total_LBAs_Written      ------   100   253   000    -    3554296657
242 Total_LBAs_Read         ------   100   253   000    -    910733411
                            ||||||_ K auto-keep
                            |||||__ C event count
                            ||||___ R error rate
                            |||____ S speed/performance
                            ||_____ O updated online
                            |______ P prefailure warning

General Purpose Log Directory Version 1
SMART           Log Directory Version 1 [multi-sector log support]
Address    Access  R/W   Size  Description
0x00       GPL,SL  R/O      1  Log Directory
0x01       GPL,SL  R/O      1  Summary SMART error log
0x02       GPL,SL  R/O      5  Comprehensive SMART error log
0x03       GPL,SL  R/O      5  Ext. Comprehensive SMART error log
0x06       GPL,SL  R/O      1  SMART self-test log
0x07       GPL,SL  R/O      1  Extended self-test log
0x09       GPL,SL  R/W      1  Selective self-test log
0x10       GPL,SL  R/O      1  NCQ Command Error log
0x11       GPL,SL  R/O      1  SATA Phy Event Counters
0x21       GPL,SL  R/O      1  Write stream error log
0x22       GPL,SL  R/O      1  Read stream error log
0x80-0x9f  GPL,SL  R/W     16  Host vendor specific log
0xa1       GPL,SL  VS      20  Device vendor specific log
0xa2       GPL     VS    2248  Device vendor specific log
0xa8       GPL,SL  VS     129  Device vendor specific log
0xa9       GPL,SL  VS       1  Device vendor specific log
0xb0       GPL     VS    2928  Device vendor specific log
0xbd       GPL,SL  VS     252  Device vendor specific log
0xbe-0xbf  GPL     VS   65535  Device vendor specific log
0xc0       GPL,SL  VS       1  Device vendor specific log
0xe0       GPL,SL  R/W      1  SCT Command/Status
0xe1       GPL,SL  R/W      1  SCT Data Transfer

SMART Extended Comprehensive Error Log Version: 1 (5 sectors)
Device Error Count: 57827 (device log contains only the most recent 20 errors)
	CR     = Command Register
	FEATR  = Features Register
	COUNT  = Count (was: Sector Count) Register
	LBA_48 = Upper bytes of LBA High/Mid/Low Registers ]  ATA-8
	LH     = LBA High (was: Cylinder High) Register    ]   LBA
	LM     = LBA Mid (was: Cylinder Low) Register      ] Register
	LL     = LBA Low (was: Sector Number) Register     ]
	DV     = Device (was: Device/Head) Register
	DC     = Device Control Register
	ER     = Error register
	ST     = Status register
Powered_Up_Time is measured from power on, and printed as
DDd+hh:mm:SS.sss where DD=days, hh=hours, mm=minutes,
SS=sec, and sss=millisec. It "wraps" after 49.710 days.

Error 57827 [6] occurred at disk power-on lifetime: 3276 hours (136 days + 12 hours)
  When the command that caused the error occurred, the device was active or idle.

  After command completion occurred, registers were:
  ER -- ST COUNT  LBA_48  LH LM LL DV DC
  -- -- -- == -- == == == -- -- -- -- --
  04 -- 51 00 00 00 2a 48 00 75 99 00 00

  Commands leading to the command that caused the error were:
  CR FEATR COUNT  LBA_48  LH LM LL DV DC  Powered_Up_Time  Command/Feature_Name
  -- == -- == -- == == == -- -- -- -- --  ---------------  --------------------
  ea 00 00 00 00 00 00 00 00 00 00 a0 00     20:00:26.770  FLUSH CACHE EXT
  39 d0 00 00 08 00 00 3f 00 5e 00 e0 00     20:00:26.770  WRITE MULTIPLE EXT
  39 d0 00 00 08 00 00 e5 00 5e e8 e0 00     20:00:26.769  WRITE MULTIPLE EXT
  39 d0 00 00 08 00 36 d9 00 76 b0 e0 00     20:00:26.768  WRITE MULTIPLE EXT
  39 d0 00 00 08 00 00 3e 00 5e f8 e0 00     20:00:24.330  WRITE MULTIPLE EXT

Error 57826 [5] occurred at disk power-on lifetime: 3256 hours (135 days + 16 hours)
  When the command that caused the error occurred, the device was active or idle.

  After command completion occurred, registers were:
  ER -- ST COUNT  LBA_48  LH LM LL DV DC
  -- -- -- == -- == == == -- -- -- -- --
  04 -- 71 00 03 00 00 01 00 32 80 e0 00  Device Fault; Error: ABRT

  Commands leading to the command that caused the error were:
  CR FEATR COUNT  LBA_48  LH LM LL DV DC  Powered_Up_Time  Command/Feature_Name
  -- == -- == -- == == == -- -- -- -- --  ---------------  --------------------
  a1 00 00 00 00 00 00 00 00 00 00 a0 00     10:25:52.303  IDENTIFY PACKET DEVICE
  ec 00 00 00 00 00 00 00 00 00 00 a0 00     10:25:52.303  IDENTIFY DEVICE
  a1 00 00 00 03 00 00 01 00 32 80 a0 00     10:25:43.676  IDENTIFY PACKET DEVICE
  ec 00 00 00 01 00 00 00 00 00 01 a0 00     10:25:43.147  IDENTIFY DEVICE
  00 00 00 00 00 00 00 00 00 00 00 00 ff     10:25:34.793  NOP [Abort queued commands]

Error 57825 [4] occurred at disk power-on lifetime: 3256 hours (135 days + 16 hours)
  When the command that caused the error occurred, the device was active or idle.

  After command completion occurred, registers were:
  ER -- ST COUNT  LBA_48  LH LM LL DV DC
  -- -- -- == -- == == == -- -- -- -- --
  04 -- 71 00 03 00 00 01 00 32 80 e0 00

  Commands leading to the command that caused the error were:
  CR FEATR COUNT  LBA_48  LH LM LL DV DC  Powered_Up_Time  Command/Feature_Name
  -- == -- == -- == == == -- -- -- -- --  ---------------  --------------------
  ec 00 00 00 00 00 00 00 00 00 00 a0 00     10:25:52.303  IDENTIFY DEVICE
  a1 00 00 00 03 00 00 01 00 32 80 a0 00     10:25:43.676  IDENTIFY PACKET DEVICE
  ec 00 00 00 01 00 00 00 00 00 01 a0 00     10:25:43.147  IDENTIFY DEVICE
  00 00 00 00 00 00 00 00 00 00 00 00 ff     10:25:34.793  NOP [Abort queued commands]
  00 00 00 00 00 00 00 00 00 00 00 00 ff     10:25:34.451  NOP [Abort queued commands]

Error 57824 [3] occurred at disk power-on lifetime: 3256 hours (135 days + 16 hours)
  When the command that caused the error occurred, the device was active or idle.

  After command completion occurred, registers were:
  ER -- ST COUNT  LBA_48  LH LM LL DV DC
  -- -- -- == -- == == == -- -- -- -- --
  04 -- 71 00 03 00 00 01 00 32 80 e0 00  Device Fault; Error: ABRT

  Commands leading to the command that caused the error were:
  CR FEATR COUNT  LBA_48  LH LM LL DV DC  Powered_Up_Time  Command/Feature_Name
  -- == -- == -- == == == -- -- -- -- --  ---------------  --------------------
  a1 00 00 00 03 00 00 01 00 32 80 a0 00     10:25:43.676  IDENTIFY PACKET DEVICE
  ec 00 00 00 01 00 00 00 00 00 01 a0 00     10:25:43.147  IDENTIFY DEVICE
  00 00 00 00 00 00 00 00 00 00 00 00 ff     10:25:34.793  NOP [Abort queued commands]
  00 00 00 00 00 00 00 00 00 00 00 00 ff     10:25:34.451  NOP [Abort queued commands]
  c6 00 00 00 00 00 00 01 00 32 80 a0 00     10:25:33.669  SET MULTIPLE MODE

Error 57823 [2] occurred at disk power-on lifetime: 3256 hours (135 days + 16 hours)
  When the command that caused the error occurred, the device was active or idle.

  After command completion occurred, registers were:
  ER -- ST COUNT  LBA_48  LH LM LL DV DC
  -- -- -- == -- == == == -- -- -- -- --
  04 -- 71 00 03 00 00 01 00 32 80 e0 00

  Commands leading to the command that caused the error were:
  CR FEATR COUNT  LBA_48  LH LM LL DV DC  Powered_Up_Time  Command/Feature_Name
  -- == -- == -- == == == -- -- -- -- --  ---------------  --------------------
  ec 00 00 00 01 00 00 00 00 00 01 a0 00     10:25:43.147  IDENTIFY DEVICE
  00 00 00 00 00 00 00 00 00 00 00 00 ff     10:25:34.793  NOP [Abort queued commands]
  00 00 00 00 00 00 00 00 00 00 00 00 ff     10:25:34.451  NOP [Abort queued commands]
  c6 00 00 00 00 00 00 01 00 32 80 a0 00     10:25:33.669  SET MULTIPLE MODE
  34 03 00 00 08 00 00 6c 00 5e 58 e0 00     10:25:33.668  WRITE SECTORS(S) EXT

Error 57822 [1] occurred at disk power-on lifetime: 3256 hours (135 days + 16 hours)
  When the command that caused the error occurred, the device was active or idle.

  After command completion occurred, registers were:
  ER -- ST COUNT  LBA_48  LH LM LL DV DC
  -- -- -- == -- == == == -- -- -- -- --
  04 -- 71 00 03 00 00 01 00 32 80 e0 00  Device Fault; Error: ABRT

  Commands leading to the command that caused the error were:
  CR FEATR COUNT  LBA_48  LH LM LL DV DC  Powered_Up_Time  Command/Feature_Name
  -- == -- == -- == == == -- -- -- -- --  ---------------  --------------------
  c6 00 00 00 00 00 00 01 00 32 80 a0 00     10:25:33.669  SET MULTIPLE MODE
  34 03 00 00 08 00 00 6c 00 5e 58 e0 00     10:25:33.668  WRITE SECTORS(S) EXT
  c6 00 00 00 00 00 00 01 00 32 80 a0 00     10:25:33.644  SET MULTIPLE MODE
  24 03 00 00 08 00 00 3b 00 61 b0 e0 00     10:25:33.644  READ SECTOR(S) EXT
  c6 00 00 00 00 00 00 01 00 32 80 a0 00     10:25:33.600  SET MULTIPLE MODE

Error 57821 [0] occurred at disk power-on lifetime: 3256 hours (135 days + 16 hours)
  When the command that caused the error occurred, the device was active or idle.

  After command completion occurred, registers were:
  ER -- ST COUNT  LBA_48  LH LM LL DV DC
  -- -- -- == -- == == == -- -- -- -- --
  04 -- 71 00 03 00 00 01 00 32 80 e0 00  Device Fault; Error: ABRT

  Commands leading to the command that caused the error were:
  CR FEATR COUNT  LBA_48  LH LM LL DV DC  Powered_Up_Time  Command/Feature_Name
  -- == -- == -- == == == -- -- -- -- --  ---------------  --------------------
  c6 00 00 00 00 00 00 01 00 32 80 a0 00     10:25:33.644  SET MULTIPLE MODE
  24 03 00 00 08 00 00 3b 00 61 b0 e0 00     10:25:33.644  READ SECTOR(S) EXT
  c6 00 00 00 00 00 00 01 00 32 80 a0 00     10:25:33.600  SET MULTIPLE MODE
  34 03 00 00 08 00 00 6c 00 5e 50 e0 00     10:25:33.600  WRITE SECTORS(S) EXT
  c6 00 00 00 00 00 00 01 00 32 80 a0 00     10:25:32.611  SET MULTIPLE MODE

Error 57820 [19] occurred at disk power-on lifetime: 3256 hours (135 days + 16 hours)
  When the command that caused the error occurred, the device was active or idle.

  After command completion occurred, registers were:
  ER -- ST COUNT  LBA_48  LH LM LL DV DC
  -- -- -- == -- == == == -- -- -- -- --
  04 -- 71 00 03 00 00 01 00 32 80 e0 00  Device Fault; Error: ABRT

  Commands leading to the command that caused the error were:
  CR FEATR COUNT  LBA_48  LH LM LL DV DC  Powered_Up_Time  Command/Feature_Name
  -- == -- == -- == == == -- -- -- -- --  ---------------  --------------------
  c6 00 00 00 00 00 00 01 00 32 80 a0 00     10:25:33.644  SET MULTIPLE MODE
  24 03 00 00 08 00 00 3b 00 61 b0 e0 00     10:25:33.644  READ SECTOR(S) EXT
  c6 00 00 00 00 00 00 01 00 32 80 a0 00     10:25:33.600  SET MULTIPLE MODE
  34 03 00 00 08 00 00 6c 00 5e 50 e0 00     10:25:33.600  WRITE SECTORS(S) EXT
  c6 00 00 00 00 00 00 01 00 32 80 a0 00     10:25:32.611  SET MULTIPLE MODE

SMART Extended Self-test Log Version: 1 (1 sectors)
Num  Test_Description    Status                  Remaining  LifeTime(hours)  LBA_of_first_error
# 1  Extended offline    Completed: unknown failure    90%     25000         0

SMART Selective self-test log data structure revision number 1
 SPAN  MIN_LBA  MAX_LBA  CURRENT_TEST_STATUS
    1        0        0  Not_testing
    2        0        0  Not_testing
    3        0        0  Not_testing
    4        0        0  Not_testing
    5        0        0  Not_testing
Selective self-test flags (0x0):
  After scanning selected spans, do NOT read-scan remainder of disk.
If Selective self-test is pending on power-up, resume after 0 minute delay.

SCT Status Version:                  3
SCT Version (vendor specific):       522 (0x020a)
SCT Support Level:                   1
Device State:                        Active (0)
Current Temperature:                    32 Celsius
Power Cycle Min/Max Temperature:     24/34 Celsius
Lifetime    Min/Max Temperature:     14/54 Celsius
Under/Over Temperature Limit Count:   0/0

SCT Temperature History Version:     2
Temperature Sampling Period:         10 minutes
Temperature Logging Interval:        59 minutes
Min/Max recommended Temperature:     14/55 Celsius
Min/Max Temperature Limit:           10/60 Celsius
Temperature History Size (Index):    128 (120)

SCT Error Recovery Control:
           Read: Disabled
          Write: Disabled

Device Statistics (GP Log 0x04) not supported

SATA Phy Event Counters (GP Log 0x11)
ID      Size     Value  Description
0x000a  2            1  Device-to-host register FISes sent due to a COMRESET
0x0001  2            0  Command failed due to ICRC error
0x0003  2            0  R_ERR response for device-to-host data FIS
0x0004  2            0  R_ERR response for host-to-device data FIS
0x0006  2            0  R_ERR response for device-to-host non-data FIS
0x0007  2            0  R_ERR response for host-to-device non-data FIS

