smartctl 7.3 2022-02-28 r5338 [x86_64-linux-6.1.9-arch1-1] (local build)
Copyright (C) 2002-22, Bruce Allen, Christian Franke, www.smartmontools.org

=== START OF INFORMATION SECTION ===
Model Number:                       512GB NVMe SSD
Serial Number:                      --
Firmware Version:                   APE00PI0
PCI Vendor/Subsystem ID:            0x1987
IEEE OUI Identifier:                0x6479a7
Total NVM Capacity:                 512,110,190,592 [512 GB]
Unallocated NVM Capacity:           0
Controller ID:                      1
NVMe Version:                       1.3
Number of Namespaces:               1
Namespace 1 Size/Capacity:          512,110,190,592 [512 GB]
Namespace 1 Formatted LBA Size:     512
Namespace 1 IEEE EUI-64:            6479a7 ...
Local Time is:                      Mon Feb 13 18:28:40 2023 CST
Firmware Updates (0x12):            1 Slot, no Reset required
Optional Admin Commands (0x0017):   Security Format Frmw_DL Self_Test
Optional NVM Commands (0x005e):     Wr_Unc DS_Mngmt Wr_Zero Sav/Sel_Feat Timestmp
Log Page Attributes (0x0a):         Cmd_Eff_Lg Telmtry_Lg
Maximum Data Transfer Size:         64 Pages
Warning  Comp. Temp. Threshold:     70 Celsius
Critical Comp. Temp. Threshold:     80 Celsius

Supported Power States
St Op     Max   Active     Idle   RL RT WL WT  Ent_Lat  Ex_Lat
 0 +     4.50W       -        -    0  0  0  0        0       0
 1 +     2.70W       -        -    1  1  1  1        0       0
 2 +     2.16W       -        -    2  2  2  2        0       0
 3 -   0.0700W       -        -    3  3  3  3     1000    1000
 4 -   0.0050W       -        -    4  4  4  4     5000   50000

Supported LBA Sizes (NSID 0x1)
Id Fmt  Data  Metadt  Rel_Perf
 0 +     512       0         1
 1 -    4096       0         0

=== START OF SMART DATA SECTION ===
SMART overall-health self-assessment test result: PASSED

SMART/Health Information (NVMe Log 0x02)
Critical Warning:                   0x00
Temperature:                        33 Celsius
Available Spare:                    100%
Available Spare Threshold:          5%
Percentage Used:                    2%
Data Units Read:                    13,276,156 [6.79 TB]
Data Units Written:                 10,244,629 [5.24 TB]
Host Read Commands:                 266,464,403
Host Write Commands:                169,692,441
Controller Busy Time:               1,549
Power Cycles:                       141
Power On Hours:                     4,409
Unsafe Shutdowns:                   28
Media and Data Integrity Errors:    0
Error Information Log Entries:      12,692,687
Warning  Comp. Temperature Time:    0
Critical Comp. Temperature Time:    0
Temperature Sensor 1:               45 Celsius
Temperature Sensor 3:               33 Celsius

Error Information (NVMe Log 0x01, 16 of 16 entries)
Num   ErrCount  SQId   CmdId  Status  PELoc          LBA  NSID    VS
  0   12692687     0  0x9015  0x4004      -            0     0     -
  1   12692686     0  0x8017  0x4004      -            0     0     -
  2   12692685     0  0xa01d  0x4004      -            0     0     -
  3   12692684     0  0xa01c  0x4004      -            0     0     -
  4   12692683     0  0x901c  0x4004      -            0     0     -
  5   12692682     0  0x801d  0x4004      -            0     0     -
  6   12692681     0  0xe00a  0x4004      -            0     0     -
  7   12692680     0  0xe008  0x4004      -            0     0     -
  8   12692679     0  0xd008  0x4004      -            0     0     -
  9   12692678     0  0xc00a  0x4004      -            0     0     -
 10   12692677     0  0xb00a  0x4005      -            0     0     -
 11   12692676     0  0xb008  0x4005      -            0     0     -
 12   12692675     0  0xa008  0x4005      -            0     0     -
 13   12692674     0  0x900a  0x4005      -            0     0     -
 14   12692673     0  0x800a  0x4005      -            0     0     -
 15   12692672     0  0x8008  0x4005      -            0     0     -

