smartctl 7.3 2022-02-28 r5338 [x86_64-linux-6.1.1-desktop-1omv2290] (OpenMandriva Lx 7.3-2)
Copyright (C) 2002-22, Bruce Allen, Christian Franke, www.smartmontools.org

=== START OF INFORMATION SECTION ===
Model Family:     Seagate Laptop HDD
Device Model:     ST500LT012-9WS142
Serial Number:    --
LU WWN Device Id: 5 000c50 ...
Firmware Version: 0001SDM1
User Capacity:    500,107,862,016 bytes [500 GB]
Sector Sizes:     512 bytes logical, 4096 bytes physical
Rotation Rate:    5400 rpm
Form Factor:      2.5 inches
Device is:        In smartctl database
ATA Version is:   ATA8-ACS T13/1699-D revision 4
SATA Version is:  SATA 2.6, 3.0 Gb/s (current: 3.0 Gb/s)
Local Time is:    Fri Feb 24 08:59:13 2023 -03
SMART support is: Available - device has SMART capability.
SMART support is: Enabled
AAM feature is:   Unavailable
APM level is:     128 (minimum power consumption without standby)
Rd look-ahead is: Enabled
Write cache is:   Enabled
DSN feature is:   Unavailable
ATA Security is:  Disabled, frozen [SEC2]
Wt Cache Reorder: Enabled

=== START OF READ SMART DATA SECTION ===
SMART overall-health self-assessment test result: PASSED

General SMART Values:
Offline data collection status:  (0x00)	Offline data collection activity
					was never started.
					Auto Offline Data Collection: Disabled.
Self-test execution status:      (   0)	The previous self-test routine completed
					without error or no self-test has ever 
					been run.
Total time to complete Offline 
data collection: 		(    0) seconds.
Offline data collection
capabilities: 			 (0x73) SMART execute Offline immediate.
					Auto Offline data collection on/off support.
					Suspend Offline collection upon new
					command.
					No Offline surface scan supported.
					Self-test supported.
					Conveyance Self-test supported.
					Selective Self-test supported.
SMART capabilities:            (0x0003)	Saves SMART data before entering
					power-saving mode.
					Supports SMART auto save timer.
Error logging capability:        (0x01)	Error logging supported.
					General Purpose Logging supported.
Short self-test routine 
recommended polling time: 	 (   1) minutes.
Extended self-test routine
recommended polling time: 	 ( 101) minutes.
Conveyance self-test routine
recommended polling time: 	 (   2) minutes.
SCT capabilities: 	       (0x1035)	SCT Status supported.
					SCT Feature Control supported.
					SCT Data Table supported.

SMART Attributes Data Structure revision number: 10
Vendor Specific SMART Attributes with Thresholds:
ID# ATTRIBUTE_NAME          FLAGS    VALUE WORST THRESH FAIL RAW_VALUE
  1 Raw_Read_Error_Rate     POSR--   110   072   006    -    227183927
  3 Spin_Up_Time            PO----   099   099   000    -    0
  4 Start_Stop_Count        -O--CK   091   091   020    -    9330
  5 Reallocated_Sector_Ct   PO--CK   097   097   036    -    528
  7 Seek_Error_Rate         POSR--   076   060   030    -    26013746289
  9 Power_On_Hours          -O--CK   090   090   000    -    8802 (237 7 0)
 10 Spin_Retry_Count        PO--C-   100   100   097    -    0
 12 Power_Cycle_Count       -O--CK   091   091   020    -    9262
184 End-to-End_Error        -O--CK   100   100   099    -    0
187 Reported_Uncorrect      -O--CK   001   001   000    -    16395
188 Command_Timeout         -O--CK   100   094   000    -    188981444877
189 High_Fly_Writes         -O-RCK   100   100   000    -    0
190 Airflow_Temperature_Cel -O---K   070   047   045    -    30 (Min/Max 26/30)
191 G-Sense_Error_Rate      -O--CK   100   100   000    -    342
192 Power-Off_Retract_Count -O--CK   100   100   000    -    319
193 Load_Cycle_Count        -O--CK   058   058   000    -    85789
194 Temperature_Celsius     -O---K   030   053   000    -    30 (0 7 0 0 0)
196 Reallocated_Event_Count POSR--   091   091   030    -    8574 (14666 0)
197 Current_Pending_Sector  -O--C-   100   077   000    -    0
198 Offline_Uncorrectable   ----C-   100   077   000    -    0
199 UDMA_CRC_Error_Count    -OSRCK   200   200   000    -    0
240 Head_Flying_Hours       ------   091   091   000    -    8574 (57 74 0)
241 Total_LBAs_Written      ------   100   253   000    -    2648772192
242 Total_LBAs_Read         ------   100   253   000    -    4006099298
254 Free_Fall_Sensor        -O--CK   100   100   000    -    0
                            ||||||_ K auto-keep
                            |||||__ C event count
                            ||||___ R error rate
                            |||____ S speed/performance
                            ||_____ O updated online
                            |______ P prefailure warning

General Purpose Log Directory Version 1
SMART           Log Directory Version 1 [multi-sector log support]
Address    Access  R/W   Size  Description
0x00       GPL,SL  R/O      1  Log Directory
0x01           SL  R/O      1  Summary SMART error log
0x02           SL  R/O      5  Comprehensive SMART error log
0x03       GPL     R/O      5  Ext. Comprehensive SMART error log
0x06           SL  R/O      1  SMART self-test log
0x07       GPL     R/O      1  Extended self-test log
0x09           SL  R/W      1  Selective self-test log
0x10       GPL     R/O      1  NCQ Command Error log
0x11       GPL     R/O      1  SATA Phy Event Counters log
0x21       GPL     R/O      1  Write stream error log
0x22       GPL     R/O      1  Read stream error log
0x80-0x9f  GPL,SL  R/W     16  Host vendor specific log
0xa1       GPL,SL  VS      20  Device vendor specific log
0xa2       GPL     VS    2248  Device vendor specific log
0xa8       GPL,SL  VS      65  Device vendor specific log
0xa9       GPL,SL  VS       1  Device vendor specific log
0xab       GPL     VS       1  Device vendor specific log
0xb0       GPL     VS    2864  Device vendor specific log
0xbd-0xbf  GPL     VS   65535  Device vendor specific log
0xc0       GPL,SL  VS       1  Device vendor specific log
0xe0       GPL,SL  R/W      1  SCT Command/Status
0xe1       GPL,SL  R/W      1  SCT Data Transfer

SMART Extended Comprehensive Error Log Version: 1 (5 sectors)
Device Error Count: 16770 (device log contains only the most recent 20 errors)
	CR     = Command Register
	FEATR  = Features Register
	COUNT  = Count (was: Sector Count) Register
	LBA_48 = Upper bytes of LBA High/Mid/Low Registers ]  ATA-8
	LH     = LBA High (was: Cylinder High) Register    ]   LBA
	LM     = LBA Mid (was: Cylinder Low) Register      ] Register
	LL     = LBA Low (was: Sector Number) Register     ]
	DV     = Device (was: Device/Head) Register
	DC     = Device Control Register
	ER     = Error register
	ST     = Status register
Powered_Up_Time is measured from power on, and printed as
DDd+hh:mm:SS.sss where DD=days, hh=hours, mm=minutes,
SS=sec, and sss=millisec. It "wraps" after 49.710 days.

Error 16770 [9] occurred at disk power-on lifetime: 8795 hours (366 days + 11 hours)
  When the command that caused the error occurred, the device was active or idle.

  After command completion occurred, registers were:
  ER -- ST COUNT  LBA_48  LH LM LL DV DC
  -- -- -- == -- == == == -- -- -- -- --
  40 -- 51 00 00 00 00 00 3c a4 e8 00 00  Error: UNC at LBA = 0x003ca4e8 = 3974376

  Commands leading to the command that caused the error were:
  CR FEATR COUNT  LBA_48  LH LM LL DV DC  Powered_Up_Time  Command/Feature_Name
  -- == -- == -- == == == -- -- -- -- --  ---------------  --------------------
  c8 00 00 00 08 00 00 00 3c a4 e8 e0 00     00:51:08.460  READ DMA
  35 00 00 01 00 00 00 19 88 92 00 e0 00     00:51:08.459  WRITE DMA EXT
  35 00 00 01 68 00 00 39 1f f6 fe e0 00     00:51:08.458  WRITE DMA EXT
  35 00 00 01 c0 00 00 19 88 8f e8 e0 00     00:51:08.457  WRITE DMA EXT
  27 00 00 00 00 00 00 00 00 00 00 e0 00     00:51:08.456  READ NATIVE MAX ADDRESS EXT [OBS-ACS-3]

Error 16769 [8] occurred at disk power-on lifetime: 8795 hours (366 days + 11 hours)
  When the command that caused the error occurred, the device was active or idle.

  After command completion occurred, registers were:
  ER -- ST COUNT  LBA_48  LH LM LL DV DC
  -- -- -- == -- == == == -- -- -- -- --
  40 -- 51 00 00 00 00 00 3c a4 e8 00 00  Error: UNC at LBA = 0x003ca4e8 = 3974376

  Commands leading to the command that caused the error were:
  CR FEATR COUNT  LBA_48  LH LM LL DV DC  Powered_Up_Time  Command/Feature_Name
  -- == -- == -- == == == -- -- -- -- --  ---------------  --------------------
  c8 00 00 00 08 00 00 00 3c a4 e8 e0 00     00:51:05.745  READ DMA
  35 00 00 00 18 00 00 19 c6 9f a0 e0 00     00:51:05.745  WRITE DMA EXT
  35 00 00 06 e8 00 00 19 88 89 00 e0 00     00:51:05.741  WRITE DMA EXT
  ea 00 00 00 00 00 00 1c 8e 56 5f a0 00     00:51:05.729  FLUSH CACHE EXT
  35 00 00 00 08 00 00 1c 8e 56 58 e0 00     00:51:05.729  WRITE DMA EXT

Error 16768 [7] occurred at disk power-on lifetime: 8795 hours (366 days + 11 hours)
  When the command that caused the error occurred, the device was active or idle.

  After command completion occurred, registers were:
  ER -- ST COUNT  LBA_48  LH LM LL DV DC
  -- -- -- == -- == == == -- -- -- -- --
  40 -- 51 00 00 00 00 00 3c a4 e8 00 00  Error: UNC at LBA = 0x003ca4e8 = 3974376

  Commands leading to the command that caused the error were:
  CR FEATR COUNT  LBA_48  LH LM LL DV DC  Powered_Up_Time  Command/Feature_Name
  -- == -- == -- == == == -- -- -- -- --  ---------------  --------------------
  c8 00 00 00 08 00 00 00 3c a4 e8 e0 00     00:51:02.975  READ DMA
  35 00 00 08 20 00 00 1a 04 2d 00 e0 00     00:51:02.970  WRITE DMA EXT
  27 00 00 00 00 00 00 00 00 00 00 e0 00     00:51:02.970  READ NATIVE MAX ADDRESS EXT [OBS-ACS-3]
  ec 00 00 00 00 00 00 00 00 00 00 a0 00     00:51:02.967  IDENTIFY DEVICE
  ef 00 03 00 46 00 00 00 00 00 00 a0 00     00:51:02.967  SET FEATURES [Set transfer mode]

Error 16767 [6] occurred at disk power-on lifetime: 8795 hours (366 days + 11 hours)
  When the command that caused the error occurred, the device was active or idle.

  After command completion occurred, registers were:
  ER -- ST COUNT  LBA_48  LH LM LL DV DC
  -- -- -- == -- == == == -- -- -- -- --
  40 -- 51 00 00 00 00 00 3c a4 e8 00 00  Error: UNC at LBA = 0x003ca4e8 = 3974376

  Commands leading to the command that caused the error were:
  CR FEATR COUNT  LBA_48  LH LM LL DV DC  Powered_Up_Time  Command/Feature_Name
  -- == -- == -- == == == -- -- -- -- --  ---------------  --------------------
  c8 00 00 00 08 00 00 00 3c a4 e8 e0 00     00:51:00.106  READ DMA
  35 00 00 02 f8 00 00 18 4b 01 00 e0 00     00:51:00.104  WRITE DMA EXT
  35 00 00 01 00 00 00 1a 04 2c 00 e0 00     00:51:00.103  WRITE DMA EXT
  35 00 00 00 08 00 00 17 45 7f c0 e0 00     00:51:00.103  WRITE DMA EXT
  35 00 00 00 98 00 00 17 45 88 58 e0 00     00:51:00.102  WRITE DMA EXT

Error 16766 [5] occurred at disk power-on lifetime: 8795 hours (366 days + 11 hours)
  When the command that caused the error occurred, the device was active or idle.

  After command completion occurred, registers were:
  ER -- ST COUNT  LBA_48  LH LM LL DV DC
  -- -- -- == -- == == == -- -- -- -- --
  40 -- 51 00 00 00 00 00 3c a4 e8 00 00  Error: UNC at LBA = 0x003ca4e8 = 3974376

  Commands leading to the command that caused the error were:
  CR FEATR COUNT  LBA_48  LH LM LL DV DC  Powered_Up_Time  Command/Feature_Name
  -- == -- == -- == == == -- -- -- -- --  ---------------  --------------------
  c8 00 00 00 08 00 00 00 3c a4 e8 e0 00     00:50:57.339  READ DMA
  ea 00 00 00 00 00 00 1c 8e 54 97 a0 00     00:50:57.328  FLUSH CACHE EXT
  35 00 00 00 08 00 00 1c 8e 54 90 e0 00     00:50:57.328  WRITE DMA EXT
  ea 00 00 00 00 00 00 1c 8e 54 8f a0 00     00:50:57.280  FLUSH CACHE EXT
  35 00 00 00 e8 00 00 1c 8e 53 a8 e0 00     00:50:57.279  WRITE DMA EXT

Error 16765 [4] occurred at disk power-on lifetime: 8795 hours (366 days + 11 hours)
  When the command that caused the error occurred, the device was active or idle.

  After command completion occurred, registers were:
  ER -- ST COUNT  LBA_48  LH LM LL DV DC
  -- -- -- == -- == == == -- -- -- -- --
  40 -- 51 00 00 00 00 00 3c a4 e8 00 00  Error: UNC at LBA = 0x003ca4e8 = 3974376

  Commands leading to the command that caused the error were:
  CR FEATR COUNT  LBA_48  LH LM LL DV DC  Powered_Up_Time  Command/Feature_Name
  -- == -- == -- == == == -- -- -- -- --  ---------------  --------------------
  c8 00 00 00 08 00 00 00 3c a4 e8 e0 00     00:50:54.484  READ DMA
  35 00 00 04 50 00 00 15 85 c3 00 e0 00     00:50:54.481  WRITE DMA EXT
  c8 00 00 00 08 00 00 00 3c a4 e0 e0 00     00:50:54.481  READ DMA
  ca 00 00 00 10 00 00 00 ce 42 00 e0 00     00:50:54.480  WRITE DMA
  c8 00 00 00 08 00 00 00 3c a4 d8 e0 00     00:50:54.480  READ DMA

Error 16764 [3] occurred at disk power-on lifetime: 8795 hours (366 days + 11 hours)
  When the command that caused the error occurred, the device was active or idle.

  After command completion occurred, registers were:
  ER -- ST COUNT  LBA_48  LH LM LL DV DC
  -- -- -- == -- == == == -- -- -- -- --
  40 -- 51 00 00 00 00 00 3c a4 e8 00 00  Error: UNC at LBA = 0x003ca4e8 = 3974376

  Commands leading to the command that caused the error were:
  CR FEATR COUNT  LBA_48  LH LM LL DV DC  Powered_Up_Time  Command/Feature_Name
  -- == -- == -- == == == -- -- -- -- --  ---------------  --------------------
  c8 00 00 00 00 00 00 00 3c 9b e8 e0 00     00:50:51.451  READ DMA
  c8 00 00 00 00 00 00 00 3c 92 68 e0 00     00:50:51.362  READ DMA
  c8 00 00 00 40 00 00 00 3c 92 28 e0 00     00:50:51.351  READ DMA
  c8 00 00 00 08 00 00 00 3c 91 e8 e0 00     00:50:51.344  READ DMA
  c8 00 00 00 80 00 00 00 3c 48 a8 e0 00     00:50:51.331  READ DMA

Error 16763 [2] occurred at disk power-on lifetime: 8777 hours (365 days + 17 hours)
  When the command that caused the error occurred, the device was active or idle.

  After command completion occurred, registers were:
  ER -- ST COUNT  LBA_48  LH LM LL DV DC
  -- -- -- == -- == == == -- -- -- -- --
  40 -- 51 00 00 00 00 00 3c e8 70 00 00  Error: UNC at LBA = 0x003ce870 = 3991664

  Commands leading to the command that caused the error were:
  CR FEATR COUNT  LBA_48  LH LM LL DV DC  Powered_Up_Time  Command/Feature_Name
  -- == -- == -- == == == -- -- -- -- --  ---------------  --------------------
  c8 00 00 00 08 00 00 00 3c e8 70 e0 00     00:25:28.900  READ DMA
  c8 00 00 00 20 00 00 00 50 a4 a8 e0 00     00:25:28.879  READ DMA
  27 00 00 00 00 00 00 00 00 00 00 e0 00     00:25:28.878  READ NATIVE MAX ADDRESS EXT [OBS-ACS-3]
  ec 00 00 00 00 00 00 00 00 00 00 a0 00     00:25:28.875  IDENTIFY DEVICE
  ef 00 03 00 46 00 00 00 00 00 00 a0 00     00:25:28.873  SET FEATURES [Set transfer mode]

SMART Extended Self-test Log Version: 1 (1 sectors)
Num  Test_Description    Status                  Remaining  LifeTime(hours)  LBA_of_first_error
# 1  Short offline       Completed without error       00%      6408         -

SMART Selective self-test log data structure revision number 1
 SPAN  MIN_LBA  MAX_LBA  CURRENT_TEST_STATUS
    1        0        0  Not_testing
    2        0        0  Not_testing
    3        0        0  Not_testing
    4        0        0  Not_testing
    5        0        0  Not_testing
Selective self-test flags (0x0):
  After scanning selected spans, do NOT read-scan remainder of disk.
If Selective self-test is pending on power-up, resume after 0 minute delay.

SCT Status Version:                  3
SCT Version (vendor specific):       522 (0x020a)
Device State:                        Active (0)
Current Temperature:                    30 Celsius
Power Cycle Min/Max Temperature:     26/31 Celsius
Lifetime    Min/Max Temperature:      7/53 Celsius
Specified Max Operating Temperature:    31 Celsius
Under/Over Temperature Limit Count:   0/0

SCT Temperature History Version:     2
Temperature Sampling Period:         1 minute
Temperature Logging Interval:        30 minutes
Min/Max recommended Temperature:     14/55 Celsius
Min/Max Temperature Limit:           10/60 Celsius
Temperature History Size (Index):    128 (79)

SCT Error Recovery Control command not supported

Device Statistics (GP/SMART Log 0x04) not supported

Pending Defects log (GP Log 0x0c) not supported

SATA Phy Event Counters (GP Log 0x11)
ID      Size     Value  Description
0x000a  2            4  Device-to-host register FISes sent due to a COMRESET
0x0001  2            0  Command failed due to ICRC error
0x0003  2            0  R_ERR response for device-to-host data FIS
0x0004  2            0  R_ERR response for host-to-device data FIS
0x0006  2            0  R_ERR response for device-to-host non-data FIS
0x0007  2            0  R_ERR response for host-to-device non-data FIS

