=== START OF INFORMATION SECTION ===
Model Family:     Seagate Barracuda 7200.11
Device Model:     ST3500320AS
Serial Number:    --
LU WWN Device Id: 5 000c50 ...
Firmware Version: SD1A
User Capacity:    500,107,862,016 bytes [500 GB]
Sector Size:      512 bytes logical/physical
Rotation Rate:    7200 rpm
Device is:        In smartctl database [for details use: -P show]
ATA Version is:   ATA8-ACS T13/1699-D revision 4
SATA Version is:  SATA 2.6, 1.5 Gb/s
Local Time is:    Wed Jul 29 12:32:18 2015 CEST
SMART support is: Available - device has SMART capability.
SMART support is: Enabled
AAM feature is:   Unavailable
APM feature is:   Unavailable
Rd look-ahead is: Enabled
Write cache is:   Enabled
ATA Security is:  Disabled, frozen [SEC2]
Wt Cache Reorder: Unknown

=== START OF READ SMART DATA SECTION ===
SMART overall-health self-assessment test result: PASSED

General SMART Values:
Offline data collection status:  (0x82)	Offline data collection activity
					was completed without error.
					Auto Offline Data Collection: Enabled.
Self-test execution status:      (   0)	The previous self-test routine completed
					without error or no self-test has ever 
					been run.
Total time to complete Offline 
data collection: 		(  642) seconds.
Offline data collection
capabilities: 			 (0x7b) SMART execute Offline immediate.
					Auto Offline data collection on/off support.
					Suspend Offline collection upon new
					command.
					Offline surface scan supported.
					Self-test supported.
					Conveyance Self-test supported.
					Selective Self-test supported.
SMART capabilities:            (0x0003)	Saves SMART data before entering
					power-saving mode.
					Supports SMART auto save timer.
Error logging capability:        (0x01)	Error logging supported.
					General Purpose Logging supported.
Short self-test routine 
recommended polling time: 	 (   1) minutes.
Extended self-test routine
recommended polling time: 	 ( 119) minutes.
Conveyance self-test routine
recommended polling time: 	 (   2) minutes.
SCT capabilities: 	       (0x103b)	SCT Status supported.
					SCT Error Recovery Control supported.
					SCT Feature Control supported.
					SCT Data Table supported.

SMART Attributes Data Structure revision number: 10
Vendor Specific SMART Attributes with Thresholds:
ID# ATTRIBUTE_NAME          FLAGS    VALUE WORST THRESH FAIL RAW_VALUE
  1 Raw_Read_Error_Rate     POSR--   116   094   006    -    214904861
  3 Spin_Up_Time            PO----   095   095   000    -    0
  4 Start_Stop_Count        -O--CK   100   100   020    -    20
  5 Reallocated_Sector_Ct   PO--CK   100   100   036    -    0
  7 Seek_Error_Rate         POSR--   054   051   030    -    30067288095
  9 Power_On_Hours          -O--CK   079   079   000    -    19037
 10 Spin_Retry_Count        PO--C-   100   100   097    -    0
 12 Power_Cycle_Count       -O--CK   094   094   020    -    6817
184 End-to-End_Error        -O--CK   100   100   099    -    0
187 Reported_Uncorrect      -O--CK   001   001   000    -    137
188 Command_Timeout         -O--CK   100   100   000    -    1
189 High_Fly_Writes         -O-RCK   100   100   000    -    0
190 Airflow_Temperature_Cel -O---K   062   059   045    -    38 (Min/Max 27/38)
194 Temperature_Celsius     -O---K   038   041   000    -    38 (0 22 0 0 0)
195 Hardware_ECC_Recovered  -O-RC-   050   037   000    -    214904861
197 Current_Pending_Sector  -O--C-   100   100   000    -    15
198 Offline_Uncorrectable   ----C-   100   100   000    -    15
199 UDMA_CRC_Error_Count    -OSRCK   200   200   000    -    0
                            ||||||_ K auto-keep
                            |||||__ C event count
                            ||||___ R error rate
                            |||____ S speed/performance
                            ||_____ O updated online
                            |______ P prefailure warning

General Purpose Log Directory Version 1
SMART           Log Directory Version 1 [multi-sector log support]
Address    Access  R/W   Size  Description
0x00       GPL,SL  R/O      1  Log Directory
0x01       GPL,SL  R/O      1  Summary SMART error log
0x02       GPL,SL  R/O      5  Comprehensive SMART error log
0x03       GPL,SL  R/O      5  Ext. Comprehensive SMART error log
0x06       GPL,SL  R/O      1  SMART self-test log
0x07       GPL,SL  R/O      1  Extended self-test log
0x09       GPL,SL  R/W      1  Selective self-test log
0x10       GPL,SL  R/O      1  NCQ Command Error log
0x11       GPL,SL  R/O      1  SATA Phy Event Counters
0x21       GPL,SL  R/O      1  Write stream error log
0x22       GPL,SL  R/O      1  Read stream error log
0x80-0x9f  GPL,SL  R/W     16  Host vendor specific log
0xa1       GPL,SL  VS      20  Device vendor specific log
0xa2       GPL     VS    2248  Device vendor specific log
0xa8       GPL,SL  VS      20  Device vendor specific log
0xa9       GPL,SL  VS       1  Device vendor specific log
0xb0       GPL     VS    2819  Device vendor specific log
0xbe-0xbf  GPL     VS   65535  Device vendor specific log
0xe0       GPL,SL  R/W      1  SCT Command/Status
0xe1       GPL,SL  R/W      1  SCT Data Transfer

SMART Extended Comprehensive Error Log Version: 1 (5 sectors)
Device Error Count: 143 (device log contains only the most recent 20 errors)
	CR     = Command Register
	FEATR  = Features Register
	COUNT  = Count (was: Sector Count) Register
	LBA_48 = Upper bytes of LBA High/Mid/Low Registers ]  ATA-8
	LH     = LBA High (was: Cylinder High) Register    ]   LBA
	LM     = LBA Mid (was: Cylinder Low) Register      ] Register
	LL     = LBA Low (was: Sector Number) Register     ]
	DV     = Device (was: Device/Head) Register
	DC     = Device Control Register
	ER     = Error register
	ST     = Status register
Powered_Up_Time is measured from power on, and printed as
DDd+hh:mm:SS.sss where DD=days, hh=hours, mm=minutes,
SS=sec, and sss=millisec. It "wraps" after 49.710 days.

Error 143 [2] occurred at disk power-on lifetime: 19037 hours (793 days + 5 hours)
  When the command that caused the error occurred, the device was active or idle.

  After command completion occurred, registers were:
  ER -- ST COUNT  LBA_48  LH LM LL DV DC
  -- -- -- == -- == == == -- -- -- -- --
  40 -- 51 00 00 00 00 f4 00 11 f1 00 00  Error: UNC at LBA = 0xf40011f1 = 4093645297

  Commands leading to the command that caused the error were:
  CR FEATR COUNT  LBA_48  LH LM LL DV DC  Powered_Up_Time  Command/Feature_Name
  -- == -- == -- == == == -- -- -- -- --  ---------------  --------------------
  c8 00 00 00 08 00 00 f4 00 11 f0 e0 00     00:38:51.684  READ DMA
  c8 00 00 00 18 00 00 f5 00 11 00 e0 00     00:38:51.656  READ DMA
  35 00 00 00 18 00 10 09 00 01 48 e0 00     00:38:51.656  WRITE DMA EXT
  c8 00 00 00 00 00 00 64 00 23 a0 e0 00     00:38:51.654  READ DMA
  c8 00 00 00 30 00 01 4a 00 86 60 e1 00     00:38:51.638  READ DMA

Error 142 [1] occurred at disk power-on lifetime: 19037 hours (793 days + 5 hours)
  When the command that caused the error occurred, the device was active or idle.

  After command completion occurred, registers were:
  ER -- ST COUNT  LBA_48  LH LM LL DV DC
  -- -- -- == -- == == == -- -- -- -- --
  40 -- 51 00 00 00 00 f4 00 11 f0 00 00  Error: UNC at LBA = 0xf40011f0 = 4093645296

  Commands leading to the command that caused the error were:
  CR FEATR COUNT  LBA_48  LH LM LL DV DC  Powered_Up_Time  Command/Feature_Name
  -- == -- == -- == == == -- -- -- -- --  ---------------  --------------------
  c8 00 00 00 20 00 00 f4 00 11 e0 e0 00     00:38:45.813  READ DMA
  c8 00 00 00 20 00 00 f5 00 11 60 e0 00     00:38:45.796  READ DMA
  c8 00 00 00 20 00 00 f5 00 11 40 e0 00     00:38:45.779  READ DMA
  c8 00 00 00 10 00 00 f5 00 11 80 e0 00     00:38:45.756  READ DMA
  c8 00 00 00 08 00 00 3d 00 01 18 e0 00     00:38:45.755  READ DMA

Error 141 [0] occurred at disk power-on lifetime: 19035 hours (793 days + 3 hours)
  When the command that caused the error occurred, the device was active or idle.

  After command completion occurred, registers were:
  ER -- ST COUNT  LBA_48  LH LM LL DV DC
  -- -- -- == -- == == == -- -- -- -- --
  40 -- 51 00 00 00 00 fc 00 5f b2 00 00  Error: UNC at LBA = 0xfc005fb2 = 4227882930

  Commands leading to the command that caused the error were:
  CR FEATR COUNT  LBA_48  LH LM LL DV DC  Powered_Up_Time  Command/Feature_Name
  -- == -- == -- == == == -- -- -- -- --  ---------------  --------------------
  25 d8 00 01 00 00 00 fc 00 5f 6f 40 00     00:00:42.376  READ DMA EXT
  25 d8 00 00 a8 00 00 fb 00 5f bf 40 00     00:00:42.375  READ DMA EXT
  25 d8 00 01 00 00 00 fa 00 5f bf 40 00     00:00:42.373  READ DMA EXT
  25 d8 00 01 00 00 00 f3 00 5f bf 40 00     00:00:42.276  READ DMA EXT
  25 d8 00 01 00 00 00 f2 00 5f bf 40 00     00:00:42.267  READ DMA EXT

Error 140 [19] occurred at disk power-on lifetime: 19035 hours (793 days + 3 hours)
  When the command that caused the error occurred, the device was active or idle.

  After command completion occurred, registers were:
  ER -- ST COUNT  LBA_48  LH LM LL DV DC
  -- -- -- == -- == == == -- -- -- -- --
  40 -- 51 00 00 00 00 3b 00 f8 99 00 00  Error: UNC at LBA = 0x3b00f899 = 989919385

  Commands leading to the command that caused the error were:
  CR FEATR COUNT  LBA_48  LH LM LL DV DC  Powered_Up_Time  Command/Feature_Name
  -- == -- == -- == == == -- -- -- -- --  ---------------  --------------------
  25 00 00 00 40 00 00 3b 00 f8 77 40 00     00:05:31.391  READ DMA EXT
  35 00 00 00 08 00 00 f2 00 5b cf 40 00     00:05:31.371  WRITE DMA EXT
  35 00 00 00 08 00 00 f2 00 5b d7 40 00     00:05:31.369  WRITE DMA EXT
  35 00 00 00 40 00 01 35 00 aa ef 40 00     00:05:31.368  WRITE DMA EXT
  35 00 00 00 40 00 01 35 00 aa af 40 00     00:05:31.367  WRITE DMA EXT

Error 139 [18] occurred at disk power-on lifetime: 19035 hours (793 days + 3 hours)
  When the command that caused the error occurred, the device was active or idle.

  After command completion occurred, registers were:
  ER -- ST COUNT  LBA_48  LH LM LL DV DC
  -- -- -- == -- == == == -- -- -- -- --
  40 -- 51 00 00 00 00 3b 00 f8 99 00 00  Error: UNC at LBA = 0x3b00f899 = 989919385

  Commands leading to the command that caused the error were:
  CR FEATR COUNT  LBA_48  LH LM LL DV DC  Powered_Up_Time  Command/Feature_Name
  -- == -- == -- == == == -- -- -- -- --  ---------------  --------------------
  25 00 00 00 40 00 00 3b 00 f8 77 40 00     00:04:52.440  READ DMA EXT
  35 00 00 00 08 00 00 f2 00 5b cf 40 00     00:04:52.420  WRITE DMA EXT
  35 00 00 00 08 00 00 f2 00 5b d7 40 00     00:04:52.419  WRITE DMA EXT
  35 00 00 00 40 00 01 35 00 aa ef 40 00     00:04:52.419  WRITE DMA EXT
  35 00 00 00 40 00 01 35 00 aa af 40 00     00:04:52.418  WRITE DMA EXT

Error 138 [17] occurred at disk power-on lifetime: 19035 hours (793 days + 3 hours)
  When the command that caused the error occurred, the device was active or idle.

  After command completion occurred, registers were:
  ER -- ST COUNT  LBA_48  LH LM LL DV DC
  -- -- -- == -- == == == -- -- -- -- --
  40 -- 51 00 00 00 00 3b 00 f8 99 00 00  Error: UNC at LBA = 0x3b00f899 = 989919385

  Commands leading to the command that caused the error were:
  CR FEATR COUNT  LBA_48  LH LM LL DV DC  Powered_Up_Time  Command/Feature_Name
  -- == -- == -- == == == -- -- -- -- --  ---------------  --------------------
  25 00 00 00 40 00 00 3b 00 f8 77 40 00     00:04:12.510  READ DMA EXT
  25 00 00 00 08 00 00 0e 00 60 5f 40 00     00:04:12.501  READ DMA EXT
  25 00 00 00 08 00 00 e4 00 62 df 40 00     00:04:12.486  READ DMA EXT
  25 00 00 00 40 00 03 cc 00 18 a7 40 00     00:04:12.445  READ DMA EXT
  25 00 00 00 40 00 03 cc 00 18 27 40 00     00:04:12.430  READ DMA EXT

Error 137 [16] occurred at disk power-on lifetime: 19035 hours (793 days + 3 hours)
  When the command that caused the error occurred, the device was active or idle.

  After command completion occurred, registers were:
  ER -- ST COUNT  LBA_48  LH LM LL DV DC
  -- -- -- == -- == == == -- -- -- -- --
  40 -- 51 00 00 00 00 3b 00 f8 99 00 00  Error: UNC at LBA = 0x3b00f899 = 989919385

  Commands leading to the command that caused the error were:
  CR FEATR COUNT  LBA_48  LH LM LL DV DC  Powered_Up_Time  Command/Feature_Name
  -- == -- == -- == == == -- -- -- -- --  ---------------  --------------------
  25 00 00 00 40 00 00 3b 00 f8 77 40 00     00:15:41.430  READ DMA EXT
  35 00 00 00 08 00 04 b5 00 44 17 40 00     00:15:41.424  WRITE DMA EXT
  35 00 00 00 08 00 04 b2 00 44 cf 40 00     00:15:41.414  WRITE DMA EXT
  35 00 00 00 08 00 04 cf 00 cb e7 40 00     00:15:41.410  WRITE DMA EXT
  35 00 00 00 08 00 00 f2 00 5b cf 40 00     00:15:41.409  WRITE DMA EXT

Error 136 [15] occurred at disk power-on lifetime: 19035 hours (793 days + 3 hours)
  When the command that caused the error occurred, the device was active or idle.

  After command completion occurred, registers were:
  ER -- ST COUNT  LBA_48  LH LM LL DV DC
  -- -- -- == -- == == == -- -- -- -- --
  40 -- 51 00 00 00 00 3b 00 f8 99 00 00  Error: UNC at LBA = 0x3b00f899 = 989919385

  Commands leading to the command that caused the error were:
  CR FEATR COUNT  LBA_48  LH LM LL DV DC  Powered_Up_Time  Command/Feature_Name
  -- == -- == -- == == == -- -- -- -- --  ---------------  --------------------
  25 00 00 00 40 00 00 3b 00 f8 77 40 00     00:14:59.817  READ DMA EXT
  25 00 00 00 08 00 00 2e 00 63 a7 40 00     00:14:59.808  READ DMA EXT
  35 00 00 00 08 00 00 d0 00 60 67 40 00     00:14:59.806  WRITE DMA EXT
  ea 00 00 00 00 00 00 00 00 00 00 00 00     00:14:59.767  FLUSH CACHE EXT
  25 00 00 00 04 00 05 0e 00 46 78 40 00     00:14:59.767  READ DMA EXT

SMART Extended Self-test Log Version: 1 (1 sectors)
No self-tests have been logged.  [To run self-tests, use: smartctl -t]

SMART Selective self-test log data structure revision number 1
 SPAN  MIN_LBA  MAX_LBA  CURRENT_TEST_STATUS
    1        0        0  Not_testing
    2        0        0  Not_testing
    3        0        0  Not_testing
    4        0        0  Not_testing
    5        0        0  Not_testing
Selective self-test flags (0x0):
  After scanning selected spans, do NOT read-scan remainder of disk.
If Selective self-test is pending on power-up, resume after 0 minute delay.

SCT Status Version:                  3
SCT Version (vendor specific):       522 (0x020a)
SCT Support Level:                   1
Device State:                        Active (0)
Current Temperature:                    38 Celsius
Power Cycle Min/Max Temperature:     27/38 Celsius
Lifetime    Min/Max Temperature:     22/41 Celsius
Under/Over Temperature Limit Count:   0/49

SCT Temperature History Version:     2
Temperature Sampling Period:         1 minute
Temperature Logging Interval:        1 minute
Min/Max recommended Temperature:      0/ 0 Celsius
Min/Max Temperature Limit:            0/ 0 Celsius
Temperature History Size (Index):    128 (115)

SCT Error Recovery Control:
           Read: Disabled
          Write: Disabled

Device Statistics (GP Log 0x04) not supported

SATA Phy Event Counters (GP Log 0x11)
ID      Size     Value  Description
0x000a  2            8  Device-to-host register FISes sent due to a COMRESET
0x0001  2            0  Command failed due to ICRC error
0x0003  2            0  R_ERR response for device-to-host data FIS
0x0004  2            0  R_ERR response for host-to-device data FIS
0x0006  2            0  R_ERR response for device-to-host non-data FIS
0x0007  2            0  R_ERR response for host-to-device non-data FIS

