smartctl 7.0 2018-12-30 r4883 [x86_64-linux-5.4.0-51-generic] (local build)
Copyright (C) 2002-18, Bruce Allen, Christian Franke, www.smartmontools.org

=== START OF INFORMATION SECTION ===
Model Family:     Seagate Barracuda 7200.11
Device Model:     ST3500320AS
Serial Number:    --
LU WWN Device Id: 5 000c50 ...
Firmware Version: SD1A
User Capacity:    500,107,862,016 bytes [500 GB]
Sector Size:      512 bytes logical/physical
Rotation Rate:    7200 rpm
Device is:        In smartctl database [for details use: -P show]
ATA Version is:   ATA8-ACS T13/1699-D revision 4
SATA Version is:  SATA 2.6, 3.0 Gb/s
Local Time is:    Fri Oct 16 02:24:02 2020 CEST
SMART support is: Available - device has SMART capability.
SMART support is: Enabled
AAM feature is:   Unavailable
APM feature is:   Unavailable
Rd look-ahead is: Enabled
Write cache is:   Enabled
DSN feature is:   Unavailable
ATA Security is:  Disabled, NOT FROZEN [SEC1]
Wt Cache Reorder: Unknown

=== START OF READ SMART DATA SECTION ===
SMART overall-health self-assessment test result: PASSED

General SMART Values:
Offline data collection status:  (0x82)	Offline data collection activity
					was completed without error.
					Auto Offline Data Collection: Enabled.
Self-test execution status:      (   0)	The previous self-test routine completed
					without error or no self-test has ever 
					been run.
Total time to complete Offline 
data collection: 		(  634) seconds.
Offline data collection
capabilities: 			 (0x7b) SMART execute Offline immediate.
					Auto Offline data collection on/off support.
					Suspend Offline collection upon new
					command.
					Offline surface scan supported.
					Self-test supported.
					Conveyance Self-test supported.
					Selective Self-test supported.
SMART capabilities:            (0x0003)	Saves SMART data before entering
					power-saving mode.
					Supports SMART auto save timer.
Error logging capability:        (0x01)	Error logging supported.
					General Purpose Logging supported.
Short self-test routine 
recommended polling time: 	 (   1) minutes.
Extended self-test routine
recommended polling time: 	 ( 116) minutes.
Conveyance self-test routine
recommended polling time: 	 (   2) minutes.
SCT capabilities: 	       (0x103b)	SCT Status supported.
					SCT Error Recovery Control supported.
					SCT Feature Control supported.
					SCT Data Table supported.

SMART Attributes Data Structure revision number: 10
Vendor Specific SMART Attributes with Thresholds:
ID# ATTRIBUTE_NAME          FLAGS    VALUE WORST THRESH FAIL RAW_VALUE
  1 Raw_Read_Error_Rate     POSR--   111   099   006    -    163226302
  3 Spin_Up_Time            PO----   094   091   000    -    0
  4 Start_Stop_Count        -O--CK   094   094   020    -    6353
  5 Reallocated_Sector_Ct   PO--CK   095   095   036    -    104
  7 Seek_Error_Rate         POSR--   077   060   030    -    39076031687
  9 Power_On_Hours          -O--CK   056   056   000    -    38937
 10 Spin_Retry_Count        PO--C-   100   100   097    -    12
 12 Power_Cycle_Count       -O--CK   095   037   020    -    6016
184 End-to-End_Error        -O--CK   100   100   099    -    0
187 Reported_Uncorrect      -O--CK   062   062   000    -    38
188 Command_Timeout         -O--CK   100   001   000    -    704388275191
189 High_Fly_Writes         -O-RCK   091   091   000    -    9
190 Airflow_Temperature_Cel -O---K   069   058   045    -    31 (Min/Max 21/32)
194 Temperature_Celsius     -O---K   031   042   000    -    31 (0 13 0 0 0)
195 Hardware_ECC_Recovered  -O-RC-   024   014   000    -    163226302
197 Current_Pending_Sector  -O--C-   100   100   000    -    1
198 Offline_Uncorrectable   ----C-   100   100   000    -    1
199 UDMA_CRC_Error_Count    -OSRCK   200   177   000    -    2373
                            ||||||_ K auto-keep
                            |||||__ C event count
                            ||||___ R error rate
                            |||____ S speed/performance
                            ||_____ O updated online
                            |______ P prefailure warning

General Purpose Log Directory Version 1
SMART           Log Directory Version 1 [multi-sector log support]
Address    Access  R/W   Size  Description
0x00       GPL,SL  R/O      1  Log Directory
0x01       GPL,SL  R/O      1  Summary SMART error log
0x02       GPL,SL  R/O      5  Comprehensive SMART error log
0x03       GPL,SL  R/O      5  Ext. Comprehensive SMART error log
0x06       GPL,SL  R/O      1  SMART self-test log
0x07       GPL,SL  R/O      1  Extended self-test log
0x09       GPL,SL  R/W      1  Selective self-test log
0x10       GPL,SL  R/O      1  NCQ Command Error log
0x11       GPL,SL  R/O      1  SATA Phy Event Counters log
0x21       GPL,SL  R/O      1  Write stream error log
0x22       GPL,SL  R/O      1  Read stream error log
0x80-0x9f  GPL,SL  R/W     16  Host vendor specific log
0xa1       GPL,SL  VS      20  Device vendor specific log
0xa2       GPL     VS    2248  Device vendor specific log
0xa8       GPL,SL  VS      20  Device vendor specific log
0xa9       GPL,SL  VS       1  Device vendor specific log
0xb0       GPL     VS    2819  Device vendor specific log
0xbe-0xbf  GPL     VS   65535  Device vendor specific log
0xe0       GPL,SL  R/W      1  SCT Command/Status
0xe1       GPL,SL  R/W      1  SCT Data Transfer

SMART Extended Comprehensive Error Log Version: 1 (5 sectors)
Device Error Count: 38 (device log contains only the most recent 20 errors)
	CR     = Command Register
	FEATR  = Features Register
	COUNT  = Count (was: Sector Count) Register
	LBA_48 = Upper bytes of LBA High/Mid/Low Registers ]  ATA-8
	LH     = LBA High (was: Cylinder High) Register    ]   LBA
	LM     = LBA Mid (was: Cylinder Low) Register      ] Register
	LL     = LBA Low (was: Sector Number) Register     ]
	DV     = Device (was: Device/Head) Register
	DC     = Device Control Register
	ER     = Error register
	ST     = Status register
Powered_Up_Time is measured from power on, and printed as
DDd+hh:mm:SS.sss where DD=days, hh=hours, mm=minutes,
SS=sec, and sss=millisec. It "wraps" after 49.710 days.

Error 38 [17] occurred at disk power-on lifetime: 38830 hours (1617 days + 22 hours)
  When the command that caused the error occurred, the device was active or idle.

  After command completion occurred, registers were:
  ER -- ST COUNT  LBA_48  LH LM LL DV DC
  -- -- -- == -- == == == -- -- -- -- --
  40 -- 51 00 00 00 08 55 00 43 fe 00 00  Error: UNC at LBA = 0x8550043fe = 35785819134

  Commands leading to the command that caused the error were:
  CR FEATR COUNT  LBA_48  LH LM LL DV DC  Powered_Up_Time  Command/Feature_Name
  -- == -- == -- == == == -- -- -- -- --  ---------------  --------------------
  60 00 00 01 00 00 08 56 00 43 90 40 00     02:00:47.853  READ FPDMA QUEUED
  60 00 00 01 00 00 08 55 00 43 90 40 00     02:00:47.853  READ FPDMA QUEUED
  60 00 00 01 00 00 08 54 00 43 90 40 00     02:00:47.853  READ FPDMA QUEUED
  60 00 00 01 00 00 08 53 00 43 90 40 00     02:00:47.852  READ FPDMA QUEUED
  60 00 00 01 00 00 08 52 00 43 90 40 00     02:00:47.852  READ FPDMA QUEUED

Error 37 [16] occurred at disk power-on lifetime: 38830 hours (1617 days + 22 hours)
  When the command that caused the error occurred, the device was active or idle.

  After command completion occurred, registers were:
  ER -- ST COUNT  LBA_48  LH LM LL DV DC
  -- -- -- == -- == == == -- -- -- -- --
  40 -- 51 00 00 00 08 55 00 43 fe 00 00  Error: UNC at LBA = 0x8550043fe = 35785819134

  Commands leading to the command that caused the error were:
  CR FEATR COUNT  LBA_48  LH LM LL DV DC  Powered_Up_Time  Command/Feature_Name
  -- == -- == -- == == == -- -- -- -- --  ---------------  --------------------
  60 00 00 01 00 00 08 56 00 43 90 40 00     02:00:42.332  READ FPDMA QUEUED
  60 00 00 01 00 00 08 55 00 43 90 40 00     02:00:42.332  READ FPDMA QUEUED
  60 00 00 01 00 00 08 54 00 43 90 40 00     02:00:42.332  READ FPDMA QUEUED
  60 00 00 01 00 00 08 53 00 43 90 40 00     02:00:42.331  READ FPDMA QUEUED
  60 00 00 01 00 00 08 52 00 43 90 40 00     02:00:42.331  READ FPDMA QUEUED

Error 36 [15] occurred at disk power-on lifetime: 38830 hours (1617 days + 22 hours)
  When the command that caused the error occurred, the device was active or idle.

  After command completion occurred, registers were:
  ER -- ST COUNT  LBA_48  LH LM LL DV DC
  -- -- -- == -- == == == -- -- -- -- --
  40 -- 51 00 00 00 08 55 00 43 fe 00 00  Error: WP at LBA = 0x8550043fe = 35785819134

  Commands leading to the command that caused the error were:
  CR FEATR COUNT  LBA_48  LH LM LL DV DC  Powered_Up_Time  Command/Feature_Name
  -- == -- == -- == == == -- -- -- -- --  ---------------  --------------------
  61 00 00 00 10 00 07 ad 00 13 58 40 00     02:00:28.433  WRITE FPDMA QUEUED
  60 00 00 01 00 00 08 56 00 43 90 40 00     02:00:28.422  READ FPDMA QUEUED
  60 00 00 01 00 00 08 55 00 43 90 40 00     02:00:28.422  READ FPDMA QUEUED
  60 00 00 01 00 00 08 54 00 43 90 40 00     02:00:28.422  READ FPDMA QUEUED
  60 00 00 01 00 00 08 53 00 43 90 40 00     02:00:28.422  READ FPDMA QUEUED

Error 35 [14] occurred at disk power-on lifetime: 38830 hours (1617 days + 22 hours)
  When the command that caused the error occurred, the device was active or idle.

  After command completion occurred, registers were:
  ER -- ST COUNT  LBA_48  LH LM LL DV DC
  -- -- -- == -- == == == -- -- -- -- --
  40 -- 51 00 00 00 08 55 00 43 fe 00 00  Error: UNC at LBA = 0x8550043fe = 35785819134

  Commands leading to the command that caused the error were:
  CR FEATR COUNT  LBA_48  LH LM LL DV DC  Powered_Up_Time  Command/Feature_Name
  -- == -- == -- == == == -- -- -- -- --  ---------------  --------------------
  60 00 00 01 00 00 08 56 00 43 90 40 00     02:00:12.884  READ FPDMA QUEUED
  60 00 00 01 00 00 08 55 00 43 90 40 00     02:00:12.882  READ FPDMA QUEUED
  60 00 00 01 00 00 08 54 00 43 90 40 00     02:00:12.882  READ FPDMA QUEUED
  60 00 00 01 00 00 08 53 00 43 90 40 00     02:00:12.882  READ FPDMA QUEUED
  60 00 00 01 00 00 08 52 00 43 90 40 00     02:00:12.882  READ FPDMA QUEUED

Error 34 [13] occurred at disk power-on lifetime: 38645 hours (1610 days + 5 hours)
  When the command that caused the error occurred, the device was active or idle.

  After command completion occurred, registers were:
  ER -- ST COUNT  LBA_48  LH LM LL DV DC
  -- -- -- == -- == == == -- -- -- -- --
  40 -- 51 00 00 00 08 55 00 43 fe 00 00  Error: UNC at LBA = 0x8550043fe = 35785819134

  Commands leading to the command that caused the error were:
  CR FEATR COUNT  LBA_48  LH LM LL DV DC  Powered_Up_Time  Command/Feature_Name
  -- == -- == -- == == == -- -- -- -- --  ---------------  --------------------
  60 00 00 00 01 00 08 55 00 43 fe 40 00     07:22:40.105  READ FPDMA QUEUED
  ec 00 00 00 00 00 00 00 00 00 00 a0 00     07:22:40.103  IDENTIFY DEVICE
  ec 00 00 00 00 00 00 00 00 00 00 a0 00     07:22:37.793  IDENTIFY DEVICE
  60 00 00 00 08 00 01 18 00 40 00 40 00     07:22:37.555  READ FPDMA QUEUED
  ec 00 00 00 00 00 00 00 00 00 00 a0 00     07:22:37.553  IDENTIFY DEVICE

Error 33 [12] occurred at disk power-on lifetime: 38645 hours (1610 days + 5 hours)
  When the command that caused the error occurred, the device was active or idle.

  After command completion occurred, registers were:
  ER -- ST COUNT  LBA_48  LH LM LL DV DC
  -- -- -- == -- == == == -- -- -- -- --
  40 -- 51 00 00 00 08 55 00 43 fe 00 00  Error: UNC at LBA = 0x8550043fe = 35785819134

  Commands leading to the command that caused the error were:
  CR FEATR COUNT  LBA_48  LH LM LL DV DC  Powered_Up_Time  Command/Feature_Name
  -- == -- == -- == == == -- -- -- -- --  ---------------  --------------------
  60 00 00 00 01 00 08 55 00 43 fe 40 00     07:21:00.372  READ FPDMA QUEUED
  ec 00 00 00 00 00 00 00 00 00 00 a0 00     07:21:00.370  IDENTIFY DEVICE
  60 00 00 00 08 00 01 18 00 40 00 40 00     07:20:58.290  READ FPDMA QUEUED
  ec 00 00 00 00 00 00 00 00 00 00 a0 00     07:20:58.288  IDENTIFY DEVICE
  ec 00 00 00 00 00 00 00 00 00 00 a0 00     07:20:58.276  IDENTIFY DEVICE

Error 32 [11] occurred at disk power-on lifetime: 38645 hours (1610 days + 5 hours)
  When the command that caused the error occurred, the device was active or idle.

  After command completion occurred, registers were:
  ER -- ST COUNT  LBA_48  LH LM LL DV DC
  -- -- -- == -- == == == -- -- -- -- --
  40 -- 51 00 00 00 08 55 00 43 fe 00 00  Error: UNC at LBA = 0x8550043fe = 35785819134

  Commands leading to the command that caused the error were:
  CR FEATR COUNT  LBA_48  LH LM LL DV DC  Powered_Up_Time  Command/Feature_Name
  -- == -- == -- == == == -- -- -- -- --  ---------------  --------------------
  60 00 00 00 01 00 08 55 00 43 fe 40 00     07:20:51.852  READ FPDMA QUEUED
  ec 00 00 00 00 00 00 00 00 00 00 a0 00     07:20:51.850  IDENTIFY DEVICE
  ec 00 00 00 00 00 00 00 00 00 00 a0 00     07:20:47.363  IDENTIFY DEVICE
  60 00 00 00 08 00 01 18 00 40 00 40 00     07:20:45.512  READ FPDMA QUEUED
  ec 00 00 00 00 00 00 00 00 00 00 a0 00     07:20:45.510  IDENTIFY DEVICE

Error 31 [10] occurred at disk power-on lifetime: 38644 hours (1610 days + 4 hours)
  When the command that caused the error occurred, the device was active or idle.

  After command completion occurred, registers were:
  ER -- ST COUNT  LBA_48  LH LM LL DV DC
  -- -- -- == -- == == == -- -- -- -- --
  40 -- 51 00 00 00 08 55 00 43 fe 00 00  Error: UNC at LBA = 0x8550043fe = 35785819134

  Commands leading to the command that caused the error were:
  CR FEATR COUNT  LBA_48  LH LM LL DV DC  Powered_Up_Time  Command/Feature_Name
  -- == -- == -- == == == -- -- -- -- --  ---------------  --------------------
  60 00 00 00 01 00 08 55 00 43 fe 40 00     07:15:37.515  READ FPDMA QUEUED
  ec 00 00 00 00 00 00 00 00 00 00 a0 00     07:15:37.513  IDENTIFY DEVICE
  ec 00 00 00 00 00 00 00 00 00 00 a0 00     07:15:36.090  IDENTIFY DEVICE
  ec 00 00 00 00 00 00 00 00 00 00 a0 00     07:15:26.055  IDENTIFY DEVICE
  ec 00 00 00 00 00 00 00 00 00 00 a0 00     07:15:16.015  IDENTIFY DEVICE

SMART Extended Self-test Log Version: 1 (1 sectors)
Num  Test_Description    Status                  Remaining  LifeTime(hours)  LBA_of_first_error
# 1  Short offline       Completed: read failure       90%     38755         138630654
# 2  Short offline       Completed: read failure       90%     38645         138630654
# 3  Short offline       Completed without error       00%     33569         -
# 4  Conveyance offline  Completed without error       00%     30644         -
# 5  Extended offline    Aborted by host               90%     30644         -
# 6  Short offline       Completed without error       00%     30644         -
# 7  Short offline       Completed without error       00%     13379         -
# 8  Short offline       Completed without error       00%      5385         -
# 9  Short offline       Completed without error       00%      5254         -
#10  Short offline       Completed: read failure       90%      5253         758278290
#11  Short offline       Completed: read failure       90%      5253         758278290
#12  Short offline       Completed: read failure       90%      5253         758278290
#13  Extended offline    Completed: read failure       90%      5245         758278290
#14  Conveyance offline  Completed: read failure       90%      5245         758278290
#15  Short offline       Completed: read failure       90%      5245         758278290
#16  Short offline       Completed: read failure       90%      5244         758278290
#17  Short offline       Completed: read failure       90%      5244         758278290
#18  Short offline       Completed: read failure       90%      5138         758278290
#19  Short offline       Completed: read failure       90%      5137         758278290

SMART Selective self-test log data structure revision number 1
 SPAN  MIN_LBA  MAX_LBA  CURRENT_TEST_STATUS
    1        0        0  Not_testing
    2        0        0  Not_testing
    3        0        0  Not_testing
    4        0        0  Not_testing
    5        0        0  Not_testing
Selective self-test flags (0x0):
  After scanning selected spans, do NOT read-scan remainder of disk.
If Selective self-test is pending on power-up, resume after 0 minute delay.

SCT Status Version:                  3
SCT Version (vendor specific):       522 (0x020a)
Device State:                        Active (0)
Current Temperature:                    31 Celsius
Power Cycle Min/Max Temperature:     21/32 Celsius
Lifetime    Min/Max Temperature:     13/42 Celsius
Under/Over Temperature Limit Count:   0/930

SCT Temperature History Version:     2
Temperature Sampling Period:         1 minute
Temperature Logging Interval:        1 minute
Min/Max recommended Temperature:      0/ 0 Celsius
Min/Max Temperature Limit:            0/ 0 Celsius
Temperature History Size (Index):    128 (48)

SCT Error Recovery Control:
           Read: Disabled
          Write: Disabled

Device Statistics (GP/SMART Log 0x04) not supported

Pending Defects log (GP Log 0x0c) not supported

SATA Phy Event Counters (GP Log 0x11)
ID      Size     Value  Description
0x000a  2            2  Device-to-host register FISes sent due to a COMRESET
0x0001  2            0  Command failed due to ICRC error
0x0003  2            0  R_ERR response for device-to-host data FIS
0x0004  2            0  R_ERR response for host-to-device data FIS
0x0006  2            0  R_ERR response for device-to-host non-data FIS
0x0007  2            0  R_ERR response for host-to-device non-data FIS



