smartctl 7.3 2022-02-28 r5338 [x86_64-linux-6.1.0-kali7-amd64] (local build)
Copyright (C) 2002-22, Bruce Allen, Christian Franke, www.smartmontools.org

=== START OF INFORMATION SECTION ===
Model Number:                       SK hynix BC501 HFM256GDJTNG-8310A
Serial Number:                      --
Firmware Version:                   80002C00
PCI Vendor/Subsystem ID:            0x1c5c
IEEE OUI Identifier:                0xace42e
Controller ID:                      1
NVMe Version:                       1.2.1
Number of Namespaces:               1
Namespace 1 Size/Capacity:          256,060,514,304 [256 GB]
Namespace 1 Formatted LBA Size:     512
Namespace 1 IEEE EUI-64:            ace42e ...
Local Time is:                      Thu May  4 14:56:19 2023 CDT
Firmware Updates (0x16):            3 Slots, no Reset required
Optional Admin Commands (0x0017):   Security Format Frmw_DL Self_Test
Optional NVM Commands (0x0016):     Wr_Unc DS_Mngmt Sav/Sel_Feat
Log Page Attributes (0x02):         Cmd_Eff_Lg
Maximum Data Transfer Size:         64 Pages
Warning  Comp. Temp. Threshold:     81 Celsius
Critical Comp. Temp. Threshold:     82 Celsius
Namespace 1 Features (0x02):        NA_Fields

Supported Power States
St Op     Max   Active     Idle   RL RT WL WT  Ent_Lat  Ex_Lat
 0 +   3.5000W       -        -    0  0  0  0        5       5
 1 +   2.4000W       -        -    1  1  1  1       30      30
 2 +   1.9000W       -        -    2  2  2  2      100     100
 3 -   0.0350W       -        -    3  3  3  3     1000    1000
 4 -   0.0050W       -        -    3  3  3  3     1000    5000

Supported LBA Sizes (NSID 0x1)
Id Fmt  Data  Metadt  Rel_Perf
 0 +     512       0         0
 1 -    4096       0         0

=== START OF SMART DATA SECTION ===
SMART overall-health self-assessment test result: FAILED!
- NVM subsystem reliability has been degraded

SMART/Health Information (NVMe Log 0x02)
Critical Warning:                   0x04
Temperature:                        36 Celsius
Available Spare:                    100%
Available Spare Threshold:          5%
Percentage Used:                    96%
Data Units Read:                    32,139,360 [16.4 TB]
Data Units Written:                 50,109,543 [25.6 TB]
Host Read Commands:                 438,224,704
Host Write Commands:                1,219,875,152
Controller Busy Time:               10,088
Power Cycles:                       755
Power On Hours:                     5,481
Unsafe Shutdowns:                   331
Media and Data Integrity Errors:    0
Error Information Log Entries:      6
Warning  Comp. Temperature Time:    0
Critical Comp. Temperature Time:    0
Temperature Sensor 1:               36 Celsius
Temperature Sensor 2:               38 Celsius

Error Information (NVMe Log 0x01, 16 of 256 entries)
No Errors Logged



