=== START OF INFORMATION SECTION ===
Model Family:     SAMSUNG SpinPoint F1 RE
Device Model:     SAMSUNG HE753LJ
Serial Number:    --
LU WWN Device Id: 5 0000f0 ...
Firmware Version: 1AA01112
User Capacity:    750 156 374 016 bytes [750 GB]
Sector Size:      512 bytes logical/physical
Device is:        In smartctl database [for details use: -P show]
ATA Version is:   ATA/ATAPI-7, ATA8-ACS T13/1699-D revision 3b
Local Time is:    Thu Jan 28 16:10:17 2016 MSK
SMART support is: Available - device has SMART capability.
SMART support is: Enabled
AAM feature is:   Disabled
APM feature is:   Disabled
Rd look-ahead is: Enabled
Write cache is:   Enabled
ATA Security is:  Disabled, frozen [SEC2]
Wt Cache Reorder: Enabled

=== START OF READ SMART DATA SECTION ===
SMART overall-health self-assessment test result: PASSED

General SMART Values:
Offline data collection status:  (0x00)	Offline data collection activity
					was never started.
					Auto Offline Data Collection: Disabled.
Self-test execution status:      (   0)	The previous self-test routine completed
					without error or no self-test has ever 
					been run.
Total time to complete Offline 
data collection: 		(11154) seconds.
Offline data collection
capabilities: 			 (0x7b) SMART execute Offline immediate.
					Auto Offline data collection on/off support.
					Suspend Offline collection upon new
					command.
					Offline surface scan supported.
					Self-test supported.
					Conveyance Self-test supported.
					Selective Self-test supported.
SMART capabilities:            (0x0003)	Saves SMART data before entering
					power-saving mode.
					Supports SMART auto save timer.
Error logging capability:        (0x01)	Error logging supported.
					General Purpose Logging supported.
Short self-test routine 
recommended polling time: 	 (   2) minutes.
Extended self-test routine
recommended polling time: 	 ( 187) minutes.
Conveyance self-test routine
recommended polling time: 	 (  20) minutes.
SCT capabilities: 	       (0x003f)	SCT Status supported.
					SCT Error Recovery Control supported.
					SCT Feature Control supported.
					SCT Data Table supported.

SMART Attributes Data Structure revision number: 16
Vendor Specific SMART Attributes with Thresholds:
ID# ATTRIBUTE_NAME          FLAGS    VALUE WORST THRESH FAIL RAW_VALUE
  1 Raw_Read_Error_Rate     POSR--   100   100   051    -    0
  3 Spin_Up_Time            POS---   085   085   011    -    5500
  4 Start_Stop_Count        -O--CK   096   096   000    -    3759
  5 Reallocated_Sector_Ct   PO--CK   098   098   010    -    101
  7 Seek_Error_Rate         POSR--   100   100   051    -    0
  8 Seek_Time_Performance   P-S--K   100   100   015    -    0
  9 Power_On_Hours          -O--CK   098   098   000    -    9483
 10 Spin_Retry_Count        PO--CK   100   100   051    -    0
 11 Calibration_Retry_Count -O--C-   100   100   000    -    0
 12 Power_Cycle_Count       -O--CK   096   096   000    -    3633
 13 Read_Soft_Error_Rate    -OSR--   100   100   000    -    0
183 Runtime_Bad_Block       -O--CK   100   100   000    -    0
184 End-to-End_Error        PO--CK   100   100   099    -    0
187 Reported_Uncorrect      -O--CK   100   100   000    -    0
188 Command_Timeout         -O--CK   100   100   000    -    0
190 Airflow_Temperature_Cel -O---K   065   057   000    -    35 (Min/Max 35/35)
194 Temperature_Celsius     -O---K   064   056   000    -    36 (Min/Max 35/36)
195 Hardware_ECC_Recovered  -O-RC-   100   100   000    -    68
196 Reallocated_Event_Count -O--CK   100   100   000    -    0
197 Current_Pending_Sector  -O--C-   100   100   000    -    0
198 Offline_Uncorrectable   ----CK   100   100   000    -    0
199 UDMA_CRC_Error_Count    -OSRCK   100   100   000    -    14
200 Multi_Zone_Error_Rate   -O-R--   100   100   000    -    0
201 Soft_Read_Error_Rate    -O-R--   253   253   000    -    0
                            ||||||_ K auto-keep
                            |||||__ C event count
                            ||||___ R error rate
                            |||____ S speed/performance
                            ||_____ O updated online
                            |______ P prefailure warning

General Purpose Log Directory Version 1
SMART           Log Directory Version 1 [multi-sector log support]
Address    Access  R/W   Size  Description
0x00       GPL,SL  R/O      1  Log Directory
0x01           SL  R/O      1  Summary SMART error log
0x02           SL  R/O      2  Comprehensive SMART error log
0x03       GPL     R/O      2  Ext. Comprehensive SMART error log
0x06           SL  R/O      1  SMART self-test log
0x07       GPL     R/O      2  Extended self-test log
0x09           SL  R/W      1  Selective self-test log
0x10       GPL     R/O      1  NCQ Command Error log
0x11       GPL     R/O      1  SATA Phy Event Counters
0x80-0x9f  GPL,SL  R/W     16  Host vendor specific log
0xe0       GPL,SL  R/W      1  SCT Command/Status
0xe1       GPL,SL  R/W      1  SCT Data Transfer

SMART Extended Comprehensive Error Log Version: 1 (2 sectors)
Device Error Count: 29 (device log contains only the most recent 8 errors)
	CR     = Command Register
	FEATR  = Features Register
	COUNT  = Count (was: Sector Count) Register
	LBA_48 = Upper bytes of LBA High/Mid/Low Registers ]  ATA-8
	LH     = LBA High (was: Cylinder High) Register    ]   LBA
	LM     = LBA Mid (was: Cylinder Low) Register      ] Register
	LL     = LBA Low (was: Sector Number) Register     ]
	DV     = Device (was: Device/Head) Register
	DC     = Device Control Register
	ER     = Error register
	ST     = Status register
Powered_Up_Time is measured from power on, and printed as
DDd+hh:mm:SS.sss where DD=days, hh=hours, mm=minutes,
SS=sec, and sss=millisec. It "wraps" after 49.710 days.

Error 29 [4] occurred at disk power-on lifetime: 9162 hours (381 days + 18 hours)
  When the command that caused the error occurred, the device was active or idle.

  After command completion occurred, registers were:
  ER -- ST COUNT  LBA_48  LH LM LL DV DC
  -- -- -- == -- == == == -- -- -- -- --
  04 -- 51 00 21 00 00 00 00 08 37 e0 00  Error: ABRT 33 sectors at LBA = 0x00000837 = 2103

  Commands leading to the command that caused the error were:
  CR FEATR COUNT  LBA_48  LH LM LL DV DC  Powered_Up_Time  Command/Feature_Name
  -- == -- == -- == == == -- -- -- -- --  ---------------  --------------------
  35 00 00 00 38 00 00 00 00 08 20 e0 00     03:13:27.810  WRITE DMA EXT
  35 00 00 00 18 00 00 00 00 08 00 e0 00     03:13:27.800  WRITE DMA EXT
  25 00 00 00 01 00 00 0a eb 43 e8 e0 00     03:13:27.770  READ DMA EXT
  25 00 00 00 01 00 00 0a eb 41 e0 e0 00     03:13:27.750  READ DMA EXT
  25 00 00 00 01 00 00 00 00 08 10 e0 00     03:13:27.670  READ DMA EXT

Error 28 [3] occurred at disk power-on lifetime: 9162 hours (381 days + 18 hours)
  When the command that caused the error occurred, the device was active or idle.

  After command completion occurred, registers were:
  ER -- ST COUNT  LBA_48  LH LM LL DV DC
  -- -- -- == -- == == == -- -- -- -- --
  04 -- 51 00 49 00 00 22 2c 08 a7 e0 00  Error: ABRT 73 sectors at LBA = 0x222c08a7 = 573311143

  Commands leading to the command that caused the error were:
  CR FEATR COUNT  LBA_48  LH LM LL DV DC  Powered_Up_Time  Command/Feature_Name
  -- == -- == -- == == == -- -- -- -- --  ---------------  --------------------
  35 00 00 00 f0 00 00 22 2c 08 00 e0 00     02:38:07.500  WRITE DMA EXT
  35 00 00 00 08 00 00 22 00 08 00 e0 00     02:38:07.450  WRITE DMA EXT
  35 00 00 00 08 00 00 21 c0 08 00 e0 00     02:38:07.420  WRITE DMA EXT
  35 00 00 00 08 00 00 21 80 08 00 e0 00     02:38:07.410  WRITE DMA EXT
  35 00 00 00 08 00 00 21 40 08 00 e0 00     02:38:07.400  WRITE DMA EXT

Error 27 [2] occurred at disk power-on lifetime: 9160 hours (381 days + 16 hours)
  When the command that caused the error occurred, the device was active or idle.

  After command completion occurred, registers were:
  ER -- ST COUNT  LBA_48  LH LM LL DV DC
  -- -- -- == -- == == == -- -- -- -- --
  04 -- 51 00 3d 00 00 00 5e 16 23 e0 00  Error: ABRT 61 sectors at LBA = 0x005e1623 = 6166051

  Commands leading to the command that caused the error were:
  CR FEATR COUNT  LBA_48  LH LM LL DV DC  Powered_Up_Time  Command/Feature_Name
  -- == -- == -- == == == -- -- -- -- --  ---------------  --------------------
  35 00 00 00 80 00 00 00 5e 15 e0 e0 00     01:27:47.830  WRITE DMA EXT
  35 00 00 00 80 00 00 00 5e 15 60 e0 00     01:27:47.800  WRITE DMA EXT
  35 00 00 00 80 00 00 00 5e 14 e0 e0 00     01:27:47.780  WRITE DMA EXT
  35 00 00 00 80 00 00 00 5e 14 60 e0 00     01:27:47.770  WRITE DMA EXT
  35 00 00 00 80 00 00 00 5e 13 e0 e0 00     01:27:47.740  WRITE DMA EXT

Error 26 [1] occurred at disk power-on lifetime: 9160 hours (381 days + 16 hours)
  When the command that caused the error occurred, the device was active or idle.

  After command completion occurred, registers were:
  ER -- ST COUNT  LBA_48  LH LM LL DV DC
  -- -- -- == -- == == == -- -- -- -- --
  04 -- 51 00 0d 00 00 00 60 08 3b e0 00  Error: ABRT 13 sectors at LBA = 0x0060083b = 6293563

  Commands leading to the command that caused the error were:
  CR FEATR COUNT  LBA_48  LH LM LL DV DC  Powered_Up_Time  Command/Feature_Name
  -- == -- == -- == == == -- -- -- -- --  ---------------  --------------------
  35 00 00 00 10 00 00 00 60 08 38 e0 00     01:09:23.240  WRITE DMA EXT
  25 00 00 00 08 00 00 00 60 08 38 e0 00     01:09:23.240  READ DMA EXT
  25 00 00 00 08 00 00 00 5f 3a 00 e0 00     01:09:23.220  READ DMA EXT
  25 00 00 00 08 00 00 00 60 08 a0 e0 00     01:09:23.220  READ DMA EXT
  25 00 00 00 08 00 00 00 5e 03 d0 e0 00     01:09:23.190  READ DMA EXT

Error 25 [0] occurred at disk power-on lifetime: 9160 hours (381 days + 16 hours)
  When the command that caused the error occurred, the device was active or idle.

  After command completion occurred, registers were:
  ER -- ST COUNT  LBA_48  LH LM LL DV DC
  -- -- -- == -- == == == -- -- -- -- --
  04 -- 51 00 0d 00 00 00 60 08 3b e0 00  Error: ABRT 13 sectors at LBA = 0x0060083b = 6293563

  Commands leading to the command that caused the error were:
  CR FEATR COUNT  LBA_48  LH LM LL DV DC  Powered_Up_Time  Command/Feature_Name
  -- == -- == -- == == == -- -- -- -- --  ---------------  --------------------
  35 00 00 00 10 00 00 00 60 08 38 e0 00     01:09:20.820  WRITE DMA EXT
  25 00 00 00 08 00 00 00 60 08 38 e0 00     01:09:20.820  READ DMA EXT
  25 00 00 00 08 00 00 00 5f 3a 00 e0 00     01:09:20.810  READ DMA EXT
  25 00 00 00 08 00 00 00 60 08 a0 e0 00     01:09:20.810  READ DMA EXT
  25 00 00 00 08 00 00 00 5e 03 d0 e0 00     01:09:20.800  READ DMA EXT

Error 24 [7] occurred at disk power-on lifetime: 9160 hours (381 days + 16 hours)
  When the command that caused the error occurred, the device was active or idle.

  After command completion occurred, registers were:
  ER -- ST COUNT  LBA_48  LH LM LL DV DC
  -- -- -- == -- == == == -- -- -- -- --
  04 -- 51 00 0d 00 00 00 60 08 3b e0 00  Error: ABRT 13 sectors at LBA = 0x0060083b = 6293563

  Commands leading to the command that caused the error were:
  CR FEATR COUNT  LBA_48  LH LM LL DV DC  Powered_Up_Time  Command/Feature_Name
  -- == -- == -- == == == -- -- -- -- --  ---------------  --------------------
  35 00 00 00 10 00 00 00 60 08 38 e0 00     01:09:18.280  WRITE DMA EXT
  25 00 00 00 08 00 00 00 60 08 38 e0 00     01:09:18.280  READ DMA EXT
  25 00 00 00 08 00 00 00 5f 3a 00 e0 00     01:09:18.270  READ DMA EXT
  25 00 00 00 08 00 00 00 60 08 a0 e0 00     01:09:18.270  READ DMA EXT
  25 00 00 00 08 00 00 00 5e 03 d0 e0 00     01:09:18.250  READ DMA EXT

Error 23 [6] occurred at disk power-on lifetime: 9160 hours (381 days + 16 hours)
  When the command that caused the error occurred, the device was active or idle.

  After command completion occurred, registers were:
  ER -- ST COUNT  LBA_48  LH LM LL DV DC
  -- -- -- == -- == == == -- -- -- -- --
  04 -- 51 00 0d 00 00 00 60 08 3b e0 00  Error: ABRT 13 sectors at LBA = 0x0060083b = 6293563

  Commands leading to the command that caused the error were:
  CR FEATR COUNT  LBA_48  LH LM LL DV DC  Powered_Up_Time  Command/Feature_Name
  -- == -- == -- == == == -- -- -- -- --  ---------------  --------------------
  35 00 00 00 10 00 00 00 60 08 38 e0 00     01:09:15.810  WRITE DMA EXT
  25 00 00 00 08 00 00 00 60 08 38 e0 00     01:09:15.810  READ DMA EXT
  25 00 00 00 08 00 00 00 5f 3a 00 e0 00     01:09:15.790  READ DMA EXT
  25 00 00 00 08 00 00 00 60 08 a0 e0 00     01:09:15.790  READ DMA EXT
  25 00 00 00 08 00 00 00 5e 03 d0 e0 00     01:09:15.780  READ DMA EXT

Error 22 [5] occurred at disk power-on lifetime: 9160 hours (381 days + 16 hours)
  When the command that caused the error occurred, the device was active or idle.

  After command completion occurred, registers were:
  ER -- ST COUNT  LBA_48  LH LM LL DV DC
  -- -- -- == -- == == == -- -- -- -- --
  04 -- 51 00 0d 00 00 00 60 08 3b e0 00  Error: ABRT 13 sectors at LBA = 0x0060083b = 6293563

  Commands leading to the command that caused the error were:
  CR FEATR COUNT  LBA_48  LH LM LL DV DC  Powered_Up_Time  Command/Feature_Name
  -- == -- == -- == == == -- -- -- -- --  ---------------  --------------------
  35 00 00 00 10 00 00 00 60 08 38 e0 00     01:09:13.280  WRITE DMA EXT
  25 00 00 00 08 00 00 00 60 08 38 e0 00     01:09:13.280  READ DMA EXT
  25 00 00 00 08 00 00 00 5f 3a 00 e0 00     01:09:13.270  READ DMA EXT
  25 00 00 00 08 00 00 00 60 08 a0 e0 00     01:09:13.270  READ DMA EXT
  25 00 00 00 08 00 00 00 5e 03 d0 e0 00     01:09:13.250  READ DMA EXT

SMART Extended Self-test Log Version: 0 (2 sectors)
No self-tests have been logged.  [To run self-tests, use: smartctl -t]

SMART Selective self-test log data structure revision number 0
Note: revision number not 1 implies that no selective self-test has ever been run
 SPAN  MIN_LBA  MAX_LBA  CURRENT_TEST_STATUS
    1        0        0  Not_testing
    2        0        0  Not_testing
    3        0        0  Not_testing
    4        0        0  Not_testing
    5        0        0  Not_testing
Selective self-test flags (0x0):
  After scanning selected spans, do NOT read-scan remainder of disk.
If Selective self-test is pending on power-up, resume after 0 minute delay.

SCT Status Version:                  2
SCT Version (vendor specific):       256 (0x0100)
SCT Support Level:                   1
Device State:                        Active (0)
Current Temperature:                 36 Celsius
Power Cycle Max Temperature:         36 Celsius
Lifetime    Max Temperature:         49 Celsius

SCT Temperature History Version:     2
Temperature Sampling Period:         1 minute
Temperature Logging Interval:        1 minute
Min/Max recommended Temperature:     -4/72 Celsius
Min/Max Temperature Limit:           -9/77 Celsius
Temperature History Size (Index):    128 (76)

SCT Error Recovery Control:
           Read: Disabled
          Write: Disabled

Device Statistics (GP Log 0x04) not supported

SATA Phy Event Counters (GP Log 0x11)
ID      Size     Value  Description
0x000a  2            1  Device-to-host register FISes sent due to a COMRESET
0x0001  2            0  Command failed due to ICRC error
0x0002  2            0  R_ERR response for data FIS
0x0003  2            0  R_ERR response for device-to-host data FIS
0x0004  2            0  R_ERR response for host-to-device data FIS
0x0005  2            0  R_ERR response for non-data FIS
0x0006  2            0  R_ERR response for device-to-host non-data FIS
0x0007  2            0  R_ERR response for host-to-device non-data FIS
0x0008  2            0  Device-to-host non-data FIS retries
0x0009  2            1  Transition from drive PhyRdy to drive PhyNRdy
0x000b  2            0  CRC errors within host-to-device FIS
0x000d  2            0  Non-CRC errors within host-to-device FIS
0x000f  2            0  R_ERR response for host-to-device data FIS, CRC
0x0010  2            0  R_ERR response for host-to-device data FIS, non-CRC
0x0012  2            0  R_ERR response for host-to-device non-data FIS, CRC
0x0013  2            0  R_ERR response for host-to-device non-data FIS, non-CRC



