smartctl 7.5 2025-04-30 r5714 [x86_64-linux-6.17.8-zen1-1-zen] (local build)
Copyright (C) 2002-25, Bruce Allen, Christian Franke, www.smartmontools.org

=== START OF INFORMATION SECTION ===
Model Number:                       KINGSTON SNV3S1000G
Serial Number:                      --
Firmware Version:                   P3BR0A23
PCI Vendor/Subsystem ID:            0x2646
IEEE OUI Identifier:                0x0026b7
Total NVM Capacity:                 1,000,204,886,016 [1.00 TB]
Unallocated NVM Capacity:           0
Controller ID:                      0
NVMe Version:                       1.4
Number of Namespaces:               1
Namespace 1 Size/Capacity:          1,000,204,886,016 [1.00 TB]
Namespace 1 Formatted LBA Size:     512
Namespace 1 IEEE EUI-64:            0026b7 ...
Local Time is:                      Sat Dec  6 18:20:19 2025 CET
Firmware Updates (0x12):            1 Slot, no Reset required
Optional Admin Commands (0x0016):   Format Frmw_DL Self_Test
Optional NVM Commands (0x0056):     Wr_Unc DS_Mngmt Sav/Sel_Feat Timestmp
Log Page Attributes (0x02):         Cmd_Eff_Lg
Maximum Data Transfer Size:         64 Pages
Warning  Comp. Temp. Threshold:     75 Celsius
Critical Comp. Temp. Threshold:     80 Celsius

Supported Power States
St Op     Max   Active     Idle   RL RT WL WT  Ent_Lat  Ex_Lat
 0 +     5.00W       -        -    0  0  0  0        1       1
 1 +     5.00W       -        -    1  1  1  1       10      10
 2 +     5.00W       -        -    2  2  2  2       50      50
 3 -     0.30W       -        -    3  3  3  3     5000   10000
 4 -     0.30W       -        -    4  4  4  4    10000   40000

Supported LBA Sizes (NSID 0x1)
Id Fmt  Data  Metadt  Rel_Perf
 0 +     512       0         0

=== START OF SMART DATA SECTION ===
SMART overall-health self-assessment test result: PASSED

SMART/Health Information (NVMe Log 0x02, NSID 0xffffffff)
Critical Warning:                   0x00
Temperature:                        36 Celsius
Available Spare:                    100%
Available Spare Threshold:          10%
Percentage Used:                    1%
Data Units Read:                    8,102,998 [4.14 TB]
Data Units Written:                 9,149,789 [4.68 TB]
Host Read Commands:                 74,554,145
Host Write Commands:                67,918,307
Controller Busy Time:               147
Power Cycles:                       247
Power On Hours:                     778
Unsafe Shutdowns:                   27
Media and Data Integrity Errors:    0
Error Information Log Entries:      0
Warning  Comp. Temperature Time:    3
Critical Comp. Temperature Time:    1
Temperature Sensor 1:               48 Celsius
Temperature Sensor 2:               81 Celsius
Temperature Sensor 3:               36 Celsius
Thermal Temp. 1 Transition Count:   1
Thermal Temp. 1 Total Time:         62

Error Information (NVMe Log 0x01, 4 of 4 entries)
No Errors Logged

Self-test Log (NVMe Log 0x06, NSID 0xffffffff)
Self-test status: No self-test in progress
No Self-tests Logged



