=== START OF INFORMATION SECTION ===
Model Family:     Hitachi Travelstar 80GN
Device Model:     IC25N080ATMR04-0
Serial Number:    --
Firmware Version: MO4OAD4A
User Capacity:    80,026,361,856 bytes [80.0 GB]
Sector Size:      512 bytes logical/physical
Device is:        In smartctl database [for details use: -P show]
ATA Version is:   ATA/ATAPI-6 T13/1410D revision 3a
Local Time is:    Sat Mar  2 19:41:36 2019 MSK
SMART support is: Available - device has SMART capability.
SMART support is: Enabled
AAM feature is:   Disabled
APM level is:     128 (minimum power consumption without standby)
Rd look-ahead is: Enabled
Write cache is:   Enabled
DSN feature is:   Unavailable
ATA Security is:  Disabled, frozen [SEC2]
Wt Cache Reorder: Unavailable

=== START OF READ SMART DATA SECTION ===
SMART overall-health self-assessment test result: PASSED

General SMART Values:
Offline data collection status:  (0x84)	Offline data collection activity
					was suspended by an interrupting command from host.
					Auto Offline Data Collection: Enabled.
Self-test execution status:      (   0)	The previous self-test routine completed
					without error or no self-test has ever 
					been run.
Total time to complete Offline 
data collection: 		(  645) seconds.
Offline data collection
capabilities: 			 (0x5b) SMART execute Offline immediate.
					Auto Offline data collection on/off support.
					Suspend Offline collection upon new
					command.
					Offline surface scan supported.
					Self-test supported.
					No Conveyance Self-test supported.
					Selective Self-test supported.
SMART capabilities:            (0x0003)	Saves SMART data before entering
					power-saving mode.
					Supports SMART auto save timer.
Error logging capability:        (0x01)	Error logging supported.
					General Purpose Logging supported.
Short self-test routine 
recommended polling time: 	 (   2) minutes.
Extended self-test routine
recommended polling time: 	 (  69) minutes.

SMART Attributes Data Structure revision number: 16
Vendor Specific SMART Attributes with Thresholds:
ID# ATTRIBUTE_NAME          FLAGS    VALUE WORST THRESH FAIL RAW_VALUE
  1 Raw_Read_Error_Rate     PO-R--   100   100   062    -    0
  2 Throughput_Performance  P-S---   100   100   040    -    146
  3 Spin_Up_Time            POS---   196   196   033    -    0
  4 Start_Stop_Count        -O--C-   100   100   000    -    1183
  5 Reallocated_Sector_Ct   PO--CK   100   100   005    -    0
  7 Seek_Error_Rate         PO-R--   100   100   067    -    0
  8 Seek_Time_Performance   P-S---   100   100   040    -    0
  9 Power_On_Hours          -O--C-   098   098   000    -    1197
 10 Spin_Retry_Count        PO--C-   100   100   060    -    0
 12 Power_Cycle_Count       -O--CK   100   100   000    -    1172
191 G-Sense_Error_Rate      -O-R--   100   100   000    -    0
192 Power-Off_Retract_Count -O--CK   100   100   000    -    36
193 Load_Cycle_Count        -O--C-   096   096   000    -    46635
194 Temperature_Celsius     -O----   157   157   000    -    35 (Min/Max 7/51)
196 Reallocated_Event_Count -O--CK   100   100   000    -    3
197 Current_Pending_Sector  -O---K   100   100   000    -    1
198 Offline_Uncorrectable   ---R--   100   100   000    -    0
199 UDMA_CRC_Error_Count    -O-R--   200   200   000    -    0
                            ||||||_ K auto-keep
                            |||||__ C event count
                            ||||___ R error rate
                            |||____ S speed/performance
                            ||_____ O updated online
                            |______ P prefailure warning

General Purpose Log Directory Version 1
SMART           Log Directory Version 1 [multi-sector log support]
Address    Access  R/W   Size  Description
0x00       GPL,SL  R/O      1  Log Directory
0x01           SL  R/O      1  Summary SMART error log
0x03       GPL     R/O      1  Ext. Comprehensive SMART error log
0x06           SL  R/O      1  SMART self-test log
0x07       GPL     R/O      1  Extended self-test log
0x80-0x9f  GPL,SL  R/W     16  Host vendor specific log

SMART Extended Comprehensive Error Log Version: 1 (1 sectors)
Device Error Count: 11 (device log contains only the most recent 4 errors)
	CR     = Command Register
	FEATR  = Features Register
	COUNT  = Count (was: Sector Count) Register
	LBA_48 = Upper bytes of LBA High/Mid/Low Registers ]  ATA-8
	LH     = LBA High (was: Cylinder High) Register    ]   LBA
	LM     = LBA Mid (was: Cylinder Low) Register      ] Register
	LL     = LBA Low (was: Sector Number) Register     ]
	DV     = Device (was: Device/Head) Register
	DC     = Device Control Register
	ER     = Error register
	ST     = Status register
Powered_Up_Time is measured from power on, and printed as
DDd+hh:mm:SS.sss where DD=days, hh=hours, mm=minutes,
SS=sec, and sss=millisec. It "wraps" after 49.710 days.

Error 11 [2] occurred at disk power-on lifetime: 555 hours (23 days + 3 hours)
  When the command that caused the error occurred, the device was active or idle.

  After command completion occurred, registers were:
  ER -- ST COUNT  LBA_48  LH LM LL DV DC
  -- -- -- == -- == == == -- -- -- -- --
  40 -- 51 00 04 00 00 08 1c 39 2d e8 00  Error: UNC 4 sectors at LBA = 0x081c392d = 136067373

  Commands leading to the command that caused the error were:
  CR FEATR COUNT  LBA_48  LH LM LL DV DC  Powered_Up_Time  Command/Feature_Name
  -- == -- == -- == == == -- -- -- -- --  ---------------  --------------------
  c8 00 00 00 08 80 ce 58 1c 39 29 e8 00     03:20:31.800  READ DMA
  c8 00 00 00 08 80 b4 c8 80 ce 51 e7 00     03:20:31.800  READ DMA
  c8 00 00 00 38 80 92 a0 80 b4 91 e7 00     03:20:31.800  READ DMA
  c8 00 00 00 08 7f 84 48 80 92 99 e7 00     03:20:31.800  READ DMA
  c8 00 00 00 20 17 2c c5 7f 84 29 e7 00     03:20:31.800  READ DMA

Error 10 [1] occurred at disk power-on lifetime: 183 hours (7 days + 15 hours)
  When the command that caused the error occurred, the device was in a reserved state.

  After command completion occurred, registers were:
  ER -- ST COUNT  LBA_48  LH LM LL DV DC
  -- -- -- == -- == == == -- -- -- -- --
  38 -- 51 6b 00 e7 01 97 1c 39 28 c8 00

  Commands leading to the command that caused the error were:
  CR FEATR COUNT  LBA_48  LH LM LL DV DC  Powered_Up_Time  Command/Feature_Name
  -- == -- == -- == == == -- -- -- -- --  ---------------  --------------------
  d4 00 08 90 21 c8 81 08 e8 1c 39 e8 00     00:00:00.183  [RESERVED FOR MEDIA CARD PASS THROUGH]
  d4 00 08 d8 89 c8 80 84 e7 81 08 e8 00     00:00:00.183  [RESERVED FOR MEDIA CARD PASS THROUGH]
  d4 00 08 8a d1 c8 17 2b e7 80 84 e8 00     00:00:00.183  [RESERVED FOR MEDIA CARD PASS THROUGH]
  d4 00 02 fb 89 c8 ca f8 e7 17 2b e8 00     00:00:00.183  [RESERVED FOR MEDIA CARD PASS THROUGH]
  d4 00 10 20 ec c8 1c 39 e6 ca f8 e8 00     00:00:00.183  [RESERVED FOR MEDIA CARD PASS THROUGH]

Error 9 [0] occurred at disk power-on lifetime: 0 hours (0 days + 0 hours)
  When the command that caused the error occurred, the device was in an unknown state.

  After command completion occurred, registers were:
  ER -- ST COUNT  LBA_48  LH LM LL DV DC
  -- -- -- == -- == == == -- -- -- -- --
  29 -- 96 44 d8 00 e7 81 c8 81 05 70 00

  Commands leading to the command that caused the error were:
  CR FEATR COUNT  LBA_48  LH LM LL DV DC  Powered_Up_Time  Command/Feature_Name
  -- == -- == -- == == == -- -- -- -- --  ---------------  --------------------
  b7 00 b1 f9 05 70 c8 80 38 e7 81 96 00  1d+13:16:57.728  [RESERVED FOR COMPACTFLASH ASSOCIATION]
  b7 30 f9 86 f8 70 c8 80 00 e7 80 96 00  7d+18:24:48.640  [RESERVED FOR COMPACTFLASH ASSOCIATION]
  b7 48 b9 aa 85 70 c8 73 38 e7 80 96 00  1d+13:16:57.728  [RESERVED FOR COMPACTFLASH ASSOCIATION]
  b7 c8 41 7f aa 70 c8 70 8f e7 73 96 00 23d+07:14:25.920  [RESERVED FOR COMPACTFLASH ASSOCIATION]
  c8 00 00 00 01 92 b4 de 00 00 00 e0 00  1d+13:16:57.728  READ DMA

Error 8 [3] occurred at disk power-on lifetime: 307 hours (12 days + 19 hours)
  When the command that caused the error occurred, the device was active or idle.

  After command completion occurred, registers were:
  ER -- ST COUNT  LBA_48  LH LM LL DV DC
  -- -- -- == -- == == == -- -- -- -- --
  40 -- 51 00 02 8f 0e 16 38 5a 38 e4 00  Error: UNC at LBA = 0x8f0e16385a38 = 157290665105976

  Commands leading to the command that caused the error were:
  CR FEATR COUNT  LBA_48  LH LM LL DV DC  Powered_Up_Time  Command/Feature_Name
  -- == -- == -- == == == -- -- -- -- --  ---------------  --------------------
  40 00 00 00 02 8f 0e 16 38 5a 38 e4 00     00:12:52.800  READ VERIFY SECTOR(S)
  ca 00 00 00 08 00 08 d6 8f 0e 0f e0 00     00:12:52.800  WRITE DMA
  ca 00 00 00 08 00 08 bf 92 b4 cf e2 00     00:12:52.800  WRITE DMA
  ca 00 00 04 01 00 08 38 5d e2 bf e0 00     00:12:52.700  WRITE DMA
  40 00 00 00 04 bc 42 fa 38 5a 38 e4 00     00:12:49.100  READ VERIFY SECTOR(S)

SMART Extended Self-test Log Version: 1 (1 sectors)
No self-tests have been logged.  [To run self-tests, use: smartctl -t]

Warning! SMART Selective Self-Test Log Structure error: invalid SMART checksum.
SMART Selective self-test log data structure revision number 1
 SPAN  MIN_LBA  MAX_LBA  CURRENT_TEST_STATUS
    1        0        0  Not_testing
    2        0        0  Not_testing
    3        0        0  Not_testing
    4        0        0  Not_testing
    5        0        0  Not_testing
Selective self-test flags (0x0):
  After scanning selected spans, do NOT read-scan remainder of disk.
If Selective self-test is pending on power-up, resume after 0 minute delay.

SCT Commands not supported

Device Statistics (GP/SMART Log 0x04) not supported

Pending Defects log (GP Log 0x0c) not supported

SATA Phy Event Counters (GP Log 0x11) not supported

