smartctl 7.4 2023-08-01 r5530 [x86_64-linux-6.14.2-desktop-3omv2590] (OpenMandriva Lx 7.4-1)
Copyright (C) 2002-23, Bruce Allen, Christian Franke, www.smartmontools.org

=== START OF INFORMATION SECTION ===
Model Number:                       Predator SSD GM7000 4TB
Serial Number:                      --
Firmware Version:                   3.A.J.CR
PCI Vendor/Subsystem ID:            0x1dbe
IEEE OUI Identifier:                0xa84397
Total NVM Capacity:                 4,096,805,658,624 [4.09 TB]
Unallocated NVM Capacity:           0
Controller ID:                      0
NVMe Version:                       1.4
Number of Namespaces:               1
Namespace 1 Size/Capacity:          4,096,805,658,624 [4.09 TB]
Namespace 1 Formatted LBA Size:     512
Namespace 1 IEEE EUI-64:            a84397 ...
Local Time is:                      Sun Apr 27 10:46:54 2025 CDT
Firmware Updates (0x0e):            7 Slots
Optional Admin Commands (0x0017):   Security Format Frmw_DL Self_Test
Optional NVM Commands (0x0014):     DS_Mngmt Sav/Sel_Feat
Log Page Attributes (0x0e):         Cmd_Eff_Lg Ext_Get_Lg Telmtry_Lg
Maximum Data Transfer Size:         512 Pages
Warning  Comp. Temp. Threshold:     120 Celsius
Critical Comp. Temp. Threshold:     130 Celsius

Supported Power States
St Op     Max   Active     Idle   RL RT WL WT  Ent_Lat  Ex_Lat
 0 +     3.50W       -        -    0  0  0  0        5       5
 1 +     3.30W       -        -    1  1  1  1       50     100
 2 +     3.10W       -        -    2  2  2  2       50     200
 3 -   0.1500W       -        -    3  3  3  3      500    5000
 4 -   0.0080W       -        -    4  4  4  4     2000   85000

Supported LBA Sizes (NSID 0x1)
Id Fmt  Data  Metadt  Rel_Perf
 0 +     512       0         0

=== START OF SMART DATA SECTION ===
SMART overall-health self-assessment test result: PASSED

SMART/Health Information (NVMe Log 0x02)
Critical Warning:                   0x00
Temperature:                        53 Celsius
Available Spare:                    100%
Available Spare Threshold:          25%
Percentage Used:                    0%
Data Units Read:                    18,529,788 [9.48 TB]
Data Units Written:                 15,490,198 [7.93 TB]
Host Read Commands:                 126,628,337
Host Write Commands:                117,541,726
Controller Busy Time:               5
Power Cycles:                       211
Power On Hours:                     287
Unsafe Shutdowns:                   145
Media and Data Integrity Errors:    0
Error Information Log Entries:      0
Warning  Comp. Temperature Time:    0
Critical Comp. Temperature Time:    0
Temperature Sensor 1:               71 Celsius
Temperature Sensor 2:               53 Celsius
Thermal Temp. 1 Transition Count:   23
Thermal Temp. 1 Total Time:         3134

Error Information (NVMe Log 0x01, 16 of 64 entries)
No Errors Logged

Read Self-test Log failed: Invalid Field in Command (0x002)



