smartctl 7.4 2023-08-01 r5530 [x86_64-linux-6.8.0-63-generic] (local build)
Copyright (C) 2002-23, Bruce Allen, Christian Franke, www.smartmontools.org

=== START OF INFORMATION SECTION ===
Model Number:                       Lexar SSD
Serial Number:                      --
Firmware Version:                   S0318B0
PCI Vendor/Subsystem ID:            0x126f
IEEE OUI Identifier:                0x000000
Controller ID:                      1
NVMe Version:                       1.3
Number of Namespaces:               1
Namespace 1 Size/Capacity:          250,059,350,016 [250 GB]
Namespace 1 Formatted LBA Size:     512
Namespace 1 IEEE EUI-64:            010000 ...
Local Time is:                      Sat Jul  5 23:39:18 2025 +06
Firmware Updates (0x12):            1 Slot, no Reset required
Optional Admin Commands (0x0007):   Security Format Frmw_DL
Optional NVM Commands (0x001f):     Comp Wr_Unc DS_Mngmt Wr_Zero Sav/Sel_Feat
Log Page Attributes (0x07):         S/H_per_NS Cmd_Eff_Lg Ext_Get_Lg
Maximum Data Transfer Size:         64 Pages
Warning  Comp. Temp. Threshold:     70 Celsius
Critical Comp. Temp. Threshold:     80 Celsius
Namespace 1 Features (0x04):        Dea/Unw_Error

Supported Power States
St Op     Max   Active     Idle   RL RT WL WT  Ent_Lat  Ex_Lat
 0 +     9.00W       -        -    0  0  0  0        0       0

Supported LBA Sizes (NSID 0x1)
Id Fmt  Data  Metadt  Rel_Perf
 0 +     512       0         0

=== START OF SMART DATA SECTION ===
SMART overall-health self-assessment test result: PASSED

SMART/Health Information (NVMe Log 0x02)
Critical Warning:                   0x00
Temperature:                        56 Celsius
Available Spare:                    100%
Available Spare Threshold:          10%
Percentage Used:                    9%
Data Units Read:                    121,472,215 [62.1 TB]
Data Units Written:                 111,818,115 [57.2 TB]
Host Read Commands:                 1,406,543,347
Host Write Commands:                1,642,059,202
Controller Busy Time:               123,365
Power Cycles:                       2,534
Power On Hours:                     16,930
Unsafe Shutdowns:                   768
Media and Data Integrity Errors:    4
Error Information Log Entries:      3,893
Warning  Comp. Temperature Time:    3201
Critical Comp. Temperature Time:    1

Error Information (NVMe Log 0x01, 16 of 64 entries)
Num   ErrCount  SQId   CmdId  Status  PELoc          LBA  NSID    VS  Message
  0       3893     0  0x0014  0x0004      -            0     0     -  Invalid Field in Command
  1       3892     0  0x000b  0x8004      -            0     0     -  Invalid Field in Command
  2       3891     0  0x0014  0x0004      -            0     0     -  Invalid Field in Command
  3       3890     0  0x000c  0x0016      -            0     1     -  Invalid Namespace or Format

Self-tests not supported



