smartctl 7.2 2020-12-30 r5155 [x86_64-linux-6.2.0-36-generic] (local build)
Copyright (C) 2002-20, Bruce Allen, Christian Franke, www.smartmontools.org

=== START OF INFORMATION SECTION ===
Model Number:                       SSSTC CL4-8D512
Serial Number:                      --
Firmware Version:                   EV22001
PCI Vendor ID:                      0x1e95
PCI Vendor Subsystem ID:            0x126f
IEEE OUI Identifier:                0x38f601
Controller ID:                      1
NVMe Version:                       1.4
Number of Namespaces:               1
Namespace 1 Size/Capacity:          512,110,190,592 [512 GB]
Namespace 1 Formatted LBA Size:     512
Namespace 1 IEEE EUI-64:            38f601 ...
Local Time is:                      Sun Jan  7 04:04:23 2024 -03
Firmware Updates (0x14):            2 Slots, no Reset required
Optional Admin Commands (0x0017):   Security Format Frmw_DL Self_Test
Optional NVM Commands (0x0097):     Comp Wr_Unc DS_Mngmt Sav/Sel_Feat Verify
Log Page Attributes (0x0a):         Cmd_Eff_Lg Telmtry_Lg
Maximum Data Transfer Size:         64 Pages
Warning  Comp. Temp. Threshold:     83 Celsius
Critical Comp. Temp. Threshold:     85 Celsius

Supported Power States
St Op     Max   Active     Idle   RL RT WL WT  Ent_Lat  Ex_Lat
 0 +     6.00W       -        -    0  0  0  0        0       0
 1 +     3.50W       -        -    1  1  1  1        0       0
 2 +     2.50W       -        -    2  2  2  2        0       0
 3 -   0.0500W       -        -    3  3  3  3     5000   10000
 4 -   0.0050W       -        -    4  4  4  4     5000   35000

Supported LBA Sizes (NSID 0x1)
Id Fmt  Data  Metadt  Rel_Perf
 0 +     512       0         0

=== START OF SMART DATA SECTION ===
SMART overall-health self-assessment test result: PASSED

SMART/Health Information (NVMe Log 0x02)
Critical Warning:                   0x00
Temperature:                        46 Celsius
Available Spare:                    100%
Available Spare Threshold:          10%
Percentage Used:                    3%
Data Units Read:                    1,115,957 [571 GB]
Data Units Written:                 4,105,328 [2.10 TB]
Host Read Commands:                 14,431,722
Host Write Commands:                78,416,422
Controller Busy Time:               3,942
Power Cycles:                       37
Power On Hours:                     1,777
Unsafe Shutdowns:                   23
Media and Data Integrity Errors:    0
Error Information Log Entries:      0
Warning  Comp. Temperature Time:    7
Critical Comp. Temperature Time:    63
Temperature Sensor 1:               46 Celsius

Error Information (NVMe Log 0x01, 16 of 64 entries)
No Errors Logged

