smartctl 7.4 2023-08-01 r5530 [x86_64-linux-6.13.9-200.fc41.x86_64] (local build)
Copyright (C) 2002-23, Bruce Allen, Christian Franke, www.smartmontools.org

=== START OF INFORMATION SECTION ===
Model Family:     Seagate Momentus 7200.4
Device Model:     ST9500420ASG
Serial Number:    --
LU WWN Device Id: 5 000c50 ...
Firmware Version: D005SDM1
User Capacity:    500,107,862,016 bytes [500 GB]
Sector Size:      512 bytes logical/physical
Rotation Rate:    7200 rpm
Device is:        In smartctl database 7.3/5528
ATA Version is:   ATA8-ACS T13/1699-D revision 4
SATA Version is:  SATA 2.6, 3.0 Gb/s
Local Time is:    Tue Apr  8 16:58:24 2025 CEST
SMART support is: Available - device has SMART capability.
SMART support is: Enabled
AAM level is:     208 (intermediate), recommended: 208
APM level is:     128 (minimum power consumption without standby)
Rd look-ahead is: Enabled
Write cache is:   Enabled
DSN feature is:   Unavailable
ATA Security is:  Disabled, frozen [SEC2]
Wt Cache Reorder: Unknown

=== START OF READ SMART DATA SECTION ===
SMART overall-health self-assessment test result: PASSED

General SMART Values:
Offline data collection status:  (0x00)	Offline data collection activity
					was never started.
					Auto Offline Data Collection: Disabled.
Self-test execution status:      (   0)	The previous self-test routine completed
					without error or no self-test has ever 
					been run.
Total time to complete Offline 
data collection: 		(    0) seconds.
Offline data collection
capabilities: 			 (0x73) SMART execute Offline immediate.
					Auto Offline data collection on/off support.
					Suspend Offline collection upon new
					command.
					No Offline surface scan supported.
					Self-test supported.
					Conveyance Self-test supported.
					Selective Self-test supported.
SMART capabilities:            (0x0003)	Saves SMART data before entering
					power-saving mode.
					Supports SMART auto save timer.
Error logging capability:        (0x01)	Error logging supported.
					General Purpose Logging supported.
Short self-test routine 
recommended polling time: 	 (   2) minutes.
Extended self-test routine
recommended polling time: 	 ( 108) minutes.
Conveyance self-test routine
recommended polling time: 	 (   3) minutes.
SCT capabilities: 	       (0x103f)	SCT Status supported.
					SCT Error Recovery Control supported.
					SCT Feature Control supported.
					SCT Data Table supported.

SMART Attributes Data Structure revision number: 10
Vendor Specific SMART Attributes with Thresholds:
ID# ATTRIBUTE_NAME          FLAGS    VALUE WORST THRESH FAIL RAW_VALUE
  1 Raw_Read_Error_Rate     POSR--   119   099   006    -    208892321
  3 Spin_Up_Time            PO----   096   096   085    -    0
  4 Start_Stop_Count        -O--CK   097   097   020    -    3702
  5 Reallocated_Sector_Ct   PO--CK   100   100   036    -    0
  7 Seek_Error_Rate         POSR--   078   060   030    -    66667826
  9 Power_On_Hours          -O--CK   090   090   000    -    9634
 10 Spin_Retry_Count        PO--C-   100   100   097    -    0
 12 Power_Cycle_Count       -O--CK   097   037   020    -    3676
184 End-to-End_Error        -O--CK   100   100   099    -    0
187 Reported_Uncorrect      -O--CK   082   082   000    -    18
188 Command_Timeout         -O--CK   100   099   000    -    1
189 High_Fly_Writes         -O-RCK   100   100   000    -    0
190 Airflow_Temperature_Cel -O---K   064   052   045    -    36 (Min/Max 20/36)
191 G-Sense_Error_Rate      -O--CK   100   100   000    -    50
192 Power-Off_Retract_Count -O--CK   100   100   000    -    8
193 Load_Cycle_Count        -O--CK   001   001   000    -    606938
194 Temperature_Celsius     -O---K   036   048   000    -    36 (0 8 0 0 0)
195 Hardware_ECC_Recovered  -O-RC-   047   025   000    -    208892321
197 Current_Pending_Sector  -O--C-   100   100   000    -    0
198 Offline_Uncorrectable   ----C-   100   100   000    -    0
199 UDMA_CRC_Error_Count    -OSRCK   200   200   000    -    0
240 Head_Flying_Hours       ------   100   253   000    -    6944 (34 255 0)
241 Total_LBAs_Written      ------   100   253   000    -    2801064625
242 Total_LBAs_Read         ------   100   253   000    -    4212190687
254 Free_Fall_Sensor        -O--CK   100   100   000    -    0
                            ||||||_ K auto-keep
                            |||||__ C event count
                            ||||___ R error rate
                            |||____ S speed/performance
                            ||_____ O updated online
                            |______ P prefailure warning

General Purpose Log Directory Version 1
SMART           Log Directory Version 1 [multi-sector log support]
Address    Access  R/W   Size  Description
0x00       GPL,SL  R/O      1  Log Directory
0x01       GPL,SL  R/O      1  Summary SMART error log
0x02       GPL,SL  R/O      5  Comprehensive SMART error log
0x03       GPL,SL  R/O      5  Ext. Comprehensive SMART error log
0x06       GPL,SL  R/O      1  SMART self-test log
0x07       GPL,SL  R/O      1  Extended self-test log
0x09       GPL,SL  R/W      1  Selective self-test log
0x10       GPL,SL  R/O      1  NCQ Command Error log
0x11       GPL,SL  R/O      1  SATA Phy Event Counters log
0x21       GPL,SL  R/O      1  Write stream error log
0x22       GPL,SL  R/O      1  Read stream error log
0x80-0x9f  GPL,SL  R/W     16  Host vendor specific log
0xa1       GPL,SL  VS      20  Device vendor specific log
0xa2       GPL     VS    2248  Device vendor specific log
0xa8       GPL,SL  VS      65  Device vendor specific log
0xa9       GPL,SL  VS       1  Device vendor specific log
0xb0       GPL     VS    2864  Device vendor specific log
0xbe-0xbf  GPL     VS   65535  Device vendor specific log
0xe0       GPL,SL  R/W      1  SCT Command/Status
0xe1       GPL,SL  R/W      1  SCT Data Transfer

SMART Extended Comprehensive Error Log Version: 1 (5 sectors)
Device Error Count: 12
	CR     = Command Register
	FEATR  = Features Register
	COUNT  = Count (was: Sector Count) Register
	LBA_48 = Upper bytes of LBA High/Mid/Low Registers ]  ATA-8
	LH     = LBA High (was: Cylinder High) Register    ]   LBA
	LM     = LBA Mid (was: Cylinder Low) Register      ] Register
	LL     = LBA Low (was: Sector Number) Register     ]
	DV     = Device (was: Device/Head) Register
	DC     = Device Control Register
	ER     = Error register
	ST     = Status register
Powered_Up_Time is measured from power on, and printed as
DDd+hh:mm:SS.sss where DD=days, hh=hours, mm=minutes,
SS=sec, and sss=millisec. It "wraps" after 49.710 days.

Error 12 [11] occurred at disk power-on lifetime: 6533 hours (272 days + 5 hours)
  When the command that caused the error occurred, the device was active or idle.

  After command completion occurred, registers were:
  ER -- ST COUNT  LBA_48  LH LM LL DV DC
  -- -- -- == -- == == == -- -- -- -- --
  40 -- 51 00 00 00 00 0c bc 0f 87 00 00  Error: UNC at LBA = 0x0cbc0f87 = 213651335

  Commands leading to the command that caused the error were:
  CR FEATR COUNT  LBA_48  LH LM LL DV DC  Powered_Up_Time  Command/Feature_Name
  -- == -- == -- == == == -- -- -- -- --  ---------------  --------------------
  20 00 00 00 01 00 00 0c bc 0f 87 ec 00     04:07:35.856  READ SECTOR(S)
  ea 00 00 00 00 00 00 00 00 00 00 a0 00     04:07:31.481  FLUSH CACHE EXT
  61 00 00 00 08 00 00 0f e3 3b 28 40 00     04:07:31.471  WRITE FPDMA QUEUED
  ea 00 00 00 00 00 00 00 00 00 00 a0 00     04:07:31.404  FLUSH CACHE EXT
  61 00 00 00 08 00 00 0f e3 3b 20 40 00     04:07:31.184  WRITE FPDMA QUEUED

Error 11 [10] occurred at disk power-on lifetime: 6533 hours (272 days + 5 hours)
  When the command that caused the error occurred, the device was active or idle.

  After command completion occurred, registers were:
  ER -- ST COUNT  LBA_48  LH LM LL DV DC
  -- -- -- == -- == == == -- -- -- -- --
  40 -- 51 00 00 00 00 0c bc 0f 87 00 00  Error: UNC at LBA = 0x0cbc0f87 = 213651335

  Commands leading to the command that caused the error were:
  CR FEATR COUNT  LBA_48  LH LM LL DV DC  Powered_Up_Time  Command/Feature_Name
  -- == -- == -- == == == -- -- -- -- --  ---------------  --------------------
  20 00 00 00 01 00 00 0c bc 0f 87 ec 00     04:06:56.585  READ SECTOR(S)
  61 00 00 00 08 00 00 0f df 31 40 40 00     04:06:41.107  WRITE FPDMA QUEUED
  61 00 00 00 08 00 00 0f df 30 80 40 00     04:06:41.107  WRITE FPDMA QUEUED
  61 00 00 00 08 00 00 0f e0 2e 80 40 00     04:06:41.107  WRITE FPDMA QUEUED
  61 00 00 00 08 00 00 0f df 33 30 40 00     04:06:41.106  WRITE FPDMA QUEUED

Error 10 [9] occurred at disk power-on lifetime: 6533 hours (272 days + 5 hours)
  When the command that caused the error occurred, the device was active or idle.

  After command completion occurred, registers were:
  ER -- ST COUNT  LBA_48  LH LM LL DV DC
  -- -- -- == -- == == == -- -- -- -- --
  40 -- 51 00 00 00 00 0c bc 0f 87 00 00  Error: UNC at LBA = 0x0cbc0f87 = 213651335

  Commands leading to the command that caused the error were:
  CR FEATR COUNT  LBA_48  LH LM LL DV DC  Powered_Up_Time  Command/Feature_Name
  -- == -- == -- == == == -- -- -- -- --  ---------------  --------------------
  20 00 00 00 01 00 00 0c bc 0f 87 ec 00     04:06:23.631  READ SECTOR(S)
  ea 00 00 00 00 00 00 00 00 00 00 a0 00     04:06:06.340  FLUSH CACHE EXT
  61 00 00 00 08 00 00 0f e3 3a 50 40 00     04:06:06.340  WRITE FPDMA QUEUED
  ea 00 00 00 00 00 00 00 00 00 00 a0 00     04:06:06.315  FLUSH CACHE EXT
  61 00 00 00 48 00 00 0f e3 3a 08 40 00     04:06:06.274  WRITE FPDMA QUEUED

Error 9 [8] occurred at disk power-on lifetime: 6533 hours (272 days + 5 hours)
  When the command that caused the error occurred, the device was active or idle.

  After command completion occurred, registers were:
  ER -- ST COUNT  LBA_48  LH LM LL DV DC
  -- -- -- == -- == == == -- -- -- -- --
  40 -- 51 00 00 00 00 0c bc 0f 87 00 00  Error: UNC at LBA = 0x0cbc0f87 = 213651335

  Commands leading to the command that caused the error were:
  CR FEATR COUNT  LBA_48  LH LM LL DV DC  Powered_Up_Time  Command/Feature_Name
  -- == -- == -- == == == -- -- -- -- --  ---------------  --------------------
  20 00 00 00 01 00 00 0c bc 0f 87 ec 00     04:05:58.159  READ SECTOR(S)
  61 00 00 00 08 00 00 05 5d f0 00 40 00     04:05:27.798  WRITE FPDMA QUEUED
  ea 00 00 00 00 00 00 00 00 00 00 a0 00     04:05:27.772  FLUSH CACHE EXT
  61 00 00 00 08 00 00 08 e1 f0 00 40 00     04:05:27.771  WRITE FPDMA QUEUED
  ea 00 00 00 00 00 00 00 00 00 00 a0 00     04:05:27.740  FLUSH CACHE EXT

Error 8 [7] occurred at disk power-on lifetime: 6532 hours (272 days + 4 hours)
  When the command that caused the error occurred, the device was active or idle.

  After command completion occurred, registers were:
  ER -- ST COUNT  LBA_48  LH LM LL DV DC
  -- -- -- == -- == == == -- -- -- -- --
  40 -- 51 00 00 00 00 0c bc 0f 87 00 00  Error: UNC at LBA = 0x0cbc0f87 = 213651335

  Commands leading to the command that caused the error were:
  CR FEATR COUNT  LBA_48  LH LM LL DV DC  Powered_Up_Time  Command/Feature_Name
  -- == -- == -- == == == -- -- -- -- --  ---------------  --------------------
  20 00 00 00 01 00 00 0c bc 0f 87 ec 00     03:06:12.943  READ SECTOR(S)
  60 00 00 00 08 00 00 0c b1 20 00 40 00     03:06:03.130  READ FPDMA QUEUED
  60 00 00 00 28 00 00 0f 9f 1f c8 40 00     03:06:03.127  READ FPDMA QUEUED
  60 00 00 00 38 00 00 0f 9f 1f 88 40 00     03:06:03.126  READ FPDMA QUEUED
  60 00 00 00 78 00 00 0f 9f 1f 08 40 00     03:06:03.126  READ FPDMA QUEUED

Error 7 [6] occurred at disk power-on lifetime: 6532 hours (272 days + 4 hours)
  When the command that caused the error occurred, the device was active or idle.

  After command completion occurred, registers were:
  ER -- ST COUNT  LBA_48  LH LM LL DV DC
  -- -- -- == -- == == == -- -- -- -- --
  40 -- 51 00 00 00 00 0c bc 0f 87 00 00  Error: UNC at LBA = 0x0cbc0f87 = 213651335

  Commands leading to the command that caused the error were:
  CR FEATR COUNT  LBA_48  LH LM LL DV DC  Powered_Up_Time  Command/Feature_Name
  -- == -- == -- == == == -- -- -- -- --  ---------------  --------------------
  20 00 00 00 01 00 00 0c bc 0f 87 ec 00     03:05:09.367  READ SECTOR(S)
  61 00 00 00 08 00 00 0f 9f 49 b0 40 00     03:03:20.608  WRITE FPDMA QUEUED
  61 00 00 00 08 00 00 0f 9f 44 f8 40 00     03:03:20.608  WRITE FPDMA QUEUED
  61 00 00 00 08 00 00 0f df 30 38 40 00     03:03:20.608  WRITE FPDMA QUEUED
  61 00 00 00 08 00 00 0f 9f 30 08 40 00     03:03:20.608  WRITE FPDMA QUEUED

Error 6 [5] occurred at disk power-on lifetime: 6527 hours (271 days + 23 hours)
  When the command that caused the error occurred, the device was active or idle.

  After command completion occurred, registers were:
  ER -- ST COUNT  LBA_48  LH LM LL DV DC
  -- -- -- == -- == == == -- -- -- -- --
  40 -- 51 00 00 00 00 0c bc 0f 87 00 00  Error: UNC at LBA = 0x0cbc0f87 = 213651335

  Commands leading to the command that caused the error were:
  CR FEATR COUNT  LBA_48  LH LM LL DV DC  Powered_Up_Time  Command/Feature_Name
  -- == -- == -- == == == -- -- -- -- --  ---------------  --------------------
  20 00 00 00 01 00 00 0c bc 0f 87 ec 00     06:11:12.139  READ SECTOR(S)
  27 00 00 00 00 00 00 00 00 00 00 e0 00     06:11:08.234  READ NATIVE MAX ADDRESS EXT [OBS-ACS-3]
  ec 00 00 00 00 00 00 00 00 00 00 a0 00     06:11:08.232  IDENTIFY DEVICE
  ef 00 03 00 46 00 00 00 00 00 00 a0 00     06:11:08.232  SET FEATURES [Set transfer mode]
  27 00 00 00 00 00 00 00 00 00 00 e0 00     06:11:08.210  READ NATIVE MAX ADDRESS EXT [OBS-ACS-3]

Error 5 [4] occurred at disk power-on lifetime: 6527 hours (271 days + 23 hours)
  When the command that caused the error occurred, the device was active or idle.

  After command completion occurred, registers were:
  ER -- ST COUNT  LBA_48  LH LM LL DV DC
  -- -- -- == -- == == == -- -- -- -- --
  40 -- 51 00 00 00 00 0c bc 0f 87 00 00  Error: UNC at LBA = 0x0cbc0f87 = 213651335

  Commands leading to the command that caused the error were:
  CR FEATR COUNT  LBA_48  LH LM LL DV DC  Powered_Up_Time  Command/Feature_Name
  -- == -- == -- == == == -- -- -- -- --  ---------------  --------------------
  20 00 00 00 01 00 00 0c bc 0f 87 ec 00     06:11:05.478  READ SECTOR(S)
  ea 00 00 00 00 00 00 00 00 00 00 a0 00     06:11:03.819  FLUSH CACHE EXT
  61 00 00 00 08 00 00 0f e3 da 80 40 00     06:11:03.819  WRITE FPDMA QUEUED
  ea 00 00 00 00 00 00 00 00 00 00 a0 00     06:11:03.792  FLUSH CACHE EXT
  61 00 00 00 08 00 00 0f e3 da 78 40 00     06:11:03.790  WRITE FPDMA QUEUED

SMART Extended Self-test Log Version: 1 (1 sectors)
Num  Test_Description    Status                  Remaining  LifeTime(hours)  LBA_of_first_error
# 1  Short offline       Completed without error       00%      9111         -
# 2  Short offline       Completed without error       00%      8276         -
# 3  Short offline       Completed without error       00%      8275         -
# 4  Short offline       Aborted by host               90%      7701         -
# 5  Short offline       Completed without error       00%      7699         -
# 6  Short offline       Completed without error       00%      7602         -
# 7  Short offline       Completed without error       00%      7440         -
# 8  Short offline       Completed without error       00%      7193         -
# 9  Short offline       Completed without error       00%      7183         -
#10  Short offline       Completed without error       00%      7178         -
#11  Short offline       Completed without error       00%      7130         -
#12  Short offline       Completed without error       00%      7055         -
#13  Short offline       Completed without error       00%      6832         -
#14  Extended offline    Aborted by host               90%      6738         -
#15  Short offline       Completed without error       00%      6738         -
#16  Short offline       Completed without error       00%      6738         -
#17  Short offline       Completed without error       00%      6701         -
#18  Short offline       Completed without error       00%      6592         -
#19  Short offline       Completed without error       00%      6586         -

SMART Selective self-test log data structure revision number 1
 SPAN  MIN_LBA  MAX_LBA  CURRENT_TEST_STATUS
    1        0        0  Not_testing
    2        0        0  Not_testing
    3        0        0  Not_testing
    4        0        0  Not_testing
    5        0        0  Not_testing
Selective self-test flags (0x0):
  After scanning selected spans, do NOT read-scan remainder of disk.
If Selective self-test is pending on power-up, resume after 0 minute delay.

SCT Status Version:                  3
SCT Version (vendor specific):       522 (0x020a)
Device State:                        Active (0)
Current Temperature:                    36 Celsius
Power Cycle Min/Max Temperature:     20/36 Celsius
Lifetime    Min/Max Temperature:      8/48 Celsius
Specified Max Operating Temperature:    37 Celsius
Under/Over Temperature Limit Count:   0/0

SCT Temperature History Version:     2
Temperature Sampling Period:         1 minute
Temperature Logging Interval:        1 minute
Min/Max recommended Temperature:     14/55 Celsius
Min/Max Temperature Limit:           10/60 Celsius
Temperature History Size (Index):    128 (40)

SCT Error Recovery Control:
           Read: Disabled
          Write: Disabled

Device Statistics (GP/SMART Log 0x04) not supported

Pending Defects log (GP Log 0x0c) not supported

SATA Phy Event Counters (GP Log 0x11)
ID      Size     Value  Description
0x000a  2            6  Device-to-host register FISes sent due to a COMRESET
0x0001  2            0  Command failed due to ICRC error
0x0003  2            0  R_ERR response for device-to-host data FIS
0x0004  2            0  R_ERR response for host-to-device data FIS
0x0006  2            0  R_ERR response for device-to-host non-data FIS
0x0007  2            0  R_ERR response for host-to-device non-data FIS

