smartctl 7.3 2022-02-28 r5338 [x86_64-linux-6.0.9-gentoo-x86_64] (local build)
Copyright (C) 2002-22, Bruce Allen, Christian Franke, www.smartmontools.org

=== START OF INFORMATION SECTION ===
Model Family:     Toshiba N300/MN NAS HDD
Device Model:     TOSHIBA HDWQ140
Serial Number:    --
LU WWN Device Id: 5 000039 ...
Firmware Version: FJ1M
User Capacity:    4,000,787,030,016 bytes [4.00 TB]
Sector Size:      512 bytes logical/physical
Rotation Rate:    7200 rpm
Form Factor:      3.5 inches
Device is:        In smartctl database 7.3/5319
ATA Version is:   ATA8-ACS (minor revision not indicated)
SATA Version is:  SATA 3.0, 6.0 Gb/s (current: 6.0 Gb/s)
Local Time is:    Sat Nov 19 17:44:14 2022 GMT
SMART support is: Available - device has SMART capability.
SMART support is: Enabled
AAM feature is:   Unavailable
APM level is:     128 (minimum power consumption without standby)
Rd look-ahead is: Enabled
Write cache is:   Enabled
DSN feature is:   Unavailable
ATA Security is:  Disabled, frozen [SEC2]
Wt Cache Reorder: Enabled

=== START OF READ SMART DATA SECTION ===
SMART overall-health self-assessment test result: PASSED

General SMART Values:
Offline data collection status:  (0x82)	Offline data collection activity
					was completed without error.
					Auto Offline Data Collection: Enabled.
Self-test execution status:      (  17)	The self-test routine was aborted by
					the host.
Total time to complete Offline 
data collection: 		(  120) seconds.
Offline data collection
capabilities: 			 (0x5b) SMART execute Offline immediate.
					Auto Offline data collection on/off support.
					Suspend Offline collection upon new
					command.
					Offline surface scan supported.
					Self-test supported.
					No Conveyance Self-test supported.
					Selective Self-test supported.
SMART capabilities:            (0x0003)	Saves SMART data before entering
					power-saving mode.
					Supports SMART auto save timer.
Error logging capability:        (0x01)	Error logging supported.
					General Purpose Logging supported.
Short self-test routine 
recommended polling time: 	 (   2) minutes.
Extended self-test routine
recommended polling time: 	 ( 449) minutes.
SCT capabilities: 	       (0x003d)	SCT Status supported.
					SCT Error Recovery Control supported.
					SCT Feature Control supported.
					SCT Data Table supported.

SMART Attributes Data Structure revision number: 16
Vendor Specific SMART Attributes with Thresholds:
ID# ATTRIBUTE_NAME          FLAGS    VALUE WORST THRESH FAIL RAW_VALUE
  1 Raw_Read_Error_Rate     PO-R--   100   100   050    -    0
  2 Throughput_Performance  P-S---   100   100   050    -    0
  3 Spin_Up_Time            POS--K   100   100   001    -    6915
  4 Start_Stop_Count        -O--CK   100   100   000    -    859
  5 Reallocated_Sector_Ct   PO--CK   100   100   050    -    0
  7 Seek_Error_Rate         PO-R--   100   100   050    -    0
  8 Seek_Time_Performance   P-S---   100   100   050    -    0
  9 Power_On_Hours          -O--CK   074   074   000    -    10600
 10 Spin_Retry_Count        PO--CK   117   100   030    -    0
 12 Power_Cycle_Count       -O--CK   100   100   000    -    824
191 G-Sense_Error_Rate      -O--CK   100   100   000    -    5
192 Power-Off_Retract_Count -O--CK   100   100   000    -    62
193 Load_Cycle_Count        -O--CK   100   100   000    -    2514
194 Temperature_Celsius     -O---K   100   100   000    -    36 (Min/Max 15/60)
196 Reallocated_Event_Count -O--CK   100   100   000    -    0
197 Current_Pending_Sector  -O--CK   100   100   000    -    0
198 Offline_Uncorrectable   ----CK   100   100   000    -    0
199 UDMA_CRC_Error_Count    -O--CK   200   253   000    -    179
220 Disk_Shift              -O----   100   100   000    -    0
222 Loaded_Hours            -O--CK   080   080   000    -    8048
223 Load_Retry_Count        -O--CK   100   100   000    -    0
224 Load_Friction           -O---K   100   100   000    -    0
226 Load-in_Time            -OS--K   100   100   000    -    643
240 Head_Flying_Hours       P-----   100   100   001    -    0
                            ||||||_ K auto-keep
                            |||||__ C event count
                            ||||___ R error rate
                            |||____ S speed/performance
                            ||_____ O updated online
                            |______ P prefailure warning

General Purpose Log Directory Version 1
SMART           Log Directory Version 1 [multi-sector log support]
Address    Access  R/W   Size  Description
0x00       GPL,SL  R/O      1  Log Directory
0x01           SL  R/O      1  Summary SMART error log
0x02           SL  R/O     51  Comprehensive SMART error log
0x03       GPL     R/O     64  Ext. Comprehensive SMART error log
0x04       GPL,SL  R/O      8  Device Statistics log
0x06           SL  R/O      1  SMART self-test log
0x07       GPL     R/O      1  Extended self-test log
0x08       GPL     R/O      2  Power Conditions log
0x09           SL  R/W      1  Selective self-test log
0x0c       GPL     R/O   2048  Pending Defects log
0x10       GPL     R/O      1  NCQ Command Error log
0x11       GPL     R/O      1  SATA Phy Event Counters log
0x24       GPL     R/O  12288  Current Device Internal Status Data log
0x30       GPL,SL  R/O      9  IDENTIFY DEVICE data log
0x80-0x9f  GPL,SL  R/W     16  Host vendor specific log
0xa7       GPL     VS       8  Device vendor specific log
0xe0       GPL,SL  R/W      1  SCT Command/Status
0xe1       GPL,SL  R/W      1  SCT Data Transfer

SMART Extended Comprehensive Error Log Version: 1 (64 sectors)
Device Error Count: 179
	CR     = Command Register
	FEATR  = Features Register
	COUNT  = Count (was: Sector Count) Register
	LBA_48 = Upper bytes of LBA High/Mid/Low Registers ]  ATA-8
	LH     = LBA High (was: Cylinder High) Register    ]   LBA
	LM     = LBA Mid (was: Cylinder Low) Register      ] Register
	LL     = LBA Low (was: Sector Number) Register     ]
	DV     = Device (was: Device/Head) Register
	DC     = Device Control Register
	ER     = Error register
	ST     = Status register
Powered_Up_Time is measured from power on, and printed as
DDd+hh:mm:SS.sss where DD=days, hh=hours, mm=minutes,
SS=sec, and sss=millisec. It "wraps" after 49.710 days.

Error 179 [178] occurred at disk power-on lifetime: 1270 hours (52 days + 22 hours)
  When the command that caused the error occurred, the device was active or idle.

  After command completion occurred, registers were:
  ER -- ST COUNT  LBA_48  LH LM LL DV DC
  -- -- -- == -- == == == -- -- -- -- --
  84 -- 50 00 00 00 00 19 65 ba a8 40 00   at LBA = 0x1965baa8 = 426097320

  Commands leading to the command that caused the error were:
  CR FEATR COUNT  LBA_48  LH LM LL DV DC  Powered_Up_Time  Command/Feature_Name
  -- == -- == -- == == == -- -- -- -- --  ---------------  --------------------
  35 00 03 00 01 00 00 19 65 ba a8 40 00     00:56:50.871  WRITE DMA EXT
  ef 00 03 00 45 00 00 00 00 00 00 00 00     00:56:50.870  SET FEATURES [Set transfer mode]
  ef 00 03 00 0c 00 00 00 00 00 00 00 00     00:56:50.870  SET FEATURES [Set transfer mode]
  ec 00 00 00 00 00 00 00 00 00 00 00 00     00:56:50.869  IDENTIFY DEVICE
  aa aa aa aa aa aa aa aa aa aa aa aa ff     00:56:50.859  [RESERVED]

Error 178 [177] occurred at disk power-on lifetime: 1182 hours (49 days + 6 hours)
  When the command that caused the error occurred, the device was active or idle.

  After command completion occurred, registers were:
  ER -- ST COUNT  LBA_48  LH LM LL DV DC
  -- -- -- == -- == == == -- -- -- -- --
  84 -- 50 00 00 00 00 07 a1 89 68 40 00   at LBA = 0x07a18968 = 128026984

  Commands leading to the command that caused the error were:
  CR FEATR COUNT  LBA_48  LH LM LL DV DC  Powered_Up_Time  Command/Feature_Name
  -- == -- == -- == == == -- -- -- -- --  ---------------  --------------------
  35 00 03 00 01 00 00 07 a1 89 68 40 00 45d+15:48:57.008  WRITE DMA EXT
  ef 00 03 00 45 00 00 00 00 00 00 00 00 45d+15:48:57.007  SET FEATURES [Set transfer mode]
  ef 00 03 00 0c 00 00 00 00 00 00 00 00 45d+15:48:57.006  SET FEATURES [Set transfer mode]
  ec 00 00 00 00 00 00 00 00 00 00 00 00 45d+15:48:57.006  IDENTIFY DEVICE
  aa aa aa aa aa aa aa aa aa aa aa aa ff 45d+15:48:56.996  [RESERVED]

Error 177 [176] occurred at disk power-on lifetime: 1179 hours (49 days + 3 hours)
  When the command that caused the error occurred, the device was active or idle.

  After command completion occurred, registers were:
  ER -- ST COUNT  LBA_48  LH LM LL DV DC
  -- -- -- == -- == == == -- -- -- -- --
  84 -- 50 00 00 00 00 07 a1 6d 98 40 00   at LBA = 0x07a16d98 = 128019864

  Commands leading to the command that caused the error were:
  CR FEATR COUNT  LBA_48  LH LM LL DV DC  Powered_Up_Time  Command/Feature_Name
  -- == -- == -- == == == -- -- -- -- --  ---------------  --------------------
  35 00 03 00 01 00 00 07 a1 6d 98 40 00 45d+12:13:51.695  WRITE DMA EXT
  ef 00 03 00 45 00 00 00 00 00 00 00 00 45d+12:13:51.695  SET FEATURES [Set transfer mode]
  ef 00 03 00 0c 00 00 00 00 00 00 00 00 45d+12:13:51.694  SET FEATURES [Set transfer mode]
  ec 00 00 00 00 00 00 00 00 00 00 00 00 45d+12:13:51.694  IDENTIFY DEVICE
  aa aa aa aa aa aa aa aa aa aa aa aa ff 45d+12:13:51.684  [RESERVED]

Error 176 [175] occurred at disk power-on lifetime: 1177 hours (49 days + 1 hours)
  When the command that caused the error occurred, the device was active or idle.

  After command completion occurred, registers were:
  ER -- ST COUNT  LBA_48  LH LM LL DV DC
  -- -- -- == -- == == == -- -- -- -- --
  84 -- 50 00 00 00 00 07 a1 52 e0 40 00   at LBA = 0x07a152e0 = 128013024

  Commands leading to the command that caused the error were:
  CR FEATR COUNT  LBA_48  LH LM LL DV DC  Powered_Up_Time  Command/Feature_Name
  -- == -- == -- == == == -- -- -- -- --  ---------------  --------------------
  35 00 03 00 01 00 00 07 a1 52 e0 40 00 45d+10:24:36.664  WRITE DMA EXT
  ef 00 03 00 45 00 00 00 00 00 00 00 00 45d+10:24:36.664  SET FEATURES [Set transfer mode]
  ef 00 03 00 0c 00 00 00 00 00 00 00 00 45d+10:24:36.663  SET FEATURES [Set transfer mode]
  ec 00 00 00 00 00 00 00 00 00 00 00 00 45d+10:24:36.663  IDENTIFY DEVICE
  aa aa aa aa aa aa aa aa aa aa aa aa ff 45d+10:24:36.653  [RESERVED]

Error 175 [174] occurred at disk power-on lifetime: 1176 hours (49 days + 0 hours)
  When the command that caused the error occurred, the device was active or idle.

  After command completion occurred, registers were:
  ER -- ST COUNT  LBA_48  LH LM LL DV DC
  -- -- -- == -- == == == -- -- -- -- --
  84 -- 50 00 00 00 00 07 a1 4f 78 40 00   at LBA = 0x07a14f78 = 128012152

  Commands leading to the command that caused the error were:
  CR FEATR COUNT  LBA_48  LH LM LL DV DC  Powered_Up_Time  Command/Feature_Name
  -- == -- == -- == == == -- -- -- -- --  ---------------  --------------------
  35 00 03 00 01 00 00 07 a1 4f 78 40 00 45d+09:48:57.957  WRITE DMA EXT
  ef 00 03 00 45 00 00 00 00 00 00 00 00 45d+09:48:57.957  SET FEATURES [Set transfer mode]
  ef 00 03 00 0c 00 00 00 00 00 00 00 00 45d+09:48:57.956  SET FEATURES [Set transfer mode]
  ec 00 00 00 00 00 00 00 00 00 00 00 00 45d+09:48:57.956  IDENTIFY DEVICE
  aa aa aa aa aa aa aa aa aa aa aa aa ff 45d+09:48:57.946  [RESERVED]

Error 174 [173] occurred at disk power-on lifetime: 1176 hours (49 days + 0 hours)
  When the command that caused the error occurred, the device was active or idle.

  After command completion occurred, registers were:
  ER -- ST COUNT  LBA_48  LH LM LL DV DC
  -- -- -- == -- == == == -- -- -- -- --
  84 -- 51 00 00 00 00 07 a1 44 e8 40 00  Error: ICRC, ABRT at LBA = 0x07a144e8 = 128009448

  Commands leading to the command that caused the error were:
  CR FEATR COUNT  LBA_48  LH LM LL DV DC  Powered_Up_Time  Command/Feature_Name
  -- == -- == -- == == == -- -- -- -- --  ---------------  --------------------
  35 00 03 00 01 00 00 07 a1 44 e8 40 00 45d+09:11:28.856  WRITE DMA EXT
  ef 00 03 00 45 00 00 00 00 00 00 00 00 45d+09:11:28.856  SET FEATURES [Set transfer mode]
  ef 00 03 00 0c 00 00 00 00 00 00 00 00 45d+09:11:28.855  SET FEATURES [Set transfer mode]
  ec 00 00 00 00 00 00 00 00 00 00 00 00 45d+09:11:28.855  IDENTIFY DEVICE
  aa aa aa aa aa aa aa aa aa aa aa aa ff 45d+09:11:28.844  [RESERVED]

Error 173 [172] occurred at disk power-on lifetime: 1173 hours (48 days + 21 hours)
  When the command that caused the error occurred, the device was active or idle.

  After command completion occurred, registers were:
  ER -- ST COUNT  LBA_48  LH LM LL DV DC
  -- -- -- == -- == == == -- -- -- -- --
  84 -- 50 00 00 00 00 07 a1 29 d0 40 00   at LBA = 0x07a129d0 = 128002512

  Commands leading to the command that caused the error were:
  CR FEATR COUNT  LBA_48  LH LM LL DV DC  Powered_Up_Time  Command/Feature_Name
  -- == -- == -- == == == -- -- -- -- --  ---------------  --------------------
  35 00 03 00 01 00 00 07 a1 29 d0 40 00 45d+06:31:38.546  WRITE DMA EXT
  ef 00 03 00 45 00 00 00 00 00 00 00 00 45d+06:31:38.546  SET FEATURES [Set transfer mode]
  ef 00 03 00 0c 00 00 00 00 00 00 00 00 45d+06:31:38.545  SET FEATURES [Set transfer mode]
  ec 00 00 00 00 00 00 00 00 00 00 00 00 45d+06:31:38.545  IDENTIFY DEVICE
  aa aa aa aa aa aa aa aa aa aa aa aa ff 45d+06:31:38.535  [RESERVED]

Error 172 [171] occurred at disk power-on lifetime: 1169 hours (48 days + 17 hours)
  When the command that caused the error occurred, the device was active or idle.

  After command completion occurred, registers were:
  ER -- ST COUNT  LBA_48  LH LM LL DV DC
  -- -- -- == -- == == == -- -- -- -- --
  84 -- 50 00 00 00 00 07 a1 01 03 40 00   at LBA = 0x07a10103 = 127992067

  Commands leading to the command that caused the error were:
  CR FEATR COUNT  LBA_48  LH LM LL DV DC  Powered_Up_Time  Command/Feature_Name
  -- == -- == -- == == == -- -- -- -- --  ---------------  --------------------
  35 00 03 00 01 00 00 07 a1 01 03 40 00 45d+03:01:54.084  WRITE DMA EXT
  ef 00 03 00 45 00 00 00 00 00 00 00 00 45d+03:01:54.083  SET FEATURES [Set transfer mode]
  ef 00 03 00 0c 00 00 00 00 00 00 00 00 45d+03:01:54.083  SET FEATURES [Set transfer mode]
  ec 00 00 00 00 00 00 00 00 00 00 00 00 45d+03:01:54.082  IDENTIFY DEVICE
  aa aa aa aa aa aa aa aa aa aa aa aa ff 45d+03:01:54.072  [RESERVED]

SMART Extended Self-test Log Version: 1 (1 sectors)
Num  Test_Description    Status                  Remaining  LifeTime(hours)  LBA_of_first_error
# 1  Extended offline    Aborted by host               10%     10593         -
# 2  Extended offline    Completed without error       00%     10559         -
# 3  Extended offline    Aborted by host               70%     10478         -
# 4  Extended offline    Aborted by host               60%     10409         -
# 5  Extended offline    Completed without error       00%     10337         -
# 6  Extended offline    Aborted by host               60%     10269         -
# 7  Extended offline    Aborted by host               90%     10213         -
# 8  Extended offline    Aborted by host               60%     10163         -
# 9  Extended offline    Completed without error       00%     10109         -
#10  Extended offline    Aborted by host               90%      9979         -
#11  Extended offline    Completed without error       00%      9704         -
#12  Extended offline    Completed without error       00%      9622         -
#13  Extended offline    Aborted by host               90%      9521         -
#14  Extended offline    Completed without error       00%      9435         -
#15  Extended offline    Completed without error       00%      9248         -
#16  Extended offline    Aborted by host               90%      9160         -
#17  Extended offline    Completed without error       00%      8885         -
#18  Extended offline    Aborted by host               90%      8796         -
#19  Extended offline    Completed without error       00%      8704         -

SMART Selective self-test log data structure revision number 1
 SPAN  MIN_LBA  MAX_LBA  CURRENT_TEST_STATUS
    1        0        0  Not_testing
    2        0        0  Not_testing
    3        0        0  Not_testing
    4        0        0  Not_testing
    5        0        0  Not_testing
Selective self-test flags (0x0):
  After scanning selected spans, do NOT read-scan remainder of disk.
If Selective self-test is pending on power-up, resume after 0 minute delay.

SCT Status Version:                  3
SCT Version (vendor specific):       1 (0x0001)
Device State:                        Active (0)
Current Temperature:                    36 Celsius
Power Cycle Min/Max Temperature:     17/36 Celsius
Lifetime    Min/Max Temperature:     15/60 Celsius
Under/Over Temperature Limit Count:   0/2597

SCT Temperature History Version:     2
Temperature Sampling Period:         1 minute
Temperature Logging Interval:        1 minute
Min/Max recommended Temperature:      5/55 Celsius
Min/Max Temperature Limit:            5/55 Celsius
Temperature History Size (Index):    478 (470)

SCT Error Recovery Control:
           Read: Disabled
          Write: Disabled

Device Statistics (GP Log 0x04)
Page  Offset Size        Value Flags Description
0x01  =====  =               =  ===  == General Statistics (rev 2) ==
0x01  0x008  4             824  ---  Lifetime Power-On Resets
0x01  0x010  4           10600  ---  Power-on Hours
0x01  0x018  6     16658282086  ---  Logical Sectors Written
0x01  0x020  6        60000456  ---  Number of Write Commands
0x01  0x028  6     53072741277  ---  Logical Sectors Read
0x01  0x030  6       272164560  ---  Number of Read Commands
0x02  =====  =               =  ===  == Free-Fall Statistics (rev 1) ==
0x02  0x010  4               5  ---  Overlimit Shock Events
0x03  =====  =               =  ===  == Rotating Media Statistics (rev 1) ==
0x03  0x008  4           10576  ---  Spindle Motor Power-on Hours
0x03  0x010  4            8048  ---  Head Flying Hours
0x03  0x018  4            2514  ---  Head Load Events
0x03  0x020  4               0  ---  Number of Reallocated Logical Sectors
0x03  0x028  4               0  ---  Read Recovery Attempts
0x03  0x030  4               0  ---  Number of Mechanical Start Failures
0x04  =====  =               =  ===  == General Errors Statistics (rev 1) ==
0x04  0x008  4               0  ---  Number of Reported Uncorrectable Errors
0x04  0x010  4           30382  ---  Resets Between Cmd Acceptance and Completion
0x05  =====  =               =  ===  == Temperature Statistics (rev 1) ==
0x05  0x008  1              36  ---  Current Temperature
0x05  0x010  1              36  N--  Average Short Term Temperature
0x05  0x018  1              39  N--  Average Long Term Temperature
0x05  0x020  1              60  ---  Highest Temperature
0x05  0x028  1              15  ---  Lowest Temperature
0x05  0x030  1              55  N--  Highest Average Short Term Temperature
0x05  0x038  1              33  N--  Lowest Average Short Term Temperature
0x05  0x040  1              51  N--  Highest Average Long Term Temperature
0x05  0x048  1              34  N--  Lowest Average Long Term Temperature
0x05  0x050  4           10217  ---  Time in Over-Temperature
0x05  0x058  1              55  ---  Specified Maximum Operating Temperature
0x05  0x060  4               0  ---  Time in Under-Temperature
0x05  0x068  1               5  ---  Specified Minimum Operating Temperature
0x06  =====  =               =  ===  == Transport Statistics (rev 1) ==
0x06  0x008  4           70981  ---  Number of Hardware Resets
0x06  0x018  4             179  ---  Number of Interface CRC Errors
0x07  =====  =               =  ===  == Solid State Device Statistics (rev 1) ==
                                |||_ C monitored condition met
                                ||__ D supports DSN
                                |___ N normalized value

Pending Defects log (GP Log 0x0c)
No Defects Logged

SATA Phy Event Counters (GP Log 0x11)
ID      Size     Value  Description
0x0001  4            0  Command failed due to ICRC error
0x0002  4            0  R_ERR response for data FIS
0x0003  4            0  R_ERR response for device-to-host data FIS
0x0004  4            0  R_ERR response for host-to-device data FIS
0x0005  4            0  R_ERR response for non-data FIS
0x0006  4            0  R_ERR response for device-to-host non-data FIS
0x0007  4            0  R_ERR response for host-to-device non-data FIS
0x0008  4            0  Device-to-host non-data FIS retries
0x0009  4        11985  Transition from drive PhyRdy to drive PhyNRdy
0x000a  4            6  Device-to-host register FISes sent due to a COMRESET
0x000b  4            0  CRC errors within host-to-device FIS
0x000d  4            0  Non-CRC errors within host-to-device FIS
0x000f  4            0  R_ERR response for host-to-device data FIS, CRC
0x0010  4            0  R_ERR response for host-to-device data FIS, non-CRC
0x0012  4            0  R_ERR response for host-to-device non-data FIS, CRC
0x0013  4            0  R_ERR response for host-to-device non-data FIS, non-CRC



