smartctl 7.1 2019-12-30 r5022 [x86_64-linux-5.4.0-94-generic] (local build)
Copyright (C) 2002-19, Bruce Allen, Christian Franke, www.smartmontools.org

=== START OF INFORMATION SECTION ===
Model Number:                       WDC WDS500G1B0C-00S6U0
Serial Number:                      --
Firmware Version:                   201000WD
PCI Vendor/Subsystem ID:            0x15b7
IEEE OUI Identifier:                0x001b44
Total NVM Capacity:                 500,107,862,016 [500 GB]
Unallocated NVM Capacity:           0
Controller ID:                      1
Number of Namespaces:               1
Namespace 1 Size/Capacity:          500,107,862,016 [500 GB]
Namespace 1 Formatted LBA Size:     512
Namespace 1 IEEE EUI-64:            001b44 ...
Local Time is:                      Fri Jan 14 15:24:58 2022 GMT
Firmware Updates (0x14):            2 Slots, no Reset required
Optional Admin Commands (0x0017):   Security Format Frmw_DL Self_Test
Optional NVM Commands (0x001f):     Comp Wr_Unc DS_Mngmt Wr_Zero Sav/Sel_Feat
Maximum Data Transfer Size:         128 Pages
Warning  Comp. Temp. Threshold:     82 Celsius
Critical Comp. Temp. Threshold:     86 Celsius
Namespace 1 Features (0x02):        NA_Fields

Supported Power States
St Op     Max   Active     Idle   RL RT WL WT  Ent_Lat  Ex_Lat
 0 +     2.60W       -        -    0  0  0  0        0       0
 1 +     2.60W       -        -    1  1  1  1        0       0
 2 +     1.70W       -        -    2  2  2  2        0       0
 3 -   0.0250W       -        -    3  3  3  3     5000    9000
 4 -   0.0025W       -        -    4  4  4  4     5000   44000

Supported LBA Sizes (NSID 0x1)
Id Fmt  Data  Metadt  Rel_Perf
 0 +     512       0         2
 1 -    4096       0         1

=== START OF SMART DATA SECTION ===
SMART overall-health self-assessment test result: PASSED

SMART/Health Information (NVMe Log 0x02)
Critical Warning:                   0x00
Temperature:                        38 Celsius
Available Spare:                    100%
Available Spare Threshold:          10%
Percentage Used:                    1%
Data Units Read:                    3,736,870 [1.91 TB]
Data Units Written:                 11,783,853 [6.03 TB]
Host Read Commands:                 41,518,572
Host Write Commands:                165,837,132
Controller Busy Time:               201
Power Cycles:                       517
Power On Hours:                     3,521
Unsafe Shutdowns:                   32
Media and Data Integrity Errors:    0
Error Information Log Entries:      0
Warning  Comp. Temperature Time:    0
Critical Comp. Temperature Time:    0

Error Information (NVMe Log 0x01, max 256 entries)
No Errors Logged



