smartctl 7.2 2020-12-30 r5155 [x86_64-linux-5.10.14-desktop-1omv4002] (OpenMandriva Lx 7.2-2)
Copyright (C) 2002-20, Bruce Allen, Christian Franke, www.smartmontools.org

=== START OF INFORMATION SECTION ===
Model Family:     Maxtor DiamondMax Plus 9
Device Model:     Maxtor 6Y080L0
Serial Number:    --
Firmware Version: YAR41BW0
User Capacity:    81,963,220,480 bytes [81.9 GB]
Sector Size:      512 bytes logical/physical
Device is:        In smartctl database [for details use: -P show]
ATA Version is:   ATA/ATAPI-7 T13/1532D revision 0
Local Time is:    Thu Mar  4 18:10:26 2021 UTC
SMART support is: Available - device has SMART capability.
SMART support is: Enabled
AAM feature is:   Disabled
APM feature is:   Disabled
Rd look-ahead is: Enabled
Write cache is:   Enabled
DSN feature is:   Unavailable
ATA Security is:  Disabled, frozen [SEC2]
Wt Cache Reorder: Unavailable

=== START OF READ SMART DATA SECTION ===
SMART overall-health self-assessment test result: PASSED

General SMART Values:
Offline data collection status:  (0x82)	Offline data collection activity
					was completed without error.
					Auto Offline Data Collection: Enabled.
Self-test execution status:      ( 118)	The previous self-test completed having
					the read element of the test failed.
Total time to complete Offline 
data collection: 		(  241) seconds.
Offline data collection
capabilities: 			 (0x5b) SMART execute Offline immediate.
					Auto Offline data collection on/off support.
					Suspend Offline collection upon new
					command.
					Offline surface scan supported.
					Self-test supported.
					No Conveyance Self-test supported.
					Selective Self-test supported.
SMART capabilities:            (0x0003)	Saves SMART data before entering
					power-saving mode.
					Supports SMART auto save timer.
Error logging capability:        (0x01)	Error logging supported.
					No General Purpose Logging support.
Short self-test routine 
recommended polling time: 	 (   2) minutes.
Extended self-test routine
recommended polling time: 	 (  37) minutes.

SMART Attributes Data Structure revision number: 16
Vendor Specific SMART Attributes with Thresholds:
ID# ATTRIBUTE_NAME          FLAGS    VALUE WORST THRESH FAIL RAW_VALUE
  3 Spin_Up_Time            POS--K   224   223   063    -    9406
  4 Start_Stop_Count        -O--CK   240   240   000    -    25990
  5 Reallocated_Sector_Ct   PO--CK   253   252   063    -    8
  6 Read_Channel_Margin     P-----   253   253   100    -    0
  7 Seek_Error_Rate         -O-R--   253   248   000    -    0
  8 Seek_Time_Performance   POS--K   253   240   187    -    48396
  9 Power_On_Minutes        -O--CK   143   143   000    -    31h+11m
 10 Spin_Retry_Count        PO-R-K   253   252   157    -    0
 11 Calibration_Retry_Count PO-R-K   253   252   223    -    0
 12 Power_Cycle_Count       -O--CK   223   223   000    -    11916
192 Power-Off_Retract_Count -O--CK   253   253   000    -    0
193 Load_Cycle_Count        -O--CK   253   253   000    -    0
194 Temperature_Celsius     -O--CK   253   253   000    -    35
195 Hardware_ECC_Recovered  -O-R--   253   252   000    -    7285
196 Reallocated_Event_Count ---R--   247   247   000    -    6
197 Current_Pending_Sector  ---R--   253   253   000    -    0
198 Offline_Uncorrectable   ---R--   252   248   000    -    1
199 UDMA_CRC_Error_Count    ---R--   197   196   000    -    3
200 Multi_Zone_Error_Rate   -O-R--   253   252   000    -    0
201 Soft_Read_Error_Rate    -O-R--   253   240   000    -    126
202 Data_Address_Mark_Errs  -O-R--   253   251   000    -    0
203 Run_Out_Cancel          PO-R--   253   252   180    -    133
204 Soft_ECC_Correction     -O-R--   253   252   000    -    0
205 Thermal_Asperity_Rate   -O-R--   253   252   000    -    0
207 Spin_High_Current       -O-R-K   253   252   000    -    0
208 Spin_Buzz               -O-R-K   253   252   000    -    0
209 Offline_Seek_Performnce --S--K   187   187   000    -    0
 99 Unknown_Attribute       --S---   253   253   000    -    0
100 Unknown_Attribute       --S---   253   253   000    -    0
101 Unknown_Attribute       --S---   253   253   000    -    0
                            ||||||_ K auto-keep
                            |||||__ C event count
                            ||||___ R error rate
                            |||____ S speed/performance
                            ||_____ O updated online
                            |______ P prefailure warning

Read SMART Log Directory failed: scsi error badly formed scsi parameters

General Purpose Log Directory not supported

SMART Extended Comprehensive Error Log (GP Log 0x03) not supported

SMART Error Log Version: 1
Warning: ATA error count 8369 inconsistent with error log pointer 5

ATA Error Count: 8369 (device log contains only the most recent five errors)
	CR = Command Register [HEX]
	FR = Features Register [HEX]
	SC = Sector Count Register [HEX]
	SN = Sector Number Register [HEX]
	CL = Cylinder Low Register [HEX]
	CH = Cylinder High Register [HEX]
	DH = Device/Head Register [HEX]
	DC = Device Command Register [HEX]
	ER = Error register [HEX]
	ST = Status register [HEX]
Powered_Up_Time is measured from power on, and printed as
DDd+hh:mm:SS.sss where DD=days, hh=hours, mm=minutes,
SS=sec, and sss=millisec. It "wraps" after 49.710 days.

Error 8369 occurred at disk power-on lifetime: 33021 hours (1375 days + 21 hours)
  When the command that caused the error occurred, the device was in an unknown state.

  After command completion occurred, registers were:
  ER ST SC SN CL CH DH
  -- -- -- -- -- -- --
  84 51 00 77 fd cc e4  Error: ICRC, ABRT at LBA = 0x04ccfd77 = 80543095

  Commands leading to the command that caused the error were:
  CR FR SC SN CL CH DH DC   Powered_Up_Time  Command/Feature_Name
  -- -- -- -- -- -- -- --  ----------------  --------------------
  c8 00 08 77 fd cc e4 08      11:05:04.064  READ DMA
  c8 00 08 67 fd cc e4 08      11:05:04.048  READ DMA
  c8 00 08 c7 1e cf e4 08      11:05:04.048  READ DMA
  c8 00 08 4f f5 cc e4 08      11:05:04.048  READ DMA
  c8 00 08 6f 0f cd e4 08      11:05:04.032  READ DMA

Error 8368 occurred at disk power-on lifetime: 32746 hours (1364 days + 10 hours)
  When the command that caused the error occurred, the device was in an unknown state.

  After command completion occurred, registers were:
  ER ST SC SN CL CH DH
  -- -- -- -- -- -- --
  84 51 80 97 06 c1 e4  Error: ICRC, ABRT at LBA = 0x04c10697 = 79758999

  Commands leading to the command that caused the error were:
  CR FR SC SN CL CH DH DC   Powered_Up_Time  Command/Feature_Name
  -- -- -- -- -- -- -- --  ----------------  --------------------
  ca 00 80 97 06 c1 e4 08      02:46:04.352  WRITE DMA
  ca 00 08 8f 06 c1 e4 08      02:46:01.920  WRITE DMA
  ca 00 08 77 08 c1 e4 08      02:46:01.920  WRITE DMA
  e5 00 00 00 00 00 00 08      02:46:01.920  CHECK POWER MODE
  c8 00 08 af 11 bd e4 08      02:41:05.008  READ DMA

Error 8367 occurred at disk power-on lifetime: 32396 hours (1349 days + 20 hours)
  When the command that caused the error occurred, the device was in an unknown state.

  After command completion occurred, registers were:
  ER ST SC SN CL CH DH
  -- -- -- -- -- -- --
  84 51 00 9f f5 c2 e4  Error: ICRC, ABRT at LBA = 0x04c2f59f = 79885727

  Commands leading to the command that caused the error were:
  CR FR SC SN CL CH DH DC   Powered_Up_Time  Command/Feature_Name
  -- -- -- -- -- -- -- --  ----------------  --------------------
  c8 00 00 9f f5 c2 e4 08      00:03:40.672  READ DMA
  c8 00 f8 9f f4 c2 e4 08      00:03:40.672  READ DMA
  c8 00 00 9f f3 c2 e4 08      00:03:40.672  READ DMA
  c8 00 00 9f f2 c2 e4 08      00:03:40.672  READ DMA
  c8 00 00 9f f1 c2 e4 08      00:03:40.656  READ DMA

Error 8366 occurred at disk power-on lifetime: 32213 hours (1342 days + 5 hours)
  When the command that caused the error occurred, the device was in an unknown state.

  After command completion occurred, registers were:
  ER ST SC SN CL CH DH
  -- -- -- -- -- -- --
  84 51 00 9f 9d cc e4  Error: ICRC, ABRT at LBA = 0x04cc9d9f = 80518559

  Commands leading to the command that caused the error were:
  CR FR SC SN CL CH DH DC   Powered_Up_Time  Command/Feature_Name
  -- -- -- -- -- -- -- --  ----------------  --------------------
  c8 00 00 9f 9d cc e4 08      00:03:50.592  READ DMA
  c8 00 00 9f 9c cc e4 08      00:03:50.592  READ DMA
  c8 00 00 9f 9b cc e4 08      00:03:50.592  READ DMA
  c8 00 00 9f 9a cc e4 08      00:03:50.576  READ DMA
  c8 00 00 9f 99 cc e4 08      00:03:50.576  READ DMA

Error 8365 occurred at disk power-on lifetime: 32213 hours (1342 days + 5 hours)
  When the command that caused the error occurred, the device was in an unknown state.

  After command completion occurred, registers were:
  ER ST SC SN CL CH DH
  -- -- -- -- -- -- --
  84 51 00 9f 06 ca e4  Error: ICRC, ABRT at LBA = 0x04ca069f = 80348831

  Commands leading to the command that caused the error were:
  CR FR SC SN CL CH DH DC   Powered_Up_Time  Command/Feature_Name
  -- -- -- -- -- -- -- --  ----------------  --------------------
  c8 00 f8 9f 06 ca e4 08      00:03:49.088  READ DMA
  f8 00 00 00 00 00 e0 08      00:03:49.088  READ NATIVE MAX ADDRESS [OBS-ACS-3]
  ec 00 00 00 00 00 a0 0a      00:03:49.072  IDENTIFY DEVICE
  ef 03 45 00 00 00 a0 0a      00:03:49.072  SET FEATURES [Set transfer mode]
  f8 00 00 00 00 00 e0 08      00:03:49.072  READ NATIVE MAX ADDRESS [OBS-ACS-3]

SMART Extended Self-test Log (GP Log 0x07) not supported

SMART Self-test log structure revision number 1
Num  Test_Description    Status                  Remaining  LifeTime(hours)  LBA_of_first_error
# 1  Short offline       Completed: read failure       60%      8958         6354683
# 2  Short offline       Completed: read failure       60%      8958         6354683
# 3  Short offline       Completed: read failure       60%      8958         6354683

SMART Selective self-test log data structure revision number 1
 SPAN  MIN_LBA  MAX_LBA  CURRENT_TEST_STATUS
    1        0        0  Not_testing
    2        0        0  Not_testing
    3        0        0  Not_testing
    4        0        0  Not_testing
    5        0        0  Not_testing
Selective self-test flags (0x0):
  After scanning selected spans, do NOT read-scan remainder of disk.
If Selective self-test is pending on power-up, resume after 0 minute delay.

SCT Commands not supported

Device Statistics (GP/SMART Log 0x04) not supported

Pending Defects log (GP Log 0x0c) not supported

SATA Phy Event Counters (GP Log 0x11) not supported



