smartctl 7.3 2022-02-28 r5338 [x86_64-linux-6.1.1-desktop-1omv2290] (OpenMandriva Lx 7.3-2)
Copyright (C) 2002-22, Bruce Allen, Christian Franke, www.smartmontools.org

=== START OF INFORMATION SECTION ===
Model Family:     Seagate Barracuda 7200.14 (AF)
Device Model:     ST500DM002-1BD142
Serial Number:    --
LU WWN Device Id: 5 000c50 ...
Firmware Version: KC47
User Capacity:    500,107,862,016 bytes [500 GB]
Sector Sizes:     512 bytes logical, 4096 bytes physical
Rotation Rate:    7200 rpm
Device is:        In smartctl database
ATA Version is:   ATA8-ACS T13/1699-D revision 4
SATA Version is:  SATA 3.0, 6.0 Gb/s (current: 6.0 Gb/s)
Local Time is:    Wed Jan 11 23:57:53 2023 GMT
SMART support is: Available - device has SMART capability.
SMART support is: Enabled
AAM level is:     208 (intermediate), recommended: 208
APM feature is:   Unavailable
Rd look-ahead is: Enabled
Write cache is:   Enabled
DSN feature is:   Unavailable
ATA Security is:  Disabled, frozen [SEC2]
Wt Cache Reorder: Enabled

=== START OF READ SMART DATA SECTION ===
SMART overall-health self-assessment test result: PASSED

General SMART Values:
Offline data collection status:  (0x82)	Offline data collection activity
					was completed without error.
					Auto Offline Data Collection: Enabled.
Self-test execution status:      (   0)	The previous self-test routine completed
					without error or no self-test has ever 
					been run.
Total time to complete Offline 
data collection: 		(  592) seconds.
Offline data collection
capabilities: 			 (0x7b) SMART execute Offline immediate.
					Auto Offline data collection on/off support.
					Suspend Offline collection upon new
					command.
					Offline surface scan supported.
					Self-test supported.
					Conveyance Self-test supported.
					Selective Self-test supported.
SMART capabilities:            (0x0003)	Saves SMART data before entering
					power-saving mode.
					Supports SMART auto save timer.
Error logging capability:        (0x01)	Error logging supported.
					General Purpose Logging supported.
Short self-test routine 
recommended polling time: 	 (   1) minutes.
Extended self-test routine
recommended polling time: 	 (  78) minutes.
Conveyance self-test routine
recommended polling time: 	 (   2) minutes.
SCT capabilities: 	       (0x303f)	SCT Status supported.
					SCT Error Recovery Control supported.
					SCT Feature Control supported.
					SCT Data Table supported.

SMART Attributes Data Structure revision number: 10
Vendor Specific SMART Attributes with Thresholds:
ID# ATTRIBUTE_NAME          FLAGS    VALUE WORST THRESH FAIL RAW_VALUE
  1 Raw_Read_Error_Rate     POSR--   105   086   006    -    7568616
  3 Spin_Up_Time            PO----   100   097   000    -    0
  4 Start_Stop_Count        -O--CK   094   094   020    -    6733
  5 Reallocated_Sector_Ct   PO--CK   100   100   036    -    0
  7 Seek_Error_Rate         POSR--   083   060   030    -    13688294628
  9 Power_On_Hours          -O--CK   065   065   000    -    30958
 10 Spin_Retry_Count        PO--C-   100   100   097    -    0
 12 Power_Cycle_Count       -O--CK   096   096   020    -    5102
183 Runtime_Bad_Block       -O--CK   098   098   000    -    2
184 End-to-End_Error        -O--CK   100   100   099    -    0
187 Reported_Uncorrect      -O--CK   001   001   000    -    408
188 Command_Timeout         -O--CK   100   098   000    -    20 20 148
189 High_Fly_Writes         -O-RCK   096   096   000    -    4
190 Airflow_Temperature_Cel -O---K   067   054   045    -    33 (Min/Max 23/37)
194 Temperature_Celsius     -O---K   033   046   000    -    33 (0 10 0 0 0)
195 Hardware_ECC_Recovered  -O-RC-   047   022   000    -    7568616
197 Current_Pending_Sector  -O--C-   100   100   000    -    8
198 Offline_Uncorrectable   ----C-   100   100   000    -    8
199 UDMA_CRC_Error_Count    -OSRCK   200   116   000    -    28605
240 Head_Flying_Hours       ------   100   253   000    -    30998h+20m+49.255s
241 Total_LBAs_Written      ------   100   253   000    -    3694449961
242 Total_LBAs_Read         ------   100   253   000    -    221883846
                            ||||||_ K auto-keep
                            |||||__ C event count
                            ||||___ R error rate
                            |||____ S speed/performance
                            ||_____ O updated online
                            |______ P prefailure warning

General Purpose Log Directory Version 1
SMART           Log Directory Version 1 [multi-sector log support]
Address    Access  R/W   Size  Description
0x00       GPL,SL  R/O      1  Log Directory
0x01           SL  R/O      1  Summary SMART error log
0x02           SL  R/O      5  Comprehensive SMART error log
0x03       GPL     R/O      5  Ext. Comprehensive SMART error log
0x06           SL  R/O      1  SMART self-test log
0x07       GPL     R/O      1  Extended self-test log
0x09           SL  R/W      1  Selective self-test log
0x10       GPL     R/O      1  NCQ Command Error log
0x11       GPL     R/O      1  SATA Phy Event Counters log
0x21       GPL     R/O      1  Write stream error log
0x22       GPL     R/O      1  Read stream error log
0x80-0x9f  GPL,SL  R/W     16  Host vendor specific log
0xa1       GPL,SL  VS      20  Device vendor specific log
0xa2       GPL     VS    2248  Device vendor specific log
0xa8       GPL,SL  VS     129  Device vendor specific log
0xa9       GPL,SL  VS       1  Device vendor specific log
0xab       GPL     VS       1  Device vendor specific log
0xb0       GPL     VS    2928  Device vendor specific log
0xbd       GPL     VS     252  Device vendor specific log
0xbe-0xbf  GPL     VS   65535  Device vendor specific log
0xc0       GPL,SL  VS       1  Device vendor specific log
0xe0       GPL,SL  R/W      1  SCT Command/Status
0xe1       GPL,SL  R/W      1  SCT Data Transfer

SMART Extended Comprehensive Error Log Version: 1 (5 sectors)
Device Error Count: 251 (device log contains only the most recent 20 errors)
	CR     = Command Register
	FEATR  = Features Register
	COUNT  = Count (was: Sector Count) Register
	LBA_48 = Upper bytes of LBA High/Mid/Low Registers ]  ATA-8
	LH     = LBA High (was: Cylinder High) Register    ]   LBA
	LM     = LBA Mid (was: Cylinder Low) Register      ] Register
	LL     = LBA Low (was: Sector Number) Register     ]
	DV     = Device (was: Device/Head) Register
	DC     = Device Control Register
	ER     = Error register
	ST     = Status register
Powered_Up_Time is measured from power on, and printed as
DDd+hh:mm:SS.sss where DD=days, hh=hours, mm=minutes,
SS=sec, and sss=millisec. It "wraps" after 49.710 days.

Error 251 [10] occurred at disk power-on lifetime: 28143 hours (1172 days + 15 hours)
  When the command that caused the error occurred, the device was active or idle.

  After command completion occurred, registers were:
  ER -- ST COUNT  LBA_48  LH LM LL DV DC
  -- -- -- == -- == == == -- -- -- -- --
  40 -- 51 00 00 00 00 26 ad 32 28 00 00  Error: UNC at LBA = 0x26ad3228 = 648884776

  Commands leading to the command that caused the error were:
  CR FEATR COUNT  LBA_48  LH LM LL DV DC  Powered_Up_Time  Command/Feature_Name
  -- == -- == -- == == == -- -- -- -- --  ---------------  --------------------
  60 00 00 00 08 00 00 26 ad 32 28 40 00     04:22:50.161  READ FPDMA QUEUED
  61 00 00 00 08 00 00 26 ad 32 20 40 00     04:22:50.160  WRITE FPDMA QUEUED
  60 00 00 00 08 00 00 26 ad 32 20 40 00     04:22:50.160  READ FPDMA QUEUED
  61 00 00 00 08 00 00 26 ad 32 20 40 00     04:22:50.160  WRITE FPDMA QUEUED
  60 00 00 00 08 00 00 26 ad 32 20 40 00     04:22:50.159  READ FPDMA QUEUED

Error 250 [9] occurred at disk power-on lifetime: 28143 hours (1172 days + 15 hours)
  When the command that caused the error occurred, the device was active or idle.

  After command completion occurred, registers were:
  ER -- ST COUNT  LBA_48  LH LM LL DV DC
  -- -- -- == -- == == == -- -- -- -- --
  40 -- 51 00 00 00 00 26 ad 32 28 00 00  Error: UNC at LBA = 0x26ad3228 = 648884776

  Commands leading to the command that caused the error were:
  CR FEATR COUNT  LBA_48  LH LM LL DV DC  Powered_Up_Time  Command/Feature_Name
  -- == -- == -- == == == -- -- -- -- --  ---------------  --------------------
  60 00 00 02 00 00 00 26 ad 32 00 40 00     04:22:46.229  READ FPDMA QUEUED
  61 00 00 02 00 00 00 26 ad 30 00 40 00     04:22:46.227  WRITE FPDMA QUEUED
  60 00 00 02 00 00 00 26 ad 30 00 40 00     04:22:46.225  READ FPDMA QUEUED
  61 00 00 02 00 00 00 26 ad 30 00 40 00     04:22:46.224  WRITE FPDMA QUEUED
  60 00 00 02 00 00 00 26 ad 30 00 40 00     04:22:46.218  READ FPDMA QUEUED

Error 249 [8] occurred at disk power-on lifetime: 28115 hours (1171 days + 11 hours)
  When the command that caused the error occurred, the device was active or idle.

  After command completion occurred, registers were:
  ER -- ST COUNT  LBA_48  LH LM LL DV DC
  -- -- -- == -- == == == -- -- -- -- --
  40 -- 51 00 00 00 00 26 ad 32 28 00 00  Error: UNC at LBA = 0x26ad3228 = 648884776

  Commands leading to the command that caused the error were:
  CR FEATR COUNT  LBA_48  LH LM LL DV DC  Powered_Up_Time  Command/Feature_Name
  -- == -- == -- == == == -- -- -- -- --  ---------------  --------------------
  60 00 00 00 08 00 00 26 ad 32 28 40 00     01:34:40.505  READ FPDMA QUEUED
  60 00 00 00 08 00 00 26 ad 32 20 40 00     01:34:40.505  READ FPDMA QUEUED
  60 00 00 00 08 00 00 26 ad 32 18 40 00     01:34:40.504  READ FPDMA QUEUED
  60 00 00 00 08 00 00 26 ad 32 08 40 00     01:34:40.496  READ FPDMA QUEUED
  60 00 00 00 08 00 00 26 ad 32 00 40 00     01:34:40.477  READ FPDMA QUEUED

Error 248 [7] occurred at disk power-on lifetime: 28115 hours (1171 days + 11 hours)
  When the command that caused the error occurred, the device was active or idle.

  After command completion occurred, registers were:
  ER -- ST COUNT  LBA_48  LH LM LL DV DC
  -- -- -- == -- == == == -- -- -- -- --
  40 -- 51 00 00 00 00 26 ad 32 28 00 00  Error: UNC at LBA = 0x26ad3228 = 648884776

  Commands leading to the command that caused the error were:
  CR FEATR COUNT  LBA_48  LH LM LL DV DC  Powered_Up_Time  Command/Feature_Name
  -- == -- == -- == == == -- -- -- -- --  ---------------  --------------------
  60 00 00 02 00 00 00 26 a7 cc 00 40 00     01:34:35.006  READ FPDMA QUEUED
  60 00 00 02 00 00 00 26 a7 ca 00 40 00     01:34:34.996  READ FPDMA QUEUED
  60 00 00 02 00 00 00 26 97 d8 00 40 00     01:34:30.216  READ FPDMA QUEUED
  60 00 00 02 00 00 00 26 97 d6 00 40 00     01:34:30.205  READ FPDMA QUEUED
  60 00 00 02 00 00 00 26 87 e4 00 40 00     01:34:25.443  READ FPDMA QUEUED

Error 247 [6] occurred at disk power-on lifetime: 27722 hours (1155 days + 2 hours)
  When the command that caused the error occurred, the device was active or idle.

  After command completion occurred, registers were:
  ER -- ST COUNT  LBA_48  LH LM LL DV DC
  -- -- -- == -- == == == -- -- -- -- --
  40 -- 51 00 00 00 00 26 ad 32 28 00 00  Error: UNC at LBA = 0x26ad3228 = 648884776

  Commands leading to the command that caused the error were:
  CR FEATR COUNT  LBA_48  LH LM LL DV DC  Powered_Up_Time  Command/Feature_Name
  -- == -- == -- == == == -- -- -- -- --  ---------------  --------------------
  60 00 00 00 08 00 00 26 ad 32 28 40 00     02:26:53.807  READ FPDMA QUEUED
  60 00 00 00 08 00 00 26 ad 32 20 40 00     02:26:53.806  READ FPDMA QUEUED
  60 00 00 00 08 00 00 26 ad 32 18 40 00     02:26:53.806  READ FPDMA QUEUED
  60 00 00 00 08 00 00 26 ad 32 10 40 00     02:26:53.806  READ FPDMA QUEUED
  ea 00 00 00 00 00 00 00 00 00 00 a0 00     02:26:53.774  FLUSH CACHE EXT

Error 246 [5] occurred at disk power-on lifetime: 27722 hours (1155 days + 2 hours)
  When the command that caused the error occurred, the device was active or idle.

  After command completion occurred, registers were:
  ER -- ST COUNT  LBA_48  LH LM LL DV DC
  -- -- -- == -- == == == -- -- -- -- --
  40 -- 51 00 00 00 00 26 ad 32 28 00 00  Error: UNC at LBA = 0x26ad3228 = 648884776

  Commands leading to the command that caused the error were:
  CR FEATR COUNT  LBA_48  LH LM LL DV DC  Powered_Up_Time  Command/Feature_Name
  -- == -- == -- == == == -- -- -- -- --  ---------------  --------------------
  60 00 00 02 00 00 00 26 aa 5e 00 40 00     02:26:48.916  READ FPDMA QUEUED
  61 00 00 02 b8 00 00 39 96 a8 60 40 00     02:26:48.911  WRITE FPDMA QUEUED
  61 00 00 00 30 00 00 39 96 77 d0 40 00     02:26:48.911  WRITE FPDMA QUEUED
  61 00 00 00 68 00 00 39 7b 0e e0 40 00     02:26:48.911  WRITE FPDMA QUEUED
  61 00 00 00 28 00 00 39 6e f6 a0 40 00     02:26:48.910  WRITE FPDMA QUEUED

Error 245 [4] occurred at disk power-on lifetime: 23568 hours (982 days + 0 hours)
  When the command that caused the error occurred, the device was active or idle.

  After command completion occurred, registers were:
  ER -- ST COUNT  LBA_48  LH LM LL DV DC
  -- -- -- == -- == == == -- -- -- -- --
  40 -- 51 00 00 00 00 04 e6 95 68 00 00  Error: UNC at LBA = 0x04e69568 = 82220392

  Commands leading to the command that caused the error were:
  CR FEATR COUNT  LBA_48  LH LM LL DV DC  Powered_Up_Time  Command/Feature_Name
  -- == -- == -- == == == -- -- -- -- --  ---------------  --------------------
  25 00 00 00 20 00 00 04 e6 95 50 e0 00     01:37:15.130  READ DMA EXT
  35 00 00 00 18 00 00 00 9b 06 f0 e0 00     01:37:15.129  WRITE DMA EXT
  25 00 00 00 18 00 00 00 87 33 c8 e0 00     01:37:15.114  READ DMA EXT
  35 00 00 00 08 00 00 00 6f c1 a0 e0 00     01:37:15.113  WRITE DMA EXT
  ea 00 00 00 00 8c 58 5f 00 00 00 a0 00     01:37:14.976  FLUSH CACHE EXT

Error 244 [3] occurred at disk power-on lifetime: 23568 hours (982 days + 0 hours)
  When the command that caused the error occurred, the device was active or idle.

  After command completion occurred, registers were:
  ER -- ST COUNT  LBA_48  LH LM LL DV DC
  -- -- -- == -- == == == -- -- -- -- --
  40 -- 51 00 00 00 00 04 e6 95 68 00 00  Error: UNC at LBA = 0x04e69568 = 82220392

  Commands leading to the command that caused the error were:
  CR FEATR COUNT  LBA_48  LH LM LL DV DC  Powered_Up_Time  Command/Feature_Name
  -- == -- == -- == == == -- -- -- -- --  ---------------  --------------------
  25 00 00 00 20 00 00 04 e6 95 50 e0 00     01:37:11.293  READ DMA EXT
  35 00 00 00 40 00 00 00 ae dc 68 e0 00     01:37:11.292  WRITE DMA EXT
  35 00 00 00 50 00 00 00 9b 06 a0 e0 00     01:37:11.292  WRITE DMA EXT
  25 00 00 00 10 00 00 00 87 33 d8 e0 00     01:37:11.213  READ DMA EXT
  35 00 00 00 08 00 00 00 6b 76 d0 e0 00     01:37:11.212  WRITE DMA EXT

SMART Extended Self-test Log Version: 1 (1 sectors)
Num  Test_Description    Status                  Remaining  LifeTime(hours)  LBA_of_first_error
# 1  Short offline       Completed without error       00%     27995         -
# 2  Short offline       Completed without error       00%     26466         -
# 3  Short offline       Completed without error       00%     22952         -
# 4  Short offline       Completed without error       00%     18213         -
# 5  Short offline       Completed without error       00%     11609         -
# 6  Short offline       Completed without error       00%      7509         -
# 7  Extended offline    Aborted by host               90%      7509         -
# 8  Short offline       Completed without error       00%      6511         -
# 9  Short offline       Completed without error       00%      5888         -
#10  Short offline       Completed without error       00%      2349         -

SMART Selective self-test log data structure revision number 1
 SPAN  MIN_LBA  MAX_LBA  CURRENT_TEST_STATUS
    1        0        0  Not_testing
    2        0        0  Not_testing
    3        0        0  Not_testing
    4        0        0  Not_testing
    5        0        0  Not_testing
Selective self-test flags (0x0):
  After scanning selected spans, do NOT read-scan remainder of disk.
If Selective self-test is pending on power-up, resume after 0 minute delay.

SCT Status Version:                  3
SCT Version (vendor specific):       522 (0x020a)
Device State:                        Active (0)
Current Temperature:                    33 Celsius
Power Cycle Min/Max Temperature:     23/37 Celsius
Lifetime    Min/Max Temperature:     10/46 Celsius
Under/Over Temperature Limit Count:   0/0

SCT Temperature History Version:     2
Temperature Sampling Period:         1 minute
Temperature Logging Interval:        59 minutes
Min/Max recommended Temperature:     14/55 Celsius
Min/Max Temperature Limit:           10/60 Celsius
Temperature History Size (Index):    128 (73)

SCT Error Recovery Control:
           Read: Disabled
          Write: Disabled

Device Statistics (GP/SMART Log 0x04) not supported

Pending Defects log (GP Log 0x0c) not supported

SATA Phy Event Counters (GP Log 0x11)
ID      Size     Value  Description
0x000a  2           27  Device-to-host register FISes sent due to a COMRESET
0x0001  2            0  Command failed due to ICRC error
0x0003  2            0  R_ERR response for device-to-host data FIS
0x0004  2            0  R_ERR response for host-to-device data FIS
0x0006  2            0  R_ERR response for device-to-host non-data FIS
0x0007  2            0  R_ERR response for host-to-device non-data FIS

