smartctl 7.3 2022-02-28 r5338 [x86_64-linux-5.18.13-200.fc36.x86_64] (local build)
Copyright (C) 2002-22, Bruce Allen, Christian Franke, www.smartmontools.org

=== START OF INFORMATION SECTION ===
Model Family:     Seagate Barracuda 7200.14 (AF)
Device Model:     ST500DM002-1BD142
Serial Number:    --
LU WWN Device Id: 5 000c50 ...
Firmware Version: KC48
User Capacity:    500,107,862,016 bytes [500 GB]
Sector Sizes:     512 bytes logical, 4096 bytes physical
Rotation Rate:    7200 rpm
Device is:        In smartctl database 7.3/5319
ATA Version is:   ATA8-ACS T13/1699-D revision 4
SATA Version is:  SATA 3.0, 6.0 Gb/s (current: 3.0 Gb/s)
Local Time is:    Mon Jul 25 04:20:25 2022 MSK
SMART support is: Available - device has SMART capability.
SMART support is: Enabled
AAM level is:     208 (intermediate), recommended: 208
APM feature is:   Unavailable
Rd look-ahead is: Enabled
Write cache is:   Enabled
DSN feature is:   Unavailable
ATA Security is:  Disabled, frozen [SEC2]
Wt Cache Reorder: Enabled

=== START OF READ SMART DATA SECTION ===
SMART overall-health self-assessment test result: PASSED

General SMART Values:
Offline data collection status:  (0x82)	Offline data collection activity
					was completed without error.
					Auto Offline Data Collection: Enabled.
Self-test execution status:      (   0)	The previous self-test routine completed
					without error or no self-test has ever 
					been run.
Total time to complete Offline 
data collection: 		(  609) seconds.
Offline data collection
capabilities: 			 (0x7b) SMART execute Offline immediate.
					Auto Offline data collection on/off support.
					Suspend Offline collection upon new
					command.
					Offline surface scan supported.
					Self-test supported.
					Conveyance Self-test supported.
					Selective Self-test supported.
SMART capabilities:            (0x0003)	Saves SMART data before entering
					power-saving mode.
					Supports SMART auto save timer.
Error logging capability:        (0x01)	Error logging supported.
					General Purpose Logging supported.
Short self-test routine 
recommended polling time: 	 (   1) minutes.
Extended self-test routine
recommended polling time: 	 (  86) minutes.
Conveyance self-test routine
recommended polling time: 	 (   2) minutes.
SCT capabilities: 	       (0x303f)	SCT Status supported.
					SCT Error Recovery Control supported.
					SCT Feature Control supported.
					SCT Data Table supported.

SMART Attributes Data Structure revision number: 10
Vendor Specific SMART Attributes with Thresholds:
ID# ATTRIBUTE_NAME          FLAGS    VALUE WORST THRESH FAIL RAW_VALUE
  1 Raw_Read_Error_Rate     POSR--   102   099   006    -    6880
  3 Spin_Up_Time            PO----   100   098   000    -    0
  4 Start_Stop_Count        -O--CK   098   098   020    -    2386
  5 Reallocated_Sector_Ct   PO--CK   100   100   036    -    0
  7 Seek_Error_Rate         POSR--   084   060   030    -    259888131
  9 Power_On_Hours          -O--CK   096   096   000    -    3801
 10 Spin_Retry_Count        PO--C-   100   100   097    -    0
 12 Power_Cycle_Count       -O--CK   098   098   020    -    2297
183 Runtime_Bad_Block       -O--CK   100   100   000    -    0
184 End-to-End_Error        -O--CK   100   100   099    -    0
187 Reported_Uncorrect      -O--CK   001   001   000    -    417
188 Command_Timeout         -O--CK   100   099   000    -    0 0 12
189 High_Fly_Writes         -O-RCK   100   100   000    -    0
190 Airflow_Temperature_Cel -O---K   062   056   045    -    38 (0 4 38 34 0)
194 Temperature_Celsius     -O---K   038   044   000    -    38 (128 0 0 0 0)
195 Hardware_ECC_Recovered  -O-RC-   074   043   000    -    6880
197 Current_Pending_Sector  -O--C-   100   100   000    -    0
198 Offline_Uncorrectable   ----C-   100   100   000    -    0
199 UDMA_CRC_Error_Count    -OSRCK   200   200   000    -    1
240 Head_Flying_Hours       ------   100   253   000    -    3783h+48m+16.007s
241 Total_LBAs_Written      ------   100   253   000    -    2252725134
242 Total_LBAs_Read         ------   100   253   000    -    3719470169
                            ||||||_ K auto-keep
                            |||||__ C event count
                            ||||___ R error rate
                            |||____ S speed/performance
                            ||_____ O updated online
                            |______ P prefailure warning

General Purpose Log Directory Version 1
SMART           Log Directory Version 1 [multi-sector log support]
Address    Access  R/W   Size  Description
0x00       GPL,SL  R/O      1  Log Directory
0x01           SL  R/O      1  Summary SMART error log
0x02           SL  R/O      5  Comprehensive SMART error log
0x03       GPL     R/O      5  Ext. Comprehensive SMART error log
0x06           SL  R/O      1  SMART self-test log
0x07       GPL     R/O      1  Extended self-test log
0x09           SL  R/W      1  Selective self-test log
0x10       GPL     R/O      1  NCQ Command Error log
0x11       GPL     R/O      1  SATA Phy Event Counters log
0x21       GPL     R/O      1  Write stream error log
0x22       GPL     R/O      1  Read stream error log
0x80-0x9f  GPL,SL  R/W     16  Host vendor specific log
0xa1       GPL,SL  VS      20  Device vendor specific log
0xa2       GPL     VS    2248  Device vendor specific log
0xa8       GPL,SL  VS     129  Device vendor specific log
0xa9       GPL,SL  VS       1  Device vendor specific log
0xab       GPL     VS       1  Device vendor specific log
0xb0       GPL     VS    2928  Device vendor specific log
0xbd       GPL     VS     252  Device vendor specific log
0xbe-0xbf  GPL     VS   65535  Device vendor specific log
0xc0       GPL,SL  VS       1  Device vendor specific log
0xe0       GPL,SL  R/W      1  SCT Command/Status
0xe1       GPL,SL  R/W      1  SCT Data Transfer

SMART Extended Comprehensive Error Log Version: 1 (5 sectors)
Device Error Count: 416 (device log contains only the most recent 20 errors)
	CR     = Command Register
	FEATR  = Features Register
	COUNT  = Count (was: Sector Count) Register
	LBA_48 = Upper bytes of LBA High/Mid/Low Registers ]  ATA-8
	LH     = LBA High (was: Cylinder High) Register    ]   LBA
	LM     = LBA Mid (was: Cylinder Low) Register      ] Register
	LL     = LBA Low (was: Sector Number) Register     ]
	DV     = Device (was: Device/Head) Register
	DC     = Device Control Register
	ER     = Error register
	ST     = Status register
Powered_Up_Time is measured from power on, and printed as
DDd+hh:mm:SS.sss where DD=days, hh=hours, mm=minutes,
SS=sec, and sss=millisec. It "wraps" after 49.710 days.

Error 416 [15] occurred at disk power-on lifetime: 3017 hours (125 days + 17 hours)
  When the command that caused the error occurred, the device was active or idle.

  After command completion occurred, registers were:
  ER -- ST COUNT  LBA_48  LH LM LL DV DC
  -- -- -- == -- == == == -- -- -- -- --
  40 -- 51 00 00 00 00 06 75 72 48 00 00  Error: UNC at LBA = 0x06757248 = 108360264

  Commands leading to the command that caused the error were:
  CR FEATR COUNT  LBA_48  LH LM LL DV DC  Powered_Up_Time  Command/Feature_Name
  -- == -- == -- == == == -- -- -- -- --  ---------------  --------------------
  60 00 00 01 00 00 00 06 75 72 00 40 00     00:35:50.183  READ FPDMA QUEUED
  60 00 00 01 00 00 00 05 84 bf 00 40 00     00:35:50.167  READ FPDMA QUEUED
  60 00 00 00 02 00 00 06 75 72 5c 40 00     00:35:50.167  READ FPDMA QUEUED
  61 00 00 00 02 00 00 06 75 72 5c 40 00     00:35:50.167  WRITE FPDMA QUEUED
  60 00 00 00 02 00 00 00 63 28 0a 40 00     00:35:50.166  READ FPDMA QUEUED

Error 415 [14] occurred at disk power-on lifetime: 3017 hours (125 days + 17 hours)
  When the command that caused the error occurred, the device was active or idle.

  After command completion occurred, registers were:
  ER -- ST COUNT  LBA_48  LH LM LL DV DC
  -- -- -- == -- == == == -- -- -- -- --
  40 -- 51 00 00 00 00 06 75 72 48 00 00  Error: UNC at LBA = 0x06757248 = 108360264

  Commands leading to the command that caused the error were:
  CR FEATR COUNT  LBA_48  LH LM LL DV DC  Powered_Up_Time  Command/Feature_Name
  -- == -- == -- == == == -- -- -- -- --  ---------------  --------------------
  60 00 00 01 00 00 00 06 75 72 00 40 00     00:35:44.950  READ FPDMA QUEUED
  60 00 00 01 00 00 00 06 75 6a 00 40 00     00:35:44.935  READ FPDMA QUEUED
  60 00 00 01 00 00 00 00 64 b5 00 40 00     00:35:44.924  READ FPDMA QUEUED
  60 00 00 01 00 00 00 00 64 b4 00 40 00     00:35:44.915  READ FPDMA QUEUED
  60 00 00 01 00 00 00 00 64 b3 00 40 00     00:35:44.906  READ FPDMA QUEUED

Error 414 [13] occurred at disk power-on lifetime: 3017 hours (125 days + 17 hours)
  When the command that caused the error occurred, the device was active or idle.

  After command completion occurred, registers were:
  ER -- ST COUNT  LBA_48  LH LM LL DV DC
  -- -- -- == -- == == == -- -- -- -- --
  40 -- 51 00 00 00 00 06 75 72 48 00 00  Error: UNC at LBA = 0x06757248 = 108360264

  Commands leading to the command that caused the error were:
  CR FEATR COUNT  LBA_48  LH LM LL DV DC  Powered_Up_Time  Command/Feature_Name
  -- == -- == -- == == == -- -- -- -- --  ---------------  --------------------
  60 00 00 01 00 00 00 06 75 72 00 40 00     00:35:20.015  READ FPDMA QUEUED
  60 00 00 00 02 00 00 06 75 72 de 40 00     00:35:19.968  READ FPDMA QUEUED
  2f 00 00 00 01 00 00 00 00 00 10 e0 00     00:35:19.883  READ LOG EXT
  60 00 00 01 00 00 00 06 75 72 00 40 00     00:35:16.244  READ FPDMA QUEUED
  60 00 00 00 02 00 00 06 75 72 ca 40 00     00:35:16.196  READ FPDMA QUEUED

Error 413 [12] occurred at disk power-on lifetime: 3017 hours (125 days + 17 hours)
  When the command that caused the error occurred, the device was active or idle.

  After command completion occurred, registers were:
  ER -- ST COUNT  LBA_48  LH LM LL DV DC
  -- -- -- == -- == == == -- -- -- -- --
  40 -- 51 00 00 00 00 06 75 72 48 00 00  Error: UNC at LBA = 0x06757248 = 108360264

  Commands leading to the command that caused the error were:
  CR FEATR COUNT  LBA_48  LH LM LL DV DC  Powered_Up_Time  Command/Feature_Name
  -- == -- == -- == == == -- -- -- -- --  ---------------  --------------------
  60 00 00 01 00 00 00 06 75 72 00 40 00     00:35:16.244  READ FPDMA QUEUED
  60 00 00 00 02 00 00 06 75 72 ca 40 00     00:35:16.196  READ FPDMA QUEUED
  2f 00 00 00 01 00 00 00 00 00 10 e0 00     00:35:16.112  READ LOG EXT
  60 00 00 01 00 00 00 06 75 72 00 40 00     00:35:12.492  READ FPDMA QUEUED
  60 00 00 00 02 00 00 06 75 72 b6 40 00     00:35:12.491  READ FPDMA QUEUED

Error 412 [11] occurred at disk power-on lifetime: 3017 hours (125 days + 17 hours)
  When the command that caused the error occurred, the device was active or idle.

  After command completion occurred, registers were:
  ER -- ST COUNT  LBA_48  LH LM LL DV DC
  -- -- -- == -- == == == -- -- -- -- --
  40 -- 51 00 00 00 00 06 75 72 48 00 00  Error: UNC at LBA = 0x06757248 = 108360264

  Commands leading to the command that caused the error were:
  CR FEATR COUNT  LBA_48  LH LM LL DV DC  Powered_Up_Time  Command/Feature_Name
  -- == -- == -- == == == -- -- -- -- --  ---------------  --------------------
  60 00 00 01 00 00 00 06 75 72 00 40 00     00:35:12.492  READ FPDMA QUEUED
  60 00 00 00 02 00 00 06 75 72 b6 40 00     00:35:12.491  READ FPDMA QUEUED
  2f 00 00 00 01 00 00 00 00 00 10 e0 00     00:35:12.415  READ LOG EXT
  60 00 00 01 00 00 00 06 75 72 00 40 00     00:35:08.792  READ FPDMA QUEUED
  60 00 00 00 02 00 00 06 75 72 a2 40 00     00:35:08.745  READ FPDMA QUEUED

Error 411 [10] occurred at disk power-on lifetime: 3017 hours (125 days + 17 hours)
  When the command that caused the error occurred, the device was active or idle.

  After command completion occurred, registers were:
  ER -- ST COUNT  LBA_48  LH LM LL DV DC
  -- -- -- == -- == == == -- -- -- -- --
  40 -- 51 00 00 00 00 06 75 72 48 00 00  Error: UNC at LBA = 0x06757248 = 108360264

  Commands leading to the command that caused the error were:
  CR FEATR COUNT  LBA_48  LH LM LL DV DC  Powered_Up_Time  Command/Feature_Name
  -- == -- == -- == == == -- -- -- -- --  ---------------  --------------------
  60 00 00 01 00 00 00 06 75 72 00 40 00     00:35:08.792  READ FPDMA QUEUED
  60 00 00 00 02 00 00 06 75 72 a2 40 00     00:35:08.745  READ FPDMA QUEUED
  2f 00 00 00 01 00 00 00 00 00 10 e0 00     00:35:08.660  READ LOG EXT
  60 00 00 01 00 00 00 06 75 72 00 40 00     00:35:05.104  READ FPDMA QUEUED
  60 00 00 00 02 00 00 06 75 72 8c 40 00     00:35:05.057  READ FPDMA QUEUED

Error 410 [9] occurred at disk power-on lifetime: 3017 hours (125 days + 17 hours)
  When the command that caused the error occurred, the device was active or idle.

  After command completion occurred, registers were:
  ER -- ST COUNT  LBA_48  LH LM LL DV DC
  -- -- -- == -- == == == -- -- -- -- --
  40 -- 51 00 00 00 00 06 75 72 48 00 00  Error: UNC at LBA = 0x06757248 = 108360264

  Commands leading to the command that caused the error were:
  CR FEATR COUNT  LBA_48  LH LM LL DV DC  Powered_Up_Time  Command/Feature_Name
  -- == -- == -- == == == -- -- -- -- --  ---------------  --------------------
  60 00 00 01 00 00 00 06 75 72 00 40 00     00:35:05.104  READ FPDMA QUEUED
  60 00 00 00 02 00 00 06 75 72 8c 40 00     00:35:05.057  READ FPDMA QUEUED
  2f 00 00 00 01 00 00 00 00 00 10 e0 00     00:35:04.972  READ LOG EXT
  60 00 00 01 00 00 00 06 75 72 00 40 00     00:35:01.390  READ FPDMA QUEUED
  60 00 00 01 00 00 00 00 7c 07 00 40 00     00:35:01.373  READ FPDMA QUEUED

Error 409 [8] occurred at disk power-on lifetime: 3017 hours (125 days + 17 hours)
  When the command that caused the error occurred, the device was active or idle.

  After command completion occurred, registers were:
  ER -- ST COUNT  LBA_48  LH LM LL DV DC
  -- -- -- == -- == == == -- -- -- -- --
  40 -- 51 00 00 00 00 06 75 72 48 00 00  Error: UNC at LBA = 0x06757248 = 108360264

  Commands leading to the command that caused the error were:
  CR FEATR COUNT  LBA_48  LH LM LL DV DC  Powered_Up_Time  Command/Feature_Name
  -- == -- == -- == == == -- -- -- -- --  ---------------  --------------------
  60 00 00 01 00 00 00 06 75 72 00 40 00     00:35:01.390  READ FPDMA QUEUED
  60 00 00 01 00 00 00 00 7c 07 00 40 00     00:35:01.373  READ FPDMA QUEUED
  60 00 00 00 02 00 00 06 75 72 88 40 00     00:35:01.327  READ FPDMA QUEUED
  2f 00 00 00 01 00 00 00 00 00 10 e0 00     00:35:01.242  READ LOG EXT
  60 00 00 01 00 00 00 06 75 72 00 40 00     00:34:57.648  READ FPDMA QUEUED

SMART Extended Self-test Log Version: 1 (1 sectors)
No self-tests have been logged.  [To run self-tests, use: smartctl -t]

SMART Selective self-test log data structure revision number 1
 SPAN  MIN_LBA  MAX_LBA  CURRENT_TEST_STATUS
    1        0        0  Not_testing
    2        0        0  Not_testing
    3        0        0  Not_testing
    4        0        0  Not_testing
    5        0        0  Not_testing
Selective self-test flags (0x0):
  After scanning selected spans, do NOT read-scan remainder of disk.
If Selective self-test is pending on power-up, resume after 0 minute delay.

SCT Status Version:                  3
SCT Version (vendor specific):       522 (0x020a)
Device State:                        Active (0)
Current Temperature:                    38 Celsius
Power Cycle Min/Max Temperature:     34/38 Celsius
Lifetime    Min/Max Temperature:     15/45 Celsius
Under/Over Temperature Limit Count:   0/0

SCT Temperature History Version:     2
Temperature Sampling Period:         1 minute
Temperature Logging Interval:        59 minutes
Min/Max recommended Temperature:     14/55 Celsius
Min/Max Temperature Limit:           10/60 Celsius
Temperature History Size (Index):    128 (22)

SCT Error Recovery Control:
           Read: Disabled
          Write: Disabled

Device Statistics (GP/SMART Log 0x04) not supported

Pending Defects log (GP Log 0x0c) not supported

SATA Phy Event Counters (GP Log 0x11)
ID      Size     Value  Description
0x000a  2           20  Device-to-host register FISes sent due to a COMRESET
0x0001  2            0  Command failed due to ICRC error
0x0003  2            0  R_ERR response for device-to-host data FIS
0x0004  2            0  R_ERR response for host-to-device data FIS
0x0006  2            0  R_ERR response for device-to-host non-data FIS
0x0007  2            0  R_ERR response for host-to-device non-data FIS

