=== START OF INFORMATION SECTION ===
Model Family:     Western Digital Caviar Green (AF, SATA 6Gb/s)
Device Model:     WDC WD10EARX-00N0YB0
Serial Number:    --
LU WWN Device Id: 5 0014ee ...
Firmware Version: 51.0AB51
User Capacity:    1 000 203 804 160 bytes [1,00 TB]
Sector Sizes:     512 bytes logical, 4096 bytes physical
Device is:        In smartctl database [for details use: -P show]
ATA Version is:   ATA8-ACS (minor revision not indicated)
SATA Version is:  SATA 3.0, 6.0 Gb/s (current: 3.0 Gb/s)
Local Time is:    Mon Aug  1 17:56:30 2016 EET
SMART support is: Available - device has SMART capability.
SMART support is: Enabled
AAM feature is:   Unavailable
APM feature is:   Unavailable
Rd look-ahead is: Enabled
Write cache is:   Enabled
ATA Security is:  Disabled, frozen [SEC2]
Wt Cache Reorder: Enabled

=== START OF READ SMART DATA SECTION ===
SMART overall-health self-assessment test result: PASSED

General SMART Values:
Offline data collection status:  (0x82)	Offline data collection activity
					was completed without error.
					Auto Offline Data Collection: Enabled.
Self-test execution status:      (   0)	The previous self-test routine completed
					without error or no self-test has ever 
					been run.
Total time to complete Offline 
data collection: 		(17460) seconds.
Offline data collection
capabilities: 			 (0x7b) SMART execute Offline immediate.
					Auto Offline data collection on/off support.
					Suspend Offline collection upon new
					command.
					Offline surface scan supported.
					Self-test supported.
					Conveyance Self-test supported.
					Selective Self-test supported.
SMART capabilities:            (0x0003)	Saves SMART data before entering
					power-saving mode.
					Supports SMART auto save timer.
Error logging capability:        (0x01)	Error logging supported.
					General Purpose Logging supported.
Short self-test routine 
recommended polling time: 	 (   2) minutes.
Extended self-test routine
recommended polling time: 	 ( 171) minutes.
Conveyance self-test routine
recommended polling time: 	 (   5) minutes.
SCT capabilities: 	       (0x30b5)	SCT Status supported.
					SCT Feature Control supported.
					SCT Data Table supported.

SMART Attributes Data Structure revision number: 16
Vendor Specific SMART Attributes with Thresholds:
ID# ATTRIBUTE_NAME          FLAGS    VALUE WORST THRESH FAIL RAW_VALUE
  1 Raw_Read_Error_Rate     POSR-K   200   198   051    -    608
  3 Spin_Up_Time            POS--K   108   096   021    -    7566
  4 Start_Stop_Count        -O--CK   098   098   000    -    2412
  5 Reallocated_Sector_Ct   PO--CK   200   200   140    -    0
  7 Seek_Error_Rate         -OSR-K   200   200   000    -    0
  9 Power_On_Hours          -O--CK   093   093   000    -    5206
 10 Spin_Retry_Count        -O--CK   100   100   000    -    0
 11 Calibration_Retry_Count -O--CK   100   100   000    -    0
 12 Power_Cycle_Count       -O--CK   098   098   000    -    2398
192 Power-Off_Retract_Count -O--CK   200   200   000    -    549
193 Load_Cycle_Count        -O--CK   175   175   000    -    76956
194 Temperature_Celsius     -O---K   120   113   000    -    27
196 Reallocated_Event_Count -O--CK   200   200   000    -    0
197 Current_Pending_Sector  -O--CK   200   200   000    -    0
198 Offline_Uncorrectable   ----CK   200   200   000    -    4
199 UDMA_CRC_Error_Count    -O--CK   200   200   000    -    22
200 Multi_Zone_Error_Rate   ---R--   200   200   000    -    2
                            ||||||_ K auto-keep
                            |||||__ C event count
                            ||||___ R error rate
                            |||____ S speed/performance
                            ||_____ O updated online
                            |______ P prefailure warning

General Purpose Log Directory Version 1
SMART           Log Directory Version 1 [multi-sector log support]
Address    Access  R/W   Size  Description
0x00       GPL,SL  R/O      1  Log Directory
0x01           SL  R/O      1  Summary SMART error log
0x02           SL  R/O      5  Comprehensive SMART error log
0x03       GPL     R/O      6  Ext. Comprehensive SMART error log
0x06           SL  R/O      1  SMART self-test log
0x07       GPL     R/O      1  Extended self-test log
0x09           SL  R/W      1  Selective self-test log
0x10       GPL     R/O      1  NCQ Command Error log
0x11       GPL     R/O      1  SATA Phy Event Counters
0x80-0x9f  GPL,SL  R/W     16  Host vendor specific log
0xa0-0xa7  GPL,SL  VS      16  Device vendor specific log
0xa8-0xb7  GPL,SL  VS       1  Device vendor specific log
0xc0       GPL,SL  VS       1  Device vendor specific log
0xc1       GPL     VS      93  Device vendor specific log
0xe0       GPL,SL  R/W      1  SCT Command/Status
0xe1       GPL,SL  R/W      1  SCT Data Transfer

SMART Extended Comprehensive Error Log Version: 1 (6 sectors)
Device Error Count: 17423 (device log contains only the most recent 24 errors)
	CR     = Command Register
	FEATR  = Features Register
	COUNT  = Count (was: Sector Count) Register
	LBA_48 = Upper bytes of LBA High/Mid/Low Registers ]  ATA-8
	LH     = LBA High (was: Cylinder High) Register    ]   LBA
	LM     = LBA Mid (was: Cylinder Low) Register      ] Register
	LL     = LBA Low (was: Sector Number) Register     ]
	DV     = Device (was: Device/Head) Register
	DC     = Device Control Register
	ER     = Error register
	ST     = Status register
Powered_Up_Time is measured from power on, and printed as
DDd+hh:mm:SS.sss where DD=days, hh=hours, mm=minutes,
SS=sec, and sss=millisec. It "wraps" after 49.710 days.

Error 17423 [22] occurred at disk power-on lifetime: 4827 hours (201 days + 3 hours)
  When the command that caused the error occurred, the device was active or idle.

  After command completion occurred, registers were:
  ER -- ST COUNT  LBA_48  LH LM LL DV DC
  -- -- -- == -- == == == -- -- -- -- --
  40 -- 51 00 08 00 00 46 94 e5 f0 e0 00  Error: UNC 8 sectors at LBA = 0x4694e5f0 = 1184163312

  Commands leading to the command that caused the error were:
  CR FEATR COUNT  LBA_48  LH LM LL DV DC  Powered_Up_Time  Command/Feature_Name
  -- == -- == -- == == == -- -- -- -- --  ---------------  --------------------
  25 00 00 00 08 00 00 46 94 e5 f0 e0 00     01:24:54.530  READ DMA EXT
  25 00 00 00 08 00 00 46 94 e5 e8 e0 00     01:24:54.530  READ DMA EXT
  25 00 00 00 08 00 00 46 94 e5 e0 e0 00     01:24:54.480  READ DMA EXT
  35 00 00 00 01 00 00 01 a7 64 a6 e0 00     01:24:54.431  WRITE DMA EXT
  25 00 00 00 01 00 00 01 a7 64 a6 e0 00     01:24:54.431  READ DMA EXT

Error 17422 [21] occurred at disk power-on lifetime: 4827 hours (201 days + 3 hours)
  When the command that caused the error occurred, the device was active or idle.

  After command completion occurred, registers were:
  ER -- ST COUNT  LBA_48  LH LM LL DV DC
  -- -- -- == -- == == == -- -- -- -- --
  40 -- 51 00 20 00 00 46 94 e5 f0 e0 00  Error: UNC 32 sectors at LBA = 0x4694e5f0 = 1184163312

  Commands leading to the command that caused the error were:
  CR FEATR COUNT  LBA_48  LH LM LL DV DC  Powered_Up_Time  Command/Feature_Name
  -- == -- == -- == == == -- -- -- -- --  ---------------  --------------------
  25 00 00 00 20 00 00 46 94 e5 e0 e0 00     01:24:51.755  READ DMA EXT
  35 00 00 00 08 00 00 00 55 f4 20 e0 00     01:24:51.755  WRITE DMA EXT
  25 00 00 00 08 00 00 46 94 ed 00 e0 00     01:24:51.755  READ DMA EXT
  35 00 00 00 20 00 00 3a 59 66 60 e0 00     01:24:51.755  WRITE DMA EXT
  35 00 00 00 20 00 00 00 55 f4 00 e0 00     01:24:51.755  WRITE DMA EXT

Error 17421 [20] occurred at disk power-on lifetime: 4807 hours (200 days + 7 hours)
  When the command that caused the error occurred, the device was active or idle.

  After command completion occurred, registers were:
  ER -- ST COUNT  LBA_48  LH LM LL DV DC
  -- -- -- == -- == == == -- -- -- -- --
  40 -- 51 00 08 00 00 46 94 e5 f0 e0 00  Error: UNC 8 sectors at LBA = 0x4694e5f0 = 1184163312

  Commands leading to the command that caused the error were:
  CR FEATR COUNT  LBA_48  LH LM LL DV DC  Powered_Up_Time  Command/Feature_Name
  -- == -- == -- == == == -- -- -- -- --  ---------------  --------------------
  25 00 00 00 08 00 00 46 94 e5 f0 e0 00     03:38:44.352  READ DMA EXT
  35 00 00 00 08 00 00 00 62 60 e8 e0 00     03:38:44.352  WRITE DMA EXT
  25 00 00 00 08 00 00 46 94 e5 e8 e0 00     03:38:44.352  READ DMA EXT
  35 00 00 00 01 00 00 11 ac ca 96 e0 00     03:38:44.351  WRITE DMA EXT
  35 00 00 00 18 00 00 00 62 60 c0 e0 00     03:38:44.351  WRITE DMA EXT

Error 17420 [19] occurred at disk power-on lifetime: 4807 hours (200 days + 7 hours)
  When the command that caused the error occurred, the device was active or idle.

  After command completion occurred, registers were:
  ER -- ST COUNT  LBA_48  LH LM LL DV DC
  -- -- -- == -- == == == -- -- -- -- --
  40 -- 51 00 20 00 00 46 94 e5 f0 e0 00  Error: UNC 32 sectors at LBA = 0x4694e5f0 = 1184163312

  Commands leading to the command that caused the error were:
  CR FEATR COUNT  LBA_48  LH LM LL DV DC  Powered_Up_Time  Command/Feature_Name
  -- == -- == -- == == == -- -- -- -- --  ---------------  --------------------
  25 00 00 00 20 00 00 46 94 e5 e0 e0 00     03:38:41.782  READ DMA EXT
  25 00 00 00 20 00 00 10 fc 1d e0 e0 00     03:38:41.770  READ DMA EXT
  35 00 00 00 80 00 00 10 fc 1d 18 e0 00     03:38:41.770  WRITE DMA EXT
  35 00 00 00 80 00 00 10 fc 1c 98 e0 00     03:38:41.769  WRITE DMA EXT
  35 00 00 00 80 00 00 10 fc 1c 18 e0 00     03:38:41.769  WRITE DMA EXT

Error 17419 [18] occurred at disk power-on lifetime: 4774 hours (198 days + 22 hours)
  When the command that caused the error occurred, the device was active or idle.

  After command completion occurred, registers were:
  ER -- ST COUNT  LBA_48  LH LM LL DV DC
  -- -- -- == -- == == == -- -- -- -- --
  40 -- 51 00 08 00 00 00 89 9d 00 e0 00  Error: UNC 8 sectors at LBA = 0x00899d00 = 9018624

  Commands leading to the command that caused the error were:
  CR FEATR COUNT  LBA_48  LH LM LL DV DC  Powered_Up_Time  Command/Feature_Name
  -- == -- == -- == == == -- -- -- -- --  ---------------  --------------------
  25 00 00 00 08 00 00 00 89 9d 00 e0 00     00:39:19.281  READ DMA EXT
  35 00 00 00 08 00 00 13 64 3a 20 e0 00     00:39:19.251  WRITE DMA EXT
  35 00 00 00 08 00 00 13 64 3a 10 e0 00     00:39:19.248  WRITE DMA EXT
  35 00 00 00 08 00 00 13 64 35 a8 e0 00     00:39:19.244  WRITE DMA EXT
  35 00 00 00 08 00 00 13 64 35 30 e0 00     00:39:19.244  WRITE DMA EXT

Error 17418 [17] occurred at disk power-on lifetime: 4774 hours (198 days + 22 hours)
  When the command that caused the error occurred, the device was active or idle.

  After command completion occurred, registers were:
  ER -- ST COUNT  LBA_48  LH LM LL DV DC
  -- -- -- == -- == == == -- -- -- -- --
  40 -- 51 00 20 00 00 00 89 9d 00 e0 00  Error: UNC 32 sectors at LBA = 0x00899d00 = 9018624

  Commands leading to the command that caused the error were:
  CR FEATR COUNT  LBA_48  LH LM LL DV DC  Powered_Up_Time  Command/Feature_Name
  -- == -- == -- == == == -- -- -- -- --  ---------------  --------------------
  25 00 00 00 20 00 00 00 89 9d 00 e0 00     00:39:16.607  READ DMA EXT
  35 00 00 00 10 00 00 00 88 d2 70 e0 00     00:39:16.607  WRITE DMA EXT
  25 00 00 00 10 00 00 02 10 60 30 e0 00     00:39:16.607  READ DMA EXT
  35 00 00 00 20 00 00 3a 62 6b a0 e0 00     00:39:16.606  WRITE DMA EXT
  35 00 00 00 20 00 00 3a 67 4e 00 e0 00     00:39:16.606  WRITE DMA EXT

Error 17417 [16] occurred at disk power-on lifetime: 4721 hours (196 days + 17 hours)
  When the command that caused the error occurred, the device was active or idle.

  After command completion occurred, registers were:
  ER -- ST COUNT  LBA_48  LH LM LL DV DC
  -- -- -- == -- == == == -- -- -- -- --
  40 -- 51 00 08 00 00 00 89 9d 00 e0 00  Error: UNC 8 sectors at LBA = 0x00899d00 = 9018624

  Commands leading to the command that caused the error were:
  CR FEATR COUNT  LBA_48  LH LM LL DV DC  Powered_Up_Time  Command/Feature_Name
  -- == -- == -- == == == -- -- -- -- --  ---------------  --------------------
  25 00 00 00 08 00 00 00 89 9d 00 e0 00     00:08:24.024  READ DMA EXT
  35 00 00 00 08 00 00 00 63 36 a8 e0 00     00:08:24.024  WRITE DMA EXT
  35 00 00 00 08 00 00 00 07 77 80 e0 00     00:08:24.024  WRITE DMA EXT
  35 00 00 00 20 00 00 00 07 3a 20 e0 00     00:08:24.024  WRITE DMA EXT
  25 00 00 00 40 00 00 70 78 76 80 e0 00     00:08:24.000  READ DMA EXT

Error 17416 [15] occurred at disk power-on lifetime: 4721 hours (196 days + 17 hours)
  When the command that caused the error occurred, the device was active or idle.

  After command completion occurred, registers were:
  ER -- ST COUNT  LBA_48  LH LM LL DV DC
  -- -- -- == -- == == == -- -- -- -- --
  40 -- 51 00 20 00 00 00 89 9d 00 e0 00  Error: UNC 32 sectors at LBA = 0x00899d00 = 9018624

  Commands leading to the command that caused the error were:
  CR FEATR COUNT  LBA_48  LH LM LL DV DC  Powered_Up_Time  Command/Feature_Name
  -- == -- == -- == == == -- -- -- -- --  ---------------  --------------------
  25 00 00 00 20 00 00 00 89 9d 00 e0 00     00:08:21.498  READ DMA EXT
  35 00 00 00 08 00 00 00 5e 3f 20 e0 00     00:08:21.498  WRITE DMA EXT
  35 00 00 00 30 00 00 00 5f 82 60 e0 00     00:08:21.497  WRITE DMA EXT
  25 00 00 00 40 00 00 33 38 63 b8 e0 00     00:08:20.949  READ DMA EXT
  25 00 00 00 18 00 00 04 f7 4d 50 e0 00     00:08:20.940  READ DMA EXT

SMART Extended Self-test Log Version: 1 (1 sectors)
No self-tests have been logged.  [To run self-tests, use: smartctl -t]

SMART Selective self-test log data structure revision number 1
 SPAN  MIN_LBA  MAX_LBA  CURRENT_TEST_STATUS
    1        0        0  Not_testing
    2        0        0  Not_testing
    3        0        0  Not_testing
    4        0        0  Not_testing
    5        0        0  Not_testing
Selective self-test flags (0x0):
  After scanning selected spans, do NOT read-scan remainder of disk.
If Selective self-test is pending on power-up, resume after 0 minute delay.

SCT Status Version:                  3
SCT Version (vendor specific):       258 (0x0102)
SCT Support Level:                   1
Device State:                        Active (0)
Current Temperature:                    27 Celsius
Power Cycle Min/Max Temperature:     26/30 Celsius
Lifetime    Min/Max Temperature:     26/34 Celsius
Under/Over Temperature Limit Count:   0/0

SCT Temperature History Version:     2
Temperature Sampling Period:         1 minute
Temperature Logging Interval:        1 minute
Min/Max recommended Temperature:      0/60 Celsius
Min/Max Temperature Limit:           -41/85 Celsius
Temperature History Size (Index):    478 (355)

SCT Error Recovery Control command not supported

Device Statistics (GP Log 0x04) not supported

SATA Phy Event Counters (GP Log 0x11)
ID      Size     Value  Description
0x0001  2            0  Command failed due to ICRC error
0x0002  2            0  R_ERR response for data FIS
0x0003  2            0  R_ERR response for device-to-host data FIS
0x0004  2            0  R_ERR response for host-to-device data FIS
0x0005  2            0  R_ERR response for non-data FIS
0x0006  2            0  R_ERR response for device-to-host non-data FIS
0x0007  2            0  R_ERR response for host-to-device non-data FIS
0x0008  2            0  Device-to-host non-data FIS retries
0x0009  2            2  Transition from drive PhyRdy to drive PhyNRdy
0x000a  2            3  Device-to-host register FISes sent due to a COMRESET
0x000b  2            0  CRC errors within host-to-device FIS
0x000f  2            0  R_ERR response for host-to-device data FIS, CRC
0x0012  2            0  R_ERR response for host-to-device non-data FIS, CRC
0x8000  4         4755  Vendor specific

