smartctl 7.2 2020-12-30 r5155 [x86_64-linux-5.10.14-desktop-1omv4002] (OpenMandriva Lx 7.2-2)
Copyright (C) 2002-20, Bruce Allen, Christian Franke, www.smartmontools.org

=== START OF INFORMATION SECTION ===
Model Family:     Seagate Barracuda 7200.10
Device Model:     ST3320620AS
Serial Number:    --
Firmware Version: 3.AAK
User Capacity:    320,072,933,376 bytes [320 GB]
Sector Size:      512 bytes logical/physical
Device is:        In smartctl database [for details use: -P show]
ATA Version is:   ATA/ATAPI-7 (minor revision not indicated)
Local Time is:    Thu Jul  8 18:10:08 2021 UTC
SMART support is: Available - device has SMART capability.
SMART support is: Enabled
AAM feature is:   Unavailable
APM feature is:   Unavailable
Rd look-ahead is: Enabled
Write cache is:   Enabled
DSN feature is:   Unavailable
ATA Security is:  Disabled, NOT FROZEN [SEC1]
Wt Cache Reorder: Unavailable

=== START OF READ SMART DATA SECTION ===
SMART overall-health self-assessment test result: PASSED

General SMART Values:
Offline data collection status:  (0x82)	Offline data collection activity
					was completed without error.
					Auto Offline Data Collection: Enabled.
Self-test execution status:      (  41)	The self-test routine was interrupted
					by the host with a hard or soft reset.
Total time to complete Offline 
data collection: 		(  430) seconds.
Offline data collection
capabilities: 			 (0x5b) SMART execute Offline immediate.
					Auto Offline data collection on/off support.
					Suspend Offline collection upon new
					command.
					Offline surface scan supported.
					Self-test supported.
					No Conveyance Self-test supported.
					Selective Self-test supported.
SMART capabilities:            (0x0003)	Saves SMART data before entering
					power-saving mode.
					Supports SMART auto save timer.
Error logging capability:        (0x01)	Error logging supported.
					General Purpose Logging supported.
Short self-test routine 
recommended polling time: 	 (   1) minutes.
Extended self-test routine
recommended polling time: 	 ( 115) minutes.

SMART Attributes Data Structure revision number: 10
Vendor Specific SMART Attributes with Thresholds:
ID# ATTRIBUTE_NAME          FLAGS    VALUE WORST THRESH FAIL RAW_VALUE
  1 Raw_Read_Error_Rate     POSR--   119   084   006    -    211500985
  3 Spin_Up_Time            PO----   100   095   000    -    0
  4 Start_Stop_Count        -O--CK   088   088   020    -    12992
  5 Reallocated_Sector_Ct   PO--CK   100   100   036    -    7
  7 Seek_Error_Rate         POSR--   049   038   030    -    6455448401286
  9 Power_On_Hours          -O--CK   096   096   000    -    3513
 10 Spin_Retry_Count        PO--C-   100   100   097    -    0
 12 Power_Cycle_Count       -O--CK   088   088   020    -    12659
187 Reported_Uncorrect      -O--CK   001   001   000    -    1676
189 High_Fly_Writes         -O-RCK   100   100   000    -    0
190 Airflow_Temperature_Cel -O---K   054   050   045    -    46 (Min/Max 46/46)
194 Temperature_Celsius     -O---K   046   050   000    -    46 (0 18 0 0 0)
195 Hardware_ECC_Recovered  -O-RC-   094   055   000    -    115969954
197 Current_Pending_Sector  -O--C-   001   001   000    -    4294967293
198 Offline_Uncorrectable   ----C-   001   001   000    -    4294967293
199 UDMA_CRC_Error_Count    -OSRCK   200   200   000    -    0
200 Multi_Zone_Error_Rate   ------   100   253   000    -    0
202 Data_Address_Mark_Errs  -O--CK   100   253   000    -    0
                            ||||||_ K auto-keep
                            |||||__ C event count
                            ||||___ R error rate
                            |||____ S speed/performance
                            ||_____ O updated online
                            |______ P prefailure warning

General Purpose Log Directory Version 1
SMART           Log Directory Version 1 [multi-sector log support]
Address    Access  R/W   Size  Description
0x00       GPL,SL  R/O      1  Log Directory
0x01       GPL,SL  R/O      1  Summary SMART error log
0x02       GPL,SL  R/O      5  Comprehensive SMART error log
0x03       GPL,SL  R/O      5  Ext. Comprehensive SMART error log
0x06       GPL,SL  R/O      1  SMART self-test log
0x07       GPL,SL  R/O      1  Extended self-test log
0x09       GPL,SL  R/W      1  Selective self-test log
0x10       GPL,SL  R/O      1  NCQ Command Error log
0x11       GPL,SL  R/O      1  SATA Phy Event Counters log
0x20       GPL,SL  R/O      1  Streaming performance log [OBS-8]
0x21       GPL,SL  R/O      1  Write stream error log
0x22       GPL,SL  R/O      1  Read stream error log
0x23       GPL,SL  R/O      1  Delayed sector log [OBS-8]
0x80-0x9f  GPL,SL  R/W     16  Host vendor specific log
0xa0       GPL,SL  VS       1  Device vendor specific log
0xa1       GPL,SL  VS      20  Device vendor specific log
0xa2       GPL,SL  VS     101  Device vendor specific log
0xa8       GPL,SL  VS      20  Device vendor specific log
0xa9       GPL,SL  VS       1  Device vendor specific log
0xe0       GPL,SL  R/W      1  SCT Command/Status
0xe1       GPL,SL  R/W      1  SCT Data Transfer
0xff       GPL     -    23040  Reserved

SMART Extended Comprehensive Error Log Version: 1 (5 sectors)
Device Error Count: 4620 (device log contains only the most recent 20 errors)
	CR     = Command Register
	FEATR  = Features Register
	COUNT  = Count (was: Sector Count) Register
	LBA_48 = Upper bytes of LBA High/Mid/Low Registers ]  ATA-8
	LH     = LBA High (was: Cylinder High) Register    ]   LBA
	LM     = LBA Mid (was: Cylinder Low) Register      ] Register
	LL     = LBA Low (was: Sector Number) Register     ]
	DV     = Device (was: Device/Head) Register
	DC     = Device Control Register
	ER     = Error register
	ST     = Status register
Powered_Up_Time is measured from power on, and printed as
DDd+hh:mm:SS.sss where DD=days, hh=hours, mm=minutes,
SS=sec, and sss=millisec. It "wraps" after 49.710 days.

Error 4620 [19] occurred at disk power-on lifetime: 1092 hours (45 days + 12 hours)
  When the command that caused the error occurred, the device was active or idle.

  After command completion occurred, registers were:
  ER -- ST COUNT  LBA_48  LH LM LL DV DC
  -- -- -- == -- == == == -- -- -- -- --
  40 -- 51 00 03 00 02 86 e2 92 e2 e0 00  Error: UNC at LBA = 0x286e292e2 = 10852930274

  Commands leading to the command that caused the error were:
  CR FEATR COUNT  LBA_48  LH LM LL DV DC  Powered_Up_Time  Command/Feature_Name
  -- == -- == -- == == == -- -- -- -- --  ---------------  --------------------
  42 00 00 00 04 00 02 86 00 92 e1 e0 00     00:33:41.552  READ VERIFY SECTOR(S) EXT
  42 00 00 00 08 00 02 86 00 92 e1 e0 00     00:33:40.015  READ VERIFY SECTOR(S) EXT
  42 00 00 00 08 00 02 86 00 92 d9 e0 00     00:33:40.000  READ VERIFY SECTOR(S) EXT
  42 00 00 00 10 00 02 86 00 92 d9 e0 00     00:33:38.463  READ VERIFY SECTOR(S) EXT
  42 00 00 00 10 00 02 86 00 92 c9 e0 00     00:33:38.449  READ VERIFY SECTOR(S) EXT

Error 4619 [18] occurred at disk power-on lifetime: 1092 hours (45 days + 12 hours)
  When the command that caused the error occurred, the device was active or idle.

  After command completion occurred, registers were:
  ER -- ST COUNT  LBA_48  LH LM LL DV DC
  -- -- -- == -- == == == -- -- -- -- --
  40 -- 51 00 07 00 02 86 e2 92 e2 e0 00  Error: UNC at LBA = 0x286e292e2 = 10852930274

  Commands leading to the command that caused the error were:
  CR FEATR COUNT  LBA_48  LH LM LL DV DC  Powered_Up_Time  Command/Feature_Name
  -- == -- == -- == == == -- -- -- -- --  ---------------  --------------------
  42 00 00 00 08 00 02 86 00 92 e1 e0 00     00:33:41.552  READ VERIFY SECTOR(S) EXT
  42 00 00 00 08 00 02 86 00 92 d9 e0 00     00:33:40.015  READ VERIFY SECTOR(S) EXT
  42 00 00 00 10 00 02 86 00 92 d9 e0 00     00:33:40.000  READ VERIFY SECTOR(S) EXT
  42 00 00 00 10 00 02 86 00 92 c9 e0 00     00:33:38.463  READ VERIFY SECTOR(S) EXT
  42 00 00 00 20 00 02 86 00 92 c9 e0 00     00:33:38.449  READ VERIFY SECTOR(S) EXT

Error 4618 [17] occurred at disk power-on lifetime: 1092 hours (45 days + 12 hours)
  When the command that caused the error occurred, the device was active or idle.

  After command completion occurred, registers were:
  ER -- ST COUNT  LBA_48  LH LM LL DV DC
  -- -- -- == -- == == == -- -- -- -- --
  40 -- 51 00 07 00 02 86 e2 92 e2 e0 00  Error: UNC at LBA = 0x286e292e2 = 10852930274

  Commands leading to the command that caused the error were:
  CR FEATR COUNT  LBA_48  LH LM LL DV DC  Powered_Up_Time  Command/Feature_Name
  -- == -- == -- == == == -- -- -- -- --  ---------------  --------------------
  42 00 00 00 10 00 02 86 00 92 d9 e0 00     00:33:41.552  READ VERIFY SECTOR(S) EXT
  42 00 00 00 10 00 02 86 00 92 c9 e0 00     00:33:40.015  READ VERIFY SECTOR(S) EXT
  42 00 00 00 20 00 02 86 00 92 c9 e0 00     00:33:40.000  READ VERIFY SECTOR(S) EXT
  42 00 00 00 20 00 02 86 00 92 a9 e0 00     00:33:38.463  READ VERIFY SECTOR(S) EXT
  42 00 00 00 40 00 02 86 00 92 a9 e0 00     00:33:38.449  READ VERIFY SECTOR(S) EXT

Error 4617 [16] occurred at disk power-on lifetime: 1092 hours (45 days + 12 hours)
  When the command that caused the error occurred, the device was active or idle.

  After command completion occurred, registers were:
  ER -- ST COUNT  LBA_48  LH LM LL DV DC
  -- -- -- == -- == == == -- -- -- -- --
  40 -- 51 00 07 00 02 86 e2 92 e2 e0 00  Error: UNC at LBA = 0x286e292e2 = 10852930274

  Commands leading to the command that caused the error were:
  CR FEATR COUNT  LBA_48  LH LM LL DV DC  Powered_Up_Time  Command/Feature_Name
  -- == -- == -- == == == -- -- -- -- --  ---------------  --------------------
  42 00 00 00 20 00 02 86 00 92 c9 e0 00     00:33:36.880  READ VERIFY SECTOR(S) EXT
  42 00 00 00 20 00 02 86 00 92 a9 e0 00     00:33:40.015  READ VERIFY SECTOR(S) EXT
  42 00 00 00 40 00 02 86 00 92 a9 e0 00     00:33:40.000  READ VERIFY SECTOR(S) EXT
  42 00 00 00 40 00 02 86 00 92 69 e0 00     00:33:38.463  READ VERIFY SECTOR(S) EXT
  42 00 00 00 80 00 02 86 00 92 69 e0 00     00:33:38.449  READ VERIFY SECTOR(S) EXT

Error 4616 [15] occurred at disk power-on lifetime: 1092 hours (45 days + 12 hours)
  When the command that caused the error occurred, the device was active or idle.

  After command completion occurred, registers were:
  ER -- ST COUNT  LBA_48  LH LM LL DV DC
  -- -- -- == -- == == == -- -- -- -- --
  40 -- 51 00 03 00 02 86 e2 92 e2 e0 00  Error: UNC at LBA = 0x286e292e2 = 10852930274

  Commands leading to the command that caused the error were:
  CR FEATR COUNT  LBA_48  LH LM LL DV DC  Powered_Up_Time  Command/Feature_Name
  -- == -- == -- == == == -- -- -- -- --  ---------------  --------------------
  42 00 00 00 04 00 02 86 00 92 e1 e0 00     00:33:41.552  READ VERIFY SECTOR(S) EXT
  42 00 00 00 08 00 02 86 00 92 e1 e0 00     00:33:40.015  READ VERIFY SECTOR(S) EXT
  42 00 00 00 08 00 02 86 00 92 d9 e0 00     00:33:40.000  READ VERIFY SECTOR(S) EXT
  42 00 00 00 10 00 02 86 00 92 d9 e0 00     00:33:38.463  READ VERIFY SECTOR(S) EXT
  42 00 00 00 10 00 02 86 00 92 c9 e0 00     00:33:38.449  READ VERIFY SECTOR(S) EXT

Error 4615 [14] occurred at disk power-on lifetime: 1092 hours (45 days + 12 hours)
  When the command that caused the error occurred, the device was active or idle.

  After command completion occurred, registers were:
  ER -- ST COUNT  LBA_48  LH LM LL DV DC
  -- -- -- == -- == == == -- -- -- -- --
  40 -- 51 00 07 00 02 86 e2 92 e2 e0 00  Error: UNC at LBA = 0x286e292e2 = 10852930274

  Commands leading to the command that caused the error were:
  CR FEATR COUNT  LBA_48  LH LM LL DV DC  Powered_Up_Time  Command/Feature_Name
  -- == -- == -- == == == -- -- -- -- --  ---------------  --------------------
  42 00 00 00 08 00 02 86 00 92 e1 e0 00     00:33:41.552  READ VERIFY SECTOR(S) EXT
  42 00 00 00 08 00 02 86 00 92 d9 e0 00     00:33:40.015  READ VERIFY SECTOR(S) EXT
  42 00 00 00 10 00 02 86 00 92 d9 e0 00     00:33:40.000  READ VERIFY SECTOR(S) EXT
  42 00 00 00 10 00 02 86 00 92 c9 e0 00     00:33:38.463  READ VERIFY SECTOR(S) EXT
  42 00 00 00 20 00 02 86 00 92 c9 e0 00     00:33:38.449  READ VERIFY SECTOR(S) EXT

Error 4614 [13] occurred at disk power-on lifetime: 1092 hours (45 days + 12 hours)
  When the command that caused the error occurred, the device was active or idle.

  After command completion occurred, registers were:
  ER -- ST COUNT  LBA_48  LH LM LL DV DC
  -- -- -- == -- == == == -- -- -- -- --
  40 -- 51 00 07 00 02 86 e2 92 e2 e0 00  Error: UNC at LBA = 0x286e292e2 = 10852930274

  Commands leading to the command that caused the error were:
  CR FEATR COUNT  LBA_48  LH LM LL DV DC  Powered_Up_Time  Command/Feature_Name
  -- == -- == -- == == == -- -- -- -- --  ---------------  --------------------
  42 00 00 00 10 00 02 86 00 92 d9 e0 00     00:33:41.552  READ VERIFY SECTOR(S) EXT
  42 00 00 00 10 00 02 86 00 92 c9 e0 00     00:33:40.015  READ VERIFY SECTOR(S) EXT
  42 00 00 00 20 00 02 86 00 92 c9 e0 00     00:33:40.000  READ VERIFY SECTOR(S) EXT
  42 00 00 00 20 00 02 86 00 92 a9 e0 00     00:33:38.463  READ VERIFY SECTOR(S) EXT
  42 00 00 00 40 00 02 86 00 92 a9 e0 00     00:33:38.449  READ VERIFY SECTOR(S) EXT

Error 4613 [12] occurred at disk power-on lifetime: 1092 hours (45 days + 12 hours)
  When the command that caused the error occurred, the device was active or idle.

  After command completion occurred, registers were:
  ER -- ST COUNT  LBA_48  LH LM LL DV DC
  -- -- -- == -- == == == -- -- -- -- --
  40 -- 51 00 07 00 02 86 e2 92 e2 e0 00  Error: UNC at LBA = 0x286e292e2 = 10852930274

  Commands leading to the command that caused the error were:
  CR FEATR COUNT  LBA_48  LH LM LL DV DC  Powered_Up_Time  Command/Feature_Name
  -- == -- == -- == == == -- -- -- -- --  ---------------  --------------------
  42 00 00 00 20 00 02 86 00 92 c9 e0 00     00:33:36.880  READ VERIFY SECTOR(S) EXT
  42 00 00 00 20 00 02 86 00 92 a9 e0 00     00:33:40.015  READ VERIFY SECTOR(S) EXT
  42 00 00 00 40 00 02 86 00 92 a9 e0 00     00:33:40.000  READ VERIFY SECTOR(S) EXT
  42 00 00 00 40 00 02 86 00 92 69 e0 00     00:33:38.463  READ VERIFY SECTOR(S) EXT
  42 00 00 00 80 00 02 86 00 92 69 e0 00     00:33:38.449  READ VERIFY SECTOR(S) EXT

SMART Extended Self-test Log Version: 1 (1 sectors)
Num  Test_Description    Status                  Remaining  LifeTime(hours)  LBA_of_first_error
# 1  Extended offline    Interrupted (host reset)      80%      3372         -
# 2  Short offline       Completed without error       00%      3175         -
# 3  Short offline       Interrupted (host reset)      90%      3151         -
# 4  Extended offline    Interrupted (host reset)      90%      3102         -
# 5  Extended offline    Interrupted (host reset)      90%      3086         -
# 6  Short offline       Completed without error       00%      3008         -
# 7  Extended offline    Aborted by host               90%      2968         -
# 8  Extended offline    Aborted by host               90%      2893         -
# 9  Extended offline    Aborted by host               70%      2886         -
#10  Short offline       Completed without error       00%      2785         -
#11  Short offline       Completed without error       00%      2744         -
#12  Extended offline    Interrupted (host reset)      80%      2727         -
#13  Extended offline    Aborted by host               70%      2684         -
#14  Extended offline    Aborted by host               70%      2573         -
#15  Extended offline    Aborted by host               90%      2483         -
#16  Short offline       Completed without error       00%      2455         -
#17  Short offline       Interrupted (host reset)      70%      2437         -
#18  Short offline       Completed without error       00%      2399         -
#19  Extended offline    Self-test routine in progress 90%      3447         -

SMART Selective self-test log data structure revision number 1
 SPAN  MIN_LBA  MAX_LBA  CURRENT_TEST_STATUS
    1        0        0  Not_testing
    2        0        0  Not_testing
    3        0        0  Not_testing
    4        0        0  Not_testing
    5        0        0  Not_testing
Selective self-test flags (0x0):
  After scanning selected spans, do NOT read-scan remainder of disk.
If Selective self-test is pending on power-up, resume after 0 minute delay.

SCT Commands not supported

Device Statistics (GP/SMART Log 0x04) not supported

Pending Defects log (GP Log 0x0c) not supported

SATA Phy Event Counters (GP Log 0x11)
ID      Size     Value  Description
0x000a  2            2  Device-to-host register FISes sent due to a COMRESET
0x0001  2            0  Command failed due to ICRC error
0x0003  2            0  R_ERR response for device-to-host data FIS
0x0004  2            0  R_ERR response for host-to-device data FIS
0x0006  2            0  R_ERR response for device-to-host non-data FIS
0x0007  2            0  R_ERR response for host-to-device non-data FIS

