=== START OF INFORMATION SECTION ===
Model Family:     Western Digital Caviar Green
Device Model:     WDC WD5000AADS-00S9B0
Serial Number:    --
LU WWN Device Id: 5 0014ee ...
Firmware Version: 01.00A01
User Capacity:    500,107,862,016 bytes [500 GB]
Sector Size:      512 bytes logical/physical
Device is:        In smartctl database [for details use: -P show]
ATA Version is:   ATA8-ACS (minor revision not indicated)
SATA Version is:  SATA 2.6, 3.0 Gb/s
Local Time is:    Wed Jul 15 18:01:41 2020 CEST
SMART support is: Available - device has SMART capability.
SMART support is: Enabled
AAM feature is:   Disabled
APM feature is:   Unavailable
Rd look-ahead is: Enabled
Write cache is:   Enabled
DSN feature is:   Unavailable
ATA Security is:  Disabled, frozen [SEC2]
Wt Cache Reorder: Enabled

=== START OF READ SMART DATA SECTION ===
SMART overall-health self-assessment test result: PASSED

General SMART Values:
Offline data collection status:  (0x82)	Offline data collection activity
					was completed without error.
					Auto Offline Data Collection: Enabled.
Self-test execution status:      (   0)	The previous self-test routine completed
					without error or no self-test has ever 
					been run.
Total time to complete Offline 
data collection: 		(11160) seconds.
Offline data collection
capabilities: 			 (0x7b) SMART execute Offline immediate.
					Auto Offline data collection on/off support.
					Suspend Offline collection upon new
					command.
					Offline surface scan supported.
					Self-test supported.
					Conveyance Self-test supported.
					Selective Self-test supported.
SMART capabilities:            (0x0003)	Saves SMART data before entering
					power-saving mode.
					Supports SMART auto save timer.
Error logging capability:        (0x01)	Error logging supported.
					General Purpose Logging supported.
Short self-test routine 
recommended polling time: 	 (   2) minutes.
Extended self-test routine
recommended polling time: 	 ( 131) minutes.
Conveyance self-test routine
recommended polling time: 	 (   5) minutes.
SCT capabilities: 	       (0x3037)	SCT Status supported.
					SCT Feature Control supported.
					SCT Data Table supported.

SMART Attributes Data Structure revision number: 16
Vendor Specific SMART Attributes with Thresholds:
ID# ATTRIBUTE_NAME          FLAGS    VALUE WORST THRESH FAIL RAW_VALUE
  1 Raw_Read_Error_Rate     POSR-K   200   200   051    -    87
  3 Spin_Up_Time            POS--K   190   187   021    -    3475
  4 Start_Stop_Count        -O--CK   083   083   000    -    17431
  5 Reallocated_Sector_Ct   PO--CK   200   200   140    -    0
  7 Seek_Error_Rate         -OSR-K   100   253   000    -    0
  9 Power_On_Hours          -O--CK   068   068   000    -    23372
 10 Spin_Retry_Count        -O--CK   100   100   000    -    0
 11 Calibration_Retry_Count -O--CK   100   100   000    -    0
 12 Power_Cycle_Count       -O--CK   089   089   000    -    11661
192 Power-Off_Retract_Count -O--CK   200   200   000    -    124
193 Load_Cycle_Count        -O--CK   001   001   000    -    597879
194 Temperature_Celsius     -O---K   107   089   000    -    36
196 Reallocated_Event_Count -O--CK   200   200   000    -    0
197 Current_Pending_Sector  -O--CK   200   200   000    -    0
198 Offline_Uncorrectable   ----CK   200   200   000    -    0
199 UDMA_CRC_Error_Count    -O--CK   200   200   000    -    6
200 Multi_Zone_Error_Rate   ---R--   200   200   000    -    0
                            ||||||_ K auto-keep
                            |||||__ C event count
                            ||||___ R error rate
                            |||____ S speed/performance
                            ||_____ O updated online
                            |______ P prefailure warning

General Purpose Log Directory Version 1
SMART           Log Directory Version 1 [multi-sector log support]
Address    Access  R/W   Size  Description
0x00       GPL,SL  R/O      1  Log Directory
0x01           SL  R/O      1  Summary SMART error log
0x02           SL  R/O      5  Comprehensive SMART error log
0x03       GPL     R/O      6  Ext. Comprehensive SMART error log
0x06           SL  R/O      1  SMART self-test log
0x07       GPL     R/O      1  Extended self-test log
0x09           SL  R/W      1  Selective self-test log
0x10       GPL     R/O      1  NCQ Command Error log
0x11       GPL     R/O      1  SATA Phy Event Counters log
0x80-0x9f  GPL,SL  R/W     16  Host vendor specific log
0xa0-0xa7  GPL,SL  VS      16  Device vendor specific log
0xa8-0xb7  GPL,SL  VS       1  Device vendor specific log
0xc0       GPL,SL  VS       1  Device vendor specific log
0xc1       GPL     VS      24  Device vendor specific log
0xe0       GPL,SL  R/W      1  SCT Command/Status
0xe1       GPL,SL  R/W      1  SCT Data Transfer

SMART Extended Comprehensive Error Log Version: 1 (6 sectors)
Device Error Count: 88 (device log contains only the most recent 24 errors)
	CR     = Command Register
	FEATR  = Features Register
	COUNT  = Count (was: Sector Count) Register
	LBA_48 = Upper bytes of LBA High/Mid/Low Registers ]  ATA-8
	LH     = LBA High (was: Cylinder High) Register    ]   LBA
	LM     = LBA Mid (was: Cylinder Low) Register      ] Register
	LL     = LBA Low (was: Sector Number) Register     ]
	DV     = Device (was: Device/Head) Register
	DC     = Device Control Register
	ER     = Error register
	ST     = Status register
Powered_Up_Time is measured from power on, and printed as
DDd+hh:mm:SS.sss where DD=days, hh=hours, mm=minutes,
SS=sec, and sss=millisec. It "wraps" after 49.710 days.

Error 88 [15] occurred at disk power-on lifetime: 6113 hours (254 days + 17 hours)
  When the command that caused the error occurred, the device was active or idle.

  After command completion occurred, registers were:
  ER -- ST COUNT  LBA_48  LH LM LL DV DC
  -- -- -- == -- == == == -- -- -- -- --
  40 -- 51 00 20 00 7e 00 c8 00 c0 e0 00  Error: UNC 32 sectors at LBA = 0x7e00c800c0 = 541178986688

  Commands leading to the command that caused the error were:
  CR FEATR COUNT  LBA_48  LH LM LL DV DC  Powered_Up_Time  Command/Feature_Name
  -- == -- == -- == == == -- -- -- -- --  ---------------  --------------------
  25 00 00 00 20 00 7e 00 c8 00 c0 e0 00     00:22:18.579  READ DMA EXT
  35 00 00 00 20 00 1b 00 5a 03 e0 e0 00     00:22:18.579  WRITE DMA EXT
  25 00 00 00 20 00 7e 00 c8 00 a0 e0 00     00:22:18.579  READ DMA EXT
  35 00 00 00 20 00 1b 00 5a 03 c0 e0 00     00:22:18.578  WRITE DMA EXT
  25 00 00 00 20 00 7e 00 c8 00 80 e0 00     00:22:18.578  READ DMA EXT

Error 87 [14] occurred at disk power-on lifetime: 6100 hours (254 days + 4 hours)
  When the command that caused the error occurred, the device was active or idle.

  After command completion occurred, registers were:
  ER -- ST COUNT  LBA_48  LH LM LL DV DC
  -- -- -- == -- == == == -- -- -- -- --
  40 -- 51 01 00 00 7e 00 c8 00 68 e0 00  Error: UNC 256 sectors at LBA = 0x7e00c80068 = 541178986600

  Commands leading to the command that caused the error were:
  CR FEATR COUNT  LBA_48  LH LM LL DV DC  Powered_Up_Time  Command/Feature_Name
  -- == -- == -- == == == -- -- -- -- --  ---------------  --------------------
  25 00 00 01 00 00 7e 00 c8 00 68 e0 00     00:50:04.497  READ DMA EXT
  25 00 00 01 00 00 7e 00 c7 00 68 e0 00     00:50:04.497  READ DMA EXT
  35 00 00 00 08 00 6b 00 3f 00 98 e0 00     00:50:04.455  WRITE DMA EXT
  35 00 00 00 20 00 38 00 ed 06 40 e0 00     00:50:04.455  WRITE DMA EXT
  35 00 00 00 20 00 3c 00 6b 06 60 e0 00     00:50:04.454  WRITE DMA EXT

Error 86 [13] occurred at disk power-on lifetime: 6100 hours (254 days + 4 hours)
  When the command that caused the error occurred, the device was active or idle.

  After command completion occurred, registers were:
  ER -- ST COUNT  LBA_48  LH LM LL DV DC
  -- -- -- == -- == == == -- -- -- -- --
  40 -- 51 00 20 00 7e 00 c8 00 c0 e0 00  Error: UNC 32 sectors at LBA = 0x7e00c800c0 = 541178986688

  Commands leading to the command that caused the error were:
  CR FEATR COUNT  LBA_48  LH LM LL DV DC  Powered_Up_Time  Command/Feature_Name
  -- == -- == -- == == == -- -- -- -- --  ---------------  --------------------
  25 00 00 00 20 00 7e 00 c8 00 c0 e0 00     00:50:01.505  READ DMA EXT
  35 00 00 00 20 00 62 00 e2 00 00 e0 00     00:50:01.505  WRITE DMA EXT
  25 00 00 00 20 00 7e 00 c8 00 a0 e0 00     00:50:01.504  READ DMA EXT
  35 00 00 00 20 00 62 00 e1 00 e0 e0 00     00:50:01.504  WRITE DMA EXT
  25 00 00 00 20 00 7e 00 c8 00 80 e0 00     00:50:01.504  READ DMA EXT

Error 85 [12] occurred at disk power-on lifetime: 6100 hours (254 days + 4 hours)
  When the command that caused the error occurred, the device was active or idle.

  After command completion occurred, registers were:
  ER -- ST COUNT  LBA_48  LH LM LL DV DC
  -- -- -- == -- == == == -- -- -- -- --
  40 -- 51 01 00 00 7e 00 c8 00 68 e0 00  Error: UNC 256 sectors at LBA = 0x7e00c80068 = 541178986600

  Commands leading to the command that caused the error were:
  CR FEATR COUNT  LBA_48  LH LM LL DV DC  Powered_Up_Time  Command/Feature_Name
  -- == -- == -- == == == -- -- -- -- --  ---------------  --------------------
  25 00 00 01 00 00 7e 00 c8 00 68 e0 00     00:49:27.352  READ DMA EXT
  25 00 00 01 00 00 7e 00 c7 00 68 e0 00     00:49:27.352  READ DMA EXT
  ea 00 00 00 00 66 00 83 00 a7 00 e0 00     00:49:27.324  FLUSH CACHE EXT
  35 00 00 00 08 00 66 00 83 00 a0 e0 00     00:49:27.324  WRITE DMA EXT
  35 00 00 00 10 00 8d 00 fe 08 98 e0 00     00:49:27.323  WRITE DMA EXT

Error 84 [11] occurred at disk power-on lifetime: 6100 hours (254 days + 4 hours)
  When the command that caused the error occurred, the device was active or idle.

  After command completion occurred, registers were:
  ER -- ST COUNT  LBA_48  LH LM LL DV DC
  -- -- -- == -- == == == -- -- -- -- --
  40 -- 51 00 20 00 7e 00 c8 00 c0 e0 00  Error: UNC 32 sectors at LBA = 0x7e00c800c0 = 541178986688

  Commands leading to the command that caused the error were:
  CR FEATR COUNT  LBA_48  LH LM LL DV DC  Powered_Up_Time  Command/Feature_Name
  -- == -- == -- == == == -- -- -- -- --  ---------------  --------------------
  25 00 00 00 20 00 7e 00 c8 00 c0 e0 00     00:49:24.577  READ DMA EXT
  35 00 00 00 20 00 46 00 4a 00 a0 e0 00     00:49:24.577  WRITE DMA EXT
  25 00 00 00 20 00 7e 00 c8 00 a0 e0 00     00:49:24.576  READ DMA EXT
  35 00 00 00 20 00 46 00 4a 00 80 e0 00     00:49:24.576  WRITE DMA EXT
  25 00 00 00 20 00 7e 00 c8 00 80 e0 00     00:49:24.576  READ DMA EXT

Error 83 [10] occurred at disk power-on lifetime: 6100 hours (254 days + 4 hours)
  When the command that caused the error occurred, the device was active or idle.

  After command completion occurred, registers were:
  ER -- ST COUNT  LBA_48  LH LM LL DV DC
  -- -- -- == -- == == == -- -- -- -- --
  40 -- 51 01 00 00 7e 00 c8 00 68 e0 00  Error: UNC 256 sectors at LBA = 0x7e00c80068 = 541178986600

  Commands leading to the command that caused the error were:
  CR FEATR COUNT  LBA_48  LH LM LL DV DC  Powered_Up_Time  Command/Feature_Name
  -- == -- == -- == == == -- -- -- -- --  ---------------  --------------------
  25 00 00 01 00 00 7e 00 c8 00 68 e0 00     00:49:19.360  READ DMA EXT
  25 00 00 01 00 00 7e 00 c7 00 68 e0 00     00:49:19.359  READ DMA EXT
  35 00 00 00 08 00 6a 00 92 00 88 e0 00     00:49:19.310  WRITE DMA EXT
  35 00 00 00 10 00 3c 00 92 00 20 e0 00     00:49:19.309  WRITE DMA EXT
  25 00 00 00 20 00 7e 00 c8 00 c0 e0 00     00:49:16.738  READ DMA EXT

Error 82 [9] occurred at disk power-on lifetime: 6100 hours (254 days + 4 hours)
  When the command that caused the error occurred, the device was active or idle.

  After command completion occurred, registers were:
  ER -- ST COUNT  LBA_48  LH LM LL DV DC
  -- -- -- == -- == == == -- -- -- -- --
  40 -- 51 00 20 00 7e 00 c8 00 c0 e0 00  Error: UNC 32 sectors at LBA = 0x7e00c800c0 = 541178986688

  Commands leading to the command that caused the error were:
  CR FEATR COUNT  LBA_48  LH LM LL DV DC  Powered_Up_Time  Command/Feature_Name
  -- == -- == -- == == == -- -- -- -- --  ---------------  --------------------
  25 00 00 00 20 00 7e 00 c8 00 c0 e0 00     00:49:16.738  READ DMA EXT
  35 00 00 00 20 00 60 00 c6 03 00 e0 00     00:49:16.738  WRITE DMA EXT
  25 00 00 00 20 00 7e 00 c8 00 a0 e0 00     00:49:16.737  READ DMA EXT
  35 00 00 00 20 00 60 00 c5 03 e0 e0 00     00:49:16.737  WRITE DMA EXT
  25 00 00 00 20 00 7e 00 c8 00 80 e0 00     00:49:16.737  READ DMA EXT

Error 81 [8] occurred at disk power-on lifetime: 6100 hours (254 days + 4 hours)
  When the command that caused the error occurred, the device was active or idle.

  After command completion occurred, registers were:
  ER -- ST COUNT  LBA_48  LH LM LL DV DC
  -- -- -- == -- == == == -- -- -- -- --
  40 -- 51 01 00 00 7e 00 c8 00 68 e0 00  Error: UNC 256 sectors at LBA = 0x7e00c80068 = 541178986600

  Commands leading to the command that caused the error were:
  CR FEATR COUNT  LBA_48  LH LM LL DV DC  Powered_Up_Time  Command/Feature_Name
  -- == -- == -- == == == -- -- -- -- --  ---------------  --------------------
  25 00 00 01 00 00 7e 00 c8 00 68 e0 00     00:48:52.414  READ DMA EXT
  25 00 00 01 00 00 7e 00 c7 00 68 e0 00     00:48:52.414  READ DMA EXT
  ea 00 00 00 00 66 00 83 00 a7 00 e0 00     00:48:52.381  FLUSH CACHE EXT
  35 00 00 00 08 00 66 00 83 00 a0 e0 00     00:48:52.381  WRITE DMA EXT
  35 00 00 00 01 00 8c 00 e0 08 30 e0 00     00:48:52.380  WRITE DMA EXT

SMART Extended Self-test Log Version: 1 (1 sectors)
No self-tests have been logged.  [To run self-tests, use: smartctl -t]

SMART Selective self-test log data structure revision number 1
 SPAN  MIN_LBA  MAX_LBA  CURRENT_TEST_STATUS
    1        0        0  Not_testing
    2        0        0  Not_testing
    3        0        0  Not_testing
    4        0        0  Not_testing
    5        0        0  Not_testing
Selective self-test flags (0x0):
  After scanning selected spans, do NOT read-scan remainder of disk.
If Selective self-test is pending on power-up, resume after 0 minute delay.

SCT Status Version:                  2
SCT Version (vendor specific):       258 (0x0102)
Device State:                        Active (0)
Current Temperature:                    35 Celsius
Power Cycle Min/Max Temperature:     23/36 Celsius
Lifetime    Min/Max Temperature:     23/54 Celsius
Under/Over Temperature Limit Count:   0/0

SCT Temperature History Version:     2
Temperature Sampling Period:         1 minute
Temperature Logging Interval:        1 minute
Min/Max recommended Temperature:      0/60 Celsius
Min/Max Temperature Limit:           -41/85 Celsius
Temperature History Size (Index):    478 (203)

SCT Error Recovery Control command not supported

Device Statistics (GP/SMART Log 0x04) not supported

Pending Defects log (GP Log 0x0c) not supported

SATA Phy Event Counters (GP Log 0x11)
ID      Size     Value  Description
0x0001  2            0  Command failed due to ICRC error
0x0002  2            0  R_ERR response for data FIS
0x0003  2            0  R_ERR response for device-to-host data FIS
0x0004  2            0  R_ERR response for host-to-device data FIS
0x0005  2            0  R_ERR response for non-data FIS
0x0006  2            0  R_ERR response for device-to-host non-data FIS
0x0007  2            0  R_ERR response for host-to-device non-data FIS
0x000a  2            6  Device-to-host register FISes sent due to a COMRESET
0x000b  2            0  CRC errors within host-to-device FIS
0x8000  4         6102  Vendor specific



