=== START OF INFORMATION SECTION ===
Model Number:                       KINGSTON SKC1000480G
Serial Number:                      --
Firmware Version:                   E7FT04.9
PCI Vendor/Subsystem ID:            0x1987
IEEE OUI Identifier:                0x6479a7
Controller ID:                      0
Number of Namespaces:               1
Namespace 1 Size/Capacity:          480,103,981,056 [480 GB]
Namespace 1 Formatted LBA Size:     512
Local Time is:                      Mon Feb 17 06:43:22 2020 CET
Firmware Updates (0x02):            1 Slot
Optional Admin Commands (0x0007):   Security Format Frmw_DL
Optional NVM Commands (0x001e):     Wr_Unc DS_Mngmt Wr_Zero Sav/Sel_Feat
Maximum Data Transfer Size:         512 Pages
Warning  Comp. Temp. Threshold:     110 Celsius
Critical Comp. Temp. Threshold:     130 Celsius

Supported Power States
St Op     Max   Active     Idle   RL RT WL WT  Ent_Lat  Ex_Lat
 0 +     7.90W       -        -    0  0  0  0        0       0
 1 +     2.40W       -        -    1  1  1  1      600     600
 2 +     1.90W       -        -    2  2  2  2      600     600
 3 -   0.1100W       -        -    3  3  3  3      600     600
 4 -   0.0050W       -        -    4  4  4  4   100000  160000

Supported LBA Sizes (NSID 0x1)
Id Fmt  Data  Metadt  Rel_Perf
 0 +     512       0         1
 1 -    4096       0         0

=== START OF SMART DATA SECTION ===
SMART overall-health self-assessment test result: PASSED

SMART/Health Information (NVMe Log 0x02)
Critical Warning:                   0x00
Temperature:                        47 Celsius
Available Spare:                    100%
Available Spare Threshold:          1%
Percentage Used:                    0%
Data Units Read:                    29,423,962 [15.0 TB]
Data Units Written:                 10,545,346 [5.39 TB]
Host Read Commands:                 228,440,352
Host Write Commands:                102,920,369
Controller Busy Time:               651
Power Cycles:                       2,314
Power On Hours:                     3,866
Unsafe Shutdowns:                   1,513
Media and Data Integrity Errors:    0
Error Information Log Entries:      1,341
Warning  Comp. Temperature Time:    0
Critical Comp. Temperature Time:    0
Temperature Sensor 2:               92 Celsius

Error Information (NVMe Log 0x01, max 64 entries)
Num   ErrCount  SQId   CmdId  Status  PELoc          LBA  NSID    VS
  0       1341     0  0x000a  0x4004      - 8796109799680     1     -
  1       1340     0  0x0019  0x4004      - 8796109799680     1     -
  2       1339     0  0x0017  0x4004      -            0     1     -
  3       1338     0  0x0016  0x4004      -            0     1     -
  4       1337     0  0x0002  0x4004      -          208     1     -
  5       1336     0  0x0013  0x4004      - 8796109799680     1     -
  6       1335     0  0x0017  0x4004      -            0     1     -
  7       1334     0  0x0016  0x4004      -            0     1     -
  8       1333     0  0x0002  0x4004      -          208     1     -
  9       1332     0  0x0012  0x4004      - 8796109799680     1     -
 10       1331     0  0x0017  0x4004      -            0     1     -
 11       1330     0  0x0016  0x4004      -            0     1     -
 12       1329     0  0x0002  0x4004      -          208     1     -
 13       1328     0  0x0017  0x4004      -            0     1     -
 14       1327     0  0x0016  0x4004      -            0     1     -
 15       1326     0  0x0002  0x4004      -          208     1     -
... (47 entries not shown)

