smartctl 7.3 2022-02-28 r5338 [x86_64-linux-5.18.8.xm1-1.klp-xanmod-rosa2021.1-x86_64] (local build)
Copyright (C) 2002-22, Bruce Allen, Christian Franke, www.smartmontools.org

=== START OF INFORMATION SECTION ===
Model Family:     Fujitsu MHZ BH
Device Model:     FUJITSU MHZ2320BH G1
Serial Number:    --
LU WWN Device Id: 5 00000e ...
Firmware Version: 00000009
User Capacity:    320,072,933,376 bytes [320 GB]
Sector Size:      512 bytes logical/physical
Device is:        In smartctl database 7.3/5319
ATA Version is:   ATA8-ACS T13/1699-D revision 3f
SATA Version is:  SATA 2.5, 1.5 Gb/s
Local Time is:    Sat Jul  2 09:03:19 2022 +05
SMART support is: Available - device has SMART capability.
SMART support is: Enabled
AAM feature is:   Disabled
APM level is:     128 (minimum power consumption without standby)
Rd look-ahead is: Enabled
Write cache is:   Enabled
DSN feature is:   Unavailable
ATA Security is:  Disabled, frozen [SEC2]
Wt Cache Reorder: Enabled

=== START OF READ SMART DATA SECTION ===
SMART overall-health self-assessment test result: PASSED

General SMART Values:
Offline data collection status:  (0x80)	Offline data collection activity
					was never started.
					Auto Offline Data Collection: Enabled.
Self-test execution status:      (   0)	The previous self-test routine completed
					without error or no self-test has ever 
					been run.
Total time to complete Offline 
data collection: 		( 1298) seconds.
Offline data collection
capabilities: 			 (0x7b) SMART execute Offline immediate.
					Auto Offline data collection on/off support.
					Suspend Offline collection upon new
					command.
					Offline surface scan supported.
					Self-test supported.
					Conveyance Self-test supported.
					Selective Self-test supported.
SMART capabilities:            (0x0003)	Saves SMART data before entering
					power-saving mode.
					Supports SMART auto save timer.
Error logging capability:        (0x01)	Error logging supported.
					General Purpose Logging supported.
Short self-test routine 
recommended polling time: 	 (   2) minutes.
Extended self-test routine
recommended polling time: 	 ( 184) minutes.
Conveyance self-test routine
recommended polling time: 	 (   2) minutes.
SCT capabilities: 	       (0x003d)	SCT Status supported.
					SCT Error Recovery Control supported.
					SCT Feature Control supported.
					SCT Data Table supported.

SMART Attributes Data Structure revision number: 16
Vendor Specific SMART Attributes with Thresholds:
ID# ATTRIBUTE_NAME          FLAGS    VALUE WORST THRESH FAIL RAW_VALUE
  1 Raw_Read_Error_Rate     POSR--   100   100   046    -    18746
  2 Throughput_Performance  P-S---   100   100   030    -    52167539
  3 Spin_Up_Time            PO----   100   100   025    -    1
  4 Start_Stop_Count        -O--CK   097   097   000    -    10321
  5 Reallocated_Sector_Ct   PO--CK   100   100   024    -    2 (1998 2)
  7 Seek_Error_Rate         POSR--   100   100   047    -    3188
  8 Seek_Time_Performance   P-S---   100   100   019    -    0
  9 Power_On_Hours          -O--CK   021   021   000    -    39601
 10 Spin_Retry_Count        PO--C-   100   100   020    -    0
 12 Power_Cycle_Count       -O--CK   099   099   000    -    7106
192 Power-Off_Retract_Count -O--CK   095   095   000    -    1387
193 Load_Cycle_Count        -O--CK   086   086   000    -    292520
194 Temperature_Celsius     -O---K   100   055   000    -    29 (Min/Max 3/69)
195 Hardware_ECC_Recovered  -O-RC-   100   100   000    -    46
196 Reallocated_Event_Count -O--CK   100   100   000    -    2 (0 6594)
197 Current_Pending_Sector  -O--C-   100   091   000    -    0
198 Offline_Uncorrectable   ----C-   082   082   000    -    37
199 UDMA_CRC_Error_Count    -OSRCK   200   253   000    -    11
200 Multi_Zone_Error_Rate   POSR--   100   100   060    -    21968
203 Run_Out_Cancel          -O----   100   100   000    -    1529114984973
240 Head_Flying_Hours       -OSRCK   200   200   000    -    0
                            ||||||_ K auto-keep
                            |||||__ C event count
                            ||||___ R error rate
                            |||____ S speed/performance
                            ||_____ O updated online
                            |______ P prefailure warning

General Purpose Log Directory Version 1
SMART           Log Directory Version 1 [multi-sector log support]
Address    Access  R/W   Size  Description
0x00       GPL,SL  R/O      1  Log Directory
0x01       GPL,SL  R/O      1  Summary SMART error log
0x02       GPL,SL  R/O     51  Comprehensive SMART error log
0x03       GPL,SL  R/O     64  Ext. Comprehensive SMART error log
0x06       GPL,SL  R/O      1  SMART self-test log
0x07       GPL,SL  R/O      2  Extended self-test log
0x09       GPL,SL  R/W      1  Selective self-test log
0x10       GPL,SL  R/O      1  NCQ Command Error log
0x11       GPL,SL  R/O      1  SATA Phy Event Counters log
0x23       GPL,SL  R/O      1  Delayed sector log [OBS-8]
0x80-0x9f  GPL,SL  R/W     16  Host vendor specific log
0xa1       GPL,SL  VS       1  Device vendor specific log

SMART Extended Comprehensive Error Log Version: 1 (64 sectors)
Device Error Count: 12493 (device log contains only the most recent 256 errors)
	CR     = Command Register
	FEATR  = Features Register
	COUNT  = Count (was: Sector Count) Register
	LBA_48 = Upper bytes of LBA High/Mid/Low Registers ]  ATA-8
	LH     = LBA High (was: Cylinder High) Register    ]   LBA
	LM     = LBA Mid (was: Cylinder Low) Register      ] Register
	LL     = LBA Low (was: Sector Number) Register     ]
	DV     = Device (was: Device/Head) Register
	DC     = Device Control Register
	ER     = Error register
	ST     = Status register
Powered_Up_Time is measured from power on, and printed as
DDd+hh:mm:SS.sss where DD=days, hh=hours, mm=minutes,
SS=sec, and sss=millisec. It "wraps" after 49.710 days.

Error 12493 [204] occurred at disk power-on lifetime: 39074 hours (1628 days + 2 hours)
  When the command that caused the error occurred, the device was active or idle.

  After command completion occurred, registers were:
  ER -- ST COUNT  LBA_48  LH LM LL DV DC
  -- -- -- == -- == == == -- -- -- -- --
  40 -- 41 00 eb 00 00 d7 00 42 ab 40 00  Error: UNC at LBA = 0xd70042ab = 3607118507

  Commands leading to the command that caused the error were:
  CR FEATR COUNT  LBA_48  LH LM LL DV DC  Powered_Up_Time  Command/Feature_Name
  -- == -- == -- == == == -- -- -- -- --  ---------------  --------------------
  60 00 08 00 e8 00 00 d7 00 42 a8 40 00     08:06:23.447  READ FPDMA QUEUED
  00 00 08 00 01 00 00 00 00 00 01 00 ff     08:06:22.667  NOP [Reserved subcommand] [OBS-ACS-2]
  60 00 08 00 e0 00 00 d7 00 42 a8 40 00     08:06:18.043  READ FPDMA QUEUED
  60 00 08 00 d8 00 00 cb 00 08 c0 40 00     08:06:18.042  READ FPDMA QUEUED
  60 00 08 00 d0 00 00 d7 00 42 b0 40 00     08:06:18.025  READ FPDMA QUEUED

Error 12492 [203] occurred at disk power-on lifetime: 39074 hours (1628 days + 2 hours)
  When the command that caused the error occurred, the device was active or idle.

  After command completion occurred, registers were:
  ER -- ST COUNT  LBA_48  LH LM LL DV DC
  -- -- -- == -- == == == -- -- -- -- --
  40 -- 41 00 e3 00 00 d7 00 42 ab 40 00  Error: UNC at LBA = 0xd70042ab = 3607118507

  Commands leading to the command that caused the error were:
  CR FEATR COUNT  LBA_48  LH LM LL DV DC  Powered_Up_Time  Command/Feature_Name
  -- == -- == -- == == == -- -- -- -- --  ---------------  --------------------
  60 00 08 00 e0 00 00 d7 00 42 a8 40 00     08:06:18.043  READ FPDMA QUEUED
  60 00 08 00 d8 00 00 cb 00 08 c0 40 00     08:06:18.042  READ FPDMA QUEUED
  60 00 08 00 d0 00 00 d7 00 42 b0 40 00     08:06:18.025  READ FPDMA QUEUED
  60 00 08 00 c8 00 00 c6 00 60 c8 40 00     08:06:18.011  READ FPDMA QUEUED
  60 00 08 00 c0 00 00 57 00 43 90 40 00     08:06:18.001  READ FPDMA QUEUED

Error 12491 [202] occurred at disk power-on lifetime: 36432 hours (1518 days + 0 hours)
  When the command that caused the error occurred, the device was active or idle.

  After command completion occurred, registers were:
  ER -- ST COUNT  LBA_48  LH LM LL DV DC
  -- -- -- == -- == == == -- -- -- -- --
  40 -- 41 00 bb 00 00 14 00 04 d5 40 00  Error: UNC at LBA = 0x140004d5 = 335545557

  Commands leading to the command that caused the error were:
  CR FEATR COUNT  LBA_48  LH LM LL DV DC  Powered_Up_Time  Command/Feature_Name
  -- == -- == -- == == == -- -- -- -- --  ---------------  --------------------
  60 00 08 00 18 00 06 ad 00 78 90 40 00     08:06:19.829  READ FPDMA QUEUED
  60 00 a8 00 10 00 00 6d 00 13 a8 40 00     08:06:19.828  READ FPDMA QUEUED
  60 01 00 00 08 00 00 6c 00 13 a8 40 00     08:06:19.828  READ FPDMA QUEUED
  60 01 00 00 f8 00 00 6b 00 13 a8 40 00     08:06:19.828  READ FPDMA QUEUED
  60 01 00 00 f0 00 00 6a 00 13 a8 40 00     08:06:19.828  READ FPDMA QUEUED

Error 12490 [201] occurred at disk power-on lifetime: 36432 hours (1518 days + 0 hours)
  When the command that caused the error occurred, the device was active or idle.

  After command completion occurred, registers were:
  ER -- ST COUNT  LBA_48  LH LM LL DV DC
  -- -- -- == -- == == == -- -- -- -- --
  40 -- 41 00 2b 00 06 ad 00 78 90 40 00  Error: WP at LBA = 0x6ad007890 = 28672293008

  Commands leading to the command that caused the error were:
  CR FEATR COUNT  LBA_48  LH LM LL DV DC  Powered_Up_Time  Command/Feature_Name
  -- == -- == -- == == == -- -- -- -- --  ---------------  --------------------
  61 00 30 00 b0 00 00 1f 00 01 18 40 00     08:06:15.140  WRITE FPDMA QUEUED
  60 01 00 00 a8 00 00 64 00 13 a8 40 00     08:06:14.927  READ FPDMA QUEUED
  60 01 00 00 a0 00 00 63 00 13 a8 40 00     08:06:14.927  READ FPDMA QUEUED
  60 01 00 00 98 00 00 62 00 13 a8 40 00     08:06:14.927  READ FPDMA QUEUED
  60 01 00 00 90 00 00 61 00 13 a8 40 00     08:06:14.927  READ FPDMA QUEUED

Error 12489 [200] occurred at disk power-on lifetime: 36432 hours (1518 days + 0 hours)
  When the command that caused the error occurred, the device was active or idle.

  After command completion occurred, registers were:
  ER -- ST COUNT  LBA_48  LH LM LL DV DC
  -- -- -- == -- == == == -- -- -- -- --
  40 -- 41 00 93 00 06 ad 00 78 90 40 00  Error: UNC at LBA = 0x6ad007890 = 28672293008

  Commands leading to the command that caused the error were:
  CR FEATR COUNT  LBA_48  LH LM LL DV DC  Powered_Up_Time  Command/Feature_Name
  -- == -- == -- == == == -- -- -- -- --  ---------------  --------------------
  60 01 00 00 18 00 00 54 00 13 a8 40 00     08:06:10.148  READ FPDMA QUEUED
  60 01 00 00 10 00 00 53 00 13 a8 40 00     08:06:10.148  READ FPDMA QUEUED
  60 01 00 00 08 00 00 52 00 13 a8 40 00     08:06:10.148  READ FPDMA QUEUED
  60 01 00 00 f8 00 00 51 00 13 a8 40 00     08:06:10.148  READ FPDMA QUEUED
  60 01 00 00 f0 00 00 50 00 13 a8 40 00     08:06:10.148  READ FPDMA QUEUED

Error 12488 [199] occurred at disk power-on lifetime: 36432 hours (1518 days + 0 hours)
  When the command that caused the error occurred, the device was active or idle.

  After command completion occurred, registers were:
  ER -- ST COUNT  LBA_48  LH LM LL DV DC
  -- -- -- == -- == == == -- -- -- -- --
  40 -- 41 00 73 00 00 26 00 13 a7 40 00  Error: UNC at LBA = 0x260013a7 = 637539239

  Commands leading to the command that caused the error were:
  CR FEATR COUNT  LBA_48  LH LM LL DV DC  Powered_Up_Time  Command/Feature_Name
  -- == -- == -- == == == -- -- -- -- --  ---------------  --------------------
  60 01 00 00 70 00 00 43 00 13 a8 40 00     08:06:05.344  READ FPDMA QUEUED
  60 00 08 00 68 00 06 ad 00 78 90 40 00     08:06:05.329  READ FPDMA QUEUED
  60 01 00 00 60 00 00 42 00 13 a8 40 00     08:06:05.329  READ FPDMA QUEUED
  60 01 00 00 58 00 00 41 00 13 a8 40 00     08:06:05.329  READ FPDMA QUEUED
  60 01 00 00 50 00 00 40 00 13 a8 40 00     08:06:05.329  READ FPDMA QUEUED

Error 12487 [198] occurred at disk power-on lifetime: 36432 hours (1518 days + 0 hours)
  When the command that caused the error occurred, the device was active or idle.

  After command completion occurred, registers were:
  ER -- ST COUNT  LBA_48  LH LM LL DV DC
  -- -- -- == -- == == == -- -- -- -- --
  40 -- 41 00 d3 00 06 ad 00 78 90 40 00  Error: WP at LBA = 0x6ad007890 = 28672293008

  Commands leading to the command that caused the error were:
  CR FEATR COUNT  LBA_48  LH LM LL DV DC  Powered_Up_Time  Command/Feature_Name
  -- == -- == -- == == == -- -- -- -- --  ---------------  --------------------
  61 00 08 00 60 00 00 20 00 00 10 40 00     08:06:01.024  WRITE FPDMA QUEUED
  60 01 00 00 58 00 00 24 00 13 a8 40 00     08:06:00.542  READ FPDMA QUEUED
  60 01 00 00 50 00 00 23 00 13 a8 40 00     08:06:00.542  READ FPDMA QUEUED
  60 01 00 00 48 00 00 22 00 13 a8 40 00     08:06:00.542  READ FPDMA QUEUED
  60 01 00 00 40 00 00 21 00 13 a8 40 00     08:06:00.542  READ FPDMA QUEUED

Error 12486 [197] occurred at disk power-on lifetime: 36432 hours (1518 days + 0 hours)
  When the command that caused the error occurred, the device was active or idle.

  After command completion occurred, registers were:
  ER -- ST COUNT  LBA_48  LH LM LL DV DC
  -- -- -- == -- == == == -- -- -- -- --
  40 -- 41 00 6b 00 00 08 00 00 66 40 00  Error: UNC at LBA = 0x08000066 = 134217830

  Commands leading to the command that caused the error were:
  CR FEATR COUNT  LBA_48  LH LM LL DV DC  Powered_Up_Time  Command/Feature_Name
  -- == -- == -- == == == -- -- -- -- --  ---------------  --------------------
  60 00 08 00 80 00 06 ad 00 78 90 40 00     08:05:55.811  READ FPDMA QUEUED
  61 00 08 00 78 00 00 18 00 00 b0 40 00     08:05:55.802  WRITE FPDMA QUEUED
  60 00 09 00 70 00 00 6e 00 13 50 40 00     08:05:55.802  READ FPDMA QUEUED
  61 00 18 00 68 00 00 08 00 00 40 40 00     08:05:55.802  WRITE FPDMA QUEUED
  60 00 f8 00 60 00 00 0d 00 13 b0 40 00     08:05:55.789  READ FPDMA QUEUED

SMART Extended Self-test Log Version: 1 (2 sectors)
No self-tests have been logged.  [To run self-tests, use: smartctl -t]

SMART Selective self-test log data structure revision number 1
 SPAN  MIN_LBA  MAX_LBA  CURRENT_TEST_STATUS
    1        0        0  Not_testing
    2        0        0  Not_testing
    3        0        0  Not_testing
    4        0        0  Not_testing
    5        0        0  Not_testing
Selective self-test flags (0x0):
  After scanning selected spans, do NOT read-scan remainder of disk.
If Selective self-test is pending on power-up, resume after 0 minute delay.

SCT Status Version:                  2
SCT Version (vendor specific):       0 (0x0000)
Device State:                        Active (0)
Current Temperature:                    29 Celsius
Power Cycle Min/Max Temperature:     24/33 Celsius
Lifetime    Min/Max Temperature:      3/69 Celsius
Under/Over Temperature Limit Count:   0/0

SCT Temperature History Version:     2
Temperature Sampling Period:         1 minute
Temperature Logging Interval:        1 minute
Min/Max recommended Temperature:      5/60 Celsius
Min/Max Temperature Limit:           -40/65 Celsius
Temperature History Size (Index):    478 (162)

SCT Error Recovery Control:
           Read: Disabled
          Write: Disabled

Device Statistics (GP/SMART Log 0x04) not supported

Pending Defects log (GP Log 0x0c) not supported

SATA Phy Event Counters (GP Log 0x11)
ID      Size     Value  Description
0x0001  4            0  Command failed due to ICRC error
0x0002  4            0  R_ERR response for data FIS
0x0003  4            0  R_ERR response for device-to-host data FIS
0x0004  4            0  R_ERR response for host-to-device data FIS
0x0005  4            0  R_ERR response for non-data FIS
0x0006  4            0  R_ERR response for device-to-host non-data FIS
0x0008  4            0  Device-to-host non-data FIS retries
0x0009  4           22  Transition from drive PhyRdy to drive PhyNRdy
0x000a  4           20  Device-to-host register FISes sent due to a COMRESET
0x000b  4            0  CRC errors within host-to-device FIS
0x000d  4            0  Non-CRC errors within host-to-device FIS
0x000f  4            0  R_ERR response for host-to-device data FIS, CRC
0x0010  4            0  R_ERR response for host-to-device data FIS, non-CRC



