smartctl 7.4 2023-08-01 r5530 [x86_64-linux-6.14.2-desktop-3omv2590] (OpenMandriva Lx 7.4-1)
Copyright (C) 2002-23, Bruce Allen, Christian Franke, www.smartmontools.org

=== START OF INFORMATION SECTION ===
Model Family:     Hitachi Deskstar 7K160
Device Model:     HDS721616PLA380
Serial Number:    --
LU WWN Device Id: 5 000cca ...
Firmware Version: P22OABEA
User Capacity:    160,040,803,840 bytes [160 GB]
Sector Size:      512 bytes logical/physical
Device is:        In smartctl database
ATA Version is:   ATA/ATAPI-7 T13/1532D revision 1
Local Time is:    Tue Aug 19 18:20:48 2025 -03
SMART support is: Available - device has SMART capability.
SMART support is: Enabled
AAM feature is:   Disabled
APM feature is:   Disabled
Rd look-ahead is: Enabled
Write cache is:   Enabled
DSN feature is:   Unavailable
ATA Security is:  Disabled, frozen [SEC2]
Wt Cache Reorder: Enabled

=== START OF READ SMART DATA SECTION ===
SMART overall-health self-assessment test result: PASSED

General SMART Values:
Offline data collection status:  (0x84)	Offline data collection activity
					was suspended by an interrupting command from host.
					Auto Offline Data Collection: Enabled.
Self-test execution status:      (   0)	The previous self-test routine completed
					without error or no self-test has ever 
					been run.
Total time to complete Offline 
data collection: 		( 2865) seconds.
Offline data collection
capabilities: 			 (0x5b) SMART execute Offline immediate.
					Auto Offline data collection on/off support.
					Suspend Offline collection upon new
					command.
					Offline surface scan supported.
					Self-test supported.
					No Conveyance Self-test supported.
					Selective Self-test supported.
SMART capabilities:            (0x0003)	Saves SMART data before entering
					power-saving mode.
					Supports SMART auto save timer.
Error logging capability:        (0x01)	Error logging supported.
					General Purpose Logging supported.
Short self-test routine 
recommended polling time: 	 (   1) minutes.
Extended self-test routine
recommended polling time: 	 (  48) minutes.
SCT capabilities: 	       (0x003f)	SCT Status supported.
					SCT Error Recovery Control supported.
					SCT Feature Control supported.
					SCT Data Table supported.

SMART Attributes Data Structure revision number: 16
Vendor Specific SMART Attributes with Thresholds:
ID# ATTRIBUTE_NAME          FLAGS    VALUE WORST THRESH FAIL RAW_VALUE
  1 Raw_Read_Error_Rate     PO-R--   100   100   016    -    0
  2 Throughput_Performance  P-S---   166   166   050    -    171
  3 Spin_Up_Time            POS---   121   121   024    -    166 (Average 163)
  4 Start_Stop_Count        -O--C-   097   097   000    -    12844
  5 Reallocated_Sector_Ct   PO--CK   100   100   005    -    1
  7 Seek_Error_Rate         PO-R--   100   100   067    -    0
  8 Seek_Time_Performance   P-S---   134   134   020    -    32
  9 Power_On_Hours          -O--C-   096   096   000    -    34042
 10 Spin_Retry_Count        PO--C-   100   100   060    -    0
 12 Power_Cycle_Count       -O--CK   098   098   000    -    10796
192 Power-Off_Retract_Count -O--CK   089   089   000    -    13668
193 Load_Cycle_Count        -O--C-   089   089   000    -    13668
194 Temperature_Celsius     -O----   181   181   000    -    33 (Min/Max 19/60)
196 Reallocated_Event_Count -O--CK   100   100   000    -    1
197 Current_Pending_Sector  -O---K   100   100   000    -    0
198 Offline_Uncorrectable   ---R--   100   100   000    -    0
199 UDMA_CRC_Error_Count    -O-R--   200   253   000    -    2
                            ||||||_ K auto-keep
                            |||||__ C event count
                            ||||___ R error rate
                            |||____ S speed/performance
                            ||_____ O updated online
                            |______ P prefailure warning

General Purpose Log Directory Version 1
SMART           Log Directory Version 1 [multi-sector log support]
Address    Access  R/W   Size  Description
0x00       GPL,SL  R/O      1  Log Directory
0x01           SL  R/O      1  Summary SMART error log
0x03       GPL     R/O      1  Ext. Comprehensive SMART error log
0x06           SL  R/O      1  SMART self-test log
0x07       GPL     R/O      1  Extended self-test log
0x09           SL  R/W      1  Selective self-test log
0x10       GPL     R/O      1  NCQ Command Error log
0x11       GPL     R/O      1  SATA Phy Event Counters log
0x20       GPL     R/O      1  Streaming performance log
0x21       GPL     R/O      1  Write stream error log
0x22       GPL     R/O      1  Read stream error log
0x80-0x9f  GPL,SL  R/W     16  Host vendor specific log
0xe0       GPL,SL  R/W      1  SCT Command/Status
0xe1       GPL,SL  R/W      1  SCT Data Transfer

SMART Extended Comprehensive Error Log Version: 1 (1 sectors)
Device Error Count: 3668 (device log contains only the most recent 4 errors)
	CR     = Command Register
	FEATR  = Features Register
	COUNT  = Count (was: Sector Count) Register
	LBA_48 = Upper bytes of LBA High/Mid/Low Registers ]  ATA-8
	LH     = LBA High (was: Cylinder High) Register    ]   LBA
	LM     = LBA Mid (was: Cylinder Low) Register      ] Register
	LL     = LBA Low (was: Sector Number) Register     ]
	DV     = Device (was: Device/Head) Register
	DC     = Device Control Register
	ER     = Error register
	ST     = Status register
Powered_Up_Time is measured from power on, and printed as
DDd+hh:mm:SS.sss where DD=days, hh=hours, mm=minutes,
SS=sec, and sss=millisec. It "wraps" after 49.710 days.

Error 3668 [3] occurred at disk power-on lifetime: 34038 hours (1418 days + 6 hours)
  When the command that caused the error occurred, the device was active or idle.

  After command completion occurred, registers were:
  ER -- ST COUNT  LBA_48  LH LM LL DV DC
  -- -- -- == -- == == == -- -- -- -- --
  84 -- 51 00 60 00 00 05 e3 7d 57 45 00  Error: ICRC, ABRT at LBA = 0x05e37d57 = 98794839

  Commands leading to the command that caused the error were:
  CR FEATR COUNT  LBA_48  LH LM LL DV DC  Powered_Up_Time  Command/Feature_Name
  -- == -- == -- == == == -- -- -- -- --  ---------------  --------------------
  60 01 00 00 10 00 00 05 e3 7c b8 40 08     02:25:07.800  READ FPDMA QUEUED
  60 01 00 00 08 00 00 05 e3 7b b8 40 08     02:25:07.800  READ FPDMA QUEUED
  60 01 00 00 00 00 00 05 e3 7a b8 40 08     02:25:07.800  READ FPDMA QUEUED
  60 01 00 00 f8 00 00 05 e3 79 b8 40 08     02:25:07.800  READ FPDMA QUEUED
  60 01 00 00 b8 00 00 05 e3 78 b8 40 08     02:25:07.800  READ FPDMA QUEUED

Error 3667 [2] occurred at disk power-on lifetime: 33912 hours (1413 days + 0 hours)
  When the command that caused the error occurred, the device was active or idle.

  After command completion occurred, registers were:
  ER -- ST COUNT  LBA_48  LH LM LL DV DC
  -- -- -- == -- == == == -- -- -- -- --
  84 -- 51 05 e0 00 00 00 a1 b8 c7 40 00  Error: ICRC, ABRT at LBA = 0x00a1b8c7 = 10598599

  Commands leading to the command that caused the error were:
  CR FEATR COUNT  LBA_48  LH LM LL DV DC  Powered_Up_Time  Command/Feature_Name
  -- == -- == -- == == == -- -- -- -- --  ---------------  --------------------
  60 01 b8 00 50 00 00 00 a1 f3 a0 40 08     01:41:38.200  READ FPDMA QUEUED
  60 0a 00 00 48 00 00 00 a1 e9 a0 40 08     01:41:38.200  READ FPDMA QUEUED
  60 02 00 00 40 00 00 00 a1 e7 a0 40 08     01:41:38.200  READ FPDMA QUEUED
  60 0a 00 00 38 00 00 00 a1 dd a0 40 08     01:41:38.200  READ FPDMA QUEUED
  60 0a 00 00 30 00 00 00 a1 d3 a0 40 08     01:41:38.200  READ FPDMA QUEUED

Error 3666 [1] occurred at disk power-on lifetime: 17902 hours (745 days + 22 hours)
  When the command that caused the error occurred, the device was active or idle.

  After command completion occurred, registers were:
  ER -- ST COUNT  LBA_48  LH LM LL DV DC
  -- -- -- == -- == == == -- -- -- -- --
  40 -- 51 00 03 00 00 00 5f 27 55 e0 00  Error: UNC 3 sectors at LBA = 0x005f2755 = 6235989

  Commands leading to the command that caused the error were:
  CR FEATR COUNT  LBA_48  LH LM LL DV DC  Powered_Up_Time  Command/Feature_Name
  -- == -- == -- == == == -- -- -- -- --  ---------------  --------------------
  25 00 00 00 08 00 00 00 5f 27 50 e0 00     00:09:06.700  READ DMA EXT
  25 00 00 00 08 00 00 00 5f 27 50 e0 00     00:09:01.800  READ DMA EXT
  25 00 00 00 08 00 00 00 5f 27 48 e0 00     00:09:01.800  READ DMA EXT
  25 00 00 00 08 00 00 00 5f 27 40 e0 00     00:09:01.700  READ DMA EXT
  25 00 00 00 80 00 00 00 68 90 58 e0 00     00:09:01.500  READ DMA EXT

Error 3665 [0] occurred at disk power-on lifetime: 17902 hours (745 days + 22 hours)
  When the command that caused the error occurred, the device was active or idle.

  After command completion occurred, registers were:
  ER -- ST COUNT  LBA_48  LH LM LL DV DC
  -- -- -- == -- == == == -- -- -- -- --
  40 -- 51 00 03 00 00 00 5f 27 55 e0 00  Error: UNC 3 sectors at LBA = 0x005f2755 = 6235989

  Commands leading to the command that caused the error were:
  CR FEATR COUNT  LBA_48  LH LM LL DV DC  Powered_Up_Time  Command/Feature_Name
  -- == -- == -- == == == -- -- -- -- --  ---------------  --------------------
  25 00 00 00 08 00 00 00 5f 27 50 e0 00     00:09:01.800  READ DMA EXT
  25 00 00 00 08 00 00 00 5f 27 48 e0 00     00:09:01.800  READ DMA EXT
  25 00 00 00 08 00 00 00 5f 27 40 e0 00     00:09:01.700  READ DMA EXT
  25 00 00 00 80 00 00 00 68 90 58 e0 00     00:09:01.500  READ DMA EXT
  25 00 00 00 08 00 00 00 61 02 a8 e0 00     00:09:01.500  READ DMA EXT

SMART Extended Self-test Log Version: 1 (1 sectors)
No self-tests have been logged.  [To run self-tests, use: smartctl -t]

SMART Selective self-test log data structure revision number 1
 SPAN  MIN_LBA  MAX_LBA  CURRENT_TEST_STATUS
    1        0        0  Not_testing
    2        0        0  Not_testing
    3        0        0  Not_testing
    4        0        0  Not_testing
    5        0        0  Not_testing
Selective self-test flags (0x0):
  After scanning selected spans, do NOT read-scan remainder of disk.
If Selective self-test is pending on power-up, resume after 0 minute delay.

SCT Status Version:                  2
SCT Version (vendor specific):       256 (0x0100)
Device State:                        SMART Off-line Data Collection executing in background (4)
Current Temperature:                    33 Celsius
Power Cycle Min/Max Temperature:     --/33 Celsius
Lifetime    Min/Max Temperature:     --/60 Celsius

SCT Temperature History Version:     2
Temperature Sampling Period:         1 minute
Temperature Logging Interval:        1 minute
Min/Max recommended Temperature:      5/60 Celsius
Min/Max Temperature Limit:           -40/65 Celsius
Temperature History Size (Index):    128 (15)

SCT Error Recovery Control:
           Read: Disabled
          Write: Disabled

Device Statistics (GP/SMART Log 0x04) not supported

Pending Defects log (GP Log 0x0c) not supported

SATA Phy Event Counters (GP Log 0x11)
ID      Size     Value  Description
0x0001  2            0  Command failed due to ICRC error
0x0009  2            2  Transition from drive PhyRdy to drive PhyNRdy
0x000a  2            2  Device-to-host register FISes sent due to a COMRESET
0x000b  2            0  CRC errors within host-to-device FIS
0x000d  2            0  Non-CRC errors within host-to-device FIS

