smartctl 7.4 2023-08-01 r5530 [x86_64-linux-6.12.9-desktop-1omv2490] (OpenMandriva Lx 7.4-1)
Copyright (C) 2002-23, Bruce Allen, Christian Franke, www.smartmontools.org

=== START OF INFORMATION SECTION ===
Model Family:     Phison Driven SSDs
Device Model:     KINGSTON SA400S37480G
Serial Number:    --
LU WWN Device Id: 5 0026b7 ...
Firmware Version: SAN20102
User Capacity:    480,103,981,056 bytes [480 GB]
Sector Size:      512 bytes logical/physical
Rotation Rate:    Solid State Device
TRIM Command:     Available
Device is:        In smartctl database
ATA Version is:   ACS-3 T13/2161-D revision 4
SATA Version is:  SATA 3.2, 6.0 Gb/s (current: 6.0 Gb/s)
Local Time is:    Fri Mar 14 13:34:52 2025 GMT
SMART support is: Available - device has SMART capability.
SMART support is: Enabled
AAM feature is:   Unavailable
APM level is:     128 (minimum power consumption without standby)
Rd look-ahead is: Enabled
Write cache is:   Enabled
DSN feature is:   Unavailable
ATA Security is:  Disabled, frozen [SEC2]
Wt Cache Reorder: Unavailable

=== START OF READ SMART DATA SECTION ===
SMART overall-health self-assessment test result: PASSED

General SMART Values:
Offline data collection status:  (0x00)	Offline data collection activity
					was never started.
					Auto Offline Data Collection: Disabled.
Self-test execution status:      (   0)	The previous self-test routine completed
					without error or no self-test has ever 
					been run.
Total time to complete Offline 
data collection: 		(  120) seconds.
Offline data collection
capabilities: 			 (0x11) SMART execute Offline immediate.
					No Auto Offline data collection support.
					Suspend Offline collection upon new
					command.
					No Offline surface scan supported.
					Self-test supported.
					No Conveyance Self-test supported.
					No Selective Self-test supported.
SMART capabilities:            (0x0002)	Does not save SMART data before
					entering power-saving mode.
					Supports SMART auto save timer.
Error logging capability:        (0x01)	Error logging supported.
					General Purpose Logging supported.
Short self-test routine 
recommended polling time: 	 (   2) minutes.
Extended self-test routine
recommended polling time: 	 (  10) minutes.

SMART Attributes Data Structure revision number: 1
Vendor Specific SMART Attributes with Thresholds:
ID# ATTRIBUTE_NAME          FLAGS    VALUE WORST THRESH FAIL RAW_VALUE
  1 Raw_Read_Error_Rate     -O--CK   100   100   000    -    100
  9 Power_On_Hours          -O--CK   100   100   000    -    7367
 12 Power_Cycle_Count       -O--CK   100   100   000    -    289
148 Unknown_Attribute       ------   100   100   000    -    0
149 Unknown_Attribute       ------   100   100   000    -    0
167 Write_Protect_Mode      ------   100   100   000    -    0
168 SATA_Phy_Error_Count    -O--C-   100   100   000    -    0
169 Bad_Block_Rate          ------   100   100   000    -    0
170 Bad_Blk_Ct_Lat/Erl      ------   100   100   010    -    0/0
172 Erase_Fail_Count        -O--CK   100   100   000    -    0
173 MaxAvgErase_Ct          ------   100   100   000    -    0
181 Program_Fail_Count      -O--CK   100   100   000    -    0
182 Erase_Fail_Count        ------   100   100   000    -    0
187 Reported_Uncorrect      -O--CK   100   100   000    -    0
192 Unsafe_Shutdown_Count   -O--C-   100   100   000    -    39
194 Temperature_Celsius     -O---K   024   041   000    -    24 (Min/Max 11/41)
196 Reallocated_Event_Count -O--CK   100   100   000    -    0
199 SATA_CRC_Error_Count    -O--CK   100   100   000    -    0
218 CRC_Error_Count         -O--CK   100   100   000    -    0
231 SSD_Life_Left           ------   098   098   000    -    98
233 Flash_Writes_GiB        -O--CK   100   100   000    -    8607
241 Lifetime_Writes_GiB     -O--CK   100   100   000    -    6532
242 Lifetime_Reads_GiB      -O--CK   100   100   000    -    6736
244 Average_Erase_Count     ------   100   100   000    -    24
245 Max_Erase_Count         ------   100   100   000    -    78
246 Total_Erase_Count       ------   100   100   000    -    11030
                            ||||||_ K auto-keep
                            |||||__ C event count
                            ||||___ R error rate
                            |||____ S speed/performance
                            ||_____ O updated online
                            |______ P prefailure warning

General Purpose Log Directory Version 1
SMART           Log Directory Version 1 [multi-sector log support]
Address    Access  R/W   Size  Description
0x00       GPL,SL  R/O      1  Log Directory
0x01           SL  R/O      1  Summary SMART error log
0x02           SL  R/O      1  Comprehensive SMART error log
0x03       GPL     R/O      1  Ext. Comprehensive SMART error log
0x04       GPL,SL  R/O      8  Device Statistics log
0x06           SL  R/O      1  SMART self-test log
0x07       GPL     R/O      1  Extended self-test log
0x10       GPL     R/O      1  NCQ Command Error log
0x11       GPL     R/O      1  SATA Phy Event Counters log
0x30       GPL,SL  R/O      9  IDENTIFY DEVICE data log
0x80-0x9f  GPL,SL  R/W     16  Host vendor specific log
0xde       GPL     VS       8  Device vendor specific log

SMART Extended Comprehensive Error Log Version: 1 (1 sectors)
No Errors Logged

SMART Extended Self-test Log Version: 1 (1 sectors)
Num  Test_Description    Status                  Remaining  LifeTime(hours)  LBA_of_first_error
# 1  Short offline       Aborted by host               60%      7361         -
# 2  Short offline       Self-test routine in progress 60%      7361         -

Selective Self-tests/Logging not supported

SCT Commands not supported

Device Statistics (GP Log 0x04)
Page  Offset Size        Value Flags Description
0x01  =====  =               =  ===  == General Statistics (rev 1) ==
0x01  0x008  4             289  ---  Lifetime Power-On Resets
0x01  0x010  4            7367  ---  Power-on Hours
0x01  0x018  6       814363558  ---  Logical Sectors Written
0x01  0x020  6           78034  ---  Number of Write Commands
0x01  0x028  6      1242123222  ---  Logical Sectors Read
0x01  0x030  6           79066  ---  Number of Read Commands
0x07  =====  =               =  ===  == Solid State Device Statistics (rev 1) ==
0x07  0x008  1              42  ---  Percentage Used Endurance Indicator
                                |||_ C monitored condition met
                                ||__ D supports DSN
                                |___ N normalized value

Pending Defects log (GP Log 0x0c) not supported

SATA Phy Event Counters (GP Log 0x11)
ID      Size     Value  Description
0x0001  4            0  Command failed due to ICRC error
0x0002  4            0  R_ERR response for data FIS
0x0005  4            1  R_ERR response for non-data FIS
0x000a  4           20  Device-to-host register FISes sent due to a COMRESET

