smartctl 7.1 2019-12-30 r5022 [x86_64-linux-5.7.0-3-amd64] (local build)
Copyright (C) 2002-19, Bruce Allen, Christian Franke, www.smartmontools.org

=== START OF INFORMATION SECTION ===
Model Number:                       INTEL SSDPEKKW256G7
Serial Number:                      --
Firmware Version:                   PSF121C
PCI Vendor/Subsystem ID:            0x8086
IEEE OUI Identifier:                0x5cd2e4
Controller ID:                      1
Number of Namespaces:               1
Namespace 1 Size/Capacity:          256,060,514,304 [256 GB]
Namespace 1 Formatted LBA Size:     512
Local Time is:                      Wed Sep  2 18:48:28 2020 CEST
Firmware Updates (0x12):            1 Slot, no Reset required
Optional Admin Commands (0x0006):   Format Frmw_DL
Optional NVM Commands (0x001e):     Wr_Unc DS_Mngmt Wr_Zero Sav/Sel_Feat
Maximum Data Transfer Size:         32 Pages
Warning  Comp. Temp. Threshold:     70 Celsius
Critical Comp. Temp. Threshold:     80 Celsius

Supported Power States
St Op     Max   Active     Idle   RL RT WL WT  Ent_Lat  Ex_Lat
 0 +     9.00W       -        -    0  0  0  0        5       5
 1 +     4.60W       -        -    1  1  1  1       30      30
 2 +     3.80W       -        -    2  2  2  2       30      30
 3 -   0.0700W       -        -    3  3  3  3    10000     300
 4 -   0.0050W       -        -    4  4  4  4     2000   10000

Supported LBA Sizes (NSID 0x1)
Id Fmt  Data  Metadt  Rel_Perf
 0 +     512       0         0

=== START OF SMART DATA SECTION ===
SMART overall-health self-assessment test result: PASSED

SMART/Health Information (NVMe Log 0x02)
Critical Warning:                   0x00
Temperature:                        33 Celsius
Available Spare:                    100%
Available Spare Threshold:          10%
Percentage Used:                    4%
Data Units Read:                    25,644,669 [13.1 TB]
Data Units Written:                 21,087,694 [10.7 TB]
Host Read Commands:                 504,871,938
Host Write Commands:                358,175,115
Controller Busy Time:               4,761
Power Cycles:                       5,669
Power On Hours:                     20,878
Unsafe Shutdowns:                   218
Media and Data Integrity Errors:    0
Error Information Log Entries:      0
Warning  Comp. Temperature Time:    49
Critical Comp. Temperature Time:    0

Error Information (NVMe Log 0x01, max 64 entries)
No Errors Logged

