smartctl 7.1 2019-12-30 r5022 [x86_64-linux-5.15.0-53-generic] (local build)
Copyright (C) 2002-19, Bruce Allen, Christian Franke, www.smartmontools.org

=== START OF INFORMATION SECTION ===
Model Number:                       INTEL SSDPEKKW256G7
Serial Number:                      --
Firmware Version:                   PSF109C
PCI Vendor/Subsystem ID:            0x8086
IEEE OUI Identifier:                0x5cd2e4
Controller ID:                      1
Number of Namespaces:               1
Namespace 1 Size/Capacity:          256,060,514,304 [256 GB]
Namespace 1 Formatted LBA Size:     512
Local Time is:                      Tue Dec 13 09:38:01 2022 WIB
Firmware Updates (0x12):            1 Slot, no Reset required
Optional Admin Commands (0x0006):   Format Frmw_DL
Optional NVM Commands (0x001e):     Wr_Unc DS_Mngmt Wr_Zero Sav/Sel_Feat
Maximum Data Transfer Size:         32 Pages
Warning  Comp. Temp. Threshold:     70 Celsius
Critical Comp. Temp. Threshold:     80 Celsius

Supported Power States
St Op     Max   Active     Idle   RL RT WL WT  Ent_Lat  Ex_Lat
 0 +     9.00W       -        -    0  0  0  0        5       5
 1 +     4.60W       -        -    1  1  1  1       30      30
 2 +     3.80W       -        -    2  2  2  2       30      30
 3 -   0.0700W       -        -    3  3  3  3    10000     300
 4 -   0.0050W       -        -    4  4  4  4     2000   10000

Supported LBA Sizes (NSID 0x1)
Id Fmt  Data  Metadt  Rel_Perf
 0 +     512       0         0

=== START OF SMART DATA SECTION ===
SMART overall-health self-assessment test result: PASSED

SMART/Health Information (NVMe Log 0x02)
Critical Warning:                   0x00
Temperature:                        36 Celsius
Available Spare:                    100%
Available Spare Threshold:          10%
Percentage Used:                    11%
Data Units Read:                    80,042,034 [40.9 TB]
Data Units Written:                 53,594,307 [27.4 TB]
Host Read Commands:                 1,280,060,034
Host Write Commands:                1,046,426,410
Controller Busy Time:               21,912
Power Cycles:                       2,929
Power On Hours:                     13,524
Unsafe Shutdowns:                   337
Media and Data Integrity Errors:    0
Error Information Log Entries:      2,184
Warning  Comp. Temperature Time:    301
Critical Comp. Temperature Time:    0

Error Information (NVMe Log 0x01, max 64 entries)
Num   ErrCount  SQId   CmdId  Status  PELoc          LBA  NSID    VS
  0       2184     7  0x001a  0x0004  0x018            0     1     -
  1       2183     7  0x001a  0x0004  0x018            0     1     -
  2       2182     7  0x001a  0x0004  0x018            0     1     -
  3       2181     7  0x001a  0x0004  0x018            0     1     -
  4       2180     7  0x001a  0x0004  0x018            0     1     -
  5       2179     7  0x001a  0x0004  0x018            0     1     -
  6       2178     7  0x001a  0x0004  0x018            0     1     -
  7       2177     7  0x001a  0x0004  0x018            0     1     -
  8       2176     7  0x001a  0x0004  0x018            0     1     -
  9       2175     7  0x001a  0x0004  0x018            0     1     -
 10       2174     7  0x001a  0x0004  0x018            0     1     -
 11       2173     7  0x001a  0x0004  0x018            0     1     -
 12       2172     7  0x001a  0x0004  0x018            0     1     -
 13       2171     7  0x001a  0x0004  0x018            0     1     -
 14       2170     7  0x001a  0x0004  0x018            0     1     -
 15       2169     7  0x001a  0x0004  0x018            0     1     -
... (48 entries not shown)



