smartctl 7.2 2020-12-30 r5155 [x86_64-linux-6.2.0-33-generic] (local build)
Copyright (C) 2002-20, Bruce Allen, Christian Franke, www.smartmontools.org

=== START OF INFORMATION SECTION ===
Model Number:                       311CD0512GB
Serial Number:                      --
Firmware Version:                   EDFOB0.7
PCI Vendor/Subsystem ID:            0x1987
IEEE OUI Identifier:                0x6479a7
Total NVM Capacity:                 512,110,190,592 [512 GB]
Unallocated NVM Capacity:           0
Controller ID:                      1
NVMe Version:                       1.3
Number of Namespaces:               1
Namespace 1 Size/Capacity:          512,110,190,592 [512 GB]
Namespace 1 Formatted LBA Size:     512
Namespace 1 IEEE EUI-64:            6479a7 ...
Local Time is:                      Tue Sep 26 22:35:57 2023 CEST
Firmware Updates (0x12):            1 Slot, no Reset required
Optional Admin Commands (0x0017):   Security Format Frmw_DL Self_Test
Optional NVM Commands (0x005e):     Wr_Unc DS_Mngmt Wr_Zero Sav/Sel_Feat Timestmp
Log Page Attributes (0x0a):         Cmd_Eff_Lg Telmtry_Lg
Maximum Data Transfer Size:         64 Pages
Warning  Comp. Temp. Threshold:     70 Celsius
Critical Comp. Temp. Threshold:     85 Celsius

Supported Power States
St Op     Max   Active     Idle   RL RT WL WT  Ent_Lat  Ex_Lat
 0 +     4.50W       -        -    0  0  0  0        0       0
 1 +     2.70W       -        -    1  1  1  1        0       0
 2 +     2.16W       -        -    2  2  2  2        0       0
 3 -   0.0700W       -        -    3  3  3  3     1000    1000
 4 -   0.0050W       -        -    4  4  4  4     5000   45000

Supported LBA Sizes (NSID 0x1)
Id Fmt  Data  Metadt  Rel_Perf
 0 +     512       0         1
 1 -    4096       0         0

=== START OF SMART DATA SECTION ===
SMART overall-health self-assessment test result: PASSED

SMART/Health Information (NVMe Log 0x02)
Critical Warning:                   0x00
Temperature:                        26 Celsius
Available Spare:                    100%
Available Spare Threshold:          5%
Percentage Used:                    0%
Data Units Read:                    939,550 [481 GB]
Data Units Written:                 1,318,101 [674 GB]
Host Read Commands:                 13,986,563
Host Write Commands:                24,368,337
Controller Busy Time:               143
Power Cycles:                       224
Power On Hours:                     357
Unsafe Shutdowns:                   16
Media and Data Integrity Errors:    0
Error Information Log Entries:      424
Warning  Comp. Temperature Time:    0
Critical Comp. Temperature Time:    0
Temperature Sensor 1:               40 Celsius

Error Information (NVMe Log 0x01, 16 of 16 entries)
Num   ErrCount  SQId   CmdId  Status  PELoc          LBA  NSID    VS
  0        424     0  0x500f  0x4005      -            0     0     -
  1        423     0  0x500e  0x4005      -            0     0     -
  2        422     0  0x400c  0x4005      -            0     0     -
  3        421     0  0x300f  0x4005      -            0     0     -
  4        420     0  0x300a  0x4005      -            0     0     -
  5        419     0  0x3009  0x4005      -            0     0     -
  6        418     0  0x200d  0x4004      -            0     0     -
  7        417     0  0x200c  0x4004      -            0     0     -
  8        416     0  0x2001  0x4004      -            0     0     -
  9        415     0  0x2000  0x4004      -            0     0     -
 10        414     0  0x100b  0x4004      -            0     0     -
 11        413     0  0x100a  0x4004      -            0     0     -
 12        412     0  0x6018  0x4005  0x028            0     0     -

