smartctl 6.6 2016-05-31 r4324 [x86_64-linux-5.4.0-42-generic] (local build)
Copyright (C) 2002-16, Bruce Allen, Christian Franke, www.smartmontools.org

=== START OF INFORMATION SECTION ===
Device Model:     PNY CS1311 32GB SSD
Serial Number:    --
LU WWN Device Id: 5 000000 ...
Firmware Version: S9FM02.8
User Capacity:    32,017,047,552 bytes [32.0 GB]
Sector Size:      512 bytes logical/physical
Rotation Rate:    Solid State Device
Form Factor:      2.5 inches
Device is:        Not in smartctl database [for details use: -P showall]
ATA Version is:   ACS-3 (minor revision not indicated)
SATA Version is:  SATA 3.1, 6.0 Gb/s (current: 3.0 Gb/s)
Local Time is:    Sun Dec  6 17:46:40 2020 CET
SMART support is: Available - device has SMART capability.
SMART support is: Enabled
AAM feature is:   Unavailable
APM level is:     254 (maximum performance)
Rd look-ahead is: Enabled
Write cache is:   Enabled
ATA Security is:  Disabled, frozen [SEC2]
Wt Cache Reorder: Unavailable

=== START OF READ SMART DATA SECTION ===
SMART overall-health self-assessment test result: PASSED

General SMART Values:
Offline data collection status:  (0x00)	Offline data collection activity
					was never started.
					Auto Offline Data Collection: Disabled.
Self-test execution status:      (   0)	The previous self-test routine completed
					without error or no self-test has ever 
					been run.
Total time to complete Offline 
data collection: 		(   30) seconds.
Offline data collection
capabilities: 			 (0x7b) SMART execute Offline immediate.
					Auto Offline data collection on/off support.
					Suspend Offline collection upon new
					command.
					Offline surface scan supported.
					Self-test supported.
					Conveyance Self-test supported.
					Selective Self-test supported.
SMART capabilities:            (0x0003)	Saves SMART data before entering
					power-saving mode.
					Supports SMART auto save timer.
Error logging capability:        (0x01)	Error logging supported.
					General Purpose Logging supported.
Short self-test routine 
recommended polling time: 	 (   1) minutes.
Extended self-test routine
recommended polling time: 	 (   2) minutes.
Conveyance self-test routine
recommended polling time: 	 (   2) minutes.

SMART Attributes Data Structure revision number: 16
Vendor Specific SMART Attributes with Thresholds:
ID# ATTRIBUTE_NAME          FLAGS    VALUE WORST THRESH FAIL RAW_VALUE
  1 Raw_Read_Error_Rate     -O-R--   100   100   000    -    0
  9 Power_On_Hours          -O--C-   100   100   000    -    241
 12 Power_Cycle_Count       -O--C-   100   100   000    -    227
168 Unknown_Attribute       -O--C-   100   100   000    -    0
170 Unknown_Attribute       PO--C-   100   100   010    -    16
173 Unknown_Attribute       ------   100   100   000    -    12124176
192 Power-Off_Retract_Count -O--C-   100   100   000    -    1
194 Temperature_Celsius     PO---K   070   070   000    -    30
196 Reallocated_Event_Count ------   100   100   000    -    0
218 Unknown_Attribute       ------   100   100   000    -    94
241 Total_LBAs_Written      -O--C-   100   100   000    -    265513
                            ||||||_ K auto-keep
                            |||||__ C event count
                            ||||___ R error rate
                            |||____ S speed/performance
                            ||_____ O updated online
                            |______ P prefailure warning

General Purpose Log Directory Version 1
SMART           Log Directory Version 1 [multi-sector log support]
Address    Access  R/W   Size  Description
0x00       GPL,SL  R/O      1  Log Directory
0x01           SL  R/O      1  Summary SMART error log
0x02           SL  R/O     51  Comprehensive SMART error log
0x03       GPL     R/O     64  Ext. Comprehensive SMART error log
0x04       GPL,SL  R/O      8  Device Statistics log
0x06           SL  R/O      1  SMART self-test log
0x07       GPL     R/O      1  Extended self-test log
0x09           SL  R/W      1  Selective self-test log
0x10       GPL     R/O      1  SATA NCQ Queued Error log
0x11       GPL     R/O      1  SATA Phy Event Counters log
0x30       GPL,SL  R/O      9  IDENTIFY DEVICE data log
0x80-0x9f  GPL,SL  R/W     16  Host vendor specific log

SMART Extended Comprehensive Error Log Version: 1 (64 sectors)
Device Error Count: 94
	CR     = Command Register
	FEATR  = Features Register
	COUNT  = Count (was: Sector Count) Register
	LBA_48 = Upper bytes of LBA High/Mid/Low Registers ]  ATA-8
	LH     = LBA High (was: Cylinder High) Register    ]   LBA
	LM     = LBA Mid (was: Cylinder Low) Register      ] Register
	LL     = LBA Low (was: Sector Number) Register     ]
	DV     = Device (was: Device/Head) Register
	DC     = Device Control Register
	ER     = Error register
	ST     = Status register
Powered_Up_Time is measured from power on, and printed as
DDd+hh:mm:SS.sss where DD=days, hh=hours, mm=minutes,
SS=sec, and sss=millisec. It "wraps" after 49.710 days.

Error 94 [93] occurred at disk power-on lifetime: 0 hours (0 days + 0 hours)
  When the command that caused the error occurred, the device was active or idle.

  After command completion occurred, registers were:
  ER -- ST COUNT  LBA_48  LH LM LL DV DC
  -- -- -- == -- == == == -- -- -- -- --
  84 -- 51 00 7f 00 00 00 05 3d ef e0 00  Error: ICRC, ABRT 127 sectors at LBA = 0x00053def = 343535

  Commands leading to the command that caused the error were:
  CR FEATR COUNT  LBA_48  LH LM LL DV DC  Powered_Up_Time  Command/Feature_Name
  -- == -- == -- == == == -- -- -- -- --  ---------------  --------------------
  25 00 03 00 7f 00 00 00 05 3d ef e0 00     00:01:28.960  READ DMA EXT
  25 00 03 00 7f 00 00 00 00 08 ee e0 00     00:01:28.938  READ DMA EXT
  25 00 03 00 02 00 00 00 05 3d 5a e0 00     00:01:28.935  READ DMA EXT
  25 00 03 00 01 00 00 00 05 3d 6f e0 00     00:01:28.922  READ DMA EXT
  25 00 03 00 7f 00 00 00 05 3c f1 e0 00     00:01:28.916  READ DMA EXT

Error 93 [92] occurred at disk power-on lifetime: 0 hours (0 days + 0 hours)
  When the command that caused the error occurred, the device was active or idle.

  After command completion occurred, registers were:
  ER -- ST COUNT  LBA_48  LH LM LL DV DC
  -- -- -- == -- == == == -- -- -- -- --
  84 -- 51 00 7f 00 00 00 05 3c f1 e0 00  Error: ICRC, ABRT 127 sectors at LBA = 0x00053cf1 = 343281

  Commands leading to the command that caused the error were:
  CR FEATR COUNT  LBA_48  LH LM LL DV DC  Powered_Up_Time  Command/Feature_Name
  -- == -- == -- == == == -- -- -- -- --  ---------------  --------------------
  25 00 03 00 7f 00 00 00 05 3c f1 e0 00     00:01:28.916  READ DMA EXT
  25 00 03 00 02 00 00 00 05 3d 50 e0 00     00:01:28.913  READ DMA EXT
  25 00 03 00 01 00 00 00 05 3d 6f e0 00     00:01:28.900  READ DMA EXT
  25 00 03 00 7f 00 00 00 05 3c f1 e0 00     00:01:28.894  READ DMA EXT
  25 00 03 00 7f 00 00 00 00 07 f0 e0 00     00:01:28.890  READ DMA EXT

Error 92 [91] occurred at disk power-on lifetime: 0 hours (0 days + 0 hours)
  When the command that caused the error occurred, the device was active or idle.

  After command completion occurred, registers were:
  ER -- ST COUNT  LBA_48  LH LM LL DV DC
  -- -- -- == -- == == == -- -- -- -- --
  84 -- 51 00 7f 00 00 00 05 3c f1 e0 00  Error: ICRC, ABRT 127 sectors at LBA = 0x00053cf1 = 343281

  Commands leading to the command that caused the error were:
  CR FEATR COUNT  LBA_48  LH LM LL DV DC  Powered_Up_Time  Command/Feature_Name
  -- == -- == -- == == == -- -- -- -- --  ---------------  --------------------
  25 00 03 00 7f 00 00 00 05 3c f1 e0 00     00:01:28.894  READ DMA EXT
  25 00 03 00 7f 00 00 00 00 07 f0 e0 00     00:01:28.890  READ DMA EXT
  25 00 03 00 7f 00 00 00 00 00 00 e0 00     00:01:28.885  READ DMA EXT
  25 00 03 00 01 00 00 00 00 3f 00 e0 00     00:01:28.708  READ DMA EXT
  25 00 03 00 7f 00 00 00 00 3e 82 e0 00     00:01:28.703  READ DMA EXT

Error 91 [90] occurred at disk power-on lifetime: 0 hours (0 days + 0 hours)
  When the command that caused the error occurred, the device was active or idle.

  After command completion occurred, registers were:
  ER -- ST COUNT  LBA_48  LH LM LL DV DC
  -- -- -- == -- == == == -- -- -- -- --
  84 -- 51 00 7f 00 00 00 00 3e 82 e0 00  Error: ICRC, ABRT 127 sectors at LBA = 0x00003e82 = 16002

  Commands leading to the command that caused the error were:
  CR FEATR COUNT  LBA_48  LH LM LL DV DC  Powered_Up_Time  Command/Feature_Name
  -- == -- == -- == == == -- -- -- -- --  ---------------  --------------------
  25 00 03 00 7f 00 00 00 00 3e 82 e0 00     00:01:28.703  READ DMA EXT
  25 00 03 00 7f 00 00 00 00 3e 03 e0 00     00:01:28.699  READ DMA EXT
  25 00 03 00 7f 00 00 00 00 3d 84 e0 00     00:01:28.694  READ DMA EXT
  25 00 03 00 7f 00 00 00 00 3d 05 e0 00     00:01:28.690  READ DMA EXT
  25 00 03 00 01 00 00 00 00 3d 38 e0 00     00:01:28.687  READ DMA EXT

Error 90 [89] occurred at disk power-on lifetime: 0 hours (0 days + 0 hours)
  When the command that caused the error occurred, the device was active or idle.

  After command completion occurred, registers were:
  ER -- ST COUNT  LBA_48  LH LM LL DV DC
  -- -- -- == -- == == == -- -- -- -- --
  84 -- 51 00 7f 00 00 00 00 3d 05 e0 00  Error: ICRC, ABRT 127 sectors at LBA = 0x00003d05 = 15621

  Commands leading to the command that caused the error were:
  CR FEATR COUNT  LBA_48  LH LM LL DV DC  Powered_Up_Time  Command/Feature_Name
  -- == -- == -- == == == -- -- -- -- --  ---------------  --------------------
  25 00 03 00 7f 00 00 00 00 3d 05 e0 00     00:01:28.668  READ DMA EXT
  25 00 03 00 02 00 00 00 05 3e 02 e0 00     00:01:28.665  READ DMA EXT
  25 00 03 00 01 00 00 00 05 3e 6d e0 00     00:01:28.651  READ DMA EXT
  25 00 03 00 7f 00 00 00 05 3d ef e0 00     00:01:28.646  READ DMA EXT
  25 00 03 00 7f 00 00 00 00 08 ee e0 00     00:01:28.624  READ DMA EXT

Error 89 [88] occurred at disk power-on lifetime: 0 hours (0 days + 0 hours)
  When the command that caused the error occurred, the device was active or idle.

  After command completion occurred, registers were:
  ER -- ST COUNT  LBA_48  LH LM LL DV DC
  -- -- -- == -- == == == -- -- -- -- --
  84 -- 51 00 7f 00 00 00 05 3d ef e0 00  Error: ICRC, ABRT 127 sectors at LBA = 0x00053def = 343535

  Commands leading to the command that caused the error were:
  CR FEATR COUNT  LBA_48  LH LM LL DV DC  Powered_Up_Time  Command/Feature_Name
  -- == -- == -- == == == -- -- -- -- --  ---------------  --------------------
  25 00 03 00 7f 00 00 00 05 3d ef e0 00     00:01:28.646  READ DMA EXT
  25 00 03 00 7f 00 00 00 00 08 ee e0 00     00:01:28.624  READ DMA EXT
  25 00 03 00 02 00 00 00 05 3d 5a e0 00     00:01:28.621  READ DMA EXT
  25 00 03 00 01 00 00 00 05 3d 6f e0 00     00:01:28.607  READ DMA EXT
  25 00 03 00 7f 00 00 00 05 3c f1 e0 00     00:01:28.602  READ DMA EXT

Error 88 [87] occurred at disk power-on lifetime: 0 hours (0 days + 0 hours)
  When the command that caused the error occurred, the device was active or idle.

  After command completion occurred, registers were:
  ER -- ST COUNT  LBA_48  LH LM LL DV DC
  -- -- -- == -- == == == -- -- -- -- --
  84 -- 51 00 7f 00 00 00 05 3c f1 e0 00  Error: ICRC, ABRT 127 sectors at LBA = 0x00053cf1 = 343281

  Commands leading to the command that caused the error were:
  CR FEATR COUNT  LBA_48  LH LM LL DV DC  Powered_Up_Time  Command/Feature_Name
  -- == -- == -- == == == -- -- -- -- --  ---------------  --------------------
  25 00 03 00 7f 00 00 00 05 3c f1 e0 00     00:01:28.602  READ DMA EXT
  25 00 03 00 02 00 00 00 05 3d 50 e0 00     00:01:28.599  READ DMA EXT
  25 00 03 00 01 00 00 00 05 3d 6f e0 00     00:01:28.585  READ DMA EXT
  25 00 03 00 7f 00 00 00 05 3c f1 e0 00     00:01:28.580  READ DMA EXT
  25 00 03 00 7f 00 00 00 00 07 f0 e0 00     00:01:28.575  READ DMA EXT

Error 87 [86] occurred at disk power-on lifetime: 0 hours (0 days + 0 hours)
  When the command that caused the error occurred, the device was active or idle.

  After command completion occurred, registers were:
  ER -- ST COUNT  LBA_48  LH LM LL DV DC
  -- -- -- == -- == == == -- -- -- -- --
  84 -- 51 00 7f 00 00 00 05 3c f1 e0 00  Error: ICRC, ABRT 127 sectors at LBA = 0x00053cf1 = 343281

  Commands leading to the command that caused the error were:
  CR FEATR COUNT  LBA_48  LH LM LL DV DC  Powered_Up_Time  Command/Feature_Name
  -- == -- == -- == == == -- -- -- -- --  ---------------  --------------------
  25 00 03 00 7f 00 00 00 05 3c f1 e0 00     00:01:28.580  READ DMA EXT
  25 00 03 00 7f 00 00 00 00 07 f0 e0 00     00:01:28.575  READ DMA EXT
  25 00 03 00 7f 00 00 00 00 00 00 e0 00     00:01:28.571  READ DMA EXT
  25 00 03 00 7f 00 00 00 00 07 f0 e0 00     00:01:28.558  READ DMA EXT
  25 00 03 00 7f 00 00 00 00 00 00 e0 00     00:01:28.554  READ DMA EXT

SMART Extended Self-test Log Version: 1 (1 sectors)
No self-tests have been logged.  [To run self-tests, use: smartctl -t]

SMART Selective self-test log data structure revision number 0
Note: revision number not 1 implies that no selective self-test has ever been run
 SPAN  MIN_LBA  MAX_LBA  CURRENT_TEST_STATUS
    1        0        0  Not_testing
    2        0        0  Not_testing
    3        0        0  Not_testing
    4        0        0  Not_testing
    5        0        0  Not_testing
Selective self-test flags (0x0):
  After scanning selected spans, do NOT read-scan remainder of disk.
If Selective self-test is pending on power-up, resume after 0 minute delay.

SCT Commands not supported

Device Statistics (GP Log 0x04)
Page  Offset Size        Value Flags Description
0x07  =====  =               =  ===  == Solid State Device Statistics (rev 1) ==
0x07  0x008  1               0  ---  Percentage Used Endurance Indicator
                                |||_ C monitored condition met
                                ||__ D supports DSN
                                |___ N normalized value

SATA Phy Event Counters (GP Log 0x11)
ID      Size     Value  Description
0x0001  2            0  Command failed due to ICRC error
0x0003  2            0  R_ERR response for device-to-host data FIS
0x0004  2            0  R_ERR response for host-to-device data FIS
0x0006  2            0  R_ERR response for device-to-host non-data FIS
0x0007  2            0  R_ERR response for host-to-device non-data FIS
0x0008  2            0  Device-to-host non-data FIS retries
0x0009  4            1  Transition from drive PhyRdy to drive PhyNRdy
0x000a  4            2  Device-to-host register FISes sent due to a COMRESET
0x000f  2            0  R_ERR response for host-to-device data FIS, CRC
0x0010  2            0  R_ERR response for host-to-device data FIS, non-CRC
0x0012  2            0  R_ERR response for host-to-device non-data FIS, CRC
0x0013  2            0  R_ERR response for host-to-device non-data FIS, non-CRC



