smartctl 7.4 2023-08-01 r5530 [x86_64-linux-6.11.0-13-generic] (local build)
Copyright (C) 2002-23, Bruce Allen, Christian Franke, www.smartmontools.org

=== START OF INFORMATION SECTION ===
Model Number:                       Micron_MTFDKBA512TFK-1BC15ABFA
Serial Number:                      --
Firmware Version:                   V5MA010
PCI Vendor/Subsystem ID:            0x1344
IEEE OUI Identifier:                0x00a075
Controller ID:                      0
NVMe Version:                       1.4
Number of Namespaces:               1
Namespace 1 Size/Capacity:          512,110,190,592 [512 GB]
Namespace 1 Formatted LBA Size:     512
Namespace 1 IEEE EUI-64:            00a075 ...
Local Time is:                      Tue Jan 14 16:10:06 2025 CET
Firmware Updates (0x14):            2 Slots, no Reset required
Optional Admin Commands (0x0017):   Security Format Frmw_DL Self_Test
Optional NVM Commands (0x0057):     Comp Wr_Unc DS_Mngmt Sav/Sel_Feat Timestmp
Log Page Attributes (0x1e):         Cmd_Eff_Lg Ext_Get_Lg Telmtry_Lg Pers_Ev_Lg
Maximum Data Transfer Size:         64 Pages
Warning  Comp. Temp. Threshold:     83 Celsius
Critical Comp. Temp. Threshold:     85 Celsius

Supported Power States
St Op     Max   Active     Idle   RL RT WL WT  Ent_Lat  Ex_Lat
 0 +     5.50W       -        -    0  0  0  0        0       0
 1 +     2.40W       -        -    1  1  1  1        0       0
 2 +     1.92W       -        -    2  2  2  2        0       0
 3 -   0.0700W       -        -    3  3  3  3     1000    1000
 4 -   0.0050W       -        -    4  4  4  4    10000   40000

Supported LBA Sizes (NSID 0x1)
Id Fmt  Data  Metadt  Rel_Perf
 0 +     512       0         0

=== START OF SMART DATA SECTION ===
SMART overall-health self-assessment test result: PASSED

SMART/Health Information (NVMe Log 0x02)
Critical Warning:                   0x00
Temperature:                        22 Celsius
Available Spare:                    100%
Available Spare Threshold:          5%
Percentage Used:                    0%
Data Units Read:                    5,421,293 [2.77 TB]
Data Units Written:                 8,439,103 [4.32 TB]
Host Read Commands:                 86,357,221
Host Write Commands:                143,259,591
Controller Busy Time:               272
Power Cycles:                       410
Power On Hours:                     2,210
Unsafe Shutdowns:                   17
Media and Data Integrity Errors:    0
Error Information Log Entries:      0
Warning  Comp. Temperature Time:    0
Critical Comp. Temperature Time:    0
Temperature Sensor 1:               22 Celsius

Error Information (NVMe Log 0x01, 16 of 63 entries)
No Errors Logged

Read Self-test Log failed: Invalid Field in Command (0x002)

