=== START OF INFORMATION SECTION ===
Model Family:     SAMSUNG SpinPoint F1 DT
Device Model:     SAMSUNG HD502IJ
Serial Number:    --
LU WWN Device Id: 5 0024e9 ...
Firmware Version: 1AA01118
User Capacity:    500 107 862 016 bytes [500 GB]
Sector Size:      512 bytes logical/physical
Device is:        In smartctl database [for details use: -P show]
ATA Version is:   ATA/ATAPI-7, ATA8-ACS T13/1699-D revision 3b
Local Time is:    Fri May 26 19:33:04 2017 +06
SMART support is: Available - device has SMART capability.
SMART support is: Enabled
AAM level is:     208 (intermediate), recommended: 254
APM feature is:   Disabled
Rd look-ahead is: Enabled
Write cache is:   Enabled
ATA Security is:  Disabled, frozen [SEC2]
Wt Cache Reorder: Enabled

=== START OF READ SMART DATA SECTION ===
SMART overall-health self-assessment test result: PASSED

General SMART Values:
Offline data collection status:  (0x00)	Offline data collection activity
					was never started.
					Auto Offline Data Collection: Disabled.
Self-test execution status:      (   0)	The previous self-test routine completed
					without error or no self-test has ever 
					been run.
Total time to complete Offline 
data collection: 		( 7587) seconds.
Offline data collection
capabilities: 			 (0x7b) SMART execute Offline immediate.
					Auto Offline data collection on/off support.
					Suspend Offline collection upon new
					command.
					Offline surface scan supported.
					Self-test supported.
					Conveyance Self-test supported.
					Selective Self-test supported.
SMART capabilities:            (0x0003)	Saves SMART data before entering
					power-saving mode.
					Supports SMART auto save timer.
Error logging capability:        (0x01)	Error logging supported.
					General Purpose Logging supported.
Short self-test routine 
recommended polling time: 	 (   2) minutes.
Extended self-test routine
recommended polling time: 	 ( 127) minutes.
Conveyance self-test routine
recommended polling time: 	 (  14) minutes.
SCT capabilities: 	       (0x003f)	SCT Status supported.
					SCT Error Recovery Control supported.
					SCT Feature Control supported.
					SCT Data Table supported.

SMART Attributes Data Structure revision number: 16
Vendor Specific SMART Attributes with Thresholds:
ID# ATTRIBUTE_NAME          FLAGS    VALUE WORST THRESH FAIL RAW_VALUE
  1 Raw_Read_Error_Rate     POSR--   100   100   051    -    0
  3 Spin_Up_Time            POS---   085   085   011    -    5380
  4 Start_Stop_Count        -O--CK   090   090   000    -    10360
  5 Reallocated_Sector_Ct   PO--CK   100   100   010    -    0
  7 Seek_Error_Rate         POSR--   100   100   051    -    0
  8 Seek_Time_Performance   P-S--K   100   100   015    -    10280
  9 Power_On_Hours          -O--CK   095   095   000    -    24342
 10 Spin_Retry_Count        PO--CK   100   100   051    -    0
 11 Calibration_Retry_Count -O--C-   100   100   000    -    0
 12 Power_Cycle_Count       -O--CK   093   093   000    -    6618
 13 Read_Soft_Error_Rate    -OSR--   100   100   000    -    0
183 Runtime_Bad_Block       -O--CK   100   100   000    -    0
184 End-to-End_Error        PO--CK   100   100   000    -    0
187 Reported_Uncorrect      -O--CK   100   100   000    -    0
188 Command_Timeout         -O--CK   100   100   000    -    0
190 Airflow_Temperature_Cel -O---K   070   056   000    -    30 (Min/Max 19/30)
194 Temperature_Celsius     -O---K   066   055   000    -    34 (Min/Max 19/35)
195 Hardware_ECC_Recovered  -O-RC-   100   100   000    -    9388
196 Reallocated_Event_Count -O--CK   100   100   000    -    0
197 Current_Pending_Sector  -O--C-   100   100   000    -    0
198 Offline_Uncorrectable   ----CK   100   100   000    -    0
199 UDMA_CRC_Error_Count    -OSRCK   100   100   000    -    133
200 Multi_Zone_Error_Rate   -O-R--   100   100   000    -    0
201 Soft_Read_Error_Rate    -O-R--   253   253   000    -    0
                            ||||||_ K auto-keep
                            |||||__ C event count
                            ||||___ R error rate
                            |||____ S speed/performance
                            ||_____ O updated online
                            |______ P prefailure warning

General Purpose Log Directory Version 1
SMART           Log Directory Version 1 [multi-sector log support]
Address    Access  R/W   Size  Description
0x00       GPL,SL  R/O      1  Log Directory
0x01           SL  R/O      1  Summary SMART error log
0x02           SL  R/O      2  Comprehensive SMART error log
0x03       GPL     R/O      2  Ext. Comprehensive SMART error log
0x04       GPL     R/O      2  Device Statistics log
0x06           SL  R/O      1  SMART self-test log
0x07       GPL     R/O      2  Extended self-test log
0x09           SL  R/W      1  Selective self-test log
0x10       GPL     R/O      1  SATA NCQ Queued Error log
0x11       GPL     R/O      1  SATA Phy Event Counters log
0x20       GPL     R/O      2  Streaming performance log [OBS-8]
0x21       GPL     R/O      1  Write stream error log
0x22       GPL     R/O      1  Read stream error log
0x80-0x9f  GPL,SL  R/W     16  Host vendor specific log
0xe0       GPL,SL  R/W      1  SCT Command/Status
0xe1       GPL,SL  R/W      1  SCT Data Transfer

SMART Extended Comprehensive Error Log Version: 1 (2 sectors)
Device Error Count: 133 (device log contains only the most recent 8 errors)
	CR     = Command Register
	FEATR  = Features Register
	COUNT  = Count (was: Sector Count) Register
	LBA_48 = Upper bytes of LBA High/Mid/Low Registers ]  ATA-8
	LH     = LBA High (was: Cylinder High) Register    ]   LBA
	LM     = LBA Mid (was: Cylinder Low) Register      ] Register
	LL     = LBA Low (was: Sector Number) Register     ]
	DV     = Device (was: Device/Head) Register
	DC     = Device Control Register
	ER     = Error register
	ST     = Status register
Powered_Up_Time is measured from power on, and printed as
DDd+hh:mm:SS.sss where DD=days, hh=hours, mm=minutes,
SS=sec, and sss=millisec. It "wraps" after 49.710 days.

Error 133 [4] occurred at disk power-on lifetime: 14271 hours (594 days + 15 hours)
  When the command that caused the error occurred, the device was active or idle.

  After command completion occurred, registers were:
  ER -- ST COUNT  LBA_48  LH LM LL DV DC
  -- -- -- == -- == == == -- -- -- -- --
  00 -- d0 00 38 00 00 3a 27 22 b0 e0 00   56 sectors at LBA = 0x3a2722b0 = 975643312

  Commands leading to the command that caused the error were:
  CR FEATR COUNT  LBA_48  LH LM LL DV DC  Powered_Up_Time  Command/Feature_Name
  -- == -- == -- == == == -- -- -- -- --  ---------------  --------------------
  25 00 00 00 80 00 00 38 72 fc 18 e0 00     00:01:26.080  READ DMA EXT
  25 00 00 00 08 00 00 3a 34 49 48 e0 00     00:01:26.070  READ DMA EXT
  25 00 00 00 40 00 00 3a 2c 35 18 e0 00     00:01:26.070  READ DMA EXT
  25 00 00 00 40 00 00 3a 26 0e 90 e0 00     00:01:26.060  READ DMA EXT
  25 00 00 00 80 00 00 38 72 fb 98 e0 00     00:01:26.050  READ DMA EXT

Error 132 [3] occurred at disk power-on lifetime: 14238 hours (593 days + 6 hours)
  When the command that caused the error occurred, the device was active or idle.

  After command completion occurred, registers were:
  ER -- ST COUNT  LBA_48  LH LM LL DV DC
  -- -- -- == -- == == == -- -- -- -- --
  00 -- d2 00 01 00 00 38 4d e7 37 e0 00   1 sectors at LBA = 0x384de737 = 944629559

  Commands leading to the command that caused the error were:
  CR FEATR COUNT  LBA_48  LH LM LL DV DC  Powered_Up_Time  Command/Feature_Name
  -- == -- == -- == == == -- -- -- -- --  ---------------  --------------------
  25 00 00 00 40 00 00 3a 29 62 08 e0 00     00:01:25.890  READ DMA EXT
  25 00 00 00 40 00 00 3a 33 c7 78 e0 00     00:01:25.880  READ DMA EXT
  25 00 00 00 40 00 00 3a 26 17 d0 e0 00     00:01:25.870  READ DMA EXT
  25 00 00 00 18 00 00 3a 34 fd c0 e0 00     00:01:25.860  READ DMA EXT
  25 00 00 00 10 00 00 3a 2a 03 48 e0 00     00:01:25.860  READ DMA EXT

Error 131 [2] occurred at disk power-on lifetime: 14210 hours (592 days + 2 hours)
  When the command that caused the error occurred, the device was active or idle.

  After command completion occurred, registers were:
  ER -- ST COUNT  LBA_48  LH LM LL DV DC
  -- -- -- == -- == == == -- -- -- -- --
  00 -- d0 00 80 00 00 39 d4 66 38 e0 00   128 sectors at LBA = 0x39d46638 = 970221112

  Commands leading to the command that caused the error were:
  CR FEATR COUNT  LBA_48  LH LM LL DV DC  Powered_Up_Time  Command/Feature_Name
  -- == -- == -- == == == -- -- -- -- --  ---------------  --------------------
  25 00 00 00 40 00 00 3a 1c e8 e2 e0 00     00:01:12.690  READ DMA EXT
  25 00 00 00 80 00 00 39 d4 65 b8 e0 00     00:01:12.690  READ DMA EXT
  25 00 00 00 01 00 00 38 80 da 58 e0 00     00:01:12.690  READ DMA EXT
  35 00 00 00 01 00 00 38 4d e7 37 e0 00     00:01:12.680  WRITE DMA EXT
  35 00 00 00 01 00 00 38 80 da 95 e0 00     00:01:12.680  WRITE DMA EXT

Error 130 [1] occurred at disk power-on lifetime: 14207 hours (591 days + 23 hours)
  When the command that caused the error occurred, the device was active or idle.

  After command completion occurred, registers were:
  ER -- ST COUNT  LBA_48  LH LM LL DV DC
  -- -- -- == -- == == == -- -- -- -- --
  00 -- d0 00 10 00 00 3a 25 4c f0 e0 00   16 sectors at LBA = 0x3a254cf0 = 975523056

  Commands leading to the command that caused the error were:
  CR FEATR COUNT  LBA_48  LH LM LL DV DC  Powered_Up_Time  Command/Feature_Name
  -- == -- == -- == == == -- -- -- -- --  ---------------  --------------------
  25 00 00 00 40 00 00 3a 30 1b f8 e0 00     00:01:14.660  READ DMA EXT
  25 00 00 00 40 00 00 3a 27 70 08 e0 00     00:01:14.650  READ DMA EXT
  25 00 00 00 40 00 00 3a 30 1b b8 e0 00     00:01:14.650  READ DMA EXT
  25 00 00 00 10 00 00 3a 27 68 c0 e0 00     00:01:14.630  READ DMA EXT
  25 00 00 00 40 00 00 3a 30 1b 78 e0 00     00:01:14.620  READ DMA EXT

Error 129 [0] occurred at disk power-on lifetime: 14184 hours (591 days + 0 hours)
  When the command that caused the error occurred, the device was active or idle.

  After command completion occurred, registers were:
  ER -- ST COUNT  LBA_48  LH LM LL DV DC
  -- -- -- == -- == == == -- -- -- -- --
  84 -- 51 00 07 00 00 3a 24 0a 19 e0 00  Error: ICRC, ABRT 7 sectors at LBA = 0x3a240a19 = 975440409

  Commands leading to the command that caused the error were:
  CR FEATR COUNT  LBA_48  LH LM LL DV DC  Powered_Up_Time  Command/Feature_Name
  -- == -- == -- == == == -- -- -- -- --  ---------------  --------------------
  25 00 00 00 08 00 00 3a 24 0a 18 e0 00     00:01:20.560  READ DMA EXT
  25 00 00 00 80 00 00 3a 22 00 e8 e0 00     00:01:20.550  READ DMA EXT
  25 00 00 00 08 00 00 3a 35 97 a8 e0 00     00:01:20.540  READ DMA EXT
  25 00 00 00 08 00 00 3a 2e c1 f8 e0 00     00:01:20.540  READ DMA EXT
  25 00 00 00 08 00 00 3a 24 02 d0 e0 00     00:01:20.540  READ DMA EXT

Error 128 [7] occurred at disk power-on lifetime: 14183 hours (590 days + 23 hours)
  When the command that caused the error occurred, the device was active or idle.

  After command completion occurred, registers were:
  ER -- ST COUNT  LBA_48  LH LM LL DV DC
  -- -- -- == -- == == == -- -- -- -- --
  00 -- d0 00 20 00 00 3a 27 28 a0 e0 00   32 sectors at LBA = 0x3a2728a0 = 975644832

  Commands leading to the command that caused the error were:
  CR FEATR COUNT  LBA_48  LH LM LL DV DC  Powered_Up_Time  Command/Feature_Name
  -- == -- == -- == == == -- -- -- -- --  ---------------  --------------------
  25 00 00 00 48 00 00 3a 22 d1 08 e0 00     00:01:10.540  READ DMA EXT
  35 00 00 00 01 00 00 3a 1e c2 2f e0 00     00:01:10.540  WRITE DMA EXT
  35 00 00 00 01 00 00 3a 19 bf bf e0 00     00:01:10.540  WRITE DMA EXT
  25 00 00 00 80 00 00 39 d4 65 38 e0 00     00:01:10.530  READ DMA EXT
  25 00 00 00 20 00 00 3a 26 cc e8 e0 00     00:01:10.530  READ DMA EXT

Error 127 [6] occurred at disk power-on lifetime: 14171 hours (590 days + 11 hours)
  When the command that caused the error occurred, the device was active or idle.

  After command completion occurred, registers were:
  ER -- ST COUNT  LBA_48  LH LM LL DV DC
  -- -- -- == -- == == == -- -- -- -- --
  00 -- d0 00 40 00 00 39 ce b3 58 e0 00   64 sectors at LBA = 0x39ceb358 = 969847640

  Commands leading to the command that caused the error were:
  CR FEATR COUNT  LBA_48  LH LM LL DV DC  Powered_Up_Time  Command/Feature_Name
  -- == -- == -- == == == -- -- -- -- --  ---------------  --------------------
  25 00 00 00 2a 00 00 39 cf a5 d8 e0 00     00:01:43.590  READ DMA EXT
  25 00 00 00 20 00 00 39 ce b7 98 e0 00     00:01:43.590  READ DMA EXT
  25 00 00 00 20 00 00 39 ce b7 68 e0 00     00:01:43.590  READ DMA EXT
  25 00 00 00 08 00 00 37 f1 41 d8 e0 00     00:01:43.580  READ DMA EXT
  25 00 00 00 40 00 00 39 ce b5 58 e0 00     00:01:43.570  READ DMA EXT

Error 126 [5] occurred at disk power-on lifetime: 14104 hours (587 days + 16 hours)
  When the command that caused the error occurred, the device was active or idle.

  After command completion occurred, registers were:
  ER -- ST COUNT  LBA_48  LH LM LL DV DC
  -- -- -- == -- == == == -- -- -- -- --
  84 -- 51 00 5f 00 00 39 c8 f1 b1 e0 00  Error: ICRC, ABRT 95 sectors at LBA = 0x39c8f1b1 = 969470385

  Commands leading to the command that caused the error were:
  CR FEATR COUNT  LBA_48  LH LM LL DV DC  Powered_Up_Time  Command/Feature_Name
  -- == -- == -- == == == -- -- -- -- --  ---------------  --------------------
  25 00 00 00 80 00 00 39 c8 f1 90 e0 00     00:01:12.160  READ DMA EXT
  35 00 00 00 01 00 00 39 c6 f5 5f e0 00     00:01:12.160  WRITE DMA EXT
  35 00 00 00 01 00 00 39 c4 17 ff e0 00     00:01:12.160  WRITE DMA EXT
  25 00 00 00 08 00 00 38 d9 43 28 e0 00     00:01:12.160  READ DMA EXT
  25 00 00 00 08 00 00 38 50 72 f0 e0 00     00:01:12.150  READ DMA EXT

SMART Extended Self-test Log Version: 1 (2 sectors)
Num  Test_Description    Status                  Remaining  LifeTime(hours)  LBA_of_first_error
# 1  Short offline       Completed without error       00%     15162         -
# 2  Short offline       Completed without error       00%     14817         -

SMART Selective self-test log data structure revision number 1
 SPAN  MIN_LBA  MAX_LBA  CURRENT_TEST_STATUS
    1        0        0  Not_testing
    2        0        0  Not_testing
    3        0        0  Not_testing
    4        0        0  Not_testing
    5        0        0  Not_testing
Selective self-test flags (0x0):
  After scanning selected spans, do NOT read-scan remainder of disk.
If Selective self-test is pending on power-up, resume after 0 minute delay.

SCT Status Version:                  2
SCT Version (vendor specific):       256 (0x0100)
SCT Support Level:                   1
Device State:                        Active (0)
Current Temperature:                 34 Celsius
Power Cycle Max Temperature:         35 Celsius
Lifetime    Max Temperature:         46 Celsius

SCT Temperature History Version:     2
Temperature Sampling Period:         1 minute
Temperature Logging Interval:        1 minute
Min/Max recommended Temperature:     -4/72 Celsius
Min/Max Temperature Limit:           -9/77 Celsius
Temperature History Size (Index):    128 (68)

SCT Error Recovery Control:
           Read: Disabled
          Write: Disabled

ATA_READ_LOG_EXT (addr=0x04:0x00, page=0, n=1) failed: scsi error badly formed scsi parameters
Read Device Statistics page 0x00 failed

SATA Phy Event Counters (GP Log 0x11)
ID      Size     Value  Description
0x000a  2            0  Device-to-host register FISes sent due to a COMRESET
0x0001  2            0  Command failed due to ICRC error
0x0002  2            0  R_ERR response for data FIS
0x0003  2            0  R_ERR response for device-to-host data FIS
0x0004  2            0  R_ERR response for host-to-device data FIS
0x0005  2            0  R_ERR response for non-data FIS
0x0006  2            0  R_ERR response for device-to-host non-data FIS
0x0007  2            0  R_ERR response for host-to-device non-data FIS
0x0008  2            0  Device-to-host non-data FIS retries
0x0009  2            0  Transition from drive PhyRdy to drive PhyNRdy
0x000b  2            0  CRC errors within host-to-device FIS
0x000d  2            0  Non-CRC errors within host-to-device FIS
0x000f  2            0  R_ERR response for host-to-device data FIS, CRC
0x0010  2            0  R_ERR response for host-to-device data FIS, non-CRC
0x0012  2            0  R_ERR response for host-to-device non-data FIS, CRC
0x0013  2            0  R_ERR response for host-to-device non-data FIS, non-CRC

