smartctl 7.2 2020-12-30 r5155 [x86_64-linux-6.0.0-12parrot1-amd64] (local build)
Copyright (C) 2002-20, Bruce Allen, Christian Franke, www.smartmontools.org

=== START OF INFORMATION SECTION ===
Model Family:     Marvell based SanDisk SSDs
Device Model:     SanDisk SD8SN8U-256G-1006
Serial Number:    --
LU WWN Device Id: 5 001b44 ...
Firmware Version: X4120006
User Capacity:    256,060,514,304 bytes [256 GB]
Sector Sizes:     512 bytes logical, 4096 bytes physical
Rotation Rate:    Solid State Device
Form Factor:      < 1.8 inches
TRIM Command:     Available, deterministic, zeroed
Device is:        In smartctl database [for details use: -P show]
ATA Version is:   ACS-2 T13/2015-D revision 3
SATA Version is:  SATA 3.2, 6.0 Gb/s (current: 6.0 Gb/s)
Local Time is:    Wed May 24 22:43:39 2023 PKT
SMART support is: Available - device has SMART capability.
SMART support is: Enabled
AAM feature is:   Unavailable
APM level is:     254 (maximum performance)
Rd look-ahead is: Enabled
Write cache is:   Enabled
DSN feature is:   Unavailable
ATA Security is:  Disabled, frozen [SEC2]
Wt Cache Reorder: Enabled

=== START OF READ SMART DATA SECTION ===
SMART overall-health self-assessment test result: PASSED

General SMART Values:
Offline data collection status:  (0x82)	Offline data collection activity
					was completed without error.
					Auto Offline Data Collection: Enabled.
Self-test execution status:      (   0)	The previous self-test routine completed
					without error or no self-test has ever 
					been run.
Total time to complete Offline 
data collection: 		(  120) seconds.
Offline data collection
capabilities: 			 (0x53) SMART execute Offline immediate.
					Auto Offline data collection on/off support.
					Suspend Offline collection upon new
					command.
					No Offline surface scan supported.
					Self-test supported.
					No Conveyance Self-test supported.
					Selective Self-test supported.
SMART capabilities:            (0x0003)	Saves SMART data before entering
					power-saving mode.
					Supports SMART auto save timer.
Error logging capability:        (0x01)	Error logging supported.
					General Purpose Logging supported.
Short self-test routine 
recommended polling time: 	 (   2) minutes.
Extended self-test routine
recommended polling time: 	 (  21) minutes.
SCT capabilities: 	       (0x003d)	SCT Status supported.
					SCT Error Recovery Control supported.
					SCT Feature Control supported.
					SCT Data Table supported.

SMART Attributes Data Structure revision number: 32
Vendor Specific SMART Attributes with Thresholds:
ID# ATTRIBUTE_NAME          FLAGS    VALUE WORST THRESH FAIL RAW_VALUE
  1 Raw_Read_Error_Rate     POSR-K   100   100   050    -    18841
  5 Reallocated_Sector_Ct   PO--CK   100   100   005    -    0
  9 Power_On_Hours          -O--CK   100   100   ---    -    15609
 12 Power_Cycle_Count       -O--CK   100   100   ---    -    4871
171 Program_Fail_Count      -O--CK   100   100   ---    -    0
172 Erase_Fail_Count        -O--CK   100   100   ---    -    0
173 Avg_Write/Erase_Count   -O--CK   090   090   005    -    75
174 Unexpect_Power_Loss_Ct  -O--CK   100   100   ---    -    173
176 Erase_Fail_Count_Chip   -O---K   100   100   ---    -    2176
181 Program_Fail_Cnt_Total  -O---K   100   100   ---    -    0
183 Runtime_Bad_Block       -O--CK   100   100   ---    -    0
184 End-to-End_Error        PO-RCK   100   100   097    -    0
187 Reported_Uncorrect      -O--CK   100   100   ---    -    0
188 Command_Timeout         -O--CK   100   100   ---    -    65548
194 Temperature_Celsius     -O---K   044   070   ---    -    44 (Min/Max 12/70)
198 Offline_Uncorrectable   ----CK   100   100   ---    -    0
199 SATA_CRC_Error          -O--CK   100   100   ---    -    0
201 Lifetime_Remaining%     PO---K   090   090   005    -    42949673035
230 Perc_Write/Erase_Count  -O--CK   100   100   ---    -    5204 5204 2631
241 Total_Writes_GiB        -O--CK   100   100   ---    -    1508885
242 Total_Reads_GiB         -O--CK   100   100   ---    -    2482879
243 Unknown_Marvell_Attr    -O--CK   100   100   ---    -    3255663
244 Thermal_Throttle        -O--CK   000   100   ---    -    0
249 TLC_NAND_GB_Writes      -O--CK   100   100   ---    -    18156
                            ||||||_ K auto-keep
                            |||||__ C event count
                            ||||___ R error rate
                            |||____ S speed/performance
                            ||_____ O updated online
                            |______ P prefailure warning

General Purpose Log Directory Version 1
SMART           Log Directory Version 1 [multi-sector log support]
Address    Access  R/W   Size  Description
0x00       GPL,SL  R/O      1  Log Directory
0x01           SL  R/O      1  Summary SMART error log
0x02           SL  R/O      2  Comprehensive SMART error log
0x03       GPL     R/O      1  Ext. Comprehensive SMART error log
0x04       GPL,SL  R/O      8  Device Statistics log
0x06           SL  R/O      1  SMART self-test log
0x07       GPL     R/O      1  Extended self-test log
0x09           SL  R/W      1  Selective self-test log
0x10       GPL     R/O      1  NCQ Command Error log
0x11       GPL     R/O      1  SATA Phy Event Counters log
0x30       GPL,SL  R/O      9  IDENTIFY DEVICE data log
0x80-0x9f  GPL,SL  R/W     16  Host vendor specific log
0xde       GPL     VS       8  Device vendor specific log
0xe0       GPL,SL  R/W      1  SCT Command/Status
0xe1       GPL,SL  R/W      1  SCT Data Transfer

SMART Extended Comprehensive Error Log Version: 1 (1 sectors)
No Errors Logged

SMART Extended Self-test Log Version: 1 (1 sectors)
Num  Test_Description    Status                  Remaining  LifeTime(hours)  LBA_of_first_error
# 1  Short offline       Aborted by host               00%     14621         -
# 2  Short offline       Completed without error       00%     14515         -
# 3  Short offline       Completed without error       00%     14381         -
# 4  Short offline       Completed without error       00%     14344         -
# 5  Short offline       Completed without error       00%     14297         -
# 6  Short offline       Completed without error       00%     14139         -
# 7  Short offline       Completed without error       00%     13990         -
# 8  Short offline       Completed without error       00%     13969         -
# 9  Short offline       Completed without error       00%     13738         -
#10  Short offline       Completed without error       00%     13413         -
#11  Short offline       Completed without error       00%     13362         -
#12  Short offline       Completed without error       00%     12430         -
#13  Short offline       Completed without error       00%     12397         -
#14  Short offline       Completed without error       00%     12309         -
#15  Short offline       Completed without error       00%     12309         -
#16  Short offline       Completed without error       00%     12169         -
#17  Short offline       Interrupted (host reset)      00%     12161         -
#18  Short offline       Completed without error       00%     12157         -
#19  Short offline       Completed without error       00%     12062         -

SMART Selective self-test log data structure revision number 1
 SPAN  MIN_LBA  MAX_LBA  CURRENT_TEST_STATUS
    1        0        0  Not_testing
    2        0        0  Not_testing
    3        0        0  Not_testing
    4        0        0  Not_testing
    5        0        0  Not_testing
Selective self-test flags (0x0):
  After scanning selected spans, do NOT read-scan remainder of disk.
If Selective self-test is pending on power-up, resume after 0 minute delay.

SCT Status Version:                  3
SCT Version (vendor specific):       257 (0x0101)
Device State:                        Active (0)
Current Temperature:                    42 Celsius
Power Cycle Min/Max Temperature:     34/51 Celsius
Lifetime    Min/Max Temperature:     34/51 Celsius
Specified Max Operating Temperature:    42 Celsius
Under/Over Temperature Limit Count:   0/0
Vendor specific:
00 00 00 00 00 00 00 00 00 00 00 00 00 00 00 00
01 00 01 00 01 00 00 00 00 00 00 00 00 00 00 00

SCT Temperature History Version:     2
Temperature Sampling Period:         1 minute
Temperature Logging Interval:        1 minute
Min/Max recommended Temperature:      0/70 Celsius
Min/Max Temperature Limit:           -15/90 Celsius
Temperature History Size (Index):    256 (37)

SCT Error Recovery Control:
           Read: Disabled
          Write: Disabled

Device Statistics (GP Log 0x04)
Page  Offset Size        Value Flags Description
0x01  =====  =               =  ===  == General Statistics (rev 1) ==
0x01  0x008  4            4871  ---  Lifetime Power-On Resets
0x01  0x010  4             899  ---  Power-on Hours
0x01  0x018  6               0  ---  Logical Sectors Written
0x01  0x020  6     49443147337  ---  Number of Write Commands
0x01  0x028  6     81358991999  ---  Logical Sectors Read
0x01  0x030  6               0  ---  Number of Read Commands
0x04  =====  =               =  ===  == General Errors Statistics (rev 1) ==
0x04  0x008  4               0  ---  Number of Reported Uncorrectable Errors
0x04  0x010  4            3940  ---  Resets Between Cmd Acceptance and Completion
0x05  =====  =               =  ===  == Temperature Statistics (rev 1) ==
0x05  0x008  1              15  ---  Current Temperature
0x05  0x020  1              75  ---  Highest Temperature
0x05  0x028  1              15  ---  Lowest Temperature
0x05  0x038  1              14  ---  Lowest Average Short Term Temperature
0x05  0x058  1              70  ---  Specified Maximum Operating Temperature
0x05  0x068  1               0  ---  Specified Minimum Operating Temperature
0x06  =====  =               =  ===  == Transport Statistics (rev 1) ==
0x06  0x008  4           10241  ---  Number of Hardware Resets
0x06  0x010  4            4932  ---  Number of ASR Events
0x06  0x018  4               0  ---  Number of Interface CRC Errors
0x07  =====  =               =  ===  == Solid State Device Statistics (rev 1) ==
0x07  0x008  1              10  N--  Percentage Used Endurance Indicator
                                |||_ C monitored condition met
                                ||__ D supports DSN
                                |___ N normalized value

Pending Defects log (GP Log 0x0c) not supported

SATA Phy Event Counters (GP Log 0x11)
ID      Size     Value  Description
0x0001  4            0  Command failed due to ICRC error
0x0002  4            0  R_ERR response for data FIS
0x0005  4            0  R_ERR response for non-data FIS
0x000a  4            3  Device-to-host register FISes sent due to a COMRESET

