smartctl 7.4 2023-08-01 r5530 [x86_64-linux-5.14.0-1051-oem] (local build)
Copyright (C) 2002-23, Bruce Allen, Christian Franke, www.smartmontools.org

=== START OF INFORMATION SECTION ===
Model Number:                       KINGSTON SNVS500G
Serial Number:                      --
Firmware Version:                   EDFK0N01
PCI Vendor/Subsystem ID:            0x2646
IEEE OUI Identifier:                0x0026b7
Total NVM Capacity:                 500,107,862,016 [500 GB]
Unallocated NVM Capacity:           0
Controller ID:                      1
NVMe Version:                       1.3
Number of Namespaces:               1
Namespace 1 Size/Capacity:          500,107,862,016 [500 GB]
Namespace 1 Formatted LBA Size:     512
Namespace 1 IEEE EUI-64:            0026b7 ...
Local Time is:                      Tue Sep 17 13:50:04 2024 -03
Firmware Updates (0x12):            1 Slot, no Reset required
Optional Admin Commands (0x0017):   Security Format Frmw_DL Self_Test
Optional NVM Commands (0x005e):     Wr_Unc DS_Mngmt Wr_Zero Sav/Sel_Feat Timestmp
Log Page Attributes (0x0e):         Cmd_Eff_Lg Ext_Get_Lg Telmtry_Lg
Maximum Data Transfer Size:         64 Pages
Warning  Comp. Temp. Threshold:     85 Celsius
Critical Comp. Temp. Threshold:     95 Celsius

Supported Power States
St Op     Max   Active     Idle   RL RT WL WT  Ent_Lat  Ex_Lat
 0 +     4.50W       -        -    0  0  0  0        0       0
 1 +     2.70W       -        -    1  1  1  1        0       0
 2 +     2.16W       -        -    2  2  2  2        0       0
 3 -   0.0700W       -        -    3  3  3  3     1000    1000
 4 -   0.0025W       -        -    4  4  4  4     5000   45000

Supported LBA Sizes (NSID 0x1)
Id Fmt  Data  Metadt  Rel_Perf
 0 +     512       0         1
 1 -    4096       0         0

=== START OF SMART DATA SECTION ===
SMART overall-health self-assessment test result: PASSED

SMART/Health Information (NVMe Log 0x02)
Critical Warning:                   0x00
Temperature:                        42 Celsius
Available Spare:                    100%
Available Spare Threshold:          10%
Percentage Used:                    1%
Data Units Read:                    13,495,710 [6.90 TB]
Data Units Written:                 11,313,895 [5.79 TB]
Host Read Commands:                 334,060,510
Host Write Commands:                195,400,651
Controller Busy Time:               3,828
Power Cycles:                       1,871
Power On Hours:                     7,972
Unsafe Shutdowns:                   85
Media and Data Integrity Errors:    0
Error Information Log Entries:      9,218
Warning  Comp. Temperature Time:    0
Critical Comp. Temperature Time:    0
Temperature Sensor 1:               45 Celsius
Temperature Sensor 2:               66 Celsius

Error Information (NVMe Log 0x01, 16 of 16 entries)
Num   ErrCount  SQId   CmdId  Status  PELoc          LBA  NSID    VS  Message
  0       9218     0  0x4004  0x4004      -            0     0     -  Invalid Field in Command
  1       9217     0  0x3007  0x4004      -            0     0     -  Invalid Field in Command
  2       9216     0  0x3005  0x4004      -            0     0     -  Invalid Field in Command
  3       9215     0  0x3004  0x4004      -            0     0     -  Invalid Field in Command
  4       9214     0  0x5008  0x4005  0x028            0     0     -  Invalid Field in Command
  5       9213     0  0x2009  0x4005      -            0     0     -  Invalid Field in Command

Read Self-test Log failed: Invalid Field in Command (0x2002)



