smartctl 7.2 2020-12-30 r5155 [x86_64-linux-5.10.0-8-amd64] (local build)
Copyright (C) 2002-20, Bruce Allen, Christian Franke, www.smartmontools.org

=== START OF INFORMATION SECTION ===
Model Number:                       SSDPEDMW012T4D NVMe INTEL 1200GB
Serial Number:                      --
Firmware Version:                   8EV1DC01
PCI Vendor/Subsystem ID:            0x8086
IEEE OUI Identifier:                0x5cd2e4
Controller ID:                      0
NVMe Version:                       <1.2
Number of Namespaces:               1
Namespace 1 Size/Capacity:          1,200,243,695,616 [1.20 TB]
Namespace 1 Formatted LBA Size:     4096
Local Time is:                      Sat Jul 24 18:40:15 2021 PDT
Firmware Updates (0x02):            1 Slot
Optional Admin Commands (0x0006):   Format Frmw_DL
Optional NVM Commands (0x0006):     Wr_Unc DS_Mngmt
Maximum Data Transfer Size:         32 Pages

Supported Power States
St Op     Max   Active     Idle   RL RT WL WT  Ent_Lat  Ex_Lat
 0 +    25.00W       -        -    0  0  0  0        0       0

Supported LBA Sizes (NSID 0x1)
Id Fmt  Data  Metadt  Rel_Perf
 0 -     512       0         2
 1 -     512       8         2
 2 -     512      16         2
 3 +    4096       0         0
 4 -    4096       8         0
 5 -    4096      64         0
 6 -    4096     128         0

=== START OF SMART DATA SECTION ===
SMART overall-health self-assessment test result: PASSED

SMART/Health Information (NVMe Log 0x02)
Critical Warning:                   0x00
Temperature:                        41 Celsius
Available Spare:                    100%
Available Spare Threshold:          10%
Percentage Used:                    1%
Data Units Read:                    2,182,213 [1.11 TB]
Data Units Written:                 924,030 [473 GB]
Host Read Commands:                 57,790,742
Host Write Commands:                1,061,702,392
Controller Busy Time:               0
Power Cycles:                       301
Power On Hours:                     13,252
Unsafe Shutdowns:                   7
Media and Data Integrity Errors:    0
Error Information Log Entries:      0

Error Information (NVMe Log 0x01, 16 of 64 entries)
No Errors Logged

