smartctl 7.1 2019-12-30 r5022 [x86_64-linux-5.13.0-27-generic] (local build)
Copyright (C) 2002-19, Bruce Allen, Christian Franke, www.smartmontools.org

=== START OF INFORMATION SECTION ===
Model Family:     Toshiba 2.5" HDD MQ01ABD...
Device Model:     TOSHIBA MQ01ABD100
Serial Number:    --
LU WWN Device Id: 5 000039 ...
Firmware Version: AX1R4C
User Capacity:    1,000,204,886,016 bytes [1.00 TB]
Sector Sizes:     512 bytes logical, 4096 bytes physical
Rotation Rate:    5400 rpm
Form Factor:      2.5 inches
Device is:        In smartctl database [for details use: -P show]
ATA Version is:   ATA8-ACS (minor revision not indicated)
SATA Version is:  SATA 3.0, 6.0 Gb/s (current: 6.0 Gb/s)
Local Time is:    Wed Jan 26 08:56:09 2022 IST
SMART support is: Available - device has SMART capability.
SMART support is: Enabled
AAM feature is:   Unavailable
APM level is:     254 (maximum performance)
Rd look-ahead is: Enabled
Write cache is:   Enabled
DSN feature is:   Unavailable
ATA Security is:  Disabled, NOT FROZEN [SEC1]
Wt Cache Reorder: Enabled

=== START OF READ SMART DATA SECTION ===
SMART overall-health self-assessment test result: PASSED

General SMART Values:
Offline data collection status:  (0x82)	Offline data collection activity
					was completed without error.
					Auto Offline Data Collection: Enabled.
Self-test execution status:      (   0)	The previous self-test routine completed
					without error or no self-test has ever 
					been run.
Total time to complete Offline 
data collection: 		(  120) seconds.
Offline data collection
capabilities: 			 (0x51) SMART execute Offline immediate.
					No Auto Offline data collection support.
					Suspend Offline collection upon new
					command.
					No Offline surface scan supported.
					Self-test supported.
					No Conveyance Self-test supported.
					Selective Self-test supported.
SMART capabilities:            (0x0003)	Saves SMART data before entering
					power-saving mode.
					Supports SMART auto save timer.
Error logging capability:        (0x01)	Error logging supported.
					General Purpose Logging supported.
Short self-test routine 
recommended polling time: 	 (   2) minutes.
Extended self-test routine
recommended polling time: 	 ( 199) minutes.
SCT capabilities: 	       (0x003d)	SCT Status supported.
					SCT Error Recovery Control supported.
					SCT Feature Control supported.
					SCT Data Table supported.

SMART Attributes Data Structure revision number: 16
Vendor Specific SMART Attributes with Thresholds:
ID# ATTRIBUTE_NAME          FLAGS    VALUE WORST THRESH FAIL RAW_VALUE
  1 Raw_Read_Error_Rate     POSR-K   100   100   050    -    0
  2 Throughput_Performance  POS--K   100   100   050    -    0
  3 Spin_Up_Time            PO---K   100   100   002    -    1433
  4 Start_Stop_Count        -O--CK   100   100   000    -    46071
  5 Reallocated_Sector_Ct   PO--CK   100   100   010    -    0
  7 Seek_Error_Rate         POSR-K   100   100   050    -    0
  8 Seek_Time_Performance   P-S--K   100   100   050    -    0
  9 Power_On_Hours          -O--CK   069   069   000    -    12517
 10 Spin_Retry_Count        PO--CK   253   100   030    -    0
 12 Power_Cycle_Count       -O--CK   100   100   000    -    3988
183 Runtime_Bad_Block       -O--CK   100   100   001    -    1
184 End-to-End_Error        PO--CK   100   100   097    -    0
185 Unknown_Attribute       -O--CK   100   100   001    -    65535
187 Reported_Uncorrect      -O--CK   031   031   000    -    69
188 Command_Timeout         -O--CK   100   100   000    -    0
189 High_Fly_Writes         -O-RCK   100   100   001    -    0
190 Airflow_Temperature_Cel -O---K   079   049   040    -    21 (Min/Max 20/21)
191 G-Sense_Error_Rate      -O--CK   100   100   000    -    20547
192 Power-Off_Retract_Count -O---K   099   099   000    -    38142534
193 Load_Cycle_Count        -O--CK   094   094   000    -    65895
194 Temperature_Celsius     -O---K   079   049   040    -    21 (Min/Max 20/21)
196 Reallocated_Event_Count -O--CK   100   100   000    -    0
197 Current_Pending_Sector  -O--CK   100   100   000    -    24
199 UDMA_CRC_Error_Count    -O--CK   200   200   000    -    0
                            ||||||_ K auto-keep
                            |||||__ C event count
                            ||||___ R error rate
                            |||____ S speed/performance
                            ||_____ O updated online
                            |______ P prefailure warning

General Purpose Log Directory Version 1
SMART           Log Directory Version 1 [multi-sector log support]
Address    Access  R/W   Size  Description
0x00       GPL,SL  R/O      1  Log Directory
0x01           SL  R/O      1  Summary SMART error log
0x02           SL  R/O     51  Comprehensive SMART error log
0x03       GPL     R/O     64  Ext. Comprehensive SMART error log
0x04       GPL,SL  R/O      8  Device Statistics log
0x06           SL  R/O      1  SMART self-test log
0x07       GPL     R/O      1  Extended self-test log
0x09           SL  R/W      1  Selective self-test log
0x10       GPL     R/O      1  NCQ Command Error log
0x11       GPL     R/O      1  SATA Phy Event Counters log
0x80-0x9f  GPL,SL  R/W     16  Host vendor specific log
0xe0       GPL,SL  R/W      1  SCT Command/Status
0xe1       GPL,SL  R/W      1  SCT Data Transfer

SMART Extended Comprehensive Error Log Version: 1 (64 sectors)
Device Error Count: 69
	CR     = Command Register
	FEATR  = Features Register
	COUNT  = Count (was: Sector Count) Register
	LBA_48 = Upper bytes of LBA High/Mid/Low Registers ]  ATA-8
	LH     = LBA High (was: Cylinder High) Register    ]   LBA
	LM     = LBA Mid (was: Cylinder Low) Register      ] Register
	LL     = LBA Low (was: Sector Number) Register     ]
	DV     = Device (was: Device/Head) Register
	DC     = Device Control Register
	ER     = Error register
	ST     = Status register
Powered_Up_Time is measured from power on, and printed as
DDd+hh:mm:SS.sss where DD=days, hh=hours, mm=minutes,
SS=sec, and sss=millisec. It "wraps" after 49.710 days.

Error 69 [68] occurred at disk power-on lifetime: 12022 hours (500 days + 22 hours)
  When the command that caused the error occurred, the device was active or idle.

  After command completion occurred, registers were:
  ER -- ST COUNT  LBA_48  LH LM LL DV DC
  -- -- -- == -- == == == -- -- -- -- --
  40 -- 41 00 20 00 00 10 13 f9 c7 40 00  Error: UNC at LBA = 0x1013f9c7 = 269744583

  Commands leading to the command that caused the error were:
  CR FEATR COUNT  LBA_48  LH LM LL DV DC  Powered_Up_Time  Command/Feature_Name
  -- == -- == -- == == == -- -- -- -- --  ---------------  --------------------
  60 00 01 00 20 00 00 10 13 f9 c7 40 00     02:11:06.982  READ FPDMA QUEUED
  2f 00 00 00 01 00 00 00 00 00 10 28 00     02:11:06.962  READ LOG EXT
  60 00 01 00 18 00 00 10 13 f9 c6 40 00     02:11:03.169  READ FPDMA QUEUED
  2f 00 00 00 01 00 00 00 00 00 10 28 00     02:11:03.150  READ LOG EXT
  60 00 01 00 10 00 00 10 13 f9 c5 40 00     02:10:59.363  READ FPDMA QUEUED

Error 68 [67] occurred at disk power-on lifetime: 12022 hours (500 days + 22 hours)
  When the command that caused the error occurred, the device was active or idle.

  After command completion occurred, registers were:
  ER -- ST COUNT  LBA_48  LH LM LL DV DC
  -- -- -- == -- == == == -- -- -- -- --
  40 -- 41 00 18 00 00 10 13 f9 c6 40 00  Error: UNC at LBA = 0x1013f9c6 = 269744582

  Commands leading to the command that caused the error were:
  CR FEATR COUNT  LBA_48  LH LM LL DV DC  Powered_Up_Time  Command/Feature_Name
  -- == -- == -- == == == -- -- -- -- --  ---------------  --------------------
  60 00 01 00 18 00 00 10 13 f9 c6 40 00     02:11:03.169  READ FPDMA QUEUED
  2f 00 00 00 01 00 00 00 00 00 10 28 00     02:11:03.150  READ LOG EXT
  60 00 01 00 10 00 00 10 13 f9 c5 40 00     02:10:59.363  READ FPDMA QUEUED
  2f 00 00 00 01 00 00 00 00 00 10 28 00     02:10:59.339  READ LOG EXT
  60 00 01 00 08 00 00 10 13 f9 c4 40 00     02:10:55.543  READ FPDMA QUEUED

Error 67 [66] occurred at disk power-on lifetime: 12022 hours (500 days + 22 hours)
  When the command that caused the error occurred, the device was active or idle.

  After command completion occurred, registers were:
  ER -- ST COUNT  LBA_48  LH LM LL DV DC
  -- -- -- == -- == == == -- -- -- -- --
  40 -- 41 00 10 00 00 10 13 f9 c5 40 00  Error: UNC at LBA = 0x1013f9c5 = 269744581

  Commands leading to the command that caused the error were:
  CR FEATR COUNT  LBA_48  LH LM LL DV DC  Powered_Up_Time  Command/Feature_Name
  -- == -- == -- == == == -- -- -- -- --  ---------------  --------------------
  60 00 01 00 10 00 00 10 13 f9 c5 40 00     02:10:59.363  READ FPDMA QUEUED
  2f 00 00 00 01 00 00 00 00 00 10 28 00     02:10:59.339  READ LOG EXT
  60 00 01 00 08 00 00 10 13 f9 c4 40 00     02:10:55.543  READ FPDMA QUEUED
  2f 00 00 00 01 00 00 00 00 00 10 28 00     02:10:55.517  READ LOG EXT
  60 00 01 00 00 00 00 10 13 f9 c3 40 00     02:10:51.727  READ FPDMA QUEUED

Error 66 [65] occurred at disk power-on lifetime: 12022 hours (500 days + 22 hours)
  When the command that caused the error occurred, the device was active or idle.

  After command completion occurred, registers were:
  ER -- ST COUNT  LBA_48  LH LM LL DV DC
  -- -- -- == -- == == == -- -- -- -- --
  40 -- 41 00 08 00 00 10 13 f9 c4 40 00  Error: UNC at LBA = 0x1013f9c4 = 269744580

  Commands leading to the command that caused the error were:
  CR FEATR COUNT  LBA_48  LH LM LL DV DC  Powered_Up_Time  Command/Feature_Name
  -- == -- == -- == == == -- -- -- -- --  ---------------  --------------------
  60 00 01 00 08 00 00 10 13 f9 c4 40 00     02:10:55.543  READ FPDMA QUEUED
  2f 00 00 00 01 00 00 00 00 00 10 28 00     02:10:55.517  READ LOG EXT
  60 00 01 00 00 00 00 10 13 f9 c3 40 00     02:10:51.727  READ FPDMA QUEUED
  2f 00 00 00 01 00 00 00 00 00 10 28 00     02:10:51.716  READ LOG EXT
  60 00 01 00 f8 00 00 10 13 f9 c2 40 00     02:10:47.925  READ FPDMA QUEUED

Error 65 [64] occurred at disk power-on lifetime: 12022 hours (500 days + 22 hours)
  When the command that caused the error occurred, the device was active or idle.

  After command completion occurred, registers were:
  ER -- ST COUNT  LBA_48  LH LM LL DV DC
  -- -- -- == -- == == == -- -- -- -- --
  40 -- 41 00 00 00 00 10 13 f9 c3 40 00  Error: UNC at LBA = 0x1013f9c3 = 269744579

  Commands leading to the command that caused the error were:
  CR FEATR COUNT  LBA_48  LH LM LL DV DC  Powered_Up_Time  Command/Feature_Name
  -- == -- == -- == == == -- -- -- -- --  ---------------  --------------------
  60 00 01 00 00 00 00 10 13 f9 c3 40 00     02:10:51.727  READ FPDMA QUEUED
  2f 00 00 00 01 00 00 00 00 00 10 28 00     02:10:51.716  READ LOG EXT
  60 00 01 00 f8 00 00 10 13 f9 c2 40 00     02:10:47.925  READ FPDMA QUEUED
  60 00 18 00 e8 00 00 00 16 63 68 40 00     02:10:47.914  READ FPDMA QUEUED
  2f 00 00 00 01 00 00 00 00 00 10 28 00     02:10:47.894  READ LOG EXT

Error 64 [63] occurred at disk power-on lifetime: 12022 hours (500 days + 22 hours)
  When the command that caused the error occurred, the device was active or idle.

  After command completion occurred, registers were:
  ER -- ST COUNT  LBA_48  LH LM LL DV DC
  -- -- -- == -- == == == -- -- -- -- --
  40 -- 41 00 f8 00 00 10 13 f9 c2 40 00  Error: UNC at LBA = 0x1013f9c2 = 269744578

  Commands leading to the command that caused the error were:
  CR FEATR COUNT  LBA_48  LH LM LL DV DC  Powered_Up_Time  Command/Feature_Name
  -- == -- == -- == == == -- -- -- -- --  ---------------  --------------------
  60 00 01 00 f8 00 00 10 13 f9 c2 40 00     02:10:47.925  READ FPDMA QUEUED
  60 00 18 00 e8 00 00 00 16 63 68 40 00     02:10:47.914  READ FPDMA QUEUED
  2f 00 00 00 01 00 00 00 00 00 10 28 00     02:10:47.894  READ LOG EXT
  60 00 01 00 f0 00 00 10 13 f9 c1 40 00     02:10:44.106  READ FPDMA QUEUED
  60 00 18 00 e8 00 00 00 16 63 68 40 00     02:10:44.088  READ FPDMA QUEUED

Error 63 [62] occurred at disk power-on lifetime: 12022 hours (500 days + 22 hours)
  When the command that caused the error occurred, the device was active or idle.

  After command completion occurred, registers were:
  ER -- ST COUNT  LBA_48  LH LM LL DV DC
  -- -- -- == -- == == == -- -- -- -- --
  40 -- 41 00 f0 00 00 10 13 f9 c1 40 00  Error: UNC at LBA = 0x1013f9c1 = 269744577

  Commands leading to the command that caused the error were:
  CR FEATR COUNT  LBA_48  LH LM LL DV DC  Powered_Up_Time  Command/Feature_Name
  -- == -- == -- == == == -- -- -- -- --  ---------------  --------------------
  60 00 01 00 f0 00 00 10 13 f9 c1 40 00     02:10:44.106  READ FPDMA QUEUED
  60 00 18 00 e8 00 00 00 16 63 68 40 00     02:10:44.088  READ FPDMA QUEUED
  60 00 08 00 d0 00 00 10 20 81 10 40 00     02:10:44.088  READ FPDMA QUEUED
  2f 00 00 00 01 00 00 00 00 00 10 28 00     02:10:44.072  READ LOG EXT
  60 00 01 00 e0 00 00 10 13 f9 c0 40 00     02:10:40.269  READ FPDMA QUEUED

Error 62 [61] occurred at disk power-on lifetime: 12022 hours (500 days + 22 hours)
  When the command that caused the error occurred, the device was active or idle.

  After command completion occurred, registers were:
  ER -- ST COUNT  LBA_48  LH LM LL DV DC
  -- -- -- == -- == == == -- -- -- -- --
  40 -- 41 00 e0 00 00 10 13 f9 c0 40 00  Error: UNC at LBA = 0x1013f9c0 = 269744576

  Commands leading to the command that caused the error were:
  CR FEATR COUNT  LBA_48  LH LM LL DV DC  Powered_Up_Time  Command/Feature_Name
  -- == -- == -- == == == -- -- -- -- --  ---------------  --------------------
  60 00 01 00 e0 00 00 10 13 f9 c0 40 00     02:10:40.269  READ FPDMA QUEUED
  60 00 02 00 d8 00 00 00 16 63 98 40 00     02:10:40.261  READ FPDMA QUEUED
  60 00 08 00 d0 00 00 10 20 81 10 40 00     02:10:40.234  READ FPDMA QUEUED
  61 00 40 00 c8 00 00 0c f2 08 58 40 00     02:10:40.234  WRITE FPDMA QUEUED
  60 00 10 00 c0 00 00 05 35 e5 70 40 00     02:10:40.234  READ FPDMA QUEUED

SMART Extended Self-test Log Version: 1 (1 sectors)
Num  Test_Description    Status                  Remaining  LifeTime(hours)  LBA_of_first_error
# 1  Short offline       Completed without error       00%       386         -
# 2  Short offline       Completed without error       00%       215         -

SMART Selective self-test log data structure revision number 1
 SPAN  MIN_LBA  MAX_LBA  CURRENT_TEST_STATUS
    1        0        0  Not_testing
    2        0        0  Not_testing
    3        0        0  Not_testing
    4        0        0  Not_testing
    5        0        0  Not_testing
Selective self-test flags (0x0):
  After scanning selected spans, do NOT read-scan remainder of disk.
If Selective self-test is pending on power-up, resume after 0 minute delay.

SCT Status Version:                  2
SCT Version (vendor specific):       1 (0x0001)
Device State:                        Active (0)
Current Temperature:                    21 Celsius
Power Cycle Min/Max Temperature:     20/21 Celsius
Lifetime    Min/Max Temperature:     11/51 Celsius
Under/Over Temperature Limit Count:   0/0

SCT Temperature History Version:     2
Temperature Sampling Period:         1 minute
Temperature Logging Interval:        1 minute
Min/Max recommended Temperature:      0/60 Celsius
Min/Max Temperature Limit:            0/60 Celsius
Temperature History Size (Index):    478 (171)

SCT Error Recovery Control:
           Read: Disabled
          Write: Disabled

Device Statistics (GP Log 0x04)
Page  Offset Size        Value Flags Description
0x01  =====  =               =  ===  == General Statistics (rev 2) ==
0x01  0x008  4            3988  ---  Lifetime Power-On Resets
0x01  0x010  4           12517  ---  Power-on Hours
0x01  0x018  6     65498536094  ---  Logical Sectors Written
0x01  0x020  6       782433489  ---  Number of Write Commands
0x01  0x028  6     47503561150  ---  Logical Sectors Read
0x01  0x030  6       710747628  ---  Number of Read Commands
0x02  =====  =               =  ===  == Free-Fall Statistics (rev 1) ==
0x02  0x010  4           20547  ---  Overlimit Shock Events
0x03  =====  =               =  ===  == Rotating Media Statistics (rev 1) ==
0x03  0x008  4           11988  ---  Spindle Motor Power-on Hours
0x03  0x010  4            9303  ---  Head Flying Hours
0x03  0x018  4           65895  ---  Head Load Events
0x03  0x020  4               0  ---  Number of Reallocated Logical Sectors
0x03  0x028  4               0  ---  Read Recovery Attempts
0x03  0x030  4               0  ---  Number of Mechanical Start Failures
0x04  =====  =               =  ===  == General Errors Statistics (rev 1) ==
0x04  0x008  4              69  ---  Number of Reported Uncorrectable Errors
0x04  0x010  4               0  ---  Resets Between Cmd Acceptance and Completion
0x05  =====  =               =  ===  == Temperature Statistics (rev 1) ==
0x05  0x008  1              21  ---  Current Temperature
0x05  0x010  1              22  N--  Average Short Term Temperature
0x05  0x018  1              26  N--  Average Long Term Temperature
0x05  0x020  1              51  ---  Highest Temperature
0x05  0x028  1              11  ---  Lowest Temperature
0x05  0x030  1              43  N--  Highest Average Short Term Temperature
0x05  0x038  1              21  N--  Lowest Average Short Term Temperature
0x05  0x040  1              39  N--  Highest Average Long Term Temperature
0x05  0x048  1              26  N--  Lowest Average Long Term Temperature
0x05  0x050  4               0  ---  Time in Over-Temperature
0x05  0x058  1              60  ---  Specified Maximum Operating Temperature
0x05  0x060  4               0  ---  Time in Under-Temperature
0x05  0x068  1               0  ---  Specified Minimum Operating Temperature
0x06  =====  =               =  ===  == Transport Statistics (rev 1) ==
0x06  0x008  4            4409  ---  Number of Hardware Resets
0x06  0x018  4               0  ---  Number of Interface CRC Errors
0x07  =====  =               =  ===  == Solid State Device Statistics (rev 1) ==
0x07  0x008  1              20  N--  Percentage Used Endurance Indicator
                                |||_ C monitored condition met
                                ||__ D supports DSN
                                |___ N normalized value

Pending Defects log (GP Log 0x0c) not supported

SATA Phy Event Counters (GP Log 0x11)
ID      Size     Value  Description
0x0001  4            0  Command failed due to ICRC error
0x0002  4            0  R_ERR response for data FIS
0x0003  4            0  R_ERR response for device-to-host data FIS
0x0004  4            0  R_ERR response for host-to-device data FIS
0x0005  4            0  R_ERR response for non-data FIS
0x0006  4            0  R_ERR response for device-to-host non-data FIS
0x0007  4            0  R_ERR response for host-to-device non-data FIS
0x0008  4            0  Device-to-host non-data FIS retries
0x0009  4           82  Transition from drive PhyRdy to drive PhyNRdy
0x000a  4            2  Device-to-host register FISes sent due to a COMRESET
0x000b  4            0  CRC errors within host-to-device FIS
0x000d  4            0  Non-CRC errors within host-to-device FIS
0x000f  4            0  R_ERR response for host-to-device data FIS, CRC
0x0010  4            0  R_ERR response for host-to-device data FIS, non-CRC
0x0012  4            0  R_ERR response for host-to-device non-data FIS, CRC
0x0013  4            0  R_ERR response for host-to-device non-data FIS, non-CRC

