=== START OF INFORMATION SECTION ===
Model Family:     Toshiba 2.5" HDD MQ01ABD...
Device Model:     TOSHIBA MQ01ABD100
Serial Number:    --
LU WWN Device Id: 5 000039 ...
Firmware Version: AX0R2J
User Capacity:    1,000,204,886,016 bytes [1.00 TB]
Sector Sizes:     512 bytes logical, 4096 bytes physical
Rotation Rate:    5400 rpm
Form Factor:      2.5 inches
Device is:        In smartctl database [for details use: -P show]
ATA Version is:   ATA8-ACS (minor revision not indicated)
SATA Version is:  SATA 3.0, 6.0 Gb/s (current: 6.0 Gb/s)
Local Time is:    Sun Aug 30 19:56:42 2020 CEST
SMART support is: Available - device has SMART capability.
SMART support is: Enabled
AAM feature is:   Unavailable
APM level is:     254 (maximum performance)
Rd look-ahead is: Enabled
Write cache is:   Enabled
DSN feature is:   Unavailable
ATA Security is:  Disabled, frozen [SEC2]
Wt Cache Reorder: Enabled

=== START OF READ SMART DATA SECTION ===
SMART overall-health self-assessment test result: PASSED

General SMART Values:
Offline data collection status:  (0x82)	Offline data collection activity
					was completed without error.
					Auto Offline Data Collection: Enabled.
Self-test execution status:      (   0)	The previous self-test routine completed
					without error or no self-test has ever 
					been run.
Total time to complete Offline 
data collection: 		(  120) seconds.
Offline data collection
capabilities: 			 (0x5b) SMART execute Offline immediate.
					Auto Offline data collection on/off support.
					Suspend Offline collection upon new
					command.
					Offline surface scan supported.
					Self-test supported.
					No Conveyance Self-test supported.
					Selective Self-test supported.
SMART capabilities:            (0x0003)	Saves SMART data before entering
					power-saving mode.
					Supports SMART auto save timer.
Error logging capability:        (0x01)	Error logging supported.
					General Purpose Logging supported.
Short self-test routine 
recommended polling time: 	 (   2) minutes.
Extended self-test routine
recommended polling time: 	 ( 244) minutes.
SCT capabilities: 	       (0x003d)	SCT Status supported.
					SCT Error Recovery Control supported.
					SCT Feature Control supported.
					SCT Data Table supported.

SMART Attributes Data Structure revision number: 16
Vendor Specific SMART Attributes with Thresholds:
ID# ATTRIBUTE_NAME          FLAGS    VALUE WORST THRESH FAIL RAW_VALUE
  1 Raw_Read_Error_Rate     PO-R--   100   100   050    -    0
  2 Throughput_Performance  P-S---   100   100   050    -    0
  3 Spin_Up_Time            POS--K   100   100   001    -    1720
  4 Start_Stop_Count        -O--CK   100   100   000    -    2054
  5 Reallocated_Sector_Ct   PO--CK   100   100   050    -    0
  7 Seek_Error_Rate         PO-R--   100   100   050    -    0
  8 Seek_Time_Performance   P-S---   100   100   050    -    0
  9 Power_On_Hours          -O--CK   079   079   000    -    8681
 10 Spin_Retry_Count        PO--CK   140   100   030    -    0
 12 Power_Cycle_Count       -O--CK   100   100   000    -    2020
191 G-Sense_Error_Rate      -O--CK   100   100   000    -    668
192 Power-Off_Retract_Count -O--CK   100   100   000    -    28
193 Load_Cycle_Count        -O--CK   099   099   000    -    15438
194 Temperature_Celsius     -O---K   100   100   000    -    41 (Min/Max 6/52)
196 Reallocated_Event_Count -O--CK   100   100   000    -    0
197 Current_Pending_Sector  -O--CK   100   100   000    -    224
198 Offline_Uncorrectable   ----CK   100   100   000    -    0
199 UDMA_CRC_Error_Count    -O--CK   200   200   000    -    0
220 Disk_Shift              -O----   100   100   000    -    0
222 Loaded_Hours            -O--CK   083   083   000    -    7045
223 Load_Retry_Count        -O--CK   100   100   000    -    0
224 Load_Friction           -O---K   100   100   000    -    0
226 Load-in_Time            -OS--K   100   100   000    -    262
240 Head_Flying_Hours       P-----   100   100   001    -    0
                            ||||||_ K auto-keep
                            |||||__ C event count
                            ||||___ R error rate
                            |||____ S speed/performance
                            ||_____ O updated online
                            |______ P prefailure warning

General Purpose Log Directory Version 1
SMART           Log Directory Version 1 [multi-sector log support]
Address    Access  R/W   Size  Description
0x00       GPL,SL  R/O      1  Log Directory
0x01           SL  R/O      1  Summary SMART error log
0x02           SL  R/O     51  Comprehensive SMART error log
0x03       GPL     R/O     64  Ext. Comprehensive SMART error log
0x04       GPL,SL  R/O      8  Device Statistics log
0x06           SL  R/O      1  SMART self-test log
0x07       GPL     R/O      1  Extended self-test log
0x09           SL  R/W      1  Selective self-test log
0x10       GPL     R/O      1  NCQ Command Error log
0x11       GPL     R/O      1  SATA Phy Event Counters log
0x80-0x9f  GPL,SL  R/W     16  Host vendor specific log
0xe0       GPL,SL  R/W      1  SCT Command/Status
0xe1       GPL,SL  R/W      1  SCT Data Transfer

SMART Extended Comprehensive Error Log Version: 1 (64 sectors)
Device Error Count: 55163 (device log contains only the most recent 256 errors)
	CR     = Command Register
	FEATR  = Features Register
	COUNT  = Count (was: Sector Count) Register
	LBA_48 = Upper bytes of LBA High/Mid/Low Registers ]  ATA-8
	LH     = LBA High (was: Cylinder High) Register    ]   LBA
	LM     = LBA Mid (was: Cylinder Low) Register      ] Register
	LL     = LBA Low (was: Sector Number) Register     ]
	DV     = Device (was: Device/Head) Register
	DC     = Device Control Register
	ER     = Error register
	ST     = Status register
Powered_Up_Time is measured from power on, and printed as
DDd+hh:mm:SS.sss where DD=days, hh=hours, mm=minutes,
SS=sec, and sss=millisec. It "wraps" after 49.710 days.

Error 55163 [122] occurred at disk power-on lifetime: 8681 hours (361 days + 17 hours)
  When the command that caused the error occurred, the device was active or idle.

  After command completion occurred, registers were:
  ER -- ST COUNT  LBA_48  LH LM LL DV DC
  -- -- -- == -- == == == -- -- -- -- --
  40 -- 41 00 e8 00 00 01 e2 54 b0 40 00  Error: UNC at LBA = 0x01e254b0 = 31610032

  Commands leading to the command that caused the error were:
  CR FEATR COUNT  LBA_48  LH LM LL DV DC  Powered_Up_Time  Command/Feature_Name
  -- == -- == -- == == == -- -- -- -- --  ---------------  --------------------
  60 00 10 00 f0 00 00 02 3f 1e 68 40 00     03:38:40.391  READ FPDMA QUEUED
  60 00 08 00 e8 00 00 01 e2 54 b0 40 00     03:38:40.046  READ FPDMA QUEUED
  60 00 08 00 e0 00 00 00 20 26 e2 40 00     03:38:40.036  READ FPDMA QUEUED
  60 00 08 00 d8 00 00 00 20 26 f2 40 00     03:38:40.029  READ FPDMA QUEUED
  60 00 08 00 d0 00 00 00 32 87 a2 40 00     03:38:40.023  READ FPDMA QUEUED

Error 55162 [121] occurred at disk power-on lifetime: 8681 hours (361 days + 17 hours)
  When the command that caused the error occurred, the device was active or idle.

  After command completion occurred, registers were:
  ER -- ST COUNT  LBA_48  LH LM LL DV DC
  -- -- -- == -- == == == -- -- -- -- --
  40 -- 41 00 b0 00 00 01 e2 54 b0 40 00  Error: UNC at LBA = 0x01e254b0 = 31610032

  Commands leading to the command that caused the error were:
  CR FEATR COUNT  LBA_48  LH LM LL DV DC  Powered_Up_Time  Command/Feature_Name
  -- == -- == -- == == == -- -- -- -- --  ---------------  --------------------
  60 00 08 00 f8 00 00 00 2a 57 27 40 00     03:38:36.022  READ FPDMA QUEUED
  60 00 08 00 f0 00 00 01 e8 b7 48 40 00     03:38:36.022  READ FPDMA QUEUED
  61 00 10 00 e8 00 00 00 70 57 c8 40 00     03:38:36.021  WRITE FPDMA QUEUED
  60 00 08 00 e0 00 00 00 14 aa 70 40 00     03:38:36.021  READ FPDMA QUEUED
  60 00 08 00 d8 00 00 00 e3 38 c0 40 00     03:38:36.021  READ FPDMA QUEUED

Error 55161 [120] occurred at disk power-on lifetime: 8681 hours (361 days + 17 hours)
  When the command that caused the error occurred, the device was active or idle.

  After command completion occurred, registers were:
  ER -- ST COUNT  LBA_48  LH LM LL DV DC
  -- -- -- == -- == == == -- -- -- -- --
  40 -- 41 00 b8 00 00 01 e2 54 b0 40 00  Error: UNC at LBA = 0x01e254b0 = 31610032

  Commands leading to the command that caused the error were:
  CR FEATR COUNT  LBA_48  LH LM LL DV DC  Powered_Up_Time  Command/Feature_Name
  -- == -- == -- == == == -- -- -- -- --  ---------------  --------------------
  60 00 40 00 08 00 00 02 21 3a 5a 40 00     03:38:31.951  READ FPDMA QUEUED
  61 01 00 00 f0 00 00 10 93 62 00 40 00     03:38:31.951  WRITE FPDMA QUEUED
  60 00 08 00 e8 00 00 00 74 63 e8 40 00     03:38:31.951  READ FPDMA QUEUED
  60 00 10 00 e0 00 00 00 6a a9 60 40 00     03:38:31.950  READ FPDMA QUEUED
  61 00 08 00 d8 00 00 00 70 57 c8 40 00     03:38:31.950  WRITE FPDMA QUEUED

Error 55160 [119] occurred at disk power-on lifetime: 8681 hours (361 days + 17 hours)
  When the command that caused the error occurred, the device was active or idle.

  After command completion occurred, registers were:
  ER -- ST COUNT  LBA_48  LH LM LL DV DC
  -- -- -- == -- == == == -- -- -- -- --
  40 -- 41 00 60 00 00 01 e2 54 b0 40 00  Error: WP at LBA = 0x01e254b0 = 31610032

  Commands leading to the command that caused the error were:
  CR FEATR COUNT  LBA_48  LH LM LL DV DC  Powered_Up_Time  Command/Feature_Name
  -- == -- == -- == == == -- -- -- -- --  ---------------  --------------------
  61 01 00 00 80 00 00 10 93 5f 00 40 00     03:38:27.887  WRITE FPDMA QUEUED
  60 00 18 00 78 00 00 00 1c 4f f3 40 00     03:38:27.886  READ FPDMA QUEUED
  61 00 50 00 70 00 00 00 70 76 00 40 00     03:38:27.886  WRITE FPDMA QUEUED
  61 00 01 00 68 00 00 05 7c 81 d0 40 00     03:38:27.886  WRITE FPDMA QUEUED
  60 00 40 00 60 00 00 01 e2 54 b0 40 00     03:38:27.881  READ FPDMA QUEUED

Error 55159 [118] occurred at disk power-on lifetime: 8681 hours (361 days + 17 hours)
  When the command that caused the error occurred, the device was active or idle.

  After command completion occurred, registers were:
  ER -- ST COUNT  LBA_48  LH LM LL DV DC
  -- -- -- == -- == == == -- -- -- -- --
  40 -- 41 00 10 00 00 01 e2 54 f0 40 00  Error: WP at LBA = 0x01e254f0 = 31610096

  Commands leading to the command that caused the error were:
  CR FEATR COUNT  LBA_48  LH LM LL DV DC  Powered_Up_Time  Command/Feature_Name
  -- == -- == -- == == == -- -- -- -- --  ---------------  --------------------
  61 00 01 00 48 00 00 00 23 b2 18 40 00     03:38:23.764  WRITE FPDMA QUEUED
  60 00 08 00 40 00 00 00 19 0b a2 40 00     03:38:23.764  READ FPDMA QUEUED
  60 00 08 00 38 00 00 00 73 92 30 40 00     03:38:23.764  READ FPDMA QUEUED
  61 00 20 00 30 00 00 00 70 57 d0 40 00     03:38:23.763  WRITE FPDMA QUEUED
  61 00 10 00 28 00 00 00 7a c7 d8 40 00     03:38:23.763  WRITE FPDMA QUEUED

Error 55158 [117] occurred at disk power-on lifetime: 8681 hours (361 days + 17 hours)
  When the command that caused the error occurred, the device was active or idle.

  After command completion occurred, registers were:
  ER -- ST COUNT  LBA_48  LH LM LL DV DC
  -- -- -- == -- == == == -- -- -- -- --
  40 -- 41 00 58 00 00 01 e2 54 f0 40 00  Error: WP at LBA = 0x01e254f0 = 31610096

  Commands leading to the command that caused the error were:
  CR FEATR COUNT  LBA_48  LH LM LL DV DC  Powered_Up_Time  Command/Feature_Name
  -- == -- == -- == == == -- -- -- -- --  ---------------  --------------------
  61 01 00 00 a0 00 00 0c 68 22 b0 40 00     03:38:19.713  WRITE FPDMA QUEUED
  61 01 00 00 98 00 00 0c 68 21 b0 40 00     03:38:19.713  WRITE FPDMA QUEUED
  61 01 00 00 90 00 00 0c 68 20 b0 40 00     03:38:19.713  WRITE FPDMA QUEUED
  61 01 00 00 88 00 00 0c 68 1f b0 40 00     03:38:19.713  WRITE FPDMA QUEUED
  61 01 00 00 40 00 00 0c 68 1e b0 40 00     03:38:19.713  WRITE FPDMA QUEUED

Error 55157 [116] occurred at disk power-on lifetime: 8681 hours (361 days + 17 hours)
  When the command that caused the error occurred, the device was active or idle.

  After command completion occurred, registers were:
  ER -- ST COUNT  LBA_48  LH LM LL DV DC
  -- -- -- == -- == == == -- -- -- -- --
  40 -- 41 00 40 00 00 01 e2 54 e8 40 00  Error: UNC at LBA = 0x01e254e8 = 31610088

  Commands leading to the command that caused the error were:
  CR FEATR COUNT  LBA_48  LH LM LL DV DC  Powered_Up_Time  Command/Feature_Name
  -- == -- == -- == == == -- -- -- -- --  ---------------  --------------------
  60 00 38 00 08 00 00 06 8c 16 28 40 00     03:38:15.731  READ FPDMA QUEUED
  61 01 00 00 f8 00 00 0c 68 0a b0 40 00     03:38:15.527  WRITE FPDMA QUEUED
  61 01 00 00 f0 00 00 0c 68 09 b0 40 00     03:38:15.527  WRITE FPDMA QUEUED
  61 01 00 00 e8 00 00 0c 68 08 b0 40 00     03:38:15.527  WRITE FPDMA QUEUED
  61 01 00 00 e0 00 00 0c 68 07 b0 40 00     03:38:15.527  WRITE FPDMA QUEUED

Error 55156 [115] occurred at disk power-on lifetime: 8681 hours (361 days + 17 hours)
  When the command that caused the error occurred, the device was active or idle.

  After command completion occurred, registers were:
  ER -- ST COUNT  LBA_48  LH LM LL DV DC
  -- -- -- == -- == == == -- -- -- -- --
  40 -- 41 00 c8 00 00 01 e2 54 e8 40 00  Error: UNC at LBA = 0x01e254e8 = 31610088

  Commands leading to the command that caused the error were:
  CR FEATR COUNT  LBA_48  LH LM LL DV DC  Powered_Up_Time  Command/Feature_Name
  -- == -- == -- == == == -- -- -- -- --  ---------------  --------------------
  60 00 12 00 e8 00 00 06 b8 18 88 40 00     03:38:11.318  READ FPDMA QUEUED
  60 00 08 00 e0 00 00 17 88 78 f0 40 00     03:38:11.317  READ FPDMA QUEUED
  61 00 10 00 d8 00 00 00 70 57 d0 40 00     03:38:11.317  WRITE FPDMA QUEUED
  60 00 12 00 d0 00 00 00 e2 53 40 40 00     03:38:11.312  READ FPDMA QUEUED
  60 00 12 00 c8 00 00 01 e2 54 e8 40 00     03:38:11.312  READ FPDMA QUEUED

SMART Extended Self-test Log Version: 1 (1 sectors)
No self-tests have been logged.  [To run self-tests, use: smartctl -t]

SMART Selective self-test log data structure revision number 1
 SPAN  MIN_LBA  MAX_LBA  CURRENT_TEST_STATUS
    1        0        0  Not_testing
    2        0        0  Not_testing
    3        0        0  Not_testing
    4        0        0  Not_testing
    5        0        0  Not_testing
Selective self-test flags (0x0):
  After scanning selected spans, do NOT read-scan remainder of disk.
If Selective self-test is pending on power-up, resume after 0 minute delay.

SCT Status Version:                  2
SCT Version (vendor specific):       1 (0x0001)
Device State:                        Active (0)
Current Temperature:                    41 Celsius
Power Cycle Min/Max Temperature:     27/43 Celsius
Lifetime    Min/Max Temperature:      6/52 Celsius
Under/Over Temperature Limit Count:   0/0

SCT Temperature History Version:     2
Temperature Sampling Period:         1 minute
Temperature Logging Interval:        1 minute
Min/Max recommended Temperature:      5/55 Celsius
Min/Max Temperature Limit:            5/55 Celsius
Temperature History Size (Index):    478 (109)

SCT Error Recovery Control:
           Read: Disabled
          Write: Disabled

Device Statistics (GP Log 0x04)
Page  Offset Size        Value Flags Description
0x01  =====  =               =  ===  == General Statistics (rev 2) ==
0x01  0x008  4            2020  ---  Lifetime Power-On Resets
0x01  0x010  4            8681  ---  Power-on Hours
0x01  0x018  6     31325127649  ---  Logical Sectors Written
0x01  0x020  6       534086828  ---  Number of Write Commands
0x01  0x028  6     47371404198  ---  Logical Sectors Read
0x01  0x030  6       613888685  ---  Number of Read Commands
0x02  =====  =               =  ===  == Free-Fall Statistics (rev 1) ==
0x02  0x010  4             668  ---  Overlimit Shock Events
0x03  =====  =               =  ===  == Rotating Media Statistics (rev 1) ==
0x03  0x008  4            1987  ---  Spindle Motor Power-on Hours
0x03  0x010  4            7045  ---  Head Flying Hours
0x03  0x018  4           15438  ---  Head Load Events
0x03  0x020  4             152  ---  Number of Reallocated Logical Sectors
0x03  0x028  4              40  ---  Read Recovery Attempts
0x03  0x030  4               0  ---  Number of Mechanical Start Failures
0x04  =====  =               =  ===  == General Errors Statistics (rev 1) ==
0x04  0x008  4           54837  ---  Number of Reported Uncorrectable Errors
0x04  0x010  4               4  ---  Resets Between Cmd Acceptance and Completion
0x05  =====  =               =  ===  == Temperature Statistics (rev 1) ==
0x05  0x008  1              41  ---  Current Temperature
0x05  0x010  1              36  N--  Average Short Term Temperature
0x05  0x018  1              35  N--  Average Long Term Temperature
0x05  0x020  1              52  ---  Highest Temperature
0x05  0x028  1               6  ---  Lowest Temperature
0x05  0x030  1              43  N--  Highest Average Short Term Temperature
0x05  0x038  1              30  N--  Lowest Average Short Term Temperature
0x05  0x040  1              36  N--  Highest Average Long Term Temperature
0x05  0x048  1              32  N--  Lowest Average Long Term Temperature
0x05  0x050  4               0  ---  Time in Over-Temperature
0x05  0x058  1              55  ---  Specified Maximum Operating Temperature
0x05  0x060  4               0  ---  Time in Under-Temperature
0x05  0x068  1               5  ---  Specified Minimum Operating Temperature
0x06  =====  =               =  ===  == Transport Statistics (rev 1) ==
0x06  0x008  4           27177  ---  Number of Hardware Resets
0x06  0x018  4               0  ---  Number of Interface CRC Errors
0x07  =====  =               =  ===  == Solid State Device Statistics (rev 1) ==
0x07  0x008  1              14  N--  Percentage Used Endurance Indicator
                                |||_ C monitored condition met
                                ||__ D supports DSN
                                |___ N normalized value

Pending Defects log (GP Log 0x0c) not supported

SATA Phy Event Counters (GP Log 0x11)
ID      Size     Value  Description
0x0001  4            0  Command failed due to ICRC error
0x0002  4            0  R_ERR response for data FIS
0x0003  4            0  R_ERR response for device-to-host data FIS
0x0004  4            0  R_ERR response for host-to-device data FIS
0x0005  4            0  R_ERR response for non-data FIS
0x0006  4            0  R_ERR response for device-to-host non-data FIS
0x0007  4            0  R_ERR response for host-to-device non-data FIS
0x0008  4            0  Device-to-host non-data FIS retries
0x0009  4         6049  Transition from drive PhyRdy to drive PhyNRdy
0x000a  4           36  Device-to-host register FISes sent due to a COMRESET
0x000b  4            0  CRC errors within host-to-device FIS
0x000d  4            0  Non-CRC errors within host-to-device FIS
0x000f  4            0  R_ERR response for host-to-device data FIS, CRC
0x0010  4            0  R_ERR response for host-to-device data FIS, non-CRC
0x0012  4            0  R_ERR response for host-to-device non-data FIS, CRC
0x0013  4            0  R_ERR response for host-to-device non-data FIS, non-CRC

