smartctl 7.4 2023-08-01 r5530 [x86_64-linux-6.4.8-desktop-2omv2390] (OpenMandriva Lx 7.4-1)
Copyright (C) 2002-23, Bruce Allen, Christian Franke, www.smartmontools.org

=== START OF INFORMATION SECTION ===
Model Family:     Toshiba 2.5" HDD MQ01ABD...
Device Model:     TOSHIBA MQ01ABD100
Serial Number:    --
LU WWN Device Id: 5 000039 ...
Firmware Version: AX003J
User Capacity:    1,000,204,886,016 bytes [1.00 TB]
Sector Sizes:     512 bytes logical, 4096 bytes physical
Rotation Rate:    5400 rpm
Form Factor:      2.5 inches
Device is:        In smartctl database
ATA Version is:   ATA8-ACS (minor revision not indicated)
SATA Version is:  SATA 3.0, 6.0 Gb/s (current: 6.0 Gb/s)
Local Time is:    Tue Aug 15 12:07:33 2023 BST
SMART support is: Available - device has SMART capability.
SMART support is: Enabled
AAM feature is:   Unavailable
APM level is:     254 (maximum performance)
Rd look-ahead is: Enabled
Write cache is:   Enabled
DSN feature is:   Unavailable
ATA Security is:  Disabled, frozen [SEC2]
Wt Cache Reorder: Enabled

=== START OF READ SMART DATA SECTION ===
SMART overall-health self-assessment test result: PASSED

General SMART Values:
Offline data collection status:  (0x84)	Offline data collection activity
					was suspended by an interrupting command from host.
					Auto Offline Data Collection: Enabled.
Self-test execution status:      (   0)	The previous self-test routine completed
					without error or no self-test has ever 
					been run.
Total time to complete Offline 
data collection: 		(  120) seconds.
Offline data collection
capabilities: 			 (0x5b) SMART execute Offline immediate.
					Auto Offline data collection on/off support.
					Suspend Offline collection upon new
					command.
					Offline surface scan supported.
					Self-test supported.
					No Conveyance Self-test supported.
					Selective Self-test supported.
SMART capabilities:            (0x0003)	Saves SMART data before entering
					power-saving mode.
					Supports SMART auto save timer.
Error logging capability:        (0x01)	Error logging supported.
					General Purpose Logging supported.
Short self-test routine 
recommended polling time: 	 (   2) minutes.
Extended self-test routine
recommended polling time: 	 ( 235) minutes.
SCT capabilities: 	       (0x003d)	SCT Status supported.
					SCT Error Recovery Control supported.
					SCT Feature Control supported.
					SCT Data Table supported.

SMART Attributes Data Structure revision number: 16
Vendor Specific SMART Attributes with Thresholds:
ID# ATTRIBUTE_NAME          FLAGS    VALUE WORST THRESH FAIL RAW_VALUE
  1 Raw_Read_Error_Rate     PO-R--   100   100   050    -    0
  2 Throughput_Performance  P-S---   100   100   050    -    0
  3 Spin_Up_Time            POS--K   100   100   001    -    1538
  4 Start_Stop_Count        -O--CK   100   100   000    -    18617
  5 Reallocated_Sector_Ct   PO--CK   100   100   050    -    0
  7 Seek_Error_Rate         PO-R--   100   100   050    -    0
  8 Seek_Time_Performance   P-S---   100   100   050    -    0
  9 Power_On_Hours          -O--CK   059   059   000    -    16715
 10 Spin_Retry_Count        PO--CK   253   100   030    -    0
 12 Power_Cycle_Count       -O--CK   100   100   000    -    12813
191 G-Sense_Error_Rate      -O--CK   100   100   000    -    45
192 Power-Off_Retract_Count -O--CK   100   100   000    -    474
193 Load_Cycle_Count        -O--CK   093   093   000    -    75881
194 Temperature_Celsius     -O---K   100   100   000    -    38 (Min/Max 12/47)
196 Reallocated_Event_Count -O--CK   100   100   000    -    0
197 Current_Pending_Sector  -O--CK   100   100   000    -    416
198 Offline_Uncorrectable   ----CK   100   100   000    -    0
199 UDMA_CRC_Error_Count    -O--CK   200   200   000    -    4
220 Disk_Shift              -O----   100   100   000    -    0
222 Loaded_Hours            -O--CK   061   061   000    -    15928
223 Load_Retry_Count        -O--CK   100   100   000    -    0
224 Load_Friction           -O---K   100   100   000    -    0
226 Load-in_Time            -OS--K   100   100   000    -    276
240 Head_Flying_Hours       P-----   100   100   001    -    0
                            ||||||_ K auto-keep
                            |||||__ C event count
                            ||||___ R error rate
                            |||____ S speed/performance
                            ||_____ O updated online
                            |______ P prefailure warning

General Purpose Log Directory Version 1
SMART           Log Directory Version 1 [multi-sector log support]
Address    Access  R/W   Size  Description
0x00       GPL,SL  R/O      1  Log Directory
0x01           SL  R/O      1  Summary SMART error log
0x02           SL  R/O     51  Comprehensive SMART error log
0x03       GPL     R/O     64  Ext. Comprehensive SMART error log
0x04       GPL,SL  R/O      8  Device Statistics log
0x06           SL  R/O      1  SMART self-test log
0x07       GPL     R/O      1  Extended self-test log
0x09           SL  R/W      1  Selective self-test log
0x10       GPL     R/O      1  NCQ Command Error log
0x11       GPL     R/O      1  SATA Phy Event Counters log
0x80-0x9f  GPL,SL  R/W     16  Host vendor specific log
0xe0       GPL,SL  R/W      1  SCT Command/Status
0xe1       GPL,SL  R/W      1  SCT Data Transfer

SMART Extended Comprehensive Error Log Version: 1 (64 sectors)
Device Error Count: 4
	CR     = Command Register
	FEATR  = Features Register
	COUNT  = Count (was: Sector Count) Register
	LBA_48 = Upper bytes of LBA High/Mid/Low Registers ]  ATA-8
	LH     = LBA High (was: Cylinder High) Register    ]   LBA
	LM     = LBA Mid (was: Cylinder Low) Register      ] Register
	LL     = LBA Low (was: Sector Number) Register     ]
	DV     = Device (was: Device/Head) Register
	DC     = Device Control Register
	ER     = Error register
	ST     = Status register
Powered_Up_Time is measured from power on, and printed as
DDd+hh:mm:SS.sss where DD=days, hh=hours, mm=minutes,
SS=sec, and sss=millisec. It "wraps" after 49.710 days.

Error 4 [3] occurred at disk power-on lifetime: 16030 hours (667 days + 22 hours)
  When the command that caused the error occurred, the device was active or idle.

  After command completion occurred, registers were:
  ER -- ST COUNT  LBA_48  LH LM LL DV DC
  -- -- -- == -- == == == -- -- -- -- --
  84 -- 41 00 10 00 00 2c 03 33 ff 40 00  Error: ICRC, ABRT at LBA = 0x2c0333ff = 738407423

  Commands leading to the command that caused the error were:
  CR FEATR COUNT  LBA_48  LH LM LL DV DC  Powered_Up_Time  Command/Feature_Name
  -- == -- == -- == == == -- -- -- -- --  ---------------  --------------------
  60 00 08 00 58 00 00 2c 03 48 00 40 00     00:01:06.323  READ FPDMA QUEUED
  60 00 08 00 50 00 00 2c 03 40 00 40 00     00:01:06.319  READ FPDMA QUEUED
  60 00 08 00 48 00 00 2c 03 3c 00 40 00     00:01:06.315  READ FPDMA QUEUED
  60 00 08 00 40 00 00 2c 03 3a 00 40 00     00:01:06.314  READ FPDMA QUEUED
  60 00 08 00 38 00 00 2c 03 39 00 40 00     00:01:06.314  READ FPDMA QUEUED

Error 3 [2] occurred at disk power-on lifetime: 14259 hours (594 days + 3 hours)
  When the command that caused the error occurred, the device was active or idle.

  After command completion occurred, registers were:
  ER -- ST COUNT  LBA_48  LH LM LL DV DC
  -- -- -- == -- == == == -- -- -- -- --
  84 -- 41 00 28 00 00 0e b7 3b ff 40 00  Error: ICRC, ABRT at LBA = 0x0eb73bff = 246889471

  Commands leading to the command that caused the error were:
  CR FEATR COUNT  LBA_48  LH LM LL DV DC  Powered_Up_Time  Command/Feature_Name
  -- == -- == -- == == == -- -- -- -- --  ---------------  --------------------
  60 00 08 00 40 00 00 1d 5d 38 18 40 00     00:00:19.549  READ FPDMA QUEUED
  60 00 08 00 38 00 00 1d 5d 58 00 40 00     00:00:19.541  READ FPDMA QUEUED
  60 02 00 00 30 00 00 0e b7 34 00 40 00     00:00:19.519  READ FPDMA QUEUED
  60 01 f8 00 28 00 00 0e b7 3a 08 40 00     00:00:19.519  READ FPDMA QUEUED
  60 01 f8 00 20 00 00 0e ad da 08 40 00     00:00:19.518  READ FPDMA QUEUED

Error 2 [1] occurred at disk power-on lifetime: 11252 hours (468 days + 20 hours)
  When the command that caused the error occurred, the device was active or idle.

  After command completion occurred, registers were:
  ER -- ST COUNT  LBA_48  LH LM LL DV DC
  -- -- -- == -- == == == -- -- -- -- --
  84 -- 41 00 48 00 00 0f 75 6b ff 40 00  Error: ICRC, ABRT at LBA = 0x0f756bff = 259353599

  Commands leading to the command that caused the error were:
  CR FEATR COUNT  LBA_48  LH LM LL DV DC  Powered_Up_Time  Command/Feature_Name
  -- == -- == -- == == == -- -- -- -- --  ---------------  --------------------
  60 01 00 00 48 00 00 0f 75 6b 00 40 00     00:07:16.718  READ FPDMA QUEUED
  60 01 00 00 40 00 00 0f 75 6a 00 40 00     00:07:16.716  READ FPDMA QUEUED
  60 01 00 00 38 00 00 0f 75 69 00 40 00     00:07:16.713  READ FPDMA QUEUED
  60 01 00 00 30 00 00 0f 75 68 00 40 00     00:07:16.711  READ FPDMA QUEUED
  60 01 00 00 28 00 00 0f 75 67 00 40 00     00:07:16.689  READ FPDMA QUEUED

Error 1 [0] occurred at disk power-on lifetime: 10658 hours (444 days + 2 hours)
  When the command that caused the error occurred, the device was active or idle.

  After command completion occurred, registers were:
  ER -- ST COUNT  LBA_48  LH LM LL DV DC
  -- -- -- == -- == == == -- -- -- -- --
  84 -- 41 00 38 00 00 0c 7f fb ff 40 00  Error: ICRC, ABRT at LBA = 0x0c7ffbff = 209714175

  Commands leading to the command that caused the error were:
  CR FEATR COUNT  LBA_48  LH LM LL DV DC  Powered_Up_Time  Command/Feature_Name
  -- == -- == -- == == == -- -- -- -- --  ---------------  --------------------
  60 02 00 00 38 00 00 0c 7f fa 00 40 00     00:00:33.981  READ FPDMA QUEUED
  60 01 80 00 30 00 00 0c 7f f8 80 40 00     00:00:33.952  READ FPDMA QUEUED
  60 00 38 00 28 00 00 0c 7f f8 40 40 00     00:00:33.952  READ FPDMA QUEUED
  60 00 18 00 20 00 00 0c 7f f8 20 40 00     00:00:33.952  READ FPDMA QUEUED
  60 00 08 00 18 00 00 0c 7f f8 10 40 00     00:00:33.952  READ FPDMA QUEUED

SMART Extended Self-test Log Version: 1 (1 sectors)
Num  Test_Description    Status                  Remaining  LifeTime(hours)  LBA_of_first_error
# 1  Short offline       Completed without error       00%     11797         -
# 2  Short offline       Completed without error       00%     11770         -
# 3  Short offline       Completed without error       00%     11715         -
# 4  Short offline       Interrupted (host reset)      20%     11654         -
# 5  Short offline       Completed without error       00%     11637         -
# 6  Short offline       Completed without error       00%     11626         -
# 7  Short offline       Completed without error       00%     11177         -
# 8  Short offline       Completed without error       00%     11070         -
# 9  Short offline       Aborted by host               40%     10669         -
#10  Short offline       Completed without error       00%     10664         -
#11  Short offline       Completed without error       00%     10660         -
#12  Short offline       Completed without error       00%      8048         -
#13  Extended offline    Aborted by host               90%      7783         -
#14  Extended offline    Aborted by host               50%      7579         -
#15  Extended offline    Aborted by host               50%      7161         -
#16  Short offline       Completed without error       00%      2599         -
#17  Short offline       Completed without error       00%      2599         -
#18  Short offline       Completed without error       00%      2599         -
#19  Short offline       Completed without error       00%      2599         -

SMART Selective self-test log data structure revision number 1
 SPAN  MIN_LBA  MAX_LBA  CURRENT_TEST_STATUS
    1        0        0  Not_testing
    2        0        0  Not_testing
    3        0        0  Not_testing
    4        0        0  Not_testing
    5        0        0  Not_testing
Selective self-test flags (0x0):
  After scanning selected spans, do NOT read-scan remainder of disk.
If Selective self-test is pending on power-up, resume after 0 minute delay.

SCT Status Version:                  2
SCT Version (vendor specific):       1 (0x0001)
Device State:                        SMART Off-line Data Collection executing in background (4)
Current Temperature:                    38 Celsius
Power Cycle Min/Max Temperature:     36/39 Celsius
Lifetime    Min/Max Temperature:     12/47 Celsius
Under/Over Temperature Limit Count:   0/0

SCT Temperature History Version:     2
Temperature Sampling Period:         1 minute
Temperature Logging Interval:        1 minute
Min/Max recommended Temperature:      5/55 Celsius
Min/Max Temperature Limit:            5/55 Celsius
Temperature History Size (Index):    478 (219)

SCT Error Recovery Control:
           Read: Disabled
          Write: Disabled

Device Statistics (GP Log 0x04)
Page  Offset Size        Value Flags Description
0x01  =====  =               =  ===  == General Statistics (rev 2) ==
0x01  0x008  4           12813  ---  Lifetime Power-On Resets
0x01  0x010  4           16715  ---  Power-on Hours
0x01  0x018  6     23292802948  ---  Logical Sectors Written
0x01  0x020  6       224869607  ---  Number of Write Commands
0x01  0x028  6     39980242242  ---  Logical Sectors Read
0x01  0x030  6       519289461  ---  Number of Read Commands
0x02  =====  =               =  ===  == Free-Fall Statistics (rev 1) ==
0x02  0x010  4              45  ---  Overlimit Shock Events
0x03  =====  =               =  ===  == Rotating Media Statistics (rev 1) ==
0x03  0x008  4            8452  ---  Spindle Motor Power-on Hours
0x03  0x010  4           15928  ---  Head Flying Hours
0x03  0x018  4           75881  ---  Head Load Events
0x03  0x020  4               0  ---  Number of Reallocated Logical Sectors
0x03  0x028  4               5  ---  Read Recovery Attempts
0x03  0x030  4               0  ---  Number of Mechanical Start Failures
0x04  =====  =               =  ===  == General Errors Statistics (rev 1) ==
0x04  0x008  4               0  ---  Number of Reported Uncorrectable Errors
0x04  0x010  4              36  ---  Resets Between Cmd Acceptance and Completion
0x05  =====  =               =  ===  == Temperature Statistics (rev 1) ==
0x05  0x008  1              38  ---  Current Temperature
0x05  0x010  1              33  N--  Average Short Term Temperature
0x05  0x018  1              32  N--  Average Long Term Temperature
0x05  0x020  1              47  ---  Highest Temperature
0x05  0x028  1              12  ---  Lowest Temperature
0x05  0x030  1              40  N--  Highest Average Short Term Temperature
0x05  0x038  1              26  N--  Lowest Average Short Term Temperature
0x05  0x040  1              34  N--  Highest Average Long Term Temperature
0x05  0x048  1              28  N--  Lowest Average Long Term Temperature
0x05  0x050  4               0  ---  Time in Over-Temperature
0x05  0x058  1              55  ---  Specified Maximum Operating Temperature
0x05  0x060  4               0  ---  Time in Under-Temperature
0x05  0x068  1               5  ---  Specified Minimum Operating Temperature
0x06  =====  =               =  ===  == Transport Statistics (rev 1) ==
0x06  0x008  4           36209  ---  Number of Hardware Resets
0x06  0x018  4               4  ---  Number of Interface CRC Errors
0x07  =====  =               =  ===  == Solid State Device Statistics (rev 1) ==
0x07  0x008  1              27  N--  Percentage Used Endurance Indicator
                                |||_ C monitored condition met
                                ||__ D supports DSN
                                |___ N normalized value

Pending Defects log (GP Log 0x0c) not supported

SATA Phy Event Counters (GP Log 0x11)
ID      Size     Value  Description
0x0001  4            0  Command failed due to ICRC error
0x0002  4            0  R_ERR response for data FIS
0x0003  4            0  R_ERR response for device-to-host data FIS
0x0004  4            0  R_ERR response for host-to-device data FIS
0x0005  4            0  R_ERR response for non-data FIS
0x0006  4            0  R_ERR response for device-to-host non-data FIS
0x0007  4            0  R_ERR response for host-to-device non-data FIS
0x0008  4            0  Device-to-host non-data FIS retries
0x0009  4        25073  Transition from drive PhyRdy to drive PhyNRdy
0x000a  4            8  Device-to-host register FISes sent due to a COMRESET
0x000b  4            0  CRC errors within host-to-device FIS
0x000d  4            0  Non-CRC errors within host-to-device FIS
0x000f  4            0  R_ERR response for host-to-device data FIS, CRC
0x0010  4            0  R_ERR response for host-to-device data FIS, non-CRC
0x0012  4            0  R_ERR response for host-to-device non-data FIS, CRC
0x0013  4            0  R_ERR response for host-to-device non-data FIS, non-CRC

