=== START OF INFORMATION SECTION ===
Model Family:     Hitachi/HGST Travelstar 7K750
Device Model:     HTS727575A9E364
Serial Number:    --
LU WWN Device Id: 5 000cca ...
Firmware Version: JF4OA0D0
User Capacity:    750,156,374,016 bytes [750 GB]
Sector Sizes:     512 bytes logical, 4096 bytes physical
Rotation Rate:    7200 rpm
Form Factor:      2.5 inches
Device is:        In smartctl database [for details use: -P show]
ATA Version is:   ATA8-ACS T13/1699-D revision 6
SATA Version is:  SATA 2.6, 3.0 Gb/s
Local Time is:    Tue Jun 18 22:03:02 2024 CEST
SMART support is: Available - device has SMART capability.
SMART support is: Enabled
AAM feature is:   Unavailable
APM level is:     128 (minimum power consumption without standby)
Rd look-ahead is: Enabled
Write cache is:   Enabled
DSN feature is:   Unavailable
ATA Security is:  Disabled, NOT FROZEN [SEC1]
Write SCT (Get) Feature Control Command failed: scsi error unsupported scsi opcode
Wt Cache Reorder: Unknown (SCT Feature Control command failed)

=== START OF READ SMART DATA SECTION ===
SMART Status not supported: Incomplete response, ATA output registers missing
SMART overall-health self-assessment test result: PASSED
Warning: This result is based on an Attribute check.

General SMART Values:
Offline data collection status:  (0x82)	Offline data collection activity
					was completed without error.
					Auto Offline Data Collection: Enabled.
Self-test execution status:      (   0)	The previous self-test routine completed
					without error or no self-test has ever 
					been run.
Total time to complete Offline 
data collection: 		(   45) seconds.
Offline data collection
capabilities: 			 (0x5b) SMART execute Offline immediate.
					Auto Offline data collection on/off support.
					Suspend Offline collection upon new
					command.
					Offline surface scan supported.
					Self-test supported.
					No Conveyance Self-test supported.
					Selective Self-test supported.
SMART capabilities:            (0x0003)	Saves SMART data before entering
					power-saving mode.
					Supports SMART auto save timer.
Error logging capability:        (0x01)	Error logging supported.
					General Purpose Logging supported.
Short self-test routine 
recommended polling time: 	 (   2) minutes.
Extended self-test routine
recommended polling time: 	 ( 160) minutes.
SCT capabilities: 	       (0x003d)	SCT Status supported.
					SCT Error Recovery Control supported.
					SCT Feature Control supported.
					SCT Data Table supported.

SMART Attributes Data Structure revision number: 16
Vendor Specific SMART Attributes with Thresholds:
ID# ATTRIBUTE_NAME          FLAGS    VALUE WORST THRESH FAIL RAW_VALUE
  1 Raw_Read_Error_Rate     PO-R--   100   100   062    -    0
  2 Throughput_Performance  P-S---   161   161   040    -    106
  3 Spin_Up_Time            POS---   187   187   033    -    2
  4 Start_Stop_Count        -O--C-   089   089   000    -    17478
  5 Reallocated_Sector_Ct   PO--CK   100   100   005    -    0
  7 Seek_Error_Rate         PO-R--   100   100   067    -    0
  8 Seek_Time_Performance   P-S---   094   094   040    -    58
  9 Power_On_Hours          -O--C-   010   010   000    -    39721
 10 Spin_Retry_Count        PO--C-   100   100   060    -    0
 12 Power_Cycle_Count       -O--CK   096   096   000    -    6819
191 G-Sense_Error_Rate      -O-R--   100   100   000    -    0
192 Power-Off_Retract_Count -O--CK   099   099   000    -    307
193 Load_Cycle_Count        -O--C-   001   001   000    -    1748305
194 Temperature_Celsius     -O----   206   206   000    -    29 (Min/Max 10/48)
196 Reallocated_Event_Count -O--CK   100   100   000    -    0
197 Current_Pending_Sector  -O---K   100   100   000    -    0
198 Offline_Uncorrectable   ---R--   100   100   000    -    0
199 UDMA_CRC_Error_Count    -O-R--   200   200   000    -    1
223 Load_Retry_Count        -O-R--   100   100   000    -    0
                            ||||||_ K auto-keep
                            |||||__ C event count
                            ||||___ R error rate
                            |||____ S speed/performance
                            ||_____ O updated online
                            |______ P prefailure warning

ATA_READ_LOG_EXT (addr=0x00:0x00, page=0, n=1) failed: scsi error unsupported scsi opcode
Read GP Log Directory failed

SMART Log Directory Version 1 [multi-sector log support]
Address    Access  R/W   Size  Description
0x00           SL  R/O      1  Log Directory
0x01           SL  R/O      1  Summary SMART error log
0x02           SL  R/O      1  Comprehensive SMART error log
0x06           SL  R/O      1  SMART self-test log
0x09           SL  R/W      1  Selective self-test log
0x80-0x9f      SL  R/W     16  Host vendor specific log
0xe0           SL  R/W      1  SCT Command/Status
0xe1           SL  R/W      1  SCT Data Transfer

SMART Extended Comprehensive Error Log (GP Log 0x03) not supported

SMART Error Log Version: 1
ATA Error Count: 1
	CR = Command Register [HEX]
	FR = Features Register [HEX]
	SC = Sector Count Register [HEX]
	SN = Sector Number Register [HEX]
	CL = Cylinder Low Register [HEX]
	CH = Cylinder High Register [HEX]
	DH = Device/Head Register [HEX]
	DC = Device Command Register [HEX]
	ER = Error register [HEX]
	ST = Status register [HEX]
Powered_Up_Time is measured from power on, and printed as
DDd+hh:mm:SS.sss where DD=days, hh=hours, mm=minutes,
SS=sec, and sss=millisec. It "wraps" after 49.710 days.

Error 1 occurred at disk power-on lifetime: 39238 hours (1634 days + 22 hours)
  When the command that caused the error occurred, the device was active or idle.

  After command completion occurred, registers were:
  ER ST SC SN CL CH DH
  -- -- -- -- -- -- --
  84 51 70 50 66 0e 00  Error: ICRC, ABRT 112 sectors at LBA = 0x000e6650 = 943696

  Commands leading to the command that caused the error were:
  CR FR SC SN CL CH DH DC   Powered_Up_Time  Command/Feature_Name
  -- -- -- -- -- -- -- --  ----------------  --------------------
  35 ff 80 40 66 0e 40 00      02:59:53.768  WRITE DMA EXT
  35 ff 80 c0 65 0e 40 00      02:59:53.766  WRITE DMA EXT
  35 ff 80 40 65 0e 40 00      02:59:53.765  WRITE DMA EXT
  35 ff 80 c0 64 0e 40 00      02:59:53.763  WRITE DMA EXT
  35 ff 80 40 64 0e 40 00      02:59:53.762  WRITE DMA EXT

SMART Extended Self-test Log (GP Log 0x07) not supported

SMART Self-test log structure revision number 1
Num  Test_Description    Status                  Remaining  LifeTime(hours)  LBA_of_first_error
# 1  Short offline       Aborted by host               90%     37546         -
# 2  Short offline       Completed without error       00%     12248         -
# 3  Short offline       Aborted by host               90%     11756         -
# 4  Extended offline    Completed without error       00%     11248         -
# 5  Extended offline    Completed without error       00%     11193         -
# 6  Extended offline    Completed without error       00%     11105         -
# 7  Extended offline    Completed without error       00%     10657         -
# 8  Short offline       Aborted by host               90%     10632         -
# 9  Short offline       Completed without error       00%     10632         -

SMART Selective self-test log data structure revision number 1
 SPAN  MIN_LBA  MAX_LBA  CURRENT_TEST_STATUS
    1        0        0  Not_testing
    2        0        0  Not_testing
    3        0        0  Not_testing
    4        0        0  Not_testing
    5        0        0  Not_testing
Selective self-test flags (0x0):
  After scanning selected spans, do NOT read-scan remainder of disk.
If Selective self-test is pending on power-up, resume after 0 minute delay.

SCT Status Version:                  3
SCT Version (vendor specific):       256 (0x0100)
Device State:                        Active (0)
Current Temperature:                    29 Celsius
Power Cycle Min/Max Temperature:     29/33 Celsius
Lifetime    Min/Max Temperature:     10/48 Celsius
Specified Max Operating Temperature:    31 Celsius
Under/Over Temperature Limit Count:   0/0

Write SCT Data Table failed: scsi error unsupported scsi opcode
Read SCT Temperature History failed

Write SCT (Get) Error Recovery Control Command failed: scsi error unsupported scsi opcode
SCT (Get) Error Recovery Control command failed

Device Statistics (GP/SMART Log 0x04) not supported

Pending Defects log (GP Log 0x0c) not supported

ATA_READ_LOG_EXT (addr=0x11:0x00, page=0, n=1) failed: scsi error unsupported scsi opcode
Read SATA Phy Event Counters failed

