smartctl 7.3 2022-02-28 r5338 [x86_64-linux-6.2.10-arch1-1] (local build)
Copyright (C) 2002-22, Bruce Allen, Christian Franke, www.smartmontools.org

=== START OF INFORMATION SECTION ===
Model Family:     Western Digital Caviar Green (AF)
Device Model:     WDC WD20EARS-00MVWB0
Serial Number:    --
LU WWN Device Id: 5 0014ee ...
Firmware Version: 51.0AB51
User Capacity:    2,000,398,934,016 bytes [2.00 TB]
Sector Size:      512 bytes logical/physical
Device is:        In smartctl database 7.3/5319
ATA Version is:   ATA8-ACS (minor revision not indicated)
SATA Version is:  SATA 2.6, 3.0 Gb/s
Local Time is:    Mon Apr 10 22:14:14 2023 CEST
SMART support is: Available - device has SMART capability.
SMART support is: Enabled
AAM feature is:   Disabled
APM feature is:   Unavailable
Rd look-ahead is: Enabled
Write cache is:   Enabled
DSN feature is:   Unavailable
ATA Security is:  Disabled, frozen [SEC2]
Wt Cache Reorder: Enabled

=== START OF READ SMART DATA SECTION ===
SMART overall-health self-assessment test result: PASSED

General SMART Values:
Offline data collection status:  (0x82)	Offline data collection activity
					was completed without error.
					Auto Offline Data Collection: Enabled.
Self-test execution status:      (   0)	The previous self-test routine completed
					without error or no self-test has ever 
					been run.
Total time to complete Offline 
data collection: 		(37080) seconds.
Offline data collection
capabilities: 			 (0x7b) SMART execute Offline immediate.
					Auto Offline data collection on/off support.
					Suspend Offline collection upon new
					command.
					Offline surface scan supported.
					Self-test supported.
					Conveyance Self-test supported.
					Selective Self-test supported.
SMART capabilities:            (0x0003)	Saves SMART data before entering
					power-saving mode.
					Supports SMART auto save timer.
Error logging capability:        (0x01)	Error logging supported.
					General Purpose Logging supported.
Short self-test routine 
recommended polling time: 	 (   2) minutes.
Extended self-test routine
recommended polling time: 	 ( 358) minutes.
Conveyance self-test routine
recommended polling time: 	 (   5) minutes.
SCT capabilities: 	       (0x3035)	SCT Status supported.
					SCT Feature Control supported.
					SCT Data Table supported.

SMART Attributes Data Structure revision number: 16
Vendor Specific SMART Attributes with Thresholds:
ID# ATTRIBUTE_NAME          FLAGS    VALUE WORST THRESH FAIL RAW_VALUE
  1 Raw_Read_Error_Rate     POSR-K   190   189   051    -    2670
  3 Spin_Up_Time            POS--K   224   167   021    -    3800
  4 Start_Stop_Count        -O--CK   093   093   000    -    7886
  5 Reallocated_Sector_Ct   PO--CK   200   200   140    -    0
  7 Seek_Error_Rate         -OSR-K   200   200   000    -    0
  9 Power_On_Hours          -O--CK   091   091   000    -    6713
 10 Spin_Retry_Count        -O--CK   100   100   000    -    0
 11 Calibration_Retry_Count -O--CK   100   100   000    -    0
 12 Power_Cycle_Count       -O--CK   097   097   000    -    3989
192 Power-Off_Retract_Count -O--CK   199   199   000    -    1000
193 Load_Cycle_Count        -O--CK   196   196   000    -    13872
194 Temperature_Celsius     -O---K   128   105   000    -    22
196 Reallocated_Event_Count -O--CK   200   200   000    -    0
197 Current_Pending_Sector  -O--CK   200   200   000    -    20
198 Offline_Uncorrectable   ----CK   200   200   000    -    0
199 UDMA_CRC_Error_Count    -O--CK   200   200   000    -    7
200 Multi_Zone_Error_Rate   ---R--   200   199   000    -    0
                            ||||||_ K auto-keep
                            |||||__ C event count
                            ||||___ R error rate
                            |||____ S speed/performance
                            ||_____ O updated online
                            |______ P prefailure warning

General Purpose Log Directory Version 1
SMART           Log Directory Version 1 [multi-sector log support]
Address    Access  R/W   Size  Description
0x00       GPL,SL  R/O      1  Log Directory
0x01           SL  R/O      1  Summary SMART error log
0x02           SL  R/O      5  Comprehensive SMART error log
0x03       GPL     R/O      6  Ext. Comprehensive SMART error log
0x06           SL  R/O      1  SMART self-test log
0x07       GPL     R/O      1  Extended self-test log
0x09           SL  R/W      1  Selective self-test log
0x10       GPL     R/O      1  NCQ Command Error log
0x11       GPL     R/O      1  SATA Phy Event Counters log
0x80-0x9f  GPL,SL  R/W     16  Host vendor specific log
0xa0-0xa7  GPL,SL  VS      16  Device vendor specific log
0xa8-0xb7  GPL,SL  VS       1  Device vendor specific log
0xc0       GPL,SL  VS       1  Device vendor specific log
0xc1       GPL     VS      93  Device vendor specific log
0xe0       GPL,SL  R/W      1  SCT Command/Status
0xe1       GPL,SL  R/W      1  SCT Data Transfer

SMART Extended Comprehensive Error Log Version: 1 (6 sectors)
Device Error Count: 17
	CR     = Command Register
	FEATR  = Features Register
	COUNT  = Count (was: Sector Count) Register
	LBA_48 = Upper bytes of LBA High/Mid/Low Registers ]  ATA-8
	LH     = LBA High (was: Cylinder High) Register    ]   LBA
	LM     = LBA Mid (was: Cylinder Low) Register      ] Register
	LL     = LBA Low (was: Sector Number) Register     ]
	DV     = Device (was: Device/Head) Register
	DC     = Device Control Register
	ER     = Error register
	ST     = Status register
Powered_Up_Time is measured from power on, and printed as
DDd+hh:mm:SS.sss where DD=days, hh=hours, mm=minutes,
SS=sec, and sss=millisec. It "wraps" after 49.710 days.

Error 17 [16] occurred at disk power-on lifetime: 5463 hours (227 days + 15 hours)
  When the command that caused the error occurred, the device was active or idle.

  After command completion occurred, registers were:
  ER -- ST COUNT  LBA_48  LH LM LL DV DC
  -- -- -- == -- == == == -- -- -- -- --
  40 -- 51 00 00 00 00 12 29 70 90 40 00  Error: UNC at LBA = 0x12297090 = 304705680

  Commands leading to the command that caused the error were:
  CR FEATR COUNT  LBA_48  LH LM LL DV DC  Powered_Up_Time  Command/Feature_Name
  -- == -- == -- == == == -- -- -- -- --  ---------------  --------------------
  60 01 00 00 80 00 00 12 29 77 88 40 00     00:43:53.080  READ FPDMA QUEUED
  60 01 00 00 78 00 00 12 29 76 88 40 00     00:43:53.080  READ FPDMA QUEUED
  60 01 00 00 70 00 00 12 29 75 88 40 00     00:43:53.080  READ FPDMA QUEUED
  60 01 00 00 68 00 00 12 29 74 88 40 00     00:43:53.080  READ FPDMA QUEUED
  60 01 00 00 60 00 00 12 29 73 88 40 00     00:43:53.079  READ FPDMA QUEUED

Error 16 [15] occurred at disk power-on lifetime: 5463 hours (227 days + 15 hours)
  When the command that caused the error occurred, the device was active or idle.

  After command completion occurred, registers were:
  ER -- ST COUNT  LBA_48  LH LM LL DV DC
  -- -- -- == -- == == == -- -- -- -- --
  40 -- 51 00 00 00 00 12 29 41 48 40 00  Error: UNC at LBA = 0x12294148 = 304693576

  Commands leading to the command that caused the error were:
  CR FEATR COUNT  LBA_48  LH LM LL DV DC  Powered_Up_Time  Command/Feature_Name
  -- == -- == -- == == == -- -- -- -- --  ---------------  --------------------
  60 01 00 00 a8 00 00 12 29 47 88 40 00     00:43:42.604  READ FPDMA QUEUED
  60 01 00 00 a0 00 00 12 29 46 88 40 00     00:43:42.604  READ FPDMA QUEUED
  60 01 00 00 98 00 00 12 29 45 88 40 00     00:43:42.604  READ FPDMA QUEUED
  60 01 00 00 90 00 00 12 29 44 88 40 00     00:43:42.604  READ FPDMA QUEUED
  60 01 00 00 88 00 00 12 29 43 88 40 00     00:43:42.604  READ FPDMA QUEUED

Error 15 [14] occurred at disk power-on lifetime: 5463 hours (227 days + 15 hours)
  When the command that caused the error occurred, the device was active or idle.

  After command completion occurred, registers were:
  ER -- ST COUNT  LBA_48  LH LM LL DV DC
  -- -- -- == -- == == == -- -- -- -- --
  40 -- 51 00 00 00 00 12 29 08 90 40 00  Error: UNC at LBA = 0x12290890 = 304679056

  Commands leading to the command that caused the error were:
  CR FEATR COUNT  LBA_48  LH LM LL DV DC  Powered_Up_Time  Command/Feature_Name
  -- == -- == -- == == == -- -- -- -- --  ---------------  --------------------
  60 01 00 00 d0 00 00 12 29 17 88 40 00     00:43:32.985  READ FPDMA QUEUED
  60 01 00 00 c8 00 00 12 29 16 88 40 00     00:43:32.985  READ FPDMA QUEUED
  60 01 00 00 c0 00 00 12 29 15 88 40 00     00:43:32.985  READ FPDMA QUEUED
  60 01 00 00 b8 00 00 12 29 14 88 40 00     00:43:32.985  READ FPDMA QUEUED
  60 01 00 00 b0 00 00 12 29 13 88 40 00     00:43:32.985  READ FPDMA QUEUED

Error 14 [13] occurred at disk power-on lifetime: 5463 hours (227 days + 15 hours)
  When the command that caused the error occurred, the device was active or idle.

  After command completion occurred, registers were:
  ER -- ST COUNT  LBA_48  LH LM LL DV DC
  -- -- -- == -- == == == -- -- -- -- --
  40 -- 51 00 00 00 00 12 0b 47 28 40 00  Error: UNC at LBA = 0x120b4728 = 302729000

  Commands leading to the command that caused the error were:
  CR FEATR COUNT  LBA_48  LH LM LL DV DC  Powered_Up_Time  Command/Feature_Name
  -- == -- == -- == == == -- -- -- -- --  ---------------  --------------------
  60 01 00 00 f8 00 00 12 0b 47 88 40 00     00:42:49.667  READ FPDMA QUEUED
  60 01 00 00 f0 00 00 12 0b 46 88 40 00     00:42:49.667  READ FPDMA QUEUED
  60 01 00 00 e8 00 00 12 0b 45 88 40 00     00:42:49.666  READ FPDMA QUEUED
  60 01 00 00 e0 00 00 12 0b 44 88 40 00     00:42:49.666  READ FPDMA QUEUED
  60 01 00 00 d8 00 00 12 0b 43 88 40 00     00:42:49.665  READ FPDMA QUEUED

Error 13 [12] occurred at disk power-on lifetime: 5463 hours (227 days + 15 hours)
  When the command that caused the error occurred, the device was active or idle.

  After command completion occurred, registers were:
  ER -- ST COUNT  LBA_48  LH LM LL DV DC
  -- -- -- == -- == == == -- -- -- -- --
  40 -- 51 00 00 00 00 12 0b 43 40 40 00  Error: UNC at LBA = 0x120b4340 = 302728000

  Commands leading to the command that caused the error were:
  CR FEATR COUNT  LBA_48  LH LM LL DV DC  Powered_Up_Time  Command/Feature_Name
  -- == -- == -- == == == -- -- -- -- --  ---------------  --------------------
  60 01 00 00 f8 00 00 12 0b 47 88 40 00     00:42:46.290  READ FPDMA QUEUED
  60 01 00 00 f0 00 00 12 0b 46 88 40 00     00:42:46.290  READ FPDMA QUEUED
  60 01 00 00 e8 00 00 12 0b 45 88 40 00     00:42:46.290  READ FPDMA QUEUED
  60 01 00 00 e0 00 00 12 0b 44 88 40 00     00:42:46.290  READ FPDMA QUEUED
  60 01 00 00 d8 00 00 12 0b 43 88 40 00     00:42:46.290  READ FPDMA QUEUED

Error 12 [11] occurred at disk power-on lifetime: 5463 hours (227 days + 15 hours)
  When the command that caused the error occurred, the device was active or idle.

  After command completion occurred, registers were:
  ER -- ST COUNT  LBA_48  LH LM LL DV DC
  -- -- -- == -- == == == -- -- -- -- --
  40 -- 51 00 00 00 00 11 c4 83 68 40 00  Error: UNC at LBA = 0x11c48368 = 298091368

  Commands leading to the command that caused the error were:
  CR FEATR COUNT  LBA_48  LH LM LL DV DC  Powered_Up_Time  Command/Feature_Name
  -- == -- == -- == == == -- -- -- -- --  ---------------  --------------------
  60 01 00 00 78 00 00 11 c4 8a b8 40 00     00:41:11.161  READ FPDMA QUEUED
  60 01 00 00 70 00 00 11 c4 89 b8 40 00     00:41:11.161  READ FPDMA QUEUED
  60 01 00 00 68 00 00 11 c4 88 b8 40 00     00:41:11.161  READ FPDMA QUEUED
  60 01 00 00 60 00 00 11 c4 87 b8 40 00     00:41:11.161  READ FPDMA QUEUED
  60 01 00 00 58 00 00 11 c4 86 b8 40 00     00:41:11.161  READ FPDMA QUEUED

Error 11 [10] occurred at disk power-on lifetime: 5463 hours (227 days + 15 hours)
  When the command that caused the error occurred, the device was active or idle.

  After command completion occurred, registers were:
  ER -- ST COUNT  LBA_48  LH LM LL DV DC
  -- -- -- == -- == == == -- -- -- -- --
  40 -- 51 00 00 00 00 11 c2 04 b8 40 00  Error: UNC at LBA = 0x11c204b8 = 297927864

  Commands leading to the command that caused the error were:
  CR FEATR COUNT  LBA_48  LH LM LL DV DC  Powered_Up_Time  Command/Feature_Name
  -- == -- == -- == == == -- -- -- -- --  ---------------  --------------------
  60 01 00 00 f0 00 00 11 c2 00 b8 40 00     00:41:05.755  READ FPDMA QUEUED
  60 01 00 00 e8 00 00 11 c1 ff b8 40 00     00:41:05.755  READ FPDMA QUEUED
  60 01 00 00 e0 00 00 11 c1 fe b8 40 00     00:41:05.755  READ FPDMA QUEUED
  60 01 00 00 48 00 00 11 c2 0a b8 40 00     00:41:05.755  READ FPDMA QUEUED
  60 01 00 00 40 00 00 11 c2 09 b8 40 00     00:41:05.754  READ FPDMA QUEUED

Error 10 [9] occurred at disk power-on lifetime: 5463 hours (227 days + 15 hours)
  When the command that caused the error occurred, the device was active or idle.

  After command completion occurred, registers were:
  ER -- ST COUNT  LBA_48  LH LM LL DV DC
  -- -- -- == -- == == == -- -- -- -- --
  40 -- 51 00 00 00 00 11 c2 03 b8 40 00  Error: UNC at LBA = 0x11c203b8 = 297927608

  Commands leading to the command that caused the error were:
  CR FEATR COUNT  LBA_48  LH LM LL DV DC  Powered_Up_Time  Command/Feature_Name
  -- == -- == -- == == == -- -- -- -- --  ---------------  --------------------
  60 01 00 00 f0 00 00 11 c2 00 b8 40 00     00:41:02.998  READ FPDMA QUEUED
  60 01 00 00 e8 00 00 11 c1 ff b8 40 00     00:41:02.997  READ FPDMA QUEUED
  60 01 00 00 e0 00 00 11 c1 fe b8 40 00     00:41:02.997  READ FPDMA QUEUED
  60 01 00 00 48 00 00 11 c2 0a b8 40 00     00:41:02.997  READ FPDMA QUEUED
  60 01 00 00 40 00 00 11 c2 09 b8 40 00     00:41:02.997  READ FPDMA QUEUED

SMART Extended Self-test Log Version: 1 (1 sectors)
Num  Test_Description    Status                  Remaining  LifeTime(hours)  LBA_of_first_error
# 1  Extended offline    Aborted by host               90%      5485         -
# 2  Short offline       Completed without error       00%      5464         -
# 3  Short offline       Completed without error       00%      4908         -
# 4  Extended offline    Interrupted (host reset)      90%      1531         -
# 5  Short offline       Completed without error       00%      1474         -
# 6  Short offline       Completed without error       00%      1469         -
# 7  Extended offline    Interrupted (host reset)      90%      1447         -
# 8  Conveyance offline  Completed without error       00%      1379         -
# 9  Short offline       Completed without error       00%      1377         -

SMART Selective self-test log data structure revision number 1
 SPAN  MIN_LBA  MAX_LBA  CURRENT_TEST_STATUS
    1        0        0  Not_testing
    2        0        0  Not_testing
    3        0        0  Not_testing
    4        0        0  Not_testing
    5        0        0  Not_testing
Selective self-test flags (0x0):
  After scanning selected spans, do NOT read-scan remainder of disk.
If Selective self-test is pending on power-up, resume after 0 minute delay.

SCT Status Version:                  3
SCT Version (vendor specific):       258 (0x0102)
Device State:                        Active (0)
Current Temperature:                    22 Celsius
Power Cycle Min/Max Temperature:     22/22 Celsius
Lifetime    Min/Max Temperature:     19/45 Celsius
Under/Over Temperature Limit Count:   0/0

SCT Temperature History Version:     2
Temperature Sampling Period:         1 minute
Temperature Logging Interval:        1 minute
Min/Max recommended Temperature:      0/60 Celsius
Min/Max Temperature Limit:           -41/85 Celsius
Temperature History Size (Index):    478 (455)

SCT Error Recovery Control command not supported

Device Statistics (GP/SMART Log 0x04) not supported

Pending Defects log (GP Log 0x0c) not supported

SATA Phy Event Counters (GP Log 0x11)
ID      Size     Value  Description
0x0001  2            0  Command failed due to ICRC error
0x0002  2            0  R_ERR response for data FIS
0x0003  2            0  R_ERR response for device-to-host data FIS
0x0004  2            0  R_ERR response for host-to-device data FIS
0x0005  2            0  R_ERR response for non-data FIS
0x0006  2            0  R_ERR response for device-to-host non-data FIS
0x0007  2            0  R_ERR response for host-to-device non-data FIS
0x000a  2            2  Device-to-host register FISes sent due to a COMRESET
0x000b  2            0  CRC errors within host-to-device FIS
0x8000  4          185  Vendor specific

