smartctl 7.4 2023-08-01 r5530 [x86_64-linux-6.8.0-78-generic] (local build)
Copyright (C) 2002-23, Bruce Allen, Christian Franke, www.smartmontools.org

=== START OF INFORMATION SECTION ===
Model Number:                       Dahua C970 M.2 2280 NVMe 1TB SSD
Serial Number:                      --
Firmware Version:                   H230610a
PCI Vendor/Subsystem ID:            0x1e4b
IEEE OUI Identifier:                0x000000
Total NVM Capacity:                 1,024,209,543,168 [1.02 TB]
Unallocated NVM Capacity:           0
Controller ID:                      0
NVMe Version:                       1.4
Number of Namespaces:               1
Namespace 1 Size/Capacity:          1,024,209,543,168 [1.02 TB]
Namespace 1 Formatted LBA Size:     512
Namespace 1 IEEE EUI-64:            d0d0d0 ...
Local Time is:                      Tue Aug 26 13:58:14 2025 CEST
Firmware Updates (0x16):            3 Slots, no Reset required
Optional Admin Commands (0x0017):   Security Format Frmw_DL Self_Test
Optional NVM Commands (0x001f):     Comp Wr_Unc DS_Mngmt Wr_Zero Sav/Sel_Feat
Log Page Attributes (0x02):         Cmd_Eff_Lg
Maximum Data Transfer Size:         128 Pages
Warning  Comp. Temp. Threshold:     90 Celsius
Critical Comp. Temp. Threshold:     95 Celsius

Supported Power States
St Op     Max   Active     Idle   RL RT WL WT  Ent_Lat  Ex_Lat
 0 +     6.50W       -        -    0  0  0  0        0       0
 1 +     5.80W       -        -    1  1  1  1        0       0
 2 +     3.60W       -        -    2  2  2  2        0       0
 3 -   0.7460W       -        -    3  3  3  3     5000   10000
 4 -   0.7260W       -        -    4  4  4  4     8000   45000

Supported LBA Sizes (NSID 0x1)
Id Fmt  Data  Metadt  Rel_Perf
 0 +     512       0         0

=== START OF SMART DATA SECTION ===
SMART overall-health self-assessment test result: PASSED

SMART/Health Information (NVMe Log 0x02)
Critical Warning:                   0x00
Temperature:                        44 Celsius
Available Spare:                    100%
Available Spare Threshold:          1%
Percentage Used:                    0%
Data Units Read:                    246,290 [126 GB]
Data Units Written:                 601,846 [308 GB]
Host Read Commands:                 3,139,934
Host Write Commands:                4,336,012
Controller Busy Time:               6
Power Cycles:                       73
Power On Hours:                     22
Unsafe Shutdowns:                   47
Media and Data Integrity Errors:    0
Error Information Log Entries:      0
Warning  Comp. Temperature Time:    0
Critical Comp. Temperature Time:    0
Temperature Sensor 1:               44 Celsius
Temperature Sensor 2:               26 Celsius

Error Information (NVMe Log 0x01, 16 of 64 entries)
No Errors Logged

Read Self-test Log failed: Invalid Field in Command (0x2002)

