smartctl 7.2 2020-12-30 r5155 [x86_64-linux-5.16.13-desktop-1omv4003] (OpenMandriva Lx 7.2-2)
Copyright (C) 2002-20, Bruce Allen, Christian Franke, www.smartmontools.org

=== START OF INFORMATION SECTION ===
Device Model:     TOSHIBA MQ04ABF100
Serial Number:    --
LU WWN Device Id: 5 000039 ...
Firmware Version: JU0G0A
User Capacity:    1,000,204,886,016 bytes [1.00 TB]
Sector Sizes:     512 bytes logical, 4096 bytes physical
Rotation Rate:    5400 rpm
Form Factor:      2.5 inches
Zoned Device:     Device managed zones
Device is:        Not in smartctl database [for details use: -P showall]
ATA Version is:   ACS-3 T13/2161-D revision 5
SATA Version is:  SATA 3.3, 3.0 Gb/s (current: 3.0 Gb/s)
Local Time is:    Sun Feb  5 14:46:29 2023 EST
SMART support is: Available - device has SMART capability.
SMART support is: Enabled
AAM feature is:   Unavailable
APM level is:     254 (maximum performance)
Rd look-ahead is: Enabled
Write cache is:   Enabled
DSN feature is:   Disabled
ATA Security is:  Disabled, frozen [SEC2]
Wt Cache Reorder: Enabled

=== START OF READ SMART DATA SECTION ===
SMART overall-health self-assessment test result: PASSED

General SMART Values:
Offline data collection status:  (0x82)	Offline data collection activity
					was completed without error.
					Auto Offline Data Collection: Enabled.
Self-test execution status:      (   0)	The previous self-test routine completed
					without error or no self-test has ever 
					been run.
Total time to complete Offline 
data collection: 		(  120) seconds.
Offline data collection
capabilities: 			 (0x5b) SMART execute Offline immediate.
					Auto Offline data collection on/off support.
					Suspend Offline collection upon new
					command.
					Offline surface scan supported.
					Self-test supported.
					No Conveyance Self-test supported.
					Selective Self-test supported.
SMART capabilities:            (0x0003)	Saves SMART data before entering
					power-saving mode.
					Supports SMART auto save timer.
Error logging capability:        (0x01)	Error logging supported.
					General Purpose Logging supported.
Short self-test routine 
recommended polling time: 	 (   2) minutes.
Extended self-test routine
recommended polling time: 	 ( 168) minutes.
SCT capabilities: 	       (0x003d)	SCT Status supported.
					SCT Error Recovery Control supported.
					SCT Feature Control supported.
					SCT Data Table supported.

SMART Attributes Data Structure revision number: 16
Vendor Specific SMART Attributes with Thresholds:
ID# ATTRIBUTE_NAME          FLAGS    VALUE WORST THRESH FAIL RAW_VALUE
  1 Raw_Read_Error_Rate     PO-R--   100   100   050    -    0
  2 Throughput_Performance  P-S---   100   100   050    -    0
  3 Spin_Up_Time            POS--K   100   100   001    -    1316
  4 Start_Stop_Count        -O--CK   100   100   000    -    8748
  5 Reallocated_Sector_Ct   PO--CK   100   100   050    -    16
  7 Seek_Error_Rate         PO-R--   100   091   050    -    0
  8 Seek_Time_Performance   P-S---   100   100   050    -    0
  9 Power_On_Hours          -O--CK   039   039   000    -    24658
 10 Spin_Retry_Count        PO--CK   253   100   030    -    0
 12 Power_Cycle_Count       -O--CK   100   100   000    -    1808
191 G-Sense_Error_Rate      -O--CK   100   100   000    -    111
192 Power-Off_Retract_Count -O--CK   099   099   000    -    913
193 Load_Cycle_Count        -O--CK   081   081   000    -    199955
194 Temperature_Celsius     -O---K   100   100   000    -    36 (Min/Max 17/58)
196 Reallocated_Event_Count -O--CK   100   100   000    -    16
197 Current_Pending_Sector  -O--CK   100   100   000    -    0
198 Offline_Uncorrectable   ----CK   100   100   000    -    0
199 UDMA_CRC_Error_Count    -O--CK   200   253   000    -    0
220 Disk_Shift              -O----   100   100   000    -    0
222 Loaded_Hours            -O--CK   062   062   000    -    15505
223 Load_Retry_Count        -O--CK   100   100   000    -    0
224 Load_Friction           -O---K   100   100   000    -    0
226 Load-in_Time            -OS--K   100   100   000    -    189
240 Head_Flying_Hours       P-----   100   100   001    -    0
                            ||||||_ K auto-keep
                            |||||__ C event count
                            ||||___ R error rate
                            |||____ S speed/performance
                            ||_____ O updated online
                            |______ P prefailure warning

General Purpose Log Directory Version 1
SMART           Log Directory Version 1 [multi-sector log support]
Address    Access  R/W   Size  Description
0x00       GPL,SL  R/O      1  Log Directory
0x01           SL  R/O      1  Summary SMART error log
0x02           SL  R/O     51  Comprehensive SMART error log
0x03       GPL     R/O     64  Ext. Comprehensive SMART error log
0x04       GPL,SL  R/O      8  Device Statistics log
0x06           SL  R/O      1  SMART self-test log
0x07       GPL     R/O      1  Extended self-test log
0x09           SL  R/W      1  Selective self-test log
0x0a       GPL     R/W      2  Device Statistics Notification
0x10       GPL     R/O      1  NCQ Command Error log
0x11       GPL     R/O      1  SATA Phy Event Counters log
0x24       GPL     R/O  32768  Current Device Internal Status Data log
0x30       GPL,SL  R/O      9  IDENTIFY DEVICE data log
0x80-0x9f  GPL,SL  R/W     16  Host vendor specific log
0xa7       GPL     VS       8  Device vendor specific log
0xe0       GPL,SL  R/W      1  SCT Command/Status
0xe1       GPL,SL  R/W      1  SCT Data Transfer

SMART Extended Comprehensive Error Log Version: 1 (64 sectors)
Device Error Count: 25
	CR     = Command Register
	FEATR  = Features Register
	COUNT  = Count (was: Sector Count) Register
	LBA_48 = Upper bytes of LBA High/Mid/Low Registers ]  ATA-8
	LH     = LBA High (was: Cylinder High) Register    ]   LBA
	LM     = LBA Mid (was: Cylinder Low) Register      ] Register
	LL     = LBA Low (was: Sector Number) Register     ]
	DV     = Device (was: Device/Head) Register
	DC     = Device Control Register
	ER     = Error register
	ST     = Status register
Powered_Up_Time is measured from power on, and printed as
DDd+hh:mm:SS.sss where DD=days, hh=hours, mm=minutes,
SS=sec, and sss=millisec. It "wraps" after 49.710 days.

Error 25 [24] occurred at disk power-on lifetime: 23134 hours (963 days + 22 hours)
  When the command that caused the error occurred, the device was active or idle.

  After command completion occurred, registers were:
  ER -- ST COUNT  LBA_48  LH LM LL DV DC
  -- -- -- == -- == == == -- -- -- -- --
  84 -- 51 00 16 00 00 22 43 20 2a 40 00  Error: ICRC, ABRT 22 sectors at LBA = 0x2243202a = 574824490

  Commands leading to the command that caused the error were:
  CR FEATR COUNT  LBA_48  LH LM LL DV DC  Powered_Up_Time  Command/Feature_Name
  -- == -- == -- == == == -- -- -- -- --  ---------------  --------------------
  25 00 00 00 26 00 00 22 43 20 1a 40 00     00:00:34.103  READ DMA EXT
  25 00 00 00 1a 00 00 22 43 20 00 40 00     00:00:34.103  READ DMA EXT
  25 00 00 00 1a 00 00 22 43 20 00 40 00     00:00:34.103  READ DMA EXT
  25 00 00 00 1a 00 00 22 43 20 00 40 00     00:00:34.103  READ DMA EXT
  25 00 00 00 1a 00 00 22 43 20 00 40 00     00:00:34.103  READ DMA EXT

Error 24 [23] occurred at disk power-on lifetime: 13665 hours (569 days + 9 hours)
  When the command that caused the error occurred, the device was active or idle.

  After command completion occurred, registers were:
  ER -- ST COUNT  LBA_48  LH LM LL DV DC
  -- -- -- == -- == == == -- -- -- -- --
  40 -- 41 00 b0 00 00 5b b1 0d c8 40 00  Error: UNC at LBA = 0x5bb10dc8 = 1538330056

  Commands leading to the command that caused the error were:
  CR FEATR COUNT  LBA_48  LH LM LL DV DC  Powered_Up_Time  Command/Feature_Name
  -- == -- == -- == == == -- -- -- -- --  ---------------  --------------------
  60 00 38 00 a0 00 00 6d a6 1e 81 40 00     00:02:15.307  READ FPDMA QUEUED
  60 00 08 00 58 00 00 6e 23 97 b9 40 00     00:02:15.302  READ FPDMA QUEUED
  60 00 08 00 50 00 00 6e 20 83 69 40 00     00:02:15.302  READ FPDMA QUEUED
  60 00 08 00 48 00 00 6d c7 b9 c1 40 00     00:02:15.301  READ FPDMA QUEUED
  60 01 00 00 b0 00 00 5b b1 0d 89 40 00     00:02:15.276  READ FPDMA QUEUED

Error 23 [22] occurred at disk power-on lifetime: 13645 hours (568 days + 13 hours)
  When the command that caused the error occurred, the device was active or idle.

  After command completion occurred, registers were:
  ER -- ST COUNT  LBA_48  LH LM LL DV DC
  -- -- -- == -- == == == -- -- -- -- --
  40 -- 41 00 08 00 00 5b b1 0d c8 40 00  Error: UNC at LBA = 0x5bb10dc8 = 1538330056

  Commands leading to the command that caused the error were:
  CR FEATR COUNT  LBA_48  LH LM LL DV DC  Powered_Up_Time  Command/Feature_Name
  -- == -- == -- == == == -- -- -- -- --  ---------------  --------------------
  60 00 a8 00 88 00 00 59 b3 37 b9 40 00  1d+04:18:21.968  READ FPDMA QUEUED
  60 01 00 00 08 00 00 5b b1 0d 89 40 00  1d+04:18:21.956  READ FPDMA QUEUED
  60 00 60 00 00 00 00 5b b1 0d 29 40 00  1d+04:18:21.955  READ FPDMA QUEUED
  60 01 00 00 f8 00 00 5b b1 0c 29 40 00  1d+04:18:21.953  READ FPDMA QUEUED
  60 00 78 00 b8 00 00 5b b1 0b b1 40 00  1d+04:18:21.952  READ FPDMA QUEUED

Error 22 [21] occurred at disk power-on lifetime: 13645 hours (568 days + 13 hours)
  When the command that caused the error occurred, the device was active or idle.

  After command completion occurred, registers were:
  ER -- ST COUNT  LBA_48  LH LM LL DV DC
  -- -- -- == -- == == == -- -- -- -- --
  40 -- 41 00 78 00 00 5b b1 0d c9 40 00  Error: WP at LBA = 0x5bb10dc9 = 1538330057

  Commands leading to the command that caused the error were:
  CR FEATR COUNT  LBA_48  LH LM LL DV DC  Powered_Up_Time  Command/Feature_Name
  -- == -- == -- == == == -- -- -- -- --  ---------------  --------------------
  61 00 08 00 48 00 00 57 e3 08 01 40 00  1d+03:55:25.487  WRITE FPDMA QUEUED
  61 01 e0 00 00 00 00 66 25 40 31 40 00  1d+03:55:25.485  WRITE FPDMA QUEUED
  61 00 08 00 40 00 00 57 e3 07 c9 40 00  1d+03:55:25.485  WRITE FPDMA QUEUED
  61 00 08 00 f0 00 00 64 af 4c 49 40 00  1d+03:55:25.485  WRITE FPDMA QUEUED
  61 00 08 00 38 00 00 57 e3 07 71 40 00  1d+03:55:25.484  WRITE FPDMA QUEUED

Error 21 [20] occurred at disk power-on lifetime: 13645 hours (568 days + 13 hours)
  When the command that caused the error occurred, the device was active or idle.

  After command completion occurred, registers were:
  ER -- ST COUNT  LBA_48  LH LM LL DV DC
  -- -- -- == -- == == == -- -- -- -- --
  40 -- 41 00 b8 00 00 5b b1 0d c9 40 00  Error: UNC at LBA = 0x5bb10dc9 = 1538330057

  Commands leading to the command that caused the error were:
  CR FEATR COUNT  LBA_48  LH LM LL DV DC  Powered_Up_Time  Command/Feature_Name
  -- == -- == -- == == == -- -- -- -- --  ---------------  --------------------
  60 00 08 00 b8 00 00 5b b1 0d c9 40 00  1d+03:55:24.669  READ FPDMA QUEUED
  60 00 08 00 d0 00 00 64 e0 7f 01 40 00  1d+03:55:24.658  READ FPDMA QUEUED
  60 01 00 00 c8 00 00 59 b6 d6 19 40 00  1d+03:55:24.616  READ FPDMA QUEUED
  60 00 88 00 c0 00 00 59 35 93 61 40 00  1d+03:55:24.578  READ FPDMA QUEUED
  60 00 08 00 b8 00 00 64 a0 7a b9 40 00  1d+03:55:24.540  READ FPDMA QUEUED

Error 20 [19] occurred at disk power-on lifetime: 13645 hours (568 days + 13 hours)
  When the command that caused the error occurred, the device was active or idle.

  After command completion occurred, registers were:
  ER -- ST COUNT  LBA_48  LH LM LL DV DC
  -- -- -- == -- == == == -- -- -- -- --
  40 -- 41 00 b0 00 00 5b b1 0d c9 40 00  Error: UNC at LBA = 0x5bb10dc9 = 1538330057

  Commands leading to the command that caused the error were:
  CR FEATR COUNT  LBA_48  LH LM LL DV DC  Powered_Up_Time  Command/Feature_Name
  -- == -- == -- == == == -- -- -- -- --  ---------------  --------------------
  60 00 08 00 b0 00 00 5b b1 0d c9 40 00  1d+03:55:23.836  READ FPDMA QUEUED
  ef 00 10 00 03 00 00 00 00 00 00 a0 00  1d+03:55:23.835  SET FEATURES [Enable SATA feature]
  ef 00 10 00 02 00 00 00 00 00 00 a0 00  1d+03:55:23.835  SET FEATURES [Enable SATA feature]
  27 00 00 00 00 00 00 00 00 00 00 e0 00  1d+03:55:23.835  READ NATIVE MAX ADDRESS EXT [OBS-ACS-3]
  ec 00 00 00 00 00 00 00 00 00 00 a0 00  1d+03:55:23.834  IDENTIFY DEVICE

Error 19 [18] occurred at disk power-on lifetime: 13645 hours (568 days + 13 hours)
  When the command that caused the error occurred, the device was active or idle.

  After command completion occurred, registers were:
  ER -- ST COUNT  LBA_48  LH LM LL DV DC
  -- -- -- == -- == == == -- -- -- -- --
  40 -- 41 00 48 00 00 5b b1 0d c9 40 00  Error: UNC at LBA = 0x5bb10dc9 = 1538330057

  Commands leading to the command that caused the error were:
  CR FEATR COUNT  LBA_48  LH LM LL DV DC  Powered_Up_Time  Command/Feature_Name
  -- == -- == -- == == == -- -- -- -- --  ---------------  --------------------
  60 00 08 00 48 00 00 5b b1 0d c9 40 00  1d+03:55:22.897  READ FPDMA QUEUED
  60 00 08 00 40 00 00 5b b1 0d d9 40 00  1d+03:55:22.874  READ FPDMA QUEUED
  60 00 b0 00 38 00 00 5b b7 fb 91 40 00  1d+03:55:22.862  READ FPDMA QUEUED
  60 00 a8 00 30 00 00 5b b7 fa e9 40 00  1d+03:55:22.861  READ FPDMA QUEUED
  60 00 a8 00 a8 00 00 5b b7 fa 41 40 00  1d+03:55:22.849  READ FPDMA QUEUED

Error 18 [17] occurred at disk power-on lifetime: 13645 hours (568 days + 13 hours)
  When the command that caused the error occurred, the device was active or idle.

  After command completion occurred, registers were:
  ER -- ST COUNT  LBA_48  LH LM LL DV DC
  -- -- -- == -- == == == -- -- -- -- --
  40 -- 41 00 e0 00 00 5b b1 0d c8 40 00  Error: UNC at LBA = 0x5bb10dc8 = 1538330056

  Commands leading to the command that caused the error were:
  CR FEATR COUNT  LBA_48  LH LM LL DV DC  Powered_Up_Time  Command/Feature_Name
  -- == -- == -- == == == -- -- -- -- --  ---------------  --------------------
  60 01 00 00 e8 00 00 59 6d 31 e9 40 00  1d+03:50:45.366  READ FPDMA QUEUED
  60 00 10 00 40 00 00 64 a7 a1 41 40 00  1d+03:50:45.356  READ FPDMA QUEUED
  60 00 10 00 b8 00 00 64 a5 a2 99 40 00  1d+03:50:45.355  READ FPDMA QUEUED
  60 00 b0 00 b0 00 00 59 9d 7c 09 40 00  1d+03:50:45.304  READ FPDMA QUEUED
  60 01 00 00 e0 00 00 5b b1 0d 89 40 00  1d+03:50:45.301  READ FPDMA QUEUED

SMART Extended Self-test Log Version: 1 (1 sectors)
Num  Test_Description    Status                  Remaining  LifeTime(hours)  LBA_of_first_error
# 1  Short offline       Completed without error       00%     22469         -
# 2  Short offline       Completed without error       00%     21737         -
# 3  Short offline       Completed without error       00%     21723         -
# 4  Short offline       Completed without error       00%     21723         -
# 5  Short offline       Completed without error       00%     10978         -

SMART Selective self-test log data structure revision number 1
 SPAN  MIN_LBA  MAX_LBA  CURRENT_TEST_STATUS
    1        0        0  Not_testing
    2        0        0  Not_testing
    3        0        0  Not_testing
    4        0        0  Not_testing
    5        0        0  Not_testing
Selective self-test flags (0x0):
  After scanning selected spans, do NOT read-scan remainder of disk.
If Selective self-test is pending on power-up, resume after 0 minute delay.

SCT Status Version:                  3
SCT Version (vendor specific):       1 (0x0001)
Device State:                        Active (0)
Current Temperature:                    35 Celsius
Power Cycle Min/Max Temperature:     35/36 Celsius
Lifetime    Min/Max Temperature:     17/58 Celsius
Under/Over Temperature Limit Count:   0/0

SCT Temperature History Version:     2
Temperature Sampling Period:         1 minute
Temperature Logging Interval:        1 minute
Min/Max recommended Temperature:      0/60 Celsius
Min/Max Temperature Limit:            0/60 Celsius
Temperature History Size (Index):    478 (453)

SCT Error Recovery Control:
           Read: Disabled
          Write: Disabled

Device Statistics (GP Log 0x04)
Page  Offset Size        Value Flags Description
0x01  =====  =               =  ===  == General Statistics (rev 1) ==
0x01  0x008  4            1808  ---  Lifetime Power-On Resets
0x01  0x010  4           24658  ---  Power-on Hours
0x01  0x018  6     36037964894  ---  Logical Sectors Written
0x01  0x020  6       205005209  ---  Number of Write Commands
0x01  0x028  6     25998156566  ---  Logical Sectors Read
0x01  0x030  6       340112001  ---  Number of Read Commands
0x01  0x038  6     88772136077  ---  Date and Time TimeStamp
0x02  =====  =               =  ===  == Free-Fall Statistics (rev 1) ==
0x02  0x010  4             111  ---  Overlimit Shock Events
0x03  =====  =               =  ===  == Rotating Media Statistics (rev 1) ==
0x03  0x008  4           24590  ---  Spindle Motor Power-on Hours
0x03  0x010  4           15505  ---  Head Flying Hours
0x03  0x018  4          199955  ---  Head Load Events
0x03  0x020  4              16  -D-  Number of Reallocated Logical Sectors
0x03  0x028  4          118052  ---  Read Recovery Attempts
0x03  0x030  4               0  ---  Number of Mechanical Start Failures
0x03  0x038  4               0  ---  Number of Realloc. Candidate Logical Sectors
0x03  0x040  4             913  ---  Number of High Priority Unload Events
0x04  =====  =               =  ===  == General Errors Statistics (rev 1) ==
0x04  0x008  4              24  ---  Number of Reported Uncorrectable Errors
0x04  0x010  4             169  ---  Resets Between Cmd Acceptance and Completion
0x05  =====  =               =  ===  == Temperature Statistics (rev 1) ==
0x05  0x008  1              36  ---  Current Temperature
0x05  0x010  1              29  N--  Average Short Term Temperature
0x05  0x018  1              28  N--  Average Long Term Temperature
0x05  0x020  1              58  ---  Highest Temperature
0x05  0x028  1              17  ---  Lowest Temperature
0x05  0x030  1              51  N--  Highest Average Short Term Temperature
0x05  0x038  1              24  N--  Lowest Average Short Term Temperature
0x05  0x040  1              34  N--  Highest Average Long Term Temperature
0x05  0x048  1              25  N--  Lowest Average Long Term Temperature
0x05  0x050  4               0  ---  Time in Over-Temperature
0x05  0x058  1              60  ---  Specified Maximum Operating Temperature
0x05  0x060  4               0  ---  Time in Under-Temperature
0x05  0x068  1               0  ---  Specified Minimum Operating Temperature
0x06  =====  =               =  ===  == Transport Statistics (rev 1) ==
0x06  0x008  4           13946  ---  Number of Hardware Resets
0x06  0x010  4            2804  ---  Number of ASR Events
0x06  0x018  4               0  ---  Number of Interface CRC Errors
0x07  =====  =               =  ===  == Solid State Device Statistics (rev 1) ==
                                |||_ C monitored condition met
                                ||__ D supports DSN
                                |___ N normalized value

Pending Defects log (GP Log 0x0c) not supported

SATA Phy Event Counters (GP Log 0x11)
ID      Size     Value  Description
0x0001  4            0  Command failed due to ICRC error
0x0002  4            0  R_ERR response for data FIS
0x0003  4            0  R_ERR response for device-to-host data FIS
0x0004  4            0  R_ERR response for host-to-device data FIS
0x0005  4            0  R_ERR response for non-data FIS
0x0006  4            0  R_ERR response for device-to-host non-data FIS
0x0007  4            0  R_ERR response for host-to-device non-data FIS
0x0008  4            0  Device-to-host non-data FIS retries
0x0009  4           11  Transition from drive PhyRdy to drive PhyNRdy
0x000a  4           11  Device-to-host register FISes sent due to a COMRESET
0x000b  4            0  CRC errors within host-to-device FIS
0x000d  4            0  Non-CRC errors within host-to-device FIS
0x000f  4            0  R_ERR response for host-to-device data FIS, CRC
0x0010  4            0  R_ERR response for host-to-device data FIS, non-CRC
0x0012  4            0  R_ERR response for host-to-device non-data FIS, CRC
0x0013  4            0  R_ERR response for host-to-device non-data FIS, non-CRC

