smartctl 6.5 2016-01-24 r4214 [x86_64-linux-4.10.0-38-generic] (local build)
Copyright (C) 2002-16, Bruce Allen, Christian Franke, www.smartmontools.org

=== START OF INFORMATION SECTION ===
Device Model:     TOSHIBA MQ04ABF100
Serial Number:    --
LU WWN Device Id: 5 000039 ...
Firmware Version: JU001C
User Capacity:    1,000,204,886,016 bytes [1.00 TB]
Sector Sizes:     512 bytes logical, 4096 bytes physical
Rotation Rate:    5400 rpm
Form Factor:      2.5 inches
Device is:        Not in smartctl database [for details use: -P showall]
ATA Version is:   ACS-3 T13/2161-D revision 5
SATA Version is:  SATA 3.1, 6.0 Gb/s (current: 6.0 Gb/s)
Local Time is:    Tue Feb 16 18:49:55 2021 MSK
SMART support is: Available - device has SMART capability.
SMART support is: Enabled
AAM feature is:   Unavailable
APM level is:     254 (maximum performance)
Rd look-ahead is: Enabled
Write cache is:   Enabled
ATA Security is:  Disabled, frozen [SEC2]
Wt Cache Reorder: Enabled

=== START OF READ SMART DATA SECTION ===
SMART overall-health self-assessment test result: PASSED

General SMART Values:
Offline data collection status:  (0x80)	Offline data collection activity
					was never started.
					Auto Offline Data Collection: Enabled.
Self-test execution status:      (   0)	The previous self-test routine completed
					without error or no self-test has ever 
					been run.
Total time to complete Offline 
data collection: 		(  120) seconds.
Offline data collection
capabilities: 			 (0x51) SMART execute Offline immediate.
					No Auto Offline data collection support.
					Suspend Offline collection upon new
					command.
					No Offline surface scan supported.
					Self-test supported.
					No Conveyance Self-test supported.
					Selective Self-test supported.
SMART capabilities:            (0x0003)	Saves SMART data before entering
					power-saving mode.
					Supports SMART auto save timer.
Error logging capability:        (0x01)	Error logging supported.
					General Purpose Logging supported.
Short self-test routine 
recommended polling time: 	 (   2) minutes.
Extended self-test routine
recommended polling time: 	 ( 167) minutes.
SCT capabilities: 	       (0x003d)	SCT Status supported.
					SCT Error Recovery Control supported.
					SCT Feature Control supported.
					SCT Data Table supported.

SMART Attributes Data Structure revision number: 32
Vendor Specific SMART Attributes with Thresholds:
ID# ATTRIBUTE_NAME          FLAGS    VALUE WORST THRESH FAIL RAW_VALUE
  1 Raw_Read_Error_Rate     POSR-K   100   100   050    -    751
  3 Spin_Up_Time            PO---K   100   100   002    -    1355
  4 Start_Stop_Count        -O--CK   100   100   000    -    5441
  5 Reallocated_Sector_Ct   PO--CK   100   100   005    -    0
  7 Seek_Error_Rate         POSR-K   100   100   070    -    26236
  9 Power_On_Hours          -O--CK   100   100   000    -    9881
 10 Spin_Retry_Count        PO--CK   100   100   050    -    0
 12 Power_Cycle_Count       -O--CK   100   100   000    -    3918
183 Runtime_Bad_Block       -O--CK   100   100   000    -    30
184 End-to-End_Error        PO-RCK   100   100   097    -    0
187 Reported_Uncorrect      -O--CK   100   100   000    -    0
188 Command_Timeout         -O--CK   100   100   000    -    0
189 High_Fly_Writes         -O-RCK   100   100   000    -    0
191 G-Sense_Error_Rate      -O--CK   001   001   000    -    345
192 Power-Off_Retract_Count -O--CK   100   100   000    -    450971566185
193 Load_Cycle_Count        -O--CK   067   067   000    -    66580
194 Temperature_Celsius     -O---K   039   054   000    -    39 (Min/Max 30/40)
197 Current_Pending_Sector  -O--CK   100   100   000    -    0
198 Offline_Uncorrectable   ----CK   100   100   000    -    0
199 UDMA_CRC_Error_Count    -O--CK   100   100   000    -    3
                            ||||||_ K auto-keep
                            |||||__ C event count
                            ||||___ R error rate
                            |||____ S speed/performance
                            ||_____ O updated online
                            |______ P prefailure warning

General Purpose Log Directory Version 1
SMART           Log Directory Version 1 [multi-sector log support]
Address    Access  R/W   Size  Description
0x00       GPL,SL  R/O      1  Log Directory
0x01           SL  R/O      1  Summary SMART error log
0x02           SL  R/O     51  Comprehensive SMART error log
0x03       GPL     R/O     64  Ext. Comprehensive SMART error log
0x04       GPL,SL  R/O      8  Device Statistics log
0x06           SL  R/O      1  SMART self-test log
0x07       GPL     R/O      1  Extended self-test log
0x09           SL  R/W      1  Selective self-test log
0x0a       GPL     R/W      2  Device Statistics Notification
0x10       GPL     R/O      1  SATA NCQ Queued Error log
0x11       GPL     R/O      1  SATA Phy Event Counters log
0x24       GPL     R/O  32768  Current Device Internal Status Data log
0x30       GPL,SL  R/O      9  IDENTIFY DEVICE data log
0x80-0x9f  GPL,SL  R/W     16  Host vendor specific log
0xa7       GPL     VS       8  Device vendor specific log
0xb6       GPL     VS    8191  Device vendor specific log
0xbb       GPL     VS       1  Device vendor specific log
0xe0       GPL,SL  R/W      1  SCT Command/Status
0xe1       GPL,SL  R/W      1  SCT Data Transfer

SMART Extended Comprehensive Error Log Version: 1 (64 sectors)
Device Error Count: 3
	CR     = Command Register
	FEATR  = Features Register
	COUNT  = Count (was: Sector Count) Register
	LBA_48 = Upper bytes of LBA High/Mid/Low Registers ]  ATA-8
	LH     = LBA High (was: Cylinder High) Register    ]   LBA
	LM     = LBA Mid (was: Cylinder Low) Register      ] Register
	LL     = LBA Low (was: Sector Number) Register     ]
	DV     = Device (was: Device/Head) Register
	DC     = Device Control Register
	ER     = Error register
	ST     = Status register
Powered_Up_Time is measured from power on, and printed as
DDd+hh:mm:SS.sss where DD=days, hh=hours, mm=minutes,
SS=sec, and sss=millisec. It "wraps" after 49.710 days.

Error 3 [2] occurred at disk power-on lifetime: 5069 hours (211 days + 5 hours)
  When the command that caused the error occurred, the device was active or idle.

  After command completion occurred, registers were:
  ER -- ST COUNT  LBA_48  LH LM LL DV DC
  -- -- -- == -- == == == -- -- -- -- --
  84 -- 43 00 18 00 00 3a 4b 7a ff 40 00  Error: ICRC, ABRT at LBA = 0x3a4b7aff = 978025215

  Commands leading to the command that caused the error were:
  CR FEATR COUNT  LBA_48  LH LM LL DV DC  Powered_Up_Time  Command/Feature_Name
  -- == -- == -- == == == -- -- -- -- --  ---------------  --------------------
  60 00 d0 00 18 00 00 3a 4b 7a 30 40 00     00:06:57.858  READ FPDMA QUEUED
  60 00 28 00 10 00 00 3a 4b 7a 00 40 00     00:06:57.858  READ FPDMA QUEUED
  60 01 00 00 e0 00 00 3a 4b 6f 40 40 00     00:06:57.855  READ FPDMA QUEUED
  60 00 20 00 d0 00 00 3c 0a 91 60 40 00     00:06:57.855  READ FPDMA QUEUED
  60 00 20 00 a8 00 00 3c 0a 90 f8 40 00     00:06:57.855  READ FPDMA QUEUED

Error 2 [1] occurred at disk power-on lifetime: 3160 hours (131 days + 16 hours)
  When the command that caused the error occurred, the device was active or idle.

  After command completion occurred, registers were:
  ER -- ST COUNT  LBA_48  LH LM LL DV DC
  -- -- -- == -- == == == -- -- -- -- --
  84 -- 43 00 b8 00 00 3a ed 12 9f 40 00  Error: ICRC, ABRT at LBA = 0x3aed129f = 988615327

  Commands leading to the command that caused the error were:
  CR FEATR COUNT  LBA_48  LH LM LL DV DC  Powered_Up_Time  Command/Feature_Name
  -- == -- == -- == == == -- -- -- -- --  ---------------  --------------------
  60 01 00 00 c0 00 00 3b 16 57 e0 40 00     01:12:29.268  READ FPDMA QUEUED
  60 01 00 00 b8 00 00 3a ed 11 a0 40 00     01:12:29.268  READ FPDMA QUEUED
  60 00 20 00 68 00 00 3d 27 37 88 40 00     01:12:29.267  READ FPDMA QUEUED
  60 00 28 00 60 00 00 3d 27 37 30 40 00     01:12:29.267  READ FPDMA QUEUED
  60 00 70 00 88 00 00 3d 27 36 b0 40 00     01:12:29.266  READ FPDMA QUEUED

Error 1 [0] occurred at disk power-on lifetime: 2308 hours (96 days + 4 hours)
  When the command that caused the error occurred, the device was active or idle.

  After command completion occurred, registers were:
  ER -- ST COUNT  LBA_48  LH LM LL DV DC
  -- -- -- == -- == == == -- -- -- -- --
  84 -- 43 00 68 00 00 3c b4 9d 8f 40 00  Error: ICRC, ABRT at LBA = 0x3cb49d8f = 1018469775

  Commands leading to the command that caused the error were:
  CR FEATR COUNT  LBA_48  LH LM LL DV DC  Powered_Up_Time  Command/Feature_Name
  -- == -- == -- == == == -- -- -- -- --  ---------------  --------------------
  60 01 00 00 50 00 00 3c 09 31 e8 40 00     01:50:20.456  READ FPDMA QUEUED
  60 01 00 00 48 00 00 3a e6 3c 70 40 00     01:50:20.456  READ FPDMA QUEUED
  60 01 00 00 40 00 00 3b 15 9e 50 40 00     01:50:20.445  READ FPDMA QUEUED
  60 00 40 00 30 00 00 3c 09 fc a0 40 00     01:50:20.422  READ FPDMA QUEUED
  60 00 b8 00 28 00 00 3c 09 fb e0 40 00     01:50:20.422  READ FPDMA QUEUED

SMART Extended Self-test Log Version: 1 (1 sectors)
Num  Test_Description    Status                  Remaining  LifeTime(hours)  LBA_of_first_error
# 1  Short offline       Completed without error       00%         7         -
# 2  Short offline       Completed without error       00%         3         -
# 3  Short offline       Completed without error       00%         0         -

SMART Selective self-test log data structure revision number 1
 SPAN  MIN_LBA  MAX_LBA  CURRENT_TEST_STATUS
    1        0        0  Not_testing
    2        0        0  Not_testing
    3        0        0  Not_testing
    4        0        0  Not_testing
    5        0        0  Not_testing
Selective self-test flags (0x0):
  After scanning selected spans, do NOT read-scan remainder of disk.
If Selective self-test is pending on power-up, resume after 0 minute delay.

SCT Status Version:                  3
SCT Version (vendor specific):       1 (0x0001)
SCT Support Level:                   1
Device State:                        Active (0)
Current Temperature:                    39 Celsius
Power Cycle Min/Max Temperature:     30/40 Celsius
Lifetime    Min/Max Temperature:     15/54 Celsius
Under/Over Temperature Limit Count:   0/0

SCT Temperature History Version:     2
Temperature Sampling Period:         1 minute
Temperature Logging Interval:        1 minute
Min/Max recommended Temperature:      0/60 Celsius
Min/Max Temperature Limit:            0/60 Celsius
Temperature History Size (Index):    478 (103)

SCT Error Recovery Control:
           Read: Disabled
          Write: Disabled

Device Statistics (GP Log 0x04)
Page  Offset Size        Value Flags Description
0x01  =====  =               =  ===  == General Statistics (rev 1) ==
0x01  0x008  4            3918  ---  Lifetime Power-On Resets
0x01  0x010  4            9881  ---  Power-on Hours
0x01  0x018  6     18888076276  ---  Logical Sectors Written
0x01  0x020  6       125292856  ---  Number of Write Commands
0x01  0x028  6     11956604480  ---  Logical Sectors Read
0x01  0x030  6       143193679  ---  Number of Read Commands
0x01  0x038  6     35572418169  ---  Date and Time TimeStamp
0x02  =====  =               =  ===  == Free-Fall Statistics (rev 1) ==
0x02  0x010  4             345  ---  Overlimit Shock Events
0x03  =====  =               =  ===  == Rotating Media Statistics (rev 1) ==
0x03  0x008  4            9719  ---  Spindle Motor Power-on Hours
0x03  0x010  4            9223  ---  Head Flying Hours
0x03  0x018  4           66685  ---  Head Load Events
0x03  0x020  4               0  -D-  Number of Reallocated Logical Sectors
0x03  0x028  4             751  ---  Read Recovery Attempts
0x03  0x030  4               0  ---  Number of Mechanical Start Failures
0x03  0x038  4               0  ---  Number of Realloc. Candidate Logical Sectors
0x03  0x040  4             137  ---  Number of High Priority Unload Events
0x04  =====  =               =  ===  == General Errors Statistics (rev 1) ==
0x04  0x008  4               0  ---  Number of Reported Uncorrectable Errors
0x04  0x010  4               0  ---  Resets Between Cmd Acceptance and Completion
0x05  =====  =               =  ===  == Temperature Statistics (rev 1) ==
0x05  0x008  1              39  ---  Current Temperature
0x05  0x010  1              36  N--  Average Short Term Temperature
0x05  0x018  1              34  N--  Average Long Term Temperature
0x05  0x020  1              54  ---  Highest Temperature
0x05  0x028  1              15  ---  Lowest Temperature
0x05  0x030  1              40  N--  Highest Average Short Term Temperature
0x05  0x038  1              29  N--  Lowest Average Short Term Temperature
0x05  0x040  1              36  N--  Highest Average Long Term Temperature
0x05  0x048  1              32  N--  Lowest Average Long Term Temperature
0x05  0x050  4               0  ---  Time in Over-Temperature
0x05  0x058  1              60  ---  Specified Maximum Operating Temperature
0x05  0x060  4               0  ---  Time in Under-Temperature
0x05  0x068  1               0  ---  Specified Minimum Operating Temperature
0x06  =====  =               =  ===  == Transport Statistics (rev 1) ==
0x06  0x008  4            8184  ---  Number of Hardware Resets
0x06  0x010  4            4095  ---  Number of ASR Events
0x06  0x018  4               3  ---  Number of Interface CRC Errors
0x07  =====  =               =  ===  == Solid State Device Statistics (rev 1) ==
                                |||_ C monitored condition met
                                ||__ D supports DSN
                                |___ N normalized value

SATA Phy Event Counters (GP Log 0x11)
ID      Size     Value  Description
0x0001  4            0  Command failed due to ICRC error
0x0002  4            0  R_ERR response for data FIS
0x0003  4            0  R_ERR response for device-to-host data FIS
0x0004  4            0  R_ERR response for host-to-device data FIS
0x0005  4            0  R_ERR response for non-data FIS
0x0006  4            0  R_ERR response for device-to-host non-data FIS
0x0007  4            0  R_ERR response for host-to-device non-data FIS
0x0008  4            0  Device-to-host non-data FIS retries
0x0009  4            7  Transition from drive PhyRdy to drive PhyNRdy
0x000a  4            6  Device-to-host register FISes sent due to a COMRESET
0x000b  4            0  CRC errors within host-to-device FIS
0x000d  4            0  Non-CRC errors within host-to-device FIS
0x000f  4            0  R_ERR response for host-to-device data FIS, CRC
0x0010  4            0  R_ERR response for host-to-device data FIS, non-CRC
0x0012  4            0  R_ERR response for host-to-device non-data FIS, CRC
0x0013  4            0  R_ERR response for host-to-device non-data FIS, non-CRC



