=== START OF INFORMATION SECTION ===
Device Model:     TOSHIBA MQ04ABF100
Serial Number:    --
LU WWN Device Id: 5 000039 ...
Firmware Version: JU0C0J
User Capacity:    1,000,204,886,016 bytes [1.00 TB]
Sector Sizes:     512 bytes logical, 4096 bytes physical
Rotation Rate:    5400 rpm
Form Factor:      2.5 inches
Device is:        Not in smartctl database [for details use: -P showall]
ATA Version is:   ACS-3 T13/2161-D revision 5
SATA Version is:  SATA 3.3, 6.0 Gb/s (current: 6.0 Gb/s)
Local Time is:    Fri Apr  1 22:44:18 2022 CEST
SMART support is: Available - device has SMART capability.
SMART support is: Enabled
AAM feature is:   Unavailable
APM level is:     1 (minimum power consumption with standby)
Rd look-ahead is: Enabled
Write cache is:   Disabled
DSN feature is:   Disabled
ATA Security is:  Disabled, frozen [SEC2]
Wt Cache Reorder: Enabled

=== START OF READ SMART DATA SECTION ===
SMART overall-health self-assessment test result: PASSED

General SMART Values:
Offline data collection status:  (0x85)	Offline data collection activity
					was aborted by an interrupting command from host.
					Auto Offline Data Collection: Enabled.
Self-test execution status:      (   0)	The previous self-test routine completed
					without error or no self-test has ever 
					been run.
Total time to complete Offline 
data collection: 		(  120) seconds.
Offline data collection
capabilities: 			 (0x5b) SMART execute Offline immediate.
					Auto Offline data collection on/off support.
					Suspend Offline collection upon new
					command.
					Offline surface scan supported.
					Self-test supported.
					No Conveyance Self-test supported.
					Selective Self-test supported.
SMART capabilities:            (0x0003)	Saves SMART data before entering
					power-saving mode.
					Supports SMART auto save timer.
Error logging capability:        (0x01)	Error logging supported.
					General Purpose Logging supported.
Short self-test routine 
recommended polling time: 	 (   2) minutes.
Extended self-test routine
recommended polling time: 	 ( 171) minutes.
SCT capabilities: 	       (0x003d)	SCT Status supported.
					SCT Error Recovery Control supported.
					SCT Feature Control supported.
					SCT Data Table supported.

SMART Attributes Data Structure revision number: 16
Vendor Specific SMART Attributes with Thresholds:
ID# ATTRIBUTE_NAME          FLAGS    VALUE WORST THRESH FAIL RAW_VALUE
  1 Raw_Read_Error_Rate     PO-R--   100   100   050    -    0
  2 Throughput_Performance  P-S---   100   100   050    -    0
  3 Spin_Up_Time            POS--K   100   100   001    -    1304
  4 Start_Stop_Count        -O--CK   100   100   000    -    65557
  5 Reallocated_Sector_Ct   PO--CK   100   100   050    -    0
  7 Seek_Error_Rate         PO-R--   100   100   050    -    0
  8 Seek_Time_Performance   P-S---   100   100   050    -    0
  9 Power_On_Hours          -O--CK   085   085   000    -    6278
 10 Spin_Retry_Count        PO--CK   253   100   030    -    0
 12 Power_Cycle_Count       -O--CK   100   100   000    -    9678
191 G-Sense_Error_Rate      -O--CK   100   100   000    -    25354
192 Power-Off_Retract_Count -O--CK   098   098   000    -    1169
193 Load_Cycle_Count        -O--CK   086   086   000    -    142881
194 Temperature_Celsius     -O---K   100   100   000    -    33 (Min/Max 9/52)
196 Reallocated_Event_Count -O--CK   100   100   000    -    0
197 Current_Pending_Sector  -O--CK   100   100   000    -    0
198 Offline_Uncorrectable   ----CK   100   100   000    -    0
199 UDMA_CRC_Error_Count    -O--CK   200   200   000    -    2
220 Disk_Shift              -O----   100   100   000    -    0
222 Loaded_Hours            -O--CK   086   086   000    -    5672
223 Load_Retry_Count        -O--CK   100   100   000    -    0
224 Load_Friction           -O---K   100   100   000    -    0
226 Load-in_Time            -OS--K   100   100   000    -    182
240 Head_Flying_Hours       P-----   100   100   001    -    0
254 Free_Fall_Sensor        -O--CK   100   100   000    -    0
                            ||||||_ K auto-keep
                            |||||__ C event count
                            ||||___ R error rate
                            |||____ S speed/performance
                            ||_____ O updated online
                            |______ P prefailure warning

General Purpose Log Directory Version 1
SMART           Log Directory Version 1 [multi-sector log support]
Address    Access  R/W   Size  Description
0x00       GPL,SL  R/O      1  Log Directory
0x01           SL  R/O      1  Summary SMART error log
0x02           SL  R/O     51  Comprehensive SMART error log
0x03       GPL     R/O     64  Ext. Comprehensive SMART error log
0x04       GPL,SL  R/O      8  Device Statistics log
0x06           SL  R/O      1  SMART self-test log
0x07       GPL     R/O      1  Extended self-test log
0x09           SL  R/W      1  Selective self-test log
0x0a       GPL     R/W      2  Device Statistics Notification
0x10       GPL     R/O      1  NCQ Command Error log
0x11       GPL     R/O      1  SATA Phy Event Counters log
0x24       GPL     R/O  32768  Current Device Internal Status Data log
0x30       GPL,SL  R/O      9  IDENTIFY DEVICE data log
0x80-0x9f  GPL,SL  R/W     16  Host vendor specific log
0xa7       GPL     VS       8  Device vendor specific log
0xe0       GPL,SL  R/W      1  SCT Command/Status
0xe1       GPL,SL  R/W      1  SCT Data Transfer

SMART Extended Comprehensive Error Log Version: 1 (64 sectors)
Device Error Count: 226
	CR     = Command Register
	FEATR  = Features Register
	COUNT  = Count (was: Sector Count) Register
	LBA_48 = Upper bytes of LBA High/Mid/Low Registers ]  ATA-8
	LH     = LBA High (was: Cylinder High) Register    ]   LBA
	LM     = LBA Mid (was: Cylinder Low) Register      ] Register
	LL     = LBA Low (was: Sector Number) Register     ]
	DV     = Device (was: Device/Head) Register
	DC     = Device Control Register
	ER     = Error register
	ST     = Status register
Powered_Up_Time is measured from power on, and printed as
DDd+hh:mm:SS.sss where DD=days, hh=hours, mm=minutes,
SS=sec, and sss=millisec. It "wraps" after 49.710 days.

Error 226 [225] occurred at disk power-on lifetime: 5736 hours (239 days + 0 hours)
  When the command that caused the error occurred, the device was active or idle.

  After command completion occurred, registers were:
  ER -- ST COUNT  LBA_48  LH LM LL DV DC
  -- -- -- == -- == == == -- -- -- -- --
  84 -- 41 00 10 00 00 3b 65 40 cf 40 00  Error: ICRC, ABRT at LBA = 0x3b6540cf = 996491471

  Commands leading to the command that caused the error were:
  CR FEATR COUNT  LBA_48  LH LM LL DV DC  Powered_Up_Time  Command/Feature_Name
  -- == -- == -- == == == -- -- -- -- --  ---------------  --------------------
  60 00 08 00 d0 00 00 09 d8 21 60 40 00     00:16:39.895  READ FPDMA QUEUED
  60 00 08 00 50 00 00 1a f7 b2 ba 40 00     00:16:39.894  READ FPDMA QUEUED
  60 00 50 00 28 00 00 1a f6 d9 ba 40 00     00:16:39.892  READ FPDMA QUEUED
  60 00 60 00 90 00 00 1a f6 cc f2 40 00     00:16:39.890  READ FPDMA QUEUED
  60 00 08 00 90 00 00 1a f6 c9 72 40 00     00:16:39.887  READ FPDMA QUEUED

Error 225 [224] occurred at disk power-on lifetime: 4760 hours (198 days + 8 hours)
  When the command that caused the error occurred, the device was active or idle.

  After command completion occurred, registers were:
  ER -- ST COUNT  LBA_48  LH LM LL DV DC
  -- -- -- == -- == == == -- -- -- -- --
  84 -- 41 00 60 00 00 00 fe bd 81 40 00  Error: ICRC, ABRT at LBA = 0x00febd81 = 16694657

  Commands leading to the command that caused the error were:
  CR FEATR COUNT  LBA_48  LH LM LL DV DC  Powered_Up_Time  Command/Feature_Name
  -- == -- == -- == == == -- -- -- -- --  ---------------  --------------------
  60 00 40 00 88 00 00 07 db 81 12 40 00     00:11:35.759  READ FPDMA QUEUED
  60 00 12 00 80 00 00 00 fe bf 0c 40 00     00:11:35.755  READ FPDMA QUEUED
  60 00 02 00 78 00 00 00 fe bf 0a 40 00     00:11:35.747  READ FPDMA QUEUED
  60 00 88 00 70 00 00 00 fe be 82 40 00     00:11:35.747  READ FPDMA QUEUED
  60 01 00 00 68 00 00 00 fe bd 82 40 00     00:11:35.747  READ FPDMA QUEUED

Error 224 [223] occurred at disk power-on lifetime: 4439 hours (184 days + 23 hours)
  When the command that caused the error occurred, the device was active or idle.

  After command completion occurred, registers were:
  ER -- ST COUNT  LBA_48  LH LM LL DV DC
  -- -- -- == -- == == == -- -- -- -- --
  04 -- 51 00 00 00 00 00 00 00 00 40 00

  Commands leading to the command that caused the error were:
  CR FEATR COUNT  LBA_48  LH LM LL DV DC  Powered_Up_Time  Command/Feature_Name
  -- == -- == -- == == == -- -- -- -- --  ---------------  --------------------
  f2 00 00 00 01 00 00 00 00 00 00 40 00     00:01:42.252  SECURITY UNLOCK
  ec 00 00 00 00 00 00 00 00 00 00 00 00     00:01:42.252  IDENTIFY DEVICE
  f6 00 00 00 01 00 00 00 00 00 00 40 00     00:01:36.867  SECURITY DISABLE PASSWORD
  ec 00 00 00 00 00 00 00 00 00 00 00 00     00:01:36.866  IDENTIFY DEVICE
  f6 00 00 00 01 00 00 00 00 00 00 40 00     00:01:36.001  SECURITY DISABLE PASSWORD

Error 223 [222] occurred at disk power-on lifetime: 4439 hours (184 days + 23 hours)
  When the command that caused the error occurred, the device was active or idle.

  After command completion occurred, registers were:
  ER -- ST COUNT  LBA_48  LH LM LL DV DC
  -- -- -- == -- == == == -- -- -- -- --
  04 -- 51 00 00 00 00 00 00 00 00 40 00

  Commands leading to the command that caused the error were:
  CR FEATR COUNT  LBA_48  LH LM LL DV DC  Powered_Up_Time  Command/Feature_Name
  -- == -- == -- == == == -- -- -- -- --  ---------------  --------------------
  f6 00 00 00 01 00 00 00 00 00 00 40 00     00:01:36.867  SECURITY DISABLE PASSWORD
  ec 00 00 00 00 00 00 00 00 00 00 00 00     00:01:36.866  IDENTIFY DEVICE
  f6 00 00 00 01 00 00 00 00 00 00 40 00     00:01:36.001  SECURITY DISABLE PASSWORD
  ec 00 00 00 00 00 00 00 00 00 00 00 00     00:01:36.001  IDENTIFY DEVICE
  f6 00 00 00 01 00 00 00 00 00 00 40 00     00:01:35.015  SECURITY DISABLE PASSWORD

Error 222 [221] occurred at disk power-on lifetime: 4439 hours (184 days + 23 hours)
  When the command that caused the error occurred, the device was active or idle.

  After command completion occurred, registers were:
  ER -- ST COUNT  LBA_48  LH LM LL DV DC
  -- -- -- == -- == == == -- -- -- -- --
  04 -- 51 00 00 00 00 00 00 00 00 40 00

  Commands leading to the command that caused the error were:
  CR FEATR COUNT  LBA_48  LH LM LL DV DC  Powered_Up_Time  Command/Feature_Name
  -- == -- == -- == == == -- -- -- -- --  ---------------  --------------------
  f6 00 00 00 01 00 00 00 00 00 00 40 00     00:01:36.001  SECURITY DISABLE PASSWORD
  ec 00 00 00 00 00 00 00 00 00 00 00 00     00:01:36.001  IDENTIFY DEVICE
  f6 00 00 00 01 00 00 00 00 00 00 40 00     00:01:35.015  SECURITY DISABLE PASSWORD
  ec 00 00 00 00 00 00 00 00 00 00 00 00     00:01:35.014  IDENTIFY DEVICE
  f6 00 00 00 01 00 00 00 00 00 00 40 00     00:01:33.247  SECURITY DISABLE PASSWORD

Error 221 [220] occurred at disk power-on lifetime: 4439 hours (184 days + 23 hours)
  When the command that caused the error occurred, the device was active or idle.

  After command completion occurred, registers were:
  ER -- ST COUNT  LBA_48  LH LM LL DV DC
  -- -- -- == -- == == == -- -- -- -- --
  04 -- 51 00 00 00 00 00 00 00 00 40 00

  Commands leading to the command that caused the error were:
  CR FEATR COUNT  LBA_48  LH LM LL DV DC  Powered_Up_Time  Command/Feature_Name
  -- == -- == -- == == == -- -- -- -- --  ---------------  --------------------
  f6 00 00 00 01 00 00 00 00 00 00 40 00     00:01:35.015  SECURITY DISABLE PASSWORD
  ec 00 00 00 00 00 00 00 00 00 00 00 00     00:01:35.014  IDENTIFY DEVICE
  f6 00 00 00 01 00 00 00 00 00 00 40 00     00:01:33.247  SECURITY DISABLE PASSWORD
  ec 00 00 00 00 00 00 00 00 00 00 00 00     00:01:33.246  IDENTIFY DEVICE
  ec 00 00 00 00 00 00 00 00 00 00 00 00     00:01:25.812  IDENTIFY DEVICE

Error 220 [219] occurred at disk power-on lifetime: 4439 hours (184 days + 23 hours)
  When the command that caused the error occurred, the device was active or idle.

  After command completion occurred, registers were:
  ER -- ST COUNT  LBA_48  LH LM LL DV DC
  -- -- -- == -- == == == -- -- -- -- --
  04 -- 51 00 00 00 00 00 00 00 00 40 00

  Commands leading to the command that caused the error were:
  CR FEATR COUNT  LBA_48  LH LM LL DV DC  Powered_Up_Time  Command/Feature_Name
  -- == -- == -- == == == -- -- -- -- --  ---------------  --------------------
  f6 00 00 00 01 00 00 00 00 00 00 40 00     00:01:33.247  SECURITY DISABLE PASSWORD
  ec 00 00 00 00 00 00 00 00 00 00 00 00     00:01:33.246  IDENTIFY DEVICE
  ec 00 00 00 00 00 00 00 00 00 00 00 00     00:01:25.812  IDENTIFY DEVICE
  f2 00 00 00 01 00 00 00 00 00 00 40 00     00:01:25.640  SECURITY UNLOCK
  ec 00 00 00 00 00 00 00 00 00 00 00 00     00:01:25.640  IDENTIFY DEVICE

Error 219 [218] occurred at disk power-on lifetime: 4439 hours (184 days + 23 hours)
  When the command that caused the error occurred, the device was active or idle.

  After command completion occurred, registers were:
  ER -- ST COUNT  LBA_48  LH LM LL DV DC
  -- -- -- == -- == == == -- -- -- -- --
  04 -- 51 00 00 00 00 00 00 00 00 40 00

  Commands leading to the command that caused the error were:
  CR FEATR COUNT  LBA_48  LH LM LL DV DC  Powered_Up_Time  Command/Feature_Name
  -- == -- == -- == == == -- -- -- -- --  ---------------  --------------------
  f2 00 00 00 01 00 00 00 00 00 00 40 00     00:01:25.640  SECURITY UNLOCK
  ec 00 00 00 00 00 00 00 00 00 00 00 00     00:01:25.640  IDENTIFY DEVICE
  f6 00 00 00 01 00 00 00 00 00 00 40 00     00:01:16.078  SECURITY DISABLE PASSWORD
  ec 00 00 00 00 00 00 00 00 00 00 00 00     00:01:16.077  IDENTIFY DEVICE
  f6 00 00 00 01 00 00 00 00 00 00 40 00     00:00:36.103  SECURITY DISABLE PASSWORD

SMART Extended Self-test Log Version: 1 (1 sectors)
Num  Test_Description    Status                  Remaining  LifeTime(hours)  LBA_of_first_error
# 1  Short offline       Completed without error       00%      2691         -

SMART Selective self-test log data structure revision number 1
 SPAN  MIN_LBA  MAX_LBA  CURRENT_TEST_STATUS
    1        0        0  Not_testing
    2        0        0  Not_testing
    3        0        0  Not_testing
    4        0        0  Not_testing
    5        0        0  Not_testing
Selective self-test flags (0x0):
  After scanning selected spans, do NOT read-scan remainder of disk.
If Selective self-test is pending on power-up, resume after 0 minute delay.

SCT Status Version:                  3
SCT Version (vendor specific):       1 (0x0001)
Device State:                        Active (0)
Current Temperature:                    33 Celsius
Power Cycle Min/Max Temperature:     30/36 Celsius
Lifetime    Min/Max Temperature:      9/52 Celsius
Under/Over Temperature Limit Count:   0/0

SCT Temperature History Version:     2
Temperature Sampling Period:         1 minute
Temperature Logging Interval:        1 minute
Min/Max recommended Temperature:      0/60 Celsius
Min/Max Temperature Limit:            0/60 Celsius
Temperature History Size (Index):    478 (294)

SCT Error Recovery Control:
           Read: Disabled
          Write: Disabled

Device Statistics (GP Log 0x04)
Page  Offset Size        Value Flags Description
0x01  =====  =               =  ===  == General Statistics (rev 1) ==
0x01  0x008  4            9678  ---  Lifetime Power-On Resets
0x01  0x010  4            6278  ---  Power-on Hours
0x01  0x018  6     71063476485  ---  Logical Sectors Written
0x01  0x020  6       639420453  ---  Number of Write Commands
0x01  0x028  6     67569421874  ---  Logical Sectors Read
0x01  0x030  6       870453337  ---  Number of Read Commands
0x01  0x038  6     22601442366  ---  Date and Time TimeStamp
0x02  =====  =               =  ===  == Free-Fall Statistics (rev 1) ==
0x02  0x010  4           25354  ---  Overlimit Shock Events
0x03  =====  =               =  ===  == Rotating Media Statistics (rev 1) ==
0x03  0x008  4            6006  ---  Spindle Motor Power-on Hours
0x03  0x010  4            5672  ---  Head Flying Hours
0x03  0x018  4          142881  ---  Head Load Events
0x03  0x020  4               0  -D-  Number of Reallocated Logical Sectors
0x03  0x028  4           11432  ---  Read Recovery Attempts
0x03  0x030  4               0  ---  Number of Mechanical Start Failures
0x03  0x038  4               0  ---  Number of Realloc. Candidate Logical Sectors
0x03  0x040  4            1169  ---  Number of High Priority Unload Events
0x04  =====  =               =  ===  == General Errors Statistics (rev 1) ==
0x04  0x008  4               0  ---  Number of Reported Uncorrectable Errors
0x04  0x010  4               4  ---  Resets Between Cmd Acceptance and Completion
0x05  =====  =               =  ===  == Temperature Statistics (rev 1) ==
0x05  0x008  1              33  ---  Current Temperature
0x05  0x010  1              27  N--  Average Short Term Temperature
0x05  0x018  1              31  N--  Average Long Term Temperature
0x05  0x020  1              52  ---  Highest Temperature
0x05  0x028  1               9  ---  Lowest Temperature
0x05  0x030  1              40  N--  Highest Average Short Term Temperature
0x05  0x038  1              25  N--  Lowest Average Short Term Temperature
0x05  0x040  1              34  N--  Highest Average Long Term Temperature
0x05  0x048  1              31  N--  Lowest Average Long Term Temperature
0x05  0x050  4               0  ---  Time in Over-Temperature
0x05  0x058  1              60  ---  Specified Maximum Operating Temperature
0x05  0x060  4               0  ---  Time in Under-Temperature
0x05  0x068  1               0  ---  Specified Minimum Operating Temperature
0x06  =====  =               =  ===  == Transport Statistics (rev 1) ==
0x06  0x008  4           53324  ---  Number of Hardware Resets
0x06  0x010  4           10599  ---  Number of ASR Events
0x06  0x018  4               2  ---  Number of Interface CRC Errors
0x07  =====  =               =  ===  == Solid State Device Statistics (rev 1) ==
                                |||_ C monitored condition met
                                ||__ D supports DSN
                                |___ N normalized value

Pending Defects log (GP Log 0x0c) not supported

SATA Phy Event Counters (GP Log 0x11)
ID      Size     Value  Description
0x0001  4            0  Command failed due to ICRC error
0x0002  4            0  R_ERR response for data FIS
0x0003  4            0  R_ERR response for device-to-host data FIS
0x0004  4            0  R_ERR response for host-to-device data FIS
0x0005  4            0  R_ERR response for non-data FIS
0x0006  4            0  R_ERR response for device-to-host non-data FIS
0x0007  4            0  R_ERR response for host-to-device non-data FIS
0x0008  4            0  Device-to-host non-data FIS retries
0x0009  4        10358  Transition from drive PhyRdy to drive PhyNRdy
0x000a  4            8  Device-to-host register FISes sent due to a COMRESET
0x000b  4            0  CRC errors within host-to-device FIS
0x000d  4            0  Non-CRC errors within host-to-device FIS
0x000f  4            0  R_ERR response for host-to-device data FIS, CRC
0x0010  4            0  R_ERR response for host-to-device data FIS, non-CRC
0x0012  4            0  R_ERR response for host-to-device non-data FIS, CRC
0x0013  4            0  R_ERR response for host-to-device non-data FIS, non-CRC

