=== START OF INFORMATION SECTION ===
Model Family:     Seagate Barracuda 7200.11
Device Model:     ST3320613AS
Serial Number:    --
LU WWN Device Id: 5 000c50 ...
Firmware Version: CC2F
User Capacity:    320,072,933,376 bytes [320 GB]
Sector Size:      512 bytes logical/physical
Rotation Rate:    7200 rpm
Device is:        In smartctl database [for details use: -P show]
ATA Version is:   ATA8-ACS T13/1699-D revision 4
SATA Version is:  SATA 2.6, 3.0 Gb/s
Local Time is:    Wed Jul  3 15:16:16 2019 MSK
SMART support is: Available - device has SMART capability.
SMART support is: Enabled
AAM level is:     254 (maximum performance), recommended: 208
APM feature is:   Unavailable
Rd look-ahead is: Enabled
Write cache is:   Enabled
DSN feature is:   Unavailable
ATA Security is:  Disabled, frozen [SEC2]
Wt Cache Reorder: Unknown

=== START OF READ SMART DATA SECTION ===
SMART overall-health self-assessment test result: PASSED

General SMART Values:
Offline data collection status:  (0x82)	Offline data collection activity
					was completed without error.
					Auto Offline Data Collection: Enabled.
Self-test execution status:      (   0)	The previous self-test routine completed
					without error or no self-test has ever 
					been run.
Total time to complete Offline 
data collection: 		(  617) seconds.
Offline data collection
capabilities: 			 (0x7b) SMART execute Offline immediate.
					Auto Offline data collection on/off support.
					Suspend Offline collection upon new
					command.
					Offline surface scan supported.
					Self-test supported.
					Conveyance Self-test supported.
					Selective Self-test supported.
SMART capabilities:            (0x0003)	Saves SMART data before entering
					power-saving mode.
					Supports SMART auto save timer.
Error logging capability:        (0x01)	Error logging supported.
					General Purpose Logging supported.
Short self-test routine 
recommended polling time: 	 (   1) minutes.
Extended self-test routine
recommended polling time: 	 (  70) minutes.
Conveyance self-test routine
recommended polling time: 	 (   2) minutes.
SCT capabilities: 	       (0x103f)	SCT Status supported.
					SCT Error Recovery Control supported.
					SCT Feature Control supported.
					SCT Data Table supported.

SMART Attributes Data Structure revision number: 10
Vendor Specific SMART Attributes with Thresholds:
ID# ATTRIBUTE_NAME          FLAGS    VALUE WORST THRESH FAIL RAW_VALUE
  1 Raw_Read_Error_Rate     POSR--   120   081   006    -    242049543
  3 Spin_Up_Time            PO----   098   096   000    -    0
  4 Start_Stop_Count        -O--CK   077   077   020    -    23684
  5 Reallocated_Sector_Ct   PO--CK   100   100   036    -    12
  7 Seek_Error_Rate         POSR--   084   060   030    -    4599898326
  9 Power_On_Hours          -O--CK   060   060   000    -    35296
 10 Spin_Retry_Count        PO--C-   100   100   097    -    27
 12 Power_Cycle_Count       -O--CK   086   037   020    -    14660
184 End-to-End_Error        -O--CK   100   100   099    -    0
187 Reported_Uncorrect      -O--CK   001   001   000    -    3922
188 Command_Timeout         -O--CK   100   068   000    -    811761271416
189 High_Fly_Writes         -O-RCK   001   001   000    -    155
190 Airflow_Temperature_Cel -O---K   064   051   045    -    36 (Min/Max 24/37)
194 Temperature_Celsius     -O---K   036   049   000    -    36 (0 4 0 0 0)
195 Hardware_ECC_Recovered  -O-RC-   033   023   000    -    242049543
197 Current_Pending_Sector  -O--C-   100   100   000    -    1
198 Offline_Uncorrectable   ----C-   100   100   000    -    1
199 UDMA_CRC_Error_Count    -OSRCK   200   001   000    -    126256
240 Head_Flying_Hours       ------   100   253   000    -    33391 (208 82 0)
241 Total_LBAs_Written      ------   100   253   000    -    434284040
242 Total_LBAs_Read         ------   100   253   000    -    3889468298
                            ||||||_ K auto-keep
                            |||||__ C event count
                            ||||___ R error rate
                            |||____ S speed/performance
                            ||_____ O updated online
                            |______ P prefailure warning

General Purpose Log Directory Version 1
SMART           Log Directory Version 1 [multi-sector log support]
Address    Access  R/W   Size  Description
0x00       GPL,SL  R/O      1  Log Directory
0x01       GPL,SL  R/O      1  Summary SMART error log
0x02       GPL,SL  R/O      5  Comprehensive SMART error log
0x03       GPL,SL  R/O      5  Ext. Comprehensive SMART error log
0x06       GPL,SL  R/O      1  SMART self-test log
0x07       GPL,SL  R/O      1  Extended self-test log
0x09       GPL,SL  R/W      1  Selective self-test log
0x10       GPL,SL  R/O      1  NCQ Command Error log
0x11       GPL,SL  R/O      1  SATA Phy Event Counters log
0x21       GPL,SL  R/O      1  Write stream error log
0x22       GPL,SL  R/O      1  Read stream error log
0x80-0x9f  GPL,SL  R/W     16  Host vendor specific log
0xa1       GPL,SL  VS      20  Device vendor specific log
0xa2       GPL     VS    2248  Device vendor specific log
0xa8       GPL,SL  VS     129  Device vendor specific log
0xa9       GPL,SL  VS       1  Device vendor specific log
0xb0       GPL     VS    2928  Device vendor specific log
0xbe-0xbf  GPL     VS   65535  Device vendor specific log
0xe0       GPL,SL  R/W      1  SCT Command/Status
0xe1       GPL,SL  R/W      1  SCT Data Transfer

SMART Extended Comprehensive Error Log Version: 1 (5 sectors)
Device Error Count: 3794 (device log contains only the most recent 20 errors)
	CR     = Command Register
	FEATR  = Features Register
	COUNT  = Count (was: Sector Count) Register
	LBA_48 = Upper bytes of LBA High/Mid/Low Registers ]  ATA-8
	LH     = LBA High (was: Cylinder High) Register    ]   LBA
	LM     = LBA Mid (was: Cylinder Low) Register      ] Register
	LL     = LBA Low (was: Sector Number) Register     ]
	DV     = Device (was: Device/Head) Register
	DC     = Device Control Register
	ER     = Error register
	ST     = Status register
Powered_Up_Time is measured from power on, and printed as
DDd+hh:mm:SS.sss where DD=days, hh=hours, mm=minutes,
SS=sec, and sss=millisec. It "wraps" after 49.710 days.

Error 3794 [13] occurred at disk power-on lifetime: 34586 hours (1441 days + 2 hours)
  When the command that caused the error occurred, the device was active or idle.

  After command completion occurred, registers were:
  ER -- ST COUNT  LBA_48  LH LM LL DV DC
  -- -- -- == -- == == == -- -- -- -- --
  40 -- 51 00 00 00 00 be 00 5f 57 00 00  Error: UNC at LBA = 0xbe005f57 = 3187695447

  Commands leading to the command that caused the error were:
  CR FEATR COUNT  LBA_48  LH LM LL DV DC  Powered_Up_Time  Command/Feature_Name
  -- == -- == -- == == == -- -- -- -- --  ---------------  --------------------
  60 00 00 01 00 00 00 be 00 5f 00 40 00     00:00:22.780  READ FPDMA QUEUED
  60 00 00 01 00 00 00 4a 00 66 00 40 00     00:00:22.776  READ FPDMA QUEUED
  60 00 00 00 50 00 00 be 00 5f 00 40 00     00:00:22.697  READ FPDMA QUEUED
  2f 00 00 00 01 00 00 00 00 00 10 28 00     00:00:22.567  READ LOG EXT
  60 00 00 01 00 00 00 be 00 5f 00 40 00     00:00:19.856  READ FPDMA QUEUED

Error 3793 [12] occurred at disk power-on lifetime: 34586 hours (1441 days + 2 hours)
  When the command that caused the error occurred, the device was active or idle.

  After command completion occurred, registers were:
  ER -- ST COUNT  LBA_48  LH LM LL DV DC
  -- -- -- == -- == == == -- -- -- -- --
  40 -- 51 00 00 00 00 be 00 5f 57 00 00  Error: UNC at LBA = 0xbe005f57 = 3187695447

  Commands leading to the command that caused the error were:
  CR FEATR COUNT  LBA_48  LH LM LL DV DC  Powered_Up_Time  Command/Feature_Name
  -- == -- == -- == == == -- -- -- -- --  ---------------  --------------------
  60 00 00 01 00 00 00 be 00 5f 00 40 00     00:00:19.856  READ FPDMA QUEUED
  42 00 00 00 68 00 00 0e 00 60 70 40 00     00:00:19.846  READ VERIFY SECTOR(S) EXT
  60 00 00 01 00 00 00 0e 00 60 00 40 00     00:00:19.829  READ FPDMA QUEUED
  42 00 00 00 68 00 00 0e 00 60 08 40 00     00:00:19.793  READ VERIFY SECTOR(S) EXT
  60 00 00 00 01 00 25 df 00 42 ff 40 00     00:00:19.778  READ FPDMA QUEUED

Error 3792 [11] occurred at disk power-on lifetime: 34586 hours (1441 days + 2 hours)
  When the command that caused the error occurred, the device was active or idle.

  After command completion occurred, registers were:
  ER -- ST COUNT  LBA_48  LH LM LL DV DC
  -- -- -- == -- == == == -- -- -- -- --
  40 -- 51 00 00 00 00 cf 00 5d df 00 00  Error: UNC at LBA = 0xcf005ddf = 3472907743

  Commands leading to the command that caused the error were:
  CR FEATR COUNT  LBA_48  LH LM LL DV DC  Powered_Up_Time  Command/Feature_Name
  -- == -- == -- == == == -- -- -- -- --  ---------------  --------------------
  60 00 00 00 08 00 00 cf 00 5d d8 40 00     00:00:14.830  READ FPDMA QUEUED
  60 00 00 00 08 00 00 cf 00 5d d0 40 00     00:00:14.829  READ FPDMA QUEUED
  60 00 00 00 08 00 00 cf 00 5d c8 40 00     00:00:14.829  READ FPDMA QUEUED
  60 00 00 00 08 00 00 cf 00 5d c0 40 00     00:00:14.829  READ FPDMA QUEUED
  60 00 00 00 08 00 00 cf 00 5d b8 40 00     00:00:14.828  READ FPDMA QUEUED

Error 3791 [10] occurred at disk power-on lifetime: 34586 hours (1441 days + 2 hours)
  When the command that caused the error occurred, the device was active or idle.

  After command completion occurred, registers were:
  ER -- ST COUNT  LBA_48  LH LM LL DV DC
  -- -- -- == -- == == == -- -- -- -- --
  40 -- 51 00 00 00 00 cf 00 5d df 00 00  Error: UNC at LBA = 0xcf005ddf = 3472907743

  Commands leading to the command that caused the error were:
  CR FEATR COUNT  LBA_48  LH LM LL DV DC  Powered_Up_Time  Command/Feature_Name
  -- == -- == -- == == == -- -- -- -- --  ---------------  --------------------
  60 00 00 00 80 00 00 bd 00 5d f0 40 00     00:00:11.749  READ FPDMA QUEUED
  60 00 00 00 80 00 00 bd 00 5d 70 40 00     00:00:11.742  READ FPDMA QUEUED
  60 00 00 01 00 00 00 08 00 00 00 40 00     00:00:11.734  READ FPDMA QUEUED
  60 00 00 00 02 00 00 0d 00 60 74 40 00     00:00:11.731  READ FPDMA QUEUED
  61 00 00 00 02 00 00 0d 00 60 74 40 00     00:00:11.730  WRITE FPDMA QUEUED

Error 3790 [9] occurred at disk power-on lifetime: 34586 hours (1441 days + 2 hours)
  When the command that caused the error occurred, the device was active or idle.

  After command completion occurred, registers were:
  ER -- ST COUNT  LBA_48  LH LM LL DV DC
  -- -- -- == -- == == == -- -- -- -- --
  40 -- 51 00 00 00 00 be 00 5f 57 00 00  Error: UNC at LBA = 0xbe005f57 = 3187695447

  Commands leading to the command that caused the error were:
  CR FEATR COUNT  LBA_48  LH LM LL DV DC  Powered_Up_Time  Command/Feature_Name
  -- == -- == -- == == == -- -- -- -- --  ---------------  --------------------
  60 00 00 00 08 00 00 be 00 5f 50 40 00     00:00:04.483  READ FPDMA QUEUED
  60 00 00 00 08 00 00 be 00 5f 48 40 00     00:00:04.482  READ FPDMA QUEUED
  60 00 00 00 08 00 00 be 00 5f 40 40 00     00:00:04.482  READ FPDMA QUEUED
  60 00 00 00 08 00 00 be 00 5f 38 40 00     00:00:04.481  READ FPDMA QUEUED
  60 00 00 00 08 00 00 be 00 5f 30 40 00     00:00:04.481  READ FPDMA QUEUED

Error 3789 [8] occurred at disk power-on lifetime: 34586 hours (1441 days + 2 hours)
  When the command that caused the error occurred, the device was active or idle.

  After command completion occurred, registers were:
  ER -- ST COUNT  LBA_48  LH LM LL DV DC
  -- -- -- == -- == == == -- -- -- -- --
  40 -- 51 00 00 00 00 be 00 5f 57 00 00  Error: UNC at LBA = 0xbe005f57 = 3187695447

  Commands leading to the command that caused the error were:
  CR FEATR COUNT  LBA_48  LH LM LL DV DC  Powered_Up_Time  Command/Feature_Name
  -- == -- == -- == == == -- -- -- -- --  ---------------  --------------------
  60 00 00 01 00 00 00 c4 00 5f 70 40 00     00:00:01.426  READ FPDMA QUEUED
  60 00 00 01 00 00 00 c3 00 5f 70 40 00     00:00:01.425  READ FPDMA QUEUED
  60 00 00 01 00 00 00 c2 00 5f 70 40 00     00:00:01.425  READ FPDMA QUEUED
  60 00 00 01 00 00 00 c1 00 5f 70 40 00     00:00:01.424  READ FPDMA QUEUED
  60 00 00 01 00 00 00 c0 00 5f 70 40 00     00:00:01.424  READ FPDMA QUEUED

Error 3788 [7] occurred at disk power-on lifetime: 34570 hours (1440 days + 10 hours)
  When the command that caused the error occurred, the device was active or idle.

  After command completion occurred, registers were:
  ER -- ST COUNT  LBA_48  LH LM LL DV DC
  -- -- -- == -- == == == -- -- -- -- --
  40 -- 51 00 00 00 18 2c 00 0f be 00 00  Error: UNC at LBA = 0x182c000fbe = 103817416638

  Commands leading to the command that caused the error were:
  CR FEATR COUNT  LBA_48  LH LM LL DV DC  Powered_Up_Time  Command/Feature_Name
  -- == -- == -- == == == -- -- -- -- --  ---------------  --------------------
  60 00 00 00 08 00 18 2c 00 0f b8 40 00     00:04:29.205  READ FPDMA QUEUED
  2f 00 00 00 01 00 00 00 00 00 10 28 00     00:04:29.195  READ LOG EXT
  60 00 00 00 08 00 18 2c 00 0f b8 40 00     00:04:26.420  READ FPDMA QUEUED
  2f 00 00 00 01 00 00 00 00 00 10 28 00     00:04:26.371  READ LOG EXT
  60 00 00 00 08 00 18 2c 00 0f b8 40 00     00:04:23.560  READ FPDMA QUEUED

Error 3787 [6] occurred at disk power-on lifetime: 34570 hours (1440 days + 10 hours)
  When the command that caused the error occurred, the device was active or idle.

  After command completion occurred, registers were:
  ER -- ST COUNT  LBA_48  LH LM LL DV DC
  -- -- -- == -- == == == -- -- -- -- --
  40 -- 51 00 00 00 18 2c 00 0f be 00 00  Error: UNC at LBA = 0x182c000fbe = 103817416638

  Commands leading to the command that caused the error were:
  CR FEATR COUNT  LBA_48  LH LM LL DV DC  Powered_Up_Time  Command/Feature_Name
  -- == -- == -- == == == -- -- -- -- --  ---------------  --------------------
  60 00 00 00 08 00 18 2c 00 0f b8 40 00     00:04:26.420  READ FPDMA QUEUED
  2f 00 00 00 01 00 00 00 00 00 10 28 00     00:04:26.371  READ LOG EXT
  60 00 00 00 08 00 18 2c 00 0f b8 40 00     00:04:23.560  READ FPDMA QUEUED
  2f 00 00 00 01 00 00 00 00 00 10 28 00     00:04:23.547  READ LOG EXT
  60 00 00 00 08 00 18 2c 00 0f b8 40 00     00:04:20.809  READ FPDMA QUEUED

SMART Extended Self-test Log Version: 1 (1 sectors)
No self-tests have been logged.  [To run self-tests, use: smartctl -t]

SMART Selective self-test log data structure revision number 1
 SPAN  MIN_LBA  MAX_LBA  CURRENT_TEST_STATUS
    1        0        0  Not_testing
    2        0        0  Not_testing
    3        0        0  Not_testing
    4        0        0  Not_testing
    5        0        0  Not_testing
Selective self-test flags (0x0):
  After scanning selected spans, do NOT read-scan remainder of disk.
If Selective self-test is pending on power-up, resume after 0 minute delay.

SCT Status Version:                  3
SCT Version (vendor specific):       522 (0x020a)
SCT Support Level:                   1
Device State:                        Active (0)
Current Temperature:                    36 Celsius
Power Cycle Min/Max Temperature:     24/38 Celsius
Lifetime    Min/Max Temperature:      4/49 Celsius
Under/Over Temperature Limit Count:   0/0

SCT Temperature History Version:     2
Temperature Sampling Period:         1 minute
Temperature Logging Interval:        1 minute
Min/Max recommended Temperature:     14/55 Celsius
Min/Max Temperature Limit:           10/60 Celsius
Temperature History Size (Index):    128 (15)

SCT Error Recovery Control:
           Read: Disabled
          Write: Disabled

Device Statistics (GP/SMART Log 0x04) not supported

Pending Defects log (GP Log 0x0c) not supported

SATA Phy Event Counters (GP Log 0x11)
ID      Size     Value  Description
0x000a  2           30  Device-to-host register FISes sent due to a COMRESET
0x0001  2            0  Command failed due to ICRC error
0x0003  2            0  R_ERR response for device-to-host data FIS
0x0004  2            0  R_ERR response for host-to-device data FIS
0x0006  2            0  R_ERR response for device-to-host non-data FIS
0x0007  2            0  R_ERR response for host-to-device non-data FIS



