smartctl 7.2 2020-12-30 r5155 [x86_64-linux-6.2.0-26-generic] (local build)
Copyright (C) 2002-20, Bruce Allen, Christian Franke, www.smartmontools.org

=== START OF INFORMATION SECTION ===
Model Number:                       APPLE SSD AP0256M
Serial Number:                      --
Firmware Version:                   1296.140
PCI Vendor/Subsystem ID:            0x106b
IEEE OUI Identifier:                0x000000
Controller ID:                      0
NVMe Version:                       <1.2
Number of Namespaces:               1
Namespace 1 Size/Capacity:          251,000,193,024 [251 GB]
Namespace 1 Formatted LBA Size:     4096
Local Time is:                      Wed Sep 20 10:35:14 2023 EDT
Firmware Updates (0x02):            1 Slot
Optional Admin Commands (0x0004):   Frmw_DL
Optional NVM Commands (0x0004):     DS_Mngmt
Maximum Data Transfer Size:         256 Pages

Supported Power States
St Op     Max   Active     Idle   RL RT WL WT  Ent_Lat  Ex_Lat
 0 +     0.00W       -        -    0  0  0  0        0       0

Supported LBA Sizes (NSID 0x1)
Id Fmt  Data  Metadt  Rel_Perf
 0 +    4096       0         0

=== START OF SMART DATA SECTION ===
SMART overall-health self-assessment test result: PASSED

SMART/Health Information (NVMe Log 0x02)
Critical Warning:                   0x00
Temperature:                        43 Celsius
Available Spare:                    100%
Available Spare Threshold:          99%
Percentage Used:                    10%
Data Units Read:                    243,179,388 [124 TB]
Data Units Written:                 99,002,835 [50.6 TB]
Host Read Commands:                 4,274,279,727
Host Write Commands:                1,518,127,292
Controller Busy Time:               0
Power Cycles:                       225
Power On Hours:                     1,720
Unsafe Shutdowns:                   118
Media and Data Integrity Errors:    0
Error Information Log Entries:      0

Read 1 entries from Error Information Log failed: NVMe Status 0x109

