smartctl 7.4 2023-08-01 r5530 [x86_64-linux-6.14.0-28-generic] (local build)
Copyright (C) 2002-23, Bruce Allen, Christian Franke, www.smartmontools.org

=== START OF INFORMATION SECTION ===
Model Family:     SK hynix SATA SSDs
Device Model:     SHGS31-250GS-2
Serial Number:    --
Firmware Version: 90000Q00
User Capacity:    250,059,350,016 bytes [250 GB]
Sector Sizes:     512 bytes logical, 4096 bytes physical
Rotation Rate:    Solid State Device
Form Factor:      2.5 inches
TRIM Command:     Available, deterministic
Device is:        In smartctl database 7.3/5528
ATA Version is:   ACS-3 (minor revision not indicated)
SATA Version is:  SATA 3.2, 6.0 Gb/s (current: 6.0 Gb/s)
Local Time is:    Wed Aug 27 11:08:57 2025 EDT
SMART support is: Available - device has SMART capability.
SMART support is: Enabled
AAM feature is:   Unavailable
APM level is:     254 (maximum performance)
Rd look-ahead is: Enabled
Write cache is:   Enabled
DSN feature is:   Unavailable
ATA Security is:  Disabled, frozen [SEC2]
Wt Cache Reorder: Unavailable

=== START OF READ SMART DATA SECTION ===
SMART overall-health self-assessment test result: PASSED

General SMART Values:
Offline data collection status:  (0x02)	Offline data collection activity
					was completed without error.
					Auto Offline Data Collection: Disabled.
Self-test execution status:      (   0)	The previous self-test routine completed
					without error or no self-test has ever 
					been run.
Total time to complete Offline 
data collection: 		(  110) seconds.
Offline data collection
capabilities: 			 (0x51) SMART execute Offline immediate.
					No Auto Offline data collection support.
					Suspend Offline collection upon new
					command.
					No Offline surface scan supported.
					Self-test supported.
					No Conveyance Self-test supported.
					Selective Self-test supported.
SMART capabilities:            (0x0002)	Does not save SMART data before
					entering power-saving mode.
					Supports SMART auto save timer.
Error logging capability:        (0x01)	Error logging supported.
					General Purpose Logging supported.
Short self-test routine 
recommended polling time: 	 (   2) minutes.
Extended self-test routine
recommended polling time: 	 (  40) minutes.

SMART Attributes Data Structure revision number: 0
Vendor Specific SMART Attributes with Thresholds:
ID# ATTRIBUTE_NAME          FLAGS    VALUE WORST THRESH FAIL RAW_VALUE
  1 Raw_Read_Error_Rate     -OSR--   166   166   006    -    0
  5 Retired_Block_Count     -O--CK   100   100   036    -    0
  9 Power_On_Hours          -O--CK   090   090   000    -    9727
 12 Power_Cycle_Count       -O--CK   100   100   020    -    408
100 Total_Erase_Count       -O--CK   100   100   000    -    831334
168 Min_Erase_Count         -O--CK   100   100   000    -    7
169 Max_Erase_Count         -O--CK   098   098   000    -    71
171 Program_Fail_Count      -O--CK   100   100   000    -    0
172 Erase_Fail_Count        -O--CK   100   100   000    -    0
174 Unexpect_Power_Loss_Ct  -O--CK   100   100   000    -    123
175 Program_Fail_Count_Chip -O--CK   100   100   000    -    0
176 Unused_Rsvd_Blk_Cnt_Tot -O--CK   100   100   000    -    0
177 Wear_Leveling_Count     -O--CK   099   099   000    -    43
178 Used_Rsvd_Blk_Cnt_Chip  -O--CK   100   100   000    -    0
179 Used_Rsvd_Blk_Cnt_Tot   -O--CK   100   100   000    -    0
180 Erase_Fail_Count        -O--CK   100   100   000    -    417
184 End-to-End_Error        -O--CK   100   100   000    -    0
187 Reported_Uncorrect      -O--CK   100   100   000    -    0
188 Command_Timeout         -O--CK   100   100   000    -    103
194 Temperature_Celsius     -O---K   025   046   000    -    25 (Min/Max 18/46)
195 Hardware_ECC_Recovered  -OSR--   100   100   000    -    0
196 Reallocated_Event_Count -O--CK   100   100   036    -    0
198 Offline_Uncorrectable   ----CK   100   100   000    -    0
199 UDMA_CRC_Error_Count    -O--CK   100   100   000    -    0
204 Soft_ECC_Correction     -OSR--   100   001   000    -    5767
212 Phy_Error_Count         -O--CK   100   100   000    -    3099
233 Media_Wearout_Indicator PO---K   099   099   001    -    99
234 Unknown_SK_hynix_Attrib -O--CK   100   100   000    -    11738
241 Total_Writes_GB         -O--CK   100   100   000    -    6433
242 Total_Reads_GB          -O--CK   100   100   000    -    40271
                            ||||||_ K auto-keep
                            |||||__ C event count
                            ||||___ R error rate
                            |||____ S speed/performance
                            ||_____ O updated online
                            |______ P prefailure warning

General Purpose Log Directory Version 1
SMART           Log Directory Version 1 [multi-sector log support]
Address    Access  R/W   Size  Description
0x00       GPL,SL  R/O      1  Log Directory
0x01           SL  R/O      1  Summary SMART error log
0x02           SL  R/O      4  Comprehensive SMART error log
0x03       GPL     R/O      5  Ext. Comprehensive SMART error log
0x04       GPL,SL  R/O      8  Device Statistics log
0x06           SL  R/O      1  SMART self-test log
0x07       GPL     R/O      2  Extended self-test log
0x09           SL  R/W      1  Selective self-test log
0x10       GPL     R/O      1  NCQ Command Error log
0x11       GPL     R/O      1  SATA Phy Event Counters log
0x30       GPL,SL  R/O      9  IDENTIFY DEVICE data log
0x80-0x9f  GPL,SL  R/W     16  Host vendor specific log

SMART Extended Comprehensive Error Log Version: 1 (5 sectors)
No Errors Logged

SMART Extended Self-test Log Version: 1 (2 sectors)
Num  Test_Description    Status                  Remaining  LifeTime(hours)  LBA_of_first_error
# 1  Short offline       Completed without error       00%      4359         -
# 2  Short offline       Completed without error       00%      4238         -
# 3  Extended offline    Completed without error       00%      3046         -
# 4  Short offline       Completed without error       00%      3044         -
# 5  Extended offline    Completed without error       00%      2001         -
# 6  Short offline       Completed without error       00%      2000         -
# 7  Short offline       Aborted by host               80%      1999         -
# 8  Extended offline    Completed without error       00%      1439         -
# 9  Short offline       Completed without error       00%      1438         -
#10  Short offline       Completed without error       00%      1437         -
#11  Short offline       Completed without error       00%       871         -
#12  Extended offline    Completed without error       00%       543         -
#13  Short offline       Completed without error       00%       541         -
#14  Short offline       Completed without error       00%       518         -
#15  Short offline       Aborted by host               90%       518         -
#16  Short offline       Completed without error       00%       502         -
#17  Short offline       Completed without error       00%       500         -
#18  Short offline       Completed without error       00%       500         -
#19  Short offline       Completed without error       00%       498         -

SMART Selective self-test log data structure revision number 0
Note: revision number not 1 implies that no selective self-test has ever been run
 SPAN  MIN_LBA  MAX_LBA  CURRENT_TEST_STATUS
    1        0        0  Not_testing
    2        0        0  Not_testing
    3        0        0  Not_testing
    4        0        0  Not_testing
    5        0        0  Not_testing
Selective self-test flags (0x0):
  After scanning selected spans, do NOT read-scan remainder of disk.
If Selective self-test is pending on power-up, resume after 0 minute delay.

SCT Commands not supported

Device Statistics (GP Log 0x04)
Page  Offset Size        Value Flags Description
0x01  =====  =               =  ===  == General Statistics (rev 1) ==
0x01  0x008  4             408  ---  Lifetime Power-On Resets
0x01  0x010  4            9727  ---  Power-on Hours
0x01  0x018  6     12565009916  ---  Logical Sectors Written
0x01  0x020  6      1070273932  ---  Number of Write Commands
0x01  0x028  6     78654393395  ---  Logical Sectors Read
0x01  0x030  6      3156689220  ---  Number of Read Commands
0x01  0x038  6   1634366255109  ---  Date and Time TimeStamp
0x04  =====  =               =  ===  == General Errors Statistics (rev 1) ==
0x04  0x008  4               0  ---  Number of Reported Uncorrectable Errors
0x04  0x010  4             103  ---  Resets Between Cmd Acceptance and Completion
0x05  =====  =               =  ===  == Temperature Statistics (rev 1) ==
0x05  0x008  1              25  ---  Current Temperature
0x05  0x010  1              23  ---  Average Short Term Temperature
0x05  0x018  1              21  ---  Average Long Term Temperature
0x05  0x020  1              46  ---  Highest Temperature
0x05  0x028  1              18  ---  Lowest Temperature
0x05  0x030  1               -  ---  Highest Average Short Term Temperature
0x05  0x038  1              19  ---  Lowest Average Short Term Temperature
0x05  0x040  1               -  ---  Highest Average Long Term Temperature
0x05  0x048  1              20  ---  Lowest Average Long Term Temperature
0x05  0x050  4               0  ---  Time in Over-Temperature
0x05  0x058  1              80  ---  Specified Maximum Operating Temperature
0x05  0x060  4          443260  ---  Time in Under-Temperature
0x05  0x068  1             -20  ---  Specified Minimum Operating Temperature
0x06  =====  =               =  ===  == Transport Statistics (rev 1) ==
0x06  0x008  4            1645  ---  Number of Hardware Resets
0x06  0x018  4               0  ---  Number of Interface CRC Errors
0x07  =====  =               =  ===  == Solid State Device Statistics (rev 1) ==
0x07  0x008  1               1  ---  Percentage Used Endurance Indicator
                                |||_ C monitored condition met
                                ||__ D supports DSN
                                |___ N normalized value

Pending Defects log (GP Log 0x0c) not supported

SATA Phy Event Counters (GP Log 0x11)
ID      Size     Value  Description
0x0001  2            0  Command failed due to ICRC error
0x000a  2            4  Device-to-host register FISes sent due to a COMRESET

