smartctl 7.1 2019-12-30 r5022 [x86_64-linux-5.6.3-2-MANJARO] (local build)
Copyright (C) 2002-19, Bruce Allen, Christian Franke, www.smartmontools.org

=== START OF INFORMATION SECTION ===
Model Family:     Western Digital Caviar Black
Device Model:     WDC WD5002AALX-00J37A0
Serial Number:    --
LU WWN Device Id: 5 0014ee ...
Firmware Version: 15.01H15
User Capacity:    500,107,862,016 bytes [500 GB]
Sector Size:      512 bytes logical/physical
Device is:        In smartctl database [for details use: -P show]
ATA Version is:   ATA8-ACS (minor revision not indicated)
SATA Version is:  SATA 3.0, 6.0 Gb/s (current: 3.0 Gb/s)
Local Time is:    Tue Apr 14 23:54:22 2020 EEST
SMART support is: Available - device has SMART capability.
SMART support is: Enabled
AAM feature is:   Unavailable
APM feature is:   Unavailable
Rd look-ahead is: Enabled
Write cache is:   Disabled
DSN feature is:   Unavailable
ATA Security is:  Disabled, frozen [SEC2]
Wt Cache Reorder: Enabled

=== START OF READ SMART DATA SECTION ===
SMART overall-health self-assessment test result: PASSED

General SMART Values:
Offline data collection status:  (0x82)	Offline data collection activity
					was completed without error.
					Auto Offline Data Collection: Enabled.
Self-test execution status:      (   0)	The previous self-test routine completed
					without error or no self-test has ever 
					been run.
Total time to complete Offline 
data collection: 		( 8280) seconds.
Offline data collection
capabilities: 			 (0x7b) SMART execute Offline immediate.
					Auto Offline data collection on/off support.
					Suspend Offline collection upon new
					command.
					Offline surface scan supported.
					Self-test supported.
					Conveyance Self-test supported.
					Selective Self-test supported.
SMART capabilities:            (0x0003)	Saves SMART data before entering
					power-saving mode.
					Supports SMART auto save timer.
Error logging capability:        (0x01)	Error logging supported.
					General Purpose Logging supported.
Short self-test routine 
recommended polling time: 	 (   2) minutes.
Extended self-test routine
recommended polling time: 	 (  84) minutes.
Conveyance self-test routine
recommended polling time: 	 (   5) minutes.
SCT capabilities: 	       (0x3037)	SCT Status supported.
					SCT Feature Control supported.
					SCT Data Table supported.

SMART Attributes Data Structure revision number: 16
Vendor Specific SMART Attributes with Thresholds:
ID# ATTRIBUTE_NAME          FLAGS    VALUE WORST THRESH FAIL RAW_VALUE
  1 Raw_Read_Error_Rate     POSR-K   200   187   051    -    89
  3 Spin_Up_Time            POS--K   138   137   021    -    4075
  4 Start_Stop_Count        -O--CK   100   100   000    -    269
  5 Reallocated_Sector_Ct   PO--CK   143   143   140    -    1082
  7 Seek_Error_Rate         -OSR-K   100   253   000    -    0
  9 Power_On_Hours          -O--CK   100   100   000    -    496
 10 Spin_Retry_Count        -O--CK   100   100   000    -    0
 11 Calibration_Retry_Count -O--CK   100   100   000    -    0
 12 Power_Cycle_Count       -O--CK   100   100   000    -    267
192 Power-Off_Retract_Count -O--CK   200   200   000    -    216
193 Load_Cycle_Count        -O--CK   200   200   000    -    52
194 Temperature_Celsius     -O---K   110   103   000    -    33
196 Reallocated_Event_Count -O--CK   172   172   000    -    28
197 Current_Pending_Sector  -O--CK   200   199   000    -    1
198 Offline_Uncorrectable   ----CK   200   197   000    -    2
199 UDMA_CRC_Error_Count    -O--CK   200   200   000    -    0
200 Multi_Zone_Error_Rate   ---R--   200   199   000    -    1
                            ||||||_ K auto-keep
                            |||||__ C event count
                            ||||___ R error rate
                            |||____ S speed/performance
                            ||_____ O updated online
                            |______ P prefailure warning

General Purpose Log Directory Version 1
SMART           Log Directory Version 1 [multi-sector log support]
Address    Access  R/W   Size  Description
0x00       GPL,SL  R/O      1  Log Directory
0x01           SL  R/O      1  Summary SMART error log
0x02           SL  R/O      5  Comprehensive SMART error log
0x03       GPL     R/O      6  Ext. Comprehensive SMART error log
0x06           SL  R/O      1  SMART self-test log
0x07       GPL     R/O      1  Extended self-test log
0x09           SL  R/W      1  Selective self-test log
0x10       GPL     R/O      1  NCQ Command Error log
0x11       GPL     R/O      1  SATA Phy Event Counters log
0x80-0x9f  GPL,SL  R/W     16  Host vendor specific log
0xa0-0xa7  GPL,SL  VS      16  Device vendor specific log
0xa8-0xb5  GPL,SL  VS       1  Device vendor specific log
0xb6       GPL     VS       1  Device vendor specific log
0xb7       GPL,SL  VS       1  Device vendor specific log
0xbd       GPL,SL  VS       1  Device vendor specific log
0xc0       GPL,SL  VS       1  Device vendor specific log
0xc1       GPL     VS      24  Device vendor specific log
0xe0       GPL,SL  R/W      1  SCT Command/Status
0xe1       GPL,SL  R/W      1  SCT Data Transfer

SMART Extended Comprehensive Error Log Version: 1 (6 sectors)
Device Error Count: 164 (device log contains only the most recent 24 errors)
	CR     = Command Register
	FEATR  = Features Register
	COUNT  = Count (was: Sector Count) Register
	LBA_48 = Upper bytes of LBA High/Mid/Low Registers ]  ATA-8
	LH     = LBA High (was: Cylinder High) Register    ]   LBA
	LM     = LBA Mid (was: Cylinder Low) Register      ] Register
	LL     = LBA Low (was: Sector Number) Register     ]
	DV     = Device (was: Device/Head) Register
	DC     = Device Control Register
	ER     = Error register
	ST     = Status register
Powered_Up_Time is measured from power on, and printed as
DDd+hh:mm:SS.sss where DD=days, hh=hours, mm=minutes,
SS=sec, and sss=millisec. It "wraps" after 49.710 days.

Error 164 [19] occurred at disk power-on lifetime: 19 hours (0 days + 19 hours)
  When the command that caused the error occurred, the device was active or idle.

  After command completion occurred, registers were:
  ER -- ST COUNT  LBA_48  LH LM LL DV DC
  -- -- -- == -- == == == -- -- -- -- --
  40 -- 51 00 08 00 00 03 a7 9e 0c e3 00  Error: UNC 8 sectors at LBA = 0x03a79e0c = 61316620

  Commands leading to the command that caused the error were:
  CR FEATR COUNT  LBA_48  LH LM LL DV DC  Powered_Up_Time  Command/Feature_Name
  -- == -- == -- == == == -- -- -- -- --  ---------------  --------------------
  c8 00 00 00 08 00 00 03 a7 9e 08 e3 08     00:08:37.161  READ DMA
  c8 00 00 00 78 00 00 03 a7 a0 88 e3 08     00:08:37.160  READ DMA
  c8 00 00 00 08 00 00 03 a7 9e 00 e3 08     00:08:37.160  READ DMA
  c8 00 00 00 30 00 00 03 a7 a0 48 e3 08     00:08:37.160  READ DMA
  c8 00 00 00 68 00 00 03 a7 9f 88 e3 08     00:08:37.159  READ DMA

Error 163 [18] occurred at disk power-on lifetime: 19 hours (0 days + 19 hours)
  When the command that caused the error occurred, the device was active or idle.

  After command completion occurred, registers were:
  ER -- ST COUNT  LBA_48  LH LM LL DV DC
  -- -- -- == -- == == == -- -- -- -- --
  40 -- 51 00 f8 00 00 03 a7 9e 0c e3 00  Error: UNC 248 sectors at LBA = 0x03a79e0c = 61316620

  Commands leading to the command that caused the error were:
  CR FEATR COUNT  LBA_48  LH LM LL DV DC  Powered_Up_Time  Command/Feature_Name
  -- == -- == -- == == == -- -- -- -- --  ---------------  --------------------
  c8 00 00 00 f8 00 00 03 a7 9e 00 e3 08     00:08:35.469  READ DMA
  c8 00 00 00 08 00 00 03 a7 a0 78 e3 08     00:08:35.469  READ DMA
  c8 00 00 00 08 00 00 03 a7 a0 38 e3 08     00:08:35.468  READ DMA
  c8 00 00 00 08 00 00 03 a7 a0 18 e3 08     00:08:35.468  READ DMA
  c8 00 00 00 08 00 00 03 a7 c0 00 e3 08     00:08:35.466  READ DMA

Error 162 [17] occurred at disk power-on lifetime: 19 hours (0 days + 19 hours)
  When the command that caused the error occurred, the device was active or idle.

  After command completion occurred, registers were:
  ER -- ST COUNT  LBA_48  LH LM LL DV DC
  -- -- -- == -- == == == -- -- -- -- --
  40 -- 51 00 08 00 00 03 a7 9e 0c e3 00  Error: UNC 8 sectors at LBA = 0x03a79e0c = 61316620

  Commands leading to the command that caused the error were:
  CR FEATR COUNT  LBA_48  LH LM LL DV DC  Powered_Up_Time  Command/Feature_Name
  -- == -- == -- == == == -- -- -- -- --  ---------------  --------------------
  c8 00 00 00 08 00 00 03 a7 9e 08 e3 08     00:08:33.526  READ DMA
  e5 00 00 00 00 00 00 00 00 00 00 00 08     00:08:33.525  CHECK POWER MODE
  c8 00 00 00 08 00 00 03 a7 9e 00 e3 08     00:08:33.523  READ DMA
  25 00 00 02 00 00 00 03 42 7a 00 e0 08     00:08:33.522  READ DMA EXT
  c8 00 00 00 68 00 00 03 a7 9f 88 e3 08     00:08:33.521  READ DMA

Error 161 [16] occurred at disk power-on lifetime: 19 hours (0 days + 19 hours)
  When the command that caused the error occurred, the device was active or idle.

  After command completion occurred, registers were:
  ER -- ST COUNT  LBA_48  LH LM LL DV DC
  -- -- -- == -- == == == -- -- -- -- --
  40 -- 51 00 f8 00 00 03 a7 9e 0c e3 00  Error: UNC 248 sectors at LBA = 0x03a79e0c = 61316620

  Commands leading to the command that caused the error were:
  CR FEATR COUNT  LBA_48  LH LM LL DV DC  Powered_Up_Time  Command/Feature_Name
  -- == -- == -- == == == -- -- -- -- --  ---------------  --------------------
  c8 00 00 00 f8 00 00 03 a7 9e 00 e3 08     00:08:31.816  READ DMA
  c8 00 00 00 78 00 00 00 00 08 88 e0 08     00:08:31.816  READ DMA
  25 00 00 00 68 00 00 3a 38 5f 88 e0 08     00:08:31.815  READ DMA EXT
  25 00 00 00 80 00 00 3a 38 5f 00 e0 08     00:08:31.815  READ DMA EXT
  25 00 00 00 f8 00 00 3a 38 5e 00 e0 08     00:08:31.814  READ DMA EXT

Error 160 [15] occurred at disk power-on lifetime: 19 hours (0 days + 19 hours)
  When the command that caused the error occurred, the device was active or idle.

  After command completion occurred, registers were:
  ER -- ST COUNT  LBA_48  LH LM LL DV DC
  -- -- -- == -- == == == -- -- -- -- --
  40 -- 51 00 08 00 00 03 a7 9e 0c e3 00  Error: UNC 8 sectors at LBA = 0x03a79e0c = 61316620

  Commands leading to the command that caused the error were:
  CR FEATR COUNT  LBA_48  LH LM LL DV DC  Powered_Up_Time  Command/Feature_Name
  -- == -- == -- == == == -- -- -- -- --  ---------------  --------------------
  c8 00 00 00 08 00 00 03 a7 9e 08 e3 08     00:08:30.006  READ DMA
  e5 00 00 00 00 00 00 00 00 00 00 00 08     00:08:30.002  CHECK POWER MODE
  25 00 00 01 f8 00 00 00 00 0a 08 e0 08     00:08:30.000  READ DMA EXT
  c8 00 00 00 f8 00 00 00 00 09 08 e0 08     00:08:29.996  READ DMA
  c8 00 00 00 78 00 00 00 00 08 88 e0 08     00:08:29.996  READ DMA

Error 159 [14] occurred at disk power-on lifetime: 19 hours (0 days + 19 hours)
  When the command that caused the error occurred, the device was active or idle.

  After command completion occurred, registers were:
  ER -- ST COUNT  LBA_48  LH LM LL DV DC
  -- -- -- == -- == == == -- -- -- -- --
  40 -- 51 00 f8 00 00 03 a7 9e 0c e3 00  Error: UNC 248 sectors at LBA = 0x03a79e0c = 61316620

  Commands leading to the command that caused the error were:
  CR FEATR COUNT  LBA_48  LH LM LL DV DC  Powered_Up_Time  Command/Feature_Name
  -- == -- == -- == == == -- -- -- -- --  ---------------  --------------------
  c8 00 00 00 f8 00 00 03 a7 9e 00 e3 08     00:08:28.285  READ DMA
  c8 00 00 00 f8 00 00 03 a7 a1 08 e3 08     00:08:28.285  READ DMA
  c8 00 00 00 78 00 00 03 a7 a0 88 e3 08     00:08:28.284  READ DMA
  c8 00 00 00 30 00 00 03 a7 a0 48 e3 08     00:08:28.284  READ DMA
  c8 00 00 00 08 00 00 00 00 08 20 e0 08     00:08:28.284  READ DMA

Error 158 [13] occurred at disk power-on lifetime: 19 hours (0 days + 19 hours)
  When the command that caused the error occurred, the device was active or idle.

  After command completion occurred, registers were:
  ER -- ST COUNT  LBA_48  LH LM LL DV DC
  -- -- -- == -- == == == -- -- -- -- --
  40 -- 51 00 08 00 00 03 a7 9e 0c e3 00  Error: UNC 8 sectors at LBA = 0x03a79e0c = 61316620

  Commands leading to the command that caused the error were:
  CR FEATR COUNT  LBA_48  LH LM LL DV DC  Powered_Up_Time  Command/Feature_Name
  -- == -- == -- == == == -- -- -- -- --  ---------------  --------------------
  c8 00 00 00 08 00 00 03 a7 9e 08 e3 08     00:08:26.475  READ DMA
  c8 00 00 00 08 00 00 03 a7 9e 00 e3 08     00:08:26.475  READ DMA
  c8 00 00 00 68 00 00 03 a7 9f 88 e3 08     00:08:26.475  READ DMA
  c8 00 00 00 80 00 00 03 a7 9f 00 e3 08     00:08:26.474  READ DMA
  27 00 00 00 00 00 00 00 00 00 00 e0 08     00:08:26.474  READ NATIVE MAX ADDRESS EXT [OBS-ACS-3]

Error 157 [12] occurred at disk power-on lifetime: 19 hours (0 days + 19 hours)
  When the command that caused the error occurred, the device was active or idle.

  After command completion occurred, registers were:
  ER -- ST COUNT  LBA_48  LH LM LL DV DC
  -- -- -- == -- == == == -- -- -- -- --
  40 -- 51 00 f8 00 00 03 a7 9e 0c e3 00  Error: UNC 248 sectors at LBA = 0x03a79e0c = 61316620

  Commands leading to the command that caused the error were:
  CR FEATR COUNT  LBA_48  LH LM LL DV DC  Powered_Up_Time  Command/Feature_Name
  -- == -- == -- == == == -- -- -- -- --  ---------------  --------------------
  c8 00 00 00 f8 00 00 03 a7 9e 00 e3 08     00:08:24.781  READ DMA
  25 00 00 02 00 00 00 03 a7 9c 00 e0 08     00:08:24.779  READ DMA EXT
  25 00 00 01 f8 00 00 03 42 82 08 e0 08     00:08:24.777  READ DMA EXT
  c8 00 00 00 f8 00 00 03 42 81 08 e3 08     00:08:24.775  READ DMA
  c8 00 00 00 78 00 00 03 42 80 88 e3 08     00:08:24.775  READ DMA

SMART Extended Self-test Log Version: 1 (1 sectors)
Num  Test_Description    Status                  Remaining  LifeTime(hours)  LBA_of_first_error
# 1  Short offline       Completed: read failure       90%       375         284934728
# 2  Extended offline    Completed: read failure       90%       375         284934728

SMART Selective self-test log data structure revision number 1
 SPAN  MIN_LBA  MAX_LBA  CURRENT_TEST_STATUS
    1        0        0  Not_testing
    2        0        0  Not_testing
    3        0        0  Not_testing
    4        0        0  Not_testing
    5        0        0  Not_testing
Selective self-test flags (0x0):
  After scanning selected spans, do NOT read-scan remainder of disk.
If Selective self-test is pending on power-up, resume after 0 minute delay.

SCT Status Version:                  3
SCT Version (vendor specific):       258 (0x0102)
Device State:                        Active (0)
Current Temperature:                    33 Celsius
Power Cycle Min/Max Temperature:     33/36 Celsius
Lifetime    Min/Max Temperature:      0/40 Celsius
Under/Over Temperature Limit Count:   0/0

SCT Temperature History Version:     2
Temperature Sampling Period:         1 minute
Temperature Logging Interval:        1 minute
Min/Max recommended Temperature:      0/60 Celsius
Min/Max Temperature Limit:           -41/85 Celsius
Temperature History Size (Index):    478 (137)

SCT Error Recovery Control command not supported

Device Statistics (GP/SMART Log 0x04) not supported

Pending Defects log (GP Log 0x0c) not supported

SATA Phy Event Counters (GP Log 0x11)
ID      Size     Value  Description
0x0001  2            0  Command failed due to ICRC error
0x0002  2            0  R_ERR response for data FIS
0x0003  2            0  R_ERR response for device-to-host data FIS
0x0004  2            0  R_ERR response for host-to-device data FIS
0x0005  2            0  R_ERR response for non-data FIS
0x0006  2            0  R_ERR response for device-to-host non-data FIS
0x0007  2            0  R_ERR response for host-to-device non-data FIS
0x000a  2            2  Device-to-host register FISes sent due to a COMRESET
0x000b  2            0  CRC errors within host-to-device FIS
0x8000  4        24807  Vendor specific

