smartctl 7.3 2022-02-28 r5338 [x86_64-linux-6.1.0-27-amd64] (local build)
Copyright (C) 2002-22, Bruce Allen, Christian Franke, www.smartmontools.org

=== START OF INFORMATION SECTION ===
Model Number:                       CT2000T500SSD8
Serial Number:                      --
Firmware Version:                   P8CR002
PCI Vendor/Subsystem ID:            0xc0a9
IEEE OUI Identifier:                0x00a075
Total NVM Capacity:                 2,000,398,934,016 [2.00 TB]
Unallocated NVM Capacity:           0
Controller ID:                      0
NVMe Version:                       2.0
Number of Namespaces:               1
Namespace 1 Size/Capacity:          2,000,398,934,016 [2.00 TB]
Namespace 1 Formatted LBA Size:     512
Namespace 1 IEEE EUI-64:            00a075 ...
Local Time is:                      Wed Nov 13 16:54:58 2024 CST
Firmware Updates (0x14):            2 Slots, no Reset required
Optional Admin Commands (0x0017):   Security Format Frmw_DL Self_Test
Optional NVM Commands (0x00d7):     Comp Wr_Unc DS_Mngmt Sav/Sel_Feat Timestmp Verify
Log Page Attributes (0x3e):         Cmd_Eff_Lg Ext_Get_Lg Telmtry_Lg Pers_Ev_Lg *Other*
Maximum Data Transfer Size:         128 Pages
Warning  Comp. Temp. Threshold:     86 Celsius
Critical Comp. Temp. Threshold:     88 Celsius
Namespace 1 Features (0x08):        No_ID_Reuse

Supported Power States
St Op     Max   Active     Idle   RL RT WL WT  Ent_Lat  Ex_Lat
 0 +     8.25W       -        -    0  0  0  0        0       0
 1 +     4.00W       -        -    1  1  1  1        0       0
 2 +     3.00W       -        -    2  2  2  2        0       0
 3 -   0.0250W       -        -    3  3  3  3     2000    3000
 4 -   0.0035W       -        -    4  4  4  4     5000   35000

Supported LBA Sizes (NSID 0x1)
Id Fmt  Data  Metadt  Rel_Perf
 0 +     512       0         1
 1 -    4096       0         0

=== START OF SMART DATA SECTION ===
SMART overall-health self-assessment test result: PASSED

SMART/Health Information (NVMe Log 0x02)
Critical Warning:                   0x00
Temperature:                        26 Celsius
Available Spare:                    100%
Available Spare Threshold:          5%
Percentage Used:                    5%
Data Units Read:                    9,285,969 [4.75 TB]
Data Units Written:                 250,574,903 [128 TB]
Host Read Commands:                 39,225,515
Host Write Commands:                898,312,794
Controller Busy Time:               3,753
Power Cycles:                       1,696
Power On Hours:                     2,267
Unsafe Shutdowns:                   51
Media and Data Integrity Errors:    0
Error Information Log Entries:      0
Warning  Comp. Temperature Time:    0
Critical Comp. Temperature Time:    0
Temperature Sensor 1:               26 Celsius

Error Information (NVMe Log 0x01, 16 of 255 entries)
No Errors Logged



