smartctl 7.2 2020-12-30 r5155 [x86_64-linux-5.10.0-16-amd64] (local build)
Copyright (C) 2002-20, Bruce Allen, Christian Franke, www.smartmontools.org

=== START OF INFORMATION SECTION ===
Model Family:     Western Digital Caviar Blue Serial ATA
Device Model:     WDC WD1600AAJS-08L7A0
Serial Number:    --
LU WWN Device Id: 5 0014ee ...
Firmware Version: 03.03E03
User Capacity:    160,041,885,696 bytes [160 GB]
Sector Size:      512 bytes logical/physical
Device is:        In smartctl database [for details use: -P show]
ATA Version is:   ATA8-ACS (minor revision not indicated)
SATA Version is:  SATA 2.5, 3.0 Gb/s
Local Time is:    Sun Aug 21 06:21:56 2022 CEST
SMART support is: Available - device has SMART capability.
SMART support is: Enabled
AAM feature is:   Disabled
APM feature is:   Unavailable
Rd look-ahead is: Enabled
Write cache is:   Enabled
DSN feature is:   Unavailable
ATA Security is:  Disabled, frozen [SEC2]
Wt Cache Reorder: Enabled

=== START OF READ SMART DATA SECTION ===
SMART overall-health self-assessment test result: PASSED

General SMART Values:
Offline data collection status:  (0x84)	Offline data collection activity
					was suspended by an interrupting command from host.
					Auto Offline Data Collection: Enabled.
Self-test execution status:      (   0)	The previous self-test routine completed
					without error or no self-test has ever 
					been run.
Total time to complete Offline 
data collection: 		( 3060) seconds.
Offline data collection
capabilities: 			 (0x7b) SMART execute Offline immediate.
					Auto Offline data collection on/off support.
					Suspend Offline collection upon new
					command.
					Offline surface scan supported.
					Self-test supported.
					Conveyance Self-test supported.
					Selective Self-test supported.
SMART capabilities:            (0x0003)	Saves SMART data before entering
					power-saving mode.
					Supports SMART auto save timer.
Error logging capability:        (0x01)	Error logging supported.
					General Purpose Logging supported.
Short self-test routine 
recommended polling time: 	 (   2) minutes.
Extended self-test routine
recommended polling time: 	 (  40) minutes.
Conveyance self-test routine
recommended polling time: 	 (   5) minutes.
SCT capabilities: 	       (0x3037)	SCT Status supported.
					SCT Feature Control supported.
					SCT Data Table supported.

SMART Attributes Data Structure revision number: 16
Vendor Specific SMART Attributes with Thresholds:
ID# ATTRIBUTE_NAME          FLAGS    VALUE WORST THRESH FAIL RAW_VALUE
  1 Raw_Read_Error_Rate     POSR-K   200   200   051    -    1268
  3 Spin_Up_Time            POS--K   139   138   021    -    4033
  4 Start_Stop_Count        -O--CK   099   099   000    -    1805
  5 Reallocated_Sector_Ct   PO--CK   200   200   140    -    0
  7 Seek_Error_Rate         -OSR-K   200   200   000    -    0
  9 Power_On_Hours          -O--CK   077   077   000    -    17392
 10 Spin_Retry_Count        -O--CK   100   100   000    -    0
 11 Calibration_Retry_Count -O--CK   100   100   000    -    0
 12 Power_Cycle_Count       -O--CK   099   099   000    -    1803
192 Power-Off_Retract_Count -O--CK   200   200   000    -    712
193 Load_Cycle_Count        -O--CK   200   200   000    -    1805
194 Temperature_Celsius     -O---K   106   093   000    -    37
196 Reallocated_Event_Count -O--CK   200   200   000    -    0
197 Current_Pending_Sector  -O--CK   200   200   000    -    0
198 Offline_Uncorrectable   ----CK   200   200   000    -    0
199 UDMA_CRC_Error_Count    -O--CK   200   200   000    -    0
200 Multi_Zone_Error_Rate   ---R--   200   200   000    -    0
                            ||||||_ K auto-keep
                            |||||__ C event count
                            ||||___ R error rate
                            |||____ S speed/performance
                            ||_____ O updated online
                            |______ P prefailure warning

General Purpose Log Directory Version 1
SMART           Log Directory Version 1 [multi-sector log support]
Address    Access  R/W   Size  Description
0x00       GPL,SL  R/O      1  Log Directory
0x01           SL  R/O      1  Summary SMART error log
0x02           SL  R/O      5  Comprehensive SMART error log
0x03       GPL     R/O      6  Ext. Comprehensive SMART error log
0x06           SL  R/O      1  SMART self-test log
0x07       GPL     R/O      1  Extended self-test log
0x09           SL  R/W      1  Selective self-test log
0x10       GPL     R/O      1  NCQ Command Error log
0x11       GPL     R/O      1  SATA Phy Event Counters log
0x80-0x9f  GPL,SL  R/W     16  Host vendor specific log
0xa0-0xa7  GPL,SL  VS      16  Device vendor specific log
0xa8-0xb7  GPL,SL  VS       1  Device vendor specific log
0xbd       GPL,SL  VS       1  Device vendor specific log
0xc0       GPL,SL  VS       1  Device vendor specific log
0xc1       GPL     VS      24  Device vendor specific log
0xe0       GPL,SL  R/W      1  SCT Command/Status
0xe1       GPL,SL  R/W      1  SCT Data Transfer

SMART Extended Comprehensive Error Log Version: 1 (6 sectors)
Device Error Count: 1268 (device log contains only the most recent 24 errors)
	CR     = Command Register
	FEATR  = Features Register
	COUNT  = Count (was: Sector Count) Register
	LBA_48 = Upper bytes of LBA High/Mid/Low Registers ]  ATA-8
	LH     = LBA High (was: Cylinder High) Register    ]   LBA
	LM     = LBA Mid (was: Cylinder Low) Register      ] Register
	LL     = LBA Low (was: Sector Number) Register     ]
	DV     = Device (was: Device/Head) Register
	DC     = Device Control Register
	ER     = Error register
	ST     = Status register
Powered_Up_Time is measured from power on, and printed as
DDd+hh:mm:SS.sss where DD=days, hh=hours, mm=minutes,
SS=sec, and sss=millisec. It "wraps" after 49.710 days.

Error 1268 [19] occurred at disk power-on lifetime: 13336 hours (555 days + 16 hours)
  When the command that caused the error occurred, the device was active or idle.

  After command completion occurred, registers were:
  ER -- ST COUNT  LBA_48  LH LM LL DV DC
  -- -- -- == -- == == == -- -- -- -- --
  40 -- 51 00 10 00 00 09 00 19 d9 40 00  Error: UNC at LBA = 0x090019d9 = 151001561

  Commands leading to the command that caused the error were:
  CR FEATR COUNT  LBA_48  LH LM LL DV DC  Powered_Up_Time  Command/Feature_Name
  -- == -- == -- == == == -- -- -- -- --  ---------------  --------------------
  60 00 10 00 f8 00 00 09 00 19 d8 40 00     00:07:06.927  READ FPDMA QUEUED
  60 00 18 00 f0 00 00 0a 00 19 00 40 00     00:07:06.927  READ FPDMA QUEUED
  2f 00 00 00 01 00 00 00 00 00 10 40 00     00:07:06.927  READ LOG EXT
  60 00 10 00 e0 00 00 09 00 19 d8 40 00     00:07:04.679  READ FPDMA QUEUED
  60 00 18 00 d8 00 00 0a 00 19 00 40 00     00:07:04.679  READ FPDMA QUEUED

Error 1267 [18] occurred at disk power-on lifetime: 13336 hours (555 days + 16 hours)
  When the command that caused the error occurred, the device was active or idle.

  After command completion occurred, registers were:
  ER -- ST COUNT  LBA_48  LH LM LL DV DC
  -- -- -- == -- == == == -- -- -- -- --
  40 -- 51 00 10 00 00 09 00 19 d9 40 00  Error: UNC at LBA = 0x090019d9 = 151001561

  Commands leading to the command that caused the error were:
  CR FEATR COUNT  LBA_48  LH LM LL DV DC  Powered_Up_Time  Command/Feature_Name
  -- == -- == -- == == == -- -- -- -- --  ---------------  --------------------
  60 00 10 00 e0 00 00 09 00 19 d8 40 00     00:07:04.679  READ FPDMA QUEUED
  60 00 18 00 d8 00 00 0a 00 19 00 40 00     00:07:04.679  READ FPDMA QUEUED
  2f 00 00 00 01 00 00 00 00 00 10 40 00     00:07:04.679  READ LOG EXT
  60 00 10 00 c8 00 00 09 00 19 d8 40 00     00:07:02.432  READ FPDMA QUEUED
  60 00 18 00 c0 00 00 0a 00 19 00 40 00     00:07:02.432  READ FPDMA QUEUED

Error 1266 [17] occurred at disk power-on lifetime: 13336 hours (555 days + 16 hours)
  When the command that caused the error occurred, the device was active or idle.

  After command completion occurred, registers were:
  ER -- ST COUNT  LBA_48  LH LM LL DV DC
  -- -- -- == -- == == == -- -- -- -- --
  40 -- 51 00 10 00 00 09 00 19 d9 40 00  Error: UNC at LBA = 0x090019d9 = 151001561

  Commands leading to the command that caused the error were:
  CR FEATR COUNT  LBA_48  LH LM LL DV DC  Powered_Up_Time  Command/Feature_Name
  -- == -- == -- == == == -- -- -- -- --  ---------------  --------------------
  60 00 10 00 c8 00 00 09 00 19 d8 40 00     00:07:02.432  READ FPDMA QUEUED
  60 00 18 00 c0 00 00 0a 00 19 00 40 00     00:07:02.432  READ FPDMA QUEUED
  2f 00 00 00 01 00 00 00 00 00 10 40 00     00:07:02.431  READ LOG EXT
  60 00 10 00 b0 00 00 09 00 19 d8 40 00     00:07:00.178  READ FPDMA QUEUED
  60 00 18 00 a8 00 00 0a 00 19 00 40 00     00:07:00.177  READ FPDMA QUEUED

Error 1265 [16] occurred at disk power-on lifetime: 13336 hours (555 days + 16 hours)
  When the command that caused the error occurred, the device was active or idle.

  After command completion occurred, registers were:
  ER -- ST COUNT  LBA_48  LH LM LL DV DC
  -- -- -- == -- == == == -- -- -- -- --
  40 -- 51 00 10 00 00 09 00 19 d9 40 00  Error: UNC at LBA = 0x090019d9 = 151001561

  Commands leading to the command that caused the error were:
  CR FEATR COUNT  LBA_48  LH LM LL DV DC  Powered_Up_Time  Command/Feature_Name
  -- == -- == -- == == == -- -- -- -- --  ---------------  --------------------
  60 00 10 00 b0 00 00 09 00 19 d8 40 00     00:07:00.178  READ FPDMA QUEUED
  60 00 18 00 a8 00 00 0a 00 19 00 40 00     00:07:00.177  READ FPDMA QUEUED
  2f 00 00 00 01 00 00 00 00 00 10 40 00     00:07:00.177  READ LOG EXT
  60 00 10 00 98 00 00 09 00 19 d8 40 00     00:06:57.928  READ FPDMA QUEUED
  60 00 18 00 90 00 00 0a 00 19 00 40 00     00:06:57.928  READ FPDMA QUEUED

Error 1264 [15] occurred at disk power-on lifetime: 13336 hours (555 days + 16 hours)
  When the command that caused the error occurred, the device was active or idle.

  After command completion occurred, registers were:
  ER -- ST COUNT  LBA_48  LH LM LL DV DC
  -- -- -- == -- == == == -- -- -- -- --
  40 -- 51 00 10 00 00 09 00 19 d9 40 00  Error: UNC at LBA = 0x090019d9 = 151001561

  Commands leading to the command that caused the error were:
  CR FEATR COUNT  LBA_48  LH LM LL DV DC  Powered_Up_Time  Command/Feature_Name
  -- == -- == -- == == == -- -- -- -- --  ---------------  --------------------
  60 00 10 00 98 00 00 09 00 19 d8 40 00     00:06:57.928  READ FPDMA QUEUED
  60 00 18 00 90 00 00 0a 00 19 00 40 00     00:06:57.928  READ FPDMA QUEUED
  2f 00 00 00 01 00 00 00 00 00 10 40 00     00:06:57.928  READ LOG EXT
  60 00 10 00 80 00 00 09 00 19 d8 40 00     00:06:55.680  READ FPDMA QUEUED
  60 00 18 00 78 00 00 0a 00 19 00 40 00     00:06:55.680  READ FPDMA QUEUED

Error 1263 [14] occurred at disk power-on lifetime: 13336 hours (555 days + 16 hours)
  When the command that caused the error occurred, the device was active or idle.

  After command completion occurred, registers were:
  ER -- ST COUNT  LBA_48  LH LM LL DV DC
  -- -- -- == -- == == == -- -- -- -- --
  40 -- 51 00 10 00 00 09 00 19 d9 40 00  Error: UNC at LBA = 0x090019d9 = 151001561

  Commands leading to the command that caused the error were:
  CR FEATR COUNT  LBA_48  LH LM LL DV DC  Powered_Up_Time  Command/Feature_Name
  -- == -- == -- == == == -- -- -- -- --  ---------------  --------------------
  60 00 10 00 80 00 00 09 00 19 d8 40 00     00:06:55.680  READ FPDMA QUEUED
  60 00 18 00 78 00 00 0a 00 19 00 40 00     00:06:55.680  READ FPDMA QUEUED
  2f 00 00 00 01 00 00 00 00 00 10 40 00     00:06:55.680  READ LOG EXT
  60 00 18 00 68 00 00 0a 00 19 00 40 00     00:06:53.427  READ FPDMA QUEUED
  60 00 10 00 60 00 00 09 00 19 d8 40 00     00:06:53.427  READ FPDMA QUEUED

Error 1262 [13] occurred at disk power-on lifetime: 13336 hours (555 days + 16 hours)
  When the command that caused the error occurred, the device was active or idle.

  After command completion occurred, registers were:
  ER -- ST COUNT  LBA_48  LH LM LL DV DC
  -- -- -- == -- == == == -- -- -- -- --
  40 -- 51 00 10 00 00 09 00 19 d9 40 00  Error: UNC at LBA = 0x090019d9 = 151001561

  Commands leading to the command that caused the error were:
  CR FEATR COUNT  LBA_48  LH LM LL DV DC  Powered_Up_Time  Command/Feature_Name
  -- == -- == -- == == == -- -- -- -- --  ---------------  --------------------
  60 00 18 00 68 00 00 0a 00 19 00 40 00     00:06:53.427  READ FPDMA QUEUED
  60 00 10 00 60 00 00 09 00 19 d8 40 00     00:06:53.427  READ FPDMA QUEUED
  60 00 52 00 58 00 00 02 00 79 86 40 00     00:06:53.382  READ FPDMA QUEUED
  60 01 00 00 50 00 00 01 00 79 86 40 00     00:06:53.382  READ FPDMA QUEUED
  60 00 56 00 48 00 00 01 00 79 30 40 00     00:06:53.382  READ FPDMA QUEUED

Error 1261 [12] occurred at disk power-on lifetime: 13336 hours (555 days + 16 hours)
  When the command that caused the error occurred, the device was active or idle.

  After command completion occurred, registers were:
  ER -- ST COUNT  LBA_48  LH LM LL DV DC
  -- -- -- == -- == == == -- -- -- -- --
  40 -- 51 00 08 00 00 09 00 19 d9 40 00  Error: UNC at LBA = 0x090019d9 = 151001561

  Commands leading to the command that caused the error were:
  CR FEATR COUNT  LBA_48  LH LM LL DV DC  Powered_Up_Time  Command/Feature_Name
  -- == -- == -- == == == -- -- -- -- --  ---------------  --------------------
  60 00 08 00 38 00 00 09 00 19 d8 40 00     00:03:12.950  READ FPDMA QUEUED
  2f 00 00 00 01 00 00 00 00 00 10 40 00     00:03:12.950  READ LOG EXT
  60 00 08 00 28 00 00 09 00 19 d8 40 00     00:03:10.703  READ FPDMA QUEUED
  2f 00 00 00 01 00 00 00 00 00 10 40 00     00:03:10.702  READ LOG EXT
  60 00 08 00 18 00 00 09 00 19 d8 40 00     00:03:08.455  READ FPDMA QUEUED

SMART Extended Self-test Log Version: 1 (1 sectors)
Num  Test_Description    Status                  Remaining  LifeTime(hours)  LBA_of_first_error
# 1  Vendor (0x50)       Completed without error       00%         0         -

SMART Selective self-test log data structure revision number 1
 SPAN  MIN_LBA  MAX_LBA  CURRENT_TEST_STATUS
    1        0        0  Not_testing
    2        0        0  Not_testing
    3        0        0  Not_testing
    4        0        0  Not_testing
    5        0        0  Not_testing
Selective self-test flags (0x0):
  After scanning selected spans, do NOT read-scan remainder of disk.
If Selective self-test is pending on power-up, resume after 0 minute delay.

SCT Status Version:                  2
SCT Version (vendor specific):       258 (0x0102)
Device State:                        SMART Off-line Data Collection executing in background (4)
Current Temperature:                    37 Celsius
Power Cycle Min/Max Temperature:     36/39 Celsius
Lifetime    Min/Max Temperature:     37/51 Celsius
Under/Over Temperature Limit Count:   0/0

SCT Temperature History Version:     2
Temperature Sampling Period:         1 minute
Temperature Logging Interval:        1 minute
Min/Max recommended Temperature:      0/60 Celsius
Min/Max Temperature Limit:           -41/85 Celsius
Temperature History Size (Index):    478 (349)

SCT Error Recovery Control command not supported

Device Statistics (GP/SMART Log 0x04) not supported

Pending Defects log (GP Log 0x0c) not supported

SATA Phy Event Counters (GP Log 0x11)
ID      Size     Value  Description
0x0001  2            0  Command failed due to ICRC error
0x0002  2            0  R_ERR response for data FIS
0x0003  2            0  R_ERR response for device-to-host data FIS
0x0004  2            0  R_ERR response for host-to-device data FIS
0x0005  2            0  R_ERR response for non-data FIS
0x0006  2            0  R_ERR response for device-to-host non-data FIS
0x0007  2            0  R_ERR response for host-to-device non-data FIS
0x000a  2            1  Device-to-host register FISes sent due to a COMRESET
0x8000  4       189163  Vendor specific

