smartctl 7.4 2023-08-01 r5530 [x86_64-linux-6.14.0-36-generic] (local build)
Copyright (C) 2002-23, Bruce Allen, Christian Franke, www.smartmontools.org

=== START OF INFORMATION SECTION ===
Model Family:     Seagate Samsung SpinPoint M9T
Device Model:     ST2000LM003 HN-M201RAD
Serial Number:    --
LU WWN Device Id: 5 0004cf ...
Firmware Version: 2BC10001
User Capacity:    2,000,398,934,016 bytes [2.00 TB]
Sector Sizes:     512 bytes logical, 4096 bytes physical
Rotation Rate:    5400 rpm
Form Factor:      2.5 inches
Device is:        In smartctl database 7.3/5528
ATA Version is:   ACS-2, ATA8-ACS T13/1699-D revision 6
SATA Version is:  SATA 3.1, 6.0 Gb/s (current: 6.0 Gb/s)
Local Time is:    Mon Dec  1 11:47:10 2025 EST
SMART support is: Available - device has SMART capability.
SMART support is: Enabled
AAM feature is:   Unavailable
APM level is:     254 (maximum performance)
Rd look-ahead is: Enabled
Write cache is:   Enabled
DSN feature is:   Unavailable
ATA Security is:  Disabled, NOT FROZEN [SEC1]
Wt Cache Reorder: Enabled

=== START OF READ SMART DATA SECTION ===
SMART overall-health self-assessment test result: PASSED

General SMART Values:
Offline data collection status:  (0x00)	Offline data collection activity
					was never started.
					Auto Offline Data Collection: Disabled.
Self-test execution status:      ( 121)	The previous self-test completed having
					the read element of the test failed.
Total time to complete Offline 
data collection: 		(22260) seconds.
Offline data collection
capabilities: 			 (0x51) SMART execute Offline immediate.
					No Auto Offline data collection support.
					Suspend Offline collection upon new
					command.
					No Offline surface scan supported.
					Self-test supported.
					No Conveyance Self-test supported.
					Selective Self-test supported.
SMART capabilities:            (0x0003)	Saves SMART data before entering
					power-saving mode.
					Supports SMART auto save timer.
Error logging capability:        (0x01)	Error logging supported.
					General Purpose Logging supported.
Short self-test routine 
recommended polling time: 	 (   2) minutes.
Extended self-test routine
recommended polling time: 	 ( 371) minutes.
SCT capabilities: 	       (0x003d)	SCT Status supported.
					SCT Error Recovery Control supported.
					SCT Feature Control supported.
					SCT Data Table supported.

SMART Attributes Data Structure revision number: 16
Vendor Specific SMART Attributes with Thresholds:
ID# ATTRIBUTE_NAME          FLAGS    VALUE WORST THRESH FAIL RAW_VALUE
  1 Raw_Read_Error_Rate     POSR-K   100   100   051    -    7155
  2 Throughput_Performance  POS--K   252   252   000    -    0
  3 Spin_Up_Time            PO---K   092   091   025    -    2690
  4 Start_Stop_Count        -O--CK   092   092   000    -    8387
  5 Reallocated_Sector_Ct   PO--CK   252   252   010    -    0
  7 Seek_Error_Rate         POSR-K   252   252   051    -    0
  8 Seek_Time_Performance   P-S--K   252   252   015    -    0
  9 Power_On_Hours          -O--CK   100   100   000    -    54288
 10 Spin_Retry_Count        PO--CK   252   252   051    -    0
 12 Power_Cycle_Count       -O--CK   092   092   000    -    8122
181 Program_Fail_Cnt_Total  -O---K   100   100   000    -    10852485
183 Runtime_Bad_Block       -O--CK   252   252   010    -    0
184 End-to-End_Error        PO--CK   252   252   097    -    0
186 Unknown_Attribute       -O--CK   252   252   000    -    0
187 Reported_Uncorrect      -O--CK   100   100   000    -    5399
188 Command_Timeout         -O--CK   252   252   000    -    0
190 Airflow_Temperature_Cel -O----   070   055   040    -    30 (Min/Max 14/45)
191 G-Sense_Error_Rate      -O---K   100   100   000    -    8606
192 Power-Off_Retract_Count -O---K   100   100   000    -    5
193 Load_Cycle_Count        -O--CK   001   001   000    -    5400830
194 Temperature_Celsius     -O----   064   055   000    -    30 (Min/Max 14/45)
195 Hardware_ECC_Recovered  -O-RCK   100   100   000    -    0
196 Reallocated_Event_Count -O--CK   252   252   000    -    0
197 Current_Pending_Sector  -O--CK   100   100   000    -    9
198 Offline_Uncorrectable   ----CK   252   252   000    -    0
199 UDMA_CRC_Error_Count    -OS-CK   200   200   000    -    0
200 Multi_Zone_Error_Rate   -O-R-K   100   100   000    -    472
241 Total_LBAs_Written      -O--CK   099   094   000    -    1840162
242 Total_LBAs_Read         -O--CK   098   094   000    -    2964260
                            ||||||_ K auto-keep
                            |||||__ C event count
                            ||||___ R error rate
                            |||____ S speed/performance
                            ||_____ O updated online
                            |______ P prefailure warning

General Purpose Log Directory Version 1
SMART           Log Directory Version 1 [multi-sector log support]
Address    Access  R/W   Size  Description
0x00       GPL,SL  R/O      1  Log Directory
0x01           SL  R/O      1  Summary SMART error log
0x02           SL  R/O      2  Comprehensive SMART error log
0x03       GPL     R/O      2  Ext. Comprehensive SMART error log
0x06           SL  R/O      1  SMART self-test log
0x07       GPL     R/O      2  Extended self-test log
0x08       GPL     R/O      2  Power Conditions log
0x09           SL  R/W      1  Selective self-test log
0x10       GPL     R/O      1  NCQ Command Error log
0x11       GPL     R/O      1  SATA Phy Event Counters log
0x80-0x9f  GPL,SL  R/W     16  Host vendor specific log
0xc0-0xdf  GPL,SL  VS      16  Device vendor specific log
0xe0       GPL,SL  R/W      1  SCT Command/Status
0xe1       GPL,SL  R/W      1  SCT Data Transfer

SMART Extended Comprehensive Error Log Version: 1 (2 sectors)
Device Error Count: 5399 (device log contains only the most recent 8 errors)
	CR     = Command Register
	FEATR  = Features Register
	COUNT  = Count (was: Sector Count) Register
	LBA_48 = Upper bytes of LBA High/Mid/Low Registers ]  ATA-8
	LH     = LBA High (was: Cylinder High) Register    ]   LBA
	LM     = LBA Mid (was: Cylinder Low) Register      ] Register
	LL     = LBA Low (was: Sector Number) Register     ]
	DV     = Device (was: Device/Head) Register
	DC     = Device Control Register
	ER     = Error register
	ST     = Status register
Powered_Up_Time is measured from power on, and printed as
DDd+hh:mm:SS.sss where DD=days, hh=hours, mm=minutes,
SS=sec, and sss=millisec. It "wraps" after 49.710 days.

Error 5399 [6] occurred at disk power-on lifetime: 54274 hours (2261 days + 10 hours)
  When the command that caused the error occurred, the device was active or idle.

  After command completion occurred, registers were:
  ER -- ST COUNT  LBA_48  LH LM LL DV DC
  -- -- -- == -- == == == -- -- -- -- --
  40 -- 41 00 08 00 00 b7 d0 08 00 40 00  Error: UNC at LBA = 0xb7d00800 = 3083864064

  Commands leading to the command that caused the error were:
  CR FEATR COUNT  LBA_48  LH LM LL DV DC  Powered_Up_Time  Command/Feature_Name
  -- == -- == -- == == == -- -- -- -- --  ---------------  --------------------
  60 00 10 00 08 00 00 b7 d0 08 00 40 08     00:00:01.524  READ FPDMA QUEUED
  60 00 10 00 08 00 00 b7 d0 08 00 40 08     00:00:01.529  READ FPDMA QUEUED
  ef 00 10 00 03 00 00 00 00 00 00 a0 08     00:00:01.529  SET FEATURES [Enable SATA feature]
  ef 00 10 00 02 00 00 00 00 00 00 a0 08     00:00:01.529  SET FEATURES [Enable SATA feature]
  ec 00 00 00 00 00 00 00 00 00 00 a0 08     00:00:01.529  IDENTIFY DEVICE

Error 5398 [5] occurred at disk power-on lifetime: 54274 hours (2261 days + 10 hours)
  When the command that caused the error occurred, the device was active or idle.

  After command completion occurred, registers were:
  ER -- ST COUNT  LBA_48  LH LM LL DV DC
  -- -- -- == -- == == == -- -- -- -- --
  40 -- 41 00 08 00 00 b7 d0 08 00 40 00  Error: UNC at LBA = 0xb7d00800 = 3083864064

  Commands leading to the command that caused the error were:
  CR FEATR COUNT  LBA_48  LH LM LL DV DC  Powered_Up_Time  Command/Feature_Name
  -- == -- == -- == == == -- -- -- -- --  ---------------  --------------------
  60 00 10 00 08 00 00 b7 d0 08 00 40 08     00:00:01.524  READ FPDMA QUEUED
  60 00 10 00 08 00 00 b7 d0 08 00 40 08     00:00:01.526  READ FPDMA QUEUED
  60 00 10 00 08 00 00 e8 d0 08 20 40 08     00:00:01.525  READ FPDMA QUEUED
  60 00 10 00 08 00 00 e8 d0 08 00 40 08     00:00:01.525  READ FPDMA QUEUED
  60 00 10 00 08 00 00 e8 90 08 00 40 08     00:00:01.525  READ FPDMA QUEUED

Error 5397 [4] occurred at disk power-on lifetime: 54274 hours (2261 days + 10 hours)
  When the command that caused the error occurred, the device was active or idle.

  After command completion occurred, registers were:
  ER -- ST COUNT  LBA_48  LH LM LL DV DC
  -- -- -- == -- == == == -- -- -- -- --
  40 -- 41 00 08 00 00 b7 d0 08 00 40 00  Error: UNC at LBA = 0xb7d00800 = 3083864064

  Commands leading to the command that caused the error were:
  CR FEATR COUNT  LBA_48  LH LM LL DV DC  Powered_Up_Time  Command/Feature_Name
  -- == -- == -- == == == -- -- -- -- --  ---------------  --------------------
  60 00 00 00 08 00 00 b7 d0 08 00 40 08     00:00:01.519  READ FPDMA QUEUED
  60 00 00 00 08 00 00 bf 50 08 00 40 08     00:00:01.520  READ FPDMA QUEUED
  60 00 00 00 08 00 00 bf 10 08 00 40 08     00:00:01.520  READ FPDMA QUEUED
  60 00 00 00 08 00 00 be d0 08 00 40 08     00:00:01.520  READ FPDMA QUEUED
  60 00 00 00 08 00 00 be 90 08 00 40 08     00:00:01.520  READ FPDMA QUEUED

Error 5396 [3] occurred at disk power-on lifetime: 54274 hours (2261 days + 10 hours)
  When the command that caused the error occurred, the device was active or idle.

  After command completion occurred, registers were:
  ER -- ST COUNT  LBA_48  LH LM LL DV DC
  -- -- -- == -- == == == -- -- -- -- --
  40 -- 41 00 08 00 00 b7 d0 08 00 40 00  Error: UNC at LBA = 0xb7d00800 = 3083864064

  Commands leading to the command that caused the error were:
  CR FEATR COUNT  LBA_48  LH LM LL DV DC  Powered_Up_Time  Command/Feature_Name
  -- == -- == -- == == == -- -- -- -- --  ---------------  --------------------
  60 00 10 00 08 00 00 b7 d0 08 00 40 08     00:00:01.391  READ FPDMA QUEUED
  60 00 10 00 08 00 00 b7 d0 08 00 40 08     00:00:01.396  READ FPDMA QUEUED
  ef 00 10 00 03 00 00 00 00 00 00 a0 08     00:00:01.396  SET FEATURES [Enable SATA feature]
  ef 00 10 00 02 00 00 00 00 00 00 a0 08     00:00:01.396  SET FEATURES [Enable SATA feature]
  ec 00 00 00 00 00 00 00 00 00 00 a0 08     00:00:01.396  IDENTIFY DEVICE

Error 5395 [2] occurred at disk power-on lifetime: 54274 hours (2261 days + 10 hours)
  When the command that caused the error occurred, the device was active or idle.

  After command completion occurred, registers were:
  ER -- ST COUNT  LBA_48  LH LM LL DV DC
  -- -- -- == -- == == == -- -- -- -- --
  40 -- 41 00 08 00 00 b7 d0 08 00 40 00  Error: UNC at LBA = 0xb7d00800 = 3083864064

  Commands leading to the command that caused the error were:
  CR FEATR COUNT  LBA_48  LH LM LL DV DC  Powered_Up_Time  Command/Feature_Name
  -- == -- == -- == == == -- -- -- -- --  ---------------  --------------------
  60 00 10 00 08 00 00 b7 d0 08 00 40 08     00:00:01.391  READ FPDMA QUEUED
  60 00 10 00 08 00 00 b7 d0 08 00 40 08     00:00:01.393  READ FPDMA QUEUED
  60 00 10 00 08 00 00 e8 d0 08 20 40 08     00:00:01.392  READ FPDMA QUEUED
  60 00 10 00 08 00 00 e8 d0 08 00 40 08     00:00:01.392  READ FPDMA QUEUED
  60 00 10 00 08 00 00 e8 90 08 00 40 08     00:00:01.392  READ FPDMA QUEUED

Error 5394 [1] occurred at disk power-on lifetime: 54274 hours (2261 days + 10 hours)
  When the command that caused the error occurred, the device was active or idle.

  After command completion occurred, registers were:
  ER -- ST COUNT  LBA_48  LH LM LL DV DC
  -- -- -- == -- == == == -- -- -- -- --
  40 -- 41 00 08 00 00 b7 d0 08 00 40 00  Error: UNC at LBA = 0xb7d00800 = 3083864064

  Commands leading to the command that caused the error were:
  CR FEATR COUNT  LBA_48  LH LM LL DV DC  Powered_Up_Time  Command/Feature_Name
  -- == -- == -- == == == -- -- -- -- --  ---------------  --------------------
  60 00 00 00 08 00 00 b7 d0 08 00 40 08     00:00:01.386  READ FPDMA QUEUED
  60 00 00 00 08 00 00 bb 50 08 00 40 08     00:00:01.387  READ FPDMA QUEUED
  60 00 00 00 08 00 00 bb 10 08 00 40 08     00:00:01.387  READ FPDMA QUEUED
  60 00 00 00 08 00 00 ba d0 08 00 40 08     00:00:01.387  READ FPDMA QUEUED
  60 00 00 00 08 00 00 ba 90 08 00 40 08     00:00:01.387  READ FPDMA QUEUED

Error 5393 [0] occurred at disk power-on lifetime: 54274 hours (2261 days + 10 hours)
  When the command that caused the error occurred, the device was active or idle.

  After command completion occurred, registers were:
  ER -- ST COUNT  LBA_48  LH LM LL DV DC
  -- -- -- == -- == == == -- -- -- -- --
  40 -- 41 00 08 00 00 b7 d0 08 00 40 00  Error: UNC at LBA = 0xb7d00800 = 3083864064

  Commands leading to the command that caused the error were:
  CR FEATR COUNT  LBA_48  LH LM LL DV DC  Powered_Up_Time  Command/Feature_Name
  -- == -- == -- == == == -- -- -- -- --  ---------------  --------------------
  60 00 00 00 08 00 00 b7 d0 08 00 40 08     00:00:00.901  READ FPDMA QUEUED
  61 00 00 00 08 00 00 ab 10 08 00 40 08     00:00:00.904  WRITE FPDMA QUEUED
  60 00 00 00 08 00 00 b7 90 08 00 40 08     00:00:00.904  READ FPDMA QUEUED
  60 00 00 00 08 00 00 b7 50 08 00 40 08     00:00:00.904  READ FPDMA QUEUED
  61 00 00 00 08 00 00 1e 91 09 00 40 08     00:00:00.904  WRITE FPDMA QUEUED

Error 5392 [7] occurred at disk power-on lifetime: 54274 hours (2261 days + 10 hours)
  When the command that caused the error occurred, the device was active or idle.

  After command completion occurred, registers were:
  ER -- ST COUNT  LBA_48  LH LM LL DV DC
  -- -- -- == -- == == == -- -- -- -- --
  40 -- 41 00 08 00 00 b7 d0 08 00 40 00  Error: UNC at LBA = 0xb7d00800 = 3083864064

  Commands leading to the command that caused the error were:
  CR FEATR COUNT  LBA_48  LH LM LL DV DC  Powered_Up_Time  Command/Feature_Name
  -- == -- == -- == == == -- -- -- -- --  ---------------  --------------------
  60 00 00 00 08 00 00 b7 d0 08 00 40 08     00:00:00.900  READ FPDMA QUEUED
  61 00 00 00 08 00 00 1e 91 09 00 40 08     00:00:00.902  WRITE FPDMA QUEUED
  61 00 00 00 08 00 00 1e 90 09 00 40 08     00:00:00.902  WRITE FPDMA QUEUED
  61 00 00 00 08 00 00 1e 90 08 80 40 08     00:00:00.902  WRITE FPDMA QUEUED
  61 00 00 00 08 00 00 1e 90 08 00 40 08     00:00:00.902  WRITE FPDMA QUEUED

SMART Extended Self-test Log Version: 1 (2 sectors)
Num  Test_Description    Status                  Remaining  LifeTime(hours)  LBA_of_first_error
# 1  Extended offline    Completed: read failure       90%     54263         9782
# 2  Short offline       Completed without error       00%      5972         -
# 3  Short offline       Completed without error       00%      1287         -
# 4  Short offline       Completed without error       00%      1097         -
# 5  Short offline       Completed without error       00%       898         -
# 6  Short offline       Completed without error       00%       608         -
# 7  Short offline       Completed without error       00%       525         -
# 8  Short offline       Completed without error       00%       169         -
# 9  Short offline       Completed without error       00%        63         -

SMART Selective self-test log data structure revision number 0
Note: revision number not 1 implies that no selective self-test has ever been run
 SPAN  MIN_LBA  MAX_LBA  CURRENT_TEST_STATUS
    1        0        0  Completed_read_failure [90% left] (0-65535)
    2        0        0  Not_testing
    3        0        0  Not_testing
    4        0        0  Not_testing
    5        0        0  Not_testing
Selective self-test flags (0x0):
  After scanning selected spans, do NOT read-scan remainder of disk.
If Selective self-test is pending on power-up, resume after 0 minute delay.

SCT Status Version:                  2
SCT Version (vendor specific):       256 (0x0100)
Device State:                        Active (0)
Current Temperature:                    30 Celsius
Power Cycle Min/Max Temperature:     29/35 Celsius
Lifetime    Min/Max Temperature:     14/46 Celsius
Specified Max Operating Temperature:    80 Celsius
Under/Over Temperature Limit Count:   0/0

SCT Temperature History Version:     2
Temperature Sampling Period:         5 minutes
Temperature Logging Interval:        5 minutes
Min/Max recommended Temperature:     -5/80 Celsius
Min/Max Temperature Limit:           -10/85 Celsius
Temperature History Size (Index):    128 (119)

SCT Error Recovery Control:
           Read:     85 (8.5 seconds)
          Write:     85 (8.5 seconds)

Device Statistics (GP/SMART Log 0x04) not supported

Pending Defects log (GP Log 0x0c) not supported

SATA Phy Event Counters (GP Log 0x11)
ID      Size     Value  Description
0x0001  4            0  Command failed due to ICRC error
0x0002  4            0  R_ERR response for data FIS
0x0003  4            0  R_ERR response for device-to-host data FIS
0x0004  4            0  R_ERR response for host-to-device data FIS
0x0005  4            0  R_ERR response for non-data FIS
0x0006  4            0  R_ERR response for device-to-host non-data FIS
0x0007  4            0  R_ERR response for host-to-device non-data FIS
0x0008  4            0  Device-to-host non-data FIS retries
0x0009  4        12643  Transition from drive PhyRdy to drive PhyNRdy
0x000a  4            7  Device-to-host register FISes sent due to a COMRESET
0x000b  4            0  CRC errors within host-to-device FIS
0x000d  4            0  Non-CRC errors within host-to-device FIS
0x000f  4            0  R_ERR response for host-to-device data FIS, CRC
0x0010  4            0  R_ERR response for host-to-device data FIS, non-CRC
0x0012  4            0  R_ERR response for host-to-device non-data FIS, CRC
0x0013  4            0  R_ERR response for host-to-device non-data FIS, non-CRC
0x8e00  4            0  Vendor specific
0x8e01  4            0  Vendor specific
0x8e02  4            0  Vendor specific
0x8e03  4            0  Vendor specific
0x8e04  4            0  Vendor specific
0x8e05  4            0  Vendor specific
0x8e06  4            0  Vendor specific
0x8e07  4            0  Vendor specific
0x8e08  4            0  Vendor specific
0x8e09  4            0  Vendor specific
0x8e0a  4            0  Vendor specific
0x8e0b  4            0  Vendor specific
0x8e0c  4            0  Vendor specific
0x8e0d  4            0  Vendor specific
0x8e0e  4            0  Vendor specific
0x8e0f  4            0  Vendor specific
0x8e10  4            0  Vendor specific
0x8e11  4            0  Vendor specific



