smartctl 7.3 2022-02-28 r5338 [x86_64-linux-5.17.5-300.fc36.x86_64] (local build)
Copyright (C) 2002-22, Bruce Allen, Christian Franke, www.smartmontools.org

=== START OF INFORMATION SECTION ===
Model Number:                       RPFTJ128PDD2EWX
Serial Number:                      --
Firmware Version:                   11.9
PCI Vendor/Subsystem ID:            0x1cc4
IEEE OUI Identifier:                0x000000
Total NVM Capacity:                 128,035,676,160 [128 GB]
Unallocated NVM Capacity:           0
Controller ID:                      0
NVMe Version:                       1.2
Number of Namespaces:               1
Namespace 1 Size/Capacity:          128,035,676,160 [128 GB]
Namespace 1 Formatted LBA Size:     512
Local Time is:                      Sat Aug 20 13:08:20 2022 IST
Firmware Updates (0x12):            1 Slot, no Reset required
Optional Admin Commands (0x0007):   Security Format Frmw_DL
Optional NVM Commands (0x001e):     Wr_Unc DS_Mngmt Wr_Zero Sav/Sel_Feat
Log Page Attributes (0x04):         Ext_Get_Lg
Maximum Data Transfer Size:         512 Pages
Warning  Comp. Temp. Threshold:     90 Celsius
Critical Comp. Temp. Threshold:     94 Celsius

Supported Power States
St Op     Max   Active     Idle   RL RT WL WT  Ent_Lat  Ex_Lat
 0 +     3.00W       -        -    0  0  0  0        0       0
 1 +     2.00W       -        -    1  1  1  1        0       0
 2 +     2.00W       -        -    2  2  2  2        0       0
 3 -   0.1000W       -        -    3  3  3  3     1000    1000
 4 -   0.0050W       -        -    4  4  4  4     1000    5000

Supported LBA Sizes (NSID 0x1)
Id Fmt  Data  Metadt  Rel_Perf
 0 +     512       0         1
 1 -    4096       0         0

=== START OF SMART DATA SECTION ===
SMART overall-health self-assessment test result: PASSED

SMART/Health Information (NVMe Log 0x02)
Critical Warning:                   0x00
Temperature:                        45 Celsius
Available Spare:                    100%
Available Spare Threshold:          50%
Percentage Used:                    38%
Data Units Read:                    102,527,204 [52.4 TB]
Data Units Written:                 58,588,122 [29.9 TB]
Host Read Commands:                 1,496,934,013
Host Write Commands:                630,012,350
Controller Busy Time:               1,438
Power Cycles:                       5,572
Power On Hours:                     1,328
Unsafe Shutdowns:                   561
Media and Data Integrity Errors:    0
Error Information Log Entries:      1,907
Warning  Comp. Temperature Time:    0
Critical Comp. Temperature Time:    0
Temperature Sensor 2:               45 Celsius

Error Information (NVMe Log 0x01, 16 of 16 entries)
Num   ErrCount  SQId   CmdId  Status  PELoc          LBA  NSID    VS
  0       1907     0  0x001d  0x0005      -            6     0     -
  1       1906     0  0x000d  0x0005      -            6     0     -
  2       1905     0  0x0011  0x0005      -            6     0     -
  3       1904     0  0x5011  0x0005      -            6     0     -
  4       1903     0  0x0015  0x0005      -            6     0     -
  5       1902     0  0x000c  0x0005      -            6     0     -
  6       1901     0  0x0008  0x0005      -            6     0     -
  7       1899     0  0x101a  0x0005      -            6     0     -
  8       1897     0  0x0008  0x0005      -            6     0     -
  9       1896     0  0x2008  0x0005      -            6     0     -
 10       1894     0  0x0014  0x0005      -            6     0     -
 11       1893     0  0x0015  0x0005      -            6     0     -
 12       1884     0  0x1005  0x0005      -            6     0     -
 13       1879     0  0x5009  0x0005      -            6     0     -
 14       1850     0  0x0004  0x0005      -            6     0     -
 15       1844     0  0x0004  0x0005      -            6     0     -



