smartctl 7.3 2022-02-28 r5338 [x86_64-linux-6.4.0-4-amd64] (local build)
Copyright (C) 2002-22, Bruce Allen, Christian Franke, www.smartmontools.org

=== START OF INFORMATION SECTION ===
Model Number:                       SAMSUNG MZVLB512HAJQ-000H1
Serial Number:                      --
Firmware Version:                   EXA73H1Q
PCI Vendor/Subsystem ID:            0x144d
IEEE OUI Identifier:                0x002538
Total NVM Capacity:                 512,110,190,592 [512 GB]
Unallocated NVM Capacity:           0
Controller ID:                      4
NVMe Version:                       1.2
Number of Namespaces:               1
Namespace 1 Size/Capacity:          512,110,190,592 [512 GB]
Namespace 1 Utilization:            314,371,276,800 [314 GB]
Namespace 1 Formatted LBA Size:     512
Namespace 1 IEEE EUI-64:            002538 ...
Local Time is:                      Fri Sep  8 15:43:16 2023 CEST
Firmware Updates (0x16):            3 Slots, no Reset required
Optional Admin Commands (0x0017):   Security Format Frmw_DL Self_Test
Optional NVM Commands (0x001f):     Comp Wr_Unc DS_Mngmt Wr_Zero Sav/Sel_Feat
Log Page Attributes (0x03):         S/H_per_NS Cmd_Eff_Lg
Maximum Data Transfer Size:         512 Pages
Warning  Comp. Temp. Threshold:     81 Celsius
Critical Comp. Temp. Threshold:     82 Celsius

Supported Power States
St Op     Max   Active     Idle   RL RT WL WT  Ent_Lat  Ex_Lat
 0 +     7.02W       -        -    0  0  0  0        0       0
 1 +     6.30W       -        -    1  1  1  1        0       0
 2 +     3.50W       -        -    2  2  2  2        0       0
 3 -   0.0760W       -        -    3  3  3  3      210    1200
 4 -   0.0050W       -        -    4  4  4  4     2000    8000

Supported LBA Sizes (NSID 0x1)
Id Fmt  Data  Metadt  Rel_Perf
 0 +     512       0         0
 1 -    4096       0         0

=== START OF SMART DATA SECTION ===
SMART overall-health self-assessment test result: PASSED

SMART/Health Information (NVMe Log 0x02)
Critical Warning:                   0x00
Temperature:                        36 Celsius
Available Spare:                    100%
Available Spare Threshold:          5%
Percentage Used:                    2%
Data Units Read:                    15,382,483 [7.87 TB]
Data Units Written:                 32,041,538 [16.4 TB]
Host Read Commands:                 497,459,933
Host Write Commands:                592,400,567
Controller Busy Time:               2,437
Power Cycles:                       335
Power On Hours:                     3,328
Unsafe Shutdowns:                   93
Media and Data Integrity Errors:    0
Error Information Log Entries:      3,797
Warning  Comp. Temperature Time:    0
Critical Comp. Temperature Time:    0
Temperature Sensor 1:               36 Celsius
Temperature Sensor 2:               38 Celsius

Error Information (NVMe Log 0x01, 16 of 256 entries)
Num   ErrCount  SQId   CmdId  Status  PELoc          LBA  NSID    VS
  0       3797     0  0x001a  0x4004      -            0     1     -
  1       3796     0  0x100b  0x4004      -            0     1     -
  2       3795     0  0x1009  0x4004      -            0     1     -
  3       3794     0  0x000b  0x4004      -            0     1     -
  4       3793     0  0x0009  0x4004      -            0     1     -
  5       3792     0  0x1017  0x4004      -            0     1     -
  6       3791     0  0x1015  0x4004      -            0     1     -
  7       3790     0  0x0017  0x4004      -            0     1     -
  8       3789     0  0x0015  0x4004      -            0     1     -
  9       3788     0  0x1001  0x4004      -            0     1     -
 10       3787     0  0x0003  0x4004      -            0     1     -
 11       3786     0  0x0001  0x4004      -            0     1     -
 12       3785     0  0x9013  0x4004      -            0     1     -
 13       3784     0  0x600c  0x4004      -            0     1     -
 14       3783     0  0x400f  0x4004      -            0     1     -
 15       3782     0  0x400d  0x4004      -            0     1     -
... (240 entries not read)

