smartctl 7.3 2022-02-28 r5338 [x86_64-linux-6.1.6-arch1-3] (local build)
Copyright (C) 2002-22, Bruce Allen, Christian Franke, www.smartmontools.org

=== START OF INFORMATION SECTION ===
Model Number:                       Force MP500
Serial Number:                      --
Firmware Version:                   E7FM02.1
PCI Vendor/Subsystem ID:            0x1987
IEEE OUI Identifier:                0x6479a7
Controller ID:                      0
NVMe Version:                       1.2
Number of Namespaces:               1
Namespace 1 Size/Capacity:          240,057,409,536 [240 GB]
Namespace 1 Formatted LBA Size:     512
Local Time is:                      Thu Jan 19 06:42:28 2023 IST
Firmware Updates (0x02):            1 Slot
Optional Admin Commands (0x0007):   Security Format Frmw_DL
Optional NVM Commands (0x001e):     Wr_Unc DS_Mngmt Wr_Zero Sav/Sel_Feat
Log Page Attributes (0x03):         S/H_per_NS Cmd_Eff_Lg
Maximum Data Transfer Size:         512 Pages
Warning  Comp. Temp. Threshold:     110 Celsius
Critical Comp. Temp. Threshold:     130 Celsius

Supported Power States
St Op     Max   Active     Idle   RL RT WL WT  Ent_Lat  Ex_Lat
 0 +     7.90W       -        -    0  0  0  0        0       0
 1 +     2.40W       -        -    1  1  1  1      600     600
 2 +     1.90W       -        -    2  2  2  2      600     600
 3 -   0.1100W       -        -    3  3  3  3      600     600
 4 -   0.0050W       -        -    4  4  4  4   100000  160000

Supported LBA Sizes (NSID 0x1)
Id Fmt  Data  Metadt  Rel_Perf
 0 +     512       0         1

=== START OF SMART DATA SECTION ===
SMART overall-health self-assessment test result: PASSED

SMART/Health Information (NVMe Log 0x02)
Critical Warning:                   0x00
Temperature:                        63 Celsius
Available Spare:                    99%
Available Spare Threshold:          0%
Percentage Used:                    59%
Data Units Read:                    91,530,104 [46.8 TB]
Data Units Written:                 445,109,196 [227 TB]
Host Read Commands:                 2,441,754,520
Host Write Commands:                7,108,294,766
Controller Busy Time:               0
Power Cycles:                       579
Power On Hours:                     42,345
Unsafe Shutdowns:                   117
Media and Data Integrity Errors:    0
Error Information Log Entries:      26,173
Warning  Comp. Temperature Time:    0
Critical Comp. Temperature Time:    0
Temperature Sensor 2:               89 Celsius

Error Information (NVMe Log 0x01, 16 of 64 entries)
Num   ErrCount  SQId   CmdId  Status  PELoc          LBA  NSID    VS
  0      26173     0  0x5000  0x4004      -            6     1     -
  1      26172     0  0x0001  0x4016      -     67043333     1     -
  2      26171     0  0x0015  0x4004      -            6     1     -
  3      26170     0  0x0004  0x4016      -     67043333     1     -
  4      26169     0  0x400b  0x4004      -            6     1     -
  5      26168     0  0x0009  0x4016      -     67043333     1     -
  6      26167     0  0x000c  0x4004      -            6     1     -
  7      26166     0  0x0009  0x4016      -     67043333     1     -
  8      26165     0  0x4017  0x4004      -            6     1     -
  9      26164     0  0x0008  0x4016      -     67043333     1     -
 10      26163     0  0x0014  0x4004      -            6     1     -
 11      26162     0  0x0011  0x4016      -     67043333     1     -
 12      26161     0  0x0010  0x4004      -            6     1     -
 13      26160     0  0x0009  0x4016      -     67043333     1     -
 14      26159     0  0x0014  0x4004      -            6     1     -
 15      26158     0  0x0009  0x4016      -     67043333     1     -
... (48 entries not read)



