smartctl 7.3 2022-02-28 r5338 [x86_64-linux-6.1.1-desktop-1omv2290] (OpenMandriva Lx 7.3-2)
Copyright (C) 2002-22, Bruce Allen, Christian Franke, www.smartmontools.org

=== START OF INFORMATION SECTION ===
Model Family:     Seagate Barracuda 7200.12
Device Model:     ST3500418AS
Serial Number:    --
LU WWN Device Id: 5 000c50 ...
Firmware Version: CC38
User Capacity:    500,103,634,432 bytes [500 GB]
Sector Size:      512 bytes logical/physical
Rotation Rate:    7200 rpm
Device is:        In smartctl database
ATA Version is:   ATA8-ACS T13/1699-D revision 4
SATA Version is:  SATA 2.6, 3.0 Gb/s
Local Time is:    Tue Feb 28 15:18:59 2023 EST

==> WARNING: A firmware update for this drive may be available,
see the following Seagate web pages:
http://knowledge.seagate.com/articles/en_US/FAQ/207931en
http://knowledge.seagate.com/articles/en_US/FAQ/213891en

SMART support is: Available - device has SMART capability.
SMART support is: Enabled
AAM feature is:   Disabled
APM feature is:   Unavailable
Rd look-ahead is: Enabled
Write cache is:   Enabled
DSN feature is:   Unavailable
ATA Security is:  Disabled, NOT FROZEN [SEC1]
Wt Cache Reorder: Unknown

=== START OF READ SMART DATA SECTION ===
SMART overall-health self-assessment test result: PASSED

General SMART Values:
Offline data collection status:  (0x82)	Offline data collection activity
					was completed without error.
					Auto Offline Data Collection: Enabled.
Self-test execution status:      (   0)	The previous self-test routine completed
					without error or no self-test has ever 
					been run.
Total time to complete Offline 
data collection: 		(  600) seconds.
Offline data collection
capabilities: 			 (0x7b) SMART execute Offline immediate.
					Auto Offline data collection on/off support.
					Suspend Offline collection upon new
					command.
					Offline surface scan supported.
					Self-test supported.
					Conveyance Self-test supported.
					Selective Self-test supported.
SMART capabilities:            (0x0003)	Saves SMART data before entering
					power-saving mode.
					Supports SMART auto save timer.
Error logging capability:        (0x01)	Error logging supported.
					General Purpose Logging supported.
Short self-test routine 
recommended polling time: 	 (   1) minutes.
Extended self-test routine
recommended polling time: 	 (  85) minutes.
Conveyance self-test routine
recommended polling time: 	 (   2) minutes.
SCT capabilities: 	       (0x103f)	SCT Status supported.
					SCT Error Recovery Control supported.
					SCT Feature Control supported.
					SCT Data Table supported.

SMART Attributes Data Structure revision number: 10
Vendor Specific SMART Attributes with Thresholds:
ID# ATTRIBUTE_NAME          FLAGS    VALUE WORST THRESH FAIL RAW_VALUE
  1 Raw_Read_Error_Rate     POSR--   118   099   006    -    196833909
  3 Spin_Up_Time            PO----   097   097   000    -    0
  4 Start_Stop_Count        -O--CK   080   080   020    -    21007
  5 Reallocated_Sector_Ct   PO--CK   100   100   036    -    0
  7 Seek_Error_Rate         POSR--   075   060   030    -    32461144
  9 Power_On_Hours          -O--CK   089   089   000    -    10375
 10 Spin_Retry_Count        PO--C-   100   100   097    -    0
 12 Power_Cycle_Count       -O--CK   091   091   020    -    9614
183 Runtime_Bad_Block       -O--CK   100   100   000    -    0
184 End-to-End_Error        -O--CK   100   100   099    -    0
187 Reported_Uncorrect      -O--CK   025   025   000    -    75
188 Command_Timeout         -O--CK   100   099   000    -    35
189 High_Fly_Writes         -O-RCK   100   100   000    -    0
190 Airflow_Temperature_Cel -O---K   070   050   045    -    30 (Min/Max 24/30)
194 Temperature_Celsius     -O---K   030   050   000    -    30 (0 15 0 0 0)
195 Hardware_ECC_Recovered  -O-RC-   028   015   000    -    196833909
197 Current_Pending_Sector  -O--C-   100   100   000    -    0
198 Offline_Uncorrectable   ----C-   100   100   000    -    0
199 UDMA_CRC_Error_Count    -OSRCK   200   200   000    -    5
240 Head_Flying_Hours       ------   100   253   000    -    35980 (226 178 0)
241 Total_LBAs_Written      ------   100   253   000    -    3820500954
242 Total_LBAs_Read         ------   100   253   000    -    1052427466
                            ||||||_ K auto-keep
                            |||||__ C event count
                            ||||___ R error rate
                            |||____ S speed/performance
                            ||_____ O updated online
                            |______ P prefailure warning

General Purpose Log Directory Version 1
SMART           Log Directory Version 1 [multi-sector log support]
Address    Access  R/W   Size  Description
0x00       GPL,SL  R/O      1  Log Directory
0x01       GPL,SL  R/O      1  Summary SMART error log
0x02       GPL,SL  R/O      5  Comprehensive SMART error log
0x03       GPL     R/O      5  Ext. Comprehensive SMART error log
0x06       GPL,SL  R/O      1  SMART self-test log
0x07       GPL     R/O      1  Extended self-test log
0x09       GPL,SL  R/W      1  Selective self-test log
0x10       GPL     R/O      1  NCQ Command Error log
0x11       GPL     R/O      1  SATA Phy Event Counters log
0x21       GPL     R/O      1  Write stream error log
0x22       GPL     R/O      1  Read stream error log
0x80-0x9f  GPL,SL  R/W     16  Host vendor specific log
0xa1       GPL,SL  VS      20  Device vendor specific log
0xa2       GPL     VS    2248  Device vendor specific log
0xa8       GPL,SL  VS     129  Device vendor specific log
0xa9       GPL,SL  VS       1  Device vendor specific log
0xb0       GPL     VS    2928  Device vendor specific log
0xbd       GPL     VS     252  Device vendor specific log
0xbe-0xbf  GPL     VS   65535  Device vendor specific log
0xc0       GPL,SL  VS       1  Device vendor specific log
0xe0       GPL,SL  R/W      1  SCT Command/Status
0xe1       GPL,SL  R/W      1  SCT Data Transfer

SMART Extended Comprehensive Error Log Version: 1 (5 sectors)
Device Error Count: 82 (device log contains only the most recent 20 errors)
	CR     = Command Register
	FEATR  = Features Register
	COUNT  = Count (was: Sector Count) Register
	LBA_48 = Upper bytes of LBA High/Mid/Low Registers ]  ATA-8
	LH     = LBA High (was: Cylinder High) Register    ]   LBA
	LM     = LBA Mid (was: Cylinder Low) Register      ] Register
	LL     = LBA Low (was: Sector Number) Register     ]
	DV     = Device (was: Device/Head) Register
	DC     = Device Control Register
	ER     = Error register
	ST     = Status register
Powered_Up_Time is measured from power on, and printed as
DDd+hh:mm:SS.sss where DD=days, hh=hours, mm=minutes,
SS=sec, and sss=millisec. It "wraps" after 49.710 days.

Error 82 [1] occurred at disk power-on lifetime: 100 hours (4 days + 4 hours)
  When the command that caused the error occurred, the device was active or idle.

  After command completion occurred, registers were:
  ER -- ST COUNT  LBA_48  LH LM LL DV DC
  -- -- -- == -- == == == -- -- -- -- --
  40 -- 51 00 00 00 13 d5 00 b2 e9 00 00  Error: UNC at LBA = 0x13d500b2e9 = 85177971433

  Commands leading to the command that caused the error were:
  CR FEATR COUNT  LBA_48  LH LM LL DV DC  Powered_Up_Time  Command/Feature_Name
  -- == -- == -- == == == -- -- -- -- --  ---------------  --------------------
  60 00 00 00 d8 00 13 d5 00 b2 7d 40 00     00:01:03.817  READ FPDMA QUEUED
  27 00 00 00 00 00 00 00 00 00 00 e0 00     00:01:03.816  READ NATIVE MAX ADDRESS EXT [OBS-ACS-3]
  ec 00 00 00 00 00 00 00 00 00 00 a0 00     00:01:03.808  IDENTIFY DEVICE
  ef 00 03 00 46 00 00 00 00 00 00 a0 00     00:01:03.808  SET FEATURES [Set transfer mode]
  27 00 00 00 00 00 00 00 00 00 00 e0 00     00:01:03.807  READ NATIVE MAX ADDRESS EXT [OBS-ACS-3]

Error 81 [0] occurred at disk power-on lifetime: 100 hours (4 days + 4 hours)
  When the command that caused the error occurred, the device was active or idle.

  After command completion occurred, registers were:
  ER -- ST COUNT  LBA_48  LH LM LL DV DC
  -- -- -- == -- == == == -- -- -- -- --
  40 -- 51 00 00 00 13 d5 00 b2 e9 00 00  Error: UNC at LBA = 0x13d500b2e9 = 85177971433

  Commands leading to the command that caused the error were:
  CR FEATR COUNT  LBA_48  LH LM LL DV DC  Powered_Up_Time  Command/Feature_Name
  -- == -- == -- == == == -- -- -- -- --  ---------------  --------------------
  60 00 00 00 d8 00 13 d5 00 b2 7d 40 00     00:01:00.681  READ FPDMA QUEUED
  27 00 00 00 00 00 00 00 00 00 00 e0 00     00:01:00.681  READ NATIVE MAX ADDRESS EXT [OBS-ACS-3]
  ec 00 00 00 00 00 00 00 00 00 00 a0 00     00:01:00.672  IDENTIFY DEVICE
  ef 00 03 00 46 00 00 00 00 00 00 a0 00     00:01:00.672  SET FEATURES [Set transfer mode]
  27 00 00 00 00 00 00 00 00 00 00 e0 00     00:01:00.672  READ NATIVE MAX ADDRESS EXT [OBS-ACS-3]

Error 80 [19] occurred at disk power-on lifetime: 100 hours (4 days + 4 hours)
  When the command that caused the error occurred, the device was active or idle.

  After command completion occurred, registers were:
  ER -- ST COUNT  LBA_48  LH LM LL DV DC
  -- -- -- == -- == == == -- -- -- -- --
  40 -- 51 00 00 00 13 d5 00 b2 e9 00 00  Error: UNC at LBA = 0x13d500b2e9 = 85177971433

  Commands leading to the command that caused the error were:
  CR FEATR COUNT  LBA_48  LH LM LL DV DC  Powered_Up_Time  Command/Feature_Name
  -- == -- == -- == == == -- -- -- -- --  ---------------  --------------------
  60 00 00 00 d8 00 13 d5 00 b2 7d 40 00     00:00:57.589  READ FPDMA QUEUED
  27 00 00 00 00 00 00 00 00 00 00 e0 00     00:00:57.589  READ NATIVE MAX ADDRESS EXT [OBS-ACS-3]
  ec 00 00 00 00 00 00 00 00 00 00 a0 00     00:00:57.580  IDENTIFY DEVICE
  ef 00 03 00 46 00 00 00 00 00 00 a0 00     00:00:57.580  SET FEATURES [Set transfer mode]
  27 00 00 00 00 00 00 00 00 00 00 e0 00     00:00:57.580  READ NATIVE MAX ADDRESS EXT [OBS-ACS-3]

Error 79 [18] occurred at disk power-on lifetime: 100 hours (4 days + 4 hours)
  When the command that caused the error occurred, the device was active or idle.

  After command completion occurred, registers were:
  ER -- ST COUNT  LBA_48  LH LM LL DV DC
  -- -- -- == -- == == == -- -- -- -- --
  40 -- 51 00 00 00 13 d5 00 b2 e9 00 00  Error: UNC at LBA = 0x13d500b2e9 = 85177971433

  Commands leading to the command that caused the error were:
  CR FEATR COUNT  LBA_48  LH LM LL DV DC  Powered_Up_Time  Command/Feature_Name
  -- == -- == -- == == == -- -- -- -- --  ---------------  --------------------
  60 00 00 00 d8 00 13 d5 00 b2 7d 40 00     00:00:54.471  READ FPDMA QUEUED
  27 00 00 00 00 00 00 00 00 00 00 e0 00     00:00:54.470  READ NATIVE MAX ADDRESS EXT [OBS-ACS-3]
  ec 00 00 00 00 00 00 00 00 00 00 a0 00     00:00:54.470  IDENTIFY DEVICE
  ef 00 03 00 46 00 00 00 00 00 00 a0 00     00:00:54.469  SET FEATURES [Set transfer mode]
  27 00 00 00 00 00 00 00 00 00 00 e0 00     00:00:54.469  READ NATIVE MAX ADDRESS EXT [OBS-ACS-3]

Error 78 [17] occurred at disk power-on lifetime: 100 hours (4 days + 4 hours)
  When the command that caused the error occurred, the device was active or idle.

  After command completion occurred, registers were:
  ER -- ST COUNT  LBA_48  LH LM LL DV DC
  -- -- -- == -- == == == -- -- -- -- --
  40 -- 51 00 00 00 13 d5 00 b2 e9 00 00  Error: UNC at LBA = 0x13d500b2e9 = 85177971433

  Commands leading to the command that caused the error were:
  CR FEATR COUNT  LBA_48  LH LM LL DV DC  Powered_Up_Time  Command/Feature_Name
  -- == -- == -- == == == -- -- -- -- --  ---------------  --------------------
  60 00 00 00 d8 00 13 d5 00 b2 7d 40 00     00:00:51.395  READ FPDMA QUEUED
  27 00 00 00 00 00 00 00 00 00 00 e0 00     00:00:51.395  READ NATIVE MAX ADDRESS EXT [OBS-ACS-3]
  ec 00 00 00 00 00 00 00 00 00 00 a0 00     00:00:51.394  IDENTIFY DEVICE
  ef 00 03 00 46 00 00 00 00 00 00 a0 00     00:00:51.394  SET FEATURES [Set transfer mode]
  27 00 00 00 00 00 00 00 00 00 00 e0 00     00:00:51.394  READ NATIVE MAX ADDRESS EXT [OBS-ACS-3]

Error 77 [16] occurred at disk power-on lifetime: 100 hours (4 days + 4 hours)
  When the command that caused the error occurred, the device was active or idle.

  After command completion occurred, registers were:
  ER -- ST COUNT  LBA_48  LH LM LL DV DC
  -- -- -- == -- == == == -- -- -- -- --
  40 -- 51 00 00 00 13 d5 00 b2 e9 00 00  Error: UNC at LBA = 0x13d500b2e9 = 85177971433

  Commands leading to the command that caused the error were:
  CR FEATR COUNT  LBA_48  LH LM LL DV DC  Powered_Up_Time  Command/Feature_Name
  -- == -- == -- == == == -- -- -- -- --  ---------------  --------------------
  60 00 00 00 08 00 13 0b 00 b2 7d 40 00     00:00:48.072  READ FPDMA QUEUED
  60 00 00 00 f8 00 13 0a 00 b2 85 40 00     00:00:48.072  READ FPDMA QUEUED
  60 00 00 00 08 00 13 b0 00 b1 2d 40 00     00:00:47.980  READ FPDMA QUEUED
  60 00 00 00 f8 00 13 af 00 b1 35 40 00     00:00:47.978  READ FPDMA QUEUED
  60 00 00 00 08 00 13 4f 00 b1 a5 40 00     00:00:47.876  READ FPDMA QUEUED

Error 76 [15] occurred at disk power-on lifetime: 100 hours (4 days + 4 hours)
  When the command that caused the error occurred, the device was active or idle.

  After command completion occurred, registers were:
  ER -- ST COUNT  LBA_48  LH LM LL DV DC
  -- -- -- == -- == == == -- -- -- -- --
  40 -- 51 00 00 00 13 d5 00 b2 e9 00 00  Error: UNC at LBA = 0x13d500b2e9 = 85177971433

  Commands leading to the command that caused the error were:
  CR FEATR COUNT  LBA_48  LH LM LL DV DC  Powered_Up_Time  Command/Feature_Name
  -- == -- == -- == == == -- -- -- -- --  ---------------  --------------------
  60 00 00 00 d0 00 13 d5 00 b2 85 40 00     00:03:33.753  READ FPDMA QUEUED
  27 00 00 00 00 00 00 00 00 00 00 e0 00     00:03:33.752  READ NATIVE MAX ADDRESS EXT [OBS-ACS-3]
  ec 00 00 00 00 00 00 00 00 00 00 a0 00     00:03:33.744  IDENTIFY DEVICE
  ef 00 03 00 46 00 00 00 00 00 00 a0 00     00:03:33.743  SET FEATURES [Set transfer mode]
  27 00 00 00 00 00 00 00 00 00 00 e0 00     00:03:33.743  READ NATIVE MAX ADDRESS EXT [OBS-ACS-3]

Error 75 [14] occurred at disk power-on lifetime: 100 hours (4 days + 4 hours)
  When the command that caused the error occurred, the device was active or idle.

  After command completion occurred, registers were:
  ER -- ST COUNT  LBA_48  LH LM LL DV DC
  -- -- -- == -- == == == -- -- -- -- --
  40 -- 51 00 00 00 13 d5 00 b2 e9 00 00  Error: UNC at LBA = 0x13d500b2e9 = 85177971433

  Commands leading to the command that caused the error were:
  CR FEATR COUNT  LBA_48  LH LM LL DV DC  Powered_Up_Time  Command/Feature_Name
  -- == -- == -- == == == -- -- -- -- --  ---------------  --------------------
  60 00 00 00 d0 00 13 d5 00 b2 85 40 00     00:03:30.651  READ FPDMA QUEUED
  27 00 00 00 00 00 00 00 00 00 00 e0 00     00:03:30.650  READ NATIVE MAX ADDRESS EXT [OBS-ACS-3]
  ec 00 00 00 00 00 00 00 00 00 00 a0 00     00:03:30.642  IDENTIFY DEVICE
  ef 00 03 00 46 00 00 00 00 00 00 a0 00     00:03:30.641  SET FEATURES [Set transfer mode]
  27 00 00 00 00 00 00 00 00 00 00 e0 00     00:03:30.641  READ NATIVE MAX ADDRESS EXT [OBS-ACS-3]

SMART Extended Self-test Log Version: 1 (1 sectors)
Num  Test_Description    Status                  Remaining  LifeTime(hours)  LBA_of_first_error
# 1  Extended offline    Completed without error       00%     10365         -
# 2  Short offline       Completed without error       00%     10275         -
# 3  Extended offline    Completed without error       00%     10247         -
# 4  Extended offline    Interrupted (host reset)      00%     10207         -
# 5  Extended offline    Interrupted (host reset)      10%     10151         -
# 6  Short offline       Completed without error       00%     10090         -
# 7  Short offline       Completed without error       00%     10075         -
# 8  Short offline       Completed without error       00%     10053         -
# 9  Extended offline    Completed without error       00%     10040         -
#10  Short offline       Completed without error       00%      9988         -
#11  Short offline       Completed without error       00%      9977         -
#12  Extended offline    Interrupted (host reset)      90%      9974         -
#13  Short offline       Completed without error       00%      9941         -
#14  Short offline       Completed without error       00%      9928         -
#15  Short offline       Interrupted (host reset)      00%      9925         -
#16  Short offline       Completed without error       00%      9903         -
#17  Short offline       Completed without error       00%      9862         -
#18  Extended offline    Interrupted (host reset)      90%      9854         -
#19  Extended offline    Interrupted (host reset)      70%      9849         -

SMART Selective self-test log data structure revision number 1
 SPAN  MIN_LBA  MAX_LBA  CURRENT_TEST_STATUS
    1        0        0  Not_testing
    2        0        0  Not_testing
    3        0        0  Not_testing
    4        0        0  Not_testing
    5        0        0  Not_testing
Selective self-test flags (0x0):
  After scanning selected spans, do NOT read-scan remainder of disk.
If Selective self-test is pending on power-up, resume after 0 minute delay.

SCT Status Version:                  3
SCT Version (vendor specific):       522 (0x020a)
Device State:                        Active (0)
Current Temperature:                    29 Celsius
Power Cycle Min/Max Temperature:     24/29 Celsius
Lifetime    Min/Max Temperature:     15/50 Celsius
Under/Over Temperature Limit Count:   0/0

SCT Temperature History Version:     2
Temperature Sampling Period:         1 minute
Temperature Logging Interval:        59 minutes
Min/Max recommended Temperature:     14/55 Celsius
Min/Max Temperature Limit:           10/60 Celsius
Temperature History Size (Index):    128 (101)

SCT Error Recovery Control:
           Read: Disabled
          Write: Disabled

Device Statistics (GP/SMART Log 0x04) not supported

Pending Defects log (GP Log 0x0c) not supported

SATA Phy Event Counters (GP Log 0x11)
ID      Size     Value  Description
0x000a  2            3  Device-to-host register FISes sent due to a COMRESET
0x0001  2            0  Command failed due to ICRC error
0x0003  2            0  R_ERR response for device-to-host data FIS
0x0004  2            0  R_ERR response for host-to-device data FIS
0x0006  2            0  R_ERR response for device-to-host non-data FIS
0x0007  2            0  R_ERR response for host-to-device non-data FIS

