smartctl 7.3 2022-02-28 r5338 [x86_64-linux-6.1.0-26-amd64] (local build)
Copyright (C) 2002-22, Bruce Allen, Christian Franke, www.smartmontools.org

=== START OF INFORMATION SECTION ===
Model Family:     Seagate Barracuda 7200.12
Device Model:     ST3500418AS
Serial Number:    --
LU WWN Device Id: 5 000c50 ...
Firmware Version: CC38
User Capacity:    500,107,862,016 bytes [500 GB]
Sector Size:      512 bytes logical/physical
Rotation Rate:    7200 rpm
Device is:        In smartctl database 7.3/5319
ATA Version is:   ATA8-ACS T13/1699-D revision 4
SATA Version is:  SATA 2.6, 3.0 Gb/s
Local Time is:    Sat Nov  9 20:42:21 2024 AEST

==> WARNING: A firmware update for this drive may be available,
see the following Seagate web pages:
http://knowledge.seagate.com/articles/en_US/FAQ/207931en
http://knowledge.seagate.com/articles/en_US/FAQ/213891en

SMART support is: Available - device has SMART capability.
SMART support is: Enabled
AAM level is:     254 (maximum performance), recommended: 254
APM feature is:   Unavailable
Rd look-ahead is: Enabled
Write cache is:   Enabled
DSN feature is:   Unavailable
ATA Security is:  Disabled, NOT FROZEN [SEC1]
Wt Cache Reorder: Unknown

=== START OF READ SMART DATA SECTION ===
SMART overall-health self-assessment test result: PASSED

General SMART Values:
Offline data collection status:  (0x82)	Offline data collection activity
					was completed without error.
					Auto Offline Data Collection: Enabled.
Self-test execution status:      (   0)	The previous self-test routine completed
					without error or no self-test has ever 
					been run.
Total time to complete Offline 
data collection: 		(  600) seconds.
Offline data collection
capabilities: 			 (0x7b) SMART execute Offline immediate.
					Auto Offline data collection on/off support.
					Suspend Offline collection upon new
					command.
					Offline surface scan supported.
					Self-test supported.
					Conveyance Self-test supported.
					Selective Self-test supported.
SMART capabilities:            (0x0003)	Saves SMART data before entering
					power-saving mode.
					Supports SMART auto save timer.
Error logging capability:        (0x01)	Error logging supported.
					General Purpose Logging supported.
Short self-test routine 
recommended polling time: 	 (   1) minutes.
Extended self-test routine
recommended polling time: 	 (  85) minutes.
Conveyance self-test routine
recommended polling time: 	 (   2) minutes.
SCT capabilities: 	       (0x103f)	SCT Status supported.
					SCT Error Recovery Control supported.
					SCT Feature Control supported.
					SCT Data Table supported.

SMART Attributes Data Structure revision number: 10
Vendor Specific SMART Attributes with Thresholds:
ID# ATTRIBUTE_NAME          FLAGS    VALUE WORST THRESH FAIL RAW_VALUE
  1 Raw_Read_Error_Rate     POSR--   117   072   006    -    135934833
  3 Spin_Up_Time            PO----   097   097   000    -    0
  4 Start_Stop_Count        -O--CK   098   098   020    -    2430
  5 Reallocated_Sector_Ct   PO--CK   094   094   036    -    266
  7 Seek_Error_Rate         POSR--   083   060   030    -    221323185
  9 Power_On_Hours          -O--CK   088   088   000    -    10891
 10 Spin_Retry_Count        PO--C-   100   100   097    -    0
 12 Power_Cycle_Count       -O--CK   099   099   020    -    1224
183 Runtime_Bad_Block       -O--CK   100   100   000    -    0
184 End-to-End_Error        -O--CK   100   100   099    -    0
187 Reported_Uncorrect      -O--CK   001   001   000    -    65535
188 Command_Timeout         -O--CK   100   099   000    -    8590065693
189 High_Fly_Writes         -O-RCK   100   100   000    -    0
190 Airflow_Temperature_Cel -O---K   064   053   045    -    36 (Min/Max 29/36)
194 Temperature_Celsius     -O---K   036   047   000    -    36 (0 16 0 0 0)
195 Hardware_ECC_Recovered  -O-RC-   039   022   000    -    135934833
197 Current_Pending_Sector  -O--C-   100   097   000    -    0
198 Offline_Uncorrectable   ----C-   100   097   000    -    0
199 UDMA_CRC_Error_Count    -OSRCK   200   200   000    -    0
240 Head_Flying_Hours       ------   100   253   000    -    13936 (70 160 0)
241 Total_LBAs_Written      ------   100   253   000    -    1704474673
242 Total_LBAs_Read         ------   100   253   000    -    3038042127
                            ||||||_ K auto-keep
                            |||||__ C event count
                            ||||___ R error rate
                            |||____ S speed/performance
                            ||_____ O updated online
                            |______ P prefailure warning

General Purpose Log Directory Version 1
SMART           Log Directory Version 1 [multi-sector log support]
Address    Access  R/W   Size  Description
0x00       GPL,SL  R/O      1  Log Directory
0x01       GPL,SL  R/O      1  Summary SMART error log
0x02       GPL,SL  R/O      5  Comprehensive SMART error log
0x03       GPL     R/O      5  Ext. Comprehensive SMART error log
0x06       GPL,SL  R/O      1  SMART self-test log
0x07       GPL     R/O      1  Extended self-test log
0x09       GPL,SL  R/W      1  Selective self-test log
0x10       GPL     R/O      1  NCQ Command Error log
0x11       GPL     R/O      1  SATA Phy Event Counters log
0x21       GPL     R/O      1  Write stream error log
0x22       GPL     R/O      1  Read stream error log
0x80-0x9f  GPL,SL  R/W     16  Host vendor specific log
0xa1       GPL,SL  VS      20  Device vendor specific log
0xa2       GPL     VS    2248  Device vendor specific log
0xa8       GPL,SL  VS     129  Device vendor specific log
0xa9       GPL,SL  VS       1  Device vendor specific log
0xb0       GPL     VS    2928  Device vendor specific log
0xbd       GPL     VS     252  Device vendor specific log
0xbe-0xbf  GPL     VS   65535  Device vendor specific log
0xc0       GPL,SL  VS       1  Device vendor specific log
0xe0       GPL,SL  R/W      1  SCT Command/Status
0xe1       GPL,SL  R/W      1  SCT Data Transfer

SMART Extended Comprehensive Error Log Version: 1 (5 sectors)
Device Error Count: 15598 (device log contains only the most recent 20 errors)
	CR     = Command Register
	FEATR  = Features Register
	COUNT  = Count (was: Sector Count) Register
	LBA_48 = Upper bytes of LBA High/Mid/Low Registers ]  ATA-8
	LH     = LBA High (was: Cylinder High) Register    ]   LBA
	LM     = LBA Mid (was: Cylinder Low) Register      ] Register
	LL     = LBA Low (was: Sector Number) Register     ]
	DV     = Device (was: Device/Head) Register
	DC     = Device Control Register
	ER     = Error register
	ST     = Status register
Powered_Up_Time is measured from power on, and printed as
DDd+hh:mm:SS.sss where DD=days, hh=hours, mm=minutes,
SS=sec, and sss=millisec. It "wraps" after 49.710 days.

Error 15598 [17] occurred at disk power-on lifetime: 10626 hours (442 days + 18 hours)
  When the command that caused the error occurred, the device was active or idle.

  After command completion occurred, registers were:
  ER -- ST COUNT  LBA_48  LH LM LL DV DC
  -- -- -- == -- == == == -- -- -- -- --
  40 -- 51 00 00 00 21 24 00 8f 0d 00 00  Error: UNC at LBA = 0x2124008f0d = 142337937165

  Commands leading to the command that caused the error were:
  CR FEATR COUNT  LBA_48  LH LM LL DV DC  Powered_Up_Time  Command/Feature_Name
  -- == -- == -- == == == -- -- -- -- --  ---------------  --------------------
  25 00 00 00 08 00 21 24 00 8f 08 e0 00     01:51:08.550  READ DMA EXT
  25 00 00 01 00 00 18 52 00 d8 00 e0 00     01:51:08.541  READ DMA EXT
  25 00 00 01 00 00 18 51 00 d8 00 e0 00     01:51:08.412  READ DMA EXT
  35 00 00 00 08 00 13 b7 00 1a 40 e0 00     01:51:08.411  WRITE DMA EXT
  35 00 00 00 08 00 00 b4 00 5e 38 e0 00     01:51:08.411  WRITE DMA EXT

Error 15597 [16] occurred at disk power-on lifetime: 10626 hours (442 days + 18 hours)
  When the command that caused the error occurred, the device was active or idle.

  After command completion occurred, registers were:
  ER -- ST COUNT  LBA_48  LH LM LL DV DC
  -- -- -- == -- == == == -- -- -- -- --
  40 -- 51 00 00 00 21 24 00 8f 0d 00 00  Error: UNC at LBA = 0x2124008f0d = 142337937165

  Commands leading to the command that caused the error were:
  CR FEATR COUNT  LBA_48  LH LM LL DV DC  Powered_Up_Time  Command/Feature_Name
  -- == -- == -- == == == -- -- -- -- --  ---------------  --------------------
  25 00 00 00 08 00 21 24 00 8f 08 e0 00     01:51:05.394  READ DMA EXT
  25 00 00 01 00 00 18 4a 00 d8 00 e0 00     01:51:05.386  READ DMA EXT
  25 00 00 01 00 00 18 49 00 d8 00 e0 00     01:51:05.370  READ DMA EXT
  25 00 00 00 08 00 00 0b 00 75 b0 e0 00     01:51:05.322  READ DMA EXT
  35 00 00 00 09 00 00 d1 00 6e 7d e0 00     01:51:05.322  WRITE DMA EXT

Error 15596 [15] occurred at disk power-on lifetime: 10626 hours (442 days + 18 hours)
  When the command that caused the error occurred, the device was active or idle.

  After command completion occurred, registers were:
  ER -- ST COUNT  LBA_48  LH LM LL DV DC
  -- -- -- == -- == == == -- -- -- -- --
  40 -- 51 00 00 00 21 24 00 8f 0d 00 00  Error: UNC at LBA = 0x2124008f0d = 142337937165

  Commands leading to the command that caused the error were:
  CR FEATR COUNT  LBA_48  LH LM LL DV DC  Powered_Up_Time  Command/Feature_Name
  -- == -- == -- == == == -- -- -- -- --  ---------------  --------------------
  25 00 00 00 08 00 21 24 00 8f 08 e0 00     01:51:02.280  READ DMA EXT
  25 00 00 01 00 00 18 42 00 d8 00 e0 00     01:51:02.271  READ DMA EXT
  25 00 00 01 00 00 18 41 00 d8 00 e0 00     01:51:02.256  READ DMA EXT
  25 00 00 00 05 00 00 0c 00 75 28 e0 00     01:51:02.147  READ DMA EXT
  ea 00 00 00 00 8f 2d 00 24 00 00 a0 00     01:51:02.084  FLUSH CACHE EXT

Error 15595 [14] occurred at disk power-on lifetime: 10626 hours (442 days + 18 hours)
  When the command that caused the error occurred, the device was active or idle.

  After command completion occurred, registers were:
  ER -- ST COUNT  LBA_48  LH LM LL DV DC
  -- -- -- == -- == == == -- -- -- -- --
  40 -- 51 00 00 00 21 24 00 8f 2d 00 00  Error: UNC at LBA = 0x2124008f2d = 142337937197

  Commands leading to the command that caused the error were:
  CR FEATR COUNT  LBA_48  LH LM LL DV DC  Powered_Up_Time  Command/Feature_Name
  -- == -- == -- == == == -- -- -- -- --  ---------------  --------------------
  25 00 00 00 08 00 21 24 00 8f 28 e0 00     01:50:59.057  READ DMA EXT
  25 00 00 01 00 00 18 3e 00 d8 00 e0 00     01:50:59.054  READ DMA EXT
  25 00 00 01 00 00 18 3d 00 d8 00 e0 00     01:50:59.036  READ DMA EXT
  25 00 00 01 00 00 18 3c 00 d8 00 e0 00     01:50:59.035  READ DMA EXT
  25 00 00 01 00 00 18 3b 00 d8 00 e0 00     01:50:59.034  READ DMA EXT

Error 15594 [13] occurred at disk power-on lifetime: 10626 hours (442 days + 18 hours)
  When the command that caused the error occurred, the device was active or idle.

  After command completion occurred, registers were:
  ER -- ST COUNT  LBA_48  LH LM LL DV DC
  -- -- -- == -- == == == -- -- -- -- --
  40 -- 51 00 00 00 21 24 00 8f 0d 00 00  Error: UNC at LBA = 0x2124008f0d = 142337937165

  Commands leading to the command that caused the error were:
  CR FEATR COUNT  LBA_48  LH LM LL DV DC  Powered_Up_Time  Command/Feature_Name
  -- == -- == -- == == == -- -- -- -- --  ---------------  --------------------
  25 00 00 00 08 00 21 24 00 8f 08 e0 00     01:50:55.901  READ DMA EXT
  25 00 00 01 00 00 18 2a 00 d8 00 e0 00     01:50:55.892  READ DMA EXT
  25 00 00 01 00 00 18 29 00 d8 00 e0 00     01:50:55.877  READ DMA EXT
  35 00 00 00 08 00 0c 43 00 96 c0 e0 00     01:50:55.877  WRITE DMA EXT
  35 00 00 00 02 00 24 ea 00 a0 40 e0 00     01:50:55.874  WRITE DMA EXT

Error 15593 [12] occurred at disk power-on lifetime: 10626 hours (442 days + 18 hours)
  When the command that caused the error occurred, the device was active or idle.

  After command completion occurred, registers were:
  ER -- ST COUNT  LBA_48  LH LM LL DV DC
  -- -- -- == -- == == == -- -- -- -- --
  40 -- 51 00 00 00 21 24 00 8f 0d 00 00  Error: UNC at LBA = 0x2124008f0d = 142337937165

  Commands leading to the command that caused the error were:
  CR FEATR COUNT  LBA_48  LH LM LL DV DC  Powered_Up_Time  Command/Feature_Name
  -- == -- == -- == == == -- -- -- -- --  ---------------  --------------------
  25 00 00 01 00 00 21 24 00 8f 08 e0 00     01:50:52.716  READ DMA EXT
  35 00 00 00 20 00 2a ad 00 7c a0 e0 00     01:50:52.702  WRITE DMA EXT
  35 00 00 00 20 00 2a f0 00 7d 20 e0 00     01:50:52.700  WRITE DMA EXT
  25 00 00 01 00 00 18 1a 00 d8 00 e0 00     01:50:52.671  READ DMA EXT
  25 00 00 01 00 00 18 19 00 d8 00 e0 00     01:50:52.657  READ DMA EXT

Error 15592 [11] occurred at disk power-on lifetime: 10626 hours (442 days + 18 hours)
  When the command that caused the error occurred, the device was active or idle.

  After command completion occurred, registers were:
  ER -- ST COUNT  LBA_48  LH LM LL DV DC
  -- -- -- == -- == == == -- -- -- -- --
  40 -- 51 00 00 00 21 24 00 8f 0d 00 00  Error: UNC at LBA = 0x2124008f0d = 142337937165

  Commands leading to the command that caused the error were:
  CR FEATR COUNT  LBA_48  LH LM LL DV DC  Powered_Up_Time  Command/Feature_Name
  -- == -- == -- == == == -- -- -- -- --  ---------------  --------------------
  25 00 00 00 08 00 21 24 00 8f 08 e0 00     01:50:43.579  READ DMA EXT
  25 00 00 01 00 00 18 c3 00 d6 00 e0 00     01:50:43.571  READ DMA EXT
  25 00 00 01 00 00 18 c2 00 d6 00 e0 00     01:50:43.510  READ DMA EXT
  25 00 00 01 00 00 18 c1 00 d6 00 e0 00     01:50:43.510  READ DMA EXT
  35 00 00 00 20 00 00 b3 00 5e f0 e0 00     01:50:43.509  WRITE DMA EXT

Error 15591 [10] occurred at disk power-on lifetime: 10626 hours (442 days + 18 hours)
  When the command that caused the error occurred, the device was active or idle.

  After command completion occurred, registers were:
  ER -- ST COUNT  LBA_48  LH LM LL DV DC
  -- -- -- == -- == == == -- -- -- -- --
  40 -- 51 00 00 00 21 24 00 8f 0d 00 00  Error: UNC at LBA = 0x2124008f0d = 142337937165

  Commands leading to the command that caused the error were:
  CR FEATR COUNT  LBA_48  LH LM LL DV DC  Powered_Up_Time  Command/Feature_Name
  -- == -- == -- == == == -- -- -- -- --  ---------------  --------------------
  25 00 00 00 08 00 21 24 00 8f 08 e0 00     01:50:40.474  READ DMA EXT
  35 00 00 01 00 00 26 ea 00 d6 00 e0 00     01:50:40.473  WRITE DMA EXT
  25 00 00 01 00 00 18 bb 00 d6 00 e0 00     01:50:40.465  READ DMA EXT
  25 00 00 01 00 00 18 ba 00 d6 00 e0 00     01:50:40.448  READ DMA EXT
  25 00 00 01 00 00 18 b9 00 d6 00 e0 00     01:50:40.446  READ DMA EXT

SMART Extended Self-test Log Version: 1 (1 sectors)
No self-tests have been logged.  [To run self-tests, use: smartctl -t]

SMART Selective self-test log data structure revision number 1
 SPAN  MIN_LBA  MAX_LBA  CURRENT_TEST_STATUS
    1        0        0  Not_testing
    2        0        0  Not_testing
    3        0        0  Not_testing
    4        0        0  Not_testing
    5        0        0  Not_testing
Selective self-test flags (0x0):
  After scanning selected spans, do NOT read-scan remainder of disk.
If Selective self-test is pending on power-up, resume after 0 minute delay.

SCT Status Version:                  3
SCT Version (vendor specific):       522 (0x020a)
Device State:                        Active (0)
Current Temperature:                    36 Celsius
Power Cycle Min/Max Temperature:     29/36 Celsius
Lifetime    Min/Max Temperature:     16/47 Celsius
Under/Over Temperature Limit Count:   0/0

SCT Temperature History Version:     2
Temperature Sampling Period:         1 minute
Temperature Logging Interval:        59 minutes
Min/Max recommended Temperature:     14/55 Celsius
Min/Max Temperature Limit:           10/60 Celsius
Temperature History Size (Index):    128 (38)

SCT Error Recovery Control:
           Read: Disabled
          Write: Disabled

Device Statistics (GP/SMART Log 0x04) not supported

Pending Defects log (GP Log 0x0c) not supported

SATA Phy Event Counters (GP Log 0x11)
ID      Size     Value  Description
0x000a  2            1  Device-to-host register FISes sent due to a COMRESET
0x0001  2            0  Command failed due to ICRC error
0x0003  2            0  R_ERR response for device-to-host data FIS
0x0004  2            0  R_ERR response for host-to-device data FIS
0x0006  2            0  R_ERR response for device-to-host non-data FIS
0x0007  2            0  R_ERR response for host-to-device non-data FIS

