=== START OF INFORMATION SECTION ===
Model Family:     Toshiba 2.5" HDD MQ01ABD...
Device Model:     TOSHIBA MQ01ABD032
Serial Number:    --
LU WWN Device Id: 5 000039 ...
Firmware Version: AX001F
User Capacity:    320,072,933,376 bytes [320 GB]
Sector Sizes:     512 bytes logical, 4096 bytes physical
Rotation Rate:    5400 rpm
Form Factor:      2.5 inches
Device is:        In smartctl database [for details use: -P show]
ATA Version is:   ATA8-ACS (minor revision not indicated)
SATA Version is:  SATA 2.6, 3.0 Gb/s (current: 3.0 Gb/s)
Local Time is:    Sat May 19 00:22:04 2018 MSK
SMART support is: Available - device has SMART capability.
SMART support is: Enabled
AAM feature is:   Unavailable
APM level is:     128 (minimum power consumption without standby)
Rd look-ahead is: Enabled
Write cache is:   Enabled
ATA Security is:  Disabled, frozen [SEC2]
Wt Cache Reorder: Enabled

=== START OF READ SMART DATA SECTION ===
SMART overall-health self-assessment test result: PASSED

General SMART Values:
Offline data collection status:  (0x85)	Offline data collection activity
					was aborted by an interrupting command from host.
					Auto Offline Data Collection: Enabled.
Self-test execution status:      (   0)	The previous self-test routine completed
					without error or no self-test has ever 
					been run.
Total time to complete Offline 
data collection: 		(  120) seconds.
Offline data collection
capabilities: 			 (0x5b) SMART execute Offline immediate.
					Auto Offline data collection on/off support.
					Suspend Offline collection upon new
					command.
					Offline surface scan supported.
					Self-test supported.
					No Conveyance Self-test supported.
					Selective Self-test supported.
SMART capabilities:            (0x0003)	Saves SMART data before entering
					power-saving mode.
					Supports SMART auto save timer.
Error logging capability:        (0x01)	Error logging supported.
					General Purpose Logging supported.
Short self-test routine 
recommended polling time: 	 (   2) minutes.
Extended self-test routine
recommended polling time: 	 (  89) minutes.
SCT capabilities: 	       (0x003d)	SCT Status supported.
					SCT Error Recovery Control supported.
					SCT Feature Control supported.
					SCT Data Table supported.

SMART Attributes Data Structure revision number: 16
Vendor Specific SMART Attributes with Thresholds:
ID# ATTRIBUTE_NAME          FLAGS    VALUE WORST THRESH FAIL RAW_VALUE
  1 Raw_Read_Error_Rate     PO-R--   100   100   050    -    0
  2 Throughput_Performance  P-S---   100   100   050    -    0
  3 Spin_Up_Time            POS--K   100   100   001    -    1071
  4 Start_Stop_Count        -O--CK   100   100   000    -    3142
  5 Reallocated_Sector_Ct   PO--CK   100   100   050    -    0
  7 Seek_Error_Rate         PO-R--   100   100   050    -    0
  8 Seek_Time_Performance   P-S---   100   100   050    -    0
  9 Power_On_Hours          -O--CK   068   068   000    -    12997
 10 Spin_Retry_Count        PO--CK   162   100   030    -    0
 12 Power_Cycle_Count       -O--CK   100   100   000    -    1271
191 G-Sense_Error_Rate      -O--CK   100   100   000    -    566
192 Power-Off_Retract_Count -O--CK   100   100   000    -    253
193 Load_Cycle_Count        -O--CK   096   096   000    -    40528
194 Temperature_Celsius     -O---K   100   100   000    -    40 (Min/Max 11/47)
196 Reallocated_Event_Count -O--CK   100   100   000    -    0
197 Current_Pending_Sector  -O--CK   100   100   000    -    0
198 Offline_Uncorrectable   ----CK   100   100   000    -    0
199 UDMA_CRC_Error_Count    -O--CK   200   200   000    -    5
220 Disk_Shift              -O----   100   100   000    -    0
222 Loaded_Hours            -O--CK   076   076   000    -    9763
223 Load_Retry_Count        -O--CK   100   100   000    -    0
224 Load_Friction           -O---K   100   100   000    -    0
226 Load-in_Time            -OS--K   100   100   000    -    261
240 Head_Flying_Hours       P-----   100   100   001    -    0
                            ||||||_ K auto-keep
                            |||||__ C event count
                            ||||___ R error rate
                            |||____ S speed/performance
                            ||_____ O updated online
                            |______ P prefailure warning

General Purpose Log Directory Version 1
SMART           Log Directory Version 1 [multi-sector log support]
Address    Access  R/W   Size  Description
0x00       GPL,SL  R/O      1  Log Directory
0x01           SL  R/O      1  Summary SMART error log
0x02           SL  R/O     51  Comprehensive SMART error log
0x03       GPL     R/O     64  Ext. Comprehensive SMART error log
0x04       GPL,SL  R/O      8  Device Statistics log
0x06           SL  R/O      1  SMART self-test log
0x07       GPL     R/O      1  Extended self-test log
0x09           SL  R/W      1  Selective self-test log
0x10       GPL     R/O      1  SATA NCQ Queued Error log
0x11       GPL     R/O      1  SATA Phy Event Counters log
0x80-0x9f  GPL,SL  R/W     16  Host vendor specific log
0xe0       GPL,SL  R/W      1  SCT Command/Status
0xe1       GPL,SL  R/W      1  SCT Data Transfer

SMART Extended Comprehensive Error Log Version: 1 (64 sectors)
Device Error Count: 5
	CR     = Command Register
	FEATR  = Features Register
	COUNT  = Count (was: Sector Count) Register
	LBA_48 = Upper bytes of LBA High/Mid/Low Registers ]  ATA-8
	LH     = LBA High (was: Cylinder High) Register    ]   LBA
	LM     = LBA Mid (was: Cylinder Low) Register      ] Register
	LL     = LBA Low (was: Sector Number) Register     ]
	DV     = Device (was: Device/Head) Register
	DC     = Device Control Register
	ER     = Error register
	ST     = Status register
Powered_Up_Time is measured from power on, and printed as
DDd+hh:mm:SS.sss where DD=days, hh=hours, mm=minutes,
SS=sec, and sss=millisec. It "wraps" after 49.710 days.

Error 5 [4] occurred at disk power-on lifetime: 9262 hours (385 days + 22 hours)
  When the command that caused the error occurred, the device was active or idle.

  After command completion occurred, registers were:
  ER -- ST COUNT  LBA_48  LH LM LL DV DC
  -- -- -- == -- == == == -- -- -- -- --
  84 -- 41 00 38 00 00 23 8e a3 27 40 00  Error: ICRC, ABRT at LBA = 0x238ea327 = 596550439

  Commands leading to the command that caused the error were:
  CR FEATR COUNT  LBA_48  LH LM LL DV DC  Powered_Up_Time  Command/Feature_Name
  -- == -- == -- == == == -- -- -- -- --  ---------------  --------------------
  61 00 10 00 38 00 00 23 8e a3 18 40 00     23:57:02.577  WRITE FPDMA QUEUED
  ef 00 90 00 03 00 00 00 00 00 00 a0 00     23:57:02.576  SET FEATURES [Disable SATA feature]
  ef 00 10 00 02 00 00 00 00 00 00 a0 00     23:57:02.576  SET FEATURES [Enable SATA feature]
  27 00 00 00 00 00 00 00 00 00 00 e0 00     23:57:02.576  READ NATIVE MAX ADDRESS EXT [OBS-ACS-3]
  ec 00 00 00 00 00 00 00 00 00 00 a0 00     23:57:02.575  IDENTIFY DEVICE

Error 4 [3] occurred at disk power-on lifetime: 9262 hours (385 days + 22 hours)
  When the command that caused the error occurred, the device was active or idle.

  After command completion occurred, registers were:
  ER -- ST COUNT  LBA_48  LH LM LL DV DC
  -- -- -- == -- == == == -- -- -- -- --
  84 -- 41 00 30 00 00 23 8e a3 27 40 00  Error: ICRC, ABRT at LBA = 0x238ea327 = 596550439

  Commands leading to the command that caused the error were:
  CR FEATR COUNT  LBA_48  LH LM LL DV DC  Powered_Up_Time  Command/Feature_Name
  -- == -- == -- == == == -- -- -- -- --  ---------------  --------------------
  61 00 10 00 30 00 00 23 8e a3 18 40 00     23:57:02.244  WRITE FPDMA QUEUED
  ef 00 90 00 03 00 00 00 00 00 00 a0 00     23:57:02.244  SET FEATURES [Disable SATA feature]
  ef 00 90 00 03 00 00 00 00 00 00 a0 00     23:57:02.244  SET FEATURES [Disable SATA feature]
  ef 00 10 00 02 00 00 00 00 00 00 a0 00     23:57:02.243  SET FEATURES [Enable SATA feature]
  27 00 00 00 00 00 00 00 00 00 00 e0 00     23:57:02.243  READ NATIVE MAX ADDRESS EXT [OBS-ACS-3]

Error 3 [2] occurred at disk power-on lifetime: 9262 hours (385 days + 22 hours)
  When the command that caused the error occurred, the device was active or idle.

  After command completion occurred, registers were:
  ER -- ST COUNT  LBA_48  LH LM LL DV DC
  -- -- -- == -- == == == -- -- -- -- --
  84 -- 41 00 28 00 00 23 8e a3 27 40 00  Error: ICRC, ABRT at LBA = 0x238ea327 = 596550439

  Commands leading to the command that caused the error were:
  CR FEATR COUNT  LBA_48  LH LM LL DV DC  Powered_Up_Time  Command/Feature_Name
  -- == -- == -- == == == -- -- -- -- --  ---------------  --------------------
  61 00 10 00 28 00 00 23 8e a3 18 40 00     23:57:01.914  WRITE FPDMA QUEUED
  ef 00 90 00 03 00 00 00 00 00 00 a0 00     23:57:01.913  SET FEATURES [Disable SATA feature]
  ef 00 10 00 02 00 00 00 00 00 00 a0 00     23:57:01.913  SET FEATURES [Enable SATA feature]
  27 00 00 00 00 00 00 00 00 00 00 e0 00     23:57:01.913  READ NATIVE MAX ADDRESS EXT [OBS-ACS-3]
  ec 00 00 00 00 00 00 00 00 00 00 a0 00     23:57:01.912  IDENTIFY DEVICE

Error 2 [1] occurred at disk power-on lifetime: 9262 hours (385 days + 22 hours)
  When the command that caused the error occurred, the device was active or idle.

  After command completion occurred, registers were:
  ER -- ST COUNT  LBA_48  LH LM LL DV DC
  -- -- -- == -- == == == -- -- -- -- --
  84 -- 41 00 20 00 00 23 8e a3 27 40 00  Error: ICRC, ABRT at LBA = 0x238ea327 = 596550439

  Commands leading to the command that caused the error were:
  CR FEATR COUNT  LBA_48  LH LM LL DV DC  Powered_Up_Time  Command/Feature_Name
  -- == -- == -- == == == -- -- -- -- --  ---------------  --------------------
  61 00 10 00 20 00 00 23 8e a3 18 40 00     23:57:01.483  WRITE FPDMA QUEUED
  61 00 08 00 18 00 00 22 0f 26 70 40 00     23:56:58.617  WRITE FPDMA QUEUED
  61 00 08 00 10 00 00 23 8e 9f 30 40 00     23:56:58.617  WRITE FPDMA QUEUED
  ea 00 00 00 00 00 00 00 00 00 00 a0 00     23:56:58.297  FLUSH CACHE EXT
  61 00 08 00 00 00 00 22 b5 86 c0 40 00     23:56:58.297  WRITE FPDMA QUEUED

Error 1 [0] occurred at disk power-on lifetime: 9237 hours (384 days + 21 hours)
  When the command that caused the error occurred, the device was active or idle.

  After command completion occurred, registers were:
  ER -- ST COUNT  LBA_48  LH LM LL DV DC
  -- -- -- == -- == == == -- -- -- -- --
  84 -- 41 00 18 00 00 21 f9 e3 af 40 00  Error: ICRC, ABRT at LBA = 0x21f9e3af = 570024879

  Commands leading to the command that caused the error were:
  CR FEATR COUNT  LBA_48  LH LM LL DV DC  Powered_Up_Time  Command/Feature_Name
  -- == -- == -- == == == -- -- -- -- --  ---------------  --------------------
  61 00 08 00 18 00 00 21 f9 e3 a8 40 00     21:30:45.601  WRITE FPDMA QUEUED
  ea 00 00 00 00 00 00 00 00 00 00 a0 00     21:30:38.779  FLUSH CACHE EXT
  61 00 08 00 08 00 00 22 b4 de f0 40 00     21:30:38.779  WRITE FPDMA QUEUED
  ea 00 00 00 00 00 00 00 00 00 00 a0 00     21:30:38.769  FLUSH CACHE EXT
  61 00 20 00 f0 00 00 22 b4 de d0 40 00     21:30:38.769  WRITE FPDMA QUEUED

SMART Extended Self-test Log Version: 1 (1 sectors)
No self-tests have been logged.  [To run self-tests, use: smartctl -t]

SMART Selective self-test log data structure revision number 1
 SPAN  MIN_LBA  MAX_LBA  CURRENT_TEST_STATUS
    1        0        0  Not_testing
    2        0        0  Not_testing
    3        0        0  Not_testing
    4        0        0  Not_testing
    5        0        0  Not_testing
Selective self-test flags (0x0):
  After scanning selected spans, do NOT read-scan remainder of disk.
If Selective self-test is pending on power-up, resume after 0 minute delay.

SCT Status Version:                  2
SCT Version (vendor specific):       1 (0x0001)
SCT Support Level:                   1
Device State:                        Active (0)
Current Temperature:                    40 Celsius
Power Cycle Min/Max Temperature:     38/45 Celsius
Lifetime    Min/Max Temperature:     11/47 Celsius
Under/Over Temperature Limit Count:   0/0

SCT Temperature History Version:     2
Temperature Sampling Period:         1 minute
Temperature Logging Interval:        1 minute
Min/Max recommended Temperature:      5/55 Celsius
Min/Max Temperature Limit:            5/55 Celsius
Temperature History Size (Index):    478 (252)

SCT Error Recovery Control:
           Read: Disabled
          Write: Disabled

Device Statistics (GP Log 0x04)
Page  Offset Size        Value Flags Description
0x01  =====  =               =  ===  == General Statistics (rev 2) ==
0x01  0x008  4            1271  ---  Lifetime Power-On Resets
0x01  0x010  4           12997  ---  Power-on Hours
0x01  0x018  6     24446044854  ---  Logical Sectors Written
0x01  0x020  6       351326549  ---  Number of Write Commands
0x01  0x028  6     29833293816  ---  Logical Sectors Read
0x01  0x030  6       647022862  ---  Number of Read Commands
0x02  =====  =               =  ===  == Free-Fall Statistics (rev 1) ==
0x02  0x010  4             566  ---  Overlimit Shock Events
0x03  =====  =               =  ===  == Rotating Media Statistics (rev 1) ==
0x03  0x008  4           12658  ---  Spindle Motor Power-on Hours
0x03  0x010  4            9763  ---  Head Flying Hours
0x03  0x018  4           40528  ---  Head Load Events
0x03  0x020  4               0  ---  Number of Reallocated Logical Sectors
0x03  0x028  4               0  ---  Read Recovery Attempts
0x03  0x030  4               0  ---  Number of Mechanical Start Failures
0x04  =====  =               =  ===  == General Errors Statistics (rev 1) ==
0x04  0x008  4               0  ---  Number of Reported Uncorrectable Errors
0x04  0x010  4              48  ---  Resets Between Cmd Acceptance and Completion
0x05  =====  =               =  ===  == Temperature Statistics (rev 1) ==
0x05  0x008  1              40  ---  Current Temperature
0x05  0x010  1              40  N--  Average Short Term Temperature
0x05  0x018  1              38  N--  Average Long Term Temperature
0x05  0x020  1              47  ---  Highest Temperature
0x05  0x028  1              11  ---  Lowest Temperature
0x05  0x030  1              42  N--  Highest Average Short Term Temperature
0x05  0x038  1              32  N--  Lowest Average Short Term Temperature
0x05  0x040  1              40  N--  Highest Average Long Term Temperature
0x05  0x048  1              36  N--  Lowest Average Long Term Temperature
0x05  0x050  4               0  ---  Time in Over-Temperature
0x05  0x058  1              55  ---  Specified Maximum Operating Temperature
0x05  0x060  4               0  ---  Time in Under-Temperature
0x05  0x068  1               5  ---  Specified Minimum Operating Temperature
0x06  =====  =               =  ===  == Transport Statistics (rev 1) ==
0x06  0x008  4            7470  ---  Number of Hardware Resets
0x06  0x018  4               5  ---  Number of Interface CRC Errors
0x07  =====  =               =  ===  == Solid State Device Statistics (rev 1) ==
0x07  0x008  1              21  N--  Percentage Used Endurance Indicator
                                |||_ C monitored condition met
                                ||__ D supports DSN
                                |___ N normalized value

SATA Phy Event Counters (GP Log 0x11)
ID      Size     Value  Description
0x0001  4            0  Command failed due to ICRC error
0x0002  4            0  R_ERR response for data FIS
0x0003  4            0  R_ERR response for device-to-host data FIS
0x0004  4            0  R_ERR response for host-to-device data FIS
0x0005  4            0  R_ERR response for non-data FIS
0x0006  4            0  R_ERR response for device-to-host non-data FIS
0x0007  4            0  R_ERR response for host-to-device non-data FIS
0x0008  4            0  Device-to-host non-data FIS retries
0x0009  4            9  Transition from drive PhyRdy to drive PhyNRdy
0x000a  4            8  Device-to-host register FISes sent due to a COMRESET
0x000b  4            0  CRC errors within host-to-device FIS
0x000d  4            0  Non-CRC errors within host-to-device FIS
0x000f  4            0  R_ERR response for host-to-device data FIS, CRC
0x0010  4            0  R_ERR response for host-to-device data FIS, non-CRC
0x0012  4            0  R_ERR response for host-to-device non-data FIS, CRC
0x0013  4            0  R_ERR response for host-to-device non-data FIS, non-CRC

