smartctl 7.1 2019-12-30 r5022 [x86_64-linux-5.15.54-051554-generic] (local build)
Copyright (C) 2002-19, Bruce Allen, Christian Franke, www.smartmontools.org

=== START OF INFORMATION SECTION ===
Device Model:     ST9250311CS
Serial Number:    --
LU WWN Device Id: 5 000c50 ...
Firmware Version: SC1A
User Capacity:    250,059,350,016 bytes [250 GB]
Sector Size:      512 bytes logical/physical
Rotation Rate:    5400 rpm
Device is:        Not in smartctl database [for details use: -P showall]
ATA Version is:   ATA8-ACS T13/1699-D revision 4
SATA Version is:  SATA 2.6, 3.0 Gb/s
Local Time is:    Tue Dec 26 10:33:59 2023 CET
SMART support is: Available - device has SMART capability.
SMART support is: Enabled
AAM feature is:   Unavailable
APM level is:     254 (maximum performance)
Rd look-ahead is: Enabled
Write cache is:   Enabled
DSN feature is:   Unavailable
ATA Security is:  Disabled, frozen [SEC2]
Wt Cache Reorder: Unknown

=== START OF READ SMART DATA SECTION ===
SMART overall-health self-assessment test result: PASSED

General SMART Values:
Offline data collection status:  (0x82)	Offline data collection activity
					was completed without error.
					Auto Offline Data Collection: Enabled.
Self-test execution status:      (   0)	The previous self-test routine completed
					without error or no self-test has ever 
					been run.
Total time to complete Offline 
data collection: 		(    0) seconds.
Offline data collection
capabilities: 			 (0x7b) SMART execute Offline immediate.
					Auto Offline data collection on/off support.
					Suspend Offline collection upon new
					command.
					Offline surface scan supported.
					Self-test supported.
					Conveyance Self-test supported.
					Selective Self-test supported.
SMART capabilities:            (0x0003)	Saves SMART data before entering
					power-saving mode.
					Supports SMART auto save timer.
Error logging capability:        (0x01)	Error logging supported.
					General Purpose Logging supported.
Short self-test routine 
recommended polling time: 	 (   1) minutes.
Extended self-test routine
recommended polling time: 	 (  80) minutes.
Conveyance self-test routine
recommended polling time: 	 (   2) minutes.
SCT capabilities: 	       (0x103f)	SCT Status supported.
					SCT Error Recovery Control supported.
					SCT Feature Control supported.
					SCT Data Table supported.

SMART Attributes Data Structure revision number: 10
Vendor Specific SMART Attributes with Thresholds:
ID# ATTRIBUTE_NAME          FLAGS    VALUE WORST THRESH FAIL RAW_VALUE
  1 Raw_Read_Error_Rate     POSR--   118   099   006    -    200579959
  3 Spin_Up_Time            PO----   099   099   000    -    0
  4 Start_Stop_Count        -O--CK   099   099   020    -    1964
  5 Reallocated_Sector_Ct   PO--CK   100   100   036    -    5
  7 Seek_Error_Rate         POSR--   063   060   030    -    73050200653
  9 Power_On_Hours          -O--CK   069   069   000    -    27445
 10 Spin_Retry_Count        PO--C-   100   100   097    -    0
 12 Power_Cycle_Count       -O--CK   099   099   020    -    1846
184 End-to-End_Error        -O--CK   100   100   099    -    0
187 Reported_Uncorrect      -O--CK   033   033   000    -    67
188 Command_Timeout         -O--CK   100   095   000    -    1799618757090
189 High_Fly_Writes         -O-RCK   100   100   000    -    0
190 Airflow_Temperature_Cel -O---K   074   046   045    -    26 (Min/Max 20/26)
191 G-Sense_Error_Rate      -O--CK   100   100   000    -    0
192 Power-Off_Retract_Count -O--CK   100   100   000    -    1530
193 Load_Cycle_Count        -O--CK   100   100   000    -    1918
194 Temperature_Celsius     -O---K   026   054   000    -    26 (0 14 0 0 0)
195 Hardware_ECC_Recovered  -O-RC-   043   038   000    -    200579959
197 Current_Pending_Sector  -O--C-   100   100   000    -    3
198 Offline_Uncorrectable   ----C-   100   100   000    -    3
199 UDMA_CRC_Error_Count    -OSRCK   200   200   000    -    1
                            ||||||_ K auto-keep
                            |||||__ C event count
                            ||||___ R error rate
                            |||____ S speed/performance
                            ||_____ O updated online
                            |______ P prefailure warning

General Purpose Log Directory Version 1
SMART           Log Directory Version 1 [multi-sector log support]
Address    Access  R/W   Size  Description
0x00       GPL,SL  R/O      1  Log Directory
0x01       GPL,SL  R/O      1  Summary SMART error log
0x02       GPL,SL  R/O      5  Comprehensive SMART error log
0x03       GPL,SL  R/O      5  Ext. Comprehensive SMART error log
0x06       GPL,SL  R/O      1  SMART self-test log
0x07       GPL,SL  R/O      1  Extended self-test log
0x09       GPL,SL  R/W      1  Selective self-test log
0x10       GPL,SL  R/O      1  NCQ Command Error log
0x11       GPL,SL  R/O      1  SATA Phy Event Counters log
0x21       GPL,SL  R/O      1  Write stream error log
0x22       GPL,SL  R/O      1  Read stream error log
0x80-0x9f  GPL,SL  R/W     16  Host vendor specific log
0xa1       GPL,SL  VS      20  Device vendor specific log
0xa2       GPL     VS    2248  Device vendor specific log
0xa8       GPL,SL  VS      65  Device vendor specific log
0xa9       GPL,SL  VS       1  Device vendor specific log
0xb0       GPL     VS    2864  Device vendor specific log
0xbe-0xbf  GPL     VS   65535  Device vendor specific log
0xe0       GPL,SL  R/W      1  SCT Command/Status
0xe1       GPL,SL  R/W      1  SCT Data Transfer

SMART Extended Comprehensive Error Log Version: 1 (5 sectors)
Device Error Count: 73 (device log contains only the most recent 20 errors)
	CR     = Command Register
	FEATR  = Features Register
	COUNT  = Count (was: Sector Count) Register
	LBA_48 = Upper bytes of LBA High/Mid/Low Registers ]  ATA-8
	LH     = LBA High (was: Cylinder High) Register    ]   LBA
	LM     = LBA Mid (was: Cylinder Low) Register      ] Register
	LL     = LBA Low (was: Sector Number) Register     ]
	DV     = Device (was: Device/Head) Register
	DC     = Device Control Register
	ER     = Error register
	ST     = Status register
Powered_Up_Time is measured from power on, and printed as
DDd+hh:mm:SS.sss where DD=days, hh=hours, mm=minutes,
SS=sec, and sss=millisec. It "wraps" after 49.710 days.

Error 73 [12] occurred at disk power-on lifetime: 27243 hours (1135 days + 3 hours)
  When the command that caused the error occurred, the device was active or idle.

  After command completion occurred, registers were:
  ER -- ST COUNT  LBA_48  LH LM LL DV DC
  -- -- -- == -- == == == -- -- -- -- --
  40 -- 51 00 00 00 18 e4 00 cf 05 00 00  Error: UNC at LBA = 0x18e400cf05 = 106904473349

  Commands leading to the command that caused the error were:
  CR FEATR COUNT  LBA_48  LH LM LL DV DC  Powered_Up_Time  Command/Feature_Name
  -- == -- == -- == == == -- -- -- -- --  ---------------  --------------------
  25 00 00 00 24 00 18 e4 00 cf 00 e0 00     00:00:19.066  READ DMA EXT
  25 00 00 00 1b 00 18 e3 00 cf e5 e0 00     00:00:19.063  READ DMA EXT
  25 00 00 00 25 00 18 e3 00 cf c0 e0 00     00:00:19.063  READ DMA EXT
  25 00 00 00 1a 00 18 e3 00 cf a6 e0 00     00:00:19.062  READ DMA EXT
  25 00 00 00 26 00 18 e3 00 cf 80 e0 00     00:00:19.062  READ DMA EXT

Error 72 [11] occurred at disk power-on lifetime: 27243 hours (1135 days + 3 hours)
  When the command that caused the error occurred, the device was active or idle.

  After command completion occurred, registers were:
  ER -- ST COUNT  LBA_48  LH LM LL DV DC
  -- -- -- == -- == == == -- -- -- -- --
  40 -- 51 00 00 00 18 e4 00 cf 05 00 00  Error: UNC at LBA = 0x18e400cf05 = 106904473349

  Commands leading to the command that caused the error were:
  CR FEATR COUNT  LBA_48  LH LM LL DV DC  Powered_Up_Time  Command/Feature_Name
  -- == -- == -- == == == -- -- -- -- --  ---------------  --------------------
  25 00 00 00 24 00 18 e4 00 cf 00 e0 00     00:00:15.323  READ DMA EXT
  25 00 00 00 1b 00 18 e3 00 cf e5 e0 00     00:00:15.320  READ DMA EXT
  25 00 00 00 25 00 18 e3 00 cf c0 e0 00     00:00:15.320  READ DMA EXT
  25 00 00 00 1a 00 18 e3 00 cf a6 e0 00     00:00:15.319  READ DMA EXT
  25 00 00 00 26 00 18 e3 00 cf 80 e0 00     00:00:15.319  READ DMA EXT

Error 71 [10] occurred at disk power-on lifetime: 27221 hours (1134 days + 5 hours)
  When the command that caused the error occurred, the device was active or idle.

  After command completion occurred, registers were:
  ER -- ST COUNT  LBA_48  LH LM LL DV DC
  -- -- -- == -- == == == -- -- -- -- --
  40 -- 51 00 00 00 18 e4 00 cf 05 00 00  Error: UNC at LBA = 0x18e400cf05 = 106904473349

  Commands leading to the command that caused the error were:
  CR FEATR COUNT  LBA_48  LH LM LL DV DC  Powered_Up_Time  Command/Feature_Name
  -- == -- == -- == == == -- -- -- -- --  ---------------  --------------------
  25 00 00 00 24 00 18 e4 00 cf 00 e0 00     00:00:11.975  READ DMA EXT
  25 00 00 00 1b 00 18 e3 00 cf e5 e0 00     00:00:11.972  READ DMA EXT
  25 00 00 00 25 00 18 e3 00 cf c0 e0 00     00:00:11.972  READ DMA EXT
  25 00 00 00 1a 00 18 e3 00 cf a6 e0 00     00:00:11.971  READ DMA EXT
  25 00 00 00 26 00 18 e3 00 cf 80 e0 00     00:00:11.971  READ DMA EXT

Error 70 [9] occurred at disk power-on lifetime: 27220 hours (1134 days + 4 hours)
  When the command that caused the error occurred, the device was active or idle.

  After command completion occurred, registers were:
  ER -- ST COUNT  LBA_48  LH LM LL DV DC
  -- -- -- == -- == == == -- -- -- -- --
  40 -- 51 00 00 00 18 e4 00 cf 05 00 00  Error: UNC at LBA = 0x18e400cf05 = 106904473349

  Commands leading to the command that caused the error were:
  CR FEATR COUNT  LBA_48  LH LM LL DV DC  Powered_Up_Time  Command/Feature_Name
  -- == -- == -- == == == -- -- -- -- --  ---------------  --------------------
  25 00 00 00 24 00 18 e4 00 cf 00 e0 00     00:00:26.382  READ DMA EXT
  25 00 00 00 1b 00 18 e3 00 cf e5 e0 00     00:00:26.379  READ DMA EXT
  25 00 00 00 25 00 18 e3 00 cf c0 e0 00     00:00:26.378  READ DMA EXT
  25 00 00 00 1a 00 18 e3 00 cf a6 e0 00     00:00:26.378  READ DMA EXT
  25 00 00 00 26 00 18 e3 00 cf 80 e0 00     00:00:26.377  READ DMA EXT

Error 69 [8] occurred at disk power-on lifetime: 27220 hours (1134 days + 4 hours)
  When the command that caused the error occurred, the device was active or idle.

  After command completion occurred, registers were:
  ER -- ST COUNT  LBA_48  LH LM LL DV DC
  -- -- -- == -- == == == -- -- -- -- --
  40 -- 51 00 00 00 18 e4 00 cf 05 00 00  Error: UNC at LBA = 0x18e400cf05 = 106904473349

  Commands leading to the command that caused the error were:
  CR FEATR COUNT  LBA_48  LH LM LL DV DC  Powered_Up_Time  Command/Feature_Name
  -- == -- == -- == == == -- -- -- -- --  ---------------  --------------------
  25 00 00 00 24 00 18 e4 00 cf 00 e0 00     00:00:11.510  READ DMA EXT
  25 00 00 00 1b 00 18 e3 00 cf e5 e0 00     00:00:11.507  READ DMA EXT
  25 00 00 00 25 00 18 e3 00 cf c0 e0 00     00:00:11.507  READ DMA EXT
  25 00 00 00 1a 00 18 e3 00 cf a6 e0 00     00:00:11.506  READ DMA EXT
  25 00 00 00 26 00 18 e3 00 cf 80 e0 00     00:00:11.506  READ DMA EXT

Error 68 [7] occurred at disk power-on lifetime: 27220 hours (1134 days + 4 hours)
  When the command that caused the error occurred, the device was active or idle.

  After command completion occurred, registers were:
  ER -- ST COUNT  LBA_48  LH LM LL DV DC
  -- -- -- == -- == == == -- -- -- -- --
  40 -- 51 00 00 00 18 e4 00 cf 05 00 00  Error: UNC at LBA = 0x18e400cf05 = 106904473349

  Commands leading to the command that caused the error were:
  CR FEATR COUNT  LBA_48  LH LM LL DV DC  Powered_Up_Time  Command/Feature_Name
  -- == -- == -- == == == -- -- -- -- --  ---------------  --------------------
  25 00 00 00 26 00 18 88 00 cf 1a e0 00     01:06:38.544  READ DMA EXT
  25 00 00 00 1a 00 18 88 00 cf 00 e0 00     01:06:38.526  READ DMA EXT
  25 00 00 00 1c 00 09 0c 00 80 64 e0 00     01:06:38.516  READ DMA EXT
  25 00 00 00 24 00 09 0c 00 80 40 e0 00     01:06:38.514  READ DMA EXT
  25 00 00 00 0a 00 08 68 00 29 36 e0 00     01:06:38.268  READ DMA EXT

Error 67 [6] occurred at disk power-on lifetime: 27128 hours (1130 days + 8 hours)
  When the command that caused the error occurred, the device was active or idle.

  After command completion occurred, registers were:
  ER -- ST COUNT  LBA_48  LH LM LL DV DC
  -- -- -- == -- == == == -- -- -- -- --
  40 -- 51 00 00 00 18 91 00 6b 3f 00 00  Error: UNC at LBA = 0x1891006b3f = 105511938879

  Commands leading to the command that caused the error were:
  CR FEATR COUNT  LBA_48  LH LM LL DV DC  Powered_Up_Time  Command/Feature_Name
  -- == -- == -- == == == -- -- -- -- --  ---------------  --------------------
  25 00 00 20 00 00 18 80 00 6b 00 e0 00     01:00:24.603  READ DMA EXT
  25 00 00 20 00 00 18 80 00 6b 00 e0 00     01:00:22.160  READ DMA EXT
  25 00 00 20 00 00 18 80 00 6b 00 e0 00     01:00:19.584  READ DMA EXT
  25 00 00 20 00 00 18 80 00 6b 00 e0 00     01:00:17.075  READ DMA EXT
  25 00 00 20 00 00 18 00 00 68 00 e0 00     01:00:12.283  READ DMA EXT

Error 66 [5] occurred at disk power-on lifetime: 27128 hours (1130 days + 8 hours)
  When the command that caused the error occurred, the device was active or idle.

  After command completion occurred, registers were:
  ER -- ST COUNT  LBA_48  LH LM LL DV DC
  -- -- -- == -- == == == -- -- -- -- --
  40 -- 51 00 00 00 18 91 00 6b 3f 00 00  Error: UNC at LBA = 0x1891006b3f = 105511938879

  Commands leading to the command that caused the error were:
  CR FEATR COUNT  LBA_48  LH LM LL DV DC  Powered_Up_Time  Command/Feature_Name
  -- == -- == -- == == == -- -- -- -- --  ---------------  --------------------
  25 00 00 20 00 00 18 80 00 6b 00 e0 00     01:00:22.160  READ DMA EXT
  25 00 00 20 00 00 18 80 00 6b 00 e0 00     01:00:19.584  READ DMA EXT
  25 00 00 20 00 00 18 80 00 6b 00 e0 00     01:00:17.075  READ DMA EXT
  25 00 00 20 00 00 18 00 00 68 00 e0 00     01:00:12.283  READ DMA EXT
  25 00 00 20 00 00 18 e0 00 67 00 e0 00     01:00:12.186  READ DMA EXT

SMART Extended Self-test Log Version: 1 (1 sectors)
Num  Test_Description    Status                  Remaining  LifeTime(hours)  LBA_of_first_error
# 1  Short offline       Completed without error       00%     26822         -
# 2  Short offline       Completed without error       00%     26798         -
# 3  Short offline       Completed without error       00%     26774         -
# 4  Short offline       Completed without error       00%     26770         -
# 5  Short offline       Completed without error       00%     26745         -
# 6  Short offline       Completed without error       00%     26721         -
# 7  Short offline       Completed without error       00%     26697         -
# 8  Short offline       Completed without error       00%     26673         -
# 9  Short offline       Completed without error       00%     26648         -
#10  Short offline       Completed without error       00%     26620         -
#11  Short offline       Completed without error       00%     26596         -
#12  Short offline       Completed without error       00%     26572         -
#13  Short offline       Completed without error       00%     26561         -
#14  Short offline       Completed without error       00%     26556         -
#15  Short offline       Completed without error       00%     26532         -
#16  Short offline       Completed without error       00%     26507         -
#17  Short offline       Completed without error       00%     26483         -
#18  Short offline       Completed without error       00%     26459         -
#19  Short offline       Completed without error       00%     26435         -

SMART Selective self-test log data structure revision number 1
 SPAN  MIN_LBA  MAX_LBA  CURRENT_TEST_STATUS
    1        0        0  Not_testing
    2        0        0  Not_testing
    3        0        0  Not_testing
    4        0        0  Not_testing
    5        0        0  Not_testing
Selective self-test flags (0x0):
  After scanning selected spans, do NOT read-scan remainder of disk.
If Selective self-test is pending on power-up, resume after 0 minute delay.

SCT Status Version:                  3
SCT Version (vendor specific):       522 (0x020a)
Device State:                        Active (0)
Current Temperature:                    26 Celsius
Power Cycle Min/Max Temperature:     20/26 Celsius
Lifetime    Min/Max Temperature:     14/54 Celsius
Under/Over Temperature Limit Count:   0/0

SCT Temperature History Version:     2
Temperature Sampling Period:         2 minutes
Temperature Logging Interval:        94 minutes
Min/Max recommended Temperature:      1/61 Celsius
Min/Max Temperature Limit:            2/60 Celsius
Temperature History Size (Index):    432 (139)

SCT Error Recovery Control:
           Read: Disabled
          Write: Disabled

Device Statistics (GP/SMART Log 0x04) not supported

Pending Defects log (GP Log 0x0c) not supported

SATA Phy Event Counters (GP Log 0x11)
ID      Size     Value  Description
0x000a  2            3  Device-to-host register FISes sent due to a COMRESET
0x0001  2            0  Command failed due to ICRC error
0x0003  2            0  R_ERR response for device-to-host data FIS
0x0004  2            0  R_ERR response for host-to-device data FIS
0x0006  2            0  R_ERR response for device-to-host non-data FIS
0x0007  2            0  R_ERR response for host-to-device non-data FIS

