=== START OF INFORMATION SECTION ===
Model Family:     Seagate Momentus 5400.4
Device Model:     ST9160827AS
Serial Number:    --
LU WWN Device Id: 5 000c50 ...
Firmware Version: 3.ADB
User Capacity:    160,041,885,696 bytes [160 GB]
Sector Size:      512 bytes logical/physical
Rotation Rate:    5400 rpm
Device is:        In smartctl database [for details use: -P show]
ATA Version is:   ATA8-ACS T13/1699-D revision 4
SATA Version is:  SATA 2.6, 3.0 Gb/s
Local Time is:    Wed Oct 21 01:03:52 2015 CDT
SMART support is: Available - device has SMART capability.
SMART support is: Enabled
AAM level is:     254 (maximum performance), recommended: 208
APM level is:     128 (minimum power consumption without standby)
Rd look-ahead is: Enabled
Write cache is:   Enabled
ATA Security is:  Disabled, frozen [SEC2]
Unexpected SCT status 0xffff (action_code=4, function_code=2)
Wt Cache Reorder: Unknown (SCT Feature Control command failed)

=== START OF READ SMART DATA SECTION ===
SMART overall-health self-assessment test result: PASSED

General SMART Values:
Offline data collection status:  (0x00)	Offline data collection activity
					was never started.
					Auto Offline Data Collection: Disabled.
Self-test execution status:      (   0)	The previous self-test routine completed
					without error or no self-test has ever 
					been run.
Total time to complete Offline 
data collection: 		(  426) seconds.
Offline data collection
capabilities: 			 (0x53) SMART execute Offline immediate.
					Auto Offline data collection on/off support.
					Suspend Offline collection upon new
					command.
					No Offline surface scan supported.
					Self-test supported.
					No Conveyance Self-test supported.
					Selective Self-test supported.
SMART capabilities:            (0x0003)	Saves SMART data before entering
					power-saving mode.
					Supports SMART auto save timer.
Error logging capability:        (0x01)	Error logging supported.
					General Purpose Logging supported.
Short self-test routine 
recommended polling time: 	 (   2) minutes.
Extended self-test routine
recommended polling time: 	 (  77) minutes.
SCT capabilities: 	       (0x0035)	SCT Status supported.
					SCT Feature Control supported.
					SCT Data Table supported.

SMART Attributes Data Structure revision number: 10
Vendor Specific SMART Attributes with Thresholds:
ID# ATTRIBUTE_NAME          FLAGS    VALUE WORST THRESH FAIL RAW_VALUE
  1 Raw_Read_Error_Rate     POSR--   100   253   006    -    0
  3 Spin_Up_Time            PO----   100   099   085    -    0
  4 Start_Stop_Count        -O--CK   040   040   020    -    62401
  5 Reallocated_Sector_Ct   PO--CK   100   100   036    -    0
  7 Seek_Error_Rate         POSR--   079   060   030    -    87157504
  9 Power_On_Hours          -O--CK   097   097   000    -    3087 (193 225 0)
 10 Spin_Retry_Count        PO--C-   100   099   034    -    0
 12 Power_Cycle_Count       -O--CK   097   097   020    -    3164
187 Reported_Uncorrect      -O--CK   100   100   000    -    0
189 High_Fly_Writes         -O-RCK   100   100   000    -    0
190 Airflow_Temperature_Cel -O---K   067   052   045    -    33 (Min/Max 12/48)
191 G-Sense_Error_Rate      -O--CK   100   100   000    -    82
192 Power-Off_Retract_Count -O--CK   100   100   000    -    135
193 Load_Cycle_Count        -O---K   001   001   000    -    616203
194 Temperature_Celsius     -O-RC-   033   048   000    -    33 (0 12 0 0 0)
195 Hardware_ECC_Recovered  -O--C-   066   046   000    -    70421939
196 Reallocated_Event_Count ----C-   097   097   000    -    2837 (50505 0)
197 Current_Pending_Sector  -OSRCK   100   100   000    -    0
198 Offline_Uncorrectable   ------   100   100   000    -    0
199 UDMA_CRC_Error_Count    -O--CK   200   200   000    -    3
200 Multi_Zone_Error_Rate   ------   100   253   000    -    0
202 Data_Address_Mark_Errs  ------   100   253   000    -    0
240 Head_Flying_Hours       ------   000   000   000    -    0
241 Total_LBAs_Written      ------   000   000   000    -    4026515707
242 Total_LBAs_Read         ------   000   000   000    -    28572
                            ||||||_ K auto-keep
                            |||||__ C event count
                            ||||___ R error rate
                            |||____ S speed/performance
                            ||_____ O updated online
                            |______ P prefailure warning

General Purpose Log Directory Version 1
SMART           Log Directory Version 1 [multi-sector log support]
Address    Access  R/W   Size  Description
0x00       GPL,SL  R/O      1  Log Directory
0x01       GPL,SL  R/O      1  Summary SMART error log
0x02       GPL,SL  R/O      5  Comprehensive SMART error log
0x03       GPL,SL  R/O      5  Ext. Comprehensive SMART error log
0x06       GPL,SL  R/O      1  SMART self-test log
0x07       GPL,SL  R/O      1  Extended self-test log
0x09       GPL,SL  R/W      1  Selective self-test log
0x10       GPL,SL  R/O      1  NCQ Command Error log
0x11       GPL,SL  R/O      1  SATA Phy Event Counters
0x20       GPL,SL  R/O      1  Streaming performance log [OBS-8]
0x21       GPL,SL  R/O      1  Write stream error log
0x22       GPL,SL  R/O      1  Read stream error log
0x23       GPL,SL  R/O      1  Delayed sector log [OBS-8]
0x80-0x9f  GPL,SL  R/W     16  Host vendor specific log
0xa0       GPL,SL  VS       1  Device vendor specific log
0xa1       GPL,SL  VS      20  Device vendor specific log
0xa2       GPL,SL  VS     101  Device vendor specific log
0xa8       GPL,SL  VS      20  Device vendor specific log
0xa9       GPL,SL  VS       1  Device vendor specific log
0xe0       GPL,SL  R/W      1  SCT Command/Status
0xe1       GPL,SL  R/W      1  SCT Data Transfer
0xff       GPL     -    23040  Reserved

SMART Extended Comprehensive Error Log Version: 1 (5 sectors)
Device Error Count: 2
	CR     = Command Register
	FEATR  = Features Register
	COUNT  = Count (was: Sector Count) Register
	LBA_48 = Upper bytes of LBA High/Mid/Low Registers ]  ATA-8
	LH     = LBA High (was: Cylinder High) Register    ]   LBA
	LM     = LBA Mid (was: Cylinder Low) Register      ] Register
	LL     = LBA Low (was: Sector Number) Register     ]
	DV     = Device (was: Device/Head) Register
	DC     = Device Control Register
	ER     = Error register
	ST     = Status register
Powered_Up_Time is measured from power on, and printed as
DDd+hh:mm:SS.sss where DD=days, hh=hours, mm=minutes,
SS=sec, and sss=millisec. It "wraps" after 49.710 days.

Error 2 [1] occurred at disk power-on lifetime: 2714 hours (113 days + 2 hours)
  When the command that caused the error occurred, the device was active or idle.

  After command completion occurred, registers were:
  ER -- ST COUNT  LBA_48  LH LM LL DV DC
  -- -- -- == -- == == == -- -- -- -- --
  84 -- 41 00 fe 00 00 70 00 67 d6 40 00  Error: ICRC, ABRT at LBA = 0x700067d6 = 1879074774

  Commands leading to the command that caused the error were:
  CR FEATR COUNT  LBA_48  LH LM LL DV DC  Powered_Up_Time  Command/Feature_Name
  -- == -- == -- == == == -- -- -- -- --  ---------------  --------------------
  61 00 80 00 00 00 00 00 00 00 10 40 00     03:26:12.875  WRITE FPDMA QUEUED
  2f 00 00 00 01 00 00 00 00 00 10 40 00     03:26:12.873  READ LOG EXT
  60 00 40 00 40 00 12 9e 00 a1 81 00 00     03:26:12.872  READ FPDMA QUEUED
  60 00 40 00 40 00 12 9e 00 a1 41 00 00     03:26:13.991  READ FPDMA QUEUED
  60 00 40 00 40 00 12 9e 00 a1 01 00 00     03:26:12.887  READ FPDMA QUEUED

Error 1 [0] occurred at disk power-on lifetime: 2714 hours (113 days + 2 hours)
  When the command that caused the error occurred, the device was active or idle.

  After command completion occurred, registers were:
  ER -- ST COUNT  LBA_48  LH LM LL DV DC
  -- -- -- == -- == == == -- -- -- -- --
  84 -- 41 00 e8 00 00 70 00 67 d6 40 00  Error: ABRT

  Commands leading to the command that caused the error were:
  CR FEATR COUNT  LBA_48  LH LM LL DV DC  Powered_Up_Time  Command/Feature_Name
  -- == -- == -- == == == -- -- -- -- --  ---------------  --------------------
  2f 00 00 00 01 00 00 00 00 00 10 40 00     03:26:12.875  READ LOG EXT
  60 00 40 00 40 00 12 9e 00 a1 81 00 00     03:26:12.873  READ FPDMA QUEUED
  60 00 40 00 40 00 12 9e 00 a1 41 00 00     03:26:12.872  READ FPDMA QUEUED
  60 00 40 00 40 00 12 9e 00 a1 01 00 00     03:26:12.871  READ FPDMA QUEUED
  60 00 40 00 40 00 12 9d 00 a1 c1 00 00     03:26:12.887  READ FPDMA QUEUED

SMART Extended Self-test Log Version: 1 (1 sectors)
Num  Test_Description    Status                  Remaining  LifeTime(hours)  LBA_of_first_error
# 1  Short offline       Completed without error       00%      3084         -
# 2  Short offline       Completed without error       00%      3076         -
# 3  Extended offline    Interrupted (host reset)      80%      3075         -
# 4  Short offline       Interrupted (host reset)      70%      3067         -
# 5  Extended offline    Completed without error       00%      3063         -
# 6  Short offline       Completed without error       00%      3061         -
# 7  Short offline       Aborted by host               80%      3042         -
# 8  Short offline       Aborted by host               80%      3042         -
# 9  Short offline       Completed without error       00%      2966         -
#10  Short offline       Completed without error       00%      2965         -
#11  Short offline       Completed without error       00%      2950         -
#12  Short offline       Completed without error       00%      2826         -
#13  Short offline       Completed without error       00%      2817         -
#14  Short offline       Completed without error       00%      2781         -
#15  Short offline       Interrupted (host reset)      10%        65         -
#16  Short offline       Completed without error       00%         1         -
#17  Short offline       Completed without error       00%         0         -

SMART Selective self-test log data structure revision number 1
 SPAN  MIN_LBA  MAX_LBA  CURRENT_TEST_STATUS
    1        0        0  Not_testing
    2        0        0  Not_testing
    3        0        0  Not_testing
    4        0        0  Not_testing
    5        0        0  Not_testing
Selective self-test flags (0x0):
  After scanning selected spans, do NOT read-scan remainder of disk.
If Selective self-test is pending on power-up, resume after 0 minute delay.

SCT Status Version:                  3
SCT Version (vendor specific):       521 (0x0209)
SCT Support Level:                   1
Device State:                        Active (0)
Current Temperature:                    33 Celsius
Power Cycle Min/Max Temperature:     100/ 0 Celsius
Lifetime    Min/Max Temperature:     13/48 Celsius
Lifetime    Average Temperature:        34 Celsius
Under/Over Temperature Limit Count:   0/0

Another SCT command is executing, abort Read Data Table
(SCT ext_status_code 0xffff, action_code=4, function_code=2)
Read SCT Temperature History failed

SCT Error Recovery Control command not supported

Device Statistics (GP Log 0x04) not supported

SATA Phy Event Counters (GP Log 0x11)
ID      Size     Value  Description
0x000a  2            4  Device-to-host register FISes sent due to a COMRESET
0x0001  2            0  Command failed due to ICRC error
0x0003  2            0  R_ERR response for device-to-host data FIS
0x0004  2            0  R_ERR response for host-to-device data FIS
0x0006  2            0  R_ERR response for device-to-host non-data FIS
0x0007  2            0  R_ERR response for host-to-device non-data FIS
0x0009  2            3  Transition from drive PhyRdy to drive PhyNRdy
0x8002  2            0  Vendor specific
0x8003  2            4  Vendor specific
0x8004  2            0  Vendor specific

