smartctl 7.3 2022-02-28 r5338 [x86_64-linux-6.6.12-1-liquorix-amd64] (local build)
Copyright (C) 2002-22, Bruce Allen, Christian Franke, www.smartmontools.org

=== START OF INFORMATION SECTION ===
Model Number:                       Sabrent SB-RKT4P-2TB
Serial Number:                      --
Firmware Version:                   R4PB47.4
PCI Vendor/Subsystem ID:            0x1987
IEEE OUI Identifier:                0x6479a7
Total NVM Capacity:                 2,000,398,934,016 [2.00 TB]
Unallocated NVM Capacity:           0
Controller ID:                      1
NVMe Version:                       1.4
Number of Namespaces:               1
Namespace 1 Size/Capacity:          2,000,398,934,016 [2.00 TB]
Namespace 1 Formatted LBA Size:     512
Namespace 1 IEEE EUI-64:            6479a7 ...
Local Time is:                      Sun Feb 16 20:49:16 2025 CET
Firmware Updates (0x12):            1 Slot, no Reset required
Optional Admin Commands (0x0017):   Security Format Frmw_DL Self_Test
Optional NVM Commands (0x005d):     Comp DS_Mngmt Wr_Zero Sav/Sel_Feat Timestmp
Log Page Attributes (0x08):         Telmtry_Lg
Maximum Data Transfer Size:         512 Pages
Warning  Comp. Temp. Threshold:     84 Celsius
Critical Comp. Temp. Threshold:     89 Celsius

Supported Power States
St Op     Max   Active     Idle   RL RT WL WT  Ent_Lat  Ex_Lat
 0 +     8.80W       -        -    0  0  0  0        0       0
 1 +     7.10W       -        -    1  1  1  1        0       0
 2 +     5.20W       -        -    2  2  2  2        0       0
 3 -   0.0620W       -        -    3  3  3  3     2500    7500
 4 -   0.0440W       -        -    4  4  4  4    10500   65000

Supported LBA Sizes (NSID 0x1)
Id Fmt  Data  Metadt  Rel_Perf
 0 +     512       0         2
 1 -    4096       0         1

=== START OF SMART DATA SECTION ===
SMART overall-health self-assessment test result: PASSED

SMART/Health Information (NVMe Log 0x02)
Critical Warning:                   0x00
Temperature:                        38 Celsius
Available Spare:                    100%
Available Spare Threshold:          5%
Percentage Used:                    4%
Data Units Read:                    34,103,739 [17.4 TB]
Data Units Written:                 25,251,216 [12.9 TB]
Host Read Commands:                 188,459,827
Host Write Commands:                193,838,691
Controller Busy Time:               8,578
Power Cycles:                       863
Power On Hours:                     10,152
Unsafe Shutdowns:                   81
Media and Data Integrity Errors:    4,697
Error Information Log Entries:      5,725
Warning  Comp. Temperature Time:    0
Critical Comp. Temperature Time:    0

Error Information (NVMe Log 0x01, 16 of 63 entries)
Num   ErrCount  SQId   CmdId  Status  PELoc          LBA  NSID    VS
  0       5725     0  0x1003  0x4004  0x028            0     0     -



