smartctl 7.1 2019-12-30 r5022 [x86_64-linux-5.8.0-26-generic] (local build)
Copyright (C) 2002-19, Bruce Allen, Christian Franke, www.smartmontools.org

=== START OF INFORMATION SECTION ===
Model Family:     Seagate Barracuda 7200.12
Device Model:     ST31000528AS
Serial Number:    --
LU WWN Device Id: 5 000c50 ...
Firmware Version: AP4C
User Capacity:    1,000,204,886,016 bytes [1.00 TB]
Sector Size:      512 bytes logical/physical
Rotation Rate:    7200 rpm
Device is:        In smartctl database [for details use: -P show]
ATA Version is:   ATA8-ACS T13/1699-D revision 4
SATA Version is:  SATA 2.6, 3.0 Gb/s
Local Time is:    Sun Nov  8 19:46:13 2020 AEST

==> WARNING: A firmware update for this drive may be available,
see the following Seagate web pages:
http://knowledge.seagate.com/articles/en_US/FAQ/207931en
http://knowledge.seagate.com/articles/en_US/FAQ/213891en

SMART support is: Available - device has SMART capability.
SMART support is: Enabled
AAM feature is:   Unavailable
APM feature is:   Unavailable
Rd look-ahead is: Enabled
Write cache is:   Enabled
DSN feature is:   Unavailable
ATA Security is:  Disabled, frozen [SEC2]
Wt Cache Reorder: Unknown

=== START OF READ SMART DATA SECTION ===
SMART overall-health self-assessment test result: PASSED
See vendor-specific Attribute list for marginal Attributes.

General SMART Values:
Offline data collection status:  (0x82)	Offline data collection activity
					was completed without error.
					Auto Offline Data Collection: Enabled.
Self-test execution status:      (   0)	The previous self-test routine completed
					without error or no self-test has ever 
					been run.
Total time to complete Offline 
data collection: 		(  600) seconds.
Offline data collection
capabilities: 			 (0x7b) SMART execute Offline immediate.
					Auto Offline data collection on/off support.
					Suspend Offline collection upon new
					command.
					Offline surface scan supported.
					Self-test supported.
					Conveyance Self-test supported.
					Selective Self-test supported.
SMART capabilities:            (0x0003)	Saves SMART data before entering
					power-saving mode.
					Supports SMART auto save timer.
Error logging capability:        (0x01)	Error logging supported.
					General Purpose Logging supported.
Short self-test routine 
recommended polling time: 	 (   1) minutes.
Extended self-test routine
recommended polling time: 	 ( 172) minutes.
Conveyance self-test routine
recommended polling time: 	 (   2) minutes.
SCT capabilities: 	       (0x103f)	SCT Status supported.
					SCT Error Recovery Control supported.
					SCT Feature Control supported.
					SCT Data Table supported.

SMART Attributes Data Structure revision number: 10
Vendor Specific SMART Attributes with Thresholds:
ID# ATTRIBUTE_NAME          FLAGS    VALUE WORST THRESH FAIL RAW_VALUE
  1 Raw_Read_Error_Rate     -OSR--   120   099   006    -    236313983
  3 Spin_Up_Time            PO----   100   100   000    -    0
  4 Start_Stop_Count        -O--CK   089   089   020    -    12097
  5 Reallocated_Sector_Ct   PO--CK   099   099   036    -    71
  7 Seek_Error_Rate         POSR--   081   060   030    -    136845200
  9 Power_On_Hours          -O--CK   081   081   000    -    16859
 10 Spin_Retry_Count        PO--C-   100   100   097    -    0
 12 Power_Cycle_Count       -O--CK   090   090   020    -    10693
184 End-to-End_Error        -O--CK   100   100   099    -    0
187 Reported_Uncorrect      -O--CK   090   090   000    -    10
188 Command_Timeout         -O--CK   100   100   000    -    0
189 High_Fly_Writes         -O-RCK   100   100   000    -    0
190 Airflow_Temperature_Cel -O---K   062   044   045    Past 38 (Min/Max 35/42 #14)
194 Temperature_Celsius     -O---K   038   056   000    -    38 (0 19 0 0 0)
195 Hardware_ECC_Recovered  -O-RC-   031   022   000    -    236313983
197 Current_Pending_Sector  -O--C-   100   099   000    -    0
198 Offline_Uncorrectable   ----C-   100   099   000    -    0
199 UDMA_CRC_Error_Count    -OSRCK   200   200   000    -    0
                            ||||||_ K auto-keep
                            |||||__ C event count
                            ||||___ R error rate
                            |||____ S speed/performance
                            ||_____ O updated online
                            |______ P prefailure warning

General Purpose Log Directory Version 1
SMART           Log Directory Version 1 [multi-sector log support]
Address    Access  R/W   Size  Description
0x00       GPL,SL  R/O      1  Log Directory
0x01       GPL,SL  R/O      1  Summary SMART error log
0x02       GPL,SL  R/O      5  Comprehensive SMART error log
0x03       GPL     R/O      5  Ext. Comprehensive SMART error log
0x06       GPL,SL  R/O      1  SMART self-test log
0x07       GPL     R/O      1  Extended self-test log
0x09       GPL,SL  R/W      1  Selective self-test log
0x10       GPL     R/O      1  NCQ Command Error log
0x11       GPL     R/O      1  SATA Phy Event Counters log
0x21       GPL     R/O      1  Write stream error log
0x22       GPL     R/O      1  Read stream error log
0x80-0x9f  GPL,SL  R/W     16  Host vendor specific log
0xa1       GPL,SL  VS     132  Device vendor specific log
0xa2       GPL     VS    2248  Device vendor specific log
0xa5       GPL,SL  VS     132  Device vendor specific log
0xa8       GPL,SL  VS     129  Device vendor specific log
0xa9       GPL,SL  VS       1  Device vendor specific log
0xb0       GPL     VS    3040  Device vendor specific log
0xbd       GPL     VS     252  Device vendor specific log
0xbe-0xbf  GPL     VS   65535  Device vendor specific log
0xe0       GPL,SL  R/W      1  SCT Command/Status
0xe1       GPL,SL  R/W      1  SCT Data Transfer

SMART Extended Comprehensive Error Log Version: 1 (5 sectors)
Device Error Count: 10
	CR     = Command Register
	FEATR  = Features Register
	COUNT  = Count (was: Sector Count) Register
	LBA_48 = Upper bytes of LBA High/Mid/Low Registers ]  ATA-8
	LH     = LBA High (was: Cylinder High) Register    ]   LBA
	LM     = LBA Mid (was: Cylinder Low) Register      ] Register
	LL     = LBA Low (was: Sector Number) Register     ]
	DV     = Device (was: Device/Head) Register
	DC     = Device Control Register
	ER     = Error register
	ST     = Status register
Powered_Up_Time is measured from power on, and printed as
DDd+hh:mm:SS.sss where DD=days, hh=hours, mm=minutes,
SS=sec, and sss=millisec. It "wraps" after 49.710 days.

Error 10 [9] occurred at disk power-on lifetime: 12750 hours (531 days + 6 hours)
  When the command that caused the error occurred, the device was active or idle.

  After command completion occurred, registers were:
  ER -- ST COUNT  LBA_48  LH LM LL DV DC
  -- -- -- == -- == == == -- -- -- -- --
  40 -- 51 00 00 00 00 00 ce 4a 53 00 00  Error: UNC at LBA = 0x00ce4a53 = 13519443

  Commands leading to the command that caused the error were:
  CR FEATR COUNT  LBA_48  LH LM LL DV DC  Powered_Up_Time  Command/Feature_Name
  -- == -- == -- == == == -- -- -- -- --  ---------------  --------------------
  25 00 00 07 f8 00 00 00 ce 48 68 40 00     00:00:33.062  READ DMA EXT
  25 00 00 07 f8 00 00 00 ce 48 68 40 00     00:00:30.281  READ DMA EXT
  25 00 00 07 f8 00 00 00 ce 48 68 40 00     00:00:27.542  READ DMA EXT
  25 00 00 07 f8 00 00 00 ce 48 68 40 00     00:00:24.802  READ DMA EXT
  2f 00 00 00 01 00 00 00 00 00 10 00 00     00:00:24.487  READ LOG EXT

Error 9 [8] occurred at disk power-on lifetime: 12750 hours (531 days + 6 hours)
  When the command that caused the error occurred, the device was active or idle.

  After command completion occurred, registers were:
  ER -- ST COUNT  LBA_48  LH LM LL DV DC
  -- -- -- == -- == == == -- -- -- -- --
  40 -- 51 00 00 00 00 00 ce 4a 53 00 00  Error: UNC at LBA = 0x00ce4a53 = 13519443

  Commands leading to the command that caused the error were:
  CR FEATR COUNT  LBA_48  LH LM LL DV DC  Powered_Up_Time  Command/Feature_Name
  -- == -- == -- == == == -- -- -- -- --  ---------------  --------------------
  25 00 00 07 f8 00 00 00 ce 48 68 40 00     00:00:30.281  READ DMA EXT
  25 00 00 07 f8 00 00 00 ce 48 68 40 00     00:00:27.542  READ DMA EXT
  25 00 00 07 f8 00 00 00 ce 48 68 40 00     00:00:24.802  READ DMA EXT
  2f 00 00 00 01 00 00 00 00 00 10 00 00     00:00:24.487  READ LOG EXT
  60 00 00 07 f8 00 00 00 ce 48 68 40 00     00:00:21.866  READ FPDMA QUEUED

Error 8 [7] occurred at disk power-on lifetime: 12750 hours (531 days + 6 hours)
  When the command that caused the error occurred, the device was active or idle.

  After command completion occurred, registers were:
  ER -- ST COUNT  LBA_48  LH LM LL DV DC
  -- -- -- == -- == == == -- -- -- -- --
  40 -- 51 00 00 00 00 00 ce 4a 53 00 00  Error: UNC at LBA = 0x00ce4a53 = 13519443

  Commands leading to the command that caused the error were:
  CR FEATR COUNT  LBA_48  LH LM LL DV DC  Powered_Up_Time  Command/Feature_Name
  -- == -- == -- == == == -- -- -- -- --  ---------------  --------------------
  25 00 00 07 f8 00 00 00 ce 48 68 40 00     00:00:27.542  READ DMA EXT
  25 00 00 07 f8 00 00 00 ce 48 68 40 00     00:00:24.802  READ DMA EXT
  2f 00 00 00 01 00 00 00 00 00 10 00 00     00:00:24.487  READ LOG EXT
  60 00 00 07 f8 00 00 00 ce 48 68 40 00     00:00:21.866  READ FPDMA QUEUED
  60 00 00 08 00 00 00 00 ce 40 68 40 00     00:00:21.849  READ FPDMA QUEUED

Error 7 [6] occurred at disk power-on lifetime: 12750 hours (531 days + 6 hours)
  When the command that caused the error occurred, the device was active or idle.

  After command completion occurred, registers were:
  ER -- ST COUNT  LBA_48  LH LM LL DV DC
  -- -- -- == -- == == == -- -- -- -- --
  40 -- 51 00 00 00 00 00 ce 4a 53 00 00  Error: UNC at LBA = 0x00ce4a53 = 13519443

  Commands leading to the command that caused the error were:
  CR FEATR COUNT  LBA_48  LH LM LL DV DC  Powered_Up_Time  Command/Feature_Name
  -- == -- == -- == == == -- -- -- -- --  ---------------  --------------------
  25 00 00 07 f8 00 00 00 ce 48 68 40 00     00:00:24.802  READ DMA EXT
  2f 00 00 00 01 00 00 00 00 00 10 00 00     00:00:24.487  READ LOG EXT
  60 00 00 07 f8 00 00 00 ce 48 68 40 00     00:00:21.866  READ FPDMA QUEUED
  60 00 00 08 00 00 00 00 ce 40 68 40 00     00:00:21.849  READ FPDMA QUEUED
  60 00 00 00 08 00 00 00 ca 40 38 40 00     00:00:21.842  READ FPDMA QUEUED

Error 6 [5] occurred at disk power-on lifetime: 12750 hours (531 days + 6 hours)
  When the command that caused the error occurred, the device was active or idle.

  After command completion occurred, registers were:
  ER -- ST COUNT  LBA_48  LH LM LL DV DC
  -- -- -- == -- == == == -- -- -- -- --
  40 -- 51 00 00 00 00 00 ce 4a 53 00 00  Error: UNC at LBA = 0x00ce4a53 = 13519443

  Commands leading to the command that caused the error were:
  CR FEATR COUNT  LBA_48  LH LM LL DV DC  Powered_Up_Time  Command/Feature_Name
  -- == -- == -- == == == -- -- -- -- --  ---------------  --------------------
  60 00 00 07 f8 00 00 00 ce 48 68 40 00     00:00:21.866  READ FPDMA QUEUED
  60 00 00 08 00 00 00 00 ce 40 68 40 00     00:00:21.849  READ FPDMA QUEUED
  60 00 00 00 08 00 00 00 ca 40 38 40 00     00:00:21.842  READ FPDMA QUEUED
  60 00 00 00 08 00 00 00 ca 40 28 40 00     00:00:21.834  READ FPDMA QUEUED
  60 00 00 00 10 00 00 00 70 9f a8 40 00     00:00:21.830  READ FPDMA QUEUED

Error 5 [4] occurred at disk power-on lifetime: 12748 hours (531 days + 4 hours)
  When the command that caused the error occurred, the device was active or idle.

  After command completion occurred, registers were:
  ER -- ST COUNT  LBA_48  LH LM LL DV DC
  -- -- -- == -- == == == -- -- -- -- --
  40 -- 51 00 00 00 00 00 ce 4a 53 00 00  Error: UNC at LBA = 0x00ce4a53 = 13519443

  Commands leading to the command that caused the error were:
  CR FEATR COUNT  LBA_48  LH LM LL DV DC  Powered_Up_Time  Command/Feature_Name
  -- == -- == -- == == == -- -- -- -- --  ---------------  --------------------
  25 00 00 08 00 00 00 00 ce 48 60 40 00     00:01:00.512  READ DMA EXT
  25 00 00 08 00 00 00 00 ce 48 60 40 00     00:00:57.781  READ DMA EXT
  25 00 00 08 00 00 00 00 ce 48 60 40 00     00:00:55.085  READ DMA EXT
  25 00 00 00 30 00 00 04 e7 75 68 40 00     00:00:55.072  READ DMA EXT
  25 00 00 00 98 00 00 08 44 56 08 40 00     00:00:54.959  READ DMA EXT

Error 4 [3] occurred at disk power-on lifetime: 12748 hours (531 days + 4 hours)
  When the command that caused the error occurred, the device was active or idle.

  After command completion occurred, registers were:
  ER -- ST COUNT  LBA_48  LH LM LL DV DC
  -- -- -- == -- == == == -- -- -- -- --
  40 -- 51 00 00 00 00 00 ce 4a 53 00 00  Error: UNC at LBA = 0x00ce4a53 = 13519443

  Commands leading to the command that caused the error were:
  CR FEATR COUNT  LBA_48  LH LM LL DV DC  Powered_Up_Time  Command/Feature_Name
  -- == -- == -- == == == -- -- -- -- --  ---------------  --------------------
  25 00 00 08 00 00 00 00 ce 48 60 40 00     00:00:57.781  READ DMA EXT
  25 00 00 08 00 00 00 00 ce 48 60 40 00     00:00:55.085  READ DMA EXT
  25 00 00 00 30 00 00 04 e7 75 68 40 00     00:00:55.072  READ DMA EXT
  25 00 00 00 98 00 00 08 44 56 08 40 00     00:00:54.959  READ DMA EXT
  25 00 00 08 00 00 00 00 ce 48 60 40 00     00:00:52.241  READ DMA EXT

Error 3 [2] occurred at disk power-on lifetime: 12748 hours (531 days + 4 hours)
  When the command that caused the error occurred, the device was active or idle.

  After command completion occurred, registers were:
  ER -- ST COUNT  LBA_48  LH LM LL DV DC
  -- -- -- == -- == == == -- -- -- -- --
  40 -- 51 00 00 00 00 00 ce 4a 53 00 00  Error: UNC at LBA = 0x00ce4a53 = 13519443

  Commands leading to the command that caused the error were:
  CR FEATR COUNT  LBA_48  LH LM LL DV DC  Powered_Up_Time  Command/Feature_Name
  -- == -- == -- == == == -- -- -- -- --  ---------------  --------------------
  25 00 00 08 00 00 00 00 ce 48 60 40 00     00:00:55.085  READ DMA EXT
  25 00 00 00 30 00 00 04 e7 75 68 40 00     00:00:55.072  READ DMA EXT
  25 00 00 00 98 00 00 08 44 56 08 40 00     00:00:54.959  READ DMA EXT
  25 00 00 08 00 00 00 00 ce 48 60 40 00     00:00:52.241  READ DMA EXT
  ef 00 02 00 00 00 00 00 00 00 00 00 00     00:00:52.240  SET FEATURES [Enable write cache]

SMART Extended Self-test Log Version: 1 (1 sectors)
No self-tests have been logged.  [To run self-tests, use: smartctl -t]

SMART Selective self-test log data structure revision number 1
 SPAN  MIN_LBA  MAX_LBA  CURRENT_TEST_STATUS
    1        0        0  Not_testing
    2        0        0  Not_testing
    3        0        0  Not_testing
    4        0        0  Not_testing
    5        0        0  Not_testing
Selective self-test flags (0x0):
  After scanning selected spans, do NOT read-scan remainder of disk.
If Selective self-test is pending on power-up, resume after 0 minute delay.

SCT Status Version:                  3
SCT Version (vendor specific):       522 (0x020a)
Device State:                        Active (0)
Current Temperature:                    38 Celsius
Power Cycle Min/Max Temperature:     35/42 Celsius
Lifetime    Min/Max Temperature:     19/58 Celsius
Under/Over Temperature Limit Count:   0/0

SCT Temperature History Version:     2
Temperature Sampling Period:         1 minute
Temperature Logging Interval:        59 minutes
Min/Max recommended Temperature:      3/62 Celsius
Min/Max Temperature Limit:            0/65 Celsius
Temperature History Size (Index):    128 (46)

SCT Error Recovery Control:
           Read: Disabled
          Write: Disabled

Device Statistics (GP/SMART Log 0x04) not supported

Pending Defects log (GP Log 0x0c) not supported

SATA Phy Event Counters (GP Log 0x11)
ID      Size     Value  Description
0x000a  2           41  Device-to-host register FISes sent due to a COMRESET
0x0001  2            0  Command failed due to ICRC error
0x0003  2            0  R_ERR response for device-to-host data FIS
0x0004  2            0  R_ERR response for host-to-device data FIS
0x0006  2            0  R_ERR response for device-to-host non-data FIS
0x0007  2            0  R_ERR response for host-to-device non-data FIS

