=== START OF INFORMATION SECTION ===
Model Family:     Seagate Barracuda 7200.12
Device Model:     ST31000528AS
Serial Number:    --
LU WWN Device Id: 5 000c50 ...
Firmware Version: CC38
User Capacity:    1,000,204,886,016 bytes [1.00 TB]
Sector Size:      512 bytes logical/physical
Rotation Rate:    7200 rpm
Device is:        In smartctl database [for details use: -P show]
ATA Version is:   ATA8-ACS T13/1699-D revision 4
SATA Version is:  SATA 2.6, 3.0 Gb/s
Local Time is:    Mon Aug 17 16:51:35 2020 WEST

==> WARNING: A firmware update for this drive may be available,
see the following Seagate web pages:
http://knowledge.seagate.com/articles/en_US/FAQ/207931en
http://knowledge.seagate.com/articles/en_US/FAQ/213891en

SMART support is: Available - device has SMART capability.
SMART support is: Enabled
AAM feature is:   Disabled
APM feature is:   Unavailable
Rd look-ahead is: Enabled
Write cache is:   Enabled
DSN feature is:   Unavailable
ATA Security is:  Disabled, NOT FROZEN [SEC1]
Wt Cache Reorder: Unknown

=== START OF READ SMART DATA SECTION ===
SMART Status not supported: Incomplete response, ATA output registers missing
SMART overall-health self-assessment test result: FAILED!
Drive failure expected in less than 24 hours. SAVE ALL DATA.
Warning: This result is based on an Attribute check.
See vendor-specific Attribute list for failed Attributes.

General SMART Values:
Offline data collection status:  (0x82)	Offline data collection activity
					was completed without error.
					Auto Offline Data Collection: Enabled.
Self-test execution status:      (   0)	The previous self-test routine completed
					without error or no self-test has ever 
					been run.
Total time to complete Offline 
data collection: 		(  609) seconds.
Offline data collection
capabilities: 			 (0x7b) SMART execute Offline immediate.
					Auto Offline data collection on/off support.
					Suspend Offline collection upon new
					command.
					Offline surface scan supported.
					Self-test supported.
					Conveyance Self-test supported.
					Selective Self-test supported.
SMART capabilities:            (0x0003)	Saves SMART data before entering
					power-saving mode.
					Supports SMART auto save timer.
Error logging capability:        (0x01)	Error logging supported.
					General Purpose Logging supported.
Short self-test routine 
recommended polling time: 	 (   1) minutes.
Extended self-test routine
recommended polling time: 	 ( 182) minutes.
Conveyance self-test routine
recommended polling time: 	 (   2) minutes.
SCT capabilities: 	       (0x103f)	SCT Status supported.
					SCT Error Recovery Control supported.
					SCT Feature Control supported.
					SCT Data Table supported.

SMART Attributes Data Structure revision number: 10
Vendor Specific SMART Attributes with Thresholds:
ID# ATTRIBUTE_NAME          FLAGS    VALUE WORST THRESH FAIL RAW_VALUE
  1 Raw_Read_Error_Rate     POSR--   117   090   006    -    125567150
  3 Spin_Up_Time            PO----   095   093   000    -    0
  4 Start_Stop_Count        -O--CK   090   090   020    -    10508
  5 Reallocated_Sector_Ct   PO--CK   003   003   036    NOW  3998
  7 Seek_Error_Rate         POSR--   070   060   030    -    12086545
  9 Power_On_Hours          -O--CK   089   089   000    -    10005
 10 Spin_Retry_Count        PO--C-   100   100   097    -    0
 12 Power_Cycle_Count       -O--CK   095   095   020    -    5931
183 Runtime_Bad_Block       -O--CK   001   001   000    -    23244
184 End-to-End_Error        -O--CK   100   100   099    -    0
187 Reported_Uncorrect      -O--CK   085   085   000    -    15
188 Command_Timeout         -O--CK   100   072   000    -    137444786539
189 High_Fly_Writes         -O-RCK   100   100   000    -    0
190 Airflow_Temperature_Cel -O---K   048   046   045    -    52 (Min/Max 46/52)
194 Temperature_Celsius     -O---K   052   054   000    -    52 (0 17 0 0 0)
195 Hardware_ECC_Recovered  -O-RC-   042   023   000    -    125567150
197 Current_Pending_Sector  -O--C-   100   100   000    -    0
198 Offline_Uncorrectable   ----C-   100   100   000    -    0
199 UDMA_CRC_Error_Count    -OSRCK   200   189   000    -    852
240 Head_Flying_Hours       ------   100   253   000    -    17073 (192 35 0)
241 Total_LBAs_Written      ------   100   253   000    -    186172383
242 Total_LBAs_Read         ------   100   253   000    -    4165614982
                            ||||||_ K auto-keep
                            |||||__ C event count
                            ||||___ R error rate
                            |||____ S speed/performance
                            ||_____ O updated online
                            |______ P prefailure warning

General Purpose Log Directory Version 1
SMART           Log Directory Version 1 [multi-sector log support]
Address    Access  R/W   Size  Description
0x00       GPL,SL  R/O      1  Log Directory
0x01       GPL,SL  R/O      1  Summary SMART error log
0x02       GPL,SL  R/O      5  Comprehensive SMART error log
0x03       GPL     R/O      5  Ext. Comprehensive SMART error log
0x06       GPL,SL  R/O      1  SMART self-test log
0x07       GPL     R/O      1  Extended self-test log
0x09       GPL,SL  R/W      1  Selective self-test log
0x10       GPL     R/O      1  NCQ Command Error log
0x11       GPL     R/O      1  SATA Phy Event Counters log
0x21       GPL     R/O      1  Write stream error log
0x22       GPL     R/O      1  Read stream error log
0x80-0x9f  GPL,SL  R/W     16  Host vendor specific log
0xa1       GPL,SL  VS      20  Device vendor specific log
0xa2       GPL     VS    2248  Device vendor specific log
0xa8       GPL,SL  VS     129  Device vendor specific log
0xa9       GPL,SL  VS       1  Device vendor specific log
0xb0       GPL     VS    2928  Device vendor specific log
0xbd       GPL     VS     252  Device vendor specific log
0xbe-0xbf  GPL     VS   65535  Device vendor specific log
0xc0       GPL,SL  VS       1  Device vendor specific log
0xe0       GPL,SL  R/W      1  SCT Command/Status
0xe1       GPL,SL  R/W      1  SCT Data Transfer

SMART Extended Comprehensive Error Log Version: 1 (5 sectors)
Device Error Count: 363 (device log contains only the most recent 20 errors)
	CR     = Command Register
	FEATR  = Features Register
	COUNT  = Count (was: Sector Count) Register
	LBA_48 = Upper bytes of LBA High/Mid/Low Registers ]  ATA-8
	LH     = LBA High (was: Cylinder High) Register    ]   LBA
	LM     = LBA Mid (was: Cylinder Low) Register      ] Register
	LL     = LBA Low (was: Sector Number) Register     ]
	DV     = Device (was: Device/Head) Register
	DC     = Device Control Register
	ER     = Error register
	ST     = Status register
Powered_Up_Time is measured from power on, and printed as
DDd+hh:mm:SS.sss where DD=days, hh=hours, mm=minutes,
SS=sec, and sss=millisec. It "wraps" after 49.710 days.

Error 363 [2] occurred at disk power-on lifetime: 5552 hours (231 days + 8 hours)
  When the command that caused the error occurred, the device was active or idle.

  After command completion occurred, registers were:
  ER -- ST COUNT  LBA_48  LH LM LL DV DC
  -- -- -- == -- == == == -- -- -- -- --
  04 -- 71 00 04 00 00 00 00 32 91 e0 00  Device Fault; Error: ABRT

  Commands leading to the command that caused the error were:
  CR FEATR COUNT  LBA_48  LH LM LL DV DC  Powered_Up_Time  Command/Feature_Name
  -- == -- == -- == == == -- -- -- -- --  ---------------  --------------------
  a1 00 00 00 00 00 00 00 00 00 00 a0 00     01:33:26.436  IDENTIFY PACKET DEVICE
  ec 00 00 00 00 00 00 00 00 00 00 a0 00     01:33:26.435  IDENTIFY DEVICE
  00 00 00 00 00 00 00 00 00 00 00 00 04     01:33:26.276  NOP [Abort queued commands]
  00 00 00 00 00 00 00 00 00 00 00 00 ff     01:33:25.957  NOP [Abort queued commands]
  00 00 00 00 00 00 00 00 00 00 00 00 04     01:31:50.065  NOP [Abort queued commands]

Error 362 [1] occurred at disk power-on lifetime: 5552 hours (231 days + 8 hours)
  When the command that caused the error occurred, the device was active or idle.

  After command completion occurred, registers were:
  ER -- ST COUNT  LBA_48  LH LM LL DV DC
  -- -- -- == -- == == == -- -- -- -- --
  04 -- 71 00 04 00 00 00 00 32 91 e0 00

  Commands leading to the command that caused the error were:
  CR FEATR COUNT  LBA_48  LH LM LL DV DC  Powered_Up_Time  Command/Feature_Name
  -- == -- == -- == == == -- -- -- -- --  ---------------  --------------------
  ec 00 00 00 00 00 00 00 00 00 00 a0 00     01:33:26.435  IDENTIFY DEVICE
  00 00 00 00 00 00 00 00 00 00 00 00 04     01:33:26.276  NOP [Abort queued commands]
  00 00 00 00 00 00 00 00 00 00 00 00 ff     01:33:25.957  NOP [Abort queued commands]
  00 00 00 00 00 00 00 00 00 00 00 00 04     01:31:50.065  NOP [Abort queued commands]
  00 00 00 00 00 00 00 00 00 00 00 00 04     01:31:48.689  NOP [Abort queued commands]

Error 361 [0] occurred at disk power-on lifetime: 5552 hours (231 days + 8 hours)
  When the command that caused the error occurred, the device was active or idle.

  After command completion occurred, registers were:
  ER -- ST COUNT  LBA_48  LH LM LL DV DC
  -- -- -- == -- == == == -- -- -- -- --
  04 -- 71 00 04 00 00 00 00 32 91 e0 00

  Commands leading to the command that caused the error were:
  CR FEATR COUNT  LBA_48  LH LM LL DV DC  Powered_Up_Time  Command/Feature_Name
  -- == -- == -- == == == -- -- -- -- --  ---------------  --------------------
  ec 00 00 00 04 00 00 00 00 32 91 a0 00     01:31:34.108  IDENTIFY DEVICE
  a1 00 00 00 01 00 00 00 00 00 01 a0 00     01:31:33.706  IDENTIFY PACKET DEVICE
  00 00 00 00 00 00 00 00 00 00 00 00 ff     01:31:23.863  NOP [Abort queued commands]
  00 00 00 00 00 00 00 00 00 00 00 00 ff     01:31:23.614  NOP [Abort queued commands]
  a1 00 00 00 00 00 00 00 00 00 00 a0 00     01:31:13.564  IDENTIFY PACKET DEVICE

Error 360 [19] occurred at disk power-on lifetime: 5552 hours (231 days + 8 hours)
  When the command that caused the error occurred, the device was active or idle.

  After command completion occurred, registers were:
  ER -- ST COUNT  LBA_48  LH LM LL DV DC
  -- -- -- == -- == == == -- -- -- -- --
  04 -- 71 00 04 00 00 00 00 32 91 e0 00  Device Fault; Error: ABRT

  Commands leading to the command that caused the error were:
  CR FEATR COUNT  LBA_48  LH LM LL DV DC  Powered_Up_Time  Command/Feature_Name
  -- == -- == -- == == == -- -- -- -- --  ---------------  --------------------
  a1 00 00 00 01 00 00 00 00 00 01 a0 00     01:31:33.706  IDENTIFY PACKET DEVICE
  00 00 00 00 00 00 00 00 00 00 00 00 ff     01:31:23.863  NOP [Abort queued commands]
  00 00 00 00 00 00 00 00 00 00 00 00 ff     01:31:23.614  NOP [Abort queued commands]
  a1 00 00 00 00 00 00 00 00 00 00 a0 00     01:31:13.564  IDENTIFY PACKET DEVICE
  ec 00 00 00 00 00 00 00 00 00 00 a0 00     01:31:13.563  IDENTIFY DEVICE

Error 359 [18] occurred at disk power-on lifetime: 5552 hours (231 days + 8 hours)
  When the command that caused the error occurred, the device was active or idle.

  After command completion occurred, registers were:
  ER -- ST COUNT  LBA_48  LH LM LL DV DC
  -- -- -- == -- == == == -- -- -- -- --
  04 -- 71 00 04 00 00 00 00 32 91 e0 00  Device Fault; Error: ABRT

  Commands leading to the command that caused the error were:
  CR FEATR COUNT  LBA_48  LH LM LL DV DC  Powered_Up_Time  Command/Feature_Name
  -- == -- == -- == == == -- -- -- -- --  ---------------  --------------------
  a1 00 00 00 00 00 00 00 00 00 00 a0 00     01:31:13.564  IDENTIFY PACKET DEVICE
  ec 00 00 00 00 00 00 00 00 00 00 a0 00     01:31:13.563  IDENTIFY DEVICE
  00 00 00 00 00 00 00 00 00 00 00 00 04     01:31:13.404  NOP [Abort queued commands]
  00 00 00 00 00 00 00 00 00 00 00 00 ff     01:31:13.088  NOP [Abort queued commands]
  a1 00 00 00 00 00 00 00 00 00 00 a0 00     01:31:13.064  IDENTIFY PACKET DEVICE

Error 358 [17] occurred at disk power-on lifetime: 5552 hours (231 days + 8 hours)
  When the command that caused the error occurred, the device was active or idle.

  After command completion occurred, registers were:
  ER -- ST COUNT  LBA_48  LH LM LL DV DC
  -- -- -- == -- == == == -- -- -- -- --
  04 -- 71 00 04 00 00 00 00 32 91 e0 00

  Commands leading to the command that caused the error were:
  CR FEATR COUNT  LBA_48  LH LM LL DV DC  Powered_Up_Time  Command/Feature_Name
  -- == -- == -- == == == -- -- -- -- --  ---------------  --------------------
  ec 00 00 00 00 00 00 00 00 00 00 a0 00     01:31:13.563  IDENTIFY DEVICE
  00 00 00 00 00 00 00 00 00 00 00 00 04     01:31:13.404  NOP [Abort queued commands]
  00 00 00 00 00 00 00 00 00 00 00 00 ff     01:31:13.088  NOP [Abort queued commands]
  a1 00 00 00 00 00 00 00 00 00 00 a0 00     01:31:13.064  IDENTIFY PACKET DEVICE
  ec 00 00 00 00 00 00 00 00 00 00 a0 00     01:31:13.063  IDENTIFY DEVICE

Error 357 [16] occurred at disk power-on lifetime: 5552 hours (231 days + 8 hours)
  When the command that caused the error occurred, the device was active or idle.

  After command completion occurred, registers were:
  ER -- ST COUNT  LBA_48  LH LM LL DV DC
  -- -- -- == -- == == == -- -- -- -- --
  04 -- 71 00 04 00 00 00 00 32 91 e0 00  Device Fault; Error: ABRT

  Commands leading to the command that caused the error were:
  CR FEATR COUNT  LBA_48  LH LM LL DV DC  Powered_Up_Time  Command/Feature_Name
  -- == -- == -- == == == -- -- -- -- --  ---------------  --------------------
  a1 00 00 00 00 00 00 00 00 00 00 a0 00     01:31:13.064  IDENTIFY PACKET DEVICE
  ec 00 00 00 00 00 00 00 00 00 00 a0 00     01:31:13.063  IDENTIFY DEVICE
  00 00 00 00 00 00 00 00 00 00 00 00 04     01:31:12.904  NOP [Abort queued commands]
  00 00 00 00 00 00 00 00 00 00 00 00 ff     01:31:12.589  NOP [Abort queued commands]
  a1 00 00 00 00 00 00 00 00 00 00 a0 00     01:31:12.564  IDENTIFY PACKET DEVICE

Error 356 [15] occurred at disk power-on lifetime: 5552 hours (231 days + 8 hours)
  When the command that caused the error occurred, the device was active or idle.

  After command completion occurred, registers were:
  ER -- ST COUNT  LBA_48  LH LM LL DV DC
  -- -- -- == -- == == == -- -- -- -- --
  04 -- 71 00 04 00 00 00 00 32 91 e0 00

  Commands leading to the command that caused the error were:
  CR FEATR COUNT  LBA_48  LH LM LL DV DC  Powered_Up_Time  Command/Feature_Name
  -- == -- == -- == == == -- -- -- -- --  ---------------  --------------------
  ec 00 00 00 00 00 00 00 00 00 00 a0 00     01:31:13.063  IDENTIFY DEVICE
  00 00 00 00 00 00 00 00 00 00 00 00 04     01:31:12.904  NOP [Abort queued commands]
  00 00 00 00 00 00 00 00 00 00 00 00 ff     01:31:12.589  NOP [Abort queued commands]
  a1 00 00 00 00 00 00 00 00 00 00 a0 00     01:31:12.564  IDENTIFY PACKET DEVICE
  ec 00 00 00 00 00 00 00 00 00 00 a0 00     01:31:12.563  IDENTIFY DEVICE

SMART Extended Self-test Log Version: 1 (1 sectors)
Num  Test_Description    Status                  Remaining  LifeTime(hours)  LBA_of_first_error
# 1  Short offline       Completed: unknown failure    90%      9621         0
# 2  Extended offline    Completed: unknown failure    90%      9352         0
# 3  Short offline       Completed: unknown failure    90%      8818         0
# 4  Extended offline    Completed: unknown failure    90%      8655         0
# 5  Short offline       Completed: unknown failure    90%      8614         0
# 6  Short offline       Completed: unknown failure    90%      7468         0
# 7  Short offline       Completed: unknown failure    90%      6834         0
# 8  Short offline       Completed: unknown failure    90%      6680         0
# 9  Short offline       Completed: unknown failure    90%      6661         0
#10  Short offline       Completed: unknown failure    90%      6650         0
#11  Short offline       Completed: unknown failure    90%      6621         0
#12  Short offline       Completed: unknown failure    90%      6608         0
#13  Short offline       Completed: unknown failure    90%      6563         0
#14  Short offline       Completed: unknown failure    90%      6537         0
#15  Short offline       Completed: unknown failure    90%      6496         0
#16  Short offline       Completed: unknown failure    90%      6451         0
#17  Short offline       Completed: unknown failure    90%      6435         0
#18  Extended offline    Completed: unknown failure    90%      6417         0
#19  Short offline       Completed: unknown failure    90%      6380         0

SMART Selective self-test log data structure revision number 1
 SPAN  MIN_LBA  MAX_LBA  CURRENT_TEST_STATUS
    1        0        0  Not_testing
    2        0        0  Not_testing
    3        0        0  Not_testing
    4        0        0  Not_testing
    5        0        0  Not_testing
Selective self-test flags (0x0):
  After scanning selected spans, do NOT read-scan remainder of disk.
If Selective self-test is pending on power-up, resume after 0 minute delay.

SCT Status Version:                  3
SCT Version (vendor specific):       522 (0x020a)
Device State:                        Active (0)
Current Temperature:                    52 Celsius
Power Cycle Min/Max Temperature:     46/52 Celsius
Lifetime    Min/Max Temperature:     17/54 Celsius
Under/Over Temperature Limit Count:   0/0

SCT Temperature History Version:     2
Temperature Sampling Period:         1 minute
Temperature Logging Interval:        59 minutes
Min/Max recommended Temperature:     14/55 Celsius
Min/Max Temperature Limit:           10/60 Celsius
Temperature History Size (Index):    128 (80)

SMART WRITE LOG does not return COUNT and LBA_LOW register
SCT (Get) Error Recovery Control command failed

Device Statistics (GP/SMART Log 0x04) not supported

Pending Defects log (GP Log 0x0c) not supported

SATA Phy Event Counters (GP Log 0x11)
ID      Size     Value  Description
0x000a  2            1  Device-to-host register FISes sent due to a COMRESET
0x0001  2            0  Command failed due to ICRC error
0x0003  2            0  R_ERR response for device-to-host data FIS
0x0004  2            0  R_ERR response for host-to-device data FIS
0x0006  2            0  R_ERR response for device-to-host non-data FIS
0x0007  2            0  R_ERR response for host-to-device non-data FIS

