smartctl 7.4 2023-08-01 r5530 [x86_64-linux-6.6.2-desktop-1omv2390] (OpenMandriva Lx 7.4-1)
Copyright (C) 2002-23, Bruce Allen, Christian Franke, www.smartmontools.org

=== START OF INFORMATION SECTION ===
Model Number:                       KINGSTON RBUSNS8154P3128GJ1
Serial Number:                      --
Firmware Version:                   E8FK12.3
PCI Vendor/Subsystem ID:            0x2646
IEEE OUI Identifier:                0x0026b7
Total NVM Capacity:                 128,035,676,160 [128 GB]
Unallocated NVM Capacity:           0
Controller ID:                      0
NVMe Version:                       1.2
Number of Namespaces:               1
Namespace 1 Size/Capacity:          128,035,676,160 [128 GB]
Namespace 1 Formatted LBA Size:     512
Namespace 1 IEEE EUI-64:            0026b7 ...
Local Time is:                      Fri Dec  1 16:11:06 2023 CET
Firmware Updates (0x12):            1 Slot, no Reset required
Optional Admin Commands (0x0007):   Security Format Frmw_DL
Optional NVM Commands (0x001e):     Wr_Unc DS_Mngmt Wr_Zero Sav/Sel_Feat
Log Page Attributes (0x04):         Ext_Get_Lg
Maximum Data Transfer Size:         512 Pages
Warning  Comp. Temp. Threshold:     84 Celsius
Critical Comp. Temp. Threshold:     88 Celsius

Supported Power States
St Op     Max   Active     Idle   RL RT WL WT  Ent_Lat  Ex_Lat
 0 +     7.90W  0.0790W       -    0  0  0  0      600     600
 1 +     7.90W  0.0790W       -    0  0  0  0      600     600
 2 +     7.90W  0.0790W       -    0  0  0  0      600     600
 3 -   0.1000W  0.0790W       -    3  3  3  3     1000    1000
 4 -   0.0050W  0.0790W       -    4  4  4  4   400000   90000

Supported LBA Sizes (NSID 0x1)
Id Fmt  Data  Metadt  Rel_Perf
 0 +     512       0         1
 1 -    4096       0         0

=== START OF SMART DATA SECTION ===
SMART overall-health self-assessment test result: PASSED

SMART/Health Information (NVMe Log 0x02)
Critical Warning:                   0x00
Temperature:                        28 Celsius
Available Spare:                    100%
Available Spare Threshold:          100%
Percentage Used:                    11%
Data Units Read:                    25,096,691 [12.8 TB]
Data Units Written:                 21,837,573 [11.1 TB]
Host Read Commands:                 335,346,233
Host Write Commands:                237,889,664
Controller Busy Time:               947
Power Cycles:                       5,140
Power On Hours:                     871
Unsafe Shutdowns:                   302
Media and Data Integrity Errors:    0
Error Information Log Entries:      4,982
Warning  Comp. Temperature Time:    0
Critical Comp. Temperature Time:    0
Temperature Sensor 2:               28 Celsius

Error Information (NVMe Log 0x01, 16 of 16 entries)
Num   ErrCount  SQId   CmdId  Status  PELoc          LBA  NSID    VS  Message
  0       4982     0  0x900c  0x0005      -            3     1     -  Invalid Field in Command
  1       4981     0  0x800e  0x0005      -            3     1     -  Invalid Field in Command
  2       4980     0  0x9007  0x0005      -            3     1     -  Invalid Field in Command
  3       4979     0  0x9005  0x0005      -            3     1     -  Invalid Field in Command
  4       4978     0  0x4003  0x0005      -            3     1     -  Invalid Field in Command
  5       4977     0  0x8007  0x0005      -            3     1     -  Invalid Field in Command
  6       4976     0  0x4002  0x0005      -            3     1     -  Invalid Field in Command
  7       4975     0  0x4000  0x0005      -            3     1     -  Invalid Field in Command
  8       4974     0  0xd013  0x0005      -            3     1     -  Invalid Field in Command
  9       4973     0  0x800c  0x0005      -            3     1     -  Invalid Field in Command
 10       4972     0  0x7006  0x0005      -            3     1     -  Invalid Field in Command
 11       4971     0  0x7004  0x0005      -            3     1     -  Invalid Field in Command
 12       4970     0  0x6006  0x0005      -            3     1     -  Invalid Field in Command
 13       4969     0  0x6005  0x0004      -            3     1     -  Invalid Field in Command
 14       4968     0  0x5007  0x0004      -            3     1     -  Invalid Field in Command
 15       4967     0  0x3000  0x0004      -            3     1     -  Invalid Field in Command

Self-tests not supported



