smartctl 7.3 2022-02-28 r5338 [x86_64-linux-6.1.1-desktop-1omv2290] (OpenMandriva Lx 7.3-2)
Copyright (C) 2002-22, Bruce Allen, Christian Franke, www.smartmontools.org

=== START OF INFORMATION SECTION ===
Device Model:     ADATA SU630
Serial Number:    --
LU WWN Device Id: 5 000000 ...
Firmware Version: N191129a
User Capacity:    240,057,409,536 bytes [240 GB]
Sector Size:      512 bytes logical/physical
Rotation Rate:    Solid State Device
Form Factor:      2.5 inches
TRIM Command:     Available, deterministic, zeroed
Device is:        Not in smartctl database
ATA Version is:   ACS-2 (minor revision not indicated)
SATA Version is:  SATA 3.2, 6.0 Gb/s (current: 3.0 Gb/s)
Local Time is:    Fri Feb 17 16:31:18 2023 EST
SMART support is: Available - device has SMART capability.
SMART support is: Enabled
AAM feature is:   Unavailable
APM feature is:   Unavailable
Rd look-ahead is: Enabled
Write cache is:   Enabled
DSN feature is:   Unavailable
ATA Security is:  Disabled, NOT FROZEN [SEC1]
Wt Cache Reorder: Enabled

=== START OF READ SMART DATA SECTION ===
SMART overall-health self-assessment test result: PASSED

General SMART Values:
Offline data collection status:  (0x00)	Offline data collection activity
					was never started.
					Auto Offline Data Collection: Disabled.
Self-test execution status:      (   0)	The previous self-test routine completed
					without error or no self-test has ever 
					been run.
Total time to complete Offline 
data collection: 		(   33) seconds.
Offline data collection
capabilities: 			 (0x7b) SMART execute Offline immediate.
					Auto Offline data collection on/off support.
					Suspend Offline collection upon new
					command.
					Offline surface scan supported.
					Self-test supported.
					Conveyance Self-test supported.
					Selective Self-test supported.
SMART capabilities:            (0x0003)	Saves SMART data before entering
					power-saving mode.
					Supports SMART auto save timer.
Error logging capability:        (0x01)	Error logging supported.
					General Purpose Logging supported.
Short self-test routine 
recommended polling time: 	 (   2) minutes.
Extended self-test routine
recommended polling time: 	 (   2) minutes.
Conveyance self-test routine
recommended polling time: 	 (   2) minutes.
SCT capabilities: 	       (0x0031)	SCT Status supported.
					SCT Feature Control supported.
					SCT Data Table supported.

SMART Attributes Data Structure revision number: 0
Vendor Specific SMART Attributes with Thresholds:
ID# ATTRIBUTE_NAME          FLAGS    VALUE WORST THRESH FAIL RAW_VALUE
  9 Power_On_Hours          -O--C-   100   100   000    -    1167
 12 Power_Cycle_Count       -O--C-   100   100   000    -    580
167 Unknown_Attribute       -O---K   100   100   000    -    0
168 Unknown_Attribute       -O--C-   100   100   000    -    2049
169 Unknown_Attribute       PO--C-   095   095   010    -    2097184
173 Unknown_Attribute       -O--C-   200   200   000    -    373670936679
175 Program_Fail_Count_Chip PO--C-   100   100   010    -    0
180 Unused_Rsvd_Blk_Cnt_Tot PO--CK   100   100   020    -    84
192 Power-Off_Retract_Count -O--C-   100   100   000    -    64
194 Temperature_Celsius     -O---K   057   057   030    -    43 (Min/Max 24/67)
231 Unknown_SSD_Attribute   PO--CK   094   094   005    -    6
233 Media_Wearout_Indicator -O--CK   100   100   000    -    18915659872
234 Unknown_Attribute       -O--CK   100   100   000    -    2340878741504
241 Total_LBAs_Written      -O--CK   100   100   000    -    14874626238
242 Total_LBAs_Read         -O--CK   100   100   000    -    10555054015
                            ||||||_ K auto-keep
                            |||||__ C event count
                            ||||___ R error rate
                            |||____ S speed/performance
                            ||_____ O updated online
                            |______ P prefailure warning

General Purpose Log Directory Version 1
SMART           Log Directory Version 1 [multi-sector log support]
Address    Access  R/W   Size  Description
0x00       GPL,SL  R/O      1  Log Directory
0x01           SL  R/O      1  Summary SMART error log
0x02           SL  R/O     51  Comprehensive SMART error log
0x03       GPL     R/O     64  Ext. Comprehensive SMART error log
0x04       GPL,SL  R/O      8  Device Statistics log
0x06           SL  R/O      1  SMART self-test log
0x07       GPL     R/O      1  Extended self-test log
0x09           SL  R/W      1  Selective self-test log
0x10       GPL     R/O      1  NCQ Command Error log
0x11       GPL     R/O      1  SATA Phy Event Counters log
0x30       GPL,SL  R/O      9  IDENTIFY DEVICE data log
0x80-0x9f  GPL,SL  R/W     16  Host vendor specific log
0xe0       GPL,SL  R/W      1  SCT Command/Status
0xe1       GPL,SL  R/W      1  SCT Data Transfer

SMART Extended Comprehensive Error Log Version: 1 (64 sectors)
Device Error Count: 2048 (device log contains only the most recent 256 errors)
	CR     = Command Register
	FEATR  = Features Register
	COUNT  = Count (was: Sector Count) Register
	LBA_48 = Upper bytes of LBA High/Mid/Low Registers ]  ATA-8
	LH     = LBA High (was: Cylinder High) Register    ]   LBA
	LM     = LBA Mid (was: Cylinder Low) Register      ] Register
	LL     = LBA Low (was: Sector Number) Register     ]
	DV     = Device (was: Device/Head) Register
	DC     = Device Control Register
	ER     = Error register
	ST     = Status register
Powered_Up_Time is measured from power on, and printed as
DDd+hh:mm:SS.sss where DD=days, hh=hours, mm=minutes,
SS=sec, and sss=millisec. It "wraps" after 49.710 days.

Error 2048 [255] occurred at disk power-on lifetime: 1138 hours (47 days + 10 hours)
  When the command that caused the error occurred, the device was in an unknown state.

  After command completion occurred, registers were:
  ER -- ST COUNT  LBA_48  LH LM LL DV DC
  -- -- -- == -- == == == -- -- -- -- --
  84 -- 51 00 34 00 00 02 ae 3e 40 e0 00  Error: ICRC, ABRT 52 sectors at LBA = 0x02ae3e40 = 44973632

  Commands leading to the command that caused the error were:
  CR FEATR COUNT  LBA_48  LH LM LL DV DC  Powered_Up_Time  Command/Feature_Name
  -- == -- == -- == == == -- -- -- -- --  ---------------  --------------------
  25 40 40 00 34 00 00 02 ae 3e 40 e0 80     00:26:31.200  READ DMA EXT
  25 40 40 00 2d 00 00 00 15 05 d3 e0 80     00:26:09.800  READ DMA EXT
  25 40 40 00 13 00 00 00 15 05 c0 e0 80     00:26:09.800  READ DMA EXT
  25 40 40 00 15 00 00 00 00 c2 2b e0 80     00:26:09.800  READ DMA EXT
  25 40 40 00 2b 00 00 00 00 c2 00 e0 80     00:26:09.800  READ DMA EXT

Error 2047 [254] occurred at disk power-on lifetime: 1110 hours (46 days + 6 hours)
  When the command that caused the error occurred, the device was in an unknown state.

  After command completion occurred, registers were:
  ER -- ST COUNT  LBA_48  LH LM LL DV DC
  -- -- -- == -- == == == -- -- -- -- --
  84 -- 51 00 21 00 00 00 00 08 1f e0 00  Error: ICRC, ABRT 33 sectors at LBA = 0x0000081f = 2079

  Commands leading to the command that caused the error were:
  CR FEATR COUNT  LBA_48  LH LM LL DV DC  Powered_Up_Time  Command/Feature_Name
  -- == -- == -- == == == -- -- -- -- --  ---------------  --------------------
  25 40 40 00 1f 00 00 00 00 08 00 e0 80     03:45:31.900  READ DMA EXT
  25 40 40 00 09 00 00 18 04 c8 b7 e0 80     03:45:10.700  READ DMA EXT
  25 40 40 00 37 00 00 18 04 c8 80 e0 80     03:45:10.700  READ DMA EXT
  25 40 40 00 0a 00 00 18 04 b9 36 e0 80     03:45:10.700  READ DMA EXT
  25 40 40 00 36 00 00 18 04 b9 00 e0 80     03:45:10.700  READ DMA EXT

Error 2046 [253] occurred at disk power-on lifetime: 493 hours (20 days + 13 hours)
  When the command that caused the error occurred, the device was in an unknown state.

  After command completion occurred, registers were:
  ER -- ST COUNT  LBA_48  LH LM LL DV DC
  -- -- -- == -- == == == -- -- -- -- --
  84 -- 41 00 a8 00 00 0d d9 cd e8 40 08  Error: ABRT

  Commands leading to the command that caused the error were:
  CR FEATR COUNT  LBA_48  LH LM LL DV DC  Powered_Up_Time  Command/Feature_Name
  -- == -- == -- == == == -- -- -- -- --  ---------------  --------------------
  ef 00 10 00 02 00 00 00 00 00 00 a0 80     00:51:40.800  SET FEATURES [Enable SATA feature]
  ec 00 00 00 00 00 00 00 00 00 00 a0 80     00:51:40.800  IDENTIFY DEVICE
  ef 00 03 00 46 00 00 00 00 00 00 a0 80     00:51:40.800  SET FEATURES [Set transfer mode]
  ef 00 10 00 02 00 00 00 00 00 00 a0 80     00:51:40.800  SET FEATURES [Enable SATA feature]
  ec 00 00 00 00 00 00 00 00 00 00 a0 80     00:51:40.800  IDENTIFY DEVICE

Error 2045 [252] occurred at disk power-on lifetime: 493 hours (20 days + 13 hours)
  When the command that caused the error occurred, the device was in an unknown state.

  After command completion occurred, registers were:
  ER -- ST COUNT  LBA_48  LH LM LL DV DC
  -- -- -- == -- == == == -- -- -- -- --
  84 -- 41 00 58 00 00 0d d8 4e 78 40 08

  Commands leading to the command that caused the error were:
  CR FEATR COUNT  LBA_48  LH LM LL DV DC  Powered_Up_Time  Command/Feature_Name
  -- == -- == -- == == == -- -- -- -- --  ---------------  --------------------
  ea 00 00 00 00 00 00 00 00 00 00 a0 80     00:51:36.300  FLUSH CACHE EXT
  ef 00 10 00 02 00 00 00 00 00 00 a0 80     00:51:36.200  SET FEATURES [Enable SATA feature]
  ec 00 00 00 00 00 00 00 00 00 00 a0 80     00:51:36.200  IDENTIFY DEVICE
  ef 00 03 00 46 00 00 00 00 00 00 a0 80     00:51:36.200  SET FEATURES [Set transfer mode]
  ef 00 10 00 02 00 00 00 00 00 00 a0 80     00:51:36.200  SET FEATURES [Enable SATA feature]

Error 2044 [251] occurred at disk power-on lifetime: 493 hours (20 days + 13 hours)
  When the command that caused the error occurred, the device was in an unknown state.

  After command completion occurred, registers were:
  ER -- ST COUNT  LBA_48  LH LM LL DV DC
  -- -- -- == -- == == == -- -- -- -- --
  84 -- 51 01 00 00 00 14 d0 19 08 e0 08  Error: ICRC, ABRT 256 sectors at LBA = 0x14d01908 = 349182216

  Commands leading to the command that caused the error were:
  CR FEATR COUNT  LBA_48  LH LM LL DV DC  Powered_Up_Time  Command/Feature_Name
  -- == -- == -- == == == -- -- -- -- --  ---------------  --------------------
  25 00 00 01 00 00 00 14 d0 19 08 e0 80     00:48:53.300  READ DMA EXT
  ef 00 10 00 03 00 00 00 00 00 00 a0 80     00:48:53.300  SET FEATURES [Enable SATA feature]
  ef 00 10 00 02 00 00 00 00 00 00 a0 80     00:48:53.300  SET FEATURES [Enable SATA feature]
  ec 00 00 00 00 00 00 00 00 00 00 a0 80     00:48:53.300  IDENTIFY DEVICE
  ef 00 03 00 42 00 00 00 00 00 00 a0 80     00:48:53.300  SET FEATURES [Set transfer mode]

Error 2043 [250] occurred at disk power-on lifetime: 493 hours (20 days + 13 hours)
  When the command that caused the error occurred, the device was in an unknown state.

  After command completion occurred, registers were:
  ER -- ST COUNT  LBA_48  LH LM LL DV DC
  -- -- -- == -- == == == -- -- -- -- --
  84 -- 51 01 00 00 00 14 d0 19 08 e0 08  Error: ICRC, ABRT 256 sectors at LBA = 0x14d01908 = 349182216

  Commands leading to the command that caused the error were:
  CR FEATR COUNT  LBA_48  LH LM LL DV DC  Powered_Up_Time  Command/Feature_Name
  -- == -- == -- == == == -- -- -- -- --  ---------------  --------------------
  25 00 00 01 00 00 00 14 d0 19 08 e0 80     00:48:52.300  READ DMA EXT
  ef 00 10 00 03 00 00 00 00 00 00 a0 80     00:48:52.300  SET FEATURES [Enable SATA feature]
  ef 00 10 00 02 00 00 00 00 00 00 a0 80     00:48:52.300  SET FEATURES [Enable SATA feature]
  ec 00 00 00 00 00 00 00 00 00 00 a0 80     00:48:52.300  IDENTIFY DEVICE
  ef 00 03 00 42 00 00 00 00 00 00 a0 80     00:48:52.300  SET FEATURES [Set transfer mode]

Error 2042 [249] occurred at disk power-on lifetime: 493 hours (20 days + 13 hours)
  When the command that caused the error occurred, the device was in an unknown state.

  After command completion occurred, registers were:
  ER -- ST COUNT  LBA_48  LH LM LL DV DC
  -- -- -- == -- == == == -- -- -- -- --
  84 -- 51 01 00 00 00 14 d0 19 08 e0 08  Error: ICRC, ABRT 256 sectors at LBA = 0x14d01908 = 349182216

  Commands leading to the command that caused the error were:
  CR FEATR COUNT  LBA_48  LH LM LL DV DC  Powered_Up_Time  Command/Feature_Name
  -- == -- == -- == == == -- -- -- -- --  ---------------  --------------------
  25 00 00 01 00 00 00 14 d0 19 08 e0 80     00:48:51.300  READ DMA EXT
  ef 00 10 00 03 00 00 00 00 00 00 a0 80     00:48:51.300  SET FEATURES [Enable SATA feature]
  ef 00 10 00 02 00 00 00 00 00 00 a0 80     00:48:51.300  SET FEATURES [Enable SATA feature]
  ec 00 00 00 00 00 00 00 00 00 00 a0 80     00:48:51.300  IDENTIFY DEVICE
  ef 00 03 00 42 00 00 00 00 00 00 a0 80     00:48:51.300  SET FEATURES [Set transfer mode]

Error 2041 [248] occurred at disk power-on lifetime: 493 hours (20 days + 13 hours)
  When the command that caused the error occurred, the device was in an unknown state.

  After command completion occurred, registers were:
  ER -- ST COUNT  LBA_48  LH LM LL DV DC
  -- -- -- == -- == == == -- -- -- -- --
  84 -- 51 01 08 00 00 14 d0 19 00 e0 08  Error: ICRC, ABRT 264 sectors at LBA = 0x14d01900 = 349182208

  Commands leading to the command that caused the error were:
  CR FEATR COUNT  LBA_48  LH LM LL DV DC  Powered_Up_Time  Command/Feature_Name
  -- == -- == -- == == == -- -- -- -- --  ---------------  --------------------
  25 00 00 01 08 00 00 14 d0 19 00 e0 80     00:48:50.300  READ DMA EXT
  35 00 00 00 e8 00 00 17 96 d3 00 e0 80     00:48:50.300  WRITE DMA EXT
  ea 00 00 00 00 00 00 00 00 00 00 a0 80     00:48:50.300  FLUSH CACHE EXT
  ca 00 00 00 08 00 00 00 da ee 10 ed 80     00:48:50.300  WRITE DMA
  ea 00 00 00 00 00 00 00 00 00 00 a0 80     00:48:50.300  FLUSH CACHE EXT

SMART Extended Self-test Log Version: 1 (1 sectors)
Num  Test_Description    Status                  Remaining  LifeTime(hours)  LBA_of_first_error
# 1  Short offline       Completed without error       00%      1167         -
# 2  Short offline       Completed without error       00%      1139         -
# 3  Short offline       Completed without error       00%      1137         -
# 4  Short offline       Completed without error       00%      1132         -
# 5  Short offline       Completed without error       00%      1088         -
# 6  Short offline       Completed without error       00%      1088         -
# 7  Short offline       Completed without error       00%      1088         -
# 8  Short offline       Completed without error       00%      1069         -
# 9  Short offline       Completed without error       00%      1052         -
#10  Extended offline    Completed without error       00%      1051         -
#11  Short offline       Completed without error       00%      1050         -
#12  Short offline       Completed without error       00%      1042         -
#13  Extended offline    Completed without error       00%      1041         -
#14  Short offline       Aborted by host               00%      1041         -
#15  Short offline       Completed without error       00%      1034         -
#16  Short offline       Completed without error       00%      1026         -
#17  Short offline       Completed without error       00%      1017         -
#18  Short offline       Completed without error       00%       972         -
#19  Short offline       Completed without error       00%       831         -

SMART Selective self-test log data structure revision number 1
 SPAN  MIN_LBA  MAX_LBA  CURRENT_TEST_STATUS
    1        0        0  Not_testing
    2        0        0  Not_testing
    3        0        0  Not_testing
    4        0        0  Not_testing
    5        0        0  Not_testing
Selective self-test flags (0x0):
  After scanning selected spans, do NOT read-scan remainder of disk.
If Selective self-test is pending on power-up, resume after 0 minute delay.

SCT Status Version:                  3
SCT Version (vendor specific):       1 (0x0001)
Device State:                        Active (0)
Current Temperature:                     ? Celsius
Power Cycle Min/Max Temperature:      ?/ ? Celsius
Lifetime    Min/Max Temperature:      ?/ ? Celsius
Under/Over Temperature Limit Count:   0/0

SCT Temperature History Version:     2
Temperature Sampling Period:         1 minute
Temperature Logging Interval:        1 minute
Min/Max recommended Temperature:     -127/127 Celsius
Min/Max Temperature Limit:           -127/127 Celsius
Temperature History Size (Index):    478 (268)

SCT Error Recovery Control command not supported

Device Statistics (GP Log 0x04)
Page  Offset Size        Value Flags Description
0x01  =====  =               =  ===  == General Statistics (rev 1) ==
0x01  0x008  4             580  ---  Lifetime Power-On Resets
0x01  0x010  4            1167  ---  Power-on Hours
0x01  0x018  6     14874626238  ---  Logical Sectors Written
0x01  0x020  6       101163885  ---  Number of Write Commands
0x01  0x028  6     10555054015  ---  Logical Sectors Read
0x01  0x030  6       117345919  ---  Number of Read Commands
0x01  0x038  6   1077943103100  ---  Date and Time TimeStamp
0x07  =====  =               =  ===  == Solid State Device Statistics (rev 1) ==
0x07  0x008  1              15  N--  Percentage Used Endurance Indicator
                                |||_ C monitored condition met
                                ||__ D supports DSN
                                |___ N normalized value

Pending Defects log (GP Log 0x0c) not supported

SATA Phy Event Counters (GP Log 0x11)
ID      Size     Value  Description
0x0001  2            1  Command failed due to ICRC error
0x0003  2            0  R_ERR response for device-to-host data FIS
0x0004  2            0  R_ERR response for host-to-device data FIS
0x0006  2            0  R_ERR response for device-to-host non-data FIS
0x0007  2            0  R_ERR response for host-to-device non-data FIS
0x0008  2            0  Device-to-host non-data FIS retries
0x0009  4            0  Transition from drive PhyRdy to drive PhyNRdy
0x000a  4            5  Device-to-host register FISes sent due to a COMRESET
0x000f  2            0  R_ERR response for host-to-device data FIS, CRC
0x0010  2            0  R_ERR response for host-to-device data FIS, non-CRC
0x0012  2            0  R_ERR response for host-to-device non-data FIS, CRC
0x0013  2            0  R_ERR response for host-to-device non-data FIS, non-CRC

