smartctl 7.1 2019-12-30 r5022 [x86_64-linux-5.4.0-7634-generic] (local build)
Copyright (C) 2002-19, Bruce Allen, Christian Franke, www.smartmontools.org

=== START OF INFORMATION SECTION ===
Model Number:                       SAMSUNG MZVLW512HMJP-000H1
Serial Number:                      --
Firmware Version:                   CXY73H1Q
PCI Vendor/Subsystem ID:            0x144d
IEEE OUI Identifier:                0x002538
Total NVM Capacity:                 512,110,190,592 [512 GB]
Unallocated NVM Capacity:           0
Controller ID:                      2
Number of Namespaces:               1
Namespace 1 Size/Capacity:          512,110,190,592 [512 GB]
Namespace 1 Utilization:            40,585,555,968 [40.5 GB]
Namespace 1 Formatted LBA Size:     512
Namespace 1 IEEE EUI-64:            002538 ...
Local Time is:                      Tue Jul 21 06:21:30 2020 PDT
Firmware Updates (0x16):            3 Slots, no Reset required
Optional Admin Commands (0x0017):   Security Format Frmw_DL Self_Test
Optional NVM Commands (0x001f):     Comp Wr_Unc DS_Mngmt Wr_Zero Sav/Sel_Feat
Warning  Comp. Temp. Threshold:     68 Celsius
Critical Comp. Temp. Threshold:     71 Celsius

Supported Power States
St Op     Max   Active     Idle   RL RT WL WT  Ent_Lat  Ex_Lat
 0 +     7.60W       -        -    0  0  0  0        0       0
 1 +     6.00W       -        -    1  1  1  1        0       0
 2 +     5.10W       -        -    2  2  2  2        0       0
 3 -   0.0400W       -        -    3  3  3  3      210    1500
 4 -   0.0050W       -        -    4  4  4  4     2200    6000

Supported LBA Sizes (NSID 0x1)
Id Fmt  Data  Metadt  Rel_Perf
 0 +     512       0         0

=== START OF SMART DATA SECTION ===
SMART overall-health self-assessment test result: PASSED

SMART/Health Information (NVMe Log 0x02)
Critical Warning:                   0x00
Temperature:                        31 Celsius
Available Spare:                    100%
Available Spare Threshold:          5%
Percentage Used:                    0%
Data Units Read:                    760,995 [389 GB]
Data Units Written:                 915,291 [468 GB]
Host Read Commands:                 8,181,877
Host Write Commands:                6,755,339
Controller Busy Time:               38
Power Cycles:                       70
Power On Hours:                     7
Unsafe Shutdowns:                   20
Media and Data Integrity Errors:    0
Error Information Log Entries:      212
Warning  Comp. Temperature Time:    0
Critical Comp. Temperature Time:    0
Temperature Sensor 1:               31 Celsius
Temperature Sensor 2:               41 Celsius

Error Information (NVMe Log 0x01, max 64 entries)
Num   ErrCount  SQId   CmdId  Status  PELoc          LBA  NSID    VS
  0        212     0  0x0008  0x4016  0x004            0     1     -
  1        211     0  0x0024  0x4016  0x004            0     1     -
  2        210     0  0x0018  0x4004  0x02c            0     0     -
  3        209     0  0x0017  0x4004  0x02c            0     0     -
  4        208     0  0x0015  0x4212  0x028            0     -     -
  5        207     0  0x0012  0x4212  0x028            0     -     -
  6        206     0  0x0012  0x4212  0x028            0     -     -
  7        205     0  0x0018  0x4004  0x02c            0     0     -
  8        204     0  0x0017  0x4004  0x02c            0     0     -
  9        203     0  0x0015  0x4212  0x028            0     -     -
 10        202     0  0x0084  0x4212  0x028            0     -     -
 11        201     0  0x0018  0x4004  0x02c            0     0     -
 12        200     0  0x0017  0x4004  0x02c            0     0     -
 13        199     0  0x0015  0x4212  0x028            0     -     -
 14        198     0  0x001a  0x4004  0x02c            0     0     -
 15        197     0  0x0019  0x4004  0x02c            0     0     -
... (48 entries not shown)

