smartctl 7.4 2023-08-01 r5530 [x86_64-linux-6.10.10-surface-1] (local build)
Copyright (C) 2002-23, Bruce Allen, Christian Franke, www.smartmontools.org

=== START OF INFORMATION SECTION ===
Model Number:                       KBG30ZPZ512G TOSHIBA
Serial Number:                      --
Firmware Version:                   ADMS0101
PCI Vendor/Subsystem ID:            0x1179
IEEE OUI Identifier:                0x00080d
Controller ID:                      0
NVMe Version:                       1.2
Number of Namespaces:               1
Namespace 1 Size/Capacity:          512,110,190,592 [512 GB]
Namespace 1 Formatted LBA Size:     512
Namespace 1 IEEE EUI-64:            00080d ...
Local Time is:                      Mon Oct 14 18:42:49 2024 EDT
Firmware Updates (0x12):            1 Slot, no Reset required
Optional Admin Commands (0x0017):   Security Format Frmw_DL Self_Test
Optional NVM Commands (0x0017):     Comp Wr_Unc DS_Mngmt Sav/Sel_Feat
Log Page Attributes (0x02):         Cmd_Eff_Lg
Maximum Data Transfer Size:         512 Pages
Warning  Comp. Temp. Threshold:     82 Celsius
Critical Comp. Temp. Threshold:     85 Celsius

Supported Power States
St Op     Max   Active     Idle   RL RT WL WT  Ent_Lat  Ex_Lat
 0 +     2.80W       -        -    0  0  0  0        0       0
 1 +     2.40W       -        -    1  1  1  1        0       0
 2 +     1.90W       -        -    2  2  2  2        0       0
 3 -   0.0500W       -        -    4  4  4  4     8000    5000
 4 -   0.0050W       -        -    4  4  4  4     8000   40000

Supported LBA Sizes (NSID 0x1)
Id Fmt  Data  Metadt  Rel_Perf
 0 -    4096       0         0
 1 +     512       0         3

=== START OF SMART DATA SECTION ===
SMART overall-health self-assessment test result: PASSED

SMART/Health Information (NVMe Log 0x02)
Critical Warning:                   0x00
Temperature:                        32 Celsius
Available Spare:                    100%
Available Spare Threshold:          10%
Percentage Used:                    2%
Data Units Read:                    7,673,405 [3.92 TB]
Data Units Written:                 13,606,727 [6.96 TB]
Host Read Commands:                 97,758,058
Host Write Commands:                117,639,961
Controller Busy Time:               1,434
Power Cycles:                       518
Power On Hours:                     286
Unsafe Shutdowns:                   111
Media and Data Integrity Errors:    0
Error Information Log Entries:      913
Warning  Comp. Temperature Time:    0
Critical Comp. Temperature Time:    0
Temperature Sensor 1:               32 Celsius

Error Information (NVMe Log 0x01, 16 of 64 entries)
Num   ErrCount  SQId   CmdId  Status  PELoc          LBA  NSID    VS  Message
  0        913     0  0x0018  0xc005  0x028            -     0     -  Invalid Field in Command

Self-test Log (NVMe Log 0x06)
Self-test status: No self-test in progress
No Self-tests Logged

