=== START OF INFORMATION SECTION ===
Model Family:     Seagate Barracuda 7200.12
Device Model:     ST3250318AS
Serial Number:    --
LU WWN Device Id: 5 000c50 ...
Firmware Version: CC38
User Capacity:    250,058,268,160 bytes [250 GB]
Sector Size:      512 bytes logical/physical
Rotation Rate:    7200 rpm
Device is:        In smartctl database [for details use: -P show]
ATA Version is:   ATA8-ACS T13/1699-D revision 4
SATA Version is:  SATA 2.6, 3.0 Gb/s
Local Time is:    Sat May  4 01:49:50 2019 MSK

==> WARNING: A firmware update for this drive may be available,
see the following Seagate web pages:
http://knowledge.seagate.com/articles/en_US/FAQ/207931en
http://knowledge.seagate.com/articles/en_US/FAQ/213891en

SMART support is: Available - device has SMART capability.
SMART support is: Enabled
AAM level is:     0 (vendor specific), recommended: 254
APM feature is:   Unavailable
Rd look-ahead is: Enabled
Write cache is:   Enabled
DSN feature is:   Unavailable
ATA Security is:  Disabled, frozen [SEC2]
Wt Cache Reorder: Unknown

=== START OF READ SMART DATA SECTION ===
SMART overall-health self-assessment test result: PASSED
See vendor-specific Attribute list for marginal Attributes.

General SMART Values:
Offline data collection status:  (0x82)	Offline data collection activity
					was completed without error.
					Auto Offline Data Collection: Enabled.
Self-test execution status:      (   0)	The previous self-test routine completed
					without error or no self-test has ever 
					been run.
Total time to complete Offline 
data collection: 		(  617) seconds.
Offline data collection
capabilities: 			 (0x7b) SMART execute Offline immediate.
					Auto Offline data collection on/off support.
					Suspend Offline collection upon new
					command.
					Offline surface scan supported.
					Self-test supported.
					Conveyance Self-test supported.
					Selective Self-test supported.
SMART capabilities:            (0x0003)	Saves SMART data before entering
					power-saving mode.
					Supports SMART auto save timer.
Error logging capability:        (0x01)	Error logging supported.
					General Purpose Logging supported.
Short self-test routine 
recommended polling time: 	 (   1) minutes.
Extended self-test routine
recommended polling time: 	 (  48) minutes.
Conveyance self-test routine
recommended polling time: 	 (   2) minutes.
SCT capabilities: 	       (0x103f)	SCT Status supported.
					SCT Error Recovery Control supported.
					SCT Feature Control supported.
					SCT Data Table supported.

SMART Attributes Data Structure revision number: 10
Vendor Specific SMART Attributes with Thresholds:
ID# ATTRIBUTE_NAME          FLAGS    VALUE WORST THRESH FAIL RAW_VALUE
  1 Raw_Read_Error_Rate     POSR--   117   099   006    -    127163612
  3 Spin_Up_Time            PO----   098   097   000    -    0
  4 Start_Stop_Count        -O--CK   090   090   020    -    10387
  5 Reallocated_Sector_Ct   PO--CK   100   100   036    -    0
  7 Seek_Error_Rate         POSR--   084   060   030    -    298633741
  9 Power_On_Hours          -O--CK   073   073   000    -    24499
 10 Spin_Retry_Count        PO--C-   100   100   097    -    0
 12 Power_Cycle_Count       -O--CK   097   097   020    -    3895
183 Runtime_Bad_Block       -O--CK   100   100   000    -    0
184 End-to-End_Error        -O--CK   100   100   099    -    0
187 Reported_Uncorrect      -O--CK   091   091   000    -    9
188 Command_Timeout         -O--CK   100   098   000    -    94490919032
189 High_Fly_Writes         -O-RCK   100   100   000    -    0
190 Airflow_Temperature_Cel -O---K   058   043   045    Past 42 (Min/Max 41/42 #77)
194 Temperature_Celsius     -O---K   042   057   000    -    42 (0 12 0 0 0)
195 Hardware_ECC_Recovered  -O-RC-   052   031   000    -    127163612
197 Current_Pending_Sector  -O--C-   100   100   000    -    0
198 Offline_Uncorrectable   ----C-   100   100   000    -    0
199 UDMA_CRC_Error_Count    -OSRCK   200   200   000    -    0
240 Head_Flying_Hours       ------   100   253   000    -    25904 (50 93 0)
241 Total_LBAs_Written      ------   100   253   000    -    3565771189
242 Total_LBAs_Read         ------   100   253   000    -    2311166086
                            ||||||_ K auto-keep
                            |||||__ C event count
                            ||||___ R error rate
                            |||____ S speed/performance
                            ||_____ O updated online
                            |______ P prefailure warning

General Purpose Log Directory Version 1
SMART           Log Directory Version 1 [multi-sector log support]
Address    Access  R/W   Size  Description
0x00       GPL,SL  R/O      1  Log Directory
0x01       GPL,SL  R/O      1  Summary SMART error log
0x02       GPL,SL  R/O      5  Comprehensive SMART error log
0x03       GPL     R/O      5  Ext. Comprehensive SMART error log
0x06       GPL,SL  R/O      1  SMART self-test log
0x07       GPL     R/O      1  Extended self-test log
0x09       GPL,SL  R/W      1  Selective self-test log
0x10       GPL     R/O      1  NCQ Command Error log
0x11       GPL     R/O      1  SATA Phy Event Counters log
0x21       GPL     R/O      1  Write stream error log
0x22       GPL     R/O      1  Read stream error log
0x80-0x9f  GPL,SL  R/W     16  Host vendor specific log
0xa1       GPL,SL  VS      20  Device vendor specific log
0xa2       GPL     VS    2248  Device vendor specific log
0xa8       GPL,SL  VS     129  Device vendor specific log
0xa9       GPL,SL  VS       1  Device vendor specific log
0xb0       GPL     VS    2928  Device vendor specific log
0xbd       GPL     VS     252  Device vendor specific log
0xbe-0xbf  GPL     VS   65535  Device vendor specific log
0xc0       GPL,SL  VS       1  Device vendor specific log
0xe0       GPL,SL  R/W      1  SCT Command/Status
0xe1       GPL,SL  R/W      1  SCT Data Transfer

SMART Extended Comprehensive Error Log Version: 1 (5 sectors)
Device Error Count: 9
	CR     = Command Register
	FEATR  = Features Register
	COUNT  = Count (was: Sector Count) Register
	LBA_48 = Upper bytes of LBA High/Mid/Low Registers ]  ATA-8
	LH     = LBA High (was: Cylinder High) Register    ]   LBA
	LM     = LBA Mid (was: Cylinder Low) Register      ] Register
	LL     = LBA Low (was: Sector Number) Register     ]
	DV     = Device (was: Device/Head) Register
	DC     = Device Control Register
	ER     = Error register
	ST     = Status register
Powered_Up_Time is measured from power on, and printed as
DDd+hh:mm:SS.sss where DD=days, hh=hours, mm=minutes,
SS=sec, and sss=millisec. It "wraps" after 49.710 days.

Error 9 [8] occurred at disk power-on lifetime: 6145 hours (256 days + 1 hours)
  When the command that caused the error occurred, the device was active or idle.

  After command completion occurred, registers were:
  ER -- ST COUNT  LBA_48  LH LM LL DV DC
  -- -- -- == -- == == == -- -- -- -- --
  40 -- 51 00 00 00 00 4d 00 5f a3 00 00  Error: UNC at LBA = 0x4d005fa3 = 1291870115

  Commands leading to the command that caused the error were:
  CR FEATR COUNT  LBA_48  LH LM LL DV DC  Powered_Up_Time  Command/Feature_Name
  -- == -- == -- == == == -- -- -- -- --  ---------------  --------------------
  60 00 00 01 00 00 00 4d 00 5f 1f 40 00     00:43:40.799  READ FPDMA QUEUED
  60 00 00 01 00 00 00 4e 00 5f 1f 40 00     00:43:40.786  READ FPDMA QUEUED
  60 00 00 00 1e 00 03 da 00 2b 2f 40 00     00:43:40.754  READ FPDMA QUEUED
  60 00 00 00 20 00 03 da 00 2b 0f 40 00     00:43:40.745  READ FPDMA QUEUED
  60 00 00 00 08 00 00 b3 00 63 bf 40 00     00:43:40.737  READ FPDMA QUEUED

Error 8 [7] occurred at disk power-on lifetime: 6145 hours (256 days + 1 hours)
  When the command that caused the error occurred, the device was active or idle.

  After command completion occurred, registers were:
  ER -- ST COUNT  LBA_48  LH LM LL DV DC
  -- -- -- == -- == == == -- -- -- -- --
  40 -- 51 00 00 00 00 4d 00 5f a3 00 00  Error: UNC at LBA = 0x4d005fa3 = 1291870115

  Commands leading to the command that caused the error were:
  CR FEATR COUNT  LBA_48  LH LM LL DV DC  Powered_Up_Time  Command/Feature_Name
  -- == -- == -- == == == -- -- -- -- --  ---------------  --------------------
  60 00 00 01 00 00 00 4e 00 5f 1f 40 00     00:43:36.505  READ FPDMA QUEUED
  60 00 00 01 00 00 00 4d 00 5f 1f 40 00     00:43:36.505  READ FPDMA QUEUED
  60 00 00 00 08 00 03 27 00 40 67 40 00     00:43:36.505  READ FPDMA QUEUED
  60 00 00 01 00 00 00 4f 00 5f 1f 40 00     00:43:36.505  READ FPDMA QUEUED
  60 00 00 00 f8 00 00 98 00 18 07 40 00     00:43:36.495  READ FPDMA QUEUED

Error 7 [6] occurred at disk power-on lifetime: 6145 hours (256 days + 1 hours)
  When the command that caused the error occurred, the device was active or idle.

  After command completion occurred, registers were:
  ER -- ST COUNT  LBA_48  LH LM LL DV DC
  -- -- -- == -- == == == -- -- -- -- --
  40 -- 51 00 00 00 00 4d 00 5f a3 00 00  Error: UNC at LBA = 0x4d005fa3 = 1291870115

  Commands leading to the command that caused the error were:
  CR FEATR COUNT  LBA_48  LH LM LL DV DC  Powered_Up_Time  Command/Feature_Name
  -- == -- == -- == == == -- -- -- -- --  ---------------  --------------------
  60 00 00 01 00 00 00 4f 00 5f 1f 40 00     00:43:32.254  READ FPDMA QUEUED
  60 00 00 01 00 00 00 4e 00 5f 1f 40 00     00:43:32.254  READ FPDMA QUEUED
  60 00 00 01 00 00 00 4d 00 5f 1f 40 00     00:43:32.254  READ FPDMA QUEUED
  60 00 00 00 08 00 00 bc 00 63 37 40 00     00:43:32.254  READ FPDMA QUEUED
  60 00 00 00 20 00 00 00 00 89 07 40 00     00:43:32.244  READ FPDMA QUEUED

Error 6 [5] occurred at disk power-on lifetime: 6145 hours (256 days + 1 hours)
  When the command that caused the error occurred, the device was active or idle.

  After command completion occurred, registers were:
  ER -- ST COUNT  LBA_48  LH LM LL DV DC
  -- -- -- == -- == == == -- -- -- -- --
  40 -- 51 00 00 00 00 4d 00 5f a3 00 00  Error: UNC at LBA = 0x4d005fa3 = 1291870115

  Commands leading to the command that caused the error were:
  CR FEATR COUNT  LBA_48  LH LM LL DV DC  Powered_Up_Time  Command/Feature_Name
  -- == -- == -- == == == -- -- -- -- --  ---------------  --------------------
  60 00 00 01 00 00 00 4f 00 5f 1f 40 00     00:43:28.006  READ FPDMA QUEUED
  60 00 00 01 00 00 00 4e 00 5f 1f 40 00     00:43:28.006  READ FPDMA QUEUED
  60 00 00 01 00 00 00 4d 00 5f 1f 40 00     00:43:28.006  READ FPDMA QUEUED
  60 00 00 00 08 00 00 bc 00 63 2f 40 00     00:43:28.005  READ FPDMA QUEUED
  60 00 00 00 08 00 00 41 00 3f e7 40 00     00:43:27.960  READ FPDMA QUEUED

Error 5 [4] occurred at disk power-on lifetime: 6145 hours (256 days + 1 hours)
  When the command that caused the error occurred, the device was active or idle.

  After command completion occurred, registers were:
  ER -- ST COUNT  LBA_48  LH LM LL DV DC
  -- -- -- == -- == == == -- -- -- -- --
  40 -- 51 00 00 00 00 4d 00 5f a3 00 00  Error: UNC at LBA = 0x4d005fa3 = 1291870115

  Commands leading to the command that caused the error were:
  CR FEATR COUNT  LBA_48  LH LM LL DV DC  Powered_Up_Time  Command/Feature_Name
  -- == -- == -- == == == -- -- -- -- --  ---------------  --------------------
  60 00 00 01 00 00 00 4f 00 5f 1f 40 00     00:43:23.778  READ FPDMA QUEUED
  60 00 00 01 00 00 00 4e 00 5f 1f 40 00     00:43:23.778  READ FPDMA QUEUED
  60 00 00 01 00 00 00 4d 00 5f 1f 40 00     00:43:23.777  READ FPDMA QUEUED
  60 00 00 00 13 00 01 94 00 62 3f 40 00     00:43:23.741  READ FPDMA QUEUED
  60 00 00 00 20 00 01 94 00 62 1f 40 00     00:43:23.736  READ FPDMA QUEUED

Error 4 [3] occurred at disk power-on lifetime: 6145 hours (256 days + 1 hours)
  When the command that caused the error occurred, the device was active or idle.

  After command completion occurred, registers were:
  ER -- ST COUNT  LBA_48  LH LM LL DV DC
  -- -- -- == -- == == == -- -- -- -- --
  40 -- 51 00 00 00 00 4d 00 5f a3 00 00  Error: UNC at LBA = 0x4d005fa3 = 1291870115

  Commands leading to the command that caused the error were:
  CR FEATR COUNT  LBA_48  LH LM LL DV DC  Powered_Up_Time  Command/Feature_Name
  -- == -- == -- == == == -- -- -- -- --  ---------------  --------------------
  60 00 00 01 00 00 00 4f 00 5f 1f 40 00     00:43:19.549  READ FPDMA QUEUED
  60 00 00 01 00 00 00 4e 00 5f 1f 40 00     00:43:19.548  READ FPDMA QUEUED
  60 00 00 01 00 00 00 4d 00 5f 1f 40 00     00:43:19.548  READ FPDMA QUEUED
  60 00 00 00 10 00 00 3e 00 16 df 40 00     00:43:19.540  READ FPDMA QUEUED
  60 00 00 00 f8 00 00 3f 00 16 d7 40 00     00:43:19.533  READ FPDMA QUEUED

Error 3 [2] occurred at disk power-on lifetime: 6145 hours (256 days + 1 hours)
  When the command that caused the error occurred, the device was active or idle.

  After command completion occurred, registers were:
  ER -- ST COUNT  LBA_48  LH LM LL DV DC
  -- -- -- == -- == == == -- -- -- -- --
  40 -- 51 00 00 00 00 4d 00 5f a3 00 00  Error: UNC at LBA = 0x4d005fa3 = 1291870115

  Commands leading to the command that caused the error were:
  CR FEATR COUNT  LBA_48  LH LM LL DV DC  Powered_Up_Time  Command/Feature_Name
  -- == -- == -- == == == -- -- -- -- --  ---------------  --------------------
  60 00 00 01 00 00 00 4f 00 5f 1f 40 00     00:43:15.346  READ FPDMA QUEUED
  60 00 00 01 00 00 00 4e 00 5f 1f 40 00     00:43:15.346  READ FPDMA QUEUED
  60 00 00 01 00 00 00 4d 00 5f 1f 40 00     00:43:15.346  READ FPDMA QUEUED
  60 00 00 00 08 00 01 51 00 c6 bf 40 00     00:43:15.346  READ FPDMA QUEUED
  60 00 00 00 08 00 0f 97 00 10 9f 40 00     00:43:15.333  READ FPDMA QUEUED

Error 2 [1] occurred at disk power-on lifetime: 6145 hours (256 days + 1 hours)
  When the command that caused the error occurred, the device was active or idle.

  After command completion occurred, registers were:
  ER -- ST COUNT  LBA_48  LH LM LL DV DC
  -- -- -- == -- == == == -- -- -- -- --
  40 -- 51 00 00 00 00 4d 00 5f a3 00 00  Error: UNC at LBA = 0x4d005fa3 = 1291870115

  Commands leading to the command that caused the error were:
  CR FEATR COUNT  LBA_48  LH LM LL DV DC  Powered_Up_Time  Command/Feature_Name
  -- == -- == -- == == == -- -- -- -- --  ---------------  --------------------
  60 00 00 00 07 00 03 e8 00 31 b7 40 00     00:43:11.023  READ FPDMA QUEUED
  60 00 00 01 00 00 00 4f 00 5f 1f 40 00     00:43:11.023  READ FPDMA QUEUED
  60 00 00 01 00 00 00 4e 00 5f 1f 40 00     00:43:11.023  READ FPDMA QUEUED
  60 00 00 01 00 00 00 4d 00 5f 1f 40 00     00:43:11.023  READ FPDMA QUEUED
  60 00 00 00 08 00 00 7d 00 0b 07 40 00     00:43:11.022  READ FPDMA QUEUED

SMART Extended Self-test Log Version: 1 (1 sectors)
Num  Test_Description    Status                  Remaining  LifeTime(hours)  LBA_of_first_error
# 1  Extended offline    Interrupted (host reset)      00%      1922         -

SMART Selective self-test log data structure revision number 1
 SPAN  MIN_LBA  MAX_LBA  CURRENT_TEST_STATUS
    1        0        0  Not_testing
    2        0        0  Not_testing
    3        0        0  Not_testing
    4        0        0  Not_testing
    5        0        0  Not_testing
Selective self-test flags (0x0):
  After scanning selected spans, do NOT read-scan remainder of disk.
If Selective self-test is pending on power-up, resume after 0 minute delay.

SCT Status Version:                  3
SCT Version (vendor specific):       522 (0x020a)
SCT Support Level:                   1
Device State:                        Active (0)
Current Temperature:                    42 Celsius
Power Cycle Min/Max Temperature:     41/42 Celsius
Lifetime    Min/Max Temperature:     12/57 Celsius
Under/Over Temperature Limit Count:   0/0

SCT Temperature History Version:     2
Temperature Sampling Period:         1 minute
Temperature Logging Interval:        59 minutes
Min/Max recommended Temperature:     14/55 Celsius
Min/Max Temperature Limit:           10/60 Celsius
Temperature History Size (Index):    128 (17)

SCT Error Recovery Control:
           Read: Disabled
          Write: Disabled

Device Statistics (GP/SMART Log 0x04) not supported

Pending Defects log (GP Log 0x0c) not supported

SATA Phy Event Counters (GP Log 0x11)
ID      Size     Value  Description
0x000a  2            7  Device-to-host register FISes sent due to a COMRESET
0x0001  2            0  Command failed due to ICRC error
0x0003  2            0  R_ERR response for device-to-host data FIS
0x0004  2            0  R_ERR response for host-to-device data FIS
0x0006  2            0  R_ERR response for device-to-host non-data FIS
0x0007  2            0  R_ERR response for host-to-device non-data FIS

