smartctl 7.3 2022-02-28 r5338 [x86_64-linux-6.1.20-generic-2rosa2021.1-x86_64] (local build)
Copyright (C) 2002-22, Bruce Allen, Christian Franke, www.smartmontools.org

=== START OF INFORMATION SECTION ===
Model Family:     Seagate Barracuda 7200.12
Device Model:     ST3250318AS
Serial Number:    --
LU WWN Device Id: 5 000c50 ...
Firmware Version: HP35
User Capacity:    250,059,350,016 bytes [250 GB]
Sector Size:      512 bytes logical/physical
Rotation Rate:    7200 rpm
Device is:        In smartctl database 7.3/5319
ATA Version is:   ATA8-ACS T13/1699-D revision 4
SATA Version is:  SATA 2.6, 3.0 Gb/s
Local Time is:    Sun Apr  9 14:35:32 2023 CEST

==> WARNING: A firmware update for this drive may be available,
see the following Seagate web pages:
http://knowledge.seagate.com/articles/en_US/FAQ/207931en
http://knowledge.seagate.com/articles/en_US/FAQ/213891en

SMART support is: Available - device has SMART capability.
SMART support is: Enabled
AAM feature is:   Unavailable
APM feature is:   Unavailable
Rd look-ahead is: Enabled
Write cache is:   Enabled
DSN feature is:   Unavailable
ATA Security is:  Disabled, frozen [SEC2]
Wt Cache Reorder: Unknown

=== START OF READ SMART DATA SECTION ===
SMART overall-health self-assessment test result: PASSED

General SMART Values:
Offline data collection status:  (0x82)	Offline data collection activity
					was completed without error.
					Auto Offline Data Collection: Enabled.
Self-test execution status:      (   0)	The previous self-test routine completed
					without error or no self-test has ever 
					been run.
Total time to complete Offline 
data collection: 		(  600) seconds.
Offline data collection
capabilities: 			 (0x5b) SMART execute Offline immediate.
					Auto Offline data collection on/off support.
					Suspend Offline collection upon new
					command.
					Offline surface scan supported.
					Self-test supported.
					No Conveyance Self-test supported.
					Selective Self-test supported.
SMART capabilities:            (0x0003)	Saves SMART data before entering
					power-saving mode.
					Supports SMART auto save timer.
Error logging capability:        (0x01)	Error logging supported.
					General Purpose Logging supported.
Short self-test routine 
recommended polling time: 	 (   2) minutes.
Extended self-test routine
recommended polling time: 	 (  42) minutes.
SCT capabilities: 	       (0x103f)	SCT Status supported.
					SCT Error Recovery Control supported.
					SCT Feature Control supported.
					SCT Data Table supported.

SMART Attributes Data Structure revision number: 10
Vendor Specific SMART Attributes with Thresholds:
ID# ATTRIBUTE_NAME          FLAGS    VALUE WORST THRESH FAIL RAW_VALUE
  1 Raw_Read_Error_Rate     POSR-K   117   099   006    -    164044142
  3 Spin_Up_Time            PO---K   097   097   000    -    0
  4 Start_Stop_Count        -O--CK   089   089   020    -    11594
  5 Reallocated_Sector_Ct   PO--CK   100   100   036    -    2
  7 Seek_Error_Rate         POSR-K   081   060   030    -    153711993
  9 Power_On_Hours          -O--CK   098   098   000    -    1965
 10 Spin_Retry_Count        PO--CK   100   100   097    -    0
 12 Power_Cycle_Count       -O--CK   095   095   020    -    5787
180 Unknown_HDD_Attribute   PO-R-K   100   100   000    -    2059329349
183 Runtime_Bad_Block       -O--CK   100   100   000    -    0
184 End-to-End_Error        PO--CK   100   100   097    -    0
187 Reported_Uncorrect      -O--CK   090   090   000    -    10
188 Command_Timeout         -O--CK   100   099   000    -    2
189 High_Fly_Writes         -O-RCK   100   100   000    -    0
190 Airflow_Temperature_Cel -O---K   081   054   045    -    19 (Min/Max 17/19)
194 Temperature_Celsius     -O---K   019   046   000    -    19 (0 5 0 0 0)
195 Hardware_ECC_Recovered  -O-RCK   052   030   000    -    164044142
196 Reallocated_Event_Count -O--CK   100   100   036    -    2
197 Current_Pending_Sector  -O--CK   100   100   000    -    0
198 Offline_Uncorrectable   ----CK   100   100   000    -    0
199 UDMA_CRC_Error_Count    -O--CK   200   200   000    -    5
                            ||||||_ K auto-keep
                            |||||__ C event count
                            ||||___ R error rate
                            |||____ S speed/performance
                            ||_____ O updated online
                            |______ P prefailure warning

General Purpose Log Directory Version 1
SMART           Log Directory Version 1 [multi-sector log support]
Address    Access  R/W   Size  Description
0x00       GPL,SL  R/O      1  Log Directory
0x01       GPL,SL  R/O      1  Summary SMART error log
0x02       GPL,SL  R/O      5  Comprehensive SMART error log
0x03       GPL     R/O      5  Ext. Comprehensive SMART error log
0x06       GPL,SL  R/O      1  SMART self-test log
0x07       GPL     R/O      1  Extended self-test log
0x09       GPL,SL  R/W      1  Selective self-test log
0x10       GPL     R/O      1  NCQ Command Error log
0x11       GPL     R/O      1  SATA Phy Event Counters log
0x21       GPL     R/O      1  Write stream error log
0x22       GPL     R/O      1  Read stream error log
0x80-0x9f  GPL,SL  R/W     16  Host vendor specific log
0xa1       GPL,SL  VS      20  Device vendor specific log
0xa2       GPL     VS    2248  Device vendor specific log
0xa8       GPL,SL  VS     129  Device vendor specific log
0xa9       GPL,SL  VS       1  Device vendor specific log
0xb0       GPL     VS    2928  Device vendor specific log
0xbd       GPL     VS     252  Device vendor specific log
0xbe-0xbf  GPL     VS   65535  Device vendor specific log
0xe0       GPL,SL  R/W      1  SCT Command/Status
0xe1       GPL,SL  R/W      1  SCT Data Transfer

SMART Extended Comprehensive Error Log Version: 1 (5 sectors)
Device Error Count: 10
	CR     = Command Register
	FEATR  = Features Register
	COUNT  = Count (was: Sector Count) Register
	LBA_48 = Upper bytes of LBA High/Mid/Low Registers ]  ATA-8
	LH     = LBA High (was: Cylinder High) Register    ]   LBA
	LM     = LBA Mid (was: Cylinder Low) Register      ] Register
	LL     = LBA Low (was: Sector Number) Register     ]
	DV     = Device (was: Device/Head) Register
	DC     = Device Control Register
	ER     = Error register
	ST     = Status register
Powered_Up_Time is measured from power on, and printed as
DDd+hh:mm:SS.sss where DD=days, hh=hours, mm=minutes,
SS=sec, and sss=millisec. It "wraps" after 49.710 days.

Error 10 [9] occurred at disk power-on lifetime: 127 hours (5 days + 7 hours)
  When the command that caused the error occurred, the device was active or idle.

  After command completion occurred, registers were:
  ER -- ST COUNT  LBA_48  LH LM LL DV DC
  -- -- -- == -- == == == -- -- -- -- --
  40 -- 51 00 00 00 00 0e bc 45 af 00 00  Error: WP at LBA = 0x0ebc45af = 247219631

  Commands leading to the command that caused the error were:
  CR FEATR COUNT  LBA_48  LH LM LL DV DC  Powered_Up_Time  Command/Feature_Name
  -- == -- == -- == == == -- -- -- -- --  ---------------  --------------------
  61 00 00 00 08 00 00 00 6c 2d 38 40 00     00:20:22.997  WRITE FPDMA QUEUED
  61 00 00 00 08 00 00 00 0d 0b 76 40 00     00:20:22.996  WRITE FPDMA QUEUED
  61 00 00 00 07 00 00 00 0d 0b 6f 40 00     00:20:22.996  WRITE FPDMA QUEUED
  61 00 00 00 10 00 00 00 6a db 28 40 00     00:20:22.996  WRITE FPDMA QUEUED
  61 00 00 00 08 00 00 01 01 95 30 40 00     00:20:22.995  WRITE FPDMA QUEUED

Error 9 [8] occurred at disk power-on lifetime: 127 hours (5 days + 7 hours)
  When the command that caused the error occurred, the device was active or idle.

  After command completion occurred, registers were:
  ER -- ST COUNT  LBA_48  LH LM LL DV DC
  -- -- -- == -- == == == -- -- -- -- --
  40 -- 51 00 00 00 00 0e bc 45 af 00 00  Error: WP at LBA = 0x0ebc45af = 247219631

  Commands leading to the command that caused the error were:
  CR FEATR COUNT  LBA_48  LH LM LL DV DC  Powered_Up_Time  Command/Feature_Name
  -- == -- == -- == == == -- -- -- -- --  ---------------  --------------------
  61 00 00 00 08 00 00 00 6a c3 e8 40 00     00:20:19.952  WRITE FPDMA QUEUED
  61 00 00 00 08 00 00 01 01 95 30 40 00     00:20:19.951  WRITE FPDMA QUEUED
  61 00 00 00 08 00 00 00 6a bf 98 40 00     00:20:19.951  WRITE FPDMA QUEUED
  61 00 00 00 08 00 00 00 6c fb d8 40 00     00:20:19.951  WRITE FPDMA QUEUED
  61 00 00 00 08 00 00 00 6a bf 88 40 00     00:20:19.950  WRITE FPDMA QUEUED

Error 8 [7] occurred at disk power-on lifetime: 127 hours (5 days + 7 hours)
  When the command that caused the error occurred, the device was active or idle.

  After command completion occurred, registers were:
  ER -- ST COUNT  LBA_48  LH LM LL DV DC
  -- -- -- == -- == == == -- -- -- -- --
  40 -- 51 00 00 00 00 0e bc 45 af 00 00  Error: WP at LBA = 0x0ebc45af = 247219631

  Commands leading to the command that caused the error were:
  CR FEATR COUNT  LBA_48  LH LM LL DV DC  Powered_Up_Time  Command/Feature_Name
  -- == -- == -- == == == -- -- -- -- --  ---------------  --------------------
  61 00 00 00 01 00 00 00 9b 54 40 40 00     00:20:17.003  WRITE FPDMA QUEUED
  61 00 00 00 08 00 00 00 66 bd e0 40 00     00:20:17.003  WRITE FPDMA QUEUED
  60 00 00 00 80 00 00 0e bc 45 a0 40 00     00:20:17.002  READ FPDMA QUEUED
  60 00 00 00 20 00 00 00 0d 0b 40 40 00     00:20:17.002  READ FPDMA QUEUED
  61 00 00 00 08 00 00 00 ab d5 e0 40 00     00:20:17.002  WRITE FPDMA QUEUED

Error 7 [6] occurred at disk power-on lifetime: 127 hours (5 days + 7 hours)
  When the command that caused the error occurred, the device was active or idle.

  After command completion occurred, registers were:
  ER -- ST COUNT  LBA_48  LH LM LL DV DC
  -- -- -- == -- == == == -- -- -- -- --
  40 -- 51 00 00 00 00 0e bc 45 af 00 00  Error: WP at LBA = 0x0ebc45af = 247219631

  Commands leading to the command that caused the error were:
  CR FEATR COUNT  LBA_48  LH LM LL DV DC  Powered_Up_Time  Command/Feature_Name
  -- == -- == -- == == == -- -- -- -- --  ---------------  --------------------
  61 00 00 00 08 00 00 01 01 95 30 40 00     00:20:14.028  WRITE FPDMA QUEUED
  61 00 00 00 08 00 00 00 6c fb e0 40 00     00:20:14.028  WRITE FPDMA QUEUED
  61 00 00 00 08 00 00 00 66 bd d8 40 00     00:20:14.027  WRITE FPDMA QUEUED
  61 00 00 00 08 00 00 00 68 0f e8 40 00     00:20:14.027  WRITE FPDMA QUEUED
  61 00 00 00 10 00 00 01 01 93 d0 40 00     00:20:14.027  WRITE FPDMA QUEUED

Error 6 [5] occurred at disk power-on lifetime: 127 hours (5 days + 7 hours)
  When the command that caused the error occurred, the device was active or idle.

  After command completion occurred, registers were:
  ER -- ST COUNT  LBA_48  LH LM LL DV DC
  -- -- -- == -- == == == -- -- -- -- --
  40 -- 51 00 00 00 00 0e bc 45 af 00 00  Error: UNC at LBA = 0x0ebc45af = 247219631

  Commands leading to the command that caused the error were:
  CR FEATR COUNT  LBA_48  LH LM LL DV DC  Powered_Up_Time  Command/Feature_Name
  -- == -- == -- == == == -- -- -- -- --  ---------------  --------------------
  60 00 00 00 08 00 00 04 ca 3f e0 40 00     00:20:11.038  READ FPDMA QUEUED
  60 00 00 00 28 00 00 00 21 4d 66 40 00     00:20:11.034  READ FPDMA QUEUED
  61 00 00 00 08 00 00 01 01 92 f0 40 00     00:20:11.021  WRITE FPDMA QUEUED
  61 00 00 00 08 00 00 01 01 92 e8 40 00     00:20:11.021  WRITE FPDMA QUEUED
  61 00 00 00 08 00 00 01 01 92 e0 40 00     00:20:11.020  WRITE FPDMA QUEUED

Error 5 [4] occurred at disk power-on lifetime: 127 hours (5 days + 7 hours)
  When the command that caused the error occurred, the device was active or idle.

  After command completion occurred, registers were:
  ER -- ST COUNT  LBA_48  LH LM LL DV DC
  -- -- -- == -- == == == -- -- -- -- --
  40 -- 51 00 00 00 00 0e bc 45 af 00 00  Error: UNC at LBA = 0x0ebc45af = 247219631

  Commands leading to the command that caused the error were:
  CR FEATR COUNT  LBA_48  LH LM LL DV DC  Powered_Up_Time  Command/Feature_Name
  -- == -- == -- == == == -- -- -- -- --  ---------------  --------------------
  60 00 00 00 20 00 00 02 c1 c8 60 40 00     00:20:08.081  READ FPDMA QUEUED
  60 00 00 00 20 00 00 02 c1 b3 60 40 00     00:20:08.081  READ FPDMA QUEUED
  60 00 00 00 20 00 00 00 12 c4 20 40 00     00:20:08.081  READ FPDMA QUEUED
  61 00 00 00 08 00 00 00 66 bd d8 40 00     00:20:08.080  WRITE FPDMA QUEUED
  61 00 00 00 08 00 00 00 68 0f d0 40 00     00:20:08.080  WRITE FPDMA QUEUED

Error 4 [3] occurred at disk power-on lifetime: 127 hours (5 days + 7 hours)
  When the command that caused the error occurred, the device was active or idle.

  After command completion occurred, registers were:
  ER -- ST COUNT  LBA_48  LH LM LL DV DC
  -- -- -- == -- == == == -- -- -- -- --
  40 -- 51 00 00 00 00 0e bc 45 af 00 00  Error: UNC at LBA = 0x0ebc45af = 247219631

  Commands leading to the command that caused the error were:
  CR FEATR COUNT  LBA_48  LH LM LL DV DC  Powered_Up_Time  Command/Feature_Name
  -- == -- == -- == == == -- -- -- -- --  ---------------  --------------------
  60 00 00 00 30 00 00 00 ac 73 48 40 00     00:20:05.196  READ FPDMA QUEUED
  60 00 00 00 10 00 00 00 12 9a c8 40 00     00:20:05.196  READ FPDMA QUEUED
  60 00 00 00 40 00 00 0e c2 5d 02 40 00     00:20:05.195  READ FPDMA QUEUED
  60 00 00 00 08 00 00 00 cd a0 c0 40 00     00:20:05.195  READ FPDMA QUEUED
  60 00 00 00 3e 00 00 00 c6 d2 3a 40 00     00:20:05.195  READ FPDMA QUEUED

Error 3 [2] occurred at disk power-on lifetime: 127 hours (5 days + 7 hours)
  When the command that caused the error occurred, the device was active or idle.

  After command completion occurred, registers were:
  ER -- ST COUNT  LBA_48  LH LM LL DV DC
  -- -- -- == -- == == == -- -- -- -- --
  40 -- 51 00 00 00 00 0e bc 45 af 00 00  Error: UNC at LBA = 0x0ebc45af = 247219631

  Commands leading to the command that caused the error were:
  CR FEATR COUNT  LBA_48  LH LM LL DV DC  Powered_Up_Time  Command/Feature_Name
  -- == -- == -- == == == -- -- -- -- --  ---------------  --------------------
  60 00 00 00 10 00 00 00 12 9a c8 40 00     00:20:02.260  READ FPDMA QUEUED
  60 00 00 00 10 00 00 00 12 9b 88 40 00     00:20:02.259  READ FPDMA QUEUED
  60 00 00 00 10 00 00 00 0f d9 f0 40 00     00:20:02.252  READ FPDMA QUEUED
  60 00 00 00 10 00 00 01 02 67 38 40 00     00:20:02.241  READ FPDMA QUEUED
  60 00 00 00 10 00 00 00 12 9a e8 40 00     00:20:02.236  READ FPDMA QUEUED

SMART Extended Self-test Log Version: 1 (1 sectors)
Num  Test_Description    Status                  Remaining  LifeTime(hours)  LBA_of_first_error
# 1  Extended offline    Completed: read failure       80%      1751         137024643
# 2  Short offline       Completed without error       00%      1711         -
# 3  Extended offline    Interrupted (host reset)      60%      1693         -
# 4  Extended offline    Interrupted (host reset)      00%      1629         -
# 5  Short offline       Completed without error       00%      1561         -
# 6  Extended offline    Interrupted (host reset)      00%      1543         -
# 7  Extended offline    Interrupted (host reset)      90%      1510         -
# 8  Short offline       Completed without error       00%      1412         -
# 9  Short offline       Completed without error       00%      1403         -
#10  Short offline       Completed without error       00%      1398         -
#11  Short offline       Completed without error       00%      1390         -
#12  Short offline       Completed without error       00%      1379         -
#13  Extended offline    Completed without error       00%      1371         -
#14  Short offline       Completed without error       00%      1332         -
#15  Short offline       Completed without error       00%      1323         -
#16  Extended offline    Interrupted (host reset)      70%      1322         -
#17  Extended offline    Interrupted (host reset)      00%      1267         -
#18  Extended offline    Interrupted (host reset)      00%      1258         -
#19  Extended offline    Completed without error       00%      1223         -

SMART Selective self-test log data structure revision number 1
 SPAN  MIN_LBA  MAX_LBA  CURRENT_TEST_STATUS
    1        0        0  Not_testing
    2        0        0  Not_testing
    3        0        0  Not_testing
    4        0        0  Not_testing
    5        0        0  Not_testing
Selective self-test flags (0x0):
  After scanning selected spans, do NOT read-scan remainder of disk.
If Selective self-test is pending on power-up, resume after 0 minute delay.

SCT Status Version:                  3
SCT Version (vendor specific):       522 (0x020a)
Device State:                        Active (0)
Current Temperature:                    19 Celsius
Power Cycle Min/Max Temperature:     17/19 Celsius
Lifetime    Min/Max Temperature:      4/46 Celsius
Under/Over Temperature Limit Count:   0/0

SCT Temperature History Version:     2
Temperature Sampling Period:         1 minute
Temperature Logging Interval:        59 minutes
Min/Max recommended Temperature:     14/55 Celsius
Min/Max Temperature Limit:           10/60 Celsius
Temperature History Size (Index):    128 (116)

SCT Error Recovery Control:
           Read: Disabled
          Write: Disabled

Device Statistics (GP/SMART Log 0x04) not supported

Pending Defects log (GP Log 0x0c) not supported

SATA Phy Event Counters (GP Log 0x11)
ID      Size     Value  Description
0x000a  2            3  Device-to-host register FISes sent due to a COMRESET
0x0001  2            0  Command failed due to ICRC error
0x0003  2            0  R_ERR response for device-to-host data FIS
0x0004  2            0  R_ERR response for host-to-device data FIS
0x0006  2            0  R_ERR response for device-to-host non-data FIS
0x0007  2            0  R_ERR response for host-to-device non-data FIS



