smartctl 7.2 2020-12-30 r5155 [x86_64-linux-5.15.0-58-generic] (local build)
Copyright (C) 2002-20, Bruce Allen, Christian Franke, www.smartmontools.org

=== START OF INFORMATION SECTION ===
Model Number:                       SSDPEKKF512G8 NVMe INTEL 512GB
Serial Number:                      --
Firmware Version:                   D05N
PCI Vendor/Subsystem ID:            0x8086
IEEE OUI Identifier:                0x5cd2e4
Controller ID:                      1
NVMe Version:                       1.3
Number of Namespaces:               1
Namespace 1 Size/Capacity:          512,110,190,592 [512 GB]
Namespace 1 Formatted LBA Size:     512
Namespace 1 IEEE EUI-64:            5cd2e4 ...
Local Time is:                      Fri Jan 13 11:18:29 2023 +08
Firmware Updates (0x14):            2 Slots, no Reset required
Optional Admin Commands (0x0017):   Security Format Frmw_DL Self_Test
Optional NVM Commands (0x005f):     Comp Wr_Unc DS_Mngmt Wr_Zero Sav/Sel_Feat Timestmp
Log Page Attributes (0x0f):         S/H_per_NS Cmd_Eff_Lg Ext_Get_Lg Telmtry_Lg
Maximum Data Transfer Size:         64 Pages
Warning  Comp. Temp. Threshold:     75 Celsius
Critical Comp. Temp. Threshold:     80 Celsius

Supported Power States
St Op     Max   Active     Idle   RL RT WL WT  Ent_Lat  Ex_Lat
 0 +     9.00W       -        -    0  0  0  0        0       0
 1 +     4.60W       -        -    1  1  1  1        0       0
 2 +     3.80W       -        -    2  2  2  2        0       0
 3 -   0.0450W       -        -    3  3  3  3     2000    2000
 4 -   0.0040W       -        -    4  4  4  4     6000    8000

Supported LBA Sizes (NSID 0x1)
Id Fmt  Data  Metadt  Rel_Perf
 0 +     512       0         0

=== START OF SMART DATA SECTION ===
SMART overall-health self-assessment test result: PASSED

SMART/Health Information (NVMe Log 0x02)
Critical Warning:                   0x00
Temperature:                        33 Celsius
Available Spare:                    100%
Available Spare Threshold:          10%
Percentage Used:                    8%
Data Units Read:                    70,425,747 [36.0 TB]
Data Units Written:                 65,407,446 [33.4 TB]
Host Read Commands:                 1,109,645,532
Host Write Commands:                1,216,919,337
Controller Busy Time:               60,498
Power Cycles:                       4,524
Power On Hours:                     13,481
Unsafe Shutdowns:                   253
Media and Data Integrity Errors:    0
Error Information Log Entries:      0
Warning  Comp. Temperature Time:    0
Critical Comp. Temperature Time:    0
Thermal Temp. 1 Transition Count:   403
Thermal Temp. 2 Transition Count:   42
Thermal Temp. 1 Total Time:         4788
Thermal Temp. 2 Total Time:         635

Error Information (NVMe Log 0x01, 16 of 256 entries)
Num   ErrCount  SQId   CmdId  Status  PELoc          LBA  NSID    VS
  - [7 unused entries]
  7 18446744069908070399     -  0x0001  0x0002      - 18446744069414846467     -  0xff

