smartctl 7.2 2020-12-30 r5155 [x86_64-linux-5.10.74-generic-2rosa2021.1-x86_64] (local build)
Copyright (C) 2002-20, Bruce Allen, Christian Franke, www.smartmontools.org

=== START OF INFORMATION SECTION ===
Model Family:     Western Digital Blue
Device Model:     WDC WD10EZEX-60WN4A1
Serial Number:    --
LU WWN Device Id: 5 0014ee ...
Firmware Version: 03.01A03
User Capacity:    1,000,204,886,016 bytes [1.00 TB]
Sector Sizes:     512 bytes logical, 4096 bytes physical
Rotation Rate:    7200 rpm
Form Factor:      3.5 inches
Device is:        In smartctl database [for details use: -P show]
ATA Version is:   ACS-3 T13/2161-D revision 5
SATA Version is:  SATA 3.1, 6.0 Gb/s (current: 6.0 Gb/s)
Local Time is:    Sun May 22 13:52:40 2022 MSK
SMART support is: Available - device has SMART capability.
SMART support is: Enabled
AAM feature is:   Unavailable
APM level is:     128 (minimum power consumption without standby)
Rd look-ahead is: Enabled
Write cache is:   Enabled
DSN feature is:   Unavailable
ATA Security is:  Disabled, frozen [SEC2]
Wt Cache Reorder: Enabled

=== START OF READ SMART DATA SECTION ===
SMART overall-health self-assessment test result: PASSED

General SMART Values:
Offline data collection status:  (0x82)	Offline data collection activity
					was completed without error.
					Auto Offline Data Collection: Enabled.
Self-test execution status:      (   0)	The previous self-test routine completed
					without error or no self-test has ever 
					been run.
Total time to complete Offline 
data collection: 		(10800) seconds.
Offline data collection
capabilities: 			 (0x5b) SMART execute Offline immediate.
					Auto Offline data collection on/off support.
					Suspend Offline collection upon new
					command.
					Offline surface scan supported.
					Self-test supported.
					No Conveyance Self-test supported.
					Selective Self-test supported.
SMART capabilities:            (0x0003)	Saves SMART data before entering
					power-saving mode.
					Supports SMART auto save timer.
Error logging capability:        (0x01)	Error logging supported.
					General Purpose Logging supported.
Short self-test routine 
recommended polling time: 	 (   2) minutes.
Extended self-test routine
recommended polling time: 	 ( 113) minutes.
SCT capabilities: 	       (0x303d)	SCT Status supported.
					SCT Error Recovery Control supported.
					SCT Feature Control supported.
					SCT Data Table supported.

SMART Attributes Data Structure revision number: 16
Vendor Specific SMART Attributes with Thresholds:
ID# ATTRIBUTE_NAME          FLAGS    VALUE WORST THRESH FAIL RAW_VALUE
  1 Raw_Read_Error_Rate     POSR-K   200   200   051    -    3
  3 Spin_Up_Time            POS--K   173   171   021    -    2316
  4 Start_Stop_Count        -O--CK   099   099   000    -    1056
  5 Reallocated_Sector_Ct   PO--CK   200   200   140    -    0
  7 Seek_Error_Rate         POSR-K   100   253   051    -    0
  9 Power_On_Hours          -O--CK   098   098   000    -    1843
 10 Spin_Retry_Count        PO--CK   100   100   051    -    0
 11 Calibration_Retry_Count -O--CK   100   100   000    -    0
 12 Power_Cycle_Count       -O--CK   100   100   000    -    828
183 Runtime_Bad_Block       -O--CK   100   100   000    -    0
184 End-to-End_Error        PO--CK   100   100   097    -    0
187 Reported_Uncorrect      -O--CK   097   081   000    -    253
188 Command_Timeout         -O--CK   100   100   000    -    0
190 Airflow_Temperature_Cel -O---K   073   067   040    -    27 (Min/Max 23/27)
192 Power-Off_Retract_Count -O--CK   200   200   000    -    146
193 Load_Cycle_Count        -O--CK   199   199   000    -    3466
194 Temperature_Celsius     -O---K   117   110   000    -    26
196 Reallocated_Event_Count -O--CK   200   200   000    -    0
197 Current_Pending_Sector  -O--CK   200   200   000    -    1
198 Offline_Uncorrectable   ----CK   200   200   000    -    0
199 UDMA_CRC_Error_Count    -O--CK   200   200   000    -    0
200 Multi_Zone_Error_Rate   ---R--   200   200   000    -    0
                            ||||||_ K auto-keep
                            |||||__ C event count
                            ||||___ R error rate
                            |||____ S speed/performance
                            ||_____ O updated online
                            |______ P prefailure warning

General Purpose Log Directory Version 1
SMART           Log Directory Version 1 [multi-sector log support]
Address    Access  R/W   Size  Description
0x00       GPL,SL  R/O      1  Log Directory
0x01           SL  R/O      1  Summary SMART error log
0x02           SL  R/O      5  Comprehensive SMART error log
0x03       GPL     R/O      6  Ext. Comprehensive SMART error log
0x04       GPL,SL  R/O      8  Device Statistics log
0x06           SL  R/O      1  SMART self-test log
0x07       GPL     R/O      1  Extended self-test log
0x08       GPL     R/O      2  Power Conditions log
0x09           SL  R/W      1  Selective self-test log
0x0d       GPL,SL  R/O      8  LPS Mis-alignment log
0x10       GPL     R/O      1  NCQ Command Error log
0x11       GPL     R/O      1  SATA Phy Event Counters log
0x30       GPL,SL  R/O      9  IDENTIFY DEVICE data log
0x80-0x9f  GPL,SL  R/W     16  Host vendor specific log
0xa0-0xa7  GPL,SL  VS      16  Device vendor specific log
0xa8-0xb5  GPL,SL  VS       1  Device vendor specific log
0xb6       GPL     VS     231  Device vendor specific log
0xb6       SL      VS       1  Device vendor specific log
0xb7       GPL,SL  VS      48  Device vendor specific log
0xbd       GPL,SL  VS       1  Device vendor specific log
0xc0       GPL,SL  VS       1  Device vendor specific log
0xc1       GPL     VS      93  Device vendor specific log
0xe0       GPL,SL  R/W      1  SCT Command/Status
0xe1       GPL,SL  R/W      1  SCT Data Transfer

SMART Extended Comprehensive Error Log Version: 1 (6 sectors)
Device Error Count: 253 (device log contains only the most recent 24 errors)
	CR     = Command Register
	FEATR  = Features Register
	COUNT  = Count (was: Sector Count) Register
	LBA_48 = Upper bytes of LBA High/Mid/Low Registers ]  ATA-8
	LH     = LBA High (was: Cylinder High) Register    ]   LBA
	LM     = LBA Mid (was: Cylinder Low) Register      ] Register
	LL     = LBA Low (was: Sector Number) Register     ]
	DV     = Device (was: Device/Head) Register
	DC     = Device Control Register
	ER     = Error register
	ST     = Status register
Powered_Up_Time is measured from power on, and printed as
DDd+hh:mm:SS.sss where DD=days, hh=hours, mm=minutes,
SS=sec, and sss=millisec. It "wraps" after 49.710 days.

Error 253 [12] occurred at disk power-on lifetime: 1843 hours (76 days + 19 hours)
  When the command that caused the error occurred, the device was active or idle.

  After command completion occurred, registers were:
  ER -- ST COUNT  LBA_48  LH LM LL DV DC
  -- -- -- == -- == == == -- -- -- -- --
  40 -- 53 00 00 00 00 00 6c 98 50 40 00  Error: WP at LBA = 0x006c9850 = 7116880

  Commands leading to the command that caused the error were:
  CR FEATR COUNT  LBA_48  LH LM LL DV DC  Powered_Up_Time  Command/Feature_Name
  -- == -- == -- == == == -- -- -- -- --  ---------------  --------------------
  61 00 08 00 d0 00 00 00 35 c6 38 40 08     03:28:13.927  WRITE FPDMA QUEUED
  61 00 08 00 c8 00 00 00 31 28 88 40 08     03:28:13.927  WRITE FPDMA QUEUED
  61 00 08 00 18 00 00 00 35 9d 30 40 08     03:28:13.927  WRITE FPDMA QUEUED
  61 00 08 00 10 00 00 00 35 9d c0 40 08     03:28:13.927  WRITE FPDMA QUEUED
  61 00 08 00 08 00 00 00 35 9e b8 40 08     03:28:13.927  WRITE FPDMA QUEUED

Error 252 [11] occurred at disk power-on lifetime: 1843 hours (76 days + 19 hours)
  When the command that caused the error occurred, the device was active or idle.

  After command completion occurred, registers were:
  ER -- ST COUNT  LBA_48  LH LM LL DV DC
  -- -- -- == -- == == == -- -- -- -- --
  40 -- 53 00 00 00 00 00 6c 98 50 40 00  Error: UNC at LBA = 0x006c9850 = 7116880

  Commands leading to the command that caused the error were:
  CR FEATR COUNT  LBA_48  LH LM LL DV DC  Powered_Up_Time  Command/Feature_Name
  -- == -- == -- == == == -- -- -- -- --  ---------------  --------------------
  60 00 08 00 a8 00 00 00 6c 98 50 40 08     03:26:47.616  READ FPDMA QUEUED
  60 00 20 00 98 00 00 12 d6 21 b0 40 08     03:26:47.616  READ FPDMA QUEUED
  60 00 20 00 88 00 00 08 72 88 00 40 08     03:26:47.616  READ FPDMA QUEUED
  60 00 08 00 80 00 00 14 e3 b8 00 40 08     03:26:47.615  READ FPDMA QUEUED
  60 00 80 00 78 00 00 0d b8 5f 60 40 08     03:26:47.615  READ FPDMA QUEUED

Error 251 [10] occurred at disk power-on lifetime: 1843 hours (76 days + 19 hours)
  When the command that caused the error occurred, the device was active or idle.

  After command completion occurred, registers were:
  ER -- ST COUNT  LBA_48  LH LM LL DV DC
  -- -- -- == -- == == == -- -- -- -- --
  40 -- 53 00 00 00 00 00 6c 98 50 40 00  Error: UNC at LBA = 0x006c9850 = 7116880

  Commands leading to the command that caused the error were:
  CR FEATR COUNT  LBA_48  LH LM LL DV DC  Powered_Up_Time  Command/Feature_Name
  -- == -- == -- == == == -- -- -- -- --  ---------------  --------------------
  60 00 08 00 00 00 00 02 4c 26 a8 40 08     03:26:43.950  READ FPDMA QUEUED
  60 00 20 00 f8 00 00 12 d6 21 b0 40 08     03:26:43.948  READ FPDMA QUEUED
  60 00 20 00 e0 00 00 08 72 88 00 40 08     03:26:43.947  READ FPDMA QUEUED
  60 00 08 00 30 00 00 06 0a 69 20 40 08     03:26:43.946  READ FPDMA QUEUED
  60 00 08 00 d8 00 00 14 e3 b8 00 40 08     03:26:43.918  READ FPDMA QUEUED

Error 250 [9] occurred at disk power-on lifetime: 1839 hours (76 days + 15 hours)
  When the command that caused the error occurred, the device was active or idle.

  After command completion occurred, registers were:
  ER -- ST COUNT  LBA_48  LH LM LL DV DC
  -- -- -- == -- == == == -- -- -- -- --
  40 -- 53 00 00 00 00 00 6c 98 50 40 00  Error: UNC at LBA = 0x006c9850 = 7116880

  Commands leading to the command that caused the error were:
  CR FEATR COUNT  LBA_48  LH LM LL DV DC  Powered_Up_Time  Command/Feature_Name
  -- == -- == -- == == == -- -- -- -- --  ---------------  --------------------
  60 00 c0 00 60 00 00 0d f6 ee f0 40 08     00:00:35.030  READ FPDMA QUEUED
  60 00 28 00 58 00 00 0b 89 69 08 40 08     00:00:35.030  READ FPDMA QUEUED
  60 00 08 00 50 00 00 0b 89 69 00 40 08     00:00:35.030  READ FPDMA QUEUED
  60 00 30 00 40 00 00 0f 17 6a 88 40 08     00:00:35.030  READ FPDMA QUEUED
  60 00 20 00 38 00 00 00 f0 1c 80 40 08     00:00:35.030  READ FPDMA QUEUED

Error 249 [8] occurred at disk power-on lifetime: 1839 hours (76 days + 15 hours)
  When the command that caused the error occurred, the device was active or idle.

  After command completion occurred, registers were:
  ER -- ST COUNT  LBA_48  LH LM LL DV DC
  -- -- -- == -- == == == -- -- -- -- --
  40 -- 53 00 00 00 00 00 6c 98 50 40 00  Error: UNC at LBA = 0x006c9850 = 7116880

  Commands leading to the command that caused the error were:
  CR FEATR COUNT  LBA_48  LH LM LL DV DC  Powered_Up_Time  Command/Feature_Name
  -- == -- == -- == == == -- -- -- -- --  ---------------  --------------------
  60 00 20 00 68 00 00 0f 10 e7 00 40 08     00:00:31.361  READ FPDMA QUEUED
  60 00 20 00 10 00 00 0f 3e c3 c0 40 08     00:00:31.324  READ FPDMA QUEUED
  60 00 a8 00 20 00 00 0d f6 ea 68 40 08     00:00:31.324  READ FPDMA QUEUED
  60 01 00 00 08 00 00 0d f6 e9 68 40 08     00:00:31.323  READ FPDMA QUEUED
  60 00 c0 00 f0 00 00 0d f6 ee f0 40 08     00:00:31.323  READ FPDMA QUEUED

Error 248 [7] occurred at disk power-on lifetime: 1838 hours (76 days + 14 hours)
  When the command that caused the error occurred, the device was active or idle.

  After command completion occurred, registers were:
  ER -- ST COUNT  LBA_48  LH LM LL DV DC
  -- -- -- == -- == == == -- -- -- -- --
  40 -- 53 00 00 00 00 00 6c 98 50 40 00  Error: WP at LBA = 0x006c9850 = 7116880

  Commands leading to the command that caused the error were:
  CR FEATR COUNT  LBA_48  LH LM LL DV DC  Powered_Up_Time  Command/Feature_Name
  -- == -- == -- == == == -- -- -- -- --  ---------------  --------------------
  61 00 08 00 f8 00 00 12 2a f0 f0 40 08     00:41:29.149  WRITE FPDMA QUEUED
  61 00 08 00 b8 00 00 12 2a f1 a8 40 08     00:41:29.149  WRITE FPDMA QUEUED
  61 00 10 00 b0 00 00 12 2c 66 78 40 08     00:41:29.149  WRITE FPDMA QUEUED
  61 00 08 00 a8 00 00 12 2c 66 a0 40 08     00:41:29.149  WRITE FPDMA QUEUED
  61 00 20 00 a0 00 00 12 2c 66 c0 40 08     00:41:29.149  WRITE FPDMA QUEUED

Error 247 [6] occurred at disk power-on lifetime: 1838 hours (76 days + 14 hours)
  When the command that caused the error occurred, the device was active or idle.

  After command completion occurred, registers were:
  ER -- ST COUNT  LBA_48  LH LM LL DV DC
  -- -- -- == -- == == == -- -- -- -- --
  40 -- 53 00 00 00 00 00 6c 98 50 40 00  Error: WP at LBA = 0x006c9850 = 7116880

  Commands leading to the command that caused the error were:
  CR FEATR COUNT  LBA_48  LH LM LL DV DC  Powered_Up_Time  Command/Feature_Name
  -- == -- == -- == == == -- -- -- -- --  ---------------  --------------------
  61 00 08 00 20 00 00 03 73 ac 10 40 08     00:41:21.978  WRITE FPDMA QUEUED
  61 00 08 00 10 00 00 00 09 68 08 40 08     00:41:21.978  WRITE FPDMA QUEUED
  60 00 08 00 a8 00 00 00 11 6f d8 40 08     00:41:21.978  READ FPDMA QUEUED
  60 00 08 00 30 00 00 00 6c 98 50 40 08     00:41:21.978  READ FPDMA QUEUED
  60 00 08 00 98 00 00 01 4a ae 00 40 08     00:41:21.949  READ FPDMA QUEUED

Error 246 [5] occurred at disk power-on lifetime: 1838 hours (76 days + 14 hours)
  When the command that caused the error occurred, the device was active or idle.

  After command completion occurred, registers were:
  ER -- ST COUNT  LBA_48  LH LM LL DV DC
  -- -- -- == -- == == == -- -- -- -- --
  40 -- 53 00 00 00 00 00 6c 98 50 40 00  Error: WP at LBA = 0x006c9850 = 7116880

  Commands leading to the command that caused the error were:
  CR FEATR COUNT  LBA_48  LH LM LL DV DC  Powered_Up_Time  Command/Feature_Name
  -- == -- == -- == == == -- -- -- -- --  ---------------  --------------------
  61 00 08 00 78 00 00 04 5d e1 10 40 08     00:41:18.271  WRITE FPDMA QUEUED
  61 00 10 00 18 00 00 03 73 ab b0 40 08     00:41:18.271  WRITE FPDMA QUEUED
  60 00 08 00 08 00 00 00 6c 98 50 40 08     00:41:18.271  READ FPDMA QUEUED
  61 00 08 00 00 00 00 12 2c 66 18 40 08     00:41:18.270  WRITE FPDMA QUEUED
  61 00 10 00 f8 00 00 12 2c 65 e0 40 08     00:41:18.270  WRITE FPDMA QUEUED

SMART Extended Self-test Log Version: 1 (1 sectors)
No self-tests have been logged.  [To run self-tests, use: smartctl -t]

SMART Selective self-test log data structure revision number 1
 SPAN  MIN_LBA  MAX_LBA  CURRENT_TEST_STATUS
    1        0        0  Not_testing
    2        0        0  Not_testing
    3        0        0  Not_testing
    4        0        0  Not_testing
    5        0        0  Not_testing
Selective self-test flags (0x0):
  After scanning selected spans, do NOT read-scan remainder of disk.
If Selective self-test is pending on power-up, resume after 0 minute delay.

SCT Status Version:                  3
SCT Version (vendor specific):       258 (0x0102)
Device State:                        Active (0)
Current Temperature:                    27 Celsius
Power Cycle Min/Max Temperature:     23/27 Celsius
Lifetime    Min/Max Temperature:     19/33 Celsius
Under/Over Temperature Limit Count:   0/0
Vendor specific:
01 00 00 00 00 00 00 00 00 00 00 00 00 00 00 00
00 00 00 00 00 00 00 00 00 00 00 00 00 00 00 00

SCT Temperature History Version:     2
Temperature Sampling Period:         1 minute
Temperature Logging Interval:        1 minute
Min/Max recommended Temperature:      0/60 Celsius
Min/Max Temperature Limit:           -41/85 Celsius
Temperature History Size (Index):    128 (63)

SCT Error Recovery Control:
           Read:     85 (8.5 seconds)
          Write:     85 (8.5 seconds)

Device Statistics (GP Log 0x04)
Page  Offset Size        Value Flags Description
0x01  =====  =               =  ===  == General Statistics (rev 1) ==
0x01  0x008  4             828  ---  Lifetime Power-On Resets
0x01  0x010  4            1843  ---  Power-on Hours
0x01  0x018  6     18435885935  ---  Logical Sectors Written
0x01  0x020  6       125496403  ---  Number of Write Commands
0x01  0x028  6     19972172524  ---  Logical Sectors Read
0x01  0x030  6       130959999  ---  Number of Read Commands
0x01  0x038  6      2339832704  ---  Date and Time TimeStamp
0x03  =====  =               =  ===  == Rotating Media Statistics (rev 1) ==
0x03  0x008  4            1771  ---  Spindle Motor Power-on Hours
0x03  0x010  4            1444  ---  Head Flying Hours
0x03  0x018  4            3613  ---  Head Load Events
0x03  0x020  4               0  ---  Number of Reallocated Logical Sectors
0x03  0x028  4             274  ---  Read Recovery Attempts
0x03  0x030  4               0  ---  Number of Mechanical Start Failures
0x03  0x038  4               8  ---  Number of Realloc. Candidate Logical Sectors
0x03  0x040  4             146  ---  Number of High Priority Unload Events
0x04  =====  =               =  ===  == General Errors Statistics (rev 1) ==
0x04  0x008  4             253  ---  Number of Reported Uncorrectable Errors
0x04  0x010  4               0  ---  Resets Between Cmd Acceptance and Completion
0x05  =====  =               =  ===  == Temperature Statistics (rev 1) ==
0x05  0x008  1              26  ---  Current Temperature
0x05  0x010  1              27  ---  Average Short Term Temperature
0x05  0x018  1              25  ---  Average Long Term Temperature
0x05  0x020  1              33  ---  Highest Temperature
0x05  0x028  1              22  ---  Lowest Temperature
0x05  0x030  1              29  ---  Highest Average Short Term Temperature
0x05  0x038  1              24  ---  Lowest Average Short Term Temperature
0x05  0x040  1              26  ---  Highest Average Long Term Temperature
0x05  0x048  1              25  ---  Lowest Average Long Term Temperature
0x05  0x050  4               0  ---  Time in Over-Temperature
0x05  0x058  1              60  ---  Specified Maximum Operating Temperature
0x05  0x060  4               0  ---  Time in Under-Temperature
0x05  0x068  1               0  ---  Specified Minimum Operating Temperature
0x06  =====  =               =  ===  == Transport Statistics (rev 1) ==
0x06  0x008  4            3776  ---  Number of Hardware Resets
0x06  0x010  4            1271  ---  Number of ASR Events
0x06  0x018  4               0  ---  Number of Interface CRC Errors
                                |||_ C monitored condition met
                                ||__ D supports DSN
                                |___ N normalized value

Pending Defects log (GP Log 0x0c) not supported

SATA Phy Event Counters (GP Log 0x11)
ID      Size     Value  Description
0x0001  2            0  Command failed due to ICRC error
0x0002  2            0  R_ERR response for data FIS
0x0003  2            0  R_ERR response for device-to-host data FIS
0x0004  2            0  R_ERR response for host-to-device data FIS
0x0005  2            0  R_ERR response for non-data FIS
0x0006  2            0  R_ERR response for device-to-host non-data FIS
0x0007  2            0  R_ERR response for host-to-device non-data FIS
0x0008  2            0  Device-to-host non-data FIS retries
0x0009  2            2  Transition from drive PhyRdy to drive PhyNRdy
0x000a  2            4  Device-to-host register FISes sent due to a COMRESET
0x000b  2            0  CRC errors within host-to-device FIS
0x000d  2            0  Non-CRC errors within host-to-device FIS
0x000f  2            0  R_ERR response for host-to-device data FIS, CRC
0x0012  2            0  R_ERR response for host-to-device non-data FIS, CRC
0x8000  4          942  Vendor specific



