=== START OF INFORMATION SECTION ===
Model Family:     Western Digital RE2 Serial ATA
Device Model:     WDC WD5001ABYS-01YNA0
Serial Number:    --
LU WWN Device Id: 5 0014ee ...
Firmware Version: 59.01D01
User Capacity:    500 107 862 016 bytes [500 GB]
Sector Size:      512 bytes logical/physical
Rotation Rate:    7200 rpm
Device is:        In smartctl database [for details use: -P show]
ATA Version is:   ATA8-ACS (minor revision not indicated)
SATA Version is:  SATA 2.5, 3.0 Gb/s
Local Time is:    Sun Sep 20 12:34:59 2015 YEKT
SMART support is: Available - device has SMART capability.
SMART support is: Enabled
AAM level is:     254 (maximum performance), recommended: 128
APM feature is:   Unavailable
Rd look-ahead is: Enabled
Write cache is:   Enabled
ATA Security is:  Disabled, frozen [SEC2]
Wt Cache Reorder: Enabled

=== START OF READ SMART DATA SECTION ===
SMART overall-health self-assessment test result: PASSED

General SMART Values:
Offline data collection status:  (0x84)	Offline data collection activity
					was suspended by an interrupting command from host.
					Auto Offline Data Collection: Enabled.
Self-test execution status:      (   0)	The previous self-test routine completed
					without error or no self-test has ever 
					been run.
Total time to complete Offline 
data collection: 		(13200) seconds.
Offline data collection
capabilities: 			 (0x7b) SMART execute Offline immediate.
					Auto Offline data collection on/off support.
					Suspend Offline collection upon new
					command.
					Offline surface scan supported.
					Self-test supported.
					Conveyance Self-test supported.
					Selective Self-test supported.
SMART capabilities:            (0x0003)	Saves SMART data before entering
					power-saving mode.
					Supports SMART auto save timer.
Error logging capability:        (0x01)	Error logging supported.
					General Purpose Logging supported.
Short self-test routine 
recommended polling time: 	 (   2) minutes.
Extended self-test routine
recommended polling time: 	 ( 154) minutes.
Conveyance self-test routine
recommended polling time: 	 (   5) minutes.
SCT capabilities: 	       (0x303f)	SCT Status supported.
					SCT Error Recovery Control supported.
					SCT Feature Control supported.
					SCT Data Table supported.

SMART Attributes Data Structure revision number: 16
Vendor Specific SMART Attributes with Thresholds:
ID# ATTRIBUTE_NAME          FLAGS    VALUE WORST THRESH FAIL RAW_VALUE
  1 Raw_Read_Error_Rate     POSR--   200   200   051    -    1
  3 Spin_Up_Time            PO----   181   179   021    -    5908
  4 Start_Stop_Count        -O--CK   096   096   000    -    4630
  5 Reallocated_Sector_Ct   PO--CK   200   200   140    -    0
  7 Seek_Error_Rate         -OSR--   200   200   000    -    0
  9 Power_On_Hours          -O--CK   063   063   000    -    27040
 10 Spin_Retry_Count        -O--C-   100   100   000    -    0
 11 Calibration_Retry_Count -O--C-   100   100   000    -    0
 12 Power_Cycle_Count       -O--CK   096   096   000    -    4263
192 Power-Off_Retract_Count -O--CK   197   197   000    -    2810
193 Load_Cycle_Count        -O--CK   198   198   000    -    7062
194 Temperature_Celsius     -O---K   104   096   000    -    46
196 Reallocated_Event_Count -O--CK   200   200   000    -    0
197 Current_Pending_Sector  -O--C-   200   200   000    -    0
198 Offline_Uncorrectable   ----C-   200   200   000    -    0
199 UDMA_CRC_Error_Count    -OSRCK   200   200   000    -    5400
200 Multi_Zone_Error_Rate   ---R--   200   200   000    -    0
                            ||||||_ K auto-keep
                            |||||__ C event count
                            ||||___ R error rate
                            |||____ S speed/performance
                            ||_____ O updated online
                            |______ P prefailure warning

General Purpose Log Directory Version 1
SMART           Log Directory Version 1 [multi-sector log support]
Address    Access  R/W   Size  Description
0x00       GPL,SL  R/O      1  Log Directory
0x01           SL  R/O      1  Summary SMART error log
0x02           SL  R/O      5  Comprehensive SMART error log
0x03       GPL     R/O      6  Ext. Comprehensive SMART error log
0x06           SL  R/O      1  SMART self-test log
0x07       GPL     R/O      1  Extended self-test log
0x09           SL  R/W      1  Selective self-test log
0x10       GPL     R/O      1  NCQ Command Error log
0x11       GPL     R/O      1  SATA Phy Event Counters
0x80-0x9f  GPL,SL  R/W     16  Host vendor specific log
0xa0-0xa7  GPL,SL  VS      16  Device vendor specific log
0xa8-0xb7  GPL,SL  VS       1  Device vendor specific log
0xc0       GPL,SL  VS       1  Device vendor specific log
0xc1       GPL     VS      24  Device vendor specific log
0xe0       GPL,SL  R/W      1  SCT Command/Status
0xe1       GPL,SL  R/W      1  SCT Data Transfer

SMART Extended Comprehensive Error Log Version: 1 (6 sectors)
Device Error Count: 33 (device log contains only the most recent 24 errors)
	CR     = Command Register
	FEATR  = Features Register
	COUNT  = Count (was: Sector Count) Register
	LBA_48 = Upper bytes of LBA High/Mid/Low Registers ]  ATA-8
	LH     = LBA High (was: Cylinder High) Register    ]   LBA
	LM     = LBA Mid (was: Cylinder Low) Register      ] Register
	LL     = LBA Low (was: Sector Number) Register     ]
	DV     = Device (was: Device/Head) Register
	DC     = Device Control Register
	ER     = Error register
	ST     = Status register
Powered_Up_Time is measured from power on, and printed as
DDd+hh:mm:SS.sss where DD=days, hh=hours, mm=minutes,
SS=sec, and sss=millisec. It "wraps" after 49.710 days.

Error 33 [8] occurred at disk power-on lifetime: 0 hours (0 days + 0 hours)
  When the command that caused the error occurred, the device was in an unknown state.

  After command completion occurred, registers were:
  ER -- ST COUNT  LBA_48  LH LM LL DV DC
  -- -- -- == -- == == == -- -- -- -- --
  10 -- 00 01 80 00 51 00 00 e0 01 00 00

  Commands leading to the command that caused the error were:
  CR FEATR COUNT  LBA_48  LH LM LL DV DC  Powered_Up_Time  Command/Feature_Name
  -- == -- == -- == == == -- -- -- -- --  ---------------  --------------------
  00 91 34 22 31 00 00 00 00 00 00 00 01     00:00:00.000  NOP [Reserved subcommand] [OBS-ACS-2]
  00 80 00 00 88 22 80 01 31 34 00 00 00     00:00:32.896  NOP [Abort queued commands]
  00 6c 34 22 31 00 18 00 48 00 00 00 01     00:37:20.893  NOP [Reserved subcommand] [OBS-ACS-2]
  00 80 00 00 08 22 5b 01 31 34 00 00 00     00:00:00.128  NOP [Abort queued commands]

Error 32 [7] occurred at disk power-on lifetime: 0 hours (0 days + 0 hours)
  When the command that caused the error occurred, the device was in an unknown state.

  After command completion occurred, registers were:
  ER -- ST COUNT  LBA_48  LH LM LL DV DC
  -- -- -- == -- == == == -- -- -- -- --
  40 -- 00 01 7f 00 51 00 00 e0 01 00 00

  Commands leading to the command that caused the error were:
  CR FEATR COUNT  LBA_48  LH LM LL DV DC  Powered_Up_Time  Command/Feature_Name
  -- == -- == -- == == == -- -- -- -- --  ---------------  --------------------
  00 bd 25 03 d9 00 00 00 00 00 00 00 00     00:00:00.000  NOP [Reserved subcommand] [OBS-ACS-2]
  00 7f 20 00 25 03 bc 00 d9 25 00 00 00     00:00:42.111  NOP [Reserved subcommand] [OBS-ACS-2]
  00 bb 25 03 d9 00 7f 00 a6 20 00 00 00     00:04:12.347  NOP [Reserved subcommand] [OBS-ACS-2]
  00 7f 20 00 a8 03 ba 00 d9 25 00 00 00     00:00:10.111  NOP [Reserved subcommand] [OBS-ACS-2]

Error 31 [6] occurred at disk power-on lifetime: 0 hours (0 days + 0 hours)
  When the command that caused the error occurred, the device was in an unknown state.

  After command completion occurred, registers were:
  ER -- ST COUNT  LBA_48  LH LM LL DV DC
  -- -- -- == -- == == == -- -- -- -- --
  10 -- 00 01 00 00 51 00 00 e0 01 00 00

  Commands leading to the command that caused the error were:
  CR FEATR COUNT  LBA_48  LH LM LL DV DC  Powered_Up_Time  Command/Feature_Name
  -- == -- == -- == == == -- -- -- -- --  ---------------  --------------------
  00 2b 35 05 27 00 00 00 00 00 00 00 00     00:00:00.000  NOP [Reserved subcommand] [OBS-ACS-2]
  00 00 00 00 20 05 2b 00 27 35 00 00 00     00:00:08.192  NOP [Abort queued commands]
  00 23 25 05 27 00 38 00 40 00 00 00 00     00:05:37.707  NOP [Reserved subcommand] [OBS-ACS-2]
  00 00 00 00 20 05 23 00 27 35 00 00 00     00:01:01.520  NOP [Abort queued commands]

Error 30 [5] occurred at disk power-on lifetime: 0 hours (0 days + 0 hours)
  When the command that caused the error occurred, the device was in an unknown state.

  After command completion occurred, registers were:
  ER -- ST COUNT  LBA_48  LH LM LL DV DC
  -- -- -- == -- == == == -- -- -- -- --
  10 -- 00 01 80 00 51 00 00 e0 01 00 00

  Commands leading to the command that caused the error were:
  CR FEATR COUNT  LBA_48  LH LM LL DV DC  Powered_Up_Time  Command/Feature_Name
  -- == -- == -- == == == -- -- -- -- --  ---------------  --------------------
  00 fd 35 1f bb 00 00 00 00 00 00 00 06     00:00:00.000  NOP [Reserved subcommand] [OBS-ACS-2]
  00 80 00 00 00 1f fd 06 bb 35 00 00 00     00:00:32.896  NOP [Abort queued commands]
  06 f8 35 1f bb 00 80 00 80 00 00 00 06     00:34:39.736  DATA SET MANAGEMENT
  00 80 00 00 80 1f f4 06 bb 35 00 00 00     00:00:00.128  NOP [Abort queued commands]

Error 29 [4] occurred at disk power-on lifetime: 0 hours (0 days + 0 hours)
  When the command that caused the error occurred, the device was in an unknown state.

  After command completion occurred, registers were:
  ER -- ST COUNT  LBA_48  LH LM LL DV DC
  -- -- -- == -- == == == -- -- -- -- --
  40 -- 00 01 00 00 51 00 00 e0 01 00 00

  Commands leading to the command that caused the error were:
  CR FEATR COUNT  LBA_48  LH LM LL DV DC  Powered_Up_Time  Command/Feature_Name
  -- == -- == -- == == == -- -- -- -- --  ---------------  --------------------
  00 43 25 03 8e 00 00 00 00 00 00 00 06     00:00:00.000  NOP [Reserved subcommand] [OBS-ACS-2]
  00 00 00 00 c0 03 42 06 8e 25 00 00 00     00:00:49.152  NOP [Abort queued commands]
  06 3e 25 03 8e 00 00 00 c0 00 00 00 06     00:03:53.024  DATA SET MANAGEMENT
  00 00 00 00 c0 03 3d 06 8e 25 00 00 00     00:00:49.152  NOP [Abort queued commands]

Error 28 [3] occurred at disk power-on lifetime: 0 hours (0 days + 0 hours)
  When the command that caused the error occurred, the device was in an unknown state.

  After command completion occurred, registers were:
  ER -- ST COUNT  LBA_48  LH LM LL DV DC
  -- -- -- == -- == == == -- -- -- -- --
  40 -- 00 01 7f 00 51 00 00 e0 01 00 00

  Commands leading to the command that caused the error were:
  CR FEATR COUNT  LBA_48  LH LM LL DV DC  Powered_Up_Time  Command/Feature_Name
  -- == -- == -- == == == -- -- -- -- --  ---------------  --------------------
  00 4c 25 01 d5 00 00 00 00 00 00 00 00     00:00:00.000  NOP [Reserved subcommand] [OBS-ACS-2]
  00 30 20 00 48 01 34 01 d5 25 00 00 00     00:00:43.135  NOP [Reserved subcommand] [OBS-ACS-2]
  01 08 25 01 d5 00 10 00 38 20 00 00 01     00:02:00.072  [RESERVED]
  00 7f 20 00 3a 01 07 01 d5 25 00 00 00     00:00:47.487  NOP [Reserved subcommand] [OBS-ACS-2]

Error 27 [2] occurred at disk power-on lifetime: 0 hours (0 days + 0 hours)
  When the command that caused the error occurred, the device was in an unknown state.

  After command completion occurred, registers were:
  ER -- ST COUNT  LBA_48  LH LM LL DV DC
  -- -- -- == -- == == == -- -- -- -- --
  40 -- 00 01 20 00 51 00 00 e0 01 00 00

  Commands leading to the command that caused the error were:
  CR FEATR COUNT  LBA_48  LH LM LL DV DC  Powered_Up_Time  Command/Feature_Name
  -- == -- == -- == == == -- -- -- -- --  ---------------  --------------------
  00 69 25 68 0f 00 00 00 00 00 12 00 21     00:00:00.000  NOP [Reserved subcommand] [OBS-ACS-2]
  00 20 d0 00 37 68 3b 0f 0c 25 00 12 00     00:00:14.112  NOP [Reserved subcommand] [OBS-ACS-2]
  00 f4 35 68 0a 00 08 00 37 d0 12 00 00  3d+13:46:48.436  NOP [Reserved subcommand] [OBS-ACS-2]
  00 10 d0 00 67 68 f4 00 0a 35 00 12 00     00:00:18.184  NOP [Reserved subcommand] [OBS-ACS-2]

Error 26 [1] occurred at disk power-on lifetime: 0 hours (0 days + 0 hours)
  When the command that caused the error occurred, the device was in an unknown state.

  After command completion occurred, registers were:
  ER -- ST COUNT  LBA_48  LH LM LL DV DC
  -- -- -- == -- == == == -- -- -- -- --
  40 -- 00 01 20 00 51 00 00 e0 01 00 00

  Commands leading to the command that caused the error were:
  CR FEATR COUNT  LBA_48  LH LM LL DV DC  Powered_Up_Time  Command/Feature_Name
  -- == -- == -- == == == -- -- -- -- --  ---------------  --------------------
  00 8b 25 67 eb 00 00 00 00 00 12 00 21     00:00:00.000  NOP [Reserved subcommand] [OBS-ACS-2]
  00 20 d0 00 37 67 e8 0f e4 25 00 12 00     00:00:14.112  NOP [Reserved subcommand] [OBS-ACS-2]
  00 cd 25 67 e4 00 01 00 00 d0 12 00 00  3d+13:46:38.669  NOP [Reserved subcommand] [OBS-ACS-2]
  00 08 d0 00 2f 67 cd 00 e4 35 00 12 00     00:00:00.001  NOP [Reserved subcommand] [OBS-ACS-2]

SMART Extended Self-test Log Version: 1 (1 sectors)
No self-tests have been logged.  [To run self-tests, use: smartctl -t]

SMART Selective self-test log data structure revision number 1
 SPAN  MIN_LBA  MAX_LBA  CURRENT_TEST_STATUS
    1        0        0  Not_testing
    2        0        0  Not_testing
    3        0        0  Not_testing
    4        0        0  Not_testing
    5        0        0  Not_testing
Selective self-test flags (0x0):
  After scanning selected spans, do NOT read-scan remainder of disk.
If Selective self-test is pending on power-up, resume after 0 minute delay.

SCT Status Version:                  2
SCT Version (vendor specific):       258 (0x0102)
SCT Support Level:                   1
Device State:                        SMART Off-line Data Collection executing in background (4)
Current Temperature:                    46 Celsius
Power Cycle Min/Max Temperature:     20/46 Celsius
Lifetime    Min/Max Temperature:     20/54 Celsius
Under/Over Temperature Limit Count:   0/0

SCT Temperature History Version:     2
Temperature Sampling Period:         1 minute
Temperature Logging Interval:        1 minute
Min/Max recommended Temperature:      0/60 Celsius
Min/Max Temperature Limit:           -40/85 Celsius
Temperature History Size (Index):    128 (74)

SCT Error Recovery Control:
           Read:     70 (7,0 seconds)
          Write:     70 (7,0 seconds)

Device Statistics (GP Log 0x04) not supported

SATA Phy Event Counters (GP Log 0x11)
ID      Size     Value  Description
0x0001  2            0  Command failed due to ICRC error
0x0002  2            0  R_ERR response for data FIS
0x0003  2            0  R_ERR response for device-to-host data FIS
0x0004  2            0  R_ERR response for host-to-device data FIS
0x0005  2            0  R_ERR response for non-data FIS
0x0006  2            0  R_ERR response for device-to-host non-data FIS
0x0007  2            0  R_ERR response for host-to-device non-data FIS
0x000a  2            2  Device-to-host register FISes sent due to a COMRESET
0x8000  4         5276  Vendor specific



