smartctl 7.5 2025-04-30 r5714 [x86_64-linux-6.17.9-2-cachyos] (local build)
Copyright (C) 2002-25, Bruce Allen, Christian Franke, www.smartmontools.org

=== START OF INFORMATION SECTION ===
Model Number:                       Seagate BarraCuda 510 SSD ZP500CM30001
Serial Number:                      --
Firmware Version:                   STPSC014
PCI Vendor/Subsystem ID:            0x1bb1
IEEE OUI Identifier:                0x0024cf
Total NVM Capacity:                 500,107,862,016 [500 GB]
Unallocated NVM Capacity:           0
Controller ID:                      1
NVMe Version:                       1.3
Number of Namespaces:               1
Namespace 1 Size/Capacity:          500,107,862,016 [500 GB]
Namespace 1 Formatted LBA Size:     512
Namespace 1 IEEE EUI-64:            0024cf ...
Local Time is:                      Fri Dec  5 08:51:48 2025 MST
Firmware Updates (0x1e):            7 Slots, no Reset required
Optional Admin Commands (0x0017):   Security Format Frmw_DL Self_Test
Optional NVM Commands (0x005d):     Comp DS_Mngmt Wr_Zero Sav/Sel_Feat Timestmp
Log Page Attributes (0x08):         Telmtry_Lg
Maximum Data Transfer Size:         512 Pages
Warning  Comp. Temp. Threshold:     75 Celsius
Critical Comp. Temp. Threshold:     80 Celsius

Supported Power States
St Op     Max   Active     Idle   RL RT WL WT  Ent_Lat  Ex_Lat
 0 +     6.84W       -        -    0  0  0  0        0       0
 1 +     5.13W       -        -    1  1  1  1        0       0
 2 +     4.27W       -        -    2  2  2  2        0       0
 3 -   0.0490W       -        -    3  3  3  3     2000    2000
 4 -   0.0018W       -        -    4  4  4  4    25000   25000

Supported LBA Sizes (NSID 0x1)
Id Fmt  Data  Metadt  Rel_Perf
 0 +     512       0         2
 1 -    4096       0         1

=== START OF SMART DATA SECTION ===
SMART overall-health self-assessment test result: PASSED

SMART/Health Information (NVMe Log 0x02, NSID 0xffffffff)
Critical Warning:                   0x00
Temperature:                        26 Celsius
Available Spare:                    100%
Available Spare Threshold:          5%
Percentage Used:                    8%
Data Units Read:                    55,146,266 [28.2 TB]
Data Units Written:                 63,854,071 [32.6 TB]
Host Read Commands:                 345,720,989
Host Write Commands:                625,273,513
Controller Busy Time:               1,374
Power Cycles:                       5,354
Power On Hours:                     15,900
Unsafe Shutdowns:                   3,591
Media and Data Integrity Errors:    0
Error Information Log Entries:      16,653
Warning  Comp. Temperature Time:    0
Critical Comp. Temperature Time:    0
Thermal Temp. 1 Transition Count:   6
Thermal Temp. 2 Transition Count:   2
Thermal Temp. 1 Total Time:         3171
Thermal Temp. 2 Total Time:         326

Error Information (NVMe Log 0x01, 16 of 63 entries)
Num   ErrCount  SQId   CmdId  Status  PELoc          LBA  NSID    VS  Message
  0      16653     0  0x1008  0x4004  0x028            0     0     -  Invalid Field in Command

Self-test Log (NVMe Log 0x06, NSID 0xffffffff)
Self-test status: No self-test in progress
Num  Test_Description  Status                       Power_on_Hours  Failing_LBA  NSID Seg SCT Code
 0   Short             Completed without error               15724            -     -   -   -    -
 1   Short             Completed without error               15727            -     -   -   -    -
 2   Short             Completed without error               15729            -     -   -   -    -
 3   Short             Completed without error               15727            -     -   -   -    -
 4   Short             Completed without error               15703            -     -   -   -    -
 5   Short             Completed without error               15659            -     -   -   -    -
 6   Short             Completed without error               15651            -     -   -   -    -
 7   Short             Completed without error               15637            -     -   -   -    -
 8   Short             Completed without error               15629            -     -   -   -    -



