smartctl 7.1 2019-12-30 r5022 [x86_64-linux-5.15.0-91-generic] (local build)
Copyright (C) 2002-19, Bruce Allen, Christian Franke, www.smartmontools.org

=== START OF INFORMATION SECTION ===
Model Number:                       Seagate BarraCuda 510 SSD ZP500CM30001
Serial Number:                      --
Firmware Version:                   STPSC014
PCI Vendor/Subsystem ID:            0x1bb1
IEEE OUI Identifier:                0x0024cf
Total NVM Capacity:                 500,107,862,016 [500 GB]
Unallocated NVM Capacity:           0
Controller ID:                      1
Number of Namespaces:               1
Namespace 1 Size/Capacity:          500,107,862,016 [500 GB]
Namespace 1 Formatted LBA Size:     512
Namespace 1 IEEE EUI-64:            0024cf ...
Local Time is:                      Fri Feb 16 11:42:07 2024 CST
Firmware Updates (0x1e):            7 Slots, no Reset required
Optional Admin Commands (0x0017):   Security Format Frmw_DL Self_Test
Optional NVM Commands (0x005d):     Comp DS_Mngmt Wr_Zero Sav/Sel_Feat Timestmp
Maximum Data Transfer Size:         512 Pages
Warning  Comp. Temp. Threshold:     75 Celsius
Critical Comp. Temp. Threshold:     80 Celsius

Supported Power States
St Op     Max   Active     Idle   RL RT WL WT  Ent_Lat  Ex_Lat
 0 +     8.09W       -        -    0  0  0  0        0       0
 1 +     6.37W       -        -    1  1  1  1        0       0
 2 +     5.52W       -        -    2  2  2  2        0       0
 3 -   0.0490W       -        -    3  3  3  3     2000    2000
 4 -   0.0018W       -        -    4  4  4  4    25000   25000

Supported LBA Sizes (NSID 0x1)
Id Fmt  Data  Metadt  Rel_Perf
 0 +     512       0         2
 1 -    4096       0         1

=== START OF SMART DATA SECTION ===
SMART overall-health self-assessment test result: PASSED

SMART/Health Information (NVMe Log 0x02)
Critical Warning:                   0x00
Temperature:                        26 Celsius
Available Spare:                    100%
Available Spare Threshold:          5%
Percentage Used:                    7%
Data Units Read:                    78,275,415 [40.0 TB]
Data Units Written:                 65,064,990 [33.3 TB]
Host Read Commands:                 1,142,434,961
Host Write Commands:                614,546,211
Controller Busy Time:               3,780
Power Cycles:                       635
Power On Hours:                     13,052
Unsafe Shutdowns:                   194
Media and Data Integrity Errors:    0
Error Information Log Entries:      1,028
Warning  Comp. Temperature Time:    1479
Critical Comp. Temperature Time:    63
Thermal Temp. 1 Transition Count:   604
Thermal Temp. 2 Transition Count:   197
Thermal Temp. 1 Total Time:         3613125
Thermal Temp. 2 Total Time:         32674

Error Information (NVMe Log 0x01, max 63 entries)
Num   ErrCount  SQId   CmdId  Status  PELoc          LBA  NSID    VS
  0       1028     0  0x2017  0x4004  0x028            0     0     -



