=== START OF INFORMATION SECTION ===
Model Family:     Toshiba 2.5" HDD MK..65GSX
Device Model:     TOSHIBA MK6465GSXN
Serial Number:    --
LU WWN Device Id: 5 000039 ...
Firmware Version: GH101M
User Capacity:    640,135,028,736 bytes [640 GB]
Sector Size:      512 bytes logical/physical
Rotation Rate:    5400 rpm
Form Factor:      2.5 inches
Device is:        In smartctl database [for details use: -P show]
ATA Version is:   ATA8-ACS (minor revision not indicated)
SATA Version is:  SATA 2.6, 3.0 Gb/s (current: 3.0 Gb/s)
Local Time is:    Wed Jan 11 18:02:15 2017 PST
SMART support is: Available - device has SMART capability.
SMART support is: Enabled
AAM feature is:   Unavailable
APM level is:     128 (minimum power consumption without standby)
Rd look-ahead is: Enabled
Write cache is:   Enabled
ATA Security is:  Disabled, frozen [SEC2]
Wt Cache Reorder: Enabled

=== START OF READ SMART DATA SECTION ===
SMART overall-health self-assessment test result: PASSED

General SMART Values:
Offline data collection status:  (0x82)	Offline data collection activity
					was completed without error.
					Auto Offline Data Collection: Enabled.
Self-test execution status:      (  25)	The self-test routine was aborted by
					the host.
Total time to complete Offline 
data collection: 		(  120) seconds.
Offline data collection
capabilities: 			 (0x5b) SMART execute Offline immediate.
					Auto Offline data collection on/off support.
					Suspend Offline collection upon new
					command.
					Offline surface scan supported.
					Self-test supported.
					No Conveyance Self-test supported.
					Selective Self-test supported.
SMART capabilities:            (0x0003)	Saves SMART data before entering
					power-saving mode.
					Supports SMART auto save timer.
Error logging capability:        (0x01)	Error logging supported.
					General Purpose Logging supported.
Short self-test routine 
recommended polling time: 	 (   2) minutes.
Extended self-test routine
recommended polling time: 	 ( 199) minutes.
SCT capabilities: 	       (0x003d)	SCT Status supported.
					SCT Error Recovery Control supported.
					SCT Feature Control supported.
					SCT Data Table supported.

SMART Attributes Data Structure revision number: 16
Vendor Specific SMART Attributes with Thresholds:
ID# ATTRIBUTE_NAME          FLAGS    VALUE WORST THRESH FAIL RAW_VALUE
  1 Raw_Read_Error_Rate     PO-R--   100   100   050    -    0
  2 Throughput_Performance  P-S---   100   100   050    -    0
  3 Spin_Up_Time            POS--K   100   100   001    -    1670
  4 Start_Stop_Count        -O--CK   100   100   000    -    6687
  5 Reallocated_Sector_Ct   PO--CK   100   100   050    -    0
  7 Seek_Error_Rate         PO-R--   100   100   050    -    0
  8 Seek_Time_Performance   P-S---   100   100   050    -    0
  9 Power_On_Hours          -O--CK   053   053   000    -    19190
 10 Spin_Retry_Count        PO--CK   233   100   030    -    0
 12 Power_Cycle_Count       -O--CK   100   100   000    -    6606
191 G-Sense_Error_Rate      -O--CK   100   100   000    -    60
192 Power-Off_Retract_Count -O--CK   099   099   000    -    1638793730
193 Load_Cycle_Count        -O--CK   085   085   000    -    156056
194 Temperature_Celsius     -O---K   100   100   000    -    39 (Min/Max 7/53)
196 Reallocated_Event_Count -O--CK   100   100   000    -    0
197 Current_Pending_Sector  -O--CK   100   100   000    -    0
198 Offline_Uncorrectable   ----CK   100   100   000    -    0
199 UDMA_CRC_Error_Count    -O--CK   200   200   000    -    0
220 Disk_Shift              -O----   100   100   000    -    56
222 Loaded_Hours            -O--CK   058   058   000    -    16804
223 Load_Retry_Count        -O--CK   100   100   000    -    0
224 Load_Friction           -O---K   100   100   000    -    0
226 Load-in_Time            -OS--K   100   100   000    -    307
240 Head_Flying_Hours       P-----   100   100   001    -    0
                            ||||||_ K auto-keep
                            |||||__ C event count
                            ||||___ R error rate
                            |||____ S speed/performance
                            ||_____ O updated online
                            |______ P prefailure warning

General Purpose Log Directory Version 1
SMART           Log Directory Version 1 [multi-sector log support]
Address    Access  R/W   Size  Description
0x00       GPL,SL  R/O      1  Log Directory
0x01           SL  R/O      1  Summary SMART error log
0x02           SL  R/O     51  Comprehensive SMART error log
0x03       GPL     R/O     64  Ext. Comprehensive SMART error log
0x06           SL  R/O      1  SMART self-test log
0x07       GPL     R/O      1  Extended self-test log
0x09           SL  R/W      1  Selective self-test log
0x10       GPL     R/O      1  SATA NCQ Queued Error log
0x11       GPL     R/O      1  SATA Phy Event Counters log
0x80-0x9f  GPL,SL  R/W     16  Host vendor specific log
0xe0       GPL,SL  R/W      1  SCT Command/Status
0xe1       GPL,SL  R/W      1  SCT Data Transfer

SMART Extended Comprehensive Error Log Version: 1 (64 sectors)
Device Error Count: 1774 (device log contains only the most recent 256 errors)
	CR     = Command Register
	FEATR  = Features Register
	COUNT  = Count (was: Sector Count) Register
	LBA_48 = Upper bytes of LBA High/Mid/Low Registers ]  ATA-8
	LH     = LBA High (was: Cylinder High) Register    ]   LBA
	LM     = LBA Mid (was: Cylinder Low) Register      ] Register
	LL     = LBA Low (was: Sector Number) Register     ]
	DV     = Device (was: Device/Head) Register
	DC     = Device Control Register
	ER     = Error register
	ST     = Status register
Powered_Up_Time is measured from power on, and printed as
DDd+hh:mm:SS.sss where DD=days, hh=hours, mm=minutes,
SS=sec, and sss=millisec. It "wraps" after 49.710 days.

Error 1774 [237] occurred at disk power-on lifetime: 3149 hours (131 days + 5 hours)
  When the command that caused the error occurred, the device was active or idle.

  After command completion occurred, registers were:
  ER -- ST COUNT  LBA_48  LH LM LL DV DC
  -- -- -- == -- == == == -- -- -- -- --
  40 -- 41 00 32 00 00 12 1b 0d 19 62 00  Error: UNC at LBA = 0x121b0d19 = 303762713

  Commands leading to the command that caused the error were:
  CR FEATR COUNT  LBA_48  LH LM LL DV DC  Powered_Up_Time  Command/Feature_Name
  -- == -- == -- == == == -- -- -- -- --  ---------------  --------------------
  60 01 00 00 30 00 00 12 1b 0c b8 40 00  2d+06:02:29.720  READ FPDMA QUEUED
  61 00 08 00 28 00 00 00 87 74 d8 40 00  2d+06:02:29.720  WRITE FPDMA QUEUED
  61 00 08 00 20 00 00 00 2f 4f c8 40 00  2d+06:02:29.719  WRITE FPDMA QUEUED
  61 00 08 00 18 00 00 00 91 42 d8 40 00  2d+06:02:29.719  WRITE FPDMA QUEUED
  61 00 08 00 10 00 00 00 8a b1 10 40 00  2d+06:02:29.719  WRITE FPDMA QUEUED

Error 1773 [236] occurred at disk power-on lifetime: 3149 hours (131 days + 5 hours)
  When the command that caused the error occurred, the device was active or idle.

  After command completion occurred, registers were:
  ER -- ST COUNT  LBA_48  LH LM LL DV DC
  -- -- -- == -- == == == -- -- -- -- --
  40 -- 41 00 02 00 00 12 1b 0d 19 62 00  Error: UNC at LBA = 0x121b0d19 = 303762713

  Commands leading to the command that caused the error were:
  CR FEATR COUNT  LBA_48  LH LM LL DV DC  Powered_Up_Time  Command/Feature_Name
  -- == -- == -- == == == -- -- -- -- --  ---------------  --------------------
  60 01 00 00 00 00 00 12 1b 0c b8 40 00  2d+06:02:25.675  READ FPDMA QUEUED
  61 00 08 00 f8 00 00 00 2f 7d d8 40 00  2d+06:02:25.675  WRITE FPDMA QUEUED
  61 00 08 00 f0 00 00 00 90 f7 80 40 00  2d+06:02:25.674  WRITE FPDMA QUEUED
  61 00 08 00 e8 00 00 00 8a b1 28 40 00  2d+06:02:25.674  WRITE FPDMA QUEUED
  2f 00 00 00 01 00 00 00 00 00 10 40 00  2d+06:02:25.674  READ LOG EXT

Error 1772 [235] occurred at disk power-on lifetime: 3149 hours (131 days + 5 hours)
  When the command that caused the error occurred, the device was active or idle.

  After command completion occurred, registers were:
  ER -- ST COUNT  LBA_48  LH LM LL DV DC
  -- -- -- == -- == == == -- -- -- -- --
  40 -- 41 00 d2 00 00 12 1b 0d 19 62 00  Error: UNC at LBA = 0x121b0d19 = 303762713

  Commands leading to the command that caused the error were:
  CR FEATR COUNT  LBA_48  LH LM LL DV DC  Powered_Up_Time  Command/Feature_Name
  -- == -- == -- == == == -- -- -- -- --  ---------------  --------------------
  60 01 00 00 d0 00 00 12 1b 0c b8 40 00  2d+06:02:21.620  READ FPDMA QUEUED
  61 00 08 00 c8 00 00 02 2b 94 e0 40 00  2d+06:02:21.620  WRITE FPDMA QUEUED
  61 00 18 00 c0 00 00 00 8c ac b8 40 00  2d+06:02:21.619  WRITE FPDMA QUEUED
  61 00 03 00 b8 00 00 15 a7 14 50 40 00  2d+06:02:21.619  WRITE FPDMA QUEUED
  2f 00 00 00 01 00 00 00 00 00 10 40 00  2d+06:02:21.618  READ LOG EXT

Error 1771 [234] occurred at disk power-on lifetime: 3149 hours (131 days + 5 hours)
  When the command that caused the error occurred, the device was active or idle.

  After command completion occurred, registers were:
  ER -- ST COUNT  LBA_48  LH LM LL DV DC
  -- -- -- == -- == == == -- -- -- -- --
  40 -- 41 00 a2 00 00 12 1b 0d 19 62 00  Error: UNC at LBA = 0x121b0d19 = 303762713

  Commands leading to the command that caused the error were:
  CR FEATR COUNT  LBA_48  LH LM LL DV DC  Powered_Up_Time  Command/Feature_Name
  -- == -- == -- == == == -- -- -- -- --  ---------------  --------------------
  60 01 00 00 a0 00 00 12 1b 0c b8 40 00  2d+06:02:17.597  READ FPDMA QUEUED
  61 00 08 00 98 00 00 00 8a b1 20 40 00  2d+06:02:17.596  WRITE FPDMA QUEUED
  2f 00 00 00 01 00 00 00 00 00 10 40 00  2d+06:02:17.596  READ LOG EXT
  60 01 00 00 88 00 00 12 1b 0c b8 40 00  2d+06:02:13.553  READ FPDMA QUEUED
  61 00 08 00 80 00 00 02 2b 8a 28 40 00  2d+06:02:13.552  WRITE FPDMA QUEUED

Error 1770 [233] occurred at disk power-on lifetime: 3149 hours (131 days + 5 hours)
  When the command that caused the error occurred, the device was active or idle.

  After command completion occurred, registers were:
  ER -- ST COUNT  LBA_48  LH LM LL DV DC
  -- -- -- == -- == == == -- -- -- -- --
  40 -- 41 00 8a 00 00 12 1b 0d 19 62 00  Error: UNC at LBA = 0x121b0d19 = 303762713

  Commands leading to the command that caused the error were:
  CR FEATR COUNT  LBA_48  LH LM LL DV DC  Powered_Up_Time  Command/Feature_Name
  -- == -- == -- == == == -- -- -- -- --  ---------------  --------------------
  60 01 00 00 88 00 00 12 1b 0c b8 40 00  2d+06:02:13.553  READ FPDMA QUEUED
  61 00 08 00 80 00 00 02 2b 8a 28 40 00  2d+06:02:13.552  WRITE FPDMA QUEUED
  61 00 08 00 78 00 00 00 8c ac b0 40 00  2d+06:02:13.552  WRITE FPDMA QUEUED
  2f 00 00 00 01 00 00 00 00 00 10 40 00  2d+06:02:13.551  READ LOG EXT
  60 01 00 00 68 00 00 12 1b 0c b8 40 00  2d+06:02:09.530  READ FPDMA QUEUED

Error 1769 [232] occurred at disk power-on lifetime: 3149 hours (131 days + 5 hours)
  When the command that caused the error occurred, the device was active or idle.

  After command completion occurred, registers were:
  ER -- ST COUNT  LBA_48  LH LM LL DV DC
  -- -- -- == -- == == == -- -- -- -- --
  40 -- 41 00 6a 00 00 12 1b 0d 19 62 00  Error: UNC at LBA = 0x121b0d19 = 303762713

  Commands leading to the command that caused the error were:
  CR FEATR COUNT  LBA_48  LH LM LL DV DC  Powered_Up_Time  Command/Feature_Name
  -- == -- == -- == == == -- -- -- -- --  ---------------  --------------------
  60 01 00 00 68 00 00 12 1b 0c b8 40 00  2d+06:02:09.530  READ FPDMA QUEUED
  61 00 08 00 60 00 00 00 8a b1 18 40 00  2d+06:02:09.530  WRITE FPDMA QUEUED
  2f 00 00 00 01 00 00 00 00 00 10 40 00  2d+06:02:09.529  READ LOG EXT
  60 01 00 00 50 00 00 12 1b 0c b8 40 00  2d+06:02:05.475  READ FPDMA QUEUED
  61 00 01 00 48 00 00 00 2f 16 88 40 00  2d+06:02:05.475  WRITE FPDMA QUEUED

Error 1768 [231] occurred at disk power-on lifetime: 3149 hours (131 days + 5 hours)
  When the command that caused the error occurred, the device was active or idle.

  After command completion occurred, registers were:
  ER -- ST COUNT  LBA_48  LH LM LL DV DC
  -- -- -- == -- == == == -- -- -- -- --
  40 -- 41 00 52 00 00 12 1b 0d 19 62 00  Error: UNC at LBA = 0x121b0d19 = 303762713

  Commands leading to the command that caused the error were:
  CR FEATR COUNT  LBA_48  LH LM LL DV DC  Powered_Up_Time  Command/Feature_Name
  -- == -- == -- == == == -- -- -- -- --  ---------------  --------------------
  60 01 00 00 50 00 00 12 1b 0c b8 40 00  2d+06:02:05.475  READ FPDMA QUEUED
  61 00 01 00 48 00 00 00 2f 16 88 40 00  2d+06:02:05.475  WRITE FPDMA QUEUED
  61 00 c0 00 40 00 00 0d f7 d3 d8 40 00  2d+06:02:05.474  WRITE FPDMA QUEUED
  61 00 08 00 38 00 00 00 8a b1 28 40 00  2d+06:02:05.474  WRITE FPDMA QUEUED
  2f 00 00 00 01 00 00 00 00 00 10 40 00  2d+06:02:05.474  READ LOG EXT

Error 1767 [230] occurred at disk power-on lifetime: 3149 hours (131 days + 5 hours)
  When the command that caused the error occurred, the device was active or idle.

  After command completion occurred, registers were:
  ER -- ST COUNT  LBA_48  LH LM LL DV DC
  -- -- -- == -- == == == -- -- -- -- --
  40 -- 41 00 2a 00 00 12 1b 0d 19 62 00  Error: UNC at LBA = 0x121b0d19 = 303762713

  Commands leading to the command that caused the error were:
  CR FEATR COUNT  LBA_48  LH LM LL DV DC  Powered_Up_Time  Command/Feature_Name
  -- == -- == -- == == == -- -- -- -- --  ---------------  --------------------
  60 01 00 00 28 00 00 12 1b 0c b8 40 00  2d+06:02:01.418  READ FPDMA QUEUED
  61 00 08 00 20 00 00 00 31 0b 00 40 00  2d+06:02:01.417  WRITE FPDMA QUEUED
  61 00 68 00 18 00 00 00 8c ac 48 40 00  2d+06:02:01.417  WRITE FPDMA QUEUED
  61 00 c0 00 10 00 00 0d f7 d3 18 40 00  2d+06:02:01.416  WRITE FPDMA QUEUED
  60 01 00 00 08 00 00 12 1b 0d b8 40 00  2d+06:01:57.585  READ FPDMA QUEUED

SMART Extended Self-test Log Version: 1 (1 sectors)
Num  Test_Description    Status                  Remaining  LifeTime(hours)  LBA_of_first_error
# 1  Extended offline    Aborted by host               90%     19187         -
# 2  Short offline       Completed without error       00%     19187         -
# 3  Short offline       Completed without error       00%     19187         -
# 4  Extended offline    Aborted by host               70%     18141         -
# 5  Short offline       Completed without error       00%     18054         -
# 6  Extended offline    Completed without error       00%     17984         -
# 7  Short offline       Completed without error       00%     17981         -
# 8  Extended offline    Aborted by host               80%     17981         -
# 9  Short offline       Completed without error       00%     17981         -
#10  Short offline       Completed without error       00%     17981         -
#11  Short offline       Completed without error       00%     17980         -
#12  Short offline       Completed without error       00%     17980         -
#13  Short offline       Completed without error       00%     17980         -
#14  Short offline       Completed without error       00%     17980         -
#15  Short offline       Completed without error       00%     17980         -
#16  Short offline       Completed without error       00%     17980         -
#17  Short offline       Completed without error       00%     17980         -
#18  Short offline       Completed without error       00%     17972         -
#19  Short offline       Aborted by host               90%     17962         -

SMART Selective self-test log data structure revision number 1
 SPAN  MIN_LBA  MAX_LBA  CURRENT_TEST_STATUS
    1        0        0  Not_testing
    2        0        0  Not_testing
    3        0        0  Not_testing
    4        0        0  Not_testing
    5        0        0  Not_testing
Selective self-test flags (0x0):
  After scanning selected spans, do NOT read-scan remainder of disk.
If Selective self-test is pending on power-up, resume after 0 minute delay.

SCT Status Version:                  2
SCT Version (vendor specific):       1 (0x0001)
SCT Support Level:                   1
Device State:                        Active (0)
Current Temperature:                    39 Celsius
Power Cycle Min/Max Temperature:     37/42 Celsius
Lifetime    Min/Max Temperature:      7/53 Celsius
Under/Over Temperature Limit Count:   0/0

SCT Temperature History Version:     2
Temperature Sampling Period:         1 minute
Temperature Logging Interval:        1 minute
Min/Max recommended Temperature:      5/55 Celsius
Min/Max Temperature Limit:            5/55 Celsius
Temperature History Size (Index):    478 (303)

SCT Error Recovery Control:
           Read: Disabled
          Write: Disabled

Device Statistics (GP/SMART Log 0x04) not supported

SATA Phy Event Counters (GP Log 0x11)
ID      Size     Value  Description
0x0001  4            0  Command failed due to ICRC error
0x0002  4            0  R_ERR response for data FIS
0x0003  4            0  R_ERR response for device-to-host data FIS
0x0004  4            0  R_ERR response for host-to-device data FIS
0x0005  4            0  R_ERR response for non-data FIS
0x0006  4            0  R_ERR response for device-to-host non-data FIS
0x0007  4            0  R_ERR response for host-to-device non-data FIS
0x0008  4            0  Device-to-host non-data FIS retries
0x0009  4            8  Transition from drive PhyRdy to drive PhyNRdy
0x000a  4           13  Device-to-host register FISes sent due to a COMRESET
0x000b  4            0  CRC errors within host-to-device FIS
0x000d  4            0  Non-CRC errors within host-to-device FIS
0x000f  4            0  R_ERR response for host-to-device data FIS, CRC
0x0010  4            0  R_ERR response for host-to-device data FIS, non-CRC
0x0012  4            0  R_ERR response for host-to-device non-data FIS, CRC
0x0013  4            0  R_ERR response for host-to-device non-data FIS, non-CRC

