smartctl 7.4 2023-08-01 r5530 [x86_64-linux-6.8.0-87-generic] (local build)
Copyright (C) 2002-23, Bruce Allen, Christian Franke, www.smartmontools.org

=== START OF INFORMATION SECTION ===
Model Number:                       ADATA LEGEND 840
Serial Number:                      --
Firmware Version:                   1.2.4.M
PCI Vendor/Subsystem ID:            0x1cc1
IEEE OUI Identifier:                0x707c18
Controller ID:                      0
NVMe Version:                       1.4
Number of Namespaces:               1
Namespace 1 Size/Capacity:          512,110,190,592 [512 GB]
Namespace 1 Formatted LBA Size:     512
Namespace 1 IEEE EUI-64:            707c18 ...
Local Time is:                      Sat Nov 15 08:38:38 2025 CET
Firmware Updates (0x0e):            7 Slots
Optional Admin Commands (0x0016):   Format Frmw_DL Self_Test
Optional NVM Commands (0x0014):     DS_Mngmt Sav/Sel_Feat
Log Page Attributes (0x0e):         Cmd_Eff_Lg Ext_Get_Lg Telmtry_Lg
Maximum Data Transfer Size:         512 Pages
Warning  Comp. Temp. Threshold:     100 Celsius
Critical Comp. Temp. Threshold:     110 Celsius

Supported Power States
St Op     Max   Active     Idle   RL RT WL WT  Ent_Lat  Ex_Lat
 0 +     3.50W       -        -    0  0  0  0        5       5
 1 +     3.30W       -        -    1  1  1  1       50     100
 2 +     2.80W       -        -    2  2  2  2       50     200
 3 -   0.1000W       -        -    3  3  3  3      500    5000
 4 -   0.0080W       -        -    4  4  4  4     2000   50000

Supported LBA Sizes (NSID 0x1)
Id Fmt  Data  Metadt  Rel_Perf
 0 -     512       0         0

=== START OF SMART DATA SECTION ===
SMART overall-health self-assessment test result: PASSED

SMART/Health Information (NVMe Log 0x02)
Critical Warning:                   0x00
Temperature:                        27 Celsius
Available Spare:                    100%
Available Spare Threshold:          10%
Percentage Used:                    0%
Data Units Read:                    9,911,984 [5.07 TB]
Data Units Written:                 7,211,154 [3.69 TB]
Host Read Commands:                 82,474,435
Host Write Commands:                55,778,237
Controller Busy Time:               9
Power Cycles:                       772
Power On Hours:                     1,034
Unsafe Shutdowns:                   5
Media and Data Integrity Errors:    0
Error Information Log Entries:      0
Warning  Comp. Temperature Time:    0
Critical Comp. Temperature Time:    0
Temperature Sensor 1:               27 Celsius

Error Information (NVMe Log 0x01, 16 of 64 entries)
No Errors Logged

Read Self-test Log failed: Invalid Field in Command (0x002)

