smartctl 7.3 2022-02-28 r5338 [x86_64-linux-6.0.0-060000rc1daily20220820-generic] (local build)
Copyright (C) 2002-22, Bruce Allen, Christian Franke, www.smartmontools.org

=== START OF INFORMATION SECTION ===
Model Number:                       Micron MTFDKBA1T0TFH
Serial Number:                      --
Firmware Version:                   0001P7LN
PCI Vendor/Subsystem ID:            0x1344
IEEE OUI Identifier:                0x00a075
Total NVM Capacity:                 1,024,209,543,168 [1.02 TB]
Unallocated NVM Capacity:           0
Controller ID:                      0
NVMe Version:                       1.4
Number of Namespaces:               1
Namespace 1 Size/Capacity:          1,024,209,543,168 [1.02 TB]
Namespace 1 Formatted LBA Size:     512
Namespace 1 IEEE EUI-64:            00a075 ...
Local Time is:                      Thu Aug 25 17:46:34 2022 CEST
Firmware Updates (0x14):            2 Slots, no Reset required
Optional Admin Commands (0x0017):   Security Format Frmw_DL Self_Test
Optional NVM Commands (0x0057):     Comp Wr_Unc DS_Mngmt Sav/Sel_Feat Timestmp
Log Page Attributes (0x0b):         S/H_per_NS Cmd_Eff_Lg Telmtry_Lg
Maximum Data Transfer Size:         512 Pages
Warning  Comp. Temp. Threshold:     80 Celsius
Critical Comp. Temp. Threshold:     82 Celsius
Namespace 1 Features (0x08):        No_ID_Reuse

Supported Power States
St Op     Max   Active     Idle   RL RT WL WT  Ent_Lat  Ex_Lat
 0 +     8.25W       -        -    0  0  0  0        0       0
 1 +     4.00W       -        -    1  1  1  1        0       0
 2 +     2.00W       -        -    2  2  2  2        0       0
 3 -   0.1000W       -        -    3  3  3  3     5000    6000
 4 -   0.0050W       -        -    4  4  4  4    12000   35000

Supported LBA Sizes (NSID 0x1)
Id Fmt  Data  Metadt  Rel_Perf
 0 +     512       0         0

=== START OF SMART DATA SECTION ===
SMART overall-health self-assessment test result: PASSED

SMART/Health Information (NVMe Log 0x02)
Critical Warning:                   0x00
Temperature:                        29 Celsius
Available Spare:                    100%
Available Spare Threshold:          5%
Percentage Used:                    0%
Data Units Read:                    743,531 [380 GB]
Data Units Written:                 987,868 [505 GB]
Host Read Commands:                 6,557,390
Host Write Commands:                5,646,212
Controller Busy Time:               2
Power Cycles:                       226
Power On Hours:                     26
Unsafe Shutdowns:                   21
Media and Data Integrity Errors:    0
Error Information Log Entries:      197
Warning  Comp. Temperature Time:    0
Critical Comp. Temperature Time:    0
Temperature Sensor 1:               29 Celsius

Error Information (NVMe Log 0x01, 16 of 256 entries)
Num   ErrCount  SQId   CmdId  Status  PELoc          LBA  NSID    VS
  0        197     0  0x900b  0x8004  0x000            0     0     -

