smartctl 7.4 2023-08-01 r5530 [x86_64-linux-6.12.7-200.fsync.fc41.x86_64] (local build)
Copyright (C) 2002-23, Bruce Allen, Christian Franke, www.smartmontools.org

=== START OF INFORMATION SECTION ===
Model Number:                       Samsung SSD 960 EVO 250GB
Serial Number:                      --
Firmware Version:                   3B7QCXE7
PCI Vendor/Subsystem ID:            0x144d
IEEE OUI Identifier:                0x002538
Total NVM Capacity:                 250,059,350,016 [250 GB]
Unallocated NVM Capacity:           0
Controller ID:                      2
NVMe Version:                       1.2
Number of Namespaces:               1
Namespace 1 Size/Capacity:          250,059,350,016 [250 GB]
Namespace 1 Utilization:            111,634,182,144 [111 GB]
Namespace 1 Formatted LBA Size:     512
Namespace 1 IEEE EUI-64:            002538 ...
Local Time is:                      Wed Jan  8 01:30:43 2025 AEDT
Firmware Updates (0x16):            3 Slots, no Reset required
Optional Admin Commands (0x0007):   Security Format Frmw_DL
Optional NVM Commands (0x001f):     Comp Wr_Unc DS_Mngmt Wr_Zero Sav/Sel_Feat
Log Page Attributes (0x03):         S/H_per_NS Cmd_Eff_Lg
Maximum Data Transfer Size:         512 Pages
Warning  Comp. Temp. Threshold:     77 Celsius
Critical Comp. Temp. Threshold:     79 Celsius

Supported Power States
St Op     Max   Active     Idle   RL RT WL WT  Ent_Lat  Ex_Lat
 0 +     6.04W       -        -    0  0  0  0        0       0
 1 +     5.09W       -        -    1  1  1  1        0       0
 2 +     4.08W       -        -    2  2  2  2        0       0
 3 -   0.0400W       -        -    3  3  3  3      210    1500
 4 -   0.0050W       -        -    4  4  4  4     2200    6000

Supported LBA Sizes (NSID 0x1)
Id Fmt  Data  Metadt  Rel_Perf
 0 +     512       0         0

=== START OF SMART DATA SECTION ===
SMART overall-health self-assessment test result: PASSED

SMART/Health Information (NVMe Log 0x02)
Critical Warning:                   0x00
Temperature:                        42 Celsius
Available Spare:                    100%
Available Spare Threshold:          10%
Percentage Used:                    12%
Data Units Read:                    40,368,197 [20.6 TB]
Data Units Written:                 72,267,983 [37.0 TB]
Host Read Commands:                 492,301,746
Host Write Commands:                1,385,626,821
Controller Busy Time:               4,978
Power Cycles:                       2,514
Power On Hours:                     14,471
Unsafe Shutdowns:                   317
Media and Data Integrity Errors:    0
Error Information Log Entries:      5,998
Warning  Comp. Temperature Time:    0
Critical Comp. Temperature Time:    0
Temperature Sensor 1:               42 Celsius
Temperature Sensor 2:               50 Celsius

Error Information (NVMe Log 0x01, 16 of 64 entries)
Num   ErrCount  SQId   CmdId  Status  PELoc          LBA  NSID    VS  Message
  0       5998     0  0x001c  0x4004      -            0     0     -  Invalid Field in Command
  1       5997     0  0x000a  0x421a  0x028            0     0     -  Feature Identifier Not Saveable
  2       5996     0  0x0010  0x4004      -            0     0     -  Invalid Field in Command
  3       5995     0  0x000a  0x421a  0x028            0     0     -  Feature Identifier Not Saveable
  4       5994     0  0x0004  0x4004      -            0     0     -  Invalid Field in Command
  5       5993     0  0x000a  0x421a  0x028            0     0     -  Feature Identifier Not Saveable
  6       5992     0  0x001c  0x4004      -            0     0     -  Invalid Field in Command
  7       5991     0  0x000a  0x421a  0x028            0     0     -  Feature Identifier Not Saveable
  8       5990     0  0x0004  0x4004      -            0     0     -  Invalid Field in Command
  9       5989     0  0x000a  0x421a  0x028            0     0     -  Feature Identifier Not Saveable
 10       5988     0  0x0010  0x4004      -            0     0     -  Invalid Field in Command
 11       5987     0  0x000a  0x421a  0x028            0     0     -  Feature Identifier Not Saveable
 12       5986     0  0x0004  0x4004      -            0     0     -  Invalid Field in Command
 13       5985     0  0x000a  0x421a  0x028            0     0     -  Feature Identifier Not Saveable
 14       5984     0  0x0010  0x4004      -            0     0     -  Invalid Field in Command
 15       5983     0  0x000a  0x421a  0x028            0     0     -  Feature Identifier Not Saveable
... (48 entries not read)

Self-tests not supported



