smartctl 7.4 2023-08-01 r5530 [x86_64-linux-6.8.0-38-generic] (local build)
Copyright (C) 2002-23, Bruce Allen, Christian Franke, www.smartmontools.org

=== START OF INFORMATION SECTION ===
Model Number:                       Samsung SSD 960 EVO 250GB
Serial Number:                      --
Firmware Version:                   3B7QCXE7
PCI Vendor/Subsystem ID:            0x144d
IEEE OUI Identifier:                0x002538
Total NVM Capacity:                 250,059,350,016 [250 GB]
Unallocated NVM Capacity:           0
Controller ID:                      2
NVMe Version:                       1.2
Number of Namespaces:               1
Namespace 1 Size/Capacity:          250,059,350,016 [250 GB]
Namespace 1 Utilization:            113,344,159,744 [113 GB]
Namespace 1 Formatted LBA Size:     512
Namespace 1 IEEE EUI-64:            002538 ...
Local Time is:                      Thu Jun 26 03:47:40 2025 UTC
Firmware Updates (0x16):            3 Slots, no Reset required
Optional Admin Commands (0x0007):   Security Format Frmw_DL
Optional NVM Commands (0x001f):     Comp Wr_Unc DS_Mngmt Wr_Zero Sav/Sel_Feat
Log Page Attributes (0x03):         S/H_per_NS Cmd_Eff_Lg
Maximum Data Transfer Size:         512 Pages
Warning  Comp. Temp. Threshold:     77 Celsius
Critical Comp. Temp. Threshold:     79 Celsius

Supported Power States
St Op     Max   Active     Idle   RL RT WL WT  Ent_Lat  Ex_Lat
 0 +     6.04W       -        -    0  0  0  0        0       0
 1 +     5.09W       -        -    1  1  1  1        0       0
 2 +     4.08W       -        -    2  2  2  2        0       0
 3 -   0.0400W       -        -    3  3  3  3      210    1500
 4 -   0.0050W       -        -    4  4  4  4     2200    6000

Supported LBA Sizes (NSID 0x1)
Id Fmt  Data  Metadt  Rel_Perf
 0 +     512       0         0

=== START OF SMART DATA SECTION ===
SMART overall-health self-assessment test result: PASSED

SMART/Health Information (NVMe Log 0x02)
Critical Warning:                   0x00
Temperature:                        34 Celsius
Available Spare:                    100%
Available Spare Threshold:          10%
Percentage Used:                    22%
Data Units Read:                    27,261,449 [13.9 TB]
Data Units Written:                 149,563,652 [76.5 TB]
Host Read Commands:                 496,926,339
Host Write Commands:                7,244,078,636
Controller Busy Time:               23,383
Power Cycles:                       1,406
Power On Hours:                     23,999
Unsafe Shutdowns:                   316
Media and Data Integrity Errors:    0
Error Information Log Entries:      1,897
Warning  Comp. Temperature Time:    0
Critical Comp. Temperature Time:    0
Temperature Sensor 1:               34 Celsius
Temperature Sensor 2:               43 Celsius

Error Information (NVMe Log 0x01, 16 of 64 entries)
Num   ErrCount  SQId   CmdId  Status  PELoc          LBA  NSID    VS  Message
  0       1897     0  0x0000  0x4004      -            0     0     -  Invalid Field in Command
  1       1896     0  0x001c  0x421a  0x028            0     0     -  Feature Identifier Not Saveable
  2       1895     0  0x0022  0x421a  0x028            0     0     -  Feature Identifier Not Saveable
  3       1894     0  0x001b  0x4016  0x004            0     1     -  Invalid Namespace or Format
  4       1893     0  0x0007  0x4004      -            0     0     -  Invalid Field in Command
  5       1892     0  0x0060  0x4212  0x028            0     0     -  Invalid Log Page
  6       1891     0  0x001e  0x421a  0x028            0     0     -  Feature Identifier Not Saveable
  7       1890     0  0x0007  0x4004      -            0     0     -  Invalid Field in Command
  8       1889     0  0x001e  0x421a  0x028            0     0     -  Feature Identifier Not Saveable
  9       1888     0  0x0007  0x4004      -            0     0     -  Invalid Field in Command
 10       1887     0  0x0002  0x4212  0x028            0     0     -  Invalid Log Page
 11       1886     0  0x001e  0x421a  0x028            0     0     -  Feature Identifier Not Saveable
 12       1885     0  0x0007  0x4004      -            0     0     -  Invalid Field in Command
 13       1884     0  0x0019  0x4212  0x028            0     0     -  Invalid Log Page
 14       1883     0  0x001e  0x421a  0x028            0     0     -  Feature Identifier Not Saveable
 15       1882     0  0x0007  0x4004      -            0     0     -  Invalid Field in Command
... (48 entries not read)

Self-tests not supported



