smartctl 7.3 2022-02-28 r5338 [x86_64-linux-6.1.0-37-amd64] (local build)
Copyright (C) 2002-22, Bruce Allen, Christian Franke, www.smartmontools.org

=== START OF INFORMATION SECTION ===
Model Number:                       APPLE SSD AP0256H
Serial Number:                      --
Firmware Version:                   7.844.01
PCI Vendor/Subsystem ID:            0x106b
IEEE OUI Identifier:                0x000000
Controller ID:                      0
NVMe Version:                       <1.2
Number of Namespaces:               1
Namespace 1 Size/Capacity:          251,000,193,024 [251 GB]
Namespace 1 Formatted LBA Size:     4096
Namespace 1 IEEE EUI-64:            8e4c31 ...
Local Time is:                      Thu May 29 17:05:56 2025 CEST
Firmware Updates (0x04):            2 Slots
Optional Admin Commands (0x0004):   Frmw_DL
Optional NVM Commands (0x0004):     DS_Mngmt
Maximum Data Transfer Size:         64 Pages

Supported Power States
St Op     Max   Active     Idle   RL RT WL WT  Ent_Lat  Ex_Lat
 0 +     0.00W       -        -    0  0  0  0        0       0

Supported LBA Sizes (NSID 0x1)
Id Fmt  Data  Metadt  Rel_Perf
 0 +    4096       0         0

=== START OF SMART DATA SECTION ===
SMART overall-health self-assessment test result: PASSED

SMART/Health Information (NVMe Log 0x02)
Critical Warning:                   0x00
Temperature:                        48 Celsius
Available Spare:                    100%
Available Spare Threshold:          0%
Percentage Used:                    9%
Data Units Read:                    110,220,133 [56.4 TB]
Data Units Written:                 58,830,945 [30.1 TB]
Host Read Commands:                 2,225,180,176
Host Write Commands:                884,433,086
Controller Busy Time:               0
Power Cycles:                       1,818
Power On Hours:                     774
Unsafe Shutdowns:                   56
Media and Data Integrity Errors:    0
Error Information Log Entries:      0

Error Information (NVMe Log 0x01, 1 of 1 entries)
No Errors Logged

