smartctl 7.4 2023-08-01 r5530 [x86_64-linux-6.8.0-31-generic] (local build)
Copyright (C) 2002-23, Bruce Allen, Christian Franke, www.smartmontools.org

=== START OF INFORMATION SECTION ===
Model Number:                       BC901 NVMe SK hynix 512GB
Serial Number:                      --
Firmware Version:                   51007151
PCI Vendor/Subsystem ID:            0x1c5c
IEEE OUI Identifier:                0xace42e
Controller ID:                      1
NVMe Version:                       1.4
Number of Namespaces:               1
Namespace 1 Size/Capacity:          512,110,190,592 [512 GB]
Namespace 1 Formatted LBA Size:     512
Namespace 1 IEEE EUI-64:            ace42e ...
Local Time is:                      Tue Oct 29 08:35:02 2024 UTC
Firmware Updates (0x16):            3 Slots, no Reset required
Optional Admin Commands (0x0017):   Security Format Frmw_DL Self_Test
Optional NVM Commands (0x00df):     Comp Wr_Unc DS_Mngmt Wr_Zero Sav/Sel_Feat Timestmp Verify
Log Page Attributes (0x1e):         Cmd_Eff_Lg Ext_Get_Lg Telmtry_Lg Pers_Ev_Lg
Maximum Data Transfer Size:         64 Pages
Warning  Comp. Temp. Threshold:     83 Celsius
Critical Comp. Temp. Threshold:     85 Celsius

Supported Power States
St Op     Max   Active     Idle   RL RT WL WT  Ent_Lat  Ex_Lat
 0 +   4.5000W       -        -    0  0  0  0      100     100
 1 +   3.0000W       -        -    1  1  1  1      200     200
 2 +   0.6000W       -        -    2  2  2  2      400     400
 3 -   0.0150W       -        -    3  3  3  3     2000    2000
 4 -   0.0030W       -        -    4  4  4  4     5000   10000

Supported LBA Sizes (NSID 0x1)
Id Fmt  Data  Metadt  Rel_Perf
 0 +     512       0         0

=== START OF SMART DATA SECTION ===
SMART overall-health self-assessment test result: PASSED

SMART/Health Information (NVMe Log 0x02)
Critical Warning:                   0x00
Temperature:                        48 Celsius
Available Spare:                    100%
Available Spare Threshold:          50%
Percentage Used:                    2%
Data Units Read:                    53,734,476 [27.5 TB]
Data Units Written:                 31,805,028 [16.2 TB]
Host Read Commands:                 577,376,746
Host Write Commands:                346,933,115
Controller Busy Time:               7,709
Power Cycles:                       583
Power On Hours:                     2,121
Unsafe Shutdowns:                   69
Media and Data Integrity Errors:    0
Error Information Log Entries:      0
Warning  Comp. Temperature Time:    0
Critical Comp. Temperature Time:    0
Temperature Sensor 1:               48 Celsius
Temperature Sensor 2:               57 Celsius
Thermal Temp. 1 Transition Count:   138

Error Information (NVMe Log 0x01, 16 of 256 entries)
No Errors Logged

Self-test Log (NVMe Log 0x06)
Self-test status: No self-test in progress
Num  Test_Description  Status                       Power_on_Hours  Failing_LBA  NSID Seg SCT Code
 0   Short             Completed without error                1971            -     -   -   -    -
 1   Short             Completed without error                1916            -     -   -   -    -
 2   Short             Completed without error                1839            -     -   -   -    -
 3   Short             Completed without error                1652            -     -   -   -    -
 4   Short             Aborted: Self-test command             1639            -     -   -   -    -
 5   Short             Completed without error                1356            -     -   -   -    -
 6   Short             Completed without error                1188            -     -   -   -    -
 7   Short             Completed without error                1074            -     -   -   -    -
 8   Short             Completed without error                 867            -     -   -   -    -
 9   Short             Completed without error                 634            -     -   -   -    -
10   Short             Aborted: Self-test command              186            -     -   -   -    -
11   Short             Completed without error                 149            -     -   -   -    -
12   Short             Completed without error                   1            -     -   -   -    -

