=== START OF INFORMATION SECTION ===
Model Family:     SAMSUNG SpinPoint P80
Device Model:     SAMSUNG SP0802N
Serial Number:    --
Firmware Version: TK200-04
User Capacity:    80 060 424 192 bytes [80,0 GB]
Sector Size:      512 bytes logical/physical
Device is:        In smartctl database [for details use: -P show]
ATA Version is:   ATA/ATAPI-7 T13/1532D revision 0
Local Time is:    Sun Jun 11 02:26:59 2017 EEST

==> WARNING: May need -F samsung2 or -F samsung3 enabled; see manual for details.

SMART support is: Available - device has SMART capability.
SMART support is: Enabled
AAM feature is:   Disabled
APM feature is:   Unavailable
Rd look-ahead is: Enabled
Write cache is:   Enabled
ATA Security is:  Disabled, frozen [SEC2]
Wt Cache Reorder: Unavailable

=== START OF READ SMART DATA SECTION ===
SMART overall-health self-assessment test result: PASSED

General SMART Values:
Offline data collection status:  (0x80)	Offline data collection activity
					was never started.
					Auto Offline Data Collection: Enabled.
Self-test execution status:      (   0)	The previous self-test routine completed
					without error or no self-test has ever 
					been run.
Total time to complete Offline 
data collection: 		( 3000) seconds.
Offline data collection
capabilities: 			 (0x1b) SMART execute Offline immediate.
					Auto Offline data collection on/off support.
					Suspend Offline collection upon new
					command.
					Offline surface scan supported.
					Self-test supported.
					No Conveyance Self-test supported.
					No Selective Self-test supported.
SMART capabilities:            (0x0003)	Saves SMART data before entering
					power-saving mode.
					Supports SMART auto save timer.
Error logging capability:        (0x01)	Error logging supported.
					No General Purpose Logging support.
Short self-test routine 
recommended polling time: 	 (   1) minutes.
Extended self-test routine
recommended polling time: 	 (  50) minutes.

SMART Attributes Data Structure revision number: 16
Vendor Specific SMART Attributes with Thresholds:
ID# ATTRIBUTE_NAME          FLAGS    VALUE WORST THRESH FAIL RAW_VALUE
  1 Raw_Read_Error_Rate     POSR--   100   079   051    -    20
  3 Spin_Up_Time            POS---   100   100   025    -    4224
  4 Start_Stop_Count        -O--CK   093   093   000    -    7899
  5 Reallocated_Sector_Ct   PO--CK   070   070   011    -    67
  7 Seek_Error_Rate         POSR--   100   100   051    -    0
  8 Seek_Time_Performance   P-S--K   100   100   015    -    0
  9 Power_On_Hours          -O--CK   099   099   000    -    1035944
 10 Spin_Retry_Count        PO--CK   100   100   051    -    0
 11 Calibration_Retry_Count -O--C-   100   100   000    -    0
 12 Power_Cycle_Count       -O--CK   095   095   000    -    5078
194 Temperature_Celsius     -O---K   100   097   000    -    46
195 Hardware_ECC_Recovered  -O-RC-   100   100   000    -    5736039
196 Reallocated_Event_Count -O--CK   060   060   000    -    87
197 Current_Pending_Sector  -O--C-   100   100   000    -    0
198 Offline_Uncorrectable   ----CK   060   060   000    -    87
199 UDMA_CRC_Error_Count    -OSRCK   200   200   000    -    0
200 Multi_Zone_Error_Rate   -O-R--   100   100   051    -    0
201 Soft_Read_Error_Rate    -O-R--   100   099   051    -    0
                            ||||||_ K auto-keep
                            |||||__ C event count
                            ||||___ R error rate
                            |||____ S speed/performance
                            ||_____ O updated online
                            |______ P prefailure warning

General Purpose Log Directory not supported

SMART Log Directory Version 1 [multi-sector log support]
Address    Access  R/W   Size  Description
0x00           SL  R/O      1  Log Directory
0x01           SL  R/O      1  Summary SMART error log
0x02           SL  R/O      2  Comprehensive SMART error log
0x06           SL  R/O      2  SMART self-test log
0x80-0x9f      SL  R/W     16  Host vendor specific log

SMART Extended Comprehensive Error Log (GP Log 0x03) not supported

SMART Error Log Version: 1
ATA Error Count: 1761 (device log contains only the most recent five errors)
	CR = Command Register [HEX]
	FR = Features Register [HEX]
	SC = Sector Count Register [HEX]
	SN = Sector Number Register [HEX]
	CL = Cylinder Low Register [HEX]
	CH = Cylinder High Register [HEX]
	DH = Device/Head Register [HEX]
	DC = Device Command Register [HEX]
	ER = Error register [HEX]
	ST = Status register [HEX]
Powered_Up_Time is measured from power on, and printed as
DDd+hh:mm:SS.sss where DD=days, hh=hours, mm=minutes,
SS=sec, and sss=millisec. It "wraps" after 49.710 days.

Error 1761 occurred at disk power-on lifetime: 8627 hours (359 days + 11 hours)
  When the command that caused the error occurred, the device was active or idle.

  After command completion occurred, registers were:
  ER ST SC SN CL CH DH
  -- -- -- -- -- -- --
  04 51 fe 00 00 00 50  Error: ABRT

  Commands leading to the command that caused the error were:
  CR FR SC SN CL CH DH DC   Powered_Up_Time  Command/Feature_Name
  -- -- -- -- -- -- -- --  ----------------  --------------------
  ef 05 fe 00 00 00 50 00      00:00:46.063  SET FEATURES [Enable APM]
  c8 00 08 28 08 40 f0 00      00:00:46.000  READ DMA
  c8 00 08 08 0b 81 f6 00      00:00:46.000  READ DMA
  c8 00 08 80 08 80 f6 00      00:00:46.000  READ DMA
  c8 00 08 00 09 81 f6 00      00:00:46.000  READ DMA

Error 1760 occurred at disk power-on lifetime: 8627 hours (359 days + 11 hours)
  When the command that caused the error occurred, the device was active or idle.

  After command completion occurred, registers were:
  ER ST SC SN CL CH DH
  -- -- -- -- -- -- --
  04 51 fe 00 00 00 50  Error: ABRT

  Commands leading to the command that caused the error were:
  CR FR SC SN CL CH DH DC   Powered_Up_Time  Command/Feature_Name
  -- -- -- -- -- -- -- --  ----------------  --------------------
  ef 05 fe 00 00 00 50 00      01:03:16.125  SET FEATURES [Enable APM]
  c8 00 08 00 09 80 f6 00      01:03:16.125  READ DMA
  c8 00 08 00 0a 80 f6 00      01:03:16.125  READ DMA
  c8 00 08 f8 09 80 f6 00      01:03:16.125  READ DMA
  c8 00 08 f0 09 80 f6 00      01:03:16.125  READ DMA

Error 1759 occurred at disk power-on lifetime: 8626 hours (359 days + 10 hours)
  When the command that caused the error occurred, the device was active or idle.

  After command completion occurred, registers were:
  ER ST SC SN CL CH DH
  -- -- -- -- -- -- --
  04 51 fe 00 00 00 50  Error: ABRT

  Commands leading to the command that caused the error were:
  CR FR SC SN CL CH DH DC   Powered_Up_Time  Command/Feature_Name
  -- -- -- -- -- -- -- --  ----------------  --------------------
  ef 05 fe 00 00 00 50 00      00:51:23.250  SET FEATURES [Enable APM]
  c8 00 08 00 10 00 f0 00      00:51:22.500  READ DMA
  c8 00 68 98 fb 51 f9 00      00:51:22.500  READ DMA
  c8 00 80 08 fb 51 f9 00      00:51:22.500  READ DMA
  c8 00 b8 48 fa 51 f9 00      00:51:22.500  READ DMA

Error 1758 occurred at disk power-on lifetime: 8626 hours (359 days + 10 hours)
  When the command that caused the error occurred, the device was active or idle.

  After command completion occurred, registers were:
  ER ST SC SN CL CH DH
  -- -- -- -- -- -- --
  04 51 fe 00 00 00 50  Error: ABRT

  Commands leading to the command that caused the error were:
  CR FR SC SN CL CH DH DC   Powered_Up_Time  Command/Feature_Name
  -- -- -- -- -- -- -- --  ----------------  --------------------
  ef 05 fe 00 00 00 50 00      00:46:27.063  SET FEATURES [Enable APM]
  c8 00 08 00 10 00 f0 00      00:46:26.250  READ DMA
  c8 00 68 98 fb 51 f9 00      00:46:26.250  READ DMA
  c8 00 80 08 fb 51 f9 00      00:46:26.250  READ DMA
  c8 00 b8 48 fa 51 f9 00      00:46:26.250  READ DMA

Error 1757 occurred at disk power-on lifetime: 8626 hours (359 days + 10 hours)
  When the command that caused the error occurred, the device was active or idle.

  After command completion occurred, registers were:
  ER ST SC SN CL CH DH
  -- -- -- -- -- -- --
  04 51 fe 00 00 00 50  Error: ABRT

  Commands leading to the command that caused the error were:
  CR FR SC SN CL CH DH DC   Powered_Up_Time  Command/Feature_Name
  -- -- -- -- -- -- -- --  ----------------  --------------------
  ef 05 fe 00 00 00 50 00      00:00:41.875  SET FEATURES [Enable APM]
  c8 00 08 00 09 80 f6 00      00:00:41.875  READ DMA
  c8 00 08 00 0a 80 f6 00      00:00:41.875  READ DMA
  c8 00 08 f8 09 80 f6 00      00:00:41.875  READ DMA
  c8 00 08 f0 09 80 f6 00      00:00:41.875  READ DMA

SMART Extended Self-test Log (GP Log 0x07) not supported

SMART Self-test log structure revision number 1
No self-tests have been logged.  [To run self-tests, use: smartctl -t]

Selective Self-tests/Logging not supported

SCT Commands not supported

Device Statistics (GP/SMART Log 0x04) not supported

SATA Phy Event Counters (GP Log 0x11) not supported

