=== START OF INFORMATION SECTION ===
Model Family:     SAMSUNG SpinPoint P80
Device Model:     SAMSUNG SP0802N
Serial Number:    --
Firmware Version: TK100-30
User Capacity:    80 060 424 192 bytes [80,0 GB]
Sector Size:      512 bytes logical/physical
Device is:        In smartctl database [for details use: -P show]
ATA Version is:   ATA/ATAPI-7 T13/1532D revision 0
Local Time is:    Tue Dec  6 17:55:54 2016 MSK
SMART support is: Available - device has SMART capability.
SMART support is: Enabled
AAM feature is:   Disabled
APM feature is:   Unavailable
Rd look-ahead is: Enabled
Write cache is:   Enabled
ATA Security is:  Disabled, frozen [SEC2]
Wt Cache Reorder: Unavailable

=== START OF READ SMART DATA SECTION ===
SMART overall-health self-assessment test result: PASSED

General SMART Values:
Offline data collection status:  (0x80)	Offline data collection activity
					was never started.
					Auto Offline Data Collection: Enabled.
Self-test execution status:      (   0)	The previous self-test routine completed
					without error or no self-test has ever 
					been run.
Total time to complete Offline 
data collection: 		( 3000) seconds.
Offline data collection
capabilities: 			 (0x1b) SMART execute Offline immediate.
					Auto Offline data collection on/off support.
					Suspend Offline collection upon new
					command.
					Offline surface scan supported.
					Self-test supported.
					No Conveyance Self-test supported.
					No Selective Self-test supported.
SMART capabilities:            (0x0003)	Saves SMART data before entering
					power-saving mode.
					Supports SMART auto save timer.
Error logging capability:        (0x01)	Error logging supported.
					No General Purpose Logging support.
Short self-test routine 
recommended polling time: 	 (   1) minutes.
Extended self-test routine
recommended polling time: 	 (  50) minutes.

SMART Attributes Data Structure revision number: 16
Vendor Specific SMART Attributes with Thresholds:
ID# ATTRIBUTE_NAME          FLAGS    VALUE WORST THRESH FAIL RAW_VALUE
  1 Raw_Read_Error_Rate     POSR--   100   100   051    -    0
  3 Spin_Up_Time            POS---   100   100   025    -    3456
  4 Start_Stop_Count        -O--CK   083   083   000    -    17241
  5 Reallocated_Sector_Ct   PO--CK   100   100   011    -    0
  7 Seek_Error_Rate         POSR--   100   100   051    -    0
  8 Seek_Time_Performance   P-S--K   100   100   015    -    0
  9 Power_On_Half_Minutes   -O--CK   097   097   000    -    15999h+36m
 10 Spin_Retry_Count        PO--CK   100   100   051    -    0
 11 Calibration_Retry_Count -O--C-   100   100   000    -    72
 12 Power_Cycle_Count       -O--CK   091   091   000    -    9155
194 Temperature_Celsius     -O---K   136   067   000    -    34
195 Hardware_ECC_Recovered  -O-RC-   100   100   000    -    429254
196 Reallocated_Event_Count -O--CK   099   099   000    -    3
197 Current_Pending_Sector  -O--C-   100   100   000    -    0
198 Total_Offl_Uncorrectabl ----CK   100   100   000    -    0
199 UDMA_CRC_Error_Count    -OSRCK   200   200   000    -    7
200 Multi_Zone_Error_Rate   -O-R--   100   100   051    -    0
201 Soft_Read_Error_Rate    -O-R--   100   100   051    -    0
                            ||||||_ K auto-keep
                            |||||__ C event count
                            ||||___ R error rate
                            |||____ S speed/performance
                            ||_____ O updated online
                            |______ P prefailure warning

General Purpose Log Directory not supported

SMART Log Directory Version 1 [multi-sector log support]
Address    Access  R/W   Size  Description
0x00           SL  R/O      1  Log Directory
0x01           SL  R/O      1  Summary SMART error log
0x02           SL  R/O      2  Comprehensive SMART error log
0x06           SL  R/O      2  SMART self-test log
0x80-0x9f      SL  R/W     16  Host vendor specific log

SMART Extended Comprehensive Error Log (GP Log 0x03) not supported

SMART Error Log Version: 1
ATA Error Count: 36 (device log contains only the most recent five errors)
	CR = Command Register [HEX]
	FR = Features Register [HEX]
	SC = Sector Count Register [HEX]
	SN = Sector Number Register [HEX]
	CL = Cylinder Low Register [HEX]
	CH = Cylinder High Register [HEX]
	DH = Device/Head Register [HEX]
	DC = Device Command Register [HEX]
	ER = Error register [HEX]
	ST = Status register [HEX]
Powered_Up_Time is measured from power on, and printed as
DDd+hh:mm:SS.sss where DD=days, hh=hours, mm=minutes,
SS=sec, and sss=millisec. It "wraps" after 49.710 days.

Error 36 occurred at disk power-on lifetime: 15975 hours (665 days + 15 hours)
  When the command that caused the error occurred, the device was active or idle.

  After command completion occurred, registers were:
  ER ST SC SN CL CH DH
  -- -- -- -- -- -- --
  84 51 10 97 1f 5e e0  Error: ICRC, ABRT at LBA = 0x005e1f97 = 6168471

  Commands leading to the command that caused the error were:
  CR FR SC SN CL CH DH DC   Powered_Up_Time  Command/Feature_Name
  -- -- -- -- -- -- -- --  ----------------  --------------------
  ca 00 10 97 1f 5e e0 00      00:14:23.875  WRITE DMA
  ca 00 08 5f 4d 4e e0 00      00:14:21.000  WRITE DMA
  ca 00 08 57 23 02 e0 00      00:14:21.000  WRITE DMA
  c8 00 01 29 9a 35 e7 00      00:14:20.500  READ DMA
  c8 00 01 bd 57 e6 e4 00      00:14:20.500  READ DMA

Error 35 occurred at disk power-on lifetime: 15975 hours (665 days + 15 hours)
  When the command that caused the error occurred, the device was active or idle.

  After command completion occurred, registers were:
  ER ST SC SN CL CH DH
  -- -- -- -- -- -- --
  84 51 08 5f 4d 4e e0  Error: ICRC, ABRT at LBA = 0x004e4d5f = 5131615

  Commands leading to the command that caused the error were:
  CR FR SC SN CL CH DH DC   Powered_Up_Time  Command/Feature_Name
  -- -- -- -- -- -- -- --  ----------------  --------------------
  ca 00 08 5f 4d 4e e0 00      00:14:20.500  WRITE DMA
  c8 00 01 29 9a 35 e7 00      00:14:20.000  READ DMA
  c8 00 01 bd 57 e6 e4 00      00:14:20.000  READ DMA
  c8 00 01 00 00 00 e0 00      00:14:20.000  READ DMA
  c8 00 01 00 00 00 e0 00      00:14:20.000  READ DMA

Error 34 occurred at disk power-on lifetime: 15975 hours (665 days + 15 hours)
  When the command that caused the error occurred, the device was active or idle.

  After command completion occurred, registers were:
  ER ST SC SN CL CH DH
  -- -- -- -- -- -- --
  84 51 08 5f 4d 4e e0  Error: ICRC, ABRT at LBA = 0x004e4d5f = 5131615

  Commands leading to the command that caused the error were:
  CR FR SC SN CL CH DH DC   Powered_Up_Time  Command/Feature_Name
  -- -- -- -- -- -- -- --  ----------------  --------------------
  ca 00 08 5f 4d 4e e0 00      00:14:20.000  WRITE DMA
  ca 00 80 df 4c 4e e0 00      00:14:18.938  WRITE DMA
  ca 00 30 af 4c 4e e0 00      00:14:17.938  WRITE DMA
  ca 00 50 d7 85 46 e0 00      00:14:17.938  WRITE DMA
  ca 00 38 9f 85 46 e0 00      00:14:16.938  WRITE DMA

Error 33 occurred at disk power-on lifetime: 15557 hours (648 days + 5 hours)
  When the command that caused the error occurred, the device was active or idle.

  After command completion occurred, registers were:
  ER ST SC SN CL CH DH
  -- -- -- -- -- -- --
  84 51 0f 17 01 4d e0  Error: ICRC, ABRT at LBA = 0x004d0117 = 5046551

  Commands leading to the command that caused the error were:
  CR FR SC SN CL CH DH DC   Powered_Up_Time  Command/Feature_Name
  -- -- -- -- -- -- -- --  ----------------  --------------------
  ca 00 0f 17 01 4d e0 00      00:07:37.813  WRITE DMA
  c8 00 01 29 9a 35 e7 00      00:07:37.375  READ DMA
  c8 00 01 bd 57 e6 e4 00      00:07:37.375  READ DMA
  c8 00 01 00 00 00 e0 00      00:07:37.375  READ DMA
  c8 00 01 00 00 00 e0 00      00:07:37.375  READ DMA

Error 32 occurred at disk power-on lifetime: 15557 hours (648 days + 5 hours)
  When the command that caused the error occurred, the device was active or idle.

  After command completion occurred, registers were:
  ER ST SC SN CL CH DH
  -- -- -- -- -- -- --
  84 51 10 3f 13 44 e0  Error: ICRC, ABRT at LBA = 0x0044133f = 4461375

  Commands leading to the command that caused the error were:
  CR FR SC SN CL CH DH DC   Powered_Up_Time  Command/Feature_Name
  -- -- -- -- -- -- -- --  ----------------  --------------------
  ca 00 10 3f 13 44 e0 00      00:07:37.313  WRITE DMA
  c8 00 01 29 9a 35 e7 00      00:07:36.875  READ DMA
  c8 00 01 bd 57 e6 e4 00      00:07:36.875  READ DMA
  c8 00 01 00 00 00 e0 00      00:07:36.875  READ DMA
  ca 00 18 ef 56 03 e0 00      00:07:36.875  WRITE DMA

SMART Extended Self-test Log (GP Log 0x07) not supported

SMART Self-test log structure revision number 1
No self-tests have been logged.  [To run self-tests, use: smartctl -t]

Selective Self-tests/Logging not supported

SCT Commands not supported

Device Statistics (GP/SMART Log 0x04) not supported

SATA Phy Event Counters (GP Log 0x11) not supported

