smartctl 7.1 2019-12-30 r5022 [x86_64-linux-5.4.0-42-generic] (local build)
Copyright (C) 2002-19, Bruce Allen, Christian Franke, www.smartmontools.org

=== START OF INFORMATION SECTION ===
Model Number:                       XPG GAMMIX S11 Pro
Serial Number:                      --
Firmware Version:                   42AZS6AC
PCI Vendor/Subsystem ID:            0x1cc1
IEEE OUI Identifier:                0x000000
Controller ID:                      1
Number of Namespaces:               1
Namespace 1 Size/Capacity:          512,110,190,592 [512 GB]
Namespace 1 Utilization:            143,403,827,200 [143 GB]
Namespace 1 Formatted LBA Size:     512
Local Time is:                      Fri Aug  7 09:55:21 2020 -03
Firmware Updates (0x14):            2 Slots, no Reset required
Optional Admin Commands (0x0017):   Security Format Frmw_DL Self_Test
Optional NVM Commands (0x005f):     Comp Wr_Unc DS_Mngmt Wr_Zero Sav/Sel_Feat Timestmp
Maximum Data Transfer Size:         64 Pages
Warning  Comp. Temp. Threshold:     75 Celsius
Critical Comp. Temp. Threshold:     80 Celsius

Supported Power States
St Op     Max   Active     Idle   RL RT WL WT  Ent_Lat  Ex_Lat
 0 +     9.00W       -        -    0  0  0  0        0       0
 1 +     4.60W       -        -    1  1  1  1        0       0
 2 +     3.80W       -        -    2  2  2  2        0       0
 3 -   0.0450W       -        -    3  3  3  3     2000    2000
 4 -   0.0040W       -        -    4  4  4  4    15000   15000

Supported LBA Sizes (NSID 0x1)
Id Fmt  Data  Metadt  Rel_Perf
 0 +     512       0         0

=== START OF SMART DATA SECTION ===
SMART overall-health self-assessment test result: PASSED

SMART/Health Information (NVMe Log 0x02)
Critical Warning:                   0x00
Temperature:                        29 Celsius
Available Spare:                    100%
Available Spare Threshold:          10%
Percentage Used:                    1%
Data Units Read:                    14,024,872 [7.18 TB]
Data Units Written:                 11,863,409 [6.07 TB]
Host Read Commands:                 155,893,860
Host Write Commands:                146,448,718
Controller Busy Time:               2,900
Power Cycles:                       303
Power On Hours:                     1,589
Unsafe Shutdowns:                   19
Media and Data Integrity Errors:    0
Error Information Log Entries:      0
Warning  Comp. Temperature Time:    0
Critical Comp. Temperature Time:    0
Thermal Temp. 1 Transition Count:   22
Thermal Temp. 2 Transition Count:   14
Thermal Temp. 1 Total Time:         339
Thermal Temp. 2 Total Time:         218

Error Information (NVMe Log 0x01, max 256 entries)
No Errors Logged



