smartctl 7.4 2023-08-01 r5530 [x86_64-linux-6.1.20-generic-2rosa2021.1-x86_64] (local build)
Copyright (C) 2002-23, Bruce Allen, Christian Franke, www.smartmontools.org

=== START OF INFORMATION SECTION ===
Model Number:                       Patriot M.2 P300 256GB
Serial Number:                      --
Firmware Version:                   APF1M3R0
PCI Vendor/Subsystem ID:            0x1ed0
IEEE OUI Identifier:                0x2c3ebf
Total NVM Capacity:                 256,060,514,304 [256 GB]
Unallocated NVM Capacity:           0
Controller ID:                      1
NVMe Version:                       1.3
Number of Namespaces:               1
Namespace 1 Size/Capacity:          256,060,514,304 [256 GB]
Namespace 1 Formatted LBA Size:     512
Namespace 1 IEEE EUI-64:            2c3ebf ...
Local Time is:                      Sat Dec  2 09:21:28 2023 MSK
Firmware Updates (0x12):            1 Slot, no Reset required
Optional Admin Commands (0x0017):   Security Format Frmw_DL Self_Test
Optional NVM Commands (0x0056):     Wr_Unc DS_Mngmt Sav/Sel_Feat Timestmp
Log Page Attributes (0x0a):         Cmd_Eff_Lg Telmtry_Lg
Maximum Data Transfer Size:         64 Pages
Warning  Comp. Temp. Threshold:     70 Celsius
Critical Comp. Temp. Threshold:     80 Celsius

Supported Power States
St Op     Max   Active     Idle   RL RT WL WT  Ent_Lat  Ex_Lat
 0 +     3.50W       -        -    0  0  0  0        0       0
 1 +     1.90W       -        -    1  1  1  1        0       0
 2 +     1.50W       -        -    2  2  2  2        0       0
 3 -   0.0700W       -        -    3  3  3  3     1000    1000
 4 -   0.0050W       -        -    4  4  4  4     5000   45000

Supported LBA Sizes (NSID 0x1)
Id Fmt  Data  Metadt  Rel_Perf
 0 +     512       0         1
 1 -    4096       0         0

=== START OF SMART DATA SECTION ===
SMART overall-health self-assessment test result: PASSED

SMART/Health Information (NVMe Log 0x02)
Critical Warning:                   0x00
Temperature:                        30 Celsius
Available Spare:                    100%
Available Spare Threshold:          5%
Percentage Used:                    0%
Data Units Read:                    1,519,143 [777 GB]
Data Units Written:                 1,950,634 [998 GB]
Host Read Commands:                 14,159,387
Host Write Commands:                15,349,599
Controller Busy Time:               315
Power Cycles:                       187
Power On Hours:                     298
Unsafe Shutdowns:                   43
Media and Data Integrity Errors:    0
Error Information Log Entries:      0
Warning  Comp. Temperature Time:    0
Critical Comp. Temperature Time:    0
Temperature Sensor 1:               47 Celsius

Error Information (NVMe Log 0x01, 16 of 16 entries)
No Errors Logged

Read Self-test Log failed: Invalid Field in Command (0x002)

