smartctl 7.4 2023-08-01 r5530 [x86_64-linux-6.14.0-desktop-0.rc7.2omv2590] (OpenMandriva Lx 7.4-1)
Copyright (C) 2002-23, Bruce Allen, Christian Franke, www.smartmontools.org

=== START OF INFORMATION SECTION ===
Model Family:     Western Digital Blue Mobile
Device Model:     WDC WD5000LPVX-22V0TT0
Serial Number:    --
LU WWN Device Id: 5 0014ee ...
Firmware Version: 01.01A01
User Capacity:    500,107,862,016 bytes [500 GB]
Sector Sizes:     512 bytes logical, 4096 bytes physical
Rotation Rate:    5400 rpm
Device is:        In smartctl database
ATA Version is:   ACS-2 (minor revision not indicated)
SATA Version is:  SATA 3.0, 6.0 Gb/s (current: 6.0 Gb/s)
Local Time is:    Sat Apr 12 13:07:05 2025 WEST
SMART support is: Available - device has SMART capability.
SMART support is: Enabled
AAM feature is:   Unavailable
APM level is:     96 (intermediate level with standby)
Rd look-ahead is: Enabled
Write cache is:   Enabled
DSN feature is:   Unavailable
ATA Security is:  Disabled, frozen [SEC2]
Wt Cache Reorder: Enabled

=== START OF READ SMART DATA SECTION ===
SMART overall-health self-assessment test result: PASSED

General SMART Values:
Offline data collection status:  (0x80)	Offline data collection activity
					was never started.
					Auto Offline Data Collection: Enabled.
Self-test execution status:      (   0)	The previous self-test routine completed
					without error or no self-test has ever 
					been run.
Total time to complete Offline 
data collection: 		( 8880) seconds.
Offline data collection
capabilities: 			 (0x7b) SMART execute Offline immediate.
					Auto Offline data collection on/off support.
					Suspend Offline collection upon new
					command.
					Offline surface scan supported.
					Self-test supported.
					Conveyance Self-test supported.
					Selective Self-test supported.
SMART capabilities:            (0x0003)	Saves SMART data before entering
					power-saving mode.
					Supports SMART auto save timer.
Error logging capability:        (0x01)	Error logging supported.
					General Purpose Logging supported.
Short self-test routine 
recommended polling time: 	 (   2) minutes.
Extended self-test routine
recommended polling time: 	 ( 103) minutes.
Conveyance self-test routine
recommended polling time: 	 (   5) minutes.
SCT capabilities: 	       (0x7035)	SCT Status supported.
					SCT Feature Control supported.
					SCT Data Table supported.

SMART Attributes Data Structure revision number: 16
Vendor Specific SMART Attributes with Thresholds:
ID# ATTRIBUTE_NAME          FLAGS    VALUE WORST THRESH FAIL RAW_VALUE
  1 Raw_Read_Error_Rate     POSR-K   200   200   051    -    0
  3 Spin_Up_Time            POS--K   152   139   021    -    1391
  4 Start_Stop_Count        -O--CK   079   079   000    -    21554
  5 Reallocated_Sector_Ct   PO--CK   200   200   140    -    0
  7 Seek_Error_Rate         -OSR-K   200   200   000    -    0
  9 Power_On_Hours          -O--CK   096   096   000    -    3017
 10 Spin_Retry_Count        -O--CK   100   100   000    -    0
 11 Calibration_Retry_Count -O--CK   100   100   000    -    0
 12 Power_Cycle_Count       -O--CK   096   096   000    -    4582
191 G-Sense_Error_Rate      -O--CK   001   001   000    -    188
192 Power-Off_Retract_Count -O--CK   198   198   000    -    1686
193 Load_Cycle_Count        -O--CK   183   183   000    -    52099
194 Temperature_Celsius     -O---K   113   096   000    -    30
196 Reallocated_Event_Count -O--CK   200   200   000    -    0
197 Current_Pending_Sector  -O--CK   200   200   000    -    0
198 Offline_Uncorrectable   ----CK   100   253   000    -    0
199 UDMA_CRC_Error_Count    -O--CK   200   200   000    -    0
200 Multi_Zone_Error_Rate   ---R--   200   200   000    -    0
                            ||||||_ K auto-keep
                            |||||__ C event count
                            ||||___ R error rate
                            |||____ S speed/performance
                            ||_____ O updated online
                            |______ P prefailure warning

General Purpose Log Directory Version 1
SMART           Log Directory Version 1 [multi-sector log support]
Address    Access  R/W   Size  Description
0x00       GPL,SL  R/O      1  Log Directory
0x01           SL  R/O      1  Summary SMART error log
0x02           SL  R/O      5  Comprehensive SMART error log
0x03       GPL     R/O      6  Ext. Comprehensive SMART error log
0x06           SL  R/O      1  SMART self-test log
0x07       GPL     R/O      1  Extended self-test log
0x09           SL  R/W      1  Selective self-test log
0x10       GPL     R/O      1  NCQ Command Error log
0x11       GPL     R/O      1  SATA Phy Event Counters log
0x80-0x9f  GPL,SL  R/W     16  Host vendor specific log
0xa0-0xa7  GPL,SL  VS      16  Device vendor specific log
0xa8-0xb6  GPL,SL  VS       1  Device vendor specific log
0xb7       GPL,SL  VS      38  Device vendor specific log
0xbd       GPL,SL  VS       1  Device vendor specific log
0xc0       GPL,SL  VS       1  Device vendor specific log
0xc1       GPL     VS      93  Device vendor specific log
0xe0       GPL,SL  R/W      1  SCT Command/Status
0xe1       GPL,SL  R/W      1  SCT Data Transfer

SMART Extended Comprehensive Error Log Version: 1 (6 sectors)
Device Error Count: 18
	CR     = Command Register
	FEATR  = Features Register
	COUNT  = Count (was: Sector Count) Register
	LBA_48 = Upper bytes of LBA High/Mid/Low Registers ]  ATA-8
	LH     = LBA High (was: Cylinder High) Register    ]   LBA
	LM     = LBA Mid (was: Cylinder Low) Register      ] Register
	LL     = LBA Low (was: Sector Number) Register     ]
	DV     = Device (was: Device/Head) Register
	DC     = Device Control Register
	ER     = Error register
	ST     = Status register
Powered_Up_Time is measured from power on, and printed as
DDd+hh:mm:SS.sss where DD=days, hh=hours, mm=minutes,
SS=sec, and sss=millisec. It "wraps" after 49.710 days.

Error 18 [17] occurred at disk power-on lifetime: 115 hours (4 days + 19 hours)
  When the command that caused the error occurred, the device was in standby mode.

  After command completion occurred, registers were:
  ER -- ST COUNT  LBA_48  LH LM LL DV DC
  -- -- -- == -- == == == -- -- -- -- --
  04 -- 51 00 01 00 00 00 00 00 00 a0 00  Error: ABRT

  Commands leading to the command that caused the error were:
  CR FEATR COUNT  LBA_48  LH LM LL DV DC  Powered_Up_Time  Command/Feature_Name
  -- == -- == -- == == == -- -- -- -- --  ---------------  --------------------
  b0 00 d6 00 01 00 00 00 c2 4f e0 a0 00     05:38:05.043  SMART WRITE LOG
  b0 00 d6 00 01 00 00 00 c2 4f e0 a0 00     05:38:05.042  SMART WRITE LOG
  b0 00 d6 00 01 00 00 00 c2 4f e0 a0 00     05:38:05.042  SMART WRITE LOG
  27 00 00 00 00 00 00 00 00 00 00 e0 00     05:37:36.133  READ NATIVE MAX ADDRESS EXT [OBS-ACS-3]
  ec 00 00 00 01 00 00 00 00 00 00 e0 00     05:37:36.132  IDENTIFY DEVICE

Error 17 [16] occurred at disk power-on lifetime: 115 hours (4 days + 19 hours)
  When the command that caused the error occurred, the device was in standby mode.

  After command completion occurred, registers were:
  ER -- ST COUNT  LBA_48  LH LM LL DV DC
  -- -- -- == -- == == == -- -- -- -- --
  04 -- 51 00 01 00 00 00 00 00 00 a0 00  Error: ABRT

  Commands leading to the command that caused the error were:
  CR FEATR COUNT  LBA_48  LH LM LL DV DC  Powered_Up_Time  Command/Feature_Name
  -- == -- == -- == == == -- -- -- -- --  ---------------  --------------------
  b0 00 d6 00 01 00 00 00 c2 4f e0 a0 00     05:38:05.042  SMART WRITE LOG
  b0 00 d6 00 01 00 00 00 c2 4f e0 a0 00     05:38:05.042  SMART WRITE LOG
  27 00 00 00 00 00 00 00 00 00 00 e0 00     05:37:36.133  READ NATIVE MAX ADDRESS EXT [OBS-ACS-3]
  ec 00 00 00 01 00 00 00 00 00 00 e0 00     05:37:36.132  IDENTIFY DEVICE
  ec 00 00 00 01 00 00 00 00 00 00 e0 00     05:37:36.131  IDENTIFY DEVICE

Error 16 [15] occurred at disk power-on lifetime: 115 hours (4 days + 19 hours)
  When the command that caused the error occurred, the device was in standby mode.

  After command completion occurred, registers were:
  ER -- ST COUNT  LBA_48  LH LM LL DV DC
  -- -- -- == -- == == == -- -- -- -- --
  04 -- 51 00 01 00 00 00 00 00 00 a0 00  Error: ABRT

  Commands leading to the command that caused the error were:
  CR FEATR COUNT  LBA_48  LH LM LL DV DC  Powered_Up_Time  Command/Feature_Name
  -- == -- == -- == == == -- -- -- -- --  ---------------  --------------------
  b0 00 d6 00 01 00 00 00 c2 4f e0 a0 00     05:38:05.042  SMART WRITE LOG
  27 00 00 00 00 00 00 00 00 00 00 e0 00     05:37:36.133  READ NATIVE MAX ADDRESS EXT [OBS-ACS-3]
  ec 00 00 00 01 00 00 00 00 00 00 e0 00     05:37:36.132  IDENTIFY DEVICE
  ec 00 00 00 01 00 00 00 00 00 00 e0 00     05:37:36.131  IDENTIFY DEVICE
  ec 00 00 00 01 00 00 00 00 00 00 e0 00     05:37:36.131  IDENTIFY DEVICE

Error 15 [14] occurred at disk power-on lifetime: 115 hours (4 days + 19 hours)
  When the command that caused the error occurred, the device was in standby mode.

  After command completion occurred, registers were:
  ER -- ST COUNT  LBA_48  LH LM LL DV DC
  -- -- -- == -- == == == -- -- -- -- --
  04 -- 51 00 01 00 00 00 00 00 00 a0 00  Error: ABRT

  Commands leading to the command that caused the error were:
  CR FEATR COUNT  LBA_48  LH LM LL DV DC  Powered_Up_Time  Command/Feature_Name
  -- == -- == -- == == == -- -- -- -- --  ---------------  --------------------
  b0 00 d6 00 01 00 00 00 c2 4f e0 a0 00     05:37:36.118  SMART WRITE LOG
  b0 00 d6 00 01 00 00 00 c2 4f e0 a0 00     05:37:36.118  SMART WRITE LOG
  b0 00 d6 00 01 00 00 00 c2 4f e0 a0 00     05:37:36.117  SMART WRITE LOG
  ec 00 00 00 00 00 00 00 00 00 00 a0 00     05:35:43.960  IDENTIFY DEVICE
  b0 00 d8 00 01 00 00 00 c2 4f 01 a0 00     05:35:42.226  SMART ENABLE OPERATIONS

Error 14 [13] occurred at disk power-on lifetime: 115 hours (4 days + 19 hours)
  When the command that caused the error occurred, the device was in standby mode.

  After command completion occurred, registers were:
  ER -- ST COUNT  LBA_48  LH LM LL DV DC
  -- -- -- == -- == == == -- -- -- -- --
  04 -- 51 00 01 00 00 00 00 00 00 a0 00  Error: ABRT

  Commands leading to the command that caused the error were:
  CR FEATR COUNT  LBA_48  LH LM LL DV DC  Powered_Up_Time  Command/Feature_Name
  -- == -- == -- == == == -- -- -- -- --  ---------------  --------------------
  b0 00 d6 00 01 00 00 00 c2 4f e0 a0 00     05:37:36.118  SMART WRITE LOG
  b0 00 d6 00 01 00 00 00 c2 4f e0 a0 00     05:37:36.117  SMART WRITE LOG
  ec 00 00 00 00 00 00 00 00 00 00 a0 00     05:35:43.960  IDENTIFY DEVICE
  b0 00 d8 00 01 00 00 00 c2 4f 01 a0 00     05:35:42.226  SMART ENABLE OPERATIONS
  27 00 00 00 00 00 00 00 00 00 00 e0 00     05:35:00.672  READ NATIVE MAX ADDRESS EXT [OBS-ACS-3]

Error 13 [12] occurred at disk power-on lifetime: 115 hours (4 days + 19 hours)
  When the command that caused the error occurred, the device was in standby mode.

  After command completion occurred, registers were:
  ER -- ST COUNT  LBA_48  LH LM LL DV DC
  -- -- -- == -- == == == -- -- -- -- --
  04 -- 51 00 01 00 00 00 00 00 00 a0 00  Error: ABRT

  Commands leading to the command that caused the error were:
  CR FEATR COUNT  LBA_48  LH LM LL DV DC  Powered_Up_Time  Command/Feature_Name
  -- == -- == -- == == == -- -- -- -- --  ---------------  --------------------
  b0 00 d6 00 01 00 00 00 c2 4f e0 a0 00     05:37:36.117  SMART WRITE LOG
  ec 00 00 00 00 00 00 00 00 00 00 a0 00     05:35:43.960  IDENTIFY DEVICE
  b0 00 d8 00 01 00 00 00 c2 4f 01 a0 00     05:35:42.226  SMART ENABLE OPERATIONS
  27 00 00 00 00 00 00 00 00 00 00 e0 00     05:35:00.672  READ NATIVE MAX ADDRESS EXT [OBS-ACS-3]
  ec 00 00 00 01 00 00 00 00 00 00 e0 00     05:35:00.671  IDENTIFY DEVICE

Error 12 [11] occurred at disk power-on lifetime: 115 hours (4 days + 19 hours)
  When the command that caused the error occurred, the device was in standby mode.

  After command completion occurred, registers were:
  ER -- ST COUNT  LBA_48  LH LM LL DV DC
  -- -- -- == -- == == == -- -- -- -- --
  04 -- 51 00 01 00 00 00 00 00 00 a0 00  Error: ABRT

  Commands leading to the command that caused the error were:
  CR FEATR COUNT  LBA_48  LH LM LL DV DC  Powered_Up_Time  Command/Feature_Name
  -- == -- == -- == == == -- -- -- -- --  ---------------  --------------------
  b0 00 d6 00 01 00 00 00 c2 4f e0 a0 00     05:34:36.560  SMART WRITE LOG
  b0 00 d6 00 01 00 00 00 c2 4f e0 a0 00     05:34:36.559  SMART WRITE LOG
  b0 00 d6 00 01 00 00 00 c2 4f e0 a0 00     05:34:36.556  SMART WRITE LOG
  2f 00 00 00 01 00 00 00 00 00 00 e0 00     05:33:54.626  READ LOG EXT
  ec 00 00 00 00 00 00 00 00 00 00 a0 00     05:33:54.626  IDENTIFY DEVICE

Error 11 [10] occurred at disk power-on lifetime: 115 hours (4 days + 19 hours)
  When the command that caused the error occurred, the device was in standby mode.

  After command completion occurred, registers were:
  ER -- ST COUNT  LBA_48  LH LM LL DV DC
  -- -- -- == -- == == == -- -- -- -- --
  04 -- 51 00 01 00 00 00 00 00 00 a0 00  Error: ABRT

  Commands leading to the command that caused the error were:
  CR FEATR COUNT  LBA_48  LH LM LL DV DC  Powered_Up_Time  Command/Feature_Name
  -- == -- == -- == == == -- -- -- -- --  ---------------  --------------------
  b0 00 d6 00 01 00 00 00 c2 4f e0 a0 00     05:34:36.559  SMART WRITE LOG
  b0 00 d6 00 01 00 00 00 c2 4f e0 a0 00     05:34:36.556  SMART WRITE LOG
  2f 00 00 00 01 00 00 00 00 00 00 e0 00     05:33:54.626  READ LOG EXT
  ec 00 00 00 00 00 00 00 00 00 00 a0 00     05:33:54.626  IDENTIFY DEVICE
  ec 00 00 00 00 00 00 00 00 00 00 a0 00     05:33:43.495  IDENTIFY DEVICE

SMART Extended Self-test Log Version: 1 (1 sectors)
Num  Test_Description    Status                  Remaining  LifeTime(hours)  LBA_of_first_error
# 1  Short offline       Completed without error       00%      2831         -
# 2  Short offline       Completed without error       00%      2829         -
# 3  Short offline       Completed without error       00%      2828         -
# 4  Short offline       Completed without error       00%      2827         -
# 5  Short offline       Completed without error       00%      2823         -
# 6  Short offline       Completed without error       00%      2815         -
# 7  Short offline       Completed without error       00%      2814         -
# 8  Short offline       Completed without error       00%      2791         -
# 9  Short offline       Completed without error       00%      2786         -
#10  Short offline       Completed without error       00%      2782         -
#11  Short offline       Completed without error       00%      2774         -
#12  Short offline       Completed without error       00%      2769         -
#13  Short offline       Completed without error       00%      2751         -
#14  Short offline       Completed without error       00%       676         -
#15  Short offline       Interrupted (host reset)      10%       672         -
#16  Short offline       Completed without error       00%       670         -
#17  Short offline       Completed without error       00%       666         -
#18  Short offline       Completed without error       00%       658         -

SMART Selective self-test log data structure revision number 1
 SPAN  MIN_LBA  MAX_LBA  CURRENT_TEST_STATUS
    1        0        0  Not_testing
    2        0        0  Not_testing
    3        0        0  Not_testing
    4        0        0  Not_testing
    5        0        0  Not_testing
Selective self-test flags (0x0):
  After scanning selected spans, do NOT read-scan remainder of disk.
If Selective self-test is pending on power-up, resume after 0 minute delay.

SCT Status Version:                  3
SCT Version (vendor specific):       258 (0x0102)
Device State:                        Active (0)
Current Temperature:                    30 Celsius
Power Cycle Min/Max Temperature:     25/30 Celsius
Lifetime    Min/Max Temperature:      7/48 Celsius
Under/Over Temperature Limit Count:   0/0
Vendor specific:
01 00 00 00 00 00 00 00 00 00 00 00 00 00 00 00
00 00 00 00 00 00 00 00 00 00 00 00 00 00 00 00

SCT Temperature History Version:     2
Temperature Sampling Period:         1 minute
Temperature Logging Interval:        1 minute
Min/Max recommended Temperature:      0/60 Celsius
Min/Max Temperature Limit:           -41/85 Celsius
Temperature History Size (Index):    128 (7)

SCT Error Recovery Control command not supported

Device Statistics (GP/SMART Log 0x04) not supported

Pending Defects log (GP Log 0x0c) not supported

SATA Phy Event Counters (GP Log 0x11)
ID      Size     Value  Description
0x0001  2            0  Command failed due to ICRC error
0x0002  2            0  R_ERR response for data FIS
0x0003  2            0  R_ERR response for device-to-host data FIS
0x0004  2            0  R_ERR response for host-to-device data FIS
0x0005  2            0  R_ERR response for non-data FIS
0x0006  2            0  R_ERR response for device-to-host non-data FIS
0x0007  2            0  R_ERR response for host-to-device non-data FIS
0x0008  2            0  Device-to-host non-data FIS retries
0x0009  2            3  Transition from drive PhyRdy to drive PhyNRdy
0x000a  2            2  Device-to-host register FISes sent due to a COMRESET
0x000b  2            0  CRC errors within host-to-device FIS
0x000f  2            0  R_ERR response for host-to-device data FIS, CRC
0x0012  2            0  R_ERR response for host-to-device non-data FIS, CRC
0x8000  4          449  Vendor specific



