smartctl 7.2 2020-12-30 r5155 [x86_64-linux-6.0.0-6mx-amd64] (local build)
Copyright (C) 2002-20, Bruce Allen, Christian Franke, www.smartmontools.org

=== START OF INFORMATION SECTION ===
Model Number:                       KBG40ZNS256G NVMe KIOXIA 256GB
Serial Number:                      --
Firmware Version:                   10410106
PCI Vendor/Subsystem ID:            0x1e0f
IEEE OUI Identifier:                0x8ce38e
Total NVM Capacity:                 256,060,514,304 [256 GB]
Unallocated NVM Capacity:           0
Controller ID:                      0
NVMe Version:                       1.3
Number of Namespaces:               1
Namespace 1 Size/Capacity:          256,060,514,304 [256 GB]
Namespace 1 Formatted LBA Size:     512
Namespace 1 IEEE EUI-64:            8ce38e ...
Local Time is:                      Tue Oct 24 16:55:53 2023 EDT
Firmware Updates (0x14):            2 Slots, no Reset required
Optional Admin Commands (0x0017):   Security Format Frmw_DL Self_Test
Optional NVM Commands (0x005f):     Comp Wr_Unc DS_Mngmt Wr_Zero Sav/Sel_Feat Timestmp
Log Page Attributes (0x0e):         Cmd_Eff_Lg Ext_Get_Lg Telmtry_Lg
Maximum Data Transfer Size:         512 Pages
Warning  Comp. Temp. Threshold:     83 Celsius
Critical Comp. Temp. Threshold:     87 Celsius

Supported Power States
St Op     Max   Active     Idle   RL RT WL WT  Ent_Lat  Ex_Lat
 0 +     3.60W       -        -    0  0  0  0        1       1
 1 +     2.60W       -        -    1  1  1  1        1       1
 2 +     2.20W       -        -    2  2  2  2        1       1
 3 -   0.0500W       -        -    3  3  3  3      800    1200
 4 -   0.0050W       -        -    4  4  4  4     3000   32000

Supported LBA Sizes (NSID 0x1)
Id Fmt  Data  Metadt  Rel_Perf
 0 +     512       0         3
 1 -    4096       0         1

=== START OF SMART DATA SECTION ===
SMART overall-health self-assessment test result: PASSED

SMART/Health Information (NVMe Log 0x02)
Critical Warning:                   0x00
Temperature:                        35 Celsius
Available Spare:                    100%
Available Spare Threshold:          50%
Percentage Used:                    12%
Data Units Read:                    20,219,975 [10.3 TB]
Data Units Written:                 29,173,543 [14.9 TB]
Host Read Commands:                 214,202,394
Host Write Commands:                489,999,641
Controller Busy Time:               3,004
Power Cycles:                       241
Power On Hours:                     13,087
Unsafe Shutdowns:                   141
Media and Data Integrity Errors:    0
Error Information Log Entries:      0
Warning  Comp. Temperature Time:    0
Critical Comp. Temperature Time:    0
Temperature Sensor 1:               35 Celsius
Thermal Temp. 1 Transition Count:   26
Thermal Temp. 1 Total Time:         46

Error Information (NVMe Log 0x01, 16 of 256 entries)
No Errors Logged



