=== START OF INFORMATION SECTION ===
Model Family:     Toshiba 2.5" HDD MQ01ABD...
Device Model:     TOSHIBA MQ01ABD050
Serial Number:    --
LU WWN Device Id: 5 000039 ...
Firmware Version: AX001A
User Capacity:    500,107,862,016 bytes [500 GB]
Sector Sizes:     512 bytes logical, 4096 bytes physical
Rotation Rate:    5400 rpm
Form Factor:      2.5 inches
Device is:        In smartctl database [for details use: -P show]
ATA Version is:   ATA8-ACS (minor revision not indicated)
SATA Version is:  SATA 2.6, 3.0 Gb/s (current: 3.0 Gb/s)
Local Time is:    Wed Nov  8 22:00:58 2023 CET
SMART support is: Available - device has SMART capability.
SMART support is: Enabled
AAM feature is:   Unavailable
APM level is:     128 (minimum power consumption without standby)
Rd look-ahead is: Enabled
Write cache is:   Enabled
DSN feature is:   Unavailable
ATA Security is:  Disabled, frozen [SEC2]
Wt Cache Reorder: Enabled

=== START OF READ SMART DATA SECTION ===
SMART overall-health self-assessment test result: PASSED

General SMART Values:
Offline data collection status:  (0x82)	Offline data collection activity
					was completed without error.
					Auto Offline Data Collection: Enabled.
Self-test execution status:      (   0)	The previous self-test routine completed
					without error or no self-test has ever 
					been run.
Total time to complete Offline 
data collection: 		(  120) seconds.
Offline data collection
capabilities: 			 (0x5b) SMART execute Offline immediate.
					Auto Offline data collection on/off support.
					Suspend Offline collection upon new
					command.
					Offline surface scan supported.
					Self-test supported.
					No Conveyance Self-test supported.
					Selective Self-test supported.
SMART capabilities:            (0x0003)	Saves SMART data before entering
					power-saving mode.
					Supports SMART auto save timer.
Error logging capability:        (0x01)	Error logging supported.
					General Purpose Logging supported.
Short self-test routine 
recommended polling time: 	 (   2) minutes.
Extended self-test routine
recommended polling time: 	 ( 118) minutes.
SCT capabilities: 	       (0x003d)	SCT Status supported.
					SCT Error Recovery Control supported.
					SCT Feature Control supported.
					SCT Data Table supported.

SMART Attributes Data Structure revision number: 16
Vendor Specific SMART Attributes with Thresholds:
ID# ATTRIBUTE_NAME          FLAGS    VALUE WORST THRESH FAIL RAW_VALUE
  1 Raw_Read_Error_Rate     PO-R--   100   100   050    -    0
  2 Throughput_Performance  P-S---   100   100   050    -    0
  3 Spin_Up_Time            POS--K   100   100   001    -    1032
  4 Start_Stop_Count        -O--CK   100   100   000    -    3890
  5 Reallocated_Sector_Ct   PO--CK   100   100   050    -    0
  7 Seek_Error_Rate         PO-R--   100   100   050    -    0
  8 Seek_Time_Performance   P-S---   100   100   050    -    0
  9 Power_On_Hours          -O--CK   091   091   000    -    3691
 10 Spin_Retry_Count        PO--CK   177   100   030    -    0
 12 Power_Cycle_Count       -O--CK   100   100   000    -    2458
191 G-Sense_Error_Rate      -O--CK   100   100   000    -    128
192 Power-Off_Retract_Count -O--CK   100   100   000    -    271
193 Load_Cycle_Count        -O--CK   099   099   000    -    17675
194 Temperature_Celsius     -O---K   100   100   000    -    42 (Min/Max 15/58)
196 Reallocated_Event_Count -O--CK   100   100   000    -    0
197 Current_Pending_Sector  -O--CK   100   100   000    -    0
198 Offline_Uncorrectable   ----CK   100   100   000    -    0
199 UDMA_CRC_Error_Count    -O--CK   200   200   000    -    8
220 Disk_Shift              -O----   100   100   000    -    0
222 Loaded_Hours            -O--CK   093   093   000    -    2911
223 Load_Retry_Count        -O--CK   100   100   000    -    0
224 Load_Friction           -O---K   100   100   000    -    0
226 Load-in_Time            -OS--K   100   100   000    -    170
240 Head_Flying_Hours       P-----   100   100   001    -    0
                            ||||||_ K auto-keep
                            |||||__ C event count
                            ||||___ R error rate
                            |||____ S speed/performance
                            ||_____ O updated online
                            |______ P prefailure warning

General Purpose Log Directory Version 1
SMART           Log Directory Version 1 [multi-sector log support]
Address    Access  R/W   Size  Description
0x00       GPL,SL  R/O      1  Log Directory
0x01           SL  R/O      1  Summary SMART error log
0x02           SL  R/O     51  Comprehensive SMART error log
0x03       GPL     R/O     64  Ext. Comprehensive SMART error log
0x04       GPL,SL  R/O      8  Device Statistics log
0x06           SL  R/O      1  SMART self-test log
0x07       GPL     R/O      1  Extended self-test log
0x09           SL  R/W      1  Selective self-test log
0x10       GPL     R/O      1  NCQ Command Error log
0x11       GPL     R/O      1  SATA Phy Event Counters log
0x80-0x9f  GPL,SL  R/W     16  Host vendor specific log
0xe0       GPL,SL  R/W      1  SCT Command/Status
0xe1       GPL,SL  R/W      1  SCT Data Transfer

SMART Extended Comprehensive Error Log Version: 1 (64 sectors)
Device Error Count: 11
	CR     = Command Register
	FEATR  = Features Register
	COUNT  = Count (was: Sector Count) Register
	LBA_48 = Upper bytes of LBA High/Mid/Low Registers ]  ATA-8
	LH     = LBA High (was: Cylinder High) Register    ]   LBA
	LM     = LBA Mid (was: Cylinder Low) Register      ] Register
	LL     = LBA Low (was: Sector Number) Register     ]
	DV     = Device (was: Device/Head) Register
	DC     = Device Control Register
	ER     = Error register
	ST     = Status register
Powered_Up_Time is measured from power on, and printed as
DDd+hh:mm:SS.sss where DD=days, hh=hours, mm=minutes,
SS=sec, and sss=millisec. It "wraps" after 49.710 days.

Error 11 [10] occurred at disk power-on lifetime: 3673 hours (153 days + 1 hours)
  When the command that caused the error occurred, the device was active or idle.

  After command completion occurred, registers were:
  ER -- ST COUNT  LBA_48  LH LM LL DV DC
  -- -- -- == -- == == == -- -- -- -- --
  84 -- 41 00 00 00 00 23 69 a9 27 40 00  Error: ICRC, ABRT at LBA = 0x2369a927 = 594127143

  Commands leading to the command that caused the error were:
  CR FEATR COUNT  LBA_48  LH LM LL DV DC  Powered_Up_Time  Command/Feature_Name
  -- == -- == -- == == == -- -- -- -- --  ---------------  --------------------
  61 00 08 00 00 00 00 23 69 a9 20 40 00     00:00:36.665  WRITE FPDMA QUEUED
  60 00 08 00 00 00 00 00 03 28 10 40 00     00:00:33.557  READ FPDMA QUEUED
  60 00 08 00 00 00 00 00 63 28 00 40 00     00:00:33.556  READ FPDMA QUEUED
  60 00 01 00 00 00 00 23 69 a7 ff 40 00     00:00:33.554  READ FPDMA QUEUED
  60 00 01 00 00 00 00 00 03 28 00 40 00     00:00:33.553  READ FPDMA QUEUED

Error 10 [9] occurred at disk power-on lifetime: 2278 hours (94 days + 22 hours)
  When the command that caused the error occurred, the device was active or idle.

  After command completion occurred, registers were:
  ER -- ST COUNT  LBA_48  LH LM LL DV DC
  -- -- -- == -- == == == -- -- -- -- --
  84 -- 41 00 e8 00 00 09 73 63 1f 40 00  Error: ICRC, ABRT at LBA = 0x0973631f = 158556959

  Commands leading to the command that caused the error were:
  CR FEATR COUNT  LBA_48  LH LM LL DV DC  Powered_Up_Time  Command/Feature_Name
  -- == -- == -- == == == -- -- -- -- --  ---------------  --------------------
  60 00 90 00 e8 00 00 09 73 62 90 40 00     00:07:16.350  READ FPDMA QUEUED
  60 00 b0 00 e0 00 00 09 73 61 e0 40 00     00:07:16.345  READ FPDMA QUEUED
  60 00 18 00 d8 00 00 09 73 5d 60 40 00     00:07:16.338  READ FPDMA QUEUED
  60 00 18 00 d0 00 00 09 73 4f 40 40 00     00:07:16.333  READ FPDMA QUEUED
  60 00 20 00 c8 00 00 09 73 4a 60 40 00     00:07:16.322  READ FPDMA QUEUED

Error 9 [8] occurred at disk power-on lifetime: 2278 hours (94 days + 22 hours)
  When the command that caused the error occurred, the device was active or idle.

  After command completion occurred, registers were:
  ER -- ST COUNT  LBA_48  LH LM LL DV DC
  -- -- -- == -- == == == -- -- -- -- --
  84 -- 41 00 18 00 00 09 72 6a 87 40 00  Error: ICRC, ABRT at LBA = 0x09726a87 = 158493319

  Commands leading to the command that caused the error were:
  CR FEATR COUNT  LBA_48  LH LM LL DV DC  Powered_Up_Time  Command/Feature_Name
  -- == -- == -- == == == -- -- -- -- --  ---------------  --------------------
  60 00 a8 00 18 00 00 09 72 69 e0 40 00     00:07:15.593  READ FPDMA QUEUED
  60 00 20 00 10 00 00 09 72 66 c0 40 00     00:07:15.592  READ FPDMA QUEUED
  60 01 20 00 08 00 00 09 72 64 c0 40 00     00:07:15.590  READ FPDMA QUEUED
  60 01 e0 00 00 00 00 09 72 62 e0 40 00     00:07:15.586  READ FPDMA QUEUED
  60 00 e0 00 f8 00 00 09 72 61 e0 40 00     00:07:15.584  READ FPDMA QUEUED

Error 8 [7] occurred at disk power-on lifetime: 2278 hours (94 days + 22 hours)
  When the command that caused the error occurred, the device was active or idle.

  After command completion occurred, registers were:
  ER -- ST COUNT  LBA_48  LH LM LL DV DC
  -- -- -- == -- == == == -- -- -- -- --
  84 -- 41 00 00 00 00 00 07 7a 83 40 00  Error: ICRC, ABRT at LBA = 0x00077a83 = 490115

  Commands leading to the command that caused the error were:
  CR FEATR COUNT  LBA_48  LH LM LL DV DC  Powered_Up_Time  Command/Feature_Name
  -- == -- == -- == == == -- -- -- -- --  ---------------  --------------------
  60 00 40 00 78 00 00 00 33 74 2a 40 00     00:01:10.478  READ FPDMA QUEUED
  60 00 3b 00 70 00 00 00 17 61 f8 40 00     00:01:10.472  READ FPDMA QUEUED
  60 00 3e 00 68 00 00 00 19 9e 18 40 00     00:01:10.467  READ FPDMA QUEUED
  60 00 18 00 60 00 00 09 6f 3c a8 40 00     00:01:10.455  READ FPDMA QUEUED
  60 00 40 00 58 00 00 00 19 8f d0 40 00     00:01:10.444  READ FPDMA QUEUED

Error 7 [6] occurred at disk power-on lifetime: 2247 hours (93 days + 15 hours)
  When the command that caused the error occurred, the device was active or idle.

  After command completion occurred, registers were:
  ER -- ST COUNT  LBA_48  LH LM LL DV DC
  -- -- -- == -- == == == -- -- -- -- --
  84 -- 41 00 f8 00 00 00 09 71 58 40 00  Error: ICRC, ABRT at LBA = 0x00097158 = 618840

  Commands leading to the command that caused the error were:
  CR FEATR COUNT  LBA_48  LH LM LL DV DC  Powered_Up_Time  Command/Feature_Name
  -- == -- == -- == == == -- -- -- -- --  ---------------  --------------------
  60 00 10 00 18 00 00 00 09 74 80 40 00     00:07:59.697  READ FPDMA QUEUED
  60 00 08 00 10 00 00 00 09 72 f8 40 00     00:07:59.697  READ FPDMA QUEUED
  60 00 18 00 08 00 00 00 09 72 99 40 00     00:07:59.697  READ FPDMA QUEUED
  60 00 10 00 00 00 00 00 09 71 59 40 00     00:07:59.697  READ FPDMA QUEUED
  60 02 5f 00 f8 00 00 00 09 6e fa 40 00     00:07:59.697  READ FPDMA QUEUED

Error 6 [5] occurred at disk power-on lifetime: 2247 hours (93 days + 15 hours)
  When the command that caused the error occurred, the device was active or idle.

  After command completion occurred, registers were:
  ER -- ST COUNT  LBA_48  LH LM LL DV DC
  -- -- -- == -- == == == -- -- -- -- --
  84 -- 51 00 0f 00 00 00 4f 97 52 e0 00  Error: ICRC, ABRT 15 sectors at LBA = 0x004f9752 = 5216082

  Commands leading to the command that caused the error were:
  CR FEATR COUNT  LBA_48  LH LM LL DV DC  Powered_Up_Time  Command/Feature_Name
  -- == -- == -- == == == -- -- -- -- --  ---------------  --------------------
  25 00 00 00 7f 00 00 00 4f 96 e2 e0 00     00:00:08.072  READ DMA EXT
  25 00 00 00 7f 00 00 00 4f 96 63 e0 00     00:00:08.072  READ DMA EXT
  25 00 00 00 7f 00 00 00 4f 95 e4 e0 00     00:00:08.071  READ DMA EXT
  25 00 00 00 7f 00 00 00 4f 95 65 e0 00     00:00:08.070  READ DMA EXT
  25 00 00 00 7f 00 00 00 4f 94 e6 e0 00     00:00:08.070  READ DMA EXT

Error 5 [4] occurred at disk power-on lifetime: 2174 hours (90 days + 14 hours)
  When the command that caused the error occurred, the device was active or idle.

  After command completion occurred, registers were:
  ER -- ST COUNT  LBA_48  LH LM LL DV DC
  -- -- -- == -- == == == -- -- -- -- --
  84 -- 41 00 c8 00 00 1d 89 a8 37 40 00  Error: ICRC, ABRT at LBA = 0x1d89a837 = 495560759

  Commands leading to the command that caused the error were:
  CR FEATR COUNT  LBA_48  LH LM LL DV DC  Powered_Up_Time  Command/Feature_Name
  -- == -- == -- == == == -- -- -- -- --  ---------------  --------------------
  60 00 40 00 c8 00 00 1d 89 a7 f8 40 00     00:01:35.663  READ FPDMA QUEUED
  60 00 48 00 c0 00 00 1d 89 a7 b0 40 00     00:01:35.650  READ FPDMA QUEUED
  60 00 80 00 b8 00 00 1d 89 a7 30 40 00     00:01:35.641  READ FPDMA QUEUED
  60 00 10 00 b0 00 00 1d 75 7e 78 40 00     00:01:35.635  READ FPDMA QUEUED
  60 00 40 00 a8 00 00 1d 55 b4 18 40 00     00:01:35.635  READ FPDMA QUEUED

Error 4 [3] occurred at disk power-on lifetime: 1414 hours (58 days + 22 hours)
  When the command that caused the error occurred, the device was active or idle.

  After command completion occurred, registers were:
  ER -- ST COUNT  LBA_48  LH LM LL DV DC
  -- -- -- == -- == == == -- -- -- -- --
  84 -- 41 00 d0 00 00 04 48 09 df 40 00  Error: ICRC, ABRT at LBA = 0x044809df = 71829983

  Commands leading to the command that caused the error were:
  CR FEATR COUNT  LBA_48  LH LM LL DV DC  Powered_Up_Time  Command/Feature_Name
  -- == -- == -- == == == -- -- -- -- --  ---------------  --------------------
  60 00 80 00 d0 00 00 04 48 09 60 40 00     00:00:41.954  READ FPDMA QUEUED
  60 00 40 00 c8 00 00 0d ea c5 58 40 00     00:00:41.948  READ FPDMA QUEUED
  60 00 40 00 c0 00 00 00 1d 32 08 40 00     00:00:41.948  READ FPDMA QUEUED
  60 01 00 00 b8 00 00 00 16 b9 40 40 00     00:00:41.945  READ FPDMA QUEUED
  60 01 00 00 b0 00 00 00 16 b8 40 40 00     00:00:41.944  READ FPDMA QUEUED

SMART Extended Self-test Log Version: 1 (1 sectors)
No self-tests have been logged.  [To run self-tests, use: smartctl -t]

SMART Selective self-test log data structure revision number 1
 SPAN  MIN_LBA  MAX_LBA  CURRENT_TEST_STATUS
    1        0        0  Not_testing
    2        0        0  Not_testing
    3        0        0  Not_testing
    4        0        0  Not_testing
    5        0        0  Not_testing
Selective self-test flags (0x0):
  After scanning selected spans, do NOT read-scan remainder of disk.
If Selective self-test is pending on power-up, resume after 0 minute delay.

SCT Status Version:                  2
SCT Version (vendor specific):       1 (0x0001)
Device State:                        Active (0)
Current Temperature:                    41 Celsius
Power Cycle Min/Max Temperature:     38/42 Celsius
Lifetime    Min/Max Temperature:     15/58 Celsius
Under/Over Temperature Limit Count:   0/60

SCT Temperature History Version:     2
Temperature Sampling Period:         1 minute
Temperature Logging Interval:        1 minute
Min/Max recommended Temperature:      5/55 Celsius
Min/Max Temperature Limit:            5/55 Celsius
Temperature History Size (Index):    478 (313)

SCT Error Recovery Control:
           Read: Disabled
          Write: Disabled

Device Statistics (GP Log 0x04)
Page  Offset Size        Value Flags Description
0x01  =====  =               =  ===  == General Statistics (rev 2) ==
0x01  0x008  4            2458  ---  Lifetime Power-On Resets
0x01  0x010  4            3691  ---  Power-on Hours
0x01  0x018  6     11349582637  ---  Logical Sectors Written
0x01  0x020  6       187819827  ---  Number of Write Commands
0x01  0x028  6     14943033040  ---  Logical Sectors Read
0x01  0x030  6       195032984  ---  Number of Read Commands
0x02  =====  =               =  ===  == Free-Fall Statistics (rev 1) ==
0x02  0x010  4             128  ---  Overlimit Shock Events
0x03  =====  =               =  ===  == Rotating Media Statistics (rev 1) ==
0x03  0x008  4            3584  ---  Spindle Motor Power-on Hours
0x03  0x010  4            2911  ---  Head Flying Hours
0x03  0x018  4           17675  ---  Head Load Events
0x03  0x020  4               0  ---  Number of Reallocated Logical Sectors
0x03  0x028  4               0  ---  Read Recovery Attempts
0x03  0x030  4               0  ---  Number of Mechanical Start Failures
0x04  =====  =               =  ===  == General Errors Statistics (rev 1) ==
0x04  0x008  4               0  ---  Number of Reported Uncorrectable Errors
0x04  0x010  4              22  ---  Resets Between Cmd Acceptance and Completion
0x05  =====  =               =  ===  == Temperature Statistics (rev 1) ==
0x05  0x008  1              42  ---  Current Temperature
0x05  0x010  1              28  N--  Average Short Term Temperature
0x05  0x018  1              37  N--  Average Long Term Temperature
0x05  0x020  1              58  ---  Highest Temperature
0x05  0x028  1              15  ---  Lowest Temperature
0x05  0x030  1              46  N--  Highest Average Short Term Temperature
0x05  0x038  1              28  N--  Lowest Average Short Term Temperature
0x05  0x040  1              40  N--  Highest Average Long Term Temperature
0x05  0x048  1              37  N--  Lowest Average Long Term Temperature
0x05  0x050  4              98  ---  Time in Over-Temperature
0x05  0x058  1              55  ---  Specified Maximum Operating Temperature
0x05  0x060  4               0  ---  Time in Under-Temperature
0x05  0x068  1               5  ---  Specified Minimum Operating Temperature
0x06  =====  =               =  ===  == Transport Statistics (rev 1) ==
0x06  0x008  4            8057  ---  Number of Hardware Resets
0x06  0x018  4               8  ---  Number of Interface CRC Errors
0x07  =====  =               =  ===  == Solid State Device Statistics (rev 1) ==
0x07  0x008  1               6  N--  Percentage Used Endurance Indicator
                                |||_ C monitored condition met
                                ||__ D supports DSN
                                |___ N normalized value

Pending Defects log (GP Log 0x0c) not supported

SATA Phy Event Counters (GP Log 0x11)
ID      Size     Value  Description
0x0001  4            0  Command failed due to ICRC error
0x0002  4            0  R_ERR response for data FIS
0x0003  4            0  R_ERR response for device-to-host data FIS
0x0004  4            0  R_ERR response for host-to-device data FIS
0x0005  4            0  R_ERR response for non-data FIS
0x0006  4            0  R_ERR response for device-to-host non-data FIS
0x0007  4            0  R_ERR response for host-to-device non-data FIS
0x0008  4            0  Device-to-host non-data FIS retries
0x0009  4            2  Transition from drive PhyRdy to drive PhyNRdy
0x000a  4            2  Device-to-host register FISes sent due to a COMRESET
0x000b  4            0  CRC errors within host-to-device FIS
0x000d  4            0  Non-CRC errors within host-to-device FIS
0x000f  4            0  R_ERR response for host-to-device data FIS, CRC
0x0010  4            0  R_ERR response for host-to-device data FIS, non-CRC
0x0012  4            0  R_ERR response for host-to-device non-data FIS, CRC
0x0013  4            0  R_ERR response for host-to-device non-data FIS, non-CRC

