=== START OF INFORMATION SECTION ===
Model Family:     Toshiba 2.5" HDD MQ01ABD...
Device Model:     TOSHIBA MQ01ABD050
Serial Number:    --
LU WWN Device Id: 5 000039 ...
Firmware Version: AX001A
User Capacity:    500 107 862 016 bytes [500 GB]
Sector Sizes:     512 bytes logical, 4096 bytes physical
Rotation Rate:    5400 rpm
Form Factor:      2.5 inches
Device is:        In smartctl database [for details use: -P show]
ATA Version is:   ATA8-ACS (minor revision not indicated)
SATA Version is:  SATA 2.6, 3.0 Gb/s (current: 3.0 Gb/s)
Local Time is:    Wed Apr 12 05:27:06 2017 MSK
SMART support is: Available - device has SMART capability.
SMART support is: Enabled
AAM feature is:   Unavailable
APM level is:     128 (minimum power consumption without standby)
Rd look-ahead is: Enabled
Write cache is:   Enabled
ATA Security is:  Disabled, NOT FROZEN [SEC1]
Wt Cache Reorder: Enabled

=== START OF READ SMART DATA SECTION ===
SMART overall-health self-assessment test result: PASSED

General SMART Values:
Offline data collection status:  (0x82)	Offline data collection activity
					was completed without error.
					Auto Offline Data Collection: Enabled.
Self-test execution status:      (  25)	The self-test routine was aborted by
					the host.
Total time to complete Offline 
data collection: 		(  120) seconds.
Offline data collection
capabilities: 			 (0x5b) SMART execute Offline immediate.
					Auto Offline data collection on/off support.
					Suspend Offline collection upon new
					command.
					Offline surface scan supported.
					Self-test supported.
					No Conveyance Self-test supported.
					Selective Self-test supported.
SMART capabilities:            (0x0003)	Saves SMART data before entering
					power-saving mode.
					Supports SMART auto save timer.
Error logging capability:        (0x01)	Error logging supported.
					General Purpose Logging supported.
Short self-test routine 
recommended polling time: 	 (   2) minutes.
Extended self-test routine
recommended polling time: 	 ( 131) minutes.
SCT capabilities: 	       (0x003d)	SCT Status supported.
					SCT Error Recovery Control supported.
					SCT Feature Control supported.
					SCT Data Table supported.

SMART Attributes Data Structure revision number: 16
Vendor Specific SMART Attributes with Thresholds:
ID# ATTRIBUTE_NAME          FLAGS    VALUE WORST THRESH FAIL RAW_VALUE
  1 Raw_Read_Error_Rate     PO-R--   100   100   050    -    0
  2 Throughput_Performance  P-S---   100   100   050    -    0
  3 Spin_Up_Time            POS--K   100   100   001    -    1033
  4 Start_Stop_Count        -O--CK   100   100   000    -    6156
  5 Reallocated_Sector_Ct   PO--CK   100   100   050    -    0
  7 Seek_Error_Rate         PO-R--   100   100   050    -    0
  8 Seek_Time_Performance   P-S---   100   100   050    -    0
  9 Power_On_Hours          -O--CK   064   064   000    -    14671
 10 Spin_Retry_Count        PO--CK   222   100   030    -    0
 12 Power_Cycle_Count       -O--CK   100   100   000    -    2250
191 G-Sense_Error_Rate      -O--CK   100   100   000    -    84
192 Power-Off_Retract_Count -O--CK   100   100   000    -    87
193 Load_Cycle_Count        -O--CK   096   096   000    -    44229
194 Temperature_Celsius     -O---K   100   100   000    -    42 (Min/Max 19/53)
196 Reallocated_Event_Count -O--CK   100   100   000    -    0
197 Current_Pending_Sector  -O--CK   100   100   000    -    0
198 Offline_Uncorrectable   ----CK   100   100   000    -    0
199 UDMA_CRC_Error_Count    -O--CK   200   200   000    -    0
220 Disk_Shift              -O----   100   100   000    -    0
222 Loaded_Hours            -O--CK   093   093   000    -    2877
223 Load_Retry_Count        -O--CK   100   100   000    -    0
224 Load_Friction           -O---K   100   100   000    -    0
226 Load-in_Time            -OS--K   100   100   000    -    259
240 Head_Flying_Hours       P-----   100   100   001    -    0
                            ||||||_ K auto-keep
                            |||||__ C event count
                            ||||___ R error rate
                            |||____ S speed/performance
                            ||_____ O updated online
                            |______ P prefailure warning

General Purpose Log Directory Version 1
SMART           Log Directory Version 1 [multi-sector log support]
Address    Access  R/W   Size  Description
0x00       GPL,SL  R/O      1  Log Directory
0x01           SL  R/O      1  Summary SMART error log
0x02           SL  R/O     51  Comprehensive SMART error log
0x03       GPL     R/O     64  Ext. Comprehensive SMART error log
0x04       GPL,SL  R/O      8  Device Statistics log
0x06           SL  R/O      1  SMART self-test log
0x07       GPL     R/O      1  Extended self-test log
0x09           SL  R/W      1  Selective self-test log
0x10       GPL     R/O      1  NCQ Command Error log
0x11       GPL     R/O      1  SATA Phy Event Counters
0x80-0x9f  GPL,SL  R/W     16  Host vendor specific log
0xe0       GPL,SL  R/W      1  SCT Command/Status
0xe1       GPL,SL  R/W      1  SCT Data Transfer

SMART Extended Comprehensive Error Log Version: 1 (64 sectors)
Device Error Count: 573 (device log contains only the most recent 256 errors)
	CR     = Command Register
	FEATR  = Features Register
	COUNT  = Count (was: Sector Count) Register
	LBA_48 = Upper bytes of LBA High/Mid/Low Registers ]  ATA-8
	LH     = LBA High (was: Cylinder High) Register    ]   LBA
	LM     = LBA Mid (was: Cylinder Low) Register      ] Register
	LL     = LBA Low (was: Sector Number) Register     ]
	DV     = Device (was: Device/Head) Register
	DC     = Device Control Register
	ER     = Error register
	ST     = Status register
Powered_Up_Time is measured from power on, and printed as
DDd+hh:mm:SS.sss where DD=days, hh=hours, mm=minutes,
SS=sec, and sss=millisec. It "wraps" after 49.710 days.

Error 573 [60] occurred at disk power-on lifetime: 6845 hours (285 days + 5 hours)
  When the command that caused the error occurred, the device was active or idle.

  After command completion occurred, registers were:
  ER -- ST COUNT  LBA_48  LH LM LL DV DC
  -- -- -- == -- == == == -- -- -- -- --
  40 -- 41 00 68 00 00 00 0c 28 e0 40 00  Error: UNC at LBA = 0x000c28e0 = 796896

  Commands leading to the command that caused the error were:
  CR FEATR COUNT  LBA_48  LH LM LL DV DC  Powered_Up_Time  Command/Feature_Name
  -- == -- == -- == == == -- -- -- -- --  ---------------  --------------------
  60 01 00 00 68 00 00 00 0c 28 00 40 00  5d+02:13:51.555  READ FPDMA QUEUED
  60 01 00 00 60 00 00 00 0c 27 00 40 00  5d+02:13:51.554  READ FPDMA QUEUED
  60 01 00 00 58 00 00 00 0c 26 00 40 00  5d+02:13:51.553  READ FPDMA QUEUED
  60 01 00 00 50 00 00 00 0c 25 00 40 00  5d+02:13:51.552  READ FPDMA QUEUED
  60 01 00 00 48 00 00 00 0c 24 00 40 00  5d+02:13:51.550  READ FPDMA QUEUED

Error 572 [59] occurred at disk power-on lifetime: 6845 hours (285 days + 5 hours)
  When the command that caused the error occurred, the device was active or idle.

  After command completion occurred, registers were:
  ER -- ST COUNT  LBA_48  LH LM LL DV DC
  -- -- -- == -- == == == -- -- -- -- --
  40 -- 41 00 08 00 00 00 0c 28 e0 40 00  Error: UNC at LBA = 0x000c28e0 = 796896

  Commands leading to the command that caused the error were:
  CR FEATR COUNT  LBA_48  LH LM LL DV DC  Powered_Up_Time  Command/Feature_Name
  -- == -- == -- == == == -- -- -- -- --  ---------------  --------------------
  60 01 00 00 08 00 00 00 0c 28 00 40 00  5d+01:53:57.186  READ FPDMA QUEUED
  60 01 00 00 f8 00 00 00 0c 27 00 40 00  5d+01:53:57.185  READ FPDMA QUEUED
  60 01 00 00 f0 00 00 00 0c 26 00 40 00  5d+01:53:57.184  READ FPDMA QUEUED
  60 01 00 00 e8 00 00 00 0c 25 00 40 00  5d+01:53:57.183  READ FPDMA QUEUED
  60 01 00 00 e0 00 00 00 0c 24 00 40 00  5d+01:53:57.182  READ FPDMA QUEUED

Error 571 [58] occurred at disk power-on lifetime: 6844 hours (285 days + 4 hours)
  When the command that caused the error occurred, the device was active or idle.

  After command completion occurred, registers were:
  ER -- ST COUNT  LBA_48  LH LM LL DV DC
  -- -- -- == -- == == == -- -- -- -- --
  40 -- 41 00 20 00 00 00 0c 28 e0 40 00  Error: UNC at LBA = 0x000c28e0 = 796896

  Commands leading to the command that caused the error were:
  CR FEATR COUNT  LBA_48  LH LM LL DV DC  Powered_Up_Time  Command/Feature_Name
  -- == -- == -- == == == -- -- -- -- --  ---------------  --------------------
  60 01 00 00 20 00 00 00 0c 28 00 40 00  5d+01:26:59.080  READ FPDMA QUEUED
  60 01 00 00 18 00 00 00 0c 27 00 40 00  5d+01:26:59.079  READ FPDMA QUEUED
  60 01 00 00 10 00 00 00 0c 26 00 40 00  5d+01:26:59.077  READ FPDMA QUEUED
  60 01 00 00 08 00 00 00 0c 25 00 40 00  5d+01:26:59.075  READ FPDMA QUEUED
  60 01 00 00 f8 00 00 00 0c 24 00 40 00  5d+01:26:59.074  READ FPDMA QUEUED

Error 570 [57] occurred at disk power-on lifetime: 6844 hours (285 days + 4 hours)
  When the command that caused the error occurred, the device was active or idle.

  After command completion occurred, registers were:
  ER -- ST COUNT  LBA_48  LH LM LL DV DC
  -- -- -- == -- == == == -- -- -- -- --
  40 -- 41 00 70 00 00 00 0c 28 e7 40 00  Error: UNC at LBA = 0x000c28e7 = 796903

  Commands leading to the command that caused the error were:
  CR FEATR COUNT  LBA_48  LH LM LL DV DC  Powered_Up_Time  Command/Feature_Name
  -- == -- == -- == == == -- -- -- -- --  ---------------  --------------------
  60 00 01 00 70 00 00 00 0c 28 e7 40 00  5d+01:26:40.761  READ FPDMA QUEUED
  2f 00 00 00 01 00 00 00 00 00 10 e0 00  5d+01:26:40.753  READ LOG EXT
  60 01 00 00 60 00 00 00 0c 28 e7 40 00  5d+01:26:37.395  READ FPDMA QUEUED
  2f 00 00 00 01 00 00 00 00 00 10 e0 00  5d+01:26:37.386  READ LOG EXT
  60 00 01 00 50 00 00 00 0c 28 e6 40 00  5d+01:26:34.028  READ FPDMA QUEUED

Error 569 [56] occurred at disk power-on lifetime: 6844 hours (285 days + 4 hours)
  When the command that caused the error occurred, the device was active or idle.

  After command completion occurred, registers were:
  ER -- ST COUNT  LBA_48  LH LM LL DV DC
  -- -- -- == -- == == == -- -- -- -- --
  40 -- 41 00 60 00 00 00 0c 28 e7 40 00  Error: UNC at LBA = 0x000c28e7 = 796903

  Commands leading to the command that caused the error were:
  CR FEATR COUNT  LBA_48  LH LM LL DV DC  Powered_Up_Time  Command/Feature_Name
  -- == -- == -- == == == -- -- -- -- --  ---------------  --------------------
  60 01 00 00 60 00 00 00 0c 28 e7 40 00  5d+01:26:37.395  READ FPDMA QUEUED
  2f 00 00 00 01 00 00 00 00 00 10 e0 00  5d+01:26:37.386  READ LOG EXT
  60 00 01 00 50 00 00 00 0c 28 e6 40 00  5d+01:26:34.028  READ FPDMA QUEUED
  2f 00 00 00 01 00 00 00 00 00 10 e0 00  5d+01:26:34.019  READ LOG EXT
  60 01 00 00 40 00 00 00 0c 28 e6 40 00  5d+01:26:30.673  READ FPDMA QUEUED

Error 568 [55] occurred at disk power-on lifetime: 6844 hours (285 days + 4 hours)
  When the command that caused the error occurred, the device was active or idle.

  After command completion occurred, registers were:
  ER -- ST COUNT  LBA_48  LH LM LL DV DC
  -- -- -- == -- == == == -- -- -- -- --
  40 -- 41 00 50 00 00 00 0c 28 e6 40 00  Error: UNC at LBA = 0x000c28e6 = 796902

  Commands leading to the command that caused the error were:
  CR FEATR COUNT  LBA_48  LH LM LL DV DC  Powered_Up_Time  Command/Feature_Name
  -- == -- == -- == == == -- -- -- -- --  ---------------  --------------------
  60 00 01 00 50 00 00 00 0c 28 e6 40 00  5d+01:26:34.028  READ FPDMA QUEUED
  2f 00 00 00 01 00 00 00 00 00 10 e0 00  5d+01:26:34.019  READ LOG EXT
  60 01 00 00 40 00 00 00 0c 28 e6 40 00  5d+01:26:30.673  READ FPDMA QUEUED
  2f 00 00 00 01 00 00 00 00 00 10 e0 00  5d+01:26:30.663  READ LOG EXT
  60 00 01 00 30 00 00 00 0c 28 e5 40 00  5d+01:26:27.304  READ FPDMA QUEUED

Error 567 [54] occurred at disk power-on lifetime: 6844 hours (285 days + 4 hours)
  When the command that caused the error occurred, the device was active or idle.

  After command completion occurred, registers were:
  ER -- ST COUNT  LBA_48  LH LM LL DV DC
  -- -- -- == -- == == == -- -- -- -- --
  40 -- 41 00 40 00 00 00 0c 28 e6 40 00  Error: UNC at LBA = 0x000c28e6 = 796902

  Commands leading to the command that caused the error were:
  CR FEATR COUNT  LBA_48  LH LM LL DV DC  Powered_Up_Time  Command/Feature_Name
  -- == -- == -- == == == -- -- -- -- --  ---------------  --------------------
  60 01 00 00 40 00 00 00 0c 28 e6 40 00  5d+01:26:30.673  READ FPDMA QUEUED
  2f 00 00 00 01 00 00 00 00 00 10 e0 00  5d+01:26:30.663  READ LOG EXT
  60 00 01 00 30 00 00 00 0c 28 e5 40 00  5d+01:26:27.304  READ FPDMA QUEUED
  2f 00 00 00 01 00 00 00 00 00 10 e0 00  5d+01:26:27.296  READ LOG EXT
  60 01 00 00 20 00 00 00 0c 28 e5 40 00  5d+01:26:23.938  READ FPDMA QUEUED

Error 566 [53] occurred at disk power-on lifetime: 6844 hours (285 days + 4 hours)
  When the command that caused the error occurred, the device was active or idle.

  After command completion occurred, registers were:
  ER -- ST COUNT  LBA_48  LH LM LL DV DC
  -- -- -- == -- == == == -- -- -- -- --
  40 -- 41 00 30 00 00 00 0c 28 e5 40 00  Error: UNC at LBA = 0x000c28e5 = 796901

  Commands leading to the command that caused the error were:
  CR FEATR COUNT  LBA_48  LH LM LL DV DC  Powered_Up_Time  Command/Feature_Name
  -- == -- == -- == == == -- -- -- -- --  ---------------  --------------------
  60 00 01 00 30 00 00 00 0c 28 e5 40 00  5d+01:26:27.304  READ FPDMA QUEUED
  2f 00 00 00 01 00 00 00 00 00 10 e0 00  5d+01:26:27.296  READ LOG EXT
  60 01 00 00 20 00 00 00 0c 28 e5 40 00  5d+01:26:23.938  READ FPDMA QUEUED
  2f 00 00 00 01 00 00 00 00 00 10 e0 00  5d+01:26:23.929  READ LOG EXT
  60 00 01 00 10 00 00 00 0c 28 e4 40 00  5d+01:26:20.570  READ FPDMA QUEUED

SMART Extended Self-test Log Version: 1 (1 sectors)
Num  Test_Description    Status                  Remaining  LifeTime(hours)  LBA_of_first_error
# 1  Short offline       Aborted by host               90%      6723         -
# 2  Short offline       Completed: read failure       00%      6719         796896

SMART Selective self-test log data structure revision number 1
 SPAN  MIN_LBA  MAX_LBA  CURRENT_TEST_STATUS
    1        0        0  Not_testing
    2        0        0  Not_testing
    3        0        0  Not_testing
    4        0        0  Not_testing
    5        0        0  Not_testing
Selective self-test flags (0x0):
  After scanning selected spans, do NOT read-scan remainder of disk.
If Selective self-test is pending on power-up, resume after 0 minute delay.

SCT Status Version:                  2
SCT Version (vendor specific):       1 (0x0001)
SCT Support Level:                   1
Device State:                        Active (0)
Current Temperature:                    42 Celsius
Power Cycle Min/Max Temperature:     42/42 Celsius
Lifetime    Min/Max Temperature:     19/53 Celsius
Under/Over Temperature Limit Count:   0/0

SCT Temperature History Version:     2
Temperature Sampling Period:         1 minute
Temperature Logging Interval:        1 minute
Min/Max recommended Temperature:      5/55 Celsius
Min/Max Temperature Limit:            5/55 Celsius
Temperature History Size (Index):    478 (290)

SCT Error Recovery Control:
           Read: Disabled
          Write: Disabled

Device Statistics (GP Log 0x04)
Page Offset Size         Value  Description
  1  =====  =                =  == General Statistics (rev 2) ==
  1  0x008  4             2250  Lifetime Power-On Resets
  1  0x010  4            14671  Power-on Hours
  1  0x018  6      15921914135  Logical Sectors Written
  1  0x020  6        387209113  Number of Write Commands
  1  0x028  6      20216282549  Logical Sectors Read
  1  0x030  6        330779392  Number of Read Commands
  2  =====  =                =  == Free-Fall Statistics (rev 1) ==
  2  0x010  4               84  Overlimit Shock Events
  3  =====  =                =  == Rotating Media Statistics (rev 1) ==
  3  0x008  4             5518  Spindle Motor Power-on Hours
  3  0x010  4             2877  Head Flying Hours
  3  0x018  4            44229  Head Load Events
  3  0x020  4               24  Number of Reallocated Logical Sectors
  3  0x028  4              372  Read Recovery Attempts
  3  0x030  4                0  Number of Mechanical Start Failures
  4  =====  =                =  == General Errors Statistics (rev 1) ==
  4  0x008  4              573  Number of Reported Uncorrectable Errors
  4  0x010  4              508  Resets Between Cmd Acceptance and Completion
  5  =====  =                =  == Temperature Statistics (rev 1) ==
  5  0x008  1               42  Current Temperature
  5  0x010  1               40~ Average Short Term Temperature
  5  0x018  1               42~ Average Long Term Temperature
  5  0x020  1               53  Highest Temperature
  5  0x028  1               19  Lowest Temperature
  5  0x030  1               47~ Highest Average Short Term Temperature
  5  0x038  1               26~ Lowest Average Short Term Temperature
  5  0x040  1               42~ Highest Average Long Term Temperature
  5  0x048  1               29~ Lowest Average Long Term Temperature
  5  0x050  4                0  Time in Over-Temperature
  5  0x058  1               55  Specified Maximum Operating Temperature
  5  0x060  4                0  Time in Under-Temperature
  5  0x068  1                5  Specified Minimum Operating Temperature
  6  =====  =                =  == Transport Statistics (rev 1) ==
  6  0x008  4            18562  Number of Hardware Resets
  6  0x018  4                0  Number of Interface CRC Errors
  7  =====  =                =  == Solid State Device Statistics (rev 1) ==
  7  0x008  1               24~ Percentage Used Endurance Indicator
                              |_ ~ normalized value

SATA Phy Event Counters (GP Log 0x11)
ID      Size     Value  Description
0x0001  4            0  Command failed due to ICRC error
0x0002  4            0  R_ERR response for data FIS
0x0003  4            0  R_ERR response for device-to-host data FIS
0x0004  4            0  R_ERR response for host-to-device data FIS
0x0005  4            0  R_ERR response for non-data FIS
0x0006  4            0  R_ERR response for device-to-host non-data FIS
0x0007  4            0  R_ERR response for host-to-device non-data FIS
0x0008  4            0  Device-to-host non-data FIS retries
0x0009  4            3  Transition from drive PhyRdy to drive PhyNRdy
0x000a  4            2  Device-to-host register FISes sent due to a COMRESET
0x000b  4            0  CRC errors within host-to-device FIS
0x000d  4            0  Non-CRC errors within host-to-device FIS
0x000f  4            0  R_ERR response for host-to-device data FIS, CRC
0x0010  4            0  R_ERR response for host-to-device data FIS, non-CRC
0x0012  4            0  R_ERR response for host-to-device non-data FIS, CRC
0x0013  4            0  R_ERR response for host-to-device non-data FIS, non-CRC



