=== START OF INFORMATION SECTION ===
Model Family:     Toshiba 2.5" HDD MQ01ABD...
Device Model:     TOSHIBA MQ01ABD050
Serial Number:    --
LU WWN Device Id: 5 000039 ...
Firmware Version: AX002J
User Capacity:    500 107 862 016 bytes [500 GB]
Sector Sizes:     512 bytes logical, 4096 bytes physical
Rotation Rate:    5400 rpm
Form Factor:      2.5 inches
Device is:        In smartctl database [for details use: -P show]
ATA Version is:   ATA8-ACS (minor revision not indicated)
SATA Version is:  SATA 3.0, 6.0 Gb/s (current: 6.0 Gb/s)
Local Time is:    Thu Oct 18 14:42:19 2018 +08
SMART support is: Available - device has SMART capability.
SMART support is: Enabled
AAM feature is:   Unavailable
APM level is:     128 (minimum power consumption without standby)
Rd look-ahead is: Enabled
Write cache is:   Enabled
ATA Security is:  Disabled, frozen [SEC2]
Wt Cache Reorder: Enabled

=== START OF READ SMART DATA SECTION ===
SMART overall-health self-assessment test result: PASSED

General SMART Values:
Offline data collection status:  (0x82)	Offline data collection activity
					was completed without error.
					Auto Offline Data Collection: Enabled.
Self-test execution status:      (   0)	The previous self-test routine completed
					without error or no self-test has ever 
					been run.
Total time to complete Offline 
data collection: 		(  120) seconds.
Offline data collection
capabilities: 			 (0x5b) SMART execute Offline immediate.
					Auto Offline data collection on/off support.
					Suspend Offline collection upon new
					command.
					Offline surface scan supported.
					Self-test supported.
					No Conveyance Self-test supported.
					Selective Self-test supported.
SMART capabilities:            (0x0003)	Saves SMART data before entering
					power-saving mode.
					Supports SMART auto save timer.
Error logging capability:        (0x01)	Error logging supported.
					General Purpose Logging supported.
Short self-test routine 
recommended polling time: 	 (   2) minutes.
Extended self-test routine
recommended polling time: 	 ( 121) minutes.
SCT capabilities: 	       (0x003d)	SCT Status supported.
					SCT Error Recovery Control supported.
					SCT Feature Control supported.
					SCT Data Table supported.

SMART Attributes Data Structure revision number: 16
Vendor Specific SMART Attributes with Thresholds:
ID# ATTRIBUTE_NAME          FLAGS    VALUE WORST THRESH FAIL RAW_VALUE
  1 Raw_Read_Error_Rate     PO-R--   100   100   050    -    0
  2 Throughput_Performance  P-S---   100   100   050    -    0
  3 Spin_Up_Time            POS--K   100   100   001    -    1062
  4 Start_Stop_Count        -O--CK   100   100   000    -    1208
  5 Reallocated_Sector_Ct   PO--CK   100   100   050    -    0
  7 Seek_Error_Rate         PO-R--   100   100   050    -    0
  8 Seek_Time_Performance   P-S---   100   100   050    -    0
  9 Power_On_Hours          -O--CK   084   084   000    -    6768
 10 Spin_Retry_Count        PO--CK   124   100   030    -    0
 12 Power_Cycle_Count       -O--CK   100   100   000    -    1112
191 G-Sense_Error_Rate      -O--CK   100   100   000    -    1280
192 Power-Off_Retract_Count -O--CK   100   100   000    -    40
193 Load_Cycle_Count        -O--CK   095   095   000    -    52723
194 Temperature_Celsius     -O---K   100   100   000    -    30 (Min/Max 17/48)
196 Reallocated_Event_Count -O--CK   100   100   000    -    0
197 Current_Pending_Sector  -O--CK   100   100   000    -    0
198 Offline_Uncorrectable   ----CK   100   100   000    -    0
199 UDMA_CRC_Error_Count    -O--CK   200   253   000    -    0
220 Disk_Shift              -O----   100   100   000    -    0
222 Loaded_Hours            -O--CK   085   085   000    -    6294
223 Load_Retry_Count        -O--CK   100   100   000    -    0
224 Load_Friction           -O---K   100   100   000    -    0
226 Load-in_Time            -OS--K   100   100   000    -    256
240 Head_Flying_Hours       P-----   100   100   001    -    0
                            ||||||_ K auto-keep
                            |||||__ C event count
                            ||||___ R error rate
                            |||____ S speed/performance
                            ||_____ O updated online
                            |______ P prefailure warning

General Purpose Log Directory Version 1
SMART           Log Directory Version 1 [multi-sector log support]
Address    Access  R/W   Size  Description
0x00       GPL,SL  R/O      1  Log Directory
0x01           SL  R/O      1  Summary SMART error log
0x02           SL  R/O     51  Comprehensive SMART error log
0x03       GPL     R/O     64  Ext. Comprehensive SMART error log
0x04       GPL,SL  R/O      8  Device Statistics log
0x06           SL  R/O      1  SMART self-test log
0x07       GPL     R/O      1  Extended self-test log
0x09           SL  R/W      1  Selective self-test log
0x10       GPL     R/O      1  SATA NCQ Queued Error log
0x11       GPL     R/O      1  SATA Phy Event Counters log
0x80-0x9f  GPL,SL  R/W     16  Host vendor specific log
0xe0       GPL,SL  R/W      1  SCT Command/Status
0xe1       GPL,SL  R/W      1  SCT Data Transfer

SMART Extended Comprehensive Error Log Version: 1 (64 sectors)
Device Error Count: 463 (device log contains only the most recent 256 errors)
	CR     = Command Register
	FEATR  = Features Register
	COUNT  = Count (was: Sector Count) Register
	LBA_48 = Upper bytes of LBA High/Mid/Low Registers ]  ATA-8
	LH     = LBA High (was: Cylinder High) Register    ]   LBA
	LM     = LBA Mid (was: Cylinder Low) Register      ] Register
	LL     = LBA Low (was: Sector Number) Register     ]
	DV     = Device (was: Device/Head) Register
	DC     = Device Control Register
	ER     = Error register
	ST     = Status register
Powered_Up_Time is measured from power on, and printed as
DDd+hh:mm:SS.sss where DD=days, hh=hours, mm=minutes,
SS=sec, and sss=millisec. It "wraps" after 49.710 days.

Error 463 [206] occurred at disk power-on lifetime: 6737 hours (280 days + 17 hours)
  When the command that caused the error occurred, the device was active or idle.

  After command completion occurred, registers were:
  ER -- ST COUNT  LBA_48  LH LM LL DV DC
  -- -- -- == -- == == == -- -- -- -- --
  40 -- 41 00 00 00 00 01 b8 c6 c1 40 00  Error: WP at LBA = 0x01b8c6c1 = 28886721

  Commands leading to the command that caused the error were:
  CR FEATR COUNT  LBA_48  LH LM LL DV DC  Powered_Up_Time  Command/Feature_Name
  -- == -- == -- == == == -- -- -- -- --  ---------------  --------------------
  61 00 08 00 28 00 00 00 85 59 68 40 00     00:57:08.719  WRITE FPDMA QUEUED
  61 00 40 00 28 00 00 00 87 36 a0 40 00     00:57:08.719  WRITE FPDMA QUEUED
  60 00 d8 00 20 00 00 16 b8 6f 28 40 00     00:57:08.109  READ FPDMA QUEUED
  60 01 00 00 18 00 00 16 b8 6e 28 40 00     00:57:08.109  READ FPDMA QUEUED
  60 01 00 00 10 00 00 16 b8 6d 28 40 00     00:57:08.109  READ FPDMA QUEUED

Error 462 [205] occurred at disk power-on lifetime: 6737 hours (280 days + 17 hours)
  When the command that caused the error occurred, the device was active or idle.

  After command completion occurred, registers were:
  ER -- ST COUNT  LBA_48  LH LM LL DV DC
  -- -- -- == -- == == == -- -- -- -- --
  40 -- 41 00 00 00 00 01 b8 c6 c0 40 00  Error: WP at LBA = 0x01b8c6c0 = 28886720

  Commands leading to the command that caused the error were:
  CR FEATR COUNT  LBA_48  LH LM LL DV DC  Powered_Up_Time  Command/Feature_Name
  -- == -- == -- == == == -- -- -- -- --  ---------------  --------------------
  61 00 08 00 08 00 00 00 85 59 e8 40 00     00:57:02.298  WRITE FPDMA QUEUED
  61 00 d8 00 08 00 00 00 87 35 c8 40 00     00:57:02.296  WRITE FPDMA QUEUED
  60 00 01 00 00 00 00 01 b8 c6 c0 40 00     00:57:02.296  READ FPDMA QUEUED
  61 00 08 00 38 00 00 09 19 78 50 40 00     00:57:02.296  WRITE FPDMA QUEUED
  60 00 08 00 30 00 00 16 79 11 20 40 00     00:57:02.296  READ FPDMA QUEUED

Error 461 [204] occurred at disk power-on lifetime: 6737 hours (280 days + 17 hours)
  When the command that caused the error occurred, the device was active or idle.

  After command completion occurred, registers were:
  ER -- ST COUNT  LBA_48  LH LM LL DV DC
  -- -- -- == -- == == == -- -- -- -- --
  40 -- 41 00 00 00 00 01 b8 c6 c0 40 00  Error: WP at LBA = 0x01b8c6c0 = 28886720

  Commands leading to the command that caused the error were:
  CR FEATR COUNT  LBA_48  LH LM LL DV DC  Powered_Up_Time  Command/Feature_Name
  -- == -- == -- == == == -- -- -- -- --  ---------------  --------------------
  61 00 08 00 08 00 00 01 04 36 f0 40 00     00:56:58.718  WRITE FPDMA QUEUED
  60 00 20 00 00 00 00 01 b8 c6 c0 40 00     00:56:58.395  READ FPDMA QUEUED
  61 00 08 00 00 00 00 01 9e 08 c8 40 00     00:56:58.394  WRITE FPDMA QUEUED
  60 00 08 00 00 00 00 01 b8 ca 80 40 00     00:56:58.382  READ FPDMA QUEUED
  61 00 08 00 00 00 00 01 9e 08 c0 40 00     00:56:58.381  WRITE FPDMA QUEUED

Error 460 [203] occurred at disk power-on lifetime: 6578 hours (274 days + 2 hours)
  When the command that caused the error occurred, the device was active or idle.

  After command completion occurred, registers were:
  ER -- ST COUNT  LBA_48  LH LM LL DV DC
  -- -- -- == -- == == == -- -- -- -- --
  40 -- 41 00 00 00 00 01 b8 c6 c7 40 00  Error: UNC at LBA = 0x01b8c6c7 = 28886727

  Commands leading to the command that caused the error were:
  CR FEATR COUNT  LBA_48  LH LM LL DV DC  Powered_Up_Time  Command/Feature_Name
  -- == -- == -- == == == -- -- -- -- --  ---------------  --------------------
  60 00 01 00 00 00 00 01 b8 c6 c7 40 00     21:38:35.162  READ FPDMA QUEUED
  60 00 08 00 00 00 00 16 e4 e3 80 40 00     21:38:35.154  READ FPDMA QUEUED
  60 00 40 00 00 00 00 16 af 8b c0 40 00     21:38:35.145  READ FPDMA QUEUED
  60 00 08 00 00 00 00 16 d4 b0 c0 40 00     21:38:35.135  READ FPDMA QUEUED
  60 00 08 00 00 00 00 16 8a 38 58 40 00     21:38:35.091  READ FPDMA QUEUED

Error 459 [202] occurred at disk power-on lifetime: 6578 hours (274 days + 2 hours)
  When the command that caused the error occurred, the device was active or idle.

  After command completion occurred, registers were:
  ER -- ST COUNT  LBA_48  LH LM LL DV DC
  -- -- -- == -- == == == -- -- -- -- --
  40 -- 41 00 00 00 00 01 b8 c6 c6 40 00  Error: UNC at LBA = 0x01b8c6c6 = 28886726

  Commands leading to the command that caused the error were:
  CR FEATR COUNT  LBA_48  LH LM LL DV DC  Powered_Up_Time  Command/Feature_Name
  -- == -- == -- == == == -- -- -- -- --  ---------------  --------------------
  60 00 01 00 00 00 00 01 b8 c6 c6 40 00     21:38:30.976  READ FPDMA QUEUED
  60 00 80 00 00 00 00 16 af 8c 00 40 00     21:38:30.967  READ FPDMA QUEUED
  61 00 08 00 00 00 00 01 b9 48 58 40 00     21:38:30.967  WRITE FPDMA QUEUED
  60 00 08 00 00 00 00 16 d4 b0 b0 40 00     21:38:30.959  READ FPDMA QUEUED
  60 00 08 00 00 00 00 16 d7 c2 20 40 00     21:38:30.947  READ FPDMA QUEUED

Error 458 [201] occurred at disk power-on lifetime: 6578 hours (274 days + 2 hours)
  When the command that caused the error occurred, the device was active or idle.

  After command completion occurred, registers were:
  ER -- ST COUNT  LBA_48  LH LM LL DV DC
  -- -- -- == -- == == == -- -- -- -- --
  40 -- 41 00 00 00 00 01 b8 c6 c5 40 00  Error: UNC at LBA = 0x01b8c6c5 = 28886725

  Commands leading to the command that caused the error were:
  CR FEATR COUNT  LBA_48  LH LM LL DV DC  Powered_Up_Time  Command/Feature_Name
  -- == -- == -- == == == -- -- -- -- --  ---------------  --------------------
  60 00 01 00 00 00 00 01 b8 c6 c5 40 00     21:38:26.836  READ FPDMA QUEUED
  60 01 00 00 00 00 00 02 ae 83 d8 40 00     21:38:26.835  READ FPDMA QUEUED
  60 01 00 00 00 00 00 02 ae 82 d8 40 00     21:38:26.834  READ FPDMA QUEUED
  60 01 00 00 00 00 00 02 ae 81 d8 40 00     21:38:26.833  READ FPDMA QUEUED
  60 01 00 00 00 00 00 02 ae 80 d8 40 00     21:38:26.812  READ FPDMA QUEUED

Error 457 [200] occurred at disk power-on lifetime: 6578 hours (274 days + 2 hours)
  When the command that caused the error occurred, the device was active or idle.

  After command completion occurred, registers were:
  ER -- ST COUNT  LBA_48  LH LM LL DV DC
  -- -- -- == -- == == == -- -- -- -- --
  40 -- 41 00 00 00 00 01 b8 c6 c4 40 00  Error: UNC at LBA = 0x01b8c6c4 = 28886724

  Commands leading to the command that caused the error were:
  CR FEATR COUNT  LBA_48  LH LM LL DV DC  Powered_Up_Time  Command/Feature_Name
  -- == -- == -- == == == -- -- -- -- --  ---------------  --------------------
  60 00 01 00 00 00 00 01 b8 c6 c4 40 00     21:38:22.722  READ FPDMA QUEUED
  60 00 38 00 00 00 00 16 d4 b0 a8 40 00     21:38:22.714  READ FPDMA QUEUED
  61 00 08 00 00 00 00 01 b9 48 58 40 00     21:38:22.714  WRITE FPDMA QUEUED
  60 00 08 00 00 00 00 16 e7 65 e0 40 00     21:38:22.709  READ FPDMA QUEUED
  60 00 08 00 00 00 00 16 eb 97 88 40 00     21:38:22.709  READ FPDMA QUEUED

Error 456 [199] occurred at disk power-on lifetime: 6578 hours (274 days + 2 hours)
  When the command that caused the error occurred, the device was active or idle.

  After command completion occurred, registers were:
  ER -- ST COUNT  LBA_48  LH LM LL DV DC
  -- -- -- == -- == == == -- -- -- -- --
  40 -- 41 00 00 00 00 01 b8 c6 c3 40 00  Error: UNC at LBA = 0x01b8c6c3 = 28886723

  Commands leading to the command that caused the error were:
  CR FEATR COUNT  LBA_48  LH LM LL DV DC  Powered_Up_Time  Command/Feature_Name
  -- == -- == -- == == == -- -- -- -- --  ---------------  --------------------
  60 00 01 00 00 00 00 01 b8 c6 c3 40 00     21:38:18.789  READ FPDMA QUEUED
  60 00 70 00 00 00 00 16 be 17 b0 40 00     21:38:18.781  READ FPDMA QUEUED
  60 00 08 00 00 00 00 16 e7 65 e8 40 00     21:38:18.773  READ FPDMA QUEUED
  60 00 08 00 00 00 00 16 d9 f5 08 40 00     21:38:18.757  READ FPDMA QUEUED
  60 00 08 00 00 00 00 16 aa e5 e0 40 00     21:38:18.748  READ FPDMA QUEUED

SMART Extended Self-test Log Version: 1 (1 sectors)
No self-tests have been logged.  [To run self-tests, use: smartctl -t]

SMART Selective self-test log data structure revision number 1
 SPAN  MIN_LBA  MAX_LBA  CURRENT_TEST_STATUS
    1        0        0  Not_testing
    2        0        0  Not_testing
    3        0        0  Not_testing
    4        0        0  Not_testing
    5        0        0  Not_testing
Selective self-test flags (0x0):
  After scanning selected spans, do NOT read-scan remainder of disk.
If Selective self-test is pending on power-up, resume after 0 minute delay.

SCT Status Version:                  2
SCT Version (vendor specific):       1 (0x0001)
SCT Support Level:                   1
Device State:                        Active (0)
Current Temperature:                    30 Celsius
Power Cycle Min/Max Temperature:     29/30 Celsius
Lifetime    Min/Max Temperature:     17/48 Celsius
Under/Over Temperature Limit Count:   0/0

SCT Temperature History Version:     2
Temperature Sampling Period:         1 minute
Temperature Logging Interval:        1 minute
Min/Max recommended Temperature:      5/55 Celsius
Min/Max Temperature Limit:            5/55 Celsius
Temperature History Size (Index):    478 (417)

SCT Error Recovery Control:
           Read: Disabled
          Write: Disabled

Device Statistics (GP Log 0x04)
Page  Offset Size        Value Flags Description
0x01  =====  =               =  ===  == General Statistics (rev 2) ==
0x01  0x008  4            1112  ---  Lifetime Power-On Resets
0x01  0x010  4            6768  ---  Power-on Hours
0x01  0x018  6     24418343130  ---  Logical Sectors Written
0x01  0x020  6       470596788  ---  Number of Write Commands
0x01  0x028  6     34759965029  ---  Logical Sectors Read
0x01  0x030  6       540879033  ---  Number of Read Commands
0x02  =====  =               =  ===  == Free-Fall Statistics (rev 1) ==
0x02  0x010  4            1280  ---  Overlimit Shock Events
0x03  =====  =               =  ===  == Rotating Media Statistics (rev 1) ==
0x03  0x008  4            6761  ---  Spindle Motor Power-on Hours
0x03  0x010  4            6294  ---  Head Flying Hours
0x03  0x018  4           52723  ---  Head Load Events
0x03  0x020  4               0  ---  Number of Reallocated Logical Sectors
0x03  0x028  4               0  ---  Read Recovery Attempts
0x03  0x030  4               0  ---  Number of Mechanical Start Failures
0x04  =====  =               =  ===  == General Errors Statistics (rev 1) ==
0x04  0x008  4             463  ---  Number of Reported Uncorrectable Errors
0x04  0x010  4              18  ---  Resets Between Cmd Acceptance and Completion
0x05  =====  =               =  ===  == Temperature Statistics (rev 1) ==
0x05  0x008  1              30  ---  Current Temperature
0x05  0x010  1              37  N--  Average Short Term Temperature
0x05  0x018  1              37  N--  Average Long Term Temperature
0x05  0x020  1              48  ---  Highest Temperature
0x05  0x028  1              17  ---  Lowest Temperature
0x05  0x030  1              41  N--  Highest Average Short Term Temperature
0x05  0x038  1              31  N--  Lowest Average Short Term Temperature
0x05  0x040  1              39  N--  Highest Average Long Term Temperature
0x05  0x048  1              36  N--  Lowest Average Long Term Temperature
0x05  0x050  4               0  ---  Time in Over-Temperature
0x05  0x058  1              55  ---  Specified Maximum Operating Temperature
0x05  0x060  4               0  ---  Time in Under-Temperature
0x05  0x068  1               5  ---  Specified Minimum Operating Temperature
0x06  =====  =               =  ===  == Transport Statistics (rev 1) ==
0x06  0x008  4            1129  ---  Number of Hardware Resets
0x06  0x018  4               0  ---  Number of Interface CRC Errors
0x07  =====  =               =  ===  == Solid State Device Statistics (rev 1) ==
0x07  0x008  1              11  N--  Percentage Used Endurance Indicator
                                |||_ C monitored condition met
                                ||__ D supports DSN
                                |___ N normalized value

SATA Phy Event Counters (GP Log 0x11)
ID      Size     Value  Description
0x0001  4            0  Command failed due to ICRC error
0x0002  4            0  R_ERR response for data FIS
0x0003  4            0  R_ERR response for device-to-host data FIS
0x0004  4            0  R_ERR response for host-to-device data FIS
0x0005  4            0  R_ERR response for non-data FIS
0x0006  4            0  R_ERR response for device-to-host non-data FIS
0x0007  4            0  R_ERR response for host-to-device non-data FIS
0x0008  4            0  Device-to-host non-data FIS retries
0x0009  4            8  Transition from drive PhyRdy to drive PhyNRdy
0x000a  4            8  Device-to-host register FISes sent due to a COMRESET
0x000b  4            0  CRC errors within host-to-device FIS
0x000d  4            0  Non-CRC errors within host-to-device FIS
0x000f  4            0  R_ERR response for host-to-device data FIS, CRC
0x0010  4            0  R_ERR response for host-to-device data FIS, non-CRC
0x0012  4            0  R_ERR response for host-to-device non-data FIS, CRC
0x0013  4            0  R_ERR response for host-to-device non-data FIS, non-CRC

