=== START OF INFORMATION SECTION ===
Model Family:     Toshiba 2.5" HDD MQ01ABD...
Device Model:     TOSHIBA MQ01ABD050
Serial Number:    --
LU WWN Device Id: 5 000039 ...
Firmware Version: AX001U
User Capacity:    500 107 862 016 bytes [500 GB]
Sector Sizes:     512 bytes logical, 4096 bytes physical
Rotation Rate:    5400 rpm
Form Factor:      2.5 inches
Device is:        In smartctl database [for details use: -P show]
ATA Version is:   ATA8-ACS (minor revision not indicated)
SATA Version is:  SATA 2.6, 3.0 Gb/s (current: 3.0 Gb/s)
Local Time is:    Mon Aug  1 23:55:48 2016 OMST
SMART support is: Available - device has SMART capability.
SMART support is: Enabled
AAM feature is:   Unavailable
APM level is:     128 (minimum power consumption without standby)
Rd look-ahead is: Enabled
Write cache is:   Enabled
ATA Security is:  Disabled, frozen [SEC2]
Wt Cache Reorder: Enabled

=== START OF READ SMART DATA SECTION ===
SMART overall-health self-assessment test result: PASSED

General SMART Values:
Offline data collection status:  (0x85)	Offline data collection activity
					was aborted by an interrupting command from host.
					Auto Offline Data Collection: Enabled.
Self-test execution status:      ( 112)	The previous self-test completed having
					the read element of the test failed.
Total time to complete Offline 
data collection: 		(  120) seconds.
Offline data collection
capabilities: 			 (0x5b) SMART execute Offline immediate.
					Auto Offline data collection on/off support.
					Suspend Offline collection upon new
					command.
					Offline surface scan supported.
					Self-test supported.
					No Conveyance Self-test supported.
					Selective Self-test supported.
SMART capabilities:            (0x0003)	Saves SMART data before entering
					power-saving mode.
					Supports SMART auto save timer.
Error logging capability:        (0x01)	Error logging supported.
					General Purpose Logging supported.
Short self-test routine 
recommended polling time: 	 (   2) minutes.
Extended self-test routine
recommended polling time: 	 ( 120) minutes.
SCT capabilities: 	       (0x003d)	SCT Status supported.
					SCT Error Recovery Control supported.
					SCT Feature Control supported.
					SCT Data Table supported.

SMART Attributes Data Structure revision number: 16
Vendor Specific SMART Attributes with Thresholds:
ID# ATTRIBUTE_NAME          FLAGS    VALUE WORST THRESH FAIL RAW_VALUE
  1 Raw_Read_Error_Rate     PO-R--   100   100   050    -    0
  2 Throughput_Performance  P-S---   100   100   050    -    0
  3 Spin_Up_Time            POS--K   100   100   001    -    1454
  4 Start_Stop_Count        -O--CK   100   100   000    -    1217
  5 Reallocated_Sector_Ct   PO--CK   100   100   050    -    0
  7 Seek_Error_Rate         PO-R--   100   100   050    -    0
  8 Seek_Time_Performance   P-S---   100   100   050    -    0
  9 Power_On_Hours          -O--CK   091   091   000    -    3717
 10 Spin_Retry_Count        PO--CK   124   100   030    -    0
 12 Power_Cycle_Count       -O--CK   100   100   000    -    1215
191 G-Sense_Error_Rate      -O--CK   100   100   000    -    24
192 Power-Off_Retract_Count -O--CK   100   100   000    -    215
193 Load_Cycle_Count        -O--CK   099   099   000    -    16212
194 Temperature_Celsius     -O---K   100   100   000    -    37 (Min/Max 15/48)
196 Reallocated_Event_Count -O--CK   100   100   000    -    0
197 Current_Pending_Sector  -O--CK   100   100   000    -    1168
198 Offline_Uncorrectable   ----CK   100   001   000    -    219
199 UDMA_CRC_Error_Count    -O--CK   200   200   000    -    0
220 Disk_Shift              -O----   100   100   000    -    0
222 Loaded_Hours            -O--CK   093   093   000    -    2968
223 Load_Retry_Count        -O--CK   100   100   000    -    0
224 Load_Friction           -O---K   100   100   000    -    0
226 Load-in_Time            -OS--K   100   100   000    -    241
240 Head_Flying_Hours       P-----   100   100   001    -    0
                            ||||||_ K auto-keep
                            |||||__ C event count
                            ||||___ R error rate
                            |||____ S speed/performance
                            ||_____ O updated online
                            |______ P prefailure warning

General Purpose Log Directory Version 1
SMART           Log Directory Version 1 [multi-sector log support]
Address    Access  R/W   Size  Description
0x00       GPL,SL  R/O      1  Log Directory
0x01           SL  R/O      1  Summary SMART error log
0x02           SL  R/O     51  Comprehensive SMART error log
0x03       GPL     R/O     64  Ext. Comprehensive SMART error log
0x04       GPL,SL  R/O      8  Device Statistics log
0x06           SL  R/O      1  SMART self-test log
0x07       GPL     R/O      1  Extended self-test log
0x09           SL  R/W      1  Selective self-test log
0x10       GPL     R/O      1  NCQ Command Error log
0x11       GPL     R/O      1  SATA Phy Event Counters
0x80-0x9f  GPL,SL  R/W     16  Host vendor specific log
0xe0       GPL,SL  R/W      1  SCT Command/Status
0xe1       GPL,SL  R/W      1  SCT Data Transfer

SMART Extended Comprehensive Error Log Version: 1 (64 sectors)
Device Error Count: 1659 (device log contains only the most recent 256 errors)
	CR     = Command Register
	FEATR  = Features Register
	COUNT  = Count (was: Sector Count) Register
	LBA_48 = Upper bytes of LBA High/Mid/Low Registers ]  ATA-8
	LH     = LBA High (was: Cylinder High) Register    ]   LBA
	LM     = LBA Mid (was: Cylinder Low) Register      ] Register
	LL     = LBA Low (was: Sector Number) Register     ]
	DV     = Device (was: Device/Head) Register
	DC     = Device Control Register
	ER     = Error register
	ST     = Status register
Powered_Up_Time is measured from power on, and printed as
DDd+hh:mm:SS.sss where DD=days, hh=hours, mm=minutes,
SS=sec, and sss=millisec. It "wraps" after 49.710 days.

Error 1659 [122] occurred at disk power-on lifetime: 3715 hours (154 days + 19 hours)
  When the command that caused the error occurred, the device was active or idle.

  After command completion occurred, registers were:
  ER -- ST COUNT  LBA_48  LH LM LL DV DC
  -- -- -- == -- == == == -- -- -- -- --
  40 -- 41 00 b8 00 00 00 fc 3d 78 40 00  Error: UNC at LBA = 0x00fc3d78 = 16530808

  Commands leading to the command that caused the error were:
  CR FEATR COUNT  LBA_48  LH LM LL DV DC  Powered_Up_Time  Command/Feature_Name
  -- == -- == -- == == == -- -- -- -- --  ---------------  --------------------
  60 00 08 00 b8 00 00 00 fc 3d 78 40 00     00:23:36.463  READ FPDMA QUEUED
  60 00 08 00 b0 00 00 00 fc 3d 70 40 00     00:23:36.463  READ FPDMA QUEUED
  60 00 08 00 a8 00 00 00 fc 3d 68 40 00     00:23:36.463  READ FPDMA QUEUED
  60 00 08 00 a0 00 00 00 fc 3d 60 40 00     00:23:36.463  READ FPDMA QUEUED
  60 00 08 00 98 00 00 00 fc 3d 58 40 00     00:23:36.462  READ FPDMA QUEUED

Error 1658 [121] occurred at disk power-on lifetime: 3715 hours (154 days + 19 hours)
  When the command that caused the error occurred, the device was active or idle.

  After command completion occurred, registers were:
  ER -- ST COUNT  LBA_48  LH LM LL DV DC
  -- -- -- == -- == == == -- -- -- -- --
  40 -- 41 00 80 00 00 00 fc 33 e8 40 00  Error: UNC at LBA = 0x00fc33e8 = 16528360

  Commands leading to the command that caused the error were:
  CR FEATR COUNT  LBA_48  LH LM LL DV DC  Powered_Up_Time  Command/Feature_Name
  -- == -- == -- == == == -- -- -- -- --  ---------------  --------------------
  60 00 08 00 80 00 00 00 fc 33 e8 40 00     00:23:32.630  READ FPDMA QUEUED
  60 00 08 00 78 00 00 00 fc 33 e0 40 00     00:23:32.630  READ FPDMA QUEUED
  60 00 08 00 70 00 00 00 fc 33 d8 40 00     00:23:32.630  READ FPDMA QUEUED
  60 00 08 00 68 00 00 00 fc 33 d0 40 00     00:23:32.630  READ FPDMA QUEUED
  60 00 08 00 60 00 00 00 fc 33 c8 40 00     00:23:32.630  READ FPDMA QUEUED

Error 1657 [120] occurred at disk power-on lifetime: 3715 hours (154 days + 19 hours)
  When the command that caused the error occurred, the device was active or idle.

  After command completion occurred, registers were:
  ER -- ST COUNT  LBA_48  LH LM LL DV DC
  -- -- -- == -- == == == -- -- -- -- --
  40 -- 41 00 40 00 00 00 fc 2a 50 40 00  Error: UNC at LBA = 0x00fc2a50 = 16525904

  Commands leading to the command that caused the error were:
  CR FEATR COUNT  LBA_48  LH LM LL DV DC  Powered_Up_Time  Command/Feature_Name
  -- == -- == -- == == == -- -- -- -- --  ---------------  --------------------
  60 00 08 00 40 00 00 00 fc 2a 50 40 00     00:23:28.794  READ FPDMA QUEUED
  60 00 08 00 38 00 00 00 fc 2a 48 40 00     00:23:28.794  READ FPDMA QUEUED
  60 00 08 00 30 00 00 00 fc 2a 40 40 00     00:23:28.794  READ FPDMA QUEUED
  60 00 08 00 28 00 00 00 fc 2a 38 40 00     00:23:28.794  READ FPDMA QUEUED
  60 00 08 00 20 00 00 00 fc 2a 30 40 00     00:23:28.793  READ FPDMA QUEUED

Error 1656 [119] occurred at disk power-on lifetime: 3715 hours (154 days + 19 hours)
  When the command that caused the error occurred, the device was active or idle.

  After command completion occurred, registers were:
  ER -- ST COUNT  LBA_48  LH LM LL DV DC
  -- -- -- == -- == == == -- -- -- -- --
  40 -- 41 00 10 00 00 00 fc 15 28 40 00  Error: UNC at LBA = 0x00fc1528 = 16520488

  Commands leading to the command that caused the error were:
  CR FEATR COUNT  LBA_48  LH LM LL DV DC  Powered_Up_Time  Command/Feature_Name
  -- == -- == -- == == == -- -- -- -- --  ---------------  --------------------
  60 00 08 00 10 00 00 00 fc 15 28 40 00     00:23:24.928  READ FPDMA QUEUED
  60 00 08 00 08 00 00 00 fc 15 20 40 00     00:23:24.928  READ FPDMA QUEUED
  60 00 08 00 00 00 00 00 fc 15 18 40 00     00:23:24.928  READ FPDMA QUEUED
  60 00 08 00 f0 00 00 00 fc 15 10 40 00     00:23:24.928  READ FPDMA QUEUED
  60 00 08 00 e8 00 00 00 fc 15 08 40 00     00:23:24.928  READ FPDMA QUEUED

Error 1655 [118] occurred at disk power-on lifetime: 3715 hours (154 days + 19 hours)
  When the command that caused the error occurred, the device was active or idle.

  After command completion occurred, registers were:
  ER -- ST COUNT  LBA_48  LH LM LL DV DC
  -- -- -- == -- == == == -- -- -- -- --
  40 -- 41 00 d0 00 00 00 fc 0b 98 40 00  Error: UNC at LBA = 0x00fc0b98 = 16518040

  Commands leading to the command that caused the error were:
  CR FEATR COUNT  LBA_48  LH LM LL DV DC  Powered_Up_Time  Command/Feature_Name
  -- == -- == -- == == == -- -- -- -- --  ---------------  --------------------
  60 00 08 00 d0 00 00 00 fc 0b 98 40 00     00:23:21.103  READ FPDMA QUEUED
  60 00 08 00 c8 00 00 00 fc 0b 90 40 00     00:23:21.103  READ FPDMA QUEUED
  60 00 08 00 c0 00 00 00 fc 0b 88 40 00     00:23:21.103  READ FPDMA QUEUED
  60 00 08 00 b8 00 00 00 fc 0b 80 40 00     00:23:21.103  READ FPDMA QUEUED
  60 00 08 00 b0 00 00 00 fc 0b 78 40 00     00:23:21.103  READ FPDMA QUEUED

Error 1654 [117] occurred at disk power-on lifetime: 3715 hours (154 days + 19 hours)
  When the command that caused the error occurred, the device was active or idle.

  After command completion occurred, registers were:
  ER -- ST COUNT  LBA_48  LH LM LL DV DC
  -- -- -- == -- == == == -- -- -- -- --
  40 -- 41 00 b0 00 00 00 f6 c0 88 40 00  Error: UNC at LBA = 0x00f6c088 = 16171144

  Commands leading to the command that caused the error were:
  CR FEATR COUNT  LBA_48  LH LM LL DV DC  Powered_Up_Time  Command/Feature_Name
  -- == -- == -- == == == -- -- -- -- --  ---------------  --------------------
  60 00 08 00 b0 00 00 00 f6 c0 88 40 00     00:23:13.817  READ FPDMA QUEUED
  60 00 08 00 a8 00 00 00 f6 c0 80 40 00     00:23:13.817  READ FPDMA QUEUED
  60 00 08 00 a0 00 00 00 f6 c0 78 40 00     00:23:13.817  READ FPDMA QUEUED
  60 00 08 00 98 00 00 00 f6 c0 70 40 00     00:23:13.817  READ FPDMA QUEUED
  60 00 08 00 90 00 00 00 f6 c0 68 40 00     00:23:13.817  READ FPDMA QUEUED

Error 1653 [116] occurred at disk power-on lifetime: 3715 hours (154 days + 19 hours)
  When the command that caused the error occurred, the device was active or idle.

  After command completion occurred, registers were:
  ER -- ST COUNT  LBA_48  LH LM LL DV DC
  -- -- -- == -- == == == -- -- -- -- --
  40 -- 41 00 70 00 00 00 f6 b6 f0 40 00  Error: UNC at LBA = 0x00f6b6f0 = 16168688

  Commands leading to the command that caused the error were:
  CR FEATR COUNT  LBA_48  LH LM LL DV DC  Powered_Up_Time  Command/Feature_Name
  -- == -- == -- == == == -- -- -- -- --  ---------------  --------------------
  60 00 08 00 70 00 00 00 f6 b6 f0 40 00     00:23:09.985  READ FPDMA QUEUED
  60 00 08 00 68 00 00 00 f6 b6 e8 40 00     00:23:09.985  READ FPDMA QUEUED
  60 00 08 00 60 00 00 00 f6 b6 e0 40 00     00:23:09.985  READ FPDMA QUEUED
  60 00 08 00 58 00 00 00 f6 b6 d8 40 00     00:23:09.985  READ FPDMA QUEUED
  60 00 08 00 50 00 00 00 f6 b6 d0 40 00     00:23:09.985  READ FPDMA QUEUED

Error 1652 [115] occurred at disk power-on lifetime: 3715 hours (154 days + 19 hours)
  When the command that caused the error occurred, the device was active or idle.

  After command completion occurred, registers were:
  ER -- ST COUNT  LBA_48  LH LM LL DV DC
  -- -- -- == -- == == == -- -- -- -- --
  40 -- 41 00 f0 00 00 00 f6 ad 20 40 00  Error: UNC at LBA = 0x00f6ad20 = 16166176

  Commands leading to the command that caused the error were:
  CR FEATR COUNT  LBA_48  LH LM LL DV DC  Powered_Up_Time  Command/Feature_Name
  -- == -- == -- == == == -- -- -- -- --  ---------------  --------------------
  60 00 08 00 f0 00 00 00 f6 ad 20 40 00     00:23:06.154  READ FPDMA QUEUED
  60 00 08 00 e8 00 00 00 f6 ad 18 40 00     00:23:06.154  READ FPDMA QUEUED
  60 00 08 00 e0 00 00 00 f6 ad 10 40 00     00:23:06.154  READ FPDMA QUEUED
  60 00 08 00 d8 00 00 00 f6 ad 08 40 00     00:23:06.154  READ FPDMA QUEUED
  60 00 08 00 d0 00 00 00 f6 ad 00 40 00     00:23:06.154  READ FPDMA QUEUED

SMART Extended Self-test Log Version: 1 (1 sectors)
Num  Test_Description    Status                  Remaining  LifeTime(hours)  LBA_of_first_error
# 1  Extended offline    Completed: read failure       00%      3689         13451672
# 2  Extended offline    Completed: read failure       00%      3608         13436952
# 3  Extended offline    Completed: read failure       00%      3511         13436952
# 4  Extended offline    Completed: read failure       00%      3400         12971224
# 5  Extended offline    Completed: read failure       00%      3292         12971224
# 6  Extended offline    Completed: read failure       00%      3256         12971224
# 7  Extended offline    Completed: read failure       00%      3205         12971224
# 8  Extended offline    Aborted by host               90%      2094         -
# 9  Short offline       Aborted by host               90%      2094         -
#10  Short offline       Completed: read failure       00%      2094         12971224

SMART Selective self-test log data structure revision number 1
 SPAN  MIN_LBA  MAX_LBA  CURRENT_TEST_STATUS
    1        0        0  Not_testing
    2        0        0  Not_testing
    3        0        0  Not_testing
    4        0        0  Not_testing
    5        0        0  Not_testing
Selective self-test flags (0x0):
  After scanning selected spans, do NOT read-scan remainder of disk.
If Selective self-test is pending on power-up, resume after 0 minute delay.

SCT Status Version:                  2
SCT Version (vendor specific):       1 (0x0001)
SCT Support Level:                   1
Device State:                        Active (0)
Current Temperature:                    37 Celsius
Power Cycle Min/Max Temperature:     35/38 Celsius
Lifetime    Min/Max Temperature:     15/48 Celsius
Under/Over Temperature Limit Count:   0/0

SCT Temperature History Version:     2
Temperature Sampling Period:         1 minute
Temperature Logging Interval:        1 minute
Min/Max recommended Temperature:      5/55 Celsius
Min/Max Temperature Limit:            5/55 Celsius
Temperature History Size (Index):    478 (372)

SCT Error Recovery Control:
           Read: Disabled
          Write: Disabled

Device Statistics (GP Log 0x04)
Page Offset Size         Value  Description
  1  =====  =                =  == General Statistics (rev 2) ==
  1  0x008  4             1215  Lifetime Power-On Resets
  1  0x010  4             3717  Power-on Hours
  1  0x018  6       3506853944  Logical Sectors Written
  1  0x020  6         32119353  Number of Write Commands
  1  0x028  6       1134250646  Logical Sectors Read
  1  0x030  6         19144777  Number of Read Commands
  2  =====  =                =  == Free-Fall Statistics (rev 1) ==
  2  0x010  4               24  Overlimit Shock Events
  3  =====  =                =  == Rotating Media Statistics (rev 1) ==
  3  0x008  4             3107  Spindle Motor Power-on Hours
  3  0x010  4             2968  Head Flying Hours
  3  0x018  4            16212  Head Load Events
  3  0x020  4              224  Number of Reallocated Logical Sectors
  3  0x028  4              325  Read Recovery Attempts
  3  0x030  4                0  Number of Mechanical Start Failures
  4  =====  =                =  == General Errors Statistics (rev 1) ==
  4  0x008  4             1658  Number of Reported Uncorrectable Errors
  4  0x010  4                2  Resets Between Cmd Acceptance and Completion
  5  =====  =                =  == Temperature Statistics (rev 1) ==
  5  0x008  1               37  Current Temperature
  5  0x010  1               35~ Average Short Term Temperature
  5  0x018  1               34~ Average Long Term Temperature
  5  0x020  1               48  Highest Temperature
  5  0x028  1               15  Lowest Temperature
  5  0x030  1               41~ Highest Average Short Term Temperature
  5  0x038  1               29~ Lowest Average Short Term Temperature
  5  0x040  1               37~ Highest Average Long Term Temperature
  5  0x048  1               31~ Lowest Average Long Term Temperature
  5  0x050  4                0  Time in Over-Temperature
  5  0x058  1               55  Specified Maximum Operating Temperature
  5  0x060  4                0  Time in Under-Temperature
  5  0x068  1                5  Specified Minimum Operating Temperature
  6  =====  =                =  == Transport Statistics (rev 1) ==
  6  0x008  4             1576  Number of Hardware Resets
  6  0x018  4                0  Number of Interface CRC Errors
  7  =====  =                =  == Solid State Device Statistics (rev 1) ==
  7  0x008  1                6~ Percentage Used Endurance Indicator
                              |_ ~ normalized value

SATA Phy Event Counters (GP Log 0x11)
ID      Size     Value  Description
0x0001  4            0  Command failed due to ICRC error
0x0002  4            0  R_ERR response for data FIS
0x0003  4            0  R_ERR response for device-to-host data FIS
0x0004  4            0  R_ERR response for host-to-device data FIS
0x0005  4            0  R_ERR response for non-data FIS
0x0006  4            0  R_ERR response for device-to-host non-data FIS
0x0007  4            0  R_ERR response for host-to-device non-data FIS
0x0008  4            0  Device-to-host non-data FIS retries
0x0009  4           11  Transition from drive PhyRdy to drive PhyNRdy
0x000a  4           10  Device-to-host register FISes sent due to a COMRESET
0x000b  4            0  CRC errors within host-to-device FIS
0x000d  4            0  Non-CRC errors within host-to-device FIS
0x000f  4            0  R_ERR response for host-to-device data FIS, CRC
0x0010  4            0  R_ERR response for host-to-device data FIS, non-CRC
0x0012  4            0  R_ERR response for host-to-device non-data FIS, CRC
0x0013  4            0  R_ERR response for host-to-device non-data FIS, non-CRC

