smartctl 7.3 2022-02-28 r5338 [x86_64-linux-5.19.0-21-generic] (local build)
Copyright (C) 2002-22, Bruce Allen, Christian Franke, www.smartmontools.org

=== START OF INFORMATION SECTION ===
Model Number:                       Micron 3400 NVMe 512GB
Serial Number:                      --
Firmware Version:                   34000060
PCI Vendor/Subsystem ID:            0x1344
IEEE OUI Identifier:                0x00a075
Total NVM Capacity:                 512,110,190,592 [512 GB]
Unallocated NVM Capacity:           0
Controller ID:                      0
NVMe Version:                       1.4
Number of Namespaces:               1
Namespace 1 Size/Capacity:          512,110,190,592 [512 GB]
Namespace 1 Formatted LBA Size:     512
Namespace 1 IEEE EUI-64:            00a075 ...
Local Time is:                      Wed Feb  8 12:29:42 2023 UTC
Firmware Updates (0x14):            2 Slots, no Reset required
Optional Admin Commands (0x0017):   Security Format Frmw_DL Self_Test
Optional NVM Commands (0x00d7):     Comp Wr_Unc DS_Mngmt Sav/Sel_Feat Timestmp Verify
Log Page Attributes (0x1a):         Cmd_Eff_Lg Telmtry_Lg Pers_Ev_Lg
Maximum Data Transfer Size:         512 Pages
Warning  Comp. Temp. Threshold:     83 Celsius
Critical Comp. Temp. Threshold:     85 Celsius
Namespace 1 Features (0x08):        No_ID_Reuse

Supported Power States
St Op     Max   Active     Idle   RL RT WL WT  Ent_Lat  Ex_Lat
 0 +     8.25W       -        -    0  0  0  0        0       0
 1 +     4.00W       -        -    1  1  1  1        0       0
 2 +     2.00W       -        -    2  2  2  2        0       0
 3 -   0.1000W       -        -    3  3  3  3     5000    6000
 4 -   0.0050W       -        -    4  4  4  4    12000   35000

Supported LBA Sizes (NSID 0x1)
Id Fmt  Data  Metadt  Rel_Perf
 0 +     512       0         0

=== START OF SMART DATA SECTION ===
SMART overall-health self-assessment test result: PASSED

SMART/Health Information (NVMe Log 0x02)
Critical Warning:                   0x00
Temperature:                        25 Celsius
Available Spare:                    100%
Available Spare Threshold:          50%
Percentage Used:                    0%
Data Units Read:                    4,567,624 [2.33 TB]
Data Units Written:                 4,517,309 [2.31 TB]
Host Read Commands:                 52,990,053
Host Write Commands:                56,809,430
Controller Busy Time:               22
Power Cycles:                       277
Power On Hours:                     48
Unsafe Shutdowns:                   63
Media and Data Integrity Errors:    0
Error Information Log Entries:      51
Warning  Comp. Temperature Time:    0
Critical Comp. Temperature Time:    0
Temperature Sensor 1:               25 Celsius

Error Information (NVMe Log 0x01, 16 of 256 entries)
Num   ErrCount  SQId   CmdId  Status  PELoc          LBA  NSID    VS
  0         51     0  0x201d  0x8004  0x000            0     0     -

