=== START OF INFORMATION SECTION ===
Model Family:     Seagate Barracuda 7200.10
Device Model:     ST380815AS
Serial Number:    --
Firmware Version: 3.CHF
User Capacity:    80,026,361,856 bytes [80.0 GB]
Sector Size:      512 bytes logical/physical
Device is:        In smartctl database [for details use: -P show]
ATA Version is:   ATA/ATAPI-7 (minor revision not indicated)
Local Time is:    Fri Mar 27 09:53:45 2020 EET
SMART support is: Available - device has SMART capability.
SMART support is: Enabled
AAM feature is:   Unavailable
APM feature is:   Unavailable
Rd look-ahead is: Enabled
Write cache is:   Enabled
DSN feature is:   Unavailable
ATA Security is:  Disabled, frozen [SEC2]
Unexpected SCT status 0xffff (action_code=4, function_code=2)
Wt Cache Reorder: Unknown (SCT Feature Control command failed)

=== START OF READ SMART DATA SECTION ===
SMART overall-health self-assessment test result: PASSED

General SMART Values:
Offline data collection status:  (0x82)	Offline data collection activity
					was completed without error.
					Auto Offline Data Collection: Enabled.
Self-test execution status:      (   0)	The previous self-test routine completed
					without error or no self-test has ever 
					been run.
Total time to complete Offline 
data collection: 		(  433) seconds.
Offline data collection
capabilities: 			 (0x5b) SMART execute Offline immediate.
					Auto Offline data collection on/off support.
					Suspend Offline collection upon new
					command.
					Offline surface scan supported.
					Self-test supported.
					No Conveyance Self-test supported.
					Selective Self-test supported.
SMART capabilities:            (0x0003)	Saves SMART data before entering
					power-saving mode.
					Supports SMART auto save timer.
Error logging capability:        (0x01)	Error logging supported.
					General Purpose Logging supported.
Short self-test routine 
recommended polling time: 	 (   2) minutes.
Extended self-test routine
recommended polling time: 	 (  26) minutes.
SCT capabilities: 	       (0x0035)	SCT Status supported.
					SCT Feature Control supported.
					SCT Data Table supported.

SMART Attributes Data Structure revision number: 10
Vendor Specific SMART Attributes with Thresholds:
ID# ATTRIBUTE_NAME          FLAGS    VALUE WORST THRESH FAIL RAW_VALUE
  1 Raw_Read_Error_Rate     POSR--   100   253   006    -    0
  3 Spin_Up_Time            -O----   098   097   000    -    0
  4 Start_Stop_Count        PO--CK   096   096   020    -    4792
  5 Reallocated_Sector_Ct   PO--CK   100   100   036    -    0
  7 Seek_Error_Rate         POSR--   090   060   030    -    944709055
  9 Power_On_Hours          -O--CK   079   079   000    -    18437
 10 Spin_Retry_Count        PO--C-   100   100   097    -    0
 12 Power_Cycle_Count       PO--CK   096   096   020    -    4578
184 End-to-End_Error        PO--CK   100   253   097    -    0
187 Reported_Uncorrect      -O-RCK   100   100   000    -    0
189 High_Fly_Writes         -O---K   100   100   000    -    0
190 Airflow_Temperature_Cel -O-RC-   061   053   000    -    39 (Min/Max 31/39)
194 Temperature_Celsius     ------   039   047   000    -    39 (0 15 0 0 0)
195 Hardware_ECC_Recovered  -O--CK   080   069   000    -    233223355
197 Current_Pending_Sector  ------   100   100   000    -    0
198 Offline_Uncorrectable   ------   100   100   000    -    0
199 UDMA_CRC_Error_Count    ------   200   200   000    -    1442
                            ||||||_ K auto-keep
                            |||||__ C event count
                            ||||___ R error rate
                            |||____ S speed/performance
                            ||_____ O updated online
                            |______ P prefailure warning

General Purpose Log Directory Version 1
SMART           Log Directory Version 1 [multi-sector log support]
Address    Access  R/W   Size  Description
0x00       GPL,SL  R/O      1  Log Directory
0x01       GPL,SL  R/O      1  Summary SMART error log
0x02       GPL,SL  R/O      5  Comprehensive SMART error log
0x03       GPL,SL  R/O      5  Ext. Comprehensive SMART error log
0x06       GPL,SL  R/O      1  SMART self-test log
0x07       GPL,SL  R/O      1  Extended self-test log
0x09       GPL,SL  R/W      1  Selective self-test log
0x10       GPL,SL  R/O      1  NCQ Command Error log
0x11       GPL,SL  R/O      1  SATA Phy Event Counters log
0x20       GPL,SL  R/O      1  Streaming performance log [OBS-8]
0x21       GPL,SL  R/O      1  Write stream error log
0x22       GPL,SL  R/O      1  Read stream error log
0x23       GPL,SL  R/O      1  Delayed sector log [OBS-8]
0x80-0x9f  GPL,SL  R/W     16  Host vendor specific log
0xa0       GPL,SL  VS       1  Device vendor specific log
0xa1       GPL,SL  VS      20  Device vendor specific log
0xa2       GPL,SL  VS     101  Device vendor specific log
0xa8       GPL,SL  VS      20  Device vendor specific log
0xa9       GPL,SL  VS       1  Device vendor specific log
0xe0       GPL,SL  R/W      1  SCT Command/Status
0xe1       GPL,SL  R/W      1  SCT Data Transfer
0xff       GPL     -    23040  Reserved

SMART Extended Comprehensive Error Log Version: 1 (5 sectors)
Device Error Count: 1883 (device log contains only the most recent 20 errors)
	CR     = Command Register
	FEATR  = Features Register
	COUNT  = Count (was: Sector Count) Register
	LBA_48 = Upper bytes of LBA High/Mid/Low Registers ]  ATA-8
	LH     = LBA High (was: Cylinder High) Register    ]   LBA
	LM     = LBA Mid (was: Cylinder Low) Register      ] Register
	LL     = LBA Low (was: Sector Number) Register     ]
	DV     = Device (was: Device/Head) Register
	DC     = Device Control Register
	ER     = Error register
	ST     = Status register
Powered_Up_Time is measured from power on, and printed as
DDd+hh:mm:SS.sss where DD=days, hh=hours, mm=minutes,
SS=sec, and sss=millisec. It "wraps" after 49.710 days.

Error 1883 [2] occurred at disk power-on lifetime: 18200 hours (758 days + 8 hours)
  When the command that caused the error occurred, the device was active or idle.

  After command completion occurred, registers were:
  ER -- ST COUNT  LBA_48  LH LM LL DV DC
  -- -- -- == -- == == == -- -- -- -- --
  84 -- 51 00 00 00 00 00 00 00 00 e0 00  Error: ICRC, ABRT at LBA = 0x00000000 = 0

  Commands leading to the command that caused the error were:
  CR FEATR COUNT  LBA_48  LH LM LL DV DC  Powered_Up_Time  Command/Feature_Name
  -- == -- == -- == == == -- -- -- -- --  ---------------  --------------------
  c8 00 00 00 20 00 00 9e 00 63 a0 e0 00     00:08:50.045  READ DMA
  c8 00 00 00 20 00 00 7f 00 04 e0 e0 00     00:08:50.029  READ DMA
  c8 00 00 00 20 00 05 94 00 1c 40 e5 00     00:08:49.170  READ DMA
  c8 00 00 00 08 00 00 0f 00 65 60 e0 00     00:08:49.169  READ DMA
  c6 00 00 00 08 00 ff ff 00 ff ff a0 00     00:08:49.168  SET MULTIPLE MODE

Error 1882 [1] occurred at disk power-on lifetime: 18200 hours (758 days + 8 hours)
  When the command that caused the error occurred, the device was active or idle.

  After command completion occurred, registers were:
  ER -- ST COUNT  LBA_48  LH LM LL DV DC
  -- -- -- == -- == == == -- -- -- -- --
  84 -- 51 00 0f 00 00 00 00 00 00 e0 00  Error: ICRC, ABRT 15 sectors at LBA = 0x00000000 = 0

  Commands leading to the command that caused the error were:
  CR FEATR COUNT  LBA_48  LH LM LL DV DC  Powered_Up_Time  Command/Feature_Name
  -- == -- == -- == == == -- -- -- -- --  ---------------  --------------------
  c8 00 00 00 20 00 00 7f 00 04 e0 e0 00     00:08:50.045  READ DMA
  c8 00 00 00 20 00 05 94 00 1c 40 e5 00     00:08:50.029  READ DMA
  c8 00 00 00 08 00 00 0f 00 65 60 e0 00     00:08:49.170  READ DMA
  c6 00 00 00 08 00 ff ff 00 ff ff a0 00     00:08:49.169  SET MULTIPLE MODE
  ef 00 03 00 45 00 ff ff 00 ff ff a0 00     00:08:49.168  SET FEATURES [Set transfer mode]

Error 1881 [0] occurred at disk power-on lifetime: 18200 hours (758 days + 8 hours)
  When the command that caused the error occurred, the device was active or idle.

  After command completion occurred, registers were:
  ER -- ST COUNT  LBA_48  LH LM LL DV DC
  -- -- -- == -- == == == -- -- -- -- --
  84 -- 51 00 0f 00 00 00 00 00 00 e5 00  Error: ICRC, ABRT 15 sectors at LBA = 0x05000000 = 83886080

  Commands leading to the command that caused the error were:
  CR FEATR COUNT  LBA_48  LH LM LL DV DC  Powered_Up_Time  Command/Feature_Name
  -- == -- == -- == == == -- -- -- -- --  ---------------  --------------------
  c8 00 00 00 20 00 05 94 00 1c 40 e5 00     00:08:50.045  READ DMA
  c8 00 00 00 08 00 00 0f 00 65 60 e0 00     00:08:50.029  READ DMA
  c6 00 00 00 08 00 ff ff 00 ff ff a0 00     00:08:49.170  SET MULTIPLE MODE
  ef 00 03 00 45 00 ff ff 00 ff ff a0 00     00:08:49.169  SET FEATURES [Set transfer mode]
  ef 00 03 00 0c 00 ff ff 00 ff ff a0 00     00:08:49.168  SET FEATURES [Set transfer mode]

Error 1880 [19] occurred at disk power-on lifetime: 18199 hours (758 days + 7 hours)
  When the command that caused the error occurred, the device was active or idle.

  After command completion occurred, registers were:
  ER -- ST COUNT  LBA_48  LH LM LL DV DC
  -- -- -- == -- == == == -- -- -- -- --
  84 -- 51 00 5f 00 00 00 00 00 00 e4 00  Error: ICRC, ABRT 95 sectors at LBA = 0x04000000 = 67108864

  Commands leading to the command that caused the error were:
  CR FEATR COUNT  LBA_48  LH LM LL DV DC  Powered_Up_Time  Command/Feature_Name
  -- == -- == -- == == == -- -- -- -- --  ---------------  --------------------
  c8 00 00 01 00 00 04 c7 00 c4 80 e4 00     00:01:15.100  READ DMA
  c8 00 00 01 00 00 04 c6 00 c4 80 e4 00     00:01:15.100  READ DMA
  c8 00 00 00 08 00 00 02 00 01 88 e0 00     00:01:15.078  READ DMA
  c8 00 00 00 08 00 00 27 00 65 40 e0 00     00:01:15.065  READ DMA
  ca 00 00 00 08 00 00 fa 00 00 e0 e0 00     00:01:15.056  WRITE DMA

Error 1879 [18] occurred at disk power-on lifetime: 18200 hours (758 days + 8 hours)
  When the command that caused the error occurred, the device was active or idle.

  After command completion occurred, registers were:
  ER -- ST COUNT  LBA_48  LH LM LL DV DC
  -- -- -- == -- == == == -- -- -- -- --
  84 -- 51 00 00 00 00 00 00 00 00 e0 00  Error: ICRC, ABRT at LBA = 0x00000000 = 0

  Commands leading to the command that caused the error were:
  CR FEATR COUNT  LBA_48  LH LM LL DV DC  Powered_Up_Time  Command/Feature_Name
  -- == -- == -- == == == -- -- -- -- --  ---------------  --------------------
  c8 00 00 00 20 00 00 9e 00 63 a0 e0 00     00:08:50.045  READ DMA
  c8 00 00 00 20 00 00 7f 00 04 e0 e0 00     00:08:50.029  READ DMA
  c8 00 00 00 20 00 05 94 00 1c 40 e5 00     00:08:49.170  READ DMA
  c8 00 00 00 08 00 00 0f 00 65 60 e0 00     00:08:49.169  READ DMA
  c6 00 00 00 08 00 ff ff 00 ff ff a0 00     00:08:49.168  SET MULTIPLE MODE

Error 1878 [17] occurred at disk power-on lifetime: 18200 hours (758 days + 8 hours)
  When the command that caused the error occurred, the device was active or idle.

  After command completion occurred, registers were:
  ER -- ST COUNT  LBA_48  LH LM LL DV DC
  -- -- -- == -- == == == -- -- -- -- --
  84 -- 51 00 0f 00 00 00 00 00 00 e0 00  Error: ICRC, ABRT 15 sectors at LBA = 0x00000000 = 0

  Commands leading to the command that caused the error were:
  CR FEATR COUNT  LBA_48  LH LM LL DV DC  Powered_Up_Time  Command/Feature_Name
  -- == -- == -- == == == -- -- -- -- --  ---------------  --------------------
  c8 00 00 00 20 00 00 7f 00 04 e0 e0 00     00:08:50.045  READ DMA
  c8 00 00 00 20 00 05 94 00 1c 40 e5 00     00:08:50.029  READ DMA
  c8 00 00 00 08 00 00 0f 00 65 60 e0 00     00:08:49.170  READ DMA
  c6 00 00 00 08 00 ff ff 00 ff ff a0 00     00:08:49.169  SET MULTIPLE MODE
  ef 00 03 00 45 00 ff ff 00 ff ff a0 00     00:08:49.168  SET FEATURES [Set transfer mode]

Error 1877 [16] occurred at disk power-on lifetime: 18200 hours (758 days + 8 hours)
  When the command that caused the error occurred, the device was active or idle.

  After command completion occurred, registers were:
  ER -- ST COUNT  LBA_48  LH LM LL DV DC
  -- -- -- == -- == == == -- -- -- -- --
  84 -- 51 00 0f 00 00 00 00 00 00 e5 00  Error: ICRC, ABRT 15 sectors at LBA = 0x05000000 = 83886080

  Commands leading to the command that caused the error were:
  CR FEATR COUNT  LBA_48  LH LM LL DV DC  Powered_Up_Time  Command/Feature_Name
  -- == -- == -- == == == -- -- -- -- --  ---------------  --------------------
  c8 00 00 00 20 00 05 94 00 1c 40 e5 00     00:08:50.045  READ DMA
  c8 00 00 00 08 00 00 0f 00 65 60 e0 00     00:08:50.029  READ DMA
  c6 00 00 00 08 00 ff ff 00 ff ff a0 00     00:08:49.170  SET MULTIPLE MODE
  ef 00 03 00 45 00 ff ff 00 ff ff a0 00     00:08:49.169  SET FEATURES [Set transfer mode]
  ef 00 03 00 0c 00 ff ff 00 ff ff a0 00     00:08:49.168  SET FEATURES [Set transfer mode]

Error 1876 [15] occurred at disk power-on lifetime: 18199 hours (758 days + 7 hours)
  When the command that caused the error occurred, the device was active or idle.

  After command completion occurred, registers were:
  ER -- ST COUNT  LBA_48  LH LM LL DV DC
  -- -- -- == -- == == == -- -- -- -- --
  84 -- 51 00 5f 00 00 00 00 00 00 e4 00  Error: ICRC, ABRT 95 sectors at LBA = 0x04000000 = 67108864

  Commands leading to the command that caused the error were:
  CR FEATR COUNT  LBA_48  LH LM LL DV DC  Powered_Up_Time  Command/Feature_Name
  -- == -- == -- == == == -- -- -- -- --  ---------------  --------------------
  c8 00 00 01 00 00 04 c7 00 c4 80 e4 00     00:01:15.100  READ DMA
  c8 00 00 01 00 00 04 c6 00 c4 80 e4 00     00:01:15.100  READ DMA
  c8 00 00 00 08 00 00 02 00 01 88 e0 00     00:01:15.078  READ DMA
  c8 00 00 00 08 00 00 27 00 65 40 e0 00     00:01:15.065  READ DMA
  ca 00 00 00 08 00 00 fa 00 00 e0 e0 00     00:01:15.056  WRITE DMA

SMART Extended Self-test Log Version: 1 (1 sectors)
Num  Test_Description    Status                  Remaining  LifeTime(hours)  LBA_of_first_error
# 1  Short captive       Completed without error       00%     18405         -
# 2  Short captive       Completed without error       00%     18405         -
# 3  Short captive       Completed without error       00%     18401         -
# 4  Short captive       Completed without error       00%     18397         -
# 5  Short captive       Completed without error       00%     18377         -
# 6  Short captive       Completed without error       00%     18306         -
# 7  Short captive       Completed without error       00%     18202         -
# 8  Short captive       Completed without error       00%     18134         -
# 9  Short captive       Completed without error       00%     17935         -
#10  Short captive       Completed without error       00%     17657         -
#11  Short captive       Completed without error       00%     17620         -
#12  Short captive       Completed without error       00%     17603         -
#13  Short captive       Completed without error       00%     17401         -
#14  Short captive       Completed without error       00%     17017         -
#15  Short captive       Completed without error       00%     14419         -
#16  Extended offline    Interrupted (host reset)      30%         1         -

SMART Selective self-test log data structure revision number 1
 SPAN  MIN_LBA  MAX_LBA  CURRENT_TEST_STATUS
    1        0        0  Not_testing
    2        0        0  Not_testing
    3        0        0  Not_testing
    4        0        0  Not_testing
    5        0        0  Not_testing
Selective self-test flags (0x0):
  After scanning selected spans, do NOT read-scan remainder of disk.
If Selective self-test is pending on power-up, resume after 0 minute delay.

SCT Status Version:                  2
SCT Version (vendor specific):       521 (0x0209)
Device State:                        Active (0)
Current Temperature:                    39 Celsius
Power Cycle Min/Max Temperature:     --/39 Celsius
Lifetime    Min/Max Temperature:     --/47 Celsius

Another SCT command is executing, abort Read Data Table
(SCT ext_status_code 0xffff, action_code=4, function_code=2)
Read SCT Temperature History failed

SCT Error Recovery Control command not supported

Device Statistics (GP/SMART Log 0x04) not supported

Pending Defects log (GP Log 0x0c) not supported

SATA Phy Event Counters (GP Log 0x11)
ID      Size     Value  Description
0x000a  2            9  Device-to-host register FISes sent due to a COMRESET
0x0001  2            0  Command failed due to ICRC error
0x0003  2            0  R_ERR response for device-to-host data FIS
0x0004  2            0  R_ERR response for host-to-device data FIS
0x0006  2            0  R_ERR response for device-to-host non-data FIS
0x0007  2            0  R_ERR response for host-to-device non-data FIS

