smartctl 7.1 2019-12-30 r5022 [x86_64-linux-5.15.0-56-generic] (local build)
Copyright (C) 2002-19, Bruce Allen, Christian Franke, www.smartmontools.org

=== START OF INFORMATION SECTION ===
Model Number:                       CT250P2SSD8
Serial Number:                      --
Firmware Version:                   P2CR010
PCI Vendor/Subsystem ID:            0xc0a9
IEEE OUI Identifier:                0x6479a7
Total NVM Capacity:                 250,059,350,016 [250 GB]
Unallocated NVM Capacity:           0
Controller ID:                      1
Number of Namespaces:               1
Namespace 1 Size/Capacity:          250,059,350,016 [250 GB]
Namespace 1 Formatted LBA Size:     512
Namespace 1 IEEE EUI-64:            6479a7 ...
Local Time is:                      Wed Dec 10 20:34:08 2025 UTC
Firmware Updates (0x12):            1 Slot, no Reset required
Optional Admin Commands (0x001f):   Security Format Frmw_DL NS_Mngmt Self_Test
Optional NVM Commands (0x005e):     Wr_Unc DS_Mngmt Wr_Zero Sav/Sel_Feat Timestmp
Maximum Data Transfer Size:         64 Pages
Warning  Comp. Temp. Threshold:     70 Celsius
Critical Comp. Temp. Threshold:     85 Celsius

Supported Power States
St Op     Max   Active     Idle   RL RT WL WT  Ent_Lat  Ex_Lat
 0 +     4.50W       -        -    0  0  0  0        0       0
 1 +     2.70W       -        -    1  1  1  1        0       0
 2 +     2.16W       -        -    2  2  2  2        0       0
 3 -   0.0700W       -        -    3  3  3  3     1000    1000
 4 -   0.0020W       -        -    4  4  4  4     5000   55000

Supported LBA Sizes (NSID 0x1)
Id Fmt  Data  Metadt  Rel_Perf
 0 +     512       0         1
 1 -    4096       0         0

=== START OF SMART DATA SECTION ===
SMART overall-health self-assessment test result: PASSED

SMART/Health Information (NVMe Log 0x02)
Critical Warning:                   0x00
Temperature:                        27 Celsius
Available Spare:                    100%
Available Spare Threshold:          5%
Percentage Used:                    5%
Data Units Read:                    64,749,611 [33.1 TB]
Data Units Written:                 44,649,097 [22.8 TB]
Host Read Commands:                 1,223,375,451
Host Write Commands:                957,664,787
Controller Busy Time:               25,444
Power Cycles:                       6,296
Power On Hours:                     7,810
Unsafe Shutdowns:                   70
Media and Data Integrity Errors:    0
Error Information Log Entries:      8,019
Warning  Comp. Temperature Time:    9
Critical Comp. Temperature Time:    0
Thermal Temp. 1 Transition Count:   14
Thermal Temp. 2 Transition Count:   4
Thermal Temp. 1 Total Time:         12
Thermal Temp. 2 Total Time:         13

Error Information (NVMe Log 0x01, max 16 entries)
Num   ErrCount  SQId   CmdId  Status  PELoc          LBA  NSID    VS
  0       8019     0  0x101c  0x4005  0x028            0     0     -



