smartctl 7.2 2020-12-30 r5155 [x86_64-linux-5.11.0-27-generic] (local build)
Copyright (C) 2002-20, Bruce Allen, Christian Franke, www.smartmontools.org

=== START OF INFORMATION SECTION ===
Model Family:     Western Digital Caviar Blue Serial ATA
Device Model:     WDC WD3200AAJS-56B4A0
Serial Number:    --
LU WWN Device Id: 5 0014ee ...
Firmware Version: 01.03A01
User Capacity:    320,072,933,376 bytes [320 GB]
Sector Size:      512 bytes logical/physical
Device is:        In smartctl database [for details use: -P show]
ATA Version is:   ATA8-ACS (minor revision not indicated)
SATA Version is:  SATA 2.5, 3.0 Gb/s
Local Time is:    Mon Aug 30 19:44:43 2021 UTC
SMART support is: Available - device has SMART capability.
SMART support is: Enabled
AAM level is:     128 (quiet), recommended: 128
APM feature is:   Unavailable
Rd look-ahead is: Enabled
Write cache is:   Enabled
DSN feature is:   Unavailable
ATA Security is:  Disabled, frozen [SEC2]
Wt Cache Reorder: Enabled

=== START OF READ SMART DATA SECTION ===
SMART overall-health self-assessment test result: PASSED

General SMART Values:
Offline data collection status:  (0x84)	Offline data collection activity
					was suspended by an interrupting command from host.
					Auto Offline Data Collection: Enabled.
Self-test execution status:      (   0)	The previous self-test routine completed
					without error or no self-test has ever 
					been run.
Total time to complete Offline 
data collection: 		( 5580) seconds.
Offline data collection
capabilities: 			 (0x7b) SMART execute Offline immediate.
					Auto Offline data collection on/off support.
					Suspend Offline collection upon new
					command.
					Offline surface scan supported.
					Self-test supported.
					Conveyance Self-test supported.
					Selective Self-test supported.
SMART capabilities:            (0x0003)	Saves SMART data before entering
					power-saving mode.
					Supports SMART auto save timer.
Error logging capability:        (0x01)	Error logging supported.
					General Purpose Logging supported.
Short self-test routine 
recommended polling time: 	 (   2) minutes.
Extended self-test routine
recommended polling time: 	 (  68) minutes.
Conveyance self-test routine
recommended polling time: 	 (   5) minutes.
SCT capabilities: 	       (0x303f)	SCT Status supported.
					SCT Error Recovery Control supported.
					SCT Feature Control supported.
					SCT Data Table supported.

SMART Attributes Data Structure revision number: 16
Vendor Specific SMART Attributes with Thresholds:
ID# ATTRIBUTE_NAME          FLAGS    VALUE WORST THRESH FAIL RAW_VALUE
  1 Raw_Read_Error_Rate     POSR-K   200   200   051    -    210
  3 Spin_Up_Time            POS--K   151   151   021    -    3416
  4 Start_Stop_Count        -O--CK   096   096   000    -    4402
  5 Reallocated_Sector_Ct   PO--CK   200   200   140    -    0
  7 Seek_Error_Rate         -OSR-K   200   200   000    -    0
  9 Power_On_Hours          -O--CK   072   072   000    -    20625
 10 Spin_Retry_Count        -O--CK   100   100   000    -    0
 11 Calibration_Retry_Count -O--CK   100   100   000    -    0
 12 Power_Cycle_Count       -O--CK   096   096   000    -    4128
192 Power-Off_Retract_Count -O--CK   198   198   000    -    1739
193 Load_Cycle_Count        -O--CK   199   199   000    -    4387
194 Temperature_Celsius     -O---K   106   089   000    -    37
196 Reallocated_Event_Count -O--CK   200   200   000    -    0
197 Current_Pending_Sector  -O--CK   200   200   000    -    0
198 Offline_Uncorrectable   ----CK   200   200   000    -    0
199 UDMA_CRC_Error_Count    -O--CK   200   200   000    -    4245
200 Multi_Zone_Error_Rate   ---R--   200   200   000    -    0
                            ||||||_ K auto-keep
                            |||||__ C event count
                            ||||___ R error rate
                            |||____ S speed/performance
                            ||_____ O updated online
                            |______ P prefailure warning

General Purpose Log Directory Version 1
SMART           Log Directory Version 1 [multi-sector log support]
Address    Access  R/W   Size  Description
0x00       GPL,SL  R/O      1  Log Directory
0x01           SL  R/O      1  Summary SMART error log
0x02           SL  R/O      5  Comprehensive SMART error log
0x03       GPL     R/O      6  Ext. Comprehensive SMART error log
0x06           SL  R/O      1  SMART self-test log
0x07       GPL     R/O      1  Extended self-test log
0x09           SL  R/W      1  Selective self-test log
0x10       GPL     R/O      1  NCQ Command Error log
0x11       GPL     R/O      1  SATA Phy Event Counters log
0x21       GPL     R/O      1  Write stream error log
0x22       GPL     R/O      1  Read stream error log
0x80-0x9f  GPL,SL  R/W     16  Host vendor specific log
0xa0-0xa7  GPL,SL  VS      16  Device vendor specific log
0xa8-0xb7  GPL,SL  VS       1  Device vendor specific log
0xc0       GPL,SL  VS       1  Device vendor specific log
0xc1       GPL     VS      24  Device vendor specific log
0xe0       GPL,SL  R/W      1  SCT Command/Status
0xe1       GPL,SL  R/W      1  SCT Data Transfer

SMART Extended Comprehensive Error Log Version: 1 (6 sectors)
Device Error Count: 30 (device log contains only the most recent 24 errors)
	CR     = Command Register
	FEATR  = Features Register
	COUNT  = Count (was: Sector Count) Register
	LBA_48 = Upper bytes of LBA High/Mid/Low Registers ]  ATA-8
	LH     = LBA High (was: Cylinder High) Register    ]   LBA
	LM     = LBA Mid (was: Cylinder Low) Register      ] Register
	LL     = LBA Low (was: Sector Number) Register     ]
	DV     = Device (was: Device/Head) Register
	DC     = Device Control Register
	ER     = Error register
	ST     = Status register
Powered_Up_Time is measured from power on, and printed as
DDd+hh:mm:SS.sss where DD=days, hh=hours, mm=minutes,
SS=sec, and sss=millisec. It "wraps" after 49.710 days.

Error 30 [5] occurred at disk power-on lifetime: 12855 hours (535 days + 15 hours)
  When the command that caused the error occurred, the device was active or idle.

  After command completion occurred, registers were:
  ER -- ST COUNT  LBA_48  LH LM LL DV DC
  -- -- -- == -- == == == -- -- -- -- --
  40 -- 51 00 00 00 13 79 00 6c b5 40 00  Error: UNC at LBA = 0x1379006cb5 = 83634449589

  Commands leading to the command that caused the error were:
  CR FEATR COUNT  LBA_48  LH LM LL DV DC  Powered_Up_Time  Command/Feature_Name
  -- == -- == -- == == == -- -- -- -- --  ---------------  --------------------
  60 01 00 00 08 00 00 13 6c 79 3d 40 00     06:22:55.347  READ FPDMA QUEUED
  60 01 00 00 08 00 00 13 6c 78 3d 40 00     06:22:55.345  READ FPDMA QUEUED
  60 01 00 00 08 00 00 13 6c 77 3d 40 00     06:22:55.344  READ FPDMA QUEUED
  60 01 00 00 08 00 00 13 6c 76 3d 40 00     06:22:55.343  READ FPDMA QUEUED
  60 01 00 00 08 00 00 13 6c 75 3d 40 00     06:22:55.342  READ FPDMA QUEUED

Error 29 [4] occurred at disk power-on lifetime: 12854 hours (535 days + 14 hours)
  When the command that caused the error occurred, the device was active or idle.

  After command completion occurred, registers were:
  ER -- ST COUNT  LBA_48  LH LM LL DV DC
  -- -- -- == -- == == == -- -- -- -- --
  40 -- 51 00 01 00 13 79 00 6c b5 40 00  Error: UNC at LBA = 0x1379006cb5 = 83634449589

  Commands leading to the command that caused the error were:
  CR FEATR COUNT  LBA_48  LH LM LL DV DC  Powered_Up_Time  Command/Feature_Name
  -- == -- == -- == == == -- -- -- -- --  ---------------  --------------------
  60 01 00 00 08 00 00 13 6c 79 3f 40 00     04:22:03.884  READ FPDMA QUEUED
  60 01 00 00 08 00 00 13 6c 78 3f 40 00     04:22:03.883  READ FPDMA QUEUED
  60 01 00 00 08 00 00 13 6c 77 3f 40 00     04:22:03.882  READ FPDMA QUEUED
  60 01 00 00 08 00 00 13 6c 76 3f 40 00     04:22:03.880  READ FPDMA QUEUED
  60 01 00 00 08 00 00 13 6c 75 3f 40 00     04:22:03.879  READ FPDMA QUEUED

Error 28 [3] occurred at disk power-on lifetime: 12636 hours (526 days + 12 hours)
  When the command that caused the error occurred, the device was active or idle.

  After command completion occurred, registers were:
  ER -- ST COUNT  LBA_48  LH LM LL DV DC
  -- -- -- == -- == == == -- -- -- -- --
  40 -- 51 00 01 00 13 79 00 6c b5 40 00  Error: UNC at LBA = 0x1379006cb5 = 83634449589

  Commands leading to the command that caused the error were:
  CR FEATR COUNT  LBA_48  LH LM LL DV DC  Powered_Up_Time  Command/Feature_Name
  -- == -- == -- == == == -- -- -- -- --  ---------------  --------------------
  60 00 80 00 08 00 00 13 6c 79 64 40 00     02:01:23.023  READ FPDMA QUEUED
  60 00 80 00 08 00 00 13 6c 78 e4 40 00     02:01:23.022  READ FPDMA QUEUED
  60 00 80 00 08 00 00 13 6c 78 64 40 00     02:01:23.020  READ FPDMA QUEUED
  60 00 80 00 08 00 00 13 6c 77 e4 40 00     02:01:23.020  READ FPDMA QUEUED
  60 00 80 00 08 00 00 13 6c 77 64 40 00     02:01:23.019  READ FPDMA QUEUED

Error 27 [2] occurred at disk power-on lifetime: 12635 hours (526 days + 11 hours)
  When the command that caused the error occurred, the device was active or idle.

  After command completion occurred, registers were:
  ER -- ST COUNT  LBA_48  LH LM LL DV DC
  -- -- -- == -- == == == -- -- -- -- --
  40 -- 51 00 01 00 13 79 00 6c b5 40 00  Error: UNC at LBA = 0x1379006cb5 = 83634449589

  Commands leading to the command that caused the error were:
  CR FEATR COUNT  LBA_48  LH LM LL DV DC  Powered_Up_Time  Command/Feature_Name
  -- == -- == -- == == == -- -- -- -- --  ---------------  --------------------
  60 00 80 00 08 00 00 13 6c 79 a4 40 00     00:57:04.115  READ FPDMA QUEUED
  60 00 80 00 08 00 00 13 6c 79 24 40 00     00:57:04.115  READ FPDMA QUEUED
  60 00 80 00 08 00 00 13 6c 78 a4 40 00     00:57:04.114  READ FPDMA QUEUED
  60 00 80 00 08 00 00 13 6c 78 24 40 00     00:57:04.113  READ FPDMA QUEUED
  60 00 80 00 08 00 00 13 6c 77 a4 40 00     00:57:04.112  READ FPDMA QUEUED

Error 26 [1] occurred at disk power-on lifetime: 9497 hours (395 days + 17 hours)
  When the command that caused the error occurred, the device was active or idle.

  After command completion occurred, registers were:
  ER -- ST COUNT  LBA_48  LH LM LL DV DC
  -- -- -- == -- == == == -- -- -- -- --
  40 -- 51 00 08 00 13 79 00 6c b4 e0 00  Error: UNC 8 sectors at LBA = 0x1379006cb4 = 83634449588

  Commands leading to the command that caused the error were:
  CR FEATR COUNT  LBA_48  LH LM LL DV DC  Powered_Up_Time  Command/Feature_Name
  -- == -- == -- == == == -- -- -- -- --  ---------------  --------------------
  25 00 00 00 08 00 00 13 6c 79 b4 e0 08     08:18:06.334  READ DMA EXT
  25 00 00 00 80 00 00 13 6c 7a 3c e0 08     08:18:06.334  READ DMA EXT
  25 00 00 00 08 00 00 13 6c 79 b4 e0 08     08:18:04.131  READ DMA EXT
  25 00 00 00 80 00 00 13 6c 79 bc e0 08     08:18:04.120  READ DMA EXT
  25 00 00 00 08 00 00 13 6c 79 ac e0 08     08:18:04.120  READ DMA EXT

Error 25 [0] occurred at disk power-on lifetime: 9497 hours (395 days + 17 hours)
  When the command that caused the error occurred, the device was active or idle.

  After command completion occurred, registers were:
  ER -- ST COUNT  LBA_48  LH LM LL DV DC
  -- -- -- == -- == == == -- -- -- -- --
  40 -- 51 00 08 00 13 79 00 6c b4 e0 00  Error: UNC 8 sectors at LBA = 0x1379006cb4 = 83634449588

  Commands leading to the command that caused the error were:
  CR FEATR COUNT  LBA_48  LH LM LL DV DC  Powered_Up_Time  Command/Feature_Name
  -- == -- == -- == == == -- -- -- -- --  ---------------  --------------------
  25 00 00 00 08 00 00 13 6c 79 b4 e0 08     08:18:04.131  READ DMA EXT
  25 00 00 00 80 00 00 13 6c 79 bc e0 08     08:18:04.120  READ DMA EXT
  25 00 00 00 08 00 00 13 6c 79 ac e0 08     08:18:04.120  READ DMA EXT
  25 00 00 00 80 00 00 13 6c 79 b4 e0 08     08:18:01.916  READ DMA EXT
  25 00 00 00 08 00 00 13 6c 79 a4 e0 08     08:18:01.916  READ DMA EXT

Error 24 [23] occurred at disk power-on lifetime: 9497 hours (395 days + 17 hours)
  When the command that caused the error occurred, the device was active or idle.

  After command completion occurred, registers were:
  ER -- ST COUNT  LBA_48  LH LM LL DV DC
  -- -- -- == -- == == == -- -- -- -- --
  40 -- 51 00 80 00 13 79 00 6c b4 e0 00  Error: UNC 128 sectors at LBA = 0x1379006cb4 = 83634449588

  Commands leading to the command that caused the error were:
  CR FEATR COUNT  LBA_48  LH LM LL DV DC  Powered_Up_Time  Command/Feature_Name
  -- == -- == -- == == == -- -- -- -- --  ---------------  --------------------
  25 00 00 00 80 00 00 13 6c 79 b4 e0 08     08:18:01.916  READ DMA EXT
  25 00 00 00 08 00 00 13 6c 79 a4 e0 08     08:18:01.916  READ DMA EXT
  25 00 00 00 80 00 00 13 6c 79 ac e0 08     08:17:59.400  READ DMA EXT
  25 00 00 00 08 00 00 13 6c 79 9c e0 08     08:17:59.400  READ DMA EXT
  25 00 00 00 80 00 00 13 6c 79 a4 e0 08     08:17:57.194  READ DMA EXT

Error 23 [22] occurred at disk power-on lifetime: 9497 hours (395 days + 17 hours)
  When the command that caused the error occurred, the device was active or idle.

  After command completion occurred, registers were:
  ER -- ST COUNT  LBA_48  LH LM LL DV DC
  -- -- -- == -- == == == -- -- -- -- --
  40 -- 51 00 80 00 13 79 00 6c ac e0 00  Error: UNC 128 sectors at LBA = 0x1379006cac = 83634449580

  Commands leading to the command that caused the error were:
  CR FEATR COUNT  LBA_48  LH LM LL DV DC  Powered_Up_Time  Command/Feature_Name
  -- == -- == -- == == == -- -- -- -- --  ---------------  --------------------
  25 00 00 00 80 00 00 13 6c 79 ac e0 08     08:17:59.400  READ DMA EXT
  25 00 00 00 08 00 00 13 6c 79 9c e0 08     08:17:59.400  READ DMA EXT
  25 00 00 00 80 00 00 13 6c 79 a4 e0 08     08:17:57.194  READ DMA EXT
  25 00 00 00 08 00 00 13 6c 79 94 e0 08     08:17:57.194  READ DMA EXT
  25 00 00 00 80 00 00 13 6c 79 9c e0 08     08:17:54.988  READ DMA EXT

SMART Extended Self-test Log Version: 1 (1 sectors)
Num  Test_Description    Status                  Remaining  LifeTime(hours)  LBA_of_first_error
# 1  Short offline       Completed without error       00%     18486         -

SMART Selective self-test log data structure revision number 1
 SPAN  MIN_LBA  MAX_LBA  CURRENT_TEST_STATUS
    1        0        0  Not_testing
    2        0        0  Not_testing
    3        0        0  Not_testing
    4        0        0  Not_testing
    5        0        0  Not_testing
Selective self-test flags (0x0):
  After scanning selected spans, do NOT read-scan remainder of disk.
If Selective self-test is pending on power-up, resume after 0 minute delay.

SCT Status Version:                  2
SCT Version (vendor specific):       258 (0x0102)
Device State:                        SMART Off-line Data Collection executing in background (4)
Current Temperature:                    22 Celsius
Power Cycle Min/Max Temperature:     22/22 Celsius
Lifetime    Min/Max Temperature:      ?/53 Celsius
Under/Over Temperature Limit Count:   0/0

SCT Temperature History Version:     2
Temperature Sampling Period:         1 minute
Temperature Logging Interval:        255 minutes
Min/Max recommended Temperature:      0/60 Celsius
Min/Max Temperature Limit:           -41/85 Celsius
Temperature History Size (Index):    478 (368)

SCT Error Recovery Control:
           Read: Disabled
          Write: Disabled

Device Statistics (GP/SMART Log 0x04) not supported

Pending Defects log (GP Log 0x0c) not supported

SATA Phy Event Counters (GP Log 0x11)
ID      Size     Value  Description
0x0001  2            0  Command failed due to ICRC error
0x0002  2            0  R_ERR response for data FIS
0x0003  2            0  R_ERR response for device-to-host data FIS
0x0004  2            0  R_ERR response for host-to-device data FIS
0x0005  2            0  R_ERR response for non-data FIS
0x0006  2            0  R_ERR response for device-to-host non-data FIS
0x0007  2            0  R_ERR response for host-to-device non-data FIS
0x000a  2           39  Device-to-host register FISes sent due to a COMRESET
0x8000  4         9455  Vendor specific

