smartctl 7.4 2023-08-01 r5530 [x86_64-linux-6.14.0-27-generic] (local build)
Copyright (C) 2002-23, Bruce Allen, Christian Franke, www.smartmontools.org

=== START OF INFORMATION SECTION ===
Model Number:                       KXG60ZNV1T02 NVMe KIOXIA 1024GB
Serial Number:                      --
Firmware Version:                   10604107
PCI Vendor/Subsystem ID:            0x1179
IEEE OUI Identifier:                0x8ce38e
Total NVM Capacity:                 1,024,209,543,168 [1.02 TB]
Unallocated NVM Capacity:           0
Controller ID:                      0
NVMe Version:                       1.3
Number of Namespaces:               1
Namespace 1 Size/Capacity:          1,024,209,543,168 [1.02 TB]
Namespace 1 Formatted LBA Size:     512
Namespace 1 IEEE EUI-64:            8ce38e ...
Local Time is:                      Thu Aug 14 22:41:51 2025 CEST
Firmware Updates (0x14):            2 Slots, no Reset required
Optional Admin Commands (0x0017):   Security Format Frmw_DL Self_Test
Optional NVM Commands (0x005f):     Comp Wr_Unc DS_Mngmt Wr_Zero Sav/Sel_Feat Timestmp
Log Page Attributes (0x0e):         Cmd_Eff_Lg Ext_Get_Lg Telmtry_Lg
Maximum Data Transfer Size:         512 Pages
Warning  Comp. Temp. Threshold:     82 Celsius
Critical Comp. Temp. Threshold:     84 Celsius
Namespace 1 Features (0x02):        NA_Fields

Supported Power States
St Op     Max   Active     Idle   RL RT WL WT  Ent_Lat  Ex_Lat
 0 +     6.00W       -        -    0  0  0  0        1       1
 1 +     2.40W       -        -    1  1  1  1        1       1
 2 +     1.90W       -        -    2  2  2  2        1       1
 3 -   0.0500W       -        -    3  3  3  3     1500    1500
 4 -   0.0030W       -        -    4  4  4  4    50000   80000

Supported LBA Sizes (NSID 0x1)
Id Fmt  Data  Metadt  Rel_Perf
 0 +     512       0         2
 1 -    4096       0         1

=== START OF SMART DATA SECTION ===
SMART overall-health self-assessment test result: PASSED

SMART/Health Information (NVMe Log 0x02)
Critical Warning:                   0x00
Temperature:                        42 Celsius
Available Spare:                    100%
Available Spare Threshold:          10%
Percentage Used:                    13%
Data Units Read:                    76,790,120 [39.3 TB]
Data Units Written:                 94,272,012 [48.2 TB]
Host Read Commands:                 1,540,653,384
Host Write Commands:                2,089,380,051
Controller Busy Time:               4,861
Power Cycles:                       910
Power On Hours:                     25,603
Unsafe Shutdowns:                   246
Media and Data Integrity Errors:    0
Error Information Log Entries:      0
Warning  Comp. Temperature Time:    0
Critical Comp. Temperature Time:    0
Temperature Sensor 1:               42 Celsius

Error Information (NVMe Log 0x01, 16 of 256 entries)
No Errors Logged

Self-test Log (NVMe Log 0x06)
Self-test status: No self-test in progress
Num  Test_Description  Status                       Power_on_Hours  Failing_LBA  NSID Seg SCT Code
 0   Short             Completed without error               23413            -     -   -   -    -
 1   Short             Completed without error               22980            -     -   -   -    -
 2   Short             Completed without error               22322            -     -   -   -    -
 3   Short             Aborted: Controller Reset             22063            -     -   -   -    -
 4   Short             Completed without error               21348            -     -   -   -    -
 5   Short             Completed without error               19333            -     -   -   -    -
 6   Short             Completed without error               19196            -     -   -   -    -
 7   Short             Completed without error               18019            -     -   -   -    -
 8   Short             Completed without error               16593            -     -   -   -    -
 9   Short             Completed without error               15430            -     -   -   -    -
10   Short             Completed without error               13374            -     -   -   -    -
11   Short             Completed without error               12673            -     -   -   -    -
12   Short             Completed without error               12290            -     -   -   -    -
13   Short             Completed without error               11362            -     -   -   -    -
14   Short             Completed without error               11110            -     -   -   -    -
15   Short             Completed without error               10137            -     -   -   -    -
16   Short             Completed without error                8989            -     -   -   -    -
17   Short             Completed without error                8416            -     -   -   -    -
18   Short             Completed without error                8299            -     -   -   -    -
19   Short             Completed without error                8098            -     -   -   -    -

