smartctl 7.3 2022-02-28 r5338 [x86_64-linux-6.2.9-300.fc38.x86_64] (local build)
Copyright (C) 2002-22, Bruce Allen, Christian Franke, www.smartmontools.org

=== START OF INFORMATION SECTION ===
Model Number:                       KINGSTON RBUSNS8154P3512GJ
Serial Number:                      --
Firmware Version:                   E8FK11.C
PCI Vendor/Subsystem ID:            0x2646
IEEE OUI Identifier:                0x0026b7
Total NVM Capacity:                 512,110,190,592 [512 GB]
Unallocated NVM Capacity:           0
Controller ID:                      0
NVMe Version:                       1.2
Number of Namespaces:               1
Namespace 1 Size/Capacity:          512,110,190,592 [512 GB]
Namespace 1 Formatted LBA Size:     512
Namespace 1 IEEE EUI-64:            0026b7 ...
Local Time is:                      Sun Jun 18 05:38:34 2023 EDT
Firmware Updates (0x02):            1 Slot
Optional Admin Commands (0x0007):   Security Format Frmw_DL
Optional NVM Commands (0x001e):     Wr_Unc DS_Mngmt Wr_Zero Sav/Sel_Feat
Log Page Attributes (0x04):         Ext_Get_Lg
Maximum Data Transfer Size:         512 Pages
Warning  Comp. Temp. Threshold:     84 Celsius
Critical Comp. Temp. Threshold:     88 Celsius

Supported Power States
St Op     Max   Active     Idle   RL RT WL WT  Ent_Lat  Ex_Lat
 0 +     7.90W  0.0790W       -    0  0  0  0      600     600
 1 +     7.90W  0.0790W       -    0  0  0  0      600     600
 2 +     7.90W  0.0790W       -    0  0  0  0      600     600
 3 -   0.1000W  0.0790W       -    3  3  3  3     1000    1000
 4 -   0.0050W  0.0790W       -    4  4  4  4   400000   90000

Supported LBA Sizes (NSID 0x1)
Id Fmt  Data  Metadt  Rel_Perf
 0 +     512       0         1
 1 -    4096       0         0

=== START OF SMART DATA SECTION ===
SMART overall-health self-assessment test result: PASSED

SMART/Health Information (NVMe Log 0x02)
Critical Warning:                   0x00
Temperature:                        33 Celsius
Available Spare:                    100%
Available Spare Threshold:          100%
Percentage Used:                    2%
Data Units Read:                    27,364,170 [14.0 TB]
Data Units Written:                 26,938,113 [13.7 TB]
Host Read Commands:                 318,139,760
Host Write Commands:                395,053,125
Controller Busy Time:               1,143
Power Cycles:                       1,608
Power On Hours:                     1,707
Unsafe Shutdowns:                   41
Media and Data Integrity Errors:    0
Error Information Log Entries:      76
Warning  Comp. Temperature Time:    0
Critical Comp. Temperature Time:    0
Temperature Sensor 2:               33 Celsius

Error Information (NVMe Log 0x01, 16 of 16 entries)
Num   ErrCount  SQId   CmdId  Status  PELoc          LBA  NSID    VS
  0         76     0  0x0010  0x0005      -            6     0     -
  1         75     0  0x0005  0x0005      -           12     0     -
  2         74     0  0x0007  0x0005      -     33555456     0     -
  3         73     0  0x0007  0x0005      -     33555456     0     -
  4         72     0  0x0007  0x0005      -     33555456     0     -
  5         71     0  0x0007  0x0005      -     33555456     0     -
  6         70     0  0x0007  0x0005      -     33555456     0     -
  7         69     0  0x0007  0x0005      -     33555456     0     -
  8         68     0  0x0007  0x0005      -     33555456     0     -
  9         67     0  0x0007  0x0005      -     33555456     0     -
 10         66     0  0x0007  0x0005      -     33555456     0     -
 11         65     0  0x0007  0x0005      -     33555456     0     -
 12         64     0  0x0007  0x0005      -     33555456     0     -
 13         62     0  0x0007  0x0005      -     33555456     0     -
 14         61     0  0x0007  0x0005      -     33555456     0     -
 15         47     0  0x0007  0x0005      -     33555456     0     -

