smartctl 7.4 2023-08-01 r5530 [x86_64-linux-6.11.0-25-generic] (local build)
Copyright (C) 2002-23, Bruce Allen, Christian Franke, www.smartmontools.org

=== START OF INFORMATION SECTION ===
Model Number:                       KXG50ZNV256G NVMe TOSHIBA 256GB
Serial Number:                      --
Firmware Version:                   AADA4101
PCI Vendor/Subsystem ID:            0x1179
IEEE OUI Identifier:                0x00080d
Total NVM Capacity:                 256,060,514,304 [256 GB]
Unallocated NVM Capacity:           0
Controller ID:                      0
NVMe Version:                       1.2.1
Number of Namespaces:               1
Namespace 1 Size/Capacity:          256,060,514,304 [256 GB]
Namespace 1 Formatted LBA Size:     512
Namespace 1 IEEE EUI-64:            00080d ...
Local Time is:                      Wed May 14 20:00:35 2025 PDT
Firmware Updates (0x14):            2 Slots, no Reset required
Optional Admin Commands (0x0017):   Security Format Frmw_DL Self_Test
Optional NVM Commands (0x005f):     Comp Wr_Unc DS_Mngmt Wr_Zero Sav/Sel_Feat Timestmp
Log Page Attributes (0x02):         Cmd_Eff_Lg
Maximum Data Transfer Size:         512 Pages
Warning  Comp. Temp. Threshold:     78 Celsius
Critical Comp. Temp. Threshold:     82 Celsius
Namespace 1 Features (0x02):        NA_Fields

Supported Power States
St Op     Max   Active     Idle   RL RT WL WT  Ent_Lat  Ex_Lat
 0 +     6.00W       -        -    0  0  0  0        0       0
 1 +     2.40W       -        -    1  1  1  1        0       0
 2 +     1.90W       -        -    2  2  2  2        0       0
 3 -   0.0500W       -        -    3  3  3  3     1500    1500
 4 -   0.0030W       -        -    4  4  4  4    50000   80000

Supported LBA Sizes (NSID 0x1)
Id Fmt  Data  Metadt  Rel_Perf
 0 +     512       0         2
 1 -    4096       0         1

=== START OF SMART DATA SECTION ===
SMART overall-health self-assessment test result: PASSED

SMART/Health Information (NVMe Log 0x02)
Critical Warning:                   0x00
Temperature:                        34 Celsius
Available Spare:                    100%
Available Spare Threshold:          10%
Percentage Used:                    32%
Data Units Read:                    47,686,292 [24.4 TB]
Data Units Written:                 45,168,582 [23.1 TB]
Host Read Commands:                 716,163,377
Host Write Commands:                731,545,708
Controller Busy Time:               5,622
Power Cycles:                       2,128
Power On Hours:                     16,304
Unsafe Shutdowns:                   206
Media and Data Integrity Errors:    0
Error Information Log Entries:      0
Warning  Comp. Temperature Time:    0
Critical Comp. Temperature Time:    0
Temperature Sensor 1:               34 Celsius

Error Information (NVMe Log 0x01, 16 of 128 entries)
No Errors Logged

Self-test Log (NVMe Log 0x06)
Self-test status: No self-test in progress
Num  Test_Description  Status                       Power_on_Hours  Failing_LBA  NSID Seg SCT Code
 0   Short             Aborted: Self-test command            16299            -     -   -   -    -
 1   Short             Aborted: Self-test command            16299            -     -   -   -    -
 2   Short             Aborted: Self-test command            16297            -     -   -   -    -
 3   Short             Aborted: Self-test command            16297            -     -   -   -    -
 4   Short             Aborted: Self-test command            16294            -     -   -   -    -
 5   Short             Aborted: Self-test command             4743            -     -   -   -    -
 6   Short             Completed without error                4743            -     -   -   -    -
 7   Short             Aborted: Self-test command             4686            -     -   -   -    -
 8   Short             Aborted: Self-test command             4686            -     -   -   -    -
 9   Short             Aborted: Self-test command             2153            -     -   -   -    -
10   Short             Aborted: Self-test command             2153            -     -   -   -    -
11   Short             Aborted: Self-test command             2153            -     -   -   -    -
12   Short             Aborted: Self-test command             1944            -     -   -   -    -
13   Short             Aborted: Controller Reset              1944            -     -   -   -    -
14   Short             Aborted: Self-test command             1944            -     -   -   -    -
15   Short             Aborted: Controller Reset              1944            -     -   -   -    -
16   Short             Aborted: Self-test command             1944            -     -   -   -    -
17   Short             Aborted: Self-test command             1944            -     -   -   -    -
18   Short             Completed without error                1944            -     -   -   -    -
19   Short             Aborted: Self-test command             1944            -     -   -   -    -

