smartctl 7.2 2020-12-30 r5155 [x86_64-linux-5.10.74-generic-2rosa2021.1-x86_64] (local build)
Copyright (C) 2002-20, Bruce Allen, Christian Franke, www.smartmontools.org

=== START OF INFORMATION SECTION ===
Model Family:     Seagate Barracuda 7200.14 (AF)
Device Model:     ST250DM000-1BD141
Serial Number:    --
LU WWN Device Id: 5 000c50 ...
Firmware Version: KC48
User Capacity:    250,059,350,016 bytes [250 GB]
Sector Sizes:     512 bytes logical, 4096 bytes physical
Rotation Rate:    7200 rpm
Device is:        In smartctl database [for details use: -P show]
ATA Version is:   ATA8-ACS T13/1699-D revision 4
SATA Version is:  SATA 3.0, 6.0 Gb/s (current: 6.0 Gb/s)
Local Time is:    Tue Feb  8 15:07:28 2022 +07
SMART support is: Available - device has SMART capability.
SMART support is: Enabled
AAM level is:     208 (intermediate), recommended: 208
APM feature is:   Unavailable
Rd look-ahead is: Enabled
Write cache is:   Enabled
DSN feature is:   Unavailable
ATA Security is:  Disabled, frozen [SEC2]
Wt Cache Reorder: Enabled

=== START OF READ SMART DATA SECTION ===
SMART overall-health self-assessment test result: PASSED

General SMART Values:
Offline data collection status:  (0x82)	Offline data collection activity
					was completed without error.
					Auto Offline Data Collection: Enabled.
Self-test execution status:      (   0)	The previous self-test routine completed
					without error or no self-test has ever 
					been run.
Total time to complete Offline 
data collection: 		(  600) seconds.
Offline data collection
capabilities: 			 (0x7b) SMART execute Offline immediate.
					Auto Offline data collection on/off support.
					Suspend Offline collection upon new
					command.
					Offline surface scan supported.
					Self-test supported.
					Conveyance Self-test supported.
					Selective Self-test supported.
SMART capabilities:            (0x0003)	Saves SMART data before entering
					power-saving mode.
					Supports SMART auto save timer.
Error logging capability:        (0x01)	Error logging supported.
					General Purpose Logging supported.
Short self-test routine 
recommended polling time: 	 (   1) minutes.
Extended self-test routine
recommended polling time: 	 (  41) minutes.
Conveyance self-test routine
recommended polling time: 	 (   2) minutes.
SCT capabilities: 	       (0x303f)	SCT Status supported.
					SCT Error Recovery Control supported.
					SCT Feature Control supported.
					SCT Data Table supported.

SMART Attributes Data Structure revision number: 10
Vendor Specific SMART Attributes with Thresholds:
ID# ATTRIBUTE_NAME          FLAGS    VALUE WORST THRESH FAIL RAW_VALUE
  1 Raw_Read_Error_Rate     POSR--   103   089   006    -    5308328
  3 Spin_Up_Time            PO----   100   100   000    -    0
  4 Start_Stop_Count        -O--CK   100   100   020    -    136
  5 Reallocated_Sector_Ct   PO--CK   100   100   036    -    0
  7 Seek_Error_Rate         POSR--   079   060   030    -    8771884478
  9 Power_On_Hours          -O--CK   044   044   000    -    49774
 10 Spin_Retry_Count        PO--C-   100   100   097    -    0
 12 Power_Cycle_Count       -O--CK   100   100   020    -    135
183 Runtime_Bad_Block       -O--CK   100   100   000    -    0
184 End-to-End_Error        -O--CK   100   100   099    -    0
187 Reported_Uncorrect      -O--CK   015   015   000    -    85
188 Command_Timeout         -O--CK   100   099   000    -    0 0 4
189 High_Fly_Writes         -O-RCK   100   100   000    -    0
190 Airflow_Temperature_Cel -O---K   062   046   045    -    38 (Min/Max 37/38)
194 Temperature_Celsius     -O---K   038   054   000    -    38 (0 21 0 0 0)
195 Hardware_ECC_Recovered  -O-RC-   034   022   000    -    5308328
197 Current_Pending_Sector  -O--C-   100   100   000    -    0
198 Offline_Uncorrectable   ----C-   100   100   000    -    0
199 UDMA_CRC_Error_Count    -OSRCK   200   200   000    -    7
240 Head_Flying_Hours       ------   100   253   000    -    49774h+17m+25.352s
241 Total_LBAs_Written      ------   100   253   000    -    2392152618
242 Total_LBAs_Read         ------   100   253   000    -    2971352976
                            ||||||_ K auto-keep
                            |||||__ C event count
                            ||||___ R error rate
                            |||____ S speed/performance
                            ||_____ O updated online
                            |______ P prefailure warning

General Purpose Log Directory Version 1
SMART           Log Directory Version 1 [multi-sector log support]
Address    Access  R/W   Size  Description
0x00       GPL,SL  R/O      1  Log Directory
0x01           SL  R/O      1  Summary SMART error log
0x02           SL  R/O      5  Comprehensive SMART error log
0x03       GPL     R/O      5  Ext. Comprehensive SMART error log
0x06           SL  R/O      1  SMART self-test log
0x07       GPL     R/O      1  Extended self-test log
0x09           SL  R/W      1  Selective self-test log
0x10       GPL     R/O      1  NCQ Command Error log
0x11       GPL     R/O      1  SATA Phy Event Counters log
0x21       GPL     R/O      1  Write stream error log
0x22       GPL     R/O      1  Read stream error log
0x80-0x9f  GPL,SL  R/W     16  Host vendor specific log
0xa1       GPL,SL  VS      20  Device vendor specific log
0xa2       GPL     VS    2248  Device vendor specific log
0xa8       GPL,SL  VS     129  Device vendor specific log
0xa9       GPL,SL  VS       1  Device vendor specific log
0xab       GPL     VS       1  Device vendor specific log
0xb0       GPL     VS    2928  Device vendor specific log
0xbd       GPL     VS     252  Device vendor specific log
0xbe-0xbf  GPL     VS   65535  Device vendor specific log
0xc0       GPL,SL  VS       1  Device vendor specific log
0xe0       GPL,SL  R/W      1  SCT Command/Status
0xe1       GPL,SL  R/W      1  SCT Data Transfer

SMART Extended Comprehensive Error Log Version: 1 (5 sectors)
Device Error Count: 85 (device log contains only the most recent 20 errors)
	CR     = Command Register
	FEATR  = Features Register
	COUNT  = Count (was: Sector Count) Register
	LBA_48 = Upper bytes of LBA High/Mid/Low Registers ]  ATA-8
	LH     = LBA High (was: Cylinder High) Register    ]   LBA
	LM     = LBA Mid (was: Cylinder Low) Register      ] Register
	LL     = LBA Low (was: Sector Number) Register     ]
	DV     = Device (was: Device/Head) Register
	DC     = Device Control Register
	ER     = Error register
	ST     = Status register
Powered_Up_Time is measured from power on, and printed as
DDd+hh:mm:SS.sss where DD=days, hh=hours, mm=minutes,
SS=sec, and sss=millisec. It "wraps" after 49.710 days.

Error 85 [4] occurred at disk power-on lifetime: 48082 hours (2003 days + 10 hours)
  When the command that caused the error occurred, the device was active or idle.

  After command completion occurred, registers were:
  ER -- ST COUNT  LBA_48  LH LM LL DV DC
  -- -- -- == -- == == == -- -- -- -- --
  40 -- 51 00 00 00 00 02 e3 ea 30 00 00  Error: UNC at LBA = 0x02e3ea30 = 48491056

  Commands leading to the command that caused the error were:
  CR FEATR COUNT  LBA_48  LH LM LL DV DC  Powered_Up_Time  Command/Feature_Name
  -- == -- == -- == == == -- -- -- -- --  ---------------  --------------------
  42 00 00 01 00 00 00 02 e3 ea 00 40 00     00:04:40.613  READ VERIFY SECTOR(S) EXT
  42 00 00 01 00 00 00 02 e2 bb 00 e0 00     00:04:40.310  READ VERIFY SECTOR(S) EXT
  42 00 00 01 00 00 00 02 d2 ca 00 e0 00     00:04:36.320  READ VERIFY SECTOR(S) EXT
  42 00 00 01 00 00 00 02 c2 d9 00 e0 00     00:04:32.324  READ VERIFY SECTOR(S) EXT
  42 00 00 01 00 00 00 02 b2 e9 00 e0 00     00:04:28.335  READ VERIFY SECTOR(S) EXT

Error 84 [3] occurred at disk power-on lifetime: 39731 hours (1655 days + 11 hours)
  When the command that caused the error occurred, the device was active or idle.

  After command completion occurred, registers were:
  ER -- ST COUNT  LBA_48  LH LM LL DV DC
  -- -- -- == -- == == == -- -- -- -- --
  40 -- 51 00 00 00 00 02 e3 ea 30 00 00  Error: UNC at LBA = 0x02e3ea30 = 48491056

  Commands leading to the command that caused the error were:
  CR FEATR COUNT  LBA_48  LH LM LL DV DC  Powered_Up_Time  Command/Feature_Name
  -- == -- == -- == == == -- -- -- -- --  ---------------  --------------------
  60 00 00 00 08 00 00 08 44 76 c0 40 00  2d+18:19:19.596  READ FPDMA QUEUED
  60 00 00 00 08 00 00 02 e3 ea 30 40 00  2d+18:19:19.596  READ FPDMA QUEUED
  27 00 00 00 00 00 00 00 00 00 00 e0 00  2d+18:19:19.595  READ NATIVE MAX ADDRESS EXT [OBS-ACS-3]
  ec 00 00 00 00 00 00 00 00 00 00 a0 00  2d+18:19:19.594  IDENTIFY DEVICE
  ef 00 03 00 46 00 00 00 00 00 00 a0 00  2d+18:19:19.594  SET FEATURES [Set transfer mode]

Error 83 [2] occurred at disk power-on lifetime: 39731 hours (1655 days + 11 hours)
  When the command that caused the error occurred, the device was active or idle.

  After command completion occurred, registers were:
  ER -- ST COUNT  LBA_48  LH LM LL DV DC
  -- -- -- == -- == == == -- -- -- -- --
  40 -- 51 00 00 00 00 02 e3 ea 30 00 00  Error: UNC at LBA = 0x02e3ea30 = 48491056

  Commands leading to the command that caused the error were:
  CR FEATR COUNT  LBA_48  LH LM LL DV DC  Powered_Up_Time  Command/Feature_Name
  -- == -- == -- == == == -- -- -- -- --  ---------------  --------------------
  60 00 00 00 08 00 00 02 e3 ea 30 40 00  2d+18:19:15.709  READ FPDMA QUEUED
  60 00 00 00 08 00 00 08 44 76 c0 40 00  2d+18:19:15.708  READ FPDMA QUEUED
  60 00 00 00 08 00 00 02 00 38 68 40 00  2d+18:19:15.707  READ FPDMA QUEUED
  27 00 00 00 00 00 00 00 00 00 00 e0 00  2d+18:19:15.707  READ NATIVE MAX ADDRESS EXT [OBS-ACS-3]
  ec 00 00 00 00 00 00 00 00 00 00 a0 00  2d+18:19:15.706  IDENTIFY DEVICE

Error 82 [1] occurred at disk power-on lifetime: 39731 hours (1655 days + 11 hours)
  When the command that caused the error occurred, the device was active or idle.

  After command completion occurred, registers were:
  ER -- ST COUNT  LBA_48  LH LM LL DV DC
  -- -- -- == -- == == == -- -- -- -- --
  40 -- 51 00 00 00 00 02 e3 ea 30 00 00  Error: UNC at LBA = 0x02e3ea30 = 48491056

  Commands leading to the command that caused the error were:
  CR FEATR COUNT  LBA_48  LH LM LL DV DC  Powered_Up_Time  Command/Feature_Name
  -- == -- == -- == == == -- -- -- -- --  ---------------  --------------------
  60 00 00 00 08 00 00 02 00 38 68 40 00  2d+18:19:11.829  READ FPDMA QUEUED
  60 00 00 00 08 00 00 08 44 76 c0 40 00  2d+18:19:11.829  READ FPDMA QUEUED
  60 00 00 00 08 00 00 02 e3 ea 30 40 00  2d+18:19:11.828  READ FPDMA QUEUED
  27 00 00 00 00 00 00 00 00 00 00 e0 00  2d+18:19:11.827  READ NATIVE MAX ADDRESS EXT [OBS-ACS-3]
  ec 00 00 00 00 00 00 00 00 00 00 a0 00  2d+18:19:11.826  IDENTIFY DEVICE

Error 81 [0] occurred at disk power-on lifetime: 39731 hours (1655 days + 11 hours)
  When the command that caused the error occurred, the device was active or idle.

  After command completion occurred, registers were:
  ER -- ST COUNT  LBA_48  LH LM LL DV DC
  -- -- -- == -- == == == -- -- -- -- --
  40 -- 51 00 00 00 00 02 e3 ea 30 00 00  Error: WP at LBA = 0x02e3ea30 = 48491056

  Commands leading to the command that caused the error were:
  CR FEATR COUNT  LBA_48  LH LM LL DV DC  Powered_Up_Time  Command/Feature_Name
  -- == -- == -- == == == -- -- -- -- --  ---------------  --------------------
  61 00 00 00 68 00 00 13 00 10 08 40 00  2d+18:19:07.910  WRITE FPDMA QUEUED
  60 00 00 00 08 00 00 02 e3 ea 30 40 00  2d+18:19:07.910  READ FPDMA QUEUED
  60 00 00 00 08 00 00 08 44 76 c0 40 00  2d+18:19:07.909  READ FPDMA QUEUED
  61 00 00 00 08 00 00 02 04 d0 f8 40 00  2d+18:19:07.909  WRITE FPDMA QUEUED
  61 00 00 00 08 00 00 02 04 d1 98 40 00  2d+18:19:07.909  WRITE FPDMA QUEUED

Error 80 [19] occurred at disk power-on lifetime: 39731 hours (1655 days + 11 hours)
  When the command that caused the error occurred, the device was active or idle.

  After command completion occurred, registers were:
  ER -- ST COUNT  LBA_48  LH LM LL DV DC
  -- -- -- == -- == == == -- -- -- -- --
  40 -- 51 00 00 00 00 02 e3 ea 30 00 00  Error: UNC at LBA = 0x02e3ea30 = 48491056

  Commands leading to the command that caused the error were:
  CR FEATR COUNT  LBA_48  LH LM LL DV DC  Powered_Up_Time  Command/Feature_Name
  -- == -- == -- == == == -- -- -- -- --  ---------------  --------------------
  60 00 00 00 08 00 00 08 44 76 c0 40 00  2d+18:19:03.953  READ FPDMA QUEUED
  60 00 00 00 08 00 00 02 e3 ea 30 40 00  2d+18:19:03.952  READ FPDMA QUEUED
  27 00 00 00 00 00 00 00 00 00 00 e0 00  2d+18:19:03.951  READ NATIVE MAX ADDRESS EXT [OBS-ACS-3]
  ec 00 00 00 00 00 00 00 00 00 00 a0 00  2d+18:19:03.950  IDENTIFY DEVICE
  ef 00 03 00 46 00 00 00 00 00 00 a0 00  2d+18:19:03.950  SET FEATURES [Set transfer mode]

Error 79 [18] occurred at disk power-on lifetime: 39731 hours (1655 days + 11 hours)
  When the command that caused the error occurred, the device was active or idle.

  After command completion occurred, registers were:
  ER -- ST COUNT  LBA_48  LH LM LL DV DC
  -- -- -- == -- == == == -- -- -- -- --
  40 -- 51 00 00 00 00 02 e3 ea 30 00 00  Error: UNC at LBA = 0x02e3ea30 = 48491056

  Commands leading to the command that caused the error were:
  CR FEATR COUNT  LBA_48  LH LM LL DV DC  Powered_Up_Time  Command/Feature_Name
  -- == -- == -- == == == -- -- -- -- --  ---------------  --------------------
  60 00 00 00 08 00 00 02 e3 ea 30 40 00  2d+18:19:00.030  READ FPDMA QUEUED
  60 00 00 00 08 00 00 02 e3 ea 28 40 00  2d+18:19:00.030  READ FPDMA QUEUED
  60 00 00 00 08 00 00 02 e3 ea 20 40 00  2d+18:19:00.029  READ FPDMA QUEUED
  61 00 00 00 20 00 00 18 40 15 60 40 00  2d+18:19:00.013  WRITE FPDMA QUEUED
  60 00 00 00 08 00 00 0f fc 10 08 40 00  2d+18:19:00.013  READ FPDMA QUEUED

Error 78 [17] occurred at disk power-on lifetime: 39731 hours (1655 days + 11 hours)
  When the command that caused the error occurred, the device was active or idle.

  After command completion occurred, registers were:
  ER -- ST COUNT  LBA_48  LH LM LL DV DC
  -- -- -- == -- == == == -- -- -- -- --
  40 -- 51 00 00 00 00 02 e3 ea 30 00 00  Error: UNC at LBA = 0x02e3ea30 = 48491056

  Commands leading to the command that caused the error were:
  CR FEATR COUNT  LBA_48  LH LM LL DV DC  Powered_Up_Time  Command/Feature_Name
  -- == -- == -- == == == -- -- -- -- --  ---------------  --------------------
  60 00 00 01 00 00 00 02 e3 e9 e0 40 00  2d+18:18:56.017  READ FPDMA QUEUED
  27 00 00 00 00 00 00 00 00 00 00 e0 00  2d+18:18:56.017  READ NATIVE MAX ADDRESS EXT [OBS-ACS-3]
  ec 00 00 00 00 00 00 00 00 00 00 a0 00  2d+18:18:56.016  IDENTIFY DEVICE
  ef 00 03 00 46 00 00 00 00 00 00 a0 00  2d+18:18:56.016  SET FEATURES [Set transfer mode]
  27 00 00 00 00 00 00 00 00 00 00 e0 00  2d+18:18:56.015  READ NATIVE MAX ADDRESS EXT [OBS-ACS-3]

SMART Extended Self-test Log Version: 1 (1 sectors)
Num  Test_Description    Status                  Remaining  LifeTime(hours)  LBA_of_first_error
# 1  Extended offline    Completed without error       00%     49691         -
# 2  Extended offline    Completed without error       00%     49523         -
# 3  Extended offline    Completed without error       00%     49355         -
# 4  Extended offline    Completed without error       00%     49211         -
# 5  Extended offline    Completed without error       00%     49043         -
# 6  Extended offline    Completed without error       00%     48875         -
# 7  Extended offline    Completed without error       00%     48707         -
# 8  Extended offline    Completed without error       00%     48539         -
# 9  Extended offline    Completed without error       00%     48371         -
#10  Extended offline    Completed without error       00%     48203         -
#11  Extended offline    Completed without error       00%     48097         -
#12  Extended offline    Completed: read failure       90%     47981         48491056
#13  Extended offline    Completed: read failure       90%     47981         48491056
#14  Extended offline    Completed: read failure       90%     47813         48491056
#15  Extended offline    Completed: read failure       90%     47644         48491056
#16  Extended offline    Completed: read failure       90%     47478         48491056
#17  Extended offline    Completed: read failure       90%     47310         48491056
#18  Extended offline    Completed: read failure       90%     47142         48491056
#19  Extended offline    Completed: read failure       90%     46974         48491056
8 of 8 failed self-tests are outdated by newer successful extended offline self-test # 1

SMART Selective self-test log data structure revision number 1
 SPAN  MIN_LBA  MAX_LBA  CURRENT_TEST_STATUS
    1        0        0  Not_testing
    2        0        0  Not_testing
    3        0        0  Not_testing
    4        0        0  Not_testing
    5        0        0  Not_testing
Selective self-test flags (0x0):
  After scanning selected spans, do NOT read-scan remainder of disk.
If Selective self-test is pending on power-up, resume after 0 minute delay.

SCT Status Version:                  3
SCT Version (vendor specific):       522 (0x020a)
Device State:                        Active (0)
Current Temperature:                    38 Celsius
Power Cycle Min/Max Temperature:     37/38 Celsius
Lifetime    Min/Max Temperature:     21/54 Celsius
Under/Over Temperature Limit Count:   0/0

SCT Temperature History Version:     2
Temperature Sampling Period:         1 minute
Temperature Logging Interval:        59 minutes
Min/Max recommended Temperature:     14/55 Celsius
Min/Max Temperature Limit:           10/60 Celsius
Temperature History Size (Index):    128 (37)

SCT Error Recovery Control:
           Read: Disabled
          Write: Disabled

Device Statistics (GP/SMART Log 0x04) not supported

Pending Defects log (GP Log 0x0c) not supported

SATA Phy Event Counters (GP Log 0x11)
ID      Size     Value  Description
0x000a  2            9  Device-to-host register FISes sent due to a COMRESET
0x0001  2            0  Command failed due to ICRC error
0x0003  2            0  R_ERR response for device-to-host data FIS
0x0004  2            0  R_ERR response for host-to-device data FIS
0x0006  2            0  R_ERR response for device-to-host non-data FIS
0x0007  2            0  R_ERR response for host-to-device non-data FIS



