smartctl 7.1 2019-12-30 r5022 [x86_64-linux-5.4.0-72-generic] (local build)
Copyright (C) 2002-19, Bruce Allen, Christian Franke, www.smartmontools.org

=== START OF INFORMATION SECTION ===
Model Family:     SK hynix SATA SSDs
Device Model:     SK hynix SC311 SATA 256GB
Serial Number:    --
Firmware Version: 70002P10
User Capacity:    256,060,514,304 bytes [256 GB]
Sector Sizes:     512 bytes logical, 4096 bytes physical
Rotation Rate:    Solid State Device
Form Factor:      M.2
Device is:        In smartctl database [for details use: -P show]
ATA Version is:   ACS-3 (minor revision not indicated)
SATA Version is:  SATA 3.2, 6.0 Gb/s (current: 6.0 Gb/s)
Local Time is:    Sat May  8 06:12:08 2021 +04
SMART support is: Available - device has SMART capability.
SMART support is: Enabled
AAM feature is:   Unavailable
APM level is:     254 (maximum performance)
Rd look-ahead is: Enabled
Write cache is:   Enabled
DSN feature is:   Unavailable
ATA Security is:  Disabled, frozen [SEC2]
Wt Cache Reorder: Unknown

=== START OF READ SMART DATA SECTION ===
SMART overall-health self-assessment test result: PASSED

General SMART Values:
Offline data collection status:  (0x05)	Offline data collection activity
					was aborted by an interrupting command from host.
					Auto Offline Data Collection: Disabled.
Self-test execution status:      (  25)	The self-test routine was aborted by
					the host.
Total time to complete Offline 
data collection: 		(    8) seconds.
Offline data collection
capabilities: 			 (0x51) SMART execute Offline immediate.
					No Auto Offline data collection support.
					Suspend Offline collection upon new
					command.
					No Offline surface scan supported.
					Self-test supported.
					No Conveyance Self-test supported.
					Selective Self-test supported.
SMART capabilities:            (0x0002)	Does not save SMART data before
					entering power-saving mode.
					Supports SMART auto save timer.
Error logging capability:        (0x01)	Error logging supported.
					General Purpose Logging supported.
Short self-test routine 
recommended polling time: 	 (   2) minutes.
Extended self-test routine
recommended polling time: 	 (  40) minutes.
SCT capabilities: 	       (0x003d)	SCT Status supported.
					SCT Error Recovery Control supported.
					SCT Feature Control supported.
					SCT Data Table supported.

SMART Attributes Data Structure revision number: 0
Vendor Specific SMART Attributes with Thresholds:
ID# ATTRIBUTE_NAME          FLAGS    VALUE WORST THRESH FAIL RAW_VALUE
  1 Raw_Read_Error_Rate     POSR--   166   166   006    -    0
  5 Retired_Block_Count     -O--CK   253   253   036    -    0
  9 Power_On_Hours          -O--CK   096   096   000    -    4037
 12 Power_Cycle_Count       -O--CK   100   100   020    -    2772
100 Total_Erase_Count       -O--CK   100   100   000    -    1236043
168 Min_Erase_Count         -O--CK   099   099   000    -    16
169 Max_Erase_Count         -O--CK   095   095   000    -    78
174 Unexpect_Power_Loss_Ct  ----CK   100   100   000    -    50
175 Program_Fail_Count_Chip -O--CK   253   253   000    -    0
176 Unused_Rsvd_Blk_Cnt_Tot -O--CK   253   253   000    -    0
177 Wear_Leveling_Count     -O--CK   098   001   000    -    44
178 Used_Rsvd_Blk_Cnt_Chip  -O--CK   253   253   000    -    0
179 Used_Rsvd_Blk_Cnt_Tot   -O--CK   253   253   000    -    0
180 Erase_Fail_Count        -O--CK   100   100   000    -    780
181 Non4k_Aligned_Access    -O--CK   253   253   000    -    0
182 Erase_Fail_Count_Total  -O--CK   253   253   000    -    0
184 End-to-End_Error        -O--CK   253   253   000    -    0
187 Reported_Uncorrect      -O--CK   253   253   000    -    0
188 Command_Timeout         -O--CK   100   100   000    -    418
194 Temperature_Celsius     -O----   041   015   000    -    41 (Min/Max 15/55)
195 Hardware_ECC_Recovered  -O--CK   253   253   000    -    0
196 Reallocated_Event_Count -O--CK   253   253   036    -    0
198 Offline_Uncorrectable   -O--CK   253   253   000    -    0
199 UDMA_CRC_Error_Count    -O--CK   253   253   000    -    0
204 Soft_ECC_Correction     -OSR--   001   001   000    -    109074
212 Phy_Error_Count         -O--CK   100   100   000    -    8096718
233 Media_Wearout_Indicator -O--CK   004   001   000    -    97
234 Unknown_SK_hynix_Attrib -O--CK   100   100   000    -    22705795088
241 Total_Writes_GiB        -O--CK   100   100   000    -    31686501045
242 Total_Reads_GiB         -O--CK   100   100   000    -    37061331687
                            ||||||_ K auto-keep
                            |||||__ C event count
                            ||||___ R error rate
                            |||____ S speed/performance
                            ||_____ O updated online
                            |______ P prefailure warning

General Purpose Log Directory Version 1
SMART           Log Directory Version 1 [multi-sector log support]
Address    Access  R/W   Size  Description
0x00       GPL,SL  R/O      1  Log Directory
0x01           SL  R/O      1  Summary SMART error log
0x02           SL  R/O      4  Comprehensive SMART error log
0x03       GPL     R/O      5  Ext. Comprehensive SMART error log
0x04       GPL,SL  R/O      8  Device Statistics log
0x06           SL  R/O      1  SMART self-test log
0x07       GPL     R/O      2  Extended self-test log
0x09           SL  R/W      1  Selective self-test log
0x10       GPL     R/O      1  NCQ Command Error log
0x11       GPL     R/O      1  SATA Phy Event Counters log
0x30       GPL     R/O      8  IDENTIFY DEVICE data log
0x80-0x9f  GPL,SL  R/W     16  Host vendor specific log
0xe0       GPL,SL  R/W      1  SCT Command/Status
0xe1       GPL,SL  R/W      1  SCT Data Transfer

SMART Extended Comprehensive Error Log Version: 1 (5 sectors)
No Errors Logged

SMART Extended Self-test Log Version: 1 (2 sectors)
Num  Test_Description    Status                  Remaining  LifeTime(hours)  LBA_of_first_error
# 1  Short offline       Aborted by host               90%      3974         -
# 2  Short offline       Completed without error       00%      3552         -
# 3  Short offline       Aborted by host               90%      1008         -
# 4  Short offline       Aborted by host               50%       966         -
# 5  Short offline       Aborted by host               80%       965         -
# 6  Short offline       Aborted by host               90%       494         -
# 7  Short offline       Aborted by host               90%        13         -
# 8  Short offline       Aborted by host               90%        13         -
# 9  Short offline       Interrupted (host reset)      80%         6         -
#10  Short offline       Aborted by host               90%         6         -
#11  Short offline       Aborted by host               90%         5         -

Warning! SMART Selective Self-Test Log Structure error: invalid SMART checksum.
SMART Selective self-test log data structure revision number 0
Note: revision number not 1 implies that no selective self-test has ever been run
 SPAN  MIN_LBA  MAX_LBA  CURRENT_TEST_STATUS
    1        0        0  Not_testing
    2        0        0  Not_testing
    3        0        0  Not_testing
    4        0        0  Not_testing
    5        0        0  Not_testing
Selective self-test flags (0x0):
  After scanning selected spans, do NOT read-scan remainder of disk.
If Selective self-test is pending on power-up, resume after 0 minute delay.

SCT Status Version:                  3
SCT Version (vendor specific):       1 (0x0001)
Device State:                        Active (0)
Current Temperature:                    41 Celsius
Power Cycle Min/Max Temperature:     38/52 Celsius
Lifetime    Min/Max Temperature:      1/-1 Celsius
Specified Max Operating Temperature:    80 Celsius
Under/Over Temperature Limit Count:  124/0

SCT Temperature History Version:     2
Temperature Sampling Period:         1 minute
Temperature Logging Interval:        1 minute
Min/Max recommended Temperature:     -20/80 Celsius
Min/Max Temperature Limit:           -20/125 Celsius
Temperature History Size (Index):    192 (129)

SCT Error Recovery Control:
           Read:     80 (8.0 seconds)
          Write:     80 (8.0 seconds)

Device Statistics (GP Log 0x04)
Page  Offset Size        Value Flags Description
0x01  =====  =               =  ===  == General Statistics (rev 2) ==
0x01  0x008  4            2772  ---  Lifetime Power-On Resets
0x01  0x010  4            4037  ---  Power-on Hours
0x01  0x018  6     31686501045  ---  Logical Sectors Written
0x01  0x020  6       411872915  ---  Number of Write Commands
0x01  0x028  6     37061331687  ---  Logical Sectors Read
0x01  0x030  6       589327783  ---  Number of Read Commands
0x01  0x038  6   1592844679925  ---  Date and Time TimeStamp
0x04  =====  =               =  ===  == General Errors Statistics (rev 1) ==
0x04  0x008  4               0  ---  Number of Reported Uncorrectable Errors
0x04  0x010  4             418  ---  Resets Between Cmd Acceptance and Completion
0x05  =====  =               =  ===  == Temperature Statistics (rev 1) ==
0x05  0x008  1              41  ---  Current Temperature
0x05  0x010  1              39  ---  Average Short Term Temperature
0x05  0x018  1               0  ---  Average Long Term Temperature
0x05  0x020  1              -1  ---  Highest Temperature
0x05  0x028  1               1  ---  Lowest Temperature
0x05  0x030  1               -  ---  Highest Average Short Term Temperature
0x05  0x038  1              24  ---  Lowest Average Short Term Temperature
0x05  0x040  1               -  ---  Highest Average Long Term Temperature
0x05  0x048  1               -  ---  Lowest Average Long Term Temperature
0x05  0x050  4               0  ---  Time in Over-Temperature
0x05  0x058  1              80  ---  Specified Maximum Operating Temperature
0x05  0x060  4          153730  ---  Time in Under-Temperature
0x05  0x068  1             -20  ---  Specified Minimum Operating Temperature
0x06  =====  =               =  ===  == Transport Statistics (rev 1) ==
0x06  0x008  4           42628  ---  Number of Hardware Resets
0x06  0x018  4               0  ---  Number of Interface CRC Errors
0x07  =====  =               =  ===  == Solid State Device Statistics (rev 1) ==
0x07  0x008  1               2  ---  Percentage Used Endurance Indicator
                                |||_ C monitored condition met
                                ||__ D supports DSN
                                |___ N normalized value

Pending Defects log (GP Log 0x0c) not supported

SATA Phy Event Counters (GP Log 0x11)
ID      Size     Value  Description
0x0001  2            0  Command failed due to ICRC error
0x000a  2            4  Device-to-host register FISes sent due to a COMRESET

