smartctl 7.2 2020-12-30 r5155 [x86_64-linux-5.14.3-arch1-1] (local build)
Copyright (C) 2002-20, Bruce Allen, Christian Franke, www.smartmontools.org

=== START OF INFORMATION SECTION ===
Model Number:                       NE-128
Serial Number:                      --
Firmware Version:                   S0614B0G
PCI Vendor/Subsystem ID:            0x126f
IEEE OUI Identifier:                0x000000
Controller ID:                      1
NVMe Version:                       1.3
Number of Namespaces:               1
Namespace 1 Size/Capacity:          128,035,676,160 [128 GB]
Namespace 1 Formatted LBA Size:     512
Namespace 1 IEEE EUI-64:            010000 ...
Local Time is:                      Tue Sep 21 16:46:51 2021 PDT
Firmware Updates (0x12):            1 Slot, no Reset required
Optional Admin Commands (0x0007):   Security Format Frmw_DL
Optional NVM Commands (0x001f):     Comp Wr_Unc DS_Mngmt Wr_Zero Sav/Sel_Feat
Log Page Attributes (0x03):         S/H_per_NS Cmd_Eff_Lg
Maximum Data Transfer Size:         64 Pages
Warning  Comp. Temp. Threshold:     70 Celsius
Critical Comp. Temp. Threshold:     80 Celsius
Namespace 1 Features (0x04):        Dea/Unw_Error

Supported Power States
St Op     Max   Active     Idle   RL RT WL WT  Ent_Lat  Ex_Lat
 0 +     9.00W       -        -    0  0  0  0        0       0

Supported LBA Sizes (NSID 0x1)
Id Fmt  Data  Metadt  Rel_Perf
 0 +     512       0         0

=== START OF SMART DATA SECTION ===
SMART overall-health self-assessment test result: PASSED

SMART/Health Information (NVMe Log 0x02)
Critical Warning:                   0x00
Temperature:                        53 Celsius
Available Spare:                    100%
Available Spare Threshold:          10%
Percentage Used:                    0%
Data Units Read:                    73,697 [37.7 GB]
Data Units Written:                 89,913 [46.0 GB]
Host Read Commands:                 187,986
Host Write Commands:                207,619
Controller Busy Time:               4
Power Cycles:                       129
Power On Hours:                     910
Unsafe Shutdowns:                   4
Media and Data Integrity Errors:    0
Error Information Log Entries:      0
Warning  Comp. Temperature Time:    0
Critical Comp. Temperature Time:    0

Error Information (NVMe Log 0x01, 16 of 64 entries)
No Errors Logged



