smartctl 7.2 2020-12-30 r5155 [x86_64-linux-5.10.109-std-def-alt1] (ALT Sisyphus 7.2-alt1)
Copyright (C) 2002-20, Bruce Allen, Christian Franke, www.smartmontools.org

=== START OF INFORMATION SECTION ===
Model Number:                       SAMSUNG MZVLW128HEGR-00000
Serial Number:                      --
Firmware Version:                   CXB7401Q
PCI Vendor/Subsystem ID:            0x144d
IEEE OUI Identifier:                0x002538
Total NVM Capacity:                 128,035,676,160 [128 GB]
Unallocated NVM Capacity:           0
Controller ID:                      2
NVMe Version:                       1.2
Number of Namespaces:               1
Namespace 1 Size/Capacity:          128,035,676,160 [128 GB]
Namespace 1 Utilization:            29,400,780,800 [29.4 GB]
Namespace 1 Formatted LBA Size:     512
Namespace 1 IEEE EUI-64:            002538 ...
Local Time is:                      Tue Apr 12 10:12:53 2022 MSK
Firmware Updates (0x16):            3 Slots, no Reset required
Optional Admin Commands (0x0017):   Security Format Frmw_DL Self_Test
Optional NVM Commands (0x001f):     Comp Wr_Unc DS_Mngmt Wr_Zero Sav/Sel_Feat
Log Page Attributes (0x03):         S/H_per_NS Cmd_Eff_Lg
Warning  Comp. Temp. Threshold:     68 Celsius
Critical Comp. Temp. Threshold:     71 Celsius

Supported Power States
St Op     Max   Active     Idle   RL RT WL WT  Ent_Lat  Ex_Lat
 0 +     7.60W       -        -    0  0  0  0        0       0
 1 +     6.00W       -        -    1  1  1  1        0       0
 2 +     5.10W       -        -    2  2  2  2        0       0
 3 -   0.0400W       -        -    3  3  3  3      210    1500
 4 -   0.0050W       -        -    4  4  4  4     2200    6000

Supported LBA Sizes (NSID 0x1)
Id Fmt  Data  Metadt  Rel_Perf
 0 +     512       0         0

=== START OF SMART DATA SECTION ===
SMART overall-health self-assessment test result: PASSED

SMART/Health Information (NVMe Log 0x02)
Critical Warning:                   0x00
Temperature:                        41 Celsius
Available Spare:                    100%
Available Spare Threshold:          10%
Percentage Used:                    0%
Data Units Read:                    5,665,883 [2.90 TB]
Data Units Written:                 2,608,962 [1.33 TB]
Host Read Commands:                 83,053,028
Host Write Commands:                53,430,956
Controller Busy Time:               482
Power Cycles:                       1,075
Power On Hours:                     250
Unsafe Shutdowns:                   14
Media and Data Integrity Errors:    0
Error Information Log Entries:      2,106
Warning  Comp. Temperature Time:    0
Critical Comp. Temperature Time:    0
Temperature Sensor 1:               41 Celsius
Temperature Sensor 2:               49 Celsius

Error Information (NVMe Log 0x01, 16 of 64 entries)
Num   ErrCount  SQId   CmdId  Status  PELoc          LBA  NSID    VS
  0       2106     0  0x0016  0x4004  0x02c            0     0     -
  1       2105     0  0x0015  0x4004  0x02c            0     0     -
  2       2104     0  0x0016  0x4004  0x02c            0     0     -
  3       2103     0  0x0015  0x4004  0x02c            0     0     -
  4       2102     0  0x0016  0x4004  0x02c            0     0     -
  5       2101     0  0x0015  0x4004  0x02c            0     0     -
  6       2100     0  0x0016  0x4004  0x02c            0     0     -
  7       2099     0  0x0015  0x4004  0x02c            0     0     -
  8       2098     0  0x0016  0x4004  0x02c            0     0     -
  9       2097     0  0x0015  0x4004  0x02c            0     0     -
 10       2096     0  0x0016  0x4004  0x02c            0     0     -
 11       2095     0  0x0015  0x4004  0x02c            0     0     -
 12       2094     0  0x0016  0x4004  0x02c            0     0     -
 13       2093     0  0x0015  0x4004  0x02c            0     0     -
 14       2092     0  0x0016  0x4004  0x02c            0     0     -
 15       2091     0  0x0015  0x4004  0x02c            0     0     -
... (48 entries not read)

