smartctl 7.4 2023-08-01 r5530 [x86_64-linux-6.14.0-desktop-0.rc4.2omv2590] (OpenMandriva Lx 7.4-1)
Copyright (C) 2002-23, Bruce Allen, Christian Franke, www.smartmontools.org

=== START OF INFORMATION SECTION ===
Model Number:                       KINGSTON SNV2S1000G
Serial Number:                      --
Firmware Version:                   SBM02103
PCI Vendor/Subsystem ID:            0x2646
IEEE OUI Identifier:                0x0026b7
Controller ID:                      1
NVMe Version:                       1.4
Number of Namespaces:               1
Namespace 1 Size/Capacity:          1,000,204,886,016 [1.00 TB]
Namespace 1 Formatted LBA Size:     512
Namespace 1 IEEE EUI-64:            0026b7 ...
Local Time is:                      Fri Mar 14 11:26:20 2025 CET
Firmware Updates (0x12):            1 Slot, no Reset required
Optional Admin Commands (0x0016):   Format Frmw_DL Self_Test
Optional NVM Commands (0x009f):     Comp Wr_Unc DS_Mngmt Wr_Zero Sav/Sel_Feat Verify
Log Page Attributes (0x12):         Cmd_Eff_Lg Pers_Ev_Lg
Maximum Data Transfer Size:         64 Pages
Warning  Comp. Temp. Threshold:     83 Celsius
Critical Comp. Temp. Threshold:     90 Celsius

Supported Power States
St Op     Max   Active     Idle   RL RT WL WT  Ent_Lat  Ex_Lat
 0 +     5.00W       -        -    0  0  0  0        0       0
 1 +     3.50W       -        -    1  1  1  1        0     200
 2 +     2.50W       -        -    2  2  2  2        0    1000
 3 -     1.50W       -        -    3  3  3  3     5000    5000
 4 -     1.50W       -        -    4  4  4  4    20000   70000

Supported LBA Sizes (NSID 0x1)
Id Fmt  Data  Metadt  Rel_Perf
 0 +     512       0         0

=== START OF SMART DATA SECTION ===
SMART overall-health self-assessment test result: PASSED

SMART/Health Information (NVMe Log 0x02)
Critical Warning:                   0x00
Temperature:                        27 Celsius
Available Spare:                    100%
Available Spare Threshold:          10%
Percentage Used:                    0%
Data Units Read:                    8,138,016 [4.16 TB]
Data Units Written:                 6,999,131 [3.58 TB]
Host Read Commands:                 33,067,809
Host Write Commands:                28,087,653
Controller Busy Time:               977
Power Cycles:                       668
Power On Hours:                     7,526
Unsafe Shutdowns:                   40
Media and Data Integrity Errors:    0
Error Information Log Entries:      0
Warning  Comp. Temperature Time:    0
Critical Comp. Temperature Time:    0

Error Information (NVMe Log 0x01, 16 of 64 entries)
No Errors Logged

Read Self-test Log failed: Invalid Field in Command (0x002)



