smartctl 7.3 2022-02-28 r5338 [x86_64-linux-6.1.36-1-lts] (local build)
Copyright (C) 2002-22, Bruce Allen, Christian Franke, www.smartmontools.org

=== START OF INFORMATION SECTION ===
Device Model:     LITEONIT LCT-512M3S 2.5 7mm 512GB
Serial Number:    --
Firmware Version: VSDD
User Capacity:    512,110,190,592 bytes [512 GB]
Sector Size:      512 bytes logical/physical
Rotation Rate:    Solid State Device
TRIM Command:     Available
Device is:        Not in smartctl database 7.3/5319
ATA Version is:   ATA8-ACS, ATA/ATAPI-7 T13/1532D revision 4a
SATA Version is:  SATA 3.0, 6.0 Gb/s
Local Time is:    Sat Jul  1 17:49:55 2023 CDT
SMART support is: Available - device has SMART capability.
SMART support is: Enabled
AAM feature is:   Disabled
APM feature is:   Unavailable
Rd look-ahead is: Enabled
Write cache is:   Enabled
DSN feature is:   Unavailable
ATA Security is:  Disabled, NOT FROZEN [SEC1]
Wt Cache Reorder: Enabled

=== START OF READ SMART DATA SECTION ===
SMART overall-health self-assessment test result: PASSED

General SMART Values:
Offline data collection status:  (0x00)	Offline data collection activity
					was never started.
					Auto Offline Data Collection: Disabled.
Self-test execution status:      (   0)	The previous self-test routine completed
					without error or no self-test has ever 
					been run.
Total time to complete Offline 
data collection: 		(   10) seconds.
Offline data collection
capabilities: 			 (0x15) SMART execute Offline immediate.
					No Auto Offline data collection support.
					Abort Offline collection upon new
					command.
					No Offline surface scan supported.
					Self-test supported.
					No Conveyance Self-test supported.
					No Selective Self-test supported.
SMART capabilities:            (0x0002)	Does not save SMART data before
					entering power-saving mode.
					Supports SMART auto save timer.
Error logging capability:        (0x00)	Error logging supported.
					General Purpose Logging supported.
Short self-test routine 
recommended polling time: 	 (   1) minutes.
Extended self-test routine
recommended polling time: 	 (  10) minutes.
SCT capabilities: 	       (0x003d)	SCT Status supported.
					SCT Error Recovery Control supported.
					SCT Feature Control supported.
					SCT Data Table supported.

SMART Attributes Data Structure revision number: 1
Vendor Specific SMART Attributes with Thresholds:
ID# ATTRIBUTE_NAME          FLAGS    VALUE WORST THRESH FAIL RAW_VALUE
  5 Reallocated_Sector_Ct   PO----   100   100   000    -    0
 12 Power_Cycle_Count       PO----   100   100   000    -    9413
175 Program_Fail_Count_Chip PO----   100   100   000    -    0
176 Erase_Fail_Count_Chip   PO----   100   100   000    -    0
177 Wear_Leveling_Count     PO----   100   100   000    -    620225
178 Used_Rsvd_Blk_Cnt_Chip  PO----   100   100   000    -    1
179 Used_Rsvd_Blk_Cnt_Tot   PO----   100   100   000    -    1
180 Unused_Rsvd_Blk_Cnt_Tot PO----   100   100   005    -    5120
181 Program_Fail_Cnt_Total  PO----   100   100   000    -    0
182 Erase_Fail_Count_Total  PO----   100   100   000    -    0
187 Reported_Uncorrect      PO----   100   100   000    -    1
195 Hardware_ECC_Recovered  PO----   100   100   000    -    0
241 Total_LBAs_Written      PO----   100   100   000    -    1503779
242 Total_LBAs_Read         PO----   100   100   000    -    1450476
                            ||||||_ K auto-keep
                            |||||__ C event count
                            ||||___ R error rate
                            |||____ S speed/performance
                            ||_____ O updated online
                            |______ P prefailure warning

General Purpose Log Directory Version 0
SMART           Log Directory Version 0
Address    Access  R/W   Size  Description
0x00       GPL,SL  R/O      1  Log Directory
0x01       GPL,SL  R/O      1  Summary SMART error log
0x06       GPL,SL  R/O      1  SMART self-test log
0x07       GPL,SL  R/O      1  Extended self-test log
0x10       GPL,SL  R/O      1  NCQ Command Error log
0x11       GPL,SL  R/O      1  SATA Phy Event Counters log
0x80-0x9f  GPL,SL  R/W      1  Host vendor specific log
0xe0       GPL,SL  R/W      1  SCT Command/Status
0xe1       GPL,SL  R/W      1  SCT Data Transfer

SMART Extended Comprehensive Error Log (GP Log 0x03) not supported

SMART Error Log Version: 1
Warning: ATA error count 0 inconsistent with error log pointer 2

ATA Error Count: 0
	CR = Command Register [HEX]
	FR = Features Register [HEX]
	SC = Sector Count Register [HEX]
	SN = Sector Number Register [HEX]
	CL = Cylinder Low Register [HEX]
	CH = Cylinder High Register [HEX]
	DH = Device/Head Register [HEX]
	DC = Device Command Register [HEX]
	ER = Error register [HEX]
	ST = Status register [HEX]
Powered_Up_Time is measured from power on, and printed as
DDd+hh:mm:SS.sss where DD=days, hh=hours, mm=minutes,
SS=sec, and sss=millisec. It "wraps" after 49.710 days.

Error 0 occurred at disk power-on lifetime: 0 hours (0 days + 0 hours)
  When the command that caused the error occurred, the device was in an unknown state.

  After command completion occurred, registers were:
  ER ST SC SN CL CH DH
  -- -- -- -- -- -- --
  67 a0 34 00 00 00 20  Device Fault

  Commands leading to the command that caused the error were:
  CR FR SC SN CL CH DH DC   Powered_Up_Time  Command/Feature_Name
  -- -- -- -- -- -- -- --  ----------------  --------------------
  a0 67 34 00 00 00 20 41   7d+08:31:00.842  PACKET
  a0 67 34 00 00 00 20 41   7d+08:31:00.842  PACKET
  a0 67 34 00 00 00 20 41   7d+08:31:00.842  PACKET
  a0 67 34 00 00 00 20 41   7d+08:31:00.842  PACKET
  a0 00 00 00 00 00 20 09   7d+08:31:00.842  PACKET

Error -1 occurred at disk power-on lifetime: 768 hours (32 days + 0 hours)
  When the command that caused the error occurred, the device was in an unknown state.

  After command completion occurred, registers were:
  ER ST SC SN CL CH DH
  -- -- -- -- -- -- --
  00 5c 00 00 20 a0 ea

  Commands leading to the command that caused the error were:
  CR FR SC SN CL CH DH DC   Powered_Up_Time  Command/Feature_Name
  -- -- -- -- -- -- -- --  ----------------  --------------------
  5c 00 00 00 20 a0 ea 34  20d+01:12:02.784  TRUSTED RECEIVE
  5c 00 00 00 20 a0 ea 34  20d+01:12:02.784  TRUSTED RECEIVE
  5c 00 00 00 20 a0 ea 34  20d+01:12:02.784  TRUSTED RECEIVE
  5c 00 00 00 20 a0 ea 34  20d+01:12:02.784  TRUSTED RECEIVE
  5c 00 00 00 20 a0 ea 00  20d+01:12:02.784  TRUSTED RECEIVE

Error -2 occurred at disk power-on lifetime: 0 hours (0 days + 0 hours)
  When the command that caused the error occurred, the device was in an unknown state.

  After command completion occurred, registers were:
  ER ST SC SN CL CH DH
  -- -- -- -- -- -- --
  a0 67 ea 5c e0 25 41

  Commands leading to the command that caused the error were:
  CR FR SC SN CL CH DH DC   Powered_Up_Time  Command/Feature_Name
  -- -- -- -- -- -- -- --  ----------------  --------------------
  67 a0 ea 5c e0 25 41 20      00:00:00.052  [RESERVED FOR SERIAL ATA]
  67 a0 ea 5c e0 25 41 20      00:00:00.052  [RESERVED FOR SERIAL ATA]
  67 a0 ea 5c e0 25 41 20      00:00:00.052  [RESERVED FOR SERIAL ATA]
  67 a0 ea 5c e0 25 41 20      00:00:00.052  [RESERVED FOR SERIAL ATA]
  00 00 00 00 00 03 09 00      00:00:00.000  NOP [Abort queued commands]

Error -3 occurred at disk power-on lifetime: 0 hours (0 days + 0 hours)
  When the command that caused the error occurred, the device was in an unknown state.

  After command completion occurred, registers were:
  ER ST SC SN CL CH DH
  -- -- -- -- -- -- --
  5c 00 e0 25 41 67 34

  Commands leading to the command that caused the error were:
  CR FR SC SN CL CH DH DC   Powered_Up_Time  Command/Feature_Name
  -- -- -- -- -- -- -- --  ----------------  --------------------
  00 5c e0 25 41 67 34 ea  31d+02:14:11.712  NOP [Reserved subcommand] [OBS-ACS-2]
  00 5c e0 25 41 67 34 ea  31d+02:14:11.712  NOP [Reserved subcommand] [OBS-ACS-2]
  00 5c e0 25 41 67 34 ea  31d+02:14:11.712  NOP [Reserved subcommand] [OBS-ACS-2]
  00 5c e0 25 41 67 34 ea  31d+02:14:11.712  NOP [Reserved subcommand] [OBS-ACS-2]
  00 00 00 03 14 00 00 00  31d+02:14:11.712  NOP [Abort queued commands]

Error -4 occurred at disk power-on lifetime: 0 hours (0 days + 0 hours)
  When the command that caused the error occurred, the device was in an unknown state.

  After command completion occurred, registers were:
  ER ST SC SN CL CH DH
  -- -- -- -- -- -- --
  25 00 41 67 34 00 00

  Commands leading to the command that caused the error were:
  CR FR SC SN CL CH DH DC   Powered_Up_Time  Command/Feature_Name
  -- -- -- -- -- -- -- --  ----------------  --------------------
  00 25 41 67 34 00 00 e0  18d+01:01:20.288  NOP [Reserved subcommand] [OBS-ACS-2]
  00 25 41 67 34 00 00 e0  18d+01:01:20.288  NOP [Reserved subcommand] [OBS-ACS-2]
  00 25 41 67 34 00 00 e0  18d+01:01:20.288  NOP [Reserved subcommand] [OBS-ACS-2]
  00 25 3d 0e 72 00 00 e0  18d+01:01:20.288  NOP [Reserved subcommand] [OBS-ACS-2]
  00 03 09 00 00 00 00 00  18d+01:01:20.288  NOP [Reserved subcommand] [OBS-ACS-2]

SMART Extended Self-test Log Version: 1 (1 sectors)
No self-tests have been logged.  [To run self-tests, use: smartctl -t]

Selective Self-tests/Logging not supported

SCT Status Version:                  3
SCT Version (vendor specific):       1 (0x0001)
Device State:                        Active (0)
Current Temperature:                     ? Celsius
Power Cycle Min/Max Temperature:      ?/ ? Celsius
Lifetime    Min/Max Temperature:      ?/ ? Celsius
Under/Over Temperature Limit Count:   0/0

SCT Temperature History Version:     2
Temperature Sampling Period:         0 minutes
Temperature Logging Interval:        0 minutes
Min/Max recommended Temperature:      ?/ ? Celsius
Min/Max Temperature Limit:            ?/ ? Celsius
Temperature History Size (Index):    128 (0)

SCT Error Recovery Control:
           Read:      2 (0.2 seconds)
          Write:      2 (0.2 seconds)

Device Statistics (GP/SMART Log 0x04) not supported

Pending Defects log (GP Log 0x0c) not supported

SATA Phy Event Counters (GP Log 0x11)
ID      Size     Value  Description
0x0001  2            0  Command failed due to ICRC error
0x0002  2            0  R_ERR response for data FIS
0x0003  2            0  R_ERR response for device-to-host data FIS
0x0004  2            0  R_ERR response for host-to-device data FIS
0x0005  2            0  R_ERR response for non-data FIS
0x0006  2            0  R_ERR response for device-to-host non-data FIS
0x0007  2            0  R_ERR response for host-to-device non-data FIS
0x0008  2            0  Device-to-host non-data FIS retries
0x0009  2            0  Transition from drive PhyRdy to drive PhyNRdy
0x000a  2            6  Device-to-host register FISes sent due to a COMRESET
0x000b  2            0  CRC errors within host-to-device FIS
0x000d  2            0  Non-CRC errors within host-to-device FIS
0x000f  2            0  R_ERR response for host-to-device data FIS, CRC
0x0010  2            0  R_ERR response for host-to-device data FIS, non-CRC
0x0012  2            0  R_ERR response for host-to-device non-data FIS, CRC
0x0013  2            0  R_ERR response for host-to-device non-data FIS, non-CRC

