smartctl 7.1 2019-12-30 r5022 [x86_64-linux-5.8.0-41-generic] (local build)
Copyright (C) 2002-19, Bruce Allen, Christian Franke, www.smartmontools.org

=== START OF INFORMATION SECTION ===
Model Family:     Seagate Barracuda 7200.14 (AF)
Device Model:     ST1000DM003-1SB102
Serial Number:    --
LU WWN Device Id: 5 000c50 ...
Firmware Version: CC43
User Capacity:    1,000,204,886,016 bytes [1.00 TB]
Sector Sizes:     512 bytes logical, 4096 bytes physical
Rotation Rate:    7200 rpm
Form Factor:      3.5 inches
Device is:        In smartctl database [for details use: -P show]
ATA Version is:   ATA8-ACS T13/1699-D revision 4
SATA Version is:  SATA 3.0, 6.0 Gb/s (current: 6.0 Gb/s)
Local Time is:    Sun Feb  7 12:40:17 2021 CET
SMART support is: Available - device has SMART capability.
SMART support is: Enabled
AAM feature is:   Unavailable
APM level is:     254 (maximum performance)
Rd look-ahead is: Enabled
Write cache is:   Enabled
DSN feature is:   Unavailable
ATA Security is:  Disabled, frozen [SEC2]
Wt Cache Reorder: Unavailable

=== START OF READ SMART DATA SECTION ===
SMART overall-health self-assessment test result: PASSED

General SMART Values:
Offline data collection status:  (0x82)	Offline data collection activity
					was completed without error.
					Auto Offline Data Collection: Enabled.
Self-test execution status:      (   0)	The previous self-test routine completed
					without error or no self-test has ever 
					been run.
Total time to complete Offline 
data collection: 		(    0) seconds.
Offline data collection
capabilities: 			 (0x7b) SMART execute Offline immediate.
					Auto Offline data collection on/off support.
					Suspend Offline collection upon new
					command.
					Offline surface scan supported.
					Self-test supported.
					Conveyance Self-test supported.
					Selective Self-test supported.
SMART capabilities:            (0x0003)	Saves SMART data before entering
					power-saving mode.
					Supports SMART auto save timer.
Error logging capability:        (0x01)	Error logging supported.
					General Purpose Logging supported.
Short self-test routine 
recommended polling time: 	 (   1) minutes.
Extended self-test routine
recommended polling time: 	 ( 102) minutes.
Conveyance self-test routine
recommended polling time: 	 (   2) minutes.
SCT capabilities: 	       (0x1085)	SCT Status supported.

SMART Attributes Data Structure revision number: 10
Vendor Specific SMART Attributes with Thresholds:
ID# ATTRIBUTE_NAME          FLAGS    VALUE WORST THRESH FAIL RAW_VALUE
  1 Raw_Read_Error_Rate     POSR--   083   063   006    -    233377406
  3 Spin_Up_Time            PO----   097   097   000    -    0
  4 Start_Stop_Count        -O--CK   092   092   020    -    8270
  5 Reallocated_Sector_Ct   PO--CK   100   100   010    -    0
  7 Seek_Error_Rate         POSR--   087   060   045    -    508379082
  9 Power_On_Hours          -O--CK   086   086   000    -    12432
 10 Spin_Retry_Count        PO--C-   100   100   097    -    0
 12 Power_Cycle_Count       -O--CK   093   093   020    -    7850
183 Runtime_Bad_Block       -O--CK   066   066   000    -    34
184 End-to-End_Error        -O--CK   100   100   099    -    0
187 Reported_Uncorrect      -O--CK   003   003   000    -    97
188 Command_Timeout         -O--CK   100   092   000    -    1 1 128
189 High_Fly_Writes         -O-RCK   100   100   000    -    0
190 Airflow_Temperature_Cel -O---K   076   051   040    -    24 (Min/Max 20/24)
193 Load_Cycle_Count        -O--CK   096   096   000    -    8330
194 Temperature_Celsius     -O---K   024   014   000    -    24 (255 248 0 0 0)
195 Hardware_ECC_Recovered  -O-RC-   001   001   000    -    233377406
197 Current_Pending_Sector  -O--C-   100   100   000    -    0
198 Offline_Uncorrectable   ----C-   100   100   000    -    0
199 UDMA_CRC_Error_Count    -OSRCK   200   186   000    -    409
240 Head_Flying_Hours       ------   100   253   000    -    12301h+35m+39.635s
241 Total_LBAs_Written      ------   100   253   000    -    102667008955
242 Total_LBAs_Read         ------   100   253   000    -    126767384689
                            ||||||_ K auto-keep
                            |||||__ C event count
                            ||||___ R error rate
                            |||____ S speed/performance
                            ||_____ O updated online
                            |______ P prefailure warning

General Purpose Log Directory Version 1
SMART           Log Directory Version 1 [multi-sector log support]
Address    Access  R/W   Size  Description
0x00       GPL,SL  R/O      1  Log Directory
0x01           SL  R/O      1  Summary SMART error log
0x02           SL  R/O      5  Comprehensive SMART error log
0x03       GPL     R/O      5  Ext. Comprehensive SMART error log
0x04       GPL,SL  R/O      8  Device Statistics log
0x06           SL  R/O      1  SMART self-test log
0x07       GPL     R/O      1  Extended self-test log
0x09           SL  R/W      1  Selective self-test log
0x10       GPL     R/O      1  NCQ Command Error log
0x11       GPL     R/O      1  SATA Phy Event Counters log
0x21       GPL     R/O      1  Write stream error log
0x22       GPL     R/O      1  Read stream error log
0x24       GPL     R/O    512  Current Device Internal Status Data log
0x30       GPL,SL  R/O      9  IDENTIFY DEVICE data log
0x80-0x9f  GPL,SL  R/W     16  Host vendor specific log
0xa1       GPL,SL  VS      20  Device vendor specific log
0xa2       GPL     VS    4120  Device vendor specific log
0xa8       GPL,SL  VS     129  Device vendor specific log
0xa9       GPL,SL  VS       1  Device vendor specific log
0xab       GPL     VS       1  Device vendor specific log
0xb0       GPL     VS    4800  Device vendor specific log
0xbe-0xbf  GPL     VS   65535  Device vendor specific log
0xc0       GPL,SL  VS       1  Device vendor specific log
0xc1       GPL,SL  VS      10  Device vendor specific log
0xe0       GPL,SL  R/W      1  SCT Command/Status
0xe1       GPL,SL  R/W      1  SCT Data Transfer

SMART Extended Comprehensive Error Log Version: 1 (5 sectors)
Device Error Count: 161 (device log contains only the most recent 20 errors)
	CR     = Command Register
	FEATR  = Features Register
	COUNT  = Count (was: Sector Count) Register
	LBA_48 = Upper bytes of LBA High/Mid/Low Registers ]  ATA-8
	LH     = LBA High (was: Cylinder High) Register    ]   LBA
	LM     = LBA Mid (was: Cylinder Low) Register      ] Register
	LL     = LBA Low (was: Sector Number) Register     ]
	DV     = Device (was: Device/Head) Register
	DC     = Device Control Register
	ER     = Error register
	ST     = Status register
Powered_Up_Time is measured from power on, and printed as
DDd+hh:mm:SS.sss where DD=days, hh=hours, mm=minutes,
SS=sec, and sss=millisec. It "wraps" after 49.710 days.

Error 161 [0] occurred at disk power-on lifetime: 66 hours (2 days + 18 hours)
  When the command that caused the error occurred, the device was active or idle.

  After command completion occurred, registers were:
  ER -- ST COUNT  LBA_48  LH LM LL DV DC
  -- -- -- == -- == == == -- -- -- -- --
  40 -- 51 00 00 00 00 53 b9 31 0f 00 00  Error: UNC at LBA = 0x53b9310f = 1404645647

  Commands leading to the command that caused the error were:
  CR FEATR COUNT  LBA_48  LH LM LL DV DC  Powered_Up_Time  Command/Feature_Name
  -- == -- == -- == == == -- -- -- -- --  ---------------  --------------------
  60 00 00 00 01 00 00 53 b9 31 0f 40 00     01:15:01.061  READ FPDMA QUEUED
  61 00 00 00 08 00 00 01 da 62 f0 40 00     01:15:01.061  WRITE FPDMA QUEUED
  61 00 00 00 08 00 00 00 19 54 f0 40 00     01:15:01.061  WRITE FPDMA QUEUED
  b0 00 d0 00 00 00 00 00 c2 4f 00 e0 00     01:15:00.954  SMART READ DATA
  ea 00 00 00 00 00 00 00 00 00 00 00 00     01:15:00.953  FLUSH CACHE EXT

Error 160 [19] occurred at disk power-on lifetime: 66 hours (2 days + 18 hours)
  When the command that caused the error occurred, the device was active or idle.

  After command completion occurred, registers were:
  ER -- ST COUNT  LBA_48  LH LM LL DV DC
  -- -- -- == -- == == == -- -- -- -- --
  40 -- 51 00 00 00 00 53 b9 31 0e 00 00  Error: WP at LBA = 0x53b9310e = 1404645646

  Commands leading to the command that caused the error were:
  CR FEATR COUNT  LBA_48  LH LM LL DV DC  Powered_Up_Time  Command/Feature_Name
  -- == -- == -- == == == -- -- -- -- --  ---------------  --------------------
  61 00 00 00 08 00 00 00 6f 10 88 40 00     01:14:58.602  WRITE FPDMA QUEUED
  60 00 00 00 01 00 00 53 b9 31 0e 40 00     01:14:58.602  READ FPDMA QUEUED
  61 00 00 00 98 00 00 00 70 9c b0 40 00     01:14:58.601  WRITE FPDMA QUEUED
  60 00 00 00 01 00 00 02 0b 57 b1 40 00     01:14:58.601  READ FPDMA QUEUED
  b0 00 d0 00 00 00 00 00 c2 4f 00 e0 00     01:14:58.497  SMART READ DATA

Error 159 [18] occurred at disk power-on lifetime: 66 hours (2 days + 18 hours)
  When the command that caused the error occurred, the device was active or idle.

  After command completion occurred, registers were:
  ER -- ST COUNT  LBA_48  LH LM LL DV DC
  -- -- -- == -- == == == -- -- -- -- --
  40 -- 51 00 00 00 00 53 b9 31 0d 00 00  Error: WP at LBA = 0x53b9310d = 1404645645

  Commands leading to the command that caused the error were:
  CR FEATR COUNT  LBA_48  LH LM LL DV DC  Powered_Up_Time  Command/Feature_Name
  -- == -- == -- == == == -- -- -- -- --  ---------------  --------------------
  61 00 00 00 08 00 00 00 6f 10 08 40 00     01:14:55.969  WRITE FPDMA QUEUED
  61 00 00 00 08 00 00 02 8e 16 78 40 00     01:14:55.968  WRITE FPDMA QUEUED
  61 00 00 00 28 00 00 02 3d 8d a0 40 00     01:14:55.968  WRITE FPDMA QUEUED
  61 00 00 00 28 00 00 01 fb dc b8 40 00     01:14:55.968  WRITE FPDMA QUEUED
  61 00 00 00 08 00 00 00 19 8d 50 40 00     01:14:55.968  WRITE FPDMA QUEUED

Error 158 [17] occurred at disk power-on lifetime: 66 hours (2 days + 18 hours)
  When the command that caused the error occurred, the device was active or idle.

  After command completion occurred, registers were:
  ER -- ST COUNT  LBA_48  LH LM LL DV DC
  -- -- -- == -- == == == -- -- -- -- --
  40 -- 51 00 00 00 00 53 b9 31 0c 00 00  Error: UNC at LBA = 0x53b9310c = 1404645644

  Commands leading to the command that caused the error were:
  CR FEATR COUNT  LBA_48  LH LM LL DV DC  Powered_Up_Time  Command/Feature_Name
  -- == -- == -- == == == -- -- -- -- --  ---------------  --------------------
  60 00 00 00 10 00 00 01 2c 7d c0 40 00     01:14:53.590  READ FPDMA QUEUED
  60 00 00 00 e8 00 00 01 2c 7c d0 40 00     01:14:53.590  READ FPDMA QUEUED
  60 00 00 00 01 00 00 53 b9 31 0c 40 00     01:14:53.550  READ FPDMA QUEUED
  60 00 00 01 00 00 00 01 29 96 f8 40 00     01:14:53.491  READ FPDMA QUEUED
  61 00 00 00 08 00 00 00 1d 8b 30 40 00     01:14:53.491  WRITE FPDMA QUEUED

Error 157 [16] occurred at disk power-on lifetime: 66 hours (2 days + 18 hours)
  When the command that caused the error occurred, the device was active or idle.

  After command completion occurred, registers were:
  ER -- ST COUNT  LBA_48  LH LM LL DV DC
  -- -- -- == -- == == == -- -- -- -- --
  40 -- 51 00 00 00 00 53 b9 31 0b 00 00  Error: WP at LBA = 0x53b9310b = 1404645643

  Commands leading to the command that caused the error were:
  CR FEATR COUNT  LBA_48  LH LM LL DV DC  Powered_Up_Time  Command/Feature_Name
  -- == -- == -- == == == -- -- -- -- --  ---------------  --------------------
  61 00 00 00 08 00 00 00 6f 10 60 40 00     01:14:51.026  WRITE FPDMA QUEUED
  61 00 00 00 08 00 00 02 8e 16 78 40 00     01:14:51.025  WRITE FPDMA QUEUED
  61 00 00 00 08 00 00 00 19 8d 50 40 00     01:14:51.025  WRITE FPDMA QUEUED
  61 00 00 00 60 00 00 00 6f 10 88 40 00     01:14:51.025  WRITE FPDMA QUEUED
  61 00 00 00 90 00 00 00 70 9b 68 40 00     01:14:51.024  WRITE FPDMA QUEUED

Error 156 [15] occurred at disk power-on lifetime: 66 hours (2 days + 18 hours)
  When the command that caused the error occurred, the device was active or idle.

  After command completion occurred, registers were:
  ER -- ST COUNT  LBA_48  LH LM LL DV DC
  -- -- -- == -- == == == -- -- -- -- --
  40 -- 51 00 00 00 00 53 b9 31 0a 00 00  Error: WP at LBA = 0x53b9310a = 1404645642

  Commands leading to the command that caused the error were:
  CR FEATR COUNT  LBA_48  LH LM LL DV DC  Powered_Up_Time  Command/Feature_Name
  -- == -- == -- == == == -- -- -- -- --  ---------------  --------------------
  61 00 00 00 10 00 00 02 8e 16 70 40 00     01:14:48.515  WRITE FPDMA QUEUED
  61 00 00 00 38 00 00 00 6f 10 c8 40 00     01:14:48.515  WRITE FPDMA QUEUED
  61 00 00 00 08 00 00 00 19 8d 50 40 00     01:14:48.515  WRITE FPDMA QUEUED
  60 00 00 00 01 00 00 53 b9 31 0a 40 00     01:14:48.514  READ FPDMA QUEUED
  61 00 00 00 48 00 00 00 6f 10 08 40 00     01:14:48.514  WRITE FPDMA QUEUED

Error 155 [14] occurred at disk power-on lifetime: 66 hours (2 days + 18 hours)
  When the command that caused the error occurred, the device was active or idle.

  After command completion occurred, registers were:
  ER -- ST COUNT  LBA_48  LH LM LL DV DC
  -- -- -- == -- == == == -- -- -- -- --
  40 -- 51 00 00 00 00 53 b9 31 09 00 00  Error: WP at LBA = 0x53b93109 = 1404645641

  Commands leading to the command that caused the error were:
  CR FEATR COUNT  LBA_48  LH LM LL DV DC  Powered_Up_Time  Command/Feature_Name
  -- == -- == -- == == == -- -- -- -- --  ---------------  --------------------
  61 00 00 00 08 00 00 00 6f 10 88 40 00     01:14:46.045  WRITE FPDMA QUEUED
  61 00 00 00 08 00 00 00 1f 9c 50 40 00     01:14:46.045  WRITE FPDMA QUEUED
  61 00 00 00 08 00 00 00 1f 9c 48 40 00     01:14:46.044  WRITE FPDMA QUEUED
  61 00 00 00 08 00 00 00 6f 10 08 40 00     01:14:46.044  WRITE FPDMA QUEUED
  61 00 00 00 a0 00 00 00 70 9a c8 40 00     01:14:46.044  WRITE FPDMA QUEUED

Error 154 [13] occurred at disk power-on lifetime: 66 hours (2 days + 18 hours)
  When the command that caused the error occurred, the device was active or idle.

  After command completion occurred, registers were:
  ER -- ST COUNT  LBA_48  LH LM LL DV DC
  -- -- -- == -- == == == -- -- -- -- --
  40 -- 51 00 00 00 00 53 b9 31 08 00 00  Error: UNC at LBA = 0x53b93108 = 1404645640

  Commands leading to the command that caused the error were:
  CR FEATR COUNT  LBA_48  LH LM LL DV DC  Powered_Up_Time  Command/Feature_Name
  -- == -- == -- == == == -- -- -- -- --  ---------------  --------------------
  60 00 00 00 01 00 00 53 b9 31 08 40 00     01:14:43.589  READ FPDMA QUEUED
  60 00 00 00 01 00 00 53 b9 31 07 40 00     01:14:43.589  READ FPDMA QUEUED
  60 00 00 00 01 00 00 53 b9 31 06 40 00     01:14:43.589  READ FPDMA QUEUED
  60 00 00 00 01 00 00 53 b9 31 05 40 00     01:14:43.588  READ FPDMA QUEUED
  60 00 00 00 01 00 00 53 b9 31 04 40 00     01:14:43.588  READ FPDMA QUEUED

SMART Extended Self-test Log Version: 1 (1 sectors)
Num  Test_Description    Status                  Remaining  LifeTime(hours)  LBA_of_first_error
# 1  Extended offline    Aborted by host               90%      7275         -
# 2  Short offline       Completed without error       00%      7274         -
# 3  Short offline       Completed without error       00%        67         -
# 4  Extended offline    Aborted by host               90%        57         -

SMART Selective self-test log data structure revision number 1
 SPAN  MIN_LBA  MAX_LBA  CURRENT_TEST_STATUS
    1        0        0  Not_testing
    2        0        0  Not_testing
    3        0        0  Not_testing
    4        0        0  Not_testing
    5        0        0  Not_testing
Selective self-test flags (0x0):
  After scanning selected spans, do NOT read-scan remainder of disk.
If Selective self-test is pending on power-up, resume after 0 minute delay.

SCT Status Version:                  3
SCT Version (vendor specific):       522 (0x020a)
Device State:                        Active (0)
Current Temperature:                    22 Celsius
Power Cycle Min/Max Temperature:     20/22 Celsius
Lifetime    Min/Max Temperature:     12/50 Celsius
Under/Over Temperature Limit Count:   0/0

SCT Data Table command not supported

SCT Error Recovery Control command not supported

Device Statistics (GP Log 0x04)
Page  Offset Size        Value Flags Description
0x01  =====  =               =  ===  == General Statistics (rev 1) ==
0x01  0x008  4            7850  ---  Lifetime Power-On Resets
0x01  0x010  4           12432  ---  Power-on Hours
0x01  0x018  6    103553764186  ---  Logical Sectors Written
0x01  0x020  6       946191324  ---  Number of Write Commands
0x01  0x028  6    128377851876  ---  Logical Sectors Read
0x01  0x030  6      1172383188  ---  Number of Read Commands
0x01  0x038  6               -  ---  Date and Time TimeStamp
0x03  =====  =               =  ===  == Rotating Media Statistics (rev 1) ==
0x03  0x008  4            8568  ---  Spindle Motor Power-on Hours
0x03  0x010  4            8553  ---  Head Flying Hours
0x03  0x018  4            8330  ---  Head Load Events
0x03  0x020  4               0  ---  Number of Reallocated Logical Sectors
0x03  0x028  4               0  ---  Read Recovery Attempts
0x03  0x030  4               0  ---  Number of Mechanical Start Failures
0x03  0x038  4               0  ---  Number of Realloc. Candidate Logical Sectors
0x04  =====  =               =  ===  == General Errors Statistics (rev 1) ==
0x04  0x008  4              97  ---  Number of Reported Uncorrectable Errors
0x04  0x010  4             264  ---  Resets Between Cmd Acceptance and Completion
0x05  =====  =               =  ===  == Temperature Statistics (rev 1) ==
0x05  0x008  1              22  ---  Current Temperature
0x05  0x010  1              31  ---  Average Short Term Temperature
0x05  0x018  1              27  ---  Average Long Term Temperature
0x05  0x020  1              50  ---  Highest Temperature
0x05  0x028  1              13  ---  Lowest Temperature
0x05  0x030  1              44  ---  Highest Average Short Term Temperature
0x05  0x038  1              22  ---  Lowest Average Short Term Temperature
0x05  0x040  1              41  ---  Highest Average Long Term Temperature
0x05  0x048  1              23  ---  Lowest Average Long Term Temperature
0x05  0x050  4               0  ---  Time in Over-Temperature
0x05  0x058  1              55  ---  Specified Maximum Operating Temperature
0x05  0x060  4               0  ---  Time in Under-Temperature
0x05  0x068  1              13  ---  Specified Minimum Operating Temperature
                                |||_ C monitored condition met
                                ||__ D supports DSN
                                |___ N normalized value

Pending Defects log (GP Log 0x0c) not supported

SATA Phy Event Counters (GP Log 0x11)
ID      Size     Value  Description
0x000a  2            3  Device-to-host register FISes sent due to a COMRESET
0x0001  2            0  Command failed due to ICRC error
0x0003  2            0  R_ERR response for device-to-host data FIS
0x0004  2            0  R_ERR response for host-to-device data FIS
0x0006  2            0  R_ERR response for device-to-host non-data FIS
0x0007  2            0  R_ERR response for host-to-device non-data FIS



