smartctl 7.5 2025-04-30 r5714 [x86_64-linux-6.17.8-2-cachyos] (local build)
Copyright (C) 2002-25, Bruce Allen, Christian Franke, www.smartmontools.org

=== START OF INFORMATION SECTION ===
Model Family:     Western Digital Elements / My Passport (USB, AF)
Device Model:     WDC WD40NDZW-11MR8S1
Serial Number:    --
LU WWN Device Id: 5 0014ee ...
Firmware Version: 02.01A02
User Capacity:    4,000,753,475,584 bytes [4.00 TB]
Sector Sizes:     512 bytes logical, 4096 bytes physical
Rotation Rate:    5400 rpm
Form Factor:      2.5 inches
TRIM Command:     Available, deterministic
Device is:        In smartctl database 7.5/5706
ATA Version is:   ACS-3 (minor revision not indicated)
SATA Version is:  SATA 3.1, 6.0 Gb/s (current: 6.0 Gb/s)
Local Time is:    Tue Nov 18 13:54:02 2025 EET
SMART support is: Available - device has SMART capability.
SMART support is: Enabled
AAM feature is:   Unavailable
APM level is:     128 (minimum power consumption without standby)
Rd look-ahead is: Enabled
Write cache is:   Enabled
DSN feature is:   Unavailable
ATA Security is:  Disabled, NOT FROZEN [SEC1], Master PW ID: 0xbbbb

=== START OF READ SMART DATA SECTION ===
SMART overall-health self-assessment test result: PASSED

General SMART Values:
Offline data collection status:  (0x00)	Offline data collection activity
					was never started.
					Auto Offline Data Collection: Disabled.
Self-test execution status:      (   0)	The previous self-test routine completed
					without error or no self-test has ever 
					been run.
Total time to complete Offline 
data collection: 		( 5940) seconds.
Offline data collection
capabilities: 			 (0x1b) SMART execute Offline immediate.
					Auto Offline data collection on/off support.
					Suspend Offline collection upon new
					command.
					Offline surface scan supported.
					Self-test supported.
					No Conveyance Self-test supported.
					No Selective Self-test supported.
SMART capabilities:            (0x0003)	Saves SMART data before entering
					power-saving mode.
					Supports SMART auto save timer.
Error logging capability:        (0x01)	Error logging supported.
					General Purpose Logging supported.
Short self-test routine 
recommended polling time: 	 (   2) minutes.
Extended self-test routine
recommended polling time: 	 ( 475) minutes.
SCT capabilities: 	       (0x30b5)	SCT Status supported.
					SCT Feature Control supported.
					SCT Data Table supported.

SMART Attributes Data Structure revision number: 16
Vendor Specific SMART Attributes with Thresholds:
ID# ATTRIBUTE_NAME          FLAGS    VALUE WORST THRESH FAIL RAW_VALUE
  1 Raw_Read_Error_Rate     POSR-K   200   200   051    -    0
  3 Spin_Up_Time            POS--K   253   242   021    -    1991
  4 Start_Stop_Count        -O--CK   094   094   000    -    6620
  5 Reallocated_Sector_Ct   PO--CK   200   200   140    -    0
  7 Seek_Error_Rate         -OSR-K   200   200   000    -    0
  9 Power_On_Hours          -O--CK   094   094   000    -    4982
 10 Spin_Retry_Count        -O--CK   100   100   000    -    0
 11 Calibration_Retry_Count -O--CK   100   100   000    -    0
 12 Power_Cycle_Count       -O--CK   099   099   000    -    1242
192 Power-Off_Retract_Count -O--CK   200   200   000    -    658
193 Load_Cycle_Count        -O--CK   193   193   000    -    22957
194 Temperature_Celsius     -O---K   123   081   000    -    29
196 Reallocated_Event_Count -O--CK   200   200   000    -    0
197 Current_Pending_Sector  -O--CK   200   200   000    -    0
198 Offline_Uncorrectable   ----CK   100   253   000    -    0
199 UDMA_CRC_Error_Count    -O--CK   200   200   000    -    0
200 Multi_Zone_Error_Rate   ---R--   100   253   000    -    0
                            ||||||_ K auto-keep
                            |||||__ C event count
                            ||||___ R error rate
                            |||____ S speed/performance
                            ||_____ O updated online
                            |______ P prefailure warning

General Purpose Log Directory Version 1
SMART           Log Directory Version 1 [multi-sector log support]
Address    Access  R/W   Size  Description
0x00       GPL,SL  R/O      1  Log Directory
0x01           SL  R/O      1  Summary SMART error log
0x02           SL  R/O      5  Comprehensive SMART error log
0x03       GPL     R/O      6  Ext. Comprehensive SMART error log
0x06           SL  R/O      1  SMART self-test log
0x07       GPL     R/O      1  Extended self-test log
0x09           SL  R/W      1  Selective self-test log
0x10       GPL     R/O      1  NCQ Command Error log
0x11       GPL     R/O      1  SATA Phy Event Counters log
0x24       GPL     R/O    288  Current Device Internal Status Data log
0x30       GPL,SL  R/O      9  IDENTIFY DEVICE data log
0x80-0x9f  GPL,SL  R/W     16  Host vendor specific log
0xa0-0xa7  GPL,SL  VS      16  Device vendor specific log
0xa8-0xb6  GPL,SL  VS       1  Device vendor specific log
0xb7       GPL,SL  VS      82  Device vendor specific log
0xb9       GPL,SL  VS       4  Device vendor specific log
0xbd       GPL,SL  VS       1  Device vendor specific log
0xc0       GPL,SL  VS       1  Device vendor specific log
0xc1       GPL     VS      93  Device vendor specific log
0xcf       GPL     VS   65535  Device vendor specific log
0xe0       GPL,SL  R/W      1  SCT Command/Status
0xe1       GPL,SL  R/W      1  SCT Data Transfer

SMART Extended Comprehensive Error Log Version: 1 (6 sectors)
Device Error Count: 14
	CR     = Command Register
	FEATR  = Features Register
	COUNT  = Count (was: Sector Count) Register
	LBA_48 = Upper bytes of LBA High/Mid/Low Registers ]  ATA-8
	LH     = LBA High (was: Cylinder High) Register    ]   LBA
	LM     = LBA Mid (was: Cylinder Low) Register      ] Register
	LL     = LBA Low (was: Sector Number) Register     ]
	DV     = Device (was: Device/Head) Register
	DC     = Device Control Register
	ER     = Error register
	ST     = Status register
Powered_Up_Time is measured from power on, and printed as
DDd+hh:mm:SS.sss where DD=days, hh=hours, mm=minutes,
SS=sec, and sss=millisec. It "wraps" after 49.710 days.

Error 14 [13] occurred at disk power-on lifetime: 2988 hours (124 days + 12 hours)
  When the command that caused the error occurred, the device was in standby mode.

  After command completion occurred, registers were:
  ER -- ST COUNT  LBA_48  LH LM LL DV DC
  -- -- -- == -- == == == -- -- -- -- --
  04 -- 51 00 08 00 00 00 5a 64 80 00 00

  Commands leading to the command that caused the error were:
  CR FEATR COUNT  LBA_48  LH LM LL DV DC  Powered_Up_Time  Command/Feature_Name
  -- == -- == -- == == == -- -- -- -- --  ---------------  --------------------
  e1 00 01 00 08 00 00 00 5a 64 80 00 00     01:32:05.300  IDLE IMMEDIATE
  e0 00 01 00 08 00 00 00 5a 64 80 00 00     01:31:49.736  STANDBY IMMEDIATE
  e7 00 01 00 08 00 00 00 5a 64 80 00 00     01:31:49.736  FLUSH CACHE
  e7 00 01 00 08 00 00 00 5a 64 80 00 00     01:31:48.663  FLUSH CACHE
  35 00 01 00 08 00 00 00 5a 64 80 40 00     01:31:15.377  WRITE DMA EXT

Error 13 [12] occurred at disk power-on lifetime: 2973 hours (123 days + 21 hours)
  When the command that caused the error occurred, the device was in standby mode.

  After command completion occurred, registers were:
  ER -- ST COUNT  LBA_48  LH LM LL DV DC
  -- -- -- == -- == == == -- -- -- -- --
  04 -- 51 00 08 00 00 00 2b f0 80 00 00

  Commands leading to the command that caused the error were:
  CR FEATR COUNT  LBA_48  LH LM LL DV DC  Powered_Up_Time  Command/Feature_Name
  -- == -- == -- == == == -- -- -- -- --  ---------------  --------------------
  e1 00 d5 00 08 00 00 00 2b f0 80 00 00     00:45:21.083  IDLE IMMEDIATE
  e0 00 d5 00 08 00 00 00 2b f0 80 00 00     00:44:18.625  STANDBY IMMEDIATE
  e7 00 d5 00 08 00 00 00 2b f0 80 00 00     00:44:18.625  FLUSH CACHE
  e7 00 d5 00 08 00 00 00 2b f0 80 00 00     00:44:18.625  FLUSH CACHE
  25 00 d5 00 08 00 00 f4 2b f0 80 40 00     00:43:45.318  READ DMA EXT

Error 12 [11] occurred at disk power-on lifetime: 2970 hours (123 days + 18 hours)
  When the command that caused the error occurred, the device was in standby mode.

  After command completion occurred, registers were:
  ER -- ST COUNT  LBA_48  LH LM LL DV DC
  -- -- -- == -- == == == -- -- -- -- --
  04 -- 51 00 10 00 00 00 00 00 00 00 00

  Commands leading to the command that caused the error were:
  CR FEATR COUNT  LBA_48  LH LM LL DV DC  Powered_Up_Time  Command/Feature_Name
  -- == -- == -- == == == -- -- -- -- --  ---------------  --------------------
  e1 00 00 00 10 00 00 00 00 00 00 00 00     01:09:35.666  IDLE IMMEDIATE
  e0 00 00 00 10 00 00 00 00 00 00 00 00     00:59:59.097  STANDBY IMMEDIATE
  e7 00 00 00 10 00 00 00 00 00 00 00 00     00:59:59.097  FLUSH CACHE
  e7 00 00 00 10 00 00 00 00 00 00 00 00     00:59:59.097  FLUSH CACHE
  25 00 00 00 10 00 00 00 00 00 00 40 00     00:59:25.870  READ DMA EXT

Error 11 [10] occurred at disk power-on lifetime: 2970 hours (123 days + 18 hours)
  When the command that caused the error occurred, the device was in standby mode.

  After command completion occurred, registers were:
  ER -- ST COUNT  LBA_48  LH LM LL DV DC
  -- -- -- == -- == == == -- -- -- -- --
  04 -- 51 00 10 00 00 00 00 00 00 00 00

  Commands leading to the command that caused the error were:
  CR FEATR COUNT  LBA_48  LH LM LL DV DC  Powered_Up_Time  Command/Feature_Name
  -- == -- == -- == == == -- -- -- -- --  ---------------  --------------------
  e1 00 00 00 10 00 00 00 00 00 00 00 00     00:59:11.552  IDLE IMMEDIATE
  e0 00 00 00 10 00 00 00 00 00 00 00 00     00:44:51.090  STANDBY IMMEDIATE
  e7 00 00 00 10 00 00 00 00 00 00 00 00     00:44:51.090  FLUSH CACHE
  e7 00 00 00 10 00 00 00 00 00 00 00 00     00:44:51.089  FLUSH CACHE
  25 00 00 00 10 00 00 00 00 00 00 40 00     00:44:17.857  READ DMA EXT

Error 10 [9] occurred at disk power-on lifetime: 2881 hours (120 days + 1 hours)
  When the command that caused the error occurred, the device was in standby mode.

  After command completion occurred, registers were:
  ER -- ST COUNT  LBA_48  LH LM LL DV DC
  -- -- -- == -- == == == -- -- -- -- --
  04 -- 51 00 10 00 00 00 00 00 00 00 00

  Commands leading to the command that caused the error were:
  CR FEATR COUNT  LBA_48  LH LM LL DV DC  Powered_Up_Time  Command/Feature_Name
  -- == -- == -- == == == -- -- -- -- --  ---------------  --------------------
  e1 00 00 00 10 00 00 00 00 00 00 00 00     02:07:00.159  IDLE IMMEDIATE
  e0 00 00 00 10 00 00 00 00 00 00 00 00     01:52:49.153  STANDBY IMMEDIATE
  e7 00 00 00 10 00 00 00 00 00 00 00 00     01:52:49.152  FLUSH CACHE
  e7 00 00 00 10 00 00 00 00 00 00 00 00     01:52:49.152  FLUSH CACHE
  25 00 00 00 10 00 00 00 00 00 00 40 00     01:52:16.108  READ DMA EXT

Error 9 [8] occurred at disk power-on lifetime: 2880 hours (120 days + 0 hours)
  When the command that caused the error occurred, the device was in standby mode.

  After command completion occurred, registers were:
  ER -- ST COUNT  LBA_48  LH LM LL DV DC
  -- -- -- == -- == == == -- -- -- -- --
  04 -- 51 00 08 00 00 00 86 34 d0 00 00

  Commands leading to the command that caused the error were:
  CR FEATR COUNT  LBA_48  LH LM LL DV DC  Powered_Up_Time  Command/Feature_Name
  -- == -- == -- == == == -- -- -- -- --  ---------------  --------------------
  e1 00 00 00 08 00 00 00 86 34 d0 00 00     01:52:01.057  IDLE IMMEDIATE
  e0 00 00 00 08 00 00 00 86 34 d0 00 00     01:46:00.792  STANDBY IMMEDIATE
  e7 00 00 00 08 00 00 00 86 34 d0 00 00     01:46:00.711  FLUSH CACHE
  e7 00 00 00 08 00 00 00 86 34 d0 00 00     01:46:00.591  FLUSH CACHE
  35 00 00 00 08 00 00 f4 86 34 d0 40 00     01:45:27.540  WRITE DMA EXT

Error 8 [7] occurred at disk power-on lifetime: 2880 hours (120 days + 0 hours)
  When the command that caused the error occurred, the device was in standby mode.

  After command completion occurred, registers were:
  ER -- ST COUNT  LBA_48  LH LM LL DV DC
  -- -- -- == -- == == == -- -- -- -- --
  04 -- 51 00 10 00 00 00 2b f0 00 00 00

  Commands leading to the command that caused the error were:
  CR FEATR COUNT  LBA_48  LH LM LL DV DC  Powered_Up_Time  Command/Feature_Name
  -- == -- == -- == == == -- -- -- -- --  ---------------  --------------------
  e1 00 00 00 10 00 00 00 2b f0 00 00 00     01:37:01.953  IDLE IMMEDIATE
  e0 00 00 00 10 00 00 00 2b f0 00 00 00     01:22:46.548  STANDBY IMMEDIATE
  e7 00 00 00 10 00 00 00 2b f0 00 00 00     01:22:46.541  FLUSH CACHE
  e7 00 00 00 10 00 00 00 2b f0 00 00 00     01:22:46.465  FLUSH CACHE
  35 00 00 00 10 00 00 f4 2b f0 00 40 00     01:22:13.304  WRITE DMA EXT

Error 7 [6] occurred at disk power-on lifetime: 2876 hours (119 days + 20 hours)
  When the command that caused the error occurred, the device was in standby mode.

  After command completion occurred, registers were:
  ER -- ST COUNT  LBA_48  LH LM LL DV DC
  -- -- -- == -- == == == -- -- -- -- --
  04 -- 51 00 10 00 00 00 00 00 00 00 00

  Commands leading to the command that caused the error were:
  CR FEATR COUNT  LBA_48  LH LM LL DV DC  Powered_Up_Time  Command/Feature_Name
  -- == -- == -- == == == -- -- -- -- --  ---------------  --------------------
  e1 00 00 00 10 00 00 00 00 00 00 00 00     03:01:01.334  IDLE IMMEDIATE
  e0 00 00 00 10 00 00 00 00 00 00 00 00     02:53:59.024  STANDBY IMMEDIATE
  e7 00 00 00 10 00 00 00 00 00 00 00 00     02:53:59.024  FLUSH CACHE
  e7 00 00 00 10 00 00 00 00 00 00 00 00     02:53:59.024  FLUSH CACHE
  25 00 00 00 10 00 00 00 00 00 00 40 00     02:53:25.744  READ DMA EXT

SMART Extended Self-test Log Version: 1 (1 sectors)
Num  Test_Description    Status                  Remaining  LifeTime(hours)  LBA_of_first_error
# 1  Short offline       Completed without error       00%      1104         -

Selective Self-tests/Logging not supported

SCT Status Version:                  3
SCT Version (vendor specific):       258 (0x0102)
Device State:                        Active (0)
Current Temperature:                    29 Celsius
Power Cycle Min/Max Temperature:     26/33 Celsius
Lifetime    Min/Max Temperature:     13/71 Celsius
Specified Max Operating Temperature:    40 Celsius
Under/Over Temperature Limit Count:   0/0
Vendor specific:
01 00 00 00 00 00 00 00 00 00 00 00 00 00 00 00
00 00 00 00 00 00 00 00 00 00 00 00 00 00 00 00

SCT Temperature History Version:     2
Temperature Sampling Period:         1 minute
Temperature Logging Interval:        1 minute
Min/Max recommended Temperature:      0/60 Celsius
Min/Max Temperature Limit:           -41/85 Celsius
Temperature History Size (Index):    128 (110)

SCT Error Recovery Control command not supported

Device Statistics (GP/SMART Log 0x04) not supported

Pending Defects log (GP Log 0x0c) not supported

SATA Phy Event Counters (GP Log 0x11)
ID      Size     Value  Description
0x0001  2            0  Command failed due to ICRC error
0x0002  2            0  R_ERR response for data FIS
0x0003  2            0  R_ERR response for device-to-host data FIS
0x0004  2            0  R_ERR response for host-to-device data FIS
0x0005  2            0  R_ERR response for non-data FIS
0x0006  2            0  R_ERR response for device-to-host non-data FIS
0x0007  2            0  R_ERR response for host-to-device non-data FIS
0x0008  2            0  Device-to-host non-data FIS retries
0x0009  2            0  Transition from drive PhyRdy to drive PhyNRdy
0x000a  2            1  Device-to-host register FISes sent due to a COMRESET
0x000b  2            0  CRC errors within host-to-device FIS
0x000d  2            0  Non-CRC errors within host-to-device FIS
0x000f  2            0  R_ERR response for host-to-device data FIS, CRC
0x0012  2            0  R_ERR response for host-to-device non-data FIS, CRC
0x8000  4       385884  Vendor specific



