smartctl 7.4 2023-08-01 r5530 [x86_64-linux-6.11.0-26-generic] (local build)
Copyright (C) 2002-23, Bruce Allen, Christian Franke, www.smartmontools.org

=== START OF INFORMATION SECTION ===
Model Number:                       SAMSUNG MZVKW1T0HMLH-00000
Serial Number:                      --
Firmware Version:                   CXA7300Q
PCI Vendor/Subsystem ID:            0x144d
IEEE OUI Identifier:                0x002538
Total NVM Capacity:                 1,024,209,543,168 [1.02 TB]
Unallocated NVM Capacity:           0
Controller ID:                      2
NVMe Version:                       1.2
Number of Namespaces:               1
Namespace 1 Size/Capacity:          1,024,209,543,168 [1.02 TB]
Namespace 1 Formatted LBA Size:     512
Namespace 1 IEEE EUI-64:            002538 ...
Local Time is:                      Wed Jun 18 15:33:37 2025 CEST
Firmware Updates (0x16):            3 Slots, no Reset required
Optional Admin Commands (0x0017):   Security Format Frmw_DL Self_Test
Optional NVM Commands (0x001f):     Comp Wr_Unc DS_Mngmt Wr_Zero Sav/Sel_Feat
Log Page Attributes (0x03):         S/H_per_NS Cmd_Eff_Lg
Warning  Comp. Temp. Threshold:     70 Celsius
Critical Comp. Temp. Threshold:     73 Celsius

Supported Power States
St Op     Max   Active     Idle   RL RT WL WT  Ent_Lat  Ex_Lat
 0 +     6.80W       -        -    0  0  0  0        0       0
 1 +     5.60W       -        -    1  1  1  1        0       0
 2 +     4.40W       -        -    2  2  2  2        0       0
 3 -   0.0400W       -        -    3  3  3  3      210    1500
 4 -   0.0050W       -        -    4  4  4  4     2200    6000

Supported LBA Sizes (NSID 0x1)
Id Fmt  Data  Metadt  Rel_Perf
 0 +     512       0         0

=== START OF SMART DATA SECTION ===
SMART overall-health self-assessment test result: PASSED

SMART/Health Information (NVMe Log 0x02)
Critical Warning:                   0x00
Temperature:                        31 Celsius
Available Spare:                    100%
Available Spare Threshold:          10%
Percentage Used:                    0%
Data Units Read:                    22,516,076 [11.5 TB]
Data Units Written:                 26,409,594 [13.5 TB]
Host Read Commands:                 560,417,097
Host Write Commands:                723,546,768
Controller Busy Time:               1,932
Power Cycles:                       182
Power On Hours:                     39,564
Unsafe Shutdowns:                   67
Media and Data Integrity Errors:    0
Error Information Log Entries:      421
Warning  Comp. Temperature Time:    0
Critical Comp. Temperature Time:    0
Temperature Sensor 1:               31 Celsius
Temperature Sensor 2:               41 Celsius

Error Information (NVMe Log 0x01, 16 of 64 entries)
Num   ErrCount  SQId   CmdId  Status  PELoc          LBA  NSID    VS  Message
  0        421     0  0x0004  0x4004      -            0     0     -  Invalid Field in Command
  1        420     0  0x0010  0x4004      -            0     0     -  Invalid Field in Command
  2        419     0  0x0010  0x4004      -            0     0     -  Invalid Field in Command
  3        418     0  0x0014  0x4004      -            0     0     -  Invalid Field in Command
  4        417     0  0x1013  0x4004      -            0     0     -  Invalid Field in Command
  5        416     0  0x000c  0x4004      -            0     0     -  Invalid Field in Command
  6        415     0  0x0015  0x4004      -            0     0     -  Invalid Field in Command
  7        414     0  0x000c  0x4004      -            0     0     -  Invalid Field in Command
  8        413     0  0x0014  0x4004      -            0     0     -  Invalid Field in Command
  9        412     0  0x0000  0x4004      -            0     0     -  Invalid Field in Command
 10        411     0  0x0008  0x4004      -            0     0     -  Invalid Field in Command
 11        410     0  0x0018  0x4004      -            0     0     -  Invalid Field in Command
 12        409     0  0x0004  0x4004      -            0     0     -  Invalid Field in Command
 13        408     0  0x101b  0x4004      -            0     0     -  Invalid Field in Command
 14        407     0  0x000c  0x4004      -            0     0     -  Invalid Field in Command
 15        406     0  0x5016  0x4004      -            0     0     -  Invalid Field in Command
... (48 entries not read)

Self-test Log (NVMe Log 0x06)
Self-test status: No self-test in progress
No Self-tests Logged



