smartctl 7.1 2019-12-30 r5022 [x86_64-linux-5.4.0-42-generic] (local build)
Copyright (C) 2002-19, Bruce Allen, Christian Franke, www.smartmontools.org

=== START OF INFORMATION SECTION ===
Model Number:                       HFS256GD9TNG-62A0A
Serial Number:                      --
Firmware Version:                   80001E00
PCI Vendor/Subsystem ID:            0x1c5c
IEEE OUI Identifier:                0xace42e
Controller ID:                      1
Number of Namespaces:               1
Namespace 1 Size/Capacity:          256,060,514,304 [256 GB]
Namespace 1 Utilization:            173,996,576,768 [173 GB]
Namespace 1 Formatted LBA Size:     512
Local Time is:                      Wed Mar  3 21:11:07 2021 EST
Firmware Updates (0x14):            2 Slots, no Reset required
Optional Admin Commands (0x0017):   Security Format Frmw_DL Self_Test
Optional NVM Commands (0x001f):     Comp Wr_Unc DS_Mngmt Wr_Zero Sav/Sel_Feat
Maximum Data Transfer Size:         32 Pages
Warning  Comp. Temp. Threshold:     79 Celsius
Critical Comp. Temp. Threshold:     81 Celsius

Supported Power States
St Op     Max   Active     Idle   RL RT WL WT  Ent_Lat  Ex_Lat
 0 +     6.00W       -        -    0  0  0  0        5       5
 1 +     3.80W       -        -    1  1  1  1       30      30
 2 +     2.40W       -        -    2  2  2  2      100     100
 3 -   0.0700W       -        -    3  3  3  3     1000    1000
 4 -   0.0070W       -        -    3  3  3  3     1000    5000

Supported LBA Sizes (NSID 0x1)
Id Fmt  Data  Metadt  Rel_Perf
 0 +     512       0         0
 1 -    4096       0         0

=== START OF SMART DATA SECTION ===
SMART overall-health self-assessment test result: PASSED

SMART/Health Information (NVMe Log 0x02)
Critical Warning:                   0x00
Temperature:                        31 Celsius
Available Spare:                    100%
Available Spare Threshold:          10%
Percentage Used:                    4%
Data Units Read:                    11,120,231 [5.69 TB]
Data Units Written:                 64,446,979 [32.9 TB]
Host Read Commands:                 112,807,581
Host Write Commands:                89,989,187
Controller Busy Time:               20,593
Power Cycles:                       440
Power On Hours:                     1,020
Unsafe Shutdowns:                   85
Media and Data Integrity Errors:    0
Error Information Log Entries:      0
Warning  Comp. Temperature Time:    0
Critical Comp. Temperature Time:    0
Temperature Sensor 1:               31 Celsius
Temperature Sensor 2:               42 Celsius

Error Information (NVMe Log 0x01, max 256 entries)
No Errors Logged

