smartctl 7.2 2020-12-30 r5155 [x86_64-linux-5.13.0-35-generic] (local build)
Copyright (C) 2002-20, Bruce Allen, Christian Franke, www.smartmontools.org

=== START OF INFORMATION SECTION ===
Model Number:                       HFS256GD9TNG-62A0A
Serial Number:                      --
Firmware Version:                   80001E00
PCI Vendor/Subsystem ID:            0x1c5c
IEEE OUI Identifier:                0xace42e
Controller ID:                      1
NVMe Version:                       1.2
Number of Namespaces:               1
Namespace 1 Size/Capacity:          256,060,514,304 [256 GB]
Namespace 1 Utilization:            17,629,708,288 [17.6 GB]
Namespace 1 Formatted LBA Size:     512
Local Time is:                      Wed Mar 16 18:44:01 2022 PDT
Firmware Updates (0x14):            2 Slots, no Reset required
Optional Admin Commands (0x0017):   Security Format Frmw_DL Self_Test
Optional NVM Commands (0x001f):     Comp Wr_Unc DS_Mngmt Wr_Zero Sav/Sel_Feat
Log Page Attributes (0x02):         Cmd_Eff_Lg
Maximum Data Transfer Size:         32 Pages
Warning  Comp. Temp. Threshold:     79 Celsius
Critical Comp. Temp. Threshold:     81 Celsius

Supported Power States
St Op     Max   Active     Idle   RL RT WL WT  Ent_Lat  Ex_Lat
 0 +     6.00W       -        -    0  0  0  0        5       5
 1 +     3.80W       -        -    1  1  1  1       30      30
 2 +     2.40W       -        -    2  2  2  2      100     100
 3 -   0.0700W       -        -    3  3  3  3     1000    1000
 4 -   0.0070W       -        -    3  3  3  3     1000    5000

Supported LBA Sizes (NSID 0x1)
Id Fmt  Data  Metadt  Rel_Perf
 0 +     512       0         0
 1 -    4096       0         0

=== START OF SMART DATA SECTION ===
SMART overall-health self-assessment test result: PASSED

SMART/Health Information (NVMe Log 0x02)
Critical Warning:                   0x00
Temperature:                        40 Celsius
Available Spare:                    100%
Available Spare Threshold:          10%
Percentage Used:                    1%
Data Units Read:                    11,740,645 [6.01 TB]
Data Units Written:                 12,155,433 [6.22 TB]
Host Read Commands:                 170,508,307
Host Write Commands:                129,629,822
Controller Busy Time:               10,154
Power Cycles:                       969
Power On Hours:                     1,348
Unsafe Shutdowns:                   57
Media and Data Integrity Errors:    0
Error Information Log Entries:      0
Warning  Comp. Temperature Time:    0
Critical Comp. Temperature Time:    0
Temperature Sensor 1:               40 Celsius
Temperature Sensor 2:               49 Celsius

Error Information (NVMe Log 0x01, 16 of 256 entries)
No Errors Logged

