smartctl 7.4 2023-08-01 r5530 [x86_64-linux-6.8.0-47-generic] (local build)
Copyright (C) 2002-23, Bruce Allen, Christian Franke, www.smartmontools.org

=== START OF INFORMATION SECTION ===
Model Number:                       KBG30ZMS256G NVMe TOSHIBA 256GB
Serial Number:                      --
Firmware Version:                   ADDA0103
PCI Vendor/Subsystem ID:            0x1179
IEEE OUI Identifier:                0x00080d
Controller ID:                      0
NVMe Version:                       1.2
Number of Namespaces:               1
Namespace 1 Size/Capacity:          256,060,514,304 [256 GB]
Namespace 1 Formatted LBA Size:     512
Namespace 1 IEEE EUI-64:            00080d ...
Local Time is:                      Thu Nov 21 10:20:54 2024 CET
Firmware Updates (0x12):            1 Slot, no Reset required
Optional Admin Commands (0x0017):   Security Format Frmw_DL Self_Test
Optional NVM Commands (0x0017):     Comp Wr_Unc DS_Mngmt Sav/Sel_Feat
Log Page Attributes (0x02):         Cmd_Eff_Lg
Maximum Data Transfer Size:         512 Pages
Warning  Comp. Temp. Threshold:     82 Celsius
Critical Comp. Temp. Threshold:     85 Celsius

Supported Power States
St Op     Max   Active     Idle   RL RT WL WT  Ent_Lat  Ex_Lat
 0 +     3.30W       -        -    0  0  0  0        0       0
 1 +     2.70W       -        -    1  1  1  1        0       0
 2 +     2.30W       -        -    2  2  2  2        0       0
 3 -   0.0500W       -        -    3  3  3  3     8000   32000
 4 -   0.0050W       -        -    4  4  4  4     8000   40000

Supported LBA Sizes (NSID 0x1)
Id Fmt  Data  Metadt  Rel_Perf
 0 -    4096       0         0
 1 +     512       0         3

=== START OF SMART DATA SECTION ===
SMART overall-health self-assessment test result: PASSED

SMART/Health Information (NVMe Log 0x02)
Critical Warning:                   0x00
Temperature:                        39 Celsius
Available Spare:                    100%
Available Spare Threshold:          50%
Percentage Used:                    3%
Data Units Read:                    8,449,793 [4.32 TB]
Data Units Written:                 7,755,169 [3.97 TB]
Host Read Commands:                 131,272,725
Host Write Commands:                131,136,803
Controller Busy Time:               1,028
Power Cycles:                       30
Power On Hours:                     1,459
Unsafe Shutdowns:                   187
Media and Data Integrity Errors:    0
Error Information Log Entries:      3,372
Warning  Comp. Temperature Time:    0
Critical Comp. Temperature Time:    0
Temperature Sensor 1:               39 Celsius

Error Information (NVMe Log 0x01, 16 of 64 entries)
Num   ErrCount  SQId   CmdId  Status  PELoc          LBA  NSID    VS  Message
  0       3372     0  0x000c  0xc005  0x028            -     0     -  Invalid Field in Command

Self-test Log (NVMe Log 0x06)
Self-test status: No self-test in progress
Num  Test_Description  Status                       Power_on_Hours  Failing_LBA  NSID Seg SCT Code
 0   Short             Completed without error                 855            -     -   -   -    -
 1   Short             Completed without error                 269            -     -   -   -    -
 2   Short             Completed without error                 261            -     -   -   -    -
 3   Short             Aborted: Self-test command              261            -     -   -   -    -
 4   Short             Aborted: Controller Reset               260            -     -   -   -    -
 5   Short             Completed without error                 260            -     -   -   -    -
 6   Short             Completed without error                 260            -     -   -   -    -
 7   Short             Aborted: Self-test command              260            -     -   -   -    -
 8   Short             Completed without error                 247            -     -   -   -    -
 9   Short             Aborted: Self-test command              246            -     -   -   -    -
10   Short             Aborted: Self-test command              246            -     -   -   -    -
11   Short             Aborted: Self-test command              246            -     -   -   -    -
12   Short             Completed without error                 246            -     -   -   -    -
13   Short             Completed without error                 246            -     -   -   -    -
14   Short             Completed without error                 246            -     -   -   -    -
15   Short             Aborted: Self-test command              236            -     -   -   -    -
16   Short             Completed without error                 234            -     -   -   -    -



