smartctl 7.2 2020-12-30 r5155 [x86_64-linux-5.16.7-desktop-1omv4003] (OpenMandriva Lx 7.2-2)
Copyright (C) 2002-20, Bruce Allen, Christian Franke, www.smartmontools.org

=== START OF INFORMATION SECTION ===
Model Family:     SAMSUNG SpinPoint F1 DT
Device Model:     SAMSUNG HD322HJ
Serial Number:    --
LU WWN Device Id: 5 0024e9 ...
Firmware Version: 1AC01118
User Capacity:    320,072,933,376 bytes [320 GB]
Sector Size:      512 bytes logical/physical
Device is:        In smartctl database [for details use: -P show]
ATA Version is:   ATA/ATAPI-7, ATA8-ACS T13/1699-D revision 3b
Local Time is:    Mon Oct 24 09:24:06 2022 BST
SMART support is: Available - device has SMART capability.
SMART support is: Enabled
AAM feature is:   Disabled
APM feature is:   Disabled
Rd look-ahead is: Enabled
Write cache is:   Enabled
DSN feature is:   Unavailable
ATA Security is:  Disabled, NOT FROZEN [SEC1]
Wt Cache Reorder: Enabled

=== START OF READ SMART DATA SECTION ===
SMART overall-health self-assessment test result: PASSED

General SMART Values:
Offline data collection status:  (0x00)	Offline data collection activity
					was never started.
					Auto Offline Data Collection: Disabled.
Self-test execution status:      (   0)	The previous self-test routine completed
					without error or no self-test has ever 
					been run.
Total time to complete Offline 
data collection: 		( 3923) seconds.
Offline data collection
capabilities: 			 (0x7b) SMART execute Offline immediate.
					Auto Offline data collection on/off support.
					Suspend Offline collection upon new
					command.
					Offline surface scan supported.
					Self-test supported.
					Conveyance Self-test supported.
					Selective Self-test supported.
SMART capabilities:            (0x0003)	Saves SMART data before entering
					power-saving mode.
					Supports SMART auto save timer.
Error logging capability:        (0x01)	Error logging supported.
					General Purpose Logging supported.
Short self-test routine 
recommended polling time: 	 (   2) minutes.
Extended self-test routine
recommended polling time: 	 (  66) minutes.
Conveyance self-test routine
recommended polling time: 	 (   8) minutes.
SCT capabilities: 	       (0x003f)	SCT Status supported.
					SCT Error Recovery Control supported.
					SCT Feature Control supported.
					SCT Data Table supported.

SMART Attributes Data Structure revision number: 16
Vendor Specific SMART Attributes with Thresholds:
ID# ATTRIBUTE_NAME          FLAGS    VALUE WORST THRESH FAIL RAW_VALUE
  1 Raw_Read_Error_Rate     POSR--   100   100   051    -    0
  3 Spin_Up_Time            POS---   092   092   011    -    3210
  4 Start_Stop_Count        -O--CK   094   094   000    -    5768
  5 Reallocated_Sector_Ct   PO--CK   100   100   010    -    0
  7 Seek_Error_Rate         POSR--   100   100   051    -    0
  8 Seek_Time_Performance   P-S--K   100   100   015    -    9649
  9 Power_On_Hours          -O--CK   099   099   000    -    4521
 10 Spin_Retry_Count        PO--CK   100   100   051    -    1
 11 Calibration_Retry_Count -O--C-   100   100   000    -    0
 12 Power_Cycle_Count       -O--CK   095   095   000    -    5458
 13 Read_Soft_Error_Rate    -OSR--   100   100   000    -    0
183 Runtime_Bad_Block       -O--CK   100   100   000    -    3
184 End-to-End_Error        PO--CK   100   100   000    -    0
187 Reported_Uncorrect      -O--CK   100   100   000    -    0
188 Command_Timeout         -O--CK   100   100   000    -    0
190 Airflow_Temperature_Cel -O---K   069   060   000    -    31 (Min/Max 31/31)
194 Temperature_Celsius     -O---K   070   058   000    -    30 (Min/Max 30/31)
195 Hardware_ECC_Recovered  -O-RC-   100   100   000    -    6290
196 Reallocated_Event_Count -O--CK   100   100   000    -    0
197 Current_Pending_Sector  -O--C-   100   100   000    -    0
198 Offline_Uncorrectable   ----CK   100   100   000    -    0
199 UDMA_CRC_Error_Count    -OSRCK   100   100   000    -    7
200 Multi_Zone_Error_Rate   -O-R--   100   100   000    -    0
201 Soft_Read_Error_Rate    -O-R--   253   253   000    -    0
                            ||||||_ K auto-keep
                            |||||__ C event count
                            ||||___ R error rate
                            |||____ S speed/performance
                            ||_____ O updated online
                            |______ P prefailure warning

General Purpose Log Directory Version 1
SMART           Log Directory Version 1 [multi-sector log support]
Address    Access  R/W   Size  Description
0x00       GPL,SL  R/O      1  Log Directory
0x01           SL  R/O      1  Summary SMART error log
0x02           SL  R/O      2  Comprehensive SMART error log
0x03       GPL     R/O      2  Ext. Comprehensive SMART error log
0x04       GPL     R/O      2  Device Statistics log
0x06           SL  R/O      1  SMART self-test log
0x07       GPL     R/O      2  Extended self-test log
0x09           SL  R/W      1  Selective self-test log
0x10       GPL     R/O      1  NCQ Command Error log
0x11       GPL     R/O      1  SATA Phy Event Counters log
0x20       GPL     R/O      2  Streaming performance log [OBS-8]
0x21       GPL     R/O      1  Write stream error log
0x22       GPL     R/O      1  Read stream error log
0x80-0x9f  GPL,SL  R/W     16  Host vendor specific log
0xe0       GPL,SL  R/W      1  SCT Command/Status
0xe1       GPL,SL  R/W      1  SCT Data Transfer

SMART Extended Comprehensive Error Log Version: 1 (2 sectors)
Device Error Count: 7
	CR     = Command Register
	FEATR  = Features Register
	COUNT  = Count (was: Sector Count) Register
	LBA_48 = Upper bytes of LBA High/Mid/Low Registers ]  ATA-8
	LH     = LBA High (was: Cylinder High) Register    ]   LBA
	LM     = LBA Mid (was: Cylinder Low) Register      ] Register
	LL     = LBA Low (was: Sector Number) Register     ]
	DV     = Device (was: Device/Head) Register
	DC     = Device Control Register
	ER     = Error register
	ST     = Status register
Powered_Up_Time is measured from power on, and printed as
DDd+hh:mm:SS.sss where DD=days, hh=hours, mm=minutes,
SS=sec, and sss=millisec. It "wraps" after 49.710 days.

Error 7 [6] occurred at disk power-on lifetime: 4335 hours (180 days + 15 hours)
  When the command that caused the error occurred, the device was active or idle.

  After command completion occurred, registers were:
  ER -- ST COUNT  LBA_48  LH LM LL DV DC
  -- -- -- == -- == == == -- -- -- -- --
  00 -- c0 00 01 00 00 01 69 0e 67 40 00   at LBA = 0x01690e67 = 23662183

  Commands leading to the command that caused the error were:
  CR FEATR COUNT  LBA_48  LH LM LL DV DC  Powered_Up_Time  Command/Feature_Name
  -- == -- == -- == == == -- -- -- -- --  ---------------  --------------------
  61 00 00 00 18 00 00 00 69 0e 50 40 00     00:01:48.990  WRITE FPDMA QUEUED
  60 00 00 00 18 00 00 00 3e 3a 78 40 00     00:01:48.990  READ FPDMA QUEUED
  60 00 00 00 08 00 00 00 6a 2b 40 40 00     00:01:48.990  READ FPDMA QUEUED
  61 00 00 00 08 00 00 00 42 fb b0 40 00     00:01:48.990  WRITE FPDMA QUEUED
  60 00 00 00 08 00 00 00 35 51 b8 40 00     00:01:48.980  READ FPDMA QUEUED

Error 6 [5] occurred at disk power-on lifetime: 4306 hours (179 days + 10 hours)
  When the command that caused the error occurred, the device was active or idle.

  After command completion occurred, registers were:
  ER -- ST COUNT  LBA_48  LH LM LL DV DC
  -- -- -- == -- == == == -- -- -- -- --
  00 -- 48 00 1f 00 00 0f 86 e7 80 40 00   at LBA = 0x0f86e780 = 260499328

  Commands leading to the command that caused the error were:
  CR FEATR COUNT  LBA_48  LH LM LL DV DC  Powered_Up_Time  Command/Feature_Name
  -- == -- == -- == == == -- -- -- -- --  ---------------  --------------------
  60 00 00 00 20 00 00 00 86 e7 e0 40 00     00:19:06.220  READ FPDMA QUEUED
  60 00 00 00 20 00 00 00 86 e7 c0 40 00     00:19:06.220  READ FPDMA QUEUED
  60 00 00 00 20 00 00 00 86 e7 a0 40 00     00:19:06.220  READ FPDMA QUEUED
  60 00 00 00 20 00 00 00 86 e7 80 40 00     00:19:06.220  READ FPDMA QUEUED
  60 00 00 00 20 00 00 00 86 e7 60 40 00     00:19:06.220  READ FPDMA QUEUED

Error 5 [4] occurred at disk power-on lifetime: 4240 hours (176 days + 16 hours)
  When the command that caused the error occurred, the device was active or idle.

  After command completion occurred, registers were:
  ER -- ST COUNT  LBA_48  LH LM LL DV DC
  -- -- -- == -- == == == -- -- -- -- --
  00 -- 4a 00 27 00 00 02 ba 20 79 40 00   at LBA = 0x02ba2079 = 45752441

  Commands leading to the command that caused the error were:
  CR FEATR COUNT  LBA_48  LH LM LL DV DC  Powered_Up_Time  Command/Feature_Name
  -- == -- == -- == == == -- -- -- -- --  ---------------  --------------------
  60 00 00 00 28 00 00 00 ba 21 d8 40 00     00:00:53.170  READ FPDMA QUEUED
  60 00 00 00 48 00 00 00 ba 20 58 40 00     00:00:53.170  READ FPDMA QUEUED
  60 00 00 00 20 00 00 00 ba 1f e0 40 00     00:00:53.170  READ FPDMA QUEUED
  60 00 00 00 50 00 00 00 ba 1f a8 40 00     00:00:53.170  READ FPDMA QUEUED
  60 00 00 00 48 00 00 00 ba 1f 30 40 00     00:00:53.170  READ FPDMA QUEUED

Error 4 [3] occurred at disk power-on lifetime: 4234 hours (176 days + 10 hours)
  When the command that caused the error occurred, the device was active or idle.

  After command completion occurred, registers were:
  ER -- ST COUNT  LBA_48  LH LM LL DV DC
  -- -- -- == -- == == == -- -- -- -- --
  00 -- 48 00 28 00 00 20 07 2c 00 40 00   at LBA = 0x20072c00 = 537340928

  Commands leading to the command that caused the error were:
  CR FEATR COUNT  LBA_48  LH LM LL DV DC  Powered_Up_Time  Command/Feature_Name
  -- == -- == -- == == == -- -- -- -- --  ---------------  --------------------
  60 00 00 01 00 00 00 00 6d 28 00 40 00     00:18:22.150  READ FPDMA QUEUED
  60 00 00 01 00 00 00 00 6d 27 00 40 00     00:18:22.150  READ FPDMA QUEUED
  60 00 00 01 00 00 00 00 6d 26 00 40 00     00:18:22.150  READ FPDMA QUEUED
  60 00 00 01 00 00 00 00 6d 25 00 40 00     00:18:22.150  READ FPDMA QUEUED
  60 00 00 01 00 00 00 00 6d 24 00 40 00     00:18:22.150  READ FPDMA QUEUED

Error 3 [2] occurred at disk power-on lifetime: 4206 hours (175 days + 6 hours)
  When the command that caused the error occurred, the device was active or idle.

  After command completion occurred, registers were:
  ER -- ST COUNT  LBA_48  LH LM LL DV DC
  -- -- -- == -- == == == -- -- -- -- --
  00 -- 48 00 02 00 00 03 5f 13 00 40 00   at LBA = 0x035f1300 = 56562432

  Commands leading to the command that caused the error were:
  CR FEATR COUNT  LBA_48  LH LM LL DV DC  Powered_Up_Time  Command/Feature_Name
  -- == -- == -- == == == -- -- -- -- --  ---------------  --------------------
  60 00 00 00 30 00 00 00 f4 e6 d0 40 00     02:01:06.340  READ FPDMA QUEUED
  60 00 00 00 03 00 00 00 5f 13 00 40 00     02:01:06.330  READ FPDMA QUEUED
  60 00 00 00 20 00 00 00 6b 8d 00 40 00     02:01:06.320  READ FPDMA QUEUED
  60 00 00 00 40 00 00 00 f4 e6 50 40 00     02:01:06.320  READ FPDMA QUEUED
  61 00 00 00 10 00 00 00 69 0e 58 40 00     02:01:06.310  WRITE FPDMA QUEUED

Error 2 [1] occurred at disk power-on lifetime: 4162 hours (173 days + 10 hours)
  When the command that caused the error occurred, the device was active or idle.

  After command completion occurred, registers were:
  ER -- ST COUNT  LBA_48  LH LM LL DV DC
  -- -- -- == -- == == == -- -- -- -- --
  00 -- 48 00 7f 00 00 01 57 b1 28 40 00   at LBA = 0x0157b128 = 22524200

  Commands leading to the command that caused the error were:
  CR FEATR COUNT  LBA_48  LH LM LL DV DC  Powered_Up_Time  Command/Feature_Name
  -- == -- == -- == == == -- -- -- -- --  ---------------  --------------------
  60 00 00 00 80 00 00 00 57 b1 28 40 00     00:01:15.960  READ FPDMA QUEUED
  60 00 00 00 18 00 00 00 b5 cd 00 40 00     00:01:15.950  READ FPDMA QUEUED
  60 00 00 00 08 00 00 00 6a 92 38 40 00     00:01:15.950  READ FPDMA QUEUED
  60 00 00 00 08 00 00 00 6b 64 18 40 00     00:01:15.950  READ FPDMA QUEUED
  ea 00 00 00 00 00 00 00 00 00 00 00 00     00:01:15.880  FLUSH CACHE EXT

Error 1 [0] occurred at disk power-on lifetime: 2187 hours (91 days + 3 hours)
  When the command that caused the error occurred, the device was active or idle.

  After command completion occurred, registers were:
  ER -- ST COUNT  LBA_48  LH LM LL DV DC
  -- -- -- == -- == == == -- -- -- -- --
  00 -- 48 00 1f 00 00 03 8d f5 03 40 00   at LBA = 0x038df503 = 59634947

  Commands leading to the command that caused the error were:
  CR FEATR COUNT  LBA_48  LH LM LL DV DC  Powered_Up_Time  Command/Feature_Name
  -- == -- == -- == == == -- -- -- -- --  ---------------  --------------------
  60 00 00 00 20 00 00 00 8d f5 03 40 00     00:06:57.750  READ FPDMA QUEUED
  60 00 00 00 7d 00 00 00 bc 19 83 40 00     00:06:57.740  READ FPDMA QUEUED
  60 00 00 00 28 00 00 00 8d f3 3b 40 00     00:06:57.720  READ FPDMA QUEUED
  60 00 00 00 80 00 00 00 bc 19 03 40 00     00:06:57.710  READ FPDMA QUEUED
  60 00 00 00 3b 00 00 00 8d f3 00 40 00     00:06:57.700  READ FPDMA QUEUED

SMART Extended Self-test Log Version: 1 (2 sectors)
Num  Test_Description    Status                  Remaining  LifeTime(hours)  LBA_of_first_error
# 1  Short offline       Completed without error       00%      4484         -
# 2  Short offline       Completed without error       00%      4483         -
# 3  Short offline       Completed without error       00%      4479         -
# 4  Short offline       Completed without error       00%      4474         -
# 5  Short offline       Completed without error       00%      4467         -
# 6  Extended offline    Interrupted (host reset)      50%      4466         -
# 7  Short offline       Completed without error       00%      4463         -
# 8  Extended offline    Aborted by host               90%      4457         -
# 9  Extended offline    Interrupted (host reset)      70%      4432         -
#10  Short offline       Completed without error       00%      4416         -
#11  Short offline       Completed without error       00%      4408         -
#12  Extended offline    Interrupted (host reset)      70%      4403         -
#13  Extended offline    Aborted by host               50%      4389         -
#14  Short offline       Completed without error       00%      4387         -
#15  Short offline       Completed without error       00%      4384         -
#16  Short offline       Completed without error       00%      4378         -
#17  Short offline       Completed without error       00%      4365         -
#18  Short offline       Completed without error       00%      4361         -
#19  Extended offline    Interrupted (host reset)      50%      4358         -
#20  Short offline       Completed without error       00%      4357         -
#21  Short offline       Aborted by host               90%      4352         -

SMART Selective self-test log data structure revision number 1
 SPAN  MIN_LBA  MAX_LBA  CURRENT_TEST_STATUS
    1        0        0  Not_testing
    2        0        0  Not_testing
    3        0        0  Not_testing
    4        0        0  Not_testing
    5        0        0  Not_testing
Selective self-test flags (0x0):
  After scanning selected spans, do NOT read-scan remainder of disk.
If Selective self-test is pending on power-up, resume after 0 minute delay.

SCT Status Version:                  2
SCT Version (vendor specific):       256 (0x0100)
Device State:                        Active (0)
Current Temperature:                    30 Celsius
Power Cycle Min/Max Temperature:     --/31 Celsius
Lifetime    Min/Max Temperature:     --/44 Celsius

SCT Temperature History Version:     2
Temperature Sampling Period:         1 minute
Temperature Logging Interval:        1 minute
Min/Max recommended Temperature:     -4/72 Celsius
Min/Max Temperature Limit:           -9/77 Celsius
Temperature History Size (Index):    128 (42)

SCT Error Recovery Control:
           Read: Disabled
          Write: Disabled

ATA_READ_LOG_EXT (addr=0x04:0x00, page=0, n=1) failed: scsi error badly formed scsi parameters
Read Device Statistics page 0x00 failed

Pending Defects log (GP Log 0x0c) not supported

SATA Phy Event Counters (GP Log 0x11)
ID      Size     Value  Description
0x000a  2            5  Device-to-host register FISes sent due to a COMRESET
0x0001  2            0  Command failed due to ICRC error
0x0002  2            0  R_ERR response for data FIS
0x0003  2            0  R_ERR response for device-to-host data FIS
0x0004  2            0  R_ERR response for host-to-device data FIS
0x0005  2            0  R_ERR response for non-data FIS
0x0006  2            0  R_ERR response for device-to-host non-data FIS
0x0007  2            0  R_ERR response for host-to-device non-data FIS
0x0008  2            0  Device-to-host non-data FIS retries
0x0009  2            5  Transition from drive PhyRdy to drive PhyNRdy
0x000b  2            0  CRC errors within host-to-device FIS
0x000d  2            0  Non-CRC errors within host-to-device FIS
0x000f  2            0  R_ERR response for host-to-device data FIS, CRC
0x0010  2            0  R_ERR response for host-to-device data FIS, non-CRC
0x0012  2            0  R_ERR response for host-to-device non-data FIS, CRC
0x0013  2            0  R_ERR response for host-to-device non-data FIS, non-CRC

