smartctl 7.4 2023-08-01 r5530 [x86_64-linux-6.14.2-desktop-3omv2590] (OpenMandriva Lx 7.4-1)
Copyright (C) 2002-23, Bruce Allen, Christian Franke, www.smartmontools.org

=== START OF INFORMATION SECTION ===
Model Family:     Fujitsu MHZ BH
Device Model:     FUJITSU MHZ2320BH G2
Serial Number:    --
LU WWN Device Id: 5 00000e ...
Firmware Version: 8909
User Capacity:    320,072,933,376 bytes [320 GB]
Sector Size:      512 bytes logical/physical
Device is:        In smartctl database
ATA Version is:   ATA8-ACS T13/1699-D revision 3f
SATA Version is:  SATA 2.5, 3.0 Gb/s
Local Time is:    Tue Oct 28 16:35:16 2025 PDT
SMART support is: Available - device has SMART capability.
SMART support is: Enabled
AAM feature is:   Unavailable
APM level is:     128 (minimum power consumption without standby)
Rd look-ahead is: Enabled
Write cache is:   Enabled
DSN feature is:   Unavailable
ATA Security is:  Disabled, frozen [SEC2]
Wt Cache Reorder: Enabled

=== START OF READ SMART DATA SECTION ===
SMART overall-health self-assessment test result: PASSED

General SMART Values:
Offline data collection status:  (0x00)	Offline data collection activity
					was never started.
					Auto Offline Data Collection: Disabled.
Self-test execution status:      (   0)	The previous self-test routine completed
					without error or no self-test has ever 
					been run.
Total time to complete Offline 
data collection: 		( 1298) seconds.
Offline data collection
capabilities: 			 (0x51) SMART execute Offline immediate.
					No Auto Offline data collection support.
					Suspend Offline collection upon new
					command.
					No Offline surface scan supported.
					Self-test supported.
					No Conveyance Self-test supported.
					Selective Self-test supported.
SMART capabilities:            (0x0003)	Saves SMART data before entering
					power-saving mode.
					Supports SMART auto save timer.
Error logging capability:        (0x01)	Error logging supported.
					General Purpose Logging supported.
Short self-test routine 
recommended polling time: 	 (   2) minutes.
Extended self-test routine
recommended polling time: 	 ( 184) minutes.
SCT capabilities: 	       (0x003f)	SCT Status supported.
					SCT Error Recovery Control supported.
					SCT Feature Control supported.
					SCT Data Table supported.

SMART Attributes Data Structure revision number: 16
Vendor Specific SMART Attributes with Thresholds:
ID# ATTRIBUTE_NAME          FLAGS    VALUE WORST THRESH FAIL RAW_VALUE
  1 Raw_Read_Error_Rate     POSR--   100   100   046    -    217725
  2 Throughput_Performance  P-S---   100   100   030    -    56819712
  3 Spin_Up_Time            PO----   100   100   025    -    1
  4 Start_Stop_Count        -O--CK   097   097   000    -    12637
  5 Reallocated_Sector_Ct   PO--CK   100   100   024    -    0 (2000 0)
  7 Seek_Error_Rate         POSR--   100   100   047    -    3876
  8 Seek_Time_Performance   P-S---   100   100   019    -    0
  9 Power_On_Hours          -O--CK   066   066   000    -    17059
 10 Spin_Retry_Count        PO--C-   100   100   020    -    0
 11 Calibration_Retry_Count -O--CK   253   253   000    -    0
 12 Power_Cycle_Count       -O--CK   099   099   000    -    6021
182 Erase_Fail_Count_Total  -O--CK   100   100   000    -    0
184 End-to-End_Error        PO--CK   253   253   097    -    0
185 Unknown_Attribute       ----C-   253   253   000    -    0
186 Unknown_Attribute       -O--CK   253   253   000    -    0
187 Reported_Uncorrect      -O--CK   253   100   000    -    4681514352640
188 Command_Timeout         -O--CK   253   044   000    -    4204837143521
189 High_Fly_Writes         -O-RCK   253   100   000    -    0
190 Airflow_Temperature_Cel -O---K   078   042   000    -    22 (Min/Max 19/22)
191 G-Sense_Error_Rate      -O--CK   253   099   000    -    16580609
192 Power-Off_Retract_Count -O--CK   099   099   000    -    24314227
193 Load_Cycle_Count        -O--CK   098   098   000    -    51627
195 Hardware_ECC_Recovered  -O-RC-   100   100   000    -    651
196 Reallocated_Event_Count -O--CK   100   100   000    -    0 (0 4484)
197 Current_Pending_Sector  -O--C-   100   100   000    -    0
198 Offline_Uncorrectable   ----C-   100   100   000    -    0
199 UDMA_CRC_Error_Count    -OSRCK   200   253   000    -    0
200 Multi_Zone_Error_Rate   POSR--   100   100   060    -    11016
203 Run_Out_Cancel          -O----   100   100   000    -    3732321729629
240 Head_Flying_Hours       -OSRCK   200   199   000    -    0
                            ||||||_ K auto-keep
                            |||||__ C event count
                            ||||___ R error rate
                            |||____ S speed/performance
                            ||_____ O updated online
                            |______ P prefailure warning

General Purpose Log Directory Version 1
SMART           Log Directory Version 1 [multi-sector log support]
Address    Access  R/W   Size  Description
0x00       GPL,SL  R/O      1  Log Directory
0x01       GPL,SL  R/O      1  Summary SMART error log
0x02       GPL,SL  R/O     51  Comprehensive SMART error log
0x03       GPL,SL  R/O     64  Ext. Comprehensive SMART error log
0x06       GPL,SL  R/O      1  SMART self-test log
0x07       GPL,SL  R/O      2  Extended self-test log
0x09       GPL,SL  R/W      1  Selective self-test log
0x10       GPL,SL  R/O      1  NCQ Command Error log
0x11       GPL,SL  R/O      1  SATA Phy Event Counters log
0x23       GPL,SL  R/O      1  Delayed sector log
0x80-0x9f  GPL,SL  R/W     16  Host vendor specific log
0xa1       GPL,SL  VS       1  Device vendor specific log

SMART Extended Comprehensive Error Log Version: 1 (64 sectors)
Device Error Count: 3
	CR     = Command Register
	FEATR  = Features Register
	COUNT  = Count (was: Sector Count) Register
	LBA_48 = Upper bytes of LBA High/Mid/Low Registers ]  ATA-8
	LH     = LBA High (was: Cylinder High) Register    ]   LBA
	LM     = LBA Mid (was: Cylinder Low) Register      ] Register
	LL     = LBA Low (was: Sector Number) Register     ]
	DV     = Device (was: Device/Head) Register
	DC     = Device Control Register
	ER     = Error register
	ST     = Status register
Powered_Up_Time is measured from power on, and printed as
DDd+hh:mm:SS.sss where DD=days, hh=hours, mm=minutes,
SS=sec, and sss=millisec. It "wraps" after 49.710 days.

Error 3 [2] occurred at disk power-on lifetime: 3120 hours (130 days + 0 hours)
  When the command that caused the error occurred, the device was active or idle.

  After command completion occurred, registers were:
  ER -- ST COUNT  LBA_48  LH LM LL DV DC
  -- -- -- == -- == == == -- -- -- -- --
  84 -- 51 00 03 00 00 26 00 bf 75 e0 00  Error: ICRC, ABRT 3 sectors at LBA = 0x2600bf75 = 637583221

  Commands leading to the command that caused the error were:
  CR FEATR COUNT  LBA_48  LH LM LL DV DC  Powered_Up_Time  Command/Feature_Name
  -- == -- == -- == == == -- -- -- -- --  ---------------  --------------------
  35 00 00 00 08 00 02 26 00 bf 70 e0 00     00:00:21.477  WRITE DMA EXT
  35 00 00 00 08 00 02 26 00 bf 68 e0 00     00:00:21.476  WRITE DMA EXT
  35 00 00 00 08 00 02 26 00 bf 60 e0 00     00:00:21.476  WRITE DMA EXT
  35 00 00 00 08 00 02 26 00 bf 58 e0 00     00:00:21.475  WRITE DMA EXT
  35 00 00 00 08 00 02 26 00 bf 50 e0 00     00:00:21.475  WRITE DMA EXT

Error 2 [1] occurred at disk power-on lifetime: 3038 hours (126 days + 14 hours)
  When the command that caused the error occurred, the device was active or idle.

  After command completion occurred, registers were:
  ER -- ST COUNT  LBA_48  LH LM LL DV DC
  -- -- -- == -- == == == -- -- -- -- --
  84 -- 51 00 06 00 00 24 00 bf 2a e0 00  Error: ICRC, ABRT 6 sectors at LBA = 0x2400bf2a = 604028714

  Commands leading to the command that caused the error were:
  CR FEATR COUNT  LBA_48  LH LM LL DV DC  Powered_Up_Time  Command/Feature_Name
  -- == -- == -- == == == -- -- -- -- --  ---------------  --------------------
  35 00 00 00 08 00 02 24 00 bf 28 e0 00     00:00:54.193  WRITE DMA EXT
  35 00 00 00 08 00 02 24 00 bf 20 e0 00     00:00:54.193  WRITE DMA EXT
  ef 00 02 00 00 00 00 00 00 00 00 00 00     00:00:54.192  SET FEATURES [Enable write cache]
  ec 00 00 00 00 00 00 00 00 00 00 a0 00     00:00:54.192  IDENTIFY DEVICE
  00 00 20 00 01 00 00 00 00 00 01 00 ff     00:00:54.181  NOP [Reserved subcommand] [OBS-ACS-2]

Error 1 [0] occurred at disk power-on lifetime: 3012 hours (125 days + 12 hours)
  When the command that caused the error occurred, the device was active or idle.

  After command completion occurred, registers were:
  ER -- ST COUNT  LBA_48  LH LM LL DV DC
  -- -- -- == -- == == == -- -- -- -- --
  84 -- 51 00 01 00 00 44 00 bf 27 e0 00  Error: ICRC, ABRT 1 sectors at LBA = 0x4400bf27 = 1140899623

  Commands leading to the command that caused the error were:
  CR FEATR COUNT  LBA_48  LH LM LL DV DC  Powered_Up_Time  Command/Feature_Name
  -- == -- == -- == == == -- -- -- -- --  ---------------  --------------------
  35 00 00 00 08 00 02 44 00 bf 20 e0 00     00:00:25.831  WRITE DMA EXT
  35 00 00 00 08 00 02 44 00 bf 18 e0 00     00:00:25.830  WRITE DMA EXT
  35 00 00 00 08 00 02 44 00 bf 10 e0 00     00:00:25.830  WRITE DMA EXT
  35 00 00 00 08 00 02 44 00 bf 08 e0 00     00:00:25.829  WRITE DMA EXT
  35 00 00 00 08 00 02 44 00 bf 00 e0 00     00:00:25.829  WRITE DMA EXT

SMART Extended Self-test Log Version: 1 (2 sectors)
No self-tests have been logged.  [To run self-tests, use: smartctl -t]

SMART Selective self-test log data structure revision number 1
 SPAN  MIN_LBA  MAX_LBA  CURRENT_TEST_STATUS
    1        0        0  Not_testing
    2        0        0  Not_testing
    3        0        0  Not_testing
    4        0        0  Not_testing
    5        0        0  Not_testing
Selective self-test flags (0x0):
  After scanning selected spans, do NOT read-scan remainder of disk.
If Selective self-test is pending on power-up, resume after 0 minute delay.

SCT Status Version:                  2
SCT Version (vendor specific):       0 (0x0000)
Device State:                        Active (0)
Current Temperature:                    24 Celsius
Power Cycle Min/Max Temperature:     21/24 Celsius
Lifetime    Min/Max Temperature:     14/62 Celsius
Under/Over Temperature Limit Count:   0/0

SCT Temperature History Version:     2
Temperature Sampling Period:         1 minute
Temperature Logging Interval:        1 minute
Min/Max recommended Temperature:      5/60 Celsius
Min/Max Temperature Limit:           -40/65 Celsius
Temperature History Size (Index):    478 (18)

SCT Error Recovery Control:
           Read:     85 (8.5 seconds)
          Write:     85 (8.5 seconds)

Device Statistics (GP/SMART Log 0x04) not supported

Pending Defects log (GP Log 0x0c) not supported

SATA Phy Event Counters (GP Log 0x11)
ID      Size     Value  Description
0x0001  4            0  Command failed due to ICRC error
0x0002  4            0  R_ERR response for data FIS
0x0003  4            0  R_ERR response for device-to-host data FIS
0x0004  4            0  R_ERR response for host-to-device data FIS
0x0005  4            0  R_ERR response for non-data FIS
0x0006  4            0  R_ERR response for device-to-host non-data FIS
0x0008  4            0  Device-to-host non-data FIS retries
0x0009  4            2  Transition from drive PhyRdy to drive PhyNRdy
0x000a  4            2  Device-to-host register FISes sent due to a COMRESET
0x000b  4            0  CRC errors within host-to-device FIS
0x000d  4            0  Non-CRC errors within host-to-device FIS
0x000f  4            0  R_ERR response for host-to-device data FIS, CRC
0x0010  4            0  R_ERR response for host-to-device data FIS, non-CRC



