smartctl 7.1 2019-12-30 r5022 [x86_64-linux-5.4.0-128-generic] (local build)
Copyright (C) 2002-19, Bruce Allen, Christian Franke, www.smartmontools.org

=== START OF INFORMATION SECTION ===
Model Family:     Crucial/Micron BX/MX1/2/3/500, M5/600, 1100 SSDs
Device Model:     Micron 1100 SATA 512GB
Serial Number:    --
LU WWN Device Id: 5 00a075 ...
Firmware Version: M0DL003
User Capacity:    512,110,190,592 bytes [512 GB]
Sector Sizes:     512 bytes logical, 4096 bytes physical
Rotation Rate:    Solid State Device
Form Factor:      2.5 inches
Device is:        In smartctl database [for details use: -P show]
ATA Version is:   ACS-3 T13/2161-D revision 5
SATA Version is:  SATA 3.2, 6.0 Gb/s (current: 6.0 Gb/s)
Local Time is:    Wed Jan 25 15:48:45 2023 CET
SMART support is: Available - device has SMART capability.
SMART support is: Enabled
AAM feature is:   Unavailable
APM feature is:   Unavailable
Rd look-ahead is: Enabled
Write cache is:   Enabled
DSN feature is:   Unavailable
ATA Security is:  Disabled, NOT FROZEN [SEC1]
Wt Cache Reorder: Enabled

=== START OF READ SMART DATA SECTION ===
SMART overall-health self-assessment test result: PASSED
See vendor-specific Attribute list for marginal Attributes.

General SMART Values:
Offline data collection status:  (0x00)	Offline data collection activity
					was never started.
					Auto Offline Data Collection: Disabled.
Self-test execution status:      (   0)	The previous self-test routine completed
					without error or no self-test has ever 
					been run.
Total time to complete Offline 
data collection: 		( 1205) seconds.
Offline data collection
capabilities: 			 (0x7b) SMART execute Offline immediate.
					Auto Offline data collection on/off support.
					Suspend Offline collection upon new
					command.
					Offline surface scan supported.
					Self-test supported.
					Conveyance Self-test supported.
					Selective Self-test supported.
SMART capabilities:            (0x0003)	Saves SMART data before entering
					power-saving mode.
					Supports SMART auto save timer.
Error logging capability:        (0x01)	Error logging supported.
					General Purpose Logging supported.
Short self-test routine 
recommended polling time: 	 (   2) minutes.
Extended self-test routine
recommended polling time: 	 (   7) minutes.
Conveyance self-test routine
recommended polling time: 	 (   3) minutes.
SCT capabilities: 	       (0x0035)	SCT Status supported.
					SCT Feature Control supported.
					SCT Data Table supported.

SMART Attributes Data Structure revision number: 16
Vendor Specific SMART Attributes with Thresholds:
ID# ATTRIBUTE_NAME          FLAGS    VALUE WORST THRESH FAIL RAW_VALUE
  5 Reallocate_NAND_Blk_Cnt PO--CK   100   100   010    -    0
  9 Power_On_Hours          -O--CK   100   100   000    -    46234
 12 Power_Cycle_Count       PO--CK   100   100   001    -    101
181 Program_Fail_Cnt_Total  PO--CK   100   100   001    -    0
182 Erase_Fail_Count_Total  PO--CK   100   100   001    -    0
177 Wear_Leveling_Count     PO--CK   065   065   010    -    531
187 Reported_Uncorrect      PO--CK   100   100   001    -    0
194 Temperature_Celsius     -O---K   066   049   000    -    34 (Min/Max 15/51)
199 UDMA_CRC_Error_Count    -O--CK   100   100   000    -    0
238 Unknown_Attribute       ----CK   065   065   000    -    35
175 Program_Fail_Count_Chip PO--CK   100   100   000    -    0
176 Erase_Fail_Count_Chip   PO--CK   100   100   000    -    0
178 Used_Rsvd_Blk_Cnt_Chip  PO--CK   100   100   000    -    0
180 Unused_Reserve_NAND_Blk PO--CK   000   000   000    -    2458
195 Cumulativ_Corrected_ECC POSR-K   100   000   050    Past 0
241 Total_LBAs_Written      PO--CK   100   100   000    -    237335924883
242 Total_LBAs_Read         PO--CK   100   100   000    -    199121864727
179 Used_Rsvd_Blk_Cnt_Tot   PO--CK   100   100   000    -    0
                            ||||||_ K auto-keep
                            |||||__ C event count
                            ||||___ R error rate
                            |||____ S speed/performance
                            ||_____ O updated online
                            |______ P prefailure warning

General Purpose Log Directory Version 1
SMART           Log Directory Version 1 [multi-sector log support]
Address    Access  R/W   Size  Description
0x00       GPL,SL  R/O      1  Log Directory
0x01           SL  R/O      1  Summary SMART error log
0x02           SL  R/O     51  Comprehensive SMART error log
0x03       GPL     R/O  16383  Ext. Comprehensive SMART error log
0x04       GPL,SL  R/O      8  Device Statistics log
0x06           SL  R/O      1  SMART self-test log
0x07       GPL     R/O      1  Extended self-test log
0x09           SL  R/W      1  Selective self-test log
0x10       GPL     R/O      1  NCQ Command Error log
0x11       GPL     R/O      1  SATA Phy Event Counters log
0x13       GPL     R/O      1  SATA NCQ Send and Receive log
0x24       GPL     R/O   8000  Current Device Internal Status Data log
0x25       GPL     R/O   8000  Saved Device Internal Status Data log
0x30       GPL,SL  R/O      9  IDENTIFY DEVICE data log
0x80-0x9f  GPL,SL  R/W     16  Host vendor specific log
0xa0       GPL     VS   35328  Device vendor specific log
0xa1       GPL,SL  VS       3  Device vendor specific log
0xa2       GPL,SL  VS       1  Device vendor specific log
0xa3       GPL     VS   13824  Device vendor specific log
0xa4       GPL     VS     354  Device vendor specific log
0xa4       SL      VS      98  Device vendor specific log
0xa5       GPL     VS    8000  Device vendor specific log
0xa5       SL      VS      64  Device vendor specific log
0xa6       GPL     VS    8000  Device vendor specific log
0xa6       SL      VS      64  Device vendor specific log
0xa7-0xdf  GPL,SL  VS       1  Device vendor specific log
0xe0       GPL,SL  R/W      1  SCT Command/Status
0xe1       GPL,SL  R/W      1  SCT Data Transfer

SMART Extended Comprehensive Error Log Version: 1 (16383 sectors)
No Errors Logged

SMART Extended Self-test Log Version: 1 (1 sectors)
Num  Test_Description    Status                  Remaining  LifeTime(hours)  LBA_of_first_error
# 1  Vendor (0xff)       Completed without error       00%     46190         -
# 2  Vendor (0xff)       Completed without error       00%     45955         -
# 3  Vendor (0xff)       Completed without error       00%     45744         -
# 4  Vendor (0xff)       Completed without error       00%     45577         -
# 5  Vendor (0xff)       Completed without error       00%     45365         -
# 6  Vendor (0xff)       Completed without error       00%     44865         -
# 7  Vendor (0xff)       Completed without error       00%     44341         -
# 8  Vendor (0xff)       Completed without error       00%     35298         -
# 9  Vendor (0xff)       Completed without error       00%     35139         -
#10  Short offline       Completed without error       00%     43762         -
#11  Vendor (0xff)       Completed without error       00%     34984         -
#12  Vendor (0xff)       Completed without error       00%     34573         -
#13  Vendor (0xff)       Completed without error       00%     43530         -
#14  Vendor (0xff)       Completed without error       00%     43234         -
#15  Vendor (0xff)       Completed without error       00%     42933         -
#16  Vendor (0xff)       Completed without error       00%     42660         -
#17  Vendor (0xff)       Completed without error       00%     42418         -
#18  Vendor (0xff)       Completed without error       00%     42135         -
#19  Vendor (0xff)       Completed without error       00%     41861         -

SMART Selective self-test log data structure revision number 1
 SPAN  MIN_LBA  MAX_LBA  CURRENT_TEST_STATUS
    1        0        0  Not_testing
    2        0        0  Completed [00% left] (74787-140322)
    3        0        0  Not_testing
    4        0        0  Not_testing
    5        0        0  Not_testing
Selective self-test flags (0x0):
  After scanning selected spans, do NOT read-scan remainder of disk.
If Selective self-test is pending on power-up, resume after 0 minute delay.

SCT Status Version:                  3
SCT Version (vendor specific):       1 (0x0001)
Device State:                        Active (0)
Current Temperature:                    34 Celsius
Power Cycle Min/Max Temperature:     28/47 Celsius
Lifetime    Min/Max Temperature:     15/51 Celsius
Under/Over Temperature Limit Count:   0/0

SCT Temperature History Version:     2
Temperature Sampling Period:         1 minute
Temperature Logging Interval:        1 minute
Min/Max recommended Temperature:      0/70 Celsius
Min/Max Temperature Limit:           -5/75 Celsius
Temperature History Size (Index):    478 (466)

SCT Error Recovery Control command not supported

Device Statistics (GP Log 0x04)
Page  Offset Size        Value Flags Description
0x01  =====  =               =  ===  == General Statistics (rev 1) ==
0x01  0x008  4             101  ---  Lifetime Power-On Resets
0x01  0x010  4           46234  ---  Power-on Hours
0x01  0x018  6    237335924883  ---  Logical Sectors Written
0x01  0x020  6      2459837681  ---  Number of Write Commands
0x01  0x028  6    199121864727  ---  Logical Sectors Read
0x01  0x030  6      2915138525  ---  Number of Read Commands
0x04  =====  =               =  ===  == General Errors Statistics (rev 1) ==
0x04  0x008  4               0  ---  Number of Reported Uncorrectable Errors
0x04  0x010  4             335  ---  Resets Between Cmd Acceptance and Completion
0x05  =====  =               =  ===  == Temperature Statistics (rev 1) ==
0x05  0x008  1              34  ---  Current Temperature
0x05  0x010  1              31  ---  Average Short Term Temperature
0x05  0x018  1               -  ---  Average Long Term Temperature
0x05  0x020  1              51  ---  Highest Temperature
0x05  0x028  1              15  ---  Lowest Temperature
0x05  0x030  1              38  ---  Highest Average Short Term Temperature
0x05  0x038  1              28  ---  Lowest Average Short Term Temperature
0x05  0x040  1               -  ---  Highest Average Long Term Temperature
0x05  0x048  1               -  ---  Lowest Average Long Term Temperature
0x05  0x050  4               0  ---  Time in Over-Temperature
0x05  0x058  1              70  ---  Specified Maximum Operating Temperature
0x05  0x060  4               0  ---  Time in Under-Temperature
0x05  0x068  1               0  ---  Specified Minimum Operating Temperature
0x06  =====  =               =  ===  == Transport Statistics (rev 1) ==
0x06  0x008  4             335  ---  Number of Hardware Resets
0x06  0x010  4             239  ---  Number of ASR Events
0x06  0x018  4               0  ---  Number of Interface CRC Errors
0x07  =====  =               =  ===  == Solid State Device Statistics (rev 1) ==
0x07  0x008  1              35  N--  Percentage Used Endurance Indicator
                                |||_ C monitored condition met
                                ||__ D supports DSN
                                |___ N normalized value

Pending Defects log (GP Log 0x0c) not supported

SATA Phy Event Counters (GP Log 0x11)
ID      Size     Value  Description
0x0001  4            0  Command failed due to ICRC error
0x000a  4            2  Device-to-host register FISes sent due to a COMRESET



