smartctl 7.4 2023-08-01 r5530 [x86_64-linux-6.16.3-76061603-generic] (local build)
Copyright (C) 2002-23, Bruce Allen, Christian Franke, www.smartmontools.org

=== START OF INFORMATION SECTION ===
Model Number:                       WD PC SN810 SDCPNRY-512G-1006
Serial Number:                      --
Firmware Version:                   HPS2
PCI Vendor/Subsystem ID:            0x15b7
IEEE OUI Identifier:                0x001b44
Total NVM Capacity:                 512,110,190,592 [512 GB]
Unallocated NVM Capacity:           0
Controller ID:                      8224
NVMe Version:                       1.4
Number of Namespaces:               1
Namespace 1 Size/Capacity:          512,110,190,592 [512 GB]
Namespace 1 Formatted LBA Size:     512
Namespace 1 IEEE EUI-64:            001b44 ...
Local Time is:                      Sun Nov  9 08:50:47 2025 +0330
Firmware Updates (0x14):            2 Slots, no Reset required
Optional Admin Commands (0x0017):   Security Format Frmw_DL Self_Test
Optional NVM Commands (0x005f):     Comp Wr_Unc DS_Mngmt Wr_Zero Sav/Sel_Feat Timestmp
Log Page Attributes (0x1e):         Cmd_Eff_Lg Ext_Get_Lg Telmtry_Lg Pers_Ev_Lg
Maximum Data Transfer Size:         128 Pages
Warning  Comp. Temp. Threshold:     84 Celsius
Critical Comp. Temp. Threshold:     88 Celsius
Namespace 1 Features (0x02):        NA_Fields

Supported Power States
St Op     Max   Active     Idle   RL RT WL WT  Ent_Lat  Ex_Lat
 0 +     8.25W    8.25W       -    0  0  0  0        0       0
 1 +     3.50W    3.50W       -    0  0  0  0        0       0
 2 +     2.60W    2.60W       -    0  0  0  0        0       0
 3 -   0.0250W       -        -    3  3  3  3     5000   10000
 4 -   0.0035W       -        -    4  4  4  4     3900   45700

Supported LBA Sizes (NSID 0x1)
Id Fmt  Data  Metadt  Rel_Perf
 0 +     512       0         2
 1 -    4096       0         1

=== START OF SMART DATA SECTION ===
SMART overall-health self-assessment test result: FAILED!
- NVM subsystem reliability has been degraded

SMART/Health Information (NVMe Log 0x02)
Critical Warning:                   0x04
Temperature:                        36 Celsius
Available Spare:                    100%
Available Spare Threshold:          5%
Percentage Used:                    6%
Data Units Read:                    208,773,537 [106 TB]
Data Units Written:                 110,254,815 [56.4 TB]
Host Read Commands:                 2,133,012,366
Host Write Commands:                1,151,087,436
Controller Busy Time:               3,564
Power Cycles:                       1,593
Power On Hours:                     2,678
Unsafe Shutdowns:                   127
Media and Data Integrity Errors:    2,030
Error Information Log Entries:      2,034
Warning  Comp. Temperature Time:    5
Critical Comp. Temperature Time:    0

Error Information (NVMe Log 0x01, 16 of 256 entries)
No Errors Logged

Read Self-test Log failed: Invalid Field in Command (0x4002)

