smartctl 7.3 2022-02-28 r5338 [x86_64-linux-5.19.8-desktop-2omv4090] (OpenMandriva Lx 7.3-2)
Copyright (C) 2002-22, Bruce Allen, Christian Franke, www.smartmontools.org

=== START OF INFORMATION SECTION ===
Device Model:     TOSHIBA THNSNH128GBST
Serial Number:    --
LU WWN Device Id: 5 00080d ...
Firmware Version: HTRAN101
User Capacity:    128,035,676,160 bytes [128 GB]
Sector Size:      512 bytes logical/physical
Rotation Rate:    Solid State Device
Form Factor:      2.5 inches
TRIM Command:     Available, deterministic, zeroed
Device is:        Not in smartctl database
ATA Version is:   ACS-2 (minor revision not indicated)
SATA Version is:  SATA 3.1, 6.0 Gb/s (current: 3.0 Gb/s)
Local Time is:    Tue Oct  4 23:32:54 2022 CEST
SMART support is: Available - device has SMART capability.
SMART support is: Enabled
AAM feature is:   Unavailable
APM level is:     254 (maximum performance)
Rd look-ahead is: Enabled
Write cache is:   Enabled
DSN feature is:   Unavailable
ATA Security is:  Disabled, NOT FROZEN [SEC1]
Wt Cache Reorder: Enabled

=== START OF READ SMART DATA SECTION ===
SMART overall-health self-assessment test result: PASSED

General SMART Values:
Offline data collection status:  (0x00)	Offline data collection activity
					was never started.
					Auto Offline Data Collection: Disabled.
Self-test execution status:      (   0)	The previous self-test routine completed
					without error or no self-test has ever 
					been run.
Total time to complete Offline 
data collection: 		(  120) seconds.
Offline data collection
capabilities: 			 (0x5b) SMART execute Offline immediate.
					Auto Offline data collection on/off support.
					Suspend Offline collection upon new
					command.
					Offline surface scan supported.
					Self-test supported.
					No Conveyance Self-test supported.
					Selective Self-test supported.
SMART capabilities:            (0x0003)	Saves SMART data before entering
					power-saving mode.
					Supports SMART auto save timer.
Error logging capability:        (0x01)	Error logging supported.
					General Purpose Logging supported.
Short self-test routine 
recommended polling time: 	 (   2) minutes.
Extended self-test routine
recommended polling time: 	 (   8) minutes.
SCT capabilities: 	       (0x0039)	SCT Status supported.
					SCT Error Recovery Control supported.
					SCT Feature Control supported.
					SCT Data Table supported.

SMART Attributes Data Structure revision number: 16
Vendor Specific SMART Attributes with Thresholds:
ID# ATTRIBUTE_NAME          FLAGS    VALUE WORST THRESH FAIL RAW_VALUE
  1 Raw_Read_Error_Rate     -O-R--   100   100   000    -    0
  2 Throughput_Performance  P-S---   100   100   050    -    0
  3 Spin_Up_Time            POS---   100   100   050    -    0
  5 Reallocated_Sector_Ct   PO--C-   100   100   050    -    0
  7 Unknown_SSD_Attribute   PO-R--   100   100   050    -    0
  8 Unknown_SSD_Attribute   P-S---   100   100   050    -    0
  9 Power_On_Hours          -O--C-   100   100   000    -    11034
 10 Unknown_SSD_Attribute   PO--C-   100   100   050    -    0
 12 Power_Cycle_Count       -O--C-   100   100   000    -    4298
167 Unknown_Attribute       -O---K   100   100   000    -    0
168 Unknown_Attribute       -O--C-   100   100   000    -    573
169 Unknown_Attribute       PO--C-   100   100   010    -    100
173 Unknown_Attribute       -O--C-   170   170   000    -    0
175 Program_Fail_Count_Chip PO--C-   100   100   010    -    0
192 Power-Off_Retract_Count -O--C-   100   100   000    -    1022
194 Temperature_Celsius     PO---K   077   048   020    -    23 (Min/Max 8/52)
197 Current_Pending_Sector  -O--C-   100   100   000    -    0
240 Unknown_SSD_Attribute   PO--C-   100   100   050    -    0
                            ||||||_ K auto-keep
                            |||||__ C event count
                            ||||___ R error rate
                            |||____ S speed/performance
                            ||_____ O updated online
                            |______ P prefailure warning

General Purpose Log Directory Version 1
SMART           Log Directory Version 1 [multi-sector log support]
Address    Access  R/W   Size  Description
0x00       GPL,SL  R/O      1  Log Directory
0x01           SL  R/O      1  Summary SMART error log
0x02           SL  R/O     51  Comprehensive SMART error log
0x03       GPL     R/O     64  Ext. Comprehensive SMART error log
0x04       GPL,SL  R/O      8  Device Statistics log
0x06           SL  R/O      1  SMART self-test log
0x07       GPL     R/O      1  Extended self-test log
0x09           SL  R/W      1  Selective self-test log
0x10       GPL     R/O      1  NCQ Command Error log
0x11       GPL     R/O      1  SATA Phy Event Counters log
0x30       GPL,SL  R/O      9  IDENTIFY DEVICE data log
0x80-0x9f  GPL,SL  R/W     16  Host vendor specific log
0xe0       GPL,SL  R/W      1  SCT Command/Status
0xe1       GPL,SL  R/W      1  SCT Data Transfer

SMART Extended Comprehensive Error Log Version: 1 (64 sectors)
Device Error Count: 535 (device log contains only the most recent 256 errors)
	CR     = Command Register
	FEATR  = Features Register
	COUNT  = Count (was: Sector Count) Register
	LBA_48 = Upper bytes of LBA High/Mid/Low Registers ]  ATA-8
	LH     = LBA High (was: Cylinder High) Register    ]   LBA
	LM     = LBA Mid (was: Cylinder Low) Register      ] Register
	LL     = LBA Low (was: Sector Number) Register     ]
	DV     = Device (was: Device/Head) Register
	DC     = Device Control Register
	ER     = Error register
	ST     = Status register
Powered_Up_Time is measured from power on, and printed as
DDd+hh:mm:SS.sss where DD=days, hh=hours, mm=minutes,
SS=sec, and sss=millisec. It "wraps" after 49.710 days.

Error 535 [22] occurred at disk power-on lifetime: 8249 hours (343 days + 17 hours)
  When the command that caused the error occurred, the device was active or idle.

  After command completion occurred, registers were:
  ER -- ST COUNT  LBA_48  LH LM LL DV DC
  -- -- -- == -- == == == -- -- -- -- --
  84 -- 51 00 01 00 00 00 00 00 00 40 08  Error: ICRC, ABRT at LBA = 0x00000000 = 0

  Commands leading to the command that caused the error were:
  CR FEATR COUNT  LBA_48  LH LM LL DV DC  Powered_Up_Time  Command/Feature_Name
  -- == -- == -- == == == -- -- -- -- --  ---------------  --------------------
  ca 00 00 00 01 00 00 00 00 00 00 40 08     00:03:06.093  WRITE DMA
  ef 00 02 00 00 00 00 00 00 00 00 40 08     00:03:06.093  SET FEATURES [Enable write cache]
  ef 00 aa 00 00 00 00 00 00 00 00 40 08     00:03:06.093  SET FEATURES [Enable read look-ahead]
  c6 00 00 00 10 00 00 00 00 00 00 40 08     00:03:06.093  SET MULTIPLE MODE
  ef 00 10 00 02 00 00 00 00 00 00 40 08     00:03:06.092  SET FEATURES [Enable SATA feature]

Error 534 [21] occurred at disk power-on lifetime: 8249 hours (343 days + 17 hours)
  When the command that caused the error occurred, the device was active or idle.

  After command completion occurred, registers were:
  ER -- ST COUNT  LBA_48  LH LM LL DV DC
  -- -- -- == -- == == == -- -- -- -- --
  84 -- 51 00 01 00 00 00 00 00 00 40 08  Error: ICRC, ABRT at LBA = 0x00000000 = 0

  Commands leading to the command that caused the error were:
  CR FEATR COUNT  LBA_48  LH LM LL DV DC  Powered_Up_Time  Command/Feature_Name
  -- == -- == -- == == == -- -- -- -- --  ---------------  --------------------
  ca 00 00 00 01 00 00 00 00 00 00 40 08     00:03:05.991  WRITE DMA
  ef 00 02 00 00 00 00 00 00 00 00 40 08     00:03:05.990  SET FEATURES [Enable write cache]
  ef 00 aa 00 00 00 00 00 00 00 00 40 08     00:03:05.990  SET FEATURES [Enable read look-ahead]
  c6 00 00 00 10 00 00 00 00 00 00 40 08     00:03:05.990  SET MULTIPLE MODE
  ef 00 10 00 02 00 00 00 00 00 00 40 08     00:03:05.990  SET FEATURES [Enable SATA feature]

Error 533 [20] occurred at disk power-on lifetime: 8249 hours (343 days + 17 hours)
  When the command that caused the error occurred, the device was active or idle.

  After command completion occurred, registers were:
  ER -- ST COUNT  LBA_48  LH LM LL DV DC
  -- -- -- == -- == == == -- -- -- -- --
  84 -- 51 00 01 00 00 00 00 00 00 40 08  Error: ICRC, ABRT at LBA = 0x00000000 = 0

  Commands leading to the command that caused the error were:
  CR FEATR COUNT  LBA_48  LH LM LL DV DC  Powered_Up_Time  Command/Feature_Name
  -- == -- == -- == == == -- -- -- -- --  ---------------  --------------------
  ca 00 00 00 01 00 00 00 00 00 00 40 08     00:03:05.887  WRITE DMA
  ef 00 02 00 00 00 00 00 00 00 00 40 08     00:03:05.887  SET FEATURES [Enable write cache]
  ef 00 aa 00 00 00 00 00 00 00 00 40 08     00:03:05.887  SET FEATURES [Enable read look-ahead]
  c6 00 00 00 10 00 00 00 00 00 00 40 08     00:03:05.887  SET MULTIPLE MODE
  ef 00 10 00 02 00 00 00 00 00 00 40 08     00:03:05.887  SET FEATURES [Enable SATA feature]

Error 532 [19] occurred at disk power-on lifetime: 8249 hours (343 days + 17 hours)
  When the command that caused the error occurred, the device was active or idle.

  After command completion occurred, registers were:
  ER -- ST COUNT  LBA_48  LH LM LL DV DC
  -- -- -- == -- == == == -- -- -- -- --
  84 -- 51 00 01 00 00 00 00 00 00 40 08  Error: ICRC, ABRT at LBA = 0x00000000 = 0

  Commands leading to the command that caused the error were:
  CR FEATR COUNT  LBA_48  LH LM LL DV DC  Powered_Up_Time  Command/Feature_Name
  -- == -- == -- == == == -- -- -- -- --  ---------------  --------------------
  ca 00 00 00 01 00 00 00 00 00 00 40 08     00:03:05.779  WRITE DMA
  ef 00 02 00 00 00 00 00 00 00 00 40 08     00:03:05.779  SET FEATURES [Enable write cache]
  ef 00 aa 00 00 00 00 00 00 00 00 40 08     00:03:05.779  SET FEATURES [Enable read look-ahead]
  c6 00 00 00 10 00 00 00 00 00 00 40 08     00:03:05.779  SET MULTIPLE MODE
  ef 00 10 00 02 00 00 00 00 00 00 40 08     00:03:05.779  SET FEATURES [Enable SATA feature]

Error 531 [18] occurred at disk power-on lifetime: 8249 hours (343 days + 17 hours)
  When the command that caused the error occurred, the device was active or idle.

  After command completion occurred, registers were:
  ER -- ST COUNT  LBA_48  LH LM LL DV DC
  -- -- -- == -- == == == -- -- -- -- --
  84 -- 51 00 01 00 00 00 00 00 00 40 08  Error: ICRC, ABRT at LBA = 0x00000000 = 0

  Commands leading to the command that caused the error were:
  CR FEATR COUNT  LBA_48  LH LM LL DV DC  Powered_Up_Time  Command/Feature_Name
  -- == -- == -- == == == -- -- -- -- --  ---------------  --------------------
  ca 00 00 00 01 00 00 00 00 00 00 40 08     00:03:05.671  WRITE DMA
  60 00 01 00 68 00 00 00 00 00 00 40 08     00:02:13.500  READ FPDMA QUEUED
  ef 00 02 00 00 00 00 00 00 00 00 40 08     00:02:13.500  SET FEATURES [Enable write cache]
  ef 00 aa 00 00 00 00 00 00 00 00 40 08     00:02:13.500  SET FEATURES [Enable read look-ahead]
  c6 00 00 00 10 00 00 00 00 00 00 40 08     00:02:13.500  SET MULTIPLE MODE

Error 530 [17] occurred at disk power-on lifetime: 8249 hours (343 days + 17 hours)
  When the command that caused the error occurred, the device was active or idle.

  After command completion occurred, registers were:
  ER -- ST COUNT  LBA_48  LH LM LL DV DC
  -- -- -- == -- == == == -- -- -- -- --
  84 -- 51 00 f0 00 00 00 4c 06 80 40 08  Error: ICRC, ABRT at LBA = 0x004c0680 = 4982400

  Commands leading to the command that caused the error were:
  CR FEATR COUNT  LBA_48  LH LM LL DV DC  Powered_Up_Time  Command/Feature_Name
  -- == -- == -- == == == -- -- -- -- --  ---------------  --------------------
  61 00 08 00 f0 00 00 00 4c 06 80 40 08     00:04:22.170  WRITE FPDMA QUEUED
  2f 00 00 00 01 00 00 00 00 08 30 a0 08     00:04:22.169  READ LOG EXT
  ef 00 10 00 02 00 00 00 00 00 00 a0 08     00:04:22.169  SET FEATURES [Enable SATA feature]
  27 00 00 00 00 00 00 00 00 00 00 e0 08     00:04:22.169  READ NATIVE MAX ADDRESS EXT [OBS-ACS-3]
  ec 00 00 00 00 00 00 00 00 00 00 a0 08     00:04:22.169  IDENTIFY DEVICE

Error 529 [16] occurred at disk power-on lifetime: 8249 hours (343 days + 17 hours)
  When the command that caused the error occurred, the device was active or idle.

  After command completion occurred, registers were:
  ER -- ST COUNT  LBA_48  LH LM LL DV DC
  -- -- -- == -- == == == -- -- -- -- --
  84 -- 51 00 e8 00 00 00 4c 06 80 40 08  Error: ICRC, ABRT at LBA = 0x004c0680 = 4982400

  Commands leading to the command that caused the error were:
  CR FEATR COUNT  LBA_48  LH LM LL DV DC  Powered_Up_Time  Command/Feature_Name
  -- == -- == -- == == == -- -- -- -- --  ---------------  --------------------
  61 00 08 00 e8 00 00 00 4c 06 80 40 08     00:04:21.863  WRITE FPDMA QUEUED
  e7 00 00 00 00 00 00 00 00 00 00 a0 08     00:04:21.863  FLUSH CACHE
  e7 00 00 00 00 00 00 00 00 00 00 a0 08     00:04:21.862  FLUSH CACHE
  61 00 08 00 d0 00 00 00 4c 06 80 40 08     00:04:21.862  WRITE FPDMA QUEUED
  2f 00 00 00 01 00 00 00 00 08 30 a0 08     00:04:21.861  READ LOG EXT

Error 528 [15] occurred at disk power-on lifetime: 8249 hours (343 days + 17 hours)
  When the command that caused the error occurred, the device was active or idle.

  After command completion occurred, registers were:
  ER -- ST COUNT  LBA_48  LH LM LL DV DC
  -- -- -- == -- == == == -- -- -- -- --
  84 -- 51 00 c8 00 00 00 4c 06 80 40 08  Error: ICRC, ABRT at LBA = 0x004c0680 = 4982400

  Commands leading to the command that caused the error were:
  CR FEATR COUNT  LBA_48  LH LM LL DV DC  Powered_Up_Time  Command/Feature_Name
  -- == -- == -- == == == -- -- -- -- --  ---------------  --------------------
  61 00 08 00 c8 00 00 00 4c 06 80 40 08     00:04:21.555  WRITE FPDMA QUEUED
  2f 00 00 00 01 00 00 00 00 08 30 a0 08     00:04:21.554  READ LOG EXT
  ef 00 10 00 02 00 00 00 00 00 00 a0 08     00:04:21.554  SET FEATURES [Enable SATA feature]
  27 00 00 00 00 00 00 00 00 00 00 e0 08     00:04:21.554  READ NATIVE MAX ADDRESS EXT [OBS-ACS-3]
  ec 00 00 00 00 00 00 00 00 00 00 a0 08     00:04:21.554  IDENTIFY DEVICE

SMART Extended Self-test Log Version: 1 (1 sectors)
Num  Test_Description    Status                  Remaining  LifeTime(hours)  LBA_of_first_error
# 1  Extended offline    Completed without error       00%      8247         -
# 2  Short offline       Aborted by host               00%       809         -
# 3  Short offline       Aborted by host               00%       809         -
# 4  Short offline       Aborted by host               00%       809         -
# 5  Short offline       Aborted by host               00%       809         -

SMART Selective self-test log data structure revision number 1
 SPAN  MIN_LBA  MAX_LBA  CURRENT_TEST_STATUS
    1        0        0  Not_testing
    2        0        0  Not_testing
    3        0        0  Not_testing
    4        0        0  Not_testing
    5        0        0  Not_testing
Selective self-test flags (0x0):
  After scanning selected spans, do NOT read-scan remainder of disk.
If Selective self-test is pending on power-up, resume after 0 minute delay.

SCT Status Version:                  3
SCT Version (vendor specific):       3 (0x0003)
Device State:                        Active (0)
Current Temperature:                    23 Celsius
Power Cycle Min/Max Temperature:     22/23 Celsius
Lifetime    Min/Max Temperature:      8/52 Celsius
Specified Max Operating Temperature:     8 Celsius
Under/Over Temperature Limit Count:   0/0
Vendor specific:
00 00 04 00 01 01 00 05 05 00 00 00 00 00 00 00
00 01 00 00 fe 24 5e 02 02 02 00 00 00 00 00 05

SCT Temperature History Version:     2
Temperature Sampling Period:         1 minute
Temperature Logging Interval:        1 minute
Min/Max recommended Temperature:      5/40 Celsius
Min/Max Temperature Limit:            0/80 Celsius
Temperature History Size (Index):    128 (6)

SCT Error Recovery Control:
           Read:    600 (60.0 seconds)
          Write:    600 (60.0 seconds)

Device Statistics (GP Log 0x04)
Page  Offset Size        Value Flags Description
0x01  =====  =               =  ===  == General Statistics (rev 2) ==
0x01  0x008  4            4298  ---  Lifetime Power-On Resets
0x01  0x018  6     30891726637  ---  Logical Sectors Written
0x01  0x020  6       186295235  ---  Number of Write Commands
0x01  0x028  6     26547669872  ---  Logical Sectors Read
0x01  0x030  6       319744631  ---  Number of Read Commands
0x04  =====  =               =  ===  == General Errors Statistics (rev 1) ==
0x04  0x008  4               0  ---  Number of Reported Uncorrectable Errors
0x04  0x010  4               0  ---  Resets Between Cmd Acceptance and Completion
0x05  =====  =               =  ===  == Temperature Statistics (rev 1) ==
0x05  0x008  1              23  ---  Current Temperature
0x05  0x010  1              31  ---  Average Short Term Temperature
0x05  0x018  1              29  ---  Average Long Term Temperature
0x05  0x020  1              49  ---  Highest Temperature
0x05  0x028  1              19  ---  Lowest Temperature
0x05  0x030  1              45  ---  Highest Average Short Term Temperature
0x05  0x038  1              21  ---  Lowest Average Short Term Temperature
0x05  0x040  1              40  ---  Highest Average Long Term Temperature
0x05  0x048  1              26  ---  Lowest Average Long Term Temperature
0x05  0x050  4           84260  ---  Time in Over-Temperature
0x05  0x058  1              40  ---  Specified Maximum Operating Temperature
0x05  0x060  4               0  ---  Time in Under-Temperature
0x05  0x068  1               5  ---  Specified Minimum Operating Temperature
0x06  =====  =               =  ===  == Transport Statistics (rev 1) ==
0x06  0x008  4            8376  ---  Number of Hardware Resets
0x06  0x018  4             573  ---  Number of Interface CRC Errors
0x07  =====  =               =  ===  == Solid State Device Statistics (rev 1) ==
0x07  0x008  1              30  N--  Percentage Used Endurance Indicator
                                |||_ C monitored condition met
                                ||__ D supports DSN
                                |___ N normalized value

Pending Defects log (GP Log 0x0c) not supported

SATA Phy Event Counters (GP Log 0x11)
ID      Size     Value  Description
0x0001  2            0  Command failed due to ICRC error
0x0002  4            0  R_ERR response for data FIS
0x0003  2            0  R_ERR response for device-to-host data FIS
0x0004  2            0  R_ERR response for host-to-device data FIS
0x0005  4            0  R_ERR response for non-data FIS
0x0006  2            0  R_ERR response for device-to-host non-data FIS
0x0007  2            0  R_ERR response for host-to-device non-data FIS
0x0008  2            0  Device-to-host non-data FIS retries
0x0009  4            2  Transition from drive PhyRdy to drive PhyNRdy
0x000a  4            3  Device-to-host register FISes sent due to a COMRESET
0x000f  2            0  R_ERR response for host-to-device data FIS, CRC
0x0010  2            0  R_ERR response for host-to-device data FIS, non-CRC
0x0012  2            0  R_ERR response for host-to-device non-data FIS, CRC
0x0013  2            0  R_ERR response for host-to-device non-data FIS, non-CRC

