=== START OF INFORMATION SECTION ===
Model Family:     Western Digital AV-GP
Device Model:     WDC WD5000AVCS-632DY1
Serial Number:    --
LU WWN Device Id: 5 0014ee ...
Firmware Version: 01.00A01
User Capacity:    500,103,634,432 bytes [500 GB]
Sector Size:      512 bytes logical/physical
Device is:        In smartctl database [for details use: -P show]
ATA Version is:   ATA8-ACS (minor revision not indicated)
SATA Version is:  SATA 2.6, 3.0 Gb/s
Local Time is:    Mon Jan 27 20:01:15 2020 CET
SMART support is: Available - device has SMART capability.
SMART support is: Enabled
AAM level is:     254 (maximum performance), recommended: 128
APM feature is:   Unavailable
Rd look-ahead is: Enabled
Write cache is:   Enabled
DSN feature is:   Unavailable
ATA Security is:  Disabled, frozen [SEC2]
Wt Cache Reorder: Enabled

=== START OF READ SMART DATA SECTION ===
SMART overall-health self-assessment test result: PASSED

General SMART Values:
Offline data collection status:  (0x00)	Offline data collection activity
					was never started.
					Auto Offline Data Collection: Disabled.
Self-test execution status:      (   0)	The previous self-test routine completed
					without error or no self-test has ever 
					been run.
Total time to complete Offline 
data collection: 		(11760) seconds.
Offline data collection
capabilities: 			 (0x7b) SMART execute Offline immediate.
					Auto Offline data collection on/off support.
					Suspend Offline collection upon new
					command.
					Offline surface scan supported.
					Self-test supported.
					Conveyance Self-test supported.
					Selective Self-test supported.
SMART capabilities:            (0x0003)	Saves SMART data before entering
					power-saving mode.
					Supports SMART auto save timer.
Error logging capability:        (0x01)	Error logging supported.
					General Purpose Logging supported.
Short self-test routine 
recommended polling time: 	 (   2) minutes.
Extended self-test routine
recommended polling time: 	 ( 138) minutes.
Conveyance self-test routine
recommended polling time: 	 (   5) minutes.
SCT capabilities: 	       (0x3037)	SCT Status supported.
					SCT Feature Control supported.
					SCT Data Table supported.

SMART Attributes Data Structure revision number: 16
Vendor Specific SMART Attributes with Thresholds:
ID# ATTRIBUTE_NAME          FLAGS    VALUE WORST THRESH FAIL RAW_VALUE
  1 Raw_Read_Error_Rate     POSR-K   200   200   051    -    51
  3 Spin_Up_Time            POS--K   228   185   021    -    1558
  4 Start_Stop_Count        -O--CK   100   100   000    -    370
  5 Reallocated_Sector_Ct   PO--CK   200   200   140    -    0
  7 Seek_Error_Rate         -OSR-K   100   253   000    -    0
  9 Power_On_Hours          -O--CK   096   096   000    -    3013
 10 Spin_Retry_Count        -O--CK   100   100   000    -    0
 11 Calibration_Retry_Count -O--CK   100   100   000    -    0
 12 Power_Cycle_Count       -O--CK   100   100   000    -    365
192 Power-Off_Retract_Count -O--CK   200   200   000    -    101
193 Load_Cycle_Count        -O--CK   200   200   000    -    268
194 Temperature_Celsius     -O---K   103   096   000    -    40
196 Reallocated_Event_Count -O--CK   200   200   000    -    0
197 Current_Pending_Sector  -O--CK   200   200   000    -    7
198 Offline_Uncorrectable   ----CK   100   253   000    -    0
199 UDMA_CRC_Error_Count    -O--CK   200   200   000    -    0
200 Multi_Zone_Error_Rate   ---R--   100   253   000    -    0
                            ||||||_ K auto-keep
                            |||||__ C event count
                            ||||___ R error rate
                            |||____ S speed/performance
                            ||_____ O updated online
                            |______ P prefailure warning

General Purpose Log Directory Version 1
SMART           Log Directory Version 1 [multi-sector log support]
Address    Access  R/W   Size  Description
0x00       GPL,SL  R/O      1  Log Directory
0x01           SL  R/O      1  Summary SMART error log
0x02           SL  R/O      5  Comprehensive SMART error log
0x03       GPL     R/O      6  Ext. Comprehensive SMART error log
0x06           SL  R/O      1  SMART self-test log
0x07       GPL     R/O      1  Extended self-test log
0x09           SL  R/W      1  Selective self-test log
0x10       GPL     R/O      1  NCQ Command Error log
0x11       GPL     R/O      1  SATA Phy Event Counters log
0x21       GPL     R/O      1  Write stream error log
0x22       GPL     R/O      1  Read stream error log
0x80-0x9f  GPL,SL  R/W     16  Host vendor specific log
0xa0-0xa7  GPL,SL  VS      16  Device vendor specific log
0xa8-0xb7  GPL,SL  VS       1  Device vendor specific log
0xbd       GPL,SL  VS       1  Device vendor specific log
0xc0       GPL,SL  VS       1  Device vendor specific log
0xc1       GPL     VS      24  Device vendor specific log
0xe0       GPL,SL  R/W      1  SCT Command/Status
0xe1       GPL,SL  R/W      1  SCT Data Transfer

SMART Extended Comprehensive Error Log Version: 1 (6 sectors)
Device Error Count: 95 (device log contains only the most recent 24 errors)
	CR     = Command Register
	FEATR  = Features Register
	COUNT  = Count (was: Sector Count) Register
	LBA_48 = Upper bytes of LBA High/Mid/Low Registers ]  ATA-8
	LH     = LBA High (was: Cylinder High) Register    ]   LBA
	LM     = LBA Mid (was: Cylinder Low) Register      ] Register
	LL     = LBA Low (was: Sector Number) Register     ]
	DV     = Device (was: Device/Head) Register
	DC     = Device Control Register
	ER     = Error register
	ST     = Status register
Powered_Up_Time is measured from power on, and printed as
DDd+hh:mm:SS.sss where DD=days, hh=hours, mm=minutes,
SS=sec, and sss=millisec. It "wraps" after 49.710 days.

Error 95 [22] occurred at disk power-on lifetime: 3005 hours (125 days + 5 hours)
  When the command that caused the error occurred, the device was active or idle.

  After command completion occurred, registers were:
  ER -- ST COUNT  LBA_48  LH LM LL DV DC
  -- -- -- == -- == == == -- -- -- -- --
  40 -- 51 00 01 00 00 0a db 66 59 e0 00  Error: UNC at LBA = 0x0adb6659 = 182150745

  Commands leading to the command that caused the error were:
  CR FEATR COUNT  LBA_48  LH LM LL DV DC  Powered_Up_Time  Command/Feature_Name
  -- == -- == -- == == == -- -- -- -- --  ---------------  --------------------
  42 00 00 00 01 00 00 0a db 66 59 e0 00     01:04:34.576  READ VERIFY SECTOR(S) EXT
  42 00 00 00 01 00 00 0a db 66 58 e0 00     01:04:34.575  READ VERIFY SECTOR(S) EXT
  42 00 00 00 02 00 00 0a db 66 5a e0 00     01:04:34.547  READ VERIFY SECTOR(S) EXT
  42 00 00 00 02 00 00 0a db 66 58 e0 00     01:04:32.094  READ VERIFY SECTOR(S) EXT
  42 00 00 00 04 00 00 0a db 66 5c e0 00     01:04:32.066  READ VERIFY SECTOR(S) EXT

Error 94 [21] occurred at disk power-on lifetime: 3005 hours (125 days + 5 hours)
  When the command that caused the error occurred, the device was active or idle.

  After command completion occurred, registers were:
  ER -- ST COUNT  LBA_48  LH LM LL DV DC
  -- -- -- == -- == == == -- -- -- -- --
  40 -- 51 00 02 00 00 0a db 66 59 e0 00  Error: UNC at LBA = 0x0adb6659 = 182150745

  Commands leading to the command that caused the error were:
  CR FEATR COUNT  LBA_48  LH LM LL DV DC  Powered_Up_Time  Command/Feature_Name
  -- == -- == -- == == == -- -- -- -- --  ---------------  --------------------
  42 00 00 00 02 00 00 0a db 66 58 e0 00     01:04:32.094  READ VERIFY SECTOR(S) EXT
  42 00 00 00 04 00 00 0a db 66 5c e0 00     01:04:32.066  READ VERIFY SECTOR(S) EXT
  42 00 00 00 04 00 00 0a db 66 58 e0 00     01:04:29.612  READ VERIFY SECTOR(S) EXT
  42 00 00 00 08 00 00 0a db 66 60 e0 00     01:04:29.584  READ VERIFY SECTOR(S) EXT
  42 00 00 00 08 00 00 0a db 66 58 e0 00     01:04:27.131  READ VERIFY SECTOR(S) EXT

Error 93 [20] occurred at disk power-on lifetime: 3005 hours (125 days + 5 hours)
  When the command that caused the error occurred, the device was active or idle.

  After command completion occurred, registers were:
  ER -- ST COUNT  LBA_48  LH LM LL DV DC
  -- -- -- == -- == == == -- -- -- -- --
  40 -- 51 00 04 00 00 0a db 66 59 e0 00  Error: UNC at LBA = 0x0adb6659 = 182150745

  Commands leading to the command that caused the error were:
  CR FEATR COUNT  LBA_48  LH LM LL DV DC  Powered_Up_Time  Command/Feature_Name
  -- == -- == -- == == == -- -- -- -- --  ---------------  --------------------
  42 00 00 00 04 00 00 0a db 66 58 e0 00     01:04:29.612  READ VERIFY SECTOR(S) EXT
  42 00 00 00 08 00 00 0a db 66 60 e0 00     01:04:29.584  READ VERIFY SECTOR(S) EXT
  42 00 00 00 08 00 00 0a db 66 58 e0 00     01:04:27.131  READ VERIFY SECTOR(S) EXT
  42 00 00 00 10 00 00 0a db 66 68 e0 00     01:04:27.103  READ VERIFY SECTOR(S) EXT
  42 00 00 00 10 00 00 0a db 66 58 e0 00     01:04:24.650  READ VERIFY SECTOR(S) EXT

Error 92 [19] occurred at disk power-on lifetime: 3005 hours (125 days + 5 hours)
  When the command that caused the error occurred, the device was active or idle.

  After command completion occurred, registers were:
  ER -- ST COUNT  LBA_48  LH LM LL DV DC
  -- -- -- == -- == == == -- -- -- -- --
  40 -- 51 00 08 00 00 0a db 66 59 e0 00  Error: UNC at LBA = 0x0adb6659 = 182150745

  Commands leading to the command that caused the error were:
  CR FEATR COUNT  LBA_48  LH LM LL DV DC  Powered_Up_Time  Command/Feature_Name
  -- == -- == -- == == == -- -- -- -- --  ---------------  --------------------
  42 00 00 00 08 00 00 0a db 66 58 e0 00     01:04:27.131  READ VERIFY SECTOR(S) EXT
  42 00 00 00 10 00 00 0a db 66 68 e0 00     01:04:27.103  READ VERIFY SECTOR(S) EXT
  42 00 00 00 10 00 00 0a db 66 58 e0 00     01:04:24.650  READ VERIFY SECTOR(S) EXT
  42 00 00 00 20 00 00 0a db 66 78 e0 00     01:04:24.621  READ VERIFY SECTOR(S) EXT
  42 00 00 00 20 00 00 0a db 66 58 e0 00     01:04:22.152  READ VERIFY SECTOR(S) EXT

Error 91 [18] occurred at disk power-on lifetime: 3005 hours (125 days + 5 hours)
  When the command that caused the error occurred, the device was active or idle.

  After command completion occurred, registers were:
  ER -- ST COUNT  LBA_48  LH LM LL DV DC
  -- -- -- == -- == == == -- -- -- -- --
  40 -- 51 00 10 00 00 0a db 66 59 e0 00  Error: UNC at LBA = 0x0adb6659 = 182150745

  Commands leading to the command that caused the error were:
  CR FEATR COUNT  LBA_48  LH LM LL DV DC  Powered_Up_Time  Command/Feature_Name
  -- == -- == -- == == == -- -- -- -- --  ---------------  --------------------
  42 00 00 00 10 00 00 0a db 66 58 e0 00     01:04:24.650  READ VERIFY SECTOR(S) EXT
  42 00 00 00 20 00 00 0a db 66 78 e0 00     01:04:24.621  READ VERIFY SECTOR(S) EXT
  42 00 00 00 20 00 00 0a db 66 58 e0 00     01:04:22.152  READ VERIFY SECTOR(S) EXT
  42 00 00 00 40 00 00 0a db 66 58 e0 00     01:04:19.682  READ VERIFY SECTOR(S) EXT
  42 00 00 00 40 00 00 0a db 66 18 e0 00     01:04:19.682  READ VERIFY SECTOR(S) EXT

Error 90 [17] occurred at disk power-on lifetime: 3005 hours (125 days + 5 hours)
  When the command that caused the error occurred, the device was active or idle.

  After command completion occurred, registers were:
  ER -- ST COUNT  LBA_48  LH LM LL DV DC
  -- -- -- == -- == == == -- -- -- -- --
  40 -- 51 00 20 00 00 0a db 66 59 e0 00  Error: UNC at LBA = 0x0adb6659 = 182150745

  Commands leading to the command that caused the error were:
  CR FEATR COUNT  LBA_48  LH LM LL DV DC  Powered_Up_Time  Command/Feature_Name
  -- == -- == -- == == == -- -- -- -- --  ---------------  --------------------
  42 00 00 00 20 00 00 0a db 66 58 e0 00     01:04:22.152  READ VERIFY SECTOR(S) EXT
  42 00 00 00 40 00 00 0a db 66 58 e0 00     01:04:19.682  READ VERIFY SECTOR(S) EXT
  42 00 00 00 40 00 00 0a db 66 18 e0 00     01:04:19.682  READ VERIFY SECTOR(S) EXT
  42 00 00 00 80 00 00 0a db 66 18 e0 00     01:04:17.222  READ VERIFY SECTOR(S) EXT
  42 00 00 00 80 00 00 0a db 65 98 e0 00     01:04:17.222  READ VERIFY SECTOR(S) EXT

Error 89 [16] occurred at disk power-on lifetime: 3005 hours (125 days + 5 hours)
  When the command that caused the error occurred, the device was active or idle.

  After command completion occurred, registers were:
  ER -- ST COUNT  LBA_48  LH LM LL DV DC
  -- -- -- == -- == == == -- -- -- -- --
  40 -- 51 00 40 00 00 0a db 66 59 e0 00  Error: UNC at LBA = 0x0adb6659 = 182150745

  Commands leading to the command that caused the error were:
  CR FEATR COUNT  LBA_48  LH LM LL DV DC  Powered_Up_Time  Command/Feature_Name
  -- == -- == -- == == == -- -- -- -- --  ---------------  --------------------
  42 00 00 00 40 00 00 0a db 66 58 e0 00     01:04:19.682  READ VERIFY SECTOR(S) EXT
  42 00 00 00 40 00 00 0a db 66 18 e0 00     01:04:19.682  READ VERIFY SECTOR(S) EXT
  42 00 00 00 80 00 00 0a db 66 18 e0 00     01:04:17.222  READ VERIFY SECTOR(S) EXT
  42 00 00 00 80 00 00 0a db 65 98 e0 00     01:04:17.222  READ VERIFY SECTOR(S) EXT
  42 00 00 00 80 00 00 0a db 68 98 e0 00     01:04:17.221  READ VERIFY SECTOR(S) EXT

Error 88 [15] occurred at disk power-on lifetime: 3005 hours (125 days + 5 hours)
  When the command that caused the error occurred, the device was active or idle.

  After command completion occurred, registers were:
  ER -- ST COUNT  LBA_48  LH LM LL DV DC
  -- -- -- == -- == == == -- -- -- -- --
  40 -- 51 00 80 00 00 0a db 66 59 e0 00  Error: UNC at LBA = 0x0adb6659 = 182150745

  Commands leading to the command that caused the error were:
  CR FEATR COUNT  LBA_48  LH LM LL DV DC  Powered_Up_Time  Command/Feature_Name
  -- == -- == -- == == == -- -- -- -- --  ---------------  --------------------
  42 00 00 00 80 00 00 0a db 66 18 e0 00     01:04:17.222  READ VERIFY SECTOR(S) EXT
  42 00 00 00 80 00 00 0a db 65 98 e0 00     01:04:17.222  READ VERIFY SECTOR(S) EXT
  42 00 00 00 80 00 00 0a db 68 98 e0 00     01:04:17.221  READ VERIFY SECTOR(S) EXT
  42 00 00 01 00 00 00 0a db 67 98 e0 00     01:04:17.220  READ VERIFY SECTOR(S) EXT
  42 00 00 01 00 00 00 0a db 66 98 e0 00     01:04:17.189  READ VERIFY SECTOR(S) EXT

SMART Extended Self-test Log Version: 1 (1 sectors)
Num  Test_Description    Status                  Remaining  LifeTime(hours)  LBA_of_first_error
# 1  Conveyance offline  Completed: read failure       90%      3004         104963854
# 2  Short offline       Completed: read failure       90%      3004         104963854
# 3  Extended offline    Completed: read failure       90%      3004         104963854
# 4  Short offline       Completed: read failure       90%      3004         104963854
# 5  Short offline       Completed: read failure       90%      3004         104963854

SMART Selective self-test log data structure revision number 1
 SPAN  MIN_LBA  MAX_LBA  CURRENT_TEST_STATUS
    1        0        0  Not_testing
    2        0        0  Not_testing
    3        0        0  Not_testing
    4        0        0  Not_testing
    5        0        0  Not_testing
Selective self-test flags (0x0):
  After scanning selected spans, do NOT read-scan remainder of disk.
If Selective self-test is pending on power-up, resume after 0 minute delay.

SCT Status Version:                  3
SCT Version (vendor specific):       258 (0x0102)
SCT Support Level:                   1
Device State:                        Active (0)
Current Temperature:                    40 Celsius
Power Cycle Min/Max Temperature:     40/41 Celsius
Lifetime    Min/Max Temperature:      0/47 Celsius
Under/Over Temperature Limit Count:   0/0

SCT Temperature History Version:     2
Temperature Sampling Period:         1 minute
Temperature Logging Interval:        1 minute
Min/Max recommended Temperature:      0/60 Celsius
Min/Max Temperature Limit:           -41/85 Celsius
Temperature History Size (Index):    478 (46)

SCT Error Recovery Control command not supported

Device Statistics (GP/SMART Log 0x04) not supported

Pending Defects log (GP Log 0x0c) not supported

SATA Phy Event Counters (GP Log 0x11)
ID      Size     Value  Description
0x0001  2            0  Command failed due to ICRC error
0x0002  2            0  R_ERR response for data FIS
0x0003  2            0  R_ERR response for device-to-host data FIS
0x0004  2            0  R_ERR response for host-to-device data FIS
0x0005  2            0  R_ERR response for non-data FIS
0x0006  2            0  R_ERR response for device-to-host non-data FIS
0x0007  2            0  R_ERR response for host-to-device non-data FIS
0x000a  2            9  Device-to-host register FISes sent due to a COMRESET
0x000b  2            0  CRC errors within host-to-device FIS
0x8000  4        29837  Vendor specific

