smartctl 7.2 2020-12-30 r5155 [x86_64-linux-5.10.74-generic-2rosa2021.1-x86_64] (local build)
Copyright (C) 2002-20, Bruce Allen, Christian Franke, www.smartmontools.org

=== START OF INFORMATION SECTION ===
Model Family:     SAMSUNG SpinPoint P80
Device Model:     SAMSUNG SP0812C
Serial Number:    --
Firmware Version: SU100-27
User Capacity:    80,060,424,192 bytes [80.0 GB]
Sector Size:      512 bytes logical/physical
Device is:        In smartctl database [for details use: -P show]
ATA Version is:   ATA/ATAPI-7 T13/1532D revision 0
Local Time is:    Fri May 20 14:10:07 2022 +07
SMART support is: Available - device has SMART capability.
SMART support is: Enabled
AAM feature is:   Disabled
APM feature is:   Unavailable
Rd look-ahead is: Enabled
Write cache is:   Enabled
DSN feature is:   Unavailable
ATA Security is:  Disabled, NOT FROZEN [SEC1]
Wt Cache Reorder: Unavailable

=== START OF READ SMART DATA SECTION ===
SMART overall-health self-assessment test result: PASSED

General SMART Values:
Offline data collection status:  (0x80)	Offline data collection activity
					was never started.
					Auto Offline Data Collection: Enabled.
Self-test execution status:      ( 249)	Self-test routine in progress...
					90% of test remaining.
Total time to complete Offline 
data collection: 		( 3000) seconds.
Offline data collection
capabilities: 			 (0x1b) SMART execute Offline immediate.
					Auto Offline data collection on/off support.
					Suspend Offline collection upon new
					command.
					Offline surface scan supported.
					Self-test supported.
					No Conveyance Self-test supported.
					No Selective Self-test supported.
SMART capabilities:            (0x0003)	Saves SMART data before entering
					power-saving mode.
					Supports SMART auto save timer.
Error logging capability:        (0x01)	Error logging supported.
					No General Purpose Logging support.
Short self-test routine 
recommended polling time: 	 (   1) minutes.
Extended self-test routine
recommended polling time: 	 (  50) minutes.

SMART Attributes Data Structure revision number: 16
Vendor Specific SMART Attributes with Thresholds:
ID# ATTRIBUTE_NAME          FLAGS    VALUE WORST THRESH FAIL RAW_VALUE
  1 Raw_Read_Error_Rate     POSR--   100   100   051    -    3
  3 Spin_Up_Time            POS---   100   092   000    -    4096
  4 Start_Stop_Count        -O--CK   086   086   000    -    14994
  5 Reallocated_Sector_Ct   PO--CK   100   100   011    -    0
  7 Seek_Error_Rate         POSR--   100   100   051    -    0
  8 Seek_Time_Performance   P-S--K   100   100   000    -    0
  9 Power_On_Half_Minutes   -O--CK   098   098   000    -    11801h+14m
 10 Spin_Retry_Count        PO--C-   100   100   051    -    0
 12 Power_Cycle_Count       -O--CK   093   093   000    -    7287
194 Temperature_Celsius     -O---K   139   097   000    -    33
195 Hardware_ECC_Recovered  -O-RC-   001   001   000    -    115632610
196 Reallocated_Event_Count -O--C-   099   099   000    -    3
197 Current_Pending_Sector  PO--CK   100   100   011    -    0
198 Total_Offl_Uncorrectabl ----CK   099   099   011    -    3
199 UDMA_CRC_Error_Count    -OS-CK   200   172   000    -    26
200 Multi_Zone_Error_Rate   POSR--   100   100   051    -    0
201 Soft_Read_Error_Rate    POSR--   100   100   051    -    0
                            ||||||_ K auto-keep
                            |||||__ C event count
                            ||||___ R error rate
                            |||____ S speed/performance
                            ||_____ O updated online
                            |______ P prefailure warning

General Purpose Log Directory not supported

SMART Log Directory Version 1 [multi-sector log support]
Address    Access  R/W   Size  Description
0x00           SL  R/O      1  Log Directory
0x01           SL  R/O      1  Summary SMART error log
0x02           SL  R/O      2  Comprehensive SMART error log
0x06           SL  R/O      2  SMART self-test log
0x80-0x9f      SL  R/W     16  Host vendor specific log

SMART Extended Comprehensive Error Log (GP Log 0x03) not supported

SMART Error Log Version: 1
ATA Error Count: 2968 (device log contains only the most recent five errors)
	CR = Command Register [HEX]
	FR = Features Register [HEX]
	SC = Sector Count Register [HEX]
	SN = Sector Number Register [HEX]
	CL = Cylinder Low Register [HEX]
	CH = Cylinder High Register [HEX]
	DH = Device/Head Register [HEX]
	DC = Device Command Register [HEX]
	ER = Error register [HEX]
	ST = Status register [HEX]
Powered_Up_Time is measured from power on, and printed as
DDd+hh:mm:SS.sss where DD=days, hh=hours, mm=minutes,
SS=sec, and sss=millisec. It "wraps" after 49.710 days.

Error 2968 occurred at disk power-on lifetime: 11788 hours (491 days + 4 hours)
  When the command that caused the error occurred, the device was active or idle.

  After command completion occurred, registers were:
  ER ST SC SN CL CH DH
  -- -- -- -- -- -- --
  84 51 80 80 0e 07 e0  Error: ICRC, ABRT at LBA = 0x00070e80 = 462464

  Commands leading to the command that caused the error were:
  CR FR SC SN CL CH DH DC   Powered_Up_Time  Command/Feature_Name
  -- -- -- -- -- -- -- --  ----------------  --------------------
  ca 00 80 80 0e 07 e0 00      00:36:05.875  WRITE DMA
  ca 00 80 00 0e 27 e0 00      00:36:05.875  WRITE DMA
  ca 00 80 00 0e 07 e0 00      00:36:05.875  WRITE DMA
  ca 00 80 80 0d 27 e0 00      00:36:05.875  WRITE DMA
  ca 00 80 80 0d 07 e0 00      00:36:05.875  WRITE DMA

Error 2967 occurred at disk power-on lifetime: 11788 hours (491 days + 4 hours)
  When the command that caused the error occurred, the device was active or idle.

  After command completion occurred, registers were:
  ER ST SC SN CL CH DH
  -- -- -- -- -- -- --
  84 51 20 40 08 07 e0  Error: ICRC, ABRT at LBA = 0x00070840 = 460864

  Commands leading to the command that caused the error were:
  CR FR SC SN CL CH DH DC   Powered_Up_Time  Command/Feature_Name
  -- -- -- -- -- -- -- --  ----------------  --------------------
  ca 00 20 40 08 07 e0 00      00:36:05.625  WRITE DMA
  ca 00 20 00 08 27 e0 00      00:36:05.625  WRITE DMA
  ca 00 20 00 08 07 e0 00      00:36:05.625  WRITE DMA
  ca 00 20 e0 fc 26 e0 00      00:36:05.625  WRITE DMA
  ca 00 20 e0 fc 06 e0 00      00:36:05.625  WRITE DMA

Error 2966 occurred at disk power-on lifetime: 11740 hours (489 days + 4 hours)
  When the command that caused the error occurred, the device was active or idle.

  After command completion occurred, registers were:
  ER ST SC SN CL CH DH
  -- -- -- -- -- -- --
  84 51 08 10 83 19 e3  Error: ICRC, ABRT 8 sectors at LBA = 0x03198310 = 52003600

  Commands leading to the command that caused the error were:
  CR FR SC SN CL CH DH DC   Powered_Up_Time  Command/Feature_Name
  -- -- -- -- -- -- -- --  ----------------  --------------------
  c8 00 08 10 83 19 e3 00      02:35:23.125  READ DMA
  c8 00 c0 00 52 7d e1 00      02:35:23.125  READ DMA
  c8 00 08 c8 18 f0 e1 00      02:35:23.125  READ DMA
  c8 00 88 00 58 a6 e1 00      02:35:23.063  READ DMA
  ca 00 10 58 cb 11 e0 00      02:35:23.063  WRITE DMA

Error 2965 occurred at disk power-on lifetime: 11740 hours (489 days + 4 hours)
  When the command that caused the error occurred, the device was active or idle.

  After command completion occurred, registers were:
  ER ST SC SN CL CH DH
  -- -- -- -- -- -- --
  04 51 fe 00 00 00 40  Error: ABRT

  Commands leading to the command that caused the error were:
  CR FR SC SN CL CH DH DC   Powered_Up_Time  Command/Feature_Name
  -- -- -- -- -- -- -- --  ----------------  --------------------
  ef 05 fe 00 00 00 40 00      02:33:40.188  SET FEATURES [Enable APM]
  c8 00 00 a0 8c 54 e1 00      02:33:40.188  READ DMA
  c8 00 00 f0 36 3c e1 00      02:33:40.188  READ DMA
  c8 00 00 38 ef 7f e1 00      02:33:40.125  READ DMA
  e7 00 00 77 13 94 a0 00      02:33:40.125  FLUSH CACHE

Error 2964 occurred at disk power-on lifetime: 11740 hours (489 days + 4 hours)
  When the command that caused the error occurred, the device was active or idle.

  After command completion occurred, registers were:
  ER ST SC SN CL CH DH
  -- -- -- -- -- -- --
  04 51 fe 00 00 00 40  Error: ABRT

  Commands leading to the command that caused the error were:
  CR FR SC SN CL CH DH DC   Powered_Up_Time  Command/Feature_Name
  -- -- -- -- -- -- -- --  ----------------  --------------------
  ef 05 fe 00 00 00 40 00      02:33:32.688  SET FEATURES [Enable APM]
  c8 00 20 98 c0 7b e1 00      02:33:32.688  READ DMA
  c8 00 08 40 89 25 e1 00      02:33:32.688  READ DMA
  c8 00 b8 60 89 25 e1 00      02:33:32.688  READ DMA
  c8 00 18 48 89 25 e1 00      02:33:32.688  READ DMA

SMART Extended Self-test Log (GP Log 0x07) not supported

SMART Self-test log structure revision number 1
Num  Test_Description    Status                  Remaining  LifeTime(hours)  LBA_of_first_error
# 1  Short offline       Completed without error       00%      2800         -

Selective Self-tests/Logging not supported

SCT Commands not supported

Device Statistics (GP/SMART Log 0x04) not supported

Pending Defects log (GP Log 0x0c) not supported

SATA Phy Event Counters (GP Log 0x11) not supported

