smartctl 7.2 2020-12-30 r5155 [x86_64-linux-6.9.3-76060903-generic] (local build)
Copyright (C) 2002-20, Bruce Allen, Christian Franke, www.smartmontools.org

=== START OF INFORMATION SECTION ===
Model Number:                       CT4000T700SSD3
Serial Number:                      --
Firmware Version:                   PACR5103
PCI Vendor/Subsystem ID:            0xc0a9
IEEE OUI Identifier:                0x00a075
Controller ID:                      0
NVMe Version:                       2.0
Number of Namespaces:               1
Namespace 1 Size/Capacity:          4,000,787,030,016 [4.00 TB]
Namespace 1 Formatted LBA Size:     512
Namespace 1 IEEE EUI-64:            00a075 ...
Local Time is:                      Mon Feb  3 00:17:31 2025 PST
Firmware Updates (0x12):            1 Slot, no Reset required
Optional Admin Commands (0x0017):   Security Format Frmw_DL Self_Test
Optional NVM Commands (0x005e):     Wr_Unc DS_Mngmt Wr_Zero Sav/Sel_Feat Timestmp
Log Page Attributes (0x3e):         Cmd_Eff_Lg Ext_Get_Lg Telmtry_Lg Pers_Ev_Lg *Other*
Maximum Data Transfer Size:         128 Pages
Warning  Comp. Temp. Threshold:     87 Celsius
Critical Comp. Temp. Threshold:     89 Celsius

Supported Power States
St Op     Max   Active     Idle   RL RT WL WT  Ent_Lat  Ex_Lat
 0 +    11.50W       -        -    0  0  0  0      800    1000
 1 +     8.00W       -        -    0  0  0  0      800    1000
 2 +     6.00W       -        -    0  0  0  0      800    1000
 3 -   0.1440W       -        -    0  0  0  0     3000    3000
 4 -   0.1440W       -        -    0  0  0  0     3000    3000

Supported LBA Sizes (NSID 0x1)
Id Fmt  Data  Metadt  Rel_Perf
 0 +     512       0         1
 1 -    4096       0         0

=== START OF SMART DATA SECTION ===
SMART overall-health self-assessment test result: PASSED

SMART/Health Information (NVMe Log 0x02)
Critical Warning:                   0x00
Temperature:                        41 Celsius
Available Spare:                    100%
Available Spare Threshold:          5%
Percentage Used:                    0%
Data Units Read:                    7,828,763 [4.00 TB]
Data Units Written:                 5,199,996 [2.66 TB]
Host Read Commands:                 34,286,060
Host Write Commands:                48,420,485
Controller Busy Time:               141
Power Cycles:                       43
Power On Hours:                     4,051
Unsafe Shutdowns:                   8
Media and Data Integrity Errors:    0
Error Information Log Entries:      0
Warning  Comp. Temperature Time:    0
Critical Comp. Temperature Time:    0

Error Information (NVMe Log 0x01, 16 of 16 entries)
No Errors Logged



