smartctl 7.4 2023-08-01 r5530 [x86_64-linux-6.14.2-desktop-3omv2590] (OpenMandriva Lx 7.4-1)
Copyright (C) 2002-23, Bruce Allen, Christian Franke, www.smartmontools.org

=== START OF INFORMATION SECTION ===
Model Number:                       SAMSUNG MZVPW256HEGL-00000
Serial Number:                      --
Firmware Version:                   CXZ7500Q
PCI Vendor/Subsystem ID:            0x144d
IEEE OUI Identifier:                0x002538
Total NVM Capacity:                 256,060,514,304 [256 GB]
Unallocated NVM Capacity:           0
Controller ID:                      2
NVMe Version:                       1.2
Number of Namespaces:               1
Namespace 1 Size/Capacity:          256,060,514,304 [256 GB]
Namespace 1 Utilization:            31,721,807,872 [31.7 GB]
Namespace 1 Formatted LBA Size:     512
Namespace 1 IEEE EUI-64:            002538 ...
Local Time is:                      Thu Jul  3 05:16:50 2025 BST
Firmware Updates (0x16):            3 Slots, no Reset required
Optional Admin Commands (0x0017):   Security Format Frmw_DL Self_Test
Optional NVM Commands (0x001f):     Comp Wr_Unc DS_Mngmt Wr_Zero Sav/Sel_Feat
Log Page Attributes (0x03):         S/H_per_NS Cmd_Eff_Lg
Warning  Comp. Temp. Threshold:     70 Celsius
Critical Comp. Temp. Threshold:     73 Celsius

Supported Power States
St Op     Max   Active     Idle   RL RT WL WT  Ent_Lat  Ex_Lat
 0 +     6.80W       -        -    0  0  0  0        0       0
 1 +     5.60W       -        -    1  1  1  1        0       0
 2 +     4.40W       -        -    2  2  2  2        0       0
 3 -   0.0400W       -        -    3  3  3  3      210    1500
 4 -   0.0050W       -        -    4  4  4  4     2200    6000

Supported LBA Sizes (NSID 0x1)
Id Fmt  Data  Metadt  Rel_Perf
 0 +     512       0         0

=== START OF SMART DATA SECTION ===
SMART overall-health self-assessment test result: PASSED

SMART/Health Information (NVMe Log 0x02)
Critical Warning:                   0x00
Temperature:                        51 Celsius
Available Spare:                    100%
Available Spare Threshold:          10%
Percentage Used:                    8%
Data Units Read:                    89,393,649 [45.7 TB]
Data Units Written:                 58,349,851 [29.8 TB]
Host Read Commands:                 1,053,184,958
Host Write Commands:                599,395,113
Controller Busy Time:               4,142
Power Cycles:                       2,086
Power On Hours:                     2,715
Unsafe Shutdowns:                   59
Media and Data Integrity Errors:    0
Error Information Log Entries:      8,852
Warning  Comp. Temperature Time:    0
Critical Comp. Temperature Time:    0
Temperature Sensor 1:               51 Celsius
Temperature Sensor 2:               57 Celsius

Error Information (NVMe Log 0x01, 16 of 64 entries)
Num   ErrCount  SQId   CmdId  Status  PELoc          LBA  NSID    VS  Message
  0       8852     0  0x0018  0x4004      -            0     0     -  Invalid Field in Command
  1       8851     0  0x0018  0x4004      -            0     0     -  Invalid Field in Command
  2       8850     0  0x4002  0x4004      -            0     0     -  Invalid Field in Command
  3       8849     0  0x0018  0x4004      -            0     0     -  Invalid Field in Command
  4       8848     0  0x301b  0x4004      -            0     0     -  Invalid Field in Command
  5       8847     0  0x0010  0x4004      -            0     0     -  Invalid Field in Command
  6       8846     0  0x001e  0x4004      -            0     0     -  Invalid Field in Command
  7       8845     0  0x001a  0x4004      -            0     0     -  Invalid Field in Command
  8       8844     0  0x0016  0x4004      -            0     0     -  Invalid Field in Command
  9       8843     0  0x0007  0x4004      -            0     0     -  Invalid Field in Command
 10       8842     0  0x000c  0x4004      -            0     0     -  Invalid Field in Command
 11       8841     0  0x0010  0x4004      -            0     0     -  Invalid Field in Command
 12       8840     0  0x0010  0x4004      -            0     0     -  Invalid Field in Command
 13       8839     0  0x000c  0x4004      -            0     0     -  Invalid Field in Command
 14       8838     0  0x0014  0x4004      -            0     0     -  Invalid Field in Command
 15       8837     0  0x0007  0x4004      -            0     0     -  Invalid Field in Command
... (48 entries not read)

Self-test Log (NVMe Log 0x06)
Self-test status: No self-test in progress
No Self-tests Logged

