smartctl 7.4 2023-08-01 r5530 [x86_64-linux-6.14.2-desktop-3omv2590] (OpenMandriva Lx 7.4-1)
Copyright (C) 2002-23, Bruce Allen, Christian Franke, www.smartmontools.org

=== START OF INFORMATION SECTION ===
Model Family:     SandForce Driven SSDs
Device Model:     SanDisk SDSSDA120G
Serial Number:    --
LU WWN Device Id: 5 001b44 ...
Firmware Version: Z33130RL
User Capacity:    120,034,123,776 bytes [120 GB]
Sector Size:      512 bytes logical/physical
Rotation Rate:    Solid State Device
Form Factor:      2.5 inches
TRIM Command:     Available, deterministic, zeroed
Device is:        In smartctl database
ATA Version is:   ACS-2 T13/2015-D revision 3
SATA Version is:  SATA 3.2, 6.0 Gb/s (current: 6.0 Gb/s)
Local Time is:    Wed May 21 21:20:18 2025 CEST
SMART support is: Available - device has SMART capability.
SMART support is: Enabled
AAM feature is:   Unavailable
APM level is:     128 (minimum power consumption without standby)
Rd look-ahead is: Enabled
Write cache is:   Enabled
DSN feature is:   Unavailable
ATA Security is:  Disabled, frozen [SEC2]
Wt Cache Reorder: Unavailable

=== START OF READ SMART DATA SECTION ===
SMART overall-health self-assessment test result: PASSED

General SMART Values:
Offline data collection status:  (0x00)	Offline data collection activity
					was never started.
					Auto Offline Data Collection: Disabled.
Self-test execution status:      (   0)	The previous self-test routine completed
					without error or no self-test has ever 
					been run.
Total time to complete Offline 
data collection: 		(  120) seconds.
Offline data collection
capabilities: 			 (0x11) SMART execute Offline immediate.
					No Auto Offline data collection support.
					Suspend Offline collection upon new
					command.
					No Offline surface scan supported.
					Self-test supported.
					No Conveyance Self-test supported.
					No Selective Self-test supported.
SMART capabilities:            (0x0003)	Saves SMART data before entering
					power-saving mode.
					Supports SMART auto save timer.
Error logging capability:        (0x01)	Error logging supported.
					General Purpose Logging supported.
Short self-test routine 
recommended polling time: 	 (   2) minutes.
Extended self-test routine
recommended polling time: 	 (  10) minutes.

SMART Attributes Data Structure revision number: 1
Vendor Specific SMART Attributes with Thresholds:
ID# ATTRIBUTE_NAME          FLAGS    VALUE WORST THRESH FAIL RAW_VALUE
  5 Retired_Block_Count     -O--CK   100   100   000    -    0
  9 Power_On_Hours_and_Msec -O--CK   000   100   000    -    5414h+00m+00.000s
 12 Power_Cycle_Count       -O--CK   100   100   000    -    2361
165 Unknown_Attribute       -O--CK   100   100   000    -    14384103821124
166 Unknown_Attribute       -O--CK   100   100   000    -    49
167 Unknown_Attribute       -O--CK   100   100   000    -    0
168 Unknown_Attribute       -O--CK   100   100   000    -    125
169 Unknown_Attribute       -O--CK   100   100   000    -    0
170 Reserve_Block_Count     -O--CK   100   100   000    -    0
171 Program_Fail_Count      -O--CK   100   100   000    -    0
172 Erase_Fail_Count        -O--CK   100   100   000    -    0
173 Unknown_SandForce_Attr  -O--CK   100   100   000    -    71
174 Unexpect_Power_Loss_Ct  -O--CK   100   100   000    -    390
187 Reported_Uncorrect      -O--CK   100   100   000    -    0
188 Command_Timeout         -O--CK   100   100   000    -    0
194 Temperature_Celsius     -O---K   066   032   000    -    34 (Min/Max 0/68)
199 SATA_CRC_Error_Count    -O--CK   100   100   000    -    0
230 Life_Curve_Status       -O--CK   100   100   000    -    5592114464022
232 Available_Reservd_Space PO--CK   100   100   004    -    100
233 SandForce_Internal      -O--CK   100   100   000    -    8571
234 SandForce_Internal      -O--CK   100   100   000    -    18275
241 Lifetime_Writes_GiB     ----CK   253   253   000    -    11290
242 Lifetime_Reads_GiB      ----CK   253   253   000    -    16259
244 Unknown_Attribute       -O--CK   000   100   000    -    0
                            ||||||_ K auto-keep
                            |||||__ C event count
                            ||||___ R error rate
                            |||____ S speed/performance
                            ||_____ O updated online
                            |______ P prefailure warning

General Purpose Log Directory Version 1
SMART           Log Directory Version 1 [multi-sector log support]
Address    Access  R/W   Size  Description
0x00       GPL,SL  R/O      1  Log Directory
0x01           SL  R/O      1  Summary SMART error log
0x02           SL  R/O      1  Comprehensive SMART error log
0x03       GPL     R/O      1  Ext. Comprehensive SMART error log
0x04       GPL,SL  R/O      8  Device Statistics log
0x06           SL  R/O      1  SMART self-test log
0x07       GPL     R/O      1  Extended self-test log
0x10       GPL     R/O      1  NCQ Command Error log
0x11       GPL     R/O      1  SATA Phy Event Counters log
0x30       GPL,SL  R/O      9  IDENTIFY DEVICE data log
0x80-0x9f  GPL,SL  R/W     16  Host vendor specific log
0xde       GPL     VS       8  Device vendor specific log

SMART Extended Comprehensive Error Log Version: 1 (1 sectors)
Device Error Count: 3
	CR     = Command Register
	FEATR  = Features Register
	COUNT  = Count (was: Sector Count) Register
	LBA_48 = Upper bytes of LBA High/Mid/Low Registers ]  ATA-8
	LH     = LBA High (was: Cylinder High) Register    ]   LBA
	LM     = LBA Mid (was: Cylinder Low) Register      ] Register
	LL     = LBA Low (was: Sector Number) Register     ]
	DV     = Device (was: Device/Head) Register
	DC     = Device Control Register
	ER     = Error register
	ST     = Status register
Powered_Up_Time is measured from power on, and printed as
DDd+hh:mm:SS.sss where DD=days, hh=hours, mm=minutes,
SS=sec, and sss=millisec. It "wraps" after 49.710 days.

Error 3 [2] log entry is empty
Error 2 [1] log entry is empty
Error 1 [0] log entry is empty
SMART Extended Self-test Log Version: 1 (1 sectors)
Num  Test_Description    Status                  Remaining  LifeTime(hours)  LBA_of_first_error
# 1  Short offline       Completed without error       00%      5270         -
# 2  Short offline       Completed without error       00%      5268         -
# 3  Short offline       Completed without error       00%      5264         -
# 4  Short offline       Completed without error       00%      4558         -
# 5  Extended offline    Completed without error       00%      4558         -
# 6  Short offline       Completed without error       00%      4558         -
# 7  Short offline       Completed without error       00%      4132         -
# 8  Short offline       Completed without error       00%      4130         -
# 9  Short offline       Completed without error       00%      4129         -
#10  Extended offline    Completed without error       00%      4128         -
#11  Extended offline    Completed without error       00%      4128         -
#12  Short offline       Completed without error       00%      4128         -
#13  Short offline       Completed without error       00%      4128         -
#14  Short offline       Completed without error       00%      4128         -
#15  Short offline       Completed without error       00%      4128         -

Selective Self-tests/Logging not supported

SCT Commands not supported

Device Statistics (GP Log 0x04)
Page  Offset Size        Value Flags Description
0x01  =====  =               =  ===  == General Statistics (rev 1) ==
0x01  0x008  4            2361  ---  Lifetime Power-On Resets
0x01  0x010  4            5414  ---  Power-on Hours
0x01  0x018  6      2203300368  ---  Logical Sectors Written
0x01  0x020  6       240234839  ---  Number of Write Commands
0x01  0x028  6      4034308303  ---  Logical Sectors Read
0x01  0x030  6       569270780  ---  Number of Read Commands
0x07  =====  =               =  ===  == Solid State Device Statistics (rev 1) ==
0x07  0x008  1               2  ---  Percentage Used Endurance Indicator
                                |||_ C monitored condition met
                                ||__ D supports DSN
                                |___ N normalized value

Pending Defects log (GP Log 0x0c) not supported

SATA Phy Event Counters (GP Log 0x11)
ID      Size     Value  Description
0x0001  4            0  Command failed due to ICRC error
0x0002  4            0  R_ERR response for data FIS
0x0005  4            0  R_ERR response for non-data FIS
0x000a  4            2  Device-to-host register FISes sent due to a COMRESET

