smartctl 7.3 2022-02-28 r5338 [x86_64-linux-5.10.155-generic-1rosa2021.1-x86_64] (local build)
Copyright (C) 2002-22, Bruce Allen, Christian Franke, www.smartmontools.org

=== START OF INFORMATION SECTION ===
Model Family:     Seagate BarraCuda 3.5 (CMR)
Device Model:     ST1000DM010-2EP102
Serial Number:    --
LU WWN Device Id: 5 000c50 ...
Firmware Version: CC43
User Capacity:    1,000,204,886,016 bytes [1.00 TB]
Sector Sizes:     512 bytes logical, 4096 bytes physical
Rotation Rate:    7200 rpm
Form Factor:      3.5 inches
Device is:        In smartctl database 7.3/5319
ATA Version is:   ATA8-ACS T13/1699-D revision 4
SATA Version is:  SATA 3.0, 6.0 Gb/s (current: 3.0 Gb/s)
Local Time is:    Sat Dec  7 18:38:23 2024 MSK
SMART support is: Available - device has SMART capability.
SMART support is: Enabled
AAM feature is:   Unavailable
APM level is:     128 (minimum power consumption without standby)
Rd look-ahead is: Enabled
Write cache is:   Enabled
DSN feature is:   Unavailable
ATA Security is:  Disabled, NOT FROZEN [SEC1]
Wt Cache Reorder: Unavailable

=== START OF READ SMART DATA SECTION ===
SMART overall-health self-assessment test result: PASSED

General SMART Values:
Offline data collection status:  (0x00)	Offline data collection activity
					was never started.
					Auto Offline Data Collection: Disabled.
Self-test execution status:      (   0)	The previous self-test routine completed
					without error or no self-test has ever 
					been run.
Total time to complete Offline 
data collection: 		(    0) seconds.
Offline data collection
capabilities: 			 (0x73) SMART execute Offline immediate.
					Auto Offline data collection on/off support.
					Suspend Offline collection upon new
					command.
					No Offline surface scan supported.
					Self-test supported.
					Conveyance Self-test supported.
					Selective Self-test supported.
SMART capabilities:            (0x0003)	Saves SMART data before entering
					power-saving mode.
					Supports SMART auto save timer.
Error logging capability:        (0x01)	Error logging supported.
					General Purpose Logging supported.
Short self-test routine 
recommended polling time: 	 (   1) minutes.
Extended self-test routine
recommended polling time: 	 ( 108) minutes.
Conveyance self-test routine
recommended polling time: 	 (   2) minutes.
SCT capabilities: 	       (0x1085)	SCT Status supported.

SMART Attributes Data Structure revision number: 10
Vendor Specific SMART Attributes with Thresholds:
ID# ATTRIBUTE_NAME          FLAGS    VALUE WORST THRESH FAIL RAW_VALUE
  1 Raw_Read_Error_Rate     POSR--   078   063   006    -    67534368
  3 Spin_Up_Time            PO----   097   096   000    -    0
  4 Start_Stop_Count        -O--CK   094   094   020    -    6636
  5 Reallocated_Sector_Ct   PO--CK   100   100   010    -    0
  7 Seek_Error_Rate         POSR--   075   060   045    -    40734813
  9 Power_On_Hours          -O--CK   096   096   000    -    4025
 10 Spin_Retry_Count        PO--C-   100   100   097    -    0
 12 Power_Cycle_Count       -O--CK   090   090   020    -    10546
183 Runtime_Bad_Block       -O--CK   100   100   000    -    0
184 End-to-End_Error        -O--CK   100   100   099    -    0
187 Reported_Uncorrect      -O--CK   080   080   000    -    20
188 Command_Timeout         -O--CK   100   099   000    -    1 1 12
189 High_Fly_Writes         -O-RCK   100   100   000    -    0
190 Airflow_Temperature_Cel -O---K   071   057   040    -    29 (Min/Max 27/29)
193 Load_Cycle_Count        -O--CK   095   095   000    -    11457
194 Temperature_Celsius     -O---K   029   016   000    -    29 (0 16 0 0 0)
195 Hardware_ECC_Recovered  -O-RC-   001   001   000    -    67534368
197 Current_Pending_Sector  -O--C-   100   100   000    -    0
198 Offline_Uncorrectable   ----C-   100   100   000    -    0
199 UDMA_CRC_Error_Count    -OSRCK   200   196   000    -    32
240 Head_Flying_Hours       ------   100   253   000    -    3879h+01m+48.420s
241 Total_LBAs_Written      ------   100   253   000    -    14477838337
242 Total_LBAs_Read         ------   100   253   000    -    13667577244
                            ||||||_ K auto-keep
                            |||||__ C event count
                            ||||___ R error rate
                            |||____ S speed/performance
                            ||_____ O updated online
                            |______ P prefailure warning

General Purpose Log Directory Version 1
SMART           Log Directory Version 1 [multi-sector log support]
Address    Access  R/W   Size  Description
0x00       GPL,SL  R/O      1  Log Directory
0x01           SL  R/O      1  Summary SMART error log
0x02           SL  R/O      5  Comprehensive SMART error log
0x03       GPL     R/O      5  Ext. Comprehensive SMART error log
0x04       GPL,SL  R/O      8  Device Statistics log
0x06           SL  R/O      1  SMART self-test log
0x07       GPL     R/O      1  Extended self-test log
0x09           SL  R/W      1  Selective self-test log
0x10       GPL     R/O      1  NCQ Command Error log
0x11       GPL     R/O      1  SATA Phy Event Counters log
0x21       GPL     R/O      1  Write stream error log
0x22       GPL     R/O      1  Read stream error log
0x24       GPL     R/O    512  Current Device Internal Status Data log
0x30       GPL,SL  R/O      9  IDENTIFY DEVICE data log
0x80-0x9f  GPL,SL  R/W     16  Host vendor specific log
0xa1       GPL,SL  VS      20  Device vendor specific log
0xa2       GPL     VS    4120  Device vendor specific log
0xa8       GPL,SL  VS     129  Device vendor specific log
0xa9       GPL,SL  VS       1  Device vendor specific log
0xab       GPL     VS       1  Device vendor specific log
0xb0       GPL     VS    4800  Device vendor specific log
0xbe-0xbf  GPL     VS   65535  Device vendor specific log
0xc0       GPL,SL  VS       1  Device vendor specific log
0xc1       GPL,SL  VS      10  Device vendor specific log
0xe0       GPL,SL  R/W      1  SCT Command/Status
0xe1       GPL,SL  R/W      1  SCT Data Transfer

SMART Extended Comprehensive Error Log Version: 1 (5 sectors)
Device Error Count: 22 (device log contains only the most recent 20 errors)
	CR     = Command Register
	FEATR  = Features Register
	COUNT  = Count (was: Sector Count) Register
	LBA_48 = Upper bytes of LBA High/Mid/Low Registers ]  ATA-8
	LH     = LBA High (was: Cylinder High) Register    ]   LBA
	LM     = LBA Mid (was: Cylinder Low) Register      ] Register
	LL     = LBA Low (was: Sector Number) Register     ]
	DV     = Device (was: Device/Head) Register
	DC     = Device Control Register
	ER     = Error register
	ST     = Status register
Powered_Up_Time is measured from power on, and printed as
DDd+hh:mm:SS.sss where DD=days, hh=hours, mm=minutes,
SS=sec, and sss=millisec. It "wraps" after 49.710 days.

Error 22 [1] occurred at disk power-on lifetime: 2287 hours (95 days + 7 hours)
  When the command that caused the error occurred, the device was active or idle.

  After command completion occurred, registers were:
  ER -- ST COUNT  LBA_48  LH LM LL DV DC
  -- -- -- == -- == == == -- -- -- -- --
  40 -- 51 00 00 00 00 60 56 ca e8 00 00  Error: UNC at LBA = 0x6056cae8 = 1616300776

  Commands leading to the command that caused the error were:
  CR FEATR COUNT  LBA_48  LH LM LL DV DC  Powered_Up_Time  Command/Feature_Name
  -- == -- == -- == == == -- -- -- -- --  ---------------  --------------------
  25 00 00 00 08 00 00 60 56 ca e8 e0 00     00:12:02.462  READ DMA EXT
  25 00 00 00 08 00 00 60 56 ca e0 e0 00     00:12:02.460  READ DMA EXT
  25 00 00 00 08 00 00 60 56 ca d8 e0 00     00:12:02.460  READ DMA EXT
  25 00 00 00 08 00 00 60 56 ca d0 e0 00     00:12:02.460  READ DMA EXT
  25 00 00 00 08 00 00 60 56 ca c8 e0 00     00:12:02.460  READ DMA EXT

Error 21 [0] occurred at disk power-on lifetime: 2287 hours (95 days + 7 hours)
  When the command that caused the error occurred, the device was active or idle.

  After command completion occurred, registers were:
  ER -- ST COUNT  LBA_48  LH LM LL DV DC
  -- -- -- == -- == == == -- -- -- -- --
  40 -- 51 00 00 00 00 60 56 ca e8 00 00  Error: UNC at LBA = 0x6056cae8 = 1616300776

  Commands leading to the command that caused the error were:
  CR FEATR COUNT  LBA_48  LH LM LL DV DC  Powered_Up_Time  Command/Feature_Name
  -- == -- == -- == == == -- -- -- -- --  ---------------  --------------------
  25 00 00 02 00 00 00 5f fa d4 00 e0 00     00:11:37.586  READ DMA EXT
  25 00 00 02 00 00 00 5f fa d2 00 e0 00     00:11:37.584  READ DMA EXT
  25 00 00 02 00 00 00 5f fa d0 00 e0 00     00:11:37.582  READ DMA EXT
  25 00 00 02 00 00 00 5f fa ce 00 e0 00     00:11:37.581  READ DMA EXT
  25 00 00 02 00 00 00 5f fa cc 00 e0 00     00:11:37.570  READ DMA EXT

Error 20 [19] occurred at disk power-on lifetime: 2281 hours (95 days + 1 hours)
  When the command that caused the error occurred, the device was active or idle.

  After command completion occurred, registers were:
  ER -- ST COUNT  LBA_48  LH LM LL DV DC
  -- -- -- == -- == == == -- -- -- -- --
  40 -- 51 00 00 00 00 60 56 ca e8 00 00  Error: UNC at LBA = 0x6056cae8 = 1616300776

  Commands leading to the command that caused the error were:
  CR FEATR COUNT  LBA_48  LH LM LL DV DC  Powered_Up_Time  Command/Feature_Name
  -- == -- == -- == == == -- -- -- -- --  ---------------  --------------------
  25 00 00 00 08 00 00 60 56 ca e8 e0 00     00:00:29.918  READ DMA EXT
  27 00 00 00 00 00 00 00 00 00 00 e0 00     00:00:29.913  READ NATIVE MAX ADDRESS EXT [OBS-ACS-3]
  ec 00 00 00 00 00 00 00 00 00 00 a0 00     00:00:29.910  IDENTIFY DEVICE
  ef 00 03 00 42 00 00 00 00 00 00 a0 00     00:00:29.892  SET FEATURES [Set transfer mode]
  27 00 00 00 00 00 00 00 00 00 00 e0 00     00:00:29.891  READ NATIVE MAX ADDRESS EXT [OBS-ACS-3]

Error 19 [18] occurred at disk power-on lifetime: 2281 hours (95 days + 1 hours)
  When the command that caused the error occurred, the device was active or idle.

  After command completion occurred, registers were:
  ER -- ST COUNT  LBA_48  LH LM LL DV DC
  -- -- -- == -- == == == -- -- -- -- --
  40 -- 51 00 00 00 00 60 56 ca e8 00 00  Error: UNC at LBA = 0x6056cae8 = 1616300776

  Commands leading to the command that caused the error were:
  CR FEATR COUNT  LBA_48  LH LM LL DV DC  Powered_Up_Time  Command/Feature_Name
  -- == -- == -- == == == -- -- -- -- --  ---------------  --------------------
  25 00 00 00 08 00 00 60 56 ca e8 e0 00     00:00:29.576  READ DMA EXT
  27 00 00 00 00 00 00 00 00 00 00 e0 00     00:00:29.572  READ NATIVE MAX ADDRESS EXT [OBS-ACS-3]
  ec 00 00 00 00 00 00 00 00 00 00 a0 00     00:00:29.570  IDENTIFY DEVICE
  ef 00 03 00 42 00 00 00 00 00 00 a0 00     00:00:29.551  SET FEATURES [Set transfer mode]
  27 00 00 00 00 00 00 00 00 00 00 e0 00     00:00:29.551  READ NATIVE MAX ADDRESS EXT [OBS-ACS-3]

Error 18 [17] occurred at disk power-on lifetime: 2281 hours (95 days + 1 hours)
  When the command that caused the error occurred, the device was active or idle.

  After command completion occurred, registers were:
  ER -- ST COUNT  LBA_48  LH LM LL DV DC
  -- -- -- == -- == == == -- -- -- -- --
  40 -- 51 00 00 00 00 60 56 ca e8 00 00  Error: UNC at LBA = 0x6056cae8 = 1616300776

  Commands leading to the command that caused the error were:
  CR FEATR COUNT  LBA_48  LH LM LL DV DC  Powered_Up_Time  Command/Feature_Name
  -- == -- == -- == == == -- -- -- -- --  ---------------  --------------------
  25 00 00 00 08 00 00 60 56 ca e8 e0 00     00:01:12.056  READ DMA EXT
  ea 00 00 00 00 00 00 58 56 c0 97 a0 00     00:01:12.027  FLUSH CACHE EXT
  35 00 00 00 08 00 00 58 56 c0 90 e0 00     00:01:12.026  WRITE DMA EXT
  35 00 00 0a 00 00 00 59 a6 4a 90 e0 00     00:01:12.009  WRITE DMA EXT
  ea 00 00 00 00 00 00 66 5b a0 0f a0 00     00:01:11.996  FLUSH CACHE EXT

Error 17 [16] occurred at disk power-on lifetime: 2281 hours (95 days + 1 hours)
  When the command that caused the error occurred, the device was active or idle.

  After command completion occurred, registers were:
  ER -- ST COUNT  LBA_48  LH LM LL DV DC
  -- -- -- == -- == == == -- -- -- -- --
  40 -- 51 00 00 00 00 60 56 ca e8 00 00  Error: UNC at LBA = 0x6056cae8 = 1616300776

  Commands leading to the command that caused the error were:
  CR FEATR COUNT  LBA_48  LH LM LL DV DC  Powered_Up_Time  Command/Feature_Name
  -- == -- == -- == == == -- -- -- -- --  ---------------  --------------------
  25 00 00 00 08 00 00 60 56 ca e8 e0 00     00:01:09.609  READ DMA EXT
  35 00 00 00 08 00 00 6d 07 91 40 e0 00     00:01:09.608  WRITE DMA EXT
  35 00 00 09 a8 00 00 59 a3 f6 e8 e0 00     00:01:09.601  WRITE DMA EXT
  35 00 00 00 10 00 00 59 a5 c4 60 e0 00     00:01:09.599  WRITE DMA EXT
  35 00 00 00 98 00 00 59 a5 dd d0 e0 00     00:01:09.599  WRITE DMA EXT

Error 16 [15] occurred at disk power-on lifetime: 2281 hours (95 days + 1 hours)
  When the command that caused the error occurred, the device was active or idle.

  After command completion occurred, registers were:
  ER -- ST COUNT  LBA_48  LH LM LL DV DC
  -- -- -- == -- == == == -- -- -- -- --
  40 -- 51 00 00 00 00 60 56 ca e8 00 00  Error: UNC at LBA = 0x6056cae8 = 1616300776

  Commands leading to the command that caused the error were:
  CR FEATR COUNT  LBA_48  LH LM LL DV DC  Powered_Up_Time  Command/Feature_Name
  -- == -- == -- == == == -- -- -- -- --  ---------------  --------------------
  25 00 00 00 08 00 00 60 56 ca e8 e0 00     00:01:07.255  READ DMA EXT
  ea 00 00 00 00 00 00 58 56 c0 97 a0 00     00:01:07.220  FLUSH CACHE EXT
  35 00 00 00 08 00 00 58 56 c0 90 e0 00     00:01:07.220  WRITE DMA EXT
  35 00 00 00 08 00 00 59 7d 22 80 e0 00     00:01:07.220  WRITE DMA EXT
  35 00 00 06 00 00 00 59 a3 dc e8 e0 00     00:01:07.216  WRITE DMA EXT

Error 15 [14] occurred at disk power-on lifetime: 2281 hours (95 days + 1 hours)
  When the command that caused the error occurred, the device was active or idle.

  After command completion occurred, registers were:
  ER -- ST COUNT  LBA_48  LH LM LL DV DC
  -- -- -- == -- == == == -- -- -- -- --
  40 -- 51 00 00 00 00 60 56 ca e8 00 00  Error: UNC at LBA = 0x6056cae8 = 1616300776

  Commands leading to the command that caused the error were:
  CR FEATR COUNT  LBA_48  LH LM LL DV DC  Powered_Up_Time  Command/Feature_Name
  -- == -- == -- == == == -- -- -- -- --  ---------------  --------------------
  25 00 00 00 08 00 00 60 56 ca e8 e0 00     00:01:04.876  READ DMA EXT
  35 00 00 0a 00 00 00 59 a3 d2 e8 e0 00     00:01:04.868  WRITE DMA EXT
  35 00 00 00 08 00 00 59 a5 c3 e8 e0 00     00:01:04.867  WRITE DMA EXT
  35 00 00 0a 00 00 00 59 a3 c8 e8 e0 00     00:01:04.862  WRITE DMA EXT
  35 00 00 00 08 00 00 59 a5 c3 d8 e0 00     00:01:04.861  WRITE DMA EXT

SMART Extended Self-test Log Version: 1 (1 sectors)
No self-tests have been logged.  [To run self-tests, use: smartctl -t]

SMART Selective self-test log data structure revision number 1
 SPAN  MIN_LBA  MAX_LBA  CURRENT_TEST_STATUS
    1        0        0  Not_testing
    2        0        0  Not_testing
    3        0        0  Not_testing
    4        0        0  Not_testing
    5        0        0  Not_testing
Selective self-test flags (0x0):
  After scanning selected spans, do NOT read-scan remainder of disk.
If Selective self-test is pending on power-up, resume after 0 minute delay.

SCT Status Version:                  3
SCT Version (vendor specific):       522 (0x020a)
Device State:                        Active (0)
Current Temperature:                    28 Celsius
Power Cycle Min/Max Temperature:     27/28 Celsius
Lifetime    Min/Max Temperature:     15/44 Celsius
Under/Over Temperature Limit Count:   0/0

SCT Data Table command not supported

SCT Error Recovery Control command not supported

Device Statistics (GP Log 0x04)
Page  Offset Size        Value Flags Description
0x01  =====  =               =  ===  == General Statistics (rev 1) ==
0x01  0x008  4           10546  ---  Lifetime Power-On Resets
0x01  0x010  4            4025  ---  Power-on Hours
0x01  0x018  6     15010115458  ---  Logical Sectors Written
0x01  0x020  6        99333063  ---  Number of Write Commands
0x01  0x028  6     14507845012  ---  Logical Sectors Read
0x01  0x030  6       145358418  ---  Number of Read Commands
0x01  0x038  6               -  ---  Date and Time TimeStamp
0x03  =====  =               =  ===  == Rotating Media Statistics (rev 1) ==
0x03  0x008  4      1457017122  N--  Spindle Motor Power-on Hours
0x03  0x010  4      1457017122  N--  Head Flying Hours
0x03  0x018  4           11457  ---  Head Load Events
0x03  0x020  4               0  ---  Number of Reallocated Logical Sectors
0x03  0x028  4               0  ---  Read Recovery Attempts
0x03  0x030  4               0  ---  Number of Mechanical Start Failures
0x03  0x038  4               0  ---  Number of Realloc. Candidate Logical Sectors
0x04  =====  =               =  ===  == General Errors Statistics (rev 1) ==
0x04  0x008  4               2  ---  Number of Reported Uncorrectable Errors
0x04  0x010  4              12  ---  Resets Between Cmd Acceptance and Completion
0x05  =====  =               =  ===  == Temperature Statistics (rev 1) ==
0x05  0x008  1              28  ---  Current Temperature
0x05  0x010  1              28  ---  Average Short Term Temperature
0x05  0x018  1              29  ---  Average Long Term Temperature
0x05  0x020  1              44  ---  Highest Temperature
0x05  0x028  1              17  ---  Lowest Temperature
0x05  0x030  1              37  ---  Highest Average Short Term Temperature
0x05  0x038  1              26  ---  Lowest Average Short Term Temperature
0x05  0x040  1              35  ---  Highest Average Long Term Temperature
0x05  0x048  1              27  ---  Lowest Average Long Term Temperature
0x05  0x050  4               0  ---  Time in Over-Temperature
0x05  0x058  1              55  ---  Specified Maximum Operating Temperature
0x05  0x060  4               0  ---  Time in Under-Temperature
0x05  0x068  1              13  ---  Specified Minimum Operating Temperature
                                |||_ C monitored condition met
                                ||__ D supports DSN
                                |___ N normalized value

Pending Defects log (GP Log 0x0c) not supported

SATA Phy Event Counters (GP Log 0x11)
ID      Size     Value  Description
0x000a  2            2  Device-to-host register FISes sent due to a COMRESET
0x0001  2            0  Command failed due to ICRC error
0x0003  2            0  R_ERR response for device-to-host data FIS
0x0004  2            0  R_ERR response for host-to-device data FIS
0x0006  2            0  R_ERR response for device-to-host non-data FIS
0x0007  2            0  R_ERR response for host-to-device non-data FIS



