smartctl 7.4 2023-08-01 r5530 [x86_64-linux-6.10.0-desktop-1omv2490] (OpenMandriva Lx 7.4-1)
Copyright (C) 2002-23, Bruce Allen, Christian Franke, www.smartmontools.org

=== START OF INFORMATION SECTION ===
Model Family:     Seagate BarraCuda 3.5 (CMR)
Device Model:     ST1000DM010-2EP102
Serial Number:    --
LU WWN Device Id: 5 000c50 ...
Firmware Version: CC43
User Capacity:    1,000,204,886,016 bytes [1.00 TB]
Sector Sizes:     512 bytes logical, 4096 bytes physical
Rotation Rate:    7200 rpm
Form Factor:      3.5 inches
Device is:        In smartctl database
ATA Version is:   ATA8-ACS T13/1699-D revision 4
SATA Version is:  SATA 3.0, 6.0 Gb/s (current: 3.0 Gb/s)
Local Time is:    Fri Aug 16 13:59:17 2024 MSK
SMART support is: Available - device has SMART capability.
SMART support is: Enabled
AAM feature is:   Unavailable
APM level is:     128 (minimum power consumption without standby)
Rd look-ahead is: Enabled
Write cache is:   Enabled
DSN feature is:   Unavailable
ATA Security is:  Disabled, frozen [SEC2]
Wt Cache Reorder: Unavailable

=== START OF READ SMART DATA SECTION ===
SMART overall-health self-assessment test result: PASSED
See vendor-specific Attribute list for marginal Attributes.

General SMART Values:
Offline data collection status:  (0x00)	Offline data collection activity
					was never started.
					Auto Offline Data Collection: Disabled.
Self-test execution status:      (   0)	The previous self-test routine completed
					without error or no self-test has ever 
					been run.
Total time to complete Offline 
data collection: 		(    0) seconds.
Offline data collection
capabilities: 			 (0x73) SMART execute Offline immediate.
					Auto Offline data collection on/off support.
					Suspend Offline collection upon new
					command.
					No Offline surface scan supported.
					Self-test supported.
					Conveyance Self-test supported.
					Selective Self-test supported.
SMART capabilities:            (0x0003)	Saves SMART data before entering
					power-saving mode.
					Supports SMART auto save timer.
Error logging capability:        (0x01)	Error logging supported.
					General Purpose Logging supported.
Short self-test routine 
recommended polling time: 	 (   1) minutes.
Extended self-test routine
recommended polling time: 	 ( 109) minutes.
Conveyance self-test routine
recommended polling time: 	 (   2) minutes.
SCT capabilities: 	       (0x1085)	SCT Status supported.

SMART Attributes Data Structure revision number: 10
Vendor Specific SMART Attributes with Thresholds:
ID# ATTRIBUTE_NAME          FLAGS    VALUE WORST THRESH FAIL RAW_VALUE
  1 Raw_Read_Error_Rate     POSR--   100   063   006    -    612638
  3 Spin_Up_Time            PO----   097   096   000    -    0
  4 Start_Stop_Count        -O--CK   089   089   020    -    11900
  5 Reallocated_Sector_Ct   PO--CK   100   100   010    -    0
  7 Seek_Error_Rate         POSR--   081   060   045    -    152211301
  9 Power_On_Hours          -O--CK   071   071   000    -    25521
 10 Spin_Retry_Count        PO--C-   100   100   097    -    0
 12 Power_Cycle_Count       -O--CK   095   095   020    -    5270
183 Runtime_Bad_Block       -O--CK   001   001   000    -    1304
184 End-to-End_Error        -O--CK   100   100   099    -    0
187 Reported_Uncorrect      -O--CK   086   086   000    -    14
188 Command_Timeout         -O--CK   100   095   000    -    16 16 27
189 High_Fly_Writes         -O-RCK   100   100   000    -    0
190 Airflow_Temperature_Cel -O---K   061   031   040    Past 39 (3 24 39 25 0)
193 Load_Cycle_Count        -O--CK   095   095   000    -    11959
194 Temperature_Celsius     -O---K   039   005   000    -    39 (0 5 0 0 0)
195 Hardware_ECC_Recovered  -O-RC-   100   001   000    -    612638
197 Current_Pending_Sector  -O--C-   100   100   000    -    0
198 Offline_Uncorrectable   ----C-   100   100   000    -    0
199 UDMA_CRC_Error_Count    -OSRCK   200   200   000    -    126
240 Head_Flying_Hours       ------   100   253   000    -    21528h+38m+10.663s
241 Total_LBAs_Written      ------   100   253   000    -    31719192218
242 Total_LBAs_Read         ------   100   253   000    -    60779719235
                            ||||||_ K auto-keep
                            |||||__ C event count
                            ||||___ R error rate
                            |||____ S speed/performance
                            ||_____ O updated online
                            |______ P prefailure warning

General Purpose Log Directory Version 1
SMART           Log Directory Version 1 [multi-sector log support]
Address    Access  R/W   Size  Description
0x00       GPL,SL  R/O      1  Log Directory
0x01           SL  R/O      1  Summary SMART error log
0x02           SL  R/O      5  Comprehensive SMART error log
0x03       GPL     R/O      5  Ext. Comprehensive SMART error log
0x04       GPL,SL  R/O      8  Device Statistics log
0x06           SL  R/O      1  SMART self-test log
0x07       GPL     R/O      1  Extended self-test log
0x09           SL  R/W      1  Selective self-test log
0x10       GPL     R/O      1  NCQ Command Error log
0x11       GPL     R/O      1  SATA Phy Event Counters log
0x21       GPL     R/O      1  Write stream error log
0x22       GPL     R/O      1  Read stream error log
0x24       GPL     R/O    512  Current Device Internal Status Data log
0x30       GPL,SL  R/O      9  IDENTIFY DEVICE data log
0x80-0x9f  GPL,SL  R/W     16  Host vendor specific log
0xa1       GPL,SL  VS      20  Device vendor specific log
0xa2       GPL     VS    4120  Device vendor specific log
0xa8       GPL,SL  VS     129  Device vendor specific log
0xa9       GPL,SL  VS       1  Device vendor specific log
0xab       GPL     VS       1  Device vendor specific log
0xb0       GPL     VS    4800  Device vendor specific log
0xbe-0xbf  GPL     VS   65535  Device vendor specific log
0xc0       GPL,SL  VS       1  Device vendor specific log
0xc1       GPL,SL  VS      10  Device vendor specific log
0xe0       GPL,SL  R/W      1  SCT Command/Status
0xe1       GPL,SL  R/W      1  SCT Data Transfer

SMART Extended Comprehensive Error Log Version: 1 (5 sectors)
Device Error Count: 14
	CR     = Command Register
	FEATR  = Features Register
	COUNT  = Count (was: Sector Count) Register
	LBA_48 = Upper bytes of LBA High/Mid/Low Registers ]  ATA-8
	LH     = LBA High (was: Cylinder High) Register    ]   LBA
	LM     = LBA Mid (was: Cylinder Low) Register      ] Register
	LL     = LBA Low (was: Sector Number) Register     ]
	DV     = Device (was: Device/Head) Register
	DC     = Device Control Register
	ER     = Error register
	ST     = Status register
Powered_Up_Time is measured from power on, and printed as
DDd+hh:mm:SS.sss where DD=days, hh=hours, mm=minutes,
SS=sec, and sss=millisec. It "wraps" after 49.710 days.

Error 14 [13] occurred at disk power-on lifetime: 2310 hours (96 days + 6 hours)
  When the command that caused the error occurred, the device was active or idle.

  After command completion occurred, registers were:
  ER -- ST COUNT  LBA_48  LH LM LL DV DC
  -- -- -- == -- == == == -- -- -- -- --
  40 -- 51 00 00 00 00 60 77 c7 50 00 00  Error: UNC at LBA = 0x6077c750 = 1618462544

  Commands leading to the command that caused the error were:
  CR FEATR COUNT  LBA_48  LH LM LL DV DC  Powered_Up_Time  Command/Feature_Name
  -- == -- == -- == == == -- -- -- -- --  ---------------  --------------------
  25 00 00 00 08 00 00 60 77 c7 50 e0 00     00:00:53.939  READ DMA EXT
  25 00 00 00 08 00 00 09 b6 02 38 e0 00     00:00:53.939  READ DMA EXT
  25 00 00 00 08 00 00 60 77 c7 58 e0 00     00:00:53.861  READ DMA EXT
  25 00 00 00 08 00 00 60 77 c7 50 e0 00     00:00:51.519  READ DMA EXT
  35 00 00 00 10 00 00 00 5b 4c c0 e0 00     00:00:51.518  WRITE DMA EXT

Error 13 [12] occurred at disk power-on lifetime: 2310 hours (96 days + 6 hours)
  When the command that caused the error occurred, the device was active or idle.

  After command completion occurred, registers were:
  ER -- ST COUNT  LBA_48  LH LM LL DV DC
  -- -- -- == -- == == == -- -- -- -- --
  40 -- 51 00 00 00 00 60 77 c7 50 00 00  Error: UNC at LBA = 0x6077c750 = 1618462544

  Commands leading to the command that caused the error were:
  CR FEATR COUNT  LBA_48  LH LM LL DV DC  Powered_Up_Time  Command/Feature_Name
  -- == -- == -- == == == -- -- -- -- --  ---------------  --------------------
  25 00 00 00 08 00 00 60 77 c7 50 e0 00     00:00:51.519  READ DMA EXT
  35 00 00 00 10 00 00 00 5b 4c c0 e0 00     00:00:51.518  WRITE DMA EXT
  25 00 00 00 08 00 00 00 36 ed f0 e0 00     00:00:51.518  READ DMA EXT
  25 00 00 00 08 00 00 60 77 c7 50 e0 00     00:00:49.192  READ DMA EXT
  25 00 00 00 08 00 00 60 77 c7 50 e0 00     00:00:46.939  READ DMA EXT

Error 12 [11] occurred at disk power-on lifetime: 2310 hours (96 days + 6 hours)
  When the command that caused the error occurred, the device was active or idle.

  After command completion occurred, registers were:
  ER -- ST COUNT  LBA_48  LH LM LL DV DC
  -- -- -- == -- == == == -- -- -- -- --
  40 -- 51 00 00 00 00 60 77 c7 50 00 00  Error: UNC at LBA = 0x6077c750 = 1618462544

  Commands leading to the command that caused the error were:
  CR FEATR COUNT  LBA_48  LH LM LL DV DC  Powered_Up_Time  Command/Feature_Name
  -- == -- == -- == == == -- -- -- -- --  ---------------  --------------------
  25 00 00 00 08 00 00 60 77 c7 50 e0 00     00:00:49.192  READ DMA EXT
  25 00 00 00 08 00 00 60 77 c7 50 e0 00     00:00:46.939  READ DMA EXT
  25 00 00 00 08 00 00 60 77 c7 48 e0 00     00:00:46.938  READ DMA EXT
  25 00 00 00 11 00 00 0b a6 4b 31 e0 00     00:00:46.937  READ DMA EXT
  35 00 00 00 08 00 00 09 b6 b2 a0 e0 00     00:00:46.937  WRITE DMA EXT

Error 11 [10] occurred at disk power-on lifetime: 2310 hours (96 days + 6 hours)
  When the command that caused the error occurred, the device was active or idle.

  After command completion occurred, registers were:
  ER -- ST COUNT  LBA_48  LH LM LL DV DC
  -- -- -- == -- == == == -- -- -- -- --
  40 -- 51 00 00 00 00 60 77 c7 50 00 00  Error: UNC at LBA = 0x6077c750 = 1618462544

  Commands leading to the command that caused the error were:
  CR FEATR COUNT  LBA_48  LH LM LL DV DC  Powered_Up_Time  Command/Feature_Name
  -- == -- == -- == == == -- -- -- -- --  ---------------  --------------------
  25 00 00 00 08 00 00 60 77 c7 50 e0 00     00:00:46.939  READ DMA EXT
  25 00 00 00 08 00 00 60 77 c7 48 e0 00     00:00:46.938  READ DMA EXT
  25 00 00 00 11 00 00 0b a6 4b 31 e0 00     00:00:46.937  READ DMA EXT
  35 00 00 00 08 00 00 09 b6 b2 a0 e0 00     00:00:46.937  WRITE DMA EXT
  25 00 00 00 08 00 00 60 77 c7 48 e0 00     00:00:46.841  READ DMA EXT

Error 10 [9] occurred at disk power-on lifetime: 2310 hours (96 days + 6 hours)
  When the command that caused the error occurred, the device was active or idle.

  After command completion occurred, registers were:
  ER -- ST COUNT  LBA_48  LH LM LL DV DC
  -- -- -- == -- == == == -- -- -- -- --
  40 -- 51 00 00 00 00 60 77 c7 50 00 00  Error: UNC at LBA = 0x6077c750 = 1618462544

  Commands leading to the command that caused the error were:
  CR FEATR COUNT  LBA_48  LH LM LL DV DC  Powered_Up_Time  Command/Feature_Name
  -- == -- == -- == == == -- -- -- -- --  ---------------  --------------------
  25 00 00 00 80 00 00 60 77 c7 48 e0 00     00:00:44.593  READ DMA EXT
  25 00 00 00 08 00 00 60 77 c6 c8 e0 00     00:00:44.592  READ DMA EXT
  25 00 00 00 80 00 00 60 77 c6 c8 e0 00     00:00:44.592  READ DMA EXT
  25 00 00 00 08 00 00 60 77 c6 c0 e0 00     00:00:44.592  READ DMA EXT
  25 00 00 00 08 00 00 60 77 c6 c0 e0 00     00:00:44.591  READ DMA EXT

Error 9 [8] occurred at disk power-on lifetime: 2310 hours (96 days + 6 hours)
  When the command that caused the error occurred, the device was active or idle.

  After command completion occurred, registers were:
  ER -- ST COUNT  LBA_48  LH LM LL DV DC
  -- -- -- == -- == == == -- -- -- -- --
  40 -- 51 00 00 00 00 60 77 c7 50 00 00  Error: UNC at LBA = 0x6077c750 = 1618462544

  Commands leading to the command that caused the error were:
  CR FEATR COUNT  LBA_48  LH LM LL DV DC  Powered_Up_Time  Command/Feature_Name
  -- == -- == -- == == == -- -- -- -- --  ---------------  --------------------
  25 00 00 01 00 00 00 60 77 c7 50 e0 00     00:00:42.261  READ DMA EXT
  25 00 00 01 00 00 00 60 77 c6 50 e0 00     00:00:42.250  READ DMA EXT
  25 00 00 00 1a 00 00 0b a6 4b 92 e0 00     00:00:42.249  READ DMA EXT
  35 00 00 00 08 00 00 00 5f 29 f8 e0 00     00:00:42.249  WRITE DMA EXT
  25 00 00 01 00 00 00 60 77 cc 50 e0 00     00:00:42.247  READ DMA EXT

Error 8 [7] occurred at disk power-on lifetime: 2310 hours (96 days + 6 hours)
  When the command that caused the error occurred, the device was active or idle.

  After command completion occurred, registers were:
  ER -- ST COUNT  LBA_48  LH LM LL DV DC
  -- -- -- == -- == == == -- -- -- -- --
  40 -- 51 00 00 00 00 60 77 c7 50 00 00  Error: UNC at LBA = 0x6077c750 = 1618462544

  Commands leading to the command that caused the error were:
  CR FEATR COUNT  LBA_48  LH LM LL DV DC  Powered_Up_Time  Command/Feature_Name
  -- == -- == -- == == == -- -- -- -- --  ---------------  --------------------
  25 00 00 01 00 00 00 60 77 c2 50 e0 00     00:00:39.796  READ DMA EXT
  25 00 00 01 00 00 00 60 77 c1 50 e0 00     00:00:39.795  READ DMA EXT
  25 00 00 01 00 00 00 60 77 c0 50 e0 00     00:00:39.794  READ DMA EXT
  25 00 00 01 00 00 00 60 77 bf 50 e0 00     00:00:39.793  READ DMA EXT
  25 00 00 01 00 00 00 60 77 be 50 e0 00     00:00:39.793  READ DMA EXT

Error 7 [6] occurred at disk power-on lifetime: 1755 hours (73 days + 3 hours)
  When the command that caused the error occurred, the device was active or idle.

  After command completion occurred, registers were:
  ER -- ST COUNT  LBA_48  LH LM LL DV DC
  -- -- -- == -- == == == -- -- -- -- --
  40 -- 51 00 00 00 00 6e 26 ba a0 00 00  Error: UNC at LBA = 0x6e26baa0 = 1848031904

  Commands leading to the command that caused the error were:
  CR FEATR COUNT  LBA_48  LH LM LL DV DC  Powered_Up_Time  Command/Feature_Name
  -- == -- == -- == == == -- -- -- -- --  ---------------  --------------------
  25 00 00 00 08 00 00 6e 26 ba a0 e0 00     00:01:02.157  READ DMA EXT
  35 00 00 00 08 00 00 3c d1 50 d0 e0 00     00:01:02.157  WRITE DMA EXT
  25 00 00 00 08 00 00 12 88 98 10 e0 00     00:01:02.136  READ DMA EXT
  25 00 00 00 08 00 00 6e 26 ba a8 e0 00     00:01:02.099  READ DMA EXT
  25 00 00 00 08 00 00 6e 26 ba a0 e0 00     00:00:59.773  READ DMA EXT

SMART Extended Self-test Log Version: 1 (1 sectors)
Num  Test_Description    Status                  Remaining  LifeTime(hours)  LBA_of_first_error
# 1  Short offline       Completed without error       00%     24701         -

SMART Selective self-test log data structure revision number 1
 SPAN  MIN_LBA  MAX_LBA  CURRENT_TEST_STATUS
    1        0        0  Not_testing
    2        0        0  Not_testing
    3        0        0  Not_testing
    4        0        0  Not_testing
    5        0        0  Not_testing
Selective self-test flags (0x0):
  After scanning selected spans, do NOT read-scan remainder of disk.
If Selective self-test is pending on power-up, resume after 0 minute delay.

SCT Status Version:                  3
SCT Version (vendor specific):       522 (0x020a)
Device State:                        Active (0)
Current Temperature:                    38 Celsius
Power Cycle Min/Max Temperature:     25/39 Celsius
Lifetime    Min/Max Temperature:      6/68 Celsius
Under/Over Temperature Limit Count:   0/0

SCT Data Table command not supported

SCT Error Recovery Control command not supported

Device Statistics (GP Log 0x04)
Page  Offset Size        Value Flags Description
0x01  =====  =               =  ===  == General Statistics (rev 1) ==
0x01  0x008  4            5270  ---  Lifetime Power-On Resets
0x01  0x010  4           25521  ---  Power-on Hours
0x01  0x018  6     31782878374  ---  Logical Sectors Written
0x01  0x020  6       201824885  ---  Number of Write Commands
0x01  0x028  6     61182818352  ---  Logical Sectors Read
0x01  0x030  6       478692878  ---  Number of Read Commands
0x01  0x038  6               -  ---  Date and Time TimeStamp
0x03  =====  =               =  ===  == Rotating Media Statistics (rev 1) ==
0x03  0x008  4           21594  ---  Spindle Motor Power-on Hours
0x03  0x010  4           20934  ---  Head Flying Hours
0x03  0x018  4           11959  ---  Head Load Events
0x03  0x020  4               0  ---  Number of Reallocated Logical Sectors
0x03  0x028  4               0  ---  Read Recovery Attempts
0x03  0x030  4               0  ---  Number of Mechanical Start Failures
0x03  0x038  4               0  ---  Number of Realloc. Candidate Logical Sectors
0x04  =====  =               =  ===  == General Errors Statistics (rev 1) ==
0x04  0x008  4               8  ---  Number of Reported Uncorrectable Errors
0x04  0x010  4              27  ---  Resets Between Cmd Acceptance and Completion
0x05  =====  =               =  ===  == Temperature Statistics (rev 1) ==
0x05  0x008  1              38  ---  Current Temperature
0x05  0x010  1              38  ---  Average Short Term Temperature
0x05  0x018  1              37  ---  Average Long Term Temperature
0x05  0x020  1              71  ---  Highest Temperature
0x05  0x028  1              16  ---  Lowest Temperature
0x05  0x030  1              58  ---  Highest Average Short Term Temperature
0x05  0x038  1              32  ---  Lowest Average Short Term Temperature
0x05  0x040  1              54  ---  Highest Average Long Term Temperature
0x05  0x048  1              33  ---  Lowest Average Long Term Temperature
0x05  0x050  4           44424  ---  Time in Over-Temperature
0x05  0x058  1              55  ---  Specified Maximum Operating Temperature
0x05  0x060  4               0  ---  Time in Under-Temperature
0x05  0x068  1              13  ---  Specified Minimum Operating Temperature
                                |||_ C monitored condition met
                                ||__ D supports DSN
                                |___ N normalized value

Pending Defects log (GP Log 0x0c) not supported

SATA Phy Event Counters (GP Log 0x11)
ID      Size     Value  Description
0x000a  2           12  Device-to-host register FISes sent due to a COMRESET
0x0001  2            0  Command failed due to ICRC error
0x0003  2            0  R_ERR response for device-to-host data FIS
0x0004  2            0  R_ERR response for host-to-device data FIS
0x0006  2            0  R_ERR response for device-to-host non-data FIS
0x0007  2            0  R_ERR response for host-to-device non-data FIS



