smartctl 7.2 2020-12-30 r5155 [x86_64-linux-5.14.0-162.12.1.el9_1.0.2.x86_64] (local build)
Copyright (C) 2002-20, Bruce Allen, Christian Franke, www.smartmontools.org

=== START OF INFORMATION SECTION ===
Model Number:                       SHPP41-2000GM
Serial Number:                      --
Firmware Version:                   51060A20
PCI Vendor/Subsystem ID:            0x1c5c
IEEE OUI Identifier:                0xace42e
Controller ID:                      0
NVMe Version:                       1.4
Number of Namespaces:               1
Namespace 1 Size/Capacity:          2,000,398,934,016 [2.00 TB]
Namespace 1 Formatted LBA Size:     512
Local Time is:                      Thu Feb 16 14:49:08 2023 CST
Firmware Updates (0x16):            3 Slots, no Reset required
Optional Admin Commands (0x0017):   Security Format Frmw_DL Self_Test
Optional NVM Commands (0x00df):     Comp Wr_Unc DS_Mngmt Wr_Zero Sav/Sel_Feat Timestmp Verify
Log Page Attributes (0x1e):         Cmd_Eff_Lg Ext_Get_Lg Telmtry_Lg Pers_Ev_Lg
Maximum Data Transfer Size:         64 Pages
Warning  Comp. Temp. Threshold:     86 Celsius
Critical Comp. Temp. Threshold:     87 Celsius

Supported Power States
St Op     Max   Active     Idle   RL RT WL WT  Ent_Lat  Ex_Lat
 0 +     7.50W       -        -    0  0  0  0        5     305
 1 +   3.9000W       -        -    1  1  1  1       30     330
 2 +   1.5000W       -        -    2  2  2  2      100     400
 3 -   0.0500W       -        -    3  3  3  3      500    1500
 4 -   0.0050W       -        -    4  4  4  4     1000    9000

Supported LBA Sizes (NSID 0x1)
Id Fmt  Data  Metadt  Rel_Perf
 0 +     512       0         0
 1 -    4096       0         0

=== START OF SMART DATA SECTION ===
SMART overall-health self-assessment test result: PASSED

SMART/Health Information (NVMe Log 0x02)
Critical Warning:                   0x00
Temperature:                        47 Celsius
Available Spare:                    100%
Available Spare Threshold:          10%
Percentage Used:                    0%
Data Units Read:                    37,467 [19.1 GB]
Data Units Written:                 64,631 [33.0 GB]
Host Read Commands:                 1,535,615
Host Write Commands:                573,490
Controller Busy Time:               29
Power Cycles:                       55
Power On Hours:                     6
Unsafe Shutdowns:                   39
Media and Data Integrity Errors:    0
Error Information Log Entries:      0
Warning  Comp. Temperature Time:    0
Critical Comp. Temperature Time:    0
Temperature Sensor 1:               41 Celsius
Temperature Sensor 2:               48 Celsius

Error Information (NVMe Log 0x01, 16 of 256 entries)
No Errors Logged

