=== START OF INFORMATION SECTION ===
Model Family:     SAMSUNG SpinPoint P80
Device Model:     SAMSUNG SP1614C
Serial Number:    --
Firmware Version: SW100-34
User Capacity:    160,041,885,696 bytes [160 GB]
Sector Size:      512 bytes logical/physical
Device is:        In smartctl database [for details use: -P show]
ATA Version is:   ATA/ATAPI-7 T13/1532D revision 0
Local Time is:    Mon Sep 28 20:46:04 2020 CEST
SMART support is: Available - device has SMART capability.
SMART support is: Enabled
AAM feature is:   Disabled
APM feature is:   Unavailable
Rd look-ahead is: Enabled
Write cache is:   Enabled
ATA Security is:  Disabled, frozen [SEC2]
Wt Cache Reorder: Unavailable

=== START OF READ SMART DATA SECTION ===
SMART overall-health self-assessment test result: PASSED

General SMART Values:
Offline data collection status:  (0x82)	Offline data collection activity
					was completed without error.
					Auto Offline Data Collection: Enabled.
Self-test execution status:      (   0)	The previous self-test routine completed
					without error or no self-test has ever 
					been run.
Total time to complete Offline 
data collection: 		( 6000) seconds.
Offline data collection
capabilities: 			 (0x1b) SMART execute Offline immediate.
					Auto Offline data collection on/off support.
					Suspend Offline collection upon new
					command.
					Offline surface scan supported.
					Self-test supported.
					No Conveyance Self-test supported.
					No Selective Self-test supported.
SMART capabilities:            (0x0003)	Saves SMART data before entering
					power-saving mode.
					Supports SMART auto save timer.
Error logging capability:        (0x01)	Error logging supported.
					No General Purpose Logging support.
Short self-test routine 
recommended polling time: 	 (   1) minutes.
Extended self-test routine
recommended polling time: 	 ( 100) minutes.

SMART Attributes Data Structure revision number: 16
Vendor Specific SMART Attributes with Thresholds:
ID# ATTRIBUTE_NAME          FLAGS    VALUE WORST THRESH FAIL RAW_VALUE
  1 Raw_Read_Error_Rate     POSR--   100   099   051    -    58
  3 Spin_Up_Time            POS---   100   100   025    -    5696
  4 Start_Stop_Count        -O--CK   096   096   000    -    4954
  5 Reallocated_Sector_Ct   PO--CK   100   100   011    -    1
  7 Seek_Error_Rate         POSR--   100   100   051    -    0
  8 Seek_Time_Performance   P-S--K   100   100   015    -    0
  9 Power_On_Half_Minutes   -O--CK   099   099   000    -    6046h+14m
 10 Spin_Retry_Count        PO--CK   100   100   051    -    0
 11 Calibration_Retry_Count -O--C-   100   100   000    -    0
 12 Power_Cycle_Count       -O--CK   096   096   000    -    4285
194 Temperature_Celsius     -O---K   133   076   000    -    35
195 Hardware_ECC_Recovered  -O-RC-   100   100   000    -    7283795
196 Reallocated_Event_Count -O--CK   097   097   000    -    8
197 Current_Pending_Sector  -O--C-   100   100   000    -    0
198 Total_Offl_Uncorrectabl ----CK   100   100   000    -    0
199 UDMA_CRC_Error_Count    -OSRCK   200   181   000    -    11
200 Multi_Zone_Error_Rate   -O-R--   100   100   051    -    0
201 Soft_Read_Error_Rate    -O-R--   100   100   051    -    0
                            ||||||_ K auto-keep
                            |||||__ C event count
                            ||||___ R error rate
                            |||____ S speed/performance
                            ||_____ O updated online
                            |______ P prefailure warning

General Purpose Log Directory not supported

SMART Log Directory Version 1 [multi-sector log support]
Address    Access  R/W   Size  Description
0x00           SL  R/O      1  Log Directory
0x01           SL  R/O      1  Summary SMART error log
0x02           SL  R/O      2  Comprehensive SMART error log
0x06           SL  R/O      2  SMART self-test log
0x80-0x9f      SL  R/W     16  Host vendor specific log

SMART Extended Comprehensive Error Log (GP Log 0x03) not supported

SMART Error Log Version: 1
ATA Error Count: 2290 (device log contains only the most recent five errors)
	CR = Command Register [HEX]
	FR = Features Register [HEX]
	SC = Sector Count Register [HEX]
	SN = Sector Number Register [HEX]
	CL = Cylinder Low Register [HEX]
	CH = Cylinder High Register [HEX]
	DH = Device/Head Register [HEX]
	DC = Device Command Register [HEX]
	ER = Error register [HEX]
	ST = Status register [HEX]
Powered_Up_Time is measured from power on, and printed as
DDd+hh:mm:SS.sss where DD=days, hh=hours, mm=minutes,
SS=sec, and sss=millisec. It "wraps" after 49.710 days.

Error 2290 occurred at disk power-on lifetime: 6045 hours (251 days + 21 hours)
  When the command that caused the error occurred, the device was active or idle.

  After command completion occurred, registers were:
  ER ST SC SN CL CH DH
  -- -- -- -- -- -- --
  04 51 00 01 4f c2 a0  Error: ABRT

  Commands leading to the command that caused the error were:
  CR FR SC SN CL CH DH DC   Powered_Up_Time  Command/Feature_Name
  -- -- -- -- -- -- -- --  ----------------  --------------------
  b0 d9 00 01 4f c2 a0 00      05:57:22.938  SMART DISABLE OPERATIONS
  ec 20 3f 01 00 00 a0 00      05:57:22.938  IDENTIFY DEVICE
  10 20 3f 01 00 00 a0 00      05:57:22.938  RECALIBRATE [OBS-4]
  91 20 3f 01 00 00 af 00      05:57:22.938  INITIALIZE DEVICE PARAMETERS [OBS-6]
  ec 00 00 01 00 00 a0 00      05:57:22.938  IDENTIFY DEVICE

Error 2289 occurred at disk power-on lifetime: 6040 hours (251 days + 16 hours)
  When the command that caused the error occurred, the device was active or idle.

  After command completion occurred, registers were:
  ER ST SC SN CL CH DH
  -- -- -- -- -- -- --
  04 51 00 00 4f c2 e0  Error: ABRT

  Commands leading to the command that caused the error were:
  CR FR SC SN CL CH DH DC   Powered_Up_Time  Command/Feature_Name
  -- -- -- -- -- -- -- --  ----------------  --------------------
  b0 d0 00 00 4f c2 e0 00      00:00:39.688  SMART READ DATA

Error 2288 occurred at disk power-on lifetime: 6040 hours (251 days + 16 hours)
  When the command that caused the error occurred, the device was active or idle.

  After command completion occurred, registers were:
  ER ST SC SN CL CH DH
  -- -- -- -- -- -- --
  04 51 00 00 4f c2 e0  Error: ABRT

  Commands leading to the command that caused the error were:
  CR FR SC SN CL CH DH DC   Powered_Up_Time  Command/Feature_Name
  -- -- -- -- -- -- -- --  ----------------  --------------------
  b0 da 00 00 4f c2 e0 00      00:00:39.563  SMART RETURN STATUS
  c6 00 10 00 00 00 a0 00      00:00:38.250  SET MULTIPLE MODE
  ef 03 46 00 00 00 a0 00      00:00:38.250  SET FEATURES [Set transfer mode]
  ef 03 0c 00 00 00 a0 00      00:00:38.250  SET FEATURES [Set transfer mode]
  ec 00 00 00 00 00 a0 00      00:00:38.188  IDENTIFY DEVICE

Error 2287 occurred at disk power-on lifetime: 6037 hours (251 days + 13 hours)
  When the command that caused the error occurred, the device was active or idle.

  After command completion occurred, registers were:
  ER ST SC SN CL CH DH
  -- -- -- -- -- -- --
  04 51 00 00 4f c2 e0  Error: ABRT

  Commands leading to the command that caused the error were:
  CR FR SC SN CL CH DH DC   Powered_Up_Time  Command/Feature_Name
  -- -- -- -- -- -- -- --  ----------------  --------------------
  b0 d0 00 00 4f c2 e0 00      00:00:45.125  SMART READ DATA

Error 2286 occurred at disk power-on lifetime: 6037 hours (251 days + 13 hours)
  When the command that caused the error occurred, the device was active or idle.

  After command completion occurred, registers were:
  ER ST SC SN CL CH DH
  -- -- -- -- -- -- --
  04 51 00 00 4f c2 e0  Error: ABRT

  Commands leading to the command that caused the error were:
  CR FR SC SN CL CH DH DC   Powered_Up_Time  Command/Feature_Name
  -- -- -- -- -- -- -- --  ----------------  --------------------
  b0 da 00 00 4f c2 e0 00      00:00:44.875  SMART RETURN STATUS
  c6 00 10 00 00 00 a0 00      00:00:42.563  SET MULTIPLE MODE
  ef 03 46 00 00 00 a0 00      00:00:42.563  SET FEATURES [Set transfer mode]
  ef 03 0c 00 00 00 a0 00      00:00:42.563  SET FEATURES [Set transfer mode]
  ec 00 00 00 00 00 a0 00      00:00:42.500  IDENTIFY DEVICE

SMART Extended Self-test Log (GP Log 0x07) not supported

SMART Self-test log structure revision number 1
No self-tests have been logged.  [To run self-tests, use: smartctl -t]

Selective Self-tests/Logging not supported

SCT Commands not supported

Device Statistics (GP/SMART Log 0x04) not supported

SATA Phy Event Counters (GP Log 0x11) not supported

