smartctl 7.2 2020-12-30 r5155 [x86_64-linux-5.15.15-76051515-generic] (local build)
Copyright (C) 2002-20, Bruce Allen, Christian Franke, www.smartmontools.org

=== START OF INFORMATION SECTION ===
Model Number:                       VO003840KXAVQ
Serial Number:                      --
Firmware Version:                   HPK1
PCI Vendor ID:                      0x1c5c
PCI Vendor Subsystem ID:            0x1590
IEEE OUI Identifier:                0xace42e
Total NVM Capacity:                 3,840,755,982,336 [3.84 TB]
Unallocated NVM Capacity:           0
Controller ID:                      0
NVMe Version:                       1.3
Number of Namespaces:               128
Namespace 1 Size/Capacity:          3,840,755,982,336 [3.84 TB]
Namespace 1 Formatted LBA Size:     512
Namespace 1 IEEE EUI-64:            ace42e ...
Local Time is:                      Mon Jan 31 16:20:52 2022 EST
Firmware Updates (0x1e):            7 Slots, no Reset required
Optional Admin Commands (0x005e):   Format Frmw_DL NS_Mngmt Self_Test MI_Snd/Rec
Optional NVM Commands (0x005f):     Comp Wr_Unc DS_Mngmt Wr_Zero Sav/Sel_Feat Timestmp
Log Page Attributes (0x0e):         Cmd_Eff_Lg Ext_Get_Lg Telmtry_Lg
Maximum Data Transfer Size:         128 Pages
Warning  Comp. Temp. Threshold:     70 Celsius
Critical Comp. Temp. Threshold:     76 Celsius
Namespace 1 Features (0x04):        Dea/Unw_Error

Supported Power States
St Op     Max   Active     Idle   RL RT WL WT  Ent_Lat  Ex_Lat
 0 +    14.00W    0.00W       -    0  0  0  0    30000   30000
 1 +    11.00W    0.00W       -    0  1  0  1    30000   30000
 2 -     5.00W       -        -    2  2  2  2    30000   30000

Supported LBA Sizes (NSID 0x1)
Id Fmt  Data  Metadt  Rel_Perf
 0 +     512       0         2
 1 -    4096       0         0

=== START OF SMART DATA SECTION ===
SMART overall-health self-assessment test result: PASSED

SMART/Health Information (NVMe Log 0x02)
Critical Warning:                   0x00
Temperature:                        47 Celsius
Available Spare:                    100%
Available Spare Threshold:          10%
Percentage Used:                    0%
Data Units Read:                    41,403,187 [21.1 TB]
Data Units Written:                 32,576,172 [16.6 TB]
Host Read Commands:                 133,675,975
Host Write Commands:                59,120,324
Controller Busy Time:               287
Power Cycles:                       181
Power On Hours:                     460
Unsafe Shutdowns:                   68
Media and Data Integrity Errors:    0
Error Information Log Entries:      440
Warning  Comp. Temperature Time:    0
Critical Comp. Temperature Time:    0
Temperature Sensor 1:               63 Celsius
Temperature Sensor 2:               54 Celsius

Error Information (NVMe Log 0x01, 16 of 256 entries)
Num   ErrCount  SQId   CmdId  Status  PELoc          LBA  NSID    VS
  0        440     0  0x1012  0x4004  0x028            0     0     -



