=== START OF INFORMATION SECTION ===
Model Family:     Fujitsu MPA..MPG
Device Model:     FUJITSU MPE3064AT
Serial Number:    --
Firmware Version: ED-03-04
User Capacity:    6,487,212,544 bytes [6.48 GB]
Sector Size:      512 bytes logical/physical
Device is:        In smartctl database [for details use: -P show]
ATA Version is:   ATA/ATAPI-4 (minor revision not indicated)
Local Time is:    Wed Apr 17 21:27:16 2019 +05
SMART support is: Available - device has SMART capability.
SMART support is: Enabled
AAM feature is:   Unavailable
APM feature is:   Disabled
Rd look-ahead is: Enabled
Write cache is:   Enabled
DSN feature is:   Unavailable
ATA Security is:  Disabled, frozen [SEC2]
Wt Cache Reorder: Unavailable

=== START OF READ SMART DATA SECTION ===
SMART overall-health self-assessment test result: PASSED
See vendor-specific Attribute list for marginal Attributes.

General SMART Values:
Offline data collection status:  (0x80)	Offline data collection activity
					was never started.
					Auto Offline Data Collection: Enabled.
Self-test execution status:      (   0)	The previous self-test routine completed
					without error or no self-test has ever 
					been run.
Total time to complete Offline 
data collection: 		(  180) seconds.
Offline data collection
capabilities: 			 (0x1b) SMART execute Offline immediate.
					Auto Offline data collection on/off support.
					Suspend Offline collection upon new
					command.
					Offline surface scan supported.
					Self-test supported.
					No Conveyance Self-test supported.
					No Selective Self-test supported.
SMART capabilities:            (0x0002)	Does not save SMART data before
					entering power-saving mode.
					Supports SMART auto save timer.
Error logging capability:        (0x01)	Error logging supported.
					No General Purpose Logging support.
Short self-test routine 
recommended polling time: 	 (   2) minutes.
Extended self-test routine
recommended polling time: 	 (   8) minutes.

SMART Attributes Data Structure revision number: 16
Vendor Specific SMART Attributes with Thresholds:
ID# ATTRIBUTE_NAME          FLAGS    VALUE WORST THRESH FAIL RAW_VALUE
  1 Raw_Read_Error_Rate     PO-R--   100   100   032    -    193183
  2 Throughput_Performance  P-S---   085   085   020    -    86
  3 Spin_Up_Time            POS---   096   093   025    -    1
  4 Start_Stop_Count        -O--C-   091   091   016    -    5600
  5 Reallocated_Sector_Ct   PO--CK   100   100   024    -    0
  7 Seek_Error_Rate         PO-R--   100   100   020    -    88
  8 Seek_Time_Performance   P-S---   081   080   019    -    30
  9 Power_On_Seconds        -O--C-   001   001   020    NOW  60471h+56m+11s
 10 Spin_Retry_Count        PO--C-   100   100   020    -    0
 12 Power_Cycle_Count       -O--CK   064   064   020    -    5472
196 Reallocated_Event_Count PO--CK   100   100   024    -    0
197 Current_Pending_Sector  ----C-   100   100   020    -    0
198 Offline_Uncorrectable   ----C-   100   100   020    -    0
199 UDMA_CRC_Error_Count    -O-R--   200   200   000    -    0
200 Multi_Zone_Error_Rate   PO-R--   100   097   020    -    644
                            ||||||_ K auto-keep
                            |||||__ C event count
                            ||||___ R error rate
                            |||____ S speed/performance
                            ||_____ O updated online
                            |______ P prefailure warning

Read SMART Log Directory failed: scsi error badly formed scsi parameters

General Purpose Log Directory not supported

SMART Extended Comprehensive Error Log (GP Log 0x03) not supported

SMART Error Log Version: 1
ATA Error Count: 11 (device log contains only the most recent five errors)
	CR = Command Register [HEX]
	FR = Features Register [HEX]
	SC = Sector Count Register [HEX]
	SN = Sector Number Register [HEX]
	CL = Cylinder Low Register [HEX]
	CH = Cylinder High Register [HEX]
	DH = Device/Head Register [HEX]
	DC = Device Command Register [HEX]
	ER = Error register [HEX]
	ST = Status register [HEX]
Powered_Up_Time is measured from power on, and printed as
DDd+hh:mm:SS.sss where DD=days, hh=hours, mm=minutes,
SS=sec, and sss=millisec. It "wraps" after 49.710 days.

Error 11 occurred at disk power-on lifetime: 59377 hours (2474 days + 1 hours)
  When the command that caused the error occurred, the device was active or idle.

  After command completion occurred, registers were:
  ER ST SC SN CL CH DH
  -- -- -- -- -- -- --
  84 51 00 02 40 00 bc  Error: ICRC, ABRT at LBA = 0x0c004002 = 201342978

  Commands leading to the command that caused the error were:
  CR FR SC SN CL CH DH DC   Powered_Up_Time  Command/Feature_Name
  -- -- -- -- -- -- -- --  ----------------  --------------------
  ca 00 80 02 40 00 ba 00      00:08:49.500  WRITE DMA

Error 10 occurred at disk power-on lifetime: 59377 hours (2474 days + 1 hours)
  When the command that caused the error occurred, the device was active or idle.

  After command completion occurred, registers were:
  ER ST SC SN CL CH DH
  -- -- -- -- -- -- --
  84 51 00 39 40 00 b9  Error: ICRC, ABRT at LBA = 0x09004039 = 151011385

  Commands leading to the command that caused the error were:
  CR FR SC SN CL CH DH DC   Powered_Up_Time  Command/Feature_Name
  -- -- -- -- -- -- -- --  ----------------  --------------------
  ca 00 80 3f 40 00 b7 00      00:08:48.500  WRITE DMA

Error 9 occurred at disk power-on lifetime: 59377 hours (2474 days + 1 hours)
  When the command that caused the error occurred, the device was active or idle.

  After command completion occurred, registers were:
  ER ST SC SN CL CH DH
  -- -- -- -- -- -- --
  84 51 00 23 a0 32 b4  Error: ICRC, ABRT at LBA = 0x0432a023 = 70426659

  Commands leading to the command that caused the error were:
  CR FR SC SN CL CH DH DC   Powered_Up_Time  Command/Feature_Name
  -- -- -- -- -- -- -- --  ----------------  --------------------
  c8 03 10 16 a0 32 b4 00      00:08:48.000  READ DMA

Error 8 occurred at disk power-on lifetime: 59377 hours (2474 days + 1 hours)
  When the command that caused the error occurred, the device was active or idle.

  After command completion occurred, registers were:
  ER ST SC SN CL CH DH
  -- -- -- -- -- -- --
  84 51 00 3f 8f 31 b8  Error: ICRC, ABRT at LBA = 0x08318f3f = 137465663

  Commands leading to the command that caused the error were:
  CR FR SC SN CL CH DH DC   Powered_Up_Time  Command/Feature_Name
  -- -- -- -- -- -- -- --  ----------------  --------------------
  ca 03 08 39 8f 31 b8 00      00:08:48.000  WRITE DMA

Error 7 occurred at disk power-on lifetime: 59377 hours (2474 days + 1 hours)
  When the command that caused the error occurred, the device was active or idle.

  After command completion occurred, registers were:
  ER ST SC SN CL CH DH
  -- -- -- -- -- -- --
  84 51 00 2f 08 06 ba  Error: ICRC, ABRT at LBA = 0x0a06082f = 168167471

  Commands leading to the command that caused the error were:
  CR FR SC SN CL CH DH DC   Powered_Up_Time  Command/Feature_Name
  -- -- -- -- -- -- -- --  ----------------  --------------------
  ca 03 07 2b 08 06 ba 00      00:08:48.000  WRITE DMA

SMART Extended Self-test Log (GP Log 0x07) not supported

SMART Self-test log structure revision number 1
Num  Test_Description    Status                  Remaining  LifeTime(hours)  LBA_of_first_error
# 1  Extended offline    Completed without error       00%     60361         -
# 2  Extended offline    Completed without error       00%     60354         -

Selective Self-tests/Logging not supported

SCT Commands not supported

Device Statistics (GP/SMART Log 0x04) not supported

Pending Defects log (GP Log 0x0c) not supported

SATA Phy Event Counters (GP Log 0x11) not supported

