smartctl 7.2 2020-12-30 r5155 [x86_64-linux-5.15.10] (local build)
Copyright (C) 2002-20, Bruce Allen, Christian Franke, www.smartmontools.org

=== START OF INFORMATION SECTION ===
Model Number:                       Micron_2210_MTFDHBA1T0QFD
Serial Number:                      --
Firmware Version:                   P6MA001
PCI Vendor/Subsystem ID:            0x1344
IEEE OUI Identifier:                0x00a075
Controller ID:                      0
NVMe Version:                       1.3
Number of Namespaces:               1
Namespace 1 Size/Capacity:          1,024,209,543,168 [1.02 TB]
Namespace 1 Formatted LBA Size:     512
Namespace 1 IEEE EUI-64:            00a075 ...
Local Time is:                      Thu Dec 23 11:35:00 2021 JST
Firmware Updates (0x14):            2 Slots, no Reset required
Optional Admin Commands (0x0017):   Security Format Frmw_DL Self_Test
Optional NVM Commands (0x005f):     Comp Wr_Unc DS_Mngmt Wr_Zero Sav/Sel_Feat Timestmp
Log Page Attributes (0x0f):         S/H_per_NS Cmd_Eff_Lg Ext_Get_Lg Telmtry_Lg
Maximum Data Transfer Size:         32 Pages
Warning  Comp. Temp. Threshold:     87 Celsius
Critical Comp. Temp. Threshold:     90 Celsius

Supported Power States
St Op     Max   Active     Idle   RL RT WL WT  Ent_Lat  Ex_Lat
 0 +     9.00W       -        -    0  0  0  0        5       5
 1 +     4.60W       -        -    1  1  1  1       30      30
 2 +     3.80W       -        -    2  2  2  2       30      30
 3 -   0.0300W       -        -    3  3  3  3     1000    1000
 4 -   0.0030W       -        -    4  4  4  4     6000    8000

Supported LBA Sizes (NSID 0x1)
Id Fmt  Data  Metadt  Rel_Perf
 0 +     512       0         0

=== START OF SMART DATA SECTION ===
SMART overall-health self-assessment test result: PASSED

SMART/Health Information (NVMe Log 0x02)
Critical Warning:                   0x00
Temperature:                        47 Celsius
Available Spare:                    100%
Available Spare Threshold:          5%
Percentage Used:                    0%
Data Units Read:                    2,472,798 [1.26 TB]
Data Units Written:                 3,165,821 [1.62 TB]
Host Read Commands:                 23,563,690
Host Write Commands:                26,202,008
Controller Busy Time:               484
Power Cycles:                       1,926
Power On Hours:                     178
Unsafe Shutdowns:                   27
Media and Data Integrity Errors:    0
Error Information Log Entries:      156
Warning  Comp. Temperature Time:    0
Critical Comp. Temperature Time:    0
Temperature Sensor 1:               47 Celsius

Error Information (NVMe Log 0x01, 16 of 256 entries)
Num   ErrCount  SQId   CmdId  Status  PELoc          LBA  NSID    VS
  0        156     0  0x100e  0x4005      -            0     1     -

