smartctl 7.3 2022-02-28 r5338 [x86_64-linux-6.1.7-arch1-1] (local build)
Copyright (C) 2002-22, Bruce Allen, Christian Franke, www.smartmontools.org

=== START OF INFORMATION SECTION ===
Model Number:                       KINGSTON SKC3000S1024G
Serial Number:                      --
Firmware Version:                   EIFK31.6
PCI Vendor/Subsystem ID:            0x2646
IEEE OUI Identifier:                0x0026b7
Total NVM Capacity:                 1,024,209,543,168 [1.02 TB]
Unallocated NVM Capacity:           0
Controller ID:                      1
NVMe Version:                       1.4
Number of Namespaces:               1
Namespace 1 Size/Capacity:          1,024,209,543,168 [1.02 TB]
Namespace 1 Formatted LBA Size:     512
Namespace 1 IEEE EUI-64:            0026b7 ...
Local Time is:                      Wed Jan 25 01:48:34 2023 CST
Firmware Updates (0x12):            1 Slot, no Reset required
Optional Admin Commands (0x0017):   Security Format Frmw_DL Self_Test
Optional NVM Commands (0x005d):     Comp DS_Mngmt Wr_Zero Sav/Sel_Feat Timestmp
Log Page Attributes (0x08):         Telmtry_Lg
Maximum Data Transfer Size:         512 Pages
Warning  Comp. Temp. Threshold:     84 Celsius
Critical Comp. Temp. Threshold:     89 Celsius

Supported Power States
St Op     Max   Active     Idle   RL RT WL WT  Ent_Lat  Ex_Lat
 0 +     8.80W       -        -    0  0  0  0        0       0
 1 +     7.10W       -        -    1  1  1  1        0       0
 2 +     5.20W       -        -    2  2  2  2        0       0
 3 -   0.0620W       -        -    3  3  3  3     2500    7500
 4 -   0.0620W       -        -    4  4  4  4     2500    7500

Supported LBA Sizes (NSID 0x1)
Id Fmt  Data  Metadt  Rel_Perf
 0 +     512       0         2
 1 -    4096       0         1

=== START OF SMART DATA SECTION ===
SMART overall-health self-assessment test result: PASSED

SMART/Health Information (NVMe Log 0x02)
Critical Warning:                   0x00
Temperature:                        23 Celsius
Available Spare:                    100%
Available Spare Threshold:          10%
Percentage Used:                    0%
Data Units Read:                    403,678 [206 GB]
Data Units Written:                 1,065,318 [545 GB]
Host Read Commands:                 4,912,853
Host Write Commands:                3,347,158
Controller Busy Time:               42
Power Cycles:                       38
Power On Hours:                     116
Unsafe Shutdowns:                   6
Media and Data Integrity Errors:    0
Error Information Log Entries:      180,759
Warning  Comp. Temperature Time:    0
Critical Comp. Temperature Time:    0
Temperature Sensor 2:               51 Celsius

Error Information (NVMe Log 0x01, 16 of 63 entries)
Num   ErrCount  SQId   CmdId  Status  PELoc          LBA  NSID    VS
  0     180759     0  0x500a  0x4004 0x102c            0     0     -
  1     180758     0  0x5009  0x4004 0x102c            0     0     -
  2     180757     0  0x300b  0x4004 0x102c            0     0     -
  3     180756     0  0x200b  0x4004 0x102c            0     0     -
  4     180755     0  0xb001  0x4004 0x102c            0     0     -
  5     180754     0  0xa001  0x4004 0x102c            0     0     -
  6     180753     0  0x9001  0x4004 0x102c            0     0     -
  7     180752     0  0x8001  0x4004 0x102c            0     0     -
  8     180751     0  0x7001  0x4004 0x102c            0     0     -
  9     180750     0  0x6001  0x4004 0x102c            0     0     -
 10     180749     0  0x401b  0x4004 0x102c            0     0     -
 11     180748     0  0x100b  0x4004 0x102c            0     0     -
 12     180747     0  0x000b  0x4004 0x102c            0     0     -
 13     180746     0  0xf00b  0x4004 0x102c            0     0     -
 14     180745     0  0xe00b  0x4004 0x102c            0     0     -
 15     180744     0  0xd00b  0x4004 0x102c            0     0     -
... (47 entries not read)



