smartctl 7.2 2020-12-30 r5155 [x86_64-linux-5.10.14-desktop-1omv4002] (OpenMandriva Lx 7.2-2)
Copyright (C) 2002-20, Bruce Allen, Christian Franke, www.smartmontools.org

=== START OF INFORMATION SECTION ===
Device Model:     WDC WD3200BMVS-11F9S0
Serial Number:    --
LU WWN Device Id: 5 0014ee ...
Firmware Version: 01.01A11
User Capacity:    320,072,933,376 bytes [320 GB]
Sector Size:      512 bytes logical/physical
Rotation Rate:    5400 rpm
Device is:        Not in smartctl database [for details use: -P showall]
ATA Version is:   ATA8-ACS (minor revision not indicated)
SATA Version is:  SATA 2.5, 1.5 Gb/s
Local Time is:    Mon Feb 15 15:45:34 2021 +07
SMART support is: Available - device has SMART capability.
SMART support is: Enabled
AAM level is:     254 (maximum performance), recommended: 128
APM level is:     128 (minimum power consumption without standby)
Rd look-ahead is: Enabled
Write cache is:   Enabled
DSN feature is:   Unavailable
ATA Security is:  Disabled, NOT FROZEN [SEC1]
Wt Cache Reorder: Enabled

=== START OF READ SMART DATA SECTION ===
SMART overall-health self-assessment test result: PASSED

General SMART Values:
Offline data collection status:  (0x84)	Offline data collection activity
					was suspended by an interrupting command from host.
					Auto Offline Data Collection: Enabled.
Self-test execution status:      (   0)	The previous self-test routine completed
					without error or no self-test has ever 
					been run.
Total time to complete Offline 
data collection: 		( 9600) seconds.
Offline data collection
capabilities: 			 (0x7b) SMART execute Offline immediate.
					Auto Offline data collection on/off support.
					Suspend Offline collection upon new
					command.
					Offline surface scan supported.
					Self-test supported.
					Conveyance Self-test supported.
					Selective Self-test supported.
SMART capabilities:            (0x0003)	Saves SMART data before entering
					power-saving mode.
					Supports SMART auto save timer.
Error logging capability:        (0x01)	Error logging supported.
					General Purpose Logging supported.
Short self-test routine 
recommended polling time: 	 (   2) minutes.
Extended self-test routine
recommended polling time: 	 ( 113) minutes.
Conveyance self-test routine
recommended polling time: 	 (   5) minutes.
SCT capabilities: 	       (0x303f)	SCT Status supported.
					SCT Error Recovery Control supported.
					SCT Feature Control supported.
					SCT Data Table supported.

SMART Attributes Data Structure revision number: 16
Vendor Specific SMART Attributes with Thresholds:
ID# ATTRIBUTE_NAME          FLAGS    VALUE WORST THRESH FAIL RAW_VALUE
  1 Raw_Read_Error_Rate     POSR-K   200   200   051    -    0
  3 Spin_Up_Time            POS--K   152   150   021    -    3375
  4 Start_Stop_Count        -O--CK   099   099   000    -    1987
  5 Reallocated_Sector_Ct   PO--CK   200   200   140    -    0
  7 Seek_Error_Rate         -OSR-K   200   200   051    -    0
  9 Power_On_Hours          -O--CK   099   099   000    -    1036
 10 Spin_Retry_Count        PO--CK   100   100   051    -    0
 11 Calibration_Retry_Count -O--CK   100   100   000    -    0
 12 Power_Cycle_Count       -O--CK   099   099   000    -    1170
192 Power-Off_Retract_Count -O--CK   200   200   000    -    530
193 Load_Cycle_Count        -O--CK   196   196   000    -    14358
194 Temperature_Celsius     -O---K   110   095   000    -    37
196 Reallocated_Event_Count -O--CK   200   200   000    -    0
197 Current_Pending_Sector  -O--CK   200   200   000    -    0
198 Offline_Uncorrectable   ----CK   100   253   000    -    0
199 UDMA_CRC_Error_Count    -O--CK   200   200   000    -    0
200 Multi_Zone_Error_Rate   P--R--   100   253   051    -    0
                            ||||||_ K auto-keep
                            |||||__ C event count
                            ||||___ R error rate
                            |||____ S speed/performance
                            ||_____ O updated online
                            |______ P prefailure warning

General Purpose Log Directory Version 1
SMART           Log Directory Version 1 [multi-sector log support]
Address    Access  R/W   Size  Description
0x00       GPL,SL  R/O      1  Log Directory
0x01           SL  R/O      1  Summary SMART error log
0x02           SL  R/O      5  Comprehensive SMART error log
0x03       GPL     R/O      6  Ext. Comprehensive SMART error log
0x06           SL  R/O      1  SMART self-test log
0x07       GPL     R/O      1  Extended self-test log
0x09           SL  R/W      1  Selective self-test log
0x10       GPL     R/O      1  NCQ Command Error log
0x11       GPL     R/O      1  SATA Phy Event Counters log
0x80-0x9f  GPL,SL  R/W     16  Host vendor specific log
0xa0-0xa7  GPL,SL  VS      16  Device vendor specific log
0xa8-0xb7  GPL,SL  VS       1  Device vendor specific log
0xc0       GPL,SL  VS       1  Device vendor specific log
0xc1       GPL     VS      24  Device vendor specific log
0xe0       GPL,SL  R/W      1  SCT Command/Status
0xe1       GPL,SL  R/W      1  SCT Data Transfer

SMART Extended Comprehensive Error Log Version: 1 (6 sectors)
Device Error Count: 105 (device log contains only the most recent 24 errors)
	CR     = Command Register
	FEATR  = Features Register
	COUNT  = Count (was: Sector Count) Register
	LBA_48 = Upper bytes of LBA High/Mid/Low Registers ]  ATA-8
	LH     = LBA High (was: Cylinder High) Register    ]   LBA
	LM     = LBA Mid (was: Cylinder Low) Register      ] Register
	LL     = LBA Low (was: Sector Number) Register     ]
	DV     = Device (was: Device/Head) Register
	DC     = Device Control Register
	ER     = Error register
	ST     = Status register
Powered_Up_Time is measured from power on, and printed as
DDd+hh:mm:SS.sss where DD=days, hh=hours, mm=minutes,
SS=sec, and sss=millisec. It "wraps" after 49.710 days.

Error 105 [8] occurred at disk power-on lifetime: 0 hours (0 days + 0 hours)
  When the command that caused the error occurred, the device was in an unknown state.

  After command completion occurred, registers were:
  ER -- ST COUNT  LBA_48  LH LM LL DV DC
  -- -- -- == -- == == == -- -- -- -- --
  40 -- 00 01 08 00 51 00 00 40 01 00 00

  Commands leading to the command that caused the error were:
  CR FEATR COUNT  LBA_48  LH LM LL DV DC  Powered_Up_Time  Command/Feature_Name
  -- == -- == -- == == == -- -- -- -- --  ---------------  --------------------
  00 9a 25 2b a5 00 00 00 00 00 00 00 21     00:00:00.000  NOP [Reserved subcommand] [OBS-ACS-2]
  00 08 42 00 b7 2b 17 21 98 25 00 00 00     00:00:46.856  NOP [Reserved subcommand] [OBS-ACS-2]
  21 3d 25 2b 7b 00 08 00 b7 42 00 00 21     00:47:33.368  READ SECTOR(S) [OBS-5]
  00 08 42 00 b7 2b cb 21 6d 25 00 00 00     00:00:46.856  NOP [Reserved subcommand] [OBS-ACS-2]

Error 104 [7] occurred at disk power-on lifetime: 0 hours (0 days + 0 hours)
  When the command that caused the error occurred, the device was in an unknown state.

  After command completion occurred, registers were:
  ER -- ST COUNT  LBA_48  LH LM LL DV DC
  -- -- -- == -- == == == -- -- -- -- --
  40 -- 00 01 08 00 51 00 00 40 01 00 00

  Commands leading to the command that caused the error were:
  CR FEATR COUNT  LBA_48  LH LM LL DV DC  Powered_Up_Time  Command/Feature_Name
  -- == -- == -- == == == -- -- -- -- --  ---------------  --------------------
  00 17 25 2b 98 00 00 00 00 00 00 00 21     00:00:00.000  NOP [Reserved subcommand] [OBS-ACS-2]
  00 08 42 00 b7 2b f8 21 89 25 00 00 00     00:00:46.856  NOP [Reserved subcommand] [OBS-ACS-2]
  21 cb 25 2b 6d 00 08 00 b7 42 00 00 21     00:47:29.597  READ SECTOR(S) [OBS-5]
  00 08 42 00 b7 2b 8e 21 61 25 00 00 00     00:00:46.856  NOP [Reserved subcommand] [OBS-ACS-2]

Error 103 [6] occurred at disk power-on lifetime: 0 hours (0 days + 0 hours)
  When the command that caused the error occurred, the device was in an unknown state.

  After command completion occurred, registers were:
  ER -- ST COUNT  LBA_48  LH LM LL DV DC
  -- -- -- == -- == == == -- -- -- -- --
  40 -- 00 01 08 00 51 00 00 40 01 00 00

  Commands leading to the command that caused the error were:
  CR FEATR COUNT  LBA_48  LH LM LL DV DC  Powered_Up_Time  Command/Feature_Name
  -- == -- == -- == == == -- -- -- -- --  ---------------  --------------------
  00 f8 25 2b 89 00 00 00 00 00 00 00 21     00:00:00.000  NOP [Reserved subcommand] [OBS-ACS-2]
  00 08 42 00 b7 2b 3d 21 7b 25 00 00 00     00:00:46.856  NOP [Reserved subcommand] [OBS-ACS-2]
  21 8e 25 2b 61 00 08 00 b7 42 00 00 21     00:47:26.155  READ SECTOR(S) [OBS-5]
  00 08 42 00 b7 2b e3 21 52 25 00 00 00     00:00:46.856  NOP [Reserved subcommand] [OBS-ACS-2]

Error 102 [5] occurred at disk power-on lifetime: 0 hours (0 days + 0 hours)
  When the command that caused the error occurred, the device was in an unknown state.

  After command completion occurred, registers were:
  ER -- ST COUNT  LBA_48  LH LM LL DV DC
  -- -- -- == -- == == == -- -- -- -- --
  40 -- 00 01 08 00 51 00 00 40 01 00 00

  Commands leading to the command that caused the error were:
  CR FEATR COUNT  LBA_48  LH LM LL DV DC  Powered_Up_Time  Command/Feature_Name
  -- == -- == -- == == == -- -- -- -- --  ---------------  --------------------
  00 3d 25 2b 7b 00 00 00 00 00 00 00 21     00:00:00.000  NOP [Reserved subcommand] [OBS-ACS-2]
  00 08 42 00 b7 2b cb 21 6d 25 00 00 00     00:00:46.856  NOP [Reserved subcommand] [OBS-ACS-2]
  21 e3 25 2b 52 00 08 00 b7 42 00 00 21     00:47:23.022  READ SECTOR(S) [OBS-5]
  00 08 42 00 b7 2b 5f 21 45 25 00 00 00     00:00:46.856  NOP [Reserved subcommand] [OBS-ACS-2]

Error 101 [4] occurred at disk power-on lifetime: 0 hours (0 days + 0 hours)
  When the command that caused the error occurred, the device was in an unknown state.

  After command completion occurred, registers were:
  ER -- ST COUNT  LBA_48  LH LM LL DV DC
  -- -- -- == -- == == == -- -- -- -- --
  40 -- 00 01 08 00 51 00 00 40 01 00 00

  Commands leading to the command that caused the error were:
  CR FEATR COUNT  LBA_48  LH LM LL DV DC  Powered_Up_Time  Command/Feature_Name
  -- == -- == -- == == == -- -- -- -- --  ---------------  --------------------
  00 cb 25 2b 6d 00 00 00 00 00 00 00 21     00:00:00.000  NOP [Reserved subcommand] [OBS-ACS-2]
  00 08 42 00 b7 2b 8e 21 61 25 00 00 00     00:00:46.856  NOP [Reserved subcommand] [OBS-ACS-2]
  21 5f 25 2b 45 00 08 00 b7 42 00 00 21     00:47:19.267  READ SECTOR(S) [OBS-5]
  00 08 42 00 b7 2b dc 21 37 25 00 00 00     00:00:46.856  NOP [Reserved subcommand] [OBS-ACS-2]

Error 100 [3] occurred at disk power-on lifetime: 0 hours (0 days + 0 hours)
  When the command that caused the error occurred, the device was in an unknown state.

  After command completion occurred, registers were:
  ER -- ST COUNT  LBA_48  LH LM LL DV DC
  -- -- -- == -- == == == -- -- -- -- --
  40 -- 00 01 08 00 51 00 00 40 01 00 00

  Commands leading to the command that caused the error were:
  CR FEATR COUNT  LBA_48  LH LM LL DV DC  Powered_Up_Time  Command/Feature_Name
  -- == -- == -- == == == -- -- -- -- --  ---------------  --------------------
  00 8e 25 2b 61 00 00 00 00 00 00 00 21     00:00:00.000  NOP [Reserved subcommand] [OBS-ACS-2]
  00 08 42 00 b7 2b e3 21 52 25 00 00 00     00:00:46.856  NOP [Reserved subcommand] [OBS-ACS-2]
  21 dc 25 2b 37 00 08 00 b7 42 00 00 21     00:47:15.807  READ SECTOR(S) [OBS-5]
  00 80 42 00 9f 2b ed 21 35 25 00 00 00     00:00:46.856  NOP [Reserved subcommand] [OBS-ACS-2]

Error 99 [2] occurred at disk power-on lifetime: 0 hours (0 days + 0 hours)
  When the command that caused the error occurred, the device was in an unknown state.

  After command completion occurred, registers were:
  ER -- ST COUNT  LBA_48  LH LM LL DV DC
  -- -- -- == -- == == == -- -- -- -- --
  40 -- 00 01 08 00 51 00 00 40 01 00 00

  Commands leading to the command that caused the error were:
  CR FEATR COUNT  LBA_48  LH LM LL DV DC  Powered_Up_Time  Command/Feature_Name
  -- == -- == -- == == == -- -- -- -- --  ---------------  --------------------
  00 e3 25 2b 52 00 00 00 00 00 00 00 21     00:00:00.000  NOP [Reserved subcommand] [OBS-ACS-2]
  00 08 42 00 b7 2b 5f 21 45 25 00 00 00     00:00:46.856  NOP [Reserved subcommand] [OBS-ACS-2]
  21 ed 25 2b 35 00 08 00 b7 42 00 00 21     00:47:12.348  READ SECTOR(S) [OBS-5]
  00 80 42 00 1f 2b eb 20 35 25 00 00 00     00:00:40.832  NOP [Reserved subcommand] [OBS-ACS-2]

Error 98 [1] occurred at disk power-on lifetime: 0 hours (0 days + 0 hours)
  When the command that caused the error occurred, the device was in an unknown state.

  After command completion occurred, registers were:
  ER -- ST COUNT  LBA_48  LH LM LL DV DC
  -- -- -- == -- == == == -- -- -- -- --
  40 -- 00 01 08 00 51 00 00 40 01 00 00

  Commands leading to the command that caused the error were:
  CR FEATR COUNT  LBA_48  LH LM LL DV DC  Powered_Up_Time  Command/Feature_Name
  -- == -- == -- == == == -- -- -- -- --  ---------------  --------------------
  00 5f 25 2b 45 00 00 00 00 00 00 00 21     00:00:00.000  NOP [Reserved subcommand] [OBS-ACS-2]
  00 08 42 00 b7 2b dc 21 37 25 00 00 00     00:00:46.856  NOP [Reserved subcommand] [OBS-ACS-2]
  21 eb 25 2b 35 00 80 00 9f 42 00 00 20     00:47:11.853  READ SECTOR(S) [OBS-5]
  00 08 42 00 b7 2b ce 21 29 25 00 00 00     00:00:08.064  NOP [Reserved subcommand] [OBS-ACS-2]

SMART Extended Self-test Log Version: 1 (1 sectors)
Num  Test_Description    Status                  Remaining  LifeTime(hours)  LBA_of_first_error
# 1  Short offline       Completed without error       00%      1011         -
# 2  Short offline       Completed without error       00%       944         -
# 3  Short offline       Completed without error       00%       899         -
# 4  Short offline       Completed without error       00%       884         -

SMART Selective self-test log data structure revision number 1
 SPAN  MIN_LBA  MAX_LBA  CURRENT_TEST_STATUS
    1        0        0  Not_testing
    2        0        0  Not_testing
    3        0        0  Not_testing
    4        0        0  Not_testing
    5        0        0  Not_testing
Selective self-test flags (0x0):
  After scanning selected spans, do NOT read-scan remainder of disk.
If Selective self-test is pending on power-up, resume after 0 minute delay.

SCT Status Version:                  2
SCT Version (vendor specific):       258 (0x0102)
Device State:                        SMART Off-line Data Collection executing in background (4)
Current Temperature:                    38 Celsius
Power Cycle Min/Max Temperature:     37/39 Celsius
Lifetime    Min/Max Temperature:     35/56 Celsius
Under/Over Temperature Limit Count:   0/0
Vendor specific:
01 00 00 00 00 00 00 00 00 00 00 00 00 00 00 00
00 00 00 00 00 00 00 00 00 00 00 00 00 00 00 00

SCT Temperature History Version:     2
Temperature Sampling Period:         1 minute
Temperature Logging Interval:        1 minute
Min/Max recommended Temperature:      0/60 Celsius
Min/Max Temperature Limit:            1/85 Celsius
Temperature History Size (Index):    128 (21)

SCT Error Recovery Control:
           Read: Disabled
          Write: Disabled

Device Statistics (GP/SMART Log 0x04) not supported

Pending Defects log (GP Log 0x0c) not supported

SATA Phy Event Counters (GP Log 0x11)
ID      Size     Value  Description
0x0001  2            0  Command failed due to ICRC error
0x0002  2            0  R_ERR response for data FIS
0x0003  2            0  R_ERR response for device-to-host data FIS
0x0004  2            0  R_ERR response for host-to-device data FIS
0x0005  2            0  R_ERR response for non-data FIS
0x0006  2            0  R_ERR response for device-to-host non-data FIS
0x0007  2            0  R_ERR response for host-to-device non-data FIS
0x000a  2            0  Device-to-host register FISes sent due to a COMRESET
0x8000  4         2336  Vendor specific

