=== START OF INFORMATION SECTION ===
Model Family:     Western Digital Caviar Blue (SATA)
Device Model:     WDC WD5000AAKS-00UU3A0
Serial Number:    --
LU WWN Device Id: 5 0014ee ...
Firmware Version: 01.03B01
User Capacity:    500 107 862 016 bytes [500 GB]
Sector Size:      512 bytes logical/physical
Device is:        In smartctl database [for details use: -P show]
ATA Version is:   ATA8-ACS (minor revision not indicated)
SATA Version is:  SATA 2.6, 3.0 Gb/s
Local Time is:    Sat Jun 18 08:07:24 2016 MSK
SMART support is: Available - device has SMART capability.
SMART support is: Enabled
AAM level is:     128 (quiet), recommended: 128
APM feature is:   Unavailable
Rd look-ahead is: Enabled
Write cache is:   Enabled
ATA Security is:  Disabled, frozen [SEC2]
Wt Cache Reorder: Enabled

=== START OF READ SMART DATA SECTION ===
SMART overall-health self-assessment test result: PASSED

General SMART Values:
Offline data collection status:  (0x82)	Offline data collection activity
					was completed without error.
					Auto Offline Data Collection: Enabled.
Self-test execution status:      (   0)	The previous self-test routine completed
					without error or no self-test has ever 
					been run.
Total time to complete Offline 
data collection: 		( 8580) seconds.
Offline data collection
capabilities: 			 (0x7b) SMART execute Offline immediate.
					Auto Offline data collection on/off support.
					Suspend Offline collection upon new
					command.
					Offline surface scan supported.
					Self-test supported.
					Conveyance Self-test supported.
					Selective Self-test supported.
SMART capabilities:            (0x0003)	Saves SMART data before entering
					power-saving mode.
					Supports SMART auto save timer.
Error logging capability:        (0x01)	Error logging supported.
					General Purpose Logging supported.
Short self-test routine 
recommended polling time: 	 (   2) minutes.
Extended self-test routine
recommended polling time: 	 ( 102) minutes.
Conveyance self-test routine
recommended polling time: 	 (   5) minutes.
SCT capabilities: 	       (0x3037)	SCT Status supported.
					SCT Feature Control supported.
					SCT Data Table supported.

SMART Attributes Data Structure revision number: 16
Vendor Specific SMART Attributes with Thresholds:
ID# ATTRIBUTE_NAME          FLAGS    VALUE WORST THRESH FAIL RAW_VALUE
  1 Raw_Read_Error_Rate     POSR-K   200   200   051    -    64
  3 Spin_Up_Time            POS--K   141   140   021    -    3925
  4 Start_Stop_Count        -O--CK   098   098   000    -    2268
  5 Reallocated_Sector_Ct   PO--CK   200   200   140    -    0
  7 Seek_Error_Rate         -OSR-K   100   253   000    -    0
  9 Power_On_Hours          -O--CK   095   095   000    -    3696
 10 Spin_Retry_Count        -O--CK   100   100   000    -    0
 11 Calibration_Retry_Count -O--CK   100   100   000    -    0
 12 Power_Cycle_Count       -O--CK   098   098   000    -    2239
192 Power-Off_Retract_Count -O--CK   200   200   000    -    733
193 Load_Cycle_Count        -O--CK   200   200   000    -    1534
194 Temperature_Celsius     -O---K   111   092   000    -    32
196 Reallocated_Event_Count -O--CK   200   200   000    -    0
197 Current_Pending_Sector  -O--CK   200   200   000    -    0
198 Offline_Uncorrectable   ----CK   200   200   000    -    0
199 UDMA_CRC_Error_Count    -O--CK   200   200   000    -    14
200 Multi_Zone_Error_Rate   ---R--   200   200   000    -    0
                            ||||||_ K auto-keep
                            |||||__ C event count
                            ||||___ R error rate
                            |||____ S speed/performance
                            ||_____ O updated online
                            |______ P prefailure warning

General Purpose Log Directory Version 1
SMART           Log Directory Version 1 [multi-sector log support]
Address    Access  R/W   Size  Description
0x00       GPL,SL  R/O      1  Log Directory
0x01           SL  R/O      1  Summary SMART error log
0x02           SL  R/O      5  Comprehensive SMART error log
0x03       GPL     R/O      6  Ext. Comprehensive SMART error log
0x06           SL  R/O      1  SMART self-test log
0x07       GPL     R/O      1  Extended self-test log
0x09           SL  R/W      1  Selective self-test log
0x10       GPL     R/O      1  SATA NCQ Queued Error log
0x11       GPL     R/O      1  SATA Phy Event Counters log
0x80-0x9f  GPL,SL  R/W     16  Host vendor specific log
0xa0-0xa7  GPL,SL  VS      16  Device vendor specific log
0xa8-0xb5  GPL,SL  VS       1  Device vendor specific log
0xb6       GPL     VS       1  Device vendor specific log
0xb7       GPL,SL  VS       1  Device vendor specific log
0xc0       GPL,SL  VS       1  Device vendor specific log
0xc1       GPL     VS      24  Device vendor specific log
0xe0       GPL,SL  R/W      1  SCT Command/Status
0xe1       GPL,SL  R/W      1  SCT Data Transfer

SMART Extended Comprehensive Error Log Version: 1 (6 sectors)
Device Error Count: 63 (device log contains only the most recent 24 errors)
	CR     = Command Register
	FEATR  = Features Register
	COUNT  = Count (was: Sector Count) Register
	LBA_48 = Upper bytes of LBA High/Mid/Low Registers ]  ATA-8
	LH     = LBA High (was: Cylinder High) Register    ]   LBA
	LM     = LBA Mid (was: Cylinder Low) Register      ] Register
	LL     = LBA Low (was: Sector Number) Register     ]
	DV     = Device (was: Device/Head) Register
	DC     = Device Control Register
	ER     = Error register
	ST     = Status register
Powered_Up_Time is measured from power on, and printed as
DDd+hh:mm:SS.sss where DD=days, hh=hours, mm=minutes,
SS=sec, and sss=millisec. It "wraps" after 49.710 days.

Error 63 [14] occurred at disk power-on lifetime: 3264 hours (136 days + 0 hours)
  When the command that caused the error occurred, the device was active or idle.

  After command completion occurred, registers were:
  ER -- ST COUNT  LBA_48  LH LM LL DV DC
  -- -- -- == -- == == == -- -- -- -- --
  40 -- 51 00 00 00 00 06 cb 9f 12 40 00  Error: UNC at LBA = 0x06cb9f12 = 114007826

  Commands leading to the command that caused the error were:
  CR FEATR COUNT  LBA_48  LH LM LL DV DC  Powered_Up_Time  Command/Feature_Name
  -- == -- == -- == == == -- -- -- -- --  ---------------  --------------------
  60 00 20 00 00 00 00 06 cb 9e f7 40 00     00:22:17.540  READ FPDMA QUEUED
  61 00 60 00 00 00 00 05 38 8f 5f 40 00     00:22:17.539  WRITE FPDMA QUEUED
  60 00 20 00 00 00 00 09 73 9f bf 40 00     00:22:17.526  READ FPDMA QUEUED
  61 00 08 00 00 00 00 00 5e 00 3f 40 00     00:22:17.525  WRITE FPDMA QUEUED
  61 00 08 00 00 00 00 00 5e 5e 67 40 00     00:22:17.525  WRITE FPDMA QUEUED

Error 62 [13] occurred at disk power-on lifetime: 3264 hours (136 days + 0 hours)
  When the command that caused the error occurred, the device was active or idle.

  After command completion occurred, registers were:
  ER -- ST COUNT  LBA_48  LH LM LL DV DC
  -- -- -- == -- == == == -- -- -- -- --
  40 -- 51 00 00 00 00 06 cb 9f 12 40 00  Error: UNC at LBA = 0x06cb9f12 = 114007826

  Commands leading to the command that caused the error were:
  CR FEATR COUNT  LBA_48  LH LM LL DV DC  Powered_Up_Time  Command/Feature_Name
  -- == -- == -- == == == -- -- -- -- --  ---------------  --------------------
  60 00 20 00 00 00 00 06 cb 9e f7 40 00     00:22:14.626  READ FPDMA QUEUED
  60 00 c0 00 00 00 00 02 9f 55 47 40 00     00:22:14.604  READ FPDMA QUEUED
  60 00 80 00 00 00 00 00 72 cf 27 40 00     00:22:14.563  READ FPDMA QUEUED
  61 00 08 00 00 00 00 00 5e 00 47 40 00     00:22:14.562  WRITE FPDMA QUEUED
  61 00 80 00 00 00 00 09 73 99 3f 40 00     00:22:14.562  WRITE FPDMA QUEUED

Error 61 [12] occurred at disk power-on lifetime: 3264 hours (136 days + 0 hours)
  When the command that caused the error occurred, the device was active or idle.

  After command completion occurred, registers were:
  ER -- ST COUNT  LBA_48  LH LM LL DV DC
  -- -- -- == -- == == == -- -- -- -- --
  40 -- 51 00 00 00 00 06 cb 9f 12 40 00  Error: UNC at LBA = 0x06cb9f12 = 114007826

  Commands leading to the command that caused the error were:
  CR FEATR COUNT  LBA_48  LH LM LL DV DC  Powered_Up_Time  Command/Feature_Name
  -- == -- == -- == == == -- -- -- -- --  ---------------  --------------------
  60 00 20 00 00 00 00 06 cb 9e f7 40 00     00:22:11.715  READ FPDMA QUEUED
  61 00 08 00 00 00 00 00 5e 00 47 40 00     00:22:11.694  WRITE FPDMA QUEUED
  61 00 80 00 00 00 00 00 72 d3 27 40 00     00:22:11.694  WRITE FPDMA QUEUED
  60 00 20 00 00 00 00 00 0b 0a 7d 40 00     00:22:11.685  READ FPDMA QUEUED
  60 00 20 00 00 00 00 00 0b 07 a5 40 00     00:22:11.679  READ FPDMA QUEUED

Error 60 [11] occurred at disk power-on lifetime: 3264 hours (136 days + 0 hours)
  When the command that caused the error occurred, the device was active or idle.

  After command completion occurred, registers were:
  ER -- ST COUNT  LBA_48  LH LM LL DV DC
  -- -- -- == -- == == == -- -- -- -- --
  40 -- 51 00 00 00 00 06 cb 9f 12 40 00  Error: UNC at LBA = 0x06cb9f12 = 114007826

  Commands leading to the command that caused the error were:
  CR FEATR COUNT  LBA_48  LH LM LL DV DC  Powered_Up_Time  Command/Feature_Name
  -- == -- == -- == == == -- -- -- -- --  ---------------  --------------------
  60 00 20 00 00 00 00 06 cb 9e f7 40 00     00:22:08.807  READ FPDMA QUEUED
  60 00 40 00 00 00 00 00 4e 78 af 40 00     00:22:08.806  READ FPDMA QUEUED
  60 00 40 00 00 00 00 00 08 60 d9 40 00     00:22:08.797  READ FPDMA QUEUED
  60 00 40 00 00 00 00 00 4e 78 ef 40 00     00:22:08.789  READ FPDMA QUEUED
  61 00 08 00 00 00 00 00 5e 00 3f 40 00     00:22:08.632  WRITE FPDMA QUEUED

Error 59 [10] occurred at disk power-on lifetime: 3264 hours (136 days + 0 hours)
  When the command that caused the error occurred, the device was active or idle.

  After command completion occurred, registers were:
  ER -- ST COUNT  LBA_48  LH LM LL DV DC
  -- -- -- == -- == == == -- -- -- -- --
  40 -- 51 00 00 00 00 06 cb 9f 12 40 00  Error: UNC at LBA = 0x06cb9f12 = 114007826

  Commands leading to the command that caused the error were:
  CR FEATR COUNT  LBA_48  LH LM LL DV DC  Powered_Up_Time  Command/Feature_Name
  -- == -- == -- == == == -- -- -- -- --  ---------------  --------------------
  60 00 20 00 00 00 00 06 cb 9e f7 40 00     00:22:05.896  READ FPDMA QUEUED
  61 00 08 00 00 00 00 00 5e 00 47 40 00     00:22:05.879  WRITE FPDMA QUEUED
  61 00 80 00 00 00 00 04 00 b0 5f 40 00     00:22:05.879  WRITE FPDMA QUEUED
  61 00 08 00 00 00 00 00 5e 00 3f 40 00     00:22:05.798  WRITE FPDMA QUEUED
  61 00 80 00 00 00 00 04 00 af df 40 00     00:22:05.798  WRITE FPDMA QUEUED

Error 58 [9] occurred at disk power-on lifetime: 3264 hours (136 days + 0 hours)
  When the command that caused the error occurred, the device was active or idle.

  After command completion occurred, registers were:
  ER -- ST COUNT  LBA_48  LH LM LL DV DC
  -- -- -- == -- == == == -- -- -- -- --
  40 -- 51 00 00 00 00 06 cb 9f 12 40 00  Error: UNC at LBA = 0x06cb9f12 = 114007826

  Commands leading to the command that caused the error were:
  CR FEATR COUNT  LBA_48  LH LM LL DV DC  Powered_Up_Time  Command/Feature_Name
  -- == -- == -- == == == -- -- -- -- --  ---------------  --------------------
  60 00 20 00 10 00 00 06 cb 9e f7 40 00     00:22:02.979  READ FPDMA QUEUED
  61 00 08 00 50 00 00 06 4d d9 df 40 00     00:22:02.978  WRITE FPDMA QUEUED
  61 00 08 00 48 00 00 00 5e 00 47 40 00     00:22:02.978  WRITE FPDMA QUEUED
  60 00 28 00 08 00 00 00 0b ec f9 40 00     00:22:02.978  READ FPDMA QUEUED
  61 00 08 00 40 00 00 00 01 64 c7 40 00     00:22:02.978  WRITE FPDMA QUEUED

Error 57 [8] occurred at disk power-on lifetime: 3264 hours (136 days + 0 hours)
  When the command that caused the error occurred, the device was active or idle.

  After command completion occurred, registers were:
  ER -- ST COUNT  LBA_48  LH LM LL DV DC
  -- -- -- == -- == == == -- -- -- -- --
  40 -- 51 00 00 00 00 06 cb 9f 12 40 00  Error: WP at LBA = 0x06cb9f12 = 114007826

  Commands leading to the command that caused the error were:
  CR FEATR COUNT  LBA_48  LH LM LL DV DC  Powered_Up_Time  Command/Feature_Name
  -- == -- == -- == == == -- -- -- -- --  ---------------  --------------------
  61 00 90 00 20 00 00 06 cc c3 3f 40 00     00:22:00.069  WRITE FPDMA QUEUED
  61 01 00 00 18 00 00 06 cc c2 3f 40 00     00:22:00.068  WRITE FPDMA QUEUED
  61 01 00 00 10 00 00 06 cc c1 3f 40 00     00:22:00.068  WRITE FPDMA QUEUED
  60 00 20 00 08 00 00 06 cb 9e f7 40 00     00:22:00.068  READ FPDMA QUEUED
  61 00 08 00 00 00 00 00 5e 5d 67 40 00     00:22:00.068  WRITE FPDMA QUEUED

Error 56 [7] occurred at disk power-on lifetime: 3264 hours (136 days + 0 hours)
  When the command that caused the error occurred, the device was active or idle.

  After command completion occurred, registers were:
  ER -- ST COUNT  LBA_48  LH LM LL DV DC
  -- -- -- == -- == == == -- -- -- -- --
  40 -- 51 00 00 00 00 06 cb 9f 12 40 00  Error: UNC at LBA = 0x06cb9f12 = 114007826

  Commands leading to the command that caused the error were:
  CR FEATR COUNT  LBA_48  LH LM LL DV DC  Powered_Up_Time  Command/Feature_Name
  -- == -- == -- == == == -- -- -- -- --  ---------------  --------------------
  60 00 20 00 80 00 00 06 cb 9e f7 40 00     00:21:56.153  READ FPDMA QUEUED
  61 00 10 00 78 00 00 06 ca d0 af 40 00     00:21:56.153  WRITE FPDMA QUEUED
  61 01 00 00 70 00 00 06 c9 c7 47 40 00     00:21:56.152  WRITE FPDMA QUEUED
  61 01 00 00 20 00 00 06 c9 c6 47 40 00     00:21:56.152  WRITE FPDMA QUEUED
  61 01 00 00 68 00 00 06 c9 c5 47 40 00     00:21:56.151  WRITE FPDMA QUEUED

SMART Extended Self-test Log Version: 1 (1 sectors)
No self-tests have been logged.  [To run self-tests, use: smartctl -t]

SMART Selective self-test log data structure revision number 1
 SPAN  MIN_LBA  MAX_LBA  CURRENT_TEST_STATUS
    1        0        0  Not_testing
    2        0        0  Not_testing
    3        0        0  Not_testing
    4        0        0  Not_testing
    5        0        0  Not_testing
Selective self-test flags (0x0):
  After scanning selected spans, do NOT read-scan remainder of disk.
If Selective self-test is pending on power-up, resume after 0 minute delay.

SCT Status Version:                  2
SCT Version (vendor specific):       258 (0x0102)
SCT Support Level:                   1
Device State:                        Active (0)
Current Temperature:                    32 Celsius
Power Cycle Min/Max Temperature:     25/32 Celsius
Lifetime    Min/Max Temperature:     25/51 Celsius
Under/Over Temperature Limit Count:   0/0

SCT Temperature History Version:     2
Temperature Sampling Period:         1 minute
Temperature Logging Interval:        1 minute
Min/Max recommended Temperature:      0/60 Celsius
Min/Max Temperature Limit:           -41/85 Celsius
Temperature History Size (Index):    478 (348)

SCT Error Recovery Control command not supported

Device Statistics (GP/SMART Log 0x04) not supported

SATA Phy Event Counters (GP Log 0x11)
ID      Size     Value  Description
0x0001  2            0  Command failed due to ICRC error
0x0002  2            0  R_ERR response for data FIS
0x0003  2            0  R_ERR response for device-to-host data FIS
0x0004  2            0  R_ERR response for host-to-device data FIS
0x0005  2            0  R_ERR response for non-data FIS
0x0006  2            0  R_ERR response for device-to-host non-data FIS
0x0007  2            0  R_ERR response for host-to-device non-data FIS
0x000a  2            1  Device-to-host register FISes sent due to a COMRESET
0x000b  2            0  CRC errors within host-to-device FIS
0x8000  4         1173  Vendor specific

