smartctl 7.2 2020-12-30 r5155 [x86_64-linux-5.16.7-desktop-1omv4003] (OpenMandriva Lx 7.2-2)
Copyright (C) 2002-20, Bruce Allen, Christian Franke, www.smartmontools.org

=== START OF INFORMATION SECTION ===
Model Family:     Western Digital Caviar Blue EIDE
Device Model:     WDC WD1600AAJB-00J3A0
Serial Number:    --
LU WWN Device Id: 5 0014ee ...
Firmware Version: 01.03E01
User Capacity:    160,040,803,840 bytes [160 GB]
Sector Size:      512 bytes logical/physical
Device is:        In smartctl database [for details use: -P show]
ATA Version is:   ATA8-ACS (minor revision not indicated)
Transport Type:   Parallel, ATA8-APT
Local Time is:    Wed Oct 23 14:00:06 2024 -03
SMART support is: Available - device has SMART capability.
SMART support is: Enabled
AAM feature is:   Disabled
APM feature is:   Unavailable
Rd look-ahead is: Enabled
Write cache is:   Enabled
DSN feature is:   Unavailable
ATA Security is:  Disabled, frozen [SEC2]
Wt Cache Reorder: Enabled

=== START OF READ SMART DATA SECTION ===
SMART overall-health self-assessment test result: PASSED

General SMART Values:
Offline data collection status:  (0x84)	Offline data collection activity
					was suspended by an interrupting command from host.
					Auto Offline Data Collection: Enabled.
Self-test execution status:      (   0)	The previous self-test routine completed
					without error or no self-test has ever 
					been run.
Total time to complete Offline 
data collection: 		( 3000) seconds.
Offline data collection
capabilities: 			 (0x7b) SMART execute Offline immediate.
					Auto Offline data collection on/off support.
					Suspend Offline collection upon new
					command.
					Offline surface scan supported.
					Self-test supported.
					Conveyance Self-test supported.
					Selective Self-test supported.
SMART capabilities:            (0x0003)	Saves SMART data before entering
					power-saving mode.
					Supports SMART auto save timer.
Error logging capability:        (0x01)	Error logging supported.
					General Purpose Logging supported.
Short self-test routine 
recommended polling time: 	 (   2) minutes.
Extended self-test routine
recommended polling time: 	 (  39) minutes.
Conveyance self-test routine
recommended polling time: 	 (   5) minutes.
SCT capabilities: 	       (0x303f)	SCT Status supported.
					SCT Error Recovery Control supported.
					SCT Feature Control supported.
					SCT Data Table supported.

SMART Attributes Data Structure revision number: 16
Vendor Specific SMART Attributes with Thresholds:
ID# ATTRIBUTE_NAME          FLAGS    VALUE WORST THRESH FAIL RAW_VALUE
  1 Raw_Read_Error_Rate     POSR-K   200   200   051    -    16357
  3 Spin_Up_Time            POS--K   137   130   021    -    4150
  4 Start_Stop_Count        -O--CK   096   096   000    -    4086
  5 Reallocated_Sector_Ct   PO--CK   200   200   140    -    0
  7 Seek_Error_Rate         -OSR-K   100   253   000    -    0
  9 Power_On_Hours          -O--CK   084   084   000    -    11995
 10 Spin_Retry_Count        -O--CK   100   100   000    -    0
 11 Calibration_Retry_Count -O--CK   100   100   000    -    0
 12 Power_Cycle_Count       -O--CK   097   097   000    -    3871
192 Power-Off_Retract_Count -O--CK   200   200   000    -    431
193 Load_Cycle_Count        -O--CK   199   199   000    -    4081
194 Temperature_Celsius     -O---K   110   099   000    -    33
196 Reallocated_Event_Count -O--CK   200   200   000    -    0
197 Current_Pending_Sector  -O--CK   200   200   000    -    12
198 Offline_Uncorrectable   ----CK   200   200   000    -    10
199 UDMA_CRC_Error_Count    -O--CK   200   200   000    -    1
200 Multi_Zone_Error_Rate   ---R--   200   200   000    -    18
                            ||||||_ K auto-keep
                            |||||__ C event count
                            ||||___ R error rate
                            |||____ S speed/performance
                            ||_____ O updated online
                            |______ P prefailure warning

General Purpose Log Directory Version 1
SMART           Log Directory Version 1 [multi-sector log support]
Address    Access  R/W   Size  Description
0x00       GPL,SL  R/O      1  Log Directory
0x01           SL  R/O      1  Summary SMART error log
0x02           SL  R/O      5  Comprehensive SMART error log
0x03       GPL     R/O      6  Ext. Comprehensive SMART error log
0x06           SL  R/O      1  SMART self-test log
0x07       GPL     R/O      1  Extended self-test log
0x09           SL  R/W      1  Selective self-test log
0x11       GPL     R/O      1  SATA Phy Event Counters log
0x80-0x9f  GPL,SL  R/W     16  Host vendor specific log
0xa0-0xa7  GPL,SL  VS      16  Device vendor specific log
0xa8-0xb7  GPL,SL  VS       1  Device vendor specific log
0xc0       GPL,SL  VS       1  Device vendor specific log
0xc1       GPL     VS      24  Device vendor specific log
0xe0       GPL,SL  R/W      1  SCT Command/Status
0xe1       GPL,SL  R/W      1  SCT Data Transfer

SMART Extended Comprehensive Error Log Version: 1 (6 sectors)
Device Error Count: 15839 (device log contains only the most recent 24 errors)
	CR     = Command Register
	FEATR  = Features Register
	COUNT  = Count (was: Sector Count) Register
	LBA_48 = Upper bytes of LBA High/Mid/Low Registers ]  ATA-8
	LH     = LBA High (was: Cylinder High) Register    ]   LBA
	LM     = LBA Mid (was: Cylinder Low) Register      ] Register
	LL     = LBA Low (was: Sector Number) Register     ]
	DV     = Device (was: Device/Head) Register
	DC     = Device Control Register
	ER     = Error register
	ST     = Status register
Powered_Up_Time is measured from power on, and printed as
DDd+hh:mm:SS.sss where DD=days, hh=hours, mm=minutes,
SS=sec, and sss=millisec. It "wraps" after 49.710 days.

Error 15839 [22] occurred at disk power-on lifetime: 11872 hours (494 days + 16 hours)
  When the command that caused the error occurred, the device was active or idle.

  After command completion occurred, registers were:
  ER -- ST COUNT  LBA_48  LH LM LL DV DC
  -- -- -- == -- == == == -- -- -- -- --
  40 -- 51 01 00 00 0f b2 00 6c 00 e0 00  Error: UNC 256 sectors at LBA = 0xfb2006c00 = 67410881536

  Commands leading to the command that caused the error were:
  CR FEATR COUNT  LBA_48  LH LM LL DV DC  Powered_Up_Time  Command/Feature_Name
  -- == -- == -- == == == -- -- -- -- --  ---------------  --------------------
  25 00 00 01 00 00 00 0f 6c b2 00 e0 00     01:47:35.227  READ DMA EXT
  25 00 00 01 00 00 00 0f 6c b1 00 e0 00     01:47:35.224  READ DMA EXT
  25 00 00 01 00 00 00 0f 6c b0 00 e0 00     01:47:35.223  READ DMA EXT
  25 00 00 01 00 00 00 0f 6c af 00 e0 00     01:47:35.221  READ DMA EXT
  25 00 00 01 00 00 00 0f 6c ae 00 e0 00     01:47:35.220  READ DMA EXT

Error 15838 [21] occurred at disk power-on lifetime: 11869 hours (494 days + 13 hours)
  When the command that caused the error occurred, the device was active or idle.

  After command completion occurred, registers were:
  ER -- ST COUNT  LBA_48  LH LM LL DV DC
  -- -- -- == -- == == == -- -- -- -- --
  40 -- 51 00 01 00 0f f0 00 7f 01 e0 00  Error: UNC 1 sectors at LBA = 0xff0007f01 = 68451073793

  Commands leading to the command that caused the error were:
  CR FEATR COUNT  LBA_48  LH LM LL DV DC  Powered_Up_Time  Command/Feature_Name
  -- == -- == -- == == == -- -- -- -- --  ---------------  --------------------
  25 00 00 00 01 00 00 0f 7f f0 01 e0 00     01:23:05.767  READ DMA EXT
  35 00 00 00 01 00 00 0f 7f f0 00 e0 00     01:23:05.767  WRITE DMA EXT
  25 00 00 00 01 00 00 0f 7f f0 00 e0 00     01:23:05.767  READ DMA EXT
  25 00 00 00 01 00 00 0f 7f f0 01 e0 00     01:23:03.559  READ DMA EXT
  25 00 00 00 01 00 00 0f 7f f0 00 e0 00     01:23:03.559  READ DMA EXT

Error 15837 [20] occurred at disk power-on lifetime: 11869 hours (494 days + 13 hours)
  When the command that caused the error occurred, the device was active or idle.

  After command completion occurred, registers were:
  ER -- ST COUNT  LBA_48  LH LM LL DV DC
  -- -- -- == -- == == == -- -- -- -- --
  40 -- 51 00 01 00 0f f0 00 7f 01 e0 00  Error: UNC 1 sectors at LBA = 0xff0007f01 = 68451073793

  Commands leading to the command that caused the error were:
  CR FEATR COUNT  LBA_48  LH LM LL DV DC  Powered_Up_Time  Command/Feature_Name
  -- == -- == -- == == == -- -- -- -- --  ---------------  --------------------
  25 00 00 00 01 00 00 0f 7f f0 01 e0 00     01:23:03.559  READ DMA EXT
  25 00 00 00 01 00 00 0f 7f f0 00 e0 00     01:23:03.559  READ DMA EXT
  25 00 00 00 01 00 00 0f 7f ef ff e0 00     01:23:03.558  READ DMA EXT
  25 00 00 00 01 00 00 0f 7f ef fe e0 00     01:23:03.558  READ DMA EXT
  25 00 00 00 01 00 00 0f 7f ef fd e0 00     01:23:03.558  READ DMA EXT

Error 15836 [19] occurred at disk power-on lifetime: 11869 hours (494 days + 13 hours)
  When the command that caused the error occurred, the device was active or idle.

  After command completion occurred, registers were:
  ER -- ST COUNT  LBA_48  LH LM LL DV DC
  -- -- -- == -- == == == -- -- -- -- --
  40 -- 51 00 7f 00 0f ef 00 7f a4 e0 00  Error: UNC 127 sectors at LBA = 0xfef007fa4 = 68434296740

  Commands leading to the command that caused the error were:
  CR FEATR COUNT  LBA_48  LH LM LL DV DC  Powered_Up_Time  Command/Feature_Name
  -- == -- == -- == == == -- -- -- -- --  ---------------  --------------------
  25 00 00 00 7f 00 00 0f 7f ef a4 e0 00     01:23:01.173  READ DMA EXT
  25 00 00 00 7f 00 00 0f 7f ef 25 e0 00     01:23:01.172  READ DMA EXT
  25 00 00 00 7f 00 00 0f 7f ee a6 e0 00     01:23:01.171  READ DMA EXT
  25 00 00 00 7f 00 00 0f 7f ee 27 e0 00     01:23:01.170  READ DMA EXT
  25 00 00 00 7f 00 00 0f 7f ed a8 e0 00     01:23:01.169  READ DMA EXT

Error 15835 [18] occurred at disk power-on lifetime: 11869 hours (494 days + 13 hours)
  When the command that caused the error occurred, the device was active or idle.

  After command completion occurred, registers were:
  ER -- ST COUNT  LBA_48  LH LM LL DV DC
  -- -- -- == -- == == == -- -- -- -- --
  40 -- 51 00 01 00 0f db 00 78 1d e0 00  Error: UNC 1 sectors at LBA = 0xfdb00781d = 68098750493

  Commands leading to the command that caused the error were:
  CR FEATR COUNT  LBA_48  LH LM LL DV DC  Powered_Up_Time  Command/Feature_Name
  -- == -- == -- == == == -- -- -- -- --  ---------------  --------------------
  25 00 00 00 01 00 00 0f 78 db 1d e0 00     01:22:49.093  READ DMA EXT
  35 00 00 00 01 00 00 0f 78 db 1c e0 00     01:22:49.093  WRITE DMA EXT
  25 00 00 00 01 00 00 0f 78 db 1c e0 00     01:22:49.093  READ DMA EXT
  25 00 00 00 01 00 00 0f 78 db 1d e0 00     01:22:46.887  READ DMA EXT
  25 00 00 00 01 00 00 0f 78 db 1c e0 00     01:22:46.887  READ DMA EXT

Error 15834 [17] occurred at disk power-on lifetime: 11869 hours (494 days + 13 hours)
  When the command that caused the error occurred, the device was active or idle.

  After command completion occurred, registers were:
  ER -- ST COUNT  LBA_48  LH LM LL DV DC
  -- -- -- == -- == == == -- -- -- -- --
  40 -- 51 00 01 00 0f db 00 78 1d e0 00  Error: UNC 1 sectors at LBA = 0xfdb00781d = 68098750493

  Commands leading to the command that caused the error were:
  CR FEATR COUNT  LBA_48  LH LM LL DV DC  Powered_Up_Time  Command/Feature_Name
  -- == -- == -- == == == -- -- -- -- --  ---------------  --------------------
  25 00 00 00 01 00 00 0f 78 db 1d e0 00     01:22:46.887  READ DMA EXT
  25 00 00 00 01 00 00 0f 78 db 1c e0 00     01:22:46.887  READ DMA EXT
  25 00 00 00 01 00 00 0f 78 db 1b e0 00     01:22:46.887  READ DMA EXT
  25 00 00 00 01 00 00 0f 78 db 1a e0 00     01:22:46.886  READ DMA EXT
  25 00 00 00 01 00 00 0f 78 db 19 e0 00     01:22:46.886  READ DMA EXT

Error 15833 [16] occurred at disk power-on lifetime: 11869 hours (494 days + 13 hours)
  When the command that caused the error occurred, the device was active or idle.

  After command completion occurred, registers were:
  ER -- ST COUNT  LBA_48  LH LM LL DV DC
  -- -- -- == -- == == == -- -- -- -- --
  40 -- 51 00 7f 00 0f da 00 78 ea e0 00  Error: UNC 127 sectors at LBA = 0xfda0078ea = 68081973482

  Commands leading to the command that caused the error were:
  CR FEATR COUNT  LBA_48  LH LM LL DV DC  Powered_Up_Time  Command/Feature_Name
  -- == -- == -- == == == -- -- -- -- --  ---------------  --------------------
  25 00 00 00 7f 00 00 0f 78 da ea e0 00     01:22:44.209  READ DMA EXT
  25 00 00 00 7f 00 00 0f 78 da 6b e0 00     01:22:44.208  READ DMA EXT
  25 00 00 00 7f 00 00 0f 78 d9 ec e0 00     01:22:44.208  READ DMA EXT
  25 00 00 00 7f 00 00 0f 78 d9 6d e0 00     01:22:44.207  READ DMA EXT
  25 00 00 00 7f 00 00 0f 78 d8 ee e0 00     01:22:44.206  READ DMA EXT

Error 15832 [15] occurred at disk power-on lifetime: 11869 hours (494 days + 13 hours)
  When the command that caused the error occurred, the device was active or idle.

  After command completion occurred, registers were:
  ER -- ST COUNT  LBA_48  LH LM LL DV DC
  -- -- -- == -- == == == -- -- -- -- --
  40 -- 51 00 01 00 0f cf 00 74 2d e0 00  Error: UNC 1 sectors at LBA = 0xfcf00742d = 67897422893

  Commands leading to the command that caused the error were:
  CR FEATR COUNT  LBA_48  LH LM LL DV DC  Powered_Up_Time  Command/Feature_Name
  -- == -- == -- == == == -- -- -- -- --  ---------------  --------------------
  25 00 00 00 01 00 00 0f 74 cf 2d e0 00     01:22:33.817  READ DMA EXT
  35 00 00 00 01 00 00 0f 74 cf 2c e0 00     01:22:33.817  WRITE DMA EXT
  25 00 00 00 01 00 00 0f 74 cf 2c e0 00     01:22:33.817  READ DMA EXT
  25 00 00 00 01 00 00 0f 74 cf 2d e0 00     01:22:31.450  READ DMA EXT
  25 00 00 00 01 00 00 0f 74 cf 2c e0 00     01:22:31.450  READ DMA EXT

SMART Extended Self-test Log Version: 1 (1 sectors)
Num  Test_Description    Status                  Remaining  LifeTime(hours)  LBA_of_first_error
# 1  Extended offline    Completed: read failure       90%     11872         258781873
# 2  Short offline       Completed without error       00%     11872         -

SMART Selective self-test log data structure revision number 1
 SPAN  MIN_LBA  MAX_LBA  CURRENT_TEST_STATUS
    1        0        0  Not_testing
    2        0        0  Not_testing
    3        0        0  Not_testing
    4        0        0  Not_testing
    5        0        0  Not_testing
Selective self-test flags (0x0):
  After scanning selected spans, do NOT read-scan remainder of disk.
If Selective self-test is pending on power-up, resume after 0 minute delay.

SCT Status Version:                  2
SCT Version (vendor specific):       258 (0x0102)
Device State:                        SMART Off-line Data Collection executing in background (4)
Current Temperature:                    33 Celsius
Power Cycle Min/Max Temperature:     26/33 Celsius
Lifetime    Min/Max Temperature:     26/44 Celsius
Under/Over Temperature Limit Count:   0/0

SCT Temperature History Version:     2
Temperature Sampling Period:         1 minute
Temperature Logging Interval:        1 minute
Min/Max recommended Temperature:      0/60 Celsius
Min/Max Temperature Limit:           -41/85 Celsius
Temperature History Size (Index):    128 (45)

SCT Error Recovery Control:
           Read: Disabled
          Write: Disabled

Device Statistics (GP/SMART Log 0x04) not supported

Pending Defects log (GP Log 0x0c) not supported

SATA Phy Event Counters (GP Log 0x11)
ID      Size     Value  Description
0x0001  2            0  Command failed due to ICRC error
0x0002  2            0  R_ERR response for data FIS
0x0003  2            0  R_ERR response for device-to-host data FIS
0x0004  2            0  R_ERR response for host-to-device data FIS
0x0005  2            0  R_ERR response for non-data FIS
0x0006  2            0  R_ERR response for device-to-host non-data FIS
0x0007  2            0  R_ERR response for host-to-device non-data FIS
0x000a  2            1  Device-to-host register FISes sent due to a COMRESET
0x8000  4          795  Vendor specific

