smartctl 7.2 2020-12-30 r5155 [x86_64-linux-5.15.0-60-generic] (local build)
Copyright (C) 2002-20, Bruce Allen, Christian Franke, www.smartmontools.org

=== START OF INFORMATION SECTION ===
Model Family:     Western Digital Red (SMR)
Device Model:     WDC WD40EFAX-68JH4N1
Serial Number:    --
LU WWN Device Id: 5 0014ee ...
Firmware Version: 83.00A83
User Capacity:    4,000,787,030,016 bytes [4.00 TB]
Sector Sizes:     512 bytes logical, 4096 bytes physical
Rotation Rate:    5400 rpm
Form Factor:      3.5 inches
TRIM Command:     Available, deterministic, zeroed
Device is:        In smartctl database [for details use: -P show]
ATA Version is:   ACS-3 T13/2161-D revision 5
SATA Version is:  SATA 3.1, 6.0 Gb/s (current: 6.0 Gb/s)
Local Time is:    Fri Dec 29 15:40:35 2023 CET
SMART support is: Available - device has SMART capability.
SMART support is: Enabled
AAM feature is:   Unavailable
APM feature is:   Unavailable
Rd look-ahead is: Enabled
Write cache is:   Enabled
DSN feature is:   Unavailable
ATA Security is:  Disabled, frozen [SEC2]
Wt Cache Reorder: Enabled

=== START OF READ SMART DATA SECTION ===
SMART overall-health self-assessment test result: PASSED

General SMART Values:
Offline data collection status:  (0x00)	Offline data collection activity
					was never started.
					Auto Offline Data Collection: Disabled.
Self-test execution status:      (   0)	The previous self-test routine completed
					without error or no self-test has ever 
					been run.
Total time to complete Offline 
data collection: 		( 9960) seconds.
Offline data collection
capabilities: 			 (0x7b) SMART execute Offline immediate.
					Auto Offline data collection on/off support.
					Suspend Offline collection upon new
					command.
					Offline surface scan supported.
					Self-test supported.
					Conveyance Self-test supported.
					Selective Self-test supported.
SMART capabilities:            (0x0003)	Saves SMART data before entering
					power-saving mode.
					Supports SMART auto save timer.
Error logging capability:        (0x01)	Error logging supported.
					General Purpose Logging supported.
Short self-test routine 
recommended polling time: 	 (   2) minutes.
Extended self-test routine
recommended polling time: 	 ( 286) minutes.
Conveyance self-test routine
recommended polling time: 	 (   2) minutes.
SCT capabilities: 	       (0x3039)	SCT Status supported.
					SCT Error Recovery Control supported.
					SCT Feature Control supported.
					SCT Data Table supported.

SMART Attributes Data Structure revision number: 16
Vendor Specific SMART Attributes with Thresholds:
ID# ATTRIBUTE_NAME          FLAGS    VALUE WORST THRESH FAIL RAW_VALUE
  1 Raw_Read_Error_Rate     POSR-K   200   200   051    -    0
  3 Spin_Up_Time            POS--K   203   199   021    -    2816
  4 Start_Stop_Count        -O--CK   100   100   000    -    913
  5 Reallocated_Sector_Ct   PO--CK   200   200   140    -    0
  7 Seek_Error_Rate         -OSR-K   200   200   000    -    0
  9 Power_On_Hours          -O--CK   095   095   000    -    3959
 10 Spin_Retry_Count        -O--CK   100   100   000    -    0
 11 Calibration_Retry_Count -O--CK   100   100   000    -    0
 12 Power_Cycle_Count       -O--CK   100   100   000    -    889
192 Power-Off_Retract_Count -O--CK   200   200   000    -    40
193 Load_Cycle_Count        -O--CK   199   199   000    -    4255
194 Temperature_Celsius     -O---K   122   101   000    -    25
196 Reallocated_Event_Count -O--CK   200   200   000    -    0
197 Current_Pending_Sector  -O--CK   200   200   000    -    0
198 Offline_Uncorrectable   ----CK   100   253   000    -    0
199 UDMA_CRC_Error_Count    -O--CK   200   200   000    -    0
200 Multi_Zone_Error_Rate   ---R--   100   253   000    -    0
                            ||||||_ K auto-keep
                            |||||__ C event count
                            ||||___ R error rate
                            |||____ S speed/performance
                            ||_____ O updated online
                            |______ P prefailure warning

General Purpose Log Directory Version 1
SMART           Log Directory Version 1 [multi-sector log support]
Address    Access  R/W   Size  Description
0x00       GPL,SL  R/O      1  Log Directory
0x01           SL  R/O      1  Summary SMART error log
0x02           SL  R/O      5  Comprehensive SMART error log
0x03       GPL     R/O      6  Ext. Comprehensive SMART error log
0x04       GPL     R/O    256  Device Statistics log
0x04       SL      R/O      8  Device Statistics log
0x06           SL  R/O      1  SMART self-test log
0x07       GPL     R/O      1  Extended self-test log
0x09           SL  R/W      1  Selective self-test log
0x0c       GPL     R/O   2048  Pending Defects log
0x10       GPL     R/O      1  NCQ Command Error log
0x11       GPL     R/O      1  SATA Phy Event Counters log
0x24       GPL     R/O    294  Current Device Internal Status Data log
0x30       GPL,SL  R/O      9  IDENTIFY DEVICE data log
0x80-0x9f  GPL,SL  R/W     16  Host vendor specific log
0xa0-0xa7  GPL,SL  VS      16  Device vendor specific log
0xa8-0xb6  GPL,SL  VS       1  Device vendor specific log
0xb7       GPL,SL  VS      78  Device vendor specific log
0xb9       GPL,SL  VS       4  Device vendor specific log
0xbd       GPL,SL  VS       1  Device vendor specific log
0xc0       GPL,SL  VS       1  Device vendor specific log
0xc1       GPL     VS      93  Device vendor specific log
0xe0       GPL,SL  R/W      1  SCT Command/Status
0xe1       GPL,SL  R/W      1  SCT Data Transfer

SMART Extended Comprehensive Error Log Version: 1 (6 sectors)
Device Error Count: 13
	CR     = Command Register
	FEATR  = Features Register
	COUNT  = Count (was: Sector Count) Register
	LBA_48 = Upper bytes of LBA High/Mid/Low Registers ]  ATA-8
	LH     = LBA High (was: Cylinder High) Register    ]   LBA
	LM     = LBA Mid (was: Cylinder Low) Register      ] Register
	LL     = LBA Low (was: Sector Number) Register     ]
	DV     = Device (was: Device/Head) Register
	DC     = Device Control Register
	ER     = Error register
	ST     = Status register
Powered_Up_Time is measured from power on, and printed as
DDd+hh:mm:SS.sss where DD=days, hh=hours, mm=minutes,
SS=sec, and sss=millisec. It "wraps" after 49.710 days.

Error 13 [12] occurred at disk power-on lifetime: 2416 hours (100 days + 16 hours)
  When the command that caused the error occurred, the device was active or idle.

  After command completion occurred, registers were:
  ER -- ST COUNT  LBA_48  LH LM LL DV DC
  -- -- -- == -- == == == -- -- -- -- --
  10 -- 51 00 00 00 00 48 08 0b 30 40 00  Error: IDNF at LBA = 0x48080b30 = 1208486704

  Commands leading to the command that caused the error were:
  CR FEATR COUNT  LBA_48  LH LM LL DV DC  Powered_Up_Time  Command/Feature_Name
  -- == -- == -- == == == -- -- -- -- --  ---------------  --------------------
  61 00 10 00 60 00 00 48 08 0e 60 40 08     06:03:54.871  WRITE FPDMA QUEUED
  61 00 10 00 48 00 00 48 08 0e 40 40 08     06:03:54.871  WRITE FPDMA QUEUED
  61 00 08 00 40 00 00 48 08 0e 10 40 08     06:03:54.871  WRITE FPDMA QUEUED
  61 00 10 00 38 00 00 48 08 0d e8 40 08     06:03:54.871  WRITE FPDMA QUEUED
  61 00 08 00 30 00 00 48 08 0d c8 40 08     06:03:54.871  WRITE FPDMA QUEUED

Error 12 [11] occurred at disk power-on lifetime: 2416 hours (100 days + 16 hours)
  When the command that caused the error occurred, the device was active or idle.

  After command completion occurred, registers were:
  ER -- ST COUNT  LBA_48  LH LM LL DV DC
  -- -- -- == -- == == == -- -- -- -- --
  10 -- 51 00 00 00 00 48 05 65 b0 40 00  Error: IDNF at LBA = 0x480565b0 = 1208313264

  Commands leading to the command that caused the error were:
  CR FEATR COUNT  LBA_48  LH LM LL DV DC  Powered_Up_Time  Command/Feature_Name
  -- == -- == -- == == == -- -- -- -- --  ---------------  --------------------
  61 00 08 00 98 00 00 48 05 65 b0 40 08     06:03:42.154  WRITE FPDMA QUEUED
  61 00 18 00 90 00 00 48 05 65 90 40 08     06:03:42.154  WRITE FPDMA QUEUED
  61 00 10 00 88 00 00 48 05 65 78 40 08     06:03:42.154  WRITE FPDMA QUEUED
  61 00 08 00 80 00 00 48 05 65 58 40 08     06:03:42.154  WRITE FPDMA QUEUED
  61 00 10 00 78 00 00 48 05 65 40 40 08     06:03:42.154  WRITE FPDMA QUEUED

Error 11 [10] occurred at disk power-on lifetime: 2416 hours (100 days + 16 hours)
  When the command that caused the error occurred, the device was active or idle.

  After command completion occurred, registers were:
  ER -- ST COUNT  LBA_48  LH LM LL DV DC
  -- -- -- == -- == == == -- -- -- -- --
  10 -- 51 00 00 00 00 47 ea 57 40 40 00  Error: IDNF at LBA = 0x47ea5740 = 1206540096

  Commands leading to the command that caused the error were:
  CR FEATR COUNT  LBA_48  LH LM LL DV DC  Powered_Up_Time  Command/Feature_Name
  -- == -- == -- == == == -- -- -- -- --  ---------------  --------------------
  61 00 08 00 68 00 00 47 c6 12 a0 40 08     06:03:17.688  WRITE FPDMA QUEUED
  61 00 08 00 60 00 00 47 c6 11 68 40 08     06:03:17.688  WRITE FPDMA QUEUED
  61 00 08 00 58 00 00 47 c6 11 40 40 08     06:03:17.688  WRITE FPDMA QUEUED
  61 00 08 00 50 00 00 47 ea 57 78 40 08     06:03:17.688  WRITE FPDMA QUEUED
  61 00 08 00 48 00 00 47 ea 57 68 40 08     06:03:17.688  WRITE FPDMA QUEUED

Error 10 [9] occurred at disk power-on lifetime: 2416 hours (100 days + 16 hours)
  When the command that caused the error occurred, the device was active or idle.

  After command completion occurred, registers were:
  ER -- ST COUNT  LBA_48  LH LM LL DV DC
  -- -- -- == -- == == == -- -- -- -- --
  10 -- 51 00 00 00 00 47 d8 b3 10 40 00  Error: IDNF at LBA = 0x47d8b310 = 1205383952

  Commands leading to the command that caused the error were:
  CR FEATR COUNT  LBA_48  LH LM LL DV DC  Powered_Up_Time  Command/Feature_Name
  -- == -- == -- == == == -- -- -- -- --  ---------------  --------------------
  60 00 08 00 78 00 00 36 81 84 a0 40 08     06:03:00.551  READ FPDMA QUEUED
  61 00 08 00 70 00 00 47 d8 b4 a0 40 08     06:03:00.506  WRITE FPDMA QUEUED
  61 00 10 00 68 00 00 47 d8 b4 20 40 08     06:03:00.506  WRITE FPDMA QUEUED
  61 00 08 00 60 00 00 47 d8 b3 e8 40 08     06:03:00.506  WRITE FPDMA QUEUED
  61 00 10 00 58 00 00 47 d8 b3 88 40 08     06:03:00.506  WRITE FPDMA QUEUED

Error 9 [8] occurred at disk power-on lifetime: 2416 hours (100 days + 16 hours)
  When the command that caused the error occurred, the device was active or idle.

  After command completion occurred, registers were:
  ER -- ST COUNT  LBA_48  LH LM LL DV DC
  -- -- -- == -- == == == -- -- -- -- --
  10 -- 51 00 00 00 00 47 f7 98 e0 40 00  Error: IDNF at LBA = 0x47f798e0 = 1207408864

  Commands leading to the command that caused the error were:
  CR FEATR COUNT  LBA_48  LH LM LL DV DC  Powered_Up_Time  Command/Feature_Name
  -- == -- == -- == == == -- -- -- -- --  ---------------  --------------------
  61 00 18 00 30 00 00 47 f7 98 28 40 08     06:02:38.083  WRITE FPDMA QUEUED
  61 00 18 00 28 00 00 47 f7 98 58 40 08     06:02:38.083  WRITE FPDMA QUEUED
  61 00 18 00 20 00 00 47 f7 98 88 40 08     06:02:38.083  WRITE FPDMA QUEUED
  61 00 18 00 18 00 00 47 f7 98 b0 40 08     06:02:38.083  WRITE FPDMA QUEUED
  61 00 08 00 10 00 00 47 f7 98 d0 40 08     06:02:38.083  WRITE FPDMA QUEUED

Error 8 [7] occurred at disk power-on lifetime: 2416 hours (100 days + 16 hours)
  When the command that caused the error occurred, the device was active or idle.

  After command completion occurred, registers were:
  ER -- ST COUNT  LBA_48  LH LM LL DV DC
  -- -- -- == -- == == == -- -- -- -- --
  10 -- 51 00 00 00 00 47 f7 98 28 40 00  Error: IDNF at LBA = 0x47f79828 = 1207408680

  Commands leading to the command that caused the error were:
  CR FEATR COUNT  LBA_48  LH LM LL DV DC  Powered_Up_Time  Command/Feature_Name
  -- == -- == -- == == == -- -- -- -- --  ---------------  --------------------
  61 00 08 00 40 00 00 47 f7 99 20 40 08     06:02:28.172  WRITE FPDMA QUEUED
  61 00 10 00 38 00 00 47 f7 98 e0 40 08     06:02:28.172  WRITE FPDMA QUEUED
  61 00 08 00 30 00 00 47 f7 98 d0 40 08     06:02:28.172  WRITE FPDMA QUEUED
  61 00 18 00 28 00 00 47 f7 98 b0 40 08     06:02:28.172  WRITE FPDMA QUEUED
  61 00 18 00 20 00 00 47 f7 98 88 40 08     06:02:28.172  WRITE FPDMA QUEUED

Error 7 [6] occurred at disk power-on lifetime: 2416 hours (100 days + 16 hours)
  When the command that caused the error occurred, the device was active or idle.

  After command completion occurred, registers were:
  ER -- ST COUNT  LBA_48  LH LM LL DV DC
  -- -- -- == -- == == == -- -- -- -- --
  10 -- 51 00 00 00 00 47 d7 e5 88 40 00  Error: IDNF at LBA = 0x47d7e588 = 1205331336

  Commands leading to the command that caused the error were:
  CR FEATR COUNT  LBA_48  LH LM LL DV DC  Powered_Up_Time  Command/Feature_Name
  -- == -- == -- == == == -- -- -- -- --  ---------------  --------------------
  60 00 08 00 98 00 00 30 b0 34 08 40 08     06:02:03.173  READ FPDMA QUEUED
  61 00 18 00 90 00 00 47 d7 e5 d0 40 08     06:02:02.750  WRITE FPDMA QUEUED
  61 00 08 00 88 00 00 47 d7 e5 c0 40 08     06:02:02.750  WRITE FPDMA QUEUED
  61 00 08 00 80 00 00 47 d7 e5 88 40 08     06:02:02.750  WRITE FPDMA QUEUED
  61 00 08 00 78 00 00 47 d7 e5 68 40 08     06:02:02.750  WRITE FPDMA QUEUED

Error 6 [5] occurred at disk power-on lifetime: 2416 hours (100 days + 16 hours)
  When the command that caused the error occurred, the device was active or idle.

  After command completion occurred, registers were:
  ER -- ST COUNT  LBA_48  LH LM LL DV DC
  -- -- -- == -- == == == -- -- -- -- --
  10 -- 51 00 00 00 00 47 db 0b 38 40 00  Error: IDNF at LBA = 0x47db0b38 = 1205537592

  Commands leading to the command that caused the error were:
  CR FEATR COUNT  LBA_48  LH LM LL DV DC  Powered_Up_Time  Command/Feature_Name
  -- == -- == -- == == == -- -- -- -- --  ---------------  --------------------
  61 00 08 00 58 00 00 47 db 0b a0 40 08     06:01:30.562  WRITE FPDMA QUEUED
  61 00 08 00 b0 00 00 47 db 0a e0 40 08     06:01:30.136  WRITE FPDMA QUEUED
  61 00 08 00 a8 00 00 47 db 0b 08 40 08     06:01:30.136  WRITE FPDMA QUEUED
  61 00 10 00 a0 00 00 47 db 0b 38 40 08     06:01:30.136  WRITE FPDMA QUEUED
  61 00 08 00 98 00 00 47 db 0b 80 40 08     06:01:30.136  WRITE FPDMA QUEUED

SMART Extended Self-test Log Version: 1 (1 sectors)
No self-tests have been logged.  [To run self-tests, use: smartctl -t]

SMART Selective self-test log data structure revision number 1
 SPAN  MIN_LBA  MAX_LBA  CURRENT_TEST_STATUS
    1        0        0  Not_testing
    2        0        0  Not_testing
    3        0        0  Not_testing
    4        0        0  Not_testing
    5        0        0  Not_testing
Selective self-test flags (0x0):
  After scanning selected spans, do NOT read-scan remainder of disk.
If Selective self-test is pending on power-up, resume after 0 minute delay.

SCT Status Version:                  3
SCT Version (vendor specific):       258 (0x0102)
Device State:                        Active (0)
Current Temperature:                    25 Celsius
Power Cycle Min/Max Temperature:     14/25 Celsius
Lifetime    Min/Max Temperature:     13/46 Celsius
Under/Over Temperature Limit Count:   0/0
Vendor specific:
01 00 00 00 00 00 00 00 00 00 00 00 00 00 00 00
00 00 00 00 00 00 00 00 00 00 00 00 00 00 00 00

SCT Temperature History Version:     2
Temperature Sampling Period:         1 minute
Temperature Logging Interval:        1 minute
Min/Max recommended Temperature:      0/65 Celsius
Min/Max Temperature Limit:           -41/85 Celsius
Temperature History Size (Index):    478 (40)

SCT Error Recovery Control:
           Read:     70 (7.0 seconds)
          Write:     70 (7.0 seconds)

Device Statistics (GP Log 0x04)
Page  Offset Size        Value Flags Description
0x01  =====  =               =  ===  == General Statistics (rev 1) ==
0x01  0x008  4             889  ---  Lifetime Power-On Resets
0x01  0x010  4            3959  ---  Power-on Hours
0x01  0x018  6      9149533008  ---  Logical Sectors Written
0x01  0x020  6        15883474  ---  Number of Write Commands
0x01  0x028  6     24801169825  ---  Logical Sectors Read
0x01  0x030  6       122007476  ---  Number of Read Commands
0x01  0x038  6      1367498112  ---  Date and Time TimeStamp
0x03  =====  =               =  ===  == Rotating Media Statistics (rev 1) ==
0x03  0x008  4            3940  ---  Spindle Motor Power-on Hours
0x03  0x010  4            2446  ---  Head Flying Hours
0x03  0x018  4            4296  ---  Head Load Events
0x03  0x020  4               0  ---  Number of Reallocated Logical Sectors
0x03  0x028  4               0  ---  Read Recovery Attempts
0x03  0x030  4               0  ---  Number of Mechanical Start Failures
0x03  0x038  4               0  ---  Number of Realloc. Candidate Logical Sectors
0x03  0x040  4              40  ---  Number of High Priority Unload Events
0x04  =====  =               =  ===  == General Errors Statistics (rev 1) ==
0x04  0x008  4              13  ---  Number of Reported Uncorrectable Errors
0x04  0x010  4               0  ---  Resets Between Cmd Acceptance and Completion
0x05  =====  =               =  ===  == Temperature Statistics (rev 1) ==
0x05  0x008  1              25  ---  Current Temperature
0x05  0x010  1              24  ---  Average Short Term Temperature
0x05  0x018  1              33  ---  Average Long Term Temperature
0x05  0x020  1              46  ---  Highest Temperature
0x05  0x028  1              17  ---  Lowest Temperature
0x05  0x030  1              43  ---  Highest Average Short Term Temperature
0x05  0x038  1              21  ---  Lowest Average Short Term Temperature
0x05  0x040  1              38  ---  Highest Average Long Term Temperature
0x05  0x048  1              24  ---  Lowest Average Long Term Temperature
0x05  0x050  4               0  ---  Time in Over-Temperature
0x05  0x058  1              65  ---  Specified Maximum Operating Temperature
0x05  0x060  4               0  ---  Time in Under-Temperature
0x05  0x068  1               0  ---  Specified Minimum Operating Temperature
0x06  =====  =               =  ===  == Transport Statistics (rev 1) ==
0x06  0x008  4            3185  ---  Number of Hardware Resets
0x06  0x010  4            1758  ---  Number of ASR Events
0x06  0x018  4               0  ---  Number of Interface CRC Errors
0xff  =====  =               =  ===  == Vendor Specific Statistics (rev 1) ==
0xff  0x008  7               0  ---  Vendor Specific
0xff  0x010  7               0  ---  Vendor Specific
0xff  0x018  7               0  ---  Vendor Specific
                                |||_ C monitored condition met
                                ||__ D supports DSN
                                |___ N normalized value

Pending Defects log (GP Log 0x0c)
No Defects Logged

SATA Phy Event Counters (GP Log 0x11)
ID      Size     Value  Description
0x0001  2            0  Command failed due to ICRC error
0x0002  2            0  R_ERR response for data FIS
0x0003  2            0  R_ERR response for device-to-host data FIS
0x0004  2            0  R_ERR response for host-to-device data FIS
0x0005  2            0  R_ERR response for non-data FIS
0x0006  2            0  R_ERR response for device-to-host non-data FIS
0x0007  2            0  R_ERR response for host-to-device non-data FIS
0x0008  2            0  Device-to-host non-data FIS retries
0x0009  2            5  Transition from drive PhyRdy to drive PhyNRdy
0x000a  2            7  Device-to-host register FISes sent due to a COMRESET
0x000b  2            0  CRC errors within host-to-device FIS
0x000d  2            0  Non-CRC errors within host-to-device FIS
0x000f  2            0  R_ERR response for host-to-device data FIS, CRC
0x0012  2            0  R_ERR response for host-to-device non-data FIS, CRC
0x8000  4         3429  Vendor specific

