=== START OF INFORMATION SECTION ===
Model Family:     Seagate Barracuda 7200.10
Device Model:     ST3250410AS
Serial Number:    --
Firmware Version: 3.AAA
User Capacity:    250 059 350 016 bytes [250 GB]
Sector Size:      512 bytes logical/physical
Device is:        In smartctl database [for details use: -P show]
ATA Version is:   ATA/ATAPI-7 (minor revision not indicated)
Local Time is:    Fri Nov 27 21:23:17 2015 KRAT
SMART support is: Available - device has SMART capability.
SMART support is: Enabled
AAM feature is:   Unavailable
APM feature is:   Unavailable
Rd look-ahead is: Enabled
Write cache is:   Enabled
ATA Security is:  Disabled, frozen [SEC2]
Wt Cache Reorder: Unavailable

=== START OF READ SMART DATA SECTION ===
SMART overall-health self-assessment test result: PASSED

General SMART Values:
Offline data collection status:  (0x82)	Offline data collection activity
					was completed without error.
					Auto Offline Data Collection: Enabled.
Self-test execution status:      ( 118)	The previous self-test completed having
					the read element of the test failed.
Total time to complete Offline 
data collection: 		(  430) seconds.
Offline data collection
capabilities: 			 (0x5b) SMART execute Offline immediate.
					Auto Offline data collection on/off support.
					Suspend Offline collection upon new
					command.
					Offline surface scan supported.
					Self-test supported.
					No Conveyance Self-test supported.
					Selective Self-test supported.
SMART capabilities:            (0x0003)	Saves SMART data before entering
					power-saving mode.
					Supports SMART auto save timer.
Error logging capability:        (0x01)	Error logging supported.
					General Purpose Logging supported.
Short self-test routine 
recommended polling time: 	 (   1) minutes.
Extended self-test routine
recommended polling time: 	 (  92) minutes.

SMART Attributes Data Structure revision number: 10
Vendor Specific SMART Attributes with Thresholds:
ID# ATTRIBUTE_NAME          FLAGS    VALUE WORST THRESH FAIL RAW_VALUE
  1 Raw_Read_Error_Rate     POSR--   108   082   006    -    16254959
  3 Spin_Up_Time            PO----   097   097   000    -    0
  4 Start_Stop_Count        -O--CK   090   090   020    -    10470
  5 Reallocated_Sector_Ct   PO--CK   050   050   036    -    2027
  7 Seek_Error_Rate         POSR--   087   060   030    -    607371167
  9 Power_On_Hours          -O--CK   079   079   000    -    18653
 10 Spin_Retry_Count        PO--C-   100   100   097    -    0
 12 Power_Cycle_Count       -O--CK   090   090   020    -    10305
187 Reported_Uncorrect      -O--CK   001   001   000    -    23607
189 High_Fly_Writes         -O-RCK   100   100   000    -    0
190 Airflow_Temperature_Cel -O---K   058   046   045    -    42 (Min/Max 30/42)
194 Temperature_Celsius     -O---K   042   054   000    -    42 (0 9 0 0 0)
195 Hardware_ECC_Recovered  -O-RC-   056   047   000    -    220810371
197 Current_Pending_Sector  -O--C-   001   001   000    -    15979
198 Offline_Uncorrectable   ----C-   001   001   000    -    15979
199 UDMA_CRC_Error_Count    -OSRCK   200   051   000    -    1180
200 Multi_Zone_Error_Rate   ------   100   253   000    -    0
202 Data_Address_Mark_Errs  -O--CK   078   231   000    -    22
                            ||||||_ K auto-keep
                            |||||__ C event count
                            ||||___ R error rate
                            |||____ S speed/performance
                            ||_____ O updated online
                            |______ P prefailure warning

General Purpose Log Directory Version 1
SMART           Log Directory Version 1 [multi-sector log support]
Address    Access  R/W   Size  Description
0x00       GPL,SL  R/O      1  Log Directory
0x01       GPL,SL  R/O      1  Summary SMART error log
0x02       GPL,SL  R/O      5  Comprehensive SMART error log
0x03       GPL,SL  R/O      5  Ext. Comprehensive SMART error log
0x06       GPL,SL  R/O      1  SMART self-test log
0x07       GPL,SL  R/O      1  Extended self-test log
0x09       GPL,SL  R/W      1  Selective self-test log
0x10       GPL,SL  R/O      1  NCQ Command Error log
0x11       GPL,SL  R/O      1  SATA Phy Event Counters
0x20       GPL,SL  R/O      1  Streaming performance log [OBS-8]
0x21       GPL,SL  R/O      1  Write stream error log
0x22       GPL,SL  R/O      1  Read stream error log
0x23       GPL,SL  R/O      1  Delayed sector log [OBS-8]
0x80-0x9f  GPL,SL  R/W     16  Host vendor specific log
0xa0       GPL,SL  VS       1  Device vendor specific log
0xa1       GPL,SL  VS      20  Device vendor specific log
0xa2       GPL,SL  VS     101  Device vendor specific log
0xa8       GPL,SL  VS      20  Device vendor specific log
0xa9       GPL,SL  VS       1  Device vendor specific log
0xe0       GPL,SL  R/W      1  SCT Command/Status
0xe1       GPL,SL  R/W      1  SCT Data Transfer
0xff       GPL     -    23040  Reserved

SMART Extended Comprehensive Error Log Version: 1 (5 sectors)
Device Error Count: 29579 (device log contains only the most recent 20 errors)
	CR     = Command Register
	FEATR  = Features Register
	COUNT  = Count (was: Sector Count) Register
	LBA_48 = Upper bytes of LBA High/Mid/Low Registers ]  ATA-8
	LH     = LBA High (was: Cylinder High) Register    ]   LBA
	LM     = LBA Mid (was: Cylinder Low) Register      ] Register
	LL     = LBA Low (was: Sector Number) Register     ]
	DV     = Device (was: Device/Head) Register
	DC     = Device Control Register
	ER     = Error register
	ST     = Status register
Powered_Up_Time is measured from power on, and printed as
DDd+hh:mm:SS.sss where DD=days, hh=hours, mm=minutes,
SS=sec, and sss=millisec. It "wraps" after 49.710 days.

Error 29579 [18] occurred at disk power-on lifetime: 17847 hours (743 days + 15 hours)
  When the command that caused the error occurred, the device was active or idle.

  After command completion occurred, registers were:
  ER -- ST COUNT  LBA_48  LH LM LL DV DC
  -- -- -- == -- == == == -- -- -- -- --
  40 -- 51 00 00 00 06 1d 8d 9d 8d 40 00  Error: UNC at LBA = 0x61d8d9d8d = 26265623949

  Commands leading to the command that caused the error were:
  CR FEATR COUNT  LBA_48  LH LM LL DV DC  Powered_Up_Time  Command/Feature_Name
  -- == -- == -- == == == -- -- -- -- --  ---------------  --------------------
  25 00 00 00 08 00 06 1d 00 9d 88 40 00     01:45:31.403  READ DMA EXT
  35 00 00 01 00 00 03 f8 00 df 28 40 00     01:45:31.402  WRITE DMA EXT
  35 00 00 01 00 00 03 f7 00 df 28 40 00     01:45:35.316  WRITE DMA EXT
  35 00 00 01 00 00 03 f6 00 df 28 40 00     01:45:35.315  WRITE DMA EXT
  35 00 00 01 00 00 03 f5 00 df 28 40 00     01:45:35.314  WRITE DMA EXT

Error 29578 [17] occurred at disk power-on lifetime: 17847 hours (743 days + 15 hours)
  When the command that caused the error occurred, the device was active or idle.

  After command completion occurred, registers were:
  ER -- ST COUNT  LBA_48  LH LM LL DV DC
  -- -- -- == -- == == == -- -- -- -- --
  40 -- 51 00 00 00 06 1d 8d 9d 8d 40 00  Error: UNC at LBA = 0x61d8d9d8d = 26265623949

  Commands leading to the command that caused the error were:
  CR FEATR COUNT  LBA_48  LH LM LL DV DC  Powered_Up_Time  Command/Feature_Name
  -- == -- == -- == == == -- -- -- -- --  ---------------  --------------------
  25 00 00 00 08 00 06 1d 00 9d 88 40 00     01:45:31.403  READ DMA EXT
  35 00 00 01 00 00 03 f0 00 df 28 40 00     01:45:31.402  WRITE DMA EXT
  35 00 00 01 00 00 03 ef 00 df 28 40 00     01:45:31.402  WRITE DMA EXT
  35 00 00 01 00 00 03 ee 00 df 28 40 00     01:45:31.401  WRITE DMA EXT
  35 00 00 01 00 00 03 ed 00 df 28 40 00     01:45:31.400  WRITE DMA EXT

Error 29577 [16] occurred at disk power-on lifetime: 17847 hours (743 days + 15 hours)
  When the command that caused the error occurred, the device was active or idle.

  After command completion occurred, registers were:
  ER -- ST COUNT  LBA_48  LH LM LL DV DC
  -- -- -- == -- == == == -- -- -- -- --
  40 -- 51 00 00 00 06 1d 8d 9d 8d 40 00  Error: UNC at LBA = 0x61d8d9d8d = 26265623949

  Commands leading to the command that caused the error were:
  CR FEATR COUNT  LBA_48  LH LM LL DV DC  Powered_Up_Time  Command/Feature_Name
  -- == -- == -- == == == -- -- -- -- --  ---------------  --------------------
  25 00 00 00 08 00 06 1d 00 9d 88 40 00     01:45:27.547  READ DMA EXT
  25 00 00 00 40 00 06 1e 00 9d f8 40 00     01:45:27.547  READ DMA EXT
  25 00 00 00 80 00 06 1e 00 9d 78 40 00     01:45:27.547  READ DMA EXT
  25 00 00 00 08 00 06 1e 00 9d 70 40 00     01:45:27.546  READ DMA EXT
  25 00 00 00 08 00 06 1e 00 9d 68 40 00     01:45:27.546  READ DMA EXT

Error 29576 [15] occurred at disk power-on lifetime: 17847 hours (743 days + 15 hours)
  When the command that caused the error occurred, the device was active or idle.

  After command completion occurred, registers were:
  ER -- ST COUNT  LBA_48  LH LM LL DV DC
  -- -- -- == -- == == == -- -- -- -- --
  40 -- 51 00 00 00 06 1d 8d 9d 8d 40 00  Error: UNC at LBA = 0x61d8d9d8d = 26265623949

  Commands leading to the command that caused the error were:
  CR FEATR COUNT  LBA_48  LH LM LL DV DC  Powered_Up_Time  Command/Feature_Name
  -- == -- == -- == == == -- -- -- -- --  ---------------  --------------------
  25 00 00 00 08 00 06 1d 00 9d 88 40 00     01:45:23.548  READ DMA EXT
  35 00 00 00 ec 00 03 e5 00 3a 38 40 00     01:45:23.536  WRITE DMA EXT
  35 00 00 01 00 00 03 e4 00 3a 38 40 00     01:45:23.535  WRITE DMA EXT
  35 00 00 01 00 00 03 e3 00 3a 38 40 00     01:45:23.534  WRITE DMA EXT
  35 00 00 01 00 00 03 e2 00 3a 38 40 00     01:45:23.509  WRITE DMA EXT

Error 29575 [14] occurred at disk power-on lifetime: 17847 hours (743 days + 15 hours)
  When the command that caused the error occurred, the device was active or idle.

  After command completion occurred, registers were:
  ER -- ST COUNT  LBA_48  LH LM LL DV DC
  -- -- -- == -- == == == -- -- -- -- --
  40 -- 51 00 00 00 06 1d 8d 9d 8d 40 00  Error: UNC at LBA = 0x61d8d9d8d = 26265623949

  Commands leading to the command that caused the error were:
  CR FEATR COUNT  LBA_48  LH LM LL DV DC  Powered_Up_Time  Command/Feature_Name
  -- == -- == -- == == == -- -- -- -- --  ---------------  --------------------
  25 00 00 01 00 00 06 1d 00 9d 88 40 00     01:45:19.544  READ DMA EXT
  25 00 00 00 50 00 06 14 00 9d 90 40 00     01:45:19.511  READ DMA EXT
  25 00 00 01 00 00 06 13 00 9d 90 40 00     01:45:19.510  READ DMA EXT
  25 00 00 01 00 00 06 12 00 9d 90 40 00     01:45:19.509  READ DMA EXT
  25 00 00 01 00 00 06 11 00 9d 90 40 00     01:45:19.508  READ DMA EXT

Error 29574 [13] occurred at disk power-on lifetime: 17847 hours (743 days + 15 hours)
  When the command that caused the error occurred, the device was active or idle.

  After command completion occurred, registers were:
  ER -- ST COUNT  LBA_48  LH LM LL DV DC
  -- -- -- == -- == == == -- -- -- -- --
  40 -- 51 00 00 00 06 eb 04 9c 04 40 00  Error: UNC at LBA = 0x6eb049c04 = 29712751620

  Commands leading to the command that caused the error were:
  CR FEATR COUNT  LBA_48  LH LM LL DV DC  Powered_Up_Time  Command/Feature_Name
  -- == -- == -- == == == -- -- -- -- --  ---------------  --------------------
  25 00 00 00 08 00 06 eb 00 9c 00 40 00     01:45:13.674  READ DMA EXT
  35 00 00 01 00 00 03 9e 00 4f b8 40 00     01:45:13.673  WRITE DMA EXT
  35 00 00 01 00 00 03 9d 00 4f b8 40 00     01:45:13.672  WRITE DMA EXT
  35 00 00 01 00 00 03 9c 00 4f b8 40 00     01:45:13.671  WRITE DMA EXT
  35 00 00 01 00 00 03 9b 00 4f b8 40 00     01:45:13.670  WRITE DMA EXT

Error 29573 [12] occurred at disk power-on lifetime: 17847 hours (743 days + 15 hours)
  When the command that caused the error occurred, the device was active or idle.

  After command completion occurred, registers were:
  ER -- ST COUNT  LBA_48  LH LM LL DV DC
  -- -- -- == -- == == == -- -- -- -- --
  40 -- 51 00 00 00 06 eb 04 9c 04 40 00  Error: UNC at LBA = 0x6eb049c04 = 29712751620

  Commands leading to the command that caused the error were:
  CR FEATR COUNT  LBA_48  LH LM LL DV DC  Powered_Up_Time  Command/Feature_Name
  -- == -- == -- == == == -- -- -- -- --  ---------------  --------------------
  25 00 00 00 08 00 06 eb 00 9c 00 40 00     01:45:06.535  READ DMA EXT
  35 00 00 00 08 00 02 40 00 78 c8 40 00     01:45:06.535  WRITE DMA EXT
  ea 00 00 00 00 00 11 c4 00 fc b8 00 00     01:45:06.535  FLUSH CACHE EXT
  25 00 00 00 07 00 11 c4 00 fc b8 40 00     01:45:02.828  READ DMA EXT
  25 00 00 00 08 00 10 76 00 e8 5b 40 00     01:45:02.828  READ DMA EXT

Error 29572 [11] occurred at disk power-on lifetime: 17847 hours (743 days + 15 hours)
  When the command that caused the error occurred, the device was active or idle.

  After command completion occurred, registers were:
  ER -- ST COUNT  LBA_48  LH LM LL DV DC
  -- -- -- == -- == == == -- -- -- -- --
  40 -- 51 00 00 00 06 eb 04 9c 04 40 00  Error: UNC at LBA = 0x6eb049c04 = 29712751620

  Commands leading to the command that caused the error were:
  CR FEATR COUNT  LBA_48  LH LM LL DV DC  Powered_Up_Time  Command/Feature_Name
  -- == -- == -- == == == -- -- -- -- --  ---------------  --------------------
  25 00 00 00 08 00 06 eb 00 9c 00 40 00     01:45:06.535  READ DMA EXT
  ea 00 00 00 00 00 11 37 00 5c e0 00 00     01:45:06.535  FLUSH CACHE EXT
  35 00 00 00 08 00 11 37 00 5c e0 40 00     01:45:06.535  WRITE DMA EXT
  35 00 00 00 08 00 11 17 00 2a 60 40 00     01:45:02.828  WRITE DMA EXT
  25 00 00 00 08 00 06 eb 00 9c 00 40 00     01:45:02.828  READ DMA EXT

SMART Extended Self-test Log Version: 1 (1 sectors)
Num  Test_Description    Status                  Remaining  LifeTime(hours)  LBA_of_first_error
# 1  Short offline       Completed: read failure       60%     13418         171892457566
# 2  Short offline       Completed: read failure       90%     13367         244889883299
# 3  Short offline       Completed: read failure       90%     13273         244906856173
# 4  Short offline       Completed: read failure       90%     12973         244909224173
# 5  Short offline       Completed: read failure       70%     12950         201957311731
# 6  Short offline       Completed: read failure       80%     12949         206252279027
# 7  Short offline       Completed: read failure       70%     12949         201957311731
# 8  Short offline       Completed: read failure       70%     12949         201957311731
# 9  Short offline       Completed: read failure       90%     12946         257791588913
#10  Short offline       Completed: read failure       90%     12939         257791494765
#11  Short offline       Completed: read failure       80%     12937         227727115507

SMART Selective self-test log data structure revision number 1
 SPAN  MIN_LBA  MAX_LBA  CURRENT_TEST_STATUS
    1        0        0  Not_testing
    2        0        0  Not_testing
    3        0        0  Not_testing
    4        0        0  Not_testing
    5        0        0  Not_testing
Selective self-test flags (0x0):
  After scanning selected spans, do NOT read-scan remainder of disk.
If Selective self-test is pending on power-up, resume after 0 minute delay.

SCT Commands not supported

Device Statistics (GP Log 0x04) not supported

SATA Phy Event Counters (GP Log 0x11)
ID      Size     Value  Description
0x000a  2           24  Device-to-host register FISes sent due to a COMRESET
0x0001  2            0  Command failed due to ICRC error
0x0003  2            0  R_ERR response for device-to-host data FIS
0x0004  2            0  R_ERR response for host-to-device data FIS
0x0006  2            0  R_ERR response for device-to-host non-data FIS
0x0007  2            0  R_ERR response for host-to-device non-data FIS
0x0009  2           23  Transition from drive PhyRdy to drive PhyNRdy
0x8002  2            2  Vendor specific
0x8003  2           57  Vendor specific
0x8004  2            0  Vendor specific

