smartctl 7.3 2022-02-28 r5338 [x86_64-linux-5.15.34_1] (local build)
Copyright (C) 2002-22, Bruce Allen, Christian Franke, www.smartmontools.org

=== START OF INFORMATION SECTION ===
Model Family:     Seagate Barracuda 7200.12
Device Model:     ST3160318AS
Serial Number:    --
LU WWN Device Id: 5 000c50 ...
Firmware Version: CC44
User Capacity:    160,041,885,696 bytes [160 GB]
Sector Size:      512 bytes logical/physical
Rotation Rate:    7200 rpm
Device is:        In smartctl database 7.3/5319
ATA Version is:   ATA8-ACS T13/1699-D revision 4
SATA Version is:  SATA 2.6, 3.0 Gb/s
Local Time is:    Fri Apr 29 12:39:28 2022 CEST

==> WARNING: A firmware update for this drive may be available,
see the following Seagate web pages:
http://knowledge.seagate.com/articles/en_US/FAQ/207931en
http://knowledge.seagate.com/articles/en_US/FAQ/213891en

SMART support is: Available - device has SMART capability.
SMART support is: Enabled
AAM level is:     208 (intermediate), recommended: 208
APM feature is:   Unavailable
Rd look-ahead is: Enabled
Write cache is:   Enabled
DSN feature is:   Unavailable
ATA Security is:  Disabled, NOT FROZEN [SEC1]
Write SCT (Get) Feature Control Command failed: ATA return descriptor not supported by controller firmware
Wt Cache Reorder: Unknown (SCT Feature Control command failed)

=== START OF READ SMART DATA SECTION ===
SMART Status not supported: ATA return descriptor not supported by controller firmware
SMART overall-health self-assessment test result: PASSED
Warning: This result is based on an Attribute check.

General SMART Values:
Offline data collection status:  (0x82)	Offline data collection activity
					was completed without error.
					Auto Offline Data Collection: Enabled.
Self-test execution status:      (   0)	The previous self-test routine completed
					without error or no self-test has ever 
					been run.
Total time to complete Offline 
data collection: 		(  617) seconds.
Offline data collection
capabilities: 			 (0x7b) SMART execute Offline immediate.
					Auto Offline data collection on/off support.
					Suspend Offline collection upon new
					command.
					Offline surface scan supported.
					Self-test supported.
					Conveyance Self-test supported.
					Selective Self-test supported.
SMART capabilities:            (0x0003)	Saves SMART data before entering
					power-saving mode.
					Supports SMART auto save timer.
Error logging capability:        (0x01)	Error logging supported.
					General Purpose Logging supported.
Short self-test routine 
recommended polling time: 	 (   1) minutes.
Extended self-test routine
recommended polling time: 	 (  36) minutes.
Conveyance self-test routine
recommended polling time: 	 (   2) minutes.
SCT capabilities: 	       (0x103f)	SCT Status supported.
					SCT Error Recovery Control supported.
					SCT Feature Control supported.
					SCT Data Table supported.

SMART Attributes Data Structure revision number: 10
Vendor Specific SMART Attributes with Thresholds:
ID# ATTRIBUTE_NAME          FLAGS    VALUE WORST THRESH FAIL RAW_VALUE
  1 Raw_Read_Error_Rate     POSR--   113   086   006    -    114800506
  3 Spin_Up_Time            PO----   097   097   000    -    0
  4 Start_Stop_Count        -O--CK   100   100   020    -    154
  5 Reallocated_Sector_Ct   PO--CK   064   064   036    -    1475
  7 Seek_Error_Rate         POSR--   100   253   030    -    680279
  9 Power_On_Hours          -O--CK   100   100   000    -    677
 10 Spin_Retry_Count        PO--C-   100   100   097    -    0
 12 Power_Cycle_Count       -O--CK   100   100   020    -    154
183 Runtime_Bad_Block       ------   100   100   000    -    0
184 End-to-End_Error        -O--CK   100   100   099    -    0
187 Reported_Uncorrect      -O--CK   001   001   000    -    4176
188 Command_Timeout         -O--CK   100   098   000    -    9
189 High_Fly_Writes         -O-RCK   100   100   000    -    0
190 Airflow_Temperature_Cel -O---K   075   051   045    -    25 (Min/Max 19/26)
194 Temperature_Celsius     -O---K   025   049   000    -    25 (0 15 0 0 0)
195 Hardware_ECC_Recovered  -O-RC-   044   038   000    -    114800506
197 Current_Pending_Sector  -O--C-   066   066   000    -    1428
198 Offline_Uncorrectable   ----C-   066   066   000    -    1428
199 UDMA_CRC_Error_Count    -OSRCK   200   200   000    -    0
240 Head_Flying_Hours       ------   100   253   000    -    967 (222 154 0)
241 Total_LBAs_Written      ------   100   253   000    -    3935480396
242 Total_LBAs_Read         ------   100   253   000    -    447109012
                            ||||||_ K auto-keep
                            |||||__ C event count
                            ||||___ R error rate
                            |||____ S speed/performance
                            ||_____ O updated online
                            |______ P prefailure warning

General Purpose Log Directory Version 1
SMART           Log Directory Version 1 [multi-sector log support]
Address    Access  R/W   Size  Description
0x00       GPL,SL  R/O      1  Log Directory
0x01       GPL,SL  R/O      1  Summary SMART error log
0x02       GPL,SL  R/O      5  Comprehensive SMART error log
0x03       GPL,SL  R/O      5  Ext. Comprehensive SMART error log
0x06       GPL,SL  R/O      1  SMART self-test log
0x07       GPL,SL  R/O      1  Extended self-test log
0x09       GPL,SL  R/W      1  Selective self-test log
0x10       GPL,SL  R/O      1  NCQ Command Error log
0x11       GPL,SL  R/O      1  SATA Phy Event Counters log
0x21       GPL,SL  R/O      1  Write stream error log
0x22       GPL,SL  R/O      1  Read stream error log
0x80-0x9f  GPL,SL  R/W     16  Host vendor specific log
0xa1       GPL,SL  VS      20  Device vendor specific log
0xa2       GPL     VS    2248  Device vendor specific log
0xa8       GPL,SL  VS     129  Device vendor specific log
0xa9       GPL,SL  VS       1  Device vendor specific log
0xb0       GPL     VS    2928  Device vendor specific log
0xbd       GPL,SL  VS     252  Device vendor specific log
0xbe-0xbf  GPL     VS   65535  Device vendor specific log
0xc0       GPL,SL  VS       1  Device vendor specific log
0xe0       GPL,SL  R/W      1  SCT Command/Status
0xe1       GPL,SL  R/W      1  SCT Data Transfer

SMART Extended Comprehensive Error Log Version: 1 (5 sectors)
Device Error Count: 4175 (device log contains only the most recent 20 errors)
	CR     = Command Register
	FEATR  = Features Register
	COUNT  = Count (was: Sector Count) Register
	LBA_48 = Upper bytes of LBA High/Mid/Low Registers ]  ATA-8
	LH     = LBA High (was: Cylinder High) Register    ]   LBA
	LM     = LBA Mid (was: Cylinder Low) Register      ] Register
	LL     = LBA Low (was: Sector Number) Register     ]
	DV     = Device (was: Device/Head) Register
	DC     = Device Control Register
	ER     = Error register
	ST     = Status register
Powered_Up_Time is measured from power on, and printed as
DDd+hh:mm:SS.sss where DD=days, hh=hours, mm=minutes,
SS=sec, and sss=millisec. It "wraps" after 49.710 days.

Error 4175 [14] occurred at disk power-on lifetime: 671 hours (27 days + 23 hours)
  When the command that caused the error occurred, the device was active or idle.

  After command completion occurred, registers were:
  ER -- ST COUNT  LBA_48  LH LM LL DV DC
  -- -- -- == -- == == == -- -- -- -- --
  40 -- 51 00 00 00 07 01 00 c5 f9 00 00  Error: UNC at LBA = 0x70100c5f9 = 30081598969

  Commands leading to the command that caused the error were:
  CR FEATR COUNT  LBA_48  LH LM LL DV DC  Powered_Up_Time  Command/Feature_Name
  -- == -- == -- == == == -- -- -- -- --  ---------------  --------------------
  42 00 00 00 80 00 07 01 00 c5 80 40 00     02:00:07.430  READ VERIFY SECTOR(S) EXT
  35 00 00 00 80 00 07 01 00 c5 80 40 00     02:00:07.429  WRITE DMA EXT
  60 00 00 00 07 00 07 01 00 c5 f9 40 00     02:00:07.414  READ FPDMA QUEUED
  60 00 00 00 78 00 07 01 00 c5 80 40 00     02:00:07.390  READ FPDMA QUEUED
  2f 00 00 00 01 00 00 00 00 00 10 00 00     02:00:07.330  READ LOG EXT

Error 4174 [13] occurred at disk power-on lifetime: 671 hours (27 days + 23 hours)
  When the command that caused the error occurred, the device was active or idle.

  After command completion occurred, registers were:
  ER -- ST COUNT  LBA_48  LH LM LL DV DC
  -- -- -- == -- == == == -- -- -- -- --
  40 -- 51 00 00 00 07 01 00 c5 f8 00 00  Error: UNC at LBA = 0x70100c5f8 = 30081598968

  Commands leading to the command that caused the error were:
  CR FEATR COUNT  LBA_48  LH LM LL DV DC  Powered_Up_Time  Command/Feature_Name
  -- == -- == -- == == == -- -- -- -- --  ---------------  --------------------
  60 00 00 00 80 00 07 01 00 c5 80 40 00     02:00:03.723  READ FPDMA QUEUED
  61 00 00 00 80 00 07 01 00 c5 00 40 00     02:00:03.722  WRITE FPDMA QUEUED
  60 00 00 00 80 00 07 01 00 c5 00 40 00     02:00:03.721  READ FPDMA QUEUED
  61 00 00 00 80 00 07 00 00 c5 80 40 00     02:00:03.716  WRITE FPDMA QUEUED
  60 00 00 00 80 00 07 00 00 c5 80 40 00     02:00:03.710  READ FPDMA QUEUED

Error 4173 [12] occurred at disk power-on lifetime: 579 hours (24 days + 3 hours)
  When the command that caused the error occurred, the device was active or idle.

  After command completion occurred, registers were:
  ER -- ST COUNT  LBA_48  LH LM LL DV DC
  -- -- -- == -- == == == -- -- -- -- --
  40 -- 51 00 00 00 08 8b 00 81 7b 00 00  Error: UNC at LBA = 0x88b00817b = 36691804539

  Commands leading to the command that caused the error were:
  CR FEATR COUNT  LBA_48  LH LM LL DV DC  Powered_Up_Time  Command/Feature_Name
  -- == -- == -- == == == -- -- -- -- --  ---------------  --------------------
  42 00 00 10 00 00 08 85 00 81 81 40 00  3d+16:27:18.012  READ VERIFY SECTOR(S) EXT
  61 00 00 00 60 00 00 d2 00 08 00 40 00  3d+16:27:17.985  WRITE FPDMA QUEUED
  61 00 00 00 60 00 00 d1 00 08 a0 40 00  3d+16:27:17.985  WRITE FPDMA QUEUED
  61 00 00 00 80 00 00 27 00 06 00 40 00  3d+16:27:17.985  WRITE FPDMA QUEUED
  61 00 00 00 80 00 00 40 00 0a 80 40 00  3d+16:27:17.985  WRITE FPDMA QUEUED

Error 4172 [11] occurred at disk power-on lifetime: 579 hours (24 days + 3 hours)
  When the command that caused the error occurred, the device was active or idle.

  After command completion occurred, registers were:
  ER -- ST COUNT  LBA_48  LH LM LL DV DC
  -- -- -- == -- == == == -- -- -- -- --
  40 -- 51 00 00 00 08 85 00 81 80 00 00  Error: UNC at LBA = 0x885008180 = 36591141248

  Commands leading to the command that caused the error were:
  CR FEATR COUNT  LBA_48  LH LM LL DV DC  Powered_Up_Time  Command/Feature_Name
  -- == -- == -- == == == -- -- -- -- --  ---------------  --------------------
  42 00 00 10 00 00 08 7f 00 81 87 40 00  3d+16:27:15.220  READ VERIFY SECTOR(S) EXT
  b0 00 da 00 00 00 00 4f 00 c2 00 00 00  3d+16:27:07.486  SMART RETURN STATUS
  42 00 00 10 00 00 08 72 00 81 76 40 00  3d+16:27:04.745  READ VERIFY SECTOR(S) EXT
  42 00 00 10 00 00 08 6c 00 81 7b 40 00  3d+16:27:01.923  READ VERIFY SECTOR(S) EXT
  42 00 00 10 00 00 08 66 00 81 81 40 00  3d+16:26:59.117  READ VERIFY SECTOR(S) EXT

Error 4171 [10] occurred at disk power-on lifetime: 579 hours (24 days + 3 hours)
  When the command that caused the error occurred, the device was active or idle.

  After command completion occurred, registers were:
  ER -- ST COUNT  LBA_48  LH LM LL DV DC
  -- -- -- == -- == == == -- -- -- -- --
  40 -- 51 00 00 00 08 7f 00 81 86 00 00  Error: UNC at LBA = 0x87f008186 = 36490477958

  Commands leading to the command that caused the error were:
  CR FEATR COUNT  LBA_48  LH LM LL DV DC  Powered_Up_Time  Command/Feature_Name
  -- == -- == -- == == == -- -- -- -- --  ---------------  --------------------
  42 00 00 10 00 00 08 72 00 81 76 40 00  3d+16:27:04.745  READ VERIFY SECTOR(S) EXT
  42 00 00 10 00 00 08 6c 00 81 7b 40 00  3d+16:27:01.923  READ VERIFY SECTOR(S) EXT
  42 00 00 10 00 00 08 66 00 81 81 40 00  3d+16:26:59.117  READ VERIFY SECTOR(S) EXT
  42 00 00 10 00 00 08 60 00 81 86 40 00  3d+16:26:56.262  READ VERIFY SECTOR(S) EXT
  42 00 00 10 00 00 08 5a 00 81 8c 40 00  3d+16:26:53.422  READ VERIFY SECTOR(S) EXT

Error 4170 [9] occurred at disk power-on lifetime: 579 hours (24 days + 3 hours)
  When the command that caused the error occurred, the device was active or idle.

  After command completion occurred, registers were:
  ER -- ST COUNT  LBA_48  LH LM LL DV DC
  -- -- -- == -- == == == -- -- -- -- --
  40 -- 51 00 00 00 08 72 00 81 75 00 00  Error: UNC at LBA = 0x872008175 = 36272374133

  Commands leading to the command that caused the error were:
  CR FEATR COUNT  LBA_48  LH LM LL DV DC  Powered_Up_Time  Command/Feature_Name
  -- == -- == -- == == == -- -- -- -- --  ---------------  --------------------
  42 00 00 10 00 00 08 6c 00 81 7b 40 00  3d+16:27:01.923  READ VERIFY SECTOR(S) EXT
  42 00 00 10 00 00 08 66 00 81 81 40 00  3d+16:26:59.117  READ VERIFY SECTOR(S) EXT
  42 00 00 10 00 00 08 60 00 81 86 40 00  3d+16:26:56.262  READ VERIFY SECTOR(S) EXT
  42 00 00 10 00 00 08 5a 00 81 8c 40 00  3d+16:26:53.422  READ VERIFY SECTOR(S) EXT
  42 00 00 10 00 00 08 54 00 81 91 40 00  3d+16:26:50.600  READ VERIFY SECTOR(S) EXT

Error 4169 [8] occurred at disk power-on lifetime: 579 hours (24 days + 3 hours)
  When the command that caused the error occurred, the device was active or idle.

  After command completion occurred, registers were:
  ER -- ST COUNT  LBA_48  LH LM LL DV DC
  -- -- -- == -- == == == -- -- -- -- --
  40 -- 51 00 00 00 08 6c 00 81 7a 00 00  Error: UNC at LBA = 0x86c00817a = 36171710842

  Commands leading to the command that caused the error were:
  CR FEATR COUNT  LBA_48  LH LM LL DV DC  Powered_Up_Time  Command/Feature_Name
  -- == -- == -- == == == -- -- -- -- --  ---------------  --------------------
  42 00 00 10 00 00 08 66 00 81 81 40 00  3d+16:26:59.117  READ VERIFY SECTOR(S) EXT
  42 00 00 10 00 00 08 60 00 81 86 40 00  3d+16:26:56.262  READ VERIFY SECTOR(S) EXT
  42 00 00 10 00 00 08 5a 00 81 8c 40 00  3d+16:26:53.422  READ VERIFY SECTOR(S) EXT
  42 00 00 10 00 00 08 54 00 81 91 40 00  3d+16:26:50.600  READ VERIFY SECTOR(S) EXT
  42 00 00 10 00 00 08 47 00 81 80 40 00  3d+16:26:47.703  READ VERIFY SECTOR(S) EXT

Error 4168 [7] occurred at disk power-on lifetime: 579 hours (24 days + 3 hours)
  When the command that caused the error occurred, the device was active or idle.

  After command completion occurred, registers were:
  ER -- ST COUNT  LBA_48  LH LM LL DV DC
  -- -- -- == -- == == == -- -- -- -- --
  40 -- 51 00 00 00 08 66 00 81 80 00 00  Error: UNC at LBA = 0x866008180 = 36071047552

  Commands leading to the command that caused the error were:
  CR FEATR COUNT  LBA_48  LH LM LL DV DC  Powered_Up_Time  Command/Feature_Name
  -- == -- == -- == == == -- -- -- -- --  ---------------  --------------------
  42 00 00 10 00 00 08 60 00 81 86 40 00  3d+16:26:56.262  READ VERIFY SECTOR(S) EXT
  42 00 00 10 00 00 08 5a 00 81 8c 40 00  3d+16:26:53.422  READ VERIFY SECTOR(S) EXT
  42 00 00 10 00 00 08 54 00 81 91 40 00  3d+16:26:50.600  READ VERIFY SECTOR(S) EXT
  42 00 00 10 00 00 08 47 00 81 80 40 00  3d+16:26:47.703  READ VERIFY SECTOR(S) EXT
  42 00 00 10 00 00 08 41 00 81 86 40 00  3d+16:26:44.914  READ VERIFY SECTOR(S) EXT

SMART Extended Self-test Log Version: 1 (1 sectors)
No self-tests have been logged.  [To run self-tests, use: smartctl -t]

SMART Selective self-test log data structure revision number 1
 SPAN  MIN_LBA  MAX_LBA  CURRENT_TEST_STATUS
    1        0        0  Not_testing
    2        0        0  Not_testing
    3        0        0  Not_testing
    4        0        0  Not_testing
    5        0        0  Not_testing
Selective self-test flags (0x0):
  After scanning selected spans, do NOT read-scan remainder of disk.
If Selective self-test is pending on power-up, resume after 0 minute delay.

SCT Status Version:                  3
SCT Version (vendor specific):       522 (0x020a)
Device State:                        Active (0)
Current Temperature:                    25 Celsius
Power Cycle Min/Max Temperature:     19/26 Celsius
Lifetime    Min/Max Temperature:     15/49 Celsius
Under/Over Temperature Limit Count:   0/0

Write SCT Data Table failed: SMART WRITE LOG SECTOR may cause problems, try with -T permissive to force
Read SCT Temperature History failed

Write SCT (Get) Error Recovery Control Command failed: ATA return descriptor not supported by controller firmware
SCT (Get) Error Recovery Control command failed

Device Statistics (GP/SMART Log 0x04) not supported

Pending Defects log (GP Log 0x0c) not supported

SATA Phy Event Counters (GP Log 0x11)
ID      Size     Value  Description
0x000a  2            6  Device-to-host register FISes sent due to a COMRESET
0x0001  2            0  Command failed due to ICRC error
0x0003  2            0  R_ERR response for device-to-host data FIS
0x0004  2            0  R_ERR response for host-to-device data FIS
0x0006  2            0  R_ERR response for device-to-host non-data FIS
0x0007  2            0  R_ERR response for host-to-device non-data FIS



