smartctl 7.1 2019-12-30 r5022 [x86_64-linux-4.15.0-desktop-122.124.1rosa-x86_64] (local build)
Copyright (C) 2002-19, Bruce Allen, Christian Franke, www.smartmontools.org

=== START OF INFORMATION SECTION ===
Model Family:     Western Digital Blue
Device Model:     WDC WD5000LPVX-60V0TT0
Serial Number:    --
LU WWN Device Id: 5 0014ee ...
Firmware Version: 01.01A01
User Capacity:    500,107,862,016 bytes [500 GB]
Sector Sizes:     512 bytes logical, 4096 bytes physical
Rotation Rate:    5400 rpm
Form Factor:      2.5 inches
Device is:        In smartctl database [for details use: -P show]
ATA Version is:   ACS-2 (minor revision not indicated)
SATA Version is:  SATA 3.0, 6.0 Gb/s (current: 6.0 Gb/s)
Local Time is:    Tue Dec 15 10:31:16 2020 MSK
SMART support is: Available - device has SMART capability.
SMART support is: Enabled
AAM feature is:   Unavailable
APM level is:     128 (minimum power consumption without standby)
Rd look-ahead is: Enabled
Write cache is:   Enabled
DSN feature is:   Unavailable
ATA Security is:  Disabled, NOT FROZEN [SEC1]
Wt Cache Reorder: Enabled

=== START OF READ SMART DATA SECTION ===
SMART overall-health self-assessment test result: PASSED

General SMART Values:
Offline data collection status:  (0x00)	Offline data collection activity
					was never started.
					Auto Offline Data Collection: Disabled.
Self-test execution status:      (   0)	The previous self-test routine completed
					without error or no self-test has ever 
					been run.
Total time to complete Offline 
data collection: 		( 9300) seconds.
Offline data collection
capabilities: 			 (0x51) SMART execute Offline immediate.
					No Auto Offline data collection support.
					Suspend Offline collection upon new
					command.
					No Offline surface scan supported.
					Self-test supported.
					No Conveyance Self-test supported.
					Selective Self-test supported.
SMART capabilities:            (0x0003)	Saves SMART data before entering
					power-saving mode.
					Supports SMART auto save timer.
Error logging capability:        (0x01)	Error logging supported.
					General Purpose Logging supported.
Short self-test routine 
recommended polling time: 	 (   2) minutes.
Extended self-test routine
recommended polling time: 	 ( 106) minutes.
SCT capabilities: 	       (0x703d)	SCT Status supported.
					SCT Error Recovery Control supported.
					SCT Feature Control supported.
					SCT Data Table supported.

SMART Attributes Data Structure revision number: 16
Vendor Specific SMART Attributes with Thresholds:
ID# ATTRIBUTE_NAME          FLAGS    VALUE WORST THRESH FAIL RAW_VALUE
  1 Raw_Read_Error_Rate     POSR-K   200   200   051    -    8927
  3 Spin_Up_Time            POS--K   151   148   021    -    1416
  4 Start_Stop_Count        -O--CK   095   095   000    -    5837
  5 Reallocated_Sector_Ct   PO--CK   200   200   140    -    0
  7 Seek_Error_Rate         POSR-K   200   200   051    -    0
  9 Power_On_Hours          -O--CK   088   088   000    -    8966
 10 Spin_Retry_Count        PO--CK   100   100   051    -    0
 11 Calibration_Retry_Count -O--CK   100   100   000    -    0
 12 Power_Cycle_Count       -O--CK   095   095   000    -    5771
183 Runtime_Bad_Block       -O--CK   100   100   000    -    0
184 End-to-End_Error        PO--CK   099   099   097    -    1
187 Reported_Uncorrect      -O--CK   100   001   000    -    9145
188 Command_Timeout         -O--CK   100   001   000    -    4390
190 Airflow_Temperature_Cel -O---K   065   058   040    -    35 (Min/Max 22/35)
191 G-Sense_Error_Rate      -O--CK   085   085   000    -    15
192 Power-Off_Retract_Count -O--CK   198   198   000    -    2051
193 Load_Cycle_Count        -O--CK   153   153   000    -    143999
194 Temperature_Celsius     -O---K   108   101   000    -    35
196 Reallocated_Event_Count -O--CK   200   200   000    -    0
197 Current_Pending_Sector  -O--CK   200   200   000    -    0
198 Offline_Uncorrectable   ----CK   100   253   000    -    0
199 UDMA_CRC_Error_Count    -O--CK   200   200   000    -    0
200 Multi_Zone_Error_Rate   P--R--   100   253   051    -    0
                            ||||||_ K auto-keep
                            |||||__ C event count
                            ||||___ R error rate
                            |||____ S speed/performance
                            ||_____ O updated online
                            |______ P prefailure warning

General Purpose Log Directory Version 1
SMART           Log Directory Version 1 [multi-sector log support]
Address    Access  R/W   Size  Description
0x00       GPL,SL  R/O      1  Log Directory
0x01           SL  R/O      1  Summary SMART error log
0x02           SL  R/O      5  Comprehensive SMART error log
0x03       GPL     R/O      6  Ext. Comprehensive SMART error log
0x06           SL  R/O      1  SMART self-test log
0x07       GPL     R/O      1  Extended self-test log
0x09           SL  R/W      1  Selective self-test log
0x10       GPL     R/O      1  NCQ Command Error log
0x11       GPL     R/O      1  SATA Phy Event Counters log
0x80-0x9f  GPL,SL  R/W     16  Host vendor specific log
0xa0-0xa7  GPL,SL  VS      16  Device vendor specific log
0xa8-0xb6  GPL,SL  VS       1  Device vendor specific log
0xb7       GPL,SL  VS      38  Device vendor specific log
0xbd       GPL,SL  VS       1  Device vendor specific log
0xc0       GPL,SL  VS       1  Device vendor specific log
0xc1       GPL     VS      93  Device vendor specific log
0xe0       GPL,SL  R/W      1  SCT Command/Status
0xe1       GPL,SL  R/W      1  SCT Data Transfer

SMART Extended Comprehensive Error Log Version: 1 (6 sectors)
Device Error Count: 9145 (device log contains only the most recent 24 errors)
	CR     = Command Register
	FEATR  = Features Register
	COUNT  = Count (was: Sector Count) Register
	LBA_48 = Upper bytes of LBA High/Mid/Low Registers ]  ATA-8
	LH     = LBA High (was: Cylinder High) Register    ]   LBA
	LM     = LBA Mid (was: Cylinder Low) Register      ] Register
	LL     = LBA Low (was: Sector Number) Register     ]
	DV     = Device (was: Device/Head) Register
	DC     = Device Control Register
	ER     = Error register
	ST     = Status register
Powered_Up_Time is measured from power on, and printed as
DDd+hh:mm:SS.sss where DD=days, hh=hours, mm=minutes,
SS=sec, and sss=millisec. It "wraps" after 49.710 days.

Error 9145 [0] occurred at disk power-on lifetime: 8579 hours (357 days + 11 hours)
  When the command that caused the error occurred, the device was active or idle.

  After command completion occurred, registers were:
  ER -- ST COUNT  LBA_48  LH LM LL DV DC
  -- -- -- == -- == == == -- -- -- -- --
  10 -- 51 00 00 00 00 1d 25 c0 88 40 00  Error: IDNF at LBA = 0x1d25c088 = 489013384

  Commands leading to the command that caused the error were:
  CR FEATR COUNT  LBA_48  LH LM LL DV DC  Powered_Up_Time  Command/Feature_Name
  -- == -- == -- == == == -- -- -- -- --  ---------------  --------------------
  60 00 08 00 c8 00 00 00 17 b4 40 40 08     09:34:33.815  READ FPDMA QUEUED
  61 00 b0 00 c0 00 00 1d 25 c0 88 40 08     09:34:27.251  WRITE FPDMA QUEUED
  60 00 30 00 b8 00 00 01 48 09 90 40 08     09:34:26.371  READ FPDMA QUEUED
  60 00 10 00 b0 00 00 01 48 09 78 40 08     09:34:26.371  READ FPDMA QUEUED
  60 00 18 00 a8 00 00 01 48 09 58 40 08     09:34:26.371  READ FPDMA QUEUED

Error 9144 [23] occurred at disk power-on lifetime: 7237 hours (301 days + 13 hours)
  When the command that caused the error occurred, the device was active or idle.

  After command completion occurred, registers were:
  ER -- ST COUNT  LBA_48  LH LM LL DV DC
  -- -- -- == -- == == == -- -- -- -- --
  40 -- 51 01 00 00 00 12 bd 01 a9 40 00  Error: UNC at LBA = 0x12bd01a9 = 314376617

  Commands leading to the command that caused the error were:
  CR FEATR COUNT  LBA_48  LH LM LL DV DC  Powered_Up_Time  Command/Feature_Name
  -- == -- == -- == == == -- -- -- -- --  ---------------  --------------------
  60 01 00 00 c0 00 00 12 bd 01 58 40 00     04:25:51.597  READ FPDMA QUEUED
  60 01 00 00 b8 00 00 12 bd 00 58 40 00     04:25:50.800  READ FPDMA QUEUED
  60 01 70 00 b0 00 00 12 bc fe e8 40 00     04:25:50.526  READ FPDMA QUEUED
  60 00 10 00 a8 00 00 12 bc fe d8 40 00     04:25:50.526  READ FPDMA QUEUED
  61 00 08 00 a0 00 00 00 5b ea d8 40 00     04:25:49.097  WRITE FPDMA QUEUED

Error 9143 [22] occurred at disk power-on lifetime: 6001 hours (250 days + 1 hours)
  When the command that caused the error occurred, the device was active or idle.

  After command completion occurred, registers were:
  ER -- ST COUNT  LBA_48  LH LM LL DV DC
  -- -- -- == -- == == == -- -- -- -- --
  40 -- 51 00 00 00 00 02 4a 76 28 40 00  Error: UNC at LBA = 0x024a7628 = 38434344

  Commands leading to the command that caused the error were:
  CR FEATR COUNT  LBA_48  LH LM LL DV DC  Powered_Up_Time  Command/Feature_Name
  -- == -- == -- == == == -- -- -- -- --  ---------------  --------------------
  60 00 40 00 08 00 00 02 4a 76 28 40 00     00:15:05.346  READ FPDMA QUEUED
  2f 00 00 00 01 00 00 00 00 00 10 40 00     00:15:05.346  READ LOG EXT
  60 00 40 00 08 00 00 02 4a 76 28 40 00     00:15:01.863  READ FPDMA QUEUED
  2f 00 00 00 01 00 00 00 00 00 10 40 00     00:15:01.863  READ LOG EXT
  60 00 40 00 08 00 00 02 4a 76 28 40 00     00:14:58.379  READ FPDMA QUEUED

Error 9142 [21] occurred at disk power-on lifetime: 6001 hours (250 days + 1 hours)
  When the command that caused the error occurred, the device was active or idle.

  After command completion occurred, registers were:
  ER -- ST COUNT  LBA_48  LH LM LL DV DC
  -- -- -- == -- == == == -- -- -- -- --
  40 -- 51 00 00 00 00 02 4a 76 28 40 00  Error: UNC at LBA = 0x024a7628 = 38434344

  Commands leading to the command that caused the error were:
  CR FEATR COUNT  LBA_48  LH LM LL DV DC  Powered_Up_Time  Command/Feature_Name
  -- == -- == -- == == == -- -- -- -- --  ---------------  --------------------
  60 00 40 00 08 00 00 02 4a 76 28 40 00     00:15:01.863  READ FPDMA QUEUED
  2f 00 00 00 01 00 00 00 00 00 10 40 00     00:15:01.863  READ LOG EXT
  60 00 40 00 08 00 00 02 4a 76 28 40 00     00:14:58.379  READ FPDMA QUEUED
  2f 00 00 00 01 00 00 00 00 00 10 40 00     00:14:58.379  READ LOG EXT
  60 00 40 00 08 00 00 02 4a 76 28 40 00     00:14:54.896  READ FPDMA QUEUED

Error 9141 [20] occurred at disk power-on lifetime: 6001 hours (250 days + 1 hours)
  When the command that caused the error occurred, the device was active or idle.

  After command completion occurred, registers were:
  ER -- ST COUNT  LBA_48  LH LM LL DV DC
  -- -- -- == -- == == == -- -- -- -- --
  40 -- 51 00 00 00 00 02 4a 76 28 40 00  Error: UNC at LBA = 0x024a7628 = 38434344

  Commands leading to the command that caused the error were:
  CR FEATR COUNT  LBA_48  LH LM LL DV DC  Powered_Up_Time  Command/Feature_Name
  -- == -- == -- == == == -- -- -- -- --  ---------------  --------------------
  60 00 40 00 08 00 00 02 4a 76 28 40 00     00:14:58.379  READ FPDMA QUEUED
  2f 00 00 00 01 00 00 00 00 00 10 40 00     00:14:58.379  READ LOG EXT
  60 00 40 00 08 00 00 02 4a 76 28 40 00     00:14:54.896  READ FPDMA QUEUED
  2f 00 00 00 01 00 00 00 00 00 10 40 00     00:14:54.895  READ LOG EXT
  60 00 40 00 08 00 00 02 4a 76 28 40 00     00:14:51.412  READ FPDMA QUEUED

Error 9140 [19] occurred at disk power-on lifetime: 6001 hours (250 days + 1 hours)
  When the command that caused the error occurred, the device was active or idle.

  After command completion occurred, registers were:
  ER -- ST COUNT  LBA_48  LH LM LL DV DC
  -- -- -- == -- == == == -- -- -- -- --
  40 -- 51 00 00 00 00 02 4a 76 28 40 00  Error: UNC at LBA = 0x024a7628 = 38434344

  Commands leading to the command that caused the error were:
  CR FEATR COUNT  LBA_48  LH LM LL DV DC  Powered_Up_Time  Command/Feature_Name
  -- == -- == -- == == == -- -- -- -- --  ---------------  --------------------
  60 00 40 00 08 00 00 02 4a 76 28 40 00     00:14:54.896  READ FPDMA QUEUED
  2f 00 00 00 01 00 00 00 00 00 10 40 00     00:14:54.895  READ LOG EXT
  60 00 40 00 08 00 00 02 4a 76 28 40 00     00:14:51.412  READ FPDMA QUEUED
  2f 00 00 00 01 00 00 00 00 00 10 40 00     00:14:51.412  READ LOG EXT
  60 00 40 00 08 00 00 02 4a 76 28 40 00     00:14:47.929  READ FPDMA QUEUED

Error 9139 [18] occurred at disk power-on lifetime: 6001 hours (250 days + 1 hours)
  When the command that caused the error occurred, the device was active or idle.

  After command completion occurred, registers were:
  ER -- ST COUNT  LBA_48  LH LM LL DV DC
  -- -- -- == -- == == == -- -- -- -- --
  40 -- 51 00 00 00 00 02 4a 76 28 40 00  Error: UNC at LBA = 0x024a7628 = 38434344

  Commands leading to the command that caused the error were:
  CR FEATR COUNT  LBA_48  LH LM LL DV DC  Powered_Up_Time  Command/Feature_Name
  -- == -- == -- == == == -- -- -- -- --  ---------------  --------------------
  60 00 40 00 08 00 00 02 4a 76 28 40 00     00:14:51.412  READ FPDMA QUEUED
  2f 00 00 00 01 00 00 00 00 00 10 40 00     00:14:51.412  READ LOG EXT
  60 00 40 00 08 00 00 02 4a 76 28 40 00     00:14:47.929  READ FPDMA QUEUED
  2f 00 00 00 01 00 00 00 00 00 10 40 00     00:14:47.928  READ LOG EXT
  60 00 40 00 08 00 00 02 4a 76 28 40 00     00:14:44.445  READ FPDMA QUEUED

Error 9138 [17] occurred at disk power-on lifetime: 6001 hours (250 days + 1 hours)
  When the command that caused the error occurred, the device was active or idle.

  After command completion occurred, registers were:
  ER -- ST COUNT  LBA_48  LH LM LL DV DC
  -- -- -- == -- == == == -- -- -- -- --
  40 -- 51 00 00 00 00 02 4a 76 28 40 00  Error: UNC at LBA = 0x024a7628 = 38434344

  Commands leading to the command that caused the error were:
  CR FEATR COUNT  LBA_48  LH LM LL DV DC  Powered_Up_Time  Command/Feature_Name
  -- == -- == -- == == == -- -- -- -- --  ---------------  --------------------
  60 00 40 00 08 00 00 02 4a 76 28 40 00     00:14:47.929  READ FPDMA QUEUED
  2f 00 00 00 01 00 00 00 00 00 10 40 00     00:14:47.928  READ LOG EXT
  60 00 40 00 08 00 00 02 4a 76 28 40 00     00:14:44.445  READ FPDMA QUEUED
  2f 00 00 00 01 00 00 00 00 00 10 40 00     00:14:44.445  READ LOG EXT
  60 00 40 00 08 00 00 02 4a 76 28 40 00     00:14:40.961  READ FPDMA QUEUED

SMART Extended Self-test Log Version: 1 (1 sectors)
Num  Test_Description    Status                  Remaining  LifeTime(hours)  LBA_of_first_error
# 1  Extended offline    Completed: read failure       90%      4165         6293592
# 2  Extended offline    Completed: read failure       90%      4165         6293592
# 3  Short offline       Completed: read failure       90%      4165         6293592

SMART Selective self-test log data structure revision number 1
 SPAN  MIN_LBA  MAX_LBA  CURRENT_TEST_STATUS
    1        0        0  Not_testing
    2        0        0  Not_testing
    3        0        0  Not_testing
    4        0        0  Not_testing
    5        0        0  Not_testing
Selective self-test flags (0x0):
  After scanning selected spans, do NOT read-scan remainder of disk.
If Selective self-test is pending on power-up, resume after 0 minute delay.

SCT Status Version:                  3
SCT Version (vendor specific):       258 (0x0102)
Device State:                        Active (0)
Current Temperature:                    35 Celsius
Power Cycle Min/Max Temperature:     22/35 Celsius
Lifetime    Min/Max Temperature:     16/44 Celsius
Under/Over Temperature Limit Count:   0/0
Vendor specific:
01 00 00 00 00 00 00 00 00 00 00 00 00 00 00 00
00 00 00 00 00 00 00 00 00 00 00 00 00 00 00 00

SCT Temperature History Version:     2
Temperature Sampling Period:         1 minute
Temperature Logging Interval:        1 minute
Min/Max recommended Temperature:      0/60 Celsius
Min/Max Temperature Limit:           -41/85 Celsius
Temperature History Size (Index):    128 (112)

SCT Error Recovery Control:
           Read:     85 (8.5 seconds)
          Write:     85 (8.5 seconds)

Device Statistics (GP/SMART Log 0x04) not supported

Pending Defects log (GP Log 0x0c) not supported

SATA Phy Event Counters (GP Log 0x11)
ID      Size     Value  Description
0x0001  2            0  Command failed due to ICRC error
0x0002  2            0  R_ERR response for data FIS
0x0003  2            0  R_ERR response for device-to-host data FIS
0x0004  2            0  R_ERR response for host-to-device data FIS
0x0005  2            0  R_ERR response for non-data FIS
0x0006  2            0  R_ERR response for device-to-host non-data FIS
0x0007  2            0  R_ERR response for host-to-device non-data FIS
0x0008  2            0  Device-to-host non-data FIS retries
0x0009  2            3  Transition from drive PhyRdy to drive PhyNRdy
0x000a  2            3  Device-to-host register FISes sent due to a COMRESET
0x000b  2            0  CRC errors within host-to-device FIS
0x000f  2            0  R_ERR response for host-to-device data FIS, CRC
0x0012  2            0  R_ERR response for host-to-device non-data FIS, CRC
0x8000  4         2745  Vendor specific

