=== START OF INFORMATION SECTION ===
Model Family:     Western Digital Scorpio Blue Serial ATA
Device Model:     WDC WD1600BEVT-22A23T0
Serial Number:    --
LU WWN Device Id: 5 0014ee ...
Firmware Version: 01.01A01
User Capacity:    160,041,885,696 bytes [160 GB]
Sector Size:      512 bytes logical/physical
Rotation Rate:    5400 rpm
Device is:        In smartctl database [for details use: -P show]
ATA Version is:   ATA8-ACS (minor revision not indicated)
SATA Version is:  SATA 2.6, 3.0 Gb/s
Local Time is:    Mon Feb 12 20:28:17 2018 +04
SMART support is: Available - device has SMART capability.
SMART support is: Enabled
AAM feature is:   Disabled
APM level is:     96 (intermediate level with standby)
Rd look-ahead is: Enabled
Write cache is:   Enabled
ATA Security is:  Disabled, frozen [SEC2]
Wt Cache Reorder: Enabled

=== START OF READ SMART DATA SECTION ===
SMART overall-health self-assessment test result: PASSED

General SMART Values:
Offline data collection status:  (0x82)	Offline data collection activity
					was completed without error.
					Auto Offline Data Collection: Enabled.
Self-test execution status:      (   0)	The previous self-test routine completed
					without error or no self-test has ever 
					been run.
Total time to complete Offline 
data collection: 		( 3780) seconds.
Offline data collection
capabilities: 			 (0x7b) SMART execute Offline immediate.
					Auto Offline data collection on/off support.
					Suspend Offline collection upon new
					command.
					Offline surface scan supported.
					Self-test supported.
					Conveyance Self-test supported.
					Selective Self-test supported.
SMART capabilities:            (0x0003)	Saves SMART data before entering
					power-saving mode.
					Supports SMART auto save timer.
Error logging capability:        (0x01)	Error logging supported.
					General Purpose Logging supported.
Short self-test routine 
recommended polling time: 	 (   2) minutes.
Extended self-test routine
recommended polling time: 	 (  48) minutes.
Conveyance self-test routine
recommended polling time: 	 (   5) minutes.
SCT capabilities: 	       (0x7037)	SCT Status supported.
					SCT Feature Control supported.
					SCT Data Table supported.

SMART Attributes Data Structure revision number: 16
Vendor Specific SMART Attributes with Thresholds:
ID# ATTRIBUTE_NAME          FLAGS    VALUE WORST THRESH FAIL RAW_VALUE
  1 Raw_Read_Error_Rate     POSR-K   200   200   051    -    10
  3 Spin_Up_Time            POS--K   140   131   021    -    1966
  4 Start_Stop_Count        -O--CK   088   088   000    -    12416
  5 Reallocated_Sector_Ct   PO--CK   200   200   140    -    0
  7 Seek_Error_Rate         -OSR-K   100   253   000    -    0
  9 Power_On_Hours          -O--CK   098   098   000    -    1888
 10 Spin_Retry_Count        -O--CK   100   100   000    -    0
 11 Calibration_Retry_Count -O--CK   100   100   000    -    0
 12 Power_Cycle_Count       -O--CK   098   098   000    -    2338
191 G-Sense_Error_Rate      -O--CK   001   001   000    -    33018
192 Power-Off_Retract_Count -O--CK   200   200   000    -    173
193 Load_Cycle_Count        -O--CK   152   152   000    -    144554
194 Temperature_Celsius     -O---K   101   090   000    -    42
196 Reallocated_Event_Count -O--CK   200   200   000    -    0
197 Current_Pending_Sector  -O--CK   200   200   000    -    4
198 Offline_Uncorrectable   ----CK   200   200   000    -    4
199 UDMA_CRC_Error_Count    -O--CK   200   200   000    -    0
200 Multi_Zone_Error_Rate   ---R--   200   200   000    -    5
                            ||||||_ K auto-keep
                            |||||__ C event count
                            ||||___ R error rate
                            |||____ S speed/performance
                            ||_____ O updated online
                            |______ P prefailure warning

General Purpose Log Directory Version 1
SMART           Log Directory Version 1 [multi-sector log support]
Address    Access  R/W   Size  Description
0x00       GPL,SL  R/O      1  Log Directory
0x01           SL  R/O      1  Summary SMART error log
0x02           SL  R/O      5  Comprehensive SMART error log
0x03       GPL     R/O      6  Ext. Comprehensive SMART error log
0x06           SL  R/O      1  SMART self-test log
0x07       GPL     R/O      1  Extended self-test log
0x09           SL  R/W      1  Selective self-test log
0x10       GPL     R/O      1  SATA NCQ Queued Error log
0x11       GPL     R/O      1  SATA Phy Event Counters log
0x80-0x9f  GPL,SL  R/W     16  Host vendor specific log
0xa0-0xa7  GPL,SL  VS      16  Device vendor specific log
0xa8-0xb7  GPL,SL  VS       1  Device vendor specific log
0xc0       GPL,SL  VS       1  Device vendor specific log
0xc1       GPL     VS      24  Device vendor specific log
0xe0       GPL,SL  R/W      1  SCT Command/Status
0xe1       GPL,SL  R/W      1  SCT Data Transfer

SMART Extended Comprehensive Error Log Version: 1 (6 sectors)
Device Error Count: 10
	CR     = Command Register
	FEATR  = Features Register
	COUNT  = Count (was: Sector Count) Register
	LBA_48 = Upper bytes of LBA High/Mid/Low Registers ]  ATA-8
	LH     = LBA High (was: Cylinder High) Register    ]   LBA
	LM     = LBA Mid (was: Cylinder Low) Register      ] Register
	LL     = LBA Low (was: Sector Number) Register     ]
	DV     = Device (was: Device/Head) Register
	DC     = Device Control Register
	ER     = Error register
	ST     = Status register
Powered_Up_Time is measured from power on, and printed as
DDd+hh:mm:SS.sss where DD=days, hh=hours, mm=minutes,
SS=sec, and sss=millisec. It "wraps" after 49.710 days.

Error 10 [9] occurred at disk power-on lifetime: 1304 hours (54 days + 8 hours)
  When the command that caused the error occurred, the device was active or idle.

  After command completion occurred, registers were:
  ER -- ST COUNT  LBA_48  LH LM LL DV DC
  -- -- -- == -- == == == -- -- -- -- --
  40 -- 51 00 08 00 00 06 d7 c1 7c 40 00  Error: UNC at LBA = 0x06d7c17c = 114803068

  Commands leading to the command that caused the error were:
  CR FEATR COUNT  LBA_48  LH LM LL DV DC  Powered_Up_Time  Command/Feature_Name
  -- == -- == -- == == == -- -- -- -- --  ---------------  --------------------
  60 00 08 00 e8 00 00 06 d7 c1 7b 40 00     00:18:49.951  READ FPDMA QUEUED
  60 00 01 00 e0 00 00 0a 3b f9 c0 40 00     00:18:49.479  READ FPDMA QUEUED
  60 00 01 00 d8 00 00 05 24 d9 fc 40 00     00:18:49.464  READ FPDMA QUEUED
  60 00 01 00 d0 00 00 00 00 00 00 40 00     00:18:49.464  READ FPDMA QUEUED
  60 00 01 00 c0 00 00 00 00 00 00 40 00     00:18:49.464  READ FPDMA QUEUED

Error 9 [8] occurred at disk power-on lifetime: 1304 hours (54 days + 8 hours)
  When the command that caused the error occurred, the device was active or idle.

  After command completion occurred, registers were:
  ER -- ST COUNT  LBA_48  LH LM LL DV DC
  -- -- -- == -- == == == -- -- -- -- --
  40 -- 51 00 08 00 00 06 d7 c1 7c 40 00  Error: UNC at LBA = 0x06d7c17c = 114803068

  Commands leading to the command that caused the error were:
  CR FEATR COUNT  LBA_48  LH LM LL DV DC  Powered_Up_Time  Command/Feature_Name
  -- == -- == -- == == == -- -- -- -- --  ---------------  --------------------
  60 00 08 00 a8 00 00 06 d7 c1 7b 40 00     00:18:46.844  READ FPDMA QUEUED
  60 00 01 00 48 00 00 0a 3b f9 c0 40 00     00:18:46.371  READ FPDMA QUEUED
  60 00 01 00 40 00 00 05 24 d9 fc 40 00     00:18:46.356  READ FPDMA QUEUED
  60 00 01 00 38 00 00 00 00 00 00 40 00     00:18:46.356  READ FPDMA QUEUED
  60 00 01 00 28 00 00 00 00 00 00 40 00     00:18:46.356  READ FPDMA QUEUED

Error 8 [7] occurred at disk power-on lifetime: 1304 hours (54 days + 8 hours)
  When the command that caused the error occurred, the device was active or idle.

  After command completion occurred, registers were:
  ER -- ST COUNT  LBA_48  LH LM LL DV DC
  -- -- -- == -- == == == -- -- -- -- --
  40 -- 51 00 08 00 00 06 d7 c1 7c 40 00  Error: UNC at LBA = 0x06d7c17c = 114803068

  Commands leading to the command that caused the error were:
  CR FEATR COUNT  LBA_48  LH LM LL DV DC  Powered_Up_Time  Command/Feature_Name
  -- == -- == -- == == == -- -- -- -- --  ---------------  --------------------
  60 00 08 00 10 00 00 06 d7 c1 7b 40 00     00:18:43.722  READ FPDMA QUEUED
  2f 00 00 00 01 00 00 00 00 00 10 40 00     00:18:43.225  READ LOG EXT
  60 00 08 00 08 00 00 06 d7 c1 7b 40 00     00:18:40.601  READ FPDMA QUEUED
  2f 00 00 00 01 00 00 00 00 00 10 40 00     00:18:40.106  READ LOG EXT
  60 00 01 00 00 00 00 0a 3b f9 c0 40 00     00:18:37.493  READ FPDMA QUEUED

Error 7 [6] occurred at disk power-on lifetime: 1304 hours (54 days + 8 hours)
  When the command that caused the error occurred, the device was active or idle.

  After command completion occurred, registers were:
  ER -- ST COUNT  LBA_48  LH LM LL DV DC
  -- -- -- == -- == == == -- -- -- -- --
  40 -- 51 00 08 00 00 06 d7 c1 7c 40 00  Error: UNC at LBA = 0x06d7c17c = 114803068

  Commands leading to the command that caused the error were:
  CR FEATR COUNT  LBA_48  LH LM LL DV DC  Powered_Up_Time  Command/Feature_Name
  -- == -- == -- == == == -- -- -- -- --  ---------------  --------------------
  60 00 08 00 08 00 00 06 d7 c1 7b 40 00     00:18:40.601  READ FPDMA QUEUED
  2f 00 00 00 01 00 00 00 00 00 10 40 00     00:18:40.106  READ LOG EXT
  60 00 01 00 00 00 00 0a 3b f9 c0 40 00     00:18:37.493  READ FPDMA QUEUED
  60 00 08 00 f8 00 00 06 d7 c1 7b 40 00     00:18:37.482  READ FPDMA QUEUED
  60 00 08 00 f0 00 00 06 d7 c1 73 40 00     00:18:37.482  READ FPDMA QUEUED

Error 6 [5] occurred at disk power-on lifetime: 1304 hours (54 days + 8 hours)
  When the command that caused the error occurred, the device was active or idle.

  After command completion occurred, registers were:
  ER -- ST COUNT  LBA_48  LH LM LL DV DC
  -- -- -- == -- == == == -- -- -- -- --
  40 -- 51 00 08 00 00 06 d7 c1 7c 40 00  Error: UNC at LBA = 0x06d7c17c = 114803068

  Commands leading to the command that caused the error were:
  CR FEATR COUNT  LBA_48  LH LM LL DV DC  Powered_Up_Time  Command/Feature_Name
  -- == -- == -- == == == -- -- -- -- --  ---------------  --------------------
  60 00 01 00 00 00 00 0a 3b f9 c0 40 00     00:18:37.493  READ FPDMA QUEUED
  60 00 08 00 f8 00 00 06 d7 c1 7b 40 00     00:18:37.482  READ FPDMA QUEUED
  60 00 08 00 f0 00 00 06 d7 c1 73 40 00     00:18:37.482  READ FPDMA QUEUED
  60 00 08 00 e8 00 00 06 d7 c1 6b 40 00     00:18:37.481  READ FPDMA QUEUED
  60 00 01 00 e0 00 00 05 24 d9 fc 40 00     00:18:37.481  READ FPDMA QUEUED

Error 5 [4] occurred at disk power-on lifetime: 1304 hours (54 days + 8 hours)
  When the command that caused the error occurred, the device was active or idle.

  After command completion occurred, registers were:
  ER -- ST COUNT  LBA_48  LH LM LL DV DC
  -- -- -- == -- == == == -- -- -- -- --
  40 -- 51 00 80 00 00 06 d7 c1 7c 40 00  Error: UNC at LBA = 0x06d7c17c = 114803068

  Commands leading to the command that caused the error were:
  CR FEATR COUNT  LBA_48  LH LM LL DV DC  Powered_Up_Time  Command/Feature_Name
  -- == -- == -- == == == -- -- -- -- --  ---------------  --------------------
  60 00 80 00 90 00 00 06 d7 c1 5b 40 00     00:18:34.809  READ FPDMA QUEUED
  60 00 01 00 88 00 00 0a 3b f9 c0 40 00     00:18:34.350  READ FPDMA QUEUED
  60 00 01 00 80 00 00 05 24 d9 fc 40 00     00:18:34.335  READ FPDMA QUEUED
  60 00 01 00 78 00 00 00 00 00 00 40 00     00:18:34.335  READ FPDMA QUEUED
  60 00 01 00 68 00 00 00 00 00 00 40 00     00:18:34.334  READ FPDMA QUEUED

Error 4 [3] occurred at disk power-on lifetime: 1304 hours (54 days + 8 hours)
  When the command that caused the error occurred, the device was active or idle.

  After command completion occurred, registers were:
  ER -- ST COUNT  LBA_48  LH LM LL DV DC
  -- -- -- == -- == == == -- -- -- -- --
  40 -- 51 00 80 00 00 06 d7 c1 7c 40 00  Error: UNC at LBA = 0x06d7c17c = 114803068

  Commands leading to the command that caused the error were:
  CR FEATR COUNT  LBA_48  LH LM LL DV DC  Powered_Up_Time  Command/Feature_Name
  -- == -- == -- == == == -- -- -- -- --  ---------------  --------------------
  60 00 80 00 50 00 00 06 d7 c1 5b 40 00     00:18:31.687  READ FPDMA QUEUED
  60 00 01 00 48 00 00 0a 3b f9 c0 40 00     00:18:31.220  READ FPDMA QUEUED
  60 00 01 00 40 00 00 05 24 d9 fc 40 00     00:18:31.205  READ FPDMA QUEUED
  60 00 01 00 38 00 00 00 00 00 00 40 00     00:18:31.204  READ FPDMA QUEUED
  60 00 01 00 28 00 00 00 00 00 00 40 00     00:18:31.204  READ FPDMA QUEUED

Error 3 [2] occurred at disk power-on lifetime: 1304 hours (54 days + 8 hours)
  When the command that caused the error occurred, the device was active or idle.

  After command completion occurred, registers were:
  ER -- ST COUNT  LBA_48  LH LM LL DV DC
  -- -- -- == -- == == == -- -- -- -- --
  40 -- 51 00 80 00 00 06 d7 c1 7c 40 00  Error: UNC at LBA = 0x06d7c17c = 114803068

  Commands leading to the command that caused the error were:
  CR FEATR COUNT  LBA_48  LH LM LL DV DC  Powered_Up_Time  Command/Feature_Name
  -- == -- == -- == == == -- -- -- -- --  ---------------  --------------------
  60 00 80 00 10 00 00 06 d7 c1 5b 40 00     00:18:28.566  READ FPDMA QUEUED
  60 00 01 00 08 00 00 0a 3b f9 c0 40 00     00:18:28.101  READ FPDMA QUEUED
  60 00 01 00 00 00 00 05 24 d9 fc 40 00     00:18:28.085  READ FPDMA QUEUED
  60 00 01 00 f8 00 00 00 00 00 00 40 00     00:18:28.085  READ FPDMA QUEUED
  60 00 01 00 e8 00 00 00 00 00 00 40 00     00:18:28.085  READ FPDMA QUEUED

SMART Extended Self-test Log Version: 1 (1 sectors)
No self-tests have been logged.  [To run self-tests, use: smartctl -t]

SMART Selective self-test log data structure revision number 1
 SPAN  MIN_LBA  MAX_LBA  CURRENT_TEST_STATUS
    1        0        0  Not_testing
    2        0        0  Not_testing
    3        0        0  Not_testing
    4        0        0  Not_testing
    5        0        0  Not_testing
Selective self-test flags (0x0):
  After scanning selected spans, do NOT read-scan remainder of disk.
If Selective self-test is pending on power-up, resume after 0 minute delay.

SCT Status Version:                  3
SCT Version (vendor specific):       258 (0x0102)
SCT Support Level:                   1
Device State:                        Active (0)
Current Temperature:                    42 Celsius
Power Cycle Min/Max Temperature:     42/42 Celsius
Lifetime    Min/Max Temperature:      ?/54 Celsius
Under/Over Temperature Limit Count:   0/0
Vendor specific:
01 00 00 00 00 00 00 00 00 00 00 00 00 00 00 00
00 00 00 00 00 00 00 00 00 00 00 00 00 00 00 00

SCT Temperature History Version:     2
Temperature Sampling Period:         1 minute
Temperature Logging Interval:        1 minute
Min/Max recommended Temperature:      0/60 Celsius
Min/Max Temperature Limit:           -41/85 Celsius
Temperature History Size (Index):    128 (55)

SCT Error Recovery Control command not supported

Device Statistics (GP/SMART Log 0x04) not supported

SATA Phy Event Counters (GP Log 0x11)
ID      Size     Value  Description
0x0001  2            0  Command failed due to ICRC error
0x0002  2            0  R_ERR response for data FIS
0x0003  2            0  R_ERR response for device-to-host data FIS
0x0004  2            0  R_ERR response for host-to-device data FIS
0x0005  2            0  R_ERR response for non-data FIS
0x0006  2            0  R_ERR response for device-to-host non-data FIS
0x0007  2            0  R_ERR response for host-to-device non-data FIS
0x000a  2            2  Device-to-host register FISes sent due to a COMRESET
0x000b  2            0  CRC errors within host-to-device FIS
0x8000  4          211  Vendor specific

