smartctl 7.2 2020-12-30 r5155 [x86_64-linux-5.10.14-desktop-1omv4002] (OpenMandriva Lx 7.2-2)
Copyright (C) 2002-20, Bruce Allen, Christian Franke, www.smartmontools.org

=== START OF INFORMATION SECTION ===
Model Family:     Western Digital Caviar Blue Serial ATA
Device Model:     WDC WD1600AAJS-22L7A0
Serial Number:    --
LU WWN Device Id: 5 0014ee ...
Firmware Version: 01.03E01
User Capacity:    160,041,885,696 bytes [160 GB]
Sector Size:      512 bytes logical/physical
Device is:        In smartctl database [for details use: -P show]
ATA Version is:   ATA8-ACS (minor revision not indicated)
SATA Version is:  SATA 2.5, 3.0 Gb/s
Local Time is:    Sat Oct 30 19:53:31 2021 UTC
SMART support is: Available - device has SMART capability.
SMART support is: Enabled
AAM level is:     128 (quiet), recommended: 128
APM feature is:   Unavailable
Rd look-ahead is: Enabled
Write cache is:   Enabled
DSN feature is:   Unavailable
ATA Security is:  Disabled, frozen [SEC2]
Wt Cache Reorder: Enabled

=== START OF READ SMART DATA SECTION ===
SMART overall-health self-assessment test result: PASSED

General SMART Values:
Offline data collection status:  (0x84)	Offline data collection activity
					was suspended by an interrupting command from host.
					Auto Offline Data Collection: Enabled.
Self-test execution status:      (   0)	The previous self-test routine completed
					without error or no self-test has ever 
					been run.
Total time to complete Offline 
data collection: 		( 3000) seconds.
Offline data collection
capabilities: 			 (0x7b) SMART execute Offline immediate.
					Auto Offline data collection on/off support.
					Suspend Offline collection upon new
					command.
					Offline surface scan supported.
					Self-test supported.
					Conveyance Self-test supported.
					Selective Self-test supported.
SMART capabilities:            (0x0003)	Saves SMART data before entering
					power-saving mode.
					Supports SMART auto save timer.
Error logging capability:        (0x01)	Error logging supported.
					General Purpose Logging supported.
Short self-test routine 
recommended polling time: 	 (   2) minutes.
Extended self-test routine
recommended polling time: 	 (  39) minutes.
Conveyance self-test routine
recommended polling time: 	 (   5) minutes.
SCT capabilities: 	       (0x303f)	SCT Status supported.
					SCT Error Recovery Control supported.
					SCT Feature Control supported.
					SCT Data Table supported.

SMART Attributes Data Structure revision number: 16
Vendor Specific SMART Attributes with Thresholds:
ID# ATTRIBUTE_NAME          FLAGS    VALUE WORST THRESH FAIL RAW_VALUE
  1 Raw_Read_Error_Rate     POSR-K   200   200   051    -    523
  3 Spin_Up_Time            POS--K   132   129   021    -    4400
  4 Start_Stop_Count        -O--CK   094   094   000    -    6751
  5 Reallocated_Sector_Ct   PO--CK   200   200   140    -    0
  7 Seek_Error_Rate         -OSR-K   200   200   000    -    0
  9 Power_On_Hours          -O--CK   086   086   000    -    10667
 10 Spin_Retry_Count        -O--CK   100   100   000    -    0
 11 Calibration_Retry_Count -O--CK   100   100   000    -    0
 12 Power_Cycle_Count       -O--CK   096   096   000    -    4302
192 Power-Off_Retract_Count -O--CK   200   200   000    -    355
193 Load_Cycle_Count        -O--CK   198   198   000    -    6751
194 Temperature_Celsius     -O---K   109   088   000    -    34
196 Reallocated_Event_Count -O--CK   200   200   000    -    0
197 Current_Pending_Sector  -O--CK   200   200   000    -    0
198 Offline_Uncorrectable   ----CK   200   200   000    -    0
199 UDMA_CRC_Error_Count    -O--CK   200   200   000    -    0
200 Multi_Zone_Error_Rate   ---R--   200   200   000    -    0
                            ||||||_ K auto-keep
                            |||||__ C event count
                            ||||___ R error rate
                            |||____ S speed/performance
                            ||_____ O updated online
                            |______ P prefailure warning

General Purpose Log Directory Version 1
SMART           Log Directory Version 1 [multi-sector log support]
Address    Access  R/W   Size  Description
0x00       GPL,SL  R/O      1  Log Directory
0x01           SL  R/O      1  Summary SMART error log
0x02           SL  R/O      5  Comprehensive SMART error log
0x03       GPL     R/O      6  Ext. Comprehensive SMART error log
0x06           SL  R/O      1  SMART self-test log
0x07       GPL     R/O      1  Extended self-test log
0x09           SL  R/W      1  Selective self-test log
0x10       GPL     R/O      1  NCQ Command Error log
0x11       GPL     R/O      1  SATA Phy Event Counters log
0x80-0x9f  GPL,SL  R/W     16  Host vendor specific log
0xa0-0xa7  GPL,SL  VS      16  Device vendor specific log
0xa8-0xb7  GPL,SL  VS       1  Device vendor specific log
0xbd       GPL,SL  VS       1  Device vendor specific log
0xc0       GPL,SL  VS       1  Device vendor specific log
0xc1       GPL     VS      24  Device vendor specific log
0xe0       GPL,SL  R/W      1  SCT Command/Status
0xe1       GPL,SL  R/W      1  SCT Data Transfer

SMART Extended Comprehensive Error Log Version: 1 (6 sectors)
Device Error Count: 510 (device log contains only the most recent 24 errors)
	CR     = Command Register
	FEATR  = Features Register
	COUNT  = Count (was: Sector Count) Register
	LBA_48 = Upper bytes of LBA High/Mid/Low Registers ]  ATA-8
	LH     = LBA High (was: Cylinder High) Register    ]   LBA
	LM     = LBA Mid (was: Cylinder Low) Register      ] Register
	LL     = LBA Low (was: Sector Number) Register     ]
	DV     = Device (was: Device/Head) Register
	DC     = Device Control Register
	ER     = Error register
	ST     = Status register
Powered_Up_Time is measured from power on, and printed as
DDd+hh:mm:SS.sss where DD=days, hh=hours, mm=minutes,
SS=sec, and sss=millisec. It "wraps" after 49.710 days.

Error 510 [5] occurred at disk power-on lifetime: 9661 hours (402 days + 13 hours)
  When the command that caused the error occurred, the device was active or idle.

  After command completion occurred, registers were:
  ER -- ST COUNT  LBA_48  LH LM LL DV DC
  -- -- -- == -- == == == -- -- -- -- --
  40 -- 51 00 08 00 00 0d 00 70 90 e0 00  Error: UNC 8 sectors at LBA = 0x0d007090 = 218132624

  Commands leading to the command that caused the error were:
  CR FEATR COUNT  LBA_48  LH LM LL DV DC  Powered_Up_Time  Command/Feature_Name
  -- == -- == -- == == == -- -- -- -- --  ---------------  --------------------
  25 00 00 00 08 00 00 00 70 0d 90 e0 00     00:00:23.618  READ DMA EXT
  25 00 00 00 08 00 00 00 70 0d 90 e0 00     00:00:21.304  READ DMA EXT
  25 00 00 00 08 00 00 00 70 0e 10 e0 00     00:00:21.304  READ DMA EXT
  25 00 00 00 08 00 00 00 70 0d 88 e0 00     00:00:21.303  READ DMA EXT
  25 00 00 00 08 00 00 00 70 0e 08 e0 00     00:00:21.294  READ DMA EXT

Error 509 [4] occurred at disk power-on lifetime: 9661 hours (402 days + 13 hours)
  When the command that caused the error occurred, the device was active or idle.

  After command completion occurred, registers were:
  ER -- ST COUNT  LBA_48  LH LM LL DV DC
  -- -- -- == -- == == == -- -- -- -- --
  40 -- 51 00 08 00 00 0d 00 70 90 e0 00  Error: UNC 8 sectors at LBA = 0x0d007090 = 218132624

  Commands leading to the command that caused the error were:
  CR FEATR COUNT  LBA_48  LH LM LL DV DC  Powered_Up_Time  Command/Feature_Name
  -- == -- == -- == == == -- -- -- -- --  ---------------  --------------------
  25 00 00 00 08 00 00 00 70 0d 90 e0 00     00:00:21.304  READ DMA EXT
  25 00 00 00 08 00 00 00 70 0e 10 e0 00     00:00:21.304  READ DMA EXT
  25 00 00 00 08 00 00 00 70 0d 88 e0 00     00:00:21.303  READ DMA EXT
  25 00 00 00 08 00 00 00 70 0e 08 e0 00     00:00:21.294  READ DMA EXT
  25 00 00 00 08 00 00 00 70 0d 80 e0 00     00:00:21.294  READ DMA EXT

Error 508 [3] occurred at disk power-on lifetime: 9661 hours (402 days + 13 hours)
  When the command that caused the error occurred, the device was active or idle.

  After command completion occurred, registers were:
  ER -- ST COUNT  LBA_48  LH LM LL DV DC
  -- -- -- == -- == == == -- -- -- -- --
  40 -- 51 00 20 00 00 0d 00 70 78 e0 00  Error: UNC 32 sectors at LBA = 0x0d007078 = 218132600

  Commands leading to the command that caused the error were:
  CR FEATR COUNT  LBA_48  LH LM LL DV DC  Powered_Up_Time  Command/Feature_Name
  -- == -- == -- == == == -- -- -- -- --  ---------------  --------------------
  25 00 00 00 20 00 00 00 70 0d 78 e0 00     00:00:18.991  READ DMA EXT
  25 00 00 00 10 00 00 00 72 21 28 e0 00     00:00:18.991  READ DMA EXT
  25 00 00 00 08 00 00 00 72 20 f8 e0 00     00:00:18.991  READ DMA EXT
  25 00 00 00 08 00 00 00 72 20 d0 e0 00     00:00:18.991  READ DMA EXT
  25 00 00 00 10 00 00 00 72 20 70 e0 00     00:00:18.991  READ DMA EXT

Error 507 [2] occurred at disk power-on lifetime: 9657 hours (402 days + 9 hours)
  When the command that caused the error occurred, the device was active or idle.

  After command completion occurred, registers were:
  ER -- ST COUNT  LBA_48  LH LM LL DV DC
  -- -- -- == -- == == == -- -- -- -- --
  40 -- 51 00 01 00 02 59 00 fd ed e0 00  Error: UNC 1 sectors at LBA = 0x25900fded = 10083171821

  Commands leading to the command that caused the error were:
  CR FEATR COUNT  LBA_48  LH LM LL DV DC  Powered_Up_Time  Command/Feature_Name
  -- == -- == -- == == == -- -- -- -- --  ---------------  --------------------
  25 00 00 00 01 00 00 02 fd 59 ed e0 00     01:28:24.747  READ DMA EXT
  25 00 00 00 01 00 00 02 fd 59 ec e0 00     01:28:24.747  READ DMA EXT
  25 00 00 00 01 00 00 02 fd 59 eb e0 00     01:28:24.747  READ DMA EXT
  25 00 00 00 01 00 00 02 fd 59 ea e0 00     01:28:24.747  READ DMA EXT
  25 00 00 00 01 00 00 02 fd 59 e9 e0 00     01:28:24.747  READ DMA EXT

Error 506 [1] occurred at disk power-on lifetime: 9657 hours (402 days + 9 hours)
  When the command that caused the error occurred, the device was active or idle.

  After command completion occurred, registers were:
  ER -- ST COUNT  LBA_48  LH LM LL DV DC
  -- -- -- == -- == == == -- -- -- -- --
  40 -- 51 00 20 00 02 59 00 fd e0 e0 00  Error: UNC 32 sectors at LBA = 0x25900fde0 = 10083171808

  Commands leading to the command that caused the error were:
  CR FEATR COUNT  LBA_48  LH LM LL DV DC  Powered_Up_Time  Command/Feature_Name
  -- == -- == -- == == == -- -- -- -- --  ---------------  --------------------
  25 00 00 00 20 00 00 02 fd 59 e0 e0 00     01:28:21.940  READ DMA EXT
  35 00 00 01 00 00 00 02 5e 33 10 e0 00     01:28:21.318  WRITE DMA EXT
  35 00 00 01 00 00 00 02 fd 53 38 e0 00     01:28:20.616  WRITE DMA EXT
  35 00 00 01 00 00 00 02 fd 52 38 e0 00     01:28:20.615  WRITE DMA EXT
  35 00 00 01 00 00 00 02 fd 51 38 e0 00     01:28:20.613  WRITE DMA EXT

Error 505 [0] occurred at disk power-on lifetime: 9508 hours (396 days + 4 hours)
  When the command that caused the error occurred, the device was active or idle.

  After command completion occurred, registers were:
  ER -- ST COUNT  LBA_48  LH LM LL DV DC
  -- -- -- == -- == == == -- -- -- -- --
  40 -- 51 00 01 00 02 59 00 fd ed e0 00  Error: UNC 1 sectors at LBA = 0x25900fded = 10083171821

  Commands leading to the command that caused the error were:
  CR FEATR COUNT  LBA_48  LH LM LL DV DC  Powered_Up_Time  Command/Feature_Name
  -- == -- == -- == == == -- -- -- -- --  ---------------  --------------------
  25 00 00 00 01 00 00 02 fd 59 ed e0 00     00:43:21.263  READ DMA EXT
  25 00 00 00 01 00 00 02 fd 59 ec e0 00     00:43:21.263  READ DMA EXT
  25 00 00 00 01 00 00 02 fd 59 eb e0 00     00:43:21.263  READ DMA EXT
  25 00 00 00 01 00 00 02 fd 59 ea e0 00     00:43:21.263  READ DMA EXT
  25 00 00 00 01 00 00 02 fd 59 e9 e0 00     00:43:21.263  READ DMA EXT

Error 504 [23] occurred at disk power-on lifetime: 9508 hours (396 days + 4 hours)
  When the command that caused the error occurred, the device was active or idle.

  After command completion occurred, registers were:
  ER -- ST COUNT  LBA_48  LH LM LL DV DC
  -- -- -- == -- == == == -- -- -- -- --
  40 -- 51 00 20 00 02 59 00 fd e0 e0 00  Error: UNC 32 sectors at LBA = 0x25900fde0 = 10083171808

  Commands leading to the command that caused the error were:
  CR FEATR COUNT  LBA_48  LH LM LL DV DC  Powered_Up_Time  Command/Feature_Name
  -- == -- == -- == == == -- -- -- -- --  ---------------  --------------------
  25 00 00 00 20 00 00 02 fd 59 e0 e0 00     00:43:18.281  READ DMA EXT
  ea 00 00 00 00 61 16 27 00 00 00 e0 00     00:43:17.973  FLUSH CACHE EXT
  35 00 00 00 10 00 00 00 61 16 18 e0 00     00:43:17.973  WRITE DMA EXT
  35 00 00 00 08 00 00 03 00 95 60 e0 00     00:43:17.973  WRITE DMA EXT
  ea 00 00 00 00 61 15 9f 00 00 00 e0 00     00:43:17.473  FLUSH CACHE EXT

Error 503 [22] occurred at disk power-on lifetime: 9414 hours (392 days + 6 hours)
  When the command that caused the error occurred, the device was active or idle.

  After command completion occurred, registers were:
  ER -- ST COUNT  LBA_48  LH LM LL DV DC
  -- -- -- == -- == == == -- -- -- -- --
  40 -- 51 01 00 00 02 59 00 fd 00 e0 00  Error: UNC 256 sectors at LBA = 0x25900fd00 = 10083171584

  Commands leading to the command that caused the error were:
  CR FEATR COUNT  LBA_48  LH LM LL DV DC  Powered_Up_Time  Command/Feature_Name
  -- == -- == -- == == == -- -- -- -- --  ---------------  --------------------
  25 00 00 01 00 00 00 02 fd 59 00 e0 00     00:35:43.019  READ DMA EXT
  25 00 00 00 02 00 00 02 fd 59 fc e0 00     00:35:43.002  READ DMA EXT
  25 00 00 01 00 00 00 02 fd 59 00 e0 00     00:35:40.654  READ DMA EXT
  25 00 00 00 02 00 00 02 fd 59 fa e0 00     00:35:40.636  READ DMA EXT
  25 00 00 01 00 00 00 02 fd 59 00 e0 00     00:35:37.866  READ DMA EXT

SMART Extended Self-test Log Version: 1 (1 sectors)
No self-tests have been logged.  [To run self-tests, use: smartctl -t]

SMART Selective self-test log data structure revision number 1
 SPAN  MIN_LBA  MAX_LBA  CURRENT_TEST_STATUS
    1        0        0  Not_testing
    2        0        0  Not_testing
    3        0        0  Not_testing
    4        0        0  Not_testing
    5        0        0  Not_testing
Selective self-test flags (0x0):
  After scanning selected spans, do NOT read-scan remainder of disk.
If Selective self-test is pending on power-up, resume after 0 minute delay.

SCT Status Version:                  2
SCT Version (vendor specific):       258 (0x0102)
Device State:                        SMART Off-line Data Collection executing in background (4)
Current Temperature:                    34 Celsius
Power Cycle Min/Max Temperature:     34/34 Celsius
Lifetime    Min/Max Temperature:     34/51 Celsius
Under/Over Temperature Limit Count:   0/0

SCT Temperature History Version:     2
Temperature Sampling Period:         1 minute
Temperature Logging Interval:        1 minute
Min/Max recommended Temperature:      0/60 Celsius
Min/Max Temperature Limit:           -41/85 Celsius
Temperature History Size (Index):    478 (190)

SCT Error Recovery Control:
           Read: Disabled
          Write: Disabled

Device Statistics (GP/SMART Log 0x04) not supported

Pending Defects log (GP Log 0x0c) not supported

SATA Phy Event Counters (GP Log 0x11)
ID      Size     Value  Description
0x0001  2            0  Command failed due to ICRC error
0x0002  2            0  R_ERR response for data FIS
0x0003  2            0  R_ERR response for device-to-host data FIS
0x0004  2            0  R_ERR response for host-to-device data FIS
0x0005  2            0  R_ERR response for non-data FIS
0x0006  2            0  R_ERR response for device-to-host non-data FIS
0x0007  2            0  R_ERR response for host-to-device non-data FIS
0x000a  2            1  Device-to-host register FISes sent due to a COMRESET
0x8000  4          705  Vendor specific



