smartctl 7.2 2020-12-30 r5155 [x86_64-linux-5.15.0-91-generic] (local build)
Copyright (C) 2002-20, Bruce Allen, Christian Franke, www.smartmontools.org

=== START OF INFORMATION SECTION ===
Model Number:                       SDLC2CLR-016T-3NA1
Serial Number:                      --
Firmware Version:                   N009
PCI Vendor/Subsystem ID:            0x15b7
IEEE OUI Identifier:                0x731100
Controller ID:                      0
NVMe Version:                       1.2
Number of Namespaces:               1
Namespace 1 Size/Capacity:          1,600,321,314,816 [1.60 TB]
Namespace 1 Formatted LBA Size:     512
Namespace 1 IEEE EUI-64:            267900 ...
Local Time is:                      Mon Jan 15 21:46:19 2024 UTC
Firmware Updates (0x14):            2 Slots, no Reset required
Optional Admin Commands (0x0006):   Format Frmw_DL
Optional NVM Commands (0x001f):     Comp Wr_Unc DS_Mngmt Wr_Zero Sav/Sel_Feat
Maximum Data Transfer Size:         32 Pages
Warning  Comp. Temp. Threshold:     70 Celsius
Critical Comp. Temp. Threshold:     75 Celsius

Supported Power States
St Op     Max   Active     Idle   RL RT WL WT  Ent_Lat  Ex_Lat
 0 +    12.00W       -        -    0  0  0  0    15000   15000
 1 +    11.00W       -        -    1  1  1  1    15000   15000
 2 +     9.00W       -        -    2  2  2  2    15000   15000

Supported LBA Sizes (NSID 0x1)
Id Fmt  Data  Metadt  Rel_Perf
 0 +     512       0         0
 1 -    4096       0         0

=== START OF SMART DATA SECTION ===
SMART overall-health self-assessment test result: PASSED

SMART/Health Information (NVMe Log 0x02)
Critical Warning:                   0x00
Temperature:                        31 Celsius
Available Spare:                    100%
Available Spare Threshold:          1%
Percentage Used:                    0%
Data Units Read:                    2,969,518 [1.52 TB]
Data Units Written:                 1 [512 KB]
Host Read Commands:                 12,146,894
Host Write Commands:                13
Controller Busy Time:               0
Power Cycles:                       111
Power On Hours:                     197
Unsafe Shutdowns:                   0
Media and Data Integrity Errors:    0
Error Information Log Entries:      0
Warning  Comp. Temperature Time:    0
Critical Comp. Temperature Time:    0
Temperature Sensor 1:               31 Celsius

Error Information (NVMe Log 0x01, 16 of 64 entries)
No Errors Logged



