smartctl 7.4 2023-08-01 r5530 [x86_64-linux-6.5.2-arch1-1] (local build)
Copyright (C) 2002-23, Bruce Allen, Christian Franke, www.smartmontools.org

=== START OF INFORMATION SECTION ===
Model Number:                       Seagate FireCuda 530 ZP4000GM30023
Serial Number:                      --
Firmware Version:                   SU6SM001
PCI Vendor/Subsystem ID:            0x1bb1
IEEE OUI Identifier:                0x6479a7
Total NVM Capacity:                 4,000,787,030,016 [4.00 TB]
Unallocated NVM Capacity:           0
Controller ID:                      1
NVMe Version:                       1.4
Number of Namespaces:               1
Namespace 1 Size/Capacity:          4,000,787,030,016 [4.00 TB]
Namespace 1 Formatted LBA Size:     512
Namespace 1 IEEE EUI-64:            6479a7 ...
Local Time is:                      Mon Sep 11 14:21:28 2023 EDT
Firmware Updates (0x18):            4 Slots, no Reset required
Optional Admin Commands (0x0017):   Security Format Frmw_DL Self_Test
Optional NVM Commands (0x005d):     Comp DS_Mngmt Wr_Zero Sav/Sel_Feat Timestmp
Log Page Attributes (0x08):         Telmtry_Lg
Maximum Data Transfer Size:         512 Pages
Warning  Comp. Temp. Threshold:     90 Celsius
Critical Comp. Temp. Threshold:     95 Celsius

Supported Power States
St Op     Max   Active     Idle   RL RT WL WT  Ent_Lat  Ex_Lat
 0 +     8.60W       -        -    0  0  0  0        0       0
 1 +     3.00W       -        -    1  1  1  1        0       0
 2 +     2.90W       -        -    2  2  2  2        0       0
 3 -   0.0300W       -        -    3  3  3  3     2500    7500
 4 -   0.0050W       -        -    4  4  4  4    10500   65000

Supported LBA Sizes (NSID 0x1)
Id Fmt  Data  Metadt  Rel_Perf
 0 +     512       0         2
 1 -    4096       0         1

=== START OF SMART DATA SECTION ===
SMART overall-health self-assessment test result: PASSED

SMART/Health Information (NVMe Log 0x02)
Critical Warning:                   0x00
Temperature:                        28 Celsius
Available Spare:                    100%
Available Spare Threshold:          5%
Percentage Used:                    1%
Data Units Read:                    73,252,492 [37.5 TB]
Data Units Written:                 89,894,024 [46.0 TB]
Host Read Commands:                 526,092,981
Host Write Commands:                941,702,816
Controller Busy Time:               2,205
Power Cycles:                       1,674
Power On Hours:                     5,840
Unsafe Shutdowns:                   79
Media and Data Integrity Errors:    0
Error Information Log Entries:      4,672
Warning  Comp. Temperature Time:    0
Critical Comp. Temperature Time:    0

Error Information (NVMe Log 0x01, 16 of 63 entries)
Num   ErrCount  SQId   CmdId  Status  PELoc          LBA  NSID    VS  Message
  0       4672     0  0x0004  0x4004  0x028            0     0     -  Invalid Field in Command
  1       4671     0  0x000f  0x4004      -            0     0     -  Invalid Field in Command

Read Self-test Log failed: Invalid Field in Command (0x2002)



