smartctl 7.2 2020-12-30 r5155 [x86_64-linux-5.10.14-desktop-1omv4002] (OpenMandriva Lx 7.2-2)
Copyright (C) 2002-20, Bruce Allen, Christian Franke, www.smartmontools.org

=== START OF INFORMATION SECTION ===
Model Family:     SAMSUNG SpinPoint M7
Device Model:     SAMSUNG HM500JI
Serial Number:    --
LU WWN Device Id: 5 0024e9 ...
Firmware Version: 2AC101C4
User Capacity:    500,107,862,016 bytes [500 GB]
Sector Size:      512 bytes logical/physical
Form Factor:      2.5 inches
Device is:        In smartctl database [for details use: -P show]
ATA Version is:   ATA8-ACS T13/1699-D revision 6
SATA Version is:  SATA 2.6, 3.0 Gb/s
Local Time is:    Mon Jul 26 11:48:13 2021 UTC
SMART support is: Available - device has SMART capability.
SMART support is: Enabled
AAM level is:     128 (quiet), recommended: 254
APM feature is:   Disabled
Rd look-ahead is: Enabled
Write cache is:   Enabled
DSN feature is:   Unavailable
ATA Security is:  Disabled, frozen [SEC2]
Wt Cache Reorder: Enabled

=== START OF READ SMART DATA SECTION ===
SMART overall-health self-assessment test result: PASSED

General SMART Values:
Offline data collection status:  (0x00)	Offline data collection activity
					was never started.
					Auto Offline Data Collection: Disabled.
Self-test execution status:      (   0)	The previous self-test routine completed
					without error or no self-test has ever 
					been run.
Total time to complete Offline 
data collection: 		( 7800) seconds.
Offline data collection
capabilities: 			 (0x5b) SMART execute Offline immediate.
					Auto Offline data collection on/off support.
					Suspend Offline collection upon new
					command.
					Offline surface scan supported.
					Self-test supported.
					No Conveyance Self-test supported.
					Selective Self-test supported.
SMART capabilities:            (0x0003)	Saves SMART data before entering
					power-saving mode.
					Supports SMART auto save timer.
Error logging capability:        (0x01)	Error logging supported.
					General Purpose Logging supported.
Short self-test routine 
recommended polling time: 	 (   2) minutes.
Extended self-test routine
recommended polling time: 	 ( 130) minutes.
SCT capabilities: 	       (0x003f)	SCT Status supported.
					SCT Error Recovery Control supported.
					SCT Feature Control supported.
					SCT Data Table supported.

SMART Attributes Data Structure revision number: 16
Vendor Specific SMART Attributes with Thresholds:
ID# ATTRIBUTE_NAME          FLAGS    VALUE WORST THRESH FAIL RAW_VALUE
  1 Raw_Read_Error_Rate     POSR-K   100   100   051    -    25854
  2 Throughput_Performance  -OS--K   252   252   000    -    0
  3 Spin_Up_Time            PO---K   092   090   025    -    2670
  4 Start_Stop_Count        -O--CK   099   099   000    -    1547
  5 Reallocated_Sector_Ct   PO--CK   252   252   010    -    0
  7 Seek_Error_Rate         -OSR-K   252   252   051    -    0
  8 Seek_Time_Performance   --S--K   252   252   015    -    0
  9 Power_On_Hours          -O--CK   100   100   000    -    18698
 10 Spin_Retry_Count        -O--CK   252   252   051    -    0
 11 Calibration_Retry_Count -O--CK   100   100   000    -    18
 12 Power_Cycle_Count       -O--CK   099   099   000    -    1564
191 G-Sense_Error_Rate      -O---K   100   100   000    -    866
192 Power-Off_Retract_Count -O---K   252   252   000    -    0
194 Temperature_Celsius     -O----   064   057   000    -    30 (Min/Max 9/43)
195 Hardware_ECC_Recovered  -O-RCK   100   100   000    -    0
196 Reallocated_Event_Count -O--CK   252   252   000    -    0
197 Current_Pending_Sector  -O--CK   252   098   000    -    0
198 Offline_Uncorrectable   ----CK   252   252   000    -    0
199 UDMA_CRC_Error_Count    -OS-CK   200   200   000    -    0
200 Multi_Zone_Error_Rate   -O-R-K   100   100   000    -    41
223 Load_Retry_Count        -O--CK   100   100   000    -    18
225 Load_Cycle_Count        -O--CK   015   015   000    -    863441
                            ||||||_ K auto-keep
                            |||||__ C event count
                            ||||___ R error rate
                            |||____ S speed/performance
                            ||_____ O updated online
                            |______ P prefailure warning

General Purpose Log Directory Version 1
SMART           Log Directory Version 1 [multi-sector log support]
Address    Access  R/W   Size  Description
0x00       GPL,SL  R/O      1  Log Directory
0x01           SL  R/O      1  Summary SMART error log
0x02           SL  R/O      2  Comprehensive SMART error log
0x03       GPL     R/O      2  Ext. Comprehensive SMART error log
0x06           SL  R/O      1  SMART self-test log
0x07       GPL     R/O      2  Extended self-test log
0x09           SL  R/W      1  Selective self-test log
0x10       GPL     R/O      1  NCQ Command Error log
0x11       GPL     R/O      1  SATA Phy Event Counters log
0x80-0x9f  GPL,SL  R/W     16  Host vendor specific log
0xbb       GPL     VS       4  Device vendor specific log
0xbc       GPL     VS       2  Device vendor specific log
0xe0       GPL,SL  R/W      1  SCT Command/Status
0xe1       GPL,SL  R/W      1  SCT Data Transfer

SMART Extended Comprehensive Error Log Version: 1 (2 sectors)
Device Error Count: 19377 (device log contains only the most recent 8 errors)
	CR     = Command Register
	FEATR  = Features Register
	COUNT  = Count (was: Sector Count) Register
	LBA_48 = Upper bytes of LBA High/Mid/Low Registers ]  ATA-8
	LH     = LBA High (was: Cylinder High) Register    ]   LBA
	LM     = LBA Mid (was: Cylinder Low) Register      ] Register
	LL     = LBA Low (was: Sector Number) Register     ]
	DV     = Device (was: Device/Head) Register
	DC     = Device Control Register
	ER     = Error register
	ST     = Status register
Powered_Up_Time is measured from power on, and printed as
DDd+hh:mm:SS.sss where DD=days, hh=hours, mm=minutes,
SS=sec, and sss=millisec. It "wraps" after 49.710 days.

Error 19377 [0] occurred at disk power-on lifetime: 18609 hours (775 days + 9 hours)
  When the command that caused the error occurred, the device was active or idle.

  After command completion occurred, registers were:
  ER -- ST COUNT  LBA_48  LH LM LL DV DC
  -- -- -- == -- == == == -- -- -- -- --
  40 -- 51 00 b1 00 00 11 24 39 47 e0 00  Error: UNC at LBA = 0x11243947 = 287586631

  Commands leading to the command that caused the error were:
  CR FEATR COUNT  LBA_48  LH LM LL DV DC  Powered_Up_Time  Command/Feature_Name
  -- == -- == -- == == == -- -- -- -- --  ---------------  --------------------
  42 00 00 01 00 00 00 11 24 38 f8 e0 00     00:00:08.734  READ VERIFY SECTOR(S) EXT
  61 00 00 00 02 00 00 02 d6 6a 18 40 00     00:00:08.734  WRITE FPDMA QUEUED
  61 00 00 00 08 00 00 00 3d 6d d8 40 00     00:00:08.734  WRITE FPDMA QUEUED
  42 00 00 01 00 00 00 11 24 37 f8 e0 00     00:00:08.733  READ VERIFY SECTOR(S) EXT
  42 00 00 01 00 00 00 11 24 36 f8 e0 00     00:00:08.733  READ VERIFY SECTOR(S) EXT

Error 19376 [7] occurred at disk power-on lifetime: 18609 hours (775 days + 9 hours)
  When the command that caused the error occurred, the device was active or idle.

  After command completion occurred, registers were:
  ER -- ST COUNT  LBA_48  LH LM LL DV DC
  -- -- -- == -- == == == -- -- -- -- --
  40 -- 51 00 48 00 00 11 23 ec 70 e0 00  Error: UNC at LBA = 0x1123ec70 = 287566960

  Commands leading to the command that caused the error were:
  CR FEATR COUNT  LBA_48  LH LM LL DV DC  Powered_Up_Time  Command/Feature_Name
  -- == -- == -- == == == -- -- -- -- --  ---------------  --------------------
  42 00 00 00 80 00 00 11 23 ec 38 e0 00     00:00:08.720  READ VERIFY SECTOR(S) EXT
  61 00 00 00 08 00 00 02 ed 29 88 40 00     00:00:08.720  WRITE FPDMA QUEUED
  42 00 00 00 40 00 00 11 23 f7 38 e0 00     00:00:08.720  READ VERIFY SECTOR(S) EXT
  61 00 00 00 08 00 00 02 ed 29 80 40 00     00:00:08.720  WRITE FPDMA QUEUED
  42 00 00 01 00 00 00 11 23 f6 38 e0 00     00:00:08.720  READ VERIFY SECTOR(S) EXT

Error 19375 [6] occurred at disk power-on lifetime: 18609 hours (775 days + 9 hours)
  When the command that caused the error occurred, the device was active or idle.

  After command completion occurred, registers were:
  ER -- ST COUNT  LBA_48  LH LM LL DV DC
  -- -- -- == -- == == == -- -- -- -- --
  40 -- 51 00 93 00 00 11 23 ec a5 e0 00  Error: UNC at LBA = 0x1123eca5 = 287567013

  Commands leading to the command that caused the error were:
  CR FEATR COUNT  LBA_48  LH LM LL DV DC  Powered_Up_Time  Command/Feature_Name
  -- == -- == -- == == == -- -- -- -- --  ---------------  --------------------
  42 00 00 01 00 00 00 11 23 ec 38 e0 00     00:00:08.715  READ VERIFY SECTOR(S) EXT
  42 00 00 01 00 00 00 11 23 eb 38 e0 00     00:00:08.715  READ VERIFY SECTOR(S) EXT
  42 00 00 01 00 00 00 11 23 ea 38 e0 00     00:00:08.715  READ VERIFY SECTOR(S) EXT
  42 00 00 01 00 00 00 11 23 e9 38 e0 00     00:00:08.715  READ VERIFY SECTOR(S) EXT
  42 00 00 01 00 00 00 11 23 e8 38 e0 00     00:00:08.715  READ VERIFY SECTOR(S) EXT

Error 19374 [5] occurred at disk power-on lifetime: 18609 hours (775 days + 9 hours)
  When the command that caused the error occurred, the device was active or idle.

  After command completion occurred, registers were:
  ER -- ST COUNT  LBA_48  LH LM LL DV DC
  -- -- -- == -- == == == -- -- -- -- --
  40 -- 51 00 ff 00 00 11 23 7a 79 e0 00  Error: UNC at LBA = 0x11237a79 = 287537785

  Commands leading to the command that caused the error were:
  CR FEATR COUNT  LBA_48  LH LM LL DV DC  Powered_Up_Time  Command/Feature_Name
  -- == -- == -- == == == -- -- -- -- --  ---------------  --------------------
  42 00 00 01 00 00 00 11 23 7a 78 e0 00     00:00:08.697  READ VERIFY SECTOR(S) EXT
  42 00 00 00 40 00 00 11 23 7a 38 e0 00     00:00:08.697  READ VERIFY SECTOR(S) EXT
  42 00 00 01 00 00 00 11 23 79 38 e0 00     00:00:08.697  READ VERIFY SECTOR(S) EXT
  42 00 00 01 00 00 00 11 23 78 38 e0 00     00:00:08.697  READ VERIFY SECTOR(S) EXT
  42 00 00 01 00 00 00 11 23 77 38 e0 00     00:00:08.697  READ VERIFY SECTOR(S) EXT

Error 19373 [4] occurred at disk power-on lifetime: 18609 hours (775 days + 9 hours)
  When the command that caused the error occurred, the device was active or idle.

  After command completion occurred, registers were:
  ER -- ST COUNT  LBA_48  LH LM LL DV DC
  -- -- -- == -- == == == -- -- -- -- --
  40 -- 51 00 04 00 00 11 23 57 fc e0 00  Error: UNC at LBA = 0x112357fc = 287528956

  Commands leading to the command that caused the error were:
  CR FEATR COUNT  LBA_48  LH LM LL DV DC  Powered_Up_Time  Command/Feature_Name
  -- == -- == -- == == == -- -- -- -- --  ---------------  --------------------
  42 00 00 00 08 00 00 11 23 57 f8 e0 00     00:00:08.693  READ VERIFY SECTOR(S) EXT
  61 00 00 00 09 00 00 00 59 7b 90 40 00     00:00:08.693  WRITE FPDMA QUEUED
  42 00 00 00 10 00 00 11 23 58 08 e0 00     00:00:08.692  READ VERIFY SECTOR(S) EXT
  ea 00 00 00 00 00 00 00 00 00 00 e0 00     00:00:08.692  FLUSH CACHE EXT
  42 00 00 00 10 00 00 11 23 57 f8 e0 00     00:00:08.691  READ VERIFY SECTOR(S) EXT

Error 19372 [3] occurred at disk power-on lifetime: 18609 hours (775 days + 9 hours)
  When the command that caused the error occurred, the device was active or idle.

  After command completion occurred, registers were:
  ER -- ST COUNT  LBA_48  LH LM LL DV DC
  -- -- -- == -- == == == -- -- -- -- --
  40 -- 51 00 0c 00 00 11 23 57 fc e0 00  Error: UNC at LBA = 0x112357fc = 287528956

  Commands leading to the command that caused the error were:
  CR FEATR COUNT  LBA_48  LH LM LL DV DC  Powered_Up_Time  Command/Feature_Name
  -- == -- == -- == == == -- -- -- -- --  ---------------  --------------------
  42 00 00 00 10 00 00 11 23 57 f8 e0 00     00:00:08.691  READ VERIFY SECTOR(S) EXT
  61 00 00 00 08 00 00 00 63 0f 10 40 00     00:00:08.691  WRITE FPDMA QUEUED
  42 00 00 00 20 00 00 11 23 58 18 e0 00     00:00:08.690  READ VERIFY SECTOR(S) EXT
  61 00 00 00 08 00 00 00 63 0f 00 40 00     00:00:08.690  WRITE FPDMA QUEUED
  42 00 00 00 20 00 00 11 23 57 f8 e0 00     00:00:08.688  READ VERIFY SECTOR(S) EXT

Error 19371 [2] occurred at disk power-on lifetime: 18609 hours (775 days + 9 hours)
  When the command that caused the error occurred, the device was active or idle.

  After command completion occurred, registers were:
  ER -- ST COUNT  LBA_48  LH LM LL DV DC
  -- -- -- == -- == == == -- -- -- -- --
  40 -- 51 00 1c 00 00 11 23 57 fc e0 00  Error: UNC at LBA = 0x112357fc = 287528956

  Commands leading to the command that caused the error were:
  CR FEATR COUNT  LBA_48  LH LM LL DV DC  Powered_Up_Time  Command/Feature_Name
  -- == -- == -- == == == -- -- -- -- --  ---------------  --------------------
  42 00 00 00 20 00 00 11 23 57 f8 e0 00     00:00:08.688  READ VERIFY SECTOR(S) EXT
  61 00 00 00 08 00 00 00 63 0f 08 40 00     00:00:08.688  WRITE FPDMA QUEUED
  42 00 00 00 40 00 00 11 23 58 38 e0 00     00:00:08.688  READ VERIFY SECTOR(S) EXT
  61 00 00 00 01 00 00 04 20 42 f0 40 00     00:00:08.688  WRITE FPDMA QUEUED
  61 00 00 00 01 00 00 00 07 31 d0 40 00     00:00:08.688  WRITE FPDMA QUEUED

Error 19370 [1] occurred at disk power-on lifetime: 18609 hours (775 days + 9 hours)
  When the command that caused the error occurred, the device was active or idle.

  After command completion occurred, registers were:
  ER -- ST COUNT  LBA_48  LH LM LL DV DC
  -- -- -- == -- == == == -- -- -- -- --
  40 -- 51 00 32 00 00 11 23 58 06 e0 00  Error: UNC at LBA = 0x11235806 = 287528966

  Commands leading to the command that caused the error were:
  CR FEATR COUNT  LBA_48  LH LM LL DV DC  Powered_Up_Time  Command/Feature_Name
  -- == -- == -- == == == -- -- -- -- --  ---------------  --------------------
  42 00 00 00 40 00 00 11 23 57 f8 e0 00     00:00:08.686  READ VERIFY SECTOR(S) EXT
  ea 00 00 00 00 00 00 00 00 00 00 e0 00     00:00:08.685  FLUSH CACHE EXT
  42 00 00 00 40 00 00 11 23 41 b8 e0 00     00:00:08.685  READ VERIFY SECTOR(S) EXT
  61 00 00 00 28 00 00 00 64 48 d0 40 00     00:00:08.685  WRITE FPDMA QUEUED
  42 00 00 00 40 00 00 11 23 41 78 e0 00     00:00:08.685  READ VERIFY SECTOR(S) EXT

SMART Extended Self-test Log Version: 1 (2 sectors)
No self-tests have been logged.  [To run self-tests, use: smartctl -t]

SMART Selective self-test log data structure revision number 0
Note: revision number not 1 implies that no selective self-test has ever been run
 SPAN  MIN_LBA  MAX_LBA  CURRENT_TEST_STATUS
    1        0        0  Completed [00% left] (0-65535)
    2        0        0  Not_testing
    3        0        0  Not_testing
    4        0        0  Not_testing
    5        0        0  Not_testing
Selective self-test flags (0x0):
  After scanning selected spans, do NOT read-scan remainder of disk.
If Selective self-test is pending on power-up, resume after 0 minute delay.

SCT Status Version:                  2
SCT Version (vendor specific):       256 (0x0100)
Device State:                        Active (0)
Current Temperature:                    29 Celsius
Power Cycle Min/Max Temperature:     28/29 Celsius
Lifetime    Min/Max Temperature:     14/60 Celsius
Specified Max Operating Temperature:    80 Celsius
Under/Over Temperature Limit Count:   0/0

SCT Temperature History Version:     2
Temperature Sampling Period:         5 minutes
Temperature Logging Interval:        5 minutes
Min/Max recommended Temperature:     -5/80 Celsius
Min/Max Temperature Limit:           -10/85 Celsius
Temperature History Size (Index):    128 (27)

SCT Error Recovery Control:
           Read: Disabled
          Write: Disabled

Device Statistics (GP/SMART Log 0x04) not supported

Pending Defects log (GP Log 0x0c) not supported

SATA Phy Event Counters (GP Log 0x11)
ID      Size     Value  Description
0x0001  4            0  Command failed due to ICRC error
0x0002  4            0  R_ERR response for data FIS
0x0003  4            0  R_ERR response for device-to-host data FIS
0x0004  4            0  R_ERR response for host-to-device data FIS
0x0005  4            0  R_ERR response for non-data FIS
0x0006  4            0  R_ERR response for device-to-host non-data FIS
0x0007  4            0  R_ERR response for host-to-device non-data FIS
0x0008  4            0  Device-to-host non-data FIS retries
0x0009  4          184  Transition from drive PhyRdy to drive PhyNRdy
0x000a  4            6  Device-to-host register FISes sent due to a COMRESET
0x000b  4            0  CRC errors within host-to-device FIS
0x000d  4            0  Non-CRC errors within host-to-device FIS
0x000f  4            0  R_ERR response for host-to-device data FIS, CRC
0x0010  4            0  R_ERR response for host-to-device data FIS, non-CRC
0x0012  4            0  R_ERR response for host-to-device non-data FIS, CRC
0x0013  4            0  R_ERR response for host-to-device non-data FIS, non-CRC
0x8e00  4            0  Vendor specific
0x8e01  4            0  Vendor specific
0x8e02  4            0  Vendor specific
0x8e03  4            0  Vendor specific
0x8e04  4            0  Vendor specific
0x8e05  4            0  Vendor specific
0x8e06  4            0  Vendor specific
0x8e07  4            0  Vendor specific
0x8e08  4            0  Vendor specific
0x8e09  4            0  Vendor specific
0x8e0a  4            0  Vendor specific
0x8e0b  4            0  Vendor specific
0x8e0c  4            0  Vendor specific
0x8e0d  4            0  Vendor specific
0x8e0e  4            0  Vendor specific
0x8e0f  4            0  Vendor specific
0x8e10  4            0  Vendor specific
0x8e11  4            0  Vendor specific

