smartctl 7.4 2023-08-01 r5530 [x86_64-linux-6.11.6-zen1-1-zen] (local build)
Copyright (C) 2002-23, Bruce Allen, Christian Franke, www.smartmontools.org

=== START OF INFORMATION SECTION ===
Device Model:     MTFDDAV256MAZ-1AE1ZABHA
Serial Number:    --
LU WWN Device Id: 5 00a075 ...
Firmware Version: M104
User Capacity:    256,060,514,304 bytes [256 GB]
Sector Sizes:     512 bytes logical, 4096 bytes physical
Rotation Rate:    Solid State Device
Form Factor:      < 1.8 inches
TRIM Command:     Available, deterministic, zeroed
Device is:        Not in smartctl database 7.3/5528
ATA Version is:   ACS-2, ATA8-ACS T13/1699-D revision 6
SATA Version is:  SATA 3.1, 6.0 Gb/s (current: 6.0 Gb/s)
Local Time is:    Mon Nov 11 12:33:06 2024 AWST
SMART support is: Available - device has SMART capability.
SMART support is: Enabled
AAM feature is:   Unavailable
APM level is:     254 (maximum performance)
Rd look-ahead is: Enabled
Write cache is:   Enabled
DSN feature is:   Unavailable
ATA Security is:  Disabled, frozen [SEC2]
Wt Cache Reorder: Enabled

=== START OF READ SMART DATA SECTION ===
SMART overall-health self-assessment test result: PASSED

General SMART Values:
Offline data collection status:  (0x80)	Offline data collection activity
					was never started.
					Auto Offline Data Collection: Enabled.
Self-test execution status:      (   0)	The previous self-test routine completed
					without error or no self-test has ever 
					been run.
Total time to complete Offline 
data collection: 		( 1190) seconds.
Offline data collection
capabilities: 			 (0x7b) SMART execute Offline immediate.
					Auto Offline data collection on/off support.
					Suspend Offline collection upon new
					command.
					Offline surface scan supported.
					Self-test supported.
					Conveyance Self-test supported.
					Selective Self-test supported.
SMART capabilities:            (0x0003)	Saves SMART data before entering
					power-saving mode.
					Supports SMART auto save timer.
Error logging capability:        (0x01)	Error logging supported.
					General Purpose Logging supported.
Short self-test routine 
recommended polling time: 	 (   2) minutes.
Extended self-test routine
recommended polling time: 	 (   3) minutes.
Conveyance self-test routine
recommended polling time: 	 (   3) minutes.
SCT capabilities: 	       (0x0035)	SCT Status supported.
					SCT Feature Control supported.
					SCT Data Table supported.

SMART Attributes Data Structure revision number: 32
Vendor Specific SMART Attributes with Thresholds:
ID# ATTRIBUTE_NAME          FLAGS    VALUE WORST THRESH FAIL RAW_VALUE
  1 Raw_Read_Error_Rate     POSR-K   100   100   050    -    20
  5 Reallocated_Sector_Ct   PO--CK   100   100   010    -    0
  9 Power_On_Hours          -O--CK   100   100   000    -    8638
 11 Unknown_SSD_Attribute   -O---K   100   100   000    -    175
 12 Power_Cycle_Count       -O--CK   100   100   000    -    2159
170 Unknown_Attribute       PO--CK   100   100   010    -    8
171 Unknown_Attribute       -O---K   100   100   000    -    0
172 Unknown_Attribute       -O--CK   100   100   000    -    0
173 Unknown_Attribute       PO--CK   099   099   010    -    54
174 Unknown_Attribute       -O--CK   100   100   000    -    175
181 Program_Fail_Cnt_Total  -O---K   100   100   000    -    3079495615119
183 Runtime_Bad_Block       -O--CK   100   100   000    -    0
184 End-to-End_Error        PO--CK   100   100   097    -    0
187 Reported_Uncorrect      -O--CK   100   100   000    -    0
188 Command_Timeout         -O--CK   100   100   000    -    2046
190 Airflow_Temperature_Cel -O---K   064   020   000    -    36 (Min/Max 11/80)
194 Temperature_Celsius     -O---K   064   020   000    -    36 (Min/Max 11/80)
195 Hardware_ECC_Recovered  -O-RCK   100   100   000    -    2900450573
196 Reallocated_Event_Count -O--CK   100   100   000    -    8
197 Current_Pending_Sector  -O--CK   100   100   000    -    0
198 Offline_Uncorrectable   ----CK   100   100   000    -    0
199 UDMA_CRC_Error_Count    -O---K   100   100   000    -    0
                            ||||||_ K auto-keep
                            |||||__ C event count
                            ||||___ R error rate
                            |||____ S speed/performance
                            ||_____ O updated online
                            |______ P prefailure warning

General Purpose Log Directory Version 1
SMART           Log Directory Version 1 [multi-sector log support]
Address    Access  R/W   Size  Description
0x00       GPL,SL  R/O      1  Log Directory
0x01           SL  R/O      1  Summary SMART error log
0x02           SL  R/O     51  Comprehensive SMART error log
0x03       GPL     R/O  16383  Ext. Comprehensive SMART error log
0x04       GPL,SL  R/O    255  Device Statistics log
0x06           SL  R/O      1  SMART self-test log
0x07       GPL     R/O      1  Extended self-test log
0x09           SL  R/W      1  Selective self-test log
0x10       GPL     R/O      1  NCQ Command Error log
0x11       GPL     R/O      1  SATA Phy Event Counters log
0x13       GPL     R/O      1  SATA NCQ Send and Receive log
0x24       GPL     R/O    429  Current Device Internal Status Data log
0x25       GPL     R/O    145  Saved Device Internal Status Data log
0x30       GPL,SL  R/O      9  IDENTIFY DEVICE data log
0x80-0x83      SL  R/W      1  Host vendor specific log
0x84-0x9f  GPL,SL  R/W     16  Host vendor specific log
0xa0       GPL     VS    2000  Device vendor specific log
0xa0       SL      VS     208  Device vendor specific log
0xa1-0xb5  GPL,SL  VS       1  Device vendor specific log
0xb6       GPL     VS    8193  Device vendor specific log
0xb6       SL      VS       1  Device vendor specific log
0xb7-0xbf  GPL,SL  VS       1  Device vendor specific log
0xc0       GPL,SL  VS      80  Device vendor specific log
0xc1-0xdf  GPL,SL  VS       1  Device vendor specific log
0xe0       GPL,SL  R/W      1  SCT Command/Status
0xe1       GPL,SL  R/W      1  SCT Data Transfer

SMART Extended Comprehensive Error Log Version: 1 (16383 sectors)
No Errors Logged

SMART Extended Self-test Log Version: 1 (1 sectors)
Num  Test_Description    Status                  Remaining  LifeTime(hours)  LBA_of_first_error
# 1  Vendor (0xff)       Completed without error       00%      8583         -
# 2  Vendor (0xff)       Completed without error       00%      8544         -
# 3  Vendor (0xff)       Completed without error       00%      8404         -
# 4  Vendor (0xff)       Completed without error       00%      8210         -
# 5  Vendor (0xff)       Completed without error       00%      8148         -
# 6  Vendor (0xff)       Completed without error       00%      8073         -
# 7  Vendor (0xff)       Completed without error       00%      8052         -
# 8  Vendor (0xff)       Completed without error       00%      8001         -
# 9  Vendor (0xff)       Completed without error       00%      7955         -
#10  Vendor (0xff)       Completed without error       00%      7899         -
#11  Vendor (0xff)       Completed without error       00%      7851         -
#12  Vendor (0xff)       Completed without error       00%      7796         -
#13  Vendor (0xff)       Completed without error       00%      7748         -
#14  Vendor (0xff)       Completed without error       00%      7700         -
#15  Vendor (0xff)       Completed without error       00%      7653         -
#16  Vendor (0xff)       Completed without error       00%      7602         -
#17  Vendor (0xff)       Completed without error       00%      7545         -
#18  Vendor (0xff)       Completed without error       00%      7533         -
#19  Vendor (0xff)       Completed without error       00%      7496         -

SMART Selective self-test log data structure revision number 1
 SPAN  MIN_LBA  MAX_LBA  CURRENT_TEST_STATUS
    1        0        0  Not_testing
    2        0        0  Not_testing
    3        0        0  Not_testing
    4        0        0  Not_testing
    5        0        0  Not_testing
Selective self-test flags (0x0):
  After scanning selected spans, do NOT read-scan remainder of disk.
If Selective self-test is pending on power-up, resume after 0 minute delay.

SCT Status Version:                  3
SCT Version (vendor specific):       1 (0x0001)
Device State:                        Active (0)
Current Temperature:                    36 Celsius
Power Cycle Min/Max Temperature:     28/53 Celsius
Lifetime    Min/Max Temperature:     11/80 Celsius
Specified Max Operating Temperature:    70 Celsius
Under/Over Temperature Limit Count:   0/0

SCT Temperature History Version:     2
Temperature Sampling Period:         1 minute
Temperature Logging Interval:        1 minute
Min/Max recommended Temperature:      0/70 Celsius
Min/Max Temperature Limit:           -5/75 Celsius
Temperature History Size (Index):    478 (88)

SCT Error Recovery Control command not supported

Device Statistics (GP Log 0x04)
Page  Offset Size        Value Flags Description
0x01  =====  =               =  ===  == General Statistics (rev 2) ==
0x01  0x008  4            2159  ---  Lifetime Power-On Resets
0x01  0x010  4            8638  ---  Power-on Hours
0x01  0x018  6     13565420395  ---  Logical Sectors Written
0x01  0x020  6       146933146  ---  Number of Write Commands
0x01  0x028  6      9785388789  ---  Logical Sectors Read
0x01  0x030  6       212968088  ---  Number of Read Commands
0x04  =====  =               =  ===  == General Errors Statistics (rev 1) ==
0x04  0x008  4               0  ---  Number of Reported Uncorrectable Errors
0x04  0x010  4            2046  ---  Resets Between Cmd Acceptance and Completion
0x05  =====  =               =  ===  == Temperature Statistics (rev 1) ==
0x05  0x008  1              36  ---  Current Temperature
0x05  0x010  1              46  ---  Average Short Term Temperature
0x05  0x018  1              51  ---  Average Long Term Temperature
0x05  0x020  1              80  ---  Highest Temperature
0x05  0x028  1              11  ---  Lowest Temperature
0x05  0x030  1              66  ---  Highest Average Short Term Temperature
0x05  0x038  1              30  ---  Lowest Average Short Term Temperature
0x05  0x040  1              60  ---  Highest Average Long Term Temperature
0x05  0x048  1              41  ---  Lowest Average Long Term Temperature
0x05  0x050  4             231  ---  Time in Over-Temperature
0x05  0x058  1              70  ---  Specified Maximum Operating Temperature
0x05  0x060  4               -  ---  Time in Under-Temperature
0x05  0x068  1               0  ---  Specified Minimum Operating Temperature
0x06  =====  =               =  ===  == Transport Statistics (rev 1) ==
0x06  0x008  4               0  ---  Number of Hardware Resets
0x06  0x010  4               0  ---  Number of ASR Events
0x06  0x018  4               0  ---  Number of Interface CRC Errors
0x07  =====  =               =  ===  == Solid State Device Statistics (rev 1) ==
0x07  0x008  1               3  N--  Percentage Used Endurance Indicator
                                |||_ C monitored condition met
                                ||__ D supports DSN
                                |___ N normalized value

Pending Defects log (GP Log 0x0c) not supported

SATA Phy Event Counters (GP Log 0x11)
ID      Size     Value  Description
0x0001  4            0  Command failed due to ICRC error
0x000a  4            6  Device-to-host register FISes sent due to a COMRESET



