smartctl 7.3 2022-02-28 r5338 [x86_64-linux-6.2.6-desktop-1omv2390] (OpenMandriva Lx 7.3-3)
Copyright (C) 2002-22, Bruce Allen, Christian Franke, www.smartmontools.org

=== START OF INFORMATION SECTION ===
Model Number:                       PNY CS2241 1TB SSD
Serial Number:                      --
Firmware Version:                   CS224C10
PCI Vendor/Subsystem ID:            0x1987
IEEE OUI Identifier:                0x6479a7
Controller ID:                      0
NVMe Version:                       1.4
Number of Namespaces:               1
Namespace 1 Size/Capacity:          1,000,204,886,016 [1.00 TB]
Namespace 1 Formatted LBA Size:     512
Namespace 1 IEEE EUI-64:            6479a7 ...
Local Time is:                      Fri Jan  3 21:27:38 2025 CST
Firmware Updates (0x12):            1 Slot, no Reset required
Optional Admin Commands (0x0017):   Security Format Frmw_DL Self_Test
Optional NVM Commands (0x0056):     Wr_Unc DS_Mngmt Sav/Sel_Feat Timestmp
Log Page Attributes (0x0e):         Cmd_Eff_Lg Ext_Get_Lg Telmtry_Lg
Maximum Data Transfer Size:         64 Pages
Warning  Comp. Temp. Threshold:     83 Celsius
Critical Comp. Temp. Threshold:     85 Celsius
Namespace 1 Features (0x08):        No_ID_Reuse

Supported Power States
St Op     Max   Active     Idle   RL RT WL WT  Ent_Lat  Ex_Lat
 0 +     5.50W       -        -    0  0  0  0        0       0
 1 +     2.40W       -        -    1  1  1  1        0       0
 2 +     1.50W       -        -    2  2  2  2        0       0
 3 -   0.0500W       -        -    3  3  3  3     1500    2500
 4 -   0.0050W       -        -    4  4  4  4     5000   30000

Supported LBA Sizes (NSID 0x1)
Id Fmt  Data  Metadt  Rel_Perf
 0 +     512       0         1
 1 -    4096       0         0

=== START OF SMART DATA SECTION ===
SMART overall-health self-assessment test result: PASSED

SMART/Health Information (NVMe Log 0x02)
Critical Warning:                   0x00
Temperature:                        42 Celsius
Available Spare:                    100%
Available Spare Threshold:          5%
Percentage Used:                    3%
Data Units Read:                    10,369,828 [5.30 TB]
Data Units Written:                 14,940,517 [7.64 TB]
Host Read Commands:                 117,368,497
Host Write Commands:                168,123,519
Controller Busy Time:               234
Power Cycles:                       687
Power On Hours:                     1,947
Unsafe Shutdowns:                   495
Media and Data Integrity Errors:    0
Error Information Log Entries:      0
Warning  Comp. Temperature Time:    0
Critical Comp. Temperature Time:    0
Temperature Sensor 1:               42 Celsius

Error Information (NVMe Log 0x01, 16 of 255 entries)
No Errors Logged

