smartctl 6.6 (build date Jun 14 2018) [x86_64-linux-4.15.0-58-generic] (local build)
Copyright (C) 2002-17, Bruce Allen, Christian Franke, www.smartmontools.org

=== START OF INFORMATION SECTION ===
Model Family:     Western Digital Scorpio Blue Serial ATA
Device Model:     WDC WD1200BEVS-22UST0
Serial Number:    --
LU WWN Device Id: 5 0014ee ...
Firmware Version: 01.01A01
User Capacity:    120,034,123,776 bytes [120 GB]
Sector Size:      512 bytes logical/physical
Device is:        In smartctl database [for details use: -P show]
ATA Version is:   ATA8-ACS (minor revision not indicated)
Local Time is:    Thu Aug 29 20:38:43 2019 MSK
SMART support is: Available - device has SMART capability.
SMART support is: Enabled
AAM feature is:   Disabled
APM level is:     254 (maximum performance)
Rd look-ahead is: Enabled
Write cache is:   Enabled
DSN feature is:   Unavailable
ATA Security is:  Disabled, frozen [SEC2]
Wt Cache Reorder: Enabled

=== START OF READ SMART DATA SECTION ===
SMART overall-health self-assessment test result: PASSED

General SMART Values:
Offline data collection status:  (0x00)	Offline data collection activity
					was never started.
					Auto Offline Data Collection: Disabled.
Self-test execution status:      (   0)	The previous self-test routine completed
					without error or no self-test has ever 
					been run.
Total time to complete Offline 
data collection: 		( 4800) seconds.
Offline data collection
capabilities: 			 (0x7b) SMART execute Offline immediate.
					Auto Offline data collection on/off support.
					Suspend Offline collection upon new
					command.
					Offline surface scan supported.
					Self-test supported.
					Conveyance Self-test supported.
					Selective Self-test supported.
SMART capabilities:            (0x0003)	Saves SMART data before entering
					power-saving mode.
					Supports SMART auto save timer.
Error logging capability:        (0x01)	Error logging supported.
					General Purpose Logging supported.
Short self-test routine 
recommended polling time: 	 (   2) minutes.
Extended self-test routine
recommended polling time: 	 (  60) minutes.
Conveyance self-test routine
recommended polling time: 	 (   5) minutes.
SCT capabilities: 	       (0x303f)	SCT Status supported.
					SCT Error Recovery Control supported.
					SCT Feature Control supported.
					SCT Data Table supported.

SMART Attributes Data Structure revision number: 16
Vendor Specific SMART Attributes with Thresholds:
ID# ATTRIBUTE_NAME          FLAGS    VALUE WORST THRESH FAIL RAW_VALUE
  1 Raw_Read_Error_Rate     POSR--   191   191   051    -    9744
  3 Spin_Up_Time            PO----   160   159   021    -    958
  4 Start_Stop_Count        -O--CK   099   099   000    -    1091
  5 Reallocated_Sector_Ct   PO--CK   200   200   140    -    0
  7 Seek_Error_Rate         -OSR--   100   253   051    -    0
  9 Power_On_Hours          -O--CK   099   099   000    -    1425
 10 Spin_Retry_Count        PO--C-   100   100   051    -    0
 11 Calibration_Retry_Count -O--C-   100   100   051    -    0
 12 Power_Cycle_Count       -O--CK   100   100   000    -    999
192 Power-Off_Retract_Count -O--CK   200   200   000    -    162
193 Load_Cycle_Count        -O--CK   194   194   000    -    20956
194 Temperature_Celsius     -O---K   108   091   000    -    35
196 Reallocated_Event_Count -O--CK   200   200   000    -    0
197 Current_Pending_Sector  -O--C-   200   198   000    -    9
198 Offline_Uncorrectable   ----C-   100   253   000    -    0
199 UDMA_CRC_Error_Count    -OSRCK   200   200   000    -    0
200 Multi_Zone_Error_Rate   P--R--   100   253   051    -    0
                            ||||||_ K auto-keep
                            |||||__ C event count
                            ||||___ R error rate
                            |||____ S speed/performance
                            ||_____ O updated online
                            |______ P prefailure warning

General Purpose Log Directory Version 1
SMART           Log Directory Version 1 [multi-sector log support]
Address    Access  R/W   Size  Description
0x00       GPL,SL  R/O      1  Log Directory
0x01           SL  R/O      1  Summary SMART error log
0x02           SL  R/O      5  Comprehensive SMART error log
0x03       GPL     R/O      6  Ext. Comprehensive SMART error log
0x06           SL  R/O      1  SMART self-test log
0x07       GPL     R/O      1  Extended self-test log
0x09           SL  R/W      1  Selective self-test log
0x10       GPL     R/O      1  NCQ Command Error log
0x11       GPL     R/O      1  SATA Phy Event Counters log
0x80-0x9f  GPL,SL  R/W     16  Host vendor specific log
0xa0-0xa7  GPL,SL  VS      16  Device vendor specific log
0xa8-0xb7  GPL,SL  VS       1  Device vendor specific log
0xc0       GPL,SL  VS       1  Device vendor specific log
0xc1       GPL     VS      12  Device vendor specific log
0xe0       GPL,SL  R/W      1  SCT Command/Status
0xe1       GPL,SL  R/W      1  SCT Data Transfer

SMART Extended Comprehensive Error Log Version: 1 (6 sectors)
Device Error Count: 9488 (device log contains only the most recent 24 errors)
	CR     = Command Register
	FEATR  = Features Register
	COUNT  = Count (was: Sector Count) Register
	LBA_48 = Upper bytes of LBA High/Mid/Low Registers ]  ATA-8
	LH     = LBA High (was: Cylinder High) Register    ]   LBA
	LM     = LBA Mid (was: Cylinder Low) Register      ] Register
	LL     = LBA Low (was: Sector Number) Register     ]
	DV     = Device (was: Device/Head) Register
	DC     = Device Control Register
	ER     = Error register
	ST     = Status register
Powered_Up_Time is measured from power on, and printed as
DDd+hh:mm:SS.sss where DD=days, hh=hours, mm=minutes,
SS=sec, and sss=millisec. It "wraps" after 49.710 days.

Error 9488 [7] occurred at disk power-on lifetime: 0 hours (0 days + 0 hours)
  When the command that caused the error occurred, the device was in an unknown state.

  After command completion occurred, registers were:
  ER -- ST COUNT  LBA_48  LH LM LL DV DC
  -- -- -- == -- == == == -- -- -- -- --
  40 -- 00 01 01 00 51 00 00 40 01 00 00

  Commands leading to the command that caused the error were:
  CR FEATR COUNT  LBA_48  LH LM LL DV DC  Powered_Up_Time  Command/Feature_Name
  -- == -- == -- == == == -- -- -- -- --  ---------------  --------------------
  00 40 60 09 02 00 00 00 00 00 00 00 07     00:00:00.000  NOP [Reserved subcommand] [OBS-ACS-2]
  00 00 08 00 18 09 40 00 02 60 00 00 00     00:00:49.152  NOP [Reserved subcommand] [OBS-ACS-2]
  00 3d 60 09 02 00 00 00 10 08 00 00 00     00:09:50.399  NOP [Reserved subcommand] [OBS-ACS-2]
  00 00 08 00 00 09 3c 00 02 60 00 00 00     00:00:02.048  NOP [Reserved subcommand] [OBS-ACS-2]

Error 9487 [6] occurred at disk power-on lifetime: 0 hours (0 days + 0 hours)
  When the command that caused the error occurred, the device was in an unknown state.

  After command completion occurred, registers were:
  ER -- ST COUNT  LBA_48  LH LM LL DV DC
  -- -- -- == -- == == == -- -- -- -- --
  40 -- 00 01 01 00 51 00 00 40 01 00 00

  Commands leading to the command that caused the error were:
  CR FEATR COUNT  LBA_48  LH LM LL DV DC  Powered_Up_Time  Command/Feature_Name
  -- == -- == -- == == == -- -- -- -- --  ---------------  --------------------
  00 ae 60 08 ed 00 00 00 00 00 00 00 07     00:00:00.000  NOP [Reserved subcommand] [OBS-ACS-2]
  00 10 10 00 60 08 ae 02 ed 61 00 00 00     00:00:49.152  NOP [Reserved subcommand] [OBS-ACS-2]
  01 ae 61 08 ed 00 08 00 f8 08 00 00 01     00:09:45.134  [RESERVED]
  00 10 20 00 60 08 59 00 ed 60 00 00 00     00:01:03.488  NOP [Reserved subcommand] [OBS-ACS-2]

Error 9486 [5] occurred at disk power-on lifetime: 0 hours (0 days + 0 hours)
  When the command that caused the error occurred, the device was in an unknown state.

  After command completion occurred, registers were:
  ER -- ST COUNT  LBA_48  LH LM LL DV DC
  -- -- -- == -- == == == -- -- -- -- --
  40 -- 00 01 01 00 51 00 00 40 01 00 00

  Commands leading to the command that caused the error were:
  CR FEATR COUNT  LBA_48  LH LM LL DV DC  Powered_Up_Time  Command/Feature_Name
  -- == -- == -- == == == -- -- -- -- --  ---------------  --------------------
  00 e0 60 08 d8 00 00 00 00 00 00 00 07     00:00:00.000  NOP [Reserved subcommand] [OBS-ACS-2]
  00 00 08 00 b8 08 d6 00 d8 60 00 00 00     00:00:49.152  NOP [Reserved subcommand] [OBS-ACS-2]
  00 d4 60 08 d8 00 00 00 10 08 00 00 00     00:09:39.797  NOP [Reserved subcommand] [OBS-ACS-2]
  00 00 08 00 28 08 d3 00 d8 60 00 00 00     00:00:02.048  NOP [Reserved subcommand] [OBS-ACS-2]

Error 9485 [4] occurred at disk power-on lifetime: 0 hours (0 days + 0 hours)
  When the command that caused the error occurred, the device was in an unknown state.

  After command completion occurred, registers were:
  ER -- ST COUNT  LBA_48  LH LM LL DV DC
  -- -- -- == -- == == == -- -- -- -- --
  40 -- 00 01 01 00 51 00 00 40 01 00 00

  Commands leading to the command that caused the error were:
  CR FEATR COUNT  LBA_48  LH LM LL DV DC  Powered_Up_Time  Command/Feature_Name
  -- == -- == -- == == == -- -- -- -- --  ---------------  --------------------
  00 aa 60 08 c4 00 00 00 00 00 00 00 07     00:00:00.000  NOP [Reserved subcommand] [OBS-ACS-2]
  00 00 08 00 28 08 aa 00 c4 60 00 00 00     00:00:49.160  NOP [Reserved subcommand] [OBS-ACS-2]
  00 83 60 08 c4 00 00 00 d8 08 00 00 00     00:09:34.634  NOP [Reserved subcommand] [OBS-ACS-2]
  00 00 20 00 00 08 83 07 c4 61 00 00 00     00:00:40.960  NOP [Reserved subcommand] [OBS-ACS-2]

Error 9484 [3] occurred at disk power-on lifetime: 0 hours (0 days + 0 hours)
  When the command that caused the error occurred, the device was in an unknown state.

  After command completion occurred, registers were:
  ER -- ST COUNT  LBA_48  LH LM LL DV DC
  -- -- -- == -- == == == -- -- -- -- --
  40 -- 00 01 01 00 51 00 00 40 01 00 00

  Commands leading to the command that caused the error were:
  CR FEATR COUNT  LBA_48  LH LM LL DV DC  Powered_Up_Time  Command/Feature_Name
  -- == -- == -- == == == -- -- -- -- --  ---------------  --------------------
  00 56 60 08 b0 00 00 00 00 00 00 00 07     00:00:00.000  NOP [Reserved subcommand] [OBS-ACS-2]
  00 08 20 00 a0 08 56 02 b0 60 00 00 00     00:00:49.168  NOP [Reserved subcommand] [OBS-ACS-2]
  00 ed 61 08 ae 00 00 00 28 08 00 00 00     00:09:29.430  NOP [Reserved subcommand] [OBS-ACS-2]
  00 00 38 00 70 08 ec 00 ae 61 00 00 00     00:00:57.344  NOP [Reserved subcommand] [OBS-ACS-2]

Error 9483 [2] occurred at disk power-on lifetime: 0 hours (0 days + 0 hours)
  When the command that caused the error occurred, the device was in an unknown state.

  After command completion occurred, registers were:
  ER -- ST COUNT  LBA_48  LH LM LL DV DC
  -- -- -- == -- == == == -- -- -- -- --
  40 -- 00 01 01 00 51 00 00 40 01 00 00

  Commands leading to the command that caused the error were:
  CR FEATR COUNT  LBA_48  LH LM LL DV DC  Powered_Up_Time  Command/Feature_Name
  -- == -- == -- == == == -- -- -- -- --  ---------------  --------------------
  00 fb 60 08 9b 00 00 00 00 00 00 00 07     00:00:00.000  NOP [Reserved subcommand] [OBS-ACS-2]
  00 28 20 00 80 08 fb 07 9b 60 00 00 00     00:00:49.200  NOP [Reserved subcommand] [OBS-ACS-2]
  07 fb 60 08 9b 00 20 00 20 20 00 00 07     00:09:24.219  [RESERVED]
  00 10 20 00 a0 08 fb 07 9b 60 00 00 00     00:00:40.984  NOP [Reserved subcommand] [OBS-ACS-2]

Error 9482 [1] occurred at disk power-on lifetime: 0 hours (0 days + 0 hours)
  When the command that caused the error occurred, the device was in an unknown state.

  After command completion occurred, registers were:
  ER -- ST COUNT  LBA_48  LH LM LL DV DC
  -- -- -- == -- == == == -- -- -- -- --
  40 -- 00 01 01 00 51 00 00 40 01 00 00

  Commands leading to the command that caused the error were:
  CR FEATR COUNT  LBA_48  LH LM LL DV DC  Powered_Up_Time  Command/Feature_Name
  -- == -- == -- == == == -- -- -- -- --  ---------------  --------------------
  00 e5 60 08 86 00 00 00 00 00 00 00 07     00:00:00.000  NOP [Reserved subcommand] [OBS-ACS-2]
  00 30 20 00 80 08 e5 07 86 60 00 00 00     00:00:49.208  NOP [Reserved subcommand] [OBS-ACS-2]
  07 e5 60 08 86 00 28 00 20 20 00 00 07     00:09:18.821  [RESERVED]
  00 18 20 00 a0 08 e5 07 86 60 00 00 00     00:00:49.184  NOP [Reserved subcommand] [OBS-ACS-2]

Error 9481 [0] occurred at disk power-on lifetime: 0 hours (0 days + 0 hours)
  When the command that caused the error occurred, the device was in an unknown state.

  After command completion occurred, registers were:
  ER -- ST COUNT  LBA_48  LH LM LL DV DC
  -- -- -- == -- == == == -- -- -- -- --
  40 -- 00 01 01 00 51 00 00 40 01 00 00

  Commands leading to the command that caused the error were:
  CR FEATR COUNT  LBA_48  LH LM LL DV DC  Powered_Up_Time  Command/Feature_Name
  -- == -- == -- == == == -- -- -- -- --  ---------------  --------------------
  00 b8 60 08 72 00 00 00 00 00 00 00 07     00:00:00.000  NOP [Reserved subcommand] [OBS-ACS-2]
  00 40 20 00 80 08 b8 07 72 60 00 00 00     00:00:49.224  NOP [Reserved subcommand] [OBS-ACS-2]
  07 b8 60 08 72 00 38 00 20 20 00 00 07     00:09:13.656  [RESERVED]
  00 28 20 00 80 08 b8 07 72 60 00 00 00     00:00:08.240  NOP [Reserved subcommand] [OBS-ACS-2]

SMART Extended Self-test Log Version: 1 (1 sectors)
Num  Test_Description    Status                  Remaining  LifeTime(hours)  LBA_of_first_error
# 1  Short offline       Completed: read failure       90%      1109         122566617

SMART Selective self-test log data structure revision number 1
 SPAN  MIN_LBA  MAX_LBA  CURRENT_TEST_STATUS
    1        0        0  Not_testing
    2        0        0  Not_testing
    3        0        0  Not_testing
    4        0        0  Not_testing
    5        0        0  Not_testing
Selective self-test flags (0x0):
  After scanning selected spans, do NOT read-scan remainder of disk.
If Selective self-test is pending on power-up, resume after 0 minute delay.

SCT Status Version:                  2
SCT Version (vendor specific):       258 (0x0102)
SCT Support Level:                   1
Device State:                        Active (0)
Current Temperature:                    35 Celsius
Power Cycle Min/Max Temperature:     35/36 Celsius
Lifetime    Min/Max Temperature:     27/52 Celsius
Under/Over Temperature Limit Count:   0/0
Vendor specific:
01 00 00 00 00 00 00 00 00 00 00 00 00 00 00 00
00 00 00 00 00 00 00 00 00 00 00 00 00 00 00 00

SCT Temperature History Version:     2
Temperature Sampling Period:         1 minute
Temperature Logging Interval:        1 minute
Min/Max recommended Temperature:      5/60 Celsius
Min/Max Temperature Limit:            1/85 Celsius
Temperature History Size (Index):    128 (122)

SCT Error Recovery Control:
           Read: Disabled
          Write: Disabled

Device Statistics (GP/SMART Log 0x04) not supported

Pending Defects log (GP Log 0x0c) not supported

SATA Phy Event Counters (GP Log 0x11)
ID      Size     Value  Description
0x0001  2            0  Command failed due to ICRC error
0x0002  2            0  R_ERR response for data FIS
0x0003  2            0  R_ERR response for device-to-host data FIS
0x0004  2            0  R_ERR response for host-to-device data FIS
0x0005  2            0  R_ERR response for non-data FIS
0x0006  2            0  R_ERR response for device-to-host non-data FIS
0x0007  2            0  R_ERR response for host-to-device non-data FIS
0x000a  2            1  Device-to-host register FISes sent due to a COMRESET
0x8000  4          243  Vendor specific

