smartctl 7.4 2023-08-01 r5530 [x86_64-linux-6.6.2-desktop-1omv2390] (OpenMandriva Lx 7.4-1)
Copyright (C) 2002-23, Bruce Allen, Christian Franke, www.smartmontools.org

=== START OF INFORMATION SECTION ===
Model Family:     Western Digital Blue
Device Model:     WDC WD5000AAKX-60U6AA0
Serial Number:    --
LU WWN Device Id: 5 0014ee ...
Firmware Version: 18.01H18
User Capacity:    500,107,862,016 bytes [500 GB]
Sector Size:      512 bytes logical/physical
Rotation Rate:    7200 rpm
Form Factor:      3.5 inches
Device is:        In smartctl database
ATA Version is:   ATA8-ACS (minor revision not indicated)
SATA Version is:  SATA 3.0, 6.0 Gb/s (current: 6.0 Gb/s)
Local Time is:    Sun Nov 26 07:08:02 2023 GMT
SMART support is: Available - device has SMART capability.
SMART support is: Enabled
AAM feature is:   Unavailable
APM feature is:   Unavailable
Rd look-ahead is: Enabled
Write cache is:   Enabled
DSN feature is:   Unavailable
ATA Security is:  Disabled, frozen [SEC2]
Wt Cache Reorder: Enabled

=== START OF READ SMART DATA SECTION ===
SMART overall-health self-assessment test result: PASSED

General SMART Values:
Offline data collection status:  (0x82)	Offline data collection activity
					was completed without error.
					Auto Offline Data Collection: Enabled.
Self-test execution status:      (   0)	The previous self-test routine completed
					without error or no self-test has ever 
					been run.
Total time to complete Offline 
data collection: 		( 8460) seconds.
Offline data collection
capabilities: 			 (0x5b) SMART execute Offline immediate.
					Auto Offline data collection on/off support.
					Suspend Offline collection upon new
					command.
					Offline surface scan supported.
					Self-test supported.
					No Conveyance Self-test supported.
					Selective Self-test supported.
SMART capabilities:            (0x0003)	Saves SMART data before entering
					power-saving mode.
					Supports SMART auto save timer.
Error logging capability:        (0x01)	Error logging supported.
					General Purpose Logging supported.
Short self-test routine 
recommended polling time: 	 (   2) minutes.
Extended self-test routine
recommended polling time: 	 (  86) minutes.
SCT capabilities: 	       (0x303f)	SCT Status supported.
					SCT Error Recovery Control supported.
					SCT Feature Control supported.
					SCT Data Table supported.

SMART Attributes Data Structure revision number: 16
Vendor Specific SMART Attributes with Thresholds:
ID# ATTRIBUTE_NAME          FLAGS    VALUE WORST THRESH FAIL RAW_VALUE
  1 Raw_Read_Error_Rate     POSR-K   200   200   051    -    9
  3 Spin_Up_Time            POS--K   141   138   021    -    3925
  4 Start_Stop_Count        -O--CK   085   085   000    -    15287
  5 Reallocated_Sector_Ct   PO--CK   200   200   140    -    0
  7 Seek_Error_Rate         POSR-K   100   253   051    -    0
  9 Power_On_Hours          -O--CK   056   056   000    -    32179
 10 Spin_Retry_Count        PO--CK   100   100   051    -    0
 11 Calibration_Retry_Count -O--CK   100   100   000    -    0
 12 Power_Cycle_Count       -O--CK   085   085   000    -    15107
184 End-to-End_Error        PO--CK   100   100   097    -    0
187 Reported_Uncorrect      -O--CK   100   091   000    -    22
188 Command_Timeout         -O--CK   100   090   000    -    60130525199
190 Airflow_Temperature_Cel -O---K   086   057   040    -    14 (Min/Max 8/14)
192 Power-Off_Retract_Count -O--CK   190   190   000    -    7735
193 Load_Cycle_Count        -O--CK   198   198   000    -    7551
196 Reallocated_Event_Count -O--CK   200   200   000    -    0
197 Current_Pending_Sector  -O--CK   200   181   000    -    0
198 Offline_Uncorrectable   ----CK   200   181   000    -    0
199 UDMA_CRC_Error_Count    -O--CK   200   200   000    -    0
200 Multi_Zone_Error_Rate   ---R--   200   028   000    -    0
                            ||||||_ K auto-keep
                            |||||__ C event count
                            ||||___ R error rate
                            |||____ S speed/performance
                            ||_____ O updated online
                            |______ P prefailure warning

General Purpose Log Directory Version 1
SMART           Log Directory Version 1 [multi-sector log support]
Address    Access  R/W   Size  Description
0x00       GPL,SL  R/O      1  Log Directory
0x01           SL  R/O      1  Summary SMART error log
0x02           SL  R/O      5  Comprehensive SMART error log
0x03       GPL     R/O      6  Ext. Comprehensive SMART error log
0x06           SL  R/O      1  SMART self-test log
0x07       GPL     R/O      1  Extended self-test log
0x09           SL  R/W      1  Selective self-test log
0x10       GPL     R/O      1  NCQ Command Error log
0x11       GPL     R/O      1  SATA Phy Event Counters log
0x80-0x9f  GPL,SL  R/W     16  Host vendor specific log
0xa0-0xa7  GPL,SL  VS      16  Device vendor specific log
0xa8-0xb5  GPL,SL  VS       1  Device vendor specific log
0xb6       GPL     VS       1  Device vendor specific log
0xb7       GPL,SL  VS       1  Device vendor specific log
0xbd       GPL,SL  VS       1  Device vendor specific log
0xc0       GPL,SL  VS       1  Device vendor specific log
0xc1       GPL     VS      24  Device vendor specific log
0xe0       GPL,SL  R/W      1  SCT Command/Status
0xe1       GPL,SL  R/W      1  SCT Data Transfer

SMART Extended Comprehensive Error Log Version: 1 (6 sectors)
Device Error Count: 22
	CR     = Command Register
	FEATR  = Features Register
	COUNT  = Count (was: Sector Count) Register
	LBA_48 = Upper bytes of LBA High/Mid/Low Registers ]  ATA-8
	LH     = LBA High (was: Cylinder High) Register    ]   LBA
	LM     = LBA Mid (was: Cylinder Low) Register      ] Register
	LL     = LBA Low (was: Sector Number) Register     ]
	DV     = Device (was: Device/Head) Register
	DC     = Device Control Register
	ER     = Error register
	ST     = Status register
Powered_Up_Time is measured from power on, and printed as
DDd+hh:mm:SS.sss where DD=days, hh=hours, mm=minutes,
SS=sec, and sss=millisec. It "wraps" after 49.710 days.

Error 22 [21] occurred at disk power-on lifetime: 30144 hours (1256 days + 0 hours)
  When the command that caused the error occurred, the device was active or idle.

  After command completion occurred, registers were:
  ER -- ST COUNT  LBA_48  LH LM LL DV DC
  -- -- -- == -- == == == -- -- -- -- --
  10 -- 51 0a 00 00 00 28 ce a3 00 e0 00  Error: IDNF 2560 sectors at LBA = 0x28cea300 = 684630784

  Commands leading to the command that caused the error were:
  CR FEATR COUNT  LBA_48  LH LM LL DV DC  Powered_Up_Time  Command/Feature_Name
  -- == -- == -- == == == -- -- -- -- --  ---------------  --------------------
  35 00 00 0a 00 00 00 28 ce a3 00 e0 08     00:10:06.068  WRITE DMA EXT
  ec 00 00 00 00 00 00 00 00 00 00 a0 08     00:10:06.059  IDENTIFY DEVICE
  ef 00 03 00 45 00 00 00 00 00 00 a0 08     00:10:06.057  SET FEATURES [Set transfer mode]
  ec 00 00 00 00 00 00 00 00 00 00 a0 08     00:10:06.055  IDENTIFY DEVICE
  35 00 00 0a 00 00 00 28 ce a3 00 e0 08     00:09:57.544  WRITE DMA EXT

Error 21 [20] occurred at disk power-on lifetime: 30144 hours (1256 days + 0 hours)
  When the command that caused the error occurred, the device was active or idle.

  After command completion occurred, registers were:
  ER -- ST COUNT  LBA_48  LH LM LL DV DC
  -- -- -- == -- == == == -- -- -- -- --
  10 -- 51 0a 00 00 00 28 ce a3 00 e0 00  Error: IDNF 2560 sectors at LBA = 0x28cea300 = 684630784

  Commands leading to the command that caused the error were:
  CR FEATR COUNT  LBA_48  LH LM LL DV DC  Powered_Up_Time  Command/Feature_Name
  -- == -- == -- == == == -- -- -- -- --  ---------------  --------------------
  35 00 00 0a 00 00 00 28 ce a3 00 e0 08     00:09:57.544  WRITE DMA EXT
  ec 00 00 00 00 00 00 00 00 00 00 a0 08     00:09:57.536  IDENTIFY DEVICE
  ef 00 03 00 45 00 00 00 00 00 00 a0 08     00:09:57.534  SET FEATURES [Set transfer mode]
  ec 00 00 00 00 00 00 00 00 00 00 a0 08     00:09:57.531  IDENTIFY DEVICE
  35 00 00 0a 00 00 00 28 ce a3 00 e0 08     00:09:49.022  WRITE DMA EXT

Error 20 [19] occurred at disk power-on lifetime: 30144 hours (1256 days + 0 hours)
  When the command that caused the error occurred, the device was active or idle.

  After command completion occurred, registers were:
  ER -- ST COUNT  LBA_48  LH LM LL DV DC
  -- -- -- == -- == == == -- -- -- -- --
  10 -- 51 0a 00 00 00 28 ce a3 00 e0 00  Error: IDNF 2560 sectors at LBA = 0x28cea300 = 684630784

  Commands leading to the command that caused the error were:
  CR FEATR COUNT  LBA_48  LH LM LL DV DC  Powered_Up_Time  Command/Feature_Name
  -- == -- == -- == == == -- -- -- -- --  ---------------  --------------------
  35 00 00 0a 00 00 00 28 ce a3 00 e0 08     00:09:49.022  WRITE DMA EXT
  ec 00 00 00 00 00 00 00 00 00 00 a0 08     00:09:49.014  IDENTIFY DEVICE
  ef 00 03 00 45 00 00 00 00 00 00 a0 08     00:09:49.014  SET FEATURES [Set transfer mode]
  ec 00 00 00 00 00 00 00 00 00 00 a0 08     00:09:49.012  IDENTIFY DEVICE
  35 00 00 0a 00 00 00 28 ce a3 00 e0 08     00:09:40.501  WRITE DMA EXT

Error 19 [18] occurred at disk power-on lifetime: 30144 hours (1256 days + 0 hours)
  When the command that caused the error occurred, the device was active or idle.

  After command completion occurred, registers were:
  ER -- ST COUNT  LBA_48  LH LM LL DV DC
  -- -- -- == -- == == == -- -- -- -- --
  10 -- 51 0a 00 00 00 28 ce a3 00 e0 00  Error: IDNF 2560 sectors at LBA = 0x28cea300 = 684630784

  Commands leading to the command that caused the error were:
  CR FEATR COUNT  LBA_48  LH LM LL DV DC  Powered_Up_Time  Command/Feature_Name
  -- == -- == -- == == == -- -- -- -- --  ---------------  --------------------
  35 00 00 0a 00 00 00 28 ce a3 00 e0 08     00:09:40.501  WRITE DMA EXT
  ec 00 00 00 00 00 00 00 00 00 00 a0 08     00:09:40.493  IDENTIFY DEVICE
  ef 00 03 00 45 00 00 00 00 00 00 a0 08     00:09:40.492  SET FEATURES [Set transfer mode]
  ec 00 00 00 00 00 00 00 00 00 00 a0 08     00:09:40.488  IDENTIFY DEVICE
  35 00 00 0a 00 00 00 28 ce a3 00 e0 08     00:09:31.968  WRITE DMA EXT

Error 18 [17] occurred at disk power-on lifetime: 30144 hours (1256 days + 0 hours)
  When the command that caused the error occurred, the device was active or idle.

  After command completion occurred, registers were:
  ER -- ST COUNT  LBA_48  LH LM LL DV DC
  -- -- -- == -- == == == -- -- -- -- --
  10 -- 51 0a 00 00 00 28 ce a3 00 e0 00  Error: IDNF 2560 sectors at LBA = 0x28cea300 = 684630784

  Commands leading to the command that caused the error were:
  CR FEATR COUNT  LBA_48  LH LM LL DV DC  Powered_Up_Time  Command/Feature_Name
  -- == -- == -- == == == -- -- -- -- --  ---------------  --------------------
  35 00 00 0a 00 00 00 28 ce a3 00 e0 08     00:09:31.968  WRITE DMA EXT
  35 00 00 0a 00 00 00 28 ce 99 00 e0 08     00:09:31.955  WRITE DMA EXT
  35 00 00 07 00 00 00 28 ce 92 00 e0 08     00:09:31.945  WRITE DMA EXT
  35 00 00 0a 00 00 00 28 ce 88 00 e0 08     00:09:31.932  WRITE DMA EXT
  35 00 00 04 00 00 00 28 ce 84 00 e0 08     00:09:31.926  WRITE DMA EXT

Error 17 [16] occurred at disk power-on lifetime: 30011 hours (1250 days + 11 hours)
  When the command that caused the error occurred, the device was active or idle.

  After command completion occurred, registers were:
  ER -- ST COUNT  LBA_48  LH LM LL DV DC
  -- -- -- == -- == == == -- -- -- -- --
  40 -- 51 00 08 00 00 28 ce 96 e0 e0 00  Error: UNC 8 sectors at LBA = 0x28ce96e0 = 684627680

  Commands leading to the command that caused the error were:
  CR FEATR COUNT  LBA_48  LH LM LL DV DC  Powered_Up_Time  Command/Feature_Name
  -- == -- == -- == == == -- -- -- -- --  ---------------  --------------------
  25 00 00 00 08 00 00 28 ce 96 e0 e0 08     06:15:51.804  READ DMA EXT
  35 00 00 00 08 00 00 25 e5 62 c8 e0 08     06:15:51.804  WRITE DMA EXT
  ea 00 00 00 00 00 00 36 30 3b bf e0 08     06:15:51.733  FLUSH CACHE EXT
  35 00 00 03 80 00 00 36 30 38 40 e0 08     06:15:51.732  WRITE DMA EXT
  35 00 00 00 10 00 00 35 e6 3d 30 e0 08     06:15:51.731  WRITE DMA EXT

Error 16 [15] occurred at disk power-on lifetime: 30011 hours (1250 days + 11 hours)
  When the command that caused the error occurred, the device was active or idle.

  After command completion occurred, registers were:
  ER -- ST COUNT  LBA_48  LH LM LL DV DC
  -- -- -- == -- == == == -- -- -- -- --
  40 -- 51 00 08 00 00 28 ce 96 e0 e0 00  Error: UNC 8 sectors at LBA = 0x28ce96e0 = 684627680

  Commands leading to the command that caused the error were:
  CR FEATR COUNT  LBA_48  LH LM LL DV DC  Powered_Up_Time  Command/Feature_Name
  -- == -- == -- == == == -- -- -- -- --  ---------------  --------------------
  25 00 00 00 08 00 00 28 ce 96 e0 e0 08     06:15:49.811  READ DMA EXT
  25 00 00 00 08 00 00 28 ce 96 d8 e0 08     06:15:49.811  READ DMA EXT
  25 00 00 00 08 00 00 28 ce 96 d0 e0 08     06:15:49.811  READ DMA EXT
  25 00 00 00 08 00 00 28 ce 96 c8 e0 08     06:15:49.811  READ DMA EXT
  25 00 00 00 08 00 00 28 ce 96 c0 e0 08     06:15:49.810  READ DMA EXT

Error 15 [14] occurred at disk power-on lifetime: 30011 hours (1250 days + 11 hours)
  When the command that caused the error occurred, the device was active or idle.

  After command completion occurred, registers were:
  ER -- ST COUNT  LBA_48  LH LM LL DV DC
  -- -- -- == -- == == == -- -- -- -- --
  40 -- 51 04 00 00 00 28 ce 98 00 e0 00  Error: UNC 1024 sectors at LBA = 0x28ce9800 = 684627968

  Commands leading to the command that caused the error were:
  CR FEATR COUNT  LBA_48  LH LM LL DV DC  Powered_Up_Time  Command/Feature_Name
  -- == -- == -- == == == -- -- -- -- --  ---------------  --------------------
  25 00 00 04 00 00 00 28 ce 98 00 e0 08     06:15:47.719  READ DMA EXT
  ec 00 00 00 00 00 00 00 00 00 00 a0 08     06:15:47.675  IDENTIFY DEVICE
  ef 00 03 00 45 00 00 00 00 00 00 a0 08     06:15:47.673  SET FEATURES [Set transfer mode]
  ec 00 00 00 00 00 00 00 00 00 00 a0 08     06:15:47.670  IDENTIFY DEVICE
  25 00 00 04 00 00 00 28 ce 94 00 e0 08     06:15:45.911  READ DMA EXT

SMART Extended Self-test Log Version: 1 (1 sectors)
Num  Test_Description    Status                  Remaining  LifeTime(hours)  LBA_of_first_error
# 1  Short offline       Completed without error       00%     32033         -
# 2  Short offline       Completed without error       00%     30370         -
# 3  Short offline       Completed without error       00%     30365         -
# 4  Short offline       Completed without error       00%     30359         -
# 5  Short offline       Completed without error       00%     30352         -
# 6  Extended offline    Interrupted (host reset)      90%         1         -

SMART Selective self-test log data structure revision number 1
 SPAN  MIN_LBA  MAX_LBA  CURRENT_TEST_STATUS
    1        0        0  Not_testing
    2        0        0  Not_testing
    3        0        0  Not_testing
    4        0        0  Not_testing
    5        0        0  Not_testing
Selective self-test flags (0x0):
  After scanning selected spans, do NOT read-scan remainder of disk.
If Selective self-test is pending on power-up, resume after 0 minute delay.

SCT Status Version:                  3
SCT Version (vendor specific):       258 (0x0102)
Device State:                        Active (0)
Current Temperature:                    14 Celsius
Power Cycle Min/Max Temperature:      8/14 Celsius
Lifetime    Min/Max Temperature:      0/43 Celsius
Under/Over Temperature Limit Count:   0/0

SCT Temperature History Version:     2
Temperature Sampling Period:         1 minute
Temperature Logging Interval:        1 minute
Min/Max recommended Temperature:      0/60 Celsius
Min/Max Temperature Limit:           -41/85 Celsius
Temperature History Size (Index):    128 (11)

SCT Error Recovery Control:
           Read:     85 (8.5 seconds)
          Write:     85 (8.5 seconds)

Device Statistics (GP/SMART Log 0x04) not supported

Pending Defects log (GP Log 0x0c) not supported

SATA Phy Event Counters (GP Log 0x11)
ID      Size     Value  Description
0x0001  2            0  Command failed due to ICRC error
0x0002  2            0  R_ERR response for data FIS
0x0003  2            0  R_ERR response for device-to-host data FIS
0x0004  2            0  R_ERR response for host-to-device data FIS
0x0005  2            0  R_ERR response for non-data FIS
0x0006  2            0  R_ERR response for device-to-host non-data FIS
0x0007  2            0  R_ERR response for host-to-device non-data FIS
0x000a  2            1  Device-to-host register FISes sent due to a COMRESET
0x000b  2            0  CRC errors within host-to-device FIS
0x8000  4          502  Vendor specific

