smartctl 7.4 2023-08-01 r5530 [x86_64-linux-6.14.2-zen1-1-zen] (local build)
Copyright (C) 2002-23, Bruce Allen, Christian Franke, www.smartmontools.org

=== START OF INFORMATION SECTION ===
Model Family:     Seagate Laptop HDD
Device Model:     ST320LT012-9WS14C
Serial Number:    --
LU WWN Device Id: 5 000c50 ...
Firmware Version: 0001LVM1
User Capacity:    320,072,933,376 bytes [320 GB]
Sector Sizes:     512 bytes logical, 4096 bytes physical
Rotation Rate:    5400 rpm
Form Factor:      2.5 inches
Device is:        In smartctl database 7.3/5528
ATA Version is:   ATA8-ACS T13/1699-D revision 4
SATA Version is:  SATA 2.6, 3.0 Gb/s (current: 3.0 Gb/s)
Local Time is:    Wed Apr 16 22:29:38 2025 +03
SMART support is: Available - device has SMART capability.
SMART support is: Enabled
AAM feature is:   Unavailable
APM level is:     128 (minimum power consumption without standby)
Rd look-ahead is: Enabled
Write cache is:   Enabled
DSN feature is:   Unavailable
ATA Security is:  Disabled, frozen [SEC2]
Wt Cache Reorder: Enabled

=== START OF READ SMART DATA SECTION ===
SMART overall-health self-assessment test result: PASSED
See vendor-specific Attribute list for marginal Attributes.

General SMART Values:
Offline data collection status:  (0x00)	Offline data collection activity
					was never started.
					Auto Offline Data Collection: Disabled.
Self-test execution status:      (   0)	The previous self-test routine completed
					without error or no self-test has ever 
					been run.
Total time to complete Offline 
data collection: 		(    0) seconds.
Offline data collection
capabilities: 			 (0x73) SMART execute Offline immediate.
					Auto Offline data collection on/off support.
					Suspend Offline collection upon new
					command.
					No Offline surface scan supported.
					Self-test supported.
					Conveyance Self-test supported.
					Selective Self-test supported.
SMART capabilities:            (0x0003)	Saves SMART data before entering
					power-saving mode.
					Supports SMART auto save timer.
Error logging capability:        (0x01)	Error logging supported.
					General Purpose Logging supported.
Short self-test routine 
recommended polling time: 	 (   1) minutes.
Extended self-test routine
recommended polling time: 	 (  78) minutes.
Conveyance self-test routine
recommended polling time: 	 (   2) minutes.
SCT capabilities: 	       (0x1031)	SCT Status supported.
					SCT Feature Control supported.
					SCT Data Table supported.

SMART Attributes Data Structure revision number: 10
Vendor Specific SMART Attributes with Thresholds:
ID# ATTRIBUTE_NAME          FLAGS    VALUE WORST THRESH FAIL RAW_VALUE
  1 Raw_Read_Error_Rate     POSR--   118   071   034    -    175617520
  3 Spin_Up_Time            PO----   099   098   000    -    0
  4 Start_Stop_Count        -O--CK   090   090   020    -    10728
  5 Reallocated_Sector_Ct   PO--CK   100   100   036    -    104
  7 Seek_Error_Rate         POSR--   066   053   030    -    133306734176
  9 Power_On_Hours          -O--CK   085   085   000    -    13965 (97 175 0)
 10 Spin_Retry_Count        PO--C-   100   100   097    -    0
 12 Power_Cycle_Count       -O--CK   092   092   020    -    8490
184 End-to-End_Error        -O--CK   100   100   099    -    0
187 Reported_Uncorrect      -O--CK   001   001   000    -    30400
188 Command_Timeout         -O--CK   100   100   000    -    8590065668
189 High_Fly_Writes         -O-RCK   100   100   000    -    0
190 Airflow_Temperature_Cel -O---K   064   033   045    Past 36 (0 12 36 34 0)
191 G-Sense_Error_Rate      -O--CK   098   098   000    -    4987
192 Power-Off_Retract_Count -O--CK   100   100   000    -    72
193 Load_Cycle_Count        -O--CK   001   001   000    -    656917
194 Temperature_Celsius     -O---K   036   067   000    -    36 (0 2 0 0 0)
196 Reallocated_Event_Count POSR--   089   089   030    -    10288 (4613 0)
197 Current_Pending_Sector  -O--C-   100   063   000    -    0
198 Offline_Uncorrectable   ----C-   100   063   000    -    0
199 UDMA_CRC_Error_Count    -OSRCK   200   200   000    -    0
254 Free_Fall_Sensor        -O--CK   100   100   000    -    0
                            ||||||_ K auto-keep
                            |||||__ C event count
                            ||||___ R error rate
                            |||____ S speed/performance
                            ||_____ O updated online
                            |______ P prefailure warning

General Purpose Log Directory Version 1
SMART           Log Directory Version 1 [multi-sector log support]
Address    Access  R/W   Size  Description
0x00       GPL,SL  R/O      1  Log Directory
0x01           SL  R/O      1  Summary SMART error log
0x02           SL  R/O      5  Comprehensive SMART error log
0x03       GPL     R/O      5  Ext. Comprehensive SMART error log
0x06           SL  R/O      1  SMART self-test log
0x07       GPL     R/O      1  Extended self-test log
0x09           SL  R/W      1  Selective self-test log
0x10       GPL     R/O      1  NCQ Command Error log
0x11       GPL     R/O      1  SATA Phy Event Counters log
0x21       GPL     R/O      1  Write stream error log
0x22       GPL     R/O      1  Read stream error log
0x80-0x9f  GPL,SL  R/W     16  Host vendor specific log
0xa1       GPL,SL  VS      20  Device vendor specific log
0xa2       GPL     VS    2248  Device vendor specific log
0xa8       GPL,SL  VS      65  Device vendor specific log
0xa9       GPL,SL  VS       1  Device vendor specific log
0xab       GPL     VS       1  Device vendor specific log
0xb0       GPL     VS    2864  Device vendor specific log
0xbd-0xbf  GPL     VS   65535  Device vendor specific log
0xc0       GPL,SL  VS       1  Device vendor specific log
0xe0       GPL,SL  R/W      1  SCT Command/Status
0xe1       GPL,SL  R/W      1  SCT Data Transfer

SMART Extended Comprehensive Error Log Version: 1 (5 sectors)
Device Error Count: 31812 (device log contains only the most recent 20 errors)
	CR     = Command Register
	FEATR  = Features Register
	COUNT  = Count (was: Sector Count) Register
	LBA_48 = Upper bytes of LBA High/Mid/Low Registers ]  ATA-8
	LH     = LBA High (was: Cylinder High) Register    ]   LBA
	LM     = LBA Mid (was: Cylinder Low) Register      ] Register
	LL     = LBA Low (was: Sector Number) Register     ]
	DV     = Device (was: Device/Head) Register
	DC     = Device Control Register
	ER     = Error register
	ST     = Status register
Powered_Up_Time is measured from power on, and printed as
DDd+hh:mm:SS.sss where DD=days, hh=hours, mm=minutes,
SS=sec, and sss=millisec. It "wraps" after 49.710 days.

Error 31812 [11] occurred at disk power-on lifetime: 12562 hours (523 days + 10 hours)
  When the command that caused the error occurred, the device was active or idle.

  After command completion occurred, registers were:
  ER -- ST COUNT  LBA_48  LH LM LL DV DC
  -- -- -- == -- == == == -- -- -- -- --
  40 -- 51 00 00 00 00 00 6c 66 5f 00 00  Error: UNC at LBA = 0x006c665f = 7104095

  Commands leading to the command that caused the error were:
  CR FEATR COUNT  LBA_48  LH LM LL DV DC  Powered_Up_Time  Command/Feature_Name
  -- == -- == -- == == == -- -- -- -- --  ---------------  --------------------
  60 00 00 00 01 00 00 18 c8 07 18 40 00     01:17:49.434  READ FPDMA QUEUED
  60 00 00 00 01 00 00 00 00 00 00 40 00     01:17:49.434  READ FPDMA QUEUED
  60 00 00 00 01 00 00 00 00 00 00 40 00     01:17:49.434  READ FPDMA QUEUED
  60 00 00 00 08 00 00 00 6c 66 5f 40 00     01:17:49.304  READ FPDMA QUEUED
  60 00 00 00 01 00 00 00 00 00 00 40 00     01:17:49.293  READ FPDMA QUEUED

Error 31811 [10] occurred at disk power-on lifetime: 12562 hours (523 days + 10 hours)
  When the command that caused the error occurred, the device was active or idle.

  After command completion occurred, registers were:
  ER -- ST COUNT  LBA_48  LH LM LL DV DC
  -- -- -- == -- == == == -- -- -- -- --
  40 -- 51 00 00 00 00 00 6c 66 5f 00 00  Error: UNC at LBA = 0x006c665f = 7104095

  Commands leading to the command that caused the error were:
  CR FEATR COUNT  LBA_48  LH LM LL DV DC  Powered_Up_Time  Command/Feature_Name
  -- == -- == -- == == == -- -- -- -- --  ---------------  --------------------
  60 00 00 00 08 00 00 00 6c 66 5f 40 00     01:17:46.556  READ FPDMA QUEUED
  60 00 00 00 01 00 00 18 c8 07 18 40 00     01:17:46.261  READ FPDMA QUEUED
  60 00 00 00 01 00 00 00 00 00 00 40 00     01:17:46.261  READ FPDMA QUEUED
  60 00 00 00 01 00 00 00 00 00 00 40 00     01:17:46.260  READ FPDMA QUEUED
  60 00 00 00 01 00 00 00 00 00 00 40 00     01:17:46.060  READ FPDMA QUEUED

Error 31810 [9] occurred at disk power-on lifetime: 12562 hours (523 days + 10 hours)
  When the command that caused the error occurred, the device was active or idle.

  After command completion occurred, registers were:
  ER -- ST COUNT  LBA_48  LH LM LL DV DC
  -- -- -- == -- == == == -- -- -- -- --
  40 -- 51 00 00 00 00 00 6c 66 5f 00 00  Error: UNC at LBA = 0x006c665f = 7104095

  Commands leading to the command that caused the error were:
  CR FEATR COUNT  LBA_48  LH LM LL DV DC  Powered_Up_Time  Command/Feature_Name
  -- == -- == -- == == == -- -- -- -- --  ---------------  --------------------
  60 00 00 00 08 00 00 00 6c 66 5f 40 00     01:17:43.275  READ FPDMA QUEUED
  60 00 00 00 01 00 00 18 c8 07 18 40 00     01:17:42.499  READ FPDMA QUEUED
  60 00 00 00 01 00 00 00 00 00 00 40 00     01:17:42.499  READ FPDMA QUEUED
  60 00 00 00 01 00 00 00 00 00 00 40 00     01:17:42.488  READ FPDMA QUEUED
  60 00 00 00 01 00 00 00 00 00 00 40 00     01:17:42.468  READ FPDMA QUEUED

Error 31809 [8] occurred at disk power-on lifetime: 12562 hours (523 days + 10 hours)
  When the command that caused the error occurred, the device was active or idle.

  After command completion occurred, registers were:
  ER -- ST COUNT  LBA_48  LH LM LL DV DC
  -- -- -- == -- == == == -- -- -- -- --
  40 -- 51 00 00 00 00 00 6c 66 5f 00 00  Error: UNC at LBA = 0x006c665f = 7104095

  Commands leading to the command that caused the error were:
  CR FEATR COUNT  LBA_48  LH LM LL DV DC  Powered_Up_Time  Command/Feature_Name
  -- == -- == -- == == == -- -- -- -- --  ---------------  --------------------
  60 00 00 00 08 00 00 00 6c 66 5f 40 00     01:17:24.790  READ FPDMA QUEUED
  60 00 00 00 01 00 00 18 c8 07 18 40 00     01:17:24.436  READ FPDMA QUEUED
  60 00 00 00 01 00 00 00 00 00 00 40 00     01:17:24.436  READ FPDMA QUEUED
  60 00 00 00 01 00 00 00 00 00 00 40 00     01:17:24.436  READ FPDMA QUEUED
  60 00 00 00 01 00 00 00 00 00 00 40 00     01:17:24.295  READ FPDMA QUEUED

Error 31808 [7] occurred at disk power-on lifetime: 12562 hours (523 days + 10 hours)
  When the command that caused the error occurred, the device was active or idle.

  After command completion occurred, registers were:
  ER -- ST COUNT  LBA_48  LH LM LL DV DC
  -- -- -- == -- == == == -- -- -- -- --
  40 -- 51 00 00 00 00 00 6c 66 5f 00 00  Error: UNC at LBA = 0x006c665f = 7104095

  Commands leading to the command that caused the error were:
  CR FEATR COUNT  LBA_48  LH LM LL DV DC  Powered_Up_Time  Command/Feature_Name
  -- == -- == -- == == == -- -- -- -- --  ---------------  --------------------
  60 00 00 00 08 00 00 00 6c 66 5f 40 00     01:17:21.676  READ FPDMA QUEUED
  60 00 00 00 01 00 00 18 c8 07 18 40 00     01:17:21.673  READ FPDMA QUEUED
  60 00 00 00 01 00 00 00 00 00 00 40 00     01:17:21.673  READ FPDMA QUEUED
  60 00 00 00 01 00 00 00 00 00 00 40 00     01:17:21.673  READ FPDMA QUEUED
  60 00 00 00 01 00 00 00 00 00 00 40 00     01:17:21.665  READ FPDMA QUEUED

Error 31807 [6] occurred at disk power-on lifetime: 12562 hours (523 days + 10 hours)
  When the command that caused the error occurred, the device was active or idle.

  After command completion occurred, registers were:
  ER -- ST COUNT  LBA_48  LH LM LL DV DC
  -- -- -- == -- == == == -- -- -- -- --
  40 -- 51 00 00 00 00 00 6c 66 5f 00 00  Error: UNC at LBA = 0x006c665f = 7104095

  Commands leading to the command that caused the error were:
  CR FEATR COUNT  LBA_48  LH LM LL DV DC  Powered_Up_Time  Command/Feature_Name
  -- == -- == -- == == == -- -- -- -- --  ---------------  --------------------
  60 00 00 00 08 00 00 00 6c 66 5f 40 00     01:17:19.056  READ FPDMA QUEUED
  60 00 00 00 01 00 00 18 c8 07 18 40 00     01:17:18.700  READ FPDMA QUEUED
  60 00 00 00 01 00 00 00 00 00 00 40 00     01:17:18.700  READ FPDMA QUEUED
  60 00 00 00 01 00 00 00 00 00 00 40 00     01:17:18.699  READ FPDMA QUEUED
  60 00 00 00 01 00 00 00 00 00 00 40 00     01:17:18.558  READ FPDMA QUEUED

Error 31806 [5] occurred at disk power-on lifetime: 12562 hours (523 days + 10 hours)
  When the command that caused the error occurred, the device was active or idle.

  After command completion occurred, registers were:
  ER -- ST COUNT  LBA_48  LH LM LL DV DC
  -- -- -- == -- == == == -- -- -- -- --
  40 -- 51 00 00 00 00 00 6c 66 5f 00 00  Error: UNC at LBA = 0x006c665f = 7104095

  Commands leading to the command that caused the error were:
  CR FEATR COUNT  LBA_48  LH LM LL DV DC  Powered_Up_Time  Command/Feature_Name
  -- == -- == -- == == == -- -- -- -- --  ---------------  --------------------
  60 00 00 00 08 00 00 00 6c 66 5f 40 00     01:17:15.946  READ FPDMA QUEUED
  60 00 00 00 01 00 00 18 c8 07 18 40 00     01:17:15.593  READ FPDMA QUEUED
  60 00 00 00 01 00 00 00 00 00 00 40 00     01:17:15.593  READ FPDMA QUEUED
  60 00 00 00 01 00 00 00 00 00 00 40 00     01:17:15.592  READ FPDMA QUEUED
  60 00 00 00 01 00 00 00 00 00 00 40 00     01:17:15.452  READ FPDMA QUEUED

Error 31805 [4] occurred at disk power-on lifetime: 12562 hours (523 days + 10 hours)
  When the command that caused the error occurred, the device was active or idle.

  After command completion occurred, registers were:
  ER -- ST COUNT  LBA_48  LH LM LL DV DC
  -- -- -- == -- == == == -- -- -- -- --
  40 -- 51 00 00 00 00 00 6c 66 5f 00 00  Error: UNC at LBA = 0x006c665f = 7104095

  Commands leading to the command that caused the error were:
  CR FEATR COUNT  LBA_48  LH LM LL DV DC  Powered_Up_Time  Command/Feature_Name
  -- == -- == -- == == == -- -- -- -- --  ---------------  --------------------
  60 00 00 00 08 00 00 00 6c 66 5f 40 00     01:17:12.837  READ FPDMA QUEUED
  60 00 00 00 01 00 00 18 c8 07 18 40 00     01:17:12.486  READ FPDMA QUEUED
  60 00 00 00 01 00 00 00 00 00 00 40 00     01:17:12.486  READ FPDMA QUEUED
  60 00 00 00 01 00 00 00 00 00 00 40 00     01:17:12.486  READ FPDMA QUEUED
  60 00 00 00 01 00 00 00 00 00 00 40 00     01:17:12.345  READ FPDMA QUEUED

SMART Extended Self-test Log Version: 1 (1 sectors)
Num  Test_Description    Status                  Remaining  LifeTime(hours)  LBA_of_first_error
# 1  Short offline       Completed without error       00%     13958         -
# 2  Offline             Aborted by host               90%     13958         -
# 3  Offline             Aborted by host               90%     13891         -
# 4  Offline             Aborted by host               90%     13851         -
# 5  Offline             Aborted by host               90%     13843         -
# 6  Offline             Aborted by host               90%     13831         -
# 7  Offline             Aborted by host               90%     13790         -
# 8  Offline             Aborted by host               90%     13790         -
# 9  Offline             Aborted by host               90%     13788         -
#10  Offline             Aborted by host               90%     13655         -
#11  Offline             Aborted by host               90%     13635         -
#12  Offline             Aborted by host               90%     13635         -

SMART Selective self-test log data structure revision number 1
 SPAN  MIN_LBA  MAX_LBA  CURRENT_TEST_STATUS
    1        0        0  Not_testing
    2        0        0  Not_testing
    3        0        0  Not_testing
    4        0        0  Not_testing
    5        0        0  Not_testing
Selective self-test flags (0x0):
  After scanning selected spans, do NOT read-scan remainder of disk.
If Selective self-test is pending on power-up, resume after 0 minute delay.

SCT Status Version:                  3
SCT Version (vendor specific):       522 (0x020a)
Device State:                        Active (0)
Current Temperature:                    36 Celsius
Power Cycle Min/Max Temperature:     34/36 Celsius
Lifetime    Min/Max Temperature:      2/67 Celsius
Under/Over Temperature Limit Count:   0/9
Vendor specific:
00 00 00 00 00 00 00 00 00 00 02 00 00 00 00 00
00 00 00 00 00 00 00 00 00 00 00 00 00 00 00 00

SCT Temperature History Version:     2
Temperature Sampling Period:         1 minute
Temperature Logging Interval:        11 minutes
Min/Max recommended Temperature:      0/ 0 Celsius
Min/Max Temperature Limit:            0/ 0 Celsius
Temperature History Size (Index):    128 (121)

SCT Error Recovery Control command not supported

Device Statistics (GP/SMART Log 0x04) not supported

Pending Defects log (GP Log 0x0c) not supported

SATA Phy Event Counters (GP Log 0x11)
ID      Size     Value  Description
0x000a  2           15  Device-to-host register FISes sent due to a COMRESET
0x0001  2            0  Command failed due to ICRC error
0x0003  2            0  R_ERR response for device-to-host data FIS
0x0004  2            0  R_ERR response for host-to-device data FIS
0x0006  2            0  R_ERR response for device-to-host non-data FIS
0x0007  2            0  R_ERR response for host-to-device non-data FIS

