smartctl 7.3 2022-02-28 r5338 [x86_64-linux-6.5.0-25-generic] (local build)
Copyright (C) 2002-22, Bruce Allen, Christian Franke, www.smartmontools.org

=== START OF INFORMATION SECTION ===
Model Number:                       KINGSTON SNV2S2000G
Serial Number:                      --
Firmware Version:                   ELFK1N.1
PCI Vendor/Subsystem ID:            0x2646
IEEE OUI Identifier:                0x0026b7
Total NVM Capacity:                 2,000,398,934,016 [2.00 TB]
Unallocated NVM Capacity:           0
Controller ID:                      0
NVMe Version:                       1.4
Number of Namespaces:               1
Namespace 1 Size/Capacity:          2,000,398,934,016 [2.00 TB]
Namespace 1 Formatted LBA Size:     512
Namespace 1 IEEE EUI-64:            0026b7 ...
Local Time is:                      Wed Mar 13 22:12:05 2024 EET
Firmware Updates (0x12):            1 Slot, no Reset required
Optional Admin Commands (0x0017):   Security Format Frmw_DL Self_Test
Optional NVM Commands (0x0057):     Comp Wr_Unc DS_Mngmt Sav/Sel_Feat Timestmp
Log Page Attributes (0x1e):         Cmd_Eff_Lg Ext_Get_Lg Telmtry_Lg Pers_Ev_Lg
Maximum Data Transfer Size:         64 Pages
Warning  Comp. Temp. Threshold:     77 Celsius
Critical Comp. Temp. Threshold:     79 Celsius

Supported Power States
St Op     Max   Active     Idle   RL RT WL WT  Ent_Lat  Ex_Lat
 0 +     5.00W       -        -    0  0  0  0        0       0
 1 +     5.00W       -        -    1  1  1  1        0       0
 2 +     5.00W       -        -    2  2  2  2        0       0
 3 -     5.00W       -        -    3  3  3  3     3000    2000
 4 -     5.00W       -        -    4  4  4  4    10000   40000

Supported LBA Sizes (NSID 0x1)
Id Fmt  Data  Metadt  Rel_Perf
 0 +     512       0         1
 1 -    4096       0         0

=== START OF SMART DATA SECTION ===
SMART overall-health self-assessment test result: PASSED

SMART/Health Information (NVMe Log 0x02)
Critical Warning:                   0x00
Temperature:                        47 Celsius
Available Spare:                    100%
Available Spare Threshold:          10%
Percentage Used:                    0%
Data Units Read:                    1,099,094 [562 GB]
Data Units Written:                 2,483,271 [1.27 TB]
Host Read Commands:                 20,305,190
Host Write Commands:                21,048,079
Controller Busy Time:               331
Power Cycles:                       45
Power On Hours:                     100
Unsafe Shutdowns:                   1
Media and Data Integrity Errors:    0
Error Information Log Entries:      245
Warning  Comp. Temperature Time:    0
Critical Comp. Temperature Time:    0
Temperature Sensor 2:               53 Celsius

Error Information (NVMe Log 0x01, 16 of 63 entries)
Num   ErrCount  SQId   CmdId  Status  PELoc          LBA  NSID    VS
  0        245     0  0x1010  0xc005  0x000            0     0     -
  1        244     0  0x0013  0xc004  0x000            0     0     -
  2        243     0  0x1002  0xc004  0x000            0     0     -
  3        242     0  0x1001  0xc004  0x000            0     0     -
  4        241     0  0x000c  0xc004  0x028            0     0     -
  5        240     0  0x1004  0xc005      -            0     0     -

