smartctl 7.1 2019-12-30 r5022 [x86_64-linux-5.11.0-43-generic] (local build)
Copyright (C) 2002-19, Bruce Allen, Christian Franke, www.smartmontools.org

=== START OF INFORMATION SECTION ===
Model Number:                       SAMSUNG MZVLW256HEHP-000L7
Serial Number:                      --
Firmware Version:                   5L7QCXB7
PCI Vendor/Subsystem ID:            0x144d
IEEE OUI Identifier:                0x002538
Total NVM Capacity:                 256,060,514,304 [256 GB]
Unallocated NVM Capacity:           0
Controller ID:                      2
Number of Namespaces:               1
Namespace 1 Size/Capacity:          256,060,514,304 [256 GB]
Namespace 1 Utilization:            32,466,784,256 [32.4 GB]
Namespace 1 Formatted LBA Size:     512
Namespace 1 IEEE EUI-64:            002538 ...
Local Time is:                      Thu Dec 30 18:34:07 2021 +07
Firmware Updates (0x16):            3 Slots, no Reset required
Optional Admin Commands (0x0017):   Security Format Frmw_DL Self_Test
Optional NVM Commands (0x001f):     Comp Wr_Unc DS_Mngmt Wr_Zero Sav/Sel_Feat
Warning  Comp. Temp. Threshold:     69 Celsius
Critical Comp. Temp. Threshold:     72 Celsius

Supported Power States
St Op     Max   Active     Idle   RL RT WL WT  Ent_Lat  Ex_Lat
 0 +     7.60W       -        -    0  0  0  0        0       0
 1 +     6.00W       -        -    1  1  1  1        0       0
 2 +     5.10W       -        -    2  2  2  2        0       0
 3 -   0.0400W       -        -    3  3  3  3      210    1500
 4 -   0.0050W       -        -    4  4  4  4     2200    6000

Supported LBA Sizes (NSID 0x1)
Id Fmt  Data  Metadt  Rel_Perf
 0 +     512       0         0

=== START OF SMART DATA SECTION ===
SMART overall-health self-assessment test result: PASSED

SMART/Health Information (NVMe Log 0x02)
Critical Warning:                   0x00
Temperature:                        35 Celsius
Available Spare:                    100%
Available Spare Threshold:          10%
Percentage Used:                    2%
Data Units Read:                    22,678,076 [11.6 TB]
Data Units Written:                 14,535,539 [7.44 TB]
Host Read Commands:                 698,264,752
Host Write Commands:                395,306,927
Controller Busy Time:               1,110
Power Cycles:                       1,981
Power On Hours:                     3,336
Unsafe Shutdowns:                   104
Media and Data Integrity Errors:    0
Error Information Log Entries:      5,317
Warning  Comp. Temperature Time:    0
Critical Comp. Temperature Time:    0
Temperature Sensor 1:               35 Celsius
Temperature Sensor 2:               38 Celsius

Error Information (NVMe Log 0x01, max 64 entries)
Num   ErrCount  SQId   CmdId  Status  PELoc          LBA  NSID    VS
  0       5317     0  0x001e  0x4016  0x004            0     1     -
  1       5316     0  0x001a  0x4004  0x02c            0     0     -
  2       5315     0  0x0019  0x4004  0x02c            0     0     -
  3       5314     0  0x0015  0x4212  0x028            0     -     -
  4       5313     0  0x0002  0x4004  0x028            0     0     -
  5       5312     0  0x001e  0x4016  0x004            0     1     -
  6       5311     0  0x001a  0x4004  0x02c            0     0     -
  7       5310     0  0x0019  0x4004  0x02c            0     0     -
  8       5309     0  0x0015  0x4212  0x028            0     -     -
  9       5308     0  0x0002  0x4004  0x028            0     0     -
 10       5307     0  0x001a  0x4004  0x02c            0     0     -
 11       5306     0  0x0019  0x4004  0x02c            0     0     -
 12       5305     0  0x0015  0x4212  0x028            0     -     -
 13       5304     0  0x0002  0x4004  0x028            0     0     -
 14       5303     0  0x001e  0x4016  0x004            0     1     -
 15       5302     0  0x001a  0x4004  0x02c            0     0     -
... (48 entries not shown)

