smartctl 7.4 2023-08-01 r5530 [x86_64-linux-6.12.1-desktop-1omv2490] (OpenMandriva Lx 7.4-1)
Copyright (C) 2002-23, Bruce Allen, Christian Franke, www.smartmontools.org

=== START OF INFORMATION SECTION ===
Model Number:                       SAMSUNG MZVLW256HEHP-000L7
Serial Number:                      --
Firmware Version:                   5L7QCXB7
PCI Vendor/Subsystem ID:            0x144d
IEEE OUI Identifier:                0x002538
Total NVM Capacity:                 256,060,514,304 [256 GB]
Unallocated NVM Capacity:           0
Controller ID:                      2
NVMe Version:                       1.2
Number of Namespaces:               1
Namespace 1 Size/Capacity:          256,060,514,304 [256 GB]
Namespace 1 Utilization:            197,993,807,872 [197 GB]
Namespace 1 Formatted LBA Size:     512
Namespace 1 IEEE EUI-64:            002538 ...
Local Time is:                      Sat Jan 11 21:58:25 2025 GMT
Firmware Updates (0x16):            3 Slots, no Reset required
Optional Admin Commands (0x0017):   Security Format Frmw_DL Self_Test
Optional NVM Commands (0x001f):     Comp Wr_Unc DS_Mngmt Wr_Zero Sav/Sel_Feat
Log Page Attributes (0x03):         S/H_per_NS Cmd_Eff_Lg
Warning  Comp. Temp. Threshold:     69 Celsius
Critical Comp. Temp. Threshold:     72 Celsius

Supported Power States
St Op     Max   Active     Idle   RL RT WL WT  Ent_Lat  Ex_Lat
 0 +     7.60W       -        -    0  0  0  0        0       0
 1 +     6.00W       -        -    1  1  1  1        0       0
 2 +     5.10W       -        -    2  2  2  2        0       0
 3 -   0.0400W       -        -    3  3  3  3      210    1500
 4 -   0.0050W       -        -    4  4  4  4     2200    6000

Supported LBA Sizes (NSID 0x1)
Id Fmt  Data  Metadt  Rel_Perf
 0 +     512       0         0

=== START OF SMART DATA SECTION ===
SMART overall-health self-assessment test result: PASSED

SMART/Health Information (NVMe Log 0x02)
Critical Warning:                   0x00
Temperature:                        31 Celsius
Available Spare:                    100%
Available Spare Threshold:          10%
Percentage Used:                    9%
Data Units Read:                    60,624,688 [31.0 TB]
Data Units Written:                 33,376,922 [17.0 TB]
Host Read Commands:                 1,101,005,572
Host Write Commands:                696,687,790
Controller Busy Time:               2,243
Power Cycles:                       7,042
Power On Hours:                     2,544
Unsafe Shutdowns:                   210
Media and Data Integrity Errors:    0
Error Information Log Entries:      9,685
Warning  Comp. Temperature Time:    0
Critical Comp. Temperature Time:    0
Temperature Sensor 1:               31 Celsius
Temperature Sensor 2:               33 Celsius

Error Information (NVMe Log 0x01, 16 of 64 entries)
Num   ErrCount  SQId   CmdId  Status  PELoc          LBA  NSID    VS  Message
  0       9685     0  0x000c  0x4004      -            0     0     -  Invalid Field in Command
  1       9684     0  0x001a  0x4004  0x02c            0     0     -  Invalid Field in Command
  2       9683     0  0x0019  0x4004  0x02c            0     0     -  Invalid Field in Command
  3       9682     0  0x0015  0x4212  0x028            0     -     -  Invalid Log Page
  4       9681     0  0x0002  0x4004  0x028            0     0     -  Invalid Field in Command
  5       9680     0  0x001c  0x4004      -            0     0     -  Invalid Field in Command
  6       9679     0  0x3011  0x4004      -            0     0     -  Invalid Field in Command
  7       9678     0  0x0018  0x4004      -            0     0     -  Invalid Field in Command
  8       9677     0  0x301a  0x4004      -            0     0     -  Invalid Field in Command
  9       9676     0  0x001a  0x4004  0x02c            0     0     -  Invalid Field in Command
 10       9675     0  0x0019  0x4004  0x02c            0     0     -  Invalid Field in Command
 11       9674     0  0x0015  0x4212  0x028            0     -     -  Invalid Log Page
 12       9673     0  0x0002  0x4004  0x028            0     0     -  Invalid Field in Command
 13       9672     0  0x3016  0x4004      -            0     0     -  Invalid Field in Command
 14       9671     0  0x300e  0x4004  0x02c            0     0     -  Invalid Field in Command
 15       9670     0  0x001a  0x4004  0x02c            0     0     -  Invalid Field in Command
... (48 entries not read)

Self-test Log (NVMe Log 0x06)
Self-test status: No self-test in progress
No Self-tests Logged



