smartctl 7.2 2020-12-30 r5155 [x86_64-linux-6.6.47-amd64-desktop-hwe] (local build)
Copyright (C) 2002-20, Bruce Allen, Christian Franke, www.smartmontools.org

=== START OF INFORMATION SECTION ===
Model Number:                       SAMSUNG MZAL4512HBLU-00BL2
Serial Number:                      --
Firmware Version:                   5L1QHXC7
PCI Vendor/Subsystem ID:            0x144d
IEEE OUI Identifier:                0x002538
Controller ID:                      7
NVMe Version:                       1.4
Number of Namespaces:               1
Namespace 1 Size/Capacity:          512,110,190,592 [512 GB]
Namespace 1 Utilization:            217,831,776,256 [217 GB]
Namespace 1 Formatted LBA Size:     512
Namespace 1 IEEE EUI-64:            002538 ...
Local Time is:                      Fri Sep 20 20:36:46 2024 CST
Firmware Updates (0x16):            3 Slots, no Reset required
Optional Admin Commands (0x0017):   Security Format Frmw_DL Self_Test
Optional NVM Commands (0x005e):     Wr_Unc DS_Mngmt Wr_Zero Sav/Sel_Feat Timestmp
Log Page Attributes (0x0f):         S/H_per_NS Cmd_Eff_Lg Ext_Get_Lg Telmtry_Lg
Maximum Data Transfer Size:         32 Pages
Warning  Comp. Temp. Threshold:     76 Celsius
Critical Comp. Temp. Threshold:     85 Celsius

Supported Power States
St Op     Max   Active     Idle   RL RT WL WT  Ent_Lat  Ex_Lat
 0 +     7.00W       -        -    0  0  0  0        0       0
 1 +     7.00W       -        -    1  1  1  1        0       0
 2 +     7.00W       -        -    2  2  2  2        0       0
 3 -   0.0600W       -        -    3  3  3  3      200    2800
 4 -   0.0050W       -        -    4  4  4  4     4000   19000

Supported LBA Sizes (NSID 0x1)
Id Fmt  Data  Metadt  Rel_Perf
 0 -     512       0         0
 1 -    4096       0         0

=== START OF SMART DATA SECTION ===
SMART overall-health self-assessment test result: PASSED

SMART/Health Information (NVMe Log 0x02)
Critical Warning:                   0x00
Temperature:                        42 Celsius
Available Spare:                    100%
Available Spare Threshold:          10%
Percentage Used:                    3%
Data Units Read:                    23,337,205 [11.9 TB]
Data Units Written:                 16,903,403 [8.65 TB]
Host Read Commands:                 706,710,937
Host Write Commands:                300,032,292
Controller Busy Time:               221
Power Cycles:                       2,660
Power On Hours:                     720
Unsafe Shutdowns:                   458
Media and Data Integrity Errors:    0
Error Information Log Entries:      0
Warning  Comp. Temperature Time:    0
Critical Comp. Temperature Time:    0
Temperature Sensor 1:               42 Celsius

Error Information (NVMe Log 0x01, 16 of 64 entries)
No Errors Logged



