smartctl 7.4 2023-08-01 r5530 [x86_64-linux-6.8.1-arch1-1] (local build)
Copyright (C) 2002-23, Bruce Allen, Christian Franke, www.smartmontools.org

=== START OF INFORMATION SECTION ===
Model Number:                       SAMSUNG MZAL4512HBLU-00BL2
Serial Number:                      --
Firmware Version:                   7L1QHXC7
PCI Vendor/Subsystem ID:            0x144d
IEEE OUI Identifier:                0x002538
Controller ID:                      7
NVMe Version:                       1.4
Number of Namespaces:               1
Namespace 1 Size/Capacity:          512,110,190,592 [512 GB]
Namespace 1 Utilization:            207,681,536,000 [207 GB]
Namespace 1 Formatted LBA Size:     512
Namespace 1 IEEE EUI-64:            002538 ...
Local Time is:                      Fri Mar 22 07:40:36 2024 CET
Firmware Updates (0x16):            3 Slots, no Reset required
Optional Admin Commands (0x0017):   Security Format Frmw_DL Self_Test
Optional NVM Commands (0x005e):     Wr_Unc DS_Mngmt Wr_Zero Sav/Sel_Feat Timestmp
Log Page Attributes (0x0f):         S/H_per_NS Cmd_Eff_Lg Ext_Get_Lg Telmtry_Lg
Maximum Data Transfer Size:         32 Pages
Warning  Comp. Temp. Threshold:     76 Celsius
Critical Comp. Temp. Threshold:     85 Celsius

Supported Power States
St Op     Max   Active     Idle   RL RT WL WT  Ent_Lat  Ex_Lat
 0 +     7.00W       -        -    0  0  0  0        0       0
 1 +     7.00W       -        -    1  1  1  1        0       0
 2 +     7.00W       -        -    2  2  2  2        0       0
 3 -   0.0600W       -        -    3  3  3  3      200    2800
 4 -   0.0050W       -        -    4  4  4  4     4000   19000

Supported LBA Sizes (NSID 0x1)
Id Fmt  Data  Metadt  Rel_Perf
 0 -     512       0         0
 1 -    4096       0         0

=== START OF SMART DATA SECTION ===
SMART overall-health self-assessment test result: PASSED

SMART/Health Information (NVMe Log 0x02)
Critical Warning:                   0x00
Temperature:                        32 Celsius
Available Spare:                    100%
Available Spare Threshold:          10%
Percentage Used:                    1%
Data Units Read:                    7,355,052 [3.76 TB]
Data Units Written:                 9,383,385 [4.80 TB]
Host Read Commands:                 82,323,476
Host Write Commands:                154,383,509
Controller Busy Time:               24
Power Cycles:                       799
Power On Hours:                     496
Unsafe Shutdowns:                   128
Media and Data Integrity Errors:    0
Error Information Log Entries:      0
Warning  Comp. Temperature Time:    55
Critical Comp. Temperature Time:    0
Temperature Sensor 1:               32 Celsius
Thermal Temp. 1 Transition Count:   15
Thermal Temp. 2 Transition Count:   1
Thermal Temp. 1 Total Time:         4365

Error Information (NVMe Log 0x01, 16 of 64 entries)
No Errors Logged

Read Self-test Log failed: Invalid Field in Command (0x4002)

