smartctl 7.5 2025-04-30 r5714 [x86_64-linux-6.16.8-gentoo-x86_64] (local build)
Copyright (C) 2002-25, Bruce Allen, Christian Franke, www.smartmontools.org

=== START OF INFORMATION SECTION ===
Model Number:                       Samsung SSD 970 PRO 512GB
Serial Number:                      --
Firmware Version:                   1B2QEXP7
PCI Vendor/Subsystem ID:            0x144d
IEEE OUI Identifier:                0x002538
Total NVM Capacity:                 512,110,190,592 [512 GB]
Unallocated NVM Capacity:           0
Controller ID:                      4
NVMe Version:                       1.3
Number of Namespaces:               1
Namespace 1 Size/Capacity:          512,110,190,592 [512 GB]
Namespace 1 Utilization:            215,272,882,176 [215 GB]
Namespace 1 Formatted LBA Size:     512
Namespace 1 IEEE EUI-64:            002538 ...
Local Time is:                      Sun Sep 21 09:47:32 2025 PDT
Firmware Updates (0x16):            3 Slots, no Reset required
Optional Admin Commands (0x0037):   Security Format Frmw_DL Self_Test Directvs
Optional NVM Commands (0x005f):     Comp Wr_Unc DS_Mngmt Wr_Zero Sav/Sel_Feat Timestmp
Log Page Attributes (0x03):         S/H_per_NS Cmd_Eff_Lg
Maximum Data Transfer Size:         512 Pages
Warning  Comp. Temp. Threshold:     81 Celsius
Critical Comp. Temp. Threshold:     81 Celsius

Supported Power States
St Op     Max   Active     Idle   RL RT WL WT  Ent_Lat  Ex_Lat
 0 +     6.20W       -        -    0  0  0  0        0       0
 1 +     4.30W       -        -    1  1  1  1        0       0
 2 +     2.10W       -        -    2  2  2  2        0       0
 3 -   0.0400W       -        -    3  3  3  3      210    1200
 4 -   0.0050W       -        -    4  4  4  4     2000    8000

Supported LBA Sizes (NSID 0x1)
Id Fmt  Data  Metadt  Rel_Perf
 0 +     512       0         0

=== START OF SMART DATA SECTION ===
SMART overall-health self-assessment test result: PASSED

SMART/Health Information (NVMe Log 0x02, NSID 0x1)
Critical Warning:                   0x00
Temperature:                        32 Celsius
Available Spare:                    100%
Available Spare Threshold:          10%
Percentage Used:                    1%
Data Units Read:                    39,299,522 [20.1 TB]
Data Units Written:                 28,830,524 [14.7 TB]
Host Read Commands:                 765,174,081
Host Write Commands:                292,297,953
Controller Busy Time:               2,998
Power Cycles:                       3,704
Power On Hours:                     11,128
Unsafe Shutdowns:                   301
Media and Data Integrity Errors:    1
Error Information Log Entries:      4,197
Warning  Comp. Temperature Time:    0
Critical Comp. Temperature Time:    0
Temperature Sensor 1:               32 Celsius
Temperature Sensor 2:               38 Celsius

Error Information (NVMe Log 0x01, 16 of 64 entries)
Num   ErrCount  SQId   CmdId  Status  PELoc          LBA  NSID    VS  Message
  0       4197     0  0x000c  0x4004      -            0     0     -  Invalid Field in Command

Self-test Log (NVMe Log 0x06, NSID 0xffffffff)
Self-test status: No self-test in progress
Num  Test_Description  Status                       Power_on_Hours  Failing_LBA  NSID Seg SCT Code
 0   Extended          Completed without error                3797            -     -   -   -    -
 1   Extended          Completed without error                 533            -     -   -   -    -

