smartctl 7.4 2023-08-01 r5530 [x86_64-linux-6.12.9-desktop-1omv2490] (OpenMandriva Lx 7.4-1)
Copyright (C) 2002-23, Bruce Allen, Christian Franke, www.smartmontools.org

=== START OF INFORMATION SECTION ===
Model Number:                       Samsung SSD 950 PRO 512GB
Serial Number:                      --
Firmware Version:                   2B0QBXX7
PCI Vendor/Subsystem ID:            0x144d
IEEE OUI Identifier:                0x002538
Controller ID:                      1
NVMe Version:                       <1.2
Number of Namespaces:               1
Namespace 1 Size/Capacity:          512,110,190,592 [512 GB]
Namespace 1 Utilization:            62,886,338,560 [62.8 GB]
Namespace 1 Formatted LBA Size:     512
Namespace 1 IEEE EUI-64:            002538 ...
Local Time is:                      Thu Feb 20 20:08:38 2025 +03
Firmware Updates (0x06):            3 Slots
Optional Admin Commands (0x0007):   Security Format Frmw_DL
Optional NVM Commands (0x001f):     Comp Wr_Unc DS_Mngmt Wr_Zero Sav/Sel_Feat
Log Page Attributes (0x01):         S/H_per_NS
Maximum Data Transfer Size:         32 Pages

Supported Power States
St Op     Max   Active     Idle   RL RT WL WT  Ent_Lat  Ex_Lat
 0 +     6.50W       -        -    0  0  0  0        5       5
 1 +     5.80W       -        -    1  1  1  1       30      30
 2 +     3.60W       -        -    2  2  2  2      100     100
 3 -   0.0700W       -        -    3  3  3  3      500    5000
 4 -   0.0050W       -        -    4  4  4  4     2000   22000

Supported LBA Sizes (NSID 0x1)
Id Fmt  Data  Metadt  Rel_Perf
 0 +     512       0         0

=== START OF SMART DATA SECTION ===
SMART overall-health self-assessment test result: PASSED

SMART/Health Information (NVMe Log 0x02)
Critical Warning:                   0x00
Temperature:                        33 Celsius
Available Spare:                    100%
Available Spare Threshold:          10%
Percentage Used:                    2%
Data Units Read:                    126,992,340 [65.0 TB]
Data Units Written:                 79,491,234 [40.6 TB]
Host Read Commands:                 2,089,910,745
Host Write Commands:                2,047,813,921
Controller Busy Time:               5,671
Power Cycles:                       14,607
Power On Hours:                     15,531
Unsafe Shutdowns:                   4,688
Media and Data Integrity Errors:    0
Error Information Log Entries:      75,423

Error Information (NVMe Log 0x01, 16 of 64 entries)
Num   ErrCount  SQId   CmdId  Status  PELoc          LBA  NSID    VS  Message
  0      75423     0  0x002b  0x4004  0x000            0     0     -  Invalid Field in Command
  1      75422     0  0x002a  0x4004  0x000            0     0     -  Invalid Field in Command
  2      75421     0  0x0027  0x4004  0x000            0     1     -  Invalid Field in Command
  3      75420     0  0x0026  0x4004  0x000            0     1     -  Invalid Field in Command
  4      75419     0  0x0021  0x4212  0x000            0   255     -  Invalid Log Page
  5      75418     0  0x001a  0x4212  0x000            0   255     -  Invalid Log Page
  6      75417     0  0x0005  0x4004  0x000            0     0     -  Invalid Field in Command
  7      75416     0  0x0004  0x4004  0x000            0     1     -  Invalid Field in Command
  8      75415     0  0x0001  0x4004  0x000            0   255     -  Invalid Field in Command
  9      75414     0  0x001e  0x4004  0x000            0     1     -  Invalid Field in Command
 10      75413     0  0x001d  0x4004  0x000            0     1     -  Invalid Field in Command
 11      75412     0  0x0014  0x4212  0x000            0   255     -  Invalid Log Page
 12      75411     0  0x0005  0x4212  0x000            0   255     -  Invalid Log Page
 13      75410     0  0x0029  0x4004  0x000            0     0     -  Invalid Field in Command
 14      75409     0  0x0028  0x4004  0x000            0     0     -  Invalid Field in Command
 15      75408     0  0x0027  0x4004  0x000            0     1     -  Invalid Field in Command
... (48 entries not read)

Self-tests not supported



