smartctl 7.4 2023-08-01 r5530 [x86_64-linux-6.12.1-desktop-1omv2490] (OpenMandriva Lx 7.4-1)
Copyright (C) 2002-23, Bruce Allen, Christian Franke, www.smartmontools.org

=== START OF INFORMATION SECTION ===
Model Number:                       Samsung SSD 950 PRO 512GB
Serial Number:                      --
Firmware Version:                   1B0QBXX7
PCI Vendor/Subsystem ID:            0x144d
IEEE OUI Identifier:                0x002538
Controller ID:                      1
NVMe Version:                       <1.2
Number of Namespaces:               1
Namespace 1 Size/Capacity:          512,110,190,592 [512 GB]
Namespace 1 Utilization:            84,874,698,752 [84.8 GB]
Namespace 1 Formatted LBA Size:     512
Namespace 1 IEEE EUI-64:            002538 ...
Local Time is:                      Mon Feb 24 05:34:12 2025 GMT
Firmware Updates (0x06):            3 Slots
Optional Admin Commands (0x0007):   Security Format Frmw_DL
Optional NVM Commands (0x001f):     Comp Wr_Unc DS_Mngmt Wr_Zero Sav/Sel_Feat
Log Page Attributes (0x01):         S/H_per_NS
Maximum Data Transfer Size:         32 Pages

Supported Power States
St Op     Max   Active     Idle   RL RT WL WT  Ent_Lat  Ex_Lat
 0 +     6.50W       -        -    0  0  0  0        5       5
 1 +     5.80W       -        -    1  1  1  1       30      30
 2 +     3.60W       -        -    2  2  2  2      100     100
 3 -   0.0700W       -        -    3  3  3  3      500    5000
 4 -   0.0050W       -        -    4  4  4  4     2000   22000

Supported LBA Sizes (NSID 0x1)
Id Fmt  Data  Metadt  Rel_Perf
 0 +     512       0         0

=== START OF SMART DATA SECTION ===
SMART overall-health self-assessment test result: PASSED

SMART/Health Information (NVMe Log 0x02)
Critical Warning:                   0x00
Temperature:                        35 Celsius
Available Spare:                    100%
Available Spare Threshold:          10%
Percentage Used:                    0%
Data Units Read:                    962,311 [492 GB]
Data Units Written:                 2,598,199 [1.33 TB]
Host Read Commands:                 10,874,436
Host Write Commands:                23,807,528
Controller Busy Time:               54
Power Cycles:                       458
Power On Hours:                     1,105
Unsafe Shutdowns:                   153
Media and Data Integrity Errors:    0
Error Information Log Entries:      1,700

Error Information (NVMe Log 0x01, 16 of 64 entries)
Num   ErrCount  SQId   CmdId  Status  PELoc          LBA  NSID    VS  Message
  0       1700     0  0x0000  0x4004  0x000            0     0     -  Invalid Field in Command
  1       1699     0  0x0016  0x4004  0x000            0     0     -  Invalid Field in Command
  2       1698     0  0x001c  0x4004  0x000            0     0     -  Invalid Field in Command
  3       1697     0  0x0013  0x4004  0x000            0     0     -  Invalid Field in Command
  4       1696     0  0x0040  0x4004  0x000            0     1     -  Invalid Field in Command
  5       1695     0  0x0029  0x4004  0x000            0     0     -  Invalid Field in Command
  6       1694     0  0x0028  0x4004  0x000            0     0     -  Invalid Field in Command
  7       1693     0  0x0025  0x4004  0x000            0     1     -  Invalid Field in Command
  8       1692     0  0x0024  0x4004  0x000            0     1     -  Invalid Field in Command
  9       1691     0  0x001f  0x4212  0x000            0   255     -  Invalid Log Page
 10       1690     0  0x0004  0x4004  0x000            0     0     -  Invalid Field in Command
 11       1689     0  0x0003  0x4004  0x000            0     1     -  Invalid Field in Command
 12       1688     0  0x0001  0x4004  0x000            0   255     -  Invalid Field in Command
 13       1687     0  0x5005  0x4004  0x000            0     0     -  Invalid Field in Command
 14       1686     0  0x0007  0x4004  0x000            0     0     -  Invalid Field in Command
 15       1685     0  0x5019  0x4004  0x000            0     0     -  Invalid Field in Command
... (48 entries not read)

Self-tests not supported



