smartctl 7.1 2019-12-30 r5022 [x86_64-linux-5.13.0-40-generic] (local build)
Copyright (C) 2002-19, Bruce Allen, Christian Franke, www.smartmontools.org

=== START OF INFORMATION SECTION ===
Model Family:     Seagate Momentus Thin
Device Model:     ST250LT007-9ZV14C
Serial Number:    --
LU WWN Device Id: 5 000c50 ...
Firmware Version: 0005DEM1
User Capacity:    250,059,350,016 bytes [250 GB]
Sector Sizes:     512 bytes logical, 4096 bytes physical
Rotation Rate:    7200 rpm
Device is:        In smartctl database [for details use: -P show]
ATA Version is:   ATA8-ACS T13/1699-D revision 4
SATA Version is:  SATA 2.6, 3.0 Gb/s
Local Time is:    Mon May  2 18:58:34 2022 EDT
SMART support is: Available - device has SMART capability.
SMART support is: Enabled
AAM feature is:   Unavailable
APM level is:     128 (minimum power consumption without standby)
Rd look-ahead is: Enabled
Write cache is:   Enabled
DSN feature is:   Unavailable
ATA Security is:  Disabled, frozen [SEC2]
Wt Cache Reorder: Unknown

=== START OF READ SMART DATA SECTION ===
SMART overall-health self-assessment test result: PASSED
See vendor-specific Attribute list for marginal Attributes.

General SMART Values:
Offline data collection status:  (0x00)	Offline data collection activity
					was never started.
					Auto Offline Data Collection: Disabled.
Self-test execution status:      (   0)	The previous self-test routine completed
					without error or no self-test has ever 
					been run.
Total time to complete Offline 
data collection: 		(    0) seconds.
Offline data collection
capabilities: 			 (0x73) SMART execute Offline immediate.
					Auto Offline data collection on/off support.
					Suspend Offline collection upon new
					command.
					No Offline surface scan supported.
					Self-test supported.
					Conveyance Self-test supported.
					Selective Self-test supported.
SMART capabilities:            (0x0003)	Saves SMART data before entering
					power-saving mode.
					Supports SMART auto save timer.
Error logging capability:        (0x01)	Error logging supported.
					General Purpose Logging supported.
Short self-test routine 
recommended polling time: 	 (   2) minutes.
Extended self-test routine
recommended polling time: 	 (  53) minutes.
Conveyance self-test routine
recommended polling time: 	 (   3) minutes.
SCT capabilities: 	       (0x303f)	SCT Status supported.
					SCT Error Recovery Control supported.
					SCT Feature Control supported.
					SCT Data Table supported.

SMART Attributes Data Structure revision number: 10
Vendor Specific SMART Attributes with Thresholds:
ID# ATTRIBUTE_NAME          FLAGS    VALUE WORST THRESH FAIL RAW_VALUE
  1 Raw_Read_Error_Rate     POSR--   115   085   006    -    92367496
  3 Spin_Up_Time            PO----   098   098   085    -    0
  4 Start_Stop_Count        -O--CK   097   097   020    -    3430
  5 Reallocated_Sector_Ct   PO--CK   100   100   036    -    16
  7 Seek_Error_Rate         POSR--   083   060   030    -    4519861168
  9 Power_On_Hours          -O--CK   076   076   000    -    21560
 10 Spin_Retry_Count        PO--C-   100   100   097    -    0
 12 Power_Cycle_Count       -O--CK   097   097   020    -    3094
184 End-to-End_Error        -O--CK   100   100   099    -    0
187 Reported_Uncorrect      -O--CK   001   001   000    -    525
188 Command_Timeout         -O--CK   100   099   000    -    6
189 High_Fly_Writes         -O-RCK   100   100   000    -    0
190 Airflow_Temperature_Cel -O---K   063   045   045    Past 37 (Min/Max 25/38)
191 G-Sense_Error_Rate      -O--CK   100   100   000    -    713
192 Power-Off_Retract_Count -O--CK   100   100   000    -    130
193 Load_Cycle_Count        -O--CK   079   079   000    -    43713
194 Temperature_Celsius     -O---K   037   055   000    -    37 (0 11 0 0 0)
195 Hardware_ECC_Recovered  -O-RC-   059   046   000    -    92367496
197 Current_Pending_Sector  -O--C-   099   099   000    -    24
198 Offline_Uncorrectable   ----C-   099   099   000    -    24
199 UDMA_CRC_Error_Count    -OSRCK   200   200   000    -    0
240 Head_Flying_Hours       ------   100   253   000    -    21309 (99 49 0)
241 Total_LBAs_Written      ------   100   253   000    -    766918532
242 Total_LBAs_Read         ------   100   253   000    -    1855280972
250 Read_Error_Retry_Rate   ------   100   001   000    -    8515
251 Unknown_Attribute       ------   100   001   000    -    242
252 Unknown_Attribute       ------   100   001   000    -    2
254 Free_Fall_Sensor        -O--CK   001   001   000    -    15
                            ||||||_ K auto-keep
                            |||||__ C event count
                            ||||___ R error rate
                            |||____ S speed/performance
                            ||_____ O updated online
                            |______ P prefailure warning

General Purpose Log Directory Version 1
SMART           Log Directory Version 1 [multi-sector log support]
Address    Access  R/W   Size  Description
0x00       GPL,SL  R/O      1  Log Directory
0x01           SL  R/O      1  Summary SMART error log
0x02           SL  R/O      5  Comprehensive SMART error log
0x03       GPL     R/O      5  Ext. Comprehensive SMART error log
0x06           SL  R/O      1  SMART self-test log
0x07       GPL     R/O      1  Extended self-test log
0x09           SL  R/W      1  Selective self-test log
0x10       GPL     R/O      1  NCQ Command Error log
0x11       GPL     R/O      1  SATA Phy Event Counters log
0x21       GPL     R/O      1  Write stream error log
0x22       GPL     R/O      1  Read stream error log
0x80-0x9f  GPL,SL  R/W     16  Host vendor specific log
0xa1       GPL,SL  VS      20  Device vendor specific log
0xa2       GPL     VS    2248  Device vendor specific log
0xa8       GPL,SL  VS      65  Device vendor specific log
0xa9       GPL,SL  VS       1  Device vendor specific log
0xab       GPL     VS       1  Device vendor specific log
0xb0       GPL     VS    2864  Device vendor specific log
0xbd       GPL     VS       1  Device vendor specific log
0xbe-0xbf  GPL     VS   65535  Device vendor specific log
0xe0       GPL,SL  R/W      1  SCT Command/Status
0xe1       GPL,SL  R/W      1  SCT Data Transfer

SMART Extended Comprehensive Error Log Version: 1 (5 sectors)
Device Error Count: 525 (device log contains only the most recent 20 errors)
	CR     = Command Register
	FEATR  = Features Register
	COUNT  = Count (was: Sector Count) Register
	LBA_48 = Upper bytes of LBA High/Mid/Low Registers ]  ATA-8
	LH     = LBA High (was: Cylinder High) Register    ]   LBA
	LM     = LBA Mid (was: Cylinder Low) Register      ] Register
	LL     = LBA Low (was: Sector Number) Register     ]
	DV     = Device (was: Device/Head) Register
	DC     = Device Control Register
	ER     = Error register
	ST     = Status register
Powered_Up_Time is measured from power on, and printed as
DDd+hh:mm:SS.sss where DD=days, hh=hours, mm=minutes,
SS=sec, and sss=millisec. It "wraps" after 49.710 days.

Error 525 [4] occurred at disk power-on lifetime: 21492 hours (895 days + 12 hours)
  When the command that caused the error occurred, the device was active or idle.

  After command completion occurred, registers were:
  ER -- ST COUNT  LBA_48  LH LM LL DV DC
  -- -- -- == -- == == == -- -- -- -- --
  40 -- 51 00 00 00 00 03 6e bd 20 00 00  Error: UNC at LBA = 0x036ebd20 = 57589024

  Commands leading to the command that caused the error were:
  CR FEATR COUNT  LBA_48  LH LM LL DV DC  Powered_Up_Time  Command/Feature_Name
  -- == -- == -- == == == -- -- -- -- --  ---------------  --------------------
  60 00 00 00 01 00 00 03 6e bd 20 40 00     00:09:53.200  READ FPDMA QUEUED
  61 00 00 00 10 00 00 00 6e f6 78 40 00     00:09:53.200  WRITE FPDMA QUEUED
  61 00 00 00 48 00 00 00 44 5b e0 40 00     00:09:53.199  WRITE FPDMA QUEUED
  61 00 00 00 28 00 00 00 15 5f 20 40 00     00:09:53.195  WRITE FPDMA QUEUED
  61 00 00 00 08 00 00 00 15 30 c0 40 00     00:09:53.194  WRITE FPDMA QUEUED

Error 524 [3] occurred at disk power-on lifetime: 21492 hours (895 days + 12 hours)
  When the command that caused the error occurred, the device was active or idle.

  After command completion occurred, registers were:
  ER -- ST COUNT  LBA_48  LH LM LL DV DC
  -- -- -- == -- == == == -- -- -- -- --
  40 -- 51 00 00 00 00 03 6e bd 20 00 00  Error: UNC at LBA = 0x036ebd20 = 57589024

  Commands leading to the command that caused the error were:
  CR FEATR COUNT  LBA_48  LH LM LL DV DC  Powered_Up_Time  Command/Feature_Name
  -- == -- == -- == == == -- -- -- -- --  ---------------  --------------------
  60 00 00 00 20 00 00 01 fe 04 50 40 00     00:09:48.195  READ FPDMA QUEUED
  60 00 00 00 20 00 00 01 d1 fc 50 40 00     00:09:48.195  READ FPDMA QUEUED
  60 00 00 00 01 00 00 03 6e bd 20 40 00     00:09:48.193  READ FPDMA QUEUED
  61 00 00 00 08 00 00 00 15 59 78 40 00     00:09:48.193  WRITE FPDMA QUEUED
  60 00 00 00 40 00 00 01 d1 fc 10 40 00     00:09:48.192  READ FPDMA QUEUED

Error 523 [2] occurred at disk power-on lifetime: 21492 hours (895 days + 12 hours)
  When the command that caused the error occurred, the device was active or idle.

  After command completion occurred, registers were:
  ER -- ST COUNT  LBA_48  LH LM LL DV DC
  -- -- -- == -- == == == -- -- -- -- --
  40 -- 51 00 00 00 00 03 6e bd 20 00 00  Error: UNC at LBA = 0x036ebd20 = 57589024

  Commands leading to the command that caused the error were:
  CR FEATR COUNT  LBA_48  LH LM LL DV DC  Powered_Up_Time  Command/Feature_Name
  -- == -- == -- == == == -- -- -- -- --  ---------------  --------------------
  60 00 00 00 01 00 00 03 6e bd 20 40 00     00:09:43.417  READ FPDMA QUEUED
  60 00 00 00 30 00 00 01 d1 fb e0 40 00     00:09:43.415  READ FPDMA QUEUED
  61 00 00 00 08 00 00 00 6e f6 70 40 00     00:09:43.415  WRITE FPDMA QUEUED
  61 00 00 00 08 00 00 00 15 59 60 40 00     00:09:43.415  WRITE FPDMA QUEUED
  61 00 00 00 60 00 00 00 70 7b e0 40 00     00:09:43.414  WRITE FPDMA QUEUED

Error 522 [1] occurred at disk power-on lifetime: 21492 hours (895 days + 12 hours)
  When the command that caused the error occurred, the device was active or idle.

  After command completion occurred, registers were:
  ER -- ST COUNT  LBA_48  LH LM LL DV DC
  -- -- -- == -- == == == -- -- -- -- --
  40 -- 51 00 00 00 00 03 6e bd 20 00 00  Error: UNC at LBA = 0x036ebd20 = 57589024

  Commands leading to the command that caused the error were:
  CR FEATR COUNT  LBA_48  LH LM LL DV DC  Powered_Up_Time  Command/Feature_Name
  -- == -- == -- == == == -- -- -- -- --  ---------------  --------------------
  60 00 00 00 30 00 00 01 d1 fb e0 40 00     00:09:38.509  READ FPDMA QUEUED
  60 00 00 00 10 00 00 01 cf 09 38 40 00     00:09:38.508  READ FPDMA QUEUED
  60 00 00 00 40 00 00 01 cf 08 f8 40 00     00:09:38.507  READ FPDMA QUEUED
  60 00 00 00 90 00 00 00 16 2c f0 40 00     00:09:38.496  READ FPDMA QUEUED
  60 00 00 00 08 00 00 00 16 2c e8 40 00     00:09:38.495  READ FPDMA QUEUED

Error 521 [0] occurred at disk power-on lifetime: 21492 hours (895 days + 12 hours)
  When the command that caused the error occurred, the device was active or idle.

  After command completion occurred, registers were:
  ER -- ST COUNT  LBA_48  LH LM LL DV DC
  -- -- -- == -- == == == -- -- -- -- --
  40 -- 51 00 00 00 00 03 6e bd 20 00 00  Error: UNC at LBA = 0x036ebd20 = 57589024

  Commands leading to the command that caused the error were:
  CR FEATR COUNT  LBA_48  LH LM LL DV DC  Powered_Up_Time  Command/Feature_Name
  -- == -- == -- == == == -- -- -- -- --  ---------------  --------------------
  60 00 00 00 08 00 00 00 16 2c e0 40 00     00:09:33.653  READ FPDMA QUEUED
  60 00 00 00 01 00 00 03 6e bd 20 40 00     00:09:33.641  READ FPDMA QUEUED
  61 00 00 00 08 00 00 00 15 59 20 40 00     00:09:33.639  WRITE FPDMA QUEUED
  ea 00 00 00 00 00 00 00 00 00 00 00 00     00:09:33.599  FLUSH CACHE EXT
  61 00 00 00 10 00 00 00 6e f5 f0 40 00     00:09:33.599  WRITE FPDMA QUEUED

Error 520 [19] occurred at disk power-on lifetime: 21492 hours (895 days + 12 hours)
  When the command that caused the error occurred, the device was active or idle.

  After command completion occurred, registers were:
  ER -- ST COUNT  LBA_48  LH LM LL DV DC
  -- -- -- == -- == == == -- -- -- -- --
  40 -- 51 00 00 00 00 03 6e bd 20 00 00  Error: WP at LBA = 0x036ebd20 = 57589024

  Commands leading to the command that caused the error were:
  CR FEATR COUNT  LBA_48  LH LM LL DV DC  Powered_Up_Time  Command/Feature_Name
  -- == -- == -- == == == -- -- -- -- --  ---------------  --------------------
  61 00 00 00 08 00 00 00 6e f6 70 40 00     00:09:28.829  WRITE FPDMA QUEUED
  60 00 00 00 30 00 00 01 cf 08 c8 40 00     00:09:28.828  READ FPDMA QUEUED
  60 00 00 00 10 00 00 01 11 5e 00 40 00     00:09:28.828  READ FPDMA QUEUED
  61 00 00 00 08 00 00 00 6e f5 e0 40 00     00:09:28.827  WRITE FPDMA QUEUED
  60 00 00 00 01 00 00 03 6e bd 20 40 00     00:09:28.826  READ FPDMA QUEUED

Error 519 [18] occurred at disk power-on lifetime: 21492 hours (895 days + 12 hours)
  When the command that caused the error occurred, the device was active or idle.

  After command completion occurred, registers were:
  ER -- ST COUNT  LBA_48  LH LM LL DV DC
  -- -- -- == -- == == == -- -- -- -- --
  40 -- 51 00 00 00 00 03 6e bd 20 00 00  Error: WP at LBA = 0x036ebd20 = 57589024

  Commands leading to the command that caused the error were:
  CR FEATR COUNT  LBA_48  LH LM LL DV DC  Powered_Up_Time  Command/Feature_Name
  -- == -- == -- == == == -- -- -- -- --  ---------------  --------------------
  61 00 00 00 08 00 00 00 6e f5 f0 40 00     00:09:23.860  WRITE FPDMA QUEUED
  60 00 00 00 01 00 00 03 6e bd 20 40 00     00:09:23.860  READ FPDMA QUEUED
  60 00 00 00 20 00 00 00 3e 83 bb 40 00     00:09:23.859  READ FPDMA QUEUED
  61 00 00 00 58 00 00 00 70 7b 88 40 00     00:09:23.859  WRITE FPDMA QUEUED
  60 00 00 00 08 00 00 00 16 2d a8 40 00     00:09:23.854  READ FPDMA QUEUED

Error 518 [17] occurred at disk power-on lifetime: 21492 hours (895 days + 12 hours)
  When the command that caused the error occurred, the device was active or idle.

  After command completion occurred, registers were:
  ER -- ST COUNT  LBA_48  LH LM LL DV DC
  -- -- -- == -- == == == -- -- -- -- --
  40 -- 51 00 00 00 00 03 6e bd 20 00 00  Error: UNC at LBA = 0x036ebd20 = 57589024

  Commands leading to the command that caused the error were:
  CR FEATR COUNT  LBA_48  LH LM LL DV DC  Powered_Up_Time  Command/Feature_Name
  -- == -- == -- == == == -- -- -- -- --  ---------------  --------------------
  60 00 00 00 01 00 00 03 6e bd 20 40 00     00:09:19.116  READ FPDMA QUEUED
  61 00 00 00 20 00 00 0f 13 2a 60 40 00     00:09:19.116  WRITE FPDMA QUEUED
  61 00 00 00 08 00 00 00 6e f5 f0 40 00     00:09:19.115  WRITE FPDMA QUEUED
  61 00 00 00 38 00 00 02 66 44 88 40 00     00:09:19.115  WRITE FPDMA QUEUED
  61 00 00 00 20 00 00 0f 17 a5 00 40 00     00:09:19.114  WRITE FPDMA QUEUED

SMART Extended Self-test Log Version: 1 (1 sectors)
Num  Test_Description    Status                  Remaining  LifeTime(hours)  LBA_of_first_error
# 1  Short offline       Completed: read failure       90%     21470         58332544
# 2  Short offline       Completed: read failure       90%     21470         58332544
# 3  Short offline       Completed without error       00%         2         -

SMART Selective self-test log data structure revision number 1
 SPAN  MIN_LBA  MAX_LBA  CURRENT_TEST_STATUS
    1        0        0  Not_testing
    2        0        0  Not_testing
    3        0        0  Not_testing
    4        0        0  Not_testing
    5        0        0  Not_testing
Selective self-test flags (0x0):
  After scanning selected spans, do NOT read-scan remainder of disk.
If Selective self-test is pending on power-up, resume after 0 minute delay.

SCT Status Version:                  3
SCT Version (vendor specific):       522 (0x020a)
Device State:                        Active (0)
Current Temperature:                    37 Celsius
Power Cycle Min/Max Temperature:     25/38 Celsius
Lifetime    Min/Max Temperature:     11/51 Celsius
Specified Max Operating Temperature:    36 Celsius
Under/Over Temperature Limit Count:   0/0

SCT Temperature History Version:     2
Temperature Sampling Period:         1 minute
Temperature Logging Interval:        30 minutes
Min/Max recommended Temperature:     14/55 Celsius
Min/Max Temperature Limit:           10/60 Celsius
Temperature History Size (Index):    128 (113)

SCT Error Recovery Control:
           Read: Disabled
          Write: Disabled

Device Statistics (GP/SMART Log 0x04) not supported

Pending Defects log (GP Log 0x0c) not supported

SATA Phy Event Counters (GP Log 0x11)
ID      Size     Value  Description
0x000a  2            5  Device-to-host register FISes sent due to a COMRESET
0x0001  2            0  Command failed due to ICRC error
0x0003  2            0  R_ERR response for device-to-host data FIS
0x0004  2            0  R_ERR response for host-to-device data FIS
0x0006  2            0  R_ERR response for device-to-host non-data FIS
0x0007  2            0  R_ERR response for host-to-device non-data FIS

