smartctl 7.3 2022-02-28 r5338 [x86_64-linux-5.19.0-1-amd64] (local build)
Copyright (C) 2002-22, Bruce Allen, Christian Franke, www.smartmontools.org

=== START OF INFORMATION SECTION ===
Model Family:     Western Digital Green
Device Model:     WDC WD40EZRX-00SPEB0
Serial Number:    --
LU WWN Device Id: 5 0014ee ...
Firmware Version: 80.00A80
User Capacity:    4,000,753,476,096 bytes [4.00 TB]
Sector Sizes:     512 bytes logical, 4096 bytes physical
Rotation Rate:    5400 rpm
Device is:        In smartctl database 7.3/5319
ATA Version is:   ACS-2 (minor revision not indicated)
SATA Version is:  SATA 3.0, 6.0 Gb/s (current: 3.0 Gb/s)
Local Time is:    Wed Sep  7 13:34:26 2022 SAST
SMART support is: Available - device has SMART capability.
SMART support is: Enabled
AAM feature is:   Unavailable
APM feature is:   Unavailable
Rd look-ahead is: Enabled
Write cache is:   Enabled
DSN feature is:   Unavailable
ATA Security is:  Disabled, NOT FROZEN [SEC1]
Wt Cache Reorder: Enabled

=== START OF READ SMART DATA SECTION ===
SMART overall-health self-assessment test result: PASSED

General SMART Values:
Offline data collection status:  (0x82)	Offline data collection activity
					was completed without error.
					Auto Offline Data Collection: Enabled.
Self-test execution status:      (   0)	The previous self-test routine completed
					without error or no self-test has ever 
					been run.
Total time to complete Offline 
data collection: 		(52680) seconds.
Offline data collection
capabilities: 			 (0x7b) SMART execute Offline immediate.
					Auto Offline data collection on/off support.
					Suspend Offline collection upon new
					command.
					Offline surface scan supported.
					Self-test supported.
					Conveyance Self-test supported.
					Selective Self-test supported.
SMART capabilities:            (0x0003)	Saves SMART data before entering
					power-saving mode.
					Supports SMART auto save timer.
Error logging capability:        (0x01)	Error logging supported.
					General Purpose Logging supported.
Short self-test routine 
recommended polling time: 	 (   2) minutes.
Extended self-test routine
recommended polling time: 	 ( 527) minutes.
Conveyance self-test routine
recommended polling time: 	 (   5) minutes.
SCT capabilities: 	       (0x7035)	SCT Status supported.
					SCT Feature Control supported.
					SCT Data Table supported.

SMART Attributes Data Structure revision number: 16
Vendor Specific SMART Attributes with Thresholds:
ID# ATTRIBUTE_NAME          FLAGS    VALUE WORST THRESH FAIL RAW_VALUE
  1 Raw_Read_Error_Rate     POSR-K   199   196   051    -    2572
  3 Spin_Up_Time            POS--K   209   173   021    -    6533
  4 Start_Stop_Count        -O--CK   098   098   000    -    2343
  5 Reallocated_Sector_Ct   PO--CK   186   186   140    -    423
  7 Seek_Error_Rate         -OSR-K   200   200   000    -    0
  9 Power_On_Hours          -O--CK   077   077   000    -    17042
 10 Spin_Retry_Count        -O--CK   100   100   000    -    0
 11 Calibration_Retry_Count -O--CK   100   100   000    -    0
 12 Power_Cycle_Count       -O--CK   098   098   000    -    2043
192 Power-Off_Retract_Count -O--CK   200   200   000    -    571
193 Load_Cycle_Count        -O--CK   190   190   000    -    30613
194 Temperature_Celsius     -O---K   109   094   000    -    43
196 Reallocated_Event_Count -O--CK   198   198   000    -    2
197 Current_Pending_Sector  -O--CK   200   200   000    -    15
198 Offline_Uncorrectable   ----CK   200   200   000    -    6
199 UDMA_CRC_Error_Count    -O--CK   200   200   000    -    0
200 Multi_Zone_Error_Rate   ---R--   200   199   000    -    206
                            ||||||_ K auto-keep
                            |||||__ C event count
                            ||||___ R error rate
                            |||____ S speed/performance
                            ||_____ O updated online
                            |______ P prefailure warning

General Purpose Log Directory Version 1
SMART           Log Directory Version 1 [multi-sector log support]
Address    Access  R/W   Size  Description
0x00       GPL,SL  R/O      1  Log Directory
0x01           SL  R/O      1  Summary SMART error log
0x02           SL  R/O      5  Comprehensive SMART error log
0x03       GPL     R/O      6  Ext. Comprehensive SMART error log
0x06           SL  R/O      1  SMART self-test log
0x07       GPL     R/O      1  Extended self-test log
0x09           SL  R/W      1  Selective self-test log
0x10       GPL     R/O      1  NCQ Command Error log
0x11       GPL     R/O      1  SATA Phy Event Counters log
0x80-0x9f  GPL,SL  R/W     16  Host vendor specific log
0xa0-0xa7  GPL,SL  VS      16  Device vendor specific log
0xa8-0xb7  GPL,SL  VS       1  Device vendor specific log
0xbd       GPL,SL  VS       1  Device vendor specific log
0xc0       GPL,SL  VS       1  Device vendor specific log
0xc1       GPL     VS      93  Device vendor specific log
0xcf       GPL     VS   65535  Device vendor specific log
0xe0       GPL,SL  R/W      1  SCT Command/Status
0xe1       GPL,SL  R/W      1  SCT Data Transfer

SMART Extended Comprehensive Error Log Version: 1 (6 sectors)
Device Error Count: 736 (device log contains only the most recent 24 errors)
	CR     = Command Register
	FEATR  = Features Register
	COUNT  = Count (was: Sector Count) Register
	LBA_48 = Upper bytes of LBA High/Mid/Low Registers ]  ATA-8
	LH     = LBA High (was: Cylinder High) Register    ]   LBA
	LM     = LBA Mid (was: Cylinder Low) Register      ] Register
	LL     = LBA Low (was: Sector Number) Register     ]
	DV     = Device (was: Device/Head) Register
	DC     = Device Control Register
	ER     = Error register
	ST     = Status register
Powered_Up_Time is measured from power on, and printed as
DDd+hh:mm:SS.sss where DD=days, hh=hours, mm=minutes,
SS=sec, and sss=millisec. It "wraps" after 49.710 days.

Error 736 [15] occurred at disk power-on lifetime: 13688 hours (570 days + 8 hours)
  When the command that caused the error occurred, the device was active or idle.

  After command completion occurred, registers were:
  ER -- ST COUNT  LBA_48  LH LM LL DV DC
  -- -- -- == -- == == == -- -- -- -- --
  40 -- 51 00 08 00 00 21 17 02 50 40 00  Error: UNC 8 sectors at LBA = 0x21170250 = 555156048

  Commands leading to the command that caused the error were:
  CR FEATR COUNT  LBA_48  LH LM LL DV DC  Powered_Up_Time  Command/Feature_Name
  -- == -- == -- == == == -- -- -- -- --  ---------------  --------------------
  25 00 d5 00 08 00 00 21 17 02 50 40 00  1d+06:29:51.041  READ DMA EXT
  25 00 d5 00 08 00 00 21 17 02 50 40 00  1d+06:29:47.692  READ DMA EXT
  25 00 d5 00 18 00 00 21 17 05 30 40 00  1d+06:29:47.690  READ DMA EXT
  25 00 d5 00 08 00 00 21 17 02 50 40 00  1d+06:29:44.337  READ DMA EXT
  25 00 d5 00 08 00 00 21 17 02 50 40 00  1d+06:29:41.000  READ DMA EXT

Error 735 [14] occurred at disk power-on lifetime: 13688 hours (570 days + 8 hours)
  When the command that caused the error occurred, the device was active or idle.

  After command completion occurred, registers were:
  ER -- ST COUNT  LBA_48  LH LM LL DV DC
  -- -- -- == -- == == == -- -- -- -- --
  40 -- 51 00 08 00 00 21 17 02 50 40 00  Error: UNC 8 sectors at LBA = 0x21170250 = 555156048

  Commands leading to the command that caused the error were:
  CR FEATR COUNT  LBA_48  LH LM LL DV DC  Powered_Up_Time  Command/Feature_Name
  -- == -- == -- == == == -- -- -- -- --  ---------------  --------------------
  25 00 d5 00 08 00 00 21 17 02 50 40 00  1d+06:29:47.692  READ DMA EXT
  25 00 d5 00 18 00 00 21 17 05 30 40 00  1d+06:29:47.690  READ DMA EXT
  25 00 d5 00 08 00 00 21 17 02 50 40 00  1d+06:29:44.337  READ DMA EXT
  25 00 d5 00 08 00 00 21 17 02 50 40 00  1d+06:29:41.000  READ DMA EXT
  25 00 d5 00 08 00 00 21 17 02 48 40 00  1d+06:29:41.000  READ DMA EXT

Error 734 [13] occurred at disk power-on lifetime: 13688 hours (570 days + 8 hours)
  When the command that caused the error occurred, the device was active or idle.

  After command completion occurred, registers were:
  ER -- ST COUNT  LBA_48  LH LM LL DV DC
  -- -- -- == -- == == == -- -- -- -- --
  40 -- 51 00 08 00 00 21 17 02 50 40 00  Error: UNC 8 sectors at LBA = 0x21170250 = 555156048

  Commands leading to the command that caused the error were:
  CR FEATR COUNT  LBA_48  LH LM LL DV DC  Powered_Up_Time  Command/Feature_Name
  -- == -- == -- == == == -- -- -- -- --  ---------------  --------------------
  25 00 d5 00 08 00 00 21 17 02 50 40 00  1d+06:29:44.337  READ DMA EXT
  25 00 d5 00 08 00 00 21 17 02 50 40 00  1d+06:29:41.000  READ DMA EXT
  25 00 d5 00 08 00 00 21 17 02 48 40 00  1d+06:29:41.000  READ DMA EXT
  25 00 d5 00 08 00 00 21 17 02 40 40 00  1d+06:29:41.000  READ DMA EXT
  25 00 d5 00 08 00 00 21 17 02 38 40 00  1d+06:29:41.000  READ DMA EXT

Error 733 [12] occurred at disk power-on lifetime: 13688 hours (570 days + 8 hours)
  When the command that caused the error occurred, the device was active or idle.

  After command completion occurred, registers were:
  ER -- ST COUNT  LBA_48  LH LM LL DV DC
  -- -- -- == -- == == == -- -- -- -- --
  40 -- 51 00 08 00 00 21 17 02 50 40 00  Error: UNC 8 sectors at LBA = 0x21170250 = 555156048

  Commands leading to the command that caused the error were:
  CR FEATR COUNT  LBA_48  LH LM LL DV DC  Powered_Up_Time  Command/Feature_Name
  -- == -- == -- == == == -- -- -- -- --  ---------------  --------------------
  25 00 d5 00 08 00 00 21 17 02 50 40 00  1d+06:29:41.000  READ DMA EXT
  25 00 d5 00 08 00 00 21 17 02 48 40 00  1d+06:29:41.000  READ DMA EXT
  25 00 d5 00 08 00 00 21 17 02 40 40 00  1d+06:29:41.000  READ DMA EXT
  25 00 d5 00 08 00 00 21 17 02 38 40 00  1d+06:29:41.000  READ DMA EXT
  25 00 d5 00 08 00 00 21 17 02 30 40 00  1d+06:29:41.000  READ DMA EXT

Error 732 [11] occurred at disk power-on lifetime: 13688 hours (570 days + 8 hours)
  When the command that caused the error occurred, the device was active or idle.

  After command completion occurred, registers were:
  ER -- ST COUNT  LBA_48  LH LM LL DV DC
  -- -- -- == -- == == == -- -- -- -- --
  40 -- 51 01 00 00 00 21 17 02 50 40 00  Error: UNC 256 sectors at LBA = 0x21170250 = 555156048

  Commands leading to the command that caused the error were:
  CR FEATR COUNT  LBA_48  LH LM LL DV DC  Powered_Up_Time  Command/Feature_Name
  -- == -- == -- == == == -- -- -- -- --  ---------------  --------------------
  25 00 da 01 00 00 00 21 17 02 00 40 00  1d+06:29:09.198  READ DMA EXT
  25 00 da 02 00 00 00 21 17 00 00 40 00  1d+06:29:09.180  READ DMA EXT
  25 00 da 00 08 00 01 4b 41 16 30 40 00  1d+06:29:09.175  READ DMA EXT
  25 00 da 00 08 00 01 11 00 09 00 40 00  1d+06:29:09.165  READ DMA EXT
  25 00 da 00 f8 00 01 11 00 09 10 40 00  1d+06:29:09.164  READ DMA EXT

Error 731 [10] occurred at disk power-on lifetime: 13687 hours (570 days + 7 hours)
  When the command that caused the error occurred, the device was active or idle.

  After command completion occurred, registers were:
  ER -- ST COUNT  LBA_48  LH LM LL DV DC
  -- -- -- == -- == == == -- -- -- -- --
  40 -- 51 00 08 00 00 21 17 02 50 40 00  Error: UNC 8 sectors at LBA = 0x21170250 = 555156048

  Commands leading to the command that caused the error were:
  CR FEATR COUNT  LBA_48  LH LM LL DV DC  Powered_Up_Time  Command/Feature_Name
  -- == -- == -- == == == -- -- -- -- --  ---------------  --------------------
  25 00 d5 00 08 00 00 21 17 02 50 40 00  1d+05:18:35.910  READ DMA EXT
  25 00 d5 00 08 00 01 14 04 ae f8 40 00  1d+05:18:35.888  READ DMA EXT
  25 00 d5 00 08 00 00 21 17 02 50 40 00  1d+05:18:32.543  READ DMA EXT
  25 00 d5 00 08 00 01 11 04 20 b8 40 00  1d+05:18:32.540  READ DMA EXT
  25 00 d5 00 10 00 01 11 04 20 c0 40 00  1d+05:18:32.540  READ DMA EXT

Error 730 [9] occurred at disk power-on lifetime: 13687 hours (570 days + 7 hours)
  When the command that caused the error occurred, the device was active or idle.

  After command completion occurred, registers were:
  ER -- ST COUNT  LBA_48  LH LM LL DV DC
  -- -- -- == -- == == == -- -- -- -- --
  40 -- 51 00 08 00 00 21 17 02 50 40 00  Error: UNC 8 sectors at LBA = 0x21170250 = 555156048

  Commands leading to the command that caused the error were:
  CR FEATR COUNT  LBA_48  LH LM LL DV DC  Powered_Up_Time  Command/Feature_Name
  -- == -- == -- == == == -- -- -- -- --  ---------------  --------------------
  25 00 d5 00 08 00 00 21 17 02 50 40 00  1d+05:18:32.543  READ DMA EXT
  25 00 d5 00 08 00 01 11 04 20 b8 40 00  1d+05:18:32.540  READ DMA EXT
  25 00 d5 00 10 00 01 11 04 20 c0 40 00  1d+05:18:32.540  READ DMA EXT
  25 00 d5 00 08 00 01 11 04 20 b0 40 00  1d+05:18:32.540  READ DMA EXT
  25 00 d5 00 08 00 01 11 04 20 98 40 00  1d+05:18:32.540  READ DMA EXT

Error 729 [8] occurred at disk power-on lifetime: 13687 hours (570 days + 7 hours)
  When the command that caused the error occurred, the device was active or idle.

  After command completion occurred, registers were:
  ER -- ST COUNT  LBA_48  LH LM LL DV DC
  -- -- -- == -- == == == -- -- -- -- --
  40 -- 51 00 08 00 00 21 17 02 50 40 00  Error: UNC 8 sectors at LBA = 0x21170250 = 555156048

  Commands leading to the command that caused the error were:
  CR FEATR COUNT  LBA_48  LH LM LL DV DC  Powered_Up_Time  Command/Feature_Name
  -- == -- == -- == == == -- -- -- -- --  ---------------  --------------------
  25 00 d5 00 08 00 00 21 17 02 50 40 00  1d+05:17:47.366  READ DMA EXT
  35 00 d5 00 08 00 00 08 a3 ad 30 40 00  1d+05:17:47.366  WRITE DMA EXT
  35 00 d5 00 08 00 00 e8 c5 3c 38 40 00  1d+05:17:47.359  WRITE DMA EXT
  25 00 d5 00 08 00 00 21 17 02 50 40 00  1d+05:17:44.008  READ DMA EXT
  35 00 d5 00 08 00 00 08 80 09 00 40 00  1d+05:17:44.008  WRITE DMA EXT

SMART Extended Self-test Log Version: 1 (1 sectors)
Num  Test_Description    Status                  Remaining  LifeTime(hours)  LBA_of_first_error
# 1  Extended offline    Completed: read failure       90%      4853         555134352

SMART Selective self-test log data structure revision number 1
 SPAN  MIN_LBA  MAX_LBA  CURRENT_TEST_STATUS
    1        0        0  Not_testing
    2        0        0  Not_testing
    3        0        0  Not_testing
    4        0        0  Not_testing
    5        0        0  Not_testing
Selective self-test flags (0x0):
  After scanning selected spans, do NOT read-scan remainder of disk.
If Selective self-test is pending on power-up, resume after 0 minute delay.

SCT Status Version:                  3
SCT Version (vendor specific):       258 (0x0102)
Device State:                        Active (0)
Current Temperature:                    43 Celsius
Power Cycle Min/Max Temperature:     43/47 Celsius
Lifetime    Min/Max Temperature:      3/58 Celsius
Under/Over Temperature Limit Count:   0/0
Vendor specific:
01 00 00 00 00 00 00 00 00 00 00 00 00 00 00 00
00 00 00 00 00 00 00 00 00 00 00 00 00 00 00 00

SCT Temperature History Version:     2
Temperature Sampling Period:         1 minute
Temperature Logging Interval:        1 minute
Min/Max recommended Temperature:      0/60 Celsius
Min/Max Temperature Limit:           -41/85 Celsius
Temperature History Size (Index):    478 (100)

SCT Error Recovery Control command not supported

Device Statistics (GP/SMART Log 0x04) not supported

Pending Defects log (GP Log 0x0c) not supported

SATA Phy Event Counters (GP Log 0x11)
ID      Size     Value  Description
0x0001  2            0  Command failed due to ICRC error
0x0002  2            0  R_ERR response for data FIS
0x0003  2            0  R_ERR response for device-to-host data FIS
0x0004  2            0  R_ERR response for host-to-device data FIS
0x0005  2            0  R_ERR response for non-data FIS
0x0006  2            0  R_ERR response for device-to-host non-data FIS
0x0007  2            0  R_ERR response for host-to-device non-data FIS
0x0008  2            0  Device-to-host non-data FIS retries
0x0009  2            0  Transition from drive PhyRdy to drive PhyNRdy
0x000a  2            1  Device-to-host register FISes sent due to a COMRESET
0x000b  2            0  CRC errors within host-to-device FIS
0x000f  2            0  R_ERR response for host-to-device data FIS, CRC
0x0012  2            0  R_ERR response for host-to-device non-data FIS, CRC
0x8000  4         8771  Vendor specific

