smartctl 7.2 2020-12-30 r5155 [x86_64-linux-5.10.14-desktop-1omv4002] (OpenMandriva Lx 7.2-2)
Copyright (C) 2002-20, Bruce Allen, Christian Franke, www.smartmontools.org

=== START OF INFORMATION SECTION ===
Model Family:     Western Digital Blue
Device Model:     WDC WD5000AAKX-75U6AA0
Serial Number:    --
LU WWN Device Id: 5 0014ee ...
Firmware Version: 19.01H19
User Capacity:    500,107,862,016 bytes [500 GB]
Sector Size:      512 bytes logical/physical
Device is:        In smartctl database [for details use: -P show]
ATA Version is:   ATA8-ACS (minor revision not indicated)
SATA Version is:  SATA 3.0, 6.0 Gb/s (current: 3.0 Gb/s)
Local Time is:    Sun Jun  6 20:16:46 2021 BST
SMART support is: Available - device has SMART capability.
SMART support is: Enabled
AAM feature is:   Unavailable
APM feature is:   Unavailable
Rd look-ahead is: Enabled
Write cache is:   Disabled
DSN feature is:   Unavailable
ATA Security is:  Disabled, frozen [SEC2]
Wt Cache Reorder: Enabled

=== START OF READ SMART DATA SECTION ===
SMART overall-health self-assessment test result: PASSED

General SMART Values:
Offline data collection status:  (0x84)	Offline data collection activity
					was suspended by an interrupting command from host.
					Auto Offline Data Collection: Enabled.
Self-test execution status:      (   0)	The previous self-test routine completed
					without error or no self-test has ever 
					been run.
Total time to complete Offline 
data collection: 		( 7860) seconds.
Offline data collection
capabilities: 			 (0x7b) SMART execute Offline immediate.
					Auto Offline data collection on/off support.
					Suspend Offline collection upon new
					command.
					Offline surface scan supported.
					Self-test supported.
					Conveyance Self-test supported.
					Selective Self-test supported.
SMART capabilities:            (0x0003)	Saves SMART data before entering
					power-saving mode.
					Supports SMART auto save timer.
Error logging capability:        (0x01)	Error logging supported.
					General Purpose Logging supported.
Short self-test routine 
recommended polling time: 	 (   2) minutes.
Extended self-test routine
recommended polling time: 	 (  80) minutes.
Conveyance self-test routine
recommended polling time: 	 (   5) minutes.
SCT capabilities: 	       (0x3037)	SCT Status supported.
					SCT Feature Control supported.
					SCT Data Table supported.

SMART Attributes Data Structure revision number: 16
Vendor Specific SMART Attributes with Thresholds:
ID# ATTRIBUTE_NAME          FLAGS    VALUE WORST THRESH FAIL RAW_VALUE
  1 Raw_Read_Error_Rate     POSR-K   200   200   051    -    5355
  3 Spin_Up_Time            POS--K   144   141   021    -    3791
  4 Start_Stop_Count        -O--CK   098   098   000    -    2550
  5 Reallocated_Sector_Ct   PO--CK   149   149   140    -    1073
  7 Seek_Error_Rate         -OSR-K   200   200   000    -    0
  9 Power_On_Hours          -O--CK   070   070   000    -    21926
 10 Spin_Retry_Count        -O--CK   100   100   000    -    0
 11 Calibration_Retry_Count -O--CK   100   100   000    -    0
 12 Power_Cycle_Count       -O--CK   098   098   000    -    2548
192 Power-Off_Retract_Count -O--CK   200   200   000    -    74
193 Load_Cycle_Count        -O--CK   200   200   000    -    2476
194 Temperature_Celsius     -O---K   106   099   000    -    37
196 Reallocated_Event_Count -O--CK   015   015   000    -    185
197 Current_Pending_Sector  -O--CK   199   196   000    -    147
198 Offline_Uncorrectable   ----CK   200   200   000    -    1
199 UDMA_CRC_Error_Count    -O--CK   200   200   000    -    0
200 Multi_Zone_Error_Rate   ---R--   200   200   000    -    1
240 Head_Flying_Hours       -O--CK   073   073   000    -    20321
241 Total_LBAs_Written      -O--CK   200   200   000    -    30430959489
242 Total_LBAs_Read         -O--CK   200   200   000    -    29161913832
                            ||||||_ K auto-keep
                            |||||__ C event count
                            ||||___ R error rate
                            |||____ S speed/performance
                            ||_____ O updated online
                            |______ P prefailure warning

General Purpose Log Directory Version 1
SMART           Log Directory Version 1 [multi-sector log support]
Address    Access  R/W   Size  Description
0x00       GPL,SL  R/O      1  Log Directory
0x01           SL  R/O      1  Summary SMART error log
0x02           SL  R/O      5  Comprehensive SMART error log
0x03       GPL     R/O      6  Ext. Comprehensive SMART error log
0x06           SL  R/O      1  SMART self-test log
0x07       GPL     R/O      1  Extended self-test log
0x09           SL  R/W      1  Selective self-test log
0x10       GPL     R/O      1  NCQ Command Error log
0x11       GPL     R/O      1  SATA Phy Event Counters log
0x80-0x9f  GPL,SL  R/W     16  Host vendor specific log
0xa0-0xa7  GPL,SL  VS      16  Device vendor specific log
0xa8-0xb5  GPL,SL  VS       1  Device vendor specific log
0xb6       GPL     VS       1  Device vendor specific log
0xb7       GPL,SL  VS       1  Device vendor specific log
0xbd       GPL,SL  VS       1  Device vendor specific log
0xc0       GPL,SL  VS       1  Device vendor specific log
0xc1       GPL     VS      24  Device vendor specific log
0xe0       GPL,SL  R/W      1  SCT Command/Status
0xe1       GPL,SL  R/W      1  SCT Data Transfer

SMART Extended Comprehensive Error Log Version: 1 (6 sectors)
Device Error Count: 5854 (device log contains only the most recent 24 errors)
	CR     = Command Register
	FEATR  = Features Register
	COUNT  = Count (was: Sector Count) Register
	LBA_48 = Upper bytes of LBA High/Mid/Low Registers ]  ATA-8
	LH     = LBA High (was: Cylinder High) Register    ]   LBA
	LM     = LBA Mid (was: Cylinder Low) Register      ] Register
	LL     = LBA Low (was: Sector Number) Register     ]
	DV     = Device (was: Device/Head) Register
	DC     = Device Control Register
	ER     = Error register
	ST     = Status register
Powered_Up_Time is measured from power on, and printed as
DDd+hh:mm:SS.sss where DD=days, hh=hours, mm=minutes,
SS=sec, and sss=millisec. It "wraps" after 49.710 days.

Error 5854 [21] occurred at disk power-on lifetime: 21926 hours (913 days + 14 hours)
  When the command that caused the error occurred, the device was active or idle.

  After command completion occurred, registers were:
  ER -- ST COUNT  LBA_48  LH LM LL DV DC
  -- -- -- == -- == == == -- -- -- -- --
  40 -- 51 00 35 00 00 01 33 ca 91 e0 00  Error: UNC 53 sectors at LBA = 0x0133ca91 = 20171409

  Commands leading to the command that caused the error were:
  CR FEATR COUNT  LBA_48  LH LM LL DV DC  Powered_Up_Time  Command/Feature_Name
  -- == -- == -- == == == -- -- -- -- --  ---------------  --------------------
  25 20 20 00 35 00 00 01 33 ca 8b e0 00     00:03:11.953  READ DMA EXT
  25 20 20 00 0b 00 00 01 33 ca 80 e0 00     00:03:11.952  READ DMA EXT
  25 20 20 00 34 00 00 01 33 ca 4c e0 00     00:03:11.952  READ DMA EXT
  25 20 20 00 0c 00 00 01 33 ca 40 e0 00     00:03:11.952  READ DMA EXT
  25 20 20 00 33 00 00 01 33 ca 0d e0 00     00:03:11.952  READ DMA EXT

Error 5853 [20] occurred at disk power-on lifetime: 21924 hours (913 days + 12 hours)
  When the command that caused the error occurred, the device was active or idle.

  After command completion occurred, registers were:
  ER -- ST COUNT  LBA_48  LH LM LL DV DC
  -- -- -- == -- == == == -- -- -- -- --
  40 -- 51 00 08 00 00 1a 84 c9 69 e0 00  Error: UNC 8 sectors at LBA = 0x1a84c969 = 444909929

  Commands leading to the command that caused the error were:
  CR FEATR COUNT  LBA_48  LH LM LL DV DC  Powered_Up_Time  Command/Feature_Name
  -- == -- == -- == == == -- -- -- -- --  ---------------  --------------------
  25 00 00 00 08 00 00 1a 84 c9 68 e0 08     01:32:22.482  READ DMA EXT
  c8 00 00 00 00 00 00 00 01 70 98 e0 08     01:32:22.475  READ DMA
  ca 00 00 00 10 00 00 00 01 2c d8 e0 08     01:32:22.459  WRITE DMA
  c8 00 00 00 00 00 00 00 01 7f 30 e0 08     01:32:22.458  READ DMA
  27 00 00 00 00 00 00 00 00 00 00 e0 08     01:32:22.457  READ NATIVE MAX ADDRESS EXT [OBS-ACS-3]

Error 5852 [19] occurred at disk power-on lifetime: 21924 hours (913 days + 12 hours)
  When the command that caused the error occurred, the device was active or idle.

  After command completion occurred, registers were:
  ER -- ST COUNT  LBA_48  LH LM LL DV DC
  -- -- -- == -- == == == -- -- -- -- --
  40 -- 51 00 08 00 00 1a 84 e0 df e0 00  Error: UNC 8 sectors at LBA = 0x1a84e0df = 444915935

  Commands leading to the command that caused the error were:
  CR FEATR COUNT  LBA_48  LH LM LL DV DC  Powered_Up_Time  Command/Feature_Name
  -- == -- == -- == == == -- -- -- -- --  ---------------  --------------------
  25 00 00 00 08 00 00 1a 84 e0 d8 e0 08     01:32:20.622  READ DMA EXT
  c8 00 00 00 00 00 00 00 01 6c 78 e0 08     01:32:20.619  READ DMA
  ca 00 00 00 08 00 00 00 01 2c c0 e0 08     01:32:20.609  WRITE DMA
  c8 00 00 00 b0 00 00 00 01 79 f8 e0 08     01:32:20.592  READ DMA
  27 00 00 00 00 00 00 00 00 00 00 e0 08     01:32:20.592  READ NATIVE MAX ADDRESS EXT [OBS-ACS-3]

Error 5851 [18] occurred at disk power-on lifetime: 21924 hours (913 days + 12 hours)
  When the command that caused the error occurred, the device was active or idle.

  After command completion occurred, registers were:
  ER -- ST COUNT  LBA_48  LH LM LL DV DC
  -- -- -- == -- == == == -- -- -- -- --
  40 -- 51 00 08 00 00 1a 84 e0 3b e0 00  Error: UNC 8 sectors at LBA = 0x1a84e03b = 444915771

  Commands leading to the command that caused the error were:
  CR FEATR COUNT  LBA_48  LH LM LL DV DC  Powered_Up_Time  Command/Feature_Name
  -- == -- == -- == == == -- -- -- -- --  ---------------  --------------------
  25 00 00 00 08 00 00 1a 84 e0 38 e0 08     01:32:18.754  READ DMA EXT
  c8 00 00 00 e8 00 00 00 01 74 50 e0 08     01:32:18.753  READ DMA
  ca 00 00 00 18 00 00 00 01 2c 00 e0 08     01:32:18.746  WRITE DMA
  c8 00 00 00 98 00 00 00 01 73 20 e0 08     01:32:18.730  READ DMA
  27 00 00 00 00 00 00 00 00 00 00 e0 08     01:32:18.729  READ NATIVE MAX ADDRESS EXT [OBS-ACS-3]

Error 5850 [17] occurred at disk power-on lifetime: 21924 hours (913 days + 12 hours)
  When the command that caused the error occurred, the device was active or idle.

  After command completion occurred, registers were:
  ER -- ST COUNT  LBA_48  LH LM LL DV DC
  -- -- -- == -- == == == -- -- -- -- --
  40 -- 51 00 08 00 00 1a 84 e0 3b e0 00  Error: UNC 8 sectors at LBA = 0x1a84e03b = 444915771

  Commands leading to the command that caused the error were:
  CR FEATR COUNT  LBA_48  LH LM LL DV DC  Powered_Up_Time  Command/Feature_Name
  -- == -- == -- == == == -- -- -- -- --  ---------------  --------------------
  25 00 00 00 08 00 00 1a 84 e0 38 e0 08     01:32:16.894  READ DMA EXT
  c8 00 00 00 00 00 00 00 01 6e 10 e0 08     01:32:16.889  READ DMA
  ca 00 00 00 08 00 00 00 01 2b e8 e0 08     01:32:16.883  WRITE DMA
  c8 00 00 00 00 00 00 00 01 75 38 e0 08     01:32:16.862  READ DMA
  27 00 00 00 00 00 00 00 00 00 00 e0 08     01:32:16.862  READ NATIVE MAX ADDRESS EXT [OBS-ACS-3]

Error 5849 [16] occurred at disk power-on lifetime: 21924 hours (913 days + 12 hours)
  When the command that caused the error occurred, the device was active or idle.

  After command completion occurred, registers were:
  ER -- ST COUNT  LBA_48  LH LM LL DV DC
  -- -- -- == -- == == == -- -- -- -- --
  40 -- 51 00 08 00 00 1a 84 d8 d2 e0 00  Error: UNC 8 sectors at LBA = 0x1a84d8d2 = 444913874

  Commands leading to the command that caused the error were:
  CR FEATR COUNT  LBA_48  LH LM LL DV DC  Powered_Up_Time  Command/Feature_Name
  -- == -- == -- == == == -- -- -- -- --  ---------------  --------------------
  25 00 00 00 08 00 00 1a 84 d8 d0 e0 08     01:32:15.046  READ DMA EXT
  c8 00 00 00 00 00 00 00 01 80 40 e0 08     01:32:15.040  READ DMA
  ca 00 00 00 08 00 00 00 01 2b d8 e0 08     01:32:15.035  WRITE DMA
  c8 00 00 00 00 00 00 00 01 86 10 e0 08     01:32:15.018  READ DMA
  27 00 00 00 00 00 00 00 00 00 00 e0 08     01:32:15.018  READ NATIVE MAX ADDRESS EXT [OBS-ACS-3]

Error 5848 [15] occurred at disk power-on lifetime: 21924 hours (913 days + 12 hours)
  When the command that caused the error occurred, the device was active or idle.

  After command completion occurred, registers were:
  ER -- ST COUNT  LBA_48  LH LM LL DV DC
  -- -- -- == -- == == == -- -- -- -- --
  40 -- 51 00 08 00 00 1a 84 d8 d2 e0 00  Error: UNC 8 sectors at LBA = 0x1a84d8d2 = 444913874

  Commands leading to the command that caused the error were:
  CR FEATR COUNT  LBA_48  LH LM LL DV DC  Powered_Up_Time  Command/Feature_Name
  -- == -- == -- == == == -- -- -- -- --  ---------------  --------------------
  25 00 00 00 08 00 00 1a 84 d8 d0 e0 08     01:32:13.192  READ DMA EXT
  ca 00 00 00 08 00 00 00 01 2b b8 e0 08     01:32:13.173  WRITE DMA
  27 00 00 00 00 00 00 00 00 00 00 e0 08     01:32:13.173  READ NATIVE MAX ADDRESS EXT [OBS-ACS-3]
  ec 00 00 00 00 00 00 00 00 00 00 a0 08     01:32:13.170  IDENTIFY DEVICE
  ef 00 03 00 46 00 00 00 00 00 00 a0 08     01:32:13.170  SET FEATURES [Set transfer mode]

Error 5847 [14] occurred at disk power-on lifetime: 21924 hours (913 days + 12 hours)
  When the command that caused the error occurred, the device was active or idle.

  After command completion occurred, registers were:
  ER -- ST COUNT  LBA_48  LH LM LL DV DC
  -- -- -- == -- == == == -- -- -- -- --
  40 -- 51 00 08 00 00 1a 84 94 4f e0 00  Error: UNC 8 sectors at LBA = 0x1a84944f = 444896335

  Commands leading to the command that caused the error were:
  CR FEATR COUNT  LBA_48  LH LM LL DV DC  Powered_Up_Time  Command/Feature_Name
  -- == -- == -- == == == -- -- -- -- --  ---------------  --------------------
  25 00 00 00 08 00 00 1a 84 94 48 e0 08     01:32:11.354  READ DMA EXT
  c8 00 00 00 f8 00 00 00 01 6b 08 e0 08     01:32:11.337  READ DMA
  35 00 00 01 58 00 00 1d 05 54 70 e0 08     01:32:11.328  WRITE DMA EXT
  35 00 00 04 00 00 00 1d 05 50 70 e0 08     01:32:11.314  WRITE DMA EXT
  35 00 00 04 00 00 00 1d 05 4c 70 e0 08     01:32:11.302  WRITE DMA EXT

SMART Extended Self-test Log Version: 1 (1 sectors)
Num  Test_Description    Status                  Remaining  LifeTime(hours)  LBA_of_first_error
# 1  Short offline       Completed without error       00%         0         -
# 2  Short offline       Completed without error       00%         0         -

SMART Selective self-test log data structure revision number 1
 SPAN  MIN_LBA  MAX_LBA  CURRENT_TEST_STATUS
    1        0        0  Not_testing
    2        0        0  Not_testing
    3        0        0  Not_testing
    4        0        0  Not_testing
    5        0        0  Not_testing
Selective self-test flags (0x0):
  After scanning selected spans, do NOT read-scan remainder of disk.
If Selective self-test is pending on power-up, resume after 0 minute delay.

SCT Status Version:                  3
SCT Version (vendor specific):       258 (0x0102)
Device State:                        Active (0)
Current Temperature:                    37 Celsius
Power Cycle Min/Max Temperature:     34/37 Celsius
Lifetime    Min/Max Temperature:      0/44 Celsius
Specified Max Operating Temperature:    28 Celsius
Under/Over Temperature Limit Count:   0/0

SCT Temperature History Version:     2
Temperature Sampling Period:         1 minute
Temperature Logging Interval:        1 minute
Min/Max recommended Temperature:      0/60 Celsius
Min/Max Temperature Limit:           -41/85 Celsius
Temperature History Size (Index):    478 (255)

SCT Error Recovery Control command not supported

Device Statistics (GP/SMART Log 0x04) not supported

Pending Defects log (GP Log 0x0c) not supported

SATA Phy Event Counters (GP Log 0x11)
ID      Size     Value  Description
0x0001  2            0  Command failed due to ICRC error
0x0002  2            0  R_ERR response for data FIS
0x0003  2            0  R_ERR response for device-to-host data FIS
0x0004  2            0  R_ERR response for host-to-device data FIS
0x0005  2            0  R_ERR response for non-data FIS
0x0006  2            0  R_ERR response for device-to-host non-data FIS
0x0007  2            0  R_ERR response for host-to-device non-data FIS
0x000a  2            1  Device-to-host register FISes sent due to a COMRESET
0x000b  2            0  CRC errors within host-to-device FIS
0x8000  4          488  Vendor specific

