=== START OF INFORMATION SECTION ===
Model Family:     Seagate Barracuda 7200.7 and 7200.7 Plus
Device Model:     ST340014A
Serial Number:    --
Firmware Version: 8.01
User Capacity:    40 019 582 464 bytes [40,0 GB]
Sector Size:      512 bytes logical/physical
Device is:        In smartctl database [for details use: -P show]
ATA Version is:   ATA/ATAPI-6 T13/1410D revision 2
Local Time is:    Tue Jun 27 08:33:17 2017 MSK
SMART support is: Available - device has SMART capability.
SMART support is: Enabled
AAM feature is:   Unavailable
APM feature is:   Unavailable
Rd look-ahead is: Enabled
Write cache is:   Enabled
ATA Security is:  Disabled, NOT FROZEN [SEC1]
Wt Cache Reorder: Unavailable

=== START OF READ SMART DATA SECTION ===
SMART overall-health self-assessment test result: PASSED

General SMART Values:
Offline data collection status:  (0x82)	Offline data collection activity
					was completed without error.
					Auto Offline Data Collection: Enabled.
Self-test execution status:      (   0)	The previous self-test routine completed
					without error or no self-test has ever 
					been run.
Total time to complete Offline 
data collection: 		(  430) seconds.
Offline data collection
capabilities: 			 (0x5b) SMART execute Offline immediate.
					Auto Offline data collection on/off support.
					Suspend Offline collection upon new
					command.
					Offline surface scan supported.
					Self-test supported.
					No Conveyance Self-test supported.
					Selective Self-test supported.
SMART capabilities:            (0x0003)	Saves SMART data before entering
					power-saving mode.
					Supports SMART auto save timer.
Error logging capability:        (0x01)	Error logging supported.
					General Purpose Logging supported.
Short self-test routine 
recommended polling time: 	 (   1) minutes.
Extended self-test routine
recommended polling time: 	 (  31) minutes.

SMART Attributes Data Structure revision number: 10
Vendor Specific SMART Attributes with Thresholds:
ID# ATTRIBUTE_NAME          FLAGS    VALUE WORST THRESH FAIL RAW_VALUE
  1 Raw_Read_Error_Rate     POSR--   076   055   006    -    162998821
  3 Spin_Up_Time            PO----   099   098   000    -    0
  4 Start_Stop_Count        -O--CK   099   099   020    -    1127
  5 Reallocated_Sector_Ct   PO--CK   100   100   036    -    0
  7 Seek_Error_Rate         POSR--   086   060   030    -    428908866
  9 Power_On_Hours          -O--CK   057   057   000    -    38151
 10 Spin_Retry_Count        PO--C-   100   100   097    -    0
 12 Power_Cycle_Count       -O--CK   091   091   020    -    10184
194 Temperature_Celsius     -O---K   026   051   000    -    26
195 Hardware_ECC_Recovered  -O-RC-   076   055   000    -    162998821
197 Current_Pending_Sector  -O--C-   100   100   000    -    0
198 Offline_Uncorrectable   ----C-   100   100   000    -    0
199 UDMA_CRC_Error_Count    -OSRCK   200   174   000    -    1283
200 Multi_Zone_Error_Rate   ------   100   253   000    -    0
202 Data_Address_Mark_Errs  -O--CK   100   253   000    -    0
                            ||||||_ K auto-keep
                            |||||__ C event count
                            ||||___ R error rate
                            |||____ S speed/performance
                            ||_____ O updated online
                            |______ P prefailure warning

General Purpose Log Directory Version 1
SMART           Log Directory Version 1 [multi-sector log support]
Address    Access  R/W   Size  Description
0x00       GPL,SL  R/O      1  Log Directory
0x01       GPL,SL  R/O      1  Summary SMART error log
0x02       GPL,SL  R/O      5  Comprehensive SMART error log
0x03       GPL,SL  R/O      5  Ext. Comprehensive SMART error log
0x06       GPL,SL  R/O      1  SMART self-test log
0x07       GPL,SL  R/O      1  Extended self-test log
0x09       GPL,SL  R/W      1  Selective self-test log
0x20       GPL,SL  R/O      1  Streaming performance log [OBS-8]
0x21       GPL,SL  R/O      1  Write stream error log
0x22       GPL,SL  R/O      1  Read stream error log
0x23       GPL,SL  R/O      1  Delayed sector log [OBS-8]
0x80-0x9f  GPL,SL  R/W     16  Host vendor specific log
0xa0       GPL,SL  VS       1  Device vendor specific log
0xa1       GPL,SL  VS      20  Device vendor specific log
0xa2       GPL,SL  VS     101  Device vendor specific log
0xa8       GPL,SL  VS      20  Device vendor specific log
0xa9       GPL,SL  VS       1  Device vendor specific log
0xff       GPL     -    24064  Reserved

SMART Extended Comprehensive Error Log Version: 1 (5 sectors)
Device Error Count: 1251 (device log contains only the most recent 20 errors)
	CR     = Command Register
	FEATR  = Features Register
	COUNT  = Count (was: Sector Count) Register
	LBA_48 = Upper bytes of LBA High/Mid/Low Registers ]  ATA-8
	LH     = LBA High (was: Cylinder High) Register    ]   LBA
	LM     = LBA Mid (was: Cylinder Low) Register      ] Register
	LL     = LBA Low (was: Sector Number) Register     ]
	DV     = Device (was: Device/Head) Register
	DC     = Device Control Register
	ER     = Error register
	ST     = Status register
Powered_Up_Time is measured from power on, and printed as
DDd+hh:mm:SS.sss where DD=days, hh=hours, mm=minutes,
SS=sec, and sss=millisec. It "wraps" after 49.710 days.

Error 1251 [10] occurred at disk power-on lifetime: 30847 hours (1285 days + 7 hours)
  When the command that caused the error occurred, the device was active or idle.

  After command completion occurred, registers were:
  ER -- ST COUNT  LBA_48  LH LM LL DV DC
  -- -- -- == -- == == == -- -- -- -- --
  40 -- 51 00 2f 80 04 8c 3d 80 3d e4 00  Error: UNC at LBA = 0x80048c3d803d = 140757021065277

  Commands leading to the command that caused the error were:
  CR FEATR COUNT  LBA_48  LH LM LL DV DC  Powered_Up_Time  Command/Feature_Name
  -- == -- == -- == == == -- -- -- -- --  ---------------  --------------------
  c4 00 00 00 80 00 04 8b 00 80 e0 e4 00     00:00:30.960  READ MULTIPLE
  c8 00 00 00 80 00 04 8b 00 80 e0 e4 00     00:00:30.958  READ DMA
  c8 00 00 00 80 00 04 8b 00 80 60 e4 00     00:00:30.956  READ DMA
  c8 00 00 00 80 00 04 8a 00 80 e0 e4 00     00:00:30.955  READ DMA
  c8 00 00 00 80 00 04 8a 00 80 60 e4 00     00:00:30.953  READ DMA

Error 1250 [9] occurred at disk power-on lifetime: 30847 hours (1285 days + 7 hours)
  When the command that caused the error occurred, the device was active or idle.

  After command completion occurred, registers were:
  ER -- ST COUNT  LBA_48  LH LM LL DV DC
  -- -- -- == -- == == == -- -- -- -- --
  40 -- 51 00 00 80 04 8c 3d 80 3d e4 00  Error: UNC at LBA = 0x80048c3d803d = 140757021065277

  Commands leading to the command that caused the error were:
  CR FEATR COUNT  LBA_48  LH LM LL DV DC  Powered_Up_Time  Command/Feature_Name
  -- == -- == -- == == == -- -- -- -- --  ---------------  --------------------
  c8 00 00 00 80 00 04 8b 00 80 e0 e4 00     00:00:30.960  READ DMA
  c8 00 00 00 80 00 04 8b 00 80 60 e4 00     00:00:30.958  READ DMA
  c8 00 00 00 80 00 04 8a 00 80 e0 e4 00     00:00:30.956  READ DMA
  c8 00 00 00 80 00 04 8a 00 80 60 e4 00     00:00:30.955  READ DMA
  c8 00 00 00 80 00 04 89 00 80 e0 e4 00     00:00:30.953  READ DMA

Error 1249 [8] occurred at disk power-on lifetime: 30673 hours (1278 days + 1 hours)
  When the command that caused the error occurred, the device was active or idle.

  After command completion occurred, registers were:
  ER -- ST COUNT  LBA_48  LH LM LL DV DC
  -- -- -- == -- == == == -- -- -- -- --
  40 -- 51 00 0f 6f 04 05 91 6f 91 e4 00  Error: UNC at LBA = 0x6f0405916f91 = 122063063969681

  Commands leading to the command that caused the error were:
  CR FEATR COUNT  LBA_48  LH LM LL DV DC  Powered_Up_Time  Command/Feature_Name
  -- == -- == -- == == == -- -- -- -- --  ---------------  --------------------
  c4 00 00 00 80 00 04 05 00 6f 18 e4 00     00:00:26.925  READ MULTIPLE
  c8 00 00 00 80 00 04 05 00 6f 18 e4 00     00:00:26.922  READ DMA
  c8 00 00 00 80 00 04 04 00 6f 98 e4 00     00:00:26.921  READ DMA
  c8 00 00 00 80 00 04 04 00 6f 18 e4 00     00:00:26.919  READ DMA
  c8 00 00 00 80 00 04 03 00 6f 98 e4 00     00:00:31.792  READ DMA

Error 1248 [7] occurred at disk power-on lifetime: 31883 hours (1328 days + 11 hours)
  When the command that caused the error occurred, the device was active or idle.

  After command completion occurred, registers were:
  ER -- ST COUNT  LBA_48  LH LM LL DV DC
  -- -- -- == -- == == == -- -- -- -- --
  10 -- 51 00 00 ef 03 2c 63 ef 63 e3 00  Error: IDNF at LBA = 0xef032f63ef63 = 262796959018851

  Commands leading to the command that caused the error were:
  CR FEATR COUNT  LBA_48  LH LM LL DV DC  Powered_Up_Time  Command/Feature_Name
  -- == -- == -- == == == -- -- -- -- --  ---------------  --------------------
  c8 00 00 00 80 00 03 2c 00 ef 40 e3 00     00:00:29.047  READ DMA
  c8 00 00 00 80 00 03 2b 00 ef c0 e3 00     00:00:29.046  READ DMA
  c8 00 00 00 80 00 03 2b 00 ef 40 e3 00     00:00:29.044  READ DMA
  c8 00 00 00 80 00 03 2a 00 ef c0 e3 00     00:00:29.043  READ DMA
  c8 00 00 00 80 00 03 2a 00 ef 40 e3 00     00:00:29.040  READ DMA

Error 1247 [6] occurred at disk power-on lifetime: 30847 hours (1285 days + 7 hours)
  When the command that caused the error occurred, the device was active or idle.

  After command completion occurred, registers were:
  ER -- ST COUNT  LBA_48  LH LM LL DV DC
  -- -- -- == -- == == == -- -- -- -- --
  40 -- 51 00 2f 80 04 8c 3d 80 3d e4 00  Error: UNC at LBA = 0x80048c3d803d = 140757021065277

  Commands leading to the command that caused the error were:
  CR FEATR COUNT  LBA_48  LH LM LL DV DC  Powered_Up_Time  Command/Feature_Name
  -- == -- == -- == == == -- -- -- -- --  ---------------  --------------------
  c4 00 00 00 80 00 04 8b 00 80 e0 e4 00     00:00:30.960  READ MULTIPLE
  c8 00 00 00 80 00 04 8b 00 80 e0 e4 00     00:00:30.958  READ DMA
  c8 00 00 00 80 00 04 8b 00 80 60 e4 00     00:00:30.956  READ DMA
  c8 00 00 00 80 00 04 8a 00 80 e0 e4 00     00:00:30.955  READ DMA
  c8 00 00 00 80 00 04 8a 00 80 60 e4 00     00:00:30.953  READ DMA

Error 1246 [5] occurred at disk power-on lifetime: 30847 hours (1285 days + 7 hours)
  When the command that caused the error occurred, the device was active or idle.

  After command completion occurred, registers were:
  ER -- ST COUNT  LBA_48  LH LM LL DV DC
  -- -- -- == -- == == == -- -- -- -- --
  40 -- 51 00 00 80 04 8c 3d 80 3d e4 00  Error: UNC at LBA = 0x80048c3d803d = 140757021065277

  Commands leading to the command that caused the error were:
  CR FEATR COUNT  LBA_48  LH LM LL DV DC  Powered_Up_Time  Command/Feature_Name
  -- == -- == -- == == == -- -- -- -- --  ---------------  --------------------
  c8 00 00 00 80 00 04 8b 00 80 e0 e4 00     00:00:30.960  READ DMA
  c8 00 00 00 80 00 04 8b 00 80 60 e4 00     00:00:30.958  READ DMA
  c8 00 00 00 80 00 04 8a 00 80 e0 e4 00     00:00:30.956  READ DMA
  c8 00 00 00 80 00 04 8a 00 80 60 e4 00     00:00:30.955  READ DMA
  c8 00 00 00 80 00 04 89 00 80 e0 e4 00     00:00:30.953  READ DMA

Error 1245 [4] occurred at disk power-on lifetime: 30673 hours (1278 days + 1 hours)
  When the command that caused the error occurred, the device was active or idle.

  After command completion occurred, registers were:
  ER -- ST COUNT  LBA_48  LH LM LL DV DC
  -- -- -- == -- == == == -- -- -- -- --
  40 -- 51 00 0f 6f 04 05 91 6f 91 e4 00  Error: UNC at LBA = 0x6f0405916f91 = 122063063969681

  Commands leading to the command that caused the error were:
  CR FEATR COUNT  LBA_48  LH LM LL DV DC  Powered_Up_Time  Command/Feature_Name
  -- == -- == -- == == == -- -- -- -- --  ---------------  --------------------
  c4 00 00 00 80 00 04 05 00 6f 18 e4 00     00:00:26.925  READ MULTIPLE
  c8 00 00 00 80 00 04 05 00 6f 18 e4 00     00:00:26.922  READ DMA
  c8 00 00 00 80 00 04 04 00 6f 98 e4 00     00:00:26.921  READ DMA
  c8 00 00 00 80 00 04 04 00 6f 18 e4 00     00:00:26.919  READ DMA
  c8 00 00 00 80 00 04 03 00 6f 98 e4 00     00:00:31.792  READ DMA

Error 1244 [3] occurred at disk power-on lifetime: 31883 hours (1328 days + 11 hours)
  When the command that caused the error occurred, the device was active or idle.

  After command completion occurred, registers were:
  ER -- ST COUNT  LBA_48  LH LM LL DV DC
  -- -- -- == -- == == == -- -- -- -- --
  10 -- 51 00 00 ef 03 2c 63 ef 63 e3 00  Error: IDNF at LBA = 0xef032f63ef63 = 262796959018851

  Commands leading to the command that caused the error were:
  CR FEATR COUNT  LBA_48  LH LM LL DV DC  Powered_Up_Time  Command/Feature_Name
  -- == -- == -- == == == -- -- -- -- --  ---------------  --------------------
  c8 00 00 00 80 00 03 2c 00 ef 40 e3 00     00:00:29.047  READ DMA
  c8 00 00 00 80 00 03 2b 00 ef c0 e3 00     00:00:29.046  READ DMA
  c8 00 00 00 80 00 03 2b 00 ef 40 e3 00     00:00:29.044  READ DMA
  c8 00 00 00 80 00 03 2a 00 ef c0 e3 00     00:00:29.043  READ DMA
  c8 00 00 00 80 00 03 2a 00 ef 40 e3 00     00:00:29.040  READ DMA

SMART Extended Self-test Log Version: 1 (1 sectors)
Num  Test_Description    Status                  Remaining  LifeTime(hours)  LBA_of_first_error
# 1  Extended offline    Completed without error       00%     36357         -
# 2  Extended offline    Completed without error       00%     36220         -
# 3  Extended offline    Completed without error       00%     35280         -
# 4  Short offline       Completed without error       00%     13898         -

SMART Selective self-test log data structure revision number 1
 SPAN  MIN_LBA  MAX_LBA  CURRENT_TEST_STATUS
    1        0        0  Not_testing
    2        0        0  Not_testing
    3        0        0  Not_testing
    4        0        0  Not_testing
    5        0        0  Not_testing
Selective self-test flags (0x0):
  After scanning selected spans, do NOT read-scan remainder of disk.
If Selective self-test is pending on power-up, resume after 0 minute delay.

SCT Commands not supported

Device Statistics (GP/SMART Log 0x04) not supported

SATA Phy Event Counters (GP Log 0x11) not supported

