=== START OF INFORMATION SECTION ===
Model Family:     Seagate Barracuda 7200.7 and 7200.7 Plus
Device Model:     ST340014A
Serial Number:    --
Firmware Version: 3.06
User Capacity:    40,020,664,320 bytes [40.0 GB]
Sector Size:      512 bytes logical/physical
Device is:        In smartctl database [for details use: -P show]
ATA Version is:   ATA/ATAPI-6 T13/1410D revision 2
Local Time is:    Wed Feb 12 01:09:20 2020 +06
SMART support is: Available - device has SMART capability.
SMART support is: Enabled
AAM feature is:   Unavailable
APM feature is:   Unavailable
Rd look-ahead is: Enabled
Write cache is:   Enabled
DSN feature is:   Unavailable
ATA Security is:  Disabled, frozen [SEC2]
Wt Cache Reorder: Unavailable

=== START OF READ SMART DATA SECTION ===
SMART overall-health self-assessment test result: PASSED

General SMART Values:
Offline data collection status:  (0x82)	Offline data collection activity
					was completed without error.
					Auto Offline Data Collection: Enabled.
Self-test execution status:      (   0)	The previous self-test routine completed
					without error or no self-test has ever 
					been run.
Total time to complete Offline 
data collection: 		(  430) seconds.
Offline data collection
capabilities: 			 (0x5b) SMART execute Offline immediate.
					Auto Offline data collection on/off support.
					Suspend Offline collection upon new
					command.
					Offline surface scan supported.
					Self-test supported.
					No Conveyance Self-test supported.
					Selective Self-test supported.
SMART capabilities:            (0x0003)	Saves SMART data before entering
					power-saving mode.
					Supports SMART auto save timer.
Error logging capability:        (0x01)	Error logging supported.
					No General Purpose Logging support.
Short self-test routine 
recommended polling time: 	 (   1) minutes.
Extended self-test routine
recommended polling time: 	 (  31) minutes.

SMART Attributes Data Structure revision number: 10
Vendor Specific SMART Attributes with Thresholds:
ID# ATTRIBUTE_NAME          FLAGS    VALUE WORST THRESH FAIL RAW_VALUE
  1 Raw_Read_Error_Rate     POSR--   066   058   006    -    161579565
  3 Spin_Up_Time            PO----   099   097   000    -    0
  4 Start_Stop_Count        -O--CK   091   091   020    -    9236
  5 Reallocated_Sector_Ct   PO--CK   100   100   036    -    0
  7 Seek_Error_Rate         POSR--   082   060   030    -    195368430
  9 Power_On_Hours          -O--CK   061   061   000    -    34785
 10 Spin_Retry_Count        PO--C-   100   100   097    -    0
 12 Power_Cycle_Count       -O--CK   092   092   020    -    8808
194 Temperature_Celsius     -O---K   041   064   000    -    41
195 Hardware_ECC_Recovered  -O-RC-   066   058   000    -    161579565
197 Current_Pending_Sector  -O--C-   100   100   000    -    0
198 Offline_Uncorrectable   ----C-   100   100   000    -    0
199 UDMA_CRC_Error_Count    -OSRCK   200   181   000    -    273
200 Multi_Zone_Error_Rate   ------   100   253   000    -    0
202 Data_Address_Mark_Errs  -O--CK   100   253   000    -    0
                            ||||||_ K auto-keep
                            |||||__ C event count
                            ||||___ R error rate
                            |||____ S speed/performance
                            ||_____ O updated online
                            |______ P prefailure warning

General Purpose Log Directory not supported

SMART Log Directory Version 1 [multi-sector log support]
Address    Access  R/W   Size  Description
0x00           SL  R/O      1  Log Directory
0x01           SL  R/O      1  Summary SMART error log
0x02           SL  R/O      5  Comprehensive SMART error log
0x03           SL  R/O      5  Ext. Comprehensive SMART error log
0x06           SL  R/O      1  SMART self-test log
0x07           SL  R/O      1  Extended self-test log
0x09           SL  R/W      1  Selective self-test log
0x20           SL  R/O      1  Streaming performance log [OBS-8]
0x21           SL  R/O      1  Write stream error log
0x22           SL  R/O      1  Read stream error log
0x23           SL  R/O      1  Delayed sector log [OBS-8]
0x80-0x9f      SL  R/W     16  Host vendor specific log
0xa0           SL  VS       1  Device vendor specific log
0xa1           SL  VS      20  Device vendor specific log
0xa2           SL  VS     101  Device vendor specific log
0xa8           SL  VS      20  Device vendor specific log
0xa9           SL  VS       1  Device vendor specific log

SMART Extended Comprehensive Error Log (GP Log 0x03) not supported

SMART Error Log Version: 1
ATA Error Count: 268 (device log contains only the most recent five errors)
	CR = Command Register [HEX]
	FR = Features Register [HEX]
	SC = Sector Count Register [HEX]
	SN = Sector Number Register [HEX]
	CL = Cylinder Low Register [HEX]
	CH = Cylinder High Register [HEX]
	DH = Device/Head Register [HEX]
	DC = Device Command Register [HEX]
	ER = Error register [HEX]
	ST = Status register [HEX]
Powered_Up_Time is measured from power on, and printed as
DDd+hh:mm:SS.sss where DD=days, hh=hours, mm=minutes,
SS=sec, and sss=millisec. It "wraps" after 49.710 days.

Error 268 occurred at disk power-on lifetime: 34751 hours (1447 days + 23 hours)
  When the command that caused the error occurred, the device was active or idle.

  After command completion occurred, registers were:
  ER ST SC SN CL CH DH
  -- -- -- -- -- -- --
  84 51 01 9f cb 11 f2  Error: ICRC, ABRT 1 sectors at LBA = 0x0211cb9f = 34720671

  Commands leading to the command that caused the error were:
  CR FR SC SN CL CH DH DC   Powered_Up_Time  Command/Feature_Name
  -- -- -- -- -- -- -- --  ----------------  --------------------
  c8 00 08 98 cb 11 f2 00      00:14:12.835  READ DMA
  c8 00 10 70 d0 11 f2 00      00:14:12.834  READ DMA
  c8 00 08 18 cd 11 f2 00      00:14:12.832  READ DMA
  c8 00 08 d8 d0 11 f2 00      00:14:12.832  READ DMA
  c8 00 08 c0 ce 11 f2 00      00:14:12.824  READ DMA

Error 267 occurred at disk power-on lifetime: 34751 hours (1447 days + 23 hours)
  When the command that caused the error occurred, the device was active or idle.

  After command completion occurred, registers were:
  ER ST SC SN CL CH DH
  -- -- -- -- -- -- --
  84 51 01 df f3 08 f2  Error: ICRC, ABRT 1 sectors at LBA = 0x0208f3df = 34141151

  Commands leading to the command that caused the error were:
  CR FR SC SN CL CH DH DC   Powered_Up_Time  Command/Feature_Name
  -- -- -- -- -- -- -- --  ----------------  --------------------
  c8 00 e0 00 f3 08 f2 00      00:13:47.945  READ DMA
  25 00 00 00 f1 08 f0 00      00:13:47.933  READ DMA EXT
  c8 00 e0 00 02 09 f2 00      00:13:47.925  READ DMA
  25 00 00 00 00 09 f0 00      00:13:47.922  READ DMA EXT
  c8 00 e0 68 31 09 f2 00      00:13:47.912  READ DMA

Error 266 occurred at disk power-on lifetime: 34689 hours (1445 days + 9 hours)
  When the command that caused the error occurred, the device was active or idle.

  After command completion occurred, registers were:
  ER ST SC SN CL CH DH
  -- -- -- -- -- -- --
  84 51 01 28 ab 49 f0  Error: ICRC, ABRT 1 sectors at LBA = 0x0049ab28 = 4827944

  Commands leading to the command that caused the error were:
  CR FR SC SN CL CH DH DC   Powered_Up_Time  Command/Feature_Name
  -- -- -- -- -- -- -- --  ----------------  --------------------
  25 20 01 28 ab 49 f0 00      00:04:15.842  READ DMA EXT
  25 20 01 27 ab 49 f0 00      00:04:15.842  READ DMA EXT
  25 20 01 26 ab 49 f0 00      00:04:15.842  READ DMA EXT
  25 20 01 25 ab 49 f0 00      00:04:15.842  READ DMA EXT
  25 20 01 24 ab 49 f0 00      00:04:15.841  READ DMA EXT

Error 265 occurred at disk power-on lifetime: 34687 hours (1445 days + 7 hours)
  When the command that caused the error occurred, the device was active or idle.

  After command completion occurred, registers were:
  ER ST SC SN CL CH DH
  -- -- -- -- -- -- --
  84 51 01 9f fc e7 f1  Error: ICRC, ABRT 1 sectors at LBA = 0x01e7fc9f = 31980703

  Commands leading to the command that caused the error were:
  CR FR SC SN CL CH DH DC   Powered_Up_Time  Command/Feature_Name
  -- -- -- -- -- -- -- --  ----------------  --------------------
  c8 00 08 98 fc e7 f1 00      00:09:01.257  READ DMA
  c8 00 01 60 84 8c f1 00      00:09:01.257  READ DMA
  c8 00 08 50 50 18 f3 00      00:09:01.257  READ DMA
  c8 00 02 48 02 1b f3 00      00:09:01.282  READ DMA
  c8 00 08 40 02 1b f3 00      00:09:01.266  READ DMA

Error 264 occurred at disk power-on lifetime: 30868 hours (1286 days + 4 hours)
  When the command that caused the error occurred, the device was active or idle.

  After command completion occurred, registers were:
  ER ST SC SN CL CH DH
  -- -- -- -- -- -- --
  84 51 01 00 00 00 e0  Error: ICRC, ABRT 1 sectors at LBA = 0x00000000 = 0

  Commands leading to the command that caused the error were:
  CR FR SC SN CL CH DH DC   Powered_Up_Time  Command/Feature_Name
  -- -- -- -- -- -- -- --  ----------------  --------------------
  c8 00 01 00 00 00 e0 00      00:00:56.130  READ DMA
  c6 00 10 00 00 00 e0 00      00:00:56.130  SET MULTIPLE MODE
  91 00 3f 00 00 00 ef 00      00:00:56.130  INITIALIZE DEVICE PARAMETERS [OBS-6]
  10 00 00 00 00 00 e0 00      00:00:56.122  RECALIBRATE [OBS-4]
  00 00 01 00 00 00 00 04      00:00:40.601  NOP [Abort queued commands]

SMART Extended Self-test Log (GP Log 0x07) not supported

SMART Self-test log structure revision number 1
No self-tests have been logged.  [To run self-tests, use: smartctl -t]

SMART Selective self-test log data structure revision number 1
 SPAN  MIN_LBA  MAX_LBA  CURRENT_TEST_STATUS
    1        0        0  Not_testing
    2        0        0  Not_testing
    3        0        0  Not_testing
    4        0        0  Not_testing
    5        0        0  Not_testing
Selective self-test flags (0x0):
  After scanning selected spans, do NOT read-scan remainder of disk.
If Selective self-test is pending on power-up, resume after 0 minute delay.

SCT Commands not supported

Device Statistics (GP/SMART Log 0x04) not supported

Pending Defects log (GP Log 0x0c) not supported

SATA Phy Event Counters (GP Log 0x11) not supported



