=== START OF INFORMATION SECTION ===
Model Family:     Seagate Barracuda 7200.7 and 7200.7 Plus
Device Model:     ST340014A
Serial Number:    --
Firmware Version: 3.06
User Capacity:    40,020,664,320 bytes [40.0 GB]
Sector Size:      512 bytes logical/physical
Device is:        In smartctl database [for details use: -P show]
ATA Version is:   ATA/ATAPI-6 T13/1410D revision 2
Local Time is:    Wed May 22 11:39:57 2019 +05
SMART support is: Available - device has SMART capability.
SMART support is: Enabled
AAM feature is:   Unavailable
APM feature is:   Unavailable
Rd look-ahead is: Enabled
Write cache is:   Enabled
DSN feature is:   Unavailable
ATA Security is:  Disabled, NOT FROZEN [SEC1]
Wt Cache Reorder: Unavailable

=== START OF READ SMART DATA SECTION ===
SMART overall-health self-assessment test result: PASSED

General SMART Values:
Offline data collection status:  (0x82)	Offline data collection activity
					was completed without error.
					Auto Offline Data Collection: Enabled.
Self-test execution status:      (   0)	The previous self-test routine completed
					without error or no self-test has ever 
					been run.
Total time to complete Offline 
data collection: 		(  430) seconds.
Offline data collection
capabilities: 			 (0x5b) SMART execute Offline immediate.
					Auto Offline data collection on/off support.
					Suspend Offline collection upon new
					command.
					Offline surface scan supported.
					Self-test supported.
					No Conveyance Self-test supported.
					Selective Self-test supported.
SMART capabilities:            (0x0003)	Saves SMART data before entering
					power-saving mode.
					Supports SMART auto save timer.
Error logging capability:        (0x01)	Error logging supported.
					No General Purpose Logging support.
Short self-test routine 
recommended polling time: 	 (   1) minutes.
Extended self-test routine
recommended polling time: 	 (  31) minutes.

SMART Attributes Data Structure revision number: 10
Vendor Specific SMART Attributes with Thresholds:
ID# ATTRIBUTE_NAME          FLAGS    VALUE WORST THRESH FAIL RAW_VALUE
  1 Raw_Read_Error_Rate     POSR--   060   055   006    -    138042394
  3 Spin_Up_Time            PO----   098   097   000    -    0
  4 Start_Stop_Count        -O--CK   100   100   020    -    143
  5 Reallocated_Sector_Ct   PO--CK   100   100   036    -    8
  7 Seek_Error_Rate         POSR--   087   060   030    -    531624747
  9 Power_On_Hours          -O--CK   080   080   000    -    17944
 10 Spin_Retry_Count        PO--C-   100   100   097    -    0
 12 Power_Cycle_Count       -O--CK   097   097   020    -    3485
194 Temperature_Celsius     -O---K   038   053   000    -    38
195 Hardware_ECC_Recovered  -O-RC-   060   054   000    -    138042394
197 Current_Pending_Sector  -O--C-   100   100   000    -    0
198 Offline_Uncorrectable   ----C-   100   100   000    -    0
199 UDMA_CRC_Error_Count    -OSRCK   200   200   000    -    0
200 Multi_Zone_Error_Rate   ------   100   253   000    -    0
202 Data_Address_Mark_Errs  -O--CK   100   253   000    -    0
                            ||||||_ K auto-keep
                            |||||__ C event count
                            ||||___ R error rate
                            |||____ S speed/performance
                            ||_____ O updated online
                            |______ P prefailure warning

General Purpose Log Directory not supported

SMART Log Directory Version 1 [multi-sector log support]
Address    Access  R/W   Size  Description
0x00           SL  R/O      1  Log Directory
0x01           SL  R/O      1  Summary SMART error log
0x02           SL  R/O      5  Comprehensive SMART error log
0x03           SL  R/O      5  Ext. Comprehensive SMART error log
0x06           SL  R/O      1  SMART self-test log
0x07           SL  R/O      1  Extended self-test log
0x09           SL  R/W      1  Selective self-test log
0x20           SL  R/O      1  Streaming performance log [OBS-8]
0x21           SL  R/O      1  Write stream error log
0x22           SL  R/O      1  Read stream error log
0x23           SL  R/O      1  Delayed sector log [OBS-8]
0x80-0x9f      SL  R/W     16  Host vendor specific log
0xa0           SL  VS       1  Device vendor specific log
0xa1           SL  VS      20  Device vendor specific log
0xa2           SL  VS     101  Device vendor specific log
0xa8           SL  VS      20  Device vendor specific log
0xa9           SL  VS       1  Device vendor specific log

SMART Extended Comprehensive Error Log (GP Log 0x03) not supported

SMART Error Log Version: 1
ATA Error Count: 25 (device log contains only the most recent five errors)
	CR = Command Register [HEX]
	FR = Features Register [HEX]
	SC = Sector Count Register [HEX]
	SN = Sector Number Register [HEX]
	CL = Cylinder Low Register [HEX]
	CH = Cylinder High Register [HEX]
	DH = Device/Head Register [HEX]
	DC = Device Command Register [HEX]
	ER = Error register [HEX]
	ST = Status register [HEX]
Powered_Up_Time is measured from power on, and printed as
DDd+hh:mm:SS.sss where DD=days, hh=hours, mm=minutes,
SS=sec, and sss=millisec. It "wraps" after 49.710 days.

Error 25 occurred at disk power-on lifetime: 17646 hours (735 days + 6 hours)
  When the command that caused the error occurred, the device was active or idle.

  After command completion occurred, registers were:
  ER ST SC SN CL CH DH
  -- -- -- -- -- -- --
  40 51 08 28 a5 07 e0  Error: UNC 8 sectors at LBA = 0x0007a528 = 501032

  Commands leading to the command that caused the error were:
  CR FR SC SN CL CH DH DC   Powered_Up_Time  Command/Feature_Name
  -- -- -- -- -- -- -- --  ----------------  --------------------
  c8 00 08 28 a5 07 e0 00      01:20:04.247  READ DMA
  c8 00 08 20 a5 07 e0 00      01:20:04.247  READ DMA
  c8 00 08 18 a5 07 e0 00      01:20:04.247  READ DMA
  c8 00 08 10 a5 07 e0 00      01:20:04.232  READ DMA
  c8 00 08 08 a5 07 e0 00      01:20:04.192  READ DMA

Error 24 occurred at disk power-on lifetime: 17646 hours (735 days + 6 hours)
  When the command that caused the error occurred, the device was active or idle.

  After command completion occurred, registers were:
  ER ST SC SN CL CH DH
  -- -- -- -- -- -- --
  40 51 00 28 a5 07 e0  Error: UNC at LBA = 0x0007a528 = 501032

  Commands leading to the command that caused the error were:
  CR FR SC SN CL CH DH DC   Powered_Up_Time  Command/Feature_Name
  -- -- -- -- -- -- -- --  ----------------  --------------------
  c8 00 40 00 a5 07 e0 00      01:19:59.728  READ DMA
  ca 00 20 20 e5 b5 e1 00      01:19:59.727  WRITE DMA
  ca 00 20 c0 ec f5 e1 00      01:19:59.726  WRITE DMA
  c8 00 20 00 f3 57 e0 00      01:19:59.713  READ DMA
  ca 00 20 18 31 65 e0 00      01:19:59.711  WRITE DMA

Error 23 occurred at disk power-on lifetime: 17636 hours (734 days + 20 hours)
  When the command that caused the error occurred, the device was active or idle.

  After command completion occurred, registers were:
  ER ST SC SN CL CH DH
  -- -- -- -- -- -- --
  40 51 20 28 a5 07 e0  Error: UNC 32 sectors at LBA = 0x0007a528 = 501032

  Commands leading to the command that caused the error were:
  CR FR SC SN CL CH DH DC   Powered_Up_Time  Command/Feature_Name
  -- -- -- -- -- -- -- --  ----------------  --------------------
  c8 00 20 28 a5 07 e0 00      02:15:36.589  READ DMA
  ca 00 08 60 7b 01 e2 00      02:14:38.023  WRITE DMA
  ca 00 08 90 08 60 e0 00      02:14:38.023  WRITE DMA
  c8 00 18 e8 92 ad e0 00      02:14:38.022  READ DMA
  ca 00 01 b0 94 5b e0 00      02:14:33.259  WRITE DMA

Error 22 occurred at disk power-on lifetime: 17635 hours (734 days + 19 hours)
  When the command that caused the error occurred, the device was active or idle.

  After command completion occurred, registers were:
  ER ST SC SN CL CH DH
  -- -- -- -- -- -- --
  40 51 20 28 a5 07 e0  Error: UNC 32 sectors at LBA = 0x0007a528 = 501032

  Commands leading to the command that caused the error were:
  CR FR SC SN CL CH DH DC   Powered_Up_Time  Command/Feature_Name
  -- -- -- -- -- -- -- --  ----------------  --------------------
  c8 00 20 28 a5 07 e0 00      02:03:44.563  READ DMA
  c8 00 18 d8 17 b5 e0 00      02:03:44.519  READ DMA
  c8 00 d8 e2 b3 38 e0 00      02:03:44.513  READ DMA
  c8 00 08 e2 7c 38 e0 00      02:03:44.498  READ DMA
  c8 00 18 ea 69 38 e0 00      02:03:44.496  READ DMA

Error 21 occurred at disk power-on lifetime: 17635 hours (734 days + 19 hours)
  When the command that caused the error occurred, the device was active or idle.

  After command completion occurred, registers were:
  ER ST SC SN CL CH DH
  -- -- -- -- -- -- --
  40 51 08 28 a5 07 e0  Error: UNC 8 sectors at LBA = 0x0007a528 = 501032

  Commands leading to the command that caused the error were:
  CR FR SC SN CL CH DH DC   Powered_Up_Time  Command/Feature_Name
  -- -- -- -- -- -- -- --  ----------------  --------------------
  c8 00 08 28 a5 07 e0 00      01:23:07.967  READ DMA
  ca 00 08 10 40 63 e0 00      01:23:07.965  WRITE DMA
  ca 00 08 d8 21 5f e0 00      01:23:07.962  WRITE DMA
  c8 00 38 90 2b 41 e0 00      01:23:07.945  READ DMA
  ca 00 10 88 2a 63 e0 00      01:23:07.943  WRITE DMA

SMART Extended Self-test Log (GP Log 0x07) not supported

SMART Self-test log structure revision number 1
No self-tests have been logged.  [To run self-tests, use: smartctl -t]

SMART Selective self-test log data structure revision number 1
 SPAN  MIN_LBA  MAX_LBA  CURRENT_TEST_STATUS
    1        0        0  Not_testing
    2        0        0  Not_testing
    3        0        0  Not_testing
    4        0        0  Not_testing
    5        0        0  Not_testing
Selective self-test flags (0x0):
  After scanning selected spans, do NOT read-scan remainder of disk.
If Selective self-test is pending on power-up, resume after 0 minute delay.

SCT Commands not supported

Device Statistics (GP/SMART Log 0x04) not supported

Pending Defects log (GP Log 0x0c) not supported

SATA Phy Event Counters (GP Log 0x11) not supported

