=== START OF INFORMATION SECTION ===
Model Family:     Seagate Barracuda 7200.7 and 7200.7 Plus
Device Model:     ST340014A
Serial Number:    --
Firmware Version: 3.06
User Capacity:    40,020,664,320 bytes [40.0 GB]
Sector Size:      512 bytes logical/physical
Device is:        In smartctl database [for details use: -P show]
ATA Version is:   ATA/ATAPI-6 T13/1410D revision 2
Local Time is:    Wed Dec 23 08:53:51 2015 MST
SMART support is: Available - device has SMART capability.
SMART support is: Enabled
AAM feature is:   Unavailable
APM feature is:   Unavailable
Rd look-ahead is: Enabled
Write cache is:   Enabled
ATA Security is:  Disabled, NOT FROZEN [SEC1]
Wt Cache Reorder: Unavailable

=== START OF READ SMART DATA SECTION ===
SMART overall-health self-assessment test result: PASSED

General SMART Values:
Offline data collection status:  (0x82)	Offline data collection activity
					was completed without error.
					Auto Offline Data Collection: Enabled.
Self-test execution status:      (   0)	The previous self-test routine completed
					without error or no self-test has ever 
					been run.
Total time to complete Offline 
data collection: 		(  430) seconds.
Offline data collection
capabilities: 			 (0x5b) SMART execute Offline immediate.
					Auto Offline data collection on/off support.
					Suspend Offline collection upon new
					command.
					Offline surface scan supported.
					Self-test supported.
					No Conveyance Self-test supported.
					Selective Self-test supported.
SMART capabilities:            (0x0003)	Saves SMART data before entering
					power-saving mode.
					Supports SMART auto save timer.
Error logging capability:        (0x01)	Error logging supported.
					No General Purpose Logging support.
Short self-test routine 
recommended polling time: 	 (   1) minutes.
Extended self-test routine
recommended polling time: 	 (  31) minutes.

SMART Attributes Data Structure revision number: 10
Vendor Specific SMART Attributes with Thresholds:
ID# ATTRIBUTE_NAME          FLAGS    VALUE WORST THRESH FAIL RAW_VALUE
  1 Raw_Read_Error_Rate     POSR--   057   052   006    -    143783679
  3 Spin_Up_Time            PO----   098   098   000    -    0
  4 Start_Stop_Count        -O--CK   100   100   020    -    45
  5 Reallocated_Sector_Ct   PO--CK   100   100   036    -    1
  7 Seek_Error_Rate         POSR--   080   060   030    -    102031323
  9 Power_On_Hours          -O--CK   099   099   000    -    1556
 10 Spin_Retry_Count        PO--C-   100   100   097    -    0
 12 Power_Cycle_Count       -O--CK   100   100   020    -    899
194 Temperature_Celsius     -O---K   034   048   000    -    34
195 Hardware_ECC_Recovered  -O-RC-   057   052   000    -    143783679
197 Current_Pending_Sector  -O--C-   100   100   000    -    0
198 Offline_Uncorrectable   ----C-   100   100   000    -    0
199 UDMA_CRC_Error_Count    -OSRCK   200   197   000    -    3
200 Multi_Zone_Error_Rate   ------   100   253   000    -    0
202 Data_Address_Mark_Errs  -O--CK   100   253   000    -    0
                            ||||||_ K auto-keep
                            |||||__ C event count
                            ||||___ R error rate
                            |||____ S speed/performance
                            ||_____ O updated online
                            |______ P prefailure warning

General Purpose Log Directory Version 1
SMART           Log Directory Version 1 [multi-sector log support]
Address    Access  R/W   Size  Description
0x00       GPL,SL  R/O      1  Log Directory
0x01       GPL,SL  R/O      1  Summary SMART error log
0x02       GPL,SL  R/O      5  Comprehensive SMART error log
0x03       GPL,SL  R/O      5  Ext. Comprehensive SMART error log
0x06       GPL,SL  R/O      1  SMART self-test log
0x07       GPL,SL  R/O      1  Extended self-test log
0x09       GPL,SL  R/W      1  Selective self-test log
0x20       GPL,SL  R/O      1  Streaming performance log [OBS-8]
0x21       GPL,SL  R/O      1  Write stream error log
0x22       GPL,SL  R/O      1  Read stream error log
0x23       GPL,SL  R/O      1  Delayed sector log [OBS-8]
0x80-0x9f  GPL,SL  R/W     16  Host vendor specific log
0xa0       GPL,SL  VS       1  Device vendor specific log
0xa1       GPL,SL  VS      20  Device vendor specific log
0xa2       GPL,SL  VS     101  Device vendor specific log
0xa8       GPL,SL  VS      20  Device vendor specific log
0xa9       GPL,SL  VS       1  Device vendor specific log
0xff       GPL     -    24064  Reserved

SMART Extended Comprehensive Error Log Version: 1 (5 sectors)
Device Error Count: 9
	CR     = Command Register
	FEATR  = Features Register
	COUNT  = Count (was: Sector Count) Register
	LBA_48 = Upper bytes of LBA High/Mid/Low Registers ]  ATA-8
	LH     = LBA High (was: Cylinder High) Register    ]   LBA
	LM     = LBA Mid (was: Cylinder Low) Register      ] Register
	LL     = LBA Low (was: Sector Number) Register     ]
	DV     = Device (was: Device/Head) Register
	DC     = Device Control Register
	ER     = Error register
	ST     = Status register
Powered_Up_Time is measured from power on, and printed as
DDd+hh:mm:SS.sss where DD=days, hh=hours, mm=minutes,
SS=sec, and sss=millisec. It "wraps" after 49.710 days.

Error 9 [8] occurred at disk power-on lifetime: 5 hours (0 days + 5 hours)
  When the command that caused the error occurred, the device was active or idle.

  After command completion occurred, registers were:
  ER -- ST COUNT  LBA_48  LH LM LL DV DC
  -- -- -- == -- == == == -- -- -- -- --
  84 -- 51 00 01 00 00 00 00 00 00 f0 00  Error: ICRC, ABRT 1 sectors at LBA = 0x00000000 = 0

  Commands leading to the command that caused the error were:
  CR FEATR COUNT  LBA_48  LH LM LL DV DC  Powered_Up_Time  Command/Feature_Name
  -- == -- == -- == == == -- -- -- -- --  ---------------  --------------------
  c8 00 ff 00 01 00 00 00 00 00 00 f0 00     00:00:13.902  READ DMA
  c6 00 03 00 10 00 00 f8 00 fb 5e b0 00     00:00:13.898  SET MULTIPLE MODE
  ef 00 03 00 45 00 00 f8 00 fb 5e b0 00     00:00:08.809  SET FEATURES [Set transfer mode]
  40 00 00 00 01 00 00 fc 00 fb 0f bf 00     00:00:05.189  READ VERIFY SECTOR(S)
  10 00 00 00 3f 00 00 03 00 00 ef bf 00     00:00:00.000  RECALIBRATE [OBS-4]

Error 8 [7] occurred at disk power-on lifetime: 5 hours (0 days + 5 hours)
  When the command that caused the error occurred, the device was active or idle.

  After command completion occurred, registers were:
  ER -- ST COUNT  LBA_48  LH LM LL DV DC
  -- -- -- == -- == == == -- -- -- -- --
  84 -- 51 00 01 00 00 00 00 00 00 f0 00  Error: ICRC, ABRT 1 sectors at LBA = 0x00000000 = 0

  Commands leading to the command that caused the error were:
  CR FEATR COUNT  LBA_48  LH LM LL DV DC  Powered_Up_Time  Command/Feature_Name
  -- == -- == -- == == == -- -- -- -- --  ---------------  --------------------
  25 00 00 00 08 00 00 00 00 00 38 f0 00     00:02:17.483  READ DMA EXT
  ea 00 00 00 00 00 00 00 00 00 00 f0 00     00:02:17.472  FLUSH CACHE EXT
  29 00 00 00 40 00 00 00 00 00 00 f0 00     00:02:17.471  READ MULTIPLE EXT
  25 00 00 00 40 00 00 00 00 00 00 f0 00     00:02:17.471  READ DMA EXT
  ea 00 00 00 00 00 00 00 00 00 00 f0 00     00:02:17.471  FLUSH CACHE EXT

Error 7 [6] occurred at disk power-on lifetime: 5 hours (0 days + 5 hours)
  When the command that caused the error occurred, the device was active or idle.

  After command completion occurred, registers were:
  ER -- ST COUNT  LBA_48  LH LM LL DV DC
  -- -- -- == -- == == == -- -- -- -- --
  84 -- 51 00 01 00 00 00 00 00 00 f0 00  Error: ICRC, ABRT 1 sectors at LBA = 0x00000000 = 0

  Commands leading to the command that caused the error were:
  CR FEATR COUNT  LBA_48  LH LM LL DV DC  Powered_Up_Time  Command/Feature_Name
  -- == -- == -- == == == -- -- -- -- --  ---------------  --------------------
  c8 00 ff 00 01 00 00 00 00 00 00 f0 00     00:01:43.967  READ DMA
  c6 00 03 00 10 00 00 f8 00 fb 5e b0 00     00:01:35.588  SET MULTIPLE MODE
  ef 00 03 00 45 00 00 f8 00 fb 5e b0 00     00:01:34.388  SET FEATURES [Set transfer mode]
  40 00 00 00 01 00 00 fc 00 fb 0f bf 00     00:01:33.297  READ VERIFY SECTOR(S)
  10 00 00 00 3f 00 00 03 00 00 ef bf 00     00:01:32.054  RECALIBRATE [OBS-4]

Error 6 [5] occurred at disk power-on lifetime: 5 hours (0 days + 5 hours)
  When the command that caused the error occurred, the device was active or idle.

  After command completion occurred, registers were:
  ER -- ST COUNT  LBA_48  LH LM LL DV DC
  -- -- -- == -- == == == -- -- -- -- --
  84 -- 51 00 01 00 00 00 00 00 00 f0 00  Error: ICRC, ABRT 1 sectors at LBA = 0x00000000 = 0

  Commands leading to the command that caused the error were:
  CR FEATR COUNT  LBA_48  LH LM LL DV DC  Powered_Up_Time  Command/Feature_Name
  -- == -- == -- == == == -- -- -- -- --  ---------------  --------------------
  c8 00 ff 00 01 00 00 00 00 00 42 f0 00     00:01:09.289  READ DMA
  c8 00 ff 00 01 00 00 00 00 00 41 f0 00     00:01:09.289  READ DMA
  c8 00 ff 00 01 00 00 00 00 00 40 f0 00     00:01:34.388  READ DMA
  c8 00 ff 00 01 00 00 00 00 00 3f f0 00     00:01:33.297  READ DMA
  c8 00 ff 00 01 00 00 00 00 00 3f f0 00     00:01:32.054  READ DMA

Error 5 [4] occurred at disk power-on lifetime: 5 hours (0 days + 5 hours)
  When the command that caused the error occurred, the device was active or idle.

  After command completion occurred, registers were:
  ER -- ST COUNT  LBA_48  LH LM LL DV DC
  -- -- -- == -- == == == -- -- -- -- --
  84 -- 51 00 01 00 00 00 00 00 00 f0 00  Error: ICRC, ABRT 1 sectors at LBA = 0x00000000 = 0

  Commands leading to the command that caused the error were:
  CR FEATR COUNT  LBA_48  LH LM LL DV DC  Powered_Up_Time  Command/Feature_Name
  -- == -- == -- == == == -- -- -- -- --  ---------------  --------------------
  c8 00 ff 00 01 00 00 00 00 00 41 f0 00     00:01:09.289  READ DMA
  c8 00 ff 00 01 00 00 00 00 00 40 f0 00     00:01:09.289  READ DMA
  c8 00 ff 00 01 00 00 00 00 00 3f f0 00     00:00:59.451  READ DMA
  c8 00 ff 00 01 00 00 00 00 00 3f f0 00     00:01:33.297  READ DMA
  ef 00 03 00 45 00 00 30 00 f2 e5 f0 00     00:01:32.054  SET FEATURES [Set transfer mode]

Error 4 [3] occurred at disk power-on lifetime: 5 hours (0 days + 5 hours)
  When the command that caused the error occurred, the device was active or idle.

  After command completion occurred, registers were:
  ER -- ST COUNT  LBA_48  LH LM LL DV DC
  -- -- -- == -- == == == -- -- -- -- --
  84 -- 51 00 01 00 00 00 00 00 00 f0 00  Error: ICRC, ABRT 1 sectors at LBA = 0x00000000 = 0

  Commands leading to the command that caused the error were:
  CR FEATR COUNT  LBA_48  LH LM LL DV DC  Powered_Up_Time  Command/Feature_Name
  -- == -- == -- == == == -- -- -- -- --  ---------------  --------------------
  c8 00 ff 00 01 00 00 00 00 00 40 f0 00     00:01:09.289  READ DMA
  c8 00 ff 00 01 00 00 00 00 00 3f f0 00     00:01:09.289  READ DMA
  c8 00 ff 00 01 00 00 00 00 00 3f f0 00     00:00:59.451  READ DMA
  ef 00 03 00 45 00 00 30 00 f2 e5 f0 00     00:00:48.894  SET FEATURES [Set transfer mode]
  c6 00 ff 00 10 00 00 30 00 f2 e5 f0 00     00:01:32.054  SET MULTIPLE MODE

Error 3 [2] occurred at disk power-on lifetime: 5 hours (0 days + 5 hours)
  When the command that caused the error occurred, the device was active or idle.

  After command completion occurred, registers were:
  ER -- ST COUNT  LBA_48  LH LM LL DV DC
  -- -- -- == -- == == == -- -- -- -- --
  84 -- 51 00 01 00 00 00 00 00 00 f0 00  Error: ICRC, ABRT 1 sectors at LBA = 0x00000000 = 0

  Commands leading to the command that caused the error were:
  CR FEATR COUNT  LBA_48  LH LM LL DV DC  Powered_Up_Time  Command/Feature_Name
  -- == -- == -- == == == -- -- -- -- --  ---------------  --------------------
  c8 00 ff 00 01 00 00 00 00 00 3f f0 00     00:01:09.289  READ DMA
  c8 00 ff 00 01 00 00 00 00 00 3f f0 00     00:01:09.289  READ DMA
  ef 00 03 00 45 00 00 30 00 f2 e5 f0 00     00:00:59.451  SET FEATURES [Set transfer mode]
  c6 00 ff 00 10 00 00 30 00 f2 e5 f0 00     00:00:48.894  SET MULTIPLE MODE
  10 00 ff 00 50 00 00 30 00 f2 e5 f0 00     00:00:48.894  RECALIBRATE [OBS-4]

Error 2 [1] occurred at disk power-on lifetime: 5 hours (0 days + 5 hours)
  When the command that caused the error occurred, the device was active or idle.

  After command completion occurred, registers were:
  ER -- ST COUNT  LBA_48  LH LM LL DV DC
  -- -- -- == -- == == == -- -- -- -- --
  84 -- 51 00 01 00 00 00 00 00 00 f0 00  Error: ICRC, ABRT 1 sectors at LBA = 0x00000000 = 0

  Commands leading to the command that caused the error were:
  CR FEATR COUNT  LBA_48  LH LM LL DV DC  Powered_Up_Time  Command/Feature_Name
  -- == -- == -- == == == -- -- -- -- --  ---------------  --------------------
  c8 00 ff 00 01 00 00 00 00 00 3f f0 00     00:01:09.289  READ DMA
  ef 00 03 00 45 00 00 30 00 f2 e5 f0 00     00:01:09.289  SET FEATURES [Set transfer mode]
  c6 00 ff 00 10 00 00 30 00 f2 e5 f0 00     00:00:59.451  SET MULTIPLE MODE
  10 00 ff 00 50 00 00 30 00 f2 e5 f0 00     00:00:48.894  RECALIBRATE [OBS-4]
  91 00 ff 00 3f 00 0f 00 00 00 3f ff 00     00:00:48.894  INITIALIZE DEVICE PARAMETERS [OBS-6]

SMART Extended Self-test Log Version: 1 (1 sectors)
No self-tests have been logged.  [To run self-tests, use: smartctl -t]

SMART Selective self-test log data structure revision number 1
 SPAN  MIN_LBA  MAX_LBA  CURRENT_TEST_STATUS
    1        0        0  Not_testing
    2        0        0  Not_testing
    3        0        0  Not_testing
    4        0        0  Not_testing
    5        0        0  Not_testing
Selective self-test flags (0x0):
  After scanning selected spans, do NOT read-scan remainder of disk.
If Selective self-test is pending on power-up, resume after 0 minute delay.

SCT Commands not supported

Device Statistics (GP Log 0x04) not supported

SATA Phy Event Counters (GP Log 0x11) not supported

