smartctl 7.4 2023-08-01 r5530 [x86_64-linux-6.12.34-6.12-alt1] (ALT Sisyphus 7.4-alt1)
Copyright (C) 2002-23, Bruce Allen, Christian Franke, www.smartmontools.org

=== START OF INFORMATION SECTION ===
Model Number:                       ADATA SX6000PNP
Serial Number:                      --
Firmware Version:                   V9002s85
PCI Vendor/Subsystem ID:            0x10ec
IEEE OUI Identifier:                0x00e04c
Controller ID:                      1
NVMe Version:                       1.3
Number of Namespaces:               1
Namespace 1 Size/Capacity:          256,060,514,304 [256 GB]
Namespace 1 Formatted LBA Size:     512
Namespace 1 IEEE EUI-64:            00e04c ...
Local Time is:                      Thu Dec 11 11:17:42 2025 MSK
Firmware Updates (0x02):            1 Slot
Optional Admin Commands (0x0007):   Security Format Frmw_DL
Optional NVM Commands (0x0014):     DS_Mngmt Sav/Sel_Feat
Log Page Attributes (0x03):         S/H_per_NS Cmd_Eff_Lg
Maximum Data Transfer Size:         32 Pages
Warning  Comp. Temp. Threshold:     115 Celsius
Critical Comp. Temp. Threshold:     120 Celsius

Supported Power States
St Op     Max   Active     Idle   RL RT WL WT  Ent_Lat  Ex_Lat
 0 +     8.00W       -        -    0  0  0  0        0   50000
 1 +     4.00W       -        -    1  1  1  1        0   50000
 2 +     3.00W       -        -    2  2  2  2        0   50000
 3 -   0.0500W       -        -    3  3  3  3     4000   50000
 4 -   0.0080W       -        -    4  4  4  4     8000  100000

Supported LBA Sizes (NSID 0x1)
Id Fmt  Data  Metadt  Rel_Perf
 0 +     512       0         0

=== START OF SMART DATA SECTION ===
SMART overall-health self-assessment test result: PASSED

SMART/Health Information (NVMe Log 0x02)
Critical Warning:                   0x00
Temperature:                        43 Celsius
Available Spare:                    93%
Available Spare Threshold:          32%
Percentage Used:                    5%
Data Units Read:                    2,555,140 [1.30 TB]
Data Units Written:                 5,766,720 [2.95 TB]
Host Read Commands:                 43,274,127
Host Write Commands:                83,813,409
Controller Busy Time:               0
Power Cycles:                       345
Power On Hours:                     268
Unsafe Shutdowns:                   64
Media and Data Integrity Errors:    539
Error Information Log Entries:      18
Warning  Comp. Temperature Time:    0
Critical Comp. Temperature Time:    0
Thermal Temp. 1 Transition Count:   2095

Error Information (NVMe Log 0x01, 8 of 8 entries)
No Errors Logged

Self-tests not supported

