smartctl 7.2 2020-12-30 r5155 [x86_64-linux-5.10.74-generic-2rosa2021.1-x86_64] (local build)
Copyright (C) 2002-20, Bruce Allen, Christian Franke, www.smartmontools.org

=== START OF INFORMATION SECTION ===
Model Family:     Western Digital Elements / My Passport (USB)
Device Model:     WDC WD2500BMVU-11A04S0
Serial Number:    --
LU WWN Device Id: 5 0014ee ...
Firmware Version: 01.01A01
User Capacity:    250,059,350,016 bytes [250 GB]
Sector Size:      512 bytes logical/physical
Rotation Rate:    5400 rpm
Device is:        In smartctl database [for details use: -P show]
ATA Version is:   ATA8-ACS (minor revision not indicated)
SATA Version is:  SATA 2.5, 1.5 Gb/s
Local Time is:    Wed Mar 30 12:08:29 2022 +05
SMART support is: Available - device has SMART capability.
SMART support is: Enabled
AAM feature is:   Disabled
APM level is:     128 (minimum power consumption without standby)
Rd look-ahead is: Enabled
Write cache is:   Enabled
DSN feature is:   Unavailable
ATA Security is:  Disabled, NOT FROZEN [SEC1]
Wt Cache Reorder: Enabled

=== START OF READ SMART DATA SECTION ===
SMART overall-health self-assessment test result: PASSED

General SMART Values:
Offline data collection status:  (0x80)	Offline data collection activity
					was never started.
					Auto Offline Data Collection: Enabled.
Self-test execution status:      (   0)	The previous self-test routine completed
					without error or no self-test has ever 
					been run.
Total time to complete Offline 
data collection: 		( 7500) seconds.
Offline data collection
capabilities: 			 (0x7b) SMART execute Offline immediate.
					Auto Offline data collection on/off support.
					Suspend Offline collection upon new
					command.
					Offline surface scan supported.
					Self-test supported.
					Conveyance Self-test supported.
					Selective Self-test supported.
SMART capabilities:            (0x0003)	Saves SMART data before entering
					power-saving mode.
					Supports SMART auto save timer.
Error logging capability:        (0x01)	Error logging supported.
					General Purpose Logging supported.
Short self-test routine 
recommended polling time: 	 (   2) minutes.
Extended self-test routine
recommended polling time: 	 (  90) minutes.
Conveyance self-test routine
recommended polling time: 	 (   5) minutes.
SCT capabilities: 	       (0x303f)	SCT Status supported.
					SCT Error Recovery Control supported.
					SCT Feature Control supported.
					SCT Data Table supported.

SMART Attributes Data Structure revision number: 16
Vendor Specific SMART Attributes with Thresholds:
ID# ATTRIBUTE_NAME          FLAGS    VALUE WORST THRESH FAIL RAW_VALUE
  1 Raw_Read_Error_Rate     POSR-K   200   200   051    -    8
  3 Spin_Up_Time            POS--K   153   150   021    -    3341
  4 Start_Stop_Count        -O--CK   092   092   000    -    8579
  5 Reallocated_Sector_Ct   PO--CK   200   200   140    -    0
  7 Seek_Error_Rate         -OSR-K   200   200   000    -    5
  9 Power_On_Hours          -O--CK   072   072   000    -    20795
 10 Spin_Retry_Count        PO--CK   100   099   051    -    0
 11 Calibration_Retry_Count -O--CK   100   100   000    -    0
 12 Power_Cycle_Count       -O--CK   098   098   000    -    2796
192 Power-Off_Retract_Count -O--CK   199   199   000    -    754
193 Load_Cycle_Count        -O--CK   181   181   000    -    58977
194 Temperature_Celsius     -O---K   112   095   000    -    35
196 Reallocated_Event_Count -O--CK   200   200   000    -    0
197 Current_Pending_Sector  -O--CK   200   200   000    -    0
198 Offline_Uncorrectable   ----CK   100   253   000    -    0
199 UDMA_CRC_Error_Count    -O--CK   200   200   000    -    0
200 Multi_Zone_Error_Rate   P--R--   100   253   051    -    0
                            ||||||_ K auto-keep
                            |||||__ C event count
                            ||||___ R error rate
                            |||____ S speed/performance
                            ||_____ O updated online
                            |______ P prefailure warning

General Purpose Log Directory Version 1
SMART           Log Directory Version 1 [multi-sector log support]
Address    Access  R/W   Size  Description
0x00       GPL,SL  R/O      1  Log Directory
0x01           SL  R/O      1  Summary SMART error log
0x02           SL  R/O      5  Comprehensive SMART error log
0x03       GPL     R/O      6  Ext. Comprehensive SMART error log
0x06           SL  R/O      1  SMART self-test log
0x07       GPL     R/O      1  Extended self-test log
0x09           SL  R/W      1  Selective self-test log
0x10       GPL     R/O      1  NCQ Command Error log
0x11       GPL     R/O      1  SATA Phy Event Counters log
0x80-0x9f  GPL,SL  R/W     16  Host vendor specific log
0xa0-0xa7  GPL,SL  VS      16  Device vendor specific log
0xa8-0xb7  GPL,SL  VS       1  Device vendor specific log
0xc0       GPL,SL  VS       1  Device vendor specific log
0xc1       GPL     VS      24  Device vendor specific log
0xe0       GPL,SL  R/W      1  SCT Command/Status
0xe1       GPL,SL  R/W      1  SCT Data Transfer

SMART Extended Comprehensive Error Log Version: 1 (6 sectors)
Device Error Count: 8
	CR     = Command Register
	FEATR  = Features Register
	COUNT  = Count (was: Sector Count) Register
	LBA_48 = Upper bytes of LBA High/Mid/Low Registers ]  ATA-8
	LH     = LBA High (was: Cylinder High) Register    ]   LBA
	LM     = LBA Mid (was: Cylinder Low) Register      ] Register
	LL     = LBA Low (was: Sector Number) Register     ]
	DV     = Device (was: Device/Head) Register
	DC     = Device Control Register
	ER     = Error register
	ST     = Status register
Powered_Up_Time is measured from power on, and printed as
DDd+hh:mm:SS.sss where DD=days, hh=hours, mm=minutes,
SS=sec, and sss=millisec. It "wraps" after 49.710 days.

Error 8 [7] occurred at disk power-on lifetime: 0 hours (0 days + 0 hours)
  When the command that caused the error occurred, the device was in an unknown state.

  After command completion occurred, registers were:
  ER -- ST COUNT  LBA_48  LH LM LL DV DC
  -- -- -- == -- == == == -- -- -- -- --
  01 -- 00 01 20 00 51 00 00 40 01 00 00

  Commands leading to the command that caused the error were:
  CR FEATR COUNT  LBA_48  LH LM LL DV DC  Powered_Up_Time  Command/Feature_Name
  -- == -- == -- == == == -- -- -- -- --  ---------------  --------------------
  00 fc 25 3f 23 00 00 00 00 00 01 00 16     00:00:00.000  NOP [Reserved subcommand] [OBS-ACS-2]
  00 20 00 00 60 3f 08 16 18 25 00 01 00     00:00:24.608  NOP [Abort queued commands]
  16 20 25 3f 00 00 20 00 60 00 01 00 16     05:48:29.076  RECALIBRATE [RET-4]
  00 20 00 00 60 3e 2c 16 f4 25 00 01 00     00:00:24.608  NOP [Abort queued commands]

Error 7 [6] occurred at disk power-on lifetime: 0 hours (0 days + 0 hours)
  When the command that caused the error occurred, the device was in an unknown state.

  After command completion occurred, registers were:
  ER -- ST COUNT  LBA_48  LH LM LL DV DC
  -- -- -- == -- == == == -- -- -- -- --
  01 -- 00 01 20 00 51 00 00 40 01 00 00

  Commands leading to the command that caused the error were:
  CR FEATR COUNT  LBA_48  LH LM LL DV DC  Powered_Up_Time  Command/Feature_Name
  -- == -- == -- == == == -- -- -- -- --  ---------------  --------------------
  00 08 25 3f 18 00 00 00 00 00 01 00 16     00:00:00.000  NOP [Reserved subcommand] [OBS-ACS-2]
  00 20 00 00 60 3f 14 16 0c 25 00 01 00     00:00:24.608  NOP [Abort queued commands]
  16 2c 25 3e f4 00 20 00 60 00 01 00 16     05:48:26.016  RECALIBRATE [RET-4]
  00 20 00 00 60 3e 38 16 e8 25 00 01 00     00:00:24.608  NOP [Abort queued commands]

Error 6 [5] occurred at disk power-on lifetime: 0 hours (0 days + 0 hours)
  When the command that caused the error occurred, the device was in an unknown state.

  After command completion occurred, registers were:
  ER -- ST COUNT  LBA_48  LH LM LL DV DC
  -- -- -- == -- == == == -- -- -- -- --
  01 -- 00 01 20 00 51 00 00 40 01 00 00

  Commands leading to the command that caused the error were:
  CR FEATR COUNT  LBA_48  LH LM LL DV DC  Powered_Up_Time  Command/Feature_Name
  -- == -- == -- == == == -- -- -- -- --  ---------------  --------------------
  00 14 25 3f 0c 00 00 00 00 00 01 00 16     00:00:00.000  NOP [Reserved subcommand] [OBS-ACS-2]
  00 20 00 00 60 3f 20 16 00 25 00 01 00     00:00:24.608  NOP [Abort queued commands]
  16 38 25 3e e8 00 20 00 60 00 01 00 16     05:48:22.956  RECALIBRATE [RET-4]
  00 20 00 00 60 3e 49 16 dc 25 00 01 00     00:00:24.608  NOP [Abort queued commands]

Error 5 [4] occurred at disk power-on lifetime: 0 hours (0 days + 0 hours)
  When the command that caused the error occurred, the device was in an unknown state.

  After command completion occurred, registers were:
  ER -- ST COUNT  LBA_48  LH LM LL DV DC
  -- -- -- == -- == == == -- -- -- -- --
  01 -- 00 01 20 00 51 00 00 40 01 00 00

  Commands leading to the command that caused the error were:
  CR FEATR COUNT  LBA_48  LH LM LL DV DC  Powered_Up_Time  Command/Feature_Name
  -- == -- == -- == == == -- -- -- -- --  ---------------  --------------------
  00 20 25 3f 00 00 00 00 00 00 01 00 16     00:00:00.000  NOP [Reserved subcommand] [OBS-ACS-2]
  00 20 00 00 60 3e 2c 16 f4 25 00 01 00     00:00:24.608  NOP [Abort queued commands]
  16 49 25 3e dc 00 20 00 60 00 01 00 16     05:48:19.896  RECALIBRATE [RET-4]
  00 20 00 00 60 3e 69 16 d0 25 00 01 00     00:00:24.608  NOP [Abort queued commands]

Error 4 [3] occurred at disk power-on lifetime: 0 hours (0 days + 0 hours)
  When the command that caused the error occurred, the device was in an unknown state.

  After command completion occurred, registers were:
  ER -- ST COUNT  LBA_48  LH LM LL DV DC
  -- -- -- == -- == == == -- -- -- -- --
  01 -- 00 01 20 00 51 00 00 40 01 00 00

  Commands leading to the command that caused the error were:
  CR FEATR COUNT  LBA_48  LH LM LL DV DC  Powered_Up_Time  Command/Feature_Name
  -- == -- == -- == == == -- -- -- -- --  ---------------  --------------------
  00 2c 25 3e f4 00 00 00 00 00 01 00 16     00:00:00.000  NOP [Reserved subcommand] [OBS-ACS-2]
  00 20 00 00 60 3e 38 16 e8 25 00 01 00     00:00:24.608  NOP [Abort queued commands]
  16 69 25 3e d0 00 20 00 60 00 01 00 16     05:48:16.841  RECALIBRATE [RET-4]
  00 20 00 00 40 3e 68 16 d0 25 00 01 00     00:00:24.608  NOP [Abort queued commands]

Error 3 [2] occurred at disk power-on lifetime: 0 hours (0 days + 0 hours)
  When the command that caused the error occurred, the device was in an unknown state.

  After command completion occurred, registers were:
  ER -- ST COUNT  LBA_48  LH LM LL DV DC
  -- -- -- == -- == == == -- -- -- -- --
  01 -- 00 01 20 00 51 00 00 40 01 00 00

  Commands leading to the command that caused the error were:
  CR FEATR COUNT  LBA_48  LH LM LL DV DC  Powered_Up_Time  Command/Feature_Name
  -- == -- == -- == == == -- -- -- -- --  ---------------  --------------------
  00 38 25 3e e8 00 00 00 00 00 01 00 16     00:00:00.000  NOP [Reserved subcommand] [OBS-ACS-2]
  00 20 00 00 60 3e 49 16 dc 25 00 01 00     00:00:24.608  NOP [Abort queued commands]
  16 68 25 3e d0 00 20 00 60 00 01 00 16     05:48:13.801  RECALIBRATE [RET-4]
  00 20 00 00 20 3e 66 16 d0 25 00 01 00     00:00:16.416  NOP [Abort queued commands]

Error 2 [1] occurred at disk power-on lifetime: 0 hours (0 days + 0 hours)
  When the command that caused the error occurred, the device was in an unknown state.

  After command completion occurred, registers were:
  ER -- ST COUNT  LBA_48  LH LM LL DV DC
  -- -- -- == -- == == == -- -- -- -- --
  01 -- 00 01 20 00 51 00 00 40 01 00 00

  Commands leading to the command that caused the error were:
  CR FEATR COUNT  LBA_48  LH LM LL DV DC  Powered_Up_Time  Command/Feature_Name
  -- == -- == -- == == == -- -- -- -- --  ---------------  --------------------
  00 49 25 3e dc 00 00 00 00 00 01 00 16     00:00:00.000  NOP [Reserved subcommand] [OBS-ACS-2]
  00 20 00 00 60 3e 69 16 d0 25 00 01 00     00:00:24.608  NOP [Abort queued commands]
  16 66 25 3e d0 00 20 00 40 00 01 00 16     05:48:13.800  RECALIBRATE [RET-4]
  00 20 00 00 00 3e 64 16 d0 25 00 01 00     00:00:08.224  NOP [Abort queued commands]

Error 1 [0] occurred at disk power-on lifetime: 0 hours (0 days + 0 hours)
  When the command that caused the error occurred, the device was in an unknown state.

  After command completion occurred, registers were:
  ER -- ST COUNT  LBA_48  LH LM LL DV DC
  -- -- -- == -- == == == -- -- -- -- --
  01 -- 00 01 20 00 51 00 00 40 01 00 00

  Commands leading to the command that caused the error were:
  CR FEATR COUNT  LBA_48  LH LM LL DV DC  Powered_Up_Time  Command/Feature_Name
  -- == -- == -- == == == -- -- -- -- --  ---------------  --------------------
  00 69 25 3e d0 00 00 00 00 00 01 00 16     00:00:00.000  NOP [Reserved subcommand] [OBS-ACS-2]
  00 20 00 00 40 3e 68 16 d0 25 00 01 00     00:00:24.608  NOP [Abort queued commands]
  16 64 25 3e d0 00 20 00 20 00 01 00 16     05:48:13.798  RECALIBRATE [RET-4]
  00 20 00 00 e0 3e 63 16 d0 25 00 01 00     00:00:00.032  NOP [Abort queued commands]

SMART Extended Self-test Log Version: 1 (1 sectors)
No self-tests have been logged.  [To run self-tests, use: smartctl -t]

SMART Selective self-test log data structure revision number 1
 SPAN  MIN_LBA  MAX_LBA  CURRENT_TEST_STATUS
    1        0        0  Not_testing
    2        0        0  Not_testing
    3        0        0  Not_testing
    4        0        0  Not_testing
    5        0        0  Not_testing
Selective self-test flags (0x0):
  After scanning selected spans, do NOT read-scan remainder of disk.
If Selective self-test is pending on power-up, resume after 0 minute delay.

SCT Status Version:                  2
SCT Version (vendor specific):       258 (0x0102)
Device State:                        Active (0)
Current Temperature:                    35 Celsius
Power Cycle Min/Max Temperature:     34/35 Celsius
Lifetime    Min/Max Temperature:     34/58 Celsius
Under/Over Temperature Limit Count:   0/0
Vendor specific:
01 00 00 00 00 00 00 00 00 00 00 00 00 00 00 00
00 00 00 00 00 00 00 00 00 00 00 00 00 00 00 00

SCT Temperature History Version:     2
Temperature Sampling Period:         1 minute
Temperature Logging Interval:        1 minute
Min/Max recommended Temperature:      0/60 Celsius
Min/Max Temperature Limit:            1/85 Celsius
Temperature History Size (Index):    128 (50)

SCT Error Recovery Control:
           Read: Disabled
          Write: Disabled

Device Statistics (GP/SMART Log 0x04) not supported

Pending Defects log (GP Log 0x0c) not supported

SATA Phy Event Counters (GP Log 0x11)
ID      Size     Value  Description
0x0001  2            0  Command failed due to ICRC error
0x0002  2            0  R_ERR response for data FIS
0x0003  2            0  R_ERR response for device-to-host data FIS
0x0004  2            0  R_ERR response for host-to-device data FIS
0x0005  2            0  R_ERR response for non-data FIS
0x0006  2            0  R_ERR response for device-to-host non-data FIS
0x0007  2            0  R_ERR response for host-to-device non-data FIS
0x000a  2            1  Device-to-host register FISes sent due to a COMRESET
0x8000  4         4100  Vendor specific

