smartctl 7.3 2022-02-28 r5338 [x86_64-linux-6.1.0-25-amd64] (local build)
Copyright (C) 2002-22, Bruce Allen, Christian Franke, www.smartmontools.org

=== START OF INFORMATION SECTION ===
Model Number:                       SAMSUNG MZAL81T0HDLB-00BL2
Serial Number:                      --
Firmware Version:                   6L1QKXD7
PCI Vendor/Subsystem ID:            0x144d
IEEE OUI Identifier:                0x002538
Total NVM Capacity:                 1,024,209,543,168 [1.02 TB]
Unallocated NVM Capacity:           0
Controller ID:                      1
NVMe Version:                       2.0
Number of Namespaces:               1
Namespace 1 Size/Capacity:          1,024,209,543,168 [1.02 TB]
Namespace 1 Utilization:            540,557,713,408 [540 GB]
Namespace 1 Formatted LBA Size:     512
Namespace 1 IEEE EUI-64:            002538 ...
Local Time is:                      Sat Sep 28 16:09:38 2024 PDT
Firmware Updates (0x16):            3 Slots, no Reset required
Optional Admin Commands (0x0017):   Security Format Frmw_DL Self_Test
Optional NVM Commands (0x00df):     Comp Wr_Unc DS_Mngmt Wr_Zero Sav/Sel_Feat Timestmp Verify
Log Page Attributes (0x2f):         S/H_per_NS Cmd_Eff_Lg Ext_Get_Lg Telmtry_Lg *Other*
Maximum Data Transfer Size:         128 Pages
Warning  Comp. Temp. Threshold:     83 Celsius
Critical Comp. Temp. Threshold:     85 Celsius

Supported Power States
St Op     Max   Active     Idle   RL RT WL WT  Ent_Lat  Ex_Lat
 0 +     6.28W       -        -    0  0  0  0        0       0
 1 +     6.28W       -        -    1  1  1  1        0       0
 2 +     6.28W       -        -    2  2  2  2        0       0
 3 -   0.0600W       -        -    3  3  3  3     2000    9500
 4 -   0.0050W       -        -    4  4  4  4     3200   46000

Supported LBA Sizes (NSID 0x1)
Id Fmt  Data  Metadt  Rel_Perf
 0 +     512       0         0

=== START OF SMART DATA SECTION ===
SMART overall-health self-assessment test result: PASSED

SMART/Health Information (NVMe Log 0x02)
Critical Warning:                   0x00
Temperature:                        37 Celsius
Available Spare:                    100%
Available Spare Threshold:          10%
Percentage Used:                    0%
Data Units Read:                    855,721 [438 GB]
Data Units Written:                 2,022,337 [1.03 TB]
Host Read Commands:                 4,432,226
Host Write Commands:                8,053,398
Controller Busy Time:               40
Power Cycles:                       17
Power On Hours:                     19
Unsafe Shutdowns:                   2
Media and Data Integrity Errors:    0
Error Information Log Entries:      0
Warning  Comp. Temperature Time:    0
Critical Comp. Temperature Time:    0
Temperature Sensor 1:               37 Celsius
Temperature Sensor 2:               37 Celsius

Error Information (NVMe Log 0x01, 16 of 64 entries)
No Errors Logged

