=== START OF INFORMATION SECTION ===
Model Family:     Seagate Laptop SSHD
Device Model:     ST1000LM014-1EJ164
Serial Number:    --
LU WWN Device Id: 5 000c50 ...
Firmware Version: SM25
User Capacity:    1,000,204,886,016 bytes [1.00 TB]
Sector Sizes:     512 bytes logical, 4096 bytes physical
Rotation Rate:    5400 rpm
Form Factor:      2.5 inches
Device is:        In smartctl database [for details use: -P show]
ATA Version is:   ACS-2, ACS-3 T13/2161-D revision 3b
SATA Version is:  SATA 3.1, 6.0 Gb/s (current: 6.0 Gb/s)
Local Time is:    Tue Oct 23 10:56:04 2018 UTC
SMART support is: Available - device has SMART capability.
SMART support is: Enabled
AAM feature is:   Unavailable
APM level is:     128 (minimum power consumption without standby)
Rd look-ahead is: Enabled
Write cache is:   Enabled
DSN feature is:   Unavailable
ATA Security is:  Disabled, frozen [SEC2]
Wt Cache Reorder: Enabled

=== START OF READ SMART DATA SECTION ===
SMART overall-health self-assessment test result: PASSED
See vendor-specific Attribute list for marginal Attributes.

General SMART Values:
Offline data collection status:  (0x00)	Offline data collection activity
					was never started.
					Auto Offline Data Collection: Disabled.
Self-test execution status:      (   0)	The previous self-test routine completed
					without error or no self-test has ever 
					been run.
Total time to complete Offline 
data collection: 		(  139) seconds.
Offline data collection
capabilities: 			 (0x73) SMART execute Offline immediate.
					Auto Offline data collection on/off support.
					Suspend Offline collection upon new
					command.
					No Offline surface scan supported.
					Self-test supported.
					Conveyance Self-test supported.
					Selective Self-test supported.
SMART capabilities:            (0x0003)	Saves SMART data before entering
					power-saving mode.
					Supports SMART auto save timer.
Error logging capability:        (0x01)	Error logging supported.
					General Purpose Logging supported.
Short self-test routine 
recommended polling time: 	 (   1) minutes.
Extended self-test routine
recommended polling time: 	 ( 194) minutes.
Conveyance self-test routine
recommended polling time: 	 (   2) minutes.
SCT capabilities: 	       (0x10b1)	SCT Status supported.
					SCT Feature Control supported.
					SCT Data Table supported.

SMART Attributes Data Structure revision number: 10
Vendor Specific SMART Attributes with Thresholds:
ID# ATTRIBUTE_NAME          FLAGS    VALUE WORST THRESH FAIL RAW_VALUE
  1 Raw_Read_Error_Rate     POSR--   117   099   006    -    159461944
  3 Spin_Up_Time            PO----   098   098   000    -    0
  4 Start_Stop_Count        -O--CK   099   099   020    -    1984
  5 Reallocated_Sector_Ct   PO--CK   100   100   010    -    0
  7 Seek_Error_Rate         POSR--   082   060   030    -    177232354
  9 Power_On_Hours          -O--CK   086   086   000    -    12374
 10 Spin_Retry_Count        PO--C-   100   100   097    -    0
 12 Power_Cycle_Count       -O--CK   099   099   020    -    2005
184 End-to-End_Error        -O--CK   085   085   099    NOW  15
187 Reported_Uncorrect      -O--CK   097   097   000    -    3
188 Command_Timeout         -O--CK   100   099   000    -    17180131369
189 High_Fly_Writes         -O-RCK   100   100   000    -    0
190 Airflow_Temperature_Cel -O---K   071   043   045    Past 29 (1 90 29 24 0)
191 G-Sense_Error_Rate      -O--CK   100   100   000    -    0
192 Power-Off_Retract_Count -O--CK   100   100   000    -    84
193 Load_Cycle_Count        -O--CK   098   098   000    -    5317
194 Temperature_Celsius     -O---K   029   057   000    -    29 (0 16 0 0 0)
197 Current_Pending_Sector  -O--C-   100   100   000    -    0
198 Offline_Uncorrectable   ----C-   100   100   000    -    0
199 UDMA_CRC_Error_Count    -OSRCK   200   200   000    -    0
254 Free_Fall_Sensor        -O--CK   100   100   000    -    0
                            ||||||_ K auto-keep
                            |||||__ C event count
                            ||||___ R error rate
                            |||____ S speed/performance
                            ||_____ O updated online
                            |______ P prefailure warning

General Purpose Log Directory Version 1
SMART           Log Directory Version 1 [multi-sector log support]
Address    Access  R/W   Size  Description
0x00       GPL,SL  R/O      1  Log Directory
0x01           SL  R/O      1  Summary SMART error log
0x02           SL  R/O      5  Comprehensive SMART error log
0x03       GPL     R/O      5  Ext. Comprehensive SMART error log
0x04       GPL,SL  R/O      8  Device Statistics log
0x06           SL  R/O      1  SMART self-test log
0x07       GPL     R/O      1  Extended self-test log
0x09           SL  R/W      1  Selective self-test log
0x10       GPL     R/O      1  NCQ Command Error log
0x11       GPL     R/O      1  SATA Phy Event Counters log
0x21       GPL     R/O      1  Write stream error log
0x22       GPL     R/O      1  Read stream error log
0x30       GPL,SL  R/O      9  IDENTIFY DEVICE data log
0x80-0x9f  GPL,SL  R/W     16  Host vendor specific log
0xa1       GPL,SL  VS      20  Device vendor specific log
0xa2       GPL     VS    3900  Device vendor specific log
0xa8       GPL,SL  VS     129  Device vendor specific log
0xa9       GPL,SL  VS       1  Device vendor specific log
0xab       GPL     VS       1  Device vendor specific log
0xae       GPL     VS       1  Device vendor specific log
0xb0       GPL     VS    4580  Device vendor specific log
0xbe-0xbf  GPL     VS   65535  Device vendor specific log
0xc1       GPL,SL  VS      10  Device vendor specific log
0xc2       GPL,SL  VS      50  Device vendor specific log
0xc4       GPL,SL  VS       5  Device vendor specific log
0xe0       GPL,SL  R/W      1  SCT Command/Status
0xe1       GPL,SL  R/W      1  SCT Data Transfer

SMART Extended Comprehensive Error Log Version: 1 (5 sectors)
Device Error Count: 18
	CR     = Command Register
	FEATR  = Features Register
	COUNT  = Count (was: Sector Count) Register
	LBA_48 = Upper bytes of LBA High/Mid/Low Registers ]  ATA-8
	LH     = LBA High (was: Cylinder High) Register    ]   LBA
	LM     = LBA Mid (was: Cylinder Low) Register      ] Register
	LL     = LBA Low (was: Sector Number) Register     ]
	DV     = Device (was: Device/Head) Register
	DC     = Device Control Register
	ER     = Error register
	ST     = Status register
Powered_Up_Time is measured from power on, and printed as
DDd+hh:mm:SS.sss where DD=days, hh=hours, mm=minutes,
SS=sec, and sss=millisec. It "wraps" after 49.710 days.

Error 18 [17] occurred at disk power-on lifetime: 6893 hours (287 days + 5 hours)
  When the command that caused the error occurred, the device was active or idle.

  After command completion occurred, registers were:
  ER -- ST COUNT  LBA_48  LH LM LL DV DC
  -- -- -- == -- == == == -- -- -- -- --
  40 -- 51 00 00 00 00 00 00 0a 40 00 00  Error: UNC at LBA = 0x00000a40 = 2624

  Commands leading to the command that caused the error were:
  CR FEATR COUNT  LBA_48  LH LM LL DV DC  Powered_Up_Time  Command/Feature_Name
  -- == -- == -- == == == -- -- -- -- --  ---------------  --------------------
  25 00 00 00 16 00 00 00 00 0a 40 e0 00     00:00:08.393  READ DMA EXT
  25 00 00 00 21 00 00 00 00 08 1f e0 00     00:00:08.384  READ DMA EXT
  25 00 00 00 1f 00 00 00 00 08 00 e0 00     00:00:08.345  READ DMA EXT
  25 00 00 00 01 00 00 00 00 00 3f e0 00     00:00:08.345  READ DMA EXT
  25 00 00 00 3f 00 00 00 00 00 00 e0 00     00:00:08.344  READ DMA EXT

Error 17 [16] occurred at disk power-on lifetime: 6872 hours (286 days + 8 hours)
  When the command that caused the error occurred, the device was active or idle.

  After command completion occurred, registers were:
  ER -- ST COUNT  LBA_48  LH LM LL DV DC
  -- -- -- == -- == == == -- -- -- -- --
  40 -- 51 00 00 00 00 00 00 0a 40 00 00  Error: UNC at LBA = 0x00000a40 = 2624

  Commands leading to the command that caused the error were:
  CR FEATR COUNT  LBA_48  LH LM LL DV DC  Powered_Up_Time  Command/Feature_Name
  -- == -- == -- == == == -- -- -- -- --  ---------------  --------------------
  25 00 00 00 16 00 00 00 00 0a 40 e0 00     00:00:08.823  READ DMA EXT
  25 00 00 00 21 00 00 00 00 08 1f e0 00     00:00:08.813  READ DMA EXT
  25 00 00 00 21 00 00 00 00 08 1f e0 00     00:00:08.357  READ DMA EXT
  25 00 00 00 1f 00 00 00 00 08 00 e0 00     00:00:08.331  READ DMA EXT
  25 00 00 00 01 00 00 00 00 00 3f e0 00     00:00:08.330  READ DMA EXT

Error 16 [15] occurred at disk power-on lifetime: 6872 hours (286 days + 8 hours)
  When the command that caused the error occurred, the device was active or idle.

  After command completion occurred, registers were:
  ER -- ST COUNT  LBA_48  LH LM LL DV DC
  -- -- -- == -- == == == -- -- -- -- --
  40 -- 51 00 00 00 00 00 00 08 20 00 00  Error: UNC at LBA = 0x00000820 = 2080

  Commands leading to the command that caused the error were:
  CR FEATR COUNT  LBA_48  LH LM LL DV DC  Powered_Up_Time  Command/Feature_Name
  -- == -- == -- == == == -- -- -- -- --  ---------------  --------------------
  25 00 00 00 21 00 00 00 00 08 1f e0 00     00:00:08.357  READ DMA EXT
  25 00 00 00 1f 00 00 00 00 08 00 e0 00     00:00:08.331  READ DMA EXT
  25 00 00 00 01 00 00 00 00 00 3f e0 00     00:00:08.330  READ DMA EXT
  25 00 00 00 3f 00 00 00 00 00 00 e0 00     00:00:08.330  READ DMA EXT
  25 00 00 00 67 00 00 00 00 00 02 e0 00     00:00:08.267  READ DMA EXT

Error 15 [14] occurred at disk power-on lifetime: 6453 hours (268 days + 21 hours)
  When the command that caused the error occurred, the device was active or idle.

  After command completion occurred, registers were:
  ER -- ST COUNT  LBA_48  LH LM LL DV DC
  -- -- -- == -- == == == -- -- -- -- --
  40 -- 51 00 00 00 00 00 00 0a 40 00 00  Error: UNC at LBA = 0x00000a40 = 2624

  Commands leading to the command that caused the error were:
  CR FEATR COUNT  LBA_48  LH LM LL DV DC  Powered_Up_Time  Command/Feature_Name
  -- == -- == -- == == == -- -- -- -- --  ---------------  --------------------
  25 00 00 00 16 00 00 00 00 0a 40 e0 00     00:00:08.372  READ DMA EXT
  25 00 00 00 21 00 00 00 00 08 1f e0 00     00:00:08.361  READ DMA EXT
  25 00 00 00 1f 00 00 00 00 08 00 e0 00     00:00:08.339  READ DMA EXT
  25 00 00 00 01 00 00 00 00 00 3f e0 00     00:00:08.338  READ DMA EXT
  25 00 00 00 3f 00 00 00 00 00 00 e0 00     00:00:08.338  READ DMA EXT

Error 14 [13] occurred at disk power-on lifetime: 5227 hours (217 days + 19 hours)
  When the command that caused the error occurred, the device was active or idle.

  After command completion occurred, registers were:
  ER -- ST COUNT  LBA_48  LH LM LL DV DC
  -- -- -- == -- == == == -- -- -- -- --
  40 -- 51 00 00 00 00 01 5b 30 8a 00 00  Error: UNC at LBA = 0x015b308a = 22753418

  Commands leading to the command that caused the error were:
  CR FEATR COUNT  LBA_48  LH LM LL DV DC  Powered_Up_Time  Command/Feature_Name
  -- == -- == -- == == == -- -- -- -- --  ---------------  --------------------
  60 00 00 01 00 00 00 01 5b e4 e0 40 00     00:01:08.743  READ FPDMA QUEUED
  60 00 00 00 80 00 00 01 5b 30 18 40 00     00:01:08.303  READ FPDMA QUEUED
  60 00 00 01 00 00 00 01 5b e3 e0 40 00     00:01:08.303  READ FPDMA QUEUED
  60 00 00 01 00 00 00 01 5b e2 e0 40 00     00:01:08.302  READ FPDMA QUEUED
  60 00 00 01 00 00 00 01 5c 06 00 40 00     00:01:08.297  READ FPDMA QUEUED

Error 13 [12] occurred at disk power-on lifetime: 4615 hours (192 days + 7 hours)
  When the command that caused the error occurred, the device was active or idle.

  After command completion occurred, registers were:
  ER -- ST COUNT  LBA_48  LH LM LL DV DC
  -- -- -- == -- == == == -- -- -- -- --
  40 -- 51 00 00 00 00 00 70 77 fc 00 00  Error: UNC at LBA = 0x007077fc = 7370748

  Commands leading to the command that caused the error were:
  CR FEATR COUNT  LBA_48  LH LM LL DV DC  Powered_Up_Time  Command/Feature_Name
  -- == -- == -- == == == -- -- -- -- --  ---------------  --------------------
  60 00 00 00 08 00 00 53 f3 b1 18 40 00     00:02:15.693  READ FPDMA QUEUED
  60 00 00 00 f0 00 00 00 70 77 70 40 00     00:02:15.693  READ FPDMA QUEUED
  60 00 00 00 08 00 00 53 d0 df 40 40 00     00:02:15.692  READ FPDMA QUEUED
  60 00 00 00 70 00 00 00 70 69 60 40 00     00:02:15.691  READ FPDMA QUEUED
  60 00 00 00 08 00 00 53 f3 b0 c8 40 00     00:02:15.691  READ FPDMA QUEUED

Error 12 [11] occurred at disk power-on lifetime: 4615 hours (192 days + 7 hours)
  When the command that caused the error occurred, the device was active or idle.

  After command completion occurred, registers were:
  ER -- ST COUNT  LBA_48  LH LM LL DV DC
  -- -- -- == -- == == == -- -- -- -- --
  40 -- 51 00 00 00 00 01 0f b4 3e 00 00  Error: UNC at LBA = 0x010fb43e = 17806398

  Commands leading to the command that caused the error were:
  CR FEATR COUNT  LBA_48  LH LM LL DV DC  Powered_Up_Time  Command/Feature_Name
  -- == -- == -- == == == -- -- -- -- --  ---------------  --------------------
  60 00 00 00 e0 00 00 01 0f b4 20 40 00     00:01:31.728  READ FPDMA QUEUED
  60 00 00 00 20 00 00 02 ed de f0 40 00     00:01:31.259  READ FPDMA QUEUED
  60 00 00 00 60 00 00 02 f5 a2 c8 40 00     00:01:30.820  READ FPDMA QUEUED
  60 00 00 00 08 00 00 02 50 b1 20 40 00     00:01:30.819  READ FPDMA QUEUED
  60 00 00 00 98 00 00 00 76 be 48 40 00     00:01:30.812  READ FPDMA QUEUED

Error 11 [10] occurred at disk power-on lifetime: 4615 hours (192 days + 7 hours)
  When the command that caused the error occurred, the device was active or idle.

  After command completion occurred, registers were:
  ER -- ST COUNT  LBA_48  LH LM LL DV DC
  -- -- -- == -- == == == -- -- -- -- --
  40 -- 51 00 00 00 00 00 7a a1 a0 00 00  Error: UNC at LBA = 0x007aa1a0 = 8036768

  Commands leading to the command that caused the error were:
  CR FEATR COUNT  LBA_48  LH LM LL DV DC  Powered_Up_Time  Command/Feature_Name
  -- == -- == -- == == == -- -- -- -- --  ---------------  --------------------
  60 00 00 01 00 00 00 00 7a a1 40 40 00     00:00:27.148  READ FPDMA QUEUED
  60 00 00 01 00 00 00 00 76 d7 00 40 00     00:00:27.109  READ FPDMA QUEUED
  60 00 00 00 c0 00 00 00 73 7a f8 40 00     00:00:27.085  READ FPDMA QUEUED
  60 00 00 00 08 00 00 00 4c d8 d0 40 00     00:00:27.084  READ FPDMA QUEUED
  61 00 00 00 08 00 00 00 74 70 38 40 00     00:00:27.084  WRITE FPDMA QUEUED

SMART Extended Self-test Log Version: 1 (1 sectors)
Num  Test_Description    Status                  Remaining  LifeTime(hours)  LBA_of_first_error
# 1  Short offline       Completed without error       00%        23         -
# 2  Short offline       Completed without error       00%        23         -
# 3  Short offline       Completed without error       00%        23         -
# 4  Short offline       Completed without error       00%         0         -

SMART Selective self-test log data structure revision number 1
 SPAN  MIN_LBA  MAX_LBA  CURRENT_TEST_STATUS
    1        0        0  Not_testing
    2        0        0  Not_testing
    3        0        0  Not_testing
    4        0        0  Not_testing
    5        0        0  Not_testing
Selective self-test flags (0x0):
  After scanning selected spans, do NOT read-scan remainder of disk.
If Selective self-test is pending on power-up, resume after 0 minute delay.

SCT Status Version:                  3
SCT Version (vendor specific):       522 (0x020a)
SCT Support Level:                   1
Device State:                        Active (0)
Current Temperature:                    26 Celsius
Power Cycle Min/Max Temperature:     24/26 Celsius
Lifetime    Min/Max Temperature:     16/57 Celsius
Under/Over Temperature Limit Count:   0/1

SCT Temperature History Version:     2
Temperature Sampling Period:         1 minute
Temperature Logging Interval:        59 minutes
Min/Max recommended Temperature:      0/ 0 Celsius
Min/Max Temperature Limit:            0/ 0 Celsius
Temperature History Size (Index):    128 (84)

SCT Error Recovery Control command not supported

Device Statistics (GP Log 0x04)
Page  Offset Size        Value Flags Description
0x01  =====  =               =  ===  == General Statistics (rev 2) ==
0x01  0x008  4            2005  ---  Lifetime Power-On Resets
0x01  0x010  4           12374  ---  Power-on Hours
0x01  0x018  6     22569148836  ---  Logical Sectors Written
0x01  0x020  6       320758824  ---  Number of Write Commands
0x01  0x028  6      8049568489  ---  Logical Sectors Read
0x01  0x030  6       132329744  ---  Number of Read Commands
0x01  0x038  6               -  ---  Date and Time TimeStamp
0x03  =====  =               =  ===  == Rotating Media Statistics (rev 1) ==
0x03  0x008  4      1594366902  N--  Spindle Motor Power-on Hours
0x03  0x010  4      1594363006  N--  Head Flying Hours
0x03  0x018  4            5317  ---  Head Load Events
0x03  0x020  4               0  ---  Number of Reallocated Logical Sectors
0x03  0x028  4               0  ---  Read Recovery Attempts
0x03  0x030  4               0  ---  Number of Mechanical Start Failures
0x04  =====  =               =  ===  == General Errors Statistics (rev 1) ==
0x04  0x008  4               0  ---  Number of Reported Uncorrectable Errors
0x04  0x010  4              41  ---  Resets Between Cmd Acceptance and Completion
0x07  =====  =               =  ===  == Solid State Device Statistics (rev 1) ==
0x07  0x008  1               0  ---  Percentage Used Endurance Indicator
                                |||_ C monitored condition met
                                ||__ D supports DSN
                                |___ N normalized value

Pending Defects log (GP Log 0x0c) not supported

SATA Phy Event Counters (GP Log 0x11)
ID      Size     Value  Description
0x000a  2            3  Device-to-host register FISes sent due to a COMRESET
0x0001  2            0  Command failed due to ICRC error
0x0003  2            0  R_ERR response for device-to-host data FIS
0x0004  2            0  R_ERR response for host-to-device data FIS
0x0006  2            0  R_ERR response for device-to-host non-data FIS
0x0007  2            0  R_ERR response for host-to-device non-data FIS

