smartctl 7.4 2023-08-01 r5530 [x86_64-linux-6.6.9-200.fc39.x86_64] (local build)
Copyright (C) 2002-23, Bruce Allen, Christian Franke, www.smartmontools.org

=== START OF INFORMATION SECTION ===
Model Family:     Seagate Momentus 5400.6
Device Model:     ST9500325AS
Serial Number:    --
LU WWN Device Id: 5 000c50 ...
Firmware Version: 0005HPM1
User Capacity:    500,107,862,016 bytes [500 GB]
Sector Size:      512 bytes logical/physical
Rotation Rate:    5400 rpm
Form Factor:      2.5 inches
Device is:        In smartctl database 7.3/5528
ATA Version is:   ATA8-ACS T13/1699-D revision 4
SATA Version is:  SATA 2.6, 3.0 Gb/s
Local Time is:    Wed Jan 24 15:36:04 2024 EST
SMART support is: Available - device has SMART capability.
SMART support is: Enabled
AAM feature is:   Unavailable
APM level is:     128 (minimum power consumption without standby)
Rd look-ahead is: Enabled
Write cache is:   Enabled
DSN feature is:   Unavailable
ATA Security is:  Disabled, NOT FROZEN [SEC1]
Wt Cache Reorder: Unknown

=== START OF READ SMART DATA SECTION ===
SMART overall-health self-assessment test result: PASSED
See vendor-specific Attribute list for marginal Attributes.

General SMART Values:
Offline data collection status:  (0x00)	Offline data collection activity
					was never started.
					Auto Offline Data Collection: Disabled.
Self-test execution status:      (   0)	The previous self-test routine completed
					without error or no self-test has ever 
					been run.
Total time to complete Offline 
data collection: 		(    0) seconds.
Offline data collection
capabilities: 			 (0x53) SMART execute Offline immediate.
					Auto Offline data collection on/off support.
					Suspend Offline collection upon new
					command.
					No Offline surface scan supported.
					Self-test supported.
					No Conveyance Self-test supported.
					Selective Self-test supported.
SMART capabilities:            (0x0003)	Saves SMART data before entering
					power-saving mode.
					Supports SMART auto save timer.
Error logging capability:        (0x01)	Error logging supported.
					General Purpose Logging supported.
Short self-test routine 
recommended polling time: 	 (   2) minutes.
Extended self-test routine
recommended polling time: 	 ( 139) minutes.
SCT capabilities: 	       (0x103f)	SCT Status supported.
					SCT Error Recovery Control supported.
					SCT Feature Control supported.
					SCT Data Table supported.

SMART Attributes Data Structure revision number: 10
Vendor Specific SMART Attributes with Thresholds:
ID# ATTRIBUTE_NAME          FLAGS    VALUE WORST THRESH FAIL RAW_VALUE
  1 Raw_Read_Error_Rate     POSR--   118   083   006    -    193187901
  3 Spin_Up_Time            -O----   099   099   000    -    0
  4 Start_Stop_Count        PO--CK   094   094   000    -    6601
  5 Reallocated_Sector_Ct   PO--CK   100   100   036    -    3
  7 Seek_Error_Rate         POSR--   086   060   030    -    420986849
  9 Power_On_Hours          -O--CK   090   090   000    -    9545
 10 Spin_Retry_Count        PO--C-   100   100   097    -    0
 12 Power_Cycle_Count       PO--CK   094   094   020    -    6532
183 Runtime_Bad_Block       -O--CK   100   253   000    -    0
184 End-to-End_Error        PO--CK   100   100   097    -    0
187 Reported_Uncorrect      -O--CK   001   001   000    -    6603
188 Command_Timeout         -O--CK   100   099   000    -    261997002930
189 High_Fly_Writes         -O-RCK   100   100   000    -    0
190 Airflow_Temperature_Cel -O---K   065   043   045    Past 35 (0 22 35 23 0)
191 G-Sense_Error_Rate      -O--CK   100   100   000    -    158
192 Power-Off_Retract_Count -O--CK   100   100   000    -    70
193 Load_Cycle_Count        -O--CK   009   009   000    -    183250
194 Temperature_Celsius     -O---K   035   057   000    -    35 (0 16 0 0 0)
195 Hardware_ECC_Recovered  -O-RC-   050   042   000    -    193187901
196 Reallocated_Event_Count PO--CK   100   100   036    -    3
197 Current_Pending_Sector  -O--C-   100   100   000    -    2
198 Offline_Uncorrectable   ----C-   100   100   000    -    0
199 UDMA_CRC_Error_Count    -OSRCK   200   200   000    -    0
                            ||||||_ K auto-keep
                            |||||__ C event count
                            ||||___ R error rate
                            |||____ S speed/performance
                            ||_____ O updated online
                            |______ P prefailure warning

General Purpose Log Directory Version 1
SMART           Log Directory Version 1 [multi-sector log support]
Address    Access  R/W   Size  Description
0x00       GPL,SL  R/O      1  Log Directory
0x01       GPL,SL  R/O      1  Summary SMART error log
0x02       GPL,SL  R/O      5  Comprehensive SMART error log
0x03       GPL,SL  R/O      5  Ext. Comprehensive SMART error log
0x06       GPL,SL  R/O      1  SMART self-test log
0x07       GPL,SL  R/O      1  Extended self-test log
0x09       GPL,SL  R/W      1  Selective self-test log
0x10       GPL,SL  R/O      1  NCQ Command Error log
0x11       GPL,SL  R/O      1  SATA Phy Event Counters log
0x21       GPL,SL  R/O      1  Write stream error log
0x22       GPL,SL  R/O      1  Read stream error log
0x80-0x9f  GPL,SL  R/W     16  Host vendor specific log
0xa1       GPL,SL  VS      20  Device vendor specific log
0xa2       GPL     VS    2248  Device vendor specific log
0xa8       GPL,SL  VS      65  Device vendor specific log
0xa9       GPL,SL  VS       1  Device vendor specific log
0xb0       GPL     VS    2864  Device vendor specific log
0xbe-0xbf  GPL     VS   65535  Device vendor specific log
0xe0       GPL,SL  R/W      1  SCT Command/Status
0xe1       GPL,SL  R/W      1  SCT Data Transfer

SMART Extended Comprehensive Error Log Version: 1 (5 sectors)
Device Error Count: 6194 (device log contains only the most recent 20 errors)
	CR     = Command Register
	FEATR  = Features Register
	COUNT  = Count (was: Sector Count) Register
	LBA_48 = Upper bytes of LBA High/Mid/Low Registers ]  ATA-8
	LH     = LBA High (was: Cylinder High) Register    ]   LBA
	LM     = LBA Mid (was: Cylinder Low) Register      ] Register
	LL     = LBA Low (was: Sector Number) Register     ]
	DV     = Device (was: Device/Head) Register
	DC     = Device Control Register
	ER     = Error register
	ST     = Status register
Powered_Up_Time is measured from power on, and printed as
DDd+hh:mm:SS.sss where DD=days, hh=hours, mm=minutes,
SS=sec, and sss=millisec. It "wraps" after 49.710 days.

Error 6194 [13] occurred at disk power-on lifetime: 9530 hours (397 days + 2 hours)
  When the command that caused the error occurred, the device was active or idle.

  After command completion occurred, registers were:
  ER -- ST COUNT  LBA_48  LH LM LL DV DC
  -- -- -- == -- == == == -- -- -- -- --
  40 -- 51 00 00 00 c3 00 f5 0e 83 00 00  Error: UNC at LBA = 0xc300f50e83 = 837534682755

  Commands leading to the command that caused the error were:
  CR FEATR COUNT  LBA_48  LH LM LL DV DC  Powered_Up_Time  Command/Feature_Name
  -- == -- == -- == == == -- -- -- -- --  ---------------  --------------------
  25 00 00 20 00 00 be 00 20 0e 00 e0 00     00:43:41.123  READ DMA EXT
  25 00 00 20 00 00 be 00 00 0e 00 e0 00     00:43:41.060  READ DMA EXT
  25 00 00 20 00 00 ae 00 40 0e 00 e0 00     00:43:34.242  READ DMA EXT
  25 00 00 20 00 00 ae 00 20 0e 00 e0 00     00:43:34.179  READ DMA EXT
  25 00 00 20 00 00 9e 00 60 0e 00 e0 00     00:43:27.358  READ DMA EXT

Error 6193 [12] occurred at disk power-on lifetime: 9511 hours (396 days + 7 hours)
  When the command that caused the error occurred, the device was active or idle.

  After command completion occurred, registers were:
  ER -- ST COUNT  LBA_48  LH LM LL DV DC
  -- -- -- == -- == == == -- -- -- -- --
  40 -- 51 00 00 00 c3 00 f5 0e 83 00 00  Error: WP at LBA = 0xc300f50e83 = 837534682755

  Commands leading to the command that caused the error were:
  CR FEATR COUNT  LBA_48  LH LM LL DV DC  Powered_Up_Time  Command/Feature_Name
  -- == -- == -- == == == -- -- -- -- --  ---------------  --------------------
  61 00 00 00 1e 00 7a 00 40 02 80 40 00     00:38:46.680  WRITE FPDMA QUEUED
  60 00 00 00 a0 00 83 00 9e 00 e0 40 00     00:38:46.680  READ FPDMA QUEUED
  61 00 00 00 06 00 c6 00 d2 0e e8 40 00     00:38:46.647  WRITE FPDMA QUEUED
  61 00 00 00 0a 00 c6 00 d2 0e f0 40 00     00:38:46.647  WRITE FPDMA QUEUED
  61 00 00 00 20 00 ca 00 d0 1c 80 40 00     00:38:46.646  WRITE FPDMA QUEUED

Error 6192 [11] occurred at disk power-on lifetime: 9511 hours (396 days + 7 hours)
  When the command that caused the error occurred, the device was active or idle.

  After command completion occurred, registers were:
  ER -- ST COUNT  LBA_48  LH LM LL DV DC
  -- -- -- == -- == == == -- -- -- -- --
  40 -- 51 00 00 00 c3 00 f5 0e 83 00 00  Error: UNC at LBA = 0xc300f50e83 = 837534682755

  Commands leading to the command that caused the error were:
  CR FEATR COUNT  LBA_48  LH LM LL DV DC  Powered_Up_Time  Command/Feature_Name
  -- == -- == -- == == == -- -- -- -- --  ---------------  --------------------
  60 00 00 00 08 00 01 00 84 07 a0 40 00     00:38:41.445  READ FPDMA QUEUED
  61 00 00 00 03 00 c4 00 d4 0e 20 40 00     00:38:41.435  WRITE FPDMA QUEUED
  61 00 00 00 08 00 20 00 b8 0c b0 40 00     00:38:41.433  WRITE FPDMA QUEUED
  61 00 00 00 39 00 50 00 1d 09 c0 40 00     00:38:41.433  WRITE FPDMA QUEUED
  60 00 00 00 20 00 c6 00 d2 0e e0 40 00     00:38:41.432  READ FPDMA QUEUED

Error 6191 [10] occurred at disk power-on lifetime: 9511 hours (396 days + 7 hours)
  When the command that caused the error occurred, the device was active or idle.

  After command completion occurred, registers were:
  ER -- ST COUNT  LBA_48  LH LM LL DV DC
  -- -- -- == -- == == == -- -- -- -- --
  40 -- 51 00 00 00 c3 00 f5 0e 83 00 00  Error: WP at LBA = 0xc300f50e83 = 837534682755

  Commands leading to the command that caused the error were:
  CR FEATR COUNT  LBA_48  LH LM LL DV DC  Powered_Up_Time  Command/Feature_Name
  -- == -- == -- == == == -- -- -- -- --  ---------------  --------------------
  61 00 00 00 20 00 d7 00 68 1c e0 40 00     00:38:39.045  WRITE FPDMA QUEUED
  61 00 00 00 09 00 c6 00 d2 0e c8 40 00     00:38:38.916  WRITE FPDMA QUEUED
  61 00 00 00 1b 00 78 00 ab 02 40 40 00     00:38:38.916  WRITE FPDMA QUEUED
  61 00 00 00 07 00 c4 00 8f 0e 60 40 00     00:38:38.915  WRITE FPDMA QUEUED
  61 00 00 00 03 00 c4 00 8f 0e 68 40 00     00:38:38.915  WRITE FPDMA QUEUED

Error 6190 [9] occurred at disk power-on lifetime: 9511 hours (396 days + 7 hours)
  When the command that caused the error occurred, the device was active or idle.

  After command completion occurred, registers were:
  ER -- ST COUNT  LBA_48  LH LM LL DV DC
  -- -- -- == -- == == == -- -- -- -- --
  40 -- 51 00 00 00 c3 00 f5 0e 83 00 00  Error: UNC at LBA = 0xc300f50e83 = 837534682755

  Commands leading to the command that caused the error were:
  CR FEATR COUNT  LBA_48  LH LM LL DV DC  Powered_Up_Time  Command/Feature_Name
  -- == -- == -- == == == -- -- -- -- --  ---------------  --------------------
  60 00 00 00 20 00 c4 00 8f 0e 40 40 00     00:38:33.900  READ FPDMA QUEUED
  60 00 00 00 20 00 c3 00 f5 0e 80 40 00     00:38:33.899  READ FPDMA QUEUED
  60 00 00 00 20 00 c3 00 f5 0e a0 40 00     00:38:33.899  READ FPDMA QUEUED
  61 00 00 00 08 00 7c 00 4f 00 58 40 00     00:38:33.898  WRITE FPDMA QUEUED
  60 00 00 00 08 00 01 00 84 07 98 40 00     00:38:33.898  READ FPDMA QUEUED

Error 6189 [8] occurred at disk power-on lifetime: 9511 hours (396 days + 7 hours)
  When the command that caused the error occurred, the device was active or idle.

  After command completion occurred, registers were:
  ER -- ST COUNT  LBA_48  LH LM LL DV DC
  -- -- -- == -- == == == -- -- -- -- --
  40 -- 51 00 00 00 c3 00 f5 0e 83 00 00  Error: WP at LBA = 0xc300f50e83 = 837534682755

  Commands leading to the command that caused the error were:
  CR FEATR COUNT  LBA_48  LH LM LL DV DC  Powered_Up_Time  Command/Feature_Name
  -- == -- == -- == == == -- -- -- -- --  ---------------  --------------------
  61 00 00 00 04 00 4e 00 59 0e 20 40 00     00:38:31.435  WRITE FPDMA QUEUED
  60 00 00 00 20 00 c3 00 f5 0e 80 40 00     00:38:31.434  READ FPDMA QUEUED
  60 00 00 00 08 00 01 00 84 07 98 40 00     00:38:31.433  READ FPDMA QUEUED
  61 00 00 00 08 00 7c 00 4f 00 58 40 00     00:38:31.433  WRITE FPDMA QUEUED
  60 00 00 00 20 00 c3 00 f5 0e a0 40 00     00:38:31.433  READ FPDMA QUEUED

Error 6188 [7] occurred at disk power-on lifetime: 9511 hours (396 days + 7 hours)
  When the command that caused the error occurred, the device was active or idle.

  After command completion occurred, registers were:
  ER -- ST COUNT  LBA_48  LH LM LL DV DC
  -- -- -- == -- == == == -- -- -- -- --
  40 -- 51 00 00 00 c3 00 f5 0e 83 00 00  Error: UNC at LBA = 0xc300f50e83 = 837534682755

  Commands leading to the command that caused the error were:
  CR FEATR COUNT  LBA_48  LH LM LL DV DC  Powered_Up_Time  Command/Feature_Name
  -- == -- == -- == == == -- -- -- -- --  ---------------  --------------------
  60 00 00 00 20 00 c3 00 f5 0e 80 40 00     00:38:28.903  READ FPDMA QUEUED
  61 00 00 00 03 00 4e 00 59 0e 10 40 00     00:38:28.903  WRITE FPDMA QUEUED
  61 00 00 00 20 00 ca 00 d0 1c 80 40 00     00:38:28.903  WRITE FPDMA QUEUED
  60 00 00 00 20 00 c3 00 f5 0e a0 40 00     00:38:28.902  READ FPDMA QUEUED
  61 00 00 00 08 00 7c 00 4f 00 58 40 00     00:38:28.902  WRITE FPDMA QUEUED

Error 6187 [6] occurred at disk power-on lifetime: 9511 hours (396 days + 7 hours)
  When the command that caused the error occurred, the device was active or idle.

  After command completion occurred, registers were:
  ER -- ST COUNT  LBA_48  LH LM LL DV DC
  -- -- -- == -- == == == -- -- -- -- --
  40 -- 51 00 00 00 c3 00 f5 0e 83 00 00  Error: UNC at LBA = 0xc300f50e83 = 837534682755

  Commands leading to the command that caused the error were:
  CR FEATR COUNT  LBA_48  LH LM LL DV DC  Powered_Up_Time  Command/Feature_Name
  -- == -- == -- == == == -- -- -- -- --  ---------------  --------------------
  60 00 00 00 20 00 c3 00 f5 0e a0 40 00     00:38:26.520  READ FPDMA QUEUED
  61 00 00 00 20 00 ca 00 d0 1c 80 40 00     00:38:26.502  WRITE FPDMA QUEUED
  61 00 00 00 03 00 4e 00 59 0e 10 40 00     00:38:26.502  WRITE FPDMA QUEUED
  61 00 00 00 07 00 4e 00 59 0e 18 40 00     00:38:26.501  WRITE FPDMA QUEUED
  61 00 00 00 20 00 ca 00 d0 1c 80 40 00     00:38:26.500  WRITE FPDMA QUEUED

SMART Extended Self-test Log Version: 1 (1 sectors)
Num  Test_Description    Status                  Remaining  LifeTime(hours)  LBA_of_first_error
# 1  Short offline       Completed: read failure       90%      6005         247723395
# 2  Short offline       Completed without error       00%      4110         -
# 3  Short offline       Interrupted (host reset)      00%      4101         -
# 4  Short offline       Completed without error       00%      4096         -
# 5  Short offline       Completed without error       00%      4084         -
# 6  Short offline       Completed without error       00%      4077         -
# 7  Short offline       Completed without error       00%      4061         -
# 8  Short offline       Completed without error       00%      4056         -
# 9  Short offline       Completed without error       00%      4049         -
#10  Short offline       Completed without error       00%      4037         -
#11  Short offline       Completed without error       00%      4024         -
#12  Short offline       Completed without error       00%      4008         -
#13  Short offline       Completed without error       00%      4000         -
#14  Short offline       Completed without error       00%      3987         -
#15  Short offline       Completed without error       00%      3970         -
#16  Short offline       Completed without error       00%      3962         -
#17  Short offline       Interrupted (host reset)      00%      3952         -
#18  Short offline       Completed without error       00%      3944         -
#19  Short offline       Completed without error       00%      3864         -

SMART Selective self-test log data structure revision number 1
 SPAN  MIN_LBA  MAX_LBA  CURRENT_TEST_STATUS
    1        0        0  Not_testing
    2        0        0  Not_testing
    3        0        0  Not_testing
    4        0        0  Not_testing
    5        0        0  Not_testing
Selective self-test flags (0x0):
  After scanning selected spans, do NOT read-scan remainder of disk.
If Selective self-test is pending on power-up, resume after 0 minute delay.

SCT Status Version:                  3
SCT Version (vendor specific):       522 (0x020a)
Device State:                        Active (0)
Current Temperature:                    35 Celsius
Power Cycle Min/Max Temperature:     23/35 Celsius
Lifetime    Min/Max Temperature:      0/58 Celsius
Under/Over Temperature Limit Count:   0/36

SCT Temperature History Version:     2
Temperature Sampling Period:         1 minute
Temperature Logging Interval:        1 minute
Min/Max recommended Temperature:      0/ 0 Celsius
Min/Max Temperature Limit:            0/ 0 Celsius
Temperature History Size (Index):    128 (127)

SCT Error Recovery Control:
           Read: Disabled
          Write: Disabled

Device Statistics (GP/SMART Log 0x04) not supported

Pending Defects log (GP Log 0x0c) not supported

SATA Phy Event Counters (GP Log 0x11)
ID      Size     Value  Description
0x000a  2            3  Device-to-host register FISes sent due to a COMRESET
0x0001  2            0  Command failed due to ICRC error
0x0003  2            0  R_ERR response for device-to-host data FIS
0x0004  2            0  R_ERR response for host-to-device data FIS
0x0006  2            0  R_ERR response for device-to-host non-data FIS
0x0007  2            0  R_ERR response for host-to-device non-data FIS

