=== START OF INFORMATION SECTION ===
Model Family:     Seagate Momentus 5400.6
Device Model:     ST9500325AS
Serial Number:    --
LU WWN Device Id: 5 000c50 ...
Firmware Version: 0003SDM1
User Capacity:    500 107 862 016 bytes [500 GB]
Sector Size:      512 bytes logical/physical
Rotation Rate:    5400 rpm
Device is:        In smartctl database [for details use: -P show]
ATA Version is:   ATA8-ACS T13/1699-D revision 4
SATA Version is:  SATA 2.6, 3.0 Gb/s
Local Time is:    Sat Feb 27 20:06:35 2016 MSK
SMART support is: Available - device has SMART capability.
SMART support is: Enabled
AAM feature is:   Unavailable
APM level is:     128 (minimum power consumption without standby)
Rd look-ahead is: Enabled
Write cache is:   Enabled
ATA Security is:  Disabled, frozen [SEC2]
Wt Cache Reorder: Unknown

=== START OF READ SMART DATA SECTION ===
SMART overall-health self-assessment test result: PASSED

General SMART Values:
Offline data collection status:  (0x00)	Offline data collection activity
					was never started.
					Auto Offline Data Collection: Disabled.
Self-test execution status:      (   0)	The previous self-test routine completed
					without error or no self-test has ever 
					been run.
Total time to complete Offline 
data collection: 		(    0) seconds.
Offline data collection
capabilities: 			 (0x73) SMART execute Offline immediate.
					Auto Offline data collection on/off support.
					Suspend Offline collection upon new
					command.
					No Offline surface scan supported.
					Self-test supported.
					Conveyance Self-test supported.
					Selective Self-test supported.
SMART capabilities:            (0x0003)	Saves SMART data before entering
					power-saving mode.
					Supports SMART auto save timer.
Error logging capability:        (0x01)	Error logging supported.
					General Purpose Logging supported.
Short self-test routine 
recommended polling time: 	 (   1) minutes.
Extended self-test routine
recommended polling time: 	 ( 138) minutes.
Conveyance self-test routine
recommended polling time: 	 (   2) minutes.
SCT capabilities: 	       (0x103b)	SCT Status supported.
					SCT Error Recovery Control supported.
					SCT Feature Control supported.
					SCT Data Table supported.

SMART Attributes Data Structure revision number: 10
Vendor Specific SMART Attributes with Thresholds:
ID# ATTRIBUTE_NAME          FLAGS    VALUE WORST THRESH FAIL RAW_VALUE
  1 Raw_Read_Error_Rate     POSR--   119   078   006    -    223829069
  3 Spin_Up_Time            PO----   098   098   000    -    0
  4 Start_Stop_Count        -O--CK   095   095   020    -    5330
  5 Reallocated_Sector_Ct   PO--CK   041   041   036    -    1226
  7 Seek_Error_Rate         POSR--   082   060   030    -    8932650545
  9 Power_On_Hours          -O--CK   084   084   000    -    14140
 10 Spin_Retry_Count        PO--C-   100   100   097    -    0
 12 Power_Cycle_Count       -O--CK   095   095   020    -    5143
184 End-to-End_Error        -O--CK   100   100   099    -    0
187 Reported_Uncorrect      -O--CK   001   001   000    -    57050
188 Command_Timeout         -O--CK   100   001   000    -    4295167796
189 High_Fly_Writes         -O-RCK   100   100   000    -    0
190 Airflow_Temperature_Cel -O---K   068   056   045    -    32 (Min/Max 31/32)
191 G-Sense_Error_Rate      -O--CK   100   100   000    -    173
192 Power-Off_Retract_Count -O--CK   100   100   000    -    1472
193 Load_Cycle_Count        -O--CK   043   043   000    -    114906
194 Temperature_Celsius     -O---K   032   044   000    -    32 (0 13 0 0 0)
195 Hardware_ECC_Recovered  -O-RC-   050   038   000    -    223829069
197 Current_Pending_Sector  -O--C-   100   100   000    -    9
198 Offline_Uncorrectable   ----C-   100   100   000    -    9
199 UDMA_CRC_Error_Count    -OSRCK   200   200   000    -    1
254 Free_Fall_Sensor        -O--CK   100   100   000    -    0
                            ||||||_ K auto-keep
                            |||||__ C event count
                            ||||___ R error rate
                            |||____ S speed/performance
                            ||_____ O updated online
                            |______ P prefailure warning

General Purpose Log Directory Version 1
SMART           Log Directory Version 1 [multi-sector log support]
Address    Access  R/W   Size  Description
0x00       GPL,SL  R/O      1  Log Directory
0x01       GPL,SL  R/O      1  Summary SMART error log
0x02       GPL,SL  R/O      5  Comprehensive SMART error log
0x03       GPL,SL  R/O      5  Ext. Comprehensive SMART error log
0x06       GPL,SL  R/O      1  SMART self-test log
0x07       GPL,SL  R/O      1  Extended self-test log
0x09       GPL,SL  R/W      1  Selective self-test log
0x10       GPL,SL  R/O      1  NCQ Command Error log
0x11       GPL,SL  R/O      1  SATA Phy Event Counters
0x21       GPL,SL  R/O      1  Write stream error log
0x22       GPL,SL  R/O      1  Read stream error log
0x80-0x9f  GPL,SL  R/W     16  Host vendor specific log
0xa1       GPL,SL  VS      20  Device vendor specific log
0xa2       GPL     VS    2248  Device vendor specific log
0xa8       GPL,SL  VS      65  Device vendor specific log
0xa9       GPL,SL  VS       1  Device vendor specific log
0xb0       GPL     VS    2864  Device vendor specific log
0xbe-0xbf  GPL     VS   65535  Device vendor specific log
0xe0       GPL,SL  R/W      1  SCT Command/Status
0xe1       GPL,SL  R/W      1  SCT Data Transfer

SMART Extended Comprehensive Error Log Version: 1 (5 sectors)
Device Error Count: 55516 (device log contains only the most recent 20 errors)
	CR     = Command Register
	FEATR  = Features Register
	COUNT  = Count (was: Sector Count) Register
	LBA_48 = Upper bytes of LBA High/Mid/Low Registers ]  ATA-8
	LH     = LBA High (was: Cylinder High) Register    ]   LBA
	LM     = LBA Mid (was: Cylinder Low) Register      ] Register
	LL     = LBA Low (was: Sector Number) Register     ]
	DV     = Device (was: Device/Head) Register
	DC     = Device Control Register
	ER     = Error register
	ST     = Status register
Powered_Up_Time is measured from power on, and printed as
DDd+hh:mm:SS.sss where DD=days, hh=hours, mm=minutes,
SS=sec, and sss=millisec. It "wraps" after 49.710 days.

Error 55516 [15] occurred at disk power-on lifetime: 14090 hours (587 days + 2 hours)
  When the command that caused the error occurred, the device was active or idle.

  After command completion occurred, registers were:
  ER -- ST COUNT  LBA_48  LH LM LL DV DC
  -- -- -- == -- == == == -- -- -- -- --
  40 -- 51 00 00 00 00 00 57 e9 97 00 00  Error: UNC at LBA = 0x0057e997 = 5761431

  Commands leading to the command that caused the error were:
  CR FEATR COUNT  LBA_48  LH LM LL DV DC  Powered_Up_Time  Command/Feature_Name
  -- == -- == -- == == == -- -- -- -- --  ---------------  --------------------
  60 00 00 00 08 00 00 00 57 e9 90 40 00     00:53:05.527  READ FPDMA QUEUED
  60 00 00 00 08 00 00 00 e0 05 20 40 00     00:53:05.392  READ FPDMA QUEUED
  ea 00 00 00 00 00 00 00 00 00 00 a0 00     00:53:05.249  FLUSH CACHE EXT
  ea 00 00 00 00 00 00 00 00 00 00 a0 00     00:53:05.248  FLUSH CACHE EXT
  ea 00 00 00 00 00 00 00 00 00 00 a0 00     00:53:05.248  FLUSH CACHE EXT

Error 55515 [14] occurred at disk power-on lifetime: 14090 hours (587 days + 2 hours)
  When the command that caused the error occurred, the device was active or idle.

  After command completion occurred, registers were:
  ER -- ST COUNT  LBA_48  LH LM LL DV DC
  -- -- -- == -- == == == -- -- -- -- --
  40 -- 51 00 00 00 00 00 57 e9 97 00 00  Error: UNC at LBA = 0x0057e997 = 5761431

  Commands leading to the command that caused the error were:
  CR FEATR COUNT  LBA_48  LH LM LL DV DC  Powered_Up_Time  Command/Feature_Name
  -- == -- == -- == == == -- -- -- -- --  ---------------  --------------------
  60 00 00 00 08 00 00 00 57 e9 90 40 00     00:52:46.399  READ FPDMA QUEUED
  ea 00 00 00 00 00 00 00 00 00 00 a0 00     00:52:46.101  FLUSH CACHE EXT
  ea 00 00 00 00 00 00 00 00 00 00 a0 00     00:52:46.100  FLUSH CACHE EXT
  ea 00 00 00 00 00 00 00 00 00 00 a0 00     00:52:46.100  FLUSH CACHE EXT
  ea 00 00 00 00 00 00 00 00 00 00 a0 00     00:52:46.099  FLUSH CACHE EXT

Error 55514 [13] occurred at disk power-on lifetime: 14090 hours (587 days + 2 hours)
  When the command that caused the error occurred, the device was active or idle.

  After command completion occurred, registers were:
  ER -- ST COUNT  LBA_48  LH LM LL DV DC
  -- -- -- == -- == == == -- -- -- -- --
  40 -- 51 00 00 00 00 00 57 e9 97 00 00  Error: UNC at LBA = 0x0057e997 = 5761431

  Commands leading to the command that caused the error were:
  CR FEATR COUNT  LBA_48  LH LM LL DV DC  Powered_Up_Time  Command/Feature_Name
  -- == -- == -- == == == -- -- -- -- --  ---------------  --------------------
  60 00 00 00 08 00 00 00 57 e9 90 40 00     00:52:31.276  READ FPDMA QUEUED
  60 00 00 00 08 00 00 00 db c8 e0 40 00     00:52:31.122  READ FPDMA QUEUED
  ea 00 00 00 00 00 00 00 00 00 00 a0 00     00:52:30.983  FLUSH CACHE EXT
  ea 00 00 00 00 00 00 00 00 00 00 a0 00     00:52:30.983  FLUSH CACHE EXT
  ea 00 00 00 00 00 00 00 00 00 00 a0 00     00:52:30.982  FLUSH CACHE EXT

Error 55513 [12] occurred at disk power-on lifetime: 14090 hours (587 days + 2 hours)
  When the command that caused the error occurred, the device was active or idle.

  After command completion occurred, registers were:
  ER -- ST COUNT  LBA_48  LH LM LL DV DC
  -- -- -- == -- == == == -- -- -- -- --
  40 -- 51 00 00 00 00 00 57 e9 97 00 00  Error: UNC at LBA = 0x0057e997 = 5761431

  Commands leading to the command that caused the error were:
  CR FEATR COUNT  LBA_48  LH LM LL DV DC  Powered_Up_Time  Command/Feature_Name
  -- == -- == -- == == == -- -- -- -- --  ---------------  --------------------
  60 00 00 00 08 00 00 00 57 e9 90 40 00     00:52:08.976  READ FPDMA QUEUED
  60 00 00 00 08 00 00 00 db ca 28 40 00     00:52:08.817  READ FPDMA QUEUED
  ea 00 00 00 00 00 00 00 00 00 00 a0 00     00:52:08.686  FLUSH CACHE EXT
  ea 00 00 00 00 00 00 00 00 00 00 a0 00     00:52:08.686  FLUSH CACHE EXT
  ea 00 00 00 00 00 00 00 00 00 00 a0 00     00:52:08.685  FLUSH CACHE EXT

Error 55512 [11] occurred at disk power-on lifetime: 14090 hours (587 days + 2 hours)
  When the command that caused the error occurred, the device was active or idle.

  After command completion occurred, registers were:
  ER -- ST COUNT  LBA_48  LH LM LL DV DC
  -- -- -- == -- == == == -- -- -- -- --
  40 -- 51 00 00 00 00 00 57 e9 97 00 00  Error: UNC at LBA = 0x0057e997 = 5761431

  Commands leading to the command that caused the error were:
  CR FEATR COUNT  LBA_48  LH LM LL DV DC  Powered_Up_Time  Command/Feature_Name
  -- == -- == -- == == == -- -- -- -- --  ---------------  --------------------
  60 00 00 00 08 00 00 00 57 e9 90 40 00     00:51:49.074  READ FPDMA QUEUED
  60 00 00 00 20 00 00 00 12 0b c0 40 00     00:51:48.910  READ FPDMA QUEUED
  60 00 00 00 08 00 00 00 01 3e f0 40 00     00:51:48.900  READ FPDMA QUEUED
  60 00 00 00 40 00 00 00 12 03 88 40 00     00:51:48.877  READ FPDMA QUEUED
  60 00 00 00 20 00 00 00 12 03 68 40 00     00:51:48.864  READ FPDMA QUEUED

Error 55511 [10] occurred at disk power-on lifetime: 14090 hours (587 days + 2 hours)
  When the command that caused the error occurred, the device was active or idle.

  After command completion occurred, registers were:
  ER -- ST COUNT  LBA_48  LH LM LL DV DC
  -- -- -- == -- == == == -- -- -- -- --
  40 -- 51 00 00 00 00 00 57 e9 97 00 00  Error: UNC at LBA = 0x0057e997 = 5761431

  Commands leading to the command that caused the error were:
  CR FEATR COUNT  LBA_48  LH LM LL DV DC  Powered_Up_Time  Command/Feature_Name
  -- == -- == -- == == == -- -- -- -- --  ---------------  --------------------
  60 00 00 00 08 00 00 00 57 e9 90 40 00     00:50:19.685  READ FPDMA QUEUED
  60 00 00 00 20 00 00 00 da 0e 60 40 00     00:50:19.557  READ FPDMA QUEUED
  60 00 00 00 20 00 00 00 da 0e 40 40 00     00:50:19.547  READ FPDMA QUEUED
  60 00 00 00 40 00 00 00 65 10 20 40 00     00:50:19.513  READ FPDMA QUEUED
  60 00 00 00 20 00 00 00 65 10 00 40 00     00:50:19.500  READ FPDMA QUEUED

Error 55510 [9] occurred at disk power-on lifetime: 14090 hours (587 days + 2 hours)
  When the command that caused the error occurred, the device was active or idle.

  After command completion occurred, registers were:
  ER -- ST COUNT  LBA_48  LH LM LL DV DC
  -- -- -- == -- == == == -- -- -- -- --
  40 -- 51 00 00 00 00 00 57 e9 97 00 00  Error: UNC at LBA = 0x0057e997 = 5761431

  Commands leading to the command that caused the error were:
  CR FEATR COUNT  LBA_48  LH LM LL DV DC  Powered_Up_Time  Command/Feature_Name
  -- == -- == -- == == == -- -- -- -- --  ---------------  --------------------
  60 00 00 00 08 00 00 00 57 e9 90 40 00     00:49:59.957  READ FPDMA QUEUED
  60 00 00 00 40 00 00 00 d9 5e e0 40 00     00:49:59.837  READ FPDMA QUEUED
  60 00 00 00 20 00 00 00 d9 5e c0 40 00     00:49:59.832  READ FPDMA QUEUED
  60 00 00 00 20 00 00 00 d9 6f c0 40 00     00:49:59.764  READ FPDMA QUEUED
  60 00 00 00 40 00 00 00 d9 67 58 40 00     00:49:59.751  READ FPDMA QUEUED

Error 55509 [8] occurred at disk power-on lifetime: 14090 hours (587 days + 2 hours)
  When the command that caused the error occurred, the device was active or idle.

  After command completion occurred, registers were:
  ER -- ST COUNT  LBA_48  LH LM LL DV DC
  -- -- -- == -- == == == -- -- -- -- --
  40 -- 51 00 00 00 00 00 57 e9 97 00 00  Error: UNC at LBA = 0x0057e997 = 5761431

  Commands leading to the command that caused the error were:
  CR FEATR COUNT  LBA_48  LH LM LL DV DC  Powered_Up_Time  Command/Feature_Name
  -- == -- == -- == == == -- -- -- -- --  ---------------  --------------------
  60 00 00 00 08 00 00 00 57 e9 90 40 00     00:49:25.571  READ FPDMA QUEUED
  60 00 00 00 40 00 00 00 d9 ce a8 40 00     00:49:25.453  READ FPDMA QUEUED
  60 00 00 00 20 00 00 00 d9 ce 88 40 00     00:49:25.444  READ FPDMA QUEUED
  60 00 00 00 20 00 00 00 da 08 d8 40 00     00:49:25.412  READ FPDMA QUEUED
  60 00 00 00 38 00 00 00 d9 6d d0 40 00     00:49:25.402  READ FPDMA QUEUED

SMART Extended Self-test Log Version: 1 (1 sectors)
Num  Test_Description    Status                  Remaining  LifeTime(hours)  LBA_of_first_error
# 1  Extended offline    Completed: read failure       90%     14123         5761431
# 2  Conveyance offline  Completed: read failure       90%      7955         5763220
# 3  Conveyance offline  Completed: read failure       90%      7955         5763220

SMART Selective self-test log data structure revision number 1
 SPAN  MIN_LBA  MAX_LBA  CURRENT_TEST_STATUS
    1        0        0  Not_testing
    2        0        0  Not_testing
    3        0        0  Not_testing
    4        0        0  Not_testing
    5        0        0  Not_testing
Selective self-test flags (0x0):
  After scanning selected spans, do NOT read-scan remainder of disk.
If Selective self-test is pending on power-up, resume after 0 minute delay.

SCT Status Version:                  3
SCT Version (vendor specific):       522 (0x020a)
SCT Support Level:                   1
Device State:                        Active (0)
Current Temperature:                    32 Celsius
Power Cycle Min/Max Temperature:     31/33 Celsius
Lifetime    Min/Max Temperature:     13/44 Celsius
Under/Over Temperature Limit Count:   0/25

SCT Temperature History Version:     2
Temperature Sampling Period:         1 minute
Temperature Logging Interval:        1 minute
Min/Max recommended Temperature:      0/ 0 Celsius
Min/Max Temperature Limit:            0/ 0 Celsius
Temperature History Size (Index):    128 (19)

SCT Error Recovery Control:
           Read: Disabled
          Write: Disabled

Device Statistics (GP Log 0x04) not supported

SATA Phy Event Counters (GP Log 0x11)
ID      Size     Value  Description
0x000a  2            2  Device-to-host register FISes sent due to a COMRESET
0x0001  2            0  Command failed due to ICRC error
0x0003  2            0  R_ERR response for device-to-host data FIS
0x0004  2            0  R_ERR response for host-to-device data FIS
0x0006  2            0  R_ERR response for device-to-host non-data FIS
0x0007  2            0  R_ERR response for host-to-device non-data FIS

