smartctl 7.4 2023-08-01 r5530 [x86_64-linux-6.6.26-1.red80.x86_64] (local build)
Copyright (C) 2002-23, Bruce Allen, Christian Franke, www.smartmontools.org

=== START OF INFORMATION SECTION ===
Model Family:     Seagate Momentus 5400.6
Device Model:     ST9500325AS
Serial Number:    --
LU WWN Device Id: 5 000c50 ...
Firmware Version: 0011LVM1
User Capacity:    500,107,862,016 bytes [500 GB]
Sector Size:      512 bytes logical/physical
Rotation Rate:    5400 rpm
Device is:        In smartctl database 7.3/5577
ATA Version is:   ATA8-ACS T13/1699-D revision 4
SATA Version is:  SATA 2.6, 3.0 Gb/s (current: 3.0 Gb/s)
Local Time is:    Thu Jun 20 22:27:26 2024 MSK
SMART support is: Available - device has SMART capability.
SMART support is: Enabled
AAM feature is:   Unavailable
APM level is:     128 (minimum power consumption without standby)
Rd look-ahead is: Enabled
Write cache is:   Enabled
DSN feature is:   Unavailable
ATA Security is:  Disabled, frozen [SEC2]
Wt Cache Reorder: Unknown

=== START OF READ SMART DATA SECTION ===
SMART overall-health self-assessment test result: PASSED
See vendor-specific Attribute list for marginal Attributes.

General SMART Values:
Offline data collection status:  (0x00)	Offline data collection activity
					was never started.
					Auto Offline Data Collection: Disabled.
Self-test execution status:      (   0)	The previous self-test routine completed
					without error or no self-test has ever 
					been run.
Total time to complete Offline 
data collection: 		(    0) seconds.
Offline data collection
capabilities: 			 (0x73) SMART execute Offline immediate.
					Auto Offline data collection on/off support.
					Suspend Offline collection upon new
					command.
					No Offline surface scan supported.
					Self-test supported.
					Conveyance Self-test supported.
					Selective Self-test supported.
SMART capabilities:            (0x0003)	Saves SMART data before entering
					power-saving mode.
					Supports SMART auto save timer.
Error logging capability:        (0x01)	Error logging supported.
					General Purpose Logging supported.
Short self-test routine 
recommended polling time: 	 (   1) minutes.
Extended self-test routine
recommended polling time: 	 ( 138) minutes.
Conveyance self-test routine
recommended polling time: 	 (   2) minutes.
SCT capabilities: 	       (0x103b)	SCT Status supported.
					SCT Error Recovery Control supported.
					SCT Feature Control supported.
					SCT Data Table supported.

SMART Attributes Data Structure revision number: 10
Vendor Specific SMART Attributes with Thresholds:
ID# ATTRIBUTE_NAME          FLAGS    VALUE WORST THRESH FAIL RAW_VALUE
  1 Raw_Read_Error_Rate     POSR--   117   085   034    -    145257208
  3 Spin_Up_Time            PO----   098   098   000    -    0
  4 Start_Stop_Count        -O--CK   095   095   020    -    5387
  5 Reallocated_Sector_Ct   PO--CK   100   100   036    -    0
  7 Seek_Error_Rate         POSR--   087   060   030    -    615330511
  9 Power_On_Hours          -O--CK   080   080   000    -    17566 (102 129 0)
 10 Spin_Retry_Count        PO--C-   100   100   097    -    0
 12 Power_Cycle_Count       -O--CK   096   096   020    -    5009
184 End-to-End_Error        -O--CK   100   100   099    -    0
187 Reported_Uncorrect      -O--CK   001   001   000    -    1399
188 Command_Timeout         -O--CK   100   097   000    -    1392
189 High_Fly_Writes         -O-RCK   100   100   000    -    0
190 Airflow_Temperature_Cel -O---K   066   036   045    Past 34 (255 255 34 29 0)
191 G-Sense_Error_Rate      -O--CK   100   100   000    -    157
192 Power-Off_Retract_Count -O--CK   100   100   000    -    264
193 Load_Cycle_Count        -O--CK   068   068   000    -    65651
194 Temperature_Celsius     -O---K   034   064   000    -    34 (0 11 0 0 0)
195 Hardware_ECC_Recovered  -O-RC-   050   043   000    -    145257208
196 Reallocated_Event_Count POSR--   081   081   030    -    17228 (7150 0)
197 Current_Pending_Sector  -O--C-   100   100   000    -    0
198 Offline_Uncorrectable   ----C-   100   100   000    -    0
199 UDMA_CRC_Error_Count    -OSRCK   200   200   000    -    0
                            ||||||_ K auto-keep
                            |||||__ C event count
                            ||||___ R error rate
                            |||____ S speed/performance
                            ||_____ O updated online
                            |______ P prefailure warning

General Purpose Log Directory Version 1
SMART           Log Directory Version 1 [multi-sector log support]
Address    Access  R/W   Size  Description
0x00       GPL,SL  R/O      1  Log Directory
0x01       GPL,SL  R/O      1  Summary SMART error log
0x02       GPL,SL  R/O      5  Comprehensive SMART error log
0x03       GPL,SL  R/O      5  Ext. Comprehensive SMART error log
0x06       GPL,SL  R/O      1  SMART self-test log
0x07       GPL,SL  R/O      1  Extended self-test log
0x09       GPL,SL  R/W      1  Selective self-test log
0x10       GPL,SL  R/O      1  NCQ Command Error log
0x11       GPL,SL  R/O      1  SATA Phy Event Counters log
0x21       GPL,SL  R/O      1  Write stream error log
0x22       GPL,SL  R/O      1  Read stream error log
0x80-0x9f  GPL,SL  R/W     16  Host vendor specific log
0xa1       GPL,SL  VS      20  Device vendor specific log
0xa2       GPL     VS    2248  Device vendor specific log
0xa8       GPL,SL  VS      65  Device vendor specific log
0xa9       GPL,SL  VS       1  Device vendor specific log
0xb0       GPL     VS    2864  Device vendor specific log
0xbe-0xbf  GPL     VS   65535  Device vendor specific log
0xe0       GPL,SL  R/W      1  SCT Command/Status
0xe1       GPL,SL  R/W      1  SCT Data Transfer

SMART Extended Comprehensive Error Log Version: 1 (5 sectors)
Device Error Count: 1920 (device log contains only the most recent 20 errors)
	CR     = Command Register
	FEATR  = Features Register
	COUNT  = Count (was: Sector Count) Register
	LBA_48 = Upper bytes of LBA High/Mid/Low Registers ]  ATA-8
	LH     = LBA High (was: Cylinder High) Register    ]   LBA
	LM     = LBA Mid (was: Cylinder Low) Register      ] Register
	LL     = LBA Low (was: Sector Number) Register     ]
	DV     = Device (was: Device/Head) Register
	DC     = Device Control Register
	ER     = Error register
	ST     = Status register
Powered_Up_Time is measured from power on, and printed as
DDd+hh:mm:SS.sss where DD=days, hh=hours, mm=minutes,
SS=sec, and sss=millisec. It "wraps" after 49.710 days.

Error 1920 [19] occurred at disk power-on lifetime: 14823 hours (617 days + 15 hours)
  When the command that caused the error occurred, the device was active or idle.

  After command completion occurred, registers were:
  ER -- ST COUNT  LBA_48  LH LM LL DV DC
  -- -- -- == -- == == == -- -- -- -- --
  40 -- 51 00 00 00 5c 00 2b 03 33 00 00  Error: UNC at LBA = 0x5c002b0333 = 395139810099

  Commands leading to the command that caused the error were:
  CR FEATR COUNT  LBA_48  LH LM LL DV DC  Powered_Up_Time  Command/Feature_Name
  -- == -- == -- == == == -- -- -- -- --  ---------------  --------------------
  60 00 00 00 01 00 11 00 fe 00 2c 40 00     00:04:36.209  READ FPDMA QUEUED
  60 00 00 00 08 00 51 00 b9 03 2b 40 00     00:04:36.209  READ FPDMA QUEUED
  60 00 00 00 01 00 22 00 9b 00 c8 40 00     00:04:36.208  READ FPDMA QUEUED
  61 00 00 00 08 00 6b 00 8f 00 e0 40 00     00:04:36.208  WRITE FPDMA QUEUED
  60 00 00 00 08 00 f3 00 54 00 a0 40 00     00:04:36.207  READ FPDMA QUEUED

Error 1919 [18] occurred at disk power-on lifetime: 14823 hours (617 days + 15 hours)
  When the command that caused the error occurred, the device was active or idle.

  After command completion occurred, registers were:
  ER -- ST COUNT  LBA_48  LH LM LL DV DC
  -- -- -- == -- == == == -- -- -- -- --
  40 -- 51 00 00 00 5c 00 2b 03 33 00 00  Error: UNC at LBA = 0x5c002b0333 = 395139810099

  Commands leading to the command that caused the error were:
  CR FEATR COUNT  LBA_48  LH LM LL DV DC  Powered_Up_Time  Command/Feature_Name
  -- == -- == -- == == == -- -- -- -- --  ---------------  --------------------
  60 00 00 00 04 00 14 00 69 00 6b 40 00     00:04:33.711  READ FPDMA QUEUED
  61 00 00 00 08 00 6b 00 8f 00 e0 40 00     00:04:33.710  WRITE FPDMA QUEUED
  60 00 00 00 04 00 22 00 9b 00 53 40 00     00:04:33.710  READ FPDMA QUEUED
  60 00 00 00 08 00 70 00 ca 00 78 40 00     00:04:33.707  READ FPDMA QUEUED
  60 00 00 00 08 00 14 00 69 00 63 40 00     00:04:33.707  READ FPDMA QUEUED

Error 1918 [17] occurred at disk power-on lifetime: 14823 hours (617 days + 15 hours)
  When the command that caused the error occurred, the device was active or idle.

  After command completion occurred, registers were:
  ER -- ST COUNT  LBA_48  LH LM LL DV DC
  -- -- -- == -- == == == -- -- -- -- --
  40 -- 51 00 00 00 5c 00 2b 03 33 00 00  Error: WP at LBA = 0x5c002b0333 = 395139810099

  Commands leading to the command that caused the error were:
  CR FEATR COUNT  LBA_48  LH LM LL DV DC  Powered_Up_Time  Command/Feature_Name
  -- == -- == -- == == == -- -- -- -- --  ---------------  --------------------
  61 00 00 00 08 00 72 00 fc 00 98 40 00     00:04:31.251  WRITE FPDMA QUEUED
  60 00 00 00 20 00 51 00 ac 03 80 40 00     00:04:31.249  READ FPDMA QUEUED
  60 00 00 00 01 00 19 00 eb 00 32 40 00     00:04:31.248  READ FPDMA QUEUED
  60 00 00 00 08 00 70 00 da 00 10 40 00     00:04:31.248  READ FPDMA QUEUED
  61 00 00 00 10 00 6b 00 90 00 58 40 00     00:04:31.248  WRITE FPDMA QUEUED

Error 1917 [16] occurred at disk power-on lifetime: 14823 hours (617 days + 15 hours)
  When the command that caused the error occurred, the device was active or idle.

  After command completion occurred, registers were:
  ER -- ST COUNT  LBA_48  LH LM LL DV DC
  -- -- -- == -- == == == -- -- -- -- --
  40 -- 51 00 00 00 5c 00 2b 03 33 00 00  Error: UNC at LBA = 0x5c002b0333 = 395139810099

  Commands leading to the command that caused the error were:
  CR FEATR COUNT  LBA_48  LH LM LL DV DC  Powered_Up_Time  Command/Feature_Name
  -- == -- == -- == == == -- -- -- -- --  ---------------  --------------------
  60 00 00 00 08 00 24 00 0b 00 10 40 00     00:04:28.681  READ FPDMA QUEUED
  60 00 00 01 00 00 24 00 09 00 38 40 00     00:04:28.680  READ FPDMA QUEUED
  60 00 00 00 b0 00 24 00 08 00 88 40 00     00:04:28.679  READ FPDMA QUEUED
  60 00 00 00 3c 00 ac 00 51 00 98 40 00     00:04:28.679  READ FPDMA QUEUED
  61 00 00 00 10 00 6b 00 8f 00 d0 40 00     00:04:28.676  WRITE FPDMA QUEUED

Error 1916 [15] occurred at disk power-on lifetime: 14823 hours (617 days + 15 hours)
  When the command that caused the error occurred, the device was active or idle.

  After command completion occurred, registers were:
  ER -- ST COUNT  LBA_48  LH LM LL DV DC
  -- -- -- == -- == == == -- -- -- -- --
  40 -- 51 00 00 00 5c 00 2b 03 33 00 00  Error: UNC at LBA = 0x5c002b0333 = 395139810099

  Commands leading to the command that caused the error were:
  CR FEATR COUNT  LBA_48  LH LM LL DV DC  Powered_Up_Time  Command/Feature_Name
  -- == -- == -- == == == -- -- -- -- --  ---------------  --------------------
  60 00 00 00 08 00 36 00 9f 01 a8 40 00     00:04:25.976  READ FPDMA QUEUED
  60 00 00 00 08 00 36 00 9f 01 f0 40 00     00:04:25.975  READ FPDMA QUEUED
  60 00 00 00 08 00 8d 00 2e 01 84 40 00     00:04:25.964  READ FPDMA QUEUED
  60 00 00 00 08 00 20 00 6d 00 9a 40 00     00:04:25.957  READ FPDMA QUEUED
  60 00 00 00 08 00 20 00 6d 00 92 40 00     00:04:25.945  READ FPDMA QUEUED

Error 1915 [14] occurred at disk power-on lifetime: 14823 hours (617 days + 15 hours)
  When the command that caused the error occurred, the device was active or idle.

  After command completion occurred, registers were:
  ER -- ST COUNT  LBA_48  LH LM LL DV DC
  -- -- -- == -- == == == -- -- -- -- --
  40 -- 51 00 00 00 5c 00 2b 03 33 00 00  Error: UNC at LBA = 0x5c002b0333 = 395139810099

  Commands leading to the command that caused the error were:
  CR FEATR COUNT  LBA_48  LH LM LL DV DC  Powered_Up_Time  Command/Feature_Name
  -- == -- == -- == == == -- -- -- -- --  ---------------  --------------------
  60 00 00 00 28 00 18 00 a0 00 fa 40 00     00:04:23.172  READ FPDMA QUEUED
  61 00 00 00 10 00 6b 00 8f 00 b8 40 00     00:04:23.172  WRITE FPDMA QUEUED
  60 00 00 00 08 00 0f 00 aa 00 38 40 00     00:04:23.171  READ FPDMA QUEUED
  61 00 00 00 08 00 16 00 71 00 90 40 00     00:04:23.169  WRITE FPDMA QUEUED
  60 00 00 00 08 00 0f 00 ca 00 30 40 00     00:04:23.158  READ FPDMA QUEUED

Error 1914 [13] occurred at disk power-on lifetime: 14823 hours (617 days + 15 hours)
  When the command that caused the error occurred, the device was active or idle.

  After command completion occurred, registers were:
  ER -- ST COUNT  LBA_48  LH LM LL DV DC
  -- -- -- == -- == == == -- -- -- -- --
  40 -- 51 00 00 00 5c 00 2b 03 33 00 00  Error: UNC at LBA = 0x5c002b0333 = 395139810099

  Commands leading to the command that caused the error were:
  CR FEATR COUNT  LBA_48  LH LM LL DV DC  Powered_Up_Time  Command/Feature_Name
  -- == -- == -- == == == -- -- -- -- --  ---------------  --------------------
  60 00 00 00 40 00 f5 00 19 00 a2 40 00     00:04:20.407  READ FPDMA QUEUED
  60 00 00 00 20 00 f5 00 53 00 e4 40 00     00:04:20.406  READ FPDMA QUEUED
  60 00 00 00 20 00 f5 00 53 00 74 40 00     00:04:20.397  READ FPDMA QUEUED
  60 00 00 00 40 00 f5 00 17 00 0a 40 00     00:04:20.396  READ FPDMA QUEUED
  60 00 00 00 40 00 f5 00 17 00 aa 40 00     00:04:20.396  READ FPDMA QUEUED

Error 1913 [12] occurred at disk power-on lifetime: 14823 hours (617 days + 15 hours)
  When the command that caused the error occurred, the device was active or idle.

  After command completion occurred, registers were:
  ER -- ST COUNT  LBA_48  LH LM LL DV DC
  -- -- -- == -- == == == -- -- -- -- --
  40 -- 51 00 00 00 5c 00 2b 03 33 00 00  Error: UNC at LBA = 0x5c002b0333 = 395139810099

  Commands leading to the command that caused the error were:
  CR FEATR COUNT  LBA_48  LH LM LL DV DC  Powered_Up_Time  Command/Feature_Name
  -- == -- == -- == == == -- -- -- -- --  ---------------  --------------------
  60 00 00 00 18 00 1e 00 25 00 fa 40 00     00:04:17.443  READ FPDMA QUEUED
  60 00 00 00 20 00 1e 00 34 00 4a 40 00     00:04:17.434  READ FPDMA QUEUED
  60 00 00 00 40 00 bc 00 ec 00 78 40 00     00:04:17.426  READ FPDMA QUEUED
  60 00 00 00 40 00 f5 00 31 00 0a 40 00     00:04:17.425  READ FPDMA QUEUED
  60 00 00 00 20 00 f5 00 53 00 94 40 00     00:04:17.424  READ FPDMA QUEUED

SMART Extended Self-test Log Version: 1 (1 sectors)
Num  Test_Description    Status                  Remaining  LifeTime(hours)  LBA_of_first_error
# 1  Conveyance offline  Completed without error       00%     17169         -
# 2  Short offline       Completed without error       00%     17169         -

SMART Selective self-test log data structure revision number 1
 SPAN  MIN_LBA  MAX_LBA  CURRENT_TEST_STATUS
    1        0        0  Not_testing
    2        0        0  Not_testing
    3        0        0  Not_testing
    4        0        0  Not_testing
    5        0        0  Not_testing
Selective self-test flags (0x0):
  After scanning selected spans, do NOT read-scan remainder of disk.
If Selective self-test is pending on power-up, resume after 0 minute delay.

SCT Status Version:                  3
SCT Version (vendor specific):       522 (0x020a)
Device State:                        Active (0)
Current Temperature:                    34 Celsius
Power Cycle Min/Max Temperature:     29/34 Celsius
Lifetime    Min/Max Temperature:     11/64 Celsius
Under/Over Temperature Limit Count:   0/2
Vendor specific:
00 00 00 00 00 00 00 00 00 00 02 00 00 00 00 00
00 00 00 00 00 00 00 00 00 00 00 00 00 00 00 00

SCT Temperature History Version:     2
Temperature Sampling Period:         10 minutes
Temperature Logging Interval:        11 minutes
Min/Max recommended Temperature:      0/ 0 Celsius
Min/Max Temperature Limit:            0/ 0 Celsius
Temperature History Size (Index):    128 (17)

SCT Error Recovery Control:
           Read: Disabled
          Write: Disabled

Device Statistics (GP/SMART Log 0x04) not supported

Pending Defects log (GP Log 0x0c) not supported

SATA Phy Event Counters (GP Log 0x11)
ID      Size     Value  Description
0x000a  2            4  Device-to-host register FISes sent due to a COMRESET
0x0001  2            0  Command failed due to ICRC error
0x0003  2            0  R_ERR response for device-to-host data FIS
0x0004  2            0  R_ERR response for host-to-device data FIS
0x0006  2            0  R_ERR response for device-to-host non-data FIS
0x0007  2            0  R_ERR response for host-to-device non-data FIS

