smartctl 7.3 2022-02-28 r5338 [x86_64-linux-6.1.1-desktop-1omv2290] (OpenMandriva Lx 7.3-2)
Copyright (C) 2002-22, Bruce Allen, Christian Franke, www.smartmontools.org

=== START OF INFORMATION SECTION ===
Model Family:     Seagate Momentus 5400.6
Device Model:     ST9500325AS
Serial Number:    --
LU WWN Device Id: 5 000c50 ...
Firmware Version: 0003DEM1
User Capacity:    500,107,862,016 bytes [500 GB]
Sector Size:      512 bytes logical/physical
Rotation Rate:    5400 rpm
Device is:        In smartctl database
ATA Version is:   ATA8-ACS T13/1699-D revision 4
SATA Version is:  SATA 2.6, 3.0 Gb/s
Local Time is:    Wed Jan 11 06:40:34 2023 GMT
SMART support is: Available - device has SMART capability.
SMART support is: Enabled
AAM level is:     208 (intermediate), recommended: 208
APM level is:     254 (maximum performance)
Rd look-ahead is: Enabled
Write cache is:   Enabled
DSN feature is:   Unavailable
ATA Security is:  Disabled, frozen [SEC2]
Wt Cache Reorder: Unknown

=== START OF READ SMART DATA SECTION ===
SMART overall-health self-assessment test result: PASSED
See vendor-specific Attribute list for marginal Attributes.

General SMART Values:
Offline data collection status:  (0x82)	Offline data collection activity
					was completed without error.
					Auto Offline Data Collection: Enabled.
Self-test execution status:      (   0)	The previous self-test routine completed
					without error or no self-test has ever 
					been run.
Total time to complete Offline 
data collection: 		(    0) seconds.
Offline data collection
capabilities: 			 (0x7b) SMART execute Offline immediate.
					Auto Offline data collection on/off support.
					Suspend Offline collection upon new
					command.
					Offline surface scan supported.
					Self-test supported.
					Conveyance Self-test supported.
					Selective Self-test supported.
SMART capabilities:            (0x0003)	Saves SMART data before entering
					power-saving mode.
					Supports SMART auto save timer.
Error logging capability:        (0x01)	Error logging supported.
					General Purpose Logging supported.
Short self-test routine 
recommended polling time: 	 (   2) minutes.
Extended self-test routine
recommended polling time: 	 ( 140) minutes.
Conveyance self-test routine
recommended polling time: 	 (   3) minutes.
SCT capabilities: 	       (0x103f)	SCT Status supported.
					SCT Error Recovery Control supported.
					SCT Feature Control supported.
					SCT Data Table supported.

SMART Attributes Data Structure revision number: 10
Vendor Specific SMART Attributes with Thresholds:
ID# ATTRIBUTE_NAME          FLAGS    VALUE WORST THRESH FAIL RAW_VALUE
  1 Raw_Read_Error_Rate     POSR--   119   099   006    -    218735375
  3 Spin_Up_Time            PO----   098   097   085    -    0
  4 Start_Stop_Count        -O--CK   098   098   020    -    2447
  5 Reallocated_Sector_Ct   PO--CK   099   099   036    -    38
  7 Seek_Error_Rate         POSR--   067   060   030    -    141922464140
  9 Power_On_Hours          -O--CK   095   095   000    -    4545
 10 Spin_Retry_Count        PO--C-   100   100   097    -    0
 12 Power_Cycle_Count       -O--CK   098   098   020    -    2438
184 End-to-End_Error        -O--CK   100   100   099    -    0
187 Reported_Uncorrect      -O--CK   088   088   000    -    12
188 Command_Timeout         -O--CK   100   098   000    -    158916214822
189 High_Fly_Writes         -O-RCK   100   100   000    -    0
190 Airflow_Temperature_Cel -O---K   061   045   045    Past 39 (Min/Max 13/39)
191 G-Sense_Error_Rate      -O--CK   100   100   000    -    132
192 Power-Off_Retract_Count -O--CK   100   100   000    -    74
193 Load_Cycle_Count        -O--CK   075   075   000    -    50290
194 Temperature_Celsius     -O---K   039   055   000    -    39 (0 8 0 0 0)
195 Hardware_ECC_Recovered  -O-RC-   041   033   000    -    218735375
197 Current_Pending_Sector  -O--C-   100   100   000    -    0
198 Offline_Uncorrectable   ----C-   100   100   000    -    0
199 UDMA_CRC_Error_Count    -OSRCK   200   200   000    -    0
240 Head_Flying_Hours       ------   100   253   000    -    4317 (48 210 0)
241 Total_LBAs_Written      ------   100   253   000    -    2009826451
242 Total_LBAs_Read         ------   100   253   000    -    2884628094
254 Free_Fall_Sensor        -O--CK   100   100   000    -    0
                            ||||||_ K auto-keep
                            |||||__ C event count
                            ||||___ R error rate
                            |||____ S speed/performance
                            ||_____ O updated online
                            |______ P prefailure warning

General Purpose Log Directory Version 1
SMART           Log Directory Version 1 [multi-sector log support]
Address    Access  R/W   Size  Description
0x00       GPL,SL  R/O      1  Log Directory
0x01       GPL,SL  R/O      1  Summary SMART error log
0x02       GPL,SL  R/O      5  Comprehensive SMART error log
0x03       GPL,SL  R/O      5  Ext. Comprehensive SMART error log
0x06       GPL,SL  R/O      1  SMART self-test log
0x07       GPL,SL  R/O      1  Extended self-test log
0x09       GPL,SL  R/W      1  Selective self-test log
0x10       GPL,SL  R/O      1  NCQ Command Error log
0x11       GPL,SL  R/O      1  SATA Phy Event Counters log
0x21       GPL,SL  R/O      1  Write stream error log
0x22       GPL,SL  R/O      1  Read stream error log
0x80-0x9f  GPL,SL  R/W     16  Host vendor specific log
0xa1       GPL,SL  VS      20  Device vendor specific log
0xa2       GPL     VS    2248  Device vendor specific log
0xa8       GPL,SL  VS      65  Device vendor specific log
0xa9       GPL,SL  VS       1  Device vendor specific log
0xb0       GPL     VS    2864  Device vendor specific log
0xbe-0xbf  GPL     VS   65535  Device vendor specific log
0xe0       GPL,SL  R/W      1  SCT Command/Status
0xe1       GPL,SL  R/W      1  SCT Data Transfer

SMART Extended Comprehensive Error Log Version: 1 (5 sectors)
Device Error Count: 12
	CR     = Command Register
	FEATR  = Features Register
	COUNT  = Count (was: Sector Count) Register
	LBA_48 = Upper bytes of LBA High/Mid/Low Registers ]  ATA-8
	LH     = LBA High (was: Cylinder High) Register    ]   LBA
	LM     = LBA Mid (was: Cylinder Low) Register      ] Register
	LL     = LBA Low (was: Sector Number) Register     ]
	DV     = Device (was: Device/Head) Register
	DC     = Device Control Register
	ER     = Error register
	ST     = Status register
Powered_Up_Time is measured from power on, and printed as
DDd+hh:mm:SS.sss where DD=days, hh=hours, mm=minutes,
SS=sec, and sss=millisec. It "wraps" after 49.710 days.

Error 12 [11] occurred at disk power-on lifetime: 3383 hours (140 days + 23 hours)
  When the command that caused the error occurred, the device was active or idle.

  After command completion occurred, registers were:
  ER -- ST COUNT  LBA_48  LH LM LL DV DC
  -- -- -- == -- == == == -- -- -- -- --
  40 -- 51 00 00 00 00 02 10 5d cc 00 00  Error: UNC at LBA = 0x02105dcc = 34627020

  Commands leading to the command that caused the error were:
  CR FEATR COUNT  LBA_48  LH LM LL DV DC  Powered_Up_Time  Command/Feature_Name
  -- == -- == -- == == == -- -- -- -- --  ---------------  --------------------
  60 00 00 00 20 00 00 02 10 60 40 40 00     02:48:30.425  READ FPDMA QUEUED
  60 00 00 00 40 00 00 02 10 5d a0 40 00     02:48:30.424  READ FPDMA QUEUED
  60 00 00 00 20 00 00 02 10 5c 60 40 00     02:48:30.375  READ FPDMA QUEUED
  60 00 00 00 40 00 00 02 10 59 c0 40 00     02:48:30.374  READ FPDMA QUEUED
  60 00 00 00 20 00 00 02 10 57 60 40 00     02:48:30.374  READ FPDMA QUEUED

Error 11 [10] occurred at disk power-on lifetime: 3382 hours (140 days + 22 hours)
  When the command that caused the error occurred, the device was active or idle.

  After command completion occurred, registers were:
  ER -- ST COUNT  LBA_48  LH LM LL DV DC
  -- -- -- == -- == == == -- -- -- -- --
  40 -- 51 00 00 00 00 02 10 5d c8 00 00  Error: UNC at LBA = 0x02105dc8 = 34627016

  Commands leading to the command that caused the error were:
  CR FEATR COUNT  LBA_48  LH LM LL DV DC  Powered_Up_Time  Command/Feature_Name
  -- == -- == -- == == == -- -- -- -- --  ---------------  --------------------
  60 00 00 00 20 00 00 02 10 5d c0 40 00     02:21:56.139  READ FPDMA QUEUED
  60 00 00 00 80 00 00 02 04 65 50 40 00     02:21:56.139  READ FPDMA QUEUED
  60 00 00 00 60 00 00 05 32 8c 40 40 00     02:21:56.138  READ FPDMA QUEUED
  60 00 00 00 10 00 00 07 5f 03 d8 40 00     02:21:56.138  READ FPDMA QUEUED
  60 00 00 00 40 00 00 02 0e 59 20 40 00     02:21:56.137  READ FPDMA QUEUED

Error 10 [9] occurred at disk power-on lifetime: 3382 hours (140 days + 22 hours)
  When the command that caused the error occurred, the device was active or idle.

  After command completion occurred, registers were:
  ER -- ST COUNT  LBA_48  LH LM LL DV DC
  -- -- -- == -- == == == -- -- -- -- --
  40 -- 51 00 00 00 00 02 10 5d c8 00 00  Error: UNC at LBA = 0x02105dc8 = 34627016

  Commands leading to the command that caused the error were:
  CR FEATR COUNT  LBA_48  LH LM LL DV DC  Powered_Up_Time  Command/Feature_Name
  -- == -- == -- == == == -- -- -- -- --  ---------------  --------------------
  60 00 00 00 60 00 00 05 32 8c 40 40 00     02:21:53.399  READ FPDMA QUEUED
  60 00 00 00 80 00 00 02 04 65 50 40 00     02:21:53.398  READ FPDMA QUEUED
  61 00 00 00 40 00 00 02 10 d7 e0 40 00     02:21:53.397  WRITE FPDMA QUEUED
  61 00 00 00 08 00 00 02 34 00 00 40 00     02:21:53.396  WRITE FPDMA QUEUED
  61 00 00 00 40 00 00 05 31 c1 78 40 00     02:21:53.396  WRITE FPDMA QUEUED

Error 9 [8] occurred at disk power-on lifetime: 3382 hours (140 days + 22 hours)
  When the command that caused the error occurred, the device was active or idle.

  After command completion occurred, registers were:
  ER -- ST COUNT  LBA_48  LH LM LL DV DC
  -- -- -- == -- == == == -- -- -- -- --
  40 -- 51 00 00 00 00 02 10 5d c8 00 00  Error: WP at LBA = 0x02105dc8 = 34627016

  Commands leading to the command that caused the error were:
  CR FEATR COUNT  LBA_48  LH LM LL DV DC  Powered_Up_Time  Command/Feature_Name
  -- == -- == -- == == == -- -- -- -- --  ---------------  --------------------
  61 00 00 00 08 00 00 02 34 00 00 40 00     02:21:48.878  WRITE FPDMA QUEUED
  61 00 00 00 08 00 00 02 66 14 e0 40 00     02:21:48.877  WRITE FPDMA QUEUED
  61 00 00 00 08 00 00 02 35 9c e0 40 00     02:21:48.876  WRITE FPDMA QUEUED
  61 00 00 00 40 00 00 02 91 3d 80 40 00     02:21:48.876  WRITE FPDMA QUEUED
  61 00 00 00 08 00 00 02 65 9a d0 40 00     02:21:48.875  WRITE FPDMA QUEUED

Error 8 [7] occurred at disk power-on lifetime: 3382 hours (140 days + 22 hours)
  When the command that caused the error occurred, the device was active or idle.

  After command completion occurred, registers were:
  ER -- ST COUNT  LBA_48  LH LM LL DV DC
  -- -- -- == -- == == == -- -- -- -- --
  40 -- 51 00 00 00 00 02 10 5d c7 00 00  Error: WP at LBA = 0x02105dc7 = 34627015

  Commands leading to the command that caused the error were:
  CR FEATR COUNT  LBA_48  LH LM LL DV DC  Powered_Up_Time  Command/Feature_Name
  -- == -- == -- == == == -- -- -- -- --  ---------------  --------------------
  61 00 00 00 40 00 00 01 d9 36 c0 40 00     02:21:45.986  WRITE FPDMA QUEUED
  61 00 00 00 08 00 00 1f d3 dc 70 40 00     02:21:45.986  WRITE FPDMA QUEUED
  61 00 00 00 08 00 00 02 34 00 00 40 00     02:21:45.983  WRITE FPDMA QUEUED
  61 00 00 00 08 00 00 01 dc 79 d0 40 00     02:21:45.983  WRITE FPDMA QUEUED
  61 00 00 00 08 00 00 02 35 9c c8 40 00     02:21:45.982  WRITE FPDMA QUEUED

Error 7 [6] occurred at disk power-on lifetime: 3382 hours (140 days + 22 hours)
  When the command that caused the error occurred, the device was active or idle.

  After command completion occurred, registers were:
  ER -- ST COUNT  LBA_48  LH LM LL DV DC
  -- -- -- == -- == == == -- -- -- -- --
  40 -- 51 00 00 00 00 02 10 5d c7 00 00  Error: WP at LBA = 0x02105dc7 = 34627015

  Commands leading to the command that caused the error were:
  CR FEATR COUNT  LBA_48  LH LM LL DV DC  Powered_Up_Time  Command/Feature_Name
  -- == -- == -- == == == -- -- -- -- --  ---------------  --------------------
  61 00 00 00 40 00 00 01 d9 36 c0 40 00     02:21:42.551  WRITE FPDMA QUEUED
  61 00 00 00 18 00 00 02 36 0d 60 40 00     02:21:42.549  WRITE FPDMA QUEUED
  61 00 00 00 18 00 00 02 36 0d 40 40 00     02:21:42.549  WRITE FPDMA QUEUED
  61 00 00 00 08 00 00 02 34 00 08 40 00     02:21:42.548  WRITE FPDMA QUEUED
  61 00 00 00 28 00 00 02 36 0d 10 40 00     02:21:42.548  WRITE FPDMA QUEUED

Error 6 [5] occurred at disk power-on lifetime: 3382 hours (140 days + 22 hours)
  When the command that caused the error occurred, the device was active or idle.

  After command completion occurred, registers were:
  ER -- ST COUNT  LBA_48  LH LM LL DV DC
  -- -- -- == -- == == == -- -- -- -- --
  40 -- 51 00 00 00 00 02 10 5d c7 00 00  Error: WP at LBA = 0x02105dc7 = 34627015

  Commands leading to the command that caused the error were:
  CR FEATR COUNT  LBA_48  LH LM LL DV DC  Powered_Up_Time  Command/Feature_Name
  -- == -- == -- == == == -- -- -- -- --  ---------------  --------------------
  61 00 00 00 08 00 00 01 db ce 78 40 00     02:21:39.479  WRITE FPDMA QUEUED
  61 00 00 00 08 00 00 01 e3 23 80 40 00     02:21:39.478  WRITE FPDMA QUEUED
  61 00 00 00 08 00 00 02 34 00 00 40 00     02:21:39.478  WRITE FPDMA QUEUED
  61 00 00 00 08 00 00 01 e3 24 a0 40 00     02:21:39.477  WRITE FPDMA QUEUED
  61 00 00 00 08 00 00 02 35 9c 50 40 00     02:21:39.477  WRITE FPDMA QUEUED

Error 5 [4] occurred at disk power-on lifetime: 3382 hours (140 days + 22 hours)
  When the command that caused the error occurred, the device was active or idle.

  After command completion occurred, registers were:
  ER -- ST COUNT  LBA_48  LH LM LL DV DC
  -- -- -- == -- == == == -- -- -- -- --
  40 -- 51 00 00 00 00 02 10 5d c7 00 00  Error: WP at LBA = 0x02105dc7 = 34627015

  Commands leading to the command that caused the error were:
  CR FEATR COUNT  LBA_48  LH LM LL DV DC  Powered_Up_Time  Command/Feature_Name
  -- == -- == -- == == == -- -- -- -- --  ---------------  --------------------
  61 00 00 00 08 00 00 06 69 23 98 40 00     02:21:35.301  WRITE FPDMA QUEUED
  61 00 00 00 08 00 00 06 3f 75 40 40 00     02:21:35.301  WRITE FPDMA QUEUED
  61 00 00 00 08 00 00 06 2d d4 80 40 00     02:21:35.301  WRITE FPDMA QUEUED
  61 00 00 00 08 00 00 06 0f ea a0 40 00     02:21:35.300  WRITE FPDMA QUEUED
  61 00 00 00 08 00 00 05 e7 3f 78 40 00     02:21:35.300  WRITE FPDMA QUEUED

SMART Extended Self-test Log Version: 1 (1 sectors)
Num  Test_Description    Status                  Remaining  LifeTime(hours)  LBA_of_first_error
# 1  Short offline       Completed without error       00%      4537         -
# 2  Short offline       Completed without error       00%      4524         -
# 3  Short offline       Completed without error       00%      4512         -
# 4  Short offline       Completed without error       00%      4112         -
# 5  Short offline       Completed without error       00%      4107         -
# 6  Short offline       Completed without error       00%      4106         -
# 7  Short offline       Completed without error       00%      4100         -
# 8  Short offline       Completed without error       00%      4097         -
# 9  Short offline       Completed without error       00%      4087         -
#10  Short offline       Completed without error       00%      3984         -
#11  Short offline       Completed without error       00%      3968         -
#12  Short offline       Completed without error       00%      3960         -
#13  Short offline       Completed without error       00%      3958         -
#14  Short offline       Completed without error       00%      3952         -
#15  Short offline       Completed without error       00%      3948         -
#16  Short offline       Completed without error       00%      3936         -
#17  Short offline       Completed without error       00%      3896         -
#18  Short offline       Completed without error       00%      3755         -
#19  Short offline       Completed without error       00%         0         -

SMART Selective self-test log data structure revision number 1
 SPAN  MIN_LBA  MAX_LBA  CURRENT_TEST_STATUS
    1        0        0  Not_testing
    2        0        0  Not_testing
    3        0        0  Not_testing
    4        0        0  Not_testing
    5        0        0  Not_testing
Selective self-test flags (0x0):
  After scanning selected spans, do NOT read-scan remainder of disk.
If Selective self-test is pending on power-up, resume after 0 minute delay.

SCT Status Version:                  3
SCT Version (vendor specific):       522 (0x020a)
Device State:                        Active (0)
Current Temperature:                    39 Celsius
Power Cycle Min/Max Temperature:     13/39 Celsius
Lifetime    Min/Max Temperature:      8/55 Celsius
Specified Max Operating Temperature:    36 Celsius
Under/Over Temperature Limit Count:   1/0

SCT Temperature History Version:     2
Temperature Sampling Period:         1 minute
Temperature Logging Interval:        1 minute
Min/Max recommended Temperature:     14/55 Celsius
Min/Max Temperature Limit:           10/60 Celsius
Temperature History Size (Index):    128 (27)

SCT Error Recovery Control:
           Read: Disabled
          Write: Disabled

Device Statistics (GP/SMART Log 0x04) not supported

Pending Defects log (GP Log 0x0c) not supported

SATA Phy Event Counters (GP Log 0x11)
ID      Size     Value  Description
0x000a  2           22  Device-to-host register FISes sent due to a COMRESET
0x0001  2            0  Command failed due to ICRC error
0x0003  2            0  R_ERR response for device-to-host data FIS
0x0004  2            0  R_ERR response for host-to-device data FIS
0x0006  2            0  R_ERR response for device-to-host non-data FIS
0x0007  2            0  R_ERR response for host-to-device non-data FIS

