smartctl 7.4 2023-08-01 r5530 [x86_64-linux-5.15.0-84-generic] (local build)
Copyright (C) 2002-23, Bruce Allen, Christian Franke, www.smartmontools.org

=== START OF INFORMATION SECTION ===
Model Family:     Seagate Momentus 5400.6
Device Model:     ST9500325AS
Serial Number:    --
LU WWN Device Id: 5 000c50 ...
Firmware Version: 0002SDM1
User Capacity:    500,107,862,016 bytes [500 GB]
Sector Size:      512 bytes logical/physical
Rotation Rate:    5400 rpm
Device is:        In smartctl database 7.3/5528
ATA Version is:   ATA8-ACS T13/1699-D revision 4
SATA Version is:  SATA 2.6, 3.0 Gb/s
Local Time is:    Wed Sep 20 13:03:49 2023 AWST
SMART support is: Available - device has SMART capability.
SMART support is: Enabled
AAM feature is:   Unavailable
APM level is:     245 (intermediate level without standby)
Rd look-ahead is: Enabled
Write cache is:   Enabled
DSN feature is:   Unavailable
ATA Security is:  Disabled, frozen [SEC2]
Wt Cache Reorder: Unknown

=== START OF READ SMART DATA SECTION ===
SMART overall-health self-assessment test result: PASSED
See vendor-specific Attribute list for marginal Attributes.

General SMART Values:
Offline data collection status:  (0x00)	Offline data collection activity
					was never started.
					Auto Offline Data Collection: Disabled.
Self-test execution status:      (   0)	The previous self-test routine completed
					without error or no self-test has ever 
					been run.
Total time to complete Offline 
data collection: 		(    0) seconds.
Offline data collection
capabilities: 			 (0x73) SMART execute Offline immediate.
					Auto Offline data collection on/off support.
					Suspend Offline collection upon new
					command.
					No Offline surface scan supported.
					Self-test supported.
					Conveyance Self-test supported.
					Selective Self-test supported.
SMART capabilities:            (0x0003)	Saves SMART data before entering
					power-saving mode.
					Supports SMART auto save timer.
Error logging capability:        (0x01)	Error logging supported.
					General Purpose Logging supported.
Short self-test routine 
recommended polling time: 	 (   1) minutes.
Extended self-test routine
recommended polling time: 	 ( 139) minutes.
Conveyance self-test routine
recommended polling time: 	 (   2) minutes.
SCT capabilities: 	       (0x103b)	SCT Status supported.
					SCT Error Recovery Control supported.
					SCT Feature Control supported.
					SCT Data Table supported.

SMART Attributes Data Structure revision number: 10
Vendor Specific SMART Attributes with Thresholds:
ID# ATTRIBUTE_NAME          FLAGS    VALUE WORST THRESH FAIL RAW_VALUE
  1 Raw_Read_Error_Rate     POSR--   114   095   006    -    83217169
  3 Spin_Up_Time            PO----   098   098   000    -    0
  4 Start_Stop_Count        -O--CK   099   099   020    -    2026
  5 Reallocated_Sector_Ct   PO--CK   100   100   036    -    11
  7 Seek_Error_Rate         POSR--   075   060   030    -    8673733897
  9 Power_On_Hours          -O--CK   098   098   000    -    2060
 10 Spin_Retry_Count        PO--C-   100   100   097    -    0
 12 Power_Cycle_Count       -O--CK   099   037   020    -    1982
184 End-to-End_Error        -O--CK   100   100   099    -    0
187 Reported_Uncorrect      -O--CK   001   001   000    -    605
188 Command_Timeout         -O--CK   100   096   000    -    17180131359
189 High_Fly_Writes         -O-RCK   100   100   000    -    0
190 Airflow_Temperature_Cel -O---K   054   038   045    Past 46 (Min/Max 41/50 #205)
191 G-Sense_Error_Rate      -O--CK   100   100   000    -    451
192 Power-Off_Retract_Count -O--CK   100   100   000    -    351
193 Load_Cycle_Count        -O--CK   091   091   000    -    18141
194 Temperature_Celsius     -O---K   046   062   000    -    46 (0 13 0 0 0)
195 Hardware_ECC_Recovered  -O-RC-   042   032   000    -    83217169
197 Current_Pending_Sector  -O--C-   100   100   000    -    0
198 Offline_Uncorrectable   ----C-   100   100   000    -    0
199 UDMA_CRC_Error_Count    -OSRCK   200   200   000    -    0
254 Free_Fall_Sensor        -O--CK   100   100   000    -    0
                            ||||||_ K auto-keep
                            |||||__ C event count
                            ||||___ R error rate
                            |||____ S speed/performance
                            ||_____ O updated online
                            |______ P prefailure warning

General Purpose Log Directory Version 1
SMART           Log Directory Version 1 [multi-sector log support]
Address    Access  R/W   Size  Description
0x00       GPL,SL  R/O      1  Log Directory
0x01       GPL,SL  R/O      1  Summary SMART error log
0x02       GPL,SL  R/O      5  Comprehensive SMART error log
0x03       GPL,SL  R/O      5  Ext. Comprehensive SMART error log
0x06       GPL,SL  R/O      1  SMART self-test log
0x07       GPL,SL  R/O      1  Extended self-test log
0x09       GPL,SL  R/W      1  Selective self-test log
0x10       GPL,SL  R/O      1  NCQ Command Error log
0x11       GPL,SL  R/O      1  SATA Phy Event Counters log
0x21       GPL,SL  R/O      1  Write stream error log
0x22       GPL,SL  R/O      1  Read stream error log
0x80-0x9f  GPL,SL  R/W     16  Host vendor specific log
0xa1       GPL,SL  VS      20  Device vendor specific log
0xa2       GPL     VS    2248  Device vendor specific log
0xa8       GPL,SL  VS      65  Device vendor specific log
0xa9       GPL,SL  VS       1  Device vendor specific log
0xb0       GPL     VS    2864  Device vendor specific log
0xbe-0xbf  GPL     VS   65535  Device vendor specific log
0xe0       GPL,SL  R/W      1  SCT Command/Status
0xe1       GPL,SL  R/W      1  SCT Data Transfer

SMART Extended Comprehensive Error Log Version: 1 (5 sectors)
Device Error Count: 591 (device log contains only the most recent 20 errors)
	CR     = Command Register
	FEATR  = Features Register
	COUNT  = Count (was: Sector Count) Register
	LBA_48 = Upper bytes of LBA High/Mid/Low Registers ]  ATA-8
	LH     = LBA High (was: Cylinder High) Register    ]   LBA
	LM     = LBA Mid (was: Cylinder Low) Register      ] Register
	LL     = LBA Low (was: Sector Number) Register     ]
	DV     = Device (was: Device/Head) Register
	DC     = Device Control Register
	ER     = Error register
	ST     = Status register
Powered_Up_Time is measured from power on, and printed as
DDd+hh:mm:SS.sss where DD=days, hh=hours, mm=minutes,
SS=sec, and sss=millisec. It "wraps" after 49.710 days.

Error 591 [10] occurred at disk power-on lifetime: 1767 hours (73 days + 15 hours)
  When the command that caused the error occurred, the device was active or idle.

  After command completion occurred, registers were:
  ER -- ST COUNT  LBA_48  LH LM LL DV DC
  -- -- -- == -- == == == -- -- -- -- --
  40 -- 51 00 00 00 00 01 1f 23 f0 00 00  Error: UNC at LBA = 0x011f23f0 = 18818032

  Commands leading to the command that caused the error were:
  CR FEATR COUNT  LBA_48  LH LM LL DV DC  Powered_Up_Time  Command/Feature_Name
  -- == -- == -- == == == -- -- -- -- --  ---------------  --------------------
  60 00 00 00 08 00 00 00 20 01 20 40 00     02:18:26.632  READ FPDMA QUEUED
  60 00 00 00 58 00 00 01 1f 23 f0 40 00     02:18:26.475  READ FPDMA QUEUED
  60 00 00 00 b0 00 00 03 19 f6 30 40 00     02:18:26.473  READ FPDMA QUEUED
  60 00 00 00 08 00 00 00 26 fc 18 40 00     02:18:26.472  READ FPDMA QUEUED
  60 00 00 00 08 00 00 04 10 59 70 40 00     02:18:26.464  READ FPDMA QUEUED

Error 590 [9] occurred at disk power-on lifetime: 1628 hours (67 days + 20 hours)
  When the command that caused the error occurred, the device was active or idle.

  After command completion occurred, registers were:
  ER -- ST COUNT  LBA_48  LH LM LL DV DC
  -- -- -- == -- == == == -- -- -- -- --
  40 -- 51 00 00 00 00 1d e2 38 c3 00 00  Error: UNC at LBA = 0x1de238c3 = 501364931

  Commands leading to the command that caused the error were:
  CR FEATR COUNT  LBA_48  LH LM LL DV DC  Powered_Up_Time  Command/Feature_Name
  -- == -- == -- == == == -- -- -- -- --  ---------------  --------------------
  25 00 00 00 01 00 00 1d e2 38 c3 40 00     04:32:30.250  READ DMA EXT
  25 00 00 00 01 00 00 1d e2 38 c2 40 00     04:32:27.812  READ DMA EXT
  25 00 00 00 01 00 00 1d e2 38 c1 40 00     04:32:27.809  READ DMA EXT
  25 00 00 00 01 00 00 1d e2 38 c0 40 00     04:32:27.744  READ DMA EXT
  25 00 00 00 01 00 00 1d e2 38 b7 40 00     04:32:27.633  READ DMA EXT

Error 589 [8] occurred at disk power-on lifetime: 1628 hours (67 days + 20 hours)
  When the command that caused the error occurred, the device was active or idle.

  After command completion occurred, registers were:
  ER -- ST COUNT  LBA_48  LH LM LL DV DC
  -- -- -- == -- == == == -- -- -- -- --
  40 -- 51 00 00 00 00 1d e2 38 c2 00 00  Error: UNC at LBA = 0x1de238c2 = 501364930

  Commands leading to the command that caused the error were:
  CR FEATR COUNT  LBA_48  LH LM LL DV DC  Powered_Up_Time  Command/Feature_Name
  -- == -- == -- == == == -- -- -- -- --  ---------------  --------------------
  25 00 00 00 01 00 00 1d e2 38 c2 40 00     04:32:27.812  READ DMA EXT
  25 00 00 00 01 00 00 1d e2 38 c1 40 00     04:32:27.809  READ DMA EXT
  25 00 00 00 01 00 00 1d e2 38 c0 40 00     04:32:27.744  READ DMA EXT
  25 00 00 00 01 00 00 1d e2 38 b7 40 00     04:32:27.633  READ DMA EXT
  25 00 00 00 01 00 00 1d e2 38 b6 40 00     04:32:27.567  READ DMA EXT

Error 588 [7] occurred at disk power-on lifetime: 1628 hours (67 days + 20 hours)
  When the command that caused the error occurred, the device was active or idle.

  After command completion occurred, registers were:
  ER -- ST COUNT  LBA_48  LH LM LL DV DC
  -- -- -- == -- == == == -- -- -- -- --
  40 -- 51 00 00 00 00 1d e2 38 c2 00 00  Error: UNC at LBA = 0x1de238c2 = 501364930

  Commands leading to the command that caused the error were:
  CR FEATR COUNT  LBA_48  LH LM LL DV DC  Powered_Up_Time  Command/Feature_Name
  -- == -- == -- == == == -- -- -- -- --  ---------------  --------------------
  25 00 00 00 35 00 00 1d e2 38 b5 40 00     04:32:25.021  READ DMA EXT
  25 00 00 00 01 00 00 1d e2 38 b4 40 00     04:32:25.018  READ DMA EXT
  25 00 00 00 01 00 00 1d e2 38 b3 40 00     04:32:25.017  READ DMA EXT
  25 00 00 00 01 00 00 1d e2 38 b2 40 00     04:32:25.017  READ DMA EXT
  25 00 00 00 01 00 00 1d e2 38 b1 40 00     04:32:25.016  READ DMA EXT

Error 587 [6] occurred at disk power-on lifetime: 1628 hours (67 days + 20 hours)
  When the command that caused the error occurred, the device was active or idle.

  After command completion occurred, registers were:
  ER -- ST COUNT  LBA_48  LH LM LL DV DC
  -- -- -- == -- == == == -- -- -- -- --
  40 -- 51 00 00 00 00 1d e2 38 c2 00 00  Error: UNC at LBA = 0x1de238c2 = 501364930

  Commands leading to the command that caused the error were:
  CR FEATR COUNT  LBA_48  LH LM LL DV DC  Powered_Up_Time  Command/Feature_Name
  -- == -- == -- == == == -- -- -- -- --  ---------------  --------------------
  25 00 00 00 4e 00 00 1d e2 38 9c 40 00     04:32:22.300  READ DMA EXT
  25 00 00 00 01 00 00 1d e2 38 9b 40 00     04:32:22.297  READ DMA EXT
  25 00 00 00 01 00 00 1d e2 38 9a 40 00     04:32:22.297  READ DMA EXT
  25 00 00 00 01 00 00 1d e2 38 99 40 00     04:32:22.296  READ DMA EXT
  25 00 00 00 01 00 00 1d e2 38 98 40 00     04:32:22.296  READ DMA EXT

Error 586 [5] occurred at disk power-on lifetime: 1628 hours (67 days + 20 hours)
  When the command that caused the error occurred, the device was active or idle.

  After command completion occurred, registers were:
  ER -- ST COUNT  LBA_48  LH LM LL DV DC
  -- -- -- == -- == == == -- -- -- -- --
  40 -- 51 00 00 00 00 1d e2 38 c2 00 00  Error: UNC at LBA = 0x1de238c2 = 501364930

  Commands leading to the command that caused the error were:
  CR FEATR COUNT  LBA_48  LH LM LL DV DC  Powered_Up_Time  Command/Feature_Name
  -- == -- == -- == == == -- -- -- -- --  ---------------  --------------------
  25 00 00 00 67 00 00 1d e2 38 83 40 00     04:32:19.580  READ DMA EXT
  25 00 00 00 01 00 00 1d e2 38 82 40 00     04:32:19.577  READ DMA EXT
  25 00 00 00 01 00 00 1d e2 38 81 40 00     04:32:19.577  READ DMA EXT
  25 00 00 00 01 00 00 1d e2 38 80 40 00     04:32:19.576  READ DMA EXT
  25 00 00 00 01 00 00 1d e2 38 7f 40 00     04:32:19.576  READ DMA EXT

Error 585 [4] occurred at disk power-on lifetime: 1628 hours (67 days + 20 hours)
  When the command that caused the error occurred, the device was active or idle.

  After command completion occurred, registers were:
  ER -- ST COUNT  LBA_48  LH LM LL DV DC
  -- -- -- == -- == == == -- -- -- -- --
  40 -- 51 00 00 00 00 1d e2 38 c2 00 00  Error: UNC at LBA = 0x1de238c2 = 501364930

  Commands leading to the command that caused the error were:
  CR FEATR COUNT  LBA_48  LH LM LL DV DC  Powered_Up_Time  Command/Feature_Name
  -- == -- == -- == == == -- -- -- -- --  ---------------  --------------------
  25 00 00 00 80 00 00 1d e2 38 6a 40 00     04:32:16.837  READ DMA EXT
  ec 00 00 00 01 00 00 00 00 00 00 a0 00     04:32:16.831  IDENTIFY DEVICE
  25 00 00 00 80 00 00 1d e2 37 ea 40 00     04:32:16.829  READ DMA EXT
  25 00 00 00 80 00 00 1d e2 37 6a 40 00     04:32:16.827  READ DMA EXT
  25 00 00 00 80 00 00 1d e2 36 ea 40 00     04:32:16.824  READ DMA EXT

Error 584 [3] occurred at disk power-on lifetime: 1489 hours (62 days + 1 hours)
  When the command that caused the error occurred, the device was active or idle.

  After command completion occurred, registers were:
  ER -- ST COUNT  LBA_48  LH LM LL DV DC
  -- -- -- == -- == == == -- -- -- -- --
  40 -- 51 00 00 00 00 1e 0b 83 45 00 00  Error: UNC at LBA = 0x1e0b8345 = 504070981

  Commands leading to the command that caused the error were:
  CR FEATR COUNT  LBA_48  LH LM LL DV DC  Powered_Up_Time  Command/Feature_Name
  -- == -- == -- == == == -- -- -- -- --  ---------------  --------------------
  25 00 00 00 80 00 00 1e 0b 83 20 e0 00     00:04:57.002  READ DMA EXT
  25 00 00 00 80 00 00 1e 0b 82 a0 e0 00     00:04:56.998  READ DMA EXT
  25 00 00 00 80 00 00 1e 0b 80 e0 e0 00     00:04:56.997  READ DMA EXT
  25 00 00 00 80 00 00 1e 0b 80 60 e0 00     00:04:56.989  READ DMA EXT
  25 00 00 00 60 00 00 1e 0b 7c 08 e0 00     00:04:56.987  READ DMA EXT

SMART Extended Self-test Log Version: 1 (1 sectors)
Num  Test_Description    Status                  Remaining  LifeTime(hours)  LBA_of_first_error
# 1  Short offline       Completed without error       00%      2051         -
# 2  Extended offline    Interrupted (host reset)      00%      2038         -
# 3  Short offline       Completed without error       00%      2037         -
# 4  Short offline       Aborted by host               50%      2037         -
# 5  Short offline       Completed without error       00%      2037         -
# 6  Short offline       Completed without error       00%      2023         -
# 7  Conveyance offline  Completed without error       00%      1974         -
# 8  Extended offline    Interrupted (host reset)      60%      1868         -
# 9  Extended offline    Aborted by host               30%      1867         -
#10  Extended offline    Completed without error       00%      1865         -
#11  Extended offline    Completed without error       00%      1863         -
#12  Short offline       Completed without error       00%      1835         -
#13  Short offline       Completed without error       00%      1744         -
#14  Short offline       Completed without error       00%      1738         -
#15  Extended offline    Aborted by host               70%      1676         -
#16  Conveyance offline  Aborted by host               80%      1663         -
#17  Short offline       Completed without error       00%      1663         -
#18  Short offline       Completed without error       00%      1659         -
#19  Short offline       Completed without error       00%      1643         -

SMART Selective self-test log data structure revision number 1
 SPAN  MIN_LBA  MAX_LBA  CURRENT_TEST_STATUS
    1        0        0  Not_testing
    2        0        0  Not_testing
    3        0        0  Not_testing
    4        0        0  Not_testing
    5        0        0  Not_testing
Selective self-test flags (0x0):
  After scanning selected spans, do NOT read-scan remainder of disk.
If Selective self-test is pending on power-up, resume after 0 minute delay.

SCT Status Version:                  3
SCT Version (vendor specific):       522 (0x020a)
Device State:                        Active (0)
Current Temperature:                    46 Celsius
Power Cycle Min/Max Temperature:     41/50 Celsius
Lifetime    Min/Max Temperature:     13/62 Celsius
Under/Over Temperature Limit Count:   0/359

SCT Temperature History Version:     2
Temperature Sampling Period:         1 minute
Temperature Logging Interval:        1 minute
Min/Max recommended Temperature:      0/ 0 Celsius
Min/Max Temperature Limit:            0/ 0 Celsius
Temperature History Size (Index):    128 (113)

SCT Error Recovery Control:
           Read: Disabled
          Write: Disabled

Device Statistics (GP/SMART Log 0x04) not supported

Pending Defects log (GP Log 0x0c) not supported

SATA Phy Event Counters (GP Log 0x11)
ID      Size     Value  Description
0x000a  2           16  Device-to-host register FISes sent due to a COMRESET
0x0001  2            0  Command failed due to ICRC error
0x0003  2            0  R_ERR response for device-to-host data FIS
0x0004  2            0  R_ERR response for host-to-device data FIS
0x0006  2            0  R_ERR response for device-to-host non-data FIS
0x0007  2            0  R_ERR response for host-to-device non-data FIS

