smartctl 7.2 2020-12-30 r5155 [x86_64-linux-5.10.74-generic-2rosa2021.1-x86_64] (local build)
Copyright (C) 2002-20, Bruce Allen, Christian Franke, www.smartmontools.org

=== START OF INFORMATION SECTION ===
Model Family:     Seagate Momentus 5400.6
Device Model:     ST9500325AS
Serial Number:    --
LU WWN Device Id: 5 000c50 ...
Firmware Version: D005DEM1
User Capacity:    500,107,862,016 bytes [500 GB]
Sector Size:      512 bytes logical/physical
Rotation Rate:    5400 rpm
Device is:        In smartctl database [for details use: -P show]
ATA Version is:   ATA8-ACS T13/1699-D revision 4
SATA Version is:  SATA 2.6, 3.0 Gb/s
Local Time is:    Fri Apr  1 11:32:04 2022 MSK
SMART support is: Available - device has SMART capability.
SMART support is: Enabled
AAM feature is:   Disabled
APM level is:     128 (minimum power consumption without standby)
Rd look-ahead is: Enabled
Write cache is:   Enabled
DSN feature is:   Unavailable
ATA Security is:  Disabled, frozen [SEC2]
Wt Cache Reorder: Unknown

=== START OF READ SMART DATA SECTION ===
SMART overall-health self-assessment test result: PASSED

General SMART Values:
Offline data collection status:  (0x00)	Offline data collection activity
					was never started.
					Auto Offline Data Collection: Disabled.
Self-test execution status:      (   0)	The previous self-test routine completed
					without error or no self-test has ever 
					been run.
Total time to complete Offline 
data collection: 		(    0) seconds.
Offline data collection
capabilities: 			 (0x73) SMART execute Offline immediate.
					Auto Offline data collection on/off support.
					Suspend Offline collection upon new
					command.
					No Offline surface scan supported.
					Self-test supported.
					Conveyance Self-test supported.
					Selective Self-test supported.
SMART capabilities:            (0x0003)	Saves SMART data before entering
					power-saving mode.
					Supports SMART auto save timer.
Error logging capability:        (0x01)	Error logging supported.
					General Purpose Logging supported.
Short self-test routine 
recommended polling time: 	 (   2) minutes.
Extended self-test routine
recommended polling time: 	 ( 140) minutes.
Conveyance self-test routine
recommended polling time: 	 (   3) minutes.
SCT capabilities: 	       (0x103f)	SCT Status supported.
					SCT Error Recovery Control supported.
					SCT Feature Control supported.
					SCT Data Table supported.

SMART Attributes Data Structure revision number: 10
Vendor Specific SMART Attributes with Thresholds:
ID# ATTRIBUTE_NAME          FLAGS    VALUE WORST THRESH FAIL RAW_VALUE
  1 Raw_Read_Error_Rate     POSR--   120   097   006    -    911035
  3 Spin_Up_Time            PO----   099   099   085    -    0
  4 Start_Stop_Count        -O--CK   095   095   020    -    5817
  5 Reallocated_Sector_Ct   PO--CK   100   100   036    -    2
  7 Seek_Error_Rate         POSR--   085   060   030    -    378687483
  9 Power_On_Hours          -O--CK   089   089   000    -    10216
 10 Spin_Retry_Count        PO--C-   100   100   097    -    0
 12 Power_Cycle_Count       -O--CK   096   096   020    -    4781
184 End-to-End_Error        -O--CK   100   100   099    -    0
187 Reported_Uncorrect      -O--CK   001   001   000    -    203
188 Command_Timeout         -O--CK   100   099   000    -    6
189 High_Fly_Writes         -O-RCK   100   100   000    -    0
190 Airflow_Temperature_Cel -O---K   066   050   045    -    34 (Min/Max 24/35)
191 G-Sense_Error_Rate      -O--CK   100   100   000    -    193
192 Power-Off_Retract_Count -O--CK   100   100   000    -    97
193 Load_Cycle_Count        -O--CK   032   032   000    -    137579
194 Temperature_Celsius     -O---K   034   050   000    -    34 (0 6 0 0 0)
195 Hardware_ECC_Recovered  -O-RC-   054   035   000    -    911035
197 Current_Pending_Sector  -O--C-   100   100   000    -    0
198 Offline_Uncorrectable   ----C-   100   100   000    -    0
199 UDMA_CRC_Error_Count    -OSRCK   200   200   000    -    1
240 Head_Flying_Hours       ------   100   253   000    -    9765 (238 253 0)
241 Total_LBAs_Written      ------   100   253   000    -    3981900876
242 Total_LBAs_Read         ------   100   253   000    -    1869298746
254 Free_Fall_Sensor        -O--CK   100   100   000    -    0
                            ||||||_ K auto-keep
                            |||||__ C event count
                            ||||___ R error rate
                            |||____ S speed/performance
                            ||_____ O updated online
                            |______ P prefailure warning

General Purpose Log Directory Version 1
SMART           Log Directory Version 1 [multi-sector log support]
Address    Access  R/W   Size  Description
0x00       GPL,SL  R/O      1  Log Directory
0x01       GPL,SL  R/O      1  Summary SMART error log
0x02       GPL,SL  R/O      5  Comprehensive SMART error log
0x03       GPL,SL  R/O      5  Ext. Comprehensive SMART error log
0x06       GPL,SL  R/O      1  SMART self-test log
0x07       GPL,SL  R/O      1  Extended self-test log
0x09       GPL,SL  R/W      1  Selective self-test log
0x10       GPL,SL  R/O      1  NCQ Command Error log
0x11       GPL,SL  R/O      1  SATA Phy Event Counters log
0x21       GPL,SL  R/O      1  Write stream error log
0x22       GPL,SL  R/O      1  Read stream error log
0x80-0x9f  GPL,SL  R/W     16  Host vendor specific log
0xa1       GPL,SL  VS      20  Device vendor specific log
0xa2       GPL     VS    2248  Device vendor specific log
0xa8       GPL,SL  VS      65  Device vendor specific log
0xa9       GPL,SL  VS       1  Device vendor specific log
0xb0       GPL     VS    2864  Device vendor specific log
0xbe-0xbf  GPL     VS   65535  Device vendor specific log
0xe0       GPL,SL  R/W      1  SCT Command/Status
0xe1       GPL,SL  R/W      1  SCT Data Transfer

SMART Extended Comprehensive Error Log Version: 1 (5 sectors)
Device Error Count: 194 (device log contains only the most recent 20 errors)
	CR     = Command Register
	FEATR  = Features Register
	COUNT  = Count (was: Sector Count) Register
	LBA_48 = Upper bytes of LBA High/Mid/Low Registers ]  ATA-8
	LH     = LBA High (was: Cylinder High) Register    ]   LBA
	LM     = LBA Mid (was: Cylinder Low) Register      ] Register
	LL     = LBA Low (was: Sector Number) Register     ]
	DV     = Device (was: Device/Head) Register
	DC     = Device Control Register
	ER     = Error register
	ST     = Status register
Powered_Up_Time is measured from power on, and printed as
DDd+hh:mm:SS.sss where DD=days, hh=hours, mm=minutes,
SS=sec, and sss=millisec. It "wraps" after 49.710 days.

Error 194 [13] occurred at disk power-on lifetime: 10145 hours (422 days + 17 hours)
  When the command that caused the error occurred, the device was active or idle.

  After command completion occurred, registers were:
  ER -- ST COUNT  LBA_48  LH LM LL DV DC
  -- -- -- == -- == == == -- -- -- -- --
  40 -- 51 00 00 00 5c 00 2b 02 b8 00 00  Error: UNC at LBA = 0x5c002b02b8 = 395139809976

  Commands leading to the command that caused the error were:
  CR FEATR COUNT  LBA_48  LH LM LL DV DC  Powered_Up_Time  Command/Feature_Name
  -- == -- == -- == == == -- -- -- -- --  ---------------  --------------------
  60 00 00 00 08 00 da 00 d2 13 e6 40 00     00:58:53.583  READ FPDMA QUEUED
  60 00 00 00 08 00 da 00 d2 13 de 40 00     00:58:53.583  READ FPDMA QUEUED
  60 00 00 00 08 00 da 00 d2 13 d6 40 00     00:58:53.582  READ FPDMA QUEUED
  60 00 00 00 08 00 da 00 d2 13 ce 40 00     00:58:53.582  READ FPDMA QUEUED
  60 00 00 00 08 00 da 00 d2 13 c6 40 00     00:58:53.581  READ FPDMA QUEUED

Error 193 [12] occurred at disk power-on lifetime: 10145 hours (422 days + 17 hours)
  When the command that caused the error occurred, the device was active or idle.

  After command completion occurred, registers were:
  ER -- ST COUNT  LBA_48  LH LM LL DV DC
  -- -- -- == -- == == == -- -- -- -- --
  40 -- 51 00 00 00 5c 00 2b 02 b8 00 00  Error: UNC at LBA = 0x5c002b02b8 = 395139809976

  Commands leading to the command that caused the error were:
  CR FEATR COUNT  LBA_48  LH LM LL DV DC  Powered_Up_Time  Command/Feature_Name
  -- == -- == -- == == == -- -- -- -- --  ---------------  --------------------
  60 00 00 02 00 00 5c 00 2a 02 7e 40 00     00:58:50.568  READ FPDMA QUEUED
  60 00 00 01 00 00 5c 00 29 02 7e 40 00     00:58:50.564  READ FPDMA QUEUED
  60 00 00 03 68 00 da 00 ce 13 46 40 00     00:58:50.533  READ FPDMA QUEUED
  60 00 00 03 00 00 5c 00 26 02 7e 40 00     00:58:50.504  READ FPDMA QUEUED
  60 00 00 02 00 00 5c 00 24 02 7e 40 00     00:58:50.502  READ FPDMA QUEUED

Error 192 [11] occurred at disk power-on lifetime: 9636 hours (401 days + 12 hours)
  When the command that caused the error occurred, the device was active or idle.

  After command completion occurred, registers were:
  ER -- ST COUNT  LBA_48  LH LM LL DV DC
  -- -- -- == -- == == == -- -- -- -- --
  40 -- 51 00 00 00 ee 00 49 04 43 00 00  Error: WP at LBA = 0xee00490443 = 1022207001667

  Commands leading to the command that caused the error were:
  CR FEATR COUNT  LBA_48  LH LM LL DV DC  Powered_Up_Time  Command/Feature_Name
  -- == -- == -- == == == -- -- -- -- --  ---------------  --------------------
  61 00 00 00 08 00 61 00 ed 00 40 40 00     02:41:17.312  WRITE FPDMA QUEUED
  61 00 00 00 08 00 61 00 ec 00 78 40 00     02:41:17.311  WRITE FPDMA QUEUED
  61 00 00 00 08 00 61 00 eb 00 28 40 00     02:41:17.311  WRITE FPDMA QUEUED
  61 00 00 00 08 00 61 00 ea 00 b8 40 00     02:41:17.310  WRITE FPDMA QUEUED
  61 00 00 00 08 00 61 00 e9 00 f0 40 00     02:41:17.310  WRITE FPDMA QUEUED

Error 191 [10] occurred at disk power-on lifetime: 9636 hours (401 days + 12 hours)
  When the command that caused the error occurred, the device was active or idle.

  After command completion occurred, registers were:
  ER -- ST COUNT  LBA_48  LH LM LL DV DC
  -- -- -- == -- == == == -- -- -- -- --
  40 -- 51 00 00 00 ee 00 49 04 43 00 00  Error: WP at LBA = 0xee00490443 = 1022207001667

  Commands leading to the command that caused the error were:
  CR FEATR COUNT  LBA_48  LH LM LL DV DC  Powered_Up_Time  Command/Feature_Name
  -- == -- == -- == == == -- -- -- -- --  ---------------  --------------------
  61 00 00 00 08 00 60 00 19 1c b8 40 00     02:41:14.530  WRITE FPDMA QUEUED
  61 00 00 00 08 00 60 00 18 1c 80 40 00     02:41:14.523  WRITE FPDMA QUEUED
  61 00 00 00 08 00 60 00 18 1c 00 40 00     02:41:14.518  WRITE FPDMA QUEUED
  61 00 00 00 08 00 61 00 1d 17 78 40 00     02:41:14.512  WRITE FPDMA QUEUED
  61 00 00 00 08 00 61 00 19 17 48 40 00     02:41:14.501  WRITE FPDMA QUEUED

Error 190 [9] occurred at disk power-on lifetime: 9636 hours (401 days + 12 hours)
  When the command that caused the error occurred, the device was active or idle.

  After command completion occurred, registers were:
  ER -- ST COUNT  LBA_48  LH LM LL DV DC
  -- -- -- == -- == == == -- -- -- -- --
  40 -- 51 00 00 00 ee 00 49 04 43 00 00  Error: WP at LBA = 0xee00490443 = 1022207001667

  Commands leading to the command that caused the error were:
  CR FEATR COUNT  LBA_48  LH LM LL DV DC  Powered_Up_Time  Command/Feature_Name
  -- == -- == -- == == == -- -- -- -- --  ---------------  --------------------
  61 00 00 00 08 00 a0 00 18 0c 88 40 00     02:41:10.984  WRITE FPDMA QUEUED
  60 00 00 02 00 00 ee 00 48 04 00 40 00     02:41:10.983  READ FPDMA QUEUED
  61 00 00 00 10 00 a0 00 18 0c 00 40 00     02:41:10.981  WRITE FPDMA QUEUED
  60 00 00 02 00 00 ee 00 46 04 00 40 00     02:41:10.980  READ FPDMA QUEUED
  61 00 00 00 20 00 61 00 4f 0c 00 40 00     02:41:10.978  WRITE FPDMA QUEUED

Error 189 [8] occurred at disk power-on lifetime: 8721 hours (363 days + 9 hours)
  When the command that caused the error occurred, the device was active or idle.

  After command completion occurred, registers were:
  ER -- ST COUNT  LBA_48  LH LM LL DV DC
  -- -- -- == -- == == == -- -- -- -- --
  40 -- 51 00 00 00 ee 00 3b 04 a5 00 00  Error: UNC at LBA = 0xee003b04a5 = 1022206084261

  Commands leading to the command that caused the error were:
  CR FEATR COUNT  LBA_48  LH LM LL DV DC  Powered_Up_Time  Command/Feature_Name
  -- == -- == -- == == == -- -- -- -- --  ---------------  --------------------
  60 00 00 00 08 00 ee 00 3b 04 a0 40 00     00:12:21.928  READ FPDMA QUEUED
  61 00 00 00 08 00 04 00 6d 1d 38 40 00     00:12:21.928  WRITE FPDMA QUEUED
  ea 00 00 00 00 00 00 00 00 00 00 a0 00     00:12:21.880  FLUSH CACHE EXT
  61 00 00 00 40 00 04 00 6c 1d f8 40 00     00:12:21.880  WRITE FPDMA QUEUED
  61 00 00 00 08 00 49 00 38 03 80 40 00     00:12:21.879  WRITE FPDMA QUEUED

Error 188 [7] occurred at disk power-on lifetime: 8721 hours (363 days + 9 hours)
  When the command that caused the error occurred, the device was active or idle.

  After command completion occurred, registers were:
  ER -- ST COUNT  LBA_48  LH LM LL DV DC
  -- -- -- == -- == == == -- -- -- -- --
  40 -- 51 00 00 00 ee 00 3b 04 a5 00 00  Error: UNC at LBA = 0xee003b04a5 = 1022206084261

  Commands leading to the command that caused the error were:
  CR FEATR COUNT  LBA_48  LH LM LL DV DC  Powered_Up_Time  Command/Feature_Name
  -- == -- == -- == == == -- -- -- -- --  ---------------  --------------------
  60 00 00 00 08 00 ee 00 3b 04 a0 40 00     00:12:19.617  READ FPDMA QUEUED
  60 00 00 00 08 00 ee 00 3b 04 98 40 00     00:12:19.616  READ FPDMA QUEUED
  60 00 00 00 08 00 ee 00 3b 04 90 40 00     00:12:19.616  READ FPDMA QUEUED
  60 00 00 00 08 00 ee 00 3b 04 88 40 00     00:12:19.616  READ FPDMA QUEUED
  60 00 00 00 08 00 ee 00 3b 04 80 40 00     00:12:19.615  READ FPDMA QUEUED

Error 187 [6] occurred at disk power-on lifetime: 8721 hours (363 days + 9 hours)
  When the command that caused the error occurred, the device was active or idle.

  After command completion occurred, registers were:
  ER -- ST COUNT  LBA_48  LH LM LL DV DC
  -- -- -- == -- == == == -- -- -- -- --
  40 -- 51 00 00 00 ee 00 3b 04 a5 00 00  Error: UNC at LBA = 0xee003b04a5 = 1022206084261

  Commands leading to the command that caused the error were:
  CR FEATR COUNT  LBA_48  LH LM LL DV DC  Powered_Up_Time  Command/Feature_Name
  -- == -- == -- == == == -- -- -- -- --  ---------------  --------------------
  60 00 00 04 00 00 ed 00 cc 04 00 40 00     00:12:16.862  READ FPDMA QUEUED
  60 00 00 04 00 00 ed 00 c8 04 00 40 00     00:12:16.859  READ FPDMA QUEUED
  60 00 00 04 00 00 e9 00 4c 04 00 40 00     00:12:16.747  READ FPDMA QUEUED
  60 00 00 04 00 00 e9 00 48 04 00 40 00     00:12:16.746  READ FPDMA QUEUED
  60 00 00 04 00 00 e7 00 8c 04 00 40 00     00:12:16.518  READ FPDMA QUEUED

SMART Extended Self-test Log Version: 1 (1 sectors)
Num  Test_Description    Status                  Remaining  LifeTime(hours)  LBA_of_first_error
# 1  Short offline       Completed without error       00%      9883         -
# 2  Short offline       Completed: read failure       90%      8537         82725187
# 3  Short offline       Completed without error       00%      6524         -
# 4  Short offline       Completed without error       00%      5482         -
# 5  Short offline       Completed without error       00%       630         -
# 6  Short offline       Completed without error       00%       555         -
# 7  Short offline       Completed without error       00%       363         -
# 8  Short offline       Completed without error       00%         0         -

SMART Selective self-test log data structure revision number 1
 SPAN  MIN_LBA  MAX_LBA  CURRENT_TEST_STATUS
    1        0        0  Not_testing
    2        0        0  Not_testing
    3        0        0  Not_testing
    4        0        0  Not_testing
    5        0        0  Not_testing
Selective self-test flags (0x0):
  After scanning selected spans, do NOT read-scan remainder of disk.
If Selective self-test is pending on power-up, resume after 0 minute delay.

SCT Status Version:                  3
SCT Version (vendor specific):       522 (0x020a)
Device State:                        Active (0)
Current Temperature:                    34 Celsius
Power Cycle Min/Max Temperature:     24/35 Celsius
Lifetime    Min/Max Temperature:      6/50 Celsius
Specified Max Operating Temperature:    35 Celsius
Under/Over Temperature Limit Count:   0/0

SCT Temperature History Version:     2
Temperature Sampling Period:         1 minute
Temperature Logging Interval:        1 minute
Min/Max recommended Temperature:     14/55 Celsius
Min/Max Temperature Limit:           10/60 Celsius
Temperature History Size (Index):    128 (16)

SCT Error Recovery Control:
           Read: Disabled
          Write: Disabled

Device Statistics (GP/SMART Log 0x04) not supported

Pending Defects log (GP Log 0x0c) not supported

SATA Phy Event Counters (GP Log 0x11)
ID      Size     Value  Description
0x000a  2            4  Device-to-host register FISes sent due to a COMRESET
0x0001  2            0  Command failed due to ICRC error
0x0003  2            0  R_ERR response for device-to-host data FIS
0x0004  2            0  R_ERR response for host-to-device data FIS
0x0006  2            0  R_ERR response for device-to-host non-data FIS
0x0007  2            0  R_ERR response for host-to-device non-data FIS

