smartctl 7.1 2019-12-30 r5022 [x86_64-linux-5.11.0-27-generic] (local build)
Copyright (C) 2002-19, Bruce Allen, Christian Franke, www.smartmontools.org

=== START OF INFORMATION SECTION ===
Model Family:     Seagate Momentus 5400.6
Device Model:     ST9500325AS
Serial Number:    --
LU WWN Device Id: 5 000c50 ...
Firmware Version: 0003SDM1
User Capacity:    500,107,862,016 bytes [500 GB]
Sector Size:      512 bytes logical/physical
Rotation Rate:    5400 rpm
Device is:        In smartctl database [for details use: -P show]
ATA Version is:   ATA8-ACS T13/1699-D revision 4
SATA Version is:  SATA 2.6, 3.0 Gb/s
Local Time is:    Tue Jan 10 23:10:32 2023 UTC
SMART support is: Available - device has SMART capability.
SMART support is: Enabled
AAM feature is:   Unavailable
APM level is:     254 (maximum performance)
Rd look-ahead is: Enabled
Write cache is:   Enabled
DSN feature is:   Unavailable
ATA Security is:  Disabled, NOT FROZEN [SEC1]
Wt Cache Reorder: Unknown

=== START OF READ SMART DATA SECTION ===
SMART overall-health self-assessment test result: PASSED
See vendor-specific Attribute list for marginal Attributes.

General SMART Values:
Offline data collection status:  (0x82)	Offline data collection activity
					was completed without error.
					Auto Offline Data Collection: Enabled.
Self-test execution status:      (   0)	The previous self-test routine completed
					without error or no self-test has ever 
					been run.
Total time to complete Offline 
data collection: 		(    0) seconds.
Offline data collection
capabilities: 			 (0x7b) SMART execute Offline immediate.
					Auto Offline data collection on/off support.
					Suspend Offline collection upon new
					command.
					Offline surface scan supported.
					Self-test supported.
					Conveyance Self-test supported.
					Selective Self-test supported.
SMART capabilities:            (0x0003)	Saves SMART data before entering
					power-saving mode.
					Supports SMART auto save timer.
Error logging capability:        (0x01)	Error logging supported.
					General Purpose Logging supported.
Short self-test routine 
recommended polling time: 	 (   1) minutes.
Extended self-test routine
recommended polling time: 	 ( 142) minutes.
Conveyance self-test routine
recommended polling time: 	 (   2) minutes.
SCT capabilities: 	       (0x103b)	SCT Status supported.
					SCT Error Recovery Control supported.
					SCT Feature Control supported.
					SCT Data Table supported.

SMART Attributes Data Structure revision number: 10
Vendor Specific SMART Attributes with Thresholds:
ID# ATTRIBUTE_NAME          FLAGS    VALUE WORST THRESH FAIL RAW_VALUE
  1 Raw_Read_Error_Rate     POSR--   114   090   006    -    81480875
  3 Spin_Up_Time            PO----   098   098   000    -    0
  4 Start_Stop_Count        -O--CK   094   094   020    -    7012
  5 Reallocated_Sector_Ct   PO--CK   100   100   036    -    0
  7 Seek_Error_Rate         POSR--   082   060   030    -    170752770
  9 Power_On_Hours          -O--CK   095   095   000    -    5094
 10 Spin_Retry_Count        PO--C-   100   100   097    -    0
 12 Power_Cycle_Count       -O--CK   094   094   020    -    7010
184 End-to-End_Error        -O--CK   100   100   099    -    0
187 Reported_Uncorrect      -O--CK   001   001   000    -    2874
188 Command_Timeout         -O--CK   100   097   000    -    4295032882
189 High_Fly_Writes         -O-RCK   100   100   000    -    0
190 Airflow_Temperature_Cel -O---K   062   037   045    Past 38 (0 64 38 25 0)
191 G-Sense_Error_Rate      -O--CK   099   099   000    -    3441
192 Power-Off_Retract_Count -O--CK   100   100   000    -    272
193 Load_Cycle_Count        -O--CK   075   075   000    -    51905
194 Temperature_Celsius     -O---K   038   063   000    -    38 (0 10 0 0 0)
195 Hardware_ECC_Recovered  -O-RC-   055   047   000    -    81480875
197 Current_Pending_Sector  -O--C-   100   100   000    -    2
198 Offline_Uncorrectable   ----C-   100   100   000    -    2
199 UDMA_CRC_Error_Count    -OSRCK   200   200   000    -    0
254 Free_Fall_Sensor        -O--CK   100   100   000    -    0
                            ||||||_ K auto-keep
                            |||||__ C event count
                            ||||___ R error rate
                            |||____ S speed/performance
                            ||_____ O updated online
                            |______ P prefailure warning

General Purpose Log Directory Version 1
SMART           Log Directory Version 1 [multi-sector log support]
Address    Access  R/W   Size  Description
0x00       GPL,SL  R/O      1  Log Directory
0x01       GPL,SL  R/O      1  Summary SMART error log
0x02       GPL,SL  R/O      5  Comprehensive SMART error log
0x03       GPL,SL  R/O      5  Ext. Comprehensive SMART error log
0x06       GPL,SL  R/O      1  SMART self-test log
0x07       GPL,SL  R/O      1  Extended self-test log
0x09       GPL,SL  R/W      1  Selective self-test log
0x10       GPL,SL  R/O      1  NCQ Command Error log
0x11       GPL,SL  R/O      1  SATA Phy Event Counters log
0x21       GPL,SL  R/O      1  Write stream error log
0x22       GPL,SL  R/O      1  Read stream error log
0x80-0x9f  GPL,SL  R/W     16  Host vendor specific log
0xa1       GPL,SL  VS      20  Device vendor specific log
0xa2       GPL     VS    2248  Device vendor specific log
0xa8       GPL,SL  VS      65  Device vendor specific log
0xa9       GPL,SL  VS       1  Device vendor specific log
0xb0       GPL     VS    2864  Device vendor specific log
0xbe-0xbf  GPL     VS   65535  Device vendor specific log
0xe0       GPL,SL  R/W      1  SCT Command/Status
0xe1       GPL,SL  R/W      1  SCT Data Transfer

SMART Extended Comprehensive Error Log Version: 1 (5 sectors)
Device Error Count: 2130 (device log contains only the most recent 20 errors)
	CR     = Command Register
	FEATR  = Features Register
	COUNT  = Count (was: Sector Count) Register
	LBA_48 = Upper bytes of LBA High/Mid/Low Registers ]  ATA-8
	LH     = LBA High (was: Cylinder High) Register    ]   LBA
	LM     = LBA Mid (was: Cylinder Low) Register      ] Register
	LL     = LBA Low (was: Sector Number) Register     ]
	DV     = Device (was: Device/Head) Register
	DC     = Device Control Register
	ER     = Error register
	ST     = Status register
Powered_Up_Time is measured from power on, and printed as
DDd+hh:mm:SS.sss where DD=days, hh=hours, mm=minutes,
SS=sec, and sss=millisec. It "wraps" after 49.710 days.

Error 2130 [9] occurred at disk power-on lifetime: 4396 hours (183 days + 4 hours)
  When the command that caused the error occurred, the device was active or idle.

  After command completion occurred, registers were:
  ER -- ST COUNT  LBA_48  LH LM LL DV DC
  -- -- -- == -- == == == -- -- -- -- --
  40 -- 51 00 00 00 11 00 50 09 99 00 00  Error: WP at LBA = 0x1100500999 = 73019689369

  Commands leading to the command that caused the error were:
  CR FEATR COUNT  LBA_48  LH LM LL DV DC  Powered_Up_Time  Command/Feature_Name
  -- == -- == -- == == == -- -- -- -- --  ---------------  --------------------
  61 00 00 00 08 00 c8 00 af 00 f8 40 00     00:01:04.799  WRITE FPDMA QUEUED
  61 00 00 00 08 00 33 00 e6 04 08 40 00     00:01:04.798  WRITE FPDMA QUEUED
  60 00 00 00 20 00 33 00 b3 00 60 40 00     00:01:04.794  READ FPDMA QUEUED
  61 00 00 00 3a 00 78 00 e1 02 40 40 00     00:01:04.793  WRITE FPDMA QUEUED
  60 00 00 00 20 00 59 00 8a 02 00 40 00     00:01:04.793  READ FPDMA QUEUED

Error 2129 [8] occurred at disk power-on lifetime: 4396 hours (183 days + 4 hours)
  When the command that caused the error occurred, the device was active or idle.

  After command completion occurred, registers were:
  ER -- ST COUNT  LBA_48  LH LM LL DV DC
  -- -- -- == -- == == == -- -- -- -- --
  40 -- 51 00 00 00 11 00 50 09 99 00 00  Error: UNC at LBA = 0x1100500999 = 73019689369

  Commands leading to the command that caused the error were:
  CR FEATR COUNT  LBA_48  LH LM LL DV DC  Powered_Up_Time  Command/Feature_Name
  -- == -- == -- == == == -- -- -- -- --  ---------------  --------------------
  60 00 00 00 08 00 27 00 ad 00 54 40 00     00:01:02.246  READ FPDMA QUEUED
  60 00 00 00 40 00 02 00 e9 00 1c 40 00     00:01:02.244  READ FPDMA QUEUED
  60 00 00 00 18 00 29 00 b6 00 5a 40 00     00:01:02.242  READ FPDMA QUEUED
  61 00 00 00 10 00 5c 00 ef 00 78 40 00     00:01:02.241  WRITE FPDMA QUEUED
  61 00 00 01 00 00 44 00 e8 0b 78 40 00     00:01:02.240  WRITE FPDMA QUEUED

Error 2128 [7] occurred at disk power-on lifetime: 4396 hours (183 days + 4 hours)
  When the command that caused the error occurred, the device was active or idle.

  After command completion occurred, registers were:
  ER -- ST COUNT  LBA_48  LH LM LL DV DC
  -- -- -- == -- == == == -- -- -- -- --
  40 -- 51 00 00 00 11 00 50 09 99 00 00  Error: WP at LBA = 0x1100500999 = 73019689369

  Commands leading to the command that caused the error were:
  CR FEATR COUNT  LBA_48  LH LM LL DV DC  Powered_Up_Time  Command/Feature_Name
  -- == -- == -- == == == -- -- -- -- --  ---------------  --------------------
  61 00 00 00 08 00 5b 00 ef 00 08 40 00     00:00:56.946  WRITE FPDMA QUEUED
  61 00 00 00 05 00 00 00 11 00 f8 40 00     00:00:56.945  WRITE FPDMA QUEUED
  60 00 00 00 20 00 11 00 50 09 80 40 00     00:00:56.936  READ FPDMA QUEUED
  61 00 00 01 00 00 44 00 d2 0b 78 40 00     00:00:56.935  WRITE FPDMA QUEUED
  61 00 00 01 00 00 44 00 d3 0b 78 40 00     00:00:56.934  WRITE FPDMA QUEUED

Error 2127 [6] occurred at disk power-on lifetime: 4396 hours (183 days + 4 hours)
  When the command that caused the error occurred, the device was active or idle.

  After command completion occurred, registers were:
  ER -- ST COUNT  LBA_48  LH LM LL DV DC
  -- -- -- == -- == == == -- -- -- -- --
  40 -- 51 00 00 00 11 00 50 09 99 00 00  Error: UNC at LBA = 0x1100500999 = 73019689369

  Commands leading to the command that caused the error were:
  CR FEATR COUNT  LBA_48  LH LM LL DV DC  Powered_Up_Time  Command/Feature_Name
  -- == -- == -- == == == -- -- -- -- --  ---------------  --------------------
  60 00 00 00 20 00 8d 00 4d 01 60 40 00     00:00:54.483  READ FPDMA QUEUED
  61 00 00 00 08 00 e6 00 54 01 40 40 00     00:00:54.483  WRITE FPDMA QUEUED
  61 00 00 01 00 00 44 00 df 0b 78 40 00     00:00:54.482  WRITE FPDMA QUEUED
  61 00 00 01 00 00 44 00 de 0b 78 40 00     00:00:54.482  WRITE FPDMA QUEUED
  61 00 00 01 00 00 44 00 dd 0b 78 40 00     00:00:54.481  WRITE FPDMA QUEUED

Error 2126 [5] occurred at disk power-on lifetime: 4396 hours (183 days + 4 hours)
  When the command that caused the error occurred, the device was active or idle.

  After command completion occurred, registers were:
  ER -- ST COUNT  LBA_48  LH LM LL DV DC
  -- -- -- == -- == == == -- -- -- -- --
  40 -- 51 00 00 00 11 00 50 09 99 00 00  Error: WP at LBA = 0x1100500999 = 73019689369

  Commands leading to the command that caused the error were:
  CR FEATR COUNT  LBA_48  LH LM LL DV DC  Powered_Up_Time  Command/Feature_Name
  -- == -- == -- == == == -- -- -- -- --  ---------------  --------------------
  61 00 00 00 08 00 c8 00 af 00 f8 40 00     00:00:49.034  WRITE FPDMA QUEUED
  61 00 00 00 08 00 5b 00 ef 00 00 40 00     00:00:49.031  WRITE FPDMA QUEUED
  61 00 00 00 08 00 5b 00 ef 00 08 40 00     00:00:49.024  WRITE FPDMA QUEUED
  61 00 00 00 10 00 5c 00 ee 00 d8 40 00     00:00:49.023  WRITE FPDMA QUEUED
  61 00 00 00 08 00 c8 00 af 00 f8 40 00     00:00:49.022  WRITE FPDMA QUEUED

Error 2125 [4] occurred at disk power-on lifetime: 4396 hours (183 days + 4 hours)
  When the command that caused the error occurred, the device was active or idle.

  After command completion occurred, registers were:
  ER -- ST COUNT  LBA_48  LH LM LL DV DC
  -- -- -- == -- == == == -- -- -- -- --
  40 -- 51 00 00 00 11 00 50 09 99 00 00  Error: WP at LBA = 0x1100500999 = 73019689369

  Commands leading to the command that caused the error were:
  CR FEATR COUNT  LBA_48  LH LM LL DV DC  Powered_Up_Time  Command/Feature_Name
  -- == -- == -- == == == -- -- -- -- --  ---------------  --------------------
  61 00 00 00 08 00 5b 00 ef 00 08 40 00     00:00:45.936  WRITE FPDMA QUEUED
  61 00 00 00 08 00 02 00 23 00 c0 40 00     00:00:45.935  WRITE FPDMA QUEUED
  60 00 00 00 20 00 0c 00 21 00 20 40 00     00:00:45.933  READ FPDMA QUEUED
  61 00 00 00 18 00 5c 00 ed 00 28 40 00     00:00:45.931  WRITE FPDMA QUEUED
  61 00 00 00 08 00 02 00 23 00 90 40 00     00:00:45.930  WRITE FPDMA QUEUED

Error 2124 [3] occurred at disk power-on lifetime: 4396 hours (183 days + 4 hours)
  When the command that caused the error occurred, the device was active or idle.

  After command completion occurred, registers were:
  ER -- ST COUNT  LBA_48  LH LM LL DV DC
  -- -- -- == -- == == == -- -- -- -- --
  40 -- 51 00 00 00 11 00 50 09 99 00 00  Error: WP at LBA = 0x1100500999 = 73019689369

  Commands leading to the command that caused the error were:
  CR FEATR COUNT  LBA_48  LH LM LL DV DC  Powered_Up_Time  Command/Feature_Name
  -- == -- == -- == == == -- -- -- -- --  ---------------  --------------------
  61 00 00 00 08 00 c8 00 af 00 e8 40 00     00:00:40.617  WRITE FPDMA QUEUED
  61 00 00 00 58 00 08 00 9c 0a 80 40 00     00:00:40.611  WRITE FPDMA QUEUED
  61 00 00 01 00 00 08 00 9b 0a 80 40 00     00:00:40.600  WRITE FPDMA QUEUED
  61 00 00 01 00 00 08 00 9a 0a 80 40 00     00:00:40.598  WRITE FPDMA QUEUED
  61 00 00 01 00 00 08 00 99 0a 80 40 00     00:00:40.596  WRITE FPDMA QUEUED

Error 2123 [2] occurred at disk power-on lifetime: 4396 hours (183 days + 4 hours)
  When the command that caused the error occurred, the device was active or idle.

  After command completion occurred, registers were:
  ER -- ST COUNT  LBA_48  LH LM LL DV DC
  -- -- -- == -- == == == -- -- -- -- --
  40 -- 51 00 00 00 11 00 50 09 99 00 00  Error: UNC at LBA = 0x1100500999 = 73019689369

  Commands leading to the command that caused the error were:
  CR FEATR COUNT  LBA_48  LH LM LL DV DC  Powered_Up_Time  Command/Feature_Name
  -- == -- == -- == == == -- -- -- -- --  ---------------  --------------------
  60 00 00 00 20 00 6b 00 44 07 40 40 00     00:00:37.917  READ FPDMA QUEUED
  60 00 00 00 20 00 6b 00 32 07 40 40 00     00:00:37.915  READ FPDMA QUEUED
  61 00 00 00 08 00 6b 00 0a 07 28 40 00     00:00:37.915  WRITE FPDMA QUEUED
  61 00 00 00 08 00 5b 00 ef 00 00 40 00     00:00:37.914  WRITE FPDMA QUEUED
  61 00 00 00 01 00 6b 00 0a 07 20 40 00     00:00:37.913  WRITE FPDMA QUEUED

SMART Extended Self-test Log Version: 1 (1 sectors)
No self-tests have been logged.  [To run self-tests, use: smartctl -t]

SMART Selective self-test log data structure revision number 1
 SPAN  MIN_LBA  MAX_LBA  CURRENT_TEST_STATUS
    1        0        0  Not_testing
    2        0        0  Not_testing
    3        0        0  Not_testing
    4        0        0  Not_testing
    5        0        0  Not_testing
Selective self-test flags (0x0):
  After scanning selected spans, do NOT read-scan remainder of disk.
If Selective self-test is pending on power-up, resume after 0 minute delay.

SCT Status Version:                  3
SCT Version (vendor specific):       522 (0x020a)
Device State:                        Active (0)
Current Temperature:                    38 Celsius
Power Cycle Min/Max Temperature:     25/38 Celsius
Lifetime    Min/Max Temperature:     10/63 Celsius
Under/Over Temperature Limit Count:   0/23

SCT Temperature History Version:     2
Temperature Sampling Period:         1 minute
Temperature Logging Interval:        1 minute
Min/Max recommended Temperature:      0/ 0 Celsius
Min/Max Temperature Limit:            0/ 0 Celsius
Temperature History Size (Index):    128 (69)

SCT Error Recovery Control:
           Read: Disabled
          Write: Disabled

Device Statistics (GP/SMART Log 0x04) not supported

Pending Defects log (GP Log 0x0c) not supported

SATA Phy Event Counters (GP Log 0x11)
ID      Size     Value  Description
0x000a  2            3  Device-to-host register FISes sent due to a COMRESET
0x0001  2            0  Command failed due to ICRC error
0x0003  2            0  R_ERR response for device-to-host data FIS
0x0004  2            0  R_ERR response for host-to-device data FIS
0x0006  2            0  R_ERR response for device-to-host non-data FIS
0x0007  2            0  R_ERR response for host-to-device non-data FIS

