smartctl 7.2 2020-12-30 r5155 [x86_64-linux-5.10.14-desktop-1omv4002] (OpenMandriva Lx 7.2-2)
Copyright (C) 2002-20, Bruce Allen, Christian Franke, www.smartmontools.org

=== START OF INFORMATION SECTION ===
Model Family:     Seagate Momentus 5400.6
Device Model:     ST9500325AS
Serial Number:    --
LU WWN Device Id: 5 000c50 ...
Firmware Version: 0005HPM1
User Capacity:    500,107,862,016 bytes [500 GB]
Sector Size:      512 bytes logical/physical
Rotation Rate:    5400 rpm
Form Factor:      2.5 inches
Device is:        In smartctl database [for details use: -P show]
ATA Version is:   ATA8-ACS T13/1699-D revision 4
SATA Version is:  SATA 2.6, 3.0 Gb/s
Local Time is:    Sun Feb 14 16:15:46 2021 UTC
SMART support is: Available - device has SMART capability.
SMART support is: Enabled
AAM feature is:   Unavailable
APM level is:     128 (minimum power consumption without standby)
Rd look-ahead is: Enabled
Write cache is:   Enabled
DSN feature is:   Unavailable
ATA Security is:  Disabled, NOT FROZEN [SEC1]
Wt Cache Reorder: Unknown

=== START OF READ SMART DATA SECTION ===
SMART overall-health self-assessment test result: PASSED

General SMART Values:
Offline data collection status:  (0x00)	Offline data collection activity
					was never started.
					Auto Offline Data Collection: Disabled.
Self-test execution status:      (   0)	The previous self-test routine completed
					without error or no self-test has ever 
					been run.
Total time to complete Offline 
data collection: 		(    0) seconds.
Offline data collection
capabilities: 			 (0x53) SMART execute Offline immediate.
					Auto Offline data collection on/off support.
					Suspend Offline collection upon new
					command.
					No Offline surface scan supported.
					Self-test supported.
					No Conveyance Self-test supported.
					Selective Self-test supported.
SMART capabilities:            (0x0003)	Saves SMART data before entering
					power-saving mode.
					Supports SMART auto save timer.
Error logging capability:        (0x01)	Error logging supported.
					General Purpose Logging supported.
Short self-test routine 
recommended polling time: 	 (   2) minutes.
Extended self-test routine
recommended polling time: 	 ( 139) minutes.
SCT capabilities: 	       (0x103f)	SCT Status supported.
					SCT Error Recovery Control supported.
					SCT Feature Control supported.
					SCT Data Table supported.

SMART Attributes Data Structure revision number: 10
Vendor Specific SMART Attributes with Thresholds:
ID# ATTRIBUTE_NAME          FLAGS    VALUE WORST THRESH FAIL RAW_VALUE
  1 Raw_Read_Error_Rate     POSR--   117   087   006    -    152962475
  3 Spin_Up_Time            -O----   099   098   000    -    0
  4 Start_Stop_Count        PO--CK   095   095   000    -    5228
  5 Reallocated_Sector_Ct   PO--CK   100   100   036    -    4
  7 Seek_Error_Rate         POSR--   081   060   030    -    162074351
  9 Power_On_Hours          -O--CK   091   091   000    -    8364
 10 Spin_Retry_Count        PO--C-   100   100   097    -    0
 12 Power_Cycle_Count       PO--CK   096   096   020    -    4847
183 Runtime_Bad_Block       -O--CK   100   253   000    -    0
184 End-to-End_Error        PO--CK   100   100   097    -    0
187 Reported_Uncorrect      -O--CK   063   063   000    -    37
188 Command_Timeout         -O--CK   100   094   000    -    95
189 High_Fly_Writes         -O-RCK   100   100   000    -    0
190 Airflow_Temperature_Cel -O---K   070   046   045    -    30 (Min/Max 30/30)
191 G-Sense_Error_Rate      -O--CK   100   100   000    -    101
192 Power-Off_Retract_Count -O--CK   100   100   000    -    194
193 Load_Cycle_Count        -O--CK   074   074   000    -    52349
194 Temperature_Celsius     -O---K   030   054   000    -    30 (243 52 0 0 0)
195 Hardware_ECC_Recovered  -O-RC-   055   048   000    -    152962475
196 Reallocated_Event_Count PO--CK   100   100   036    -    4
197 Current_Pending_Sector  -O--C-   100   100   000    -    7
198 Offline_Uncorrectable   ----C-   100   100   000    -    0
199 UDMA_CRC_Error_Count    -OSRCK   200   200   000    -    0
                            ||||||_ K auto-keep
                            |||||__ C event count
                            ||||___ R error rate
                            |||____ S speed/performance
                            ||_____ O updated online
                            |______ P prefailure warning

General Purpose Log Directory Version 1
SMART           Log Directory Version 1 [multi-sector log support]
Address    Access  R/W   Size  Description
0x00       GPL,SL  R/O      1  Log Directory
0x01       GPL,SL  R/O      1  Summary SMART error log
0x02       GPL,SL  R/O      5  Comprehensive SMART error log
0x03       GPL,SL  R/O      5  Ext. Comprehensive SMART error log
0x06       GPL,SL  R/O      1  SMART self-test log
0x07       GPL,SL  R/O      1  Extended self-test log
0x09       GPL,SL  R/W      1  Selective self-test log
0x10       GPL,SL  R/O      1  NCQ Command Error log
0x11       GPL,SL  R/O      1  SATA Phy Event Counters log
0x21       GPL,SL  R/O      1  Write stream error log
0x22       GPL,SL  R/O      1  Read stream error log
0x80-0x9f  GPL,SL  R/W     16  Host vendor specific log
0xa1       GPL,SL  VS      20  Device vendor specific log
0xa2       GPL     VS    2248  Device vendor specific log
0xa8       GPL,SL  VS      65  Device vendor specific log
0xa9       GPL,SL  VS       1  Device vendor specific log
0xb0       GPL     VS    2864  Device vendor specific log
0xbe-0xbf  GPL     VS   65535  Device vendor specific log
0xe0       GPL,SL  R/W      1  SCT Command/Status
0xe1       GPL,SL  R/W      1  SCT Data Transfer

SMART Extended Comprehensive Error Log Version: 1 (5 sectors)
Device Error Count: 32 (device log contains only the most recent 20 errors)
	CR     = Command Register
	FEATR  = Features Register
	COUNT  = Count (was: Sector Count) Register
	LBA_48 = Upper bytes of LBA High/Mid/Low Registers ]  ATA-8
	LH     = LBA High (was: Cylinder High) Register    ]   LBA
	LM     = LBA Mid (was: Cylinder Low) Register      ] Register
	LL     = LBA Low (was: Sector Number) Register     ]
	DV     = Device (was: Device/Head) Register
	DC     = Device Control Register
	ER     = Error register
	ST     = Status register
Powered_Up_Time is measured from power on, and printed as
DDd+hh:mm:SS.sss where DD=days, hh=hours, mm=minutes,
SS=sec, and sss=millisec. It "wraps" after 49.710 days.

Error 32 [11] occurred at disk power-on lifetime: 8253 hours (343 days + 21 hours)
  When the command that caused the error occurred, the device was active or idle.

  After command completion occurred, registers were:
  ER -- ST COUNT  LBA_48  LH LM LL DV DC
  -- -- -- == -- == == == -- -- -- -- --
  40 -- 51 00 00 00 98 00 2d 2c 5b 00 00  Error: UNC at LBA = 0x98002d2c5b = 652837989467

  Commands leading to the command that caused the error were:
  CR FEATR COUNT  LBA_48  LH LM LL DV DC  Powered_Up_Time  Command/Feature_Name
  -- == -- == -- == == == -- -- -- -- --  ---------------  --------------------
  25 00 00 00 08 00 98 00 2d 2c 58 40 00     18:54:29.809  READ DMA EXT
  25 00 00 00 08 00 1e 00 f9 15 98 40 00     18:54:29.799  READ DMA EXT
  25 00 00 00 08 00 1e 00 f9 15 90 40 00     18:54:29.765  READ DMA EXT
  25 00 00 00 08 00 98 00 2d 2c 58 40 00     18:54:27.433  READ DMA EXT
  25 00 00 00 08 00 1e 00 ed 15 c0 40 00     18:54:27.378  READ DMA EXT

Error 31 [10] occurred at disk power-on lifetime: 8253 hours (343 days + 21 hours)
  When the command that caused the error occurred, the device was active or idle.

  After command completion occurred, registers were:
  ER -- ST COUNT  LBA_48  LH LM LL DV DC
  -- -- -- == -- == == == -- -- -- -- --
  40 -- 51 00 00 00 98 00 2d 2c 5b 00 00  Error: UNC at LBA = 0x98002d2c5b = 652837989467

  Commands leading to the command that caused the error were:
  CR FEATR COUNT  LBA_48  LH LM LL DV DC  Powered_Up_Time  Command/Feature_Name
  -- == -- == -- == == == -- -- -- -- --  ---------------  --------------------
  25 00 00 00 08 00 98 00 2d 2c 58 40 00     18:54:27.433  READ DMA EXT
  25 00 00 00 08 00 1e 00 ed 15 c0 40 00     18:54:27.378  READ DMA EXT
  25 00 00 00 08 00 1e 00 ed 15 b8 40 00     18:54:27.305  READ DMA EXT
  25 00 00 00 08 00 1e 00 ed 15 b0 40 00     18:54:27.304  READ DMA EXT
  25 00 00 00 08 00 1e 00 e5 15 58 40 00     18:54:27.265  READ DMA EXT

Error 30 [9] occurred at disk power-on lifetime: 8253 hours (343 days + 21 hours)
  When the command that caused the error occurred, the device was active or idle.

  After command completion occurred, registers were:
  ER -- ST COUNT  LBA_48  LH LM LL DV DC
  -- -- -- == -- == == == -- -- -- -- --
  40 -- 51 00 00 00 98 00 2d 2c 5b 00 00  Error: UNC at LBA = 0x98002d2c5b = 652837989467

  Commands leading to the command that caused the error were:
  CR FEATR COUNT  LBA_48  LH LM LL DV DC  Powered_Up_Time  Command/Feature_Name
  -- == -- == -- == == == -- -- -- -- --  ---------------  --------------------
  25 00 00 00 08 00 98 00 2d 2c 58 40 00     18:54:22.304  READ DMA EXT
  25 00 00 00 08 00 98 00 2d 2c 58 40 00     18:54:19.994  READ DMA EXT
  25 00 00 00 08 00 98 00 2c 2c 98 40 00     18:54:19.993  READ DMA EXT
  25 00 00 00 08 00 98 00 2c 2c 90 40 00     18:54:19.992  READ DMA EXT
  25 00 00 00 08 00 98 00 2c 2c 88 40 00     18:54:19.992  READ DMA EXT

Error 29 [8] occurred at disk power-on lifetime: 8253 hours (343 days + 21 hours)
  When the command that caused the error occurred, the device was active or idle.

  After command completion occurred, registers were:
  ER -- ST COUNT  LBA_48  LH LM LL DV DC
  -- -- -- == -- == == == -- -- -- -- --
  40 -- 51 00 00 00 98 00 2d 2c 5b 00 00  Error: UNC at LBA = 0x98002d2c5b = 652837989467

  Commands leading to the command that caused the error were:
  CR FEATR COUNT  LBA_48  LH LM LL DV DC  Powered_Up_Time  Command/Feature_Name
  -- == -- == -- == == == -- -- -- -- --  ---------------  --------------------
  25 00 00 00 08 00 98 00 2d 2c 58 40 00     18:54:19.994  READ DMA EXT
  25 00 00 00 08 00 98 00 2c 2c 98 40 00     18:54:19.993  READ DMA EXT
  25 00 00 00 08 00 98 00 2c 2c 90 40 00     18:54:19.992  READ DMA EXT
  25 00 00 00 08 00 98 00 2c 2c 88 40 00     18:54:19.992  READ DMA EXT
  25 00 00 00 08 00 98 00 2c 2c 80 40 00     18:54:19.992  READ DMA EXT

Error 28 [7] occurred at disk power-on lifetime: 8252 hours (343 days + 20 hours)
  When the command that caused the error occurred, the device was active or idle.

  After command completion occurred, registers were:
  ER -- ST COUNT  LBA_48  LH LM LL DV DC
  -- -- -- == -- == == == -- -- -- -- --
  40 -- 51 00 00 00 98 00 2d 2c 5b 00 00  Error: UNC at LBA = 0x98002d2c5b = 652837989467

  Commands leading to the command that caused the error were:
  CR FEATR COUNT  LBA_48  LH LM LL DV DC  Powered_Up_Time  Command/Feature_Name
  -- == -- == -- == == == -- -- -- -- --  ---------------  --------------------
  25 00 00 00 08 00 98 00 2d 2c 58 40 00     17:49:50.199  READ DMA EXT
  25 00 00 00 08 00 98 00 2d 2c 58 40 00     17:49:47.913  READ DMA EXT
  25 00 00 00 08 00 51 00 28 2a 48 40 00     17:49:47.910  READ DMA EXT
  25 00 00 00 08 00 51 00 28 2a 40 40 00     17:49:47.893  READ DMA EXT
  25 00 00 00 08 00 98 00 2d 2c a8 40 00     17:49:47.889  READ DMA EXT

Error 27 [6] occurred at disk power-on lifetime: 8252 hours (343 days + 20 hours)
  When the command that caused the error occurred, the device was active or idle.

  After command completion occurred, registers were:
  ER -- ST COUNT  LBA_48  LH LM LL DV DC
  -- -- -- == -- == == == -- -- -- -- --
  40 -- 51 00 00 00 98 00 2d 2c 5b 00 00  Error: UNC at LBA = 0x98002d2c5b = 652837989467

  Commands leading to the command that caused the error were:
  CR FEATR COUNT  LBA_48  LH LM LL DV DC  Powered_Up_Time  Command/Feature_Name
  -- == -- == -- == == == -- -- -- -- --  ---------------  --------------------
  25 00 00 00 08 00 98 00 2d 2c 58 40 00     17:49:47.913  READ DMA EXT
  25 00 00 00 08 00 51 00 28 2a 48 40 00     17:49:47.910  READ DMA EXT
  25 00 00 00 08 00 51 00 28 2a 40 40 00     17:49:47.893  READ DMA EXT
  25 00 00 00 08 00 98 00 2d 2c a8 40 00     17:49:47.889  READ DMA EXT
  25 00 00 00 08 00 98 00 2d 2c a0 40 00     17:49:47.863  READ DMA EXT

Error 26 [5] occurred at disk power-on lifetime: 8252 hours (343 days + 20 hours)
  When the command that caused the error occurred, the device was active or idle.

  After command completion occurred, registers were:
  ER -- ST COUNT  LBA_48  LH LM LL DV DC
  -- -- -- == -- == == == -- -- -- -- --
  40 -- 51 00 00 00 98 00 2d 2c 5b 00 00  Error: UNC at LBA = 0x98002d2c5b = 652837989467

  Commands leading to the command that caused the error were:
  CR FEATR COUNT  LBA_48  LH LM LL DV DC  Powered_Up_Time  Command/Feature_Name
  -- == -- == -- == == == -- -- -- -- --  ---------------  --------------------
  25 00 00 00 08 00 98 00 2d 2c 58 40 00     17:49:43.100  READ DMA EXT
  25 00 00 00 08 00 98 00 2d 2c 58 40 00     17:49:40.800  READ DMA EXT
  25 00 00 00 08 00 98 00 28 2c 48 40 00     17:49:40.779  READ DMA EXT
  25 00 00 00 08 00 98 00 28 2c 40 40 00     17:49:40.650  READ DMA EXT
  25 00 00 00 08 00 98 00 28 2c 38 40 00     17:49:40.648  READ DMA EXT

Error 25 [4] occurred at disk power-on lifetime: 8252 hours (343 days + 20 hours)
  When the command that caused the error occurred, the device was active or idle.

  After command completion occurred, registers were:
  ER -- ST COUNT  LBA_48  LH LM LL DV DC
  -- -- -- == -- == == == -- -- -- -- --
  40 -- 51 00 00 00 98 00 2d 2c 5b 00 00  Error: UNC at LBA = 0x98002d2c5b = 652837989467

  Commands leading to the command that caused the error were:
  CR FEATR COUNT  LBA_48  LH LM LL DV DC  Powered_Up_Time  Command/Feature_Name
  -- == -- == -- == == == -- -- -- -- --  ---------------  --------------------
  25 00 00 00 08 00 98 00 2d 2c 58 40 00     17:49:40.800  READ DMA EXT
  25 00 00 00 08 00 98 00 28 2c 48 40 00     17:49:40.779  READ DMA EXT
  25 00 00 00 08 00 98 00 28 2c 40 40 00     17:49:40.650  READ DMA EXT
  25 00 00 00 08 00 98 00 28 2c 38 40 00     17:49:40.648  READ DMA EXT
  25 00 00 00 08 00 98 00 28 2c 30 40 00     17:49:40.638  READ DMA EXT

SMART Extended Self-test Log Version: 1 (1 sectors)
Num  Test_Description    Status                  Remaining  LifeTime(hours)  LBA_of_first_error
# 1  Short offline       Completed without error       00%      6512         -

SMART Selective self-test log data structure revision number 1
 SPAN  MIN_LBA  MAX_LBA  CURRENT_TEST_STATUS
    1        0        0  Not_testing
    2        0        0  Not_testing
    3        0        0  Not_testing
    4        0        0  Not_testing
    5        0        0  Not_testing
Selective self-test flags (0x0):
  After scanning selected spans, do NOT read-scan remainder of disk.
If Selective self-test is pending on power-up, resume after 0 minute delay.

SCT Status Version:                  3
SCT Version (vendor specific):       522 (0x020a)
Device State:                        Active (0)
Current Temperature:                    30 Celsius
Power Cycle Min/Max Temperature:     30/31 Celsius
Lifetime    Min/Max Temperature:      0/55 Celsius
Under/Over Temperature Limit Count:   0/7

SCT Temperature History Version:     2
Temperature Sampling Period:         1 minute
Temperature Logging Interval:        1 minute
Min/Max recommended Temperature:      0/ 0 Celsius
Min/Max Temperature Limit:            0/ 0 Celsius
Temperature History Size (Index):    128 (89)

SCT Error Recovery Control:
           Read: Disabled
          Write: Disabled

Device Statistics (GP/SMART Log 0x04) not supported

Pending Defects log (GP Log 0x0c) not supported

SATA Phy Event Counters (GP Log 0x11)
ID      Size     Value  Description
0x000a  2            1  Device-to-host register FISes sent due to a COMRESET
0x0001  2            0  Command failed due to ICRC error
0x0003  2            0  R_ERR response for device-to-host data FIS
0x0004  2            0  R_ERR response for host-to-device data FIS
0x0006  2            0  R_ERR response for device-to-host non-data FIS
0x0007  2            0  R_ERR response for host-to-device non-data FIS

