=== START OF INFORMATION SECTION ===
Model Family:     Seagate Momentus 5400.6
Device Model:     ST9500325AS
Serial Number:    --
LU WWN Device Id: 5 000c50 ...
Firmware Version: 0003SDM1
User Capacity:    500 107 862 016 bytes [500 GB]
Sector Size:      512 bytes logical/physical
Rotation Rate:    5400 rpm
Device is:        In smartctl database [for details use: -P show]
ATA Version is:   ATA8-ACS T13/1699-D revision 4
SATA Version is:  SATA 2.6, 3.0 Gb/s
Local Time is:    Fri Mar 17 15:28:53 2017 +06
SMART support is: Available - device has SMART capability.
SMART support is: Enabled
AAM feature is:   Unavailable
APM level is:     128 (minimum power consumption without standby)
Rd look-ahead is: Enabled
Write cache is:   Enabled
ATA Security is:  Disabled, NOT FROZEN [SEC1]
Wt Cache Reorder: Unknown

=== START OF READ SMART DATA SECTION ===
SMART overall-health self-assessment test result: PASSED

General SMART Values:
Offline data collection status:  (0x00)	Offline data collection activity
					was never started.
					Auto Offline Data Collection: Disabled.
Self-test execution status:      (   0)	The previous self-test routine completed
					without error or no self-test has ever 
					been run.
Total time to complete Offline 
data collection: 		(    0) seconds.
Offline data collection
capabilities: 			 (0x73) SMART execute Offline immediate.
					Auto Offline data collection on/off support.
					Suspend Offline collection upon new
					command.
					No Offline surface scan supported.
					Self-test supported.
					Conveyance Self-test supported.
					Selective Self-test supported.
SMART capabilities:            (0x0003)	Saves SMART data before entering
					power-saving mode.
					Supports SMART auto save timer.
Error logging capability:        (0x01)	Error logging supported.
					General Purpose Logging supported.
Short self-test routine 
recommended polling time: 	 (   1) minutes.
Extended self-test routine
recommended polling time: 	 ( 132) minutes.
Conveyance self-test routine
recommended polling time: 	 (   2) minutes.
SCT capabilities: 	       (0x103b)	SCT Status supported.
					SCT Error Recovery Control supported.
					SCT Feature Control supported.
					SCT Data Table supported.

SMART Attributes Data Structure revision number: 10
Vendor Specific SMART Attributes with Thresholds:
ID# ATTRIBUTE_NAME          FLAGS    VALUE WORST THRESH FAIL RAW_VALUE
  1 Raw_Read_Error_Rate     POSR--   115   094   006    -    88033115
  3 Spin_Up_Time            PO----   099   098   000    -    0
  4 Start_Stop_Count        -O--CK   095   095   020    -    5540
  5 Reallocated_Sector_Ct   PO--CK   100   100   036    -    0
  7 Seek_Error_Rate         POSR--   084   060   030    -    241110198
  9 Power_On_Hours          -O--CK   093   093   000    -    6435
 10 Spin_Retry_Count        PO--C-   100   100   097    -    0
 12 Power_Cycle_Count       -O--CK   095   095   020    -    5394
184 End-to-End_Error        -O--CK   100   100   099    -    0
187 Reported_Uncorrect      -O--CK   011   011   000    -    89
188 Command_Timeout         -O--CK   100   099   000    -    2
189 High_Fly_Writes         -O-RCK   100   100   000    -    0
190 Airflow_Temperature_Cel -O---K   066   048   045    -    34 (Min/Max 23/34)
191 G-Sense_Error_Rate      -O--CK   100   100   000    -    441
192 Power-Off_Retract_Count -O--CK   100   100   000    -    410
193 Load_Cycle_Count        -O--CK   087   087   000    -    27040
194 Temperature_Celsius     -O---K   034   052   000    -    34 (0 12 0 0 0)
195 Hardware_ECC_Recovered  -O-RC-   052   045   000    -    88033115
197 Current_Pending_Sector  -O--C-   100   100   000    -    0
198 Offline_Uncorrectable   ----C-   100   100   000    -    0
199 UDMA_CRC_Error_Count    -OSRCK   200   200   000    -    0
254 Free_Fall_Sensor        -O--CK   100   100   000    -    0
                            ||||||_ K auto-keep
                            |||||__ C event count
                            ||||___ R error rate
                            |||____ S speed/performance
                            ||_____ O updated online
                            |______ P prefailure warning

General Purpose Log Directory Version 1
SMART           Log Directory Version 1 [multi-sector log support]
Address    Access  R/W   Size  Description
0x00       GPL,SL  R/O      1  Log Directory
0x01       GPL,SL  R/O      1  Summary SMART error log
0x02       GPL,SL  R/O      5  Comprehensive SMART error log
0x03       GPL,SL  R/O      5  Ext. Comprehensive SMART error log
0x06       GPL,SL  R/O      1  SMART self-test log
0x07       GPL,SL  R/O      1  Extended self-test log
0x09       GPL,SL  R/W      1  Selective self-test log
0x10       GPL,SL  R/O      1  SATA NCQ Queued Error log
0x11       GPL,SL  R/O      1  SATA Phy Event Counters log
0x21       GPL,SL  R/O      1  Write stream error log
0x22       GPL,SL  R/O      1  Read stream error log
0x80-0x9f  GPL,SL  R/W     16  Host vendor specific log
0xa1       GPL,SL  VS      20  Device vendor specific log
0xa2       GPL     VS    2248  Device vendor specific log
0xa8       GPL,SL  VS      65  Device vendor specific log
0xa9       GPL,SL  VS       1  Device vendor specific log
0xb0       GPL     VS    2864  Device vendor specific log
0xbe-0xbf  GPL     VS   65535  Device vendor specific log
0xe0       GPL,SL  R/W      1  SCT Command/Status
0xe1       GPL,SL  R/W      1  SCT Data Transfer

SMART Extended Comprehensive Error Log Version: 1 (5 sectors)
Device Error Count: 84 (device log contains only the most recent 20 errors)
	CR     = Command Register
	FEATR  = Features Register
	COUNT  = Count (was: Sector Count) Register
	LBA_48 = Upper bytes of LBA High/Mid/Low Registers ]  ATA-8
	LH     = LBA High (was: Cylinder High) Register    ]   LBA
	LM     = LBA Mid (was: Cylinder Low) Register      ] Register
	LL     = LBA Low (was: Sector Number) Register     ]
	DV     = Device (was: Device/Head) Register
	DC     = Device Control Register
	ER     = Error register
	ST     = Status register
Powered_Up_Time is measured from power on, and printed as
DDd+hh:mm:SS.sss where DD=days, hh=hours, mm=minutes,
SS=sec, and sss=millisec. It "wraps" after 49.710 days.

Error 84 [3] occurred at disk power-on lifetime: 3387 hours (141 days + 3 hours)
  When the command that caused the error occurred, the device was active or idle.

  After command completion occurred, registers were:
  ER -- ST COUNT  LBA_48  LH LM LL DV DC
  -- -- -- == -- == == == -- -- -- -- --
  40 -- 51 00 00 00 00 34 57 5a d1 00 00  Error: UNC at LBA = 0x34575ad1 = 878140113

  Commands leading to the command that caused the error were:
  CR FEATR COUNT  LBA_48  LH LM LL DV DC  Powered_Up_Time  Command/Feature_Name
  -- == -- == -- == == == -- -- -- -- --  ---------------  --------------------
  60 00 00 01 00 00 00 34 57 5a c0 40 00     01:03:47.673  READ FPDMA QUEUED
  61 00 00 00 08 00 00 34 00 d8 10 40 00     01:03:47.672  WRITE FPDMA QUEUED
  61 00 00 00 08 00 00 37 2e a7 60 40 00     01:03:47.672  WRITE FPDMA QUEUED
  61 00 00 00 08 00 00 37 6e dc 90 40 00     01:03:47.672  WRITE FPDMA QUEUED
  61 00 00 00 08 00 00 35 11 c3 d0 40 00     01:03:47.671  WRITE FPDMA QUEUED

Error 83 [2] occurred at disk power-on lifetime: 3387 hours (141 days + 3 hours)
  When the command that caused the error occurred, the device was active or idle.

  After command completion occurred, registers were:
  ER -- ST COUNT  LBA_48  LH LM LL DV DC
  -- -- -- == -- == == == -- -- -- -- --
  40 -- 51 00 00 00 00 34 57 5a d1 00 00  Error: WP at LBA = 0x34575ad1 = 878140113

  Commands leading to the command that caused the error were:
  CR FEATR COUNT  LBA_48  LH LM LL DV DC  Powered_Up_Time  Command/Feature_Name
  -- == -- == -- == == == -- -- -- -- --  ---------------  --------------------
  61 00 00 00 08 00 00 36 d0 cb 60 40 00     01:03:45.080  WRITE FPDMA QUEUED
  61 00 00 00 08 00 00 34 54 80 80 40 00     01:03:45.079  WRITE FPDMA QUEUED
  61 00 00 00 08 00 00 34 58 5a c0 40 00     01:03:45.079  WRITE FPDMA QUEUED
  61 00 00 00 08 00 00 36 d0 ca f0 40 00     01:03:45.078  WRITE FPDMA QUEUED
  61 00 00 00 08 00 00 34 a0 50 70 40 00     01:03:45.077  WRITE FPDMA QUEUED

Error 82 [1] occurred at disk power-on lifetime: 3387 hours (141 days + 3 hours)
  When the command that caused the error occurred, the device was active or idle.

  After command completion occurred, registers were:
  ER -- ST COUNT  LBA_48  LH LM LL DV DC
  -- -- -- == -- == == == -- -- -- -- --
  40 -- 51 00 00 00 00 34 57 5a d1 00 00  Error: UNC at LBA = 0x34575ad1 = 878140113

  Commands leading to the command that caused the error were:
  CR FEATR COUNT  LBA_48  LH LM LL DV DC  Powered_Up_Time  Command/Feature_Name
  -- == -- == -- == == == -- -- -- -- --  ---------------  --------------------
  60 00 00 01 00 00 00 34 57 5a c0 40 00     01:03:42.532  READ FPDMA QUEUED
  61 00 00 00 10 00 00 36 d0 ca c0 40 00     01:03:42.532  WRITE FPDMA QUEUED
  61 00 00 00 08 00 00 35 23 4f d0 40 00     01:03:42.532  WRITE FPDMA QUEUED
  61 00 00 00 08 00 00 34 a0 50 68 40 00     01:03:42.532  WRITE FPDMA QUEUED
  61 00 00 00 08 00 00 34 54 43 70 40 00     01:03:42.531  WRITE FPDMA QUEUED

Error 81 [0] occurred at disk power-on lifetime: 3387 hours (141 days + 3 hours)
  When the command that caused the error occurred, the device was active or idle.

  After command completion occurred, registers were:
  ER -- ST COUNT  LBA_48  LH LM LL DV DC
  -- -- -- == -- == == == -- -- -- -- --
  40 -- 51 00 00 00 00 34 57 5a d1 00 00  Error: WP at LBA = 0x34575ad1 = 878140113

  Commands leading to the command that caused the error were:
  CR FEATR COUNT  LBA_48  LH LM LL DV DC  Powered_Up_Time  Command/Feature_Name
  -- == -- == -- == == == -- -- -- -- --  ---------------  --------------------
  61 00 00 00 08 00 00 36 d0 ca 90 40 00     01:03:39.877  WRITE FPDMA QUEUED
  61 00 00 00 08 00 00 35 11 c3 d0 40 00     01:03:39.876  WRITE FPDMA QUEUED
  61 00 00 00 08 00 00 37 2e a7 60 40 00     01:03:39.875  WRITE FPDMA QUEUED
  61 00 00 00 07 00 00 34 a0 50 61 40 00     01:03:39.875  WRITE FPDMA QUEUED
  61 00 00 00 0e 00 00 36 3c 50 f0 40 00     01:03:39.874  WRITE FPDMA QUEUED

Error 80 [19] occurred at disk power-on lifetime: 3387 hours (141 days + 3 hours)
  When the command that caused the error occurred, the device was active or idle.

  After command completion occurred, registers were:
  ER -- ST COUNT  LBA_48  LH LM LL DV DC
  -- -- -- == -- == == == -- -- -- -- --
  40 -- 51 00 00 00 00 34 57 5a d1 00 00  Error: WP at LBA = 0x34575ad1 = 878140113

  Commands leading to the command that caused the error were:
  CR FEATR COUNT  LBA_48  LH LM LL DV DC  Powered_Up_Time  Command/Feature_Name
  -- == -- == -- == == == -- -- -- -- --  ---------------  --------------------
  61 00 00 00 08 00 00 36 d0 b9 f8 40 00     01:03:37.170  WRITE FPDMA QUEUED
  60 00 00 01 00 00 00 34 57 5a c0 40 00     01:03:37.169  READ FPDMA QUEUED
  61 00 00 00 06 00 00 34 04 c5 58 40 00     01:03:37.169  WRITE FPDMA QUEUED
  61 00 00 00 08 00 00 37 4b f1 60 40 00     01:03:37.168  WRITE FPDMA QUEUED
  61 00 00 00 08 00 00 34 0c c1 50 40 00     01:03:37.168  WRITE FPDMA QUEUED

Error 79 [18] occurred at disk power-on lifetime: 3387 hours (141 days + 3 hours)
  When the command that caused the error occurred, the device was active or idle.

  After command completion occurred, registers were:
  ER -- ST COUNT  LBA_48  LH LM LL DV DC
  -- -- -- == -- == == == -- -- -- -- --
  40 -- 51 00 00 00 00 34 57 5a d1 00 00  Error: WP at LBA = 0x34575ad1 = 878140113

  Commands leading to the command that caused the error were:
  CR FEATR COUNT  LBA_48  LH LM LL DV DC  Powered_Up_Time  Command/Feature_Name
  -- == -- == -- == == == -- -- -- -- --  ---------------  --------------------
  61 00 00 00 08 00 00 34 54 80 10 40 00     01:03:34.578  WRITE FPDMA QUEUED
  61 00 00 00 18 00 00 36 d0 a8 e8 40 00     01:03:34.578  WRITE FPDMA QUEUED
  61 00 00 00 08 00 00 34 54 43 88 40 00     01:03:34.577  WRITE FPDMA QUEUED
  60 00 00 01 00 00 00 34 57 5a c0 40 00     01:03:34.575  READ FPDMA QUEUED
  61 00 00 00 08 00 00 33 f8 52 c0 40 00     01:03:34.575  WRITE FPDMA QUEUED

Error 78 [17] occurred at disk power-on lifetime: 3387 hours (141 days + 3 hours)
  When the command that caused the error occurred, the device was active or idle.

  After command completion occurred, registers were:
  ER -- ST COUNT  LBA_48  LH LM LL DV DC
  -- -- -- == -- == == == -- -- -- -- --
  40 -- 51 00 00 00 00 34 57 5a d1 00 00  Error: WP at LBA = 0x34575ad1 = 878140113

  Commands leading to the command that caused the error were:
  CR FEATR COUNT  LBA_48  LH LM LL DV DC  Powered_Up_Time  Command/Feature_Name
  -- == -- == -- == == == -- -- -- -- --  ---------------  --------------------
  61 00 00 00 08 00 00 36 d0 a2 40 40 00     01:03:32.091  WRITE FPDMA QUEUED
  61 00 00 00 08 00 00 34 54 43 88 40 00     01:03:32.090  WRITE FPDMA QUEUED
  61 00 00 00 08 00 00 36 d0 a1 e0 40 00     01:03:32.089  WRITE FPDMA QUEUED
  60 00 00 01 00 00 00 34 57 5a c0 40 00     01:03:32.089  READ FPDMA QUEUED
  61 00 00 00 08 00 00 34 05 62 20 40 00     01:03:32.088  WRITE FPDMA QUEUED

Error 77 [16] occurred at disk power-on lifetime: 3387 hours (141 days + 3 hours)
  When the command that caused the error occurred, the device was active or idle.

  After command completion occurred, registers were:
  ER -- ST COUNT  LBA_48  LH LM LL DV DC
  -- -- -- == -- == == == -- -- -- -- --
  40 -- 51 00 00 00 00 34 57 5a d1 00 00  Error: WP at LBA = 0x34575ad1 = 878140113

  Commands leading to the command that caused the error were:
  CR FEATR COUNT  LBA_48  LH LM LL DV DC  Powered_Up_Time  Command/Feature_Name
  -- == -- == -- == == == -- -- -- -- --  ---------------  --------------------
  61 00 00 00 08 00 00 36 d0 a0 e0 40 00     01:03:29.530  WRITE FPDMA QUEUED
  61 00 00 00 10 00 00 34 58 44 b0 40 00     01:03:29.530  WRITE FPDMA QUEUED
  61 00 00 00 08 00 00 34 54 43 78 40 00     01:03:29.529  WRITE FPDMA QUEUED
  61 00 00 00 08 00 00 35 11 c3 d0 40 00     01:03:29.529  WRITE FPDMA QUEUED
  61 00 00 00 08 00 00 35 23 4f d0 40 00     01:03:29.528  WRITE FPDMA QUEUED

SMART Extended Self-test Log Version: 1 (1 sectors)
No self-tests have been logged.  [To run self-tests, use: smartctl -t]

SMART Selective self-test log data structure revision number 1
 SPAN  MIN_LBA  MAX_LBA  CURRENT_TEST_STATUS
    1        0        0  Not_testing
    2        0        0  Not_testing
    3        0        0  Not_testing
    4        0        0  Not_testing
    5        0        0  Not_testing
Selective self-test flags (0x0):
  After scanning selected spans, do NOT read-scan remainder of disk.
If Selective self-test is pending on power-up, resume after 0 minute delay.

SCT Status Version:                  3
SCT Version (vendor specific):       522 (0x020a)
SCT Support Level:                   1
Device State:                        Active (0)
Current Temperature:                    34 Celsius
Power Cycle Min/Max Temperature:     23/34 Celsius
Lifetime    Min/Max Temperature:     12/52 Celsius
Under/Over Temperature Limit Count:   0/27

SCT Temperature History Version:     2
Temperature Sampling Period:         1 minute
Temperature Logging Interval:        1 minute
Min/Max recommended Temperature:      0/ 0 Celsius
Min/Max Temperature Limit:            0/ 0 Celsius
Temperature History Size (Index):    128 (14)

SCT Error Recovery Control:
           Read: Disabled
          Write: Disabled

Device Statistics (GP/SMART Log 0x04) not supported

SATA Phy Event Counters (GP Log 0x11)
ID      Size     Value  Description
0x000a  2            3  Device-to-host register FISes sent due to a COMRESET
0x0001  2            0  Command failed due to ICRC error
0x0003  2            0  R_ERR response for device-to-host data FIS
0x0004  2            0  R_ERR response for host-to-device data FIS
0x0006  2            0  R_ERR response for device-to-host non-data FIS
0x0007  2            0  R_ERR response for host-to-device non-data FIS

