=== START OF INFORMATION SECTION ===
Device Model:     APPLE HDD ST750LM022
Serial Number:    --
LU WWN Device Id: 5 0000f0 ...
Firmware Version: 2AR20008
User Capacity:    750,156,374,016 bytes [750 GB]
Sector Sizes:     512 bytes logical, 4096 bytes physical
Rotation Rate:    5400 rpm
Form Factor:      2.5 inches
Device is:        Not in smartctl database [for details use: -P showall]
ATA Version is:   ATA8-ACS T13/1699-D revision 6
SATA Version is:  SATA 3.0, 3.0 Gb/s (current: 3.0 Gb/s)
Local Time is:    Sat Nov  3 21:31:12 2018 GMT
SMART support is: Available - device has SMART capability.
SMART support is: Enabled
AAM feature is:   Disabled
APM feature is:   Disabled
Rd look-ahead is: Enabled
Write cache is:   Enabled
DSN feature is:   Unavailable
ATA Security is:  Disabled, frozen [SEC2]
Wt Cache Reorder: Enabled

=== START OF READ SMART DATA SECTION ===
SMART overall-health self-assessment test result: PASSED

General SMART Values:
Offline data collection status:  (0x00)	Offline data collection activity
					was never started.
					Auto Offline Data Collection: Disabled.
Self-test execution status:      (   0)	The previous self-test routine completed
					without error or no self-test has ever 
					been run.
Total time to complete Offline 
data collection: 		(11160) seconds.
Offline data collection
capabilities: 			 (0x5b) SMART execute Offline immediate.
					Auto Offline data collection on/off support.
					Suspend Offline collection upon new
					command.
					Offline surface scan supported.
					Self-test supported.
					No Conveyance Self-test supported.
					Selective Self-test supported.
SMART capabilities:            (0x0003)	Saves SMART data before entering
					power-saving mode.
					Supports SMART auto save timer.
Error logging capability:        (0x01)	Error logging supported.
					General Purpose Logging supported.
Short self-test routine 
recommended polling time: 	 (   2) minutes.
Extended self-test routine
recommended polling time: 	 ( 186) minutes.
SCT capabilities: 	       (0x003f)	SCT Status supported.
					SCT Error Recovery Control supported.
					SCT Feature Control supported.
					SCT Data Table supported.

SMART Attributes Data Structure revision number: 16
Vendor Specific SMART Attributes with Thresholds:
ID# ATTRIBUTE_NAME          FLAGS    VALUE WORST THRESH FAIL RAW_VALUE
  1 Raw_Read_Error_Rate     POSR-K   100   100   051    -    3
  2 Throughput_Performance  -OS--K   056   056   000    -    10137
  3 Spin_Up_Time            PO---K   090   089   025    -    3104
  4 Start_Stop_Count        -O--CK   084   084   000    -    17052
  5 Reallocated_Sector_Ct   PO--CK   252   252   010    -    0
  7 Seek_Error_Rate         -OSR-K   252   252   051    -    0
  8 Seek_Time_Performance   --S--K   252   252   015    -    0
  9 Power_On_Hours          -O--CK   100   100   000    -    14137
 10 Spin_Retry_Count        -O--CK   252   252   051    -    0
 11 Calibration_Retry_Count -O--CK   100   100   000    -    466
 12 Power_Cycle_Count       -O--CK   083   083   000    -    17417
191 G-Sense_Error_Rate      -O---K   100   100   000    -    328
192 Power-Off_Retract_Count -O---K   252   252   000    -    0
194 Temperature_Celsius     -O----   064   053   000    -    33 (Min/Max 17/47)
195 Hardware_ECC_Recovered  -O-RCK   100   100   000    -    0
196 Reallocated_Event_Count -O--CK   252   252   000    -    0
197 Current_Pending_Sector  -O--CK   252   252   000    -    0
198 Offline_Uncorrectable   ----CK   252   252   000    -    0
199 UDMA_CRC_Error_Count    -OS-CK   099   099   000    -    613
200 Multi_Zone_Error_Rate   -O-R-K   100   100   000    -    6232
223 Load_Retry_Count        -O--CK   100   100   000    -    466
225 Load_Cycle_Count        -O--CK   007   007   000    -    940852
254 Free_Fall_Sensor        -O--CK   100   100   000    -    103079215381
                            ||||||_ K auto-keep
                            |||||__ C event count
                            ||||___ R error rate
                            |||____ S speed/performance
                            ||_____ O updated online
                            |______ P prefailure warning

General Purpose Log Directory Version 1
SMART           Log Directory Version 1 [multi-sector log support]
Address    Access  R/W   Size  Description
0x00       GPL,SL  R/O      1  Log Directory
0x01           SL  R/O      1  Summary SMART error log
0x02           SL  R/O      2  Comprehensive SMART error log
0x03       GPL     R/O      2  Ext. Comprehensive SMART error log
0x06           SL  R/O      1  SMART self-test log
0x07       GPL     R/O      2  Extended self-test log
0x08       GPL     R/O      2  Power Conditions log
0x09           SL  R/W      1  Selective self-test log
0x10       GPL     R/O      1  NCQ Command Error log
0x11       GPL     R/O      1  SATA Phy Event Counters log
0x80-0x9f  GPL,SL  R/W     16  Host vendor specific log
0xbe           SL  VS     128  Device vendor specific log
0xc0-0xdf  GPL,SL  VS      16  Device vendor specific log
0xe0       GPL,SL  R/W      1  SCT Command/Status
0xe1       GPL,SL  R/W      1  SCT Data Transfer

SMART Extended Comprehensive Error Log Version: 1 (2 sectors)
Device Error Count: 613 (device log contains only the most recent 8 errors)
	CR     = Command Register
	FEATR  = Features Register
	COUNT  = Count (was: Sector Count) Register
	LBA_48 = Upper bytes of LBA High/Mid/Low Registers ]  ATA-8
	LH     = LBA High (was: Cylinder High) Register    ]   LBA
	LM     = LBA Mid (was: Cylinder Low) Register      ] Register
	LL     = LBA Low (was: Sector Number) Register     ]
	DV     = Device (was: Device/Head) Register
	DC     = Device Control Register
	ER     = Error register
	ST     = Status register
Powered_Up_Time is measured from power on, and printed as
DDd+hh:mm:SS.sss where DD=days, hh=hours, mm=minutes,
SS=sec, and sss=millisec. It "wraps" after 49.710 days.

Error 613 [4] occurred at disk power-on lifetime: 10027 hours (417 days + 19 hours)
  When the command that caused the error occurred, the device was active or idle.

  After command completion occurred, registers were:
  ER -- ST COUNT  LBA_48  LH LM LL DV DC
  -- -- -- == -- == == == -- -- -- -- --
  84 -- 41 ff a1 00 00 1d 33 bb 2f 40 00  Error: ICRC, ABRT at LBA = 0x1d33bb2f = 489929519

  Commands leading to the command that caused the error were:
  CR FEATR COUNT  LBA_48  LH LM LL DV DC  Powered_Up_Time  Command/Feature_Name
  -- == -- == -- == == == -- -- -- -- --  ---------------  --------------------
  61 00 00 00 10 00 00 1d 33 bb 30 40 00     00:00:01.867  WRITE FPDMA QUEUED
  61 00 00 00 80 00 00 1d 33 ba c0 40 00     00:00:01.873  WRITE FPDMA QUEUED
  61 00 00 00 20 00 00 1d 33 b1 e0 40 00     00:00:01.872  WRITE FPDMA QUEUED
  61 00 00 00 20 00 00 1d 33 b2 00 40 00     00:00:01.872  WRITE FPDMA QUEUED
  61 00 00 00 20 00 00 1d 33 b2 20 40 00     00:00:01.872  WRITE FPDMA QUEUED

Error 612 [3] occurred at disk power-on lifetime: 10027 hours (417 days + 19 hours)
  When the command that caused the error occurred, the device was active or idle.

  After command completion occurred, registers were:
  ER -- ST COUNT  LBA_48  LH LM LL DV DC
  -- -- -- == -- == == == -- -- -- -- --
  84 -- 41 03 99 00 00 1d 31 59 b7 40 00  Error: ICRC, ABRT at LBA = 0x1d3159b7 = 489773495

  Commands leading to the command that caused the error were:
  CR FEATR COUNT  LBA_48  LH LM LL DV DC  Powered_Up_Time  Command/Feature_Name
  -- == -- == -- == == == -- -- -- -- --  ---------------  --------------------
  61 00 00 03 d8 00 00 1d 31 59 b8 40 00     00:00:01.131  WRITE FPDMA QUEUED
  61 00 00 00 08 00 00 07 a8 5a 20 40 00     00:00:01.155  WRITE FPDMA QUEUED
  61 00 00 04 18 00 00 1d 31 59 78 40 00     00:00:01.155  WRITE FPDMA QUEUED
  61 00 00 00 08 00 00 17 af 97 88 40 00     00:00:01.155  WRITE FPDMA QUEUED
  61 00 00 00 08 00 00 19 24 4b 50 40 00     00:00:01.155  WRITE FPDMA QUEUED

Error 611 [2] occurred at disk power-on lifetime: 10024 hours (417 days + 16 hours)
  When the command that caused the error occurred, the device was active or idle.

  After command completion occurred, registers were:
  ER -- ST COUNT  LBA_48  LH LM LL DV DC
  -- -- -- == -- == == == -- -- -- -- --
  84 -- 41 00 19 00 00 1b 5a a8 ff 40 00  Error: ICRC, ABRT at LBA = 0x1b5aa8ff = 458926335

  Commands leading to the command that caused the error were:
  CR FEATR COUNT  LBA_48  LH LM LL DV DC  Powered_Up_Time  Command/Feature_Name
  -- == -- == -- == == == -- -- -- -- --  ---------------  --------------------
  61 00 00 00 38 00 00 1b 5a a9 00 40 00     00:00:02.916  WRITE FPDMA QUEUED
  61 00 00 00 58 00 00 1b 5a a8 e0 40 00     00:00:02.916  WRITE FPDMA QUEUED
  61 00 00 00 08 00 00 1b 5a a8 e0 40 00     00:00:02.916  WRITE FPDMA QUEUED
  61 00 00 00 08 00 00 1b 5a a8 d8 40 00     00:00:02.916  WRITE FPDMA QUEUED
  61 00 00 00 08 00 00 1b 5a a8 d0 40 00     00:00:02.916  WRITE FPDMA QUEUED

Error 610 [1] occurred at disk power-on lifetime: 10020 hours (417 days + 12 hours)
  When the command that caused the error occurred, the device was active or idle.

  After command completion occurred, registers were:
  ER -- ST COUNT  LBA_48  LH LM LL DV DC
  -- -- -- == -- == == == -- -- -- -- --
  84 -- 41 ff e9 00 00 1a 37 27 57 40 00  Error: ICRC, ABRT at LBA = 0x1a372757 = 439822167

  Commands leading to the command that caused the error were:
  CR FEATR COUNT  LBA_48  LH LM LL DV DC  Powered_Up_Time  Command/Feature_Name
  -- == -- == -- == == == -- -- -- -- --  ---------------  --------------------
  61 00 00 00 08 00 00 1a 37 27 58 40 00     00:00:00.026  WRITE FPDMA QUEUED
  61 00 00 00 28 00 00 1a 37 27 38 40 00     00:00:00.027  WRITE FPDMA QUEUED
  60 00 00 00 40 00 00 1b b3 be 98 40 00     00:00:00.027  READ FPDMA QUEUED
  60 00 00 00 08 00 00 00 f6 68 68 40 00     00:00:00.027  READ FPDMA QUEUED
  61 00 00 00 08 00 00 1a 37 27 30 40 00     00:00:00.027  WRITE FPDMA QUEUED

Error 609 [0] occurred at disk power-on lifetime: 10016 hours (417 days + 8 hours)
  When the command that caused the error occurred, the device was active or idle.

  After command completion occurred, registers were:
  ER -- ST COUNT  LBA_48  LH LM LL DV DC
  -- -- -- == -- == == == -- -- -- -- --
  84 -- 41 ff a2 00 00 18 ef fa cf 40 00  Error: ICRC, ABRT at LBA = 0x18effacf = 418380495

  Commands leading to the command that caused the error were:
  CR FEATR COUNT  LBA_48  LH LM LL DV DC  Powered_Up_Time  Command/Feature_Name
  -- == -- == -- == == == -- -- -- -- --  ---------------  --------------------
  61 00 00 00 11 00 00 18 ef fa cf 40 00     00:00:01.035  WRITE FPDMA QUEUED
  61 00 00 00 80 00 00 18 ef fa 60 40 00     00:00:01.036  WRITE FPDMA QUEUED
  61 00 00 00 80 00 00 18 ef dc 08 40 00     00:00:01.036  WRITE FPDMA QUEUED
  61 00 00 00 80 00 00 18 ef e4 f8 40 00     00:00:01.036  WRITE FPDMA QUEUED
  61 00 00 00 08 00 00 18 ef fa 58 40 00     00:00:01.036  WRITE FPDMA QUEUED

Error 608 [7] occurred at disk power-on lifetime: 10014 hours (417 days + 6 hours)
  When the command that caused the error occurred, the device was active or idle.

  After command completion occurred, registers were:
  ER -- ST COUNT  LBA_48  LH LM LL DV DC
  -- -- -- == -- == == == -- -- -- -- --
  84 -- 41 ff e1 00 00 01 0c 53 9f 40 00  Error: ICRC, ABRT at LBA = 0x010c539f = 17585055

  Commands leading to the command that caused the error were:
  CR FEATR COUNT  LBA_48  LH LM LL DV DC  Powered_Up_Time  Command/Feature_Name
  -- == -- == -- == == == -- -- -- -- --  ---------------  --------------------
  61 00 00 00 00 00 00 01 0c 53 a0 40 00     00:00:00.193  WRITE FPDMA QUEUED
  61 00 00 00 20 00 00 00 1e 7e 38 40 00     00:00:00.222  WRITE FPDMA QUEUED
  61 00 00 00 08 00 00 00 1f 91 28 40 00     00:00:00.222  WRITE FPDMA QUEUED
  61 00 00 00 20 00 00 01 0c 53 a0 40 00     00:00:00.222  WRITE FPDMA QUEUED
  61 00 00 00 20 00 00 01 0c 53 80 40 00     00:00:00.222  WRITE FPDMA QUEUED

Error 607 [6] occurred at disk power-on lifetime: 10011 hours (417 days + 3 hours)
  When the command that caused the error occurred, the device was active or idle.

  After command completion occurred, registers were:
  ER -- ST COUNT  LBA_48  LH LM LL DV DC
  -- -- -- == -- == == == -- -- -- -- --
  84 -- 41 07 e1 00 00 18 5c b5 57 40 00  Error: ICRC, ABRT at LBA = 0x185cb557 = 408728919

  Commands leading to the command that caused the error were:
  CR FEATR COUNT  LBA_48  LH LM LL DV DC  Powered_Up_Time  Command/Feature_Name
  -- == -- == -- == == == -- -- -- -- --  ---------------  --------------------
  61 00 00 07 f0 00 00 18 5c b5 58 40 00     00:00:00.614  WRITE FPDMA QUEUED
  61 00 00 08 00 00 00 18 5c bd 48 40 00     00:00:00.619  WRITE FPDMA QUEUED
  61 00 00 08 00 00 00 18 5c b5 48 40 00     00:00:00.619  WRITE FPDMA QUEUED
  61 00 00 08 00 00 00 18 5c 99 48 40 00     00:00:00.619  WRITE FPDMA QUEUED
  61 00 00 08 00 00 00 18 5c 91 48 40 00     00:00:00.619  WRITE FPDMA QUEUED

Error 606 [5] occurred at disk power-on lifetime: 9992 hours (416 days + 8 hours)
  When the command that caused the error occurred, the device was active or idle.

  After command completion occurred, registers were:
  ER -- ST COUNT  LBA_48  LH LM LL DV DC
  -- -- -- == -- == == == -- -- -- -- --
  84 -- 51 00 91 00 00 06 d1 a2 87 40 00  Error: ICRC, ABRT 145 sectors at LBA = 0x06d1a287 = 114401927

  Commands leading to the command that caused the error were:
  CR FEATR COUNT  LBA_48  LH LM LL DV DC  Powered_Up_Time  Command/Feature_Name
  -- == -- == -- == == == -- -- -- -- --  ---------------  --------------------
  35 00 00 01 00 00 00 06 d1 a2 18 40 00     00:00:01.830  WRITE DMA EXT
  35 00 00 01 00 00 00 06 d1 a1 18 40 00     00:00:01.830  WRITE DMA EXT
  35 00 00 01 00 00 00 06 d1 a0 18 40 00     00:00:01.830  WRITE DMA EXT
  35 00 00 01 00 00 00 06 d1 9f 18 40 00     00:00:01.830  WRITE DMA EXT
  35 00 00 01 00 00 00 06 d1 9e 18 40 00     00:00:01.830  WRITE DMA EXT

SMART Extended Self-test Log Version: 1 (2 sectors)
Num  Test_Description    Status                  Remaining  LifeTime(hours)  LBA_of_first_error
# 1  Short offline       Completed without error       00%     14079         -
# 2  Short offline       Completed without error       00%     13944         -
# 3  Short offline       Completed without error       00%     13728         -
# 4  Short offline       Completed without error       00%     13680         -
# 5  Short offline       Completed without error       00%     13589         -
# 6  Short offline       Completed without error       00%     13522         -
# 7  Short offline       Completed without error       00%     13521         -
# 8  Short offline       Completed without error       00%     13520         -
# 9  Short offline       Aborted by host               50%     13518         -
#10  Short offline       Completed without error       00%     13509         -
#11  Short offline       Completed without error       00%     13509         -
#12  Short offline       Completed without error       00%     13508         -
#13  Short offline       Completed without error       00%     13507         -
#14  Short offline       Completed without error       00%     13462         -
#15  Short offline       Completed without error       00%     13448         -
#16  Short offline       Completed without error       00%     13447         -
#17  Short offline       Completed without error       00%     13278         -
#18  Short offline       Completed without error       00%     13276         -
#19  Short offline       Completed without error       00%     13270         -
#20  Short offline       Aborted by host               80%     13236         -
#21  Short offline       Completed without error       00%     13235         -

SMART Selective self-test log data structure revision number 0
Note: revision number not 1 implies that no selective self-test has ever been run
 SPAN  MIN_LBA  MAX_LBA  CURRENT_TEST_STATUS
    1        0        0  Completed [00% left] (0-65535)
    2        0        0  Not_testing
    3        0        0  Not_testing
    4        0        0  Not_testing
    5        0        0  Not_testing
Selective self-test flags (0x0):
  After scanning selected spans, do NOT read-scan remainder of disk.
If Selective self-test is pending on power-up, resume after 0 minute delay.

SCT Status Version:                  2
SCT Version (vendor specific):       256 (0x0100)
SCT Support Level:                   1
Device State:                        Active (0)
Current Temperature:                    33 Celsius
Power Cycle Min/Max Temperature:     24/38 Celsius
Lifetime    Min/Max Temperature:     14/47 Celsius
Under/Over Temperature Limit Count:   0/0

SCT Temperature History Version:     2
Temperature Sampling Period:         5 minutes
Temperature Logging Interval:        5 minutes
Min/Max recommended Temperature:     -5/80 Celsius
Min/Max Temperature Limit:           -10/85 Celsius
Temperature History Size (Index):    128 (94)

SCT Error Recovery Control:
           Read: Disabled
          Write: Disabled

Device Statistics (GP/SMART Log 0x04) not supported

Pending Defects log (GP Log 0x0c) not supported

SATA Phy Event Counters (GP Log 0x11)
ID      Size     Value  Description
0x0001  4            0  Command failed due to ICRC error
0x0002  4            0  R_ERR response for data FIS
0x0003  4            0  R_ERR response for device-to-host data FIS
0x0004  4            0  R_ERR response for host-to-device data FIS
0x0005  4            0  R_ERR response for non-data FIS
0x0006  4            0  R_ERR response for device-to-host non-data FIS
0x0007  4            0  R_ERR response for host-to-device non-data FIS
0x0008  4            0  Device-to-host non-data FIS retries
0x0009  4        34165  Transition from drive PhyRdy to drive PhyNRdy
0x000a  4            4  Device-to-host register FISes sent due to a COMRESET
0x000b  4            0  CRC errors within host-to-device FIS
0x000d  4            0  Non-CRC errors within host-to-device FIS
0x000f  4            0  R_ERR response for host-to-device data FIS, CRC
0x0010  4            0  R_ERR response for host-to-device data FIS, non-CRC
0x0012  4            0  R_ERR response for host-to-device non-data FIS, CRC
0x0013  4            0  R_ERR response for host-to-device non-data FIS, non-CRC
0x8e00  4            0  Vendor specific
0x8e01  4            0  Vendor specific
0x8e02  4            0  Vendor specific
0x8e03  4            0  Vendor specific
0x8e04  4            0  Vendor specific
0x8e05  4            0  Vendor specific
0x8e06  4            0  Vendor specific
0x8e07  4            0  Vendor specific
0x8e08  4            0  Vendor specific
0x8e09  4            0  Vendor specific
0x8e0a  4            0  Vendor specific
0x8e0b  4            0  Vendor specific
0x8e0c  4            0  Vendor specific
0x8e0d  4            0  Vendor specific
0x8e0e  4            0  Vendor specific
0x8e0f  4            0  Vendor specific
0x8e10  4            0  Vendor specific
0x8e11  4            0  Vendor specific

