smartctl 7.3 2022-02-28 r5338 [x86_64-linux-6.2.1-desktop-1omv2390] (OpenMandriva Lx 7.3-2)
Copyright (C) 2002-22, Bruce Allen, Christian Franke, www.smartmontools.org

=== START OF INFORMATION SECTION ===
Model Family:     SandForce Driven SSDs
Device Model:     SanDisk SDSSDA240G
Serial Number:    --
LU WWN Device Id: 5 001b44 ...
Firmware Version: Z32080RL
User Capacity:    240,057,409,536 bytes [240 GB]
Sector Size:      512 bytes logical/physical
Rotation Rate:    Solid State Device
Form Factor:      2.5 inches
TRIM Command:     Available, deterministic, zeroed
Device is:        In smartctl database
ATA Version is:   ACS-2 T13/2015-D revision 3
SATA Version is:  SATA 3.2, 6.0 Gb/s (current: 6.0 Gb/s)
Local Time is:    Wed Mar  1 21:44:46 2023 -03
SMART support is: Available - device has SMART capability.
SMART support is: Enabled
AAM feature is:   Unavailable
APM level is:     128 (minimum power consumption without standby)
Rd look-ahead is: Enabled
Write cache is:   Enabled
DSN feature is:   Unavailable
ATA Security is:  Disabled, frozen [SEC2]
Wt Cache Reorder: Unavailable

=== START OF READ SMART DATA SECTION ===
SMART overall-health self-assessment test result: PASSED

General SMART Values:
Offline data collection status:  (0x00)	Offline data collection activity
					was never started.
					Auto Offline Data Collection: Disabled.
Self-test execution status:      (   0)	The previous self-test routine completed
					without error or no self-test has ever 
					been run.
Total time to complete Offline 
data collection: 		(  120) seconds.
Offline data collection
capabilities: 			 (0x11) SMART execute Offline immediate.
					No Auto Offline data collection support.
					Suspend Offline collection upon new
					command.
					No Offline surface scan supported.
					Self-test supported.
					No Conveyance Self-test supported.
					No Selective Self-test supported.
SMART capabilities:            (0x0003)	Saves SMART data before entering
					power-saving mode.
					Supports SMART auto save timer.
Error logging capability:        (0x01)	Error logging supported.
					General Purpose Logging supported.
Short self-test routine 
recommended polling time: 	 (   2) minutes.
Extended self-test routine
recommended polling time: 	 (  10) minutes.

SMART Attributes Data Structure revision number: 1
Vendor Specific SMART Attributes with Thresholds:
ID# ATTRIBUTE_NAME          FLAGS    VALUE WORST THRESH FAIL RAW_VALUE
  5 Retired_Block_Count     -O--CK   100   100   000    -    0
  9 Power_On_Hours_and_Msec -O--CK   000   100   000    -    25864h+00m+00.000s
 12 Power_Cycle_Count       -O--CK   100   100   000    -    7881
165 Unknown_Attribute       -O--CK   100   100   000    -    29863389240432
166 Unknown_Attribute       -O--CK   100   100   000    -    50
167 Unknown_Attribute       -O--CK   100   100   000    -    0
168 Unknown_Attribute       -O--CK   100   100   000    -    98
169 Unknown_Attribute       -O--CK   100   100   000    -    0
170 Reserve_Block_Count     -O--CK   100   100   000    -    0
171 Program_Fail_Count      -O--CK   100   100   000    -    0
172 Erase_Fail_Count        -O--CK   100   100   000    -    0
173 Unknown_SandForce_Attr  -O--CK   100   100   000    -    85
174 Unexpect_Power_Loss_Ct  -O--CK   100   100   000    -    3856
187 Reported_Uncorrect      -O--CK   100   100   000    -    0
188 Command_Timeout         -O--CK   100   100   000    -    0
194 Temperature_Celsius     -O---K   058   027   000    -    42 (Min/Max 0/73)
199 SATA_CRC_Error_Count    -O--CK   100   100   000    -    0
230 Life_Curve_Status       -O--CK   100   100   000    -    10419670288762
232 Available_Reservd_Space PO--CK   100   100   004    -    100
233 SandForce_Internal      -O--CK   100   100   000    -    20123
234 SandForce_Internal      -O--CK   100   100   000    -    74517
241 Lifetime_Writes_GiB     ----CK   253   253   000    -    36772
242 Lifetime_Reads_GiB      ----CK   253   253   000    -    71352
244 Unknown_Attribute       -O--CK   000   100   000    -    0
                            ||||||_ K auto-keep
                            |||||__ C event count
                            ||||___ R error rate
                            |||____ S speed/performance
                            ||_____ O updated online
                            |______ P prefailure warning

General Purpose Log Directory Version 1
SMART           Log Directory Version 1 [multi-sector log support]
Address    Access  R/W   Size  Description
0x00       GPL,SL  R/O      1  Log Directory
0x01           SL  R/O      1  Summary SMART error log
0x02           SL  R/O      1  Comprehensive SMART error log
0x03       GPL     R/O      1  Ext. Comprehensive SMART error log
0x04       GPL,SL  R/O      8  Device Statistics log
0x06           SL  R/O      1  SMART self-test log
0x07       GPL     R/O      1  Extended self-test log
0x10       GPL     R/O      1  NCQ Command Error log
0x11       GPL     R/O      1  SATA Phy Event Counters log
0x30       GPL,SL  R/O      9  IDENTIFY DEVICE data log
0x80-0x9f  GPL,SL  R/W     16  Host vendor specific log
0xde       GPL     VS       8  Device vendor specific log

SMART Extended Comprehensive Error Log Version: 1 (1 sectors)
No Errors Logged

SMART Extended Self-test Log Version: 1 (1 sectors)
Num  Test_Description    Status                  Remaining  LifeTime(hours)  LBA_of_first_error
# 1  Short offline       Completed without error       00%     18819         -
# 2  Short offline       Completed without error       00%     15223         -
# 3  Short offline       Completed without error       00%     15211         -
# 4  Short offline       Completed without error       00%     15200         -
# 5  Short offline       Completed without error       00%     15190         -
# 6  Short offline       Completed without error       00%     15180         -
# 7  Short offline       Completed without error       00%     15169         -
# 8  Short offline       Completed without error       00%     15153         -
# 9  Short offline       Completed without error       00%     15141         -
#10  Extended offline    Completed without error       00%     15139         -
#11  Short offline       Completed without error       00%     14129         -

Selective Self-tests/Logging not supported

SCT Commands not supported

Device Statistics (GP Log 0x04)
Page  Offset Size        Value Flags Description
0x01  =====  =               =  ===  == General Statistics (rev 1) ==
0x01  0x008  4            7881  ---  Lifetime Power-On Resets
0x01  0x010  4           25864  ---  Power-on Hours
0x01  0x018  6      4102484969  ---  Logical Sectors Written
0x01  0x020  6       992078270  ---  Number of Write Commands
0x01  0x028  6      3607104979  ---  Logical Sectors Read
0x01  0x030  6      1550523712  ---  Number of Read Commands
0x07  =====  =               =  ===  == Solid State Device Statistics (rev 1) ==
0x07  0x008  1               2  ---  Percentage Used Endurance Indicator
                                |||_ C monitored condition met
                                ||__ D supports DSN
                                |___ N normalized value

Pending Defects log (GP Log 0x0c) not supported

SATA Phy Event Counters (GP Log 0x11)
ID      Size     Value  Description
0x0001  4            0  Command failed due to ICRC error
0x0002  4            0  R_ERR response for data FIS
0x0005  4            0  R_ERR response for non-data FIS
0x000a  4           10  Device-to-host register FISes sent due to a COMRESET



