smartctl 7.2 2020-12-30 r5155 [x86_64-linux-5.10.0-6parrot1-amd64] (local build)
Copyright (C) 2002-20, Bruce Allen, Christian Franke, www.smartmontools.org

=== START OF INFORMATION SECTION ===
Model Family:     Seagate Momentus 7200.4
Device Model:     ST9250410AS
Serial Number:    --
LU WWN Device Id: 5 000c50 ...
Firmware Version: D005SDM1
User Capacity:    250,059,350,016 bytes [250 GB]
Sector Size:      512 bytes logical/physical
Rotation Rate:    7200 rpm
Device is:        In smartctl database [for details use: -P show]
ATA Version is:   ATA8-ACS T13/1699-D revision 4
SATA Version is:  SATA 2.6, 3.0 Gb/s
Local Time is:    Mon Jul 19 20:25:25 2021 CEST
SMART support is: Available - device has SMART capability.
SMART support is: Enabled
AAM feature is:   Disabled
APM level is:     128 (minimum power consumption without standby)
Rd look-ahead is: Enabled
Write cache is:   Enabled
DSN feature is:   Unavailable
ATA Security is:  Disabled, frozen [SEC2]
Wt Cache Reorder: Unknown

=== START OF READ SMART DATA SECTION ===
SMART overall-health self-assessment test result: PASSED
See vendor-specific Attribute list for marginal Attributes.

General SMART Values:
Offline data collection status:  (0x00)	Offline data collection activity
					was never started.
					Auto Offline Data Collection: Disabled.
Self-test execution status:      (   0)	The previous self-test routine completed
					without error or no self-test has ever 
					been run.
Total time to complete Offline 
data collection: 		(    0) seconds.
Offline data collection
capabilities: 			 (0x73) SMART execute Offline immediate.
					Auto Offline data collection on/off support.
					Suspend Offline collection upon new
					command.
					No Offline surface scan supported.
					Self-test supported.
					Conveyance Self-test supported.
					Selective Self-test supported.
SMART capabilities:            (0x0003)	Saves SMART data before entering
					power-saving mode.
					Supports SMART auto save timer.
Error logging capability:        (0x01)	Error logging supported.
					General Purpose Logging supported.
Short self-test routine 
recommended polling time: 	 (   2) minutes.
Extended self-test routine
recommended polling time: 	 (  53) minutes.
Conveyance self-test routine
recommended polling time: 	 (   3) minutes.
SCT capabilities: 	       (0x103f)	SCT Status supported.
					SCT Error Recovery Control supported.
					SCT Feature Control supported.
					SCT Data Table supported.

SMART Attributes Data Structure revision number: 10
Vendor Specific SMART Attributes with Thresholds:
ID# ATTRIBUTE_NAME          FLAGS    VALUE WORST THRESH FAIL RAW_VALUE
  1 Raw_Read_Error_Rate     POSR--   119   081   006    -    233467149
  3 Spin_Up_Time            PO----   100   099   085    -    0
  4 Start_Stop_Count        -O--CK   098   098   020    -    2320
  5 Reallocated_Sector_Ct   PO--CK   100   100   036    -    0
  7 Seek_Error_Rate         POSR--   077   060   030    -    21791722831
  9 Power_On_Hours          -O--CK   082   082   000    -    15772
 10 Spin_Retry_Count        PO--C-   100   100   097    -    0
 12 Power_Cycle_Count       -O--CK   098   037   020    -    2257
184 End-to-End_Error        -O--CK   100   100   099    -    0
187 Reported_Uncorrect      -O--CK   001   001   000    -    32476
188 Command_Timeout         -O--CK   100   001   000    -    197100
189 High_Fly_Writes         -O-RCK   100   100   000    -    0
190 Airflow_Temperature_Cel -O---K   067   036   045    Past 33 (6 51 34 31 0)
191 G-Sense_Error_Rate      -O--CK   100   100   000    -    158
192 Power-Off_Retract_Count -O--CK   100   100   000    -    299
193 Load_Cycle_Count        -O--CK   001   001   000    -    204434
194 Temperature_Celsius     -O---K   033   064   000    -    33 (0 4 0 0 0)
195 Hardware_ECC_Recovered  -O-RC-   047   041   000    -    233467149
197 Current_Pending_Sector  -O--C-   100   100   000    -    0
198 Offline_Uncorrectable   ----C-   100   100   000    -    0
199 UDMA_CRC_Error_Count    -OSRCK   200   200   000    -    11
240 Head_Flying_Hours       ------   100   253   000    -    11107 (76 73 0)
241 Total_LBAs_Written      ------   100   253   000    -    2970339293
242 Total_LBAs_Read         ------   100   253   000    -    1596087525
254 Free_Fall_Sensor        -O--CK   001   001   000    -    8
                            ||||||_ K auto-keep
                            |||||__ C event count
                            ||||___ R error rate
                            |||____ S speed/performance
                            ||_____ O updated online
                            |______ P prefailure warning

General Purpose Log Directory Version 1
SMART           Log Directory Version 1 [multi-sector log support]
Address    Access  R/W   Size  Description
0x00       GPL,SL  R/O      1  Log Directory
0x01       GPL,SL  R/O      1  Summary SMART error log
0x02       GPL,SL  R/O      5  Comprehensive SMART error log
0x03       GPL,SL  R/O      5  Ext. Comprehensive SMART error log
0x06       GPL,SL  R/O      1  SMART self-test log
0x07       GPL,SL  R/O      1  Extended self-test log
0x09       GPL,SL  R/W      1  Selective self-test log
0x10       GPL,SL  R/O      1  NCQ Command Error log
0x11       GPL,SL  R/O      1  SATA Phy Event Counters log
0x21       GPL,SL  R/O      1  Write stream error log
0x22       GPL,SL  R/O      1  Read stream error log
0x80-0x9f  GPL,SL  R/W     16  Host vendor specific log
0xa1       GPL,SL  VS      20  Device vendor specific log
0xa2       GPL     VS    2248  Device vendor specific log
0xa8       GPL,SL  VS      65  Device vendor specific log
0xa9       GPL,SL  VS       1  Device vendor specific log
0xb0       GPL     VS    2864  Device vendor specific log
0xbe-0xbf  GPL     VS   65535  Device vendor specific log
0xe0       GPL,SL  R/W      1  SCT Command/Status
0xe1       GPL,SL  R/W      1  SCT Data Transfer

SMART Extended Comprehensive Error Log Version: 1 (5 sectors)
Device Error Count: 22443 (device log contains only the most recent 20 errors)
	CR     = Command Register
	FEATR  = Features Register
	COUNT  = Count (was: Sector Count) Register
	LBA_48 = Upper bytes of LBA High/Mid/Low Registers ]  ATA-8
	LH     = LBA High (was: Cylinder High) Register    ]   LBA
	LM     = LBA Mid (was: Cylinder Low) Register      ] Register
	LL     = LBA Low (was: Sector Number) Register     ]
	DV     = Device (was: Device/Head) Register
	DC     = Device Control Register
	ER     = Error register
	ST     = Status register
Powered_Up_Time is measured from power on, and printed as
DDd+hh:mm:SS.sss where DD=days, hh=hours, mm=minutes,
SS=sec, and sss=millisec. It "wraps" after 49.710 days.

Error 22443 [2] occurred at disk power-on lifetime: 2920 hours (121 days + 16 hours)
  When the command that caused the error occurred, the device was active or idle.

  After command completion occurred, registers were:
  ER -- ST COUNT  LBA_48  LH LM LL DV DC
  -- -- -- == -- == == == -- -- -- -- --
  40 -- 51 00 00 00 00 00 57 c4 ec 00 00  Error: UNC at LBA = 0x0057c4ec = 5752044

  Commands leading to the command that caused the error were:
  CR FEATR COUNT  LBA_48  LH LM LL DV DC  Powered_Up_Time  Command/Feature_Name
  -- == -- == -- == == == -- -- -- -- --  ---------------  --------------------
  60 00 00 00 01 00 00 00 00 00 00 40 00     06:36:25.386  READ FPDMA QUEUED
  60 00 00 00 40 00 00 00 57 c4 e0 40 00     06:36:25.280  READ FPDMA QUEUED
  61 00 00 00 08 00 00 00 61 28 b0 40 00     06:36:25.280  WRITE FPDMA QUEUED
  61 00 00 00 08 00 00 00 5d 22 d0 40 00     06:36:25.279  WRITE FPDMA QUEUED
  60 00 00 00 08 00 00 05 2c 47 30 40 00     06:36:25.279  READ FPDMA QUEUED

Error 22442 [1] occurred at disk power-on lifetime: 2920 hours (121 days + 16 hours)
  When the command that caused the error occurred, the device was active or idle.

  After command completion occurred, registers were:
  ER -- ST COUNT  LBA_48  LH LM LL DV DC
  -- -- -- == -- == == == -- -- -- -- --
  40 -- 51 00 00 00 00 00 57 c4 ec 00 00  Error: UNC at LBA = 0x0057c4ec = 5752044

  Commands leading to the command that caused the error were:
  CR FEATR COUNT  LBA_48  LH LM LL DV DC  Powered_Up_Time  Command/Feature_Name
  -- == -- == -- == == == -- -- -- -- --  ---------------  --------------------
  60 00 00 00 40 00 00 00 57 c4 e0 40 00     06:36:19.915  READ FPDMA QUEUED
  61 00 00 00 08 00 00 01 9e 95 18 40 00     06:36:19.915  WRITE FPDMA QUEUED
  61 00 00 00 08 00 00 00 61 28 b0 40 00     06:36:19.914  WRITE FPDMA QUEUED
  61 00 00 00 08 00 00 00 5d 22 d0 40 00     06:36:19.914  WRITE FPDMA QUEUED
  60 00 00 00 08 00 00 05 2c 47 30 40 00     06:36:19.914  READ FPDMA QUEUED

Error 22441 [0] occurred at disk power-on lifetime: 2920 hours (121 days + 16 hours)
  When the command that caused the error occurred, the device was active or idle.

  After command completion occurred, registers were:
  ER -- ST COUNT  LBA_48  LH LM LL DV DC
  -- -- -- == -- == == == -- -- -- -- --
  40 -- 51 00 00 00 00 00 57 c4 ec 00 00  Error: UNC at LBA = 0x0057c4ec = 5752044

  Commands leading to the command that caused the error were:
  CR FEATR COUNT  LBA_48  LH LM LL DV DC  Powered_Up_Time  Command/Feature_Name
  -- == -- == -- == == == -- -- -- -- --  ---------------  --------------------
  60 00 00 00 48 00 00 00 01 56 a0 40 00     06:36:17.299  READ FPDMA QUEUED
  61 00 00 00 08 00 00 02 db 69 00 40 00     06:36:17.285  WRITE FPDMA QUEUED
  61 00 00 00 08 00 00 02 db 68 88 40 00     06:36:17.284  WRITE FPDMA QUEUED
  61 00 00 00 08 00 00 01 4c 02 00 40 00     06:36:17.283  WRITE FPDMA QUEUED
  61 00 00 00 08 00 00 01 4e b3 f8 40 00     06:36:17.283  WRITE FPDMA QUEUED

Error 22440 [19] occurred at disk power-on lifetime: 2920 hours (121 days + 16 hours)
  When the command that caused the error occurred, the device was active or idle.

  After command completion occurred, registers were:
  ER -- ST COUNT  LBA_48  LH LM LL DV DC
  -- -- -- == -- == == == -- -- -- -- --
  40 -- 51 00 00 00 00 00 57 c4 ec 00 00  Error: WP at LBA = 0x0057c4ec = 5752044

  Commands leading to the command that caused the error were:
  CR FEATR COUNT  LBA_48  LH LM LL DV DC  Powered_Up_Time  Command/Feature_Name
  -- == -- == -- == == == -- -- -- -- --  ---------------  --------------------
  61 00 00 00 08 00 00 00 5d 22 e0 40 00     06:36:11.830  WRITE FPDMA QUEUED
  60 00 00 00 40 00 00 00 57 c4 e0 40 00     06:36:11.829  READ FPDMA QUEUED
  60 00 00 00 08 00 00 00 14 fe 52 40 00     06:36:11.829  READ FPDMA QUEUED
  60 00 00 00 08 00 00 00 01 56 98 40 00     06:36:11.829  READ FPDMA QUEUED
  61 00 00 00 08 00 00 00 61 28 b0 40 00     06:36:11.828  WRITE FPDMA QUEUED

Error 22439 [18] occurred at disk power-on lifetime: 2920 hours (121 days + 16 hours)
  When the command that caused the error occurred, the device was active or idle.

  After command completion occurred, registers were:
  ER -- ST COUNT  LBA_48  LH LM LL DV DC
  -- -- -- == -- == == == -- -- -- -- --
  40 -- 51 00 00 00 00 00 57 c4 ec 00 00  Error: UNC at LBA = 0x0057c4ec = 5752044

  Commands leading to the command that caused the error were:
  CR FEATR COUNT  LBA_48  LH LM LL DV DC  Powered_Up_Time  Command/Feature_Name
  -- == -- == -- == == == -- -- -- -- --  ---------------  --------------------
  60 00 00 00 40 00 00 00 57 c4 e0 40 00     06:36:09.156  READ FPDMA QUEUED
  61 00 00 00 28 00 00 00 5d fa 00 40 00     06:36:09.155  WRITE FPDMA QUEUED
  61 00 00 01 00 00 00 0a f7 ce 88 40 00     06:36:09.155  WRITE FPDMA QUEUED
  61 00 00 00 08 00 00 00 44 9e b8 40 00     06:36:09.155  WRITE FPDMA QUEUED
  61 00 00 00 08 00 00 01 9e 95 18 40 00     06:36:09.155  WRITE FPDMA QUEUED

Error 22438 [17] occurred at disk power-on lifetime: 2920 hours (121 days + 16 hours)
  When the command that caused the error occurred, the device was active or idle.

  After command completion occurred, registers were:
  ER -- ST COUNT  LBA_48  LH LM LL DV DC
  -- -- -- == -- == == == -- -- -- -- --
  40 -- 51 00 00 00 00 00 57 c4 ec 00 00  Error: UNC at LBA = 0x0057c4ec = 5752044

  Commands leading to the command that caused the error were:
  CR FEATR COUNT  LBA_48  LH LM LL DV DC  Powered_Up_Time  Command/Feature_Name
  -- == -- == -- == == == -- -- -- -- --  ---------------  --------------------
  60 00 00 00 40 00 00 00 57 c4 e0 40 00     06:36:06.409  READ FPDMA QUEUED
  60 00 00 00 08 00 00 00 01 56 98 40 00     06:36:06.409  READ FPDMA QUEUED
  61 00 00 00 08 00 00 00 61 28 b0 40 00     06:36:06.408  WRITE FPDMA QUEUED
  61 00 00 00 08 00 00 01 9e 95 18 40 00     06:36:06.408  WRITE FPDMA QUEUED
  61 00 00 00 08 00 00 00 44 9e b8 40 00     06:36:06.408  WRITE FPDMA QUEUED

Error 22437 [16] occurred at disk power-on lifetime: 2920 hours (121 days + 16 hours)
  When the command that caused the error occurred, the device was active or idle.

  After command completion occurred, registers were:
  ER -- ST COUNT  LBA_48  LH LM LL DV DC
  -- -- -- == -- == == == -- -- -- -- --
  40 -- 51 00 00 00 00 00 57 c4 ec 00 00  Error: UNC at LBA = 0x0057c4ec = 5752044

  Commands leading to the command that caused the error were:
  CR FEATR COUNT  LBA_48  LH LM LL DV DC  Powered_Up_Time  Command/Feature_Name
  -- == -- == -- == == == -- -- -- -- --  ---------------  --------------------
  60 00 00 00 40 00 00 00 57 c4 e0 40 00     06:36:03.802  READ FPDMA QUEUED
  60 00 00 00 40 00 00 05 35 30 60 40 00     06:36:03.799  READ FPDMA QUEUED
  60 00 00 00 40 00 00 04 fd 6b 80 40 00     06:36:03.797  READ FPDMA QUEUED
  60 00 00 00 40 00 00 05 35 30 20 40 00     06:36:03.792  READ FPDMA QUEUED
  60 00 00 00 40 00 00 05 35 2f e0 40 00     06:36:03.789  READ FPDMA QUEUED

Error 22436 [15] occurred at disk power-on lifetime: 2919 hours (121 days + 15 hours)
  When the command that caused the error occurred, the device was active or idle.

  After command completion occurred, registers were:
  ER -- ST COUNT  LBA_48  LH LM LL DV DC
  -- -- -- == -- == == == -- -- -- -- --
  40 -- 51 00 00 00 00 00 57 c4 ec 00 00  Error: WP at LBA = 0x0057c4ec = 5752044

  Commands leading to the command that caused the error were:
  CR FEATR COUNT  LBA_48  LH LM LL DV DC  Powered_Up_Time  Command/Feature_Name
  -- == -- == -- == == == -- -- -- -- --  ---------------  --------------------
  61 00 00 00 08 00 00 00 5d 22 e0 40 00     05:59:14.364  WRITE FPDMA QUEUED
  61 00 00 00 08 00 00 00 61 43 c0 40 00     05:59:14.362  WRITE FPDMA QUEUED
  61 00 00 00 01 00 00 01 31 2f a0 40 00     05:59:14.360  WRITE FPDMA QUEUED
  61 00 00 00 08 00 00 00 01 57 f0 40 00     05:59:14.357  WRITE FPDMA QUEUED
  61 00 00 00 08 00 00 04 75 0e 40 40 00     05:59:14.357  WRITE FPDMA QUEUED

SMART Extended Self-test Log Version: 1 (1 sectors)
Num  Test_Description    Status                  Remaining  LifeTime(hours)  LBA_of_first_error
# 1  Conveyance offline  Completed without error       00%      7825         -
# 2  Short offline       Completed without error       00%      7808         -
# 3  Short offline       Completed without error       00%      7808         -
# 4  Short offline       Completed without error       00%         1         -

SMART Selective self-test log data structure revision number 1
 SPAN  MIN_LBA  MAX_LBA  CURRENT_TEST_STATUS
    1        0        0  Not_testing
    2        0        0  Not_testing
    3        0        0  Not_testing
    4        0        0  Not_testing
    5        0        0  Not_testing
Selective self-test flags (0x0):
  After scanning selected spans, do NOT read-scan remainder of disk.
If Selective self-test is pending on power-up, resume after 0 minute delay.

SCT Status Version:                  3
SCT Version (vendor specific):       522 (0x020a)
Device State:                        Active (0)
Current Temperature:                    33 Celsius
Power Cycle Min/Max Temperature:     31/34 Celsius
Lifetime    Min/Max Temperature:      4/61 Celsius
Specified Max Operating Temperature:    33 Celsius
Under/Over Temperature Limit Count:   0/0

SCT Temperature History Version:     2
Temperature Sampling Period:         1 minute
Temperature Logging Interval:        1 minute
Min/Max recommended Temperature:     14/55 Celsius
Min/Max Temperature Limit:           10/60 Celsius
Temperature History Size (Index):    128 (16)

SCT Error Recovery Control:
           Read: Disabled
          Write: Disabled

Device Statistics (GP/SMART Log 0x04) not supported

Pending Defects log (GP Log 0x0c) not supported

SATA Phy Event Counters (GP Log 0x11)
ID      Size     Value  Description
0x000a  2           34  Device-to-host register FISes sent due to a COMRESET
0x0001  2            0  Command failed due to ICRC error
0x0003  2            0  R_ERR response for device-to-host data FIS
0x0004  2            0  R_ERR response for host-to-device data FIS
0x0006  2            0  R_ERR response for device-to-host non-data FIS
0x0007  2            0  R_ERR response for host-to-device non-data FIS



