smartctl 7.2 2020-12-30 r5155 [x86_64-linux-5.10.14-desktop-1omv4002] (OpenMandriva Lx 7.2-2)
Copyright (C) 2002-20, Bruce Allen, Christian Franke, www.smartmontools.org

=== START OF INFORMATION SECTION ===
Model Number:                       KBG30ZMV512G TOSHIBA
Serial Number:                      --
Firmware Version:                   ADXA0103
PCI Vendor/Subsystem ID:            0x1179
IEEE OUI Identifier:                0x00080d
Controller ID:                      0
NVMe Version:                       1.2.1
Number of Namespaces:               1
Namespace 1 Size/Capacity:          512,110,190,592 [512 GB]
Namespace 1 Formatted LBA Size:     512
Namespace 1 IEEE EUI-64:            00080d ...
Local Time is:                      Sun Mar 21 11:31:48 2021 UTC
Firmware Updates (0x12):            1 Slot, no Reset required
Optional Admin Commands (0x0017):   Security Format Frmw_DL Self_Test
Optional NVM Commands (0x0017):     Comp Wr_Unc DS_Mngmt Sav/Sel_Feat
Log Page Attributes (0x02):         Cmd_Eff_Lg
Maximum Data Transfer Size:         512 Pages
Warning  Comp. Temp. Threshold:     82 Celsius
Critical Comp. Temp. Threshold:     85 Celsius

Supported Power States
St Op     Max   Active     Idle   RL RT WL WT  Ent_Lat  Ex_Lat
 0 +     3.30W       -        -    0  0  0  0        0       0
 1 +     2.80W       -        -    1  1  1  1        0       0
 2 +     2.30W       -        -    2  2  2  2        0       0
 3 -   0.0500W       -        -    4  4  4  4     8000   32000
 4 -   0.0050W       -        -    4  4  4  4     8000   40000

Supported LBA Sizes (NSID 0x1)
Id Fmt  Data  Metadt  Rel_Perf
 0 -    4096       0         0
 1 +     512       0         3

=== START OF SMART DATA SECTION ===
SMART overall-health self-assessment test result: PASSED

SMART/Health Information (NVMe Log 0x02)
Critical Warning:                   0x00
Temperature:                        43 Celsius
Available Spare:                    100%
Available Spare Threshold:          10%
Percentage Used:                    4%
Data Units Read:                    16,404,337 [8.39 TB]
Data Units Written:                 14,562,396 [7.45 TB]
Host Read Commands:                 124,984,495
Host Write Commands:                87,572,193
Controller Busy Time:               906
Power Cycles:                       1,158
Power On Hours:                     619
Unsafe Shutdowns:                   549
Media and Data Integrity Errors:    0
Error Information Log Entries:      2,084
Warning  Comp. Temperature Time:    0
Critical Comp. Temperature Time:    0
Temperature Sensor 1:               43 Celsius
Thermal Temp. 1 Transition Count:   72
Thermal Temp. 1 Total Time:         607

Error Information (NVMe Log 0x01, 16 of 64 entries)
No Errors Logged



