=== START OF INFORMATION SECTION ===
Model Family:     Seagate Barracuda 7200.12
Device Model:     ST3500413AS
Serial Number:    --
LU WWN Device Id: 5 000c50 ...
Firmware Version: JC45
User Capacity:    500 107 862 016 bytes [500 GB]
Sector Size:      512 bytes logical/physical
Rotation Rate:    7200 rpm
Device is:        In smartctl database [for details use: -P show]
ATA Version is:   ATA8-ACS T13/1699-D revision 4
SATA Version is:  SATA 2.6, 6.0 Gb/s (current: 3.0 Gb/s)
Local Time is:    Sun Nov 17 08:34:01 2019 MSK
SMART support is: Available - device has SMART capability.
SMART support is: Enabled
AAM level is:     208 (intermediate), recommended: 208
APM feature is:   Unavailable
Rd look-ahead is: Enabled
Write cache is:   Enabled
ATA Security is:  Disabled, frozen [SEC2]
Wt Cache Reorder: Unknown

=== START OF READ SMART DATA SECTION ===
SMART overall-health self-assessment test result: PASSED

General SMART Values:
Offline data collection status:  (0x82)	Offline data collection activity
					was completed without error.
					Auto Offline Data Collection: Enabled.
Self-test execution status:      (   0)	The previous self-test routine completed
					without error or no self-test has ever 
					been run.
Total time to complete Offline 
data collection: 		(  592) seconds.
Offline data collection
capabilities: 			 (0x7b) SMART execute Offline immediate.
					Auto Offline data collection on/off support.
					Suspend Offline collection upon new
					command.
					Offline surface scan supported.
					Self-test supported.
					Conveyance Self-test supported.
					Selective Self-test supported.
SMART capabilities:            (0x0003)	Saves SMART data before entering
					power-saving mode.
					Supports SMART auto save timer.
Error logging capability:        (0x01)	Error logging supported.
					General Purpose Logging supported.
Short self-test routine 
recommended polling time: 	 (   1) minutes.
Extended self-test routine
recommended polling time: 	 (  81) minutes.
Conveyance self-test routine
recommended polling time: 	 (   2) minutes.
SCT capabilities: 	       (0x103f)	SCT Status supported.
					SCT Error Recovery Control supported.
					SCT Feature Control supported.
					SCT Data Table supported.

SMART Attributes Data Structure revision number: 10
Vendor Specific SMART Attributes with Thresholds:
ID# ATTRIBUTE_NAME          FLAGS    VALUE WORST THRESH FAIL RAW_VALUE
  1 Raw_Read_Error_Rate     POSR--   115   098   006    -    89057745
  3 Spin_Up_Time            PO----   100   100   000    -    0
  4 Start_Stop_Count        -O--CK   092   092   020    -    9016
  5 Reallocated_Sector_Ct   PO--CK   100   100   036    -    15
  7 Seek_Error_Rate         POSR--   086   060   030    -    456356121
  9 Power_On_Hours          -O--CK   074   074   000    -    23029
 10 Spin_Retry_Count        PO--C-   100   100   097    -    0
 12 Power_Cycle_Count       -O--CK   092   092   020    -    8936
183 Runtime_Bad_Block       -O--CK   100   100   000    -    0
184 End-to-End_Error        -O--CK   100   100   099    -    0
187 Reported_Uncorrect      -O--CK   001   001   000    -    103
188 Command_Timeout         -O--CK   100   096   000    -    42950526279
189 High_Fly_Writes         -O-RCK   100   100   000    -    0
190 Airflow_Temperature_Cel -O---K   068   046   045    -    32 (Min/Max 22/32)
194 Temperature_Celsius     -O---K   032   054   000    -    32 (0 16 0 0 0)
195 Hardware_ECC_Recovered  -O-RC-   043   023   000    -    89057745
197 Current_Pending_Sector  -O--C-   100   100   000    -    0
198 Offline_Uncorrectable   ----C-   100   100   000    -    0
199 UDMA_CRC_Error_Count    -OSRCK   200   200   000    -    3
240 Head_Flying_Hours       ------   100   253   000    -    45395 (145 137 0)
241 Total_LBAs_Written      ------   100   253   000    -    2982632851
242 Total_LBAs_Read         ------   100   253   000    -    2191733082
                            ||||||_ K auto-keep
                            |||||__ C event count
                            ||||___ R error rate
                            |||____ S speed/performance
                            ||_____ O updated online
                            |______ P prefailure warning

General Purpose Log Directory Version 1
SMART           Log Directory Version 1 [multi-sector log support]
Address    Access  R/W   Size  Description
0x00       GPL,SL  R/O      1  Log Directory
0x01       GPL,SL  R/O      1  Summary SMART error log
0x02       GPL,SL  R/O      5  Comprehensive SMART error log
0x03       GPL     R/O      5  Ext. Comprehensive SMART error log
0x06       GPL,SL  R/O      1  SMART self-test log
0x07       GPL     R/O      1  Extended self-test log
0x09       GPL,SL  R/W      1  Selective self-test log
0x10       GPL     R/O      1  SATA NCQ Queued Error log
0x11       GPL     R/O      1  SATA Phy Event Counters log
0x21       GPL     R/O      1  Write stream error log
0x22       GPL     R/O      1  Read stream error log
0x80-0x9f  GPL,SL  R/W     16  Host vendor specific log
0xa1       GPL,SL  VS      20  Device vendor specific log
0xa2       GPL     VS    2248  Device vendor specific log
0xa8       GPL,SL  VS     129  Device vendor specific log
0xa9       GPL,SL  VS       1  Device vendor specific log
0xb0       GPL     VS    2928  Device vendor specific log
0xbd       GPL     VS     252  Device vendor specific log
0xbe-0xbf  GPL     VS   65535  Device vendor specific log
0xc0       GPL,SL  VS       1  Device vendor specific log
0xe0       GPL,SL  R/W      1  SCT Command/Status
0xe1       GPL,SL  R/W      1  SCT Data Transfer

SMART Extended Comprehensive Error Log Version: 1 (5 sectors)
Device Error Count: 98 (device log contains only the most recent 20 errors)
	CR     = Command Register
	FEATR  = Features Register
	COUNT  = Count (was: Sector Count) Register
	LBA_48 = Upper bytes of LBA High/Mid/Low Registers ]  ATA-8
	LH     = LBA High (was: Cylinder High) Register    ]   LBA
	LM     = LBA Mid (was: Cylinder Low) Register      ] Register
	LL     = LBA Low (was: Sector Number) Register     ]
	DV     = Device (was: Device/Head) Register
	DC     = Device Control Register
	ER     = Error register
	ST     = Status register
Powered_Up_Time is measured from power on, and printed as
DDd+hh:mm:SS.sss where DD=days, hh=hours, mm=minutes,
SS=sec, and sss=millisec. It "wraps" after 49.710 days.

Error 98 [17] occurred at disk power-on lifetime: 10308 hours (429 days + 12 hours)
  When the command that caused the error occurred, the device was active or idle.

  After command completion occurred, registers were:
  ER -- ST COUNT  LBA_48  LH LM LL DV DC
  -- -- -- == -- == == == -- -- -- -- --
  40 -- 51 00 00 00 00 06 24 ab c0 00 00  Error: UNC at LBA = 0x0624abc0 = 103066560

  Commands leading to the command that caused the error were:
  CR FEATR COUNT  LBA_48  LH LM LL DV DC  Powered_Up_Time  Command/Feature_Name
  -- == -- == -- == == == -- -- -- -- --  ---------------  --------------------
  25 00 00 00 08 00 00 06 24 ab c0 e0 00     00:00:53.589  READ DMA EXT
  25 00 00 00 08 00 00 06 24 a9 40 e0 00     00:00:50.878  READ DMA EXT
  25 00 00 00 08 00 00 06 24 a9 38 e0 00     00:00:50.872  READ DMA EXT
  ec 00 00 00 00 00 00 00 00 00 00 a0 00     00:00:50.844  IDENTIFY DEVICE
  35 00 00 00 10 00 00 06 24 88 00 e0 00     00:00:50.843  WRITE DMA EXT

Error 97 [16] occurred at disk power-on lifetime: 10308 hours (429 days + 12 hours)
  When the command that caused the error occurred, the device was active or idle.

  After command completion occurred, registers were:
  ER -- ST COUNT  LBA_48  LH LM LL DV DC
  -- -- -- == -- == == == -- -- -- -- --
  40 -- 51 00 00 00 00 06 24 ab c0 00 00  Error: UNC at LBA = 0x0624abc0 = 103066560

  Commands leading to the command that caused the error were:
  CR FEATR COUNT  LBA_48  LH LM LL DV DC  Powered_Up_Time  Command/Feature_Name
  -- == -- == -- == == == -- -- -- -- --  ---------------  --------------------
  25 00 00 00 08 00 00 06 24 a9 40 e0 00     00:00:50.878  READ DMA EXT
  25 00 00 00 08 00 00 06 24 a9 38 e0 00     00:00:50.872  READ DMA EXT
  ec 00 00 00 00 00 00 00 00 00 00 a0 00     00:00:50.844  IDENTIFY DEVICE
  35 00 00 00 10 00 00 06 24 88 00 e0 00     00:00:50.843  WRITE DMA EXT
  25 00 00 01 00 00 00 32 cc cb a0 e0 00     00:00:50.795  READ DMA EXT

Error 96 [15] occurred at disk power-on lifetime: 10293 hours (428 days + 21 hours)
  When the command that caused the error occurred, the device was active or idle.

  After command completion occurred, registers were:
  ER -- ST COUNT  LBA_48  LH LM LL DV DC
  -- -- -- == -- == == == -- -- -- -- --
  40 -- 51 00 00 00 00 32 0c ee 54 00 00  Error: UNC at LBA = 0x320cee54 = 839708244

  Commands leading to the command that caused the error were:
  CR FEATR COUNT  LBA_48  LH LM LL DV DC  Powered_Up_Time  Command/Feature_Name
  -- == -- == -- == == == -- -- -- -- --  ---------------  --------------------
  25 00 00 00 80 00 00 32 0c ee 08 e0 00     00:25:01.825  READ DMA EXT
  35 00 00 00 08 00 00 24 df 01 90 e0 00     00:25:01.825  WRITE DMA EXT
  35 00 00 00 40 00 00 22 8f 0d a0 e0 00     00:25:01.824  WRITE DMA EXT
  35 00 00 00 80 00 00 22 8f 0d 20 e0 00     00:25:01.824  WRITE DMA EXT
  35 00 00 00 80 00 00 22 8f 0c a0 e0 00     00:25:01.823  WRITE DMA EXT

Error 95 [14] occurred at disk power-on lifetime: 10293 hours (428 days + 21 hours)
  When the command that caused the error occurred, the device was active or idle.

  After command completion occurred, registers were:
  ER -- ST COUNT  LBA_48  LH LM LL DV DC
  -- -- -- == -- == == == -- -- -- -- --
  40 -- 51 00 00 00 00 32 0c ee 54 00 00  Error: UNC at LBA = 0x320cee54 = 839708244

  Commands leading to the command that caused the error were:
  CR FEATR COUNT  LBA_48  LH LM LL DV DC  Powered_Up_Time  Command/Feature_Name
  -- == -- == -- == == == -- -- -- -- --  ---------------  --------------------
  25 00 00 00 80 00 00 32 0c ee 08 e0 00     00:24:58.998  READ DMA EXT
  35 00 00 00 08 00 00 0c da 15 c0 e0 00     00:24:58.997  WRITE DMA EXT
  35 00 00 00 08 00 00 06 26 d6 b8 e0 00     00:24:58.997  WRITE DMA EXT
  35 00 00 00 08 00 00 06 24 8b 00 e0 00     00:24:58.996  WRITE DMA EXT
  35 00 00 00 30 00 00 29 c6 b2 58 e0 00     00:24:58.996  WRITE DMA EXT

Error 94 [13] occurred at disk power-on lifetime: 10293 hours (428 days + 21 hours)
  When the command that caused the error occurred, the device was active or idle.

  After command completion occurred, registers were:
  ER -- ST COUNT  LBA_48  LH LM LL DV DC
  -- -- -- == -- == == == -- -- -- -- --
  40 -- 51 00 00 00 00 32 0c ee 54 00 00  Error: UNC at LBA = 0x320cee54 = 839708244

  Commands leading to the command that caused the error were:
  CR FEATR COUNT  LBA_48  LH LM LL DV DC  Powered_Up_Time  Command/Feature_Name
  -- == -- == -- == == == -- -- -- -- --  ---------------  --------------------
  25 00 00 00 80 00 00 32 0c ee 08 e0 00     00:24:56.238  READ DMA EXT
  35 00 00 00 20 00 00 2c 62 7c 60 e0 00     00:24:56.238  WRITE DMA EXT
  35 00 00 00 80 00 00 2c 62 7b e0 e0 00     00:24:56.237  WRITE DMA EXT
  35 00 00 00 80 00 00 2c 62 7b 60 e0 00     00:24:56.237  WRITE DMA EXT
  35 00 00 00 80 00 00 2c 62 7a e0 e0 00     00:24:56.236  WRITE DMA EXT

Error 93 [12] occurred at disk power-on lifetime: 10293 hours (428 days + 21 hours)
  When the command that caused the error occurred, the device was active or idle.

  After command completion occurred, registers were:
  ER -- ST COUNT  LBA_48  LH LM LL DV DC
  -- -- -- == -- == == == -- -- -- -- --
  40 -- 51 00 00 00 00 32 0c ee 54 00 00  Error: UNC at LBA = 0x320cee54 = 839708244

  Commands leading to the command that caused the error were:
  CR FEATR COUNT  LBA_48  LH LM LL DV DC  Powered_Up_Time  Command/Feature_Name
  -- == -- == -- == == == -- -- -- -- --  ---------------  --------------------
  25 00 00 00 80 00 00 32 0c ee 08 e0 00     00:24:53.329  READ DMA EXT
  35 00 00 00 10 00 00 30 b5 1f a0 e0 00     00:24:53.328  WRITE DMA EXT
  35 00 00 00 80 00 00 30 b5 1f 20 e0 00     00:24:53.328  WRITE DMA EXT
  35 00 00 00 80 00 00 30 b5 1e a0 e0 00     00:24:53.327  WRITE DMA EXT
  35 00 00 00 80 00 00 30 b5 1e 20 e0 00     00:24:53.326  WRITE DMA EXT

Error 92 [11] occurred at disk power-on lifetime: 10293 hours (428 days + 21 hours)
  When the command that caused the error occurred, the device was active or idle.

  After command completion occurred, registers were:
  ER -- ST COUNT  LBA_48  LH LM LL DV DC
  -- -- -- == -- == == == -- -- -- -- --
  40 -- 51 00 00 00 00 32 0c ee 54 00 00  Error: UNC at LBA = 0x320cee54 = 839708244

  Commands leading to the command that caused the error were:
  CR FEATR COUNT  LBA_48  LH LM LL DV DC  Powered_Up_Time  Command/Feature_Name
  -- == -- == -- == == == -- -- -- -- --  ---------------  --------------------
  25 00 00 00 80 00 00 32 0c ee 08 e0 00     00:24:50.547  READ DMA EXT
  35 00 00 00 48 00 00 31 eb b4 78 e0 00     00:24:50.547  WRITE DMA EXT
  35 00 00 00 80 00 00 31 eb b3 f8 e0 00     00:24:50.546  WRITE DMA EXT
  35 00 00 00 80 00 00 31 eb b3 78 e0 00     00:24:50.546  WRITE DMA EXT
  35 00 00 00 80 00 00 31 eb b2 f8 e0 00     00:24:50.545  WRITE DMA EXT

Error 91 [10] occurred at disk power-on lifetime: 10293 hours (428 days + 21 hours)
  When the command that caused the error occurred, the device was active or idle.

  After command completion occurred, registers were:
  ER -- ST COUNT  LBA_48  LH LM LL DV DC
  -- -- -- == -- == == == -- -- -- -- --
  40 -- 51 00 00 00 00 32 0c ee 54 00 00  Error: UNC at LBA = 0x320cee54 = 839708244

  Commands leading to the command that caused the error were:
  CR FEATR COUNT  LBA_48  LH LM LL DV DC  Powered_Up_Time  Command/Feature_Name
  -- == -- == -- == == == -- -- -- -- --  ---------------  --------------------
  25 00 00 00 80 00 00 32 0c ee 08 e0 00     00:24:47.778  READ DMA EXT
  35 00 00 00 50 00 00 2e e9 b9 10 e0 00     00:24:47.760  WRITE DMA EXT
  35 00 00 00 80 00 00 2e e9 b8 90 e0 00     00:24:47.756  WRITE DMA EXT
  35 00 00 00 80 00 00 2e e9 b8 10 e0 00     00:24:47.755  WRITE DMA EXT
  35 00 00 00 80 00 00 2e e9 b7 90 e0 00     00:24:47.755  WRITE DMA EXT

SMART Extended Self-test Log Version: 1 (1 sectors)
No self-tests have been logged.  [To run self-tests, use: smartctl -t]

SMART Selective self-test log data structure revision number 1
 SPAN  MIN_LBA  MAX_LBA  CURRENT_TEST_STATUS
    1        0        0  Not_testing
    2        0        0  Not_testing
    3        0        0  Not_testing
    4        0        0  Not_testing
    5        0        0  Not_testing
Selective self-test flags (0x0):
  After scanning selected spans, do NOT read-scan remainder of disk.
If Selective self-test is pending on power-up, resume after 0 minute delay.

SCT Status Version:                  3
SCT Version (vendor specific):       522 (0x020a)
SCT Support Level:                   1
Device State:                        Active (0)
Current Temperature:                    31 Celsius
Power Cycle Min/Max Temperature:     22/31 Celsius
Lifetime    Min/Max Temperature:     16/54 Celsius
Under/Over Temperature Limit Count:   0/0

SCT Temperature History Version:     2
Temperature Sampling Period:         1 minute
Temperature Logging Interval:        59 minutes
Min/Max recommended Temperature:     14/55 Celsius
Min/Max Temperature Limit:           10/60 Celsius
Temperature History Size (Index):    128 (102)

SCT Error Recovery Control:
           Read: Disabled
          Write: Disabled

Device Statistics (GP/SMART Log 0x04) not supported

SATA Phy Event Counters (GP Log 0x11)
ID      Size     Value  Description
0x000a  2           11  Device-to-host register FISes sent due to a COMRESET
0x0001  2            0  Command failed due to ICRC error
0x0003  2            0  R_ERR response for device-to-host data FIS
0x0004  2            0  R_ERR response for host-to-device data FIS
0x0006  2            0  R_ERR response for device-to-host non-data FIS
0x0007  2            0  R_ERR response for host-to-device non-data FIS

