=== START OF INFORMATION SECTION ===
Model Family:     Seagate Barracuda 7200.12
Device Model:     ST3500413AS
Serial Number:    --
LU WWN Device Id: 5 000c50 ...
Firmware Version: JC4B
User Capacity:    500,106,780,160 bytes [500 GB]
Sector Size:      512 bytes logical/physical
Rotation Rate:    7200 rpm
Device is:        In smartctl database [for details use: -P show]
ATA Version is:   ATA8-ACS T13/1699-D revision 4
SATA Version is:  SATA 3.0, 6.0 Gb/s (current: 3.0 Gb/s)
Local Time is:    Wed Sep  4 14:23:21 2019 +0430
SMART support is: Available - device has SMART capability.
SMART support is: Enabled
AAM level is:     208 (intermediate), recommended: 208
APM feature is:   Unavailable
Rd look-ahead is: Enabled
Write cache is:   Enabled
DSN feature is:   Unavailable
ATA Security is:  Disabled, frozen [SEC2]
Wt Cache Reorder: Unknown

=== START OF READ SMART DATA SECTION ===
SMART overall-health self-assessment test result: PASSED
See vendor-specific Attribute list for marginal Attributes.

General SMART Values:
Offline data collection status:  (0x82)	Offline data collection activity
					was completed without error.
					Auto Offline Data Collection: Enabled.
Self-test execution status:      (   0)	The previous self-test routine completed
					without error or no self-test has ever 
					been run.
Total time to complete Offline 
data collection: 		(  600) seconds.
Offline data collection
capabilities: 			 (0x7b) SMART execute Offline immediate.
					Auto Offline data collection on/off support.
					Suspend Offline collection upon new
					command.
					Offline surface scan supported.
					Self-test supported.
					Conveyance Self-test supported.
					Selective Self-test supported.
SMART capabilities:            (0x0003)	Saves SMART data before entering
					power-saving mode.
					Supports SMART auto save timer.
Error logging capability:        (0x01)	Error logging supported.
					General Purpose Logging supported.
Short self-test routine 
recommended polling time: 	 (   1) minutes.
Extended self-test routine
recommended polling time: 	 (  81) minutes.
Conveyance self-test routine
recommended polling time: 	 (   2) minutes.
SCT capabilities: 	       (0x103f)	SCT Status supported.
					SCT Error Recovery Control supported.
					SCT Feature Control supported.
					SCT Data Table supported.

SMART Attributes Data Structure revision number: 10
Vendor Specific SMART Attributes with Thresholds:
ID# ATTRIBUTE_NAME          FLAGS    VALUE WORST THRESH FAIL RAW_VALUE
  1 Raw_Read_Error_Rate     POSR--   117   099   006    -    146495333
  3 Spin_Up_Time            PO----   100   100   000    -    0
  4 Start_Stop_Count        -O--CK   094   094   020    -    6435
  5 Reallocated_Sector_Ct   PO--CK   100   100   036    -    0
  7 Seek_Error_Rate         POSR--   085   060   030    -    382598799
  9 Power_On_Hours          -O--CK   084   084   000    -    14017
 10 Spin_Retry_Count        PO--C-   100   100   097    -    0
 12 Power_Cycle_Count       -O--CK   095   095   020    -    5991
183 Runtime_Bad_Block       -O--CK   001   001   000    -    494
184 End-to-End_Error        -O--CK   100   100   099    -    0
187 Reported_Uncorrect      -O--CK   095   095   000    -    5
188 Command_Timeout         -O--CK   100   074   000    -    17180263614
189 High_Fly_Writes         -O-RCK   100   100   000    -    0
190 Airflow_Temperature_Cel -O---K   050   040   045    Past 50 (Min/Max 37/50 #96)
194 Temperature_Celsius     -O---K   050   060   000    -    50 (0 14 0 0 0)
195 Hardware_ECC_Recovered  -O-RC-   045   021   000    -    146495333
197 Current_Pending_Sector  -O--C-   100   100   000    -    1
198 Offline_Uncorrectable   ----C-   100   100   000    -    1
199 UDMA_CRC_Error_Count    -OSRCK   200   137   000    -    5748
240 Head_Flying_Hours       ------   100   253   000    -    30045 (154 145 0)
241 Total_LBAs_Written      ------   100   253   000    -    2783144008
242 Total_LBAs_Read         ------   100   253   000    -    2397318969
                            ||||||_ K auto-keep
                            |||||__ C event count
                            ||||___ R error rate
                            |||____ S speed/performance
                            ||_____ O updated online
                            |______ P prefailure warning

General Purpose Log Directory Version 1
SMART           Log Directory Version 1 [multi-sector log support]
Address    Access  R/W   Size  Description
0x00       GPL,SL  R/O      1  Log Directory
0x01       GPL,SL  R/O      1  Summary SMART error log
0x02       GPL,SL  R/O      5  Comprehensive SMART error log
0x03       GPL     R/O      5  Ext. Comprehensive SMART error log
0x06       GPL,SL  R/O      1  SMART self-test log
0x07       GPL     R/O      1  Extended self-test log
0x09       GPL,SL  R/W      1  Selective self-test log
0x10       GPL     R/O      1  NCQ Command Error log
0x11       GPL     R/O      1  SATA Phy Event Counters log
0x21       GPL     R/O      1  Write stream error log
0x22       GPL     R/O      1  Read stream error log
0x80-0x9f  GPL,SL  R/W     16  Host vendor specific log
0xa1       GPL,SL  VS      20  Device vendor specific log
0xa2       GPL     VS    2248  Device vendor specific log
0xa8       GPL,SL  VS     129  Device vendor specific log
0xa9       GPL,SL  VS       1  Device vendor specific log
0xb0       GPL     VS    2928  Device vendor specific log
0xbd       GPL     VS     252  Device vendor specific log
0xbe-0xbf  GPL     VS   65535  Device vendor specific log
0xc0       GPL,SL  VS       1  Device vendor specific log
0xe0       GPL,SL  R/W      1  SCT Command/Status
0xe1       GPL,SL  R/W      1  SCT Data Transfer

SMART Extended Comprehensive Error Log Version: 1 (5 sectors)
Device Error Count: 5
	CR     = Command Register
	FEATR  = Features Register
	COUNT  = Count (was: Sector Count) Register
	LBA_48 = Upper bytes of LBA High/Mid/Low Registers ]  ATA-8
	LH     = LBA High (was: Cylinder High) Register    ]   LBA
	LM     = LBA Mid (was: Cylinder Low) Register      ] Register
	LL     = LBA Low (was: Sector Number) Register     ]
	DV     = Device (was: Device/Head) Register
	DC     = Device Control Register
	ER     = Error register
	ST     = Status register
Powered_Up_Time is measured from power on, and printed as
DDd+hh:mm:SS.sss where DD=days, hh=hours, mm=minutes,
SS=sec, and sss=millisec. It "wraps" after 49.710 days.

Error 5 [4] occurred at disk power-on lifetime: 11978 hours (499 days + 2 hours)
  When the command that caused the error occurred, the device was active or idle.

  After command completion occurred, registers were:
  ER -- ST COUNT  LBA_48  LH LM LL DV DC
  -- -- -- == -- == == == -- -- -- -- --
  40 -- 51 00 00 00 00 00 00 2c 17 00 00  Error: UNC at LBA = 0x00002c17 = 11287

  Commands leading to the command that caused the error were:
  CR FEATR COUNT  LBA_48  LH LM LL DV DC  Powered_Up_Time  Command/Feature_Name
  -- == -- == -- == == == -- -- -- -- --  ---------------  --------------------
  25 00 00 00 18 00 00 00 00 2c 17 e0 00     00:01:19.648  READ DMA EXT
  25 00 00 00 20 00 00 27 33 0c 9c e0 00     00:01:19.626  READ DMA EXT
  25 00 00 00 20 00 00 00 39 2b 2d e0 00     00:01:19.625  READ DMA EXT
  25 00 00 00 08 00 00 00 26 34 ff e0 00     00:01:19.623  READ DMA EXT
  25 00 00 00 08 00 00 00 11 e5 1f e0 00     00:01:19.606  READ DMA EXT

Error 4 [3] occurred at disk power-on lifetime: 11978 hours (499 days + 2 hours)
  When the command that caused the error occurred, the device was active or idle.

  After command completion occurred, registers were:
  ER -- ST COUNT  LBA_48  LH LM LL DV DC
  -- -- -- == -- == == == -- -- -- -- --
  40 -- 51 00 00 00 00 00 00 2c 17 00 00  Error: UNC at LBA = 0x00002c17 = 11287

  Commands leading to the command that caused the error were:
  CR FEATR COUNT  LBA_48  LH LM LL DV DC  Powered_Up_Time  Command/Feature_Name
  -- == -- == -- == == == -- -- -- -- --  ---------------  --------------------
  25 00 00 00 38 00 00 00 00 2b f7 e0 00     00:01:16.714  READ DMA EXT
  25 00 00 00 40 00 00 27 33 02 2a e0 00     00:01:16.697  READ DMA EXT
  25 00 00 00 40 00 00 06 8a 84 47 e0 00     00:01:16.686  READ DMA EXT
  35 00 00 00 08 00 00 00 62 b3 2f e0 00     00:01:16.685  WRITE DMA EXT
  25 00 00 00 40 00 00 00 52 1e e1 e0 00     00:01:16.685  READ DMA EXT

Error 3 [2] occurred at disk power-on lifetime: 11978 hours (499 days + 2 hours)
  When the command that caused the error occurred, the device was active or idle.

  After command completion occurred, registers were:
  ER -- ST COUNT  LBA_48  LH LM LL DV DC
  -- -- -- == -- == == == -- -- -- -- --
  40 -- 51 00 00 00 00 00 00 2c 17 00 00  Error: UNC at LBA = 0x00002c17 = 11287

  Commands leading to the command that caused the error were:
  CR FEATR COUNT  LBA_48  LH LM LL DV DC  Powered_Up_Time  Command/Feature_Name
  -- == -- == -- == == == -- -- -- -- --  ---------------  --------------------
  25 00 00 00 38 00 00 00 00 2b f7 e0 00     00:01:13.941  READ DMA EXT
  25 00 00 00 40 00 00 27 33 01 02 e0 00     00:01:13.919  READ DMA EXT
  25 00 00 00 20 00 00 00 52 34 01 e0 00     00:01:13.909  READ DMA EXT
  25 00 00 00 20 00 00 00 39 2a cd e0 00     00:01:13.908  READ DMA EXT
  25 00 00 00 40 00 00 00 19 ac 79 e0 00     00:01:13.905  READ DMA EXT

Error 2 [1] occurred at disk power-on lifetime: 10007 hours (416 days + 23 hours)
  When the command that caused the error occurred, the device was active or idle.

  After command completion occurred, registers were:
  ER -- ST COUNT  LBA_48  LH LM LL DV DC
  -- -- -- == -- == == == -- -- -- -- --
  40 -- 51 00 00 00 00 05 54 16 97 00 00  Error: UNC at LBA = 0x05541697 = 89396887

  Commands leading to the command that caused the error were:
  CR FEATR COUNT  LBA_48  LH LM LL DV DC  Powered_Up_Time  Command/Feature_Name
  -- == -- == -- == == == -- -- -- -- --  ---------------  --------------------
  25 00 00 00 08 00 00 05 54 16 97 e0 00     00:25:24.056  READ DMA EXT
  25 00 00 00 08 00 00 05 59 64 4f e0 00     00:25:23.992  READ DMA EXT
  25 00 00 00 08 00 00 05 54 16 8f e0 00     00:25:23.990  READ DMA EXT
  25 00 00 00 06 00 00 01 1a 0f 87 e0 00     00:25:23.990  READ DMA EXT
  25 00 00 00 01 00 00 01 0c bc b4 e0 00     00:25:23.989  READ DMA EXT

Error 1 [0] occurred at disk power-on lifetime: 10007 hours (416 days + 23 hours)
  When the command that caused the error occurred, the device was active or idle.

  After command completion occurred, registers were:
  ER -- ST COUNT  LBA_48  LH LM LL DV DC
  -- -- -- == -- == == == -- -- -- -- --
  40 -- 51 00 00 00 00 05 54 16 97 00 00  Error: UNC at LBA = 0x05541697 = 89396887

  Commands leading to the command that caused the error were:
  CR FEATR COUNT  LBA_48  LH LM LL DV DC  Powered_Up_Time  Command/Feature_Name
  -- == -- == -- == == == -- -- -- -- --  ---------------  --------------------
  25 00 00 01 00 00 00 05 54 16 7f e0 00     00:25:20.945  READ DMA EXT
  25 00 00 00 08 00 00 00 ee ff 2f e0 00     00:25:20.943  READ DMA EXT
  25 00 00 00 08 00 00 02 71 35 a7 e0 00     00:25:20.943  READ DMA EXT
  25 00 00 00 40 00 00 00 ee fd b7 e0 00     00:25:20.931  READ DMA EXT
  25 00 00 00 08 00 00 05 59 65 17 e0 00     00:25:20.930  READ DMA EXT

SMART Extended Self-test Log Version: 1 (1 sectors)
No self-tests have been logged.  [To run self-tests, use: smartctl -t]

SMART Selective self-test log data structure revision number 1
 SPAN  MIN_LBA  MAX_LBA  CURRENT_TEST_STATUS
    1        0        0  Not_testing
    2        0        0  Not_testing
    3        0        0  Not_testing
    4        0        0  Not_testing
    5        0        0  Not_testing
Selective self-test flags (0x0):
  After scanning selected spans, do NOT read-scan remainder of disk.
If Selective self-test is pending on power-up, resume after 0 minute delay.

SCT Status Version:                  3
SCT Version (vendor specific):       522 (0x020a)
Device State:                        Active (0)
Current Temperature:                    50 Celsius
Power Cycle Min/Max Temperature:     37/50 Celsius
Lifetime    Min/Max Temperature:     14/60 Celsius
Under/Over Temperature Limit Count:   0/0

SCT Temperature History Version:     2
Temperature Sampling Period:         1 minute
Temperature Logging Interval:        59 minutes
Min/Max recommended Temperature:     14/55 Celsius
Min/Max Temperature Limit:           10/60 Celsius
Temperature History Size (Index):    128 (123)

SCT Error Recovery Control:
           Read: Disabled
          Write: Disabled

Device Statistics (GP/SMART Log 0x04) not supported

Pending Defects log (GP Log 0x0c) not supported

SATA Phy Event Counters (GP Log 0x11)
ID      Size     Value  Description
0x000a  2           21  Device-to-host register FISes sent due to a COMRESET
0x0001  2            0  Command failed due to ICRC error
0x0003  2            0  R_ERR response for device-to-host data FIS
0x0004  2            0  R_ERR response for host-to-device data FIS
0x0006  2            0  R_ERR response for device-to-host non-data FIS
0x0007  2            0  R_ERR response for host-to-device non-data FIS



