smartctl 7.1 2019-12-30 r5022 [i686-linux-5.4.32-generic-2rosa-i586] (local build)
Copyright (C) 2002-19, Bruce Allen, Christian Franke, www.smartmontools.org

=== START OF INFORMATION SECTION ===
Model Family:     Seagate Barracuda 7200.10
Device Model:     ST3160215AS
Serial Number:    --
Firmware Version: 4.AAB
User Capacity:    160,041,885,696 bytes [160 GB]
Sector Size:      512 bytes logical/physical
Device is:        In smartctl database [for details use: -P show]
ATA Version is:   ATA/ATAPI-7 (minor revision not indicated)
Local Time is:    Sat Jan 22 10:52:30 2022 MSK
SMART support is: Available - device has SMART capability.
SMART support is: Enabled
AAM feature is:   Unavailable
APM feature is:   Unavailable
Rd look-ahead is: Enabled
Write cache is:   Enabled
DSN feature is:   Unavailable
ATA Security is:  Disabled, frozen [SEC2]
Wt Cache Reorder: Unavailable

=== START OF READ SMART DATA SECTION ===
SMART overall-health self-assessment test result: PASSED

General SMART Values:
Offline data collection status:  (0x82)	Offline data collection activity
					was completed without error.
					Auto Offline Data Collection: Enabled.
Self-test execution status:      (   0)	The previous self-test routine completed
					without error or no self-test has ever 
					been run.
Total time to complete Offline 
data collection: 		(  430) seconds.
Offline data collection
capabilities: 			 (0x5b) SMART execute Offline immediate.
					Auto Offline data collection on/off support.
					Suspend Offline collection upon new
					command.
					Offline surface scan supported.
					Self-test supported.
					No Conveyance Self-test supported.
					Selective Self-test supported.
SMART capabilities:            (0x0003)	Saves SMART data before entering
					power-saving mode.
					Supports SMART auto save timer.
Error logging capability:        (0x01)	Error logging supported.
					General Purpose Logging supported.
Short self-test routine 
recommended polling time: 	 (   1) minutes.
Extended self-test routine
recommended polling time: 	 (  54) minutes.

SMART Attributes Data Structure revision number: 10
Vendor Specific SMART Attributes with Thresholds:
ID# ATTRIBUTE_NAME          FLAGS    VALUE WORST THRESH FAIL RAW_VALUE
  1 Raw_Read_Error_Rate     POSR--   100   253   006    -    0
  3 Spin_Up_Time            PO----   098   097   000    -    0
  4 Start_Stop_Count        -O--CK   099   099   020    -    2040
  5 Reallocated_Sector_Ct   PO--CK   098   098   036    -    97
  7 Seek_Error_Rate         POSR--   089   060   030    -    913545671
  9 Power_On_Hours          -O--CK   046   046   000    -    48082
 10 Spin_Retry_Count        PO--C-   100   100   097    -    0
 12 Power_Cycle_Count       -O--CK   099   099   020    -    2016
187 Reported_Uncorrect      -O--CK   092   092   000    -    8
189 High_Fly_Writes         -O-RCK   098   098   000    -    2
190 Airflow_Temperature_Cel -O---K   061   050   045    -    39 (Min/Max 39/40)
194 Temperature_Celsius     -O---K   039   050   000    -    39 (0 18 0 0 0)
195 Hardware_ECC_Recovered  -O-RC-   083   061   000    -    188993615
197 Current_Pending_Sector  -O--C-   100   100   000    -    0
198 Offline_Uncorrectable   ----C-   100   100   000    -    0
199 UDMA_CRC_Error_Count    -OSRCK   200   151   000    -    474
200 Multi_Zone_Error_Rate   ------   100   253   000    -    0
202 Data_Address_Mark_Errs  -O--CK   100   253   000    -    0
                            ||||||_ K auto-keep
                            |||||__ C event count
                            ||||___ R error rate
                            |||____ S speed/performance
                            ||_____ O updated online
                            |______ P prefailure warning

General Purpose Log Directory Version 1
SMART           Log Directory Version 1 [multi-sector log support]
Address    Access  R/W   Size  Description
0x00       GPL,SL  R/O      1  Log Directory
0x01       GPL,SL  R/O      1  Summary SMART error log
0x02       GPL,SL  R/O      5  Comprehensive SMART error log
0x03       GPL,SL  R/O      5  Ext. Comprehensive SMART error log
0x06       GPL,SL  R/O      1  SMART self-test log
0x07       GPL,SL  R/O      1  Extended self-test log
0x09       GPL,SL  R/W      1  Selective self-test log
0x10       GPL,SL  R/O      1  NCQ Command Error log
0x11       GPL,SL  R/O      1  SATA Phy Event Counters log
0x20       GPL,SL  R/O      1  Streaming performance log [OBS-8]
0x21       GPL,SL  R/O      1  Write stream error log
0x22       GPL,SL  R/O      1  Read stream error log
0x23       GPL,SL  R/O      1  Delayed sector log [OBS-8]
0x80-0x9f  GPL,SL  R/W     16  Host vendor specific log
0xa0       GPL,SL  VS       1  Device vendor specific log
0xa1       GPL,SL  VS      20  Device vendor specific log
0xa2       GPL,SL  VS     101  Device vendor specific log
0xa8       GPL,SL  VS      20  Device vendor specific log
0xa9       GPL,SL  VS       1  Device vendor specific log
0xe0       GPL,SL  R/W      1  SCT Command/Status
0xe1       GPL,SL  R/W      1  SCT Data Transfer
0xff       GPL     -    23040  Reserved

SMART Extended Comprehensive Error Log Version: 1 (5 sectors)
Device Error Count: 10
	CR     = Command Register
	FEATR  = Features Register
	COUNT  = Count (was: Sector Count) Register
	LBA_48 = Upper bytes of LBA High/Mid/Low Registers ]  ATA-8
	LH     = LBA High (was: Cylinder High) Register    ]   LBA
	LM     = LBA Mid (was: Cylinder Low) Register      ] Register
	LL     = LBA Low (was: Sector Number) Register     ]
	DV     = Device (was: Device/Head) Register
	DC     = Device Control Register
	ER     = Error register
	ST     = Status register
Powered_Up_Time is measured from power on, and printed as
DDd+hh:mm:SS.sss where DD=days, hh=hours, mm=minutes,
SS=sec, and sss=millisec. It "wraps" after 49.710 days.

Error 10 [9] occurred at disk power-on lifetime: 47889 hours (1995 days + 9 hours)
  When the command that caused the error occurred, the device was active or idle.

  After command completion occurred, registers were:
  ER -- ST COUNT  LBA_48  LH LM LL DV DC
  -- -- -- == -- == == == -- -- -- -- --
  40 -- 51 00 00 00 00 00 00 5e 37 e0 00  Error: UNC at LBA = 0x00005e37 = 24119

  Commands leading to the command that caused the error were:
  CR FEATR COUNT  LBA_48  LH LM LL DV DC  Powered_Up_Time  Command/Feature_Name
  -- == -- == -- == == == -- -- -- -- --  ---------------  --------------------
  25 00 00 00 08 00 00 00 00 5e 37 e0 00     00:00:16.619  READ DMA EXT
  25 00 00 00 08 00 00 00 00 5e 37 e0 00     00:00:16.613  READ DMA EXT
  25 00 00 00 08 00 00 00 00 5e 2f e0 00     00:00:16.612  READ DMA EXT
  25 00 00 00 08 00 09 a6 00 50 1f e0 00     00:00:16.596  READ DMA EXT
  25 00 00 00 08 00 00 00 00 60 3f e0 00     00:00:16.596  READ DMA EXT

Error 9 [8] occurred at disk power-on lifetime: 47889 hours (1995 days + 9 hours)
  When the command that caused the error occurred, the device was active or idle.

  After command completion occurred, registers were:
  ER -- ST COUNT  LBA_48  LH LM LL DV DC
  -- -- -- == -- == == == -- -- -- -- --
  40 -- 51 00 00 00 00 00 00 5e 37 e0 00  Error: UNC at LBA = 0x00005e37 = 24119

  Commands leading to the command that caused the error were:
  CR FEATR COUNT  LBA_48  LH LM LL DV DC  Powered_Up_Time  Command/Feature_Name
  -- == -- == -- == == == -- -- -- -- --  ---------------  --------------------
  25 00 00 00 08 00 00 00 00 5e 37 e0 00     00:00:16.619  READ DMA EXT
  25 00 00 00 08 00 00 00 00 5e 2f e0 00     00:00:16.613  READ DMA EXT
  25 00 00 00 08 00 09 a6 00 50 1f e0 00     00:00:16.612  READ DMA EXT
  25 00 00 00 08 00 00 00 00 60 3f e0 00     00:00:16.596  READ DMA EXT
  25 00 00 00 01 00 12 4b 00 a1 ff e0 00     00:00:16.596  READ DMA EXT

Error 8 [7] occurred at disk power-on lifetime: 47889 hours (1995 days + 9 hours)
  When the command that caused the error occurred, the device was active or idle.

  After command completion occurred, registers were:
  ER -- ST COUNT  LBA_48  LH LM LL DV DC
  -- -- -- == -- == == == -- -- -- -- --
  40 -- 51 00 00 00 00 26 00 00 78 e0 00  Error: UNC at LBA = 0x26000078 = 637534328

  Commands leading to the command that caused the error were:
  CR FEATR COUNT  LBA_48  LH LM LL DV DC  Powered_Up_Time  Command/Feature_Name
  -- == -- == -- == == == -- -- -- -- --  ---------------  --------------------
  25 00 00 00 07 00 00 26 00 00 78 e0 00     00:00:13.790  READ DMA EXT
  25 00 00 00 3d 00 00 26 00 00 78 e0 00     00:00:17.117  READ DMA EXT
  25 00 00 00 3d 00 00 26 00 00 3b e0 00     00:00:13.831  READ DMA EXT
  25 00 00 00 02 00 00 26 00 00 39 e0 00     00:00:13.830  READ DMA EXT
  25 00 00 00 02 00 00 26 00 00 37 e0 00     00:00:13.830  READ DMA EXT

Error 7 [6] occurred at disk power-on lifetime: 47889 hours (1995 days + 9 hours)
  When the command that caused the error occurred, the device was active or idle.

  After command completion occurred, registers were:
  ER -- ST COUNT  LBA_48  LH LM LL DV DC
  -- -- -- == -- == == == -- -- -- -- --
  40 -- 51 00 00 00 00 26 00 00 78 e0 00  Error: UNC at LBA = 0x26000078 = 637534328

  Commands leading to the command that caused the error were:
  CR FEATR COUNT  LBA_48  LH LM LL DV DC  Powered_Up_Time  Command/Feature_Name
  -- == -- == -- == == == -- -- -- -- --  ---------------  --------------------
  25 00 00 00 3d 00 00 26 00 00 78 e0 00     00:00:13.790  READ DMA EXT
  25 00 00 00 3d 00 00 26 00 00 3b e0 00     00:00:13.790  READ DMA EXT
  25 00 00 00 02 00 00 26 00 00 39 e0 00     00:00:13.831  READ DMA EXT
  25 00 00 00 02 00 00 26 00 00 37 e0 00     00:00:13.830  READ DMA EXT
  25 00 00 00 08 00 00 00 00 60 87 e0 00     00:00:13.830  READ DMA EXT

Error 6 [5] occurred at disk power-on lifetime: 47889 hours (1995 days + 9 hours)
  When the command that caused the error occurred, the device was active or idle.

  After command completion occurred, registers were:
  ER -- ST COUNT  LBA_48  LH LM LL DV DC
  -- -- -- == -- == == == -- -- -- -- --
  40 -- 51 00 00 00 00 00 00 5e 37 e0 00  Error: UNC at LBA = 0x00005e37 = 24119

  Commands leading to the command that caused the error were:
  CR FEATR COUNT  LBA_48  LH LM LL DV DC  Powered_Up_Time  Command/Feature_Name
  -- == -- == -- == == == -- -- -- -- --  ---------------  --------------------
  25 00 00 00 08 00 00 00 00 5e 37 e0 00     00:00:16.619  READ DMA EXT
  25 00 00 00 08 00 00 00 00 5e 37 e0 00     00:00:16.613  READ DMA EXT
  25 00 00 00 08 00 00 00 00 5e 2f e0 00     00:00:16.612  READ DMA EXT
  25 00 00 00 08 00 09 a6 00 50 1f e0 00     00:00:16.596  READ DMA EXT
  25 00 00 00 08 00 00 00 00 60 3f e0 00     00:00:16.596  READ DMA EXT

Error 5 [4] occurred at disk power-on lifetime: 47889 hours (1995 days + 9 hours)
  When the command that caused the error occurred, the device was active or idle.

  After command completion occurred, registers were:
  ER -- ST COUNT  LBA_48  LH LM LL DV DC
  -- -- -- == -- == == == -- -- -- -- --
  40 -- 51 00 00 00 00 00 00 5e 37 e0 00  Error: UNC at LBA = 0x00005e37 = 24119

  Commands leading to the command that caused the error were:
  CR FEATR COUNT  LBA_48  LH LM LL DV DC  Powered_Up_Time  Command/Feature_Name
  -- == -- == -- == == == -- -- -- -- --  ---------------  --------------------
  25 00 00 00 08 00 00 00 00 5e 37 e0 00     00:00:16.619  READ DMA EXT
  25 00 00 00 08 00 00 00 00 5e 2f e0 00     00:00:16.613  READ DMA EXT
  25 00 00 00 08 00 09 a6 00 50 1f e0 00     00:00:16.612  READ DMA EXT
  25 00 00 00 08 00 00 00 00 60 3f e0 00     00:00:16.596  READ DMA EXT
  25 00 00 00 01 00 12 4b 00 a1 ff e0 00     00:00:16.596  READ DMA EXT

Error 4 [3] occurred at disk power-on lifetime: 47889 hours (1995 days + 9 hours)
  When the command that caused the error occurred, the device was active or idle.

  After command completion occurred, registers were:
  ER -- ST COUNT  LBA_48  LH LM LL DV DC
  -- -- -- == -- == == == -- -- -- -- --
  40 -- 51 00 00 00 00 26 00 00 78 e0 00  Error: UNC at LBA = 0x26000078 = 637534328

  Commands leading to the command that caused the error were:
  CR FEATR COUNT  LBA_48  LH LM LL DV DC  Powered_Up_Time  Command/Feature_Name
  -- == -- == -- == == == -- -- -- -- --  ---------------  --------------------
  25 00 00 00 07 00 00 26 00 00 78 e0 00     00:00:13.790  READ DMA EXT
  25 00 00 00 3d 00 00 26 00 00 78 e0 00     00:00:17.117  READ DMA EXT
  25 00 00 00 3d 00 00 26 00 00 3b e0 00     00:00:13.831  READ DMA EXT
  25 00 00 00 02 00 00 26 00 00 39 e0 00     00:00:13.830  READ DMA EXT
  25 00 00 00 02 00 00 26 00 00 37 e0 00     00:00:13.830  READ DMA EXT

Error 3 [2] occurred at disk power-on lifetime: 47889 hours (1995 days + 9 hours)
  When the command that caused the error occurred, the device was active or idle.

  After command completion occurred, registers were:
  ER -- ST COUNT  LBA_48  LH LM LL DV DC
  -- -- -- == -- == == == -- -- -- -- --
  40 -- 51 00 00 00 00 26 00 00 78 e0 00  Error: UNC at LBA = 0x26000078 = 637534328

  Commands leading to the command that caused the error were:
  CR FEATR COUNT  LBA_48  LH LM LL DV DC  Powered_Up_Time  Command/Feature_Name
  -- == -- == -- == == == -- -- -- -- --  ---------------  --------------------
  25 00 00 00 3d 00 00 26 00 00 78 e0 00     00:00:13.790  READ DMA EXT
  25 00 00 00 3d 00 00 26 00 00 3b e0 00     00:00:13.790  READ DMA EXT
  25 00 00 00 02 00 00 26 00 00 39 e0 00     00:00:13.831  READ DMA EXT
  25 00 00 00 02 00 00 26 00 00 37 e0 00     00:00:13.830  READ DMA EXT
  25 00 00 00 08 00 00 00 00 60 87 e0 00     00:00:13.830  READ DMA EXT

SMART Extended Self-test Log Version: 1 (1 sectors)
Num  Test_Description    Status                  Remaining  LifeTime(hours)  LBA_of_first_error
# 1  Short offline       Completed without error       00%         0         -
# 2  Short offline       Completed without error       00%     44304         -

SMART Selective self-test log data structure revision number 1
 SPAN  MIN_LBA  MAX_LBA  CURRENT_TEST_STATUS
    1        0        0  Not_testing
    2        0        0  Not_testing
    3        0        0  Not_testing
    4        0        0  Not_testing
    5        0        0  Not_testing
Selective self-test flags (0x0):
  After scanning selected spans, do NOT read-scan remainder of disk.
If Selective self-test is pending on power-up, resume after 0 minute delay.

SCT Commands not supported

Device Statistics (GP/SMART Log 0x04) not supported

Pending Defects log (GP Log 0x0c) not supported

SATA Phy Event Counters (GP Log 0x11)
ID      Size     Value  Description
0x000a  2            5  Device-to-host register FISes sent due to a COMRESET
0x0001  2            0  Command failed due to ICRC error
0x0003  2            0  R_ERR response for device-to-host data FIS
0x0004  2            0  R_ERR response for host-to-device data FIS
0x0006  2            0  R_ERR response for device-to-host non-data FIS
0x0007  2            0  R_ERR response for host-to-device non-data FIS

