smartctl 7.2 2020-12-30 r5155 [x86_64-linux-5.12.4-desktop-1omv4050] (OpenMandriva Lx 7.2-2)
Copyright (C) 2002-20, Bruce Allen, Christian Franke, www.smartmontools.org

=== START OF INFORMATION SECTION ===
Model Family:     Western Digital Caviar Blue (SATA)
Device Model:     WDC WD6400AAKS-65A7B0
Serial Number:    --
LU WWN Device Id: 5 0014ee ...
Firmware Version: 01.03B01
User Capacity:    640,135,028,736 bytes [640 GB]
Sector Size:      512 bytes logical/physical
Device is:        In smartctl database [for details use: -P show]
ATA Version is:   ATA8-ACS (minor revision not indicated)
SATA Version is:  SATA 2.5, 3.0 Gb/s
Local Time is:    Tue May 25 13:56:10 2021 BST
SMART support is: Available - device has SMART capability.
SMART support is: Enabled
AAM feature is:   Disabled
APM feature is:   Unavailable
Rd look-ahead is: Enabled
Write cache is:   Enabled
DSN feature is:   Unavailable
ATA Security is:  Unavailable
Wt Cache Reorder: Enabled

=== START OF READ SMART DATA SECTION ===
SMART overall-health self-assessment test result: PASSED

General SMART Values:
Offline data collection status:  (0x84)	Offline data collection activity
					was suspended by an interrupting command from host.
					Auto Offline Data Collection: Enabled.
Self-test execution status:      (   0)	The previous self-test routine completed
					without error or no self-test has ever 
					been run.
Total time to complete Offline 
data collection: 		(11160) seconds.
Offline data collection
capabilities: 			 (0x7b) SMART execute Offline immediate.
					Auto Offline data collection on/off support.
					Suspend Offline collection upon new
					command.
					Offline surface scan supported.
					Self-test supported.
					Conveyance Self-test supported.
					Selective Self-test supported.
SMART capabilities:            (0x0003)	Saves SMART data before entering
					power-saving mode.
					Supports SMART auto save timer.
Error logging capability:        (0x01)	Error logging supported.
					General Purpose Logging supported.
Short self-test routine 
recommended polling time: 	 (   2) minutes.
Extended self-test routine
recommended polling time: 	 ( 131) minutes.
Conveyance self-test routine
recommended polling time: 	 (   5) minutes.
SCT capabilities: 	       (0x303f)	SCT Status supported.
					SCT Error Recovery Control supported.
					SCT Feature Control supported.
					SCT Data Table supported.

SMART Attributes Data Structure revision number: 16
Vendor Specific SMART Attributes with Thresholds:
ID# ATTRIBUTE_NAME          FLAGS    VALUE WORST THRESH FAIL RAW_VALUE
  1 Raw_Read_Error_Rate     POSR-K   200   200   051    -    0
  3 Spin_Up_Time            POS--K   157   153   021    -    5150
  4 Start_Stop_Count        -O--CK   080   080   000    -    20084
  5 Reallocated_Sector_Ct   PO--CK   200   200   140    -    0
  7 Seek_Error_Rate         -OSR-K   200   200   051    -    0
  9 Power_On_Hours          -O--CK   072   072   000    -    20608
 10 Spin_Retry_Count        -O--CK   100   100   051    -    0
 11 Calibration_Retry_Count -O--CK   100   100   051    -    0
 12 Power_Cycle_Count       -O--CK   085   085   000    -    15399
192 Power-Off_Retract_Count -O--CK   197   197   000    -    2502
193 Load_Cycle_Count        -O--CK   194   194   000    -    20084
194 Temperature_Celsius     -O---K   108   103   000    -    39
196 Reallocated_Event_Count -O--CK   200   200   000    -    0
197 Current_Pending_Sector  -O--CK   200   200   000    -    2
198 Offline_Uncorrectable   ----CK   200   200   000    -    3
199 UDMA_CRC_Error_Count    -O--CK   200   200   000    -    0
200 Multi_Zone_Error_Rate   ---R--   200   200   051    -    0
                            ||||||_ K auto-keep
                            |||||__ C event count
                            ||||___ R error rate
                            |||____ S speed/performance
                            ||_____ O updated online
                            |______ P prefailure warning

General Purpose Log Directory Version 1
SMART           Log Directory Version 1 [multi-sector log support]
Address    Access  R/W   Size  Description
0x00       GPL,SL  R/O      1  Log Directory
0x01           SL  R/O      1  Summary SMART error log
0x02           SL  R/O      5  Comprehensive SMART error log
0x03       GPL     R/O      6  Ext. Comprehensive SMART error log
0x06           SL  R/O      1  SMART self-test log
0x07       GPL     R/O      1  Extended self-test log
0x09           SL  R/W      1  Selective self-test log
0x10       GPL     R/O      1  NCQ Command Error log
0x11       GPL     R/O      1  SATA Phy Event Counters log
0x80-0x9f  GPL,SL  R/W     16  Host vendor specific log
0xa0-0xa7  GPL,SL  VS      16  Device vendor specific log
0xa8-0xb7  GPL,SL  VS       1  Device vendor specific log
0xc0       GPL,SL  VS       1  Device vendor specific log
0xc1       GPL     VS      24  Device vendor specific log
0xe0       GPL,SL  R/W      1  SCT Command/Status
0xe1       GPL,SL  R/W      1  SCT Data Transfer

SMART Extended Comprehensive Error Log Version: 1 (6 sectors)
Device Error Count: 42 (device log contains only the most recent 24 errors)
	CR     = Command Register
	FEATR  = Features Register
	COUNT  = Count (was: Sector Count) Register
	LBA_48 = Upper bytes of LBA High/Mid/Low Registers ]  ATA-8
	LH     = LBA High (was: Cylinder High) Register    ]   LBA
	LM     = LBA Mid (was: Cylinder Low) Register      ] Register
	LL     = LBA Low (was: Sector Number) Register     ]
	DV     = Device (was: Device/Head) Register
	DC     = Device Control Register
	ER     = Error register
	ST     = Status register
Powered_Up_Time is measured from power on, and printed as
DDd+hh:mm:SS.sss where DD=days, hh=hours, mm=minutes,
SS=sec, and sss=millisec. It "wraps" after 49.710 days.

Error 42 [17] occurred at disk power-on lifetime: 19389 hours (807 days + 21 hours)
  When the command that caused the error occurred, the device was active or idle.

  After command completion occurred, registers were:
  ER -- ST COUNT  LBA_48  LH LM LL DV DC
  -- -- -- == -- == == == -- -- -- -- --
  40 -- 51 00 00 00 25 48 00 44 68 40 00  Error: UNC at LBA = 0x2548004468 = 160121767016

  Commands leading to the command that caused the error were:
  CR FEATR COUNT  LBA_48  LH LM LL DV DC  Powered_Up_Time  Command/Feature_Name
  -- == -- == -- == == == -- -- -- -- --  ---------------  --------------------
  60 00 08 00 b8 00 00 25 44 49 00 40 08     00:07:09.670  READ FPDMA QUEUED
  60 00 08 00 b0 00 00 25 44 48 f8 40 08     00:07:09.670  READ FPDMA QUEUED
  60 00 08 00 a8 00 00 25 44 48 f0 40 08     00:07:09.670  READ FPDMA QUEUED
  60 00 08 00 a0 00 00 25 44 48 e8 40 08     00:07:09.669  READ FPDMA QUEUED
  60 00 08 00 98 00 00 25 44 48 e0 40 08     00:07:09.669  READ FPDMA QUEUED

Error 41 [16] occurred at disk power-on lifetime: 19389 hours (807 days + 21 hours)
  When the command that caused the error occurred, the device was active or idle.

  After command completion occurred, registers were:
  ER -- ST COUNT  LBA_48  LH LM LL DV DC
  -- -- -- == -- == == == -- -- -- -- --
  40 -- 51 00 01 00 25 48 00 44 68 40 00  Error: UNC at LBA = 0x2548004468 = 160121767016

  Commands leading to the command that caused the error were:
  CR FEATR COUNT  LBA_48  LH LM LL DV DC  Powered_Up_Time  Command/Feature_Name
  -- == -- == -- == == == -- -- -- -- --  ---------------  --------------------
  60 00 08 00 90 00 00 25 44 49 00 40 08     00:07:05.054  READ FPDMA QUEUED
  60 00 08 00 88 00 00 25 44 48 f8 40 08     00:07:05.046  READ FPDMA QUEUED
  60 00 08 00 80 00 00 25 44 48 f0 40 08     00:07:05.037  READ FPDMA QUEUED
  60 00 08 00 78 00 00 25 44 48 e8 40 08     00:07:05.033  READ FPDMA QUEUED
  60 00 08 00 70 00 00 25 44 48 e0 40 08     00:07:05.033  READ FPDMA QUEUED

Error 40 [15] occurred at disk power-on lifetime: 19389 hours (807 days + 21 hours)
  When the command that caused the error occurred, the device was active or idle.

  After command completion occurred, registers were:
  ER -- ST COUNT  LBA_48  LH LM LL DV DC
  -- -- -- == -- == == == -- -- -- -- --
  40 -- 51 00 00 00 25 48 00 44 68 40 00  Error: UNC at LBA = 0x2548004468 = 160121767016

  Commands leading to the command that caused the error were:
  CR FEATR COUNT  LBA_48  LH LM LL DV DC  Powered_Up_Time  Command/Feature_Name
  -- == -- == -- == == == -- -- -- -- --  ---------------  --------------------
  60 00 08 00 b0 00 00 25 44 49 00 40 08     00:01:19.937  READ FPDMA QUEUED
  60 00 08 00 a8 00 00 25 44 48 f8 40 08     00:01:19.937  READ FPDMA QUEUED
  60 00 08 00 a0 00 00 25 44 48 f0 40 08     00:01:19.937  READ FPDMA QUEUED
  60 00 08 00 98 00 00 25 44 48 e8 40 08     00:01:19.937  READ FPDMA QUEUED
  60 00 08 00 90 00 00 25 44 48 e0 40 08     00:01:19.937  READ FPDMA QUEUED

Error 39 [14] occurred at disk power-on lifetime: 19389 hours (807 days + 21 hours)
  When the command that caused the error occurred, the device was active or idle.

  After command completion occurred, registers were:
  ER -- ST COUNT  LBA_48  LH LM LL DV DC
  -- -- -- == -- == == == -- -- -- -- --
  40 -- 51 00 01 00 25 48 00 44 68 40 00  Error: UNC at LBA = 0x2548004468 = 160121767016

  Commands leading to the command that caused the error were:
  CR FEATR COUNT  LBA_48  LH LM LL DV DC  Powered_Up_Time  Command/Feature_Name
  -- == -- == -- == == == -- -- -- -- --  ---------------  --------------------
  60 00 08 00 90 00 00 25 44 49 00 40 08     00:01:15.038  READ FPDMA QUEUED
  60 00 08 00 88 00 00 25 44 48 f8 40 08     00:01:15.030  READ FPDMA QUEUED
  60 00 08 00 80 00 00 25 44 48 f0 40 08     00:01:15.021  READ FPDMA QUEUED
  60 00 08 00 78 00 00 25 44 48 e8 40 08     00:01:15.013  READ FPDMA QUEUED
  60 00 08 00 70 00 00 25 44 48 e0 40 08     00:01:15.005  READ FPDMA QUEUED

Error 38 [13] occurred at disk power-on lifetime: 19389 hours (807 days + 21 hours)
  When the command that caused the error occurred, the device was active or idle.

  After command completion occurred, registers were:
  ER -- ST COUNT  LBA_48  LH LM LL DV DC
  -- -- -- == -- == == == -- -- -- -- --
  40 -- 51 00 00 00 25 48 00 44 68 40 00  Error: UNC at LBA = 0x2548004468 = 160121767016

  Commands leading to the command that caused the error were:
  CR FEATR COUNT  LBA_48  LH LM LL DV DC  Powered_Up_Time  Command/Feature_Name
  -- == -- == -- == == == -- -- -- -- --  ---------------  --------------------
  60 00 08 00 68 00 00 25 44 49 00 40 08     00:01:20.011  READ FPDMA QUEUED
  60 00 08 00 60 00 00 25 44 48 f8 40 08     00:01:20.011  READ FPDMA QUEUED
  60 00 08 00 58 00 00 25 44 48 f0 40 08     00:01:20.011  READ FPDMA QUEUED
  60 00 08 00 50 00 00 25 44 48 e8 40 08     00:01:20.011  READ FPDMA QUEUED
  60 00 08 00 48 00 00 25 44 48 e0 40 08     00:01:20.011  READ FPDMA QUEUED

Error 37 [12] occurred at disk power-on lifetime: 19389 hours (807 days + 21 hours)
  When the command that caused the error occurred, the device was active or idle.

  After command completion occurred, registers were:
  ER -- ST COUNT  LBA_48  LH LM LL DV DC
  -- -- -- == -- == == == -- -- -- -- --
  40 -- 51 00 01 00 25 48 00 44 68 40 00  Error: UNC at LBA = 0x2548004468 = 160121767016

  Commands leading to the command that caused the error were:
  CR FEATR COUNT  LBA_48  LH LM LL DV DC  Powered_Up_Time  Command/Feature_Name
  -- == -- == -- == == == -- -- -- -- --  ---------------  --------------------
  60 00 08 00 70 00 00 25 44 49 00 40 08     00:01:15.087  READ FPDMA QUEUED
  60 00 08 00 68 00 00 25 44 48 f8 40 08     00:01:15.079  READ FPDMA QUEUED
  60 00 08 00 60 00 00 25 44 48 f0 40 08     00:01:15.071  READ FPDMA QUEUED
  60 00 08 00 58 00 00 25 44 48 e8 40 08     00:01:15.062  READ FPDMA QUEUED
  60 00 08 00 50 00 00 25 44 48 e0 40 08     00:01:15.054  READ FPDMA QUEUED

Error 36 [11] occurred at disk power-on lifetime: 19389 hours (807 days + 21 hours)
  When the command that caused the error occurred, the device was active or idle.

  After command completion occurred, registers were:
  ER -- ST COUNT  LBA_48  LH LM LL DV DC
  -- -- -- == -- == == == -- -- -- -- --
  40 -- 51 00 00 00 25 48 00 44 68 40 00  Error: UNC at LBA = 0x2548004468 = 160121767016

  Commands leading to the command that caused the error were:
  CR FEATR COUNT  LBA_48  LH LM LL DV DC  Powered_Up_Time  Command/Feature_Name
  -- == -- == -- == == == -- -- -- -- --  ---------------  --------------------
  60 00 08 00 d0 00 00 25 44 48 68 40 08     00:01:59.675  READ FPDMA QUEUED
  ef 00 10 00 02 00 00 00 00 00 00 a0 08     00:01:59.675  SET FEATURES [Enable SATA feature]
  ec 00 00 00 00 00 00 00 00 00 00 a0 08     00:01:59.674  IDENTIFY DEVICE
  ef 00 03 00 46 00 00 00 00 00 00 a0 08     00:01:59.674  SET FEATURES [Set transfer mode]
  ef 00 10 00 02 00 00 00 00 00 00 a0 08     00:01:59.674  SET FEATURES [Enable SATA feature]

Error 35 [10] occurred at disk power-on lifetime: 19389 hours (807 days + 21 hours)
  When the command that caused the error occurred, the device was active or idle.

  After command completion occurred, registers were:
  ER -- ST COUNT  LBA_48  LH LM LL DV DC
  -- -- -- == -- == == == -- -- -- -- --
  40 -- 51 00 00 00 25 48 00 44 68 40 00  Error: UNC at LBA = 0x2548004468 = 160121767016

  Commands leading to the command that caused the error were:
  CR FEATR COUNT  LBA_48  LH LM LL DV DC  Powered_Up_Time  Command/Feature_Name
  -- == -- == -- == == == -- -- -- -- --  ---------------  --------------------
  60 00 08 00 38 00 00 25 44 48 68 40 08     00:01:56.446  READ FPDMA QUEUED
  ef 00 10 00 02 00 00 00 00 00 00 a0 08     00:01:56.446  SET FEATURES [Enable SATA feature]
  ec 00 00 00 00 00 00 00 00 00 00 a0 08     00:01:56.445  IDENTIFY DEVICE
  ef 00 03 00 46 00 00 00 00 00 00 a0 08     00:01:56.445  SET FEATURES [Set transfer mode]
  ef 00 10 00 02 00 00 00 00 00 00 a0 08     00:01:56.445  SET FEATURES [Enable SATA feature]

SMART Extended Self-test Log Version: 1 (1 sectors)
Num  Test_Description    Status                  Remaining  LifeTime(hours)  LBA_of_first_error
# 1  Short offline       Aborted by host               90%     18655         -
# 2  Short offline       Completed without error       00%     18633         -
# 3  Short offline       Completed without error       00%     18590         -
# 4  Short offline       Completed without error       00%     18590         -
# 5  Short offline       Completed without error       00%         1         -

SMART Selective self-test log data structure revision number 1
 SPAN  MIN_LBA  MAX_LBA  CURRENT_TEST_STATUS
    1        0        0  Not_testing
    2        0        0  Not_testing
    3        0        0  Not_testing
    4        0        0  Not_testing
    5        0        0  Not_testing
Selective self-test flags (0x0):
  After scanning selected spans, do NOT read-scan remainder of disk.
If Selective self-test is pending on power-up, resume after 0 minute delay.

SCT Status Version:                  2
SCT Version (vendor specific):       258 (0x0102)
Device State:                        SMART Off-line Data Collection executing in background (4)
Current Temperature:                    39 Celsius
Power Cycle Min/Max Temperature:     38/39 Celsius
Lifetime    Min/Max Temperature:     22/44 Celsius
Under/Over Temperature Limit Count:   0/0

SCT Temperature History Version:     2
Temperature Sampling Period:         1 minute
Temperature Logging Interval:        1 minute
Min/Max recommended Temperature:      0/60 Celsius
Min/Max Temperature Limit:           -41/85 Celsius
Temperature History Size (Index):    128 (78)

SCT Error Recovery Control:
           Read: Disabled
          Write: Disabled

Device Statistics (GP/SMART Log 0x04) not supported

Pending Defects log (GP Log 0x0c) not supported

SATA Phy Event Counters (GP Log 0x11)
ID      Size     Value  Description
0x0001  2            0  Command failed due to ICRC error
0x0002  2            0  R_ERR response for data FIS
0x0003  2            0  R_ERR response for device-to-host data FIS
0x0004  2            0  R_ERR response for host-to-device data FIS
0x0005  2            0  R_ERR response for non-data FIS
0x0006  2            0  R_ERR response for device-to-host non-data FIS
0x0007  2            0  R_ERR response for host-to-device non-data FIS
0x000a  2            0  Device-to-host register FISes sent due to a COMRESET
0x8000  4          481  Vendor specific

