smartctl 7.1 2019-12-30 r5022 [x86_64-linux-5.11.0-41-generic] (local build)
Copyright (C) 2002-19, Bruce Allen, Christian Franke, www.smartmontools.org

=== START OF INFORMATION SECTION ===
Model Family:     SAMSUNG SpinPoint F2 EG
Device Model:     SAMSUNG HD103SI
Serial Number:    --
LU WWN Device Id: 5 0024e9 ...
Firmware Version: 1AG01118
User Capacity:    1,000,204,886,016 bytes [1.00 TB]
Sector Size:      512 bytes logical/physical
Device is:        In smartctl database [for details use: -P show]
ATA Version is:   ATA/ATAPI-7, ATA8-ACS T13/1699-D revision 3b
Local Time is:    Sun Nov 14 21:20:37 2021 CET
SMART support is: Available - device has SMART capability.
SMART support is: Enabled
AAM feature is:   Disabled
APM feature is:   Disabled
Rd look-ahead is: Enabled
Write cache is:   Enabled
DSN feature is:   Unavailable
ATA Security is:  Disabled, frozen [SEC2]
Wt Cache Reorder: Enabled

=== START OF READ SMART DATA SECTION ===
SMART overall-health self-assessment test result: PASSED

General SMART Values:
Offline data collection status:  (0x00)	Offline data collection activity
					was never started.
					Auto Offline Data Collection: Disabled.
Self-test execution status:      (   0)	The previous self-test routine completed
					without error or no self-test has ever 
					been run.
Total time to complete Offline 
data collection: 		(12826) seconds.
Offline data collection
capabilities: 			 (0x7b) SMART execute Offline immediate.
					Auto Offline data collection on/off support.
					Suspend Offline collection upon new
					command.
					Offline surface scan supported.
					Self-test supported.
					Conveyance Self-test supported.
					Selective Self-test supported.
SMART capabilities:            (0x0003)	Saves SMART data before entering
					power-saving mode.
					Supports SMART auto save timer.
Error logging capability:        (0x01)	Error logging supported.
					General Purpose Logging supported.
Short self-test routine 
recommended polling time: 	 (   2) minutes.
Extended self-test routine
recommended polling time: 	 ( 215) minutes.
Conveyance self-test routine
recommended polling time: 	 (  23) minutes.
SCT capabilities: 	       (0x003f)	SCT Status supported.
					SCT Error Recovery Control supported.
					SCT Feature Control supported.
					SCT Data Table supported.

SMART Attributes Data Structure revision number: 16
Vendor Specific SMART Attributes with Thresholds:
ID# ATTRIBUTE_NAME          FLAGS    VALUE WORST THRESH FAIL RAW_VALUE
  1 Raw_Read_Error_Rate     POSR--   100   100   051    -    0
  3 Spin_Up_Time            POS---   082   082   011    -    6280
  4 Start_Stop_Count        -O--CK   100   100   000    -    47
  5 Reallocated_Sector_Ct   PO--CK   100   100   010    -    0
  7 Seek_Error_Rate         POSR--   100   100   051    -    0
  8 Seek_Time_Performance   P-S--K   100   100   015    -    0
  9 Power_On_Hours          -O--CK   095   095   000    -    26192
 10 Spin_Retry_Count        PO--CK   100   100   051    -    0
 11 Calibration_Retry_Count -O--C-   100   100   000    -    0
 12 Power_Cycle_Count       -O--CK   100   100   000    -    43
 13 Read_Soft_Error_Rate    -OSR--   100   100   000    -    0
183 Runtime_Bad_Block       -O--CK   100   100   000    -    0
184 End-to-End_Error        PO--CK   100   100   000    -    0
187 Reported_Uncorrect      -O--CK   100   100   000    -    0
188 Command_Timeout         -O--CK   100   100   000    -    0
190 Airflow_Temperature_Cel -O---K   088   075   000    -    12 (Min/Max 12/12)
194 Temperature_Celsius     -O---K   086   073   000    -    14 (0 39 14 12 0)
195 Hardware_ECC_Recovered  -O-RC-   100   100   000    -    408534
196 Reallocated_Event_Count -O--CK   100   100   000    -    0
197 Current_Pending_Sector  -O--C-   100   100   000    -    0
198 Offline_Uncorrectable   ----CK   100   100   000    -    0
199 UDMA_CRC_Error_Count    -OSRCK   100   100   000    -    15
200 Multi_Zone_Error_Rate   -O-R--   100   100   000    -    0
201 Soft_Read_Error_Rate    -O-R--   253   253   000    -    0
                            ||||||_ K auto-keep
                            |||||__ C event count
                            ||||___ R error rate
                            |||____ S speed/performance
                            ||_____ O updated online
                            |______ P prefailure warning

General Purpose Log Directory Version 1
SMART           Log Directory Version 1 [multi-sector log support]
Address    Access  R/W   Size  Description
0x00       GPL,SL  R/O      1  Log Directory
0x01           SL  R/O      1  Summary SMART error log
0x02           SL  R/O      2  Comprehensive SMART error log
0x03       GPL     R/O      2  Ext. Comprehensive SMART error log
0x04       GPL     R/O      2  Device Statistics log
0x06           SL  R/O      1  SMART self-test log
0x07       GPL     R/O      2  Extended self-test log
0x09           SL  R/W      1  Selective self-test log
0x10       GPL     R/O      1  NCQ Command Error log
0x11       GPL     R/O      1  SATA Phy Event Counters log
0x20       GPL     R/O      2  Streaming performance log [OBS-8]
0x21       GPL     R/O      1  Write stream error log
0x22       GPL     R/O      1  Read stream error log
0x80-0x9f  GPL,SL  R/W     16  Host vendor specific log
0xe0       GPL,SL  R/W      1  SCT Command/Status
0xe1       GPL,SL  R/W      1  SCT Data Transfer

SMART Extended Comprehensive Error Log Version: 1 (2 sectors)
Device Error Count: 15 (device log contains only the most recent 8 errors)
	CR     = Command Register
	FEATR  = Features Register
	COUNT  = Count (was: Sector Count) Register
	LBA_48 = Upper bytes of LBA High/Mid/Low Registers ]  ATA-8
	LH     = LBA High (was: Cylinder High) Register    ]   LBA
	LM     = LBA Mid (was: Cylinder Low) Register      ] Register
	LL     = LBA Low (was: Sector Number) Register     ]
	DV     = Device (was: Device/Head) Register
	DC     = Device Control Register
	ER     = Error register
	ST     = Status register
Powered_Up_Time is measured from power on, and printed as
DDd+hh:mm:SS.sss where DD=days, hh=hours, mm=minutes,
SS=sec, and sss=millisec. It "wraps" after 49.710 days.

Error 15 [6] occurred at disk power-on lifetime: 26143 hours (1089 days + 7 hours)
  When the command that caused the error occurred, the device was active or idle.

  After command completion occurred, registers were:
  ER -- ST COUNT  LBA_48  LH LM LL DV DC
  -- -- -- == -- == == == -- -- -- -- --
  84 -- 51 00 cf 00 00 00 00 03 29 e0 00  Error: ICRC, ABRT 207 sectors at LBA = 0x00000329 = 809

  Commands leading to the command that caused the error were:
  CR FEATR COUNT  LBA_48  LH LM LL DV DC  Powered_Up_Time  Command/Feature_Name
  -- == -- == -- == == == -- -- -- -- --  ---------------  --------------------
  25 00 03 00 f0 00 00 00 00 03 08 e0 00     00:00:51.930  READ DMA EXT
  25 00 03 00 08 00 00 00 00 03 00 e0 00     00:00:51.930  READ DMA EXT
  25 00 03 00 08 00 00 00 00 02 f8 e0 00     00:00:51.930  READ DMA EXT
  25 00 03 00 08 00 00 00 00 02 f0 e0 00     00:00:51.930  READ DMA EXT
  25 00 03 00 08 00 00 00 00 02 e8 e0 00     00:00:51.930  READ DMA EXT

Error 14 [5] occurred at disk power-on lifetime: 26143 hours (1089 days + 7 hours)
  When the command that caused the error occurred, the device was active or idle.

  After command completion occurred, registers were:
  ER -- ST COUNT  LBA_48  LH LM LL DV DC
  -- -- -- == -- == == == -- -- -- -- --
  84 -- 51 00 af 00 00 00 00 02 49 e0 00  Error: ICRC, ABRT 175 sectors at LBA = 0x00000249 = 585

  Commands leading to the command that caused the error were:
  CR FEATR COUNT  LBA_48  LH LM LL DV DC  Powered_Up_Time  Command/Feature_Name
  -- == -- == -- == == == -- -- -- -- --  ---------------  --------------------
  25 00 03 00 f0 00 00 00 00 02 08 e0 00     00:00:29.870  READ DMA EXT
  25 00 03 00 f0 00 00 00 00 01 10 e0 00     00:00:29.870  READ DMA EXT
  25 00 03 00 08 00 00 00 00 01 08 e0 00     00:00:29.870  READ DMA EXT
  25 00 03 00 78 00 00 00 00 00 88 e0 00     00:00:29.860  READ DMA EXT
  25 00 03 00 30 00 00 00 00 00 48 e0 00     00:00:29.860  READ DMA EXT

Error 13 [4] occurred at disk power-on lifetime: 26143 hours (1089 days + 7 hours)
  When the command that caused the error occurred, the device was active or idle.

  After command completion occurred, registers were:
  ER -- ST COUNT  LBA_48  LH LM LL DV DC
  -- -- -- == -- == == == -- -- -- -- --
  84 -- 51 00 0f 00 00 00 00 03 e9 e0 00  Error: ICRC, ABRT 15 sectors at LBA = 0x000003e9 = 1001

  Commands leading to the command that caused the error were:
  CR FEATR COUNT  LBA_48  LH LM LL DV DC  Powered_Up_Time  Command/Feature_Name
  -- == -- == -- == == == -- -- -- -- --  ---------------  --------------------
  25 03 00 00 f0 00 00 00 00 03 08 e0 00     00:05:37.950  READ DMA EXT
  25 03 00 00 10 00 00 00 00 02 f8 e0 00     00:05:37.950  READ DMA EXT
  25 03 00 00 f0 00 00 00 00 02 08 e0 00     00:05:37.940  READ DMA EXT
  25 03 00 00 f0 00 00 00 00 01 10 e0 00     00:05:37.940  READ DMA EXT
  25 03 00 00 08 00 00 00 00 01 08 e0 00     00:05:37.940  READ DMA EXT

Error 12 [3] occurred at disk power-on lifetime: 26143 hours (1089 days + 7 hours)
  When the command that caused the error occurred, the device was active or idle.

  After command completion occurred, registers were:
  ER -- ST COUNT  LBA_48  LH LM LL DV DC
  -- -- -- == -- == == == -- -- -- -- --
  84 -- 51 00 5f 00 00 00 00 8b b0 e0 00  Error: ICRC, ABRT 95 sectors at LBA = 0x00008bb0 = 35760

  Commands leading to the command that caused the error were:
  CR FEATR COUNT  LBA_48  LH LM LL DV DC  Powered_Up_Time  Command/Feature_Name
  -- == -- == -- == == == -- -- -- -- --  ---------------  --------------------
  25 00 03 00 f0 00 00 00 00 8b 1f e0 00     00:04:25.860  READ DMA EXT
  25 00 03 00 10 00 00 00 00 8b 0f e0 00     00:04:25.860  READ DMA EXT
  25 00 03 00 f0 00 00 00 00 8a 1f e0 00     00:04:25.850  READ DMA EXT
  25 00 03 00 10 00 00 00 00 8a 0f e0 00     00:04:25.850  READ DMA EXT
  25 00 03 00 f0 00 00 00 00 89 1f e0 00     00:04:25.850  READ DMA EXT

Error 11 [2] occurred at disk power-on lifetime: 26143 hours (1089 days + 7 hours)
  When the command that caused the error occurred, the device was active or idle.

  After command completion occurred, registers were:
  ER -- ST COUNT  LBA_48  LH LM LL DV DC
  -- -- -- == -- == == == -- -- -- -- --
  84 -- 51 00 9f 00 00 00 00 36 70 e0 00  Error: ICRC, ABRT 159 sectors at LBA = 0x00003670 = 13936

  Commands leading to the command that caused the error were:
  CR FEATR COUNT  LBA_48  LH LM LL DV DC  Powered_Up_Time  Command/Feature_Name
  -- == -- == -- == == == -- -- -- -- --  ---------------  --------------------
  25 00 03 00 f0 00 00 00 00 36 1f e0 00     00:03:54.830  READ DMA EXT
  25 00 03 00 10 00 00 00 00 36 0f e0 00     00:03:54.830  READ DMA EXT
  25 00 03 00 f0 00 00 00 00 35 1f e0 00     00:03:54.830  READ DMA EXT
  25 00 03 00 10 00 00 00 00 35 0f e0 00     00:03:54.830  READ DMA EXT
  25 00 03 00 f0 00 00 00 00 34 1f e0 00     00:03:54.820  READ DMA EXT

Error 10 [1] occurred at disk power-on lifetime: 26143 hours (1089 days + 7 hours)
  When the command that caused the error occurred, the device was active or idle.

  After command completion occurred, registers were:
  ER -- ST COUNT  LBA_48  LH LM LL DV DC
  -- -- -- == -- == == == -- -- -- -- --
  84 -- 51 00 df 00 00 00 00 23 30 e0 00  Error: ICRC, ABRT 223 sectors at LBA = 0x00002330 = 9008

  Commands leading to the command that caused the error were:
  CR FEATR COUNT  LBA_48  LH LM LL DV DC  Powered_Up_Time  Command/Feature_Name
  -- == -- == -- == == == -- -- -- -- --  ---------------  --------------------
  25 00 03 00 f0 00 00 00 00 23 1f e0 00     00:03:24.290  READ DMA EXT
  25 00 03 00 10 00 00 00 00 23 0f e0 00     00:03:24.290  READ DMA EXT
  25 00 03 00 f0 00 00 00 00 22 1f e0 00     00:03:24.290  READ DMA EXT
  25 00 03 00 10 00 00 00 00 22 0f e0 00     00:03:24.290  READ DMA EXT
  25 00 03 00 f0 00 00 00 00 21 1f e0 00     00:03:24.290  READ DMA EXT

Error 9 [0] occurred at disk power-on lifetime: 26143 hours (1089 days + 7 hours)
  When the command that caused the error occurred, the device was active or idle.

  After command completion occurred, registers were:
  ER -- ST COUNT  LBA_48  LH LM LL DV DC
  -- -- -- == -- == == == -- -- -- -- --
  00 -- d0 00 10 00 00 00 00 14 0f e0 00   16 sectors at LBA = 0x0000140f = 5135

  Commands leading to the command that caused the error were:
  CR FEATR COUNT  LBA_48  LH LM LL DV DC  Powered_Up_Time  Command/Feature_Name
  -- == -- == -- == == == -- -- -- -- --  ---------------  --------------------
  25 00 03 00 f0 00 00 00 00 13 1f e0 00     00:03:24.180  READ DMA EXT
  25 00 03 00 06 00 00 00 00 12 19 e0 00     00:03:24.180  READ DMA EXT
  25 00 03 00 02 00 00 00 00 12 17 e0 00     00:03:24.180  READ DMA EXT
  25 00 03 00 06 00 00 00 00 12 11 e0 00     00:03:24.180  READ DMA EXT
  25 00 03 00 02 00 00 00 00 12 0f e0 00     00:03:24.180  READ DMA EXT

Error 8 [7] occurred at disk power-on lifetime: 26143 hours (1089 days + 7 hours)
  When the command that caused the error occurred, the device was active or idle.

  After command completion occurred, registers were:
  ER -- ST COUNT  LBA_48  LH LM LL DV DC
  -- -- -- == -- == == == -- -- -- -- --
  84 -- 51 00 00 00 00 00 00 11 de e0 00  Error: ICRC, ABRT at LBA = 0x000011de = 4574

  Commands leading to the command that caused the error were:
  CR FEATR COUNT  LBA_48  LH LM LL DV DC  Powered_Up_Time  Command/Feature_Name
  -- == -- == -- == == == -- -- -- -- --  ---------------  --------------------
  25 00 03 00 06 00 00 00 00 11 d9 e0 00     00:03:24.070  READ DMA EXT
  25 00 03 00 02 00 00 00 00 11 d7 e0 00     00:03:24.070  READ DMA EXT
  25 00 03 00 06 00 00 00 00 11 d1 e0 00     00:03:24.060  READ DMA EXT
  25 00 03 00 02 00 00 00 00 11 cf e0 00     00:03:24.060  READ DMA EXT
  25 00 03 00 06 00 00 00 00 11 c9 e0 00     00:03:24.060  READ DMA EXT

SMART Extended Self-test Log Version: 1 (2 sectors)
No self-tests have been logged.  [To run self-tests, use: smartctl -t]

SMART Selective self-test log data structure revision number 1
 SPAN  MIN_LBA  MAX_LBA  CURRENT_TEST_STATUS
    1        0        0  Not_testing
    2        0        0  Not_testing
    3        0        0  Not_testing
    4        0        0  Not_testing
    5        0        0  Not_testing
Selective self-test flags (0x0):
  After scanning selected spans, do NOT read-scan remainder of disk.
If Selective self-test is pending on power-up, resume after 0 minute delay.

SCT Status Version:                  2
SCT Version (vendor specific):       256 (0x0100)
Device State:                        Active (0)
Current Temperature:                    13 Celsius
Power Cycle Min/Max Temperature:     --/14 Celsius
Lifetime    Min/Max Temperature:     --/58 Celsius

SCT Temperature History Version:     2
Temperature Sampling Period:         1 minute
Temperature Logging Interval:        1 minute
Min/Max recommended Temperature:     -4/72 Celsius
Min/Max Temperature Limit:           -9/77 Celsius
Temperature History Size (Index):    128 (6)

SCT Error Recovery Control:
           Read: Disabled
          Write: Disabled

ATA_READ_LOG_EXT (addr=0x04:0x00, page=0, n=1) failed: scsi error badly formed scsi parameters
Read Device Statistics page 0x00 failed

Pending Defects log (GP Log 0x0c) not supported

SATA Phy Event Counters (GP Log 0x11)
ID      Size     Value  Description
0x000a  2            3  Device-to-host register FISes sent due to a COMRESET
0x0001  2            0  Command failed due to ICRC error
0x0002  2            0  R_ERR response for data FIS
0x0003  2            0  R_ERR response for device-to-host data FIS
0x0004  2            0  R_ERR response for host-to-device data FIS
0x0005  2            0  R_ERR response for non-data FIS
0x0006  2            0  R_ERR response for device-to-host non-data FIS
0x0007  2            0  R_ERR response for host-to-device non-data FIS
0x0008  2            0  Device-to-host non-data FIS retries
0x0009  2            2  Transition from drive PhyRdy to drive PhyNRdy
0x000b  2            0  CRC errors within host-to-device FIS
0x000d  2            0  Non-CRC errors within host-to-device FIS
0x000f  2            0  R_ERR response for host-to-device data FIS, CRC
0x0010  2            0  R_ERR response for host-to-device data FIS, non-CRC
0x0012  2            0  R_ERR response for host-to-device non-data FIS, CRC
0x0013  2            0  R_ERR response for host-to-device non-data FIS, non-CRC

