smartctl 7.4 2023-08-01 r5530 [x86_64-linux-6.6.27-generic-3rosa2021.1-x86_64] (local build)
Copyright (C) 2002-23, Bruce Allen, Christian Franke, www.smartmontools.org

=== START OF INFORMATION SECTION ===
Model Number:                       WDC PC SN520 SDAPMUW-512G-1101
Serial Number:                      --
Firmware Version:                   20290001
PCI Vendor/Subsystem ID:            0x15b7
IEEE OUI Identifier:                0x001b44
Total NVM Capacity:                 512,110,190,592 [512 GB]
Unallocated NVM Capacity:           0
Controller ID:                      1
NVMe Version:                       1.3
Number of Namespaces:               1
Namespace 1 Size/Capacity:          512,110,190,592 [512 GB]
Namespace 1 Formatted LBA Size:     512
Namespace 1 IEEE EUI-64:            001b44 ...
Local Time is:                      Fri May 31 17:11:26 2024 MSK
Firmware Updates (0x14):            2 Slots, no Reset required
Optional Admin Commands (0x0017):   Security Format Frmw_DL Self_Test
Optional NVM Commands (0x001f):     Comp Wr_Unc DS_Mngmt Wr_Zero Sav/Sel_Feat
Log Page Attributes (0x02):         Cmd_Eff_Lg
Maximum Data Transfer Size:         128 Pages
Warning  Comp. Temp. Threshold:     82 Celsius
Critical Comp. Temp. Threshold:     86 Celsius
Namespace 1 Features (0x02):        NA_Fields

Supported Power States
St Op     Max   Active     Idle   RL RT WL WT  Ent_Lat  Ex_Lat
 0 +     3.00W       -        -    0  0  0  0        0       0
 1 +     2.60W       -        -    1  1  1  1        0       0
 2 +     1.70W       -        -    2  2  2  2        0       0
 3 -   0.0250W       -        -    3  3  3  3     5000    9000
 4 -   0.0035W       -        -    4  4  4  4     5000   44000

Supported LBA Sizes (NSID 0x1)
Id Fmt  Data  Metadt  Rel_Perf
 0 +     512       0         2
 1 -    4096       0         1

=== START OF SMART DATA SECTION ===
SMART overall-health self-assessment test result: PASSED

SMART/Health Information (NVMe Log 0x02)
Critical Warning:                   0x00
Temperature:                        41 Celsius
Available Spare:                    100%
Available Spare Threshold:          10%
Percentage Used:                    1%
Data Units Read:                    22,599,849 [11.5 TB]
Data Units Written:                 19,063,782 [9.76 TB]
Host Read Commands:                 243,827,052
Host Write Commands:                120,266,454
Controller Busy Time:               781
Power Cycles:                       2,036
Power On Hours:                     1,241
Unsafe Shutdowns:                   552
Media and Data Integrity Errors:    0
Error Information Log Entries:      0
Warning  Comp. Temperature Time:    0
Critical Comp. Temperature Time:    0
Thermal Temp. 1 Transition Count:   9
Thermal Temp. 1 Total Time:         1

Error Information (NVMe Log 0x01, 16 of 256 entries)
No Errors Logged

Read Self-test Log failed: Invalid Field in Command (0x4002)

