smartctl 7.4 2023-08-01 r5530 [x86_64-linux-6.4.11-desktop-1omv2390] (OpenMandriva Lx 7.4-1)
Copyright (C) 2002-23, Bruce Allen, Christian Franke, www.smartmontools.org

=== START OF INFORMATION SECTION ===
Model Family:     Seagate Laptop HDD
Device Model:     ST500LT012-1DG142
Serial Number:    --
LU WWN Device Id: 5 000c50 ...
Firmware Version: 0002LVM1
User Capacity:    500,107,862,016 bytes [500 GB]
Sector Sizes:     512 bytes logical, 4096 bytes physical
Rotation Rate:    5400 rpm
Form Factor:      2.5 inches
Device is:        In smartctl database
ATA Version is:   ATA8-ACS T13/1699-D revision 4
SATA Version is:  SATA 3.0, 6.0 Gb/s (current: 6.0 Gb/s)
Local Time is:    Sun Nov 12 18:25:59 2023 GMT
SMART support is: Available - device has SMART capability.
SMART support is: Enabled
AAM feature is:   Unavailable
APM level is:     254 (maximum performance)
Rd look-ahead is: Enabled
Write cache is:   Enabled
DSN feature is:   Unavailable
ATA Security is:  Disabled, frozen [SEC2]
Wt Cache Reorder: Enabled

=== START OF READ SMART DATA SECTION ===
SMART overall-health self-assessment test result: PASSED

General SMART Values:
Offline data collection status:  (0x82)	Offline data collection activity
					was completed without error.
					Auto Offline Data Collection: Enabled.
Self-test execution status:      (   0)	The previous self-test routine completed
					without error or no self-test has ever 
					been run.
Total time to complete Offline 
data collection: 		(    0) seconds.
Offline data collection
capabilities: 			 (0x7b) SMART execute Offline immediate.
					Auto Offline data collection on/off support.
					Suspend Offline collection upon new
					command.
					Offline surface scan supported.
					Self-test supported.
					Conveyance Self-test supported.
					Selective Self-test supported.
SMART capabilities:            (0x0003)	Saves SMART data before entering
					power-saving mode.
					Supports SMART auto save timer.
Error logging capability:        (0x01)	Error logging supported.
					General Purpose Logging supported.
Short self-test routine 
recommended polling time: 	 (   1) minutes.
Extended self-test routine
recommended polling time: 	 ( 105) minutes.
Conveyance self-test routine
recommended polling time: 	 (   2) minutes.
SCT capabilities: 	       (0x1031)	SCT Status supported.
					SCT Feature Control supported.
					SCT Data Table supported.

SMART Attributes Data Structure revision number: 10
Vendor Specific SMART Attributes with Thresholds:
ID# ATTRIBUTE_NAME          FLAGS    VALUE WORST THRESH FAIL RAW_VALUE
  1 Raw_Read_Error_Rate     POSR--   113   090   034    -    50724520
  3 Spin_Up_Time            PO----   099   099   000    -    0
  4 Start_Stop_Count        -O--CK   085   085   020    -    16117
  5 Reallocated_Sector_Ct   PO--CK   100   100   036    -    0
  7 Seek_Error_Rate         POSR--   080   060   030    -    17617262790
  9 Power_On_Hours          -O--CK   084   084   000    -    14730
 10 Spin_Retry_Count        PO--C-   100   100   097    -    0
 12 Power_Cycle_Count       -O--CK   096   096   020    -    4579
184 End-to-End_Error        -O--CK   100   100   099    -    0
187 Reported_Uncorrect      -O--CK   001   001   000    -    2382
188 Command_Timeout         -O--CK   100   100   000    -    4295032839
189 High_Fly_Writes         -O-RCK   100   100   000    -    0
190 Airflow_Temperature_Cel -O---K   066   055   045    -    34 (Min/Max 32/36)
191 G-Sense_Error_Rate      -O--CK   100   100   000    -    1257
192 Power-Off_Retract_Count -O--CK   100   100   000    -    247
193 Load_Cycle_Count        -O--CK   060   060   000    -    81959
194 Temperature_Celsius     -O---K   034   045   000    -    34 (0 2 0 0 0)
197 Current_Pending_Sector  -O--C-   100   100   000    -    0
198 Offline_Uncorrectable   ----C-   100   100   000    -    0
199 UDMA_CRC_Error_Count    -OSRCK   200   200   000    -    0
254 Free_Fall_Sensor        -O--CK   100   100   000    -    0
                            ||||||_ K auto-keep
                            |||||__ C event count
                            ||||___ R error rate
                            |||____ S speed/performance
                            ||_____ O updated online
                            |______ P prefailure warning

General Purpose Log Directory Version 1
SMART           Log Directory Version 1 [multi-sector log support]
Address    Access  R/W   Size  Description
0x00       GPL,SL  R/O      1  Log Directory
0x01           SL  R/O      1  Summary SMART error log
0x02           SL  R/O      5  Comprehensive SMART error log
0x03       GPL     R/O      5  Ext. Comprehensive SMART error log
0x06           SL  R/O      1  SMART self-test log
0x07       GPL     R/O      1  Extended self-test log
0x09           SL  R/W      1  Selective self-test log
0x10       GPL     R/O      1  NCQ Command Error log
0x11       GPL     R/O      1  SATA Phy Event Counters log
0x21       GPL     R/O      1  Write stream error log
0x22       GPL     R/O      1  Read stream error log
0x80-0x9f  GPL,SL  R/W     16  Host vendor specific log
0xa1       GPL,SL  VS      20  Device vendor specific log
0xa2       GPL     VS    2248  Device vendor specific log
0xa8       GPL,SL  VS      65  Device vendor specific log
0xa9       GPL,SL  VS       1  Device vendor specific log
0xab       GPL     VS       1  Device vendor specific log
0xb0       GPL     VS    2864  Device vendor specific log
0xbd-0xbf  GPL     VS   65535  Device vendor specific log
0xc0       GPL,SL  VS       1  Device vendor specific log
0xc1       GPL,SL  VS      10  Device vendor specific log
0xc3       GPL,SL  VS       8  Device vendor specific log
0xc4       GPL,SL  VS      18  Device vendor specific log
0xe0       GPL,SL  R/W      1  SCT Command/Status
0xe1       GPL,SL  R/W      1  SCT Data Transfer

SMART Extended Comprehensive Error Log Version: 1 (5 sectors)
Device Error Count: 2382 (device log contains only the most recent 20 errors)
	CR     = Command Register
	FEATR  = Features Register
	COUNT  = Count (was: Sector Count) Register
	LBA_48 = Upper bytes of LBA High/Mid/Low Registers ]  ATA-8
	LH     = LBA High (was: Cylinder High) Register    ]   LBA
	LM     = LBA Mid (was: Cylinder Low) Register      ] Register
	LL     = LBA Low (was: Sector Number) Register     ]
	DV     = Device (was: Device/Head) Register
	DC     = Device Control Register
	ER     = Error register
	ST     = Status register
Powered_Up_Time is measured from power on, and printed as
DDd+hh:mm:SS.sss where DD=days, hh=hours, mm=minutes,
SS=sec, and sss=millisec. It "wraps" after 49.710 days.

Error 2382 [1] occurred at disk power-on lifetime: 11871 hours (494 days + 15 hours)
  When the command that caused the error occurred, the device was active or idle.

  After command completion occurred, registers were:
  ER -- ST COUNT  LBA_48  LH LM LL DV DC
  -- -- -- == -- == == == -- -- -- -- --
  40 -- 51 00 00 00 00 00 75 cb 4f 00 00  Error: UNC at LBA = 0x0075cb4f = 7719759

  Commands leading to the command that caused the error were:
  CR FEATR COUNT  LBA_48  LH LM LL DV DC  Powered_Up_Time  Command/Feature_Name
  -- == -- == -- == == == -- -- -- -- --  ---------------  --------------------
  60 00 00 00 01 00 00 00 75 cb 4f 40 00     10:26:54.381  READ FPDMA QUEUED
  2f 00 00 00 01 00 00 00 00 00 10 e0 00     10:26:54.380  READ LOG EXT
  61 00 00 00 08 00 00 00 6d 43 a0 40 00     10:26:51.913  WRITE FPDMA QUEUED
  60 00 00 00 01 00 00 00 75 cb 4e 40 00     10:26:51.912  READ FPDMA QUEUED
  ea 00 00 00 00 00 00 00 00 00 00 a0 00     10:26:51.895  FLUSH CACHE EXT

Error 2381 [0] occurred at disk power-on lifetime: 11871 hours (494 days + 15 hours)
  When the command that caused the error occurred, the device was active or idle.

  After command completion occurred, registers were:
  ER -- ST COUNT  LBA_48  LH LM LL DV DC
  -- -- -- == -- == == == -- -- -- -- --
  40 -- 51 00 00 00 00 00 75 cb 4e 00 00  Error: WP at LBA = 0x0075cb4e = 7719758

  Commands leading to the command that caused the error were:
  CR FEATR COUNT  LBA_48  LH LM LL DV DC  Powered_Up_Time  Command/Feature_Name
  -- == -- == -- == == == -- -- -- -- --  ---------------  --------------------
  61 00 00 00 08 00 00 00 6d 43 a0 40 00     10:26:51.913  WRITE FPDMA QUEUED
  60 00 00 00 01 00 00 00 75 cb 4e 40 00     10:26:51.912  READ FPDMA QUEUED
  ea 00 00 00 00 00 00 00 00 00 00 a0 00     10:26:51.895  FLUSH CACHE EXT
  61 00 00 00 08 00 00 00 6d 44 30 40 00     10:26:51.895  WRITE FPDMA QUEUED
  61 00 00 00 68 00 00 00 6d 5d 58 40 00     10:26:51.894  WRITE FPDMA QUEUED

Error 2380 [19] occurred at disk power-on lifetime: 11871 hours (494 days + 15 hours)
  When the command that caused the error occurred, the device was active or idle.

  After command completion occurred, registers were:
  ER -- ST COUNT  LBA_48  LH LM LL DV DC
  -- -- -- == -- == == == -- -- -- -- --
  40 -- 51 00 00 00 00 00 75 cb 4d 00 00  Error: UNC at LBA = 0x0075cb4d = 7719757

  Commands leading to the command that caused the error were:
  CR FEATR COUNT  LBA_48  LH LM LL DV DC  Powered_Up_Time  Command/Feature_Name
  -- == -- == -- == == == -- -- -- -- --  ---------------  --------------------
  60 00 00 00 01 00 00 00 75 cb 4d 40 00     10:26:49.354  READ FPDMA QUEUED
  2f 00 00 00 01 00 00 00 00 00 10 e0 00     10:26:49.353  READ LOG EXT
  60 00 00 00 01 00 00 00 75 cb 4c 40 00     10:26:46.903  READ FPDMA QUEUED
  61 00 00 00 08 00 00 00 1a 1f 78 40 00     10:26:46.890  WRITE FPDMA QUEUED
  2f 00 00 00 01 00 00 00 00 00 10 e0 00     10:26:46.890  READ LOG EXT

Error 2379 [18] occurred at disk power-on lifetime: 11871 hours (494 days + 15 hours)
  When the command that caused the error occurred, the device was active or idle.

  After command completion occurred, registers were:
  ER -- ST COUNT  LBA_48  LH LM LL DV DC
  -- -- -- == -- == == == -- -- -- -- --
  40 -- 51 00 00 00 00 00 75 cb 4c 00 00  Error: UNC at LBA = 0x0075cb4c = 7719756

  Commands leading to the command that caused the error were:
  CR FEATR COUNT  LBA_48  LH LM LL DV DC  Powered_Up_Time  Command/Feature_Name
  -- == -- == -- == == == -- -- -- -- --  ---------------  --------------------
  60 00 00 00 01 00 00 00 75 cb 4c 40 00     10:26:46.903  READ FPDMA QUEUED
  61 00 00 00 08 00 00 00 1a 1f 78 40 00     10:26:46.890  WRITE FPDMA QUEUED
  2f 00 00 00 01 00 00 00 00 00 10 e0 00     10:26:46.890  READ LOG EXT
  60 00 00 00 01 00 00 00 75 cb 4b 40 00     10:26:44.328  READ FPDMA QUEUED
  2f 00 00 00 01 00 00 00 00 00 10 e0 00     10:26:44.328  READ LOG EXT

Error 2378 [17] occurred at disk power-on lifetime: 11871 hours (494 days + 15 hours)
  When the command that caused the error occurred, the device was active or idle.

  After command completion occurred, registers were:
  ER -- ST COUNT  LBA_48  LH LM LL DV DC
  -- -- -- == -- == == == -- -- -- -- --
  40 -- 51 00 00 00 00 00 75 cb 4b 00 00  Error: UNC at LBA = 0x0075cb4b = 7719755

  Commands leading to the command that caused the error were:
  CR FEATR COUNT  LBA_48  LH LM LL DV DC  Powered_Up_Time  Command/Feature_Name
  -- == -- == -- == == == -- -- -- -- --  ---------------  --------------------
  60 00 00 00 01 00 00 00 75 cb 4b 40 00     10:26:44.328  READ FPDMA QUEUED
  2f 00 00 00 01 00 00 00 00 00 10 e0 00     10:26:44.328  READ LOG EXT
  60 00 00 00 01 00 00 00 75 cb 4a 40 00     10:26:41.855  READ FPDMA QUEUED
  60 00 00 00 08 00 00 04 c6 18 08 40 00     10:26:41.839  READ FPDMA QUEUED
  60 00 00 00 28 00 00 04 c6 17 e0 40 00     10:26:41.829  READ FPDMA QUEUED

Error 2377 [16] occurred at disk power-on lifetime: 11871 hours (494 days + 15 hours)
  When the command that caused the error occurred, the device was active or idle.

  After command completion occurred, registers were:
  ER -- ST COUNT  LBA_48  LH LM LL DV DC
  -- -- -- == -- == == == -- -- -- -- --
  40 -- 51 00 00 00 00 00 75 cb 4a 00 00  Error: UNC at LBA = 0x0075cb4a = 7719754

  Commands leading to the command that caused the error were:
  CR FEATR COUNT  LBA_48  LH LM LL DV DC  Powered_Up_Time  Command/Feature_Name
  -- == -- == -- == == == -- -- -- -- --  ---------------  --------------------
  60 00 00 00 01 00 00 00 75 cb 4a 40 00     10:26:41.855  READ FPDMA QUEUED
  60 00 00 00 08 00 00 04 c6 18 08 40 00     10:26:41.839  READ FPDMA QUEUED
  60 00 00 00 28 00 00 04 c6 17 e0 40 00     10:26:41.829  READ FPDMA QUEUED
  60 00 00 00 10 00 00 00 27 5d b8 40 00     10:26:41.827  READ FPDMA QUEUED
  60 00 00 00 10 00 00 00 27 5d b0 40 00     10:26:41.827  READ FPDMA QUEUED

Error 2376 [15] occurred at disk power-on lifetime: 11871 hours (494 days + 15 hours)
  When the command that caused the error occurred, the device was active or idle.

  After command completion occurred, registers were:
  ER -- ST COUNT  LBA_48  LH LM LL DV DC
  -- -- -- == -- == == == -- -- -- -- --
  40 -- 51 00 00 00 00 00 75 cb 49 00 00  Error: UNC at LBA = 0x0075cb49 = 7719753

  Commands leading to the command that caused the error were:
  CR FEATR COUNT  LBA_48  LH LM LL DV DC  Powered_Up_Time  Command/Feature_Name
  -- == -- == -- == == == -- -- -- -- --  ---------------  --------------------
  60 00 00 00 10 00 00 00 27 5d a8 40 00     10:26:39.330  READ FPDMA QUEUED
  61 00 00 00 08 00 00 00 6d 43 b0 40 00     10:26:39.330  WRITE FPDMA QUEUED
  60 00 00 00 01 00 00 00 75 cb 49 40 00     10:26:39.330  READ FPDMA QUEUED
  60 00 00 00 18 00 00 00 27 5d c0 40 00     10:26:39.329  READ FPDMA QUEUED
  61 00 00 00 d0 00 00 00 6d 5c 88 40 00     10:26:39.329  WRITE FPDMA QUEUED

Error 2375 [14] occurred at disk power-on lifetime: 11871 hours (494 days + 15 hours)
  When the command that caused the error occurred, the device was active or idle.

  After command completion occurred, registers were:
  ER -- ST COUNT  LBA_48  LH LM LL DV DC
  -- -- -- == -- == == == -- -- -- -- --
  40 -- 51 00 00 00 00 00 75 cb 48 00 00  Error: UNC at LBA = 0x0075cb48 = 7719752

  Commands leading to the command that caused the error were:
  CR FEATR COUNT  LBA_48  LH LM LL DV DC  Powered_Up_Time  Command/Feature_Name
  -- == -- == -- == == == -- -- -- -- --  ---------------  --------------------
  60 00 00 00 01 00 00 00 75 cb 48 40 00     10:26:36.783  READ FPDMA QUEUED
  ef 00 90 00 03 00 00 00 00 00 00 a0 00     10:26:36.410  SET FEATURES [Disable SATA feature]
  ef 00 02 00 00 00 00 00 00 00 00 a0 00     10:26:36.392  SET FEATURES [Enable write cache]
  00 00 00 00 00 00 00 00 00 00 00 00 ff     10:26:36.272  NOP [Abort queued commands]
  60 00 00 00 01 00 00 00 75 cb 48 40 00     10:26:33.750  READ FPDMA QUEUED

SMART Extended Self-test Log Version: 1 (1 sectors)
Num  Test_Description    Status                  Remaining  LifeTime(hours)  LBA_of_first_error
# 1  Short offline       Completed without error       00%     11974         -
# 2  Vendor (0x50)       Completed without error       00%      1595         -
# 3  Short offline       Completed without error       00%      1595         -
# 4  Vendor (0x50)       Completed without error       00%      1121         -
# 5  Short offline       Completed without error       00%      1121         -
# 6  Vendor (0x50)       Completed without error       00%       366         -
# 7  Short offline       Completed without error       00%       366         -
# 8  Vendor (0x50)       Completed without error       00%        88         -
# 9  Short offline       Completed without error       00%        88         -

SMART Selective self-test log data structure revision number 1
 SPAN  MIN_LBA  MAX_LBA  CURRENT_TEST_STATUS
    1        0        0  Not_testing
    2        0        0  Not_testing
    3        0        0  Not_testing
    4        0        0  Not_testing
    5        0        0  Not_testing
Selective self-test flags (0x0):
  After scanning selected spans, do NOT read-scan remainder of disk.
If Selective self-test is pending on power-up, resume after 0 minute delay.

SCT Status Version:                  3
SCT Version (vendor specific):       522 (0x020a)
Device State:                        Active (0)
Current Temperature:                    34 Celsius
Power Cycle Min/Max Temperature:     32/36 Celsius
Lifetime    Min/Max Temperature:      1/47 Celsius
Under/Over Temperature Limit Count:   0/30
Vendor specific:
00 00 00 00 00 00 00 00 00 00 02 00 00 00 00 00
00 00 00 00 00 00 00 00 00 00 00 00 00 00 00 00

SCT Temperature History Version:     2
Temperature Sampling Period:         1 minute
Temperature Logging Interval:        11 minutes
Min/Max recommended Temperature:      0/ 0 Celsius
Min/Max Temperature Limit:            0/ 0 Celsius
Temperature History Size (Index):    128 (110)

SCT Error Recovery Control command not supported

Device Statistics (GP/SMART Log 0x04) not supported

Pending Defects log (GP Log 0x0c) not supported

SATA Phy Event Counters (GP Log 0x11)
ID      Size     Value  Description
0x000a  2           14  Device-to-host register FISes sent due to a COMRESET
0x0001  2            0  Command failed due to ICRC error
0x0003  2            0  R_ERR response for device-to-host data FIS
0x0004  2            0  R_ERR response for host-to-device data FIS
0x0006  2            0  R_ERR response for device-to-host non-data FIS
0x0007  2            0  R_ERR response for host-to-device non-data FIS



