smartctl 7.4 2023-08-01 r5530 [x86_64-linux-6.8.0-58-generic] (local build)
Copyright (C) 2002-23, Bruce Allen, Christian Franke, www.smartmontools.org

=== START OF INFORMATION SECTION ===
Model Family:     Seagate Laptop HDD
Device Model:     ST500LT012-1DG142
Serial Number:    --
LU WWN Device Id: 5 000c50 ...
Firmware Version: 0001SDM1
User Capacity:    500,107,862,016 bytes [500 GB]
Sector Sizes:     512 bytes logical, 4096 bytes physical
Rotation Rate:    5400 rpm
Form Factor:      2.5 inches
Device is:        In smartctl database 7.3/5528
ATA Version is:   ATA8-ACS T13/1699-D revision 4
SATA Version is:  SATA 3.0, 6.0 Gb/s (current: 6.0 Gb/s)
Local Time is:    Sat Apr 26 13:27:45 2025 CEST
SMART support is: Available - device has SMART capability.
SMART support is: Enabled
AAM feature is:   Unavailable
APM level is:     254 (maximum performance)
Rd look-ahead is: Enabled
Write cache is:   Enabled
DSN feature is:   Unavailable
ATA Security is:  Disabled, frozen [SEC2]
Wt Cache Reorder: Enabled

=== START OF READ SMART DATA SECTION ===
SMART overall-health self-assessment test result: PASSED

General SMART Values:
Offline data collection status:  (0x82)	Offline data collection activity
					was completed without error.
					Auto Offline Data Collection: Enabled.
Self-test execution status:      (   0)	The previous self-test routine completed
					without error or no self-test has ever 
					been run.
Total time to complete Offline 
data collection: 		(    0) seconds.
Offline data collection
capabilities: 			 (0x7b) SMART execute Offline immediate.
					Auto Offline data collection on/off support.
					Suspend Offline collection upon new
					command.
					Offline surface scan supported.
					Self-test supported.
					Conveyance Self-test supported.
					Selective Self-test supported.
SMART capabilities:            (0x0003)	Saves SMART data before entering
					power-saving mode.
					Supports SMART auto save timer.
Error logging capability:        (0x01)	Error logging supported.
					General Purpose Logging supported.
Short self-test routine 
recommended polling time: 	 (   1) minutes.
Extended self-test routine
recommended polling time: 	 ( 102) minutes.
Conveyance self-test routine
recommended polling time: 	 (   2) minutes.
SCT capabilities: 	       (0x1035)	SCT Status supported.
					SCT Feature Control supported.
					SCT Data Table supported.

SMART Attributes Data Structure revision number: 10
Vendor Specific SMART Attributes with Thresholds:
ID# ATTRIBUTE_NAME          FLAGS    VALUE WORST THRESH FAIL RAW_VALUE
  1 Raw_Read_Error_Rate     POSR--   120   099   006    -    240385520
  3 Spin_Up_Time            PO----   099   099   000    -    0
  4 Start_Stop_Count        -O--CK   097   097   020    -    3584
  5 Reallocated_Sector_Ct   PO--CK   100   100   036    -    24
  7 Seek_Error_Rate         POSR--   072   060   030    -    60442169131
  9 Power_On_Hours          -O--CK   097   097   000    -    3466 (249 166 0)
 10 Spin_Retry_Count        PO--C-   100   100   097    -    0
 12 Power_Cycle_Count       -O--CK   097   097   020    -    3480
184 End-to-End_Error        -O--CK   100   100   099    -    0
187 Reported_Uncorrect      -O--CK   031   031   000    -    69
188 Command_Timeout         -O--CK   100   001   000    -    8590066618
189 High_Fly_Writes         -O-RCK   100   100   000    -    0
190 Airflow_Temperature_Cel -O---K   061   048   045    -    39 (Min/Max 33/41)
191 G-Sense_Error_Rate      -O--CK   100   100   000    -    1423
192 Power-Off_Retract_Count -O--CK   100   100   000    -    52
193 Load_Cycle_Count        -O--CK   096   096   000    -    8856
194 Temperature_Celsius     -O---K   039   052   000    -    39 (0 14 0 0 0)
197 Current_Pending_Sector  -O--C-   100   100   000    -    0
198 Offline_Uncorrectable   ----C-   100   100   000    -    0
199 UDMA_CRC_Error_Count    -OSRCK   200   198   000    -    1185
240 Head_Flying_Hours       ------   097   097   000    -    3449 (123 39 0)
241 Total_LBAs_Written      ------   100   253   000    -    23867432760
242 Total_LBAs_Read         ------   100   253   000    -    38995584059
254 Free_Fall_Sensor        -O--CK   100   100   000    -    0
                            ||||||_ K auto-keep
                            |||||__ C event count
                            ||||___ R error rate
                            |||____ S speed/performance
                            ||_____ O updated online
                            |______ P prefailure warning

General Purpose Log Directory Version 1
SMART           Log Directory Version 1 [multi-sector log support]
Address    Access  R/W   Size  Description
0x00       GPL,SL  R/O      1  Log Directory
0x01           SL  R/O      1  Summary SMART error log
0x02           SL  R/O      5  Comprehensive SMART error log
0x03       GPL     R/O      5  Ext. Comprehensive SMART error log
0x06           SL  R/O      1  SMART self-test log
0x07       GPL     R/O      1  Extended self-test log
0x09           SL  R/W      1  Selective self-test log
0x10       GPL     R/O      1  NCQ Command Error log
0x11       GPL     R/O      1  SATA Phy Event Counters log
0x21       GPL     R/O      1  Write stream error log
0x22       GPL     R/O      1  Read stream error log
0x80-0x9f  GPL,SL  R/W     16  Host vendor specific log
0xa1       GPL,SL  VS      20  Device vendor specific log
0xa2       GPL     VS    2248  Device vendor specific log
0xa8       GPL,SL  VS      65  Device vendor specific log
0xa9       GPL,SL  VS       1  Device vendor specific log
0xab       GPL     VS       1  Device vendor specific log
0xb0       GPL     VS    2864  Device vendor specific log
0xbd-0xbf  GPL     VS   65535  Device vendor specific log
0xc0       GPL,SL  VS       1  Device vendor specific log
0xc1       GPL,SL  VS      10  Device vendor specific log
0xc3       GPL,SL  VS       8  Device vendor specific log
0xc4       GPL,SL  VS      18  Device vendor specific log
0xe0       GPL,SL  R/W      1  SCT Command/Status
0xe1       GPL,SL  R/W      1  SCT Data Transfer

SMART Extended Comprehensive Error Log Version: 1 (5 sectors)
Device Error Count: 69 (device log contains only the most recent 20 errors)
	CR     = Command Register
	FEATR  = Features Register
	COUNT  = Count (was: Sector Count) Register
	LBA_48 = Upper bytes of LBA High/Mid/Low Registers ]  ATA-8
	LH     = LBA High (was: Cylinder High) Register    ]   LBA
	LM     = LBA Mid (was: Cylinder Low) Register      ] Register
	LL     = LBA Low (was: Sector Number) Register     ]
	DV     = Device (was: Device/Head) Register
	DC     = Device Control Register
	ER     = Error register
	ST     = Status register
Powered_Up_Time is measured from power on, and printed as
DDd+hh:mm:SS.sss where DD=days, hh=hours, mm=minutes,
SS=sec, and sss=millisec. It "wraps" after 49.710 days.

Error 69 [8] occurred at disk power-on lifetime: 1315 hours (54 days + 19 hours)
  When the command that caused the error occurred, the device was active or idle.

  After command completion occurred, registers were:
  ER -- ST COUNT  LBA_48  LH LM LL DV DC
  -- -- -- == -- == == == -- -- -- -- --
  40 -- 51 00 00 00 00 00 98 4b 4f 00 00  Error: UNC at LBA = 0x00984b4f = 9980751

  Commands leading to the command that caused the error were:
  CR FEATR COUNT  LBA_48  LH LM LL DV DC  Powered_Up_Time  Command/Feature_Name
  -- == -- == -- == == == -- -- -- -- --  ---------------  --------------------
  60 00 00 00 01 00 00 00 98 4b 4f 40 00     01:20:51.402  READ FPDMA QUEUED
  2f 00 00 00 01 00 00 00 00 00 10 e0 00     01:20:51.402  READ LOG EXT
  60 00 00 00 01 00 00 00 98 4b 4e 40 00     01:20:48.861  READ FPDMA QUEUED
  2f 00 00 00 01 00 00 00 00 00 10 e0 00     01:20:48.861  READ LOG EXT
  60 00 00 00 01 00 00 00 98 4b 4d 40 00     01:20:46.399  READ FPDMA QUEUED

Error 68 [7] occurred at disk power-on lifetime: 1315 hours (54 days + 19 hours)
  When the command that caused the error occurred, the device was active or idle.

  After command completion occurred, registers were:
  ER -- ST COUNT  LBA_48  LH LM LL DV DC
  -- -- -- == -- == == == -- -- -- -- --
  40 -- 51 00 00 00 00 00 98 4b 4e 00 00  Error: UNC at LBA = 0x00984b4e = 9980750

  Commands leading to the command that caused the error were:
  CR FEATR COUNT  LBA_48  LH LM LL DV DC  Powered_Up_Time  Command/Feature_Name
  -- == -- == -- == == == -- -- -- -- --  ---------------  --------------------
  60 00 00 00 01 00 00 00 98 4b 4e 40 00     01:20:48.861  READ FPDMA QUEUED
  2f 00 00 00 01 00 00 00 00 00 10 e0 00     01:20:48.861  READ LOG EXT
  60 00 00 00 01 00 00 00 98 4b 4d 40 00     01:20:46.399  READ FPDMA QUEUED
  2f 00 00 00 01 00 00 00 00 00 10 e0 00     01:20:46.398  READ LOG EXT
  60 00 00 00 01 00 00 00 98 4b 4c 40 00     01:20:43.903  READ FPDMA QUEUED

Error 67 [6] occurred at disk power-on lifetime: 1315 hours (54 days + 19 hours)
  When the command that caused the error occurred, the device was active or idle.

  After command completion occurred, registers were:
  ER -- ST COUNT  LBA_48  LH LM LL DV DC
  -- -- -- == -- == == == -- -- -- -- --
  40 -- 51 00 00 00 00 00 98 4b 4d 00 00  Error: UNC at LBA = 0x00984b4d = 9980749

  Commands leading to the command that caused the error were:
  CR FEATR COUNT  LBA_48  LH LM LL DV DC  Powered_Up_Time  Command/Feature_Name
  -- == -- == -- == == == -- -- -- -- --  ---------------  --------------------
  60 00 00 00 01 00 00 00 98 4b 4d 40 00     01:20:46.399  READ FPDMA QUEUED
  2f 00 00 00 01 00 00 00 00 00 10 e0 00     01:20:46.398  READ LOG EXT
  60 00 00 00 01 00 00 00 98 4b 4c 40 00     01:20:43.903  READ FPDMA QUEUED
  61 00 00 00 40 00 00 06 1b 6a e0 40 00     01:20:43.879  WRITE FPDMA QUEUED
  2f 00 00 00 01 00 00 00 00 00 10 e0 00     01:20:43.879  READ LOG EXT

Error 66 [5] occurred at disk power-on lifetime: 1315 hours (54 days + 19 hours)
  When the command that caused the error occurred, the device was active or idle.

  After command completion occurred, registers were:
  ER -- ST COUNT  LBA_48  LH LM LL DV DC
  -- -- -- == -- == == == -- -- -- -- --
  40 -- 51 00 00 00 00 00 98 4b 4c 00 00  Error: UNC at LBA = 0x00984b4c = 9980748

  Commands leading to the command that caused the error were:
  CR FEATR COUNT  LBA_48  LH LM LL DV DC  Powered_Up_Time  Command/Feature_Name
  -- == -- == -- == == == -- -- -- -- --  ---------------  --------------------
  60 00 00 00 01 00 00 00 98 4b 4c 40 00     01:20:43.903  READ FPDMA QUEUED
  61 00 00 00 40 00 00 06 1b 6a e0 40 00     01:20:43.879  WRITE FPDMA QUEUED
  2f 00 00 00 01 00 00 00 00 00 10 e0 00     01:20:43.879  READ LOG EXT
  60 00 00 00 01 00 00 00 98 4b 4b 40 00     01:20:41.417  READ FPDMA QUEUED
  2f 00 00 00 01 00 00 00 00 00 10 e0 00     01:20:41.416  READ LOG EXT

Error 65 [4] occurred at disk power-on lifetime: 1315 hours (54 days + 19 hours)
  When the command that caused the error occurred, the device was active or idle.

  After command completion occurred, registers were:
  ER -- ST COUNT  LBA_48  LH LM LL DV DC
  -- -- -- == -- == == == -- -- -- -- --
  40 -- 51 00 00 00 00 00 98 4b 4b 00 00  Error: UNC at LBA = 0x00984b4b = 9980747

  Commands leading to the command that caused the error were:
  CR FEATR COUNT  LBA_48  LH LM LL DV DC  Powered_Up_Time  Command/Feature_Name
  -- == -- == -- == == == -- -- -- -- --  ---------------  --------------------
  60 00 00 00 01 00 00 00 98 4b 4b 40 00     01:20:41.417  READ FPDMA QUEUED
  2f 00 00 00 01 00 00 00 00 00 10 e0 00     01:20:41.416  READ LOG EXT
  60 00 00 00 01 00 00 00 98 4b 4a 40 00     01:20:38.886  READ FPDMA QUEUED
  61 00 00 00 40 00 00 06 1b 6a a0 40 00     01:20:38.864  WRITE FPDMA QUEUED
  2f 00 00 00 01 00 00 00 00 00 10 e0 00     01:20:38.864  READ LOG EXT

Error 64 [3] occurred at disk power-on lifetime: 1315 hours (54 days + 19 hours)
  When the command that caused the error occurred, the device was active or idle.

  After command completion occurred, registers were:
  ER -- ST COUNT  LBA_48  LH LM LL DV DC
  -- -- -- == -- == == == -- -- -- -- --
  40 -- 51 00 00 00 00 00 98 4b 4a 00 00  Error: UNC at LBA = 0x00984b4a = 9980746

  Commands leading to the command that caused the error were:
  CR FEATR COUNT  LBA_48  LH LM LL DV DC  Powered_Up_Time  Command/Feature_Name
  -- == -- == -- == == == -- -- -- -- --  ---------------  --------------------
  60 00 00 00 01 00 00 00 98 4b 4a 40 00     01:20:38.886  READ FPDMA QUEUED
  61 00 00 00 40 00 00 06 1b 6a a0 40 00     01:20:38.864  WRITE FPDMA QUEUED
  2f 00 00 00 01 00 00 00 00 00 10 e0 00     01:20:38.864  READ LOG EXT
  60 00 00 00 01 00 00 00 98 4b 49 40 00     01:20:36.415  READ FPDMA QUEUED
  61 00 00 00 40 00 00 06 1b 6a 60 40 00     01:20:36.398  WRITE FPDMA QUEUED

Error 63 [2] occurred at disk power-on lifetime: 1315 hours (54 days + 19 hours)
  When the command that caused the error occurred, the device was active or idle.

  After command completion occurred, registers were:
  ER -- ST COUNT  LBA_48  LH LM LL DV DC
  -- -- -- == -- == == == -- -- -- -- --
  40 -- 51 00 00 00 00 00 98 4b 49 00 00  Error: UNC at LBA = 0x00984b49 = 9980745

  Commands leading to the command that caused the error were:
  CR FEATR COUNT  LBA_48  LH LM LL DV DC  Powered_Up_Time  Command/Feature_Name
  -- == -- == -- == == == -- -- -- -- --  ---------------  --------------------
  60 00 00 00 01 00 00 00 98 4b 49 40 00     01:20:36.415  READ FPDMA QUEUED
  61 00 00 00 40 00 00 06 1b 6a 60 40 00     01:20:36.398  WRITE FPDMA QUEUED
  61 00 00 00 40 00 00 06 1b 6a e0 40 00     01:20:36.397  WRITE FPDMA QUEUED
  ea 00 00 00 00 00 00 00 00 00 00 a0 00     01:20:36.357  FLUSH CACHE EXT
  2f 00 00 00 01 00 00 00 00 00 10 e0 00     01:20:36.357  READ LOG EXT

Error 62 [1] occurred at disk power-on lifetime: 1315 hours (54 days + 19 hours)
  When the command that caused the error occurred, the device was active or idle.

  After command completion occurred, registers were:
  ER -- ST COUNT  LBA_48  LH LM LL DV DC
  -- -- -- == -- == == == -- -- -- -- --
  40 -- 51 00 00 00 00 00 98 4b 48 00 00  Error: WP at LBA = 0x00984b48 = 9980744

  Commands leading to the command that caused the error were:
  CR FEATR COUNT  LBA_48  LH LM LL DV DC  Powered_Up_Time  Command/Feature_Name
  -- == -- == -- == == == -- -- -- -- --  ---------------  --------------------
  61 00 00 00 18 00 00 00 7b b8 98 40 00     01:20:33.896  WRITE FPDMA QUEUED
  61 00 00 00 40 00 00 06 1b 6a a0 40 00     01:20:33.896  WRITE FPDMA QUEUED
  61 00 00 00 28 00 00 06 d5 03 38 40 00     01:20:33.896  WRITE FPDMA QUEUED
  60 00 00 00 01 00 00 00 98 4b 48 40 00     01:20:33.895  READ FPDMA QUEUED
  61 00 00 00 40 00 00 06 1b 6a 60 40 00     01:20:33.895  WRITE FPDMA QUEUED

SMART Extended Self-test Log Version: 1 (1 sectors)
No self-tests have been logged.  [To run self-tests, use: smartctl -t]

SMART Selective self-test log data structure revision number 1
 SPAN  MIN_LBA  MAX_LBA  CURRENT_TEST_STATUS
    1        0        0  Not_testing
    2        0        0  Not_testing
    3        0        0  Not_testing
    4        0        0  Not_testing
    5        0        0  Not_testing
Selective self-test flags (0x0):
  After scanning selected spans, do NOT read-scan remainder of disk.
If Selective self-test is pending on power-up, resume after 0 minute delay.

SCT Status Version:                  3
SCT Version (vendor specific):       522 (0x020a)
Device State:                        Active (0)
Current Temperature:                    39 Celsius
Power Cycle Min/Max Temperature:     33/41 Celsius
Lifetime    Min/Max Temperature:     14/52 Celsius
Specified Max Operating Temperature:    33 Celsius
Under/Over Temperature Limit Count:   0/0

SCT Temperature History Version:     2
Temperature Sampling Period:         1 minute
Temperature Logging Interval:        30 minutes
Min/Max recommended Temperature:     14/55 Celsius
Min/Max Temperature Limit:           10/60 Celsius
Temperature History Size (Index):    128 (61)

SCT Error Recovery Control command not supported

Device Statistics (GP/SMART Log 0x04) not supported

Pending Defects log (GP Log 0x0c) not supported

SATA Phy Event Counters (GP Log 0x11)
ID      Size     Value  Description
0x000a  2           13  Device-to-host register FISes sent due to a COMRESET
0x0001  2            0  Command failed due to ICRC error
0x0003  2            0  R_ERR response for device-to-host data FIS
0x0004  2            0  R_ERR response for host-to-device data FIS
0x0006  2            0  R_ERR response for device-to-host non-data FIS
0x0007  2            0  R_ERR response for host-to-device non-data FIS

