smartctl 7.3 2022-02-28 r5338 [x86_64-linux-5.19.1-zen1-1-zen] (local build)
Copyright (C) 2002-22, Bruce Allen, Christian Franke, www.smartmontools.org

=== START OF INFORMATION SECTION ===
Model Family:     Seagate Laptop HDD
Device Model:     ST500LT012-1DG142
Serial Number:    --
LU WWN Device Id: 5 000c50 ...
Firmware Version: 1003YAM1
User Capacity:    500,107,862,016 bytes [500 GB]
Sector Sizes:     512 bytes logical, 4096 bytes physical
Rotation Rate:    5400 rpm
Form Factor:      2.5 inches
Device is:        In smartctl database 7.3/5319
ATA Version is:   ATA8-ACS T13/1699-D revision 4
SATA Version is:  SATA 3.0, 6.0 Gb/s (current: 6.0 Gb/s)
Local Time is:    Sun Aug 21 15:05:11 2022 IST
SMART support is: Available - device has SMART capability.
SMART support is: Enabled
AAM feature is:   Unavailable
APM level is:     254 (maximum performance)
Rd look-ahead is: Enabled
Write cache is:   Enabled
DSN feature is:   Unavailable
ATA Security is:  Disabled, NOT FROZEN [SEC1]
Wt Cache Reorder: Enabled

=== START OF READ SMART DATA SECTION ===
SMART overall-health self-assessment test result: PASSED

General SMART Values:
Offline data collection status:  (0x82)	Offline data collection activity
					was completed without error.
					Auto Offline Data Collection: Enabled.
Self-test execution status:      (   0)	The previous self-test routine completed
					without error or no self-test has ever 
					been run.
Total time to complete Offline 
data collection: 		(    0) seconds.
Offline data collection
capabilities: 			 (0x5b) SMART execute Offline immediate.
					Auto Offline data collection on/off support.
					Suspend Offline collection upon new
					command.
					Offline surface scan supported.
					Self-test supported.
					No Conveyance Self-test supported.
					Selective Self-test supported.
SMART capabilities:            (0x0003)	Saves SMART data before entering
					power-saving mode.
					Supports SMART auto save timer.
Error logging capability:        (0x01)	Error logging supported.
					General Purpose Logging supported.
Short self-test routine 
recommended polling time: 	 (   2) minutes.
Extended self-test routine
recommended polling time: 	 ( 100) minutes.
SCT capabilities: 	       (0x103d)	SCT Status supported.
					SCT Error Recovery Control supported.
					SCT Feature Control supported.
					SCT Data Table supported.

SMART Attributes Data Structure revision number: 10
Vendor Specific SMART Attributes with Thresholds:
ID# ATTRIBUTE_NAME          FLAGS    VALUE WORST THRESH FAIL RAW_VALUE
  1 Raw_Read_Error_Rate     POSR-K   112   091   006    -    45168632
  3 Spin_Up_Time            PO---K   099   099   000    -    0
  4 Start_Stop_Count        -O--CK   100   100   000    -    235
  5 Reallocated_Sector_Ct   PO--CK   100   100   036    -    0
  7 Seek_Error_Rate         POSR-K   072   060   030    -    4309860373
  9 Power_On_Hours          -O--CK   100   100   000    -    268
 10 Spin_Retry_Count        PO--CK   100   100   097    -    0
 12 Power_Cycle_Count       -O--CK   100   100   000    -    234
183 Runtime_Bad_Block       -O--CK   100   100   000    -    0
184 End-to-End_Error        PO--CK   100   100   097    -    0
187 Reported_Uncorrect      -O--CK   001   001   000    -    401
188 Command_Timeout         -O--CK   100   100   000    -    5
189 High_Fly_Writes         -O-RCK   100   100   000    -    0
190 Airflow_Temperature_Cel -O---K   058   051   045    -    42 (Min/Max 29/42)
191 G-Sense_Error_Rate      -O--CK   100   100   000    -    7
192 Power-Off_Retract_Count -O---K   100   100   000    -    34
193 Load_Cycle_Count        -O--CK   097   097   000    -    7698
194 Temperature_Celsius     -O---K   042   049   000    -    42 (0 19 0 0 0)
196 Reallocated_Event_Count -O--CK   100   100   000    -    0
197 Current_Pending_Sector  -O--CK   100   100   000    -    8
198 Offline_Uncorrectable   ----CK   100   100   000    -    0
199 UDMA_CRC_Error_Count    -O--CK   200   200   000    -    0
254 Free_Fall_Sensor        -O--CK   100   100   000    -    0
                            ||||||_ K auto-keep
                            |||||__ C event count
                            ||||___ R error rate
                            |||____ S speed/performance
                            ||_____ O updated online
                            |______ P prefailure warning

General Purpose Log Directory Version 1
SMART           Log Directory Version 1 [multi-sector log support]
Address    Access  R/W   Size  Description
0x00       GPL,SL  R/O      1  Log Directory
0x01           SL  R/O      1  Summary SMART error log
0x02           SL  R/O      5  Comprehensive SMART error log
0x03       GPL     R/O      5  Ext. Comprehensive SMART error log
0x06           SL  R/O      1  SMART self-test log
0x07       GPL     R/O      1  Extended self-test log
0x09           SL  R/W      1  Selective self-test log
0x10       GPL     R/O      1  NCQ Command Error log
0x11       GPL     R/O      1  SATA Phy Event Counters log
0x21       GPL     R/O      1  Write stream error log
0x22       GPL     R/O      1  Read stream error log
0x80-0x9f  GPL,SL  R/W     16  Host vendor specific log
0xa1       GPL,SL  VS      20  Device vendor specific log
0xa2       GPL     VS    2248  Device vendor specific log
0xa8       GPL,SL  VS      65  Device vendor specific log
0xa9       GPL,SL  VS       1  Device vendor specific log
0xab       GPL     VS       1  Device vendor specific log
0xb0       GPL     VS    2864  Device vendor specific log
0xb6       GPL     VS   16385  Device vendor specific log
0xbd-0xbf  GPL     VS   65535  Device vendor specific log
0xc0       GPL,SL  VS       1  Device vendor specific log
0xc1       GPL,SL  VS      10  Device vendor specific log
0xc3       GPL,SL  VS       8  Device vendor specific log
0xc4       GPL,SL  VS      18  Device vendor specific log
0xe0       GPL,SL  R/W      1  SCT Command/Status
0xe1       GPL,SL  R/W      1  SCT Data Transfer

SMART Extended Comprehensive Error Log Version: 1 (5 sectors)
Device Error Count: 452 (device log contains only the most recent 20 errors)
	CR     = Command Register
	FEATR  = Features Register
	COUNT  = Count (was: Sector Count) Register
	LBA_48 = Upper bytes of LBA High/Mid/Low Registers ]  ATA-8
	LH     = LBA High (was: Cylinder High) Register    ]   LBA
	LM     = LBA Mid (was: Cylinder Low) Register      ] Register
	LL     = LBA Low (was: Sector Number) Register     ]
	DV     = Device (was: Device/Head) Register
	DC     = Device Control Register
	ER     = Error register
	ST     = Status register
Powered_Up_Time is measured from power on, and printed as
DDd+hh:mm:SS.sss where DD=days, hh=hours, mm=minutes,
SS=sec, and sss=millisec. It "wraps" after 49.710 days.

Error 452 [11] occurred at disk power-on lifetime: 219 hours (9 days + 3 hours)
  When the command that caused the error occurred, the device was active or idle.

  After command completion occurred, registers were:
  ER -- ST COUNT  LBA_48  LH LM LL DV DC
  -- -- -- == -- == == == -- -- -- -- --
  40 -- 51 00 00 00 00 2c 53 3b e8 00 00  Error: UNC at LBA = 0x2c533be8 = 743652328

  Commands leading to the command that caused the error were:
  CR FEATR COUNT  LBA_48  LH LM LL DV DC  Powered_Up_Time  Command/Feature_Name
  -- == -- == -- == == == -- -- -- -- --  ---------------  --------------------
  60 00 00 01 00 00 00 2c 53 3b 00 40 00     00:03:00.698  READ FPDMA QUEUED
  60 00 00 00 02 00 00 2c 53 3b 68 40 00     00:03:00.696  READ FPDMA QUEUED
  2f 00 00 00 01 00 00 00 00 00 10 e0 00     00:03:00.695  READ LOG EXT
  60 00 00 01 00 00 00 2c 53 3b 00 40 00     00:02:58.257  READ FPDMA QUEUED
  60 00 00 00 02 00 00 2c 53 3b 66 40 00     00:02:58.255  READ FPDMA QUEUED

Error 451 [10] occurred at disk power-on lifetime: 219 hours (9 days + 3 hours)
  When the command that caused the error occurred, the device was active or idle.

  After command completion occurred, registers were:
  ER -- ST COUNT  LBA_48  LH LM LL DV DC
  -- -- -- == -- == == == -- -- -- -- --
  40 -- 51 00 00 00 00 2c 53 3b e8 00 00  Error: UNC at LBA = 0x2c533be8 = 743652328

  Commands leading to the command that caused the error were:
  CR FEATR COUNT  LBA_48  LH LM LL DV DC  Powered_Up_Time  Command/Feature_Name
  -- == -- == -- == == == -- -- -- -- --  ---------------  --------------------
  60 00 00 01 00 00 00 2c 53 3b 00 40 00     00:02:58.257  READ FPDMA QUEUED
  60 00 00 00 02 00 00 2c 53 3b 66 40 00     00:02:58.255  READ FPDMA QUEUED
  2f 00 00 00 01 00 00 00 00 00 10 e0 00     00:02:58.254  READ LOG EXT
  60 00 00 01 00 00 00 2c 53 3b 00 40 00     00:02:55.893  READ FPDMA QUEUED
  60 00 00 00 02 00 00 2c 53 3b 64 40 00     00:02:55.891  READ FPDMA QUEUED

Error 450 [9] occurred at disk power-on lifetime: 219 hours (9 days + 3 hours)
  When the command that caused the error occurred, the device was active or idle.

  After command completion occurred, registers were:
  ER -- ST COUNT  LBA_48  LH LM LL DV DC
  -- -- -- == -- == == == -- -- -- -- --
  40 -- 51 00 00 00 00 2c 53 3b e8 00 00  Error: UNC at LBA = 0x2c533be8 = 743652328

  Commands leading to the command that caused the error were:
  CR FEATR COUNT  LBA_48  LH LM LL DV DC  Powered_Up_Time  Command/Feature_Name
  -- == -- == -- == == == -- -- -- -- --  ---------------  --------------------
  60 00 00 01 00 00 00 2c 53 3b 00 40 00     00:02:55.893  READ FPDMA QUEUED
  60 00 00 00 02 00 00 2c 53 3b 64 40 00     00:02:55.891  READ FPDMA QUEUED
  2f 00 00 00 01 00 00 00 00 00 10 e0 00     00:02:55.891  READ LOG EXT
  60 00 00 01 00 00 00 2c 53 3b 00 40 00     00:02:53.441  READ FPDMA QUEUED
  60 00 00 00 02 00 00 2c 53 3b 62 40 00     00:02:53.439  READ FPDMA QUEUED

Error 449 [8] occurred at disk power-on lifetime: 219 hours (9 days + 3 hours)
  When the command that caused the error occurred, the device was active or idle.

  After command completion occurred, registers were:
  ER -- ST COUNT  LBA_48  LH LM LL DV DC
  -- -- -- == -- == == == -- -- -- -- --
  40 -- 51 00 00 00 00 2c 53 3b e8 00 00  Error: UNC at LBA = 0x2c533be8 = 743652328

  Commands leading to the command that caused the error were:
  CR FEATR COUNT  LBA_48  LH LM LL DV DC  Powered_Up_Time  Command/Feature_Name
  -- == -- == -- == == == -- -- -- -- --  ---------------  --------------------
  60 00 00 01 00 00 00 2c 53 3b 00 40 00     00:02:53.441  READ FPDMA QUEUED
  60 00 00 00 02 00 00 2c 53 3b 62 40 00     00:02:53.439  READ FPDMA QUEUED
  2f 00 00 00 01 00 00 00 00 00 10 e0 00     00:02:53.439  READ LOG EXT
  60 00 00 01 00 00 00 2c 53 3b 00 40 00     00:02:51.078  READ FPDMA QUEUED
  60 00 00 00 02 00 00 2c 53 3b 60 40 00     00:02:51.076  READ FPDMA QUEUED

Error 448 [7] occurred at disk power-on lifetime: 219 hours (9 days + 3 hours)
  When the command that caused the error occurred, the device was active or idle.

  After command completion occurred, registers were:
  ER -- ST COUNT  LBA_48  LH LM LL DV DC
  -- -- -- == -- == == == -- -- -- -- --
  40 -- 51 00 00 00 00 2c 53 3b e8 00 00  Error: UNC at LBA = 0x2c533be8 = 743652328

  Commands leading to the command that caused the error were:
  CR FEATR COUNT  LBA_48  LH LM LL DV DC  Powered_Up_Time  Command/Feature_Name
  -- == -- == -- == == == -- -- -- -- --  ---------------  --------------------
  60 00 00 01 00 00 00 2c 53 3b 00 40 00     00:02:51.078  READ FPDMA QUEUED
  60 00 00 00 02 00 00 2c 53 3b 60 40 00     00:02:51.076  READ FPDMA QUEUED
  2f 00 00 00 01 00 00 00 00 00 10 e0 00     00:02:51.075  READ LOG EXT
  60 00 00 01 00 00 00 2c 53 3b 00 40 00     00:02:48.659  READ FPDMA QUEUED
  60 00 00 00 02 00 00 2c 53 3b 5e 40 00     00:02:48.657  READ FPDMA QUEUED

Error 447 [6] occurred at disk power-on lifetime: 219 hours (9 days + 3 hours)
  When the command that caused the error occurred, the device was active or idle.

  After command completion occurred, registers were:
  ER -- ST COUNT  LBA_48  LH LM LL DV DC
  -- -- -- == -- == == == -- -- -- -- --
  40 -- 51 00 00 00 00 2c 53 3b e8 00 00  Error: UNC at LBA = 0x2c533be8 = 743652328

  Commands leading to the command that caused the error were:
  CR FEATR COUNT  LBA_48  LH LM LL DV DC  Powered_Up_Time  Command/Feature_Name
  -- == -- == -- == == == -- -- -- -- --  ---------------  --------------------
  60 00 00 01 00 00 00 2c 53 3b 00 40 00     00:02:48.659  READ FPDMA QUEUED
  60 00 00 00 02 00 00 2c 53 3b 5e 40 00     00:02:48.657  READ FPDMA QUEUED
  2f 00 00 00 01 00 00 00 00 00 10 e0 00     00:02:48.657  READ LOG EXT
  60 00 00 01 00 00 00 2c 53 3b 00 40 00     00:02:46.285  READ FPDMA QUEUED
  60 00 00 00 02 00 00 2c 53 3b 5c 40 00     00:02:46.283  READ FPDMA QUEUED

Error 446 [5] occurred at disk power-on lifetime: 219 hours (9 days + 3 hours)
  When the command that caused the error occurred, the device was active or idle.

  After command completion occurred, registers were:
  ER -- ST COUNT  LBA_48  LH LM LL DV DC
  -- -- -- == -- == == == -- -- -- -- --
  40 -- 51 00 00 00 00 2c 53 3b e8 00 00  Error: UNC at LBA = 0x2c533be8 = 743652328

  Commands leading to the command that caused the error were:
  CR FEATR COUNT  LBA_48  LH LM LL DV DC  Powered_Up_Time  Command/Feature_Name
  -- == -- == -- == == == -- -- -- -- --  ---------------  --------------------
  60 00 00 01 00 00 00 2c 53 3b 00 40 00     00:02:46.285  READ FPDMA QUEUED
  60 00 00 00 02 00 00 2c 53 3b 5c 40 00     00:02:46.283  READ FPDMA QUEUED
  2f 00 00 00 01 00 00 00 00 00 10 e0 00     00:02:46.282  READ LOG EXT
  60 00 00 01 00 00 00 2c 53 3b 00 40 00     00:02:43.866  READ FPDMA QUEUED
  60 00 00 00 02 00 00 2c 53 3b 5a 40 00     00:02:43.864  READ FPDMA QUEUED

Error 445 [4] occurred at disk power-on lifetime: 219 hours (9 days + 3 hours)
  When the command that caused the error occurred, the device was active or idle.

  After command completion occurred, registers were:
  ER -- ST COUNT  LBA_48  LH LM LL DV DC
  -- -- -- == -- == == == -- -- -- -- --
  40 -- 51 00 00 00 00 2c 53 3b e8 00 00  Error: UNC at LBA = 0x2c533be8 = 743652328

  Commands leading to the command that caused the error were:
  CR FEATR COUNT  LBA_48  LH LM LL DV DC  Powered_Up_Time  Command/Feature_Name
  -- == -- == -- == == == -- -- -- -- --  ---------------  --------------------
  60 00 00 01 00 00 00 2c 53 3b 00 40 00     00:02:43.866  READ FPDMA QUEUED
  60 00 00 00 02 00 00 2c 53 3b 5a 40 00     00:02:43.864  READ FPDMA QUEUED
  2f 00 00 00 01 00 00 00 00 00 10 e0 00     00:02:43.863  READ LOG EXT
  60 00 00 01 00 00 00 2c 53 3b 00 40 00     00:02:41.491  READ FPDMA QUEUED
  60 00 00 00 02 00 00 2c 53 3b 58 40 00     00:02:41.489  READ FPDMA QUEUED

SMART Extended Self-test Log Version: 1 (1 sectors)
Num  Test_Description    Status                  Remaining  LifeTime(hours)  LBA_of_first_error
# 1  Short offline       Completed: read failure       90%       219         743652328
# 2  Short offline       Completed without error       00%        31         -
# 3  Short offline       Completed without error       00%        16         -

SMART Selective self-test log data structure revision number 1
 SPAN  MIN_LBA  MAX_LBA  CURRENT_TEST_STATUS
    1        0        0  Not_testing
    2        0        0  Not_testing
    3        0        0  Not_testing
    4        0        0  Not_testing
    5        0        0  Not_testing
Selective self-test flags (0x0):
  After scanning selected spans, do NOT read-scan remainder of disk.
If Selective self-test is pending on power-up, resume after 0 minute delay.

SCT Status Version:                  3
SCT Version (vendor specific):       522 (0x020a)
Device State:                        Active (0)
Current Temperature:                    42 Celsius
Power Cycle Min/Max Temperature:     29/42 Celsius
Lifetime    Min/Max Temperature:     19/49 Celsius
Under/Over Temperature Limit Count:   0/3

SCT Temperature History Version:     2
Temperature Sampling Period:         1 minute
Temperature Logging Interval:        30 minutes
Min/Max recommended Temperature:      0/ 0 Celsius
Min/Max Temperature Limit:            0/ 0 Celsius
Temperature History Size (Index):    128 (65)

SCT Error Recovery Control:
           Read: Disabled
          Write: Disabled

Device Statistics (GP/SMART Log 0x04) not supported

Pending Defects log (GP Log 0x0c) not supported

SATA Phy Event Counters (GP Log 0x11)
ID      Size     Value  Description
0x000a  2            3  Device-to-host register FISes sent due to a COMRESET
0x0001  2            0  Command failed due to ICRC error
0x0003  2            0  R_ERR response for device-to-host data FIS
0x0004  2            0  R_ERR response for host-to-device data FIS
0x0006  2            0  R_ERR response for device-to-host non-data FIS
0x0007  2            0  R_ERR response for host-to-device non-data FIS

