smartctl 7.4 2023-08-01 r5530 [x86_64-linux-6.11.0-18-generic] (local build)
Copyright (C) 2002-23, Bruce Allen, Christian Franke, www.smartmontools.org

=== START OF INFORMATION SECTION ===
Model Number:                       Corsair MP600 PRO NH
Serial Number:                      --
Firmware Version:                   EIFM51.3
PCI Vendor/Subsystem ID:            0x1987
IEEE OUI Identifier:                0x6479a7
Total NVM Capacity:                 4,000,787,030,016 [4.00 TB]
Unallocated NVM Capacity:           0
Controller ID:                      1
NVMe Version:                       1.4
Number of Namespaces:               1
Namespace 1 Size/Capacity:          4,000,787,030,016 [4.00 TB]
Namespace 1 Formatted LBA Size:     512
Namespace 1 IEEE EUI-64:            6479a7 ...
Local Time is:                      Wed Feb 26 09:19:31 2025 GMT
Firmware Updates (0x12):            1 Slot, no Reset required
Optional Admin Commands (0x0017):   Security Format Frmw_DL Self_Test
Optional NVM Commands (0x005d):     Comp DS_Mngmt Wr_Zero Sav/Sel_Feat Timestmp
Log Page Attributes (0x0c):         Ext_Get_Lg Telmtry_Lg
Maximum Data Transfer Size:         512 Pages
Warning  Comp. Temp. Threshold:     84 Celsius
Critical Comp. Temp. Threshold:     89 Celsius

Supported Power States
St Op     Max   Active     Idle   RL RT WL WT  Ent_Lat  Ex_Lat
 0 +     8.80W       -        -    0  0  0  0        0       0
 1 +     7.10W       -        -    1  1  1  1        0       0
 2 +     5.20W       -        -    2  2  2  2        0       0
 3 -   0.0620W       -        -    3  3  3  3     2500    7500
 4 -   0.0440W       -        -    4  4  4  4    10500   65000

Supported LBA Sizes (NSID 0x1)
Id Fmt  Data  Metadt  Rel_Perf
 0 +     512       0         2
 1 -    4096       0         1

=== START OF SMART DATA SECTION ===
SMART overall-health self-assessment test result: PASSED

SMART/Health Information (NVMe Log 0x02)
Critical Warning:                   0x00
Temperature:                        41 Celsius
Available Spare:                    100%
Available Spare Threshold:          5%
Percentage Used:                    0%
Data Units Read:                    16,061,523 [8.22 TB]
Data Units Written:                 12,573,075 [6.43 TB]
Host Read Commands:                 123,846,101
Host Write Commands:                83,160,879
Controller Busy Time:               746
Power Cycles:                       553
Power On Hours:                     6,635
Unsafe Shutdowns:                   134
Media and Data Integrity Errors:    0
Error Information Log Entries:      1,091
Warning  Comp. Temperature Time:    0
Critical Comp. Temperature Time:    0
Thermal Temp. 1 Transition Count:   1
Thermal Temp. 1 Total Time:         15382

Error Information (NVMe Log 0x01, 16 of 63 entries)
Num   ErrCount  SQId   CmdId  Status  PELoc          LBA  NSID    VS  Message
  0       1091     0  0x0008  0x4004  0x028            0     0     -  Invalid Field in Command

Read Self-test Log failed: Invalid Field in Command (0x2002)



