smartctl 7.1 2019-12-30 r5022 [x86_64-linux-5.8.0-25-generic] (local build)
Copyright (C) 2002-19, Bruce Allen, Christian Franke, www.smartmontools.org

=== START OF INFORMATION SECTION ===
Model Family:     Western Digital Caviar Green
Device Model:     WDC WD10EADS-00L5B1
Serial Number:    --
LU WWN Device Id: 5 0014ee ...
Firmware Version: 01.01A01
User Capacity:    1,000,204,886,016 bytes [1.00 TB]
Sector Size:      512 bytes logical/physical
Device is:        In smartctl database [for details use: -P show]
ATA Version is:   ATA8-ACS (minor revision not indicated)
SATA Version is:  SATA 2.5, 3.0 Gb/s
Local Time is:    Tue Dec  1 07:32:18 2020 EST
SMART support is: Available - device has SMART capability.
SMART support is: Enabled
AAM feature is:   Disabled
APM feature is:   Unavailable
Rd look-ahead is: Enabled
Write cache is:   Enabled
DSN feature is:   Unavailable
ATA Security is:  Disabled, frozen [SEC2]
Wt Cache Reorder: Enabled

=== START OF READ SMART DATA SECTION ===
SMART overall-health self-assessment test result: PASSED

General SMART Values:
Offline data collection status:  (0x84)	Offline data collection activity
					was suspended by an interrupting command from host.
					Auto Offline Data Collection: Enabled.
Self-test execution status:      (   0)	The previous self-test routine completed
					without error or no self-test has ever 
					been run.
Total time to complete Offline 
data collection: 		(22200) seconds.
Offline data collection
capabilities: 			 (0x7b) SMART execute Offline immediate.
					Auto Offline data collection on/off support.
					Suspend Offline collection upon new
					command.
					Offline surface scan supported.
					Self-test supported.
					Conveyance Self-test supported.
					Selective Self-test supported.
SMART capabilities:            (0x0003)	Saves SMART data before entering
					power-saving mode.
					Supports SMART auto save timer.
Error logging capability:        (0x01)	Error logging supported.
					General Purpose Logging supported.
Short self-test routine 
recommended polling time: 	 (   2) minutes.
Extended self-test routine
recommended polling time: 	 ( 255) minutes.
Conveyance self-test routine
recommended polling time: 	 (   5) minutes.
SCT capabilities: 	       (0x303f)	SCT Status supported.
					SCT Error Recovery Control supported.
					SCT Feature Control supported.
					SCT Data Table supported.

SMART Attributes Data Structure revision number: 16
Vendor Specific SMART Attributes with Thresholds:
ID# ATTRIBUTE_NAME          FLAGS    VALUE WORST THRESH FAIL RAW_VALUE
  1 Raw_Read_Error_Rate     POSR-K   200   200   051    -    5
  3 Spin_Up_Time            POS--K   187   153   021    -    5616
  4 Start_Stop_Count        -O--CK   078   078   000    -    22346
  5 Reallocated_Sector_Ct   PO--CK   200   200   140    -    0
  7 Seek_Error_Rate         -OSR-K   100   253   000    -    0
  9 Power_On_Hours          -O--CK   001   001   000    -    92106
 10 Spin_Retry_Count        -O--CK   100   100   000    -    0
 11 Calibration_Retry_Count -O--CK   100   100   000    -    0
 12 Power_Cycle_Count       -O--CK   098   098   000    -    2914
192 Power-Off_Retract_Count -O--CK   198   198   000    -    1537
193 Load_Cycle_Count        -O--CK   193   193   000    -    22336
194 Temperature_Celsius     -O---K   116   095   000    -    34
196 Reallocated_Event_Count -O--CK   200   200   000    -    0
197 Current_Pending_Sector  -O--CK   200   200   000    -    0
198 Offline_Uncorrectable   ----CK   200   200   000    -    0
199 UDMA_CRC_Error_Count    -O--CK   200   200   000    -    1
200 Multi_Zone_Error_Rate   ---R--   200   200   000    -    0
                            ||||||_ K auto-keep
                            |||||__ C event count
                            ||||___ R error rate
                            |||____ S speed/performance
                            ||_____ O updated online
                            |______ P prefailure warning

General Purpose Log Directory Version 1
SMART           Log Directory Version 1 [multi-sector log support]
Address    Access  R/W   Size  Description
0x00       GPL,SL  R/O      1  Log Directory
0x01           SL  R/O      1  Summary SMART error log
0x02           SL  R/O      5  Comprehensive SMART error log
0x03       GPL     R/O      6  Ext. Comprehensive SMART error log
0x06           SL  R/O      1  SMART self-test log
0x07       GPL     R/O      1  Extended self-test log
0x09           SL  R/W      1  Selective self-test log
0x10       GPL     R/O      1  NCQ Command Error log
0x11       GPL     R/O      1  SATA Phy Event Counters log
0x80-0x9f  GPL,SL  R/W     16  Host vendor specific log
0xa0-0xa7  GPL,SL  VS      16  Device vendor specific log
0xa8-0xb7  GPL,SL  VS       1  Device vendor specific log
0xc0       GPL,SL  VS       1  Device vendor specific log
0xc1       GPL     VS      24  Device vendor specific log
0xe0       GPL,SL  R/W      1  SCT Command/Status
0xe1       GPL,SL  R/W      1  SCT Data Transfer

SMART Extended Comprehensive Error Log Version: 1 (6 sectors)
Device Error Count: 6
	CR     = Command Register
	FEATR  = Features Register
	COUNT  = Count (was: Sector Count) Register
	LBA_48 = Upper bytes of LBA High/Mid/Low Registers ]  ATA-8
	LH     = LBA High (was: Cylinder High) Register    ]   LBA
	LM     = LBA Mid (was: Cylinder Low) Register      ] Register
	LL     = LBA Low (was: Sector Number) Register     ]
	DV     = Device (was: Device/Head) Register
	DC     = Device Control Register
	ER     = Error register
	ST     = Status register
Powered_Up_Time is measured from power on, and printed as
DDd+hh:mm:SS.sss where DD=days, hh=hours, mm=minutes,
SS=sec, and sss=millisec. It "wraps" after 49.710 days.

Error 6 [5] occurred at disk power-on lifetime: 10666 hours (444 days + 10 hours)
  When the command that caused the error occurred, the device was active or idle.

  After command completion occurred, registers were:
  ER -- ST COUNT  LBA_48  LH LM LL DV DC
  -- -- -- == -- == == == -- -- -- -- --
  40 -- 51 00 08 00 00 00 5e 00 47 e0 00  Error: UNC 8 sectors at LBA = 0x005e0047 = 6160455

  Commands leading to the command that caused the error were:
  CR FEATR COUNT  LBA_48  LH LM LL DV DC  Powered_Up_Time  Command/Feature_Name
  -- == -- == -- == == == -- -- -- -- --  ---------------  --------------------
  25 03 03 00 08 00 5e 00 00 00 47 e0 00  1d+03:28:04.685  READ DMA EXT
  25 03 03 00 08 00 5e 00 00 00 37 e0 00  1d+03:28:04.684  READ DMA EXT
  25 03 03 00 08 00 5e 00 00 00 2f e0 00  1d+03:28:04.670  READ DMA EXT
  25 03 03 00 08 00 38 00 2c 3a ff e0 00  1d+03:28:04.654  READ DMA EXT
  25 03 03 00 08 00 60 00 00 00 3f e0 00  1d+03:28:04.653  READ DMA EXT

Error 5 [4] occurred at disk power-on lifetime: 8624 hours (359 days + 8 hours)
  When the command that caused the error occurred, the device was active or idle.

  After command completion occurred, registers were:
  ER -- ST COUNT  LBA_48  LH LM LL DV DC
  -- -- -- == -- == == == -- -- -- -- --
  40 -- 51 00 08 00 00 00 5e 00 37 e0 00  Error: UNC 8 sectors at LBA = 0x005e0037 = 6160439

  Commands leading to the command that caused the error were:
  CR FEATR COUNT  LBA_48  LH LM LL DV DC  Powered_Up_Time  Command/Feature_Name
  -- == -- == -- == == == -- -- -- -- --  ---------------  --------------------
  25 00 03 00 08 00 5e 00 00 00 37 e0 00     00:00:12.084  READ DMA EXT
  25 00 03 00 08 00 5e 00 00 00 2f e0 00     00:00:12.070  READ DMA EXT
  25 00 03 00 08 00 38 00 2c 3a ff e0 00     00:00:12.058  READ DMA EXT
  25 00 03 00 08 00 60 00 00 00 3f e0 00     00:00:12.045  READ DMA EXT
  25 00 03 00 08 00 00 00 00 00 3f e0 00     00:00:12.044  READ DMA EXT

Error 4 [3] occurred at disk power-on lifetime: 8570 hours (357 days + 2 hours)
  When the command that caused the error occurred, the device was active or idle.

  After command completion occurred, registers were:
  ER -- ST COUNT  LBA_48  LH LM LL DV DC
  -- -- -- == -- == == == -- -- -- -- --
  40 -- 51 00 08 00 00 00 5e 00 47 e0 00  Error: UNC 8 sectors at LBA = 0x005e0047 = 6160455

  Commands leading to the command that caused the error were:
  CR FEATR COUNT  LBA_48  LH LM LL DV DC  Powered_Up_Time  Command/Feature_Name
  -- == -- == -- == == == -- -- -- -- --  ---------------  --------------------
  25 00 03 00 08 00 5e 00 00 00 47 e0 00     00:00:12.366  READ DMA EXT
  25 00 03 00 08 00 5e 00 00 00 37 e0 00     00:00:12.366  READ DMA EXT
  25 00 03 00 08 00 5e 00 00 00 2f e0 00     00:00:12.351  READ DMA EXT
  25 00 03 00 08 00 38 00 2c 3a ff e0 00     00:00:12.340  READ DMA EXT
  25 00 03 00 08 00 60 00 00 00 3f e0 00     00:00:12.334  READ DMA EXT

Error 3 [2] occurred at disk power-on lifetime: 8409 hours (350 days + 9 hours)
  When the command that caused the error occurred, the device was active or idle.

  After command completion occurred, registers were:
  ER -- ST COUNT  LBA_48  LH LM LL DV DC
  -- -- -- == -- == == == -- -- -- -- --
  40 -- 51 00 08 00 00 00 5f 58 4f e0 00  Error: UNC 8 sectors at LBA = 0x005f584f = 6248527

  Commands leading to the command that caused the error were:
  CR FEATR COUNT  LBA_48  LH LM LL DV DC  Powered_Up_Time  Command/Feature_Name
  -- == -- == -- == == == -- -- -- -- --  ---------------  --------------------
  25 00 03 00 08 00 5f 00 58 00 4f e0 00     00:00:12.022  READ DMA EXT
  25 00 03 00 08 00 5f 00 58 00 47 e0 00     00:00:12.022  READ DMA EXT
  25 00 03 00 08 00 5f 00 58 00 3f e0 00     00:00:12.021  READ DMA EXT
  25 00 03 00 08 00 5f 00 58 00 37 e0 00     00:00:12.020  READ DMA EXT
  25 00 03 00 08 00 5f 00 58 00 2f e0 00     00:00:12.020  READ DMA EXT

Error 2 [1] occurred at disk power-on lifetime: 7580 hours (315 days + 20 hours)
  When the command that caused the error occurred, the device was active or idle.

  After command completion occurred, registers were:
  ER -- ST COUNT  LBA_48  LH LM LL DV DC
  -- -- -- == -- == == == -- -- -- -- --
  40 -- 51 00 08 00 00 00 5e 37 4f e0 00  Error: UNC 8 sectors at LBA = 0x005e374f = 6174543

  Commands leading to the command that caused the error were:
  CR FEATR COUNT  LBA_48  LH LM LL DV DC  Powered_Up_Time  Command/Feature_Name
  -- == -- == -- == == == -- -- -- -- --  ---------------  --------------------
  25 00 03 00 08 00 5e 00 37 00 4f e0 00     00:00:12.007  READ DMA EXT
  25 00 03 00 08 00 5e 00 37 00 47 e0 00     00:00:12.006  READ DMA EXT
  25 00 03 00 08 00 5e 00 37 00 3f e0 00     00:00:12.006  READ DMA EXT
  25 00 03 00 08 00 5e 00 37 00 37 e0 00     00:00:12.005  READ DMA EXT
  25 00 03 00 08 00 5e 00 37 00 2f e0 00     00:00:12.004  READ DMA EXT

Error 1 [0] occurred at disk power-on lifetime: 6532 hours (272 days + 4 hours)
  When the command that caused the error occurred, the device was active or idle.

  After command completion occurred, registers were:
  ER -- ST COUNT  LBA_48  LH LM LL DV DC
  -- -- -- == -- == == == -- -- -- -- --
  40 -- 51 00 08 00 00 00 5e 73 57 e0 00  Error: UNC 8 sectors at LBA = 0x005e7357 = 6189911

  Commands leading to the command that caused the error were:
  CR FEATR COUNT  LBA_48  LH LM LL DV DC  Powered_Up_Time  Command/Feature_Name
  -- == -- == -- == == == -- -- -- -- --  ---------------  --------------------
  25 00 03 00 08 00 5e 00 73 00 57 e0 00     00:00:11.836  READ DMA EXT
  25 00 03 00 08 00 5e 00 73 00 4f e0 00     00:00:11.836  READ DMA EXT
  25 00 03 00 08 00 5e 00 73 00 47 e0 00     00:00:11.835  READ DMA EXT
  25 00 03 00 08 00 5e 00 73 00 3f e0 00     00:00:11.835  READ DMA EXT
  25 00 03 00 08 00 5e 00 73 00 37 e0 00     00:00:11.834  READ DMA EXT

SMART Extended Self-test Log Version: 1 (1 sectors)
Num  Test_Description    Status                  Remaining  LifeTime(hours)  LBA_of_first_error
# 1  Short offline       Completed without error       00%      2799         -

SMART Selective self-test log data structure revision number 1
 SPAN  MIN_LBA  MAX_LBA  CURRENT_TEST_STATUS
    1        0        0  Not_testing
    2        0        0  Not_testing
    3        0        0  Not_testing
    4        0        0  Not_testing
    5        0        0  Not_testing
Selective self-test flags (0x0):
  After scanning selected spans, do NOT read-scan remainder of disk.
If Selective self-test is pending on power-up, resume after 0 minute delay.

SCT Status Version:                  2
SCT Version (vendor specific):       258 (0x0102)
Device State:                        SMART Off-line Data Collection executing in background (4)
Current Temperature:                    34 Celsius
Power Cycle Min/Max Temperature:     29/34 Celsius
Lifetime    Min/Max Temperature:     28/55 Celsius
Under/Over Temperature Limit Count:   0/0

SCT Temperature History Version:     2
Temperature Sampling Period:         1 minute
Temperature Logging Interval:        1 minute
Min/Max recommended Temperature:      0/60 Celsius
Min/Max Temperature Limit:           -41/85 Celsius
Temperature History Size (Index):    478 (231)

SCT Error Recovery Control:
           Read: Disabled
          Write: Disabled

Device Statistics (GP/SMART Log 0x04) not supported

Pending Defects log (GP Log 0x0c) not supported

SATA Phy Event Counters (GP Log 0x11)
ID      Size     Value  Description
0x0001  2            0  Command failed due to ICRC error
0x0002  2            0  R_ERR response for data FIS
0x0003  2            0  R_ERR response for device-to-host data FIS
0x0004  2            0  R_ERR response for host-to-device data FIS
0x0005  2            0  R_ERR response for non-data FIS
0x0006  2            0  R_ERR response for device-to-host non-data FIS
0x0007  2            0  R_ERR response for host-to-device non-data FIS
0x000a  2           10  Device-to-host register FISes sent due to a COMRESET
0x8000  4       917237  Vendor specific



