smartctl 7.4 2023-08-01 r5530 [x86_64-linux-6.1.46-generic-2rosa2021.1-x86_64] (local build)
Copyright (C) 2002-23, Bruce Allen, Christian Franke, www.smartmontools.org

=== START OF INFORMATION SECTION ===
Device Model:     P3-256
Serial Number:    --
LU WWN Device Id: 0 000000 ...
Firmware Version: FW210521
User Capacity:    256,060,514,304 bytes [256 GB]
Sector Size:      512 bytes logical/physical
Rotation Rate:    Solid State Device
Form Factor:      2.5 inches
TRIM Command:     Available
Device is:        Not in smartctl database 7.3/5528
ATA Version is:   ACS-2 T13/2015-D revision 3
SATA Version is:  SATA 3.2, 6.0 Gb/s (current: 6.0 Gb/s)
Local Time is:    Thu Oct 12 22:54:27 2023 MSK
SMART support is: Available - device has SMART capability.
SMART support is: Enabled
AAM feature is:   Unavailable
APM feature is:   Unavailable
Rd look-ahead is: Enabled
Write cache is:   Enabled
DSN feature is:   Unavailable
ATA Security is:  Disabled, frozen [SEC2]
Wt Cache Reorder: Unavailable

=== START OF READ SMART DATA SECTION ===
SMART overall-health self-assessment test result: PASSED

General SMART Values:
Offline data collection status:  (0x00)	Offline data collection activity
					was never started.
					Auto Offline Data Collection: Disabled.
Self-test execution status:      (   0)	The previous self-test routine completed
					without error or no self-test has ever 
					been run.
Total time to complete Offline 
data collection: 		(  120) seconds.
Offline data collection
capabilities: 			 (0x5d) SMART execute Offline immediate.
					No Auto Offline data collection support.
					Abort Offline collection upon new
					command.
					Offline surface scan supported.
					Self-test supported.
					No Conveyance Self-test supported.
					Selective Self-test supported.
SMART capabilities:            (0x0002)	Does not save SMART data before
					entering power-saving mode.
					Supports SMART auto save timer.
Error logging capability:        (0x01)	Error logging supported.
					General Purpose Logging supported.
Short self-test routine 
recommended polling time: 	 (   2) minutes.
Extended self-test routine
recommended polling time: 	 (   4) minutes.

SMART Attributes Data Structure revision number: 1
Vendor Specific SMART Attributes with Thresholds:
ID# ATTRIBUTE_NAME          FLAGS    VALUE WORST THRESH FAIL RAW_VALUE
  1 Raw_Read_Error_Rate     -O--CK   100   100   050    -    0
  5 Reallocated_Sector_Ct   -O--CK   100   100   050    -    0
  9 Power_On_Hours          -O--CK   100   100   050    -    4022
 12 Power_Cycle_Count       -O--CK   100   100   050    -    582
160 Unknown_Attribute       -O--CK   100   100   050    -    0
161 Unknown_Attribute       -O--CK   100   100   050    -    0
163 Unknown_Attribute       -O--CK   100   100   050    -    86
164 Unknown_Attribute       -O--CK   100   100   050    -    76
165 Unknown_Attribute       -O--CK   100   100   050    -    349
166 Unknown_Attribute       -O--CK   100   100   050    -    69
167 Unknown_Attribute       -O--CK   100   100   050    -    95
168 Unknown_Attribute       -O--CK   100   100   050    -    0
169 Unknown_Attribute       -O--CK   100   100   050    -    100
175 Program_Fail_Count_Chip -O--CK   100   100   050    -    67108864
176 Erase_Fail_Count_Chip   -O--CK   100   100   050    -    1764967
177 Wear_Leveling_Count     -O--CK   100   100   050    -    2944528
178 Used_Rsvd_Blk_Cnt_Chip  -O--CK   100   100   050    -    327680
181 Program_Fail_Cnt_Total  -O--CK   100   100   050    -    0
182 Erase_Fail_Count_Total  -O--CK   100   100   050    -    0
192 Power-Off_Retract_Count -O--CK   100   100   050    -    110
194 Temperature_Celsius     -O--CK   100   100   050    -    45
195 Hardware_ECC_Recovered  -O--CK   100   100   050    -    3580
196 Reallocated_Event_Count -O--CK   100   100   050    -    0
197 Current_Pending_Sector  -O--CK   100   100   050    -    0
198 Offline_Uncorrectable   -O--CK   100   100   050    -    0
199 UDMA_CRC_Error_Count    -O--CK   100   100   050    -    1574
232 Available_Reservd_Space -O--CK   100   100   050    -    0
241 Total_LBAs_Written      -O--CK   100   100   050    -    125728
242 Total_LBAs_Read         -O--CK   100   100   050    -    111534
249 Unknown_Attribute       -O--CK   100   100   050    -    133935
                            ||||||_ K auto-keep
                            |||||__ C event count
                            ||||___ R error rate
                            |||____ S speed/performance
                            ||_____ O updated online
                            |______ P prefailure warning

General Purpose Log Directory Version 1
SMART           Log Directory Version 1 [multi-sector log support]
Address    Access  R/W   Size  Description
0x00       GPL,SL  R/O      1  Log Directory
0x01       GPL,SL  R/O      1  Summary SMART error log
0x02       GPL,SL  R/O      1  Comprehensive SMART error log
0x03       GPL,SL  R/O      1  Ext. Comprehensive SMART error log
0x04       GPL,SL  R/O      8  Device Statistics log
0x06       GPL,SL  R/O      1  SMART self-test log
0x07       GPL,SL  R/O      1  Extended self-test log
0x09       GPL,SL  R/W      1  Selective self-test log
0x10       GPL,SL  R/O      1  NCQ Command Error log
0x11       GPL,SL  R/O      1  SATA Phy Event Counters log
0x30       GPL,SL  R/O      9  IDENTIFY DEVICE data log
0x80-0x9f  GPL,SL  R/W     16  Host vendor specific log
0xa0       GPL,SL  VS      16  Device vendor specific log
0xe0       GPL,SL  R/W      1  SCT Command/Status
0xe1       GPL,SL  R/W      1  SCT Data Transfer

SMART Extended Comprehensive Error Log Version: 1 (1 sectors)
Device Error Count: 195 (device log contains only the most recent 4 errors)
	CR     = Command Register
	FEATR  = Features Register
	COUNT  = Count (was: Sector Count) Register
	LBA_48 = Upper bytes of LBA High/Mid/Low Registers ]  ATA-8
	LH     = LBA High (was: Cylinder High) Register    ]   LBA
	LM     = LBA Mid (was: Cylinder Low) Register      ] Register
	LL     = LBA Low (was: Sector Number) Register     ]
	DV     = Device (was: Device/Head) Register
	DC     = Device Control Register
	ER     = Error register
	ST     = Status register
Powered_Up_Time is measured from power on, and printed as
DDd+hh:mm:SS.sss where DD=days, hh=hours, mm=minutes,
SS=sec, and sss=millisec. It "wraps" after 49.710 days.

Error 195 [2] occurred at disk power-on lifetime: 3997 hours (166 days + 13 hours)
  When the command that caused the error occurred, the device was in an unknown state.

  After command completion occurred, registers were:
  ER -- ST COUNT  LBA_48  LH LM LL DV DC
  -- -- -- == -- == == == -- -- -- -- --
  04 -- 40 00 20 00 1c 64 00 b4 00 00 00   at LBA = 0x1c6400b400 = 121936851968

  Commands leading to the command that caused the error were:
  CR FEATR COUNT  LBA_48  LH LM LL DV DC  Powered_Up_Time  Command/Feature_Name
  -- == -- == -- == == == -- -- -- -- --  ---------------  --------------------
  60 01 00 00 20 00 1c 64 00 b4 00 40 08     03:31:21.360  READ FPDMA QUEUED
  60 00 58 00 18 00 08 b0 00 e4 50 40 08     03:31:21.360  READ FPDMA QUEUED
  60 00 c0 00 10 00 08 b3 00 e4 b0 40 08     03:31:21.360  READ FPDMA QUEUED
  60 01 00 00 08 00 09 4d 00 58 d8 40 08     03:31:21.360  READ FPDMA QUEUED
  60 00 88 00 00 00 08 b3 00 e4 28 40 08     03:31:21.360  READ FPDMA QUEUED

Error 194 [1] occurred at disk power-on lifetime: 3990 hours (166 days + 6 hours)
  When the command that caused the error occurred, the device was in an unknown state.

  After command completion occurred, registers were:
  ER -- ST COUNT  LBA_48  LH LM LL DV DC
  -- -- -- == -- == == == -- -- -- -- --
  04 -- 40 00 98 00 08 21 00 80 28 00 00   at LBA = 0x821008028 = 34913419304

  Commands leading to the command that caused the error were:
  CR FEATR COUNT  LBA_48  LH LM LL DV DC  Powered_Up_Time  Command/Feature_Name
  -- == -- == -- == == == -- -- -- -- --  ---------------  --------------------
  60 00 e0 00 98 00 08 21 00 80 28 40 08     00:00:13.790  READ FPDMA QUEUED
  60 00 08 00 90 00 08 21 00 80 20 40 08     00:00:13.790  READ FPDMA QUEUED
  60 00 20 00 88 00 08 21 00 80 00 40 08     00:00:13.790  READ FPDMA QUEUED
  60 00 08 00 80 00 08 97 00 85 60 40 08     00:00:13.780  READ FPDMA QUEUED
  60 00 08 00 78 00 08 b3 00 85 58 40 08     00:00:13.780  READ FPDMA QUEUED

Error 193 [0] occurred at disk power-on lifetime: 3898 hours (162 days + 10 hours)
  When the command that caused the error occurred, the device was in an unknown state.

  After command completion occurred, registers were:
  ER -- ST COUNT  LBA_48  LH LM LL DV DC
  -- -- -- == -- == == == -- -- -- -- --
  04 -- 40 00 38 00 08 42 00 c8 78 00 00   at LBA = 0x84200c878 = 35467085944

  Commands leading to the command that caused the error were:
  CR FEATR COUNT  LBA_48  LH LM LL DV DC  Powered_Up_Time  Command/Feature_Name
  -- == -- == -- == == == -- -- -- -- --  ---------------  --------------------
  60 00 58 00 38 00 08 42 00 c8 78 40 08  1d+01:20:11.950  READ FPDMA QUEUED
  60 00 10 00 68 00 08 42 00 c8 d0 40 08  1d+01:20:11.950  READ FPDMA QUEUED
  60 00 10 00 60 00 08 42 00 c8 e0 40 08  1d+01:20:11.950  READ FPDMA QUEUED
  61 00 08 00 18 00 00 0b 00 10 c0 40 08  1d+01:20:10.800  WRITE FPDMA QUEUED
  61 00 08 00 10 00 00 22 00 10 98 40 08  1d+01:20:10.800  WRITE FPDMA QUEUED

Error 192 [3] occurred at disk power-on lifetime: 3897 hours (162 days + 9 hours)
  When the command that caused the error occurred, the device was in an unknown state.

  After command completion occurred, registers were:
  ER -- ST COUNT  LBA_48  LH LM LL DV DC
  -- -- -- == -- == == == -- -- -- -- --
  04 -- 40 00 70 00 08 65 00 e1 88 00 00   at LBA = 0x86500e188 = 36054294920

  Commands leading to the command that caused the error were:
  CR FEATR COUNT  LBA_48  LH LM LL DV DC  Powered_Up_Time  Command/Feature_Name
  -- == -- == -- == == == -- -- -- -- --  ---------------  --------------------
  60 00 c8 00 70 00 08 65 00 e1 88 40 08  1d+00:24:04.820  READ FPDMA QUEUED
  60 00 08 00 68 00 08 65 00 e1 48 40 08  1d+00:24:04.820  READ FPDMA QUEUED
  60 00 38 00 60 00 08 61 00 e1 00 40 08  1d+00:24:04.820  READ FPDMA QUEUED
  60 00 08 00 58 00 00 20 00 10 b0 40 08  1d+00:24:03.450  READ FPDMA QUEUED
  60 00 e8 00 50 00 00 1f 00 10 b8 40 08  1d+00:24:03.450  READ FPDMA QUEUED

SMART Extended Self-test Log Version: 1 (1 sectors)
Num  Test_Description    Status                  Remaining  LifeTime(hours)  LBA_of_first_error
# 1  Offline             Completed without error       00%      3743         -
# 2  Offline             Self-test routine in progress 10%      3743         -
# 3  Offline             Self-test routine in progress 10%      3743         -
# 4  Offline             Self-test routine in progress 10%      3743         -
# 5  Offline             Self-test routine in progress 10%      3743         -
# 6  Offline             Self-test routine in progress 10%      3743         -
# 7  Offline             Self-test routine in progress 10%      3743         -
# 8  Offline             Self-test routine in progress 10%      3743         -
# 9  Offline             Self-test routine in progress 10%      3743         -
#10  Offline             Self-test routine in progress 10%      3743         -
#11  Offline             Self-test routine in progress 10%      3743         -
#12  Offline             Self-test routine in progress 10%      3743         -
#13  Offline             Self-test routine in progress 10%      3743         -
#14  Offline             Self-test routine in progress 10%      3743         -
#15  Offline             Self-test routine in progress 10%      3743         -
#16  Offline             Self-test routine in progress 10%      3743         -
#17  Offline             Self-test routine in progress 10%      3743         -
#18  Offline             Self-test routine in progress 10%      3743         -
#19  Offline             Self-test routine in progress 10%      3743         -

SMART Selective self-test log data structure revision number 0
Note: revision number not 1 implies that no selective self-test has ever been run
 SPAN  MIN_LBA  MAX_LBA  CURRENT_TEST_STATUS
    1        0        0  Not_testing
    2        0        0  Not_testing
    3        0        0  Not_testing
    4        0        0  Not_testing
    5        0        0  Not_testing
Selective self-test flags (0x0):
  After scanning selected spans, do NOT read-scan remainder of disk.
If Selective self-test is pending on power-up, resume after 0 minute delay.

SCT Commands not supported

Device Statistics (GP Log 0x04)
Page  Offset Size        Value Flags Description
0x01  =====  =               =  ===  == General Statistics (rev 1) ==
0x01  0x008  4             582  ---  Lifetime Power-On Resets
0x01  0x010  4            4022  ---  Power-on Hours
0x01  0x018  6      8239710208  ---  Logical Sectors Written
0x01  0x020  6        80033129  ---  Number of Write Commands
0x01  0x028  6      7309492224  ---  Logical Sectors Read
0x01  0x030  6        56296643  ---  Number of Read Commands
0x01  =====  =               =  ===  == General Statistics (rev 1) ==
0x01  0x008  4             582  ---  Lifetime Power-On Resets
0x01  0x010  4            4022  ---  Power-on Hours
0x01  0x018  6      8239710208  ---  Logical Sectors Written
0x01  0x020  6        80033129  ---  Number of Write Commands
0x01  0x028  6      7309492224  ---  Logical Sectors Read
0x01  0x030  6        56296643  ---  Number of Read Commands
0x01  =====  =               =  ===  == General Statistics (rev 1) ==
0x01  0x008  4             582  ---  Lifetime Power-On Resets
0x01  0x010  4            4022  ---  Power-on Hours
0x01  0x018  6      8239710208  ---  Logical Sectors Written
0x01  0x020  6        80033129  ---  Number of Write Commands
0x01  0x028  6      7309492224  ---  Logical Sectors Read
0x01  0x030  6        56296643  ---  Number of Read Commands
0x01  =====  =               =  ===  == General Statistics (rev 1) ==
0x01  0x008  4             582  ---  Lifetime Power-On Resets
0x01  0x010  4            4022  ---  Power-on Hours
0x01  0x018  6      8239710208  ---  Logical Sectors Written
0x01  0x020  6        80033129  ---  Number of Write Commands
0x01  0x028  6      7309492224  ---  Logical Sectors Read
0x01  0x030  6        56296643  ---  Number of Read Commands
0x01  =====  =               =  ===  == General Statistics (rev 1) ==
0x01  0x008  4             582  ---  Lifetime Power-On Resets
0x01  0x010  4            4022  ---  Power-on Hours
0x01  0x018  6      8239710208  ---  Logical Sectors Written
0x01  0x020  6        80033129  ---  Number of Write Commands
0x01  0x028  6      7309492224  ---  Logical Sectors Read
0x01  0x030  6        56296643  ---  Number of Read Commands
0x01  =====  =               =  ===  == General Statistics (rev 1) ==
0x01  0x008  4             582  ---  Lifetime Power-On Resets
0x01  0x010  4            4022  ---  Power-on Hours
0x01  0x018  6      8239710208  ---  Logical Sectors Written
0x01  0x020  6        80033129  ---  Number of Write Commands
0x01  0x028  6      7309492224  ---  Logical Sectors Read
0x01  0x030  6        56296643  ---  Number of Read Commands
0x01  =====  =               =  ===  == General Statistics (rev 1) ==
0x01  0x008  4             582  ---  Lifetime Power-On Resets
0x01  0x010  4            4022  ---  Power-on Hours
0x01  0x018  6      8239710208  ---  Logical Sectors Written
0x01  0x020  6        80033129  ---  Number of Write Commands
0x01  0x028  6      7309492224  ---  Logical Sectors Read
0x01  0x030  6        56296643  ---  Number of Read Commands
0x01  =====  =               =  ===  == General Statistics (rev 1) ==
0x01  0x008  4             582  ---  Lifetime Power-On Resets
0x01  0x010  4            4022  ---  Power-on Hours
0x01  0x018  6      8239710208  ---  Logical Sectors Written
0x01  0x020  6        80033129  ---  Number of Write Commands
0x01  0x028  6      7309492224  ---  Logical Sectors Read
0x01  0x030  6        56296643  ---  Number of Read Commands
                                |||_ C monitored condition met
                                ||__ D supports DSN
                                |___ N normalized value

Pending Defects log (GP Log 0x0c) not supported

SATA Phy Event Counters (GP Log 0x11)
ID      Size     Value  Description
0x0001  4            0  Command failed due to ICRC error
0x0009  4         1003  Transition from drive PhyRdy to drive PhyNRdy
0x000a  4        10484  Device-to-host register FISes sent due to a COMRESET
0x000b  4         1574  CRC errors within host-to-device FIS
0x000d  4         1574  Non-CRC errors within host-to-device FIS



