=== START OF INFORMATION SECTION ===
Model Family:     Seagate Barracuda 7200.10
Device Model:     ST3250310AS
Serial Number:    --
Firmware Version: 3.AAC
User Capacity:    250 058 268 160 bytes [250 GB]
Sector Size:      512 bytes logical/physical
Device is:        In smartctl database [for details use: -P show]
ATA Version is:   ATA/ATAPI-7 (minor revision not indicated)
Local Time is:    Thu Jul 14 01:57:36 2016 CEST
SMART support is: Available - device has SMART capability.
SMART support is: Enabled
AAM feature is:   Unavailable
APM feature is:   Unavailable
Rd look-ahead is: Enabled
Write cache is:   Enabled
ATA Security is:  Disabled, frozen [SEC2]
Wt Cache Reorder: Unavailable

=== START OF READ SMART DATA SECTION ===
SMART overall-health self-assessment test result: PASSED

General SMART Values:
Offline data collection status:  (0x82)	Offline data collection activity
					was completed without error.
					Auto Offline Data Collection: Enabled.
Self-test execution status:      (   0)	The previous self-test routine completed
					without error or no self-test has ever 
					been run.
Total time to complete Offline 
data collection: 		(  430) seconds.
Offline data collection
capabilities: 			 (0x5b) SMART execute Offline immediate.
					Auto Offline data collection on/off support.
					Suspend Offline collection upon new
					command.
					Offline surface scan supported.
					Self-test supported.
					No Conveyance Self-test supported.
					Selective Self-test supported.
SMART capabilities:            (0x0003)	Saves SMART data before entering
					power-saving mode.
					Supports SMART auto save timer.
Error logging capability:        (0x01)	Error logging supported.
					General Purpose Logging supported.
Short self-test routine 
recommended polling time: 	 (   1) minutes.
Extended self-test routine
recommended polling time: 	 (  64) minutes.
SCT capabilities: 	       (0x0001)	SCT Status supported.

SMART Attributes Data Structure revision number: 10
Vendor Specific SMART Attributes with Thresholds:
ID# ATTRIBUTE_NAME          FLAGS    VALUE WORST THRESH FAIL RAW_VALUE
  1 Raw_Read_Error_Rate     POSR--   108   091   006    -    16796221
  3 Spin_Up_Time            PO----   098   097   000    -    0
  4 Start_Stop_Count        -O--CK   097   097   020    -    4032
  5 Reallocated_Sector_Ct   PO--CK   100   100   036    -    0
  7 Seek_Error_Rate         POSR--   084   060   030    -    265215838
  9 Power_On_Hours          -O--CK   088   088   000    -    11083
 10 Spin_Retry_Count        PO--C-   100   100   097    -    0
 12 Power_Cycle_Count       -O--CK   097   097   020    -    3876
187 Reported_Uncorrect      -O--CK   001   001   000    -    117
189 High_Fly_Writes         -O-RCK   098   098   000    -    2
190 Airflow_Temperature_Cel -O---K   060   051   045    -    40 (Min/Max 39/40)
194 Temperature_Celsius     -O---K   040   049   000    -    40 (0 2 0 0 0)
195 Hardware_ECC_Recovered  -O-RC-   070   057   000    -    122375564
197 Current_Pending_Sector  -O--C-   100   100   000    -    0
198 Offline_Uncorrectable   ----C-   100   100   000    -    0
199 UDMA_CRC_Error_Count    -OSRCK   200   200   000    -    2
200 Multi_Zone_Error_Rate   ------   100   253   000    -    0
202 Data_Address_Mark_Errs  -O--CK   100   253   000    -    0
                            ||||||_ K auto-keep
                            |||||__ C event count
                            ||||___ R error rate
                            |||____ S speed/performance
                            ||_____ O updated online
                            |______ P prefailure warning

General Purpose Log Directory Version 1
SMART           Log Directory Version 1 [multi-sector log support]
Address    Access  R/W   Size  Description
0x00       GPL,SL  R/O      1  Log Directory
0x01       GPL,SL  R/O      1  Summary SMART error log
0x02       GPL,SL  R/O      5  Comprehensive SMART error log
0x03       GPL,SL  R/O      5  Ext. Comprehensive SMART error log
0x06       GPL,SL  R/O      1  SMART self-test log
0x07       GPL,SL  R/O      1  Extended self-test log
0x09       GPL,SL  R/W      1  Selective self-test log
0x10       GPL,SL  R/O      1  NCQ Command Error log
0x11       GPL,SL  R/O      1  SATA Phy Event Counters
0x20       GPL,SL  R/O      1  Streaming performance log [OBS-8]
0x21       GPL,SL  R/O      1  Write stream error log
0x22       GPL,SL  R/O      1  Read stream error log
0x23       GPL,SL  R/O      1  Delayed sector log [OBS-8]
0x80-0x9f  GPL,SL  R/W     16  Host vendor specific log
0xa0       GPL,SL  VS       1  Device vendor specific log
0xa1       GPL,SL  VS      20  Device vendor specific log
0xa2       GPL,SL  VS     101  Device vendor specific log
0xa8       GPL,SL  VS      20  Device vendor specific log
0xa9       GPL,SL  VS       1  Device vendor specific log
0xe0       GPL,SL  R/W      1  SCT Command/Status
0xe1       GPL,SL  R/W      1  SCT Data Transfer
0xff       GPL     -    23040  Reserved

SMART Extended Comprehensive Error Log Version: 1 (5 sectors)
Device Error Count: 125 (device log contains only the most recent 20 errors)
	CR     = Command Register
	FEATR  = Features Register
	COUNT  = Count (was: Sector Count) Register
	LBA_48 = Upper bytes of LBA High/Mid/Low Registers ]  ATA-8
	LH     = LBA High (was: Cylinder High) Register    ]   LBA
	LM     = LBA Mid (was: Cylinder Low) Register      ] Register
	LL     = LBA Low (was: Sector Number) Register     ]
	DV     = Device (was: Device/Head) Register
	DC     = Device Control Register
	ER     = Error register
	ST     = Status register
Powered_Up_Time is measured from power on, and printed as
DDd+hh:mm:SS.sss where DD=days, hh=hours, mm=minutes,
SS=sec, and sss=millisec. It "wraps" after 49.710 days.

Error 125 [4] occurred at disk power-on lifetime: 10711 hours (446 days + 7 hours)
  When the command that caused the error occurred, the device was active or idle.

  After command completion occurred, registers were:
  ER -- ST COUNT  LBA_48  LH LM LL DV DC
  -- -- -- == -- == == == -- -- -- -- --
  40 -- 51 00 00 00 03 72 00 7b 64 e0 00  Error: UNC at LBA = 0x372007b64 = 14797536100

  Commands leading to the command that caused the error were:
  CR FEATR COUNT  LBA_48  LH LM LL DV DC  Powered_Up_Time  Command/Feature_Name
  -- == -- == -- == == == -- -- -- -- --  ---------------  --------------------
  25 00 00 00 10 00 03 72 00 7b 58 e0 00     00:06:56.298  READ DMA EXT
  35 00 00 00 08 00 00 5e 00 62 48 e0 00     00:06:56.297  WRITE DMA EXT
  35 00 00 00 08 00 00 cd 00 5b c8 e0 00     00:06:56.296  WRITE DMA EXT
  35 00 00 01 00 00 10 fc 00 21 60 e0 00     00:06:56.296  WRITE DMA EXT
  35 00 00 01 00 00 10 fb 00 21 60 e0 00     00:06:56.295  WRITE DMA EXT

Error 124 [3] occurred at disk power-on lifetime: 10711 hours (446 days + 7 hours)
  When the command that caused the error occurred, the device was active or idle.

  After command completion occurred, registers were:
  ER -- ST COUNT  LBA_48  LH LM LL DV DC
  -- -- -- == -- == == == -- -- -- -- --
  40 -- 51 00 00 00 03 72 00 7b 64 e0 00  Error: UNC at LBA = 0x372007b64 = 14797536100

  Commands leading to the command that caused the error were:
  CR FEATR COUNT  LBA_48  LH LM LL DV DC  Powered_Up_Time  Command/Feature_Name
  -- == -- == -- == == == -- -- -- -- --  ---------------  --------------------
  25 00 00 00 10 00 03 72 00 7b 58 e0 00     00:06:52.110  READ DMA EXT
  25 00 00 00 20 00 0f 1d 00 7a a0 e0 00     00:06:52.110  READ DMA EXT
  25 00 00 00 40 00 03 72 00 7b 18 e0 00     00:06:52.110  READ DMA EXT
  25 00 00 00 40 00 03 73 00 7b e8 e0 00     00:06:52.109  READ DMA EXT
  25 00 00 00 80 00 03 73 00 7b 68 e0 00     00:06:52.109  READ DMA EXT

Error 123 [2] occurred at disk power-on lifetime: 10711 hours (446 days + 7 hours)
  When the command that caused the error occurred, the device was active or idle.

  After command completion occurred, registers were:
  ER -- ST COUNT  LBA_48  LH LM LL DV DC
  -- -- -- == -- == == == -- -- -- -- --
  40 -- 51 00 00 00 03 72 00 7b 64 e0 00  Error: UNC at LBA = 0x372007b64 = 14797536100

  Commands leading to the command that caused the error were:
  CR FEATR COUNT  LBA_48  LH LM LL DV DC  Powered_Up_Time  Command/Feature_Name
  -- == -- == -- == == == -- -- -- -- --  ---------------  --------------------
  25 00 00 00 80 00 03 72 00 7b 60 e0 00     00:06:47.978  READ DMA EXT
  35 00 00 00 08 00 00 e3 00 5b 28 e0 00     00:06:47.977  WRITE DMA EXT
  35 00 00 01 00 00 10 ec 00 21 60 e0 00     00:06:47.976  WRITE DMA EXT
  35 00 00 01 00 00 10 eb 00 21 60 e0 00     00:06:47.975  WRITE DMA EXT
  35 00 00 01 00 00 10 ea 00 21 60 e0 00     00:06:47.974  WRITE DMA EXT

Error 122 [1] occurred at disk power-on lifetime: 10711 hours (446 days + 7 hours)
  When the command that caused the error occurred, the device was active or idle.

  After command completion occurred, registers were:
  ER -- ST COUNT  LBA_48  LH LM LL DV DC
  -- -- -- == -- == == == -- -- -- -- --
  40 -- 51 00 00 00 03 72 00 7b 64 e0 00  Error: UNC at LBA = 0x372007b64 = 14797536100

  Commands leading to the command that caused the error were:
  CR FEATR COUNT  LBA_48  LH LM LL DV DC  Powered_Up_Time  Command/Feature_Name
  -- == -- == -- == == == -- -- -- -- --  ---------------  --------------------
  25 00 00 00 80 00 03 72 00 7b 58 e0 00     00:06:39.698  READ DMA EXT
  35 00 00 00 08 00 00 cd 00 5b b8 e0 00     00:06:39.698  WRITE DMA EXT
  35 00 00 01 00 00 10 e4 00 21 60 e0 00     00:06:39.698  WRITE DMA EXT
  35 00 00 01 00 00 10 e3 00 21 60 e0 00     00:06:39.697  WRITE DMA EXT
  35 00 00 01 00 00 10 e2 00 21 60 e0 00     00:06:39.696  WRITE DMA EXT

Error 121 [0] occurred at disk power-on lifetime: 10711 hours (446 days + 7 hours)
  When the command that caused the error occurred, the device was active or idle.

  After command completion occurred, registers were:
  ER -- ST COUNT  LBA_48  LH LM LL DV DC
  -- -- -- == -- == == == -- -- -- -- --
  40 -- 51 00 00 00 03 72 00 7b 64 e0 00  Error: UNC at LBA = 0x372007b64 = 14797536100

  Commands leading to the command that caused the error were:
  CR FEATR COUNT  LBA_48  LH LM LL DV DC  Powered_Up_Time  Command/Feature_Name
  -- == -- == -- == == == -- -- -- -- --  ---------------  --------------------
  25 00 00 00 80 00 03 72 00 7b 50 e0 00     00:06:39.698  READ DMA EXT
  35 00 00 00 08 00 00 cd 00 5b c8 e0 00     00:06:39.698  WRITE DMA EXT
  35 00 00 01 00 00 10 dc 00 21 60 e0 00     00:06:39.698  WRITE DMA EXT
  35 00 00 01 00 00 10 db 00 21 60 e0 00     00:06:39.697  WRITE DMA EXT
  35 00 00 01 00 00 10 da 00 21 60 e0 00     00:06:39.696  WRITE DMA EXT

Error 120 [19] occurred at disk power-on lifetime: 10711 hours (446 days + 7 hours)
  When the command that caused the error occurred, the device was active or idle.

  After command completion occurred, registers were:
  ER -- ST COUNT  LBA_48  LH LM LL DV DC
  -- -- -- == -- == == == -- -- -- -- --
  40 -- 51 00 00 00 03 72 00 7b 64 e0 00  Error: UNC at LBA = 0x372007b64 = 14797536100

  Commands leading to the command that caused the error were:
  CR FEATR COUNT  LBA_48  LH LM LL DV DC  Powered_Up_Time  Command/Feature_Name
  -- == -- == -- == == == -- -- -- -- --  ---------------  --------------------
  25 00 00 00 80 00 03 72 00 7b 48 e0 00     00:06:35.591  READ DMA EXT
  35 00 00 00 08 00 00 cd 00 5f b0 e0 00     00:06:35.591  WRITE DMA EXT
  35 00 00 00 08 00 00 e3 00 5b 20 e0 00     00:06:35.590  WRITE DMA EXT
  35 00 00 01 00 00 10 d4 00 21 60 e0 00     00:06:35.589  WRITE DMA EXT
  35 00 00 01 00 00 10 d3 00 21 60 e0 00     00:06:35.588  WRITE DMA EXT

Error 119 [18] occurred at disk power-on lifetime: 10711 hours (446 days + 7 hours)
  When the command that caused the error occurred, the device was active or idle.

  After command completion occurred, registers were:
  ER -- ST COUNT  LBA_48  LH LM LL DV DC
  -- -- -- == -- == == == -- -- -- -- --
  40 -- 51 00 00 00 03 72 00 7b 64 e0 00  Error: UNC at LBA = 0x372007b64 = 14797536100

  Commands leading to the command that caused the error were:
  CR FEATR COUNT  LBA_48  LH LM LL DV DC  Powered_Up_Time  Command/Feature_Name
  -- == -- == -- == == == -- -- -- -- --  ---------------  --------------------
  25 00 00 00 80 00 03 72 00 7b 40 e0 00     00:06:31.390  READ DMA EXT
  35 00 00 00 08 00 00 ed 00 5f f0 e0 00     00:06:31.389  WRITE DMA EXT
  35 00 00 00 08 00 00 cd 00 5b b0 e0 00     00:06:31.388  WRITE DMA EXT
  35 00 00 00 08 00 00 25 00 57 60 e0 00     00:06:27.180  WRITE DMA EXT
  35 00 00 01 00 00 10 cc 00 21 60 e0 00     00:06:27.180  WRITE DMA EXT

Error 118 [17] occurred at disk power-on lifetime: 10711 hours (446 days + 7 hours)
  When the command that caused the error occurred, the device was active or idle.

  After command completion occurred, registers were:
  ER -- ST COUNT  LBA_48  LH LM LL DV DC
  -- -- -- == -- == == == -- -- -- -- --
  40 -- 51 00 00 00 03 72 00 7b 64 e0 00  Error: UNC at LBA = 0x372007b64 = 14797536100

  Commands leading to the command that caused the error were:
  CR FEATR COUNT  LBA_48  LH LM LL DV DC  Powered_Up_Time  Command/Feature_Name
  -- == -- == -- == == == -- -- -- -- --  ---------------  --------------------
  25 00 00 00 80 00 03 72 00 7b 38 e0 00     00:06:27.142  READ DMA EXT
  35 00 00 00 08 00 00 cf 00 5f 98 e0 00     00:06:22.938  WRITE DMA EXT
  35 00 00 00 08 00 00 cd 00 5b c0 e0 00     00:06:22.938  WRITE DMA EXT
  35 00 00 00 08 00 00 bc 00 00 00 e0 00     00:06:27.180  WRITE DMA EXT
  35 00 00 00 08 00 00 30 00 00 10 e0 00     00:06:27.180  WRITE DMA EXT

SMART Extended Self-test Log Version: 1 (1 sectors)

SMART Selective self-test log data structure revision number 1
 SPAN  MIN_LBA  MAX_LBA  CURRENT_TEST_STATUS
    1        0        0  Not_testing
    2        0        0  Not_testing
    3        0        0  Not_testing
    4        0        0  Not_testing
    5        0        0  Not_testing
Selective self-test flags (0x0):
  After scanning selected spans, do NOT read-scan remainder of disk.
If Selective self-test is pending on power-up, resume after 0 minute delay.

SCT Status Version:                  2
SCT Version (vendor specific):       521 (0x0209)
SCT Support Level:                   1
Device State:                        Active (0)
Current Temperature:                 40 Celsius
Power Cycle Max Temperature:          0 Celsius
Lifetime    Max Temperature:          0 Celsius

SCT Data Table command not supported

SCT Error Recovery Control command not supported

Device Statistics (GP Log 0x04) not supported

SATA Phy Event Counters (GP Log 0x11)
ID      Size     Value  Description
0x000a  2           17  Device-to-host register FISes sent due to a COMRESET
0x0001  2            0  Command failed due to ICRC error
0x0003  2            0  R_ERR response for device-to-host data FIS
0x0004  2            0  R_ERR response for host-to-device data FIS
0x0006  2            0  R_ERR response for device-to-host non-data FIS
0x0007  2            0  R_ERR response for host-to-device non-data FIS
0x0009  2           22  Transition from drive PhyRdy to drive PhyNRdy
0x8002  2            0  Vendor specific
0x8003  2           11  Vendor specific
0x8004  2            0  Vendor specific

