=== START OF INFORMATION SECTION ===
Model Family:     Seagate Barracuda 7200.10
Device Model:     ST3250310AS
Serial Number:    --
Firmware Version: 3.AAC
User Capacity:    250,059,350,016 bytes [250 GB]
Sector Size:      512 bytes logical/physical
Device is:        In smartctl database [for details use: -P show]
ATA Version is:   ATA/ATAPI-7 (minor revision not indicated)
Local Time is:    Sun Sep 23 00:44:37 2018 MSK
SMART support is: Available - device has SMART capability.
SMART support is: Enabled
AAM feature is:   Unavailable
APM feature is:   Unavailable
Rd look-ahead is: Enabled
Write cache is:   Enabled
DSN feature is:   Unavailable
ATA Security is:  Disabled, frozen [SEC2]
Wt Cache Reorder: Unavailable

=== START OF READ SMART DATA SECTION ===
SMART overall-health self-assessment test result: PASSED
See vendor-specific Attribute list for marginal Attributes.

General SMART Values:
Offline data collection status:  (0x82)	Offline data collection activity
					was completed without error.
					Auto Offline Data Collection: Enabled.
Self-test execution status:      (   0)	The previous self-test routine completed
					without error or no self-test has ever 
					been run.
Total time to complete Offline 
data collection: 		(  430) seconds.
Offline data collection
capabilities: 			 (0x5b) SMART execute Offline immediate.
					Auto Offline data collection on/off support.
					Suspend Offline collection upon new
					command.
					Offline surface scan supported.
					Self-test supported.
					No Conveyance Self-test supported.
					Selective Self-test supported.
SMART capabilities:            (0x0003)	Saves SMART data before entering
					power-saving mode.
					Supports SMART auto save timer.
Error logging capability:        (0x01)	Error logging supported.
					General Purpose Logging supported.
Short self-test routine 
recommended polling time: 	 (   1) minutes.
Extended self-test routine
recommended polling time: 	 (  64) minutes.
SCT capabilities: 	       (0x0001)	SCT Status supported.

SMART Attributes Data Structure revision number: 10
Vendor Specific SMART Attributes with Thresholds:
ID# ATTRIBUTE_NAME          FLAGS    VALUE WORST THRESH FAIL RAW_VALUE
  1 Raw_Read_Error_Rate     POSR--   118   090   006    -    176562779
  3 Spin_Up_Time            PO----   097   097   000    -    0
  4 Start_Stop_Count        -O--CK   091   091   020    -    9855
  5 Reallocated_Sector_Ct   PO--CK   100   100   036    -    0
  7 Seek_Error_Rate         POSR--   081   060   030    -    133298206
  9 Power_On_Hours          -O--CK   057   057   000    -    38252
 10 Spin_Retry_Count        PO--C-   100   100   097    -    0
 12 Power_Cycle_Count       -O--CK   091   091   020    -    9766
187 Reported_Uncorrect      -O--CK   021   021   000    -    79
189 High_Fly_Writes         -O-RCK   100   100   000    -    0
190 Airflow_Temperature_Cel -O---K   059   042   045    Past 41 (Min/Max 39/42)
194 Temperature_Celsius     -O---K   041   058   000    -    41 (0 17 0 0 0)
195 Hardware_ECC_Recovered  -O-RC-   079   055   000    -    169495931
197 Current_Pending_Sector  -O--C-   100   100   000    -    0
198 Offline_Uncorrectable   ----C-   100   100   000    -    0
199 UDMA_CRC_Error_Count    -OSRCK   200   200   000    -    0
200 Multi_Zone_Error_Rate   ------   100   253   000    -    0
202 Data_Address_Mark_Errs  -O--CK   100   253   000    -    0
                            ||||||_ K auto-keep
                            |||||__ C event count
                            ||||___ R error rate
                            |||____ S speed/performance
                            ||_____ O updated online
                            |______ P prefailure warning

General Purpose Log Directory Version 1
SMART           Log Directory Version 1 [multi-sector log support]
Address    Access  R/W   Size  Description
0x00       GPL,SL  R/O      1  Log Directory
0x01       GPL,SL  R/O      1  Summary SMART error log
0x02       GPL,SL  R/O      5  Comprehensive SMART error log
0x03       GPL,SL  R/O      5  Ext. Comprehensive SMART error log
0x06       GPL,SL  R/O      1  SMART self-test log
0x07       GPL,SL  R/O      1  Extended self-test log
0x09       GPL,SL  R/W      1  Selective self-test log
0x10       GPL,SL  R/O      1  NCQ Command Error log
0x11       GPL,SL  R/O      1  SATA Phy Event Counters log
0x20       GPL,SL  R/O      1  Streaming performance log [OBS-8]
0x21       GPL,SL  R/O      1  Write stream error log
0x22       GPL,SL  R/O      1  Read stream error log
0x23       GPL,SL  R/O      1  Delayed sector log [OBS-8]
0x80-0x9f  GPL,SL  R/W     16  Host vendor specific log
0xa0       GPL,SL  VS       1  Device vendor specific log
0xa1       GPL,SL  VS      20  Device vendor specific log
0xa2       GPL,SL  VS     101  Device vendor specific log
0xa8       GPL,SL  VS      20  Device vendor specific log
0xa9       GPL,SL  VS       1  Device vendor specific log
0xe0       GPL,SL  R/W      1  SCT Command/Status
0xe1       GPL,SL  R/W      1  SCT Data Transfer
0xff       GPL     -    23040  Reserved

SMART Extended Comprehensive Error Log Version: 1 (5 sectors)
Device Error Count: 79 (device log contains only the most recent 20 errors)
	CR     = Command Register
	FEATR  = Features Register
	COUNT  = Count (was: Sector Count) Register
	LBA_48 = Upper bytes of LBA High/Mid/Low Registers ]  ATA-8
	LH     = LBA High (was: Cylinder High) Register    ]   LBA
	LM     = LBA Mid (was: Cylinder Low) Register      ] Register
	LL     = LBA Low (was: Sector Number) Register     ]
	DV     = Device (was: Device/Head) Register
	DC     = Device Control Register
	ER     = Error register
	ST     = Status register
Powered_Up_Time is measured from power on, and printed as
DDd+hh:mm:SS.sss where DD=days, hh=hours, mm=minutes,
SS=sec, and sss=millisec. It "wraps" after 49.710 days.

Error 79 [18] occurred at disk power-on lifetime: 10266 hours (427 days + 18 hours)
  When the command that caused the error occurred, the device was active or idle.

  After command completion occurred, registers were:
  ER -- ST COUNT  LBA_48  LH LM LL DV DC
  -- -- -- == -- == == == -- -- -- -- --
  40 -- 51 00 00 00 00 03 00 60 75 e0 00  Error: UNC at LBA = 0x03006075 = 50356341

  Commands leading to the command that caused the error were:
  CR FEATR COUNT  LBA_48  LH LM LL DV DC  Powered_Up_Time  Command/Feature_Name
  -- == -- == -- == == == -- -- -- -- --  ---------------  --------------------
  25 00 00 00 40 00 00 03 00 60 3f e0 00     03:38:49.860  READ DMA EXT
  35 00 00 00 10 00 00 02 00 60 ff e0 00     03:38:49.859  WRITE DMA EXT
  35 00 00 00 20 00 01 0f 00 7b bf e0 00     03:38:49.859  WRITE DMA EXT
  35 00 00 00 20 00 01 97 00 7c 7f e0 00     03:38:49.850  WRITE DMA EXT
  25 00 00 00 20 00 00 02 00 60 ff e0 00     03:38:49.846  READ DMA EXT

Error 78 [17] occurred at disk power-on lifetime: 10262 hours (427 days + 14 hours)
  When the command that caused the error occurred, the device was active or idle.

  After command completion occurred, registers were:
  ER -- ST COUNT  LBA_48  LH LM LL DV DC
  -- -- -- == -- == == == -- -- -- -- --
  40 -- 51 00 00 00 00 03 00 60 75 e0 00  Error: UNC at LBA = 0x03006075 = 50356341

  Commands leading to the command that caused the error were:
  CR FEATR COUNT  LBA_48  LH LM LL DV DC  Powered_Up_Time  Command/Feature_Name
  -- == -- == -- == == == -- -- -- -- --  ---------------  --------------------
  25 00 00 00 08 00 00 03 00 60 6f e0 00     06:39:35.980  READ DMA EXT
  25 00 00 00 08 00 00 03 00 60 67 e0 00     06:39:31.639  READ DMA EXT
  25 00 00 00 08 00 00 03 00 60 5f e0 00     06:39:31.636  READ DMA EXT
  35 00 00 00 13 00 01 c1 00 0d 47 e0 00     06:39:31.631  WRITE DMA EXT
  25 00 00 00 20 00 00 03 00 60 5f e0 00     06:39:31.630  READ DMA EXT

Error 77 [16] occurred at disk power-on lifetime: 10262 hours (427 days + 14 hours)
  When the command that caused the error occurred, the device was active or idle.

  After command completion occurred, registers were:
  ER -- ST COUNT  LBA_48  LH LM LL DV DC
  -- -- -- == -- == == == -- -- -- -- --
  40 -- 51 00 00 00 00 03 00 60 75 e0 00  Error: UNC at LBA = 0x03006075 = 50356341

  Commands leading to the command that caused the error were:
  CR FEATR COUNT  LBA_48  LH LM LL DV DC  Powered_Up_Time  Command/Feature_Name
  -- == -- == -- == == == -- -- -- -- --  ---------------  --------------------
  25 00 00 00 20 00 00 03 00 60 5f e0 00     06:39:31.590  READ DMA EXT
  35 00 00 00 10 00 00 03 00 60 3f e0 00     06:39:31.639  WRITE DMA EXT
  35 00 00 00 08 00 00 00 00 60 a7 e0 00     06:39:31.636  WRITE DMA EXT
  35 00 00 00 08 00 00 fb 00 61 af e0 00     06:39:31.631  WRITE DMA EXT
  35 00 00 00 20 00 01 19 00 7b 9f e0 00     06:39:31.630  WRITE DMA EXT

Error 76 [15] occurred at disk power-on lifetime: 10266 hours (427 days + 18 hours)
  When the command that caused the error occurred, the device was active or idle.

  After command completion occurred, registers were:
  ER -- ST COUNT  LBA_48  LH LM LL DV DC
  -- -- -- == -- == == == -- -- -- -- --
  40 -- 51 00 00 00 00 03 00 60 75 e0 00  Error: UNC at LBA = 0x03006075 = 50356341

  Commands leading to the command that caused the error were:
  CR FEATR COUNT  LBA_48  LH LM LL DV DC  Powered_Up_Time  Command/Feature_Name
  -- == -- == -- == == == -- -- -- -- --  ---------------  --------------------
  25 00 00 00 08 00 00 03 00 60 6f e0 00     03:38:54.041  READ DMA EXT
  25 00 00 00 08 00 00 03 00 60 67 e0 00     03:38:54.041  READ DMA EXT
  25 00 00 00 08 00 00 03 00 60 5f e0 00     03:38:54.040  READ DMA EXT
  25 00 00 00 08 00 00 03 00 60 57 e0 00     03:38:54.040  READ DMA EXT
  25 00 00 00 08 00 00 03 00 60 4f e0 00     03:38:54.031  READ DMA EXT

Error 75 [14] occurred at disk power-on lifetime: 10266 hours (427 days + 18 hours)
  When the command that caused the error occurred, the device was active or idle.

  After command completion occurred, registers were:
  ER -- ST COUNT  LBA_48  LH LM LL DV DC
  -- -- -- == -- == == == -- -- -- -- --
  40 -- 51 00 00 00 00 03 00 60 75 e0 00  Error: UNC at LBA = 0x03006075 = 50356341

  Commands leading to the command that caused the error were:
  CR FEATR COUNT  LBA_48  LH LM LL DV DC  Powered_Up_Time  Command/Feature_Name
  -- == -- == -- == == == -- -- -- -- --  ---------------  --------------------
  25 00 00 00 40 00 00 03 00 60 3f e0 00     03:38:49.860  READ DMA EXT
  35 00 00 00 10 00 00 02 00 60 ff e0 00     03:38:49.859  WRITE DMA EXT
  35 00 00 00 20 00 01 0f 00 7b bf e0 00     03:38:49.859  WRITE DMA EXT
  35 00 00 00 20 00 01 97 00 7c 7f e0 00     03:38:49.850  WRITE DMA EXT
  25 00 00 00 20 00 00 02 00 60 ff e0 00     03:38:49.846  READ DMA EXT

Error 74 [13] occurred at disk power-on lifetime: 10262 hours (427 days + 14 hours)
  When the command that caused the error occurred, the device was active or idle.

  After command completion occurred, registers were:
  ER -- ST COUNT  LBA_48  LH LM LL DV DC
  -- -- -- == -- == == == -- -- -- -- --
  40 -- 51 00 00 00 00 03 00 60 75 e0 00  Error: UNC at LBA = 0x03006075 = 50356341

  Commands leading to the command that caused the error were:
  CR FEATR COUNT  LBA_48  LH LM LL DV DC  Powered_Up_Time  Command/Feature_Name
  -- == -- == -- == == == -- -- -- -- --  ---------------  --------------------
  25 00 00 00 08 00 00 03 00 60 6f e0 00     06:39:35.980  READ DMA EXT
  25 00 00 00 08 00 00 03 00 60 67 e0 00     06:39:31.639  READ DMA EXT
  25 00 00 00 08 00 00 03 00 60 5f e0 00     06:39:31.636  READ DMA EXT
  35 00 00 00 13 00 01 c1 00 0d 47 e0 00     06:39:31.631  WRITE DMA EXT
  25 00 00 00 20 00 00 03 00 60 5f e0 00     06:39:31.630  READ DMA EXT

Error 73 [12] occurred at disk power-on lifetime: 10262 hours (427 days + 14 hours)
  When the command that caused the error occurred, the device was active or idle.

  After command completion occurred, registers were:
  ER -- ST COUNT  LBA_48  LH LM LL DV DC
  -- -- -- == -- == == == -- -- -- -- --
  40 -- 51 00 00 00 00 03 00 60 75 e0 00  Error: UNC at LBA = 0x03006075 = 50356341

  Commands leading to the command that caused the error were:
  CR FEATR COUNT  LBA_48  LH LM LL DV DC  Powered_Up_Time  Command/Feature_Name
  -- == -- == -- == == == -- -- -- -- --  ---------------  --------------------
  25 00 00 00 20 00 00 03 00 60 5f e0 00     06:39:31.590  READ DMA EXT
  35 00 00 00 10 00 00 03 00 60 3f e0 00     06:39:31.639  WRITE DMA EXT
  35 00 00 00 08 00 00 00 00 60 a7 e0 00     06:39:31.636  WRITE DMA EXT
  35 00 00 00 08 00 00 fb 00 61 af e0 00     06:39:31.631  WRITE DMA EXT
  35 00 00 00 20 00 01 19 00 7b 9f e0 00     06:39:31.630  WRITE DMA EXT

Error 72 [11] occurred at disk power-on lifetime: 10266 hours (427 days + 18 hours)
  When the command that caused the error occurred, the device was active or idle.

  After command completion occurred, registers were:
  ER -- ST COUNT  LBA_48  LH LM LL DV DC
  -- -- -- == -- == == == -- -- -- -- --
  40 -- 51 00 00 00 00 03 00 60 75 e0 00  Error: UNC at LBA = 0x03006075 = 50356341

  Commands leading to the command that caused the error were:
  CR FEATR COUNT  LBA_48  LH LM LL DV DC  Powered_Up_Time  Command/Feature_Name
  -- == -- == -- == == == -- -- -- -- --  ---------------  --------------------
  25 00 00 00 08 00 00 03 00 60 6f e0 00     03:38:54.041  READ DMA EXT
  25 00 00 00 08 00 00 03 00 60 67 e0 00     03:38:54.041  READ DMA EXT
  25 00 00 00 08 00 00 03 00 60 5f e0 00     03:38:54.040  READ DMA EXT
  25 00 00 00 08 00 00 03 00 60 57 e0 00     03:38:54.040  READ DMA EXT
  25 00 00 00 08 00 00 03 00 60 4f e0 00     03:38:54.031  READ DMA EXT

SMART Extended Self-test Log Version: 1 (1 sectors)
Num  Test_Description    Status                  Remaining  LifeTime(hours)  LBA_of_first_error
# 1  Extended offline    Completed without error       00%     33431         -
# 2  Short offline       Completed without error       00%     33223         -
# 3  Short offline       Completed without error       00%     33040         -
# 4  Extended offline    Aborted by host               90%     33000         -
# 5  Short offline       Completed without error       00%     33000         -
# 6  Short offline       Aborted by host               50%     33000         -
# 7  Extended offline    Aborted by host               90%     32245         -
# 8  Short offline       Completed without error       00%     32245         -
# 9  Short offline       Completed without error       00%     31975         -
#10  Short offline       Completed without error       00%     31974         -
#11  Short offline       Completed without error       00%     31972         -
#12  Conveyance offline  Aborted by host               50%     22623         -
#13  Short offline       Completed without error       00%     22623         -
#14  Short offline       Aborted by host               30%     21721         -
#15  Short offline       Completed without error       00%      7804         -
#16  Short offline       Aborted by host               90%      7804         -
#17  Extended offline    Aborted by host               90%      7804         -
#18  Extended offline    Aborted by host               90%      7804         -
#19  Short offline       Aborted by host               20%       554         -

SMART Selective self-test log data structure revision number 1
 SPAN  MIN_LBA  MAX_LBA  CURRENT_TEST_STATUS
    1        0        0  Not_testing
    2        0        0  Not_testing
    3        0        0  Not_testing
    4        0        0  Not_testing
    5        0        0  Not_testing
Selective self-test flags (0x0):
  After scanning selected spans, do NOT read-scan remainder of disk.
If Selective self-test is pending on power-up, resume after 0 minute delay.

SCT Status Version:                  2
SCT Version (vendor specific):       521 (0x0209)
SCT Support Level:                   1
Device State:                        Active (0)
Current Temperature:                 41 Celsius
Power Cycle Max Temperature:          0 Celsius
Lifetime    Max Temperature:          0 Celsius

SCT Data Table command not supported

SCT Error Recovery Control command not supported

Device Statistics (GP/SMART Log 0x04) not supported

Pending Defects log (GP Log 0x0c) not supported

SATA Phy Event Counters (GP Log 0x11)
ID      Size     Value  Description
0x000a  2           15  Device-to-host register FISes sent due to a COMRESET
0x0001  2            0  Command failed due to ICRC error
0x0003  2            0  R_ERR response for device-to-host data FIS
0x0004  2            0  R_ERR response for host-to-device data FIS
0x0006  2            0  R_ERR response for device-to-host non-data FIS
0x0007  2            0  R_ERR response for host-to-device non-data FIS
0x0009  2           18  Transition from drive PhyRdy to drive PhyNRdy
0x8002  2            0  Vendor specific
0x8003  2           12  Vendor specific
0x8004  2            0  Vendor specific

