smartctl 7.4 2023-08-01 r5530 [x86_64-linux-6.8.0-45-generic] (local build)
Copyright (C) 2002-23, Bruce Allen, Christian Franke, www.smartmontools.org

=== START OF INFORMATION SECTION ===
Model Family:     Intel 730 and DC S35x0/3610/3700 Series SSDs
Device Model:     INTEL SSDSC2BB480G6
Serial Number:    --
LU WWN Device Id: 5 5cd2e4 ...
Firmware Version: G2010140
User Capacity:    480,103,981,056 bytes [480 GB]
Sector Sizes:     512 bytes logical, 4096 bytes physical
Rotation Rate:    Solid State Device
Form Factor:      2.5 inches
TRIM Command:     Available, deterministic, zeroed
Device is:        In smartctl database 7.3/5528
ATA Version is:   ACS-2 T13/2015-D revision 3
SATA Version is:  SATA 2.6, 6.0 Gb/s (current: 6.0 Gb/s)
Local Time is:    Sun Oct 20 23:32:06 2024 MSK
SMART support is: Available - device has SMART capability.
SMART support is: Enabled
AAM feature is:   Unavailable
APM feature is:   Unavailable
Rd look-ahead is: Enabled
Write cache is:   Enabled
DSN feature is:   Unavailable
ATA Security is:  Disabled, frozen [SEC2]
Wt Cache Reorder: Enabled

=== START OF READ SMART DATA SECTION ===
SMART overall-health self-assessment test result: PASSED

General SMART Values:
Offline data collection status:  (0x00)	Offline data collection activity
					was never started.
					Auto Offline Data Collection: Disabled.
Self-test execution status:      (   0)	The previous self-test routine completed
					without error or no self-test has ever 
					been run.
Total time to complete Offline 
data collection: 		(    0) seconds.
Offline data collection
capabilities: 			 (0x79) SMART execute Offline immediate.
					No Auto Offline data collection support.
					Suspend Offline collection upon new
					command.
					Offline surface scan supported.
					Self-test supported.
					Conveyance Self-test supported.
					Selective Self-test supported.
SMART capabilities:            (0x0003)	Saves SMART data before entering
					power-saving mode.
					Supports SMART auto save timer.
Error logging capability:        (0x01)	Error logging supported.
					General Purpose Logging supported.
Short self-test routine 
recommended polling time: 	 (   1) minutes.
Extended self-test routine
recommended polling time: 	 (   2) minutes.
Conveyance self-test routine
recommended polling time: 	 (   2) minutes.
SCT capabilities: 	       (0x003d)	SCT Status supported.
					SCT Error Recovery Control supported.
					SCT Feature Control supported.
					SCT Data Table supported.

SMART Attributes Data Structure revision number: 1
Vendor Specific SMART Attributes with Thresholds:
ID# ATTRIBUTE_NAME          FLAGS    VALUE WORST THRESH FAIL RAW_VALUE
  5 Reallocated_Sector_Ct   -O--CK   100   100   000    -    0
  9 Power_On_Hours          -O--CK   100   100   000    -    51804
 12 Power_Cycle_Count       -O--CK   100   100   000    -    749
170 Available_Reservd_Space PO--CK   100   100   010    -    0
171 Program_Fail_Count      -O--CK   100   100   000    -    0
172 Erase_Fail_Count        -O--CK   100   100   000    -    0
174 Unsafe_Shutdown_Count   -O--CK   100   100   000    -    538
175 Power_Loss_Cap_Test     PO--CK   100   100   010    -    6570 (246 176)
183 SATA_Downshift_Count    -O--CK   100   100   000    -    0
184 End-to-End_Error        PO--CK   100   100   090    -    0
187 Reported_Uncorrect      -O--CK   100   100   000    -    0
190 Temperature_Case        -O---K   063   063   000    -    37 (Min/Max 30/37)
192 Unsafe_Shutdown_Count   -O--CK   100   100   000    -    538
194 Temperature_Internal    -O---K   100   100   000    -    37
197 Current_Pending_Sector  -O--C-   100   100   000    -    0
199 CRC_Error_Count         -OSRCK   100   100   000    -    28
225 Host_Writes_32MiB       -O--CK   100   100   000    -    989426
226 Workld_Media_Wear_Indic -O--CK   100   100   000    -    3788
227 Workld_Host_Reads_Perc  -O--CK   100   100   000    -    50
228 Workload_Minutes        -O--CK   100   100   000    -    3106360
232 Available_Reservd_Space PO--CK   100   100   010    -    0
233 Media_Wearout_Indicator -O--CK   097   097   000    -    0
234 Thermal_Throttle        -O--CK   100   100   000    -    0/0
241 Host_Writes_32MiB       -O--CK   100   100   000    -    989426
242 Host_Reads_32MiB        -O--CK   100   100   000    -    992765
243 NAND_Writes_32MiB       -O--CK   100   100   000    -    1896908
                            ||||||_ K auto-keep
                            |||||__ C event count
                            ||||___ R error rate
                            |||____ S speed/performance
                            ||_____ O updated online
                            |______ P prefailure warning

General Purpose Log Directory Version 1
SMART           Log Directory Version 1 [multi-sector log support]
Address    Access  R/W   Size  Description
0x00       GPL,SL  R/O      1  Log Directory
0x01       GPL,SL  R/O      1  Summary SMART error log
0x02       GPL,SL  R/O      8  Comprehensive SMART error log
0x03       GPL,SL  R/O     20  Ext. Comprehensive SMART error log
0x04       GPL,SL  R/O      8  Device Statistics log
0x06       GPL,SL  R/O      1  SMART self-test log
0x07       GPL,SL  R/O      2  Extended self-test log
0x08       GPL,SL  R/O      2  Power Conditions log
0x09       GPL,SL  R/W      1  Selective self-test log
0x10       GPL,SL  R/O      1  NCQ Command Error log
0x11       GPL,SL  R/O      1  SATA Phy Event Counters log
0x80-0x9f  GPL,SL  R/W     16  Host vendor specific log
0xb0       GPL,SL  VS       1  Device vendor specific log
0xb1       GPL,SL  VS      33  Device vendor specific log
0xb8       GPL,SL  VS       1  Device vendor specific log
0xb9       GPL     VS    1544  Device vendor specific log
0xb9       SL      VS       8  Device vendor specific log
0xba       GPL     VS    1280  Device vendor specific log
0xdf       GPL,SL  VS       1  Device vendor specific log
0xe0       GPL,SL  R/W      1  SCT Command/Status
0xe1       GPL,SL  R/W      1  SCT Data Transfer

SMART Extended Comprehensive Error Log Version: 1 (20 sectors)
Device Error Count: 21
	CR     = Command Register
	FEATR  = Features Register
	COUNT  = Count (was: Sector Count) Register
	LBA_48 = Upper bytes of LBA High/Mid/Low Registers ]  ATA-8
	LH     = LBA High (was: Cylinder High) Register    ]   LBA
	LM     = LBA Mid (was: Cylinder Low) Register      ] Register
	LL     = LBA Low (was: Sector Number) Register     ]
	DV     = Device (was: Device/Head) Register
	DC     = Device Control Register
	ER     = Error register
	ST     = Status register
Powered_Up_Time is measured from power on, and printed as
DDd+hh:mm:SS.sss where DD=days, hh=hours, mm=minutes,
SS=sec, and sss=millisec. It "wraps" after 49.710 days.

Warning! SMART Extended Comprehensive Error Log Structure error: invalid SMART checksum.
Error 21 [20] occurred at disk power-on lifetime: 51783 hours (2157 days + 15 hours)
  When the command that caused the error occurred, the device was active or idle.

  After command completion occurred, registers were:
  ER -- ST COUNT  LBA_48  LH LM LL DV DC
  -- -- -- == -- == == == -- -- -- -- --
  84 -- 51 00 40 00 81 00 00 17 00 40 00  Error: ICRC, ABRT 64 sectors at LBA = 0x8100001700 = 554050787072

  Commands leading to the command that caused the error were:
  CR FEATR COUNT  LBA_48  LH LM LL DV DC  Powered_Up_Time  Command/Feature_Name
  -- == -- == -- == == == -- -- -- -- --  ---------------  --------------------
  25 00 00 00 40 00 81 00 00 17 00 40 00     00:00:08.906  READ DMA EXT
  25 00 00 00 40 00 81 00 52 17 00 40 00     00:00:08.905  READ DMA EXT
  25 00 00 00 40 00 80 00 82 17 c0 40 00     00:00:08.905  READ DMA EXT
  25 00 00 00 40 00 7f 00 d8 37 00 40 00     00:00:08.905  READ DMA EXT
  25 00 00 00 40 00 81 00 d8 17 00 40 00     00:00:08.904  READ DMA EXT

Warning! SMART Extended Comprehensive Error Log Structure error: invalid SMART checksum.
Error 20 [19] occurred at disk power-on lifetime: 51783 hours (2157 days + 15 hours)
  When the command that caused the error occurred, the device was active or idle.

  After command completion occurred, registers were:
  ER -- ST COUNT  LBA_48  LH LM LL DV DC
  -- -- -- == -- == == == -- -- -- -- --
  84 -- 51 00 40 00 7f 00 d8 17 00 40 00  Error: ICRC, ABRT 64 sectors at LBA = 0x7f00d81700 = 545475008256

  Commands leading to the command that caused the error were:
  CR FEATR COUNT  LBA_48  LH LM LL DV DC  Powered_Up_Time  Command/Feature_Name
  -- == -- == -- == == == -- -- -- -- --  ---------------  --------------------
  25 00 00 00 40 00 7f 00 d8 17 00 40 00     00:00:08.845  READ DMA EXT
  25 00 00 00 40 00 22 00 68 00 00 40 00     00:00:08.845  READ DMA EXT
  25 00 00 00 40 00 22 00 68 00 00 40 00     00:00:08.812  READ DMA EXT
  25 00 00 00 40 00 1e 00 90 00 00 40 00     00:00:08.812  READ DMA EXT
  25 00 00 00 40 00 1e 00 90 00 00 40 00     00:00:08.757  READ DMA EXT

Error 19 [18] occurred at disk power-on lifetime: 51783 hours (2157 days + 15 hours)
  When the command that caused the error occurred, the device was active or idle.

  After command completion occurred, registers were:
  ER -- ST COUNT  LBA_48  LH LM LL DV DC
  -- -- -- == -- == == == -- -- -- -- --
  84 -- 51 00 40 00 22 00 68 00 00 40 00  Error: ICRC, ABRT 64 sectors at LBA = 0x2200680000 = 146035703808

  Commands leading to the command that caused the error were:
  CR FEATR COUNT  LBA_48  LH LM LL DV DC  Powered_Up_Time  Command/Feature_Name
  -- == -- == -- == == == -- -- -- -- --  ---------------  --------------------
  25 00 00 00 40 00 22 00 68 00 00 40 00     00:00:08.812  READ DMA EXT
  25 00 00 00 40 00 1e 00 90 00 00 40 00     00:00:08.812  READ DMA EXT
  25 00 00 00 40 00 1e 00 90 00 00 40 00     00:00:08.757  READ DMA EXT
  25 00 00 00 40 00 00 00 08 00 00 40 00     00:00:08.757  READ DMA EXT
  25 00 00 00 40 00 00 00 00 00 80 40 00     00:00:08.757  READ DMA EXT

Error 18 [17] occurred at disk power-on lifetime: 51783 hours (2157 days + 15 hours)
  When the command that caused the error occurred, the device was active or idle.

  After command completion occurred, registers were:
  ER -- ST COUNT  LBA_48  LH LM LL DV DC
  -- -- -- == -- == == == -- -- -- -- --
  84 -- 51 00 40 00 1e 00 90 00 00 40 00  Error: ICRC, ABRT 64 sectors at LBA = 0x1e00900000 = 128858456064

  Commands leading to the command that caused the error were:
  CR FEATR COUNT  LBA_48  LH LM LL DV DC  Powered_Up_Time  Command/Feature_Name
  -- == -- == -- == == == -- -- -- -- --  ---------------  --------------------
  25 00 00 00 40 00 1e 00 90 00 00 40 00     00:00:08.757  READ DMA EXT
  25 00 00 00 40 00 00 00 08 00 00 40 00     00:00:08.757  READ DMA EXT
  25 00 00 00 40 00 00 00 00 00 80 40 00     00:00:08.757  READ DMA EXT
  25 00 00 00 02 00 00 00 00 00 40 40 00     00:00:08.757  READ DMA EXT
  25 00 00 00 40 00 00 00 00 00 40 40 00     00:00:08.729  READ DMA EXT

Error 17 [16] occurred at disk power-on lifetime: 51783 hours (2157 days + 15 hours)
  When the command that caused the error occurred, the device was active or idle.

  After command completion occurred, registers were:
  ER -- ST COUNT  LBA_48  LH LM LL DV DC
  -- -- -- == -- == == == -- -- -- -- --
  84 -- 51 00 40 00 00 00 00 00 40 40 00  Error: ICRC, ABRT 64 sectors at LBA = 0x00000040 = 64

  Commands leading to the command that caused the error were:
  CR FEATR COUNT  LBA_48  LH LM LL DV DC  Powered_Up_Time  Command/Feature_Name
  -- == -- == -- == == == -- -- -- -- --  ---------------  --------------------
  25 00 00 00 40 00 00 00 00 00 40 40 00     00:00:08.729  READ DMA EXT
  25 00 00 00 40 00 00 00 00 00 40 40 00     00:00:08.674  READ DMA EXT
  25 00 00 00 40 00 00 00 00 00 00 40 00     00:00:08.674  READ DMA EXT
  25 00 00 00 40 00 00 00 00 00 00 40 00     00:00:08.643  READ DMA EXT
  25 00 00 00 01 00 00 00 00 00 02 40 00     00:00:08.120  READ DMA EXT

Warning! SMART Extended Comprehensive Error Log Structure error: invalid SMART checksum.
Error 16 [15] occurred at disk power-on lifetime: 51783 hours (2157 days + 15 hours)
  When the command that caused the error occurred, the device was active or idle.

  After command completion occurred, registers were:
  ER -- ST COUNT  LBA_48  LH LM LL DV DC
  -- -- -- == -- == == == -- -- -- -- --
  84 -- 51 00 40 00 00 00 00 00 40 40 00  Error: ICRC, ABRT 64 sectors at LBA = 0x00000040 = 64

  Commands leading to the command that caused the error were:
  CR FEATR COUNT  LBA_48  LH LM LL DV DC  Powered_Up_Time  Command/Feature_Name
  -- == -- == -- == == == -- -- -- -- --  ---------------  --------------------
  25 00 00 00 40 00 00 00 00 00 40 40 00     00:00:08.674  READ DMA EXT
  25 00 00 00 40 00 00 00 00 00 00 40 00     00:00:08.674  READ DMA EXT
  25 00 00 00 40 00 00 00 00 00 00 40 00     00:00:08.643  READ DMA EXT
  25 00 00 00 01 00 00 00 00 00 02 40 00     00:00:08.120  READ DMA EXT
  25 00 00 00 01 00 00 00 00 00 01 40 00     00:00:08.120  READ DMA EXT

Error 15 [14] occurred at disk power-on lifetime: 51783 hours (2157 days + 15 hours)
  When the command that caused the error occurred, the device was active or idle.

  After command completion occurred, registers were:
  ER -- ST COUNT  LBA_48  LH LM LL DV DC
  -- -- -- == -- == == == -- -- -- -- --
  84 -- 51 00 40 00 00 00 00 00 00 40 00  Error: ICRC, ABRT 64 sectors at LBA = 0x00000000 = 0

  Commands leading to the command that caused the error were:
  CR FEATR COUNT  LBA_48  LH LM LL DV DC  Powered_Up_Time  Command/Feature_Name
  -- == -- == -- == == == -- -- -- -- --  ---------------  --------------------
  25 00 00 00 40 00 00 00 00 00 00 40 00     00:00:08.643  READ DMA EXT
  25 00 00 00 01 00 00 00 00 00 02 40 00     00:00:08.120  READ DMA EXT
  25 00 00 00 01 00 00 00 00 00 01 40 00     00:00:08.120  READ DMA EXT
  25 00 00 00 01 00 00 00 00 00 00 40 00     00:00:08.120  READ DMA EXT
  25 00 00 00 01 00 00 00 00 00 00 40 00     00:00:07.977  READ DMA EXT

Error 14 [13] occurred at disk power-on lifetime: 51783 hours (2157 days + 15 hours)
  When the command that caused the error occurred, the device was active or idle.

  After command completion occurred, registers were:
  ER -- ST COUNT  LBA_48  LH LM LL DV DC
  -- -- -- == -- == == == -- -- -- -- --
  84 -- 51 00 20 00 e4 00 36 37 8f 40 00  Error: ICRC, ABRT 32 sectors at LBA = 0xe40036378f = 979256096655

  Commands leading to the command that caused the error were:
  CR FEATR COUNT  LBA_48  LH LM LL DV DC  Powered_Up_Time  Command/Feature_Name
  -- == -- == -- == == == -- -- -- -- --  ---------------  --------------------
  25 00 00 00 20 00 e4 00 36 37 8f 40 00     00:00:07.942  READ DMA EXT
  25 00 00 00 20 00 e4 00 36 37 8f 40 00     00:00:07.911  READ DMA EXT
  25 00 00 00 01 00 e4 00 36 37 af 40 00     00:00:07.911  READ DMA EXT
  25 00 00 00 20 00 00 00 00 00 02 40 00     00:00:07.880  READ DMA EXT
  25 00 00 00 20 00 00 00 00 00 02 40 00     00:00:07.849  READ DMA EXT

SMART Extended Self-test Log Version: 1 (2 sectors)
No self-tests have been logged.  [To run self-tests, use: smartctl -t]

SMART Selective self-test log data structure revision number 1
 SPAN  MIN_LBA  MAX_LBA  CURRENT_TEST_STATUS
    1        0        0  Not_testing
    2        0        0  Not_testing
    3        0        0  Not_testing
    4        0        0  Not_testing
    5        0        0  Not_testing
Selective self-test flags (0x0):
  After scanning selected spans, do NOT read-scan remainder of disk.
If Selective self-test is pending on power-up, resume after 0 minute delay.

SCT Status Version:                  3
SCT Version (vendor specific):       1 (0x0001)
Device State:                        Active (0)
Current Temperature:                    37 Celsius
Power Cycle Min/Max Temperature:     30/37 Celsius
Lifetime    Min/Max Temperature:      7/53 Celsius
Specified Max Operating Temperature:    70 Celsius
Under/Over Temperature Limit Count:   0/0
Vendor specific:
00 00 64 00 00 00 00 00 00 00 00 00 00 00 00 00
00 00 00 00 00 00 00 00 00 00 00 00 00 00 00 00

SCT Temperature History Version:     2
Temperature Sampling Period:         1 minute
Temperature Logging Interval:        1 minute
Min/Max recommended Temperature:      0/70 Celsius
Min/Max Temperature Limit:            0/70 Celsius
Temperature History Size (Index):    478 (89)

SCT Error Recovery Control:
           Read: Disabled
          Write: Disabled

Device Statistics (GP Log 0x04)
Page  Offset Size        Value Flags Description
0x01  =====  =               =  ===  == General Statistics (rev 2) ==
0x01  0x008  4             749  ---  Lifetime Power-On Resets
0x01  0x018  6     64843083310  ---  Logical Sectors Written
0x01  0x020  6      1709058698  ---  Number of Write Commands
0x01  0x028  6     65061904808  ---  Logical Sectors Read
0x01  0x030  6      1634614773  ---  Number of Read Commands
0x04  =====  =               =  ===  == General Errors Statistics (rev 1) ==
0x04  0x008  4               0  ---  Number of Reported Uncorrectable Errors
0x04  0x010  4               0  ---  Resets Between Cmd Acceptance and Completion
0x05  =====  =               =  ===  == Temperature Statistics (rev 1) ==
0x05  0x008  1              37  ---  Current Temperature
0x05  0x010  1              36  ---  Average Short Term Temperature
0x05  0x018  1              31  ---  Average Long Term Temperature
0x05  0x020  1              53  ---  Highest Temperature
0x05  0x028  1              13  ---  Lowest Temperature
0x05  0x030  1              44  ---  Highest Average Short Term Temperature
0x05  0x038  1              15  ---  Lowest Average Short Term Temperature
0x05  0x040  1              41  ---  Highest Average Long Term Temperature
0x05  0x048  1              21  ---  Lowest Average Long Term Temperature
0x05  0x050  4               0  ---  Time in Over-Temperature
0x05  0x058  1              70  ---  Specified Maximum Operating Temperature
0x05  0x060  4               0  ---  Time in Under-Temperature
0x05  0x068  1               0  ---  Specified Minimum Operating Temperature
0x06  =====  =               =  ===  == Transport Statistics (rev 1) ==
0x06  0x008  4            3681  ---  Number of Hardware Resets
0x06  0x010  4            1943  ---  Number of ASR Events
0x06  0x018  4              28  ---  Number of Interface CRC Errors
0x07  =====  =               =  ===  == Solid State Device Statistics (rev 1) ==
0x07  0x008  1               3  ---  Percentage Used Endurance Indicator
                                |||_ C monitored condition met
                                ||__ D supports DSN
                                |___ N normalized value

Pending Defects log (GP Log 0x0c) not supported

SATA Phy Event Counters (GP Log 0x11)
ID      Size     Value  Description
0x0001  4            0  Command failed due to ICRC error
0x0003  4            0  R_ERR response for device-to-host data FIS
0x0004  4            0  R_ERR response for host-to-device data FIS
0x0006  4            0  R_ERR response for device-to-host non-data FIS
0x000a  4            3  Device-to-host register FISes sent due to a COMRESET
0x000b  4            0  CRC errors within host-to-device FIS
0x000d  4            0  Non-CRC errors within host-to-device FIS

