smartctl 7.2 2020-12-30 r5155 [x86_64-linux-5.10.14-desktop-1omv4002] (OpenMandriva Lx 7.2-2)
Copyright (C) 2002-20, Bruce Allen, Christian Franke, www.smartmontools.org

=== START OF INFORMATION SECTION ===
Model Family:     Toshiba 2.5" HDD MK..65GSX
Device Model:     TOSHIBA MK5065GSX
Serial Number:    --
LU WWN Device Id: 5 000039 ...
Firmware Version: GJ002C
User Capacity:    500,107,862,016 bytes [500 GB]
Sector Size:      512 bytes logical/physical
Rotation Rate:    5400 rpm
Form Factor:      2.5 inches
Device is:        In smartctl database [for details use: -P show]
ATA Version is:   ATA8-ACS (minor revision not indicated)
SATA Version is:  SATA 2.6, 3.0 Gb/s (current: 3.0 Gb/s)
Local Time is:    Thu Apr  1 11:01:33 2021 UTC
SMART support is: Available - device has SMART capability.
SMART support is: Enabled
AAM feature is:   Unavailable
APM level is:     128 (minimum power consumption without standby)
Rd look-ahead is: Enabled
Write cache is:   Enabled
DSN feature is:   Unavailable
ATA Security is:  Disabled, frozen [SEC2]
Wt Cache Reorder: Enabled

=== START OF READ SMART DATA SECTION ===
SMART overall-health self-assessment test result: PASSED
See vendor-specific Attribute list for marginal Attributes.

General SMART Values:
Offline data collection status:  (0x00)	Offline data collection activity
					was never started.
					Auto Offline Data Collection: Disabled.
Self-test execution status:      (   0)	The previous self-test routine completed
					without error or no self-test has ever 
					been run.
Total time to complete Offline 
data collection: 		(  120) seconds.
Offline data collection
capabilities: 			 (0x51) SMART execute Offline immediate.
					No Auto Offline data collection support.
					Suspend Offline collection upon new
					command.
					No Offline surface scan supported.
					Self-test supported.
					No Conveyance Self-test supported.
					Selective Self-test supported.
SMART capabilities:            (0x0003)	Saves SMART data before entering
					power-saving mode.
					Supports SMART auto save timer.
Error logging capability:        (0x01)	Error logging supported.
					General Purpose Logging supported.
Short self-test routine 
recommended polling time: 	 (   2) minutes.
Extended self-test routine
recommended polling time: 	 ( 178) minutes.
SCT capabilities: 	       (0x003f)	SCT Status supported.
					SCT Error Recovery Control supported.
					SCT Feature Control supported.
					SCT Data Table supported.

SMART Attributes Data Structure revision number: 16
Vendor Specific SMART Attributes with Thresholds:
ID# ATTRIBUTE_NAME          FLAGS    VALUE WORST THRESH FAIL RAW_VALUE
  1 Raw_Read_Error_Rate     POSR--   100   100   050    -    0
  2 Throughput_Performance  POS---   100   100   050    -    0
  3 Spin_Up_Time            PO----   100   100   002    -    2228
  4 Start_Stop_Count        -O--CK   100   100   000    -    6044
  5 Reallocated_Sector_Ct   PO--CK   100   100   010    -    0
  7 Seek_Error_Rate         POSR--   100   100   050    -    0
  8 Seek_Time_Performance   P-S---   100   100   050    -    0
  9 Power_On_Hours          -O--CK   068   068   000    -    12994
 10 Spin_Retry_Count        PO--C-   220   100   030    -    0
 12 Power_Cycle_Count       -O--CK   100   100   000    -    5957
183 Runtime_Bad_Block       -O---K   100   100   001    -    0
184 End-to-End_Error        PO--CK   100   100   097    -    0
185 Unknown_Attribute       -O--CK   100   100   001    -    65535
187 Reported_Uncorrect      -O--CK   001   001   000    -    65535
188 Command_Timeout         -O--CK   100   093   000    -    437
189 High_Fly_Writes         -O-RCK   100   100   001    -    0
190 Airflow_Temperature_Cel -O---K   061   040   045    Past 39 (Min/Max 38/42)
191 G-Sense_Error_Rate      -O--CK   100   100   000    -    367
192 Power-Off_Retract_Count -O--CK   099   099   000    -    42336902
193 Load_Cycle_Count        -O--CK   083   083   000    -    170542
196 Reallocated_Event_Count -O--CK   100   100   000    -    0
197 Current_Pending_Sector  -O--C-   100   100   000    -    0
199 UDMA_CRC_Error_Count    -OSRCK   200   200   000    -    0
                            ||||||_ K auto-keep
                            |||||__ C event count
                            ||||___ R error rate
                            |||____ S speed/performance
                            ||_____ O updated online
                            |______ P prefailure warning

General Purpose Log Directory Version 1
SMART           Log Directory Version 1 [multi-sector log support]
Address    Access  R/W   Size  Description
0x00       GPL,SL  R/O      1  Log Directory
0x01           SL  R/O      1  Summary SMART error log
0x02           SL  R/O     51  Comprehensive SMART error log
0x03       GPL     R/O     64  Ext. Comprehensive SMART error log
0x06           SL  R/O      1  SMART self-test log
0x07       GPL     R/O      1  Extended self-test log
0x09           SL  R/W      1  Selective self-test log
0x10       GPL     R/O      1  NCQ Command Error log
0x11       GPL     R/O      1  SATA Phy Event Counters log
0x80-0x9f  GPL,SL  R/W     16  Host vendor specific log
0xe0       GPL,SL  R/W      1  SCT Command/Status
0xe1       GPL,SL  R/W      1  SCT Data Transfer

SMART Extended Comprehensive Error Log Version: 1 (64 sectors)
Device Error Count: 65535 (device log contains only the most recent 256 errors)
	CR     = Command Register
	FEATR  = Features Register
	COUNT  = Count (was: Sector Count) Register
	LBA_48 = Upper bytes of LBA High/Mid/Low Registers ]  ATA-8
	LH     = LBA High (was: Cylinder High) Register    ]   LBA
	LM     = LBA Mid (was: Cylinder Low) Register      ] Register
	LL     = LBA Low (was: Sector Number) Register     ]
	DV     = Device (was: Device/Head) Register
	DC     = Device Control Register
	ER     = Error register
	ST     = Status register
Powered_Up_Time is measured from power on, and printed as
DDd+hh:mm:SS.sss where DD=days, hh=hours, mm=minutes,
SS=sec, and sss=millisec. It "wraps" after 49.710 days.

Error 65535 [137] occurred at disk power-on lifetime: 5612 hours (233 days + 20 hours)
  When the command that caused the error occurred, the device was active or idle.

  After command completion occurred, registers were:
  ER -- ST COUNT  LBA_48  LH LM LL DV DC
  -- -- -- == -- == == == -- -- -- -- --
  40 -- 41 00 d2 00 00 01 7f 0c e4 61 00  Error: UNC at LBA = 0x017f0ce4 = 25103588

  Commands leading to the command that caused the error were:
  CR FEATR COUNT  LBA_48  LH LM LL DV DC  Powered_Up_Time  Command/Feature_Name
  -- == -- == -- == == == -- -- -- -- --  ---------------  --------------------
  60 00 18 00 d0 00 00 01 7f 0c d0 40 00     00:43:01.829  READ FPDMA QUEUED
  61 01 00 00 c8 00 00 07 b7 58 20 40 00     00:43:01.829  WRITE FPDMA QUEUED
  61 01 00 00 c0 00 00 07 b7 59 20 40 00     00:43:01.829  WRITE FPDMA QUEUED
  61 01 00 00 b8 00 00 07 b7 5a 20 40 00     00:43:01.829  WRITE FPDMA QUEUED
  61 01 00 00 b0 00 00 07 b7 5b 20 40 00     00:43:01.829  WRITE FPDMA QUEUED

Error 65534 [136] occurred at disk power-on lifetime: 5612 hours (233 days + 20 hours)
  When the command that caused the error occurred, the device was active or idle.

  After command completion occurred, registers were:
  ER -- ST COUNT  LBA_48  LH LM LL DV DC
  -- -- -- == -- == == == -- -- -- -- --
  40 -- 41 00 b2 00 00 01 7f 0c e4 61 00  Error: UNC at LBA = 0x017f0ce4 = 25103588

  Commands leading to the command that caused the error were:
  CR FEATR COUNT  LBA_48  LH LM LL DV DC  Powered_Up_Time  Command/Feature_Name
  -- == -- == -- == == == -- -- -- -- --  ---------------  --------------------
  60 00 38 00 c0 00 00 07 b2 0d f4 40 00     00:42:57.811  READ FPDMA QUEUED
  60 00 40 00 b8 00 00 07 b2 13 6c 40 00     00:42:57.800  READ FPDMA QUEUED
  60 00 18 00 b0 00 00 01 7f 0c d0 40 00     00:42:57.784  READ FPDMA QUEUED
  60 00 28 00 a8 00 00 07 b2 0e 8c 40 00     00:42:57.784  READ FPDMA QUEUED
  2f 00 00 00 01 00 00 00 00 00 10 40 00     00:42:57.784  READ LOG EXT

Error 65533 [135] occurred at disk power-on lifetime: 5612 hours (233 days + 20 hours)
  When the command that caused the error occurred, the device was active or idle.

  After command completion occurred, registers were:
  ER -- ST COUNT  LBA_48  LH LM LL DV DC
  -- -- -- == -- == == == -- -- -- -- --
  40 -- 41 00 92 00 00 01 7f 0c e4 61 00  Error: UNC at LBA = 0x017f0ce4 = 25103588

  Commands leading to the command that caused the error were:
  CR FEATR COUNT  LBA_48  LH LM LL DV DC  Powered_Up_Time  Command/Feature_Name
  -- == -- == -- == == == -- -- -- -- --  ---------------  --------------------
  60 00 18 00 90 00 00 01 7f 0c d0 40 00     00:42:53.773  READ FPDMA QUEUED
  2f 00 00 00 01 00 00 00 00 00 10 40 00     00:42:53.772  READ LOG EXT
  60 00 18 00 80 00 00 01 7f 0c d0 40 00     00:42:49.751  READ FPDMA QUEUED
  61 00 08 00 78 00 00 09 25 79 20 40 00     00:42:49.751  WRITE FPDMA QUEUED
  2f 00 00 00 01 00 00 00 00 00 10 40 00     00:42:49.750  READ LOG EXT

Error 65532 [134] occurred at disk power-on lifetime: 5612 hours (233 days + 20 hours)
  When the command that caused the error occurred, the device was active or idle.

  After command completion occurred, registers were:
  ER -- ST COUNT  LBA_48  LH LM LL DV DC
  -- -- -- == -- == == == -- -- -- -- --
  40 -- 41 00 82 00 00 01 7f 0c e4 61 00  Error: UNC at LBA = 0x017f0ce4 = 25103588

  Commands leading to the command that caused the error were:
  CR FEATR COUNT  LBA_48  LH LM LL DV DC  Powered_Up_Time  Command/Feature_Name
  -- == -- == -- == == == -- -- -- -- --  ---------------  --------------------
  60 00 18 00 80 00 00 01 7f 0c d0 40 00     00:42:49.751  READ FPDMA QUEUED
  61 00 08 00 78 00 00 09 25 79 20 40 00     00:42:49.751  WRITE FPDMA QUEUED
  2f 00 00 00 01 00 00 00 00 00 10 40 00     00:42:49.750  READ LOG EXT
  61 00 08 00 68 00 00 09 25 79 20 40 00     00:42:49.750  WRITE FPDMA QUEUED
  60 00 18 00 60 00 00 01 7f 0c d0 40 00     00:42:45.739  READ FPDMA QUEUED

Error 65531 [133] occurred at disk power-on lifetime: 5612 hours (233 days + 20 hours)
  When the command that caused the error occurred, the device was active or idle.

  After command completion occurred, registers were:
  ER -- ST COUNT  LBA_48  LH LM LL DV DC
  -- -- -- == -- == == == -- -- -- -- --
  40 -- 41 00 62 00 00 01 7f 0c e4 61 00  Error: UNC at LBA = 0x017f0ce4 = 25103588

  Commands leading to the command that caused the error were:
  CR FEATR COUNT  LBA_48  LH LM LL DV DC  Powered_Up_Time  Command/Feature_Name
  -- == -- == -- == == == -- -- -- -- --  ---------------  --------------------
  60 00 18 00 60 00 00 01 7f 0c d0 40 00     00:42:45.739  READ FPDMA QUEUED
  2f 00 00 00 01 00 00 00 00 00 10 40 00     00:42:45.739  READ LOG EXT
  60 00 18 00 50 00 00 01 7f 0c d0 40 00     00:42:41.728  READ FPDMA QUEUED
  2f 00 00 00 01 00 00 00 00 00 10 40 00     00:42:41.728  READ LOG EXT
  61 00 08 00 40 00 00 00 64 ea 08 40 00     00:42:37.663  WRITE FPDMA QUEUED

Error 65530 [132] occurred at disk power-on lifetime: 5612 hours (233 days + 20 hours)
  When the command that caused the error occurred, the device was active or idle.

  After command completion occurred, registers were:
  ER -- ST COUNT  LBA_48  LH LM LL DV DC
  -- -- -- == -- == == == -- -- -- -- --
  40 -- 41 00 52 00 00 01 7f 0c e4 61 00  Error: UNC at LBA = 0x017f0ce4 = 25103588

  Commands leading to the command that caused the error were:
  CR FEATR COUNT  LBA_48  LH LM LL DV DC  Powered_Up_Time  Command/Feature_Name
  -- == -- == -- == == == -- -- -- -- --  ---------------  --------------------
  60 00 18 00 50 00 00 01 7f 0c d0 40 00     00:42:41.728  READ FPDMA QUEUED
  2f 00 00 00 01 00 00 00 00 00 10 40 00     00:42:41.728  READ LOG EXT
  61 00 08 00 40 00 00 00 64 ea 08 40 00     00:42:37.663  WRITE FPDMA QUEUED
  61 00 08 00 38 00 00 00 66 a2 48 40 00     00:42:37.663  WRITE FPDMA QUEUED
  61 00 08 00 30 00 00 00 5e b3 98 40 00     00:42:37.663  WRITE FPDMA QUEUED

Error 65529 [131] occurred at disk power-on lifetime: 5612 hours (233 days + 20 hours)
  When the command that caused the error occurred, the device was active or idle.

  After command completion occurred, registers were:
  ER -- ST COUNT  LBA_48  LH LM LL DV DC
  -- -- -- == -- == == == -- -- -- -- --
  40 -- 41 00 22 00 00 01 7f 0c e4 61 00  Error: WP at LBA = 0x017f0ce4 = 25103588

  Commands leading to the command that caused the error were:
  CR FEATR COUNT  LBA_48  LH LM LL DV DC  Powered_Up_Time  Command/Feature_Name
  -- == -- == -- == == == -- -- -- -- --  ---------------  --------------------
  61 00 08 00 40 00 00 00 64 ea 08 40 00     00:42:37.663  WRITE FPDMA QUEUED
  61 00 08 00 38 00 00 00 66 a2 48 40 00     00:42:37.663  WRITE FPDMA QUEUED
  61 00 08 00 30 00 00 00 5e b3 98 40 00     00:42:37.663  WRITE FPDMA QUEUED
  61 00 08 00 28 00 00 00 65 e3 30 40 00     00:42:37.662  WRITE FPDMA QUEUED
  60 00 18 00 20 00 00 01 7f 0c d0 40 00     00:42:37.661  READ FPDMA QUEUED

Error 65528 [130] occurred at disk power-on lifetime: 5612 hours (233 days + 20 hours)
  When the command that caused the error occurred, the device was active or idle.

  After command completion occurred, registers were:
  ER -- ST COUNT  LBA_48  LH LM LL DV DC
  -- -- -- == -- == == == -- -- -- -- --
  40 -- 41 00 d2 00 00 01 7f 0c e4 61 00  Error: WP at LBA = 0x017f0ce4 = 25103588

  Commands leading to the command that caused the error were:
  CR FEATR COUNT  LBA_48  LH LM LL DV DC  Powered_Up_Time  Command/Feature_Name
  -- == -- == -- == == == -- -- -- -- --  ---------------  --------------------
  61 00 08 00 f0 00 00 02 a0 cd 18 40 00     00:42:33.615  WRITE FPDMA QUEUED
  61 00 08 00 e8 00 00 02 a3 cb 38 40 00     00:42:33.615  WRITE FPDMA QUEUED
  61 00 08 00 e0 00 00 00 5e b3 90 40 00     00:42:33.615  WRITE FPDMA QUEUED
  60 00 08 00 d8 00 00 00 66 26 10 40 00     00:42:33.613  READ FPDMA QUEUED
  60 00 18 00 d0 00 00 01 7f 0c d0 40 00     00:42:33.606  READ FPDMA QUEUED

SMART Extended Self-test Log Version: 1 (1 sectors)
Num  Test_Description    Status                  Remaining  LifeTime(hours)  LBA_of_first_error
# 1  Short offline       Completed without error       00%     12101         -
# 2  Short offline       Completed without error       00%      5724         -

SMART Selective self-test log data structure revision number 1
 SPAN  MIN_LBA  MAX_LBA  CURRENT_TEST_STATUS
    1        0        0  Not_testing
    2        0        0  Not_testing
    3        0        0  Not_testing
    4        0        0  Not_testing
    5        0        0  Not_testing
Selective self-test flags (0x0):
  After scanning selected spans, do NOT read-scan remainder of disk.
If Selective self-test is pending on power-up, resume after 0 minute delay.

SCT Status Version:                  2
SCT Version (vendor specific):       1 (0x0001)
Device State:                        Active (0)
Current Temperature:                    39 Celsius
Power Cycle Min/Max Temperature:     38/42 Celsius
Lifetime    Min/Max Temperature:     21/60 Celsius
Under/Over Temperature Limit Count:   0/270

SCT Temperature History Version:     2
Temperature Sampling Period:         1 minute
Temperature Logging Interval:        1 minute
Min/Max recommended Temperature:      5/55 Celsius
Min/Max Temperature Limit:            5/55 Celsius
Temperature History Size (Index):    478 (336)

SCT Error Recovery Control:
           Read: Disabled
          Write: Disabled

Device Statistics (GP/SMART Log 0x04) not supported

Pending Defects log (GP Log 0x0c) not supported

SATA Phy Event Counters (GP Log 0x11)
ID      Size     Value  Description
0x0001  4            0  Command failed due to ICRC error
0x0002  4            0  R_ERR response for data FIS
0x0003  4            0  R_ERR response for device-to-host data FIS
0x0004  4            0  R_ERR response for host-to-device data FIS
0x0005  4            0  R_ERR response for non-data FIS
0x0006  4            0  R_ERR response for device-to-host non-data FIS
0x0007  4            0  R_ERR response for host-to-device non-data FIS
0x0008  4            0  Device-to-host non-data FIS retries
0x0009  4            6  Transition from drive PhyRdy to drive PhyNRdy
0x000a  4            7  Device-to-host register FISes sent due to a COMRESET
0x000b  4            0  CRC errors within host-to-device FIS
0x000d  4            0  Non-CRC errors within host-to-device FIS
0x000f  4            0  R_ERR response for host-to-device data FIS, CRC
0x0010  4            0  R_ERR response for host-to-device data FIS, non-CRC
0x0012  4            0  R_ERR response for host-to-device non-data FIS, CRC
0x0013  4            0  R_ERR response for host-to-device non-data FIS, non-CRC

