smartctl 7.1 2019-12-30 r5022 [x86_64-linux-5.5.0-1-amd64] (local build)
Copyright (C) 2002-19, Bruce Allen, Christian Franke, www.smartmontools.org

=== START OF INFORMATION SECTION ===
Model Number:                       HP SSD EX900 120GB
Serial Number:                      --
Firmware Version:                   S0614B0
PCI Vendor ID:                      0x1dee
PCI Vendor Subsystem ID:            0x126f
IEEE OUI Identifier:                0x000000
Controller ID:                      1
Number of Namespaces:               1
Namespace 1 Size/Capacity:          120,034,123,776 [120 GB]
Namespace 1 Formatted LBA Size:     512
Namespace 1 IEEE EUI-64:            010000 ...
Local Time is:                      Wed Apr  8 00:13:19 2020 CEST
Firmware Updates (0x12):            1 Slot, no Reset required
Optional Admin Commands (0x0007):   Security Format Frmw_DL
Optional NVM Commands (0x001f):     Comp Wr_Unc DS_Mngmt Wr_Zero Sav/Sel_Feat
Maximum Data Transfer Size:         64 Pages
Warning  Comp. Temp. Threshold:     70 Celsius
Critical Comp. Temp. Threshold:     80 Celsius
Namespace 1 Features (0x04):        Dea/Unw_Error

Supported Power States
St Op     Max   Active     Idle   RL RT WL WT  Ent_Lat  Ex_Lat
 0 +     9.00W       -        -    0  0  0  0        0       0

Supported LBA Sizes (NSID 0x1)
Id Fmt  Data  Metadt  Rel_Perf
 0 +     512       0         0

=== START OF SMART DATA SECTION ===
SMART overall-health self-assessment test result: PASSED

SMART/Health Information (NVMe Log 0x02)
Critical Warning:                   0x00
Temperature:                        34 Celsius
Available Spare:                    100%
Available Spare Threshold:          10%
Percentage Used:                    0%
Data Units Read:                    3,209 [1.64 GB]
Data Units Written:                 31 [15.8 MB]
Host Read Commands:                 63,370
Host Write Commands:                349
Controller Busy Time:               2
Power Cycles:                       299
Power On Hours:                     944
Unsafe Shutdowns:                   22
Media and Data Integrity Errors:    0
Error Information Log Entries:      0
Warning  Comp. Temperature Time:    0
Critical Comp. Temperature Time:    0

Error Information (NVMe Log 0x01, max 64 entries)
No Errors Logged



