smartctl 7.2 2020-12-30 r5155 [x86_64-linux-6.8.0-48-generic] (local build)
Copyright (C) 2002-20, Bruce Allen, Christian Franke, www.smartmontools.org

=== START OF INFORMATION SECTION ===
Device Model:     SSD 240GB
Serial Number:    --
Firmware Version: HAFEA2.0
User Capacity:    240,057,409,536 bytes [240 GB]
Sector Size:      512 bytes logical/physical
Rotation Rate:    Solid State Device
Form Factor:      2.5 inches
TRIM Command:     Available
Device is:        Not in smartctl database [for details use: -P showall]
ATA Version is:   ACS-4 (minor revision not indicated)
SATA Version is:  SATA 3.2, 6.0 Gb/s (current: 6.0 Gb/s)
Local Time is:    Wed Nov 13 10:53:03 2024 -03
SMART support is: Available - device has SMART capability.
SMART support is: Enabled
AAM feature is:   Unavailable
APM feature is:   Unavailable
Rd look-ahead is: Enabled
Write cache is:   Enabled
DSN feature is:   Unavailable
ATA Security is:  Disabled, NOT FROZEN [SEC1]
Wt Cache Reorder: Unavailable

=== START OF READ SMART DATA SECTION ===
SMART overall-health self-assessment test result: PASSED

General SMART Values:
Offline data collection status:  (0x00)	Offline data collection activity
					was never started.
					Auto Offline Data Collection: Disabled.
Self-test execution status:      (  32)	The self-test routine was interrupted
					by the host with a hard or soft reset.
Total time to complete Offline 
data collection: 		(65535) seconds.
Offline data collection
capabilities: 			 (0x79) SMART execute Offline immediate.
					No Auto Offline data collection support.
					Suspend Offline collection upon new
					command.
					Offline surface scan supported.
					Self-test supported.
					Conveyance Self-test supported.
					Selective Self-test supported.
SMART capabilities:            (0x0003)	Saves SMART data before entering
					power-saving mode.
					Supports SMART auto save timer.
Error logging capability:        (0x01)	Error logging supported.
					General Purpose Logging supported.
Short self-test routine 
recommended polling time: 	 (   2) minutes.
Extended self-test routine
recommended polling time: 	 (  30) minutes.
Conveyance self-test routine
recommended polling time: 	 (   6) minutes.

SMART Attributes Data Structure revision number: 16
Vendor Specific SMART Attributes with Thresholds:
ID# ATTRIBUTE_NAME          FLAGS    VALUE WORST THRESH FAIL RAW_VALUE
  1 Raw_Read_Error_Rate     PO-R--   100   100   050    -    0
  5 Reallocated_Sector_Ct   PO--C-   100   100   050    -    0
  9 Power_On_Hours          -O--C-   100   100   000    -    5602
 12 Power_Cycle_Count       -O--C-   100   100   000    -    1727
161 Unknown_Attribute       -O--C-   100   100   000    -    484
163 Unknown_Attribute       PO----   100   100   050    -    9
165 Unknown_Attribute       ------   100   100   000    -    188
166 Unknown_Attribute       ------   100   100   000    -    0
167 Unknown_Attribute       ------   100   100   000    -    159
172 Unknown_Attribute       -O--C-   100   100   000    -    0
173 Unknown_Attribute       -O---K   100   100   000    -    0
192 Power-Off_Retract_Count -O--C-   100   100   000    -    94
194 Temperature_Celsius     PO---K   060   060   000    -    40 (Min/Max 33/40)
198 Offline_Uncorrectable   -O--C-   100   100   000    -    0
241 Total_LBAs_Written      -O--C-   100   100   000    -    11546
242 Total_LBAs_Read         -O--C-   100   100   000    -    16524
                            ||||||_ K auto-keep
                            |||||__ C event count
                            ||||___ R error rate
                            |||____ S speed/performance
                            ||_____ O updated online
                            |______ P prefailure warning

General Purpose Log Directory Version 1
SMART           Log Directory Version 1 [multi-sector log support]
Address    Access  R/W   Size  Description
0x00       GPL,SL  R/O      1  Log Directory
0x01           SL  R/O      1  Summary SMART error log
0x02           SL  R/O     51  Comprehensive SMART error log
0x03       GPL     R/O     64  Ext. Comprehensive SMART error log
0x04       GPL,SL  R/O      8  Device Statistics log
0x06           SL  R/O      1  SMART self-test log
0x07       GPL     R/O      1  Extended self-test log
0x09           SL  R/W      1  Selective self-test log
0x10       GPL     R/O      1  NCQ Command Error log
0x11       GPL     R/O      1  SATA Phy Event Counters log
0x30       GPL,SL  R/O      9  IDENTIFY DEVICE data log
0x80-0x9f  GPL,SL  R/W     16  Host vendor specific log

SMART Extended Comprehensive Error Log Version: 1 (64 sectors)
Device Error Count: 88
	CR     = Command Register
	FEATR  = Features Register
	COUNT  = Count (was: Sector Count) Register
	LBA_48 = Upper bytes of LBA High/Mid/Low Registers ]  ATA-8
	LH     = LBA High (was: Cylinder High) Register    ]   LBA
	LM     = LBA Mid (was: Cylinder Low) Register      ] Register
	LL     = LBA Low (was: Sector Number) Register     ]
	DV     = Device (was: Device/Head) Register
	DC     = Device Control Register
	ER     = Error register
	ST     = Status register
Powered_Up_Time is measured from power on, and printed as
DDd+hh:mm:SS.sss where DD=days, hh=hours, mm=minutes,
SS=sec, and sss=millisec. It "wraps" after 49.710 days.

Error 88 [87] occurred at disk power-on lifetime: 0 hours (0 days + 0 hours)
  When the command that caused the error occurred, the device was active or idle.

  After command completion occurred, registers were:
  ER -- ST COUNT  LBA_48  LH LM LL DV DC
  -- -- -- == -- == == == -- -- -- -- --
  84 -- 51 00 01 00 00 00 00 00 00 e0 00  Error: ICRC, ABRT 1 sectors at LBA = 0x00000000 = 0

  Commands leading to the command that caused the error were:
  CR FEATR COUNT  LBA_48  LH LM LL DV DC  Powered_Up_Time  Command/Feature_Name
  -- == -- == -- == == == -- -- -- -- --  ---------------  --------------------
  25 00 00 00 01 00 00 00 00 00 00 e0 00     00:00:00.000  READ DMA EXT
  ff 00 d5 00 01 00 00 00 00 00 01 00 04     00:00:00.000  [VENDOR SPECIFIC]
  25 00 00 00 01 00 00 00 00 00 00 e0 00     00:00:00.000  READ DMA EXT
  ff 00 d5 00 01 00 00 00 00 00 01 00 04     00:00:00.000  [VENDOR SPECIFIC]
  25 00 00 00 01 00 00 00 00 00 00 e0 00     00:00:00.000  READ DMA EXT

Error 87 [86] occurred at disk power-on lifetime: 0 hours (0 days + 0 hours)
  When the command that caused the error occurred, the device was active or idle.

  After command completion occurred, registers were:
  ER -- ST COUNT  LBA_48  LH LM LL DV DC
  -- -- -- == -- == == == -- -- -- -- --
  84 -- 51 00 01 00 00 00 00 00 00 e0 00  Error: ICRC, ABRT 1 sectors at LBA = 0x00000000 = 0

  Commands leading to the command that caused the error were:
  CR FEATR COUNT  LBA_48  LH LM LL DV DC  Powered_Up_Time  Command/Feature_Name
  -- == -- == -- == == == -- -- -- -- --  ---------------  --------------------
  25 00 00 00 01 00 00 00 00 00 00 e0 00     00:00:00.000  READ DMA EXT
  ff 00 d5 00 01 00 00 00 00 00 01 00 04     00:00:00.000  [VENDOR SPECIFIC]
  25 00 00 00 01 00 00 00 00 00 00 e0 00     00:00:00.000  READ DMA EXT
  ec 00 00 00 00 00 00 00 00 00 00 e0 00     00:00:00.000  IDENTIFY DEVICE
  ff 00 d5 00 01 00 00 00 00 00 01 00 04     00:00:00.000  [VENDOR SPECIFIC]

Error 86 [85] occurred at disk power-on lifetime: 0 hours (0 days + 0 hours)
  When the command that caused the error occurred, the device was active or idle.

  After command completion occurred, registers were:
  ER -- ST COUNT  LBA_48  LH LM LL DV DC
  -- -- -- == -- == == == -- -- -- -- --
  84 -- 51 00 01 00 00 00 00 00 00 e0 00  Error: ICRC, ABRT 1 sectors at LBA = 0x00000000 = 0

  Commands leading to the command that caused the error were:
  CR FEATR COUNT  LBA_48  LH LM LL DV DC  Powered_Up_Time  Command/Feature_Name
  -- == -- == -- == == == -- -- -- -- --  ---------------  --------------------
  25 00 00 00 01 00 00 00 00 00 00 e0 00     00:00:00.000  READ DMA EXT
  ec 00 00 00 00 00 00 00 00 00 00 e0 00     00:00:00.000  IDENTIFY DEVICE
  ff 00 d5 00 01 00 00 00 00 00 01 00 04     00:00:00.000  [VENDOR SPECIFIC]
  25 00 00 00 01 00 00 00 00 00 00 e0 00     00:00:00.000  READ DMA EXT
  ff 00 d5 00 01 00 00 00 00 00 01 00 04     00:00:00.000  [VENDOR SPECIFIC]

Error 85 [84] occurred at disk power-on lifetime: 0 hours (0 days + 0 hours)
  When the command that caused the error occurred, the device was active or idle.

  After command completion occurred, registers were:
  ER -- ST COUNT  LBA_48  LH LM LL DV DC
  -- -- -- == -- == == == -- -- -- -- --
  84 -- 51 00 01 00 00 00 00 00 00 e0 00  Error: ICRC, ABRT 1 sectors at LBA = 0x00000000 = 0

  Commands leading to the command that caused the error were:
  CR FEATR COUNT  LBA_48  LH LM LL DV DC  Powered_Up_Time  Command/Feature_Name
  -- == -- == -- == == == -- -- -- -- --  ---------------  --------------------
  25 00 00 00 01 00 00 00 00 00 00 e0 00     00:00:00.000  READ DMA EXT
  ff 00 d5 00 01 00 00 00 00 00 01 00 04     00:00:00.000  [VENDOR SPECIFIC]
  25 00 00 00 01 00 00 00 00 00 00 e0 00     00:00:00.000  READ DMA EXT
  ff 00 d5 00 01 00 00 00 00 00 01 00 04     00:00:00.000  [VENDOR SPECIFIC]
  25 00 00 00 01 00 00 00 00 00 00 e0 00     00:00:00.000  READ DMA EXT

Error 84 [83] occurred at disk power-on lifetime: 0 hours (0 days + 0 hours)
  When the command that caused the error occurred, the device was active or idle.

  After command completion occurred, registers were:
  ER -- ST COUNT  LBA_48  LH LM LL DV DC
  -- -- -- == -- == == == -- -- -- -- --
  84 -- 51 00 01 00 00 00 00 00 00 e0 00  Error: ICRC, ABRT 1 sectors at LBA = 0x00000000 = 0

  Commands leading to the command that caused the error were:
  CR FEATR COUNT  LBA_48  LH LM LL DV DC  Powered_Up_Time  Command/Feature_Name
  -- == -- == -- == == == -- -- -- -- --  ---------------  --------------------
  25 00 00 00 01 00 00 00 00 00 00 e0 00     00:00:00.000  READ DMA EXT
  ff 00 d5 00 01 00 00 00 00 00 01 00 04     00:00:00.000  [VENDOR SPECIFIC]
  25 00 00 00 01 00 00 00 00 00 00 e0 00     00:00:00.000  READ DMA EXT
  ec 00 00 00 00 00 00 00 00 00 00 e0 00     00:00:00.000  IDENTIFY DEVICE
  ff 00 d5 00 01 00 00 00 00 00 01 00 04     00:00:00.000  [VENDOR SPECIFIC]

Error 83 [82] occurred at disk power-on lifetime: 0 hours (0 days + 0 hours)
  When the command that caused the error occurred, the device was active or idle.

  After command completion occurred, registers were:
  ER -- ST COUNT  LBA_48  LH LM LL DV DC
  -- -- -- == -- == == == -- -- -- -- --
  84 -- 51 00 01 00 00 00 00 00 00 e0 00  Error: ICRC, ABRT 1 sectors at LBA = 0x00000000 = 0

  Commands leading to the command that caused the error were:
  CR FEATR COUNT  LBA_48  LH LM LL DV DC  Powered_Up_Time  Command/Feature_Name
  -- == -- == -- == == == -- -- -- -- --  ---------------  --------------------
  25 00 00 00 01 00 00 00 00 00 00 e0 00     00:00:00.000  READ DMA EXT
  ec 00 00 00 00 00 00 00 00 00 00 e0 00     00:00:00.000  IDENTIFY DEVICE
  ff 00 d5 00 01 00 00 00 00 00 01 00 04     00:00:00.000  [VENDOR SPECIFIC]
  25 00 00 00 01 00 00 00 00 00 00 e0 00     00:00:00.000  READ DMA EXT
  ff 00 d5 00 01 00 00 00 00 00 01 00 04     00:00:00.000  [VENDOR SPECIFIC]

Error 82 [81] occurred at disk power-on lifetime: 0 hours (0 days + 0 hours)
  When the command that caused the error occurred, the device was active or idle.

  After command completion occurred, registers were:
  ER -- ST COUNT  LBA_48  LH LM LL DV DC
  -- -- -- == -- == == == -- -- -- -- --
  84 -- 51 00 01 00 00 00 00 00 00 e0 00  Error: ICRC, ABRT 1 sectors at LBA = 0x00000000 = 0

  Commands leading to the command that caused the error were:
  CR FEATR COUNT  LBA_48  LH LM LL DV DC  Powered_Up_Time  Command/Feature_Name
  -- == -- == -- == == == -- -- -- -- --  ---------------  --------------------
  25 00 00 00 01 00 00 00 00 00 00 e0 00     00:00:00.000  READ DMA EXT
  ff 00 d5 00 01 00 00 00 00 00 01 00 04     00:00:00.000  [VENDOR SPECIFIC]
  25 00 00 00 01 00 00 00 00 00 00 e0 00     00:00:00.000  READ DMA EXT
  ec 00 00 00 00 00 00 00 00 00 00 e0 00     00:00:00.000  IDENTIFY DEVICE
  ff 00 d5 00 01 00 00 00 00 00 01 00 04     00:00:00.000  [VENDOR SPECIFIC]

Error 81 [80] occurred at disk power-on lifetime: 0 hours (0 days + 0 hours)
  When the command that caused the error occurred, the device was active or idle.

  After command completion occurred, registers were:
  ER -- ST COUNT  LBA_48  LH LM LL DV DC
  -- -- -- == -- == == == -- -- -- -- --
  84 -- 51 00 01 00 00 00 00 00 00 e0 00  Error: ICRC, ABRT 1 sectors at LBA = 0x00000000 = 0

  Commands leading to the command that caused the error were:
  CR FEATR COUNT  LBA_48  LH LM LL DV DC  Powered_Up_Time  Command/Feature_Name
  -- == -- == -- == == == -- -- -- -- --  ---------------  --------------------
  25 00 00 00 01 00 00 00 00 00 00 e0 00     00:00:00.000  READ DMA EXT
  ec 00 00 00 00 00 00 00 00 00 00 e0 00     00:00:00.000  IDENTIFY DEVICE
  ff 00 d5 00 01 00 00 00 00 00 01 00 04     00:00:00.000  [VENDOR SPECIFIC]
  25 00 00 00 01 00 00 00 00 00 00 e0 00     00:00:00.000  READ DMA EXT
  ff 00 d5 00 01 00 00 00 00 00 01 00 04     00:00:00.000  [VENDOR SPECIFIC]

SMART Extended Self-test Log Version: 1 (1 sectors)
Num  Test_Description    Status                  Remaining  LifeTime(hours)  LBA_of_first_error
# 1  Short offline       Interrupted (host reset)      00%      5551         -
# 2  Short offline       Completed without error       00%      5551         -
# 3  Short offline       Completed without error       00%      5551         -
# 4  Short offline       Completed without error       00%      4045         -
# 5  Short offline       Completed without error       00%      3658         -
# 6  Short offline       Completed without error       00%      3284         -
# 7  Short offline       Interrupted (host reset)      00%      2156         -
# 8  Short offline       Completed without error       00%      1256         -
# 9  Short offline       Completed without error       00%      1228         -
#10  Short offline       Completed without error       00%       952         -
#11  Short offline       Completed without error       00%       840         -
#12  Short offline       Completed without error       00%       669         -
#13  Short offline       Completed without error       00%       328         -
#14  Short offline       Completed without error       00%       200         -

SMART Selective self-test log data structure revision number 0
Note: revision number not 1 implies that no selective self-test has ever been run
 SPAN  MIN_LBA  MAX_LBA  CURRENT_TEST_STATUS
    1        0        0  Not_testing
    2        0        0  Not_testing
    3        0        0  Not_testing
    4        0        0  Not_testing
    5        0        0  Not_testing
Selective self-test flags (0x0):
  After scanning selected spans, do NOT read-scan remainder of disk.
If Selective self-test is pending on power-up, resume after 0 minute delay.

SCT Commands not supported

Device Statistics (GP Log 0x04)
Page  Offset Size        Value Flags Description
0x01  =====  =               =  ===  == General Statistics (rev 1) ==
0x01  0x008  4            1727  ---  Lifetime Power-On Resets
0x01  0x010  4            5602  ---  Power-on Hours
0x01  0x018  6     24214771781  ---  Logical Sectors Written
0x01  0x028  6     34653613073  ---  Logical Sectors Read
0x04  =====  =               =  ===  == General Errors Statistics (rev 1) ==
0x04  0x008  4               0  ---  Number of Reported Uncorrectable Errors
0x05  =====  =               =  ===  == Temperature Statistics (rev 1) ==
0x05  0x008  1              40  ---  Current Temperature
0x05  0x020  1              40  ---  Highest Temperature
0x05  0x028  1              33  ---  Lowest Temperature
0x06  =====  =               =  ===  == Transport Statistics (rev 1) ==
0x06  0x008  4            7126  ---  Number of Hardware Resets
0x06  0x018  4             129  ---  Number of Interface CRC Errors
0x07  =====  =               =  ===  == Solid State Device Statistics (rev 1) ==
0x07  0x008  1              15  ---  Percentage Used Endurance Indicator
                                |||_ C monitored condition met
                                ||__ D supports DSN
                                |___ N normalized value

Pending Defects log (GP Log 0x0c) not supported

SATA Phy Event Counters (GP Log 0x11)
ID      Size     Value  Description
0x0001  2            0  Command failed due to ICRC error
0x0003  2            0  R_ERR response for device-to-host data FIS
0x0004  2            0  R_ERR response for host-to-device data FIS
0x0006  2            0  R_ERR response for device-to-host non-data FIS
0x0007  2            0  R_ERR response for host-to-device non-data FIS
0x0008  2            0  Device-to-host non-data FIS retries
0x0009  4            6  Transition from drive PhyRdy to drive PhyNRdy
0x000a  4            7  Device-to-host register FISes sent due to a COMRESET
0x000f  2            0  R_ERR response for host-to-device data FIS, CRC
0x0010  2            0  R_ERR response for host-to-device data FIS, non-CRC
0x0012  2            0  R_ERR response for host-to-device non-data FIS, CRC
0x0013  2            0  R_ERR response for host-to-device non-data FIS, non-CRC

