smartctl 7.0 2018-12-30 r4883 [x86_64-linux-5.9.16-050916-generic] (local build)
Copyright (C) 2002-18, Bruce Allen, Christian Franke, www.smartmontools.org

=== START OF INFORMATION SECTION ===
Model Family:     Hitachi Deskstar 7K1000.B
Device Model:     HDT721010SLA360
Serial Number:    --
LU WWN Device Id: 5 000cca ...
Firmware Version: ST6OA3AA
User Capacity:    1,000,204,886,016 bytes [1.00 TB]
Sector Size:      512 bytes logical/physical
Rotation Rate:    7200 rpm
Device is:        In smartctl database [for details use: -P show]
ATA Version is:   ATA8-ACS T13/1699-D revision 4
SATA Version is:  SATA 2.6, 3.0 Gb/s
Local Time is:    Sat May 15 19:29:12 2021 HKT
SMART support is: Available - device has SMART capability.
SMART support is: Enabled
AAM level is:     254 (maximum performance), recommended: 128
APM feature is:   Disabled
Rd look-ahead is: Enabled
Write cache is:   Enabled
DSN feature is:   Unavailable
ATA Security is:  Disabled, frozen [SEC2]
Wt Cache Reorder: Enabled

=== START OF READ SMART DATA SECTION ===
SMART overall-health self-assessment test result: PASSED

General SMART Values:
Offline data collection status:  (0x84)	Offline data collection activity
					was suspended by an interrupting command from host.
					Auto Offline Data Collection: Enabled.
Self-test execution status:      (   0)	The previous self-test routine completed
					without error or no self-test has ever 
					been run.
Total time to complete Offline 
data collection: 		(14090) seconds.
Offline data collection
capabilities: 			 (0x5b) SMART execute Offline immediate.
					Auto Offline data collection on/off support.
					Suspend Offline collection upon new
					command.
					Offline surface scan supported.
					Self-test supported.
					No Conveyance Self-test supported.
					Selective Self-test supported.
SMART capabilities:            (0x0003)	Saves SMART data before entering
					power-saving mode.
					Supports SMART auto save timer.
Error logging capability:        (0x01)	Error logging supported.
					General Purpose Logging supported.
Short self-test routine 
recommended polling time: 	 (   1) minutes.
Extended self-test routine
recommended polling time: 	 ( 235) minutes.
SCT capabilities: 	       (0x003d)	SCT Status supported.
					SCT Error Recovery Control supported.
					SCT Feature Control supported.
					SCT Data Table supported.

SMART Attributes Data Structure revision number: 16
Vendor Specific SMART Attributes with Thresholds:
ID# ATTRIBUTE_NAME          FLAGS    VALUE WORST THRESH FAIL RAW_VALUE
  1 Raw_Read_Error_Rate     PO-R--   100   100   016    -    0
  2 Throughput_Performance  P-S---   132   132   054    -    114
  3 Spin_Up_Time            POS---   121   121   024    -    471 (Average 478)
  4 Start_Stop_Count        -O--C-   100   100   000    -    3189
  5 Reallocated_Sector_Ct   PO--CK   100   100   005    -    0
  7 Seek_Error_Rate         PO-R--   100   100   067    -    0
  8 Seek_Time_Performance   P-S---   123   123   020    -    34
  9 Power_On_Hours          -O--C-   097   097   000    -    21753
 10 Spin_Retry_Count        PO--C-   100   100   060    -    0
 12 Power_Cycle_Count       -O--CK   100   100   000    -    3179
192 Power-Off_Retract_Count -O--CK   098   098   000    -    3206
193 Load_Cycle_Count        -O--C-   098   098   000    -    3206
194 Temperature_Celsius     -O----   120   120   000    -    50 (Min/Max 17/62)
196 Reallocated_Event_Count -O--CK   100   100   000    -    0
197 Current_Pending_Sector  -O---K   100   100   000    -    0
198 Offline_Uncorrectable   ---R--   100   100   000    -    0
199 UDMA_CRC_Error_Count    -O-R--   200   200   000    -    6
                            ||||||_ K auto-keep
                            |||||__ C event count
                            ||||___ R error rate
                            |||____ S speed/performance
                            ||_____ O updated online
                            |______ P prefailure warning

General Purpose Log Directory Version 1
SMART           Log Directory Version 1 [multi-sector log support]
Address    Access  R/W   Size  Description
0x00       GPL,SL  R/O      1  Log Directory
0x01           SL  R/O      1  Summary SMART error log
0x03       GPL     R/O      1  Ext. Comprehensive SMART error log
0x06           SL  R/O      1  SMART self-test log
0x07       GPL     R/O      1  Extended self-test log
0x09           SL  R/W      1  Selective self-test log
0x10       GPL     R/O      1  NCQ Command Error log
0x11       GPL     R/O      1  SATA Phy Event Counters log
0x20       GPL     R/O      1  Streaming performance log [OBS-8]
0x21       GPL     R/O      1  Write stream error log
0x22       GPL     R/O      1  Read stream error log
0x80-0x9f  GPL,SL  R/W     16  Host vendor specific log
0xe0       GPL,SL  R/W      1  SCT Command/Status
0xe1       GPL,SL  R/W      1  SCT Data Transfer

SMART Extended Comprehensive Error Log Version: 1 (1 sectors)
Device Error Count: 4
	CR     = Command Register
	FEATR  = Features Register
	COUNT  = Count (was: Sector Count) Register
	LBA_48 = Upper bytes of LBA High/Mid/Low Registers ]  ATA-8
	LH     = LBA High (was: Cylinder High) Register    ]   LBA
	LM     = LBA Mid (was: Cylinder Low) Register      ] Register
	LL     = LBA Low (was: Sector Number) Register     ]
	DV     = Device (was: Device/Head) Register
	DC     = Device Control Register
	ER     = Error register
	ST     = Status register
Powered_Up_Time is measured from power on, and printed as
DDd+hh:mm:SS.sss where DD=days, hh=hours, mm=minutes,
SS=sec, and sss=millisec. It "wraps" after 49.710 days.

Error 4 [3] occurred at disk power-on lifetime: 21155 hours (881 days + 11 hours)
  When the command that caused the error occurred, the device was active or idle.

  After command completion occurred, registers were:
  ER -- ST COUNT  LBA_48  LH LM LL DV DC
  -- -- -- == -- == == == -- -- -- -- --
  84 -- 51 00 50 00 00 3b 25 15 b0 4b 00  Error: ICRC, ABRT at LBA = 0x3b2515b0 = 992286128

  Commands leading to the command that caused the error were:
  CR FEATR COUNT  LBA_48  LH LM LL DV DC  Powered_Up_Time  Command/Feature_Name
  -- == -- == -- == == == -- -- -- -- --  ---------------  --------------------
  60 02 00 00 a0 00 00 3b 25 14 00 40 08     04:36:22.800  READ FPDMA QUEUED
  60 01 f8 00 98 00 00 07 80 1a 08 40 08     04:36:22.800  READ FPDMA QUEUED
  60 00 f8 00 90 00 00 07 80 19 08 40 08     04:36:22.800  READ FPDMA QUEUED
  60 00 78 00 88 00 00 07 80 18 88 40 08     04:36:22.800  READ FPDMA QUEUED
  60 00 30 00 80 00 00 07 80 18 48 40 08     04:36:22.800  READ FPDMA QUEUED

Error 3 [2] occurred at disk power-on lifetime: 21152 hours (881 days + 8 hours)
  When the command that caused the error occurred, the device was active or idle.

  After command completion occurred, registers were:
  ER -- ST COUNT  LBA_48  LH LM LL DV DC
  -- -- -- == -- == == == -- -- -- -- --
  84 -- 51 00 20 00 00 05 00 07 e1 45 00  Error: ICRC, ABRT at LBA = 0x050007e1 = 83888097

  Commands leading to the command that caused the error were:
  CR FEATR COUNT  LBA_48  LH LM LL DV DC  Powered_Up_Time  Command/Feature_Name
  -- == -- == -- == == == -- -- -- -- --  ---------------  --------------------
  60 00 f8 00 d8 00 00 07 80 19 08 40 08     00:53:26.600  READ FPDMA QUEUED
  60 00 78 00 d0 00 00 07 80 18 88 40 08     00:53:26.600  READ FPDMA QUEUED
  60 00 30 00 a0 00 00 07 80 18 48 40 08     00:53:26.600  READ FPDMA QUEUED
  60 00 10 00 98 00 00 07 80 18 28 40 08     00:53:26.600  READ FPDMA QUEUED
  60 00 08 00 90 00 00 07 80 18 10 40 08     00:53:26.600  READ FPDMA QUEUED

Error 2 [1] occurred at disk power-on lifetime: 21151 hours (881 days + 7 hours)
  When the command that caused the error occurred, the device was active or idle.

  After command completion occurred, registers were:
  ER -- ST COUNT  LBA_48  LH LM LL DV DC
  -- -- -- == -- == == == -- -- -- -- --
  84 -- 51 01 a0 00 00 3b 25 14 60 4b 00  Error: ICRC, ABRT at LBA = 0x3b251460 = 992285792

  Commands leading to the command that caused the error were:
  CR FEATR COUNT  LBA_48  LH LM LL DV DC  Powered_Up_Time  Command/Feature_Name
  -- == -- == -- == == == -- -- -- -- --  ---------------  --------------------
  60 02 00 00 a0 00 00 02 80 04 00 40 08     00:52:50.800  READ FPDMA QUEUED
  60 02 00 00 c8 00 00 3b 25 14 00 40 08     00:52:50.800  READ FPDMA QUEUED
  60 00 08 00 68 00 00 3b 25 20 78 40 08     00:52:50.800  READ FPDMA QUEUED
  60 01 f8 00 98 00 00 00 00 0a 08 40 08     00:52:50.800  READ FPDMA QUEUED
  60 00 08 00 60 00 00 3b 25 20 38 40 08     00:52:50.800  READ FPDMA QUEUED

Error 1 [0] occurred at disk power-on lifetime: 21151 hours (881 days + 7 hours)
  When the command that caused the error occurred, the device was active or idle.

  After command completion occurred, registers were:
  ER -- ST COUNT  LBA_48  LH LM LL DV DC
  -- -- -- == -- == == == -- -- -- -- --
  84 -- 51 01 70 00 00 74 70 64 90 44 00  Error: ICRC, ABRT at LBA = 0x74706490 = 1953522832

  Commands leading to the command that caused the error were:
  CR FEATR COUNT  LBA_48  LH LM LL DV DC  Powered_Up_Time  Command/Feature_Name
  -- == -- == -- == == == -- -- -- -- --  ---------------  --------------------
  60 02 00 00 80 00 00 74 70 64 00 40 08     00:01:01.700  READ FPDMA QUEUED
  60 01 f8 00 78 00 00 73 f0 b2 08 40 08     00:01:01.700  READ FPDMA QUEUED
  60 00 f8 00 70 00 00 73 f0 b1 08 40 08     00:01:01.700  READ FPDMA QUEUED
  60 00 78 00 68 00 00 73 f0 b0 88 40 08     00:01:01.700  READ FPDMA QUEUED
  60 00 30 00 60 00 00 73 f0 b0 48 40 08     00:01:01.700  READ FPDMA QUEUED

SMART Extended Self-test Log Version: 1 (1 sectors)
No self-tests have been logged.  [To run self-tests, use: smartctl -t]

SMART Selective self-test log data structure revision number 1
 SPAN  MIN_LBA  MAX_LBA  CURRENT_TEST_STATUS
    1        0        0  Not_testing
    2        0        0  Not_testing
    3        0        0  Not_testing
    4        0        0  Not_testing
    5        0        0  Not_testing
Selective self-test flags (0x0):
  After scanning selected spans, do NOT read-scan remainder of disk.
If Selective self-test is pending on power-up, resume after 0 minute delay.

SCT Status Version:                  3
SCT Version (vendor specific):       256 (0x0100)
Device State:                        SMART Off-line Data Collection executing in background (4)
Current Temperature:                    50 Celsius
Power Cycle Min/Max Temperature:     32/52 Celsius
Lifetime    Min/Max Temperature:     17/62 Celsius
Under/Over Temperature Limit Count:   0/0

SCT Temperature History Version:     2
Temperature Sampling Period:         1 minute
Temperature Logging Interval:        1 minute
Min/Max recommended Temperature:      0/60 Celsius
Min/Max Temperature Limit:           -40/70 Celsius
Temperature History Size (Index):    128 (73)

SCT Error Recovery Control:
           Read: Disabled
          Write: Disabled

Device Statistics (GP/SMART Log 0x04) not supported

Pending Defects log (GP Log 0x0c) not supported

SATA Phy Event Counters (GP Log 0x11)
ID      Size     Value  Description
0x0001  2            0  Command failed due to ICRC error
0x0009  2        65535+ Transition from drive PhyRdy to drive PhyNRdy
0x000a  2           24  Device-to-host register FISes sent due to a COMRESET
0x000b  2            0  CRC errors within host-to-device FIS
0x000d  2            0  Non-CRC errors within host-to-device FIS

