smartctl 7.4 2023-08-01 r5530 [x86_64-linux-6.11.4-301.fc41.x86_64] (local build)
Copyright (C) 2002-23, Bruce Allen, Christian Franke, www.smartmontools.org

=== START OF INFORMATION SECTION ===
Model Number:                       Samsung SSD 980 1TB
Serial Number:                      --
Firmware Version:                   2B4QFXO7
PCI Vendor/Subsystem ID:            0x144d
IEEE OUI Identifier:                0x002538
Total NVM Capacity:                 1,000,204,886,016 [1.00 TB]
Unallocated NVM Capacity:           0
Controller ID:                      5
NVMe Version:                       1.4
Number of Namespaces:               1
Namespace 1 Size/Capacity:          1,000,204,886,016 [1.00 TB]
Namespace 1 Utilization:            900,152,373,248 [900 GB]
Namespace 1 Formatted LBA Size:     512
Namespace 1 IEEE EUI-64:            002538 ...
Local Time is:                      Wed Dec 25 18:32:27 2024 CET
Firmware Updates (0x16):            3 Slots, no Reset required
Optional Admin Commands (0x0017):   Security Format Frmw_DL Self_Test
Optional NVM Commands (0x0055):     Comp DS_Mngmt Sav/Sel_Feat Timestmp
Log Page Attributes (0x0f):         S/H_per_NS Cmd_Eff_Lg Ext_Get_Lg Telmtry_Lg
Maximum Data Transfer Size:         512 Pages
Warning  Comp. Temp. Threshold:     82 Celsius
Critical Comp. Temp. Threshold:     85 Celsius
Namespace 1 Features (0x10):        NP_Fields

Supported Power States
St Op     Max   Active     Idle   RL RT WL WT  Ent_Lat  Ex_Lat
 0 +     5.24W       -        -    0  0  0  0        0       0
 1 +     4.49W       -        -    1  1  1  1        0       0
 2 +     2.19W       -        -    2  2  2  2        0     500
 3 -   0.0500W       -        -    3  3  3  3      210    1200
 4 -   0.0050W       -        -    4  4  4  4     1000    9000

Supported LBA Sizes (NSID 0x1)
Id Fmt  Data  Metadt  Rel_Perf
 0 +     512       0         0

=== START OF SMART DATA SECTION ===
SMART overall-health self-assessment test result: PASSED

SMART/Health Information (NVMe Log 0x02)
Critical Warning:                   0x00
Temperature:                        43 Celsius
Available Spare:                    100%
Available Spare Threshold:          10%
Percentage Used:                    0%
Data Units Read:                    3,664,447 [1.87 TB]
Data Units Written:                 5,712,781 [2.92 TB]
Host Read Commands:                 12,809,837
Host Write Commands:                6,269,526
Controller Busy Time:               55
Power Cycles:                       244
Power On Hours:                     53
Unsafe Shutdowns:                   6
Media and Data Integrity Errors:    0
Error Information Log Entries:      0
Warning  Comp. Temperature Time:    0
Critical Comp. Temperature Time:    0
Temperature Sensor 1:               43 Celsius
Temperature Sensor 2:               52 Celsius
Thermal Temp. 2 Transition Count:   7

Error Information (NVMe Log 0x01, 16 of 64 entries)
No Errors Logged

Read Self-test Log failed: Invalid Field in Command (0x002)



