=== START OF INFORMATION SECTION ===
Model Family:     JMicron based SSDs
Device Model:     APPLE SSD TS128C
Serial Number:    --
Firmware Version: CJAA0201
User Capacity:    121 332 826 112 bytes [121 GB]
Sector Size:      512 bytes logical/physical
Rotation Rate:    Solid State Device
Form Factor:      < 1.8 inches
Device is:        In smartctl database [for details use: -P show]
ATA Version is:   ATA8-ACS (minor revision not indicated)
SATA Version is:  SATA 2.6, 3.0 Gb/s (current: 3.0 Gb/s)
Local Time is:    Mon Jun 12 14:51:55 2017 MSK
SMART support is: Available - device has SMART capability.
SMART support is: Enabled
AAM feature is:   Unavailable
APM level is:     128 (minimum power consumption without standby)
Rd look-ahead is: Enabled
Write cache is:   Enabled
ATA Security is:  Disabled, NOT FROZEN [SEC1]
Wt Cache Reorder: Enabled

=== START OF READ SMART DATA SECTION ===
SMART overall-health self-assessment test result: PASSED

General SMART Values:
Offline data collection status:  (0x00)	Offline data collection activity
					was never started.
					Auto Offline Data Collection: Disabled.
Self-test execution status:      (   0)	The previous self-test routine completed
					without error or no self-test has ever 
					been run.
Total time to complete Offline 
data collection: 		(  120) seconds.
Offline data collection
capabilities: 			 (0x5b) SMART execute Offline immediate.
					Auto Offline data collection on/off support.
					Suspend Offline collection upon new
					command.
					Offline surface scan supported.
					Self-test supported.
					No Conveyance Self-test supported.
					Selective Self-test supported.
SMART capabilities:            (0x0003)	Saves SMART data before entering
					power-saving mode.
					Supports SMART auto save timer.
Error logging capability:        (0x01)	Error logging supported.
					General Purpose Logging supported.
Short self-test routine 
recommended polling time: 	 (   2) minutes.
Extended self-test routine
recommended polling time: 	 (  12) minutes.
SCT capabilities: 	       (0x0039)	SCT Status supported.
					SCT Error Recovery Control supported.
					SCT Feature Control supported.
					SCT Data Table supported.

SMART Attributes Data Structure revision number: 16
Vendor Specific SMART Attributes with Thresholds:
ID# ATTRIBUTE_NAME          FLAGS    VALUE WORST THRESH FAIL RAW_VALUE
  1 Raw_Read_Error_Rate     -O-R--   099   099   000    -    0
  2 Throughput_Performance  P-S---   100   100   050    -    0
  3 Unknown_JMF_Attribute   POS---   100   100   050    -    0
  5 Reallocated_Sector_Ct   PO--C-   100   100   050    -    0
  7 Unknown_JMF_Attribute   PO-R--   100   100   050    -    0
  8 Unknown_JMF_Attribute   P-S---   100   100   050    -    0
  9 Power_On_Hours          -O--C-   100   100   000    -    9984
 10 Unknown_JMF_Attribute   PO--C-   100   100   050    -    0
 12 Power_Cycle_Count       -O--C-   100   100   000    -    16388
167 Unknown_JMF_Attribute   -O---K   100   100   000    -    0
168 SATA_Phy_Error_Count    -O--C-   100   100   000    -    0
169 Unknown_JMF_Attribute   PO--C-   100   100   010    -    1142556329258
170 Bad_Block_Count         PO--C-   100   100   010    -    54 252 82
171 Unknown_Attribute       ------   100   100   000    -    266
173 Erase_Count             PO--C-   188   188   100    -    1 377 203
175 Bad_Cluster_Table_Count PO--C-   100   100   010    -    0
192 Unexpect_Power_Loss_Ct  -O--C-   100   100   000    -    118
194 Temperature_Celsius     PO---K   065   039   030    -    35 (Min/Max 16/61)
197 Current_Pending_Sector  -O--C-   100   100   000    -    0
199 UDMA_CRC_Error_Count    -O--C-   100   100   000    -    0
240 Unknown_JMF_Attribute   PO--C-   100   100   050    -    0
                            ||||||_ K auto-keep
                            |||||__ C event count
                            ||||___ R error rate
                            |||____ S speed/performance
                            ||_____ O updated online
                            |______ P prefailure warning

General Purpose Log Directory Version 1
SMART           Log Directory Version 1 [multi-sector log support]
Address    Access  R/W   Size  Description
0x00       GPL,SL  R/O      1  Log Directory
0x01           SL  R/O      1  Summary SMART error log
0x02           SL  R/O     51  Comprehensive SMART error log
0x03       GPL     R/O     64  Ext. Comprehensive SMART error log
0x06           SL  R/O      1  SMART self-test log
0x07       GPL     R/O      1  Extended self-test log
0x09           SL  R/W      1  Selective self-test log
0x11       GPL     R/O      1  SATA Phy Event Counters log
0x80-0x9f  GPL,SL  R/W     16  Host vendor specific log
0xe0       GPL,SL  R/W      1  SCT Command/Status
0xe1       GPL,SL  R/W      1  SCT Data Transfer

SMART Extended Comprehensive Error Log Version: 1 (64 sectors)
Device Error Count: 1
	CR     = Command Register
	FEATR  = Features Register
	COUNT  = Count (was: Sector Count) Register
	LBA_48 = Upper bytes of LBA High/Mid/Low Registers ]  ATA-8
	LH     = LBA High (was: Cylinder High) Register    ]   LBA
	LM     = LBA Mid (was: Cylinder Low) Register      ] Register
	LL     = LBA Low (was: Sector Number) Register     ]
	DV     = Device (was: Device/Head) Register
	DC     = Device Control Register
	ER     = Error register
	ST     = Status register
Powered_Up_Time is measured from power on, and printed as
DDd+hh:mm:SS.sss where DD=days, hh=hours, mm=minutes,
SS=sec, and sss=millisec. It "wraps" after 49.710 days.

Error 1 [0] occurred at disk power-on lifetime: 4740 hours (197 days + 12 hours)
  When the command that caused the error occurred, the device was active or idle.

  After command completion occurred, registers were:
  ER -- ST COUNT  LBA_48  LH LM LL DV DC
  -- -- -- == -- == == == -- -- -- -- --
  84 -- 51 02 00 00 00 0b 50 b3 30 40 00  Error: ICRC, ABRT 512 sectors at LBA = 0x0b50b330 = 189838128

  Commands leading to the command that caused the error were:
  CR FEATR COUNT  LBA_48  LH LM LL DV DC  Powered_Up_Time  Command/Feature_Name
  -- == -- == -- == == == -- -- -- -- --  ---------------  --------------------
  35 00 00 02 00 00 00 0b 50 b3 30 40 00     02:02:11.910  WRITE DMA EXT
  35 00 00 02 00 00 00 0b 50 b1 30 40 00     02:02:11.910  WRITE DMA EXT
  35 00 00 02 00 00 00 0b 50 af 30 40 00     02:02:11.907  WRITE DMA EXT
  35 00 00 02 00 00 00 0b 50 ad 30 40 00     02:02:11.904  WRITE DMA EXT
  35 00 00 02 00 00 00 0b 50 ab 30 40 00     02:02:11.900  WRITE DMA EXT

SMART Extended Self-test Log Version: 1 (1 sectors)
No self-tests have been logged.  [To run self-tests, use: smartctl -t]

SMART Selective self-test log data structure revision number 1
 SPAN  MIN_LBA  MAX_LBA  CURRENT_TEST_STATUS
    1        0        0  Not_testing
    2        0        0  Not_testing
    3        0        0  Not_testing
    4        0        0  Not_testing
    5        0        0  Not_testing
Selective self-test flags (0x0):
  After scanning selected spans, do NOT read-scan remainder of disk.
If Selective self-test is pending on power-up, resume after 0 minute delay.

SCT Status Version:                  3
SCT Version (vendor specific):       1 (0x0001)
SCT Support Level:                   0
Device State:                        Active (0)
Current Temperature:                    35 Celsius
Power Cycle Min/Max Temperature:     30/35 Celsius
Lifetime    Min/Max Temperature:     16/61 Celsius
Under/Over Temperature Limit Count:   0/0
Vendor specific:
00 00 04 00 01 01 00 05 05 00 00 00 00 00 00 00
00 02 02 00 5f 74 24 02 04 00 00 00 00 00 00 03

SCT Temperature History Version:     2
Temperature Sampling Period:         1 minute
Temperature Logging Interval:        1 minute
Min/Max recommended Temperature:      5/40 Celsius
Min/Max Temperature Limit:            0/70 Celsius
Temperature History Size (Index):    128 (16)

SCT Error Recovery Control:
           Read:     80 (8,0 seconds)
          Write:     80 (8,0 seconds)

Device Statistics (GP/SMART Log 0x04) not supported

SATA Phy Event Counters (GP Log 0x11)
ID      Size     Value  Description
0x0001  2            0  Command failed due to ICRC error
0x0002  4            0  R_ERR response for data FIS
0x0003  2            0  R_ERR response for device-to-host data FIS
0x0004  2            0  R_ERR response for host-to-device data FIS
0x0005  4            0  R_ERR response for non-data FIS
0x0006  2            0  R_ERR response for device-to-host non-data FIS
0x0007  2            0  R_ERR response for host-to-device non-data FIS
0x0008  2            0  Device-to-host non-data FIS retries
0x0009  4            2  Transition from drive PhyRdy to drive PhyNRdy
0x000a  4            2  Device-to-host register FISes sent due to a COMRESET
0x000f  2            0  R_ERR response for host-to-device data FIS, CRC
0x0010  2            0  R_ERR response for host-to-device data FIS, non-CRC
0x0012  2            0  R_ERR response for host-to-device non-data FIS, CRC
0x0013  2            0  R_ERR response for host-to-device non-data FIS, non-CRC



