=== START OF INFORMATION SECTION ===
Model Family:     Western Digital Black Mobile
Device Model:     WDC WD5000LPLX-66ZNTT1
Serial Number:    --
LU WWN Device Id: 5 0014ee ...
Firmware Version: 02.01A02
User Capacity:    500,107,862,016 bytes [500 GB]
Sector Sizes:     512 bytes logical, 4096 bytes physical
Rotation Rate:    7200 rpm
Form Factor:      2.5 inches
Device is:        In smartctl database [for details use: -P show]
ATA Version is:   ACS-2, ACS-3 T13/2161-D revision 3b
SATA Version is:  SATA 3.1, 6.0 Gb/s (current: 6.0 Gb/s)
Local Time is:    Mon Feb 10 08:37:37 2020 -03
SMART support is: Available - device has SMART capability.
SMART support is: Enabled
AAM feature is:   Unavailable
APM level is:     254 (maximum performance)
Rd look-ahead is: Enabled
Write cache is:   Enabled
DSN feature is:   Unavailable
ATA Security is:  Disabled, NOT FROZEN [SEC1]
Wt Cache Reorder: Enabled

=== START OF READ SMART DATA SECTION ===
SMART overall-health self-assessment test result: PASSED

General SMART Values:
Offline data collection status:  (0x82)	Offline data collection activity
					was completed without error.
					Auto Offline Data Collection: Enabled.
Self-test execution status:      (   0)	The previous self-test routine completed
					without error or no self-test has ever 
					been run.
Total time to complete Offline 
data collection: 		( 6480) seconds.
Offline data collection
capabilities: 			 (0x5b) SMART execute Offline immediate.
					Auto Offline data collection on/off support.
					Suspend Offline collection upon new
					command.
					Offline surface scan supported.
					Self-test supported.
					No Conveyance Self-test supported.
					Selective Self-test supported.
SMART capabilities:            (0x0003)	Saves SMART data before entering
					power-saving mode.
					Supports SMART auto save timer.
Error logging capability:        (0x01)	Error logging supported.
					General Purpose Logging supported.
Short self-test routine 
recommended polling time: 	 (   2) minutes.
Extended self-test routine
recommended polling time: 	 (  77) minutes.
SCT capabilities: 	       (0x303d)	SCT Status supported.
					SCT Error Recovery Control supported.
					SCT Feature Control supported.
					SCT Data Table supported.

SMART Attributes Data Structure revision number: 16
Vendor Specific SMART Attributes with Thresholds:
ID# ATTRIBUTE_NAME          FLAGS    VALUE WORST THRESH FAIL RAW_VALUE
  1 Raw_Read_Error_Rate     POSR-K   200   200   051    -    0
  3 Spin_Up_Time            POS--K   150   149   021    -    1500
  4 Start_Stop_Count        -O--CK   100   100   000    -    203
  5 Reallocated_Sector_Ct   PO--CK   200   200   140    -    0
  7 Seek_Error_Rate         POSR-K   200   200   051    -    0
  9 Power_On_Hours          -O--CK   099   099   000    -    1406
 10 Spin_Retry_Count        PO--CK   100   100   051    -    0
 11 Calibration_Retry_Count -O--CK   100   100   000    -    0
 12 Power_Cycle_Count       -O--CK   100   100   000    -    203
183 Runtime_Bad_Block       -O--CK   100   100   000    -    0
184 End-to-End_Error        PO--CK   100   100   097    -    0
187 Reported_Uncorrect      -O--CK   100   100   000    -    0
188 Command_Timeout         -O--CK   100   100   000    -    0
190 Airflow_Temperature_Cel -O---K   068   049   040    -    32 (Min/Max 21/32)
191 G-Sense_Error_Rate      -O--CK   080   080   000    -    20
192 Power-Off_Retract_Count -O--CK   200   200   000    -    82
193 Load_Cycle_Count        -O--CK   200   200   000    -    120
194 Temperature_Celsius     -O---K   111   092   000    -    32
196 Reallocated_Event_Count -O--CK   200   200   000    -    0
197 Current_Pending_Sector  -O--CK   200   200   000    -    0
198 Offline_Uncorrectable   ----CK   200   200   000    -    0
199 UDMA_CRC_Error_Count    -O--CK   200   200   000    -    0
200 Multi_Zone_Error_Rate   ---R--   200   200   000    -    0
                            ||||||_ K auto-keep
                            |||||__ C event count
                            ||||___ R error rate
                            |||____ S speed/performance
                            ||_____ O updated online
                            |______ P prefailure warning

General Purpose Log Directory Version 1
SMART           Log Directory Version 1 [multi-sector log support]
Address    Access  R/W   Size  Description
0x00       GPL,SL  R/O      1  Log Directory
0x01           SL  R/O      1  Summary SMART error log
0x02           SL  R/O      5  Comprehensive SMART error log
0x03       GPL     R/O      6  Ext. Comprehensive SMART error log
0x06           SL  R/O      1  SMART self-test log
0x07       GPL     R/O      1  Extended self-test log
0x09           SL  R/W      1  Selective self-test log
0x10       GPL     R/O      1  NCQ Command Error log
0x11       GPL     R/O      1  SATA Phy Event Counters log
0x80-0x9f  GPL,SL  R/W     16  Host vendor specific log
0xa0-0xa7  GPL,SL  VS      16  Device vendor specific log
0xa8-0xb6  GPL,SL  VS       1  Device vendor specific log
0xb7       GPL,SL  VS      37  Device vendor specific log
0xbd       GPL,SL  VS       1  Device vendor specific log
0xc0       GPL,SL  VS       1  Device vendor specific log
0xc1       GPL     VS      93  Device vendor specific log
0xe0       GPL,SL  R/W      1  SCT Command/Status
0xe1       GPL,SL  R/W      1  SCT Data Transfer

SMART Extended Comprehensive Error Log Version: 1 (6 sectors)
Device Error Count: 42 (device log contains only the most recent 24 errors)
	CR     = Command Register
	FEATR  = Features Register
	COUNT  = Count (was: Sector Count) Register
	LBA_48 = Upper bytes of LBA High/Mid/Low Registers ]  ATA-8
	LH     = LBA High (was: Cylinder High) Register    ]   LBA
	LM     = LBA Mid (was: Cylinder Low) Register      ] Register
	LL     = LBA Low (was: Sector Number) Register     ]
	DV     = Device (was: Device/Head) Register
	DC     = Device Control Register
	ER     = Error register
	ST     = Status register
Powered_Up_Time is measured from power on, and printed as
DDd+hh:mm:SS.sss where DD=days, hh=hours, mm=minutes,
SS=sec, and sss=millisec. It "wraps" after 49.710 days.

Error 42 [17] occurred at disk power-on lifetime: 694 hours (28 days + 22 hours)
  When the command that caused the error occurred, the device was active or idle.

  After command completion occurred, registers were:
  ER -- ST COUNT  LBA_48  LH LM LL DV DC
  -- -- -- == -- == == == -- -- -- -- --
  04 -- 51 00 00 00 00 00 00 00 02 e0 00

  Commands leading to the command that caused the error were:
  CR FEATR COUNT  LBA_48  LH LM LL DV DC  Powered_Up_Time  Command/Feature_Name
  -- == -- == -- == == == -- -- -- -- --  ---------------  --------------------
  b4 00 20 00 00 00 00 46 72 4c 6b e0 00     00:14:00.184  SANITIZE DEVICE
  f5 00 00 00 00 00 00 00 00 00 00 e0 00     00:14:00.184  SECURITY FREEZE LOCK
  25 00 00 00 01 00 00 00 00 00 00 e0 00     00:13:51.661  READ DMA EXT
  25 00 00 00 20 00 00 3a 38 60 0f e0 00     00:13:51.659  READ DMA EXT
  25 00 00 00 20 00 00 00 00 00 02 e0 00     00:13:51.658  READ DMA EXT

Error 41 [16] occurred at disk power-on lifetime: 694 hours (28 days + 22 hours)
  When the command that caused the error occurred, the device was active or idle.

  After command completion occurred, registers were:
  ER -- ST COUNT  LBA_48  LH LM LL DV DC
  -- -- -- == -- == == == -- -- -- -- --
  04 -- 51 00 00 00 00 00 00 00 02 e0 00

  Commands leading to the command that caused the error were:
  CR FEATR COUNT  LBA_48  LH LM LL DV DC  Powered_Up_Time  Command/Feature_Name
  -- == -- == -- == == == -- -- -- -- --  ---------------  --------------------
  b4 00 20 00 00 00 00 46 72 4c 6b e0 00     00:00:36.664  SANITIZE DEVICE
  f5 00 00 00 00 00 00 00 00 00 00 e0 00     00:00:36.664  SECURITY FREEZE LOCK
  25 00 00 00 01 00 00 00 00 00 00 e0 00     00:00:10.913  READ DMA EXT
  25 00 00 00 20 00 00 3a 38 60 0f e0 00     00:00:10.912  READ DMA EXT
  25 00 00 00 20 00 00 00 00 00 02 e0 00     00:00:10.911  READ DMA EXT

Error 40 [15] occurred at disk power-on lifetime: 692 hours (28 days + 20 hours)
  When the command that caused the error occurred, the device was active or idle.

  After command completion occurred, registers were:
  ER -- ST COUNT  LBA_48  LH LM LL DV DC
  -- -- -- == -- == == == -- -- -- -- --
  04 -- 51 00 00 00 00 00 00 00 02 e0 00

  Commands leading to the command that caused the error were:
  CR FEATR COUNT  LBA_48  LH LM LL DV DC  Powered_Up_Time  Command/Feature_Name
  -- == -- == -- == == == -- -- -- -- --  ---------------  --------------------
  b4 00 20 00 00 00 00 46 72 4c 6b e0 00     00:01:29.939  SANITIZE DEVICE
  f5 00 00 00 00 00 00 00 00 00 00 e0 00     00:01:29.939  SECURITY FREEZE LOCK
  25 00 00 00 01 00 00 00 00 00 00 e0 00     00:00:11.045  READ DMA EXT
  25 00 00 00 20 00 00 3a 38 60 0f e0 00     00:00:11.044  READ DMA EXT
  25 00 00 00 20 00 00 00 00 00 02 e0 00     00:00:11.044  READ DMA EXT

Error 39 [14] occurred at disk power-on lifetime: 692 hours (28 days + 20 hours)
  When the command that caused the error occurred, the device was active or idle.

  After command completion occurred, registers were:
  ER -- ST COUNT  LBA_48  LH LM LL DV DC
  -- -- -- == -- == == == -- -- -- -- --
  04 -- 51 00 00 00 00 00 00 00 02 e0 00

  Commands leading to the command that caused the error were:
  CR FEATR COUNT  LBA_48  LH LM LL DV DC  Powered_Up_Time  Command/Feature_Name
  -- == -- == -- == == == -- -- -- -- --  ---------------  --------------------
  b4 00 20 00 00 00 00 46 72 4c 6b e0 00     00:00:39.229  SANITIZE DEVICE
  f5 00 00 00 00 00 00 00 00 00 00 e0 00     00:00:39.229  SECURITY FREEZE LOCK
  25 00 00 00 80 00 00 0e 0f 07 90 e0 00     00:00:10.873  READ DMA EXT
  25 00 00 00 40 00 00 0e 0f 00 20 e0 00     00:00:10.872  READ DMA EXT
  25 00 00 00 08 00 00 00 3b 00 88 e0 00     00:00:10.872  READ DMA EXT

Error 38 [13] occurred at disk power-on lifetime: 691 hours (28 days + 19 hours)
  When the command that caused the error occurred, the device was active or idle.

  After command completion occurred, registers were:
  ER -- ST COUNT  LBA_48  LH LM LL DV DC
  -- -- -- == -- == == == -- -- -- -- --
  04 -- 51 00 00 00 00 00 00 00 02 e0 00

  Commands leading to the command that caused the error were:
  CR FEATR COUNT  LBA_48  LH LM LL DV DC  Powered_Up_Time  Command/Feature_Name
  -- == -- == -- == == == -- -- -- -- --  ---------------  --------------------
  b4 00 20 00 00 00 00 46 72 4c 6b e0 00     00:09:10.771  SANITIZE DEVICE
  f5 00 00 00 00 00 00 00 00 00 00 e0 00     00:09:10.771  SECURITY FREEZE LOCK
  b0 00 d5 00 01 00 00 00 c2 4f 06 00 00     00:02:31.853  SMART READ LOG
  b0 00 d5 00 01 00 00 00 c2 4f 00 00 00     00:02:31.852  SMART READ LOG
  b0 00 d0 00 00 00 00 00 c2 4f 00 00 00     00:02:31.847  SMART READ DATA

Error 37 [12] occurred at disk power-on lifetime: 656 hours (27 days + 8 hours)
  When the command that caused the error occurred, the device was active or idle.

  After command completion occurred, registers were:
  ER -- ST COUNT  LBA_48  LH LM LL DV DC
  -- -- -- == -- == == == -- -- -- -- --
  04 -- 51 00 00 00 00 00 00 00 02 e0 00

  Commands leading to the command that caused the error were:
  CR FEATR COUNT  LBA_48  LH LM LL DV DC  Powered_Up_Time  Command/Feature_Name
  -- == -- == -- == == == -- -- -- -- --  ---------------  --------------------
  b4 00 20 00 00 00 00 46 72 4c 6b e0 00     00:01:49.427  SANITIZE DEVICE
  f5 00 00 00 00 00 00 00 00 00 00 e0 00     00:01:49.427  SECURITY FREEZE LOCK
  25 00 00 00 01 00 00 00 00 00 00 e0 00     00:00:11.129  READ DMA EXT
  25 00 00 00 01 00 00 00 00 00 21 e0 00     00:00:11.127  READ DMA EXT
  25 00 00 00 01 00 00 00 00 00 20 e0 00     00:00:11.127  READ DMA EXT

Error 36 [11] occurred at disk power-on lifetime: 28 hours (1 days + 4 hours)
  When the command that caused the error occurred, the device was active or idle.

  After command completion occurred, registers were:
  ER -- ST COUNT  LBA_48  LH LM LL DV DC
  -- -- -- == -- == == == -- -- -- -- --
  04 -- 51 00 00 00 00 00 00 00 02 e0 00

  Commands leading to the command that caused the error were:
  CR FEATR COUNT  LBA_48  LH LM LL DV DC  Powered_Up_Time  Command/Feature_Name
  -- == -- == -- == == == -- -- -- -- --  ---------------  --------------------
  b4 00 20 00 00 00 00 46 72 4c 6b e0 00     00:00:24.035  SANITIZE DEVICE
  f5 00 00 00 00 00 00 00 00 00 00 e0 00     00:00:24.034  SECURITY FREEZE LOCK
  25 00 00 00 01 00 00 00 00 00 00 e0 00     00:00:10.774  READ DMA EXT
  25 00 00 00 01 00 00 00 00 00 21 e0 00     00:00:10.772  READ DMA EXT
  25 00 00 00 01 00 00 00 00 00 20 e0 00     00:00:10.772  READ DMA EXT

Error 35 [10] occurred at disk power-on lifetime: 24 hours (1 days + 0 hours)
  When the command that caused the error occurred, the device was active or idle.

  After command completion occurred, registers were:
  ER -- ST COUNT  LBA_48  LH LM LL DV DC
  -- -- -- == -- == == == -- -- -- -- --
  04 -- 51 00 00 00 00 00 00 00 02 e0 00

  Commands leading to the command that caused the error were:
  CR FEATR COUNT  LBA_48  LH LM LL DV DC  Powered_Up_Time  Command/Feature_Name
  -- == -- == -- == == == -- -- -- -- --  ---------------  --------------------
  b4 00 20 00 00 00 00 46 72 4c 6b e0 00     00:00:23.638  SANITIZE DEVICE
  f5 00 00 00 00 00 00 00 00 00 00 e0 00     00:00:23.638  SECURITY FREEZE LOCK
  25 00 00 00 01 00 00 00 00 00 00 e0 00     00:00:10.133  READ DMA EXT
  25 00 00 00 20 00 00 3a 38 60 0f e0 00     00:00:10.132  READ DMA EXT
  25 00 00 00 20 00 00 00 00 00 02 e0 00     00:00:10.131  READ DMA EXT

SMART Extended Self-test Log Version: 1 (1 sectors)
Num  Test_Description    Status                  Remaining  LifeTime(hours)  LBA_of_first_error
# 1  Short offline       Completed without error       00%       691         -
# 2  Short offline       Completed without error       00%         1         -

SMART Selective self-test log data structure revision number 1
 SPAN  MIN_LBA  MAX_LBA  CURRENT_TEST_STATUS
    1        0        0  Not_testing
    2        0        0  Not_testing
    3        0        0  Not_testing
    4        0        0  Not_testing
    5        0        0  Not_testing
Selective self-test flags (0x0):
  After scanning selected spans, do NOT read-scan remainder of disk.
If Selective self-test is pending on power-up, resume after 0 minute delay.

SCT Status Version:                  3
SCT Version (vendor specific):       258 (0x0102)
Device State:                        Active (0)
Current Temperature:                    32 Celsius
Power Cycle Min/Max Temperature:     21/32 Celsius
Lifetime    Min/Max Temperature:     21/51 Celsius
Under/Over Temperature Limit Count:   0/0
Vendor specific:
01 00 00 00 00 00 00 00 00 00 00 00 00 00 00 00
00 00 00 00 00 00 00 00 00 00 00 00 00 00 00 00

SCT Temperature History Version:     2
Temperature Sampling Period:         1 minute
Temperature Logging Interval:        1 minute
Min/Max recommended Temperature:      0/60 Celsius
Min/Max Temperature Limit:           -41/85 Celsius
Temperature History Size (Index):    128 (58)

SCT Error Recovery Control:
           Read:     85 (8.5 seconds)
          Write:     85 (8.5 seconds)

Device Statistics (GP/SMART Log 0x04) not supported

Pending Defects log (GP Log 0x0c) not supported

SATA Phy Event Counters (GP Log 0x11)
ID      Size     Value  Description
0x0001  2            0  Command failed due to ICRC error
0x0002  2            0  R_ERR response for data FIS
0x0003  2            0  R_ERR response for device-to-host data FIS
0x0004  2            0  R_ERR response for host-to-device data FIS
0x0005  2            0  R_ERR response for non-data FIS
0x0006  2            0  R_ERR response for device-to-host non-data FIS
0x0007  2            0  R_ERR response for host-to-device non-data FIS
0x0008  2            0  Device-to-host non-data FIS retries
0x0009  2            3  Transition from drive PhyRdy to drive PhyNRdy
0x000a  2            4  Device-to-host register FISes sent due to a COMRESET
0x000b  2            0  CRC errors within host-to-device FIS
0x000f  2            0  R_ERR response for host-to-device data FIS, CRC
0x0012  2            0  R_ERR response for host-to-device non-data FIS, CRC
0x8000  4         1144  Vendor specific

