=== START OF INFORMATION SECTION ===
Model Family:     Hitachi Travelstar 5K250
Device Model:     HITACHI HTS542512K9SA00
Serial Number:    --
LU WWN Device Id: 5 000cca ...
Firmware Version: BB2ZC3HP
User Capacity:    120,034,123,776 bytes [120 GB]
Sector Size:      512 bytes logical/physical
Device is:        In smartctl database [for details use: -P show]
ATA Version is:   ATA8-ACS T13/1699-D revision 3f
SATA Version is:  SATA 2.5, 1.5 Gb/s
Local Time is:    Thu Oct 25 19:16:51 2018 +04
SMART support is: Available - device has SMART capability.
SMART support is: Enabled
AAM feature is:   Disabled
APM level is:     128 (minimum power consumption without standby)
Rd look-ahead is: Enabled
Write cache is:   Enabled
DSN feature is:   Unavailable
ATA Security is:  Disabled, frozen [SEC2]
Wt Cache Reorder: Enabled

=== START OF READ SMART DATA SECTION ===
SMART overall-health self-assessment test result: PASSED

General SMART Values:
Offline data collection status:  (0x82)	Offline data collection activity
					was completed without error.
					Auto Offline Data Collection: Enabled.
Self-test execution status:      (   0)	The previous self-test routine completed
					without error or no self-test has ever 
					been run.
Total time to complete Offline 
data collection: 		(  645) seconds.
Offline data collection
capabilities: 			 (0x5b) SMART execute Offline immediate.
					Auto Offline data collection on/off support.
					Suspend Offline collection upon new
					command.
					Offline surface scan supported.
					Self-test supported.
					No Conveyance Self-test supported.
					Selective Self-test supported.
SMART capabilities:            (0x0003)	Saves SMART data before entering
					power-saving mode.
					Supports SMART auto save timer.
Error logging capability:        (0x01)	Error logging supported.
					General Purpose Logging supported.
Short self-test routine 
recommended polling time: 	 (   2) minutes.
Extended self-test routine
recommended polling time: 	 (  56) minutes.
SCT capabilities: 	       (0x003d)	SCT Status supported.
					SCT Error Recovery Control supported.
					SCT Feature Control supported.
					SCT Data Table supported.

SMART Attributes Data Structure revision number: 16
Vendor Specific SMART Attributes with Thresholds:
ID# ATTRIBUTE_NAME          FLAGS    VALUE WORST THRESH FAIL RAW_VALUE
  1 Raw_Read_Error_Rate     PO-R--   100   100   062    -    0
  2 Throughput_Performance  P-S---   111   111   040    -    4272
  3 Spin_Up_Time            POS---   253   253   033    -    0
  4 Start_Stop_Count        -O--C-   098   098   000    -    4344
  5 Reallocated_Sector_Ct   PO--CK   100   100   005    -    0
  7 Seek_Error_Rate         PO-R--   100   100   067    -    0
  8 Seek_Time_Performance   P-S---   126   126   040    -    37
  9 Power_On_Hours          -O--C-   065   065   000    -    15547
 10 Spin_Retry_Count        PO--C-   100   100   060    -    0
 12 Power_Cycle_Count       -O--CK   098   098   000    -    4025
191 G-Sense_Error_Rate      -O-R--   100   100   000    -    0
192 Power-Off_Retract_Count -O--CK   099   099   000    -    38469844
193 Load_Cycle_Count        -O--C-   058   058   000    -    427538
194 Temperature_Celsius     -O----   183   183   000    -    30 (Min/Max 8/51)
196 Reallocated_Event_Count -O--CK   100   100   000    -    1
197 Current_Pending_Sector  -O---K   100   100   000    -    0
198 Offline_Uncorrectable   ---R--   100   100   000    -    0
199 UDMA_CRC_Error_Count    -O-R--   200   200   000    -    0
223 Load_Retry_Count        -O-R--   100   100   000    -    0
                            ||||||_ K auto-keep
                            |||||__ C event count
                            ||||___ R error rate
                            |||____ S speed/performance
                            ||_____ O updated online
                            |______ P prefailure warning

General Purpose Log Directory Version 1
SMART           Log Directory Version 1 [multi-sector log support]
Address    Access  R/W   Size  Description
0x00       GPL,SL  R/O      1  Log Directory
0x01           SL  R/O      1  Summary SMART error log
0x02           SL  R/O      1  Comprehensive SMART error log
0x03       GPL     R/O      1  Ext. Comprehensive SMART error log
0x06           SL  R/O      1  SMART self-test log
0x07       GPL     R/O      1  Extended self-test log
0x09           SL  R/W      1  Selective self-test log
0x10       GPL     R/O      1  NCQ Command Error log
0x11       GPL     R/O      1  SATA Phy Event Counters log
0x80-0x9f  GPL,SL  R/W     16  Host vendor specific log

SMART Extended Comprehensive Error Log Version: 1 (1 sectors)
Device Error Count: 16 (device log contains only the most recent 4 errors)
	CR     = Command Register
	FEATR  = Features Register
	COUNT  = Count (was: Sector Count) Register
	LBA_48 = Upper bytes of LBA High/Mid/Low Registers ]  ATA-8
	LH     = LBA High (was: Cylinder High) Register    ]   LBA
	LM     = LBA Mid (was: Cylinder Low) Register      ] Register
	LL     = LBA Low (was: Sector Number) Register     ]
	DV     = Device (was: Device/Head) Register
	DC     = Device Control Register
	ER     = Error register
	ST     = Status register
Powered_Up_Time is measured from power on, and printed as
DDd+hh:mm:SS.sss where DD=days, hh=hours, mm=minutes,
SS=sec, and sss=millisec. It "wraps" after 49.710 days.

Error 16 [3] occurred at disk power-on lifetime: 1 hours (0 days + 1 hours)
  When the command that caused the error occurred, the device was active or idle.

  After command completion occurred, registers were:
  ER -- ST COUNT  LBA_48  LH LM LL DV DC
  -- -- -- == -- == == == -- -- -- -- --
  10 -- 51 00 01 00 00 0d f9 6f 1f e0 00  Error: IDNF at LBA = 0x0df96f1f = 234450719

  Commands leading to the command that caused the error were:
  CR FEATR COUNT  LBA_48  LH LM LL DV DC  Powered_Up_Time  Command/Feature_Name
  -- == -- == -- == == == -- -- -- -- --  ---------------  --------------------
  24 ff ff 00 01 00 00 0d f9 6f 1f e0 00     00:12:18.800  READ SECTOR(S) EXT
  25 ff ff 00 01 00 00 0d f9 6f 1f e0 00     00:12:18.700  READ DMA EXT
  34 ff ff 00 01 00 00 00 00 00 00 e0 00     00:12:18.600  WRITE SECTORS(S) EXT
  25 ff ff 00 01 00 00 00 00 00 00 e0 00     00:12:18.600  READ DMA EXT
  25 ff ff 00 01 00 00 00 00 3b 10 e0 00     00:12:18.600  READ DMA EXT

Error 15 [2] occurred at disk power-on lifetime: 1 hours (0 days + 1 hours)
  When the command that caused the error occurred, the device was active or idle.

  After command completion occurred, registers were:
  ER -- ST COUNT  LBA_48  LH LM LL DV DC
  -- -- -- == -- == == == -- -- -- -- --
  10 -- 51 00 01 00 00 0d f9 6f 1f e0 00  Error: IDNF 1 sectors at LBA = 0x0df96f1f = 234450719

  Commands leading to the command that caused the error were:
  CR FEATR COUNT  LBA_48  LH LM LL DV DC  Powered_Up_Time  Command/Feature_Name
  -- == -- == -- == == == -- -- -- -- --  ---------------  --------------------
  25 ff ff 00 01 00 00 0d f9 6f 1f e0 00     00:12:18.700  READ DMA EXT
  34 ff ff 00 01 00 00 00 00 00 00 e0 00     00:12:18.600  WRITE SECTORS(S) EXT
  25 ff ff 00 01 00 00 00 00 00 00 e0 00     00:12:18.600  READ DMA EXT
  25 ff ff 00 01 00 00 00 00 3b 10 e0 00     00:12:18.600  READ DMA EXT
  25 ff ff 00 01 00 00 00 00 00 3f e0 00     00:12:18.600  READ DMA EXT

Error 14 [1] occurred at disk power-on lifetime: 1 hours (0 days + 1 hours)
  When the command that caused the error occurred, the device was active or idle.

  After command completion occurred, registers were:
  ER -- ST COUNT  LBA_48  LH LM LL DV DC
  -- -- -- == -- == == == -- -- -- -- --
  10 -- 51 00 01 00 00 0d f9 6f 1f e0 00  Error: IDNF at LBA = 0x0df96f1f = 234450719

  Commands leading to the command that caused the error were:
  CR FEATR COUNT  LBA_48  LH LM LL DV DC  Powered_Up_Time  Command/Feature_Name
  -- == -- == -- == == == -- -- -- -- --  ---------------  --------------------
  24 ff ff 00 01 00 00 0d f9 6f 1f e0 00     00:12:18.500  READ SECTOR(S) EXT
  25 ff ff 00 01 00 00 0d f9 6f 1f e0 00     00:12:18.400  READ DMA EXT
  34 ff ff 00 01 00 00 00 00 00 00 e0 00     00:12:17.900  WRITE SECTORS(S) EXT
  35 ff ff 00 01 00 00 00 00 3b 1f e0 00     00:12:17.900  WRITE DMA EXT
  35 ff ff 00 01 00 00 00 00 3b 1e e0 00     00:12:17.900  WRITE DMA EXT

Error 13 [0] occurred at disk power-on lifetime: 1 hours (0 days + 1 hours)
  When the command that caused the error occurred, the device was active or idle.

  After command completion occurred, registers were:
  ER -- ST COUNT  LBA_48  LH LM LL DV DC
  -- -- -- == -- == == == -- -- -- -- --
  10 -- 51 00 01 00 00 0d f9 6f 1f e0 00  Error: IDNF 1 sectors at LBA = 0x0df96f1f = 234450719

  Commands leading to the command that caused the error were:
  CR FEATR COUNT  LBA_48  LH LM LL DV DC  Powered_Up_Time  Command/Feature_Name
  -- == -- == -- == == == -- -- -- -- --  ---------------  --------------------
  25 ff ff 00 01 00 00 0d f9 6f 1f e0 00     00:12:18.400  READ DMA EXT
  34 ff ff 00 01 00 00 00 00 00 00 e0 00     00:12:17.900  WRITE SECTORS(S) EXT
  35 ff ff 00 01 00 00 00 00 3b 1f e0 00     00:12:17.900  WRITE DMA EXT
  35 ff ff 00 01 00 00 00 00 3b 1e e0 00     00:12:17.900  WRITE DMA EXT
  35 ff ff 00 01 00 00 00 00 3b 1d e0 00     00:12:17.900  WRITE DMA EXT

SMART Extended Self-test Log Version: 1 (1 sectors)
Num  Test_Description    Status                  Remaining  LifeTime(hours)  LBA_of_first_error
# 1  Offline             Completed without error       00%         0         -
# 2  Vendor (0x6b)       Fatal or unknown error        120%         0         0
# 3  Offline             Completed without error       00%         0         -
# 4  Offline             Completed without error       00%         0         -
# 5  Offline             Completed without error       00%         0         -
# 6  Offline             Completed without error       00%         0         -
# 7  Offline             Completed without error       00%         0         -
# 8  Offline             Completed without error       00%         0         -
# 9  Vendor (0xc0)       Fatal or unknown error        110%         0         0
#10  Extended offline    Completed without error       00%     15291         -
#11  Offline             Completed without error       00%         2         -
#12  Offline             Completed without error       00%         0         -
#13  Offline             Completed without error       00%         0         -
#14  Offline             Completed without error       00%         0         -
#15  Offline             Completed without error       00%         0         -
#16  Offline             Completed without error       00%         0         -
#17  Offline             Completed without error       00%         0         -
#18  Offline             Completed without error       00%         0         -
#19  Offline             Completed without error       00%         0         -

SMART Selective self-test log data structure revision number 1
 SPAN  MIN_LBA  MAX_LBA  CURRENT_TEST_STATUS
    1        0        0  Not_testing
    2        0        0  Not_testing
    3        0        0  Not_testing
    4        0        0  Not_testing
    5        0        0  Not_testing
Selective self-test flags (0x0):
  After scanning selected spans, do NOT read-scan remainder of disk.
If Selective self-test is pending on power-up, resume after 0 minute delay.

SCT Status Version:                  3
SCT Version (vendor specific):       256 (0x0100)
SCT Support Level:                   1
Device State:                        Active (0)
Current Temperature:                    30 Celsius
Power Cycle Min/Max Temperature:     25/30 Celsius
Lifetime    Min/Max Temperature:      8/51 Celsius
Lifetime    Average Temperature:        37 Celsius
Under/Over Temperature Limit Count:   0/0

Unexpected SCT status 0x0000 (action_code=5, function_code=0)
Read SCT Temperature History failed

SCT Error Recovery Control:
           Read: Disabled
          Write: Disabled

Device Statistics (GP/SMART Log 0x04) not supported

Pending Defects log (GP Log 0x0c) not supported

SATA Phy Event Counters (GP Log 0x11)
ID      Size     Value  Description
0x0001  2            0  Command failed due to ICRC error
0x0009  2            2  Transition from drive PhyRdy to drive PhyNRdy
0x000a  2            1  Device-to-host register FISes sent due to a COMRESET
0x000b  2            0  CRC errors within host-to-device FIS
0x000d  2            0  Non-CRC errors within host-to-device FIS



