smartctl 7.2 2020-12-30 r5155 [x86_64-linux-5.16.13-desktop-1omv4003] (OpenMandriva Lx 7.2-2)
Copyright (C) 2002-20, Bruce Allen, Christian Franke, www.smartmontools.org

=== START OF INFORMATION SECTION ===
Model Family:     SAMSUNG SpinPoint F1 DT
Device Model:     SAMSUNG HD252HJ
Serial Number:    --
LU WWN Device Id: 5 0024e9 ...
Firmware Version: 1AC01118
User Capacity:    250,059,350,016 bytes [250 GB]
Sector Size:      512 bytes logical/physical
Device is:        In smartctl database [for details use: -P show]
ATA Version is:   ATA/ATAPI-7, ATA8-ACS T13/1699-D revision 3b
Local Time is:    Sat May 13 11:32:59 2023 EEST
SMART support is: Available - device has SMART capability.
SMART support is: Enabled
AAM feature is:   Disabled
APM feature is:   Disabled
Rd look-ahead is: Enabled
Write cache is:   Enabled
DSN feature is:   Unavailable
ATA Security is:  Disabled, frozen [SEC2]
Wt Cache Reorder: Enabled

=== START OF READ SMART DATA SECTION ===
SMART overall-health self-assessment test result: PASSED
See vendor-specific Attribute list for marginal Attributes.

General SMART Values:
Offline data collection status:  (0x00)	Offline data collection activity
					was never started.
					Auto Offline Data Collection: Disabled.
Self-test execution status:      (   0)	The previous self-test routine completed
					without error or no self-test has ever 
					been run.
Total time to complete Offline 
data collection: 		( 3534) seconds.
Offline data collection
capabilities: 			 (0x7b) SMART execute Offline immediate.
					Auto Offline data collection on/off support.
					Suspend Offline collection upon new
					command.
					Offline surface scan supported.
					Self-test supported.
					Conveyance Self-test supported.
					Selective Self-test supported.
SMART capabilities:            (0x0003)	Saves SMART data before entering
					power-saving mode.
					Supports SMART auto save timer.
Error logging capability:        (0x01)	Error logging supported.
					General Purpose Logging supported.
Short self-test routine 
recommended polling time: 	 (   2) minutes.
Extended self-test routine
recommended polling time: 	 (  60) minutes.
Conveyance self-test routine
recommended polling time: 	 (   7) minutes.
SCT capabilities: 	       (0x003f)	SCT Status supported.
					SCT Error Recovery Control supported.
					SCT Feature Control supported.
					SCT Data Table supported.

SMART Attributes Data Structure revision number: 16
Vendor Specific SMART Attributes with Thresholds:
ID# ATTRIBUTE_NAME          FLAGS    VALUE WORST THRESH FAIL RAW_VALUE
  1 Raw_Read_Error_Rate     POSR--   099   042   051    Past 10630
  3 Spin_Up_Time            POS---   092   092   011    -    3290
  4 Start_Stop_Count        -O--CK   095   095   000    -    5307
  5 Reallocated_Sector_Ct   PO--CK   100   100   010    -    0
  7 Seek_Error_Rate         POSR--   100   100   051    -    0
  8 Seek_Time_Performance   P-S--K   100   100   015    -    0
  9 Power_On_Hours          -O--CK   097   097   000    -    12749
 10 Spin_Retry_Count        PO--CK   100   100   051    -    1
 11 Calibration_Retry_Count -O--C-   100   100   000    -    0
 12 Power_Cycle_Count       -O--CK   095   095   000    -    4647
 13 Read_Soft_Error_Rate    -OSR--   099   042   000    -    10630
183 Runtime_Bad_Block       -O--CK   100   100   000    -    0
184 End-to-End_Error        PO--CK   100   100   000    -    0
187 Reported_Uncorrect      -O--CK   100   100   000    -    21007
188 Command_Timeout         -O--CK   100   100   000    -    0
190 Airflow_Temperature_Cel -O---K   086   054   000    -    14 (Min/Max 14/14)
194 Temperature_Celsius     -O---K   083   049   000    -    17 (Min/Max 14/17)
195 Hardware_ECC_Recovered  -O-RC-   100   100   000    -    3907
196 Reallocated_Event_Count -O--CK   100   100   000    -    0
197 Current_Pending_Sector  -O--C-   100   100   000    -    1
198 Offline_Uncorrectable   ----CK   100   100   000    -    0
199 UDMA_CRC_Error_Count    -OSRCK   100   100   000    -    255
200 Multi_Zone_Error_Rate   -O-R--   100   099   000    -    27
201 Soft_Read_Error_Rate    -O-R--   253   253   000    -    0
                            ||||||_ K auto-keep
                            |||||__ C event count
                            ||||___ R error rate
                            |||____ S speed/performance
                            ||_____ O updated online
                            |______ P prefailure warning

General Purpose Log Directory Version 1
SMART           Log Directory Version 1 [multi-sector log support]
Address    Access  R/W   Size  Description
0x00       GPL,SL  R/O      1  Log Directory
0x01           SL  R/O      1  Summary SMART error log
0x02           SL  R/O      2  Comprehensive SMART error log
0x03       GPL     R/O      2  Ext. Comprehensive SMART error log
0x04       GPL     R/O      2  Device Statistics log
0x06           SL  R/O      1  SMART self-test log
0x07       GPL     R/O      2  Extended self-test log
0x09           SL  R/W      1  Selective self-test log
0x10       GPL     R/O      1  NCQ Command Error log
0x11       GPL     R/O      1  SATA Phy Event Counters log
0x20       GPL     R/O      2  Streaming performance log [OBS-8]
0x21       GPL     R/O      1  Write stream error log
0x22       GPL     R/O      1  Read stream error log
0x80-0x9f  GPL,SL  R/W     16  Host vendor specific log
0xe0       GPL,SL  R/W      1  SCT Command/Status
0xe1       GPL,SL  R/W      1  SCT Data Transfer

SMART Extended Comprehensive Error Log Version: 1 (2 sectors)
Device Error Count: 10738 (device log contains only the most recent 8 errors)
	CR     = Command Register
	FEATR  = Features Register
	COUNT  = Count (was: Sector Count) Register
	LBA_48 = Upper bytes of LBA High/Mid/Low Registers ]  ATA-8
	LH     = LBA High (was: Cylinder High) Register    ]   LBA
	LM     = LBA Mid (was: Cylinder Low) Register      ] Register
	LL     = LBA Low (was: Sector Number) Register     ]
	DV     = Device (was: Device/Head) Register
	DC     = Device Control Register
	ER     = Error register
	ST     = Status register
Powered_Up_Time is measured from power on, and printed as
DDd+hh:mm:SS.sss where DD=days, hh=hours, mm=minutes,
SS=sec, and sss=millisec. It "wraps" after 49.710 days.

Error 10738 [1] occurred at disk power-on lifetime: 12305 hours (512 days + 17 hours)
  When the command that caused the error occurred, the device was active or idle.

  After command completion occurred, registers were:
  ER -- ST COUNT  LBA_48  LH LM LL DV DC
  -- -- -- == -- == == == -- -- -- -- --
  40 -- 51 00 00 00 00 02 70 7c b6 e0 00  Error: UNC at LBA = 0x02707cb6 = 40926390

  Commands leading to the command that caused the error were:
  CR FEATR COUNT  LBA_48  LH LM LL DV DC  Powered_Up_Time  Command/Feature_Name
  -- == -- == -- == == == -- -- -- -- --  ---------------  --------------------
  25 00 00 00 08 00 00 02 70 7c b0 e0 00     00:38:20.110  READ DMA EXT
  35 00 00 00 5e 00 00 01 c6 20 9c e0 00     00:38:20.110  WRITE DMA EXT
  35 00 00 00 ed 00 00 01 c6 1f 9b e0 00     00:38:20.110  WRITE DMA EXT
  35 00 00 00 f0 00 00 01 c6 1e 99 e0 00     00:38:20.110  WRITE DMA EXT
  35 00 00 00 f0 00 00 01 c6 1d 98 e0 00     00:38:20.110  WRITE DMA EXT

Error 10737 [0] occurred at disk power-on lifetime: 12305 hours (512 days + 17 hours)
  When the command that caused the error occurred, the device was active or idle.

  After command completion occurred, registers were:
  ER -- ST COUNT  LBA_48  LH LM LL DV DC
  -- -- -- == -- == == == -- -- -- -- --
  40 -- 51 00 00 00 00 02 70 7c b6 e0 00  Error: UNC at LBA = 0x02707cb6 = 40926390

  Commands leading to the command that caused the error were:
  CR FEATR COUNT  LBA_48  LH LM LL DV DC  Powered_Up_Time  Command/Feature_Name
  -- == -- == -- == == == -- -- -- -- --  ---------------  --------------------
  25 00 00 00 08 00 00 02 70 7c b0 e0 00     00:38:18.030  READ DMA EXT
  35 00 00 00 01 00 00 00 f4 59 b7 e0 00     00:38:18.030  WRITE DMA EXT
  35 00 00 00 86 00 00 00 68 c5 c3 e0 00     00:38:18.030  WRITE DMA EXT
  35 00 00 00 f0 00 00 00 68 c4 c0 e0 00     00:38:18.030  WRITE DMA EXT
  35 00 00 00 f0 00 00 00 68 c3 c1 e0 00     00:38:18.030  WRITE DMA EXT

Error 10736 [7] occurred at disk power-on lifetime: 12305 hours (512 days + 17 hours)
  When the command that caused the error occurred, the device was active or idle.

  After command completion occurred, registers were:
  ER -- ST COUNT  LBA_48  LH LM LL DV DC
  -- -- -- == -- == == == -- -- -- -- --
  40 -- 51 00 00 00 00 02 70 7c b6 e0 00  Error: UNC at LBA = 0x02707cb6 = 40926390

  Commands leading to the command that caused the error were:
  CR FEATR COUNT  LBA_48  LH LM LL DV DC  Powered_Up_Time  Command/Feature_Name
  -- == -- == -- == == == -- -- -- -- --  ---------------  --------------------
  25 00 00 00 08 00 00 02 70 7c b0 e0 00     00:38:16.010  READ DMA EXT
  35 00 00 00 01 00 00 01 30 7b bf e0 00     00:38:16.010  WRITE DMA EXT
  35 00 00 00 01 00 00 00 f4 59 af e0 00     00:38:16.010  WRITE DMA EXT
  25 00 00 00 39 00 00 00 44 4a c8 e0 00     00:38:15.990  READ DMA EXT
  25 00 00 00 40 00 00 04 19 2f b2 e0 00     00:38:15.980  READ DMA EXT

Error 10735 [6] occurred at disk power-on lifetime: 12305 hours (512 days + 17 hours)
  When the command that caused the error occurred, the device was active or idle.

  After command completion occurred, registers were:
  ER -- ST COUNT  LBA_48  LH LM LL DV DC
  -- -- -- == -- == == == -- -- -- -- --
  40 -- 51 00 00 00 00 02 70 7c b6 e0 00  Error: UNC at LBA = 0x02707cb6 = 40926390

  Commands leading to the command that caused the error were:
  CR FEATR COUNT  LBA_48  LH LM LL DV DC  Powered_Up_Time  Command/Feature_Name
  -- == -- == -- == == == -- -- -- -- --  ---------------  --------------------
  25 00 00 00 08 00 00 02 70 7c b0 e0 00     00:38:14.000  READ DMA EXT
  35 00 00 00 01 00 00 00 f4 59 af e0 00     00:38:14.000  WRITE DMA EXT
  35 00 00 00 01 00 00 00 6b a8 cf e0 00     00:38:14.000  WRITE DMA EXT
  35 00 00 00 01 00 00 00 6a e5 c7 e0 00     00:38:14.000  WRITE DMA EXT
  25 00 00 00 40 00 00 00 44 4a 88 e0 00     00:38:13.990  READ DMA EXT

Error 10734 [5] occurred at disk power-on lifetime: 12305 hours (512 days + 17 hours)
  When the command that caused the error occurred, the device was active or idle.

  After command completion occurred, registers were:
  ER -- ST COUNT  LBA_48  LH LM LL DV DC
  -- -- -- == -- == == == -- -- -- -- --
  40 -- 51 00 00 00 00 02 70 7c b6 e0 00  Error: UNC at LBA = 0x02707cb6 = 40926390

  Commands leading to the command that caused the error were:
  CR FEATR COUNT  LBA_48  LH LM LL DV DC  Powered_Up_Time  Command/Feature_Name
  -- == -- == -- == == == -- -- -- -- --  ---------------  --------------------
  25 00 00 00 08 00 00 02 70 7c b0 e0 00     00:38:11.790  READ DMA EXT
  35 00 00 00 01 00 00 01 30 7b b7 e0 00     00:38:11.790  WRITE DMA EXT
  35 00 00 00 01 00 00 00 6b 9b 4f e0 00     00:38:11.790  WRITE DMA EXT
  35 00 00 00 1d 00 00 00 6a e5 74 e0 00     00:38:11.790  WRITE DMA EXT
  35 00 00 00 d6 00 00 00 3b 2e 95 e0 00     00:38:11.790  WRITE DMA EXT

Error 10733 [4] occurred at disk power-on lifetime: 12305 hours (512 days + 17 hours)
  When the command that caused the error occurred, the device was active or idle.

  After command completion occurred, registers were:
  ER -- ST COUNT  LBA_48  LH LM LL DV DC
  -- -- -- == -- == == == -- -- -- -- --
  40 -- 51 00 00 00 00 02 70 7c b6 e0 00  Error: UNC at LBA = 0x02707cb6 = 40926390

  Commands leading to the command that caused the error were:
  CR FEATR COUNT  LBA_48  LH LM LL DV DC  Powered_Up_Time  Command/Feature_Name
  -- == -- == -- == == == -- -- -- -- --  ---------------  --------------------
  25 00 00 00 08 00 00 02 70 7c b0 e0 00     00:30:40.540  READ DMA EXT
  35 00 00 00 98 00 00 00 67 c2 28 e0 00     00:30:40.540  WRITE DMA EXT
  35 00 00 00 ef 00 00 00 67 c1 29 e0 00     00:30:40.540  WRITE DMA EXT
  35 00 00 00 f0 00 00 00 67 c0 29 e0 00     00:30:40.540  WRITE DMA EXT
  35 00 00 00 f0 00 00 00 67 bf 28 e0 00     00:30:40.540  WRITE DMA EXT

Error 10732 [3] occurred at disk power-on lifetime: 12305 hours (512 days + 17 hours)
  When the command that caused the error occurred, the device was active or idle.

  After command completion occurred, registers were:
  ER -- ST COUNT  LBA_48  LH LM LL DV DC
  -- -- -- == -- == == == -- -- -- -- --
  40 -- 51 00 00 00 00 02 70 7c b6 e0 00  Error: UNC at LBA = 0x02707cb6 = 40926390

  Commands leading to the command that caused the error were:
  CR FEATR COUNT  LBA_48  LH LM LL DV DC  Powered_Up_Time  Command/Feature_Name
  -- == -- == -- == == == -- -- -- -- --  ---------------  --------------------
  25 00 00 00 08 00 00 02 70 7c b0 e0 00     00:30:38.520  READ DMA EXT
  35 00 00 00 01 00 00 01 04 e6 76 e0 00     00:30:38.520  WRITE DMA EXT
  35 00 00 00 ee 00 00 01 04 e5 5a e0 00     00:30:38.520  WRITE DMA EXT
  35 00 00 00 ef 00 00 01 04 e4 5a e0 00     00:30:38.520  WRITE DMA EXT
  35 00 00 00 ea 00 00 01 04 e3 5e e0 00     00:30:38.520  WRITE DMA EXT

Error 10731 [2] occurred at disk power-on lifetime: 12305 hours (512 days + 17 hours)
  When the command that caused the error occurred, the device was active or idle.

  After command completion occurred, registers were:
  ER -- ST COUNT  LBA_48  LH LM LL DV DC
  -- -- -- == -- == == == -- -- -- -- --
  40 -- 51 00 00 00 00 02 70 7c b6 e0 00  Error: UNC at LBA = 0x02707cb6 = 40926390

  Commands leading to the command that caused the error were:
  CR FEATR COUNT  LBA_48  LH LM LL DV DC  Powered_Up_Time  Command/Feature_Name
  -- == -- == -- == == == -- -- -- -- --  ---------------  --------------------
  25 00 00 00 08 00 00 02 70 7c b0 e0 00     00:30:36.450  READ DMA EXT
  35 00 00 00 5c 00 00 01 3c 85 f8 e0 00     00:30:36.450  WRITE DMA EXT
  35 00 00 00 ef 00 00 01 3c 84 f9 e0 00     00:30:36.450  WRITE DMA EXT
  35 00 00 00 f0 00 00 01 3c 83 f8 e0 00     00:30:36.450  WRITE DMA EXT
  35 00 00 00 f0 00 00 01 3c 82 f9 e0 00     00:30:36.450  WRITE DMA EXT

SMART Extended Self-test Log Version: 1 (2 sectors)
No self-tests have been logged.  [To run self-tests, use: smartctl -t]

SMART Selective self-test log data structure revision number 1
 SPAN  MIN_LBA  MAX_LBA  CURRENT_TEST_STATUS
    1        0        0  Not_testing
    2        0        0  Not_testing
    3        0        0  Not_testing
    4        0        0  Not_testing
    5        0        0  Not_testing
Selective self-test flags (0x0):
  After scanning selected spans, do NOT read-scan remainder of disk.
If Selective self-test is pending on power-up, resume after 0 minute delay.

SCT Status Version:                  2
SCT Version (vendor specific):       256 (0x0100)
Device State:                        Active (0)
Current Temperature:                    17 Celsius
Power Cycle Min/Max Temperature:     --/17 Celsius
Lifetime    Min/Max Temperature:     --/51 Celsius

SCT Temperature History Version:     2
Temperature Sampling Period:         1 minute
Temperature Logging Interval:        1 minute
Min/Max recommended Temperature:     -4/72 Celsius
Min/Max Temperature Limit:           -9/77 Celsius
Temperature History Size (Index):    128 (112)

SCT Error Recovery Control:
           Read: Disabled
          Write: Disabled

ATA_READ_LOG_EXT (addr=0x04:0x00, page=0, n=1) failed: scsi error badly formed scsi parameters
Read Device Statistics page 0x00 failed

Pending Defects log (GP Log 0x0c) not supported

SATA Phy Event Counters (GP Log 0x11)
ID      Size     Value  Description
0x000a  2            4  Device-to-host register FISes sent due to a COMRESET
0x0001  2            0  Command failed due to ICRC error
0x0002  2            0  R_ERR response for data FIS
0x0003  2            0  R_ERR response for device-to-host data FIS
0x0004  2            0  R_ERR response for host-to-device data FIS
0x0005  2            0  R_ERR response for non-data FIS
0x0006  2            0  R_ERR response for device-to-host non-data FIS
0x0007  2            0  R_ERR response for host-to-device non-data FIS
0x0008  2            0  Device-to-host non-data FIS retries
0x0009  2            4  Transition from drive PhyRdy to drive PhyNRdy
0x000b  2            0  CRC errors within host-to-device FIS
0x000d  2            0  Non-CRC errors within host-to-device FIS
0x000f  2            0  R_ERR response for host-to-device data FIS, CRC
0x0010  2            0  R_ERR response for host-to-device data FIS, non-CRC
0x0012  2            0  R_ERR response for host-to-device non-data FIS, CRC
0x0013  2            0  R_ERR response for host-to-device non-data FIS, non-CRC



