smartctl 7.3 2022-02-28 r5338 [x86_64-linux-5.19.16-201.fsync.fc36.x86_64] (local build)
Copyright (C) 2002-22, Bruce Allen, Christian Franke, www.smartmontools.org

=== START OF INFORMATION SECTION ===
Model Number:                       Lexar SSD NM620 512GB
Serial Number:                      --
Firmware Version:                   V1.23
PCI Vendor/Subsystem ID:            0x1d97
IEEE OUI Identifier:                0xcaf25b
Total NVM Capacity:                 512,110,190,592 [512 GB]
Unallocated NVM Capacity:           0
Controller ID:                      0
NVMe Version:                       1.4
Number of Namespaces:               1
Namespace 1 Size/Capacity:          512,110,190,592 [512 GB]
Namespace 1 Formatted LBA Size:     512
Namespace 1 IEEE EUI-64:            caf25b ...
Local Time is:                      Tue Oct 25 13:23:07 2022 CEST
Firmware Updates (0x02):            1 Slot
Optional Admin Commands (0x0017):   Security Format Frmw_DL Self_Test
Optional NVM Commands (0x005c):     DS_Mngmt Wr_Zero Sav/Sel_Feat Timestmp
Log Page Attributes (0x0a):         Cmd_Eff_Lg Telmtry_Lg
Maximum Data Transfer Size:         32 Pages
Warning  Comp. Temp. Threshold:     81 Celsius
Critical Comp. Temp. Threshold:     85 Celsius

Supported Power States
St Op     Max   Active     Idle   RL RT WL WT  Ent_Lat  Ex_Lat
 0 +     5.00W       -        -    0  0  0  0        5     700

Supported LBA Sizes (NSID 0x1)
Id Fmt  Data  Metadt  Rel_Perf
 0 +     512       0         3

=== START OF SMART DATA SECTION ===
SMART overall-health self-assessment test result: PASSED

SMART/Health Information (NVMe Log 0x02)
Critical Warning:                   0x00
Temperature:                        33 Celsius
Available Spare:                    100%
Available Spare Threshold:          10%
Percentage Used:                    0%
Data Units Read:                    1,867,157 [955 GB]
Data Units Written:                 1,673,139 [856 GB]
Host Read Commands:                 13,147,562
Host Write Commands:                17,218,894
Controller Busy Time:               27
Power Cycles:                       54
Power On Hours:                     121
Unsafe Shutdowns:                   17
Media and Data Integrity Errors:    0
Error Information Log Entries:      0
Warning  Comp. Temperature Time:    0
Critical Comp. Temperature Time:    0

Read 16 entries from Error Information Log failed: NVMe Status 0x13



