=== START OF INFORMATION SECTION ===
Model Family:     Seagate Maxtor DiamondMax 21
Device Model:     MAXTOR STM3320820AS
Serial Number:    --
Firmware Version: 3.AAE
User Capacity:    320,072,933,376 bytes [320 GB]
Sector Size:      512 bytes logical/physical
Device is:        In smartctl database [for details use: -P show]
ATA Version is:   ATA/ATAPI-7 (minor revision not indicated)
Local Time is:    Fri Jun 14 18:45:51 2019 +04
SMART support is: Available - device has SMART capability.
SMART support is: Enabled
AAM feature is:   Unavailable
APM feature is:   Unavailable
Rd look-ahead is: Enabled
Write cache is:   Enabled
DSN feature is:   Unavailable
ATA Security is:  Disabled, frozen [SEC2]
Wt Cache Reorder: Unavailable

=== START OF READ SMART DATA SECTION ===
SMART overall-health self-assessment test result: PASSED
See vendor-specific Attribute list for marginal Attributes.

General SMART Values:
Offline data collection status:  (0x82)	Offline data collection activity
					was completed without error.
					Auto Offline Data Collection: Enabled.
Self-test execution status:      (  41)	The self-test routine was interrupted
					by the host with a hard or soft reset.
Total time to complete Offline 
data collection: 		(  430) seconds.
Offline data collection
capabilities: 			 (0x5b) SMART execute Offline immediate.
					Auto Offline data collection on/off support.
					Suspend Offline collection upon new
					command.
					Offline surface scan supported.
					Self-test supported.
					No Conveyance Self-test supported.
					Selective Self-test supported.
SMART capabilities:            (0x0003)	Saves SMART data before entering
					power-saving mode.
					Supports SMART auto save timer.
Error logging capability:        (0x01)	Error logging supported.
					General Purpose Logging supported.
Short self-test routine 
recommended polling time: 	 (   1) minutes.
Extended self-test routine
recommended polling time: 	 ( 115) minutes.

SMART Attributes Data Structure revision number: 10
Vendor Specific SMART Attributes with Thresholds:
ID# ATTRIBUTE_NAME          FLAGS    VALUE WORST THRESH FAIL RAW_VALUE
  1 Raw_Read_Error_Rate     POSR--   109   081   006    -    171427686
  3 Spin_Up_Time            PO----   096   095   000    -    0
  4 Start_Stop_Count        -O--CK   091   091   020    -    9372
  5 Reallocated_Sector_Ct   PO--CK   100   100   036    -    0
  7 Seek_Error_Rate         POSR--   078   060   030    -    76513830
  9 Power_On_Hours          -O--CK   076   076   000    -    21105
 10 Spin_Retry_Count        PO--C-   100   100   097    -    0
 12 Power_Cycle_Count       -O--CK   093   093   020    -    7619
187 Reported_Uncorrect      -O--CK   100   100   000    -    0
189 High_Fly_Writes         -O-RCK   100   100   000    -    0
190 Airflow_Temperature_Cel -O---K   060   039   045    Past 40 (Min/Max 37/40)
194 Temperature_Celsius     -O---K   040   061   000    -    40 (0 15 0 0 0)
195 Hardware_ECC_Recovered  -O-RC-   065   047   000    -    6583033
197 Current_Pending_Sector  -O--C-   100   100   000    -    1
198 Offline_Uncorrectable   ----C-   100   100   000    -    1
199 UDMA_CRC_Error_Count    -OSRCK   200   200   000    -    4
200 Multi_Zone_Error_Rate   ------   100   253   000    -    0
202 Data_Address_Mark_Errs  -O--CK   099   252   000    -    1
                            ||||||_ K auto-keep
                            |||||__ C event count
                            ||||___ R error rate
                            |||____ S speed/performance
                            ||_____ O updated online
                            |______ P prefailure warning

General Purpose Log Directory Version 1
SMART           Log Directory Version 1 [multi-sector log support]
Address    Access  R/W   Size  Description
0x00       GPL,SL  R/O      1  Log Directory
0x01       GPL,SL  R/O      1  Summary SMART error log
0x02       GPL,SL  R/O      5  Comprehensive SMART error log
0x03       GPL,SL  R/O      5  Ext. Comprehensive SMART error log
0x06       GPL,SL  R/O      1  SMART self-test log
0x07       GPL,SL  R/O      1  Extended self-test log
0x09       GPL,SL  R/W      1  Selective self-test log
0x10       GPL,SL  R/O      1  NCQ Command Error log
0x11       GPL,SL  R/O      1  SATA Phy Event Counters log
0x20       GPL,SL  R/O      1  Streaming performance log [OBS-8]
0x21       GPL,SL  R/O      1  Write stream error log
0x22       GPL,SL  R/O      1  Read stream error log
0x23       GPL,SL  R/O      1  Delayed sector log [OBS-8]
0x80-0x9f  GPL,SL  R/W     16  Host vendor specific log
0xa0       GPL,SL  VS       1  Device vendor specific log
0xa1       GPL,SL  VS      20  Device vendor specific log
0xa2       GPL,SL  VS     101  Device vendor specific log
0xa8       GPL,SL  VS      20  Device vendor specific log
0xa9       GPL,SL  VS       1  Device vendor specific log
0xe0       GPL,SL  R/W      1  SCT Command/Status
0xe1       GPL,SL  R/W      1  SCT Data Transfer
0xff       GPL     -    23040  Reserved

SMART Extended Comprehensive Error Log Version: 1 (5 sectors)
Device Error Count: 7
	CR     = Command Register
	FEATR  = Features Register
	COUNT  = Count (was: Sector Count) Register
	LBA_48 = Upper bytes of LBA High/Mid/Low Registers ]  ATA-8
	LH     = LBA High (was: Cylinder High) Register    ]   LBA
	LM     = LBA Mid (was: Cylinder Low) Register      ] Register
	LL     = LBA Low (was: Sector Number) Register     ]
	DV     = Device (was: Device/Head) Register
	DC     = Device Control Register
	ER     = Error register
	ST     = Status register
Powered_Up_Time is measured from power on, and printed as
DDd+hh:mm:SS.sss where DD=days, hh=hours, mm=minutes,
SS=sec, and sss=millisec. It "wraps" after 49.710 days.

Error 7 [6] occurred at disk power-on lifetime: 11645 hours (485 days + 5 hours)
  When the command that caused the error occurred, the device was active or idle.

  After command completion occurred, registers were:
  ER -- ST COUNT  LBA_48  LH LM LL DV DC
  -- -- -- == -- == == == -- -- -- -- --
  84 -- 51 00 3f 00 00 00 00 00 00 e0 00  Error: ICRC, ABRT 63 sectors at LBA = 0x00000000 = 0

  Commands leading to the command that caused the error were:
  CR FEATR COUNT  LBA_48  LH LM LL DV DC  Powered_Up_Time  Command/Feature_Name
  -- == -- == -- == == == -- -- -- -- --  ---------------  --------------------
  25 00 03 00 80 00 02 d4 00 63 13 e0 00     01:41:53.874  READ DMA EXT
  25 00 03 00 20 00 00 26 00 41 e4 e0 00     01:41:53.874  READ DMA EXT
  25 00 03 00 80 00 02 d2 00 63 93 e0 00     01:41:53.977  READ DMA EXT
  25 00 03 00 80 00 02 d3 00 63 93 e0 00     01:41:53.969  READ DMA EXT
  25 00 03 00 20 00 00 26 00 41 c4 e0 00     01:41:53.962  READ DMA EXT

Error 6 [5] occurred at disk power-on lifetime: 10977 hours (457 days + 9 hours)
  When the command that caused the error occurred, the device was active or idle.

  After command completion occurred, registers were:
  ER -- ST COUNT  LBA_48  LH LM LL DV DC
  -- -- -- == -- == == == -- -- -- -- --
  84 -- 51 00 00 00 00 00 00 00 00 e0 00  Error: ICRC, ABRT at LBA = 0x00000000 = 0

  Commands leading to the command that caused the error were:
  CR FEATR COUNT  LBA_48  LH LM LL DV DC  Powered_Up_Time  Command/Feature_Name
  -- == -- == -- == == == -- -- -- -- --  ---------------  --------------------
  25 00 20 00 01 00 00 8e 00 17 42 e0 00     00:00:17.529  READ DMA EXT
  25 00 20 00 01 00 00 8e 00 17 41 e0 00     00:00:17.529  READ DMA EXT
  25 00 20 00 01 00 00 8e 00 17 40 e0 00     00:00:17.529  READ DMA EXT
  25 00 20 00 01 00 00 8e 00 17 3f e0 00     00:00:17.528  READ DMA EXT
  25 00 20 00 01 00 00 8e 00 17 3e e0 00     00:00:17.528  READ DMA EXT

Error 5 [4] occurred at disk power-on lifetime: 10976 hours (457 days + 8 hours)
  When the command that caused the error occurred, the device was active or idle.

  After command completion occurred, registers were:
  ER -- ST COUNT  LBA_48  LH LM LL DV DC
  -- -- -- == -- == == == -- -- -- -- --
  84 -- 51 00 2f 00 00 00 00 00 00 e0 00  Error: ICRC, ABRT 47 sectors at LBA = 0x00000000 = 0

  Commands leading to the command that caused the error were:
  CR FEATR COUNT  LBA_48  LH LM LL DV DC  Powered_Up_Time  Command/Feature_Name
  -- == -- == -- == == == -- -- -- -- --  ---------------  --------------------
  25 00 03 00 80 00 04 c1 00 ae 9f e0 00     00:00:14.204  READ DMA EXT
  25 00 03 00 80 00 04 c1 00 ae 1f e0 00     00:00:14.202  READ DMA EXT
  25 00 03 00 80 00 04 c0 00 ae 9f e0 00     00:00:14.199  READ DMA EXT
  25 00 03 00 80 00 04 c0 00 ae 1f e0 00     00:00:14.197  READ DMA EXT
  25 00 03 00 80 00 04 bf 00 ae 9f e0 00     00:00:14.195  READ DMA EXT

Error 4 [3] occurred at disk power-on lifetime: 11649 hours (485 days + 9 hours)
  When the command that caused the error occurred, the device was active or idle.

  After command completion occurred, registers were:
  ER -- ST COUNT  LBA_48  LH LM LL DV DC
  -- -- -- == -- == == == -- -- -- -- --
  84 -- 51 00 5f 00 00 00 00 00 00 e0 00  Error: ICRC, ABRT 95 sectors at LBA = 0x00000000 = 0

  Commands leading to the command that caused the error were:
  CR FEATR COUNT  LBA_48  LH LM LL DV DC  Powered_Up_Time  Command/Feature_Name
  -- == -- == -- == == == -- -- -- -- --  ---------------  --------------------
  25 00 03 00 80 00 00 b6 00 a6 63 e0 00     07:30:47.226  READ DMA EXT
  25 00 03 00 80 00 00 b5 00 a6 e3 e0 00     07:30:47.226  READ DMA EXT
  25 00 03 00 80 00 00 b5 00 a6 63 e0 00     07:30:47.226  READ DMA EXT
  25 00 03 00 80 00 00 b4 00 a6 e3 e0 00     07:30:47.225  READ DMA EXT
  25 00 03 00 40 00 01 05 00 13 fb e0 00     07:30:47.224  READ DMA EXT

Error 3 [2] occurred at disk power-on lifetime: 11645 hours (485 days + 5 hours)
  When the command that caused the error occurred, the device was active or idle.

  After command completion occurred, registers were:
  ER -- ST COUNT  LBA_48  LH LM LL DV DC
  -- -- -- == -- == == == -- -- -- -- --
  84 -- 51 00 3f 00 00 00 00 00 00 e0 00  Error: ICRC, ABRT 63 sectors at LBA = 0x00000000 = 0

  Commands leading to the command that caused the error were:
  CR FEATR COUNT  LBA_48  LH LM LL DV DC  Powered_Up_Time  Command/Feature_Name
  -- == -- == -- == == == -- -- -- -- --  ---------------  --------------------
  25 00 03 00 80 00 02 d4 00 63 13 e0 00     01:41:53.874  READ DMA EXT
  25 00 03 00 20 00 00 26 00 41 e4 e0 00     01:41:53.874  READ DMA EXT
  25 00 03 00 80 00 02 d2 00 63 93 e0 00     01:41:53.977  READ DMA EXT
  25 00 03 00 80 00 02 d3 00 63 93 e0 00     01:41:53.969  READ DMA EXT
  25 00 03 00 20 00 00 26 00 41 c4 e0 00     01:41:53.962  READ DMA EXT

Error 2 [1] occurred at disk power-on lifetime: 10977 hours (457 days + 9 hours)
  When the command that caused the error occurred, the device was active or idle.

  After command completion occurred, registers were:
  ER -- ST COUNT  LBA_48  LH LM LL DV DC
  -- -- -- == -- == == == -- -- -- -- --
  84 -- 51 00 00 00 00 00 00 00 00 e0 00  Error: ICRC, ABRT at LBA = 0x00000000 = 0

  Commands leading to the command that caused the error were:
  CR FEATR COUNT  LBA_48  LH LM LL DV DC  Powered_Up_Time  Command/Feature_Name
  -- == -- == -- == == == -- -- -- -- --  ---------------  --------------------
  25 00 20 00 01 00 00 8e 00 17 42 e0 00     00:00:17.529  READ DMA EXT
  25 00 20 00 01 00 00 8e 00 17 41 e0 00     00:00:17.529  READ DMA EXT
  25 00 20 00 01 00 00 8e 00 17 40 e0 00     00:00:17.529  READ DMA EXT
  25 00 20 00 01 00 00 8e 00 17 3f e0 00     00:00:17.528  READ DMA EXT
  25 00 20 00 01 00 00 8e 00 17 3e e0 00     00:00:17.528  READ DMA EXT

Error 1 [0] occurred at disk power-on lifetime: 10976 hours (457 days + 8 hours)
  When the command that caused the error occurred, the device was active or idle.

  After command completion occurred, registers were:
  ER -- ST COUNT  LBA_48  LH LM LL DV DC
  -- -- -- == -- == == == -- -- -- -- --
  84 -- 51 00 2f 00 00 00 00 00 00 e0 00  Error: ICRC, ABRT 47 sectors at LBA = 0x00000000 = 0

  Commands leading to the command that caused the error were:
  CR FEATR COUNT  LBA_48  LH LM LL DV DC  Powered_Up_Time  Command/Feature_Name
  -- == -- == -- == == == -- -- -- -- --  ---------------  --------------------
  25 00 03 00 80 00 04 c1 00 ae 9f e0 00     00:00:14.204  READ DMA EXT
  25 00 03 00 80 00 04 c1 00 ae 1f e0 00     00:00:14.202  READ DMA EXT
  25 00 03 00 80 00 04 c0 00 ae 9f e0 00     00:00:14.199  READ DMA EXT
  25 00 03 00 80 00 04 c0 00 ae 1f e0 00     00:00:14.197  READ DMA EXT
  25 00 03 00 80 00 04 bf 00 ae 9f e0 00     00:00:14.195  READ DMA EXT

SMART Extended Self-test Log Version: 1 (1 sectors)
Num  Test_Description    Status                  Remaining  LifeTime(hours)  LBA_of_first_error
# 1  Extended offline    Interrupted (host reset)      90%     14665         -
# 2  Extended offline    Interrupted (host reset)      60%     13994         -

SMART Selective self-test log data structure revision number 1
 SPAN  MIN_LBA  MAX_LBA  CURRENT_TEST_STATUS
    1        0        0  Not_testing
    2        0        0  Not_testing
    3        0        0  Not_testing
    4        0        0  Not_testing
    5        0        0  Not_testing
Selective self-test flags (0x0):
  After scanning selected spans, do NOT read-scan remainder of disk.
If Selective self-test is pending on power-up, resume after 0 minute delay.

SCT Commands not supported

Device Statistics (GP/SMART Log 0x04) not supported

Pending Defects log (GP Log 0x0c) not supported

SATA Phy Event Counters (GP Log 0x11)
ID      Size     Value  Description
0x000a  2           38  Device-to-host register FISes sent due to a COMRESET
0x0001  2            0  Command failed due to ICRC error
0x0003  2            0  R_ERR response for device-to-host data FIS
0x0004  2            0  R_ERR response for host-to-device data FIS
0x0006  2            0  R_ERR response for device-to-host non-data FIS
0x0007  2            0  R_ERR response for host-to-device non-data FIS

