smartctl 7.3 2022-02-28 r5338 [x86_64-linux-6.1.1-desktop-1omv2290] (OpenMandriva Lx 7.3-2)
Copyright (C) 2002-22, Bruce Allen, Christian Franke, www.smartmontools.org

=== START OF INFORMATION SECTION ===
Device Model:     ADATA SU630
Serial Number:    --
LU WWN Device Id: 0 000000 ...
Firmware Version: V8X01c86
User Capacity:    480,103,981,056 bytes [480 GB]
Sector Size:      512 bytes logical/physical
Rotation Rate:    Solid State Device
Form Factor:      2.5 inches
TRIM Command:     Available, deterministic, zeroed
Device is:        Not in smartctl database
ATA Version is:   ACS-3, ATA8-ACS T13/1699-D revision 6
SATA Version is:  SATA 3.1, 6.0 Gb/s (current: 6.0 Gb/s)
Local Time is:    Mon Jan  9 16:50:13 2023 GMT
SMART support is: Available - device has SMART capability.
SMART support is: Enabled
AAM feature is:   Unavailable
APM feature is:   Unavailable
Rd look-ahead is: Disabled
Write cache is:   Enabled
DSN feature is:   Unavailable
ATA Security is:  Disabled, NOT FROZEN [SEC1]
Wt Cache Reorder: Enabled

=== START OF READ SMART DATA SECTION ===
SMART overall-health self-assessment test result: PASSED

General SMART Values:
Offline data collection status:  (0x00)	Offline data collection activity
					was never started.
					Auto Offline Data Collection: Disabled.
Self-test execution status:      (   0)	The previous self-test routine completed
					without error or no self-test has ever 
					been run.
Total time to complete Offline 
data collection: 		(    1) seconds.
Offline data collection
capabilities: 			 (0x59) SMART execute Offline immediate.
					No Auto Offline data collection support.
					Suspend Offline collection upon new
					command.
					Offline surface scan supported.
					Self-test supported.
					No Conveyance Self-test supported.
					Selective Self-test supported.
SMART capabilities:            (0x0002)	Does not save SMART data before
					entering power-saving mode.
					Supports SMART auto save timer.
Error logging capability:        (0x01)	Error logging supported.
					General Purpose Logging supported.
Short self-test routine 
recommended polling time: 	 (  15) minutes.
Extended self-test routine
recommended polling time: 	 (  46) minutes.
SCT capabilities: 	       (0x0039)	SCT Status supported.
					SCT Error Recovery Control supported.
					SCT Feature Control supported.
					SCT Data Table supported.

SMART Attributes Data Structure revision number: 10
Vendor Specific SMART Attributes with Thresholds:
ID# ATTRIBUTE_NAME          FLAGS    VALUE WORST THRESH FAIL RAW_VALUE
  1 Raw_Read_Error_Rate     POSR-K   100   100   050    -    0
  5 Reallocated_Sector_Ct   PO--CK   100   100   010    -    1416
  9 Power_On_Hours          -O--CK   100   100   000    -    2989
 12 Power_Cycle_Count       -O--CK   100   100   000    -    1511
161 Unknown_Attribute       -O--CK   100   100   000    -    71
162 Unknown_Attribute       -O--CK   100   100   000    -    109392
163 Unknown_Attribute       -O--CK   100   100   000    -    100
164 Unknown_Attribute       -O--CK   100   100   000    -    77
166 Unknown_Attribute       -O--CK   100   100   000    -    134
167 Unknown_Attribute       -O--CK   100   100   050    -    0
168 Unknown_Attribute       -O--CK   100   100   000    -    0
169 Unknown_Attribute       -O--CK   100   100   000    -    100
171 Unknown_Attribute       -O--CK   100   100   000    -    0
172 Unknown_Attribute       -O--CK   100   100   000    -    0
174 Unknown_Attribute       -O--CK   100   100   000    -    225
175 Program_Fail_Count_Chip -O--CK   100   100   000    -    22
181 Program_Fail_Cnt_Total  -O---K   100   100   000    -    14027078
187 Reported_Uncorrect      -O--CK   100   100   000    -    22
194 Temperature_Celsius     -O---K   100   100   030    -    70
195 Hardware_ECC_Recovered  -O-RCK   100   100   000    -    119
196 Reallocated_Event_Count -O--CK   100   100   000    -    22
199 UDMA_CRC_Error_Count    -O--CK   100   100   000    -    22
206 Unknown_SSD_Attribute   -O--CK   100   100   000    -    35
207 Unknown_SSD_Attribute   -O--CK   100   100   000    -    106
232 Available_Reservd_Space -O--CK   100   100   000    -    97
233 Media_Wearout_Indicator -O--CK   100   100   000    -    3380
241 Total_LBAs_Written      -O--CK   100   100   000    -    10364
242 Total_LBAs_Read         -O--CK   100   100   000    -    6453
249 Unknown_Attribute       -O--CK   100   100   000    -    2633
250 Read_Error_Retry_Rate   -O--CK   100   100   000    -    12651
                            ||||||_ K auto-keep
                            |||||__ C event count
                            ||||___ R error rate
                            |||____ S speed/performance
                            ||_____ O updated online
                            |______ P prefailure warning

General Purpose Log Directory Version 1
SMART           Log Directory Version 1 [multi-sector log support]
Address    Access  R/W   Size  Description
0x00       GPL,SL  R/O      1  Log Directory
0x01           SL  R/O      1  Summary SMART error log
0x02           SL  R/O      1  Comprehensive SMART error log
0x03       GPL     R/O      2  Ext. Comprehensive SMART error log
0x04       GPL,SL  R/O      5  Device Statistics log
0x06           SL  R/O      1  SMART self-test log
0x07       GPL     R/O      1  Extended self-test log
0x09           SL  R/W      1  Selective self-test log
0x10       GPL     R/O      1  NCQ Command Error log
0x11       GPL     R/O      1  SATA Phy Event Counters log
0x30       GPL,SL  R/O      8  IDENTIFY DEVICE data log
0x80-0x9f  GPL,SL  R/W     16  Host vendor specific log
0xe0       GPL,SL  R/W      1  SCT Command/Status
0xe1       GPL,SL  R/W      1  SCT Data Transfer

SMART Extended Comprehensive Error Log Version: 1 (2 sectors)
Device Error Count: 137 (device log contains only the most recent 8 errors)
	CR     = Command Register
	FEATR  = Features Register
	COUNT  = Count (was: Sector Count) Register
	LBA_48 = Upper bytes of LBA High/Mid/Low Registers ]  ATA-8
	LH     = LBA High (was: Cylinder High) Register    ]   LBA
	LM     = LBA Mid (was: Cylinder Low) Register      ] Register
	LL     = LBA Low (was: Sector Number) Register     ]
	DV     = Device (was: Device/Head) Register
	DC     = Device Control Register
	ER     = Error register
	ST     = Status register
Powered_Up_Time is measured from power on, and printed as
DDd+hh:mm:SS.sss where DD=days, hh=hours, mm=minutes,
SS=sec, and sss=millisec. It "wraps" after 49.710 days.

Error 137 [7] occurred at disk power-on lifetime: 2975 hours (123 days + 23 hours)
  When the command that caused the error occurred, the device was active or idle.

  After command completion occurred, registers were:
  ER -- ST COUNT  LBA_48  LH LM LL DV DC
  -- -- -- == -- == == == -- -- -- -- --
  40 -- 41 00 f8 00 00 37 bf dc f0 40 08  Error: UNC at LBA = 0x37bfdcf0 = 935320816

  Commands leading to the command that caused the error were:
  CR FEATR COUNT  LBA_48  LH LM LL DV DC  Powered_Up_Time  Command/Feature_Name
  -- == -- == -- == == == -- -- -- -- --  ---------------  --------------------
  60 00 30 00 f8 00 00 37 bf dc f0 40 08     00:01:54.026  READ FPDMA QUEUED
  60 00 28 00 30 00 00 16 60 1c 40 40 08     00:01:53.960  READ FPDMA QUEUED
  60 00 f0 00 c8 00 00 20 de fe 20 40 08     00:01:53.959  READ FPDMA QUEUED
  60 00 f0 00 68 00 00 16 60 24 18 40 08     00:01:53.959  READ FPDMA QUEUED
  60 00 08 00 90 00 00 13 97 da 50 40 08     00:01:53.958  READ FPDMA QUEUED

Error 136 [6] occurred at disk power-on lifetime: 2933 hours (122 days + 5 hours)
  When the command that caused the error occurred, the device was active or idle.

  After command completion occurred, registers were:
  ER -- ST COUNT  LBA_48  LH LM LL DV DC
  -- -- -- == -- == == == -- -- -- -- --
  40 -- 41 00 90 00 00 30 47 d9 00 40 08  Error: UNC at LBA = 0x3047d900 = 810014976

  Commands leading to the command that caused the error were:
  CR FEATR COUNT  LBA_48  LH LM LL DV DC  Powered_Up_Time  Command/Feature_Name
  -- == -- == -- == == == -- -- -- -- --  ---------------  --------------------
  60 00 f8 00 90 00 00 30 47 d9 00 40 08     00:00:27.208  READ FPDMA QUEUED
  60 00 88 00 e8 00 00 26 1f db a0 40 08     00:00:27.147  READ FPDMA QUEUED
  60 00 40 00 e0 00 00 26 1f d8 28 40 08     00:00:27.147  READ FPDMA QUEUED
  60 00 20 00 d8 00 00 26 1f d8 08 40 08     00:00:27.147  READ FPDMA QUEUED
  60 00 a0 00 d0 00 00 1a 0f d8 60 40 08     00:00:27.146  READ FPDMA QUEUED

Error 135 [5] occurred at disk power-on lifetime: 2933 hours (122 days + 5 hours)
  When the command that caused the error occurred, the device was active or idle.

  After command completion occurred, registers were:
  ER -- ST COUNT  LBA_48  LH LM LL DV DC
  -- -- -- == -- == == == -- -- -- -- --
  40 -- 41 00 18 00 00 19 3b e0 a0 40 08  Error: UNC at LBA = 0x193be0a0 = 423354528

  Commands leading to the command that caused the error were:
  CR FEATR COUNT  LBA_48  LH LM LL DV DC  Powered_Up_Time  Command/Feature_Name
  -- == -- == -- == == == -- -- -- -- --  ---------------  --------------------
  60 00 a0 00 18 00 00 19 3b e0 a0 40 08     00:00:18.615  READ FPDMA QUEUED
  60 00 d0 00 00 00 00 18 c8 ff 78 40 08     00:00:18.512  READ FPDMA QUEUED
  60 01 00 00 f8 00 00 18 c9 02 08 40 08     00:00:18.511  READ FPDMA QUEUED
  60 00 b8 00 a8 00 00 10 a7 fd 38 40 08     00:00:18.510  READ FPDMA QUEUED
  60 00 70 00 b0 00 00 08 d6 3a 88 40 08     00:00:18.509  READ FPDMA QUEUED

Error 134 [4] occurred at disk power-on lifetime: 2930 hours (122 days + 2 hours)
  When the command that caused the error occurred, the device was active or idle.

  After command completion occurred, registers were:
  ER -- ST COUNT  LBA_48  LH LM LL DV DC
  -- -- -- == -- == == == -- -- -- -- --
  40 -- 41 00 58 00 00 33 c7 f5 18 40 08  Error: UNC at LBA = 0x33c7f518 = 868742424

  Commands leading to the command that caused the error were:
  CR FEATR COUNT  LBA_48  LH LM LL DV DC  Powered_Up_Time  Command/Feature_Name
  -- == -- == -- == == == -- -- -- -- --  ---------------  --------------------
  60 00 e8 00 58 00 00 33 c7 f5 18 40 08     00:02:59.791  READ FPDMA QUEUED
  60 00 08 00 40 00 00 33 c7 f5 10 40 08     00:02:59.471  READ FPDMA QUEUED
  60 00 08 00 38 00 00 33 c7 f5 08 40 08     00:02:59.471  READ FPDMA QUEUED
  60 00 30 00 20 00 00 01 94 64 68 40 08     00:02:59.470  READ FPDMA QUEUED
  61 00 08 00 b8 00 00 1f e9 e3 08 40 08     00:02:59.464  WRITE FPDMA QUEUED

Error 133 [3] occurred at disk power-on lifetime: 2930 hours (122 days + 2 hours)
  When the command that caused the error occurred, the device was active or idle.

  After command completion occurred, registers were:
  ER -- ST COUNT  LBA_48  LH LM LL DV DC
  -- -- -- == -- == == == -- -- -- -- --
  40 -- 41 00 18 00 00 2e c7 e0 00 40 08  Error: UNC at LBA = 0x2ec7e000 = 784850944

  Commands leading to the command that caused the error were:
  CR FEATR COUNT  LBA_48  LH LM LL DV DC  Powered_Up_Time  Command/Feature_Name
  -- == -- == -- == == == -- -- -- -- --  ---------------  --------------------
  60 00 c8 00 18 00 00 2e c7 e0 00 40 08     00:00:22.805  READ FPDMA QUEUED
  60 00 08 00 b0 00 00 24 44 97 08 40 08     00:00:22.740  READ FPDMA QUEUED
  60 00 10 00 a8 00 00 2d 10 da 30 40 08     00:00:22.739  READ FPDMA QUEUED
  60 00 08 00 a0 00 00 30 0b e3 68 40 08     00:00:22.739  READ FPDMA QUEUED
  60 00 08 00 98 00 00 30 8e 7c d0 40 08     00:00:22.739  READ FPDMA QUEUED

Error 132 [2] occurred at disk power-on lifetime: 2908 hours (121 days + 4 hours)
  When the command that caused the error occurred, the device was active or idle.

  After command completion occurred, registers were:
  ER -- ST COUNT  LBA_48  LH LM LL DV DC
  -- -- -- == -- == == == -- -- -- -- --
  40 -- 41 00 80 00 00 31 c9 18 00 40 08  Error: UNC at LBA = 0x31c91800 = 835262464

  Commands leading to the command that caused the error were:
  CR FEATR COUNT  LBA_48  LH LM LL DV DC  Powered_Up_Time  Command/Feature_Name
  -- == -- == -- == == == -- -- -- -- --  ---------------  --------------------
  60 00 18 00 80 00 00 31 c9 18 00 40 08     00:00:56.652  READ FPDMA QUEUED
  60 00 08 00 f8 00 00 05 70 5a 00 40 08     00:00:56.490  READ FPDMA QUEUED
  60 00 80 00 e0 00 00 08 04 40 d0 40 08     00:00:56.490  READ FPDMA QUEUED
  60 00 08 00 58 00 00 05 78 1a 00 40 08     00:00:56.489  READ FPDMA QUEUED
  60 00 08 00 d8 00 00 05 7a 1a 00 40 08     00:00:56.485  READ FPDMA QUEUED

Error 131 [1] occurred at disk power-on lifetime: 2908 hours (121 days + 4 hours)
  When the command that caused the error occurred, the device was active or idle.

  After command completion occurred, registers were:
  ER -- ST COUNT  LBA_48  LH LM LL DV DC
  -- -- -- == -- == == == -- -- -- -- --
  40 -- 41 00 58 00 00 13 8f dd a0 40 08  Error: UNC at LBA = 0x138fdda0 = 328195488

  Commands leading to the command that caused the error were:
  CR FEATR COUNT  LBA_48  LH LM LL DV DC  Powered_Up_Time  Command/Feature_Name
  -- == -- == -- == == == -- -- -- -- --  ---------------  --------------------
  60 00 08 00 58 00 00 13 8f dd a0 40 08     00:00:22.294  READ FPDMA QUEUED
  60 00 08 00 d0 00 00 14 57 d9 60 40 08     00:00:22.236  READ FPDMA QUEUED
  60 00 10 00 80 00 00 14 57 de 00 40 08     00:00:22.236  READ FPDMA QUEUED
  60 00 08 00 48 00 00 14 57 db d0 40 08     00:00:22.236  READ FPDMA QUEUED
  60 00 20 00 a0 00 00 14 57 db 20 40 08     00:00:22.236  READ FPDMA QUEUED

Error 130 [0] occurred at disk power-on lifetime: 2908 hours (121 days + 4 hours)
  When the command that caused the error occurred, the device was active or idle.

  After command completion occurred, registers were:
  ER -- ST COUNT  LBA_48  LH LM LL DV DC
  -- -- -- == -- == == == -- -- -- -- --
  40 -- 41 00 50 00 00 10 a7 dd 08 40 08  Error: UNC at LBA = 0x10a7dd08 = 279436552

  Commands leading to the command that caused the error were:
  CR FEATR COUNT  LBA_48  LH LM LL DV DC  Powered_Up_Time  Command/Feature_Name
  -- == -- == -- == == == -- -- -- -- --  ---------------  --------------------
  60 00 08 00 50 00 00 10 a7 dd 08 40 08     00:00:22.003  READ FPDMA QUEUED
  60 00 a0 00 b8 00 00 10 03 fb 60 40 08     00:00:21.938  READ FPDMA QUEUED
  60 00 28 00 b0 00 00 10 03 fb 20 40 08     00:00:21.938  READ FPDMA QUEUED
  60 00 30 00 80 00 00 10 03 f9 50 40 08     00:00:21.937  READ FPDMA QUEUED
  60 00 08 00 a8 00 00 10 03 fa e0 40 08     00:00:21.937  READ FPDMA QUEUED

SMART Extended Self-test Log Version: 1 (1 sectors)
Num  Test_Description    Status                  Remaining  LifeTime(hours)  LBA_of_first_error
# 1  Short offline       Completed without error       00%      1843         -
# 2  Short offline       Completed without error       00%      1840         -
# 3  Short offline       Aborted by host               80%      1840         -
# 4  Short offline       Completed without error       00%      1836         -
# 5  Extended offline    Aborted by host               90%      1836         -
# 6  Short offline       Completed without error       00%      1834         -
# 7  Short offline       Interrupted (host reset)      70%      1832         -
# 8  Short offline       Completed without error       00%      1830         -
# 9  Short offline       Interrupted (host reset)      90%      1823         -
#10  Short offline       Completed without error       00%      1797         -
#11  Short offline       Aborted by host               90%      1777         -
#12  Short offline       Completed without error       00%      1630         -
#13  Short offline       Completed without error       00%      1014         -
#14  Short offline       Aborted by host               90%       436         -
#15  Short offline       Aborted by host               90%       436         -
#16  Short offline       Interrupted (host reset)      90%        70         -

SMART Selective self-test log data structure revision number 0
Note: revision number not 1 implies that no selective self-test has ever been run
 SPAN  MIN_LBA  MAX_LBA  CURRENT_TEST_STATUS
    1        0        0  Not_testing
    2        0        0  Not_testing
    3        0        0  Not_testing
    4        0        0  Not_testing
    5        0        0  Not_testing
Selective self-test flags (0x0):
  After scanning selected spans, do NOT read-scan remainder of disk.
If Selective self-test is pending on power-up, resume after 0 minute delay.

SCT Status Version:                  3
SCT Version (vendor specific):       0 (0x0000)
Device State:                        Active (0)
Current Temperature:                     0 Celsius
Power Cycle Min/Max Temperature:     28/28 Celsius
Lifetime    Min/Max Temperature:      0/36 Celsius
Specified Max Operating Temperature:   100 Celsius
Under/Over Temperature Limit Count:   0/0

SCT Temperature History Version:     2
Temperature Sampling Period:         0 minutes
Temperature Logging Interval:        0 minutes
Min/Max recommended Temperature:      0/100 Celsius
Min/Max Temperature Limit:           -10/125 Celsius
Temperature History Size (Index):    128 (1)

SCT Error Recovery Control:
           Read: Disabled
          Write: Disabled

Device Statistics (GP Log 0x04)
Page  Offset Size        Value Flags Description
0x01  =====  =               =  ===  == General Statistics (rev 1) ==
0x01  0x008  4            1511  ---  Lifetime Power-On Resets
0x01  0x010  4            2989  ---  Power-on Hours
0x01  0x018  6     21736261014  ---  Logical Sectors Written
0x01  0x020  6       276547022  ---  Number of Write Commands
0x01  0x028  6     13533826146  ---  Logical Sectors Read
0x01  0x030  6       192211351  ---  Number of Read Commands
0x01  0x038  6     10761314583  ---  Date and Time TimeStamp
0x04  =====  =               =  ===  == General Errors Statistics (rev 1) ==
0x04  0x008  4             137  ---  Number of Reported Uncorrectable Errors
0x04  0x010  4               1  ---  Resets Between Cmd Acceptance and Completion
0x06  =====  =               =  ===  == Transport Statistics (rev 1) ==
0x06  0x008  4            8932  ---  Number of Hardware Resets
0x06  0x018  4               0  ---  Number of Interface CRC Errors
0x07  =====  =               =  ===  == Solid State Device Statistics (rev 1) ==
0x07  0x008  1              68  ---  Percentage Used Endurance Indicator
                                |||_ C monitored condition met
                                ||__ D supports DSN
                                |___ N normalized value

Pending Defects log (GP Log 0x0c) not supported

SATA Phy Event Counters (GP Log 0x11)
ID      Size     Value  Description
0x0001  4            0  Command failed due to ICRC error
0x000a  4           10  Device-to-host register FISes sent due to a COMRESET

