smartctl 7.4 2023-08-01 r5530 [x86_64-linux-6.14.2-desktop-3omv2590] (OpenMandriva Lx 7.4-1)
Copyright (C) 2002-23, Bruce Allen, Christian Franke, www.smartmontools.org

=== START OF INFORMATION SECTION ===
Model Number:                       SAMSUNG MZVLW256HEHP-000H1
Serial Number:                      --
Firmware Version:                   CXB73H1Q
PCI Vendor/Subsystem ID:            0x144d
IEEE OUI Identifier:                0x002538
Total NVM Capacity:                 256,060,514,304 [256 GB]
Unallocated NVM Capacity:           0
Controller ID:                      2
NVMe Version:                       1.2
Number of Namespaces:               1
Namespace 1 Size/Capacity:          256,060,514,304 [256 GB]
Namespace 1 Utilization:            14,795,669,504 [14.7 GB]
Namespace 1 Formatted LBA Size:     512
Namespace 1 IEEE EUI-64:            002538 ...
Local Time is:                      Thu Oct  9 11:33:13 2025 EDT
Firmware Updates (0x16):            3 Slots, no Reset required
Optional Admin Commands (0x0017):   Security Format Frmw_DL Self_Test
Optional NVM Commands (0x001f):     Comp Wr_Unc DS_Mngmt Wr_Zero Sav/Sel_Feat
Log Page Attributes (0x03):         S/H_per_NS Cmd_Eff_Lg
Warning  Comp. Temp. Threshold:     68 Celsius
Critical Comp. Temp. Threshold:     71 Celsius

Supported Power States
St Op     Max   Active     Idle   RL RT WL WT  Ent_Lat  Ex_Lat
 0 +     7.60W       -        -    0  0  0  0        0       0
 1 +     6.00W       -        -    1  1  1  1        0       0
 2 +     5.10W       -        -    2  2  2  2        0       0
 3 -   0.0400W       -        -    3  3  3  3      210    1500
 4 -   0.0050W       -        -    4  4  4  4     2200    6000

Supported LBA Sizes (NSID 0x1)
Id Fmt  Data  Metadt  Rel_Perf
 0 +     512       0         0

=== START OF SMART DATA SECTION ===
SMART overall-health self-assessment test result: PASSED

SMART/Health Information (NVMe Log 0x02)
Critical Warning:                   0x00
Temperature:                        28 Celsius
Available Spare:                    100%
Available Spare Threshold:          5%
Percentage Used:                    8%
Data Units Read:                    63,709,583 [32.6 TB]
Data Units Written:                 54,017,709 [27.6 TB]
Host Read Commands:                 1,902,730,159
Host Write Commands:                1,885,488,592
Controller Busy Time:               8,499
Power Cycles:                       1,809
Power On Hours:                     5,280
Unsafe Shutdowns:                   134
Media and Data Integrity Errors:    0
Error Information Log Entries:      6,430
Warning  Comp. Temperature Time:    0
Critical Comp. Temperature Time:    0
Temperature Sensor 1:               28 Celsius
Temperature Sensor 2:               34 Celsius

Error Information (NVMe Log 0x01, 16 of 64 entries)
Num   ErrCount  SQId   CmdId  Status  PELoc          LBA  NSID    VS  Message
  0       6430     0  0x3014  0x4004      -            0     0     -  Invalid Field in Command
  1       6429     0  0x0018  0x4016  0x004            0     1     -  Invalid Namespace or Format
  2       6428     0  0x0014  0x4016  0x004            0     1     -  Invalid Namespace or Format
  3       6427     0  0x3019  0x4004      -            0     0     -  Invalid Field in Command
  4       6426     0  0x001c  0x4016  0x004            0     1     -  Invalid Namespace or Format
  5       6425     0  0x2013  0x4004      -            0     0     -  Invalid Field in Command
  6       6424     0  0x0015  0x4016  0x004            0     1     -  Invalid Namespace or Format
  7       6423     0  0x501d  0x4004      -            0     0     -  Invalid Field in Command
  8       6422     0  0x0015  0x4016  0x004            0     1     -  Invalid Namespace or Format
  9       6421     0  0x0015  0x4016  0x004            0     1     -  Invalid Namespace or Format
 10       6420     0  0x301a  0x4004      -            0     0     -  Invalid Field in Command
 11       6419     0  0x0015  0x4016  0x004            0     1     -  Invalid Namespace or Format
 12       6418     0  0x200d  0x4004      -            0     0     -  Invalid Field in Command
 13       6417     0  0x0015  0x4016  0x004            0     1     -  Invalid Namespace or Format
 14       6416     0  0x2012  0x4004      -            0     0     -  Invalid Field in Command
 15       6415     0  0x0014  0x4016  0x004            0     1     -  Invalid Namespace or Format
... (48 entries not read)

Self-test Log (NVMe Log 0x06)
Self-test status: No self-test in progress
Num  Test_Description  Status                       Power_on_Hours  Failing_LBA  NSID Seg SCT Code
 0   Short             Completed without error                5189            -     -   -   -    -
 1   Short             Aborted: Self-test command             3463            -     -   -   -    -
 2   Short             Completed without error                 518            -     -   -   -    -

