smartctl 7.2 2020-12-30 r5155 [x86_64-linux-5.11.0-051100-generic] (local build)
Copyright (C) 2002-20, Bruce Allen, Christian Franke, www.smartmontools.org

=== START OF INFORMATION SECTION ===
Model Number:                       SAMSUNG MZVLW256HEHP-000H1
Serial Number:                      --
Firmware Version:                   CXB70H1Q
PCI Vendor/Subsystem ID:            0x144d
IEEE OUI Identifier:                0x002538
Total NVM Capacity:                 256,060,514,304 [256 GB]
Unallocated NVM Capacity:           0
Controller ID:                      2
NVMe Version:                       1.2
Number of Namespaces:               1
Namespace 1 Size/Capacity:          256,060,514,304 [256 GB]
Namespace 1 Utilization:            161,488,384,000 [161 GB]
Namespace 1 Formatted LBA Size:     512
Namespace 1 IEEE EUI-64:            002538 ...
Local Time is:                      Fri Apr 23 12:37:33 2021 -04
Firmware Updates (0x16):            3 Slots, no Reset required
Optional Admin Commands (0x0007):   Security Format Frmw_DL
Optional NVM Commands (0x001f):     Comp Wr_Unc DS_Mngmt Wr_Zero Sav/Sel_Feat
Log Page Attributes (0x03):         S/H_per_NS Cmd_Eff_Lg
Warning  Comp. Temp. Threshold:     77 Celsius
Critical Comp. Temp. Threshold:     80 Celsius

Supported Power States
St Op     Max   Active     Idle   RL RT WL WT  Ent_Lat  Ex_Lat
 0 +     7.60W       -        -    0  0  0  0        0       0
 1 +     6.00W       -        -    1  1  1  1        0       0
 2 +     5.10W       -        -    2  2  2  2        0       0
 3 -   0.0400W       -        -    3  3  3  3      210    1500
 4 -   0.0050W       -        -    4  4  4  4     2200    6000

Supported LBA Sizes (NSID 0x1)
Id Fmt  Data  Metadt  Rel_Perf
 0 +     512       0         0

=== START OF SMART DATA SECTION ===
SMART overall-health self-assessment test result: PASSED

SMART/Health Information (NVMe Log 0x02)
Critical Warning:                   0x00
Temperature:                        26 Celsius
Available Spare:                    100%
Available Spare Threshold:          5%
Percentage Used:                    4%
Data Units Read:                    65,025,882 [33.2 TB]
Data Units Written:                 29,954,969 [15.3 TB]
Host Read Commands:                 511,586,359
Host Write Commands:                741,262,186
Controller Busy Time:               2,839
Power Cycles:                       3,737
Power On Hours:                     1,980
Unsafe Shutdowns:                   756
Media and Data Integrity Errors:    0
Error Information Log Entries:      5,070
Warning  Comp. Temperature Time:    0
Critical Comp. Temperature Time:    0
Temperature Sensor 1:               26 Celsius

Error Information (NVMe Log 0x01, 16 of 64 entries)
Num   ErrCount  SQId   CmdId  Status  PELoc          LBA  NSID    VS
  0       5070     0  0x0008  0x4004      -            0     0     -
  1       5069     0  0x0008  0x4004      -            0     0     -
  2       5068     0  0x0008  0x4004      -            0     0     -
  3       5067     0  0x0008  0x4004      -            0     0     -
  4       5066     0  0x0008  0x4004      -            0     0     -
  5       5065     0  0x0008  0x4004      -            0     0     -
  6       5064     0  0x0008  0x4004      -            0     0     -
  7       5063     0  0x0008  0x4004      -            0     0     -
  8       5062     0  0x0008  0x4004      -            0     0     -
  9       5061     0  0x0008  0x4004      -            0     0     -
 10       5060     0  0x0008  0x4004      -            0     0     -
 11       5059     0  0x0008  0x4004      -            0     0     -
 12       5058     0  0x0008  0x4004      -            0     0     -
 13       5057     0  0x0008  0x4004      -            0     0     -
 14       5056     0  0x0008  0x4004      -            0     0     -
 15       5055     0  0x0008  0x4004      -            0     0     -
... (48 entries not read)

