=== START OF INFORMATION SECTION ===
Model Family:     Seagate U5
Device Model:     ST340823A
Serial Number:    --
Firmware Version: 3.11
User Capacity:    40,020,664,320 bytes [40,0 GB]
Sector Size:      512 bytes logical/physical
Device is:        In smartctl database [for details use: -P show]
ATA Version is:   ATA/ATAPI-4 (minor revision not indicated)
Local Time is:    Sat Sep 26 13:35:41 2015 CEST
SMART support is: Available - device has SMART capability.
SMART support is: Enabled
AAM feature is:   Disabled
APM feature is:   Unavailable
Rd look-ahead is: Enabled
Write cache is:   Enabled
ATA Security is:  Disabled, frozen [SEC2]
Wt Cache Reorder: Unavailable

=== START OF READ SMART DATA SECTION ===
SMART overall-health self-assessment test result: PASSED

General SMART Values:
Offline data collection status:  (0x82)	Offline data collection activity
					was completed without error.
					Auto Offline Data Collection: Enabled.
Self-test execution status:      (   0)	The previous self-test routine completed
					without error or no self-test has ever 
					been run.
Total time to complete Offline 
data collection: 		(  422) seconds.
Offline data collection
capabilities: 			 (0x1b) SMART execute Offline immediate.
					Auto Offline data collection on/off support.
					Suspend Offline collection upon new
					command.
					Offline surface scan supported.
					Self-test supported.
					No Conveyance Self-test supported.
					No Selective Self-test supported.
SMART capabilities:            (0x0003)	Saves SMART data before entering
					power-saving mode.
					Supports SMART auto save timer.
Error logging capability:        (0x01)	Error logging supported.
					No General Purpose Logging support.
Short self-test routine 
recommended polling time: 	 (   1) minutes.
Extended self-test routine
recommended polling time: 	 (  44) minutes.

SMART Attributes Data Structure revision number: 10
Vendor Specific SMART Attributes with Thresholds:
ID# ATTRIBUTE_NAME          FLAGS    VALUE WORST THRESH FAIL RAW_VALUE
  1 Raw_Read_Error_Rate     -OSR--   071   053   025    -    178588831
  3 Spin_Up_Time            -O----   070   070   000    -    0
  4 Start_Stop_Count        -O--CK   100   100   020    -    267
  5 Reallocated_Sector_Ct   -O--CK   100   100   036    -    0
  7 Seek_Error_Rate         -OSR--   084   060   030    -    259107286
  9 Power_On_Hours          -O--CK   072   072   000    -    24822
 10 Spin_Retry_Count        -O--C-   100   099   097    -    0
 12 Power_Cycle_Count       -O--CK   095   095   020    -    5861
194 Temperature_Celsius     -O---K   040   050   000    -    40
195 Hardware_ECC_Recovered  -O-RC-   068   059   000    -    106262164
197 Current_Pending_Sector  -O--C-   100   100   000    -    0
198 Offline_Uncorrectable   ----C-   100   100   000    -    0
199 UDMA_CRC_Error_Count    -OSRCK   198   139   000    -    571
200 Multi_Zone_Error_Rate   ------   100   100   000    -    0
202 Data_Address_Mark_Errs  -O--CK   100   253   000    -    0
                            ||||||_ K auto-keep
                            |||||__ C event count
                            ||||___ R error rate
                            |||____ S speed/performance
                            ||_____ O updated online
                            |______ P prefailure warning

ATA_READ_LOG_EXT (addr=0x00:0x00, page=0, n=1) failed: scsi error aborted command
Read GP Log Directory failed

SMART Log Directory Version 1 [multi-sector log support]
Address    Access  R/W   Size  Description
0x00           SL  R/O      1  Log Directory
0x01           SL  R/O      1  Summary SMART error log
0x02           SL  R/O      5  Comprehensive SMART error log
0x06           SL  R/O      1  SMART self-test log
0x80-0x9f      SL  R/W     16  Host vendor specific log
0xa0           SL  VS       1  Device vendor specific log
0xa1           SL  VS      20  Device vendor specific log
0xa2           SL  VS     101  Device vendor specific log
0xa8           SL  VS      20  Device vendor specific log
0xa9           SL  VS       1  Device vendor specific log

SMART Extended Comprehensive Error Log (GP Log 0x03) not supported

SMART Error Log Version: 1
ATA Error Count: 559 (device log contains only the most recent five errors)
	CR = Command Register [HEX]
	FR = Features Register [HEX]
	SC = Sector Count Register [HEX]
	SN = Sector Number Register [HEX]
	CL = Cylinder Low Register [HEX]
	CH = Cylinder High Register [HEX]
	DH = Device/Head Register [HEX]
	DC = Device Command Register [HEX]
	ER = Error register [HEX]
	ST = Status register [HEX]
Powered_Up_Time is measured from power on, and printed as
DDd+hh:mm:SS.sss where DD=days, hh=hours, mm=minutes,
SS=sec, and sss=millisec. It "wraps" after 49.710 days.

Error 559 occurred at disk power-on lifetime: 24822 hours (1034 days + 6 hours)
  When the command that caused the error occurred, the device was active or idle.

  After command completion occurred, registers were:
  ER ST SC SN CL CH DH
  -- -- -- -- -- -- --
  84 51 00 c6 d3 27 f0  Error: ICRC, ABRT at LBA = 0x0027d3c6 = 2610118

  Commands leading to the command that caused the error were:
  CR FR SC SN CL CH DH DC   Powered_Up_Time  Command/Feature_Name
  -- -- -- -- -- -- -- --  ----------------  --------------------
  c8 00 00 c6 d3 27 f0 00      02:36:20.200  READ DMA
  c8 00 00 c6 d2 27 f0 00      02:36:20.196  READ DMA
  c8 00 00 c6 d1 27 f0 00      02:36:20.193  READ DMA
  c8 00 00 c6 d0 27 f0 00      02:36:20.187  READ DMA
  c8 00 00 c6 cf 27 f0 00      02:36:20.184  READ DMA

Error 558 occurred at disk power-on lifetime: 24822 hours (1034 days + 6 hours)
  When the command that caused the error occurred, the device was active or idle.

  After command completion occurred, registers were:
  ER ST SC SN CL CH DH
  -- -- -- -- -- -- --
  84 51 00 1e c1 2c f0  Error: ICRC, ABRT at LBA = 0x002cc11e = 2933022

  Commands leading to the command that caused the error were:
  CR FR SC SN CL CH DH DC   Powered_Up_Time  Command/Feature_Name
  -- -- -- -- -- -- -- --  ----------------  --------------------
  c8 00 00 1e c1 2c f0 00      02:32:45.038  READ DMA
  c8 00 00 d6 19 83 f0 00      02:32:45.029  READ DMA
  c8 00 10 c6 18 83 f0 00      02:32:45.020  READ DMA
  c8 00 00 16 45 3c f0 00      02:32:45.009  READ DMA
  c8 00 00 f6 82 5d f0 00      02:32:44.997  READ DMA

Error 557 occurred at disk power-on lifetime: 24822 hours (1034 days + 6 hours)
  When the command that caused the error occurred, the device was active or idle.

  After command completion occurred, registers were:
  ER ST SC SN CL CH DH
  -- -- -- -- -- -- --
  84 51 00 1e 9c 16 f0  Error: ICRC, ABRT at LBA = 0x00169c1e = 1481758

  Commands leading to the command that caused the error were:
  CR FR SC SN CL CH DH DC   Powered_Up_Time  Command/Feature_Name
  -- -- -- -- -- -- -- --  ----------------  --------------------
  c8 00 00 1e 9c 16 f0 00      02:32:00.982  READ DMA
  c8 00 08 de 03 30 f0 00      02:32:00.972  READ DMA
  c8 00 08 ee 87 33 f0 00      02:32:00.966  READ DMA
  c8 00 00 2e 9a 16 f0 00      02:32:00.954  READ DMA
  c8 00 30 ee ce 1e f0 00      02:32:00.940  READ DMA

Error 556 occurred at disk power-on lifetime: 24816 hours (1034 days + 0 hours)
  When the command that caused the error occurred, the device was active or idle.

  After command completion occurred, registers were:
  ER ST SC SN CL CH DH
  -- -- -- -- -- -- --
  84 51 00 ac 8b c6 f2  Error: ICRC, ABRT at LBA = 0x02c68bac = 46566316

  Commands leading to the command that caused the error were:
  CR FR SC SN CL CH DH DC   Powered_Up_Time  Command/Feature_Name
  -- -- -- -- -- -- -- --  ----------------  --------------------
  c8 00 40 ac 8b c6 f2 00      01:34:33.647  READ DMA
  c8 00 18 dc 5a c6 f2 00      01:34:33.645  READ DMA
  c8 00 08 14 58 e3 f1 00      01:34:33.633  READ DMA
  c8 00 40 f4 5a c6 f2 00      01:34:33.619  READ DMA
  c8 00 08 3c 5c e3 f1 00      01:34:33.601  READ DMA

Error 555 occurred at disk power-on lifetime: 24809 hours (1033 days + 17 hours)
  When the command that caused the error occurred, the device was active or idle.

  After command completion occurred, registers were:
  ER ST SC SN CL CH DH
  -- -- -- -- -- -- --
  84 51 00 66 fb 3d f0  Error: ICRC, ABRT at LBA = 0x003dfb66 = 4062054

  Commands leading to the command that caused the error were:
  CR FR SC SN CL CH DH DC   Powered_Up_Time  Command/Feature_Name
  -- -- -- -- -- -- -- --  ----------------  --------------------
  c8 00 00 66 fb 3d f0 00      00:19:43.150  READ DMA
  c8 00 00 66 24 42 f0 00      00:19:43.144  READ DMA
  c8 00 00 d6 5c 41 f0 00      00:19:43.128  READ DMA
  c8 00 00 c6 5f 40 f0 00      00:19:43.119  READ DMA
  c8 00 00 26 7b 40 f0 00      00:19:43.108  READ DMA

SMART Extended Self-test Log (GP Log 0x07) not supported

SMART Self-test log structure revision number 1
Num  Test_Description    Status                  Remaining  LifeTime(hours)  LBA_of_first_error
# 1  Short offline       Completed without error       00%     24404         -
# 2  Short offline       Completed without error       00%     21616         -
# 3  Short offline       Completed without error       00%     19183         -
# 4  Short offline       Completed without error       00%      5889         -
# 5  Short offline       Completed without error       00%      5746         -

Selective Self-tests/Logging not supported

SCT Commands not supported

Device Statistics (GP Log 0x04) not supported

SATA Phy Event Counters (GP Log 0x11) not supported

