smartctl 7.2 2020-12-30 r5155 [x86_64-linux-5.16.7-desktop-1omv4003] (OpenMandriva Lx 7.2-2)
Copyright (C) 2002-20, Bruce Allen, Christian Franke, www.smartmontools.org

=== START OF INFORMATION SECTION ===
Model Family:     Seagate Momentus 5400.6
Device Model:     ST9250315AS
Serial Number:    --
LU WWN Device Id: 5 000c50 ...
Firmware Version: 0020LVM1
User Capacity:    250,059,350,016 bytes [250 GB]
Sector Size:      512 bytes logical/physical
Rotation Rate:    5400 rpm
Device is:        In smartctl database [for details use: -P show]
ATA Version is:   ATA8-ACS T13/1699-D revision 4
SATA Version is:  SATA 2.6, 1.5 Gb/s (current: 1.5 Gb/s)
Local Time is:    Sun Jun  5 08:29:56 2022 BST
SMART support is: Available - device has SMART capability.
SMART support is: Enabled
AAM feature is:   Unavailable
APM level is:     128 (minimum power consumption without standby)
Rd look-ahead is: Enabled
Write cache is:   Enabled
DSN feature is:   Unavailable
ATA Security is:  Disabled, frozen [SEC2]
Wt Cache Reorder: Unknown

=== START OF READ SMART DATA SECTION ===
SMART overall-health self-assessment test result: PASSED

General SMART Values:
Offline data collection status:  (0x00)	Offline data collection activity
					was never started.
					Auto Offline Data Collection: Disabled.
Self-test execution status:      (   0)	The previous self-test routine completed
					without error or no self-test has ever 
					been run.
Total time to complete Offline 
data collection: 		(    0) seconds.
Offline data collection
capabilities: 			 (0x73) SMART execute Offline immediate.
					Auto Offline data collection on/off support.
					Suspend Offline collection upon new
					command.
					No Offline surface scan supported.
					Self-test supported.
					Conveyance Self-test supported.
					Selective Self-test supported.
SMART capabilities:            (0x0003)	Saves SMART data before entering
					power-saving mode.
					Supports SMART auto save timer.
Error logging capability:        (0x01)	Error logging supported.
					General Purpose Logging supported.
Short self-test routine 
recommended polling time: 	 (   1) minutes.
Extended self-test routine
recommended polling time: 	 (  72) minutes.
Conveyance self-test routine
recommended polling time: 	 (   2) minutes.
SCT capabilities: 	       (0x103b)	SCT Status supported.
					SCT Error Recovery Control supported.
					SCT Feature Control supported.
					SCT Data Table supported.

SMART Attributes Data Structure revision number: 10
Vendor Specific SMART Attributes with Thresholds:
ID# ATTRIBUTE_NAME          FLAGS    VALUE WORST THRESH FAIL RAW_VALUE
  1 Raw_Read_Error_Rate     POSR--   120   076   034    -    239670511
  3 Spin_Up_Time            PO----   099   099   000    -    0
  4 Start_Stop_Count        -O--CK   098   098   020    -    2402
  5 Reallocated_Sector_Ct   PO--CK   100   100   036    -    0
  7 Seek_Error_Rate         POSR--   078   065   030    -    74613951
  9 Power_On_Hours          -O--CK   094   094   000    -    5970 (152 206 0)
 10 Spin_Retry_Count        PO--C-   100   100   097    -    0
 12 Power_Cycle_Count       -O--CK   099   099   020    -    1977
184 End-to-End_Error        -O--CK   100   100   099    -    0
187 Reported_Uncorrect      -O--CK   001   001   000    -    19254
188 Command_Timeout         -O--CK   100   100   000    -    10
189 High_Fly_Writes         -O-RCK   100   100   000    -    0
190 Airflow_Temperature_Cel -O---K   064   052   045    -    36 (Min/Max 36/37)
191 G-Sense_Error_Rate      -O--CK   100   100   000    -    85
192 Power-Off_Retract_Count -O--CK   100   100   000    -    4
193 Load_Cycle_Count        -O--CK   002   002   000    -    197528
194 Temperature_Celsius     -O---K   036   048   000    -    36 (0 16 0 0 0)
195 Hardware_ECC_Recovered  -O-RC-   059   050   000    -    239670511
196 Reallocated_Event_Count POSR--   095   095   030    -    4800 (13480 0)
197 Current_Pending_Sector  -O--C-   100   100   000    -    0
198 Offline_Uncorrectable   ----C-   100   100   000    -    0
199 UDMA_CRC_Error_Count    -OSRCK   200   200   000    -    0
                            ||||||_ K auto-keep
                            |||||__ C event count
                            ||||___ R error rate
                            |||____ S speed/performance
                            ||_____ O updated online
                            |______ P prefailure warning

General Purpose Log Directory Version 1
SMART           Log Directory Version 1 [multi-sector log support]
Address    Access  R/W   Size  Description
0x00       GPL,SL  R/O      1  Log Directory
0x01       GPL,SL  R/O      1  Summary SMART error log
0x02       GPL,SL  R/O      5  Comprehensive SMART error log
0x03       GPL,SL  R/O      5  Ext. Comprehensive SMART error log
0x06       GPL,SL  R/O      1  SMART self-test log
0x07       GPL,SL  R/O      1  Extended self-test log
0x09       GPL,SL  R/W      1  Selective self-test log
0x10       GPL,SL  R/O      1  NCQ Command Error log
0x11       GPL,SL  R/O      1  SATA Phy Event Counters log
0x21       GPL,SL  R/O      1  Write stream error log
0x22       GPL,SL  R/O      1  Read stream error log
0x80-0x9f  GPL,SL  R/W     16  Host vendor specific log
0xa1       GPL,SL  VS      20  Device vendor specific log
0xa2       GPL     VS    2248  Device vendor specific log
0xa8       GPL,SL  VS      65  Device vendor specific log
0xa9       GPL,SL  VS       1  Device vendor specific log
0xb0       GPL     VS    2864  Device vendor specific log
0xbe-0xbf  GPL     VS   65535  Device vendor specific log
0xe0       GPL,SL  R/W      1  SCT Command/Status
0xe1       GPL,SL  R/W      1  SCT Data Transfer

SMART Extended Comprehensive Error Log Version: 1 (5 sectors)
Device Error Count: 20760 (device log contains only the most recent 20 errors)
	CR     = Command Register
	FEATR  = Features Register
	COUNT  = Count (was: Sector Count) Register
	LBA_48 = Upper bytes of LBA High/Mid/Low Registers ]  ATA-8
	LH     = LBA High (was: Cylinder High) Register    ]   LBA
	LM     = LBA Mid (was: Cylinder Low) Register      ] Register
	LL     = LBA Low (was: Sector Number) Register     ]
	DV     = Device (was: Device/Head) Register
	DC     = Device Control Register
	ER     = Error register
	ST     = Status register
Powered_Up_Time is measured from power on, and printed as
DDd+hh:mm:SS.sss where DD=days, hh=hours, mm=minutes,
SS=sec, and sss=millisec. It "wraps" after 49.710 days.

Error 20760 [19] occurred at disk power-on lifetime: 5922 hours (246 days + 18 hours)
  When the command that caused the error occurred, the device was active or idle.

  After command completion occurred, registers were:
  ER -- ST COUNT  LBA_48  LH LM LL DV DC
  -- -- -- == -- == == == -- -- -- -- --
  40 -- 51 00 00 00 00 00 02 e7 51 00 00  Error: UNC at LBA = 0x0002e751 = 190289

  Commands leading to the command that caused the error were:
  CR FEATR COUNT  LBA_48  LH LM LL DV DC  Powered_Up_Time  Command/Feature_Name
  -- == -- == -- == == == -- -- -- -- --  ---------------  --------------------
  60 00 00 00 80 00 00 00 02 eb 80 40 00     00:56:07.860  READ FPDMA QUEUED
  60 00 00 00 80 00 00 00 02 eb 00 40 00     00:56:07.857  READ FPDMA QUEUED
  60 00 00 00 80 00 00 00 02 ea 80 40 00     00:56:07.856  READ FPDMA QUEUED
  60 00 00 00 80 00 00 00 02 e7 00 40 00     00:56:07.829  READ FPDMA QUEUED
  60 00 00 00 80 00 00 00 02 ea 00 40 00     00:56:07.827  READ FPDMA QUEUED

Error 20759 [18] occurred at disk power-on lifetime: 5922 hours (246 days + 18 hours)
  When the command that caused the error occurred, the device was active or idle.

  After command completion occurred, registers were:
  ER -- ST COUNT  LBA_48  LH LM LL DV DC
  -- -- -- == -- == == == -- -- -- -- --
  40 -- 51 00 00 00 00 00 02 e7 51 00 00  Error: WP at LBA = 0x0002e751 = 190289

  Commands leading to the command that caused the error were:
  CR FEATR COUNT  LBA_48  LH LM LL DV DC  Powered_Up_Time  Command/Feature_Name
  -- == -- == -- == == == -- -- -- -- --  ---------------  --------------------
  61 00 00 00 08 00 00 00 0f fe 00 40 00     00:56:05.516  WRITE FPDMA QUEUED
  61 00 00 00 08 00 00 00 71 81 50 40 00     00:56:05.516  WRITE FPDMA QUEUED
  61 00 00 00 08 00 00 00 6b 65 e8 40 00     00:56:05.516  WRITE FPDMA QUEUED
  61 00 00 00 08 00 00 00 6b 65 d8 40 00     00:56:05.515  WRITE FPDMA QUEUED
  61 00 00 00 08 00 00 00 6b 65 e0 40 00     00:56:05.515  WRITE FPDMA QUEUED

Error 20758 [17] occurred at disk power-on lifetime: 5922 hours (246 days + 18 hours)
  When the command that caused the error occurred, the device was active or idle.

  After command completion occurred, registers were:
  ER -- ST COUNT  LBA_48  LH LM LL DV DC
  -- -- -- == -- == == == -- -- -- -- --
  40 -- 51 00 00 00 00 00 02 e7 51 00 00  Error: WP at LBA = 0x0002e751 = 190289

  Commands leading to the command that caused the error were:
  CR FEATR COUNT  LBA_48  LH LM LL DV DC  Powered_Up_Time  Command/Feature_Name
  -- == -- == -- == == == -- -- -- -- --  ---------------  --------------------
  61 00 00 00 08 00 00 00 0f fe 00 40 00     00:56:03.142  WRITE FPDMA QUEUED
  61 00 00 00 08 00 00 00 71 81 50 40 00     00:56:03.142  WRITE FPDMA QUEUED
  61 00 00 00 08 00 00 00 6b 65 e8 40 00     00:56:03.141  WRITE FPDMA QUEUED
  60 00 00 00 80 00 00 00 02 e9 80 40 00     00:56:03.141  READ FPDMA QUEUED
  61 00 00 00 08 00 00 00 5f d2 60 40 00     00:56:03.141  WRITE FPDMA QUEUED

Error 20757 [16] occurred at disk power-on lifetime: 5922 hours (246 days + 18 hours)
  When the command that caused the error occurred, the device was active or idle.

  After command completion occurred, registers were:
  ER -- ST COUNT  LBA_48  LH LM LL DV DC
  -- -- -- == -- == == == -- -- -- -- --
  40 -- 51 00 00 00 00 00 02 e7 51 00 00  Error: WP at LBA = 0x0002e751 = 190289

  Commands leading to the command that caused the error were:
  CR FEATR COUNT  LBA_48  LH LM LL DV DC  Powered_Up_Time  Command/Feature_Name
  -- == -- == -- == == == -- -- -- -- --  ---------------  --------------------
  61 00 00 00 08 00 00 00 0f fe 00 40 00     00:56:00.849  WRITE FPDMA QUEUED
  61 00 00 00 08 00 00 00 71 81 50 40 00     00:56:00.849  WRITE FPDMA QUEUED
  61 00 00 00 08 00 00 00 6b 65 e0 40 00     00:56:00.848  WRITE FPDMA QUEUED
  60 00 00 00 80 00 00 00 02 e7 00 40 00     00:56:00.848  READ FPDMA QUEUED
  61 00 00 00 01 00 00 00 5f 8d d0 40 00     00:56:00.848  WRITE FPDMA QUEUED

Error 20756 [15] occurred at disk power-on lifetime: 5922 hours (246 days + 18 hours)
  When the command that caused the error occurred, the device was active or idle.

  After command completion occurred, registers were:
  ER -- ST COUNT  LBA_48  LH LM LL DV DC
  -- -- -- == -- == == == -- -- -- -- --
  40 -- 51 00 00 00 00 00 02 e7 51 00 00  Error: WP at LBA = 0x0002e751 = 190289

  Commands leading to the command that caused the error were:
  CR FEATR COUNT  LBA_48  LH LM LL DV DC  Powered_Up_Time  Command/Feature_Name
  -- == -- == -- == == == -- -- -- -- --  ---------------  --------------------
  61 00 00 00 08 00 00 00 0f fe 00 40 00     00:55:58.489  WRITE FPDMA QUEUED
  61 00 00 00 08 00 00 00 71 81 50 40 00     00:55:58.489  WRITE FPDMA QUEUED
  61 00 00 00 08 00 00 00 6b 65 e8 40 00     00:55:58.488  WRITE FPDMA QUEUED
  61 00 00 00 08 00 00 02 d1 8b c1 40 00     00:55:58.488  WRITE FPDMA QUEUED
  61 00 00 00 08 00 00 02 d1 8b b9 40 00     00:55:58.487  WRITE FPDMA QUEUED

Error 20755 [14] occurred at disk power-on lifetime: 5922 hours (246 days + 18 hours)
  When the command that caused the error occurred, the device was active or idle.

  After command completion occurred, registers were:
  ER -- ST COUNT  LBA_48  LH LM LL DV DC
  -- -- -- == -- == == == -- -- -- -- --
  40 -- 51 00 00 00 00 00 02 e7 51 00 00  Error: WP at LBA = 0x0002e751 = 190289

  Commands leading to the command that caused the error were:
  CR FEATR COUNT  LBA_48  LH LM LL DV DC  Powered_Up_Time  Command/Feature_Name
  -- == -- == -- == == == -- -- -- -- --  ---------------  --------------------
  61 00 00 00 08 00 00 00 6b 65 e8 40 00     00:55:56.209  WRITE FPDMA QUEUED
  60 00 00 00 80 00 00 00 02 e7 00 40 00     00:55:56.208  READ FPDMA QUEUED
  61 00 00 00 8f 00 00 00 15 3b 70 40 00     00:55:56.207  WRITE FPDMA QUEUED
  61 00 00 01 00 00 00 00 15 3a 70 40 00     00:55:56.207  WRITE FPDMA QUEUED
  60 00 00 00 80 00 00 00 02 e8 80 40 00     00:55:56.206  READ FPDMA QUEUED

Error 20754 [13] occurred at disk power-on lifetime: 5922 hours (246 days + 18 hours)
  When the command that caused the error occurred, the device was active or idle.

  After command completion occurred, registers were:
  ER -- ST COUNT  LBA_48  LH LM LL DV DC
  -- -- -- == -- == == == -- -- -- -- --
  40 -- 51 00 00 00 00 00 02 e7 51 00 00  Error: WP at LBA = 0x0002e751 = 190289

  Commands leading to the command that caused the error were:
  CR FEATR COUNT  LBA_48  LH LM LL DV DC  Powered_Up_Time  Command/Feature_Name
  -- == -- == -- == == == -- -- -- -- --  ---------------  --------------------
  61 00 00 00 08 00 00 00 71 81 58 40 00     00:55:53.902  WRITE FPDMA QUEUED
  61 00 00 00 08 00 00 00 6b 65 e0 40 00     00:55:53.902  WRITE FPDMA QUEUED
  61 00 00 00 08 00 00 00 71 81 48 40 00     00:55:53.901  WRITE FPDMA QUEUED
  61 00 00 00 08 00 00 00 71 0e 00 40 00     00:55:53.901  WRITE FPDMA QUEUED
  60 00 00 00 80 00 00 00 02 e7 00 40 00     00:55:53.900  READ FPDMA QUEUED

Error 20753 [12] occurred at disk power-on lifetime: 5922 hours (246 days + 18 hours)
  When the command that caused the error occurred, the device was active or idle.

  After command completion occurred, registers were:
  ER -- ST COUNT  LBA_48  LH LM LL DV DC
  -- -- -- == -- == == == -- -- -- -- --
  40 -- 51 00 00 00 00 00 02 e7 51 00 00  Error: WP at LBA = 0x0002e751 = 190289

  Commands leading to the command that caused the error were:
  CR FEATR COUNT  LBA_48  LH LM LL DV DC  Powered_Up_Time  Command/Feature_Name
  -- == -- == -- == == == -- -- -- -- --  ---------------  --------------------
  61 00 00 00 08 00 00 00 6b 65 e8 40 00     00:55:51.585  WRITE FPDMA QUEUED
  61 00 00 00 08 00 00 00 6b a4 10 40 00     00:55:51.585  WRITE FPDMA QUEUED
  61 00 00 00 10 00 00 02 51 6a a0 40 00     00:55:51.582  WRITE FPDMA QUEUED
  61 00 00 00 08 00 00 00 71 82 48 40 00     00:55:51.581  WRITE FPDMA QUEUED
  60 00 00 00 80 00 00 00 02 e8 00 40 00     00:55:51.581  READ FPDMA QUEUED

SMART Extended Self-test Log Version: 1 (1 sectors)
Num  Test_Description    Status                  Remaining  LifeTime(hours)  LBA_of_first_error
# 1  Extended offline    Completed without error       00%        19         -
# 2  Extended offline    Completed without error       00%        14         -
# 3  Short offline       Aborted by host               20%        13         -
# 4  Extended offline    Completed without error       00%        12         -
# 5  Conveyance offline  Completed without error       00%         9         -
# 6  Extended offline    Completed without error       00%         8         -
# 7  Short offline       Completed without error       00%         7         -

SMART Selective self-test log data structure revision number 1
 SPAN  MIN_LBA  MAX_LBA  CURRENT_TEST_STATUS
    1        0        0  Not_testing
    2        0        0  Not_testing
    3        0        0  Not_testing
    4        0        0  Not_testing
    5        0        0  Not_testing
Selective self-test flags (0x0):
  After scanning selected spans, do NOT read-scan remainder of disk.
If Selective self-test is pending on power-up, resume after 0 minute delay.

SCT Status Version:                  3
SCT Version (vendor specific):       522 (0x020a)
Device State:                        Active (0)
Current Temperature:                    36 Celsius
Power Cycle Min/Max Temperature:     36/37 Celsius
Lifetime    Min/Max Temperature:     15/48 Celsius
Under/Over Temperature Limit Count:   0/1
Vendor specific:
00 00 00 00 00 00 00 00 00 00 02 00 00 00 00 00
00 00 00 00 00 00 00 00 00 00 00 00 00 00 00 00

SCT Temperature History Version:     2
Temperature Sampling Period:         10 minutes
Temperature Logging Interval:        11 minutes
Min/Max recommended Temperature:      0/ 0 Celsius
Min/Max Temperature Limit:            0/ 0 Celsius
Temperature History Size (Index):    128 (113)

SCT Error Recovery Control:
           Read: Disabled
          Write: Disabled

Device Statistics (GP/SMART Log 0x04) not supported

Pending Defects log (GP Log 0x0c) not supported

SATA Phy Event Counters (GP Log 0x11)
ID      Size     Value  Description
0x000a  2            2  Device-to-host register FISes sent due to a COMRESET
0x0001  2            0  Command failed due to ICRC error
0x0003  2            0  R_ERR response for device-to-host data FIS
0x0004  2            0  R_ERR response for host-to-device data FIS
0x0006  2            0  R_ERR response for device-to-host non-data FIS
0x0007  2            0  R_ERR response for host-to-device non-data FIS

