smartctl 7.1 2019-12-30 r5022 [x86_64-linux-5.4.83-generic-2rosa-x86_64] (local build)
Copyright (C) 2002-19, Bruce Allen, Christian Franke, www.smartmontools.org

=== START OF INFORMATION SECTION ===
Model Family:     Seagate Momentus 5400.6
Device Model:     ST9250315AS
Serial Number:    --
LU WWN Device Id: 5 000c50 ...
Firmware Version: 0001SDM1
User Capacity:    250,059,350,016 bytes [250 GB]
Sector Size:      512 bytes logical/physical
Rotation Rate:    5400 rpm
Device is:        In smartctl database [for details use: -P show]
ATA Version is:   ATA8-ACS T13/1699-D revision 4
SATA Version is:  SATA 2.6, 3.0 Gb/s
Local Time is:    Tue Feb 23 18:31:17 2021 MSK
SMART support is: Available - device has SMART capability.
SMART support is: Enabled
AAM feature is:   Unavailable
APM level is:     128 (minimum power consumption without standby)
Rd look-ahead is: Enabled
Write cache is:   Enabled
DSN feature is:   Unavailable
ATA Security is:  Disabled, frozen [SEC2]
Wt Cache Reorder: Unknown

=== START OF READ SMART DATA SECTION ===
SMART overall-health self-assessment test result: PASSED
See vendor-specific Attribute list for marginal Attributes.

General SMART Values:
Offline data collection status:  (0x00)	Offline data collection activity
					was never started.
					Auto Offline Data Collection: Disabled.
Self-test execution status:      (   0)	The previous self-test routine completed
					without error or no self-test has ever 
					been run.
Total time to complete Offline 
data collection: 		(    0) seconds.
Offline data collection
capabilities: 			 (0x73) SMART execute Offline immediate.
					Auto Offline data collection on/off support.
					Suspend Offline collection upon new
					command.
					No Offline surface scan supported.
					Self-test supported.
					Conveyance Self-test supported.
					Selective Self-test supported.
SMART capabilities:            (0x0003)	Saves SMART data before entering
					power-saving mode.
					Supports SMART auto save timer.
Error logging capability:        (0x01)	Error logging supported.
					General Purpose Logging supported.
Short self-test routine 
recommended polling time: 	 (   1) minutes.
Extended self-test routine
recommended polling time: 	 (  72) minutes.
Conveyance self-test routine
recommended polling time: 	 (   2) minutes.
SCT capabilities: 	       (0x103b)	SCT Status supported.
					SCT Error Recovery Control supported.
					SCT Feature Control supported.
					SCT Data Table supported.

SMART Attributes Data Structure revision number: 10
Vendor Specific SMART Attributes with Thresholds:
ID# ATTRIBUTE_NAME          FLAGS    VALUE WORST THRESH FAIL RAW_VALUE
  1 Raw_Read_Error_Rate     POSR--   118   086   006    -    171398137
  3 Spin_Up_Time            PO----   099   099   000    -    0
  4 Start_Stop_Count        -O--CK   097   097   020    -    3842
  5 Reallocated_Sector_Ct   PO--CK   097   097   036    -    79
  7 Seek_Error_Rate         POSR--   086   060   030    -    416183522
  9 Power_On_Hours          -O--CK   086   086   000    -    13124
 10 Spin_Retry_Count        PO--C-   100   100   097    -    0
 12 Power_Cycle_Count       -O--CK   097   037   020    -    3575
184 End-to-End_Error        -O--CK   100   100   099    -    0
187 Reported_Uncorrect      -O--CK   001   001   000    -    1481
188 Command_Timeout         -O--CK   100   099   000    -    8590065694
189 High_Fly_Writes         -O-RCK   100   100   000    -    0
190 Airflow_Temperature_Cel -O---K   052   026   045    Past 48 (Min/Max 26/48 #20562)
191 G-Sense_Error_Rate      -O--CK   100   100   000    -    201
192 Power-Off_Retract_Count -O--CK   100   100   000    -    8
193 Load_Cycle_Count        -O--CK   063   063   000    -    74354
194 Temperature_Celsius     -O---K   048   074   000    -    48 (0 15 0 0 0)
195 Hardware_ECC_Recovered  -O-RC-   050   041   000    -    171398137
197 Current_Pending_Sector  -O--C-   100   100   000    -    0
198 Offline_Uncorrectable   ----C-   100   100   000    -    0
199 UDMA_CRC_Error_Count    -OSRCK   200   200   000    -    0
254 Free_Fall_Sensor        -O--CK   100   100   000    -    0
                            ||||||_ K auto-keep
                            |||||__ C event count
                            ||||___ R error rate
                            |||____ S speed/performance
                            ||_____ O updated online
                            |______ P prefailure warning

General Purpose Log Directory Version 1
SMART           Log Directory Version 1 [multi-sector log support]
Address    Access  R/W   Size  Description
0x00       GPL,SL  R/O      1  Log Directory
0x01       GPL,SL  R/O      1  Summary SMART error log
0x02       GPL,SL  R/O      5  Comprehensive SMART error log
0x03       GPL,SL  R/O      5  Ext. Comprehensive SMART error log
0x06       GPL,SL  R/O      1  SMART self-test log
0x07       GPL,SL  R/O      1  Extended self-test log
0x09       GPL,SL  R/W      1  Selective self-test log
0x10       GPL,SL  R/O      1  NCQ Command Error log
0x11       GPL,SL  R/O      1  SATA Phy Event Counters log
0x21       GPL,SL  R/O      1  Write stream error log
0x22       GPL,SL  R/O      1  Read stream error log
0x80-0x9f  GPL,SL  R/W     16  Host vendor specific log
0xa1       GPL,SL  VS      20  Device vendor specific log
0xa2       GPL     VS    2248  Device vendor specific log
0xa8       GPL,SL  VS      65  Device vendor specific log
0xa9       GPL,SL  VS       1  Device vendor specific log
0xb0       GPL     VS    2864  Device vendor specific log
0xbe-0xbf  GPL     VS   65535  Device vendor specific log
0xe0       GPL,SL  R/W      1  SCT Command/Status
0xe1       GPL,SL  R/W      1  SCT Data Transfer

SMART Extended Comprehensive Error Log Version: 1 (5 sectors)
Device Error Count: 1594 (device log contains only the most recent 20 errors)
	CR     = Command Register
	FEATR  = Features Register
	COUNT  = Count (was: Sector Count) Register
	LBA_48 = Upper bytes of LBA High/Mid/Low Registers ]  ATA-8
	LH     = LBA High (was: Cylinder High) Register    ]   LBA
	LM     = LBA Mid (was: Cylinder Low) Register      ] Register
	LL     = LBA Low (was: Sector Number) Register     ]
	DV     = Device (was: Device/Head) Register
	DC     = Device Control Register
	ER     = Error register
	ST     = Status register
Powered_Up_Time is measured from power on, and printed as
DDd+hh:mm:SS.sss where DD=days, hh=hours, mm=minutes,
SS=sec, and sss=millisec. It "wraps" after 49.710 days.

Error 1594 [13] occurred at disk power-on lifetime: 13023 hours (542 days + 15 hours)
  When the command that caused the error occurred, the device was active or idle.

  After command completion occurred, registers were:
  ER -- ST COUNT  LBA_48  LH LM LL DV DC
  -- -- -- == -- == == == -- -- -- -- --
  40 -- 51 00 00 00 00 10 5d e1 21 00 00  Error: WP at LBA = 0x105de121 = 274587937

  Commands leading to the command that caused the error were:
  CR FEATR COUNT  LBA_48  LH LM LL DV DC  Powered_Up_Time  Command/Feature_Name
  -- == -- == -- == == == -- -- -- -- --  ---------------  --------------------
  61 00 00 01 00 00 00 0b fa 81 20 40 00     00:06:59.047  WRITE FPDMA QUEUED
  60 00 00 00 08 00 00 10 5d e1 20 40 00     00:06:59.045  READ FPDMA QUEUED
  61 00 00 00 08 00 00 06 62 a1 b8 40 00     00:06:59.045  WRITE FPDMA QUEUED
  61 00 00 01 00 00 00 0b fa 84 20 40 00     00:06:59.045  WRITE FPDMA QUEUED
  61 00 00 01 00 00 00 0b fa 83 20 40 00     00:06:59.044  WRITE FPDMA QUEUED

Error 1593 [12] occurred at disk power-on lifetime: 13023 hours (542 days + 15 hours)
  When the command that caused the error occurred, the device was active or idle.

  After command completion occurred, registers were:
  ER -- ST COUNT  LBA_48  LH LM LL DV DC
  -- -- -- == -- == == == -- -- -- -- --
  40 -- 51 00 00 00 00 10 5d e1 21 00 00  Error: WP at LBA = 0x105de121 = 274587937

  Commands leading to the command that caused the error were:
  CR FEATR COUNT  LBA_48  LH LM LL DV DC  Powered_Up_Time  Command/Feature_Name
  -- == -- == -- == == == -- -- -- -- --  ---------------  --------------------
  61 00 00 00 08 00 00 06 62 a1 b8 40 00     00:06:56.157  WRITE FPDMA QUEUED
  61 00 00 01 00 00 00 0b fa 84 20 40 00     00:06:56.156  WRITE FPDMA QUEUED
  61 00 00 01 00 00 00 0b fa 83 20 40 00     00:06:56.155  WRITE FPDMA QUEUED
  61 00 00 01 00 00 00 0b fa 82 20 40 00     00:06:56.155  WRITE FPDMA QUEUED
  61 00 00 01 00 00 00 0b fa 81 20 40 00     00:06:56.155  WRITE FPDMA QUEUED

Error 1592 [11] occurred at disk power-on lifetime: 13023 hours (542 days + 15 hours)
  When the command that caused the error occurred, the device was active or idle.

  After command completion occurred, registers were:
  ER -- ST COUNT  LBA_48  LH LM LL DV DC
  -- -- -- == -- == == == -- -- -- -- --
  40 -- 51 00 00 00 00 10 5d e1 21 00 00  Error: UNC at LBA = 0x105de121 = 274587937

  Commands leading to the command that caused the error were:
  CR FEATR COUNT  LBA_48  LH LM LL DV DC  Powered_Up_Time  Command/Feature_Name
  -- == -- == -- == == == -- -- -- -- --  ---------------  --------------------
  60 00 00 00 08 00 00 10 5d e1 20 40 00     00:06:53.505  READ FPDMA QUEUED
  60 00 00 00 08 00 00 01 db 2b 08 40 00     00:06:53.479  READ FPDMA QUEUED
  60 00 00 00 08 00 00 01 db 2b 00 40 00     00:06:53.479  READ FPDMA QUEUED
  60 00 00 00 08 00 00 10 5a c6 b8 40 00     00:06:53.479  READ FPDMA QUEUED
  60 00 00 00 08 00 00 10 5a c6 b0 40 00     00:06:53.478  READ FPDMA QUEUED

Error 1591 [10] occurred at disk power-on lifetime: 13023 hours (542 days + 15 hours)
  When the command that caused the error occurred, the device was active or idle.

  After command completion occurred, registers were:
  ER -- ST COUNT  LBA_48  LH LM LL DV DC
  -- -- -- == -- == == == -- -- -- -- --
  40 -- 51 00 00 00 00 10 5d e1 00 00 00  Error: WP at LBA = 0x105de100 = 274587904

  Commands leading to the command that caused the error were:
  CR FEATR COUNT  LBA_48  LH LM LL DV DC  Powered_Up_Time  Command/Feature_Name
  -- == -- == -- == == == -- -- -- -- --  ---------------  --------------------
  61 00 00 01 00 00 00 0b fa 4c 20 40 00     00:06:44.100  WRITE FPDMA QUEUED
  61 00 00 01 00 00 00 0b fa 4b 20 40 00     00:06:44.100  WRITE FPDMA QUEUED
  61 00 00 01 00 00 00 0b fa 4a 20 40 00     00:06:44.100  WRITE FPDMA QUEUED
  61 00 00 01 00 00 00 0b fa 49 20 40 00     00:06:44.099  WRITE FPDMA QUEUED
  61 00 00 01 00 00 00 0b fa 48 20 40 00     00:06:44.099  WRITE FPDMA QUEUED

Error 1590 [9] occurred at disk power-on lifetime: 13023 hours (542 days + 15 hours)
  When the command that caused the error occurred, the device was active or idle.

  After command completion occurred, registers were:
  ER -- ST COUNT  LBA_48  LH LM LL DV DC
  -- -- -- == -- == == == -- -- -- -- --
  40 -- 51 00 00 00 00 10 5d e1 00 00 00  Error: UNC at LBA = 0x105de100 = 274587904

  Commands leading to the command that caused the error were:
  CR FEATR COUNT  LBA_48  LH LM LL DV DC  Powered_Up_Time  Command/Feature_Name
  -- == -- == -- == == == -- -- -- -- --  ---------------  --------------------
  60 00 00 00 08 00 00 10 5d e1 00 40 00     00:06:41.491  READ FPDMA QUEUED
  60 00 00 00 08 00 00 10 5a b3 18 40 00     00:06:41.490  READ FPDMA QUEUED
  60 00 00 00 08 00 00 10 5a b3 10 40 00     00:06:41.490  READ FPDMA QUEUED
  60 00 00 00 08 00 00 10 5a b3 08 40 00     00:06:41.490  READ FPDMA QUEUED
  60 00 00 00 08 00 00 10 5a b3 00 40 00     00:06:41.489  READ FPDMA QUEUED

Error 1589 [8] occurred at disk power-on lifetime: 13023 hours (542 days + 15 hours)
  When the command that caused the error occurred, the device was active or idle.

  After command completion occurred, registers were:
  ER -- ST COUNT  LBA_48  LH LM LL DV DC
  -- -- -- == -- == == == -- -- -- -- --
  40 -- 51 00 00 00 00 10 5d e0 fd 00 00  Error: UNC at LBA = 0x105de0fd = 274587901

  Commands leading to the command that caused the error were:
  CR FEATR COUNT  LBA_48  LH LM LL DV DC  Powered_Up_Time  Command/Feature_Name
  -- == -- == -- == == == -- -- -- -- --  ---------------  --------------------
  60 00 00 00 20 00 00 10 5d e0 e0 40 00     00:06:06.283  READ FPDMA QUEUED
  ef 00 02 00 00 00 00 00 00 00 00 00 00     00:06:06.279  SET FEATURES [Enable write cache]
  00 00 00 00 00 00 00 00 00 00 00 00 ff     00:06:06.175  NOP [Abort queued commands]
  60 00 00 00 20 00 00 10 5d e0 e0 40 00     00:06:03.774  READ FPDMA QUEUED
  ef 00 02 00 00 00 00 00 00 00 00 00 00     00:06:03.752  SET FEATURES [Enable write cache]

Error 1588 [7] occurred at disk power-on lifetime: 13023 hours (542 days + 15 hours)
  When the command that caused the error occurred, the device was active or idle.

  After command completion occurred, registers were:
  ER -- ST COUNT  LBA_48  LH LM LL DV DC
  -- -- -- == -- == == == -- -- -- -- --
  40 -- 51 00 00 00 00 10 5d e0 e8 00 00  Error: UNC at LBA = 0x105de0e8 = 274587880

  Commands leading to the command that caused the error were:
  CR FEATR COUNT  LBA_48  LH LM LL DV DC  Powered_Up_Time  Command/Feature_Name
  -- == -- == -- == == == -- -- -- -- --  ---------------  --------------------
  60 00 00 00 20 00 00 10 5d e0 e0 40 00     00:06:03.774  READ FPDMA QUEUED
  ef 00 02 00 00 00 00 00 00 00 00 00 00     00:06:03.752  SET FEATURES [Enable write cache]
  00 00 00 00 00 00 00 00 00 00 00 00 ff     00:06:03.665  NOP [Abort queued commands]
  60 00 00 00 20 00 00 10 5d e0 e0 40 00     00:06:01.265  READ FPDMA QUEUED
  ef 00 02 00 00 00 00 00 00 00 00 00 00     00:06:01.240  SET FEATURES [Enable write cache]

Error 1587 [6] occurred at disk power-on lifetime: 13023 hours (542 days + 15 hours)
  When the command that caused the error occurred, the device was active or idle.

  After command completion occurred, registers were:
  ER -- ST COUNT  LBA_48  LH LM LL DV DC
  -- -- -- == -- == == == -- -- -- -- --
  40 -- 51 00 00 00 00 10 5d e0 e8 00 00  Error: UNC at LBA = 0x105de0e8 = 274587880

  Commands leading to the command that caused the error were:
  CR FEATR COUNT  LBA_48  LH LM LL DV DC  Powered_Up_Time  Command/Feature_Name
  -- == -- == -- == == == -- -- -- -- --  ---------------  --------------------
  60 00 00 00 20 00 00 10 5d e0 e0 40 00     00:06:01.265  READ FPDMA QUEUED
  ef 00 02 00 00 00 00 00 00 00 00 00 00     00:06:01.240  SET FEATURES [Enable write cache]
  00 00 00 00 00 00 00 00 00 00 00 00 ff     00:06:01.165  NOP [Abort queued commands]
  60 00 00 00 20 00 00 10 5d e0 e0 40 00     00:05:55.905  READ FPDMA QUEUED
  ef 00 02 00 00 00 00 00 00 00 00 00 00     00:05:55.890  SET FEATURES [Enable write cache]

SMART Extended Self-test Log Version: 1 (1 sectors)
No self-tests have been logged.  [To run self-tests, use: smartctl -t]

SMART Selective self-test log data structure revision number 1
 SPAN  MIN_LBA  MAX_LBA  CURRENT_TEST_STATUS
    1        0        0  Not_testing
    2        0        0  Not_testing
    3        0        0  Not_testing
    4        0        0  Not_testing
    5        0        0  Not_testing
Selective self-test flags (0x0):
  After scanning selected spans, do NOT read-scan remainder of disk.
If Selective self-test is pending on power-up, resume after 0 minute delay.

SCT Status Version:                  3
SCT Version (vendor specific):       522 (0x020a)
Device State:                        Active (0)
Current Temperature:                    48 Celsius
Power Cycle Min/Max Temperature:     26/48 Celsius
Lifetime    Min/Max Temperature:     15/74 Celsius
Under/Over Temperature Limit Count:   0/84

SCT Temperature History Version:     2
Temperature Sampling Period:         1 minute
Temperature Logging Interval:        1 minute
Min/Max recommended Temperature:      0/ 0 Celsius
Min/Max Temperature Limit:            0/ 0 Celsius
Temperature History Size (Index):    128 (56)

SCT Error Recovery Control:
           Read: Disabled
          Write: Disabled

Device Statistics (GP/SMART Log 0x04) not supported

Pending Defects log (GP Log 0x0c) not supported

SATA Phy Event Counters (GP Log 0x11)
ID      Size     Value  Description
0x000a  2            8  Device-to-host register FISes sent due to a COMRESET
0x0001  2            0  Command failed due to ICRC error
0x0003  2            0  R_ERR response for device-to-host data FIS
0x0004  2            0  R_ERR response for host-to-device data FIS
0x0006  2            0  R_ERR response for device-to-host non-data FIS
0x0007  2            0  R_ERR response for host-to-device non-data FIS

