=== START OF INFORMATION SECTION ===
Model Family:     Seagate Momentus 5400.6
Device Model:     ST9250315AS
Serial Number:    --
LU WWN Device Id: 5 000c50 ...
Firmware Version: 0002SDM1
User Capacity:    250,059,350,016 bytes [250 GB]
Sector Size:      512 bytes logical/physical
Rotation Rate:    5400 rpm
Device is:        In smartctl database [for details use: -P show]
ATA Version is:   ATA8-ACS T13/1699-D revision 4
SATA Version is:  SATA 2.6, 3.0 Gb/s
Local Time is:    Mon Jan  6 00:15:14 2020 MSK
SMART support is: Available - device has SMART capability.
SMART support is: Enabled
AAM feature is:   Unavailable
APM level is:     128 (minimum power consumption without standby)
Rd look-ahead is: Enabled
Write cache is:   Enabled
DSN feature is:   Unavailable
ATA Security is:  Disabled, frozen [SEC2]
Wt Cache Reorder: Unknown

=== START OF READ SMART DATA SECTION ===
SMART overall-health self-assessment test result: PASSED
See vendor-specific Attribute list for marginal Attributes.

General SMART Values:
Offline data collection status:  (0x00)	Offline data collection activity
					was never started.
					Auto Offline Data Collection: Disabled.
Self-test execution status:      (   0)	The previous self-test routine completed
					without error or no self-test has ever 
					been run.
Total time to complete Offline 
data collection: 		(    0) seconds.
Offline data collection
capabilities: 			 (0x73) SMART execute Offline immediate.
					Auto Offline data collection on/off support.
					Suspend Offline collection upon new
					command.
					No Offline surface scan supported.
					Self-test supported.
					Conveyance Self-test supported.
					Selective Self-test supported.
SMART capabilities:            (0x0003)	Saves SMART data before entering
					power-saving mode.
					Supports SMART auto save timer.
Error logging capability:        (0x01)	Error logging supported.
					General Purpose Logging supported.
Short self-test routine 
recommended polling time: 	 (   1) minutes.
Extended self-test routine
recommended polling time: 	 (  72) minutes.
Conveyance self-test routine
recommended polling time: 	 (   2) minutes.
SCT capabilities: 	       (0x103b)	SCT Status supported.
					SCT Error Recovery Control supported.
					SCT Feature Control supported.
					SCT Data Table supported.

SMART Attributes Data Structure revision number: 10
Vendor Specific SMART Attributes with Thresholds:
ID# ATTRIBUTE_NAME          FLAGS    VALUE WORST THRESH FAIL RAW_VALUE
  1 Raw_Read_Error_Rate     POSR--   116   099   006    -    104978326
  3 Spin_Up_Time            PO----   099   099   000    -    0
  4 Start_Stop_Count        -O--CK   086   086   020    -    14487
  5 Reallocated_Sector_Ct   PO--CK   100   100   036    -    5
  7 Seek_Error_Rate         POSR--   075   060   030    -    4334741434
  9 Power_On_Hours          -O--CK   067   067   000    -    29491
 10 Spin_Retry_Count        PO--C-   100   100   097    -    0
 12 Power_Cycle_Count       -O--CK   096   037   020    -    4782
184 End-to-End_Error        -O--CK   100   100   099    -    0
187 Reported_Uncorrect      -O--CK   082   082   000    -    18
188 Command_Timeout         -O--CK   100   067   000    -    335012561733
189 High_Fly_Writes         -O-RCK   100   100   000    -    0
190 Airflow_Temperature_Cel -O---K   066   038   045    Past 34 (1 133 34 32 0)
191 G-Sense_Error_Rate      -O--CK   100   100   000    -    12
192 Power-Off_Retract_Count -O--CK   100   100   000    -    1181
193 Load_Cycle_Count        -O--CK   007   007   000    -    187650
194 Temperature_Celsius     -O---K   034   062   000    -    34 (0 2 0 0 0)
195 Hardware_ECC_Recovered  -O-RC-   053   039   000    -    104978326
197 Current_Pending_Sector  -O--C-   100   100   000    -    0
198 Offline_Uncorrectable   ----C-   100   100   000    -    0
199 UDMA_CRC_Error_Count    -OSRCK   200   200   000    -    0
254 Free_Fall_Sensor        -O--CK   100   100   000    -    0
                            ||||||_ K auto-keep
                            |||||__ C event count
                            ||||___ R error rate
                            |||____ S speed/performance
                            ||_____ O updated online
                            |______ P prefailure warning

General Purpose Log Directory Version 1
SMART           Log Directory Version 1 [multi-sector log support]
Address    Access  R/W   Size  Description
0x00       GPL,SL  R/O      1  Log Directory
0x01       GPL,SL  R/O      1  Summary SMART error log
0x02       GPL,SL  R/O      5  Comprehensive SMART error log
0x03       GPL,SL  R/O      5  Ext. Comprehensive SMART error log
0x06       GPL,SL  R/O      1  SMART self-test log
0x07       GPL,SL  R/O      1  Extended self-test log
0x09       GPL,SL  R/W      1  Selective self-test log
0x10       GPL,SL  R/O      1  NCQ Command Error log
0x11       GPL,SL  R/O      1  SATA Phy Event Counters log
0x21       GPL,SL  R/O      1  Write stream error log
0x22       GPL,SL  R/O      1  Read stream error log
0x80-0x9f  GPL,SL  R/W     16  Host vendor specific log
0xa1       GPL,SL  VS      20  Device vendor specific log
0xa2       GPL     VS    2248  Device vendor specific log
0xa8       GPL,SL  VS      65  Device vendor specific log
0xa9       GPL,SL  VS       1  Device vendor specific log
0xb0       GPL     VS    2864  Device vendor specific log
0xbe-0xbf  GPL     VS   65535  Device vendor specific log
0xe0       GPL,SL  R/W      1  SCT Command/Status
0xe1       GPL,SL  R/W      1  SCT Data Transfer

SMART Extended Comprehensive Error Log Version: 1 (5 sectors)
Device Error Count: 24 (device log contains only the most recent 20 errors)
	CR     = Command Register
	FEATR  = Features Register
	COUNT  = Count (was: Sector Count) Register
	LBA_48 = Upper bytes of LBA High/Mid/Low Registers ]  ATA-8
	LH     = LBA High (was: Cylinder High) Register    ]   LBA
	LM     = LBA Mid (was: Cylinder Low) Register      ] Register
	LL     = LBA Low (was: Sector Number) Register     ]
	DV     = Device (was: Device/Head) Register
	DC     = Device Control Register
	ER     = Error register
	ST     = Status register
Powered_Up_Time is measured from power on, and printed as
DDd+hh:mm:SS.sss where DD=days, hh=hours, mm=minutes,
SS=sec, and sss=millisec. It "wraps" after 49.710 days.

Error 24 [3] occurred at disk power-on lifetime: 15290 hours (637 days + 2 hours)
  When the command that caused the error occurred, the device was active or idle.

  After command completion occurred, registers were:
  ER -- ST COUNT  LBA_48  LH LM LL DV DC
  -- -- -- == -- == == == -- -- -- -- --
  40 -- 51 00 00 00 00 00 00 5e 3c 00 00  Error: UNC at LBA = 0x00005e3c = 24124

  Commands leading to the command that caused the error were:
  CR FEATR COUNT  LBA_48  LH LM LL DV DC  Powered_Up_Time  Command/Feature_Name
  -- == -- == -- == == == -- -- -- -- --  ---------------  --------------------
  25 00 00 00 08 00 00 00 00 5e 37 e0 00     00:00:46.206  READ DMA EXT
  25 00 00 00 08 00 00 00 00 5e 37 e0 00     00:00:43.862  READ DMA EXT
  25 00 00 00 08 00 00 00 00 5e 37 e0 00     00:00:41.474  READ DMA EXT
  25 00 00 00 08 00 00 00 00 5e 37 e0 00     00:00:39.140  READ DMA EXT
  25 00 00 00 08 00 00 00 00 5e 37 e0 00     00:00:36.763  READ DMA EXT

Error 23 [2] occurred at disk power-on lifetime: 15290 hours (637 days + 2 hours)
  When the command that caused the error occurred, the device was active or idle.

  After command completion occurred, registers were:
  ER -- ST COUNT  LBA_48  LH LM LL DV DC
  -- -- -- == -- == == == -- -- -- -- --
  40 -- 51 00 00 00 00 00 00 5e 3c 00 00  Error: UNC at LBA = 0x00005e3c = 24124

  Commands leading to the command that caused the error were:
  CR FEATR COUNT  LBA_48  LH LM LL DV DC  Powered_Up_Time  Command/Feature_Name
  -- == -- == -- == == == -- -- -- -- --  ---------------  --------------------
  25 00 00 00 08 00 00 00 00 5e 37 e0 00     00:00:43.862  READ DMA EXT
  25 00 00 00 08 00 00 00 00 5e 37 e0 00     00:00:41.474  READ DMA EXT
  25 00 00 00 08 00 00 00 00 5e 37 e0 00     00:00:39.140  READ DMA EXT
  25 00 00 00 08 00 00 00 00 5e 37 e0 00     00:00:36.763  READ DMA EXT
  25 00 00 00 08 00 00 00 00 5e 37 e0 00     00:00:34.430  READ DMA EXT

Error 22 [1] occurred at disk power-on lifetime: 15290 hours (637 days + 2 hours)
  When the command that caused the error occurred, the device was active or idle.

  After command completion occurred, registers were:
  ER -- ST COUNT  LBA_48  LH LM LL DV DC
  -- -- -- == -- == == == -- -- -- -- --
  40 -- 51 00 00 00 00 00 00 5e 3c 00 00  Error: UNC at LBA = 0x00005e3c = 24124

  Commands leading to the command that caused the error were:
  CR FEATR COUNT  LBA_48  LH LM LL DV DC  Powered_Up_Time  Command/Feature_Name
  -- == -- == -- == == == -- -- -- -- --  ---------------  --------------------
  25 00 00 00 08 00 00 00 00 5e 37 e0 00     00:00:41.474  READ DMA EXT
  25 00 00 00 08 00 00 00 00 5e 37 e0 00     00:00:39.140  READ DMA EXT
  25 00 00 00 08 00 00 00 00 5e 37 e0 00     00:00:36.763  READ DMA EXT
  25 00 00 00 08 00 00 00 00 5e 37 e0 00     00:00:34.430  READ DMA EXT
  25 00 00 00 08 00 00 00 00 5e 37 e0 00     00:00:32.041  READ DMA EXT

Error 21 [0] occurred at disk power-on lifetime: 15290 hours (637 days + 2 hours)
  When the command that caused the error occurred, the device was active or idle.

  After command completion occurred, registers were:
  ER -- ST COUNT  LBA_48  LH LM LL DV DC
  -- -- -- == -- == == == -- -- -- -- --
  40 -- 51 00 00 00 00 00 00 5e 3c 00 00  Error: UNC at LBA = 0x00005e3c = 24124

  Commands leading to the command that caused the error were:
  CR FEATR COUNT  LBA_48  LH LM LL DV DC  Powered_Up_Time  Command/Feature_Name
  -- == -- == -- == == == -- -- -- -- --  ---------------  --------------------
  25 00 00 00 08 00 00 00 00 5e 37 e0 00     00:00:39.140  READ DMA EXT
  25 00 00 00 08 00 00 00 00 5e 37 e0 00     00:00:36.763  READ DMA EXT
  25 00 00 00 08 00 00 00 00 5e 37 e0 00     00:00:34.430  READ DMA EXT
  25 00 00 00 08 00 00 00 00 5e 37 e0 00     00:00:32.041  READ DMA EXT
  25 00 00 00 08 00 00 00 00 5e 37 e0 00     00:00:29.708  READ DMA EXT

Error 20 [19] occurred at disk power-on lifetime: 15290 hours (637 days + 2 hours)
  When the command that caused the error occurred, the device was active or idle.

  After command completion occurred, registers were:
  ER -- ST COUNT  LBA_48  LH LM LL DV DC
  -- -- -- == -- == == == -- -- -- -- --
  40 -- 51 00 00 00 00 00 00 5e 3c 00 00  Error: UNC at LBA = 0x00005e3c = 24124

  Commands leading to the command that caused the error were:
  CR FEATR COUNT  LBA_48  LH LM LL DV DC  Powered_Up_Time  Command/Feature_Name
  -- == -- == -- == == == -- -- -- -- --  ---------------  --------------------
  25 00 00 00 08 00 00 00 00 5e 37 e0 00     00:00:36.763  READ DMA EXT
  25 00 00 00 08 00 00 00 00 5e 37 e0 00     00:00:34.430  READ DMA EXT
  25 00 00 00 08 00 00 00 00 5e 37 e0 00     00:00:32.041  READ DMA EXT
  25 00 00 00 08 00 00 00 00 5e 37 e0 00     00:00:29.708  READ DMA EXT
  25 00 00 00 08 00 00 00 00 5e 37 e0 00     00:00:27.342  READ DMA EXT

Error 19 [18] occurred at disk power-on lifetime: 15290 hours (637 days + 2 hours)
  When the command that caused the error occurred, the device was active or idle.

  After command completion occurred, registers were:
  ER -- ST COUNT  LBA_48  LH LM LL DV DC
  -- -- -- == -- == == == -- -- -- -- --
  40 -- 51 00 00 00 00 00 00 5e 3c 00 00  Error: UNC at LBA = 0x00005e3c = 24124

  Commands leading to the command that caused the error were:
  CR FEATR COUNT  LBA_48  LH LM LL DV DC  Powered_Up_Time  Command/Feature_Name
  -- == -- == -- == == == -- -- -- -- --  ---------------  --------------------
  25 00 00 00 08 00 00 00 00 5e 37 e0 00     00:00:34.430  READ DMA EXT
  25 00 00 00 08 00 00 00 00 5e 37 e0 00     00:00:32.041  READ DMA EXT
  25 00 00 00 08 00 00 00 00 5e 37 e0 00     00:00:29.708  READ DMA EXT
  25 00 00 00 08 00 00 00 00 5e 37 e0 00     00:00:27.342  READ DMA EXT
  25 00 00 00 08 00 00 00 00 5e 37 e0 00     00:00:25.020  READ DMA EXT

Error 18 [17] occurred at disk power-on lifetime: 15290 hours (637 days + 2 hours)
  When the command that caused the error occurred, the device was active or idle.

  After command completion occurred, registers were:
  ER -- ST COUNT  LBA_48  LH LM LL DV DC
  -- -- -- == -- == == == -- -- -- -- --
  40 -- 51 00 00 00 00 00 00 5e 3c 00 00  Error: UNC at LBA = 0x00005e3c = 24124

  Commands leading to the command that caused the error were:
  CR FEATR COUNT  LBA_48  LH LM LL DV DC  Powered_Up_Time  Command/Feature_Name
  -- == -- == -- == == == -- -- -- -- --  ---------------  --------------------
  25 00 00 00 08 00 00 00 00 5e 37 e0 00     00:00:32.041  READ DMA EXT
  25 00 00 00 08 00 00 00 00 5e 37 e0 00     00:00:29.708  READ DMA EXT
  25 00 00 00 08 00 00 00 00 5e 37 e0 00     00:00:27.342  READ DMA EXT
  25 00 00 00 08 00 00 00 00 5e 37 e0 00     00:00:25.020  READ DMA EXT
  25 00 00 00 08 00 00 00 00 5e 37 e0 00     00:00:22.643  READ DMA EXT

Error 17 [16] occurred at disk power-on lifetime: 15290 hours (637 days + 2 hours)
  When the command that caused the error occurred, the device was active or idle.

  After command completion occurred, registers were:
  ER -- ST COUNT  LBA_48  LH LM LL DV DC
  -- -- -- == -- == == == -- -- -- -- --
  40 -- 51 00 00 00 00 00 00 5e 3c 00 00  Error: UNC at LBA = 0x00005e3c = 24124

  Commands leading to the command that caused the error were:
  CR FEATR COUNT  LBA_48  LH LM LL DV DC  Powered_Up_Time  Command/Feature_Name
  -- == -- == -- == == == -- -- -- -- --  ---------------  --------------------
  25 00 00 00 08 00 00 00 00 5e 37 e0 00     00:00:29.708  READ DMA EXT
  25 00 00 00 08 00 00 00 00 5e 37 e0 00     00:00:27.342  READ DMA EXT
  25 00 00 00 08 00 00 00 00 5e 37 e0 00     00:00:25.020  READ DMA EXT
  25 00 00 00 08 00 00 00 00 5e 37 e0 00     00:00:22.643  READ DMA EXT
  25 00 00 00 08 00 00 00 00 5e 37 e0 00     00:00:20.299  READ DMA EXT

SMART Extended Self-test Log Version: 1 (1 sectors)
Num  Test_Description    Status                  Remaining  LifeTime(hours)  LBA_of_first_error
# 1  Extended offline    Completed without error       00%     29146         -
# 2  Extended offline    Completed without error       00%     29012         -
# 3  Extended offline    Completed without error       00%     28743         -
# 4  Extended offline    Interrupted (host reset)      00%     25688         -
# 5  Short offline       Completed without error       00%         1         -

SMART Selective self-test log data structure revision number 1
 SPAN  MIN_LBA  MAX_LBA  CURRENT_TEST_STATUS
    1        0        0  Not_testing
    2        0        0  Not_testing
    3        0        0  Not_testing
    4        0        0  Not_testing
    5        0        0  Not_testing
Selective self-test flags (0x0):
  After scanning selected spans, do NOT read-scan remainder of disk.
If Selective self-test is pending on power-up, resume after 0 minute delay.

SCT Status Version:                  3
SCT Version (vendor specific):       522 (0x020a)
SCT Support Level:                   1
Device State:                        Active (0)
Current Temperature:                    34 Celsius
Power Cycle Min/Max Temperature:     32/34 Celsius
Lifetime    Min/Max Temperature:      2/62 Celsius
Under/Over Temperature Limit Count:   0/4

SCT Temperature History Version:     2
Temperature Sampling Period:         1 minute
Temperature Logging Interval:        1 minute
Min/Max recommended Temperature:      0/ 0 Celsius
Min/Max Temperature Limit:            0/ 0 Celsius
Temperature History Size (Index):    128 (49)

SCT Error Recovery Control:
           Read: Disabled
          Write: Disabled

Device Statistics (GP/SMART Log 0x04) not supported

Pending Defects log (GP Log 0x0c) not supported

SATA Phy Event Counters (GP Log 0x11)
ID      Size     Value  Description
0x000a  2            4  Device-to-host register FISes sent due to a COMRESET
0x0001  2            0  Command failed due to ICRC error
0x0003  2            0  R_ERR response for device-to-host data FIS
0x0004  2            0  R_ERR response for host-to-device data FIS
0x0006  2            0  R_ERR response for device-to-host non-data FIS
0x0007  2            0  R_ERR response for host-to-device non-data FIS

