smartctl 7.3 2022-02-28 r5338 [x86_64-linux-5.18.3-arch1-1] (local build)
Copyright (C) 2002-22, Bruce Allen, Christian Franke, www.smartmontools.org

=== START OF INFORMATION SECTION ===
Model Family:     Seagate Archive HDD (SMR)
Device Model:     ST8000AS0002-1NA17Z
Serial Number:    --
LU WWN Device Id: 5 000c50 ...
Firmware Version: RT17
User Capacity:    8,001,563,222,016 bytes [8.00 TB]
Sector Sizes:     512 bytes logical, 4096 bytes physical
Rotation Rate:    5980 rpm
Device is:        In smartctl database 7.3/5319
ATA Version is:   ACS-2, ACS-3 T13/2161-D revision 3b
SATA Version is:  SATA 3.1, 6.0 Gb/s (current: 6.0 Gb/s)
Local Time is:    Sun Jun 12 06:16:49 2022 PDT
SMART support is: Available - device has SMART capability.
SMART support is: Enabled
AAM feature is:   Unavailable
APM feature is:   Unavailable
Rd look-ahead is: Enabled
Write cache is:   Enabled
DSN feature is:   Unavailable
ATA Security is:  Disabled, NOT FROZEN [SEC1]
Wt Cache Reorder: Enabled

=== START OF READ SMART DATA SECTION ===
SMART overall-health self-assessment test result: PASSED
See vendor-specific Attribute list for marginal Attributes.

General SMART Values:
Offline data collection status:  (0x82)	Offline data collection activity
					was completed without error.
					Auto Offline Data Collection: Enabled.
Self-test execution status:      (   0)	The previous self-test routine completed
					without error or no self-test has ever 
					been run.
Total time to complete Offline 
data collection: 		(    0) seconds.
Offline data collection
capabilities: 			 (0x7b) SMART execute Offline immediate.
					Auto Offline data collection on/off support.
					Suspend Offline collection upon new
					command.
					Offline surface scan supported.
					Self-test supported.
					Conveyance Self-test supported.
					Selective Self-test supported.
SMART capabilities:            (0x0003)	Saves SMART data before entering
					power-saving mode.
					Supports SMART auto save timer.
Error logging capability:        (0x01)	Error logging supported.
					General Purpose Logging supported.
Short self-test routine 
recommended polling time: 	 (   1) minutes.
Extended self-test routine
recommended polling time: 	 ( 942) minutes.
Conveyance self-test routine
recommended polling time: 	 (   2) minutes.
SCT capabilities: 	       (0x30b5)	SCT Status supported.
					SCT Feature Control supported.
					SCT Data Table supported.

SMART Attributes Data Structure revision number: 10
Vendor Specific SMART Attributes with Thresholds:
ID# ATTRIBUTE_NAME          FLAGS    VALUE WORST THRESH FAIL RAW_VALUE
  1 Raw_Read_Error_Rate     POSR--   117   099   006    -    145620496
  3 Spin_Up_Time            PO----   090   090   000    -    0
  4 Start_Stop_Count        -O--CK   088   088   020    -    12858
  5 Reallocated_Sector_Ct   PO--CK   100   100   010    -    0
  7 Seek_Error_Rate         POSR--   070   060   030    -    68895009761
  9 Power_On_Hours          -O--CK   053   053   000    -    41449
 10 Spin_Retry_Count        PO--C-   100   100   097    -    0
 12 Power_Cycle_Count       -O--CK   098   098   020    -    2048
183 Runtime_Bad_Block       -O--CK   100   100   000    -    0
184 End-to-End_Error        -O--CK   100   100   099    -    0
187 Reported_Uncorrect      -O--CK   097   097   000    -    3
188 Command_Timeout         -O--CK   100   066   000    -    597009829431
189 High_Fly_Writes         -O-RCK   100   100   000    -    0
190 Airflow_Temperature_Cel -O---K   072   044   045    Past 28 (0 31 34 24 0)
191 G-Sense_Error_Rate      -O--CK   100   100   000    -    0
192 Power-Off_Retract_Count -O--CK   095   095   000    -    10457
193 Load_Cycle_Count        -O--CK   082   082   000    -    36600
194 Temperature_Celsius     -O---K   028   056   000    -    28 (0 15 0 0 0)
195 Hardware_ECC_Recovered  -O-RC-   117   099   000    -    145620496
197 Current_Pending_Sector  -O--C-   089   001   000    -    3904
198 Offline_Uncorrectable   ----C-   089   001   000    -    3904
199 UDMA_CRC_Error_Count    -OSRCK   200   200   000    -    1
240 Head_Flying_Hours       ------   100   253   000    -    5293 (38 49 0)
241 Total_LBAs_Written      ------   100   253   000    -    83017592384
242 Total_LBAs_Read         ------   100   253   000    -    1466411741519
                            ||||||_ K auto-keep
                            |||||__ C event count
                            ||||___ R error rate
                            |||____ S speed/performance
                            ||_____ O updated online
                            |______ P prefailure warning

General Purpose Log Directory Version 1
SMART           Log Directory Version 1 [multi-sector log support]
Address    Access  R/W   Size  Description
0x00       GPL,SL  R/O      1  Log Directory
0x01           SL  R/O      1  Summary SMART error log
0x02           SL  R/O      5  Comprehensive SMART error log
0x03       GPL     R/O      5  Ext. Comprehensive SMART error log
0x04       GPL,SL  R/O      8  Device Statistics log
0x06           SL  R/O      1  SMART self-test log
0x07       GPL     R/O      1  Extended self-test log
0x08       GPL     R/O      8  Power Conditions log
0x09           SL  R/W      1  Selective self-test log
0x10       GPL     R/O      1  NCQ Command Error log
0x11       GPL     R/O      1  SATA Phy Event Counters log
0x21       GPL     R/O      8  Write stream error log
0x22       GPL     R/O      8  Read stream error log
0x24       GPL     R/O    512  Current Device Internal Status Data log
0x30       GPL,SL  R/O      9  IDENTIFY DEVICE data log
0x80-0x9f  GPL,SL  R/W     16  Host vendor specific log
0xa1       GPL,SL  VS      24  Device vendor specific log
0xa2       GPL     VS    8160  Device vendor specific log
0xa8-0xa9  GPL,SL  VS     136  Device vendor specific log
0xab       GPL     VS       1  Device vendor specific log
0xb0       GPL     VS    9048  Device vendor specific log
0xbe-0xbf  GPL     VS   65528  Device vendor specific log
0xc0       GPL,SL  VS       1  Device vendor specific log
0xc1       GPL,SL  VS      16  Device vendor specific log
0xd1       GPL     VS      80  Device vendor specific log
0xd3       GPL     VS    1920  Device vendor specific log
0xda       GPL,SL  VS       8  Device vendor specific log
0xe0       GPL,SL  R/W      1  SCT Command/Status
0xe1       GPL,SL  R/W      1  SCT Data Transfer

SMART Extended Comprehensive Error Log Version: 1 (5 sectors)
Device Error Count: 3
	CR     = Command Register
	FEATR  = Features Register
	COUNT  = Count (was: Sector Count) Register
	LBA_48 = Upper bytes of LBA High/Mid/Low Registers ]  ATA-8
	LH     = LBA High (was: Cylinder High) Register    ]   LBA
	LM     = LBA Mid (was: Cylinder Low) Register      ] Register
	LL     = LBA Low (was: Sector Number) Register     ]
	DV     = Device (was: Device/Head) Register
	DC     = Device Control Register
	ER     = Error register
	ST     = Status register
Powered_Up_Time is measured from power on, and printed as
DDd+hh:mm:SS.sss where DD=days, hh=hours, mm=minutes,
SS=sec, and sss=millisec. It "wraps" after 49.710 days.

Error 3 [2] occurred at disk power-on lifetime: 26509 hours (1104 days + 13 hours)
  When the command that caused the error occurred, the device was active or idle.

  After command completion occurred, registers were:
  ER -- ST COUNT  LBA_48  LH LM LL DV DC
  -- -- -- == -- == == == -- -- -- -- --
  40 -- 51 00 00 00 03 88 ef d9 d0 00 00  Error: UNC at LBA = 0x388efd9d0 = 15182322128

  Commands leading to the command that caused the error were:
  CR FEATR COUNT  LBA_48  LH LM LL DV DC  Powered_Up_Time  Command/Feature_Name
  -- == -- == -- == == == -- -- -- -- --  ---------------  --------------------
  60 00 00 00 08 00 03 88 ef d9 d0 40 00     14:19:07.790  READ FPDMA QUEUED
  25 00 00 01 00 00 03 88 ef da d0 40 00     14:19:04.330  READ DMA EXT
  e1 00 00 00 0f 00 00 00 00 00 00 00 00     14:19:04.298  IDLE IMMEDIATE
  ef 00 03 00 46 00 00 00 00 00 00 00 00     14:19:04.298  SET FEATURES [Set transfer mode]
  ef 00 02 00 00 00 00 00 00 00 00 00 00     14:19:04.298  SET FEATURES [Enable write cache]

Error 2 [1] occurred at disk power-on lifetime: 26509 hours (1104 days + 13 hours)
  When the command that caused the error occurred, the device was active or idle.

  After command completion occurred, registers were:
  ER -- ST COUNT  LBA_48  LH LM LL DV DC
  -- -- -- == -- == == == -- -- -- -- --
  40 -- 51 00 00 00 03 88 ef da d0 00 00  Error: UNC at LBA = 0x388efdad0 = 15182322384

  Commands leading to the command that caused the error were:
  CR FEATR COUNT  LBA_48  LH LM LL DV DC  Powered_Up_Time  Command/Feature_Name
  -- == -- == -- == == == -- -- -- -- --  ---------------  --------------------
  25 00 00 01 00 00 03 88 ef da d0 40 00     14:19:04.330  READ DMA EXT
  e1 00 00 00 0f 00 00 00 00 00 00 00 00     14:19:04.298  IDLE IMMEDIATE
  ef 00 03 00 46 00 00 00 00 00 00 00 00     14:19:04.298  SET FEATURES [Set transfer mode]
  ef 00 02 00 00 00 00 00 00 00 00 00 00     14:19:04.298  SET FEATURES [Enable write cache]
  e1 00 00 00 02 00 00 00 00 00 00 00 00     14:19:03.622  IDLE IMMEDIATE

Error 1 [0] occurred at disk power-on lifetime: 26509 hours (1104 days + 13 hours)
  When the command that caused the error occurred, the device was active or idle.

  After command completion occurred, registers were:
  ER -- ST COUNT  LBA_48  LH LM LL DV DC
  -- -- -- == -- == == == -- -- -- -- --
  40 -- 51 00 00 00 03 88 ef d9 d0 00 00  Error: UNC at LBA = 0x388efd9d0 = 15182322128

  Commands leading to the command that caused the error were:
  CR FEATR COUNT  LBA_48  LH LM LL DV DC  Powered_Up_Time  Command/Feature_Name
  -- == -- == -- == == == -- -- -- -- --  ---------------  --------------------
  60 00 00 01 00 00 03 88 ef da d0 40 00     14:18:58.530  READ FPDMA QUEUED
  60 00 00 01 00 00 03 88 ac 9a d0 40 00     14:18:35.787  READ FPDMA QUEUED
  60 00 00 01 00 00 03 88 ac 99 d0 40 00     14:18:35.785  READ FPDMA QUEUED
  60 00 00 01 00 00 03 88 ac 98 d0 40 00     14:18:35.784  READ FPDMA QUEUED
  60 00 00 01 00 00 03 88 ac 97 d0 40 00     14:18:35.782  READ FPDMA QUEUED

SMART Extended Self-test Log Version: 1 (1 sectors)
Num  Test_Description    Status                  Remaining  LifeTime(hours)  LBA_of_first_error
# 1  Short offline       Completed without error       00%     40776         -

SMART Selective self-test log data structure revision number 1
 SPAN  MIN_LBA  MAX_LBA  CURRENT_TEST_STATUS
    1        0        0  Not_testing
    2        0        0  Not_testing
    3        0        0  Not_testing
    4        0        0  Not_testing
    5        0        0  Not_testing
Selective self-test flags (0x0):
  After scanning selected spans, do NOT read-scan remainder of disk.
If Selective self-test is pending on power-up, resume after 0 minute delay.

SCT Status Version:                  3
SCT Version (vendor specific):       522 (0x020a)
Device State:                        Active (0)
Current Temperature:                    28 Celsius
Power Cycle Min/Max Temperature:     24/35 Celsius
Lifetime    Min/Max Temperature:     15/56 Celsius
Under/Over Temperature Limit Count:   0/0

SCT Temperature History Version:     2
Temperature Sampling Period:         3 minutes
Temperature Logging Interval:        59 minutes
Min/Max recommended Temperature:     14/55 Celsius
Min/Max Temperature Limit:           10/60 Celsius
Temperature History Size (Index):    128 (7)

SCT Error Recovery Control command not supported

Device Statistics (GP Log 0x04)
Page  Offset Size        Value Flags Description
0x01  =====  =               =  ===  == General Statistics (rev 1) ==
0x01  0x008  4            2048  ---  Lifetime Power-On Resets
0x01  0x010  4           41449  ---  Power-on Hours
0x01  0x018  6     83513547837  ---  Logical Sectors Written
0x01  0x020  6       143813616  ---  Number of Write Commands
0x01  0x028  6   1470705144658  ---  Logical Sectors Read
0x01  0x030  6       343524687  ---  Number of Read Commands
0x01  0x038  6               -  ---  Date and Time TimeStamp
0x03  =====  =               =  ===  == Rotating Media Statistics (rev 1) ==
0x03  0x008  4            3709  N--  Spindle Motor Power-on Hours
0x03  0x010  4             394  N--  Head Flying Hours
0x03  0x018  4           36600  ---  Head Load Events
0x03  0x020  4               0  ---  Number of Reallocated Logical Sectors
0x03  0x028  4               0  ---  Read Recovery Attempts
0x03  0x030  4               0  ---  Number of Mechanical Start Failures
0x04  =====  =               =  ===  == General Errors Statistics (rev 1) ==
0x04  0x008  4               3  ---  Number of Reported Uncorrectable Errors
0x04  0x010  4            3628  ---  Resets Between Cmd Acceptance and Completion
0x05  =====  =               =  ===  == Temperature Statistics (rev 1) ==
0x05  0x008  1              28  N--  Current Temperature
0x05  0x010  1              27  N--  Average Short Term Temperature
0x05  0x018  1              27  N--  Average Long Term Temperature
0x05  0x020  1              56  N--  Highest Temperature
0x05  0x028  1              15  N--  Lowest Temperature
0x05  0x030  1              51  N--  Highest Average Short Term Temperature
0x05  0x038  1               1  N--  Lowest Average Short Term Temperature
0x05  0x040  1              50  N--  Highest Average Long Term Temperature
0x05  0x048  1               0  N--  Lowest Average Long Term Temperature
0x05  0x050  4              16  ---  Time in Over-Temperature
0x05  0x058  1              55  ---  Specified Maximum Operating Temperature
0x05  0x060  4               0  ---  Time in Under-Temperature
0x05  0x068  1              13  ---  Specified Minimum Operating Temperature
                                |||_ C monitored condition met
                                ||__ D supports DSN
                                |___ N normalized value

Pending Defects log (GP Log 0x0c) not supported

SATA Phy Event Counters (GP Log 0x11)
ID      Size     Value  Description
0x000a  2           32  Device-to-host register FISes sent due to a COMRESET
0x0001  2            0  Command failed due to ICRC error
0x0003  2            0  R_ERR response for device-to-host data FIS
0x0004  2            0  R_ERR response for host-to-device data FIS
0x0006  2            0  R_ERR response for device-to-host non-data FIS
0x0007  2            0  R_ERR response for host-to-device non-data FIS

