smartctl 7.3 2022-02-28 r5338 [x86_64-linux-6.5.0-14-generic] (local build)
Copyright (C) 2002-22, Bruce Allen, Christian Franke, www.smartmontools.org

=== START OF INFORMATION SECTION ===
Model Family:     Western Digital Blue
Device Model:     WDC WD40EZRZ-00WN9B0
Serial Number:    --
LU WWN Device Id: 5 0014ee ...
Firmware Version: 80.00A80
User Capacity:    4,000,787,030,016 bytes [4.00 TB]
Sector Sizes:     512 bytes logical, 4096 bytes physical
Rotation Rate:    5400 rpm
Device is:        In smartctl database 7.3/5319
ATA Version is:   ACS-2 (minor revision not indicated)
SATA Version is:  SATA 3.0, 6.0 Gb/s (current: 6.0 Gb/s)
Local Time is:    Tue Jan  2 00:44:47 2024 +03
SMART support is: Available - device has SMART capability.
SMART support is: Enabled
AAM feature is:   Unavailable
APM feature is:   Unavailable
Rd look-ahead is: Enabled
Write cache is:   Enabled
DSN feature is:   Unavailable
ATA Security is:  Disabled, frozen [SEC2]
Wt Cache Reorder: Enabled

=== START OF READ SMART DATA SECTION ===
SMART overall-health self-assessment test result: PASSED

General SMART Values:
Offline data collection status:  (0x82)	Offline data collection activity
					was completed without error.
					Auto Offline Data Collection: Enabled.
Self-test execution status:      (   0)	The previous self-test routine completed
					without error or no self-test has ever 
					been run.
Total time to complete Offline 
data collection: 		(51360) seconds.
Offline data collection
capabilities: 			 (0x7b) SMART execute Offline immediate.
					Auto Offline data collection on/off support.
					Suspend Offline collection upon new
					command.
					Offline surface scan supported.
					Self-test supported.
					Conveyance Self-test supported.
					Selective Self-test supported.
SMART capabilities:            (0x0003)	Saves SMART data before entering
					power-saving mode.
					Supports SMART auto save timer.
Error logging capability:        (0x01)	Error logging supported.
					General Purpose Logging supported.
Short self-test routine 
recommended polling time: 	 (   2) minutes.
Extended self-test routine
recommended polling time: 	 ( 513) minutes.
Conveyance self-test routine
recommended polling time: 	 (   5) minutes.
SCT capabilities: 	       (0x7035)	SCT Status supported.
					SCT Feature Control supported.
					SCT Data Table supported.

SMART Attributes Data Structure revision number: 16
Vendor Specific SMART Attributes with Thresholds:
ID# ATTRIBUTE_NAME          FLAGS    VALUE WORST THRESH FAIL RAW_VALUE
  1 Raw_Read_Error_Rate     POSR-K   200   200   051    -    58
  3 Spin_Up_Time            POS--K   212   167   021    -    6391
  4 Start_Stop_Count        -O--CK   095   095   000    -    5521
  5 Reallocated_Sector_Ct   PO--CK   200   200   140    -    0
  7 Seek_Error_Rate         -OSR-K   200   200   000    -    0
  9 Power_On_Hours          -O--CK   032   032   000    -    49978
 10 Spin_Retry_Count        -O--CK   100   100   000    -    0
 11 Calibration_Retry_Count -O--CK   100   100   000    -    0
 12 Power_Cycle_Count       -O--CK   097   097   000    -    3420
192 Power-Off_Retract_Count -O--CK   199   199   000    -    1084
193 Load_Cycle_Count        -O--CK   001   001   000    -    1250769
194 Temperature_Celsius     -O---K   112   098   000    -    40
196 Reallocated_Event_Count -O--CK   200   200   000    -    0
197 Current_Pending_Sector  -O--CK   200   200   000    -    5
198 Offline_Uncorrectable   ----CK   200   200   000    -    3
199 UDMA_CRC_Error_Count    -O--CK   200   200   000    -    1
200 Multi_Zone_Error_Rate   ---R--   200   199   000    -    3
                            ||||||_ K auto-keep
                            |||||__ C event count
                            ||||___ R error rate
                            |||____ S speed/performance
                            ||_____ O updated online
                            |______ P prefailure warning

General Purpose Log Directory Version 1
SMART           Log Directory Version 1 [multi-sector log support]
Address    Access  R/W   Size  Description
0x00       GPL,SL  R/O      1  Log Directory
0x01           SL  R/O      1  Summary SMART error log
0x02           SL  R/O      5  Comprehensive SMART error log
0x03       GPL     R/O      6  Ext. Comprehensive SMART error log
0x06           SL  R/O      1  SMART self-test log
0x07       GPL     R/O      1  Extended self-test log
0x09           SL  R/W      1  Selective self-test log
0x10       GPL     R/O      1  NCQ Command Error log
0x11       GPL     R/O      1  SATA Phy Event Counters log
0x80-0x9f  GPL,SL  R/W     16  Host vendor specific log
0xa0-0xa7  GPL,SL  VS      16  Device vendor specific log
0xa8-0xb6  GPL,SL  VS       1  Device vendor specific log
0xb7       GPL,SL  VS      39  Device vendor specific log
0xbd       GPL,SL  VS       1  Device vendor specific log
0xc0       GPL,SL  VS       1  Device vendor specific log
0xc1       GPL     VS      93  Device vendor specific log
0xe0       GPL,SL  R/W      1  SCT Command/Status
0xe1       GPL,SL  R/W      1  SCT Data Transfer

SMART Extended Comprehensive Error Log Version: 1 (6 sectors)
Device Error Count: 106 (device log contains only the most recent 24 errors)
	CR     = Command Register
	FEATR  = Features Register
	COUNT  = Count (was: Sector Count) Register
	LBA_48 = Upper bytes of LBA High/Mid/Low Registers ]  ATA-8
	LH     = LBA High (was: Cylinder High) Register    ]   LBA
	LM     = LBA Mid (was: Cylinder Low) Register      ] Register
	LL     = LBA Low (was: Sector Number) Register     ]
	DV     = Device (was: Device/Head) Register
	DC     = Device Control Register
	ER     = Error register
	ST     = Status register
Powered_Up_Time is measured from power on, and printed as
DDd+hh:mm:SS.sss where DD=days, hh=hours, mm=minutes,
SS=sec, and sss=millisec. It "wraps" after 49.710 days.

Error 106 [9] occurred at disk power-on lifetime: 47773 hours (1990 days + 13 hours)
  When the command that caused the error occurred, the device was active or idle.

  After command completion occurred, registers were:
  ER -- ST COUNT  LBA_48  LH LM LL DV DC
  -- -- -- == -- == == == -- -- -- -- --
  40 -- 51 00 00 00 00 91 15 f8 98 40 00  Error: UNC at LBA = 0x9115f898 = 2434136216

  Commands leading to the command that caused the error were:
  CR FEATR COUNT  LBA_48  LH LM LL DV DC  Powered_Up_Time  Command/Feature_Name
  -- == -- == -- == == == -- -- -- -- --  ---------------  --------------------
  60 00 08 00 a8 00 00 91 15 f8 98 40 08     11:23:01.411  READ FPDMA QUEUED
  ef 00 10 00 02 00 00 00 00 00 00 a0 08     11:23:01.411  SET FEATURES [Enable SATA feature]
  27 00 00 00 00 00 00 00 00 00 00 e0 08     11:23:01.411  READ NATIVE MAX ADDRESS EXT [OBS-ACS-3]
  ec 00 00 00 00 00 00 00 00 00 00 a0 08     11:23:01.411  IDENTIFY DEVICE
  ef 00 03 00 46 00 00 00 00 00 00 a0 08     11:23:01.411  SET FEATURES [Set transfer mode]

Error 105 [8] occurred at disk power-on lifetime: 47773 hours (1990 days + 13 hours)
  When the command that caused the error occurred, the device was active or idle.

  After command completion occurred, registers were:
  ER -- ST COUNT  LBA_48  LH LM LL DV DC
  -- -- -- == -- == == == -- -- -- -- --
  40 -- 51 00 00 00 00 91 15 f8 98 40 00  Error: UNC at LBA = 0x9115f898 = 2434136216

  Commands leading to the command that caused the error were:
  CR FEATR COUNT  LBA_48  LH LM LL DV DC  Powered_Up_Time  Command/Feature_Name
  -- == -- == -- == == == -- -- -- -- --  ---------------  --------------------
  60 00 08 00 d0 00 00 91 15 f8 98 40 08     11:22:58.009  READ FPDMA QUEUED
  60 00 08 00 c8 00 00 91 15 f8 90 40 08     11:22:58.009  READ FPDMA QUEUED
  60 00 08 00 c0 00 00 91 15 f8 88 40 08     11:22:58.009  READ FPDMA QUEUED
  60 00 08 00 b8 00 00 91 15 f8 80 40 08     11:22:58.009  READ FPDMA QUEUED
  60 00 08 00 b0 00 00 91 15 f8 78 40 08     11:22:58.009  READ FPDMA QUEUED

Error 104 [7] occurred at disk power-on lifetime: 47773 hours (1990 days + 13 hours)
  When the command that caused the error occurred, the device was active or idle.

  After command completion occurred, registers were:
  ER -- ST COUNT  LBA_48  LH LM LL DV DC
  -- -- -- == -- == == == -- -- -- -- --
  40 -- 51 00 00 00 00 91 15 f8 98 40 00  Error: UNC at LBA = 0x9115f898 = 2434136216

  Commands leading to the command that caused the error were:
  CR FEATR COUNT  LBA_48  LH LM LL DV DC  Powered_Up_Time  Command/Feature_Name
  -- == -- == -- == == == -- -- -- -- --  ---------------  --------------------
  60 01 00 00 90 00 00 91 15 f7 c0 40 08     11:22:54.577  READ FPDMA QUEUED
  60 01 00 00 88 00 00 91 15 f6 c0 40 08     11:22:54.577  READ FPDMA QUEUED
  60 01 00 00 80 00 00 91 15 f5 c0 40 08     11:22:54.576  READ FPDMA QUEUED
  60 01 00 00 78 00 00 91 15 f4 c0 40 08     11:22:54.575  READ FPDMA QUEUED
  60 01 00 00 70 00 00 91 15 f3 c0 40 08     11:22:54.574  READ FPDMA QUEUED

Error 103 [6] occurred at disk power-on lifetime: 47764 hours (1990 days + 4 hours)
  When the command that caused the error occurred, the device was active or idle.

  After command completion occurred, registers were:
  ER -- ST COUNT  LBA_48  LH LM LL DV DC
  -- -- -- == -- == == == -- -- -- -- --
  40 -- 51 00 00 00 00 91 15 f8 98 40 00  Error: UNC at LBA = 0x9115f898 = 2434136216

  Commands leading to the command that caused the error were:
  CR FEATR COUNT  LBA_48  LH LM LL DV DC  Powered_Up_Time  Command/Feature_Name
  -- == -- == -- == == == -- -- -- -- --  ---------------  --------------------
  60 00 08 00 48 00 00 91 15 f8 98 40 08     02:50:41.269  READ FPDMA QUEUED
  60 00 08 00 40 00 00 00 00 00 80 40 08     02:50:41.269  READ FPDMA QUEUED
  ef 00 10 00 02 00 00 00 00 00 00 a0 08     02:50:41.269  SET FEATURES [Enable SATA feature]
  27 00 00 00 00 00 00 00 00 00 00 e0 08     02:50:41.269  READ NATIVE MAX ADDRESS EXT [OBS-ACS-3]
  ec 00 00 00 00 00 00 00 00 00 00 a0 08     02:50:41.269  IDENTIFY DEVICE

Error 102 [5] occurred at disk power-on lifetime: 47764 hours (1990 days + 4 hours)
  When the command that caused the error occurred, the device was active or idle.

  After command completion occurred, registers were:
  ER -- ST COUNT  LBA_48  LH LM LL DV DC
  -- -- -- == -- == == == -- -- -- -- --
  40 -- 51 00 00 00 00 91 15 f8 98 40 00  Error: UNC at LBA = 0x9115f898 = 2434136216

  Commands leading to the command that caused the error were:
  CR FEATR COUNT  LBA_48  LH LM LL DV DC  Powered_Up_Time  Command/Feature_Name
  -- == -- == -- == == == -- -- -- -- --  ---------------  --------------------
  60 00 08 00 a0 00 00 91 15 f8 98 40 08     02:50:37.857  READ FPDMA QUEUED
  60 00 08 00 98 00 00 91 15 f8 90 40 08     02:50:37.857  READ FPDMA QUEUED
  60 00 08 00 90 00 00 91 15 f8 88 40 08     02:50:37.857  READ FPDMA QUEUED
  60 00 08 00 88 00 00 91 15 f8 80 40 08     02:50:37.857  READ FPDMA QUEUED
  60 00 08 00 80 00 00 91 15 f8 78 40 08     02:50:37.857  READ FPDMA QUEUED

Error 101 [4] occurred at disk power-on lifetime: 47764 hours (1990 days + 4 hours)
  When the command that caused the error occurred, the device was active or idle.

  After command completion occurred, registers were:
  ER -- ST COUNT  LBA_48  LH LM LL DV DC
  -- -- -- == -- == == == -- -- -- -- --
  40 -- 51 00 00 00 00 91 15 f8 98 40 00  Error: UNC at LBA = 0x9115f898 = 2434136216

  Commands leading to the command that caused the error were:
  CR FEATR COUNT  LBA_48  LH LM LL DV DC  Powered_Up_Time  Command/Feature_Name
  -- == -- == -- == == == -- -- -- -- --  ---------------  --------------------
  60 01 00 00 20 00 00 91 15 f8 18 40 08     02:50:34.370  READ FPDMA QUEUED
  60 01 00 00 18 00 00 91 15 f7 18 40 08     02:50:34.370  READ FPDMA QUEUED
  60 01 00 00 10 00 00 91 15 f6 18 40 08     02:50:34.369  READ FPDMA QUEUED
  60 01 00 00 08 00 00 91 15 f5 18 40 08     02:50:34.368  READ FPDMA QUEUED
  60 01 00 00 00 00 00 91 15 f4 18 40 08     02:50:34.367  READ FPDMA QUEUED

Error 100 [3] occurred at disk power-on lifetime: 47253 hours (1968 days + 21 hours)
  When the command that caused the error occurred, the device was active or idle.

  After command completion occurred, registers were:
  ER -- ST COUNT  LBA_48  LH LM LL DV DC
  -- -- -- == -- == == == -- -- -- -- --
  40 -- 51 00 00 00 00 91 16 04 b0 40 00  Error: UNC at LBA = 0x911604b0 = 2434139312

  Commands leading to the command that caused the error were:
  CR FEATR COUNT  LBA_48  LH LM LL DV DC  Powered_Up_Time  Command/Feature_Name
  -- == -- == -- == == == -- -- -- -- --  ---------------  --------------------
  60 00 08 00 68 00 00 91 16 04 b0 40 08  4d+21:03:12.508  READ FPDMA QUEUED
  60 00 08 00 28 00 00 91 16 0a 98 40 08  4d+21:03:12.508  READ FPDMA QUEUED
  60 00 08 00 18 00 00 8b 28 e8 00 40 08  4d+21:03:12.508  READ FPDMA QUEUED
  60 00 08 00 10 00 00 8c 62 91 18 40 08  4d+21:03:12.508  READ FPDMA QUEUED
  60 00 08 00 08 00 00 8e 7c d0 c0 40 08  4d+21:03:12.507  READ FPDMA QUEUED

Error 99 [2] occurred at disk power-on lifetime: 47253 hours (1968 days + 21 hours)
  When the command that caused the error occurred, the device was active or idle.

  After command completion occurred, registers were:
  ER -- ST COUNT  LBA_48  LH LM LL DV DC
  -- -- -- == -- == == == -- -- -- -- --
  40 -- 51 00 00 00 00 91 16 04 b0 40 00  Error: UNC at LBA = 0x911604b0 = 2434139312

  Commands leading to the command that caused the error were:
  CR FEATR COUNT  LBA_48  LH LM LL DV DC  Powered_Up_Time  Command/Feature_Name
  -- == -- == -- == == == -- -- -- -- --  ---------------  --------------------
  60 00 08 00 b0 00 00 91 16 05 78 40 08  4d+21:03:09.077  READ FPDMA QUEUED
  60 00 08 00 40 00 00 8b 28 e7 f8 40 08  4d+21:03:09.074  READ FPDMA QUEUED
  60 00 08 00 38 00 00 8b 28 e7 f0 40 08  4d+21:03:09.074  READ FPDMA QUEUED
  60 00 08 00 30 00 00 8b 28 e7 e8 40 08  4d+21:03:09.074  READ FPDMA QUEUED
  60 00 08 00 28 00 00 8b 28 e7 e0 40 08  4d+21:03:09.073  READ FPDMA QUEUED

SMART Extended Self-test Log Version: 1 (1 sectors)
Num  Test_Description    Status                  Remaining  LifeTime(hours)  LBA_of_first_error
# 1  Short offline       Completed without error       00%     38466         -
# 2  Conveyance offline  Completed without error       00%     37055         -
# 3  Short offline       Completed without error       00%     37055         -
# 4  Short offline       Completed: read failure       90%     36045         4822634832
# 5  Short offline       Completed: read failure       90%     36045         4822634832
# 6  Short captive       Completed: read failure       90%     36044         4822634832
# 7  Selective offline   Completed: read failure       90%     36044         4822634832
# 8  Selective offline   Completed: read failure       90%     36044         4822634832
# 9  Selective offline   Completed: read failure       90%     36044         4822634832
#10  Extended offline    Completed: read failure       90%     36033         4822632272
#11  Short offline       Completed: read failure       90%     36033         4822632272
#12  Short offline       Completed without error       00%     36005         -
#13  Short offline       Completed: read failure       90%     36005         3140659496
#14  Selective offline   Completed: read failure       90%     36005         3140659496
#15  Selective offline   Completed without error       00%     36005         -
#16  Selective offline   Completed: read failure       90%     36005         3140646916
#17  Selective offline   Completed without error       00%     36005         -
#18  Selective offline   Completed: read failure       90%     36005         3140653017

SMART Selective self-test log data structure revision number 1
 SPAN  MIN_LBA  MAX_LBA  CURRENT_TEST_STATUS
    1        0        0  Not_testing
    2        0        0  Not_testing
    3        0        0  Not_testing
    4        0        0  Not_testing
    5        0        0  Not_testing
Selective self-test flags (0x0):
  After scanning selected spans, do NOT read-scan remainder of disk.
If Selective self-test is pending on power-up, resume after 0 minute delay.

SCT Status Version:                  3
SCT Version (vendor specific):       258 (0x0102)
Device State:                        Active (0)
Current Temperature:                    40 Celsius
Power Cycle Min/Max Temperature:     33/40 Celsius
Lifetime    Min/Max Temperature:      3/54 Celsius
Under/Over Temperature Limit Count:   0/0
Vendor specific:
01 00 00 00 00 00 00 00 00 00 00 00 00 00 00 00
00 00 00 00 00 00 00 00 00 00 00 00 00 00 00 00

SCT Temperature History Version:     2
Temperature Sampling Period:         1 minute
Temperature Logging Interval:        1 minute
Min/Max recommended Temperature:      0/60 Celsius
Min/Max Temperature Limit:           -41/85 Celsius
Temperature History Size (Index):    478 (455)

SCT Error Recovery Control command not supported

Device Statistics (GP/SMART Log 0x04) not supported

Pending Defects log (GP Log 0x0c) not supported

SATA Phy Event Counters (GP Log 0x11)
ID      Size     Value  Description
0x0001  2            0  Command failed due to ICRC error
0x0002  2            0  R_ERR response for data FIS
0x0003  2            0  R_ERR response for device-to-host data FIS
0x0004  2            0  R_ERR response for host-to-device data FIS
0x0005  2            0  R_ERR response for non-data FIS
0x0006  2            0  R_ERR response for device-to-host non-data FIS
0x0007  2            0  R_ERR response for host-to-device non-data FIS
0x0008  2            0  Device-to-host non-data FIS retries
0x0009  2            2  Transition from drive PhyRdy to drive PhyNRdy
0x000a  2            2  Device-to-host register FISes sent due to a COMRESET
0x000b  2            0  CRC errors within host-to-device FIS
0x000f  2            0  R_ERR response for host-to-device data FIS, CRC
0x0012  2            0  R_ERR response for host-to-device non-data FIS, CRC
0x8000  4        42102  Vendor specific



