smartctl 7.3 2022-02-28 r5338 [x86_64-linux-6.6.25-t2-mantic] (local build)
Copyright (C) 2002-22, Bruce Allen, Christian Franke, www.smartmontools.org

=== START OF INFORMATION SECTION ===
Model Number:                       APPLE SSD SM0512L
Serial Number:                      --
Firmware Version:                   CXS6AA0Q
PCI Vendor/Subsystem ID:            0x144d
IEEE OUI Identifier:                0x002538
Controller ID:                      2
NVMe Version:                       <1.2
Number of Namespaces:               1
Namespace 1 Size/Capacity:          500,277,788,672 [500 GB]
Namespace 1 Utilization:            56,952,545,280 [56.9 GB]
Namespace 1 Formatted LBA Size:     4096
Namespace 1 IEEE EUI-64:            002538 ...
Local Time is:                      Tue Apr  9 21:58:31 2024 PDT
Firmware Updates (0x06):            3 Slots
Optional Admin Commands (0x0006):   Format Frmw_DL
Optional NVM Commands (0x001f):     Comp Wr_Unc DS_Mngmt Wr_Zero Sav/Sel_Feat
Maximum Data Transfer Size:         256 Pages

Supported Power States
St Op     Max   Active     Idle   RL RT WL WT  Ent_Lat  Ex_Lat
 0 +     6.00W       -        -    0  0  0  0        5       5
 1 -   0.0400W       -        -    1  1  1  1      210    1200
 2 -   0.0050W       -        -    2  2  2  2     1900    5300

Supported LBA Sizes (NSID 0x1)
Id Fmt  Data  Metadt  Rel_Perf
 0 +    4096       0         0

=== START OF SMART DATA SECTION ===
SMART overall-health self-assessment test result: PASSED

SMART/Health Information (NVMe Log 0x02)
Critical Warning:                   0x00
Temperature:                        38 Celsius
Available Spare:                    100%
Available Spare Threshold:          10%
Percentage Used:                    14%
Data Units Read:                    516,583,694 [264 TB]
Data Units Written:                 285,962,825 [146 TB]
Host Read Commands:                 6,240,479,963
Host Write Commands:                2,060,155,699
Controller Busy Time:               11,382
Power Cycles:                       24,970
Power On Hours:                     3,166
Unsafe Shutdowns:                   642
Media and Data Integrity Errors:    0
Error Information Log Entries:      1,687

Error Information (NVMe Log 0x01, 16 of 64 entries)
Num   ErrCount  SQId   CmdId  Status  PELoc          LBA  NSID    VS
  0       1687     0  0x2016  0x4004  0x000            0     1     -
  1       1686     0  0x2014  0x4004  0x000            0     1     -
  2       1685     0  0x400f  0x4004  0x000            0     1     -
  3       1684     0  0x500d  0x4004  0x000            0     1     -
  4       1683     0  0x300f  0x4004  0x000            0     1     -
  5       1682     0  0x400d  0x4004  0x000            0     1     -
  6       1681     0  0x300d  0x4004  0x000            0     1     -
  7       1680     0  0x200e  0x4004  0x000            0     1     -
  8       1679     0  0x200c  0x4004  0x000            0     1     -
  9       1678     0  0x100e  0x4004  0x000            0     1     -
 10       1677     0  0x100c  0x4004  0x000            0     1     -
 11       1676     0  0x101a  0x4004  0x000            0     1     -
 12       1675     0  0x1018  0x4004  0x000            0     1     -
 13       1674     0  0x201c  0x4004  0x000            0     1     -
 14       1673     0  0x101c  0x4004  0x000            0     1     -
 15       1672     0  0x001c  0x4004  0x000            0     1     -
... (48 entries not read)

