smartctl 7.3 2022-02-28 r5338 [x86_64-linux-6.5.0-10-generic] (local build)
Copyright (C) 2002-22, Bruce Allen, Christian Franke, www.smartmontools.org

=== START OF INFORMATION SECTION ===
Model Number:                       KBG30ZMT256G TOSHIBA
Serial Number:                      --
Firmware Version:                   0109ADLA
PCI Vendor/Subsystem ID:            0x1179
IEEE OUI Identifier:                0x00080d
Controller ID:                      0
NVMe Version:                       1.2
Number of Namespaces:               1
Namespace 1 Size/Capacity:          256,060,514,304 [256 GB]
Namespace 1 Formatted LBA Size:     512
Namespace 1 IEEE EUI-64:            00080d ...
Local Time is:                      Thu Nov  9 18:18:05 2023 -03
Firmware Updates (0x12):            1 Slot, no Reset required
Optional Admin Commands (0x0017):   Security Format Frmw_DL Self_Test
Optional NVM Commands (0x0017):     Comp Wr_Unc DS_Mngmt Sav/Sel_Feat
Log Page Attributes (0x02):         Cmd_Eff_Lg
Maximum Data Transfer Size:         512 Pages
Warning  Comp. Temp. Threshold:     82 Celsius
Critical Comp. Temp. Threshold:     85 Celsius

Supported Power States
St Op     Max   Active     Idle   RL RT WL WT  Ent_Lat  Ex_Lat
 0 +     3.30W       -        -    0  0  0  0        0       0
 1 +     2.70W       -        -    1  1  1  1        0       0
 2 +     2.30W       -        -    2  2  2  2        0       0
 3 -   0.0500W       -        -    4  4  4  4     8000   32000
 4 -   0.0050W       -        -    4  4  4  4     8000   40000

Supported LBA Sizes (NSID 0x1)
Id Fmt  Data  Metadt  Rel_Perf
 0 -    4096       0         0
 1 +     512       0         3

=== START OF SMART DATA SECTION ===
SMART overall-health self-assessment test result: PASSED

SMART/Health Information (NVMe Log 0x02)
Critical Warning:                   0x00
Temperature:                        41 Celsius
Available Spare:                    100%
Available Spare Threshold:          10%
Percentage Used:                    19%
Data Units Read:                    110,450,075 [56.5 TB]
Data Units Written:                 69,695,574 [35.6 TB]
Host Read Commands:                 2,393,037,734
Host Write Commands:                1,427,186,374
Controller Busy Time:               15,594
Power Cycles:                       4,407
Power On Hours:                     3,292
Unsafe Shutdowns:                   411
Media and Data Integrity Errors:    0
Error Information Log Entries:      6,086
Warning  Comp. Temperature Time:    0
Critical Comp. Temperature Time:    0
Temperature Sensor 1:               41 Celsius

Error Information (NVMe Log 0x01, 16 of 64 entries)
Num   ErrCount  SQId   CmdId  Status  PELoc          LBA  NSID    VS
  0       6086     0  0x800d  0xc004  0x028            -     1     -
  1       6085     0  0x700f  0xc004  0x028            -     1     -

