=== START OF INFORMATION SECTION ===
Device Model:     T-60
Serial Number:    --
LU WWN Device Id: 0 000000 ...
Firmware Version: P0831A
User Capacity:    60,022,480,896 bytes [60.0 GB]
Sector Size:      512 bytes logical/physical
Rotation Rate:    Solid State Device
Form Factor:      2.5 inches
Device is:        Not in smartctl database [for details use: -P showall]
ATA Version is:   ACS-2 (minor revision not indicated)
SATA Version is:  SATA 3.1, 6.0 Gb/s (current: 6.0 Gb/s)
Local Time is:    Sat Jul  6 19:08:36 2019 MSK
SMART support is: Available - device has SMART capability.
SMART support is: Enabled
AAM feature is:   Unavailable
APM feature is:   Disabled
Rd look-ahead is: Disabled
Write cache is:   Enabled
DSN feature is:   Unavailable
ATA Security is:  Disabled, frozen [SEC2]
Wt Cache Reorder: Unavailable

=== START OF READ SMART DATA SECTION ===
SMART overall-health self-assessment test result: PASSED

General SMART Values:
Offline data collection status:  (0x00)	Offline data collection activity
					was never started.
					Auto Offline Data Collection: Disabled.
Self-test execution status:      (   0)	The previous self-test routine completed
					without error or no self-test has ever 
					been run.
Total time to complete Offline 
data collection: 		(    0) seconds.
Offline data collection
capabilities: 			 (0x11) SMART execute Offline immediate.
					No Auto Offline data collection support.
					Suspend Offline collection upon new
					command.
					No Offline surface scan supported.
					Self-test supported.
					No Conveyance Self-test supported.
					No Selective Self-test supported.
SMART capabilities:            (0x0002)	Does not save SMART data before
					entering power-saving mode.
					Supports SMART auto save timer.
Error logging capability:        (0x01)	Error logging supported.
					General Purpose Logging supported.
Short self-test routine 
recommended polling time: 	 (   1) minutes.
Extended self-test routine
recommended polling time: 	 (   1) minutes.

SMART Attributes Data Structure revision number: 1
Vendor Specific SMART Attributes with Thresholds:
ID# ATTRIBUTE_NAME          FLAGS    VALUE WORST THRESH FAIL RAW_VALUE
  1 Raw_Read_Error_Rate     ------   100   100   050    -    0
  5 Reallocated_Sector_Ct   -O----   100   100   050    -    0
  9 Power_On_Hours          ------   100   100   050    -    25
 12 Power_Cycle_Count       ------   100   100   050    -    1034
160 Unknown_Attribute       ------   100   100   050    -    0
161 Unknown_Attribute       ------   100   100   050    -    281
162 Unknown_Attribute       ------   100   100   050    -    1
163 Unknown_Attribute       ------   100   100   050    -    14
164 Unknown_Attribute       ------   100   100   050    -    85604
165 Unknown_Attribute       ------   100   100   050    -    57
166 Unknown_Attribute       ------   100   100   050    -    5
167 Unknown_Attribute       ------   100   100   050    -    41
168 Unknown_Attribute       ------   100   100   050    -    3000
169 Unknown_Attribute       ------   099   099   050    -    99
192 Power-Off_Retract_Count ------   100   100   050    -    20
194 Temperature_Celsius     ------   100   100   050    -    24
195 Hardware_ECC_Recovered  ------   100   100   050    -    197
196 Reallocated_Event_Count ------   100   100   050    -    0
199 UDMA_CRC_Error_Count    ------   100   100   050    -    0
241 Total_LBAs_Written      ------   100   100   050    -    38274
242 Total_LBAs_Read         ------   100   100   050    -    44651
245 Unknown_Attribute       ------   100   100   050    -    62140
                            ||||||_ K auto-keep
                            |||||__ C event count
                            ||||___ R error rate
                            |||____ S speed/performance
                            ||_____ O updated online
                            |______ P prefailure warning

General Purpose Log Directory Version 1
SMART           Log Directory Version 1 [multi-sector log support]
Address    Access  R/W   Size  Description
0x00       GPL,SL  R/O      1  Log Directory
0x01           SL  R/O      1  Summary SMART error log
0x02           SL  R/O      1  Comprehensive SMART error log
0x03       GPL     R/O      1  Ext. Comprehensive SMART error log
0x04       GPL,SL  R/O      8  Device Statistics log
0x06           SL  R/O      1  SMART self-test log
0x07       GPL     R/O      1  Extended self-test log
0x09           SL  R/W      1  Selective self-test log
0x10       GPL     R/O      1  NCQ Command Error log
0x11       GPL     R/O      1  SATA Phy Event Counters log
0x30       GPL,SL  R/O      9  IDENTIFY DEVICE data log
0x80-0x9f  GPL,SL  R/W     16  Host vendor specific log

SMART Extended Comprehensive Error Log Version: 1 (1 sectors)
No Errors Logged

Warning! SMART Extended Self-test Log Structure error: invalid SMART checksum.
SMART Extended Self-test Log Version: 1 (1 sectors)
Num  Test_Description    Status                  Remaining  LifeTime(hours)  LBA_of_first_error
# 1  Extended offline    Completed without error       00%        25         -

Selective Self-tests/Logging not supported

SCT Commands not supported

Device Statistics (GP Log 0x04)
Page  Offset Size        Value Flags Description
0x01  =====  =               =  ===  == General Statistics (rev 1) ==
0x01  0x008  4            1034  ---  Lifetime Power-On Resets
0x01  0x010  4              25  ---  Power-on Hours
0x01  0x018  6      2508385900  ---  Logical Sectors Written
0x01  0x020  6        15348313  ---  Number of Write Commands
0x01  0x028  6      2926291092  ---  Logical Sectors Read
0x01  0x030  6        30874406  ---  Number of Read Commands
0x04  =====  =               =  ===  == General Errors Statistics (rev 1) ==
0x04  0x008  4               0  ---  Number of Reported Uncorrectable Errors
0x04  0x010  4         1763381  ---  Resets Between Cmd Acceptance and Completion
0x05  =====  =               =  ===  == Temperature Statistics (rev 1) ==
0x05  0x008  1              26  ---  Current Temperature
0x05  0x010  1             104  ---  Average Short Term Temperature
0x05  0x018  1             -87  ---  Average Long Term Temperature
0x05  0x020  1              34  ---  Highest Temperature
0x05  0x028  1              10  ---  Lowest Temperature
0x05  0x030  1              -1  ---  Highest Average Short Term Temperature
0x05  0x038  1               0  ---  Lowest Average Short Term Temperature
0x05  0x040  1              -1  ---  Highest Average Long Term Temperature
0x05  0x048  1               0  ---  Lowest Average Long Term Temperature
0x05  0x050  4               0  ---  Time in Over-Temperature
0x05  0x058  1             100  ---  Specified Maximum Operating Temperature
0x05  0x060  4               0  ---  Time in Under-Temperature
0x05  0x068  1               0  ---  Specified Minimum Operating Temperature
0x06  =====  =               =  ===  == Transport Statistics (rev 1) ==
0x06  0x008  4            3064  ---  Number of Hardware Resets
0x06  0x018  4               0  ---  Number of Interface CRC Errors
0x07  =====  =               =  ===  == Solid State Device Statistics (rev 1) ==
0x07  0x008  1               1  ---  Percentage Used Endurance Indicator
                                |||_ C monitored condition met
                                ||__ D supports DSN
                                |___ N normalized value

Pending Defects log (GP Log 0x0c) not supported

SATA Phy Event Counters (GP Log 0x11)
ID      Size     Value  Description
0x0001  2            0  Command failed due to ICRC error
0x0002  2            0  R_ERR response for data FIS
0x0003  2            0  R_ERR response for device-to-host data FIS
0x0004  2            0  R_ERR response for host-to-device data FIS
0x0005  2            0  R_ERR response for non-data FIS
0x0006  2            0  R_ERR response for device-to-host non-data FIS
0x0007  2            0  R_ERR response for host-to-device non-data FIS
0x0008  2            0  Device-to-host non-data FIS retries
0x0009  2            0  Transition from drive PhyRdy to drive PhyNRdy
0x000a  2            8  Device-to-host register FISes sent due to a COMRESET
0x000b  2            0  CRC errors within host-to-device FIS
0x000d  2            0  Non-CRC errors within host-to-device FIS
0x000f  2            0  R_ERR response for host-to-device data FIS, CRC
0x0010  2            0  R_ERR response for host-to-device data FIS, non-CRC
0x0012  2            0  R_ERR response for host-to-device non-data FIS, CRC
0x0013  2            0  R_ERR response for host-to-device non-data FIS, non-CRC

