=== START OF INFORMATION SECTION ===
Model Family:     Western Digital Scorpio Blue Serial ATA
Device Model:     WDC WD1600BEVS-22RST0
Serial Number:    --
LU WWN Device Id: 5 0014ee ...
Firmware Version: 04.01G04
User Capacity:    160 041 885 696 bytes [160 GB]
Sector Size:      512 bytes logical/physical
Device is:        In smartctl database [for details use: -P show]
ATA Version is:   ATA/ATAPI-7 (minor revision not indicated)
Local Time is:    Sat Sep 22 18:28:55 2018 CEST
SMART support is: Available - device has SMART capability.
SMART support is: Enabled
AAM feature is:   Disabled
APM level is:     128 (minimum power consumption without standby)
Rd look-ahead is: Enabled
Write cache is:   Enabled
ATA Security is:  Disabled, frozen [SEC2]
Wt Cache Reorder: Enabled

=== START OF READ SMART DATA SECTION ===
SMART overall-health self-assessment test result: PASSED

General SMART Values:
Offline data collection status:  (0x84)	Offline data collection activity
					was suspended by an interrupting command from host.
					Auto Offline Data Collection: Enabled.
Self-test execution status:      (   0)	The previous self-test routine completed
					without error or no self-test has ever 
					been run.
Total time to complete Offline 
data collection: 		( 7200) seconds.
Offline data collection
capabilities: 			 (0x7b) SMART execute Offline immediate.
					Auto Offline data collection on/off support.
					Suspend Offline collection upon new
					command.
					Offline surface scan supported.
					Self-test supported.
					Conveyance Self-test supported.
					Selective Self-test supported.
SMART capabilities:            (0x0003)	Saves SMART data before entering
					power-saving mode.
					Supports SMART auto save timer.
Error logging capability:        (0x01)	Error logging supported.
					General Purpose Logging supported.
Short self-test routine 
recommended polling time: 	 (   2) minutes.
Extended self-test routine
recommended polling time: 	 (  92) minutes.
Conveyance self-test routine
recommended polling time: 	 (   6) minutes.
SCT capabilities: 	       (0x103f)	SCT Status supported.
					SCT Error Recovery Control supported.
					SCT Feature Control supported.
					SCT Data Table supported.

SMART Attributes Data Structure revision number: 16
Vendor Specific SMART Attributes with Thresholds:
ID# ATTRIBUTE_NAME          FLAGS    VALUE WORST THRESH FAIL RAW_VALUE
  1 Raw_Read_Error_Rate     POSR--   200   200   051    -    152
  3 Spin_Up_Time            PO----   187   183   021    -    1650
  4 Start_Stop_Count        -O--CK   090   090   000    -    10052
  5 Reallocated_Sector_Ct   PO--CK   181   181   140    -    150
  7 Seek_Error_Rate         POSR--   200   200   051    -    0
  9 Power_On_Hours          -O--CK   048   048   000    -    38187
 10 Spin_Retry_Count        PO--C-   100   100   051    -    0
 11 Calibration_Retry_Count -O--C-   100   100   051    -    0
 12 Power_Cycle_Count       -O--CK   091   091   000    -    9661
192 Power-Off_Retract_Count -O--CK   199   199   000    -    1380
193 Load_Cycle_Count        -O--CK   001   001   000    -    890847
194 Temperature_Celsius     -O---K   111   092   000    -    36
196 Reallocated_Event_Count -O--CK   148   148   000    -    52
197 Current_Pending_Sector  -O--C-   200   200   000    -    0
198 Offline_Uncorrectable   ----C-   200   200   000    -    0
199 UDMA_CRC_Error_Count    -OSRCK   200   200   000    -    0
200 Multi_Zone_Error_Rate   P--R--   200   200   051    -    0
                            ||||||_ K auto-keep
                            |||||__ C event count
                            ||||___ R error rate
                            |||____ S speed/performance
                            ||_____ O updated online
                            |______ P prefailure warning

General Purpose Log Directory Version 1
SMART           Log Directory Version 1 [multi-sector log support]
Address    Access  R/W   Size  Description
0x00       GPL,SL  R/O      1  Log Directory
0x01           SL  R/O      1  Summary SMART error log
0x02           SL  R/O      5  Comprehensive SMART error log
0x03       GPL     R/O      6  Ext. Comprehensive SMART error log
0x06           SL  R/O      1  SMART self-test log
0x07       GPL     R/O      1  Extended self-test log
0x09           SL  R/W      1  Selective self-test log
0x10       GPL     R/O      1  SATA NCQ Queued Error log
0x11       GPL     R/O      1  SATA Phy Event Counters log
0x80-0x9f  GPL,SL  R/W     16  Host vendor specific log
0xa0-0xa7  GPL,SL  VS      16  Device vendor specific log
0xa8-0xb7  GPL,SL  VS       1  Device vendor specific log
0xc0       GPL,SL  VS       1  Device vendor specific log
0xe0       GPL,SL  R/W      1  SCT Command/Status
0xe1       GPL,SL  R/W      1  SCT Data Transfer

SMART Extended Comprehensive Error Log Version: 1 (6 sectors)
Device Error Count: 155 (device log contains only the most recent 24 errors)
	CR     = Command Register
	FEATR  = Features Register
	COUNT  = Count (was: Sector Count) Register
	LBA_48 = Upper bytes of LBA High/Mid/Low Registers ]  ATA-8
	LH     = LBA High (was: Cylinder High) Register    ]   LBA
	LM     = LBA Mid (was: Cylinder Low) Register      ] Register
	LL     = LBA Low (was: Sector Number) Register     ]
	DV     = Device (was: Device/Head) Register
	DC     = Device Control Register
	ER     = Error register
	ST     = Status register
Powered_Up_Time is measured from power on, and printed as
DDd+hh:mm:SS.sss where DD=days, hh=hours, mm=minutes,
SS=sec, and sss=millisec. It "wraps" after 49.710 days.

Error 155 [10] occurred at disk power-on lifetime: 0 hours (0 days + 0 hours)
  When the command that caused the error occurred, the device was in an unknown state.

  After command completion occurred, registers were:
  ER -- ST COUNT  LBA_48  LH LM LL DV DC
  -- -- -- == -- == == == -- -- -- -- --
  40 -- 00 01 01 00 51 00 00 40 01 00 00

  Commands leading to the command that caused the error were:
  CR FEATR COUNT  LBA_48  LH LM LL DV DC  Powered_Up_Time  Command/Feature_Name
  -- == -- == -- == == == -- -- -- -- --  ---------------  --------------------
  00 15 42 15 89 00 00 00 00 00 00 00 05     00:00:00.000  NOP [Reserved subcommand] [OBS-ACS-2]
  00 c8 01 00 00 15 e3 00 88 60 00 00 00     00:00:39.937  NOP [Don't abort queued commands] [OBS-ACS-2]
  05 7c 60 15 7d 00 01 00 9c 00 00 00 00     00:23:28.430  [RESERVED]
  00 01 00 00 9c 15 4d 05 72 42 00 00 00     00:00:00.176  NOP [Abort queued commands]

Error 154 [9] occurred at disk power-on lifetime: 0 hours (0 days + 0 hours)
  When the command that caused the error occurred, the device was in an unknown state.

  After command completion occurred, registers were:
  ER -- ST COUNT  LBA_48  LH LM LL DV DC
  -- -- -- == -- == == == -- -- -- -- --
  40 -- 00 01 01 00 51 00 00 40 01 00 00

  Commands leading to the command that caused the error were:
  CR FEATR COUNT  LBA_48  LH LM LL DV DC  Powered_Up_Time  Command/Feature_Name
  -- == -- == -- == == == -- -- -- -- --  ---------------  --------------------
  00 ae 42 15 7d 00 00 00 00 00 00 00 05     00:00:00.000  NOP [Reserved subcommand] [OBS-ACS-2]
  00 b0 01 00 00 15 7c 00 7d 60 00 00 00     00:00:39.937  NOP [Don't abort queued commands] [OBS-ACS-2]
  05 1d 42 15 67 00 01 00 9c 00 00 00 05     00:23:25.517  [RESERVED]
  00 01 00 00 9c 15 e9 05 5b 42 00 00 00     00:00:39.937  NOP [Abort queued commands]

Error 153 [8] occurred at disk power-on lifetime: 0 hours (0 days + 0 hours)
  When the command that caused the error occurred, the device was in an unknown state.

  After command completion occurred, registers were:
  ER -- ST COUNT  LBA_48  LH LM LL DV DC
  -- -- -- == -- == == == -- -- -- -- --
  40 -- 00 01 01 00 51 00 00 40 01 00 00

  Commands leading to the command that caused the error were:
  CR FEATR COUNT  LBA_48  LH LM LL DV DC  Powered_Up_Time  Command/Feature_Name
  -- == -- == -- == == == -- -- -- -- --  ---------------  --------------------
  00 4d 42 15 72 00 00 00 00 00 00 00 05     00:00:00.000  NOP [Reserved subcommand] [OBS-ACS-2]
  00 01 00 00 9c 15 1d 05 67 42 00 00 00     00:00:39.937  NOP [Abort queued commands]
  05 e8 42 15 5b 00 01 00 9c 00 00 00 05     00:23:19.785  [RESERVED]
  00 02 00 00 9d 15 d6 05 5b 42 00 00 00     00:00:39.681  NOP [Abort queued commands]

Error 152 [7] occurred at disk power-on lifetime: 0 hours (0 days + 0 hours)
  When the command that caused the error occurred, the device was in an unknown state.

  After command completion occurred, registers were:
  ER -- ST COUNT  LBA_48  LH LM LL DV DC
  -- -- -- == -- == == == -- -- -- -- --
  40 -- 00 01 01 00 51 00 00 40 01 00 00

  Commands leading to the command that caused the error were:
  CR FEATR COUNT  LBA_48  LH LM LL DV DC  Powered_Up_Time  Command/Feature_Name
  -- == -- == -- == == == -- -- -- -- --  ---------------  --------------------
  00 1d 42 15 67 00 00 00 00 00 00 00 05     00:00:00.000  NOP [Reserved subcommand] [OBS-ACS-2]
  00 01 00 00 9c 15 e9 05 5b 42 00 00 00     00:00:39.937  NOP [Abort queued commands]
  05 d6 42 15 5b 00 01 00 9b 00 00 00 05     00:23:19.784  [RESERVED]
  00 78 01 00 a0 15 a0 06 5b 60 00 00 00     00:00:40.194  NOP [Don't abort queued commands] [OBS-ACS-2]

Error 151 [6] occurred at disk power-on lifetime: 0 hours (0 days + 0 hours)
  When the command that caused the error occurred, the device was in an unknown state.

  After command completion occurred, registers were:
  ER -- ST COUNT  LBA_48  LH LM LL DV DC
  -- -- -- == -- == == == -- -- -- -- --
  40 -- 00 01 01 00 51 00 00 40 01 00 00

  Commands leading to the command that caused the error were:
  CR FEATR COUNT  LBA_48  LH LM LL DV DC  Powered_Up_Time  Command/Feature_Name
  -- == -- == -- == == == -- -- -- -- --  ---------------  --------------------
  00 e9 42 15 5b 00 00 00 00 00 00 00 05     00:00:00.000  NOP [Reserved subcommand] [OBS-ACS-2]
  00 01 00 00 9b 15 e8 05 5b 42 00 00 00     00:00:39.937  NOP [Abort queued commands]
  05 a0 60 15 5b 00 02 00 9d 00 00 00 06     00:23:19.766  [RESERVED]
  00 02 00 00 9b 15 5f 05 50 42 00 00 00     00:00:41.080  NOP [Abort queued commands]

Error 150 [5] occurred at disk power-on lifetime: 0 hours (0 days + 0 hours)
  When the command that caused the error occurred, the device was in an unknown state.

  After command completion occurred, registers were:
  ER -- ST COUNT  LBA_48  LH LM LL DV DC
  -- -- -- == -- == == == -- -- -- -- --
  40 -- 00 01 02 00 51 00 00 40 01 00 00

  Commands leading to the command that caused the error were:
  CR FEATR COUNT  LBA_48  LH LM LL DV DC  Powered_Up_Time  Command/Feature_Name
  -- == -- == -- == == == -- -- -- -- --  ---------------  --------------------
  00 5f 42 15 50 00 00 00 00 00 00 00 05     00:00:00.000  NOP [Reserved subcommand] [OBS-ACS-2]
  00 60 01 00 00 15 24 00 50 60 00 00 00     00:00:39.682  NOP [Don't abort queued commands] [OBS-ACS-2]
  05 b2 60 15 44 00 02 00 9b 00 00 00 00     00:23:13.897  [RESERVED]
  00 02 00 00 9b 15 72 05 39 42 00 00 00     00:00:00.072  NOP [Abort queued commands]

Error 149 [4] occurred at disk power-on lifetime: 0 hours (0 days + 0 hours)
  When the command that caused the error occurred, the device was in an unknown state.

  After command completion occurred, registers were:
  ER -- ST COUNT  LBA_48  LH LM LL DV DC
  -- -- -- == -- == == == -- -- -- -- --
  40 -- 00 01 02 00 51 00 00 40 01 00 00

  Commands leading to the command that caused the error were:
  CR FEATR COUNT  LBA_48  LH LM LL DV DC  Powered_Up_Time  Command/Feature_Name
  -- == -- == -- == == == -- -- -- -- --  ---------------  --------------------
  00 e9 42 15 44 00 00 00 00 00 00 00 05     00:00:00.000  NOP [Reserved subcommand] [OBS-ACS-2]
  00 48 01 00 00 15 b2 00 44 60 00 00 00     00:00:39.682  NOP [Don't abort queued commands] [OBS-ACS-2]
  05 35 60 15 39 00 02 00 9b 00 00 00 00     00:23:10.962  [RESERVED]
  00 02 00 00 9b 15 fb 05 2d 42 00 00 00     00:00:00.048  NOP [Abort queued commands]

Error 148 [3] occurred at disk power-on lifetime: 0 hours (0 days + 0 hours)
  When the command that caused the error occurred, the device was in an unknown state.

  After command completion occurred, registers were:
  ER -- ST COUNT  LBA_48  LH LM LL DV DC
  -- -- -- == -- == == == -- -- -- -- --
  40 -- 00 01 02 00 51 00 00 40 01 00 00

  Commands leading to the command that caused the error were:
  CR FEATR COUNT  LBA_48  LH LM LL DV DC  Powered_Up_Time  Command/Feature_Name
  -- == -- == -- == == == -- -- -- -- --  ---------------  --------------------
  00 72 42 15 39 00 00 00 00 00 00 00 05     00:00:00.000  NOP [Reserved subcommand] [OBS-ACS-2]
  00 30 01 00 00 15 35 00 39 60 00 00 00     00:00:39.682  NOP [Don't abort queued commands] [OBS-ACS-2]
  05 c3 42 15 22 00 02 00 9b 00 00 00 05     00:23:08.027  [RESERVED]
  00 10 01 00 a0 15 89 06 22 60 00 00 00     00:00:39.682  NOP [Don't abort queued commands] [OBS-ACS-2]

SMART Extended Self-test Log Version: 1 (1 sectors)
Num  Test_Description    Status                  Remaining  LifeTime(hours)  LBA_of_first_error
# 1  Short offline       Completed without error       00%     38020         -
# 2  Short offline       Completed without error       00%     37692         -
# 3  Extended offline    Completed: read failure       90%     35095         85463196

SMART Selective self-test log data structure revision number 1
 SPAN  MIN_LBA  MAX_LBA  CURRENT_TEST_STATUS
    1        0        0  Not_testing
    2        0        0  Not_testing
    3        0        0  Not_testing
    4        0        0  Not_testing
    5        0        0  Not_testing
Selective self-test flags (0x0):
  After scanning selected spans, do NOT read-scan remainder of disk.
If Selective self-test is pending on power-up, resume after 0 minute delay.

SCT Status Version:                  2
SCT Version (vendor specific):       258 (0x0102)
SCT Support Level:                   1
Device State:                        SMART Off-line Data Collection executing in background (4)
Current Temperature:                 44 Celsius
Power Cycle Max Temperature:         44 Celsius
Lifetime    Max Temperature:          0 Celsius

SCT Temperature History Version:     2
Temperature Sampling Period:         1 minute
Temperature Logging Interval:        1 minute
Min/Max recommended Temperature:      5/65 Celsius
Min/Max Temperature Limit:            1/70 Celsius
Temperature History Size (Index):    128 (125)

SCT Error Recovery Control:
           Read: Disabled
          Write: Disabled

Device Statistics (GP/SMART Log 0x04) not supported

SATA Phy Event Counters (GP Log 0x11)
ID      Size     Value  Description
0x0001  2            0  Command failed due to ICRC error
0x0002  2            0  R_ERR response for data FIS
0x0003  2            0  R_ERR response for device-to-host data FIS
0x0004  2            0  R_ERR response for host-to-device data FIS
0x0005  2            0  R_ERR response for non-data FIS
0x0006  2            0  R_ERR response for device-to-host non-data FIS
0x0007  2            0  R_ERR response for host-to-device non-data FIS
0x000a  2           18  Device-to-host register FISes sent due to a COMRESET
0x8000  4         9294  Vendor specific

