smartctl 7.4 2023-08-01 r5530 [x86_64-linux-6.8.0-31-generic] (local build)
Copyright (C) 2002-23, Bruce Allen, Christian Franke, www.smartmontools.org

=== START OF INFORMATION SECTION ===
Model Number:                       INTEL SSDPEKNW512G8
Serial Number:                      --
Firmware Version:                   004C
PCI Vendor/Subsystem ID:            0x8086
IEEE OUI Identifier:                0x5cd2e4
Controller ID:                      1
NVMe Version:                       1.3
Number of Namespaces:               1
Namespace 1 Size/Capacity:          512,110,190,592 [512 GB]
Namespace 1 Formatted LBA Size:     512
Local Time is:                      Fri May 10 00:26:52 2024 +03
Firmware Updates (0x14):            2 Slots, no Reset required
Optional Admin Commands (0x0017):   Security Format Frmw_DL Self_Test
Optional NVM Commands (0x005f):     Comp Wr_Unc DS_Mngmt Wr_Zero Sav/Sel_Feat Timestmp
Log Page Attributes (0x0f):         S/H_per_NS Cmd_Eff_Lg Ext_Get_Lg Telmtry_Lg
Maximum Data Transfer Size:         32 Pages
Warning  Comp. Temp. Threshold:     77 Celsius
Critical Comp. Temp. Threshold:     80 Celsius

Supported Power States
St Op     Max   Active     Idle   RL RT WL WT  Ent_Lat  Ex_Lat
 0 +     3.50W       -        -    0  0  0  0        0       0
 1 +     2.70W       -        -    1  1  1  1        0       0
 2 +     2.00W       -        -    2  2  2  2        0       0
 3 -   0.0250W       -        -    3  3  3  3     5000    5000
 4 -   0.0040W       -        -    4  4  4  4     5000    9000

Supported LBA Sizes (NSID 0x1)
Id Fmt  Data  Metadt  Rel_Perf
 0 +     512       0         0

=== START OF SMART DATA SECTION ===
SMART overall-health self-assessment test result: PASSED

SMART/Health Information (NVMe Log 0x02)
Critical Warning:                   0x00
Temperature:                        31 Celsius
Available Spare:                    100%
Available Spare Threshold:          10%
Percentage Used:                    11%
Data Units Read:                    83,581,311 [42.7 TB]
Data Units Written:                 71,038,315 [36.3 TB]
Host Read Commands:                 1,182,886,840
Host Write Commands:                1,172,961,032
Controller Busy Time:               27,449
Power Cycles:                       1,776
Power On Hours:                     7,442
Unsafe Shutdowns:                   167
Media and Data Integrity Errors:    0
Error Information Log Entries:      2
Warning  Comp. Temperature Time:    0
Critical Comp. Temperature Time:    0
Thermal Temp. 1 Transition Count:   529
Thermal Temp. 2 Transition Count:   4
Thermal Temp. 1 Total Time:         6662
Thermal Temp. 2 Total Time:         201

Error Information (NVMe Log 0x01, 16 of 256 entries)
No Errors Logged

Self-test Log (NVMe Log 0x06)
Self-test status: No self-test in progress
No Self-tests Logged

