smartctl 7.2 2021-01-17 r5171 [x86_64-linux-5.10.11-200.fc33.x86_64] (local build)
Copyright (C) 2002-20, Bruce Allen, Christian Franke, www.smartmontools.org

=== START OF INFORMATION SECTION ===
Model Number:                       Sabrent Rocket 4.0 2TB
Serial Number:                      --
Firmware Version:                   EGFM11.1
PCI Vendor/Subsystem ID:            0x1987
IEEE OUI Identifier:                0x6479a7
Total NVM Capacity:                 2,000,398,934,016 [2.00 TB]
Unallocated NVM Capacity:           0
Controller ID:                      1
NVMe Version:                       1.3
Number of Namespaces:               1
Namespace 1 Size/Capacity:          2,000,398,934,016 [2.00 TB]
Namespace 1 Formatted LBA Size:     4096
Namespace 1 IEEE EUI-64:            6479a7 ...
Local Time is:                      Mon Feb  1 18:32:25 2021 +01
Firmware Updates (0x12):            1 Slot, no Reset required
Optional Admin Commands (0x0017):   Security Format Frmw_DL Self_Test
Optional NVM Commands (0x005d):     Comp DS_Mngmt Wr_Zero Sav/Sel_Feat Timestmp
Log Page Attributes (0x08):         Telmtry_Lg
Maximum Data Transfer Size:         512 Pages
Warning  Comp. Temp. Threshold:     70 Celsius
Critical Comp. Temp. Threshold:     90 Celsius

Supported Power States
St Op     Max   Active     Idle   RL RT WL WT  Ent_Lat  Ex_Lat
 0 +    10.73W       -        -    0  0  0  0        0       0
 1 +     7.69W       -        -    1  1  1  1        0       0
 2 +     6.18W       -        -    2  2  2  2        0       0
 3 -   0.0490W       -        -    3  3  3  3     2000    2000
 4 -   0.0018W       -        -    4  4  4  4    25000   25000

Supported LBA Sizes (NSID 0x1)
Id Fmt  Data  Metadt  Rel_Perf
 0 -     512       0         2
 1 +    4096       0         1

=== START OF SMART DATA SECTION ===
SMART overall-health self-assessment test result: PASSED

SMART/Health Information (NVMe Log 0x02)
Critical Warning:                   0x00
Temperature:                        50 Celsius
Available Spare:                    100%
Available Spare Threshold:          5%
Percentage Used:                    0%
Data Units Read:                    24,582,881 [12.5 TB]
Data Units Written:                 29,272,691 [14.9 TB]
Host Read Commands:                 71,278,886
Host Write Commands:                223,354,956
Controller Busy Time:               493
Power Cycles:                       1,015
Power On Hours:                     1,682
Unsafe Shutdowns:                   583
Media and Data Integrity Errors:    0
Error Information Log Entries:      4,084
Warning  Comp. Temperature Time:    0
Critical Comp. Temperature Time:    0

Error Information (NVMe Log 0x01, 16 of 63 entries)
No Errors Logged



