=== START OF INFORMATION SECTION ===
Model Family:     Fujitsu MHY BH
Device Model:     FUJITSU MHY2160BH
Serial Number:    --
LU WWN Device Id: 5 00000e ...
Firmware Version: 0081000D
User Capacity:    160,041,885,696 bytes [160 GB]
Sector Size:      512 bytes logical/physical
Device is:        In smartctl database [for details use: -P show]
ATA Version is:   ATA8-ACS T13/1699-D revision 3f
SATA Version is:  SATA 2.5, 1.5 Gb/s
Local Time is:    Tue Sep  4 04:00:16 2018 CEST
SMART support is: Available - device has SMART capability.
SMART support is: Enabled
AAM feature is:   Disabled
APM feature is:   Disabled
Rd look-ahead is: Enabled
Write cache is:   Enabled
DSN feature is:   Unavailable
ATA Security is:  Disabled, NOT FROZEN [SEC1]
Wt Cache Reorder: Enabled

=== START OF READ SMART DATA SECTION ===
SMART overall-health self-assessment test result: PASSED

General SMART Values:
Offline data collection status:  (0x00)	Offline data collection activity
					was never started.
					Auto Offline Data Collection: Disabled.
Self-test execution status:      (   0)	The previous self-test routine completed
					without error or no self-test has ever 
					been run.
Total time to complete Offline 
data collection: 		(  649) seconds.
Offline data collection
capabilities: 			 (0x7b) SMART execute Offline immediate.
					Auto Offline data collection on/off support.
					Suspend Offline collection upon new
					command.
					Offline surface scan supported.
					Self-test supported.
					Conveyance Self-test supported.
					Selective Self-test supported.
SMART capabilities:            (0x0003)	Saves SMART data before entering
					power-saving mode.
					Supports SMART auto save timer.
Error logging capability:        (0x01)	Error logging supported.
					General Purpose Logging supported.
Short self-test routine 
recommended polling time: 	 (   2) minutes.
Extended self-test routine
recommended polling time: 	 (  92) minutes.
Conveyance self-test routine
recommended polling time: 	 (   2) minutes.
SCT capabilities: 	       (0x003d)	SCT Status supported.
					SCT Error Recovery Control supported.
					SCT Feature Control supported.
					SCT Data Table supported.

SMART Attributes Data Structure revision number: 16
Vendor Specific SMART Attributes with Thresholds:
ID# ATTRIBUTE_NAME          FLAGS    VALUE WORST THRESH FAIL RAW_VALUE
  1 Raw_Read_Error_Rate     POSR--   100   100   046    -    0
  2 Throughput_Performance  P-S---   100   100   030    -    0
  3 Spin_Up_Time            PO----   100   100   025    -    0
  4 Start_Stop_Count        -O--CK   098   098   000    -    5909
  5 Reallocated_Sector_Ct   PO--CK   100   100   024    -    0
  7 Seek_Error_Rate         POSR--   100   100   047    -    0
  8 Seek_Time_Performance   P-S---   100   100   019    -    0
  9 Power_On_Hours          -O--CK   060   060   000    -    20325
 10 Spin_Retry_Count        PO--C-   100   100   020    -    0
 12 Power_Cycle_Count       -O--CK   100   100   000    -    3137
192 Power-Off_Retract_Count -O--CK   100   100   000    -    21475819741
193 Load_Cycle_Count        -O--CK   073   073   000    -    552416
194 Temperature_Celsius     -O---K   100   100   000    -    33 (Min/Max 14/58)
195 Hardware_ECC_Recovered  -O-RC-   100   100   000    -    0
196 Reallocated_Event_Count -O--CK   100   100   000    -    0
197 Current_Pending_Sector  -O--C-   100   100   000    -    0
198 Offline_Uncorrectable   ----C-   100   100   000    -    0
199 UDMA_CRC_Error_Count    -OSRCK   200   253   000    -    0
200 Multi_Zone_Error_Rate   POSR--   100   100   060    -    0
203 Run_Out_Cancel          -O----   100   100   000    -    0
240 Transfer_Error_Rate     -OSRCK   200   200   000    -    0
                            ||||||_ K auto-keep
                            |||||__ C event count
                            ||||___ R error rate
                            |||____ S speed/performance
                            ||_____ O updated online
                            |______ P prefailure warning

General Purpose Log Directory Version 1
SMART           Log Directory Version 1 [multi-sector log support]
Address    Access  R/W   Size  Description
0x00       GPL,SL  R/O      1  Log Directory
0x01       GPL,SL  R/O      1  Summary SMART error log
0x02       GPL,SL  R/O     51  Comprehensive SMART error log
0x03       GPL,SL  R/O     64  Ext. Comprehensive SMART error log
0x06       GPL,SL  R/O      1  SMART self-test log
0x07       GPL,SL  R/O      2  Extended self-test log
0x09       GPL,SL  R/W      1  Selective self-test log
0x10       GPL,SL  R/O      1  NCQ Command Error log
0x11       GPL,SL  R/O      1  SATA Phy Event Counters log
0x23       GPL,SL  R/O      1  Delayed sector log [OBS-8]
0x80-0x9f  GPL,SL  R/W     16  Host vendor specific log
0xa1       GPL,SL  VS       1  Device vendor specific log

SMART Extended Comprehensive Error Log Version: 1 (64 sectors)
Device Error Count: 1
	CR     = Command Register
	FEATR  = Features Register
	COUNT  = Count (was: Sector Count) Register
	LBA_48 = Upper bytes of LBA High/Mid/Low Registers ]  ATA-8
	LH     = LBA High (was: Cylinder High) Register    ]   LBA
	LM     = LBA Mid (was: Cylinder Low) Register      ] Register
	LL     = LBA Low (was: Sector Number) Register     ]
	DV     = Device (was: Device/Head) Register
	DC     = Device Control Register
	ER     = Error register
	ST     = Status register
Powered_Up_Time is measured from power on, and printed as
DDd+hh:mm:SS.sss where DD=days, hh=hours, mm=minutes,
SS=sec, and sss=millisec. It "wraps" after 49.710 days.

Error 1 [0] occurred at disk power-on lifetime: 4046 hours (168 days + 14 hours)
  When the command that caused the error occurred, the device was active or idle.

  After command completion occurred, registers were:
  ER -- ST COUNT  LBA_48  LH LM LL DV DC
  -- -- -- == -- == == == -- -- -- -- --
  84 -- 51 00 2f 00 00 87 00 99 11 e0 00  Error: ICRC, ABRT 47 sectors at LBA = 0x87009911 = 2264963345

  Commands leading to the command that caused the error were:
  CR FEATR COUNT  LBA_48  LH LM LL DV DC  Powered_Up_Time  Command/Feature_Name
  -- == -- == -- == == == -- -- -- -- --  ---------------  --------------------
  35 00 03 00 80 00 0c 86 00 99 c0 e0 00     06:23:26.377  WRITE DMA EXT
  35 00 03 00 80 00 0c 86 00 99 40 e0 00     06:23:26.374  WRITE DMA EXT
  35 00 03 00 80 00 0c 85 00 99 c0 e0 00     06:23:26.370  WRITE DMA EXT
  35 00 03 00 80 00 0c 85 00 99 40 e0 00     06:23:26.367  WRITE DMA EXT
  35 00 03 00 80 00 0c 84 00 99 c0 e0 00     06:23:26.363  WRITE DMA EXT

SMART Extended Self-test Log Version: 1 (2 sectors)
Num  Test_Description    Status                  Remaining  LifeTime(hours)  LBA_of_first_error
# 1  Short offline       Completed without error       00%      1590         -
# 2  Short offline       Aborted by host               90%      1159         -
# 3  Short offline       Interrupted (host reset)      90%      1158         -
# 4  Short offline       Aborted by host               90%      1158         -
# 5  Short offline       Completed without error       00%      1144         -
# 6  Short offline       Aborted by host               90%      1081         -
# 7  Short offline       Aborted by host               90%      1058         -
# 8  Short offline       Aborted by host               90%      1058         -
# 9  Short offline       Aborted by host               90%      1055         -
#10  Short offline       Aborted by host               90%      1054         -
#11  Short offline       Aborted by host               90%      1052         -
#12  Short offline       Completed without error       00%      1013         -
#13  Short offline       Completed without error       00%      1013         -
#14  Short offline       Aborted by host               90%      1012         -
#15  Short offline       Completed without error       00%      1003         -
#16  Short offline       Aborted by host               90%       959         -
#17  Short offline       Completed without error       00%       945         -
#18  Short offline       Aborted by host               90%       933         -
#19  Short offline       Aborted by host               90%       931         -
#20  Short offline       Aborted by host               90%       855         -
#21  Short offline       Aborted by host               90%       818         -
#22  Short offline       Completed without error       00%       633         -
#23  Short offline       Aborted by host               90%       508         -
#24  Short offline       Completed without error       00%       153         -
#25  Short offline       Completed without error       00%       142         -

SMART Selective self-test log data structure revision number 1
 SPAN  MIN_LBA  MAX_LBA  CURRENT_TEST_STATUS
    1        0        0  Not_testing
    2        0        0  Not_testing
    3        0        0  Not_testing
    4        0        0  Not_testing
    5        0        0  Not_testing
Selective self-test flags (0x0):
  After scanning selected spans, do NOT read-scan remainder of disk.
If Selective self-test is pending on power-up, resume after 0 minute delay.

SCT Status Version:                  2
SCT Version (vendor specific):       0 (0x0000)
SCT Support Level:                   1
Device State:                        Active (0)
Current Temperature:                    33 Celsius
Power Cycle Min/Max Temperature:     26/38 Celsius
Lifetime    Min/Max Temperature:     14/58 Celsius
Under/Over Temperature Limit Count:   0/0

SCT Temperature History Version:     2
Temperature Sampling Period:         1 minute
Temperature Logging Interval:        1 minute
Min/Max recommended Temperature:      5/60 Celsius
Min/Max Temperature Limit:           -40/65 Celsius
Temperature History Size (Index):    478 (59)

SCT Error Recovery Control:
           Read: Disabled
          Write: Disabled

Device Statistics (GP/SMART Log 0x04) not supported

Pending Defects log (GP Log 0x0c) not supported

SATA Phy Event Counters (GP Log 0x11)
ID      Size     Value  Description
0x0001  4            0  Command failed due to ICRC error
0x0002  4            0  R_ERR response for data FIS
0x0003  4            0  R_ERR response for device-to-host data FIS
0x0004  4            0  R_ERR response for host-to-device data FIS
0x0005  4            0  R_ERR response for non-data FIS
0x0006  4            0  R_ERR response for device-to-host non-data FIS
0x0008  4            0  Device-to-host non-data FIS retries
0x0009  4            0  Transition from drive PhyRdy to drive PhyNRdy
0x000a  4            0  Device-to-host register FISes sent due to a COMRESET
0x000b  4            0  CRC errors within host-to-device FIS
0x000d  4            0  Non-CRC errors within host-to-device FIS
0x000f  4            0  R_ERR response for host-to-device data FIS, CRC
0x0010  4            0  R_ERR response for host-to-device data FIS, non-CRC

