smartctl 7.1 2019-12-30 r5022 [x86_64-linux-4.18.0-553.34.1.el8_10.x86_64] (local build)
Copyright (C) 2002-19, Bruce Allen, Christian Franke, www.smartmontools.org

=== START OF INFORMATION SECTION ===
Model Family:     Western Digital Se
Device Model:     WDC WD4000F9YZ-09N20L0
Serial Number:    --
LU WWN Device Id: 5 0014ee ...
Firmware Version: 01.01A01
User Capacity:    4,000,787,030,016 bytes [4.00 TB]
Sector Sizes:     512 bytes logical, 4096 bytes physical
Rotation Rate:    7200 rpm
Device is:        In smartctl database [for details use: -P show]
ATA Version is:   ATA8-ACS (minor revision not indicated)
SATA Version is:  SATA 3.0, 6.0 Gb/s (current: 6.0 Gb/s)
Local Time is:    Wed Jan 29 16:26:35 2025 EST
SMART support is: Available - device has SMART capability.
SMART support is: Enabled
AAM feature is:   Unavailable
APM level is:     128 (minimum power consumption without standby)
Rd look-ahead is: Enabled
Write cache is:   Enabled
DSN feature is:   Unavailable
ATA Security is:  Disabled, NOT FROZEN [SEC1]
Wt Cache Reorder: Enabled

=== START OF READ SMART DATA SECTION ===
SMART overall-health self-assessment test result: PASSED

General SMART Values:
Offline data collection status:  (0x82)	Offline data collection activity
					was completed without error.
					Auto Offline Data Collection: Enabled.
Self-test execution status:      (   0)	The previous self-test routine completed
					without error or no self-test has ever 
					been run.
Total time to complete Offline 
data collection: 		(42720) seconds.
Offline data collection
capabilities: 			 (0x7b) SMART execute Offline immediate.
					Auto Offline data collection on/off support.
					Suspend Offline collection upon new
					command.
					Offline surface scan supported.
					Self-test supported.
					Conveyance Self-test supported.
					Selective Self-test supported.
SMART capabilities:            (0x0003)	Saves SMART data before entering
					power-saving mode.
					Supports SMART auto save timer.
Error logging capability:        (0x01)	Error logging supported.
					General Purpose Logging supported.
Short self-test routine 
recommended polling time: 	 (   2) minutes.
Extended self-test routine
recommended polling time: 	 ( 462) minutes.
Conveyance self-test routine
recommended polling time: 	 (   5) minutes.
SCT capabilities: 	       (0x70bd)	SCT Status supported.
					SCT Error Recovery Control supported.
					SCT Feature Control supported.
					SCT Data Table supported.

SMART Attributes Data Structure revision number: 16
Vendor Specific SMART Attributes with Thresholds:
ID# ATTRIBUTE_NAME          FLAGS    VALUE WORST THRESH FAIL RAW_VALUE
  1 Raw_Read_Error_Rate     POSR-K   200   200   051    -    0
  3 Spin_Up_Time            POS--K   151   136   021    -    11416
  4 Start_Stop_Count        -O--CK   100   100   000    -    297
  5 Reallocated_Sector_Ct   PO--CK   200   200   140    -    0
  7 Seek_Error_Rate         -OSR-K   200   200   000    -    0
  9 Power_On_Hours          -O--CK   001   001   000    -    81863
 10 Spin_Retry_Count        -O--CK   100   100   000    -    0
 11 Calibration_Retry_Count -O--CK   100   100   000    -    0
 12 Power_Cycle_Count       -O--CK   100   100   000    -    295
183 Runtime_Bad_Block       -O--CK   100   100   000    -    0
192 Power-Off_Retract_Count -O--CK   200   200   000    -    266
193 Load_Cycle_Count        -O--CK   200   200   000    -    33
194 Temperature_Celsius     -O---K   119   091   000    -    33
196 Reallocated_Event_Count -O--CK   200   200   000    -    0
197 Current_Pending_Sector  -O--CK   200   200   000    -    0
198 Offline_Uncorrectable   ----CK   200   200   000    -    0
199 UDMA_CRC_Error_Count    -O--CK   200   200   000    -    0
200 Multi_Zone_Error_Rate   ---R--   200   200   000    -    0
                            ||||||_ K auto-keep
                            |||||__ C event count
                            ||||___ R error rate
                            |||____ S speed/performance
                            ||_____ O updated online
                            |______ P prefailure warning

General Purpose Log Directory Version 1
SMART           Log Directory Version 1 [multi-sector log support]
Address    Access  R/W   Size  Description
0x00       GPL,SL  R/O      1  Log Directory
0x01           SL  R/O      1  Summary SMART error log
0x02           SL  R/O      5  Comprehensive SMART error log
0x03       GPL     R/O      6  Ext. Comprehensive SMART error log
0x04       GPL,SL  R/O      8  Device Statistics log
0x06           SL  R/O      1  SMART self-test log
0x07       GPL     R/O      1  Extended self-test log
0x08       GPL     R/O      2  Power Conditions log
0x09           SL  R/W      1  Selective self-test log
0x10       GPL     R/O      1  NCQ Command Error log
0x11       GPL     R/O      1  SATA Phy Event Counters log
0x24       GPL     R/O      1  Current Device Internal Status Data log
0x80-0x9f  GPL,SL  R/W     16  Host vendor specific log
0xa0-0xa7  GPL,SL  VS      16  Device vendor specific log
0xa8-0xb7  GPL,SL  VS       1  Device vendor specific log
0xbd       GPL,SL  VS       1  Device vendor specific log
0xc0       GPL,SL  VS       1  Device vendor specific log
0xc1       GPL     VS      93  Device vendor specific log
0xe0       GPL,SL  R/W      1  SCT Command/Status
0xe1       GPL,SL  R/W      1  SCT Data Transfer

SMART Extended Comprehensive Error Log Version: 1 (6 sectors)
Device Error Count: 22
	CR     = Command Register
	FEATR  = Features Register
	COUNT  = Count (was: Sector Count) Register
	LBA_48 = Upper bytes of LBA High/Mid/Low Registers ]  ATA-8
	LH     = LBA High (was: Cylinder High) Register    ]   LBA
	LM     = LBA Mid (was: Cylinder Low) Register      ] Register
	LL     = LBA Low (was: Sector Number) Register     ]
	DV     = Device (was: Device/Head) Register
	DC     = Device Control Register
	ER     = Error register
	ST     = Status register
Powered_Up_Time is measured from power on, and printed as
DDd+hh:mm:SS.sss where DD=days, hh=hours, mm=minutes,
SS=sec, and sss=millisec. It "wraps" after 49.710 days.

Error 22 [21] occurred at disk power-on lifetime: 15634 hours (651 days + 10 hours)
  When the command that caused the error occurred, the device was active or idle.

  After command completion occurred, registers were:
  ER -- ST COUNT  LBA_48  LH LM LL DV DC
  -- -- -- == -- == == == -- -- -- -- --
  40 -- 51 00 00 00 01 75 94 80 00 40 00  Error: UNC at LBA = 0x175948000 = 6267633664

  Commands leading to the command that caused the error were:
  CR FEATR COUNT  LBA_48  LH LM LL DV DC  Powered_Up_Time  Command/Feature_Name
  -- == -- == -- == == == -- -- -- -- --  ---------------  --------------------
  60 04 00 00 00 00 01 75 94 80 00 40 00  5d+10:02:50.675  READ FPDMA QUEUED
  60 04 00 00 10 00 01 75 94 7c 00 40 00  5d+10:02:38.808  READ FPDMA QUEUED
  60 03 e0 00 08 00 01 75 94 78 20 40 00  5d+10:02:38.807  READ FPDMA QUEUED
  60 00 20 00 00 00 01 75 94 78 00 40 00  5d+10:02:38.807  READ FPDMA QUEUED
  60 03 d8 00 08 00 01 75 94 1c 00 40 00  5d+10:00:32.614  READ FPDMA QUEUED

Error 21 [20] occurred at disk power-on lifetime: 14427 hours (601 days + 3 hours)
  When the command that caused the error occurred, the device was active or idle.

  After command completion occurred, registers were:
  ER -- ST COUNT  LBA_48  LH LM LL DV DC
  -- -- -- == -- == == == -- -- -- -- --
  40 -- 51 00 00 00 01 92 0f 48 00 40 00  Error: UNC at LBA = 0x1920f4800 = 6745442304

  Commands leading to the command that caused the error were:
  CR FEATR COUNT  LBA_48  LH LM LL DV DC  Powered_Up_Time  Command/Feature_Name
  -- == -- == -- == == == -- -- -- -- --  ---------------  --------------------
  60 04 00 00 00 00 01 92 0f 48 00 40 00  7d+12:05:43.301  READ FPDMA QUEUED
  60 04 00 00 08 00 01 92 0f 44 00 40 00  7d+12:05:43.152  READ FPDMA QUEUED
  60 04 00 00 00 00 01 92 0f 40 00 40 00  7d+12:05:43.152  READ FPDMA QUEUED
  60 04 00 00 00 00 01 92 0f 38 00 40 00  7d+12:05:43.151  READ FPDMA QUEUED
  60 04 00 00 00 00 01 92 0f 34 00 40 00  7d+12:05:43.150  READ FPDMA QUEUED

Error 20 [19] occurred at disk power-on lifetime: 9027 hours (376 days + 3 hours)
  When the command that caused the error occurred, the device was active or idle.

  After command completion occurred, registers were:
  ER -- ST COUNT  LBA_48  LH LM LL DV DC
  -- -- -- == -- == == == -- -- -- -- --
  40 -- 51 00 00 00 00 92 e3 e6 a0 40 00  Error: UNC at LBA = 0x92e3e6a0 = 2464409248

  Commands leading to the command that caused the error were:
  CR FEATR COUNT  LBA_48  LH LM LL DV DC  Powered_Up_Time  Command/Feature_Name
  -- == -- == -- == == == -- -- -- -- --  ---------------  --------------------
  60 01 60 00 00 00 00 92 e3 e6 a0 40 00 24d+22:03:17.877  READ FPDMA QUEUED
  60 04 00 00 00 00 00 92 e3 dc 00 40 00 24d+22:03:17.822  READ FPDMA QUEUED
  60 01 60 00 00 00 00 92 e3 da a0 40 00 24d+22:03:17.822  READ FPDMA QUEUED
  60 02 98 00 08 00 00 92 e3 d8 00 40 00 24d+22:03:17.808  READ FPDMA QUEUED
  60 04 00 00 00 00 00 92 e3 d4 00 40 00 24d+22:03:17.808  READ FPDMA QUEUED

Error 19 [18] occurred at disk power-on lifetime: 7663 hours (319 days + 7 hours)
  When the command that caused the error occurred, the device was active or idle.

  After command completion occurred, registers were:
  ER -- ST COUNT  LBA_48  LH LM LL DV DC
  -- -- -- == -- == == == -- -- -- -- --
  40 -- 51 00 00 00 00 a0 ce d4 00 40 00  Error: UNC at LBA = 0xa0ced400 = 2697909248

  Commands leading to the command that caused the error were:
  CR FEATR COUNT  LBA_48  LH LM LL DV DC  Powered_Up_Time  Command/Feature_Name
  -- == -- == -- == == == -- -- -- -- --  ---------------  --------------------
  60 04 00 00 00 00 00 a0 ce d4 00 40 00  7d+14:07:18.152  READ FPDMA QUEUED
  60 03 c0 00 10 00 00 a0 ce d0 00 40 00  7d+14:07:17.832  READ FPDMA QUEUED
  60 00 40 00 08 00 00 a0 ce d3 c0 40 00  7d+14:07:17.832  READ FPDMA QUEUED
  60 04 00 00 00 00 00 a0 ce cc 00 40 00  7d+14:07:17.832  READ FPDMA QUEUED
  60 00 40 00 00 00 00 a0 ce cb c0 40 00  7d+14:07:17.404  READ FPDMA QUEUED

Error 18 [17] occurred at disk power-on lifetime: 7278 hours (303 days + 6 hours)
  When the command that caused the error occurred, the device was active or idle.

  After command completion occurred, registers were:
  ER -- ST COUNT  LBA_48  LH LM LL DV DC
  -- -- -- == -- == == == -- -- -- -- --
  40 -- 51 00 00 00 01 8c 31 c8 00 40 00  Error: UNC at LBA = 0x18c31c800 = 6647040000

  Commands leading to the command that caused the error were:
  CR FEATR COUNT  LBA_48  LH LM LL DV DC  Powered_Up_Time  Command/Feature_Name
  -- == -- == -- == == == -- -- -- -- --  ---------------  --------------------
  60 04 00 00 00 00 01 8c 31 c8 00 40 00  5d+09:02:29.498  READ FPDMA QUEUED
  60 04 00 00 08 00 01 8c 31 c4 00 40 00  5d+09:02:22.729  READ FPDMA QUEUED
  60 00 80 00 00 00 01 8c 31 bf 80 40 00  5d+09:02:22.610  READ FPDMA QUEUED
  60 00 20 00 10 00 01 40 a9 18 00 40 00  5d+09:02:20.541  READ FPDMA QUEUED
  60 03 e0 00 08 00 01 40 a9 18 20 40 00  5d+09:02:20.541  READ FPDMA QUEUED

Error 17 [16] occurred at disk power-on lifetime: 7134 hours (297 days + 6 hours)
  When the command that caused the error occurred, the device was active or idle.

  After command completion occurred, registers were:
  ER -- ST COUNT  LBA_48  LH LM LL DV DC
  -- -- -- == -- == == == -- -- -- -- --
  04 -- 51 00 00 00 00 00 e7 9e 28 07 00

  Commands leading to the command that caused the error were:
  CR FEATR COUNT  LBA_48  LH LM LL DV DC  Powered_Up_Time  Command/Feature_Name
  -- == -- == -- == == == -- -- -- -- --  ---------------  --------------------
  ea 00 00 00 00 00 00 00 00 00 00 40 00  7d+14:38:28.932  FLUSH CACHE EXT
  ea 00 00 00 00 00 00 00 00 00 00 40 00  7d+14:38:28.909  FLUSH CACHE EXT
  b0 00 d0 00 01 00 00 00 c2 4f 00 00 00  7d+14:20:12.772  SMART READ DATA
  b0 00 da 00 00 00 00 00 c2 4f 00 00 00  7d+14:20:12.718  SMART RETURN STATUS
  e5 00 00 00 00 00 00 00 00 00 00 00 00  7d+14:20:12.718  CHECK POWER MODE

Error 16 [15] occurred at disk power-on lifetime: 4691 hours (195 days + 11 hours)
  When the command that caused the error occurred, the device was active or idle.

  After command completion occurred, registers were:
  ER -- ST COUNT  LBA_48  LH LM LL DV DC
  -- -- -- == -- == == == -- -- -- -- --
  04 -- 51 00 00 00 00 00 e7 9e 28 07 00

  Commands leading to the command that caused the error were:
  CR FEATR COUNT  LBA_48  LH LM LL DV DC  Powered_Up_Time  Command/Feature_Name
  -- == -- == -- == == == -- -- -- -- --  ---------------  --------------------
  ea 00 00 00 00 00 00 00 00 00 00 40 00 34d+16:22:49.871  FLUSH CACHE EXT
  61 02 68 00 00 00 01 06 9e 65 98 40 00 34d+16:22:49.479  WRITE FPDMA QUEUED
  61 00 b0 00 00 00 01 06 9e 64 e8 40 00 34d+16:22:49.451  WRITE FPDMA QUEUED
  61 04 00 00 20 00 01 06 9e 04 00 40 00 34d+16:22:49.439  WRITE FPDMA QUEUED
  61 00 e8 00 18 00 01 06 9e 64 00 40 00 34d+16:22:49.439  WRITE FPDMA QUEUED

Error 15 [14] occurred at disk power-on lifetime: 3699 hours (154 days + 3 hours)
  When the command that caused the error occurred, the device was active or idle.

  After command completion occurred, registers were:
  ER -- ST COUNT  LBA_48  LH LM LL DV DC
  -- -- -- == -- == == == -- -- -- -- --
  04 -- 51 00 00 00 00 00 e7 9e 28 07 00

  Commands leading to the command that caused the error were:
  CR FEATR COUNT  LBA_48  LH LM LL DV DC  Powered_Up_Time  Command/Feature_Name
  -- == -- == -- == == == -- -- -- -- --  ---------------  --------------------
  ea 00 00 00 00 00 00 00 00 00 00 40 00  1d+01:00:29.105  FLUSH CACHE EXT
  61 00 01 00 00 00 00 00 00 08 08 c0 00  1d+01:00:29.037  WRITE FPDMA QUEUED
  ea 00 00 00 00 00 00 00 00 00 00 40 00  1d+01:00:29.037  FLUSH CACHE EXT
  61 00 08 00 00 00 00 00 00 08 10 c0 00  1d+01:00:29.010  WRITE FPDMA QUEUED
  ea 00 00 00 00 00 00 00 00 00 00 40 00  1d+01:00:29.010  FLUSH CACHE EXT

SMART Extended Self-test Log Version: 1 (1 sectors)
No self-tests have been logged.  [To run self-tests, use: smartctl -t]

SMART Selective self-test log data structure revision number 1
 SPAN  MIN_LBA  MAX_LBA  CURRENT_TEST_STATUS
    1        0        0  Not_testing
    2        0        0  Not_testing
    3        0        0  Not_testing
    4        0        0  Not_testing
    5        0        0  Not_testing
Selective self-test flags (0x0):
  After scanning selected spans, do NOT read-scan remainder of disk.
If Selective self-test is pending on power-up, resume after 0 minute delay.

SCT Status Version:                  3
SCT Version (vendor specific):       258 (0x0102)
Device State:                        Active (0)
Current Temperature:                    33 Celsius
Power Cycle Min/Max Temperature:     27/36 Celsius
Lifetime    Min/Max Temperature:      0/61 Celsius
Under/Over Temperature Limit Count:   0/0
Vendor specific:
01 00 00 00 00 00 00 00 00 00 00 00 00 00 00 00
00 00 00 00 00 00 00 00 00 00 00 00 00 00 00 00

SCT Temperature History Version:     2
Temperature Sampling Period:         1 minute
Temperature Logging Interval:        1 minute
Min/Max recommended Temperature:      0/60 Celsius
Min/Max Temperature Limit:           -41/85 Celsius
Temperature History Size (Index):    478 (87)

SCT Error Recovery Control:
           Read:     70 (7.0 seconds)
          Write:     70 (7.0 seconds)

Device Statistics (GP Log 0x04)
Page  Offset Size        Value Flags Description
0x01  =====  =               =  ===  == General Statistics (rev 2) ==
0x01  0x008  4             295  ---  Lifetime Power-On Resets
0x01  0x010  4           81863  ---  Power-on Hours
0x01  0x018  6   9621605465004  ---  Logical Sectors Written
0x01  0x020  6       596627890  ---  Number of Write Commands
0x01  0x028  6   2403729697620  ---  Logical Sectors Read
0x01  0x030  6     20012111927  ---  Number of Read Commands
0x03  =====  =               =  ===  == Rotating Media Statistics (rev 1) ==
0x03  0x008  4           82280  ---  Spindle Motor Power-on Hours
0x03  0x010  4           82277  ---  Head Flying Hours
0x03  0x018  4             300  ---  Head Load Events
0x03  0x020  4             200  N--  Number of Reallocated Logical Sectors
0x03  0x028  4           44632  ---  Read Recovery Attempts
0x03  0x030  4               0  ---  Number of Mechanical Start Failures
0x04  =====  =               =  ===  == General Errors Statistics (rev 1) ==
0x04  0x008  4              15  ---  Number of Reported Uncorrectable Errors
0x04  0x010  4         1114131  ---  Resets Between Cmd Acceptance and Completion
0x05  =====  =               =  ===  == Temperature Statistics (rev 1) ==
0x05  0x008  1              33  ---  Current Temperature
0x05  0x010  1              33  ---  Average Short Term Temperature
0x05  0x018  1              32  ---  Average Long Term Temperature
0x05  0x020  1              61  ---  Highest Temperature
0x05  0x028  1              24  ---  Lowest Temperature
0x05  0x030  1              58  ---  Highest Average Short Term Temperature
0x05  0x038  1              24  ---  Lowest Average Short Term Temperature
0x05  0x040  1              49  ---  Highest Average Long Term Temperature
0x05  0x048  1              25  ---  Lowest Average Long Term Temperature
0x05  0x050  4             190  ---  Time in Over-Temperature
0x05  0x058  1              60  ---  Specified Maximum Operating Temperature
0x05  0x060  4               0  ---  Time in Under-Temperature
0x05  0x068  1               0  ---  Specified Minimum Operating Temperature
0x06  =====  =               =  ===  == Transport Statistics (rev 1) ==
0x06  0x008  4            1174  ---  Number of Hardware Resets
0x06  0x010  4          610516  ---  Number of ASR Events
0x06  0x018  4               0  ---  Number of Interface CRC Errors
                                |||_ C monitored condition met
                                ||__ D supports DSN
                                |___ N normalized value

Pending Defects log (GP Log 0x0c) not supported

SATA Phy Event Counters (GP Log 0x11)
ID      Size     Value  Description
0x0001  2            0  Command failed due to ICRC error
0x0002  2            0  R_ERR response for data FIS
0x0003  2            0  R_ERR response for device-to-host data FIS
0x0004  2            0  R_ERR response for host-to-device data FIS
0x0005  2            0  R_ERR response for non-data FIS
0x0006  2            0  R_ERR response for device-to-host non-data FIS
0x0007  2            0  R_ERR response for host-to-device non-data FIS
0x0008  2            0  Device-to-host non-data FIS retries
0x0009  2            1  Transition from drive PhyRdy to drive PhyNRdy
0x000a  2            2  Device-to-host register FISes sent due to a COMRESET
0x000b  2            0  CRC errors within host-to-device FIS
0x000f  2            0  R_ERR response for host-to-device data FIS, CRC
0x0012  2            0  R_ERR response for host-to-device non-data FIS, CRC
0x8000  4       982173  Vendor specific



