smartctl 7.5 2025-04-30 r5714 [x86_64-linux-6.12.47-generic-5rosa13-x86_64] (local build)
Copyright (C) 2002-25, Bruce Allen, Christian Franke, www.smartmontools.org

=== START OF INFORMATION SECTION ===
Model Family:     Western Digital Scorpio Blue Serial ATA
Device Model:     WDC WD3200BEVT-22ZCT0
Serial Number:    --
LU WWN Device Id: 5 0014ee ...
Firmware Version: 11.01A11
User Capacity:    320,072,933,376 bytes [320 GB]
Sector Size:      512 bytes logical/physical
Rotation Rate:    5400 rpm
Device is:        In smartctl database 7.5/5706
ATA Version is:   ATA8-ACS (minor revision not indicated)
SATA Version is:  SATA 2.5, 3.0 Gb/s
Local Time is:    Fri Dec 26 18:19:25 2025 +05
SMART support is: Available - device has SMART capability.
SMART support is: Enabled
AAM feature is:   Disabled
APM level is:     128 (minimum power consumption without standby)
Rd look-ahead is: Enabled
Write cache is:   Enabled
DSN feature is:   Unavailable
ATA Security is:  Disabled, frozen [SEC2]

=== START OF READ SMART DATA SECTION ===
SMART overall-health self-assessment test result: PASSED

General SMART Values:
Offline data collection status:  (0x84)	Offline data collection activity
					was suspended by an interrupting command from host.
					Auto Offline Data Collection: Enabled.
Self-test execution status:      (   0)	The previous self-test routine completed
					without error or no self-test has ever 
					been run.
Total time to complete Offline 
data collection: 		(10380) seconds.
Offline data collection
capabilities: 			 (0x7b) SMART execute Offline immediate.
					Auto Offline data collection on/off support.
					Suspend Offline collection upon new
					command.
					Offline surface scan supported.
					Self-test supported.
					Conveyance Self-test supported.
					Selective Self-test supported.
SMART capabilities:            (0x0003)	Saves SMART data before entering
					power-saving mode.
					Supports SMART auto save timer.
Error logging capability:        (0x01)	Error logging supported.
					General Purpose Logging supported.
Short self-test routine 
recommended polling time: 	 (   2) minutes.
Extended self-test routine
recommended polling time: 	 ( 122) minutes.
Conveyance self-test routine
recommended polling time: 	 (   5) minutes.
SCT capabilities: 	       (0x303f)	SCT Status supported.
					SCT Error Recovery Control supported.
					SCT Feature Control supported.
					SCT Data Table supported.

SMART Attributes Data Structure revision number: 16
Vendor Specific SMART Attributes with Thresholds:
ID# ATTRIBUTE_NAME          FLAGS    VALUE WORST THRESH FAIL RAW_VALUE
  1 Raw_Read_Error_Rate     POSR-K   200   200   051    -    487
  3 Spin_Up_Time            POS--K   187   182   021    -    1650
  4 Start_Stop_Count        -O--CK   087   087   000    -    13428
  5 Reallocated_Sector_Ct   PO--CK   200   200   140    -    0
  7 Seek_Error_Rate         -OSR-K   200   200   000    -    0
  9 Power_On_Hours          -O--CK   068   068   000    -    23452
 10 Spin_Retry_Count        PO--CK   100   099   051    -    0
 11 Calibration_Retry_Count -O--CK   100   100   000    -    0
 12 Power_Cycle_Count       -O--CK   089   089   000    -    11217
192 Power-Off_Retract_Count -O--CK   199   199   000    -    1051
193 Load_Cycle_Count        -O--CK   099   099   000    -    304508
194 Temperature_Celsius     -O---K   121   078   000    -    26
196 Reallocated_Event_Count -O--CK   200   200   000    -    0
197 Current_Pending_Sector  -O--CK   200   200   000    -    0
198 Offline_Uncorrectable   ----CK   200   200   000    -    0
199 UDMA_CRC_Error_Count    -O--CK   200   200   000    -    0
200 Multi_Zone_Error_Rate   P--R--   200   200   051    -    0
                            ||||||_ K auto-keep
                            |||||__ C event count
                            ||||___ R error rate
                            |||____ S speed/performance
                            ||_____ O updated online
                            |______ P prefailure warning

General Purpose Log Directory Version 1
SMART           Log Directory Version 1 [multi-sector log support]
Address    Access  R/W   Size  Description
0x00       GPL,SL  R/O      1  Log Directory
0x01           SL  R/O      1  Summary SMART error log
0x02           SL  R/O      5  Comprehensive SMART error log
0x03       GPL     R/O      6  Ext. Comprehensive SMART error log
0x06           SL  R/O      1  SMART self-test log
0x07       GPL     R/O      1  Extended self-test log
0x09           SL  R/W      1  Selective self-test log
0x10       GPL     R/O      1  NCQ Command Error log
0x11       GPL     R/O      1  SATA Phy Event Counters log
0x80-0x9f  GPL,SL  R/W     16  Host vendor specific log
0xa0-0xa7  GPL,SL  VS      16  Device vendor specific log
0xa8-0xb7  GPL,SL  VS       1  Device vendor specific log
0xc0       GPL,SL  VS       1  Device vendor specific log
0xc1       GPL     VS      24  Device vendor specific log
0xe0       GPL,SL  R/W      1  SCT Command/Status
0xe1       GPL,SL  R/W      1  SCT Data Transfer

SMART Extended Comprehensive Error Log Version: 1 (6 sectors)
Device Error Count: 73 (device log contains only the most recent 24 errors)
	CR     = Command Register
	FEATR  = Features Register
	COUNT  = Count (was: Sector Count) Register
	LBA_48 = Upper bytes of LBA High/Mid/Low Registers ]  ATA-8
	LH     = LBA High (was: Cylinder High) Register    ]   LBA
	LM     = LBA Mid (was: Cylinder Low) Register      ] Register
	LL     = LBA Low (was: Sector Number) Register     ]
	DV     = Device (was: Device/Head) Register
	DC     = Device Control Register
	ER     = Error register
	ST     = Status register
Powered_Up_Time is measured from power on, and printed as
DDd+hh:mm:SS.sss where DD=days, hh=hours, mm=minutes,
SS=sec, and sss=millisec. It "wraps" after 49.710 days.

Error 73 [0] occurred at disk power-on lifetime: 0 hours (0 days + 0 hours)
  When the command that caused the error occurred, the device was in an unknown state.

  After command completion occurred, registers were:
  ER -- ST COUNT  LBA_48  LH LM LL DV DC
  -- -- -- == -- == == == -- -- -- -- --
  40 -- 00 01 3f 00 51 00 00 e0 01 00 00

  Commands leading to the command that caused the error were:
  CR FEATR COUNT  LBA_48  LH LM LL DV DC  Powered_Up_Time  Command/Feature_Name
  -- == -- == -- == == == -- -- -- -- --  ---------------  --------------------
  00 9a 42 38 3a 00 00 00 00 00 00 00 01     00:00:00.000  NOP [Reserved subcommand] [OBS-ACS-2]
  00 3f ff 00 15 38 87 01 2e 42 00 00 00     00:00:05.439  NOP [Reserved subcommand] [OBS-ACS-2]
  01 fe 35 38 22 00 3f 00 15 ff 00 00 01     01:01:18.978  [RESERVED]
  00 01 ff 00 d6 38 fe 01 22 35 00 00 00     00:00:56.321  NOP [Reserved subcommand] [OBS-ACS-2]

Error 72 [23] occurred at disk power-on lifetime: 0 hours (0 days + 0 hours)
  When the command that caused the error occurred, the device was in an unknown state.

  After command completion occurred, registers were:
  ER -- ST COUNT  LBA_48  LH LM LL DV DC
  -- -- -- == -- == == == -- -- -- -- --
  40 -- 00 01 3f 00 51 00 00 e0 01 00 00

  Commands leading to the command that caused the error were:
  CR FEATR COUNT  LBA_48  LH LM LL DV DC  Powered_Up_Time  Command/Feature_Name
  -- == -- == -- == == == -- -- -- -- --  ---------------  --------------------
  00 87 42 38 2e 00 00 00 00 00 00 00 01     00:00:00.000  NOP [Reserved subcommand] [OBS-ACS-2]
  00 3f ff 00 15 38 02 01 23 42 00 00 00     00:00:05.439  NOP [Reserved subcommand] [OBS-ACS-2]
  01 fe 35 38 22 00 01 00 dc ff 00 00 01     01:01:18.974  [RESERVED]
  00 3f ff 00 d6 38 f7 01 22 42 00 00 00     00:00:54.785  NOP [Reserved subcommand] [OBS-ACS-2]

Error 71 [22] occurred at disk power-on lifetime: 0 hours (0 days + 0 hours)
  When the command that caused the error occurred, the device was in an unknown state.

  After command completion occurred, registers were:
  ER -- ST COUNT  LBA_48  LH LM LL DV DC
  -- -- -- == -- == == == -- -- -- -- --
  40 -- 00 01 3f 00 51 00 00 e0 01 00 00

  Commands leading to the command that caused the error were:
  CR FEATR COUNT  LBA_48  LH LM LL DV DC  Powered_Up_Time  Command/Feature_Name
  -- == -- == -- == == == -- -- -- -- --  ---------------  --------------------
  00 02 42 38 23 00 00 00 00 00 00 00 01     00:00:00.000  NOP [Reserved subcommand] [OBS-ACS-2]
  00 01 ff 00 dc 38 fe 01 22 35 00 00 00     00:00:05.439  NOP [Reserved subcommand] [OBS-ACS-2]
  01 f7 42 38 22 00 01 00 d6 ff 00 00 01     01:01:18.974  [RESERVED]
  00 01 ff 00 9d 38 f3 01 22 35 00 00 00     00:00:54.847  NOP [Reserved subcommand] [OBS-ACS-2]

Error 70 [21] occurred at disk power-on lifetime: 0 hours (0 days + 0 hours)
  When the command that caused the error occurred, the device was in an unknown state.

  After command completion occurred, registers were:
  ER -- ST COUNT  LBA_48  LH LM LL DV DC
  -- -- -- == -- == == == -- -- -- -- --
  40 -- 00 01 3f 00 51 00 00 e0 01 00 00

  Commands leading to the command that caused the error were:
  CR FEATR COUNT  LBA_48  LH LM LL DV DC  Powered_Up_Time  Command/Feature_Name
  -- == -- == -- == == == -- -- -- -- --  ---------------  --------------------
  00 84 42 1c f6 00 00 00 00 00 00 00 01     00:00:00.000  NOP [Reserved subcommand] [OBS-ACS-2]
  00 3f ff 00 15 1c ea 01 e9 42 00 00 00     00:00:05.439  NOP [Reserved subcommand] [OBS-ACS-2]
  01 d4 35 1c dd 00 3f 00 15 ff 00 00 01     00:31:31.800  [RESERVED]
  00 01 ff 00 d6 1c d3 01 dd 35 00 00 00     00:00:56.321  NOP [Reserved subcommand] [OBS-ACS-2]

Error 69 [20] occurred at disk power-on lifetime: 0 hours (0 days + 0 hours)
  When the command that caused the error occurred, the device was in an unknown state.

  After command completion occurred, registers were:
  ER -- ST COUNT  LBA_48  LH LM LL DV DC
  -- -- -- == -- == == == -- -- -- -- --
  40 -- 00 01 3f 00 51 00 00 e0 01 00 00

  Commands leading to the command that caused the error were:
  CR FEATR COUNT  LBA_48  LH LM LL DV DC  Powered_Up_Time  Command/Feature_Name
  -- == -- == -- == == == -- -- -- -- --  ---------------  --------------------
  00 ea 42 1c e9 00 00 00 00 00 00 00 01     00:00:00.000  NOP [Reserved subcommand] [OBS-ACS-2]
  00 3f ff 00 15 1c d8 01 dd 42 00 00 00     00:00:05.439  NOP [Reserved subcommand] [OBS-ACS-2]
  01 d3 35 1c dd 00 01 00 dc ff 00 00 01     00:31:31.796  [RESERVED]
  00 3f ff 00 d6 1c cc 01 dd 42 00 00 00     00:00:54.785  NOP [Reserved subcommand] [OBS-ACS-2]

Error 68 [19] occurred at disk power-on lifetime: 0 hours (0 days + 0 hours)
  When the command that caused the error occurred, the device was in an unknown state.

  After command completion occurred, registers were:
  ER -- ST COUNT  LBA_48  LH LM LL DV DC
  -- -- -- == -- == == == -- -- -- -- --
  40 -- 00 01 3f 00 51 00 00 e0 01 00 00

  Commands leading to the command that caused the error were:
  CR FEATR COUNT  LBA_48  LH LM LL DV DC  Powered_Up_Time  Command/Feature_Name
  -- == -- == -- == == == -- -- -- -- --  ---------------  --------------------
  00 d8 42 1c dd 00 00 00 00 00 00 00 01     00:00:00.000  NOP [Reserved subcommand] [OBS-ACS-2]
  00 01 ff 00 dc 1c d4 01 dd 35 00 00 00     00:00:05.439  NOP [Reserved subcommand] [OBS-ACS-2]
  01 cc 42 1c dd 00 01 00 d6 ff 00 00 01     00:31:31.795  [RESERVED]
  00 01 ff 00 9d 1c c8 01 dd 35 00 00 00     00:00:54.847  NOP [Reserved subcommand] [OBS-ACS-2]

Error 67 [18] occurred at disk power-on lifetime: 0 hours (0 days + 0 hours)
  When the command that caused the error occurred, the device was in an unknown state.

  After command completion occurred, registers were:
  ER -- ST COUNT  LBA_48  LH LM LL DV DC
  -- -- -- == -- == == == -- -- -- -- --
  01 -- 00 01 00 00 51 00 00 40 01 00 00

  Commands leading to the command that caused the error were:
  CR FEATR COUNT  LBA_48  LH LM LL DV DC  Powered_Up_Time  Command/Feature_Name
  -- == -- == -- == == == -- -- -- -- --  ---------------  --------------------
  00 cd 61 a2 f7 00 00 00 00 00 02 00 00     00:00:00.000  NOP [Reserved subcommand] [OBS-ACS-2]
  00 10 08 00 18 a2 cd 00 f7 61 00 02 00     00:00:34.840  NOP [Reserved subcommand] [OBS-ACS-2]
  00 cc 61 a2 f7 00 10 00 48 08 02 00 01     12:17:14.700  NOP [Reserved subcommand] [OBS-ACS-2]
  00 30 08 00 b0 a2 cb 11 f7 61 00 02 00     00:01:01.496  NOP [Reserved subcommand] [OBS-ACS-2]

Error 66 [17] occurred at disk power-on lifetime: 0 hours (0 days + 0 hours)
  When the command that caused the error occurred, the device was in an unknown state.

  After command completion occurred, registers were:
  ER -- ST COUNT  LBA_48  LH LM LL DV DC
  -- -- -- == -- == == == -- -- -- -- --
  01 -- 00 01 00 00 51 00 00 40 01 00 00

  Commands leading to the command that caused the error were:
  CR FEATR COUNT  LBA_48  LH LM LL DV DC  Powered_Up_Time  Command/Feature_Name
  -- == -- == -- == == == -- -- -- -- --  ---------------  --------------------
  00 46 61 a2 eb 00 00 00 00 00 02 00 00     00:00:00.000  NOP [Reserved subcommand] [OBS-ACS-2]
  00 20 08 00 30 a2 45 18 eb 60 00 02 00     00:00:32.776  NOP [Reserved subcommand] [OBS-ACS-2]
  01 45 ef a2 eb 00 08 00 18 01 02 00 00     12:17:11.493  [RESERVED]
  00 00 02 00 00 a2 45 00 eb ef 00 02 00     00:00:00.003  NOP [Reserved subcommand] [OBS-ACS-2]

SMART Extended Self-test Log Version: 1 (1 sectors)
Num  Test_Description    Status                  Remaining  LifeTime(hours)  LBA_of_first_error
# 1  Short offline       Completed without error       00%     20821         -
# 2  Short offline       Completed without error       00%     20804         -
# 3  Short offline       Completed without error       00%     17216         -
# 4  Conveyance offline  Completed without error       00%     15358         -
# 5  Conveyance offline  Aborted by host               90%     15357         -
# 6  Conveyance offline  Aborted by host               90%     15343         -
# 7  Short offline       Completed without error       00%     15342         -
# 8  Short offline       Completed without error       00%     12930         -
# 9  Short offline       Aborted by host               90%      5125         -
#10  Short offline       Completed without error       00%      5125         -
#11  Short offline       Completed without error       00%      4895         -
#12  Short offline       Aborted by host               10%      4876         -

SMART Selective self-test log data structure revision number 1
 SPAN  MIN_LBA  MAX_LBA  CURRENT_TEST_STATUS
    1        0        0  Not_testing
    2        0        0  Not_testing
    3        0        0  Not_testing
    4        0        0  Not_testing
    5        0        0  Not_testing
Selective self-test flags (0x0):
  After scanning selected spans, do NOT read-scan remainder of disk.
If Selective self-test is pending on power-up, resume after 0 minute delay.

SCT Status Version:                  2
SCT Version (vendor specific):       258 (0x0102)
Device State:                        SMART Off-line Data Collection executing in background (4)
Current Temperature:                    26 Celsius
Power Cycle Min/Max Temperature:     21/29 Celsius
Lifetime    Min/Max Temperature:     22/70 Celsius
Under/Over Temperature Limit Count:   0/0
Vendor specific:
03 00 00 00 00 00 00 00 00 00 00 00 00 00 00 00
00 00 00 00 00 00 00 00 00 00 00 00 00 00 00 00

SCT Temperature History Version:     2
Temperature Sampling Period:         1 minute
Temperature Logging Interval:        1 minute
Min/Max recommended Temperature:      0/60 Celsius
Min/Max Temperature Limit:            1/85 Celsius
Temperature History Size (Index):    128 (52)

SCT Error Recovery Control:
           Read: Disabled
          Write: Disabled

Device Statistics (GP/SMART Log 0x04) not supported

Pending Defects log (GP Log 0x0c) not supported

SATA Phy Event Counters (GP Log 0x11)
ID      Size     Value  Description
0x0001  2            0  Command failed due to ICRC error
0x0002  2            0  R_ERR response for data FIS
0x0003  2            0  R_ERR response for device-to-host data FIS
0x0004  2            0  R_ERR response for host-to-device data FIS
0x0005  2            0  R_ERR response for non-data FIS
0x0006  2            0  R_ERR response for device-to-host non-data FIS
0x0007  2            0  R_ERR response for host-to-device non-data FIS
0x000a  2            6  Device-to-host register FISes sent due to a COMRESET
0x8000  4        10063  Vendor specific

