smartctl 7.5 2025-04-30 r5714 [x86_64-linux-6.15.2.xm1-x64v2.k.1-xanmod-rosa13-x86_64] (local build)
Copyright (C) 2002-25, Bruce Allen, Christian Franke, www.smartmontools.org

=== START OF INFORMATION SECTION ===
Model Number:                       Viper M.2 VPN100
Serial Number:                      --
Firmware Version:                   ECFM22.5
PCI Vendor/Subsystem ID:            0x1987
IEEE OUI Identifier:                0x6479a7
Total NVM Capacity:                 512,110,190,592 [512 GB]
Unallocated NVM Capacity:           0
Controller ID:                      1
NVMe Version:                       1.3
Number of Namespaces:               1
Namespace 1 Size/Capacity:          512,110,190,592 [512 GB]
Namespace 1 Formatted LBA Size:     512
Namespace 1 IEEE EUI-64:            6479a7 ...
Local Time is:                      Mon Jun 23 20:11:58 2025 +05
Firmware Updates (0x12):            1 Slot, no Reset required
Optional Admin Commands (0x0017):   Security Format Frmw_DL Self_Test
Optional NVM Commands (0x005d):     Comp DS_Mngmt Wr_Zero Sav/Sel_Feat Timestmp
Log Page Attributes (0x08):         Telmtry_Lg
Maximum Data Transfer Size:         512 Pages
Warning  Comp. Temp. Threshold:     75 Celsius
Critical Comp. Temp. Threshold:     80 Celsius

Supported Power States
St Op     Max   Active     Idle   RL RT WL WT  Ent_Lat  Ex_Lat
 0 +     8.35W       -        -    0  0  0  0        0       0
 1 +     6.51W       -        -    1  1  1  1        0       0
 2 +     5.58W       -        -    2  2  2  2        0       0
 3 -   0.0490W       -        -    3  3  3  3     2000    2000
 4 -   0.0018W       -        -    4  4  4  4    25000   25000

Supported LBA Sizes (NSID 0x1)
Id Fmt  Data  Metadt  Rel_Perf
 0 +     512       0         2
 1 -    4096       0         1

=== START OF SMART DATA SECTION ===
SMART overall-health self-assessment test result: PASSED

SMART/Health Information (NVMe Log 0x02, NSID 0xffffffff)
Critical Warning:                   0x00
Temperature:                        43 Celsius
Available Spare:                    100%
Available Spare Threshold:          5%
Percentage Used:                    28%
Data Units Read:                    180,572,806 [92.4 TB]
Data Units Written:                 139,475,047 [71.4 TB]
Host Read Commands:                 617,423,019
Host Write Commands:                909,644,830
Controller Busy Time:               4,329
Power Cycles:                       1,097
Power On Hours:                     37,605
Unsafe Shutdowns:                   234
Media and Data Integrity Errors:    0
Error Information Log Entries:      8,289
Warning  Comp. Temperature Time:    0
Critical Comp. Temperature Time:    0
Thermal Temp. 1 Transition Count:   12
Thermal Temp. 2 Transition Count:   1
Thermal Temp. 1 Total Time:         3441
Thermal Temp. 2 Total Time:         184

Error Information (NVMe Log 0x01, 16 of 63 entries)
Num   ErrCount  SQId   CmdId  Status  PELoc          LBA  NSID    VS  Message
  0       8289     0  0x0002  0x4004  0x028            0     0     -  Invalid Field in Command

Self-test Log (NVMe Log 0x06, NSID 0xffffffff)
Self-test status: No self-test in progress
Num  Test_Description  Status                       Power_on_Hours  Failing_LBA  NSID Seg SCT Code
 0   Extended          Completed without error               37542            -     -   -   -    -
 1   Extended          Completed without error               37374            -     -   -   -    -
 2   Extended          Completed without error               37188            -     -   -   -    -
 3   Short             Completed without error                2582            -     -   -   -    -



