=== START OF INFORMATION SECTION ===
Model Family:     SandForce Driven SSDs
Device Model:     KINGSTON SVP200S390G
Serial Number:    --
LU WWN Device Id: 5 0026b7 ...
Firmware Version: 501ABBF0
User Capacity:    90 028 302 336 bytes [90,0 GB]
Sector Size:      512 bytes logical/physical
Rotation Rate:    Solid State Device
Device is:        In smartctl database [for details use: -P show]
ATA Version is:   ATA8-ACS, ACS-2 T13/2015-D revision 3
SATA Version is:  SATA 3.0, 6.0 Gb/s (current: 6.0 Gb/s)
Local Time is:    Thu Dec  7 16:55:39 2017 +04
SMART support is: Available - device has SMART capability.
SMART support is: Enabled
AAM feature is:   Unavailable
APM level is:     254 (maximum performance)
Rd look-ahead is: Disabled
Write cache is:   Enabled
ATA Security is:  Disabled, frozen [SEC2]
Wt Cache Reorder: Unavailable

=== START OF READ SMART DATA SECTION ===
SMART overall-health self-assessment test result: PASSED

General SMART Values:
Offline data collection status:  (0x00)	Offline data collection activity
					was never started.
					Auto Offline Data Collection: Disabled.
Self-test execution status:      (   0)	The previous self-test routine completed
					without error or no self-test has ever 
					been run.
Total time to complete Offline 
data collection: 		(    0) seconds.
Offline data collection
capabilities: 			 (0x7b) SMART execute Offline immediate.
					Auto Offline data collection on/off support.
					Suspend Offline collection upon new
					command.
					Offline surface scan supported.
					Self-test supported.
					Conveyance Self-test supported.
					Selective Self-test supported.
SMART capabilities:            (0x0003)	Saves SMART data before entering
					power-saving mode.
					Supports SMART auto save timer.
Error logging capability:        (0x01)	Error logging supported.
					General Purpose Logging supported.
Short self-test routine 
recommended polling time: 	 (   1) minutes.
Extended self-test routine
recommended polling time: 	 (  48) minutes.
Conveyance self-test routine
recommended polling time: 	 (   2) minutes.
SCT capabilities: 	       (0x0001)	SCT Status supported.

SMART Attributes Data Structure revision number: 10
Vendor Specific SMART Attributes with Thresholds:
ID# ATTRIBUTE_NAME          FLAGS    VALUE WORST THRESH FAIL RAW_VALUE
  1 Raw_Read_Error_Rate     POSR--   105   105   050    -    0/11677306
  5 Retired_Block_Count     PO--CK   100   100   003    -    0
  9 Power_On_Hours_and_Msec -O--CK   000   000   000    -    16479h+46m+13.460s
 12 Power_Cycle_Count       -O--CK   097   097   000    -    3278
171 Program_Fail_Count      -O--CK   000   000   000    -    0
172 Erase_Fail_Count        -O--CK   000   000   000    -    0
174 Unexpect_Power_Loss_Ct  ----CK   000   000   000    -    193
177 Wear_Range_Delta        ------   000   000   000    -    5
181 Program_Fail_Count      -O--CK   000   000   000    -    0
182 Erase_Fail_Count        -O--CK   000   000   000    -    0
187 Reported_Uncorrect      -O--CK   100   100   000    -    0
194 Temperature_Celsius     -O---K   031   082   000    -    31 (Min/Max 15/82)
195 ECC_Uncorr_Error_Count  --SRC-   120   120   000    -    0/11677306
196 Reallocated_Event_Count PO--CK   100   100   003    -    0
201 Unc_Soft_Read_Err_Rate  --SRC-   120   120   000    -    0/11677306
204 Soft_ECC_Correct_Rate   --SRC-   120   120   000    -    0/11677306
230 Life_Curve_Status       PO--C-   100   100   000    -    100
231 SSD_Life_Left           PO--C-   098   098   010    -    0
233 SandForce_Internal      ------   000   000   000    -    12293
234 SandForce_Internal      -O--CK   000   000   000    -    14060
241 Lifetime_Writes_GiB     -O--CK   000   000   000    -    14060
242 Lifetime_Reads_GiB      -O--CK   000   000   000    -    10583
                            ||||||_ K auto-keep
                            |||||__ C event count
                            ||||___ R error rate
                            |||____ S speed/performance
                            ||_____ O updated online
                            |______ P prefailure warning

General Purpose Log Directory Version 0
SMART           Log Directory Version 0
Address    Access  R/W   Size  Description
0x00       GPL,SL  R/O      1  Log Directory

SMART Extended Comprehensive Error Log (GP Log 0x03) not supported

SMART Error Log not supported

SMART Extended Self-test Log (GP Log 0x07) not supported

SMART Self-test Log not supported

SMART Selective self-test log data structure revision number 0
Note: revision number not 1 implies that no selective self-test has ever been run
 SPAN  MIN_LBA  MAX_LBA  CURRENT_TEST_STATUS
    1        0        0  Not_testing
    2        0        0  Not_testing
    3        0        0  Not_testing
    4        0        0  Not_testing
    5        0        0  Not_testing
Selective self-test flags (0x0):
  After scanning selected spans, do NOT read-scan remainder of disk.
If Selective self-test is pending on power-up, resume after 0 minute delay.

SCT Status Version:                  3
SCT Version (vendor specific):       0 (0x0000)
SCT Support Level:                   1
Device State:                        Active (0)
Current Temperature:                    31 Celsius
Power Cycle Min/Max Temperature:     21/31 Celsius
Lifetime    Min/Max Temperature:     15/82 Celsius
Under/Over Temperature Limit Count:   0/0

SCT Data Table command not supported

SCT Error Recovery Control command not supported

Device Statistics (GP/SMART Log 0x04) not supported

SATA Phy Event Counters (GP Log 0x11)
ID      Size     Value  Description
0x0001  2            0  Command failed due to ICRC error
0x0003  2            0  R_ERR response for device-to-host data FIS
0x0004  2            0  R_ERR response for host-to-device data FIS
0x0006  2            0  R_ERR response for device-to-host non-data FIS
0x0007  2            0  R_ERR response for host-to-device non-data FIS
0x0008  2            0  Device-to-host non-data FIS retries
0x0009  2           43  Transition from drive PhyRdy to drive PhyNRdy
0x000a  2           32  Device-to-host register FISes sent due to a COMRESET
0x000f  2            0  R_ERR response for host-to-device data FIS, CRC
0x0010  2            0  R_ERR response for host-to-device data FIS, non-CRC
0x0012  2            0  R_ERR response for host-to-device non-data FIS, CRC
0x0013  2            0  R_ERR response for host-to-device non-data FIS, non-CRC
0x0002  2            0  R_ERR response for data FIS
0x0005  2            0  R_ERR response for non-data FIS
0x000b  2            0  CRC errors within host-to-device FIS
0x000d  2            0  Non-CRC errors within host-to-device FIS



