smartctl 7.4 2023-08-01 r5530 [x86_64-linux-6.12.9-desktop-1omv2490] (OpenMandriva Lx 7.4-1)
Copyright (C) 2002-23, Bruce Allen, Christian Franke, www.smartmontools.org

=== START OF INFORMATION SECTION ===
Model Family:     Marvell based SanDisk SSDs
Device Model:     SanDisk Ultra II 960GB
Serial Number:    --
LU WWN Device Id: 5 001b44 ...
Firmware Version: X41100RL
User Capacity:    960,197,124,096 bytes [960 GB]
Sector Size:      512 bytes logical/physical
Rotation Rate:    Solid State Device
Form Factor:      2.5 inches
TRIM Command:     Available, deterministic, zeroed
Device is:        In smartctl database
ATA Version is:   ACS-2 T13/2015-D revision 3
SATA Version is:  SATA 3.2, 6.0 Gb/s (current: 6.0 Gb/s)
Local Time is:    Fri Jan 24 13:59:59 2025 CET
SMART support is: Available - device has SMART capability.
SMART support is: Enabled
AAM feature is:   Unavailable
APM level is:     128 (minimum power consumption without standby)
Rd look-ahead is: Enabled
Write cache is:   Enabled
DSN feature is:   Unavailable
ATA Security is:  Disabled, frozen [SEC2]
Wt Cache Reorder: Unavailable

=== START OF READ SMART DATA SECTION ===
SMART overall-health self-assessment test result: PASSED

General SMART Values:
Offline data collection status:  (0x00)	Offline data collection activity
					was never started.
					Auto Offline Data Collection: Disabled.
Self-test execution status:      (   0)	The previous self-test routine completed
					without error or no self-test has ever 
					been run.
Total time to complete Offline 
data collection: 		(    0) seconds.
Offline data collection
capabilities: 			 (0x11) SMART execute Offline immediate.
					No Auto Offline data collection support.
					Suspend Offline collection upon new
					command.
					No Offline surface scan supported.
					Self-test supported.
					No Conveyance Self-test supported.
					No Selective Self-test supported.
SMART capabilities:            (0x0003)	Saves SMART data before entering
					power-saving mode.
					Supports SMART auto save timer.
Error logging capability:        (0x01)	Error logging supported.
					General Purpose Logging supported.
Short self-test routine 
recommended polling time: 	 (   2) minutes.
Extended self-test routine
recommended polling time: 	 (  10) minutes.

SMART Attributes Data Structure revision number: 4
Vendor Specific SMART Attributes with Thresholds:
ID# ATTRIBUTE_NAME          FLAGS    VALUE WORST THRESH FAIL RAW_VALUE
  5 Reallocated_Sector_Ct   -O--CK   100   100   ---    -    0
  9 Power_On_Hours          -O--CK   100   100   ---    -    41609
 12 Power_Cycle_Count       -O--CK   100   100   ---    -    2580
165 Total_Write/Erase_Count -O--CK   100   100   ---    -    5845714603525
166 Min_W/E_Cycle           -O--CK   100   100   ---    -    3
167 Min_Bad_Block/Die       -O--CK   100   100   ---    -    52
168 Maximum_Erase_Cycle     -O--CK   100   100   ---    -    45
169 Total_Bad_Block         -O--CK   100   100   ---    -    1234
170 Unknown_Marvell_Attr    -O--CK   100   100   ---    -    0
171 Program_Fail_Count      -O--CK   100   100   ---    -    0
172 Erase_Fail_Count        -O--CK   100   100   ---    -    0
173 Avg_Write/Erase_Count   -O--CK   100   100   ---    -    18
174 Unexpect_Power_Loss_Ct  -O--CK   100   100   ---    -    616
184 End-to-End_Error        -O--CK   100   100   ---    -    0
187 Reported_Uncorrect      -O--CK   100   100   ---    -    0
188 Command_Timeout         -O--CK   100   100   ---    -    0
194 Temperature_Celsius     -O---K   077   062   ---    -    23 (Min/Max 15/62)
199 SATA_CRC_Error          -O--CK   100   100   ---    -    0
230 Perc_Write/Erase_Count  -O--CK   100   100   ---    -    2585 569 2585
232 Perc_Avail_Resrvd_Space PO--CK   100   100   004    -    100
233 Total_NAND_Writes_GiB   -O--CK   100   100   ---    -    18123
234 Perc_Write/Erase_Ct_BC  -O--CK   100   100   ---    -    73506
241 Total_Writes_GiB        ----CK   253   253   ---    -    55752
242 Total_Reads_GiB         ----CK   253   253   ---    -    98121
244 Thermal_Throttle        -O--CK   000   100   ---    -    0
                            ||||||_ K auto-keep
                            |||||__ C event count
                            ||||___ R error rate
                            |||____ S speed/performance
                            ||_____ O updated online
                            |______ P prefailure warning

General Purpose Log Directory Version 1
SMART           Log Directory Version 1 [multi-sector log support]
Address    Access  R/W   Size  Description
0x00       GPL,SL  R/O      1  Log Directory
0x01           SL  R/O      1  Summary SMART error log
0x02           SL  R/O      2  Comprehensive SMART error log
0x03       GPL     R/O      1  Ext. Comprehensive SMART error log
0x04       GPL,SL  R/O      8  Device Statistics log
0x06           SL  R/O      1  SMART self-test log
0x07       GPL     R/O      1  Extended self-test log
0x10       GPL     R/O      1  NCQ Command Error log
0x11       GPL     R/O      1  SATA Phy Event Counters log
0x30       GPL,SL  R/O      9  IDENTIFY DEVICE data log
0x80-0x9f  GPL,SL  R/W     16  Host vendor specific log
0xde       GPL     VS       8  Device vendor specific log

SMART Extended Comprehensive Error Log Version: 1 (1 sectors)
No Errors Logged

SMART Extended Self-test Log Version: 1 (1 sectors)
Num  Test_Description    Status                  Remaining  LifeTime(hours)  LBA_of_first_error
# 1  Short offline       Completed without error       00%     40553         -
# 2  Short offline       Completed without error       00%     40552         -
# 3  Short offline       Completed without error       00%     40551         -
# 4  Short offline       Completed without error       00%     40532         -
# 5  Short offline       Completed without error       00%     40529         -
# 6  Short offline       Completed without error       00%     40503         -
# 7  Short offline       Completed without error       00%     40486         -
# 8  Short offline       Completed without error       00%     40483         -
# 9  Short offline       Completed without error       00%     40474         -
#10  Short offline       Completed without error       00%     40473         -
#11  Extended offline    Completed without error       00%     40465         -
#12  Short offline       Completed without error       00%     40442         -
#13  Short offline       Completed without error       00%     40437         -
#14  Short offline       Completed without error       00%     40431         -
#15  Short offline       Completed without error       00%     40429         -
#16  Short offline       Completed without error       00%     40426         -
#17  Short offline       Completed without error       00%     40409         -
#18  Short offline       Completed without error       00%     40403         -
#19  Short offline       Completed without error       00%     40395         -

Selective Self-tests/Logging not supported

SCT Commands not supported

Device Statistics (GP Log 0x04)
Page  Offset Size        Value Flags Description
0x01  =====  =               =  ===  == General Statistics (rev 1) ==
0x01  0x008  4            2580  ---  Lifetime Power-On Resets
0x01  0x018  6  60625355272055  ---  Logical Sectors Written
0x01  0x020  6      1678356141  ---  Number of Write Commands
0x01  0x028  6 120576261770567  ---  Logical Sectors Read
0x01  0x030  6      5339597164  ---  Number of Read Commands
0x07  =====  =               =  ===  == Solid State Device Statistics (rev 1) ==
0x07  0x008  1               2  ---  Percentage Used Endurance Indicator
                                |||_ C monitored condition met
                                ||__ D supports DSN
                                |___ N normalized value

Pending Defects log (GP Log 0x0c) not supported

SATA Phy Event Counters (GP Log 0x11)
ID      Size     Value  Description
0x0001  4            0  Command failed due to ICRC error
0x0002  4            0  R_ERR response for data FIS
0x0005  4            0  R_ERR response for non-data FIS
0x000a  4            3  Device-to-host register FISes sent due to a COMRESET

