smartctl 7.4 2023-08-01 r5530 [x86_64-linux-6.14.2-desktop-3omv2590] (OpenMandriva Lx 7.4-1)
Copyright (C) 2002-23, Bruce Allen, Christian Franke, www.smartmontools.org

=== START OF INFORMATION SECTION ===
Model Number:                       PC SN5000S WD 512GB
Serial Number:                      --
Firmware Version:                   34012143
PCI Vendor/Subsystem ID:            0x15b7
IEEE OUI Identifier:                0x001b44
Total NVM Capacity:                 512,110,190,592 [512 GB]
Unallocated NVM Capacity:           0
Controller ID:                      1
NVMe Version:                       2.0
Number of Namespaces:               1
Namespace 1 Size/Capacity:          512,110,190,592 [512 GB]
Namespace 1 Formatted LBA Size:     512
Namespace 1 IEEE EUI-64:            001b44 ...
Local Time is:                      Fri Jun 20 05:47:24 2025 PDT
Firmware Updates (0x14):            2 Slots, no Reset required
Optional Admin Commands (0x0017):   Security Format Frmw_DL Self_Test
Optional NVM Commands (0x00df):     Comp Wr_Unc DS_Mngmt Wr_Zero Sav/Sel_Feat Timestmp Verify
Log Page Attributes (0x7e):         Cmd_Eff_Lg Ext_Get_Lg Telmtry_Lg Pers_Ev_Lg Log0_FISE_MI Telmtry_Ar_4
Maximum Data Transfer Size:         128 Pages
Warning  Comp. Temp. Threshold:     83 Celsius
Critical Comp. Temp. Threshold:     88 Celsius
Namespace 1 Features (0x92):        NA_Fields NP_Fields *Other*

Supported Power States
St Op     Max   Active     Idle   RL RT WL WT  Ent_Lat  Ex_Lat
 0 +     5.00W    5.00W       -    0  0  0  0        0       0
 1 +     3.00W    3.00W       -    1  1  1  1        0       0
 2 +     2.50W    2.50W       -    2  2  2  2        0       0
 3 -   0.0200W       -        -    3  3  3  3     2000    3000
 4 -   0.0050W       -        -    4  4  4  4     4000   12000
 5 -   0.0030W       -        -    5  5  5  5   176000   25000

Supported LBA Sizes (NSID 0x1)
Id Fmt  Data  Metadt  Rel_Perf
 0 +     512       0         2
 1 -    4096       0         1

=== START OF SMART DATA SECTION ===
SMART overall-health self-assessment test result: PASSED

SMART/Health Information (NVMe Log 0x02)
Critical Warning:                   0x00
Temperature:                        33 Celsius
Available Spare:                    100%
Available Spare Threshold:          50%
Percentage Used:                    1%
Data Units Read:                    5,430,557 [2.78 TB]
Data Units Written:                 6,431,514 [3.29 TB]
Host Read Commands:                 40,038,276
Host Write Commands:                46,911,215
Controller Busy Time:               149
Power Cycles:                       377
Power On Hours:                     53
Unsafe Shutdowns:                   51
Media and Data Integrity Errors:    0
Error Information Log Entries:      0
Warning  Comp. Temperature Time:    0
Critical Comp. Temperature Time:    0
Temperature Sensor 1:               35 Celsius
Temperature Sensor 2:               33 Celsius

Error Information (NVMe Log 0x01, 16 of 256 entries)
No Errors Logged

Read Self-test Log failed: Invalid Field in Command (0x4002)

