smartctl 7.4 2023-08-01 r5530 [x86_64-linux-6.14.2-gentoo] (local build)
Copyright (C) 2002-23, Bruce Allen, Christian Franke, www.smartmontools.org

=== START OF INFORMATION SECTION ===
Device Model:     ST4000NM0053
Serial Number:    --
Add. Product Id:  13FD6710
Firmware Version: 1.5509
User Capacity:    4,000,787,030,016 bytes [4.00 TB]
Sector Size:      512 bytes logical/physical
Rotation Rate:    7200 rpm
Form Factor:      3.5 inches
Device is:        Not in smartctl database 7.3/5625
ATA Version is:   ACS-2 (minor revision not indicated)
SATA Version is:  SATA 3.0, 6.0 Gb/s (current: 6.0 Gb/s)
Local Time is:    Wed Apr 16 15:35:42 2025 CEST
SMART support is: Available - device has SMART capability.
SMART support is: Enabled
AAM feature is:   Unavailable
APM feature is:   Unavailable
Rd look-ahead is: Unavailable
Write cache is:   Enabled
DSN feature is:   Unavailable
ATA Security is:  Disabled, NOT FROZEN [SEC1], Master PW ID: 0xfffd
Wt Cache Reorder: Unavailable

=== START OF READ SMART DATA SECTION ===
SMART overall-health self-assessment test result: PASSED
See vendor-specific Attribute list for marginal Attributes.

General SMART Values:
Offline data collection status:  (0x82)	Offline data collection activity
					was completed without error.
					Auto Offline Data Collection: Enabled.
Self-test execution status:      (   0)	The previous self-test routine completed
					without error or no self-test has ever 
					been run.
Total time to complete Offline 
data collection: 		(  584) seconds.
Offline data collection
capabilities: 			 (0x7b) SMART execute Offline immediate.
					Auto Offline data collection on/off support.
					Suspend Offline collection upon new
					command.
					Offline surface scan supported.
					Self-test supported.
					Conveyance Self-test supported.
					Selective Self-test supported.
SMART capabilities:            (0x0003)	Saves SMART data before entering
					power-saving mode.
					Supports SMART auto save timer.
Error logging capability:        (0x01)	Error logging supported.
					No General Purpose Logging support.
Short self-test routine 
recommended polling time: 	 (   1) minutes.
Extended self-test routine
recommended polling time: 	 ( 479) minutes.
Conveyance self-test routine
recommended polling time: 	 (   2) minutes.

SMART Attributes Data Structure revision number: 10
Vendor Specific SMART Attributes with Thresholds:
ID# ATTRIBUTE_NAME          FLAGS    VALUE WORST THRESH FAIL RAW_VALUE
  1 Raw_Read_Error_Rate     POSR--   081   064   044    -    126367898
  3 Spin_Up_Time            PO----   092   091   000    -    0
  4 Start_Stop_Count        -O--CK   100   100   020    -    707
  5 Reallocated_Sector_Ct   PO--CK   100   100   010    -    0
  7 Seek_Error_Rate         POSR--   087   060   045    -    610491500
  9 Power_On_Hours          -O--CK   098   098   000    -    2351
 10 Spin_Retry_Count        PO--C-   100   100   097    -    0
 12 Power_Cycle_Count       -O--CK   100   100   020    -    665
184 End-to-End_Error        -O--CK   100   100   099    -    0
187 Reported_Uncorrect      -O--CK   100   100   000    -    0
188 Command_Timeout         -O--CK   100   100   000    -    120260984890
189 High_Fly_Writes         -O-RCK   100   100   000    -    0
190 Airflow_Temperature_Cel -O---K   065   039   040    Past 35 (0 6 35 23 0)
191 G-Sense_Error_Rate      -O--CK   100   100   000    -    0
192 Power-Off_Retract_Count -O--CK   100   100   000    -    318
193 Load_Cycle_Count        -O--CK   100   100   000    -    720
194 Temperature_Celsius     -O---K   035   061   000    -    35 (0 16 0 0 0)
195 Hardware_ECC_Recovered  -O-RC-   033   006   000    -    126367898
197 Current_Pending_Sector  -O--C-   100   100   000    -    0
198 Offline_Uncorrectable   ----C-   100   100   000    -    0
199 UDMA_CRC_Error_Count    -OSRCK   200   200   000    -    0
                            ||||||_ K auto-keep
                            |||||__ C event count
                            ||||___ R error rate
                            |||____ S speed/performance
                            ||_____ O updated online
                            |______ P prefailure warning

ATA_READ_LOG_EXT (addr=0x00:0x00, page=0, n=1) failed: SAT command failed
Read GP Log Directory failed

SMART Log Directory Version 1 [multi-sector log support]
Address    Access  R/W   Size  Description
0x00           SL  R/O      1  Log Directory
0x01           SL  R/O      1  Summary SMART error log
0x02           SL  R/O      5  Comprehensive SMART error log
0x04           SL  R/O      8  Device Statistics log
0x06           SL  R/O      1  SMART self-test log
0x09           SL  R/W      1  Selective self-test log
0x30           SL  R/O      9  IDENTIFY DEVICE data log
0x80-0x9f      SL  R/W     16  Host vendor specific log
0xa1           SL  VS      20  Device vendor specific log
0xa8           SL  VS     129  Device vendor specific log
0xa9           SL  VS       1  Device vendor specific log
0xaf           SL  VS       1  Device vendor specific log
0xc1           SL  VS      10  Device vendor specific log
0xc3           SL  VS       8  Device vendor specific log
0xe0           SL  R/W      1  SCT Command/Status
0xe1           SL  R/W      1  SCT Data Transfer

SMART Extended Comprehensive Error Log (GP Log 0x03) not supported

SMART Error Log Version: 1
No Errors Logged

SMART Extended Self-test Log (GP Log 0x07) not supported

SMART Self-test log structure revision number 1
Num  Test_Description    Status                  Remaining  LifeTime(hours)  LBA_of_first_error
# 1  Extended offline    Completed without error       00%      1287         -
# 2  Extended offline    Aborted by host               90%      1278         -
# 3  Extended offline    Aborted by host               70%      1278         -
# 4  Conveyance offline  Completed without error       00%      1275         -
# 5  Conveyance offline  Completed without error       00%         8         -
# 6  Short offline       Completed without error       00%         8         -

SMART Selective self-test log data structure revision number 1
 SPAN  MIN_LBA  MAX_LBA  CURRENT_TEST_STATUS
    1        0        0  Not_testing
    2        0        0  Not_testing
    3        0        0  Not_testing
    4        0        0  Not_testing
    5        0        0  Not_testing
Selective self-test flags (0x0):
  After scanning selected spans, do NOT read-scan remainder of disk.
If Selective self-test is pending on power-up, resume after 0 minute delay.

SCT Commands not supported

Device Statistics (SMART Log 0x04)
Page  Offset Size        Value Flags Description
0x01  =====  =               =  ===  == General Statistics (rev 1) ==
0x01  0x008  4             665  ---  Lifetime Power-On Resets
0x01  0x010  4            2351  ---  Power-on Hours
0x01  0x018  6     68553608787  ---  Logical Sectors Written
0x01  0x020  6        63881141  ---  Number of Write Commands
0x01  0x028  6     62795644418  ---  Logical Sectors Read
0x01  0x030  6       119397463  ---  Number of Read Commands
0x01  0x038  6               -  ---  Date and Time TimeStamp
0x03  =====  =               =  ===  == Rotating Media Statistics (rev 1) ==
0x03  0x008  4            2249  ---  Spindle Motor Power-on Hours
0x03  0x010  4            2249  ---  Head Flying Hours
0x03  0x018  4             720  ---  Head Load Events
0x03  0x020  4               0  ---  Number of Reallocated Logical Sectors
0x03  0x028  4               0  ---  Read Recovery Attempts
0x03  0x030  4               0  ---  Number of Mechanical Start Failures
0x03  0x038  4               0  ---  Number of Realloc. Candidate Logical Sectors
0x03  0x040  4             319  ---  Number of High Priority Unload Events
0x04  =====  =               =  ===  == General Errors Statistics (rev 1) ==
0x04  0x008  4               0  ---  Number of Reported Uncorrectable Errors
0x04  0x010  4              57  ---  Resets Between Cmd Acceptance and Completion
0x05  =====  =               =  ===  == Temperature Statistics (rev 1) ==
0x05  0x008  1              32  ---  Current Temperature
0x05  0x020  1              61  ---  Highest Temperature
0x05  0x028  1              20  ---  Lowest Temperature
0x05  0x030  1               -  ---  Highest Average Short Term Temperature
0x05  0x038  1               -  ---  Lowest Average Short Term Temperature
0x05  0x040  1               -  ---  Highest Average Long Term Temperature
0x05  0x048  1               -  ---  Lowest Average Long Term Temperature
0x05  0x050  4              20  ---  Time in Over-Temperature
0x05  0x058  1              60  ---  Specified Maximum Operating Temperature
0x05  0x060  4               0  ---  Time in Under-Temperature
0x05  0x068  1               5  ---  Specified Minimum Operating Temperature
                                |||_ C monitored condition met
                                ||__ D supports DSN
                                |___ N normalized value

Pending Defects log (GP Log 0x0c) not supported

SATA Phy Event Counters (GP Log 0x11) not supported

