smartctl 7.2 2020-12-30 r5155 [x86_64-linux-5.17.11-051711-generic] (local build)
Copyright (C) 2002-20, Bruce Allen, Christian Franke, www.smartmontools.org

=== START OF INFORMATION SECTION ===
Model Number:                       WDC WDS100T2B0C-00PXH0
Serial Number:                      --
Firmware Version:                   211210WD
PCI Vendor/Subsystem ID:            0x15b7
IEEE OUI Identifier:                0x001b44
Total NVM Capacity:                 1,000,204,886,016 [1.00 TB]
Unallocated NVM Capacity:           0
Controller ID:                      1
NVMe Version:                       1.4
Number of Namespaces:               1
Namespace 1 Size/Capacity:          1,000,204,886,016 [1.00 TB]
Namespace 1 Formatted LBA Size:     512
Namespace 1 IEEE EUI-64:            001b44 ...
Local Time is:                      Thu Jun  2 20:34:04 2022 AEST
Firmware Updates (0x14):            2 Slots, no Reset required
Optional Admin Commands (0x0017):   Security Format Frmw_DL Self_Test
Optional NVM Commands (0x005f):     Comp Wr_Unc DS_Mngmt Wr_Zero Sav/Sel_Feat Timestmp
Log Page Attributes (0x1e):         Cmd_Eff_Lg Ext_Get_Lg Telmtry_Lg Pers_Ev_Lg
Maximum Data Transfer Size:         128 Pages
Warning  Comp. Temp. Threshold:     80 Celsius
Critical Comp. Temp. Threshold:     85 Celsius
Namespace 1 Features (0x02):        NA_Fields

Supported Power States
St Op     Max   Active     Idle   RL RT WL WT  Ent_Lat  Ex_Lat
 0 +     3.50W    2.90W       -    0  0  0  0        0       0
 1 +     2.70W    1.80W       -    0  0  0  0        0       0
 2 +     1.90W    1.50W       -    0  0  0  0        0       0
 3 -   0.0250W       -        -    3  3  3  3     3900   11000
 4 -   0.0050W       -        -    4  4  4  4     5000   39000

Supported LBA Sizes (NSID 0x1)
Id Fmt  Data  Metadt  Rel_Perf
 0 +     512       0         2
 1 -    4096       0         1

=== START OF SMART DATA SECTION ===
SMART overall-health self-assessment test result: PASSED

SMART/Health Information (NVMe Log 0x02)
Critical Warning:                   0x00
Temperature:                        38 Celsius
Available Spare:                    100%
Available Spare Threshold:          10%
Percentage Used:                    1%
Data Units Read:                    10,733,850 [5.49 TB]
Data Units Written:                 30,786,141 [15.7 TB]
Host Read Commands:                 288,601,474
Host Write Commands:                371,648,752
Controller Busy Time:               1,046
Power Cycles:                       527
Power On Hours:                     1,214
Unsafe Shutdowns:                   16
Media and Data Integrity Errors:    0
Error Information Log Entries:      1
Warning  Comp. Temperature Time:    2
Critical Comp. Temperature Time:    0

Error Information (NVMe Log 0x01, 16 of 256 entries)
No Errors Logged



