smartctl 7.4 2023-08-01 r5530 [x86_64-linux-6.10.9-desktop-1omv2490] (OpenMandriva Lx 7.4-1)
Copyright (C) 2002-23, Bruce Allen, Christian Franke, www.smartmontools.org

=== START OF INFORMATION SECTION ===
Model Number:                       PM981a NVMe Samsung 1024GB
Serial Number:                      --
Firmware Version:                   15303129
PCI Vendor/Subsystem ID:            0x144d
IEEE OUI Identifier:                0x002538
Total NVM Capacity:                 1,024,209,543,168 [1.02 TB]
Unallocated NVM Capacity:           0
Controller ID:                      4
NVMe Version:                       1.3
Number of Namespaces:               1
Namespace 1 Size/Capacity:          1,024,209,543,168 [1.02 TB]
Namespace 1 Utilization:            123,594,702,848 [123 GB]
Namespace 1 Formatted LBA Size:     512
Local Time is:                      Wed Sep 10 11:11:00 2025 BST
Firmware Updates (0x16):            3 Slots, no Reset required
Optional Admin Commands (0x0017):   Security Format Frmw_DL Self_Test
Optional NVM Commands (0x005f):     Comp Wr_Unc DS_Mngmt Wr_Zero Sav/Sel_Feat Timestmp
Log Page Attributes (0x02):         Cmd_Eff_Lg
Maximum Data Transfer Size:         512 Pages
Warning  Comp. Temp. Threshold:     84 Celsius
Critical Comp. Temp. Threshold:     85 Celsius

Supported Power States
St Op     Max   Active     Idle   RL RT WL WT  Ent_Lat  Ex_Lat
 0 +     6.60W       -        -    0  0  0  0        0       0
 1 +     4.40W       -        -    1  1  1  1        0       0
 2 +     3.10W       -        -    2  2  2  2        0       0
 3 -   0.0700W       -        -    3  3  3  3      210    1200
 4 -   0.0050W       -        -    4  4  4  4     2000    8000

Supported LBA Sizes (NSID 0x1)
Id Fmt  Data  Metadt  Rel_Perf
 0 +     512       0         0

=== START OF SMART DATA SECTION ===
SMART overall-health self-assessment test result: PASSED

SMART/Health Information (NVMe Log 0x02)
Critical Warning:                   0x00
Temperature:                        44 Celsius
Available Spare:                    100%
Available Spare Threshold:          50%
Percentage Used:                    0%
Data Units Read:                    173,482,262 [88.8 TB]
Data Units Written:                 10,329,769 [5.28 TB]
Host Read Commands:                 822,199,476
Host Write Commands:                219,336,794
Controller Busy Time:               1,196
Power Cycles:                       95
Power On Hours:                     717
Unsafe Shutdowns:                   38
Media and Data Integrity Errors:    0
Error Information Log Entries:      696
Warning  Comp. Temperature Time:    0
Critical Comp. Temperature Time:    0
Temperature Sensor 1:               44 Celsius
Temperature Sensor 2:               48 Celsius
Thermal Temp. 1 Transition Count:   3
Thermal Temp. 1 Total Time:         42

Error Information (NVMe Log 0x01, 16 of 64 entries)
Num   ErrCount  SQId   CmdId  Status  PELoc          LBA  NSID    VS  Message
  0        696     0  0x0000  0x4004      -            0     0     -  Invalid Field in Command

Self-test Log (NVMe Log 0x06)
Self-test status: No self-test in progress
Num  Test_Description  Status                       Power_on_Hours  Failing_LBA  NSID Seg SCT Code
 0   Short             Completed without error                   1            -     -   -   -    -



