smartctl 7.3 2022-02-28 r5338 [x86_64-linux-6.2.2-arch1-1] (local build)
Copyright (C) 2002-22, Bruce Allen, Christian Franke, www.smartmontools.org

=== START OF INFORMATION SECTION ===
Model Number:                       Samsung SSD 960 PRO 2TB
Serial Number:                      --
Firmware Version:                   1B6QCXP7
PCI Vendor/Subsystem ID:            0x144d
IEEE OUI Identifier:                0x002538
Total NVM Capacity:                 2,048,408,248,320 [2.04 TB]
Unallocated NVM Capacity:           0
Controller ID:                      2
NVMe Version:                       1.2
Number of Namespaces:               1
Namespace 1 Size/Capacity:          2,048,408,248,320 [2.04 TB]
Namespace 1 Utilization:            168,661,475,328 [168 GB]
Namespace 1 Formatted LBA Size:     512
Namespace 1 IEEE EUI-64:            002538 ...
Local Time is:                      Wed Mar  8 19:54:05 2023 CET
Firmware Updates (0x16):            3 Slots, no Reset required
Optional Admin Commands (0x0007):   Security Format Frmw_DL
Optional NVM Commands (0x001f):     Comp Wr_Unc DS_Mngmt Wr_Zero Sav/Sel_Feat
Log Page Attributes (0x03):         S/H_per_NS Cmd_Eff_Lg
Maximum Data Transfer Size:         512 Pages
Warning  Comp. Temp. Threshold:     73 Celsius
Critical Comp. Temp. Threshold:     76 Celsius

Supported Power States
St Op     Max   Active     Idle   RL RT WL WT  Ent_Lat  Ex_Lat
 0 +     6.90W       -        -    0  0  0  0        0       0
 1 +     5.50W       -        -    1  1  1  1        0       0
 2 +     5.10W       -        -    2  2  2  2        0       0
 3 -   0.0500W       -        -    3  3  3  3      210    1200
 4 -   0.0080W       -        -    4  4  4  4     2000    6000

Supported LBA Sizes (NSID 0x1)
Id Fmt  Data  Metadt  Rel_Perf
 0 +     512       0         0

=== START OF SMART DATA SECTION ===
SMART overall-health self-assessment test result: PASSED

SMART/Health Information (NVMe Log 0x02)
Critical Warning:                   0x00
Temperature:                        29 Celsius
Available Spare:                    100%
Available Spare Threshold:          10%
Percentage Used:                    0%
Data Units Read:                    25,359,756 [12.9 TB]
Data Units Written:                 18,122,418 [9.27 TB]
Host Read Commands:                 371,408,673
Host Write Commands:                222,620,749
Controller Busy Time:               937
Power Cycles:                       1,911
Power On Hours:                     1,065
Unsafe Shutdowns:                   154
Media and Data Integrity Errors:    1,176
Error Information Log Entries:      10,002
Warning  Comp. Temperature Time:    10
Critical Comp. Temperature Time:    11
Temperature Sensor 1:               29 Celsius
Temperature Sensor 2:               32 Celsius

Error Information (NVMe Log 0x01, 16 of 64 entries)
Num   ErrCount  SQId   CmdId  Status  PELoc          LBA  NSID    VS
  0      10002     0  0x000c  0x4004      -            0     0     -
  1      10001     0  0x000d  0x4016  0x004            0     1     -
  2      10000     0  0x0001  0x4004      -            0     0     -
  3       9999     0  0x000d  0x4016  0x004            0     1     -
  4       9998     0  0x5010  0x4004      -            0     0     -
  5       9997     0  0x000d  0x4016  0x004            0     1     -
  6       9996     0  0x4006  0x4004      -            0     0     -
  7       9995     0  0x000d  0x4016  0x004            0     1     -
  8       9994     0  0x0008  0x4004      -            0     0     -
  9       9993     0  0x000d  0x4016  0x004            0     1     -
 10       9992     0  0x0002  0x4004      -            0     0     -
 11       9991     0  0x000d  0x4016  0x004            0     1     -
 12       9990     0  0x5000  0x4004      -            0     0     -
 13       9989     0  0x000d  0x4016  0x004            0     1     -
 14       9988     0  0x4018  0x4004      -            0     0     -
 15       9987     0  0x000d  0x4016  0x004            0     1     -
... (48 entries not read)



