smartctl 7.4 2023-08-01 r5530 [x86_64-linux-6.14.2-desktop-3omv2590] (OpenMandriva Lx 7.4-1)
Copyright (C) 2002-23, Bruce Allen, Christian Franke, www.smartmontools.org

=== START OF INFORMATION SECTION ===
Model Number:                       CT1000P3PSSD8
Serial Number:                      --
Firmware Version:                   P9CR411
PCI Vendor/Subsystem ID:            0x1344
IEEE OUI Identifier:                0x00a075
Controller ID:                      0
NVMe Version:                       1.4
Number of Namespaces:               1
Namespace 1 Size/Capacity:          1,000,204,886,016 [1.00 TB]
Namespace 1 Formatted LBA Size:     512
Namespace 1 IEEE EUI-64:            00a075 ...
Local Time is:                      Fri Sep 19 11:21:24 2025 CEST
Firmware Updates (0x14):            2 Slots, no Reset required
Optional Admin Commands (0x0017):   Security Format Frmw_DL Self_Test
Optional NVM Commands (0x00d7):     Comp Wr_Unc DS_Mngmt Sav/Sel_Feat Timestmp Verify
Log Page Attributes (0x1e):         Cmd_Eff_Lg Ext_Get_Lg Telmtry_Lg Pers_Ev_Lg
Maximum Data Transfer Size:         64 Pages
Warning  Comp. Temp. Threshold:     83 Celsius
Critical Comp. Temp. Threshold:     85 Celsius
Namespace 1 Features (0x08):        No_ID_Reuse

Supported Power States
St Op     Max   Active     Idle   RL RT WL WT  Ent_Lat  Ex_Lat
 0 +     5.50W       -        -    0  0  0  0        0       0
 1 +     3.00W       -        -    1  1  1  1        0       0
 2 +     1.50W       -        -    2  2  2  2        0       0
 3 -   0.0300W       -        -    3  3  3  3     5000    2500
 4 -   0.0025W       -        -    4  4  4  4     8000   40000

Supported LBA Sizes (NSID 0x1)
Id Fmt  Data  Metadt  Rel_Perf
 0 +     512       0         1
 1 -    4096       0         0

=== START OF SMART DATA SECTION ===
SMART overall-health self-assessment test result: PASSED

SMART/Health Information (NVMe Log 0x02)
Critical Warning:                   0x00
Temperature:                        32 Celsius
Available Spare:                    100%
Available Spare Threshold:          5%
Percentage Used:                    1%
Data Units Read:                    23,391,004 [11.9 TB]
Data Units Written:                 26,248,206 [13.4 TB]
Host Read Commands:                 248,140,690
Host Write Commands:                277,937,175
Controller Busy Time:               249
Power Cycles:                       1,581
Power On Hours:                     3,832
Unsafe Shutdowns:                   166
Media and Data Integrity Errors:    0
Error Information Log Entries:      0
Warning  Comp. Temperature Time:    0
Critical Comp. Temperature Time:    0
Temperature Sensor 1:               32 Celsius

Error Information (NVMe Log 0x01, 16 of 255 entries)
No Errors Logged

Read Self-test Log failed: Invalid Field in Command (0x002)

