smartctl 6.6 2017-11-05 r4594 [i686-linux-4.19.0-8-686] (local build)
Copyright (C) 2002-17, Bruce Allen, Christian Franke, www.smartmontools.org

=== START OF INFORMATION SECTION ===
Model Family:     SAMSUNG SpinPoint M
Device Model:     SAMSUNG MP0402H
Serial Number:    --
Firmware Version: UC200-16
User Capacity:    40,007,761,920 bytes [40.0 GB]
Sector Size:      512 bytes logical/physical
Device is:        In smartctl database [for details use: -P show]
ATA Version is:   ATA/ATAPI-7 T13/1532D revision 0
Local Time is:    Sun Mar 29 20:28:31 2020 EDT
SMART support is: Available - device has SMART capability.
SMART support is: Enabled
AAM level is:     128 (quiet), recommended: 254
APM level is:     128 (minimum power consumption without standby)
Rd look-ahead is: Enabled
Write cache is:   Enabled
DSN feature is:   Unavailable
ATA Security is:  Disabled, frozen [SEC2]
Wt Cache Reorder: Unavailable

=== START OF READ SMART DATA SECTION ===
SMART overall-health self-assessment test result: PASSED

General SMART Values:
Offline data collection status:  (0x00)	Offline data collection activity
					was never started.
					Auto Offline Data Collection: Disabled.
Self-test execution status:      (   0)	The previous self-test routine completed
					without error or no self-test has ever 
					been run.
Total time to complete Offline 
data collection: 		( 2400) seconds.
Offline data collection
capabilities: 			 (0x5b) SMART execute Offline immediate.
					Auto Offline data collection on/off support.
					Suspend Offline collection upon new
					command.
					Offline surface scan supported.
					Self-test supported.
					No Conveyance Self-test supported.
					Selective Self-test supported.
SMART capabilities:            (0x0003)	Saves SMART data before entering
					power-saving mode.
					Supports SMART auto save timer.
Error logging capability:        (0x01)	Error logging supported.
					No General Purpose Logging support.
Short self-test routine 
recommended polling time: 	 (   1) minutes.
Extended self-test routine
recommended polling time: 	 (  40) minutes.

SMART Attributes Data Structure revision number: 16
Vendor Specific SMART Attributes with Thresholds:
ID# ATTRIBUTE_NAME          FLAGS    VALUE WORST THRESH FAIL RAW_VALUE
  1 Raw_Read_Error_Rate     POSR--   100   100   051    -    0
  3 Spin_Up_Time            POS---   100   100   025    -    2688
  4 Start_Stop_Count        -O--CK   096   096   000    -    4971
  5 Reallocated_Sector_Ct   PO--CK   088   088   011    -    26
  7 Seek_Error_Rate         -OSR--   100   100   000    -    0
  8 Seek_Time_Performance   --S--K   100   100   000    -    0
  9 Power_On_Half_Minutes   -O--CK   097   097   000    -    19197h+05m
 10 Spin_Retry_Count        -O--CK   100   100   000    -    0
 12 Power_Cycle_Count       -O--CK   098   098   000    -    2560
191 G-Sense_Error_Rate      -O--C-   047   047   000    -    539471
194 Temperature_Celsius     -O---K   106   058   000    -    44
195 Hardware_ECC_Recovered  -O-RC-   100   100   000    -    1017390
196 Reallocated_Event_Count -O--CK   071   071   000    -    64
197 Current_Pending_Sector  -O--C-   100   100   000    -    0
198 Offline_Uncorrectable   ----CK   100   100   000    -    0
199 UDMA_CRC_Error_Count    -OSRCK   200   200   000    -    0
200 Multi_Zone_Error_Rate   -O-R--   100   100   000    -    0
201 Soft_Read_Error_Rate    -O--C-   100   100   000    -    0
223 Load_Retry_Count        -O--C-   082   082   000    -    18410
225 Load_Cycle_Count        -O--C-   001   001   000    -    2446210
255 Unknown_Attribute       -O-R--   100   100   000    -    0
                            ||||||_ K auto-keep
                            |||||__ C event count
                            ||||___ R error rate
                            |||____ S speed/performance
                            ||_____ O updated online
                            |______ P prefailure warning

General Purpose Log Directory not supported

SMART Log Directory Version 1 [multi-sector log support]
Address    Access  R/W   Size  Description
0x00           SL  R/O      1  Log Directory
0x01           SL  R/O      1  Summary SMART error log
0x02           SL  R/O      2  Comprehensive SMART error log
0x06           SL  R/O      2  SMART self-test log
0x80-0x9f      SL  R/W     16  Host vendor specific log

SMART Extended Comprehensive Error Log (GP Log 0x03) not supported

SMART Error Log Version: 1
ATA Error Count: 9395 (device log contains only the most recent five errors)
	CR = Command Register [HEX]
	FR = Features Register [HEX]
	SC = Sector Count Register [HEX]
	SN = Sector Number Register [HEX]
	CL = Cylinder Low Register [HEX]
	CH = Cylinder High Register [HEX]
	DH = Device/Head Register [HEX]
	DC = Device Command Register [HEX]
	ER = Error register [HEX]
	ST = Status register [HEX]
Powered_Up_Time is measured from power on, and printed as
DDd+hh:mm:SS.sss where DD=days, hh=hours, mm=minutes,
SS=sec, and sss=millisec. It "wraps" after 49.710 days.

Error 9395 occurred at disk power-on lifetime: 19140 hours (797 days + 12 hours)
  When the command that caused the error occurred, the device was active or idle.

  After command completion occurred, registers were:
  ER ST SC SN CL CH DH
  -- -- -- -- -- -- --
  40 51 00 9f 4e 24 e0  Error: UNC at LBA = 0x00244e9f = 2379423

  Commands leading to the command that caused the error were:
  CR FR SC SN CL CH DH DC   Powered_Up_Time  Command/Feature_Name
  -- -- -- -- -- -- -- --  ----------------  --------------------
  c4 00 00 9f 4e 24 e0 00      05:11:03.563  READ MULTIPLE
  ca 00 18 4f 4a 00 e0 00      05:11:03.563  WRITE DMA
  ca 00 10 9f 3c fa e0 00      05:11:03.563  WRITE DMA
  ca 00 28 57 e7 8e e4 00      05:11:03.563  WRITE DMA
  ca 00 08 a2 49 ec e0 00      05:11:03.563  WRITE DMA

Error 9394 occurred at disk power-on lifetime: 19140 hours (797 days + 12 hours)
  When the command that caused the error occurred, the device was active or idle.

  After command completion occurred, registers were:
  ER ST SC SN CL CH DH
  -- -- -- -- -- -- --
  40 51 00 9f 4e 24 e0  Error: UNC at LBA = 0x00244e9f = 2379423

  Commands leading to the command that caused the error were:
  CR FR SC SN CL CH DH DC   Powered_Up_Time  Command/Feature_Name
  -- -- -- -- -- -- -- --  ----------------  --------------------
  c8 00 00 9f 4e 24 e0 00      05:10:33.875  READ DMA
  ca 00 10 bf f3 06 e0 00      05:10:33.875  WRITE DMA
  ca 00 08 c7 00 00 e0 00      05:10:33.875  WRITE DMA
  ca 00 08 7f aa 72 e1 00      05:10:33.875  WRITE DMA
  ca 00 18 8a 49 ec e0 00      05:10:33.875  WRITE DMA

Error 9393 occurred at disk power-on lifetime: 19140 hours (797 days + 12 hours)
  When the command that caused the error occurred, the device was active or idle.

  After command completion occurred, registers were:
  ER ST SC SN CL CH DH
  -- -- -- -- -- -- --
  40 51 00 9f 4e 24 e0  Error: UNC at LBA = 0x00244e9f = 2379423

  Commands leading to the command that caused the error were:
  CR FR SC SN CL CH DH DC   Powered_Up_Time  Command/Feature_Name
  -- -- -- -- -- -- -- --  ----------------  --------------------
  c4 00 00 9f 4e 24 e0 00      05:10:03.563  READ MULTIPLE
  ca 00 08 8f f2 19 e0 00      05:10:03.563  WRITE DMA
  ca 00 08 87 f2 19 e0 00      05:10:03.563  WRITE DMA
  ca 00 08 7f f2 19 e0 00      05:10:03.563  WRITE DMA
  ca 00 08 77 f2 19 e0 00      05:10:03.563  WRITE DMA

Error 9392 occurred at disk power-on lifetime: 19140 hours (797 days + 12 hours)
  When the command that caused the error occurred, the device was active or idle.

  After command completion occurred, registers were:
  ER ST SC SN CL CH DH
  -- -- -- -- -- -- --
  40 51 00 9f 4e 24 e0  Error: UNC at LBA = 0x00244e9f = 2379423

  Commands leading to the command that caused the error were:
  CR FR SC SN CL CH DH DC   Powered_Up_Time  Command/Feature_Name
  -- -- -- -- -- -- -- --  ----------------  --------------------
  c8 00 00 9f 4e 24 e0 00      05:09:33.875  READ DMA
  ca 00 08 77 f3 06 e0 00      05:09:33.875  WRITE DMA
  ca 00 08 4f 01 02 e0 00      05:09:33.875  WRITE DMA
  ca 00 10 3f 4a 00 e0 00      05:09:33.875  WRITE DMA
  ca 00 28 df e6 8e e4 00      05:09:33.875  WRITE DMA

Error 9391 occurred at disk power-on lifetime: 19140 hours (797 days + 12 hours)
  When the command that caused the error occurred, the device was active or idle.

  After command completion occurred, registers were:
  ER ST SC SN CL CH DH
  -- -- -- -- -- -- --
  40 51 00 9f 4e 24 e0  Error: UNC at LBA = 0x00244e9f = 2379423

  Commands leading to the command that caused the error were:
  CR FR SC SN CL CH DH DC   Powered_Up_Time  Command/Feature_Name
  -- -- -- -- -- -- -- --  ----------------  --------------------
  c4 00 00 9f 4e 24 e0 00      05:09:03.563  READ MULTIPLE
  ca 00 08 67 f3 06 e0 00      05:09:03.563  WRITE DMA
  ca 00 20 1f 4a 00 e0 00      05:09:03.563  WRITE DMA
  ca 00 30 9f e6 8e e4 00      05:09:03.563  WRITE DMA
  c5 00 08 72 49 ec e0 00      05:09:03.563  WRITE MULTIPLE

SMART Extended Self-test Log (GP Log 0x07) not supported

SMART Self-test log structure revision number 1
Num  Test_Description    Status                  Remaining  LifeTime(hours)  LBA_of_first_error
# 1  Short offline       Completed without error       00%         0         -

SMART Selective self-test log data structure revision number 0
Note: revision number not 1 implies that no selective self-test has ever been run
 SPAN  MIN_LBA  MAX_LBA  CURRENT_TEST_STATUS
    1        0        0  Not_testing
    2        0        0  Not_testing
    3        0        0  Not_testing
    4        0        0  Not_testing
    5        0        0  Not_testing
Selective self-test flags (0x0):
  After scanning selected spans, do NOT read-scan remainder of disk.
If Selective self-test is pending on power-up, resume after 0 minute delay.

SCT Commands not supported

Device Statistics (GP/SMART Log 0x04) not supported

Pending Defects log (GP Log 0x0c) not supported

SATA Phy Event Counters (GP Log 0x11) not supported

