=== START OF INFORMATION SECTION ===
Model Family:     Western Digital Green
Device Model:     WDC WD20EARX-00PASB0
Serial Number:    --
LU WWN Device Id: 5 0014ee ...
Firmware Version: 51.0AB51
User Capacity:    2,000,398,934,016 bytes [2.00 TB]
Sector Sizes:     512 bytes logical, 4096 bytes physical
Device is:        In smartctl database [for details use: -P show]
ATA Version is:   ATA8-ACS (minor revision not indicated)
SATA Version is:  SATA 3.0, 6.0 Gb/s (current: 6.0 Gb/s)
Local Time is:    Sun Sep 24 23:47:31 2017 CST
SMART support is: Available - device has SMART capability.
SMART support is: Enabled
AAM feature is:   Unavailable
APM feature is:   Unavailable
Rd look-ahead is: Enabled
Write cache is:   Enabled
ATA Security is:  Disabled, frozen [SEC2]
Wt Cache Reorder: Enabled

=== START OF READ SMART DATA SECTION ===
SMART overall-health self-assessment test result: PASSED

General SMART Values:
Offline data collection status:  (0x82)	Offline data collection activity
					was completed without error.
					Auto Offline Data Collection: Enabled.
Self-test execution status:      (   0)	The previous self-test routine completed
					without error or no self-test has ever 
					been run.
Total time to complete Offline 
data collection: 		(37680) seconds.
Offline data collection
capabilities: 			 (0x7b) SMART execute Offline immediate.
					Auto Offline data collection on/off support.
					Suspend Offline collection upon new
					command.
					Offline surface scan supported.
					Self-test supported.
					Conveyance Self-test supported.
					Selective Self-test supported.
SMART capabilities:            (0x0003)	Saves SMART data before entering
					power-saving mode.
					Supports SMART auto save timer.
Error logging capability:        (0x01)	Error logging supported.
					General Purpose Logging supported.
Short self-test routine 
recommended polling time: 	 (   2) minutes.
Extended self-test routine
recommended polling time: 	 ( 363) minutes.
Conveyance self-test routine
recommended polling time: 	 (   5) minutes.
SCT capabilities: 	       (0x3035)	SCT Status supported.
					SCT Feature Control supported.
					SCT Data Table supported.

SMART Attributes Data Structure revision number: 16
Vendor Specific SMART Attributes with Thresholds:
ID# ATTRIBUTE_NAME          FLAGS    VALUE WORST THRESH FAIL RAW_VALUE
  1 Raw_Read_Error_Rate     POSR-K   199   198   051    -    14265
  3 Spin_Up_Time            POS--K   164   158   021    -    6783
  4 Start_Stop_Count        -O--CK   093   093   000    -    7409
  5 Reallocated_Sector_Ct   PO--CK   200   200   140    -    0
  7 Seek_Error_Rate         -OSR-K   200   200   000    -    0
  9 Power_On_Hours          -O--CK   067   067   000    -    24685
 10 Spin_Retry_Count        -O--CK   100   100   000    -    0
 11 Calibration_Retry_Count -O--CK   100   100   000    -    0
 12 Power_Cycle_Count       -O--CK   097   097   000    -    3462
192 Power-Off_Retract_Count -O--CK   199   199   000    -    1086
193 Load_Cycle_Count        -O--CK   001   001   000    -    1235027
194 Temperature_Celsius     -O---K   102   089   000    -    48
196 Reallocated_Event_Count -O--CK   200   200   000    -    0
197 Current_Pending_Sector  -O--CK   001   001   000    -    65525
198 Offline_Uncorrectable   ----CK   200   200   000    -    0
199 UDMA_CRC_Error_Count    -O--CK   200   200   000    -    319
200 Multi_Zone_Error_Rate   ---R--   200   167   000    -    2
                            ||||||_ K auto-keep
                            |||||__ C event count
                            ||||___ R error rate
                            |||____ S speed/performance
                            ||_____ O updated online
                            |______ P prefailure warning

General Purpose Log Directory Version 1
SMART           Log Directory Version 1 [multi-sector log support]
Address    Access  R/W   Size  Description
0x00       GPL,SL  R/O      1  Log Directory
0x01           SL  R/O      1  Summary SMART error log
0x02           SL  R/O      5  Comprehensive SMART error log
0x03       GPL     R/O      6  Ext. Comprehensive SMART error log
0x06           SL  R/O      1  SMART self-test log
0x07       GPL     R/O      1  Extended self-test log
0x09           SL  R/W      1  Selective self-test log
0x10       GPL     R/O      1  SATA NCQ Queued Error log
0x11       GPL     R/O      1  SATA Phy Event Counters log
0x80-0x9f  GPL,SL  R/W     16  Host vendor specific log
0xa0-0xa7  GPL,SL  VS      16  Device vendor specific log
0xa8-0xb7  GPL,SL  VS       1  Device vendor specific log
0xbd       GPL,SL  VS       1  Device vendor specific log
0xc0       GPL,SL  VS       1  Device vendor specific log
0xc1       GPL     VS      93  Device vendor specific log
0xe0       GPL,SL  R/W      1  SCT Command/Status
0xe1       GPL,SL  R/W      1  SCT Data Transfer

SMART Extended Comprehensive Error Log Version: 1 (6 sectors)
Device Error Count: 5481 (device log contains only the most recent 24 errors)
	CR     = Command Register
	FEATR  = Features Register
	COUNT  = Count (was: Sector Count) Register
	LBA_48 = Upper bytes of LBA High/Mid/Low Registers ]  ATA-8
	LH     = LBA High (was: Cylinder High) Register    ]   LBA
	LM     = LBA Mid (was: Cylinder Low) Register      ] Register
	LL     = LBA Low (was: Sector Number) Register     ]
	DV     = Device (was: Device/Head) Register
	DC     = Device Control Register
	ER     = Error register
	ST     = Status register
Powered_Up_Time is measured from power on, and printed as
DDd+hh:mm:SS.sss where DD=days, hh=hours, mm=minutes,
SS=sec, and sss=millisec. It "wraps" after 49.710 days.

Error 5481 [8] occurred at disk power-on lifetime: 10299 hours (429 days + 3 hours)
  When the command that caused the error occurred, the device was active or idle.

  After command completion occurred, registers were:
  ER -- ST COUNT  LBA_48  LH LM LL DV DC
  -- -- -- == -- == == == -- -- -- -- --
  40 -- 51 00 00 00 00 bf 70 46 68 40 00  Error: UNC at LBA = 0xbf704668 = 3211806312

  Commands leading to the command that caused the error were:
  CR FEATR COUNT  LBA_48  LH LM LL DV DC  Powered_Up_Time  Command/Feature_Name
  -- == -- == -- == == == -- -- -- -- --  ---------------  --------------------
  60 00 08 00 b0 00 00 bf 70 46 68 40 00     00:01:06.804  READ FPDMA QUEUED
  ef 00 02 00 00 00 00 00 00 00 00 a0 00     00:01:06.009  SET FEATURES [Enable write cache]
  60 00 08 00 a8 00 00 bf 70 46 68 40 00     00:01:02.689  READ FPDMA QUEUED
  ef 00 02 00 00 00 00 00 00 00 00 a0 00     00:01:01.863  SET FEATURES [Enable write cache]
  60 00 08 00 a0 00 00 bf 70 46 68 40 00     00:00:58.590  READ FPDMA QUEUED

Error 5480 [7] occurred at disk power-on lifetime: 10299 hours (429 days + 3 hours)
  When the command that caused the error occurred, the device was active or idle.

  After command completion occurred, registers were:
  ER -- ST COUNT  LBA_48  LH LM LL DV DC
  -- -- -- == -- == == == -- -- -- -- --
  40 -- 51 00 00 00 00 bf 70 46 68 40 00  Error: UNC at LBA = 0xbf704668 = 3211806312

  Commands leading to the command that caused the error were:
  CR FEATR COUNT  LBA_48  LH LM LL DV DC  Powered_Up_Time  Command/Feature_Name
  -- == -- == -- == == == -- -- -- -- --  ---------------  --------------------
  60 00 08 00 a8 00 00 bf 70 46 68 40 00     00:01:02.689  READ FPDMA QUEUED
  ef 00 02 00 00 00 00 00 00 00 00 a0 00     00:01:01.863  SET FEATURES [Enable write cache]
  60 00 08 00 a0 00 00 bf 70 46 68 40 00     00:00:58.590  READ FPDMA QUEUED
  ef 00 02 00 00 00 00 00 00 00 00 a0 00     00:00:57.764  SET FEATURES [Enable write cache]
  60 00 08 00 98 00 00 bf 70 46 68 40 00     00:00:54.492  READ FPDMA QUEUED

Error 5479 [6] occurred at disk power-on lifetime: 10299 hours (429 days + 3 hours)
  When the command that caused the error occurred, the device was active or idle.

  After command completion occurred, registers were:
  ER -- ST COUNT  LBA_48  LH LM LL DV DC
  -- -- -- == -- == == == -- -- -- -- --
  40 -- 51 00 00 00 00 bf 70 46 68 40 00  Error: UNC at LBA = 0xbf704668 = 3211806312

  Commands leading to the command that caused the error were:
  CR FEATR COUNT  LBA_48  LH LM LL DV DC  Powered_Up_Time  Command/Feature_Name
  -- == -- == -- == == == -- -- -- -- --  ---------------  --------------------
  60 00 08 00 a0 00 00 bf 70 46 68 40 00     00:00:58.590  READ FPDMA QUEUED
  ef 00 02 00 00 00 00 00 00 00 00 a0 00     00:00:57.764  SET FEATURES [Enable write cache]
  60 00 08 00 98 00 00 bf 70 46 68 40 00     00:00:54.492  READ FPDMA QUEUED
  ef 00 02 00 00 00 00 00 00 00 00 a0 00     00:00:53.666  SET FEATURES [Enable write cache]
  60 00 08 00 90 00 00 bf 70 46 68 40 00     00:00:50.393  READ FPDMA QUEUED

Error 5478 [5] occurred at disk power-on lifetime: 10299 hours (429 days + 3 hours)
  When the command that caused the error occurred, the device was active or idle.

  After command completion occurred, registers were:
  ER -- ST COUNT  LBA_48  LH LM LL DV DC
  -- -- -- == -- == == == -- -- -- -- --
  40 -- 51 00 00 00 00 bf 70 46 68 40 00  Error: UNC at LBA = 0xbf704668 = 3211806312

  Commands leading to the command that caused the error were:
  CR FEATR COUNT  LBA_48  LH LM LL DV DC  Powered_Up_Time  Command/Feature_Name
  -- == -- == -- == == == -- -- -- -- --  ---------------  --------------------
  60 00 08 00 98 00 00 bf 70 46 68 40 00     00:00:54.492  READ FPDMA QUEUED
  ef 00 02 00 00 00 00 00 00 00 00 a0 00     00:00:53.666  SET FEATURES [Enable write cache]
  60 00 08 00 90 00 00 bf 70 46 68 40 00     00:00:50.393  READ FPDMA QUEUED
  ef 00 02 00 00 00 00 00 00 00 00 a0 00     00:00:49.567  SET FEATURES [Enable write cache]
  60 00 08 00 88 00 00 bf 70 46 68 40 00     00:00:46.279  READ FPDMA QUEUED

Error 5477 [4] occurred at disk power-on lifetime: 10299 hours (429 days + 3 hours)
  When the command that caused the error occurred, the device was active or idle.

  After command completion occurred, registers were:
  ER -- ST COUNT  LBA_48  LH LM LL DV DC
  -- -- -- == -- == == == -- -- -- -- --
  40 -- 51 00 00 00 00 bf 70 46 68 40 00  Error: UNC at LBA = 0xbf704668 = 3211806312

  Commands leading to the command that caused the error were:
  CR FEATR COUNT  LBA_48  LH LM LL DV DC  Powered_Up_Time  Command/Feature_Name
  -- == -- == -- == == == -- -- -- -- --  ---------------  --------------------
  60 00 08 00 90 00 00 bf 70 46 68 40 00     00:00:50.393  READ FPDMA QUEUED
  ef 00 02 00 00 00 00 00 00 00 00 a0 00     00:00:49.567  SET FEATURES [Enable write cache]
  60 00 08 00 88 00 00 bf 70 46 68 40 00     00:00:46.279  READ FPDMA QUEUED
  ef 00 02 00 00 00 00 00 00 00 00 a0 00     00:00:45.484  SET FEATURES [Enable write cache]
  60 00 08 00 80 00 00 bf 70 46 68 40 00     00:00:42.180  READ FPDMA QUEUED

Error 5476 [3] occurred at disk power-on lifetime: 10299 hours (429 days + 3 hours)
  When the command that caused the error occurred, the device was active or idle.

  After command completion occurred, registers were:
  ER -- ST COUNT  LBA_48  LH LM LL DV DC
  -- -- -- == -- == == == -- -- -- -- --
  40 -- 51 00 00 00 00 bf 70 46 68 40 00  Error: UNC at LBA = 0xbf704668 = 3211806312

  Commands leading to the command that caused the error were:
  CR FEATR COUNT  LBA_48  LH LM LL DV DC  Powered_Up_Time  Command/Feature_Name
  -- == -- == -- == == == -- -- -- -- --  ---------------  --------------------
  60 00 08 00 88 00 00 bf 70 46 68 40 00     00:00:46.279  READ FPDMA QUEUED
  ef 00 02 00 00 00 00 00 00 00 00 a0 00     00:00:45.484  SET FEATURES [Enable write cache]
  60 00 08 00 80 00 00 bf 70 46 68 40 00     00:00:42.180  READ FPDMA QUEUED
  ef 00 02 00 00 00 00 00 00 00 00 a0 00     00:00:42.180  SET FEATURES [Enable write cache]
  60 00 08 00 78 00 00 bf 70 46 68 40 00     00:00:38.907  READ FPDMA QUEUED

Error 5475 [2] occurred at disk power-on lifetime: 10299 hours (429 days + 3 hours)
  When the command that caused the error occurred, the device was active or idle.

  After command completion occurred, registers were:
  ER -- ST COUNT  LBA_48  LH LM LL DV DC
  -- -- -- == -- == == == -- -- -- -- --
  40 -- 51 00 00 00 00 bf 70 46 68 40 00  Error: UNC at LBA = 0xbf704668 = 3211806312

  Commands leading to the command that caused the error were:
  CR FEATR COUNT  LBA_48  LH LM LL DV DC  Powered_Up_Time  Command/Feature_Name
  -- == -- == -- == == == -- -- -- -- --  ---------------  --------------------
  60 00 08 00 80 00 00 bf 70 46 68 40 00     00:00:42.180  READ FPDMA QUEUED
  ef 00 02 00 00 00 00 00 00 00 00 a0 00     00:00:42.180  SET FEATURES [Enable write cache]
  60 00 08 00 78 00 00 bf 70 46 68 40 00     00:00:38.907  READ FPDMA QUEUED
  ef 00 02 00 00 00 00 00 00 00 00 a0 00     00:00:38.081  SET FEATURES [Enable write cache]
  60 00 08 00 70 00 00 bf 70 46 68 40 00     00:00:34.808  READ FPDMA QUEUED

Error 5474 [1] occurred at disk power-on lifetime: 10299 hours (429 days + 3 hours)
  When the command that caused the error occurred, the device was active or idle.

  After command completion occurred, registers were:
  ER -- ST COUNT  LBA_48  LH LM LL DV DC
  -- -- -- == -- == == == -- -- -- -- --
  40 -- 51 00 00 00 00 bf 70 46 68 40 00  Error: UNC at LBA = 0xbf704668 = 3211806312

  Commands leading to the command that caused the error were:
  CR FEATR COUNT  LBA_48  LH LM LL DV DC  Powered_Up_Time  Command/Feature_Name
  -- == -- == -- == == == -- -- -- -- --  ---------------  --------------------
  60 00 08 00 78 00 00 bf 70 46 68 40 00     00:00:38.907  READ FPDMA QUEUED
  ef 00 02 00 00 00 00 00 00 00 00 a0 00     00:00:38.081  SET FEATURES [Enable write cache]
  60 00 08 00 70 00 00 bf 70 46 68 40 00     00:00:34.808  READ FPDMA QUEUED
  ef 00 02 00 00 00 00 00 00 00 00 a0 00     00:00:33.983  SET FEATURES [Enable write cache]
  60 00 08 00 68 00 00 bf 70 46 68 40 00     00:00:30.694  READ FPDMA QUEUED

SMART Extended Self-test Log Version: 1 (1 sectors)
Num  Test_Description    Status                  Remaining  LifeTime(hours)  LBA_of_first_error
# 1  Short offline       Completed without error       00%     24536         -
# 2  Short offline       Completed without error       00%     23172         -
# 3  Extended offline    Aborted by host               90%     23172         -
# 4  Extended offline    Aborted by host               90%     23156         -
# 5  Short offline       Completed without error       00%     23151         -
# 6  Short offline       Aborted by host               90%     21119         -
# 7  Short offline       Aborted by host               90%     20735         -
# 8  Short offline       Aborted by host               90%     20735         -
# 9  Short offline       Completed without error       00%     16092         -
#10  Short offline       Completed without error       00%     12244         -

SMART Selective self-test log data structure revision number 1
 SPAN  MIN_LBA  MAX_LBA  CURRENT_TEST_STATUS
    1        0        0  Not_testing
    2        0        0  Not_testing
    3        0        0  Not_testing
    4        0        0  Not_testing
    5        0        0  Not_testing
Selective self-test flags (0x0):
  After scanning selected spans, do NOT read-scan remainder of disk.
If Selective self-test is pending on power-up, resume after 0 minute delay.

SCT Status Version:                  3
SCT Version (vendor specific):       258 (0x0102)
SCT Support Level:                   1
Device State:                        Active (0)
Current Temperature:                    48 Celsius
Power Cycle Min/Max Temperature:     48/49 Celsius
Lifetime    Min/Max Temperature:     47/61 Celsius
Under/Over Temperature Limit Count:   0/0

SCT Temperature History Version:     2
Temperature Sampling Period:         1 minute
Temperature Logging Interval:        1 minute
Min/Max recommended Temperature:      0/60 Celsius
Min/Max Temperature Limit:           -41/85 Celsius
Temperature History Size (Index):    478 (198)

SCT Error Recovery Control command not supported

Device Statistics (GP/SMART Log 0x04) not supported

SATA Phy Event Counters (GP Log 0x11)
ID      Size     Value  Description
0x0001  2            0  Command failed due to ICRC error
0x0002  2            0  R_ERR response for data FIS
0x0003  2            0  R_ERR response for device-to-host data FIS
0x0004  2            0  R_ERR response for host-to-device data FIS
0x0005  2            0  R_ERR response for non-data FIS
0x0006  2            0  R_ERR response for device-to-host non-data FIS
0x0007  2            0  R_ERR response for host-to-device non-data FIS
0x000a  2           12  Device-to-host register FISes sent due to a COMRESET
0x000b  2            0  CRC errors within host-to-device FIS
0x8000  4         1323  Vendor specific



