smartctl 7.4 2023-08-01 r5530 [x86_64-linux-6.8.1-1-default] (SUSE RPM)
Copyright (C) 2002-23, Bruce Allen, Christian Franke, www.smartmontools.org

=== START OF INFORMATION SECTION ===
Model Number:                       CL4-3D512-Q11 NVMe SSSTC 512GB
Serial Number:                      --
Firmware Version:                   25301114
PCI Vendor ID:                      0x1e95
PCI Vendor Subsystem ID:            0x126f
IEEE OUI Identifier:                0x38f601
Controller ID:                      1
NVMe Version:                       1.4
Number of Namespaces:               1
Namespace 1 Size/Capacity:          512,110,190,592 [512 GB]
Namespace 1 Formatted LBA Size:     512
Namespace 1 IEEE EUI-64:            38f601 ...
Local Time is:                      Tue Mar 26 16:05:46 2024 CET
Firmware Updates (0x14):            2 Slots, no Reset required
Optional Admin Commands (0x0017):   Security Format Frmw_DL Self_Test
Optional NVM Commands (0x00d7):     Comp Wr_Unc DS_Mngmt Sav/Sel_Feat Timestmp Verify
Log Page Attributes (0x1a):         Cmd_Eff_Lg Telmtry_Lg Pers_Ev_Lg
Maximum Data Transfer Size:         64 Pages
Warning  Comp. Temp. Threshold:     83 Celsius
Critical Comp. Temp. Threshold:     85 Celsius

Supported Power States
St Op     Max   Active     Idle   RL RT WL WT  Ent_Lat  Ex_Lat
 0 +     6.00W       -        -    0  0  0  0        0       0
 1 +     3.50W       -        -    1  1  1  1        0       0
 2 +     2.50W       -        -    2  2  2  2        0       0
 3 -   0.0500W       -        -    3  3  3  3     5000   10000
 4 -   0.0050W       -        -    4  4  4  4     5000   35000

Supported LBA Sizes (NSID 0x1)
Id Fmt  Data  Metadt  Rel_Perf
 0 +     512       0         0

=== START OF SMART DATA SECTION ===
SMART overall-health self-assessment test result: PASSED

SMART/Health Information (NVMe Log 0x02)
Critical Warning:                   0x00
Temperature:                        33 Celsius
Available Spare:                    100%
Available Spare Threshold:          50%
Percentage Used:                    6%
Data Units Read:                    19,611,768 [10.0 TB]
Data Units Written:                 22,083,299 [11.3 TB]
Host Read Commands:                 212,659,251
Host Write Commands:                299,647,322
Controller Busy Time:               15,649
Power Cycles:                       410
Power On Hours:                     3,165
Unsafe Shutdowns:                   72
Media and Data Integrity Errors:    0
Error Information Log Entries:      11
Warning  Comp. Temperature Time:    0
Critical Comp. Temperature Time:    0
Temperature Sensor 1:               33 Celsius
Thermal Temp. 1 Transition Count:   189
Thermal Temp. 2 Transition Count:   33
Thermal Temp. 1 Total Time:         530
Thermal Temp. 2 Total Time:         30

Error Information (NVMe Log 0x01, 16 of 64 entries)
No Errors Logged

Read Self-test Log failed: Invalid Field in Command (0x002)

