=== START OF INFORMATION SECTION ===
Model Family:     SAMSUNG SpinPoint T133
Device Model:     SAMSUNG HD400LJ
Serial Number:    --
Firmware Version: ZZ100-14
User Capacity:    400,088,457,216 bytes [400 GB]
Sector Size:      512 bytes logical/physical
Device is:        In smartctl database [for details use: -P show]
ATA Version is:   ATA/ATAPI-7 T13/1532D revision 4a
Local Time is:    Thu Feb 16 21:46:16 2017 CET
SMART support is: Available - device has SMART capability.
SMART support is: Enabled
AAM level is:     254 (maximum performance), recommended: 254
APM feature is:   Unavailable
Rd look-ahead is: Enabled
Write cache is:   Enabled
ATA Security is:  Disabled, frozen [SEC2]
Wt Cache Reorder: Enabled

=== START OF READ SMART DATA SECTION ===
SMART overall-health self-assessment test result: PASSED

General SMART Values:
Offline data collection status:  (0x80)	Offline data collection activity
					was never started.
					Auto Offline Data Collection: Enabled.
Self-test execution status:      (   0)	The previous self-test routine completed
					without error or no self-test has ever 
					been run.
Total time to complete Offline 
data collection: 		( 7479) seconds.
Offline data collection
capabilities: 			 (0x5b) SMART execute Offline immediate.
					Auto Offline data collection on/off support.
					Suspend Offline collection upon new
					command.
					Offline surface scan supported.
					Self-test supported.
					No Conveyance Self-test supported.
					Selective Self-test supported.
SMART capabilities:            (0x0003)	Saves SMART data before entering
					power-saving mode.
					Supports SMART auto save timer.
Error logging capability:        (0x01)	Error logging supported.
					General Purpose Logging supported.
Short self-test routine 
recommended polling time: 	 (   2) minutes.
Extended self-test routine
recommended polling time: 	 ( 127) minutes.
SCT capabilities: 	       (0x003f)	SCT Status supported.
					SCT Error Recovery Control supported.
					SCT Feature Control supported.
					SCT Data Table supported.

SMART Attributes Data Structure revision number: 16
Vendor Specific SMART Attributes with Thresholds:
ID# ATTRIBUTE_NAME          FLAGS    VALUE WORST THRESH FAIL RAW_VALUE
  1 Raw_Read_Error_Rate     POSR--   253   100   051    -    0
  3 Spin_Up_Time            POS---   100   100   015    -    8128
  4 Start_Stop_Count        -O--CK   091   091   000    -    9457
  5 Reallocated_Sector_Ct   PO--CK   253   253   010    -    0
  7 Seek_Error_Rate         POSR--   253   253   051    -    0
  8 Seek_Time_Performance   P-S--K   253   253   015    -    0
  9 Power_On_Hours          -O--CK   100   100   000    -    13759
 10 Spin_Retry_Count        PO--CK   253   253   051    -    0
 11 Calibration_Retry_Count -O--C-   253   253   000    -    0
 12 Power_Cycle_Count       -O--CK   097   097   000    -    3666
190 Airflow_Temperature_Cel -O---K   061   050   000    -    39
194 Temperature_Celsius     -O---K   121   088   000    -    39
195 Hardware_ECC_Recovered  -O-RC-   100   100   000    -    29071
196 Reallocated_Event_Count -O--CK   253   253   000    -    0
197 Current_Pending_Sector  -O--C-   253   100   000    -    0
198 Offline_Uncorrectable   ----CK   253   253   000    -    0
199 UDMA_CRC_Error_Count    -OSRCK   199   199   000    -    7417
200 Multi_Zone_Error_Rate   -O-R--   253   100   000    -    0
201 Soft_Read_Error_Rate    -O-R--   253   100   000    -    0
202 Data_Address_Mark_Errs  -O--CK   100   100   000    -    2
                            ||||||_ K auto-keep
                            |||||__ C event count
                            ||||___ R error rate
                            |||____ S speed/performance
                            ||_____ O updated online
                            |______ P prefailure warning

General Purpose Log Directory Version 1
SMART           Log Directory Version 1 [multi-sector log support]
Address    Access  R/W   Size  Description
0x00       GPL,SL  R/O      1  Log Directory
0x01           SL  R/O      1  Summary SMART error log
0x02           SL  R/O      2  Comprehensive SMART error log
0x03       GPL     R/O      2  Ext. Comprehensive SMART error log
0x06           SL  R/O      1  SMART self-test log
0x10       GPL     R/O      1  SATA NCQ Queued Error log
0x11       GPL     R/O      1  SATA Phy Event Counters log
0x80-0x9f  GPL,SL  R/W     16  Host vendor specific log

SMART Extended Comprehensive Error Log Version: 1 (2 sectors)
Invalid Error Log index = 0x0000, trying reserved byte (0x08) instead
Device Error Count: 8432 (device log contains only the most recent 8 errors)
	CR     = Command Register
	FEATR  = Features Register
	COUNT  = Count (was: Sector Count) Register
	LBA_48 = Upper bytes of LBA High/Mid/Low Registers ]  ATA-8
	LH     = LBA High (was: Cylinder High) Register    ]   LBA
	LM     = LBA Mid (was: Cylinder Low) Register      ] Register
	LL     = LBA Low (was: Sector Number) Register     ]
	DV     = Device (was: Device/Head) Register
	DC     = Device Control Register
	ER     = Error register
	ST     = Status register
Powered_Up_Time is measured from power on, and printed as
DDd+hh:mm:SS.sss where DD=days, hh=hours, mm=minutes,
SS=sec, and sss=millisec. It "wraps" after 49.710 days.

Error 8432 [7] occurred at disk power-on lifetime: 13674 hours (569 days + 18 hours)
  When the command that caused the error occurred, the device was active or idle.

  After command completion occurred, registers were:
  ER -- ST COUNT  LBA_48  LH LM LL DV DC
  -- -- -- == -- == == == -- -- -- -- --
  84 -- 51 00 40 00 00 00 9d d1 80 e0 00  Error: ICRC, ABRT 64 sectors at LBA = 0x009dd180 = 10342784

  Commands leading to the command that caused the error were:
  CR FEATR COUNT  LBA_48  LH LM LL DV DC  Powered_Up_Time  Command/Feature_Name
  -- == -- == -- == == == -- -- -- -- --  ---------------  --------------------
  25 00 00 00 40 00 00 00 9d d1 80 e0 00     01:49:04.688  READ DMA EXT
  25 00 00 00 40 00 00 00 9d d1 40 e0 00     01:49:04.688  READ DMA EXT
  25 00 00 00 40 00 00 00 9d d1 00 e0 00     01:49:04.688  READ DMA EXT
  25 00 00 00 40 00 00 00 9d d0 c0 e0 00     01:49:04.688  READ DMA EXT
  25 00 00 00 40 00 00 00 9d d0 80 e0 00     01:49:04.688  READ DMA EXT

Error 8431 [6] occurred at disk power-on lifetime: 13674 hours (569 days + 18 hours)
  When the command that caused the error occurred, the device was active or idle.

  After command completion occurred, registers were:
  ER -- ST COUNT  LBA_48  LH LM LL DV DC
  -- -- -- == -- == == == -- -- -- -- --
  84 -- 51 00 40 00 00 00 9d a0 f8 e0 00  Error: ICRC, ABRT 64 sectors at LBA = 0x009da0f8 = 10330360

  Commands leading to the command that caused the error were:
  CR FEATR COUNT  LBA_48  LH LM LL DV DC  Powered_Up_Time  Command/Feature_Name
  -- == -- == -- == == == -- -- -- -- --  ---------------  --------------------
  25 00 00 00 40 00 00 00 9d a0 f8 e0 00     01:49:04.375  READ DMA EXT
  25 00 00 00 40 00 00 00 9d a0 b8 e0 00     01:49:04.375  READ DMA EXT
  25 00 00 00 40 00 00 00 9d a0 78 e0 00     01:49:04.375  READ DMA EXT
  25 00 00 00 40 00 00 00 9d a0 38 e0 00     01:49:04.375  READ DMA EXT
  25 00 00 00 40 00 00 00 9d 9f f8 e0 00     01:49:04.375  READ DMA EXT

Error 8430 [5] occurred at disk power-on lifetime: 13672 hours (569 days + 16 hours)
  When the command that caused the error occurred, the device was active or idle.

  After command completion occurred, registers were:
  ER -- ST COUNT  LBA_48  LH LM LL DV DC
  -- -- -- == -- == == == -- -- -- -- --
  84 -- 51 00 08 00 00 01 d5 29 f0 e0 00  Error: ICRC, ABRT 8 sectors at LBA = 0x01d529f0 = 30747120

  Commands leading to the command that caused the error were:
  CR FEATR COUNT  LBA_48  LH LM LL DV DC  Powered_Up_Time  Command/Feature_Name
  -- == -- == -- == == == -- -- -- -- --  ---------------  --------------------
  25 00 00 00 08 00 00 01 d5 29 f0 e0 00     02:11:26.375  READ DMA EXT
  25 00 00 00 08 00 00 00 66 32 68 e0 00     02:11:26.375  READ DMA EXT
  25 00 00 00 08 00 00 01 d5 29 e8 e0 00     02:11:26.375  READ DMA EXT
  25 00 00 00 08 00 00 00 66 32 60 e0 00     02:11:26.313  READ DMA EXT
  25 00 00 00 08 00 00 01 d5 1e d0 e0 00     02:11:26.313  READ DMA EXT

Error 8429 [4] occurred at disk power-on lifetime: 13672 hours (569 days + 16 hours)
  When the command that caused the error occurred, the device was active or idle.

  After command completion occurred, registers were:
  ER -- ST COUNT  LBA_48  LH LM LL DV DC
  -- -- -- == -- == == == -- -- -- -- --
  84 -- 51 00 08 00 00 0a f5 09 18 e0 00  Error: ICRC, ABRT 8 sectors at LBA = 0x0af50918 = 183830808

  Commands leading to the command that caused the error were:
  CR FEATR COUNT  LBA_48  LH LM LL DV DC  Powered_Up_Time  Command/Feature_Name
  -- == -- == -- == == == -- -- -- -- --  ---------------  --------------------
  25 00 00 00 08 00 00 0a f5 09 18 e0 00     02:11:04.875  READ DMA EXT
  35 00 00 00 18 00 00 1c 4a 5b 98 e0 00     02:11:04.875  WRITE DMA EXT
  25 00 00 00 08 00 00 1c 4a 7c 98 e0 00     02:11:04.875  READ DMA EXT
  35 00 00 00 18 00 00 1c 4a 5b 78 e0 00     02:11:04.875  WRITE DMA EXT
  35 00 00 00 08 00 00 1c 4a 5b 68 e0 00     02:11:04.875  WRITE DMA EXT

Error 8428 [3] occurred at disk power-on lifetime: 13672 hours (569 days + 16 hours)
  When the command that caused the error occurred, the device was active or idle.

  After command completion occurred, registers were:
  ER -- ST COUNT  LBA_48  LH LM LL DV DC
  -- -- -- == -- == == == -- -- -- -- --
  84 -- 51 01 00 00 00 00 09 ec bc e0 00  Error: ICRC, ABRT 256 sectors at LBA = 0x0009ecbc = 650428

  Commands leading to the command that caused the error were:
  CR FEATR COUNT  LBA_48  LH LM LL DV DC  Powered_Up_Time  Command/Feature_Name
  -- == -- == -- == == == -- -- -- -- --  ---------------  --------------------
  25 00 00 01 00 00 00 00 09 ec bc e0 00     00:43:54.625  READ DMA EXT
  29 00 00 00 30 00 00 00 09 ec 8c e0 00     00:43:54.625  READ MULTIPLE EXT

Error 8427 [2] occurred at disk power-on lifetime: 13672 hours (569 days + 16 hours)
  When the command that caused the error occurred, the device was active or idle.

  After command completion occurred, registers were:
  ER -- ST COUNT  LBA_48  LH LM LL DV DC
  -- -- -- == -- == == == -- -- -- -- --
  84 -- 51 00 30 00 00 00 09 ec 8c e0 00  Error: ICRC, ABRT 48 sectors at LBA = 0x0009ec8c = 650380

  Commands leading to the command that caused the error were:
  CR FEATR COUNT  LBA_48  LH LM LL DV DC  Powered_Up_Time  Command/Feature_Name
  -- == -- == -- == == == -- -- -- -- --  ---------------  --------------------
  25 00 00 00 30 00 00 00 09 ec 8c e0 00     00:43:54.563  READ DMA EXT
  25 00 00 01 00 00 00 00 09 eb 8c e0 00     00:43:54.563  READ DMA EXT
  25 00 00 00 28 00 00 00 09 eb 64 e0 00     00:43:54.563  READ DMA EXT
  25 00 00 01 00 00 00 00 09 ea 64 e0 00     00:43:54.563  READ DMA EXT
  25 00 00 00 58 00 00 00 09 ea 0c e0 00     00:43:54.563  READ DMA EXT

Error 8426 [1] occurred at disk power-on lifetime: 13672 hours (569 days + 16 hours)
  When the command that caused the error occurred, the device was active or idle.

  After command completion occurred, registers were:
  ER -- ST COUNT  LBA_48  LH LM LL DV DC
  -- -- -- == -- == == == -- -- -- -- --
  84 -- 51 00 80 00 00 00 09 df ac e0 00  Error: ICRC, ABRT 128 sectors at LBA = 0x0009dfac = 647084

  Commands leading to the command that caused the error were:
  CR FEATR COUNT  LBA_48  LH LM LL DV DC  Powered_Up_Time  Command/Feature_Name
  -- == -- == -- == == == -- -- -- -- --  ---------------  --------------------
  25 00 00 00 80 00 00 00 09 df ac e0 00     00:43:54.438  READ DMA EXT
  25 00 00 01 00 00 00 00 09 de ac e0 00     00:43:54.438  READ DMA EXT
  25 00 00 00 18 00 00 00 09 de 7c e0 00     00:43:54.438  READ DMA EXT
  25 00 00 01 00 00 00 00 09 dd 7c e0 00     00:43:54.438  READ DMA EXT
  25 00 00 00 68 00 00 00 09 dd 14 e0 00     00:43:54.438  READ DMA EXT

Error 8425 [0] occurred at disk power-on lifetime: 13672 hours (569 days + 16 hours)
  When the command that caused the error occurred, the device was active or idle.

  After command completion occurred, registers were:
  ER -- ST COUNT  LBA_48  LH LM LL DV DC
  -- -- -- == -- == == == -- -- -- -- --
  84 -- 51 00 b0 00 00 01 c2 03 ca e0 00  Error: ICRC, ABRT 176 sectors at LBA = 0x01c203ca = 29492170

  Commands leading to the command that caused the error were:
  CR FEATR COUNT  LBA_48  LH LM LL DV DC  Powered_Up_Time  Command/Feature_Name
  -- == -- == -- == == == -- -- -- -- --  ---------------  --------------------
  25 00 00 00 b0 00 00 01 c2 03 ca e0 00     00:43:46.313  READ DMA EXT
  25 00 00 00 90 00 00 01 c2 03 22 e0 00     00:43:46.313  READ DMA EXT
  25 00 00 01 00 00 00 01 c2 02 22 e0 00     00:43:46.313  READ DMA EXT
  25 00 00 00 18 00 00 01 c2 01 fa e0 00     00:43:46.313  READ DMA EXT
  25 00 00 01 00 00 00 01 c2 00 fa e0 00     00:43:46.313  READ DMA EXT

SMART Extended Self-test Log (GP Log 0x07) not supported

SMART Self-test log structure revision number 1
No self-tests have been logged.  [To run self-tests, use: smartctl -t]

SMART Selective self-test log data structure revision number 0
Note: revision number not 1 implies that no selective self-test has ever been run
 SPAN  MIN_LBA  MAX_LBA  CURRENT_TEST_STATUS
    1        0        0  Not_testing
    2        0        0  Not_testing
    3        0        0  Not_testing
    4        0        0  Not_testing
    5        0        0  Not_testing
Selective self-test flags (0x0):
  After scanning selected spans, do NOT read-scan remainder of disk.
If Selective self-test is pending on power-up, resume after 0 minute delay.

SCT Status Version:                  2
SCT Version (vendor specific):       256 (0x0100)
SCT Support Level:                   1
Device State:                        Active (0)
Current Temperature:                 39 Celsius
Power Cycle Max Temperature:         39 Celsius
Lifetime    Max Temperature:         51 Celsius

SCT Temperature History Version:     2
Temperature Sampling Period:         1 minute
Temperature Logging Interval:        1 minute
Min/Max recommended Temperature:     10/55 Celsius
Min/Max Temperature Limit:            5/60 Celsius
Temperature History Size (Index):    128 (46)

SCT Error Recovery Control:
           Read: Disabled
          Write: Disabled

Device Statistics (GP/SMART Log 0x04) not supported

SATA Phy Event Counters (GP Log 0x11)
ID      Size     Value  Description
0x0001  2            0  Command failed due to ICRC error
0x000a  2            5  Device-to-host register FISes sent due to a COMRESET
0x0008  2            0  Device-to-host non-data FIS retries
0x0009  2            3  Transition from drive PhyRdy to drive PhyNRdy
0x000b  2            0  CRC errors within host-to-device FIS
0x000d  2            0  Non-CRC errors within host-to-device FIS
0x8001  2            0  Vendor specific

