smartctl 7.3 2022-02-28 r5338 [x86_64-linux-5.15.75-generic-1rosa2021.1-x86_64] (local build)
Copyright (C) 2002-22, Bruce Allen, Christian Franke, www.smartmontools.org

=== START OF INFORMATION SECTION ===
Model Family:     Seagate Barracuda 7200.7 and 7200.7 Plus
Device Model:     ST3120022A
Serial Number:    --
Firmware Version: 8.01
User Capacity:    120,034,123,776 bytes [120 GB]
Sector Size:      512 bytes logical/physical
Device is:        In smartctl database 7.3/5319
ATA Version is:   ATA/ATAPI-6 T13/1410D revision 2
Local Time is:    Sun Jan  8 15:39:11 2023 MSK
SMART support is: Available - device has SMART capability.
SMART support is: Enabled
AAM feature is:   Unavailable
APM feature is:   Unavailable
Rd look-ahead is: Enabled
Write cache is:   Enabled
DSN feature is:   Unavailable
ATA Security is:  Disabled, NOT FROZEN [SEC1]
Wt Cache Reorder: Unavailable

=== START OF READ SMART DATA SECTION ===
SMART overall-health self-assessment test result: PASSED

General SMART Values:
Offline data collection status:  (0x82)	Offline data collection activity
					was completed without error.
					Auto Offline Data Collection: Enabled.
Self-test execution status:      (  25)	The self-test routine was aborted by
					the host.
Total time to complete Offline 
data collection: 		(  430) seconds.
Offline data collection
capabilities: 			 (0x5b) SMART execute Offline immediate.
					Auto Offline data collection on/off support.
					Suspend Offline collection upon new
					command.
					Offline surface scan supported.
					Self-test supported.
					No Conveyance Self-test supported.
					Selective Self-test supported.
SMART capabilities:            (0x0003)	Saves SMART data before entering
					power-saving mode.
					Supports SMART auto save timer.
Error logging capability:        (0x01)	Error logging supported.
					General Purpose Logging supported.
Short self-test routine 
recommended polling time: 	 (   1) minutes.
Extended self-test routine
recommended polling time: 	 (  85) minutes.

SMART Attributes Data Structure revision number: 10
Vendor Specific SMART Attributes with Thresholds:
ID# ATTRIBUTE_NAME          FLAGS    VALUE WORST THRESH FAIL RAW_VALUE
  1 Raw_Read_Error_Rate     POSR--   067   050   006    -    175291241
  3 Spin_Up_Time            PO----   097   096   000    -    0
  4 Start_Stop_Count        -O--CK   100   100   020    -    286
  5 Reallocated_Sector_Ct   PO--CK   056   056   036    -    1794
  7 Seek_Error_Rate         POSR--   090   060   030    -    980180678
  9 Power_On_Hours          -O--CK   078   078   000    -    19941
 10 Spin_Retry_Count        PO--C-   100   100   097    -    0
 12 Power_Cycle_Count       -O--CK   093   093   020    -    7887
194 Temperature_Celsius     -O---K   039   059   000    -    39
195 Hardware_ECC_Recovered  -O-RC-   067   050   000    -    175291241
197 Current_Pending_Sector  -O--C-   083   083   000    -    14413
198 Offline_Uncorrectable   ----C-   083   083   000    -    14413
199 UDMA_CRC_Error_Count    -OSRCK   200   180   000    -    274
200 Multi_Zone_Error_Rate   ------   100   253   000    -    0
202 Data_Address_Mark_Errs  -O--CK   254   151   000    -    102
                            ||||||_ K auto-keep
                            |||||__ C event count
                            ||||___ R error rate
                            |||____ S speed/performance
                            ||_____ O updated online
                            |______ P prefailure warning

General Purpose Log Directory Version 1
SMART           Log Directory Version 1 [multi-sector log support]
Address    Access  R/W   Size  Description
0x00       GPL,SL  R/O      1  Log Directory
0x01       GPL,SL  R/O      1  Summary SMART error log
0x02       GPL,SL  R/O      5  Comprehensive SMART error log
0x03       GPL,SL  R/O      5  Ext. Comprehensive SMART error log
0x06       GPL,SL  R/O      1  SMART self-test log
0x07       GPL,SL  R/O      1  Extended self-test log
0x09       GPL,SL  R/W      1  Selective self-test log
0x20       GPL,SL  R/O      1  Streaming performance log [OBS-8]
0x21       GPL,SL  R/O      1  Write stream error log
0x22       GPL,SL  R/O      1  Read stream error log
0x23       GPL,SL  R/O      1  Delayed sector log [OBS-8]
0x80-0x9f  GPL,SL  R/W     16  Host vendor specific log
0xa0       GPL,SL  VS       1  Device vendor specific log
0xa1       GPL,SL  VS      20  Device vendor specific log
0xa2       GPL,SL  VS     101  Device vendor specific log
0xa8       GPL,SL  VS      20  Device vendor specific log
0xa9       GPL,SL  VS       1  Device vendor specific log
0xff       GPL     -    24064  Reserved

SMART Extended Comprehensive Error Log Version: 1 (5 sectors)
Device Error Count: 35269 (device log contains only the most recent 20 errors)
	CR     = Command Register
	FEATR  = Features Register
	COUNT  = Count (was: Sector Count) Register
	LBA_48 = Upper bytes of LBA High/Mid/Low Registers ]  ATA-8
	LH     = LBA High (was: Cylinder High) Register    ]   LBA
	LM     = LBA Mid (was: Cylinder Low) Register      ] Register
	LL     = LBA Low (was: Sector Number) Register     ]
	DV     = Device (was: Device/Head) Register
	DC     = Device Control Register
	ER     = Error register
	ST     = Status register
Powered_Up_Time is measured from power on, and printed as
DDd+hh:mm:SS.sss where DD=days, hh=hours, mm=minutes,
SS=sec, and sss=millisec. It "wraps" after 49.710 days.

Error 35269 [8] occurred at disk power-on lifetime: 19848 hours (827 days + 0 hours)
  When the command that caused the error occurred, the device was active or idle.

  After command completion occurred, registers were:
  ER -- ST COUNT  LBA_48  LH LM LL DV DC
  -- -- -- == -- == == == -- -- -- -- --
  40 -- 51 00 01 60 09 36 c1 60 c1 e9 00  Error: UNC 1 sectors at LBA = 0x60093fc160c1 = 105592840609985

  Commands leading to the command that caused the error were:
  CR FEATR COUNT  LBA_48  LH LM LL DV DC  Powered_Up_Time  Command/Feature_Name
  -- == -- == -- == == == -- -- -- -- --  ---------------  --------------------
  c8 00 00 00 01 00 09 36 00 60 c1 e9 00     01:28:23.951  READ DMA
  c8 00 00 00 01 00 09 36 00 60 c0 e9 00     01:28:23.951  READ DMA
  c8 00 00 00 01 00 09 36 00 60 bf e9 00     01:28:23.951  READ DMA
  c8 00 00 00 01 00 09 36 00 60 be e9 00     01:28:23.951  READ DMA
  c8 00 00 00 01 00 09 36 00 60 bd e9 00     01:28:23.952  READ DMA

Error 35268 [7] occurred at disk power-on lifetime: 19848 hours (827 days + 0 hours)
  When the command that caused the error occurred, the device was active or idle.

  After command completion occurred, registers were:
  ER -- ST COUNT  LBA_48  LH LM LL DV DC
  -- -- -- == -- == == == -- -- -- -- --
  40 -- 51 00 01 5f 09 e7 13 5f 13 e9 00  Error: UNC 1 sectors at LBA = 0x5f09ef135f13 = 104496270368531

  Commands leading to the command that caused the error were:
  CR FEATR COUNT  LBA_48  LH LM LL DV DC  Powered_Up_Time  Command/Feature_Name
  -- == -- == -- == == == -- -- -- -- --  ---------------  --------------------
  c8 00 00 00 01 00 09 e7 00 5f 13 e9 00     01:28:59.120  READ DMA
  c8 00 00 00 01 00 09 e7 00 5f 12 e9 00     01:28:59.120  READ DMA
  c8 00 00 00 01 00 09 e7 00 5f 11 e9 00     01:28:59.120  READ DMA
  c8 00 00 00 01 00 09 e7 00 5f 10 e9 00     01:28:59.120  READ DMA
  c8 00 00 00 01 00 09 e7 00 5f 0f e9 00     01:28:59.120  READ DMA

Error 35267 [6] occurred at disk power-on lifetime: 19848 hours (827 days + 0 hours)
  When the command that caused the error occurred, the device was active or idle.

  After command completion occurred, registers were:
  ER -- ST COUNT  LBA_48  LH LM LL DV DC
  -- -- -- == -- == == == -- -- -- -- --
  40 -- 51 00 00 5f 09 ef e4 5f e4 e9 00  Error: UNC at LBA = 0x5f09efe45fe4 = 104496284065764

  Commands leading to the command that caused the error were:
  CR FEATR COUNT  LBA_48  LH LM LL DV DC  Powered_Up_Time  Command/Feature_Name
  -- == -- == -- == == == -- -- -- -- --  ---------------  --------------------
  c8 00 00 01 00 00 09 ef 00 5f a8 e9 00     01:28:38.774  READ DMA
  c8 00 00 01 00 00 09 ee 00 5f a8 e9 00     01:28:38.772  READ DMA
  c8 00 00 01 00 00 09 ed 00 5f a8 e9 00     01:28:35.733  READ DMA
  c8 00 00 01 00 00 09 ec 00 5f a8 e9 00     01:28:35.731  READ DMA
  c8 00 00 01 00 00 09 eb 00 5f a8 e9 00     01:28:35.728  READ DMA

Error 35266 [5] occurred at disk power-on lifetime: 19848 hours (827 days + 0 hours)
  When the command that caused the error occurred, the device was active or idle.

  After command completion occurred, registers were:
  ER -- ST COUNT  LBA_48  LH LM LL DV DC
  -- -- -- == -- == == == -- -- -- -- --
  40 -- 51 00 01 60 09 39 88 60 88 e9 00  Error: UNC 1 sectors at LBA = 0x600939886088 = 105592736211080

  Commands leading to the command that caused the error were:
  CR FEATR COUNT  LBA_48  LH LM LL DV DC  Powered_Up_Time  Command/Feature_Name
  -- == -- == -- == == == -- -- -- -- --  ---------------  --------------------
  c8 00 00 00 01 00 09 39 00 60 88 e9 00     01:28:28.469  READ DMA
  c8 00 00 00 01 00 09 39 00 60 87 e9 00     01:28:28.468  READ DMA
  c8 00 00 00 01 00 09 39 00 60 86 e9 00     01:28:28.468  READ DMA
  c8 00 00 00 01 00 09 39 00 60 85 e9 00     01:28:28.468  READ DMA
  c8 00 00 00 01 00 09 39 00 60 84 e9 00     01:28:28.468  READ DMA

Error 35265 [4] occurred at disk power-on lifetime: 19848 hours (827 days + 0 hours)
  When the command that caused the error occurred, the device was active or idle.

  After command completion occurred, registers were:
  ER -- ST COUNT  LBA_48  LH LM LL DV DC
  -- -- -- == -- == == == -- -- -- -- --
  40 -- 51 00 01 60 09 36 c1 60 c1 e9 00  Error: UNC 1 sectors at LBA = 0x60093fc160c1 = 105592840609985

  Commands leading to the command that caused the error were:
  CR FEATR COUNT  LBA_48  LH LM LL DV DC  Powered_Up_Time  Command/Feature_Name
  -- == -- == -- == == == -- -- -- -- --  ---------------  --------------------
  c8 00 00 00 01 00 09 36 00 60 c1 e9 00     01:28:23.951  READ DMA
  c8 00 00 00 01 00 09 36 00 60 c0 e9 00     01:28:23.951  READ DMA
  c8 00 00 00 01 00 09 36 00 60 bf e9 00     01:28:23.951  READ DMA
  c8 00 00 00 01 00 09 36 00 60 be e9 00     01:28:23.951  READ DMA
  c8 00 00 00 01 00 09 36 00 60 bd e9 00     01:28:23.952  READ DMA

Error 35264 [3] occurred at disk power-on lifetime: 19848 hours (827 days + 0 hours)
  When the command that caused the error occurred, the device was active or idle.

  After command completion occurred, registers were:
  ER -- ST COUNT  LBA_48  LH LM LL DV DC
  -- -- -- == -- == == == -- -- -- -- --
  40 -- 51 00 01 5f 09 e7 13 5f 13 e9 00  Error: UNC 1 sectors at LBA = 0x5f09ef135f13 = 104496270368531

  Commands leading to the command that caused the error were:
  CR FEATR COUNT  LBA_48  LH LM LL DV DC  Powered_Up_Time  Command/Feature_Name
  -- == -- == -- == == == -- -- -- -- --  ---------------  --------------------
  c8 00 00 00 01 00 09 e7 00 5f 13 e9 00     01:28:59.120  READ DMA
  c8 00 00 00 01 00 09 e7 00 5f 12 e9 00     01:28:59.120  READ DMA
  c8 00 00 00 01 00 09 e7 00 5f 11 e9 00     01:28:59.120  READ DMA
  c8 00 00 00 01 00 09 e7 00 5f 10 e9 00     01:28:59.120  READ DMA
  c8 00 00 00 01 00 09 e7 00 5f 0f e9 00     01:28:59.120  READ DMA

Error 35263 [2] occurred at disk power-on lifetime: 19848 hours (827 days + 0 hours)
  When the command that caused the error occurred, the device was active or idle.

  After command completion occurred, registers were:
  ER -- ST COUNT  LBA_48  LH LM LL DV DC
  -- -- -- == -- == == == -- -- -- -- --
  40 -- 51 00 00 5f 09 ef e4 5f e4 e9 00  Error: UNC at LBA = 0x5f09efe45fe4 = 104496284065764

  Commands leading to the command that caused the error were:
  CR FEATR COUNT  LBA_48  LH LM LL DV DC  Powered_Up_Time  Command/Feature_Name
  -- == -- == -- == == == -- -- -- -- --  ---------------  --------------------
  c8 00 00 01 00 00 09 ef 00 5f a8 e9 00     01:28:38.774  READ DMA
  c8 00 00 01 00 00 09 ee 00 5f a8 e9 00     01:28:38.772  READ DMA
  c8 00 00 01 00 00 09 ed 00 5f a8 e9 00     01:28:35.733  READ DMA
  c8 00 00 01 00 00 09 ec 00 5f a8 e9 00     01:28:35.731  READ DMA
  c8 00 00 01 00 00 09 eb 00 5f a8 e9 00     01:28:35.728  READ DMA

Error 35262 [1] occurred at disk power-on lifetime: 19848 hours (827 days + 0 hours)
  When the command that caused the error occurred, the device was active or idle.

  After command completion occurred, registers were:
  ER -- ST COUNT  LBA_48  LH LM LL DV DC
  -- -- -- == -- == == == -- -- -- -- --
  40 -- 51 00 01 60 09 39 88 60 88 e9 00  Error: UNC 1 sectors at LBA = 0x600939886088 = 105592736211080

  Commands leading to the command that caused the error were:
  CR FEATR COUNT  LBA_48  LH LM LL DV DC  Powered_Up_Time  Command/Feature_Name
  -- == -- == -- == == == -- -- -- -- --  ---------------  --------------------
  c8 00 00 00 01 00 09 39 00 60 88 e9 00     01:28:28.469  READ DMA
  c8 00 00 00 01 00 09 39 00 60 87 e9 00     01:28:28.468  READ DMA
  c8 00 00 00 01 00 09 39 00 60 86 e9 00     01:28:28.468  READ DMA
  c8 00 00 00 01 00 09 39 00 60 85 e9 00     01:28:28.468  READ DMA
  c8 00 00 00 01 00 09 39 00 60 84 e9 00     01:28:28.468  READ DMA

SMART Extended Self-test Log Version: 1 (1 sectors)
Num  Test_Description    Status                  Remaining  LifeTime(hours)  LBA_of_first_error
# 1  Short offline       Aborted by host               90%     16827         -
# 2  Short offline       Completed without error       00%      2975         -
# 3  Short offline       Completed without error       00%      2975         -
# 4  Short offline       Interrupted (host reset)      80%      1341         -

SMART Selective self-test log data structure revision number 1
 SPAN  MIN_LBA  MAX_LBA  CURRENT_TEST_STATUS
    1        0        0  Not_testing
    2        0        0  Not_testing
    3        0        0  Not_testing
    4        0        0  Not_testing
    5        0        0  Not_testing
Selective self-test flags (0x0):
  After scanning selected spans, do NOT read-scan remainder of disk.
If Selective self-test is pending on power-up, resume after 0 minute delay.

SCT Commands not supported

Device Statistics (GP/SMART Log 0x04) not supported

Pending Defects log (GP Log 0x0c) not supported

SATA Phy Event Counters (GP Log 0x11) not supported

