smartctl 7.1 2019-12-30 r5022 [x86_64-linux-5.14.0-1027-oem] (local build)
Copyright (C) 2002-19, Bruce Allen, Christian Franke, www.smartmontools.org

=== START OF INFORMATION SECTION ===
Model Number:                       SKHynix_HFS512GDE9X081N
Serial Number:                      --
Firmware Version:                   41720C20
PCI Vendor/Subsystem ID:            0x1c5c
IEEE OUI Identifier:                0xace42e
Controller ID:                      1
Number of Namespaces:               1
Namespace 1 Size/Capacity:          512,110,190,592 [512 GB]
Namespace 1 Formatted LBA Size:     512
Namespace 1 IEEE EUI-64:            ace42e ...
Local Time is:                      Fri Mar 11 15:40:48 2022 CET
Firmware Updates (0x16):            3 Slots, no Reset required
Optional Admin Commands (0x0017):   Security Format Frmw_DL Self_Test
Optional NVM Commands (0x005f):     Comp Wr_Unc DS_Mngmt Wr_Zero Sav/Sel_Feat Timestmp
Maximum Data Transfer Size:         64 Pages
Warning  Comp. Temp. Threshold:     83 Celsius
Critical Comp. Temp. Threshold:     84 Celsius

Supported Power States
St Op     Max   Active     Idle   RL RT WL WT  Ent_Lat  Ex_Lat
 0 +   6.3000W       -        -    0  0  0  0        5       5
 1 +   2.4000W       -        -    1  1  1  1       30      30
 2 +   1.9000W       -        -    2  2  2  2      100     100
 3 -   0.0500W       -        -    3  3  3  3     1000    1000
 4 -   0.0040W       -        -    3  3  3  3     1000    9000

Supported LBA Sizes (NSID 0x1)
Id Fmt  Data  Metadt  Rel_Perf
 0 +     512       0         0

=== START OF SMART DATA SECTION ===
SMART overall-health self-assessment test result: PASSED

SMART/Health Information (NVMe Log 0x02)
Critical Warning:                   0x00
Temperature:                        39 Celsius
Available Spare:                    100%
Available Spare Threshold:          10%
Percentage Used:                    0%
Data Units Read:                    1,333,638 [682 GB]
Data Units Written:                 743,411 [380 GB]
Host Read Commands:                 6,260,487
Host Write Commands:                11,695,995
Controller Busy Time:               13
Power Cycles:                       109
Power On Hours:                     324
Unsafe Shutdowns:                   31
Media and Data Integrity Errors:    0
Error Information Log Entries:      0
Warning  Comp. Temperature Time:    0
Critical Comp. Temperature Time:    0
Temperature Sensor 1:               32 Celsius
Temperature Sensor 2:               34 Celsius

Error Information (NVMe Log 0x01, max 256 entries)
No Errors Logged

