smartctl 7.4 2023-08-01 r5530 [x86_64-linux-6.11.0-24-generic] (local build)
Copyright (C) 2002-23, Bruce Allen, Christian Franke, www.smartmontools.org

=== START OF INFORMATION SECTION ===
Device Model:     SSD 500GB
Serial Number:    --
LU WWN Device Id: 0 000000 ...
Firmware Version: HPS1A30C
User Capacity:    500,107,862,016 bytes [500 GB]
Sector Size:      512 bytes logical/physical
Rotation Rate:    Solid State Device
Form Factor:      2.5 inches
TRIM Command:     Available
Device is:        Not in smartctl database 7.3/5528
ATA Version is:   ACS-2 T13/2015-D revision 3
SATA Version is:  SATA 3.2, 6.0 Gb/s (current: 6.0 Gb/s)
Local Time is:    Wed Apr 23 18:28:22 2025 MSK
SMART support is: Available - device has SMART capability.
SMART support is: Enabled
AAM feature is:   Unavailable
APM feature is:   Unavailable
Rd look-ahead is: Enabled
Write cache is:   Enabled
DSN feature is:   Unavailable
ATA Security is:  Disabled, frozen [SEC2]
Wt Cache Reorder: Unavailable

=== START OF READ SMART DATA SECTION ===
SMART overall-health self-assessment test result: PASSED

General SMART Values:
Offline data collection status:  (0x00)	Offline data collection activity
					was never started.
					Auto Offline Data Collection: Disabled.
Self-test execution status:      (   0)	The previous self-test routine completed
					without error or no self-test has ever 
					been run.
Total time to complete Offline 
data collection: 		(  120) seconds.
Offline data collection
capabilities: 			 (0x5d) SMART execute Offline immediate.
					No Auto Offline data collection support.
					Abort Offline collection upon new
					command.
					Offline surface scan supported.
					Self-test supported.
					No Conveyance Self-test supported.
					Selective Self-test supported.
SMART capabilities:            (0x0002)	Does not save SMART data before
					entering power-saving mode.
					Supports SMART auto save timer.
Error logging capability:        (0x01)	Error logging supported.
					General Purpose Logging supported.
Short self-test routine 
recommended polling time: 	 (   2) minutes.
Extended self-test routine
recommended polling time: 	 (   4) minutes.

SMART Attributes Data Structure revision number: 1
Vendor Specific SMART Attributes with Thresholds:
ID# ATTRIBUTE_NAME          FLAGS    VALUE WORST THRESH FAIL RAW_VALUE
  1 Raw_Read_Error_Rate     -O--CK   100   100   050    -    0
  5 Reallocated_Sector_Ct   -O--CK   100   100   050    -    0
  9 Power_On_Hours          -O--CK   100   100   050    -    8333
 12 Power_Cycle_Count       -O--CK   100   100   050    -    2459
160 Unknown_Attribute       -O--CK   100   100   050    -    1245246
161 Unknown_Attribute       -O--CK   100   100   050    -    100
163 Unknown_Attribute       -O--CK   100   100   050    -    463
164 Unknown_Attribute       -O--CK   100   100   050    -    156
165 Unknown_Attribute       -O--CK   100   100   050    -    298
166 Unknown_Attribute       -O--CK   100   100   050    -    113
167 Unknown_Attribute       -O--CK   100   100   050    -    156
168 Unknown_Attribute       -O--CK   100   100   050    -    0
169 Unknown_Attribute       -O--CK   100   100   050    -    100
175 Program_Fail_Count_Chip -O--CK   100   100   050    -    590675991
176 Erase_Fail_Count_Chip   -O--CK   100   100   050    -    704115
177 Wear_Leveling_Count     -O--CK   100   100   050    -    93934064
178 Used_Rsvd_Blk_Cnt_Chip  -O--CK   100   100   050    -    0
181 Program_Fail_Cnt_Total  -O--CK   100   100   050    -    0
182 Erase_Fail_Count_Total  -O--CK   100   100   050    -    0
192 Power-Off_Retract_Count -O--CK   100   100   050    -    327
194 Temperature_Celsius     -O--CK   100   100   050    -    40
195 Hardware_ECC_Recovered  -O--CK   100   100   050    -    5418
196 Reallocated_Event_Count -O--CK   100   100   050    -    0
197 Current_Pending_Sector  -O--CK   100   100   050    -    0
198 Offline_Uncorrectable   -O--CK   100   100   050    -    0
199 UDMA_CRC_Error_Count    -O--CK   100   100   050    -    1310
232 Available_Reservd_Space -O--CK   100   100   050    -    100
241 Total_LBAs_Written      -O--CK   100   100   050    -    513869
242 Total_LBAs_Read         -O--CK   100   100   050    -    592649
245 Unknown_Attribute       -O--CK   100   100   050    -    1278730
                            ||||||_ K auto-keep
                            |||||__ C event count
                            ||||___ R error rate
                            |||____ S speed/performance
                            ||_____ O updated online
                            |______ P prefailure warning

General Purpose Log Directory Version 1
SMART           Log Directory Version 1 [multi-sector log support]
Address    Access  R/W   Size  Description
0x00       GPL,SL  R/O      1  Log Directory
0x01       GPL,SL  R/O      1  Summary SMART error log
0x02       GPL,SL  R/O      1  Comprehensive SMART error log
0x03       GPL,SL  R/O      1  Ext. Comprehensive SMART error log
0x04       GPL,SL  R/O      8  Device Statistics log
0x06       GPL,SL  R/O      1  SMART self-test log
0x07       GPL,SL  R/O      1  Extended self-test log
0x09       GPL,SL  R/W      1  Selective self-test log
0x10       GPL,SL  R/O      1  NCQ Command Error log
0x11       GPL,SL  R/O      1  SATA Phy Event Counters log
0x30       GPL,SL  R/O      9  IDENTIFY DEVICE data log
0x80-0x9f  GPL,SL  R/W     16  Host vendor specific log
0xa0       GPL,SL  VS      16  Device vendor specific log
0xe0       GPL,SL  R/W      1  SCT Command/Status
0xe1       GPL,SL  R/W      1  SCT Data Transfer

SMART Extended Comprehensive Error Log Version: 1 (1 sectors)
Device Error Count: 785 (device log contains only the most recent 4 errors)
	CR     = Command Register
	FEATR  = Features Register
	COUNT  = Count (was: Sector Count) Register
	LBA_48 = Upper bytes of LBA High/Mid/Low Registers ]  ATA-8
	LH     = LBA High (was: Cylinder High) Register    ]   LBA
	LM     = LBA Mid (was: Cylinder Low) Register      ] Register
	LL     = LBA Low (was: Sector Number) Register     ]
	DV     = Device (was: Device/Head) Register
	DC     = Device Control Register
	ER     = Error register
	ST     = Status register
Powered_Up_Time is measured from power on, and printed as
DDd+hh:mm:SS.sss where DD=days, hh=hours, mm=minutes,
SS=sec, and sss=millisec. It "wraps" after 49.710 days.

Error 785 [0] occurred at disk power-on lifetime: 6985 hours (291 days + 1 hours)
  When the command that caused the error occurred, the device was in an unknown state.

  After command completion occurred, registers were:
  ER -- ST COUNT  LBA_48  LH LM LL DV DC
  -- -- -- == -- == == == -- -- -- -- --
  84 -- 40 00 b8 00 23 bf 00 e5 08 00 00   at LBA = 0x23bf00e508 = 153528362248

  Commands leading to the command that caused the error were:
  CR FEATR COUNT  LBA_48  LH LM LL DV DC  Powered_Up_Time  Command/Feature_Name
  -- == -- == -- == == == -- -- -- -- --  ---------------  --------------------
  61 06 40 00 b8 00 23 bf 00 e5 08 40 08     00:47:08.640  WRITE FPDMA QUEUED
  61 07 f8 00 b0 00 23 b7 00 e5 10 40 08     00:47:08.640  WRITE FPDMA QUEUED
  61 00 30 00 a8 00 06 01 00 ab b0 40 08     00:47:08.640  WRITE FPDMA QUEUED
  61 01 80 00 a0 00 23 b5 00 e5 90 40 08     00:47:08.640  WRITE FPDMA QUEUED
  ea 00 00 00 00 00 00 00 00 00 00 a0 08     00:47:08.480  FLUSH CACHE EXT

Error 784 [3] occurred at disk power-on lifetime: 6984 hours (291 days + 0 hours)
  When the command that caused the error occurred, the device was in an unknown state.

  After command completion occurred, registers were:
  ER -- ST COUNT  LBA_48  LH LM LL DV DC
  -- -- -- == -- == == == -- -- -- -- --
  84 -- 40 00 48 00 23 84 00 e2 48 00 00   at LBA = 0x238400e248 = 152538505800

  Commands leading to the command that caused the error were:
  CR FEATR COUNT  LBA_48  LH LM LL DV DC  Powered_Up_Time  Command/Feature_Name
  -- == -- == -- == == == -- -- -- -- --  ---------------  --------------------
  61 03 b8 00 48 00 23 84 00 e2 48 40 08     00:25:38.880  WRITE FPDMA QUEUED
  ea 00 00 00 00 00 00 00 00 00 00 a0 08     00:25:38.820  FLUSH CACHE EXT
  61 00 08 00 28 00 06 51 00 a9 98 40 08     00:25:38.820  WRITE FPDMA QUEUED
  ea 00 00 00 00 00 00 00 00 00 00 a0 08     00:25:38.820  FLUSH CACHE EXT
  61 00 60 00 18 00 06 59 00 a9 e0 40 08     00:25:38.820  WRITE FPDMA QUEUED

Error 783 [2] occurred at disk power-on lifetime: 6309 hours (262 days + 21 hours)
  When the command that caused the error occurred, the device was in an unknown state.

  After command completion occurred, registers were:
  ER -- ST COUNT  LBA_48  LH LM LL DV DC
  -- -- -- == -- == == == -- -- -- -- --
  84 -- 40 00 28 00 00 75 00 5f 70 00 00   at LBA = 0x75005f70 = 1962958704

  Commands leading to the command that caused the error were:
  CR FEATR COUNT  LBA_48  LH LM LL DV DC  Powered_Up_Time  Command/Feature_Name
  -- == -- == -- == == == -- -- -- -- --  ---------------  --------------------
  61 00 08 00 28 00 00 75 00 5f 70 40 00     05:17:25.280  WRITE FPDMA QUEUED
  60 00 80 00 20 00 18 e4 00 19 a8 40 00     05:17:25.280  READ FPDMA QUEUED
  60 00 80 00 18 00 18 41 00 30 e0 40 00     05:17:25.280  READ FPDMA QUEUED
  ef 00 02 00 00 00 00 00 00 00 00 a0 00     05:17:24.880  SET FEATURES [Enable write cache]
  58 00 00 00 01 00 00 01 00 00 04 e0 ff     05:17:24.860  [RESERVED]

Error 782 [1] occurred at disk power-on lifetime: 6309 hours (262 days + 21 hours)
  When the command that caused the error occurred, the device was in an unknown state.

  After command completion occurred, registers were:
  ER -- ST COUNT  LBA_48  LH LM LL DV DC
  -- -- -- == -- == == == -- -- -- -- --
  84 -- 40 00 d8 00 18 31 00 5d 80 00 00   at LBA = 0x1831005d80 = 103901322624

  Commands leading to the command that caused the error were:
  CR FEATR COUNT  LBA_48  LH LM LL DV DC  Powered_Up_Time  Command/Feature_Name
  -- == -- == -- == == == -- -- -- -- --  ---------------  --------------------
  61 01 00 00 d8 00 18 31 00 5d 80 40 00     05:15:34.520  WRITE FPDMA QUEUED
  ef 00 02 00 00 00 00 00 00 00 00 a0 00     05:15:34.270  SET FEATURES [Enable write cache]
  ef 00 02 00 00 00 00 00 00 00 00 a0 00     05:15:34.270  SET FEATURES [Enable write cache]
  58 00 00 00 01 00 00 00 00 00 10 e0 ff     05:15:34.240  [RESERVED]

SMART Extended Self-test Log Version: 0 (1 sectors)
No self-tests have been logged.  [To run self-tests, use: smartctl -t]

SMART Selective self-test log data structure revision number 0
Note: revision number not 1 implies that no selective self-test has ever been run
 SPAN  MIN_LBA  MAX_LBA  CURRENT_TEST_STATUS
    1        0        0  Not_testing
    2        0        0  Not_testing
    3        0        0  Not_testing
    4        0        0  Not_testing
    5        0        0  Not_testing
Selective self-test flags (0x0):
  After scanning selected spans, do NOT read-scan remainder of disk.
If Selective self-test is pending on power-up, resume after 0 minute delay.

SCT Commands not supported

Device Statistics (GP Log 0x04)
Page  Offset Size        Value Flags Description
0x01  =====  =               =  ===  == General Statistics (rev 1) ==
0x01  0x008  4            2459  ---  Lifetime Power-On Resets
0x01  0x010  4            8333  ---  Power-on Hours
0x01  0x018  6     33676918784  ---  Logical Sectors Written
0x01  0x020  6       140517399  ---  Number of Write Commands
0x01  0x028  6     38839844864  ---  Logical Sectors Read
0x01  0x030  6       333034083  ---  Number of Read Commands
0x01  =====  =               =  ===  == General Statistics (rev 1) ==
0x01  0x008  4            2459  ---  Lifetime Power-On Resets
0x01  0x010  4            8333  ---  Power-on Hours
0x01  0x018  6     33676918784  ---  Logical Sectors Written
0x01  0x020  6       140517399  ---  Number of Write Commands
0x01  0x028  6     38839844864  ---  Logical Sectors Read
0x01  0x030  6       333034083  ---  Number of Read Commands
0x01  =====  =               =  ===  == General Statistics (rev 1) ==
0x01  0x008  4            2459  ---  Lifetime Power-On Resets
0x01  0x010  4            8333  ---  Power-on Hours
0x01  0x018  6     33676918784  ---  Logical Sectors Written
0x01  0x020  6       140517399  ---  Number of Write Commands
0x01  0x028  6     38839844864  ---  Logical Sectors Read
0x01  0x030  6       333034083  ---  Number of Read Commands
0x01  =====  =               =  ===  == General Statistics (rev 1) ==
0x01  0x008  4            2459  ---  Lifetime Power-On Resets
0x01  0x010  4            8333  ---  Power-on Hours
0x01  0x018  6     33676918784  ---  Logical Sectors Written
0x01  0x020  6       140517399  ---  Number of Write Commands
0x01  0x028  6     38839844864  ---  Logical Sectors Read
0x01  0x030  6       333034083  ---  Number of Read Commands
0x01  =====  =               =  ===  == General Statistics (rev 1) ==
0x01  0x008  4            2459  ---  Lifetime Power-On Resets
0x01  0x010  4            8333  ---  Power-on Hours
0x01  0x018  6     33676918784  ---  Logical Sectors Written
0x01  0x020  6       140517399  ---  Number of Write Commands
0x01  0x028  6     38839844864  ---  Logical Sectors Read
0x01  0x030  6       333034083  ---  Number of Read Commands
0x01  =====  =               =  ===  == General Statistics (rev 1) ==
0x01  0x008  4            2459  ---  Lifetime Power-On Resets
0x01  0x010  4            8333  ---  Power-on Hours
0x01  0x018  6     33676918784  ---  Logical Sectors Written
0x01  0x020  6       140517399  ---  Number of Write Commands
0x01  0x028  6     38839844864  ---  Logical Sectors Read
0x01  0x030  6       333034083  ---  Number of Read Commands
0x01  =====  =               =  ===  == General Statistics (rev 1) ==
0x01  0x008  4            2459  ---  Lifetime Power-On Resets
0x01  0x010  4            8333  ---  Power-on Hours
0x01  0x018  6     33676918784  ---  Logical Sectors Written
0x01  0x020  6       140517399  ---  Number of Write Commands
0x01  0x028  6     38839844864  ---  Logical Sectors Read
0x01  0x030  6       333034083  ---  Number of Read Commands
0x01  =====  =               =  ===  == General Statistics (rev 1) ==
0x01  0x008  4            2459  ---  Lifetime Power-On Resets
0x01  0x010  4            8333  ---  Power-on Hours
0x01  0x018  6     33676918784  ---  Logical Sectors Written
0x01  0x020  6       140517399  ---  Number of Write Commands
0x01  0x028  6     38839844864  ---  Logical Sectors Read
0x01  0x030  6       333034083  ---  Number of Read Commands
                                |||_ C monitored condition met
                                ||__ D supports DSN
                                |___ N normalized value

Pending Defects log (GP Log 0x0c) not supported

SATA Phy Event Counters (GP Log 0x11)
ID      Size     Value  Description
0x0001  4            0  Command failed due to ICRC error
0x0009  4         3301  Transition from drive PhyRdy to drive PhyNRdy
0x000a  4         4025  Device-to-host register FISes sent due to a COMRESET
0x000b  4         1310  CRC errors within host-to-device FIS
0x000d  4           25  Non-CRC errors within host-to-device FIS



