=== START OF INFORMATION SECTION ===
Model Family:     Toshiba 2.5" HDD MK..75GSX
Device Model:     TOSHIBA MK6475GSX
Serial Number:    --
LU WWN Device Id: 5 000039 ...
Firmware Version: GT001M
User Capacity:    640 135 028 736 bytes [640 GB]
Sector Size:      512 bytes logical/physical
Rotation Rate:    5400 rpm
Form Factor:      2.5 inches
Device is:        In smartctl database [for details use: -P show]
ATA Version is:   ATA8-ACS (minor revision not indicated)
SATA Version is:  SATA 2.6, 3.0 Gb/s (current: 3.0 Gb/s)
Local Time is:    Mon Nov 11 23:44:42 2019 MSK
SMART support is: Available - device has SMART capability.
SMART support is: Enabled
AAM feature is:   Unavailable
APM level is:     128 (minimum power consumption without standby)
Rd look-ahead is: Enabled
Write cache is:   Enabled
ATA Security is:  Disabled, NOT FROZEN [SEC1]
Wt Cache Reorder: Enabled

=== START OF READ SMART DATA SECTION ===
SMART overall-health self-assessment test result: PASSED

General SMART Values:
Offline data collection status:  (0x84)	Offline data collection activity
					was suspended by an interrupting command from host.
					Auto Offline Data Collection: Enabled.
Self-test execution status:      (  25)	The self-test routine was aborted by
					the host.
Total time to complete Offline 
data collection: 		(  120) seconds.
Offline data collection
capabilities: 			 (0x5b) SMART execute Offline immediate.
					Auto Offline data collection on/off support.
					Suspend Offline collection upon new
					command.
					Offline surface scan supported.
					Self-test supported.
					No Conveyance Self-test supported.
					Selective Self-test supported.
SMART capabilities:            (0x0003)	Saves SMART data before entering
					power-saving mode.
					Supports SMART auto save timer.
Error logging capability:        (0x01)	Error logging supported.
					General Purpose Logging supported.
Short self-test routine 
recommended polling time: 	 (   2) minutes.
Extended self-test routine
recommended polling time: 	 ( 204) minutes.
SCT capabilities: 	       (0x003d)	SCT Status supported.
					SCT Error Recovery Control supported.
					SCT Feature Control supported.
					SCT Data Table supported.

SMART Attributes Data Structure revision number: 16
Vendor Specific SMART Attributes with Thresholds:
ID# ATTRIBUTE_NAME          FLAGS    VALUE WORST THRESH FAIL RAW_VALUE
  1 Raw_Read_Error_Rate     PO-R--   100   100   050    -    0
  2 Throughput_Performance  P-S---   100   100   050    -    0
  3 Spin_Up_Time            POS--K   100   100   001    -    1989
  4 Start_Stop_Count        -O--CK   100   100   000    -    8131
  5 Reallocated_Sector_Ct   PO--CK   100   100   050    -    0
  7 Seek_Error_Rate         PO-R--   100   100   050    -    0
  8 Seek_Time_Performance   P-S---   100   100   050    -    0
  9 Power_On_Hours          -O--CK   014   014   000    -    34566
 10 Spin_Retry_Count        PO--CK   253   100   030    -    0
 12 Power_Cycle_Count       -O--CK   100   100   000    -    8099
191 G-Sense_Error_Rate      -O--CK   100   100   000    -    380
192 Power-Off_Retract_Count -O--CK   100   100   000    -    173
193 Load_Cycle_Count        -O--CK   045   045   000    -    555126
194 Temperature_Celsius     -O---K   100   100   000    -    34 (Min/Max 14/61)
196 Reallocated_Event_Count -O--CK   100   100   000    -    0
197 Current_Pending_Sector  -O--CK   100   100   000    -    16
198 Offline_Uncorrectable   ----CK   100   100   000    -    2
199 UDMA_CRC_Error_Count    -O--CK   200   200   000    -    0
220 Disk_Shift              -O----   100   100   000    -    8247
222 Loaded_Hours            -O--CK   038   038   000    -    25046
223 Load_Retry_Count        -O--CK   100   100   000    -    0
224 Load_Friction           -O---K   100   100   000    -    0
226 Load-in_Time            -OS--K   100   100   000    -    315
240 Head_Flying_Hours       P-----   100   100   001    -    0
                            ||||||_ K auto-keep
                            |||||__ C event count
                            ||||___ R error rate
                            |||____ S speed/performance
                            ||_____ O updated online
                            |______ P prefailure warning

General Purpose Log Directory Version 1
SMART           Log Directory Version 1 [multi-sector log support]
Address    Access  R/W   Size  Description
0x00       GPL,SL  R/O      1  Log Directory
0x01           SL  R/O      1  Summary SMART error log
0x02           SL  R/O     51  Comprehensive SMART error log
0x03       GPL     R/O     64  Ext. Comprehensive SMART error log
0x06           SL  R/O      1  SMART self-test log
0x07       GPL     R/O      1  Extended self-test log
0x09           SL  R/W      1  Selective self-test log
0x10       GPL     R/O      1  SATA NCQ Queued Error log
0x11       GPL     R/O      1  SATA Phy Event Counters log
0x80-0x9f  GPL,SL  R/W     16  Host vendor specific log
0xe0       GPL,SL  R/W      1  SCT Command/Status
0xe1       GPL,SL  R/W      1  SCT Data Transfer

SMART Extended Comprehensive Error Log Version: 1 (64 sectors)
Device Error Count: 1397 (device log contains only the most recent 256 errors)
	CR     = Command Register
	FEATR  = Features Register
	COUNT  = Count (was: Sector Count) Register
	LBA_48 = Upper bytes of LBA High/Mid/Low Registers ]  ATA-8
	LH     = LBA High (was: Cylinder High) Register    ]   LBA
	LM     = LBA Mid (was: Cylinder Low) Register      ] Register
	LL     = LBA Low (was: Sector Number) Register     ]
	DV     = Device (was: Device/Head) Register
	DC     = Device Control Register
	ER     = Error register
	ST     = Status register
Powered_Up_Time is measured from power on, and printed as
DDd+hh:mm:SS.sss where DD=days, hh=hours, mm=minutes,
SS=sec, and sss=millisec. It "wraps" after 49.710 days.

Error 1397 [116] occurred at disk power-on lifetime: 27492 hours (1145 days + 12 hours)
  When the command that caused the error occurred, the device was active or idle.

  After command completion occurred, registers were:
  ER -- ST COUNT  LBA_48  LH LM LL DV DC
  -- -- -- == -- == == == -- -- -- -- --
  40 -- 41 00 ba 00 00 00 04 22 08 60 00  Error: WP at LBA = 0x00042208 = 270856

  Commands leading to the command that caused the error were:
  CR FEATR COUNT  LBA_48  LH LM LL DV DC  Powered_Up_Time  Command/Feature_Name
  -- == -- == -- == == == -- -- -- -- --  ---------------  --------------------
  61 00 08 00 e0 00 00 00 03 d9 c8 40 00     00:01:08.390  WRITE FPDMA QUEUED
  61 00 08 00 d8 00 00 01 89 85 18 40 00     00:01:08.390  WRITE FPDMA QUEUED
  61 00 08 00 d0 00 00 00 03 d9 98 40 00     00:01:08.389  WRITE FPDMA QUEUED
  61 00 08 00 c8 00 00 01 89 85 30 40 00     00:01:08.389  WRITE FPDMA QUEUED
  61 00 30 00 c0 00 00 00 2c 9e d0 40 00     00:01:08.388  WRITE FPDMA QUEUED

Error 1396 [115] occurred at disk power-on lifetime: 27492 hours (1145 days + 12 hours)
  When the command that caused the error occurred, the device was active or idle.

  After command completion occurred, registers were:
  ER -- ST COUNT  LBA_48  LH LM LL DV DC
  -- -- -- == -- == == == -- -- -- -- --
  40 -- 41 00 42 00 00 00 04 22 08 60 00  Error: WP at LBA = 0x00042208 = 270856

  Commands leading to the command that caused the error were:
  CR FEATR COUNT  LBA_48  LH LM LL DV DC  Powered_Up_Time  Command/Feature_Name
  -- == -- == -- == == == -- -- -- -- --  ---------------  --------------------
  61 00 08 00 48 00 00 01 da 91 c0 40 00     00:01:04.344  WRITE FPDMA QUEUED
  60 00 80 00 40 00 00 00 04 21 b0 40 00     00:01:04.343  READ FPDMA QUEUED
  61 00 08 00 38 00 00 03 1f b6 88 40 00     00:01:04.343  WRITE FPDMA QUEUED
  60 00 08 00 30 00 00 26 da a8 88 40 00     00:01:04.343  READ FPDMA QUEUED
  60 00 80 00 28 00 00 00 04 22 30 40 00     00:01:04.343  READ FPDMA QUEUED

Error 1395 [114] occurred at disk power-on lifetime: 27492 hours (1145 days + 12 hours)
  When the command that caused the error occurred, the device was active or idle.

  After command completion occurred, registers were:
  ER -- ST COUNT  LBA_48  LH LM LL DV DC
  -- -- -- == -- == == == -- -- -- -- --
  40 -- 41 00 e2 00 00 00 04 22 08 60 00  Error: WP at LBA = 0x00042208 = 270856

  Commands leading to the command that caused the error were:
  CR FEATR COUNT  LBA_48  LH LM LL DV DC  Powered_Up_Time  Command/Feature_Name
  -- == -- == -- == == == -- -- -- -- --  ---------------  --------------------
  61 00 08 00 e8 00 00 01 89 85 20 40 00     00:01:00.310  WRITE FPDMA QUEUED
  60 00 80 00 e0 00 00 00 04 21 b0 40 00     00:01:00.310  READ FPDMA QUEUED
  60 00 80 00 d8 00 00 00 04 22 30 40 00     00:01:00.310  READ FPDMA QUEUED
  61 00 08 00 d0 00 00 01 89 85 28 40 00     00:01:00.310  WRITE FPDMA QUEUED
  2f 00 00 00 01 00 00 00 00 00 10 40 00     00:01:00.309  READ LOG EXT

Error 1394 [113] occurred at disk power-on lifetime: 27492 hours (1145 days + 12 hours)
  When the command that caused the error occurred, the device was active or idle.

  After command completion occurred, registers were:
  ER -- ST COUNT  LBA_48  LH LM LL DV DC
  -- -- -- == -- == == == -- -- -- -- --
  40 -- 41 00 aa 00 00 00 04 22 08 60 00  Error: WP at LBA = 0x00042208 = 270856

  Commands leading to the command that caused the error were:
  CR FEATR COUNT  LBA_48  LH LM LL DV DC  Powered_Up_Time  Command/Feature_Name
  -- == -- == -- == == == -- -- -- -- --  ---------------  --------------------
  61 00 08 00 b8 00 00 00 db 66 28 40 00     00:00:58.975  WRITE FPDMA QUEUED
  61 00 08 00 b0 00 00 00 6a 22 70 40 00     00:00:56.978  WRITE FPDMA QUEUED
  60 00 80 00 a8 00 00 00 04 21 b0 40 00     00:00:56.276  READ FPDMA QUEUED
  60 00 80 00 a0 00 00 00 04 22 30 40 00     00:00:56.276  READ FPDMA QUEUED
  2f 00 00 00 01 00 00 00 00 00 10 40 00     00:00:56.276  READ LOG EXT

Error 1393 [112] occurred at disk power-on lifetime: 27492 hours (1145 days + 12 hours)
  When the command that caused the error occurred, the device was active or idle.

  After command completion occurred, registers were:
  ER -- ST COUNT  LBA_48  LH LM LL DV DC
  -- -- -- == -- == == == -- -- -- -- --
  40 -- 41 00 ba 00 00 00 04 22 08 60 00  Error: WP at LBA = 0x00042208 = 270856

  Commands leading to the command that caused the error were:
  CR FEATR COUNT  LBA_48  LH LM LL DV DC  Powered_Up_Time  Command/Feature_Name
  -- == -- == -- == == == -- -- -- -- --  ---------------  --------------------
  61 00 08 00 90 00 00 01 89 85 18 40 00     00:00:55.231  WRITE FPDMA QUEUED
  61 00 08 00 88 00 00 01 89 85 30 40 00     00:00:55.231  WRITE FPDMA QUEUED
  61 00 10 00 80 00 00 01 8a d7 90 40 00     00:00:55.231  WRITE FPDMA QUEUED
  61 00 08 00 78 00 00 01 aa fc 98 40 00     00:00:54.991  WRITE FPDMA QUEUED
  61 00 08 00 70 00 00 01 aa 25 50 40 00     00:00:54.990  WRITE FPDMA QUEUED

Error 1392 [111] occurred at disk power-on lifetime: 27492 hours (1145 days + 12 hours)
  When the command that caused the error occurred, the device was active or idle.

  After command completion occurred, registers were:
  ER -- ST COUNT  LBA_48  LH LM LL DV DC
  -- -- -- == -- == == == -- -- -- -- --
  40 -- 41 00 6a 00 00 00 04 22 08 60 00  Error: WP at LBA = 0x00042208 = 270856

  Commands leading to the command that caused the error were:
  CR FEATR COUNT  LBA_48  LH LM LL DV DC  Powered_Up_Time  Command/Feature_Name
  -- == -- == -- == == == -- -- -- -- --  ---------------  --------------------
  61 00 08 00 a0 00 00 00 00 f2 98 40 00     00:00:50.084  WRITE FPDMA QUEUED
  61 00 08 00 98 00 00 00 00 f2 a0 40 00     00:00:50.084  WRITE FPDMA QUEUED
  61 00 08 00 90 00 00 07 8c c0 20 40 00     00:00:50.084  WRITE FPDMA QUEUED
  61 00 08 00 88 00 00 07 8c c0 30 40 00     00:00:50.084  WRITE FPDMA QUEUED
  61 00 08 00 80 00 00 01 89 85 20 40 00     00:00:50.084  WRITE FPDMA QUEUED

Error 1391 [110] occurred at disk power-on lifetime: 27492 hours (1145 days + 12 hours)
  When the command that caused the error occurred, the device was active or idle.

  After command completion occurred, registers were:
  ER -- ST COUNT  LBA_48  LH LM LL DV DC
  -- -- -- == -- == == == -- -- -- -- --
  40 -- 41 00 3a 00 00 00 04 22 08 60 00  Error: WP at LBA = 0x00042208 = 270856

  Commands leading to the command that caused the error were:
  CR FEATR COUNT  LBA_48  LH LM LL DV DC  Powered_Up_Time  Command/Feature_Name
  -- == -- == -- == == == -- -- -- -- --  ---------------  --------------------
  61 00 08 00 50 00 00 00 01 12 e0 40 00     00:00:44.983  WRITE FPDMA QUEUED
  61 00 08 00 48 00 00 25 a3 10 38 40 00     00:00:44.983  WRITE FPDMA QUEUED
  61 00 08 00 40 00 00 00 63 28 68 40 00     00:00:44.982  WRITE FPDMA QUEUED
  60 00 80 00 38 00 00 00 04 21 b0 40 00     00:00:43.998  READ FPDMA QUEUED
  60 00 80 00 30 00 00 00 04 22 30 40 00     00:00:43.998  READ FPDMA QUEUED

Error 1390 [109] occurred at disk power-on lifetime: 27492 hours (1145 days + 12 hours)
  When the command that caused the error occurred, the device was active or idle.

  After command completion occurred, registers were:
  ER -- ST COUNT  LBA_48  LH LM LL DV DC
  -- -- -- == -- == == == -- -- -- -- --
  40 -- 41 00 ea 00 00 00 04 22 08 60 00  Error: WP at LBA = 0x00042208 = 270856

  Commands leading to the command that caused the error were:
  CR FEATR COUNT  LBA_48  LH LM LL DV DC  Powered_Up_Time  Command/Feature_Name
  -- == -- == -- == == == -- -- -- -- --  ---------------  --------------------
  61 00 08 00 20 00 00 00 00 f2 90 40 00     00:00:39.901  WRITE FPDMA QUEUED
  61 00 08 00 18 00 00 00 00 f2 a8 40 00     00:00:39.901  WRITE FPDMA QUEUED
  61 00 08 00 10 00 00 07 8c c0 18 40 00     00:00:39.900  WRITE FPDMA QUEUED
  61 00 08 00 08 00 00 07 8c c0 28 40 00     00:00:39.900  WRITE FPDMA QUEUED
  61 00 08 00 00 00 00 07 8e b6 b0 40 00     00:00:39.900  WRITE FPDMA QUEUED

SMART Extended Self-test Log Version: 1 (1 sectors)
Num  Test_Description    Status                  Remaining  LifeTime(hours)  LBA_of_first_error
# 1  Extended offline    Aborted by host               90%     34319         -
# 2  Extended offline    Aborted by host               20%     34297         -
# 3  Extended offline    Completed: read failure       00%     34078         270856
# 4  Extended offline    Completed: read failure       00%     33881         270856
# 5  Extended offline    Aborted by host               90%     33232         -
# 6  Extended offline    Aborted by host               80%     33147         -
# 7  Extended offline    Completed: read failure       00%     32947         270856
# 8  Extended offline    Completed: read failure       00%     31828         270856
# 9  Extended offline    Completed: read failure       00%     30205         270856
#10  Extended offline    Aborted by host               80%     29600         -
#11  Extended offline    Completed: read failure       00%     29022         270856
#12  Extended offline    Aborted by host               50%     28575         -
#13  Extended offline    Completed: read failure       00%     28474         270856
#14  Extended offline    Completed: read failure       00%     28269         270856
#15  Extended offline    Completed: read failure       00%     27938         270856
#16  Extended offline    Aborted by host               40%     27833         -
#17  Extended offline    Aborted by host               90%     27760         -
#18  Extended offline    Completed: read failure       00%     27669         270856
#19  Short offline       Completed without error       00%         3         -

SMART Selective self-test log data structure revision number 1
 SPAN  MIN_LBA  MAX_LBA  CURRENT_TEST_STATUS
    1        0        0  Not_testing
    2        0        0  Not_testing
    3        0        0  Not_testing
    4        0        0  Not_testing
    5        0        0  Not_testing
Selective self-test flags (0x0):
  After scanning selected spans, do NOT read-scan remainder of disk.
If Selective self-test is pending on power-up, resume after 0 minute delay.

SCT Status Version:                  2
SCT Version (vendor specific):       1 (0x0001)
SCT Support Level:                   1
Device State:                        SMART Off-line Data Collection executing in background (4)
Current Temperature:                    34 Celsius
Power Cycle Min/Max Temperature:     24/36 Celsius
Lifetime    Min/Max Temperature:     14/61 Celsius
Under/Over Temperature Limit Count:   0/29

SCT Temperature History Version:     2
Temperature Sampling Period:         1 minute
Temperature Logging Interval:        1 minute
Min/Max recommended Temperature:      5/55 Celsius
Min/Max Temperature Limit:            5/55 Celsius
Temperature History Size (Index):    478 (75)

SCT Error Recovery Control:
           Read: Disabled
          Write: Disabled

Device Statistics (GP/SMART Log 0x04) not supported

SATA Phy Event Counters (GP Log 0x11)
ID      Size     Value  Description
0x0001  4            0  Command failed due to ICRC error
0x0002  4            0  R_ERR response for data FIS
0x0003  4            0  R_ERR response for device-to-host data FIS
0x0004  4            0  R_ERR response for host-to-device data FIS
0x0005  4            0  R_ERR response for non-data FIS
0x0006  4            0  R_ERR response for device-to-host non-data FIS
0x0007  4            0  R_ERR response for host-to-device non-data FIS
0x0008  4            0  Device-to-host non-data FIS retries
0x0009  4            4  Transition from drive PhyRdy to drive PhyNRdy
0x000a  4            8  Device-to-host register FISes sent due to a COMRESET
0x000b  4            0  CRC errors within host-to-device FIS
0x000d  4            0  Non-CRC errors within host-to-device FIS
0x000f  4            0  R_ERR response for host-to-device data FIS, CRC
0x0010  4            0  R_ERR response for host-to-device data FIS, non-CRC
0x0012  4            0  R_ERR response for host-to-device non-data FIS, CRC
0x0013  4            0  R_ERR response for host-to-device non-data FIS, non-CRC

