smartctl 7.4 2023-08-01 r5530 [x86_64-linux-6.6.4-arch1-1] (local build)
Copyright (C) 2002-23, Bruce Allen, Christian Franke, www.smartmontools.org

=== START OF INFORMATION SECTION ===
Model Family:     Toshiba 2.5" HDD MK..75GSX
Device Model:     TOSHIBA MK6475GSX
Serial Number:    --
LU WWN Device Id: 5 000039 ...
Firmware Version: GT001M
User Capacity:    640,135,028,736 bytes [640 GB]
Sector Size:      512 bytes logical/physical
Rotation Rate:    5400 rpm
Form Factor:      2.5 inches
Device is:        In smartctl database 7.3/5528
ATA Version is:   ATA8-ACS (minor revision not indicated)
SATA Version is:  SATA 2.6, 3.0 Gb/s (current: 3.0 Gb/s)
Local Time is:    Thu May 15 21:48:00 2025 WIB
SMART support is: Available - device has SMART capability.
SMART support is: Enabled
AAM feature is:   Unavailable
APM level is:     128 (minimum power consumption without standby)
Rd look-ahead is: Enabled
Write cache is:   Enabled
DSN feature is:   Unavailable
ATA Security is:  Disabled, frozen [SEC2]
Wt Cache Reorder: Enabled

=== START OF READ SMART DATA SECTION ===
SMART overall-health self-assessment test result: PASSED

General SMART Values:
Offline data collection status:  (0x00)	Offline data collection activity
					was never started.
					Auto Offline Data Collection: Disabled.
Self-test execution status:      (   0)	The previous self-test routine completed
					without error or no self-test has ever 
					been run.
Total time to complete Offline 
data collection: 		(  120) seconds.
Offline data collection
capabilities: 			 (0x5b) SMART execute Offline immediate.
					Auto Offline data collection on/off support.
					Suspend Offline collection upon new
					command.
					Offline surface scan supported.
					Self-test supported.
					No Conveyance Self-test supported.
					Selective Self-test supported.
SMART capabilities:            (0x0003)	Saves SMART data before entering
					power-saving mode.
					Supports SMART auto save timer.
Error logging capability:        (0x01)	Error logging supported.
					General Purpose Logging supported.
Short self-test routine 
recommended polling time: 	 (   2) minutes.
Extended self-test routine
recommended polling time: 	 ( 197) minutes.
SCT capabilities: 	       (0x003d)	SCT Status supported.
					SCT Error Recovery Control supported.
					SCT Feature Control supported.
					SCT Data Table supported.

SMART Attributes Data Structure revision number: 16
Vendor Specific SMART Attributes with Thresholds:
ID# ATTRIBUTE_NAME          FLAGS    VALUE WORST THRESH FAIL RAW_VALUE
  1 Raw_Read_Error_Rate     PO-R--   100   100   050    -    0
  2 Throughput_Performance  P-S---   100   100   050    -    0
  3 Spin_Up_Time            POS--K   100   100   001    -    2162
  4 Start_Stop_Count        -O--CK   100   100   000    -    11034
  5 Reallocated_Sector_Ct   PO--CK   100   100   050    -    0
  7 Seek_Error_Rate         PO-R--   100   100   050    -    0
  8 Seek_Time_Performance   P-S---   100   100   050    -    0
  9 Power_On_Hours          -O--CK   042   042   000    -    23255
 10 Spin_Retry_Count        PO--CK   253   100   030    -    0
 12 Power_Cycle_Count       -O--CK   100   100   000    -    10995
191 G-Sense_Error_Rate      -O--CK   100   100   000    -    1329
192 Power-Off_Retract_Count -O--CK   096   096   000    -    969017407
193 Load_Cycle_Count        -O--CK   092   092   000    -    84064
194 Temperature_Celsius     -O---K   100   100   000    -    37 (Min/Max 16/59)
196 Reallocated_Event_Count -O--CK   100   100   000    -    0
197 Current_Pending_Sector  -O--CK   100   100   000    -    0
198 Offline_Uncorrectable   ----CK   100   100   000    -    0
199 UDMA_CRC_Error_Count    -O--CK   200   200   000    -    0
220 Disk_Shift              -O----   100   100   000    -    58
222 Loaded_Hours            -O--CK   049   049   000    -    20534
223 Load_Retry_Count        -O--CK   100   100   000    -    0
224 Load_Friction           -O---K   100   100   000    -    0
226 Load-in_Time            -OS--K   100   100   000    -    329
240 Head_Flying_Hours       P-----   100   100   001    -    0
                            ||||||_ K auto-keep
                            |||||__ C event count
                            ||||___ R error rate
                            |||____ S speed/performance
                            ||_____ O updated online
                            |______ P prefailure warning

General Purpose Log Directory Version 1
SMART           Log Directory Version 1 [multi-sector log support]
Address    Access  R/W   Size  Description
0x00       GPL,SL  R/O      1  Log Directory
0x01           SL  R/O      1  Summary SMART error log
0x02           SL  R/O     51  Comprehensive SMART error log
0x03       GPL     R/O     64  Ext. Comprehensive SMART error log
0x06           SL  R/O      1  SMART self-test log
0x07       GPL     R/O      1  Extended self-test log
0x09           SL  R/W      1  Selective self-test log
0x10       GPL     R/O      1  NCQ Command Error log
0x11       GPL     R/O      1  SATA Phy Event Counters log
0x80-0x9f  GPL,SL  R/W     16  Host vendor specific log
0xe0       GPL,SL  R/W      1  SCT Command/Status
0xe1       GPL,SL  R/W      1  SCT Data Transfer

SMART Extended Comprehensive Error Log Version: 1 (64 sectors)
Device Error Count: 4925 (device log contains only the most recent 256 errors)
	CR     = Command Register
	FEATR  = Features Register
	COUNT  = Count (was: Sector Count) Register
	LBA_48 = Upper bytes of LBA High/Mid/Low Registers ]  ATA-8
	LH     = LBA High (was: Cylinder High) Register    ]   LBA
	LM     = LBA Mid (was: Cylinder Low) Register      ] Register
	LL     = LBA Low (was: Sector Number) Register     ]
	DV     = Device (was: Device/Head) Register
	DC     = Device Control Register
	ER     = Error register
	ST     = Status register
Powered_Up_Time is measured from power on, and printed as
DDd+hh:mm:SS.sss where DD=days, hh=hours, mm=minutes,
SS=sec, and sss=millisec. It "wraps" after 49.710 days.

Error 4925 [60] occurred at disk power-on lifetime: 11768 hours (490 days + 8 hours)
  When the command that caused the error occurred, the device was active or idle.

  After command completion occurred, registers were:
  ER -- ST COUNT  LBA_48  LH LM LL DV DC
  -- -- -- == -- == == == -- -- -- -- --
  40 -- 41 00 32 00 00 00 64 e9 40 60 00  Error: WP at LBA = 0x0064e940 = 6613312

  Commands leading to the command that caused the error were:
  CR FEATR COUNT  LBA_48  LH LM LL DV DC  Powered_Up_Time  Command/Feature_Name
  -- == -- == -- == == == -- -- -- -- --  ---------------  --------------------
  61 00 08 00 60 00 00 2e 24 7a 38 40 00     00:11:31.911  WRITE FPDMA QUEUED
  61 00 08 00 58 00 00 2e 24 7a 40 40 00     00:11:31.911  WRITE FPDMA QUEUED
  61 00 08 00 50 00 00 2e 24 7a 48 40 00     00:11:31.911  WRITE FPDMA QUEUED
  61 00 06 00 48 00 00 39 30 dc 08 40 00     00:11:31.910  WRITE FPDMA QUEUED
  61 00 18 00 40 00 00 2e 28 b0 38 40 00     00:11:31.910  WRITE FPDMA QUEUED

Error 4924 [59] occurred at disk power-on lifetime: 11768 hours (490 days + 8 hours)
  When the command that caused the error occurred, the device was active or idle.

  After command completion occurred, registers were:
  ER -- ST COUNT  LBA_48  LH LM LL DV DC
  -- -- -- == -- == == == -- -- -- -- --
  40 -- 41 00 1a 00 00 00 64 e9 40 60 00  Error: UNC at LBA = 0x0064e940 = 6613312

  Commands leading to the command that caused the error were:
  CR FEATR COUNT  LBA_48  LH LM LL DV DC  Powered_Up_Time  Command/Feature_Name
  -- == -- == -- == == == -- -- -- -- --  ---------------  --------------------
  60 00 05 00 28 00 00 39 30 dc 08 40 00     00:11:27.667  READ FPDMA QUEUED
  61 00 3d 00 20 00 00 2e 08 e7 14 40 00     00:11:27.667  WRITE FPDMA QUEUED
  61 00 01 00 20 00 00 2d f2 ed d7 40 00     00:11:27.666  WRITE FPDMA QUEUED
  60 01 00 00 18 00 00 00 64 e9 00 40 00     00:11:27.647  READ FPDMA QUEUED
  60 00 40 00 10 00 00 2d f2 ed d0 40 00     00:11:27.613  READ FPDMA QUEUED

Error 4923 [58] occurred at disk power-on lifetime: 11768 hours (490 days + 8 hours)
  When the command that caused the error occurred, the device was active or idle.

  After command completion occurred, registers were:
  ER -- ST COUNT  LBA_48  LH LM LL DV DC
  -- -- -- == -- == == == -- -- -- -- --
  40 -- 41 00 12 00 00 00 64 e9 40 60 00  Error: WP at LBA = 0x0064e940 = 6613312

  Commands leading to the command that caused the error were:
  CR FEATR COUNT  LBA_48  LH LM LL DV DC  Powered_Up_Time  Command/Feature_Name
  -- == -- == -- == == == -- -- -- -- --  ---------------  --------------------
  61 00 08 00 70 00 00 13 4a ba 40 40 00     00:11:23.433  WRITE FPDMA QUEUED
  61 00 08 00 68 00 00 13 4a ba 38 40 00     00:11:23.433  WRITE FPDMA QUEUED
  61 00 08 00 60 00 00 13 4a ba 50 40 00     00:11:23.432  WRITE FPDMA QUEUED
  61 00 06 00 58 00 00 17 7b 30 f8 40 00     00:11:23.428  WRITE FPDMA QUEUED
  61 00 10 00 50 00 00 13 4e f0 40 40 00     00:11:23.428  WRITE FPDMA QUEUED

Error 4922 [57] occurred at disk power-on lifetime: 11768 hours (490 days + 8 hours)
  When the command that caused the error occurred, the device was active or idle.

  After command completion occurred, registers were:
  ER -- ST COUNT  LBA_48  LH LM LL DV DC
  -- -- -- == -- == == == -- -- -- -- --
  40 -- 41 00 0a 00 00 00 64 e9 40 60 00  Error: UNC at LBA = 0x0064e940 = 6613312

  Commands leading to the command that caused the error were:
  CR FEATR COUNT  LBA_48  LH LM LL DV DC  Powered_Up_Time  Command/Feature_Name
  -- == -- == -- == == == -- -- -- -- --  ---------------  --------------------
  60 00 06 00 10 00 00 17 7b 30 f8 40 00     00:11:19.276  READ FPDMA QUEUED
  60 01 00 00 08 00 00 00 64 e9 00 40 00     00:11:19.276  READ FPDMA QUEUED
  ef 00 02 01 00 00 00 01 00 00 00 00 00     00:11:19.276  SET FEATURES [Enable write cache]
  aa aa aa aa aa aa aa aa aa aa aa aa ff     00:11:19.236  [RESERVED]
  60 00 06 00 10 00 00 17 7b 30 f8 40 00     00:11:15.157  READ FPDMA QUEUED

Error 4921 [56] occurred at disk power-on lifetime: 11768 hours (490 days + 8 hours)
  When the command that caused the error occurred, the device was active or idle.

  After command completion occurred, registers were:
  ER -- ST COUNT  LBA_48  LH LM LL DV DC
  -- -- -- == -- == == == -- -- -- -- --
  40 -- 41 00 0a 00 00 00 64 e9 40 60 00  Error: UNC at LBA = 0x0064e940 = 6613312

  Commands leading to the command that caused the error were:
  CR FEATR COUNT  LBA_48  LH LM LL DV DC  Powered_Up_Time  Command/Feature_Name
  -- == -- == -- == == == -- -- -- -- --  ---------------  --------------------
  60 00 06 00 10 00 00 17 7b 30 f8 40 00     00:11:15.157  READ FPDMA QUEUED
  60 01 00 00 08 00 00 00 64 e9 00 40 00     00:11:15.157  READ FPDMA QUEUED
  ef 00 02 01 00 00 00 01 00 00 00 00 00     00:11:15.157  SET FEATURES [Enable write cache]
  aa aa aa aa aa aa aa aa aa aa aa aa ff     00:11:15.125  [RESERVED]
  60 00 06 00 38 00 00 17 7b 30 f8 40 00     00:11:11.054  READ FPDMA QUEUED

Error 4920 [55] occurred at disk power-on lifetime: 11768 hours (490 days + 8 hours)
  When the command that caused the error occurred, the device was active or idle.

  After command completion occurred, registers were:
  ER -- ST COUNT  LBA_48  LH LM LL DV DC
  -- -- -- == -- == == == -- -- -- -- --
  40 -- 41 00 0a 00 00 00 64 e9 40 60 00  Error: UNC at LBA = 0x0064e940 = 6613312

  Commands leading to the command that caused the error were:
  CR FEATR COUNT  LBA_48  LH LM LL DV DC  Powered_Up_Time  Command/Feature_Name
  -- == -- == -- == == == -- -- -- -- --  ---------------  --------------------
  60 00 06 00 38 00 00 17 7b 30 f8 40 00     00:11:11.054  READ FPDMA QUEUED
  60 01 00 00 08 00 00 00 64 e9 00 40 00     00:11:11.054  READ FPDMA QUEUED
  ef 00 02 01 00 00 00 01 00 00 00 00 00     00:11:11.054  SET FEATURES [Enable write cache]
  aa aa aa aa aa aa aa aa aa aa aa aa ff     00:11:11.014  [RESERVED]
  60 00 06 00 30 00 00 17 7b 30 f8 40 00     00:11:06.923  READ FPDMA QUEUED

Error 4919 [54] occurred at disk power-on lifetime: 11768 hours (490 days + 8 hours)
  When the command that caused the error occurred, the device was active or idle.

  After command completion occurred, registers were:
  ER -- ST COUNT  LBA_48  LH LM LL DV DC
  -- -- -- == -- == == == -- -- -- -- --
  40 -- 41 00 7a 00 00 00 64 e9 40 60 00  Error: UNC at LBA = 0x0064e940 = 6613312

  Commands leading to the command that caused the error were:
  CR FEATR COUNT  LBA_48  LH LM LL DV DC  Powered_Up_Time  Command/Feature_Name
  -- == -- == -- == == == -- -- -- -- --  ---------------  --------------------
  60 00 06 00 30 00 00 17 7b 30 f8 40 00     00:11:06.923  READ FPDMA QUEUED
  61 00 3d 00 28 00 00 12 f0 bf e9 40 00     00:11:06.921  WRITE FPDMA QUEUED
  61 00 01 00 20 00 00 12 f1 cc 8c 40 00     00:11:06.915  WRITE FPDMA QUEUED
  61 00 08 00 18 00 00 13 4a ba 38 40 00     00:11:06.857  WRITE FPDMA QUEUED
  60 00 40 00 10 00 00 12 f1 cc 88 40 00     00:11:06.857  READ FPDMA QUEUED

Error 4918 [53] occurred at disk power-on lifetime: 11768 hours (490 days + 8 hours)
  When the command that caused the error occurred, the device was active or idle.

  After command completion occurred, registers were:
  ER -- ST COUNT  LBA_48  LH LM LL DV DC
  -- -- -- == -- == == == -- -- -- -- --
  40 -- 41 00 2a 00 00 00 64 e9 40 60 00  Error: WP at LBA = 0x0064e940 = 6613312

  Commands leading to the command that caused the error were:
  CR FEATR COUNT  LBA_48  LH LM LL DV DC  Powered_Up_Time  Command/Feature_Name
  -- == -- == -- == == == -- -- -- -- --  ---------------  --------------------
  61 00 08 00 68 00 00 00 00 f2 98 40 00     00:11:02.695  WRITE FPDMA QUEUED
  61 00 08 00 60 00 00 00 00 f2 90 40 00     00:11:02.694  WRITE FPDMA QUEUED
  61 00 08 00 58 00 00 00 00 f2 a8 40 00     00:11:02.694  WRITE FPDMA QUEUED
  61 00 04 00 50 00 00 00 00 bf 28 40 00     00:11:02.694  WRITE FPDMA QUEUED
  61 00 08 00 48 00 00 00 01 13 68 40 00     00:11:02.694  WRITE FPDMA QUEUED

SMART Extended Self-test Log Version: 1 (1 sectors)
No self-tests have been logged.  [To run self-tests, use: smartctl -t]

SMART Selective self-test log data structure revision number 1
 SPAN  MIN_LBA  MAX_LBA  CURRENT_TEST_STATUS
    1        0        0  Not_testing
    2        0        0  Not_testing
    3        0        0  Not_testing
    4        0        0  Not_testing
    5        0        0  Not_testing
Selective self-test flags (0x0):
  After scanning selected spans, do NOT read-scan remainder of disk.
If Selective self-test is pending on power-up, resume after 0 minute delay.

SCT Status Version:                  2
SCT Version (vendor specific):       1 (0x0001)
Device State:                        Active (0)
Current Temperature:                    37 Celsius
Power Cycle Min/Max Temperature:     35/42 Celsius
Lifetime    Min/Max Temperature:     16/59 Celsius
Under/Over Temperature Limit Count:   0/2156

SCT Temperature History Version:     2
Temperature Sampling Period:         1 minute
Temperature Logging Interval:        1 minute
Min/Max recommended Temperature:      5/55 Celsius
Min/Max Temperature Limit:            5/55 Celsius
Temperature History Size (Index):    478 (44)

SCT Error Recovery Control:
           Read: Disabled
          Write: Disabled

Device Statistics (GP/SMART Log 0x04) not supported

Pending Defects log (GP Log 0x0c) not supported

SATA Phy Event Counters (GP Log 0x11)
ID      Size     Value  Description
0x0001  4            0  Command failed due to ICRC error
0x0002  4            0  R_ERR response for data FIS
0x0003  4            0  R_ERR response for device-to-host data FIS
0x0004  4            0  R_ERR response for host-to-device data FIS
0x0005  4            0  R_ERR response for non-data FIS
0x0006  4            0  R_ERR response for device-to-host non-data FIS
0x0007  4            0  R_ERR response for host-to-device non-data FIS
0x0008  4            0  Device-to-host non-data FIS retries
0x0009  4            7  Transition from drive PhyRdy to drive PhyNRdy
0x000a  4            9  Device-to-host register FISes sent due to a COMRESET
0x000b  4            0  CRC errors within host-to-device FIS
0x000d  4            0  Non-CRC errors within host-to-device FIS
0x000f  4            0  R_ERR response for host-to-device data FIS, CRC
0x0010  4            0  R_ERR response for host-to-device data FIS, non-CRC
0x0012  4            0  R_ERR response for host-to-device non-data FIS, CRC
0x0013  4            0  R_ERR response for host-to-device non-data FIS, non-CRC

