smartctl 7.4 2023-08-01 r5530 [x86_64-linux-6.14.2-desktop-3omv2590] (OpenMandriva Lx 7.4-1)
Copyright (C) 2002-23, Bruce Allen, Christian Franke, www.smartmontools.org

=== START OF INFORMATION SECTION ===
Model Number:                       T-FORCE TM8FP8001T
Serial Number:                      --
Firmware Version:                   V9002s77
PCI Vendor/Subsystem ID:            0x10ec
IEEE OUI Identifier:                0x00e04c
Controller ID:                      1
NVMe Version:                       1.3
Number of Namespaces:               1
Namespace 1 Size/Capacity:          1,024,209,543,168 [1.02 TB]
Namespace 1 Formatted LBA Size:     512
Namespace 1 IEEE EUI-64:            00e04c ...
Local Time is:                      Sat Nov 29 09:39:11 2025 EST
Firmware Updates (0x02):            1 Slot
Optional Admin Commands (0x0007):   Security Format Frmw_DL
Optional NVM Commands (0x0014):     DS_Mngmt Sav/Sel_Feat
Log Page Attributes (0x03):         S/H_per_NS Cmd_Eff_Lg
Maximum Data Transfer Size:         32 Pages
Warning  Comp. Temp. Threshold:     115 Celsius
Critical Comp. Temp. Threshold:     120 Celsius

Supported Power States
St Op     Max   Active     Idle   RL RT WL WT  Ent_Lat  Ex_Lat
 0 +     8.00W       -        -    0  0  0  0        0   50000
 1 +     4.00W       -        -    1  1  1  1        0   50000
 2 +     3.00W       -        -    2  2  2  2        0   50000
 3 -   0.0500W       -        -    3  3  3  3     4000   50000
 4 -   0.0080W       -        -    4  4  4  4     8000  100000

Supported LBA Sizes (NSID 0x1)
Id Fmt  Data  Metadt  Rel_Perf
 0 +     512       0         0

=== START OF SMART DATA SECTION ===
SMART overall-health self-assessment test result: PASSED

SMART/Health Information (NVMe Log 0x02)
Critical Warning:                   0x00
Temperature:                        40 Celsius
Available Spare:                    100%
Available Spare Threshold:          32%
Percentage Used:                    6%
Data Units Read:                    152,815,874 [78.2 TB]
Data Units Written:                 164,419,784 [84.1 TB]
Host Read Commands:                 1,536,697,119
Host Write Commands:                1,165,720,987
Controller Busy Time:               0
Power Cycles:                       3,033
Power On Hours:                     4,831
Unsafe Shutdowns:                   129
Media and Data Integrity Errors:    0
Error Information Log Entries:      279
Warning  Comp. Temperature Time:    0
Critical Comp. Temperature Time:    0

Error Information (NVMe Log 0x01, 8 of 8 entries)
No Errors Logged

Self-tests not supported

