=== START OF INFORMATION SECTION ===
Model Family:     Hitachi Deskstar 7K160
Device Model:     Hitachi HDS721680PLA380
Serial Number:    --
LU WWN Device Id: 5 000cca ...
Firmware Version: P21OABEA
User Capacity:    80 025 280 000 bytes [80,0 GB]
Sector Size:      512 bytes logical/physical
Device is:        In smartctl database [for details use: -P show]
ATA Version is:   ATA/ATAPI-7 T13/1532D revision 1
Local Time is:    Mon Mar 28 12:19:46 2016 YEKT
SMART support is: Available - device has SMART capability.
SMART support is: Enabled
AAM feature is:   Disabled
APM feature is:   Disabled
Rd look-ahead is: Enabled
Write cache is:   Enabled
ATA Security is:  Disabled, NOT FROZEN [SEC1]
Wt Cache Reorder: Enabled

=== START OF READ SMART DATA SECTION ===
SMART overall-health self-assessment test result: PASSED

General SMART Values:
Offline data collection status:  (0x80)	Offline data collection activity
					was never started.
					Auto Offline Data Collection: Enabled.
Self-test execution status:      (   0)	The previous self-test routine completed
					without error or no self-test has ever 
					been run.
Total time to complete Offline 
data collection: 		( 1445) seconds.
Offline data collection
capabilities: 			 (0x5b) SMART execute Offline immediate.
					Auto Offline data collection on/off support.
					Suspend Offline collection upon new
					command.
					Offline surface scan supported.
					Self-test supported.
					No Conveyance Self-test supported.
					Selective Self-test supported.
SMART capabilities:            (0x0003)	Saves SMART data before entering
					power-saving mode.
					Supports SMART auto save timer.
Error logging capability:        (0x01)	Error logging supported.
					General Purpose Logging supported.
Short self-test routine 
recommended polling time: 	 (   1) minutes.
Extended self-test routine
recommended polling time: 	 (  24) minutes.
SCT capabilities: 	       (0x003f)	SCT Status supported.
					SCT Error Recovery Control supported.
					SCT Feature Control supported.
					SCT Data Table supported.

SMART Attributes Data Structure revision number: 16
Vendor Specific SMART Attributes with Thresholds:
ID# ATTRIBUTE_NAME          FLAGS    VALUE WORST THRESH FAIL RAW_VALUE
  1 Raw_Read_Error_Rate     PO-R--   099   099   016    -    196608
  2 Throughput_Performance  P-S---   100   100   050    -    0
  3 Spin_Up_Time            POS---   125   125   024    -    160 (Average 160)
  4 Start_Stop_Count        -O--C-   100   100   000    -    3634
  5 Reallocated_Sector_Ct   PO--CK   095   095   005    -    248
  7 Seek_Error_Rate         PO-R--   100   100   067    -    0
  8 Seek_Time_Performance   P-S---   100   100   020    -    0
  9 Power_On_Hours          -O--C-   099   099   000    -    9146
 10 Spin_Retry_Count        PO--C-   100   100   060    -    0
 12 Power_Cycle_Count       -O--CK   100   100   000    -    3503
192 Power-Off_Retract_Count -O--CK   097   097   000    -    3739
193 Load_Cycle_Count        -O--C-   097   097   000    -    3739
194 Temperature_Celsius     -O----   153   153   000    -    39 (Min/Max 10/58)
196 Reallocated_Event_Count -O--CK   093   093   000    -    287
197 Current_Pending_Sector  -O---K   100   100   000    -    0
198 Offline_Uncorrectable   ---R--   100   100   000    -    0
199 UDMA_CRC_Error_Count    -O-R--   200   253   000    -    12
                            ||||||_ K auto-keep
                            |||||__ C event count
                            ||||___ R error rate
                            |||____ S speed/performance
                            ||_____ O updated online
                            |______ P prefailure warning

General Purpose Log Directory Version 1
SMART           Log Directory Version 1 [multi-sector log support]
Address    Access  R/W   Size  Description
0x00       GPL,SL  R/O      1  Log Directory
0x01           SL  R/O      1  Summary SMART error log
0x03       GPL     R/O      1  Ext. Comprehensive SMART error log
0x06           SL  R/O      1  SMART self-test log
0x07       GPL     R/O      1  Extended self-test log
0x09           SL  R/W      1  Selective self-test log
0x10       GPL     R/O      1  NCQ Command Error log
0x11       GPL     R/O      1  SATA Phy Event Counters
0x20       GPL     R/O      1  Streaming performance log [OBS-8]
0x21       GPL     R/O      1  Write stream error log
0x22       GPL     R/O      1  Read stream error log
0x80-0x9f  GPL,SL  R/W     16  Host vendor specific log
0xe0       GPL,SL  R/W      1  SCT Command/Status
0xe1       GPL,SL  R/W      1  SCT Data Transfer

SMART Extended Comprehensive Error Log Version: 1 (1 sectors)
Device Error Count: 70 (device log contains only the most recent 4 errors)
	CR     = Command Register
	FEATR  = Features Register
	COUNT  = Count (was: Sector Count) Register
	LBA_48 = Upper bytes of LBA High/Mid/Low Registers ]  ATA-8
	LH     = LBA High (was: Cylinder High) Register    ]   LBA
	LM     = LBA Mid (was: Cylinder Low) Register      ] Register
	LL     = LBA Low (was: Sector Number) Register     ]
	DV     = Device (was: Device/Head) Register
	DC     = Device Control Register
	ER     = Error register
	ST     = Status register
Powered_Up_Time is measured from power on, and printed as
DDd+hh:mm:SS.sss where DD=days, hh=hours, mm=minutes,
SS=sec, and sss=millisec. It "wraps" after 49.710 days.

Error 70 [1] occurred at disk power-on lifetime: 8172 hours (340 days + 12 hours)
  When the command that caused the error occurred, the device was active or idle.

  After command completion occurred, registers were:
  ER -- ST COUNT  LBA_48  LH LM LL DV DC
  -- -- -- == -- == == == -- -- -- -- --
  40 -- 51 00 80 16 18 00 16 18 67 e0 00  Error: UNC 128 sectors at LBA = 0x161800161867 = 24292336474215

  Commands leading to the command that caused the error were:
  CR FEATR COUNT  LBA_48  LH LM LL DV DC  Powered_Up_Time  Command/Feature_Name
  -- == -- == -- == == == -- -- -- -- --  ---------------  --------------------
  c8 00 00 00 80 16 18 61 16 18 67 e0 00     01:54:08.800  READ DMA
  c8 00 00 00 0b 60 49 96 16 18 57 e0 00     01:54:08.800  READ DMA
  c8 00 00 00 08 16 13 a8 60 49 8f e0 00     01:54:08.800  READ DMA
  c8 00 00 00 02 ba 8e 66 16 13 a7 e0 00     01:54:08.800  READ DMA
  c8 00 00 00 08 ba 6a d6 ba 8e 5f e0 00     01:54:08.800  READ DMA

Error 69 [0] occurred at disk power-on lifetime: 8144 hours (339 days + 8 hours)
  When the command that caused the error occurred, the device was active or idle.

  After command completion occurred, registers were:
  ER -- ST COUNT  LBA_48  LH LM LL DV DC
  -- -- -- == -- == == == -- -- -- -- --
  40 -- 51 00 40 00 00 00 1e 97 17 e0 00  Error: UNC 64 sectors at LBA = 0x001e9717 = 2004759

  Commands leading to the command that caused the error were:
  CR FEATR COUNT  LBA_48  LH LM LL DV DC  Powered_Up_Time  Command/Feature_Name
  -- == -- == -- == == == -- -- -- -- --  ---------------  --------------------
  c8 00 00 00 40 00 00 00 1e 97 17 e0 00     00:17:41.400  READ DMA
  c8 00 00 00 01 4d ca 38 00 00 00 e0 00     00:17:41.400  READ DMA
  c8 00 00 00 08 46 eb 2e 4d ca 31 e2 00     00:17:41.400  READ DMA
  ca 00 00 00 08 fc 49 e6 46 eb 27 e2 00     00:17:41.400  WRITE DMA
  c8 00 00 00 08 60 34 86 fc 49 df e1 00     00:17:41.400  READ DMA

Error 68 [3] occurred at disk power-on lifetime: 8144 hours (339 days + 8 hours)
  When the command that caused the error occurred, the device was active or idle.

  After command completion occurred, registers were:
  ER -- ST COUNT  LBA_48  LH LM LL DV DC
  -- -- -- == -- == == == -- -- -- -- --
  40 -- 51 00 40 66 71 00 1e 97 17 e0 00  Error: UNC 64 sectors at LBA = 0x6671001e9717 = 112635519342359

  Commands leading to the command that caused the error were:
  CR FEATR COUNT  LBA_48  LH LM LL DV DC  Powered_Up_Time  Command/Feature_Name
  -- == -- == -- == == == -- -- -- -- --  ---------------  --------------------
  c8 00 00 00 40 66 71 d8 1e 97 17 e0 00     00:17:36.700  READ DMA
  c8 00 00 00 40 4d 02 d8 66 71 99 e2 00     00:17:36.600  READ DMA
  c8 00 00 00 40 46 eb 2e 4d 02 99 e2 00     00:17:36.600  READ DMA
  ca 00 00 00 08 fb f6 ce 46 eb 27 e2 00     00:17:36.600  WRITE DMA
  c8 00 00 00 08 fb e5 26 fb f6 c7 e1 00     00:17:36.600  READ DMA

Error 67 [2] occurred at disk power-on lifetime: 8144 hours (339 days + 8 hours)
  When the command that caused the error occurred, the device was active or idle.

  After command completion occurred, registers were:
  ER -- ST COUNT  LBA_48  LH LM LL DV DC
  -- -- -- == -- == == == -- -- -- -- --
  40 -- 51 00 40 00 00 00 1e 97 17 e0 00  Error: UNC 64 sectors at LBA = 0x001e9717 = 2004759

  Commands leading to the command that caused the error were:
  CR FEATR COUNT  LBA_48  LH LM LL DV DC  Powered_Up_Time  Command/Feature_Name
  -- == -- == -- == == == -- -- -- -- --  ---------------  --------------------
  c8 00 00 00 40 00 00 00 1e 97 17 e0 00     00:17:31.900  READ DMA
  c8 00 00 00 01 46 eb 2e 00 00 00 e0 00     00:17:31.900  READ DMA
  ca 00 00 00 08 44 ba 76 46 eb 27 e2 00     00:17:31.900  WRITE DMA
  ca 00 00 00 08 fb fb 86 44 ba 6f e2 00     00:17:31.900  WRITE DMA
  c8 00 00 00 08 5e 00 46 fb fb 7f e1 00     00:17:31.900  READ DMA

SMART Extended Self-test Log Version: 1 (1 sectors)
No self-tests have been logged.  [To run self-tests, use: smartctl -t]

SMART Selective self-test log data structure revision number 1
 SPAN  MIN_LBA  MAX_LBA  CURRENT_TEST_STATUS
    1        0        0  Not_testing
    2        0        0  Not_testing
    3        0        0  Not_testing
    4        0        0  Not_testing
    5        0        0  Not_testing
Selective self-test flags (0x0):
  After scanning selected spans, do NOT read-scan remainder of disk.
If Selective self-test is pending on power-up, resume after 0 minute delay.

SCT Status Version:                  2
SCT Version (vendor specific):       256 (0x0100)
SCT Support Level:                   1
Device State:                        Active (0)
Current Temperature:                 39 Celsius
Power Cycle Max Temperature:         41 Celsius
Lifetime    Max Temperature:         58 Celsius

SCT Temperature History Version:     2
Temperature Sampling Period:         1 minute
Temperature Logging Interval:        1 minute
Min/Max recommended Temperature:      5/60 Celsius
Min/Max Temperature Limit:           -40/65 Celsius
Temperature History Size (Index):    128 (125)

SCT Error Recovery Control:
           Read: Disabled
          Write: Disabled

Device Statistics (GP Log 0x04) not supported

SATA Phy Event Counters (GP Log 0x11)
ID      Size     Value  Description
0x0001  2            0  Command failed due to ICRC error
0x0009  2            5  Transition from drive PhyRdy to drive PhyNRdy
0x000a  2            6  Device-to-host register FISes sent due to a COMRESET
0x000b  2            0  CRC errors within host-to-device FIS
0x000d  2            0  Non-CRC errors within host-to-device FIS



