smartctl 7.3 2022-02-28 r5338 [x86_64-linux-6.1.1-desktop-1omv2290] (OpenMandriva Lx 7.3-2)
Copyright (C) 2002-22, Bruce Allen, Christian Franke, www.smartmontools.org

=== START OF INFORMATION SECTION ===
Model Family:     Fujitsu MHZ BH
Device Model:     FUJITSU MHZ2250BH G2
Serial Number:    --
LU WWN Device Id: 5 00000e ...
Firmware Version: 00000009
User Capacity:    250,058,268,160 bytes [250 GB]
Sector Size:      512 bytes logical/physical
Device is:        In smartctl database
ATA Version is:   ATA8-ACS T13/1699-D revision 3f
SATA Version is:  SATA 2.5, 3.0 Gb/s
Local Time is:    Tue Mar 14 22:24:08 2023 CET
SMART support is: Available - device has SMART capability.
SMART support is: Enabled
AAM feature is:   Disabled
APM level is:     128 (minimum power consumption without standby)
Rd look-ahead is: Enabled
Write cache is:   Enabled
DSN feature is:   Unavailable
ATA Security is:  Disabled, frozen [SEC2]
Wt Cache Reorder: Enabled

=== START OF READ SMART DATA SECTION ===
SMART overall-health self-assessment test result: PASSED

General SMART Values:
Offline data collection status:  (0x80)	Offline data collection activity
					was never started.
					Auto Offline Data Collection: Enabled.
Self-test execution status:      (   0)	The previous self-test routine completed
					without error or no self-test has ever 
					been run.
Total time to complete Offline 
data collection: 		( 1009) seconds.
Offline data collection
capabilities: 			 (0x7b) SMART execute Offline immediate.
					Auto Offline data collection on/off support.
					Suspend Offline collection upon new
					command.
					Offline surface scan supported.
					Self-test supported.
					Conveyance Self-test supported.
					Selective Self-test supported.
SMART capabilities:            (0x0003)	Saves SMART data before entering
					power-saving mode.
					Supports SMART auto save timer.
Error logging capability:        (0x01)	Error logging supported.
					General Purpose Logging supported.
Short self-test routine 
recommended polling time: 	 (   2) minutes.
Extended self-test routine
recommended polling time: 	 ( 143) minutes.
Conveyance self-test routine
recommended polling time: 	 (   2) minutes.
SCT capabilities: 	       (0x003d)	SCT Status supported.
					SCT Error Recovery Control supported.
					SCT Feature Control supported.
					SCT Data Table supported.

SMART Attributes Data Structure revision number: 16
Vendor Specific SMART Attributes with Thresholds:
ID# ATTRIBUTE_NAME          FLAGS    VALUE WORST THRESH FAIL RAW_VALUE
  1 Raw_Read_Error_Rate     POSR--   100   100   046    -    199105
  2 Throughput_Performance  P-S---   100   100   030    -    41222772
  3 Spin_Up_Time            PO----   100   100   025    -    1
  4 Start_Stop_Count        -O--CK   099   099   000    -    890
  5 Reallocated_Sector_Ct   PO--CK   100   100   024    -    0 (2000 0)
  7 Seek_Error_Rate         POSR--   100   100   047    -    3106
  8 Seek_Time_Performance   P-S---   100   100   019    -    0
  9 Power_On_Hours          -O--CK   081   081   000    -    9839
 10 Spin_Retry_Count        PO--C-   100   100   020    -    0
 12 Power_Cycle_Count       -O--CK   100   100   000    -    867
192 Power-Off_Retract_Count -O--CK   099   099   000    -    359
193 Load_Cycle_Count        -O--CK   091   091   000    -    189611
194 Temperature_Celsius     -O---K   100   100   000    -    29 (Min/Max 8/50)
195 Hardware_ECC_Recovered  -O-RC-   100   100   000    -    47
196 Reallocated_Event_Count -O--CK   100   100   000    -    0 (0 6524)
197 Current_Pending_Sector  -O--C-   100   100   000    -    0
198 Offline_Uncorrectable   ----C-   100   100   000    -    0
199 UDMA_CRC_Error_Count    -OSRCK   200   253   000    -    504
200 Multi_Zone_Error_Rate   POSR--   100   100   060    -    4766
203 Run_Out_Cancel          -O----   100   100   000    -    2628564155395
240 Head_Flying_Hours       -OSRCK   200   200   000    -    0
                            ||||||_ K auto-keep
                            |||||__ C event count
                            ||||___ R error rate
                            |||____ S speed/performance
                            ||_____ O updated online
                            |______ P prefailure warning

General Purpose Log Directory Version 1
SMART           Log Directory Version 1 [multi-sector log support]
Address    Access  R/W   Size  Description
0x00       GPL,SL  R/O      1  Log Directory
0x01       GPL,SL  R/O      1  Summary SMART error log
0x02       GPL,SL  R/O     51  Comprehensive SMART error log
0x03       GPL,SL  R/O     64  Ext. Comprehensive SMART error log
0x06       GPL,SL  R/O      1  SMART self-test log
0x07       GPL,SL  R/O      2  Extended self-test log
0x09       GPL,SL  R/W      1  Selective self-test log
0x10       GPL,SL  R/O      1  NCQ Command Error log
0x11       GPL,SL  R/O      1  SATA Phy Event Counters log
0x23       GPL,SL  R/O      1  Delayed sector log [OBS-8]
0x80-0x9f  GPL,SL  R/W     16  Host vendor specific log
0xa1       GPL,SL  VS       1  Device vendor specific log

SMART Extended Comprehensive Error Log Version: 1 (64 sectors)
Device Error Count: 501 (device log contains only the most recent 256 errors)
	CR     = Command Register
	FEATR  = Features Register
	COUNT  = Count (was: Sector Count) Register
	LBA_48 = Upper bytes of LBA High/Mid/Low Registers ]  ATA-8
	LH     = LBA High (was: Cylinder High) Register    ]   LBA
	LM     = LBA Mid (was: Cylinder Low) Register      ] Register
	LL     = LBA Low (was: Sector Number) Register     ]
	DV     = Device (was: Device/Head) Register
	DC     = Device Control Register
	ER     = Error register
	ST     = Status register
Powered_Up_Time is measured from power on, and printed as
DDd+hh:mm:SS.sss where DD=days, hh=hours, mm=minutes,
SS=sec, and sss=millisec. It "wraps" after 49.710 days.

Error 501 [244] occurred at disk power-on lifetime: 9764 hours (406 days + 20 hours)
  When the command that caused the error occurred, the device was active or idle.

  After command completion occurred, registers were:
  ER -- ST COUNT  LBA_48  LH LM LL DV DC
  -- -- -- == -- == == == -- -- -- -- --
  84 -- 51 00 06 00 00 50 00 1c 82 e0 00  Error: ICRC, ABRT 6 sectors at LBA = 0x50001c82 = 1342184578

  Commands leading to the command that caused the error were:
  CR FEATR COUNT  LBA_48  LH LM LL DV DC  Powered_Up_Time  Command/Feature_Name
  -- == -- == -- == == == -- -- -- -- --  ---------------  --------------------
  25 00 00 00 08 00 1d 50 00 1c 80 e0 08     03:08:20.944  READ DMA EXT
  ec 00 00 00 01 00 00 00 00 00 00 00 08     03:08:20.925  IDENTIFY DEVICE
  c8 00 00 00 20 00 00 00 00 00 00 e0 08     03:08:16.360  READ DMA
  c8 00 00 00 08 00 05 40 00 e6 00 e0 08     03:08:16.333  READ DMA
  c8 00 00 00 07 00 05 40 00 69 01 e0 08     03:08:16.266  READ DMA

Error 500 [243] occurred at disk power-on lifetime: 9763 hours (406 days + 19 hours)
  When the command that caused the error occurred, the device was active or idle.

  After command completion occurred, registers were:
  ER -- ST COUNT  LBA_48  LH LM LL DV DC
  -- -- -- == -- == == == -- -- -- -- --
  84 -- 51 00 cd 00 00 3e 00 1c 2b e0 00  Error: ICRC, ABRT 205 sectors at LBA = 0x3e001c2b = 1040194603

  Commands leading to the command that caused the error were:
  CR FEATR COUNT  LBA_48  LH LM LL DV DC  Powered_Up_Time  Command/Feature_Name
  -- == -- == -- == == == -- -- -- -- --  ---------------  --------------------
  25 00 00 00 f8 00 1d 3e 00 1c 00 e0 08     02:09:07.270  READ DMA EXT
  25 00 00 02 00 00 1d 3c 00 1c 00 e0 08     02:09:07.255  READ DMA EXT
  25 00 00 02 00 00 05 4a 00 e6 00 e0 08     02:09:07.251  READ DMA EXT
  25 00 00 01 80 00 05 48 00 e6 80 e0 08     02:09:07.244  READ DMA EXT
  c8 00 00 00 38 00 05 48 00 e6 40 e0 08     02:09:07.240  READ DMA

Error 499 [242] occurred at disk power-on lifetime: 9763 hours (406 days + 19 hours)
  When the command that caused the error occurred, the device was active or idle.

  After command completion occurred, registers were:
  ER -- ST COUNT  LBA_48  LH LM LL DV DC
  -- -- -- == -- == == == -- -- -- -- --
  84 -- 51 00 5d 00 00 3f 00 1c 93 e0 00  Error: ICRC, ABRT 93 sectors at LBA = 0x3f001c93 = 1056971923

  Commands leading to the command that caused the error were:
  CR FEATR COUNT  LBA_48  LH LM LL DV DC  Powered_Up_Time  Command/Feature_Name
  -- == -- == -- == == == -- -- -- -- --  ---------------  --------------------
  25 00 00 00 68 00 1d 3f 00 1c 88 e0 08     02:09:06.194  READ DMA EXT
  25 00 00 00 80 00 1d 3f 00 1c 00 e0 08     02:09:06.194  READ DMA EXT
  25 00 00 00 f8 00 1d 3e 00 1c 00 e0 08     02:09:06.189  READ DMA EXT
  c8 00 00 00 08 00 05 48 00 69 78 e0 08     02:09:06.188  READ DMA
  c8 00 00 00 08 00 05 48 00 69 38 e0 08     02:09:06.173  READ DMA

Error 498 [241] occurred at disk power-on lifetime: 9763 hours (406 days + 19 hours)
  When the command that caused the error occurred, the device was active or idle.

  After command completion occurred, registers were:
  ER -- ST COUNT  LBA_48  LH LM LL DV DC
  -- -- -- == -- == == == -- -- -- -- --
  84 -- 51 00 31 00 00 08 00 00 47 e0 00  Error: ICRC, ABRT 49 sectors at LBA = 0x08000047 = 134217799

  Commands leading to the command that caused the error were:
  CR FEATR COUNT  LBA_48  LH LM LL DV DC  Powered_Up_Time  Command/Feature_Name
  -- == -- == -- == == == -- -- -- -- --  ---------------  --------------------
  c8 00 00 00 38 00 00 08 00 00 40 e0 08     02:08:55.274  READ DMA
  c8 00 00 00 18 00 00 08 00 00 20 e0 08     02:08:55.267  READ DMA
  c8 00 00 00 08 00 00 08 00 00 10 e0 08     02:08:55.267  READ DMA
  25 00 00 00 08 00 1d 3f 00 1c f0 e0 08     02:08:55.266  READ DMA EXT
  c8 00 00 00 08 00 00 08 00 00 78 e0 08     02:08:55.255  READ DMA

Error 497 [240] occurred at disk power-on lifetime: 9763 hours (406 days + 19 hours)
  When the command that caused the error occurred, the device was active or idle.

  After command completion occurred, registers were:
  ER -- ST COUNT  LBA_48  LH LM LL DV DC
  -- -- -- == -- == == == -- -- -- -- --
  84 -- 51 00 af 00 00 4e 00 1c f1 e0 00  Error: ICRC, ABRT 175 sectors at LBA = 0x4e001cf1 = 1308630257

  Commands leading to the command that caused the error were:
  CR FEATR COUNT  LBA_48  LH LM LL DV DC  Powered_Up_Time  Command/Feature_Name
  -- == -- == -- == == == -- -- -- -- --  ---------------  --------------------
  25 00 00 00 b8 00 1d 4e 00 1c e8 e0 08     02:08:37.234  READ DMA EXT
  25 00 00 00 50 00 1d 4e 00 1c 90 e0 08     02:08:37.234  READ DMA EXT
  25 00 00 00 30 00 1d 4e 00 1c 58 e0 08     02:08:37.234  READ DMA EXT
  25 00 00 00 50 00 1d 4e 00 1c 00 e0 08     02:08:37.233  READ DMA EXT
  25 00 00 00 58 00 1d 4d 00 1c a8 e0 08     02:08:37.230  READ DMA EXT

Error 496 [239] occurred at disk power-on lifetime: 9763 hours (406 days + 19 hours)
  When the command that caused the error occurred, the device was active or idle.

  After command completion occurred, registers were:
  ER -- ST COUNT  LBA_48  LH LM LL DV DC
  -- -- -- == -- == == == -- -- -- -- --
  84 -- 51 00 36 00 00 00 00 00 42 e0 00  Error: ICRC, ABRT 54 sectors at LBA = 0x00000042 = 66

  Commands leading to the command that caused the error were:
  CR FEATR COUNT  LBA_48  LH LM LL DV DC  Powered_Up_Time  Command/Feature_Name
  -- == -- == -- == == == -- -- -- -- --  ---------------  --------------------
  c8 00 00 00 38 00 00 00 00 00 40 e0 08     02:08:05.530  READ DMA
  c8 00 00 00 18 00 00 00 00 00 20 e0 08     02:08:05.523  READ DMA
  c8 00 00 00 08 00 00 00 00 00 10 e0 08     02:08:05.523  READ DMA
  c8 00 00 00 08 00 00 00 00 00 78 e0 08     02:08:05.512  READ DMA
  c8 00 00 00 08 00 00 00 00 00 38 e0 08     02:08:05.512  READ DMA

Error 495 [238] occurred at disk power-on lifetime: 9763 hours (406 days + 19 hours)
  When the command that caused the error occurred, the device was active or idle.

  After command completion occurred, registers were:
  ER -- ST COUNT  LBA_48  LH LM LL DV DC
  -- -- -- == -- == == == -- -- -- -- --
  84 -- 51 00 40 00 00 01 00 00 c0 e0 00  Error: ICRC, ABRT 64 sectors at LBA = 0x010000c0 = 16777408

  Commands leading to the command that caused the error were:
  CR FEATR COUNT  LBA_48  LH LM LL DV DC  Powered_Up_Time  Command/Feature_Name
  -- == -- == -- == == == -- -- -- -- --  ---------------  --------------------
  25 00 00 01 80 00 00 00 00 00 80 e0 08     02:06:41.344  READ DMA EXT
  c8 00 00 00 38 00 00 00 00 00 40 e0 08     02:06:41.330  READ DMA
  c8 00 00 00 18 00 00 00 00 00 20 e0 08     02:06:41.329  READ DMA
  c8 00 00 00 08 00 00 00 00 00 10 e0 08     02:06:41.329  READ DMA
  c8 00 00 00 08 00 00 00 00 00 78 e0 08     02:06:41.273  READ DMA

Error 494 [237] occurred at disk power-on lifetime: 9763 hours (406 days + 19 hours)
  When the command that caused the error occurred, the device was active or idle.

  After command completion occurred, registers were:
  ER -- ST COUNT  LBA_48  LH LM LL DV DC
  -- -- -- == -- == == == -- -- -- -- --
  84 -- 51 00 06 00 00 3f 00 1c fa e0 00  Error: ICRC, ABRT 6 sectors at LBA = 0x3f001cfa = 1056972026

  Commands leading to the command that caused the error were:
  CR FEATR COUNT  LBA_48  LH LM LL DV DC  Powered_Up_Time  Command/Feature_Name
  -- == -- == -- == == == -- -- -- -- --  ---------------  --------------------
  25 00 00 00 08 00 1d 3f 00 1c f8 e0 08     02:04:06.609  READ DMA EXT
  c8 00 00 00 08 00 05 48 00 e6 00 e0 08     02:04:06.608  READ DMA
  c8 00 00 00 08 00 05 48 00 e6 80 e0 08     02:04:06.601  READ DMA
  c8 00 00 00 08 00 05 48 00 69 10 e0 08     02:04:06.588  READ DMA
  c8 00 00 00 08 00 05 48 00 69 40 e0 08     02:04:06.502  READ DMA

SMART Extended Self-test Log Version: 1 (2 sectors)
Num  Test_Description    Status                  Remaining  LifeTime(hours)  LBA_of_first_error
# 1  Short offline       Completed without error       00%      9540         -

SMART Selective self-test log data structure revision number 1
 SPAN  MIN_LBA  MAX_LBA  CURRENT_TEST_STATUS
    1        0        0  Not_testing
    2        0        0  Not_testing
    3        0        0  Not_testing
    4        0        0  Not_testing
    5        0        0  Not_testing
Selective self-test flags (0x0):
  After scanning selected spans, do NOT read-scan remainder of disk.
If Selective self-test is pending on power-up, resume after 0 minute delay.

SCT Status Version:                  2
SCT Version (vendor specific):       0 (0x0000)
Device State:                        Active (0)
Current Temperature:                    29 Celsius
Power Cycle Min/Max Temperature:     16/31 Celsius
Lifetime    Min/Max Temperature:      8/50 Celsius
Under/Over Temperature Limit Count:   0/0

SCT Temperature History Version:     2
Temperature Sampling Period:         1 minute
Temperature Logging Interval:        1 minute
Min/Max recommended Temperature:      5/60 Celsius
Min/Max Temperature Limit:           -40/65 Celsius
Temperature History Size (Index):    478 (383)

SCT Error Recovery Control:
           Read: Disabled
          Write: Disabled

Device Statistics (GP/SMART Log 0x04) not supported

Pending Defects log (GP Log 0x0c) not supported

SATA Phy Event Counters (GP Log 0x11)
ID      Size     Value  Description
0x0001  4            0  Command failed due to ICRC error
0x0002  4            0  R_ERR response for data FIS
0x0003  4            0  R_ERR response for device-to-host data FIS
0x0004  4            0  R_ERR response for host-to-device data FIS
0x0005  4            0  R_ERR response for non-data FIS
0x0006  4            0  R_ERR response for device-to-host non-data FIS
0x0008  4            0  Device-to-host non-data FIS retries
0x0009  4           28  Transition from drive PhyRdy to drive PhyNRdy
0x000a  4           27  Device-to-host register FISes sent due to a COMRESET
0x000b  4            0  CRC errors within host-to-device FIS
0x000d  4            0  Non-CRC errors within host-to-device FIS
0x000f  4            0  R_ERR response for host-to-device data FIS, CRC
0x0010  4            0  R_ERR response for host-to-device data FIS, non-CRC



