=== START OF INFORMATION SECTION ===
Model Number:                       SAMSUNG MZALQ256HAJD-000L2
Serial Number:                      --
Firmware Version:                   3L1QFXV7
PCI Vendor/Subsystem ID:            0x144d
IEEE OUI Identifier:                0x002538
Total NVM Capacity:                 256,060,514,304 [256 GB]
Unallocated NVM Capacity:           0
Controller ID:                      5
Number of Namespaces:               1
Namespace 1 Size/Capacity:          256,060,514,304 [256 GB]
Namespace 1 Utilization:            34,046,976,000 [34.0 GB]
Namespace 1 Formatted LBA Size:     512
Namespace 1 IEEE EUI-64:            002538 ...
Local Time is:                      Fri Jul 22 09:37:57 2022 +05
Firmware Updates (0x16):            3 Slots, no Reset required
Optional Admin Commands (0x0017):   Security Format Frmw_DL Self_Test
Optional NVM Commands (0x005f):     Comp Wr_Unc DS_Mngmt Wr_Zero Sav/Sel_Feat Timestmp
Maximum Data Transfer Size:         512 Pages
Warning  Comp. Temp. Threshold:     82 Celsius
Critical Comp. Temp. Threshold:     85 Celsius

Supported Power States
St Op     Max   Active     Idle   RL RT WL WT  Ent_Lat  Ex_Lat
 0 +     4.83W       -        -    0  0  0  0        0       0
 1 +     3.54W       -        -    1  1  1  1        0       0
 2 +     3.04W       -        -    2  2  2  2        0     500
 3 -   0.0500W       -        -    3  3  3  3      210    1200
 4 -   0.0050W       -        -    4  4  4  4     1000    9000

Supported LBA Sizes (NSID 0x1)
Id Fmt  Data  Metadt  Rel_Perf
 0 +     512       0         0

=== START OF SMART DATA SECTION ===
SMART overall-health self-assessment test result: PASSED

SMART/Health Information (NVMe Log 0x02)
Critical Warning:                   0x00
Temperature:                        15 Celsius
Available Spare:                    100%
Available Spare Threshold:          10%
Percentage Used:                    2%
Data Units Read:                    8,662,604 [4.43 TB]
Data Units Written:                 9,963,033 [5.10 TB]
Host Read Commands:                 128,318,251
Host Write Commands:                198,337,429
Controller Busy Time:               1,249
Power Cycles:                       552
Power On Hours:                     1,123
Unsafe Shutdowns:                   54
Media and Data Integrity Errors:    0
Error Information Log Entries:      230
Warning  Comp. Temperature Time:    0
Critical Comp. Temperature Time:    0
Temperature Sensor 1:               15 Celsius

Error Information (NVMe Log 0x01, max 64 entries)
Num   ErrCount  SQId   CmdId  Status  PELoc          LBA  NSID    VS
  0        230     0  0x1018  0x4004      -            0     0     -

