smartctl 7.2 2020-12-30 r5155 [x86_64-linux-5.11.0-7620-generic] (local build)
Copyright (C) 2002-20, Bruce Allen, Christian Franke, www.smartmontools.org

=== START OF INFORMATION SECTION ===
Model Number:                       SAMSUNG MZALQ256HAJD-000L2
Serial Number:                      --
Firmware Version:                   3L1QFXV7
PCI Vendor/Subsystem ID:            0x144d
IEEE OUI Identifier:                0x002538
Total NVM Capacity:                 256,060,514,304 [256 GB]
Unallocated NVM Capacity:           0
Controller ID:                      5
NVMe Version:                       1.3
Number of Namespaces:               1
Namespace 1 Size/Capacity:          256,060,514,304 [256 GB]
Namespace 1 Utilization:            116,333,948,928 [116 GB]
Namespace 1 Formatted LBA Size:     512
Namespace 1 IEEE EUI-64:            002538 ...
Local Time is:                      Tue Aug 17 19:19:55 2021 CEST
Firmware Updates (0x16):            3 Slots, no Reset required
Optional Admin Commands (0x0017):   Security Format Frmw_DL Self_Test
Optional NVM Commands (0x005f):     Comp Wr_Unc DS_Mngmt Wr_Zero Sav/Sel_Feat Timestmp
Log Page Attributes (0x0f):         S/H_per_NS Cmd_Eff_Lg Ext_Get_Lg Telmtry_Lg
Maximum Data Transfer Size:         512 Pages
Warning  Comp. Temp. Threshold:     82 Celsius
Critical Comp. Temp. Threshold:     85 Celsius

Supported Power States
St Op     Max   Active     Idle   RL RT WL WT  Ent_Lat  Ex_Lat
 0 +     4.83W       -        -    0  0  0  0        0       0
 1 +     3.54W       -        -    1  1  1  1        0       0
 2 +     3.04W       -        -    2  2  2  2        0     500
 3 -   0.0500W       -        -    3  3  3  3      210    1200
 4 -   0.0050W       -        -    4  4  4  4     1000    9000

Supported LBA Sizes (NSID 0x1)
Id Fmt  Data  Metadt  Rel_Perf
 0 +     512       0         0

=== START OF SMART DATA SECTION ===
SMART overall-health self-assessment test result: PASSED

SMART/Health Information (NVMe Log 0x02)
Critical Warning:                   0x00
Temperature:                        20 Celsius
Available Spare:                    100%
Available Spare Threshold:          10%
Percentage Used:                    8%
Data Units Read:                    128,288,045 [65.6 TB]
Data Units Written:                 48,816,775 [24.9 TB]
Host Read Commands:                 2,765,861,822
Host Write Commands:                271,176,035
Controller Busy Time:               7,974
Power Cycles:                       1,260
Power On Hours:                     2,081
Unsafe Shutdowns:                   46
Media and Data Integrity Errors:    0
Error Information Log Entries:      1,873
Warning  Comp. Temperature Time:    0
Critical Comp. Temperature Time:    0
Temperature Sensor 1:               20 Celsius

Error Information (NVMe Log 0x01, 16 of 64 entries)
No Errors Logged

