smartctl 7.4 2023-08-01 r5530 [x86_64-linux-6.14.2-desktop-3omv2590] (OpenMandriva Lx 7.4-1)
Copyright (C) 2002-23, Bruce Allen, Christian Franke, www.smartmontools.org

=== START OF INFORMATION SECTION ===
Model Family:     Toshiba 2.5" HDD MQ01ABF...
Device Model:     TOSHIBA MQ01ABF050
Serial Number:    --
LU WWN Device Id: 5 000039 ...
Firmware Version: AM0C1J
User Capacity:    500,107,862,016 bytes [500 GB]
Sector Sizes:     512 bytes logical, 4096 bytes physical
Rotation Rate:    5400 rpm
Form Factor:      2.5 inches
Device is:        In smartctl database
ATA Version is:   ATA8-ACS (minor revision not indicated)
SATA Version is:  SATA 3.0, 6.0 Gb/s (current: 6.0 Gb/s)
Local Time is:    Sun Oct  5 13:14:18 2025 -03
SMART support is: Available - device has SMART capability.
SMART support is: Enabled
AAM feature is:   Unavailable
APM level is:     1 (minimum power consumption with standby)
Rd look-ahead is: Enabled
Write cache is:   Enabled
DSN feature is:   Unavailable
ATA Security is:  Disabled, frozen [SEC2]
Wt Cache Reorder: Enabled

=== START OF READ SMART DATA SECTION ===
SMART overall-health self-assessment test result: PASSED

General SMART Values:
Offline data collection status:  (0x80)	Offline data collection activity
					was never started.
					Auto Offline Data Collection: Enabled.
Self-test execution status:      (   0)	The previous self-test routine completed
					without error or no self-test has ever 
					been run.
Total time to complete Offline 
data collection: 		(  120) seconds.
Offline data collection
capabilities: 			 (0x5b) SMART execute Offline immediate.
					Auto Offline data collection on/off support.
					Suspend Offline collection upon new
					command.
					Offline surface scan supported.
					Self-test supported.
					No Conveyance Self-test supported.
					Selective Self-test supported.
SMART capabilities:            (0x0003)	Saves SMART data before entering
					power-saving mode.
					Supports SMART auto save timer.
Error logging capability:        (0x01)	Error logging supported.
					General Purpose Logging supported.
Short self-test routine 
recommended polling time: 	 (   2) minutes.
Extended self-test routine
recommended polling time: 	 ( 120) minutes.
SCT capabilities: 	       (0x003d)	SCT Status supported.
					SCT Error Recovery Control supported.
					SCT Feature Control supported.
					SCT Data Table supported.

SMART Attributes Data Structure revision number: 16
Vendor Specific SMART Attributes with Thresholds:
ID# ATTRIBUTE_NAME          FLAGS    VALUE WORST THRESH FAIL RAW_VALUE
  1 Raw_Read_Error_Rate     PO-R--   100   100   050    -    0
  2 Throughput_Performance  P-S---   100   100   050    -    0
  3 Spin_Up_Time            POS--K   100   100   001    -    1376
  4 Start_Stop_Count        -O--CK   100   100   000    -    35409
  5 Reallocated_Sector_Ct   PO--CK   100   100   050    -    0
  7 Seek_Error_Rate         PO-R--   100   100   050    -    0
  8 Seek_Time_Performance   P-S---   100   100   050    -    0
  9 Power_On_Hours          -O--CK   086   086   000    -    5726
 10 Spin_Retry_Count        PO--CK   253   100   030    -    0
 12 Power_Cycle_Count       -O--CK   100   100   000    -    1936
191 G-Sense_Error_Rate      -O--CK   100   100   000    -    456
192 Power-Off_Retract_Count -O--CK   100   100   000    -    46
193 Load_Cycle_Count        -O--CK   094   094   000    -    62225
194 Temperature_Celsius     -O---K   100   100   000    -    34 (Min/Max 6/52)
196 Reallocated_Event_Count -O--CK   100   100   000    -    0
197 Current_Pending_Sector  -O--CK   100   100   000    -    0
198 Offline_Uncorrectable   ----CK   100   100   000    -    0
199 UDMA_CRC_Error_Count    -O--CK   200   200   000    -    21
220 Disk_Shift              -O----   100   100   000    -    0
222 Loaded_Hours            -O--CK   098   098   000    -    1028
223 Load_Retry_Count        -O--CK   100   100   000    -    0
224 Load_Friction           -O---K   100   100   000    -    0
226 Load-in_Time            -OS--K   100   100   000    -    177
240 Head_Flying_Hours       P-----   100   100   001    -    0
254 Free_Fall_Sensor        -O--CK   100   100   000    -    0
                            ||||||_ K auto-keep
                            |||||__ C event count
                            ||||___ R error rate
                            |||____ S speed/performance
                            ||_____ O updated online
                            |______ P prefailure warning

General Purpose Log Directory Version 1
SMART           Log Directory Version 1 [multi-sector log support]
Address    Access  R/W   Size  Description
0x00       GPL,SL  R/O      1  Log Directory
0x01           SL  R/O      1  Summary SMART error log
0x02           SL  R/O     51  Comprehensive SMART error log
0x03       GPL     R/O     64  Ext. Comprehensive SMART error log
0x04       GPL,SL  R/O      8  Device Statistics log
0x06           SL  R/O      1  SMART self-test log
0x07       GPL     R/O      1  Extended self-test log
0x09           SL  R/W      1  Selective self-test log
0x10       GPL     R/O      1  NCQ Command Error log
0x11       GPL     R/O      1  SATA Phy Event Counters log
0x80-0x9f  GPL,SL  R/W     16  Host vendor specific log
0xe0       GPL,SL  R/W      1  SCT Command/Status
0xe1       GPL,SL  R/W      1  SCT Data Transfer

SMART Extended Comprehensive Error Log Version: 1 (64 sectors)
Device Error Count: 21
	CR     = Command Register
	FEATR  = Features Register
	COUNT  = Count (was: Sector Count) Register
	LBA_48 = Upper bytes of LBA High/Mid/Low Registers ]  ATA-8
	LH     = LBA High (was: Cylinder High) Register    ]   LBA
	LM     = LBA Mid (was: Cylinder Low) Register      ] Register
	LL     = LBA Low (was: Sector Number) Register     ]
	DV     = Device (was: Device/Head) Register
	DC     = Device Control Register
	ER     = Error register
	ST     = Status register
Powered_Up_Time is measured from power on, and printed as
DDd+hh:mm:SS.sss where DD=days, hh=hours, mm=minutes,
SS=sec, and sss=millisec. It "wraps" after 49.710 days.

Error 21 [20] occurred at disk power-on lifetime: 4835 hours (201 days + 11 hours)
  When the command that caused the error occurred, the device was active or idle.

  After command completion occurred, registers were:
  ER -- ST COUNT  LBA_48  LH LM LL DV DC
  -- -- -- == -- == == == -- -- -- -- --
  84 -- 41 00 d8 00 00 02 3b a9 b7 40 00  Error: ICRC, ABRT at LBA = 0x023ba9b7 = 37464503

  Commands leading to the command that caused the error were:
  CR FEATR COUNT  LBA_48  LH LM LL DV DC  Powered_Up_Time  Command/Feature_Name
  -- == -- == -- == == == -- -- -- -- --  ---------------  --------------------
  60 00 80 00 e0 00 00 02 65 b3 68 40 00     00:00:09.267  READ FPDMA QUEUED
  60 00 58 00 d8 00 00 02 3b a9 60 40 00     00:00:09.263  READ FPDMA QUEUED
  60 00 80 00 d0 00 00 02 3b 05 28 40 00     00:00:09.220  READ FPDMA QUEUED
  60 00 70 00 c8 00 00 02 be d1 e0 40 00     00:00:09.209  READ FPDMA QUEUED
  60 00 80 00 c0 00 00 02 4c 97 80 40 00     00:00:09.205  READ FPDMA QUEUED

Error 20 [19] occurred at disk power-on lifetime: 4823 hours (200 days + 23 hours)
  When the command that caused the error occurred, the device was active or idle.

  After command completion occurred, registers were:
  ER -- ST COUNT  LBA_48  LH LM LL DV DC
  -- -- -- == -- == == == -- -- -- -- --
  84 -- 41 00 e0 00 00 02 d0 59 7f 40 00  Error: ICRC, ABRT at LBA = 0x02d0597f = 47208831

  Commands leading to the command that caused the error were:
  CR FEATR COUNT  LBA_48  LH LM LL DV DC  Powered_Up_Time  Command/Feature_Name
  -- == -- == -- == == == -- -- -- -- --  ---------------  --------------------
  60 00 80 00 e0 00 00 02 d0 59 00 40 00     04:50:27.361  READ FPDMA QUEUED
  60 00 80 00 d8 00 00 02 7c ce a8 40 00     04:50:27.354  READ FPDMA QUEUED
  60 00 80 00 d0 00 00 02 59 b5 90 40 00     04:50:27.345  READ FPDMA QUEUED
  60 00 80 00 c8 00 00 02 8e 75 80 40 00     04:50:27.333  READ FPDMA QUEUED
  60 00 80 00 c0 00 00 02 4b c8 00 40 00     04:50:27.215  READ FPDMA QUEUED

Error 19 [18] occurred at disk power-on lifetime: 4823 hours (200 days + 23 hours)
  When the command that caused the error occurred, the device was active or idle.

  After command completion occurred, registers were:
  ER -- ST COUNT  LBA_48  LH LM LL DV DC
  -- -- -- == -- == == == -- -- -- -- --
  84 -- 41 00 68 00 00 02 3c f3 df 40 00  Error: ICRC, ABRT at LBA = 0x023cf3df = 37549023

  Commands leading to the command that caused the error were:
  CR FEATR COUNT  LBA_48  LH LM LL DV DC  Powered_Up_Time  Command/Feature_Name
  -- == -- == -- == == == -- -- -- -- --  ---------------  --------------------
  60 00 80 00 68 00 00 02 3c f3 60 40 00     04:50:22.583  READ FPDMA QUEUED
  60 00 80 00 60 00 00 02 8f b1 18 40 00     04:50:22.577  READ FPDMA QUEUED
  60 00 80 00 58 00 00 02 54 5b 68 40 00     04:50:22.573  READ FPDMA QUEUED
  60 00 80 00 50 00 00 02 c8 90 80 40 00     04:50:22.566  READ FPDMA QUEUED
  60 00 80 00 48 00 00 02 7e 89 40 40 00     04:50:22.557  READ FPDMA QUEUED

Error 18 [17] occurred at disk power-on lifetime: 4818 hours (200 days + 18 hours)
  When the command that caused the error occurred, the device was active or idle.

  After command completion occurred, registers were:
  ER -- ST COUNT  LBA_48  LH LM LL DV DC
  -- -- -- == -- == == == -- -- -- -- --
  84 -- 41 00 28 00 00 02 79 7b af 40 00  Error: ICRC, ABRT at LBA = 0x02797baf = 41515951

  Commands leading to the command that caused the error were:
  CR FEATR COUNT  LBA_48  LH LM LL DV DC  Powered_Up_Time  Command/Feature_Name
  -- == -- == -- == == == -- -- -- -- --  ---------------  --------------------
  60 00 80 00 38 00 00 02 4a 80 e0 40 00     00:00:36.109  READ FPDMA QUEUED
  60 00 08 00 30 00 00 02 d6 c9 b8 40 00     00:00:36.085  READ FPDMA QUEUED
  60 00 80 00 28 00 00 02 79 7b 30 40 00     00:00:36.078  READ FPDMA QUEUED
  60 00 80 00 20 00 00 02 d1 ce 80 40 00     00:00:36.077  READ FPDMA QUEUED
  60 00 80 00 18 00 00 02 a0 72 00 40 00     00:00:32.202  READ FPDMA QUEUED

Error 17 [16] occurred at disk power-on lifetime: 4809 hours (200 days + 9 hours)
  When the command that caused the error occurred, the device was active or idle.

  After command completion occurred, registers were:
  ER -- ST COUNT  LBA_48  LH LM LL DV DC
  -- -- -- == -- == == == -- -- -- -- --
  84 -- 41 00 80 00 00 02 3f 1a bf 40 00  Error: ICRC, ABRT at LBA = 0x023f1abf = 37690047

  Commands leading to the command that caused the error were:
  CR FEATR COUNT  LBA_48  LH LM LL DV DC  Powered_Up_Time  Command/Feature_Name
  -- == -- == -- == == == -- -- -- -- --  ---------------  --------------------
  60 00 08 00 80 00 00 02 3f 1a b8 40 00     00:20:57.324  READ FPDMA QUEUED
  60 00 08 00 78 00 00 02 3f 1e a0 40 00     00:20:57.221  READ FPDMA QUEUED
  60 00 08 00 70 00 00 02 d3 8d 68 40 00     00:20:57.175  READ FPDMA QUEUED
  60 00 08 00 68 00 00 02 3f 19 b0 40 00     00:20:57.170  READ FPDMA QUEUED
  60 00 08 00 60 00 00 02 92 6a b0 40 00     00:20:57.170  READ FPDMA QUEUED

Error 16 [15] occurred at disk power-on lifetime: 4809 hours (200 days + 9 hours)
  When the command that caused the error occurred, the device was active or idle.

  After command completion occurred, registers were:
  ER -- ST COUNT  LBA_48  LH LM LL DV DC
  -- -- -- == -- == == == -- -- -- -- --
  84 -- 41 00 b8 00 00 02 52 70 d7 40 00  Error: ICRC, ABRT at LBA = 0x025270d7 = 38957271

  Commands leading to the command that caused the error were:
  CR FEATR COUNT  LBA_48  LH LM LL DV DC  Powered_Up_Time  Command/Feature_Name
  -- == -- == -- == == == -- -- -- -- --  ---------------  --------------------
  60 00 08 00 b8 00 00 02 52 70 d0 40 00     00:20:56.112  READ FPDMA QUEUED
  60 00 10 00 b0 00 00 02 52 70 c0 40 00     00:20:56.112  READ FPDMA QUEUED
  60 00 10 00 a8 00 00 02 52 70 a0 40 00     00:20:56.112  READ FPDMA QUEUED
  60 00 08 00 a0 00 00 02 52 70 90 40 00     00:20:56.112  READ FPDMA QUEUED
  60 00 10 00 98 00 00 02 52 70 80 40 00     00:20:56.112  READ FPDMA QUEUED

Error 15 [14] occurred at disk power-on lifetime: 4805 hours (200 days + 5 hours)
  When the command that caused the error occurred, the device was active or idle.

  After command completion occurred, registers were:
  ER -- ST COUNT  LBA_48  LH LM LL DV DC
  -- -- -- == -- == == == -- -- -- -- --
  84 -- 41 00 20 00 00 02 52 af e7 40 00  Error: ICRC, ABRT at LBA = 0x0252afe7 = 38973415

  Commands leading to the command that caused the error were:
  CR FEATR COUNT  LBA_48  LH LM LL DV DC  Powered_Up_Time  Command/Feature_Name
  -- == -- == -- == == == -- -- -- -- --  ---------------  --------------------
  60 00 70 00 20 00 00 02 52 af 78 40 00     00:16:40.913  READ FPDMA QUEUED
  60 00 70 00 20 00 00 02 52 af 78 40 00     00:16:40.913  READ FPDMA QUEUED
  60 00 78 00 18 00 00 02 52 ae 18 40 00     00:16:40.912  READ FPDMA QUEUED
  60 00 28 00 10 00 00 02 5c da 78 40 00     00:16:37.643  READ FPDMA QUEUED
  60 00 08 00 08 00 00 02 5c da 70 40 00     00:16:37.642  READ FPDMA QUEUED

Error 14 [13] occurred at disk power-on lifetime: 4805 hours (200 days + 5 hours)
  When the command that caused the error occurred, the device was active or idle.

  After command completion occurred, registers were:
  ER -- ST COUNT  LBA_48  LH LM LL DV DC
  -- -- -- == -- == == == -- -- -- -- --
  84 -- 41 00 48 00 00 02 52 97 5f 40 00  Error: ICRC, ABRT at LBA = 0x0252975f = 38967135

  Commands leading to the command that caused the error were:
  CR FEATR COUNT  LBA_48  LH LM LL DV DC  Powered_Up_Time  Command/Feature_Name
  -- == -- == -- == == == -- -- -- -- --  ---------------  --------------------
  60 00 78 00 48 00 00 02 52 96 e8 40 00     00:12:59.483  READ FPDMA QUEUED
  60 00 08 00 40 00 00 02 5c ec 30 40 00     00:12:58.663  READ FPDMA QUEUED
  60 00 08 00 38 00 00 02 5c ec 28 40 00     00:12:58.519  READ FPDMA QUEUED
  60 00 08 00 30 00 00 02 5c ec 20 40 00     00:12:58.490  READ FPDMA QUEUED
  60 00 08 00 28 00 00 02 5c e1 08 40 00     00:12:58.311  READ FPDMA QUEUED

SMART Extended Self-test Log Version: 1 (1 sectors)
No self-tests have been logged.  [To run self-tests, use: smartctl -t]

SMART Selective self-test log data structure revision number 1
 SPAN  MIN_LBA  MAX_LBA  CURRENT_TEST_STATUS
    1        0        0  Not_testing
    2        0        0  Not_testing
    3        0        0  Not_testing
    4        0        0  Not_testing
    5        0        0  Not_testing
Selective self-test flags (0x0):
  After scanning selected spans, do NOT read-scan remainder of disk.
If Selective self-test is pending on power-up, resume after 0 minute delay.

SCT Status Version:                  2
SCT Version (vendor specific):       1 (0x0001)
Device State:                        Active (0)
Current Temperature:                    34 Celsius
Power Cycle Min/Max Temperature:     32/34 Celsius
Lifetime    Min/Max Temperature:      6/52 Celsius
Under/Over Temperature Limit Count:   0/0

SCT Temperature History Version:     2
Temperature Sampling Period:         1 minute
Temperature Logging Interval:        1 minute
Min/Max recommended Temperature:      5/55 Celsius
Min/Max Temperature Limit:            5/55 Celsius
Temperature History Size (Index):    478 (436)

SCT Error Recovery Control:
           Read: Disabled
          Write: Disabled

Device Statistics (GP Log 0x04)
Page  Offset Size        Value Flags Description
0x01  =====  =               =  ===  == General Statistics (rev 2) ==
0x01  0x008  4            1936  ---  Lifetime Power-On Resets
0x01  0x010  4            5726  ---  Power-on Hours
0x01  0x018  6     13738931426  ---  Logical Sectors Written
0x01  0x020  6       195657314  ---  Number of Write Commands
0x01  0x028  6     13511816190  ---  Logical Sectors Read
0x01  0x030  6       188845540  ---  Number of Read Commands
0x02  =====  =               =  ===  == Free-Fall Statistics (rev 1) ==
0x02  0x010  4             456  ---  Overlimit Shock Events
0x03  =====  =               =  ===  == Rotating Media Statistics (rev 1) ==
0x03  0x008  4             907  ---  Spindle Motor Power-on Hours
0x03  0x010  4            1028  ---  Head Flying Hours
0x03  0x018  4           62225  ---  Head Load Events
0x03  0x020  4               0  ---  Number of Reallocated Logical Sectors
0x03  0x028  4               0  ---  Read Recovery Attempts
0x03  0x030  4               0  ---  Number of Mechanical Start Failures
0x04  =====  =               =  ===  == General Errors Statistics (rev 1) ==
0x04  0x008  4               0  ---  Number of Reported Uncorrectable Errors
0x04  0x010  4              24  ---  Resets Between Cmd Acceptance and Completion
0x05  =====  =               =  ===  == Temperature Statistics (rev 1) ==
0x05  0x008  1              34  ---  Current Temperature
0x05  0x010  1              27  N--  Average Short Term Temperature
0x05  0x018  1              26  N--  Average Long Term Temperature
0x05  0x020  1              52  ---  Highest Temperature
0x05  0x028  1               6  ---  Lowest Temperature
0x05  0x030  1              40  N--  Highest Average Short Term Temperature
0x05  0x038  1              19  N--  Lowest Average Short Term Temperature
0x05  0x040  1              30  N--  Highest Average Long Term Temperature
0x05  0x048  1              23  N--  Lowest Average Long Term Temperature
0x05  0x050  4               0  ---  Time in Over-Temperature
0x05  0x058  1              55  ---  Specified Maximum Operating Temperature
0x05  0x060  4               0  ---  Time in Under-Temperature
0x05  0x068  1               5  ---  Specified Minimum Operating Temperature
0x06  =====  =               =  ===  == Transport Statistics (rev 1) ==
0x06  0x008  4           35766  ---  Number of Hardware Resets
0x06  0x018  4              21  ---  Number of Interface CRC Errors
0x07  =====  =               =  ===  == Solid State Device Statistics (rev 1) ==
0x07  0x008  1               9  N--  Percentage Used Endurance Indicator
                                |||_ C monitored condition met
                                ||__ D supports DSN
                                |___ N normalized value

Pending Defects log (GP Log 0x0c) not supported

SATA Phy Event Counters (GP Log 0x11)
ID      Size     Value  Description
0x0001  4            0  Command failed due to ICRC error
0x0002  4            0  R_ERR response for data FIS
0x0003  4            0  R_ERR response for device-to-host data FIS
0x0004  4            0  R_ERR response for host-to-device data FIS
0x0005  4            0  R_ERR response for non-data FIS
0x0006  4            0  R_ERR response for device-to-host non-data FIS
0x0007  4            0  R_ERR response for host-to-device non-data FIS
0x0008  4            0  Device-to-host non-data FIS retries
0x0009  4            2  Transition from drive PhyRdy to drive PhyNRdy
0x000a  4            2  Device-to-host register FISes sent due to a COMRESET
0x000b  4            0  CRC errors within host-to-device FIS
0x000d  4            0  Non-CRC errors within host-to-device FIS
0x000f  4            0  R_ERR response for host-to-device data FIS, CRC
0x0010  4            0  R_ERR response for host-to-device data FIS, non-CRC
0x0012  4            0  R_ERR response for host-to-device non-data FIS, CRC
0x0013  4            0  R_ERR response for host-to-device non-data FIS, non-CRC



