smartctl 7.2 2020-12-30 r5155 [x86_64-linux-5.13.0-22-generic] (local build)
Copyright (C) 2002-20, Bruce Allen, Christian Franke, www.smartmontools.org

=== START OF INFORMATION SECTION ===
Model Family:     Toshiba 2.5" HDD MQ01ABF...
Device Model:     TOSHIBA MQ01ABF050
Serial Number:    --
LU WWN Device Id: 5 000039 ...
Firmware Version: AM0P4C
User Capacity:    500,107,862,016 bytes [500 GB]
Sector Sizes:     512 bytes logical, 4096 bytes physical
Rotation Rate:    5400 rpm
Form Factor:      2.5 inches
Device is:        In smartctl database [for details use: -P show]
ATA Version is:   ATA8-ACS (minor revision not indicated)
SATA Version is:  SATA 3.0, 6.0 Gb/s (current: 3.0 Gb/s)
Local Time is:    Tue Dec 21 09:13:36 2021 MST
SMART support is: Available - device has SMART capability.
SMART support is: Enabled
AAM feature is:   Unavailable
APM level is:     128 (minimum power consumption without standby)
Rd look-ahead is: Enabled
Write cache is:   Enabled
DSN feature is:   Unavailable
ATA Security is:  Disabled, frozen [SEC2]
Wt Cache Reorder: Enabled

=== START OF READ SMART DATA SECTION ===
SMART overall-health self-assessment test result: PASSED

General SMART Values:
Offline data collection status:  (0x06)	Offline data collection activity
					was aborted by the device with a fatal error.
					Auto Offline Data Collection: Disabled.
Self-test execution status:      ( 121)	The previous self-test completed having
					the read element of the test failed.
Total time to complete Offline 
data collection: 		(  120) seconds.
Offline data collection
capabilities: 			 (0x51) SMART execute Offline immediate.
					No Auto Offline data collection support.
					Suspend Offline collection upon new
					command.
					No Offline surface scan supported.
					Self-test supported.
					No Conveyance Self-test supported.
					Selective Self-test supported.
SMART capabilities:            (0x0003)	Saves SMART data before entering
					power-saving mode.
					Supports SMART auto save timer.
Error logging capability:        (0x01)	Error logging supported.
					General Purpose Logging supported.
Short self-test routine 
recommended polling time: 	 (   2) minutes.
Extended self-test routine
recommended polling time: 	 ( 106) minutes.
SCT capabilities: 	       (0x003d)	SCT Status supported.
					SCT Error Recovery Control supported.
					SCT Feature Control supported.
					SCT Data Table supported.

SMART Attributes Data Structure revision number: 16
Vendor Specific SMART Attributes with Thresholds:
ID# ATTRIBUTE_NAME          FLAGS    VALUE WORST THRESH FAIL RAW_VALUE
  1 Raw_Read_Error_Rate     POSR-K   100   097   050    -    0
  2 Throughput_Performance  POS--K   100   100   050    -    0
  3 Spin_Up_Time            PO---K   100   100   002    -    1335
  4 Start_Stop_Count        -O--CK   100   100   000    -    12249
  5 Reallocated_Sector_Ct   PO--CK   100   100   010    -    96
  7 Seek_Error_Rate         POSR-K   100   100   050    -    0
  8 Seek_Time_Performance   P-S--K   100   100   050    -    0
  9 Power_On_Hours          -O--CK   093   093   000    -    3048
 10 Spin_Retry_Count        PO--CK   253   100   030    -    0
 12 Power_Cycle_Count       -O--CK   100   100   000    -    1380
183 Runtime_Bad_Block       -O--CK   100   100   001    -    1446
184 End-to-End_Error        PO--CK   100   100   097    -    0
185 Unknown_Attribute       -O--CK   100   100   001    -    65535
187 Reported_Uncorrect      -O--CK   001   001   000    -    65535
188 Command_Timeout         -O--CK   100   099   000    -    2
189 High_Fly_Writes         -O-RCK   100   100   001    -    0
190 Airflow_Temperature_Cel -O---K   061   053   040    -    39 (Min/Max 20/41)
191 G-Sense_Error_Rate      -O--CK   100   100   000    -    81
192 Power-Off_Retract_Count -O---K   100   100   000    -    3866683
193 Load_Cycle_Count        -O--CK   098   098   000    -    22370
194 Temperature_Celsius     -O---K   061   053   040    -    39 (Min/Max 20/41)
196 Reallocated_Event_Count -O--CK   100   100   000    -    10
197 Current_Pending_Sector  -O--CK   100   100   000    -    3432
199 UDMA_CRC_Error_Count    -O--CK   200   200   000    -    0
                            ||||||_ K auto-keep
                            |||||__ C event count
                            ||||___ R error rate
                            |||____ S speed/performance
                            ||_____ O updated online
                            |______ P prefailure warning

General Purpose Log Directory Version 1
SMART           Log Directory Version 1 [multi-sector log support]
Address    Access  R/W   Size  Description
0x00       GPL,SL  R/O      1  Log Directory
0x01           SL  R/O      1  Summary SMART error log
0x02           SL  R/O     51  Comprehensive SMART error log
0x03       GPL     R/O     64  Ext. Comprehensive SMART error log
0x04       GPL,SL  R/O      8  Device Statistics log
0x06           SL  R/O      1  SMART self-test log
0x07       GPL     R/O      1  Extended self-test log
0x09           SL  R/W      1  Selective self-test log
0x10       GPL     R/O      1  NCQ Command Error log
0x11       GPL     R/O      1  SATA Phy Event Counters log
0x80-0x9f  GPL,SL  R/W     16  Host vendor specific log
0xe0       GPL,SL  R/W      1  SCT Command/Status
0xe1       GPL,SL  R/W      1  SCT Data Transfer

SMART Extended Comprehensive Error Log Version: 1 (64 sectors)
Device Error Count: 65535 (device log contains only the most recent 256 errors)
	CR     = Command Register
	FEATR  = Features Register
	COUNT  = Count (was: Sector Count) Register
	LBA_48 = Upper bytes of LBA High/Mid/Low Registers ]  ATA-8
	LH     = LBA High (was: Cylinder High) Register    ]   LBA
	LM     = LBA Mid (was: Cylinder Low) Register      ] Register
	LL     = LBA Low (was: Sector Number) Register     ]
	DV     = Device (was: Device/Head) Register
	DC     = Device Control Register
	ER     = Error register
	ST     = Status register
Powered_Up_Time is measured from power on, and printed as
DDd+hh:mm:SS.sss where DD=days, hh=hours, mm=minutes,
SS=sec, and sss=millisec. It "wraps" after 49.710 days.

Error 65535 [117] occurred at disk power-on lifetime: 3028 hours (126 days + 4 hours)
  When the command that caused the error occurred, the device was active or idle.

  After command completion occurred, registers were:
  ER -- ST COUNT  LBA_48  LH LM LL DV DC
  -- -- -- == -- == == == -- -- -- -- --
  40 -- 41 00 50 00 00 1a 58 1b 98 40 00  Error: WP at LBA = 0x1a581b98 = 441981848

  Commands leading to the command that caused the error were:
  CR FEATR COUNT  LBA_48  LH LM LL DV DC  Powered_Up_Time  Command/Feature_Name
  -- == -- == -- == == == -- -- -- -- --  ---------------  --------------------
  61 00 a0 00 e0 00 00 05 3e 28 00 40 00     01:11:57.343  WRITE FPDMA QUEUED
  61 00 10 00 88 00 00 2b 9f 00 e8 40 00     01:11:57.343  WRITE FPDMA QUEUED
  61 00 88 00 80 00 00 04 75 5d 00 40 00     01:11:57.343  WRITE FPDMA QUEUED
  61 00 18 00 d8 00 00 05 39 e7 50 40 00     01:11:57.343  WRITE FPDMA QUEUED
  60 00 08 00 78 00 00 04 54 59 00 40 00     01:11:57.342  READ FPDMA QUEUED

Error 65534 [116] occurred at disk power-on lifetime: 3028 hours (126 days + 4 hours)
  When the command that caused the error occurred, the device was active or idle.

  After command completion occurred, registers were:
  ER -- ST COUNT  LBA_48  LH LM LL DV DC
  -- -- -- == -- == == == -- -- -- -- --
  40 -- 41 00 28 00 00 1a 58 1b 98 40 00  Error: WP at LBA = 0x1a581b98 = 441981848

  Commands leading to the command that caused the error were:
  CR FEATR COUNT  LBA_48  LH LM LL DV DC  Powered_Up_Time  Command/Feature_Name
  -- == -- == -- == == == -- -- -- -- --  ---------------  --------------------
  61 00 08 00 58 00 00 04 5e c1 78 40 00     01:11:57.128  WRITE FPDMA QUEUED
  60 00 08 00 28 00 00 1a 58 1b 98 40 00     01:11:53.387  READ FPDMA QUEUED
  61 00 d8 00 20 00 00 1d 23 a0 b8 40 00     01:11:53.387  WRITE FPDMA QUEUED
  60 00 08 00 18 00 00 04 43 d6 90 40 00     01:11:53.386  READ FPDMA QUEUED
  61 00 08 00 e8 00 00 1d 23 a0 b0 40 00     01:11:53.365  WRITE FPDMA QUEUED

Error 65533 [115] occurred at disk power-on lifetime: 3028 hours (126 days + 4 hours)
  When the command that caused the error occurred, the device was active or idle.

  After command completion occurred, registers were:
  ER -- ST COUNT  LBA_48  LH LM LL DV DC
  -- -- -- == -- == == == -- -- -- -- --
  40 -- 41 00 00 00 00 1a 58 1b 98 40 00  Error: UNC at LBA = 0x1a581b98 = 441981848

  Commands leading to the command that caused the error were:
  CR FEATR COUNT  LBA_48  LH LM LL DV DC  Powered_Up_Time  Command/Feature_Name
  -- == -- == -- == == == -- -- -- -- --  ---------------  --------------------
  60 00 08 00 68 00 00 00 26 12 00 40 00     01:11:53.254  READ FPDMA QUEUED
  60 00 20 00 00 00 00 1a 58 1b 90 40 00     01:11:49.517  READ FPDMA QUEUED
  60 00 08 00 f8 00 00 05 11 36 a0 40 00     01:11:49.383  READ FPDMA QUEUED
  61 00 18 00 60 00 00 05 39 e7 38 40 00     01:11:48.333  WRITE FPDMA QUEUED
  60 00 08 00 58 00 00 1a 54 1a b8 40 00     01:11:48.206  READ FPDMA QUEUED

Error 65532 [114] occurred at disk power-on lifetime: 3027 hours (126 days + 3 hours)
  When the command that caused the error occurred, the device was active or idle.

  After command completion occurred, registers were:
  ER -- ST COUNT  LBA_48  LH LM LL DV DC
  -- -- -- == -- == == == -- -- -- -- --
  40 -- 41 00 88 00 00 1a 58 1b 98 40 00  Error: WP at LBA = 0x1a581b98 = 441981848

  Commands leading to the command that caused the error were:
  CR FEATR COUNT  LBA_48  LH LM LL DV DC  Powered_Up_Time  Command/Feature_Name
  -- == -- == -- == == == -- -- -- -- --  ---------------  --------------------
  61 00 28 00 90 00 00 1d 19 a4 70 40 00     00:42:29.779  WRITE FPDMA QUEUED
  60 00 08 00 88 00 00 1a 58 1b 98 40 00     00:42:29.778  READ FPDMA QUEUED
  60 00 b0 00 f8 00 00 24 f8 e5 e0 40 00     00:42:29.778  READ FPDMA QUEUED
  60 00 40 00 b8 00 00 1a 58 1b b0 40 00     00:42:29.778  READ FPDMA QUEUED
  60 00 20 00 b0 00 00 25 60 20 b8 40 00     00:42:29.778  READ FPDMA QUEUED

Error 65531 [113] occurred at disk power-on lifetime: 3027 hours (126 days + 3 hours)
  When the command that caused the error occurred, the device was active or idle.

  After command completion occurred, registers were:
  ER -- ST COUNT  LBA_48  LH LM LL DV DC
  -- -- -- == -- == == == -- -- -- -- --
  40 -- 41 00 60 00 00 1a 58 1b 98 40 00  Error: UNC at LBA = 0x1a581b98 = 441981848

  Commands leading to the command that caused the error were:
  CR FEATR COUNT  LBA_48  LH LM LL DV DC  Powered_Up_Time  Command/Feature_Name
  -- == -- == -- == == == -- -- -- -- --  ---------------  --------------------
  60 00 08 00 60 00 00 1a 58 1b 98 40 00     00:42:25.952  READ FPDMA QUEUED
  60 00 40 00 20 00 00 1a 58 1b b0 40 00     00:42:25.914  READ FPDMA QUEUED
  60 00 10 00 18 00 00 25 60 20 98 40 00     00:42:25.914  READ FPDMA QUEUED
  60 00 08 00 10 00 00 25 60 20 b0 40 00     00:42:25.914  READ FPDMA QUEUED
  60 00 e0 00 08 00 00 24 f8 e2 c0 40 00     00:42:25.914  READ FPDMA QUEUED

Error 65530 [112] occurred at disk power-on lifetime: 3027 hours (126 days + 3 hours)
  When the command that caused the error occurred, the device was active or idle.

  After command completion occurred, registers were:
  ER -- ST COUNT  LBA_48  LH LM LL DV DC
  -- -- -- == -- == == == -- -- -- -- --
  40 -- 41 00 48 00 00 1a 58 1b 98 40 00  Error: WP at LBA = 0x1a581b98 = 441981848

  Commands leading to the command that caused the error were:
  CR FEATR COUNT  LBA_48  LH LM LL DV DC  Powered_Up_Time  Command/Feature_Name
  -- == -- == -- == == == -- -- -- -- --  ---------------  --------------------
  61 00 80 00 70 00 00 1d 19 a3 e8 40 00     00:42:23.025  WRITE FPDMA QUEUED
  60 00 e0 00 d0 00 00 24 f8 e2 c0 40 00     00:42:22.126  READ FPDMA QUEUED
  60 00 08 00 68 00 00 25 60 20 b0 40 00     00:42:22.104  READ FPDMA QUEUED
  60 00 10 00 60 00 00 25 60 20 98 40 00     00:42:22.104  READ FPDMA QUEUED
  60 00 60 00 58 00 00 24 f3 36 38 40 00     00:42:22.070  READ FPDMA QUEUED

Error 65529 [111] occurred at disk power-on lifetime: 3027 hours (126 days + 3 hours)
  When the command that caused the error occurred, the device was active or idle.

  After command completion occurred, registers were:
  ER -- ST COUNT  LBA_48  LH LM LL DV DC
  -- -- -- == -- == == == -- -- -- -- --
  40 -- 41 00 e0 00 00 1a 58 1b 98 40 00  Error: UNC at LBA = 0x1a581b98 = 441981848

  Commands leading to the command that caused the error were:
  CR FEATR COUNT  LBA_48  LH LM LL DV DC  Powered_Up_Time  Command/Feature_Name
  -- == -- == -- == == == -- -- -- -- --  ---------------  --------------------
  60 00 48 00 e8 00 00 24 f6 b0 78 40 00     00:42:21.879  READ FPDMA QUEUED
  60 00 20 00 e0 00 00 1a 58 1b 90 40 00     00:42:18.171  READ FPDMA QUEUED
  60 00 40 00 d8 00 00 1a 54 1a f0 40 00     00:42:18.171  READ FPDMA QUEUED
  60 00 08 00 d0 00 00 04 41 75 20 40 00     00:42:18.157  READ FPDMA QUEUED
  60 00 08 00 c8 00 00 04 41 74 a8 40 00     00:42:18.157  READ FPDMA QUEUED

Error 65528 [110] occurred at disk power-on lifetime: 2996 hours (124 days + 20 hours)
  When the command that caused the error occurred, the device was active or idle.

  After command completion occurred, registers were:
  ER -- ST COUNT  LBA_48  LH LM LL DV DC
  -- -- -- == -- == == == -- -- -- -- --
  40 -- 41 00 b8 00 00 1a 58 19 78 40 00  Error: WP at LBA = 0x1a581978 = 441981304

  Commands leading to the command that caused the error were:
  CR FEATR COUNT  LBA_48  LH LM LL DV DC  Powered_Up_Time  Command/Feature_Name
  -- == -- == -- == == == -- -- -- -- --  ---------------  --------------------
  61 05 40 00 c0 00 00 2e 10 79 00 40 00     04:53:56.307  WRITE FPDMA QUEUED
  61 00 10 00 b0 00 00 00 11 63 98 40 00     04:53:56.306  WRITE FPDMA QUEUED
  60 00 08 00 50 00 00 05 11 19 10 40 00     04:53:56.305  READ FPDMA QUEUED
  60 00 f0 00 48 00 00 26 18 4e 30 40 00     04:53:56.305  READ FPDMA QUEUED
  61 00 08 00 40 00 00 00 11 61 90 40 00     04:53:56.305  WRITE FPDMA QUEUED

SMART Extended Self-test Log Version: 1 (1 sectors)
Num  Test_Description    Status                  Remaining  LifeTime(hours)  LBA_of_first_error
# 1  Short offline       Completed: read failure       90%      2638         147018232
# 2  Short offline       Completed: read failure       90%      1364         706336
# 3  Extended offline    Completed: read failure       90%      1364         706336
# 4  Selective offline   Completed: read failure       90%      1364         706336

SMART Selective self-test log data structure revision number 1
 SPAN    MIN_LBA    MAX_LBA  CURRENT_TEST_STATUS
    1          0    5860489  Not_testing
    2  242728169  248588658  Not_testing
    3  485456338  491316827  Not_testing
    4  728184507  734044996  Not_testing
    5  970912678  976773167  Not_testing
Selective self-test flags (0x0):
  After scanning selected spans, do NOT read-scan remainder of disk.
If Selective self-test is pending on power-up, resume after 0 minute delay.

SCT Status Version:                  2
SCT Version (vendor specific):       1 (0x0001)
Device State:                        Active (0)
Current Temperature:                    38 Celsius
Power Cycle Min/Max Temperature:     20/41 Celsius
Lifetime    Min/Max Temperature:      7/47 Celsius
Under/Over Temperature Limit Count:   0/0

SCT Temperature History Version:     2
Temperature Sampling Period:         1 minute
Temperature Logging Interval:        1 minute
Min/Max recommended Temperature:      0/60 Celsius
Min/Max Temperature Limit:            0/60 Celsius
Temperature History Size (Index):    478 (45)

SCT Error Recovery Control:
           Read: Disabled
          Write: Disabled

Device Statistics (GP Log 0x04)
Page  Offset Size        Value Flags Description
0x01  =====  =               =  ===  == General Statistics (rev 2) ==
0x01  0x008  4            1380  ---  Lifetime Power-On Resets
0x01  0x010  4            3048  ---  Power-on Hours
0x01  0x018  6      7933271188  ---  Logical Sectors Written
0x01  0x020  6       137639577  ---  Number of Write Commands
0x01  0x028  6      8442681238  ---  Logical Sectors Read
0x01  0x030  6       123099410  ---  Number of Read Commands
0x02  =====  =               =  ===  == Free-Fall Statistics (rev 1) ==
0x02  0x010  4              81  ---  Overlimit Shock Events
0x03  =====  =               =  ===  == Rotating Media Statistics (rev 1) ==
0x03  0x008  4             462  ---  Spindle Motor Power-on Hours
0x03  0x010  4            2736  ---  Head Flying Hours
0x03  0x018  4           22370  ---  Head Load Events
0x03  0x020  4             496  ---  Number of Reallocated Logical Sectors
0x03  0x028  4            1639  ---  Read Recovery Attempts
0x03  0x030  4               0  ---  Number of Mechanical Start Failures
0x04  =====  =               =  ===  == General Errors Statistics (rev 1) ==
0x04  0x008  4          233375  ---  Number of Reported Uncorrectable Errors
0x04  0x010  4               2  ---  Resets Between Cmd Acceptance and Completion
0x05  =====  =               =  ===  == Temperature Statistics (rev 1) ==
0x05  0x008  1              39  ---  Current Temperature
0x05  0x010  1              35  N--  Average Short Term Temperature
0x05  0x018  1              34  N--  Average Long Term Temperature
0x05  0x020  1              47  ---  Highest Temperature
0x05  0x028  1               7  ---  Lowest Temperature
0x05  0x030  1              41  N--  Highest Average Short Term Temperature
0x05  0x038  1              23  N--  Lowest Average Short Term Temperature
0x05  0x040  1              34  N--  Highest Average Long Term Temperature
0x05  0x048  1              29  N--  Lowest Average Long Term Temperature
0x05  0x050  4               0  ---  Time in Over-Temperature
0x05  0x058  1              60  ---  Specified Maximum Operating Temperature
0x05  0x060  4               0  ---  Time in Under-Temperature
0x05  0x068  1               0  ---  Specified Minimum Operating Temperature
0x06  =====  =               =  ===  == Transport Statistics (rev 1) ==
0x06  0x008  4            2186  ---  Number of Hardware Resets
0x06  0x018  4               0  ---  Number of Interface CRC Errors
0x07  =====  =               =  ===  == Solid State Device Statistics (rev 1) ==
0x07  0x008  1               5  N--  Percentage Used Endurance Indicator
                                |||_ C monitored condition met
                                ||__ D supports DSN
                                |___ N normalized value

Pending Defects log (GP Log 0x0c) not supported

SATA Phy Event Counters (GP Log 0x11)
ID      Size     Value  Description
0x0001  4            0  Command failed due to ICRC error
0x0002  4            0  R_ERR response for data FIS
0x0003  4            0  R_ERR response for device-to-host data FIS
0x0004  4            0  R_ERR response for host-to-device data FIS
0x0005  4            0  R_ERR response for non-data FIS
0x0006  4            0  R_ERR response for device-to-host non-data FIS
0x0007  4            0  R_ERR response for host-to-device non-data FIS
0x0008  4            0  Device-to-host non-data FIS retries
0x0009  4           19  Transition from drive PhyRdy to drive PhyNRdy
0x000a  4           14  Device-to-host register FISes sent due to a COMRESET
0x000b  4            0  CRC errors within host-to-device FIS
0x000d  4            0  Non-CRC errors within host-to-device FIS
0x000f  4            0  R_ERR response for host-to-device data FIS, CRC
0x0010  4            0  R_ERR response for host-to-device data FIS, non-CRC
0x0012  4            0  R_ERR response for host-to-device non-data FIS, CRC
0x0013  4            0  R_ERR response for host-to-device non-data FIS, non-CRC

