=== START OF INFORMATION SECTION ===
Model Family:     Toshiba 2.5" HDD MQ01ABF...
Device Model:     TOSHIBA MQ01ABF050
Serial Number:    --
LU WWN Device Id: 5 000039 ...
Firmware Version: AM002C
User Capacity:    500,107,862,016 bytes [500 GB]
Sector Sizes:     512 bytes logical, 4096 bytes physical
Rotation Rate:    5400 rpm
Form Factor:      2.5 inches
Device is:        In smartctl database [for details use: -P show]
ATA Version is:   ATA8-ACS (minor revision not indicated)
SATA Version is:  SATA 2.6, 3.0 Gb/s (current: 3.0 Gb/s)
Local Time is:    Thu Aug 20 23:28:02 2020 CEST
SMART support is: Available - device has SMART capability.
SMART support is: Enabled
AAM feature is:   Unavailable
APM level is:     254 (maximum performance)
Rd look-ahead is: Enabled
Write cache is:   Enabled
DSN feature is:   Unavailable
ATA Security is:  Disabled, frozen [SEC2]
Wt Cache Reorder: Enabled

=== START OF READ SMART DATA SECTION ===
SMART overall-health self-assessment test result: PASSED

General SMART Values:
Offline data collection status:  (0x80)	Offline data collection activity
					was never started.
					Auto Offline Data Collection: Enabled.
Self-test execution status:      (   0)	The previous self-test routine completed
					without error or no self-test has ever 
					been run.
Total time to complete Offline 
data collection: 		(  120) seconds.
Offline data collection
capabilities: 			 (0x51) SMART execute Offline immediate.
					No Auto Offline data collection support.
					Suspend Offline collection upon new
					command.
					No Offline surface scan supported.
					Self-test supported.
					No Conveyance Self-test supported.
					Selective Self-test supported.
SMART capabilities:            (0x0003)	Saves SMART data before entering
					power-saving mode.
					Supports SMART auto save timer.
Error logging capability:        (0x01)	Error logging supported.
					General Purpose Logging supported.
Short self-test routine 
recommended polling time: 	 (   2) minutes.
Extended self-test routine
recommended polling time: 	 ( 100) minutes.
SCT capabilities: 	       (0x003d)	SCT Status supported.
					SCT Error Recovery Control supported.
					SCT Feature Control supported.
					SCT Data Table supported.

SMART Attributes Data Structure revision number: 16
Vendor Specific SMART Attributes with Thresholds:
ID# ATTRIBUTE_NAME          FLAGS    VALUE WORST THRESH FAIL RAW_VALUE
  1 Raw_Read_Error_Rate     POSR-K   100   100   050    -    0
  2 Throughput_Performance  POS--K   100   100   050    -    0
  3 Spin_Up_Time            PO---K   100   100   002    -    1310
  4 Start_Stop_Count        -O--CK   100   100   000    -    5092
  5 Reallocated_Sector_Ct   PO--CK   100   100   010    -    0
  7 Seek_Error_Rate         POSR-K   100   100   050    -    0
  8 Seek_Time_Performance   P-S--K   100   100   050    -    0
  9 Power_On_Hours          -O--CK   077   077   000    -    9327
 10 Spin_Retry_Count        PO--CK   201   100   030    -    0
 12 Power_Cycle_Count       -O--CK   100   100   000    -    4973
183 Runtime_Bad_Block       -O--CK   100   100   001    -    0
184 End-to-End_Error        PO--CK   100   100   097    -    0
185 Unknown_Attribute       -O--CK   100   100   001    -    65535
187 Reported_Uncorrect      -O--CK   001   001   000    -    248
188 Command_Timeout         -O--CK   100   099   000    -    1
189 High_Fly_Writes         -O-RCK   100   100   001    -    0
190 Airflow_Temperature_Cel -O---K   066   055   040    -    34 (Min/Max 34/34)
191 G-Sense_Error_Rate      -O--CK   100   100   000    -    1979
192 Power-Off_Retract_Count -O---K   100   100   000    -    8585347
193 Load_Cycle_Count        -O--CK   093   093   000    -    78502
194 Temperature_Celsius     -O---K   066   055   040    -    34 (Min/Max 34/34)
196 Reallocated_Event_Count -O--CK   100   100   000    -    0
197 Current_Pending_Sector  -O--CK   100   100   000    -    0
199 UDMA_CRC_Error_Count    -O--CK   200   200   000    -    0
                            ||||||_ K auto-keep
                            |||||__ C event count
                            ||||___ R error rate
                            |||____ S speed/performance
                            ||_____ O updated online
                            |______ P prefailure warning

General Purpose Log Directory Version 1
SMART           Log Directory Version 1 [multi-sector log support]
Address    Access  R/W   Size  Description
0x00       GPL,SL  R/O      1  Log Directory
0x01           SL  R/O      1  Summary SMART error log
0x02           SL  R/O     51  Comprehensive SMART error log
0x03       GPL     R/O     64  Ext. Comprehensive SMART error log
0x04       GPL,SL  R/O      8  Device Statistics log
0x06           SL  R/O      1  SMART self-test log
0x07       GPL     R/O      1  Extended self-test log
0x09           SL  R/W      1  Selective self-test log
0x10       GPL     R/O      1  NCQ Command Error log
0x11       GPL     R/O      1  SATA Phy Event Counters log
0x80-0x9f  GPL,SL  R/W     16  Host vendor specific log
0xe0       GPL,SL  R/W      1  SCT Command/Status
0xe1       GPL,SL  R/W      1  SCT Data Transfer

SMART Extended Comprehensive Error Log Version: 1 (64 sectors)
Device Error Count: 248
	CR     = Command Register
	FEATR  = Features Register
	COUNT  = Count (was: Sector Count) Register
	LBA_48 = Upper bytes of LBA High/Mid/Low Registers ]  ATA-8
	LH     = LBA High (was: Cylinder High) Register    ]   LBA
	LM     = LBA Mid (was: Cylinder Low) Register      ] Register
	LL     = LBA Low (was: Sector Number) Register     ]
	DV     = Device (was: Device/Head) Register
	DC     = Device Control Register
	ER     = Error register
	ST     = Status register
Powered_Up_Time is measured from power on, and printed as
DDd+hh:mm:SS.sss where DD=days, hh=hours, mm=minutes,
SS=sec, and sss=millisec. It "wraps" after 49.710 days.

Error 248 [247] occurred at disk power-on lifetime: 8376 hours (349 days + 0 hours)
  When the command that caused the error occurred, the device was active or idle.

  After command completion occurred, registers were:
  ER -- ST COUNT  LBA_48  LH LM LL DV DC
  -- -- -- == -- == == == -- -- -- -- --
  40 -- 41 00 28 00 00 04 14 77 00 40 00  Error: WP at LBA = 0x04147700 = 68450048

  Commands leading to the command that caused the error were:
  CR FEATR COUNT  LBA_48  LH LM LL DV DC  Powered_Up_Time  Command/Feature_Name
  -- == -- == -- == == == -- -- -- -- --  ---------------  --------------------
  61 00 08 00 00 00 00 05 28 9e 80 40 00     02:29:08.489  WRITE FPDMA QUEUED
  60 00 30 00 38 00 00 04 14 78 c0 40 00     02:29:04.753  READ FPDMA QUEUED
  60 01 00 00 30 00 00 04 14 77 c0 40 00     02:29:04.753  READ FPDMA QUEUED
  60 01 00 00 28 00 00 04 14 76 c0 40 00     02:29:04.753  READ FPDMA QUEUED
  60 01 00 00 20 00 00 04 14 75 c0 40 00     02:29:04.753  READ FPDMA QUEUED

Error 247 [246] occurred at disk power-on lifetime: 8376 hours (349 days + 0 hours)
  When the command that caused the error occurred, the device was active or idle.

  After command completion occurred, registers were:
  ER -- ST COUNT  LBA_48  LH LM LL DV DC
  -- -- -- == -- == == == -- -- -- -- --
  40 -- 41 00 28 00 00 04 14 77 00 40 00  Error: WP at LBA = 0x04147700 = 68450048

  Commands leading to the command that caused the error were:
  CR FEATR COUNT  LBA_48  LH LM LL DV DC  Powered_Up_Time  Command/Feature_Name
  -- == -- == -- == == == -- -- -- -- --  ---------------  --------------------
  61 00 38 00 00 00 00 00 5c 80 b8 40 00     02:28:57.326  WRITE FPDMA QUEUED
  60 00 30 00 38 00 00 04 14 78 c0 40 00     02:28:53.574  READ FPDMA QUEUED
  60 01 00 00 30 00 00 04 14 77 c0 40 00     02:28:53.574  READ FPDMA QUEUED
  60 01 00 00 28 00 00 04 14 76 c0 40 00     02:28:53.574  READ FPDMA QUEUED
  60 01 00 00 20 00 00 04 14 75 c0 40 00     02:28:53.574  READ FPDMA QUEUED

Error 246 [245] occurred at disk power-on lifetime: 8376 hours (349 days + 0 hours)
  When the command that caused the error occurred, the device was active or idle.

  After command completion occurred, registers were:
  ER -- ST COUNT  LBA_48  LH LM LL DV DC
  -- -- -- == -- == == == -- -- -- -- --
  40 -- 41 00 28 00 00 04 14 77 00 40 00  Error: WP at LBA = 0x04147700 = 68450048

  Commands leading to the command that caused the error were:
  CR FEATR COUNT  LBA_48  LH LM LL DV DC  Powered_Up_Time  Command/Feature_Name
  -- == -- == -- == == == -- -- -- -- --  ---------------  --------------------
  61 00 70 00 00 00 00 00 5f f4 40 40 00     02:28:44.354  WRITE FPDMA QUEUED
  60 00 30 00 38 00 00 04 14 78 c0 40 00     02:28:40.621  READ FPDMA QUEUED
  60 01 00 00 30 00 00 04 14 77 c0 40 00     02:28:40.621  READ FPDMA QUEUED
  60 01 00 00 28 00 00 04 14 76 c0 40 00     02:28:40.621  READ FPDMA QUEUED
  60 01 00 00 20 00 00 04 14 75 c0 40 00     02:28:40.621  READ FPDMA QUEUED

Error 245 [244] occurred at disk power-on lifetime: 8376 hours (349 days + 0 hours)
  When the command that caused the error occurred, the device was active or idle.

  After command completion occurred, registers were:
  ER -- ST COUNT  LBA_48  LH LM LL DV DC
  -- -- -- == -- == == == -- -- -- -- --
  40 -- 41 00 28 00 00 04 14 77 00 40 00  Error: WP at LBA = 0x04147700 = 68450048

  Commands leading to the command that caused the error were:
  CR FEATR COUNT  LBA_48  LH LM LL DV DC  Powered_Up_Time  Command/Feature_Name
  -- == -- == -- == == == -- -- -- -- --  ---------------  --------------------
  61 00 a8 00 00 00 00 00 5f f2 b0 40 00     02:28:28.569  WRITE FPDMA QUEUED
  60 00 30 00 38 00 00 04 14 78 c0 40 00     02:28:24.805  READ FPDMA QUEUED
  60 01 00 00 30 00 00 04 14 77 c0 40 00     02:28:24.805  READ FPDMA QUEUED
  60 01 00 00 28 00 00 04 14 76 c0 40 00     02:28:24.805  READ FPDMA QUEUED
  60 01 00 00 20 00 00 04 14 75 c0 40 00     02:28:24.805  READ FPDMA QUEUED

Error 244 [243] occurred at disk power-on lifetime: 8376 hours (349 days + 0 hours)
  When the command that caused the error occurred, the device was active or idle.

  After command completion occurred, registers were:
  ER -- ST COUNT  LBA_48  LH LM LL DV DC
  -- -- -- == -- == == == -- -- -- -- --
  40 -- 41 00 28 00 00 04 14 77 00 40 00  Error: WP at LBA = 0x04147700 = 68450048

  Commands leading to the command that caused the error were:
  CR FEATR COUNT  LBA_48  LH LM LL DV DC  Powered_Up_Time  Command/Feature_Name
  -- == -- == -- == == == -- -- -- -- --  ---------------  --------------------
  61 00 50 00 00 00 00 00 5c 73 e8 40 00     02:27:32.046  WRITE FPDMA QUEUED
  60 00 30 00 38 00 00 04 14 78 c0 40 00     02:27:28.282  READ FPDMA QUEUED
  60 01 00 00 30 00 00 04 14 77 c0 40 00     02:27:28.282  READ FPDMA QUEUED
  60 01 00 00 28 00 00 04 14 76 c0 40 00     02:27:28.282  READ FPDMA QUEUED
  60 01 00 00 20 00 00 04 14 75 c0 40 00     02:27:28.282  READ FPDMA QUEUED

Error 243 [242] occurred at disk power-on lifetime: 8376 hours (349 days + 0 hours)
  When the command that caused the error occurred, the device was active or idle.

  After command completion occurred, registers were:
  ER -- ST COUNT  LBA_48  LH LM LL DV DC
  -- -- -- == -- == == == -- -- -- -- --
  40 -- 41 00 28 00 00 04 14 77 00 40 00  Error: WP at LBA = 0x04147700 = 68450048

  Commands leading to the command that caused the error were:
  CR FEATR COUNT  LBA_48  LH LM LL DV DC  Powered_Up_Time  Command/Feature_Name
  -- == -- == -- == == == -- -- -- -- --  ---------------  --------------------
  61 00 08 00 00 00 00 00 00 0a a0 40 00     02:25:59.261  WRITE FPDMA QUEUED
  60 00 30 00 38 00 00 04 14 78 c0 40 00     02:25:55.470  READ FPDMA QUEUED
  60 01 00 00 30 00 00 04 14 77 c0 40 00     02:25:55.470  READ FPDMA QUEUED
  60 01 00 00 28 00 00 04 14 76 c0 40 00     02:25:55.470  READ FPDMA QUEUED
  60 01 00 00 20 00 00 04 14 75 c0 40 00     02:25:55.470  READ FPDMA QUEUED

Error 242 [241] occurred at disk power-on lifetime: 8329 hours (347 days + 1 hours)
  When the command that caused the error occurred, the device was active or idle.

  After command completion occurred, registers were:
  ER -- ST COUNT  LBA_48  LH LM LL DV DC
  -- -- -- == -- == == == -- -- -- -- --
  40 -- 41 00 28 00 00 04 14 77 00 40 00  Error: WP at LBA = 0x04147700 = 68450048

  Commands leading to the command that caused the error were:
  CR FEATR COUNT  LBA_48  LH LM LL DV DC  Powered_Up_Time  Command/Feature_Name
  -- == -- == -- == == == -- -- -- -- --  ---------------  --------------------
  61 00 08 00 00 00 00 05 9d c9 98 40 00     01:16:23.709  WRITE FPDMA QUEUED
  60 00 30 00 38 00 00 04 14 78 c0 40 00     01:16:19.984  READ FPDMA QUEUED
  60 01 00 00 30 00 00 04 14 77 c0 40 00     01:16:19.984  READ FPDMA QUEUED
  60 01 00 00 28 00 00 04 14 76 c0 40 00     01:16:19.984  READ FPDMA QUEUED
  60 01 00 00 20 00 00 04 14 75 c0 40 00     01:16:19.984  READ FPDMA QUEUED

Error 241 [240] occurred at disk power-on lifetime: 8329 hours (347 days + 1 hours)
  When the command that caused the error occurred, the device was active or idle.

  After command completion occurred, registers were:
  ER -- ST COUNT  LBA_48  LH LM LL DV DC
  -- -- -- == -- == == == -- -- -- -- --
  40 -- 41 00 28 00 00 04 14 77 00 40 00  Error: WP at LBA = 0x04147700 = 68450048

  Commands leading to the command that caused the error were:
  CR FEATR COUNT  LBA_48  LH LM LL DV DC  Powered_Up_Time  Command/Feature_Name
  -- == -- == -- == == == -- -- -- -- --  ---------------  --------------------
  61 00 08 00 00 00 00 05 a0 8c 38 40 00     01:16:03.116  WRITE FPDMA QUEUED
  60 00 30 00 38 00 00 04 14 78 c0 40 00     01:15:59.358  READ FPDMA QUEUED
  60 01 00 00 30 00 00 04 14 77 c0 40 00     01:15:59.358  READ FPDMA QUEUED
  60 01 00 00 28 00 00 04 14 76 c0 40 00     01:15:59.358  READ FPDMA QUEUED
  60 01 00 00 20 00 00 04 14 75 c0 40 00     01:15:59.358  READ FPDMA QUEUED

SMART Extended Self-test Log Version: 1 (1 sectors)
Num  Test_Description    Status                  Remaining  LifeTime(hours)  LBA_of_first_error
# 1  Extended offline    Completed without error       00%      9254         -
# 2  Extended offline    Aborted by host               10%      9150         -
# 3  Extended offline    Completed without error       00%      9111         -
# 4  Short offline       Completed without error       00%      8527         -
# 5  Short offline       Completed without error       00%        28         -

SMART Selective self-test log data structure revision number 1
 SPAN  MIN_LBA  MAX_LBA  CURRENT_TEST_STATUS
    1        0        0  Not_testing
    2        0        0  Not_testing
    3        0        0  Not_testing
    4        0        0  Not_testing
    5        0        0  Not_testing
Selective self-test flags (0x0):
  After scanning selected spans, do NOT read-scan remainder of disk.
If Selective self-test is pending on power-up, resume after 0 minute delay.

SCT Status Version:                  2
SCT Version (vendor specific):       1 (0x0001)
Device State:                        Active (0)
Current Temperature:                    34 Celsius
Power Cycle Min/Max Temperature:     34/34 Celsius
Lifetime    Min/Max Temperature:     -3/45 Celsius
Under/Over Temperature Limit Count:   1/0

SCT Temperature History Version:     2
Temperature Sampling Period:         1 minute
Temperature Logging Interval:        1 minute
Min/Max recommended Temperature:      0/60 Celsius
Min/Max Temperature Limit:            0/60 Celsius
Temperature History Size (Index):    478 (421)

SCT Error Recovery Control:
           Read: Disabled
          Write: Disabled

Device Statistics (GP Log 0x04)
Page  Offset Size        Value Flags Description
0x01  =====  =               =  ===  == General Statistics (rev 2) ==
0x01  0x008  4            4973  ---  Lifetime Power-On Resets
0x01  0x010  4            9327  ---  Power-on Hours
0x01  0x018  6     20843207108  ---  Logical Sectors Written
0x01  0x020  6       285978476  ---  Number of Write Commands
0x01  0x028  6     30994045545  ---  Logical Sectors Read
0x01  0x030  6       387955980  ---  Number of Read Commands
0x02  =====  =               =  ===  == Free-Fall Statistics (rev 1) ==
0x02  0x010  4            1979  ---  Overlimit Shock Events
0x03  =====  =               =  ===  == Rotating Media Statistics (rev 1) ==
0x03  0x008  4            9024  ---  Spindle Motor Power-on Hours
0x03  0x010  4            9182  ---  Head Flying Hours
0x03  0x018  4           78502  ---  Head Load Events
0x03  0x020  4               0  ---  Number of Reallocated Logical Sectors
0x03  0x028  4               0  ---  Read Recovery Attempts
0x03  0x030  4               0  ---  Number of Mechanical Start Failures
0x04  =====  =               =  ===  == General Errors Statistics (rev 1) ==
0x04  0x008  4             248  ---  Number of Reported Uncorrectable Errors
0x04  0x010  4               1  ---  Resets Between Cmd Acceptance and Completion
0x05  =====  =               =  ===  == Temperature Statistics (rev 1) ==
0x05  0x008  1              34  ---  Current Temperature
0x05  0x010  1              38  N--  Average Short Term Temperature
0x05  0x018  1              31  N--  Average Long Term Temperature
0x05  0x020  1              45  ---  Highest Temperature
0x05  0x028  1              -3  ---  Lowest Temperature
0x05  0x030  1              39  N--  Highest Average Short Term Temperature
0x05  0x038  1              22  N--  Lowest Average Short Term Temperature
0x05  0x040  1              34  N--  Highest Average Long Term Temperature
0x05  0x048  1              30  N--  Lowest Average Long Term Temperature
0x05  0x050  4               0  ---  Time in Over-Temperature
0x05  0x058  1              60  ---  Specified Maximum Operating Temperature
0x05  0x060  4               6  ---  Time in Under-Temperature
0x05  0x068  1               0  ---  Specified Minimum Operating Temperature
0x06  =====  =               =  ===  == Transport Statistics (rev 1) ==
0x06  0x008  4            1092  ---  Number of Hardware Resets
0x06  0x018  4               0  ---  Number of Interface CRC Errors
0x07  =====  =               =  ===  == Solid State Device Statistics (rev 1) ==
0x07  0x008  1              15  N--  Percentage Used Endurance Indicator
                                |||_ C monitored condition met
                                ||__ D supports DSN
                                |___ N normalized value

Pending Defects log (GP Log 0x0c) not supported

SATA Phy Event Counters (GP Log 0x11)
ID      Size     Value  Description
0x0001  4            0  Command failed due to ICRC error
0x0002  4            0  R_ERR response for data FIS
0x0003  4            0  R_ERR response for device-to-host data FIS
0x0004  4            0  R_ERR response for host-to-device data FIS
0x0005  4            0  R_ERR response for non-data FIS
0x0006  4            0  R_ERR response for device-to-host non-data FIS
0x0007  4            0  R_ERR response for host-to-device non-data FIS
0x0008  4            0  Device-to-host non-data FIS retries
0x0009  4            2  Transition from drive PhyRdy to drive PhyNRdy
0x000a  4            2  Device-to-host register FISes sent due to a COMRESET
0x000b  4            0  CRC errors within host-to-device FIS
0x000d  4            0  Non-CRC errors within host-to-device FIS
0x000f  4            0  R_ERR response for host-to-device data FIS, CRC
0x0010  4            0  R_ERR response for host-to-device data FIS, non-CRC
0x0012  4            0  R_ERR response for host-to-device non-data FIS, CRC
0x0013  4            0  R_ERR response for host-to-device non-data FIS, non-CRC

