smartctl 7.1 2019-12-30 r5022 [x86_64-linux-4.15.0-desktop-68.5rosa-x86_64] (local build)
Copyright (C) 2002-19, Bruce Allen, Christian Franke, www.smartmontools.org

=== START OF INFORMATION SECTION ===
Model Family:     Toshiba 2.5" HDD MQ01ABF...
Device Model:     TOSHIBA MQ01ABF050
Serial Number:    --
LU WWN Device Id: 5 000039 ...
Firmware Version: AM001A
User Capacity:    500,107,862,016 bytes [500 GB]
Sector Sizes:     512 bytes logical, 4096 bytes physical
Rotation Rate:    5400 rpm
Form Factor:      2.5 inches
Device is:        In smartctl database [for details use: -P show]
ATA Version is:   ATA8-ACS (minor revision not indicated)
SATA Version is:  SATA 2.6, 3.0 Gb/s (current: 3.0 Gb/s)
Local Time is:    Sat Feb 29 19:51:50 2020 MSK
SMART support is: Available - device has SMART capability.
SMART support is: Enabled
AAM feature is:   Unavailable
APM level is:     128 (minimum power consumption without standby)
Rd look-ahead is: Enabled
Write cache is:   Enabled
DSN feature is:   Unavailable
ATA Security is:  Disabled, frozen [SEC2]
Wt Cache Reorder: Enabled

=== START OF READ SMART DATA SECTION ===
SMART overall-health self-assessment test result: PASSED

General SMART Values:
Offline data collection status:  (0x82)	Offline data collection activity
					was completed without error.
					Auto Offline Data Collection: Enabled.
Self-test execution status:      (   0)	The previous self-test routine completed
					without error or no self-test has ever 
					been run.
Total time to complete Offline 
data collection: 		(  120) seconds.
Offline data collection
capabilities: 			 (0x5b) SMART execute Offline immediate.
					Auto Offline data collection on/off support.
					Suspend Offline collection upon new
					command.
					Offline surface scan supported.
					Self-test supported.
					No Conveyance Self-test supported.
					Selective Self-test supported.
SMART capabilities:            (0x0003)	Saves SMART data before entering
					power-saving mode.
					Supports SMART auto save timer.
Error logging capability:        (0x01)	Error logging supported.
					General Purpose Logging supported.
Short self-test routine 
recommended polling time: 	 (   2) minutes.
Extended self-test routine
recommended polling time: 	 ( 122) minutes.
SCT capabilities: 	       (0x003d)	SCT Status supported.
					SCT Error Recovery Control supported.
					SCT Feature Control supported.
					SCT Data Table supported.

SMART Attributes Data Structure revision number: 16
Vendor Specific SMART Attributes with Thresholds:
ID# ATTRIBUTE_NAME          FLAGS    VALUE WORST THRESH FAIL RAW_VALUE
  1 Raw_Read_Error_Rate     PO-R--   100   100   050    -    0
  2 Throughput_Performance  P-S---   100   100   050    -    0
  3 Spin_Up_Time            POS--K   100   100   001    -    1314
  4 Start_Stop_Count        -O--CK   100   100   000    -    10698
  5 Reallocated_Sector_Ct   PO--CK   100   100   050    -    0
  7 Seek_Error_Rate         PO-R--   100   100   050    -    0
  8 Seek_Time_Performance   P-S---   100   100   050    -    0
  9 Power_On_Hours          -O--CK   061   061   000    -    15769
 10 Spin_Retry_Count        PO--CK   253   100   030    -    0
 12 Power_Cycle_Count       -O--CK   100   100   000    -    9332
191 G-Sense_Error_Rate      -O--CK   100   100   000    -    4382
192 Power-Off_Retract_Count -O--CK   100   100   000    -    266
193 Load_Cycle_Count        -O--CK   080   080   000    -    201348
194 Temperature_Celsius     -O---K   100   100   000    -    33 (Min/Max 11/58)
196 Reallocated_Event_Count -O--CK   100   100   000    -    0
197 Current_Pending_Sector  -O--CK   100   100   000    -    0
198 Offline_Uncorrectable   ----CK   100   100   000    -    0
199 UDMA_CRC_Error_Count    -O--CK   200   200   000    -    2
220 Disk_Shift              -O----   100   100   000    -    0
222 Loaded_Hours            -O--CK   064   064   000    -    14532
223 Load_Retry_Count        -O--CK   100   100   000    -    0
224 Load_Friction           -O---K   100   100   000    -    0
226 Load-in_Time            -OS--K   100   100   000    -    262
240 Head_Flying_Hours       P-----   100   100   001    -    0
                            ||||||_ K auto-keep
                            |||||__ C event count
                            ||||___ R error rate
                            |||____ S speed/performance
                            ||_____ O updated online
                            |______ P prefailure warning

General Purpose Log Directory Version 1
SMART           Log Directory Version 1 [multi-sector log support]
Address    Access  R/W   Size  Description
0x00       GPL,SL  R/O      1  Log Directory
0x01           SL  R/O      1  Summary SMART error log
0x02           SL  R/O     51  Comprehensive SMART error log
0x03       GPL     R/O     64  Ext. Comprehensive SMART error log
0x04       GPL,SL  R/O      8  Device Statistics log
0x06           SL  R/O      1  SMART self-test log
0x07       GPL     R/O      1  Extended self-test log
0x09           SL  R/W      1  Selective self-test log
0x10       GPL     R/O      1  NCQ Command Error log
0x11       GPL     R/O      1  SATA Phy Event Counters log
0x80-0x9f  GPL,SL  R/W     16  Host vendor specific log
0xe0       GPL,SL  R/W      1  SCT Command/Status
0xe1       GPL,SL  R/W      1  SCT Data Transfer

SMART Extended Comprehensive Error Log Version: 1 (64 sectors)
Device Error Count: 308 (device log contains only the most recent 256 errors)
	CR     = Command Register
	FEATR  = Features Register
	COUNT  = Count (was: Sector Count) Register
	LBA_48 = Upper bytes of LBA High/Mid/Low Registers ]  ATA-8
	LH     = LBA High (was: Cylinder High) Register    ]   LBA
	LM     = LBA Mid (was: Cylinder Low) Register      ] Register
	LL     = LBA Low (was: Sector Number) Register     ]
	DV     = Device (was: Device/Head) Register
	DC     = Device Control Register
	ER     = Error register
	ST     = Status register
Powered_Up_Time is measured from power on, and printed as
DDd+hh:mm:SS.sss where DD=days, hh=hours, mm=minutes,
SS=sec, and sss=millisec. It "wraps" after 49.710 days.

Error 308 [51] occurred at disk power-on lifetime: 15249 hours (635 days + 9 hours)
  When the command that caused the error occurred, the device was active or idle.

  After command completion occurred, registers were:
  ER -- ST COUNT  LBA_48  LH LM LL DV DC
  -- -- -- == -- == == == -- -- -- -- --
  84 -- 51 00 70 00 00 32 c5 f9 a0 e0 00  Error: ICRC, ABRT 112 sectors at LBA = 0x32c5f9a0 = 851835296

  Commands leading to the command that caused the error were:
  CR FEATR COUNT  LBA_48  LH LM LL DV DC  Powered_Up_Time  Command/Feature_Name
  -- == -- == -- == == == -- -- -- -- --  ---------------  --------------------
  25 00 00 01 00 00 00 32 c5 f9 10 e0 00     01:56:38.239  READ DMA EXT
  25 00 00 01 00 00 00 32 c5 f8 10 e0 00     01:56:38.238  READ DMA EXT
  25 00 00 01 00 00 00 32 c5 f7 10 e0 00     01:56:38.236  READ DMA EXT
  25 00 00 01 00 00 00 32 c5 f6 10 e0 00     01:56:38.234  READ DMA EXT
  25 00 00 01 00 00 00 32 c5 f5 10 e0 00     01:56:38.233  READ DMA EXT

Error 307 [50] occurred at disk power-on lifetime: 15247 hours (635 days + 7 hours)
  When the command that caused the error occurred, the device was active or idle.

  After command completion occurred, registers were:
  ER -- ST COUNT  LBA_48  LH LM LL DV DC
  -- -- -- == -- == == == -- -- -- -- --
  84 -- 50 00 c0 00 00 15 bb c6 50 e0 00   192 sectors at LBA = 0x15bbc650 = 364627536

  Commands leading to the command that caused the error were:
  CR FEATR COUNT  LBA_48  LH LM LL DV DC  Powered_Up_Time  Command/Feature_Name
  -- == -- == -- == == == -- -- -- -- --  ---------------  --------------------
  25 00 00 01 00 00 00 15 bb c6 10 e0 00     00:32:09.751  READ DMA EXT
  25 00 00 01 00 00 00 15 bb c5 10 e0 00     00:32:09.749  READ DMA EXT
  25 00 00 01 00 00 00 15 bb c4 10 e0 00     00:32:09.747  READ DMA EXT
  25 00 00 01 00 00 00 15 bb c3 10 e0 00     00:32:09.745  READ DMA EXT
  25 00 00 01 00 00 00 15 bb c2 10 e0 00     00:32:09.743  READ DMA EXT

Error 306 [49] occurred at disk power-on lifetime: 13744 hours (572 days + 16 hours)
  When the command that caused the error occurred, the device was active or idle.

  After command completion occurred, registers were:
  ER -- ST COUNT  LBA_48  LH LM LL DV DC
  -- -- -- == -- == == == -- -- -- -- --
  40 -- 41 00 00 00 00 00 75 da c8 40 00  Error: WP at LBA = 0x0075dac8 = 7723720

  Commands leading to the command that caused the error were:
  CR FEATR COUNT  LBA_48  LH LM LL DV DC  Powered_Up_Time  Command/Feature_Name
  -- == -- == -- == == == -- -- -- -- --  ---------------  --------------------
  61 00 08 00 10 00 00 00 6c 17 70 40 00     00:05:22.194  WRITE FPDMA QUEUED
  61 00 10 00 10 00 00 00 6c 1a 70 40 00     00:05:22.194  WRITE FPDMA QUEUED
  61 00 08 00 10 00 00 00 53 dd e8 40 00     00:05:21.912  WRITE FPDMA QUEUED
  61 00 08 00 10 00 00 00 53 e1 e0 40 00     00:05:21.272  WRITE FPDMA QUEUED
  60 00 05 00 08 00 00 00 2a 18 e0 40 00     00:05:21.194  READ FPDMA QUEUED

Error 305 [48] occurred at disk power-on lifetime: 13744 hours (572 days + 16 hours)
  When the command that caused the error occurred, the device was active or idle.

  After command completion occurred, registers were:
  ER -- ST COUNT  LBA_48  LH LM LL DV DC
  -- -- -- == -- == == == -- -- -- -- --
  40 -- 41 00 00 00 00 00 75 da c8 40 00  Error: WP at LBA = 0x0075dac8 = 7723720

  Commands leading to the command that caused the error were:
  CR FEATR COUNT  LBA_48  LH LM LL DV DC  Powered_Up_Time  Command/Feature_Name
  -- == -- == -- == == == -- -- -- -- --  ---------------  --------------------
  61 00 08 00 08 00 00 00 53 e1 80 40 00     00:05:20.396  WRITE FPDMA QUEUED
  61 00 08 00 08 00 00 00 53 e1 20 40 00     00:05:19.755  WRITE FPDMA QUEUED
  60 00 03 00 08 00 00 00 2a 18 da 40 00     00:05:19.193  READ FPDMA QUEUED
  61 00 10 00 08 00 00 00 53 e1 00 40 00     00:05:19.115  WRITE FPDMA QUEUED
  61 00 08 00 08 00 00 00 53 e0 e0 40 00     00:05:18.474  WRITE FPDMA QUEUED

Error 304 [47] occurred at disk power-on lifetime: 13744 hours (572 days + 16 hours)
  When the command that caused the error occurred, the device was active or idle.

  After command completion occurred, registers were:
  ER -- ST COUNT  LBA_48  LH LM LL DV DC
  -- -- -- == -- == == == -- -- -- -- --
  40 -- 41 00 00 00 00 00 75 da c8 40 00  Error: WP at LBA = 0x0075dac8 = 7723720

  Commands leading to the command that caused the error were:
  CR FEATR COUNT  LBA_48  LH LM LL DV DC  Powered_Up_Time  Command/Feature_Name
  -- == -- == -- == == == -- -- -- -- --  ---------------  --------------------
  61 00 10 00 18 00 00 00 6c 17 f0 40 00     00:05:14.815  WRITE FPDMA QUEUED
  61 00 08 00 18 00 00 00 53 e0 80 40 00     00:05:14.815  WRITE FPDMA QUEUED
  60 00 08 00 10 00 00 00 51 4d b8 40 00     00:05:14.346  READ FPDMA QUEUED
  60 00 02 00 08 00 00 00 2a 18 e7 40 00     00:05:14.346  READ FPDMA QUEUED
  61 00 10 00 10 00 00 00 53 e0 58 40 00     00:05:14.174  WRITE FPDMA QUEUED

Error 303 [46] occurred at disk power-on lifetime: 13744 hours (572 days + 16 hours)
  When the command that caused the error occurred, the device was active or idle.

  After command completion occurred, registers were:
  ER -- ST COUNT  LBA_48  LH LM LL DV DC
  -- -- -- == -- == == == -- -- -- -- --
  40 -- 41 00 08 00 00 00 75 da c8 40 00  Error: WP at LBA = 0x0075dac8 = 7723720

  Commands leading to the command that caused the error were:
  CR FEATR COUNT  LBA_48  LH LM LL DV DC  Powered_Up_Time  Command/Feature_Name
  -- == -- == -- == == == -- -- -- -- --  ---------------  --------------------
  61 00 08 00 00 00 00 00 53 e0 18 40 00     00:05:13.534  WRITE FPDMA QUEUED
  61 00 10 00 00 00 00 00 53 e0 00 40 00     00:05:12.893  WRITE FPDMA QUEUED
  60 00 01 00 30 00 00 00 57 88 48 40 00     00:05:12.346  READ FPDMA QUEUED
  60 00 05 00 28 00 00 00 57 88 43 40 00     00:05:12.346  READ FPDMA QUEUED
  60 00 0a 00 20 00 00 00 57 88 39 40 00     00:05:12.346  READ FPDMA QUEUED

Error 302 [45] occurred at disk power-on lifetime: 13744 hours (572 days + 16 hours)
  When the command that caused the error occurred, the device was active or idle.

  After command completion occurred, registers were:
  ER -- ST COUNT  LBA_48  LH LM LL DV DC
  -- -- -- == -- == == == -- -- -- -- --
  40 -- 41 00 00 00 00 00 75 da c8 40 00  Error: WP at LBA = 0x0075dac8 = 7723720

  Commands leading to the command that caused the error were:
  CR FEATR COUNT  LBA_48  LH LM LL DV DC  Powered_Up_Time  Command/Feature_Name
  -- == -- == -- == == == -- -- -- -- --  ---------------  --------------------
  61 00 08 00 08 00 00 00 6c 17 70 40 00     00:05:08.205  WRITE FPDMA QUEUED
  61 00 28 00 08 00 00 00 6c 1a 48 40 00     00:05:08.205  WRITE FPDMA QUEUED
  61 00 08 00 08 00 00 00 53 dd d0 40 00     00:05:07.923  WRITE FPDMA QUEUED
  61 00 08 00 08 00 00 00 53 dd 90 40 00     00:05:07.282  WRITE FPDMA QUEUED
  60 00 80 00 00 00 00 00 75 da c8 40 00     00:05:06.925  READ FPDMA QUEUED

Error 301 [44] occurred at disk power-on lifetime: 13744 hours (572 days + 16 hours)
  When the command that caused the error occurred, the device was active or idle.

  After command completion occurred, registers were:
  ER -- ST COUNT  LBA_48  LH LM LL DV DC
  -- -- -- == -- == == == -- -- -- -- --
  40 -- 41 00 08 00 00 00 75 da c8 40 00  Error: WP at LBA = 0x0075dac8 = 7723720

  Commands leading to the command that caused the error were:
  CR FEATR COUNT  LBA_48  LH LM LL DV DC  Powered_Up_Time  Command/Feature_Name
  -- == -- == -- == == == -- -- -- -- --  ---------------  --------------------
  61 00 08 00 10 00 00 00 51 b7 f8 40 00     00:05:04.969  WRITE FPDMA QUEUED
  61 00 08 00 10 00 00 00 51 b7 c8 40 00     00:05:04.328  WRITE FPDMA QUEUED
  61 00 28 00 10 00 00 00 51 b7 88 40 00     00:05:03.688  WRITE FPDMA QUEUED
  61 00 08 00 10 00 00 00 70 8d 80 40 00     00:05:03.203  WRITE FPDMA QUEUED
  61 00 08 00 10 00 00 00 51 b7 60 40 00     00:05:03.047  WRITE FPDMA QUEUED

SMART Extended Self-test Log Version: 1 (1 sectors)
No self-tests have been logged.  [To run self-tests, use: smartctl -t]

SMART Selective self-test log data structure revision number 1
 SPAN  MIN_LBA  MAX_LBA  CURRENT_TEST_STATUS
    1        0        0  Not_testing
    2        0        0  Not_testing
    3        0        0  Not_testing
    4        0        0  Not_testing
    5        0        0  Not_testing
Selective self-test flags (0x0):
  After scanning selected spans, do NOT read-scan remainder of disk.
If Selective self-test is pending on power-up, resume after 0 minute delay.

SCT Status Version:                  2
SCT Version (vendor specific):       1 (0x0001)
Device State:                        Active (0)
Current Temperature:                    33 Celsius
Power Cycle Min/Max Temperature:     21/33 Celsius
Lifetime    Min/Max Temperature:     11/58 Celsius
Under/Over Temperature Limit Count:   0/414

SCT Temperature History Version:     2
Temperature Sampling Period:         1 minute
Temperature Logging Interval:        1 minute
Min/Max recommended Temperature:      5/55 Celsius
Min/Max Temperature Limit:            5/55 Celsius
Temperature History Size (Index):    478 (458)

SCT Error Recovery Control:
           Read: Disabled
          Write: Disabled

Device Statistics (GP Log 0x04)
Page  Offset Size        Value Flags Description
0x01  =====  =               =  ===  == General Statistics (rev 2) ==
0x01  0x008  4            9332  ---  Lifetime Power-On Resets
0x01  0x010  4           15769  ---  Power-on Hours
0x01  0x018  6     63156779976  ---  Logical Sectors Written
0x01  0x020  6      1432816017  ---  Number of Write Commands
0x01  0x028  6     78740140638  ---  Logical Sectors Read
0x01  0x030  6      1430478918  ---  Number of Read Commands
0x02  =====  =               =  ===  == Free-Fall Statistics (rev 1) ==
0x02  0x010  4            4382  ---  Overlimit Shock Events
0x03  =====  =               =  ===  == Rotating Media Statistics (rev 1) ==
0x03  0x008  4            1647  ---  Spindle Motor Power-on Hours
0x03  0x010  4           14532  ---  Head Flying Hours
0x03  0x018  4          201348  ---  Head Load Events
0x03  0x020  4               8  ---  Number of Reallocated Logical Sectors
0x03  0x028  4               0  ---  Read Recovery Attempts
0x03  0x030  4               0  ---  Number of Mechanical Start Failures
0x04  =====  =               =  ===  == General Errors Statistics (rev 1) ==
0x04  0x008  4             292  ---  Number of Reported Uncorrectable Errors
0x04  0x010  4               5  ---  Resets Between Cmd Acceptance and Completion
0x05  =====  =               =  ===  == Temperature Statistics (rev 1) ==
0x05  0x008  1              33  ---  Current Temperature
0x05  0x010  1              35  N--  Average Short Term Temperature
0x05  0x018  1              37  N--  Average Long Term Temperature
0x05  0x020  1              58  ---  Highest Temperature
0x05  0x028  1              11  ---  Lowest Temperature
0x05  0x030  1              47  N--  Highest Average Short Term Temperature
0x05  0x038  1              30  N--  Lowest Average Short Term Temperature
0x05  0x040  1              40  N--  Highest Average Long Term Temperature
0x05  0x048  1              34  N--  Lowest Average Long Term Temperature
0x05  0x050  4            1337  ---  Time in Over-Temperature
0x05  0x058  1              55  ---  Specified Maximum Operating Temperature
0x05  0x060  4               0  ---  Time in Under-Temperature
0x05  0x068  1               5  ---  Specified Minimum Operating Temperature
0x06  =====  =               =  ===  == Transport Statistics (rev 1) ==
0x06  0x008  4           10400  ---  Number of Hardware Resets
0x06  0x018  4               2  ---  Number of Interface CRC Errors
0x07  =====  =               =  ===  == Solid State Device Statistics (rev 1) ==
0x07  0x008  1              26  N--  Percentage Used Endurance Indicator
                                |||_ C monitored condition met
                                ||__ D supports DSN
                                |___ N normalized value

Pending Defects log (GP Log 0x0c) not supported

SATA Phy Event Counters (GP Log 0x11)
ID      Size     Value  Description
0x0001  4            0  Command failed due to ICRC error
0x0002  4            0  R_ERR response for data FIS
0x0003  4            0  R_ERR response for device-to-host data FIS
0x0004  4            0  R_ERR response for host-to-device data FIS
0x0005  4            0  R_ERR response for non-data FIS
0x0006  4            0  R_ERR response for device-to-host non-data FIS
0x0007  4            0  R_ERR response for host-to-device non-data FIS
0x0008  4            0  Device-to-host non-data FIS retries
0x0009  4            4  Transition from drive PhyRdy to drive PhyNRdy
0x000a  4            2  Device-to-host register FISes sent due to a COMRESET
0x000b  4            0  CRC errors within host-to-device FIS
0x000d  4            0  Non-CRC errors within host-to-device FIS
0x000f  4            0  R_ERR response for host-to-device data FIS, CRC
0x0010  4            0  R_ERR response for host-to-device data FIS, non-CRC
0x0012  4            0  R_ERR response for host-to-device non-data FIS, CRC
0x0013  4            0  R_ERR response for host-to-device non-data FIS, non-CRC

