smartctl 7.2 2020-12-30 r5155 [x86_64-linux-5.10.14-desktop-1omv4002] (OpenMandriva Lx 7.2-2)
Copyright (C) 2002-20, Bruce Allen, Christian Franke, www.smartmontools.org

=== START OF INFORMATION SECTION ===
Model Family:     Toshiba 2.5" HDD MQ01ABF...
Device Model:     TOSHIBA MQ01ABF050
Serial Number:    --
LU WWN Device Id: 5 000039 ...
Firmware Version: AM003M
User Capacity:    500,107,862,016 bytes [500 GB]
Sector Size:      512 bytes logical/physical
Rotation Rate:    5400 rpm
Form Factor:      2.5 inches
Device is:        In smartctl database [for details use: -P show]
ATA Version is:   ATA8-ACS (minor revision not indicated)
SATA Version is:  SATA 2.6, 3.0 Gb/s (current: 3.0 Gb/s)
Local Time is:    Tue May 25 07:57:02 2021 CET
SMART support is: Available - device has SMART capability.
SMART support is: Enabled
AAM feature is:   Unavailable
APM level is:     128 (minimum power consumption without standby)
Rd look-ahead is: Enabled
Write cache is:   Enabled
DSN feature is:   Unavailable
ATA Security is:  Disabled, frozen [SEC2]
Wt Cache Reorder: Enabled

=== START OF READ SMART DATA SECTION ===
SMART overall-health self-assessment test result: PASSED

General SMART Values:
Offline data collection status:  (0x85)	Offline data collection activity
					was aborted by an interrupting command from host.
					Auto Offline Data Collection: Enabled.
Self-test execution status:      (   0)	The previous self-test routine completed
					without error or no self-test has ever 
					been run.
Total time to complete Offline 
data collection: 		(  120) seconds.
Offline data collection
capabilities: 			 (0x5b) SMART execute Offline immediate.
					Auto Offline data collection on/off support.
					Suspend Offline collection upon new
					command.
					Offline surface scan supported.
					Self-test supported.
					No Conveyance Self-test supported.
					Selective Self-test supported.
SMART capabilities:            (0x0003)	Saves SMART data before entering
					power-saving mode.
					Supports SMART auto save timer.
Error logging capability:        (0x01)	Error logging supported.
					General Purpose Logging supported.
Short self-test routine 
recommended polling time: 	 (   2) minutes.
Extended self-test routine
recommended polling time: 	 ( 117) minutes.
SCT capabilities: 	       (0x003d)	SCT Status supported.
					SCT Error Recovery Control supported.
					SCT Feature Control supported.
					SCT Data Table supported.

SMART Attributes Data Structure revision number: 16
Vendor Specific SMART Attributes with Thresholds:
ID# ATTRIBUTE_NAME          FLAGS    VALUE WORST THRESH FAIL RAW_VALUE
  1 Raw_Read_Error_Rate     PO-R--   100   100   050    -    0
  2 Throughput_Performance  P-S---   100   100   050    -    0
  3 Spin_Up_Time            POS--K   100   100   001    -    1316
  4 Start_Stop_Count        -O--CK   100   100   000    -    22256
  5 Reallocated_Sector_Ct   PO--CK   100   100   050    -    0
  7 Seek_Error_Rate         PO-R--   100   100   050    -    0
  8 Seek_Time_Performance   P-S---   100   100   050    -    0
  9 Power_On_Hours          -O--CK   059   059   000    -    16556
 10 Spin_Retry_Count        PO--CK   253   100   030    -    0
 12 Power_Cycle_Count       -O--CK   100   100   000    -    9081
191 G-Sense_Error_Rate      -O--CK   100   100   000    -    350
192 Power-Off_Retract_Count -O--CK   099   099   000    -    530
193 Load_Cycle_Count        -O--CK   095   095   000    -    57843
194 Temperature_Celsius     -O---K   100   100   000    -    40 (Min/Max 9/56)
196 Reallocated_Event_Count -O--CK   100   100   000    -    0
197 Current_Pending_Sector  -O--CK   100   100   000    -    0
198 Offline_Uncorrectable   ----CK   100   100   000    -    0
199 UDMA_CRC_Error_Count    -O--CK   200   200   000    -    0
220 Disk_Shift              -O----   100   100   000    -    0
222 Loaded_Hours            -O--CK   060   060   000    -    16262
223 Load_Retry_Count        -O--CK   100   100   000    -    0
224 Load_Friction           -O---K   100   100   000    -    0
226 Load-in_Time            -OS--K   100   100   000    -    172
240 Head_Flying_Hours       P-----   100   100   001    -    0
                            ||||||_ K auto-keep
                            |||||__ C event count
                            ||||___ R error rate
                            |||____ S speed/performance
                            ||_____ O updated online
                            |______ P prefailure warning

General Purpose Log Directory Version 1
SMART           Log Directory Version 1 [multi-sector log support]
Address    Access  R/W   Size  Description
0x00       GPL,SL  R/O      1  Log Directory
0x01           SL  R/O      1  Summary SMART error log
0x02           SL  R/O     51  Comprehensive SMART error log
0x03       GPL     R/O     64  Ext. Comprehensive SMART error log
0x04       GPL,SL  R/O      8  Device Statistics log
0x06           SL  R/O      1  SMART self-test log
0x07       GPL     R/O      1  Extended self-test log
0x09           SL  R/W      1  Selective self-test log
0x10       GPL     R/O      1  NCQ Command Error log
0x11       GPL     R/O      1  SATA Phy Event Counters log
0x80-0x9f  GPL,SL  R/W     16  Host vendor specific log
0xe0       GPL,SL  R/W      1  SCT Command/Status
0xe1       GPL,SL  R/W      1  SCT Data Transfer

SMART Extended Comprehensive Error Log Version: 1 (64 sectors)
Device Error Count: 11
	CR     = Command Register
	FEATR  = Features Register
	COUNT  = Count (was: Sector Count) Register
	LBA_48 = Upper bytes of LBA High/Mid/Low Registers ]  ATA-8
	LH     = LBA High (was: Cylinder High) Register    ]   LBA
	LM     = LBA Mid (was: Cylinder Low) Register      ] Register
	LL     = LBA Low (was: Sector Number) Register     ]
	DV     = Device (was: Device/Head) Register
	DC     = Device Control Register
	ER     = Error register
	ST     = Status register
Powered_Up_Time is measured from power on, and printed as
DDd+hh:mm:SS.sss where DD=days, hh=hours, mm=minutes,
SS=sec, and sss=millisec. It "wraps" after 49.710 days.

Error 11 [10] occurred at disk power-on lifetime: 14714 hours (613 days + 2 hours)
  When the command that caused the error occurred, the device was active or idle.

  After command completion occurred, registers were:
  ER -- ST COUNT  LBA_48  LH LM LL DV DC
  -- -- -- == -- == == == -- -- -- -- --
  40 -- 41 00 f0 00 00 0f 01 b2 b8 40 00  Error: WP at LBA = 0x0f01b2b8 = 251769528

  Commands leading to the command that caused the error were:
  CR FEATR COUNT  LBA_48  LH LM LL DV DC  Powered_Up_Time  Command/Feature_Name
  -- == -- == -- == == == -- -- -- -- --  ---------------  --------------------
  61 01 00 00 08 00 00 07 6f 62 88 40 00     03:51:29.777  WRITE FPDMA QUEUED
  61 01 00 00 e8 00 00 07 65 fd 90 40 00     03:51:29.777  WRITE FPDMA QUEUED
  61 01 00 00 e0 00 00 07 6f 61 88 40 00     03:51:29.777  WRITE FPDMA QUEUED
  61 01 00 00 d8 00 00 07 65 fc 90 40 00     03:51:29.777  WRITE FPDMA QUEUED
  61 01 00 00 d0 00 00 07 65 cf 20 40 00     03:51:29.777  WRITE FPDMA QUEUED

Error 10 [9] occurred at disk power-on lifetime: 14714 hours (613 days + 2 hours)
  When the command that caused the error occurred, the device was active or idle.

  After command completion occurred, registers were:
  ER -- ST COUNT  LBA_48  LH LM LL DV DC
  -- -- -- == -- == == == -- -- -- -- --
  40 -- 41 00 f0 00 00 0f 01 b2 b8 40 00  Error: UNC at LBA = 0x0f01b2b8 = 251769528

  Commands leading to the command that caused the error were:
  CR FEATR COUNT  LBA_48  LH LM LL DV DC  Powered_Up_Time  Command/Feature_Name
  -- == -- == -- == == == -- -- -- -- --  ---------------  --------------------
  60 00 03 00 f8 00 00 02 ca 21 c8 40 00     03:51:29.462  READ FPDMA QUEUED
  60 00 01 00 f0 00 00 0f 01 b2 b8 40 00     03:51:25.751  READ FPDMA QUEUED
  60 00 01 00 e8 00 00 0f 01 b2 b7 40 00     03:51:25.751  READ FPDMA QUEUED
  60 00 01 00 e0 00 00 0f 01 b2 b6 40 00     03:51:25.751  READ FPDMA QUEUED
  60 00 01 00 d8 00 00 0f 01 b2 b5 40 00     03:51:25.751  READ FPDMA QUEUED

Error 9 [8] occurred at disk power-on lifetime: 14714 hours (613 days + 2 hours)
  When the command that caused the error occurred, the device was active or idle.

  After command completion occurred, registers were:
  ER -- ST COUNT  LBA_48  LH LM LL DV DC
  -- -- -- == -- == == == -- -- -- -- --
  40 -- 41 00 98 00 00 0f 01 b2 b8 40 00  Error: WP at LBA = 0x0f01b2b8 = 251769528

  Commands leading to the command that caused the error were:
  CR FEATR COUNT  LBA_48  LH LM LL DV DC  Powered_Up_Time  Command/Feature_Name
  -- == -- == -- == == == -- -- -- -- --  ---------------  --------------------
  61 00 08 00 b8 00 00 03 3a 42 70 40 00     03:51:24.003  WRITE FPDMA QUEUED
  61 00 0e 00 b0 00 00 07 70 00 08 40 00     03:51:20.153  WRITE FPDMA QUEUED
  60 00 9e 00 a8 00 00 0f 01 b3 d4 40 00     03:51:20.153  READ FPDMA QUEUED
  60 01 00 00 a0 00 00 0f 01 b2 d4 40 00     03:51:20.153  READ FPDMA QUEUED
  60 01 00 00 98 00 00 0f 01 b1 d4 40 00     03:51:20.153  READ FPDMA QUEUED

Error 8 [7] occurred at disk power-on lifetime: 14710 hours (612 days + 22 hours)
  When the command that caused the error occurred, the device was active or idle.

  After command completion occurred, registers were:
  ER -- ST COUNT  LBA_48  LH LM LL DV DC
  -- -- -- == -- == == == -- -- -- -- --
  40 -- 41 00 d8 00 00 0f 01 b2 b8 40 00  Error: UNC at LBA = 0x0f01b2b8 = 251769528

  Commands leading to the command that caused the error were:
  CR FEATR COUNT  LBA_48  LH LM LL DV DC  Powered_Up_Time  Command/Feature_Name
  -- == -- == -- == == == -- -- -- -- --  ---------------  --------------------
  60 00 3f 00 d8 00 00 0f 01 b2 98 40 00     06:02:36.057  READ FPDMA QUEUED
  60 00 3f 00 d0 00 00 0f 01 b2 59 40 00     06:02:36.057  READ FPDMA QUEUED
  60 00 3f 00 c8 00 00 0f 01 b2 1a 40 00     06:02:36.056  READ FPDMA QUEUED
  60 00 3f 00 c0 00 00 0f 01 b1 db 40 00     06:02:36.056  READ FPDMA QUEUED
  60 00 3f 00 b8 00 00 0f 01 b1 9c 40 00     06:02:36.056  READ FPDMA QUEUED

Error 7 [6] occurred at disk power-on lifetime: 14710 hours (612 days + 22 hours)
  When the command that caused the error occurred, the device was active or idle.

  After command completion occurred, registers were:
  ER -- ST COUNT  LBA_48  LH LM LL DV DC
  -- -- -- == -- == == == -- -- -- -- --
  40 -- 41 00 60 00 00 0f 01 b2 b8 40 00  Error: UNC at LBA = 0x0f01b2b8 = 251769528

  Commands leading to the command that caused the error were:
  CR FEATR COUNT  LBA_48  LH LM LL DV DC  Powered_Up_Time  Command/Feature_Name
  -- == -- == -- == == == -- -- -- -- --  ---------------  --------------------
  60 01 00 00 68 00 00 0f 01 b3 00 40 00     06:02:30.163  READ FPDMA QUEUED
  60 01 00 00 60 00 00 0f 01 b2 00 40 00     06:02:30.163  READ FPDMA QUEUED
  60 01 00 00 58 00 00 0f 01 b1 00 40 00     06:02:30.163  READ FPDMA QUEUED
  60 01 00 00 50 00 00 0f 01 b0 00 40 00     06:02:30.163  READ FPDMA QUEUED
  60 01 00 00 48 00 00 0f 01 af 00 40 00     06:02:30.157  READ FPDMA QUEUED

Error 6 [5] occurred at disk power-on lifetime: 14570 hours (607 days + 2 hours)
  When the command that caused the error occurred, the device was active or idle.

  After command completion occurred, registers were:
  ER -- ST COUNT  LBA_48  LH LM LL DV DC
  -- -- -- == -- == == == -- -- -- -- --
  40 -- 41 00 40 00 00 0f 01 b2 c0 40 00  Error: WP at LBA = 0x0f01b2c0 = 251769536

  Commands leading to the command that caused the error were:
  CR FEATR COUNT  LBA_48  LH LM LL DV DC  Powered_Up_Time  Command/Feature_Name
  -- == -- == -- == == == -- -- -- -- --  ---------------  --------------------
  61 00 08 00 50 00 00 00 5f 7a d8 40 00     02:30:23.703  WRITE FPDMA QUEUED
  61 00 08 00 48 00 00 00 62 e5 28 40 00     02:30:23.703  WRITE FPDMA QUEUED
  60 00 08 00 40 00 00 0f 01 b2 c0 40 00     02:30:23.703  READ FPDMA QUEUED
  61 00 18 00 38 00 00 00 5f 81 08 40 00     02:30:23.703  WRITE FPDMA QUEUED
  2f 00 00 00 01 00 00 00 00 00 10 e0 00     02:30:23.702  READ LOG EXT

Error 5 [4] occurred at disk power-on lifetime: 14570 hours (607 days + 2 hours)
  When the command that caused the error occurred, the device was active or idle.

  After command completion occurred, registers were:
  ER -- ST COUNT  LBA_48  LH LM LL DV DC
  -- -- -- == -- == == == -- -- -- -- --
  40 -- 41 00 28 00 00 0f 01 b2 c0 40 00  Error: WP at LBA = 0x0f01b2c0 = 251769536

  Commands leading to the command that caused the error were:
  CR FEATR COUNT  LBA_48  LH LM LL DV DC  Powered_Up_Time  Command/Feature_Name
  -- == -- == -- == == == -- -- -- -- --  ---------------  --------------------
  61 00 10 00 30 00 00 00 62 e5 10 40 00     02:30:20.437  WRITE FPDMA QUEUED
  60 00 80 00 28 00 00 0f 01 b2 c0 40 00     02:30:19.944  READ FPDMA QUEUED
  60 00 08 00 20 00 00 0f 03 c2 38 40 00     02:30:19.939  READ FPDMA QUEUED
  60 00 70 00 18 00 00 0f 01 b2 48 40 00     02:30:19.939  READ FPDMA QUEUED
  60 00 80 00 10 00 00 0f 01 b1 c8 40 00     02:30:19.938  READ FPDMA QUEUED

Error 4 [3] occurred at disk power-on lifetime: 14570 hours (607 days + 2 hours)
  When the command that caused the error occurred, the device was active or idle.

  After command completion occurred, registers were:
  ER -- ST COUNT  LBA_48  LH LM LL DV DC
  -- -- -- == -- == == == -- -- -- -- --
  40 -- 41 00 d0 00 00 0f 01 b2 b8 40 00  Error: WP at LBA = 0x0f01b2b8 = 251769528

  Commands leading to the command that caused the error were:
  CR FEATR COUNT  LBA_48  LH LM LL DV DC  Powered_Up_Time  Command/Feature_Name
  -- == -- == -- == == == -- -- -- -- --  ---------------  --------------------
  61 00 08 00 d8 00 00 00 62 e4 a0 40 00     02:30:19.762  WRITE FPDMA QUEUED
  60 00 08 00 d0 00 00 0f 01 b2 b8 40 00     02:30:16.030  READ FPDMA QUEUED
  60 00 08 00 c8 00 00 0f 01 b2 b0 40 00     02:30:16.030  READ FPDMA QUEUED
  60 00 08 00 c0 00 00 0f 01 b2 a8 40 00     02:30:16.030  READ FPDMA QUEUED
  60 00 08 00 b8 00 00 0f 01 b2 a0 40 00     02:30:16.029  READ FPDMA QUEUED

SMART Extended Self-test Log Version: 1 (1 sectors)
Num  Test_Description    Status                  Remaining  LifeTime(hours)  LBA_of_first_error
# 1  Short offline       Completed without error       00%     16300         -
# 2  Short offline       Completed without error       00%     15498         -

SMART Selective self-test log data structure revision number 1
 SPAN  MIN_LBA  MAX_LBA  CURRENT_TEST_STATUS
    1        0        0  Not_testing
    2        0        0  Not_testing
    3        0        0  Not_testing
    4        0        0  Not_testing
    5        0        0  Not_testing
Selective self-test flags (0x0):
  After scanning selected spans, do NOT read-scan remainder of disk.
If Selective self-test is pending on power-up, resume after 0 minute delay.

SCT Status Version:                  2
SCT Version (vendor specific):       1 (0x0001)
Device State:                        Active (0)
Current Temperature:                    40 Celsius
Power Cycle Min/Max Temperature:     24/40 Celsius
Lifetime    Min/Max Temperature:      9/56 Celsius
Under/Over Temperature Limit Count:   0/17

SCT Temperature History Version:     2
Temperature Sampling Period:         1 minute
Temperature Logging Interval:        1 minute
Min/Max recommended Temperature:      5/55 Celsius
Min/Max Temperature Limit:            5/55 Celsius
Temperature History Size (Index):    478 (201)

SCT Error Recovery Control:
           Read: Disabled
          Write: Disabled

Device Statistics (GP Log 0x04)
Page  Offset Size        Value Flags Description
0x01  =====  =               =  ===  == General Statistics (rev 2) ==
0x01  0x008  4            9081  ---  Lifetime Power-On Resets
0x01  0x010  4           16556  ---  Power-on Hours
0x01  0x018  6    118303416228  ---  Logical Sectors Written
0x01  0x020  6      1235835015  ---  Number of Write Commands
0x01  0x028  6    173877072029  ---  Logical Sectors Read
0x01  0x030  6      1981433984  ---  Number of Read Commands
0x02  =====  =               =  ===  == Free-Fall Statistics (rev 1) ==
0x02  0x010  4             350  ---  Overlimit Shock Events
0x03  =====  =               =  ===  == Rotating Media Statistics (rev 1) ==
0x03  0x008  4           12671  ---  Spindle Motor Power-on Hours
0x03  0x010  4           16262  ---  Head Flying Hours
0x03  0x018  4           57843  ---  Head Load Events
0x03  0x020  4              24  ---  Number of Reallocated Logical Sectors
0x03  0x028  4               0  ---  Read Recovery Attempts
0x03  0x030  4               0  ---  Number of Mechanical Start Failures
0x04  =====  =               =  ===  == General Errors Statistics (rev 1) ==
0x04  0x008  4              11  ---  Number of Reported Uncorrectable Errors
0x04  0x010  4              39  ---  Resets Between Cmd Acceptance and Completion
0x05  =====  =               =  ===  == Temperature Statistics (rev 1) ==
0x05  0x008  1              40  ---  Current Temperature
0x05  0x010  1              42  N--  Average Short Term Temperature
0x05  0x018  1              36  N--  Average Long Term Temperature
0x05  0x020  1              56  ---  Highest Temperature
0x05  0x028  1               9  ---  Lowest Temperature
0x05  0x030  1              49  N--  Highest Average Short Term Temperature
0x05  0x038  1              25  N--  Lowest Average Short Term Temperature
0x05  0x040  1              45  N--  Highest Average Long Term Temperature
0x05  0x048  1              29  N--  Lowest Average Long Term Temperature
0x05  0x050  4             161  ---  Time in Over-Temperature
0x05  0x058  1              55  ---  Specified Maximum Operating Temperature
0x05  0x060  4               0  ---  Time in Under-Temperature
0x05  0x068  1               5  ---  Specified Minimum Operating Temperature
0x06  =====  =               =  ===  == Transport Statistics (rev 1) ==
0x06  0x008  4          110724  ---  Number of Hardware Resets
0x06  0x018  4               0  ---  Number of Interface CRC Errors
0x07  =====  =               =  ===  == Solid State Device Statistics (rev 1) ==
0x07  0x008  1              27  N--  Percentage Used Endurance Indicator
                                |||_ C monitored condition met
                                ||__ D supports DSN
                                |___ N normalized value

Pending Defects log (GP Log 0x0c) not supported

SATA Phy Event Counters (GP Log 0x11)
ID      Size     Value  Description
0x0001  4            0  Command failed due to ICRC error
0x0002  4            0  R_ERR response for data FIS
0x0003  4            0  R_ERR response for device-to-host data FIS
0x0004  4            0  R_ERR response for host-to-device data FIS
0x0005  4            0  R_ERR response for non-data FIS
0x0006  4            0  R_ERR response for device-to-host non-data FIS
0x0007  4            0  R_ERR response for host-to-device non-data FIS
0x0008  4            0  Device-to-host non-data FIS retries
0x0009  4        31002  Transition from drive PhyRdy to drive PhyNRdy
0x000a  4           14  Device-to-host register FISes sent due to a COMRESET
0x000b  4            0  CRC errors within host-to-device FIS
0x000d  4            0  Non-CRC errors within host-to-device FIS
0x000f  4            0  R_ERR response for host-to-device data FIS, CRC
0x0010  4            0  R_ERR response for host-to-device data FIS, non-CRC
0x0012  4            0  R_ERR response for host-to-device non-data FIS, CRC
0x0013  4            0  R_ERR response for host-to-device non-data FIS, non-CRC

