smartctl 7.1 2019-12-30 r5022 [x86_64-linux-5.13.0-28-generic] (local build)
Copyright (C) 2002-19, Bruce Allen, Christian Franke, www.smartmontools.org

=== START OF INFORMATION SECTION ===
Model Family:     Western Digital Blue
Device Model:     WDC WD10SPZX-22Z10T0
Serial Number:    --
LU WWN Device Id: 5 0014ee ...
Firmware Version: 01.01A01
User Capacity:    1,000,204,886,016 bytes [1.00 TB]
Sector Sizes:     512 bytes logical, 4096 bytes physical
Rotation Rate:    5400 rpm
Form Factor:      2.5 inches
Device is:        In smartctl database [for details use: -P show]
ATA Version is:   ACS-3 T13/2161-D revision 5
SATA Version is:  SATA 3.1, 6.0 Gb/s (current: 6.0 Gb/s)
Local Time is:    Tue Feb  8 17:12:58 2022 -03
SMART support is: Available - device has SMART capability.
SMART support is: Enabled
AAM feature is:   Unavailable
APM level is:     254 (maximum performance)
Rd look-ahead is: Enabled
Write cache is:   Enabled
DSN feature is:   Unavailable
ATA Security is:  Disabled, frozen [SEC2]
Wt Cache Reorder: Enabled

=== START OF READ SMART DATA SECTION ===
SMART overall-health self-assessment test result: FAILED!
Drive failure expected in less than 24 hours. SAVE ALL DATA.
See vendor-specific Attribute list for failed Attributes.

General SMART Values:
Offline data collection status:  (0x00)	Offline data collection activity
					was never started.
					Auto Offline Data Collection: Disabled.
Self-test execution status:      (   0)	The previous self-test routine completed
					without error or no self-test has ever 
					been run.
Total time to complete Offline 
data collection: 		(  180) seconds.
Offline data collection
capabilities: 			 (0x71) SMART execute Offline immediate.
					No Auto Offline data collection support.
					Suspend Offline collection upon new
					command.
					No Offline surface scan supported.
					Self-test supported.
					Conveyance Self-test supported.
					Selective Self-test supported.
SMART capabilities:            (0x0003)	Saves SMART data before entering
					power-saving mode.
					Supports SMART auto save timer.
Error logging capability:        (0x01)	Error logging supported.
					General Purpose Logging supported.
Short self-test routine 
recommended polling time: 	 (   2) minutes.
Extended self-test routine
recommended polling time: 	 (  66) minutes.
Conveyance self-test routine
recommended polling time: 	 (   1) minutes.
SCT capabilities: 	       (0x3035)	SCT Status supported.
					SCT Feature Control supported.
					SCT Data Table supported.

SMART Attributes Data Structure revision number: 16
Vendor Specific SMART Attributes with Thresholds:
ID# ATTRIBUTE_NAME          FLAGS    VALUE WORST THRESH FAIL RAW_VALUE
  1 Raw_Read_Error_Rate     POSR-K   040   001   051    NOW  6391
  3 Spin_Up_Time            POS--K   195   193   021    -    1208
  4 Start_Stop_Count        -O--CK   100   100   000    -    528
  5 Reallocated_Sector_Ct   PO--CK   200   200   140    -    0
  7 Seek_Error_Rate         -OSR-K   200   200   000    -    0
  9 Power_On_Hours          -O--CK   099   099   000    -    1153
 10 Spin_Retry_Count        -O--CK   100   100   000    -    0
 11 Calibration_Retry_Count -O--CK   100   100   000    -    0
 12 Power_Cycle_Count       -O--CK   100   100   000    -    449
192 Power-Off_Retract_Count -O--CK   200   200   000    -    242
193 Load_Cycle_Count        -O--CK   200   200   000    -    2807
194 Temperature_Celsius     -O---K   108   101   000    -    35
196 Reallocated_Event_Count -O--CK   200   200   000    -    0
197 Current_Pending_Sector  -O--CK   200   200   000    -    22
198 Offline_Uncorrectable   ----CK   100   253   000    -    0
199 UDMA_CRC_Error_Count    -O--CK   200   200   000    -    0
200 Multi_Zone_Error_Rate   ---R--   100   253   000    -    0
                            ||||||_ K auto-keep
                            |||||__ C event count
                            ||||___ R error rate
                            |||____ S speed/performance
                            ||_____ O updated online
                            |______ P prefailure warning

General Purpose Log Directory Version 1
SMART           Log Directory Version 1 [multi-sector log support]
Address    Access  R/W   Size  Description
0x00       GPL,SL  R/O      1  Log Directory
0x01           SL  R/O      1  Summary SMART error log
0x02           SL  R/O      5  Comprehensive SMART error log
0x03       GPL     R/O      6  Ext. Comprehensive SMART error log
0x06           SL  R/O      1  SMART self-test log
0x07       GPL     R/O      1  Extended self-test log
0x09           SL  R/W      1  Selective self-test log
0x10       GPL     R/O      1  NCQ Command Error log
0x11       GPL     R/O      1  SATA Phy Event Counters log
0x24       GPL     R/O    277  Current Device Internal Status Data log
0x30       GPL,SL  R/O      9  IDENTIFY DEVICE data log
0x80-0x9f  GPL,SL  R/W     16  Host vendor specific log
0xa0-0xa7  GPL,SL  VS      16  Device vendor specific log
0xa8-0xb6  GPL,SL  VS       1  Device vendor specific log
0xb7       GPL,SL  VS      74  Device vendor specific log
0xbd       GPL,SL  VS       1  Device vendor specific log
0xc0       GPL,SL  VS       1  Device vendor specific log
0xc1       GPL     VS      93  Device vendor specific log
0xe0       GPL,SL  R/W      1  SCT Command/Status
0xe1       GPL,SL  R/W      1  SCT Data Transfer

SMART Extended Comprehensive Error Log Version: 1 (6 sectors)
Device Error Count: 14328 (device log contains only the most recent 24 errors)
	CR     = Command Register
	FEATR  = Features Register
	COUNT  = Count (was: Sector Count) Register
	LBA_48 = Upper bytes of LBA High/Mid/Low Registers ]  ATA-8
	LH     = LBA High (was: Cylinder High) Register    ]   LBA
	LM     = LBA Mid (was: Cylinder Low) Register      ] Register
	LL     = LBA Low (was: Sector Number) Register     ]
	DV     = Device (was: Device/Head) Register
	DC     = Device Control Register
	ER     = Error register
	ST     = Status register
Powered_Up_Time is measured from power on, and printed as
DDd+hh:mm:SS.sss where DD=days, hh=hours, mm=minutes,
SS=sec, and sss=millisec. It "wraps" after 49.710 days.

Error 14328 [23] occurred at disk power-on lifetime: 362 hours (15 days + 2 hours)
  When the command that caused the error occurred, the device was active or idle.

  After command completion occurred, registers were:
  ER -- ST COUNT  LBA_48  LH LM LL DV DC
  -- -- -- == -- == == == -- -- -- -- --
  40 -- 51 00 00 00 00 00 94 ad 28 40 00  Error: UNC at LBA = 0x0094ad28 = 9743656

  Commands leading to the command that caused the error were:
  CR FEATR COUNT  LBA_48  LH LM LL DV DC  Powered_Up_Time  Command/Feature_Name
  -- == -- == -- == == == -- -- -- -- --  ---------------  --------------------
  60 00 48 00 f0 00 00 00 94 ac f8 40 00     00:55:23.176  READ FPDMA QUEUED
  60 00 80 00 e8 00 00 00 94 ac 78 40 00     00:55:23.175  READ FPDMA QUEUED
  60 00 80 00 e0 00 00 00 94 ab f8 40 00     00:55:23.175  READ FPDMA QUEUED
  60 00 80 00 d8 00 00 00 94 ab 78 40 00     00:55:23.174  READ FPDMA QUEUED
  60 00 60 00 d0 00 00 00 94 ab 18 40 00     00:55:23.174  READ FPDMA QUEUED

Error 14327 [22] occurred at disk power-on lifetime: 362 hours (15 days + 2 hours)
  When the command that caused the error occurred, the device was active or idle.

  After command completion occurred, registers were:
  ER -- ST COUNT  LBA_48  LH LM LL DV DC
  -- -- -- == -- == == == -- -- -- -- --
  40 -- 51 00 00 00 00 00 94 ad 28 40 00  Error: UNC at LBA = 0x0094ad28 = 9743656

  Commands leading to the command that caused the error were:
  CR FEATR COUNT  LBA_48  LH LM LL DV DC  Powered_Up_Time  Command/Feature_Name
  -- == -- == -- == == == -- -- -- -- --  ---------------  --------------------
  60 00 48 00 18 00 00 00 94 ac f8 40 00     00:43:58.533  READ FPDMA QUEUED
  61 00 08 00 10 00 00 03 eb 65 e0 40 00     00:43:58.532  WRITE FPDMA QUEUED
  60 00 80 00 08 00 00 00 94 ac 78 40 00     00:43:58.532  READ FPDMA QUEUED
  60 00 80 00 00 00 00 00 94 ab f8 40 00     00:43:58.532  READ FPDMA QUEUED
  61 00 30 00 f8 00 00 03 eb d5 c0 40 00     00:43:58.531  WRITE FPDMA QUEUED

Error 14326 [21] occurred at disk power-on lifetime: 362 hours (15 days + 2 hours)
  When the command that caused the error occurred, the device was active or idle.

  After command completion occurred, registers were:
  ER -- ST COUNT  LBA_48  LH LM LL DV DC
  -- -- -- == -- == == == -- -- -- -- --
  40 -- 51 00 00 00 00 04 2a 1a 10 40 00  Error: UNC at LBA = 0x042a1a10 = 69868048

  Commands leading to the command that caused the error were:
  CR FEATR COUNT  LBA_48  LH LM LL DV DC  Powered_Up_Time  Command/Feature_Name
  -- == -- == -- == == == -- -- -- -- --  ---------------  --------------------
  60 00 f0 00 f0 00 00 04 2a 1a a8 40 00     00:14:42.088  READ FPDMA QUEUED
  60 01 00 00 e8 00 00 04 2a 19 a8 40 00     00:14:42.088  READ FPDMA QUEUED
  61 00 18 00 e0 00 00 05 81 08 60 40 00     00:14:42.055  WRITE FPDMA QUEUED
  61 00 18 00 d8 00 00 05 81 08 38 40 00     00:14:42.055  WRITE FPDMA QUEUED
  61 00 08 00 d0 00 00 05 81 08 20 40 00     00:14:42.055  WRITE FPDMA QUEUED

Error 14325 [20] occurred at disk power-on lifetime: 362 hours (15 days + 2 hours)
  When the command that caused the error occurred, the device was active or idle.

  After command completion occurred, registers were:
  ER -- ST COUNT  LBA_48  LH LM LL DV DC
  -- -- -- == -- == == == -- -- -- -- --
  40 -- 51 00 00 00 00 04 ba d6 40 40 00  Error: UNC at LBA = 0x04bad640 = 79353408

  Commands leading to the command that caused the error were:
  CR FEATR COUNT  LBA_48  LH LM LL DV DC  Powered_Up_Time  Command/Feature_Name
  -- == -- == -- == == == -- -- -- -- --  ---------------  --------------------
  60 01 00 00 98 00 00 04 ba d7 48 40 00     00:14:39.102  READ FPDMA QUEUED
  60 01 00 00 90 00 00 04 ba d6 48 40 00     00:14:39.102  READ FPDMA QUEUED
  60 01 00 00 88 00 00 04 ba d5 48 40 00     00:14:39.102  READ FPDMA QUEUED
  60 01 00 00 80 00 00 04 ba d4 48 40 00     00:14:39.102  READ FPDMA QUEUED
  60 01 00 00 78 00 00 04 ba d3 48 40 00     00:14:39.102  READ FPDMA QUEUED

Error 14324 [19] occurred at disk power-on lifetime: 362 hours (15 days + 2 hours)
  When the command that caused the error occurred, the device was active or idle.

  After command completion occurred, registers were:
  ER -- ST COUNT  LBA_48  LH LM LL DV DC
  -- -- -- == -- == == == -- -- -- -- --
  40 -- 51 00 00 00 00 0f 89 82 c0 40 00  Error: UNC at LBA = 0x0f8982c0 = 260670144

  Commands leading to the command that caused the error were:
  CR FEATR COUNT  LBA_48  LH LM LL DV DC  Powered_Up_Time  Command/Feature_Name
  -- == -- == -- == == == -- -- -- -- --  ---------------  --------------------
  60 01 00 00 50 00 00 0f 89 89 28 40 00     00:14:36.212  READ FPDMA QUEUED
  60 01 00 00 48 00 00 0f 89 88 28 40 00     00:14:36.212  READ FPDMA QUEUED
  60 01 00 00 40 00 00 0f 89 87 28 40 00     00:14:36.212  READ FPDMA QUEUED
  60 01 00 00 38 00 00 0f 89 86 28 40 00     00:14:36.212  READ FPDMA QUEUED
  60 01 00 00 30 00 00 0f 89 85 28 40 00     00:14:36.212  READ FPDMA QUEUED

Error 14323 [18] occurred at disk power-on lifetime: 362 hours (15 days + 2 hours)
  When the command that caused the error occurred, the device was active or idle.

  After command completion occurred, registers were:
  ER -- ST COUNT  LBA_48  LH LM LL DV DC
  -- -- -- == -- == == == -- -- -- -- --
  40 -- 51 00 00 00 00 10 e9 19 10 40 00  Error: UNC at LBA = 0x10e91910 = 283711760

  Commands leading to the command that caused the error were:
  CR FEATR COUNT  LBA_48  LH LM LL DV DC  Powered_Up_Time  Command/Feature_Name
  -- == -- == -- == == == -- -- -- -- --  ---------------  --------------------
  60 01 00 00 38 00 00 10 e9 1d 00 40 00     00:14:32.476  READ FPDMA QUEUED
  60 01 00 00 30 00 00 10 e9 1c 00 40 00     00:14:32.476  READ FPDMA QUEUED
  60 01 00 00 28 00 00 10 e9 1b 00 40 00     00:14:32.476  READ FPDMA QUEUED
  60 01 00 00 20 00 00 10 e9 1a 00 40 00     00:14:32.476  READ FPDMA QUEUED
  60 01 00 00 18 00 00 10 e9 19 00 40 00     00:14:32.476  READ FPDMA QUEUED

Error 14322 [17] occurred at disk power-on lifetime: 362 hours (15 days + 2 hours)
  When the command that caused the error occurred, the device was active or idle.

  After command completion occurred, registers were:
  ER -- ST COUNT  LBA_48  LH LM LL DV DC
  -- -- -- == -- == == == -- -- -- -- --
  40 -- 51 00 00 00 00 0f 89 82 c0 40 00  Error: UNC at LBA = 0x0f8982c0 = 260670144

  Commands leading to the command that caused the error were:
  CR FEATR COUNT  LBA_48  LH LM LL DV DC  Powered_Up_Time  Command/Feature_Name
  -- == -- == -- == == == -- -- -- -- --  ---------------  --------------------
  60 01 00 00 f0 00 00 0f 89 89 28 40 00     00:14:27.907  READ FPDMA QUEUED
  60 01 00 00 e8 00 00 0f 89 88 28 40 00     00:14:27.907  READ FPDMA QUEUED
  60 01 00 00 e0 00 00 0f 89 87 28 40 00     00:14:27.907  READ FPDMA QUEUED
  60 01 00 00 d8 00 00 0f 89 86 28 40 00     00:14:27.907  READ FPDMA QUEUED
  60 01 00 00 d0 00 00 0f 89 85 28 40 00     00:14:27.907  READ FPDMA QUEUED

Error 14321 [16] occurred at disk power-on lifetime: 362 hours (15 days + 2 hours)
  When the command that caused the error occurred, the device was active or idle.

  After command completion occurred, registers were:
  ER -- ST COUNT  LBA_48  LH LM LL DV DC
  -- -- -- == -- == == == -- -- -- -- --
  40 -- 51 00 00 00 00 04 ba d6 40 40 00  Error: UNC at LBA = 0x04bad640 = 79353408

  Commands leading to the command that caused the error were:
  CR FEATR COUNT  LBA_48  LH LM LL DV DC  Powered_Up_Time  Command/Feature_Name
  -- == -- == -- == == == -- -- -- -- --  ---------------  --------------------
  60 01 00 00 28 00 00 04 ba d7 48 40 00     00:14:24.641  READ FPDMA QUEUED
  60 01 00 00 20 00 00 04 ba d6 48 40 00     00:14:24.641  READ FPDMA QUEUED
  60 01 00 00 18 00 00 04 ba d5 48 40 00     00:14:24.641  READ FPDMA QUEUED
  60 01 00 00 10 00 00 04 ba d4 48 40 00     00:14:24.641  READ FPDMA QUEUED
  60 01 00 00 08 00 00 04 ba d3 48 40 00     00:14:24.641  READ FPDMA QUEUED

SMART Extended Self-test Log Version: 1 (1 sectors)
No self-tests have been logged.  [To run self-tests, use: smartctl -t]

SMART Selective self-test log data structure revision number 1
 SPAN  MIN_LBA  MAX_LBA  CURRENT_TEST_STATUS
    1        0        0  Not_testing
    2        0        0  Not_testing
    3        0        0  Not_testing
    4        0        0  Not_testing
    5        0        0  Not_testing
Selective self-test flags (0x0):
  After scanning selected spans, do NOT read-scan remainder of disk.
If Selective self-test is pending on power-up, resume after 0 minute delay.

SCT Status Version:                  3
SCT Version (vendor specific):       258 (0x0102)
Device State:                        Active (0)
Current Temperature:                    35 Celsius
Power Cycle Min/Max Temperature:     33/35 Celsius
Lifetime    Min/Max Temperature:     22/44 Celsius
Under/Over Temperature Limit Count:   0/0
Vendor specific:
01 00 00 00 00 00 00 00 00 00 00 00 00 00 00 00
00 00 00 00 00 00 00 00 00 00 00 00 00 00 00 00

SCT Temperature History Version:     2
Temperature Sampling Period:         1 minute
Temperature Logging Interval:        1 minute
Min/Max recommended Temperature:      0/60 Celsius
Min/Max Temperature Limit:           -41/85 Celsius
Temperature History Size (Index):    128 (126)

SCT Error Recovery Control command not supported

Device Statistics (GP/SMART Log 0x04) not supported

Pending Defects log (GP Log 0x0c) not supported

SATA Phy Event Counters (GP Log 0x11)
ID      Size     Value  Description
0x0001  2            0  Command failed due to ICRC error
0x0002  2            0  R_ERR response for data FIS
0x0003  2            0  R_ERR response for device-to-host data FIS
0x0004  2            0  R_ERR response for host-to-device data FIS
0x0005  2            0  R_ERR response for non-data FIS
0x0006  2            0  R_ERR response for device-to-host non-data FIS
0x0007  2            0  R_ERR response for host-to-device non-data FIS
0x0008  2            0  Device-to-host non-data FIS retries
0x0009  2           15  Transition from drive PhyRdy to drive PhyNRdy
0x000a  2           20  Device-to-host register FISes sent due to a COMRESET
0x000b  2            0  CRC errors within host-to-device FIS
0x000d  2            0  Non-CRC errors within host-to-device FIS
0x000f  2            0  R_ERR response for host-to-device data FIS, CRC
0x0012  2            0  R_ERR response for host-to-device non-data FIS, CRC
0x8000  4       369224  Vendor specific



