smartctl 7.2 2020-12-30 r5155 [x86_64-linux-5.19.0-42-generic] (local build)
Copyright (C) 2002-20, Bruce Allen, Christian Franke, www.smartmontools.org

=== START OF INFORMATION SECTION ===
Model Number:                       SKHynix_HFS001TD9TNI-L2B0B
Serial Number:                      --
Firmware Version:                   11720C10
PCI Vendor/Subsystem ID:            0x1c5c
IEEE OUI Identifier:                0xace42e
Controller ID:                      1
NVMe Version:                       1.3
Number of Namespaces:               1
Namespace 1 Size/Capacity:          1,024,209,543,168 [1.02 TB]
Namespace 1 Formatted LBA Size:     512
Namespace 1 IEEE EUI-64:            ace42e ...
Local Time is:                      Wed Jun 14 12:55:42 2023 CEST
Firmware Updates (0x16):            3 Slots, no Reset required
Optional Admin Commands (0x0017):   Security Format Frmw_DL Self_Test
Optional NVM Commands (0x005e):     Wr_Unc DS_Mngmt Wr_Zero Sav/Sel_Feat Timestmp
Log Page Attributes (0x0a):         Cmd_Eff_Lg Telmtry_Lg
Maximum Data Transfer Size:         64 Pages
Warning  Comp. Temp. Threshold:     85 Celsius
Critical Comp. Temp. Threshold:     86 Celsius

Supported Power States
St Op     Max   Active     Idle   RL RT WL WT  Ent_Lat  Ex_Lat
 0 +   6.3000W       -        -    0  0  0  0        5       5
 1 +   2.4000W       -        -    1  1  1  1       30      30
 2 +   1.9000W       -        -    2  2  2  2      100     100
 3 -   0.0500W       -        -    3  3  3  3     1000    1000
 4 -   0.0040W       -        -    3  3  3  3     1000    9000

Supported LBA Sizes (NSID 0x1)
Id Fmt  Data  Metadt  Rel_Perf
 0 +     512       0         0

=== START OF SMART DATA SECTION ===
SMART overall-health self-assessment test result: PASSED

SMART/Health Information (NVMe Log 0x02)
Critical Warning:                   0x00
Temperature:                        33 Celsius
Available Spare:                    100%
Available Spare Threshold:          10%
Percentage Used:                    0%
Data Units Read:                    6,274,777 [3.21 TB]
Data Units Written:                 20,856,543 [10.6 TB]
Host Read Commands:                 67,012,640
Host Write Commands:                435,805,198
Controller Busy Time:               178
Power Cycles:                       3,267
Power On Hours:                     7,613
Unsafe Shutdowns:                   75
Media and Data Integrity Errors:    0
Error Information Log Entries:      0
Warning  Comp. Temperature Time:    0
Critical Comp. Temperature Time:    0
Temperature Sensor 1:               33 Celsius
Temperature Sensor 2:               39 Celsius

Error Information (NVMe Log 0x01, 16 of 256 entries)
No Errors Logged

