smartctl 7.3 2022-02-28 r5338 [x86_64-linux-6.0.6-gentoo_ap] (local build)
Copyright (C) 2002-22, Bruce Allen, Christian Franke, www.smartmontools.org

=== START OF INFORMATION SECTION ===
Device Model:     Corsair Neutron GTX SSD
Serial Number:    --
Firmware Version: M206
User Capacity:    240,057,409,536 bytes [240 GB]
Sector Size:      512 bytes logical/physical
Rotation Rate:    Solid State Device
TRIM Command:     Available
Device is:        Not in smartctl database 7.3/5364
ATA Version is:   ATA8-ACS (minor revision not indicated)
SATA Version is:  SATA 2.5, 6.0 Gb/s
Local Time is:    Tue Nov  1 05:43:12 2022 MSK
SMART support is: Available - device has SMART capability.
SMART support is: Enabled
AAM feature is:   Unavailable
APM feature is:   Unavailable
Rd look-ahead is: Disabled
Write cache is:   Enabled
DSN feature is:   Unavailable
ATA Security is:  Disabled, frozen [SEC2]
Wt Cache Reorder: Unavailable

=== START OF READ SMART DATA SECTION ===
SMART overall-health self-assessment test result: PASSED

General SMART Values:
Offline data collection status:  (0x02)	Offline data collection activity
					was completed without error.
					Auto Offline Data Collection: Disabled.
Self-test execution status:      (   0)	The previous self-test routine completed
					without error or no self-test has ever 
					been run.
Total time to complete Offline 
data collection: 		(  243) seconds.
Offline data collection
capabilities: 			 (0x1d) SMART execute Offline immediate.
					No Auto Offline data collection support.
					Abort Offline collection upon new
					command.
					Offline surface scan supported.
					Self-test supported.
					No Conveyance Self-test supported.
					No Selective Self-test supported.
SMART capabilities:            (0x0002)	Does not save SMART data before
					entering power-saving mode.
					Supports SMART auto save timer.
Error logging capability:        (0x01)	Error logging supported.
					No General Purpose Logging support.
Short self-test routine 
recommended polling time: 	 (   1) minutes.
Extended self-test routine
recommended polling time: 	 (   5) minutes.

SMART Attributes Data Structure revision number: 0
Vendor Specific SMART Attributes with Thresholds:
ID# ATTRIBUTE_NAME          FLAGS    VALUE WORST THRESH FAIL RAW_VALUE
  1 Raw_Read_Error_Rate     -OSR-K   166   030   006    -    0
  5 Reallocated_Sector_Ct   -O--CK   098   098   036    -    231
  9 Power_On_Hours          -O--CK   011   011   000    -    78851
 12 Power_Cycle_Count       -O--CK   100   100   020    -    1019
171 Unknown_Attribute       -O--CK   253   253   000    -    0
172 Unknown_Attribute       -O--CK   100   100   000    -    1
181 Program_Fail_Cnt_Total  -O--CK   253   253   000    -    0
182 Erase_Fail_Count_Total  -O--CK   100   100   000    -    1
194 Temperature_Celsius     -O----   036   000   000    -    36 (Min/Max 18/54)
201 Unknown_SSD_Attribute   -O--CK   100   100   000    -    0
204 Soft_ECC_Correction     -O--CK   100   100   000    -    0
231 Unknown_SSD_Attribute   -O--CK   089   089   000    -    12
234 Unknown_Attribute       -O--CK   100   100   000    -    291037
241 Total_LBAs_Written      -O--CK   100   100   000    -    91138
242 Total_LBAs_Read         -O--CK   100   100   000    -    79971
250 Read_Error_Retry_Rate   -O--CK   100   100   000    -    140103
                            ||||||_ K auto-keep
                            |||||__ C event count
                            ||||___ R error rate
                            |||____ S speed/performance
                            ||_____ O updated online
                            |______ P prefailure warning

General Purpose Log Directory not supported

SMART Log Directory Version 1 [multi-sector log support]
Address    Access  R/W   Size  Description
0x00           SL  R/O      1  Log Directory
0x01           SL  R/O      1  Summary SMART error log
0x02           SL  R/O      4  Comprehensive SMART error log
0x03           SL  R/O      5  Ext. Comprehensive SMART error log

SMART Extended Comprehensive Error Log (GP Log 0x03) not supported

SMART Error Log Version: 1
Warning: ATA error count 65535 inconsistent with error log pointer 3

ATA Error Count: 65535 (device log contains only the most recent five errors)
	CR = Command Register [HEX]
	FR = Features Register [HEX]
	SC = Sector Count Register [HEX]
	SN = Sector Number Register [HEX]
	CL = Cylinder Low Register [HEX]
	CH = Cylinder High Register [HEX]
	DH = Device/Head Register [HEX]
	DC = Device Command Register [HEX]
	ER = Error register [HEX]
	ST = Status register [HEX]
Powered_Up_Time is measured from power on, and printed as
DDd+hh:mm:SS.sss where DD=days, hh=hours, mm=minutes,
SS=sec, and sss=millisec. It "wraps" after 49.710 days.

Error 65535 occurred at disk power-on lifetime: 13300 hours (554 days + 4 hours)
  When the command that caused the error occurred, the device was in an unknown state.

  After command completion occurred, registers were:
  ER ST SC SN CL CH DH
  -- -- -- -- -- -- --
  01 50 01 01 00 00 00

  Commands leading to the command that caused the error were:
  CR FR SC SN CL CH DH DC   Powered_Up_Time  Command/Feature_Name
  -- -- -- -- -- -- -- --  ----------------  --------------------
  00 00 00 00 00 00 a0 a0   2d+06:37:48.180  NOP [Abort queued commands]
  00 00 00 00 00 00 a0 a0   2d+06:37:48.180  NOP [Abort queued commands]
  25 00 40 00 08 00 40 40   2d+06:37:46.690  READ DMA EXT
  25 00 40 00 00 00 40 40   2d+06:37:46.690  READ DMA EXT
  ec 00 00 00 00 00 00 00   2d+06:37:42.430  IDENTIFY DEVICE

Error 65534 occurred at disk power-on lifetime: 13300 hours (554 days + 4 hours)
  When the command that caused the error occurred, the device was in an unknown state.

  After command completion occurred, registers were:
  ER ST SC SN CL CH DH
  -- -- -- -- -- -- --
  00 00 00 00 00 00 00   at LBA = 0x00000000 = 0

  Commands leading to the command that caused the error were:
  CR FR SC SN CL CH DH DC   Powered_Up_Time  Command/Feature_Name
  -- -- -- -- -- -- -- --  ----------------  --------------------
  25 00 40 00 08 00 40 40   2d+06:37:46.690  READ DMA EXT
  25 00 40 00 00 00 40 40   2d+06:37:46.690  READ DMA EXT
  ec 00 00 00 00 00 00 00   2d+06:37:42.430  IDENTIFY DEVICE
  ec 00 00 00 00 00 00 00   2d+06:37:42.230  IDENTIFY DEVICE
  ec 00 00 00 00 00 00 00   2d+06:37:38.560  IDENTIFY DEVICE

Error 65533 occurred at disk power-on lifetime: 13300 hours (554 days + 4 hours)
  When the command that caused the error occurred, the device was in an unknown state.

  After command completion occurred, registers were:
  ER ST SC SN CL CH DH
  -- -- -- -- -- -- --
  00 00 00 00 00 00 00

  Commands leading to the command that caused the error were:
  CR FR SC SN CL CH DH DC   Powered_Up_Time  Command/Feature_Name
  -- -- -- -- -- -- -- --  ----------------  --------------------
  ea 00 00 00 00 00 a0 a0   2d+06:37:29.310  FLUSH CACHE EXT
  61 02 f0 5e 6a fc 40 40   2d+06:37:29.310  WRITE FPDMA QUEUED
  ea 00 00 00 00 00 a0 a0   2d+06:37:29.310  FLUSH CACHE EXT
  61 01 78 00 08 00 40 40   2d+06:37:29.310  WRITE FPDMA QUEUED
  ea 00 00 00 00 00 a0 a0   2d+06:37:29.310  FLUSH CACHE EXT

Error 65532 occurred at disk power-on lifetime: 13300 hours (554 days + 4 hours)
  When the command that caused the error occurred, the device was in an unknown state.

  After command completion occurred, registers were:
  ER ST SC SN CL CH DH
  -- -- -- -- -- -- --
  00 00 00 00 00 00 00

  Commands leading to the command that caused the error were:
  CR FR SC SN CL CH DH DC   Powered_Up_Time  Command/Feature_Name
  -- -- -- -- -- -- -- --  ----------------  --------------------
  ea 00 00 00 00 00 a0 a0   2d+06:37:29.310  FLUSH CACHE EXT
  61 02 f0 5e 6a fc 40 40   2d+06:37:29.310  WRITE FPDMA QUEUED
  ea 00 00 00 00 00 a0 a0   2d+06:37:29.310  FLUSH CACHE EXT
  61 01 78 00 08 00 40 40   2d+06:37:29.310  WRITE FPDMA QUEUED
  ea 00 00 00 00 00 a0 a0   2d+06:37:29.310  FLUSH CACHE EXT

Error 65531 occurred at disk power-on lifetime: 13290 hours (553 days + 18 hours)
  When the command that caused the error occurred, the device was in an unknown state.

  After command completion occurred, registers were:
  ER ST SC SN CL CH DH
  -- -- -- -- -- -- --
  01 50 01 01 00 00 00

  Commands leading to the command that caused the error were:
  CR FR SC SN CL CH DH DC   Powered_Up_Time  Command/Feature_Name
  -- -- -- -- -- -- -- --  ----------------  --------------------
  00 00 00 00 00 00 a0 a0   1d+21:02:05.630  NOP [Abort queued commands]
  00 00 00 00 00 00 a0 a0   1d+21:02:05.630  NOP [Abort queued commands]
  25 00 40 00 08 00 40 40   1d+21:02:04.150  READ DMA EXT
  25 00 40 00 00 00 40 40   1d+21:02:04.150  READ DMA EXT
  ec 00 00 00 00 00 00 00   1d+21:02:00.930  IDENTIFY DEVICE

SMART Extended Self-test Log (GP Log 0x07) not supported

Read SMART Self-test Log failed: scsi error badly formed scsi parameters

Selective Self-tests/Logging not supported

SCT Commands not supported

Device Statistics (GP/SMART Log 0x04) not supported

Pending Defects log (GP Log 0x0c) not supported

SATA Phy Event Counters (GP Log 0x11)
ID      Size     Value  Description
0x0001  2            0  Command failed due to ICRC error
0x0002  2            0  R_ERR response for data FIS
0x0003  2            0  R_ERR response for device-to-host data FIS
0x0004  2            0  R_ERR response for host-to-device data FIS
0x0005  2            0  R_ERR response for non-data FIS
0x0006  2            0  R_ERR response for device-to-host non-data FIS
0x0007  2            0  R_ERR response for host-to-device non-data FIS
0x0008  2            0  Device-to-host non-data FIS retries
0x0009  2            0  Transition from drive PhyRdy to drive PhyNRdy
0x000a  2         1245  Device-to-host register FISes sent due to a COMRESET
0x000b  2            0  CRC errors within host-to-device FIS
0x000d  2            0  Non-CRC errors within host-to-device FIS
0x000f  2            0  R_ERR response for host-to-device data FIS, CRC
0x0010  2            0  R_ERR response for host-to-device data FIS, non-CRC
0x0012  2            0  R_ERR response for host-to-device non-data FIS, CRC
0x0013  2            0  R_ERR response for host-to-device non-data FIS, non-CRC

