smartctl 7.3 2022-02-28 r5338 [x86_64-linux-5.10.118-generic-2rosa2021.1-x86_64] (local build)
Copyright (C) 2002-22, Bruce Allen, Christian Franke, www.smartmontools.org

=== START OF INFORMATION SECTION ===
Model Family:     Seagate Momentus 5400.6
Device Model:     ST9320325AS
Serial Number:    --
LU WWN Device Id: 5 000c50 ...
Firmware Version: 0003SDM1
User Capacity:    320,072,933,376 bytes [320 GB]
Sector Size:      512 bytes logical/physical
Rotation Rate:    5400 rpm
Device is:        In smartctl database 7.3/5319
ATA Version is:   ATA8-ACS T13/1699-D revision 4
SATA Version is:  SATA 2.6, 3.0 Gb/s
Local Time is:    Wed Jul 20 10:16:42 2022 +05
SMART support is: Available - device has SMART capability.
SMART support is: Enabled
AAM feature is:   Unavailable
APM level is:     128 (minimum power consumption without standby)
Rd look-ahead is: Enabled
Write cache is:   Enabled
DSN feature is:   Unavailable
ATA Security is:  Disabled, frozen [SEC2]
Wt Cache Reorder: Unknown

=== START OF READ SMART DATA SECTION ===
SMART overall-health self-assessment test result: PASSED

General SMART Values:
Offline data collection status:  (0x00)	Offline data collection activity
					was never started.
					Auto Offline Data Collection: Disabled.
Self-test execution status:      (   0)	The previous self-test routine completed
					without error or no self-test has ever 
					been run.
Total time to complete Offline 
data collection: 		(    0) seconds.
Offline data collection
capabilities: 			 (0x73) SMART execute Offline immediate.
					Auto Offline data collection on/off support.
					Suspend Offline collection upon new
					command.
					No Offline surface scan supported.
					Self-test supported.
					Conveyance Self-test supported.
					Selective Self-test supported.
SMART capabilities:            (0x0003)	Saves SMART data before entering
					power-saving mode.
					Supports SMART auto save timer.
Error logging capability:        (0x01)	Error logging supported.
					General Purpose Logging supported.
Short self-test routine 
recommended polling time: 	 (   1) minutes.
Extended self-test routine
recommended polling time: 	 (  96) minutes.
Conveyance self-test routine
recommended polling time: 	 (   2) minutes.
SCT capabilities: 	       (0x103b)	SCT Status supported.
					SCT Error Recovery Control supported.
					SCT Feature Control supported.
					SCT Data Table supported.

SMART Attributes Data Structure revision number: 10
Vendor Specific SMART Attributes with Thresholds:
ID# ATTRIBUTE_NAME          FLAGS    VALUE WORST THRESH FAIL RAW_VALUE
  1 Raw_Read_Error_Rate     POSR--   117   070   006    -    122428955
  3 Spin_Up_Time            PO----   099   098   000    -    0
  4 Start_Stop_Count        -O--CK   090   090   020    -    10465
  5 Reallocated_Sector_Ct   PO--CK   100   100   036    -    2
  7 Seek_Error_Rate         POSR--   088   060   030    -    732369924
  9 Power_On_Hours          -O--CK   062   062   000    -    33787
 10 Spin_Retry_Count        PO--C-   100   100   097    -    0
 12 Power_Cycle_Count       -O--CK   090   090   020    -    10429
184 End-to-End_Error        -O--CK   100   100   099    -    0
187 Reported_Uncorrect      -O--CK   001   001   000    -    51303
188 Command_Timeout         -O--CK   100   094   000    -    611
189 High_Fly_Writes         -O-RCK   100   100   000    -    0
190 Airflow_Temperature_Cel -O---K   069   048   045    -    31 (Min/Max 27/36)
191 G-Sense_Error_Rate      -O--CK   100   100   000    -    263
192 Power-Off_Retract_Count -O--CK   100   100   000    -    363
193 Load_Cycle_Count        -O--CK   001   001   000    -    355509
194 Temperature_Celsius     -O---K   031   052   000    -    31 (0 15 0 0 0)
195 Hardware_ECC_Recovered  -O-RC-   059   036   000    -    122428955
197 Current_Pending_Sector  -O--C-   100   100   000    -    0
198 Offline_Uncorrectable   ----C-   100   100   000    -    0
199 UDMA_CRC_Error_Count    -OSRCK   200   200   000    -    0
254 Free_Fall_Sensor        -O--CK   100   100   000    -    0
                            ||||||_ K auto-keep
                            |||||__ C event count
                            ||||___ R error rate
                            |||____ S speed/performance
                            ||_____ O updated online
                            |______ P prefailure warning

General Purpose Log Directory Version 1
SMART           Log Directory Version 1 [multi-sector log support]
Address    Access  R/W   Size  Description
0x00       GPL,SL  R/O      1  Log Directory
0x01       GPL,SL  R/O      1  Summary SMART error log
0x02       GPL,SL  R/O      5  Comprehensive SMART error log
0x03       GPL,SL  R/O      5  Ext. Comprehensive SMART error log
0x06       GPL,SL  R/O      1  SMART self-test log
0x07       GPL,SL  R/O      1  Extended self-test log
0x09       GPL,SL  R/W      1  Selective self-test log
0x10       GPL,SL  R/O      1  NCQ Command Error log
0x11       GPL,SL  R/O      1  SATA Phy Event Counters log
0x21       GPL,SL  R/O      1  Write stream error log
0x22       GPL,SL  R/O      1  Read stream error log
0x80-0x9f  GPL,SL  R/W     16  Host vendor specific log
0xa1       GPL,SL  VS      20  Device vendor specific log
0xa2       GPL     VS    2248  Device vendor specific log
0xa8       GPL,SL  VS      65  Device vendor specific log
0xa9       GPL,SL  VS       1  Device vendor specific log
0xb0       GPL     VS    2864  Device vendor specific log
0xbe-0xbf  GPL     VS   65535  Device vendor specific log
0xe0       GPL,SL  R/W      1  SCT Command/Status
0xe1       GPL,SL  R/W      1  SCT Data Transfer

SMART Extended Comprehensive Error Log Version: 1 (5 sectors)
Device Error Count: 54376 (device log contains only the most recent 20 errors)
	CR     = Command Register
	FEATR  = Features Register
	COUNT  = Count (was: Sector Count) Register
	LBA_48 = Upper bytes of LBA High/Mid/Low Registers ]  ATA-8
	LH     = LBA High (was: Cylinder High) Register    ]   LBA
	LM     = LBA Mid (was: Cylinder Low) Register      ] Register
	LL     = LBA Low (was: Sector Number) Register     ]
	DV     = Device (was: Device/Head) Register
	DC     = Device Control Register
	ER     = Error register
	ST     = Status register
Powered_Up_Time is measured from power on, and printed as
DDd+hh:mm:SS.sss where DD=days, hh=hours, mm=minutes,
SS=sec, and sss=millisec. It "wraps" after 49.710 days.

Error 54376 [15] occurred at disk power-on lifetime: 31809 hours (1325 days + 9 hours)
  When the command that caused the error occurred, the device was active or idle.

  After command completion occurred, registers were:
  ER -- ST COUNT  LBA_48  LH LM LL DV DC
  -- -- -- == -- == == == -- -- -- -- --
  40 -- 51 00 00 00 fa 00 a8 00 94 00 00  Error: UNC at LBA = 0xfa00a80094 = 1073752834196

  Commands leading to the command that caused the error were:
  CR FEATR COUNT  LBA_48  LH LM LL DV DC  Powered_Up_Time  Command/Feature_Name
  -- == -- == -- == == == -- -- -- -- --  ---------------  --------------------
  60 00 00 01 00 00 83 00 a8 02 50 40 00     00:07:45.516  READ FPDMA QUEUED
  61 00 00 00 01 00 14 00 ac 00 f9 40 00     00:07:45.509  WRITE FPDMA QUEUED
  60 00 00 01 00 00 83 00 a7 02 50 40 00     00:07:45.509  READ FPDMA QUEUED
  61 00 00 00 01 00 14 00 ac 00 f8 40 00     00:07:45.508  WRITE FPDMA QUEUED
  60 00 00 00 20 00 60 00 54 00 80 40 00     00:07:45.507  READ FPDMA QUEUED

Error 54375 [14] occurred at disk power-on lifetime: 31809 hours (1325 days + 9 hours)
  When the command that caused the error occurred, the device was active or idle.

  After command completion occurred, registers were:
  ER -- ST COUNT  LBA_48  LH LM LL DV DC
  -- -- -- == -- == == == -- -- -- -- --
  40 -- 51 00 00 00 fa 00 a8 00 94 00 00  Error: UNC at LBA = 0xfa00a80094 = 1073752834196

  Commands leading to the command that caused the error were:
  CR FEATR COUNT  LBA_48  LH LM LL DV DC  Powered_Up_Time  Command/Feature_Name
  -- == -- == -- == == == -- -- -- -- --  ---------------  --------------------
  60 00 00 00 08 00 23 00 99 13 40 40 00     00:07:42.929  READ FPDMA QUEUED
  60 00 00 00 08 00 fc 00 4c 12 48 40 00     00:07:42.926  READ FPDMA QUEUED
  60 00 00 00 20 00 60 00 54 00 60 40 00     00:07:42.917  READ FPDMA QUEUED
  61 00 00 00 08 00 5e 00 dd 00 70 40 00     00:07:42.916  WRITE FPDMA QUEUED
  60 00 00 00 20 00 03 00 30 00 20 40 00     00:07:42.916  READ FPDMA QUEUED

Error 54374 [13] occurred at disk power-on lifetime: 31809 hours (1325 days + 9 hours)
  When the command that caused the error occurred, the device was active or idle.

  After command completion occurred, registers were:
  ER -- ST COUNT  LBA_48  LH LM LL DV DC
  -- -- -- == -- == == == -- -- -- -- --
  40 -- 51 00 00 00 fa 00 a8 00 94 00 00  Error: UNC at LBA = 0xfa00a80094 = 1073752834196

  Commands leading to the command that caused the error were:
  CR FEATR COUNT  LBA_48  LH LM LL DV DC  Powered_Up_Time  Command/Feature_Name
  -- == -- == -- == == == -- -- -- -- --  ---------------  --------------------
  60 00 00 00 0c 00 4f 00 53 00 c2 40 00     00:07:40.359  READ FPDMA QUEUED
  60 00 00 01 00 00 83 00 a3 02 50 40 00     00:07:40.336  READ FPDMA QUEUED
  60 00 00 00 08 00 07 00 7e 00 10 40 00     00:07:40.321  READ FPDMA QUEUED
  60 00 00 00 08 00 4f 00 51 00 e0 40 00     00:07:40.320  READ FPDMA QUEUED
  60 00 00 00 30 00 d6 00 13 02 6a 40 00     00:07:40.319  READ FPDMA QUEUED

Error 54373 [12] occurred at disk power-on lifetime: 31809 hours (1325 days + 9 hours)
  When the command that caused the error occurred, the device was active or idle.

  After command completion occurred, registers were:
  ER -- ST COUNT  LBA_48  LH LM LL DV DC
  -- -- -- == -- == == == -- -- -- -- --
  40 -- 51 00 00 00 fa 00 a8 00 94 00 00  Error: UNC at LBA = 0xfa00a80094 = 1073752834196

  Commands leading to the command that caused the error were:
  CR FEATR COUNT  LBA_48  LH LM LL DV DC  Powered_Up_Time  Command/Feature_Name
  -- == -- == -- == == == -- -- -- -- --  ---------------  --------------------
  60 00 00 00 20 00 60 00 54 00 40 40 00     00:07:35.519  READ FPDMA QUEUED
  61 00 00 00 18 00 b4 00 cb 00 f0 40 00     00:07:35.517  WRITE FPDMA QUEUED
  61 00 00 00 20 00 23 00 98 13 e0 40 00     00:07:35.517  WRITE FPDMA QUEUED
  61 00 00 00 40 00 23 00 b5 13 c0 40 00     00:07:35.516  WRITE FPDMA QUEUED
  60 00 00 00 20 00 fa 00 a8 00 80 40 00     00:07:35.460  READ FPDMA QUEUED

Error 54372 [11] occurred at disk power-on lifetime: 31809 hours (1325 days + 9 hours)
  When the command that caused the error occurred, the device was active or idle.

  After command completion occurred, registers were:
  ER -- ST COUNT  LBA_48  LH LM LL DV DC
  -- -- -- == -- == == == -- -- -- -- --
  40 -- 51 00 00 00 fa 00 a8 00 94 00 00  Error: WP at LBA = 0xfa00a80094 = 1073752834196

  Commands leading to the command that caused the error were:
  CR FEATR COUNT  LBA_48  LH LM LL DV DC  Powered_Up_Time  Command/Feature_Name
  -- == -- == -- == == == -- -- -- -- --  ---------------  --------------------
  61 00 00 00 08 00 00 00 f2 00 98 40 00     00:07:32.848  WRITE FPDMA QUEUED
  60 00 00 00 80 00 83 00 9f 02 d0 40 00     00:07:32.848  READ FPDMA QUEUED
  60 00 00 00 80 00 83 00 9f 02 50 40 00     00:07:32.847  READ FPDMA QUEUED
  61 00 00 00 08 00 00 00 f2 00 a0 40 00     00:07:32.833  WRITE FPDMA QUEUED
  61 00 00 00 32 00 2d 00 f6 01 d8 40 00     00:07:32.832  WRITE FPDMA QUEUED

Error 54371 [10] occurred at disk power-on lifetime: 31809 hours (1325 days + 9 hours)
  When the command that caused the error occurred, the device was active or idle.

  After command completion occurred, registers were:
  ER -- ST COUNT  LBA_48  LH LM LL DV DC
  -- -- -- == -- == == == -- -- -- -- --
  40 -- 51 00 00 00 fa 00 a8 00 94 00 00  Error: UNC at LBA = 0xfa00a80094 = 1073752834196

  Commands leading to the command that caused the error were:
  CR FEATR COUNT  LBA_48  LH LM LL DV DC  Powered_Up_Time  Command/Feature_Name
  -- == -- == -- == == == -- -- -- -- --  ---------------  --------------------
  60 00 00 00 08 00 63 00 28 00 00 40 00     00:07:27.892  READ FPDMA QUEUED
  60 00 00 00 01 00 03 00 28 00 00 40 00     00:07:27.891  READ FPDMA QUEUED
  60 00 00 01 00 00 83 00 9c 02 50 40 00     00:07:27.887  READ FPDMA QUEUED
  60 00 00 01 00 00 83 00 9b 02 50 40 00     00:07:27.884  READ FPDMA QUEUED
  60 00 00 01 00 00 83 00 9a 02 50 40 00     00:07:27.881  READ FPDMA QUEUED

Error 54370 [9] occurred at disk power-on lifetime: 31809 hours (1325 days + 9 hours)
  When the command that caused the error occurred, the device was active or idle.

  After command completion occurred, registers were:
  ER -- ST COUNT  LBA_48  LH LM LL DV DC
  -- -- -- == -- == == == -- -- -- -- --
  40 -- 51 00 00 00 fa 00 a8 00 94 00 00  Error: UNC at LBA = 0xfa00a80094 = 1073752834196

  Commands leading to the command that caused the error were:
  CR FEATR COUNT  LBA_48  LH LM LL DV DC  Powered_Up_Time  Command/Feature_Name
  -- == -- == -- == == == -- -- -- -- --  ---------------  --------------------
  60 00 00 00 20 00 05 00 ac 00 c0 40 00     00:07:25.542  READ FPDMA QUEUED
  60 00 00 00 20 00 fa 00 a8 00 80 40 00     00:07:25.541  READ FPDMA QUEUED
  61 00 00 00 20 00 23 00 98 13 e0 40 00     00:07:25.540  WRITE FPDMA QUEUED
  60 00 00 00 02 00 63 00 28 00 00 40 00     00:07:25.540  READ FPDMA QUEUED
  60 00 00 00 20 00 05 00 ac 00 c0 40 00     00:07:25.539  READ FPDMA QUEUED

Error 54369 [8] occurred at disk power-on lifetime: 31809 hours (1325 days + 9 hours)
  When the command that caused the error occurred, the device was active or idle.

  After command completion occurred, registers were:
  ER -- ST COUNT  LBA_48  LH LM LL DV DC
  -- -- -- == -- == == == -- -- -- -- --
  40 -- 51 00 00 00 fa 00 a8 00 94 00 00  Error: UNC at LBA = 0xfa00a80094 = 1073752834196

  Commands leading to the command that caused the error were:
  CR FEATR COUNT  LBA_48  LH LM LL DV DC  Powered_Up_Time  Command/Feature_Name
  -- == -- == -- == == == -- -- -- -- --  ---------------  --------------------
  60 00 00 00 20 00 14 00 ac 00 e0 40 00     00:18:41.039  READ FPDMA QUEUED
  61 00 00 00 08 00 5e 00 dd 00 88 40 00     00:18:41.038  WRITE FPDMA QUEUED
  60 00 00 00 20 00 2d 00 67 00 e0 40 00     00:18:41.037  READ FPDMA QUEUED
  61 00 00 00 08 00 60 00 13 00 28 40 00     00:18:41.037  WRITE FPDMA QUEUED
  61 00 00 00 08 00 2d 00 67 00 80 40 00     00:18:41.034  WRITE FPDMA QUEUED

SMART Extended Self-test Log Version: 1 (1 sectors)
Num  Test_Description    Status                  Remaining  LifeTime(hours)  LBA_of_first_error
# 1  Extended offline    Completed without error       00%     33320         -
# 2  Extended offline    Completed without error       00%     33157         -
# 3  Extended offline    Completed without error       00%     32880         -
# 4  Extended offline    Completed without error       00%     32716         -
# 5  Extended offline    Completed without error       00%     32548         -
# 6  Extended offline    Completed without error       00%     32301         -
# 7  Extended offline    Completed without error       00%     32134         -

SMART Selective self-test log data structure revision number 1
 SPAN  MIN_LBA  MAX_LBA  CURRENT_TEST_STATUS
    1        0        0  Not_testing
    2        0        0  Not_testing
    3        0        0  Not_testing
    4        0        0  Not_testing
    5        0        0  Not_testing
Selective self-test flags (0x0):
  After scanning selected spans, do NOT read-scan remainder of disk.
If Selective self-test is pending on power-up, resume after 0 minute delay.

SCT Status Version:                  3
SCT Version (vendor specific):       522 (0x020a)
Device State:                        Active (0)
Current Temperature:                    31 Celsius
Power Cycle Min/Max Temperature:     27/37 Celsius
Lifetime    Min/Max Temperature:     15/52 Celsius
Under/Over Temperature Limit Count:   0/1254

SCT Temperature History Version:     2
Temperature Sampling Period:         1 minute
Temperature Logging Interval:        1 minute
Min/Max recommended Temperature:      0/ 0 Celsius
Min/Max Temperature Limit:            0/ 0 Celsius
Temperature History Size (Index):    128 (74)

SCT Error Recovery Control:
           Read: Disabled
          Write: Disabled

Device Statistics (GP/SMART Log 0x04) not supported

Pending Defects log (GP Log 0x0c) not supported

SATA Phy Event Counters (GP Log 0x11)
ID      Size     Value  Description
0x000a  2            6  Device-to-host register FISes sent due to a COMRESET
0x0001  2            0  Command failed due to ICRC error
0x0003  2            0  R_ERR response for device-to-host data FIS
0x0004  2            0  R_ERR response for host-to-device data FIS
0x0006  2            0  R_ERR response for device-to-host non-data FIS
0x0007  2            0  R_ERR response for host-to-device non-data FIS

