=== START OF INFORMATION SECTION ===
Model Family:     Seagate Momentus 5400.6
Device Model:     ST9320325AS
Serial Number:    --
LU WWN Device Id: 5 000c50 ...
Firmware Version: 0004SDM2
User Capacity:    320,072,933,376 bytes [320 GB]
Sector Size:      512 bytes logical/physical
Rotation Rate:    5400 rpm
Device is:        In smartctl database [for details use: -P show]
ATA Version is:   ATA8-ACS T13/1699-D revision 4
SATA Version is:  SATA 2.6, 1.5 Gb/s
Local Time is:    Thu Dec  3 01:16:07 2015 CET
SMART support is: Available - device has SMART capability.
SMART support is: Enabled
AAM feature is:   Unavailable
APM level is:     128 (minimum power consumption without standby)
Rd look-ahead is: Enabled
Write cache is:   Enabled
ATA Security is:  Disabled, NOT FROZEN [SEC1]
Wt Cache Reorder: Unknown

=== START OF READ SMART DATA SECTION ===
SMART overall-health self-assessment test result: PASSED

General SMART Values:
Offline data collection status:  (0x00)	Offline data collection activity
					was never started.
					Auto Offline Data Collection: Disabled.
Self-test execution status:      (   0)	The previous self-test routine completed
					without error or no self-test has ever 
					been run.
Total time to complete Offline 
data collection: 		(    0) seconds.
Offline data collection
capabilities: 			 (0x73) SMART execute Offline immediate.
					Auto Offline data collection on/off support.
					Suspend Offline collection upon new
					command.
					No Offline surface scan supported.
					Self-test supported.
					Conveyance Self-test supported.
					Selective Self-test supported.
SMART capabilities:            (0x0003)	Saves SMART data before entering
					power-saving mode.
					Supports SMART auto save timer.
Error logging capability:        (0x01)	Error logging supported.
					General Purpose Logging supported.
Short self-test routine 
recommended polling time: 	 (   1) minutes.
Extended self-test routine
recommended polling time: 	 (  96) minutes.
Conveyance self-test routine
recommended polling time: 	 (   2) minutes.
SCT capabilities: 	       (0x103b)	SCT Status supported.
					SCT Error Recovery Control supported.
					SCT Feature Control supported.
					SCT Data Table supported.

SMART Attributes Data Structure revision number: 10
Vendor Specific SMART Attributes with Thresholds:
ID# ATTRIBUTE_NAME          FLAGS    VALUE WORST THRESH FAIL RAW_VALUE
  1 Raw_Read_Error_Rate     POSR--   117   099   006    -    124151517
  3 Spin_Up_Time            PO----   098   098   000    -    0
  4 Start_Stop_Count        -O--CK   093   093   020    -    7243
  5 Reallocated_Sector_Ct   PO--CK   100   100   036    -    0
  7 Seek_Error_Rate         POSR--   083   060   030    -    233980416
  9 Power_On_Hours          -O--CK   090   090   000    -    9147
 10 Spin_Retry_Count        PO--C-   100   100   097    -    0
 12 Power_Cycle_Count       -O--CK   096   037   020    -    4540
184 End-to-End_Error        -O--CK   100   100   099    -    0
187 Reported_Uncorrect      -O--CK   080   080   000    -    20
188 Command_Timeout         -O--CK   100   092   000    -    5073
189 High_Fly_Writes         -O-RCK   100   100   000    -    0
190 Airflow_Temperature_Cel -O---K   065   052   045    -    35 (Min/Max 33/35)
191 G-Sense_Error_Rate      -O--CK   100   100   000    -    143
192 Power-Off_Retract_Count -O--CK   100   100   000    -    8
193 Load_Cycle_Count        -O--CK   034   034   000    -    132401
194 Temperature_Celsius     -O---K   035   048   000    -    35 (0 11 0 0 0)
195 Hardware_ECC_Recovered  -O-RC-   061   050   000    -    124151517
197 Current_Pending_Sector  -O--C-   100   100   000    -    0
198 Offline_Uncorrectable   ----C-   100   100   000    -    0
199 UDMA_CRC_Error_Count    -OSRCK   200   200   000    -    2
254 Free_Fall_Sensor        -O--CK   100   100   000    -    0
                            ||||||_ K auto-keep
                            |||||__ C event count
                            ||||___ R error rate
                            |||____ S speed/performance
                            ||_____ O updated online
                            |______ P prefailure warning

General Purpose Log Directory Version 1
SMART           Log Directory Version 1 [multi-sector log support]
Address    Access  R/W   Size  Description
0x00       GPL,SL  R/O      1  Log Directory
0x01       GPL,SL  R/O      1  Summary SMART error log
0x02       GPL,SL  R/O      5  Comprehensive SMART error log
0x03       GPL,SL  R/O      5  Ext. Comprehensive SMART error log
0x06       GPL,SL  R/O      1  SMART self-test log
0x07       GPL,SL  R/O      1  Extended self-test log
0x09       GPL,SL  R/W      1  Selective self-test log
0x10       GPL,SL  R/O      1  NCQ Command Error log
0x11       GPL,SL  R/O      1  SATA Phy Event Counters
0x21       GPL,SL  R/O      1  Write stream error log
0x22       GPL,SL  R/O      1  Read stream error log
0x80-0x9f  GPL,SL  R/W     16  Host vendor specific log
0xa1       GPL,SL  VS      20  Device vendor specific log
0xa2       GPL     VS    2248  Device vendor specific log
0xa8       GPL,SL  VS      65  Device vendor specific log
0xa9       GPL,SL  VS       1  Device vendor specific log
0xb0       GPL     VS    2864  Device vendor specific log
0xbe-0xbf  GPL     VS   65535  Device vendor specific log
0xe0       GPL,SL  R/W      1  SCT Command/Status
0xe1       GPL,SL  R/W      1  SCT Data Transfer

SMART Extended Comprehensive Error Log Version: 1 (5 sectors)
Device Error Count: 18
	CR     = Command Register
	FEATR  = Features Register
	COUNT  = Count (was: Sector Count) Register
	LBA_48 = Upper bytes of LBA High/Mid/Low Registers ]  ATA-8
	LH     = LBA High (was: Cylinder High) Register    ]   LBA
	LM     = LBA Mid (was: Cylinder Low) Register      ] Register
	LL     = LBA Low (was: Sector Number) Register     ]
	DV     = Device (was: Device/Head) Register
	DC     = Device Control Register
	ER     = Error register
	ST     = Status register
Powered_Up_Time is measured from power on, and printed as
DDd+hh:mm:SS.sss where DD=days, hh=hours, mm=minutes,
SS=sec, and sss=millisec. It "wraps" after 49.710 days.

Error 18 [17] occurred at disk power-on lifetime: 8673 hours (361 days + 9 hours)
  When the command that caused the error occurred, the device was active or idle.

  After command completion occurred, registers were:
  ER -- ST COUNT  LBA_48  LH LM LL DV DC
  -- -- -- == -- == == == -- -- -- -- --
  40 -- 51 00 00 00 13 87 00 31 d1 00 00  Error: UNC at LBA = 0x13870031d1 = 83869315537

  Commands leading to the command that caused the error were:
  CR FEATR COUNT  LBA_48  LH LM LL DV DC  Powered_Up_Time  Command/Feature_Name
  -- == -- == -- == == == -- -- -- -- --  ---------------  --------------------
  25 00 00 00 08 00 13 87 00 31 ca e0 00     01:02:19.651  READ DMA EXT
  25 00 00 00 08 00 13 87 00 31 ca e0 00     01:02:17.219  READ DMA EXT
  25 00 00 00 08 00 13 87 00 31 ca e0 00     01:02:14.872  READ DMA EXT
  25 00 00 00 08 00 13 89 00 31 22 e0 00     01:02:14.856  READ DMA EXT
  25 00 00 00 08 00 13 89 00 31 1a e0 00     01:02:14.808  READ DMA EXT

Error 17 [16] occurred at disk power-on lifetime: 8673 hours (361 days + 9 hours)
  When the command that caused the error occurred, the device was active or idle.

  After command completion occurred, registers were:
  ER -- ST COUNT  LBA_48  LH LM LL DV DC
  -- -- -- == -- == == == -- -- -- -- --
  40 -- 51 00 00 00 13 87 00 31 d1 00 00  Error: UNC at LBA = 0x13870031d1 = 83869315537

  Commands leading to the command that caused the error were:
  CR FEATR COUNT  LBA_48  LH LM LL DV DC  Powered_Up_Time  Command/Feature_Name
  -- == -- == -- == == == -- -- -- -- --  ---------------  --------------------
  25 00 00 00 08 00 13 87 00 31 ca e0 00     01:02:17.219  READ DMA EXT
  25 00 00 00 08 00 13 87 00 31 ca e0 00     01:02:14.872  READ DMA EXT
  25 00 00 00 08 00 13 89 00 31 22 e0 00     01:02:14.856  READ DMA EXT
  25 00 00 00 08 00 13 89 00 31 1a e0 00     01:02:14.808  READ DMA EXT
  25 00 00 00 08 00 13 87 00 31 ca e0 00     01:02:12.373  READ DMA EXT

Error 16 [15] occurred at disk power-on lifetime: 8673 hours (361 days + 9 hours)
  When the command that caused the error occurred, the device was active or idle.

  After command completion occurred, registers were:
  ER -- ST COUNT  LBA_48  LH LM LL DV DC
  -- -- -- == -- == == == -- -- -- -- --
  40 -- 51 00 00 00 13 87 00 31 d1 00 00  Error: UNC at LBA = 0x13870031d1 = 83869315537

  Commands leading to the command that caused the error were:
  CR FEATR COUNT  LBA_48  LH LM LL DV DC  Powered_Up_Time  Command/Feature_Name
  -- == -- == -- == == == -- -- -- -- --  ---------------  --------------------
  25 00 00 00 08 00 13 87 00 31 ca e0 00     01:02:14.872  READ DMA EXT
  25 00 00 00 08 00 13 89 00 31 22 e0 00     01:02:14.856  READ DMA EXT
  25 00 00 00 08 00 13 89 00 31 1a e0 00     01:02:14.808  READ DMA EXT
  25 00 00 00 08 00 13 87 00 31 ca e0 00     01:02:12.373  READ DMA EXT
  25 00 00 00 08 00 13 87 00 31 ca e0 00     01:02:09.988  READ DMA EXT

Error 15 [14] occurred at disk power-on lifetime: 8673 hours (361 days + 9 hours)
  When the command that caused the error occurred, the device was active or idle.

  After command completion occurred, registers were:
  ER -- ST COUNT  LBA_48  LH LM LL DV DC
  -- -- -- == -- == == == -- -- -- -- --
  40 -- 51 00 00 00 13 87 00 31 d1 00 00  Error: UNC at LBA = 0x13870031d1 = 83869315537

  Commands leading to the command that caused the error were:
  CR FEATR COUNT  LBA_48  LH LM LL DV DC  Powered_Up_Time  Command/Feature_Name
  -- == -- == -- == == == -- -- -- -- --  ---------------  --------------------
  25 00 00 00 08 00 13 87 00 31 ca e0 00     01:02:12.373  READ DMA EXT
  25 00 00 00 08 00 13 87 00 31 ca e0 00     01:02:09.988  READ DMA EXT
  25 00 00 00 08 00 13 87 00 31 22 e0 00     01:02:07.652  READ DMA EXT
  25 00 00 00 08 00 13 87 00 31 1a e0 00     01:02:07.650  READ DMA EXT
  25 00 00 00 f0 00 13 88 00 31 1a e0 00     01:02:07.645  READ DMA EXT

Error 14 [13] occurred at disk power-on lifetime: 8673 hours (361 days + 9 hours)
  When the command that caused the error occurred, the device was active or idle.

  After command completion occurred, registers were:
  ER -- ST COUNT  LBA_48  LH LM LL DV DC
  -- -- -- == -- == == == -- -- -- -- --
  40 -- 51 00 00 00 13 87 00 31 d1 00 00  Error: UNC at LBA = 0x13870031d1 = 83869315537

  Commands leading to the command that caused the error were:
  CR FEATR COUNT  LBA_48  LH LM LL DV DC  Powered_Up_Time  Command/Feature_Name
  -- == -- == -- == == == -- -- -- -- --  ---------------  --------------------
  25 00 00 00 08 00 13 87 00 31 ca e0 00     01:02:09.988  READ DMA EXT
  25 00 00 00 08 00 13 87 00 31 22 e0 00     01:02:07.652  READ DMA EXT
  25 00 00 00 08 00 13 87 00 31 1a e0 00     01:02:07.650  READ DMA EXT
  25 00 00 00 f0 00 13 88 00 31 1a e0 00     01:02:07.645  READ DMA EXT
  25 00 00 00 10 00 13 88 00 31 0a e0 00     01:02:07.557  READ DMA EXT

Error 13 [12] occurred at disk power-on lifetime: 8673 hours (361 days + 9 hours)
  When the command that caused the error occurred, the device was active or idle.

  After command completion occurred, registers were:
  ER -- ST COUNT  LBA_48  LH LM LL DV DC
  -- -- -- == -- == == == -- -- -- -- --
  40 -- 51 00 00 00 13 87 00 31 d1 00 00  Error: UNC at LBA = 0x13870031d1 = 83869315537

  Commands leading to the command that caused the error were:
  CR FEATR COUNT  LBA_48  LH LM LL DV DC  Powered_Up_Time  Command/Feature_Name
  -- == -- == -- == == == -- -- -- -- --  ---------------  --------------------
  25 00 00 00 08 00 13 87 00 31 22 e0 00     01:02:07.652  READ DMA EXT
  25 00 00 00 08 00 13 87 00 31 1a e0 00     01:02:07.650  READ DMA EXT
  25 00 00 00 f0 00 13 88 00 31 1a e0 00     01:02:07.645  READ DMA EXT
  25 00 00 00 10 00 13 88 00 31 0a e0 00     01:02:07.557  READ DMA EXT
  25 00 00 00 f0 00 13 73 00 31 1a e0 00     01:02:05.157  READ DMA EXT

Error 12 [11] occurred at disk power-on lifetime: 8673 hours (361 days + 9 hours)
  When the command that caused the error occurred, the device was active or idle.

  After command completion occurred, registers were:
  ER -- ST COUNT  LBA_48  LH LM LL DV DC
  -- -- -- == -- == == == -- -- -- -- --
  40 -- 51 00 00 00 13 87 00 31 d1 00 00  Error: UNC at LBA = 0x13870031d1 = 83869315537

  Commands leading to the command that caused the error were:
  CR FEATR COUNT  LBA_48  LH LM LL DV DC  Powered_Up_Time  Command/Feature_Name
  -- == -- == -- == == == -- -- -- -- --  ---------------  --------------------
  25 00 00 00 f0 00 13 73 00 31 1a e0 00     01:02:05.157  READ DMA EXT
  25 00 00 00 80 00 13 72 00 31 9a e0 00     01:02:05.147  READ DMA EXT
  25 00 00 00 f0 00 13 6f 00 30 6a e0 00     01:02:04.907  READ DMA EXT
  25 00 00 00 80 00 13 6e 00 30 ea e0 00     01:02:04.902  READ DMA EXT
  25 00 00 00 f0 00 13 ef 00 2f 62 e0 00     01:02:04.628  READ DMA EXT

Error 11 [10] occurred at disk power-on lifetime: 8657 hours (360 days + 17 hours)
  When the command that caused the error occurred, the device was active or idle.

  After command completion occurred, registers were:
  ER -- ST COUNT  LBA_48  LH LM LL DV DC
  -- -- -- == -- == == == -- -- -- -- --
  40 -- 51 00 00 00 13 87 00 31 d1 00 00  Error: UNC at LBA = 0x13870031d1 = 83869315537

  Commands leading to the command that caused the error were:
  CR FEATR COUNT  LBA_48  LH LM LL DV DC  Powered_Up_Time  Command/Feature_Name
  -- == -- == -- == == == -- -- -- -- --  ---------------  --------------------
  25 00 00 00 08 00 13 87 00 31 ca e0 00     01:41:53.982  READ DMA EXT
  25 00 00 00 08 00 13 87 00 31 ca e0 00     01:41:51.503  READ DMA EXT
  25 00 00 00 08 00 13 87 00 31 ca e0 00     01:41:49.157  READ DMA EXT
  25 00 00 00 08 00 13 88 00 31 22 e0 00     01:41:49.127  READ DMA EXT
  25 00 00 00 08 00 13 88 00 31 1a e0 00     01:41:49.072  READ DMA EXT

SMART Extended Self-test Log Version: 1 (1 sectors)
Num  Test_Description    Status                  Remaining  LifeTime(hours)  LBA_of_first_error
# 1  Extended offline    Interrupted (host reset)      00%      6181         -
# 2  Extended offline    Completed without error       00%      5997         -
# 3  Short offline       Completed without error       00%      5996         -

SMART Selective self-test log data structure revision number 1
 SPAN  MIN_LBA  MAX_LBA  CURRENT_TEST_STATUS
    1        0        0  Not_testing
    2        0        0  Not_testing
    3        0        0  Not_testing
    4        0        0  Not_testing
    5        0        0  Not_testing
Selective self-test flags (0x0):
  After scanning selected spans, do NOT read-scan remainder of disk.
If Selective self-test is pending on power-up, resume after 0 minute delay.

SCT Status Version:                  3
SCT Version (vendor specific):       522 (0x020a)
SCT Support Level:                   1
Device State:                        Active (0)
Current Temperature:                    35 Celsius
Power Cycle Min/Max Temperature:     33/35 Celsius
Lifetime    Min/Max Temperature:     11/48 Celsius
Under/Over Temperature Limit Count:   0/8

SCT Temperature History Version:     2
Temperature Sampling Period:         1 minute
Temperature Logging Interval:        1 minute
Min/Max recommended Temperature:      0/ 0 Celsius
Min/Max Temperature Limit:            0/ 0 Celsius
Temperature History Size (Index):    128 (94)

SCT Error Recovery Control:
           Read: Disabled
          Write: Disabled

Device Statistics (GP Log 0x04) not supported

SATA Phy Event Counters (GP Log 0x11)
ID      Size     Value  Description
0x000a  2           10  Device-to-host register FISes sent due to a COMRESET
0x0001  2            0  Command failed due to ICRC error
0x0003  2            0  R_ERR response for device-to-host data FIS
0x0004  2            0  R_ERR response for host-to-device data FIS
0x0006  2            0  R_ERR response for device-to-host non-data FIS
0x0007  2            0  R_ERR response for host-to-device non-data FIS



