smartctl 7.2 2020-12-30 r5155 [x86_64-linux-5.10.9-zen1-1-zen] (local build)
Copyright (C) 2002-20, Bruce Allen, Christian Franke, www.smartmontools.org

=== START OF INFORMATION SECTION ===
Model Family:     Seagate Momentus 5400.6
Device Model:     ST9320325AS
Serial Number:    --
LU WWN Device Id: 5 000c50 ...
Firmware Version: 0002SDM1
User Capacity:    320,072,933,376 bytes [320 GB]
Sector Size:      512 bytes logical/physical
Rotation Rate:    5400 rpm
Device is:        In smartctl database [for details use: -P show]
ATA Version is:   ATA8-ACS T13/1699-D revision 4
SATA Version is:  SATA 2.6, 3.0 Gb/s
Local Time is:    Sat Jan 23 18:26:30 2021 CET
SMART support is: Available - device has SMART capability.
SMART support is: Enabled
AAM feature is:   Unavailable
APM level is:     128 (minimum power consumption without standby)
Rd look-ahead is: Enabled
Write cache is:   Enabled
DSN feature is:   Unavailable
ATA Security is:  Disabled, frozen [SEC2]
Wt Cache Reorder: Unknown

=== START OF READ SMART DATA SECTION ===
SMART overall-health self-assessment test result: FAILED!
Drive failure expected in less than 24 hours. SAVE ALL DATA.
See vendor-specific Attribute list for failed Attributes.

General SMART Values:
Offline data collection status:  (0x00)	Offline data collection activity
					was never started.
					Auto Offline Data Collection: Disabled.
Self-test execution status:      (   0)	The previous self-test routine completed
					without error or no self-test has ever 
					been run.
Total time to complete Offline 
data collection: 		(    0) seconds.
Offline data collection
capabilities: 			 (0x73) SMART execute Offline immediate.
					Auto Offline data collection on/off support.
					Suspend Offline collection upon new
					command.
					No Offline surface scan supported.
					Self-test supported.
					Conveyance Self-test supported.
					Selective Self-test supported.
SMART capabilities:            (0x0003)	Saves SMART data before entering
					power-saving mode.
					Supports SMART auto save timer.
Error logging capability:        (0x01)	Error logging supported.
					General Purpose Logging supported.
Short self-test routine 
recommended polling time: 	 (   1) minutes.
Extended self-test routine
recommended polling time: 	 (  99) minutes.
Conveyance self-test routine
recommended polling time: 	 (   2) minutes.
SCT capabilities: 	       (0x103b)	SCT Status supported.
					SCT Error Recovery Control supported.
					SCT Feature Control supported.
					SCT Data Table supported.

SMART Attributes Data Structure revision number: 10
Vendor Specific SMART Attributes with Thresholds:
ID# ATTRIBUTE_NAME          FLAGS    VALUE WORST THRESH FAIL RAW_VALUE
  1 Raw_Read_Error_Rate     POSR--   108   087   006    -    17014169
  3 Spin_Up_Time            PO----   099   098   000    -    0
  4 Start_Stop_Count        -O--CK   068   068   020    -    33714
  5 Reallocated_Sector_Ct   PO--CK   015   015   036    NOW  1743
  7 Seek_Error_Rate         POSR--   081   060   030    -    4438767041
  9 Power_On_Hours          -O--CK   085   085   000    -    13380
 10 Spin_Retry_Count        PO--C-   100   100   097    -    0
 12 Power_Cycle_Count       -O--CK   097   037   020    -    3540
184 End-to-End_Error        -O--CK   100   100   099    -    0
187 Reported_Uncorrect      -O--CK   001   001   000    -    1781
188 Command_Timeout         -O--CK   100   095   000    -    8590065823
189 High_Fly_Writes         -O-RCK   100   100   000    -    0
190 Airflow_Temperature_Cel -O---K   068   054   045    -    32 (Min/Max 30/32)
191 G-Sense_Error_Rate      -O--CK   100   100   000    -    69
192 Power-Off_Retract_Count -O--CK   100   100   000    -    52
193 Load_Cycle_Count        -O--CK   001   001   000    -    288865
194 Temperature_Celsius     -O---K   032   046   000    -    32 (0 11 0 0 0)
195 Hardware_ECC_Recovered  -O-RC-   053   045   000    -    17014169
197 Current_Pending_Sector  -O--C-   100   100   000    -    0
198 Offline_Uncorrectable   ----C-   100   100   000    -    0
199 UDMA_CRC_Error_Count    -OSRCK   200   200   000    -    0
254 Free_Fall_Sensor        -O--CK   100   100   000    -    0
                            ||||||_ K auto-keep
                            |||||__ C event count
                            ||||___ R error rate
                            |||____ S speed/performance
                            ||_____ O updated online
                            |______ P prefailure warning

General Purpose Log Directory Version 1
SMART           Log Directory Version 1 [multi-sector log support]
Address    Access  R/W   Size  Description
0x00       GPL,SL  R/O      1  Log Directory
0x01       GPL,SL  R/O      1  Summary SMART error log
0x02       GPL,SL  R/O      5  Comprehensive SMART error log
0x03       GPL,SL  R/O      5  Ext. Comprehensive SMART error log
0x06       GPL,SL  R/O      1  SMART self-test log
0x07       GPL,SL  R/O      1  Extended self-test log
0x09       GPL,SL  R/W      1  Selective self-test log
0x10       GPL,SL  R/O      1  NCQ Command Error log
0x11       GPL,SL  R/O      1  SATA Phy Event Counters log
0x21       GPL,SL  R/O      1  Write stream error log
0x22       GPL,SL  R/O      1  Read stream error log
0x80-0x9f  GPL,SL  R/W     16  Host vendor specific log
0xa1       GPL,SL  VS      20  Device vendor specific log
0xa2       GPL     VS    2248  Device vendor specific log
0xa8       GPL,SL  VS      65  Device vendor specific log
0xa9       GPL,SL  VS       1  Device vendor specific log
0xb0       GPL     VS    2864  Device vendor specific log
0xbe-0xbf  GPL     VS   65535  Device vendor specific log
0xe0       GPL,SL  R/W      1  SCT Command/Status
0xe1       GPL,SL  R/W      1  SCT Data Transfer

SMART Extended Comprehensive Error Log Version: 1 (5 sectors)
Device Error Count: 2358 (device log contains only the most recent 20 errors)
	CR     = Command Register
	FEATR  = Features Register
	COUNT  = Count (was: Sector Count) Register
	LBA_48 = Upper bytes of LBA High/Mid/Low Registers ]  ATA-8
	LH     = LBA High (was: Cylinder High) Register    ]   LBA
	LM     = LBA Mid (was: Cylinder Low) Register      ] Register
	LL     = LBA Low (was: Sector Number) Register     ]
	DV     = Device (was: Device/Head) Register
	DC     = Device Control Register
	ER     = Error register
	ST     = Status register
Powered_Up_Time is measured from power on, and printed as
DDd+hh:mm:SS.sss where DD=days, hh=hours, mm=minutes,
SS=sec, and sss=millisec. It "wraps" after 49.710 days.

Error 2358 [17] occurred at disk power-on lifetime: 7053 hours (293 days + 21 hours)
  When the command that caused the error occurred, the device was active or idle.

  After command completion occurred, registers were:
  ER -- ST COUNT  LBA_48  LH LM LL DV DC
  -- -- -- == -- == == == -- -- -- -- --
  40 -- 51 00 00 00 00 02 34 ee e3 00 00  Error: UNC at LBA = 0x0234eee3 = 37023459

  Commands leading to the command that caused the error were:
  CR FEATR COUNT  LBA_48  LH LM LL DV DC  Powered_Up_Time  Command/Feature_Name
  -- == -- == -- == == == -- -- -- -- --  ---------------  --------------------
  25 00 00 00 08 00 00 02 34 ee e0 40 00     06:56:35.139  READ DMA EXT
  35 00 00 00 80 00 00 01 f8 8a 60 40 00     06:56:35.138  WRITE DMA EXT
  25 00 00 00 e0 00 00 0b 7a 8f a0 40 00     06:56:35.121  READ DMA EXT
  25 00 00 00 08 00 00 0b 16 b8 b0 40 00     06:56:34.985  READ DMA EXT
  35 00 00 00 08 00 00 0a e6 bc 70 40 00     06:56:34.984  WRITE DMA EXT

Error 2357 [16] occurred at disk power-on lifetime: 7053 hours (293 days + 21 hours)
  When the command that caused the error occurred, the device was active or idle.

  After command completion occurred, registers were:
  ER -- ST COUNT  LBA_48  LH LM LL DV DC
  -- -- -- == -- == == == -- -- -- -- --
  40 -- 51 00 00 00 00 02 34 ee e3 00 00  Error: UNC at LBA = 0x0234eee3 = 37023459

  Commands leading to the command that caused the error were:
  CR FEATR COUNT  LBA_48  LH LM LL DV DC  Powered_Up_Time  Command/Feature_Name
  -- == -- == -- == == == -- -- -- -- --  ---------------  --------------------
  25 00 00 00 20 00 00 02 34 ee e0 40 00     06:56:32.604  READ DMA EXT
  35 00 00 00 10 00 00 02 34 ee 80 40 00     06:56:32.603  WRITE DMA EXT
  35 00 00 00 08 00 00 02 34 ee 70 40 00     06:56:32.603  WRITE DMA EXT
  35 00 00 00 08 00 00 02 34 ed 80 40 00     06:56:32.602  WRITE DMA EXT
  35 00 00 00 18 00 00 02 34 ed 40 40 00     06:56:32.602  WRITE DMA EXT

Error 2356 [15] occurred at disk power-on lifetime: 7046 hours (293 days + 14 hours)
  When the command that caused the error occurred, the device was active or idle.

  After command completion occurred, registers were:
  ER -- ST COUNT  LBA_48  LH LM LL DV DC
  -- -- -- == -- == == == -- -- -- -- --
  40 -- 51 00 00 00 00 02 34 ee e3 00 00  Error: UNC at LBA = 0x0234eee3 = 37023459

  Commands leading to the command that caused the error were:
  CR FEATR COUNT  LBA_48  LH LM LL DV DC  Powered_Up_Time  Command/Feature_Name
  -- == -- == -- == == == -- -- -- -- --  ---------------  --------------------
  25 00 00 00 08 00 00 02 34 ee e0 40 00     00:47:38.921  READ DMA EXT
  35 00 00 00 10 00 00 02 34 a6 88 40 00     00:47:38.920  WRITE DMA EXT
  35 00 00 00 08 00 00 02 30 a5 58 40 00     00:47:38.919  WRITE DMA EXT
  35 00 00 00 08 00 00 04 23 a7 00 40 00     00:47:38.919  WRITE DMA EXT
  35 00 00 00 08 00 00 04 16 67 e0 40 00     00:47:38.918  WRITE DMA EXT

Error 2355 [14] occurred at disk power-on lifetime: 7046 hours (293 days + 14 hours)
  When the command that caused the error occurred, the device was active or idle.

  After command completion occurred, registers were:
  ER -- ST COUNT  LBA_48  LH LM LL DV DC
  -- -- -- == -- == == == -- -- -- -- --
  40 -- 51 00 00 00 00 02 34 ee e3 00 00  Error: UNC at LBA = 0x0234eee3 = 37023459

  Commands leading to the command that caused the error were:
  CR FEATR COUNT  LBA_48  LH LM LL DV DC  Powered_Up_Time  Command/Feature_Name
  -- == -- == -- == == == -- -- -- -- --  ---------------  --------------------
  25 00 00 01 00 00 00 02 34 ee e0 40 00     00:47:36.409  READ DMA EXT
  35 00 00 00 01 00 00 06 a1 ec a0 40 00     00:47:36.407  WRITE DMA EXT
  35 00 00 00 20 00 00 06 c5 4f 40 40 00     00:47:36.407  WRITE DMA EXT
  ea 00 00 00 00 00 00 00 00 00 00 00 00     00:47:36.383  FLUSH CACHE EXT
  35 00 00 00 20 00 00 06 f4 48 20 40 00     00:47:36.383  WRITE DMA EXT

Error 2354 [13] occurred at disk power-on lifetime: 7039 hours (293 days + 7 hours)
  When the command that caused the error occurred, the device was active or idle.

  After command completion occurred, registers were:
  ER -- ST COUNT  LBA_48  LH LM LL DV DC
  -- -- -- == -- == == == -- -- -- -- --
  40 -- 51 00 00 00 00 02 34 ee e3 00 00  Error: UNC at LBA = 0x0234eee3 = 37023459

  Commands leading to the command that caused the error were:
  CR FEATR COUNT  LBA_48  LH LM LL DV DC  Powered_Up_Time  Command/Feature_Name
  -- == -- == -- == == == -- -- -- -- --  ---------------  --------------------
  60 00 00 00 60 00 00 02 34 ee 98 40 00     01:11:12.139  READ FPDMA QUEUED
  60 00 00 00 08 00 00 02 34 ee 90 40 00     01:11:12.138  READ FPDMA QUEUED
  60 00 00 00 08 00 00 02 34 ee 70 40 00     01:11:12.138  READ FPDMA QUEUED
  60 00 00 00 60 00 00 02 34 ed c8 40 00     01:11:12.137  READ FPDMA QUEUED
  60 00 00 00 08 00 00 02 34 ed c0 40 00     01:11:12.136  READ FPDMA QUEUED

Error 2353 [12] occurred at disk power-on lifetime: 7036 hours (293 days + 4 hours)
  When the command that caused the error occurred, the device was active or idle.

  After command completion occurred, registers were:
  ER -- ST COUNT  LBA_48  LH LM LL DV DC
  -- -- -- == -- == == == -- -- -- -- --
  40 -- 51 00 00 00 00 02 34 ee e3 00 00  Error: UNC at LBA = 0x0234eee3 = 37023459

  Commands leading to the command that caused the error were:
  CR FEATR COUNT  LBA_48  LH LM LL DV DC  Powered_Up_Time  Command/Feature_Name
  -- == -- == -- == == == -- -- -- -- --  ---------------  --------------------
  25 00 00 00 08 00 00 02 34 ee e0 40 00     00:26:46.514  READ DMA EXT
  35 00 00 00 08 00 00 0b 85 9d b8 40 00     00:26:46.513  WRITE DMA EXT
  25 00 00 00 08 00 00 03 69 68 48 40 00     00:26:46.513  READ DMA EXT
  25 00 00 00 20 00 00 02 34 f6 e0 40 00     00:26:46.511  READ DMA EXT
  25 00 00 00 a0 00 00 02 34 f6 00 40 00     00:26:46.510  READ DMA EXT

Error 2352 [11] occurred at disk power-on lifetime: 7036 hours (293 days + 4 hours)
  When the command that caused the error occurred, the device was active or idle.

  After command completion occurred, registers were:
  ER -- ST COUNT  LBA_48  LH LM LL DV DC
  -- -- -- == -- == == == -- -- -- -- --
  40 -- 51 00 00 00 00 02 34 ee e3 00 00  Error: UNC at LBA = 0x0234eee3 = 37023459

  Commands leading to the command that caused the error were:
  CR FEATR COUNT  LBA_48  LH LM LL DV DC  Powered_Up_Time  Command/Feature_Name
  -- == -- == -- == == == -- -- -- -- --  ---------------  --------------------
  25 00 00 00 20 00 00 02 34 ee e0 40 00     00:26:44.026  READ DMA EXT
  35 00 00 00 08 00 00 02 34 b9 18 40 00     00:26:44.020  WRITE DMA EXT
  25 00 00 00 08 00 00 03 69 68 88 40 00     00:26:44.013  READ DMA EXT
  25 00 00 00 08 00 00 03 69 68 80 40 00     00:26:44.013  READ DMA EXT
  25 00 00 00 08 00 00 03 69 68 38 40 00     00:26:44.013  READ DMA EXT

Error 2351 [10] occurred at disk power-on lifetime: 7025 hours (292 days + 17 hours)
  When the command that caused the error occurred, the device was active or idle.

  After command completion occurred, registers were:
  ER -- ST COUNT  LBA_48  LH LM LL DV DC
  -- -- -- == -- == == == -- -- -- -- --
  40 -- 51 00 00 00 00 02 34 ee e3 00 00  Error: UNC at LBA = 0x0234eee3 = 37023459

  Commands leading to the command that caused the error were:
  CR FEATR COUNT  LBA_48  LH LM LL DV DC  Powered_Up_Time  Command/Feature_Name
  -- == -- == -- == == == -- -- -- -- --  ---------------  --------------------
  25 00 00 00 08 00 00 02 34 ee e0 40 00     00:05:44.775  READ DMA EXT
  00 00 00 00 00 00 00 00 00 00 00 00 ff     00:05:44.718  NOP [Abort queued commands]
  25 00 00 00 08 00 00 02 34 ee e0 40 00     00:04:45.562  READ DMA EXT
  25 00 00 00 20 00 00 02 34 ee e0 40 00     00:04:43.187  READ DMA EXT
  25 00 00 00 08 00 00 02 34 ee e8 40 00     00:04:43.181  READ DMA EXT

SMART Extended Self-test Log Version: 1 (1 sectors)
No self-tests have been logged.  [To run self-tests, use: smartctl -t]

SMART Selective self-test log data structure revision number 1
 SPAN  MIN_LBA  MAX_LBA  CURRENT_TEST_STATUS
    1        0        0  Not_testing
    2        0        0  Not_testing
    3        0        0  Not_testing
    4        0        0  Not_testing
    5        0        0  Not_testing
Selective self-test flags (0x0):
  After scanning selected spans, do NOT read-scan remainder of disk.
If Selective self-test is pending on power-up, resume after 0 minute delay.

SCT Status Version:                  3
SCT Version (vendor specific):       522 (0x020a)
Device State:                        Active (0)
Current Temperature:                    32 Celsius
Power Cycle Min/Max Temperature:     30/32 Celsius
Lifetime    Min/Max Temperature:     11/46 Celsius
Under/Over Temperature Limit Count:   0/23

SCT Temperature History Version:     2
Temperature Sampling Period:         1 minute
Temperature Logging Interval:        1 minute
Min/Max recommended Temperature:      0/ 0 Celsius
Min/Max Temperature Limit:            0/ 0 Celsius
Temperature History Size (Index):    128 (82)

SCT Error Recovery Control:
           Read: Disabled
          Write: Disabled

Device Statistics (GP/SMART Log 0x04) not supported

Pending Defects log (GP Log 0x0c) not supported

SATA Phy Event Counters (GP Log 0x11)
ID      Size     Value  Description
0x000a  2            3  Device-to-host register FISes sent due to a COMRESET
0x0001  2            0  Command failed due to ICRC error
0x0003  2            0  R_ERR response for device-to-host data FIS
0x0004  2            0  R_ERR response for host-to-device data FIS
0x0006  2            0  R_ERR response for device-to-host non-data FIS
0x0007  2            0  R_ERR response for host-to-device non-data FIS

