smartctl 7.2 2020-12-30 r5155 [x86_64-linux-5.11.0-rc6] (local build)
Copyright (C) 2002-20, Bruce Allen, Christian Franke, www.smartmontools.org

=== START OF INFORMATION SECTION ===
Model Family:     Seagate Momentus 5400.6
Device Model:     ST9320325AS
Serial Number:    --
LU WWN Device Id: 5 000c50 ...
Firmware Version: 0003SDM1
User Capacity:    320,072,933,376 bytes [320 GB]
Sector Size:      512 bytes logical/physical
Rotation Rate:    5400 rpm
Device is:        In smartctl database [for details use: -P show]
ATA Version is:   ATA8-ACS T13/1699-D revision 4
SATA Version is:  SATA 2.6, 3.0 Gb/s
Local Time is:    Sat Apr 24 22:16:56 2021 CEST
SMART support is: Available - device has SMART capability.
SMART support is: Enabled
AAM feature is:   Unavailable
APM level is:     20 (intermediate level with standby)
Rd look-ahead is: Enabled
Write cache is:   Enabled
DSN feature is:   Unavailable
ATA Security is:  ENABLED, PW level HIGH, not locked, frozen [SEC6]
Wt Cache Reorder: Unknown

=== START OF READ SMART DATA SECTION ===
SMART overall-health self-assessment test result: PASSED

General SMART Values:
Offline data collection status:  (0x00)	Offline data collection activity
					was never started.
					Auto Offline Data Collection: Disabled.
Self-test execution status:      (   0)	The previous self-test routine completed
					without error or no self-test has ever 
					been run.
Total time to complete Offline 
data collection: 		(    0) seconds.
Offline data collection
capabilities: 			 (0x73) SMART execute Offline immediate.
					Auto Offline data collection on/off support.
					Suspend Offline collection upon new
					command.
					No Offline surface scan supported.
					Self-test supported.
					Conveyance Self-test supported.
					Selective Self-test supported.
SMART capabilities:            (0x0003)	Saves SMART data before entering
					power-saving mode.
					Supports SMART auto save timer.
Error logging capability:        (0x01)	Error logging supported.
					General Purpose Logging supported.
Short self-test routine 
recommended polling time: 	 (   1) minutes.
Extended self-test routine
recommended polling time: 	 ( 104) minutes.
Conveyance self-test routine
recommended polling time: 	 (   2) minutes.
SCT capabilities: 	       (0x103b)	SCT Status supported.
					SCT Error Recovery Control supported.
					SCT Feature Control supported.
					SCT Data Table supported.

SMART Attributes Data Structure revision number: 10
Vendor Specific SMART Attributes with Thresholds:
ID# ATTRIBUTE_NAME          FLAGS    VALUE WORST THRESH FAIL RAW_VALUE
  1 Raw_Read_Error_Rate     POSR--   110   097   006    -    25858993
  3 Spin_Up_Time            PO----   099   099   000    -    0
  4 Start_Stop_Count        -O--CK   095   095   020    -    5651
  5 Reallocated_Sector_Ct   PO--CK   100   100   036    -    0
  7 Seek_Error_Rate         POSR--   085   060   030    -    387585296
  9 Power_On_Hours          -O--CK   087   087   000    -    11719
 10 Spin_Retry_Count        PO--C-   100   100   097    -    0
 12 Power_Cycle_Count       -O--CK   095   095   020    -    5531
184 End-to-End_Error        -O--CK   100   100   099    -    0
187 Reported_Uncorrect      -O--CK   071   071   000    -    29
188 Command_Timeout         -O--CK   100   100   000    -    4295032835
189 High_Fly_Writes         -O-RCK   100   100   000    -    0
190 Airflow_Temperature_Cel -O---K   065   048   045    -    35 (Min/Max 31/36)
191 G-Sense_Error_Rate      -O--CK   100   100   000    -    474
192 Power-Off_Retract_Count -O--CK   100   100   000    -    0
193 Load_Cycle_Count        -O--CK   001   001   000    -    374212
194 Temperature_Celsius     -O---K   035   052   000    -    35 (0 1 0 0 0)
195 Hardware_ECC_Recovered  -O-RC-   059   042   000    -    25858993
197 Current_Pending_Sector  -O--C-   100   100   000    -    0
198 Offline_Uncorrectable   ----C-   100   100   000    -    0
199 UDMA_CRC_Error_Count    -OSRCK   200   200   000    -    15
254 Free_Fall_Sensor        -O--CK   100   100   000    -    0
                            ||||||_ K auto-keep
                            |||||__ C event count
                            ||||___ R error rate
                            |||____ S speed/performance
                            ||_____ O updated online
                            |______ P prefailure warning

General Purpose Log Directory Version 1
SMART           Log Directory Version 1 [multi-sector log support]
Address    Access  R/W   Size  Description
0x00       GPL,SL  R/O      1  Log Directory
0x01       GPL,SL  R/O      1  Summary SMART error log
0x02       GPL,SL  R/O      5  Comprehensive SMART error log
0x03       GPL,SL  R/O      5  Ext. Comprehensive SMART error log
0x06       GPL,SL  R/O      1  SMART self-test log
0x07       GPL,SL  R/O      1  Extended self-test log
0x09       GPL,SL  R/W      1  Selective self-test log
0x10       GPL,SL  R/O      1  NCQ Command Error log
0x11       GPL,SL  R/O      1  SATA Phy Event Counters log
0x21       GPL,SL  R/O      1  Write stream error log
0x22       GPL,SL  R/O      1  Read stream error log
0x80-0x9f  GPL,SL  R/W     16  Host vendor specific log
0xa1       GPL,SL  VS      20  Device vendor specific log
0xa2       GPL     VS    2248  Device vendor specific log
0xa8       GPL,SL  VS      65  Device vendor specific log
0xa9       GPL,SL  VS       1  Device vendor specific log
0xb0       GPL     VS    2864  Device vendor specific log
0xbe-0xbf  GPL     VS   65535  Device vendor specific log
0xe0       GPL,SL  R/W      1  SCT Command/Status
0xe1       GPL,SL  R/W      1  SCT Data Transfer

SMART Extended Comprehensive Error Log Version: 1 (5 sectors)
Device Error Count: 29 (device log contains only the most recent 20 errors)
	CR     = Command Register
	FEATR  = Features Register
	COUNT  = Count (was: Sector Count) Register
	LBA_48 = Upper bytes of LBA High/Mid/Low Registers ]  ATA-8
	LH     = LBA High (was: Cylinder High) Register    ]   LBA
	LM     = LBA Mid (was: Cylinder Low) Register      ] Register
	LL     = LBA Low (was: Sector Number) Register     ]
	DV     = Device (was: Device/Head) Register
	DC     = Device Control Register
	ER     = Error register
	ST     = Status register
Powered_Up_Time is measured from power on, and printed as
DDd+hh:mm:SS.sss where DD=days, hh=hours, mm=minutes,
SS=sec, and sss=millisec. It "wraps" after 49.710 days.

Error 29 [8] occurred at disk power-on lifetime: 6084 hours (253 days + 12 hours)
  When the command that caused the error occurred, the device was active or idle.

  After command completion occurred, registers were:
  ER -- ST COUNT  LBA_48  LH LM LL DV DC
  -- -- -- == -- == == == -- -- -- -- --
  40 -- 51 00 00 00 48 00 6e 07 f3 00 00  Error: UNC at LBA = 0x48006e07f3 = 309244856307

  Commands leading to the command that caused the error were:
  CR FEATR COUNT  LBA_48  LH LM LL DV DC  Powered_Up_Time  Command/Feature_Name
  -- == -- == -- == == == -- -- -- -- --  ---------------  --------------------
  60 00 00 00 08 00 48 00 6e 07 f0 40 00  3d+15:20:32.286  READ FPDMA QUEUED
  27 00 00 00 00 00 00 00 00 00 00 e0 00  3d+15:20:32.285  READ NATIVE MAX ADDRESS EXT [OBS-ACS-3]
  ec 00 00 00 00 00 00 00 00 00 00 a0 00  3d+15:20:32.284  IDENTIFY DEVICE
  ef 00 03 00 46 00 00 00 00 00 00 a0 00  3d+15:20:32.284  SET FEATURES [Set transfer mode]
  27 00 00 00 00 00 00 00 00 00 00 e0 00  3d+15:20:32.283  READ NATIVE MAX ADDRESS EXT [OBS-ACS-3]

Error 28 [7] occurred at disk power-on lifetime: 6084 hours (253 days + 12 hours)
  When the command that caused the error occurred, the device was active or idle.

  After command completion occurred, registers were:
  ER -- ST COUNT  LBA_48  LH LM LL DV DC
  -- -- -- == -- == == == -- -- -- -- --
  40 -- 51 00 00 00 48 00 6e 07 f3 00 00  Error: UNC at LBA = 0x48006e07f3 = 309244856307

  Commands leading to the command that caused the error were:
  CR FEATR COUNT  LBA_48  LH LM LL DV DC  Powered_Up_Time  Command/Feature_Name
  -- == -- == -- == == == -- -- -- -- --  ---------------  --------------------
  60 00 00 00 08 00 48 00 6e 07 f0 40 00  3d+15:20:29.863  READ FPDMA QUEUED
  27 00 00 00 00 00 00 00 00 00 00 e0 00  3d+15:20:29.863  READ NATIVE MAX ADDRESS EXT [OBS-ACS-3]
  ec 00 00 00 00 00 00 00 00 00 00 a0 00  3d+15:20:29.861  IDENTIFY DEVICE
  ef 00 03 00 46 00 00 00 00 00 00 a0 00  3d+15:20:29.861  SET FEATURES [Set transfer mode]
  27 00 00 00 00 00 00 00 00 00 00 e0 00  3d+15:20:29.829  READ NATIVE MAX ADDRESS EXT [OBS-ACS-3]

Error 27 [6] occurred at disk power-on lifetime: 6084 hours (253 days + 12 hours)
  When the command that caused the error occurred, the device was active or idle.

  After command completion occurred, registers were:
  ER -- ST COUNT  LBA_48  LH LM LL DV DC
  -- -- -- == -- == == == -- -- -- -- --
  40 -- 51 00 00 00 48 00 6e 07 f3 00 00  Error: UNC at LBA = 0x48006e07f3 = 309244856307

  Commands leading to the command that caused the error were:
  CR FEATR COUNT  LBA_48  LH LM LL DV DC  Powered_Up_Time  Command/Feature_Name
  -- == -- == -- == == == -- -- -- -- --  ---------------  --------------------
  60 00 00 00 08 00 48 00 6e 07 f0 40 00  3d+15:20:27.443  READ FPDMA QUEUED
  60 00 00 01 00 00 5d 00 ea 16 30 40 00  3d+15:20:20.901  READ FPDMA QUEUED
  60 00 00 01 00 00 5d 00 e9 16 30 40 00  3d+15:20:20.899  READ FPDMA QUEUED
  60 00 00 00 40 00 5d 00 de 16 70 40 00  3d+15:20:20.873  READ FPDMA QUEUED
  60 00 00 00 08 00 5d 00 de 16 68 40 00  3d+15:20:20.864  READ FPDMA QUEUED

Error 26 [5] occurred at disk power-on lifetime: 6083 hours (253 days + 11 hours)
  When the command that caused the error occurred, the device was active or idle.

  After command completion occurred, registers were:
  ER -- ST COUNT  LBA_48  LH LM LL DV DC
  -- -- -- == -- == == == -- -- -- -- --
  40 -- 51 00 00 00 48 00 6e 07 f3 00 00  Error: UNC at LBA = 0x48006e07f3 = 309244856307

  Commands leading to the command that caused the error were:
  CR FEATR COUNT  LBA_48  LH LM LL DV DC  Powered_Up_Time  Command/Feature_Name
  -- == -- == -- == == == -- -- -- -- --  ---------------  --------------------
  60 00 00 01 00 00 e0 00 11 01 e8 40 00  3d+14:10:38.341  READ FPDMA QUEUED
  60 00 00 01 00 00 e0 00 10 01 e8 40 00  3d+14:10:38.341  READ FPDMA QUEUED
  60 00 00 00 80 00 e0 00 10 01 68 40 00  3d+14:10:38.340  READ FPDMA QUEUED
  60 00 00 00 40 00 e0 00 10 01 28 40 00  3d+14:10:38.340  READ FPDMA QUEUED
  60 00 00 00 20 00 e0 00 10 01 08 40 00  3d+14:10:38.337  READ FPDMA QUEUED

Error 25 [4] occurred at disk power-on lifetime: 6083 hours (253 days + 11 hours)
  When the command that caused the error occurred, the device was active or idle.

  After command completion occurred, registers were:
  ER -- ST COUNT  LBA_48  LH LM LL DV DC
  -- -- -- == -- == == == -- -- -- -- --
  40 -- 51 00 00 00 48 00 6e 07 f3 00 00  Error: UNC at LBA = 0x48006e07f3 = 309244856307

  Commands leading to the command that caused the error were:
  CR FEATR COUNT  LBA_48  LH LM LL DV DC  Powered_Up_Time  Command/Feature_Name
  -- == -- == -- == == == -- -- -- -- --  ---------------  --------------------
  60 00 00 02 00 00 48 00 6e 07 00 40 00  3d+14:10:35.770  READ FPDMA QUEUED
  60 00 00 00 08 00 e0 00 00 01 00 40 00  3d+14:10:35.754  READ FPDMA QUEUED
  60 00 00 02 00 00 48 00 6c 07 00 40 00  3d+14:10:35.741  READ FPDMA QUEUED
  60 00 00 02 00 00 48 00 6a 07 00 40 00  3d+14:10:35.740  READ FPDMA QUEUED
  60 00 00 02 00 00 48 00 68 07 00 40 00  3d+14:10:35.739  READ FPDMA QUEUED

Error 24 [3] occurred at disk power-on lifetime: 6082 hours (253 days + 10 hours)
  When the command that caused the error occurred, the device was active or idle.

  After command completion occurred, registers were:
  ER -- ST COUNT  LBA_48  LH LM LL DV DC
  -- -- -- == -- == == == -- -- -- -- --
  40 -- 51 00 00 00 48 00 6e 07 f3 00 00  Error: UNC at LBA = 0x48006e07f3 = 309244856307

  Commands leading to the command that caused the error were:
  CR FEATR COUNT  LBA_48  LH LM LL DV DC  Powered_Up_Time  Command/Feature_Name
  -- == -- == -- == == == -- -- -- -- --  ---------------  --------------------
  60 00 00 01 00 00 fd 00 d4 04 e8 40 00  3d+13:30:34.870  READ FPDMA QUEUED
  60 00 00 01 00 00 fd 00 d3 04 e8 40 00  3d+13:30:34.869  READ FPDMA QUEUED
  60 00 00 00 08 00 48 00 6e 07 f0 40 00  3d+13:30:34.855  READ FPDMA QUEUED
  60 00 00 01 00 00 fd 00 d2 04 e8 40 00  3d+13:30:34.850  READ FPDMA QUEUED
  60 00 00 01 00 00 fd 00 d1 04 e8 40 00  3d+13:30:34.849  READ FPDMA QUEUED

Error 23 [2] occurred at disk power-on lifetime: 6082 hours (253 days + 10 hours)
  When the command that caused the error occurred, the device was active or idle.

  After command completion occurred, registers were:
  ER -- ST COUNT  LBA_48  LH LM LL DV DC
  -- -- -- == -- == == == -- -- -- -- --
  40 -- 51 00 00 00 48 00 6e 07 f3 00 00  Error: UNC at LBA = 0x48006e07f3 = 309244856307

  Commands leading to the command that caused the error were:
  CR FEATR COUNT  LBA_48  LH LM LL DV DC  Powered_Up_Time  Command/Feature_Name
  -- == -- == -- == == == -- -- -- -- --  ---------------  --------------------
  60 00 00 01 00 00 fd 00 be 04 e8 40 00  3d+13:30:32.169  READ FPDMA QUEUED
  60 00 00 01 00 00 fd 00 bd 04 e8 40 00  3d+13:30:32.169  READ FPDMA QUEUED
  60 00 00 02 00 00 48 00 6e 07 00 40 00  3d+13:30:32.156  READ FPDMA QUEUED
  60 00 00 02 00 00 48 00 6c 07 00 40 00  3d+13:30:32.151  READ FPDMA QUEUED
  60 00 00 01 00 00 fd 00 bc 04 e8 40 00  3d+13:30:32.145  READ FPDMA QUEUED

Error 22 [1] occurred at disk power-on lifetime: 6082 hours (253 days + 10 hours)
  When the command that caused the error occurred, the device was active or idle.

  After command completion occurred, registers were:
  ER -- ST COUNT  LBA_48  LH LM LL DV DC
  -- -- -- == -- == == == -- -- -- -- --
  40 -- 51 00 00 00 48 00 6e 07 f3 00 00  Error: UNC at LBA = 0x48006e07f3 = 309244856307

  Commands leading to the command that caused the error were:
  CR FEATR COUNT  LBA_48  LH LM LL DV DC  Powered_Up_Time  Command/Feature_Name
  -- == -- == -- == == == -- -- -- -- --  ---------------  --------------------
  60 00 00 00 08 00 48 00 6e 07 f0 40 00  3d+13:14:30.264  READ FPDMA QUEUED
  27 00 00 00 00 00 00 00 00 00 00 e0 00  3d+13:14:30.262  READ NATIVE MAX ADDRESS EXT [OBS-ACS-3]
  ec 00 00 00 00 00 00 00 00 00 00 a0 00  3d+13:14:30.261  IDENTIFY DEVICE
  ef 00 03 00 46 00 00 00 00 00 00 a0 00  3d+13:14:30.260  SET FEATURES [Set transfer mode]
  27 00 00 00 00 00 00 00 00 00 00 e0 00  3d+13:14:30.260  READ NATIVE MAX ADDRESS EXT [OBS-ACS-3]

SMART Extended Self-test Log Version: 1 (1 sectors)
Num  Test_Description    Status                  Remaining  LifeTime(hours)  LBA_of_first_error
# 1  Extended offline    Aborted by host               90%     11706         -
# 2  Short offline       Completed without error       00%     11706         -
# 3  Extended offline    Aborted by host               90%     11706         -
# 4  Short offline       Completed without error       00%     11705         -
# 5  Short offline       Aborted by host               90%      8387         -
# 6  Extended offline    Completed without error       00%      5785         -
# 7  Short offline       Completed without error       00%      5783         -
# 8  Short offline       Completed without error       00%      5755         -
# 9  Extended offline    Aborted by host               50%      5703         -
#10  Short offline       Completed without error       00%      5702         -
#11  Extended offline    Aborted by host               90%      5327         -
#12  Short offline       Completed without error       00%      5327         -
#13  Short offline       Aborted by host               90%      5327         -
#14  Short offline       Completed without error       00%      5327         -
#15  Short offline       Completed without error       00%      5327         -
#16  Short offline       Completed without error       00%      5327         -
#17  Short offline       Completed without error       00%      5327         -
#18  Short offline       Completed without error       00%      5327         -

SMART Selective self-test log data structure revision number 1
 SPAN  MIN_LBA  MAX_LBA  CURRENT_TEST_STATUS
    1        0        0  Not_testing
    2        0        0  Not_testing
    3        0        0  Not_testing
    4        0        0  Not_testing
    5        0        0  Not_testing
Selective self-test flags (0x0):
  After scanning selected spans, do NOT read-scan remainder of disk.
If Selective self-test is pending on power-up, resume after 0 minute delay.

SCT Status Version:                  3
SCT Version (vendor specific):       522 (0x020a)
Device State:                        Active (0)
Current Temperature:                    35 Celsius
Power Cycle Min/Max Temperature:     31/36 Celsius
Lifetime    Min/Max Temperature:      1/52 Celsius
Under/Over Temperature Limit Count:   0/73

SCT Temperature History Version:     2
Temperature Sampling Period:         1 minute
Temperature Logging Interval:        1 minute
Min/Max recommended Temperature:      0/ 0 Celsius
Min/Max Temperature Limit:            0/ 0 Celsius
Temperature History Size (Index):    128 (2)

SCT Error Recovery Control:
           Read: Disabled
          Write: Disabled

Device Statistics (GP/SMART Log 0x04) not supported

Pending Defects log (GP Log 0x0c) not supported

SATA Phy Event Counters (GP Log 0x11)
ID      Size     Value  Description
0x000a  2            4  Device-to-host register FISes sent due to a COMRESET
0x0001  2            0  Command failed due to ICRC error
0x0003  2            0  R_ERR response for device-to-host data FIS
0x0004  2            0  R_ERR response for host-to-device data FIS
0x0006  2            0  R_ERR response for device-to-host non-data FIS
0x0007  2            0  R_ERR response for host-to-device non-data FIS

