smartctl 7.3 2022-02-28 r5338 [x86_64-linux-6.10.9-1-liquorix-amd64] (local build)
Copyright (C) 2002-22, Bruce Allen, Christian Franke, www.smartmontools.org

=== START OF INFORMATION SECTION ===
Model Family:     SAMSUNG SpinPoint M8 (AF)
Device Model:     SAMSUNG HN-M500MBB
Serial Number:    --
LU WWN Device Id: 5 0024e9 ...
Firmware Version: 2AR10001
User Capacity:    500,107,862,016 bytes [500 GB]
Sector Size:      512 bytes logical/physical
Rotation Rate:    5400 rpm
Form Factor:      2.5 inches
Device is:        In smartctl database 7.3/5319
ATA Version is:   ATA8-ACS T13/1699-D revision 6
SATA Version is:  SATA 3.0, 3.0 Gb/s (current: 3.0 Gb/s)
Local Time is:    Mon Sep  9 14:04:14 2024 -03
SMART support is: Available - device has SMART capability.
SMART support is: Enabled
AAM feature is:   Disabled
APM level is:     254 (maximum performance)
Rd look-ahead is: Enabled
Write cache is:   Enabled
DSN feature is:   Unavailable
ATA Security is:  Disabled, NOT FROZEN [SEC1]
Wt Cache Reorder: Enabled

=== START OF READ SMART DATA SECTION ===
SMART overall-health self-assessment test result: PASSED

General SMART Values:
Offline data collection status:  (0x00)	Offline data collection activity
					was never started.
					Auto Offline Data Collection: Disabled.
Self-test execution status:      (   0)	The previous self-test routine completed
					without error or no self-test has ever 
					been run.
Total time to complete Offline 
data collection: 		( 6360) seconds.
Offline data collection
capabilities: 			 (0x5b) SMART execute Offline immediate.
					Auto Offline data collection on/off support.
					Suspend Offline collection upon new
					command.
					Offline surface scan supported.
					Self-test supported.
					No Conveyance Self-test supported.
					Selective Self-test supported.
SMART capabilities:            (0x0003)	Saves SMART data before entering
					power-saving mode.
					Supports SMART auto save timer.
Error logging capability:        (0x01)	Error logging supported.
					General Purpose Logging supported.
Short self-test routine 
recommended polling time: 	 (   2) minutes.
Extended self-test routine
recommended polling time: 	 ( 106) minutes.
SCT capabilities: 	       (0x003f)	SCT Status supported.
					SCT Error Recovery Control supported.
					SCT Feature Control supported.
					SCT Data Table supported.

SMART Attributes Data Structure revision number: 16
Vendor Specific SMART Attributes with Thresholds:
ID# ATTRIBUTE_NAME          FLAGS    VALUE WORST THRESH FAIL RAW_VALUE
  1 Raw_Read_Error_Rate     POSR-K   100   100   051    -    1130
  2 Throughput_Performance  -OS--K   252   252   000    -    0
  3 Spin_Up_Time            PO---K   091   091   025    -    2858
  4 Start_Stop_Count        -O--CK   097   097   000    -    3735
  5 Reallocated_Sector_Ct   PO--CK   252   252   010    -    0
  7 Seek_Error_Rate         -OSR-K   252   252   051    -    0
  8 Seek_Time_Performance   --S--K   252   252   015    -    0
  9 Power_On_Hours          -O--CK   100   100   000    -    4765
 10 Spin_Retry_Count        -O--CK   252   252   051    -    0
 11 Calibration_Retry_Count -O--CK   094   094   000    -    6534
 12 Power_Cycle_Count       -O--CK   097   097   000    -    3511
181 Program_Fail_Cnt_Total  -O---K   100   100   000    -    17814570
191 G-Sense_Error_Rate      -O---K   100   100   000    -    1791
192 Power-Off_Retract_Count -O---K   252   252   000    -    0
194 Temperature_Celsius     -O----   057   040   000    -    43 (Min/Max 9/60)
195 Hardware_ECC_Recovered  -O-RCK   100   100   000    -    0
196 Reallocated_Event_Count -O--CK   252   252   000    -    0
197 Current_Pending_Sector  -O--CK   252   100   000    -    0
198 Offline_Uncorrectable   ----CK   252   252   000    -    0
199 UDMA_CRC_Error_Count    -OS-CK   100   100   000    -    3
200 Multi_Zone_Error_Rate   -O-R-K   100   100   000    -    13724
223 Load_Retry_Count        -O--CK   094   094   000    -    6534
225 Load_Cycle_Count        -O--CK   089   089   000    -    113941
                            ||||||_ K auto-keep
                            |||||__ C event count
                            ||||___ R error rate
                            |||____ S speed/performance
                            ||_____ O updated online
                            |______ P prefailure warning

General Purpose Log Directory Version 1
SMART           Log Directory Version 1 [multi-sector log support]
Address    Access  R/W   Size  Description
0x00       GPL,SL  R/O      1  Log Directory
0x01           SL  R/O      1  Summary SMART error log
0x02           SL  R/O      2  Comprehensive SMART error log
0x03       GPL     R/O      2  Ext. Comprehensive SMART error log
0x06           SL  R/O      1  SMART self-test log
0x07       GPL     R/O      2  Extended self-test log
0x08       GPL     R/O      2  Power Conditions log
0x09           SL  R/W      1  Selective self-test log
0x10       GPL     R/O      1  NCQ Command Error log
0x11       GPL     R/O      1  SATA Phy Event Counters log
0x80-0x9f  GPL,SL  R/W     16  Host vendor specific log
0xc0-0xdf  GPL,SL  VS      16  Device vendor specific log
0xe0       GPL,SL  R/W      1  SCT Command/Status
0xe1       GPL,SL  R/W      1  SCT Data Transfer

SMART Extended Comprehensive Error Log Version: 1 (2 sectors)
Device Error Count: 568 (device log contains only the most recent 8 errors)
	CR     = Command Register
	FEATR  = Features Register
	COUNT  = Count (was: Sector Count) Register
	LBA_48 = Upper bytes of LBA High/Mid/Low Registers ]  ATA-8
	LH     = LBA High (was: Cylinder High) Register    ]   LBA
	LM     = LBA Mid (was: Cylinder Low) Register      ] Register
	LL     = LBA Low (was: Sector Number) Register     ]
	DV     = Device (was: Device/Head) Register
	DC     = Device Control Register
	ER     = Error register
	ST     = Status register
Powered_Up_Time is measured from power on, and printed as
DDd+hh:mm:SS.sss where DD=days, hh=hours, mm=minutes,
SS=sec, and sss=millisec. It "wraps" after 49.710 days.

Error 568 [7] occurred at disk power-on lifetime: 4689 hours (195 days + 9 hours)
  When the command that caused the error occurred, the device was active or idle.

  After command completion occurred, registers were:
  ER -- ST COUNT  LBA_48  LH LM LL DV DC
  -- -- -- == -- == == == -- -- -- -- --
  84 -- 41 00 08 00 00 0c 3b 3c 00 40 00  Error: ICRC, ABRT at LBA = 0x0c3b3c00 = 205208576

  Commands leading to the command that caused the error were:
  CR FEATR COUNT  LBA_48  LH LM LL DV DC  Powered_Up_Time  Command/Feature_Name
  -- == -- == -- == == == -- -- -- -- --  ---------------  --------------------
  60 00 00 00 08 00 00 0c 3b 3c 00 40 08     00:00:00.065  READ FPDMA QUEUED
  60 00 00 00 08 00 00 00 03 2a 50 40 08     00:00:00.066  READ FPDMA QUEUED
  60 00 00 00 08 00 00 0c 3b 48 78 40 08     00:00:00.066  READ FPDMA QUEUED
  60 00 10 00 08 00 00 0c 3b 3c 00 40 00     00:00:00.066  READ FPDMA QUEUED
  ef 00 10 00 02 00 00 00 00 00 00 a0 00     00:00:00.066  SET FEATURES [Enable SATA feature]

Error 567 [6] occurred at disk power-on lifetime: 4689 hours (195 days + 9 hours)
  When the command that caused the error occurred, the device was active or idle.

  After command completion occurred, registers were:
  ER -- ST COUNT  LBA_48  LH LM LL DV DC
  -- -- -- == -- == == == -- -- -- -- --
  84 -- 41 ff e0 00 00 0c 3b 3d 00 40 00  Error: ICRC, ABRT at LBA = 0x0c3b3d00 = 205208832

  Commands leading to the command that caused the error were:
  CR FEATR COUNT  LBA_48  LH LM LL DV DC  Powered_Up_Time  Command/Feature_Name
  -- == -- == -- == == == -- -- -- -- --  ---------------  --------------------
  60 00 00 00 e0 00 00 0c 3b 3d 20 40 08     00:00:00.065  READ FPDMA QUEUED
  60 00 00 00 08 00 00 00 03 2a 50 40 08     00:00:00.066  READ FPDMA QUEUED
  60 00 00 00 08 00 00 0c 3b 48 78 40 00     00:00:00.066  READ FPDMA QUEUED
  60 00 10 02 00 00 00 0c 3b 3c 00 40 00     00:00:00.066  READ FPDMA QUEUED
  60 00 10 00 08 00 00 00 03 2a 48 40 00     00:00:00.066  READ FPDMA QUEUED

Error 566 [5] occurred at disk power-on lifetime: 4689 hours (195 days + 9 hours)
  When the command that caused the error occurred, the device was active or idle.

  After command completion occurred, registers were:
  ER -- ST COUNT  LBA_48  LH LM LL DV DC
  -- -- -- == -- == == == -- -- -- -- --
  84 -- 41 fe 70 00 00 00 03 2b c0 40 00  Error: ICRC, ABRT at LBA = 0x00032bc0 = 207808

  Commands leading to the command that caused the error were:
  CR FEATR COUNT  LBA_48  LH LM LL DV DC  Powered_Up_Time  Command/Feature_Name
  -- == -- == -- == == == -- -- -- -- --  ---------------  --------------------
  60 00 00 00 28 00 00 00 03 2b d8 40 08     00:00:00.065  READ FPDMA QUEUED
  60 00 00 00 08 00 00 0c 3b 48 08 40 08     00:00:00.065  READ FPDMA QUEUED
  60 00 00 00 08 00 00 00 01 12 a8 40 08     00:00:00.065  READ FPDMA QUEUED
  60 00 00 00 08 00 00 0c 3b 3e f8 40 08     00:00:00.065  READ FPDMA QUEUED
  60 00 00 01 f8 00 00 00 03 2a 08 40 08     00:00:00.065  READ FPDMA QUEUED

Error 565 [4] occurred at disk power-on lifetime: 4241 hours (176 days + 17 hours)
  When the command that caused the error occurred, the device was active or idle.

  After command completion occurred, registers were:
  ER -- ST COUNT  LBA_48  LH LM LL DV DC
  -- -- -- == -- == == == -- -- -- -- --
  40 -- 41 01 c8 00 00 00 1b ef 58 40 00  Error: UNC at LBA = 0x001bef58 = 1830744

  Commands leading to the command that caused the error were:
  CR FEATR COUNT  LBA_48  LH LM LL DV DC  Powered_Up_Time  Command/Feature_Name
  -- == -- == -- == == == -- -- -- -- --  ---------------  --------------------
  60 00 00 01 e0 00 00 00 1b ef 40 40 00     00:00:27.666  READ FPDMA QUEUED
  60 00 00 01 e0 00 00 00 1b ef 40 40 00     00:00:27.818  READ FPDMA QUEUED
  2f 00 00 00 01 00 00 00 00 00 10 00 00     00:00:27.818  READ LOG EXT
  60 00 00 01 e0 00 00 00 1b ef 40 40 00     00:00:27.666  READ FPDMA QUEUED
  60 00 00 01 e0 00 00 00 1b ef 40 40 00     00:00:27.812  READ FPDMA QUEUED

Error 564 [3] occurred at disk power-on lifetime: 4241 hours (176 days + 17 hours)
  When the command that caused the error occurred, the device was active or idle.

  After command completion occurred, registers were:
  ER -- ST COUNT  LBA_48  LH LM LL DV DC
  -- -- -- == -- == == == -- -- -- -- --
  40 -- 41 01 c8 00 00 00 1b ef 58 40 00  Error: UNC at LBA = 0x001bef58 = 1830744

  Commands leading to the command that caused the error were:
  CR FEATR COUNT  LBA_48  LH LM LL DV DC  Powered_Up_Time  Command/Feature_Name
  -- == -- == -- == == == -- -- -- -- --  ---------------  --------------------
  60 00 00 01 e0 00 00 00 1b ef 40 40 00     00:00:27.666  READ FPDMA QUEUED
  60 00 00 01 e0 00 00 00 1b ef 40 40 00     00:00:27.812  READ FPDMA QUEUED
  2f 00 00 00 01 00 00 00 00 00 10 00 00     00:00:27.812  READ LOG EXT
  60 00 00 01 e0 00 00 00 1b ef 40 40 00     00:00:27.666  READ FPDMA QUEUED
  60 00 00 01 e0 00 00 00 1b ef 40 40 00     00:00:27.807  READ FPDMA QUEUED

Error 563 [2] occurred at disk power-on lifetime: 4241 hours (176 days + 17 hours)
  When the command that caused the error occurred, the device was active or idle.

  After command completion occurred, registers were:
  ER -- ST COUNT  LBA_48  LH LM LL DV DC
  -- -- -- == -- == == == -- -- -- -- --
  40 -- 41 01 c8 00 00 00 1b ef 58 40 00  Error: UNC at LBA = 0x001bef58 = 1830744

  Commands leading to the command that caused the error were:
  CR FEATR COUNT  LBA_48  LH LM LL DV DC  Powered_Up_Time  Command/Feature_Name
  -- == -- == -- == == == -- -- -- -- --  ---------------  --------------------
  60 00 00 01 e0 00 00 00 1b ef 40 40 00     00:00:27.666  READ FPDMA QUEUED
  60 00 00 01 e0 00 00 00 1b ef 40 40 00     00:00:27.807  READ FPDMA QUEUED
  2f 00 00 00 01 00 00 00 00 00 10 00 00     00:00:27.807  READ LOG EXT
  60 00 00 01 e0 00 00 00 1b ef 40 40 00     00:00:27.666  READ FPDMA QUEUED
  60 00 00 01 e0 00 00 00 1b ef 40 40 00     00:00:27.801  READ FPDMA QUEUED

Error 562 [1] occurred at disk power-on lifetime: 4241 hours (176 days + 17 hours)
  When the command that caused the error occurred, the device was active or idle.

  After command completion occurred, registers were:
  ER -- ST COUNT  LBA_48  LH LM LL DV DC
  -- -- -- == -- == == == -- -- -- -- --
  40 -- 41 01 c8 00 00 00 1b ef 58 40 00  Error: UNC at LBA = 0x001bef58 = 1830744

  Commands leading to the command that caused the error were:
  CR FEATR COUNT  LBA_48  LH LM LL DV DC  Powered_Up_Time  Command/Feature_Name
  -- == -- == -- == == == -- -- -- -- --  ---------------  --------------------
  60 00 00 01 e0 00 00 00 1b ef 40 40 00     00:00:27.666  READ FPDMA QUEUED
  60 00 00 01 e0 00 00 00 1b ef 40 40 00     00:00:27.801  READ FPDMA QUEUED
  2f 00 00 00 01 00 00 00 00 00 10 00 00     00:00:27.801  READ LOG EXT
  60 00 00 01 e0 00 00 00 1b ef 40 40 00     00:00:27.666  READ FPDMA QUEUED
  60 00 00 01 e0 00 00 00 1b ef 40 40 00     00:00:27.796  READ FPDMA QUEUED

Error 561 [0] occurred at disk power-on lifetime: 4241 hours (176 days + 17 hours)
  When the command that caused the error occurred, the device was active or idle.

  After command completion occurred, registers were:
  ER -- ST COUNT  LBA_48  LH LM LL DV DC
  -- -- -- == -- == == == -- -- -- -- --
  40 -- 41 01 c8 00 00 00 1b ef 58 40 00  Error: UNC at LBA = 0x001bef58 = 1830744

  Commands leading to the command that caused the error were:
  CR FEATR COUNT  LBA_48  LH LM LL DV DC  Powered_Up_Time  Command/Feature_Name
  -- == -- == -- == == == -- -- -- -- --  ---------------  --------------------
  60 00 00 01 e0 00 00 00 1b ef 40 40 00     00:00:27.666  READ FPDMA QUEUED
  60 00 00 01 e0 00 00 00 1b ef 40 40 00     00:00:27.796  READ FPDMA QUEUED
  2f 00 00 00 01 00 00 00 00 00 10 00 00     00:00:27.796  READ LOG EXT
  60 00 00 01 e0 00 00 00 1b ef 40 40 00     00:00:27.666  READ FPDMA QUEUED
  60 00 00 01 e0 00 00 00 1b ef 40 40 00     00:00:27.790  READ FPDMA QUEUED

SMART Extended Self-test Log Version: 1 (2 sectors)
No self-tests have been logged.  [To run self-tests, use: smartctl -t]

SMART Selective self-test log data structure revision number 0
Note: revision number not 1 implies that no selective self-test has ever been run
 SPAN  MIN_LBA  MAX_LBA  CURRENT_TEST_STATUS
    1        0        0  Completed [00% left] (0-65535)
    2        0        0  Not_testing
    3        0        0  Not_testing
    4        0        0  Not_testing
    5        0        0  Not_testing
Selective self-test flags (0x0):
  After scanning selected spans, do NOT read-scan remainder of disk.
If Selective self-test is pending on power-up, resume after 0 minute delay.

SCT Status Version:                  2
SCT Version (vendor specific):       256 (0x0100)
Device State:                        Active (0)
Current Temperature:                    43 Celsius
Power Cycle Min/Max Temperature:     41/43 Celsius
Lifetime    Min/Max Temperature:      9/61 Celsius
Specified Max Operating Temperature:    80 Celsius
Under/Over Temperature Limit Count:   0/0

SCT Temperature History Version:     2
Temperature Sampling Period:         5 minutes
Temperature Logging Interval:        5 minutes
Min/Max recommended Temperature:     -5/80 Celsius
Min/Max Temperature Limit:           -10/85 Celsius
Temperature History Size (Index):    128 (120)

SCT Error Recovery Control:
           Read: Disabled
          Write: Disabled

Device Statistics (GP/SMART Log 0x04) not supported

Pending Defects log (GP Log 0x0c) not supported

SATA Phy Event Counters (GP Log 0x11)
ID      Size     Value  Description
0x0001  4            0  Command failed due to ICRC error
0x0002  4            0  R_ERR response for data FIS
0x0003  4            0  R_ERR response for device-to-host data FIS
0x0004  4            0  R_ERR response for host-to-device data FIS
0x0005  4            0  R_ERR response for non-data FIS
0x0006  4            0  R_ERR response for device-to-host non-data FIS
0x0007  4            0  R_ERR response for host-to-device non-data FIS
0x0008  4            0  Device-to-host non-data FIS retries
0x0009  4          181  Transition from drive PhyRdy to drive PhyNRdy
0x000a  4            6  Device-to-host register FISes sent due to a COMRESET
0x000b  4            0  CRC errors within host-to-device FIS
0x000d  4            0  Non-CRC errors within host-to-device FIS
0x000f  4            0  R_ERR response for host-to-device data FIS, CRC
0x0010  4            0  R_ERR response for host-to-device data FIS, non-CRC
0x0012  4            0  R_ERR response for host-to-device non-data FIS, CRC
0x0013  4            0  R_ERR response for host-to-device non-data FIS, non-CRC
0x8e00  4            0  Vendor specific
0x8e01  4            0  Vendor specific
0x8e02  4            0  Vendor specific
0x8e03  4            0  Vendor specific
0x8e04  4            0  Vendor specific
0x8e05  4            0  Vendor specific
0x8e06  4            0  Vendor specific
0x8e07  4            0  Vendor specific
0x8e08  4            0  Vendor specific
0x8e09  4            0  Vendor specific
0x8e0a  4            0  Vendor specific
0x8e0b  4            0  Vendor specific
0x8e0c  4            0  Vendor specific
0x8e0d  4            0  Vendor specific
0x8e0e  4            0  Vendor specific
0x8e0f  4            0  Vendor specific
0x8e10  4            0  Vendor specific
0x8e11  4            0  Vendor specific

