smartctl 7.2 2020-12-30 r5155 [x86_64-linux-5.10.14-desktop-1omv4002] (OpenMandriva Lx 7.2-2)
Copyright (C) 2002-20, Bruce Allen, Christian Franke, www.smartmontools.org

=== START OF INFORMATION SECTION ===
Model Family:     SK hynix SATA SSDs
Device Model:     HFS256G39TND-N210A
Serial Number:    --
Firmware Version: 30001P10
User Capacity:    256,060,514,304 bytes [256 GB]
Sector Sizes:     512 bytes logical, 4096 bytes physical
Rotation Rate:    Solid State Device
Form Factor:      M.2
TRIM Command:     Available, deterministic
Device is:        In smartctl database [for details use: -P show]
ATA Version is:   ACS-2 (minor revision not indicated)
SATA Version is:  SATA 3.1, 6.0 Gb/s (current: 6.0 Gb/s)
Local Time is:    Fri Apr  2 08:50:27 2021 WEST
SMART support is: Available - device has SMART capability.
SMART support is: Enabled
AAM feature is:   Unavailable
APM feature is:   Disabled
Rd look-ahead is: Enabled
Write cache is:   Enabled
DSN feature is:   Unavailable
ATA Security is:  Disabled, frozen [SEC2]
Wt Cache Reorder: Unavailable

=== START OF READ SMART DATA SECTION ===
SMART overall-health self-assessment test result: PASSED

General SMART Values:
Offline data collection status:  (0x02)	Offline data collection activity
					was completed without error.
					Auto Offline Data Collection: Disabled.
Self-test execution status:      (  32)	The self-test routine was interrupted
					by the host with a hard or soft reset.
Total time to complete Offline 
data collection: 		(  104) seconds.
Offline data collection
capabilities: 			 (0x19) SMART execute Offline immediate.
					No Auto Offline data collection support.
					Suspend Offline collection upon new
					command.
					Offline surface scan supported.
					Self-test supported.
					No Conveyance Self-test supported.
					No Selective Self-test supported.
SMART capabilities:            (0x0002)	Does not save SMART data before
					entering power-saving mode.
					Supports SMART auto save timer.
Error logging capability:        (0x01)	Error logging supported.
					General Purpose Logging supported.
Short self-test routine 
recommended polling time: 	 (   2) minutes.
Extended self-test routine
recommended polling time: 	 (  20) minutes.

SMART Attributes Data Structure revision number: 0
Vendor Specific SMART Attributes with Thresholds:
ID# ATTRIBUTE_NAME          FLAGS    VALUE WORST THRESH FAIL RAW_VALUE
  1 Raw_Read_Error_Rate     POSR--   166   166   006    -    0
  5 Retired_Block_Count     -O--CK   253   100   036    -    0
  9 Power_On_Hours          -O--CK   094   094   000    -    5779
 12 Power_Cycle_Count       -O--CK   100   100   020    -    2186
100 Total_Erase_Count       -O--CK   100   100   000    -    17129153
168 Min_Erase_Count         -O--CK   253   072   000    -    0
169 Max_Erase_Count         -O--CK   070   070   000    -    326
171 Program_Fail_Count      -O--CK   253   253   000    -    0
172 Erase_Fail_Count        -O--CK   253   253   000    -    0
174 Unexpect_Power_Loss_Ct  ----CK   100   100   000    -    393
175 Program_Fail_Count_Chip -O--CK   253   253   000    -    0
176 Unused_Rsvd_Blk_Cnt_Tot -O--CK   253   253   000    -    0
177 Wear_Leveling_Count     -O--CK   076   076   000    -    261
178 Used_Rsvd_Blk_Cnt_Chip  -O--CK   100   100   000    -    104
179 Used_Rsvd_Blk_Cnt_Tot   -O--CK   100   100   000    -    303
180 Erase_Fail_Count        -O--CK   100   100   000    -    5137
184 End-to-End_Error        -O--CK   253   253   000    -    0
187 Reported_Uncorrect      -O--CK   253   253   000    -    0
188 Command_Timeout         -O--CK   253   253   000    -    0
194 Temperature_Celsius     -O----   037   000   000    -    37 (Min/Max 14/73)
195 Hardware_ECC_Recovered  -O--CK   253   253   000    -    0
196 Reallocated_Event_Count -O--CK   253   100   036    -    0
198 Offline_Uncorrectable   -O--CK   253   253   000    -    0
199 UDMA_CRC_Error_Count    -O--CK   253   253   000    -    0
204 Soft_ECC_Correction     -OSR--   100   001   000    -    4
212 Phy_Error_Count         -O--CK   253   253   000    -    0
234 Unknown_SK_hynix_Attrib -O--CK   100   100   000    -    72017
241 Total_Writes_GiB        -O--CK   100   100   000    -    16085
242 Total_Reads_GiB         -O--CK   100   100   000    -    15337
250 Read_Retry_Count        -O--CK   100   100   000    -    9070031
                            ||||||_ K auto-keep
                            |||||__ C event count
                            ||||___ R error rate
                            |||____ S speed/performance
                            ||_____ O updated online
                            |______ P prefailure warning

General Purpose Log Directory Version 1
SMART           Log Directory Version 1 [multi-sector log support]
Address    Access  R/W   Size  Description
0x00       GPL,SL  R/O      1  Log Directory
0x01           SL  R/O      1  Summary SMART error log
0x02           SL  R/O      4  Comprehensive SMART error log
0x03       GPL     R/O      5  Ext. Comprehensive SMART error log
0x04       GPL,SL  R/O      8  Device Statistics log
0x06           SL  R/O      1  SMART self-test log
0x07       GPL     R/O      2  Extended self-test log
0x10       GPL     R/O      1  NCQ Command Error log
0x11       GPL     R/O      1  SATA Phy Event Counters log
0x30       GPL     R/O      8  IDENTIFY DEVICE data log
0x80-0x9f  GPL,SL  R/W     16  Host vendor specific log

SMART Extended Comprehensive Error Log Version: 1 (5 sectors)
No Errors Logged

Warning! SMART Extended Self-test Log Structure (1/2) error: invalid SMART checksum.
SMART Extended Self-test Log Version: 1 (2 sectors)
Num  Test_Description    Status                  Remaining  LifeTime(hours)  LBA_of_first_error
# 1  Short offline       Completed without error       00%      5580         -
# 2  Short offline       Completed without error       00%      4874         -
# 3  Short offline       Completed without error       00%      4130         -
# 4  Short offline       Completed without error       00%      4119         -
# 5  Short offline       Completed without error       00%      4099         -
# 6  Short offline       Completed without error       00%      4082         -
# 7  Short offline       Completed without error       00%      4069         -
# 8  Short offline       Completed without error       00%      4056         -
# 9  Short offline       Completed without error       00%      4040         -
#10  Short offline       Completed without error       00%      4026         -
#11  Short offline       Completed without error       00%      4005         -
#12  Short offline       Completed without error       00%      3987         -
#13  Short offline       Completed without error       00%      3971         -
#14  Short offline       Completed without error       00%      3958         -
#15  Short offline       Completed without error       00%      3944         -
#16  Short offline       Completed without error       00%      3932         -
#17  Short offline       Completed without error       00%      3914         -
#18  Short offline       Completed without error       00%      3897         -
#19  Short offline       Completed without error       00%      3684         -
#20  Short offline       Completed without error       00%      3670         -
#21  Short offline       Completed without error       00%        49         -

Selective Self-tests/Logging not supported

SCT Commands not supported

Device Statistics (GP Log 0x04)
Page  Offset Size        Value Flags Description
0x01  =====  =               =  ===  == General Statistics (empty) ==
0x04  =====  =               =  ===  == General Errors Statistics (empty) ==
0x05  =====  =               =  ===  == Temperature Statistics (empty) ==
0x06  =====  =               =  ===  == Transport Statistics (empty) ==
0x07  =====  =               =  ===  == Solid State Device Statistics (empty) ==
                                |||_ C monitored condition met
                                ||__ D supports DSN
                                |___ N normalized value

Pending Defects log (GP Log 0x0c) not supported

SATA Phy Event Counters (GP Log 0x11)
ID      Size     Value  Description
0x0001  2            0  Command failed due to ICRC error
0x000a  2            8  Device-to-host register FISes sent due to a COMRESET

