smartctl 7.1 2019-12-30 r5022 [x86_64-linux-5.15.0-79-generic] (local build)
Copyright (C) 2002-19, Bruce Allen, Christian Franke, www.smartmontools.org

=== START OF INFORMATION SECTION ===
Model Family:     Western Digital Blue
Device Model:     WDC WD10EZEX-00BN5A0
Serial Number:    --
LU WWN Device Id: 5 0014ee ...
Firmware Version: 01.01A01
User Capacity:    1,000,204,886,016 bytes [1.00 TB]
Sector Sizes:     512 bytes logical, 4096 bytes physical
Rotation Rate:    7200 rpm
Device is:        In smartctl database [for details use: -P show]
ATA Version is:   ACS-2, ACS-3 T13/2161-D revision 3b
SATA Version is:  SATA 3.1, 6.0 Gb/s (current: 6.0 Gb/s)
Local Time is:    Wed Aug 16 22:22:50 2023 EDT
SMART support is: Available - device has SMART capability.
SMART support is: Enabled
AAM feature is:   Unavailable
APM feature is:   Unavailable
Rd look-ahead is: Enabled
Write cache is:   Enabled
DSN feature is:   Unavailable
ATA Security is:  Disabled, frozen [SEC2]
Wt Cache Reorder: Enabled

=== START OF READ SMART DATA SECTION ===
SMART overall-health self-assessment test result: PASSED

General SMART Values:
Offline data collection status:  (0x82)	Offline data collection activity
					was completed without error.
					Auto Offline Data Collection: Enabled.
Self-test execution status:      (   0)	The previous self-test routine completed
					without error or no self-test has ever 
					been run.
Total time to complete Offline 
data collection: 		(12000) seconds.
Offline data collection
capabilities: 			 (0x7b) SMART execute Offline immediate.
					Auto Offline data collection on/off support.
					Suspend Offline collection upon new
					command.
					Offline surface scan supported.
					Self-test supported.
					Conveyance Self-test supported.
					Selective Self-test supported.
SMART capabilities:            (0x0003)	Saves SMART data before entering
					power-saving mode.
					Supports SMART auto save timer.
Error logging capability:        (0x01)	Error logging supported.
					General Purpose Logging supported.
Short self-test routine 
recommended polling time: 	 (   2) minutes.
Extended self-test routine
recommended polling time: 	 ( 124) minutes.
Conveyance self-test routine
recommended polling time: 	 (   5) minutes.
SCT capabilities: 	       (0x3035)	SCT Status supported.
					SCT Feature Control supported.
					SCT Data Table supported.

SMART Attributes Data Structure revision number: 16
Vendor Specific SMART Attributes with Thresholds:
ID# ATTRIBUTE_NAME          FLAGS    VALUE WORST THRESH FAIL RAW_VALUE
  1 Raw_Read_Error_Rate     POSR-K   200   199   051    -    1714
  3 Spin_Up_Time            POS--K   176   173   021    -    2166
  4 Start_Stop_Count        -O--CK   100   100   000    -    575
  5 Reallocated_Sector_Ct   PO--CK   200   200   140    -    0
  7 Seek_Error_Rate         -OSR-K   200   200   000    -    0
  9 Power_On_Hours          -O--CK   061   061   000    -    29114
 10 Spin_Retry_Count        -O--CK   100   100   000    -    0
 11 Calibration_Retry_Count -O--CK   100   100   000    -    0
 12 Power_Cycle_Count       -O--CK   100   100   000    -    572
192 Power-Off_Retract_Count -O--CK   200   200   000    -    174
193 Load_Cycle_Count        -O--CK   200   200   000    -    1012
194 Temperature_Celsius     -O---K   113   089   000    -    30
196 Reallocated_Event_Count -O--CK   200   200   000    -    0
197 Current_Pending_Sector  -O--CK   200   200   000    -    0
198 Offline_Uncorrectable   ----CK   200   200   000    -    0
199 UDMA_CRC_Error_Count    -O--CK   200   200   000    -    0
200 Multi_Zone_Error_Rate   ---R--   200   200   000    -    0
                            ||||||_ K auto-keep
                            |||||__ C event count
                            ||||___ R error rate
                            |||____ S speed/performance
                            ||_____ O updated online
                            |______ P prefailure warning

General Purpose Log Directory Version 1
SMART           Log Directory Version 1 [multi-sector log support]
Address    Access  R/W   Size  Description
0x00       GPL,SL  R/O      1  Log Directory
0x01           SL  R/O      1  Summary SMART error log
0x02           SL  R/O      5  Comprehensive SMART error log
0x03       GPL     R/O      6  Ext. Comprehensive SMART error log
0x06           SL  R/O      1  SMART self-test log
0x07       GPL     R/O      1  Extended self-test log
0x09           SL  R/W      1  Selective self-test log
0x10       GPL     R/O      1  NCQ Command Error log
0x11       GPL     R/O      1  SATA Phy Event Counters log
0x80-0x9f  GPL,SL  R/W     16  Host vendor specific log
0xa0-0xa7  GPL,SL  VS      16  Device vendor specific log
0xa8-0xb7  GPL,SL  VS       1  Device vendor specific log
0xbd       GPL,SL  VS       1  Device vendor specific log
0xc0       GPL,SL  VS       1  Device vendor specific log
0xc1       GPL     VS      93  Device vendor specific log
0xe0       GPL,SL  R/W      1  SCT Command/Status
0xe1       GPL,SL  R/W      1  SCT Data Transfer

SMART Extended Comprehensive Error Log Version: 1 (6 sectors)
Device Error Count: 1700 (device log contains only the most recent 24 errors)
	CR     = Command Register
	FEATR  = Features Register
	COUNT  = Count (was: Sector Count) Register
	LBA_48 = Upper bytes of LBA High/Mid/Low Registers ]  ATA-8
	LH     = LBA High (was: Cylinder High) Register    ]   LBA
	LM     = LBA Mid (was: Cylinder Low) Register      ] Register
	LL     = LBA Low (was: Sector Number) Register     ]
	DV     = Device (was: Device/Head) Register
	DC     = Device Control Register
	ER     = Error register
	ST     = Status register
Powered_Up_Time is measured from power on, and printed as
DDd+hh:mm:SS.sss where DD=days, hh=hours, mm=minutes,
SS=sec, and sss=millisec. It "wraps" after 49.710 days.

Error 1700 [19] occurred at disk power-on lifetime: 2486 hours (103 days + 14 hours)
  When the command that caused the error occurred, the device was active or idle.

  After command completion occurred, registers were:
  ER -- ST COUNT  LBA_48  LH LM LL DV DC
  -- -- -- == -- == == == -- -- -- -- --
  40 -- 51 00 00 00 00 00 10 08 09 40 00  Error: UNC at LBA = 0x00100809 = 1050633

  Commands leading to the command that caused the error were:
  CR FEATR COUNT  LBA_48  LH LM LL DV DC  Powered_Up_Time  Command/Feature_Name
  -- == -- == -- == == == -- -- -- -- --  ---------------  --------------------
  60 00 08 00 90 00 00 00 10 08 08 40 08     00:00:01.491  READ FPDMA QUEUED
  60 00 08 00 88 00 00 74 70 67 f8 40 08     00:00:01.491  READ FPDMA QUEUED
  60 00 08 00 80 00 00 00 00 10 00 40 08     00:00:01.491  READ FPDMA QUEUED
  b0 00 da 00 00 00 00 00 c2 4f 00 00 08     00:00:01.448  SMART RETURN STATUS
  ef 00 10 00 02 00 00 00 00 00 00 a0 08     00:00:01.448  SET FEATURES [Enable SATA feature]

Error 1699 [18] occurred at disk power-on lifetime: 2486 hours (103 days + 14 hours)
  When the command that caused the error occurred, the device was active or idle.

  After command completion occurred, registers were:
  ER -- ST COUNT  LBA_48  LH LM LL DV DC
  -- -- -- == -- == == == -- -- -- -- --
  40 -- 51 00 00 00 00 00 10 08 09 40 00  Error: UNC at LBA = 0x00100809 = 1050633

  Commands leading to the command that caused the error were:
  CR FEATR COUNT  LBA_48  LH LM LL DV DC  Powered_Up_Time  Command/Feature_Name
  -- == -- == -- == == == -- -- -- -- --  ---------------  --------------------
  60 00 08 00 20 00 00 00 10 08 08 40 08     00:00:01.257  READ FPDMA QUEUED
  60 00 08 00 18 00 00 74 3e d8 08 40 08     00:00:01.257  READ FPDMA QUEUED
  60 00 08 00 10 00 00 00 10 06 f8 40 08     00:00:01.257  READ FPDMA QUEUED
  b0 00 d0 00 01 00 00 00 c2 4f 00 00 08     00:00:01.253  SMART READ DATA
  60 00 08 00 00 00 00 00 10 08 00 40 08     00:00:01.253  READ FPDMA QUEUED

Error 1698 [17] occurred at disk power-on lifetime: 2486 hours (103 days + 14 hours)
  When the command that caused the error occurred, the device was active or idle.

  After command completion occurred, registers were:
  ER -- ST COUNT  LBA_48  LH LM LL DV DC
  -- -- -- == -- == == == -- -- -- -- --
  40 -- 51 00 00 00 00 00 10 08 09 40 00  Error: UNC at LBA = 0x00100809 = 1050633

  Commands leading to the command that caused the error were:
  CR FEATR COUNT  LBA_48  LH LM LL DV DC  Powered_Up_Time  Command/Feature_Name
  -- == -- == -- == == == -- -- -- -- --  ---------------  --------------------
  60 00 08 00 58 00 00 00 10 08 08 40 08 15d+03:46:39.624  READ FPDMA QUEUED
  ef 00 10 00 02 00 00 00 00 00 00 a0 08 15d+03:46:39.624  SET FEATURES [Enable SATA feature]
  27 00 00 00 00 00 00 00 00 00 00 e0 08 15d+03:46:39.624  READ NATIVE MAX ADDRESS EXT [OBS-ACS-3]
  ec 00 00 00 00 00 00 00 00 00 00 a0 08 15d+03:46:39.624  IDENTIFY DEVICE
  ef 00 03 00 46 00 00 00 00 00 00 a0 08 15d+03:46:39.624  SET FEATURES [Set transfer mode]

Error 1697 [16] occurred at disk power-on lifetime: 2486 hours (103 days + 14 hours)
  When the command that caused the error occurred, the device was active or idle.

  After command completion occurred, registers were:
  ER -- ST COUNT  LBA_48  LH LM LL DV DC
  -- -- -- == -- == == == -- -- -- -- --
  40 -- 51 00 00 00 00 00 10 08 09 40 00  Error: UNC at LBA = 0x00100809 = 1050633

  Commands leading to the command that caused the error were:
  CR FEATR COUNT  LBA_48  LH LM LL DV DC  Powered_Up_Time  Command/Feature_Name
  -- == -- == -- == == == -- -- -- -- --  ---------------  --------------------
  60 00 08 00 38 00 00 00 10 08 08 40 08 15d+03:46:39.433  READ FPDMA QUEUED
  60 00 08 00 30 00 00 00 10 08 00 40 08 15d+03:46:39.432  READ FPDMA QUEUED
  60 00 08 00 28 00 00 74 3e d7 f0 40 08 15d+03:46:39.432  READ FPDMA QUEUED
  60 00 08 00 20 00 00 74 3e d7 80 40 08 15d+03:46:39.408  READ FPDMA QUEUED
  60 00 40 00 40 00 00 00 01 19 80 40 08 15d+03:46:39.306  READ FPDMA QUEUED

Error 1696 [15] occurred at disk power-on lifetime: 2486 hours (103 days + 14 hours)
  When the command that caused the error occurred, the device was active or idle.

  After command completion occurred, registers were:
  ER -- ST COUNT  LBA_48  LH LM LL DV DC
  -- -- -- == -- == == == -- -- -- -- --
  40 -- 51 00 00 00 00 00 10 08 09 40 00  Error: UNC at LBA = 0x00100809 = 1050633

  Commands leading to the command that caused the error were:
  CR FEATR COUNT  LBA_48  LH LM LL DV DC  Powered_Up_Time  Command/Feature_Name
  -- == -- == -- == == == -- -- -- -- --  ---------------  --------------------
  60 00 08 00 48 00 00 00 10 08 08 40 08 15d+03:46:39.041  READ FPDMA QUEUED
  ef 00 10 00 02 00 00 00 00 00 00 a0 08 15d+03:46:39.041  SET FEATURES [Enable SATA feature]
  27 00 00 00 00 00 00 00 00 00 00 e0 08 15d+03:46:39.041  READ NATIVE MAX ADDRESS EXT [OBS-ACS-3]
  ec 00 00 00 00 00 00 00 00 00 00 a0 08 15d+03:46:39.041  IDENTIFY DEVICE
  ef 00 03 00 46 00 00 00 00 00 00 a0 08 15d+03:46:39.041  SET FEATURES [Set transfer mode]

Error 1695 [14] occurred at disk power-on lifetime: 2486 hours (103 days + 14 hours)
  When the command that caused the error occurred, the device was active or idle.

  After command completion occurred, registers were:
  ER -- ST COUNT  LBA_48  LH LM LL DV DC
  -- -- -- == -- == == == -- -- -- -- --
  40 -- 51 00 00 00 00 00 10 08 09 40 00  Error: UNC at LBA = 0x00100809 = 1050633

  Commands leading to the command that caused the error were:
  CR FEATR COUNT  LBA_48  LH LM LL DV DC  Powered_Up_Time  Command/Feature_Name
  -- == -- == -- == == == -- -- -- -- --  ---------------  --------------------
  60 00 08 00 e8 00 00 00 10 08 08 40 08 15d+03:46:38.864  READ FPDMA QUEUED
  ef 00 10 00 02 00 00 00 00 00 00 a0 08 15d+03:46:38.864  SET FEATURES [Enable SATA feature]
  27 00 00 00 00 00 00 00 00 00 00 e0 08 15d+03:46:38.864  READ NATIVE MAX ADDRESS EXT [OBS-ACS-3]
  ec 00 00 00 00 00 00 00 00 00 00 a0 08 15d+03:46:38.864  IDENTIFY DEVICE
  ef 00 03 00 46 00 00 00 00 00 00 a0 08 15d+03:46:38.864  SET FEATURES [Set transfer mode]

Error 1694 [13] occurred at disk power-on lifetime: 2486 hours (103 days + 14 hours)
  When the command that caused the error occurred, the device was active or idle.

  After command completion occurred, registers were:
  ER -- ST COUNT  LBA_48  LH LM LL DV DC
  -- -- -- == -- == == == -- -- -- -- --
  40 -- 51 00 00 00 00 00 10 08 09 40 00  Error: UNC at LBA = 0x00100809 = 1050633

  Commands leading to the command that caused the error were:
  CR FEATR COUNT  LBA_48  LH LM LL DV DC  Powered_Up_Time  Command/Feature_Name
  -- == -- == -- == == == -- -- -- -- --  ---------------  --------------------
  60 00 08 00 30 00 00 00 10 08 08 40 08 15d+03:46:38.685  READ FPDMA QUEUED
  ef 00 10 00 02 00 00 00 00 00 00 a0 08 15d+03:46:38.684  SET FEATURES [Enable SATA feature]
  27 00 00 00 00 00 00 00 00 00 00 e0 08 15d+03:46:38.684  READ NATIVE MAX ADDRESS EXT [OBS-ACS-3]
  ec 00 00 00 00 00 00 00 00 00 00 a0 08 15d+03:46:38.684  IDENTIFY DEVICE
  ef 00 03 00 46 00 00 00 00 00 00 a0 08 15d+03:46:38.684  SET FEATURES [Set transfer mode]

Error 1693 [12] occurred at disk power-on lifetime: 2486 hours (103 days + 14 hours)
  When the command that caused the error occurred, the device was active or idle.

  After command completion occurred, registers were:
  ER -- ST COUNT  LBA_48  LH LM LL DV DC
  -- -- -- == -- == == == -- -- -- -- --
  40 -- 51 00 00 00 00 00 10 08 09 40 00  Error: UNC at LBA = 0x00100809 = 1050633

  Commands leading to the command that caused the error were:
  CR FEATR COUNT  LBA_48  LH LM LL DV DC  Powered_Up_Time  Command/Feature_Name
  -- == -- == -- == == == -- -- -- -- --  ---------------  --------------------
  60 00 08 00 68 00 00 00 10 08 08 40 08 15d+03:46:38.510  READ FPDMA QUEUED
  ef 00 10 00 02 00 00 00 00 00 00 a0 08 15d+03:46:38.510  SET FEATURES [Enable SATA feature]
  27 00 00 00 00 00 00 00 00 00 00 e0 08 15d+03:46:38.510  READ NATIVE MAX ADDRESS EXT [OBS-ACS-3]
  ec 00 00 00 00 00 00 00 00 00 00 a0 08 15d+03:46:38.509  IDENTIFY DEVICE
  ef 00 03 00 46 00 00 00 00 00 00 a0 08 15d+03:46:38.509  SET FEATURES [Set transfer mode]

SMART Extended Self-test Log Version: 1 (1 sectors)
Num  Test_Description    Status                  Remaining  LifeTime(hours)  LBA_of_first_error
# 1  Extended offline    Completed without error       00%     15409         -
# 2  Short offline       Completed without error       00%     15406         -
# 3  Extended offline    Completed without error       00%      6663         -
# 4  Short offline       Completed without error       00%      6661         -
# 5  Extended offline    Completed without error       00%      4987         -
# 6  Short offline       Completed without error       00%      4985         -
# 7  Selective offline   Completed without error       00%      2487         -
# 8  Selective offline   Aborted by host               70%      2487         -
# 9  Selective offline   Completed without error       00%      2487         -
#10  Selective offline   Completed without error       00%      2487         -
#11  Selective offline   Completed: read failure       90%      2487         1050647
#12  Selective offline   Completed: read failure       90%      2487         1050646
#13  Selective offline   Completed: read failure       90%      2487         1050645
#14  Selective offline   Completed: read failure       90%      2487         1050639
#15  Selective offline   Completed: read failure       90%      2487         1050638
#16  Selective offline   Completed: read failure       90%      2487         1050637
#17  Selective offline   Completed: read failure       90%      2487         1050636
#18  Selective offline   Completed: read failure       90%      2487         1050635
8 of 8 failed self-tests are outdated by newer successful extended offline self-test # 1

SMART Selective self-test log data structure revision number 1
 SPAN  MIN_LBA  MAX_LBA  CURRENT_TEST_STATUS
    1        0        0  Not_testing
    2        0        0  Not_testing
    3        0        0  Not_testing
    4        0        0  Not_testing
    5        0        0  Not_testing
Selective self-test flags (0x0):
  After scanning selected spans, do NOT read-scan remainder of disk.
If Selective self-test is pending on power-up, resume after 0 minute delay.

SCT Status Version:                  3
SCT Version (vendor specific):       258 (0x0102)
Device State:                        Active (0)
Current Temperature:                    30 Celsius
Power Cycle Min/Max Temperature:     29/30 Celsius
Lifetime    Min/Max Temperature:      0/54 Celsius
Under/Over Temperature Limit Count:   0/0
Vendor specific:
00 01 00 00 00 00 00 00 00 00 00 00 00 00 00 00
00 00 00 00 00 00 00 00 00 00 00 00 00 00 00 00

SCT Temperature History Version:     2
Temperature Sampling Period:         1 minute
Temperature Logging Interval:        1 minute
Min/Max recommended Temperature:      0/60 Celsius
Min/Max Temperature Limit:           -41/85 Celsius
Temperature History Size (Index):    478 (450)

SCT Error Recovery Control command not supported

Device Statistics (GP/SMART Log 0x04) not supported

Pending Defects log (GP Log 0x0c) not supported

SATA Phy Event Counters (GP Log 0x11)
ID      Size     Value  Description
0x0001  2            0  Command failed due to ICRC error
0x0002  2            0  R_ERR response for data FIS
0x0003  2            0  R_ERR response for device-to-host data FIS
0x0004  2            0  R_ERR response for host-to-device data FIS
0x0005  2            0  R_ERR response for non-data FIS
0x0006  2            0  R_ERR response for device-to-host non-data FIS
0x0007  2            0  R_ERR response for host-to-device non-data FIS
0x0008  2            0  Device-to-host non-data FIS retries
0x0009  2        48383  Transition from drive PhyRdy to drive PhyNRdy
0x000a  2           18  Device-to-host register FISes sent due to a COMRESET
0x000b  2            0  CRC errors within host-to-device FIS
0x000f  2            0  R_ERR response for host-to-device data FIS, CRC
0x0012  2            0  R_ERR response for host-to-device non-data FIS, CRC
0x8000  4       210990  Vendor specific



