smartctl 7.1 2019-12-30 r5022 [x86_64-linux-5.4.0-65-generic] (local build)
Copyright (C) 2002-19, Bruce Allen, Christian Franke, www.smartmontools.org

=== START OF INFORMATION SECTION ===
Model Family:     Western Digital Blue
Device Model:     WDC WD10EZEX-00BN5A0
Serial Number:    --
LU WWN Device Id: 5 0014ee ...
Firmware Version: 01.01A01
User Capacity:    1,000,204,886,016 bytes [1.00 TB]
Sector Sizes:     512 bytes logical, 4096 bytes physical
Rotation Rate:    7200 rpm
Device is:        In smartctl database [for details use: -P show]
ATA Version is:   ACS-2, ACS-3 T13/2161-D revision 3b
SATA Version is:  SATA 3.1, 6.0 Gb/s (current: 6.0 Gb/s)
Local Time is:    Fri Feb 12 21:35:02 2021 CET
SMART support is: Available - device has SMART capability.
SMART support is: Enabled
AAM feature is:   Unavailable
APM feature is:   Unavailable
Rd look-ahead is: Enabled
Write cache is:   Enabled
DSN feature is:   Unavailable
ATA Security is:  Disabled, frozen [SEC2]
Wt Cache Reorder: Enabled

=== START OF READ SMART DATA SECTION ===
SMART overall-health self-assessment test result: PASSED

General SMART Values:
Offline data collection status:  (0x82)	Offline data collection activity
					was completed without error.
					Auto Offline Data Collection: Enabled.
Self-test execution status:      (   0)	The previous self-test routine completed
					without error or no self-test has ever 
					been run.
Total time to complete Offline 
data collection: 		(11040) seconds.
Offline data collection
capabilities: 			 (0x7b) SMART execute Offline immediate.
					Auto Offline data collection on/off support.
					Suspend Offline collection upon new
					command.
					Offline surface scan supported.
					Self-test supported.
					Conveyance Self-test supported.
					Selective Self-test supported.
SMART capabilities:            (0x0003)	Saves SMART data before entering
					power-saving mode.
					Supports SMART auto save timer.
Error logging capability:        (0x01)	Error logging supported.
					General Purpose Logging supported.
Short self-test routine 
recommended polling time: 	 (   2) minutes.
Extended self-test routine
recommended polling time: 	 ( 114) minutes.
Conveyance self-test routine
recommended polling time: 	 (   5) minutes.
SCT capabilities: 	       (0x3035)	SCT Status supported.
					SCT Feature Control supported.
					SCT Data Table supported.

SMART Attributes Data Structure revision number: 16
Vendor Specific SMART Attributes with Thresholds:
ID# ATTRIBUTE_NAME          FLAGS    VALUE WORST THRESH FAIL RAW_VALUE
  1 Raw_Read_Error_Rate     POSR-K   199   199   051    -    33379
  3 Spin_Up_Time            POS--K   180   171   021    -    1991
  4 Start_Stop_Count        -O--CK   084   084   000    -    16445
  5 Reallocated_Sector_Ct   PO--CK   200   200   140    -    0
  7 Seek_Error_Rate         -OSR-K   200   200   000    -    0
  9 Power_On_Hours          -O--CK   071   071   000    -    21873
 10 Spin_Retry_Count        -O--CK   100   100   000    -    0
 11 Calibration_Retry_Count -O--CK   100   100   000    -    0
 12 Power_Cycle_Count       -O--CK   096   096   000    -    4383
192 Power-Off_Retract_Count -O--CK   200   200   000    -    286
193 Load_Cycle_Count        -O--CK   195   195   000    -    16171
194 Temperature_Celsius     -O---K   113   098   000    -    30
196 Reallocated_Event_Count -O--CK   200   200   000    -    0
197 Current_Pending_Sector  -O--CK   200   200   000    -    114
198 Offline_Uncorrectable   ----CK   200   200   000    -    96
199 UDMA_CRC_Error_Count    -O--CK   200   199   000    -    1903
200 Multi_Zone_Error_Rate   ---R--   200   200   000    -    151
                            ||||||_ K auto-keep
                            |||||__ C event count
                            ||||___ R error rate
                            |||____ S speed/performance
                            ||_____ O updated online
                            |______ P prefailure warning

General Purpose Log Directory Version 1
SMART           Log Directory Version 1 [multi-sector log support]
Address    Access  R/W   Size  Description
0x00       GPL,SL  R/O      1  Log Directory
0x01           SL  R/O      1  Summary SMART error log
0x02           SL  R/O      5  Comprehensive SMART error log
0x03       GPL     R/O      6  Ext. Comprehensive SMART error log
0x06           SL  R/O      1  SMART self-test log
0x07       GPL     R/O      1  Extended self-test log
0x09           SL  R/W      1  Selective self-test log
0x10       GPL     R/O      1  NCQ Command Error log
0x11       GPL     R/O      1  SATA Phy Event Counters log
0x80-0x9f  GPL,SL  R/W     16  Host vendor specific log
0xa0-0xa7  GPL,SL  VS      16  Device vendor specific log
0xa8-0xb7  GPL,SL  VS       1  Device vendor specific log
0xbd       GPL,SL  VS       1  Device vendor specific log
0xc0       GPL,SL  VS       1  Device vendor specific log
0xc1       GPL     VS      93  Device vendor specific log
0xe0       GPL,SL  R/W      1  SCT Command/Status
0xe1       GPL,SL  R/W      1  SCT Data Transfer

SMART Extended Comprehensive Error Log Version: 1 (6 sectors)
Device Error Count: 21996 (device log contains only the most recent 24 errors)
	CR     = Command Register
	FEATR  = Features Register
	COUNT  = Count (was: Sector Count) Register
	LBA_48 = Upper bytes of LBA High/Mid/Low Registers ]  ATA-8
	LH     = LBA High (was: Cylinder High) Register    ]   LBA
	LM     = LBA Mid (was: Cylinder Low) Register      ] Register
	LL     = LBA Low (was: Sector Number) Register     ]
	DV     = Device (was: Device/Head) Register
	DC     = Device Control Register
	ER     = Error register
	ST     = Status register
Powered_Up_Time is measured from power on, and printed as
DDd+hh:mm:SS.sss where DD=days, hh=hours, mm=minutes,
SS=sec, and sss=millisec. It "wraps" after 49.710 days.

Error 21996 [11] occurred at disk power-on lifetime: 21822 hours (909 days + 6 hours)
  When the command that caused the error occurred, the device was active or idle.

  After command completion occurred, registers were:
  ER -- ST COUNT  LBA_48  LH LM LL DV DC
  -- -- -- == -- == == == -- -- -- -- --
  40 -- 51 00 08 00 00 0f a4 6e a8 e0 00  Error: UNC 8 sectors at LBA = 0x0fa46ea8 = 262434472

  Commands leading to the command that caused the error were:
  CR FEATR COUNT  LBA_48  LH LM LL DV DC  Powered_Up_Time  Command/Feature_Name
  -- == -- == -- == == == -- -- -- -- --  ---------------  --------------------
  25 00 00 00 08 00 00 0f a4 6e a8 e0 00     10:16:18.399  READ DMA EXT
  25 00 00 00 08 00 00 0f a4 6e a8 e0 00     10:16:14.725  READ DMA EXT
  25 00 00 00 a8 00 00 0f a4 6f c8 e0 00     10:16:14.696  READ DMA EXT
  25 00 00 01 00 00 00 0f a4 6e c8 e0 00     10:16:11.023  READ DMA EXT
  25 00 00 00 08 00 00 0f a4 6e a8 e0 00     10:16:06.345  READ DMA EXT

Error 21995 [10] occurred at disk power-on lifetime: 21822 hours (909 days + 6 hours)
  When the command that caused the error occurred, the device was active or idle.

  After command completion occurred, registers were:
  ER -- ST COUNT  LBA_48  LH LM LL DV DC
  -- -- -- == -- == == == -- -- -- -- --
  40 -- 51 00 08 00 00 0f a4 6e a8 e0 00  Error: UNC 8 sectors at LBA = 0x0fa46ea8 = 262434472

  Commands leading to the command that caused the error were:
  CR FEATR COUNT  LBA_48  LH LM LL DV DC  Powered_Up_Time  Command/Feature_Name
  -- == -- == -- == == == -- -- -- -- --  ---------------  --------------------
  25 00 00 00 08 00 00 0f a4 6e a8 e0 00     10:16:14.725  READ DMA EXT
  25 00 00 00 a8 00 00 0f a4 6f c8 e0 00     10:16:14.696  READ DMA EXT
  25 00 00 01 00 00 00 0f a4 6e c8 e0 00     10:16:11.023  READ DMA EXT
  25 00 00 00 08 00 00 0f a4 6e a8 e0 00     10:16:06.345  READ DMA EXT
  25 00 00 00 40 00 00 0f a4 6f 68 e0 00     10:16:01.144  READ DMA EXT

Error 21994 [9] occurred at disk power-on lifetime: 21822 hours (909 days + 6 hours)
  When the command that caused the error occurred, the device was active or idle.

  After command completion occurred, registers were:
  ER -- ST COUNT  LBA_48  LH LM LL DV DC
  -- -- -- == -- == == == -- -- -- -- --
  40 -- 51 01 00 00 00 0f a4 6e c8 e0 00  Error: UNC 256 sectors at LBA = 0x0fa46ec8 = 262434504

  Commands leading to the command that caused the error were:
  CR FEATR COUNT  LBA_48  LH LM LL DV DC  Powered_Up_Time  Command/Feature_Name
  -- == -- == -- == == == -- -- -- -- --  ---------------  --------------------
  25 00 00 01 00 00 00 0f a4 6e c8 e0 00     10:16:11.023  READ DMA EXT
  25 00 00 00 08 00 00 0f a4 6e a8 e0 00     10:16:06.345  READ DMA EXT
  25 00 00 00 40 00 00 0f a4 6f 68 e0 00     10:16:01.144  READ DMA EXT
  25 00 00 00 30 00 00 0f a4 6e a8 e0 00     10:15:57.480  READ DMA EXT
  25 00 00 00 08 00 00 0f a4 6f 60 e0 00     10:15:56.014  READ DMA EXT

Error 21993 [8] occurred at disk power-on lifetime: 21822 hours (909 days + 6 hours)
  When the command that caused the error occurred, the device was active or idle.

  After command completion occurred, registers were:
  ER -- ST COUNT  LBA_48  LH LM LL DV DC
  -- -- -- == -- == == == -- -- -- -- --
  40 -- 51 00 08 00 00 0f a4 6e a8 e0 00  Error: UNC 8 sectors at LBA = 0x0fa46ea8 = 262434472

  Commands leading to the command that caused the error were:
  CR FEATR COUNT  LBA_48  LH LM LL DV DC  Powered_Up_Time  Command/Feature_Name
  -- == -- == -- == == == -- -- -- -- --  ---------------  --------------------
  25 00 00 00 08 00 00 0f a4 6e a8 e0 00     10:16:06.345  READ DMA EXT
  25 00 00 00 40 00 00 0f a4 6f 68 e0 00     10:16:01.144  READ DMA EXT
  25 00 00 00 30 00 00 0f a4 6e a8 e0 00     10:15:57.480  READ DMA EXT
  25 00 00 00 08 00 00 0f a4 6f 60 e0 00     10:15:56.014  READ DMA EXT
  25 00 00 00 08 00 00 0f a4 6e a8 e0 00     10:15:52.341  READ DMA EXT

Error 21992 [7] occurred at disk power-on lifetime: 21822 hours (909 days + 6 hours)
  When the command that caused the error occurred, the device was active or idle.

  After command completion occurred, registers were:
  ER -- ST COUNT  LBA_48  LH LM LL DV DC
  -- -- -- == -- == == == -- -- -- -- --
  40 -- 51 00 40 00 00 0f a4 6f 68 e0 00  Error: UNC 64 sectors at LBA = 0x0fa46f68 = 262434664

  Commands leading to the command that caused the error were:
  CR FEATR COUNT  LBA_48  LH LM LL DV DC  Powered_Up_Time  Command/Feature_Name
  -- == -- == -- == == == -- -- -- -- --  ---------------  --------------------
  25 00 00 00 40 00 00 0f a4 6f 68 e0 00     10:16:01.144  READ DMA EXT
  25 00 00 00 30 00 00 0f a4 6e a8 e0 00     10:15:57.480  READ DMA EXT
  25 00 00 00 08 00 00 0f a4 6f 60 e0 00     10:15:56.014  READ DMA EXT
  25 00 00 00 08 00 00 0f a4 6e a8 e0 00     10:15:52.341  READ DMA EXT
  35 00 00 00 18 00 00 0b 5c cc e8 e0 00     10:15:52.336  WRITE DMA EXT

Error 21991 [6] occurred at disk power-on lifetime: 21822 hours (909 days + 6 hours)
  When the command that caused the error occurred, the device was active or idle.

  After command completion occurred, registers were:
  ER -- ST COUNT  LBA_48  LH LM LL DV DC
  -- -- -- == -- == == == -- -- -- -- --
  40 -- 51 00 30 00 00 0f a4 6e a8 e0 00  Error: UNC 48 sectors at LBA = 0x0fa46ea8 = 262434472

  Commands leading to the command that caused the error were:
  CR FEATR COUNT  LBA_48  LH LM LL DV DC  Powered_Up_Time  Command/Feature_Name
  -- == -- == -- == == == -- -- -- -- --  ---------------  --------------------
  25 00 00 00 30 00 00 0f a4 6e a8 e0 00     10:15:57.480  READ DMA EXT
  25 00 00 00 08 00 00 0f a4 6f 60 e0 00     10:15:56.014  READ DMA EXT
  25 00 00 00 08 00 00 0f a4 6e a8 e0 00     10:15:52.341  READ DMA EXT
  35 00 00 00 18 00 00 0b 5c cc e8 e0 00     10:15:52.336  WRITE DMA EXT
  25 00 00 00 08 00 00 0f a4 6f 58 e0 00     10:15:52.336  READ DMA EXT

Error 21990 [5] occurred at disk power-on lifetime: 21822 hours (909 days + 6 hours)
  When the command that caused the error occurred, the device was active or idle.

  After command completion occurred, registers were:
  ER -- ST COUNT  LBA_48  LH LM LL DV DC
  -- -- -- == -- == == == -- -- -- -- --
  40 -- 51 00 08 00 00 0f a4 6e a8 e0 00  Error: UNC 8 sectors at LBA = 0x0fa46ea8 = 262434472

  Commands leading to the command that caused the error were:
  CR FEATR COUNT  LBA_48  LH LM LL DV DC  Powered_Up_Time  Command/Feature_Name
  -- == -- == -- == == == -- -- -- -- --  ---------------  --------------------
  25 00 00 00 08 00 00 0f a4 6e a8 e0 00     10:15:52.341  READ DMA EXT
  35 00 00 00 18 00 00 0b 5c cc e8 e0 00     10:15:52.336  WRITE DMA EXT
  25 00 00 00 08 00 00 0f a4 6f 58 e0 00     10:15:52.336  READ DMA EXT
  25 00 00 00 08 00 00 0f a4 6e a8 e0 00     10:15:48.658  READ DMA EXT
  35 00 00 00 08 00 00 00 4a 75 d8 e0 00     10:15:48.658  WRITE DMA EXT

Error 21989 [4] occurred at disk power-on lifetime: 21822 hours (909 days + 6 hours)
  When the command that caused the error occurred, the device was active or idle.

  After command completion occurred, registers were:
  ER -- ST COUNT  LBA_48  LH LM LL DV DC
  -- -- -- == -- == == == -- -- -- -- --
  40 -- 51 00 08 00 00 0f a4 6e a8 e0 00  Error: UNC 8 sectors at LBA = 0x0fa46ea8 = 262434472

  Commands leading to the command that caused the error were:
  CR FEATR COUNT  LBA_48  LH LM LL DV DC  Powered_Up_Time  Command/Feature_Name
  -- == -- == -- == == == -- -- -- -- --  ---------------  --------------------
  25 00 00 00 08 00 00 0f a4 6e a8 e0 00     10:15:48.658  READ DMA EXT
  35 00 00 00 08 00 00 00 4a 75 d8 e0 00     10:15:48.658  WRITE DMA EXT
  25 00 00 00 08 00 00 0f a4 6f 50 e0 00     10:15:48.658  READ DMA EXT
  25 00 00 00 08 00 00 0f a4 6e a8 e0 00     10:15:44.997  READ DMA EXT
  35 00 00 00 08 00 00 00 48 4e e8 e0 00     10:15:44.991  WRITE DMA EXT

SMART Extended Self-test Log Version: 1 (1 sectors)
Num  Test_Description    Status                  Remaining  LifeTime(hours)  LBA_of_first_error
# 1  Short offline       Completed without error       00%      2705         -
# 2  Short offline       Completed without error       00%      2657         -
# 3  Short offline       Completed without error       00%      2581         -
# 4  Short offline       Completed without error       00%      2552         -
# 5  Short offline       Completed without error       00%      2472         -
# 6  Short offline       Completed without error       00%      2472         -

SMART Selective self-test log data structure revision number 1
 SPAN  MIN_LBA  MAX_LBA  CURRENT_TEST_STATUS
    1        0        0  Not_testing
    2        0        0  Not_testing
    3        0        0  Not_testing
    4        0        0  Not_testing
    5        0        0  Not_testing
Selective self-test flags (0x0):
  After scanning selected spans, do NOT read-scan remainder of disk.
If Selective self-test is pending on power-up, resume after 0 minute delay.

SCT Status Version:                  3
SCT Version (vendor specific):       258 (0x0102)
Device State:                        Active (0)
Current Temperature:                    30 Celsius
Power Cycle Min/Max Temperature:     22/32 Celsius
Lifetime    Min/Max Temperature:     17/45 Celsius
Under/Over Temperature Limit Count:   0/0
Vendor specific:
00 01 00 00 00 00 00 00 00 00 00 00 00 00 00 00
00 00 00 00 00 00 00 00 00 00 00 00 00 00 00 00

SCT Temperature History Version:     2
Temperature Sampling Period:         1 minute
Temperature Logging Interval:        1 minute
Min/Max recommended Temperature:      0/60 Celsius
Min/Max Temperature Limit:           -41/85 Celsius
Temperature History Size (Index):    478 (438)

SCT Error Recovery Control command not supported

Device Statistics (GP/SMART Log 0x04) not supported

Pending Defects log (GP Log 0x0c) not supported

SATA Phy Event Counters (GP Log 0x11)
ID      Size     Value  Description
0x0001  2          327  Command failed due to ICRC error
0x0002  2          327  R_ERR response for data FIS
0x0003  2           56  R_ERR response for device-to-host data FIS
0x0004  2          271  R_ERR response for host-to-device data FIS
0x0005  2            1  R_ERR response for non-data FIS
0x0006  2            0  R_ERR response for device-to-host non-data FIS
0x0007  2            1  R_ERR response for host-to-device non-data FIS
0x0008  2            0  Device-to-host non-data FIS retries
0x0009  2           13  Transition from drive PhyRdy to drive PhyNRdy
0x000a  2           17  Device-to-host register FISes sent due to a COMRESET
0x000b  2          154  CRC errors within host-to-device FIS
0x000f  2          154  R_ERR response for host-to-device data FIS, CRC
0x0012  2            0  R_ERR response for host-to-device non-data FIS, CRC
0x8000  4        41212  Vendor specific



