smartctl 7.1 2019-12-30 r5022 [x86_64-linux-5.4.0-51-generic] (local build)
Copyright (C) 2002-19, Bruce Allen, Christian Franke, www.smartmontools.org

=== START OF INFORMATION SECTION ===
Model Number:                       PC300 NVMe SK hynix 1TB
Serial Number:                      --
Firmware Version:                   20005A00
PCI Vendor/Subsystem ID:            0x1c5c
IEEE OUI Identifier:                0xace42e
Controller ID:                      0
Number of Namespaces:               1
Namespace 1 Size/Capacity:          1,024,209,543,168 [1.02 TB]
Namespace 1 Formatted LBA Size:     512
Namespace 1 IEEE EUI-64:            ace42e ...
Local Time is:                      Wed Oct 21 20:54:12 2020 CDT
Firmware Updates (0x16):            3 Slots, no Reset required
Optional Admin Commands (0x0016):   Format Frmw_DL Self_Test
Optional NVM Commands (0x001e):     Wr_Unc DS_Mngmt Wr_Zero Sav/Sel_Feat
Maximum Data Transfer Size:         32 Pages
Warning  Comp. Temp. Threshold:     88 Celsius
Critical Comp. Temp. Threshold:     90 Celsius

Supported Power States
St Op     Max   Active     Idle   RL RT WL WT  Ent_Lat  Ex_Lat
 0 +     5.87W       -        -    0  0  0  0        5       5
 1 +     2.40W       -        -    1  1  1  1       30      30
 2 +     1.90W       -        -    2  2  2  2      100     100
 3 -   0.1000W       -        -    3  3  3  3     1000    1000
 4 -   0.0060W       -        -    3  3  3  3     1000    5000

Supported LBA Sizes (NSID 0x1)
Id Fmt  Data  Metadt  Rel_Perf
 0 -     512       0         0
 1 -    4096       0         0

=== START OF SMART DATA SECTION ===
SMART overall-health self-assessment test result: PASSED

SMART/Health Information (NVMe Log 0x02)
Critical Warning:                   0x00
Temperature:                        40 Celsius
Available Spare:                    100%
Available Spare Threshold:          10%
Percentage Used:                    0%
Data Units Read:                    6,600,200 [3.37 TB]
Data Units Written:                 4,321,389 [2.21 TB]
Host Read Commands:                 140,200,420
Host Write Commands:                55,134,273
Controller Busy Time:               481
Power Cycles:                       5,986
Power On Hours:                     141
Unsafe Shutdowns:                   181
Media and Data Integrity Errors:    0
Error Information Log Entries:      0
Warning  Comp. Temperature Time:    0
Critical Comp. Temperature Time:    0
Temperature Sensor 1:               40 Celsius

Read Error Information Log failed: NVMe Status 0x371

