smartctl 7.3 2022-02-28 r5338 [x86_64-linux-5.17.11-300.fc36.x86_64] (local build)
Copyright (C) 2002-22, Bruce Allen, Christian Franke, www.smartmontools.org

=== START OF INFORMATION SECTION ===
Model Number:                       PC300 NVMe SK hynix 1TB
Serial Number:                      --
Firmware Version:                   20005A00
PCI Vendor/Subsystem ID:            0x1c5c
IEEE OUI Identifier:                0xace42e
Controller ID:                      0
NVMe Version:                       1.2
Number of Namespaces:               1
Namespace 1 Size/Capacity:          1,024,209,543,168 [1.02 TB]
Namespace 1 Formatted LBA Size:     512
Namespace 1 IEEE EUI-64:            ace42e ...
Local Time is:                      Thu Jun  2 12:46:02 2022 EDT
Firmware Updates (0x16):            3 Slots, no Reset required
Optional Admin Commands (0x0016):   Format Frmw_DL Self_Test
Optional NVM Commands (0x001e):     Wr_Unc DS_Mngmt Wr_Zero Sav/Sel_Feat
Log Page Attributes (0x02):         Cmd_Eff_Lg
Maximum Data Transfer Size:         32 Pages
Warning  Comp. Temp. Threshold:     88 Celsius
Critical Comp. Temp. Threshold:     90 Celsius

Supported Power States
St Op     Max   Active     Idle   RL RT WL WT  Ent_Lat  Ex_Lat
 0 +     5.87W       -        -    0  0  0  0        5       5
 1 +     2.40W       -        -    1  1  1  1       30      30
 2 +     1.90W       -        -    2  2  2  2      100     100
 3 -   0.1000W       -        -    3  3  3  3     1000    1000
 4 -   0.0060W       -        -    3  3  3  3     1000    5000

Supported LBA Sizes (NSID 0x1)
Id Fmt  Data  Metadt  Rel_Perf
 0 -     512       0         0
 1 -    4096       0         0

=== START OF SMART DATA SECTION ===
SMART overall-health self-assessment test result: PASSED

SMART/Health Information (NVMe Log 0x02)
Critical Warning:                   0x00
Temperature:                        30 Celsius
Available Spare:                    100%
Available Spare Threshold:          10%
Percentage Used:                    0%
Data Units Read:                    14,943,897 [7.65 TB]
Data Units Written:                 23,561,477 [12.0 TB]
Host Read Commands:                 229,532,135
Host Write Commands:                304,597,064
Controller Busy Time:               1,383
Power Cycles:                       5,543
Power On Hours:                     320
Unsafe Shutdowns:                   384
Media and Data Integrity Errors:    0
Error Information Log Entries:      11,250
Warning  Comp. Temperature Time:    0
Critical Comp. Temperature Time:    0
Temperature Sensor 1:               30 Celsius

Error Information (NVMe Log 0x01, 16 of 255 entries)
No Errors Logged

