smartctl 7.1 2019-12-30 r5022 [x86_64-linux-5.7.17-200.fc32.x86_64] (local build)
Copyright (C) 2002-19, Bruce Allen, Christian Franke, www.smartmontools.org

=== START OF INFORMATION SECTION ===
Model Number:                       KXG50ZNV512G TOSHIBA
Serial Number:                      --
Firmware Version:                   AAHA4102
PCI Vendor/Subsystem ID:            0x1179
IEEE OUI Identifier:                0x00080d
Total NVM Capacity:                 512,110,190,592 [512 GB]
Unallocated NVM Capacity:           0
Controller ID:                      0
Number of Namespaces:               1
Namespace 1 Size/Capacity:          512,110,190,592 [512 GB]
Namespace 1 Formatted LBA Size:     512
Namespace 1 IEEE EUI-64:            00080d ...
Local Time is:                      Sun Aug 30 09:57:48 2020 CEST
Firmware Updates (0x14):            2 Slots, no Reset required
Optional Admin Commands (0x0017):   Security Format Frmw_DL Self_Test
Optional NVM Commands (0x005f):     Comp Wr_Unc DS_Mngmt Wr_Zero Sav/Sel_Feat Timestmp
Maximum Data Transfer Size:         512 Pages
Warning  Comp. Temp. Threshold:     78 Celsius
Critical Comp. Temp. Threshold:     82 Celsius
Namespace 1 Features (0x02):        NA_Fields

Supported Power States
St Op     Max   Active     Idle   RL RT WL WT  Ent_Lat  Ex_Lat
 0 +     6.00W       -        -    0  0  0  0        0       0
 1 +     2.70W       -        -    1  1  1  1        0       0
 2 +     1.30W       -        -    2  2  2  2        0       0
 3 -   0.0500W       -        -    3  3  3  3     1500    1500
 4 -   0.0050W       -        -    4  4  4  4     6000   14000
 5 -   0.0030W       -        -    5  5  5  5    50000   80000

Supported LBA Sizes (NSID 0x1)
Id Fmt  Data  Metadt  Rel_Perf
 0 +     512       0         2
 1 -    4096       0         1

=== START OF SMART DATA SECTION ===
SMART overall-health self-assessment test result: PASSED

SMART/Health Information (NVMe Log 0x02)
Critical Warning:                   0x00
Temperature:                        29 Celsius
Available Spare:                    100%
Available Spare Threshold:          5%
Percentage Used:                    1%
Data Units Read:                    3,193,139 [1.63 TB]
Data Units Written:                 4,362,157 [2.23 TB]
Host Read Commands:                 36,848,523
Host Write Commands:                50,240,544
Controller Busy Time:               205
Power Cycles:                       1,450
Power On Hours:                     3,155
Unsafe Shutdowns:                   421
Media and Data Integrity Errors:    0
Error Information Log Entries:      0
Warning  Comp. Temperature Time:    0
Critical Comp. Temperature Time:    0
Temperature Sensor 1:               29 Celsius

Error Information (NVMe Log 0x01, max 128 entries)
No Errors Logged

