smartctl 7.3 2022-02-28 r5338 [x86_64-linux-6.11.0-1-pve] (local build)
Copyright (C) 2002-22, Bruce Allen, Christian Franke, www.smartmontools.org

=== START OF INFORMATION SECTION ===
Model Number:                       WDC WD BLACK SDBPNTY-256G-1106
Serial Number:                      --
Firmware Version:                   HPS2
PCI Vendor/Subsystem ID:            0x15b7
IEEE OUI Identifier:                0x001b44
Total NVM Capacity:                 256,060,514,304 [256 GB]
Unallocated NVM Capacity:           0
Controller ID:                      8215
NVMe Version:                       1.3
Number of Namespaces:               1
Namespace 1 Size/Capacity:          256,060,514,304 [256 GB]
Namespace 1 Formatted LBA Size:     512
Namespace 1 IEEE EUI-64:            001b44 ...
Local Time is:                      Fri Nov 29 14:48:34 2024 EST
Firmware Updates (0x14):            2 Slots, no Reset required
Optional Admin Commands (0x0017):   Security Format Frmw_DL Self_Test
Optional NVM Commands (0x005f):     Comp Wr_Unc DS_Mngmt Wr_Zero Sav/Sel_Feat Timestmp
Log Page Attributes (0x1e):         Cmd_Eff_Lg Ext_Get_Lg Telmtry_Lg Pers_Ev_Lg
Maximum Data Transfer Size:         128 Pages
Warning  Comp. Temp. Threshold:     84 Celsius
Critical Comp. Temp. Threshold:     88 Celsius
Namespace 1 Features (0x02):        NA_Fields

Supported Power States
St Op     Max   Active     Idle   RL RT WL WT  Ent_Lat  Ex_Lat
 0 +     5.00W       -        -    0  0  0  0        0       0
 1 +     3.50W       -        -    1  1  1  1        0       0
 2 +     3.00W       -        -    2  2  2  2        0       0
 3 -   0.0700W       -        -    3  3  3  3     4000   10000
 4 -   0.0025W       -        -    4  4  4  4     4000   40000

Supported LBA Sizes (NSID 0x1)
Id Fmt  Data  Metadt  Rel_Perf
 0 +     512       0         2
 1 -    4096       0         1

=== START OF SMART DATA SECTION ===
SMART overall-health self-assessment test result: PASSED

SMART/Health Information (NVMe Log 0x02)
Critical Warning:                   0x00
Temperature:                        53 Celsius
Available Spare:                    100%
Available Spare Threshold:          5%
Percentage Used:                    10%
Data Units Read:                    11,874,711 [6.07 TB]
Data Units Written:                 77,900,516 [39.8 TB]
Host Read Commands:                 135,148,803
Host Write Commands:                272,754,354
Controller Busy Time:               677
Power Cycles:                       2,164
Power On Hours:                     8,091
Unsafe Shutdowns:                   117
Media and Data Integrity Errors:    0
Error Information Log Entries:      71
Warning  Comp. Temperature Time:    0
Critical Comp. Temperature Time:    0

Error Information (NVMe Log 0x01, 16 of 256 entries)
No Errors Logged

