smartctl 7.1 2019-12-30 r5022 [x86_64-linux-5.11.0-051100-lowlatency] (local build)
Copyright (C) 2002-19, Bruce Allen, Christian Franke, www.smartmontools.org

=== START OF INFORMATION SECTION ===
Model Number:                       LITEON CL1-4D256
Serial Number:                      --
Firmware Version:                   1S222
PCI Vendor ID:                      0x14a4
PCI Vendor Subsystem ID:            0x126f
IEEE OUI Identifier:                0x002303
Total NVM Capacity:                 256,060,514,304 [256 GB]
Unallocated NVM Capacity:           0
Controller ID:                      1
Number of Namespaces:               1
Namespace 1 Size/Capacity:          256,060,514,304 [256 GB]
Namespace 1 Formatted LBA Size:     512
Namespace 1 IEEE EUI-64:            002303 ...
Local Time is:                      Wed Mar 31 16:42:40 2021 -03
Firmware Updates (0x14):            2 Slots, no Reset required
Optional Admin Commands (0x0017):   Security Format Frmw_DL Self_Test
Optional NVM Commands (0x001f):     Comp Wr_Unc DS_Mngmt Wr_Zero Sav/Sel_Feat
Maximum Data Transfer Size:         32 Pages
Warning  Comp. Temp. Threshold:     84 Celsius
Critical Comp. Temp. Threshold:     85 Celsius

Supported Power States
St Op     Max   Active     Idle   RL RT WL WT  Ent_Lat  Ex_Lat
 0 +     3.50W       -        -    0  0  0  0        0       0
 1 +     2.10W       -        -    1  1  1  1        0       0
 2 +     1.65W       -        -    2  2  2  2        0       0
 3 -   0.0500W       -        -    3  3  3  3     5000    5000
 4 -   0.0050W       -        -    4  4  4  4     5000   20000

Supported LBA Sizes (NSID 0x1)
Id Fmt  Data  Metadt  Rel_Perf
 0 +     512       0         0

=== START OF SMART DATA SECTION ===
SMART overall-health self-assessment test result: PASSED

SMART/Health Information (NVMe Log 0x02)
Critical Warning:                   0x00
Temperature:                        34 Celsius
Available Spare:                    100%
Available Spare Threshold:          10%
Percentage Used:                    5%
Data Units Read:                    6,112,797 [3.12 TB]
Data Units Written:                 5,935,651 [3.03 TB]
Host Read Commands:                 96,723,437
Host Write Commands:                377,859,796
Controller Busy Time:               833
Power Cycles:                       6,563
Power On Hours:                     2,131
Unsafe Shutdowns:                   6,303
Media and Data Integrity Errors:    0
Error Information Log Entries:      0
Warning  Comp. Temperature Time:    0
Critical Comp. Temperature Time:    0
Temperature Sensor 1:               34 Celsius

Error Information (NVMe Log 0x01, max 64 entries)
No Errors Logged

