=== START OF INFORMATION SECTION ===
Device Model:     SAMSUNG HD161HJ
Serial Number:    --
LU WWN Device Id: 5 0000f0 ...
Firmware Version: JF100-19
User Capacity:    160 041 885 696 bytes [160 GB]
Sector Size:      512 bytes logical/physical
Device is:        Not in smartctl database [for details use: -P showall]
ATA Version is:   ATA/ATAPI-7, ATA8-ACS T13/1699-D revision 3b
Local Time is:    Wed Aug 19 16:14:47 2015 MSK
SMART support is: Available - device has SMART capability.
SMART support is: Enabled
AAM feature is:   Disabled
APM level is:     254 (maximum performance)
Rd look-ahead is: Enabled
Write cache is:   Enabled
ATA Security is:  Disabled, NOT FROZEN [SEC1]
Wt Cache Reorder: Enabled

=== START OF READ SMART DATA SECTION ===
SMART overall-health self-assessment test result: PASSED

General SMART Values:
Offline data collection status:  (0x84)	Offline data collection activity
					was suspended by an interrupting command from host.
					Auto Offline Data Collection: Enabled.
Self-test execution status:      (   0)	The previous self-test routine completed
					without error or no self-test has ever 
					been run.
Total time to complete Offline 
data collection: 		( 2964) seconds.
Offline data collection
capabilities: 			 (0x5b) SMART execute Offline immediate.
					Auto Offline data collection on/off support.
					Suspend Offline collection upon new
					command.
					Offline surface scan supported.
					Self-test supported.
					No Conveyance Self-test supported.
					Selective Self-test supported.
SMART capabilities:            (0x0003)	Saves SMART data before entering
					power-saving mode.
					Supports SMART auto save timer.
Error logging capability:        (0x01)	Error logging supported.
					General Purpose Logging supported.
Short self-test routine 
recommended polling time: 	 (   2) minutes.
Extended self-test routine
recommended polling time: 	 (  50) minutes.
SCT capabilities: 	       (0x003f)	SCT Status supported.
					SCT Error Recovery Control supported.
					SCT Feature Control supported.
					SCT Data Table supported.

SMART Attributes Data Structure revision number: 16
Vendor Specific SMART Attributes with Thresholds:
ID# ATTRIBUTE_NAME          FLAGS    VALUE WORST THRESH FAIL RAW_VALUE
  1 Raw_Read_Error_Rate     POSR--   100   100   051    -    0
  3 Spin_Up_Time            POS---   253   253   025    -    4416
  4 Start_Stop_Count        -O--CK   095   095   000    -    5628
  5 Reallocated_Sector_Ct   PO--CK   253   253   010    -    0
  7 Seek_Error_Rate         POSR--   253   253   051    -    0
  8 Seek_Time_Performance   P-S--K   253   253   015    -    0
  9 Power_On_Hours          -O--CK   100   100   000    -    12638
 10 Spin_Retry_Count        PO--CK   253   253   051    -    0
 11 Calibration_Retry_Count -O--C-   253   253   000    -    0
 12 Power_Cycle_Count       -O--CK   098   098   000    -    2858
 13 Read_Soft_Error_Rate    -OSR--   100   100   000    -    12290260
184 End-to-End_Error        PO--CK   253   253   099    -    0
187 Reported_Uncorrect      -O--CK   253   253   000    -    0
188 Command_Timeout         -O--CK   253   253   000    -    0
190 Airflow_Temperature_Cel -O---K   151   100   000    -    29 (Min/Max 12/46)
194 Temperature_Celsius     -O---K   151   097   000    -    29 (Min/Max 12/47)
195 Hardware_ECC_Recovered  -O-RC-   100   100   000    -    12290260
196 Reallocated_Event_Count -O--CK   253   253   000    -    0
197 Current_Pending_Sector  -O--C-   253   253   000    -    0
198 Offline_Uncorrectable   ----CK   253   253   000    -    0
199 UDMA_CRC_Error_Count    -OSRCK   200   200   000    -    2
200 Multi_Zone_Error_Rate   -O-R--   100   100   000    -    0
201 Soft_Read_Error_Rate    -O-R--   100   100   000    -    0
202 Data_Address_Mark_Errs  -O--CK   253   253   000    -    0
                            ||||||_ K auto-keep
                            |||||__ C event count
                            ||||___ R error rate
                            |||____ S speed/performance
                            ||_____ O updated online
                            |______ P prefailure warning

General Purpose Log Directory Version 1
SMART           Log Directory Version 1 [multi-sector log support]
Address    Access  R/W   Size  Description
0x00       GPL,SL  R/O      1  Log Directory
0x01           SL  R/O      1  Summary SMART error log
0x02           SL  R/O      2  Comprehensive SMART error log
0x03       GPL     R/O      2  Ext. Comprehensive SMART error log
0x06           SL  R/O      1  SMART self-test log
0x10       GPL     R/O      1  NCQ Command Error log
0x11       GPL     R/O      1  SATA Phy Event Counters
0x80-0x9f  GPL,SL  R/W     16  Host vendor specific log
0xe0       GPL,SL  R/W      1  SCT Command/Status
0xe1       GPL,SL  R/W      1  SCT Data Transfer

SMART Extended Comprehensive Error Log Version: 1 (2 sectors)
Device Error Count: 9 (device log contains only the most recent 8 errors)
	CR     = Command Register
	FEATR  = Features Register
	COUNT  = Count (was: Sector Count) Register
	LBA_48 = Upper bytes of LBA High/Mid/Low Registers ]  ATA-8
	LH     = LBA High (was: Cylinder High) Register    ]   LBA
	LM     = LBA Mid (was: Cylinder Low) Register      ] Register
	LL     = LBA Low (was: Sector Number) Register     ]
	DV     = Device (was: Device/Head) Register
	DC     = Device Control Register
	ER     = Error register
	ST     = Status register
Powered_Up_Time is measured from power on, and printed as
DDd+hh:mm:SS.sss where DD=days, hh=hours, mm=minutes,
SS=sec, and sss=millisec. It "wraps" after 49.710 days.

Error 9 [0] log entry is empty
Error 8 [7] occurred at disk power-on lifetime: 7296 hours (304 days + 0 hours)
  When the command that caused the error occurred, the device was in an unknown state.

  After command completion occurred, registers were:
  ER -- ST COUNT  LBA_48  LH LM LL DV DC
  -- -- -- == -- == == == -- -- -- -- --
  80 -- 00 8f 00 e0 39 46 00 00 04 35 00

  Commands leading to the command that caused the error were:
  CR FEATR COUNT  LBA_48  LH LM LL DV DC  Powered_Up_Time  Command/Feature_Name
  -- == -- == -- == == == -- -- -- -- --  ---------------  --------------------
  f4 00 73 01 c7 35 00 00 e0 38 7a 00 00     00:00:00.002  SECURITY ERASE UNIT
  06 00 80 04 0f 35 00 00 e0 39 46 00 00     00:00:00.002  DATA SET MANAGEMENT
  06 00 80 04 8f 35 00 00 e0 39 45 00 00     00:00:00.002  DATA SET MANAGEMENT
  06 00 80 04 0f 35 00 00 e0 39 45 00 00     00:00:00.002  DATA SET MANAGEMENT
  00 00 16 70 8a 00 01 00 8a 00 93 00 a0     00:00:04.078  NOP [Reserved subcommand] [OBS-ACS-2]

Error 7 [6] occurred at disk power-on lifetime: 10619 hours (442 days + 11 hours)
  When the command that caused the error occurred, the device was in an unknown state.

  After command completion occurred, registers were:
  ER -- ST COUNT  LBA_48  LH LM LL DV DC
  -- -- -- == -- == == == -- -- -- -- --
  80 -- 00 87 00 e0 a5 bc 00 00 0c 35 00

  Commands leading to the command that caused the error were:
  CR FEATR COUNT  LBA_48  LH LM LL DV DC  Powered_Up_Time  Command/Feature_Name
  -- == -- == -- == == == -- -- -- -- --  ---------------  --------------------
  f5 00 08 08 2f 25 00 00 e0 23 8c 00 00     00:00:01.579  SECURITY FREEZE LOCK
  f5 00 80 07 af 35 00 00 e0 9c ef 00 00     00:00:01.579  SECURITY FREEZE LOCK
  f5 00 80 0c 07 35 00 00 e0 a5 bc 00 00     00:00:01.579  SECURITY FREEZE LOCK
  f5 00 08 08 27 25 00 00 e0 23 8c 00 00     00:00:01.579  SECURITY FREEZE LOCK
  00 00 16 0b d0 00 05 00 51 01 69 00 99     00:00:03.347  NOP [Reserved subcommand] [OBS-ACS-2]

Error 6 [5] occurred at disk power-on lifetime: 7310 hours (304 days + 14 hours)
  When the command that caused the error occurred, the device was in a vendor specific state.

  After command completion occurred, registers were:
  ER -- ST COUNT  LBA_48  LH LM LL DV DC
  -- -- -- == -- == == == -- -- -- -- --
  80 -- 00 2f 00 e0 ff db 00 00 00 35 00   at LBA = 0xe0ffdf000000 = 247389562601472

  Commands leading to the command that caused the error were:
  CR FEATR COUNT  LBA_48  LH LM LL DV DC  Powered_Up_Time  Command/Feature_Name
  -- == -- == -- == == == -- -- -- -- --  ---------------  --------------------
  20 00 08 00 8f 25 00 00 e0 45 8c 00 00     00:00:00.001  READ SECTOR(S)
  20 00 20 00 07 25 00 00 e0 1d d5 00 00     00:00:00.001  READ SECTOR(S)
  20 00 30 00 1f 25 00 00 e0 19 d2 00 00     00:00:00.001  READ SECTOR(S)
  20 00 18 00 c7 25 00 00 e0 05 59 00 00     00:00:00.001  READ SECTOR(S)
  00 00 16 01 c9 00 00 20 c0 00 20 02 99     00:00:12.567  NOP [Reserved subcommand] [OBS-ACS-2]

Error 5 [4] occurred at disk power-on lifetime: 9578 hours (399 days + 2 hours)
  When the command that caused the error occurred, the device was in a vendor specific state.

  After command completion occurred, registers were:
  ER -- ST COUNT  LBA_48  LH LM LL DV DC
  -- -- -- == -- == == == -- -- -- -- --
  80 -- 00 97 00 e0 62 cd 00 00 03 25 00

  Commands leading to the command that caused the error were:
  CR FEATR COUNT  LBA_48  LH LM LL DV DC  Powered_Up_Time  Command/Feature_Name
  -- == -- == -- == == == -- -- -- -- --  ---------------  --------------------
  81 00 80 03 17 25 00 00 e0 62 cd 00 00     00:00:00.011  [VENDOR SPECIFIC]
  81 00 80 03 97 25 00 00 e0 62 cc 00 00     00:00:00.011  [VENDOR SPECIFIC]
  81 00 80 03 17 25 00 00 e0 62 cc 00 00     00:00:00.011  [VENDOR SPECIFIC]
  81 00 80 03 97 25 00 00 e0 62 cb 00 00     00:00:00.011  [VENDOR SPECIFIC]
  00 11 89 11 91 00 00 11 01 c9 b1 00 11     00:00:00.000  NOP [Reserved subcommand] [OBS-ACS-2]

Error 4 [3] occurred at disk power-on lifetime: 25408 hours (1058 days + 16 hours)
  When the command that caused the error occurred, the device was in a reserved state.

  After command completion occurred, registers were:
  ER -- ST COUNT  LBA_48  LH LM LL DV DC
  -- -- -- == -- == == == -- -- -- -- --
  00 -- 00 00 00 00 00 00 00 00 00 00 00

  Commands leading to the command that caused the error were:
  CR FEATR COUNT  LBA_48  LH LM LL DV DC  Powered_Up_Time  Command/Feature_Name
  -- == -- == -- == == == -- -- -- -- --  ---------------  --------------------

Error 3 [2] log entry is empty
Error 2 [1] log entry is empty
SMART Extended Self-test Log (GP Log 0x07) not supported

SMART Self-test log structure revision number 1
No self-tests have been logged.  [To run self-tests, use: smartctl -t]

SMART Selective self-test log data structure revision number 0
Note: revision number not 1 implies that no selective self-test has ever been run
 SPAN  MIN_LBA  MAX_LBA  CURRENT_TEST_STATUS
    1        0        0  Not_testing
    2        0        0  Not_testing
    3        0        0  Not_testing
    4        0        0  Not_testing
    5        0        0  Not_testing
Selective self-test flags (0x0):
  After scanning selected spans, do NOT read-scan remainder of disk.
If Selective self-test is pending on power-up, resume after 0 minute delay.

SCT Status Version:                  2
SCT Version (vendor specific):       256 (0x0100)
SCT Support Level:                   1
Device State:                        Active (0)
Current Temperature:                    29 Celsius
Power Cycle Min/Max Temperature:     22/30 Celsius
Lifetime    Min/Max Temperature:     12/46 Celsius
Under/Over Temperature Limit Count:   0/0

SCT Temperature History Version:     2
Temperature Sampling Period:         1 minute
Temperature Logging Interval:        1 minute
Min/Max recommended Temperature:     -4/72 Celsius
Min/Max Temperature Limit:           -9/77 Celsius
Temperature History Size (Index):    128 (9)

SCT Error Recovery Control:
           Read: Disabled
          Write: Disabled

Device Statistics (GP Log 0x04) not supported

SATA Phy Event Counters (GP Log 0x11)
ID      Size     Value  Description
0x0001  2            0  Command failed due to ICRC error
0x0002  2            0  R_ERR response for data FIS
0x0003  2            0  R_ERR response for device-to-host data FIS
0x0004  2            0  R_ERR response for host-to-device data FIS
0x0005  2            0  R_ERR response for non-data FIS
0x0006  2            0  R_ERR response for device-to-host non-data FIS
0x0007  2            0  R_ERR response for host-to-device non-data FIS
0x0008  2            0  Device-to-host non-data FIS retries
0x0009  2            2  Transition from drive PhyRdy to drive PhyNRdy
0x000a  2           68  Device-to-host register FISes sent due to a COMRESET
0x000b  2            0  CRC errors within host-to-device FIS
0x000d  2            0  Non-CRC errors within host-to-device FIS
0x000f  2            0  R_ERR response for host-to-device data FIS, CRC
0x0010  2            0  R_ERR response for host-to-device data FIS, non-CRC
0x0012  2            0  R_ERR response for host-to-device non-data FIS, CRC
0x0013  2            0  R_ERR response for host-to-device non-data FIS, non-CRC
0x8001  2            0  Vendor specific



