smartctl 7.3 2022-02-28 r5338 [x86_64-linux-6.5.0-25-generic] (local build)
Copyright (C) 2002-22, Bruce Allen, Christian Franke, www.smartmontools.org

=== START OF INFORMATION SECTION ===
Model Number:                       HFM512GD3JX016N
Serial Number:                      --
Firmware Version:                   41020C20
PCI Vendor/Subsystem ID:            0x1c5c
IEEE OUI Identifier:                0xace42e
Controller ID:                      1
NVMe Version:                       1.3
Number of Namespaces:               1
Namespace 1 Size/Capacity:          512,110,190,592 [512 GB]
Namespace 1 Formatted LBA Size:     512
Namespace 1 IEEE EUI-64:            ace42e ...
Local Time is:                      Thu Mar  7 22:22:15 2024 CST
Firmware Updates (0x16):            3 Slots, no Reset required
Optional Admin Commands (0x0017):   Security Format Frmw_DL Self_Test
Optional NVM Commands (0x005f):     Comp Wr_Unc DS_Mngmt Wr_Zero Sav/Sel_Feat Timestmp
Log Page Attributes (0x1e):         Cmd_Eff_Lg Ext_Get_Lg Telmtry_Lg Pers_Ev_Lg
Maximum Data Transfer Size:         64 Pages
Warning  Comp. Temp. Threshold:     83 Celsius
Critical Comp. Temp. Threshold:     85 Celsius

Supported Power States
St Op     Max   Active     Idle   RL RT WL WT  Ent_Lat  Ex_Lat
 0 +   6.3000W       -        -    0  0  0  0        5       5
 1 +   2.4000W       -        -    1  1  1  1       30      30
 2 +   1.9000W       -        -    2  2  2  2      100     100
 3 -   0.0500W       -        -    3  3  3  3     1000    1000
 4 -   0.0040W       -        -    3  3  3  3     1000    9000

Supported LBA Sizes (NSID 0x1)
Id Fmt  Data  Metadt  Rel_Perf
 0 +     512       0         0

=== START OF SMART DATA SECTION ===
SMART overall-health self-assessment test result: PASSED

SMART/Health Information (NVMe Log 0x02)
Critical Warning:                   0x00
Temperature:                        25 Celsius
Available Spare:                    100%
Available Spare Threshold:          10%
Percentage Used:                    0%
Data Units Read:                    67,096,410 [34.3 TB]
Data Units Written:                 24,662,041 [12.6 TB]
Host Read Commands:                 610,627,497
Host Write Commands:                330,541,500
Controller Busy Time:               1,062
Power Cycles:                       1,307
Power On Hours:                     3,199
Unsafe Shutdowns:                   28
Media and Data Integrity Errors:    0
Error Information Log Entries:      0
Warning  Comp. Temperature Time:    0
Critical Comp. Temperature Time:    0
Temperature Sensor 1:               25 Celsius
Temperature Sensor 2:               32 Celsius
Thermal Temp. 1 Transition Count:   5110
Thermal Temp. 1 Total Time:         1032309

Error Information (NVMe Log 0x01, 16 of 256 entries)
No Errors Logged

