smartctl 7.2 2020-12-30 r5155 [x86_64-linux-5.14.11-arch1-1] (local build)
Copyright (C) 2002-20, Bruce Allen, Christian Franke, www.smartmontools.org

=== START OF INFORMATION SECTION ===
Model Family:     Western Digital Blue
Device Model:     WDC WD10EZEX-00RKKA0
Serial Number:    --
LU WWN Device Id: 5 0014ee ...
Firmware Version: 80.00A80
User Capacity:    1,000,204,886,016 bytes [1.00 TB]
Sector Sizes:     512 bytes logical, 4096 bytes physical
Device is:        In smartctl database [for details use: -P show]
ATA Version is:   ATA8-ACS (minor revision not indicated)
SATA Version is:  SATA 3.0, 6.0 Gb/s (current: 6.0 Gb/s)
Local Time is:    Tue Oct 12 19:46:04 2021 +08
SMART support is: Available - device has SMART capability.
SMART support is: Enabled
AAM feature is:   Unavailable
APM feature is:   Unavailable
Rd look-ahead is: Enabled
Write cache is:   Enabled
DSN feature is:   Unavailable
ATA Security is:  Disabled, frozen [SEC2]
Wt Cache Reorder: Enabled

=== START OF READ SMART DATA SECTION ===
SMART overall-health self-assessment test result: PASSED

General SMART Values:
Offline data collection status:  (0x82)	Offline data collection activity
					was completed without error.
					Auto Offline Data Collection: Enabled.
Self-test execution status:      (   0)	The previous self-test routine completed
					without error or no self-test has ever 
					been run.
Total time to complete Offline 
data collection: 		(10740) seconds.
Offline data collection
capabilities: 			 (0x7b) SMART execute Offline immediate.
					Auto Offline data collection on/off support.
					Suspend Offline collection upon new
					command.
					Offline surface scan supported.
					Self-test supported.
					Conveyance Self-test supported.
					Selective Self-test supported.
SMART capabilities:            (0x0003)	Saves SMART data before entering
					power-saving mode.
					Supports SMART auto save timer.
Error logging capability:        (0x01)	Error logging supported.
					General Purpose Logging supported.
Short self-test routine 
recommended polling time: 	 (   2) minutes.
Extended self-test routine
recommended polling time: 	 ( 124) minutes.
Conveyance self-test routine
recommended polling time: 	 (   5) minutes.
SCT capabilities: 	       (0x30b5)	SCT Status supported.
					SCT Feature Control supported.
					SCT Data Table supported.

SMART Attributes Data Structure revision number: 16
Vendor Specific SMART Attributes with Thresholds:
ID# ATTRIBUTE_NAME          FLAGS    VALUE WORST THRESH FAIL RAW_VALUE
  1 Raw_Read_Error_Rate     POSR-K   200   200   051    -    2373
  3 Spin_Up_Time            POS--K   178   174   021    -    2100
  4 Start_Stop_Count        -O--CK   089   089   000    -    11967
  5 Reallocated_Sector_Ct   PO--CK   189   189   140    -    494
  7 Seek_Error_Rate         -OSR-K   200   200   000    -    0
  9 Power_On_Hours          -O--CK   070   070   000    -    22202
 10 Spin_Retry_Count        -O--CK   100   100   000    -    0
 11 Calibration_Retry_Count -O--CK   100   100   000    -    0
 12 Power_Cycle_Count       -O--CK   094   094   000    -    6790
192 Power-Off_Retract_Count -O--CK   198   198   000    -    1915
193 Load_Cycle_Count        -O--CK   197   197   000    -    10051
194 Temperature_Celsius     -O---K   104   098   000    -    39
196 Reallocated_Event_Count -O--CK   191   191   000    -    9
197 Current_Pending_Sector  -O--CK   200   200   000    -    1
198 Offline_Uncorrectable   ----CK   200   200   000    -    1
199 UDMA_CRC_Error_Count    -O--CK   200   200   000    -    2
200 Multi_Zone_Error_Rate   ---R--   200   200   000    -    1
                            ||||||_ K auto-keep
                            |||||__ C event count
                            ||||___ R error rate
                            |||____ S speed/performance
                            ||_____ O updated online
                            |______ P prefailure warning

General Purpose Log Directory Version 1
SMART           Log Directory Version 1 [multi-sector log support]
Address    Access  R/W   Size  Description
0x00       GPL,SL  R/O      1  Log Directory
0x01           SL  R/O      1  Summary SMART error log
0x02           SL  R/O      5  Comprehensive SMART error log
0x03       GPL     R/O      6  Ext. Comprehensive SMART error log
0x06           SL  R/O      1  SMART self-test log
0x07       GPL     R/O      1  Extended self-test log
0x09           SL  R/W      1  Selective self-test log
0x10       GPL     R/O      1  NCQ Command Error log
0x11       GPL     R/O      1  SATA Phy Event Counters log
0x80-0x9f  GPL,SL  R/W     16  Host vendor specific log
0xa0-0xa7  GPL,SL  VS      16  Device vendor specific log
0xa8-0xb5  GPL,SL  VS       1  Device vendor specific log
0xb6       GPL     VS       1  Device vendor specific log
0xb7       GPL,SL  VS       1  Device vendor specific log
0xbd       GPL,SL  VS       1  Device vendor specific log
0xc0       GPL,SL  VS       1  Device vendor specific log
0xc1       GPL     VS      93  Device vendor specific log
0xe0       GPL,SL  R/W      1  SCT Command/Status
0xe1       GPL,SL  R/W      1  SCT Data Transfer

SMART Extended Comprehensive Error Log Version: 1 (6 sectors)
Device Error Count: 6030 (device log contains only the most recent 24 errors)
	CR     = Command Register
	FEATR  = Features Register
	COUNT  = Count (was: Sector Count) Register
	LBA_48 = Upper bytes of LBA High/Mid/Low Registers ]  ATA-8
	LH     = LBA High (was: Cylinder High) Register    ]   LBA
	LM     = LBA Mid (was: Cylinder Low) Register      ] Register
	LL     = LBA Low (was: Sector Number) Register     ]
	DV     = Device (was: Device/Head) Register
	DC     = Device Control Register
	ER     = Error register
	ST     = Status register
Powered_Up_Time is measured from power on, and printed as
DDd+hh:mm:SS.sss where DD=days, hh=hours, mm=minutes,
SS=sec, and sss=millisec. It "wraps" after 49.710 days.

Error 6030 [21] occurred at disk power-on lifetime: 16693 hours (695 days + 13 hours)
  When the command that caused the error occurred, the device was active or idle.

  After command completion occurred, registers were:
  ER -- ST COUNT  LBA_48  LH LM LL DV DC
  -- -- -- == -- == == == -- -- -- -- --
  40 -- 51 00 00 00 00 0b 00 41 18 40 00  Error: UNC at LBA = 0x0b004118 = 184566040

  Commands leading to the command that caused the error were:
  CR FEATR COUNT  LBA_48  LH LM LL DV DC  Powered_Up_Time  Command/Feature_Name
  -- == -- == -- == == == -- -- -- -- --  ---------------  --------------------
  60 00 b0 00 b0 00 00 0b 00 41 68 40 08     01:07:27.168  READ FPDMA QUEUED
  60 00 b0 00 a8 00 00 0b 00 40 b8 40 08     01:07:27.168  READ FPDMA QUEUED
  60 00 a0 00 78 00 00 0b 00 42 18 40 08     01:07:27.168  READ FPDMA QUEUED
  61 00 08 00 78 00 00 74 70 27 88 40 08     01:07:27.168  WRITE FPDMA QUEUED
  61 00 08 00 40 00 00 00 00 0b 88 40 08     01:07:27.168  WRITE FPDMA QUEUED

Error 6029 [20] occurred at disk power-on lifetime: 16693 hours (695 days + 13 hours)
  When the command that caused the error occurred, the device was active or idle.

  After command completion occurred, registers were:
  ER -- ST COUNT  LBA_48  LH LM LL DV DC
  -- -- -- == -- == == == -- -- -- -- --
  40 -- 51 00 fe 00 00 0b 00 41 18 40 00  Error: UNC at LBA = 0x0b004118 = 184566040

  Commands leading to the command that caused the error were:
  CR FEATR COUNT  LBA_48  LH LM LL DV DC  Powered_Up_Time  Command/Feature_Name
  -- == -- == -- == == == -- -- -- -- --  ---------------  --------------------
  60 01 00 00 38 00 00 0b 00 46 b8 40 08     01:07:24.887  READ FPDMA QUEUED
  60 01 30 00 80 00 00 0b 00 31 a0 40 08     01:07:24.887  READ FPDMA QUEUED
  60 04 00 00 78 00 00 0b 00 42 b8 40 08     01:07:24.887  READ FPDMA QUEUED
  60 07 f0 00 28 00 00 0b 00 3a c8 40 08     01:07:24.887  READ FPDMA QUEUED
  60 00 08 00 20 00 00 0b 00 39 c0 40 08     01:07:24.886  READ FPDMA QUEUED

Error 6028 [19] occurred at disk power-on lifetime: 16678 hours (694 days + 22 hours)
  When the command that caused the error occurred, the device was active or idle.

  After command completion occurred, registers were:
  ER -- ST COUNT  LBA_48  LH LM LL DV DC
  -- -- -- == -- == == == -- -- -- -- --
  40 -- 51 00 00 00 00 0b 00 41 18 40 00  Error: UNC at LBA = 0x0b004118 = 184566040

  Commands leading to the command that caused the error were:
  CR FEATR COUNT  LBA_48  LH LM LL DV DC  Powered_Up_Time  Command/Feature_Name
  -- == -- == -- == == == -- -- -- -- --  ---------------  --------------------
  60 00 b0 00 30 00 00 0b 00 40 b8 40 08     00:07:56.713  READ FPDMA QUEUED
  60 00 b8 00 e8 00 00 0b 00 40 00 40 08     00:07:56.713  READ FPDMA QUEUED
  60 00 b0 00 e0 00 00 0b 00 3f 50 40 08     00:07:56.712  READ FPDMA QUEUED
  60 00 b8 00 10 00 00 0b 00 3e 98 40 08     00:07:56.712  READ FPDMA QUEUED
  60 00 b0 00 d8 00 00 0b 00 3d e8 40 08     00:07:56.711  READ FPDMA QUEUED

Error 6027 [18] occurred at disk power-on lifetime: 16678 hours (694 days + 22 hours)
  When the command that caused the error occurred, the device was active or idle.

  After command completion occurred, registers were:
  ER -- ST COUNT  LBA_48  LH LM LL DV DC
  -- -- -- == -- == == == -- -- -- -- --
  40 -- 51 00 00 00 00 0b 00 41 18 40 00  Error: UNC at LBA = 0x0b004118 = 184566040

  Commands leading to the command that caused the error were:
  CR FEATR COUNT  LBA_48  LH LM LL DV DC  Powered_Up_Time  Command/Feature_Name
  -- == -- == -- == == == -- -- -- -- --  ---------------  --------------------
  60 07 d0 00 f0 00 00 0b 00 3b e8 40 08     00:07:54.587  READ FPDMA QUEUED
  60 07 60 00 48 00 00 0b 00 34 88 40 08     00:07:54.581  READ FPDMA QUEUED
  60 05 20 00 e8 00 00 0b 00 2f 10 40 08     00:07:54.578  READ FPDMA QUEUED
  60 07 98 00 e0 00 00 0b 00 27 78 40 08     00:07:54.568  READ FPDMA QUEUED
  60 08 00 00 d8 00 00 0b 00 1a f0 40 08     00:07:54.562  READ FPDMA QUEUED

Error 6026 [17] occurred at disk power-on lifetime: 16678 hours (694 days + 22 hours)
  When the command that caused the error occurred, the device was active or idle.

  After command completion occurred, registers were:
  ER -- ST COUNT  LBA_48  LH LM LL DV DC
  -- -- -- == -- == == == -- -- -- -- --
  40 -- 51 00 00 00 00 0b 00 41 18 40 00  Error: UNC at LBA = 0x0b004118 = 184566040

  Commands leading to the command that caused the error were:
  CR FEATR COUNT  LBA_48  LH LM LL DV DC  Powered_Up_Time  Command/Feature_Name
  -- == -- == -- == == == -- -- -- -- --  ---------------  --------------------
  60 00 b0 00 70 00 00 0b 00 40 b8 40 08     01:14:00.044  READ FPDMA QUEUED
  60 00 b8 00 30 00 00 0b 00 40 00 40 08     01:14:00.044  READ FPDMA QUEUED
  60 00 b0 00 28 00 00 0b 00 3f 50 40 08     01:14:00.043  READ FPDMA QUEUED
  60 00 b8 00 20 00 00 0b 00 3e 98 40 08     01:14:00.043  READ FPDMA QUEUED
  60 00 b0 00 68 00 00 0b 00 3d e8 40 08     01:14:00.042  READ FPDMA QUEUED

Error 6025 [16] occurred at disk power-on lifetime: 16678 hours (694 days + 22 hours)
  When the command that caused the error occurred, the device was active or idle.

  After command completion occurred, registers were:
  ER -- ST COUNT  LBA_48  LH LM LL DV DC
  -- -- -- == -- == == == -- -- -- -- --
  40 -- 51 00 00 00 00 0b 00 41 18 40 00  Error: UNC at LBA = 0x0b004118 = 184566040

  Commands leading to the command that caused the error were:
  CR FEATR COUNT  LBA_48  LH LM LL DV DC  Powered_Up_Time  Command/Feature_Name
  -- == -- == -- == == == -- -- -- -- --  ---------------  --------------------
  60 07 d0 00 68 00 00 0b 00 3b e8 40 08     01:13:57.852  READ FPDMA QUEUED
  60 07 60 00 88 00 00 0b 00 34 88 40 08     01:13:57.845  READ FPDMA QUEUED
  60 04 30 00 78 00 00 0b 00 30 00 40 08     01:13:57.843  READ FPDMA QUEUED
  60 08 00 00 70 00 00 0b 00 28 00 40 08     01:13:57.833  READ FPDMA QUEUED
  60 08 00 00 f0 00 00 0b 00 1a f0 40 08     01:13:57.826  READ FPDMA QUEUED

Error 6024 [15] occurred at disk power-on lifetime: 16418 hours (684 days + 2 hours)
  When the command that caused the error occurred, the device was active or idle.

  After command completion occurred, registers were:
  ER -- ST COUNT  LBA_48  LH LM LL DV DC
  -- -- -- == -- == == == -- -- -- -- --
  04 -- 61 00 02 00 00 00 00 00 00 a0 00  Device Fault; Error: ABRT

  Commands leading to the command that caused the error were:
  CR FEATR COUNT  LBA_48  LH LM LL DV DC  Powered_Up_Time  Command/Feature_Name
  -- == -- == -- == == == -- -- -- -- --  ---------------  --------------------
  ef 00 10 00 02 00 00 00 00 00 00 a0 08     01:41:01.312  SET FEATURES [Enable SATA feature]
  ec 00 00 00 00 00 00 00 00 00 00 a0 08     01:41:01.311  IDENTIFY DEVICE
  ef 00 03 00 46 00 00 00 00 00 00 a0 08     01:41:01.311  SET FEATURES [Set transfer mode]
  ef 00 10 00 02 00 00 00 00 00 00 a0 08     01:41:01.310  SET FEATURES [Enable SATA feature]
  ec 00 00 00 00 00 00 00 00 00 00 a0 08     01:41:01.310  IDENTIFY DEVICE

Error 6023 [14] occurred at disk power-on lifetime: 16418 hours (684 days + 2 hours)
  When the command that caused the error occurred, the device was active or idle.

  After command completion occurred, registers were:
  ER -- ST COUNT  LBA_48  LH LM LL DV DC
  -- -- -- == -- == == == -- -- -- -- --
  04 -- 61 00 46 00 00 00 00 00 00 a0 00  Device Fault; Error: ABRT

  Commands leading to the command that caused the error were:
  CR FEATR COUNT  LBA_48  LH LM LL DV DC  Powered_Up_Time  Command/Feature_Name
  -- == -- == -- == == == -- -- -- -- --  ---------------  --------------------
  ef 00 03 00 46 00 00 00 00 00 00 a0 08     01:41:01.311  SET FEATURES [Set transfer mode]
  ef 00 10 00 02 00 00 00 00 00 00 a0 08     01:41:01.310  SET FEATURES [Enable SATA feature]
  ec 00 00 00 00 00 00 00 00 00 00 a0 08     01:41:01.310  IDENTIFY DEVICE
  25 00 00 00 10 00 00 74 70 26 10 e0 08     01:41:01.302  READ DMA EXT
  ef 00 10 00 02 00 00 00 00 00 00 a0 08     01:41:01.301  SET FEATURES [Enable SATA feature]

SMART Extended Self-test Log Version: 1 (1 sectors)
Num  Test_Description    Status                  Remaining  LifeTime(hours)  LBA_of_first_error
# 1  Extended offline    Interrupted (host reset)      90%     13217         -
# 2  Extended offline    Completed without error       00%     13206         -
# 3  Extended offline    Interrupted (host reset)      80%     13204         -
# 4  Short offline       Completed without error       00%     13203         -
# 5  Short offline       Completed without error       00%     13008         -

SMART Selective self-test log data structure revision number 1
 SPAN  MIN_LBA  MAX_LBA  CURRENT_TEST_STATUS
    1        0        0  Not_testing
    2        0        0  Not_testing
    3        0        0  Not_testing
    4        0        0  Not_testing
    5        0        0  Not_testing
Selective self-test flags (0x0):
  After scanning selected spans, do NOT read-scan remainder of disk.
If Selective self-test is pending on power-up, resume after 0 minute delay.

SCT Status Version:                  3
SCT Version (vendor specific):       258 (0x0102)
Device State:                        Active (0)
Current Temperature:                    39 Celsius
Power Cycle Min/Max Temperature:     34/39 Celsius
Lifetime    Min/Max Temperature:     26/45 Celsius
Under/Over Temperature Limit Count:   0/0
Vendor specific:
01 00 00 00 00 00 00 00 00 00 00 00 00 00 00 00
00 00 00 00 00 00 00 00 00 00 00 00 00 00 00 00

SCT Temperature History Version:     2
Temperature Sampling Period:         1 minute
Temperature Logging Interval:        1 minute
Min/Max recommended Temperature:      0/60 Celsius
Min/Max Temperature Limit:           -41/85 Celsius
Temperature History Size (Index):    478 (221)

SCT Error Recovery Control command not supported

Device Statistics (GP/SMART Log 0x04) not supported

Pending Defects log (GP Log 0x0c) not supported

SATA Phy Event Counters (GP Log 0x11)
ID      Size     Value  Description
0x0001  2            0  Command failed due to ICRC error
0x0002  2            0  R_ERR response for data FIS
0x0003  2            0  R_ERR response for device-to-host data FIS
0x0004  2            0  R_ERR response for host-to-device data FIS
0x0005  2            0  R_ERR response for non-data FIS
0x0006  2            0  R_ERR response for device-to-host non-data FIS
0x0007  2            0  R_ERR response for host-to-device non-data FIS
0x0008  2            0  Device-to-host non-data FIS retries
0x0009  2            9  Transition from drive PhyRdy to drive PhyNRdy
0x000a  2            6  Device-to-host register FISes sent due to a COMRESET
0x000b  2            0  CRC errors within host-to-device FIS
0x000f  2            0  R_ERR response for host-to-device data FIS, CRC
0x0012  2            0  R_ERR response for host-to-device non-data FIS, CRC
0x8000  4        14252  Vendor specific



