smartctl 7.1 2019-12-30 r5022 [x86_64-linux-4.9.155-nrj-desktop-1rosa-x86_64] (local build)
Copyright (C) 2002-19, Bruce Allen, Christian Franke, www.smartmontools.org

=== START OF INFORMATION SECTION ===
Device Model:     SAMSUNG SP40A2H
Serial Number:    --
Firmware Version: RR100-06
User Capacity:    40,060,403,712 bytes [40.0 GB]
Sector Size:      512 bytes logical/physical
Device is:        Not in smartctl database [for details use: -P showall]
ATA Version is:   ATA/ATAPI-6 T13/1410D revision 1
Local Time is:    Thu Jul 23 23:29:31 2020 MSK
SMART support is: Available - device has SMART capability.
SMART support is: Enabled
AAM feature is:   Disabled
APM feature is:   Unavailable
Rd look-ahead is: Enabled
Write cache is:   Enabled
DSN feature is:   Unavailable
ATA Security is:  Disabled, NOT FROZEN [SEC1]
Wt Cache Reorder: Unavailable

=== START OF READ SMART DATA SECTION ===
SMART overall-health self-assessment test result: PASSED

General SMART Values:
Offline data collection status:  (0x82)	Offline data collection activity
					was completed without error.
					Auto Offline Data Collection: Enabled.
Self-test execution status:      ( 248)	Self-test routine in progress...
					80% of test remaining.
Total time to complete Offline 
data collection: 		( 1800) seconds.
Offline data collection
capabilities: 			 (0x1b) SMART execute Offline immediate.
					Auto Offline data collection on/off support.
					Suspend Offline collection upon new
					command.
					Offline surface scan supported.
					Self-test supported.
					No Conveyance Self-test supported.
					No Selective Self-test supported.
SMART capabilities:            (0x0003)	Saves SMART data before entering
					power-saving mode.
					Supports SMART auto save timer.
Error logging capability:        (0x01)	Error logging supported.
					No General Purpose Logging support.
Short self-test routine 
recommended polling time: 	 (   1) minutes.
Extended self-test routine
recommended polling time: 	 (  30) minutes.

SMART Attributes Data Structure revision number: 16
Vendor Specific SMART Attributes with Thresholds:
ID# ATTRIBUTE_NAME          FLAGS    VALUE WORST THRESH FAIL RAW_VALUE
  1 Raw_Read_Error_Rate     PO-R--   100   100   051    -    23
  4 Start_Stop_Count        -O--CK   093   093   000    -    8030
  5 Reallocated_Sector_Ct   PO--CK   100   100   010    -    2
  7 Seek_Error_Rate         PO-R--   253   253   051    -    0
  8 Seek_Time_Performance   --S--K   091   091   000    -    9331
  9 Power_On_Hours          -O--CK   098   098   000    -    1522519
 12 Power_Cycle_Count       -O--CK   096   096   000    -    4222
194 Temperature_Celsius     -O---K   199   097   000    -    13
197 Current_Pending_Sector  PO--CK   253   253   010    -    0
198 Offline_Uncorrectable   P---CK   253   253   010    -    0
199 UDMA_CRC_Error_Count    -O-R--   100   100   000    -    0
200 Multi_Zone_Error_Rate   PO-R--   100   100   051    -    0
201 Soft_Read_Error_Rate    PO-R--   100   100   051    -    0
                            ||||||_ K auto-keep
                            |||||__ C event count
                            ||||___ R error rate
                            |||____ S speed/performance
                            ||_____ O updated online
                            |______ P prefailure warning

General Purpose Log Directory not supported

SMART Log Directory Version 1 [multi-sector log support]
Address    Access  R/W   Size  Description
0x00           SL  R/O      1  Log Directory
0x01           SL  R/O      1  Summary SMART error log
0x02           SL  R/O      2  Comprehensive SMART error log
0x06           SL  R/O      2  SMART self-test log
0x80-0x9f      SL  R/W     16  Host vendor specific log

SMART Extended Comprehensive Error Log (GP Log 0x03) not supported

SMART Error Log Version: 1
Warning: ATA error count 23068 inconsistent with error log pointer 5

ATA Error Count: 23068 (device log contains only the most recent five errors)
	CR = Command Register [HEX]
	FR = Features Register [HEX]
	SC = Sector Count Register [HEX]
	SN = Sector Number Register [HEX]
	CL = Cylinder Low Register [HEX]
	CH = Cylinder High Register [HEX]
	DH = Device/Head Register [HEX]
	DC = Device Command Register [HEX]
	ER = Error register [HEX]
	ST = Status register [HEX]
Powered_Up_Time is measured from power on, and printed as
DDd+hh:mm:SS.sss where DD=days, hh=hours, mm=minutes,
SS=sec, and sss=millisec. It "wraps" after 49.710 days.

Error 23068 occurred at disk power-on lifetime: 35887 hours (1495 days + 7 hours)
  When the command that caused the error occurred, the device was active or idle.

  After command completion occurred, registers were:
  ER ST SC SN CL CH DH
  -- -- -- -- -- -- --
  04 51 00 00 00 00 b0  Error: ABRT

  Commands leading to the command that caused the error were:
  CR FR SC SN CL CH DH DC   Powered_Up_Time  Command/Feature_Name
  -- -- -- -- -- -- -- --  ----------------  --------------------
  a1 00 00 00 00 00 b0 00   6d+06:33:02.720  IDENTIFY PACKET DEVICE
  c8 20 01 01 00 00 f0 00   7d+19:03:02.400  READ DMA
  c8 20 01 00 00 00 f0 00   7d+19:03:02.400  READ DMA
  c8 20 01 00 00 00 f0 00   7d+19:03:02.400  READ DMA
  e3 20 00 01 00 00 b0 00   7d+19:03:02.400  IDLE

Error 23067 occurred at disk power-on lifetime: 35887 hours (1495 days + 7 hours)
  When the command that caused the error occurred, the device was active or idle.

  After command completion occurred, registers were:
  ER ST SC SN CL CH DH
  -- -- -- -- -- -- --
  04 51 00 00 00 00 b0  Error: ABRT

  Commands leading to the command that caused the error were:
  CR FR SC SN CL CH DH DC   Powered_Up_Time  Command/Feature_Name
  -- -- -- -- -- -- -- --  ----------------  --------------------
  a1 00 00 00 00 00 b0 00   1d+14:46:31.680  IDENTIFY PACKET DEVICE
  c8 20 01 01 00 00 f0 00   7d+19:03:02.400  READ DMA
  c8 20 01 00 00 00 f0 00   7d+19:03:02.400  READ DMA
  c8 20 01 00 00 00 f0 00   7d+19:03:02.400  READ DMA
  e3 20 00 01 00 00 b0 00   7d+19:03:02.400  IDLE

Error 23066 occurred at disk power-on lifetime: 35887 hours (1495 days + 7 hours)
  When the command that caused the error occurred, the device was active or idle.

  After command completion occurred, registers were:
  ER ST SC SN CL CH DH
  -- -- -- -- -- -- --
  04 51 00 00 00 00 b0  Error: ABRT

  Commands leading to the command that caused the error were:
  CR FR SC SN CL CH DH DC   Powered_Up_Time  Command/Feature_Name
  -- -- -- -- -- -- -- --  ----------------  --------------------
  a1 00 00 00 00 00 b0 00   1d+14:46:31.680  IDENTIFY PACKET DEVICE
  c8 20 01 01 00 00 f0 00   7d+19:03:02.400  READ DMA
  c8 20 01 00 00 00 f0 00   7d+19:03:02.400  READ DMA
  c8 20 01 00 00 00 f0 00   7d+19:03:02.400  READ DMA
  e3 20 00 01 00 00 b0 00   7d+19:03:02.400  IDLE

Error 23065 occurred at disk power-on lifetime: 35887 hours (1495 days + 7 hours)
  When the command that caused the error occurred, the device was active or idle.

  After command completion occurred, registers were:
  ER ST SC SN CL CH DH
  -- -- -- -- -- -- --
  04 51 00 00 00 00 b0  Error: ABRT

  Commands leading to the command that caused the error were:
  CR FR SC SN CL CH DH DC   Powered_Up_Time  Command/Feature_Name
  -- -- -- -- -- -- -- --  ----------------  --------------------
  a1 00 00 00 00 00 b0 00   1d+14:46:31.680  IDENTIFY PACKET DEVICE
  c8 20 01 01 00 00 f0 00   7d+19:03:02.400  READ DMA
  c8 20 01 00 00 00 f0 00   7d+19:03:02.400  READ DMA
  c8 20 01 00 00 00 f0 00   7d+19:03:02.400  READ DMA
  e3 20 00 01 00 00 b0 00   7d+19:03:02.400  IDLE

Error 23064 occurred at disk power-on lifetime: 6700 hours (279 days + 4 hours)
  When the command that caused the error occurred, the device was active or idle.

  After command completion occurred, registers were:
  ER ST SC SN CL CH DH
  -- -- -- -- -- -- --
  04 51 fe 00 00 00 50  Error: ABRT

  Commands leading to the command that caused the error were:
  CR FR SC SN CL CH DH DC   Powered_Up_Time  Command/Feature_Name
  -- -- -- -- -- -- -- --  ----------------  --------------------
  ef 05 fe 00 00 00 50 00  43d+14:48:37.120  SET FEATURES [Enable APM]
  c8 00 08 00 00 10 f0 00  43d+14:48:37.120  READ DMA
  c8 00 08 00 00 02 f0 00  43d+14:48:37.120  READ DMA
  c8 00 08 f8 00 03 f0 00  43d+14:48:37.120  READ DMA
  c8 00 08 f0 00 03 f0 00  43d+14:48:37.120  READ DMA

SMART Extended Self-test Log (GP Log 0x07) not supported

SMART Self-test log structure revision number 1
No self-tests have been logged.  [To run self-tests, use: smartctl -t]

Selective Self-tests/Logging not supported

SCT Commands not supported

Device Statistics (GP/SMART Log 0x04) not supported

Pending Defects log (GP Log 0x0c) not supported

SATA Phy Event Counters (GP Log 0x11) not supported



