smartctl 6.6 2016-05-31 r4324 [x86_64-linux-4.15.0-54-generic] (local build)
Copyright (C) 2002-16, Bruce Allen, Christian Franke, www.smartmontools.org

=== START OF INFORMATION SECTION ===
Model Family:     SAMSUNG SpinPoint F1 EG
Device Model:     SAMSUNG HD103UI
Serial Number:    --
LU WWN Device Id: 5 0000f0 ...
Firmware Version: 1AA01113
User Capacity:    1,000,203,804,160 bytes [1.00 TB]
Sector Size:      512 bytes logical/physical
Device is:        In smartctl database [for details use: -P show]
ATA Version is:   ATA/ATAPI-7, ATA8-ACS T13/1699-D revision 3b
Local Time is:    Wed Mar  9 19:16:03 2022 -05
SMART support is: Available - device has SMART capability.
SMART support is: Enabled
AAM feature is:   Disabled
APM level is:     254 (maximum performance)
Rd look-ahead is: Enabled
Write cache is:   Enabled
ATA Security is:  Disabled, frozen [SEC2]
Wt Cache Reorder: Enabled

=== START OF READ SMART DATA SECTION ===
SMART overall-health self-assessment test result: PASSED

General SMART Values:
Offline data collection status:  (0x00)	Offline data collection activity
					was never started.
					Auto Offline Data Collection: Disabled.
Self-test execution status:      (   0)	The previous self-test routine completed
					without error or no self-test has ever 
					been run.
Total time to complete Offline 
data collection: 		(14496) seconds.
Offline data collection
capabilities: 			 (0x7b) SMART execute Offline immediate.
					Auto Offline data collection on/off support.
					Suspend Offline collection upon new
					command.
					Offline surface scan supported.
					Self-test supported.
					Conveyance Self-test supported.
					Selective Self-test supported.
SMART capabilities:            (0x0003)	Saves SMART data before entering
					power-saving mode.
					Supports SMART auto save timer.
Error logging capability:        (0x01)	Error logging supported.
					General Purpose Logging supported.
Short self-test routine 
recommended polling time: 	 (   2) minutes.
Extended self-test routine
recommended polling time: 	 ( 242) minutes.
Conveyance self-test routine
recommended polling time: 	 (  26) minutes.
SCT capabilities: 	       (0x003f)	SCT Status supported.
					SCT Error Recovery Control supported.
					SCT Feature Control supported.
					SCT Data Table supported.

SMART Attributes Data Structure revision number: 16
Vendor Specific SMART Attributes with Thresholds:
ID# ATTRIBUTE_NAME          FLAGS    VALUE WORST THRESH FAIL RAW_VALUE
  1 Raw_Read_Error_Rate     POSR--   100   098   051    -    71
  3 Spin_Up_Time            POS---   073   073   011    -    8960
  4 Start_Stop_Count        -O--CK   098   098   000    -    2490
  5 Reallocated_Sector_Ct   PO--CK   100   100   010    -    0
  7 Seek_Error_Rate         POSR--   100   100   051    -    0
  8 Seek_Time_Performance   P-S--K   100   100   015    -    0
  9 Power_On_Hours          -O--CK   096   096   000    -    18149
 10 Spin_Retry_Count        PO--CK   100   100   051    -    0
 11 Calibration_Retry_Count -O--C-   100   100   000    -    13
 12 Power_Cycle_Count       -O--CK   098   098   000    -    2312
 13 Read_Soft_Error_Rate    -OSR--   100   098   000    -    71
183 Runtime_Bad_Block       -O--CK   100   100   000    -    27
184 End-to-End_Error        PO--CK   100   100   000    -    0
187 Reported_Uncorrect      -O--CK   100   100   000    -    316
188 Command_Timeout         -O--CK   100   100   000    -    0
190 Airflow_Temperature_Cel -O---K   071   053   000    -    29 (Min/Max 19/30)
194 Temperature_Celsius     -O---K   070   053   000    -    30 (Min/Max 19/31)
195 Hardware_ECC_Recovered  -O-RC-   100   100   000    -    2494408
196 Reallocated_Event_Count -O--CK   100   100   000    -    0
197 Current_Pending_Sector  -O--C-   100   100   000    -    0
198 Offline_Uncorrectable   ----CK   100   100   000    -    0
199 UDMA_CRC_Error_Count    -OSRCK   100   036   000    -    23364
200 Multi_Zone_Error_Rate   -O-R--   100   099   000    -    0
201 Soft_Read_Error_Rate    -O-R--   253   253   000    -    0
                            ||||||_ K auto-keep
                            |||||__ C event count
                            ||||___ R error rate
                            |||____ S speed/performance
                            ||_____ O updated online
                            |______ P prefailure warning

General Purpose Log Directory Version 1
SMART           Log Directory Version 1 [multi-sector log support]
Address    Access  R/W   Size  Description
0x00       GPL,SL  R/O      1  Log Directory
0x01           SL  R/O      1  Summary SMART error log
0x02           SL  R/O      2  Comprehensive SMART error log
0x03       GPL     R/O      2  Ext. Comprehensive SMART error log
0x04       GPL     R/O      2  Device Statistics log
0x06           SL  R/O      1  SMART self-test log
0x07       GPL     R/O      2  Extended self-test log
0x09           SL  R/W      1  Selective self-test log
0x10       GPL     R/O      1  SATA NCQ Queued Error log
0x11       GPL     R/O      1  SATA Phy Event Counters log
0x21       GPL     R/O      2  Write stream error log
0x22       GPL     R/O      2  Read stream error log
0x80-0x9f  GPL,SL  R/W     16  Host vendor specific log
0xe0       GPL,SL  R/W      1  SCT Command/Status
0xe1       GPL,SL  R/W      1  SCT Data Transfer

SMART Extended Comprehensive Error Log Version: 1 (2 sectors)
Device Error Count: 23639 (device log contains only the most recent 8 errors)
	CR     = Command Register
	FEATR  = Features Register
	COUNT  = Count (was: Sector Count) Register
	LBA_48 = Upper bytes of LBA High/Mid/Low Registers ]  ATA-8
	LH     = LBA High (was: Cylinder High) Register    ]   LBA
	LM     = LBA Mid (was: Cylinder Low) Register      ] Register
	LL     = LBA Low (was: Sector Number) Register     ]
	DV     = Device (was: Device/Head) Register
	DC     = Device Control Register
	ER     = Error register
	ST     = Status register
Powered_Up_Time is measured from power on, and printed as
DDd+hh:mm:SS.sss where DD=days, hh=hours, mm=minutes,
SS=sec, and sss=millisec. It "wraps" after 49.710 days.

Error 23639 [6] occurred at disk power-on lifetime: 13239 hours (551 days + 15 hours)
  When the command that caused the error occurred, the device was active or idle.

  After command completion occurred, registers were:
  ER -- ST COUNT  LBA_48  LH LM LL DV DC
  -- -- -- == -- == == == -- -- -- -- --
  00 -- 48 00 31 00 00 54 e5 a1 af 40 00   at LBA = 0x54e5a1af = 1424335279

  Commands leading to the command that caused the error were:
  CR FEATR COUNT  LBA_48  LH LM LL DV DC  Powered_Up_Time  Command/Feature_Name
  -- == -- == -- == == == -- -- -- -- --  ---------------  --------------------
  61 00 00 00 08 00 00 00 df 13 c8 40 00     00:53:19.650  WRITE FPDMA QUEUED
  61 00 00 00 08 00 00 00 df 12 f8 40 00     00:53:19.650  WRITE FPDMA QUEUED
  61 00 00 00 08 00 00 00 de 1a 00 40 00     00:53:19.650  WRITE FPDMA QUEUED
  61 00 00 00 08 00 00 00 de 19 50 40 00     00:53:19.650  WRITE FPDMA QUEUED
  61 00 00 00 08 00 00 00 de 18 58 40 00     00:53:19.650  WRITE FPDMA QUEUED

Error 23638 [5] occurred at disk power-on lifetime: 13239 hours (551 days + 15 hours)
  When the command that caused the error occurred, the device was active or idle.

  After command completion occurred, registers were:
  ER -- ST COUNT  LBA_48  LH LM LL DV DC
  -- -- -- == -- == == == -- -- -- -- --
  00 -- 48 00 07 00 00 54 e2 9f a1 40 00   at LBA = 0x54e29fa1 = 1424138145

  Commands leading to the command that caused the error were:
  CR FEATR COUNT  LBA_48  LH LM LL DV DC  Powered_Up_Time  Command/Feature_Name
  -- == -- == -- == == == -- -- -- -- --  ---------------  --------------------
  61 00 00 00 08 00 00 00 e3 68 58 40 00     00:50:28.900  WRITE FPDMA QUEUED
  61 00 00 00 18 00 00 00 e5 98 30 40 00     00:50:28.900  WRITE FPDMA QUEUED
  61 00 00 00 20 00 00 00 e5 91 b0 40 00     00:50:28.900  WRITE FPDMA QUEUED
  61 00 00 00 18 00 00 00 e5 92 48 40 00     00:50:28.900  WRITE FPDMA QUEUED
  61 00 00 01 e8 00 00 00 e5 05 d0 40 00     00:50:28.900  WRITE FPDMA QUEUED

Error 23637 [4] occurred at disk power-on lifetime: 13239 hours (551 days + 15 hours)
  When the command that caused the error occurred, the device was active or idle.

  After command completion occurred, registers were:
  ER -- ST COUNT  LBA_48  LH LM LL DV DC
  -- -- -- == -- == == == -- -- -- -- --
  00 -- 48 00 07 00 00 54 e2 9f a1 40 00   at LBA = 0x54e29fa1 = 1424138145

  Commands leading to the command that caused the error were:
  CR FEATR COUNT  LBA_48  LH LM LL DV DC  Powered_Up_Time  Command/Feature_Name
  -- == -- == -- == == == -- -- -- -- --  ---------------  --------------------
  61 00 00 00 18 00 00 00 e3 44 30 40 00     00:50:28.400  WRITE FPDMA QUEUED
  61 00 00 00 18 00 00 00 e3 45 00 40 00     00:50:28.400  WRITE FPDMA QUEUED
  61 00 00 00 08 00 00 00 e3 66 c8 40 00     00:50:28.400  WRITE FPDMA QUEUED
  61 00 00 00 08 00 00 00 e3 f7 f8 40 00     00:50:28.400  WRITE FPDMA QUEUED
  61 00 00 00 20 00 00 00 e5 67 d0 40 00     00:50:28.400  WRITE FPDMA QUEUED

Error 23636 [3] occurred at disk power-on lifetime: 13239 hours (551 days + 15 hours)
  When the command that caused the error occurred, the device was active or idle.

  After command completion occurred, registers were:
  ER -- ST COUNT  LBA_48  LH LM LL DV DC
  -- -- -- == -- == == == -- -- -- -- --
  00 -- 48 00 07 00 00 54 e2 9f a1 40 00   at LBA = 0x54e29fa1 = 1424138145

  Commands leading to the command that caused the error were:
  CR FEATR COUNT  LBA_48  LH LM LL DV DC  Powered_Up_Time  Command/Feature_Name
  -- == -- == -- == == == -- -- -- -- --  ---------------  --------------------
  61 00 00 01 e8 00 00 00 e5 05 d0 40 00     00:50:27.890  WRITE FPDMA QUEUED
  61 00 00 00 18 00 00 00 e4 5b 38 40 00     00:50:27.890  WRITE FPDMA QUEUED
  61 00 00 00 08 00 00 00 e2 6b 98 40 00     00:50:27.890  WRITE FPDMA QUEUED
  61 00 00 00 08 00 00 00 e3 f7 f8 40 00     00:50:27.890  WRITE FPDMA QUEUED
  61 00 00 00 08 00 00 00 e3 66 c8 40 00     00:50:27.890  WRITE FPDMA QUEUED

Error 23635 [2] occurred at disk power-on lifetime: 13237 hours (551 days + 13 hours)
  When the command that caused the error occurred, the device was active or idle.

  After command completion occurred, registers were:
  ER -- ST COUNT  LBA_48  LH LM LL DV DC
  -- -- -- == -- == == == -- -- -- -- --
  00 -- 48 08 7c 00 00 52 e2 6a 8c 40 00   at LBA = 0x52e26a8c = 1390570124

  Commands leading to the command that caused the error were:
  CR FEATR COUNT  LBA_48  LH LM LL DV DC  Powered_Up_Time  Command/Feature_Name
  -- == -- == -- == == == -- -- -- -- --  ---------------  --------------------
  61 20 20 09 f0 00 00 00 e2 69 18 40 00     05:38:17.710  WRITE FPDMA QUEUED
  61 20 20 05 40 00 00 00 e2 63 d8 40 00     05:38:17.710  WRITE FPDMA QUEUED
  ea 00 00 00 00 00 00 00 00 00 00 a0 08     05:38:13.370  FLUSH CACHE EXT
  61 20 20 00 08 00 00 00 a9 90 00 40 00     05:38:13.370  WRITE FPDMA QUEUED
  61 20 20 00 20 00 00 00 e2 3e c0 40 00     05:38:13.370  WRITE FPDMA QUEUED

Error 23634 [1] occurred at disk power-on lifetime: 13237 hours (551 days + 13 hours)
  When the command that caused the error occurred, the device was active or idle.

  After command completion occurred, registers were:
  ER -- ST COUNT  LBA_48  LH LM LL DV DC
  -- -- -- == -- == == == -- -- -- -- --
  00 -- 48 00 93 00 00 38 e1 62 75 40 00   at LBA = 0x38e16275 = 954294901

  Commands leading to the command that caused the error were:
  CR FEATR COUNT  LBA_48  LH LM LL DV DC  Powered_Up_Time  Command/Feature_Name
  -- == -- == -- == == == -- -- -- -- --  ---------------  --------------------
  61 20 20 00 30 00 00 00 e1 63 10 40 00     05:37:40.140  WRITE FPDMA QUEUED
  61 20 20 01 50 00 00 00 e1 61 b8 40 00     05:37:40.140  WRITE FPDMA QUEUED
  61 20 20 00 88 00 00 00 e1 61 28 40 00     05:37:40.140  WRITE FPDMA QUEUED
  61 20 20 00 10 00 00 00 e1 61 10 40 00     05:37:40.140  WRITE FPDMA QUEUED
  61 20 20 00 30 00 00 00 e1 60 d8 40 00     05:37:40.140  WRITE FPDMA QUEUED

Error 23633 [0] occurred at disk power-on lifetime: 13237 hours (551 days + 13 hours)
  When the command that caused the error occurred, the device was active or idle.

  After command completion occurred, registers were:
  ER -- ST COUNT  LBA_48  LH LM LL DV DC
  -- -- -- == -- == == == -- -- -- -- --
  00 -- 48 00 99 00 00 55 e2 15 7f 40 00   at LBA = 0x55e2157f = 1440879999

  Commands leading to the command that caused the error were:
  CR FEATR COUNT  LBA_48  LH LM LL DV DC  Powered_Up_Time  Command/Feature_Name
  -- == -- == -- == == == -- -- -- -- --  ---------------  --------------------
  61 20 20 00 a8 00 00 00 e2 15 70 40 00     05:37:16.150  WRITE FPDMA QUEUED
  61 20 20 06 00 00 00 00 e6 aa 00 40 00     05:37:16.070  WRITE FPDMA QUEUED
  61 20 20 0a 00 00 00 00 e6 a0 00 40 00     05:37:16.070  WRITE FPDMA QUEUED
  61 20 20 06 00 00 00 00 e6 9a 00 40 00     05:37:16.070  WRITE FPDMA QUEUED
  61 20 20 0a 00 00 00 00 e6 90 00 40 00     05:37:16.070  WRITE FPDMA QUEUED

Error 23632 [7] occurred at disk power-on lifetime: 13237 hours (551 days + 13 hours)
  When the command that caused the error occurred, the device was active or idle.

  After command completion occurred, registers were:
  ER -- ST COUNT  LBA_48  LH LM LL DV DC
  -- -- -- == -- == == == -- -- -- -- --
  00 -- 48 00 40 00 00 38 e1 70 00 40 00   at LBA = 0x38e17000 = 954298368

  Commands leading to the command that caused the error were:
  CR FEATR COUNT  LBA_48  LH LM LL DV DC  Powered_Up_Time  Command/Feature_Name
  -- == -- == -- == == == -- -- -- -- --  ---------------  --------------------
  61 20 20 06 48 00 00 00 e1 69 f8 40 00     05:37:06.020  WRITE FPDMA QUEUED
  61 20 20 0a 00 00 00 00 e1 5f f8 40 00     05:37:06.020  WRITE FPDMA QUEUED
  61 20 20 06 00 00 00 00 e1 59 f8 40 00     05:37:06.020  WRITE FPDMA QUEUED
  61 20 20 0a 00 00 00 00 e1 4f f8 40 00     05:37:06.020  WRITE FPDMA QUEUED
  61 20 20 00 08 00 00 00 a9 90 00 40 00     05:37:06.020  WRITE FPDMA QUEUED

SMART Extended Self-test Log Version: 1 (2 sectors)
No self-tests have been logged.  [To run self-tests, use: smartctl -t]

SMART Selective self-test log data structure revision number 1
 SPAN  MIN_LBA  MAX_LBA  CURRENT_TEST_STATUS
    1        0        0  Not_testing
    2        0        0  Not_testing
    3        0        0  Not_testing
    4        0        0  Not_testing
    5        0        0  Not_testing
Selective self-test flags (0x0):
  After scanning selected spans, do NOT read-scan remainder of disk.
If Selective self-test is pending on power-up, resume after 0 minute delay.

SCT Status Version:                  2
SCT Version (vendor specific):       256 (0x0100)
SCT Support Level:                   1
Device State:                        Active (0)
Current Temperature:                 30 Celsius
Power Cycle Max Temperature:         31 Celsius
Lifetime    Max Temperature:         47 Celsius

SCT Temperature History Version:     2
Temperature Sampling Period:         1 minute
Temperature Logging Interval:        1 minute
Min/Max recommended Temperature:     -4/72 Celsius
Min/Max Temperature Limit:           -9/77 Celsius
Temperature History Size (Index):    128 (69)

SCT Error Recovery Control:
           Read: Disabled
          Write: Disabled

ATA_READ_LOG_EXT (addr=0x04:0x00, page=0, n=1) failed: scsi error badly formed scsi parameters
Read Device Statistics page 0x00 failed

SATA Phy Event Counters (GP Log 0x11)
ID      Size     Value  Description
0x000a  2            2  Device-to-host register FISes sent due to a COMRESET
0x0001  2            0  Command failed due to ICRC error
0x0002  2            0  R_ERR response for data FIS
0x0003  2            0  R_ERR response for device-to-host data FIS
0x0004  2            0  R_ERR response for host-to-device data FIS
0x0005  2            0  R_ERR response for non-data FIS
0x0006  2            0  R_ERR response for device-to-host non-data FIS
0x0007  2            0  R_ERR response for host-to-device non-data FIS
0x0008  2            0  Device-to-host non-data FIS retries
0x0009  2            2  Transition from drive PhyRdy to drive PhyNRdy
0x000b  2            0  CRC errors within host-to-device FIS
0x000d  2            0  Non-CRC errors within host-to-device FIS
0x000f  2            0  R_ERR response for host-to-device data FIS, CRC
0x0010  2            0  R_ERR response for host-to-device data FIS, non-CRC
0x0012  2            0  R_ERR response for host-to-device non-data FIS, CRC
0x0013  2            0  R_ERR response for host-to-device non-data FIS, non-CRC

