smartctl 7.2 2020-12-30 r5155 [x86_64-linux-5.16.7-desktop-1omv4003] (OpenMandriva Lx 7.2-2)
Copyright (C) 2002-20, Bruce Allen, Christian Franke, www.smartmontools.org

=== START OF INFORMATION SECTION ===
Device Model:     MB8000GEQUU
Serial Number:    --
LU WWN Device Id: 5 000cca ...
Firmware Version: HPGB
User Capacity:    8,001,563,222,016 bytes [8.00 TB]
Sector Sizes:     512 bytes logical, 4096 bytes physical
Rotation Rate:    7200 rpm
Form Factor:      3.5 inches
Device is:        Not in smartctl database [for details use: -P showall]
ATA Version is:   ACS-2, ATA8-ACS T13/1699-D revision 6
SATA Version is:  SATA 3.1, 6.0 Gb/s (current: 6.0 Gb/s)
Local Time is:    Tue Jun 13 23:09:00 2023 BST
SMART support is: Available - device has SMART capability.
SMART support is: Enabled
AAM feature is:   Unavailable
APM feature is:   Unavailable
Rd look-ahead is: Enabled
Write cache is:   Disabled
DSN feature is:   Unavailable
ATA Security is:  Unavailable
Wt Cache Reorder: Unavailable

=== START OF READ SMART DATA SECTION ===
SMART overall-health self-assessment test result: PASSED

General SMART Values:
Offline data collection status:  (0x80)	Offline data collection activity
					was never started.
					Auto Offline Data Collection: Enabled.
Self-test execution status:      (   0)	The previous self-test routine completed
					without error or no self-test has ever 
					been run.
Total time to complete Offline 
data collection: 		(  101) seconds.
Offline data collection
capabilities: 			 (0x5b) SMART execute Offline immediate.
					Auto Offline data collection on/off support.
					Suspend Offline collection upon new
					command.
					Offline surface scan supported.
					Self-test supported.
					No Conveyance Self-test supported.
					Selective Self-test supported.
SMART capabilities:            (0x0003)	Saves SMART data before entering
					power-saving mode.
					Supports SMART auto save timer.
Error logging capability:        (0x01)	Error logging supported.
					General Purpose Logging supported.
Short self-test routine 
recommended polling time: 	 (   2) minutes.
Extended self-test routine
recommended polling time: 	 (1125) minutes.
SCT capabilities: 	       (0x0025)	SCT Status supported.
					SCT Data Table supported.

SMART Attributes Data Structure revision number: 16
Vendor Specific SMART Attributes with Thresholds:
ID# ATTRIBUTE_NAME          FLAGS    VALUE WORST THRESH FAIL RAW_VALUE
  1 Raw_Read_Error_Rate     POSR--   100   100   016    -    0
  2 Throughput_Performance  POS---   134   100   054    -    104
  3 Spin_Up_Time            PO----   100   100   024    -    0
  5 Reallocated_Sector_Ct   PO--CK   100   100   005    -    0
  7 Seek_Error_Rate         POSR--   100   100   067    -    0
  8 Seek_Time_Performance   P-S---   140   100   020    -    15
  9 Power_On_Hours          -O--CK   100   100   000    -    5665
 10 Spin_Retry_Count        PO--C-   100   100   060    -    0
 22 Unknown_Attribute       PO---K   100   100   025    -    100
180 Unknown_HDD_Attribute   PO-RCK   100   100   098    -    0
194 Temperature_Celsius     -O---K   171   142   000    -    35 (Min/Max 18/42)
196 Reallocated_Event_Count PO--CK   100   100   000    -    0
                            ||||||_ K auto-keep
                            |||||__ C event count
                            ||||___ R error rate
                            |||____ S speed/performance
                            ||_____ O updated online
                            |______ P prefailure warning

General Purpose Log Directory Version 1
SMART           Log Directory Version 1 [multi-sector log support]
Address    Access  R/W   Size  Description
0x00       GPL,SL  R/O      1  Log Directory
0x01           SL  R/O      1  Summary SMART error log
0x02           SL  R/O      1  Comprehensive SMART error log
0x03       GPL     R/O      1  Ext. Comprehensive SMART error log
0x04       GPL,SL  R/O      7  Device Statistics log
0x06           SL  R/O      1  SMART self-test log
0x07       GPL     R/O      1  Extended self-test log
0x08       GPL     R/O      2  Power Conditions log
0x09           SL  R/W      1  Selective self-test log
0x0d       GPL,SL  R/O      7  LPS Mis-alignment log
0x10       GPL     R/O      1  NCQ Command Error log
0x11       GPL     R/O      1  SATA Phy Event Counters log
0x12       GPL     R/O      1  SATA NCQ Non-Data log
0x15       GPL     R/W      1  Rebuild Assist log
0x30       GPL     R/O      9  IDENTIFY DEVICE data log
0x80-0x9f  GPL,SL  R/W     16  Host vendor specific log
0xb5           SL  VS       1  Device vendor specific log
0xb6       GPL     VS     127  Device vendor specific log
0xd0       GPL     VS       1  Device vendor specific log
0xd7       GPL     VS       1  Device vendor specific log
0xe0       GPL,SL  R/W      1  SCT Command/Status
0xe1       GPL,SL  R/W      1  SCT Data Transfer

SMART Extended Comprehensive Error Log Version: 1 (1 sectors)
Device Error Count: 26 (device log contains only the most recent 4 errors)
	CR     = Command Register
	FEATR  = Features Register
	COUNT  = Count (was: Sector Count) Register
	LBA_48 = Upper bytes of LBA High/Mid/Low Registers ]  ATA-8
	LH     = LBA High (was: Cylinder High) Register    ]   LBA
	LM     = LBA Mid (was: Cylinder Low) Register      ] Register
	LL     = LBA Low (was: Sector Number) Register     ]
	DV     = Device (was: Device/Head) Register
	DC     = Device Control Register
	ER     = Error register
	ST     = Status register
Powered_Up_Time is measured from power on, and printed as
DDd+hh:mm:SS.sss where DD=days, hh=hours, mm=minutes,
SS=sec, and sss=millisec. It "wraps" after 49.710 days.

Error 26 [1] occurred at disk power-on lifetime: 5663 hours (235 days + 23 hours)
  When the command that caused the error occurred, the device was active or idle.

  After command completion occurred, registers were:
  ER -- ST COUNT  LBA_48  LH LM LL DV DC
  -- -- -- == -- == == == -- -- -- -- --
  04 -- 53 00 00 00 00 00 00 00 00 00 00  Error: ABRT

  Commands leading to the command that caused the error were:
  CR FEATR COUNT  LBA_48  LH LM LL DV DC  Powered_Up_Time  Command/Feature_Name
  -- == -- == -- == == == -- -- -- -- --  ---------------  --------------------
  ef 00 05 00 fe 00 00 00 00 00 00 40 08     00:06:09.267  SET FEATURES [Enable APM]
  60 00 08 00 88 00 00 14 4f 4f 10 40 08     00:06:08.908  READ FPDMA QUEUED
  60 00 68 00 80 00 02 23 71 c7 88 40 08     00:06:08.907  READ FPDMA QUEUED
  60 00 80 00 78 00 02 23 71 c7 00 40 08     00:06:08.907  READ FPDMA QUEUED
  60 00 20 00 10 00 00 00 00 00 08 40 08     00:06:08.907  READ FPDMA QUEUED

Error 25 [0] occurred at disk power-on lifetime: 5662 hours (235 days + 22 hours)
  When the command that caused the error occurred, the device was active or idle.

  After command completion occurred, registers were:
  ER -- ST COUNT  LBA_48  LH LM LL DV DC
  -- -- -- == -- == == == -- -- -- -- --
  04 -- 53 00 00 00 00 00 00 00 00 00 00  Error: ABRT

  Commands leading to the command that caused the error were:
  CR FEATR COUNT  LBA_48  LH LM LL DV DC  Powered_Up_Time  Command/Feature_Name
  -- == -- == -- == == == -- -- -- -- --  ---------------  --------------------
  ef 00 05 00 fe 00 00 00 00 00 00 40 08     02:00:28.772  SET FEATURES [Enable APM]
  60 00 08 00 88 00 00 14 4f 4f 10 40 08     02:00:28.354  READ FPDMA QUEUED
  60 00 20 00 b8 00 00 00 00 00 08 40 08     02:00:28.354  READ FPDMA QUEUED
  60 00 68 00 80 00 02 23 71 c7 88 40 08     02:00:28.354  READ FPDMA QUEUED
  60 00 80 00 78 00 02 23 71 c7 00 40 08     02:00:28.354  READ FPDMA QUEUED

Error 24 [3] occurred at disk power-on lifetime: 5661 hours (235 days + 21 hours)
  When the command that caused the error occurred, the device was active or idle.

  After command completion occurred, registers were:
  ER -- ST COUNT  LBA_48  LH LM LL DV DC
  -- -- -- == -- == == == -- -- -- -- --
  04 -- 53 00 00 00 00 00 00 00 00 00 00  Error: ABRT

  Commands leading to the command that caused the error were:
  CR FEATR COUNT  LBA_48  LH LM LL DV DC  Powered_Up_Time  Command/Feature_Name
  -- == -- == -- == == == -- -- -- -- --  ---------------  --------------------
  ef 00 05 00 fe 00 00 00 00 00 00 40 08     00:30:12.320  SET FEATURES [Enable APM]
  60 00 08 00 20 00 00 14 4f 4f 10 40 08     00:30:11.252  READ FPDMA QUEUED
  60 00 20 00 18 00 00 00 00 00 08 40 08     00:30:11.251  READ FPDMA QUEUED
  60 00 68 00 10 00 02 23 71 c7 88 40 08     00:30:11.251  READ FPDMA QUEUED
  60 00 80 00 08 00 02 23 71 c7 00 40 08     00:30:11.251  READ FPDMA QUEUED

Error 23 [2] occurred at disk power-on lifetime: 5661 hours (235 days + 21 hours)
  When the command that caused the error occurred, the device was active or idle.

  After command completion occurred, registers were:
  ER -- ST COUNT  LBA_48  LH LM LL DV DC
  -- -- -- == -- == == == -- -- -- -- --
  04 -- 53 00 00 00 00 00 00 00 00 00 00  Error: ABRT

  Commands leading to the command that caused the error were:
  CR FEATR COUNT  LBA_48  LH LM LL DV DC  Powered_Up_Time  Command/Feature_Name
  -- == -- == -- == == == -- -- -- -- --  ---------------  --------------------
  ef 00 05 00 fe 00 00 00 00 00 00 40 08     00:27:17.796  SET FEATURES [Enable APM]
  60 00 08 00 98 00 00 14 4f 4f 10 40 08     00:27:17.399  READ FPDMA QUEUED
  60 00 20 00 e8 00 00 00 00 00 08 40 08     00:27:17.398  READ FPDMA QUEUED
  60 00 08 00 e0 00 00 00 00 00 00 40 08     00:27:17.397  READ FPDMA QUEUED
  60 00 68 00 88 00 02 23 71 c7 88 40 08     00:27:17.397  READ FPDMA QUEUED

SMART Extended Self-test Log Version: 1 (1 sectors)
Num  Test_Description    Status                  Remaining  LifeTime(hours)  LBA_of_first_error
# 1  Short offline       Completed without error       00%      5644         -
# 2  Short offline       Completed without error       00%      5635         -
# 3  Short offline       Completed without error       00%      5627         -
# 4  Short offline       Completed without error       00%      5621         -
# 5  Short offline       Completed without error       00%      5602         -
# 6  Short offline       Completed without error       00%      5588         -
# 7  Short offline       Completed without error       00%      5578         -
# 8  Short offline       Completed without error       00%      5568         -
# 9  Extended offline    Interrupted (host reset)      60%      5564         -
#10  Short offline       Completed without error       00%      5550         -
#11  Short offline       Completed without error       00%      5542         -
#12  Short offline       Completed without error       00%      5529         -
#13  Short offline       Completed without error       00%      5517         -
#14  Short offline       Completed without error       00%      5501         -
#15  Short offline       Completed without error       00%      5487         -
#16  Short offline       Completed without error       00%      5478         -
#17  Short offline       Completed without error       00%      5469         -
#18  Short offline       Completed without error       00%      5462         -
#19  Short offline       Completed without error       00%      5438         -

SMART Selective self-test log data structure revision number 1
 SPAN  MIN_LBA  MAX_LBA  CURRENT_TEST_STATUS
    1        0        0  Not_testing
    2        0        0  Not_testing
    3        0        0  Not_testing
    4        0        0  Not_testing
    5        0        0  Not_testing
Selective self-test flags (0x0):
  After scanning selected spans, do NOT read-scan remainder of disk.
If Selective self-test is pending on power-up, resume after 0 minute delay.

SCT Status Version:                  3
SCT Version (vendor specific):       256 (0x0100)
Device State:                        Active (0)
Current Temperature:                    35 Celsius
Power Cycle Min/Max Temperature:     27/36 Celsius
Lifetime    Min/Max Temperature:     18/42 Celsius
Specified Max Operating Temperature:    60 Celsius
Under/Over Temperature Limit Count:   0/0

SCT Temperature History Version:     2
Temperature Sampling Period:         1 minute
Temperature Logging Interval:        1 minute
Min/Max recommended Temperature:      0/60 Celsius
Min/Max Temperature Limit:           -40/70 Celsius
Temperature History Size (Index):    128 (41)

SCT Error Recovery Control command not supported

Device Statistics (GP Log 0x04)
Page  Offset Size        Value Flags Description
0x01  =====  =               =  ===  == General Statistics (rev 2) ==
0x01  0x008  4             507  ---  Lifetime Power-On Resets
0x01  0x018  6     31261112769  ---  Logical Sectors Written
0x01  0x020  6        72842091  ---  Number of Write Commands
0x01  0x028  6     36603710043  ---  Logical Sectors Read
0x01  0x030  6        93240271  ---  Number of Read Commands
0x01  0x038  6     20396010000  ---  Date and Time TimeStamp
0x03  =====  =               =  ===  == Rotating Media Statistics (rev 1) ==
0x03  0x008  4            5664  ---  Spindle Motor Power-on Hours
0x03  0x010  4            5664  ---  Head Flying Hours
0x03  0x018  4             864  ---  Head Load Events
0x03  0x020  4               0  ---  Number of Reallocated Logical Sectors
0x03  0x028  4           45200  ---  Read Recovery Attempts
0x03  0x030  4               0  ---  Number of Mechanical Start Failures
0x04  =====  =               =  ===  == General Errors Statistics (rev 1) ==
0x04  0x008  4               2  ---  Number of Reported Uncorrectable Errors
0x04  0x010  4               4  ---  Resets Between Cmd Acceptance and Completion
0x05  =====  =               =  ===  == Temperature Statistics (rev 1) ==
0x05  0x008  1              35  ---  Current Temperature
0x05  0x010  1              35  N--  Average Short Term Temperature
0x05  0x018  1              32  N--  Average Long Term Temperature
0x05  0x020  1              42  ---  Highest Temperature
0x05  0x028  1              18  ---  Lowest Temperature
0x05  0x030  1              40  N--  Highest Average Short Term Temperature
0x05  0x038  1              24  N--  Lowest Average Short Term Temperature
0x05  0x040  1              37  N--  Highest Average Long Term Temperature
0x05  0x048  1              25  N--  Lowest Average Long Term Temperature
0x05  0x050  4               0  ---  Time in Over-Temperature
0x05  0x058  1              60  ---  Specified Maximum Operating Temperature
0x05  0x060  4               0  ---  Time in Under-Temperature
0x05  0x068  1               0  ---  Specified Minimum Operating Temperature
0x06  =====  =               =  ===  == Transport Statistics (rev 1) ==
0x06  0x008  4              42  ---  Number of Hardware Resets
0x06  0x010  4            2944  ---  Number of ASR Events
0x06  0x018  4               2  ---  Number of Interface CRC Errors
                                |||_ C monitored condition met
                                ||__ D supports DSN
                                |___ N normalized value

Pending Defects log (GP Log 0x0c) not supported

SATA Phy Event Counters (GP Log 0x11)
ID      Size     Value  Description
0x0001  2            0  Command failed due to ICRC error
0x0002  2            0  R_ERR response for data FIS
0x0003  2            0  R_ERR response for device-to-host data FIS
0x0004  2            0  R_ERR response for host-to-device data FIS
0x0005  2            0  R_ERR response for non-data FIS
0x0006  2            0  R_ERR response for device-to-host non-data FIS
0x0007  2            0  R_ERR response for host-to-device non-data FIS
0x0008  2            0  Device-to-host non-data FIS retries
0x0009  2           42  Transition from drive PhyRdy to drive PhyNRdy
0x000a  2           37  Device-to-host register FISes sent due to a COMRESET
0x000b  2            0  CRC errors within host-to-device FIS
0x000d  2            0  Non-CRC errors within host-to-device FIS



