=== START OF INFORMATION SECTION ===
Model Family:     Western Digital Caviar Blue Serial ATA
Device Model:     WDC WD800AAJS-00PSA0
Serial Number:    --
LU WWN Device Id: 5 0014ee ...
Firmware Version: 05.06H05
User Capacity:    80 025 280 000 bytes [80,0 GB]
Sector Size:      512 bytes logical/physical
Device is:        In smartctl database [for details use: -P show]
ATA Version is:   ATA/ATAPI-7 (minor revision not indicated)
Local Time is:    Thu Jan 18 06:16:55 2018 EET
SMART support is: Available - device has SMART capability.
SMART support is: Enabled
AAM level is:     128 (quiet), recommended: 128
APM feature is:   Unavailable
Rd look-ahead is: Enabled
Write cache is:   Enabled
ATA Security is:  Disabled, frozen [SEC2]
Wt Cache Reorder: Enabled

=== START OF READ SMART DATA SECTION ===
SMART overall-health self-assessment test result: PASSED

General SMART Values:
Offline data collection status:  (0x82)	Offline data collection activity
					was completed without error.
					Auto Offline Data Collection: Enabled.
Self-test execution status:      (   0)	The previous self-test routine completed
					without error or no self-test has ever 
					been run.
Total time to complete Offline 
data collection: 		( 1860) seconds.
Offline data collection
capabilities: 			 (0x7b) SMART execute Offline immediate.
					Auto Offline data collection on/off support.
					Suspend Offline collection upon new
					command.
					Offline surface scan supported.
					Self-test supported.
					Conveyance Self-test supported.
					Selective Self-test supported.
SMART capabilities:            (0x0003)	Saves SMART data before entering
					power-saving mode.
					Supports SMART auto save timer.
Error logging capability:        (0x01)	Error logging supported.
					General Purpose Logging supported.
Short self-test routine 
recommended polling time: 	 (   2) minutes.
Extended self-test routine
recommended polling time: 	 (  28) minutes.
Conveyance self-test routine
recommended polling time: 	 (   6) minutes.
SCT capabilities: 	       (0x103f)	SCT Status supported.
					SCT Error Recovery Control supported.
					SCT Feature Control supported.
					SCT Data Table supported.

SMART Attributes Data Structure revision number: 16
Vendor Specific SMART Attributes with Thresholds:
ID# ATTRIBUTE_NAME          FLAGS    VALUE WORST THRESH FAIL RAW_VALUE
  1 Raw_Read_Error_Rate     POSR--   200   200   051    -    42200
  3 Spin_Up_Time            PO----   160   155   021    -    2966
  4 Start_Stop_Count        -O--CK   098   098   000    -    2967
  5 Reallocated_Sector_Ct   PO--CK   200   200   140    -    0
  7 Seek_Error_Rate         -OSR--   200   200   051    -    0
  9 Power_On_Hours          -O--CK   047   047   000    -    38939
 10 Spin_Retry_Count        -O--C-   100   100   051    -    0
 11 Calibration_Retry_Count -O--C-   100   100   051    -    0
 12 Power_Cycle_Count       -O--CK   098   098   000    -    2780
192 Power-Off_Retract_Count -O--CK   200   200   000    -    338
193 Load_Cycle_Count        -O--CK   200   200   000    -    2985
194 Temperature_Celsius     -O---K   112   086   000    -    31
196 Reallocated_Event_Count -O--CK   200   200   000    -    0
197 Current_Pending_Sector  -O--C-   200   200   000    -    0
198 Offline_Uncorrectable   ----C-   200   200   000    -    0
199 UDMA_CRC_Error_Count    -OSRCK   200   200   000    -    2
200 Multi_Zone_Error_Rate   ---R--   200   200   051    -    0
                            ||||||_ K auto-keep
                            |||||__ C event count
                            ||||___ R error rate
                            |||____ S speed/performance
                            ||_____ O updated online
                            |______ P prefailure warning

General Purpose Log Directory Version 1
SMART           Log Directory Version 1 [multi-sector log support]
Address    Access  R/W   Size  Description
0x00       GPL,SL  R/O      1  Log Directory
0x01           SL  R/O      1  Summary SMART error log
0x02           SL  R/O      5  Comprehensive SMART error log
0x03       GPL     R/O      6  Ext. Comprehensive SMART error log
0x06           SL  R/O      1  SMART self-test log
0x07       GPL     R/O      1  Extended self-test log
0x09           SL  R/W      1  Selective self-test log
0x10       GPL     R/O      1  SATA NCQ Queued Error log
0x11       GPL     R/O      1  SATA Phy Event Counters log
0x80-0x9f  GPL,SL  R/W     16  Host vendor specific log
0xa0-0xa7  GPL,SL  VS      16  Device vendor specific log
0xa8-0xb7  GPL,SL  VS       1  Device vendor specific log
0xc0       GPL,SL  VS       1  Device vendor specific log
0xe0       GPL,SL  R/W      1  SCT Command/Status
0xe1       GPL,SL  R/W      1  SCT Data Transfer

SMART Extended Comprehensive Error Log Version: 1 (6 sectors)
Device Error Count: 42129 (device log contains only the most recent 24 errors)
	CR     = Command Register
	FEATR  = Features Register
	COUNT  = Count (was: Sector Count) Register
	LBA_48 = Upper bytes of LBA High/Mid/Low Registers ]  ATA-8
	LH     = LBA High (was: Cylinder High) Register    ]   LBA
	LM     = LBA Mid (was: Cylinder Low) Register      ] Register
	LL     = LBA Low (was: Sector Number) Register     ]
	DV     = Device (was: Device/Head) Register
	DC     = Device Control Register
	ER     = Error register
	ST     = Status register
Powered_Up_Time is measured from power on, and printed as
DDd+hh:mm:SS.sss where DD=days, hh=hours, mm=minutes,
SS=sec, and sss=millisec. It "wraps" after 49.710 days.

Error 42129 [8] occurred at disk power-on lifetime: 0 hours (0 days + 0 hours)
  When the command that caused the error occurred, the device was in an unknown state.

  After command completion occurred, registers were:
  ER -- ST COUNT  LBA_48  LH LM LL DV DC
  -- -- -- == -- == == == -- -- -- -- --
  40 -- 00 01 08 00 51 00 00 40 01 00 00

  Commands leading to the command that caused the error were:
  CR FEATR COUNT  LBA_48  LH LM LL DV DC  Powered_Up_Time  Command/Feature_Name
  -- == -- == -- == == == -- -- -- -- --  ---------------  --------------------
  00 4e 25 44 90 00 00 00 00 00 00 00 00     00:00:00.000  NOP [Reserved subcommand] [OBS-ACS-2]
  00 08 00 00 b0 44 73 00 85 25 00 00 00     00:00:45.064  NOP [Abort queued commands]
  02 68 25 44 85 00 08 00 20 00 00 00 01     01:14:50.600  [RESERVED]
  00 20 00 00 9b 44 68 01 85 25 00 00 00     00:00:04.112  NOP [Abort queued commands]

Error 42128 [7] occurred at disk power-on lifetime: 0 hours (0 days + 0 hours)
  When the command that caused the error occurred, the device was in an unknown state.

  After command completion occurred, registers were:
  ER -- ST COUNT  LBA_48  LH LM LL DV DC
  -- -- -- == -- == == == -- -- -- -- --
  40 -- 00 01 08 00 51 00 00 40 01 00 00

  Commands leading to the command that caused the error were:
  CR FEATR COUNT  LBA_48  LH LM LL DV DC  Powered_Up_Time  Command/Feature_Name
  -- == -- == -- == == == -- -- -- -- --  ---------------  --------------------
  00 73 25 44 85 00 00 00 00 00 00 00 00     00:00:00.000  NOP [Reserved subcommand] [OBS-ACS-2]
  00 08 00 00 20 44 68 02 85 25 00 00 00     00:00:45.064  NOP [Abort queued commands]
  01 68 25 44 85 00 10 00 10 00 00 00 01     01:14:50.600  [RESERVED]
  00 08 00 00 a0 44 67 01 85 35 00 00 00     00:00:39.712  NOP [Abort queued commands]

Error 42127 [6] occurred at disk power-on lifetime: 0 hours (0 days + 0 hours)
  When the command that caused the error occurred, the device was in an unknown state.

  After command completion occurred, registers were:
  ER -- ST COUNT  LBA_48  LH LM LL DV DC
  -- -- -- == -- == == == -- -- -- -- --
  40 -- 00 01 08 00 51 00 00 40 01 00 00

  Commands leading to the command that caused the error were:
  CR FEATR COUNT  LBA_48  LH LM LL DV DC  Powered_Up_Time  Command/Feature_Name
  -- == -- == -- == == == -- -- -- -- --  ---------------  --------------------
  00 dd 25 44 7a 00 00 00 00 00 00 00 00     00:00:00.000  NOP [Reserved subcommand] [OBS-ACS-2]
  00 08 00 00 b0 44 03 00 70 25 00 00 00     00:00:45.064  NOP [Abort queued commands]
  01 fa 25 44 6f 00 10 00 f0 00 00 00 01     01:14:45.114  [RESERVED]
  00 08 00 00 48 44 fa 01 6f 35 00 00 00     00:00:39.425  NOP [Abort queued commands]

Error 42126 [5] occurred at disk power-on lifetime: 0 hours (0 days + 0 hours)
  When the command that caused the error occurred, the device was in an unknown state.

  After command completion occurred, registers were:
  ER -- ST COUNT  LBA_48  LH LM LL DV DC
  -- -- -- == -- == == == -- -- -- -- --
  40 -- 00 01 08 00 51 00 00 40 01 00 00

  Commands leading to the command that caused the error were:
  CR FEATR COUNT  LBA_48  LH LM LL DV DC  Powered_Up_Time  Command/Feature_Name
  -- == -- == -- == == == -- -- -- -- --  ---------------  --------------------
  00 03 25 44 70 00 00 00 00 00 00 00 00     00:00:00.000  NOP [Reserved subcommand] [OBS-ACS-2]
  00 10 00 00 f0 44 fa 01 6f 25 00 00 00     00:00:45.064  NOP [Abort queued commands]
  01 fa 35 44 6f 00 01 00 9a 00 00 00 01     01:14:45.114  [RESERVED]
  00 08 00 00 50 44 fa 01 6f 35 00 00 00     00:00:18.440  NOP [Abort queued commands]

Error 42125 [4] occurred at disk power-on lifetime: 0 hours (0 days + 0 hours)
  When the command that caused the error occurred, the device was in an unknown state.

  After command completion occurred, registers were:
  ER -- ST COUNT  LBA_48  LH LM LL DV DC
  -- -- -- == -- == == == -- -- -- -- --
  40 -- 00 01 08 00 51 00 00 40 01 00 00

  Commands leading to the command that caused the error were:
  CR FEATR COUNT  LBA_48  LH LM LL DV DC  Powered_Up_Time  Command/Feature_Name
  -- == -- == -- == == == -- -- -- -- --  ---------------  --------------------
  00 b6 25 44 63 00 00 00 00 00 00 00 00     00:00:00.000  NOP [Reserved subcommand] [OBS-ACS-2]
  00 08 00 00 b0 44 6f 00 59 25 00 00 00     00:00:45.064  NOP [Abort queued commands]
  00 c6 25 44 43 00 08 00 b0 00 00 00 00     01:14:36.571  NOP [Reserved subcommand] [OBS-ACS-2]
  00 08 00 00 40 44 c5 02 43 25 00 00 00     00:00:45.064  NOP [Abort queued commands]

Error 42124 [3] occurred at disk power-on lifetime: 0 hours (0 days + 0 hours)
  When the command that caused the error occurred, the device was in an unknown state.

  After command completion occurred, registers were:
  ER -- ST COUNT  LBA_48  LH LM LL DV DC
  -- -- -- == -- == == == -- -- -- -- --
  40 -- 00 01 08 00 51 00 00 40 01 00 00

  Commands leading to the command that caused the error were:
  CR FEATR COUNT  LBA_48  LH LM LL DV DC  Powered_Up_Time  Command/Feature_Name
  -- == -- == -- == == == -- -- -- -- --  ---------------  --------------------
  00 6f 25 44 59 00 00 00 00 00 00 00 00     00:00:00.000  NOP [Reserved subcommand] [OBS-ACS-2]
  00 08 00 00 b0 44 9b 00 4e 25 00 00 00     00:00:45.064  NOP [Abort queued commands]
  00 c5 25 44 43 00 08 00 b0 00 00 00 02     01:14:33.798  NOP [Reserved subcommand] [OBS-ACS-2]
  00 a0 00 00 98 44 c0 02 43 25 00 00 00     00:00:16.392  NOP [Abort queued commands]

Error 42123 [2] occurred at disk power-on lifetime: 0 hours (0 days + 0 hours)
  When the command that caused the error occurred, the device was in an unknown state.

  After command completion occurred, registers were:
  ER -- ST COUNT  LBA_48  LH LM LL DV DC
  -- -- -- == -- == == == -- -- -- -- --
  40 -- 00 01 08 00 51 00 00 40 01 00 00

  Commands leading to the command that caused the error were:
  CR FEATR COUNT  LBA_48  LH LM LL DV DC  Powered_Up_Time  Command/Feature_Name
  -- == -- == -- == == == -- -- -- -- --  ---------------  --------------------
  00 9b 25 44 4e 00 00 00 00 00 00 00 00     00:00:00.000  NOP [Reserved subcommand] [OBS-ACS-2]
  00 08 00 00 b0 44 c6 00 43 25 00 00 00     00:00:45.064  NOP [Abort queued commands]
  02 c0 25 44 43 00 08 00 40 00 00 00 02     01:14:33.797  [RESERVED]
  00 08 00 00 c0 44 b7 02 43 25 00 00 00     00:00:39.072  NOP [Abort queued commands]

Error 42122 [1] occurred at disk power-on lifetime: 0 hours (0 days + 0 hours)
  When the command that caused the error occurred, the device was in an unknown state.

  After command completion occurred, registers were:
  ER -- ST COUNT  LBA_48  LH LM LL DV DC
  -- -- -- == -- == == == -- -- -- -- --
  40 -- 00 01 08 00 51 00 00 40 01 00 00

  Commands leading to the command that caused the error were:
  CR FEATR COUNT  LBA_48  LH LM LL DV DC  Powered_Up_Time  Command/Feature_Name
  -- == -- == -- == == == -- -- -- -- --  ---------------  --------------------
  00 c6 25 44 43 00 00 00 00 00 00 00 00     00:00:00.000  NOP [Reserved subcommand] [OBS-ACS-2]
  00 08 00 00 40 44 c5 02 43 25 00 00 00     00:00:45.064  NOP [Abort queued commands]
  02 b7 25 44 43 00 a0 00 98 00 00 00 02     01:14:33.792  [RESERVED]
  00 3b 00 00 78 44 b0 01 43 25 00 00 00     00:00:49.160  NOP [Abort queued commands]

SMART Extended Self-test Log Version: 1 (1 sectors)
No self-tests have been logged.  [To run self-tests, use: smartctl -t]

SMART Selective self-test log data structure revision number 1
 SPAN  MIN_LBA  MAX_LBA  CURRENT_TEST_STATUS
    1        0        0  Not_testing
    2        0        0  Not_testing
    3        0        0  Not_testing
    4        0        0  Not_testing
    5        0        0  Not_testing
Selective self-test flags (0x0):
  After scanning selected spans, do NOT read-scan remainder of disk.
If Selective self-test is pending on power-up, resume after 0 minute delay.

SCT Status Version:                  2
SCT Version (vendor specific):       258 (0x0102)
SCT Support Level:                   1
Device State:                        Active (0)
Current Temperature:                 31 Celsius
Power Cycle Max Temperature:         31 Celsius
Lifetime    Max Temperature:         58 Celsius

SCT Temperature History Version:     2
Temperature Sampling Period:         1 minute
Temperature Logging Interval:        1 minute
Min/Max recommended Temperature:      0/60 Celsius
Min/Max Temperature Limit:            1/70 Celsius
Temperature History Size (Index):    128 (61)

SCT Error Recovery Control:
           Read: Disabled
          Write: Disabled

Device Statistics (GP/SMART Log 0x04) not supported

SATA Phy Event Counters (GP Log 0x11)
ID      Size     Value  Description
0x0001  2            0  Command failed due to ICRC error
0x0002  2            0  R_ERR response for data FIS
0x0003  2            0  R_ERR response for device-to-host data FIS
0x0004  2            0  R_ERR response for host-to-device data FIS
0x0005  2            0  R_ERR response for non-data FIS
0x0006  2            0  R_ERR response for device-to-host non-data FIS
0x0007  2            0  R_ERR response for host-to-device non-data FIS
0x000a  2            3  Device-to-host register FISes sent due to a COMRESET
0x8000  4          671  Vendor specific



