smartctl 7.4 2023-08-01 r5530 [x86_64-linux-6.16.12-1-liquorix-amd64] (local build)
Copyright (C) 2002-23, Bruce Allen, Christian Franke, www.smartmontools.org

=== START OF INFORMATION SECTION ===
Model Number:                       WD_BLACK SN770 1TB
Serial Number:                      --
Firmware Version:                   731030WD
PCI Vendor/Subsystem ID:            0x15b7
IEEE OUI Identifier:                0x001b44
Total NVM Capacity:                 1,000,204,886,016 [1.00 TB]
Unallocated NVM Capacity:           0
Controller ID:                      0
NVMe Version:                       1.4
Number of Namespaces:               1
Namespace 1 Size/Capacity:          1,000,204,886,016 [1.00 TB]
Namespace 1 Formatted LBA Size:     512
Namespace 1 IEEE EUI-64:            001b44 ...
Local Time is:                      Sat Nov 22 07:23:04 2025 EST
Firmware Updates (0x14):            2 Slots, no Reset required
Optional Admin Commands (0x0017):   Security Format Frmw_DL Self_Test
Optional NVM Commands (0x00df):     Comp Wr_Unc DS_Mngmt Wr_Zero Sav/Sel_Feat Timestmp Verify
Log Page Attributes (0x7e):         Cmd_Eff_Lg Ext_Get_Lg Telmtry_Lg Pers_Ev_Lg Log0_FISE_MI Telmtry_Ar_4
Maximum Data Transfer Size:         256 Pages
Warning  Comp. Temp. Threshold:     84 Celsius
Critical Comp. Temp. Threshold:     88 Celsius
Namespace 1 Features (0x02):        NA_Fields

Supported Power States
St Op     Max   Active     Idle   RL RT WL WT  Ent_Lat  Ex_Lat
 0 +     5.00W    5.00W       -    0  0  0  0        0       0

Supported LBA Sizes (NSID 0x1)
Id Fmt  Data  Metadt  Rel_Perf
 0 +     512       0         2
 1 -    4096       0         1

=== START OF SMART DATA SECTION ===
SMART overall-health self-assessment test result: PASSED

SMART/Health Information (NVMe Log 0x02)
Critical Warning:                   0x00
Temperature:                        36 Celsius
Available Spare:                    100%
Available Spare Threshold:          10%
Percentage Used:                    2%
Data Units Read:                    142,010,786 [72.7 TB]
Data Units Written:                 78,406,891 [40.1 TB]
Host Read Commands:                 986,006,931
Host Write Commands:                751,680,202
Controller Busy Time:               1,611
Power Cycles:                       5,303
Power On Hours:                     12,885
Unsafe Shutdowns:                   806
Media and Data Integrity Errors:    0
Error Information Log Entries:      0
Warning  Comp. Temperature Time:    0
Critical Comp. Temperature Time:    0
Temperature Sensor 1:               56 Celsius
Temperature Sensor 2:               34 Celsius

Error Information (NVMe Log 0x01, 16 of 256 entries)
No Errors Logged

Read Self-test Log failed: Invalid Field in Command (0x4002)



