smartctl 7.1 2019-12-30 r5022 [x86_64-linux-5.9.3-1-MANJARO] (local build)
Copyright (C) 2002-19, Bruce Allen, Christian Franke, www.smartmontools.org

=== START OF INFORMATION SECTION ===
Model Family:     Hitachi Deskstar 7K1000.C
Device Model:     HDS721010CLA332
Serial Number:    --
LU WWN Device Id: 5 000cca ...
Firmware Version: JP4OA3EA
User Capacity:    1,000,204,886,016 bytes [1.00 TB]
Sector Size:      512 bytes logical/physical
Rotation Rate:    7200 rpm
Form Factor:      3.5 inches
Device is:        In smartctl database [for details use: -P show]
ATA Version is:   ATA8-ACS T13/1699-D revision 4
SATA Version is:  SATA 2.6, 3.0 Gb/s
Local Time is:    Sat Nov  7 10:59:31 2020 EET
SMART support is: Available - device has SMART capability.
SMART support is: Enabled
AAM feature is:   Unavailable
APM feature is:   Disabled
Rd look-ahead is: Enabled
Write cache is:   Enabled
DSN feature is:   Unavailable
ATA Security is:  Disabled, NOT FROZEN [SEC1]
Wt Cache Reorder: Enabled

=== START OF READ SMART DATA SECTION ===
SMART overall-health self-assessment test result: PASSED

General SMART Values:
Offline data collection status:  (0x84)	Offline data collection activity
					was suspended by an interrupting command from host.
					Auto Offline Data Collection: Enabled.
Self-test execution status:      (   0)	The previous self-test routine completed
					without error or no self-test has ever 
					been run.
Total time to complete Offline 
data collection: 		(10223) seconds.
Offline data collection
capabilities: 			 (0x5b) SMART execute Offline immediate.
					Auto Offline data collection on/off support.
					Suspend Offline collection upon new
					command.
					Offline surface scan supported.
					Self-test supported.
					No Conveyance Self-test supported.
					Selective Self-test supported.
SMART capabilities:            (0x0003)	Saves SMART data before entering
					power-saving mode.
					Supports SMART auto save timer.
Error logging capability:        (0x01)	Error logging supported.
					General Purpose Logging supported.
Short self-test routine 
recommended polling time: 	 (   1) minutes.
Extended self-test routine
recommended polling time: 	 ( 170) minutes.
SCT capabilities: 	       (0x003d)	SCT Status supported.
					SCT Error Recovery Control supported.
					SCT Feature Control supported.
					SCT Data Table supported.

SMART Attributes Data Structure revision number: 16
Vendor Specific SMART Attributes with Thresholds:
ID# ATTRIBUTE_NAME          FLAGS    VALUE WORST THRESH FAIL RAW_VALUE
  1 Raw_Read_Error_Rate     PO-R--   100   100   016    -    0
  2 Throughput_Performance  P-S---   136   136   054    -    94
  3 Spin_Up_Time            POS---   116   116   024    -    328 (Average 326)
  4 Start_Stop_Count        -O--C-   099   099   000    -    5358
  5 Reallocated_Sector_Ct   PO--CK   100   100   005    -    10
  7 Seek_Error_Rate         PO-R--   100   100   067    -    0
  8 Seek_Time_Performance   P-S---   140   140   020    -    30
  9 Power_On_Hours          -O--C-   094   094   000    -    47228
 10 Spin_Retry_Count        PO--C-   100   100   060    -    0
 12 Power_Cycle_Count       -O--CK   099   099   000    -    5260
192 Power-Off_Retract_Count -O--CK   096   096   000    -    5421
193 Load_Cycle_Count        -O--C-   096   096   000    -    5421
194 Temperature_Celsius     -O----   176   176   000    -    34 (Min/Max 15/60)
196 Reallocated_Event_Count -O--CK   100   100   000    -    10
197 Current_Pending_Sector  -O---K   100   100   000    -    0
198 Offline_Uncorrectable   ---R--   100   100   000    -    0
199 UDMA_CRC_Error_Count    -O-R--   200   200   000    -    0
                            ||||||_ K auto-keep
                            |||||__ C event count
                            ||||___ R error rate
                            |||____ S speed/performance
                            ||_____ O updated online
                            |______ P prefailure warning

General Purpose Log Directory Version 1
SMART           Log Directory Version 1 [multi-sector log support]
Address    Access  R/W   Size  Description
0x00       GPL,SL  R/O      1  Log Directory
0x01           SL  R/O      1  Summary SMART error log
0x03       GPL     R/O      1  Ext. Comprehensive SMART error log
0x04       GPL     R/O      7  Device Statistics log
0x06           SL  R/O      1  SMART self-test log
0x07       GPL     R/O      1  Extended self-test log
0x09           SL  R/W      1  Selective self-test log
0x10       GPL     R/O      1  NCQ Command Error log
0x11       GPL     R/O      1  SATA Phy Event Counters log
0x20       GPL     R/O      1  Streaming performance log [OBS-8]
0x21       GPL     R/O      1  Write stream error log
0x22       GPL     R/O      1  Read stream error log
0x80-0x9f  GPL,SL  R/W     16  Host vendor specific log
0xe0       GPL,SL  R/W      1  SCT Command/Status
0xe1       GPL,SL  R/W      1  SCT Data Transfer

SMART Extended Comprehensive Error Log Version: 1 (1 sectors)
Device Error Count: 44 (device log contains only the most recent 4 errors)
	CR     = Command Register
	FEATR  = Features Register
	COUNT  = Count (was: Sector Count) Register
	LBA_48 = Upper bytes of LBA High/Mid/Low Registers ]  ATA-8
	LH     = LBA High (was: Cylinder High) Register    ]   LBA
	LM     = LBA Mid (was: Cylinder Low) Register      ] Register
	LL     = LBA Low (was: Sector Number) Register     ]
	DV     = Device (was: Device/Head) Register
	DC     = Device Control Register
	ER     = Error register
	ST     = Status register
Powered_Up_Time is measured from power on, and printed as
DDd+hh:mm:SS.sss where DD=days, hh=hours, mm=minutes,
SS=sec, and sss=millisec. It "wraps" after 49.710 days.

Error 44 [3] occurred at disk power-on lifetime: 39490 hours (1645 days + 10 hours)
  When the command that caused the error occurred, the device was active or idle.

  After command completion occurred, registers were:
  ER -- ST COUNT  LBA_48  LH LM LL DV DC
  -- -- -- == -- == == == -- -- -- -- --
  40 -- 51 00 06 00 00 71 44 13 32 01 00  Error: UNC 6 sectors at LBA = 0x71441332 = 1900286770

  Commands leading to the command that caused the error were:
  CR FEATR COUNT  LBA_48  LH LM LL DV DC  Powered_Up_Time  Command/Feature_Name
  -- == -- == -- == == == -- -- -- -- --  ---------------  --------------------
  25 00 00 00 08 00 00 71 44 13 30 e0 00  1d+08:45:11.909  READ DMA EXT
  35 00 00 01 00 00 00 62 43 99 38 e2 00  1d+08:45:11.904  WRITE DMA EXT
  35 00 00 01 00 00 00 62 43 98 38 e2 00  1d+08:45:11.900  WRITE DMA EXT
  35 00 00 01 00 00 00 62 43 97 38 e2 00  1d+08:45:11.895  WRITE DMA EXT
  35 00 00 01 00 00 00 62 43 96 38 e2 00  1d+08:45:11.890  WRITE DMA EXT

Error 43 [2] occurred at disk power-on lifetime: 39490 hours (1645 days + 10 hours)
  When the command that caused the error occurred, the device was active or idle.

  After command completion occurred, registers were:
  ER -- ST COUNT  LBA_48  LH LM LL DV DC
  -- -- -- == -- == == == -- -- -- -- --
  40 -- 51 00 06 00 00 71 44 13 32 01 00  Error: UNC 6 sectors at LBA = 0x71441332 = 1900286770

  Commands leading to the command that caused the error were:
  CR FEATR COUNT  LBA_48  LH LM LL DV DC  Powered_Up_Time  Command/Feature_Name
  -- == -- == -- == == == -- -- -- -- --  ---------------  --------------------
  25 00 00 00 08 00 00 71 44 13 30 e0 00  1d+08:44:53.413  READ DMA EXT
  35 00 00 01 00 00 00 62 43 91 38 e2 00  1d+08:44:53.408  WRITE DMA EXT
  35 00 00 01 00 00 00 62 43 90 38 e2 00  1d+08:44:53.404  WRITE DMA EXT
  35 00 00 01 00 00 00 62 43 8f 38 e2 00  1d+08:44:53.400  WRITE DMA EXT
  35 00 00 01 00 00 00 62 43 8e 38 e2 00  1d+08:44:53.396  WRITE DMA EXT

Error 42 [1] occurred at disk power-on lifetime: 39490 hours (1645 days + 10 hours)
  When the command that caused the error occurred, the device was active or idle.

  After command completion occurred, registers were:
  ER -- ST COUNT  LBA_48  LH LM LL DV DC
  -- -- -- == -- == == == -- -- -- -- --
  40 -- 51 00 06 00 00 71 44 13 32 01 00  Error: UNC 6 sectors at LBA = 0x71441332 = 1900286770

  Commands leading to the command that caused the error were:
  CR FEATR COUNT  LBA_48  LH LM LL DV DC  Powered_Up_Time  Command/Feature_Name
  -- == -- == -- == == == -- -- -- -- --  ---------------  --------------------
  25 00 00 00 08 00 00 71 44 13 30 e0 00  1d+08:44:34.095  READ DMA EXT
  35 00 00 01 00 00 00 62 43 89 38 e2 00  1d+08:44:34.092  WRITE DMA EXT
  35 00 00 01 00 00 00 62 43 88 38 e2 00  1d+08:44:34.088  WRITE DMA EXT
  35 00 00 01 00 00 00 62 43 87 38 e2 00  1d+08:44:34.084  WRITE DMA EXT
  35 00 00 01 00 00 00 62 43 86 38 e2 00  1d+08:44:34.081  WRITE DMA EXT

Error 41 [0] occurred at disk power-on lifetime: 39490 hours (1645 days + 10 hours)
  When the command that caused the error occurred, the device was active or idle.

  After command completion occurred, registers were:
  ER -- ST COUNT  LBA_48  LH LM LL DV DC
  -- -- -- == -- == == == -- -- -- -- --
  40 -- 51 00 3e 00 00 71 44 13 32 01 00  Error: UNC 62 sectors at LBA = 0x71441332 = 1900286770

  Commands leading to the command that caused the error were:
  CR FEATR COUNT  LBA_48  LH LM LL DV DC  Powered_Up_Time  Command/Feature_Name
  -- == -- == -- == == == -- -- -- -- --  ---------------  --------------------
  25 00 00 00 40 00 00 71 44 13 30 e0 00  1d+08:44:15.194  READ DMA EXT
  35 00 00 01 00 00 00 62 43 81 38 e2 00  1d+08:44:15.189  WRITE DMA EXT
  35 00 00 01 00 00 00 62 43 80 38 e2 00  1d+08:44:15.184  WRITE DMA EXT
  35 00 00 01 00 00 00 62 43 7f 38 e2 00  1d+08:44:15.180  WRITE DMA EXT
  35 00 00 01 00 00 00 62 43 7e 38 e2 00  1d+08:44:15.176  WRITE DMA EXT

SMART Extended Self-test Log Version: 1 (1 sectors)
Num  Test_Description    Status                  Remaining  LifeTime(hours)  LBA_of_first_error
# 1  Short offline       Completed without error       00%     38182         -
# 2  Short offline       Completed without error       00%     38177         -
# 3  Short offline       Completed without error       00%     38167         -
# 4  Short offline       Completed without error       00%     38152         -
# 5  Short offline       Completed without error       00%     38136         -
# 6  Short offline       Completed without error       00%     38124         -
# 7  Short offline       Completed without error       00%     38110         -
# 8  Short offline       Completed without error       00%     38097         -
# 9  Short offline       Completed without error       00%     38085         -
#10  Short offline       Completed without error       00%     38079         -
#11  Short offline       Completed without error       00%     38074         -
#12  Short offline       Completed without error       00%     38061         -

SMART Selective self-test log data structure revision number 1
 SPAN  MIN_LBA  MAX_LBA  CURRENT_TEST_STATUS
    1        0        0  Not_testing
    2        0        0  Not_testing
    3        0        0  Not_testing
    4        0        0  Not_testing
    5        0        0  Not_testing
Selective self-test flags (0x0):
  After scanning selected spans, do NOT read-scan remainder of disk.
If Selective self-test is pending on power-up, resume after 0 minute delay.

SCT Status Version:                  3
SCT Version (vendor specific):       256 (0x0100)
Device State:                        SMART Off-line Data Collection executing in background (4)
Current Temperature:                    34 Celsius
Power Cycle Min/Max Temperature:     25/40 Celsius
Lifetime    Min/Max Temperature:     15/60 Celsius
Under/Over Temperature Limit Count:   0/0

SCT Temperature History Version:     2
Temperature Sampling Period:         1 minute
Temperature Logging Interval:        1 minute
Min/Max recommended Temperature:      0/60 Celsius
Min/Max Temperature Limit:           -40/70 Celsius
Temperature History Size (Index):    128 (72)

SCT Error Recovery Control:
           Read: Disabled
          Write: Disabled

Device Statistics (GP Log 0x04)
Page  Offset Size        Value Flags Description
0x01  =====  =               =  ===  == General Statistics (rev 1) ==
0x01  0x008  4            5260  ---  Lifetime Power-On Resets
0x01  0x010  4           47228  ---  Power-on Hours
0x01  0x018  6    157637666752  ---  Logical Sectors Written
0x01  0x020  6      1676220380  ---  Number of Write Commands
0x01  0x028  6    693644579459  ---  Logical Sectors Read
0x01  0x030  6      1831736311  ---  Number of Read Commands
0x03  =====  =               =  ===  == Rotating Media Statistics (rev 1) ==
0x03  0x008  4           47127  ---  Spindle Motor Power-on Hours
0x03  0x010  4           47127  ---  Head Flying Hours
0x03  0x018  4            5421  ---  Head Load Events
0x03  0x020  4              10  ---  Number of Reallocated Logical Sectors
0x03  0x028  4            3899  ---  Read Recovery Attempts
0x03  0x030  4               2  ---  Number of Mechanical Start Failures
0x04  =====  =               =  ===  == General Errors Statistics (rev 1) ==
0x04  0x008  4              44  ---  Number of Reported Uncorrectable Errors
0x04  0x010  4           10390  ---  Resets Between Cmd Acceptance and Completion
0x05  =====  =               =  ===  == Temperature Statistics (rev 1) ==
0x05  0x008  1              34  ---  Current Temperature
0x05  0x010  1              35  N--  Average Short Term Temperature
0x05  0x018  1              36  N--  Average Long Term Temperature
0x05  0x020  1              60  ---  Highest Temperature
0x05  0x028  1              15  ---  Lowest Temperature
0x05  0x030  1              51  N--  Highest Average Short Term Temperature
0x05  0x038  1               0  N--  Lowest Average Short Term Temperature
0x05  0x040  1              46  N--  Highest Average Long Term Temperature
0x05  0x048  1               0  N--  Lowest Average Long Term Temperature
0x05  0x050  4               0  ---  Time in Over-Temperature
0x05  0x058  1              60  ---  Specified Maximum Operating Temperature
0x05  0x060  4               0  ---  Time in Under-Temperature
0x05  0x068  1               0  ---  Specified Minimum Operating Temperature
0x06  =====  =               =  ===  == Transport Statistics (rev 1) ==
0x06  0x008  4           60297  ---  Number of Hardware Resets
0x06  0x010  4           29752  ---  Number of ASR Events
0x06  0x018  4               0  ---  Number of Interface CRC Errors
                                |||_ C monitored condition met
                                ||__ D supports DSN
                                |___ N normalized value

Pending Defects log (GP Log 0x0c) not supported

SATA Phy Event Counters (GP Log 0x11)
ID      Size     Value  Description
0x0001  2            0  Command failed due to ICRC error
0x0002  2            0  R_ERR response for data FIS
0x0005  2            0  R_ERR response for non-data FIS
0x0009  2            4  Transition from drive PhyRdy to drive PhyNRdy
0x000a  2            3  Device-to-host register FISes sent due to a COMRESET
0x000b  2            0  CRC errors within host-to-device FIS
0x000d  2            0  Non-CRC errors within host-to-device FIS

