smartctl 7.4 2023-08-01 r5530 [x86_64-linux-6.5.8-arch1-1] (local build)
Copyright (C) 2002-23, Bruce Allen, Christian Franke, www.smartmontools.org

=== START OF INFORMATION SECTION ===
Model Number:                       Samsung SSD 970 EVO Plus 2TB
Serial Number:                      --
Firmware Version:                   2B2QEXM7
PCI Vendor/Subsystem ID:            0x144d
IEEE OUI Identifier:                0x002538
Total NVM Capacity:                 2,000,398,934,016 [2.00 TB]
Unallocated NVM Capacity:           0
Controller ID:                      4
NVMe Version:                       1.3
Number of Namespaces:               1
Namespace 1 Size/Capacity:          2,000,398,934,016 [2.00 TB]
Namespace 1 Utilization:            672,350,085,120 [672 GB]
Namespace 1 Formatted LBA Size:     512
Namespace 1 IEEE EUI-64:            002538 ...
Local Time is:                      Wed Oct 25 13:51:42 2023 KST
Firmware Updates (0x16):            3 Slots, no Reset required
Optional Admin Commands (0x0017):   Security Format Frmw_DL Self_Test
Optional NVM Commands (0x005f):     Comp Wr_Unc DS_Mngmt Wr_Zero Sav/Sel_Feat Timestmp
Log Page Attributes (0x03):         S/H_per_NS Cmd_Eff_Lg
Maximum Data Transfer Size:         512 Pages
Warning  Comp. Temp. Threshold:     85 Celsius
Critical Comp. Temp. Threshold:     85 Celsius

Supported Power States
St Op     Max   Active     Idle   RL RT WL WT  Ent_Lat  Ex_Lat
 0 +     7.50W       -        -    0  0  0  0        0       0
 1 +     5.90W       -        -    1  1  1  1        0       0
 2 +     3.60W       -        -    2  2  2  2        0       0
 3 -   0.0700W       -        -    3  3  3  3      210    1200
 4 -   0.0050W       -        -    4  4  4  4     2000    8000

Supported LBA Sizes (NSID 0x1)
Id Fmt  Data  Metadt  Rel_Perf
 0 +     512       0         0

=== START OF SMART DATA SECTION ===
SMART overall-health self-assessment test result: PASSED

SMART/Health Information (NVMe Log 0x02)
Critical Warning:                   0x00
Temperature:                        37 Celsius
Available Spare:                    100%
Available Spare Threshold:          10%
Percentage Used:                    0%
Data Units Read:                    5,254,582 [2.69 TB]
Data Units Written:                 5,316,962 [2.72 TB]
Host Read Commands:                 50,021,482
Host Write Commands:                40,373,781
Controller Busy Time:               113
Power Cycles:                       122
Power On Hours:                     223
Unsafe Shutdowns:                   23
Media and Data Integrity Errors:    0
Error Information Log Entries:      674
Warning  Comp. Temperature Time:    0
Critical Comp. Temperature Time:    0
Temperature Sensor 1:               37 Celsius
Temperature Sensor 2:               37 Celsius

Error Information (NVMe Log 0x01, 16 of 64 entries)
Num   ErrCount  SQId   CmdId  Status  PELoc          LBA  NSID    VS  Message
  0        674     0  0x001c  0x4004      -            0     0     -  Invalid Field in Command

Self-test Log (NVMe Log 0x06)
Self-test status: No self-test in progress
No Self-tests Logged

