smartctl 7.4 2023-08-01 r5530 [x86_64-linux-6.6.2-desktop-1omv2390] (OpenMandriva Lx 7.4-1)
Copyright (C) 2002-23, Bruce Allen, Christian Franke, www.smartmontools.org

=== START OF INFORMATION SECTION ===
Model Number:                       APPLE SSD AP0256N
Serial Number:                      --
Firmware Version:                   1306
PCI Vendor/Subsystem ID:            0x106b
IEEE OUI Identifier:                0x000000
Controller ID:                      0
NVMe Version:                       <1.2
Number of Namespaces:               1
Namespace 1 Size/Capacity:          251,000,193,024 [251 GB]
Namespace 1 Formatted LBA Size:     4096
Local Time is:                      Tue Dec 26 19:42:50 2023 PST
Firmware Updates (0x02):            1 Slot
Optional Admin Commands (0x0004):   Frmw_DL
Optional NVM Commands (0x0004):     DS_Mngmt
Maximum Data Transfer Size:         256 Pages

Supported Power States
St Op     Max   Active     Idle   RL RT WL WT  Ent_Lat  Ex_Lat
 0 +     0.00W       -        -    0  0  0  0        0       0

Supported LBA Sizes (NSID 0x1)
Id Fmt  Data  Metadt  Rel_Perf
 0 +    4096       0         0

=== START OF SMART DATA SECTION ===
SMART overall-health self-assessment test result: PASSED

SMART/Health Information (NVMe Log 0x02)
Critical Warning:                   0x00
Temperature:                        49 Celsius
Available Spare:                    100%
Available Spare Threshold:          99%
Percentage Used:                    1%
Data Units Read:                    58,799,660 [30.1 TB]
Data Units Written:                 18,722,687 [9.58 TB]
Host Read Commands:                 672,592,983
Host Write Commands:                308,814,686
Controller Busy Time:               0
Power Cycles:                       343
Power On Hours:                     584
Unsafe Shutdowns:                   127
Media and Data Integrity Errors:    0
Error Information Log Entries:      0

Read 1 entries from Error Information Log failed: Invalid Log Page (0x109)

