smartctl 7.2 2020-12-30 r5155 [x86_64-linux-5.15.0-72-generic] (local build)
Copyright (C) 2002-20, Bruce Allen, Christian Franke, www.smartmontools.org

=== START OF INFORMATION SECTION ===
Model Number:                       KINGSTON OM8SEP4512N-A0
Serial Number:                      --
Firmware Version:                   SBM01100
PCI Vendor/Subsystem ID:            0x2646
IEEE OUI Identifier:                0x0026b7
Controller ID:                      1
NVMe Version:                       1.4
Number of Namespaces:               1
Namespace 1 Size/Capacity:          512,110,190,592 [512 GB]
Namespace 1 Formatted LBA Size:     512
Namespace 1 IEEE EUI-64:            0026b7 ...
Local Time is:                      Sun May 28 08:20:44 2023 CEST
Firmware Updates (0x12):            1 Slot, no Reset required
Optional Admin Commands (0x0017):   Security Format Frmw_DL Self_Test
Optional NVM Commands (0x001f):     Comp Wr_Unc DS_Mngmt Wr_Zero Sav/Sel_Feat
Log Page Attributes (0x02):         Cmd_Eff_Lg
Maximum Data Transfer Size:         64 Pages
Warning  Comp. Temp. Threshold:     83 Celsius
Critical Comp. Temp. Threshold:     90 Celsius

Supported Power States
St Op     Max   Active     Idle   RL RT WL WT  Ent_Lat  Ex_Lat
 0 +     9.00W       -        -    0  0  0  0        0       0
 1 +     4.60W       -        -    1  1  1  1        0     200
 2 +     3.80W       -        -    2  2  2  2        0    1000
 3 -   0.0250W       -        -    3  3  3  3     5000    5000
 4 -   0.0050W       -        -    4  4  4  4    20000   40000

Supported LBA Sizes (NSID 0x1)
Id Fmt  Data  Metadt  Rel_Perf
 0 +     512       0         0

=== START OF SMART DATA SECTION ===
SMART overall-health self-assessment test result: PASSED

SMART/Health Information (NVMe Log 0x02)
Critical Warning:                   0x00
Temperature:                        34 Celsius
Available Spare:                    100%
Available Spare Threshold:          10%
Percentage Used:                    1%
Data Units Read:                    17,261,531 [8.83 TB]
Data Units Written:                 11,842,551 [6.06 TB]
Host Read Commands:                 130,937,906
Host Write Commands:                123,338,624
Controller Busy Time:               7,307
Power Cycles:                       318
Power On Hours:                     1,006
Unsafe Shutdowns:                   33
Media and Data Integrity Errors:    0
Error Information Log Entries:      1
Warning  Comp. Temperature Time:    20
Critical Comp. Temperature Time:    41

Error Information (NVMe Log 0x01, 16 of 64 entries)
No Errors Logged



