smartctl 7.2 2021-09-14 r5237 [x86_64-linux-5.14.21-150500.55.44-default] (SUSE RPM)
Copyright (C) 2002-20, Bruce Allen, Christian Franke, www.smartmontools.org

=== START OF INFORMATION SECTION ===
Model Number:                       ZTC-PCIEG3-128G
Serial Number:                      --
Firmware Version:                   R0629A0
PCI Vendor/Subsystem ID:            0x126f
IEEE OUI Identifier:                0x000000
Controller ID:                      1
NVMe Version:                       1.3
Number of Namespaces:               1
Namespace 1 Size/Capacity:          128,035,676,160 [128 GB]
Namespace 1 Formatted LBA Size:     512
Namespace 1 IEEE EUI-64:            010000 ...
Local Time is:                      Mon Mar  4 02:37:25 2024 EST
Firmware Updates (0x06):            3 Slots
Optional Admin Commands (0x0006):   Format Frmw_DL
Optional NVM Commands (0x005f):     Comp Wr_Unc DS_Mngmt Wr_Zero Sav/Sel_Feat Timestmp
Log Page Attributes (0x0f):         S/H_per_NS Cmd_Eff_Lg Ext_Get_Lg Telmtry_Lg
Maximum Data Transfer Size:         64 Pages
Warning  Comp. Temp. Threshold:     70 Celsius
Critical Comp. Temp. Threshold:     80 Celsius

Supported Power States
St Op     Max   Active     Idle   RL RT WL WT  Ent_Lat  Ex_Lat
 0 +     9.00W       -        -    0  0  0  0        0       0

Supported LBA Sizes (NSID 0x1)
Id Fmt  Data  Metadt  Rel_Perf
 0 +     512       0         0

=== START OF SMART DATA SECTION ===
SMART overall-health self-assessment test result: PASSED

SMART/Health Information (NVMe Log 0x02)
Critical Warning:                   0x00
Temperature:                        53 Celsius
Available Spare:                    100%
Available Spare Threshold:          10%
Percentage Used:                    0%
Data Units Read:                    2,438,073 [1.24 TB]
Data Units Written:                 1,626,792 [832 GB]
Host Read Commands:                 27,806,723
Host Write Commands:                28,281,741
Controller Busy Time:               5,442,818
Power Cycles:                       525
Power On Hours:                     4
Unsafe Shutdowns:                   166
Media and Data Integrity Errors:    0
Error Information Log Entries:      0
Warning  Comp. Temperature Time:    0
Critical Comp. Temperature Time:    0

Error Information (NVMe Log 0x01, 16 of 256 entries)
Num   ErrCount  SQId   CmdId  Status  PELoc          LBA  NSID    VS
  0 281595360786445   672  0x0468  0x0009  0x000  34359738368  9592  0xaf
  1 406235186724872 11823  0x058c  0x0017  0x000 107451842920     0     -
  2          9     0  0x0000  0x1b08  0x000 281479365002081 68813032  0x15
  3 299490199854120988     0  0x0000  0x0000  0x000 41266045779968 93258929  0x02
  4 394405622726110872    26  0x0000  0x0098  0x48e     16777223     8  0xa0
  5 34359738368 48992  0x0001  0x37ef  0x5de 358881660458237979    15     -
  6 38728958664     0  0x0000  0x0000  0x000 392945630198116288 4292804610  0x10
  7 1125904286614048   752  0x04ee  0x000b  0x000  34359738368 106000  0xc5
  8 383454680186880 11160  0x056d  0x0015 0xfff5 72057692889285080     0     -
  9         21     0  0x0000  0xe9f0  0x001 128934493502 75563672  0x09
 10 329890287612657691    15  0x0100  0x0000  0x000 474885943984136 84751869  0x1a
 11 394402654903703784    25  0x0004  0x02e0  0x4e2            5     8  0xe0
  - [1 unused entry]
 13 38728696488     0  0x0000  0x0000  0x000 392114030040354064     8  0x28
 14 281591032657520   488  0x040b  0x0006  0x100  34359738368 34848  0x07
 15 40235253628936  1171  0x058f  0x0002  0x000  94556455096     0  0x08
... (240 entries not read)



