smartctl 6.6 2016-05-31 r4324 [x86_64-linux-4.15.0-122-generic] (local build)
Copyright (C) 2002-16, Bruce Allen, Christian Franke, www.smartmontools.org

=== START OF INFORMATION SECTION ===
Model Family:     Western Digital Elements / My Passport (USB, AF)
Device Model:     WDC WD10JMVW-11AJGS2
Serial Number:    --
LU WWN Device Id: 5 0014ee ...
Firmware Version: 01.01A01
User Capacity:    1,000,204,886,016 bytes [1.00 TB]
Sector Sizes:     512 bytes logical, 4096 bytes physical
Rotation Rate:    5400 rpm
Device is:        In smartctl database [for details use: -P show]
ATA Version is:   ACS-2 (minor revision not indicated)
SATA Version is:  SATA 3.0, 3.0 Gb/s (current: 3.0 Gb/s)
Local Time is:    Tue Nov 10 12:57:48 2020 +08
SMART support is: Available - device has SMART capability.
SMART support is: Enabled
AAM feature is:   Unavailable
APM level is:     128 (minimum power consumption without standby)
Rd look-ahead is: Enabled
Write cache is:   Enabled
ATA Security is:  Disabled, NOT FROZEN [SEC1]
Wt Cache Reorder: Unknown

=== START OF READ SMART DATA SECTION ===
SMART Status not supported: Incomplete response, ATA output registers missing
SMART overall-health self-assessment test result: PASSED
Warning: This result is based on an Attribute check.

General SMART Values:
Offline data collection status:  (0x00)	Offline data collection activity
					was never started.
					Auto Offline Data Collection: Disabled.
Self-test execution status:      (   0)	The previous self-test routine completed
					without error or no self-test has ever 
					been run.
Total time to complete Offline 
data collection: 		(18300) seconds.
Offline data collection
capabilities: 			 (0x7b) SMART execute Offline immediate.
					Auto Offline data collection on/off support.
					Suspend Offline collection upon new
					command.
					Offline surface scan supported.
					Self-test supported.
					Conveyance Self-test supported.
					Selective Self-test supported.
SMART capabilities:            (0x0003)	Saves SMART data before entering
					power-saving mode.
					Supports SMART auto save timer.
Error logging capability:        (0x01)	Error logging supported.
					General Purpose Logging supported.
Short self-test routine 
recommended polling time: 	 (   2) minutes.
Extended self-test routine
recommended polling time: 	 ( 205) minutes.
Conveyance self-test routine
recommended polling time: 	 (   5) minutes.
SCT capabilities: 	       (0x7035)	SCT Status supported.
					SCT Feature Control supported.
					SCT Data Table supported.

SMART Attributes Data Structure revision number: 16
Vendor Specific SMART Attributes with Thresholds:
ID# ATTRIBUTE_NAME          FLAGS    VALUE WORST THRESH FAIL RAW_VALUE
  1 Raw_Read_Error_Rate     POSR-K   200   200   051    -    9
  3 Spin_Up_Time            POS--K   126   124   021    -    4700
  4 Start_Stop_Count        -O--CK   096   096   000    -    4337
  5 Reallocated_Sector_Ct   PO--CK   200   200   140    -    0
  7 Seek_Error_Rate         -OSR-K   200   200   000    -    0
  9 Power_On_Hours          -O--CK   090   090   000    -    7353
 10 Spin_Retry_Count        -O--CK   100   100   000    -    0
 11 Calibration_Retry_Count -O--CK   100   100   000    -    0
 12 Power_Cycle_Count       -O--CK   099   099   000    -    1416
192 Power-Off_Retract_Count -O--CK   200   200   000    -    411
193 Load_Cycle_Count        -O--CK   188   188   000    -    36184
194 Temperature_Celsius     -O---K   112   086   000    -    35
196 Reallocated_Event_Count -O--CK   200   200   000    -    0
197 Current_Pending_Sector  -O--CK   200   200   000    -    5
198 Offline_Uncorrectable   ----CK   100   253   000    -    0
199 UDMA_CRC_Error_Count    -O--CK   200   200   000    -    0
200 Multi_Zone_Error_Rate   ---R--   100   253   000    -    0
                            ||||||_ K auto-keep
                            |||||__ C event count
                            ||||___ R error rate
                            |||____ S speed/performance
                            ||_____ O updated online
                            |______ P prefailure warning

General Purpose Log Directory Version 1
SMART           Log Directory Version 1 [multi-sector log support]
Address    Access  R/W   Size  Description
0x00       GPL,SL  R/O      1  Log Directory
0x01           SL  R/O      1  Summary SMART error log
0x02           SL  R/O      5  Comprehensive SMART error log
0x03       GPL     R/O      6  Ext. Comprehensive SMART error log
0x06           SL  R/O      1  SMART self-test log
0x07       GPL     R/O      1  Extended self-test log
0x09           SL  R/W      1  Selective self-test log
0x10       GPL     R/O      1  SATA NCQ Queued Error log
0x11       GPL     R/O      1  SATA Phy Event Counters log
0x80-0x9f  GPL,SL  R/W     16  Host vendor specific log
0xa0-0xa7  GPL,SL  VS      16  Device vendor specific log
0xa8-0xb6  GPL,SL  VS       1  Device vendor specific log
0xb7       GPL,SL  VS      38  Device vendor specific log
0xbd       GPL,SL  VS       1  Device vendor specific log
0xc0       GPL,SL  VS       1  Device vendor specific log
0xc1       GPL     VS      93  Device vendor specific log
0xe0       GPL,SL  R/W      1  SCT Command/Status
0xe1       GPL,SL  R/W      1  SCT Data Transfer

SMART Extended Comprehensive Error Log Version: 1 (6 sectors)
Device Error Count: 13
	CR     = Command Register
	FEATR  = Features Register
	COUNT  = Count (was: Sector Count) Register
	LBA_48 = Upper bytes of LBA High/Mid/Low Registers ]  ATA-8
	LH     = LBA High (was: Cylinder High) Register    ]   LBA
	LM     = LBA Mid (was: Cylinder Low) Register      ] Register
	LL     = LBA Low (was: Sector Number) Register     ]
	DV     = Device (was: Device/Head) Register
	DC     = Device Control Register
	ER     = Error register
	ST     = Status register
Powered_Up_Time is measured from power on, and printed as
DDd+hh:mm:SS.sss where DD=days, hh=hours, mm=minutes,
SS=sec, and sss=millisec. It "wraps" after 49.710 days.

Error 13 [12] occurred at disk power-on lifetime: 7352 hours (306 days + 8 hours)
  When the command that caused the error occurred, the device was active or idle.

  After command completion occurred, registers were:
  ER -- ST COUNT  LBA_48  LH LM LL DV DC
  -- -- -- == -- == == == -- -- -- -- --
  40 -- 51 00 10 00 00 3a 38 8f d0 40 00  Error: UNC 16 sectors at LBA = 0x3a388fd0 = 976785360

  Commands leading to the command that caused the error were:
  CR FEATR COUNT  LBA_48  LH LM LL DV DC  Powered_Up_Time  Command/Feature_Name
  -- == -- == -- == == == -- -- -- -- --  ---------------  --------------------
  25 00 00 00 10 00 00 3a 38 8f d0 40 00     00:00:06.761  READ DMA EXT
  25 00 00 00 f0 00 00 3a 38 8e e0 40 00     00:00:03.390  READ DMA EXT
  25 00 00 00 10 00 00 3a 38 8e d0 40 00     00:00:03.389  READ DMA EXT
  25 00 00 00 f0 00 00 3a 38 8d e0 40 00     00:00:03.386  READ DMA EXT
  25 00 00 00 10 00 00 3a 38 8d d0 40 00     00:00:03.385  READ DMA EXT

Error 12 [11] occurred at disk power-on lifetime: 7352 hours (306 days + 8 hours)
  When the command that caused the error occurred, the device was active or idle.

  After command completion occurred, registers were:
  ER -- ST COUNT  LBA_48  LH LM LL DV DC
  -- -- -- == -- == == == -- -- -- -- --
  40 -- 51 00 f0 00 00 3a 38 8f c0 40 00  Error: UNC 240 sectors at LBA = 0x3a388fc0 = 976785344

  Commands leading to the command that caused the error were:
  CR FEATR COUNT  LBA_48  LH LM LL DV DC  Powered_Up_Time  Command/Feature_Name
  -- == -- == -- == == == -- -- -- -- --  ---------------  --------------------
  25 00 00 00 f0 00 00 3a 38 8e e0 40 00     00:00:03.390  READ DMA EXT
  25 00 00 00 10 00 00 3a 38 8e d0 40 00     00:00:03.389  READ DMA EXT
  25 00 00 00 f0 00 00 3a 38 8d e0 40 00     00:00:03.386  READ DMA EXT
  25 00 00 00 10 00 00 3a 38 8d d0 40 00     00:00:03.385  READ DMA EXT
  25 00 00 00 f0 00 00 3a 38 8c e0 40 00     00:00:03.382  READ DMA EXT

Error 11 [10] occurred at disk power-on lifetime: 6770 hours (282 days + 2 hours)
  When the command that caused the error occurred, the device was active or idle.

  After command completion occurred, registers were:
  ER -- ST COUNT  LBA_48  LH LM LL DV DC
  -- -- -- == -- == == == -- -- -- -- --
  40 -- 51 00 08 00 00 00 63 2d 30 40 00  Error: UNC 8 sectors at LBA = 0x00632d30 = 6499632

  Commands leading to the command that caused the error were:
  CR FEATR COUNT  LBA_48  LH LM LL DV DC  Powered_Up_Time  Command/Feature_Name
  -- == -- == -- == == == -- -- -- -- --  ---------------  --------------------
  25 00 00 00 08 00 00 00 63 2d 30 40 00     00:00:16.429  READ DMA EXT
  25 00 00 00 08 00 00 00 63 2d 30 40 00     00:00:12.972  READ DMA EXT
  25 00 00 00 08 00 00 00 60 2a 68 40 00     00:00:12.965  READ DMA EXT
  25 00 00 00 08 00 00 00 60 11 80 40 00     00:00:12.953  READ DMA EXT
  25 00 00 00 08 00 00 14 40 7b 48 40 00     00:00:12.934  READ DMA EXT

Error 10 [9] occurred at disk power-on lifetime: 6770 hours (282 days + 2 hours)
  When the command that caused the error occurred, the device was active or idle.

  After command completion occurred, registers were:
  ER -- ST COUNT  LBA_48  LH LM LL DV DC
  -- -- -- == -- == == == -- -- -- -- --
  40 -- 51 00 08 00 00 00 63 2d 30 40 00  Error: UNC 8 sectors at LBA = 0x00632d30 = 6499632

  Commands leading to the command that caused the error were:
  CR FEATR COUNT  LBA_48  LH LM LL DV DC  Powered_Up_Time  Command/Feature_Name
  -- == -- == -- == == == -- -- -- -- --  ---------------  --------------------
  25 00 00 00 08 00 00 00 63 2d 30 40 00     00:00:12.972  READ DMA EXT
  25 00 00 00 08 00 00 00 60 2a 68 40 00     00:00:12.965  READ DMA EXT
  25 00 00 00 08 00 00 00 60 11 80 40 00     00:00:12.953  READ DMA EXT
  25 00 00 00 08 00 00 14 40 7b 48 40 00     00:00:12.934  READ DMA EXT
  25 00 00 00 08 00 00 00 60 11 f0 40 00     00:00:12.932  READ DMA EXT

Error 9 [8] occurred at disk power-on lifetime: 6770 hours (282 days + 2 hours)
  When the command that caused the error occurred, the device was active or idle.

  After command completion occurred, registers were:
  ER -- ST COUNT  LBA_48  LH LM LL DV DC
  -- -- -- == -- == == == -- -- -- -- --
  40 -- 51 00 08 00 00 44 87 c9 40 40 00  Error: UNC 8 sectors at LBA = 0x4487c940 = 1149749568

  Commands leading to the command that caused the error were:
  CR FEATR COUNT  LBA_48  LH LM LL DV DC  Powered_Up_Time  Command/Feature_Name
  -- == -- == -- == == == -- -- -- -- --  ---------------  --------------------
  25 00 00 00 08 00 00 44 87 c9 40 40 00     00:00:07.107  READ DMA EXT
  25 00 00 00 08 00 00 44 87 c9 40 40 00     00:00:03.651  READ DMA EXT
  25 00 00 00 08 00 00 00 64 dd 20 40 00     00:00:03.635  READ DMA EXT
  25 00 00 00 08 00 00 33 e0 d9 f0 40 00     00:00:03.612  READ DMA EXT
  25 00 00 00 08 00 00 00 64 d7 10 40 00     00:00:03.612  READ DMA EXT

Error 8 [7] occurred at disk power-on lifetime: 6770 hours (282 days + 2 hours)
  When the command that caused the error occurred, the device was active or idle.

  After command completion occurred, registers were:
  ER -- ST COUNT  LBA_48  LH LM LL DV DC
  -- -- -- == -- == == == -- -- -- -- --
  40 -- 51 00 08 00 00 44 87 c9 40 40 00  Error: UNC 8 sectors at LBA = 0x4487c940 = 1149749568

  Commands leading to the command that caused the error were:
  CR FEATR COUNT  LBA_48  LH LM LL DV DC  Powered_Up_Time  Command/Feature_Name
  -- == -- == -- == == == -- -- -- -- --  ---------------  --------------------
  25 00 00 00 08 00 00 44 87 c9 40 40 00     00:00:03.651  READ DMA EXT
  25 00 00 00 08 00 00 00 64 dd 20 40 00     00:00:03.635  READ DMA EXT
  25 00 00 00 08 00 00 33 e0 d9 f0 40 00     00:00:03.612  READ DMA EXT
  25 00 00 00 08 00 00 00 64 d7 10 40 00     00:00:03.612  READ DMA EXT
  25 00 00 00 08 00 00 00 64 d7 00 40 00     00:00:03.611  READ DMA EXT

Error 7 [6] occurred at disk power-on lifetime: 5735 hours (238 days + 23 hours)
  When the command that caused the error occurred, the device was active or idle.

  After command completion occurred, registers were:
  ER -- ST COUNT  LBA_48  LH LM LL DV DC
  -- -- -- == -- == == == -- -- -- -- --
  40 -- 51 00 01 00 00 3a 37 b7 f8 40 00  Error: UNC 1 sectors at LBA = 0x3a37b7f8 = 976730104

  Commands leading to the command that caused the error were:
  CR FEATR COUNT  LBA_48  LH LM LL DV DC  Powered_Up_Time  Command/Feature_Name
  -- == -- == -- == == == -- -- -- -- --  ---------------  --------------------
  25 00 00 00 01 00 00 3a 37 b7 f8 40 00     00:00:05.580  READ DMA EXT
  25 00 00 00 08 00 00 3a 37 b7 f8 40 00     00:00:02.129  READ DMA EXT
  25 00 00 00 08 00 00 00 60 08 00 40 00     00:00:02.128  READ DMA EXT
  25 00 00 00 20 00 00 00 00 08 00 40 00     00:00:02.127  READ DMA EXT
  25 00 00 00 08 00 00 00 00 00 00 40 00     00:00:01.895  READ DMA EXT

Error 6 [5] occurred at disk power-on lifetime: 5735 hours (238 days + 23 hours)
  When the command that caused the error occurred, the device was active or idle.

  After command completion occurred, registers were:
  ER -- ST COUNT  LBA_48  LH LM LL DV DC
  -- -- -- == -- == == == -- -- -- -- --
  40 -- 51 00 08 00 00 3a 37 b7 f8 40 00  Error: UNC 8 sectors at LBA = 0x3a37b7f8 = 976730104

  Commands leading to the command that caused the error were:
  CR FEATR COUNT  LBA_48  LH LM LL DV DC  Powered_Up_Time  Command/Feature_Name
  -- == -- == -- == == == -- -- -- -- --  ---------------  --------------------
  25 00 00 00 08 00 00 3a 37 b7 f8 40 00     00:00:02.129  READ DMA EXT
  25 00 00 00 08 00 00 00 60 08 00 40 00     00:00:02.128  READ DMA EXT
  25 00 00 00 20 00 00 00 00 08 00 40 00     00:00:02.127  READ DMA EXT
  25 00 00 00 08 00 00 00 00 00 00 40 00     00:00:01.895  READ DMA EXT
  25 00 00 00 08 00 00 00 00 18 00 40 00     00:00:01.894  READ DMA EXT

SMART Extended Self-test Log Version: 1 (1 sectors)
No self-tests have been logged.  [To run self-tests, use: smartctl -t]

SMART Selective self-test log data structure revision number 1
 SPAN  MIN_LBA  MAX_LBA  CURRENT_TEST_STATUS
    1        0        0  Not_testing
    2        0        0  Not_testing
    3        0        0  Not_testing
    4        0        0  Not_testing
    5        0        0  Not_testing
Selective self-test flags (0x0):
  After scanning selected spans, do NOT read-scan remainder of disk.
If Selective self-test is pending on power-up, resume after 0 minute delay.

SCT Status Version:                  3
SCT Version (vendor specific):       258 (0x0102)
SCT Support Level:                   1
Device State:                        Active (0)
Current Temperature:                    35 Celsius
Power Cycle Min/Max Temperature:     27/35 Celsius
Lifetime    Min/Max Temperature:     21/61 Celsius
Under/Over Temperature Limit Count:   0/0
Vendor specific:
01 00 00 00 00 00 00 00 00 00 00 00 00 00 00 00
00 00 00 00 00 00 00 00 00 00 00 00 00 00 00 00

SCT Temperature History Version:     2
Temperature Sampling Period:         1 minute
Temperature Logging Interval:        1 minute
Min/Max recommended Temperature:      0/60 Celsius
Min/Max Temperature Limit:           -41/85 Celsius
Temperature History Size (Index):    128 (36)

SCT Error Recovery Control command not supported

Device Statistics (GP/SMART Log 0x04) not supported

SATA Phy Event Counters (GP Log 0x11)
ID      Size     Value  Description
0x0001  2            0  Command failed due to ICRC error
0x0002  2            0  R_ERR response for data FIS
0x0003  2            0  R_ERR response for device-to-host data FIS
0x0004  2            0  R_ERR response for host-to-device data FIS
0x0005  2            0  R_ERR response for non-data FIS
0x0006  2            0  R_ERR response for device-to-host non-data FIS
0x0007  2            0  R_ERR response for host-to-device non-data FIS
0x0008  2            0  Device-to-host non-data FIS retries
0x0009  2            4  Transition from drive PhyRdy to drive PhyNRdy
0x000a  2            4  Device-to-host register FISes sent due to a COMRESET
0x000b  2            0  CRC errors within host-to-device FIS
0x000f  2            0  R_ERR response for host-to-device data FIS, CRC
0x0012  2            0  R_ERR response for host-to-device non-data FIS, CRC
0x8000  4         3383  Vendor specific



