smartctl 7.2 2020-12-30 r5155 [x86_64-linux-6.0.0-10.1-liquorix-amd64] (local build)
Copyright (C) 2002-20, Bruce Allen, Christian Franke, www.smartmontools.org

=== START OF INFORMATION SECTION ===
Device Model:     Lexar SSD NS100 512GB
Serial Number:    --
LU WWN Device Id: 5 3a5a27 ...
Add. Product Id:  mavlsata
Firmware Version: V4.30.2
User Capacity:    512,110,190,592 bytes [512 GB]
Sector Size:      512 bytes logical/physical
Rotation Rate:    Solid State Device
TRIM Command:     Available
Device is:        Not in smartctl database [for details use: -P showall]
ATA Version is:   ACS-3 T13/2161-D revision 4
SATA Version is:  SATA 3.2, 6.0 Gb/s (current: 6.0 Gb/s)
Local Time is:    Fri May 31 09:29:23 2024 EAT
SMART support is: Available - device has SMART capability.
SMART support is: Enabled
AAM feature is:   Unavailable
APM level is:     254 (maximum performance)
Rd look-ahead is: Enabled
Write cache is:   Enabled
DSN feature is:   Unavailable
ATA Security is:  Disabled, frozen [SEC2]
Wt Cache Reorder: Unavailable

=== START OF READ SMART DATA SECTION ===
SMART overall-health self-assessment test result: PASSED

General SMART Values:
Offline data collection status:  (0x02)	Offline data collection activity
					was completed without error.
					Auto Offline Data Collection: Disabled.
Self-test execution status:      (   0)	The previous self-test routine completed
					without error or no self-test has ever 
					been run.
Total time to complete Offline 
data collection: 		(    0) seconds.
Offline data collection
capabilities: 			 (0x75) SMART execute Offline immediate.
					No Auto Offline data collection support.
					Abort Offline collection upon new
					command.
					No Offline surface scan supported.
					Self-test supported.
					Conveyance Self-test supported.
					Selective Self-test supported.
SMART capabilities:            (0x0002)	Does not save SMART data before
					entering power-saving mode.
					Supports SMART auto save timer.
Error logging capability:        (0x00)	Error logging NOT supported.
					General Purpose Logging supported.
Short self-test routine 
recommended polling time: 	 (   2) minutes.
Extended self-test routine
recommended polling time: 	 (  90) minutes.
Conveyance self-test routine
recommended polling time: 	 (   2) minutes.

SMART Attributes Data Structure revision number: 5
Vendor Specific SMART Attributes with Thresholds:
ID# ATTRIBUTE_NAME          FLAGS    VALUE WORST THRESH FAIL RAW_VALUE
  5 Reallocated_Sector_Ct   PO--CK   100   100   010    -    0
  9 Power_On_Hours          PO--CK   100   100   010    -    2270
 12 Power_Cycle_Count       PO--CK   100   100   010    -    673
161 Unknown_Attribute       PO--CK   100   100   010    -    0
164 Unknown_Attribute       PO--CK   100   100   010    -    70422
165 Unknown_Attribute       PO--CK   100   100   010    -    110
166 Unknown_Attribute       PO--CK   100   100   010    -    6
167 Unknown_Attribute       PO--CK   100   100   010    -    64
169 Unknown_Attribute       PO--CK   100   100   010    -    0
176 Erase_Fail_Count_Chip   PO--CK   100   100   010    -    0
177 Wear_Leveling_Count     PO--CK   100   100   010    -    0
178 Used_Rsvd_Blk_Cnt_Chip  PO--CK   100   100   010    -    0
192 Power-Off_Retract_Count PO--CK   100   100   010    -    1
194 Temperature_Celsius     PO--CK   100   100   010    -    46
195 Hardware_ECC_Recovered  PO--CK   100   100   010    -    0
199 UDMA_CRC_Error_Count    PO--CK   100   100   010    -    0
241 Total_LBAs_Written      PO--CK   100   100   010    -    12698
242 Total_LBAs_Read         PO--CK   100   100   010    -    24894
243 Unknown_Attribute       PO--CK   100   100   010    -    0
244 Unknown_Attribute       PO--CK   100   100   010    -    0
245 Unknown_Attribute       PO--CK   100   100   010    -    0
246 Unknown_Attribute       PO--CK   100   100   010    -    0
248 Unknown_Attribute       PO--CK   100   100   010    -    0
249 Unknown_Attribute       PO--CK   100   100   010    -    0
250 Read_Error_Retry_Rate   PO--CK   100   100   010    -    0
251 Unknown_Attribute       PO--CK   100   100   010    -    0
252 Unknown_Attribute       PO--CK   100   100   010    -    0
253 Unknown_Attribute       PO--CK   100   100   010    -    0
254 Unknown_SSD_Attribute   PO--CK   100   100   010    -    0
                            ||||||_ K auto-keep
                            |||||__ C event count
                            ||||___ R error rate
                            |||____ S speed/performance
                            ||_____ O updated online
                            |______ P prefailure warning

General Purpose Log Directory Version 1
SMART           Log Directory Version 1 [multi-sector log support]
Address    Access  R/W   Size  Description
0x00       GPL,SL  R/O      1  Log Directory
0x06       GPL,SL  R/O      1  SMART self-test log
0x07       GPL,SL  R/O      1  Extended self-test log
0x09       GPL,SL  R/W      1  Selective self-test log
0x10       GPL,SL  R/O      1  NCQ Command Error log
0x30       GPL,SL  R/O      9  IDENTIFY DEVICE data log
0x80-0x9f  GPL,SL  R/W     16  Host vendor specific log

SMART Extended Comprehensive Error Log (GP Log 0x03) not supported

SMART Error Log not supported

SMART Extended Self-test Log Version: 1 (1 sectors)
Num  Test_Description    Status                  Remaining  LifeTime(hours)  LBA_of_first_error
# 1  Short offline       Completed without error       00%      2158         -
# 2  Short offline       Completed without error       00%      2002         -
# 3  Short offline       Completed without error       00%      1831         -
# 4  Short offline       Completed without error       00%      1661         -
# 5  Short offline       Completed without error       00%      1552         -
# 6  Short offline       Aborted by host               00%      1163         -
# 7  Short offline       Aborted by host               00%      1145         -
# 8  Short offline       Completed without error       00%      1087         -
# 9  Short offline       Completed without error       00%       994         -
#10  Short offline       Completed without error       00%       994         -
#11  Short offline       Completed without error       00%       994         -
#12  Short offline       Completed without error       00%       993         -
#13  Short offline       Completed without error       00%       789         -
#14  Short offline       Completed without error       00%       706         -
#15  Short offline       Completed without error       00%       579         -
#16  Short offline       Completed without error       00%       316         -
#17  Short offline       Completed without error       00%       253         -
#18  Short offline       Completed without error       00%        10         -

SMART Selective self-test log data structure revision number 1
 SPAN  MIN_LBA  MAX_LBA  CURRENT_TEST_STATUS
    1        0        0  Not_testing
    2        0        0  Not_testing
    3        0        0  Not_testing
    4        0        0  Not_testing
    5        0        0  Not_testing
Selective self-test flags (0x0):
  After scanning selected spans, do NOT read-scan remainder of disk.
If Selective self-test is pending on power-up, resume after 0 minute delay.

SCT Commands not supported

Device Statistics (GP/SMART Log 0x04) not supported

Pending Defects log (GP Log 0x0c) not supported

SATA Phy Event Counters (GP Log 0x11) not supported

