smartctl 7.1 2019-12-30 r5022 [x86_64-linux-5.15.0-88-generic] (local build)
Copyright (C) 2002-19, Bruce Allen, Christian Franke, www.smartmontools.org

=== START OF INFORMATION SECTION ===
Model Family:     Silicon Motion based OEM SSDs
Device Model:     ORTIAL SSD
Serial Number:    --
Firmware Version: U0202A0
User Capacity:    128,035,676,160 bytes [128 GB]
Sector Size:      512 bytes logical/physical
Rotation Rate:    Solid State Device
Device is:        In smartctl database [for details use: -P show]
ATA Version is:   ACS-3 T13/2161-D revision 4
SATA Version is:  SATA 3.2, 6.0 Gb/s (current: 3.0 Gb/s)
Local Time is:    Thu Dec 14 14:01:15 2023 EST
SMART support is: Available - device has SMART capability.
SMART support is: Enabled
AAM feature is:   Unavailable
APM level is:     254 (maximum performance)
Rd look-ahead is: Enabled
Write cache is:   Enabled
DSN feature is:   Unavailable
ATA Security is:  Disabled, frozen [SEC2]
Wt Cache Reorder: Unavailable

=== START OF READ SMART DATA SECTION ===
SMART overall-health self-assessment test result: PASSED

General SMART Values:
Offline data collection status:  (0x00)	Offline data collection activity
					was never started.
					Auto Offline Data Collection: Disabled.
Self-test execution status:      (   0)	The previous self-test routine completed
					without error or no self-test has ever 
					been run.
Total time to complete Offline 
data collection: 		(  120) seconds.
Offline data collection
capabilities: 			 (0x11) SMART execute Offline immediate.
					No Auto Offline data collection support.
					Suspend Offline collection upon new
					command.
					No Offline surface scan supported.
					Self-test supported.
					No Conveyance Self-test supported.
					No Selective Self-test supported.
SMART capabilities:            (0x0002)	Does not save SMART data before
					entering power-saving mode.
					Supports SMART auto save timer.
Error logging capability:        (0x01)	Error logging supported.
					General Purpose Logging supported.
Short self-test routine 
recommended polling time: 	 (   2) minutes.
Extended self-test routine
recommended polling time: 	 (  10) minutes.

SMART Attributes Data Structure revision number: 1
Vendor Specific SMART Attributes with Thresholds:
ID# ATTRIBUTE_NAME          FLAGS    VALUE WORST THRESH FAIL RAW_VALUE
  1 Raw_Read_Error_Rate     -O--CK   100   100   050    -    0
  5 Reallocated_Sector_Ct   -O--CK   100   100   050    -    15
  9 Power_On_Hours          -O--CK   100   100   050    -    20129
 12 Power_Cycle_Count       -O--CK   100   100   050    -    68
160 Uncorrectable_Error_Cnt -O--CK   100   100   050    -    12
161 Valid_Spare_Block_Cnt   PO--CK   100   100   050    -    66
163 Initial_Bad_Block_Count -O--CK   100   100   050    -    17
164 Total_Erase_Count       -O--CK   100   100   050    -    48258
165 Max_Erase_Count         -O--CK   100   100   050    -    251
166 Min_Erase_Count         -O--CK   100   100   050    -    3
167 Average_Erase_Count     -O--CK   100   100   050    -    73
168 Max_Erase_Count_of_Spec -O--CK   100   100   050    -    5050
169 Remaining_Lifetime_Perc -O--CK   100   100   050    -    99
175 Program_Fail_Count_Chip -O--CK   100   100   050    -    0
176 Erase_Fail_Count_Chip   -O--CK   100   100   050    -    0
177 Wear_Leveling_Count     -O--CK   100   100   050    -    0
178 Runtime_Invalid_Blk_Cnt -O--CK   100   100   050    -    15
181 Program_Fail_Cnt_Total  -O--CK   100   100   050    -    0
182 Erase_Fail_Count_Total  -O--CK   100   100   050    -    0
192 Power-Off_Retract_Count -O--CK   100   100   050    -    67
194 Temperature_Celsius     -O---K   100   100   050    -    40
195 Hardware_ECC_Recovered  -O--CK   100   100   050    -    0
196 Reallocated_Event_Count -O--CK   100   100   050    -    12
197 Current_Pending_Sector  -O--CK   100   100   050    -    15
198 Offline_Uncorrectable   -O--CK   100   100   050    -    12
199 UDMA_CRC_Error_Count    -O--CK   100   100   050    -    67
232 Available_Reservd_Space -O--CK   100   100   050    -    66
241 Host_Writes_32MiB       ----CK   100   100   050    -    146043
242 Host_Reads_32MiB        ----CK   100   100   050    -    152401
245 TLC_Writes_32MiB        -O--CK   100   100   050    -    101154
                            ||||||_ K auto-keep
                            |||||__ C event count
                            ||||___ R error rate
                            |||____ S speed/performance
                            ||_____ O updated online
                            |______ P prefailure warning

General Purpose Log Directory Version 1
SMART           Log Directory Version 1 [multi-sector log support]
Address    Access  R/W   Size  Description
0x00       GPL,SL  R/O      1  Log Directory
0x01           SL  R/O      1  Summary SMART error log
0x02           SL  R/O      1  Comprehensive SMART error log
0x03       GPL     R/O      1  Ext. Comprehensive SMART error log
0x04       GPL,SL  R/O      8  Device Statistics log
0x06           SL  R/O      1  SMART self-test log
0x07       GPL     R/O      1  Extended self-test log
0x10       GPL     R/O      1  NCQ Command Error log
0x11       GPL     R/O      1  SATA Phy Event Counters log
0x24       GPL     R/O     88  Current Device Internal Status Data log
0x25       GPL     R/O     32  Saved Device Internal Status Data log
0x30       GPL,SL  R/O      9  IDENTIFY DEVICE data log
0x80-0x9f  GPL,SL  R/W     16  Host vendor specific log

SMART Extended Comprehensive Error Log Version: 1 (1 sectors)
Device Error Count: 67 (device log contains only the most recent 4 errors)
	CR     = Command Register
	FEATR  = Features Register
	COUNT  = Count (was: Sector Count) Register
	LBA_48 = Upper bytes of LBA High/Mid/Low Registers ]  ATA-8
	LH     = LBA High (was: Cylinder High) Register    ]   LBA
	LM     = LBA Mid (was: Cylinder Low) Register      ] Register
	LL     = LBA Low (was: Sector Number) Register     ]
	DV     = Device (was: Device/Head) Register
	DC     = Device Control Register
	ER     = Error register
	ST     = Status register
Powered_Up_Time is measured from power on, and printed as
DDd+hh:mm:SS.sss where DD=days, hh=hours, mm=minutes,
SS=sec, and sss=millisec. It "wraps" after 49.710 days.

Error 67 [2] occurred at disk power-on lifetime: 0 hours (0 days + 0 hours)
  When the command that caused the error occurred, the device was active or idle.

  After command completion occurred, registers were:
  ER -- ST COUNT  LBA_48  LH LM LL DV DC
  -- -- -- == -- == == == -- -- -- -- --
  04 -- 51 00 00 00 00 00 00 00 00 40 00  Error: ABRT at LBA = 0x00000000 = 0

  Commands leading to the command that caused the error were:
  CR FEATR COUNT  LBA_48  LH LM LL DV DC  Powered_Up_Time  Command/Feature_Name
  -- == -- == -- == == == -- -- -- -- --  ---------------  --------------------
  60 00 18 00 60 00 00 42 00 5d 98 00 00     00:00:00.000  READ FPDMA QUEUED
  60 00 08 00 70 00 00 b9 00 cf a8 00 00     00:00:00.000  READ FPDMA QUEUED
  60 00 10 00 78 00 00 b9 00 cf b0 00 00     00:00:00.000  READ FPDMA QUEUED
  60 00 08 00 80 00 00 23 00 f8 00 00 00     00:00:00.000  READ FPDMA QUEUED
  60 00 08 00 98 00 00 cb 00 76 28 00 00     00:00:00.000  READ FPDMA QUEUED

Error 66 [1] log entry is empty
Error 65 [0] log entry is empty
Error 64 [3] occurred at disk power-on lifetime: 0 hours (0 days + 0 hours)
  When the command that caused the error occurred, the device was active or idle.

  After command completion occurred, registers were:
  ER -- ST COUNT  LBA_48  LH LM LL DV DC
  -- -- -- == -- == == == -- -- -- -- --
  00 -- 00 00 00 00 00 00 00 00 00 00 00

  Commands leading to the command that caused the error were:
  CR FEATR COUNT  LBA_48  LH LM LL DV DC  Powered_Up_Time  Command/Feature_Name
  -- == -- == -- == == == -- -- -- -- --  ---------------  --------------------
  ec 00 00 01 01 00 00 00 00 00 00 40 08     00:00:00.000  IDENTIFY DEVICE
  e7 00 00 00 00 00 00 00 00 00 00 a0 08     00:00:00.000  FLUSH CACHE
  ec 00 00 01 01 00 00 00 00 00 00 00 08     00:00:00.000  IDENTIFY DEVICE
  ec 00 00 01 01 00 00 00 00 00 00 00 08     00:00:00.000  IDENTIFY DEVICE
  2f 00 00 01 01 00 00 00 00 00 00 e0 08     00:00:00.000  READ LOG EXT

SMART Extended Self-test Log Version: 1 (1 sectors)
Num  Test_Description    Status                  Remaining  LifeTime(hours)  LBA_of_first_error
# 1  Extended offline    Interrupted (host reset)      90%     17847         -
# 2  Extended offline    Completed without error       00%     17847         -
# 3  Extended offline    Completed without error       00%     15437         -
# 4  Short offline       Completed without error       00%         0         -

Selective Self-tests/Logging not supported

SCT Commands not supported

Device Statistics (GP Log 0x04)
Page  Offset Size        Value Flags Description
0x01  =====  =               =  ===  == General Statistics (rev 1) ==
0x01  0x008  4              68  ---  Lifetime Power-On Resets
0x01  0x010  4           20129  ---  Power-on Hours
0x01  0x018  6       981152111  ---  Logical Sectors Written
0x01  0x020  6       212253320  ---  Number of Write Commands
0x01  0x028  6      1397844517  ---  Logical Sectors Read
0x01  0x030  6       211705382  ---  Number of Read Commands
0x07  =====  =               =  ===  == Solid State Device Statistics (rev 1) ==
0x07  0x008  1               3  ---  Percentage Used Endurance Indicator
                                |||_ C monitored condition met
                                ||__ D supports DSN
                                |___ N normalized value

Pending Defects log (GP Log 0x0c) not supported

SATA Phy Event Counters (GP Log 0x11)
ID      Size     Value  Description
0x0001  4            0  Command failed due to ICRC error
0x0002  4            0  R_ERR response for data FIS
0x0005  4            1  R_ERR response for non-data FIS
0x000a  4           51  Device-to-host register FISes sent due to a COMRESET



