smartctl 7.3 2022-02-28 r5338 [x86_64-linux-6.1.0-38-amd64] (local build)
Copyright (C) 2002-22, Bruce Allen, Christian Franke, www.smartmontools.org

=== START OF INFORMATION SECTION ===
Device Model:     TOSHIBA MQ01ACF050
Serial Number:    --
LU WWN Device Id: 5 000039 ...
Firmware Version: AV001D
User Capacity:    500,107,862,016 bytes [500 GB]
Sector Sizes:     512 bytes logical, 4096 bytes physical
Rotation Rate:    7200 rpm
Form Factor:      2.5 inches
Device is:        Not in smartctl database 7.3/5319
ATA Version is:   ATA8-ACS (minor revision not indicated)
SATA Version is:  SATA 3.0, 6.0 Gb/s (current: 3.0 Gb/s)
Local Time is:    Sat Aug 23 15:02:42 2025 -05
SMART support is: Available - device has SMART capability.
SMART support is: Enabled
AAM feature is:   Unavailable
APM level is:     254 (maximum performance)
Rd look-ahead is: Enabled
Write cache is:   Enabled
DSN feature is:   Unavailable
ATA Security is:  Disabled, frozen [SEC2]
Wt Cache Reorder: Enabled

=== START OF READ SMART DATA SECTION ===
SMART overall-health self-assessment test result: PASSED

General SMART Values:
Offline data collection status:  (0x00)	Offline data collection activity
					was never started.
					Auto Offline Data Collection: Disabled.
Self-test execution status:      (  25)	The self-test routine was aborted by
					the host.
Total time to complete Offline 
data collection: 		(  120) seconds.
Offline data collection
capabilities: 			 (0x5b) SMART execute Offline immediate.
					Auto Offline data collection on/off support.
					Suspend Offline collection upon new
					command.
					Offline surface scan supported.
					Self-test supported.
					No Conveyance Self-test supported.
					Selective Self-test supported.
SMART capabilities:            (0x0003)	Saves SMART data before entering
					power-saving mode.
					Supports SMART auto save timer.
Error logging capability:        (0x01)	Error logging supported.
					General Purpose Logging supported.
Short self-test routine 
recommended polling time: 	 (   2) minutes.
Extended self-test routine
recommended polling time: 	 (  95) minutes.
SCT capabilities: 	       (0x003d)	SCT Status supported.
					SCT Error Recovery Control supported.
					SCT Feature Control supported.
					SCT Data Table supported.

SMART Attributes Data Structure revision number: 128
Vendor Specific SMART Attributes with Thresholds:
ID# ATTRIBUTE_NAME          FLAGS    VALUE WORST THRESH FAIL RAW_VALUE
  1 Raw_Read_Error_Rate     PO-R--   100   100   050    -    0
  3 Spin_Up_Time            POS--K   100   100   001    -    2009
  5 Reallocated_Sector_Ct   PO--CK   100   100   050    -    248
  9 Power_On_Hours          -O--CK   090   090   000    -    4388
 12 Power_Cycle_Count       -O--CK   100   100   000    -    3224
191 G-Sense_Error_Rate      -O--CK   100   100   000    -    2268
192 Power-Off_Retract_Count -O--CK   100   100   000    -    127
193 Load_Cycle_Count        -O--CK   095   095   000    -    54287
194 Temperature_Celsius     -O---K   100   100   000    -    41 (Min/Max 12/53)
199 UDMA_CRC_Error_Count    -O--CK   100   100   000    -    122815153
200 Multi_Zone_Error_Rate   -O--CK   100   100   000    -    317345843
240 Head_Flying_Hours       -O--CK   090   090   000    -    4085
241 Total_LBAs_Written      -O--CK   100   100   000    -    30190050739
242 Total_LBAs_Read         -O--CK   100   100   000    -    38663658221
254 Free_Fall_Sensor        -O--CK   100   100   000    -    0
                            ||||||_ K auto-keep
                            |||||__ C event count
                            ||||___ R error rate
                            |||____ S speed/performance
                            ||_____ O updated online
                            |______ P prefailure warning

General Purpose Log Directory Version 1
SMART           Log Directory Version 1 [multi-sector log support]
Address    Access  R/W   Size  Description
0x00       GPL,SL  R/O      1  Log Directory
0x01           SL  R/O      1  Summary SMART error log
0x02           SL  R/O     51  Comprehensive SMART error log
0x03       GPL     R/O     64  Ext. Comprehensive SMART error log
0x04       GPL,SL  R/O      8  Device Statistics log
0x06           SL  R/O      1  SMART self-test log
0x07       GPL     R/O      1  Extended self-test log
0x09           SL  R/W      1  Selective self-test log
0x10       GPL     R/O      1  NCQ Command Error log
0x11       GPL     R/O      1  SATA Phy Event Counters log
0x80-0x9f  GPL,SL  R/W     16  Host vendor specific log
0xe0       GPL,SL  R/W      1  SCT Command/Status
0xe1       GPL,SL  R/W      1  SCT Data Transfer

SMART Extended Comprehensive Error Log Version: 1 (64 sectors)
Device Error Count: 2
	CR     = Command Register
	FEATR  = Features Register
	COUNT  = Count (was: Sector Count) Register
	LBA_48 = Upper bytes of LBA High/Mid/Low Registers ]  ATA-8
	LH     = LBA High (was: Cylinder High) Register    ]   LBA
	LM     = LBA Mid (was: Cylinder Low) Register      ] Register
	LL     = LBA Low (was: Sector Number) Register     ]
	DV     = Device (was: Device/Head) Register
	DC     = Device Control Register
	ER     = Error register
	ST     = Status register
Powered_Up_Time is measured from power on, and printed as
DDd+hh:mm:SS.sss where DD=days, hh=hours, mm=minutes,
SS=sec, and sss=millisec. It "wraps" after 49.710 days.

Error 2 [1] occurred at disk power-on lifetime: 1930 hours (80 days + 10 hours)
  When the command that caused the error occurred, the device was active or idle.

  After command completion occurred, registers were:
  ER -- ST COUNT  LBA_48  LH LM LL DV DC
  -- -- -- == -- == == == -- -- -- -- --
  40 -- 41 00 60 00 00 1f 81 26 e8 40 00  Error: WP at LBA = 0x1f8126e8 = 528557800

  Commands leading to the command that caused the error were:
  CR FEATR COUNT  LBA_48  LH LM LL DV DC  Powered_Up_Time  Command/Feature_Name
  -- == -- == -- == == == -- -- -- -- --  ---------------  --------------------
  61 00 08 00 68 00 00 01 44 10 30 40 00     01:30:21.039  WRITE FPDMA QUEUED
  60 00 08 00 60 00 00 1f 81 26 e8 40 00     01:30:18.120  READ FPDMA QUEUED
  60 00 08 00 58 00 00 1f 81 26 e0 40 00     01:30:18.119  READ FPDMA QUEUED
  60 00 08 00 50 00 00 1f 81 26 d8 40 00     01:30:18.119  READ FPDMA QUEUED
  60 00 08 00 48 00 00 1f 81 26 d0 40 00     01:30:18.119  READ FPDMA QUEUED

Error 1 [0] occurred at disk power-on lifetime: 1930 hours (80 days + 10 hours)
  When the command that caused the error occurred, the device was active or idle.

  After command completion occurred, registers were:
  ER -- ST COUNT  LBA_48  LH LM LL DV DC
  -- -- -- == -- == == == -- -- -- -- --
  40 -- 41 00 f8 00 00 1f 81 27 10 40 00  Error: UNC at LBA = 0x1f812710 = 528557840

  Commands leading to the command that caused the error were:
  CR FEATR COUNT  LBA_48  LH LM LL DV DC  Powered_Up_Time  Command/Feature_Name
  -- == -- == -- == == == -- -- -- -- --  ---------------  --------------------
  60 01 90 00 00 00 00 1f 81 27 70 40 00     01:30:16.735  READ FPDMA QUEUED
  60 01 00 00 f8 00 00 1f 81 26 70 40 00     01:30:13.443  READ FPDMA QUEUED
  60 02 b0 00 b8 00 00 1f 81 23 c0 40 00     01:30:13.383  READ FPDMA QUEUED
  60 02 00 00 b0 00 00 1f 81 21 c0 40 00     01:30:13.338  READ FPDMA QUEUED
  60 01 00 00 70 00 00 1f 81 20 c0 40 00     01:30:12.982  READ FPDMA QUEUED

SMART Extended Self-test Log Version: 1 (1 sectors)
Num  Test_Description    Status                  Remaining  LifeTime(hours)  LBA_of_first_error
# 1  Extended offline    Aborted by host               90%      2051         -
# 2  Short captive       Completed without error       00%       109         -
# 3  Short offline       Completed without error       00%         1         -

SMART Selective self-test log data structure revision number 1
 SPAN  MIN_LBA  MAX_LBA  CURRENT_TEST_STATUS
    1        0        0  Not_testing
    2        0        0  Not_testing
    3        0        0  Not_testing
    4        0        0  Not_testing
    5        0        0  Not_testing
Selective self-test flags (0x0):
  After scanning selected spans, do NOT read-scan remainder of disk.
If Selective self-test is pending on power-up, resume after 0 minute delay.

SCT Status Version:                  2
SCT Version (vendor specific):       1 (0x0001)
Device State:                        Active (0)
Current Temperature:                    41 Celsius
Power Cycle Min/Max Temperature:     20/42 Celsius
Lifetime    Min/Max Temperature:     12/53 Celsius
Specified Max Operating Temperature:    34 Celsius
Under/Over Temperature Limit Count:   0/0

SCT Temperature History Version:     2
Temperature Sampling Period:         1 minute
Temperature Logging Interval:        10 minutes
Min/Max recommended Temperature:     15/55 Celsius
Min/Max Temperature Limit:           10/60 Celsius
Temperature History Size (Index):    478 (36)

SCT Error Recovery Control:
           Read: Disabled
          Write: Disabled

Device Statistics (GP Log 0x04)
Page  Offset Size        Value Flags Description
0x01  =====  =               =  ===  == General Statistics (rev 2) ==
0x01  0x008  4            3224  ---  Lifetime Power-On Resets
0x01  0x010  4            4388  ---  Power-on Hours
0x01  0x018  6     30190050739  ---  Logical Sectors Written
0x01  0x020  6       194220868  ---  Number of Write Commands
0x01  0x028  6     38663658221  ---  Logical Sectors Read
0x01  0x030  6       369317697  ---  Number of Read Commands
0x02  =====  =               =  ===  == Free-Fall Statistics (rev 1) ==
0x02  0x010  4            2268  ---  Overlimit Shock Events
0x03  =====  =               =  ===  == Rotating Media Statistics (rev 1) ==
0x03  0x008  4            4373  ---  Spindle Motor Power-on Hours
0x03  0x010  4            4085  ---  Head Flying Hours
0x03  0x018  4           54287  ---  Head Load Events
0x03  0x020  4             992  ---  Number of Reallocated Logical Sectors
0x03  0x028  4               6  ---  Read Recovery Attempts
0x03  0x030  4               0  ---  Number of Mechanical Start Failures
0x04  =====  =               =  ===  == General Errors Statistics (rev 1) ==
0x04  0x008  4               2  ---  Number of Reported Uncorrectable Errors
0x04  0x010  4               6  ---  Resets Between Cmd Acceptance and Completion
0x05  =====  =               =  ===  == Temperature Statistics (rev 1) ==
0x05  0x008  1              41  ---  Current Temperature
0x05  0x010  1              37  N--  Average Short Term Temperature
0x05  0x018  1              36  N--  Average Long Term Temperature
0x05  0x020  1              53  ---  Highest Temperature
0x05  0x028  1              12  ---  Lowest Temperature
0x05  0x030  1              42  N--  Highest Average Short Term Temperature
0x05  0x038  1              29  N--  Lowest Average Short Term Temperature
0x05  0x040  1              36  N--  Highest Average Long Term Temperature
0x05  0x048  1              32  N--  Lowest Average Long Term Temperature
0x05  0x050  4               0  ---  Time in Over-Temperature
0x05  0x058  1              55  ---  Specified Maximum Operating Temperature
0x05  0x060  4             201  ---  Time in Under-Temperature
0x05  0x068  1              15  ---  Specified Minimum Operating Temperature
0x06  =====  =               =  ===  == Transport Statistics (rev 1) ==
0x06  0x008  4           21338  ---  Number of Hardware Resets
0x06  0x018  4               0  ---  Number of Interface CRC Errors
0x07  =====  =               =  ===  == Solid State Device Statistics (rev 1) ==
0x07  0x008  1               7  N--  Percentage Used Endurance Indicator
                                |||_ C monitored condition met
                                ||__ D supports DSN
                                |___ N normalized value

Pending Defects log (GP Log 0x0c) not supported

SATA Phy Event Counters (GP Log 0x11)
ID      Size     Value  Description
0x0001  4            0  Command failed due to ICRC error
0x0002  4            0  R_ERR response for data FIS
0x0003  4            0  R_ERR response for device-to-host data FIS
0x0004  4            0  R_ERR response for host-to-device data FIS
0x0005  4            0  R_ERR response for non-data FIS
0x0006  4            0  R_ERR response for device-to-host non-data FIS
0x0007  4            0  R_ERR response for host-to-device non-data FIS
0x0008  4            0  Device-to-host non-data FIS retries
0x0009  4       107056  Transition from drive PhyRdy to drive PhyNRdy
0x000a  4            3  Device-to-host register FISes sent due to a COMRESET
0x000b  4            0  CRC errors within host-to-device FIS
0x000d  4            0  Non-CRC errors within host-to-device FIS
0x000f  4            0  R_ERR response for host-to-device data FIS, CRC
0x0010  4            0  R_ERR response for host-to-device data FIS, non-CRC
0x0012  4            0  R_ERR response for host-to-device non-data FIS, CRC
0x0013  4            0  R_ERR response for host-to-device non-data FIS, non-CRC



