smartctl 7.4 2023-08-01 r5530 [x86_64-linux-6.12.1-desktop-1omv2490] (OpenMandriva Lx 7.4-1)
Copyright (C) 2002-23, Bruce Allen, Christian Franke, www.smartmontools.org

=== START OF INFORMATION SECTION ===
Device Model:     TOSHIBA MQ01ACF050
Serial Number:    --
LU WWN Device Id: 5 000039 ...
Firmware Version: AV0D2C
User Capacity:    500,107,862,016 bytes [500 GB]
Sector Sizes:     512 bytes logical, 4096 bytes physical
Rotation Rate:    7200 rpm
Form Factor:      2.5 inches
Device is:        Not in smartctl database
ATA Version is:   ACS-2 (minor revision not indicated)
SATA Version is:  SATA 3.1, 6.0 Gb/s (current: 3.0 Gb/s)
Local Time is:    Sun Feb 23 18:03:57 2025 +0330
SMART support is: Available - device has SMART capability.
SMART support is: Enabled
AAM feature is:   Unavailable
APM level is:     128 (minimum power consumption without standby)
Rd look-ahead is: Enabled
Write cache is:   Enabled
DSN feature is:   Unavailable
ATA Security is:  Disabled, frozen [SEC2]
Wt Cache Reorder: Enabled

=== START OF READ SMART DATA SECTION ===
SMART overall-health self-assessment test result: PASSED

General SMART Values:
Offline data collection status:  (0x82)	Offline data collection activity
					was completed without error.
					Auto Offline Data Collection: Enabled.
Self-test execution status:      (   0)	The previous self-test routine completed
					without error or no self-test has ever 
					been run.
Total time to complete Offline 
data collection: 		(  120) seconds.
Offline data collection
capabilities: 			 (0x5b) SMART execute Offline immediate.
					Auto Offline data collection on/off support.
					Suspend Offline collection upon new
					command.
					Offline surface scan supported.
					Self-test supported.
					No Conveyance Self-test supported.
					Selective Self-test supported.
SMART capabilities:            (0x0003)	Saves SMART data before entering
					power-saving mode.
					Supports SMART auto save timer.
Error logging capability:        (0x01)	Error logging supported.
					General Purpose Logging supported.
Short self-test routine 
recommended polling time: 	 (   2) minutes.
Extended self-test routine
recommended polling time: 	 (  85) minutes.
SCT capabilities: 	       (0x003d)	SCT Status supported.
					SCT Error Recovery Control supported.
					SCT Feature Control supported.
					SCT Data Table supported.

SMART Attributes Data Structure revision number: 16
Vendor Specific SMART Attributes with Thresholds:
ID# ATTRIBUTE_NAME          FLAGS    VALUE WORST THRESH FAIL RAW_VALUE
  1 Raw_Read_Error_Rate     POSR-K   100   100   050    -    0
  2 Throughput_Performance  POS--K   100   100   050    -    0
  3 Spin_Up_Time            PO---K   100   100   002    -    1967
  4 Start_Stop_Count        -O--CK   100   100   000    -    8119
  5 Reallocated_Sector_Ct   PO--CK   100   100   010    -    0
  7 Seek_Error_Rate         POSR-K   100   100   050    -    0
  8 Seek_Time_Performance   P-S--K   100   100   050    -    0
  9 Power_On_Hours          -O--CK   002   002   000    -    39368
 10 Spin_Retry_Count        PO--CK   253   100   030    -    0
 12 Power_Cycle_Count       -O--CK   100   100   000    -    2774
183 Runtime_Bad_Block       -O--CK   100   100   001    -    15766
184 End-to-End_Error        PO--CK   100   100   097    -    0
185 Unknown_Attribute       -O--CK   100   100   001    -    65535
187 Reported_Uncorrect      -O--CK   100   100   000    -    0
188 Command_Timeout         -O--CK   100   032   000    -    4844
189 High_Fly_Writes         -O-RCK   100   100   001    -    0
190 Airflow_Temperature_Cel -O---K   066   051   040    -    34 (Min/Max 23/34)
191 G-Sense_Error_Rate      -O--CK   100   100   000    -    153
192 Power-Off_Retract_Count -O---K   098   098   000    -    66847740
193 Load_Cycle_Count        -O--CK   065   065   000    -    354067
194 Temperature_Celsius     -O---K   066   051   040    -    34 (Min/Max 23/34)
196 Reallocated_Event_Count -O--CK   100   100   000    -    0
197 Current_Pending_Sector  -O--CK   100   100   000    -    0
198 Offline_Uncorrectable   ----CK   100   100   000    -    0
199 UDMA_CRC_Error_Count    -O--CK   200   253   000    -    2993
                            ||||||_ K auto-keep
                            |||||__ C event count
                            ||||___ R error rate
                            |||____ S speed/performance
                            ||_____ O updated online
                            |______ P prefailure warning

General Purpose Log Directory Version 1
SMART           Log Directory Version 1 [multi-sector log support]
Address    Access  R/W   Size  Description
0x00       GPL,SL  R/O      1  Log Directory
0x01           SL  R/O      1  Summary SMART error log
0x02           SL  R/O     51  Comprehensive SMART error log
0x03       GPL     R/O     64  Ext. Comprehensive SMART error log
0x04       GPL,SL  R/O      8  Device Statistics log
0x06           SL  R/O      1  SMART self-test log
0x07       GPL     R/O      1  Extended self-test log
0x09           SL  R/W      1  Selective self-test log
0x10       GPL     R/O      1  NCQ Command Error log
0x11       GPL     R/O      1  SATA Phy Event Counters log
0x80-0x9f  GPL,SL  R/W     16  Host vendor specific log
0xb6       GPL     VS    8191  Device vendor specific log
0xe0       GPL,SL  R/W      1  SCT Command/Status
0xe1       GPL,SL  R/W      1  SCT Data Transfer

SMART Extended Comprehensive Error Log Version: 1 (64 sectors)
Device Error Count: 2993 (device log contains only the most recent 256 errors)
	CR     = Command Register
	FEATR  = Features Register
	COUNT  = Count (was: Sector Count) Register
	LBA_48 = Upper bytes of LBA High/Mid/Low Registers ]  ATA-8
	LH     = LBA High (was: Cylinder High) Register    ]   LBA
	LM     = LBA Mid (was: Cylinder Low) Register      ] Register
	LL     = LBA Low (was: Sector Number) Register     ]
	DV     = Device (was: Device/Head) Register
	DC     = Device Control Register
	ER     = Error register
	ST     = Status register
Powered_Up_Time is measured from power on, and printed as
DDd+hh:mm:SS.sss where DD=days, hh=hours, mm=minutes,
SS=sec, and sss=millisec. It "wraps" after 49.710 days.

Error 2993 [176] occurred at disk power-on lifetime: 36522 hours (1521 days + 18 hours)
  When the command that caused the error occurred, the device was active or idle.

  After command completion occurred, registers were:
  ER -- ST COUNT  LBA_48  LH LM LL DV DC
  -- -- -- == -- == == == -- -- -- -- --
  84 -- 41 00 a0 00 00 12 b8 5b e7 40 00  Error: ABRT

  Commands leading to the command that caused the error were:
  CR FEATR COUNT  LBA_48  LH LM LL DV DC  Powered_Up_Time  Command/Feature_Name
  -- == -- == -- == == == -- -- -- -- --  ---------------  --------------------
  2f 00 00 00 01 00 00 00 00 00 10 e0 00     06:15:49.552  READ LOG EXT
  61 00 08 00 a0 00 00 12 b8 5b e0 40 00     06:15:49.551  WRITE FPDMA QUEUED
  ef 00 90 00 03 00 00 00 00 00 00 a0 00     06:15:48.861  SET FEATURES [Disable SATA feature]
  ef 00 02 00 00 00 00 00 00 00 00 a0 00     06:15:48.861  SET FEATURES [Enable write cache]
  ef 00 02 00 00 00 00 00 00 00 00 a0 00     06:15:48.860  SET FEATURES [Enable write cache]

Error 2992 [175] occurred at disk power-on lifetime: 36522 hours (1521 days + 18 hours)
  When the command that caused the error occurred, the device was active or idle.

  After command completion occurred, registers were:
  ER -- ST COUNT  LBA_48  LH LM LL DV DC
  -- -- -- == -- == == == -- -- -- -- --
  84 -- 41 00 98 00 00 12 5a a6 38 40 00  Error: ICRC, ABRT at LBA = 0x125aa638 = 307930680

  Commands leading to the command that caused the error were:
  CR FEATR COUNT  LBA_48  LH LM LL DV DC  Powered_Up_Time  Command/Feature_Name
  -- == -- == -- == == == -- -- -- -- --  ---------------  --------------------
  61 00 3d 00 98 00 00 12 5a a5 fc 40 00     06:15:48.751  WRITE FPDMA QUEUED
  ef 00 90 00 03 00 00 00 00 00 00 a0 00     06:15:47.797  SET FEATURES [Disable SATA feature]
  ef 00 02 00 00 00 00 00 00 00 00 a0 00     06:15:47.796  SET FEATURES [Enable write cache]
  ef 00 02 00 00 00 00 00 00 00 00 a0 00     06:15:47.796  SET FEATURES [Enable write cache]
  aa aa aa aa aa aa aa aa aa aa aa aa ff     06:15:47.762  [RESERVED]

Error 2991 [174] occurred at disk power-on lifetime: 36522 hours (1521 days + 18 hours)
  When the command that caused the error occurred, the device was active or idle.

  After command completion occurred, registers were:
  ER -- ST COUNT  LBA_48  LH LM LL DV DC
  -- -- -- == -- == == == -- -- -- -- --
  84 -- 41 00 90 00 00 12 5a a6 38 40 00  Error: ICRC, ABRT at LBA = 0x125aa638 = 307930680

  Commands leading to the command that caused the error were:
  CR FEATR COUNT  LBA_48  LH LM LL DV DC  Powered_Up_Time  Command/Feature_Name
  -- == -- == -- == == == -- -- -- -- --  ---------------  --------------------
  61 00 3d 00 90 00 00 12 5a a5 fc 40 00     06:15:47.690  WRITE FPDMA QUEUED
  61 00 01 00 88 00 00 12 5a a6 db 40 00     06:15:47.680  WRITE FPDMA QUEUED
  60 00 40 00 80 00 00 12 5a a6 d8 40 00     06:15:47.675  READ FPDMA QUEUED
  ea 00 00 00 00 00 00 00 00 00 00 a0 00     06:15:47.655  FLUSH CACHE EXT
  61 00 08 00 70 00 00 12 b8 5b 60 40 00     06:15:47.654  WRITE FPDMA QUEUED

Error 2990 [173] occurred at disk power-on lifetime: 36516 hours (1521 days + 12 hours)
  When the command that caused the error occurred, the device was active or idle.

  After command completion occurred, registers were:
  ER -- ST COUNT  LBA_48  LH LM LL DV DC
  -- -- -- == -- == == == -- -- -- -- --
  84 -- 41 00 40 00 00 12 b8 5c 8f 40 00  Error: ABRT

  Commands leading to the command that caused the error were:
  CR FEATR COUNT  LBA_48  LH LM LL DV DC  Powered_Up_Time  Command/Feature_Name
  -- == -- == -- == == == -- -- -- -- --  ---------------  --------------------
  2f 00 00 00 01 00 00 00 00 00 10 e0 00     00:05:35.173  READ LOG EXT
  61 00 08 00 40 00 00 12 b8 5c 88 40 00     00:05:35.172  WRITE FPDMA QUEUED
  61 00 08 00 38 00 00 12 ba 80 48 40 00     00:05:32.581  WRITE FPDMA QUEUED
  61 00 08 00 30 00 00 12 ba 80 50 40 00     00:05:32.580  WRITE FPDMA QUEUED
  ea 00 00 00 00 00 00 00 00 00 00 a0 00     00:05:32.578  FLUSH CACHE EXT

Error 2989 [172] occurred at disk power-on lifetime: 36516 hours (1521 days + 12 hours)
  When the command that caused the error occurred, the device was active or idle.

  After command completion occurred, registers were:
  ER -- ST COUNT  LBA_48  LH LM LL DV DC
  -- -- -- == -- == == == -- -- -- -- --
  84 -- 41 00 88 00 00 12 b8 5c 7f 40 00  Error: ABRT

  Commands leading to the command that caused the error were:
  CR FEATR COUNT  LBA_48  LH LM LL DV DC  Powered_Up_Time  Command/Feature_Name
  -- == -- == -- == == == -- -- -- -- --  ---------------  --------------------
  2f 00 00 00 01 00 00 00 00 00 10 e0 00     00:01:08.922  READ LOG EXT
  61 00 08 00 88 00 00 12 b8 5c 78 40 00     00:01:08.921  WRITE FPDMA QUEUED
  61 00 08 00 80 00 00 13 19 eb d0 40 00     00:01:03.771  WRITE FPDMA QUEUED
  61 00 08 00 78 00 00 12 b8 5b 58 40 00     00:00:58.711  WRITE FPDMA QUEUED
  ea 00 00 00 00 00 00 00 00 00 00 a0 00     00:00:58.682  FLUSH CACHE EXT

Error 2988 [171] occurred at disk power-on lifetime: 36516 hours (1521 days + 12 hours)
  When the command that caused the error occurred, the device was active or idle.

  After command completion occurred, registers were:
  ER -- ST COUNT  LBA_48  LH LM LL DV DC
  -- -- -- == -- == == == -- -- -- -- --
  84 -- 41 00 c0 00 00 12 b8 5b e7 40 00  Error: ABRT

  Commands leading to the command that caused the error were:
  CR FEATR COUNT  LBA_48  LH LM LL DV DC  Powered_Up_Time  Command/Feature_Name
  -- == -- == -- == == == -- -- -- -- --  ---------------  --------------------
  2f 00 00 00 01 00 00 00 00 00 10 e0 00     00:00:56.160  READ LOG EXT
  61 00 08 00 c0 00 00 12 b8 5b e0 40 00     00:00:56.160  WRITE FPDMA QUEUED
  60 00 3d 00 b8 00 00 12 5a a6 39 40 00     00:00:56.159  READ FPDMA QUEUED
  60 00 3d 00 b0 00 00 12 5a a5 fc 40 00     00:00:56.159  READ FPDMA QUEUED
  60 00 02 00 a8 00 00 12 5a a5 fa 40 00     00:00:56.159  READ FPDMA QUEUED

Error 2987 [170] occurred at disk power-on lifetime: 36486 hours (1520 days + 6 hours)
  When the command that caused the error occurred, the device was active or idle.

  After command completion occurred, registers were:
  ER -- ST COUNT  LBA_48  LH LM LL DV DC
  -- -- -- == -- == == == -- -- -- -- --
  84 -- 41 00 18 00 00 20 d7 78 87 40 00  Error: ICRC, ABRT at LBA = 0x20d77887 = 550992007

  Commands leading to the command that caused the error were:
  CR FEATR COUNT  LBA_48  LH LM LL DV DC  Powered_Up_Time  Command/Feature_Name
  -- == -- == -- == == == -- -- -- -- --  ---------------  --------------------
  61 00 08 00 18 00 00 20 d7 78 80 40 00     12:08:16.265  WRITE FPDMA QUEUED
  ea 00 00 00 00 00 00 00 00 00 00 a0 00     12:08:16.186  FLUSH CACHE EXT
  61 00 40 00 08 00 00 21 0c 1d 00 40 00     12:08:16.185  WRITE FPDMA QUEUED
  61 00 40 00 00 00 00 20 ec 1d 00 40 00     12:08:16.185  WRITE FPDMA QUEUED
  61 02 b0 00 f8 00 00 21 dd 8f 38 40 00     12:08:16.182  WRITE FPDMA QUEUED

Error 2986 [169] occurred at disk power-on lifetime: 36486 hours (1520 days + 6 hours)
  When the command that caused the error occurred, the device was active or idle.

  After command completion occurred, registers were:
  ER -- ST COUNT  LBA_48  LH LM LL DV DC
  -- -- -- == -- == == == -- -- -- -- --
  84 -- 41 00 50 00 00 21 94 da c7 40 00  Error: ICRC, ABRT at LBA = 0x2194dac7 = 563403463

  Commands leading to the command that caused the error were:
  CR FEATR COUNT  LBA_48  LH LM LL DV DC  Powered_Up_Time  Command/Feature_Name
  -- == -- == -- == == == -- -- -- -- --  ---------------  --------------------
  61 02 a8 00 50 00 00 21 94 d8 20 40 00     12:07:58.848  WRITE FPDMA QUEUED
  60 00 a0 00 38 00 00 28 94 3a 50 40 00     12:07:58.548  READ FPDMA QUEUED
  ea 00 00 00 00 00 00 00 00 00 00 a0 00     12:07:57.984  FLUSH CACHE EXT
  61 00 08 00 48 00 00 20 d7 78 80 40 00     12:07:57.983  WRITE FPDMA QUEUED
  ea 00 00 00 00 00 00 00 00 00 00 a0 00     12:07:57.969  FLUSH CACHE EXT

SMART Extended Self-test Log Version: 1 (1 sectors)
Num  Test_Description    Status                  Remaining  LifeTime(hours)  LBA_of_first_error
# 1  Short offline       Completed without error       00%     39343         -
# 2  Short offline       Completed without error       00%     39326         -
# 3  Short offline       Completed without error       00%     39305         -
# 4  Short offline       Completed without error       00%     39264         -
# 5  Extended offline    Interrupted (host reset)      40%     39246         -
# 6  Short offline       Completed without error       00%     39223         -
# 7  Short offline       Completed without error       00%     39201         -
# 8  Short offline       Completed without error       00%     39185         -
# 9  Short offline       Completed without error       00%     39169         -
#10  Short offline       Completed without error       00%     39145         -
#11  Short offline       Completed without error       00%     39132         -
#12  Short offline       Completed without error       00%     39127         -
#13  Short offline       Completed without error       00%     39108         -
#14  Short offline       Completed without error       00%     39061         -
#15  Short offline       Completed without error       00%     39042         -
#16  Short offline       Completed without error       00%     39023         -
#17  Short offline       Completed without error       00%     38985         -
#18  Short offline       Completed without error       00%     38940         -
#19  Short offline       Completed without error       00%     38931         -

SMART Selective self-test log data structure revision number 1
 SPAN  MIN_LBA  MAX_LBA  CURRENT_TEST_STATUS
    1        0        0  Not_testing
    2        0        0  Not_testing
    3        0        0  Not_testing
    4        0        0  Not_testing
    5        0        0  Not_testing
Selective self-test flags (0x0):
  After scanning selected spans, do NOT read-scan remainder of disk.
If Selective self-test is pending on power-up, resume after 0 minute delay.

SCT Status Version:                  2
SCT Version (vendor specific):       1 (0x0001)
Device State:                        Active (0)
Current Temperature:                    34 Celsius
Power Cycle Min/Max Temperature:     23/34 Celsius
Lifetime    Min/Max Temperature:      7/49 Celsius
Under/Over Temperature Limit Count:   0/0

SCT Temperature History Version:     2
Temperature Sampling Period:         1 minute
Temperature Logging Interval:        1 minute
Min/Max recommended Temperature:      0/60 Celsius
Min/Max Temperature Limit:            0/60 Celsius
Temperature History Size (Index):    478 (87)

SCT Error Recovery Control:
           Read: Disabled
          Write: Disabled

Device Statistics (GP Log 0x04)
Page  Offset Size        Value Flags Description
0x01  =====  =               =  ===  == General Statistics (rev 2) ==
0x01  0x008  4            2774  ---  Lifetime Power-On Resets
0x01  0x010  4           39338  ---  Power-on Hours
0x01  0x018  6     48960847931  ---  Logical Sectors Written
0x01  0x020  6       760708642  ---  Number of Write Commands
0x01  0x028  6     55198212776  ---  Logical Sectors Read
0x01  0x030  6      1229687265  ---  Number of Read Commands
0x02  =====  =               =  ===  == Free-Fall Statistics (rev 1) ==
0x02  0x010  4             153  ---  Overlimit Shock Events
0x03  =====  =               =  ===  == Rotating Media Statistics (rev 1) ==
0x03  0x008  4           38438  ---  Spindle Motor Power-on Hours
0x03  0x010  4           36477  ---  Head Flying Hours
0x03  0x018  4          354067  ---  Head Load Events
0x03  0x020  4               0  ---  Number of Reallocated Logical Sectors
0x03  0x028  4               0  ---  Read Recovery Attempts
0x03  0x030  4               0  ---  Number of Mechanical Start Failures
0x04  =====  =               =  ===  == General Errors Statistics (rev 1) ==
0x04  0x008  4               0  ---  Number of Reported Uncorrectable Errors
0x04  0x010  4            4814  ---  Resets Between Cmd Acceptance and Completion
0x05  =====  =               =  ===  == Temperature Statistics (rev 1) ==
0x05  0x008  1              34  ---  Current Temperature
0x05  0x010  1              33  N--  Average Short Term Temperature
0x05  0x018  1              28  N--  Average Long Term Temperature
0x05  0x020  1              49  ---  Highest Temperature
0x05  0x028  1               7  ---  Lowest Temperature
0x05  0x030  1              41  N--  Highest Average Short Term Temperature
0x05  0x038  1              23  N--  Lowest Average Short Term Temperature
0x05  0x040  1              38  N--  Highest Average Long Term Temperature
0x05  0x048  1              27  N--  Lowest Average Long Term Temperature
0x05  0x050  4               0  ---  Time in Over-Temperature
0x05  0x058  1              60  ---  Specified Maximum Operating Temperature
0x05  0x060  4               0  ---  Time in Under-Temperature
0x05  0x068  1               0  ---  Specified Minimum Operating Temperature
0x06  =====  =               =  ===  == Transport Statistics (rev 1) ==
0x06  0x008  4           27695  ---  Number of Hardware Resets
0x06  0x018  4            2993  ---  Number of Interface CRC Errors
0x07  =====  =               =  ===  == Solid State Device Statistics (rev 1) ==
0x07  0x008  1              65  N--  Percentage Used Endurance Indicator
                                |||_ C monitored condition met
                                ||__ D supports DSN
                                |___ N normalized value

Pending Defects log (GP Log 0x0c) not supported

SATA Phy Event Counters (GP Log 0x11)
ID      Size     Value  Description
0x0001  4            0  Command failed due to ICRC error
0x0002  4            0  R_ERR response for data FIS
0x0003  4            0  R_ERR response for device-to-host data FIS
0x0004  4            0  R_ERR response for host-to-device data FIS
0x0005  4            0  R_ERR response for non-data FIS
0x0006  4            0  R_ERR response for device-to-host non-data FIS
0x0007  4            0  R_ERR response for host-to-device non-data FIS
0x0008  4            0  Device-to-host non-data FIS retries
0x0009  4            7  Transition from drive PhyRdy to drive PhyNRdy
0x000a  4            6  Device-to-host register FISes sent due to a COMRESET
0x000b  4            0  CRC errors within host-to-device FIS
0x000d  4            0  Non-CRC errors within host-to-device FIS
0x000f  4            0  R_ERR response for host-to-device data FIS, CRC
0x0010  4            0  R_ERR response for host-to-device data FIS, non-CRC
0x0012  4            0  R_ERR response for host-to-device non-data FIS, CRC
0x0013  4            0  R_ERR response for host-to-device non-data FIS, non-CRC

