smartctl 7.4 2023-08-01 r5530 [x86_64-linux-6.5.6-200.fc38.x86_64] (local build)
Copyright (C) 2002-23, Bruce Allen, Christian Franke, www.smartmontools.org

=== START OF INFORMATION SECTION ===
Device Model:     XrayDisk 480GB SSD
Serial Number:    --
LU WWN Device Id: 0 000000 ...
Firmware Version: FW201219
User Capacity:    480,103,981,056 bytes [480 GB]
Sector Size:      512 bytes logical/physical
Rotation Rate:    Solid State Device
Form Factor:      2.5 inches
TRIM Command:     Available
Device is:        Not in smartctl database 7.3/5528
ATA Version is:   ACS-2 T13/2015-D revision 3
SATA Version is:  SATA 3.2, 6.0 Gb/s (current: 6.0 Gb/s)
Local Time is:    Tue Oct 17 09:01:21 2023 EDT
SMART support is: Available - device has SMART capability.
SMART support is: Enabled
AAM feature is:   Unavailable
APM feature is:   Unavailable
Rd look-ahead is: Enabled
Write cache is:   Enabled
DSN feature is:   Unavailable
ATA Security is:  Disabled, frozen [SEC2]
Wt Cache Reorder: Unavailable

=== START OF READ SMART DATA SECTION ===
SMART overall-health self-assessment test result: PASSED

General SMART Values:
Offline data collection status:  (0x00)	Offline data collection activity
					was never started.
					Auto Offline Data Collection: Disabled.
Self-test execution status:      (   0)	The previous self-test routine completed
					without error or no self-test has ever 
					been run.
Total time to complete Offline 
data collection: 		(  120) seconds.
Offline data collection
capabilities: 			 (0x5d) SMART execute Offline immediate.
					No Auto Offline data collection support.
					Abort Offline collection upon new
					command.
					Offline surface scan supported.
					Self-test supported.
					No Conveyance Self-test supported.
					Selective Self-test supported.
SMART capabilities:            (0x0002)	Does not save SMART data before
					entering power-saving mode.
					Supports SMART auto save timer.
Error logging capability:        (0x01)	Error logging supported.
					General Purpose Logging supported.
Short self-test routine 
recommended polling time: 	 (   2) minutes.
Extended self-test routine
recommended polling time: 	 (   4) minutes.

SMART Attributes Data Structure revision number: 1
Vendor Specific SMART Attributes with Thresholds:
ID# ATTRIBUTE_NAME          FLAGS    VALUE WORST THRESH FAIL RAW_VALUE
  1 Raw_Read_Error_Rate     -O--CK   100   100   050    -    0
  5 Reallocated_Sector_Ct   -O--CK   100   100   050    -    0
  9 Power_On_Hours          -O--CK   100   100   050    -    3469
 12 Power_Cycle_Count       -O--CK   100   100   050    -    2619
160 Unknown_Attribute       -O--CK   100   100   050    -    0
161 Unknown_Attribute       -O--CK   100   100   050    -    0
163 Unknown_Attribute       -O--CK   100   100   050    -    258
164 Unknown_Attribute       -O--CK   100   100   050    -    89
165 Unknown_Attribute       -O--CK   100   100   050    -    142
166 Unknown_Attribute       -O--CK   100   100   050    -    62
167 Unknown_Attribute       -O--CK   100   100   050    -    104
168 Unknown_Attribute       -O--CK   100   100   050    -    0
169 Unknown_Attribute       -O--CK   100   100   050    -    100
175 Program_Fail_Count_Chip -O--CK   100   100   050    -    134217728
176 Erase_Fail_Count_Chip   -O--CK   100   100   050    -    811315
177 Wear_Leveling_Count     -O--CK   100   100   050    -    3837872
178 Used_Rsvd_Blk_Cnt_Chip  -O--CK   100   100   050    -    1
181 Program_Fail_Cnt_Total  -O--CK   100   100   050    -    0
182 Erase_Fail_Count_Total  -O--CK   100   100   050    -    0
192 Power-Off_Retract_Count -O--CK   100   100   050    -    19
194 Temperature_Celsius     -O--CK   100   100   050    -    41
198 Offline_Uncorrectable   -O--CK   100   100   050    -    0
232 Available_Reservd_Space -O--CK   100   100   050    -    0
241 Total_LBAs_Written      -O--CK   100   100   050    -    277273
242 Total_LBAs_Read         -O--CK   100   100   050    -    254980
249 Unknown_Attribute       -O--CK   100   100   050    -    298023
                            ||||||_ K auto-keep
                            |||||__ C event count
                            ||||___ R error rate
                            |||____ S speed/performance
                            ||_____ O updated online
                            |______ P prefailure warning

General Purpose Log Directory Version 1
SMART           Log Directory Version 1 [multi-sector log support]
Address    Access  R/W   Size  Description
0x00       GPL,SL  R/O      1  Log Directory
0x01       GPL,SL  R/O      1  Summary SMART error log
0x02       GPL,SL  R/O      1  Comprehensive SMART error log
0x03       GPL,SL  R/O      1  Ext. Comprehensive SMART error log
0x04       GPL,SL  R/O      8  Device Statistics log
0x06       GPL,SL  R/O      1  SMART self-test log
0x07       GPL,SL  R/O      1  Extended self-test log
0x09       GPL,SL  R/W      1  Selective self-test log
0x10       GPL,SL  R/O      1  NCQ Command Error log
0x11       GPL,SL  R/O      1  SATA Phy Event Counters log
0x30       GPL,SL  R/O      9  IDENTIFY DEVICE data log
0x80-0x9f  GPL,SL  R/W     16  Host vendor specific log
0xa0       GPL,SL  VS      16  Device vendor specific log
0xe0       GPL,SL  R/W      1  SCT Command/Status
0xe1       GPL,SL  R/W      1  SCT Data Transfer

SMART Extended Comprehensive Error Log Version: 1 (1 sectors)
Device Error Count: 128 (device log contains only the most recent 4 errors)
	CR     = Command Register
	FEATR  = Features Register
	COUNT  = Count (was: Sector Count) Register
	LBA_48 = Upper bytes of LBA High/Mid/Low Registers ]  ATA-8
	LH     = LBA High (was: Cylinder High) Register    ]   LBA
	LM     = LBA Mid (was: Cylinder Low) Register      ] Register
	LL     = LBA Low (was: Sector Number) Register     ]
	DV     = Device (was: Device/Head) Register
	DC     = Device Control Register
	ER     = Error register
	ST     = Status register
Powered_Up_Time is measured from power on, and printed as
DDd+hh:mm:SS.sss where DD=days, hh=hours, mm=minutes,
SS=sec, and sss=millisec. It "wraps" after 49.710 days.

Error 128 [3] occurred at disk power-on lifetime: 3463 hours (144 days + 7 hours)
  When the command that caused the error occurred, the device was in an unknown state.

  After command completion occurred, registers were:
  ER -- ST COUNT  LBA_48  LH LM LL DV DC
  -- -- -- == -- == == == -- -- -- -- --
  04 -- 40 00 40 00 2f 9c 00 5a 78 00 00   at LBA = 0x2f9c005a78 = 204480731768

  Commands leading to the command that caused the error were:
  CR FEATR COUNT  LBA_48  LH LM LL DV DC  Powered_Up_Time  Command/Feature_Name
  -- == -- == -- == == == -- -- -- -- --  ---------------  --------------------
  60 00 48 00 40 00 2f 9c 00 5a 78 40 08     00:00:26.160  READ FPDMA QUEUED
  60 00 20 00 38 00 2f 9c 00 5a 58 40 08     00:00:26.160  READ FPDMA QUEUED
  60 00 10 00 30 00 2b c0 00 08 98 40 08     00:00:26.160  READ FPDMA QUEUED
  60 00 20 00 28 00 2b c0 00 08 78 40 08     00:00:26.160  READ FPDMA QUEUED
  60 00 20 00 20 00 2f 95 00 5a 70 40 08     00:00:26.160  READ FPDMA QUEUED

Error 127 [2] occurred at disk power-on lifetime: 3460 hours (144 days + 4 hours)
  When the command that caused the error occurred, the device was in an unknown state.

  After command completion occurred, registers were:
  ER -- ST COUNT  LBA_48  LH LM LL DV DC
  -- -- -- == -- == == == -- -- -- -- --
  04 -- 40 00 98 00 33 82 00 57 30 00 00   at LBA = 0x3382005730 = 221224392496

  Commands leading to the command that caused the error were:
  CR FEATR COUNT  LBA_48  LH LM LL DV DC  Powered_Up_Time  Command/Feature_Name
  -- == -- == -- == == == -- -- -- -- --  ---------------  --------------------
  60 01 00 00 98 00 33 82 00 57 30 40 08     00:15:11.510  READ FPDMA QUEUED
  60 01 00 00 90 00 33 81 00 57 30 40 08     00:15:11.510  READ FPDMA QUEUED
  60 01 00 00 88 00 33 80 00 57 30 40 08     00:15:11.510  READ FPDMA QUEUED
  60 01 00 00 80 00 33 7f 00 57 30 40 08     00:15:11.510  READ FPDMA QUEUED
  60 01 00 00 78 00 33 7e 00 57 30 40 08     00:15:11.510  READ FPDMA QUEUED

Error 126 [1] occurred at disk power-on lifetime: 3458 hours (144 days + 2 hours)
  When the command that caused the error occurred, the device was in an unknown state.

  After command completion occurred, registers were:
  ER -- ST COUNT  LBA_48  LH LM LL DV DC
  -- -- -- == -- == == == -- -- -- -- --
  04 -- 40 00 80 00 05 80 00 0f 88 00 00   at LBA = 0x580000f88 = 23622324104

  Commands leading to the command that caused the error were:
  CR FEATR COUNT  LBA_48  LH LM LL DV DC  Powered_Up_Time  Command/Feature_Name
  -- == -- == -- == == == -- -- -- -- --  ---------------  --------------------
  60 00 40 00 80 00 05 80 00 0f 88 40 00     01:52:07.770  READ FPDMA QUEUED
  60 00 40 00 78 00 05 80 00 0f 30 40 00     01:52:07.770  READ FPDMA QUEUED
  60 00 08 00 70 00 05 f5 00 71 e0 40 00     01:52:07.770  READ FPDMA QUEUED
  60 00 0a 00 68 00 00 f9 00 3e c0 40 00     01:52:07.770  READ FPDMA QUEUED
  60 00 40 00 60 00 00 f9 00 3e 80 40 00     01:52:07.770  READ FPDMA QUEUED

Error 125 [0] occurred at disk power-on lifetime: 3426 hours (142 days + 18 hours)
  When the command that caused the error occurred, the device was in an unknown state.

  After command completion occurred, registers were:
  ER -- ST COUNT  LBA_48  LH LM LL DV DC
  -- -- -- == -- == == == -- -- -- -- --
  04 -- 40 00 70 00 00 7e 00 73 f8 00 00   at LBA = 0x7e0073f8 = 2113958904

  Commands leading to the command that caused the error were:
  CR FEATR COUNT  LBA_48  LH LM LL DV DC  Powered_Up_Time  Command/Feature_Name
  -- == -- == -- == == == -- -- -- -- --  ---------------  --------------------
  61 00 05 00 70 00 00 7e 00 73 f8 40 00     00:06:41.530  WRITE FPDMA QUEUED
  61 00 06 00 68 00 00 9f 00 73 a0 40 00     00:06:41.530  WRITE FPDMA QUEUED
  61 00 06 00 60 00 00 9f 00 73 a8 40 00     00:06:41.530  WRITE FPDMA QUEUED
  61 00 07 00 58 00 03 34 00 c8 b2 40 00     00:06:41.510  WRITE FPDMA QUEUED
  61 00 07 00 50 00 03 34 00 c8 ab 40 00     00:06:41.510  WRITE FPDMA QUEUED

SMART Extended Self-test Log Version: 0 (1 sectors)
No self-tests have been logged.  [To run self-tests, use: smartctl -t]

SMART Selective self-test log data structure revision number 0
Note: revision number not 1 implies that no selective self-test has ever been run
 SPAN  MIN_LBA  MAX_LBA  CURRENT_TEST_STATUS
    1        0        0  Not_testing
    2        0        0  Not_testing
    3        0        0  Not_testing
    4        0        0  Not_testing
    5        0        0  Not_testing
Selective self-test flags (0x0):
  After scanning selected spans, do NOT read-scan remainder of disk.
If Selective self-test is pending on power-up, resume after 0 minute delay.

SCT Commands not supported

Device Statistics (GP Log 0x04)
Page  Offset Size        Value Flags Description
0x01  =====  =               =  ===  == General Statistics (rev 1) ==
0x01  0x008  4            2619  ---  Lifetime Power-On Resets
0x01  0x010  4            3469  ---  Power-on Hours
0x01  0x018  6     18171363328  ---  Logical Sectors Written
0x01  0x020  6       219739111  ---  Number of Write Commands
0x01  0x028  6     16710369280  ---  Logical Sectors Read
0x01  0x030  6       195448025  ---  Number of Read Commands
0x01  =====  =               =  ===  == General Statistics (rev 1) ==
0x01  0x008  4            2619  ---  Lifetime Power-On Resets
0x01  0x010  4            3469  ---  Power-on Hours
0x01  0x018  6     18171363328  ---  Logical Sectors Written
0x01  0x020  6       219739111  ---  Number of Write Commands
0x01  0x028  6     16710369280  ---  Logical Sectors Read
0x01  0x030  6       195448025  ---  Number of Read Commands
0x01  =====  =               =  ===  == General Statistics (rev 1) ==
0x01  0x008  4            2619  ---  Lifetime Power-On Resets
0x01  0x010  4            3469  ---  Power-on Hours
0x01  0x018  6     18171363328  ---  Logical Sectors Written
0x01  0x020  6       219739111  ---  Number of Write Commands
0x01  0x028  6     16710369280  ---  Logical Sectors Read
0x01  0x030  6       195448025  ---  Number of Read Commands
0x01  =====  =               =  ===  == General Statistics (rev 1) ==
0x01  0x008  4            2619  ---  Lifetime Power-On Resets
0x01  0x010  4            3469  ---  Power-on Hours
0x01  0x018  6     18171363328  ---  Logical Sectors Written
0x01  0x020  6       219739111  ---  Number of Write Commands
0x01  0x028  6     16710369280  ---  Logical Sectors Read
0x01  0x030  6       195448025  ---  Number of Read Commands
0x01  =====  =               =  ===  == General Statistics (rev 1) ==
0x01  0x008  4            2619  ---  Lifetime Power-On Resets
0x01  0x010  4            3469  ---  Power-on Hours
0x01  0x018  6     18171363328  ---  Logical Sectors Written
0x01  0x020  6       219739111  ---  Number of Write Commands
0x01  0x028  6     16710369280  ---  Logical Sectors Read
0x01  0x030  6       195448025  ---  Number of Read Commands
0x01  =====  =               =  ===  == General Statistics (rev 1) ==
0x01  0x008  4            2619  ---  Lifetime Power-On Resets
0x01  0x010  4            3469  ---  Power-on Hours
0x01  0x018  6     18171363328  ---  Logical Sectors Written
0x01  0x020  6       219739111  ---  Number of Write Commands
0x01  0x028  6     16710369280  ---  Logical Sectors Read
0x01  0x030  6       195448025  ---  Number of Read Commands
0x01  =====  =               =  ===  == General Statistics (rev 1) ==
0x01  0x008  4            2619  ---  Lifetime Power-On Resets
0x01  0x010  4            3469  ---  Power-on Hours
0x01  0x018  6     18171363328  ---  Logical Sectors Written
0x01  0x020  6       219739111  ---  Number of Write Commands
0x01  0x028  6     16710369280  ---  Logical Sectors Read
0x01  0x030  6       195448025  ---  Number of Read Commands
0x01  =====  =               =  ===  == General Statistics (rev 1) ==
0x01  0x008  4            2619  ---  Lifetime Power-On Resets
0x01  0x010  4            3469  ---  Power-on Hours
0x01  0x018  6     18171363328  ---  Logical Sectors Written
0x01  0x020  6       219739111  ---  Number of Write Commands
0x01  0x028  6     16710369280  ---  Logical Sectors Read
0x01  0x030  6       195448025  ---  Number of Read Commands
                                |||_ C monitored condition met
                                ||__ D supports DSN
                                |___ N normalized value

Pending Defects log (GP Log 0x0c) not supported

SATA Phy Event Counters (GP Log 0x11)
ID      Size     Value  Description
0x0001  4            0  Command failed due to ICRC error
0x0009  4         6306  Transition from drive PhyRdy to drive PhyNRdy
0x000a  4         8760  Device-to-host register FISes sent due to a COMRESET
0x000b  4          149  CRC errors within host-to-device FIS
0x000d  4          149  Non-CRC errors within host-to-device FIS

