smartctl 7.1 2019-12-30 r5022 [x86_64-linux-5.7.11-200.fc32.x86_64] (local build)
Copyright (C) 2002-19, Bruce Allen, Christian Franke, www.smartmontools.org

=== START OF INFORMATION SECTION ===
Model Number:                       KINGSTON RBUSNS8154P3256GJ1
Serial Number:                      --
Firmware Version:                   E8FK12.3
PCI Vendor/Subsystem ID:            0x2646
IEEE OUI Identifier:                0x0026b7
Total NVM Capacity:                 256,060,514,304 [256 GB]
Unallocated NVM Capacity:           0
Controller ID:                      0
Number of Namespaces:               1
Namespace 1 Size/Capacity:          256,060,514,304 [256 GB]
Namespace 1 Formatted LBA Size:     512
Namespace 1 IEEE EUI-64:            0026b7 ...
Local Time is:                      Sat Aug  8 17:59:19 2020 CEST
Firmware Updates (0x12):            1 Slot, no Reset required
Optional Admin Commands (0x0007):   Security Format Frmw_DL
Optional NVM Commands (0x001e):     Wr_Unc DS_Mngmt Wr_Zero Sav/Sel_Feat
Maximum Data Transfer Size:         512 Pages
Warning  Comp. Temp. Threshold:     84 Celsius
Critical Comp. Temp. Threshold:     88 Celsius

Supported Power States
St Op     Max   Active     Idle   RL RT WL WT  Ent_Lat  Ex_Lat
 0 +     7.90W  0.0790W       -    0  0  0  0      600     600
 1 +     7.90W  0.0790W       -    0  0  0  0      600     600
 2 +     7.90W  0.0790W       -    0  0  0  0      600     600
 3 -   0.1000W  0.0790W       -    3  3  3  3     1000    1000
 4 -   0.0050W  0.0790W       -    4  4  4  4   400000   90000

Supported LBA Sizes (NSID 0x1)
Id Fmt  Data  Metadt  Rel_Perf
 0 +     512       0         1
 1 -    4096       0         0

=== START OF SMART DATA SECTION ===
SMART overall-health self-assessment test result: PASSED

SMART/Health Information (NVMe Log 0x02)
Critical Warning:                   0x00
Temperature:                        37 Celsius
Available Spare:                    100%
Available Spare Threshold:          100%
Percentage Used:                    0%
Data Units Read:                    148,099 [75.8 GB]
Data Units Written:                 267,984 [137 GB]
Host Read Commands:                 2,333,649
Host Write Commands:                1,679,921
Controller Busy Time:               2
Power Cycles:                       39
Power On Hours:                     4
Unsafe Shutdowns:                   8
Media and Data Integrity Errors:    0
Error Information Log Entries:      78
Warning  Comp. Temperature Time:    0
Critical Comp. Temperature Time:    0
Temperature Sensor 2:               37 Celsius

Error Information (NVMe Log 0x01, max 16 entries)
Num   ErrCount  SQId   CmdId  Status  PELoc          LBA  NSID    VS
  0         78     0  0x000c  0x0005      -   4009754624     1     -
  1         77     0  0x000a  0x0004      -     33555456     0     -
  2         76     0  0x000c  0x0005      -   4009754624     1     -
  3         75     0  0x000a  0x0004      -     33555456     0     -
  4         74     0  0x000c  0x0005      -   4009754624     1     -
  5         73     0  0x000a  0x0004      -     33555456     0     -
  6         72     0  0x000c  0x0005      -   4009754624     1     -
  7         71     0  0x000a  0x0004      -     33555456     0     -
  8         70     0  0x000c  0x0005      -   4009754624     1     -
  9         69     0  0x000a  0x0004      -     33555456     0     -
 10         68     0  0x000c  0x0005      -   4009754624     1     -
 11         67     0  0x000a  0x0004      -     33555456     0     -
 12         66     0  0x000c  0x0005      -   4009754624     1     -
 13         65     0  0x000a  0x0004      -     33555456     0     -
 14         64     0  0x000c  0x0005      -   4009754624     1     -
 15         63     0  0x000a  0x0004      -     33555456     0     -

