smartctl 7.2 2020-12-30 r5155 [x86_64-linux-6.8.0-76060800daily20240311-generic] (local build)
Copyright (C) 2002-20, Bruce Allen, Christian Franke, www.smartmontools.org

=== START OF INFORMATION SECTION ===
Model Number:                       KINGSTON RBUSNS8154P3256GJ1
Serial Number:                      --
Firmware Version:                   E8FK12.3
PCI Vendor/Subsystem ID:            0x2646
IEEE OUI Identifier:                0x0026b7
Total NVM Capacity:                 256,060,514,304 [256 GB]
Unallocated NVM Capacity:           0
Controller ID:                      0
NVMe Version:                       1.2
Number of Namespaces:               1
Namespace 1 Size/Capacity:          256,060,514,304 [256 GB]
Namespace 1 Formatted LBA Size:     512
Namespace 1 IEEE EUI-64:            0026b7 ...
Local Time is:                      Sun Apr 14 11:10:22 2024 AKDT
Firmware Updates (0x12):            1 Slot, no Reset required
Optional Admin Commands (0x0007):   Security Format Frmw_DL
Optional NVM Commands (0x001e):     Wr_Unc DS_Mngmt Wr_Zero Sav/Sel_Feat
Log Page Attributes (0x04):         Ext_Get_Lg
Maximum Data Transfer Size:         512 Pages
Warning  Comp. Temp. Threshold:     84 Celsius
Critical Comp. Temp. Threshold:     88 Celsius

Supported Power States
St Op     Max   Active     Idle   RL RT WL WT  Ent_Lat  Ex_Lat
 0 +     7.90W  0.0790W       -    0  0  0  0      600     600
 1 +     7.90W  0.0790W       -    0  0  0  0      600     600
 2 +     7.90W  0.0790W       -    0  0  0  0      600     600
 3 -   0.1000W  0.0790W       -    3  3  3  3     1000    1000
 4 -   0.0050W  0.0790W       -    4  4  4  4   400000   90000

Supported LBA Sizes (NSID 0x1)
Id Fmt  Data  Metadt  Rel_Perf
 0 +     512       0         1
 1 -    4096       0         0

=== START OF SMART DATA SECTION ===
SMART overall-health self-assessment test result: PASSED

SMART/Health Information (NVMe Log 0x02)
Critical Warning:                   0x00
Temperature:                        26 Celsius
Available Spare:                    100%
Available Spare Threshold:          100%
Percentage Used:                    16%
Data Units Read:                    49,904,910 [25.5 TB]
Data Units Written:                 27,702,880 [14.1 TB]
Host Read Commands:                 639,568,349
Host Write Commands:                356,930,685
Controller Busy Time:               855
Power Cycles:                       1,098
Power On Hours:                     594
Unsafe Shutdowns:                   172
Media and Data Integrity Errors:    0
Error Information Log Entries:      1,342
Warning  Comp. Temperature Time:    0
Critical Comp. Temperature Time:    0
Temperature Sensor 2:               26 Celsius

Error Information (NVMe Log 0x01, 16 of 16 entries)
Num   ErrCount  SQId   CmdId  Status  PELoc          LBA  NSID    VS
  0       1342     0  0x0010  0x0005      -            6     0     -
  1       1341     0  0x0005  0x0005      -           12     0     -
  2       1340     0  0x000f  0x0004      -   4009754624     1     -
  3       1339     0  0x0020  0x0005      -          127     1     -
  4       1338     0  0x001f  0x0005      -            3     1     -
  5       1337     0  0x000f  0x0004      -   4009754624     1     -
  6       1336     0  0x000f  0x0004      -   4009754624     1     -
  7       1335     0  0x000f  0x0004      -   4009754624     1     -
  8       1334     0  0x0014  0x0005      -            6     0     -
  9       1333     0  0x0001  0x0005      -           12     0     -
 10       1332     0  0x000f  0x0004      -   4009754624     1     -
 11       1331     0  0x000f  0x0004      -   4009754624     1     -
 12       1330     0  0x000f  0x0004      -   4009754624     1     -
 13       1329     0  0x0026  0x0005      -          127     1     -
 14       1328     0  0x0025  0x0005      -            3     1     -
 15       1327     0  0x0005  0x0005      -          208     0     -

