smartctl 7.2 2020-12-30 r5155 [x86_64-linux-5.10.74-generic-2rosa2021.1-x86_64] (local build)
Copyright (C) 2002-20, Bruce Allen, Christian Franke, www.smartmontools.org

=== START OF INFORMATION SECTION ===
Model Family:     Hitachi Travelstar 5K500.B
Device Model:     HTS545050B9A300
Serial Number:    --
LU WWN Device Id: 5 000cca ...
Firmware Version: PB4OC60F
User Capacity:    500,107,862,016 bytes [500 GB]
Sector Size:      512 bytes logical/physical
Rotation Rate:    5400 rpm
Form Factor:      2.5 inches
Device is:        In smartctl database [for details use: -P show]
ATA Version is:   ATA8-ACS T13/1699-D revision 6
SATA Version is:  SATA 2.6, 3.0 Gb/s
Local Time is:    Thu Feb 17 17:10:09 2022 CET
SMART support is: Available - device has SMART capability.
SMART support is: Enabled
AAM level is:     128 (quiet), recommended: 128
APM level is:     128 (minimum power consumption without standby)
Rd look-ahead is: Enabled
Write cache is:   Enabled
DSN feature is:   Unavailable
ATA Security is:  Disabled, frozen [SEC2]
Wt Cache Reorder: Enabled

=== START OF READ SMART DATA SECTION ===
SMART overall-health self-assessment test result: PASSED

General SMART Values:
Offline data collection status:  (0x85)	Offline data collection activity
					was aborted by an interrupting command from host.
					Auto Offline Data Collection: Enabled.
Self-test execution status:      (   0)	The previous self-test routine completed
					without error or no self-test has ever 
					been run.
Total time to complete Offline 
data collection: 		(  645) seconds.
Offline data collection
capabilities: 			 (0x5b) SMART execute Offline immediate.
					Auto Offline data collection on/off support.
					Suspend Offline collection upon new
					command.
					Offline surface scan supported.
					Self-test supported.
					No Conveyance Self-test supported.
					Selective Self-test supported.
SMART capabilities:            (0x0003)	Saves SMART data before entering
					power-saving mode.
					Supports SMART auto save timer.
Error logging capability:        (0x01)	Error logging supported.
					General Purpose Logging supported.
Short self-test routine 
recommended polling time: 	 (   2) minutes.
Extended self-test routine
recommended polling time: 	 ( 158) minutes.
SCT capabilities: 	       (0x003d)	SCT Status supported.
					SCT Error Recovery Control supported.
					SCT Feature Control supported.
					SCT Data Table supported.

SMART Attributes Data Structure revision number: 16
Vendor Specific SMART Attributes with Thresholds:
ID# ATTRIBUTE_NAME          FLAGS    VALUE WORST THRESH FAIL RAW_VALUE
  1 Raw_Read_Error_Rate     PO-R--   100   100   062    -    0
  2 Throughput_Performance  P-S---   100   100   040    -    1843
  3 Spin_Up_Time            POS---   142   142   033    -    2
  4 Start_Stop_Count        -O--C-   096   096   000    -    7308
  5 Reallocated_Sector_Ct   PO--CK   100   100   005    -    0
  7 Seek_Error_Rate         PO-R--   100   100   067    -    0
  8 Seek_Time_Performance   P-S---   100   100   040    -    0
  9 Power_On_Hours          -O--C-   081   081   000    -    8616
 10 Spin_Retry_Count        PO--C-   100   100   060    -    0
 12 Power_Cycle_Count       -O--CK   096   096   000    -    6388
191 G-Sense_Error_Rate      -O-R--   100   100   000    -    0
192 Power-Off_Retract_Count -O--CK   097   097   000    -    726
193 Load_Cycle_Count        -O--C-   069   069   000    -    318193
194 Temperature_Celsius     -O----   220   220   000    -    25 (Min/Max 2/48)
196 Reallocated_Event_Count -O--CK   100   100   000    -    0
197 Current_Pending_Sector  -O---K   100   100   000    -    0
198 Offline_Uncorrectable   ---R--   100   100   000    -    0
199 UDMA_CRC_Error_Count    -O-R--   200   200   000    -    877
223 Load_Retry_Count        -O-R--   100   100   000    -    0
                            ||||||_ K auto-keep
                            |||||__ C event count
                            ||||___ R error rate
                            |||____ S speed/performance
                            ||_____ O updated online
                            |______ P prefailure warning

General Purpose Log Directory Version 1
SMART           Log Directory Version 1 [multi-sector log support]
Address    Access  R/W   Size  Description
0x00       GPL,SL  R/O      1  Log Directory
0x01           SL  R/O      1  Summary SMART error log
0x02           SL  R/O      1  Comprehensive SMART error log
0x03       GPL     R/O      1  Ext. Comprehensive SMART error log
0x06           SL  R/O      1  SMART self-test log
0x07       GPL     R/O      1  Extended self-test log
0x09           SL  R/W      1  Selective self-test log
0x10       GPL     R/O      1  NCQ Command Error log
0x11       GPL     R/O      1  SATA Phy Event Counters log
0x80-0x9f  GPL,SL  R/W     16  Host vendor specific log
0xe0       GPL,SL  R/W      1  SCT Command/Status
0xe1       GPL,SL  R/W      1  SCT Data Transfer

SMART Extended Comprehensive Error Log Version: 1 (1 sectors)
Device Error Count: 436 (device log contains only the most recent 4 errors)
	CR     = Command Register
	FEATR  = Features Register
	COUNT  = Count (was: Sector Count) Register
	LBA_48 = Upper bytes of LBA High/Mid/Low Registers ]  ATA-8
	LH     = LBA High (was: Cylinder High) Register    ]   LBA
	LM     = LBA Mid (was: Cylinder Low) Register      ] Register
	LL     = LBA Low (was: Sector Number) Register     ]
	DV     = Device (was: Device/Head) Register
	DC     = Device Control Register
	ER     = Error register
	ST     = Status register
Powered_Up_Time is measured from power on, and printed as
DDd+hh:mm:SS.sss where DD=days, hh=hours, mm=minutes,
SS=sec, and sss=millisec. It "wraps" after 49.710 days.

Error 436 [3] occurred at disk power-on lifetime: 8575 hours (357 days + 7 hours)
  When the command that caused the error occurred, the device was active or idle.

  After command completion occurred, registers were:
  ER -- ST COUNT  LBA_48  LH LM LL DV DC
  -- -- -- == -- == == == -- -- -- -- --
  84 -- 51 00 00 00 00 00 fb 70 58 40 00  Error: ICRC, ABRT at LBA = 0x00fb7058 = 16478296

  Commands leading to the command that caused the error were:
  CR FEATR COUNT  LBA_48  LH LM LL DV DC  Powered_Up_Time  Command/Feature_Name
  -- == -- == -- == == == -- -- -- -- --  ---------------  --------------------
  61 00 10 00 d8 00 00 00 fb 78 80 40 08     00:00:39.800  WRITE FPDMA QUEUED
  61 00 08 00 d0 00 00 00 fb 77 10 40 08     00:00:39.800  WRITE FPDMA QUEUED
  61 00 10 00 c8 00 00 00 fb 76 f0 40 08     00:00:39.800  WRITE FPDMA QUEUED
  61 00 08 00 c0 00 00 00 fb 76 60 40 08     00:00:39.800  WRITE FPDMA QUEUED
  61 00 08 00 b8 00 00 00 fb 72 30 40 08     00:00:39.800  WRITE FPDMA QUEUED

Error 435 [2] occurred at disk power-on lifetime: 8533 hours (355 days + 13 hours)
  When the command that caused the error occurred, the device was active or idle.

  After command completion occurred, registers were:
  ER -- ST COUNT  LBA_48  LH LM LL DV DC
  -- -- -- == -- == == == -- -- -- -- --
  84 -- 51 00 01 00 00 00 00 00 01 a0 00  Error: ICRC, ABRT 1 sectors at LBA = 0x00000001 = 1

  Commands leading to the command that caused the error were:
  CR FEATR COUNT  LBA_48  LH LM LL DV DC  Powered_Up_Time  Command/Feature_Name
  -- == -- == -- == == == -- -- -- -- --  ---------------  --------------------
  35 00 00 00 10 00 00 00 00 00 12 40 ff     00:00:26.900  WRITE DMA EXT
  35 00 00 00 20 00 00 00 00 00 02 40 00     00:00:26.900  WRITE DMA EXT
  25 00 00 00 20 00 00 3a 38 60 0f 40 00     00:00:26.900  READ DMA EXT
  35 00 00 00 01 00 00 00 00 00 01 40 00     00:00:26.900  WRITE DMA EXT
  25 00 00 00 20 00 00 3a 38 60 0f 40 00     00:00:26.900  READ DMA EXT

Error 434 [1] occurred at disk power-on lifetime: 8533 hours (355 days + 13 hours)
  When the command that caused the error occurred, the device was active or idle.

  After command completion occurred, registers were:
  ER -- ST COUNT  LBA_48  LH LM LL DV DC
  -- -- -- == -- == == == -- -- -- -- --
  84 -- 51 00 01 00 00 00 00 00 01 a0 00  Error: ICRC, ABRT 1 sectors at LBA = 0x00000001 = 1

  Commands leading to the command that caused the error were:
  CR FEATR COUNT  LBA_48  LH LM LL DV DC  Powered_Up_Time  Command/Feature_Name
  -- == -- == -- == == == -- -- -- -- --  ---------------  --------------------
  35 00 00 00 10 00 00 00 00 00 12 40 ff     00:00:26.600  WRITE DMA EXT
  35 00 00 00 20 00 00 00 00 00 02 40 00     00:00:26.600  WRITE DMA EXT
  25 00 00 00 20 00 00 3a 38 60 0f 40 00     00:00:26.600  READ DMA EXT
  35 00 00 00 01 00 00 00 00 00 01 40 00     00:00:26.600  WRITE DMA EXT
  25 00 00 00 20 00 00 3a 38 60 0f 40 00     00:00:26.600  READ DMA EXT

Error 433 [0] occurred at disk power-on lifetime: 8533 hours (355 days + 13 hours)
  When the command that caused the error occurred, the device was active or idle.

  After command completion occurred, registers were:
  ER -- ST COUNT  LBA_48  LH LM LL DV DC
  -- -- -- == -- == == == -- -- -- -- --
  84 -- 51 00 01 00 00 00 00 00 01 a0 00  Error: ICRC, ABRT 1 sectors at LBA = 0x00000001 = 1

  Commands leading to the command that caused the error were:
  CR FEATR COUNT  LBA_48  LH LM LL DV DC  Powered_Up_Time  Command/Feature_Name
  -- == -- == -- == == == -- -- -- -- --  ---------------  --------------------
  35 00 00 00 10 00 00 00 00 00 12 40 ff     00:00:26.400  WRITE DMA EXT
  35 00 00 00 20 00 00 00 00 00 02 40 00     00:00:26.400  WRITE DMA EXT
  25 00 00 00 20 00 00 3a 38 60 0f 40 00     00:00:26.400  READ DMA EXT
  35 00 00 00 01 00 00 00 00 00 01 40 00     00:00:26.400  WRITE DMA EXT
  25 00 00 00 20 00 00 3a 38 60 0f 40 00     00:00:26.400  READ DMA EXT

SMART Extended Self-test Log Version: 1 (1 sectors)
Num  Test_Description    Status                  Remaining  LifeTime(hours)  LBA_of_first_error
# 1  Short offline       Completed without error       00%      8613         -
# 2  Short offline       Completed without error       00%      8600         -
# 3  Short offline       Completed without error       00%      8455         -
# 4  Short offline       Completed without error       00%      8076         -
# 5  Short offline       Completed without error       00%      8072         -
# 6  Short offline       Completed without error       00%      7668         -
# 7  Short offline       Completed without error       00%      7571         -
# 8  Short offline       Completed without error       00%      7379         -
# 9  Short offline       Completed without error       00%      7309         -
#10  Short offline       Completed without error       00%      7246         -
#11  Short offline       Completed without error       00%      7194         -
#12  Short offline       Completed without error       00%      7027         -
#13  Short offline       Completed without error       00%      7019         -
#14  Short offline       Completed without error       00%      6943         -
#15  Short offline       Completed without error       00%      6936         -

SMART Selective self-test log data structure revision number 1
 SPAN  MIN_LBA  MAX_LBA  CURRENT_TEST_STATUS
    1        0        0  Not_testing
    2        0        0  Not_testing
    3        0        0  Not_testing
    4        0        0  Not_testing
    5        0        0  Not_testing
Selective self-test flags (0x0):
  After scanning selected spans, do NOT read-scan remainder of disk.
If Selective self-test is pending on power-up, resume after 0 minute delay.

SCT Status Version:                  3
SCT Version (vendor specific):       256 (0x0100)
Device State:                        Active (0)
Current Temperature:                    25 Celsius
Power Cycle Min/Max Temperature:     23/25 Celsius
Lifetime    Min/Max Temperature:      2/48 Celsius
Specified Max Operating Temperature:    30 Celsius
Under/Over Temperature Limit Count:   0/0

SCT Temperature History Version:     2
Temperature Sampling Period:         1 minute
Temperature Logging Interval:        1 minute
Min/Max recommended Temperature:      5/60 Celsius
Min/Max Temperature Limit:           -40/65 Celsius
Temperature History Size (Index):    478 (98)

SCT Error Recovery Control:
           Read: Disabled
          Write: Disabled

Device Statistics (GP/SMART Log 0x04) not supported

Pending Defects log (GP Log 0x0c) not supported

SATA Phy Event Counters (GP Log 0x11)
ID      Size     Value  Description
0x0001  2            0  Command failed due to ICRC error
0x0002  2            0  R_ERR response for data FIS
0x0005  2            0  R_ERR response for non-data FIS
0x0009  2        16772  Transition from drive PhyRdy to drive PhyNRdy
0x000a  2            2  Device-to-host register FISes sent due to a COMRESET
0x000b  2            0  CRC errors within host-to-device FIS
0x000d  2            0  Non-CRC errors within host-to-device FIS

