smartctl 7.2 2020-12-30 r5155 [x86_64-linux-5.14.0-570.44.1.el9_6.x86_64] (local build)
Copyright (C) 2002-20, Bruce Allen, Christian Franke, www.smartmontools.org

=== START OF INFORMATION SECTION ===
Model Number:                       Nextorage SSD NEM-PAC4TB
Serial Number:                      --
Firmware Version:                   X0828AT
PCI Vendor/Subsystem ID:            0x1f31
IEEE OUI Identifier:                0x7cef40
Total NVM Capacity:                 4,096,805,658,624 [4.09 TB]
Unallocated NVM Capacity:           0
Controller ID:                      1
NVMe Version:                       1.4
Number of Namespaces:               1
Namespace 1 Size/Capacity:          4,096,805,658,624 [4.09 TB]
Namespace 1 Formatted LBA Size:     512
Namespace 1 IEEE EUI-64:            7cef40 ...
Local Time is:                      Fri Sep 26 03:09:57 2025 EDT
Firmware Updates (0x16):            3 Slots, no Reset required
Optional Admin Commands (0x0017):   Security Format Frmw_DL Self_Test
Optional NVM Commands (0x00df):     Comp Wr_Unc DS_Mngmt Wr_Zero Sav/Sel_Feat Timestmp Verify
Log Page Attributes (0x1e):         Cmd_Eff_Lg Ext_Get_Lg Telmtry_Lg Pers_Ev_Lg
Maximum Data Transfer Size:         64 Pages
Warning  Comp. Temp. Threshold:     86 Celsius
Critical Comp. Temp. Threshold:     93 Celsius

Supported Power States
St Op     Max   Active     Idle   RL RT WL WT  Ent_Lat  Ex_Lat
 0 +     7.50W       -        -    0  0  0  0        0       0
 1 +     7.00W       -        -    1  1  1  1        0       0
 2 +     6.50W       -        -    2  2  2  2        0       0
 3 -   0.0250W       -        -    3  3  3  3     5000    5000
 4 -   0.0040W       -        -    4  4  4  4     5000   30000

Supported LBA Sizes (NSID 0x1)
Id Fmt  Data  Metadt  Rel_Perf
 0 +     512       0         0

=== START OF SMART DATA SECTION ===
SMART overall-health self-assessment test result: PASSED

SMART/Health Information (NVMe Log 0x02)
Critical Warning:                   0x00
Temperature:                        34 Celsius
Available Spare:                    100%
Available Spare Threshold:          10%
Percentage Used:                    0%
Data Units Read:                    8,002,487 [4.09 TB]
Data Units Written:                 63,642 [32.5 GB]
Host Read Commands:                 33,543,503
Host Write Commands:                694,461
Controller Busy Time:               52
Power Cycles:                       2
Power On Hours:                     105
Unsafe Shutdowns:                   2
Media and Data Integrity Errors:    0
Error Information Log Entries:      0
Warning  Comp. Temperature Time:    0
Critical Comp. Temperature Time:    0
Temperature Sensor 1:               34 Celsius
Temperature Sensor 2:               25 Celsius

Error Information (NVMe Log 0x01, 16 of 256 entries)
No Errors Logged



