smartctl 7.1 2019-12-30 r5022 [i686-linux-4.15.0-desktop-68.5rosa-i586] (local build)
Copyright (C) 2002-19, Bruce Allen, Christian Franke, www.smartmontools.org

=== START OF INFORMATION SECTION ===
Device Model:     SAMSUNG SV2042H
Serial Number:    --
Firmware Version: PK100-21
User Capacity:    20,411,080,704 bytes [20.4 GB]
Sector Size:      512 bytes logical/physical
Device is:        Not in smartctl database [for details use: -P showall]
ATA Version is:   ATA/ATAPI-6, ATA/ATAPI-4 T13/1153D revision 17
Local Time is:    Wed Mar  4 01:54:04 2020 +03
SMART support is: Available - device has SMART capability.
SMART support is: Enabled
AAM level is:     254 (maximum performance), recommended: 128
APM feature is:   Unavailable
Rd look-ahead is: Enabled
Write cache is:   Enabled
DSN feature is:   Unavailable
ATA Security is:  Disabled, NOT FROZEN [SEC1]
Wt Cache Reorder: Unavailable

=== START OF READ SMART DATA SECTION ===
SMART overall-health self-assessment test result: PASSED

General SMART Values:
Offline data collection status:  (0x80)	Offline data collection activity
					was never started.
					Auto Offline Data Collection: Enabled.
Self-test execution status:      (   0)	The previous self-test routine completed
					without error or no self-test has ever 
					been run.
Total time to complete Offline 
data collection: 		(  480) seconds.
Offline data collection
capabilities: 			 (0x1b) SMART execute Offline immediate.
					Auto Offline data collection on/off support.
					Suspend Offline collection upon new
					command.
					Offline surface scan supported.
					Self-test supported.
					No Conveyance Self-test supported.
					No Selective Self-test supported.
SMART capabilities:            (0x0003)	Saves SMART data before entering
					power-saving mode.
					Supports SMART auto save timer.
Error logging capability:        (0x01)	Error logging supported.
					No General Purpose Logging support.
Short self-test routine 
recommended polling time: 	 (   1) minutes.
Extended self-test routine
recommended polling time: 	 (   8) minutes.

SMART Attributes Data Structure revision number: 9
Vendor Specific SMART Attributes with Thresholds:
ID# ATTRIBUTE_NAME          FLAGS    VALUE WORST THRESH FAIL RAW_VALUE
  1 Raw_Read_Error_Rate     -O-R--   100   100   051    -    0
  4 Start_Stop_Count        -O--CK   097   097   000    -    3848
  5 Reallocated_Sector_Ct   PO--CK   253   253   010    -    0
  7 Seek_Error_Rate         -O-R--   253   253   051    -    0
  8 Seek_Time_Performance   --S--K   253   253   000    -    0
  9 Power_On_Hours          -O--CK   099   099   000    -    1097001
 12 Power_Cycle_Count       -O--CK   099   099   000    -    1877
197 Current_Pending_Sector  -O--CK   253   253   010    -    0
198 Offline_Uncorrectable   ----CK   253   253   010    -    0
199 UDMA_CRC_Error_Count    -O-R--   200   200   000    -    0
200 Multi_Zone_Error_Rate   -O-R--   100   100   051    -    0
201 Soft_Read_Error_Rate    -O-R--   100   100   051    -    0
                            ||||||_ K auto-keep
                            |||||__ C event count
                            ||||___ R error rate
                            |||____ S speed/performance
                            ||_____ O updated online
                            |______ P prefailure warning

Read SMART Log Directory failed: scsi error badly formed scsi parameters

General Purpose Log Directory not supported

SMART Extended Comprehensive Error Log (GP Log 0x03) not supported

SMART Error Log Version: 1
Warning: ATA error count 92 inconsistent with error log pointer 3

ATA Error Count: 92 (device log contains only the most recent five errors)
	CR = Command Register [HEX]
	FR = Features Register [HEX]
	SC = Sector Count Register [HEX]
	SN = Sector Number Register [HEX]
	CL = Cylinder Low Register [HEX]
	CH = Cylinder High Register [HEX]
	DH = Device/Head Register [HEX]
	DC = Device Command Register [HEX]
	ER = Error register [HEX]
	ST = Status register [HEX]
Powered_Up_Time is measured from power on, and printed as
DDd+hh:mm:SS.sss where DD=days, hh=hours, mm=minutes,
SS=sec, and sss=millisec. It "wraps" after 49.710 days.

Error 92 occurred at disk power-on lifetime: 9141 hours (380 days + 21 hours)
  When the command that caused the error occurred, the device was active or idle.

  After command completion occurred, registers were:
  ER ST SC SN CL CH DH
  -- -- -- -- -- -- --
  04 88 01 00 4f c2 00

  Commands leading to the command that caused the error were:
  CR FR SC SN CL CH DH DC   Powered_Up_Time  Command/Feature_Name
  -- -- -- -- -- -- -- --  ----------------  --------------------
  b0 d5 01 00 4f c2 00 00      02:54:46.000  SMART READ LOG
  b0 da 00 00 4f c2 00 00      02:54:46.000  SMART RETURN STATUS
  b0 d1 01 01 4f c2 00 00      02:54:46.000  SMART READ ATTRIBUTE THRESHOLDS [OBS-4]
  b0 d0 01 00 4f c2 00 00      02:54:46.000  SMART READ DATA
  c8 00 08 a8 dd 43 e0 00      02:54:46.000  READ DMA

Error 91 occurred at disk power-on lifetime: 9127 hours (380 days + 7 hours)
  When the command that caused the error occurred, the device was active or idle.

  After command completion occurred, registers were:
  ER ST SC SN CL CH DH
  -- -- -- -- -- -- --
  04 88 00 01 4f c2 a0

  Commands leading to the command that caused the error were:
  CR FR SC SN CL CH DH DC   Powered_Up_Time  Command/Feature_Name
  -- -- -- -- -- -- -- --  ----------------  --------------------
  b0 d9 00 01 4f c2 a0 00      00:00:05.000  SMART DISABLE OPERATIONS
  ec 00 3f 01 00 00 a0 00      00:00:05.000  IDENTIFY DEVICE
  10 00 3f 01 00 01 a0 00      00:00:05.000  RECALIBRATE [OBS-4]
  91 00 3f 01 00 01 af 00      00:00:05.000  INITIALIZE DEVICE PARAMETERS [OBS-6]
  ec 40 ff 01 00 00 a0 00      00:00:05.000  IDENTIFY DEVICE

Error 90 occurred at disk power-on lifetime: 9127 hours (380 days + 7 hours)
  When the command that caused the error occurred, the device was active or idle.

  After command completion occurred, registers were:
  ER ST SC SN CL CH DH
  -- -- -- -- -- -- --
  04 80 01 01 00 00 a0

  Commands leading to the command that caused the error were:
  CR FR SC SN CL CH DH DC   Powered_Up_Time  Command/Feature_Name
  -- -- -- -- -- -- -- --  ----------------  --------------------
  a1 40 01 01 00 00 a0 00      00:00:05.000  IDENTIFY PACKET DEVICE
  b0 d9 00 01 4f c2 a0 00      00:00:10.000  SMART DISABLE OPERATIONS
  ec 00 3f 01 00 00 a0 00      00:00:10.000  IDENTIFY DEVICE
  10 00 3f 01 00 01 a0 00      00:00:10.000  RECALIBRATE [OBS-4]
  91 00 3f 01 00 01 af 00      00:00:10.000  INITIALIZE DEVICE PARAMETERS [OBS-6]

Error 89 occurred at disk power-on lifetime: 9127 hours (380 days + 7 hours)
  When the command that caused the error occurred, the device was active or idle.

  After command completion occurred, registers were:
  ER ST SC SN CL CH DH
  -- -- -- -- -- -- --
  04 80 01 01 00 00 a0

  Commands leading to the command that caused the error were:
  CR FR SC SN CL CH DH DC   Powered_Up_Time  Command/Feature_Name
  -- -- -- -- -- -- -- --  ----------------  --------------------
  08 40 01 01 00 00 a0 00      00:00:05.000  DEVICE RESET
  00 40 00 16 95 e3 5c 04      00:00:04.000  NOP [Reserved subcommand] [OBS-ACS-2]
  a1 40 01 01 00 00 a0 00      00:00:10.000  IDENTIFY PACKET DEVICE
  b0 d9 00 01 4f c2 a0 00      00:00:10.000  SMART DISABLE OPERATIONS
  ec 00 3f 01 00 00 a0 00      00:00:10.000  IDENTIFY DEVICE

Error 88 occurred at disk power-on lifetime: 9127 hours (380 days + 7 hours)
  When the command that caused the error occurred, the device was active or idle.

  After command completion occurred, registers were:
  ER ST SC SN CL CH DH
  -- -- -- -- -- -- --
  04 88 00 01 4f c2 a0

  Commands leading to the command that caused the error were:
  CR FR SC SN CL CH DH DC   Powered_Up_Time  Command/Feature_Name
  -- -- -- -- -- -- -- --  ----------------  --------------------
  b0 d5 01 01 4f c2 00 00      02:54:46.000  SMART READ LOG
  b0 d9 00 01 4f c2 a0 00      00:00:10.000  SMART DISABLE OPERATIONS
  ec 00 3f 01 00 00 a0 00      00:00:10.000  IDENTIFY DEVICE
  10 00 3f 01 00 01 a0 00      00:00:10.000  RECALIBRATE [OBS-4]
  91 00 3f 01 00 01 af 00      00:00:10.000  INITIALIZE DEVICE PARAMETERS [OBS-6]

SMART Extended Self-test Log (GP Log 0x07) not supported

SMART Self-test log structure revision number 1
No self-tests have been logged.  [To run self-tests, use: smartctl -t]

Selective Self-tests/Logging not supported

SCT Commands not supported

Device Statistics (GP/SMART Log 0x04) not supported

Pending Defects log (GP Log 0x0c) not supported

SATA Phy Event Counters (GP Log 0x11) not supported



