smartctl 7.4 2023-08-01 r5530 [x86_64-linux-6.1.58-generic-1rosa2021.1-x86_64] (local build)
Copyright (C) 2002-23, Bruce Allen, Christian Franke, www.smartmontools.org

=== START OF INFORMATION SECTION ===
Model Number:                       LENSE30256GMSP34MEAT3TA
Serial Number:                      --
Firmware Version:                   2.5.0412
PCI Vendor/Subsystem ID:            0x17aa
IEEE OUI Identifier:                0xa03299
Controller ID:                      1
NVMe Version:                       1.2
Number of Namespaces:               1
Namespace 1 Size/Capacity:          256,060,514,304 [256 GB]
Namespace 1 Utilization:            0
Namespace 1 Formatted LBA Size:     512
Namespace 1 IEEE EUI-64:            a03299 ...
Local Time is:                      Wed Dec 27 13:28:48 2023 +07
Firmware Updates (0x02):            1 Slot
Optional Admin Commands (0x0017):   Security Format Frmw_DL Self_Test
Optional NVM Commands (0x0016):     Wr_Unc DS_Mngmt Sav/Sel_Feat
Maximum Data Transfer Size:         32 Pages
Warning  Comp. Temp. Threshold:     70 Celsius
Critical Comp. Temp. Threshold:     80 Celsius

Supported Power States
St Op     Max   Active     Idle   RL RT WL WT  Ent_Lat  Ex_Lat
 0 +     6.50W       -        -    0  0  0  0        0       0
 1 +     4.60W       -        -    1  1  1  1        5       5
 2 +     3.90W       -        -    2  2  2  2        5       5
 3 -   0.1000W       -        -    3  3  3  3       60    1000
 4 -   0.0100W       -        -    4  4  4  4    30000    1500

Supported LBA Sizes (NSID 0x1)
Id Fmt  Data  Metadt  Rel_Perf
 0 -     512       0         0

=== START OF SMART DATA SECTION ===
SMART overall-health self-assessment test result: PASSED

SMART/Health Information (NVMe Log 0x02)
Critical Warning:                   0x00
Temperature:                        41 Celsius
Available Spare:                    100%
Available Spare Threshold:          3%
Percentage Used:                    14%
Data Units Read:                    54,885,790 [28.1 TB]
Data Units Written:                 41,487,135 [21.2 TB]
Host Read Commands:                 865,876,234
Host Write Commands:                859,198,364
Controller Busy Time:               5,438
Power Cycles:                       3,499
Power On Hours:                     4,196
Unsafe Shutdowns:                   1,192
Media and Data Integrity Errors:    0
Error Information Log Entries:      1,117
Warning  Comp. Temperature Time:    0
Critical Comp. Temperature Time:    0
Temperature Sensor 1:               55 Celsius
Temperature Sensor 2:               41 Celsius

Error Information (NVMe Log 0x01, 4 of 4 entries)
Num   ErrCount  SQId   CmdId  Status  PELoc          LBA  NSID    VS  Message
  0       1117     0  0x501b  0xc005  0x000            0     0     -  Invalid Field in Command
  1       1116     0  0x0005  0xc005  0x000            0     0     -  Invalid Field in Command
  2       1115     0  0x2014  0xc005  0x000            0     0     -  Invalid Field in Command
  3       1114     0  0x0014  0xc005  0x000            0     0     -  Invalid Field in Command

Self-test Log (NVMe Log 0x06)
Self-test status: No self-test in progress
No Self-tests Logged

