smartctl 6.6 (build date Jun 14 2018) [x86_64-linux-4.15.0-47-generic] (local build)
Copyright (C) 2002-17, Bruce Allen, Christian Franke, www.smartmontools.org

=== START OF INFORMATION SECTION ===
Device Model:     TOSHIBA MQ01ABF032
Serial Number:    --
LU WWN Device Id: 5 000039 ...
Firmware Version: AM0P1D
User Capacity:    320,072,933,376 bytes [320 GB]
Sector Sizes:     512 bytes logical, 4096 bytes physical
Rotation Rate:    5400 rpm
Form Factor:      2.5 inches
Device is:        Not in smartctl database [for details use: -P showall]
ATA Version is:   ATA8-ACS (minor revision not indicated)
SATA Version is:  SATA 3.0, 6.0 Gb/s (current: 6.0 Gb/s)
Local Time is:    Tue Apr 16 07:29:00 2019 PDT
SMART support is: Available - device has SMART capability.
SMART support is: Enabled
AAM feature is:   Unavailable
APM level is:     254 (maximum performance)
Rd look-ahead is: Enabled
Write cache is:   Enabled
DSN feature is:   Unavailable
ATA Security is:  Disabled, NOT FROZEN [SEC1]
Wt Cache Reorder: Enabled

=== START OF READ SMART DATA SECTION ===
SMART overall-health self-assessment test result: FAILED!
Drive failure expected in less than 24 hours. SAVE ALL DATA.
See vendor-specific Attribute list for failed Attributes.

General SMART Values:
Offline data collection status:  (0x00)	Offline data collection activity
					was never started.
					Auto Offline Data Collection: Disabled.
Self-test execution status:      (  25)	The self-test routine was aborted by
					the host.
Total time to complete Offline 
data collection: 		(  120) seconds.
Offline data collection
capabilities: 			 (0x5b) SMART execute Offline immediate.
					Auto Offline data collection on/off support.
					Suspend Offline collection upon new
					command.
					Offline surface scan supported.
					Self-test supported.
					No Conveyance Self-test supported.
					Selective Self-test supported.
SMART capabilities:            (0x0003)	Saves SMART data before entering
					power-saving mode.
					Supports SMART auto save timer.
Error logging capability:        (0x01)	Error logging supported.
					General Purpose Logging supported.
Short self-test routine 
recommended polling time: 	 (   2) minutes.
Extended self-test routine
recommended polling time: 	 (  83) minutes.
SCT capabilities: 	       (0x003d)	SCT Status supported.
					SCT Error Recovery Control supported.
					SCT Feature Control supported.
					SCT Data Table supported.

SMART Attributes Data Structure revision number: 128
Vendor Specific SMART Attributes with Thresholds:
ID# ATTRIBUTE_NAME          FLAGS    VALUE WORST THRESH FAIL RAW_VALUE
  1 Raw_Read_Error_Rate     PO-R--   100   100   050    -    0
  3 Spin_Up_Time            POS--K   100   100   001    -    1333
  5 Reallocated_Sector_Ct   PO--CK   001   001   050    NOW  16376
  9 Power_On_Hours          -O--CK   093   093   000    -    2831
 12 Power_Cycle_Count       -O--CK   100   100   000    -    2721
191 G-Sense_Error_Rate      -O--CK   100   100   000    -    753
192 Power-Off_Retract_Count -O--CK   100   100   000    -    201
193 Load_Cycle_Count        -O--CK   100   100   000    -    7983
194 Temperature_Celsius     -O---K   100   100   000    -    29 (Min/Max 7/48)
199 UDMA_CRC_Error_Count    -O--CK   100   100   000    -    58588519
200 Multi_Zone_Error_Rate   -O--CK   100   100   000    -    216675620
240 Head_Flying_Hours       -O--CK   094   094   000    -    2768
241 Total_LBAs_Written      -O--CK   100   100   000    -    10827404780
242 Total_LBAs_Read         -O--CK   100   100   000    -    16010699934
254 Free_Fall_Sensor        -O--CK   100   100   000    -    0
                            ||||||_ K auto-keep
                            |||||__ C event count
                            ||||___ R error rate
                            |||____ S speed/performance
                            ||_____ O updated online
                            |______ P prefailure warning

General Purpose Log Directory Version 1
SMART           Log Directory Version 1 [multi-sector log support]
Address    Access  R/W   Size  Description
0x00       GPL,SL  R/O      1  Log Directory
0x01           SL  R/O      1  Summary SMART error log
0x02           SL  R/O     51  Comprehensive SMART error log
0x03       GPL     R/O     64  Ext. Comprehensive SMART error log
0x04       GPL,SL  R/O      8  Device Statistics log
0x06           SL  R/O      1  SMART self-test log
0x07       GPL     R/O      1  Extended self-test log
0x09           SL  R/W      1  Selective self-test log
0x10       GPL     R/O      1  NCQ Command Error log
0x11       GPL     R/O      1  SATA Phy Event Counters log
0x80-0x9f  GPL,SL  R/W     16  Host vendor specific log
0xe0       GPL,SL  R/W      1  SCT Command/Status
0xe1       GPL,SL  R/W      1  SCT Data Transfer

SMART Extended Comprehensive Error Log Version: 1 (64 sectors)
Device Error Count: 1697 (device log contains only the most recent 256 errors)
	CR     = Command Register
	FEATR  = Features Register
	COUNT  = Count (was: Sector Count) Register
	LBA_48 = Upper bytes of LBA High/Mid/Low Registers ]  ATA-8
	LH     = LBA High (was: Cylinder High) Register    ]   LBA
	LM     = LBA Mid (was: Cylinder Low) Register      ] Register
	LL     = LBA Low (was: Sector Number) Register     ]
	DV     = Device (was: Device/Head) Register
	DC     = Device Control Register
	ER     = Error register
	ST     = Status register
Powered_Up_Time is measured from power on, and printed as
DDd+hh:mm:SS.sss where DD=days, hh=hours, mm=minutes,
SS=sec, and sss=millisec. It "wraps" after 49.710 days.

Error 1697 [160] occurred at disk power-on lifetime: 2826 hours (117 days + 18 hours)
  When the command that caused the error occurred, the device was active or idle.

  After command completion occurred, registers were:
  ER -- ST COUNT  LBA_48  LH LM LL DV DC
  -- -- -- == -- == == == -- -- -- -- --
  40 -- 41 00 18 00 00 08 71 58 60 40 00  Error: UNC at LBA = 0x08715860 = 141645920

  Commands leading to the command that caused the error were:
  CR FEATR COUNT  LBA_48  LH LM LL DV DC  Powered_Up_Time  Command/Feature_Name
  -- == -- == -- == == == -- -- -- -- --  ---------------  --------------------
  60 00 08 00 18 00 00 08 71 58 60 40 00     00:11:50.893  READ FPDMA QUEUED
  60 00 08 00 10 00 00 08 71 58 58 40 00     00:11:50.893  READ FPDMA QUEUED
  60 00 08 00 08 00 00 08 71 58 50 40 00     00:11:50.893  READ FPDMA QUEUED
  60 00 08 00 00 00 00 08 71 58 48 40 00     00:11:50.893  READ FPDMA QUEUED
  60 00 08 00 f0 00 00 08 71 58 40 40 00     00:11:50.893  READ FPDMA QUEUED

Error 1696 [159] occurred at disk power-on lifetime: 2826 hours (117 days + 18 hours)
  When the command that caused the error occurred, the device was active or idle.

  After command completion occurred, registers were:
  ER -- ST COUNT  LBA_48  LH LM LL DV DC
  -- -- -- == -- == == == -- -- -- -- --
  40 -- 41 00 e0 00 00 08 39 bf a0 40 00  Error: UNC at LBA = 0x0839bfa0 = 138002336

  Commands leading to the command that caused the error were:
  CR FEATR COUNT  LBA_48  LH LM LL DV DC  Powered_Up_Time  Command/Feature_Name
  -- == -- == -- == == == -- -- -- -- --  ---------------  --------------------
  60 00 08 00 e0 00 00 08 39 bf a0 40 00     00:10:06.658  READ FPDMA QUEUED
  60 00 08 00 d8 00 00 1d 5f 24 68 40 00     00:10:06.639  READ FPDMA QUEUED
  60 00 08 00 d0 00 00 1d 5f 24 78 40 00     00:10:06.639  READ FPDMA QUEUED
  60 00 08 00 c8 00 00 1d 5e fd 40 40 00     00:10:06.635  READ FPDMA QUEUED
  60 00 08 00 48 00 00 1d 5f 00 b8 40 00     00:10:06.611  READ FPDMA QUEUED

Error 1695 [158] occurred at disk power-on lifetime: 2826 hours (117 days + 18 hours)
  When the command that caused the error occurred, the device was active or idle.

  After command completion occurred, registers were:
  ER -- ST COUNT  LBA_48  LH LM LL DV DC
  -- -- -- == -- == == == -- -- -- -- --
  40 -- 41 00 28 00 00 08 39 bf a0 40 00  Error: UNC at LBA = 0x0839bfa0 = 138002336

  Commands leading to the command that caused the error were:
  CR FEATR COUNT  LBA_48  LH LM LL DV DC  Powered_Up_Time  Command/Feature_Name
  -- == -- == -- == == == -- -- -- -- --  ---------------  --------------------
  60 00 08 00 30 00 00 1d 5f 00 b8 40 00     00:10:04.490  READ FPDMA QUEUED
  60 00 08 00 28 00 00 08 39 bf a0 40 00     00:10:02.742  READ FPDMA QUEUED
  60 00 08 00 20 00 00 08 39 c1 78 40 00     00:10:02.741  READ FPDMA QUEUED
  60 00 08 00 18 00 00 08 39 c1 70 40 00     00:10:02.741  READ FPDMA QUEUED
  60 00 08 00 10 00 00 08 39 c1 68 40 00     00:10:02.741  READ FPDMA QUEUED

Error 1694 [157] occurred at disk power-on lifetime: 2826 hours (117 days + 18 hours)
  When the command that caused the error occurred, the device was active or idle.

  After command completion occurred, registers were:
  ER -- ST COUNT  LBA_48  LH LM LL DV DC
  -- -- -- == -- == == == -- -- -- -- --
  40 -- 41 00 00 00 00 08 39 bf a0 40 00  Error: UNC at LBA = 0x0839bfa0 = 138002336

  Commands leading to the command that caused the error were:
  CR FEATR COUNT  LBA_48  LH LM LL DV DC  Powered_Up_Time  Command/Feature_Name
  -- == -- == -- == == == -- -- -- -- --  ---------------  --------------------
  60 00 80 00 80 00 00 19 fd df 08 40 00     00:09:58.831  READ FPDMA QUEUED
  60 00 08 00 78 00 00 1a e6 0d 10 40 00     00:09:58.817  READ FPDMA QUEUED
  60 00 08 00 00 00 00 08 39 bf a0 40 00     00:09:58.799  READ FPDMA QUEUED
  60 00 08 00 e8 00 00 1a e6 29 80 40 00     00:09:58.799  READ FPDMA QUEUED
  ef 00 10 00 02 00 00 00 00 00 00 a0 00     00:09:58.799  SET FEATURES [Enable SATA feature]

Error 1693 [156] occurred at disk power-on lifetime: 2826 hours (117 days + 18 hours)
  When the command that caused the error occurred, the device was active or idle.

  After command completion occurred, registers were:
  ER -- ST COUNT  LBA_48  LH LM LL DV DC
  -- -- -- == -- == == == -- -- -- -- --
  40 -- 41 00 50 00 00 08 39 bf a0 40 00  Error: UNC at LBA = 0x0839bfa0 = 138002336

  Commands leading to the command that caused the error were:
  CR FEATR COUNT  LBA_48  LH LM LL DV DC  Powered_Up_Time  Command/Feature_Name
  -- == -- == -- == == == -- -- -- -- --  ---------------  --------------------
  60 00 08 00 d0 00 00 1a e6 29 80 40 00     00:09:54.936  READ FPDMA QUEUED
  60 00 08 00 c8 00 00 1a a2 7b 30 40 00     00:09:54.925  READ FPDMA QUEUED
  60 00 08 00 50 00 00 08 39 bf a0 40 00     00:09:54.899  READ FPDMA QUEUED
  60 00 08 00 40 00 00 1a a2 7b 28 40 00     00:09:54.899  READ FPDMA QUEUED
  ef 00 10 00 02 00 00 00 00 00 00 a0 00     00:09:54.899  SET FEATURES [Enable SATA feature]

Error 1692 [155] occurred at disk power-on lifetime: 2826 hours (117 days + 18 hours)
  When the command that caused the error occurred, the device was active or idle.

  After command completion occurred, registers were:
  ER -- ST COUNT  LBA_48  LH LM LL DV DC
  -- -- -- == -- == == == -- -- -- -- --
  40 -- 41 00 28 00 00 08 39 bf a0 40 00  Error: UNC at LBA = 0x0839bfa0 = 138002336

  Commands leading to the command that caused the error were:
  CR FEATR COUNT  LBA_48  LH LM LL DV DC  Powered_Up_Time  Command/Feature_Name
  -- == -- == -- == == == -- -- -- -- --  ---------------  --------------------
  60 00 08 00 28 00 00 08 39 bf a0 40 00     00:09:51.037  READ FPDMA QUEUED
  60 00 08 00 20 00 00 08 39 bf 98 40 00     00:09:51.037  READ FPDMA QUEUED
  60 00 08 00 18 00 00 08 39 bf 90 40 00     00:09:51.037  READ FPDMA QUEUED
  60 00 08 00 10 00 00 08 39 bf 88 40 00     00:09:51.037  READ FPDMA QUEUED
  60 00 08 00 08 00 00 1a a2 7b 28 40 00     00:09:51.021  READ FPDMA QUEUED

Error 1691 [154] occurred at disk power-on lifetime: 2826 hours (117 days + 18 hours)
  When the command that caused the error occurred, the device was active or idle.

  After command completion occurred, registers were:
  ER -- ST COUNT  LBA_48  LH LM LL DV DC
  -- -- -- == -- == == == -- -- -- -- --
  40 -- 41 00 48 00 00 08 39 bf a0 40 00  Error: UNC at LBA = 0x0839bfa0 = 138002336

  Commands leading to the command that caused the error were:
  CR FEATR COUNT  LBA_48  LH LM LL DV DC  Powered_Up_Time  Command/Feature_Name
  -- == -- == -- == == == -- -- -- -- --  ---------------  --------------------
  60 01 00 00 50 00 00 08 39 c0 80 40 00     00:09:50.885  READ FPDMA QUEUED
  60 01 00 00 48 00 00 08 39 bf 80 40 00     00:09:47.170  READ FPDMA QUEUED
  60 01 00 00 40 00 00 08 39 be 80 40 00     00:09:47.169  READ FPDMA QUEUED
  60 01 00 00 38 00 00 08 39 bd 80 40 00     00:09:47.168  READ FPDMA QUEUED
  60 01 00 00 30 00 00 08 39 bc 80 40 00     00:09:47.167  READ FPDMA QUEUED

Error 1690 [153] occurred at disk power-on lifetime: 2826 hours (117 days + 18 hours)
  When the command that caused the error occurred, the device was active or idle.

  After command completion occurred, registers were:
  ER -- ST COUNT  LBA_48  LH LM LL DV DC
  -- -- -- == -- == == == -- -- -- -- --
  40 -- 41 00 d0 00 00 06 1f b4 70 40 00  Error: WP at LBA = 0x061fb470 = 102741104

  Commands leading to the command that caused the error were:
  CR FEATR COUNT  LBA_48  LH LM LL DV DC  Powered_Up_Time  Command/Feature_Name
  -- == -- == -- == == == -- -- -- -- --  ---------------  --------------------
  61 00 58 00 d8 00 00 1e 62 aa 70 40 00     00:07:58.457  WRITE FPDMA QUEUED
  60 00 20 00 d0 00 00 06 1f b4 58 40 00     00:07:54.720  READ FPDMA QUEUED
  60 00 08 00 c8 00 00 06 1f b4 50 40 00     00:07:54.709  READ FPDMA QUEUED
  60 00 08 00 c0 00 00 06 1f ab d0 40 00     00:07:54.704  READ FPDMA QUEUED
  60 00 08 00 b8 00 00 05 b3 81 a8 40 00     00:07:54.697  READ FPDMA QUEUED

SMART Extended Self-test Log Version: 1 (1 sectors)
Num  Test_Description    Status                  Remaining  LifeTime(hours)  LBA_of_first_error
# 1  Short offline       Aborted by host               90%      2777         -
# 2  Short offline       Completed without error       00%      2776         -
# 3  Extended offline    Interrupted (host reset)      70%      2771         -
# 4  Short offline       Completed without error       00%      2770         -
# 5  Extended offline    Interrupted (host reset)      90%      2766         -
# 6  Extended offline    Aborted by host               90%      2766         -
# 7  Extended offline    Aborted by host               90%      2766         -
# 8  Extended offline    Aborted by host               60%      2766         -
# 9  Short offline       Aborted by host               90%      2765         -
#10  Short offline       Interrupted (host reset)      90%      2765         -
#11  Short offline       Completed without error       00%      2765         -
#12  Short offline       Completed without error       00%      2765         -
#13  Short offline       Completed without error       00%      2764         -
#14  Short offline       Completed without error       00%      1950         -
#15  Short offline       Completed without error       00%      1494         -
#16  Short offline       Completed without error       00%       768         -
#17  Short offline       Completed without error       00%       412         -
#18  Short offline       Completed without error       00%       346         -
#19  Short offline       Completed without error       00%        66         -

SMART Selective self-test log data structure revision number 1
 SPAN  MIN_LBA  MAX_LBA  CURRENT_TEST_STATUS
    1        0        0  Not_testing
    2        0        0  Not_testing
    3        0        0  Not_testing
    4        0        0  Not_testing
    5        0        0  Not_testing
Selective self-test flags (0x0):
  After scanning selected spans, do NOT read-scan remainder of disk.
If Selective self-test is pending on power-up, resume after 0 minute delay.

SCT Status Version:                  2
SCT Version (vendor specific):       1 (0x0001)
SCT Support Level:                   1
Device State:                        Active (0)
Current Temperature:                    29 Celsius
Power Cycle Min/Max Temperature:     27/29 Celsius
Lifetime    Min/Max Temperature:      7/48 Celsius
Lifetime    Average Temperature:        31 Celsius
Under/Over Temperature Limit Count:   7/0

SCT Temperature History Version:     2
Temperature Sampling Period:         1 minute
Temperature Logging Interval:        10 minutes
Min/Max recommended Temperature:     15/55 Celsius
Min/Max Temperature Limit:           10/60 Celsius
Temperature History Size (Index):    478 (7)

SCT Error Recovery Control:
           Read: Disabled
          Write: Disabled

Device Statistics (GP Log 0x04)
Page  Offset Size        Value Flags Description
0x01  =====  =               =  ===  == General Statistics (rev 2) ==
0x01  0x008  4            2721  ---  Lifetime Power-On Resets
0x01  0x010  4            2831  ---  Power-on Hours
0x01  0x018  6     10827404780  ---  Logical Sectors Written
0x01  0x020  6       166487031  ---  Number of Write Commands
0x01  0x028  6     16010699934  ---  Logical Sectors Read
0x01  0x030  6       259117056  ---  Number of Read Commands
0x02  =====  =               =  ===  == Free-Fall Statistics (rev 1) ==
0x02  0x010  4             753  ---  Overlimit Shock Events
0x03  =====  =               =  ===  == Rotating Media Statistics (rev 1) ==
0x03  0x008  4            1145  ---  Spindle Motor Power-on Hours
0x03  0x010  4            2768  ---  Head Flying Hours
0x03  0x018  4            7983  ---  Head Load Events
0x03  0x020  4           16376  ---  Number of Reallocated Logical Sectors
0x03  0x028  4             905  ---  Read Recovery Attempts
0x03  0x030  4               0  ---  Number of Mechanical Start Failures
0x04  =====  =               =  ===  == General Errors Statistics (rev 1) ==
0x04  0x008  4            1553  ---  Number of Reported Uncorrectable Errors
0x04  0x010  4               0  ---  Resets Between Cmd Acceptance and Completion
0x05  =====  =               =  ===  == Temperature Statistics (rev 1) ==
0x05  0x008  1              29  ---  Current Temperature
0x05  0x010  1              32  N--  Average Short Term Temperature
0x05  0x018  1              30  N--  Average Long Term Temperature
0x05  0x020  1              48  ---  Highest Temperature
0x05  0x028  1               7  ---  Lowest Temperature
0x05  0x030  1              35  N--  Highest Average Short Term Temperature
0x05  0x038  1              26  N--  Lowest Average Short Term Temperature
0x05  0x040  1              31  N--  Highest Average Long Term Temperature
0x05  0x048  1              30  N--  Lowest Average Long Term Temperature
0x05  0x050  4               0  ---  Time in Over-Temperature
0x05  0x058  1              55  ---  Specified Maximum Operating Temperature
0x05  0x060  4             837  ---  Time in Under-Temperature
0x05  0x068  1              15  ---  Specified Minimum Operating Temperature
0x06  =====  =               =  ===  == Transport Statistics (rev 1) ==
0x06  0x008  4             796  ---  Number of Hardware Resets
0x06  0x018  4              18  ---  Number of Interface CRC Errors
0x07  =====  =               =  ===  == Solid State Device Statistics (rev 1) ==
0x07  0x008  1               4  N--  Percentage Used Endurance Indicator
                                |||_ C monitored condition met
                                ||__ D supports DSN
                                |___ N normalized value

Pending Defects log (GP Log 0x0c) not supported

SATA Phy Event Counters (GP Log 0x11)
ID      Size     Value  Description
0x0001  4            0  Command failed due to ICRC error
0x0002  4            0  R_ERR response for data FIS
0x0003  4            0  R_ERR response for device-to-host data FIS
0x0004  4            0  R_ERR response for host-to-device data FIS
0x0005  4            0  R_ERR response for non-data FIS
0x0006  4            0  R_ERR response for device-to-host non-data FIS
0x0007  4            0  R_ERR response for host-to-device non-data FIS
0x0008  4            0  Device-to-host non-data FIS retries
0x0009  4            2  Transition from drive PhyRdy to drive PhyNRdy
0x000a  4            0  Device-to-host register FISes sent due to a COMRESET
0x000b  4            0  CRC errors within host-to-device FIS
0x000d  4            0  Non-CRC errors within host-to-device FIS
0x000f  4            0  R_ERR response for host-to-device data FIS, CRC
0x0010  4            0  R_ERR response for host-to-device data FIS, non-CRC
0x0012  4            0  R_ERR response for host-to-device non-data FIS, CRC
0x0013  4            0  R_ERR response for host-to-device non-data FIS, non-CRC

