smartctl 7.2 2020-12-30 r5155 [x86_64-linux-5.16.7-desktop-1omv4003] (OpenMandriva Lx 7.2-2)
Copyright (C) 2002-20, Bruce Allen, Christian Franke, www.smartmontools.org

=== START OF INFORMATION SECTION ===
Model Number:                       ADATA SX6000LNP
Serial Number:                      --
Firmware Version:                   V9002s16
PCI Vendor/Subsystem ID:            0x10ec
IEEE OUI Identifier:                0x00e04c
Controller ID:                      1
NVMe Version:                       1.3
Number of Namespaces:               1
Namespace 1 Size/Capacity:          128,035,676,160 [128 GB]
Namespace 1 Formatted LBA Size:     512
Namespace 1 IEEE EUI-64:            4ce000 ...
Local Time is:                      Thu Oct 13 23:12:27 2022 MSK
Firmware Updates (0x02):            1 Slot
Optional Admin Commands (0x0016):   Format Frmw_DL Self_Test
Optional NVM Commands (0x0014):     DS_Mngmt Sav/Sel_Feat
Log Page Attributes (0x02):         Cmd_Eff_Lg
Maximum Data Transfer Size:         32 Pages
Warning  Comp. Temp. Threshold:     100 Celsius
Critical Comp. Temp. Threshold:     110 Celsius

Supported Power States
St Op     Max   Active     Idle   RL RT WL WT  Ent_Lat  Ex_Lat
 0 +     8.00W       -        -    0  0  0  0        0   50000
 1 +     4.00W       -        -    1  1  1  1        0   50000
 2 +     3.00W       -        -    2  2  2  2        0   50000
 3 -   0.0500W       -        -    3  3  3  3     4000   50000
 4 -   0.0080W       -        -    4  4  4  4     8000  100000

Supported LBA Sizes (NSID 0x1)
Id Fmt  Data  Metadt  Rel_Perf
 0 +     512       0         0

=== START OF SMART DATA SECTION ===
SMART overall-health self-assessment test result: PASSED

SMART/Health Information (NVMe Log 0x02)
Critical Warning:                   0x00
Temperature:                        35 Celsius
Available Spare:                    98%
Available Spare Threshold:          32%
Percentage Used:                    5%
Data Units Read:                    17,323,325 [8.86 TB]
Data Units Written:                 19,970,989 [10.2 TB]
Host Read Commands:                 257,854,291
Host Write Commands:                173,203,623
Controller Busy Time:               0
Power Cycles:                       2,088
Power On Hours:                     1,476
Unsafe Shutdowns:                   590
Media and Data Integrity Errors:    0
Error Information Log Entries:      663
Warning  Comp. Temperature Time:    0
Critical Comp. Temperature Time:    0

Error Information (NVMe Log 0x01, 8 of 8 entries)
No Errors Logged



