smartctl 7.2 2020-12-30 r5155 [x86_64-linux-5.10.0-9-amd64] (local build)
Copyright (C) 2002-20, Bruce Allen, Christian Franke, www.smartmontools.org

=== START OF INFORMATION SECTION ===
Model Number:                       ADATA SX6000LNP
Serial Number:                      --
Firmware Version:                   V9002s72
PCI Vendor/Subsystem ID:            0x10ec
IEEE OUI Identifier:                0x00e04c
Controller ID:                      1
NVMe Version:                       1.3
Number of Namespaces:               1
Namespace 1 Size/Capacity:          128,035,676,160 [128 GB]
Namespace 1 Formatted LBA Size:     512
Local Time is:                      Mon Nov 15 10:15:10 2021 -03
Firmware Updates (0x02):            1 Slot
Optional Admin Commands (0x0007):   Security Format Frmw_DL
Optional NVM Commands (0x0014):     DS_Mngmt Sav/Sel_Feat
Log Page Attributes (0x03):         S/H_per_NS Cmd_Eff_Lg
Maximum Data Transfer Size:         32 Pages
Warning  Comp. Temp. Threshold:     115 Celsius
Critical Comp. Temp. Threshold:     120 Celsius

Supported Power States
St Op     Max   Active     Idle   RL RT WL WT  Ent_Lat  Ex_Lat
 0 +     8.00W       -        -    0  0  0  0        0   50000
 1 +     4.00W       -        -    1  1  1  1        0   50000
 2 +     3.00W       -        -    2  2  2  2        0   50000
 3 -   0.0500W       -        -    3  3  3  3     4000   50000
 4 -   0.0080W       -        -    4  4  4  4     8000  100000

Supported LBA Sizes (NSID 0x1)
Id Fmt  Data  Metadt  Rel_Perf
 0 +     512       0         0

=== START OF SMART DATA SECTION ===
SMART overall-health self-assessment test result: PASSED

SMART/Health Information (NVMe Log 0x02)
Critical Warning:                   0x00
Temperature:                        44 Celsius
Available Spare:                    100%
Available Spare Threshold:          32%
Percentage Used:                    0%
Data Units Read:                    2,775,967 [1.42 TB]
Data Units Written:                 3,464,188 [1.77 TB]
Host Read Commands:                 37,100,669
Host Write Commands:                49,205,015
Controller Busy Time:               0
Power Cycles:                       321
Power On Hours:                     243
Unsafe Shutdowns:                   18
Media and Data Integrity Errors:    0
Error Information Log Entries:      3
Warning  Comp. Temperature Time:    0
Critical Comp. Temperature Time:    0

Error Information (NVMe Log 0x01, 8 of 8 entries)
No Errors Logged



