smartctl 7.1 2019-12-30 r5022 [x86_64-linux-5.8.4-200.fc32.x86_64] (local build)
Copyright (C) 2002-19, Bruce Allen, Christian Franke, www.smartmontools.org

=== START OF INFORMATION SECTION ===
Device Model:     INTEL SSDSA2BW160G3H
Serial Number:    --
LU WWN Device Id: 5 001517 ...
Firmware Version: 4PC10365
User Capacity:    160,041,885,696 bytes [160 GB]
Sector Size:      512 bytes logical/physical
Rotation Rate:    Solid State Device
Device is:        Not in smartctl database [for details use: -P showall]
ATA Version is:   ATA8-ACS T13/1699-D revision 4
SATA Version is:  SATA 2.6, 3.0 Gb/s
Local Time is:    Fri Sep  4 16:57:37 2020 CDT
SMART support is: Available - device has SMART capability.
SMART support is: Enabled
AAM feature is:   Unavailable
APM feature is:   Unavailable
Rd look-ahead is: Enabled
Write cache is:   Enabled
DSN feature is:   Unavailable
ATA Security is:  Disabled, frozen [SEC2]
Unexpected SCT status 0x0002 (action_code=4, function_code=2)
Wt Cache Reorder: Unknown (SCT Feature Control command failed)

=== START OF READ SMART DATA SECTION ===
SMART overall-health self-assessment test result: PASSED

General SMART Values:
Offline data collection status:  (0x00)	Offline data collection activity
					was never started.
					Auto Offline Data Collection: Disabled.
Self-test execution status:      (   0)	The previous self-test routine completed
					without error or no self-test has ever 
					been run.
Total time to complete Offline 
data collection: 		(    1) seconds.
Offline data collection
capabilities: 			 (0x75) SMART execute Offline immediate.
					No Auto Offline data collection support.
					Abort Offline collection upon new
					command.
					No Offline surface scan supported.
					Self-test supported.
					Conveyance Self-test supported.
					Selective Self-test supported.
SMART capabilities:            (0x0003)	Saves SMART data before entering
					power-saving mode.
					Supports SMART auto save timer.
Error logging capability:        (0x01)	Error logging supported.
					General Purpose Logging supported.
Short self-test routine 
recommended polling time: 	 (   1) minutes.
Extended self-test routine
recommended polling time: 	 (  22) minutes.
Conveyance self-test routine
recommended polling time: 	 (   1) minutes.
SCT capabilities: 	       (0x003d)	SCT Status supported.
					SCT Error Recovery Control supported.
					SCT Feature Control supported.
					SCT Data Table supported.

SMART Attributes Data Structure revision number: 5
Vendor Specific SMART Attributes with Thresholds:
ID# ATTRIBUTE_NAME          FLAGS    VALUE WORST THRESH FAIL RAW_VALUE
  3 Spin_Up_Time            -----K   100   100   000    -    0
  4 Start_Stop_Count        ----CK   100   100   000    -    0
  5 Reallocated_Sector_Ct   -O--CK   100   100   000    -    0
  9 Power_On_Hours          -O--CK   100   100   000    -    5822
 12 Power_Cycle_Count       -O--CK   100   100   000    -    2460
170 Unknown_Attribute       PO--CK   100   100   010    -    0
171 Unknown_Attribute       -O--CK   100   100   000    -    0
172 Unknown_Attribute       -O--CK   100   100   000    -    0
183 Runtime_Bad_Block       -O--CK   100   100   010    -    0
184 End-to-End_Error        PO--CK   100   100   097    -    0
187 Reported_Uncorrect      -O--CK   100   100   000    -    0
192 Power-Off_Retract_Count -O--CK   100   100   000    -    188
199 UDMA_CRC_Error_Count    -OS-CK   100   100   000    -    0
225 Unknown_SSD_Attribute   -O--CK   100   100   000    -    193677
226 Unknown_SSD_Attribute   -O--CK   100   100   000    -    65535
227 Unknown_SSD_Attribute   -O--CK   100   100   000    -    65535
228 Power-off_Retract_Count -O--CK   100   100   000    -    65535
232 Available_Reservd_Space PO--CK   100   100   010    -    0
233 Media_Wearout_Indicator -O--CK   099   099   000    -    0
241 Total_LBAs_Written      -O--CK   100   100   000    -    193677
242 Total_LBAs_Read         -O--CK   100   100   000    -    159788
                            ||||||_ K auto-keep
                            |||||__ C event count
                            ||||___ R error rate
                            |||____ S speed/performance
                            ||_____ O updated online
                            |______ P prefailure warning

General Purpose Log Directory Version 1
SMART           Log Directory Version 1 [multi-sector log support]
Address    Access  R/W   Size  Description
0x00       GPL,SL  R/O      1  Log Directory
0x01       GPL,SL  R/O      1  Summary SMART error log
0x02       GPL,SL  R/O      8  Comprehensive SMART error log
0x03       GPL,SL  R/O      8  Ext. Comprehensive SMART error log
0x04       GPL,SL  R/O      8  Device Statistics log
0x06       GPL,SL  R/O      1  SMART self-test log
0x07       GPL,SL  R/O      1  Extended self-test log
0x09       GPL,SL  R/W      1  Selective self-test log
0x10       GPL,SL  R/O      1  NCQ Command Error log
0x11       GPL,SL  R/O      1  SATA Phy Event Counters log
0x80-0x9f  GPL,SL  R/W     16  Host vendor specific log
0xe0       GPL,SL  R/W      1  SCT Command/Status
0xe1       GPL,SL  R/W      1  SCT Data Transfer

SMART Extended Comprehensive Error Log Version: 1 (8 sectors)
No Errors Logged

SMART Extended Self-test Log Version: 1 (1 sectors)
No self-tests have been logged.  [To run self-tests, use: smartctl -t]

SMART Selective self-test log data structure revision number 0
Note: revision number not 1 implies that no selective self-test has ever been run
 SPAN  MIN_LBA  MAX_LBA  CURRENT_TEST_STATUS
    1        0        0  Not_testing
    2        0        0  Not_testing
    3        0        0  Not_testing
    4        0        0  Not_testing
    5        0        0  Not_testing
Selective self-test flags (0x0):
  After scanning selected spans, do NOT read-scan remainder of disk.
If Selective self-test is pending on power-up, resume after 0 minute delay.

SCT Status Version:                  3
SCT Version (vendor specific):       1 (0x0001)
Device State:                        Active (0)
Current Temperature:                     ? Celsius
Power Cycle Min/Max Temperature:      ?/ ? Celsius
Lifetime    Min/Max Temperature:      ?/ ? Celsius
Under/Over Temperature Limit Count:   0/0

Read SCT Data Table failed: scsi error badly formed scsi parameters
Read SCT Temperature History failed

SCT Error Recovery Control:
           Read: Disabled
          Write: Disabled

Device Statistics (GP Log 0x04)
Page  Offset Size        Value Flags Description
0x01  =====  =               =  ===  == General Statistics (rev 2) ==
0x01  0x008  4            2460  ---  Lifetime Power-On Resets
0x01  0x010  4            5822  ---  Power-on Hours
0x01  0x018  6     12692816386  ---  Logical Sectors Written
0x01  0x020  6       424034707  ---  Number of Write Commands
0x01  0x028  6     10471878831  ---  Logical Sectors Read
0x01  0x030  6       267181520  ---  Number of Read Commands
0x04  =====  =               =  ===  == General Errors Statistics (rev 1) ==
0x04  0x008  4               0  ---  Number of Reported Uncorrectable Errors
0x04  0x010  4               0  ---  Resets Between Cmd Acceptance and Completion
0x06  =====  =               =  ===  == Transport Statistics (rev 1) ==
0x06  0x008  4           10435  ---  Number of Hardware Resets
0x06  0x010  4        20304117  ---  Number of ASR Events
0x06  0x018  4               0  ---  Number of Interface CRC Errors
0x07  =====  =               =  ===  == Solid State Device Statistics (rev 1) ==
0x07  0x008  1               1  ---  Percentage Used Endurance Indicator
                                |||_ C monitored condition met
                                ||__ D supports DSN
                                |___ N normalized value

Pending Defects log (GP Log 0x0c) not supported

SATA Phy Event Counters (GP Log 0x11)
ID      Size     Value  Description
0x0001  4            0  Command failed due to ICRC error
0x0004  4            0  R_ERR response for host-to-device data FIS
0x0007  4            0  R_ERR response for host-to-device non-data FIS
0x0008  4            0  Device-to-host non-data FIS retries
0x0009  4          625  Transition from drive PhyRdy to drive PhyNRdy
0x000a  4            5  Device-to-host register FISes sent due to a COMRESET
0x000b  4            0  CRC errors within host-to-device FIS
0x000d  4            0  Non-CRC errors within host-to-device FIS
0x000f  4            0  R_ERR response for host-to-device data FIS, CRC
0x0010  4            0  R_ERR response for host-to-device data FIS, non-CRC
0x0012  4            0  R_ERR response for host-to-device non-data FIS, CRC
0x0013  4            0  R_ERR response for host-to-device non-data FIS, non-CRC



