smartctl 7.2 2020-12-30 r5155 [x86_64-linux-5.16.7-desktop-1omv4003] (OpenMandriva Lx 7.2-2)
Copyright (C) 2002-20, Bruce Allen, Christian Franke, www.smartmontools.org

=== START OF INFORMATION SECTION ===
Device Model:     SAMSUNG HD256GM
Serial Number:    --
LU WWN Device Id: 5 0024e9 ...
Firmware Version: 1AR10205
User Capacity:    250,059,350,016 bytes [250 GB]
Sector Size:      512 bytes logical/physical
Rotation Rate:    7200 rpm
Form Factor:      3.5 inches
Device is:        Not in smartctl database [for details use: -P showall]
ATA Version is:   ATA8-ACS T13/1699-D revision 6
SATA Version is:  SATA 2.6, 6.0 Gb/s
Local Time is:    Fri Nov 25 01:01:51 2022 GMT
SMART support is: Available - device has SMART capability.
SMART support is: Enabled
AAM feature is:   Unavailable
APM feature is:   Disabled
Rd look-ahead is: Enabled
Write cache is:   Enabled
DSN feature is:   Unavailable
ATA Security is:  Disabled, frozen [SEC2]
Wt Cache Reorder: Enabled

=== START OF READ SMART DATA SECTION ===
SMART overall-health self-assessment test result: PASSED

General SMART Values:
Offline data collection status:  (0x80)	Offline data collection activity
					was never started.
					Auto Offline Data Collection: Enabled.
Self-test execution status:      (   0)	The previous self-test routine completed
					without error or no self-test has ever 
					been run.
Total time to complete Offline 
data collection: 		( 2100) seconds.
Offline data collection
capabilities: 			 (0x5b) SMART execute Offline immediate.
					Auto Offline data collection on/off support.
					Suspend Offline collection upon new
					command.
					Offline surface scan supported.
					Self-test supported.
					No Conveyance Self-test supported.
					Selective Self-test supported.
SMART capabilities:            (0x0003)	Saves SMART data before entering
					power-saving mode.
					Supports SMART auto save timer.
Error logging capability:        (0x01)	Error logging supported.
					General Purpose Logging supported.
Short self-test routine 
recommended polling time: 	 (   2) minutes.
Extended self-test routine
recommended polling time: 	 (  35) minutes.
SCT capabilities: 	       (0x003d)	SCT Status supported.
					SCT Error Recovery Control supported.
					SCT Feature Control supported.
					SCT Data Table supported.

SMART Attributes Data Structure revision number: 16
Vendor Specific SMART Attributes with Thresholds:
ID# ATTRIBUTE_NAME          FLAGS    VALUE WORST THRESH FAIL RAW_VALUE
  1 Raw_Read_Error_Rate     POSR-K   100   100   051    -    4981
  2 Throughput_Performance  POS--K   053   053   000    -    2032
  3 Spin_Up_Time            PO---K   091   074   025    -    2829
  4 Start_Stop_Count        -O--CK   100   100   000    -    792
  5 Reallocated_Sector_Ct   PO--CK   252   252   010    -    0
  7 Seek_Error_Rate         POSR-K   252   252   051    -    0
  8 Seek_Time_Performance   P-S--K   252   252   015    -    0
  9 Power_On_Hours          -O--CK   100   100   000    -    85402
 10 Spin_Retry_Count        PO--CK   252   252   051    -    0
 11 Calibration_Retry_Count -O--CK   252   252   000    -    0
 12 Power_Cycle_Count       -O--CK   100   100   000    -    745
183 Runtime_Bad_Block       -O--CK   100   100   010    -    11
184 End-to-End_Error        PO--CK   252   252   097    -    0
186 Unknown_Attribute       -O--CK   252   252   000    -    0
187 Reported_Uncorrect      -O--CK   100   100   000    -    4923
188 Command_Timeout         -O--CK   252   252   000    -    0
190 Airflow_Temperature_Cel -O----   076   062   040    -    24 (Min/Max 12/39)
191 G-Sense_Error_Rate      -O---K   100   100   000    -    3265
192 Power-Off_Retract_Count -O---K   252   252   000    -    0
193 Load_Cycle_Count        -O--CK   100   100   000    -    872
194 Temperature_Celsius     -O----   064   062   000    -    24 (Min/Max 12/39)
195 Hardware_ECC_Recovered  -O-RCK   100   100   000    -    0
196 Reallocated_Event_Count -O--CK   252   252   000    -    0
197 Current_Pending_Sector  -O--CK   252   100   000    -    0
198 Offline_Uncorrectable   ----CK   252   100   000    -    0
199 UDMA_CRC_Error_Count    -OS-CK   200   200   000    -    0
200 Multi_Zone_Error_Rate   -O-R-K   100   100   000    -    668
                            ||||||_ K auto-keep
                            |||||__ C event count
                            ||||___ R error rate
                            |||____ S speed/performance
                            ||_____ O updated online
                            |______ P prefailure warning

General Purpose Log Directory Version 1
SMART           Log Directory Version 1 [multi-sector log support]
Address    Access  R/W   Size  Description
0x00       GPL,SL  R/O      1  Log Directory
0x01           SL  R/O      1  Summary SMART error log
0x02           SL  R/O      2  Comprehensive SMART error log
0x03       GPL     R/O      2  Ext. Comprehensive SMART error log
0x06           SL  R/O      1  SMART self-test log
0x07       GPL     R/O      2  Extended self-test log
0x08       GPL     R/O      2  Power Conditions log
0x09           SL  R/W      1  Selective self-test log
0x10       GPL     R/O      1  NCQ Command Error log
0x11       GPL     R/O      1  SATA Phy Event Counters log
0x80-0x9f  GPL,SL  R/W     16  Host vendor specific log
0xe0       GPL,SL  R/W      1  SCT Command/Status
0xe1       GPL,SL  R/W      1  SCT Data Transfer

SMART Extended Comprehensive Error Log Version: 1 (2 sectors)
Device Error Count: 4923 (device log contains only the most recent 8 errors)
	CR     = Command Register
	FEATR  = Features Register
	COUNT  = Count (was: Sector Count) Register
	LBA_48 = Upper bytes of LBA High/Mid/Low Registers ]  ATA-8
	LH     = LBA High (was: Cylinder High) Register    ]   LBA
	LM     = LBA Mid (was: Cylinder Low) Register      ] Register
	LL     = LBA Low (was: Sector Number) Register     ]
	DV     = Device (was: Device/Head) Register
	DC     = Device Control Register
	ER     = Error register
	ST     = Status register
Powered_Up_Time is measured from power on, and printed as
DDd+hh:mm:SS.sss where DD=days, hh=hours, mm=minutes,
SS=sec, and sss=millisec. It "wraps" after 49.710 days.

Error 4923 [2] occurred at disk power-on lifetime: 18492 hours (770 days + 12 hours)
  When the command that caused the error occurred, the device was active or idle.

  After command completion occurred, registers were:
  ER -- ST COUNT  LBA_48  LH LM LL DV DC
  -- -- -- == -- == == == -- -- -- -- --
  40 -- 51 00 1a 00 00 03 d1 be 9e 40 00  Error: UNC at LBA = 0x03d1be9e = 64077470

  Commands leading to the command that caused the error were:
  CR FEATR COUNT  LBA_48  LH LM LL DV DC  Powered_Up_Time  Command/Feature_Name
  -- == -- == -- == == == -- -- -- -- --  ---------------  --------------------
  60 00 00 01 00 00 00 03 d1 bd b8 40 00     00:00:01.007  READ FPDMA QUEUED
  60 00 00 01 00 00 00 03 d1 c4 b8 40 00     00:00:01.007  READ FPDMA QUEUED
  60 00 00 01 00 00 00 03 d1 c3 b8 40 00     00:00:01.007  READ FPDMA QUEUED
  60 00 00 01 00 00 00 03 d1 c2 b8 40 00     00:00:01.007  READ FPDMA QUEUED
  60 00 00 01 00 00 00 03 d1 c1 b8 40 00     00:00:01.007  READ FPDMA QUEUED

Error 4922 [1] occurred at disk power-on lifetime: 18492 hours (770 days + 12 hours)
  When the command that caused the error occurred, the device was active or idle.

  After command completion occurred, registers were:
  ER -- ST COUNT  LBA_48  LH LM LL DV DC
  -- -- -- == -- == == == -- -- -- -- --
  40 -- 51 00 1a 00 00 03 d1 be 9e 40 00  Error: WP at LBA = 0x03d1be9e = 64077470

  Commands leading to the command that caused the error were:
  CR FEATR COUNT  LBA_48  LH LM LL DV DC  Powered_Up_Time  Command/Feature_Name
  -- == -- == -- == == == -- -- -- -- --  ---------------  --------------------
  61 00 00 00 20 00 00 00 61 6e 50 40 00     00:00:01.000  WRITE FPDMA QUEUED
  60 00 00 01 00 00 00 03 d1 bd b8 40 00     00:00:00.999  READ FPDMA QUEUED
  60 00 00 01 00 00 00 03 d1 c4 b8 40 00     00:00:00.999  READ FPDMA QUEUED
  60 00 00 01 00 00 00 03 d1 c3 b8 40 00     00:00:00.999  READ FPDMA QUEUED
  60 00 00 01 00 00 00 03 d1 c2 b8 40 00     00:00:00.999  READ FPDMA QUEUED

Error 4921 [0] occurred at disk power-on lifetime: 18492 hours (770 days + 12 hours)
  When the command that caused the error occurred, the device was active or idle.

  After command completion occurred, registers were:
  ER -- ST COUNT  LBA_48  LH LM LL DV DC
  -- -- -- == -- == == == -- -- -- -- --
  40 -- 51 00 1a 00 00 03 d1 be 9e 40 00  Error: UNC at LBA = 0x03d1be9e = 64077470

  Commands leading to the command that caused the error were:
  CR FEATR COUNT  LBA_48  LH LM LL DV DC  Powered_Up_Time  Command/Feature_Name
  -- == -- == -- == == == -- -- -- -- --  ---------------  --------------------
  60 00 00 01 00 00 00 03 d1 bd b8 40 00     00:00:00.852  READ FPDMA QUEUED
  60 00 00 01 00 00 00 03 d1 c4 b8 40 00     00:00:00.852  READ FPDMA QUEUED
  60 00 00 01 00 00 00 03 d1 c3 b8 40 00     00:00:00.852  READ FPDMA QUEUED
  60 00 00 01 00 00 00 03 d1 c2 b8 40 00     00:00:00.852  READ FPDMA QUEUED
  60 00 00 01 00 00 00 03 d1 c1 b8 40 00     00:00:00.852  READ FPDMA QUEUED

Error 4920 [7] occurred at disk power-on lifetime: 18491 hours (770 days + 11 hours)
  When the command that caused the error occurred, the device was active or idle.

  After command completion occurred, registers were:
  ER -- ST COUNT  LBA_48  LH LM LL DV DC
  -- -- -- == -- == == == -- -- -- -- --
  40 -- 51 00 1a 00 00 03 d1 be 9e 40 00  Error: UNC at LBA = 0x03d1be9e = 64077470

  Commands leading to the command that caused the error were:
  CR FEATR COUNT  LBA_48  LH LM LL DV DC  Powered_Up_Time  Command/Feature_Name
  -- == -- == -- == == == -- -- -- -- --  ---------------  --------------------
  60 00 00 01 00 00 00 03 d1 bd b8 40 00     00:00:06.620  READ FPDMA QUEUED
  60 00 00 01 00 00 00 03 d1 c4 b8 40 00     00:00:06.620  READ FPDMA QUEUED
  60 00 00 01 00 00 00 03 d1 c3 b8 40 00     00:00:06.620  READ FPDMA QUEUED
  60 00 00 01 00 00 00 03 d1 c2 b8 40 00     00:00:06.620  READ FPDMA QUEUED
  60 00 00 01 00 00 00 03 d1 c1 b8 40 00     00:00:06.620  READ FPDMA QUEUED

Error 4919 [6] occurred at disk power-on lifetime: 18491 hours (770 days + 11 hours)
  When the command that caused the error occurred, the device was active or idle.

  After command completion occurred, registers were:
  ER -- ST COUNT  LBA_48  LH LM LL DV DC
  -- -- -- == -- == == == -- -- -- -- --
  40 -- 51 00 1a 00 00 03 d1 be 9e 40 00  Error: WP at LBA = 0x03d1be9e = 64077470

  Commands leading to the command that caused the error were:
  CR FEATR COUNT  LBA_48  LH LM LL DV DC  Powered_Up_Time  Command/Feature_Name
  -- == -- == -- == == == -- -- -- -- --  ---------------  --------------------
  61 00 00 00 08 00 00 0a 16 4a 78 40 00     00:00:06.575  WRITE FPDMA QUEUED
  60 00 00 01 00 00 00 03 d1 bd b8 40 00     00:00:06.574  READ FPDMA QUEUED
  60 00 00 01 00 00 00 03 d1 c4 b8 40 00     00:00:06.574  READ FPDMA QUEUED
  60 00 00 01 00 00 00 03 d1 c3 b8 40 00     00:00:06.574  READ FPDMA QUEUED
  60 00 00 01 00 00 00 03 d1 c2 b8 40 00     00:00:06.574  READ FPDMA QUEUED

Error 4918 [5] occurred at disk power-on lifetime: 18491 hours (770 days + 11 hours)
  When the command that caused the error occurred, the device was active or idle.

  After command completion occurred, registers were:
  ER -- ST COUNT  LBA_48  LH LM LL DV DC
  -- -- -- == -- == == == -- -- -- -- --
  40 -- 51 00 1a 00 00 03 d1 be 9e 40 00  Error: WP at LBA = 0x03d1be9e = 64077470

  Commands leading to the command that caused the error were:
  CR FEATR COUNT  LBA_48  LH LM LL DV DC  Powered_Up_Time  Command/Feature_Name
  -- == -- == -- == == == -- -- -- -- --  ---------------  --------------------
  61 00 00 00 18 00 00 00 61 6e 50 40 00     00:00:06.480  WRITE FPDMA QUEUED
  60 00 00 01 00 00 00 03 d1 bd b8 40 00     00:00:06.479  READ FPDMA QUEUED
  60 00 00 01 00 00 00 03 d1 c4 b8 40 00     00:00:06.479  READ FPDMA QUEUED
  60 00 00 01 00 00 00 03 d1 c3 b8 40 00     00:00:06.479  READ FPDMA QUEUED
  60 00 00 01 00 00 00 03 d1 c2 b8 40 00     00:00:06.479  READ FPDMA QUEUED

Error 4917 [4] occurred at disk power-on lifetime: 18491 hours (770 days + 11 hours)
  When the command that caused the error occurred, the device was active or idle.

  After command completion occurred, registers were:
  ER -- ST COUNT  LBA_48  LH LM LL DV DC
  -- -- -- == -- == == == -- -- -- -- --
  40 -- 51 00 1a 00 00 03 d1 be 9e 40 00  Error: UNC at LBA = 0x03d1be9e = 64077470

  Commands leading to the command that caused the error were:
  CR FEATR COUNT  LBA_48  LH LM LL DV DC  Powered_Up_Time  Command/Feature_Name
  -- == -- == -- == == == -- -- -- -- --  ---------------  --------------------
  60 00 00 01 00 00 00 03 d1 bd b8 40 00     00:00:05.216  READ FPDMA QUEUED
  60 00 00 01 00 00 00 03 d1 c4 b8 40 00     00:00:05.216  READ FPDMA QUEUED
  60 00 00 01 00 00 00 03 d1 c3 b8 40 00     00:00:05.216  READ FPDMA QUEUED
  60 00 00 01 00 00 00 03 d1 c2 b8 40 00     00:00:05.216  READ FPDMA QUEUED
  60 00 00 01 00 00 00 03 d1 c1 b8 40 00     00:00:05.216  READ FPDMA QUEUED

Error 4916 [3] occurred at disk power-on lifetime: 18491 hours (770 days + 11 hours)
  When the command that caused the error occurred, the device was active or idle.

  After command completion occurred, registers were:
  ER -- ST COUNT  LBA_48  LH LM LL DV DC
  -- -- -- == -- == == == -- -- -- -- --
  40 -- 51 00 01 00 00 03 d1 be 9e 40 00  Error: UNC at LBA = 0x03d1be9e = 64077470

  Commands leading to the command that caused the error were:
  CR FEATR COUNT  LBA_48  LH LM LL DV DC  Powered_Up_Time  Command/Feature_Name
  -- == -- == -- == == == -- -- -- -- --  ---------------  --------------------
  60 00 00 00 01 00 00 03 d1 be 9e 40 00     00:00:05.215  READ FPDMA QUEUED
  60 00 00 00 01 00 00 03 d1 be 9e 40 00     00:00:05.215  READ FPDMA QUEUED
  60 00 00 00 01 00 00 03 d1 be 9d 40 00     00:00:05.215  READ FPDMA QUEUED
  60 00 00 00 01 00 00 03 d1 be 9c 40 00     00:00:05.215  READ FPDMA QUEUED
  60 00 00 00 01 00 00 03 d1 be 9b 40 00     00:00:05.215  READ FPDMA QUEUED

SMART Extended Self-test Log Version: 1 (2 sectors)
Num  Test_Description    Status                  Remaining  LifeTime(hours)  LBA_of_first_error
# 1  Short offline       Completed without error       00%     16229         -
# 2  Extended offline    Completed without error       00%      2746         -
# 3  Short offline       Completed without error       00%      2745         -
# 4  Short offline       Aborted by host               90%      2745         -
# 5  Extended offline    Aborted by host               70%         1         -

SMART Selective self-test log data structure revision number 0
Note: revision number not 1 implies that no selective self-test has ever been run
 SPAN  MIN_LBA  MAX_LBA  CURRENT_TEST_STATUS
    1        0        0  Completed [00% left] (0-65535)
    2        0        0  Not_testing
    3        0        0  Not_testing
    4        0        0  Not_testing
    5        0        0  Not_testing
Selective self-test flags (0x0):
  After scanning selected spans, do NOT read-scan remainder of disk.
If Selective self-test is pending on power-up, resume after 0 minute delay.

SCT Status Version:                  2
SCT Version (vendor specific):       256 (0x0100)
Device State:                        Active (0)
Current Temperature:                    24 Celsius
Power Cycle Min/Max Temperature:     24/25 Celsius
Lifetime    Min/Max Temperature:     12/39 Celsius
Specified Max Operating Temperature:    80 Celsius
Under/Over Temperature Limit Count:   0/0

SCT Temperature History Version:     2
Temperature Sampling Period:         5 minutes
Temperature Logging Interval:        5 minutes
Min/Max recommended Temperature:     -5/80 Celsius
Min/Max Temperature Limit:           -10/85 Celsius
Temperature History Size (Index):    128 (57)

SCT Error Recovery Control:
           Read:     75 (7.5 seconds)
          Write:     75 (7.5 seconds)

Device Statistics (GP/SMART Log 0x04) not supported

Pending Defects log (GP Log 0x0c) not supported

SATA Phy Event Counters (GP Log 0x11)
ID      Size     Value  Description
0x0001  4            0  Command failed due to ICRC error
0x0002  4            0  R_ERR response for data FIS
0x0003  4            0  R_ERR response for device-to-host data FIS
0x0004  4            0  R_ERR response for host-to-device data FIS
0x0005  4            0  R_ERR response for non-data FIS
0x0006  4            0  R_ERR response for device-to-host non-data FIS
0x0007  4            0  R_ERR response for host-to-device non-data FIS
0x0008  4            0  Device-to-host non-data FIS retries
0x0009  4            3  Transition from drive PhyRdy to drive PhyNRdy
0x000a  4            2  Device-to-host register FISes sent due to a COMRESET
0x000b  4            0  CRC errors within host-to-device FIS
0x000d  4            0  Non-CRC errors within host-to-device FIS
0x000f  4            0  R_ERR response for host-to-device data FIS, CRC
0x0010  4            0  R_ERR response for host-to-device data FIS, non-CRC
0x0012  4            0  R_ERR response for host-to-device non-data FIS, CRC
0x0013  4            0  R_ERR response for host-to-device non-data FIS, non-CRC
0x8e00  4            0  Vendor specific
0x8e01  4            0  Vendor specific
0x8e02  4            0  Vendor specific
0x8e03  4            0  Vendor specific
0x8e04  4            0  Vendor specific
0x8e05  4            0  Vendor specific
0x8e06  4            0  Vendor specific
0x8e07  4            0  Vendor specific
0x8e08  4            0  Vendor specific
0x8e09  4            0  Vendor specific
0x8e0a  4            0  Vendor specific
0x8e0b  4            0  Vendor specific
0x8e0c  4            0  Vendor specific
0x8e0d  4            0  Vendor specific
0x8e0e  4            0  Vendor specific
0x8e0f  4            0  Vendor specific
0x8e10  4            0  Vendor specific
0x8e11  4            0  Vendor specific

