=== START OF INFORMATION SECTION ===
Model Family:     Western Digital Caviar Blue Serial ATA
Device Model:     WDC WD1600AAJS-00YZCA0
Serial Number:    --
LU WWN Device Id: 5 0014ee ...
Firmware Version: 01.03B01
User Capacity:    160,041,885,696 bytes [160 GB]
Sector Size:      512 bytes logical/physical
Device is:        In smartctl database [for details use: -P show]
ATA Version is:   ATA8-ACS (minor revision not indicated)
SATA Version is:  SATA 2.6, 3.0 Gb/s
Local Time is:    Tue Jan 23 19:46:03 2018 -03
SMART support is: Available - device has SMART capability.
SMART support is: Enabled
AAM feature is:   Disabled
APM feature is:   Unavailable
Rd look-ahead is: Enabled
Write cache is:   Enabled
ATA Security is:  Disabled, frozen [SEC2]
Wt Cache Reorder: Enabled

=== START OF READ SMART DATA SECTION ===
SMART overall-health self-assessment test result: PASSED

General SMART Values:
Offline data collection status:  (0x82)	Offline data collection activity
					was completed without error.
					Auto Offline Data Collection: Enabled.
Self-test execution status:      (   0)	The previous self-test routine completed
					without error or no self-test has ever 
					been run.
Total time to complete Offline 
data collection: 		( 3000) seconds.
Offline data collection
capabilities: 			 (0x7b) SMART execute Offline immediate.
					Auto Offline data collection on/off support.
					Suspend Offline collection upon new
					command.
					Offline surface scan supported.
					Self-test supported.
					Conveyance Self-test supported.
					Selective Self-test supported.
SMART capabilities:            (0x0003)	Saves SMART data before entering
					power-saving mode.
					Supports SMART auto save timer.
Error logging capability:        (0x01)	Error logging supported.
					General Purpose Logging supported.
Short self-test routine 
recommended polling time: 	 (   2) minutes.
Extended self-test routine
recommended polling time: 	 (  39) minutes.
Conveyance self-test routine
recommended polling time: 	 (   5) minutes.
SCT capabilities: 	       (0x3037)	SCT Status supported.
					SCT Feature Control supported.
					SCT Data Table supported.

SMART Attributes Data Structure revision number: 16
Vendor Specific SMART Attributes with Thresholds:
ID# ATTRIBUTE_NAME          FLAGS    VALUE WORST THRESH FAIL RAW_VALUE
  1 Raw_Read_Error_Rate     POSR-K   200   200   051    -    104
  3 Spin_Up_Time            POS--K   137   135   021    -    4150
  4 Start_Stop_Count        -O--CK   097   097   000    -    3940
  5 Reallocated_Sector_Ct   PO--CK   176   176   140    -    185
  7 Seek_Error_Rate         -OSR-K   200   200   000    -    0
  9 Power_On_Hours          -O--CK   072   072   000    -    20733
 10 Spin_Retry_Count        -O--CK   100   100   000    -    0
 11 Calibration_Retry_Count -O--CK   100   100   000    -    0
 12 Power_Cycle_Count       -O--CK   097   097   000    -    3873
192 Power-Off_Retract_Count -O--CK   200   200   000    -    432
193 Load_Cycle_Count        -O--CK   199   199   000    -    3491
194 Temperature_Celsius     -O---K   108   090   000    -    35
196 Reallocated_Event_Count -O--CK   058   058   000    -    142
197 Current_Pending_Sector  -O--CK   200   200   000    -    0
198 Offline_Uncorrectable   ----CK   200   200   000    -    0
199 UDMA_CRC_Error_Count    -O--CK   200   200   000    -    1
200 Multi_Zone_Error_Rate   ---R--   200   200   000    -    0
                            ||||||_ K auto-keep
                            |||||__ C event count
                            ||||___ R error rate
                            |||____ S speed/performance
                            ||_____ O updated online
                            |______ P prefailure warning

General Purpose Log Directory Version 1
SMART           Log Directory Version 1 [multi-sector log support]
Address    Access  R/W   Size  Description
0x00       GPL,SL  R/O      1  Log Directory
0x01           SL  R/O      1  Summary SMART error log
0x02           SL  R/O      5  Comprehensive SMART error log
0x03       GPL     R/O      6  Ext. Comprehensive SMART error log
0x06           SL  R/O      1  SMART self-test log
0x07       GPL     R/O      1  Extended self-test log
0x09           SL  R/W      1  Selective self-test log
0x10       GPL     R/O      1  SATA NCQ Queued Error log
0x11       GPL     R/O      1  SATA Phy Event Counters log
0x80-0x9f  GPL,SL  R/W     16  Host vendor specific log
0xa0-0xa7  GPL,SL  VS      16  Device vendor specific log
0xa8-0xb5  GPL,SL  VS       1  Device vendor specific log
0xb6       GPL     VS       1  Device vendor specific log
0xb7       GPL,SL  VS       1  Device vendor specific log
0xc0       GPL,SL  VS       1  Device vendor specific log
0xc1       GPL     VS      24  Device vendor specific log
0xe0       GPL,SL  R/W      1  SCT Command/Status
0xe1       GPL,SL  R/W      1  SCT Data Transfer

SMART Extended Comprehensive Error Log Version: 1 (6 sectors)
Device Error Count: 17
	CR     = Command Register
	FEATR  = Features Register
	COUNT  = Count (was: Sector Count) Register
	LBA_48 = Upper bytes of LBA High/Mid/Low Registers ]  ATA-8
	LH     = LBA High (was: Cylinder High) Register    ]   LBA
	LM     = LBA Mid (was: Cylinder Low) Register      ] Register
	LL     = LBA Low (was: Sector Number) Register     ]
	DV     = Device (was: Device/Head) Register
	DC     = Device Control Register
	ER     = Error register
	ST     = Status register
Powered_Up_Time is measured from power on, and printed as
DDd+hh:mm:SS.sss where DD=days, hh=hours, mm=minutes,
SS=sec, and sss=millisec. It "wraps" after 49.710 days.

Error 17 [16] occurred at disk power-on lifetime: 8662 hours (360 days + 22 hours)
  When the command that caused the error occurred, the device was active or idle.

  After command completion occurred, registers were:
  ER -- ST COUNT  LBA_48  LH LM LL DV DC
  -- -- -- == -- == == == -- -- -- -- --
  40 -- 51 00 08 00 00 11 9b 01 68 e0 00  Error: UNC 8 sectors at LBA = 0x119b0168 = 295371112

  Commands leading to the command that caused the error were:
  CR FEATR COUNT  LBA_48  LH LM LL DV DC  Powered_Up_Time  Command/Feature_Name
  -- == -- == -- == == == -- -- -- -- --  ---------------  --------------------
  25 00 00 00 08 00 00 11 9b 01 68 e0 00     09:19:21.726  READ DMA EXT
  ea 00 00 00 00 60 02 5f 00 00 00 e0 00     09:19:19.038  FLUSH CACHE EXT
  35 00 00 00 08 00 00 00 60 02 58 e0 00     09:19:19.027  WRITE DMA EXT
  35 00 00 00 01 00 00 00 27 70 88 e0 00     09:19:19.021  WRITE DMA EXT
  ea 00 00 00 00 60 02 67 00 00 00 e0 00     09:19:19.021  FLUSH CACHE EXT

Error 16 [15] occurred at disk power-on lifetime: 2591 hours (107 days + 23 hours)
  When the command that caused the error occurred, the device was active or idle.

  After command completion occurred, registers were:
  ER -- ST COUNT  LBA_48  LH LM LL DV DC
  -- -- -- == -- == == == -- -- -- -- --
  01 -- 51 01 00 00 00 12 44 7d f0 e0 00  Error: AMNF 256 sectors at LBA = 0x12447df0 = 306478576

  Commands leading to the command that caused the error were:
  CR FEATR COUNT  LBA_48  LH LM LL DV DC  Powered_Up_Time  Command/Feature_Name
  -- == -- == -- == == == -- -- -- -- --  ---------------  --------------------
  25 00 00 01 00 00 00 12 44 7d f0 e0 00     02:18:56.312  READ DMA EXT
  25 00 00 01 00 00 00 12 44 7c f0 e0 00     02:18:56.232  READ DMA EXT
  25 00 00 01 00 00 00 12 44 7b f0 e0 00     02:18:56.148  READ DMA EXT
  25 00 00 01 00 00 00 12 44 7a f0 e0 00     02:18:56.053  READ DMA EXT
  35 00 00 00 08 00 00 00 5b f6 70 e0 00     02:18:56.047  WRITE DMA EXT

Error 15 [14] occurred at disk power-on lifetime: 2590 hours (107 days + 22 hours)
  When the command that caused the error occurred, the device was active or idle.

  After command completion occurred, registers were:
  ER -- ST COUNT  LBA_48  LH LM LL DV DC
  -- -- -- == -- == == == -- -- -- -- --
  40 -- 51 01 00 00 00 12 41 7b 70 e0 00  Error: UNC 256 sectors at LBA = 0x12417b70 = 306281328

  Commands leading to the command that caused the error were:
  CR FEATR COUNT  LBA_48  LH LM LL DV DC  Powered_Up_Time  Command/Feature_Name
  -- == -- == -- == == == -- -- -- -- --  ---------------  --------------------
  25 00 00 01 00 00 00 12 41 7b 70 e0 00     02:17:05.713  READ DMA EXT
  35 00 00 00 08 00 00 00 e2 d4 40 e0 00     02:17:05.710  WRITE DMA EXT
  35 00 00 00 08 00 00 00 e2 ca d8 e0 00     02:17:05.708  WRITE DMA EXT
  35 00 00 00 08 00 00 00 e2 c8 b8 e0 00     02:17:05.703  WRITE DMA EXT
  35 00 00 00 10 00 00 00 e2 be 80 e0 00     02:17:05.701  WRITE DMA EXT

Error 14 [13] occurred at disk power-on lifetime: 2590 hours (107 days + 22 hours)
  When the command that caused the error occurred, the device was active or idle.

  After command completion occurred, registers were:
  ER -- ST COUNT  LBA_48  LH LM LL DV DC
  -- -- -- == -- == == == -- -- -- -- --
  40 -- 51 00 78 00 00 12 41 6b f8 e0 00  Error: UNC 120 sectors at LBA = 0x12416bf8 = 306277368

  Commands leading to the command that caused the error were:
  CR FEATR COUNT  LBA_48  LH LM LL DV DC  Powered_Up_Time  Command/Feature_Name
  -- == -- == -- == == == -- -- -- -- --  ---------------  --------------------
  25 00 00 00 78 00 00 12 41 6b f8 e0 00     02:16:54.054  READ DMA EXT
  25 00 00 00 08 00 00 12 41 6b f0 e0 00     02:16:54.054  READ DMA EXT
  25 00 00 00 40 00 00 02 da 6a 88 e0 00     02:16:53.131  READ DMA EXT
  35 00 00 00 08 00 00 00 61 54 00 e0 00     02:16:53.131  WRITE DMA EXT
  35 00 00 00 08 00 00 00 5f fd 50 e0 00     02:16:53.131  WRITE DMA EXT

Error 13 [12] occurred at disk power-on lifetime: 2590 hours (107 days + 22 hours)
  When the command that caused the error occurred, the device was active or idle.

  After command completion occurred, registers were:
  ER -- ST COUNT  LBA_48  LH LM LL DV DC
  -- -- -- == -- == == == -- -- -- -- --
  40 -- 51 00 80 00 00 12 41 6b f0 e0 00  Error: UNC 128 sectors at LBA = 0x12416bf0 = 306277360

  Commands leading to the command that caused the error were:
  CR FEATR COUNT  LBA_48  LH LM LL DV DC  Powered_Up_Time  Command/Feature_Name
  -- == -- == -- == == == -- -- -- -- --  ---------------  --------------------
  25 00 00 00 80 00 00 12 41 6b f0 e0 00     02:16:48.310  READ DMA EXT
  25 00 00 00 08 00 00 12 41 6b 70 e0 00     02:16:48.309  READ DMA EXT
  25 00 00 00 40 00 00 02 da 6a 38 e0 00     02:16:48.143  READ DMA EXT
  35 00 00 00 20 00 00 00 68 a8 40 e0 00     02:16:48.094  WRITE DMA EXT
  35 00 00 00 08 00 00 00 61 51 a0 e0 00     02:16:48.061  WRITE DMA EXT

Error 12 [11] occurred at disk power-on lifetime: 2590 hours (107 days + 22 hours)
  When the command that caused the error occurred, the device was active or idle.

  After command completion occurred, registers were:
  ER -- ST COUNT  LBA_48  LH LM LL DV DC
  -- -- -- == -- == == == -- -- -- -- --
  40 -- 51 01 00 00 00 12 41 6b 70 e0 00  Error: UNC 256 sectors at LBA = 0x12416b70 = 306277232

  Commands leading to the command that caused the error were:
  CR FEATR COUNT  LBA_48  LH LM LL DV DC  Powered_Up_Time  Command/Feature_Name
  -- == -- == -- == == == -- -- -- -- --  ---------------  --------------------
  25 00 00 01 00 00 00 12 41 6b 70 e0 00     02:16:33.269  READ DMA EXT
  25 00 00 00 40 00 00 02 da 51 20 e0 00     02:16:33.245  READ DMA EXT
  35 00 00 00 06 00 00 00 e7 e1 38 e0 00     02:16:33.245  WRITE DMA EXT
  35 00 00 00 08 00 00 00 df fc f8 e0 00     02:16:33.244  WRITE DMA EXT
  35 00 00 00 08 00 00 00 5f fb f8 e0 00     02:16:33.244  WRITE DMA EXT

Error 11 [10] occurred at disk power-on lifetime: 2590 hours (107 days + 22 hours)
  When the command that caused the error occurred, the device was active or idle.

  After command completion occurred, registers were:
  ER -- ST COUNT  LBA_48  LH LM LL DV DC
  -- -- -- == -- == == == -- -- -- -- --
  40 -- 51 01 00 00 00 12 41 6b 70 e0 00  Error: UNC 256 sectors at LBA = 0x12416b70 = 306277232

  Commands leading to the command that caused the error were:
  CR FEATR COUNT  LBA_48  LH LM LL DV DC  Powered_Up_Time  Command/Feature_Name
  -- == -- == -- == == == -- -- -- -- --  ---------------  --------------------
  25 00 00 01 00 00 00 12 41 6b 70 e0 00     02:16:29.750  READ DMA EXT
  25 00 00 00 40 00 00 02 da 53 38 e0 00     02:16:29.743  READ DMA EXT
  35 00 00 00 10 00 00 00 5b fb f8 e0 00     02:16:29.742  WRITE DMA EXT
  35 00 00 00 18 00 00 00 33 b5 e0 e0 00     02:16:29.742  WRITE DMA EXT
  25 00 00 00 40 00 00 02 da 53 80 e0 00     02:16:29.696  READ DMA EXT

Error 10 [9] occurred at disk power-on lifetime: 2590 hours (107 days + 22 hours)
  When the command that caused the error occurred, the device was active or idle.

  After command completion occurred, registers were:
  ER -- ST COUNT  LBA_48  LH LM LL DV DC
  -- -- -- == -- == == == -- -- -- -- --
  40 -- 51 01 00 00 00 12 41 67 70 e0 00  Error: UNC 256 sectors at LBA = 0x12416770 = 306276208

  Commands leading to the command that caused the error were:
  CR FEATR COUNT  LBA_48  LH LM LL DV DC  Powered_Up_Time  Command/Feature_Name
  -- == -- == -- == == == -- -- -- -- --  ---------------  --------------------
  25 00 00 01 00 00 00 12 41 67 70 e0 00     02:16:21.666  READ DMA EXT
  25 00 00 00 40 00 00 02 da 22 e0 e0 00     02:16:21.587  READ DMA EXT
  35 00 00 00 18 00 00 00 5b fb 00 e0 00     02:16:21.587  WRITE DMA EXT
  25 00 00 01 00 00 00 12 41 66 70 e0 00     02:16:21.381  READ DMA EXT
  25 00 00 00 40 00 00 01 97 d1 a8 e0 00     02:16:21.282  READ DMA EXT

SMART Extended Self-test Log Version: 1 (1 sectors)
Num  Test_Description    Status                  Remaining  LifeTime(hours)  LBA_of_first_error
# 1  Short offline       Aborted by host               90%      3510         -
# 2  Extended offline    Aborted by host               90%      3510         -

SMART Selective self-test log data structure revision number 1
 SPAN  MIN_LBA  MAX_LBA  CURRENT_TEST_STATUS
    1        0        0  Not_testing
    2        0        0  Not_testing
    3        0        0  Not_testing
    4        0        0  Not_testing
    5        0        0  Not_testing
Selective self-test flags (0x0):
  After scanning selected spans, do NOT read-scan remainder of disk.
If Selective self-test is pending on power-up, resume after 0 minute delay.

SCT Status Version:                  2
SCT Version (vendor specific):       258 (0x0102)
SCT Support Level:                   1
Device State:                        Active (0)
Current Temperature:                    35 Celsius
Power Cycle Min/Max Temperature:     22/41 Celsius
Lifetime    Min/Max Temperature:     35/53 Celsius
Under/Over Temperature Limit Count:   0/0

SCT Temperature History Version:     2
Temperature Sampling Period:         1 minute
Temperature Logging Interval:        1 minute
Min/Max recommended Temperature:      0/60 Celsius
Min/Max Temperature Limit:           -41/85 Celsius
Temperature History Size (Index):    478 (119)

SCT Error Recovery Control command not supported

Device Statistics (GP/SMART Log 0x04) not supported

SATA Phy Event Counters (GP Log 0x11)
ID      Size     Value  Description
0x0001  2            0  Command failed due to ICRC error
0x0002  2            0  R_ERR response for data FIS
0x0003  2            0  R_ERR response for device-to-host data FIS
0x0004  2            0  R_ERR response for host-to-device data FIS
0x0005  2            0  R_ERR response for non-data FIS
0x0006  2            0  R_ERR response for device-to-host non-data FIS
0x0007  2            0  R_ERR response for host-to-device non-data FIS
0x000a  2            1  Device-to-host register FISes sent due to a COMRESET
0x000b  2            0  CRC errors within host-to-device FIS
0x8000  4        47573  Vendor specific

