=== START OF INFORMATION SECTION ===
Model Family:     Western Digital Caviar Green (AF)
Device Model:     WDC WD15EARS-00Z5B1
Serial Number:    --
LU WWN Device Id: 5 0014ee ...
Firmware Version: 80.00A80
User Capacity:    1 500 301 910 016 bytes [1,50 TB]
Sector Size:      512 bytes logical/physical
Device is:        In smartctl database [for details use: -P show]
ATA Version is:   ATA8-ACS (minor revision not indicated)
SATA Version is:  SATA 2.6, 3.0 Gb/s
Local Time is:    Tue Oct 31 15:22:46 2017 MSK
SMART support is: Available - device has SMART capability.
SMART support is: Enabled
AAM feature is:   Disabled
APM feature is:   Unavailable
Rd look-ahead is: Enabled
Write cache is:   Enabled
ATA Security is:  Disabled, frozen [SEC2]
Wt Cache Reorder: Enabled

=== START OF READ SMART DATA SECTION ===
SMART overall-health self-assessment test result: PASSED

General SMART Values:
Offline data collection status:  (0x84)	Offline data collection activity
					was suspended by an interrupting command from host.
					Auto Offline Data Collection: Enabled.
Self-test execution status:      (   0)	The previous self-test routine completed
					without error or no self-test has ever 
					been run.
Total time to complete Offline 
data collection: 		(33600) seconds.
Offline data collection
capabilities: 			 (0x7b) SMART execute Offline immediate.
					Auto Offline data collection on/off support.
					Suspend Offline collection upon new
					command.
					Offline surface scan supported.
					Self-test supported.
					Conveyance Self-test supported.
					Selective Self-test supported.
SMART capabilities:            (0x0003)	Saves SMART data before entering
					power-saving mode.
					Supports SMART auto save timer.
Error logging capability:        (0x01)	Error logging supported.
					General Purpose Logging supported.
Short self-test routine 
recommended polling time: 	 (   2) minutes.
Extended self-test routine
recommended polling time: 	 ( 383) minutes.
Conveyance self-test routine
recommended polling time: 	 (   5) minutes.
SCT capabilities: 	       (0x3031)	SCT Status supported.
					SCT Feature Control supported.
					SCT Data Table supported.

SMART Attributes Data Structure revision number: 16
Vendor Specific SMART Attributes with Thresholds:
ID# ATTRIBUTE_NAME          FLAGS    VALUE WORST THRESH FAIL RAW_VALUE
  1 Raw_Read_Error_Rate     POSR-K   200   200   051    -    0
  3 Spin_Up_Time            POS--K   248   178   021    -    2583
  4 Start_Stop_Count        -O--CK   096   096   000    -    4786
  5 Reallocated_Sector_Ct   PO--CK   200   200   140    -    0
  7 Seek_Error_Rate         -OSR-K   200   200   000    -    0
  9 Power_On_Hours          -O--CK   079   079   000    -    15802
 10 Spin_Retry_Count        -O--CK   100   100   000    -    0
 11 Calibration_Retry_Count -O--CK   100   100   000    -    0
 12 Power_Cycle_Count       -O--CK   096   096   000    -    4634
192 Power-Off_Retract_Count -O--CK   200   200   000    -    405
193 Load_Cycle_Count        -O--CK   148   148   000    -    157228
194 Temperature_Celsius     -O---K   110   100   000    -    40
196 Reallocated_Event_Count -O--CK   200   200   000    -    0
197 Current_Pending_Sector  -O--CK   200   200   000    -    7
198 Offline_Uncorrectable   ----CK   200   200   000    -    7
199 UDMA_CRC_Error_Count    -O--CK   200   200   000    -    1
200 Multi_Zone_Error_Rate   ---R--   200   200   000    -    7
                            ||||||_ K auto-keep
                            |||||__ C event count
                            ||||___ R error rate
                            |||____ S speed/performance
                            ||_____ O updated online
                            |______ P prefailure warning

General Purpose Log Directory Version 1
SMART           Log Directory Version 1 [multi-sector log support]
Address    Access  R/W   Size  Description
0x00       GPL,SL  R/O      1  Log Directory
0x01           SL  R/O      1  Summary SMART error log
0x02           SL  R/O      5  Comprehensive SMART error log
0x03       GPL     R/O      6  Ext. Comprehensive SMART error log
0x06           SL  R/O      1  SMART self-test log
0x07       GPL     R/O      1  Extended self-test log
0x09           SL  R/W      1  Selective self-test log
0x10       GPL     R/O      1  SATA NCQ Queued Error log
0x11       GPL     R/O      1  SATA Phy Event Counters log
0x80-0x9f  GPL,SL  R/W     16  Host vendor specific log
0xa0-0xa7  GPL,SL  VS      16  Device vendor specific log
0xa8-0xb7  GPL,SL  VS       1  Device vendor specific log
0xc0       GPL,SL  VS       1  Device vendor specific log
0xc1       GPL     VS      93  Device vendor specific log
0xe0       GPL,SL  R/W      1  SCT Command/Status
0xe1       GPL,SL  R/W      1  SCT Data Transfer

SMART Extended Comprehensive Error Log Version: 1 (6 sectors)
Device Error Count: 1119 (device log contains only the most recent 24 errors)
	CR     = Command Register
	FEATR  = Features Register
	COUNT  = Count (was: Sector Count) Register
	LBA_48 = Upper bytes of LBA High/Mid/Low Registers ]  ATA-8
	LH     = LBA High (was: Cylinder High) Register    ]   LBA
	LM     = LBA Mid (was: Cylinder Low) Register      ] Register
	LL     = LBA Low (was: Sector Number) Register     ]
	DV     = Device (was: Device/Head) Register
	DC     = Device Control Register
	ER     = Error register
	ST     = Status register
Powered_Up_Time is measured from power on, and printed as
DDd+hh:mm:SS.sss where DD=days, hh=hours, mm=minutes,
SS=sec, and sss=millisec. It "wraps" after 49.710 days.

Error 1119 [14] occurred at disk power-on lifetime: 10289 hours (428 days + 17 hours)
  When the command that caused the error occurred, the device was active or idle.

  After command completion occurred, registers were:
  ER -- ST COUNT  LBA_48  LH LM LL DV DC
  -- -- -- == -- == == == -- -- -- -- --
  40 -- 51 00 08 00 00 7c bd c5 27 e0 00  Error: UNC 8 sectors at LBA = 0x7cbdc527 = 2092811559

  Commands leading to the command that caused the error were:
  CR FEATR COUNT  LBA_48  LH LM LL DV DC  Powered_Up_Time  Command/Feature_Name
  -- == -- == -- == == == -- -- -- -- --  ---------------  --------------------
  25 00 00 00 08 00 00 7c bd c5 27 e0 00     02:00:40.908  READ DMA EXT
  25 00 00 00 80 00 00 7c bd c5 27 e0 00     02:00:38.085  READ DMA EXT
  42 00 00 00 08 00 00 95 ef 42 3f e0 00     02:00:38.061  READ VERIFY SECTOR(S) EXT
  25 00 00 00 08 00 00 7c bd c5 1f e0 00     02:00:34.926  READ DMA EXT
  25 00 00 00 80 00 00 7c bd c5 1f e0 00     02:00:32.104  READ DMA EXT

Error 1118 [13] occurred at disk power-on lifetime: 10289 hours (428 days + 17 hours)
  When the command that caused the error occurred, the device was active or idle.

  After command completion occurred, registers were:
  ER -- ST COUNT  LBA_48  LH LM LL DV DC
  -- -- -- == -- == == == -- -- -- -- --
  40 -- 51 00 80 00 00 7c bd c5 27 e0 00  Error: UNC 128 sectors at LBA = 0x7cbdc527 = 2092811559

  Commands leading to the command that caused the error were:
  CR FEATR COUNT  LBA_48  LH LM LL DV DC  Powered_Up_Time  Command/Feature_Name
  -- == -- == -- == == == -- -- -- -- --  ---------------  --------------------
  25 00 00 00 80 00 00 7c bd c5 27 e0 00     02:00:38.085  READ DMA EXT
  42 00 00 00 08 00 00 95 ef 42 3f e0 00     02:00:38.061  READ VERIFY SECTOR(S) EXT
  25 00 00 00 08 00 00 7c bd c5 1f e0 00     02:00:34.926  READ DMA EXT
  25 00 00 00 80 00 00 7c bd c5 1f e0 00     02:00:32.104  READ DMA EXT
  42 00 00 00 08 00 00 95 ef 42 37 e0 00     02:00:32.103  READ VERIFY SECTOR(S) EXT

Error 1117 [12] occurred at disk power-on lifetime: 10289 hours (428 days + 17 hours)
  When the command that caused the error occurred, the device was active or idle.

  After command completion occurred, registers were:
  ER -- ST COUNT  LBA_48  LH LM LL DV DC
  -- -- -- == -- == == == -- -- -- -- --
  40 -- 51 00 08 00 00 7c bd c5 1f e0 00  Error: UNC 8 sectors at LBA = 0x7cbdc51f = 2092811551

  Commands leading to the command that caused the error were:
  CR FEATR COUNT  LBA_48  LH LM LL DV DC  Powered_Up_Time  Command/Feature_Name
  -- == -- == -- == == == -- -- -- -- --  ---------------  --------------------
  25 00 00 00 08 00 00 7c bd c5 1f e0 00     02:00:34.926  READ DMA EXT
  25 00 00 00 80 00 00 7c bd c5 1f e0 00     02:00:32.104  READ DMA EXT
  42 00 00 00 08 00 00 95 ef 42 37 e0 00     02:00:32.103  READ VERIFY SECTOR(S) EXT
  25 00 00 00 08 00 00 7c bd c5 17 e0 00     02:00:28.968  READ DMA EXT
  25 00 00 00 80 00 00 7c bd c5 17 e0 00     02:00:26.148  READ DMA EXT

Error 1116 [11] occurred at disk power-on lifetime: 10289 hours (428 days + 17 hours)
  When the command that caused the error occurred, the device was active or idle.

  After command completion occurred, registers were:
  ER -- ST COUNT  LBA_48  LH LM LL DV DC
  -- -- -- == -- == == == -- -- -- -- --
  40 -- 51 00 80 00 00 7c bd c5 1f e0 00  Error: UNC 128 sectors at LBA = 0x7cbdc51f = 2092811551

  Commands leading to the command that caused the error were:
  CR FEATR COUNT  LBA_48  LH LM LL DV DC  Powered_Up_Time  Command/Feature_Name
  -- == -- == -- == == == -- -- -- -- --  ---------------  --------------------
  25 00 00 00 80 00 00 7c bd c5 1f e0 00     02:00:32.104  READ DMA EXT
  42 00 00 00 08 00 00 95 ef 42 37 e0 00     02:00:32.103  READ VERIFY SECTOR(S) EXT
  25 00 00 00 08 00 00 7c bd c5 17 e0 00     02:00:28.968  READ DMA EXT
  25 00 00 00 80 00 00 7c bd c5 17 e0 00     02:00:26.148  READ DMA EXT
  25 00 00 00 08 00 00 95 ef 42 2f e0 00     02:00:26.148  READ DMA EXT

Error 1115 [10] occurred at disk power-on lifetime: 10289 hours (428 days + 17 hours)
  When the command that caused the error occurred, the device was active or idle.

  After command completion occurred, registers were:
  ER -- ST COUNT  LBA_48  LH LM LL DV DC
  -- -- -- == -- == == == -- -- -- -- --
  40 -- 51 00 08 00 00 7c bd c5 17 e0 00  Error: UNC 8 sectors at LBA = 0x7cbdc517 = 2092811543

  Commands leading to the command that caused the error were:
  CR FEATR COUNT  LBA_48  LH LM LL DV DC  Powered_Up_Time  Command/Feature_Name
  -- == -- == -- == == == -- -- -- -- --  ---------------  --------------------
  25 00 00 00 08 00 00 7c bd c5 17 e0 00     02:00:28.968  READ DMA EXT
  25 00 00 00 80 00 00 7c bd c5 17 e0 00     02:00:26.148  READ DMA EXT
  25 00 00 00 08 00 00 95 ef 42 2f e0 00     02:00:26.148  READ DMA EXT
  25 00 00 00 80 00 00 7c bd c4 8f e0 00     02:00:26.148  READ DMA EXT
  25 00 00 00 80 00 00 7c bd c4 0f e0 00     02:00:26.148  READ DMA EXT

Error 1114 [9] occurred at disk power-on lifetime: 10289 hours (428 days + 17 hours)
  When the command that caused the error occurred, the device was active or idle.

  After command completion occurred, registers were:
  ER -- ST COUNT  LBA_48  LH LM LL DV DC
  -- -- -- == -- == == == -- -- -- -- --
  40 -- 51 00 80 00 00 7c bd c5 17 e0 00  Error: UNC 128 sectors at LBA = 0x7cbdc517 = 2092811543

  Commands leading to the command that caused the error were:
  CR FEATR COUNT  LBA_48  LH LM LL DV DC  Powered_Up_Time  Command/Feature_Name
  -- == -- == -- == == == -- -- -- -- --  ---------------  --------------------
  25 00 00 00 80 00 00 7c bd c5 17 e0 00     02:00:26.148  READ DMA EXT
  25 00 00 00 08 00 00 95 ef 42 2f e0 00     02:00:26.148  READ DMA EXT
  25 00 00 00 80 00 00 7c bd c4 8f e0 00     02:00:26.148  READ DMA EXT
  25 00 00 00 80 00 00 7c bd c4 0f e0 00     02:00:26.148  READ DMA EXT
  25 00 00 00 80 00 00 7c bd c3 8f e0 00     02:00:26.147  READ DMA EXT

Error 1113 [8] occurred at disk power-on lifetime: 10289 hours (428 days + 17 hours)
  When the command that caused the error occurred, the device was active or idle.

  After command completion occurred, registers were:
  ER -- ST COUNT  LBA_48  LH LM LL DV DC
  -- -- -- == -- == == == -- -- -- -- --
  40 -- 51 00 08 00 00 7c bd c5 0f e0 00  Error: UNC 8 sectors at LBA = 0x7cbdc50f = 2092811535

  Commands leading to the command that caused the error were:
  CR FEATR COUNT  LBA_48  LH LM LL DV DC  Powered_Up_Time  Command/Feature_Name
  -- == -- == -- == == == -- -- -- -- --  ---------------  --------------------
  25 00 00 00 08 00 00 7c bd c5 0f e0 00     02:00:22.920  READ DMA EXT
  25 00 00 00 18 00 00 0f 79 94 48 e0 00     02:00:22.890  READ DMA EXT
  25 00 00 00 80 00 00 7c bd c5 0f e0 00     02:00:20.070  READ DMA EXT
  25 00 00 00 80 00 00 7c bd c4 8f e0 00     02:00:20.069  READ DMA EXT
  25 00 00 00 80 00 00 7c bd c4 0f e0 00     02:00:20.068  READ DMA EXT

Error 1112 [7] occurred at disk power-on lifetime: 10289 hours (428 days + 17 hours)
  When the command that caused the error occurred, the device was active or idle.

  After command completion occurred, registers were:
  ER -- ST COUNT  LBA_48  LH LM LL DV DC
  -- -- -- == -- == == == -- -- -- -- --
  40 -- 51 00 80 00 00 7c bd c5 0f e0 00  Error: UNC 128 sectors at LBA = 0x7cbdc50f = 2092811535

  Commands leading to the command that caused the error were:
  CR FEATR COUNT  LBA_48  LH LM LL DV DC  Powered_Up_Time  Command/Feature_Name
  -- == -- == -- == == == -- -- -- -- --  ---------------  --------------------
  25 00 00 00 80 00 00 7c bd c5 0f e0 00     02:00:20.070  READ DMA EXT
  25 00 00 00 80 00 00 7c bd c4 8f e0 00     02:00:20.069  READ DMA EXT
  25 00 00 00 80 00 00 7c bd c4 0f e0 00     02:00:20.068  READ DMA EXT
  25 00 00 00 80 00 00 7c bd c3 8f e0 00     02:00:20.047  READ DMA EXT
  25 00 00 00 20 00 00 0c f3 c8 70 e0 00     02:00:20.046  READ DMA EXT

SMART Extended Self-test Log Version: 1 (1 sectors)
No self-tests have been logged.  [To run self-tests, use: smartctl -t]

SMART Selective self-test log data structure revision number 1
 SPAN  MIN_LBA  MAX_LBA  CURRENT_TEST_STATUS
    1        0        0  Not_testing
    2        0        0  Not_testing
    3        0        0  Not_testing
    4        0        0  Not_testing
    5        0        0  Not_testing
Selective self-test flags (0x0):
  After scanning selected spans, do NOT read-scan remainder of disk.
If Selective self-test is pending on power-up, resume after 0 minute delay.

SCT Status Version:                  2
SCT Version (vendor specific):       258 (0x0102)
SCT Support Level:                   1
Device State:                        Active (0)
Current Temperature:                    39 Celsius
Power Cycle Min/Max Temperature:     25/39 Celsius
Lifetime    Min/Max Temperature:     24/50 Celsius
Under/Over Temperature Limit Count:   0/0

SCT Temperature History Version:     2
Temperature Sampling Period:         1 minute
Temperature Logging Interval:        1 minute
Min/Max recommended Temperature:      0/60 Celsius
Min/Max Temperature Limit:           -41/85 Celsius
Temperature History Size (Index):    478 (367)

SCT Error Recovery Control command not supported

Device Statistics (GP/SMART Log 0x04) not supported

SATA Phy Event Counters (GP Log 0x11)
ID      Size     Value  Description
0x0001  2            0  Command failed due to ICRC error
0x0002  2            0  R_ERR response for data FIS
0x0003  2            0  R_ERR response for device-to-host data FIS
0x0004  2            0  R_ERR response for host-to-device data FIS
0x0005  2            0  R_ERR response for non-data FIS
0x0006  2            0  R_ERR response for device-to-host non-data FIS
0x0007  2            0  R_ERR response for host-to-device non-data FIS
0x000a  2            5  Device-to-host register FISes sent due to a COMRESET
0x000b  2            0  CRC errors within host-to-device FIS
0x8000  4         3414  Vendor specific

