smartctl 7.4 2023-08-01 r5530 [x86_64-linux-6.6.13-200.fc39.x86_64] (local build)
Copyright (C) 2002-23, Bruce Allen, Christian Franke, www.smartmontools.org

=== START OF INFORMATION SECTION ===
Model Number:                       PLEXTOR PX-256M8PeG
Serial Number:                      --
Firmware Version:                   1.05
PCI Vendor ID:                      0x14a4
PCI Vendor Subsystem ID:            0x1b4b
IEEE OUI Identifier:                0x002303
Total NVM Capacity:                 256,060,514,304 [256 GB]
Unallocated NVM Capacity:           0
Controller ID:                      1
NVMe Version:                       1.2
Number of Namespaces:               1
Namespace 1 Size/Capacity:          256,060,514,304 [256 GB]
Namespace 1 Utilization:            0
Namespace 1 Formatted LBA Size:     512
Namespace 1 IEEE EUI-64:            002303 ...
Local Time is:                      Sun Jan 28 12:44:22 2024 CET
Firmware Updates (0x14):            2 Slots, no Reset required
Optional Admin Commands (0x001f):   Security Format Frmw_DL NS_Mngmt Self_Test
Optional NVM Commands (0x001f):     Comp Wr_Unc DS_Mngmt Wr_Zero Sav/Sel_Feat
Log Page Attributes (0x03):         S/H_per_NS Cmd_Eff_Lg
Maximum Data Transfer Size:         32 Pages
Warning  Comp. Temp. Threshold:     85 Celsius
Critical Comp. Temp. Threshold:     95 Celsius

Supported Power States
St Op     Max   Active     Idle   RL RT WL WT  Ent_Lat  Ex_Lat
 0 +     8.00W       -        -    0  0  0  0        0       0
 1 +     4.00W       -        -    1  1  1  1        5       5
 2 +     2.10W       -        -    2  2  2  2        5       5
 3 -   0.1000W       -        -    3  3  3  3     5000    5000
 4 -   0.0100W       -        -    4  4  4  4    50000  100000

Supported LBA Sizes (NSID 0x1)
Id Fmt  Data  Metadt  Rel_Perf
 0 -     512       0         0

=== START OF SMART DATA SECTION ===
SMART overall-health self-assessment test result: PASSED

SMART/Health Information (NVMe Log 0x02)
Critical Warning:                   0x00
Temperature:                        50 Celsius
Available Spare:                    100%
Available Spare Threshold:          0%
Percentage Used:                    3%
Data Units Read:                    12,890,142 [6.59 TB]
Data Units Written:                 11,699,630 [5.99 TB]
Host Read Commands:                 199,547,950
Host Write Commands:                218,343,776
Controller Busy Time:               96,357
Power Cycles:                       532
Power On Hours:                     2,164
Unsafe Shutdowns:                   61
Media and Data Integrity Errors:    0
Error Information Log Entries:      0
Warning  Comp. Temperature Time:    0
Critical Comp. Temperature Time:    0
Temperature Sensor 1:               50 Celsius

Error Information (NVMe Log 0x01, 16 of 64 entries)
No Errors Logged

Self-test Log (NVMe Log 0x06)
Self-test status: No self-test in progress
Num  Test_Description  Status                       Power_on_Hours  Failing_LBA  NSID Seg SCT Code
 0   Short             Completed without error                2164            -     -   -   -    -



