=== START OF INFORMATION SECTION ===
Device Model:     ST250DM001 HD253GJ
Serial Number:    --
LU WWN Device Id: 5 0004cf ...
Firmware Version: 1AJ10001
User Capacity:    250 059 350 016 bytes [250 GB]
Sector Size:      512 bytes logical/physical
Rotation Rate:    7200 rpm
Form Factor:      3.5 inches
Device is:        Not in smartctl database [for details use: -P showall]
ATA Version is:   ATA8-ACS T13/1699-D revision 6
SATA Version is:  SATA 2.6, 3.0 Gb/s
Local Time is:    Wed Nov  7 20:35:39 2018 MSK
SMART support is: Available - device has SMART capability.
SMART support is: Enabled
AAM feature is:   Disabled
APM feature is:   Disabled
Rd look-ahead is: Enabled
Write cache is:   Enabled
ATA Security is:  Disabled, frozen [SEC2]
Wt Cache Reorder: Enabled

=== START OF READ SMART DATA SECTION ===
SMART overall-health self-assessment test result: PASSED

General SMART Values:
Offline data collection status:  (0x80)	Offline data collection activity
					was never started.
					Auto Offline Data Collection: Enabled.
Self-test execution status:      (   0)	The previous self-test routine completed
					without error or no self-test has ever 
					been run.
Total time to complete Offline 
data collection: 		( 2280) seconds.
Offline data collection
capabilities: 			 (0x5b) SMART execute Offline immediate.
					Auto Offline data collection on/off support.
					Suspend Offline collection upon new
					command.
					Offline surface scan supported.
					Self-test supported.
					No Conveyance Self-test supported.
					Selective Self-test supported.
SMART capabilities:            (0x0003)	Saves SMART data before entering
					power-saving mode.
					Supports SMART auto save timer.
Error logging capability:        (0x01)	Error logging supported.
					General Purpose Logging supported.
Short self-test routine 
recommended polling time: 	 (   2) minutes.
Extended self-test routine
recommended polling time: 	 (  38) minutes.
SCT capabilities: 	       (0x003f)	SCT Status supported.
					SCT Error Recovery Control supported.
					SCT Feature Control supported.
					SCT Data Table supported.

SMART Attributes Data Structure revision number: 16
Vendor Specific SMART Attributes with Thresholds:
ID# ATTRIBUTE_NAME          FLAGS    VALUE WORST THRESH FAIL RAW_VALUE
  1 Raw_Read_Error_Rate     POSR-K   100   100   051    -    7
  2 Throughput_Performance  -OS--K   252   252   000    -    0
  3 Spin_Up_Time            PO---K   083   082   025    -    5166
  4 Start_Stop_Count        -O--CK   099   099   000    -    1068
  5 Reallocated_Sector_Ct   PO--CK   252   252   010    -    0
  7 Seek_Error_Rate         -OSR-K   252   252   051    -    0
  8 Seek_Time_Performance   --S--K   252   252   015    -    0
  9 Power_On_Hours          -O--CK   100   100   000    -    18591
 10 Spin_Retry_Count        -O--CK   252   252   051    -    0
 11 Calibration_Retry_Count -O--CK   252   252   000    -    0
 12 Power_Cycle_Count       -O--CK   099   099   000    -    1035
191 G-Sense_Error_Rate      -O---K   100   100   000    -    14
192 Power-Off_Retract_Count -O---K   252   252   000    -    0
194 Temperature_Celsius     -O----   061   055   000    -    39 (Min/Max 9/45)
195 Hardware_ECC_Recovered  -O-RCK   100   100   000    -    0
196 Reallocated_Event_Count -O--CK   252   252   000    -    0
197 Current_Pending_Sector  -O--CK   252   252   000    -    0
198 Offline_Uncorrectable   ----CK   252   252   000    -    0
199 UDMA_CRC_Error_Count    -OS-CK   100   100   000    -    12
200 Multi_Zone_Error_Rate   -O-R-K   100   100   000    -    33
223 Load_Retry_Count        -O--CK   252   252   000    -    0
225 Load_Cycle_Count        -O--CK   100   100   000    -    1073
                            ||||||_ K auto-keep
                            |||||__ C event count
                            ||||___ R error rate
                            |||____ S speed/performance
                            ||_____ O updated online
                            |______ P prefailure warning

General Purpose Log Directory Version 1
SMART           Log Directory Version 1 [multi-sector log support]
Address    Access  R/W   Size  Description
0x00       GPL,SL  R/O      1  Log Directory
0x01           SL  R/O      1  Summary SMART error log
0x02           SL  R/O      2  Comprehensive SMART error log
0x03       GPL     R/O      2  Ext. Comprehensive SMART error log
0x06           SL  R/O      1  SMART self-test log
0x07       GPL     R/O      2  Extended self-test log
0x08       GPL     R/O      2  Power Conditions log
0x09           SL  R/W      1  Selective self-test log
0x10       GPL     R/O      1  SATA NCQ Queued Error log
0x11       GPL     R/O      1  SATA Phy Event Counters log
0x80-0x9f  GPL,SL  R/W     16  Host vendor specific log
0xe0       GPL,SL  R/W      1  SCT Command/Status
0xe1       GPL,SL  R/W      1  SCT Data Transfer

SMART Extended Comprehensive Error Log Version: 1 (2 sectors)
Device Error Count: 12 (device log contains only the most recent 8 errors)
	CR     = Command Register
	FEATR  = Features Register
	COUNT  = Count (was: Sector Count) Register
	LBA_48 = Upper bytes of LBA High/Mid/Low Registers ]  ATA-8
	LH     = LBA High (was: Cylinder High) Register    ]   LBA
	LM     = LBA Mid (was: Cylinder Low) Register      ] Register
	LL     = LBA Low (was: Sector Number) Register     ]
	DV     = Device (was: Device/Head) Register
	DC     = Device Control Register
	ER     = Error register
	ST     = Status register
Powered_Up_Time is measured from power on, and printed as
DDd+hh:mm:SS.sss where DD=days, hh=hours, mm=minutes,
SS=sec, and sss=millisec. It "wraps" after 49.710 days.

Error 12 [3] occurred at disk power-on lifetime: 2806 hours (116 days + 22 hours)
  When the command that caused the error occurred, the device was active or idle.

  After command completion occurred, registers were:
  ER -- ST COUNT  LBA_48  LH LM LL DV DC
  -- -- -- == -- == == == -- -- -- -- --
  84 -- 51 62 18 00 00 00 00 00 00 e0 00  Error: ICRC, ABRT 25112 sectors at LBA = 0x00000000 = 0

  Commands leading to the command that caused the error were:
  CR FEATR COUNT  LBA_48  LH LM LL DV DC  Powered_Up_Time  Command/Feature_Name
  -- == -- == -- == == == -- -- -- -- --  ---------------  --------------------
  25 00 00 00 20 00 00 00 27 61 f8 e0 00     00:00:08.709  READ DMA EXT
  35 00 00 00 20 00 00 00 27 62 38 e0 00     00:00:08.709  WRITE DMA EXT
  35 00 00 00 20 00 00 02 f1 5b e0 e0 00     00:00:08.708  WRITE DMA EXT
  25 00 00 00 2d 00 00 00 92 06 c8 e0 00     00:00:08.708  READ DMA EXT
  25 00 00 00 0a 00 00 00 41 57 8d e0 00     00:00:08.708  READ DMA EXT

Error 11 [2] occurred at disk power-on lifetime: 2632 hours (109 days + 16 hours)
  When the command that caused the error occurred, the device was active or idle.

  After command completion occurred, registers were:
  ER -- ST COUNT  LBA_48  LH LM LL DV DC
  -- -- -- == -- == == == -- -- -- -- --
  84 -- 51 34 58 00 00 00 00 00 00 e0 00  Error: ICRC, ABRT 13400 sectors at LBA = 0x00000000 = 0

  Commands leading to the command that caused the error were:
  CR FEATR COUNT  LBA_48  LH LM LL DV DC  Powered_Up_Time  Command/Feature_Name
  -- == -- == -- == == == -- -- -- -- --  ---------------  --------------------
  25 00 00 00 40 00 00 03 ac 34 18 e0 00     00:00:00.293  READ DMA EXT
  25 00 00 00 40 00 00 03 ac 34 18 e0 00     00:00:00.293  READ DMA EXT
  25 00 00 00 40 00 00 03 ac 33 98 e0 00     00:00:00.293  READ DMA EXT
  25 00 00 00 40 00 00 03 ac 32 98 e0 00     00:00:00.293  READ DMA EXT
  25 00 00 00 40 00 00 03 ac 32 58 e0 00     00:00:00.293  READ DMA EXT

Error 10 [1] occurred at disk power-on lifetime: 2036 hours (84 days + 20 hours)
  When the command that caused the error occurred, the device was active or idle.

  After command completion occurred, registers were:
  ER -- ST COUNT  LBA_48  LH LM LL DV DC
  -- -- -- == -- == == == -- -- -- -- --
  84 -- 51 62 18 00 00 00 00 00 00 e0 00  Error: ICRC, ABRT 25112 sectors at LBA = 0x00000000 = 0

  Commands leading to the command that caused the error were:
  CR FEATR COUNT  LBA_48  LH LM LL DV DC  Powered_Up_Time  Command/Feature_Name
  -- == -- == -- == == == -- -- -- -- --  ---------------  --------------------
  25 00 00 00 20 00 00 00 27 61 f8 e0 00     00:00:15.464  READ DMA EXT
  35 00 00 00 20 00 00 00 27 62 38 e0 00     00:00:15.464  WRITE DMA EXT
  35 00 00 00 08 00 00 00 63 d4 c0 e0 00     00:00:15.463  WRITE DMA EXT
  35 00 00 00 03 00 00 0e f7 59 68 e0 00     00:00:15.463  WRITE DMA EXT
  35 00 00 00 08 00 00 0e f7 5a b8 e0 00     00:00:15.463  WRITE DMA EXT

Error 9 [0] occurred at disk power-on lifetime: 2036 hours (84 days + 20 hours)
  When the command that caused the error occurred, the device was active or idle.

  After command completion occurred, registers were:
  ER -- ST COUNT  LBA_48  LH LM LL DV DC
  -- -- -- == -- == == == -- -- -- -- --
  84 -- 51 62 18 00 00 00 00 00 00 e0 00  Error: ICRC, ABRT 25112 sectors at LBA = 0x00000000 = 0

  Commands leading to the command that caused the error were:
  CR FEATR COUNT  LBA_48  LH LM LL DV DC  Powered_Up_Time  Command/Feature_Name
  -- == -- == -- == == == -- -- -- -- --  ---------------  --------------------
  25 00 00 00 20 00 00 00 27 61 f8 e0 00     00:00:13.972  READ DMA EXT
  35 00 00 00 20 00 00 00 27 62 38 e0 00     00:00:13.972  WRITE DMA EXT
  35 00 00 00 02 00 00 00 34 ff 08 e0 00     00:00:13.971  WRITE DMA EXT
  35 00 00 00 08 00 00 0e e7 3f f0 e0 00     00:00:13.971  WRITE DMA EXT
  35 00 00 00 04 00 00 0e e7 36 98 e0 00     00:00:13.971  WRITE DMA EXT

Error 8 [7] occurred at disk power-on lifetime: 2036 hours (84 days + 20 hours)
  When the command that caused the error occurred, the device was active or idle.

  After command completion occurred, registers were:
  ER -- ST COUNT  LBA_48  LH LM LL DV DC
  -- -- -- == -- == == == -- -- -- -- --
  84 -- 51 62 18 00 00 00 00 00 00 e0 00  Error: ICRC, ABRT 25112 sectors at LBA = 0x00000000 = 0

  Commands leading to the command that caused the error were:
  CR FEATR COUNT  LBA_48  LH LM LL DV DC  Powered_Up_Time  Command/Feature_Name
  -- == -- == -- == == == -- -- -- -- --  ---------------  --------------------
  25 00 00 00 20 00 00 00 27 61 f8 e0 00     00:00:13.789  READ DMA EXT
  35 00 00 00 08 00 00 0e e7 3e 60 e0 00     00:00:13.789  WRITE DMA EXT
  35 00 00 00 02 00 00 02 40 f4 40 e0 00     00:00:13.787  WRITE DMA EXT
  35 00 00 00 05 00 00 0e e7 3e 60 e0 00     00:00:13.787  WRITE DMA EXT
  25 00 00 00 20 00 00 00 27 84 f8 e0 00     00:00:13.786  READ DMA EXT

Error 7 [6] occurred at disk power-on lifetime: 2035 hours (84 days + 19 hours)
  When the command that caused the error occurred, the device was active or idle.

  After command completion occurred, registers were:
  ER -- ST COUNT  LBA_48  LH LM LL DV DC
  -- -- -- == -- == == == -- -- -- -- --
  84 -- 51 62 18 00 00 00 00 00 00 e0 00  Error: ABRT at LBA = 0x00000000 = 0

  Commands leading to the command that caused the error were:
  CR FEATR COUNT  LBA_48  LH LM LL DV DC  Powered_Up_Time  Command/Feature_Name
  -- == -- == -- == == == -- -- -- -- --  ---------------  --------------------
  29 00 00 00 20 00 00 00 27 61 f8 e0 00     00:00:10.845  READ MULTIPLE EXT
  25 00 00 00 20 00 00 00 27 61 f8 e0 00     00:00:10.845  READ DMA EXT
  35 00 00 00 09 00 00 0e bf a9 f0 e0 00     00:00:10.845  WRITE DMA EXT
  ea 00 00 00 00 5e ed cf 00 00 00 e0 00     00:00:10.844  FLUSH CACHE EXT
  35 00 00 00 08 00 00 00 5e ed c8 e0 00     00:00:10.844  WRITE DMA EXT

Error 6 [5] occurred at disk power-on lifetime: 2035 hours (84 days + 19 hours)
  When the command that caused the error occurred, the device was active or idle.

  After command completion occurred, registers were:
  ER -- ST COUNT  LBA_48  LH LM LL DV DC
  -- -- -- == -- == == == -- -- -- -- --
  84 -- 51 62 18 00 00 00 00 00 00 e0 00  Error: ICRC, ABRT 25112 sectors at LBA = 0x00000000 = 0

  Commands leading to the command that caused the error were:
  CR FEATR COUNT  LBA_48  LH LM LL DV DC  Powered_Up_Time  Command/Feature_Name
  -- == -- == -- == == == -- -- -- -- --  ---------------  --------------------
  25 00 00 00 20 00 00 00 27 61 f8 e0 00     00:00:10.845  READ DMA EXT
  35 00 00 00 09 00 00 0e bf a9 f0 e0 00     00:00:10.845  WRITE DMA EXT
  ea 00 00 00 00 5e ed cf 00 00 00 e0 00     00:00:10.844  FLUSH CACHE EXT
  35 00 00 00 08 00 00 00 5e ed c8 e0 00     00:00:10.844  WRITE DMA EXT
  35 00 00 00 01 00 00 00 31 bf a0 e0 00     00:00:10.844  WRITE DMA EXT

Error 5 [4] occurred at disk power-on lifetime: 2035 hours (84 days + 19 hours)
  When the command that caused the error occurred, the device was active or idle.

  After command completion occurred, registers were:
  ER -- ST COUNT  LBA_48  LH LM LL DV DC
  -- -- -- == -- == == == -- -- -- -- --
  84 -- 51 a4 20 00 00 00 00 00 00 e0 00  Error: ICRC, ABRT 42016 sectors at LBA = 0x00000000 = 0

  Commands leading to the command that caused the error were:
  CR FEATR COUNT  LBA_48  LH LM LL DV DC  Powered_Up_Time  Command/Feature_Name
  -- == -- == -- == == == -- -- -- -- --  ---------------  --------------------
  25 00 00 00 40 00 00 02 a6 a3 e0 e0 00     00:00:10.307  READ DMA EXT
  35 00 00 00 28 00 00 00 5f 08 08 e0 00     00:00:10.307  WRITE DMA EXT
  35 00 00 00 09 00 00 0e bf 9d f0 e0 00     00:00:10.307  WRITE DMA EXT
  25 00 00 00 20 00 00 00 27 84 f8 e0 00     00:00:10.305  READ DMA EXT
  25 00 00 00 20 00 00 00 27 63 f8 e0 00     00:00:10.305  READ DMA EXT

SMART Extended Self-test Log Version: 1 (2 sectors)
No self-tests have been logged.  [To run self-tests, use: smartctl -t]

SMART Selective self-test log data structure revision number 0
Note: revision number not 1 implies that no selective self-test has ever been run
 SPAN  MIN_LBA  MAX_LBA  CURRENT_TEST_STATUS
    1        0        0  Completed [00% left] (0-65535)
    2        0        0  Not_testing
    3        0        0  Not_testing
    4        0        0  Not_testing
    5        0        0  Not_testing
Selective self-test flags (0x0):
  After scanning selected spans, do NOT read-scan remainder of disk.
If Selective self-test is pending on power-up, resume after 0 minute delay.

SCT Status Version:                  2
SCT Version (vendor specific):       256 (0x0100)
SCT Support Level:                   1
Device State:                        Active (0)
Current Temperature:                    39 Celsius
Power Cycle Min/Max Temperature:     39/39 Celsius
Lifetime    Min/Max Temperature:     13/65 Celsius
Under/Over Temperature Limit Count:   0/0

SCT Temperature History Version:     2
Temperature Sampling Period:         5 minutes
Temperature Logging Interval:        5 minutes
Min/Max recommended Temperature:     -5/80 Celsius
Min/Max Temperature Limit:           -10/85 Celsius
Temperature History Size (Index):    128 (44)

SCT Error Recovery Control:
           Read: Disabled
          Write: Disabled

Device Statistics (GP/SMART Log 0x04) not supported

SATA Phy Event Counters (GP Log 0x11)
ID      Size     Value  Description
0x0001  4            0  Command failed due to ICRC error
0x0002  4            0  R_ERR response for data FIS
0x0003  4            0  R_ERR response for device-to-host data FIS
0x0004  4            0  R_ERR response for host-to-device data FIS
0x0005  4            0  R_ERR response for non-data FIS
0x0006  4            0  R_ERR response for device-to-host non-data FIS
0x0007  4            0  R_ERR response for host-to-device non-data FIS
0x0008  4            0  Device-to-host non-data FIS retries
0x0009  4           11  Transition from drive PhyRdy to drive PhyNRdy
0x000a  4           10  Device-to-host register FISes sent due to a COMRESET
0x000b  4            0  CRC errors within host-to-device FIS
0x000d  4            0  Non-CRC errors within host-to-device FIS
0x000f  4            0  R_ERR response for host-to-device data FIS, CRC
0x0010  4            0  R_ERR response for host-to-device data FIS, non-CRC
0x0012  4            0  R_ERR response for host-to-device non-data FIS, CRC
0x0013  4            0  R_ERR response for host-to-device non-data FIS, non-CRC
0x8e00  4            0  Vendor specific
0x8e01  4            0  Vendor specific
0x8e02  4            0  Vendor specific
0x8e03  4            0  Vendor specific
0x8e04  4            0  Vendor specific
0x8e05  4            0  Vendor specific
0x8e06  4            0  Vendor specific
0x8e07  4            0  Vendor specific
0x8e08  4            0  Vendor specific
0x8e09  4            0  Vendor specific
0x8e0a  4            0  Vendor specific
0x8e0b  4            0  Vendor specific
0x8e0c  4            0  Vendor specific
0x8e0d  4            0  Vendor specific
0x8e0e  4            0  Vendor specific
0x8e0f  4            0  Vendor specific
0x8e10  4            0  Vendor specific
0x8e11  4            0  Vendor specific



