smartctl 7.5 2025-04-30 r5714 [aarch64-linux-6.14.8-400.asahi.fc42.aarch64+16k] (local build)
Copyright (C) 2002-25, Bruce Allen, Christian Franke, www.smartmontools.org

=== START OF INFORMATION SECTION ===
Model Number:                       APPLE SSD AP0256Z
Serial Number:                      --
Firmware Version:                   499.0.9
PCI Vendor/Subsystem ID:            0x106b
IEEE OUI Identifier:                0x000000
Controller ID:                      0
NVMe Version:                       <1.2
Number of Namespaces:               3
Namespace 1 Size/Capacity:          251,000,193,024 [251 GB]
Namespace 1 Formatted LBA Size:     4096
Local Time is:                      Mon Aug 11 06:12:02 2025 CST
Firmware Updates (0x02):            1 Slot
Optional Admin Commands (0x0004):   Frmw_DL
Optional NVM Commands (0x0004):     DS_Mngmt
Maximum Data Transfer Size:         256 Pages

Supported Power States
St Op     Max   Active     Idle   RL RT WL WT  Ent_Lat  Ex_Lat
 0 +     0.00W       -        -    0  0  0  0        0       0

Supported LBA Sizes (NSID 0x1)
Id Fmt  Data  Metadt  Rel_Perf
 0 +    4096       0         0

=== START OF SMART DATA SECTION ===
SMART overall-health self-assessment test result: PASSED

SMART/Health Information (NVMe Log 0x02, NSID 0xffffffff)
Critical Warning:                   0x00
Temperature:                        32 Celsius
Available Spare:                    100%
Available Spare Threshold:          99%
Percentage Used:                    1%
Data Units Read:                    62,935,733 [32.2 TB]
Data Units Written:                 32,996,746 [16.8 TB]
Host Read Commands:                 1,207,955,653
Host Write Commands:                628,099,099
Controller Busy Time:               0
Power Cycles:                       716
Power On Hours:                     642
Unsafe Shutdowns:                   42
Media and Data Integrity Errors:    0
Error Information Log Entries:      0

Read 1 entries from Error Information Log failed: Invalid Log Page (0x109)



