smartctl 7.4 2023-08-01 r5530 [x86_64-linux-6.15.0-desktop-0.rc2.3omv2590] (OpenMandriva Lx 7.4-1)
Copyright (C) 2002-23, Bruce Allen, Christian Franke, www.smartmontools.org

=== START OF INFORMATION SECTION ===
Model Number:                       ADATA SX8100NP
Serial Number:                      --
Firmware Version:                   VB421D57
PCI Vendor/Subsystem ID:            0x10ec
IEEE OUI Identifier:                0x00e04c
Controller ID:                      1
NVMe Version:                       1.3
Number of Namespaces:               1
Namespace 1 Size/Capacity:          2,048,408,248,320 [2.04 TB]
Namespace 1 Formatted LBA Size:     512
Local Time is:                      Thu Sep  4 13:06:45 2025 -03
Firmware Updates (0x02):            1 Slot
Optional Admin Commands (0x0007):   Security Format Frmw_DL
Optional NVM Commands (0x0014):     DS_Mngmt Sav/Sel_Feat
Log Page Attributes (0x02):         Cmd_Eff_Lg
Maximum Data Transfer Size:         64 Pages
Warning  Comp. Temp. Threshold:     118 Celsius
Critical Comp. Temp. Threshold:     150 Celsius

Supported Power States
St Op     Max   Active     Idle   RL RT WL WT  Ent_Lat  Ex_Lat
 0 +     8.00W       -        -    0  0  0  0        0   50000
 1 +     4.00W       -        -    1  1  1  1        0   50000
 2 +     3.00W       -        -    2  2  2  2        0   50000
 3 -   0.0500W       -        -    3  3  3  3     4000   50000
 4 -   0.0080W       -        -    4  4  4  4     8000  100000

Supported LBA Sizes (NSID 0x1)
Id Fmt  Data  Metadt  Rel_Perf
 0 +     512       0         0

=== START OF SMART DATA SECTION ===
SMART overall-health self-assessment test result: PASSED

SMART/Health Information (NVMe Log 0x02)
Critical Warning:                   0x00
Temperature:                        46 Celsius
Available Spare:                    99%
Available Spare Threshold:          32%
Percentage Used:                    0%
Data Units Read:                    109,848,122 [56.2 TB]
Data Units Written:                 36,267,700 [18.5 TB]
Host Read Commands:                 641,053,907
Host Write Commands:                394,804,247
Controller Busy Time:               0
Power Cycles:                       1,116
Power On Hours:                     5,909
Unsafe Shutdowns:                   84
Media and Data Integrity Errors:    85
Error Information Log Entries:      1,980
Warning  Comp. Temperature Time:    0
Critical Comp. Temperature Time:    0

Error Information (NVMe Log 0x01, 8 of 8 entries)
No Errors Logged

Self-tests not supported



