smartctl 7.4 2023-08-01 r5530 [x86_64-linux-6.5.5-zen1-1-zen] (local build)
Copyright (C) 2002-23, Bruce Allen, Christian Franke, www.smartmontools.org

=== START OF INFORMATION SECTION ===
Model Number:                       KINGSTON RBUSNS8154P3256GJ3
Serial Number:                      --
Firmware Version:                   E8FK11.T
PCI Vendor/Subsystem ID:            0x2646
IEEE OUI Identifier:                0x0026b7
Total NVM Capacity:                 256,060,514,304 [256 GB]
Unallocated NVM Capacity:           0
Controller ID:                      0
NVMe Version:                       1.2
Number of Namespaces:               1
Namespace 1 Size/Capacity:          256,060,514,304 [256 GB]
Namespace 1 Formatted LBA Size:     512
Namespace 1 IEEE EUI-64:            0026b7 ...
Local Time is:                      Sat Sep 30 21:22:05 2023 UTC
Firmware Updates (0x02):            1 Slot
Optional Admin Commands (0x0007):   Security Format Frmw_DL
Optional NVM Commands (0x001e):     Wr_Unc DS_Mngmt Wr_Zero Sav/Sel_Feat
Log Page Attributes (0x04):         Ext_Get_Lg
Maximum Data Transfer Size:         512 Pages
Warning  Comp. Temp. Threshold:     84 Celsius
Critical Comp. Temp. Threshold:     88 Celsius

Supported Power States
St Op     Max   Active     Idle   RL RT WL WT  Ent_Lat  Ex_Lat
 0 +     7.90W  0.0790W       -    0  0  0  0      600     600
 1 +     7.90W  0.0790W       -    0  0  0  0      600     600
 2 +     7.90W  0.0790W       -    0  0  0  0      600     600
 3 -   0.1000W  0.0790W       -    3  3  3  3     1000    1000
 4 -   0.0050W  0.0790W       -    4  4  4  4   400000   90000

Supported LBA Sizes (NSID 0x1)
Id Fmt  Data  Metadt  Rel_Perf
 0 +     512       0         1
 1 -    4096       0         0

=== START OF SMART DATA SECTION ===
SMART overall-health self-assessment test result: PASSED

SMART/Health Information (NVMe Log 0x02)
Critical Warning:                   0x00
Temperature:                        34 Celsius
Available Spare:                    100%
Available Spare Threshold:          10%
Percentage Used:                    18%
Data Units Read:                    12,876,023 [6.59 TB]
Data Units Written:                 14,401,403 [7.37 TB]
Host Read Commands:                 197,240,468
Host Write Commands:                306,540,613
Controller Busy Time:               367
Power Cycles:                       5,955
Power On Hours:                     2,739
Unsafe Shutdowns:                   35
Media and Data Integrity Errors:    0
Error Information Log Entries:      897
Warning  Comp. Temperature Time:    0
Critical Comp. Temperature Time:    0
Temperature Sensor 2:               34 Celsius

Error Information (NVMe Log 0x01, 16 of 16 entries)
Num   ErrCount  SQId   CmdId  Status  PELoc          LBA  NSID    VS  Message
  0        897     0  0x3011  0x0004      -            3     1     -  Invalid Field in Command
  1        896     0  0x2013  0x0004      -            3     1     -  Invalid Field in Command
  2        895     0  0x2011  0x0004      -            3     1     -  Invalid Field in Command
  3        894     0  0x1013  0x0004      -            3     1     -  Invalid Field in Command
  4        893     0  0x1011  0x0004      -            3     1     -  Invalid Field in Command
  5        892     0  0x0013  0x0004      -            3     1     -  Invalid Field in Command
  6        891     0  0x0011  0x0004      -            3     1     -  Invalid Field in Command
  7        890     0  0x2004  0x0004      -            3     1     -  Invalid Field in Command
  8        889     0  0x1006  0x0004      -            3     1     -  Invalid Field in Command
  9        888     0  0x1004  0x0004      -            3     1     -  Invalid Field in Command
 10        887     0  0x0006  0x0004      -            3     1     -  Invalid Field in Command
 11        886     0  0x0004  0x0004      -            3     1     -  Invalid Field in Command
 12        885     0  0x501c  0x0005      -            3     1     -  Invalid Field in Command
 13        884     0  0x401c  0x0005      -            3     1     -  Invalid Field in Command
 14        883     0  0x001c  0x0005      -            6     0     -  Invalid Field in Command
 15        882     0  0x0019  0x0005      -           12     0     -  Invalid Field in Command

Self-tests not supported

