smartctl 7.4 2023-08-01 r5530 [x86_64-linux-6.9.6-zen1] (local build)
Copyright (C) 2002-23, Bruce Allen, Christian Franke, www.smartmontools.org

=== START OF INFORMATION SECTION ===
Model Number:                       KXG6APNV2T04 TOSHIBA
Serial Number:                      --
Firmware Version:                   5105AHLA
PCI Vendor/Subsystem ID:            0x1179
IEEE OUI Identifier:                0x8ce38e
Total NVM Capacity:                 2,048,408,248,320 [2.04 TB]
Unallocated NVM Capacity:           0
Controller ID:                      0
NVMe Version:                       1.3
Number of Namespaces:               1
Namespace 1 Size/Capacity:          2,048,408,248,320 [2.04 TB]
Namespace 1 Formatted LBA Size:     512
Namespace 1 IEEE EUI-64:            8ce38e ...
Local Time is:                      Fri Jul  5 20:48:30 2024 CEST
Firmware Updates (0x14):            2 Slots, no Reset required
Optional Admin Commands (0x001f):   Security Format Frmw_DL NS_Mngmt Self_Test
Optional NVM Commands (0x005f):     Comp Wr_Unc DS_Mngmt Wr_Zero Sav/Sel_Feat Timestmp
Log Page Attributes (0x0e):         Cmd_Eff_Lg Ext_Get_Lg Telmtry_Lg
Maximum Data Transfer Size:         512 Pages
Warning  Comp. Temp. Threshold:     78 Celsius
Critical Comp. Temp. Threshold:     82 Celsius
Namespace 1 Features (0x02):        NA_Fields

Supported Power States
St Op     Max   Active     Idle   RL RT WL WT  Ent_Lat  Ex_Lat
 0 +     8.00W       -        -    0  0  0  0        1       1
 1 +     3.90W       -        -    1  1  1  1        1       1
 2 +     2.00W       -        -    2  2  2  2        1       1
 3 -   0.0500W       -        -    3  3  3  3     1500    1500
 4 -   0.0100W       -        -    4  4  4  4     6000   14000
 5 -   0.0030W       -        -    5  5  5  5    50000   90000

Supported LBA Sizes (NSID 0x1)
Id Fmt  Data  Metadt  Rel_Perf
 0 +     512       0         2
 1 -    4096       0         1

=== START OF SMART DATA SECTION ===
SMART overall-health self-assessment test result: PASSED

SMART/Health Information (NVMe Log 0x02)
Critical Warning:                   0x00
Temperature:                        56 Celsius
Available Spare:                    100%
Available Spare Threshold:          10%
Percentage Used:                    23%
Data Units Read:                    315,020,754 [161 TB]
Data Units Written:                 132,610,340 [67.8 TB]
Host Read Commands:                 7,531,974,475
Host Write Commands:                3,989,985,127
Controller Busy Time:               18,311
Power Cycles:                       6,326
Power On Hours:                     8,978
Unsafe Shutdowns:                   913
Media and Data Integrity Errors:    0
Error Information Log Entries:      0
Warning  Comp. Temperature Time:    6
Critical Comp. Temperature Time:    0
Temperature Sensor 1:               56 Celsius

Error Information (NVMe Log 0x01, 16 of 256 entries)
No Errors Logged

Self-test Log (NVMe Log 0x06)
Self-test status: No self-test in progress
No Self-tests Logged

