=== START OF INFORMATION SECTION ===
Model Family:     Seagate Barracuda 7200.9
Device Model:     ST3400833AS
Serial Number:    --
Firmware Version: 3.AAD
User Capacity:    400 088 457 216 bytes [400 GB]
Sector Size:      512 bytes logical/physical
Device is:        In smartctl database [for details use: -P show]
ATA Version is:   ATA/ATAPI-7 (minor revision not indicated)
Local Time is:    Thu Jun 16 10:11:32 2016 MSK
SMART support is: Available - device has SMART capability.
SMART support is: Enabled
AAM feature is:   Unavailable
APM feature is:   Unavailable
Rd look-ahead is: Enabled
Write cache is:   Enabled
ATA Security is:  Disabled, frozen [SEC2]
Wt Cache Reorder: Unavailable

=== START OF READ SMART DATA SECTION ===
SMART overall-health self-assessment test result: PASSED
See vendor-specific Attribute list for marginal Attributes.

General SMART Values:
Offline data collection status:  (0x82)	Offline data collection activity
					was completed without error.
					Auto Offline Data Collection: Enabled.
Self-test execution status:      (   0)	The previous self-test routine completed
					without error or no self-test has ever 
					been run.
Total time to complete Offline 
data collection: 		(  430) seconds.
Offline data collection
capabilities: 			 (0x5b) SMART execute Offline immediate.
					Auto Offline data collection on/off support.
					Suspend Offline collection upon new
					command.
					Offline surface scan supported.
					Self-test supported.
					No Conveyance Self-test supported.
					Selective Self-test supported.
SMART capabilities:            (0x0003)	Saves SMART data before entering
					power-saving mode.
					Supports SMART auto save timer.
Error logging capability:        (0x01)	Error logging supported.
					General Purpose Logging supported.
Short self-test routine 
recommended polling time: 	 (   1) minutes.
Extended self-test routine
recommended polling time: 	 ( 179) minutes.

SMART Attributes Data Structure revision number: 10
Vendor Specific SMART Attributes with Thresholds:
ID# ATTRIBUTE_NAME          FLAGS    VALUE WORST THRESH FAIL RAW_VALUE
  1 Raw_Read_Error_Rate     POSR--   109   085   006    -    172109063
  3 Spin_Up_Time            PO----   097   097   000    -    0
  4 Start_Stop_Count        -O--CK   095   095   020    -    5935
  5 Reallocated_Sector_Ct   PO--CK   100   100   036    -    0
  7 Seek_Error_Rate         POSR--   087   060   030    -    646851057
  9 Power_On_Hours          -O--CK   076   076   000    -    21720
 10 Spin_Retry_Count        PO--C-   100   100   097    -    0
 12 Power_Cycle_Count       -O--CK   095   095   020    -    5693
187 Reported_Uncorrect      -O--CK   100   100   000    -    0
189 High_Fly_Writes         -O-RCK   084   084   000    -    16
190 Airflow_Temperature_Cel -O---K   054   038   045    Past 46 (Min/Max 36/46 #1)
194 Temperature_Celsius     -O---K   046   062   000    -    46 (0 13 0 0 0)
195 Hardware_ECC_Recovered  -O-RC-   050   046   000    -    7550498
197 Current_Pending_Sector  -O--C-   100   100   000    -    0
198 Offline_Uncorrectable   ----C-   100   100   000    -    0
199 UDMA_CRC_Error_Count    -OSRCK   200   197   000    -    19
200 Multi_Zone_Error_Rate   ------   100   253   000    -    0
202 Data_Address_Mark_Errs  -O--CK   100   253   000    -    0
                            ||||||_ K auto-keep
                            |||||__ C event count
                            ||||___ R error rate
                            |||____ S speed/performance
                            ||_____ O updated online
                            |______ P prefailure warning

General Purpose Log Directory Version 1
SMART           Log Directory Version 1 [multi-sector log support]
Address    Access  R/W   Size  Description
0x00       GPL,SL  R/O      1  Log Directory
0x01       GPL,SL  R/O      1  Summary SMART error log
0x02       GPL,SL  R/O      5  Comprehensive SMART error log
0x03       GPL,SL  R/O      5  Ext. Comprehensive SMART error log
0x06       GPL,SL  R/O      1  SMART self-test log
0x07       GPL,SL  R/O      1  Extended self-test log
0x09       GPL,SL  R/W      1  Selective self-test log
0x10       GPL,SL  R/O      1  NCQ Command Error log
0x11       GPL,SL  R/O      1  SATA Phy Event Counters
0x20       GPL,SL  R/O      1  Streaming performance log [OBS-8]
0x21       GPL,SL  R/O      1  Write stream error log
0x22       GPL,SL  R/O      1  Read stream error log
0x23       GPL,SL  R/O      1  Delayed sector log [OBS-8]
0x80-0x9f  GPL,SL  R/W     16  Host vendor specific log
0xa0       GPL,SL  VS       1  Device vendor specific log
0xa1       GPL,SL  VS      20  Device vendor specific log
0xa2       GPL,SL  VS     101  Device vendor specific log
0xa8       GPL,SL  VS      20  Device vendor specific log
0xa9       GPL,SL  VS       1  Device vendor specific log
0xe0       GPL,SL  R/W      1  SCT Command/Status
0xe1       GPL,SL  R/W      1  SCT Data Transfer
0xff       GPL     -    23040  Reserved

SMART Extended Comprehensive Error Log Version: 1 (5 sectors)
Device Error Count: 19
	CR     = Command Register
	FEATR  = Features Register
	COUNT  = Count (was: Sector Count) Register
	LBA_48 = Upper bytes of LBA High/Mid/Low Registers ]  ATA-8
	LH     = LBA High (was: Cylinder High) Register    ]   LBA
	LM     = LBA Mid (was: Cylinder Low) Register      ] Register
	LL     = LBA Low (was: Sector Number) Register     ]
	DV     = Device (was: Device/Head) Register
	DC     = Device Control Register
	ER     = Error register
	ST     = Status register
Powered_Up_Time is measured from power on, and printed as
DDd+hh:mm:SS.sss where DD=days, hh=hours, mm=minutes,
SS=sec, and sss=millisec. It "wraps" after 49.710 days.

Error 19 [18] occurred at disk power-on lifetime: 9349 hours (389 days + 13 hours)
  When the command that caused the error occurred, the device was active or idle.

  After command completion occurred, registers were:
  ER -- ST COUNT  LBA_48  LH LM LL DV DC
  -- -- -- == -- == == == -- -- -- -- --
  00 -- 01 00 01 00 00 00 00 00 00 00 00  Error:  1 sectors at LBA = 0x00000000 = 0

  Commands leading to the command that caused the error were:
  CR FEATR COUNT  LBA_48  LH LM LL DV DC  Powered_Up_Time  Command/Feature_Name
  -- == -- == -- == == == -- -- -- -- --  ---------------  --------------------
  25 00 20 00 00 00 00 51 00 00 00 e0 00     00:01:12.332  READ DMA EXT
  00 00 00 00 00 00 00 51 00 00 00 00 00     00:01:12.332  NOP [Abort queued commands]
  25 00 20 00 00 00 00 51 00 00 00 e0 00     00:01:12.332  READ DMA EXT
  00 00 00 00 00 00 00 51 00 00 00 00 00     00:01:12.332  NOP [Abort queued commands]
  25 00 20 00 00 00 00 51 00 00 00 e0 00     00:01:12.329  READ DMA EXT

Error 18 [17] occurred at disk power-on lifetime: 9349 hours (389 days + 13 hours)
  When the command that caused the error occurred, the device was active or idle.

  After command completion occurred, registers were:
  ER -- ST COUNT  LBA_48  LH LM LL DV DC
  -- -- -- == -- == == == -- -- -- -- --
  00 -- 01 00 01 00 00 00 00 00 00 00 00  Error:  1 sectors at LBA = 0x00000000 = 0

  Commands leading to the command that caused the error were:
  CR FEATR COUNT  LBA_48  LH LM LL DV DC  Powered_Up_Time  Command/Feature_Name
  -- == -- == -- == == == -- -- -- -- --  ---------------  --------------------
  25 00 20 00 00 00 00 51 00 00 00 e0 00     00:01:12.332  READ DMA EXT
  00 00 00 00 00 00 00 51 00 00 00 00 00     00:01:12.332  NOP [Abort queued commands]
  25 00 20 00 00 00 00 51 00 00 00 e0 00     00:01:12.332  READ DMA EXT
  25 00 20 00 01 00 00 09 00 00 57 e0 00     00:01:12.332  READ DMA EXT
  25 00 20 00 01 00 00 09 00 00 56 e0 00     00:01:12.329  READ DMA EXT

Error 17 [16] occurred at disk power-on lifetime: 9349 hours (389 days + 13 hours)
  When the command that caused the error occurred, the device was active or idle.

  After command completion occurred, registers were:
  ER -- ST COUNT  LBA_48  LH LM LL DV DC
  -- -- -- == -- == == == -- -- -- -- --
  00 -- 01 00 01 00 00 00 00 00 00 00 00  Error:  1 sectors at LBA = 0x00000000 = 0

  Commands leading to the command that caused the error were:
  CR FEATR COUNT  LBA_48  LH LM LL DV DC  Powered_Up_Time  Command/Feature_Name
  -- == -- == -- == == == -- -- -- -- --  ---------------  --------------------
  25 00 20 00 00 00 00 51 00 00 00 e0 00     00:01:12.332  READ DMA EXT
  25 00 20 00 01 00 00 09 00 00 57 e0 00     00:01:12.332  READ DMA EXT
  25 00 20 00 01 00 00 09 00 00 56 e0 00     00:01:12.332  READ DMA EXT
  25 00 20 00 01 00 00 09 00 00 55 e0 00     00:01:12.332  READ DMA EXT
  25 00 20 00 01 00 00 09 00 00 54 e0 00     00:01:12.329  READ DMA EXT

Error 16 [15] occurred at disk power-on lifetime: 9257 hours (385 days + 17 hours)
  When the command that caused the error occurred, the device was active or idle.

  After command completion occurred, registers were:
  ER -- ST COUNT  LBA_48  LH LM LL DV DC
  -- -- -- == -- == == == -- -- -- -- --
  00 -- 01 00 01 00 00 00 00 00 00 00 00  Error:  1 sectors at LBA = 0x00000000 = 0

  Commands leading to the command that caused the error were:
  CR FEATR COUNT  LBA_48  LH LM LL DV DC  Powered_Up_Time  Command/Feature_Name
  -- == -- == -- == == == -- -- -- -- --  ---------------  --------------------
  25 00 20 00 00 00 00 51 00 00 00 e0 00     00:01:17.761  READ DMA EXT
  25 00 20 00 01 00 00 09 00 00 57 e0 00     00:01:17.761  READ DMA EXT
  25 00 20 00 01 00 00 09 00 00 56 e0 00     00:01:17.753  READ DMA EXT
  25 00 20 00 01 00 00 09 00 00 55 e0 00     00:01:17.735  READ DMA EXT
  25 00 20 00 01 00 00 09 00 00 54 e0 00     00:01:17.734  READ DMA EXT

Error 15 [14] occurred at disk power-on lifetime: 8982 hours (374 days + 6 hours)
  When the command that caused the error occurred, the device was active or idle.

  After command completion occurred, registers were:
  ER -- ST COUNT  LBA_48  LH LM LL DV DC
  -- -- -- == -- == == == -- -- -- -- --
  00 -- 01 00 01 00 00 00 00 00 00 00 00  Error:  1 sectors at LBA = 0x00000000 = 0

  Commands leading to the command that caused the error were:
  CR FEATR COUNT  LBA_48  LH LM LL DV DC  Powered_Up_Time  Command/Feature_Name
  -- == -- == -- == == == -- -- -- -- --  ---------------  --------------------
  25 00 20 00 00 00 00 51 00 00 00 e0 00     00:12:21.116  READ DMA EXT
  00 00 00 00 00 00 00 51 00 00 00 00 00     00:12:54.366  NOP [Abort queued commands]
  25 00 20 00 00 00 00 51 00 00 00 e0 00     00:12:54.365  READ DMA EXT
  00 00 00 00 00 00 00 51 00 00 00 00 00     00:12:37.740  NOP [Abort queued commands]
  25 00 20 00 00 00 00 51 00 00 00 e0 00     00:12:37.740  READ DMA EXT

Error 14 [13] occurred at disk power-on lifetime: 8982 hours (374 days + 6 hours)
  When the command that caused the error occurred, the device was active or idle.

  After command completion occurred, registers were:
  ER -- ST COUNT  LBA_48  LH LM LL DV DC
  -- -- -- == -- == == == -- -- -- -- --
  00 -- 01 00 01 00 00 00 00 00 00 00 00  Error:  1 sectors at LBA = 0x00000000 = 0

  Commands leading to the command that caused the error were:
  CR FEATR COUNT  LBA_48  LH LM LL DV DC  Powered_Up_Time  Command/Feature_Name
  -- == -- == -- == == == -- -- -- -- --  ---------------  --------------------
  25 00 20 00 00 00 00 51 00 00 00 e0 00     00:12:21.116  READ DMA EXT
  00 00 00 00 00 00 00 51 00 00 00 00 00     00:12:21.116  NOP [Abort queued commands]
  25 00 20 00 00 00 00 51 00 00 00 e0 00     00:12:21.108  READ DMA EXT
  25 00 20 00 01 00 00 09 00 00 57 e0 00     00:12:37.740  READ DMA EXT
  25 00 20 00 01 00 00 09 00 00 56 e0 00     00:12:37.740  READ DMA EXT

Error 13 [12] occurred at disk power-on lifetime: 8982 hours (374 days + 6 hours)
  When the command that caused the error occurred, the device was active or idle.

  After command completion occurred, registers were:
  ER -- ST COUNT  LBA_48  LH LM LL DV DC
  -- -- -- == -- == == == -- -- -- -- --
  00 -- 01 00 01 00 00 00 00 00 00 00 00  Error:  1 sectors at LBA = 0x00000000 = 0

  Commands leading to the command that caused the error were:
  CR FEATR COUNT  LBA_48  LH LM LL DV DC  Powered_Up_Time  Command/Feature_Name
  -- == -- == -- == == == -- -- -- -- --  ---------------  --------------------
  25 00 20 00 00 00 00 51 00 00 00 e0 00     00:12:21.116  READ DMA EXT
  25 00 20 00 01 00 00 09 00 00 57 e0 00     00:12:21.116  READ DMA EXT
  25 00 20 00 01 00 00 09 00 00 56 e0 00     00:12:21.108  READ DMA EXT
  25 00 20 00 01 00 00 09 00 00 55 e0 00     00:12:21.090  READ DMA EXT
  25 00 20 00 01 00 00 09 00 00 54 e0 00     00:12:21.090  READ DMA EXT

Error 12 [11] occurred at disk power-on lifetime: 8982 hours (374 days + 6 hours)
  When the command that caused the error occurred, the device was active or idle.

  After command completion occurred, registers were:
  ER -- ST COUNT  LBA_48  LH LM LL DV DC
  -- -- -- == -- == == == -- -- -- -- --
  00 -- 01 00 01 00 00 00 00 00 00 00 00  Error:  1 sectors at LBA = 0x00000000 = 0

  Commands leading to the command that caused the error were:
  CR FEATR COUNT  LBA_48  LH LM LL DV DC  Powered_Up_Time  Command/Feature_Name
  -- == -- == -- == == == -- -- -- -- --  ---------------  --------------------
  25 00 20 00 00 00 00 51 00 00 00 e0 00     00:00:25.657  READ DMA EXT
  00 00 00 00 00 00 00 51 00 00 00 00 00     00:00:25.657  NOP [Abort queued commands]
  25 00 20 00 00 00 00 51 00 00 00 e0 00     00:00:25.657  READ DMA EXT
  00 00 00 00 00 00 00 51 00 00 00 00 00     00:00:25.654  NOP [Abort queued commands]
  25 00 20 00 00 00 00 51 00 00 00 e0 00     00:00:25.654  READ DMA EXT

SMART Extended Self-test Log Version: 1 (1 sectors)
No self-tests have been logged.  [To run self-tests, use: smartctl -t]

SMART Selective self-test log data structure revision number 1
 SPAN  MIN_LBA  MAX_LBA  CURRENT_TEST_STATUS
    1        0        0  Not_testing
    2        0        0  Not_testing
    3        0        0  Not_testing
    4        0        0  Not_testing
    5        0        0  Not_testing
Selective self-test flags (0x0):
  After scanning selected spans, do NOT read-scan remainder of disk.
If Selective self-test is pending on power-up, resume after 0 minute delay.

SCT Commands not supported

Device Statistics (GP Log 0x04) not supported

SATA Phy Event Counters (GP Log 0x11)
ID      Size     Value  Description
0x000a  2            4  Device-to-host register FISes sent due to a COMRESET
0x0001  2            0  Command failed due to ICRC error
0x0003  2            0  R_ERR response for device-to-host data FIS
0x0004  2            0  R_ERR response for host-to-device data FIS
0x0006  2            0  R_ERR response for device-to-host non-data FIS
0x0007  2            0  R_ERR response for host-to-device non-data FIS

