smartctl 7.3 2022-02-28 r5338 [x86_64-linux-6.1.20-generic-2rosa2021.1-x86_64] (local build)
Copyright (C) 2002-22, Bruce Allen, Christian Franke, www.smartmontools.org

=== START OF INFORMATION SECTION ===
Model Family:     Seagate Desktop SSHD
Device Model:     ST2000DX001-1CM164
Serial Number:    --
LU WWN Device Id: 5 000c50 ...
Firmware Version: CC62
User Capacity:    2,000,398,934,016 bytes [2.00 TB]
Sector Sizes:     512 bytes logical, 4096 bytes physical
Rotation Rate:    7200 rpm
Form Factor:      3.5 inches
Device is:        In smartctl database 7.3/5319
ATA Version is:   ACS-2, ACS-3 T13/2161-D revision 3b
SATA Version is:  SATA 3.1, 6.0 Gb/s (current: 6.0 Gb/s)
Local Time is:    Sun Apr 16 11:20:32 2023 MSK
SMART support is: Available - device has SMART capability.
SMART support is: Enabled
AAM feature is:   Unavailable
APM level is:     128 (minimum power consumption without standby)
Rd look-ahead is: Enabled
Write cache is:   Enabled
DSN feature is:   Unavailable
ATA Security is:  Disabled, frozen [SEC2]
Wt Cache Reorder: Unavailable

=== START OF READ SMART DATA SECTION ===
SMART overall-health self-assessment test result: PASSED
See vendor-specific Attribute list for marginal Attributes.

General SMART Values:
Offline data collection status:  (0x00)	Offline data collection activity
					was never started.
					Auto Offline Data Collection: Disabled.
Self-test execution status:      (   0)	The previous self-test routine completed
					without error or no self-test has ever 
					been run.
Total time to complete Offline 
data collection: 		(    0) seconds.
Offline data collection
capabilities: 			 (0x73) SMART execute Offline immediate.
					Auto Offline data collection on/off support.
					Suspend Offline collection upon new
					command.
					No Offline surface scan supported.
					Self-test supported.
					Conveyance Self-test supported.
					Selective Self-test supported.
SMART capabilities:            (0x0003)	Saves SMART data before entering
					power-saving mode.
					Supports SMART auto save timer.
Error logging capability:        (0x01)	Error logging supported.
					General Purpose Logging supported.
Short self-test routine 
recommended polling time: 	 (   1) minutes.
Extended self-test routine
recommended polling time: 	 ( 224) minutes.
Conveyance self-test routine
recommended polling time: 	 (   2) minutes.
SCT capabilities: 	       (0x1081)	SCT Status supported.

SMART Attributes Data Structure revision number: 10
Vendor Specific SMART Attributes with Thresholds:
ID# ATTRIBUTE_NAME          FLAGS    VALUE WORST THRESH FAIL RAW_VALUE
  1 Raw_Read_Error_Rate     POSR--   118   091   006    -    200825432
  3 Spin_Up_Time            PO----   097   095   000    -    0
  4 Start_Stop_Count        -O--CK   092   092   020    -    8225
  5 Reallocated_Sector_Ct   PO--CK   099   099   010    -    688
  7 Seek_Error_Rate         POSR--   086   060   030    -    9467260913
  9 Power_On_Hours          -O--CK   046   046   000    -    47476
 10 Spin_Retry_Count        PO--C-   100   100   097    -    0
 12 Power_Cycle_Count       -O--CK   095   095   020    -    5448
183 Runtime_Bad_Block       -O--CK   100   100   000    -    0
184 End-to-End_Error        -O--CK   099   099   099    NOW  1
187 Reported_Uncorrect      -O--CK   001   001   000    -    151
188 Command_Timeout         -O--CK   100   089   000    -    37 1029 1131
189 High_Fly_Writes         -O-RCK   048   048   000    -    52
190 Airflow_Temperature_Cel -O---K   064   058   045    -    36 (Min/Max 36/37)
191 G-Sense_Error_Rate      -O--CK   100   100   000    -    0
192 Power-Off_Retract_Count -O--CK   100   100   000    -    1721
193 Load_Cycle_Count        -O--CK   080   080   000    -    40803
194 Temperature_Celsius     -O---K   036   042   000    -    36
197 Current_Pending_Sector  -O--C-   100   100   000    -    0
198 Offline_Uncorrectable   ----C-   100   100   000    -    0
199 UDMA_CRC_Error_Count    -OSRCK   200   192   000    -    17
240 Head_Flying_Hours       ------   100   253   000    -    46766h+00m+51.507s
241 Total_LBAs_Written      ------   100   253   000    -    587534251071
242 Total_LBAs_Read         ------   100   253   000    -    834960023983
                            ||||||_ K auto-keep
                            |||||__ C event count
                            ||||___ R error rate
                            |||____ S speed/performance
                            ||_____ O updated online
                            |______ P prefailure warning

General Purpose Log Directory Version 1
SMART           Log Directory Version 1 [multi-sector log support]
Address    Access  R/W   Size  Description
0x00       GPL,SL  R/O      1  Log Directory
0x01           SL  R/O      1  Summary SMART error log
0x02           SL  R/O      5  Comprehensive SMART error log
0x03       GPL     R/O      5  Ext. Comprehensive SMART error log
0x06           SL  R/O      1  SMART self-test log
0x07       GPL     R/O      1  Extended self-test log
0x09           SL  R/W      1  Selective self-test log
0x10       GPL     R/O      1  NCQ Command Error log
0x11       GPL     R/O      1  SATA Phy Event Counters log
0x21       GPL     R/O      1  Write stream error log
0x22       GPL     R/O      1  Read stream error log
0x30       GPL,SL  R/O      9  IDENTIFY DEVICE data log
0x80-0x9f  GPL,SL  R/W     16  Host vendor specific log
0xa1       GPL,SL  VS      20  Device vendor specific log
0xa2       GPL     VS    3900  Device vendor specific log
0xa8       GPL,SL  VS     129  Device vendor specific log
0xa9       GPL,SL  VS       1  Device vendor specific log
0xab       GPL     VS       1  Device vendor specific log
0xb0       GPL     VS    4580  Device vendor specific log
0xbe-0xbf  GPL     VS   65535  Device vendor specific log
0xc0       GPL,SL  VS       1  Device vendor specific log
0xc1       GPL,SL  VS      10  Device vendor specific log
0xc4       GPL,SL  VS       5  Device vendor specific log
0xe0       GPL,SL  R/W      1  SCT Command/Status
0xe1       GPL,SL  R/W      1  SCT Data Transfer

SMART Extended Comprehensive Error Log Version: 1 (5 sectors)
Device Error Count: 140 (device log contains only the most recent 20 errors)
	CR     = Command Register
	FEATR  = Features Register
	COUNT  = Count (was: Sector Count) Register
	LBA_48 = Upper bytes of LBA High/Mid/Low Registers ]  ATA-8
	LH     = LBA High (was: Cylinder High) Register    ]   LBA
	LM     = LBA Mid (was: Cylinder Low) Register      ] Register
	LL     = LBA Low (was: Sector Number) Register     ]
	DV     = Device (was: Device/Head) Register
	DC     = Device Control Register
	ER     = Error register
	ST     = Status register
Powered_Up_Time is measured from power on, and printed as
DDd+hh:mm:SS.sss where DD=days, hh=hours, mm=minutes,
SS=sec, and sss=millisec. It "wraps" after 49.710 days.

Error 140 [19] occurred at disk power-on lifetime: 47346 hours (1972 days + 18 hours)
  When the command that caused the error occurred, the device was active or idle.

  After command completion occurred, registers were:
  ER -- ST COUNT  LBA_48  LH LM LL DV DC
  -- -- -- == -- == == == -- -- -- -- --
  40 -- 51 00 00 00 00 c2 3e 26 90 00 00  Error: UNC at LBA = 0xc23e2690 = 3258853008

  Commands leading to the command that caused the error were:
  CR FEATR COUNT  LBA_48  LH LM LL DV DC  Powered_Up_Time  Command/Feature_Name
  -- == -- == -- == == == -- -- -- -- --  ---------------  --------------------
  60 00 00 01 00 00 00 c2 3e 08 b0 40 00     00:37:26.658  READ FPDMA QUEUED
  60 00 00 00 80 00 00 c2 3e 08 30 40 00     00:37:26.643  READ FPDMA QUEUED
  60 00 00 00 f8 00 00 c2 3e 07 38 40 00     00:37:26.643  READ FPDMA QUEUED
  60 00 00 00 08 00 00 c2 3e 07 30 40 00     00:37:26.642  READ FPDMA QUEUED
  60 00 00 00 08 00 00 a3 96 b4 70 40 00     00:37:26.617  READ FPDMA QUEUED

Error 139 [18] occurred at disk power-on lifetime: 47335 hours (1972 days + 7 hours)
  When the command that caused the error occurred, the device was active or idle.

  After command completion occurred, registers were:
  ER -- ST COUNT  LBA_48  LH LM LL DV DC
  -- -- -- == -- == == == -- -- -- -- --
  40 -- 51 00 00 00 00 c2 7a e8 c8 00 00  Error: UNC at LBA = 0xc27ae8c8 = 3262834888

  Commands leading to the command that caused the error were:
  CR FEATR COUNT  LBA_48  LH LM LL DV DC  Powered_Up_Time  Command/Feature_Name
  -- == -- == -- == == == -- -- -- -- --  ---------------  --------------------
  60 00 00 00 40 00 00 c2 7a e9 f0 40 00     00:32:05.566  READ FPDMA QUEUED
  61 00 00 00 08 00 00 02 39 b6 c8 40 00     00:32:05.498  WRITE FPDMA QUEUED
  61 00 00 04 00 00 00 c2 a8 9f 50 40 00     00:32:05.273  WRITE FPDMA QUEUED
  61 00 00 04 00 00 00 c2 a8 9b 50 40 00     00:32:05.273  WRITE FPDMA QUEUED
  61 00 00 04 00 00 00 c2 f7 1a 08 40 00     00:32:05.273  WRITE FPDMA QUEUED

Error 138 [17] occurred at disk power-on lifetime: 47335 hours (1972 days + 7 hours)
  When the command that caused the error occurred, the device was active or idle.

  After command completion occurred, registers were:
  ER -- ST COUNT  LBA_48  LH LM LL DV DC
  -- -- -- == -- == == == -- -- -- -- --
  40 -- 51 00 00 00 00 c2 4e d4 a0 00 00  Error: WP at LBA = 0xc24ed4a0 = 3259946144

  Commands leading to the command that caused the error were:
  CR FEATR COUNT  LBA_48  LH LM LL DV DC  Powered_Up_Time  Command/Feature_Name
  -- == -- == -- == == == -- -- -- -- --  ---------------  --------------------
  61 00 00 00 10 00 00 02 5d b9 88 40 00     00:27:50.287  WRITE FPDMA QUEUED
  61 00 00 00 40 00 00 04 fb a8 b0 40 00     00:27:50.237  WRITE FPDMA QUEUED
  60 00 00 00 40 00 00 c2 4e d4 70 40 00     00:27:50.234  READ FPDMA QUEUED
  61 00 00 00 20 00 00 02 98 e3 50 40 00     00:27:50.234  WRITE FPDMA QUEUED
  61 00 00 00 40 00 00 05 01 69 60 40 00     00:27:50.234  WRITE FPDMA QUEUED

Error 137 [16] occurred at disk power-on lifetime: 47335 hours (1972 days + 7 hours)
  When the command that caused the error occurred, the device was active or idle.

  After command completion occurred, registers were:
  ER -- ST COUNT  LBA_48  LH LM LL DV DC
  -- -- -- == -- == == == -- -- -- -- --
  40 -- 51 00 00 00 00 c2 59 ed 20 00 00  Error: WP at LBA = 0xc259ed20 = 3260673312

  Commands leading to the command that caused the error were:
  CR FEATR COUNT  LBA_48  LH LM LL DV DC  Powered_Up_Time  Command/Feature_Name
  -- == -- == -- == == == -- -- -- -- --  ---------------  --------------------
  61 00 00 00 78 00 00 02 57 f5 80 40 00     00:26:03.866  WRITE FPDMA QUEUED
  61 00 00 00 80 00 00 c2 ec cb 00 40 00     00:26:03.713  WRITE FPDMA QUEUED
  61 00 00 00 08 00 00 02 50 04 50 40 00     00:26:03.103  WRITE FPDMA QUEUED
  61 00 00 00 18 00 00 00 04 9c 70 40 00     00:26:02.771  WRITE FPDMA QUEUED
  61 00 00 00 08 00 00 00 78 29 c8 40 00     00:26:02.588  WRITE FPDMA QUEUED

Error 136 [15] occurred at disk power-on lifetime: 47335 hours (1972 days + 7 hours)
  When the command that caused the error occurred, the device was active or idle.

  After command completion occurred, registers were:
  ER -- ST COUNT  LBA_48  LH LM LL DV DC
  -- -- -- == -- == == == -- -- -- -- --
  40 -- 51 00 00 00 00 c2 7a df a0 00 00  Error: UNC at LBA = 0xc27adfa0 = 3262832544

  Commands leading to the command that caused the error were:
  CR FEATR COUNT  LBA_48  LH LM LL DV DC  Powered_Up_Time  Command/Feature_Name
  -- == -- == -- == == == -- -- -- -- --  ---------------  --------------------
  60 00 00 00 40 00 00 c2 7a df 90 40 00     00:19:21.991  READ FPDMA QUEUED
  61 00 00 03 90 00 00 c2 7a d4 80 40 00     00:19:21.973  WRITE FPDMA QUEUED
  61 00 00 04 00 00 00 c2 7a d0 80 40 00     00:19:21.973  WRITE FPDMA QUEUED
  61 00 00 00 70 00 00 c2 63 04 10 40 00     00:19:21.973  WRITE FPDMA QUEUED
  61 00 00 00 40 00 00 c2 58 56 80 40 00     00:19:21.973  WRITE FPDMA QUEUED

Error 135 [14] occurred at disk power-on lifetime: 47335 hours (1972 days + 7 hours)
  When the command that caused the error occurred, the device was active or idle.

  After command completion occurred, registers were:
  ER -- ST COUNT  LBA_48  LH LM LL DV DC
  -- -- -- == -- == == == -- -- -- -- --
  40 -- 51 00 00 00 00 c2 50 b6 00 00 00  Error: UNC at LBA = 0xc250b600 = 3260069376

  Commands leading to the command that caused the error were:
  CR FEATR COUNT  LBA_48  LH LM LL DV DC  Powered_Up_Time  Command/Feature_Name
  -- == -- == -- == == == -- -- -- -- --  ---------------  --------------------
  60 00 00 00 40 00 00 c2 50 b5 50 40 00     00:10:06.854  READ FPDMA QUEUED
  60 00 00 00 40 00 00 c2 50 b4 d0 40 00     00:10:06.835  READ FPDMA QUEUED
  60 00 00 00 40 00 00 c2 51 48 90 40 00     00:10:06.825  READ FPDMA QUEUED
  60 00 00 00 30 00 00 c2 51 47 10 40 00     00:10:06.820  READ FPDMA QUEUED
  60 00 00 00 40 00 00 c2 51 48 50 40 00     00:10:06.812  READ FPDMA QUEUED

Error 134 [13] occurred at disk power-on lifetime: 47335 hours (1972 days + 7 hours)
  When the command that caused the error occurred, the device was active or idle.

  After command completion occurred, registers were:
  ER -- ST COUNT  LBA_48  LH LM LL DV DC
  -- -- -- == -- == == == -- -- -- -- --
  40 -- 51 00 00 00 00 c2 51 36 d8 00 00  Error: WP at LBA = 0xc25136d8 = 3260102360

  Commands leading to the command that caused the error were:
  CR FEATR COUNT  LBA_48  LH LM LL DV DC  Powered_Up_Time  Command/Feature_Name
  -- == -- == -- == == == -- -- -- -- --  ---------------  --------------------
  61 00 00 00 48 00 00 00 50 34 20 40 00     00:09:32.668  WRITE FPDMA QUEUED
  61 00 00 00 08 00 00 00 3c d6 c0 40 00     00:09:30.250  WRITE FPDMA QUEUED
  61 00 00 00 18 00 00 00 ca 8f d8 40 00     00:09:30.205  WRITE FPDMA QUEUED
  61 00 00 00 08 00 00 00 1a 09 90 40 00     00:09:30.205  WRITE FPDMA QUEUED
  61 00 00 00 10 00 00 00 cd 30 40 40 00     00:09:30.205  WRITE FPDMA QUEUED

Error 133 [12] occurred at disk power-on lifetime: 47335 hours (1972 days + 7 hours)
  When the command that caused the error occurred, the device was active or idle.

  After command completion occurred, registers were:
  ER -- ST COUNT  LBA_48  LH LM LL DV DC
  -- -- -- == -- == == == -- -- -- -- --
  40 -- 51 00 00 00 00 c2 70 45 b8 00 00  Error: WP at LBA = 0xc27045b8 = 3262137784

  Commands leading to the command that caused the error were:
  CR FEATR COUNT  LBA_48  LH LM LL DV DC  Powered_Up_Time  Command/Feature_Name
  -- == -- == -- == == == -- -- -- -- --  ---------------  --------------------
  61 00 00 00 18 00 00 00 61 87 d0 40 00     00:30:06.295  WRITE FPDMA QUEUED
  61 00 00 00 30 00 00 00 61 cb 90 40 00     00:30:06.295  WRITE FPDMA QUEUED
  61 00 00 00 08 00 00 00 23 e3 78 40 00     00:30:06.295  WRITE FPDMA QUEUED
  61 00 00 00 10 00 00 01 35 3b 40 40 00     00:30:06.295  WRITE FPDMA QUEUED
  60 00 00 00 40 00 00 c2 70 46 30 40 00     00:30:06.294  READ FPDMA QUEUED

SMART Extended Self-test Log Version: 1 (1 sectors)
Num  Test_Description    Status                  Remaining  LifeTime(hours)  LBA_of_first_error
# 1  Vendor (0x50)       Completed without error       00%     33517         -
# 2  Short offline       Completed without error       00%     33517         -
# 3  Short offline       Completed without error       00%     15222         -
# 4  Short offline       Aborted by host               70%     10116         -
# 5  Short offline       Completed without error       00%      4758         -
# 6  Short offline       Completed without error       00%      4398         -
# 7  Vendor (0x50)       Completed without error       00%       354         -
# 8  Short offline       Completed without error       00%       354         -
# 9  Vendor (0x50)       Completed without error       00%       322         -
#10  Short offline       Completed without error       00%       322         -
#11  Vendor (0x50)       Completed without error       00%         0         -

SMART Selective self-test log data structure revision number 1
 SPAN  MIN_LBA  MAX_LBA  CURRENT_TEST_STATUS
    1        0        0  Not_testing
    2        0        0  Not_testing
    3        0        0  Not_testing
    4        0        0  Not_testing
    5        0        0  Not_testing
Selective self-test flags (0x0):
  After scanning selected spans, do NOT read-scan remainder of disk.
If Selective self-test is pending on power-up, resume after 0 minute delay.

SCT Status Version:                  3
SCT Version (vendor specific):       522 (0x020a)
Device State:                        Active (0)
Current Temperature:                    36 Celsius
Power Cycle Min/Max Temperature:     25/37 Celsius
Lifetime    Min/Max Temperature:      0/42 Celsius
Under/Over Temperature Limit Count:   0/0

SCT Data Table command not supported

SCT Error Recovery Control command not supported

Device Statistics (GP/SMART Log 0x04) not supported

Pending Defects log (GP Log 0x0c) not supported

SATA Phy Event Counters (GP Log 0x11)
ID      Size     Value  Description
0x000a  2            7  Device-to-host register FISes sent due to a COMRESET
0x0001  2            0  Command failed due to ICRC error
0x0003  2            0  R_ERR response for device-to-host data FIS
0x0004  2            0  R_ERR response for host-to-device data FIS
0x0006  2            0  R_ERR response for device-to-host non-data FIS
0x0007  2            0  R_ERR response for host-to-device non-data FIS

