smartctl 7.3 2022-02-28 r5338 [x86_64-linux-6.2.0-20-generic] (local build)
Copyright (C) 2002-22, Bruce Allen, Christian Franke, www.smartmontools.org

=== START OF INFORMATION SECTION ===
Model Number:                       GIGABYTE GP-AG41TB
Serial Number:                      --
Firmware Version:                   EGFM13.2
PCI Vendor/Subsystem ID:            0x1987
IEEE OUI Identifier:                0x6479a7
Total NVM Capacity:                 1,000,204,886,016 [1.00 TB]
Unallocated NVM Capacity:           0
Controller ID:                      1
NVMe Version:                       1.3
Number of Namespaces:               1
Namespace 1 Size/Capacity:          1,000,204,886,016 [1.00 TB]
Namespace 1 Formatted LBA Size:     512
Namespace 1 IEEE EUI-64:            6479a7 ...
Local Time is:                      Fri May 19 11:56:31 2023 PST
Firmware Updates (0x12):            1 Slot, no Reset required
Optional Admin Commands (0x0017):   Security Format Frmw_DL Self_Test
Optional NVM Commands (0x005d):     Comp DS_Mngmt Wr_Zero Sav/Sel_Feat Timestmp
Log Page Attributes (0x08):         Telmtry_Lg
Maximum Data Transfer Size:         512 Pages
Warning  Comp. Temp. Threshold:     90 Celsius
Critical Comp. Temp. Threshold:     95 Celsius

Supported Power States
St Op     Max   Active     Idle   RL RT WL WT  Ent_Lat  Ex_Lat
 0 +     9.78W       -        -    0  0  0  0        0       0
 1 +     6.75W       -        -    1  1  1  1        0       0
 2 +     5.23W       -        -    2  2  2  2        0       0
 3 -   0.0490W       -        -    3  3  3  3     2000    2000
 4 -   0.0018W       -        -    4  4  4  4    25000   25000

Supported LBA Sizes (NSID 0x1)
Id Fmt  Data  Metadt  Rel_Perf
 0 +     512       0         2
 1 -    4096       0         1

=== START OF SMART DATA SECTION ===
SMART overall-health self-assessment test result: PASSED

SMART/Health Information (NVMe Log 0x02)
Critical Warning:                   0x00
Temperature:                        51 Celsius
Available Spare:                    100%
Available Spare Threshold:          5%
Percentage Used:                    7%
Data Units Read:                    33,613,634 [17.2 TB]
Data Units Written:                 48,204,650 [24.6 TB]
Host Read Commands:                 347,473,277
Host Write Commands:                490,873,982
Controller Busy Time:               1,357
Power Cycles:                       3,382
Power On Hours:                     10,761
Unsafe Shutdowns:                   2,051
Media and Data Integrity Errors:    0
Error Information Log Entries:      6,200
Warning  Comp. Temperature Time:    0
Critical Comp. Temperature Time:    0
Thermal Temp. 1 Transition Count:   9
Thermal Temp. 1 Total Time:         2618

Error Information (NVMe Log 0x01, 16 of 63 entries)
Num   ErrCount  SQId   CmdId  Status  PELoc          LBA  NSID    VS
  0       6200     0  0x0004  0x4004  0x028            0     0     -

