smartctl 7.3 2022-02-28 r5338 [x86_64-linux-6.13.6-200.fc41.x86_64] (local build)
Copyright (C) 2002-22, Bruce Allen, Christian Franke, www.smartmontools.org

=== START OF INFORMATION SECTION ===
Model Family:     Toshiba 2.5" HDD MK..65GSX
Device Model:     TOSHIBA MK5065GSXF
Serial Number:    --
LU WWN Device Id: 5 000039 ...
Firmware Version: GP006B
User Capacity:    500,107,862,016 bytes [500 GB]
Sector Size:      512 bytes logical/physical
Rotation Rate:    5400 rpm
Form Factor:      2.5 inches
Device is:        In smartctl database 7.3/5528
ATA Version is:   ATA8-ACS (minor revision not indicated)
SATA Version is:  SATA 2.6, 3.0 Gb/s (current: 3.0 Gb/s)
Local Time is:    Mon Mar 17 16:06:53 2025 CET
SMART support is: Available - device has SMART capability.
SMART support is: Enabled
AAM feature is:   Unavailable
APM level is:     254 (maximum performance)
Rd look-ahead is: Enabled
Write cache is:   Enabled
DSN feature is:   Unavailable
ATA Security is:  Disabled, frozen [SEC2]
Wt Cache Reorder: Enabled

=== START OF READ SMART DATA SECTION ===
SMART overall-health self-assessment test result: PASSED

General SMART Values:
Offline data collection status:  (0x80)	Offline data collection activity
					was never started.
					Auto Offline Data Collection: Enabled.
Self-test execution status:      (   0)	The previous self-test routine completed
					without error or no self-test has ever 
					been run.
Total time to complete Offline 
data collection: 		(  120) seconds.
Offline data collection
capabilities: 			 (0x5b) SMART execute Offline immediate.
					Auto Offline data collection on/off support.
					Suspend Offline collection upon new
					command.
					Offline surface scan supported.
					Self-test supported.
					No Conveyance Self-test supported.
					Selective Self-test supported.
SMART capabilities:            (0x0003)	Saves SMART data before entering
					power-saving mode.
					Supports SMART auto save timer.
Error logging capability:        (0x01)	Error logging supported.
					General Purpose Logging supported.
Short self-test routine 
recommended polling time: 	 (   2) minutes.
Extended self-test routine
recommended polling time: 	 ( 183) minutes.
SCT capabilities: 	       (0x003d)	SCT Status supported.
					SCT Error Recovery Control supported.
					SCT Feature Control supported.
					SCT Data Table supported.

SMART Attributes Data Structure revision number: 16
Vendor Specific SMART Attributes with Thresholds:
ID# ATTRIBUTE_NAME          FLAGS    VALUE WORST THRESH FAIL RAW_VALUE
  1 Raw_Read_Error_Rate     PO-R--   100   100   050    -    0
  2 Throughput_Performance  P-S---   100   100   050    -    0
  3 Spin_Up_Time            POS--K   100   100   001    -    2099
  4 Start_Stop_Count        -O--CK   100   100   000    -    18756
  5 Reallocated_Sector_Ct   PO--CK   100   100   050    -    0
  7 Seek_Error_Rate         PO-R--   100   100   050    -    0
  8 Seek_Time_Performance   P-S---   100   100   050    -    0
  9 Power_On_Hours          -O--CK   015   015   000    -    34085
 10 Spin_Retry_Count        PO--CK   253   100   030    -    0
 12 Power_Cycle_Count       -O--CK   100   100   000    -    13882
191 G-Sense_Error_Rate      -O--CK   100   100   000    -    8315
192 Power-Off_Retract_Count -O--CK   095   095   000    -    2802
193 Load_Cycle_Count        -O--CK   001   001   000    -    1740931
194 Temperature_Celsius     -O---K   100   100   000    -    38 (Min/Max 15/48)
196 Reallocated_Event_Count -O--CK   100   100   000    -    0
197 Current_Pending_Sector  -O--CK   100   100   000    -    0
198 Offline_Uncorrectable   ----CK   100   100   000    -    0
199 UDMA_CRC_Error_Count    -O--CK   200   200   000    -    0
220 Disk_Shift              -O----   100   100   000    -    86
222 Loaded_Hours            -O--CK   028   028   000    -    29122
223 Load_Retry_Count        -O--CK   100   100   000    -    0
224 Load_Friction           -O---K   100   100   000    -    0
226 Load-in_Time            -OS--K   100   100   000    -    233
240 Head_Flying_Hours       P-----   100   100   001    -    0
254 Free_Fall_Sensor        -O--CK   100   100   000    -    979
                            ||||||_ K auto-keep
                            |||||__ C event count
                            ||||___ R error rate
                            |||____ S speed/performance
                            ||_____ O updated online
                            |______ P prefailure warning

General Purpose Log Directory Version 1
SMART           Log Directory Version 1 [multi-sector log support]
Address    Access  R/W   Size  Description
0x00       GPL,SL  R/O      1  Log Directory
0x01           SL  R/O      1  Summary SMART error log
0x02           SL  R/O     51  Comprehensive SMART error log
0x03       GPL     R/O     64  Ext. Comprehensive SMART error log
0x06           SL  R/O      1  SMART self-test log
0x07       GPL     R/O      1  Extended self-test log
0x09           SL  R/W      1  Selective self-test log
0x10       GPL     R/O      1  NCQ Command Error log
0x11       GPL     R/O      1  SATA Phy Event Counters log
0x80-0x9f  GPL,SL  R/W     16  Host vendor specific log
0xe0       GPL,SL  R/W      1  SCT Command/Status
0xe1       GPL,SL  R/W      1  SCT Data Transfer

SMART Extended Comprehensive Error Log Version: 1 (64 sectors)
Device Error Count: 14
	CR     = Command Register
	FEATR  = Features Register
	COUNT  = Count (was: Sector Count) Register
	LBA_48 = Upper bytes of LBA High/Mid/Low Registers ]  ATA-8
	LH     = LBA High (was: Cylinder High) Register    ]   LBA
	LM     = LBA Mid (was: Cylinder Low) Register      ] Register
	LL     = LBA Low (was: Sector Number) Register     ]
	DV     = Device (was: Device/Head) Register
	DC     = Device Control Register
	ER     = Error register
	ST     = Status register
Powered_Up_Time is measured from power on, and printed as
DDd+hh:mm:SS.sss where DD=days, hh=hours, mm=minutes,
SS=sec, and sss=millisec. It "wraps" after 49.710 days.

Error 14 [13] occurred at disk power-on lifetime: 25373 hours (1057 days + 5 hours)
  When the command that caused the error occurred, the device was active or idle.

  After command completion occurred, registers were:
  ER -- ST COUNT  LBA_48  LH LM LL DV DC
  -- -- -- == -- == == == -- -- -- -- --
  40 -- 41 00 32 00 00 08 4d 77 82 68 00  Error: UNC at LBA = 0x084d7782 = 139294594

  Commands leading to the command that caused the error were:
  CR FEATR COUNT  LBA_48  LH LM LL DV DC  Powered_Up_Time  Command/Feature_Name
  -- == -- == -- == == == -- -- -- -- --  ---------------  --------------------
  60 01 a8 00 30 00 00 08 4d 76 38 40 00     05:23:31.627  READ FPDMA QUEUED
  60 00 a0 00 28 00 00 04 c4 d0 a0 40 00     05:23:31.627  READ FPDMA QUEUED
  60 02 d0 00 20 00 00 0e ff 19 58 40 00     05:23:31.615  READ FPDMA QUEUED
  60 00 20 00 18 00 00 0f 47 e0 20 40 00     05:23:31.608  READ FPDMA QUEUED
  60 02 a8 00 10 00 00 0f 00 7e 40 40 00     05:23:31.586  READ FPDMA QUEUED

Error 13 [12] occurred at disk power-on lifetime: 25363 hours (1056 days + 19 hours)
  When the command that caused the error occurred, the device was active or idle.

  After command completion occurred, registers were:
  ER -- ST COUNT  LBA_48  LH LM LL DV DC
  -- -- -- == -- == == == -- -- -- -- --
  40 -- 41 00 2a 00 00 08 4d 77 82 68 00  Error: UNC at LBA = 0x084d7782 = 139294594

  Commands leading to the command that caused the error were:
  CR FEATR COUNT  LBA_48  LH LM LL DV DC  Powered_Up_Time  Command/Feature_Name
  -- == -- == -- == == == -- -- -- -- --  ---------------  --------------------
  60 01 a8 00 28 00 00 08 4d 76 38 40 00     09:41:56.325  READ FPDMA QUEUED
  60 00 a0 00 f8 00 00 04 c4 d0 a0 40 00     09:41:56.325  READ FPDMA QUEUED
  60 02 d0 00 b8 00 00 0e ff 19 58 40 00     09:41:56.305  READ FPDMA QUEUED
  60 02 a8 00 b0 00 00 0f 00 7e 40 40 00     09:41:56.286  READ FPDMA QUEUED
  60 02 a8 00 a8 00 00 0e f7 79 88 40 00     09:41:56.272  READ FPDMA QUEUED

Error 12 [11] occurred at disk power-on lifetime: 25362 hours (1056 days + 18 hours)
  When the command that caused the error occurred, the device was active or idle.

  After command completion occurred, registers were:
  ER -- ST COUNT  LBA_48  LH LM LL DV DC
  -- -- -- == -- == == == -- -- -- -- --
  40 -- 41 00 2a 00 00 08 4d 77 80 68 00  Error: UNC at LBA = 0x084d7780 = 139294592

  Commands leading to the command that caused the error were:
  CR FEATR COUNT  LBA_48  LH LM LL DV DC  Powered_Up_Time  Command/Feature_Name
  -- == -- == -- == == == -- -- -- -- --  ---------------  --------------------
  60 01 a8 00 28 00 00 08 4d 76 38 40 00     08:14:33.925  READ FPDMA QUEUED
  60 00 a0 00 20 00 00 04 c4 d0 a0 40 00     08:14:33.925  READ FPDMA QUEUED
  60 00 08 00 98 00 00 00 7d 8e 38 40 00     08:14:33.924  READ FPDMA QUEUED
  60 02 d0 00 18 00 00 0e ff 19 58 40 00     08:14:33.905  READ FPDMA QUEUED
  60 00 20 00 b8 00 00 00 51 fa 80 40 00     08:14:33.883  READ FPDMA QUEUED

Error 11 [10] occurred at disk power-on lifetime: 25352 hours (1056 days + 8 hours)
  When the command that caused the error occurred, the device was active or idle.

  After command completion occurred, registers were:
  ER -- ST COUNT  LBA_48  LH LM LL DV DC
  -- -- -- == -- == == == -- -- -- -- --
  40 -- 41 00 7a 00 00 08 4d 77 80 68 00  Error: UNC at LBA = 0x084d7780 = 139294592

  Commands leading to the command that caused the error were:
  CR FEATR COUNT  LBA_48  LH LM LL DV DC  Powered_Up_Time  Command/Feature_Name
  -- == -- == -- == == == -- -- -- -- --  ---------------  --------------------
  60 01 a8 00 78 00 00 08 4d 76 38 40 00     12:32:12.864  READ FPDMA QUEUED
  60 00 a0 00 70 00 00 04 c4 d0 a0 40 00     12:32:12.858  READ FPDMA QUEUED
  60 00 08 00 68 00 00 0f 75 c4 10 40 00     12:32:12.858  READ FPDMA QUEUED
  60 00 08 00 60 00 00 0f 75 c4 00 40 00     12:32:12.858  READ FPDMA QUEUED
  60 02 d0 00 08 00 00 0e ff 19 58 40 00     12:32:12.838  READ FPDMA QUEUED

Error 10 [9] occurred at disk power-on lifetime: 25351 hours (1056 days + 7 hours)
  When the command that caused the error occurred, the device was active or idle.

  After command completion occurred, registers were:
  ER -- ST COUNT  LBA_48  LH LM LL DV DC
  -- -- -- == -- == == == -- -- -- -- --
  40 -- 41 00 b2 00 00 08 4d 77 80 68 00  Error: UNC at LBA = 0x084d7780 = 139294592

  Commands leading to the command that caused the error were:
  CR FEATR COUNT  LBA_48  LH LM LL DV DC  Powered_Up_Time  Command/Feature_Name
  -- == -- == -- == == == -- -- -- -- --  ---------------  --------------------
  60 01 a8 00 b0 00 00 08 4d 76 38 40 00     11:04:31.843  READ FPDMA QUEUED
  60 00 a0 00 a8 00 00 04 c4 d0 a0 40 00     11:04:31.836  READ FPDMA QUEUED
  60 00 20 00 a0 00 00 0f 75 c4 00 40 00     11:04:31.836  READ FPDMA QUEUED
  60 02 d0 00 98 00 00 0e ff 19 58 40 00     11:04:31.817  READ FPDMA QUEUED
  60 02 a8 00 90 00 00 0f 00 7e 40 40 00     11:04:31.799  READ FPDMA QUEUED

Error 9 [8] occurred at disk power-on lifetime: 25345 hours (1056 days + 1 hours)
  When the command that caused the error occurred, the device was active or idle.

  After command completion occurred, registers were:
  ER -- ST COUNT  LBA_48  LH LM LL DV DC
  -- -- -- == -- == == == -- -- -- -- --
  40 -- 41 00 ba 00 00 08 4d 77 80 68 00  Error: WP at LBA = 0x084d7780 = 139294592

  Commands leading to the command that caused the error were:
  CR FEATR COUNT  LBA_48  LH LM LL DV DC  Powered_Up_Time  Command/Feature_Name
  -- == -- == -- == == == -- -- -- -- --  ---------------  --------------------
  61 00 60 00 e8 00 00 0e bb 22 40 40 00     05:24:31.877  WRITE FPDMA QUEUED
  61 00 70 00 e0 00 00 0e bb 05 c0 40 00     05:24:31.876  WRITE FPDMA QUEUED
  61 00 58 00 d8 00 00 0e bb ed 58 40 00     05:24:31.875  WRITE FPDMA QUEUED
  61 00 58 00 d0 00 00 0e bf cc 40 40 00     05:24:31.874  WRITE FPDMA QUEUED
  60 00 10 00 c8 00 00 02 28 51 90 40 00     05:24:31.859  READ FPDMA QUEUED

Error 8 [7] occurred at disk power-on lifetime: 25329 hours (1055 days + 9 hours)
  When the command that caused the error occurred, the device was active or idle.

  After command completion occurred, registers were:
  ER -- ST COUNT  LBA_48  LH LM LL DV DC
  -- -- -- == -- == == == -- -- -- -- --
  40 -- 41 00 42 00 00 08 4d 77 80 68 00  Error: UNC at LBA = 0x084d7780 = 139294592

  Commands leading to the command that caused the error were:
  CR FEATR COUNT  LBA_48  LH LM LL DV DC  Powered_Up_Time  Command/Feature_Name
  -- == -- == -- == == == -- -- -- -- --  ---------------  --------------------
  60 01 a8 00 40 00 00 08 4d 76 38 40 00     01:20:21.792  READ FPDMA QUEUED
  60 00 a0 00 38 00 00 04 c4 d0 a0 40 00     01:20:21.792  READ FPDMA QUEUED
  60 02 d0 00 88 00 00 0e ff 19 58 40 00     01:20:21.771  READ FPDMA QUEUED
  60 00 20 00 80 00 00 0d 56 5a 40 40 00     01:20:21.761  READ FPDMA QUEUED
  60 02 a8 00 78 00 00 0f 00 7e 40 40 00     01:20:21.740  READ FPDMA QUEUED

Error 7 [6] occurred at disk power-on lifetime: 25324 hours (1055 days + 4 hours)
  When the command that caused the error occurred, the device was active or idle.

  After command completion occurred, registers were:
  ER -- ST COUNT  LBA_48  LH LM LL DV DC
  -- -- -- == -- == == == -- -- -- -- --
  40 -- 41 00 32 00 00 08 4d 77 80 68 00  Error: UNC at LBA = 0x084d7780 = 139294592

  Commands leading to the command that caused the error were:
  CR FEATR COUNT  LBA_48  LH LM LL DV DC  Powered_Up_Time  Command/Feature_Name
  -- == -- == -- == == == -- -- -- -- --  ---------------  --------------------
  60 01 a8 00 30 00 00 08 4d 76 38 40 00     12:27:22.691  READ FPDMA QUEUED
  60 00 a0 00 28 00 00 04 c4 d0 a0 40 00     12:27:22.691  READ FPDMA QUEUED
  60 02 d0 00 20 00 00 0e ff 19 58 40 00     12:27:22.671  READ FPDMA QUEUED
  60 02 a8 00 18 00 00 0f 00 7e 40 40 00     12:27:22.650  READ FPDMA QUEUED
  60 00 20 00 10 00 00 0f 81 b3 20 40 00     12:27:22.641  READ FPDMA QUEUED

SMART Extended Self-test Log Version: 1 (1 sectors)
No self-tests have been logged.  [To run self-tests, use: smartctl -t]

SMART Selective self-test log data structure revision number 1
 SPAN  MIN_LBA  MAX_LBA  CURRENT_TEST_STATUS
    1        0        0  Not_testing
    2        0        0  Not_testing
    3        0        0  Not_testing
    4        0        0  Not_testing
    5        0        0  Not_testing
Selective self-test flags (0x0):
  After scanning selected spans, do NOT read-scan remainder of disk.
If Selective self-test is pending on power-up, resume after 0 minute delay.

SCT Status Version:                  2
SCT Version (vendor specific):       1 (0x0001)
Device State:                        Active (0)
Current Temperature:                    38 Celsius
Power Cycle Min/Max Temperature:     21/41 Celsius
Lifetime    Min/Max Temperature:     15/48 Celsius
Under/Over Temperature Limit Count:   0/0

SCT Temperature History Version:     2
Temperature Sampling Period:         1 minute
Temperature Logging Interval:        1 minute
Min/Max recommended Temperature:      5/55 Celsius
Min/Max Temperature Limit:            5/55 Celsius
Temperature History Size (Index):    478 (14)

SCT Error Recovery Control:
           Read: Disabled
          Write: Disabled

Device Statistics (GP/SMART Log 0x04) not supported

Pending Defects log (GP Log 0x0c) not supported

SATA Phy Event Counters (GP Log 0x11)
ID      Size     Value  Description
0x0001  4            0  Command failed due to ICRC error
0x0002  4            0  R_ERR response for data FIS
0x0003  4            0  R_ERR response for device-to-host data FIS
0x0004  4            0  R_ERR response for host-to-device data FIS
0x0005  4            0  R_ERR response for non-data FIS
0x0006  4            0  R_ERR response for device-to-host non-data FIS
0x0007  4            0  R_ERR response for host-to-device non-data FIS
0x0008  4            0  Device-to-host non-data FIS retries
0x0009  4        25008  Transition from drive PhyRdy to drive PhyNRdy
0x000a  4            5  Device-to-host register FISes sent due to a COMRESET
0x000b  4            0  CRC errors within host-to-device FIS
0x000d  4            0  Non-CRC errors within host-to-device FIS
0x000f  4            0  R_ERR response for host-to-device data FIS, CRC
0x0010  4            0  R_ERR response for host-to-device data FIS, non-CRC
0x0012  4            0  R_ERR response for host-to-device non-data FIS, CRC
0x0013  4            0  R_ERR response for host-to-device non-data FIS, non-CRC

