smartctl 7.2 2020-12-30 r5155 [x86_64-linux-5.10.0-21-amd64] (local build)
Copyright (C) 2002-20, Bruce Allen, Christian Franke, www.smartmontools.org

=== START OF INFORMATION SECTION ===
Model Number:                       CT500P2SSD8
Serial Number:                      --
Firmware Version:                   P2CR012
PCI Vendor/Subsystem ID:            0xc0a9
IEEE OUI Identifier:                0x6479a7
Total NVM Capacity:                 500,107,862,016 [500 GB]
Unallocated NVM Capacity:           0
Controller ID:                      1
NVMe Version:                       1.3
Number of Namespaces:               1
Namespace 1 Size/Capacity:          500,107,862,016 [500 GB]
Namespace 1 Formatted LBA Size:     512
Namespace 1 IEEE EUI-64:            6479a7 ...
Local Time is:                      Sun Apr 23 16:16:26 2023 -05
Firmware Updates (0x12):            1 Slot, no Reset required
Optional Admin Commands (0x0017):   Security Format Frmw_DL Self_Test
Optional NVM Commands (0x005e):     Wr_Unc DS_Mngmt Wr_Zero Sav/Sel_Feat Timestmp
Log Page Attributes (0x0e):         Cmd_Eff_Lg Ext_Get_Lg Telmtry_Lg
Maximum Data Transfer Size:         64 Pages
Warning  Comp. Temp. Threshold:     70 Celsius
Critical Comp. Temp. Threshold:     85 Celsius

Supported Power States
St Op     Max   Active     Idle   RL RT WL WT  Ent_Lat  Ex_Lat
 0 +     4.50W       -        -    0  0  0  0        0       0
 1 +     2.70W       -        -    1  1  1  1        0       0
 2 +     2.16W       -        -    2  2  2  2        0       0
 3 -   0.0700W       -        -    3  3  3  3     1000    1000
 4 -   0.0020W       -        -    4  4  4  4     5000   55000

Supported LBA Sizes (NSID 0x1)
Id Fmt  Data  Metadt  Rel_Perf
 0 +     512       0         1
 1 -    4096       0         0

=== START OF SMART DATA SECTION ===
SMART overall-health self-assessment test result: FAILED!
- temperature is above or below threshold

SMART/Health Information (NVMe Log 0x02)
Critical Warning:                   0x02
Temperature:                        -46 Celsius
Available Spare:                    100%
Available Spare Threshold:          5%
Percentage Used:                    0%
Data Units Read:                    9,397,058 [4.81 TB]
Data Units Written:                 9,007,409 [4.61 TB]
Host Read Commands:                 123,290,775
Host Write Commands:                128,587,076
Controller Busy Time:               1,531
Power Cycles:                       1,089
Power On Hours:                     1,500
Unsafe Shutdowns:                   9
Media and Data Integrity Errors:    0
Error Information Log Entries:      19,748
Warning  Comp. Temperature Time:    0
Critical Comp. Temperature Time:    0
Thermal Temp. 1 Transition Count:   1
Thermal Temp. 2 Transition Count:   1
Thermal Temp. 1 Total Time:         11
Thermal Temp. 2 Total Time:         77

Error Information (NVMe Log 0x01, 16 of 16 entries)
No Errors Logged



