smartctl 7.2 2020-12-30 r5155 [x86_64-linux-6.8.0-51-generic] (local build)
Copyright (C) 2002-20, Bruce Allen, Christian Franke, www.smartmontools.org

=== START OF INFORMATION SECTION ===
Model Number:                       670p SSDPEKNU512GZ NVMe INTEL 512GB
Serial Number:                      --
Firmware Version:                   7002
PCI Vendor/Subsystem ID:            0x8086
IEEE OUI Identifier:                0x5cd2e4
Controller ID:                      1
NVMe Version:                       1.4
Number of Namespaces:               1
Namespace 1 Size/Capacity:          512,110,190,592 [512 GB]
Namespace 1 Formatted LBA Size:     512
Namespace 1 IEEE EUI-64:            5cd2e4 ...
Local Time is:                      Thu Jan 23 10:30:28 2025 PST
Firmware Updates (0x14):            2 Slots, no Reset required
Optional Admin Commands (0x0017):   Security Format Frmw_DL Self_Test
Optional NVM Commands (0x005f):     Comp Wr_Unc DS_Mngmt Wr_Zero Sav/Sel_Feat Timestmp
Log Page Attributes (0x1f):         S/H_per_NS Cmd_Eff_Lg Ext_Get_Lg Telmtry_Lg Pers_Ev_Lg
Maximum Data Transfer Size:         64 Pages
Warning  Comp. Temp. Threshold:     83 Celsius
Critical Comp. Temp. Threshold:     87 Celsius

Supported Power States
St Op     Max   Active     Idle   RL RT WL WT  Ent_Lat  Ex_Lat
 0 +     3.50W       -        -    0  0  0  0        0       0
 1 +     2.70W       -        -    1  1  1  1        0       0
 2 +     2.00W       -        -    2  2  2  2        0       0
 3 -   0.0250W       -        -    3  3  3  3     5000    5000
 4 -   0.0040W       -        -    4  4  4  4     3000   11999

Supported LBA Sizes (NSID 0x1)
Id Fmt  Data  Metadt  Rel_Perf
 0 +     512       0         0

=== START OF SMART DATA SECTION ===
SMART overall-health self-assessment test result: PASSED

SMART/Health Information (NVMe Log 0x02)
Critical Warning:                   0x00
Temperature:                        25 Celsius
Available Spare:                    100%
Available Spare Threshold:          50%
Percentage Used:                    0%
Data Units Read:                    1,561,313 [799 GB]
Data Units Written:                 2,280,057 [1.16 TB]
Host Read Commands:                 15,122,763
Host Write Commands:                29,948,634
Controller Busy Time:               744
Power Cycles:                       127
Power On Hours:                     519
Unsafe Shutdowns:                   16
Media and Data Integrity Errors:    0
Error Information Log Entries:      1
Warning  Comp. Temperature Time:    0
Critical Comp. Temperature Time:    0

Error Information (NVMe Log 0x01, 16 of 256 entries)
No Errors Logged

