smartctl 7.3 2022-02-28 r5338 [x86_64-linux-6.2.6-desktop-1omv2390] (OpenMandriva Lx 7.3-3)
Copyright (C) 2002-22, Bruce Allen, Christian Franke, www.smartmontools.org

=== START OF INFORMATION SECTION ===
Model Family:     Western Digital Caviar SE Serial ATA
Device Model:     WDC WD800JD-22LSA0
Serial Number:    --
Firmware Version: 06.01D06
User Capacity:    80,026,361,856 bytes [80.0 GB]
Sector Size:      512 bytes logical/physical
Device is:        In smartctl database
ATA Version is:   ATA/ATAPI-7 (minor revision not indicated)
Local Time is:    Fri Mar 31 00:28:18 2023 MSK
SMART support is: Available - device has SMART capability.
SMART support is: Enabled
AAM level is:     254 (maximum performance), recommended: 128
APM feature is:   Unavailable
Rd look-ahead is: Enabled
Write cache is:   Enabled
DSN feature is:   Unavailable
ATA Security is:  Unavailable
Write SCT (Get) Feature Control Command failed: scsi error badly formed scsi parameters
Wt Cache Reorder: Unknown (SCT Feature Control command failed)

=== START OF READ SMART DATA SECTION ===
SMART overall-health self-assessment test result: PASSED
See vendor-specific Attribute list for marginal Attributes.

General SMART Values:
Offline data collection status:  (0x82)	Offline data collection activity
					was completed without error.
					Auto Offline Data Collection: Enabled.
Self-test execution status:      (   0)	The previous self-test routine completed
					without error or no self-test has ever 
					been run.
Total time to complete Offline 
data collection: 		( 2460) seconds.
Offline data collection
capabilities: 			 (0x7b) SMART execute Offline immediate.
					Auto Offline data collection on/off support.
					Suspend Offline collection upon new
					command.
					Offline surface scan supported.
					Self-test supported.
					Conveyance Self-test supported.
					Selective Self-test supported.
SMART capabilities:            (0x0003)	Saves SMART data before entering
					power-saving mode.
					Supports SMART auto save timer.
Error logging capability:        (0x01)	Error logging supported.
					General Purpose Logging supported.
Short self-test routine 
recommended polling time: 	 (   2) minutes.
Extended self-test routine
recommended polling time: 	 (  33) minutes.
Conveyance self-test routine
recommended polling time: 	 (   5) minutes.
SCT capabilities: 	       (0x103f)	SCT Status supported.
					SCT Error Recovery Control supported.
					SCT Feature Control supported.
					SCT Data Table supported.

SMART Attributes Data Structure revision number: 16
Vendor Specific SMART Attributes with Thresholds:
ID# ATTRIBUTE_NAME          FLAGS    VALUE WORST THRESH FAIL RAW_VALUE
  1 Raw_Read_Error_Rate     POSR--   200   200   051    -    4
  3 Spin_Up_Time            PO----   170   151   021    -    2500
  4 Start_Stop_Count        -O--CK   088   088   000    -    12375
  5 Reallocated_Sector_Ct   PO--CK   188   188   140    -    94
  7 Seek_Error_Rate         POSR--   200   200   051    -    0
  9 Power_On_Hours          -O--CK   051   051   000    -    36020
 10 Spin_Retry_Count        PO--C-   100   100   051    -    0
 11 Calibration_Retry_Count -O--C-   100   100   051    -    0
 12 Power_Cycle_Count       -O--CK   090   090   000    -    10920
190 Airflow_Temperature_Cel -O---K   065   026   045    Past 35
194 Temperature_Celsius     -O---K   108   069   000    -    35
196 Reallocated_Event_Count -O--CK   195   195   000    -    5
197 Current_Pending_Sector  -O--C-   200   199   000    -    0
198 Offline_Uncorrectable   ----C-   200   197   000    -    0
199 UDMA_CRC_Error_Count    -OSRCK   200   200   000    -    1678
200 Multi_Zone_Error_Rate   P--R--   200   199   051    -    0
                            ||||||_ K auto-keep
                            |||||__ C event count
                            ||||___ R error rate
                            |||____ S speed/performance
                            ||_____ O updated online
                            |______ P prefailure warning

General Purpose Log Directory Version 1
SMART           Log Directory Version 1 [multi-sector log support]
Address    Access  R/W   Size  Description
0x00       GPL,SL  R/O      1  Log Directory
0x01           SL  R/O      1  Summary SMART error log
0x02           SL  R/O      1  Comprehensive SMART error log
0x03       GPL     R/O      6  Ext. Comprehensive SMART error log
0x06           SL  R/O      1  SMART self-test log
0x07       GPL     R/O      1  Extended self-test log
0x09           SL  R/W      1  Selective self-test log
0x11       GPL     R/O      1  SATA Phy Event Counters log
0x80-0x9f  GPL,SL  R/W     16  Host vendor specific log
0xa0-0xa7  GPL,SL  VS      16  Device vendor specific log
0xa8-0xb7  GPL,SL  VS       1  Device vendor specific log
0xc0           SL  VS       1  Device vendor specific log
0xe0       GPL,SL  R/W      1  SCT Command/Status
0xe1       GPL,SL  R/W      1  SCT Data Transfer

SMART Extended Comprehensive Error Log Version: 1 (6 sectors)
Device Error Count: 33 (device log contains only the most recent 24 errors)
	CR     = Command Register
	FEATR  = Features Register
	COUNT  = Count (was: Sector Count) Register
	LBA_48 = Upper bytes of LBA High/Mid/Low Registers ]  ATA-8
	LH     = LBA High (was: Cylinder High) Register    ]   LBA
	LM     = LBA Mid (was: Cylinder Low) Register      ] Register
	LL     = LBA Low (was: Sector Number) Register     ]
	DV     = Device (was: Device/Head) Register
	DC     = Device Control Register
	ER     = Error register
	ST     = Status register
Powered_Up_Time is measured from power on, and printed as
DDd+hh:mm:SS.sss where DD=days, hh=hours, mm=minutes,
SS=sec, and sss=millisec. It "wraps" after 49.710 days.

Error 33 [8] occurred at disk power-on lifetime: 0 hours (0 days + 0 hours)
  When the command that caused the error occurred, the device was in an unknown state.

  After command completion occurred, registers were:
  ER -- ST COUNT  LBA_48  LH LM LL DV DC
  -- -- -- == -- == == == -- -- -- -- --
  04 -- 00 00 0d 00 53 00 00 00 00 00 00

  Commands leading to the command that caused the error were:
  CR FEATR COUNT  LBA_48  LH LM LL DV DC  Powered_Up_Time  Command/Feature_Name
  -- == -- == -- == == == -- -- -- -- --  ---------------  --------------------
  00 1e b0 17 45 00 00 00 00 00 00 00 00     00:00:00.000  NOP [Reserved subcommand] [OBS-ACS-2]
  00 01 d5 00 e0 17 1e 00 45 b0 00 00 00     00:00:57.345  NOP [Reserved subcommand] [OBS-ACS-2]
  00 12 ec 17 45 00 01 00 00 00 00 00 00     00:25:25.011  NOP [Reserved subcommand] [OBS-ACS-2]
  00 01 00 00 00 17 e6 00 43 ec 00 00 00     00:00:00.001  NOP [Abort queued commands]

Error 32 [7] occurred at disk power-on lifetime: 0 hours (0 days + 0 hours)
  When the command that caused the error occurred, the device was in an unknown state.

  After command completion occurred, registers were:
  ER -- ST COUNT  LBA_48  LH LM LL DV DC
  -- -- -- == -- == == == -- -- -- -- --
  04 -- 00 01 01 00 53 00 00 00 01 00 00

  Commands leading to the command that caused the error were:
  CR FEATR COUNT  LBA_48  LH LM LL DV DC  Powered_Up_Time  Command/Feature_Name
  -- == -- == -- == == == -- -- -- -- --  ---------------  --------------------
  00 b1 b0 0b 15 00 00 00 00 00 00 00 00     00:00:00.000  NOP [Reserved subcommand] [OBS-ACS-2]
  00 01 d5 00 e0 0b b1 00 15 b0 00 00 00     00:00:57.345  NOP [Reserved subcommand] [OBS-ACS-2]
  00 a5 ec 0b 15 00 01 00 00 00 00 00 00     00:12:06.437  NOP [Reserved subcommand] [OBS-ACS-2]
  00 01 00 00 00 0b 84 00 14 ec 00 00 00     00:00:00.001  NOP [Abort queued commands]

Error 31 [6] occurred at disk power-on lifetime: 0 hours (0 days + 0 hours)
  When the command that caused the error occurred, the device was in an unknown state.

  After command completion occurred, registers were:
  ER -- ST COUNT  LBA_48  LH LM LL DV DC
  -- -- -- == -- == == == -- -- -- -- --
  40 -- 00 01 00 00 51 00 00 e2 01 00 00

  Commands leading to the command that caused the error were:
  CR FEATR COUNT  LBA_48  LH LM LL DV DC  Powered_Up_Time  Command/Feature_Name
  -- == -- == -- == == == -- -- -- -- --  ---------------  --------------------
  00 24 ca 39 d8 00 00 00 00 00 01 00 04     00:00:00.000  NOP [Reserved subcommand] [OBS-ACS-2]
  00 08 00 00 9f 39 97 02 d0 c8 00 01 00     00:00:36.616  NOP [Abort queued commands]
  02 96 ca 39 d0 00 80 00 2f 00 01 00 02     05:42:46.166  [RESERVED]
  00 80 00 00 2f 39 95 02 d0 ca 00 01 00     00:00:44.928  NOP [Abort queued commands]

Error 30 [5] occurred at disk power-on lifetime: 0 hours (0 days + 0 hours)
  When the command that caused the error occurred, the device was in an unknown state.

  After command completion occurred, registers were:
  ER -- ST COUNT  LBA_48  LH LM LL DV DC
  -- -- -- == -- == == == -- -- -- -- --
  40 -- 00 01 00 00 51 00 00 e2 01 00 00

  Commands leading to the command that caused the error were:
  CR FEATR COUNT  LBA_48  LH LM LL DV DC  Powered_Up_Time  Command/Feature_Name
  -- == -- == -- == == == -- -- -- -- --  ---------------  --------------------
  00 94 ca 39 d0 00 00 00 00 00 01 00 00     00:00:00.000  NOP [Reserved subcommand] [OBS-ACS-2]
  00 08 00 00 9f 39 38 02 c9 c8 00 01 00     00:00:55.168  NOP [Abort queued commands]
  02 36 ca 39 c9 00 08 00 0f 00 01 00 02     05:42:44.279  [RESERVED]
  00 80 00 00 3f 39 35 02 c9 ca 00 01 00     00:00:49.008  NOP [Abort queued commands]

Error 29 [4] occurred at disk power-on lifetime: 0 hours (0 days + 0 hours)
  When the command that caused the error occurred, the device was in an unknown state.

  After command completion occurred, registers were:
  ER -- ST COUNT  LBA_48  LH LM LL DV DC
  -- -- -- == -- == == == -- -- -- -- --
  40 -- 00 01 00 00 51 00 00 e2 01 00 00

  Commands leading to the command that caused the error were:
  CR FEATR COUNT  LBA_48  LH LM LL DV DC  Powered_Up_Time  Command/Feature_Name
  -- == -- == -- == == == -- -- -- -- --  ---------------  --------------------
  00 b2 c8 39 c0 00 00 00 00 00 01 00 02     00:00:00.000  NOP [Reserved subcommand] [OBS-ACS-2]
  00 78 00 00 af 39 b2 02 c0 ca 00 01 00     00:00:40.712  NOP [Abort queued commands]
  02 b1 ca 39 c0 00 80 00 2f 00 01 00 02     05:42:42.097  [RESERVED]
  00 08 00 00 3f 39 09 00 c8 ca 00 01 00     00:00:44.928  NOP [Abort queued commands]

Error 28 [3] occurred at disk power-on lifetime: 0 hours (0 days + 0 hours)
  When the command that caused the error occurred, the device was in an unknown state.

  After command completion occurred, registers were:
  ER -- ST COUNT  LBA_48  LH LM LL DV DC
  -- -- -- == -- == == == -- -- -- -- --
  40 -- 00 01 00 00 51 00 00 e2 01 00 00

  Commands leading to the command that caused the error were:
  CR FEATR COUNT  LBA_48  LH LM LL DV DC  Powered_Up_Time  Command/Feature_Name
  -- == -- == -- == == == -- -- -- -- --  ---------------  --------------------
  00 ad ca 39 c0 00 00 00 00 00 01 00 02     00:00:00.000  NOP [Reserved subcommand] [OBS-ACS-2]
  00 08 00 00 9f 39 1e 02 ba c8 00 01 00     00:00:44.880  NOP [Abort queued commands]
  02 1d ca 39 ba 00 28 00 07 00 01 00 02     05:42:40.414  [RESERVED]
  00 08 00 00 27 39 1d 02 ba c8 00 01 00     00:00:34.688  NOP [Abort queued commands]

Error 27 [2] occurred at disk power-on lifetime: 0 hours (0 days + 0 hours)
  When the command that caused the error occurred, the device was in an unknown state.

  After command completion occurred, registers were:
  ER -- ST COUNT  LBA_48  LH LM LL DV DC
  -- -- -- == -- == == == -- -- -- -- --
  40 -- 00 01 00 00 51 00 00 40 01 00 00

  Commands leading to the command that caused the error were:
  CR FEATR COUNT  LBA_48  LH LM LL DV DC  Powered_Up_Time  Command/Feature_Name
  -- == -- == -- == == == -- -- -- -- --  ---------------  --------------------
  00 df 25 08 e9 00 00 00 00 00 00 00 03     00:00:00.000  NOP [Reserved subcommand] [OBS-ACS-2]
  00 08 00 00 af 08 89 03 e2 25 00 00 00     00:00:44.808  NOP [Abort queued commands]
  03 c3 35 08 c5 00 08 00 af 00 00 00 00     00:09:40.340  CFA REQUEST EXTENDED ERROR
  00 08 00 00 af 08 6d 03 be 25 00 00 00     00:00:16.129  NOP [Abort queued commands]

Error 26 [1] occurred at disk power-on lifetime: 0 hours (0 days + 0 hours)
  When the command that caused the error occurred, the device was in an unknown state.

  After command completion occurred, registers were:
  ER -- ST COUNT  LBA_48  LH LM LL DV DC
  -- -- -- == -- == == == -- -- -- -- --
  40 -- 00 01 00 00 51 00 00 40 01 00 00

  Commands leading to the command that caused the error were:
  CR FEATR COUNT  LBA_48  LH LM LL DV DC  Powered_Up_Time  Command/Feature_Name
  -- == -- == -- == == == -- -- -- -- --  ---------------  --------------------
  00 89 25 08 e2 00 00 00 00 00 00 00 03     00:00:00.000  NOP [Reserved subcommand] [OBS-ACS-2]
  00 08 00 00 af 08 f4 03 da 25 00 00 00     00:00:44.808  NOP [Abort queued commands]
  00 6d 25 08 be 00 01 00 3f 00 00 00 03     00:09:34.915  NOP [Reserved subcommand] [OBS-ACS-2]
  00 08 00 00 af 08 df 03 b6 25 00 00 00     00:00:44.808  NOP [Abort queued commands]

SMART Extended Self-test Log Version: 1 (1 sectors)
Num  Test_Description    Status                  Remaining  LifeTime(hours)  LBA_of_first_error
# 1  Short offline       Completed without error       00%     35982         -
# 2  Extended offline    Completed without error       00%     10563         -
# 3  Extended offline    Aborted by host               90%     10560         -

SMART Selective self-test log data structure revision number 1
 SPAN  MIN_LBA  MAX_LBA  CURRENT_TEST_STATUS
    1        0        0  Not_testing
    2        0        0  Not_testing
    3        0        0  Not_testing
    4        0        0  Not_testing
    5        0        0  Not_testing
Selective self-test flags (0x0):
  After scanning selected spans, do NOT read-scan remainder of disk.
If Selective self-test is pending on power-up, resume after 0 minute delay.

SCT Status Version:                  2
SCT Version (vendor specific):       258 (0x0102)
Device State:                        Active (0)
Current Temperature:                    35 Celsius
Power Cycle Min/Max Temperature:     --/35 Celsius
Lifetime    Min/Max Temperature:     --/80 Celsius

SCT Temperature History Version:     2
Temperature Sampling Period:         1 minute
Temperature Logging Interval:        1 minute
Min/Max recommended Temperature:      5/65 Celsius
Min/Max Temperature Limit:            1/60 Celsius
Temperature History Size (Index):    128 (106)

SCT Error Recovery Control:
           Read: Disabled
          Write: Disabled

Device Statistics (GP/SMART Log 0x04) not supported

Pending Defects log (GP Log 0x0c) not supported

SATA Phy Event Counters (GP Log 0x11)
ID      Size     Value  Description
0x0001  2            0  Command failed due to ICRC error
0x000a  2           11  Device-to-host register FISes sent due to a COMRESET
0x8000  4         1525  Vendor specific

