smartctl 7.2 2020-12-30 r5155 [x86_64-linux-6.5.0-25-generic] (local build)
Copyright (C) 2002-20, Bruce Allen, Christian Franke, www.smartmontools.org

=== START OF INFORMATION SECTION ===
Device Model:     SanDisk X400 M.2 2280 256GB
Serial Number:    --
LU WWN Device Id: 5 001b44 ...
Firmware Version: X4130012
User Capacity:    256,060,514,304 bytes [256 GB]
Sector Size:      512 bytes logical/physical
Rotation Rate:    Solid State Device
Form Factor:      M.2
TRIM Command:     Available, deterministic, zeroed
Device is:        Not in smartctl database [for details use: -P showall]
ATA Version is:   ACS-2 T13/2015-D revision 3
SATA Version is:  SATA 3.2, 6.0 Gb/s (current: 6.0 Gb/s)
Local Time is:    Thu Mar 14 13:51:02 2024 EDT
SMART support is: Available - device has SMART capability.
SMART support is: Enabled
AAM feature is:   Unavailable
APM level is:     128 (minimum power consumption without standby)
Rd look-ahead is: Enabled
Write cache is:   Enabled
DSN feature is:   Unavailable
ATA Security is:  Disabled, NOT FROZEN [SEC1]
Wt Cache Reorder: Enabled

=== START OF READ SMART DATA SECTION ===
SMART overall-health self-assessment test result: PASSED

General SMART Values:
Offline data collection status:  (0x00)	Offline data collection activity
					was never started.
					Auto Offline Data Collection: Disabled.
Self-test execution status:      (   0)	The previous self-test routine completed
					without error or no self-test has ever 
					been run.
Total time to complete Offline 
data collection: 		(    0) seconds.
Offline data collection
capabilities: 			 (0x11) SMART execute Offline immediate.
					No Auto Offline data collection support.
					Suspend Offline collection upon new
					command.
					No Offline surface scan supported.
					Self-test supported.
					No Conveyance Self-test supported.
					No Selective Self-test supported.
SMART capabilities:            (0x0003)	Saves SMART data before entering
					power-saving mode.
					Supports SMART auto save timer.
Error logging capability:        (0x01)	Error logging supported.
					General Purpose Logging supported.
Short self-test routine 
recommended polling time: 	 (   2) minutes.
Extended self-test routine
recommended polling time: 	 (  10) minutes.
SCT capabilities: 	       (0x003d)	SCT Status supported.
					SCT Error Recovery Control supported.
					SCT Feature Control supported.
					SCT Data Table supported.

SMART Attributes Data Structure revision number: 4
Vendor Specific SMART Attributes with Thresholds:
ID# ATTRIBUTE_NAME          FLAGS    VALUE WORST THRESH FAIL RAW_VALUE
  5 Reallocated_Sector_Ct   -O--CK   100   100   ---    -    0
  9 Power_On_Hours          -O--CK   100   100   ---    -    37805
 12 Power_Cycle_Count       -O--CK   100   100   ---    -    831
175 Program_Fail_Count_Chip -O--CK   100   100   ---    -    0
176 Erase_Fail_Count_Chip   -O--CK   100   100   ---    -    0
177 Wear_Leveling_Count     -O--CK   100   100   ---    -    129
178 Used_Rsvd_Blk_Cnt_Chip  -O--CK   100   100   ---    -    0
179 Used_Rsvd_Blk_Cnt_Tot   -O--CK   100   100   ---    -    0
180 Unused_Rsvd_Blk_Cnt_Tot PO--CK   100   100   004    -    10418
181 Program_Fail_Cnt_Total  -O--CK   100   100   ---    -    0
182 Erase_Fail_Count_Total  -O--CK   100   100   ---    -    0
187 Reported_Uncorrect      -O--CK   100   100   ---    -    0
194 Temperature_Celsius     -O---K   066   070   ---    -    34 (Min/Max 15/70)
195 Hardware_ECC_Recovered  -O--CK   100   100   ---    -    0
199 UDMA_CRC_Error_Count    -O--CK   100   100   ---    -    0
230 Unknown_SSD_Attribute   -O--CK   100   100   ---    -    40729479619851
238 Unknown_Attribute       -O--CK   063   100   ---    -    10554526
241 Total_LBAs_Written      ----CK   253   253   ---    -    89602066154
242 Total_LBAs_Read         ----CK   253   253   ---    -    145353533239
                            ||||||_ K auto-keep
                            |||||__ C event count
                            ||||___ R error rate
                            |||____ S speed/performance
                            ||_____ O updated online
                            |______ P prefailure warning

General Purpose Log Directory Version 1
SMART           Log Directory Version 1 [multi-sector log support]
Address    Access  R/W   Size  Description
0x00       GPL,SL  R/O      1  Log Directory
0x01           SL  R/O      1  Summary SMART error log
0x02           SL  R/O      2  Comprehensive SMART error log
0x03       GPL     R/O      1  Ext. Comprehensive SMART error log
0x04       GPL,SL  R/O      8  Device Statistics log
0x06           SL  R/O      1  SMART self-test log
0x07       GPL     R/O      1  Extended self-test log
0x10       GPL     R/O      1  NCQ Command Error log
0x11       GPL     R/O      1  SATA Phy Event Counters log
0x30       GPL,SL  R/O      9  IDENTIFY DEVICE data log
0x80-0x9f  GPL,SL  R/W     16  Host vendor specific log
0xde       GPL     VS       8  Device vendor specific log
0xe0       GPL,SL  R/W      1  SCT Command/Status
0xe1       GPL,SL  R/W      1  SCT Data Transfer

SMART Extended Comprehensive Error Log Version: 1 (1 sectors)
No Errors Logged

SMART Extended Self-test Log Version: 1 (1 sectors)
Num  Test_Description    Status                  Remaining  LifeTime(hours)  LBA_of_first_error
# 1  Short offline       Completed without error       00%     25122         -
# 2  Short offline       Completed without error       00%     24402         -
# 3  Short offline       Completed without error       00%     23893         -
# 4  Short offline       Completed without error       00%     23861         -
# 5  Short offline       Completed without error       00%     22986         -
# 6  Short offline       Completed without error       00%     22342         -
# 7  Short offline       Completed without error       00%     20404         -
# 8  Short offline       Completed without error       00%     19303         -
# 9  Short offline       Completed without error       00%     17248         -
#10  Short offline       Completed without error       00%     16559         -
#11  Short offline       Completed without error       00%     15310         -
#12  Short offline       Completed without error       00%     14441         -
#13  Short offline       Completed without error       00%     13483         -
#14  Short offline       Completed without error       00%     12866         -
#15  Short offline       Completed without error       00%     11903         -
#16  Short offline       Completed without error       00%     10966         -
#17  Short offline       Completed without error       00%     10003         -
#18  Short offline       Completed without error       00%     10000         -
#19  Short offline       Completed without error       00%      9555         -

Selective Self-tests/Logging not supported

SCT Status Version:                  3
SCT Version (vendor specific):       257 (0x0101)
Device State:                        Active (0)
Current Temperature:                    33 Celsius
Power Cycle Min/Max Temperature:     30/33 Celsius
Lifetime    Min/Max Temperature:     30/33 Celsius
Specified Max Operating Temperature:    33 Celsius
Under/Over Temperature Limit Count:   0/0
Vendor specific:
00 00 00 00 00 00 00 00 00 00 00 00 00 00 00 00
01 00 01 00 01 00 00 00 00 00 00 00 00 00 00 00

SCT Temperature History Version:     2
Temperature Sampling Period:         1 minute
Temperature Logging Interval:        1 minute
Min/Max recommended Temperature:     -10/70 Celsius
Min/Max Temperature Limit:           -15/90 Celsius
Temperature History Size (Index):    256 (148)

SCT Error Recovery Control:
           Read: Disabled
          Write: Disabled

Device Statistics (GP Log 0x04)
Page  Offset Size        Value Flags Description
0x01  =====  =               =  ===  == General Statistics (rev 1) ==
0x01  0x008  4             831  ---  Lifetime Power-On Resets
0x01  0x010  4            2250  ---  Power-on Hours
0x01  0x018  6     89602066154  ---  Logical Sectors Written
0x01  0x020  6      1114789301  ---  Number of Write Commands
0x01  0x028  6    145353533239  ---  Logical Sectors Read
0x01  0x030  6      2939319914  ---  Number of Read Commands
0x07  =====  =               =  ===  == Solid State Device Statistics (rev 1) ==
0x07  0x008  1              18  N--  Percentage Used Endurance Indicator
                                |||_ C monitored condition met
                                ||__ D supports DSN
                                |___ N normalized value

Pending Defects log (GP Log 0x0c) not supported

SATA Phy Event Counters (GP Log 0x11)
ID      Size     Value  Description
0x0001  4            0  Command failed due to ICRC error
0x0002  4            0  R_ERR response for data FIS
0x0005  4            0  R_ERR response for non-data FIS
0x000a  4            2  Device-to-host register FISes sent due to a COMRESET

