smartctl 7.4 2023-08-01 r5530 [x86_64-linux-6.8.0-31-generic] (local build)
Copyright (C) 2002-23, Bruce Allen, Christian Franke, www.smartmontools.org

=== START OF INFORMATION SECTION ===
Model Number:                       THNSN5256GPU7 NVMe TOSHIBA 256GB
Serial Number:                      --
Firmware Version:                   57DA4103
PCI Vendor/Subsystem ID:            0x1179
IEEE OUI Identifier:                0x0d0800
Controller ID:                      0
NVMe Version:                       <1.2
Number of Namespaces:               1
Namespace 1 Size/Capacity:          256,060,514,304 [256 GB]
Namespace 1 Formatted LBA Size:     512
Namespace 1 IEEE EUI-64:            00080d ...
Local Time is:                      Wed Jan 15 14:32:02 2025 CET
Firmware Updates (0x02):            1 Slot
Optional Admin Commands (0x0016):   Format Frmw_DL Self_Test
Optional NVM Commands (0x001e):     Wr_Unc DS_Mngmt Wr_Zero Sav/Sel_Feat
Warning  Comp. Temp. Threshold:     78 Celsius
Critical Comp. Temp. Threshold:     82 Celsius

Supported Power States
St Op     Max   Active     Idle   RL RT WL WT  Ent_Lat  Ex_Lat
 0 +     6.00W       -        -    0  0  0  0        0       0
 1 +     2.40W       -        -    1  1  1  1        0       0
 2 +     1.90W       -        -    2  2  2  2        0       0
 3 -   0.0120W       -        -    3  3  3  3     5000   10000
 4 -   0.0060W       -        -    4  4  4  4   100000   50000

Supported LBA Sizes (NSID 0x1)
Id Fmt  Data  Metadt  Rel_Perf
 0 +     512       0         2
 1 -    4096       0         1

=== START OF SMART DATA SECTION ===
SMART overall-health self-assessment test result: PASSED

SMART/Health Information (NVMe Log 0x02)
Critical Warning:                   0x00
Temperature:                        61 Celsius
Available Spare:                    100%
Available Spare Threshold:          50%
Percentage Used:                    16%
Data Units Read:                    1,177,560,179 [602 TB]
Data Units Written:                 56,682,137 [29.0 TB]
Host Read Commands:                 2,470,205,429
Host Write Commands:                1,635,407,789
Controller Busy Time:               11,683
Power Cycles:                       551
Power On Hours:                     57,646
Unsafe Shutdowns:                   354
Media and Data Integrity Errors:    0
Error Information Log Entries:      0
Warning  Comp. Temperature Time:    10
Critical Comp. Temperature Time:    0
Temperature Sensor 1:               61 Celsius

Error Information (NVMe Log 0x01, 16 of 128 entries)
No Errors Logged

Self-test Log (NVMe Log 0x06)
Self-test status: No self-test in progress
Num  Test_Description  Status                       Power_on_Hours  Failing_LBA  NSID Seg SCT Code
 0   Extended          Completed without error                3495            -     -   -   -    -
 1   Short             Completed without error                3494            -     -   -   -    -
 2   Extended          Completed without error                3474            -     -   -   -    -
 3   Short             Completed without error                3474            -     -   -   -    -
 4   Short             Completed without error                3472            -     -   -   -    -
 5   Short             Completed without error                3471            -     -   -   -    -
 6   Short             Completed without error                3471            -     -   -   -    -
 7   Short             Completed without error                3471            -     -   -   -    -
 8   Short             Completed without error                3471            -     -   -   -    -

