smartctl 7.3 2022-02-28 r5338 [x86_64-linux-6.2.0-39-generic] (local build)
Copyright (C) 2002-22, Bruce Allen, Christian Franke, www.smartmontools.org

=== START OF INFORMATION SECTION ===
Model Number:                       SAMSUNG MZQLB960HAJR-00007
Serial Number:                      --
Firmware Version:                   EDA5702Q
PCI Vendor/Subsystem ID:            0x144d
IEEE OUI Identifier:                0x002538
Total NVM Capacity:                 960,197,124,096 [960 GB]
Unallocated NVM Capacity:           0
Controller ID:                      4
NVMe Version:                       1.2
Number of Namespaces:               1
Namespace 1 Size/Capacity:          960,197,124,096 [960 GB]
Namespace 1 Utilization:            0
Namespace 1 Formatted LBA Size:     512
Local Time is:                      Tue Sep  3 02:44:01 2024 UTC
Firmware Updates (0x17):            3 Slots, Slot 1 R/O, no Reset required
Optional Admin Commands (0x000f):   Security Format Frmw_DL NS_Mngmt
Optional NVM Commands (0x001f):     Comp Wr_Unc DS_Mngmt Wr_Zero Sav/Sel_Feat
Log Page Attributes (0x03):         S/H_per_NS Cmd_Eff_Lg
Maximum Data Transfer Size:         512 Pages
Warning  Comp. Temp. Threshold:     87 Celsius
Critical Comp. Temp. Threshold:     88 Celsius
Namespace 1 Features (0x02):        NA_Fields

Supported Power States
St Op     Max   Active     Idle   RL RT WL WT  Ent_Lat  Ex_Lat
 0 +    10.60W       -        -    0  0  0  0        0       0

Supported LBA Sizes (NSID 0x1)
Id Fmt  Data  Metadt  Rel_Perf
 0 +     512       0         0
 1 -    4096       0         0

=== START OF SMART DATA SECTION ===
SMART overall-health self-assessment test result: PASSED

SMART/Health Information (NVMe Log 0x02)
Critical Warning:                   0x00
Temperature:                        33 Celsius
Available Spare:                    100%
Available Spare Threshold:          10%
Percentage Used:                    1%
Data Units Read:                    228,457,947 [116 TB]
Data Units Written:                 50,876,399 [26.0 TB]
Host Read Commands:                 936,926,460
Host Write Commands:                812,770,890
Controller Busy Time:               1,281
Power Cycles:                       170
Power On Hours:                     33,606
Unsafe Shutdowns:                   120
Media and Data Integrity Errors:    0
Error Information Log Entries:      151
Warning  Comp. Temperature Time:    0
Critical Comp. Temperature Time:    0
Temperature Sensor 1:               33 Celsius
Temperature Sensor 2:               36 Celsius
Temperature Sensor 3:               42 Celsius

Error Information (NVMe Log 0x01, 16 of 64 entries)
Num   ErrCount  SQId   CmdId  Status  PELoc          LBA  NSID    VS
  0        151     0  0x0010  0x4004      -            0     0     -



