smartctl 7.1 2019-12-30 r5022 [x86_64-linux-5.10.101-amd64-desktop] (local build)
Copyright (C) 2002-19, Bruce Allen, Christian Franke, www.smartmontools.org

=== START OF INFORMATION SECTION ===
Model Family:     Phison Driven OEM SSDs
Device Model:     SATA SSD
Serial Number:    --
Firmware Version: S8FM08.1
User Capacity:    240,057,409,536 bytes [240 GB]
Sector Size:      512 bytes logical/physical
Rotation Rate:    Solid State Device
Form Factor:      2.5 inches
Device is:        In smartctl database [for details use: -P show]
ATA Version is:   ATA8-ACS (minor revision not indicated)
SATA Version is:  SATA 3.1, 6.0 Gb/s (current: 6.0 Gb/s)
Local Time is:    Sun Apr  3 10:08:20 2022 AEST
SMART support is: Available - device has SMART capability.
SMART support is: Enabled
AAM feature is:   Unavailable
APM level is:     254 (maximum performance)
Rd look-ahead is: Enabled
Write cache is:   Enabled
DSN feature is:   Unavailable
ATA Security is:  Disabled, frozen [SEC2]
Wt Cache Reorder: Unavailable

=== START OF READ SMART DATA SECTION ===
SMART overall-health self-assessment test result: PASSED

General SMART Values:
Offline data collection status:  (0x00)	Offline data collection activity
					was never started.
					Auto Offline Data Collection: Disabled.
Self-test execution status:      (   0)	The previous self-test routine completed
					without error or no self-test has ever 
					been run.
Total time to complete Offline 
data collection: 		(  255) seconds.
Offline data collection
capabilities: 			 (0x1b) SMART execute Offline immediate.
					Auto Offline data collection on/off support.
					Suspend Offline collection upon new
					command.
					Offline surface scan supported.
					Self-test supported.
					No Conveyance Self-test supported.
					No Selective Self-test supported.
SMART capabilities:            (0x0003)	Saves SMART data before entering
					power-saving mode.
					Supports SMART auto save timer.
Error logging capability:        (0x01)	Error logging supported.
					General Purpose Logging supported.
Short self-test routine 
recommended polling time: 	 (   1) minutes.
Extended self-test routine
recommended polling time: 	 (   2) minutes.

SMART Attributes Data Structure revision number: 16
Vendor Specific SMART Attributes with Thresholds:
ID# ATTRIBUTE_NAME          FLAGS    VALUE WORST THRESH FAIL RAW_VALUE
  1 Raw_Read_Error_Rate     PO-R--   100   100   050    -    0
  9 Power_On_Hours          -O--C-   100   100   000    -    9700
 12 Power_Cycle_Count       -O--C-   100   100   000    -    6117
168 SATA_Phy_Error_Count    -O--C-   100   100   000    -    4
170 Bad_Blk_Ct_Erl/Lat      PO----   100   100   010    -    0/315
173 MaxAvgErase_Ct          -O--C-   100   100   000    -    194 (Average 184)
192 Unsafe_Shutdown_Count   -O--C-   100   100   000    -    87
218 CRC_Error_Count         PO-R--   100   100   050    -    0
231 SSD_Life_Left           PO--C-   100   100   000    -    93
241 Lifetime_Writes_GiB     -O--C-   100   100   000    -    10459
                            ||||||_ K auto-keep
                            |||||__ C event count
                            ||||___ R error rate
                            |||____ S speed/performance
                            ||_____ O updated online
                            |______ P prefailure warning

General Purpose Log Directory Version 1
SMART           Log Directory Version 1 [multi-sector log support]
Address    Access  R/W   Size  Description
0x00       GPL,SL  R/O      1  Log Directory
0x01           SL  R/O      1  Summary SMART error log
0x02           SL  R/O     51  Comprehensive SMART error log
0x03       GPL     R/O     64  Ext. Comprehensive SMART error log
0x04       GPL,SL  R/O      8  Device Statistics log
0x06           SL  R/O      1  SMART self-test log
0x07       GPL     R/O      1  Extended self-test log
0x10       GPL     R/O      1  NCQ Command Error log
0x11       GPL     R/O      1  SATA Phy Event Counters log
0x30       GPL,SL  R/O      9  IDENTIFY DEVICE data log
0x80-0x9f  GPL,SL  R/W     16  Host vendor specific log

SMART Extended Comprehensive Error Log Version: 1 (64 sectors)
No Errors Logged

SMART Extended Self-test Log Version: 1 (1 sectors)
Num  Test_Description    Status                  Remaining  LifeTime(hours)  LBA_of_first_error
# 1  Short offline       Completed without error       00%         0         -
# 2  Short offline       Completed without error       00%         0         -
# 3  Short offline       Completed without error       00%         0         -
# 4  Short offline       Completed without error       00%         0         -
# 5  Short offline       Aborted by host               00%         0         -
# 6  Short offline       Aborted by host               00%         0         -
# 7  Short offline       Aborted by host               00%         0         -
# 8  Short offline       Aborted by host               00%         0         -
# 9  Short offline       Aborted by host               00%         0         -
#10  Short offline       Aborted by host               00%         0         -
#11  Short offline       Aborted by host               00%         0         -
#12  Short offline       Aborted by host               00%         0         -
#13  Short offline       Aborted by host               00%         0         -
#14  Short offline       Aborted by host               00%         0         -
#15  Short offline       Aborted by host               00%         0         -
#16  Short offline       Aborted by host               00%         0         -
#17  Short offline       Aborted by host               00%         0         -
#18  Short offline       Aborted by host               00%         0         -
#19  Short offline       Aborted by host               00%         0         -

Selective Self-tests/Logging not supported

SCT Commands not supported

Device Statistics (GP Log 0x04)
Page  Offset Size        Value Flags Description
0x07  =====  =               =  ===  == Solid State Device Statistics (rev 1) ==
0x07  0x008  1               0  N--  Percentage Used Endurance Indicator
                                |||_ C monitored condition met
                                ||__ D supports DSN
                                |___ N normalized value

Pending Defects log (GP Log 0x0c) not supported

SATA Phy Event Counters (GP Log 0x11)
ID      Size     Value  Description
0x0001  2            0  Command failed due to ICRC error
0x0003  2            0  R_ERR response for device-to-host data FIS
0x0004  2            0  R_ERR response for host-to-device data FIS
0x0006  2            0  R_ERR response for device-to-host non-data FIS
0x0007  2            0  R_ERR response for host-to-device non-data FIS
0x0008  2            0  Device-to-host non-data FIS retries
0x0009  4          149  Transition from drive PhyRdy to drive PhyNRdy
0x000a  4            5  Device-to-host register FISes sent due to a COMRESET
0x000f  2            0  R_ERR response for host-to-device data FIS, CRC
0x0010  2            0  R_ERR response for host-to-device data FIS, non-CRC
0x0012  2            0  R_ERR response for host-to-device non-data FIS, CRC
0x0013  2            0  R_ERR response for host-to-device non-data FIS, non-CRC

