=== START OF INFORMATION SECTION ===
Model Family:     Hitachi Travelstar 5K80
Device Model:     HTS548040M9AT00
Serial Number:    --
Firmware Version: MG2OA50A
User Capacity:    40,007,761,920 bytes [40.0 GB]
Sector Size:      512 bytes logical/physical
Device is:        In smartctl database [for details use: -P show]
ATA Version is:   ATA/ATAPI-6 T13/1410D revision 3a
Local Time is:    Wed Mar 28 11:19:24 2018 +04
SMART support is: Available - device has SMART capability.
SMART support is: Enabled
AAM feature is:   Disabled
APM level is:     254 (maximum performance)
Rd look-ahead is: Enabled
Write cache is:   Enabled
ATA Security is:  Disabled, frozen [SEC2]
Wt Cache Reorder: Unavailable

=== START OF READ SMART DATA SECTION ===
SMART overall-health self-assessment test result: PASSED

General SMART Values:
Offline data collection status:  (0x82)	Offline data collection activity
					was completed without error.
					Auto Offline Data Collection: Enabled.
Self-test execution status:      (   0)	The previous self-test routine completed
					without error or no self-test has ever 
					been run.
Total time to complete Offline 
data collection: 		(  645) seconds.
Offline data collection
capabilities: 			 (0x5b) SMART execute Offline immediate.
					Auto Offline data collection on/off support.
					Suspend Offline collection upon new
					command.
					Offline surface scan supported.
					Self-test supported.
					No Conveyance Self-test supported.
					Selective Self-test supported.
SMART capabilities:            (0x0003)	Saves SMART data before entering
					power-saving mode.
					Supports SMART auto save timer.
Error logging capability:        (0x01)	Error logging supported.
					General Purpose Logging supported.
Short self-test routine 
recommended polling time: 	 (   2) minutes.
Extended self-test routine
recommended polling time: 	 (  30) minutes.

SMART Attributes Data Structure revision number: 16
Vendor Specific SMART Attributes with Thresholds:
ID# ATTRIBUTE_NAME          FLAGS    VALUE WORST THRESH FAIL RAW_VALUE
  1 Raw_Read_Error_Rate     PO-R--   100   100   062    -    0
  2 Throughput_Performance  P-S---   105   105   040    -    4563
  3 Spin_Up_Time            POS---   253   253   033    -    1
  4 Start_Stop_Count        -O--C-   097   097   000    -    5921
  5 Reallocated_Sector_Ct   PO--CK   100   100   005    -    0
  7 Seek_Error_Rate         PO-R--   100   100   067    -    0
  8 Seek_Time_Performance   P-S---   132   132   040    -    34
  9 Power_On_Hours          -O--C-   075   075   000    -    11290
 10 Spin_Retry_Count        PO--C-   100   100   060    -    0
 12 Power_Cycle_Count       -O--CK   098   098   000    -    4296
191 G-Sense_Error_Rate      -O-R--   100   100   000    -    0
192 Power-Off_Retract_Count -O--CK   100   100   000    -    125
193 Load_Cycle_Count        -O--C-   079   079   000    -    210391
194 Temperature_Celsius     -O----   211   211   000    -    26 (8 238 0 3 0)
196 Reallocated_Event_Count -O--CK   100   100   000    -    12
197 Current_Pending_Sector  -O---K   100   100   000    -    1
198 Offline_Uncorrectable   ---R--   100   100   000    -    0
199 UDMA_CRC_Error_Count    -O-R--   200   200   000    -    62
                            ||||||_ K auto-keep
                            |||||__ C event count
                            ||||___ R error rate
                            |||____ S speed/performance
                            ||_____ O updated online
                            |______ P prefailure warning

General Purpose Log Directory Version 1
SMART           Log Directory Version 1 [multi-sector log support]
Address    Access  R/W   Size  Description
0x00       GPL,SL  R/O      1  Log Directory
0x01           SL  R/O      1  Summary SMART error log
0x03       GPL     R/O      1  Ext. Comprehensive SMART error log
0x06           SL  R/O      1  SMART self-test log
0x07       GPL     R/O      1  Extended self-test log
0x80-0x9f  GPL,SL  R/W     16  Host vendor specific log

SMART Extended Comprehensive Error Log Version: 1 (1 sectors)
Device Error Count: 4
	CR     = Command Register
	FEATR  = Features Register
	COUNT  = Count (was: Sector Count) Register
	LBA_48 = Upper bytes of LBA High/Mid/Low Registers ]  ATA-8
	LH     = LBA High (was: Cylinder High) Register    ]   LBA
	LM     = LBA Mid (was: Cylinder Low) Register      ] Register
	LL     = LBA Low (was: Sector Number) Register     ]
	DV     = Device (was: Device/Head) Register
	DC     = Device Control Register
	ER     = Error register
	ST     = Status register
Powered_Up_Time is measured from power on, and printed as
DDd+hh:mm:SS.sss where DD=days, hh=hours, mm=minutes,
SS=sec, and sss=millisec. It "wraps" after 49.710 days.

Error 4 [3] occurred at disk power-on lifetime: 11276 hours (469 days + 20 hours)
  When the command that caused the error occurred, the device was active or idle.

  After command completion occurred, registers were:
  ER -- ST COUNT  LBA_48  LH LM LL DV DC
  -- -- -- == -- == == == -- -- -- -- --
  40 -- 51 00 07 04 5f ff 16 c9 41 e0 00  Error: UNC 7 sectors at LBA = 0x45fff16c941 = 4810348087617

  Commands leading to the command that caused the error were:
  CR FEATR COUNT  LBA_48  LH LM LL DV DC  Powered_Up_Time  Command/Feature_Name
  -- == -- == -- == == == -- -- -- -- --  ---------------  --------------------
  c8 00 00 00 08 04 5f ff 16 c9 40 e0 00     02:26:59.500  READ DMA
  35 00 00 08 00 00 00 00 04 58 00 e0 00     02:26:59.500  WRITE DMA EXT
  35 00 00 08 00 00 00 00 04 50 00 e0 00     02:26:59.500  WRITE DMA EXT
  35 00 00 08 00 00 00 00 04 48 00 e0 00     02:26:59.500  WRITE DMA EXT
  e7 00 00 00 00 00 00 01 04 2c af a0 00     02:26:59.200  FLUSH CACHE

Error 3 [2] occurred at disk power-on lifetime: 11276 hours (469 days + 20 hours)
  When the command that caused the error occurred, the device was active or idle.

  After command completion occurred, registers were:
  ER -- ST COUNT  LBA_48  LH LM LL DV DC
  -- -- -- == -- == == == -- -- -- -- --
  40 -- 51 00 07 15 c9 5f 16 c9 41 e0 00  Error: UNC 7 sectors at LBA = 0x15c95f16c941 = 23954627938625

  Commands leading to the command that caused the error were:
  CR FEATR COUNT  LBA_48  LH LM LL DV DC  Powered_Up_Time  Command/Feature_Name
  -- == -- == -- == == == -- -- -- -- --  ---------------  --------------------
  c8 00 00 00 08 15 c9 5f 16 c9 40 e0 00     02:26:55.300  READ DMA
  c8 00 00 00 98 15 ba 3f 15 c8 c8 e0 00     02:26:55.300  READ DMA
  c8 00 00 00 00 15 c8 c7 15 b9 40 e0 00     02:26:55.300  READ DMA
  c8 00 00 00 00 00 08 00 15 c7 c8 e0 00     02:26:55.300  READ DMA
  e7 00 00 00 00 00 00 01 04 2c 6f a0 00     02:26:53.100  FLUSH CACHE

Error 2 [1] occurred at disk power-on lifetime: 11276 hours (469 days + 20 hours)
  When the command that caused the error occurred, the device was active or idle.

  After command completion occurred, registers were:
  ER -- ST COUNT  LBA_48  LH LM LL DV DC
  -- -- -- == -- == == == -- -- -- -- --
  40 -- 51 00 07 16 c9 3f 16 c9 41 e0 00  Error: UNC 7 sectors at LBA = 0x16c93f16c941 = 25053602695489

  Commands leading to the command that caused the error were:
  CR FEATR COUNT  LBA_48  LH LM LL DV DC  Powered_Up_Time  Command/Feature_Name
  -- == -- == -- == == == -- -- -- -- --  ---------------  --------------------
  c8 00 00 00 08 16 c9 3f 16 c9 40 e0 00     02:25:25.000  READ DMA
  c8 00 00 00 08 16 c9 37 16 c9 38 e0 00     02:25:25.000  READ DMA
  c8 00 00 00 08 16 c9 2f 16 c9 30 e0 00     02:25:25.000  READ DMA
  c8 00 00 00 08 16 c9 27 16 c9 28 e0 00     02:25:25.000  READ DMA
  c8 00 00 00 08 16 c9 1f 16 c9 20 e0 00     02:25:25.000  READ DMA

Error 1 [0] occurred at disk power-on lifetime: 11276 hours (469 days + 20 hours)
  When the command that caused the error occurred, the device was active or idle.

  After command completion occurred, registers were:
  ER -- ST COUNT  LBA_48  LH LM LL DV DC
  -- -- -- == -- == == == -- -- -- -- --
  40 -- 51 00 bf 00 00 00 16 c9 41 e0 00  Error: UNC 191 sectors at LBA = 0x0016c941 = 1493313

  Commands leading to the command that caused the error were:
  CR FEATR COUNT  LBA_48  LH LM LL DV DC  Powered_Up_Time  Command/Feature_Name
  -- == -- == -- == == == -- -- -- -- --  ---------------  --------------------
  c8 00 00 00 00 16 c8 ff 16 c9 00 e0 00     02:25:20.800  READ DMA
  c8 00 00 00 00 14 94 ef 16 c8 00 e0 00     02:25:20.800  READ DMA
  c8 00 00 00 00 13 e5 5f 14 93 f0 e0 00     02:25:20.800  READ DMA
  c8 00 00 00 28 13 f6 bf 13 e5 38 e0 00     02:25:20.800  READ DMA
  c8 00 00 00 88 13 f9 7f 13 f6 38 e0 00     02:25:20.800  READ DMA

SMART Extended Self-test Log Version: 1 (1 sectors)
Num  Test_Description    Status                  Remaining  LifeTime(hours)  LBA_of_first_error
# 1  Extended offline    Aborted by host               90%     10701         -
# 2  Short offline       Completed without error       00%     10701         -
# 3  Extended offline    Completed without error       00%      4195         -
# 4  Short offline       Completed without error       00%      4194         -

Warning! SMART Selective Self-Test Log Structure error: invalid SMART checksum.
SMART Selective self-test log data structure revision number 1
 SPAN  MIN_LBA  MAX_LBA  CURRENT_TEST_STATUS
    1        0        0  Not_testing
    2        0        0  Not_testing
    3        0        0  Not_testing
    4        0        0  Not_testing
    5        0        0  Not_testing
Selective self-test flags (0x0):
  After scanning selected spans, do NOT read-scan remainder of disk.
If Selective self-test is pending on power-up, resume after 0 minute delay.

SCT Commands not supported

Device Statistics (GP/SMART Log 0x04) not supported

SATA Phy Event Counters (GP Log 0x11) not supported

