smartctl 7.2 2020-12-30 r5155 [x86_64-linux-5.11.0-38-generic] (local build)
Copyright (C) 2002-20, Bruce Allen, Christian Franke, www.smartmontools.org

=== START OF INFORMATION SECTION ===
Model Family:     Western Digital Green
Device Model:     WDC WD20EARX-008FB0
Serial Number:    --
LU WWN Device Id: 5 0014ee ...
Firmware Version: 51.0AB51
User Capacity:    2,000,398,934,016 bytes [2.00 TB]
Sector Sizes:     512 bytes logical, 4096 bytes physical
Device is:        In smartctl database [for details use: -P show]
ATA Version is:   ATA8-ACS (minor revision not indicated)
SATA Version is:  SATA 3.0, 6.0 Gb/s (current: 6.0 Gb/s)
Local Time is:    Fri Oct 22 16:46:01 2021 +08
SMART support is: Available - device has SMART capability.
SMART support is: Enabled
AAM feature is:   Unavailable
APM feature is:   Unavailable
Rd look-ahead is: Enabled
Write cache is:   Enabled
DSN feature is:   Unavailable
ATA Security is:  Disabled, frozen [SEC2]
Wt Cache Reorder: Enabled

=== START OF READ SMART DATA SECTION ===
SMART overall-health self-assessment test result: PASSED

General SMART Values:
Offline data collection status:  (0x82)	Offline data collection activity
					was completed without error.
					Auto Offline Data Collection: Enabled.
Self-test execution status:      (   0)	The previous self-test routine completed
					without error or no self-test has ever 
					been run.
Total time to complete Offline 
data collection: 		(30780) seconds.
Offline data collection
capabilities: 			 (0x7b) SMART execute Offline immediate.
					Auto Offline data collection on/off support.
					Suspend Offline collection upon new
					command.
					Offline surface scan supported.
					Self-test supported.
					Conveyance Self-test supported.
					Selective Self-test supported.
SMART capabilities:            (0x0003)	Saves SMART data before entering
					power-saving mode.
					Supports SMART auto save timer.
Error logging capability:        (0x01)	Error logging supported.
					General Purpose Logging supported.
Short self-test routine 
recommended polling time: 	 (   2) minutes.
Extended self-test routine
recommended polling time: 	 ( 331) minutes.
Conveyance self-test routine
recommended polling time: 	 (   5) minutes.
SCT capabilities: 	       (0x30b5)	SCT Status supported.
					SCT Feature Control supported.
					SCT Data Table supported.

SMART Attributes Data Structure revision number: 16
Vendor Specific SMART Attributes with Thresholds:
ID# ATTRIBUTE_NAME          FLAGS    VALUE WORST THRESH FAIL RAW_VALUE
  1 Raw_Read_Error_Rate     POSR-K   200   200   051    -    15
  3 Spin_Up_Time            POS--K   184   183   021    -    5775
  4 Start_Stop_Count        -O--CK   100   100   000    -    837
  5 Reallocated_Sector_Ct   PO--CK   200   200   140    -    0
  7 Seek_Error_Rate         -OSR-K   200   200   000    -    0
  9 Power_On_Hours          -O--CK   041   041   000    -    43217
 10 Spin_Retry_Count        -O--CK   100   100   000    -    0
 11 Calibration_Retry_Count -O--CK   100   100   000    -    0
 12 Power_Cycle_Count       -O--CK   100   100   000    -    796
192 Power-Off_Retract_Count -O--CK   200   200   000    -    223
193 Load_Cycle_Count        -O--CK   073   073   000    -    381846
194 Temperature_Celsius     -O---K   110   103   000    -    40
196 Reallocated_Event_Count -O--CK   200   200   000    -    0
197 Current_Pending_Sector  -O--CK   200   200   000    -    1
198 Offline_Uncorrectable   ----CK   200   200   000    -    1
199 UDMA_CRC_Error_Count    -O--CK   200   200   000    -    0
200 Multi_Zone_Error_Rate   ---R--   200   200   000    -    1
                            ||||||_ K auto-keep
                            |||||__ C event count
                            ||||___ R error rate
                            |||____ S speed/performance
                            ||_____ O updated online
                            |______ P prefailure warning

General Purpose Log Directory Version 1
SMART           Log Directory Version 1 [multi-sector log support]
Address    Access  R/W   Size  Description
0x00       GPL,SL  R/O      1  Log Directory
0x01           SL  R/O      1  Summary SMART error log
0x02           SL  R/O      5  Comprehensive SMART error log
0x03       GPL     R/O      6  Ext. Comprehensive SMART error log
0x06           SL  R/O      1  SMART self-test log
0x07       GPL     R/O      1  Extended self-test log
0x09           SL  R/W      1  Selective self-test log
0x10       GPL     R/O      1  NCQ Command Error log
0x11       GPL     R/O      1  SATA Phy Event Counters log
0x80-0x9f  GPL,SL  R/W     16  Host vendor specific log
0xa0-0xa7  GPL,SL  VS      16  Device vendor specific log
0xa8-0xb7  GPL,SL  VS       1  Device vendor specific log
0xbd       GPL,SL  VS       1  Device vendor specific log
0xc0       GPL,SL  VS       1  Device vendor specific log
0xc1       GPL     VS      93  Device vendor specific log
0xe0       GPL,SL  R/W      1  SCT Command/Status
0xe1       GPL,SL  R/W      1  SCT Data Transfer

SMART Extended Comprehensive Error Log Version: 1 (6 sectors)
Device Error Count: 15
	CR     = Command Register
	FEATR  = Features Register
	COUNT  = Count (was: Sector Count) Register
	LBA_48 = Upper bytes of LBA High/Mid/Low Registers ]  ATA-8
	LH     = LBA High (was: Cylinder High) Register    ]   LBA
	LM     = LBA Mid (was: Cylinder Low) Register      ] Register
	LL     = LBA Low (was: Sector Number) Register     ]
	DV     = Device (was: Device/Head) Register
	DC     = Device Control Register
	ER     = Error register
	ST     = Status register
Powered_Up_Time is measured from power on, and printed as
DDd+hh:mm:SS.sss where DD=days, hh=hours, mm=minutes,
SS=sec, and sss=millisec. It "wraps" after 49.710 days.

Error 15 [14] occurred at disk power-on lifetime: 28864 hours (1202 days + 16 hours)
  When the command that caused the error occurred, the device was active or idle.

  After command completion occurred, registers were:
  ER -- ST COUNT  LBA_48  LH LM LL DV DC
  -- -- -- == -- == == == -- -- -- -- --
  40 -- 51 00 00 00 00 cb d1 60 60 40 00  Error: WP at LBA = 0xcbd16060 = 3419496544

  Commands leading to the command that caused the error were:
  CR FEATR COUNT  LBA_48  LH LM LL DV DC  Powered_Up_Time  Command/Feature_Name
  -- == -- == -- == == == -- -- -- -- --  ---------------  --------------------
  61 05 40 00 b0 00 00 b3 60 52 40 40 08  1d+14:08:13.170  WRITE FPDMA QUEUED
  61 05 40 00 a8 00 00 b3 60 4d 00 40 08  1d+14:08:13.168  WRITE FPDMA QUEUED
  61 05 40 00 a0 00 00 b3 60 47 c0 40 08  1d+14:08:13.165  WRITE FPDMA QUEUED
  61 05 40 00 98 00 00 b3 60 42 80 40 08  1d+14:08:13.162  WRITE FPDMA QUEUED
  60 00 08 00 20 00 00 cb d1 60 60 40 08  1d+14:08:13.144  READ FPDMA QUEUED

Error 14 [13] occurred at disk power-on lifetime: 28864 hours (1202 days + 16 hours)
  When the command that caused the error occurred, the device was active or idle.

  After command completion occurred, registers were:
  ER -- ST COUNT  LBA_48  LH LM LL DV DC
  -- -- -- == -- == == == -- -- -- -- --
  40 -- 51 00 00 00 00 cb d1 60 60 40 00  Error: WP at LBA = 0xcbd16060 = 3419496544

  Commands leading to the command that caused the error were:
  CR FEATR COUNT  LBA_48  LH LM LL DV DC  Powered_Up_Time  Command/Feature_Name
  -- == -- == -- == == == -- -- -- -- --  ---------------  --------------------
  61 05 40 00 e8 00 00 b3 60 23 00 40 08  1d+14:08:10.261  WRITE FPDMA QUEUED
  60 00 08 00 f0 00 00 cb d1 60 60 40 08  1d+14:08:10.260  READ FPDMA QUEUED
  60 00 08 00 e0 00 00 cb d1 60 58 40 08  1d+14:08:10.249  READ FPDMA QUEUED
  61 05 40 00 b8 00 00 b3 60 0e 00 40 08  1d+14:08:10.249  WRITE FPDMA QUEUED
  61 05 40 00 b0 00 00 b3 60 08 c0 40 08  1d+14:08:10.249  WRITE FPDMA QUEUED

Error 13 [12] occurred at disk power-on lifetime: 28864 hours (1202 days + 16 hours)
  When the command that caused the error occurred, the device was active or idle.

  After command completion occurred, registers were:
  ER -- ST COUNT  LBA_48  LH LM LL DV DC
  -- -- -- == -- == == == -- -- -- -- --
  40 -- 51 00 00 00 00 cb d1 60 60 40 00  Error: WP at LBA = 0xcbd16060 = 3419496544

  Commands leading to the command that caused the error were:
  CR FEATR COUNT  LBA_48  LH LM LL DV DC  Powered_Up_Time  Command/Feature_Name
  -- == -- == -- == == == -- -- -- -- --  ---------------  --------------------
  61 05 40 00 b0 00 00 b3 54 c1 40 40 08  1d+14:08:02.988  WRITE FPDMA QUEUED
  60 0a 00 00 58 00 00 cb d1 5a 00 40 08  1d+14:08:02.942  READ FPDMA QUEUED
  60 08 00 00 50 00 00 cb d1 52 00 40 08  1d+14:08:02.942  READ FPDMA QUEUED
  61 05 40 00 a8 00 00 b3 54 bc 00 40 08  1d+14:08:02.942  WRITE FPDMA QUEUED
  61 05 40 00 a0 00 00 b3 54 b6 c0 40 08  1d+14:08:02.942  WRITE FPDMA QUEUED

Error 12 [11] occurred at disk power-on lifetime: 20043 hours (835 days + 3 hours)
  When the command that caused the error occurred, the device was active or idle.

  After command completion occurred, registers were:
  ER -- ST COUNT  LBA_48  LH LM LL DV DC
  -- -- -- == -- == == == -- -- -- -- --
  40 -- 51 00 08 00 00 cb d1 60 60 e0 00  Error: UNC 8 sectors at LBA = 0xcbd16060 = 3419496544

  Commands leading to the command that caused the error were:
  CR FEATR COUNT  LBA_48  LH LM LL DV DC  Powered_Up_Time  Command/Feature_Name
  -- == -- == -- == == == -- -- -- -- --  ---------------  --------------------
  25 00 00 00 08 00 00 cb d1 60 60 e0 00     00:04:22.174  READ DMA EXT
  27 00 00 00 00 00 00 00 00 00 00 e0 00     00:04:22.173  READ NATIVE MAX ADDRESS EXT [OBS-ACS-3]
  ec 00 00 00 00 00 00 00 00 00 00 a0 02     00:04:22.171  IDENTIFY DEVICE
  ef 00 03 00 45 00 00 00 00 00 00 a0 02     00:04:22.171  SET FEATURES [Set transfer mode]
  27 00 00 00 00 00 00 00 00 00 00 e0 00     00:04:22.170  READ NATIVE MAX ADDRESS EXT [OBS-ACS-3]

Error 11 [10] occurred at disk power-on lifetime: 20043 hours (835 days + 3 hours)
  When the command that caused the error occurred, the device was active or idle.

  After command completion occurred, registers were:
  ER -- ST COUNT  LBA_48  LH LM LL DV DC
  -- -- -- == -- == == == -- -- -- -- --
  40 -- 51 00 08 00 00 cb d1 60 60 e0 00  Error: UNC 8 sectors at LBA = 0xcbd16060 = 3419496544

  Commands leading to the command that caused the error were:
  CR FEATR COUNT  LBA_48  LH LM LL DV DC  Powered_Up_Time  Command/Feature_Name
  -- == -- == -- == == == -- -- -- -- --  ---------------  --------------------
  25 00 00 00 08 00 00 cb d1 60 60 e0 00     00:04:17.745  READ DMA EXT
  27 00 00 00 00 00 00 00 00 00 00 e0 00     00:04:17.745  READ NATIVE MAX ADDRESS EXT [OBS-ACS-3]
  ec 00 00 00 00 00 00 00 00 00 00 a0 02     00:04:17.742  IDENTIFY DEVICE
  ef 00 03 00 45 00 00 00 00 00 00 a0 02     00:04:17.742  SET FEATURES [Set transfer mode]
  27 00 00 00 00 00 00 00 00 00 00 e0 00     00:04:17.742  READ NATIVE MAX ADDRESS EXT [OBS-ACS-3]

Error 10 [9] occurred at disk power-on lifetime: 20043 hours (835 days + 3 hours)
  When the command that caused the error occurred, the device was active or idle.

  After command completion occurred, registers were:
  ER -- ST COUNT  LBA_48  LH LM LL DV DC
  -- -- -- == -- == == == -- -- -- -- --
  40 -- 51 00 08 00 00 cb d1 60 60 e0 00  Error: UNC 8 sectors at LBA = 0xcbd16060 = 3419496544

  Commands leading to the command that caused the error were:
  CR FEATR COUNT  LBA_48  LH LM LL DV DC  Powered_Up_Time  Command/Feature_Name
  -- == -- == -- == == == -- -- -- -- --  ---------------  --------------------
  25 00 00 00 08 00 00 cb d1 60 60 e0 00     00:04:15.001  READ DMA EXT
  27 00 00 00 00 00 00 00 00 00 00 e0 00     00:04:15.001  READ NATIVE MAX ADDRESS EXT [OBS-ACS-3]
  ec 00 00 00 00 00 00 00 00 00 00 a0 02     00:04:14.998  IDENTIFY DEVICE
  ef 00 03 00 45 00 00 00 00 00 00 a0 02     00:04:14.998  SET FEATURES [Set transfer mode]
  27 00 00 00 00 00 00 00 00 00 00 e0 00     00:04:14.998  READ NATIVE MAX ADDRESS EXT [OBS-ACS-3]

Error 9 [8] occurred at disk power-on lifetime: 20043 hours (835 days + 3 hours)
  When the command that caused the error occurred, the device was active or idle.

  After command completion occurred, registers were:
  ER -- ST COUNT  LBA_48  LH LM LL DV DC
  -- -- -- == -- == == == -- -- -- -- --
  40 -- 51 00 08 00 00 cb d1 60 60 e0 00  Error: UNC 8 sectors at LBA = 0xcbd16060 = 3419496544

  Commands leading to the command that caused the error were:
  CR FEATR COUNT  LBA_48  LH LM LL DV DC  Powered_Up_Time  Command/Feature_Name
  -- == -- == -- == == == -- -- -- -- --  ---------------  --------------------
  25 00 00 00 08 00 00 cb d1 60 60 e0 00     00:04:10.771  READ DMA EXT
  27 00 00 00 00 00 00 00 00 00 00 e0 00     00:04:10.771  READ NATIVE MAX ADDRESS EXT [OBS-ACS-3]
  ec 00 00 00 00 00 00 00 00 00 00 a0 02     00:04:10.768  IDENTIFY DEVICE
  ef 00 03 00 45 00 00 00 00 00 00 a0 02     00:04:10.768  SET FEATURES [Set transfer mode]
  27 00 00 00 00 00 00 00 00 00 00 e0 00     00:04:10.768  READ NATIVE MAX ADDRESS EXT [OBS-ACS-3]

Error 8 [7] occurred at disk power-on lifetime: 20043 hours (835 days + 3 hours)
  When the command that caused the error occurred, the device was active or idle.

  After command completion occurred, registers were:
  ER -- ST COUNT  LBA_48  LH LM LL DV DC
  -- -- -- == -- == == == -- -- -- -- --
  40 -- 51 00 08 00 00 cb d1 60 60 e0 00  Error: UNC 8 sectors at LBA = 0xcbd16060 = 3419496544

  Commands leading to the command that caused the error were:
  CR FEATR COUNT  LBA_48  LH LM LL DV DC  Powered_Up_Time  Command/Feature_Name
  -- == -- == -- == == == -- -- -- -- --  ---------------  --------------------
  25 00 00 00 08 00 00 cb d1 60 60 e0 00     00:04:06.264  READ DMA EXT
  27 00 00 00 00 00 00 00 00 00 00 e0 00     00:04:06.264  READ NATIVE MAX ADDRESS EXT [OBS-ACS-3]
  ec 00 00 00 00 00 00 00 00 00 00 a0 02     00:04:06.260  IDENTIFY DEVICE
  ef 00 03 00 45 00 00 00 00 00 00 a0 02     00:04:06.260  SET FEATURES [Set transfer mode]
  27 00 00 00 00 00 00 00 00 00 00 e0 00     00:04:06.260  READ NATIVE MAX ADDRESS EXT [OBS-ACS-3]

SMART Extended Self-test Log Version: 1 (1 sectors)
No self-tests have been logged.  [To run self-tests, use: smartctl -t]

SMART Selective self-test log data structure revision number 1
 SPAN  MIN_LBA  MAX_LBA  CURRENT_TEST_STATUS
    1        0        0  Not_testing
    2        0        0  Not_testing
    3        0        0  Not_testing
    4        0        0  Not_testing
    5        0        0  Not_testing
Selective self-test flags (0x0):
  After scanning selected spans, do NOT read-scan remainder of disk.
If Selective self-test is pending on power-up, resume after 0 minute delay.

SCT Status Version:                  3
SCT Version (vendor specific):       258 (0x0102)
Device State:                        Active (0)
Current Temperature:                    40 Celsius
Power Cycle Min/Max Temperature:     40/41 Celsius
Lifetime    Min/Max Temperature:     40/46 Celsius
Under/Over Temperature Limit Count:   0/0

SCT Temperature History Version:     2
Temperature Sampling Period:         1 minute
Temperature Logging Interval:        1 minute
Min/Max recommended Temperature:      0/60 Celsius
Min/Max Temperature Limit:           -41/85 Celsius
Temperature History Size (Index):    478 (319)

SCT Error Recovery Control command not supported

Device Statistics (GP/SMART Log 0x04) not supported

Pending Defects log (GP Log 0x0c) not supported

SATA Phy Event Counters (GP Log 0x11)
ID      Size     Value  Description
0x0001  2            0  Command failed due to ICRC error
0x0002  2            0  R_ERR response for data FIS
0x0003  2            0  R_ERR response for device-to-host data FIS
0x0004  2            0  R_ERR response for host-to-device data FIS
0x0005  2            0  R_ERR response for non-data FIS
0x0006  2            0  R_ERR response for device-to-host non-data FIS
0x0007  2            0  R_ERR response for host-to-device non-data FIS
0x0008  2            0  Device-to-host non-data FIS retries
0x0009  2            2  Transition from drive PhyRdy to drive PhyNRdy
0x000a  2            2  Device-to-host register FISes sent due to a COMRESET
0x000b  2            0  CRC errors within host-to-device FIS
0x000f  2            0  R_ERR response for host-to-device data FIS, CRC
0x0012  2            0  R_ERR response for host-to-device non-data FIS, CRC
0x8000  4         3326  Vendor specific



