smartctl 7.1 2019-12-30 r5022 [x86_64-linux-5.13.0-35-generic] (local build)
Copyright (C) 2002-19, Bruce Allen, Christian Franke, www.smartmontools.org

=== START OF INFORMATION SECTION ===
Model Number:                       SAMSUNG MZVL2256HCHQ-00B00
Serial Number:                      --
Firmware Version:                   GXA7301Q
PCI Vendor/Subsystem ID:            0x144d
IEEE OUI Identifier:                0x002538
Total NVM Capacity:                 256,060,514,304 [256 GB]
Unallocated NVM Capacity:           0
Controller ID:                      6
Number of Namespaces:               1
Namespace 1 Size/Capacity:          256,060,514,304 [256 GB]
Namespace 1 Utilization:            34,058,293,248 [34.0 GB]
Namespace 1 Formatted LBA Size:     512
Namespace 1 IEEE EUI-64:            002538 ...
Local Time is:                      Wed Mar 16 09:39:44 2022 CET
Firmware Updates (0x16):            3 Slots, no Reset required
Optional Admin Commands (0x0017):   Security Format Frmw_DL Self_Test
Optional NVM Commands (0x0057):     Comp Wr_Unc DS_Mngmt Sav/Sel_Feat Timestmp
Maximum Data Transfer Size:         128 Pages
Warning  Comp. Temp. Threshold:     81 Celsius
Critical Comp. Temp. Threshold:     85 Celsius

Supported Power States
St Op     Max   Active     Idle   RL RT WL WT  Ent_Lat  Ex_Lat
 0 +     8.37W       -        -    0  0  0  0        0       0
 1 +     8.37W       -        -    1  1  1  1        0     200
 2 +     8.37W       -        -    2  2  2  2        0     200
 3 -   0.0500W       -        -    3  3  3  3     2000    1200
 4 -   0.0050W       -        -    4  4  4  4      500    9500

Supported LBA Sizes (NSID 0x1)
Id Fmt  Data  Metadt  Rel_Perf
 0 +     512       0         0

=== START OF SMART DATA SECTION ===
SMART overall-health self-assessment test result: PASSED

SMART/Health Information (NVMe Log 0x02)
Critical Warning:                   0x00
Temperature:                        39 Celsius
Available Spare:                    100%
Available Spare Threshold:          10%
Percentage Used:                    0%
Data Units Read:                    32,971 [16.8 GB]
Data Units Written:                 111,391 [57.0 GB]
Host Read Commands:                 465,258
Host Write Commands:                1,082,875
Controller Busy Time:               6
Power Cycles:                       34
Power On Hours:                     2
Unsafe Shutdowns:                   16
Media and Data Integrity Errors:    0
Error Information Log Entries:      0
Warning  Comp. Temperature Time:    0
Critical Comp. Temperature Time:    0
Temperature Sensor 1:               39 Celsius
Temperature Sensor 2:               47 Celsius

Error Information (NVMe Log 0x01, max 64 entries)
No Errors Logged

