smartctl 7.1 2019-12-30 r5022 [x86_64-linux-5.4.0-40-generic] (local build)
Copyright (C) 2002-19, Bruce Allen, Christian Franke, www.smartmontools.org

=== START OF INFORMATION SECTION ===
Model Family:     SAMSUNG SpinPoint F3
Device Model:     SAMSUNG HD103SJ
Serial Number:    --
LU WWN Device Id: 5 0024e9 ...
Firmware Version: 1AJ10001
User Capacity:    1,000,204,886,016 bytes [1.00 TB]
Sector Size:      512 bytes logical/physical
Rotation Rate:    7200 rpm
Form Factor:      3.5 inches
Device is:        In smartctl database [for details use: -P show]
ATA Version is:   ATA8-ACS T13/1699-D revision 6
SATA Version is:  SATA 2.6, 3.0 Gb/s
Local Time is:    Fri Jul 24 23:44:42 2020 -03
SMART support is: Available - device has SMART capability.
SMART support is: Enabled
AAM feature is:   Disabled
APM level is:     254 (maximum performance)
Rd look-ahead is: Enabled
Write cache is:   Enabled
DSN feature is:   Unavailable
ATA Security is:  Disabled, frozen [SEC2]
Wt Cache Reorder: Enabled

=== START OF READ SMART DATA SECTION ===
SMART overall-health self-assessment test result: PASSED

General SMART Values:
Offline data collection status:  (0x00)	Offline data collection activity
					was never started.
					Auto Offline Data Collection: Disabled.
Self-test execution status:      ( 121)	The previous self-test completed having
					the read element of the test failed.
Total time to complete Offline 
data collection: 		( 9240) seconds.
Offline data collection
capabilities: 			 (0x5b) SMART execute Offline immediate.
					Auto Offline data collection on/off support.
					Suspend Offline collection upon new
					command.
					Offline surface scan supported.
					Self-test supported.
					No Conveyance Self-test supported.
					Selective Self-test supported.
SMART capabilities:            (0x0003)	Saves SMART data before entering
					power-saving mode.
					Supports SMART auto save timer.
Error logging capability:        (0x01)	Error logging supported.
					General Purpose Logging supported.
Short self-test routine 
recommended polling time: 	 (   2) minutes.
Extended self-test routine
recommended polling time: 	 ( 154) minutes.
SCT capabilities: 	       (0x003f)	SCT Status supported.
					SCT Error Recovery Control supported.
					SCT Feature Control supported.
					SCT Data Table supported.

SMART Attributes Data Structure revision number: 16
Vendor Specific SMART Attributes with Thresholds:
ID# ATTRIBUTE_NAME          FLAGS    VALUE WORST THRESH FAIL RAW_VALUE
  1 Raw_Read_Error_Rate     POSR-K   100   100   051    -    19541
  2 Throughput_Performance  -OS--K   056   056   000    -    8401
  3 Spin_Up_Time            PO---K   070   069   025    -    9145
  4 Start_Stop_Count        -O--CK   098   098   000    -    2202
  5 Reallocated_Sector_Ct   PO--CK   252   252   010    -    0
  7 Seek_Error_Rate         -OSR-K   252   252   051    -    0
  8 Seek_Time_Performance   --S--K   252   252   015    -    0
  9 Power_On_Hours          -O--CK   100   100   000    -    4665
 10 Spin_Retry_Count        -O--CK   252   252   051    -    0
 11 Calibration_Retry_Count -O--CK   252   252   000    -    0
 12 Power_Cycle_Count       -O--CK   098   098   000    -    2210
191 G-Sense_Error_Rate      -O---K   100   100   000    -    3
192 Power-Off_Retract_Count -O---K   252   252   000    -    0
194 Temperature_Celsius     -O----   057   052   000    -    43 (Min/Max 14/49)
195 Hardware_ECC_Recovered  -O-RCK   100   100   000    -    0
196 Reallocated_Event_Count -O--CK   252   252   000    -    0
197 Current_Pending_Sector  -O--CK   097   092   000    -    307
198 Offline_Uncorrectable   ----CK   252   252   000    -    0
199 UDMA_CRC_Error_Count    -OS-CK   016   001   000    -    44760
200 Multi_Zone_Error_Rate   -O-R-K   100   100   000    -    664
223 Load_Retry_Count        -O--CK   252   252   000    -    0
225 Load_Cycle_Count        -O--CK   100   100   000    -    2232
                            ||||||_ K auto-keep
                            |||||__ C event count
                            ||||___ R error rate
                            |||____ S speed/performance
                            ||_____ O updated online
                            |______ P prefailure warning

General Purpose Log Directory Version 1
SMART           Log Directory Version 1 [multi-sector log support]
Address    Access  R/W   Size  Description
0x00       GPL,SL  R/O      1  Log Directory
0x01           SL  R/O      1  Summary SMART error log
0x02           SL  R/O      2  Comprehensive SMART error log
0x03       GPL     R/O      2  Ext. Comprehensive SMART error log
0x06           SL  R/O      1  SMART self-test log
0x07       GPL     R/O      2  Extended self-test log
0x08       GPL     R/O      2  Power Conditions log
0x09           SL  R/W      1  Selective self-test log
0x10       GPL     R/O      1  NCQ Command Error log
0x11       GPL     R/O      1  SATA Phy Event Counters log
0x80-0x9f  GPL,SL  R/W     16  Host vendor specific log
0xe0       GPL,SL  R/W      1  SCT Command/Status
0xe1       GPL,SL  R/W      1  SCT Data Transfer

SMART Extended Comprehensive Error Log Version: 1 (2 sectors)
Device Error Count: 64796 (device log contains only the most recent 8 errors)
	CR     = Command Register
	FEATR  = Features Register
	COUNT  = Count (was: Sector Count) Register
	LBA_48 = Upper bytes of LBA High/Mid/Low Registers ]  ATA-8
	LH     = LBA High (was: Cylinder High) Register    ]   LBA
	LM     = LBA Mid (was: Cylinder Low) Register      ] Register
	LL     = LBA Low (was: Sector Number) Register     ]
	DV     = Device (was: Device/Head) Register
	DC     = Device Control Register
	ER     = Error register
	ST     = Status register
Powered_Up_Time is measured from power on, and printed as
DDd+hh:mm:SS.sss where DD=days, hh=hours, mm=minutes,
SS=sec, and sss=millisec. It "wraps" after 49.710 days.

Error 64796 [3] occurred at disk power-on lifetime: 4215 hours (175 days + 15 hours)
  When the command that caused the error occurred, the device was active or idle.

  After command completion occurred, registers were:
  ER -- ST COUNT  LBA_48  LH LM LL DV DC
  -- -- -- == -- == == == -- -- -- -- --
  40 -- 51 00 08 00 00 3a 25 ec 20 e0 00  Error: UNC 8 sectors at LBA = 0x3a25ec20 = 975563808

  Commands leading to the command that caused the error were:
  CR FEATR COUNT  LBA_48  LH LM LL DV DC  Powered_Up_Time  Command/Feature_Name
  -- == -- == -- == == == -- -- -- -- --  ---------------  --------------------
  25 00 00 00 08 00 00 3a 25 ec 20 e0 08     00:00:01.981  READ DMA EXT
  25 00 00 00 08 00 00 38 e3 7e 08 e0 08     00:00:01.981  READ DMA EXT
  25 00 00 00 20 00 00 24 a3 81 60 e0 08     00:00:01.981  READ DMA EXT
  25 00 00 00 20 00 00 24 a3 6d 80 e0 08     00:00:01.981  READ DMA EXT
  35 00 00 04 00 00 00 49 9f 65 00 e0 08     00:00:01.980  WRITE DMA EXT

Error 64795 [2] occurred at disk power-on lifetime: 4215 hours (175 days + 15 hours)
  When the command that caused the error occurred, the device was active or idle.

  After command completion occurred, registers were:
  ER -- ST COUNT  LBA_48  LH LM LL DV DC
  -- -- -- == -- == == == -- -- -- -- --
  40 -- 51 00 08 00 00 3a 25 ec 20 e0 00  Error: UNC 8 sectors at LBA = 0x3a25ec20 = 975563808

  Commands leading to the command that caused the error were:
  CR FEATR COUNT  LBA_48  LH LM LL DV DC  Powered_Up_Time  Command/Feature_Name
  -- == -- == -- == == == -- -- -- -- --  ---------------  --------------------
  25 00 00 00 08 00 00 3a 25 ec 20 e0 08     00:00:01.954  READ DMA EXT
  35 00 00 04 00 00 00 48 5f 65 00 e0 08     00:00:01.954  WRITE DMA EXT
  35 00 00 04 00 00 00 48 5f 61 00 e0 08     00:00:01.954  WRITE DMA EXT
  35 00 00 04 00 00 00 48 5f 5d 00 e0 08     00:00:01.954  WRITE DMA EXT
  35 00 00 04 00 00 00 48 5f 59 00 e0 08     00:00:01.954  WRITE DMA EXT

Error 64794 [1] occurred at disk power-on lifetime: 4215 hours (175 days + 15 hours)
  When the command that caused the error occurred, the device was active or idle.

  After command completion occurred, registers were:
  ER -- ST COUNT  LBA_48  LH LM LL DV DC
  -- -- -- == -- == == == -- -- -- -- --
  40 -- 51 00 08 00 00 3a 25 ec 20 e0 00  Error: UNC 8 sectors at LBA = 0x3a25ec20 = 975563808

  Commands leading to the command that caused the error were:
  CR FEATR COUNT  LBA_48  LH LM LL DV DC  Powered_Up_Time  Command/Feature_Name
  -- == -- == -- == == == -- -- -- -- --  ---------------  --------------------
  25 00 00 00 08 00 00 3a 25 ec 20 e0 08     00:00:01.952  READ DMA EXT
  35 00 00 04 00 00 00 48 5f 25 00 e0 08     00:00:01.952  WRITE DMA EXT
  35 00 00 04 00 00 00 48 5f 21 00 e0 08     00:00:01.952  WRITE DMA EXT
  35 00 00 04 00 00 00 48 5f 1d 00 e0 08     00:00:01.952  WRITE DMA EXT
  35 00 00 04 00 00 00 48 5f 19 00 e0 08     00:00:01.952  WRITE DMA EXT

Error 64793 [0] occurred at disk power-on lifetime: 4215 hours (175 days + 15 hours)
  When the command that caused the error occurred, the device was active or idle.

  After command completion occurred, registers were:
  ER -- ST COUNT  LBA_48  LH LM LL DV DC
  -- -- -- == -- == == == -- -- -- -- --
  40 -- 51 00 08 00 00 3a 25 ec 20 e0 00  Error: UNC 8 sectors at LBA = 0x3a25ec20 = 975563808

  Commands leading to the command that caused the error were:
  CR FEATR COUNT  LBA_48  LH LM LL DV DC  Powered_Up_Time  Command/Feature_Name
  -- == -- == -- == == == -- -- -- -- --  ---------------  --------------------
  25 00 00 00 08 00 00 3a 25 ec 20 e0 08     00:00:01.950  READ DMA EXT
  35 00 00 04 00 00 00 48 1f f5 00 e0 08     00:00:01.949  WRITE DMA EXT
  35 00 00 04 00 00 00 48 1f f1 00 e0 08     00:00:01.949  WRITE DMA EXT
  35 00 00 04 00 00 00 48 1f ed 00 e0 08     00:00:01.949  WRITE DMA EXT
  35 00 00 04 00 00 00 48 1f e9 00 e0 08     00:00:01.949  WRITE DMA EXT

Error 64792 [7] occurred at disk power-on lifetime: 4215 hours (175 days + 15 hours)
  When the command that caused the error occurred, the device was active or idle.

  After command completion occurred, registers were:
  ER -- ST COUNT  LBA_48  LH LM LL DV DC
  -- -- -- == -- == == == -- -- -- -- --
  40 -- 51 00 08 00 00 3a 25 ec 20 e0 00  Error: UNC 8 sectors at LBA = 0x3a25ec20 = 975563808

  Commands leading to the command that caused the error were:
  CR FEATR COUNT  LBA_48  LH LM LL DV DC  Powered_Up_Time  Command/Feature_Name
  -- == -- == -- == == == -- -- -- -- --  ---------------  --------------------
  25 00 00 00 08 00 00 3a 25 ec 20 e0 08     00:00:01.948  READ DMA EXT
  35 00 00 04 00 00 00 48 1f c5 00 e0 08     00:00:01.947  WRITE DMA EXT
  35 00 00 04 00 00 00 48 1f c1 00 e0 08     00:00:01.947  WRITE DMA EXT
  35 00 00 04 00 00 00 48 1f bd 00 e0 08     00:00:01.947  WRITE DMA EXT
  35 00 00 04 00 00 00 48 1f b9 00 e0 08     00:00:01.947  WRITE DMA EXT

Error 64791 [6] occurred at disk power-on lifetime: 4215 hours (175 days + 15 hours)
  When the command that caused the error occurred, the device was active or idle.

  After command completion occurred, registers were:
  ER -- ST COUNT  LBA_48  LH LM LL DV DC
  -- -- -- == -- == == == -- -- -- -- --
  40 -- 51 00 08 00 00 3a 25 ec 20 e0 00  Error: UNC 8 sectors at LBA = 0x3a25ec20 = 975563808

  Commands leading to the command that caused the error were:
  CR FEATR COUNT  LBA_48  LH LM LL DV DC  Powered_Up_Time  Command/Feature_Name
  -- == -- == -- == == == -- -- -- -- --  ---------------  --------------------
  25 00 00 00 08 00 00 3a 25 ec 20 e0 08     00:00:01.945  READ DMA EXT
  35 00 00 04 00 00 00 48 1f 95 00 e0 08     00:00:01.945  WRITE DMA EXT
  35 00 00 04 00 00 00 48 1f 91 00 e0 08     00:00:01.945  WRITE DMA EXT
  35 00 00 04 00 00 00 48 1f 8d 00 e0 08     00:00:01.945  WRITE DMA EXT
  35 00 00 04 00 00 00 48 1f 89 00 e0 08     00:00:01.945  WRITE DMA EXT

Error 64790 [5] occurred at disk power-on lifetime: 4215 hours (175 days + 15 hours)
  When the command that caused the error occurred, the device was active or idle.

  After command completion occurred, registers were:
  ER -- ST COUNT  LBA_48  LH LM LL DV DC
  -- -- -- == -- == == == -- -- -- -- --
  40 -- 51 00 08 00 00 3a 25 ec 20 e0 00  Error: UNC 8 sectors at LBA = 0x3a25ec20 = 975563808

  Commands leading to the command that caused the error were:
  CR FEATR COUNT  LBA_48  LH LM LL DV DC  Powered_Up_Time  Command/Feature_Name
  -- == -- == -- == == == -- -- -- -- --  ---------------  --------------------
  25 00 00 00 08 00 00 3a 25 ec 20 e0 08     00:00:01.941  READ DMA EXT
  35 00 00 04 00 00 00 47 df f1 00 e0 08     00:00:01.941  WRITE DMA EXT
  35 00 00 04 00 00 00 47 df ed 00 e0 08     00:00:01.941  WRITE DMA EXT
  25 00 00 00 08 00 00 3a 25 ec 18 e0 08     00:00:01.941  READ DMA EXT
  35 00 00 04 00 00 00 47 df e9 00 e0 08     00:00:01.941  WRITE DMA EXT

Error 64789 [4] occurred at disk power-on lifetime: 4215 hours (175 days + 15 hours)
  When the command that caused the error occurred, the device was active or idle.

  After command completion occurred, registers were:
  ER -- ST COUNT  LBA_48  LH LM LL DV DC
  -- -- -- == -- == == == -- -- -- -- --
  40 -- 51 00 08 00 00 3a 25 ec 10 e0 00  Error: UNC 8 sectors at LBA = 0x3a25ec10 = 975563792

  Commands leading to the command that caused the error were:
  CR FEATR COUNT  LBA_48  LH LM LL DV DC  Powered_Up_Time  Command/Feature_Name
  -- == -- == -- == == == -- -- -- -- --  ---------------  --------------------
  25 00 00 00 08 00 00 3a 25 ec 10 e0 08     00:00:01.933  READ DMA EXT
  35 00 00 04 00 00 00 47 9f a5 00 e0 08     00:00:01.933  WRITE DMA EXT
  35 00 00 04 00 00 00 47 9f a1 00 e0 08     00:00:01.933  WRITE DMA EXT
  25 00 00 00 10 00 00 24 a3 7e 90 e0 08     00:00:01.933  READ DMA EXT
  35 00 00 04 00 00 00 47 9f 9d 00 e0 08     00:00:01.933  WRITE DMA EXT

SMART Extended Self-test Log Version: 1 (2 sectors)
Num  Test_Description    Status                  Remaining  LifeTime(hours)  LBA_of_first_error
# 1  Short offline       Completed: read failure       90%      4191         113665595
# 2  Extended offline    Completed without error       00%         6         -
# 3  Short offline       Completed without error       00%         3         -

SMART Selective self-test log data structure revision number 0
Note: revision number not 1 implies that no selective self-test has ever been run
 SPAN  MIN_LBA  MAX_LBA  CURRENT_TEST_STATUS
    1        0        0  Completed_read_failure [90% left] (0-65535)
    2        0        0  Not_testing
    3        0        0  Not_testing
    4        0        0  Not_testing
    5        0        0  Not_testing
Selective self-test flags (0x0):
  After scanning selected spans, do NOT read-scan remainder of disk.
If Selective self-test is pending on power-up, resume after 0 minute delay.

SCT Status Version:                  2
SCT Version (vendor specific):       256 (0x0100)
Device State:                        Active (0)
Current Temperature:                    42 Celsius
Power Cycle Min/Max Temperature:     26/42 Celsius
Lifetime    Min/Max Temperature:     18/63 Celsius
Specified Max Operating Temperature:    80 Celsius
Under/Over Temperature Limit Count:   0/0

SCT Temperature History Version:     2
Temperature Sampling Period:         5 minutes
Temperature Logging Interval:        5 minutes
Min/Max recommended Temperature:     -5/80 Celsius
Min/Max Temperature Limit:           -10/85 Celsius
Temperature History Size (Index):    128 (111)

SCT Error Recovery Control:
           Read: Disabled
          Write: Disabled

Device Statistics (GP/SMART Log 0x04) not supported

Pending Defects log (GP Log 0x0c) not supported

SATA Phy Event Counters (GP Log 0x11)
ID      Size     Value  Description
0x0001  4            0  Command failed due to ICRC error
0x0002  4            0  R_ERR response for data FIS
0x0003  4            0  R_ERR response for device-to-host data FIS
0x0004  4            0  R_ERR response for host-to-device data FIS
0x0005  4            0  R_ERR response for non-data FIS
0x0006  4            0  R_ERR response for device-to-host non-data FIS
0x0007  4            0  R_ERR response for host-to-device non-data FIS
0x0008  4            0  Device-to-host non-data FIS retries
0x0009  4            0  Transition from drive PhyRdy to drive PhyNRdy
0x000a  4            0  Device-to-host register FISes sent due to a COMRESET
0x000b  4            0  CRC errors within host-to-device FIS
0x000d  4            0  Non-CRC errors within host-to-device FIS
0x000f  4            0  R_ERR response for host-to-device data FIS, CRC
0x0010  4            0  R_ERR response for host-to-device data FIS, non-CRC
0x0012  4            0  R_ERR response for host-to-device non-data FIS, CRC
0x0013  4            0  R_ERR response for host-to-device non-data FIS, non-CRC
0x8e00  4            0  Vendor specific
0x8e01  4            0  Vendor specific
0x8e02  4            0  Vendor specific
0x8e03  4            0  Vendor specific
0x8e04  4            0  Vendor specific
0x8e05  4            0  Vendor specific
0x8e06  4            0  Vendor specific
0x8e07  4            0  Vendor specific
0x8e08  4            0  Vendor specific
0x8e09  4            0  Vendor specific
0x8e0a  4            0  Vendor specific
0x8e0b  4            0  Vendor specific
0x8e0c  4            0  Vendor specific
0x8e0d  4            0  Vendor specific
0x8e0e  4            0  Vendor specific
0x8e0f  4            0  Vendor specific
0x8e10  4            0  Vendor specific
0x8e11  4            0  Vendor specific

