smartctl 7.2 2020-12-30 r5155 [x86_64-linux-5.16.7-desktop-1omv4003] (OpenMandriva Lx 7.2-2)
Copyright (C) 2002-20, Bruce Allen, Christian Franke, www.smartmontools.org

=== START OF INFORMATION SECTION ===
Model Number:                       Seagate FireCuda 530 ZP500GM30023
Serial Number:                      --
Firmware Version:                   SU6SM001
PCI Vendor/Subsystem ID:            0x1bb1
IEEE OUI Identifier:                0x6479a7
Total NVM Capacity:                 500,107,862,016 [500 GB]
Unallocated NVM Capacity:           0
Controller ID:                      1
NVMe Version:                       1.4
Number of Namespaces:               1
Namespace 1 Size/Capacity:          500,107,862,016 [500 GB]
Namespace 1 Formatted LBA Size:     512
Namespace 1 IEEE EUI-64:            6479a7 ...
Local Time is:                      Sun May 15 10:40:40 2022 CDT
Firmware Updates (0x18):            4 Slots, no Reset required
Optional Admin Commands (0x0017):   Security Format Frmw_DL Self_Test
Optional NVM Commands (0x005d):     Comp DS_Mngmt Wr_Zero Sav/Sel_Feat Timestmp
Log Page Attributes (0x08):         Telmtry_Lg
Maximum Data Transfer Size:         512 Pages
Warning  Comp. Temp. Threshold:     90 Celsius
Critical Comp. Temp. Threshold:     95 Celsius

Supported Power States
St Op     Max   Active     Idle   RL RT WL WT  Ent_Lat  Ex_Lat
 0 +     6.00W       -        -    0  0  0  0        0       0
 1 +     2.80W       -        -    1  1  1  1        0       0
 2 +     2.70W       -        -    2  2  2  2        0       0
 3 -   0.0150W       -        -    3  3  3  3     2500    7500
 4 -   0.0050W       -        -    4  4  4  4    10500   65000

Supported LBA Sizes (NSID 0x1)
Id Fmt  Data  Metadt  Rel_Perf
 0 +     512       0         2
 1 -    4096       0         1

=== START OF SMART DATA SECTION ===
SMART overall-health self-assessment test result: PASSED

SMART/Health Information (NVMe Log 0x02)
Critical Warning:                   0x00
Temperature:                        29 Celsius
Available Spare:                    100%
Available Spare Threshold:          5%
Percentage Used:                    0%
Data Units Read:                    194,057 [99.3 GB]
Data Units Written:                 608,498 [311 GB]
Host Read Commands:                 2,555,888
Host Write Commands:                4,424,164
Controller Busy Time:               16
Power Cycles:                       74
Power On Hours:                     95
Unsafe Shutdowns:                   31
Media and Data Integrity Errors:    0
Error Information Log Entries:      183
Warning  Comp. Temperature Time:    0
Critical Comp. Temperature Time:    0

Error Information (NVMe Log 0x01, 16 of 63 entries)
Num   ErrCount  SQId   CmdId  Status  PELoc          LBA  NSID    VS
  0        183     0  0x1008  0x4004  0x028            0     0     -



