smartctl 7.4 2023-08-01 r5530 [x86_64-linux-6.1.0-25-amd64] (local build)
Copyright (C) 2002-23, Bruce Allen, Christian Franke, www.smartmontools.org

=== START OF INFORMATION SECTION ===
Model Family:     Western Digital Red
Device Model:     WDC WD20EFRX-68EUZN0
Serial Number:    --
LU WWN Device Id: 5 0014ee ...
Firmware Version: 82.00A82
User Capacity:    2,000,398,934,016 bytes [2.00 TB]
Sector Sizes:     512 bytes logical, 4096 bytes physical
Rotation Rate:    5400 rpm
Device is:        In smartctl database 7.3/5528
ATA Version is:   ACS-2 (minor revision not indicated)
SATA Version is:  SATA 3.0, 6.0 Gb/s (current: 6.0 Gb/s)
Local Time is:    Mon Sep  9 15:48:01 2024 CEST
SMART support is: Available - device has SMART capability.
SMART support is: Enabled
AAM feature is:   Unavailable
APM feature is:   Unavailable
Rd look-ahead is: Enabled
Write cache is:   Enabled
DSN feature is:   Unavailable
ATA Security is:  Disabled, frozen [SEC2]
Wt Cache Reorder: Enabled

=== START OF READ SMART DATA SECTION ===
SMART overall-health self-assessment test result: PASSED

General SMART Values:
Offline data collection status:  (0x00)	Offline data collection activity
					was never started.
					Auto Offline Data Collection: Disabled.
Self-test execution status:      (   0)	The previous self-test routine completed
					without error or no self-test has ever 
					been run.
Total time to complete Offline 
data collection: 		(26940) seconds.
Offline data collection
capabilities: 			 (0x7b) SMART execute Offline immediate.
					Auto Offline data collection on/off support.
					Suspend Offline collection upon new
					command.
					Offline surface scan supported.
					Self-test supported.
					Conveyance Self-test supported.
					Selective Self-test supported.
SMART capabilities:            (0x0003)	Saves SMART data before entering
					power-saving mode.
					Supports SMART auto save timer.
Error logging capability:        (0x01)	Error logging supported.
					General Purpose Logging supported.
Short self-test routine 
recommended polling time: 	 (   2) minutes.
Extended self-test routine
recommended polling time: 	 ( 272) minutes.
Conveyance self-test routine
recommended polling time: 	 (   5) minutes.
SCT capabilities: 	       (0x703d)	SCT Status supported.
					SCT Error Recovery Control supported.
					SCT Feature Control supported.
					SCT Data Table supported.

SMART Attributes Data Structure revision number: 16
Vendor Specific SMART Attributes with Thresholds:
ID# ATTRIBUTE_NAME          FLAGS    VALUE WORST THRESH FAIL RAW_VALUE
  1 Raw_Read_Error_Rate     POSR-K   200   200   051    -    0
  3 Spin_Up_Time            POS--K   180   173   021    -    4000
  4 Start_Stop_Count        -O--CK   100   100   000    -    750
  5 Reallocated_Sector_Ct   PO--CK   200   200   140    -    0
  7 Seek_Error_Rate         -OSR-K   200   200   000    -    0
  9 Power_On_Hours          -O--CK   031   031   000    -    50964
 10 Spin_Retry_Count        -O--CK   100   100   000    -    0
 11 Calibration_Retry_Count -O--CK   100   100   000    -    0
 12 Power_Cycle_Count       -O--CK   100   100   000    -    750
192 Power-Off_Retract_Count -O--CK   200   200   000    -    720
193 Load_Cycle_Count        -O--CK   172   172   000    -    85782
194 Temperature_Celsius     -O---K   107   100   000    -    40
196 Reallocated_Event_Count -O--CK   200   200   000    -    0
197 Current_Pending_Sector  -O--CK   200   200   000    -    0
198 Offline_Uncorrectable   ----CK   100   253   000    -    0
199 UDMA_CRC_Error_Count    -O--CK   200   200   000    -    0
200 Multi_Zone_Error_Rate   ---R--   100   253   000    -    0
                            ||||||_ K auto-keep
                            |||||__ C event count
                            ||||___ R error rate
                            |||____ S speed/performance
                            ||_____ O updated online
                            |______ P prefailure warning

General Purpose Log Directory Version 1
SMART           Log Directory Version 1 [multi-sector log support]
Address    Access  R/W   Size  Description
0x00       GPL,SL  R/O      1  Log Directory
0x01           SL  R/O      1  Summary SMART error log
0x02           SL  R/O      5  Comprehensive SMART error log
0x03       GPL     R/O      6  Ext. Comprehensive SMART error log
0x06           SL  R/O      1  SMART self-test log
0x07       GPL     R/O      1  Extended self-test log
0x09           SL  R/W      1  Selective self-test log
0x10       GPL     R/O      1  NCQ Command Error log
0x11       GPL     R/O      1  SATA Phy Event Counters log
0x21       GPL     R/O      1  Write stream error log
0x22       GPL     R/O      1  Read stream error log
0x80-0x9f  GPL,SL  R/W     16  Host vendor specific log
0xa0-0xa7  GPL,SL  VS      16  Device vendor specific log
0xa8-0xb7  GPL,SL  VS       1  Device vendor specific log
0xbd       GPL,SL  VS       1  Device vendor specific log
0xc0       GPL,SL  VS       1  Device vendor specific log
0xc1       GPL     VS      93  Device vendor specific log
0xe0       GPL,SL  R/W      1  SCT Command/Status
0xe1       GPL,SL  R/W      1  SCT Data Transfer

SMART Extended Comprehensive Error Log Version: 1 (6 sectors)
Device Error Count: 9
	CR     = Command Register
	FEATR  = Features Register
	COUNT  = Count (was: Sector Count) Register
	LBA_48 = Upper bytes of LBA High/Mid/Low Registers ]  ATA-8
	LH     = LBA High (was: Cylinder High) Register    ]   LBA
	LM     = LBA Mid (was: Cylinder Low) Register      ] Register
	LL     = LBA Low (was: Sector Number) Register     ]
	DV     = Device (was: Device/Head) Register
	DC     = Device Control Register
	ER     = Error register
	ST     = Status register
Powered_Up_Time is measured from power on, and printed as
DDd+hh:mm:SS.sss where DD=days, hh=hours, mm=minutes,
SS=sec, and sss=millisec. It "wraps" after 49.710 days.

Error 9 [8] occurred at disk power-on lifetime: 17573 hours (732 days + 5 hours)
  When the command that caused the error occurred, the device was active or idle.

  After command completion occurred, registers were:
  ER -- ST COUNT  LBA_48  LH LM LL DV DC
  -- -- -- == -- == == == -- -- -- -- --
  40 -- 51 00 00 00 00 00 00 08 58 40 00  Error: UNC at LBA = 0x00000858 = 2136

  Commands leading to the command that caused the error were:
  CR FEATR COUNT  LBA_48  LH LM LL DV DC  Powered_Up_Time  Command/Feature_Name
  -- == -- == -- == == == -- -- -- -- --  ---------------  --------------------
  60 00 08 00 f8 00 00 00 00 09 00 40 08     00:00:29.709  READ FPDMA QUEUED
  60 00 08 00 f0 00 00 00 00 08 f8 40 08     00:00:29.709  READ FPDMA QUEUED
  60 00 08 00 e8 00 00 00 00 08 f0 40 08     00:00:29.709  READ FPDMA QUEUED
  60 00 08 00 e0 00 00 00 00 08 e8 40 08     00:00:29.709  READ FPDMA QUEUED
  60 00 08 00 d8 00 00 00 00 08 e0 40 08     00:00:29.709  READ FPDMA QUEUED

Error 8 [7] occurred at disk power-on lifetime: 17572 hours (732 days + 4 hours)
  When the command that caused the error occurred, the device was active or idle.

  After command completion occurred, registers were:
  ER -- ST COUNT  LBA_48  LH LM LL DV DC
  -- -- -- == -- == == == -- -- -- -- --
  10 -- 51 00 00 00 00 b3 ec 08 10 40 00  Error: IDNF at LBA = 0xb3ec0810 = 3018590224

  Commands leading to the command that caused the error were:
  CR FEATR COUNT  LBA_48  LH LM LL DV DC  Powered_Up_Time  Command/Feature_Name
  -- == -- == -- == == == -- -- -- -- --  ---------------  --------------------
  61 00 08 00 c0 00 00 bf 9c 08 10 40 08     00:00:31.798  WRITE FPDMA QUEUED
  61 00 08 00 b8 00 00 be 6c 08 10 40 08     00:00:31.792  WRITE FPDMA QUEUED
  61 00 08 00 b0 00 00 be 40 08 10 40 08     00:00:31.790  WRITE FPDMA QUEUED
  61 00 08 00 a8 00 00 bc 4c 08 10 40 08     00:00:31.781  WRITE FPDMA QUEUED
  61 00 08 00 a0 00 00 bb 90 08 10 40 08     00:00:31.774  WRITE FPDMA QUEUED

Error 7 [6] occurred at disk power-on lifetime: 17572 hours (732 days + 4 hours)
  When the command that caused the error occurred, the device was active or idle.

  After command completion occurred, registers were:
  ER -- ST COUNT  LBA_48  LH LM LL DV DC
  -- -- -- == -- == == == -- -- -- -- --
  10 -- 51 00 00 00 00 9e 18 08 10 40 00  Error: IDNF at LBA = 0x9e180810 = 2652375056

  Commands leading to the command that caused the error were:
  CR FEATR COUNT  LBA_48  LH LM LL DV DC  Powered_Up_Time  Command/Feature_Name
  -- == -- == -- == == == -- -- -- -- --  ---------------  --------------------
  61 00 08 00 c0 00 00 a2 ec 08 10 40 08     00:00:29.166  WRITE FPDMA QUEUED
  61 00 08 00 b8 00 00 a2 e4 08 10 40 08     00:00:29.150  WRITE FPDMA QUEUED
  61 00 08 00 b0 00 00 a2 c8 08 10 40 08     00:00:29.145  WRITE FPDMA QUEUED
  61 00 08 00 a8 00 00 a2 c4 08 10 40 08     00:00:29.138  WRITE FPDMA QUEUED
  61 00 08 00 a0 00 00 a2 c0 08 10 40 08     00:00:29.132  WRITE FPDMA QUEUED

Error 6 [5] occurred at disk power-on lifetime: 17572 hours (732 days + 4 hours)
  When the command that caused the error occurred, the device was active or idle.

  After command completion occurred, registers were:
  ER -- ST COUNT  LBA_48  LH LM LL DV DC
  -- -- -- == -- == == == -- -- -- -- --
  10 -- 51 00 00 00 00 7f 90 08 10 40 00  Error: IDNF at LBA = 0x7f900810 = 2140145680

  Commands leading to the command that caused the error were:
  CR FEATR COUNT  LBA_48  LH LM LL DV DC  Powered_Up_Time  Command/Feature_Name
  -- == -- == -- == == == -- -- -- -- --  ---------------  --------------------
  61 00 08 00 d8 00 00 7f 90 08 10 40 08     00:00:31.174  WRITE FPDMA QUEUED
  61 00 08 00 d0 00 00 7f 48 08 10 40 08     00:00:31.168  WRITE FPDMA QUEUED
  61 00 08 00 c8 00 00 7e f8 08 10 40 08     00:00:31.149  WRITE FPDMA QUEUED
  61 00 08 00 c0 00 00 7d ec 08 10 40 08     00:00:31.144  WRITE FPDMA QUEUED
  61 00 08 00 b8 00 00 7c e4 08 10 40 08     00:00:31.137  WRITE FPDMA QUEUED

Error 5 [4] occurred at disk power-on lifetime: 17572 hours (732 days + 4 hours)
  When the command that caused the error occurred, the device was active or idle.

  After command completion occurred, registers were:
  ER -- ST COUNT  LBA_48  LH LM LL DV DC
  -- -- -- == -- == == == -- -- -- -- --
  10 -- 51 00 00 00 00 a5 20 08 10 40 00  Error: IDNF at LBA = 0xa5200810 = 2770339856

  Commands leading to the command that caused the error were:
  CR FEATR COUNT  LBA_48  LH LM LL DV DC  Powered_Up_Time  Command/Feature_Name
  -- == -- == -- == == == -- -- -- -- --  ---------------  --------------------
  61 00 08 00 58 00 00 b2 70 08 10 40 08     00:00:30.411  WRITE FPDMA QUEUED
  61 00 08 00 50 00 00 b2 2c 08 10 40 08     00:00:30.395  WRITE FPDMA QUEUED
  61 00 08 00 48 00 00 b1 bc 08 10 40 08     00:00:30.388  WRITE FPDMA QUEUED
  61 00 08 00 40 00 00 b0 b0 08 10 40 08     00:00:30.372  WRITE FPDMA QUEUED
  61 00 08 00 38 00 00 b0 4c 08 10 40 08     00:00:30.366  WRITE FPDMA QUEUED

Error 4 [3] occurred at disk power-on lifetime: 17572 hours (732 days + 4 hours)
  When the command that caused the error occurred, the device was active or idle.

  After command completion occurred, registers were:
  ER -- ST COUNT  LBA_48  LH LM LL DV DC
  -- -- -- == -- == == == -- -- -- -- --
  10 -- 51 00 00 00 00 77 90 08 10 40 00  Error: IDNF at LBA = 0x77900810 = 2005927952

  Commands leading to the command that caused the error were:
  CR FEATR COUNT  LBA_48  LH LM LL DV DC  Powered_Up_Time  Command/Feature_Name
  -- == -- == -- == == == -- -- -- -- --  ---------------  --------------------
  61 00 08 00 90 00 00 7f 90 08 10 40 08     00:00:29.316  WRITE FPDMA QUEUED
  61 00 08 00 88 00 00 7f 48 08 10 40 08     00:00:29.310  WRITE FPDMA QUEUED
  61 00 08 00 80 00 00 7e f8 08 10 40 08     00:00:29.304  WRITE FPDMA QUEUED
  61 00 08 00 78 00 00 7d ec 08 10 40 08     00:00:29.285  WRITE FPDMA QUEUED
  61 00 08 00 70 00 00 7c e4 08 10 40 08     00:00:29.281  WRITE FPDMA QUEUED

Error 3 [2] occurred at disk power-on lifetime: 17448 hours (727 days + 0 hours)
  When the command that caused the error occurred, the device was active or idle.

  After command completion occurred, registers were:
  ER -- ST COUNT  LBA_48  LH LM LL DV DC
  -- -- -- == -- == == == -- -- -- -- --
  10 -- 51 00 00 00 00 76 4c 08 10 40 00  Error: IDNF at LBA = 0x764c0810 = 1984694288

  Commands leading to the command that caused the error were:
  CR FEATR COUNT  LBA_48  LH LM LL DV DC  Powered_Up_Time  Command/Feature_Name
  -- == -- == -- == == == -- -- -- -- --  ---------------  --------------------
  61 00 08 00 28 00 00 7f 90 08 10 40 08     00:00:31.152  WRITE FPDMA QUEUED
  61 00 08 00 20 00 00 7f 48 08 10 40 08     00:00:31.146  WRITE FPDMA QUEUED
  61 00 08 00 18 00 00 7e f8 08 10 40 08     00:00:31.117  WRITE FPDMA QUEUED
  61 00 08 00 10 00 00 7d ec 08 10 40 08     00:00:31.112  WRITE FPDMA QUEUED
  61 00 08 00 08 00 00 7c e4 08 10 40 08     00:00:31.107  WRITE FPDMA QUEUED

Error 2 [1] occurred at disk power-on lifetime: 17448 hours (727 days + 0 hours)
  When the command that caused the error occurred, the device was active or idle.

  After command completion occurred, registers were:
  ER -- ST COUNT  LBA_48  LH LM LL DV DC
  -- -- -- == -- == == == -- -- -- -- --
  10 -- 51 00 00 00 00 75 1c 08 10 40 00  Error: IDNF at LBA = 0x751c0810 = 1964771344

  Commands leading to the command that caused the error were:
  CR FEATR COUNT  LBA_48  LH LM LL DV DC  Powered_Up_Time  Command/Feature_Name
  -- == -- == -- == == == -- -- -- -- --  ---------------  --------------------
  61 00 08 00 d8 00 00 7a 70 08 10 40 08     00:00:28.515  WRITE FPDMA QUEUED
  61 00 08 00 d0 00 00 7a 4c 08 10 40 08     00:00:28.507  WRITE FPDMA QUEUED
  61 00 08 00 c8 00 00 78 94 08 10 40 08     00:00:28.488  WRITE FPDMA QUEUED
  61 00 08 00 c0 00 00 78 04 08 10 40 08     00:00:28.481  WRITE FPDMA QUEUED
  61 00 08 00 b8 00 00 77 90 08 10 40 08     00:00:28.462  WRITE FPDMA QUEUED

SMART Extended Self-test Log Version: 1 (1 sectors)
No self-tests have been logged.  [To run self-tests, use: smartctl -t]

SMART Selective self-test log data structure revision number 1
 SPAN  MIN_LBA  MAX_LBA  CURRENT_TEST_STATUS
    1        0        0  Not_testing
    2        0        0  Not_testing
    3        0        0  Not_testing
    4        0        0  Not_testing
    5        0        0  Not_testing
Selective self-test flags (0x0):
  After scanning selected spans, do NOT read-scan remainder of disk.
If Selective self-test is pending on power-up, resume after 0 minute delay.

SCT Status Version:                  3
SCT Version (vendor specific):       258 (0x0102)
Device State:                        Active (0)
Current Temperature:                    40 Celsius
Power Cycle Min/Max Temperature:     39/42 Celsius
Lifetime    Min/Max Temperature:     13/48 Celsius
Under/Over Temperature Limit Count:   0/0
Vendor specific:
01 00 00 00 00 00 00 00 00 00 00 00 00 00 00 00
00 00 00 00 00 00 00 00 00 00 00 00 00 00 00 00

SCT Temperature History Version:     2
Temperature Sampling Period:         1 minute
Temperature Logging Interval:        1 minute
Min/Max recommended Temperature:      0/60 Celsius
Min/Max Temperature Limit:           -41/85 Celsius
Temperature History Size (Index):    478 (35)

SCT Error Recovery Control:
           Read:     70 (7.0 seconds)
          Write:     70 (7.0 seconds)

Device Statistics (GP/SMART Log 0x04) not supported

Pending Defects log (GP Log 0x0c) not supported

SATA Phy Event Counters (GP Log 0x11)
ID      Size     Value  Description
0x0001  2            0  Command failed due to ICRC error
0x0002  2            0  R_ERR response for data FIS
0x0003  2            0  R_ERR response for device-to-host data FIS
0x0004  2            0  R_ERR response for host-to-device data FIS
0x0005  2            0  R_ERR response for non-data FIS
0x0006  2            0  R_ERR response for device-to-host non-data FIS
0x0007  2            0  R_ERR response for host-to-device non-data FIS
0x0008  2            0  Device-to-host non-data FIS retries
0x0009  2           47  Transition from drive PhyRdy to drive PhyNRdy
0x000a  2           48  Device-to-host register FISes sent due to a COMRESET
0x000b  2            0  CRC errors within host-to-device FIS
0x000f  2            0  R_ERR response for host-to-device data FIS, CRC
0x0012  2            0  R_ERR response for host-to-device non-data FIS, CRC
0x8000  4       257382  Vendor specific



