smartctl 7.4 2023-08-01 r5530 [x86_64-linux-6.4.8-desktop-2omv2390] (OpenMandriva Lx 7.4-1)
Copyright (C) 2002-23, Bruce Allen, Christian Franke, www.smartmontools.org

=== START OF INFORMATION SECTION ===
Model Family:     Seagate Samsung SpinPoint M8 (AF)
Device Model:     ST750LM022 HN-M750MBB
Serial Number:    --
LU WWN Device Id: 5 0004cf ...
Firmware Version: 2BA30001
User Capacity:    750,156,374,016 bytes [750 GB]
Sector Sizes:     512 bytes logical, 4096 bytes physical
Rotation Rate:    5400 rpm
Form Factor:      2.5 inches
Device is:        In smartctl database
ATA Version is:   ATA8-ACS T13/1699-D revision 6
SATA Version is:  SATA 3.0, 6.0 Gb/s (current: 6.0 Gb/s)
Local Time is:    Mon Sep  4 04:27:57 2023 BST
SMART support is: Available - device has SMART capability.
SMART support is: Enabled
AAM feature is:   Disabled
APM feature is:   Disabled
Rd look-ahead is: Enabled
Write cache is:   Enabled
DSN feature is:   Unavailable
ATA Security is:  Disabled, frozen [SEC2]
Wt Cache Reorder: Enabled

=== START OF READ SMART DATA SECTION ===
SMART overall-health self-assessment test result: PASSED

General SMART Values:
Offline data collection status:  (0x80)	Offline data collection activity
					was never started.
					Auto Offline Data Collection: Enabled.
Self-test execution status:      (   0)	The previous self-test routine completed
					without error or no self-test has ever 
					been run.
Total time to complete Offline 
data collection: 		(10200) seconds.
Offline data collection
capabilities: 			 (0x5b) SMART execute Offline immediate.
					Auto Offline data collection on/off support.
					Suspend Offline collection upon new
					command.
					Offline surface scan supported.
					Self-test supported.
					No Conveyance Self-test supported.
					Selective Self-test supported.
SMART capabilities:            (0x0003)	Saves SMART data before entering
					power-saving mode.
					Supports SMART auto save timer.
Error logging capability:        (0x01)	Error logging supported.
					General Purpose Logging supported.
Short self-test routine 
recommended polling time: 	 (   2) minutes.
Extended self-test routine
recommended polling time: 	 ( 170) minutes.
SCT capabilities: 	       (0x003f)	SCT Status supported.
					SCT Error Recovery Control supported.
					SCT Feature Control supported.
					SCT Data Table supported.

SMART Attributes Data Structure revision number: 16
Vendor Specific SMART Attributes with Thresholds:
ID# ATTRIBUTE_NAME          FLAGS    VALUE WORST THRESH FAIL RAW_VALUE
  1 Raw_Read_Error_Rate     POSR-K   100   100   051    -    4230
  2 Throughput_Performance  -OS--K   252   252   000    -    0
  3 Spin_Up_Time            PO---K   092   091   025    -    2463
  4 Start_Stop_Count        -O--CK   094   094   000    -    6923
  5 Reallocated_Sector_Ct   PO--CK   252   252   010    -    0
  7 Seek_Error_Rate         -OSR-K   252   252   051    -    0
  8 Seek_Time_Performance   --S--K   252   252   015    -    0
  9 Power_On_Hours          -O--CK   100   100   000    -    9141
 10 Spin_Retry_Count        -O--CK   252   252   051    -    0
 12 Power_Cycle_Count       -O--CK   094   094   000    -    6909
191 G-Sense_Error_Rate      -O---K   100   100   000    -    806
192 Power-Off_Retract_Count -O---K   252   252   000    -    0
194 Temperature_Celsius     -O----   064   052   000    -    31 (Min/Max 14/48)
195 Hardware_ECC_Recovered  -O-RCK   100   100   000    -    0
196 Reallocated_Event_Count -O--CK   252   252   000    -    0
197 Current_Pending_Sector  -O--CK   252   100   000    -    0
198 Offline_Uncorrectable   ----CK   252   252   000    -    0
199 UDMA_CRC_Error_Count    -OS-CK   100   100   000    -    22
200 Multi_Zone_Error_Rate   -O-R-K   100   100   000    -    13915
223 Load_Retry_Count        -O--CK   095   095   000    -    5695
225 Load_Cycle_Count        -O--CK   093   093   000    -    76450
                            ||||||_ K auto-keep
                            |||||__ C event count
                            ||||___ R error rate
                            |||____ S speed/performance
                            ||_____ O updated online
                            |______ P prefailure warning

General Purpose Log Directory Version 1
SMART           Log Directory Version 1 [multi-sector log support]
Address    Access  R/W   Size  Description
0x00       GPL,SL  R/O      1  Log Directory
0x01           SL  R/O      1  Summary SMART error log
0x02           SL  R/O      2  Comprehensive SMART error log
0x03       GPL     R/O      2  Ext. Comprehensive SMART error log
0x06           SL  R/O      1  SMART self-test log
0x07       GPL     R/O      2  Extended self-test log
0x08       GPL     R/O      2  Power Conditions log
0x09           SL  R/W      1  Selective self-test log
0x10       GPL     R/O      1  NCQ Command Error log
0x11       GPL     R/O      1  SATA Phy Event Counters log
0x80-0x9f  GPL,SL  R/W     16  Host vendor specific log
0xc0-0xdf  GPL,SL  VS      16  Device vendor specific log
0xe0       GPL,SL  R/W      1  SCT Command/Status
0xe1       GPL,SL  R/W      1  SCT Data Transfer

SMART Extended Comprehensive Error Log Version: 1 (2 sectors)
Device Error Count: 4247 (device log contains only the most recent 8 errors)
	CR     = Command Register
	FEATR  = Features Register
	COUNT  = Count (was: Sector Count) Register
	LBA_48 = Upper bytes of LBA High/Mid/Low Registers ]  ATA-8
	LH     = LBA High (was: Cylinder High) Register    ]   LBA
	LM     = LBA Mid (was: Cylinder Low) Register      ] Register
	LL     = LBA Low (was: Sector Number) Register     ]
	DV     = Device (was: Device/Head) Register
	DC     = Device Control Register
	ER     = Error register
	ST     = Status register
Powered_Up_Time is measured from power on, and printed as
DDd+hh:mm:SS.sss where DD=days, hh=hours, mm=minutes,
SS=sec, and sss=millisec. It "wraps" after 49.710 days.

Error 4247 [6] occurred at disk power-on lifetime: 9079 hours (378 days + 7 hours)
  When the command that caused the error occurred, the device was active or idle.

  After command completion occurred, registers were:
  ER -- ST COUNT  LBA_48  LH LM LL DV DC
  -- -- -- == -- == == == -- -- -- -- --
  84 -- 51 01 b8 00 00 54 fd 25 40 40 00  Error: ICRC, ABRT 440 sectors at LBA = 0x54fd2540 = 1425876288

  Commands leading to the command that caused the error were:
  CR FEATR COUNT  LBA_48  LH LM LL DV DC  Powered_Up_Time  Command/Feature_Name
  -- == -- == -- == == == -- -- -- -- --  ---------------  --------------------
  25 00 00 08 00 00 00 54 fd 1e f8 40 00     00:00:00.009  READ DMA EXT
  25 00 00 08 00 00 00 54 fd 16 f8 40 00     00:00:00.009  READ DMA EXT
  25 00 00 08 00 00 00 54 fd 0e f8 40 00     00:00:00.009  READ DMA EXT
  25 00 00 08 00 00 00 54 fd 06 f8 40 00     00:00:00.009  READ DMA EXT
  25 00 00 08 00 00 00 54 fc fe f8 40 00     00:00:00.009  READ DMA EXT

Error 4246 [5] occurred at disk power-on lifetime: 9079 hours (378 days + 7 hours)
  When the command that caused the error occurred, the device was active or idle.

  After command completion occurred, registers were:
  ER -- ST COUNT  LBA_48  LH LM LL DV DC
  -- -- -- == -- == == == -- -- -- -- --
  84 -- 51 03 b8 00 00 54 fb 13 40 40 00  Error: ICRC, ABRT 952 sectors at LBA = 0x54fb1340 = 1425740608

  Commands leading to the command that caused the error were:
  CR FEATR COUNT  LBA_48  LH LM LL DV DC  Powered_Up_Time  Command/Feature_Name
  -- == -- == -- == == == -- -- -- -- --  ---------------  --------------------
  25 00 00 08 00 00 00 54 fb 0e f8 40 00     00:00:02.449  READ DMA EXT
  25 00 00 08 00 00 00 54 fb 06 f8 40 00     00:00:02.449  READ DMA EXT
  25 00 00 08 00 00 00 54 fa fe f8 40 00     00:00:02.449  READ DMA EXT
  25 00 00 08 00 00 00 54 fa f6 f8 40 00     00:00:02.449  READ DMA EXT
  25 00 00 08 00 00 00 54 fa ee f8 40 00     00:00:02.449  READ DMA EXT

Error 4245 [4] occurred at disk power-on lifetime: 9079 hours (378 days + 7 hours)
  When the command that caused the error occurred, the device was active or idle.

  After command completion occurred, registers were:
  ER -- ST COUNT  LBA_48  LH LM LL DV DC
  -- -- -- == -- == == == -- -- -- -- --
  84 -- 51 02 b8 00 00 54 f8 e4 40 40 00  Error: ICRC, ABRT 696 sectors at LBA = 0x54f8e440 = 1425597504

  Commands leading to the command that caused the error were:
  CR FEATR COUNT  LBA_48  LH LM LL DV DC  Powered_Up_Time  Command/Feature_Name
  -- == -- == -- == == == -- -- -- -- --  ---------------  --------------------
  25 00 00 08 00 00 00 54 f8 de f8 40 00     00:00:00.011  READ DMA EXT
  25 00 00 08 00 00 00 54 f8 d6 f8 40 00     00:00:00.011  READ DMA EXT
  25 00 00 08 00 00 00 54 f8 ce f8 40 00     00:00:00.011  READ DMA EXT
  25 00 00 08 00 00 00 54 f8 c6 f8 40 00     00:00:00.011  READ DMA EXT
  25 00 00 08 00 00 00 54 f8 be f8 40 00     00:00:00.011  READ DMA EXT

Error 4244 [3] occurred at disk power-on lifetime: 8909 hours (371 days + 5 hours)
  When the command that caused the error occurred, the device was active or idle.

  After command completion occurred, registers were:
  ER -- ST COUNT  LBA_48  LH LM LL DV DC
  -- -- -- == -- == == == -- -- -- -- --
  84 -- 51 00 8e 00 00 00 2d b0 40 40 00  Error: ICRC, ABRT 142 sectors at LBA = 0x002db040 = 2994240

  Commands leading to the command that caused the error were:
  CR FEATR COUNT  LBA_48  LH LM LL DV DC  Powered_Up_Time  Command/Feature_Name
  -- == -- == -- == == == -- -- -- -- --  ---------------  --------------------
  25 00 00 00 96 00 00 00 2d b0 38 40 00     00:00:00.167  READ DMA EXT
  25 00 00 00 40 00 00 10 1f 47 40 40 00     00:00:00.167  READ DMA EXT
  25 00 00 03 3c 00 00 00 45 f3 b8 40 00     00:00:00.167  READ DMA EXT
  25 00 00 00 b0 00 00 00 38 34 a0 40 00     00:00:00.167  READ DMA EXT
  25 00 00 00 40 00 00 10 1f 49 00 40 00     00:00:00.167  READ DMA EXT

Error 4243 [2] occurred at disk power-on lifetime: 8792 hours (366 days + 8 hours)
  When the command that caused the error occurred, the device was in a vendor specific state.

  After command completion occurred, registers were:
  ER -- ST COUNT  LBA_48  LH LM LL DV DC
  -- -- -- == -- == == == -- -- -- -- --
  84 -- 51 00 40 00 00 19 f1 18 c0 40 00  Error: ICRC, ABRT 64 sectors at LBA = 0x19f118c0 = 435230912

  Commands leading to the command that caused the error were:
  CR FEATR COUNT  LBA_48  LH LM LL DV DC  Powered_Up_Time  Command/Feature_Name
  -- == -- == -- == == == -- -- -- -- --  ---------------  --------------------
  25 00 00 00 40 00 00 19 f1 18 c0 40 00     00:00:00.014  READ DMA EXT
  25 00 00 04 ec 00 00 00 25 d4 70 40 00     00:00:00.014  READ DMA EXT
  25 00 00 00 40 00 00 00 84 85 40 40 00     00:00:00.014  READ DMA EXT
  25 00 00 00 c7 00 00 00 2a 5d f8 40 00     00:00:00.014  READ DMA EXT
  25 00 00 00 40 00 00 19 f0 96 c0 40 00     00:00:00.014  READ DMA EXT

Error 4242 [1] occurred at disk power-on lifetime: 8763 hours (365 days + 3 hours)
  When the command that caused the error occurred, the device was in a vendor specific state.

  After command completion occurred, registers were:
  ER -- ST COUNT  LBA_48  LH LM LL DV DC
  -- -- -- == -- == == == -- -- -- -- --
  84 -- 51 01 78 00 00 00 0b 46 00 40 00  Error: ICRC, ABRT 376 sectors at LBA = 0x000b4600 = 738816

  Commands leading to the command that caused the error were:
  CR FEATR COUNT  LBA_48  LH LM LL DV DC  Powered_Up_Time  Command/Feature_Name
  -- == -- == -- == == == -- -- -- -- --  ---------------  --------------------
  25 00 00 08 00 00 00 00 0b 3f 78 40 00     00:00:00.027  READ DMA EXT
  25 00 00 08 00 00 00 00 0b 37 78 40 00     00:00:00.027  READ DMA EXT
  25 00 00 08 00 00 00 00 0b 2f 78 40 00     00:00:00.027  READ DMA EXT
  25 00 00 08 00 00 00 00 0b 27 78 40 00     00:00:00.027  READ DMA EXT
  25 00 00 08 00 00 00 00 0b 1f 78 40 00     00:00:00.027  READ DMA EXT

Error 4241 [0] occurred at disk power-on lifetime: 8721 hours (363 days + 9 hours)
  When the command that caused the error occurred, the device was in a vendor specific state.

  After command completion occurred, registers were:
  ER -- ST COUNT  LBA_48  LH LM LL DV DC
  -- -- -- == -- == == == -- -- -- -- --
  84 -- 51 01 78 00 00 00 0b 0e 00 40 00  Error: ICRC, ABRT 376 sectors at LBA = 0x000b0e00 = 724480

  Commands leading to the command that caused the error were:
  CR FEATR COUNT  LBA_48  LH LM LL DV DC  Powered_Up_Time  Command/Feature_Name
  -- == -- == -- == == == -- -- -- -- --  ---------------  --------------------
  25 00 00 08 00 00 00 00 0b 07 78 40 00     00:00:00.018  READ DMA EXT
  25 00 00 08 00 00 00 00 0a ff 78 40 00     00:00:00.018  READ DMA EXT
  25 00 00 08 00 00 00 00 0a f7 78 40 00     00:00:00.018  READ DMA EXT
  25 00 00 08 00 00 00 00 0a ef 78 40 00     00:00:00.018  READ DMA EXT
  25 00 00 08 00 00 00 00 0a e7 78 40 00     00:00:00.018  READ DMA EXT

Error 4240 [7] occurred at disk power-on lifetime: 8720 hours (363 days + 8 hours)
  When the command that caused the error occurred, the device was in a vendor specific state.

  After command completion occurred, registers were:
  ER -- ST COUNT  LBA_48  LH LM LL DV DC
  -- -- -- == -- == == == -- -- -- -- --
  84 -- 51 01 38 00 00 00 0a 7e 40 40 00  Error: ICRC, ABRT 312 sectors at LBA = 0x000a7e40 = 687680

  Commands leading to the command that caused the error were:
  CR FEATR COUNT  LBA_48  LH LM LL DV DC  Powered_Up_Time  Command/Feature_Name
  -- == -- == -- == == == -- -- -- -- --  ---------------  --------------------
  25 00 00 08 00 00 00 00 0a 77 78 40 00     00:00:00.017  READ DMA EXT
  25 00 00 08 00 00 00 00 0a 6f 78 40 00     00:00:00.017  READ DMA EXT
  25 00 00 08 00 00 00 00 0a 67 78 40 00     00:00:00.017  READ DMA EXT
  25 00 00 08 00 00 00 00 0a 5f 78 40 00     00:00:00.017  READ DMA EXT
  25 00 00 08 00 00 00 00 0a 57 78 40 00     00:00:00.017  READ DMA EXT

SMART Extended Self-test Log Version: 1 (2 sectors)
No self-tests have been logged.  [To run self-tests, use: smartctl -t]

SMART Selective self-test log data structure revision number 0
Note: revision number not 1 implies that no selective self-test has ever been run
 SPAN  MIN_LBA  MAX_LBA  CURRENT_TEST_STATUS
    1        0        0  Completed [00% left] (0-65535)
    2        0        0  Not_testing
    3        0        0  Not_testing
    4        0        0  Not_testing
    5        0        0  Not_testing
Selective self-test flags (0x0):
  After scanning selected spans, do NOT read-scan remainder of disk.
If Selective self-test is pending on power-up, resume after 0 minute delay.

SCT Status Version:                  2
SCT Version (vendor specific):       256 (0x0100)
Device State:                        Active (0)
Current Temperature:                    31 Celsius
Power Cycle Min/Max Temperature:     30/31 Celsius
Lifetime    Min/Max Temperature:     14/48 Celsius
Specified Max Operating Temperature:    80 Celsius
Under/Over Temperature Limit Count:   0/0

SCT Temperature History Version:     2
Temperature Sampling Period:         5 minutes
Temperature Logging Interval:        5 minutes
Min/Max recommended Temperature:     -5/80 Celsius
Min/Max Temperature Limit:           -10/85 Celsius
Temperature History Size (Index):    128 (37)

SCT Error Recovery Control:
           Read: Disabled
          Write: Disabled

Device Statistics (GP/SMART Log 0x04) not supported

Pending Defects log (GP Log 0x0c) not supported

SATA Phy Event Counters (GP Log 0x11)
ID      Size     Value  Description
0x0001  4            0  Command failed due to ICRC error
0x0002  4            0  R_ERR response for data FIS
0x0003  4            0  R_ERR response for device-to-host data FIS
0x0004  4            0  R_ERR response for host-to-device data FIS
0x0005  4            0  R_ERR response for non-data FIS
0x0006  4            0  R_ERR response for device-to-host non-data FIS
0x0007  4            0  R_ERR response for host-to-device non-data FIS
0x0008  4            0  Device-to-host non-data FIS retries
0x0009  4            4  Transition from drive PhyRdy to drive PhyNRdy
0x000a  4            2  Device-to-host register FISes sent due to a COMRESET
0x000b  4            0  CRC errors within host-to-device FIS
0x000d  4            0  Non-CRC errors within host-to-device FIS
0x000f  4            0  R_ERR response for host-to-device data FIS, CRC
0x0010  4            0  R_ERR response for host-to-device data FIS, non-CRC
0x0012  4            0  R_ERR response for host-to-device non-data FIS, CRC
0x0013  4            0  R_ERR response for host-to-device non-data FIS, non-CRC
0x8e00  4            0  Vendor specific
0x8e01  4            0  Vendor specific
0x8e02  4            0  Vendor specific
0x8e03  4            0  Vendor specific
0x8e04  4            0  Vendor specific
0x8e05  4            0  Vendor specific
0x8e06  4            0  Vendor specific
0x8e07  4            0  Vendor specific
0x8e08  4            0  Vendor specific
0x8e09  4            0  Vendor specific
0x8e0a  4            0  Vendor specific
0x8e0b  4            0  Vendor specific
0x8e0c  4            0  Vendor specific
0x8e0d  4            0  Vendor specific
0x8e0e  4            0  Vendor specific
0x8e0f  4            0  Vendor specific
0x8e10  4            0  Vendor specific
0x8e11  4            0  Vendor specific

