smartctl 7.3 2022-02-28 r5338 [x86_64-linux-5.10.150-generic-1rosa2021.1-x86_64] (local build)
Copyright (C) 2002-22, Bruce Allen, Christian Franke, www.smartmontools.org

=== START OF INFORMATION SECTION ===
Model Family:     Western Digital Blue
Device Model:     WDC WD10EZEX-60WN4A0
Serial Number:    --
LU WWN Device Id: 5 0014ee ...
Firmware Version: 01.01A01
User Capacity:    1,000,204,886,016 bytes [1.00 TB]
Sector Sizes:     512 bytes logical, 4096 bytes physical
Rotation Rate:    7200 rpm
Form Factor:      3.5 inches
Device is:        In smartctl database 7.3/5319
ATA Version is:   ACS-3 T13/2161-D revision 5
SATA Version is:  SATA 3.1, 6.0 Gb/s (current: 6.0 Gb/s)
Local Time is:    Thu Nov  3 22:39:50 2022 MSK
SMART support is: Available - device has SMART capability.
SMART support is: Enabled
AAM feature is:   Unavailable
APM level is:     128 (minimum power consumption without standby)
Rd look-ahead is: Enabled
Write cache is:   Enabled
DSN feature is:   Unavailable
ATA Security is:  Disabled, frozen [SEC2]
Wt Cache Reorder: Enabled

=== START OF READ SMART DATA SECTION ===
SMART overall-health self-assessment test result: PASSED

General SMART Values:
Offline data collection status:  (0x82)	Offline data collection activity
					was completed without error.
					Auto Offline Data Collection: Enabled.
Self-test execution status:      (  23)	The self-test routine was aborted by
					the host.
Total time to complete Offline 
data collection: 		(11220) seconds.
Offline data collection
capabilities: 			 (0x5b) SMART execute Offline immediate.
					Auto Offline data collection on/off support.
					Suspend Offline collection upon new
					command.
					Offline surface scan supported.
					Self-test supported.
					No Conveyance Self-test supported.
					Selective Self-test supported.
SMART capabilities:            (0x0003)	Saves SMART data before entering
					power-saving mode.
					Supports SMART auto save timer.
Error logging capability:        (0x01)	Error logging supported.
					General Purpose Logging supported.
Short self-test routine 
recommended polling time: 	 (   2) minutes.
Extended self-test routine
recommended polling time: 	 ( 116) minutes.
SCT capabilities: 	       (0x303d)	SCT Status supported.
					SCT Error Recovery Control supported.
					SCT Feature Control supported.
					SCT Data Table supported.

SMART Attributes Data Structure revision number: 16
Vendor Specific SMART Attributes with Thresholds:
ID# ATTRIBUTE_NAME          FLAGS    VALUE WORST THRESH FAIL RAW_VALUE
  1 Raw_Read_Error_Rate     POSR-K   200   200   051    -    0
  3 Spin_Up_Time            POS--K   174   170   021    -    2275
  4 Start_Stop_Count        -O--CK   096   096   000    -    4812
  5 Reallocated_Sector_Ct   PO--CK   200   200   140    -    0
  7 Seek_Error_Rate         POSR-K   100   253   051    -    0
  9 Power_On_Hours          -O--CK   085   085   000    -    11045
 10 Spin_Retry_Count        PO--CK   100   100   051    -    0
 11 Calibration_Retry_Count -O--CK   100   100   000    -    0
 12 Power_Cycle_Count       -O--CK   097   097   000    -    3626
183 Runtime_Bad_Block       -O--CK   099   099   000    -    1
184 End-to-End_Error        PO--CK   100   100   097    -    0
187 Reported_Uncorrect      -O--CK   100   083   000    -    17
188 Command_Timeout         -O--CK   100   001   000    -    85900659289
190 Airflow_Temperature_Cel -O---K   068   059   040    -    32 (Min/Max 22/32)
192 Power-Off_Retract_Count -O--CK   199   199   000    -    829
193 Load_Cycle_Count        -O--CK   195   195   000    -    17453
194 Temperature_Celsius     -O---K   111   102   000    -    32
196 Reallocated_Event_Count -O--CK   200   200   000    -    0
197 Current_Pending_Sector  -O--CK   200   200   000    -    0
198 Offline_Uncorrectable   ----CK   200   200   000    -    0
199 UDMA_CRC_Error_Count    -O--CK   200   191   000    -    2722
200 Multi_Zone_Error_Rate   ---R--   200   200   000    -    0
                            ||||||_ K auto-keep
                            |||||__ C event count
                            ||||___ R error rate
                            |||____ S speed/performance
                            ||_____ O updated online
                            |______ P prefailure warning

General Purpose Log Directory Version 1
SMART           Log Directory Version 1 [multi-sector log support]
Address    Access  R/W   Size  Description
0x00       GPL,SL  R/O      1  Log Directory
0x01           SL  R/O      1  Summary SMART error log
0x02           SL  R/O      5  Comprehensive SMART error log
0x03       GPL     R/O      6  Ext. Comprehensive SMART error log
0x04       GPL,SL  R/O      8  Device Statistics log
0x06           SL  R/O      1  SMART self-test log
0x07       GPL     R/O      1  Extended self-test log
0x08       GPL     R/O      2  Power Conditions log
0x09           SL  R/W      1  Selective self-test log
0x0d       GPL,SL  R/O      8  LPS Mis-alignment log
0x10       GPL     R/O      1  NCQ Command Error log
0x11       GPL     R/O      1  SATA Phy Event Counters log
0x30       GPL,SL  R/O      9  IDENTIFY DEVICE data log
0x80-0x9f  GPL,SL  R/W     16  Host vendor specific log
0xa0-0xa7  GPL,SL  VS      16  Device vendor specific log
0xa8-0xb5  GPL,SL  VS       1  Device vendor specific log
0xb6       GPL     VS    1051  Device vendor specific log
0xb6       SL      VS       1  Device vendor specific log
0xb7       GPL,SL  VS      48  Device vendor specific log
0xbd       GPL,SL  VS       1  Device vendor specific log
0xc0       GPL,SL  VS       1  Device vendor specific log
0xc1       GPL     VS      93  Device vendor specific log
0xe0       GPL,SL  R/W      1  SCT Command/Status
0xe1       GPL,SL  R/W      1  SCT Data Transfer

SMART Extended Comprehensive Error Log Version: 1 (6 sectors)
Device Error Count: 17
	CR     = Command Register
	FEATR  = Features Register
	COUNT  = Count (was: Sector Count) Register
	LBA_48 = Upper bytes of LBA High/Mid/Low Registers ]  ATA-8
	LH     = LBA High (was: Cylinder High) Register    ]   LBA
	LM     = LBA Mid (was: Cylinder Low) Register      ] Register
	LL     = LBA Low (was: Sector Number) Register     ]
	DV     = Device (was: Device/Head) Register
	DC     = Device Control Register
	ER     = Error register
	ST     = Status register
Powered_Up_Time is measured from power on, and printed as
DDd+hh:mm:SS.sss where DD=days, hh=hours, mm=minutes,
SS=sec, and sss=millisec. It "wraps" after 49.710 days.

Error 17 [16] occurred at disk power-on lifetime: 9520 hours (396 days + 16 hours)
  When the command that caused the error occurred, the device was active or idle.

  After command completion occurred, registers were:
  ER -- ST COUNT  LBA_48  LH LM LL DV DC
  -- -- -- == -- == == == -- -- -- -- --
  40 -- 51 01 00 00 00 2d da d1 a8 e0 00  Error: UNC at LBA = 0x2ddad1a8 = 769315240

  Commands leading to the command that caused the error were:
  CR FEATR COUNT  LBA_48  LH LM LL DV DC  Powered_Up_Time  Command/Feature_Name
  -- == -- == -- == == == -- -- -- -- --  ---------------  --------------------
  29 00 00 01 00 00 00 2d da d1 a8 e0 00     00:35:01.638  READ MULTIPLE EXT
  25 00 00 01 00 00 00 2d da d5 a8 e0 00     00:35:01.637  READ DMA EXT
  25 00 00 01 00 00 00 2d da d4 a8 e0 00     00:35:01.637  READ DMA EXT
  25 00 00 01 00 00 00 2d da d3 a8 e0 00     00:35:01.636  READ DMA EXT
  25 00 00 01 00 00 00 2d da d2 a8 e0 00     00:35:01.633  READ DMA EXT

Error 16 [15] occurred at disk power-on lifetime: 9520 hours (396 days + 16 hours)
  When the command that caused the error occurred, the device was active or idle.

  After command completion occurred, registers were:
  ER -- ST COUNT  LBA_48  LH LM LL DV DC
  -- -- -- == -- == == == -- -- -- -- --
  40 -- 51 01 00 00 00 2d da a3 a8 e0 00  Error: UNC at LBA = 0x2ddaa3a8 = 769303464

  Commands leading to the command that caused the error were:
  CR FEATR COUNT  LBA_48  LH LM LL DV DC  Powered_Up_Time  Command/Feature_Name
  -- == -- == -- == == == -- -- -- -- --  ---------------  --------------------
  29 00 00 01 00 00 00 2d da a3 a8 e0 00     00:33:54.064  READ MULTIPLE EXT
  25 00 00 01 00 00 00 2d da a5 a8 e0 00     00:33:53.909  READ DMA EXT
  25 00 00 01 00 00 00 2d da a4 a8 e0 00     00:33:53.905  READ DMA EXT
  25 00 00 01 00 00 00 2d da a3 a8 e0 00     00:33:53.699  READ DMA EXT
  25 00 00 01 00 00 00 2d da a2 a8 e0 00     00:33:53.699  READ DMA EXT

Error 15 [14] occurred at disk power-on lifetime: 9520 hours (396 days + 16 hours)
  When the command that caused the error occurred, the device was active or idle.

  After command completion occurred, registers were:
  ER -- ST COUNT  LBA_48  LH LM LL DV DC
  -- -- -- == -- == == == -- -- -- -- --
  40 -- 51 01 00 00 00 2c 14 a6 b8 e0 00  Error: UNC at LBA = 0x2c14a6b8 = 739550904

  Commands leading to the command that caused the error were:
  CR FEATR COUNT  LBA_48  LH LM LL DV DC  Powered_Up_Time  Command/Feature_Name
  -- == -- == -- == == == -- -- -- -- --  ---------------  --------------------
  29 00 00 01 00 00 00 2c 14 a6 b8 e0 00     00:32:46.715  READ MULTIPLE EXT
  25 00 00 00 31 00 00 2c 14 af b8 e0 00     00:32:46.714  READ DMA EXT
  25 00 00 01 00 00 00 2c 14 ae b8 e0 00     00:32:46.713  READ DMA EXT
  25 00 00 01 00 00 00 2c 14 ad b8 e0 00     00:32:46.713  READ DMA EXT
  25 00 00 01 00 00 00 2c 14 ac b8 e0 00     00:32:46.712  READ DMA EXT

Error 14 [13] occurred at disk power-on lifetime: 9520 hours (396 days + 16 hours)
  When the command that caused the error occurred, the device was active or idle.

  After command completion occurred, registers were:
  ER -- ST COUNT  LBA_48  LH LM LL DV DC
  -- -- -- == -- == == == -- -- -- -- --
  40 -- 51 01 00 00 00 2a 84 41 08 e0 00  Error: UNC at LBA = 0x2a844108 = 713310472

  Commands leading to the command that caused the error were:
  CR FEATR COUNT  LBA_48  LH LM LL DV DC  Powered_Up_Time  Command/Feature_Name
  -- == -- == -- == == == -- -- -- -- --  ---------------  --------------------
  29 00 00 01 00 00 00 2a 84 41 08 e0 00     00:31:26.721  READ MULTIPLE EXT
  25 00 00 01 00 00 00 2a 84 41 08 e0 00     00:31:26.563  READ DMA EXT
  25 00 00 01 00 00 00 2a 84 40 08 e0 00     00:31:26.562  READ DMA EXT
  25 00 00 01 00 00 00 2a 84 3f 08 e0 00     00:31:26.561  READ DMA EXT
  25 00 00 01 00 00 00 2a 84 3e 08 e0 00     00:31:26.561  READ DMA EXT

Error 13 [12] occurred at disk power-on lifetime: 9520 hours (396 days + 16 hours)
  When the command that caused the error occurred, the device was active or idle.

  After command completion occurred, registers were:
  ER -- ST COUNT  LBA_48  LH LM LL DV DC
  -- -- -- == -- == == == -- -- -- -- --
  40 -- 51 01 00 00 00 2a 82 dd 08 e0 00  Error: UNC at LBA = 0x2a82dd08 = 713219336

  Commands leading to the command that caused the error were:
  CR FEATR COUNT  LBA_48  LH LM LL DV DC  Powered_Up_Time  Command/Feature_Name
  -- == -- == -- == == == -- -- -- -- --  ---------------  --------------------
  29 00 00 01 00 00 00 2a 82 dd 08 e0 00     00:30:09.686  READ MULTIPLE EXT
  25 00 00 01 00 00 00 2a 82 dd 08 e0 00     00:30:09.516  READ DMA EXT
  25 00 00 01 00 00 00 2a 82 dc 08 e0 00     00:30:09.514  READ DMA EXT
  25 00 00 01 00 00 00 2a 82 db 08 e0 00     00:30:09.514  READ DMA EXT
  25 00 00 01 00 00 00 2a 82 da 08 e0 00     00:30:09.500  READ DMA EXT

Error 12 [11] occurred at disk power-on lifetime: 9520 hours (396 days + 16 hours)
  When the command that caused the error occurred, the device was active or idle.

  After command completion occurred, registers were:
  ER -- ST COUNT  LBA_48  LH LM LL DV DC
  -- -- -- == -- == == == -- -- -- -- --
  40 -- 51 01 00 00 00 2a 82 d5 08 e0 00  Error: UNC at LBA = 0x2a82d508 = 713217288

  Commands leading to the command that caused the error were:
  CR FEATR COUNT  LBA_48  LH LM LL DV DC  Powered_Up_Time  Command/Feature_Name
  -- == -- == -- == == == -- -- -- -- --  ---------------  --------------------
  29 00 00 01 00 00 00 2a 82 d5 08 e0 00     00:29:02.672  READ MULTIPLE EXT
  25 00 00 01 00 00 00 2a 82 d2 08 e0 00     00:29:02.631  READ DMA EXT
  25 00 00 01 00 00 00 2a 82 d1 08 e0 00     00:29:02.630  READ DMA EXT
  25 00 00 01 00 00 00 2a 82 d0 08 e0 00     00:29:02.630  READ DMA EXT
  25 00 00 01 00 00 00 2a 82 cf 08 e0 00     00:29:02.629  READ DMA EXT

Error 11 [10] occurred at disk power-on lifetime: 9520 hours (396 days + 16 hours)
  When the command that caused the error occurred, the device was active or idle.

  After command completion occurred, registers were:
  ER -- ST COUNT  LBA_48  LH LM LL DV DC
  -- -- -- == -- == == == -- -- -- -- --
  40 -- 51 01 00 00 00 08 72 b9 e0 e0 00  Error: UNC at LBA = 0x0872b9e0 = 141736416

  Commands leading to the command that caused the error were:
  CR FEATR COUNT  LBA_48  LH LM LL DV DC  Powered_Up_Time  Command/Feature_Name
  -- == -- == -- == == == -- -- -- -- --  ---------------  --------------------
  29 00 00 01 00 00 00 08 72 b9 e0 e0 00     00:26:39.054  READ MULTIPLE EXT
  29 00 00 01 00 00 00 08 72 a4 e0 e0 00     00:26:39.014  READ MULTIPLE EXT
  29 00 00 00 84 00 00 08 72 a3 40 e0 00     00:26:38.993  READ MULTIPLE EXT
  29 00 00 01 00 00 00 08 72 9f 40 e0 00     00:26:38.937  READ MULTIPLE EXT
  25 00 00 01 00 00 00 2d d7 e5 a8 e0 00     00:26:38.936  READ DMA EXT

Error 10 [9] occurred at disk power-on lifetime: 9520 hours (396 days + 16 hours)
  When the command that caused the error occurred, the device was active or idle.

  After command completion occurred, registers were:
  ER -- ST COUNT  LBA_48  LH LM LL DV DC
  -- -- -- == -- == == == -- -- -- -- --
  40 -- 51 01 00 00 00 2a 81 73 62 e0 00  Error: UNC at LBA = 0x2a817362 = 713126754

  Commands leading to the command that caused the error were:
  CR FEATR COUNT  LBA_48  LH LM LL DV DC  Powered_Up_Time  Command/Feature_Name
  -- == -- == -- == == == -- -- -- -- --  ---------------  --------------------
  29 00 00 01 00 00 00 2a 81 73 62 e0 00     00:23:27.383  READ MULTIPLE EXT
  35 00 00 00 08 00 00 29 80 4b 70 e0 00     00:23:27.382  WRITE DMA EXT
  25 00 00 00 3e 00 00 14 21 8a d0 e0 00     00:23:27.366  READ DMA EXT
  25 00 00 01 00 00 00 13 73 fc 90 e0 00     00:23:27.198  READ DMA EXT
  c6 00 00 00 10 00 00 00 00 00 00 a0 00     00:23:26.402  SET MULTIPLE MODE

SMART Extended Self-test Log Version: 1 (1 sectors)
Num  Test_Description    Status                  Remaining  LifeTime(hours)  LBA_of_first_error
# 1  Extended offline    Aborted by host               70%     10792         -
# 2  Extended offline    Interrupted (host reset)      90%     10678         -
# 3  Extended offline    Interrupted (host reset)      90%     10619         -
# 4  Extended offline    Interrupted (host reset)      40%     10531         -
# 5  Extended offline    Interrupted (host reset)      50%     10511         -
# 6  Extended offline    Interrupted (host reset)      70%     10387         -
# 7  Extended offline    Aborted by host               20%     10365         -
# 8  Extended offline    Interrupted (host reset)      10%     10342         -
# 9  Extended offline    Interrupted (host reset)      60%     10326         -
#10  Extended offline    Interrupted (host reset)      40%     10275         -
#11  Extended offline    Interrupted (host reset)      50%     10238         -
#12  Extended offline    Interrupted (host reset)      20%     10188         -
#13  Extended offline    Aborted by host               90%      6834         -
#14  Short offline       Completed without error       00%      3410         -

SMART Selective self-test log data structure revision number 1
 SPAN  MIN_LBA  MAX_LBA  CURRENT_TEST_STATUS
    1        0        0  Not_testing
    2        0        0  Not_testing
    3        0        0  Not_testing
    4        0        0  Not_testing
    5        0        0  Not_testing
Selective self-test flags (0x0):
  After scanning selected spans, do NOT read-scan remainder of disk.
If Selective self-test is pending on power-up, resume after 0 minute delay.

SCT Status Version:                  3
SCT Version (vendor specific):       258 (0x0102)
Device State:                        Active (0)
Current Temperature:                    32 Celsius
Power Cycle Min/Max Temperature:     22/32 Celsius
Lifetime    Min/Max Temperature:     18/41 Celsius
Under/Over Temperature Limit Count:   0/0
Vendor specific:
01 00 00 00 00 00 00 00 00 00 00 00 00 00 00 00
00 00 00 00 00 00 00 00 00 00 00 00 00 00 00 00

SCT Temperature History Version:     2
Temperature Sampling Period:         1 minute
Temperature Logging Interval:        1 minute
Min/Max recommended Temperature:      0/60 Celsius
Min/Max Temperature Limit:           -41/85 Celsius
Temperature History Size (Index):    128 (11)

SCT Error Recovery Control:
           Read:     85 (8.5 seconds)
          Write:     85 (8.5 seconds)

Device Statistics (GP Log 0x04)
Page  Offset Size        Value Flags Description
0x01  =====  =               =  ===  == General Statistics (rev 1) ==
0x01  0x008  4            3626  ---  Lifetime Power-On Resets
0x01  0x010  4           11045  ---  Power-on Hours
0x01  0x018  6     48179737973  ---  Logical Sectors Written
0x01  0x020  6       504096599  ---  Number of Write Commands
0x01  0x028  6     61273991648  ---  Logical Sectors Read
0x01  0x030  6       527671955  ---  Number of Read Commands
0x01  0x038  6      1107294336  ---  Date and Time TimeStamp
0x03  =====  =               =  ===  == Rotating Media Statistics (rev 1) ==
0x03  0x008  4            9655  ---  Spindle Motor Power-on Hours
0x03  0x010  4            7995  ---  Head Flying Hours
0x03  0x018  4           18283  ---  Head Load Events
0x03  0x020  4               0  ---  Number of Reallocated Logical Sectors
0x03  0x028  4               0  ---  Read Recovery Attempts
0x03  0x030  4               0  ---  Number of Mechanical Start Failures
0x03  0x038  4               0  ---  Number of Realloc. Candidate Logical Sectors
0x03  0x040  4             829  ---  Number of High Priority Unload Events
0x04  =====  =               =  ===  == General Errors Statistics (rev 1) ==
0x04  0x008  4              17  ---  Number of Reported Uncorrectable Errors
0x04  0x010  4         1313369  ---  Resets Between Cmd Acceptance and Completion
0x05  =====  =               =  ===  == Temperature Statistics (rev 1) ==
0x05  0x008  1              32  ---  Current Temperature
0x05  0x010  1              29  ---  Average Short Term Temperature
0x05  0x018  1              29  ---  Average Long Term Temperature
0x05  0x020  1              41  ---  Highest Temperature
0x05  0x028  1              18  ---  Lowest Temperature
0x05  0x030  1              38  ---  Highest Average Short Term Temperature
0x05  0x038  1              24  ---  Lowest Average Short Term Temperature
0x05  0x040  1              29  ---  Highest Average Long Term Temperature
0x05  0x048  1              26  ---  Lowest Average Long Term Temperature
0x05  0x050  4               0  ---  Time in Over-Temperature
0x05  0x058  1              60  ---  Specified Maximum Operating Temperature
0x05  0x060  4               0  ---  Time in Under-Temperature
0x05  0x068  1               0  ---  Specified Minimum Operating Temperature
0x06  =====  =               =  ===  == Transport Statistics (rev 1) ==
0x06  0x008  4           12491  ---  Number of Hardware Resets
0x06  0x010  4            4343  ---  Number of ASR Events
0x06  0x018  4               0  ---  Number of Interface CRC Errors
                                |||_ C monitored condition met
                                ||__ D supports DSN
                                |___ N normalized value

Pending Defects log (GP Log 0x0c) not supported

SATA Phy Event Counters (GP Log 0x11)
ID      Size     Value  Description
0x0001  2            0  Command failed due to ICRC error
0x0002  2            0  R_ERR response for data FIS
0x0003  2            0  R_ERR response for device-to-host data FIS
0x0004  2            0  R_ERR response for host-to-device data FIS
0x0005  2            0  R_ERR response for non-data FIS
0x0006  2            0  R_ERR response for device-to-host non-data FIS
0x0007  2            0  R_ERR response for host-to-device non-data FIS
0x0008  2            0  Device-to-host non-data FIS retries
0x0009  2           17  Transition from drive PhyRdy to drive PhyNRdy
0x000a  2           18  Device-to-host register FISes sent due to a COMRESET
0x000b  2            0  CRC errors within host-to-device FIS
0x000d  2            0  Non-CRC errors within host-to-device FIS
0x000f  2            0  R_ERR response for host-to-device data FIS, CRC
0x0012  2            0  R_ERR response for host-to-device non-data FIS, CRC
0x8000  4         9433  Vendor specific

