smartctl 7.4 2023-08-01 r5530 [x86_64-linux-6.15.0-desktop-0.rc2.3omv2590] (OpenMandriva Lx 7.4-1)
Copyright (C) 2002-23, Bruce Allen, Christian Franke, www.smartmontools.org

=== START OF INFORMATION SECTION ===
Model Family:     Western Digital Blue
Device Model:     WDC WD10EZEX-60WN4A0
Serial Number:    --
LU WWN Device Id: 5 0014ee ...
Firmware Version: 01.01A01
User Capacity:    1,000,204,886,016 bytes [1.00 TB]
Sector Sizes:     512 bytes logical, 4096 bytes physical
Rotation Rate:    7200 rpm
Form Factor:      3.5 inches
Device is:        In smartctl database
ATA Version is:   ACS-3 T13/2161-D revision 5
SATA Version is:  SATA 3.1, 6.0 Gb/s (current: 6.0 Gb/s)
Local Time is:    Thu Apr 24 14:41:16 2025 EDT
SMART support is: Available - device has SMART capability.
SMART support is: Enabled
AAM feature is:   Unavailable
APM level is:     128 (minimum power consumption without standby)
Rd look-ahead is: Enabled
Write cache is:   Enabled
DSN feature is:   Unavailable
ATA Security is:  Disabled, frozen [SEC2]
Wt Cache Reorder: Enabled

=== START OF READ SMART DATA SECTION ===
SMART overall-health self-assessment test result: PASSED

General SMART Values:
Offline data collection status:  (0x82)	Offline data collection activity
					was completed without error.
					Auto Offline Data Collection: Enabled.
Self-test execution status:      (   0)	The previous self-test routine completed
					without error or no self-test has ever 
					been run.
Total time to complete Offline 
data collection: 		(10920) seconds.
Offline data collection
capabilities: 			 (0x5b) SMART execute Offline immediate.
					Auto Offline data collection on/off support.
					Suspend Offline collection upon new
					command.
					Offline surface scan supported.
					Self-test supported.
					No Conveyance Self-test supported.
					Selective Self-test supported.
SMART capabilities:            (0x0003)	Saves SMART data before entering
					power-saving mode.
					Supports SMART auto save timer.
Error logging capability:        (0x01)	Error logging supported.
					General Purpose Logging supported.
Short self-test routine 
recommended polling time: 	 (   2) minutes.
Extended self-test routine
recommended polling time: 	 ( 114) minutes.
SCT capabilities: 	       (0x303d)	SCT Status supported.
					SCT Error Recovery Control supported.
					SCT Feature Control supported.
					SCT Data Table supported.

SMART Attributes Data Structure revision number: 16
Vendor Specific SMART Attributes with Thresholds:
ID# ATTRIBUTE_NAME          FLAGS    VALUE WORST THRESH FAIL RAW_VALUE
  1 Raw_Read_Error_Rate     POSR-K   200   200   051    -    0
  3 Spin_Up_Time            POS--K   173   171   021    -    2350
  4 Start_Stop_Count        -O--CK   094   094   000    -    6551
  5 Reallocated_Sector_Ct   PO--CK   200   200   140    -    0
  7 Seek_Error_Rate         POSR-K   200   200   051    -    0
  9 Power_On_Hours          -O--CK   019   019   000    -    59294
 10 Spin_Retry_Count        PO--CK   100   100   051    -    0
 11 Calibration_Retry_Count -O--CK   100   100   000    -    0
 12 Power_Cycle_Count       -O--CK   100   100   000    -    384
183 Runtime_Bad_Block       -O--CK   100   100   000    -    0
184 End-to-End_Error        PO--CK   100   100   097    -    0
187 Reported_Uncorrect      -O--CK   100   100   000    -    0
188 Command_Timeout         -O--CK   100   100   000    -    0
190 Airflow_Temperature_Cel -O---K   063   055   040    -    37 (Min/Max 36/37)
192 Power-Off_Retract_Count -O--CK   200   200   000    -    298
193 Load_Cycle_Count        -O--CK   156   156   000    -    134110
194 Temperature_Celsius     -O---K   106   098   000    -    37
196 Reallocated_Event_Count -O--CK   200   200   000    -    0
197 Current_Pending_Sector  -O--CK   200   200   000    -    0
198 Offline_Uncorrectable   ----CK   200   200   000    -    0
199 UDMA_CRC_Error_Count    -O--CK   200   200   000    -    0
200 Multi_Zone_Error_Rate   ---R--   200   200   000    -    0
                            ||||||_ K auto-keep
                            |||||__ C event count
                            ||||___ R error rate
                            |||____ S speed/performance
                            ||_____ O updated online
                            |______ P prefailure warning

General Purpose Log Directory Version 1
SMART           Log Directory Version 1 [multi-sector log support]
Address    Access  R/W   Size  Description
0x00       GPL,SL  R/O      1  Log Directory
0x01           SL  R/O      1  Summary SMART error log
0x02           SL  R/O      5  Comprehensive SMART error log
0x03       GPL     R/O      6  Ext. Comprehensive SMART error log
0x04       GPL,SL  R/O      8  Device Statistics log
0x06           SL  R/O      1  SMART self-test log
0x07       GPL     R/O      1  Extended self-test log
0x08       GPL     R/O      2  Power Conditions log
0x09           SL  R/W      1  Selective self-test log
0x0d       GPL,SL  R/O      8  LPS Mis-alignment log
0x10       GPL     R/O      1  NCQ Command Error log
0x11       GPL     R/O      1  SATA Phy Event Counters log
0x30       GPL,SL  R/O      9  IDENTIFY DEVICE data log
0x80-0x9f  GPL,SL  R/W     16  Host vendor specific log
0xa0-0xa7  GPL,SL  VS      16  Device vendor specific log
0xa8-0xb5  GPL,SL  VS       1  Device vendor specific log
0xb6       GPL     VS    8159  Device vendor specific log
0xb6       SL      VS       1  Device vendor specific log
0xb7       GPL,SL  VS      48  Device vendor specific log
0xbd       GPL,SL  VS       1  Device vendor specific log
0xc0       GPL,SL  VS       1  Device vendor specific log
0xc1       GPL     VS      93  Device vendor specific log
0xe0       GPL,SL  R/W      1  SCT Command/Status
0xe1       GPL,SL  R/W      1  SCT Data Transfer

SMART Extended Comprehensive Error Log Version: 1 (6 sectors)
Device Error Count: 467 (device log contains only the most recent 24 errors)
	CR     = Command Register
	FEATR  = Features Register
	COUNT  = Count (was: Sector Count) Register
	LBA_48 = Upper bytes of LBA High/Mid/Low Registers ]  ATA-8
	LH     = LBA High (was: Cylinder High) Register    ]   LBA
	LM     = LBA Mid (was: Cylinder Low) Register      ] Register
	LL     = LBA Low (was: Sector Number) Register     ]
	DV     = Device (was: Device/Head) Register
	DC     = Device Control Register
	ER     = Error register
	ST     = Status register
Powered_Up_Time is measured from power on, and printed as
DDd+hh:mm:SS.sss where DD=days, hh=hours, mm=minutes,
SS=sec, and sss=millisec. It "wraps" after 49.710 days.

Error 467 [10] occurred at disk power-on lifetime: 59294 hours (2470 days + 14 hours)
  When the command that caused the error occurred, the device was active or idle.

  After command completion occurred, registers were:
  ER -- ST COUNT  LBA_48  LH LM LL DV DC
  -- -- -- == -- == == == -- -- -- -- --
  04 -- 51 00 00 00 00 00 00 00 02 e0 00

  Commands leading to the command that caused the error were:
  CR FEATR COUNT  LBA_48  LH LM LL DV DC  Powered_Up_Time  Command/Feature_Name
  -- == -- == -- == == == -- -- -- -- --  ---------------  --------------------
  b4 00 20 00 00 00 00 46 72 4c 6b e0 00     00:00:07.239  SANITIZE DEVICE
  f5 00 00 00 00 00 00 00 00 00 00 e0 00     00:00:07.239  SECURITY FREEZE LOCK
  25 00 00 00 01 00 00 00 00 00 22 40 00     00:00:06.958  READ DMA EXT
  25 00 00 00 01 00 00 00 00 00 22 40 00     00:00:06.958  READ DMA EXT
  25 00 00 00 01 00 00 00 00 00 22 40 00     00:00:06.958  READ DMA EXT

Error 466 [9] occurred at disk power-on lifetime: 59273 hours (2469 days + 17 hours)
  When the command that caused the error occurred, the device was active or idle.

  After command completion occurred, registers were:
  ER -- ST COUNT  LBA_48  LH LM LL DV DC
  -- -- -- == -- == == == -- -- -- -- --
  04 -- 51 00 00 00 00 00 00 00 02 e0 00

  Commands leading to the command that caused the error were:
  CR FEATR COUNT  LBA_48  LH LM LL DV DC  Powered_Up_Time  Command/Feature_Name
  -- == -- == -- == == == -- -- -- -- --  ---------------  --------------------
  b4 00 20 00 00 00 00 46 72 4c 6b e0 00     00:00:12.575  SANITIZE DEVICE
  f5 00 00 00 00 00 00 00 00 00 00 e0 00     00:00:12.575  SECURITY FREEZE LOCK
  25 00 00 00 01 00 00 00 00 00 22 40 00     00:00:07.500  READ DMA EXT
  25 00 00 00 01 00 00 00 00 00 22 40 00     00:00:07.500  READ DMA EXT
  25 00 00 00 01 00 00 00 00 00 22 40 00     00:00:07.500  READ DMA EXT

Error 465 [8] occurred at disk power-on lifetime: 58935 hours (2455 days + 15 hours)
  When the command that caused the error occurred, the device was active or idle.

  After command completion occurred, registers were:
  ER -- ST COUNT  LBA_48  LH LM LL DV DC
  -- -- -- == -- == == == -- -- -- -- --
  04 -- 51 00 00 00 00 00 00 00 02 e0 00

  Commands leading to the command that caused the error were:
  CR FEATR COUNT  LBA_48  LH LM LL DV DC  Powered_Up_Time  Command/Feature_Name
  -- == -- == -- == == == -- -- -- -- --  ---------------  --------------------
  b4 00 20 00 00 00 00 46 72 4c 6b e0 00     00:00:11.048  SANITIZE DEVICE
  f5 00 00 00 00 00 00 00 00 00 00 e0 00     00:00:11.048  SECURITY FREEZE LOCK
  b0 00 da 00 00 00 00 00 c2 4f 00 00 00     00:00:05.914  SMART RETURN STATUS
  ec 00 00 00 00 00 00 00 00 00 00 e0 00     00:00:05.914  IDENTIFY DEVICE
  25 00 00 00 01 00 00 00 04 08 00 40 00     00:00:05.824  READ DMA EXT

Error 464 [7] occurred at disk power-on lifetime: 58935 hours (2455 days + 15 hours)
  When the command that caused the error occurred, the device was active or idle.

  After command completion occurred, registers were:
  ER -- ST COUNT  LBA_48  LH LM LL DV DC
  -- -- -- == -- == == == -- -- -- -- --
  04 -- 51 00 00 00 00 00 00 00 02 e0 00

  Commands leading to the command that caused the error were:
  CR FEATR COUNT  LBA_48  LH LM LL DV DC  Powered_Up_Time  Command/Feature_Name
  -- == -- == -- == == == -- -- -- -- --  ---------------  --------------------
  b4 00 20 00 00 00 00 46 72 4c 6b e0 00     00:00:11.066  SANITIZE DEVICE
  f5 00 00 00 00 00 00 00 00 00 00 e0 00     00:00:11.066  SECURITY FREEZE LOCK
  25 00 00 00 01 00 00 00 00 00 22 40 00     00:00:07.402  READ DMA EXT
  25 00 00 00 01 00 00 00 00 00 22 40 00     00:00:07.402  READ DMA EXT
  25 00 00 00 01 00 00 00 00 00 22 40 00     00:00:07.402  READ DMA EXT

Error 463 [6] occurred at disk power-on lifetime: 58934 hours (2455 days + 14 hours)
  When the command that caused the error occurred, the device was active or idle.

  After command completion occurred, registers were:
  ER -- ST COUNT  LBA_48  LH LM LL DV DC
  -- -- -- == -- == == == -- -- -- -- --
  04 -- 51 00 00 00 00 00 00 00 02 e0 00

  Commands leading to the command that caused the error were:
  CR FEATR COUNT  LBA_48  LH LM LL DV DC  Powered_Up_Time  Command/Feature_Name
  -- == -- == -- == == == -- -- -- -- --  ---------------  --------------------
  b4 00 20 00 00 00 00 46 72 4c 6b e0 00     00:00:14.695  SANITIZE DEVICE
  f5 00 00 00 00 00 00 00 00 00 00 e0 00     00:00:14.695  SECURITY FREEZE LOCK
  25 00 00 00 01 00 00 00 00 00 22 40 00     00:00:07.015  READ DMA EXT
  25 00 00 00 01 00 00 00 00 00 22 40 00     00:00:07.015  READ DMA EXT
  25 00 00 00 01 00 00 00 00 00 22 40 00     00:00:07.015  READ DMA EXT

Error 462 [5] occurred at disk power-on lifetime: 58934 hours (2455 days + 14 hours)
  When the command that caused the error occurred, the device was active or idle.

  After command completion occurred, registers were:
  ER -- ST COUNT  LBA_48  LH LM LL DV DC
  -- -- -- == -- == == == -- -- -- -- --
  04 -- 51 00 00 00 00 00 00 00 02 e0 00

  Commands leading to the command that caused the error were:
  CR FEATR COUNT  LBA_48  LH LM LL DV DC  Powered_Up_Time  Command/Feature_Name
  -- == -- == -- == == == -- -- -- -- --  ---------------  --------------------
  b4 00 20 00 00 00 00 46 72 4c 6b e0 00     00:00:16.228  SANITIZE DEVICE
  f5 00 00 00 00 00 00 00 00 00 00 e0 00     00:00:16.228  SECURITY FREEZE LOCK
  b0 00 da 00 00 00 00 00 c2 4f 00 00 00     00:00:06.055  SMART RETURN STATUS
  ec 00 00 00 00 00 00 00 00 00 00 e0 00     00:00:06.055  IDENTIFY DEVICE
  25 00 00 00 01 00 00 00 04 08 00 40 00     00:00:05.956  READ DMA EXT

Error 461 [4] occurred at disk power-on lifetime: 58934 hours (2455 days + 14 hours)
  When the command that caused the error occurred, the device was active or idle.

  After command completion occurred, registers were:
  ER -- ST COUNT  LBA_48  LH LM LL DV DC
  -- -- -- == -- == == == -- -- -- -- --
  04 -- 51 00 00 00 00 00 00 00 02 e0 00

  Commands leading to the command that caused the error were:
  CR FEATR COUNT  LBA_48  LH LM LL DV DC  Powered_Up_Time  Command/Feature_Name
  -- == -- == -- == == == -- -- -- -- --  ---------------  --------------------
  b4 00 20 00 00 00 00 46 72 4c 6b e0 00     00:00:10.213  SANITIZE DEVICE
  f5 00 00 00 00 00 00 00 00 00 00 e0 00     00:00:10.213  SECURITY FREEZE LOCK
  b0 00 da 00 00 00 00 00 c2 4f 00 00 00     00:00:06.690  SMART RETURN STATUS
  ec 00 00 00 00 00 00 00 00 00 00 e0 00     00:00:06.689  IDENTIFY DEVICE
  25 00 00 00 01 00 00 00 04 08 00 40 00     00:00:06.532  READ DMA EXT

Error 460 [3] occurred at disk power-on lifetime: 58934 hours (2455 days + 14 hours)
  When the command that caused the error occurred, the device was active or idle.

  After command completion occurred, registers were:
  ER -- ST COUNT  LBA_48  LH LM LL DV DC
  -- -- -- == -- == == == -- -- -- -- --
  04 -- 51 00 00 00 00 00 00 00 02 e0 00

  Commands leading to the command that caused the error were:
  CR FEATR COUNT  LBA_48  LH LM LL DV DC  Powered_Up_Time  Command/Feature_Name
  -- == -- == -- == == == -- -- -- -- --  ---------------  --------------------
  b4 00 20 00 00 00 00 46 72 4c 6b e0 00     00:00:16.337  SANITIZE DEVICE
  f5 00 00 00 00 00 00 00 00 00 00 e0 00     00:00:16.336  SECURITY FREEZE LOCK
  b0 00 da 00 00 00 00 00 c2 4f 00 00 00     00:00:07.154  SMART RETURN STATUS
  ec 00 00 00 00 00 00 00 00 00 00 e0 00     00:00:07.153  IDENTIFY DEVICE
  25 00 00 00 01 00 00 00 04 08 00 40 00     00:00:06.995  READ DMA EXT

SMART Extended Self-test Log Version: 1 (1 sectors)
Num  Test_Description    Status                  Remaining  LifeTime(hours)  LBA_of_first_error
# 1  Short offline       Completed without error       00%         4         -

SMART Selective self-test log data structure revision number 1
 SPAN  MIN_LBA  MAX_LBA  CURRENT_TEST_STATUS
    1        0        0  Not_testing
    2        0        0  Not_testing
    3        0        0  Not_testing
    4        0        0  Not_testing
    5        0        0  Not_testing
Selective self-test flags (0x0):
  After scanning selected spans, do NOT read-scan remainder of disk.
If Selective self-test is pending on power-up, resume after 0 minute delay.

SCT Status Version:                  3
SCT Version (vendor specific):       258 (0x0102)
Device State:                        Active (0)
Current Temperature:                    37 Celsius
Power Cycle Min/Max Temperature:     36/37 Celsius
Lifetime    Min/Max Temperature:     23/45 Celsius
Under/Over Temperature Limit Count:   0/0
Vendor specific:
01 00 00 00 00 00 00 00 00 00 00 00 00 00 00 00
00 00 00 00 00 00 00 00 00 00 00 00 00 00 00 00

SCT Temperature History Version:     2
Temperature Sampling Period:         1 minute
Temperature Logging Interval:        1 minute
Min/Max recommended Temperature:      0/60 Celsius
Min/Max Temperature Limit:           -41/85 Celsius
Temperature History Size (Index):    128 (23)

SCT Error Recovery Control:
           Read:     85 (8.5 seconds)
          Write:     85 (8.5 seconds)

Device Statistics (GP Log 0x04)
Page  Offset Size        Value Flags Description
0x01  =====  =               =  ===  == General Statistics (rev 1) ==
0x01  0x008  4             384  ---  Lifetime Power-On Resets
0x01  0x010  4           59294  ---  Power-on Hours
0x01  0x018  6     15336193805  ---  Logical Sectors Written
0x01  0x020  6       102931801  ---  Number of Write Commands
0x01  0x028  6    142309957424  ---  Logical Sectors Read
0x01  0x030  6      2117085811  ---  Number of Read Commands
0x01  0x038  6      3005002496  ---  Date and Time TimeStamp
0x03  =====  =               =  ===  == Rotating Media Statistics (rev 1) ==
0x03  0x008  4           65042  ---  Spindle Motor Power-on Hours
0x03  0x010  4           23071  ---  Head Flying Hours
0x03  0x018  4          134409  ---  Head Load Events
0x03  0x020  4               0  ---  Number of Reallocated Logical Sectors
0x03  0x028  4               0  ---  Read Recovery Attempts
0x03  0x030  4               0  ---  Number of Mechanical Start Failures
0x03  0x038  4               0  ---  Number of Realloc. Candidate Logical Sectors
0x03  0x040  4             298  ---  Number of High Priority Unload Events
0x04  =====  =               =  ===  == General Errors Statistics (rev 1) ==
0x04  0x008  4               0  ---  Number of Reported Uncorrectable Errors
0x04  0x010  4               0  ---  Resets Between Cmd Acceptance and Completion
0x05  =====  =               =  ===  == Temperature Statistics (rev 1) ==
0x05  0x008  1              36  ---  Current Temperature
0x05  0x010  1              36  ---  Average Short Term Temperature
0x05  0x018  1              34  ---  Average Long Term Temperature
0x05  0x020  1              45  ---  Highest Temperature
0x05  0x028  1              23  ---  Lowest Temperature
0x05  0x030  1              42  ---  Highest Average Short Term Temperature
0x05  0x038  1              30  ---  Lowest Average Short Term Temperature
0x05  0x040  1              36  ---  Highest Average Long Term Temperature
0x05  0x048  1              32  ---  Lowest Average Long Term Temperature
0x05  0x050  4               0  ---  Time in Over-Temperature
0x05  0x058  1              60  ---  Specified Maximum Operating Temperature
0x05  0x060  4               0  ---  Time in Under-Temperature
0x05  0x068  1               0  ---  Specified Minimum Operating Temperature
0x06  =====  =               =  ===  == Transport Statistics (rev 1) ==
0x06  0x008  4            1217  ---  Number of Hardware Resets
0x06  0x010  4             776  ---  Number of ASR Events
0x06  0x018  4               0  ---  Number of Interface CRC Errors
                                |||_ C monitored condition met
                                ||__ D supports DSN
                                |___ N normalized value

Pending Defects log (GP Log 0x0c) not supported

SATA Phy Event Counters (GP Log 0x11)
ID      Size     Value  Description
0x0001  2            0  Command failed due to ICRC error
0x0002  2            0  R_ERR response for data FIS
0x0003  2            0  R_ERR response for device-to-host data FIS
0x0004  2            0  R_ERR response for host-to-device data FIS
0x0005  2            0  R_ERR response for non-data FIS
0x0006  2            0  R_ERR response for device-to-host non-data FIS
0x0007  2            0  R_ERR response for host-to-device non-data FIS
0x0008  2            0  Device-to-host non-data FIS retries
0x0009  2            2  Transition from drive PhyRdy to drive PhyNRdy
0x000a  2            2  Device-to-host register FISes sent due to a COMRESET
0x000b  2            0  CRC errors within host-to-device FIS
0x000d  2            0  Non-CRC errors within host-to-device FIS
0x000f  2            0  R_ERR response for host-to-device data FIS, CRC
0x0012  2            0  R_ERR response for host-to-device non-data FIS, CRC
0x8000  4          444  Vendor specific

