smartctl 7.2 2020-12-30 r5155 [x86_64-linux-5.19.0-43-generic] (local build)
Copyright (C) 2002-20, Bruce Allen, Christian Franke, www.smartmontools.org

=== START OF INFORMATION SECTION ===
Model Family:     Hitachi Deskstar P7K500
Device Model:     HDP725050GLA360
Serial Number:    --
LU WWN Device Id: 5 000cca ...
Firmware Version: GM4OA50E
User Capacity:    500,106,780,160 bytes [500 GB]
Sector Size:      512 bytes logical/physical
Rotation Rate:    7200 rpm
Device is:        In smartctl database [for details use: -P show]
ATA Version is:   ATA8-ACS T13/1699-D revision 4
SATA Version is:  SATA 2.6, 3.0 Gb/s
Local Time is:    Thu Jun  8 13:57:03 2023 CEST
SMART support is: Available - device has SMART capability.
SMART support is: Enabled
AAM feature is:   Disabled
APM feature is:   Disabled
Rd look-ahead is: Enabled
Write cache is:   Enabled
DSN feature is:   Unavailable
ATA Security is:  Disabled, frozen [SEC2]
Wt Cache Reorder: Enabled

=== START OF READ SMART DATA SECTION ===
SMART overall-health self-assessment test result: PASSED

General SMART Values:
Offline data collection status:  (0x84)	Offline data collection activity
					was suspended by an interrupting command from host.
					Auto Offline Data Collection: Enabled.
Self-test execution status:      (   0)	The previous self-test routine completed
					without error or no self-test has ever 
					been run.
Total time to complete Offline 
data collection: 		( 7854) seconds.
Offline data collection
capabilities: 			 (0x5b) SMART execute Offline immediate.
					Auto Offline data collection on/off support.
					Suspend Offline collection upon new
					command.
					Offline surface scan supported.
					Self-test supported.
					No Conveyance Self-test supported.
					Selective Self-test supported.
SMART capabilities:            (0x0003)	Saves SMART data before entering
					power-saving mode.
					Supports SMART auto save timer.
Error logging capability:        (0x01)	Error logging supported.
					General Purpose Logging supported.
Short self-test routine 
recommended polling time: 	 (   1) minutes.
Extended self-test routine
recommended polling time: 	 ( 131) minutes.
SCT capabilities: 	       (0x003d)	SCT Status supported.
					SCT Error Recovery Control supported.
					SCT Feature Control supported.
					SCT Data Table supported.

SMART Attributes Data Structure revision number: 16
Vendor Specific SMART Attributes with Thresholds:
ID# ATTRIBUTE_NAME          FLAGS    VALUE WORST THRESH FAIL RAW_VALUE
  1 Raw_Read_Error_Rate     PO-R--   100   100   016    -    0
  2 Throughput_Performance  P-S---   131   131   054    -    147
  3 Spin_Up_Time            POS---   126   126   024    -    308 (Average 299)
  4 Start_Stop_Count        -O--C-   095   095   000    -    22126
  5 Reallocated_Sector_Ct   PO--CK   100   100   005    -    0
  7 Seek_Error_Rate         PO-R--   100   100   067    -    0
  8 Seek_Time_Performance   P-S---   127   127   020    -    31
  9 Power_On_Hours          -O--C-   091   091   000    -    65009
 10 Spin_Retry_Count        PO--C-   100   100   060    -    0
 12 Power_Cycle_Count       -O--CK   098   098   000    -    9860
192 Power-Off_Retract_Count -O--CK   082   082   000    -    22453
193 Load_Cycle_Count        -O--C-   082   082   000    -    22453
194 Temperature_Celsius     -O----   142   142   000    -    42 (Min/Max 11/56)
196 Reallocated_Event_Count -O--CK   100   100   000    -    0
197 Current_Pending_Sector  -O---K   100   100   000    -    0
198 Offline_Uncorrectable   ---R--   100   100   000    -    0
199 UDMA_CRC_Error_Count    -O-R--   200   200   000    -    36706
                            ||||||_ K auto-keep
                            |||||__ C event count
                            ||||___ R error rate
                            |||____ S speed/performance
                            ||_____ O updated online
                            |______ P prefailure warning

General Purpose Log Directory Version 1
SMART           Log Directory Version 1 [multi-sector log support]
Address    Access  R/W   Size  Description
0x00       GPL,SL  R/O      1  Log Directory
0x01           SL  R/O      1  Summary SMART error log
0x03       GPL     R/O      1  Ext. Comprehensive SMART error log
0x06           SL  R/O      1  SMART self-test log
0x07       GPL     R/O      1  Extended self-test log
0x09           SL  R/W      1  Selective self-test log
0x10       GPL     R/O      1  NCQ Command Error log
0x11       GPL     R/O      1  SATA Phy Event Counters log
0x80-0x9f  GPL,SL  R/W     16  Host vendor specific log
0xe0       GPL,SL  R/W      1  SCT Command/Status
0xe1       GPL,SL  R/W      1  SCT Data Transfer

SMART Extended Comprehensive Error Log Version: 1 (1 sectors)
Device Error Count: 3442 (device log contains only the most recent 4 errors)
	CR     = Command Register
	FEATR  = Features Register
	COUNT  = Count (was: Sector Count) Register
	LBA_48 = Upper bytes of LBA High/Mid/Low Registers ]  ATA-8
	LH     = LBA High (was: Cylinder High) Register    ]   LBA
	LM     = LBA Mid (was: Cylinder Low) Register      ] Register
	LL     = LBA Low (was: Sector Number) Register     ]
	DV     = Device (was: Device/Head) Register
	DC     = Device Control Register
	ER     = Error register
	ST     = Status register
Powered_Up_Time is measured from power on, and printed as
DDd+hh:mm:SS.sss where DD=days, hh=hours, mm=minutes,
SS=sec, and sss=millisec. It "wraps" after 49.710 days.

Error 3442 [1] occurred at disk power-on lifetime: 63171 hours (2632 days + 3 hours)
  When the command that caused the error occurred, the device was active or idle.

  After command completion occurred, registers were:
  ER -- ST COUNT  LBA_48  LH LM LL DV DC
  -- -- -- == -- == == == -- -- -- -- --
  10 -- 51 00 01 00 00 00 c2 4f 01 00 00  Error: IDNF

  Commands leading to the command that caused the error were:
  CR FEATR COUNT  LBA_48  LH LM LL DV DC  Powered_Up_Time  Command/Feature_Name
  -- == -- == -- == == == -- -- -- -- --  ---------------  --------------------
  b0 00 d5 00 01 00 00 00 c2 4f 01 00 08     00:01:46.300  SMART READ LOG
  b0 00 d5 00 01 00 00 00 c2 4f 06 00 08     00:01:46.100  SMART READ LOG
  b0 00 d5 00 01 00 00 00 c2 4f 00 00 08     00:01:46.100  SMART READ LOG
  b0 00 d1 00 01 00 00 00 c2 4f 01 00 08     00:01:46.000  SMART READ ATTRIBUTE THRESHOLDS [OBS-4]
  b0 00 d0 00 01 00 00 00 c2 4f 00 00 08     00:01:45.900  SMART READ DATA

Error 3441 [0] occurred at disk power-on lifetime: 43661 hours (1819 days + 5 hours)
  When the command that caused the error occurred, the device was active or idle.

  After command completion occurred, registers were:
  ER -- ST COUNT  LBA_48  LH LM LL DV DC
  -- -- -- == -- == == == -- -- -- -- --
  84 -- 51 00 f0 00 00 00 0b 2e 10 40 00  Error: ICRC, ABRT at LBA = 0x000b2e10 = 732688

  Commands leading to the command that caused the error were:
  CR FEATR COUNT  LBA_48  LH LM LL DV DC  Powered_Up_Time  Command/Feature_Name
  -- == -- == -- == == == -- -- -- -- --  ---------------  --------------------
  61 01 00 00 d0 00 00 00 0b 2e 00 40 00     11:46:09.400  WRITE FPDMA QUEUED
  ef 00 90 00 03 00 00 00 00 00 00 a0 00     11:46:09.400  SET FEATURES [Disable SATA feature]
  ef 00 02 00 00 00 00 00 00 00 00 a0 00     11:46:09.400  SET FEATURES [Enable write cache]
  61 01 00 00 01 00 00 00 00 00 01 a0 ff     11:46:09.200  WRITE FPDMA QUEUED
  61 01 00 00 b0 00 00 00 0b 2d 50 40 ff     11:46:09.200  WRITE FPDMA QUEUED

Error 3440 [3] occurred at disk power-on lifetime: 43661 hours (1819 days + 5 hours)
  When the command that caused the error occurred, the device was active or idle.

  After command completion occurred, registers were:
  ER -- ST COUNT  LBA_48  LH LM LL DV DC
  -- -- -- == -- == == == -- -- -- -- --
  84 -- 51 00 01 00 00 00 00 00 01 00 00  Error: ICRC, ABRT at LBA = 0x00000001 = 1

  Commands leading to the command that caused the error were:
  CR FEATR COUNT  LBA_48  LH LM LL DV DC  Powered_Up_Time  Command/Feature_Name
  -- == -- == -- == == == -- -- -- -- --  ---------------  --------------------
  61 01 00 00 01 00 00 00 00 00 01 a0 ff     11:46:09.000  WRITE FPDMA QUEUED
  61 01 00 00 e1 00 00 00 0b 2c 1f 40 ff     11:46:09.000  WRITE FPDMA QUEUED
  61 01 00 00 c0 00 00 00 0b 2c 00 40 00     11:46:09.000  WRITE FPDMA QUEUED
  61 01 00 00 b8 00 00 00 0b 2b 00 40 00     11:46:09.000  WRITE FPDMA QUEUED
  ef 00 90 00 03 00 00 00 00 00 00 a0 00     11:46:09.000  SET FEATURES [Disable SATA feature]

Error 3439 [2] occurred at disk power-on lifetime: 43661 hours (1819 days + 5 hours)
  When the command that caused the error occurred, the device was active or idle.

  After command completion occurred, registers were:
  ER -- ST COUNT  LBA_48  LH LM LL DV DC
  -- -- -- == -- == == == -- -- -- -- --
  84 -- 51 00 01 00 00 00 00 00 01 00 00  Error: ICRC, ABRT at LBA = 0x00000001 = 1

  Commands leading to the command that caused the error were:
  CR FEATR COUNT  LBA_48  LH LM LL DV DC  Powered_Up_Time  Command/Feature_Name
  -- == -- == -- == == == -- -- -- -- --  ---------------  --------------------
  61 01 00 00 01 00 00 00 00 00 01 a0 ff     11:46:08.600  WRITE FPDMA QUEUED
  61 01 00 00 70 00 00 00 0b 29 90 40 ff     11:46:08.600  WRITE FPDMA QUEUED
  61 01 00 00 a8 00 00 00 0b 29 00 40 00     11:46:08.600  WRITE FPDMA QUEUED
  61 00 80 00 a0 00 00 00 0b 28 80 40 00     11:46:08.600  WRITE FPDMA QUEUED
  ef 00 90 00 03 00 00 00 00 00 00 a0 00     11:46:07.800  SET FEATURES [Disable SATA feature]

SMART Extended Self-test Log Version: 1 (1 sectors)
No self-tests have been logged.  [To run self-tests, use: smartctl -t]

SMART Selective self-test log data structure revision number 1
 SPAN  MIN_LBA  MAX_LBA  CURRENT_TEST_STATUS
    1        0        0  Not_testing
    2        0        0  Not_testing
    3        0        0  Not_testing
    4        0        0  Not_testing
    5        0        0  Not_testing
Selective self-test flags (0x0):
  After scanning selected spans, do NOT read-scan remainder of disk.
If Selective self-test is pending on power-up, resume after 0 minute delay.

SCT Status Version:                  3
SCT Version (vendor specific):       256 (0x0100)
Device State:                        SMART Off-line Data Collection executing in background (4)
Current Temperature:                    42 Celsius
Power Cycle Min/Max Temperature:     23/42 Celsius
Lifetime    Min/Max Temperature:     11/56 Celsius
Under/Over Temperature Limit Count:   0/0

SCT Temperature History Version:     2
Temperature Sampling Period:         1 minute
Temperature Logging Interval:        1 minute
Min/Max recommended Temperature:      0/60 Celsius
Min/Max Temperature Limit:           -40/70 Celsius
Temperature History Size (Index):    128 (77)

SCT Error Recovery Control:
           Read: Disabled
          Write: Disabled

Device Statistics (GP/SMART Log 0x04) not supported

Pending Defects log (GP Log 0x0c) not supported

SATA Phy Event Counters (GP Log 0x11)
ID      Size     Value  Description
0x0001  2            0  Command failed due to ICRC error
0x0009  2            0  Transition from drive PhyRdy to drive PhyNRdy
0x000a  2            1  Device-to-host register FISes sent due to a COMRESET
0x000b  2            0  CRC errors within host-to-device FIS
0x000d  2            0  Non-CRC errors within host-to-device FIS

