=== START OF INFORMATION SECTION ===
Model Family:     Hitachi Deskstar P7K500
Device Model:     Hitachi HDP725050GLA360
Serial Number:    --
LU WWN Device Id: 5 000cca ...
Firmware Version: GM4OA5CA
User Capacity:    500 107 862 016 bytes [500 GB]
Sector Size:      512 bytes logical/physical
Rotation Rate:    7200 rpm
Device is:        In smartctl database [for details use: -P show]
ATA Version is:   ATA8-ACS T13/1699-D revision 4
SATA Version is:  SATA 2.6, 3.0 Gb/s
Local Time is:    Sun Nov 22 14:01:26 2015 MSK
SMART support is: Available - device has SMART capability.
SMART support is: Enabled
AAM feature is:   Disabled
APM feature is:   Disabled
Rd look-ahead is: Enabled
Write cache is:   Enabled
ATA Security is:  Disabled, NOT FROZEN [SEC1]
Wt Cache Reorder: Enabled

=== START OF READ SMART DATA SECTION ===
SMART overall-health self-assessment test result: PASSED

General SMART Values:
Offline data collection status:  (0x84)	Offline data collection activity
					was suspended by an interrupting command from host.
					Auto Offline Data Collection: Enabled.
Self-test execution status:      (   0)	The previous self-test routine completed
					without error or no self-test has ever 
					been run.
Total time to complete Offline 
data collection: 		( 7890) seconds.
Offline data collection
capabilities: 			 (0x5b) SMART execute Offline immediate.
					Auto Offline data collection on/off support.
					Suspend Offline collection upon new
					command.
					Offline surface scan supported.
					Self-test supported.
					No Conveyance Self-test supported.
					Selective Self-test supported.
SMART capabilities:            (0x0003)	Saves SMART data before entering
					power-saving mode.
					Supports SMART auto save timer.
Error logging capability:        (0x01)	Error logging supported.
					General Purpose Logging supported.
Short self-test routine 
recommended polling time: 	 (   1) minutes.
Extended self-test routine
recommended polling time: 	 ( 131) minutes.
SCT capabilities: 	       (0x003d)	SCT Status supported.
					SCT Error Recovery Control supported.
					SCT Feature Control supported.
					SCT Data Table supported.

SMART Attributes Data Structure revision number: 16
Vendor Specific SMART Attributes with Thresholds:
ID# ATTRIBUTE_NAME          FLAGS    VALUE WORST THRESH FAIL RAW_VALUE
  1 Raw_Read_Error_Rate     PO-R--   100   100   016    -    0
  2 Throughput_Performance  P-S---   100   100   054    -    0
  3 Spin_Up_Time            POS---   127   127   024    -    300 (Average 304)
  4 Start_Stop_Count        -O--C-   099   099   000    -    6991
  5 Reallocated_Sector_Ct   PO--CK   100   100   005    -    4
  7 Seek_Error_Rate         PO-R--   100   100   067    -    0
  8 Seek_Time_Performance   P-S---   131   131   020    -    29
  9 Power_On_Hours          -O--C-   097   097   000    -    27575
 10 Spin_Retry_Count        PO--C-   100   100   060    -    0
 12 Power_Cycle_Count       -O--CK   099   099   000    -    6336
192 Power-Off_Retract_Count -O--CK   095   095   000    -    6998
193 Load_Cycle_Count        -O--C-   095   095   000    -    6998
194 Temperature_Celsius     -O----   171   171   000    -    35 (Min/Max 7/48)
196 Reallocated_Event_Count -O--CK   100   100   000    -    4
197 Current_Pending_Sector  -O---K   100   100   000    -    0
198 Offline_Uncorrectable   ---R--   100   100   000    -    0
199 UDMA_CRC_Error_Count    -O-R--   200   200   000    -    0
                            ||||||_ K auto-keep
                            |||||__ C event count
                            ||||___ R error rate
                            |||____ S speed/performance
                            ||_____ O updated online
                            |______ P prefailure warning

General Purpose Log Directory Version 1
SMART           Log Directory Version 1 [multi-sector log support]
Address    Access  R/W   Size  Description
0x00       GPL,SL  R/O      1  Log Directory
0x01           SL  R/O      1  Summary SMART error log
0x03       GPL     R/O      1  Ext. Comprehensive SMART error log
0x06           SL  R/O      1  SMART self-test log
0x07       GPL     R/O      1  Extended self-test log
0x09           SL  R/W      1  Selective self-test log
0x10       GPL     R/O      1  NCQ Command Error log
0x11       GPL     R/O      1  SATA Phy Event Counters
0x20       GPL     R/O      1  Streaming performance log [OBS-8]
0x21       GPL     R/O      1  Write stream error log
0x22       GPL     R/O      1  Read stream error log
0x80-0x9f  GPL,SL  R/W     16  Host vendor specific log
0xe0       GPL,SL  R/W      1  SCT Command/Status
0xe1       GPL,SL  R/W      1  SCT Data Transfer

SMART Extended Comprehensive Error Log Version: 1 (1 sectors)
Device Error Count: 20208 (device log contains only the most recent 4 errors)
	CR     = Command Register
	FEATR  = Features Register
	COUNT  = Count (was: Sector Count) Register
	LBA_48 = Upper bytes of LBA High/Mid/Low Registers ]  ATA-8
	LH     = LBA High (was: Cylinder High) Register    ]   LBA
	LM     = LBA Mid (was: Cylinder Low) Register      ] Register
	LL     = LBA Low (was: Sector Number) Register     ]
	DV     = Device (was: Device/Head) Register
	DC     = Device Control Register
	ER     = Error register
	ST     = Status register
Powered_Up_Time is measured from power on, and printed as
DDd+hh:mm:SS.sss where DD=days, hh=hours, mm=minutes,
SS=sec, and sss=millisec. It "wraps" after 49.710 days.

Error 20208 [3] occurred at disk power-on lifetime: 2702 hours (112 days + 14 hours)
  When the command that caused the error occurred, the device was active or idle.

  After command completion occurred, registers were:
  ER -- ST COUNT  LBA_48  LH LM LL DV DC
  -- -- -- == -- == == == -- -- -- -- --
  40 -- 51 00 39 00 00 01 99 2c e8 e1 00  Error: UNC 57 sectors at LBA = 0x01992ce8 = 26815720

  Commands leading to the command that caused the error were:
  CR FEATR COUNT  LBA_48  LH LM LL DV DC  Powered_Up_Time  Command/Feature_Name
  -- == -- == -- == == == -- -- -- -- --  ---------------  --------------------
  25 d8 00 00 3a 00 00 01 99 2c e7 e0 00     00:20:14.900  READ DMA EXT
  35 d8 00 00 08 00 00 00 5e 00 47 e0 00     00:20:14.900  WRITE DMA EXT
  25 d8 00 00 01 00 00 00 00 00 00 e0 00     00:20:14.900  READ DMA EXT
  25 d8 00 00 08 00 00 07 b3 05 18 e0 00     00:20:14.800  READ DMA EXT
  35 d8 00 00 80 00 00 05 64 a6 0f e0 00     00:20:14.800  WRITE DMA EXT

Error 20207 [2] occurred at disk power-on lifetime: 2702 hours (112 days + 14 hours)
  When the command that caused the error occurred, the device was active or idle.

  After command completion occurred, registers were:
  ER -- ST COUNT  LBA_48  LH LM LL DV DC
  -- -- -- == -- == == == -- -- -- -- --
  40 -- 51 00 39 00 00 01 99 2c e8 e1 00  Error: UNC 57 sectors at LBA = 0x01992ce8 = 26815720

  Commands leading to the command that caused the error were:
  CR FEATR COUNT  LBA_48  LH LM LL DV DC  Powered_Up_Time  Command/Feature_Name
  -- == -- == -- == == == -- -- -- -- --  ---------------  --------------------
  25 d8 00 00 3a 00 00 01 99 2c e7 e0 00     00:20:10.500  READ DMA EXT
  35 d8 00 00 10 00 00 00 60 11 1f e0 00     00:20:10.500  WRITE DMA EXT
  35 d8 00 00 10 00 00 00 5f 7e 1f e0 00     00:20:10.500  WRITE DMA EXT
  25 d8 00 00 08 00 00 0e 56 07 78 e0 00     00:20:10.500  READ DMA EXT
  35 d8 00 00 80 00 00 05 64 a3 0f e0 00     00:20:10.500  WRITE DMA EXT

Error 20206 [1] occurred at disk power-on lifetime: 2702 hours (112 days + 14 hours)
  When the command that caused the error occurred, the device was active or idle.

  After command completion occurred, registers were:
  ER -- ST COUNT  LBA_48  LH LM LL DV DC
  -- -- -- == -- == == == -- -- -- -- --
  40 -- 51 00 39 00 00 01 99 2c e8 e1 00  Error: UNC 57 sectors at LBA = 0x01992ce8 = 26815720

  Commands leading to the command that caused the error were:
  CR FEATR COUNT  LBA_48  LH LM LL DV DC  Powered_Up_Time  Command/Feature_Name
  -- == -- == -- == == == -- -- -- -- --  ---------------  --------------------
  25 d8 00 00 3a 00 00 01 99 2c e7 e0 00     00:20:06.200  READ DMA EXT
  25 d8 00 00 08 00 00 1e 55 04 88 e0 00     00:20:06.200  READ DMA EXT
  35 d8 00 00 50 00 00 00 60 0f 27 e0 00     00:20:06.100  WRITE DMA EXT
  35 d8 00 00 08 00 00 00 60 0f 0f e0 00     00:20:05.400  WRITE DMA EXT
  35 d8 00 00 08 00 00 00 60 0d 3f e0 00     00:20:05.400  WRITE DMA EXT

Error 20205 [0] occurred at disk power-on lifetime: 2702 hours (112 days + 14 hours)
  When the command that caused the error occurred, the device was active or idle.

  After command completion occurred, registers were:
  ER -- ST COUNT  LBA_48  LH LM LL DV DC
  -- -- -- == -- == == == -- -- -- -- --
  40 -- 51 00 32 00 00 01 99 21 65 e1 00  Error: UNC 50 sectors at LBA = 0x01992165 = 26812773

  Commands leading to the command that caused the error were:
  CR FEATR COUNT  LBA_48  LH LM LL DV DC  Powered_Up_Time  Command/Feature_Name
  -- == -- == -- == == == -- -- -- -- --  ---------------  --------------------
  25 00 00 00 40 00 00 01 99 21 57 e0 00     00:15:54.100  READ DMA EXT
  25 00 00 00 80 00 00 03 57 9e 7f e0 00     00:15:54.100  READ DMA EXT
  25 00 00 00 80 00 00 03 57 9d ff e0 00     00:15:54.100  READ DMA EXT
  25 00 00 00 80 00 00 03 57 9d 7f e0 00     00:15:54.100  READ DMA EXT
  25 00 00 00 80 00 00 03 57 9c ff e0 00     00:15:54.100  READ DMA EXT

SMART Extended Self-test Log Version: 1 (1 sectors)
Num  Test_Description    Status                  Remaining  LifeTime(hours)  LBA_of_first_error
# 1  Short offline       Completed without error       00%     26392         -
# 2  Short offline       Completed without error       00%     11669         -

SMART Selective self-test log data structure revision number 1
 SPAN  MIN_LBA  MAX_LBA  CURRENT_TEST_STATUS
    1        0        0  Not_testing
    2        0        0  Not_testing
    3        0        0  Not_testing
    4        0        0  Not_testing
    5        0        0  Not_testing
Selective self-test flags (0x0):
  After scanning selected spans, do NOT read-scan remainder of disk.
If Selective self-test is pending on power-up, resume after 0 minute delay.

SCT Status Version:                  3
SCT Version (vendor specific):       256 (0x0100)
SCT Support Level:                   1
Device State:                        SMART Off-line Data Collection executing in background (4)
Current Temperature:                    35 Celsius
Power Cycle Min/Max Temperature:     35/35 Celsius
Lifetime    Min/Max Temperature:      7/48 Celsius
Under/Over Temperature Limit Count:   0/0

SCT Temperature History Version:     2
Temperature Sampling Period:         1 minute
Temperature Logging Interval:        1 minute
Min/Max recommended Temperature:      0/60 Celsius
Min/Max Temperature Limit:           -40/70 Celsius
Temperature History Size (Index):    128 (52)

SCT Error Recovery Control:
           Read: Disabled
          Write: Disabled

Device Statistics (GP Log 0x04) not supported

SATA Phy Event Counters (GP Log 0x11)
ID      Size     Value  Description
0x0001  2            0  Command failed due to ICRC error
0x0009  2            0  Transition from drive PhyRdy to drive PhyNRdy
0x000a  2            6  Device-to-host register FISes sent due to a COMRESET
0x000b  2            0  CRC errors within host-to-device FIS
0x000d  2            0  Non-CRC errors within host-to-device FIS

