=== START OF INFORMATION SECTION ===
Model Family:     SAMSUNG SpinPoint F3
Device Model:     SAMSUNG HD502HJ
Serial Number:    --
LU WWN Device Id: 5 0024e9 ...
Firmware Version: 1AJ10001
User Capacity:    500,107,862,016 bytes [500 GB]
Sector Size:      512 bytes logical/physical
Rotation Rate:    7200 rpm
Form Factor:      3.5 inches
Device is:        In smartctl database [for details use: -P show]
ATA Version is:   ATA8-ACS T13/1699-D revision 6
SATA Version is:  SATA 2.6, 3.0 Gb/s
Local Time is:    Mon Jun 21 06:35:36 2021 CEST
SMART support is: Available - device has SMART capability.
SMART support is: Enabled
AAM feature is:   Disabled
APM feature is:   Disabled
Rd look-ahead is: Enabled
Write cache is:   Enabled
DSN feature is:   Unavailable
ATA Security is:  Disabled, NOT FROZEN [SEC1]
Wt Cache Reorder: Enabled

=== START OF READ SMART DATA SECTION ===
SMART overall-health self-assessment test result: PASSED

General SMART Values:
Offline data collection status:  (0x80)	Offline data collection activity
					was never started.
					Auto Offline Data Collection: Enabled.
Self-test execution status:      (  34)	The self-test routine was interrupted
					by the host with a hard or soft reset.
Total time to complete Offline 
data collection: 		( 4740) seconds.
Offline data collection
capabilities: 			 (0x5b) SMART execute Offline immediate.
					Auto Offline data collection on/off support.
					Suspend Offline collection upon new
					command.
					Offline surface scan supported.
					Self-test supported.
					No Conveyance Self-test supported.
					Selective Self-test supported.
SMART capabilities:            (0x0003)	Saves SMART data before entering
					power-saving mode.
					Supports SMART auto save timer.
Error logging capability:        (0x01)	Error logging supported.
					General Purpose Logging supported.
Short self-test routine 
recommended polling time: 	 (   2) minutes.
Extended self-test routine
recommended polling time: 	 (  79) minutes.
SCT capabilities: 	       (0x003f)	SCT Status supported.
					SCT Error Recovery Control supported.
					SCT Feature Control supported.
					SCT Data Table supported.

SMART Attributes Data Structure revision number: 16
Vendor Specific SMART Attributes with Thresholds:
ID# ATTRIBUTE_NAME          FLAGS    VALUE WORST THRESH FAIL RAW_VALUE
  1 Raw_Read_Error_Rate     POSR-K   100   100   051    -    4319
  2 Throughput_Performance  -OS--K   055   055   000    -    4337
  3 Spin_Up_Time            PO---K   083   079   025    -    5252
  4 Start_Stop_Count        -O--CK   086   086   000    -    14737
  5 Reallocated_Sector_Ct   PO--CK   252   252   010    -    0
  7 Seek_Error_Rate         -OSR-K   252   252   051    -    0
  8 Seek_Time_Performance   --S--K   252   252   015    -    0
  9 Power_On_Hours          -O--CK   100   100   000    -    38051
 10 Spin_Retry_Count        -O--CK   252   252   051    -    0
 11 Calibration_Retry_Count -O--CK   252   252   000    -    0
 12 Power_Cycle_Count       -O--CK   086   086   000    -    14958
191 G-Sense_Error_Rate      -O---K   100   100   000    -    79
192 Power-Off_Retract_Count -O---K   252   252   000    -    0
194 Temperature_Celsius     -O----   064   057   000    -    35 (Min/Max 10/43)
195 Hardware_ECC_Recovered  -O-RCK   100   100   000    -    0
196 Reallocated_Event_Count -O--CK   252   252   000    -    0
197 Current_Pending_Sector  -O--CK   252   100   000    -    0
198 Offline_Uncorrectable   ----CK   252   252   000    -    0
199 UDMA_CRC_Error_Count    -OS-CK   071   001   000    -    15859
200 Multi_Zone_Error_Rate   -O-R-K   001   001   000    -    82903
223 Load_Retry_Count        -O--CK   252   252   000    -    0
225 Load_Cycle_Count        -O--CK   099   099   000    -    15301
                            ||||||_ K auto-keep
                            |||||__ C event count
                            ||||___ R error rate
                            |||____ S speed/performance
                            ||_____ O updated online
                            |______ P prefailure warning

General Purpose Log Directory Version 1
SMART           Log Directory Version 1 [multi-sector log support]
Address    Access  R/W   Size  Description
0x00       GPL,SL  R/O      1  Log Directory
0x01           SL  R/O      1  Summary SMART error log
0x02           SL  R/O      2  Comprehensive SMART error log
0x03       GPL     R/O      2  Ext. Comprehensive SMART error log
0x06           SL  R/O      1  SMART self-test log
0x07       GPL     R/O      2  Extended self-test log
0x08       GPL     R/O      2  Power Conditions log
0x09           SL  R/W      1  Selective self-test log
0x10       GPL     R/O      1  NCQ Command Error log
0x11       GPL     R/O      1  SATA Phy Event Counters log
0x80-0x9f  GPL,SL  R/W     16  Host vendor specific log
0xe0       GPL,SL  R/W      1  SCT Command/Status
0xe1       GPL,SL  R/W      1  SCT Data Transfer

SMART Extended Comprehensive Error Log Version: 1 (2 sectors)
Device Error Count: 19665 (device log contains only the most recent 8 errors)
	CR     = Command Register
	FEATR  = Features Register
	COUNT  = Count (was: Sector Count) Register
	LBA_48 = Upper bytes of LBA High/Mid/Low Registers ]  ATA-8
	LH     = LBA High (was: Cylinder High) Register    ]   LBA
	LM     = LBA Mid (was: Cylinder Low) Register      ] Register
	LL     = LBA Low (was: Sector Number) Register     ]
	DV     = Device (was: Device/Head) Register
	DC     = Device Control Register
	ER     = Error register
	ST     = Status register
Powered_Up_Time is measured from power on, and printed as
DDd+hh:mm:SS.sss where DD=days, hh=hours, mm=minutes,
SS=sec, and sss=millisec. It "wraps" after 49.710 days.

Error 19665 [0] occurred at disk power-on lifetime: 37993 hours (1583 days + 1 hours)
  When the command that caused the error occurred, the device was active or idle.

  After command completion occurred, registers were:
  ER -- ST COUNT  LBA_48  LH LM LL DV DC
  -- -- -- == -- == == == -- -- -- -- --
  84 -- 51 c5 00 00 00 00 00 00 00 e0 00  Error: ICRC, ABRT 50432 sectors at LBA = 0x00000000 = 0

  Commands leading to the command that caused the error were:
  CR FEATR COUNT  LBA_48  LH LM LL DV DC  Powered_Up_Time  Command/Feature_Name
  -- == -- == -- == == == -- -- -- -- --  ---------------  --------------------
  35 00 00 04 00 00 00 0b 40 c1 00 e0 08     00:00:00.068  WRITE DMA EXT
  35 00 00 04 00 00 00 0b 40 bd 00 e0 08     00:00:00.067  WRITE DMA EXT
  25 00 00 01 00 00 00 31 19 99 f0 e0 08     00:00:00.067  READ DMA EXT
  35 00 00 04 00 00 00 0b 40 b9 00 e0 08     00:00:00.067  WRITE DMA EXT
  25 00 00 00 48 00 00 31 17 ff 18 e0 08     00:00:00.067  READ DMA EXT

Error 19664 [7] occurred at disk power-on lifetime: 36892 hours (1537 days + 4 hours)
  When the command that caused the error occurred, the device was active or idle.

  After command completion occurred, registers were:
  ER -- ST COUNT  LBA_48  LH LM LL DV DC
  -- -- -- == -- == == == -- -- -- -- --
  40 -- 51 00 01 00 00 00 74 67 55 e0 00  Error: UNC 1 sectors at LBA = 0x00746755 = 7628629

  Commands leading to the command that caused the error were:
  CR FEATR COUNT  LBA_48  LH LM LL DV DC  Powered_Up_Time  Command/Feature_Name
  -- == -- == -- == == == -- -- -- -- --  ---------------  --------------------
  25 00 00 00 01 00 00 00 74 67 55 e0 00     00:00:09.761  READ DMA EXT
  25 00 00 00 10 00 00 00 3a 20 80 e0 00     00:00:09.761  READ DMA EXT
  25 00 00 00 38 00 00 00 11 af 70 e0 00     00:00:09.761  READ DMA EXT
  25 00 00 00 40 00 00 01 64 18 90 e0 00     00:00:09.761  READ DMA EXT
  25 00 00 01 00 00 00 01 64 17 90 e0 00     00:00:09.761  READ DMA EXT

Error 19663 [6] occurred at disk power-on lifetime: 36892 hours (1537 days + 4 hours)
  When the command that caused the error occurred, the device was active or idle.

  After command completion occurred, registers were:
  ER -- ST COUNT  LBA_48  LH LM LL DV DC
  -- -- -- == -- == == == -- -- -- -- --
  40 -- 51 00 0b 00 00 00 74 67 55 e0 00  Error: UNC 11 sectors at LBA = 0x00746755 = 7628629

  Commands leading to the command that caused the error were:
  CR FEATR COUNT  LBA_48  LH LM LL DV DC  Powered_Up_Time  Command/Feature_Name
  -- == -- == -- == == == -- -- -- -- --  ---------------  --------------------
  25 00 00 00 20 00 00 00 74 67 40 e0 00     00:00:09.759  READ DMA EXT
  35 00 00 00 08 00 00 00 74 67 20 e0 00     00:00:09.759  WRITE DMA EXT
  25 00 00 00 38 00 00 00 11 af 70 e0 00     00:00:09.759  READ DMA EXT
  35 00 00 00 20 00 00 05 7e 0a c0 e0 00     00:00:09.759  WRITE DMA EXT
  25 00 00 00 38 00 00 00 11 af 70 e0 00     00:00:09.759  READ DMA EXT

Error 19662 [5] occurred at disk power-on lifetime: 36890 hours (1537 days + 2 hours)
  When the command that caused the error occurred, the device was active or idle.

  After command completion occurred, registers were:
  ER -- ST COUNT  LBA_48  LH LM LL DV DC
  -- -- -- == -- == == == -- -- -- -- --
  40 -- 51 00 ab 00 00 00 74 67 55 e0 00  Error: UNC 171 sectors at LBA = 0x00746755 = 7628629

  Commands leading to the command that caused the error were:
  CR FEATR COUNT  LBA_48  LH LM LL DV DC  Powered_Up_Time  Command/Feature_Name
  -- == -- == -- == == == -- -- -- -- --  ---------------  --------------------
  25 00 00 01 00 00 00 00 74 67 00 e0 00     00:00:04.962  READ DMA EXT
  25 00 00 00 38 00 00 00 22 79 28 e0 00     00:00:04.962  READ DMA EXT
  25 00 00 00 38 00 00 00 11 af 70 e0 00     00:00:04.962  READ DMA EXT
  25 00 00 00 38 00 00 00 22 79 28 e0 00     00:00:04.962  READ DMA EXT
  25 00 00 00 38 00 00 00 11 af 70 e0 00     00:00:04.962  READ DMA EXT

Error 19661 [4] occurred at disk power-on lifetime: 36890 hours (1537 days + 2 hours)
  When the command that caused the error occurred, the device was active or idle.

  After command completion occurred, registers were:
  ER -- ST COUNT  LBA_48  LH LM LL DV DC
  -- -- -- == -- == == == -- -- -- -- --
  40 -- 51 00 ab 00 00 00 74 67 55 e0 00  Error: UNC 171 sectors at LBA = 0x00746755 = 7628629

  Commands leading to the command that caused the error were:
  CR FEATR COUNT  LBA_48  LH LM LL DV DC  Powered_Up_Time  Command/Feature_Name
  -- == -- == -- == == == -- -- -- -- --  ---------------  --------------------
  25 00 00 01 00 00 00 00 74 67 00 e0 00     00:00:04.961  READ DMA EXT
  25 00 00 00 38 00 00 00 11 af 70 e0 00     00:00:04.961  READ DMA EXT
  25 00 00 00 38 00 00 00 22 79 28 e0 00     00:00:04.961  READ DMA EXT
  25 00 00 00 38 00 00 00 11 af 70 e0 00     00:00:04.961  READ DMA EXT
  25 00 00 00 38 00 00 00 22 79 28 e0 00     00:00:04.961  READ DMA EXT

Error 19660 [3] occurred at disk power-on lifetime: 36890 hours (1537 days + 2 hours)
  When the command that caused the error occurred, the device was active or idle.

  After command completion occurred, registers were:
  ER -- ST COUNT  LBA_48  LH LM LL DV DC
  -- -- -- == -- == == == -- -- -- -- --
  40 -- 51 00 ab 00 00 00 74 67 55 e0 00  Error: UNC 171 sectors at LBA = 0x00746755 = 7628629

  Commands leading to the command that caused the error were:
  CR FEATR COUNT  LBA_48  LH LM LL DV DC  Powered_Up_Time  Command/Feature_Name
  -- == -- == -- == == == -- -- -- -- --  ---------------  --------------------
  25 00 00 01 00 00 00 00 74 67 00 e0 00     00:00:04.960  READ DMA EXT
  25 00 00 00 38 00 00 00 11 af 70 e0 00     00:00:04.960  READ DMA EXT
  35 00 00 00 08 00 00 00 31 b2 50 e0 00     00:00:04.960  WRITE DMA EXT
  25 00 00 00 38 00 00 00 11 af 70 e0 00     00:00:04.960  READ DMA EXT
  25 00 00 00 38 00 00 00 11 af 70 e0 00     00:00:04.960  READ DMA EXT

Error 19659 [2] occurred at disk power-on lifetime: 36890 hours (1537 days + 2 hours)
  When the command that caused the error occurred, the device was active or idle.

  After command completion occurred, registers were:
  ER -- ST COUNT  LBA_48  LH LM LL DV DC
  -- -- -- == -- == == == -- -- -- -- --
  40 -- 51 00 ab 00 00 00 74 67 55 e0 00  Error: UNC 171 sectors at LBA = 0x00746755 = 7628629

  Commands leading to the command that caused the error were:
  CR FEATR COUNT  LBA_48  LH LM LL DV DC  Powered_Up_Time  Command/Feature_Name
  -- == -- == -- == == == -- -- -- -- --  ---------------  --------------------
  25 00 00 01 00 00 00 00 74 67 00 e0 00     00:00:04.958  READ DMA EXT
  25 00 00 00 38 00 00 00 11 af 70 e0 00     00:00:04.958  READ DMA EXT
  35 00 00 00 28 00 00 03 e9 c5 60 e0 00     00:00:04.958  WRITE DMA EXT
  25 00 00 00 38 00 00 00 11 af 70 e0 00     00:00:04.958  READ DMA EXT
  25 00 00 00 38 00 00 00 11 af 70 e0 00     00:00:04.958  READ DMA EXT

Error 19658 [1] occurred at disk power-on lifetime: 36890 hours (1537 days + 2 hours)
  When the command that caused the error occurred, the device was active or idle.

  After command completion occurred, registers were:
  ER -- ST COUNT  LBA_48  LH LM LL DV DC
  -- -- -- == -- == == == -- -- -- -- --
  40 -- 51 00 ab 00 00 00 74 67 55 e0 00  Error: UNC 171 sectors at LBA = 0x00746755 = 7628629

  Commands leading to the command that caused the error were:
  CR FEATR COUNT  LBA_48  LH LM LL DV DC  Powered_Up_Time  Command/Feature_Name
  -- == -- == -- == == == -- -- -- -- --  ---------------  --------------------
  25 00 00 01 00 00 00 00 74 67 00 e0 00     00:00:04.957  READ DMA EXT
  25 00 00 00 38 00 00 00 11 af 70 e0 00     00:00:04.957  READ DMA EXT
  25 00 00 00 38 00 00 00 11 af 70 e0 00     00:00:04.957  READ DMA EXT
  25 00 00 00 38 00 00 00 11 af 70 e0 00     00:00:04.957  READ DMA EXT
  25 00 00 00 38 00 00 00 11 af 70 e0 00     00:00:04.957  READ DMA EXT

SMART Extended Self-test Log Version: 1 (2 sectors)
Num  Test_Description    Status                  Remaining  LifeTime(hours)  LBA_of_first_error
# 1  Extended offline    Interrupted (host reset)      20%     38042         -
# 2  Extended offline    Interrupted (host reset)      50%     37945         -
# 3  Extended offline    Completed without error       00%     37741         -
# 4  Extended offline    Completed without error       00%     37468         -
# 5  Extended offline    Completed without error       00%     36996         -
# 6  Short offline       Interrupted (host reset)      60%     16448         -
# 7  Short offline       Completed without error       00%     16398         -
# 8  Short offline       Completed without error       00%     16345         -
# 9  Short offline       Completed without error       00%     16293         -
#10  Short offline       Completed without error       00%     16261         -
#11  Short offline       Completed without error       00%     16235         -
#12  Short offline       Completed without error       00%     16207         -
#13  Short offline       Completed without error       00%     16149         -
#14  Short offline       Completed without error       00%     16105         -
#15  Short offline       Completed without error       00%     16041         -
#16  Short offline       Completed without error       00%     15988         -
#17  Short offline       Completed without error       00%     15966         -
#18  Short offline       Completed without error       00%     15892         -
#19  Short offline       Completed without error       00%     15873         -
#20  Short offline       Completed without error       00%     15843         -
#21  Short offline       Completed without error       00%     15803         -

SMART Selective self-test log data structure revision number 0
Note: revision number not 1 implies that no selective self-test has ever been run
 SPAN  MIN_LBA  MAX_LBA  CURRENT_TEST_STATUS
    1        0        0  Interrupted [20% left] (0-65535)
    2        0        0  Not_testing
    3        0        0  Not_testing
    4        0        0  Not_testing
    5        0        0  Not_testing
Selective self-test flags (0x0):
  After scanning selected spans, do NOT read-scan remainder of disk.
If Selective self-test is pending on power-up, resume after 0 minute delay.

SCT Status Version:                  2
SCT Version (vendor specific):       256 (0x0100)
Device State:                        Active (0)
Current Temperature:                    35 Celsius
Power Cycle Min/Max Temperature:     33/35 Celsius
Lifetime    Min/Max Temperature:     13/62 Celsius
Specified Max Operating Temperature:    80 Celsius
Under/Over Temperature Limit Count:   0/0

SCT Temperature History Version:     2
Temperature Sampling Period:         5 minutes
Temperature Logging Interval:        5 minutes
Min/Max recommended Temperature:     -5/80 Celsius
Min/Max Temperature Limit:           -10/85 Celsius
Temperature History Size (Index):    128 (65)

SCT Error Recovery Control:
           Read: Disabled
          Write: Disabled

Device Statistics (GP/SMART Log 0x04) not supported

Pending Defects log (GP Log 0x0c) not supported

SATA Phy Event Counters (GP Log 0x11)
ID      Size     Value  Description
0x0001  4            0  Command failed due to ICRC error
0x0002  4            0  R_ERR response for data FIS
0x0003  4            0  R_ERR response for device-to-host data FIS
0x0004  4            0  R_ERR response for host-to-device data FIS
0x0005  4            2  R_ERR response for non-data FIS
0x0006  4            2  R_ERR response for device-to-host non-data FIS
0x0007  4            0  R_ERR response for host-to-device non-data FIS
0x0008  4            2  Device-to-host non-data FIS retries
0x0009  4            5  Transition from drive PhyRdy to drive PhyNRdy
0x000a  4            5  Device-to-host register FISes sent due to a COMRESET
0x000b  4            0  CRC errors within host-to-device FIS
0x000d  4            0  Non-CRC errors within host-to-device FIS
0x000f  4            0  R_ERR response for host-to-device data FIS, CRC
0x0010  4            0  R_ERR response for host-to-device data FIS, non-CRC
0x0012  4            0  R_ERR response for host-to-device non-data FIS, CRC
0x0013  4            0  R_ERR response for host-to-device non-data FIS, non-CRC
0x8e00  4           22  Vendor specific
0x8e01  4           23  Vendor specific
0x8e02  4            0  Vendor specific
0x8e03  4            0  Vendor specific
0x8e04  4            0  Vendor specific
0x8e05  4            0  Vendor specific
0x8e06  4        47938  Vendor specific
0x8e07  4        45967  Vendor specific
0x8e08  4           88  Vendor specific
0x8e09  4       983190  Vendor specific
0x8e0a  4      1128487  Vendor specific
0x8e0b  4     84669056  Vendor specific
0x8e0c  4       533378  Vendor specific
0x8e0d  4      1017803  Vendor specific
0x8e0e  4        49420  Vendor specific
0x8e0f  4   2059767808  Vendor specific
0x8e10  4       197680  Vendor specific
0x8e11  4            4  Vendor specific

