smartctl 7.2 2020-12-30 r5155 [x86_64-linux-5.15.0-37-generic] (local build)
Copyright (C) 2002-20, Bruce Allen, Christian Franke, www.smartmontools.org

=== START OF INFORMATION SECTION ===
Model Family:     Hitachi/HGST Travelstar Z5K500
Device Model:     HTS545050A7E380
Serial Number:    --
LU WWN Device Id: 5 000cca ...
Firmware Version: GG2OA7A0
User Capacity:    500,107,862,016 bytes [500 GB]
Sector Sizes:     512 bytes logical, 4096 bytes physical
Rotation Rate:    5400 rpm
Form Factor:      2.5 inches
Device is:        In smartctl database [for details use: -P show]
ATA Version is:   ATA8-ACS T13/1699-D revision 6
SATA Version is:  SATA 2.6, 3.0 Gb/s
Local Time is:    Fri Jun 10 16:19:45 2022 CEST
SMART support is: Available - device has SMART capability.
SMART support is: Enabled
AAM feature is:   Unavailable
APM level is:     254 (maximum performance)
Rd look-ahead is: Enabled
Write cache is:   Enabled
DSN feature is:   Unavailable
ATA Security is:  Disabled, NOT FROZEN [SEC1]
Wt Cache Reorder: Enabled

=== START OF READ SMART DATA SECTION ===
SMART overall-health self-assessment test result: PASSED

General SMART Values:
Offline data collection status:  (0x00)	Offline data collection activity
					was never started.
					Auto Offline Data Collection: Disabled.
Self-test execution status:      (   0)	The previous self-test routine completed
					without error or no self-test has ever 
					been run.
Total time to complete Offline 
data collection: 		(   45) seconds.
Offline data collection
capabilities: 			 (0x5b) SMART execute Offline immediate.
					Auto Offline data collection on/off support.
					Suspend Offline collection upon new
					command.
					Offline surface scan supported.
					Self-test supported.
					No Conveyance Self-test supported.
					Selective Self-test supported.
SMART capabilities:            (0x0003)	Saves SMART data before entering
					power-saving mode.
					Supports SMART auto save timer.
Error logging capability:        (0x01)	Error logging supported.
					General Purpose Logging supported.
Short self-test routine 
recommended polling time: 	 (   2) minutes.
Extended self-test routine
recommended polling time: 	 ( 103) minutes.
SCT capabilities: 	       (0x003d)	SCT Status supported.
					SCT Error Recovery Control supported.
					SCT Feature Control supported.
					SCT Data Table supported.

SMART Attributes Data Structure revision number: 16
Vendor Specific SMART Attributes with Thresholds:
ID# ATTRIBUTE_NAME          FLAGS    VALUE WORST THRESH FAIL RAW_VALUE
  1 Raw_Read_Error_Rate     POSR-K   100   100   062    -    0
  2 Throughput_Performance  P-S--K   100   100   040    -    0
  3 Spin_Up_Time            PO---K   253   100   033    -    1
  4 Start_Stop_Count        -O--CK   097   097   000    -    5073
  5 Reallocated_Sector_Ct   PO--CK   100   100   005    -    0
  7 Seek_Error_Rate         POSR-K   100   100   067    -    0
  8 Seek_Time_Performance   P-S--K   100   100   040    -    0
  9 Power_On_Hours          -O--CK   091   091   000    -    4209
 10 Spin_Retry_Count        PO--CK   100   100   060    -    0
 12 Power_Cycle_Count       -O--CK   097   097   000    -    5065
183 Runtime_Bad_Block       -O--CK   100   100   000    -    0
184 End-to-End_Error        PO--CK   100   100   097    -    0
187 Reported_Uncorrect      -O--CK   100   097   000    -    274878627844
188 Command_Timeout         -O--CK   100   099   000    -    85912125467
190 Airflow_Temperature_Cel -O---K   070   046   045    -    30 (Min/Max 24/31)
191 G-Sense_Error_Rate      -O--CK   095   095   000    -    1457
192 Power-Off_Retract_Count -O--CK   100   100   000    -    3866683
193 Load_Cycle_Count        -O--CK   081   081   000    -    197065
196 Reallocated_Event_Count -O--CK   100   100   000    -    0
197 Current_Pending_Sector  -O--CK   100   100   000    -    0
198 Offline_Uncorrectable   ----CK   100   100   000    -    0
199 UDMA_CRC_Error_Count    -OS-CK   100   100   000    -    0
223 Load_Retry_Count        -O-R-K   100   100   000    -    0
                            ||||||_ K auto-keep
                            |||||__ C event count
                            ||||___ R error rate
                            |||____ S speed/performance
                            ||_____ O updated online
                            |______ P prefailure warning

General Purpose Log Directory Version 1
SMART           Log Directory Version 1 [multi-sector log support]
Address    Access  R/W   Size  Description
0x00       GPL,SL  R/O      1  Log Directory
0x01           SL  R/O      1  Summary SMART error log
0x02           SL  R/O      1  Comprehensive SMART error log
0x03       GPL     R/O      1  Ext. Comprehensive SMART error log
0x06           SL  R/O      1  SMART self-test log
0x07       GPL     R/O      1  Extended self-test log
0x09           SL  R/W      1  Selective self-test log
0x10       GPL     R/O      1  NCQ Command Error log
0x11       GPL     R/O      1  SATA Phy Event Counters log
0x80-0x9f  GPL,SL  R/W     16  Host vendor specific log
0xe0       GPL,SL  R/W      1  SCT Command/Status
0xe1       GPL,SL  R/W      1  SCT Data Transfer

SMART Extended Comprehensive Error Log Version: 1 (1 sectors)
Device Error Count: 4
	CR     = Command Register
	FEATR  = Features Register
	COUNT  = Count (was: Sector Count) Register
	LBA_48 = Upper bytes of LBA High/Mid/Low Registers ]  ATA-8
	LH     = LBA High (was: Cylinder High) Register    ]   LBA
	LM     = LBA Mid (was: Cylinder Low) Register      ] Register
	LL     = LBA Low (was: Sector Number) Register     ]
	DV     = Device (was: Device/Head) Register
	DC     = Device Control Register
	ER     = Error register
	ST     = Status register
Powered_Up_Time is measured from power on, and printed as
DDd+hh:mm:SS.sss where DD=days, hh=hours, mm=minutes,
SS=sec, and sss=millisec. It "wraps" after 49.710 days.

Error 4 [3] occurred at disk power-on lifetime: 4188 hours (174 days + 12 hours)
  When the command that caused the error occurred, the device was active or idle.

  After command completion occurred, registers were:
  ER -- ST COUNT  LBA_48  LH LM LL DV DC
  -- -- -- == -- == == == -- -- -- -- --
  40 -- 41 0a 00 00 00 26 dc 88 00 06 00  Error: WP at LBA = 0x26dc8800 = 651986944

  Commands leading to the command that caused the error were:
  CR FEATR COUNT  LBA_48  LH LM LL DV DC  Powered_Up_Time  Command/Feature_Name
  -- == -- == -- == == == -- -- -- -- --  ---------------  --------------------
  61 05 40 00 08 00 00 26 f3 d9 40 40 00     00:30:40.544  WRITE FPDMA QUEUED
  61 05 40 00 00 00 00 26 f3 d4 00 40 00     00:30:40.536  WRITE FPDMA QUEUED
  61 05 40 00 c0 00 00 26 f3 ce c0 40 00     00:30:40.527  WRITE FPDMA QUEUED
  61 05 40 00 b8 00 00 26 f3 c9 80 40 00     00:30:40.520  WRITE FPDMA QUEUED
  61 05 40 00 b0 00 00 26 f3 c4 40 40 00     00:30:40.511  WRITE FPDMA QUEUED

Error 3 [2] occurred at disk power-on lifetime: 4188 hours (174 days + 12 hours)
  When the command that caused the error occurred, the device was active or idle.

  After command completion occurred, registers were:
  ER -- ST COUNT  LBA_48  LH LM LL DV DC
  -- -- -- == -- == == == -- -- -- -- --
  40 -- 41 0a 00 00 00 27 1e 28 00 07 00  Error: WP at LBA = 0x271e2800 = 656287744

  Commands leading to the command that caused the error were:
  CR FEATR COUNT  LBA_48  LH LM LL DV DC  Powered_Up_Time  Command/Feature_Name
  -- == -- == -- == == == -- -- -- -- --  ---------------  --------------------
  61 05 40 00 f8 00 00 27 34 7e 40 40 00     00:29:40.518  WRITE FPDMA QUEUED
  61 05 40 00 b8 00 00 27 34 79 00 40 00     00:29:40.510  WRITE FPDMA QUEUED
  61 05 40 00 b0 00 00 27 34 73 c0 40 00     00:29:40.502  WRITE FPDMA QUEUED
  61 05 40 00 a8 00 00 27 34 6e 80 40 00     00:29:40.495  WRITE FPDMA QUEUED
  61 05 40 00 a0 00 00 27 34 69 40 40 00     00:29:40.486  WRITE FPDMA QUEUED

Error 2 [1] occurred at disk power-on lifetime: 4188 hours (174 days + 12 hours)
  When the command that caused the error occurred, the device was active or idle.

  After command completion occurred, registers were:
  ER -- ST COUNT  LBA_48  LH LM LL DV DC
  -- -- -- == -- == == == -- -- -- -- --
  40 -- 41 0a 00 00 00 29 20 88 00 09 00  Error: WP at LBA = 0x29208800 = 689997824

  Commands leading to the command that caused the error were:
  CR FEATR COUNT  LBA_48  LH LM LL DV DC  Powered_Up_Time  Command/Feature_Name
  -- == -- == -- == == == -- -- -- -- --  ---------------  --------------------
  61 05 40 00 50 00 00 29 36 0b c0 40 00     00:22:18.815  WRITE FPDMA QUEUED
  61 05 40 00 48 00 00 29 36 06 80 40 00     00:22:18.807  WRITE FPDMA QUEUED
  61 05 40 00 40 00 00 29 36 01 40 40 00     00:22:18.798  WRITE FPDMA QUEUED
  61 05 40 00 38 00 00 29 35 fc 00 40 00     00:22:18.791  WRITE FPDMA QUEUED
  61 05 40 00 30 00 00 29 35 f6 c0 40 00     00:22:18.783  WRITE FPDMA QUEUED

Error 1 [0] occurred at disk power-on lifetime: 4188 hours (174 days + 12 hours)
  When the command that caused the error occurred, the device was active or idle.

  After command completion occurred, registers were:
  ER -- ST COUNT  LBA_48  LH LM LL DV DC
  -- -- -- == -- == == == -- -- -- -- --
  40 -- 41 0a 00 00 00 29 81 18 00 09 00  Error: WP at LBA = 0x29811800 = 696326144

  Commands leading to the command that caused the error were:
  CR FEATR COUNT  LBA_48  LH LM LL DV DC  Powered_Up_Time  Command/Feature_Name
  -- == -- == -- == == == -- -- -- -- --  ---------------  --------------------
  61 05 40 00 00 00 00 29 98 6f 00 40 00     00:20:52.960  WRITE FPDMA QUEUED
  61 05 40 00 f8 00 00 29 98 69 c0 40 00     00:20:52.952  WRITE FPDMA QUEUED
  61 05 40 00 b8 00 00 29 98 64 80 40 00     00:20:52.943  WRITE FPDMA QUEUED
  61 05 40 00 b0 00 00 29 98 5f 40 40 00     00:20:52.936  WRITE FPDMA QUEUED
  61 05 40 00 a8 00 00 29 98 5a 00 40 00     00:20:52.928  WRITE FPDMA QUEUED

SMART Extended Self-test Log Version: 1 (1 sectors)
Num  Test_Description    Status                  Remaining  LifeTime(hours)  LBA_of_first_error
# 1  Short offline       Completed without error       00%      2161         -
# 2  Short offline       Completed without error       00%      2137         -
# 3  Short offline       Completed without error       00%      2120         -
# 4  Short offline       Completed without error       00%      2096         -
# 5  Short offline       Completed without error       00%      2086         -
# 6  Short offline       Completed without error       00%      2080         -
# 7  Short offline       Completed without error       00%      2034         -
# 8  Short offline       Completed without error       00%      1998         -
# 9  Short offline       Completed without error       00%      1973         -
#10  Short offline       Completed without error       00%      1913         -
#11  Short offline       Completed without error       00%      1903         -
#12  Short offline       Completed without error       00%      1882         -
#13  Short offline       Completed without error       00%      1869         -

SMART Selective self-test log data structure revision number 1
 SPAN  MIN_LBA  MAX_LBA  CURRENT_TEST_STATUS
    1        0        0  Not_testing
    2        0        0  Not_testing
    3        0        0  Not_testing
    4        0        0  Not_testing
    5        0        0  Not_testing
Selective self-test flags (0x0):
  After scanning selected spans, do NOT read-scan remainder of disk.
If Selective self-test is pending on power-up, resume after 0 minute delay.

SCT Status Version:                  3
SCT Version (vendor specific):       256 (0x0100)
Device State:                        Active (0)
Current Temperature:                    30 Celsius
Power Cycle Min/Max Temperature:     24/31 Celsius
Lifetime    Min/Max Temperature:     11/54 Celsius
Specified Max Operating Temperature:    31 Celsius
Under/Over Temperature Limit Count:   0/0

SCT Temperature History Version:     2
Temperature Sampling Period:         1 minute
Temperature Logging Interval:        1 minute
Min/Max recommended Temperature:      0/60 Celsius
Min/Max Temperature Limit:           -40/65 Celsius
Temperature History Size (Index):    128 (75)

SCT Error Recovery Control:
           Read:     85 (8.5 seconds)
          Write:     85 (8.5 seconds)

Device Statistics (GP/SMART Log 0x04) not supported

Pending Defects log (GP Log 0x0c) not supported

SATA Phy Event Counters (GP Log 0x11)
ID      Size     Value  Description
0x0001  2            0  Command failed due to ICRC error
0x0002  2            0  R_ERR response for data FIS
0x0003  2            0  R_ERR response for device-to-host data FIS
0x0004  2            0  R_ERR response for host-to-device data FIS
0x0005  2            0  R_ERR response for non-data FIS
0x0006  2            0  R_ERR response for device-to-host non-data FIS
0x0007  2            0  R_ERR response for host-to-device non-data FIS
0x0009  2         1337  Transition from drive PhyRdy to drive PhyNRdy
0x000a  2            3  Device-to-host register FISes sent due to a COMRESET
0x000b  2            0  CRC errors within host-to-device FIS
0x000d  2            0  Non-CRC errors within host-to-device FIS

