=== START OF INFORMATION SECTION ===
Model Family:     Western Digital AV SATA
Device Model:     WDC WD2500AVJS-63B6A0
Serial Number:    --
LU WWN Device Id: 5 0014ee ...
Firmware Version: 01.03A01
User Capacity:    250 059 350 016 bytes [250 GB]
Sector Size:      512 bytes logical/physical
Device is:        In smartctl database [for details use: -P show]
ATA Version is:   ATA8-ACS (minor revision not indicated)
SATA Version is:  SATA 2.5, 3.0 Gb/s
Local Time is:    Sun Jul  9 17:39:51 2017 GMT
SMART support is: Available - device has SMART capability.
SMART support is: Enabled
AAM level is:     128 (quiet), recommended: 128
APM feature is:   Unavailable
Rd look-ahead is: Enabled
Write cache is:   Enabled
ATA Security is:  Disabled, frozen [SEC2]
Wt Cache Reorder: Enabled

=== START OF READ SMART DATA SECTION ===
SMART overall-health self-assessment test result: PASSED

General SMART Values:
Offline data collection status:  (0x80)	Offline data collection activity
					was never started.
					Auto Offline Data Collection: Enabled.
Self-test execution status:      (   0)	The previous self-test routine completed
					without error or no self-test has ever 
					been run.
Total time to complete Offline 
data collection: 		( 5400) seconds.
Offline data collection
capabilities: 			 (0x7b) SMART execute Offline immediate.
					Auto Offline data collection on/off support.
					Suspend Offline collection upon new
					command.
					Offline surface scan supported.
					Self-test supported.
					Conveyance Self-test supported.
					Selective Self-test supported.
SMART capabilities:            (0x0003)	Saves SMART data before entering
					power-saving mode.
					Supports SMART auto save timer.
Error logging capability:        (0x01)	Error logging supported.
					General Purpose Logging supported.
Short self-test routine 
recommended polling time: 	 (   2) minutes.
Extended self-test routine
recommended polling time: 	 (  66) minutes.
Conveyance self-test routine
recommended polling time: 	 (   5) minutes.
SCT capabilities: 	       (0x303f)	SCT Status supported.
					SCT Error Recovery Control supported.
					SCT Feature Control supported.
					SCT Data Table supported.

SMART Attributes Data Structure revision number: 16
Vendor Specific SMART Attributes with Thresholds:
ID# ATTRIBUTE_NAME          FLAGS    VALUE WORST THRESH FAIL RAW_VALUE
  1 Raw_Read_Error_Rate     POSR-K   200   200   051    -    0
  3 Spin_Up_Time            POS--K   154   153   021    -    3300
  4 Start_Stop_Count        -O--CK   100   100   000    -    858
  5 Reallocated_Sector_Ct   PO--CK   200   200   140    -    0
  7 Seek_Error_Rate         -OSR-K   100   253   000    -    0
  9 Power_On_Hours          -O--CK   098   098   000    -    1851
 10 Spin_Retry_Count        -O--CK   100   100   000    -    0
 11 Calibration_Retry_Count -O--CK   100   100   000    -    0
 12 Power_Cycle_Count       -O--CK   100   100   000    -    852
192 Power-Off_Retract_Count -O--CK   200   200   000    -    78
193 Load_Cycle_Count        -O--CK   200   200   000    -    858
194 Temperature_Celsius     -O---K   101   101   000    -    42
196 Reallocated_Event_Count -O--CK   200   200   000    -    0
197 Current_Pending_Sector  -O--CK   200   200   000    -    0
198 Offline_Uncorrectable   ----CK   100   253   000    -    0
199 UDMA_CRC_Error_Count    -O--CK   200   200   000    -    0
200 Multi_Zone_Error_Rate   ---R--   100   253   000    -    0
                            ||||||_ K auto-keep
                            |||||__ C event count
                            ||||___ R error rate
                            |||____ S speed/performance
                            ||_____ O updated online
                            |______ P prefailure warning

General Purpose Log Directory Version 1
SMART           Log Directory Version 1 [multi-sector log support]
Address    Access  R/W   Size  Description
0x00       GPL,SL  R/O      1  Log Directory
0x01           SL  R/O      1  Summary SMART error log
0x02           SL  R/O      5  Comprehensive SMART error log
0x03       GPL     R/O      6  Ext. Comprehensive SMART error log
0x06           SL  R/O      1  SMART self-test log
0x07       GPL     R/O      1  Extended self-test log
0x09           SL  R/W      1  Selective self-test log
0x10       GPL     R/O      1  SATA NCQ Queued Error log
0x11       GPL     R/O      1  SATA Phy Event Counters log
0x21       GPL     R/O      1  Write stream error log
0x22       GPL     R/O      1  Read stream error log
0x80-0x9f  GPL,SL  R/W     16  Host vendor specific log
0xa0-0xa7  GPL,SL  VS      16  Device vendor specific log
0xa8-0xb7  GPL,SL  VS       1  Device vendor specific log
0xc0       GPL,SL  VS       1  Device vendor specific log
0xc1       GPL     VS      24  Device vendor specific log
0xe0       GPL,SL  R/W      1  SCT Command/Status
0xe1       GPL,SL  R/W      1  SCT Data Transfer

SMART Extended Comprehensive Error Log Version: 1 (6 sectors)
Device Error Count: 56 (device log contains only the most recent 24 errors)
	CR     = Command Register
	FEATR  = Features Register
	COUNT  = Count (was: Sector Count) Register
	LBA_48 = Upper bytes of LBA High/Mid/Low Registers ]  ATA-8
	LH     = LBA High (was: Cylinder High) Register    ]   LBA
	LM     = LBA Mid (was: Cylinder Low) Register      ] Register
	LL     = LBA Low (was: Sector Number) Register     ]
	DV     = Device (was: Device/Head) Register
	DC     = Device Control Register
	ER     = Error register
	ST     = Status register
Powered_Up_Time is measured from power on, and printed as
DDd+hh:mm:SS.sss where DD=days, hh=hours, mm=minutes,
SS=sec, and sss=millisec. It "wraps" after 49.710 days.

Error 56 [7] occurred at disk power-on lifetime: 1847 hours (76 days + 23 hours)
  When the command that caused the error occurred, the device was active or idle.

  After command completion occurred, registers were:
  ER -- ST COUNT  LBA_48  LH LM LL DV DC
  -- -- -- == -- == == == -- -- -- -- --
  40 -- 51 00 08 00 00 37 00 29 78 e0 00  Error: UNC 8 sectors at LBA = 0x37002978 = 922757496

  Commands leading to the command that caused the error were:
  CR FEATR COUNT  LBA_48  LH LM LL DV DC  Powered_Up_Time  Command/Feature_Name
  -- == -- == -- == == == -- -- -- -- --  ---------------  --------------------
  25 00 00 00 08 00 00 00 29 37 78 e0 00     00:14:12.381  READ DMA EXT
  35 00 00 00 10 00 00 00 00 b7 80 e0 00     00:14:12.381  WRITE DMA EXT
  25 00 00 00 0d 00 00 00 00 3d 4a e0 00     00:14:12.381  READ DMA EXT
  25 00 00 00 20 00 00 00 00 34 a0 e0 00     00:14:12.364  READ DMA EXT
  35 00 00 00 52 00 00 05 50 f4 60 e0 00     00:14:12.364  WRITE DMA EXT

Error 55 [6] occurred at disk power-on lifetime: 1847 hours (76 days + 23 hours)
  When the command that caused the error occurred, the device was active or idle.

  After command completion occurred, registers were:
  ER -- ST COUNT  LBA_48  LH LM LL DV DC
  -- -- -- == -- == == == -- -- -- -- --
  40 -- 51 00 40 00 00 37 00 29 78 e0 00  Error: UNC 64 sectors at LBA = 0x37002978 = 922757496

  Commands leading to the command that caused the error were:
  CR FEATR COUNT  LBA_48  LH LM LL DV DC  Powered_Up_Time  Command/Feature_Name
  -- == -- == -- == == == -- -- -- -- --  ---------------  --------------------
  25 00 00 00 40 00 00 00 29 37 78 e0 00     00:14:10.150  READ DMA EXT
  25 00 00 00 3a 00 00 00 11 f8 48 e0 00     00:14:10.134  READ DMA EXT
  25 00 00 00 01 00 00 00 00 3d 5b e0 00     00:14:10.134  READ DMA EXT
  25 00 00 00 6c 00 00 08 7c 9d 30 e0 00     00:14:10.133  READ DMA EXT
  25 00 00 01 00 00 00 08 7c 9c 30 e0 00     00:14:10.132  READ DMA EXT

Error 54 [5] occurred at disk power-on lifetime: 1847 hours (76 days + 23 hours)
  When the command that caused the error occurred, the device was active or idle.

  After command completion occurred, registers were:
  ER -- ST COUNT  LBA_48  LH LM LL DV DC
  -- -- -- == -- == == == -- -- -- -- --
  40 -- 51 00 40 00 00 37 00 29 78 e0 00  Error: UNC 64 sectors at LBA = 0x37002978 = 922757496

  Commands leading to the command that caused the error were:
  CR FEATR COUNT  LBA_48  LH LM LL DV DC  Powered_Up_Time  Command/Feature_Name
  -- == -- == -- == == == -- -- -- -- --  ---------------  --------------------
  25 00 00 00 40 00 00 00 29 37 78 e0 00     00:14:07.744  READ DMA EXT
  25 00 00 00 38 00 00 00 20 6f f8 e0 00     00:14:07.743  READ DMA EXT
  35 00 00 00 70 00 00 00 18 ad e0 e0 00     00:14:07.742  WRITE DMA EXT
  25 00 00 00 20 00 00 00 00 b7 80 e0 00     00:14:07.730  READ DMA EXT
  25 00 00 00 08 00 00 00 00 3d 38 e0 00     00:14:07.715  READ DMA EXT

Error 53 [4] occurred at disk power-on lifetime: 1847 hours (76 days + 23 hours)
  When the command that caused the error occurred, the device was active or idle.

  After command completion occurred, registers were:
  ER -- ST COUNT  LBA_48  LH LM LL DV DC
  -- -- -- == -- == == == -- -- -- -- --
  40 -- 51 00 08 00 00 37 00 29 78 e0 00  Error: UNC 8 sectors at LBA = 0x37002978 = 922757496

  Commands leading to the command that caused the error were:
  CR FEATR COUNT  LBA_48  LH LM LL DV DC  Powered_Up_Time  Command/Feature_Name
  -- == -- == -- == == == -- -- -- -- --  ---------------  --------------------
  25 00 00 00 08 00 00 00 29 37 78 e0 00     00:14:05.482  READ DMA EXT
  25 00 00 00 40 00 00 00 20 6f b8 e0 00     00:14:05.481  READ DMA EXT
  35 00 00 00 10 00 00 00 13 36 f0 e0 00     00:14:05.481  WRITE DMA EXT
  25 00 00 00 08 00 00 00 13 14 92 e0 00     00:14:05.481  READ DMA EXT
  25 00 00 01 00 00 00 00 13 13 92 e0 00     00:14:05.462  READ DMA EXT

Error 52 [3] occurred at disk power-on lifetime: 1847 hours (76 days + 23 hours)
  When the command that caused the error occurred, the device was active or idle.

  After command completion occurred, registers were:
  ER -- ST COUNT  LBA_48  LH LM LL DV DC
  -- -- -- == -- == == == -- -- -- -- --
  40 -- 51 00 40 00 00 37 00 29 78 e0 00  Error: UNC 64 sectors at LBA = 0x37002978 = 922757496

  Commands leading to the command that caused the error were:
  CR FEATR COUNT  LBA_48  LH LM LL DV DC  Powered_Up_Time  Command/Feature_Name
  -- == -- == -- == == == -- -- -- -- --  ---------------  --------------------
  25 00 00 00 40 00 00 00 29 37 78 e0 00     00:14:02.912  READ DMA EXT
  25 00 00 00 40 00 00 00 20 6f 78 e0 00     00:14:02.905  READ DMA EXT
  35 00 00 00 08 00 00 00 13 36 98 e0 00     00:14:02.905  WRITE DMA EXT
  25 00 00 00 08 00 00 00 07 16 97 e0 00     00:14:02.905  READ DMA EXT
  25 00 00 00 27 00 00 00 07 16 6f e0 00     00:14:02.904  READ DMA EXT

Error 51 [2] occurred at disk power-on lifetime: 1847 hours (76 days + 23 hours)
  When the command that caused the error occurred, the device was active or idle.

  After command completion occurred, registers were:
  ER -- ST COUNT  LBA_48  LH LM LL DV DC
  -- -- -- == -- == == == -- -- -- -- --
  40 -- 51 00 08 00 00 37 00 29 78 e0 00  Error: UNC 8 sectors at LBA = 0x37002978 = 922757496

  Commands leading to the command that caused the error were:
  CR FEATR COUNT  LBA_48  LH LM LL DV DC  Powered_Up_Time  Command/Feature_Name
  -- == -- == -- == == == -- -- -- -- --  ---------------  --------------------
  25 00 00 00 08 00 00 00 29 37 78 e0 00     00:14:00.681  READ DMA EXT
  25 00 00 00 10 00 00 00 18 95 a0 e0 00     00:14:00.674  READ DMA EXT
  25 00 00 00 70 00 00 00 07 15 ff e0 00     00:14:00.673  READ DMA EXT
  25 00 00 00 18 00 00 00 07 15 e7 e0 00     00:14:00.672  READ DMA EXT
  ea 00 00 00 00 00 08 7c 00 00 00 e0 00     00:14:00.615  FLUSH CACHE EXT

Error 50 [1] occurred at disk power-on lifetime: 1847 hours (76 days + 23 hours)
  When the command that caused the error occurred, the device was active or idle.

  After command completion occurred, registers were:
  ER -- ST COUNT  LBA_48  LH LM LL DV DC
  -- -- -- == -- == == == -- -- -- -- --
  40 -- 51 00 40 00 00 37 00 29 78 e0 00  Error: UNC 64 sectors at LBA = 0x37002978 = 922757496

  Commands leading to the command that caused the error were:
  CR FEATR COUNT  LBA_48  LH LM LL DV DC  Powered_Up_Time  Command/Feature_Name
  -- == -- == -- == == == -- -- -- -- --  ---------------  --------------------
  25 00 00 00 40 00 00 00 29 37 78 e0 00     00:13:58.090  READ DMA EXT
  25 00 00 00 10 00 00 00 10 1e 53 e0 00     00:13:58.080  READ DMA EXT
  25 00 00 00 4c 00 00 00 07 15 92 e0 00     00:13:58.076  READ DMA EXT
  25 00 00 00 d8 00 00 00 07 11 4a e0 00     00:13:58.075  READ DMA EXT
  25 00 00 01 00 00 00 00 07 10 4a e0 00     00:13:58.054  READ DMA EXT

Error 49 [0] occurred at disk power-on lifetime: 1847 hours (76 days + 23 hours)
  When the command that caused the error occurred, the device was active or idle.

  After command completion occurred, registers were:
  ER -- ST COUNT  LBA_48  LH LM LL DV DC
  -- -- -- == -- == == == -- -- -- -- --
  40 -- 51 00 08 00 00 37 00 29 78 e0 00  Error: UNC 8 sectors at LBA = 0x37002978 = 922757496

  Commands leading to the command that caused the error were:
  CR FEATR COUNT  LBA_48  LH LM LL DV DC  Powered_Up_Time  Command/Feature_Name
  -- == -- == -- == == == -- -- -- -- --  ---------------  --------------------
  25 00 00 00 08 00 00 00 29 37 78 e0 00     00:13:55.847  READ DMA EXT
  25 00 00 00 80 00 00 00 04 8a b8 e0 00     00:13:55.845  READ DMA EXT
  25 00 00 00 08 00 00 00 04 8a b0 e0 00     00:13:55.825  READ DMA EXT
  25 00 00 00 0c 00 00 00 11 54 c9 e0 00     00:13:55.823  READ DMA EXT
  25 00 00 00 20 00 00 00 11 54 a9 e0 00     00:13:55.823  READ DMA EXT

SMART Extended Self-test Log Version: 1 (1 sectors)
No self-tests have been logged.  [To run self-tests, use: smartctl -t]

SMART Selective self-test log data structure revision number 1
 SPAN  MIN_LBA  MAX_LBA  CURRENT_TEST_STATUS
    1        0        0  Not_testing
    2        0        0  Not_testing
    3        0        0  Not_testing
    4        0        0  Not_testing
    5        0        0  Not_testing
Selective self-test flags (0x0):
  After scanning selected spans, do NOT read-scan remainder of disk.
If Selective self-test is pending on power-up, resume after 0 minute delay.

SCT Status Version:                  2
SCT Version (vendor specific):       258 (0x0102)
SCT Support Level:                   1
Device State:                        Active (0)
Current Temperature:                    42 Celsius
Power Cycle Min/Max Temperature:     41/42 Celsius
Lifetime    Min/Max Temperature:     41/42 Celsius
Under/Over Temperature Limit Count:   0/0

SCT Temperature History Version:     2
Temperature Sampling Period:         1 minute
Temperature Logging Interval:        1 minute
Min/Max recommended Temperature:      0/60 Celsius
Min/Max Temperature Limit:           -41/85 Celsius
Temperature History Size (Index):    478 (249)

SCT Error Recovery Control:
           Read: Disabled
          Write: Disabled

Device Statistics (GP/SMART Log 0x04) not supported

SATA Phy Event Counters (GP Log 0x11)
ID      Size     Value  Description
0x0001  2            0  Command failed due to ICRC error
0x0002  2            0  R_ERR response for data FIS
0x0003  2            0  R_ERR response for device-to-host data FIS
0x0004  2            0  R_ERR response for host-to-device data FIS
0x0005  2            0  R_ERR response for non-data FIS
0x0006  2            0  R_ERR response for device-to-host non-data FIS
0x0007  2            0  R_ERR response for host-to-device non-data FIS
0x000a  2            4  Device-to-host register FISes sent due to a COMRESET
0x8000  4         2351  Vendor specific

