smartctl 7.3 2022-02-28 r5338 [x86_64-linux-6.2.9-200.fc37.x86_64] (local build)
Copyright (C) 2002-22, Bruce Allen, Christian Franke, www.smartmontools.org

=== START OF INFORMATION SECTION ===
Model Family:     JMicron/Maxiotek based SSDs
Device Model:     KINGSTON SNV425S264GB
Serial Number:    --
Firmware Version: C091126a
User Capacity:    64,023,257,088 bytes [64.0 GB]
Sector Size:      512 bytes logical/physical
Rotation Rate:    Solid State Device
Form Factor:      2.5 inches
TRIM Command:     Available
Device is:        In smartctl database 7.3/5319
ATA Version is:   ATA8-ACS (minor revision not indicated)
SATA Version is:  SATA 2.6, 3.0 Gb/s
Local Time is:    Sat Apr 15 21:47:19 2023 CEST
SMART support is: Available - device has SMART capability.
SMART support is: Enabled
AAM feature is:   Unavailable
APM feature is:   Disabled
Rd look-ahead is: Enabled
Write cache is:   Enabled
DSN feature is:   Unavailable
ATA Security is:  Disabled, frozen [SEC2]
Wt Cache Reorder: Unavailable

=== START OF READ SMART DATA SECTION ===
SMART overall-health self-assessment test result: PASSED

General SMART Values:
Offline data collection status:  (0x00)	Offline data collection activity
					was never started.
					Auto Offline Data Collection: Disabled.
Self-test execution status:      (   0)	The previous self-test routine completed
					without error or no self-test has ever 
					been run.
Total time to complete Offline 
data collection: 		(   30) seconds.
Offline data collection
capabilities: 			 (0x1b) SMART execute Offline immediate.
					Auto Offline data collection on/off support.
					Suspend Offline collection upon new
					command.
					Offline surface scan supported.
					Self-test supported.
					No Conveyance Self-test supported.
					No Selective Self-test supported.
SMART capabilities:            (0x0003)	Saves SMART data before entering
					power-saving mode.
					Supports SMART auto save timer.
Error logging capability:        (0x01)	Error logging supported.
					General Purpose Logging supported.
Short self-test routine 
recommended polling time: 	 (   1) minutes.
Extended self-test routine
recommended polling time: 	 (   1) minutes.

SMART Attributes Data Structure revision number: 16
Vendor Specific SMART Attributes with Thresholds:
ID# ATTRIBUTE_NAME          FLAGS    VALUE WORST THRESH FAIL RAW_VALUE
  1 Raw_Read_Error_Rate     PO-R--   100   100   050    -    0
  2 Throughput_Performance  P-S---   100   100   050    -    0
  3 Unknown_JMF_Attribute   POS---   100   100   050    -    0
  5 Reallocated_Sector_Ct   PO--C-   100   100   050    -    0
  7 Unknown_JMF_Attribute   PO-R--   100   100   050    -    0
  8 Unknown_JMF_Attribute   P-S---   100   100   050    -    0
  9 Power_On_Hours          -O--C-   100   100   000    -    8956
 10 Unknown_JMF_Attribute   PO--C-   100   100   050    -    0
 12 Power_Cycle_Count       -O--C-   100   100   000    -    8201
168 SATA_Phy_Error_Count    -O--C-   100   100   000    -    3
175 Bad_Cluster_Table_Count PO----   100   100   010    -    0
192 Unexpect_Power_Loss_Ct  -O--C-   100   100   000    -    0
194 Temperature_Celsius     -O---K   036   100   020    -    36 (Min/Max 22/40)
197 Current_Pending_Sector  -O--C-   100   100   000    -    0
240 Unknown_JMF_Attribute   PO--C-   100   100   050    -    0
170 Bad_Block_Count         PO----   100   100   010    -    2 188 52
173 Erase_Count             -O--C-   100   100   000    -    10679 16519 11964
                            ||||||_ K auto-keep
                            |||||__ C event count
                            ||||___ R error rate
                            |||____ S speed/performance
                            ||_____ O updated online
                            |______ P prefailure warning

General Purpose Log Directory Version 1
SMART           Log Directory Version 1 [multi-sector log support]
Address    Access  R/W   Size  Description
0x00       GPL,SL  R/O      1  Log Directory
0x01           SL  R/O      1  Summary SMART error log
0x02           SL  R/O     51  Comprehensive SMART error log
0x03       GPL     R/O     64  Ext. Comprehensive SMART error log
0x06           SL  R/O      1  SMART self-test log
0x07       GPL     R/O      1  Extended self-test log
0x11       GPL     R/O      1  SATA Phy Event Counters log
0x80-0x9f  GPL,SL  R/W     16  Host vendor specific log

SMART Extended Comprehensive Error Log Version: 1 (64 sectors)
Device Error Count: 1607 (device log contains only the most recent 256 errors)
	CR     = Command Register
	FEATR  = Features Register
	COUNT  = Count (was: Sector Count) Register
	LBA_48 = Upper bytes of LBA High/Mid/Low Registers ]  ATA-8
	LH     = LBA High (was: Cylinder High) Register    ]   LBA
	LM     = LBA Mid (was: Cylinder Low) Register      ] Register
	LL     = LBA Low (was: Sector Number) Register     ]
	DV     = Device (was: Device/Head) Register
	DC     = Device Control Register
	ER     = Error register
	ST     = Status register
Powered_Up_Time is measured from power on, and printed as
DDd+hh:mm:SS.sss where DD=days, hh=hours, mm=minutes,
SS=sec, and sss=millisec. It "wraps" after 49.710 days.

Error 1607 [70] occurred at disk power-on lifetime: 8953 hours (373 days + 1 hours)
  When the command that caused the error occurred, the device was active or idle.

  After command completion occurred, registers were:
  ER -- ST COUNT  LBA_48  LH LM LL DV DC
  -- -- -- == -- == == == -- -- -- -- --
  40 -- 51 00 00 00 00 00 00 01 18 e0 00  Error: UNC at LBA = 0x00000118 = 280

  Commands leading to the command that caused the error were:
  CR FEATR COUNT  LBA_48  LH LM LL DV DC  Powered_Up_Time  Command/Feature_Name
  -- == -- == -- == == == -- -- -- -- --  ---------------  --------------------
  c8 00 00 00 08 00 00 00 00 01 18 e0 08     00:02:16.100  READ DMA
  c8 00 00 00 08 00 00 00 00 01 10 e0 08     00:02:16.100  READ DMA
  c8 00 00 00 08 00 00 00 00 01 08 e0 08     00:02:16.100  READ DMA
  27 00 00 00 00 00 00 00 00 00 00 e0 08     00:02:16.000  READ NATIVE MAX ADDRESS EXT [OBS-ACS-3]
  ec 00 00 00 00 00 00 00 00 00 00 a0 08     00:02:16.000  IDENTIFY DEVICE

Error 1606 [69] occurred at disk power-on lifetime: 8953 hours (373 days + 1 hours)
  When the command that caused the error occurred, the device was active or idle.

  After command completion occurred, registers were:
  ER -- ST COUNT  LBA_48  LH LM LL DV DC
  -- -- -- == -- == == == -- -- -- -- --
  40 -- 51 00 00 00 00 00 00 01 08 e0 00  Error: UNC at LBA = 0x00000108 = 264

  Commands leading to the command that caused the error were:
  CR FEATR COUNT  LBA_48  LH LM LL DV DC  Powered_Up_Time  Command/Feature_Name
  -- == -- == -- == == == -- -- -- -- --  ---------------  --------------------
  c8 00 00 00 f8 00 00 00 00 01 08 e0 08     00:02:15.900  READ DMA
  c8 00 00 00 78 00 00 00 00 00 88 e0 08     00:02:15.900  READ DMA
  c8 00 00 00 30 00 00 00 00 00 48 e0 08     00:02:15.900  READ DMA
  c8 00 00 00 10 00 00 00 00 00 28 e0 08     00:02:15.900  READ DMA
  c8 00 00 00 08 00 00 00 00 00 10 e0 08     00:02:15.900  READ DMA

Error 1605 [68] occurred at disk power-on lifetime: 8953 hours (373 days + 1 hours)
  When the command that caused the error occurred, the device was active or idle.

  After command completion occurred, registers were:
  ER -- ST COUNT  LBA_48  LH LM LL DV DC
  -- -- -- == -- == == == -- -- -- -- --
  40 -- 51 00 00 00 00 00 00 01 18 40 00  Error: UNC at LBA = 0x00000118 = 280

  Commands leading to the command that caused the error were:
  CR FEATR COUNT  LBA_48  LH LM LL DV DC  Powered_Up_Time  Command/Feature_Name
  -- == -- == -- == == == -- -- -- -- --  ---------------  --------------------
  25 00 00 00 08 00 00 00 00 01 18 40 00     00:00:00.300  READ DMA EXT
  25 00 00 00 08 00 00 00 00 01 18 40 00     00:00:00.300  READ DMA EXT
  25 00 00 00 08 00 00 00 00 01 18 40 00     00:00:00.300  READ DMA EXT
  25 00 00 00 08 00 00 00 00 01 10 40 00     00:00:00.300  READ DMA EXT
  25 00 00 00 08 00 00 00 00 01 08 40 00     00:00:00.300  READ DMA EXT

Error 1604 [67] occurred at disk power-on lifetime: 8953 hours (373 days + 1 hours)
  When the command that caused the error occurred, the device was active or idle.

  After command completion occurred, registers were:
  ER -- ST COUNT  LBA_48  LH LM LL DV DC
  -- -- -- == -- == == == -- -- -- -- --
  40 -- 51 00 00 00 00 00 00 01 18 e0 00  Error: UNC at LBA = 0x00000118 = 280

  Commands leading to the command that caused the error were:
  CR FEATR COUNT  LBA_48  LH LM LL DV DC  Powered_Up_Time  Command/Feature_Name
  -- == -- == -- == == == -- -- -- -- --  ---------------  --------------------
  c8 00 00 00 08 00 00 00 00 01 18 e0 08     00:02:16.500  READ DMA
  27 00 00 00 00 00 00 00 00 00 00 e0 08     00:02:16.400  READ NATIVE MAX ADDRESS EXT [OBS-ACS-3]
  ec 00 00 00 00 00 00 00 00 00 00 a0 08     00:02:16.400  IDENTIFY DEVICE
  ef 00 03 00 45 00 00 00 00 00 00 a0 08     00:02:16.400  SET FEATURES [Set transfer mode]
  27 00 00 00 00 00 00 00 00 00 00 e0 08     00:02:16.400  READ NATIVE MAX ADDRESS EXT [OBS-ACS-3]

Error 1603 [66] occurred at disk power-on lifetime: 8953 hours (373 days + 1 hours)
  When the command that caused the error occurred, the device was active or idle.

  After command completion occurred, registers were:
  ER -- ST COUNT  LBA_48  LH LM LL DV DC
  -- -- -- == -- == == == -- -- -- -- --
  40 -- 51 00 00 00 00 00 00 01 18 e0 00  Error: UNC at LBA = 0x00000118 = 280

  Commands leading to the command that caused the error were:
  CR FEATR COUNT  LBA_48  LH LM LL DV DC  Powered_Up_Time  Command/Feature_Name
  -- == -- == -- == == == -- -- -- -- --  ---------------  --------------------
  c8 00 00 00 08 00 00 00 00 01 18 e0 08     00:02:16.100  READ DMA
  c8 00 00 00 08 00 00 00 00 01 10 e0 08     00:02:16.100  READ DMA
  c8 00 00 00 08 00 00 00 00 01 08 e0 08     00:02:16.100  READ DMA
  27 00 00 00 00 00 00 00 00 00 00 e0 08     00:02:16.000  READ NATIVE MAX ADDRESS EXT [OBS-ACS-3]
  ec 00 00 00 00 00 00 00 00 00 00 a0 08     00:02:16.000  IDENTIFY DEVICE

Error 1602 [65] occurred at disk power-on lifetime: 8953 hours (373 days + 1 hours)
  When the command that caused the error occurred, the device was active or idle.

  After command completion occurred, registers were:
  ER -- ST COUNT  LBA_48  LH LM LL DV DC
  -- -- -- == -- == == == -- -- -- -- --
  40 -- 51 00 00 00 00 00 00 01 08 e0 00  Error: UNC at LBA = 0x00000108 = 264

  Commands leading to the command that caused the error were:
  CR FEATR COUNT  LBA_48  LH LM LL DV DC  Powered_Up_Time  Command/Feature_Name
  -- == -- == -- == == == -- -- -- -- --  ---------------  --------------------
  c8 00 00 00 f8 00 00 00 00 01 08 e0 08     00:02:15.900  READ DMA
  c8 00 00 00 78 00 00 00 00 00 88 e0 08     00:02:15.900  READ DMA
  c8 00 00 00 30 00 00 00 00 00 48 e0 08     00:02:15.900  READ DMA
  c8 00 00 00 10 00 00 00 00 00 28 e0 08     00:02:15.900  READ DMA
  c8 00 00 00 08 00 00 00 00 00 10 e0 08     00:02:15.900  READ DMA

Error 1601 [64] occurred at disk power-on lifetime: 8953 hours (373 days + 1 hours)
  When the command that caused the error occurred, the device was active or idle.

  After command completion occurred, registers were:
  ER -- ST COUNT  LBA_48  LH LM LL DV DC
  -- -- -- == -- == == == -- -- -- -- --
  40 -- 51 00 00 00 00 00 00 01 18 40 00  Error: UNC at LBA = 0x00000118 = 280

  Commands leading to the command that caused the error were:
  CR FEATR COUNT  LBA_48  LH LM LL DV DC  Powered_Up_Time  Command/Feature_Name
  -- == -- == -- == == == -- -- -- -- --  ---------------  --------------------
  25 00 00 00 08 00 00 00 00 01 18 40 00     00:00:00.300  READ DMA EXT
  25 00 00 00 08 00 00 00 00 01 18 40 00     00:00:00.300  READ DMA EXT
  25 00 00 00 08 00 00 00 00 01 18 40 00     00:00:00.300  READ DMA EXT
  25 00 00 00 08 00 00 00 00 01 10 40 00     00:00:00.300  READ DMA EXT
  25 00 00 00 08 00 00 00 00 01 08 40 00     00:00:00.300  READ DMA EXT

Error 1600 [63] occurred at disk power-on lifetime: 8953 hours (373 days + 1 hours)
  When the command that caused the error occurred, the device was active or idle.

  After command completion occurred, registers were:
  ER -- ST COUNT  LBA_48  LH LM LL DV DC
  -- -- -- == -- == == == -- -- -- -- --
  40 -- 51 00 00 00 00 00 00 01 18 e0 00  Error: UNC at LBA = 0x00000118 = 280

  Commands leading to the command that caused the error were:
  CR FEATR COUNT  LBA_48  LH LM LL DV DC  Powered_Up_Time  Command/Feature_Name
  -- == -- == -- == == == -- -- -- -- --  ---------------  --------------------
  c8 00 00 00 08 00 00 00 00 01 18 e0 08     00:02:16.500  READ DMA
  27 00 00 00 00 00 00 00 00 00 00 e0 08     00:02:16.400  READ NATIVE MAX ADDRESS EXT [OBS-ACS-3]
  ec 00 00 00 00 00 00 00 00 00 00 a0 08     00:02:16.400  IDENTIFY DEVICE
  ef 00 03 00 45 00 00 00 00 00 00 a0 08     00:02:16.400  SET FEATURES [Set transfer mode]
  27 00 00 00 00 00 00 00 00 00 00 e0 08     00:02:16.400  READ NATIVE MAX ADDRESS EXT [OBS-ACS-3]

SMART Extended Self-test Log Version: 1 (1 sectors)
Num  Test_Description    Status                  Remaining  LifeTime(hours)  LBA_of_first_error
# 1  Short captive       Completed without error       00%      8894         -
# 2  Short offline       Completed without error       00%      8894         -

Selective Self-tests/Logging not supported

SCT Commands not supported

Device Statistics (GP/SMART Log 0x04) not supported

Pending Defects log (GP Log 0x0c) not supported

SATA Phy Event Counters (GP Log 0x11)
ID      Size     Value  Description
0x0001  2            3  Command failed due to ICRC error
0x000a  2            6  Device-to-host register FISes sent due to a COMRESET

