=== START OF INFORMATION SECTION ===
Model Family:     Fujitsu MJA BH
Device Model:     FUJITSU MJA2320BH G2
Serial Number:    --
LU WWN Device Id: 5 00000e ...
Firmware Version: 00400018
User Capacity:    320 072 933 376 bytes [320 GB]
Sector Size:      512 bytes logical/physical
Device is:        In smartctl database [for details use: -P show]
ATA Version is:   ATA8-ACS T13/1699-D revision 3c
SATA Version is:  SATA 2.6, 3.0 Gb/s
Local Time is:    Sun May 28 00:18:30 2017 MSK
SMART support is: Available - device has SMART capability.
SMART support is: Enabled
AAM level is:     254 (maximum performance), recommended: 254
APM level is:     1 (minimum power consumption with standby)
Rd look-ahead is: Enabled
Write cache is:   Enabled
ATA Security is:  Disabled, NOT FROZEN [SEC1]
Wt Cache Reorder: Enabled

=== START OF READ SMART DATA SECTION ===
SMART overall-health self-assessment test result: PASSED

General SMART Values:
Offline data collection status:  (0x84)	Offline data collection activity
					was suspended by an interrupting command from host.
					Auto Offline Data Collection: Enabled.
Self-test execution status:      (   0)	The previous self-test routine completed
					without error or no self-test has ever 
					been run.
Total time to complete Offline 
data collection: 		( 1009) seconds.
Offline data collection
capabilities: 			 (0x7b) SMART execute Offline immediate.
					Auto Offline data collection on/off support.
					Suspend Offline collection upon new
					command.
					Offline surface scan supported.
					Self-test supported.
					Conveyance Self-test supported.
					Selective Self-test supported.
SMART capabilities:            (0x0003)	Saves SMART data before entering
					power-saving mode.
					Supports SMART auto save timer.
Error logging capability:        (0x01)	Error logging supported.
					General Purpose Logging supported.
Short self-test routine 
recommended polling time: 	 (   2) minutes.
Extended self-test routine
recommended polling time: 	 ( 143) minutes.
Conveyance self-test routine
recommended polling time: 	 (   2) minutes.
SCT capabilities: 	       (0x003d)	SCT Status supported.
					SCT Error Recovery Control supported.
					SCT Feature Control supported.
					SCT Data Table supported.

SMART Attributes Data Structure revision number: 16
Vendor Specific SMART Attributes with Thresholds:
ID# ATTRIBUTE_NAME          FLAGS    VALUE WORST THRESH FAIL RAW_VALUE
  1 Raw_Read_Error_Rate     POSR--   100   100   046    -    59253
  2 Throughput_Performance  P-S---   100   100   030    -    47382528
  3 Spin_Up_Time            PO----   100   100   025    -    1
  4 Start_Stop_Count        -O--CK   091   091   000    -    42887
  5 Reallocated_Sector_Ct   PO--CK   100   100   024    -    1 (1999 1)
  7 Seek_Error_Rate         POSR--   100   100   047    -    1035
  8 Seek_Time_Performance   P-S---   100   100   019    -    0
  9 Power_On_Hours          -O--CK   055   055   000    -    22815
 10 Spin_Retry_Count        PO--C-   100   100   020    -    0
 12 Power_Cycle_Count       -O--CK   099   099   000    -    7617
192 Power-Off_Retract_Count -O--CK   100   100   000    -    212
193 Load_Cycle_Count        -O--CK   098   098   000    -    49137
194 Temperature_Celsius     -O---K   100   100   000    -    44 (Min/Max 15/54)
195 Hardware_ECC_Recovered  -O-RC-   100   100   000    -    14010
196 Reallocated_Event_Count -O--CK   100   100   000    -    1 (6 15953)
197 Current_Pending_Sector  -O--C-   100   099   000    -    1
198 Offline_Uncorrectable   ----C-   099   099   000    -    3
199 UDMA_CRC_Error_Count    -OSRCK   200   253   000    -    0
200 Multi_Zone_Error_Rate   POSR--   100   100   060    -    16251
203 Run_Out_Cancel          -O----   100   100   000    -    3732245511851
240 Head_Flying_Hours       -OSRCK   200   200   000    -    0
                            ||||||_ K auto-keep
                            |||||__ C event count
                            ||||___ R error rate
                            |||____ S speed/performance
                            ||_____ O updated online
                            |______ P prefailure warning

General Purpose Log Directory Version 1
SMART           Log Directory Version 1 [multi-sector log support]
Address    Access  R/W   Size  Description
0x00       GPL,SL  R/O      1  Log Directory
0x01       GPL,SL  R/O      1  Summary SMART error log
0x02       GPL,SL  R/O     51  Comprehensive SMART error log
0x03       GPL,SL  R/O     64  Ext. Comprehensive SMART error log
0x06       GPL,SL  R/O      1  SMART self-test log
0x07       GPL,SL  R/O      2  Extended self-test log
0x09       GPL,SL  R/W      1  Selective self-test log
0x10       GPL,SL  R/O      1  SATA NCQ Queued Error log
0x11       GPL,SL  R/O      1  SATA Phy Event Counters log
0x23       GPL,SL  R/O      1  Delayed sector log [OBS-8]
0x80-0x9f  GPL,SL  R/W     16  Host vendor specific log
0xa1       GPL,SL  VS       1  Device vendor specific log

SMART Extended Comprehensive Error Log Version: 1 (64 sectors)
Device Error Count: 26
	CR     = Command Register
	FEATR  = Features Register
	COUNT  = Count (was: Sector Count) Register
	LBA_48 = Upper bytes of LBA High/Mid/Low Registers ]  ATA-8
	LH     = LBA High (was: Cylinder High) Register    ]   LBA
	LM     = LBA Mid (was: Cylinder Low) Register      ] Register
	LL     = LBA Low (was: Sector Number) Register     ]
	DV     = Device (was: Device/Head) Register
	DC     = Device Control Register
	ER     = Error register
	ST     = Status register
Powered_Up_Time is measured from power on, and printed as
DDd+hh:mm:SS.sss where DD=days, hh=hours, mm=minutes,
SS=sec, and sss=millisec. It "wraps" after 49.710 days.

Error 26 [25] occurred at disk power-on lifetime: 20356 hours (848 days + 4 hours)
  When the command that caused the error occurred, the device was active or idle.

  After command completion occurred, registers were:
  ER -- ST COUNT  LBA_48  LH LM LL DV DC
  -- -- -- == -- == == == -- -- -- -- --
  84 -- 41 00 ab 00 00 00 ba 18 df 40 00  Error: ICRC, ABRT at LBA = 0x00ba18df = 12196063

  Commands leading to the command that caused the error were:
  CR FEATR COUNT  LBA_48  LH LM LL DV DC  Powered_Up_Time  Command/Feature_Name
  -- == -- == -- == == == -- -- -- -- --  ---------------  --------------------
  60 00 20 00 a8 00 00 04 ba 18 c0 40 00     02:56:34.040  READ FPDMA QUEUED
  61 00 20 00 a0 00 00 04 a2 62 e0 40 00     02:56:34.040  WRITE FPDMA QUEUED
  60 00 20 00 98 00 00 04 ba 18 a0 40 00     02:56:34.039  READ FPDMA QUEUED
  61 00 20 00 90 00 00 04 a2 62 c0 40 00     02:56:34.039  WRITE FPDMA QUEUED
  60 00 20 00 88 00 00 04 ba 18 80 40 00     02:56:34.038  READ FPDMA QUEUED

Error 25 [24] occurred at disk power-on lifetime: 19102 hours (795 days + 22 hours)
  When the command that caused the error occurred, the device was active or idle.

  After command completion occurred, registers were:
  ER -- ST COUNT  LBA_48  LH LM LL DV DC
  -- -- -- == -- == == == -- -- -- -- --
  40 -- 41 00 0b 00 00 13 a4 d3 f2 40 00  Error: UNC at LBA = 0x13a4d3f2 = 329569266

  Commands leading to the command that caused the error were:
  CR FEATR COUNT  LBA_48  LH LM LL DV DC  Powered_Up_Time  Command/Feature_Name
  -- == -- == -- == == == -- -- -- -- --  ---------------  --------------------
  60 01 00 00 40 00 00 13 a4 d4 f8 40 00     03:57:38.571  READ FPDMA QUEUED
  60 01 00 00 38 00 00 13 a4 d3 f8 40 00     03:57:38.571  READ FPDMA QUEUED
  60 01 00 00 30 00 00 13 a4 d2 f8 40 00     03:57:38.571  READ FPDMA QUEUED
  60 01 00 00 28 00 00 13 a4 d1 f8 40 00     03:57:38.571  READ FPDMA QUEUED
  60 01 00 00 20 00 00 13 a4 d0 f8 40 00     03:57:38.571  READ FPDMA QUEUED

Error 24 [23] occurred at disk power-on lifetime: 19102 hours (795 days + 22 hours)
  When the command that caused the error occurred, the device was active or idle.

  After command completion occurred, registers were:
  ER -- ST COUNT  LBA_48  LH LM LL DV DC
  -- -- -- == -- == == == -- -- -- -- --
  40 -- 41 00 13 00 00 25 33 76 79 40 00  Error: UNC at LBA = 0x25337679 = 624129657

  Commands leading to the command that caused the error were:
  CR FEATR COUNT  LBA_48  LH LM LL DV DC  Powered_Up_Time  Command/Feature_Name
  -- == -- == -- == == == -- -- -- -- --  ---------------  --------------------
  60 00 08 00 a0 00 00 00 bd b5 c0 40 00     03:42:52.603  READ FPDMA QUEUED
  61 00 08 00 98 00 00 12 a7 52 90 40 00     03:42:52.474  WRITE FPDMA QUEUED
  60 01 00 00 90 00 00 13 a4 d4 f8 40 00     03:42:52.473  READ FPDMA QUEUED
  60 01 00 00 88 00 00 13 a4 d3 f8 40 00     03:42:52.473  READ FPDMA QUEUED
  60 01 00 00 80 00 00 13 a4 d2 f8 40 00     03:42:52.473  READ FPDMA QUEUED

Error 23 [22] occurred at disk power-on lifetime: 19059 hours (794 days + 3 hours)
  When the command that caused the error occurred, the device was active or idle.

  After command completion occurred, registers were:
  ER -- ST COUNT  LBA_48  LH LM LL DV DC
  -- -- -- == -- == == == -- -- -- -- --
  40 -- 41 00 e3 00 00 18 3f a2 3f 40 00  Error: UNC at LBA = 0x183fa23f = 406823487

  Commands leading to the command that caused the error were:
  CR FEATR COUNT  LBA_48  LH LM LL DV DC  Powered_Up_Time  Command/Feature_Name
  -- == -- == -- == == == -- -- -- -- --  ---------------  --------------------
  60 01 00 00 20 00 00 18 3f a4 f8 40 00     09:33:42.196  READ FPDMA QUEUED
  60 01 00 00 18 00 00 18 3f a3 f8 40 00     09:33:42.196  READ FPDMA QUEUED
  60 01 00 00 10 00 00 18 3f a2 f8 40 00     09:33:42.196  READ FPDMA QUEUED
  60 01 00 00 08 00 00 18 3f a1 f8 40 00     09:33:42.196  READ FPDMA QUEUED
  60 01 00 00 f8 00 00 18 3f a0 f8 40 00     09:33:42.196  READ FPDMA QUEUED

Error 22 [21] occurred at disk power-on lifetime: 18505 hours (771 days + 1 hours)
  When the command that caused the error occurred, the device was active or idle.

  After command completion occurred, registers were:
  ER -- ST COUNT  LBA_48  LH LM LL DV DC
  -- -- -- == -- == == == -- -- -- -- --
  40 -- 41 00 7b 00 00 13 a4 d3 f2 40 00  Error: UNC at LBA = 0x13a4d3f2 = 329569266

  Commands leading to the command that caused the error were:
  CR FEATR COUNT  LBA_48  LH LM LL DV DC  Powered_Up_Time  Command/Feature_Name
  -- == -- == -- == == == -- -- -- -- --  ---------------  --------------------
  60 01 00 00 b0 00 00 13 a4 d4 f8 40 00     02:14:19.242  READ FPDMA QUEUED
  60 01 00 00 a8 00 00 13 a4 d3 f8 40 00     02:14:19.242  READ FPDMA QUEUED
  60 01 00 00 a0 00 00 13 a4 d2 f8 40 00     02:14:19.242  READ FPDMA QUEUED
  60 01 00 00 98 00 00 13 a4 d1 f8 40 00     02:14:19.242  READ FPDMA QUEUED
  60 01 00 00 90 00 00 13 a4 d0 f8 40 00     02:14:19.242  READ FPDMA QUEUED

Error 21 [20] occurred at disk power-on lifetime: 16191 hours (674 days + 15 hours)
  When the command that caused the error occurred, the device was active or idle.

  After command completion occurred, registers were:
  ER -- ST COUNT  LBA_48  LH LM LL DV DC
  -- -- -- == -- == == == -- -- -- -- --
  40 -- 41 00 fb 00 00 13 a4 d3 f2 40 00  Error: UNC at LBA = 0x13a4d3f2 = 329569266

  Commands leading to the command that caused the error were:
  CR FEATR COUNT  LBA_48  LH LM LL DV DC  Powered_Up_Time  Command/Feature_Name
  -- == -- == -- == == == -- -- -- -- --  ---------------  --------------------
  60 01 00 00 38 00 00 13 a4 d4 f8 40 00     03:11:52.124  READ FPDMA QUEUED
  60 01 00 00 30 00 00 13 a4 d3 f8 40 00     03:11:52.124  READ FPDMA QUEUED
  60 01 00 00 28 00 00 13 a4 d2 f8 40 00     03:11:52.124  READ FPDMA QUEUED
  60 01 00 00 20 00 00 13 a4 d1 f8 40 00     03:11:52.124  READ FPDMA QUEUED
  60 01 00 00 18 00 00 13 a4 d0 f8 40 00     03:11:52.124  READ FPDMA QUEUED

Error 20 [19] occurred at disk power-on lifetime: 16191 hours (674 days + 15 hours)
  When the command that caused the error occurred, the device was active or idle.

  After command completion occurred, registers were:
  ER -- ST COUNT  LBA_48  LH LM LL DV DC
  -- -- -- == -- == == == -- -- -- -- --
  40 -- 41 00 1b 00 00 13 a4 d3 f2 40 00  Error: UNC at LBA = 0x13a4d3f2 = 329569266

  Commands leading to the command that caused the error were:
  CR FEATR COUNT  LBA_48  LH LM LL DV DC  Powered_Up_Time  Command/Feature_Name
  -- == -- == -- == == == -- -- -- -- --  ---------------  --------------------
  60 01 00 00 50 00 00 13 a4 d4 f8 40 00     03:11:38.580  READ FPDMA QUEUED
  60 01 00 00 48 00 00 13 a4 d3 f8 40 00     03:11:38.580  READ FPDMA QUEUED
  60 01 00 00 40 00 00 13 a4 d2 f8 40 00     03:11:38.580  READ FPDMA QUEUED
  60 01 00 00 38 00 00 13 a4 d1 f8 40 00     03:11:38.580  READ FPDMA QUEUED
  60 01 00 00 30 00 00 13 a4 d0 f8 40 00     03:11:38.580  READ FPDMA QUEUED

Error 19 [18] occurred at disk power-on lifetime: 16191 hours (674 days + 15 hours)
  When the command that caused the error occurred, the device was active or idle.

  After command completion occurred, registers were:
  ER -- ST COUNT  LBA_48  LH LM LL DV DC
  -- -- -- == -- == == == -- -- -- -- --
  40 -- 41 00 0b 00 00 13 a4 d3 f2 40 00  Error: UNC at LBA = 0x13a4d3f2 = 329569266

  Commands leading to the command that caused the error were:
  CR FEATR COUNT  LBA_48  LH LM LL DV DC  Powered_Up_Time  Command/Feature_Name
  -- == -- == -- == == == -- -- -- -- --  ---------------  --------------------
  60 01 00 00 40 00 00 13 a4 d4 f8 40 00     02:56:18.723  READ FPDMA QUEUED
  60 01 00 00 38 00 00 13 a4 d3 f8 40 00     02:56:18.723  READ FPDMA QUEUED
  60 01 00 00 30 00 00 13 a4 d2 f8 40 00     02:56:18.723  READ FPDMA QUEUED
  60 01 00 00 28 00 00 13 a4 d1 f8 40 00     02:56:18.723  READ FPDMA QUEUED
  60 01 00 00 20 00 00 13 a4 d0 f8 40 00     02:56:18.723  READ FPDMA QUEUED

SMART Extended Self-test Log Version: 1 (2 sectors)
No self-tests have been logged.  [To run self-tests, use: smartctl -t]

SMART Selective self-test log data structure revision number 1
 SPAN  MIN_LBA  MAX_LBA  CURRENT_TEST_STATUS
    1        0        0  Not_testing
    2        0        0  Not_testing
    3        0        0  Not_testing
    4        0        0  Not_testing
    5        0        0  Not_testing
Selective self-test flags (0x0):
  After scanning selected spans, do NOT read-scan remainder of disk.
If Selective self-test is pending on power-up, resume after 0 minute delay.

SCT Status Version:                  2
SCT Version (vendor specific):       0 (0x0000)
SCT Support Level:                   1
Device State:                        SMART Off-line Data Collection executing in background (4)
Current Temperature:                 44 Celsius
Power Cycle Max Temperature:         46 Celsius
Lifetime    Max Temperature:         54 Celsius

SCT Temperature History Version:     2
Temperature Sampling Period:         1 minute
Temperature Logging Interval:        1 minute
Min/Max recommended Temperature:      5/60 Celsius
Min/Max Temperature Limit:           -40/65 Celsius
Temperature History Size (Index):    478 (386)

SCT Error Recovery Control:
           Read: Disabled
          Write: Disabled

Device Statistics (GP/SMART Log 0x04) not supported

SATA Phy Event Counters (GP Log 0x11)
ID      Size     Value  Description
0x0001  4            0  Command failed due to ICRC error
0x0002  4            0  R_ERR response for data FIS
0x0003  4            0  R_ERR response for device-to-host data FIS
0x0004  4            0  R_ERR response for host-to-device data FIS
0x0005  4            0  R_ERR response for non-data FIS
0x0006  4            0  R_ERR response for device-to-host non-data FIS
0x0008  4            0  Device-to-host non-data FIS retries
0x0009  4            6  Transition from drive PhyRdy to drive PhyNRdy
0x000a  4            7  Device-to-host register FISes sent due to a COMRESET
0x000b  4            0  CRC errors within host-to-device FIS
0x000d  4            0  Non-CRC errors within host-to-device FIS
0x000f  4            0  R_ERR response for host-to-device data FIS, CRC
0x0010  4            0  R_ERR response for host-to-device data FIS, non-CRC

