smartctl 7.2 2021-06-06 r5225 [x86_64-linux-5.14.9-1-default] (SUSE RPM)
Copyright (C) 2002-20, Bruce Allen, Christian Franke, www.smartmontools.org

=== START OF INFORMATION SECTION ===
Model Number:                       INTEL SSDPEKKF256G7L
Serial Number:                      --
Firmware Version:                   121P
PCI Vendor/Subsystem ID:            0x8086
IEEE OUI Identifier:                0x5cd2e4
Controller ID:                      1
NVMe Version:                       1.2
Number of Namespaces:               1
Namespace 1 Size/Capacity:          256,060,514,304 [256 GB]
Namespace 1 Formatted LBA Size:     512
Namespace 1 IEEE EUI-64:            5cd2e4 ...
Local Time is:                      Mon Oct 18 20:34:52 2021 CEST
Firmware Updates (0x12):            1 Slot, no Reset required
Optional Admin Commands (0x0007):   Security Format Frmw_DL
Optional NVM Commands (0x001e):     Wr_Unc DS_Mngmt Wr_Zero Sav/Sel_Feat
Log Page Attributes (0x03):         S/H_per_NS Cmd_Eff_Lg
Maximum Data Transfer Size:         32 Pages
Warning  Comp. Temp. Threshold:     70 Celsius
Critical Comp. Temp. Threshold:     80 Celsius

Supported Power States
St Op     Max   Active     Idle   RL RT WL WT  Ent_Lat  Ex_Lat
 0 +     9.00W       -        -    0  0  0  0        5       5
 1 +     4.60W       -        -    1  1  1  1       30      30
 2 +     3.80W       -        -    2  2  2  2       30      30
 3 -   0.0700W       -        -    3  3  3  3    10000     300
 4 -   0.0050W       -        -    4  4  4  4     2000   10000

Supported LBA Sizes (NSID 0x1)
Id Fmt  Data  Metadt  Rel_Perf
 0 +     512       0         0

=== START OF SMART DATA SECTION ===
SMART overall-health self-assessment test result: PASSED

SMART/Health Information (NVMe Log 0x02)
Critical Warning:                   0x00
Temperature:                        42 Celsius
Available Spare:                    95%
Available Spare Threshold:          10%
Percentage Used:                    7%
Data Units Read:                    37,988,646 [19.4 TB]
Data Units Written:                 40,112,371 [20.5 TB]
Host Read Commands:                 344,448,310
Host Write Commands:                404,159,797
Controller Busy Time:               3,428
Power Cycles:                       3,887
Power On Hours:                     14,725
Unsafe Shutdowns:                   305
Media and Data Integrity Errors:    0
Error Information Log Entries:      7
Warning  Comp. Temperature Time:    11
Critical Comp. Temperature Time:    0

Error Information (NVMe Log 0x01, 16 of 64 entries)
Num   ErrCount  SQId   CmdId  Status  PELoc          LBA  NSID    VS
  0          7     -       -  0x0006      -            0     1     -
  1          6     -       -  0x0006      -            0     1     -
  2          5     -       -  0x0006      -            0     1     -
  3          4     -       -  0x0006      -            0     1     -
  4          3     -       -  0x0006      -            0     1     -
  5          2     -       -  0x0006      -            0     1     -
  6          1     -       -  0x0006      -            0     1     -



