smartctl 7.5 2025-04-30 r5714 [x86_64-linux-6.16.1-zen1-1-zen] (local build)
Copyright (C) 2002-25, Bruce Allen, Christian Franke, www.smartmontools.org

=== START OF INFORMATION SECTION ===
Model Family:     Western Digital Elements / My Passport (USB, AF)
Device Model:     WDC WD50NDZW-11MR8S1
Serial Number:    --
LU WWN Device Id: 5 0014ee ...
Firmware Version: 02.01A02
User Capacity:    5,000,947,523,584 bytes [5.00 TB]
Sector Sizes:     512 bytes logical, 4096 bytes physical
Rotation Rate:    5400 rpm
Form Factor:      2.5 inches
TRIM Command:     Available, deterministic
Device is:        In smartctl database 7.5/5706
ATA Version is:   ACS-3 (minor revision not indicated)
SATA Version is:  SATA 3.1, 6.0 Gb/s (current: 6.0 Gb/s)
Local Time is:    Tue Aug 19 05:21:21 2025 PDT
SMART support is: Available - device has SMART capability.
SMART support is: Enabled
AAM feature is:   Unavailable
APM level is:     128 (minimum power consumption without standby)
Rd look-ahead is: Enabled
Write cache is:   Enabled
DSN feature is:   Unavailable
ATA Security is:  Disabled, NOT FROZEN [SEC1]

=== START OF READ SMART DATA SECTION ===
SMART overall-health self-assessment test result: PASSED

General SMART Values:
Offline data collection status:  (0x00)	Offline data collection activity
					was never started.
					Auto Offline Data Collection: Disabled.
Self-test execution status:      (   0)	The previous self-test routine completed
					without error or no self-test has ever 
					been run.
Total time to complete Offline 
data collection: 		(16560) seconds.
Offline data collection
capabilities: 			 (0x1b) SMART execute Offline immediate.
					Auto Offline data collection on/off support.
					Suspend Offline collection upon new
					command.
					Offline surface scan supported.
					Self-test supported.
					No Conveyance Self-test supported.
					No Selective Self-test supported.
SMART capabilities:            (0x0003)	Saves SMART data before entering
					power-saving mode.
					Supports SMART auto save timer.
Error logging capability:        (0x01)	Error logging supported.
					General Purpose Logging supported.
Short self-test routine 
recommended polling time: 	 (   2) minutes.
Extended self-test routine
recommended polling time: 	 ( 734) minutes.
SCT capabilities: 	       (0x30b5)	SCT Status supported.
					SCT Feature Control supported.
					SCT Data Table supported.

SMART Attributes Data Structure revision number: 16
Vendor Specific SMART Attributes with Thresholds:
ID# ATTRIBUTE_NAME          FLAGS    VALUE WORST THRESH FAIL RAW_VALUE
  1 Raw_Read_Error_Rate     POSR-K   200   184   051    -    1
  3 Spin_Up_Time            POS--K   253   253   021    -    3958
  4 Start_Stop_Count        -O--CK   095   095   000    -    5967
  5 Reallocated_Sector_Ct   PO--CK   200   200   140    -    0
  7 Seek_Error_Rate         -OSR-K   200   200   000    -    0
  9 Power_On_Hours          -O--CK   070   070   000    -    21964
 10 Spin_Retry_Count        -O--CK   100   100   000    -    0
 11 Calibration_Retry_Count -O--CK   100   100   000    -    0
 12 Power_Cycle_Count       -O--CK   100   100   000    -    712
192 Power-Off_Retract_Count -O--CK   200   200   000    -    511
193 Load_Cycle_Count        -O--CK   185   185   000    -    45274
194 Temperature_Celsius     -O---K   116   098   000    -    36
196 Reallocated_Event_Count -O--CK   200   200   000    -    0
197 Current_Pending_Sector  -O--CK   200   200   000    -    182
198 Offline_Uncorrectable   ----CK   100   253   000    -    0
199 UDMA_CRC_Error_Count    -O--CK   200   200   000    -    0
200 Multi_Zone_Error_Rate   ---R--   100   253   000    -    0
                            ||||||_ K auto-keep
                            |||||__ C event count
                            ||||___ R error rate
                            |||____ S speed/performance
                            ||_____ O updated online
                            |______ P prefailure warning

General Purpose Log Directory Version 1
SMART           Log Directory Version 1 [multi-sector log support]
Address    Access  R/W   Size  Description
0x00       GPL,SL  R/O      1  Log Directory
0x01           SL  R/O      1  Summary SMART error log
0x02           SL  R/O      5  Comprehensive SMART error log
0x03       GPL     R/O      6  Ext. Comprehensive SMART error log
0x06           SL  R/O      1  SMART self-test log
0x07       GPL     R/O      1  Extended self-test log
0x09           SL  R/W      1  Selective self-test log
0x10       GPL     R/O      1  NCQ Command Error log
0x11       GPL     R/O      1  SATA Phy Event Counters log
0x24       GPL     R/O    277  Current Device Internal Status Data log
0x30       GPL,SL  R/O      9  IDENTIFY DEVICE data log
0x80-0x9f  GPL,SL  R/W     16  Host vendor specific log
0xa0-0xa7  GPL,SL  VS      16  Device vendor specific log
0xa8-0xb6  GPL,SL  VS       1  Device vendor specific log
0xb7       GPL,SL  VS      81  Device vendor specific log
0xbd       GPL,SL  VS       1  Device vendor specific log
0xc0       GPL,SL  VS       1  Device vendor specific log
0xc1       GPL     VS      93  Device vendor specific log
0xcf       GPL     VS   65535  Device vendor specific log
0xe0       GPL,SL  R/W      1  SCT Command/Status
0xe1       GPL,SL  R/W      1  SCT Data Transfer

SMART Extended Comprehensive Error Log Version: 1 (6 sectors)
Device Error Count: 992 (device log contains only the most recent 24 errors)
	CR     = Command Register
	FEATR  = Features Register
	COUNT  = Count (was: Sector Count) Register
	LBA_48 = Upper bytes of LBA High/Mid/Low Registers ]  ATA-8
	LH     = LBA High (was: Cylinder High) Register    ]   LBA
	LM     = LBA Mid (was: Cylinder Low) Register      ] Register
	LL     = LBA Low (was: Sector Number) Register     ]
	DV     = Device (was: Device/Head) Register
	DC     = Device Control Register
	ER     = Error register
	ST     = Status register
Powered_Up_Time is measured from power on, and printed as
DDd+hh:mm:SS.sss where DD=days, hh=hours, mm=minutes,
SS=sec, and sss=millisec. It "wraps" after 49.710 days.

Error 992 [7] occurred at disk power-on lifetime: 14175 hours (590 days + 15 hours)
  When the command that caused the error occurred, the device was active or idle.

  After command completion occurred, registers were:
  ER -- ST COUNT  LBA_48  LH LM LL DV DC
  -- -- -- == -- == == == -- -- -- -- --
  40 -- 51 00 f0 00 00 1e 70 1b 70 40 00  Error: UNC 240 sectors at LBA = 0x1e701b70 = 510663536

  Commands leading to the command that caused the error were:
  CR FEATR COUNT  LBA_48  LH LM LL DV DC  Powered_Up_Time  Command/Feature_Name
  -- == -- == -- == == == -- -- -- -- --  ---------------  --------------------
  25 00 00 00 f0 00 00 1e 70 1b 00 40 00 25d+01:03:08.083  READ DMA EXT
  25 00 00 00 f0 00 00 20 c7 67 e0 40 00 25d+01:03:08.080  READ DMA EXT
  25 00 00 00 10 00 00 1e 70 1a f0 40 00 25d+01:03:08.079  READ DMA EXT
  25 00 00 00 10 00 00 20 c7 67 d0 40 00 25d+01:03:08.079  READ DMA EXT
  25 00 00 00 f0 00 00 1e 70 1a 00 40 00 25d+01:03:08.076  READ DMA EXT

Error 991 [6] occurred at disk power-on lifetime: 12967 hours (540 days + 7 hours)
  When the command that caused the error occurred, the device was active or idle.

  After command completion occurred, registers were:
  ER -- ST COUNT  LBA_48  LH LM LL DV DC
  -- -- -- == -- == == == -- -- -- -- --
  40 -- 51 00 08 00 00 1f 1a 45 c0 40 00  Error: UNC 8 sectors at LBA = 0x1f1a45c0 = 521815488

  Commands leading to the command that caused the error were:
  CR FEATR COUNT  LBA_48  LH LM LL DV DC  Powered_Up_Time  Command/Feature_Name
  -- == -- == -- == == == -- -- -- -- --  ---------------  --------------------
  25 00 00 00 08 00 00 1f 1a 45 c0 40 00 28d+00:25:07.744  READ DMA EXT
  25 00 00 00 08 00 00 1f 1a 45 c0 40 00 28d+00:25:05.138  READ DMA EXT
  25 00 00 00 08 00 00 1f 1a 45 b8 40 00 28d+00:25:05.137  READ DMA EXT
  25 00 00 00 08 00 00 1f 1a 45 b0 40 00 28d+00:25:05.137  READ DMA EXT
  25 00 00 00 08 00 00 1f 1a 45 a8 40 00 28d+00:25:05.136  READ DMA EXT

Error 990 [5] occurred at disk power-on lifetime: 12967 hours (540 days + 7 hours)
  When the command that caused the error occurred, the device was active or idle.

  After command completion occurred, registers were:
  ER -- ST COUNT  LBA_48  LH LM LL DV DC
  -- -- -- == -- == == == -- -- -- -- --
  40 -- 51 00 08 00 00 1f 1a 45 c0 40 00  Error: UNC 8 sectors at LBA = 0x1f1a45c0 = 521815488

  Commands leading to the command that caused the error were:
  CR FEATR COUNT  LBA_48  LH LM LL DV DC  Powered_Up_Time  Command/Feature_Name
  -- == -- == -- == == == -- -- -- -- --  ---------------  --------------------
  25 00 00 00 08 00 00 1f 1a 45 c0 40 00 28d+00:25:05.138  READ DMA EXT
  25 00 00 00 08 00 00 1f 1a 45 b8 40 00 28d+00:25:05.137  READ DMA EXT
  25 00 00 00 08 00 00 1f 1a 45 b0 40 00 28d+00:25:05.137  READ DMA EXT
  25 00 00 00 08 00 00 1f 1a 45 a8 40 00 28d+00:25:05.136  READ DMA EXT
  25 00 00 00 08 00 00 1f 1a 45 a0 40 00 28d+00:25:05.136  READ DMA EXT

Error 989 [4] occurred at disk power-on lifetime: 12967 hours (540 days + 7 hours)
  When the command that caused the error occurred, the device was active or idle.

  After command completion occurred, registers were:
  ER -- ST COUNT  LBA_48  LH LM LL DV DC
  -- -- -- == -- == == == -- -- -- -- --
  40 -- 51 00 08 00 00 1f 1a 3b d0 40 00  Error: UNC 8 sectors at LBA = 0x1f1a3bd0 = 521812944

  Commands leading to the command that caused the error were:
  CR FEATR COUNT  LBA_48  LH LM LL DV DC  Powered_Up_Time  Command/Feature_Name
  -- == -- == -- == == == -- -- -- -- --  ---------------  --------------------
  25 00 00 00 08 00 00 1f 1a 3b d0 40 00 28d+00:24:54.840  READ DMA EXT
  ec 00 00 00 01 00 00 00 00 00 00 00 00 28d+00:24:54.756  IDENTIFY DEVICE
  25 00 00 00 08 00 00 1f 1a 3b d0 40 00 28d+00:24:52.131  READ DMA EXT
  ec 00 00 00 01 00 00 00 00 00 00 00 00 28d+00:24:52.048  IDENTIFY DEVICE
  25 00 00 00 08 00 00 1f 1a 3b d0 40 00 28d+00:24:49.425  READ DMA EXT

Error 988 [3] occurred at disk power-on lifetime: 12967 hours (540 days + 7 hours)
  When the command that caused the error occurred, the device was active or idle.

  After command completion occurred, registers were:
  ER -- ST COUNT  LBA_48  LH LM LL DV DC
  -- -- -- == -- == == == -- -- -- -- --
  40 -- 51 00 08 00 00 1f 1a 3b d0 40 00  Error: UNC 8 sectors at LBA = 0x1f1a3bd0 = 521812944

  Commands leading to the command that caused the error were:
  CR FEATR COUNT  LBA_48  LH LM LL DV DC  Powered_Up_Time  Command/Feature_Name
  -- == -- == -- == == == -- -- -- -- --  ---------------  --------------------
  25 00 00 00 08 00 00 1f 1a 3b d0 40 00 28d+00:24:52.131  READ DMA EXT
  ec 00 00 00 01 00 00 00 00 00 00 00 00 28d+00:24:52.048  IDENTIFY DEVICE
  25 00 00 00 08 00 00 1f 1a 3b d0 40 00 28d+00:24:49.425  READ DMA EXT
  25 00 00 00 08 00 00 1f 1a 3c 38 40 00 28d+00:24:49.405  READ DMA EXT
  25 00 00 00 10 00 00 1f 1a 3b 80 40 00 28d+00:24:49.404  READ DMA EXT

Error 987 [2] occurred at disk power-on lifetime: 12967 hours (540 days + 7 hours)
  When the command that caused the error occurred, the device was active or idle.

  After command completion occurred, registers were:
  ER -- ST COUNT  LBA_48  LH LM LL DV DC
  -- -- -- == -- == == == -- -- -- -- --
  40 -- 51 00 08 00 00 1f 1a 3b d0 40 00  Error: UNC 8 sectors at LBA = 0x1f1a3bd0 = 521812944

  Commands leading to the command that caused the error were:
  CR FEATR COUNT  LBA_48  LH LM LL DV DC  Powered_Up_Time  Command/Feature_Name
  -- == -- == -- == == == -- -- -- -- --  ---------------  --------------------
  25 00 00 00 08 00 00 1f 1a 3b d0 40 00 28d+00:24:49.425  READ DMA EXT
  25 00 00 00 08 00 00 1f 1a 3c 38 40 00 28d+00:24:49.405  READ DMA EXT
  25 00 00 00 10 00 00 1f 1a 3b 80 40 00 28d+00:24:49.404  READ DMA EXT
  25 00 00 00 f0 00 00 1f 1a 3a 90 40 00 28d+00:24:49.396  READ DMA EXT
  25 00 00 00 08 00 00 1f 18 9f 60 40 00 28d+00:24:49.395  READ DMA EXT

Error 986 [1] occurred at disk power-on lifetime: 12967 hours (540 days + 7 hours)
  When the command that caused the error occurred, the device was active or idle.

  After command completion occurred, registers were:
  ER -- ST COUNT  LBA_48  LH LM LL DV DC
  -- -- -- == -- == == == -- -- -- -- --
  40 -- 51 00 08 00 00 1f 18 97 88 40 00  Error: UNC 8 sectors at LBA = 0x1f189788 = 521705352

  Commands leading to the command that caused the error were:
  CR FEATR COUNT  LBA_48  LH LM LL DV DC  Powered_Up_Time  Command/Feature_Name
  -- == -- == -- == == == -- -- -- -- --  ---------------  --------------------
  25 00 d5 00 08 00 00 1f 18 97 88 40 00 28d+00:24:46.143  READ DMA EXT
  25 00 d5 00 08 00 00 1f 18 97 88 40 00 28d+00:24:43.490  READ DMA EXT
  25 00 d5 00 08 00 00 1f 18 97 88 40 00 28d+00:24:40.922  READ DMA EXT
  25 00 d5 00 08 00 00 1f 18 97 80 40 00 28d+00:24:40.921  READ DMA EXT
  25 00 d5 00 08 00 00 1f 18 97 78 40 00 28d+00:24:40.921  READ DMA EXT

Error 985 [0] occurred at disk power-on lifetime: 12967 hours (540 days + 7 hours)
  When the command that caused the error occurred, the device was active or idle.

  After command completion occurred, registers were:
  ER -- ST COUNT  LBA_48  LH LM LL DV DC
  -- -- -- == -- == == == -- -- -- -- --
  40 -- 51 00 08 00 00 1f 18 97 88 40 00  Error: UNC 8 sectors at LBA = 0x1f189788 = 521705352

  Commands leading to the command that caused the error were:
  CR FEATR COUNT  LBA_48  LH LM LL DV DC  Powered_Up_Time  Command/Feature_Name
  -- == -- == -- == == == -- -- -- -- --  ---------------  --------------------
  25 00 d5 00 08 00 00 1f 18 97 88 40 00 28d+00:24:43.490  READ DMA EXT
  25 00 d5 00 08 00 00 1f 18 97 88 40 00 28d+00:24:40.922  READ DMA EXT
  25 00 d5 00 08 00 00 1f 18 97 80 40 00 28d+00:24:40.921  READ DMA EXT
  25 00 d5 00 08 00 00 1f 18 97 78 40 00 28d+00:24:40.921  READ DMA EXT
  25 00 d5 00 08 00 00 1f 18 97 70 40 00 28d+00:24:40.920  READ DMA EXT

SMART Extended Self-test Log Version: 1 (1 sectors)
Num  Test_Description    Status                  Remaining  LifeTime(hours)  LBA_of_first_error
# 1  Short offline       Completed without error       00%      9080         -

Selective Self-tests/Logging not supported

SCT Status Version:                  3
SCT Version (vendor specific):       258 (0x0102)
Device State:                        Active (0)
Current Temperature:                    36 Celsius
Power Cycle Min/Max Temperature:     29/39 Celsius
Lifetime    Min/Max Temperature:     14/54 Celsius
Specified Max Operating Temperature:    38 Celsius
Under/Over Temperature Limit Count:   0/0
Vendor specific:
01 00 00 00 00 00 00 00 00 00 00 00 00 00 00 00
00 00 00 00 00 00 00 00 00 00 00 00 00 00 00 00

SCT Temperature History Version:     2
Temperature Sampling Period:         1 minute
Temperature Logging Interval:        1 minute
Min/Max recommended Temperature:      0/60 Celsius
Min/Max Temperature Limit:           -41/85 Celsius
Temperature History Size (Index):    128 (60)

SCT Error Recovery Control command not supported

Device Statistics (GP/SMART Log 0x04) not supported

Pending Defects log (GP Log 0x0c) not supported

SATA Phy Event Counters (GP Log 0x11)
ID      Size     Value  Description
0x0001  2            0  Command failed due to ICRC error
0x0002  2            0  R_ERR response for data FIS
0x0003  2            0  R_ERR response for device-to-host data FIS
0x0004  2            0  R_ERR response for host-to-device data FIS
0x0005  2            0  R_ERR response for non-data FIS
0x0006  2            0  R_ERR response for device-to-host non-data FIS
0x0007  2            0  R_ERR response for host-to-device non-data FIS
0x0008  2            0  Device-to-host non-data FIS retries
0x0009  2            2  Transition from drive PhyRdy to drive PhyNRdy
0x000a  2            3  Device-to-host register FISes sent due to a COMRESET
0x000b  2            0  CRC errors within host-to-device FIS
0x000d  2            0  Non-CRC errors within host-to-device FIS
0x000f  2            0  R_ERR response for host-to-device data FIS, CRC
0x0012  2            0  R_ERR response for host-to-device non-data FIS, CRC
0x8000  4       297746  Vendor specific

