smartctl 7.2 2020-12-30 r5155 [x86_64-linux-5.10.14-desktop-1omv4002] (OpenMandriva Lx 7.2-2)
Copyright (C) 2002-20, Bruce Allen, Christian Franke, www.smartmontools.org

=== START OF INFORMATION SECTION ===
Model Family:     Marvell based SanDisk SSDs
Device Model:     SanDisk SDSSDHP128G
Serial Number:    --
LU WWN Device Id: 5 001b44 ...
Firmware Version: X2306RL
User Capacity:    128,035,676,160 bytes [128 GB]
Sector Size:      512 bytes logical/physical
Rotation Rate:    Solid State Device
Form Factor:      Unknown (0x000a)
TRIM Command:     Available, deterministic, zeroed
Device is:        In smartctl database [for details use: -P show]
ATA Version is:   ATA8-ACS T13/1699-D revision 6
SATA Version is:  SATA 3.0, 6.0 Gb/s (current: 6.0 Gb/s)
Local Time is:    Sat Mar 20 14:23:57 2021 EDT
SMART support is: Available - device has SMART capability.
SMART support is: Enabled
AAM feature is:   Unavailable
APM level is:     128 (minimum power consumption without standby)
Rd look-ahead is: Enabled
Write cache is:   Enabled
DSN feature is:   Unavailable
ATA Security is:  Disabled, frozen [SEC2]
Wt Cache Reorder: Unavailable

=== START OF READ SMART DATA SECTION ===
SMART overall-health self-assessment test result: PASSED

General SMART Values:
Offline data collection status:  (0x00)	Offline data collection activity
					was never started.
					Auto Offline Data Collection: Disabled.
Self-test execution status:      (   0)	The previous self-test routine completed
					without error or no self-test has ever 
					been run.
Total time to complete Offline 
data collection: 		(    0) seconds.
Offline data collection
capabilities: 			 (0x11) SMART execute Offline immediate.
					No Auto Offline data collection support.
					Suspend Offline collection upon new
					command.
					No Offline surface scan supported.
					Self-test supported.
					No Conveyance Self-test supported.
					No Selective Self-test supported.
SMART capabilities:            (0x0003)	Saves SMART data before entering
					power-saving mode.
					Supports SMART auto save timer.
Error logging capability:        (0x01)	Error logging supported.
					General Purpose Logging supported.
Short self-test routine 
recommended polling time: 	 (   2) minutes.
Extended self-test routine
recommended polling time: 	 (  10) minutes.

SMART Attributes Data Structure revision number: 4
Vendor Specific SMART Attributes with Thresholds:
ID# ATTRIBUTE_NAME          FLAGS    VALUE WORST THRESH FAIL RAW_VALUE
  5 Reallocated_Sector_Ct   -O--CK   100   100   ---    -    0
  9 Power_On_Hours          -O--CK   253   100   ---    -    16397
 12 Power_Cycle_Count       -O--CK   100   100   ---    -    9361
166 Min_W/E_Cycle           -O--CK   100   100   ---    -    85
167 Min_Bad_Block/Die       -O--CK   100   100   ---    -    29
168 Maximum_Erase_Cycle     -O--CK   100   100   ---    -    376
169 Total_Bad_Block         -O--CK   100   100   ---    -    177
171 Program_Fail_Count      -O--CK   100   100   ---    -    0
172 Erase_Fail_Count        -O--CK   100   100   ---    -    0
173 Avg_Write/Erase_Count   -O--CK   100   100   ---    -    271
174 Unexpect_Power_Loss_Ct  -O--CK   100   100   ---    -    640
187 Reported_Uncorrect      -O--CK   100   100   ---    -    0
194 Temperature_Celsius     -O---K   061   051   ---    -    39 (Min/Max 14/51)
212 SATA_PHY_Error          -O--CK   100   100   ---    -    0
230 Perc_Write/Erase_Count  -O--CK   100   100   ---    -    0 0 2307
232 Perc_Avail_Resrvd_Space PO--CK   100   100   004    -    100
233 Total_NAND_Writes_GiB   -O--CK   100   100   ---    -    35201
241 Total_Writes_GiB        ----CK   253   253   ---    -    13112
242 Total_Reads_GiB         ----CK   253   253   ---    -    9204
243 Unknown_Marvell_Attr    -O--CK   100   100   ---    -    0
                            ||||||_ K auto-keep
                            |||||__ C event count
                            ||||___ R error rate
                            |||____ S speed/performance
                            ||_____ O updated online
                            |______ P prefailure warning

General Purpose Log Directory Version 1
SMART           Log Directory Version 1 [multi-sector log support]
Address    Access  R/W   Size  Description
0x00       GPL,SL  R/O      1  Log Directory
0x01           SL  R/O      1  Summary SMART error log
0x02           SL  R/O      2  Comprehensive SMART error log
0x03       GPL     R/O      1  Ext. Comprehensive SMART error log
0x04       GPL,SL  R/O      8  Device Statistics log
0x06           SL  R/O      1  SMART self-test log
0x07       GPL     R/O      1  Extended self-test log
0x10       GPL     R/O      1  NCQ Command Error log
0x11       GPL     R/O      1  SATA Phy Event Counters log
0x30       GPL,SL  R/O      9  IDENTIFY DEVICE data log
0x80-0x9f  GPL,SL  R/W     16  Host vendor specific log

SMART Extended Comprehensive Error Log Version: 1 (1 sectors)
No Errors Logged

SMART Extended Self-test Log Version: 1 (1 sectors)
Num  Test_Description    Status                  Remaining  LifeTime(hours)  LBA_of_first_error
# 1  Short offline       Completed without error       00%     14075         -
# 2  Short offline       Completed without error       00%     14058         -
# 3  Short offline       Completed without error       00%     14032         -
# 4  Short offline       Completed without error       00%     14016         -
# 5  Short offline       Completed without error       00%     14000         -
# 6  Short offline       Completed without error       00%     13984         -
# 7  Short offline       Completed without error       00%     13966         -
# 8  Short offline       Completed without error       00%     13937         -
# 9  Short offline       Completed without error       00%     13921         -
#10  Short offline       Completed without error       00%     13905         -
#11  Short offline       Completed without error       00%     13890         -
#12  Short offline       Completed without error       00%     13874         -
#13  Short offline       Completed without error       00%     13857         -
#14  Short offline       Completed without error       00%     13842         -
#15  Short offline       Completed without error       00%     13823         -

Selective Self-tests/Logging not supported

SCT Commands not supported

Device Statistics (GP Log 0x04)
Page  Offset Size        Value Flags Description
0x07  =====  =               =  ===  == Solid State Device Statistics (rev 1) ==
0x07  0x008  1               9  ---  Percentage Used Endurance Indicator
                                |||_ C monitored condition met
                                ||__ D supports DSN
                                |___ N normalized value

Pending Defects log (GP Log 0x0c) not supported

SATA Phy Event Counters (GP Log 0x11)
ID      Size     Value  Description
0x0001  4            0  Command failed due to ICRC error
0x0002  4            0  R_ERR response for data FIS
0x0005  4            0  R_ERR response for non-data FIS
0x000a  4            3  Device-to-host register FISes sent due to a COMRESET

