=== START OF INFORMATION SECTION ===
Model Family:     Toshiba 2.5" HDD MK..65GSX
Device Model:     TOSHIBA MK3265GSX
Serial Number:    --
LU WWN Device Id: 5 000039 ...
Firmware Version: GJ002J
User Capacity:    320 072 933 376 bytes [320 GB]
Sector Size:      512 bytes logical/physical
Rotation Rate:    5400 rpm
Form Factor:      2.5 inches
Device is:        In smartctl database [for details use: -P show]
ATA Version is:   ATA8-ACS (minor revision not indicated)
SATA Version is:  SATA 2.6, 3.0 Gb/s (current: 3.0 Gb/s)
Local Time is:    Fri Oct 14 20:23:32 2016 MSK
SMART support is: Available - device has SMART capability.
SMART support is: Enabled
AAM feature is:   Unavailable
APM level is:     128 (minimum power consumption without standby)
Rd look-ahead is: Enabled
Write cache is:   Enabled
ATA Security is:  Disabled, frozen [SEC2]
Wt Cache Reorder: Enabled

=== START OF READ SMART DATA SECTION ===
SMART overall-health self-assessment test result: PASSED

General SMART Values:
Offline data collection status:  (0x82)	Offline data collection activity
					was completed without error.
					Auto Offline Data Collection: Enabled.
Self-test execution status:      (   0)	The previous self-test routine completed
					without error or no self-test has ever 
					been run.
Total time to complete Offline 
data collection: 		(  120) seconds.
Offline data collection
capabilities: 			 (0x5b) SMART execute Offline immediate.
					Auto Offline data collection on/off support.
					Suspend Offline collection upon new
					command.
					Offline surface scan supported.
					Self-test supported.
					No Conveyance Self-test supported.
					Selective Self-test supported.
SMART capabilities:            (0x0003)	Saves SMART data before entering
					power-saving mode.
					Supports SMART auto save timer.
Error logging capability:        (0x01)	Error logging supported.
					General Purpose Logging supported.
Short self-test routine 
recommended polling time: 	 (   2) minutes.
Extended self-test routine
recommended polling time: 	 (  95) minutes.
SCT capabilities: 	       (0x003d)	SCT Status supported.
					SCT Error Recovery Control supported.
					SCT Feature Control supported.
					SCT Data Table supported.

SMART Attributes Data Structure revision number: 16
Vendor Specific SMART Attributes with Thresholds:
ID# ATTRIBUTE_NAME          FLAGS    VALUE WORST THRESH FAIL RAW_VALUE
  1 Raw_Read_Error_Rate     PO-R--   100   100   050    -    0
  2 Throughput_Performance  P-S---   100   100   050    -    0
  3 Spin_Up_Time            POS--K   100   100   001    -    1192
  4 Start_Stop_Count        -O--CK   100   100   000    -    2351
  5 Reallocated_Sector_Ct   PO--CK   100   100   050    -    1
  7 Seek_Error_Rate         PO-R--   100   100   050    -    0
  8 Seek_Time_Performance   P-S---   100   100   050    -    0
  9 Power_On_Hours          -O--CK   088   088   000    -    4832
 10 Spin_Retry_Count        PO--CK   146   100   030    -    0
 12 Power_Cycle_Count       -O--CK   100   100   000    -    2070
191 G-Sense_Error_Rate      -O--CK   100   100   000    -    56
192 Power-Off_Retract_Count -O--CK   100   100   000    -    192
193 Load_Cycle_Count        -O--CK   097   097   000    -    32277
194 Temperature_Celsius     -O---K   100   100   000    -    29 (Min/Max 13/55)
196 Reallocated_Event_Count -O--CK   100   100   000    -    1
197 Current_Pending_Sector  -O--CK   100   100   000    -    0
198 Offline_Uncorrectable   ----CK   100   100   000    -    0
199 UDMA_CRC_Error_Count    -O--CK   200   200   000    -    0
220 Disk_Shift              -O----   100   100   000    -    87
222 Loaded_Hours            -O--CK   091   091   000    -    3693
223 Load_Retry_Count        -O--CK   100   100   000    -    0
224 Load_Friction           -O---K   100   100   000    -    0
226 Load-in_Time            -OS--K   100   100   000    -    304
240 Head_Flying_Hours       P-----   100   100   001    -    0
                            ||||||_ K auto-keep
                            |||||__ C event count
                            ||||___ R error rate
                            |||____ S speed/performance
                            ||_____ O updated online
                            |______ P prefailure warning

General Purpose Log Directory Version 1
SMART           Log Directory Version 1 [multi-sector log support]
Address    Access  R/W   Size  Description
0x00       GPL,SL  R/O      1  Log Directory
0x01           SL  R/O      1  Summary SMART error log
0x02           SL  R/O     51  Comprehensive SMART error log
0x03       GPL     R/O     64  Ext. Comprehensive SMART error log
0x06           SL  R/O      1  SMART self-test log
0x07       GPL     R/O      1  Extended self-test log
0x09           SL  R/W      1  Selective self-test log
0x10       GPL     R/O      1  SATA NCQ Queued Error log
0x11       GPL     R/O      1  SATA Phy Event Counters log
0x80-0x9f  GPL,SL  R/W     16  Host vendor specific log
0xe0       GPL,SL  R/W      1  SCT Command/Status
0xe1       GPL,SL  R/W      1  SCT Data Transfer

SMART Extended Comprehensive Error Log Version: 1 (64 sectors)
Device Error Count: 591 (device log contains only the most recent 256 errors)
	CR     = Command Register
	FEATR  = Features Register
	COUNT  = Count (was: Sector Count) Register
	LBA_48 = Upper bytes of LBA High/Mid/Low Registers ]  ATA-8
	LH     = LBA High (was: Cylinder High) Register    ]   LBA
	LM     = LBA Mid (was: Cylinder Low) Register      ] Register
	LL     = LBA Low (was: Sector Number) Register     ]
	DV     = Device (was: Device/Head) Register
	DC     = Device Control Register
	ER     = Error register
	ST     = Status register
Powered_Up_Time is measured from power on, and printed as
DDd+hh:mm:SS.sss where DD=days, hh=hours, mm=minutes,
SS=sec, and sss=millisec. It "wraps" after 49.710 days.

Error 591 [78] occurred at disk power-on lifetime: 4409 hours (183 days + 17 hours)
  When the command that caused the error occurred, the device was active or idle.

  After command completion occurred, registers were:
  ER -- ST COUNT  LBA_48  LH LM LL DV DC
  -- -- -- == -- == == == -- -- -- -- --
  40 -- 51 00 00 00 00 04 d4 14 e9 e4 00  Error: UNC at LBA = 0x04d414e9 = 81007849

  Commands leading to the command that caused the error were:
  CR FEATR COUNT  LBA_48  LH LM LL DV DC  Powered_Up_Time  Command/Feature_Name
  -- == -- == -- == == == -- -- -- -- --  ---------------  --------------------
  42 03 00 00 ff 00 00 04 d4 14 13 e0 00     00:08:37.589  READ VERIFY SECTOR(S) EXT
  42 03 00 00 ff 00 00 04 d4 13 14 e0 00     00:08:37.588  READ VERIFY SECTOR(S) EXT
  42 03 00 00 ff 00 00 04 d4 12 15 e0 00     00:08:37.585  READ VERIFY SECTOR(S) EXT
  42 03 00 00 ff 00 00 04 d4 11 16 e0 00     00:08:37.584  READ VERIFY SECTOR(S) EXT
  42 03 00 00 ff 00 00 04 d4 10 17 e0 00     00:08:37.582  READ VERIFY SECTOR(S) EXT

Error 590 [77] occurred at disk power-on lifetime: 4405 hours (183 days + 13 hours)
  When the command that caused the error occurred, the device was active or idle.

  After command completion occurred, registers were:
  ER -- ST COUNT  LBA_48  LH LM LL DV DC
  -- -- -- == -- == == == -- -- -- -- --
  40 -- 51 00 17 00 00 04 d4 14 e9 44 00  Error: UNC 23 sectors at LBA = 0x04d414e9 = 81007849

  Commands leading to the command that caused the error were:
  CR FEATR COUNT  LBA_48  LH LM LL DV DC  Powered_Up_Time  Command/Feature_Name
  -- == -- == -- == == == -- -- -- -- --  ---------------  --------------------
  25 03 03 00 40 00 00 04 d4 14 c0 44 00     01:04:46.974  READ DMA EXT
  25 03 03 00 40 00 00 04 d4 14 80 44 00     01:04:46.972  READ DMA EXT
  25 03 03 00 40 00 00 04 d4 14 40 44 00     01:04:46.970  READ DMA EXT
  25 03 03 00 40 00 00 04 d4 14 00 44 00     01:04:46.968  READ DMA EXT
  25 03 03 00 40 00 00 04 d4 13 c0 44 00     01:04:46.966  READ DMA EXT

Error 589 [76] occurred at disk power-on lifetime: 4403 hours (183 days + 11 hours)
  When the command that caused the error occurred, the device was active or idle.

  After command completion occurred, registers were:
  ER -- ST COUNT  LBA_48  LH LM LL DV DC
  -- -- -- == -- == == == -- -- -- -- --
  40 -- 51 00 17 00 00 04 d4 14 e9 44 00  Error: UNC 23 sectors at LBA = 0x04d414e9 = 81007849

  Commands leading to the command that caused the error were:
  CR FEATR COUNT  LBA_48  LH LM LL DV DC  Powered_Up_Time  Command/Feature_Name
  -- == -- == -- == == == -- -- -- -- --  ---------------  --------------------
  25 03 03 00 40 00 00 04 d4 14 c0 44 00     00:47:21.448  READ DMA EXT
  25 03 03 00 40 00 00 04 d4 14 80 44 00     00:47:21.446  READ DMA EXT
  25 03 03 00 40 00 00 04 d4 14 40 44 00     00:47:21.444  READ DMA EXT
  25 03 03 00 40 00 00 04 d4 14 00 44 00     00:47:21.442  READ DMA EXT
  25 03 03 00 40 00 00 04 d4 13 c0 44 00     00:47:21.440  READ DMA EXT

Error 588 [75] occurred at disk power-on lifetime: 4398 hours (183 days + 6 hours)
  When the command that caused the error occurred, the device was active or idle.

  After command completion occurred, registers were:
  ER -- ST COUNT  LBA_48  LH LM LL DV DC
  -- -- -- == -- == == == -- -- -- -- --
  40 -- 41 00 7a 00 00 04 d4 14 e9 64 00  Error: UNC at LBA = 0x04d414e9 = 81007849

  Commands leading to the command that caused the error were:
  CR FEATR COUNT  LBA_48  LH LM LL DV DC  Powered_Up_Time  Command/Feature_Name
  -- == -- == -- == == == -- -- -- -- --  ---------------  --------------------
  60 01 00 00 78 00 00 04 d4 14 70 40 00     01:55:03.825  READ FPDMA QUEUED
  61 00 08 00 48 00 00 02 19 10 e8 40 00     01:55:03.825  WRITE FPDMA QUEUED
  60 01 00 00 40 00 00 02 43 c3 68 40 00     01:55:03.825  READ FPDMA QUEUED
  60 01 00 00 38 00 00 02 43 c2 68 40 00     01:55:03.825  READ FPDMA QUEUED
  60 01 00 00 30 00 00 02 43 c1 68 40 00     01:55:03.825  READ FPDMA QUEUED

Error 587 [74] occurred at disk power-on lifetime: 4398 hours (183 days + 6 hours)
  When the command that caused the error occurred, the device was active or idle.

  After command completion occurred, registers were:
  ER -- ST COUNT  LBA_48  LH LM LL DV DC
  -- -- -- == -- == == == -- -- -- -- --
  40 -- 41 00 2a 00 00 04 d4 14 e9 64 00  Error: WP at LBA = 0x04d414e9 = 81007849

  Commands leading to the command that caused the error were:
  CR FEATR COUNT  LBA_48  LH LM LL DV DC  Powered_Up_Time  Command/Feature_Name
  -- == -- == -- == == == -- -- -- -- --  ---------------  --------------------
  61 00 08 00 20 00 00 01 a3 8d c0 40 00     01:54:59.569  WRITE FPDMA QUEUED
  61 00 08 00 18 00 00 02 03 f0 80 40 00     01:54:59.568  WRITE FPDMA QUEUED
  61 00 08 00 10 00 00 01 fe e0 c8 40 00     01:54:59.567  WRITE FPDMA QUEUED
  61 00 28 00 08 00 00 01 ff d5 40 40 00     01:54:59.567  WRITE FPDMA QUEUED
  61 00 80 00 58 00 00 17 6a 79 88 40 00     01:54:59.551  WRITE FPDMA QUEUED

Error 586 [73] occurred at disk power-on lifetime: 4398 hours (183 days + 6 hours)
  When the command that caused the error occurred, the device was active or idle.

  After command completion occurred, registers were:
  ER -- ST COUNT  LBA_48  LH LM LL DV DC
  -- -- -- == -- == == == -- -- -- -- --
  40 -- 41 00 7a 00 00 04 d4 14 e9 64 00  Error: WP at LBA = 0x04d414e9 = 81007849

  Commands leading to the command that caused the error were:
  CR FEATR COUNT  LBA_48  LH LM LL DV DC  Powered_Up_Time  Command/Feature_Name
  -- == -- == -- == == == -- -- -- -- --  ---------------  --------------------
  61 00 08 00 28 00 00 01 a3 8d c0 40 00     01:54:55.325  WRITE FPDMA QUEUED
  61 00 08 00 20 00 00 02 03 f0 80 40 00     01:54:55.324  WRITE FPDMA QUEUED
  61 00 08 00 18 00 00 01 fe e0 c0 40 00     01:54:55.324  WRITE FPDMA QUEUED
  61 00 08 00 10 00 00 01 fe e0 b8 40 00     01:54:55.324  WRITE FPDMA QUEUED
  61 00 08 00 10 00 00 01 fe e0 c8 40 00     01:54:55.322  WRITE FPDMA QUEUED

Error 585 [72] occurred at disk power-on lifetime: 4398 hours (183 days + 6 hours)
  When the command that caused the error occurred, the device was active or idle.

  After command completion occurred, registers were:
  ER -- ST COUNT  LBA_48  LH LM LL DV DC
  -- -- -- == -- == == == -- -- -- -- --
  40 -- 41 00 32 00 00 04 d4 14 e9 64 00  Error: WP at LBA = 0x04d414e9 = 81007849

  Commands leading to the command that caused the error were:
  CR FEATR COUNT  LBA_48  LH LM LL DV DC  Powered_Up_Time  Command/Feature_Name
  -- == -- == -- == == == -- -- -- -- --  ---------------  --------------------
  61 00 10 00 48 00 00 02 03 36 d8 40 00     01:54:51.058  WRITE FPDMA QUEUED
  61 00 08 00 40 00 00 01 fe e0 c0 40 00     01:54:51.058  WRITE FPDMA QUEUED
  61 00 08 00 48 00 00 01 a3 8d c0 40 00     01:54:51.044  WRITE FPDMA QUEUED
  61 00 08 00 40 00 00 02 05 fe 78 40 00     01:54:51.044  WRITE FPDMA QUEUED
  61 00 08 00 28 00 00 02 03 f0 80 40 00     01:54:51.043  WRITE FPDMA QUEUED

Error 584 [71] occurred at disk power-on lifetime: 4398 hours (183 days + 6 hours)
  When the command that caused the error occurred, the device was active or idle.

  After command completion occurred, registers were:
  ER -- ST COUNT  LBA_48  LH LM LL DV DC
  -- -- -- == -- == == == -- -- -- -- --
  40 -- 41 00 3a 00 00 04 d4 14 e9 64 00  Error: WP at LBA = 0x04d414e9 = 81007849

  Commands leading to the command that caused the error were:
  CR FEATR COUNT  LBA_48  LH LM LL DV DC  Powered_Up_Time  Command/Feature_Name
  -- == -- == -- == == == -- -- -- -- --  ---------------  --------------------
  61 00 08 00 88 00 00 01 a3 8d c0 40 00     01:54:46.715  WRITE FPDMA QUEUED
  61 00 08 00 80 00 00 01 fe e0 c0 40 00     01:54:46.715  WRITE FPDMA QUEUED
  61 00 08 00 78 00 00 02 03 f0 80 40 00     01:54:46.714  WRITE FPDMA QUEUED
  61 00 08 00 70 00 00 01 ff d5 08 40 00     01:54:46.714  WRITE FPDMA QUEUED
  61 00 08 00 68 00 00 02 9c dd 92 40 00     01:54:46.713  WRITE FPDMA QUEUED

SMART Extended Self-test Log Version: 1 (1 sectors)
No self-tests have been logged.  [To run self-tests, use: smartctl -t]

SMART Selective self-test log data structure revision number 1
 SPAN  MIN_LBA  MAX_LBA  CURRENT_TEST_STATUS
    1        0        0  Not_testing
    2        0        0  Not_testing
    3        0        0  Not_testing
    4        0        0  Not_testing
    5        0        0  Not_testing
Selective self-test flags (0x0):
  After scanning selected spans, do NOT read-scan remainder of disk.
If Selective self-test is pending on power-up, resume after 0 minute delay.

SCT Status Version:                  2
SCT Version (vendor specific):       1 (0x0001)
SCT Support Level:                   1
Device State:                        Active (0)
Current Temperature:                    29 Celsius
Power Cycle Min/Max Temperature:     19/29 Celsius
Lifetime    Min/Max Temperature:     13/55 Celsius
Under/Over Temperature Limit Count:   0/0

SCT Temperature History Version:     2
Temperature Sampling Period:         1 minute
Temperature Logging Interval:        1 minute
Min/Max recommended Temperature:      5/55 Celsius
Min/Max Temperature Limit:            5/55 Celsius
Temperature History Size (Index):    478 (174)

SCT Error Recovery Control:
           Read: Disabled
          Write: Disabled

Device Statistics (GP/SMART Log 0x04) not supported

SATA Phy Event Counters (GP Log 0x11)
ID      Size     Value  Description
0x0001  4            0  Command failed due to ICRC error
0x0002  4            0  R_ERR response for data FIS
0x0003  4            0  R_ERR response for device-to-host data FIS
0x0004  4            0  R_ERR response for host-to-device data FIS
0x0005  4            0  R_ERR response for non-data FIS
0x0006  4            0  R_ERR response for device-to-host non-data FIS
0x0007  4            0  R_ERR response for host-to-device non-data FIS
0x0008  4            0  Device-to-host non-data FIS retries
0x0009  4           35  Transition from drive PhyRdy to drive PhyNRdy
0x000a  4           35  Device-to-host register FISes sent due to a COMRESET
0x000b  4            0  CRC errors within host-to-device FIS
0x000d  4            0  Non-CRC errors within host-to-device FIS
0x000f  4            0  R_ERR response for host-to-device data FIS, CRC
0x0010  4            0  R_ERR response for host-to-device data FIS, non-CRC
0x0012  4            0  R_ERR response for host-to-device non-data FIS, CRC
0x0013  4            0  R_ERR response for host-to-device non-data FIS, non-CRC

