=== START OF INFORMATION SECTION ===
Model Family:     Western Digital Caviar Blue (SATA)
Device Model:     WDC WD5000AAKS-00A7B2
Serial Number:    --
LU WWN Device Id: 5 0014ee ...
Firmware Version: 01.03B01
User Capacity:    500 107 862 016 bytes [500 GB]
Sector Size:      512 bytes logical/physical
Device is:        In smartctl database [for details use: -P show]
ATA Version is:   ATA8-ACS (minor revision not indicated)
SATA Version is:  SATA 2.5, 3.0 Gb/s
Local Time is:    Sat Mar  4 07:19:43 2017 +03
SMART support is: Available - device has SMART capability.
SMART support is: Enabled
AAM feature is:   Disabled
APM feature is:   Unavailable
Rd look-ahead is: Enabled
Write cache is:   Enabled
ATA Security is:  Disabled, NOT FROZEN [SEC1]
Wt Cache Reorder: Enabled

=== START OF READ SMART DATA SECTION ===
SMART overall-health self-assessment test result: PASSED

General SMART Values:
Offline data collection status:  (0x84)	Offline data collection activity
					was suspended by an interrupting command from host.
					Auto Offline Data Collection: Enabled.
Self-test execution status:      (   0)	The previous self-test routine completed
					without error or no self-test has ever 
					been run.
Total time to complete Offline 
data collection: 		( 8400) seconds.
Offline data collection
capabilities: 			 (0x7b) SMART execute Offline immediate.
					Auto Offline data collection on/off support.
					Suspend Offline collection upon new
					command.
					Offline surface scan supported.
					Self-test supported.
					Conveyance Self-test supported.
					Selective Self-test supported.
SMART capabilities:            (0x0003)	Saves SMART data before entering
					power-saving mode.
					Supports SMART auto save timer.
Error logging capability:        (0x01)	Error logging supported.
					General Purpose Logging supported.
Short self-test routine 
recommended polling time: 	 (   2) minutes.
Extended self-test routine
recommended polling time: 	 ( 100) minutes.
Conveyance self-test routine
recommended polling time: 	 (   5) minutes.
SCT capabilities: 	       (0x3037)	SCT Status supported.
					SCT Feature Control supported.
					SCT Data Table supported.

SMART Attributes Data Structure revision number: 16
Vendor Specific SMART Attributes with Thresholds:
ID# ATTRIBUTE_NAME          FLAGS    VALUE WORST THRESH FAIL RAW_VALUE
  1 Raw_Read_Error_Rate     POSR-K   200   200   051    -    0
  3 Spin_Up_Time            POS--K   159   158   021    -    5008
  4 Start_Stop_Count        -O--CK   097   097   000    -    3338
  5 Reallocated_Sector_Ct   PO--CK   200   200   140    -    0
  7 Seek_Error_Rate         -OSR-K   100   253   000    -    0
  9 Power_On_Hours          -O--CK   091   091   000    -    7115
 10 Spin_Retry_Count        -O--CK   100   100   000    -    0
 11 Calibration_Retry_Count -O--CK   100   100   000    -    0
 12 Power_Cycle_Count       -O--CK   097   097   000    -    3261
192 Power-Off_Retract_Count -O--CK   197   197   000    -    2675
193 Load_Cycle_Count        -O--CK   199   199   000    -    3338
194 Temperature_Celsius     -O---K   122   100   000    -    25
196 Reallocated_Event_Count -O--CK   200   200   000    -    0
197 Current_Pending_Sector  -O--CK   200   200   000    -    0
198 Offline_Uncorrectable   ----CK   200   200   000    -    1
199 UDMA_CRC_Error_Count    -O--CK   200   200   000    -    0
200 Multi_Zone_Error_Rate   ---R--   200   200   000    -    0
                            ||||||_ K auto-keep
                            |||||__ C event count
                            ||||___ R error rate
                            |||____ S speed/performance
                            ||_____ O updated online
                            |______ P prefailure warning

General Purpose Log Directory Version 1
SMART           Log Directory Version 1 [multi-sector log support]
Address    Access  R/W   Size  Description
0x00       GPL,SL  R/O      1  Log Directory
0x01           SL  R/O      1  Summary SMART error log
0x02           SL  R/O      5  Comprehensive SMART error log
0x03       GPL     R/O      6  Ext. Comprehensive SMART error log
0x06           SL  R/O      1  SMART self-test log
0x07       GPL     R/O      1  Extended self-test log
0x09           SL  R/W      1  Selective self-test log
0x10       GPL     R/O      1  SATA NCQ Queued Error log
0x11       GPL     R/O      1  SATA Phy Event Counters log
0x80-0x9f  GPL,SL  R/W     16  Host vendor specific log
0xa0-0xa7  GPL,SL  VS      16  Device vendor specific log
0xa8-0xb7  GPL,SL  VS       1  Device vendor specific log
0xc0       GPL,SL  VS       1  Device vendor specific log
0xc1       GPL     VS      24  Device vendor specific log
0xe0       GPL,SL  R/W      1  SCT Command/Status
0xe1       GPL,SL  R/W      1  SCT Data Transfer

SMART Extended Comprehensive Error Log Version: 1 (6 sectors)
Device Error Count: 31 (device log contains only the most recent 24 errors)
	CR     = Command Register
	FEATR  = Features Register
	COUNT  = Count (was: Sector Count) Register
	LBA_48 = Upper bytes of LBA High/Mid/Low Registers ]  ATA-8
	LH     = LBA High (was: Cylinder High) Register    ]   LBA
	LM     = LBA Mid (was: Cylinder Low) Register      ] Register
	LL     = LBA Low (was: Sector Number) Register     ]
	DV     = Device (was: Device/Head) Register
	DC     = Device Control Register
	ER     = Error register
	ST     = Status register
Powered_Up_Time is measured from power on, and printed as
DDd+hh:mm:SS.sss where DD=days, hh=hours, mm=minutes,
SS=sec, and sss=millisec. It "wraps" after 49.710 days.

Error 31 [6] occurred at disk power-on lifetime: 6716 hours (279 days + 20 hours)
  When the command that caused the error occurred, the device was active or idle.

  After command completion occurred, registers were:
  ER -- ST COUNT  LBA_48  LH LM LL DV DC
  -- -- -- == -- == == == -- -- -- -- --
  40 -- 51 00 00 00 00 00 ca c7 59 eb 00  Error: UNC at LBA = 0x0bcac759 = 197838681

  Commands leading to the command that caused the error were:
  CR FEATR COUNT  LBA_48  LH LM LL DV DC  Powered_Up_Time  Command/Feature_Name
  -- == -- == -- == == == -- -- -- -- --  ---------------  --------------------
  c8 00 00 00 38 00 00 00 ca c7 26 eb 0a     00:57:37.465  READ DMA
  c8 00 00 00 00 00 00 00 ca c6 26 eb 0a     00:57:37.449  READ DMA
  25 00 00 01 00 00 00 21 15 4b 16 e0 0a     00:57:37.448  READ DMA EXT
  25 00 00 01 00 00 00 21 15 4a 16 e0 0a     00:57:37.439  READ DMA EXT
  c8 00 00 00 00 00 00 00 ca c5 26 eb 0a     00:57:37.437  READ DMA

Error 30 [5] occurred at disk power-on lifetime: 6400 hours (266 days + 16 hours)
  When the command that caused the error occurred, the device was active or idle.

  After command completion occurred, registers were:
  ER -- ST COUNT  LBA_48  LH LM LL DV DC
  -- -- -- == -- == == == -- -- -- -- --
  40 -- 51 00 08 00 0b c7 00 ca 56 40 00  Error: UNC 8 sectors at LBA = 0xbc700ca56 = 50583358038

  Commands leading to the command that caused the error were:
  CR FEATR COUNT  LBA_48  LH LM LL DV DC  Powered_Up_Time  Command/Feature_Name
  -- == -- == -- == == == -- -- -- -- --  ---------------  --------------------
  25 00 ff 00 08 00 00 0b ca c7 56 40 08     02:28:51.881  READ DMA EXT
  25 00 ff 00 08 00 00 0b ca c7 4e 40 08     02:28:51.837  READ DMA EXT
  25 00 ff 00 4f 00 00 00 af 20 c7 40 08     02:28:51.797  READ DMA EXT
  25 00 ff 00 80 00 00 00 af 20 47 40 08     02:28:51.786  READ DMA EXT
  25 00 ff 00 40 00 00 00 af 14 ab 40 08     02:28:51.785  READ DMA EXT

Error 29 [4] occurred at disk power-on lifetime: 6400 hours (266 days + 16 hours)
  When the command that caused the error occurred, the device was active or idle.

  After command completion occurred, registers were:
  ER -- ST COUNT  LBA_48  LH LM LL DV DC
  -- -- -- == -- == == == -- -- -- -- --
  40 -- 51 00 20 00 0b c7 00 ca 46 40 00  Error: UNC 32 sectors at LBA = 0xbc700ca46 = 50583358022

  Commands leading to the command that caused the error were:
  CR FEATR COUNT  LBA_48  LH LM LL DV DC  Powered_Up_Time  Command/Feature_Name
  -- == -- == -- == == == -- -- -- -- --  ---------------  --------------------
  25 00 ff 00 20 00 00 0b ca c7 46 40 08     02:28:48.823  READ DMA EXT
  35 00 ff 00 10 00 00 04 7e d1 e6 40 08     02:28:48.822  WRITE DMA EXT
  25 00 ff 00 10 00 00 0b ca c7 46 40 08     02:28:48.822  READ DMA EXT
  35 00 ff 00 20 00 00 20 86 99 66 40 08     02:28:48.822  WRITE DMA EXT
  35 00 ff 00 20 00 00 04 7e d1 c6 40 08     02:28:48.822  WRITE DMA EXT

Error 28 [3] occurred at disk power-on lifetime: 6397 hours (266 days + 13 hours)
  When the command that caused the error occurred, the device was in an unknown state.

  After command completion occurred, registers were:
  ER -- ST COUNT  LBA_48  LH LM LL DV DC
  -- -- -- == -- == == == -- -- -- -- --
  40 -- 51 01 00 00 0b c6 00 ca e6 40 00  Error: UNC 256 sectors at LBA = 0xbc600cae6 = 50566580966

  Commands leading to the command that caused the error were:
  CR FEATR COUNT  LBA_48  LH LM LL DV DC  Powered_Up_Time  Command/Feature_Name
  -- == -- == -- == == == -- -- -- -- --  ---------------  --------------------
  25 00 ff 01 00 00 00 0b ca c6 e6 40 08     02:16:42.187  READ DMA EXT
  35 00 ff 00 08 00 00 00 5e 00 3f 40 08     02:16:42.187  WRITE DMA EXT
  25 00 ff 00 80 00 00 0b ca c6 86 40 08     02:16:42.187  READ DMA EXT
  35 00 ff 00 08 00 00 02 93 15 bf 40 08     02:16:42.187  WRITE DMA EXT
  35 00 ff 00 10 00 00 00 5e f4 b7 40 08     02:16:42.186  WRITE DMA EXT

Error 27 [2] occurred at disk power-on lifetime: 6397 hours (266 days + 13 hours)
  When the command that caused the error occurred, the device was active or idle.

  After command completion occurred, registers were:
  ER -- ST COUNT  LBA_48  LH LM LL DV DC
  -- -- -- == -- == == == -- -- -- -- --
  40 -- 51 01 00 00 0b c6 00 ca e6 40 00  Error: UNC 256 sectors at LBA = 0xbc600cae6 = 50566580966

  Commands leading to the command that caused the error were:
  CR FEATR COUNT  LBA_48  LH LM LL DV DC  Powered_Up_Time  Command/Feature_Name
  -- == -- == -- == == == -- -- -- -- --  ---------------  --------------------
  25 00 ff 01 00 00 00 0b ca c6 e6 40 08     02:16:39.687  READ DMA EXT
  25 00 ff 01 00 00 00 0b ca c5 e6 40 08     02:16:39.686  READ DMA EXT
  25 00 ff 01 00 00 00 0b ca c4 e6 40 08     02:16:39.685  READ DMA EXT
  25 00 ff 01 00 00 00 0b ca c3 e6 40 08     02:16:39.684  READ DMA EXT
  25 00 ff 01 00 00 00 0b ca c2 e6 40 08     02:16:39.683  READ DMA EXT

Error 26 [1] occurred at disk power-on lifetime: 3064 hours (127 days + 16 hours)
  When the command that caused the error occurred, the device was active or idle.

  After command completion occurred, registers were:
  ER -- ST COUNT  LBA_48  LH LM LL DV DC
  -- -- -- == -- == == == -- -- -- -- --
  40 -- 51 00 08 00 0b c7 00 ca 56 40 00  Error: UNC 8 sectors at LBA = 0xbc700ca56 = 50583358038

  Commands leading to the command that caused the error were:
  CR FEATR COUNT  LBA_48  LH LM LL DV DC  Powered_Up_Time  Command/Feature_Name
  -- == -- == -- == == == -- -- -- -- --  ---------------  --------------------
  25 d8 ff 00 08 00 00 0b ca c7 56 40 08     00:16:29.079  READ DMA EXT
  35 d8 ff 00 28 00 00 00 5f 1d 6f 40 08     00:16:29.079  WRITE DMA EXT
  25 d8 ff 00 01 00 00 00 00 00 00 40 08     00:16:29.078  READ DMA EXT
  25 d8 ff 00 10 00 00 34 85 39 fe 40 08     00:16:29.078  READ DMA EXT
  25 d8 ff 00 f8 00 00 34 85 39 06 40 08     00:16:29.077  READ DMA EXT

Error 25 [0] occurred at disk power-on lifetime: 3064 hours (127 days + 16 hours)
  When the command that caused the error occurred, the device was active or idle.

  After command completion occurred, registers were:
  ER -- ST COUNT  LBA_48  LH LM LL DV DC
  -- -- -- == -- == == == -- -- -- -- --
  40 -- 51 00 08 00 0b c7 00 ca 56 40 00  Error: UNC 8 sectors at LBA = 0xbc700ca56 = 50583358038

  Commands leading to the command that caused the error were:
  CR FEATR COUNT  LBA_48  LH LM LL DV DC  Powered_Up_Time  Command/Feature_Name
  -- == -- == -- == == == -- -- -- -- --  ---------------  --------------------
  25 d8 ff 00 08 00 00 0b ca c7 56 40 08     00:16:26.834  READ DMA EXT
  25 d8 ff 00 08 00 00 00 d8 e1 c7 40 08     00:16:26.823  READ DMA EXT
  25 d8 ff 00 08 00 00 00 d8 e1 9f 40 08     00:16:26.785  READ DMA EXT
  35 d8 ff 00 08 00 00 03 c6 8f 16 40 08     00:16:26.785  WRITE DMA EXT
  35 d8 ff 00 80 00 00 2d f8 3e 36 40 08     00:16:26.784  WRITE DMA EXT

Error 24 [23] occurred at disk power-on lifetime: 3064 hours (127 days + 16 hours)
  When the command that caused the error occurred, the device was active or idle.

  After command completion occurred, registers were:
  ER -- ST COUNT  LBA_48  LH LM LL DV DC
  -- -- -- == -- == == == -- -- -- -- --
  40 -- 51 00 08 00 0b c7 00 ca 56 40 00  Error: UNC 8 sectors at LBA = 0xbc700ca56 = 50583358038

  Commands leading to the command that caused the error were:
  CR FEATR COUNT  LBA_48  LH LM LL DV DC  Powered_Up_Time  Command/Feature_Name
  -- == -- == -- == == == -- -- -- -- --  ---------------  --------------------
  25 d8 ff 00 08 00 00 0b ca c7 56 40 08     00:16:24.441  READ DMA EXT
  35 d8 ff 00 08 00 00 03 c6 8f 0e 40 08     00:16:24.441  WRITE DMA EXT
  25 d8 ff 00 01 00 00 03 c6 8e a7 40 08     00:16:24.441  READ DMA EXT
  35 d8 ff 00 08 00 00 00 60 0f 8f 40 08     00:16:24.441  WRITE DMA EXT
  25 d8 ff 00 01 00 00 00 00 00 00 40 08     00:16:24.440  READ DMA EXT

SMART Extended Self-test Log Version: 1 (1 sectors)
Num  Test_Description    Status                  Remaining  LifeTime(hours)  LBA_of_first_error
# 1  Extended offline    Completed without error       00%      7058         -
# 2  Extended offline    Completed without error       00%      7045         -

SMART Selective self-test log data structure revision number 1
 SPAN  MIN_LBA  MAX_LBA  CURRENT_TEST_STATUS
    1        0        0  Not_testing
    2        0        0  Not_testing
    3        0        0  Not_testing
    4        0        0  Not_testing
    5        0        0  Not_testing
Selective self-test flags (0x0):
  After scanning selected spans, do NOT read-scan remainder of disk.
If Selective self-test is pending on power-up, resume after 0 minute delay.

SCT Status Version:                  2
SCT Version (vendor specific):       258 (0x0102)
SCT Support Level:                   1
Device State:                        SMART Off-line Data Collection executing in background (4)
Current Temperature:                    25 Celsius
Power Cycle Min/Max Temperature:     15/25 Celsius
Lifetime    Min/Max Temperature:     16/48 Celsius
Under/Over Temperature Limit Count:   0/0

SCT Temperature History Version:     2
Temperature Sampling Period:         1 minute
Temperature Logging Interval:        1 minute
Min/Max recommended Temperature:      0/60 Celsius
Min/Max Temperature Limit:           -41/85 Celsius
Temperature History Size (Index):    128 (101)

SCT Error Recovery Control command not supported

Device Statistics (GP/SMART Log 0x04) not supported

SATA Phy Event Counters (GP Log 0x11)
ID      Size     Value  Description
0x0001  2            0  Command failed due to ICRC error
0x0002  2            0  R_ERR response for data FIS
0x0003  2            0  R_ERR response for device-to-host data FIS
0x0004  2            0  R_ERR response for host-to-device data FIS
0x0005  2            0  R_ERR response for non-data FIS
0x0006  2            0  R_ERR response for device-to-host non-data FIS
0x0007  2            0  R_ERR response for host-to-device non-data FIS
0x000a  2            0  Device-to-host register FISes sent due to a COMRESET
0x8000  4         1107  Vendor specific

