smartctl 7.3 2022-02-28 r5338 [x86_64-linux-6.1.20-generic-2rosa2021.1-x86_64] (local build)
Copyright (C) 2002-22, Bruce Allen, Christian Franke, www.smartmontools.org

=== START OF INFORMATION SECTION ===
Model Number:                       Apacer AS2280P4 256GB
Serial Number:                      --
Firmware Version:                   APE00PI0
PCI Vendor/Subsystem ID:            0x1987
IEEE OUI Identifier:                0x6479a7
Total NVM Capacity:                 256,060,514,304 [256 GB]
Unallocated NVM Capacity:           0
Controller ID:                      1
NVMe Version:                       1.3
Number of Namespaces:               1
Namespace 1 Size/Capacity:          256,060,514,304 [256 GB]
Namespace 1 Formatted LBA Size:     512
Namespace 1 IEEE EUI-64:            6479a7 ...
Local Time is:                      Sat Apr 15 19:48:06 2023 MSK
Firmware Updates (0x12):            1 Slot, no Reset required
Optional Admin Commands (0x0017):   Security Format Frmw_DL Self_Test
Optional NVM Commands (0x005e):     Wr_Unc DS_Mngmt Wr_Zero Sav/Sel_Feat Timestmp
Log Page Attributes (0x0a):         Cmd_Eff_Lg Telmtry_Lg
Maximum Data Transfer Size:         64 Pages
Warning  Comp. Temp. Threshold:     70 Celsius
Critical Comp. Temp. Threshold:     80 Celsius

Supported Power States
St Op     Max   Active     Idle   RL RT WL WT  Ent_Lat  Ex_Lat
 0 +     4.50W       -        -    0  0  0  0        0       0
 1 +     2.70W       -        -    1  1  1  1        0       0
 2 +     2.16W       -        -    2  2  2  2        0       0
 3 -   0.0700W       -        -    3  3  3  3     1000    1000
 4 -   0.0050W       -        -    4  4  4  4     5000   50000

Supported LBA Sizes (NSID 0x1)
Id Fmt  Data  Metadt  Rel_Perf
 0 +     512       0         1
 1 -    4096       0         0

=== START OF SMART DATA SECTION ===
SMART overall-health self-assessment test result: PASSED

SMART/Health Information (NVMe Log 0x02)
Critical Warning:                   0x00
Temperature:                        28 Celsius
Available Spare:                    100%
Available Spare Threshold:          5%
Percentage Used:                    0%
Data Units Read:                    341,991 [175 GB]
Data Units Written:                 209,758 [107 GB]
Host Read Commands:                 3,725,846
Host Write Commands:                2,369,410
Controller Busy Time:               55
Power Cycles:                       335
Power On Hours:                     371
Unsafe Shutdowns:                   17
Media and Data Integrity Errors:    0
Error Information Log Entries:      25
Warning  Comp. Temperature Time:    0
Critical Comp. Temperature Time:    0
Temperature Sensor 1:               40 Celsius
Temperature Sensor 3:               28 Celsius

Error Information (NVMe Log 0x01, 16 of 16 entries)
Num   ErrCount  SQId   CmdId  Status  PELoc          LBA  NSID    VS
  0         25     0  0x6009  0x4005      -            0     0     -
  1         24     0  0x6008  0x4005      -            0     0     -
  2         23     0  0x500a  0x4005      -            0     0     -
  3         22     0  0x5009  0x4005      -            0     0     -
  4         21     0  0x2011  0x4004      -            0     0     -
  5         20     0  0x2010  0x4004      -            0     0     -
  6         19     0  0x1012  0x4004      -            0     0     -
  7         18     0  0x1011  0x4004      -            0     0     -
  8         17     0  0x1001  0x4004      -            0     0     -
  9         16     0  0x1000  0x4004      -            0     0     -
 10         15     0  0x300a  0x4004      -            0     0     -
 11         14     0  0x3009  0x4004      -            0     0     -
 12         13     0  0x000b  0x4005  0x028            0     0     -



