smartctl 7.2 2020-12-30 r5155 [x86_64-linux-5.16.7-desktop-1omv4003] (OpenMandriva Lx 7.2-2)
Copyright (C) 2002-20, Bruce Allen, Christian Franke, www.smartmontools.org

=== START OF INFORMATION SECTION ===
Model Family:     Seagate Maxtor DiamondMax 23
Device Model:     STM3500418AS
Serial Number:    --
LU WWN Device Id: 5 000c50 ...
Firmware Version: CC37
User Capacity:    500,107,862,016 bytes [500 GB]
Sector Size:      512 bytes logical/physical
Rotation Rate:    7200 rpm
Device is:        In smartctl database [for details use: -P show]
ATA Version is:   ATA8-ACS T13/1699-D revision 4
SATA Version is:  SATA 2.6, 3.0 Gb/s
Local Time is:    Wed Feb  9 03:15:39 2022 +10

==> WARNING: A firmware update for this drive may be available,
see the following Seagate web pages:
http://knowledge.seagate.com/articles/en_US/FAQ/207931en
http://knowledge.seagate.com/articles/en_US/FAQ/213911en

SMART support is: Available - device has SMART capability.
SMART support is: Enabled
AAM level is:     0 (vendor specific), recommended: 254
APM feature is:   Unavailable
Rd look-ahead is: Enabled
Write cache is:   Enabled
DSN feature is:   Unavailable
ATA Security is:  Disabled, frozen [SEC2]
Wt Cache Reorder: Unknown

=== START OF READ SMART DATA SECTION ===
SMART overall-health self-assessment test result: PASSED

General SMART Values:
Offline data collection status:  (0x82)	Offline data collection activity
					was completed without error.
					Auto Offline Data Collection: Enabled.
Self-test execution status:      (   0)	The previous self-test routine completed
					without error or no self-test has ever 
					been run.
Total time to complete Offline 
data collection: 		(  609) seconds.
Offline data collection
capabilities: 			 (0x7b) SMART execute Offline immediate.
					Auto Offline data collection on/off support.
					Suspend Offline collection upon new
					command.
					Offline surface scan supported.
					Self-test supported.
					Conveyance Self-test supported.
					Selective Self-test supported.
SMART capabilities:            (0x0003)	Saves SMART data before entering
					power-saving mode.
					Supports SMART auto save timer.
Error logging capability:        (0x01)	Error logging supported.
					General Purpose Logging supported.
Short self-test routine 
recommended polling time: 	 (   1) minutes.
Extended self-test routine
recommended polling time: 	 (  91) minutes.
Conveyance self-test routine
recommended polling time: 	 (   2) minutes.
SCT capabilities: 	       (0x103f)	SCT Status supported.
					SCT Error Recovery Control supported.
					SCT Feature Control supported.
					SCT Data Table supported.

SMART Attributes Data Structure revision number: 10
Vendor Specific SMART Attributes with Thresholds:
ID# ATTRIBUTE_NAME          FLAGS    VALUE WORST THRESH FAIL RAW_VALUE
  1 Raw_Read_Error_Rate     POSR--   118   099   006    -    191372482
  3 Spin_Up_Time            PO----   098   097   000    -    0
  4 Start_Stop_Count        -O--CK   090   090   020    -    10711
  5 Reallocated_Sector_Ct   PO--CK   100   100   036    -    0
  7 Seek_Error_Rate         POSR--   069   060   030    -    51643844875
  9 Power_On_Hours          -O--CK   094   094   000    -    6122
 10 Spin_Retry_Count        PO--C-   100   100   097    -    0
 12 Power_Cycle_Count       -O--CK   095   095   020    -    5361
183 Runtime_Bad_Block       -O--CK   100   100   000    -    0
184 End-to-End_Error        -O--CK   100   100   099    -    0
187 Reported_Uncorrect      -O--CK   023   023   000    -    77
188 Command_Timeout         -O--CK   100   098   000    -    4295032877
189 High_Fly_Writes         -O-RCK   099   099   000    -    1
190 Airflow_Temperature_Cel -O---K   067   056   045    -    33 (Min/Max 32/33)
194 Temperature_Celsius     -O---K   033   044   000    -    33 (255 255 0 0 0)
195 Hardware_ECC_Recovered  -O-RC-   042   026   000    -    191372482
197 Current_Pending_Sector  -O--C-   100   100   000    -    0
198 Offline_Uncorrectable   ----C-   100   100   000    -    0
199 UDMA_CRC_Error_Count    -OSRCK   200   200   000    -    0
240 Head_Flying_Hours       ------   100   253   000    -    18075 (166 24 0)
241 Total_LBAs_Written      ------   100   253   000    -    2241791255
242 Total_LBAs_Read         ------   100   253   000    -    3288702579
                            ||||||_ K auto-keep
                            |||||__ C event count
                            ||||___ R error rate
                            |||____ S speed/performance
                            ||_____ O updated online
                            |______ P prefailure warning

General Purpose Log Directory Version 1
SMART           Log Directory Version 1 [multi-sector log support]
Address    Access  R/W   Size  Description
0x00       GPL,SL  R/O      1  Log Directory
0x01       GPL,SL  R/O      1  Summary SMART error log
0x02       GPL,SL  R/O      5  Comprehensive SMART error log
0x03       GPL     R/O      5  Ext. Comprehensive SMART error log
0x06       GPL,SL  R/O      1  SMART self-test log
0x07       GPL     R/O      1  Extended self-test log
0x09       GPL,SL  R/W      1  Selective self-test log
0x10       GPL     R/O      1  NCQ Command Error log
0x11       GPL     R/O      1  SATA Phy Event Counters log
0x21       GPL     R/O      1  Write stream error log
0x22       GPL     R/O      1  Read stream error log
0x80-0x9f  GPL,SL  R/W     16  Host vendor specific log
0xa1       GPL,SL  VS      20  Device vendor specific log
0xa2       GPL     VS    2248  Device vendor specific log
0xa8       GPL,SL  VS     129  Device vendor specific log
0xa9       GPL,SL  VS       1  Device vendor specific log
0xb0       GPL     VS    2928  Device vendor specific log
0xbd       GPL     VS     252  Device vendor specific log
0xbe-0xbf  GPL     VS   65535  Device vendor specific log
0xc0       GPL,SL  VS       1  Device vendor specific log
0xe0       GPL,SL  R/W      1  SCT Command/Status
0xe1       GPL,SL  R/W      1  SCT Data Transfer

SMART Extended Comprehensive Error Log Version: 1 (5 sectors)
Device Error Count: 79 (device log contains only the most recent 20 errors)
	CR     = Command Register
	FEATR  = Features Register
	COUNT  = Count (was: Sector Count) Register
	LBA_48 = Upper bytes of LBA High/Mid/Low Registers ]  ATA-8
	LH     = LBA High (was: Cylinder High) Register    ]   LBA
	LM     = LBA Mid (was: Cylinder Low) Register      ] Register
	LL     = LBA Low (was: Sector Number) Register     ]
	DV     = Device (was: Device/Head) Register
	DC     = Device Control Register
	ER     = Error register
	ST     = Status register
Powered_Up_Time is measured from power on, and printed as
DDd+hh:mm:SS.sss where DD=days, hh=hours, mm=minutes,
SS=sec, and sss=millisec. It "wraps" after 49.710 days.

Error 79 [18] occurred at disk power-on lifetime: 6087 hours (253 days + 15 hours)
  When the command that caused the error occurred, the device was active or idle.

  After command completion occurred, registers were:
  ER -- ST COUNT  LBA_48  LH LM LL DV DC
  -- -- -- == -- == == == -- -- -- -- --
  40 -- 51 00 00 00 05 38 00 16 c9 00 00  Error: UNC at LBA = 0x5380016c9 = 22414366409

  Commands leading to the command that caused the error were:
  CR FEATR COUNT  LBA_48  LH LM LL DV DC  Powered_Up_Time  Command/Feature_Name
  -- == -- == -- == == == -- -- -- -- --  ---------------  --------------------
  c8 00 00 00 08 00 05 38 00 16 c7 e5 00     00:17:46.829  READ DMA
  27 00 00 00 00 00 00 00 00 00 00 e0 00     00:17:46.827  READ NATIVE MAX ADDRESS EXT [OBS-ACS-3]
  ec 00 00 00 00 00 00 00 00 00 00 a0 00     00:17:46.824  IDENTIFY DEVICE
  ef 00 03 00 46 00 00 00 00 00 00 a0 00     00:17:46.803  SET FEATURES [Set transfer mode]
  27 00 00 00 00 00 00 00 00 00 00 e0 00     00:17:46.802  READ NATIVE MAX ADDRESS EXT [OBS-ACS-3]

Error 78 [17] occurred at disk power-on lifetime: 6087 hours (253 days + 15 hours)
  When the command that caused the error occurred, the device was active or idle.

  After command completion occurred, registers were:
  ER -- ST COUNT  LBA_48  LH LM LL DV DC
  -- -- -- == -- == == == -- -- -- -- --
  40 -- 51 00 00 00 05 38 00 16 c9 00 00  Error: UNC at LBA = 0x5380016c9 = 22414366409

  Commands leading to the command that caused the error were:
  CR FEATR COUNT  LBA_48  LH LM LL DV DC  Powered_Up_Time  Command/Feature_Name
  -- == -- == -- == == == -- -- -- -- --  ---------------  --------------------
  c8 00 00 00 08 00 05 38 00 16 c7 e5 00     00:17:43.666  READ DMA
  27 00 00 00 00 00 00 00 00 00 00 e0 00     00:17:43.665  READ NATIVE MAX ADDRESS EXT [OBS-ACS-3]
  ec 00 00 00 00 00 00 00 00 00 00 a0 00     00:17:43.662  IDENTIFY DEVICE
  ef 00 03 00 46 00 00 00 00 00 00 a0 00     00:17:43.659  SET FEATURES [Set transfer mode]
  27 00 00 00 00 00 00 00 00 00 00 e0 00     00:17:43.639  READ NATIVE MAX ADDRESS EXT [OBS-ACS-3]

Error 77 [16] occurred at disk power-on lifetime: 6087 hours (253 days + 15 hours)
  When the command that caused the error occurred, the device was active or idle.

  After command completion occurred, registers were:
  ER -- ST COUNT  LBA_48  LH LM LL DV DC
  -- -- -- == -- == == == -- -- -- -- --
  40 -- 51 00 00 00 05 38 00 16 c9 00 00  Error: UNC at LBA = 0x5380016c9 = 22414366409

  Commands leading to the command that caused the error were:
  CR FEATR COUNT  LBA_48  LH LM LL DV DC  Powered_Up_Time  Command/Feature_Name
  -- == -- == -- == == == -- -- -- -- --  ---------------  --------------------
  c8 00 00 00 08 00 05 38 00 16 c7 e5 00     00:17:40.510  READ DMA
  27 00 00 00 00 00 00 00 00 00 00 e0 00     00:17:40.509  READ NATIVE MAX ADDRESS EXT [OBS-ACS-3]
  ec 00 00 00 00 00 00 00 00 00 00 a0 00     00:17:40.505  IDENTIFY DEVICE
  ef 00 03 00 46 00 00 00 00 00 00 a0 00     00:17:40.484  SET FEATURES [Set transfer mode]
  27 00 00 00 00 00 00 00 00 00 00 e0 00     00:17:40.484  READ NATIVE MAX ADDRESS EXT [OBS-ACS-3]

Error 76 [15] occurred at disk power-on lifetime: 6087 hours (253 days + 15 hours)
  When the command that caused the error occurred, the device was active or idle.

  After command completion occurred, registers were:
  ER -- ST COUNT  LBA_48  LH LM LL DV DC
  -- -- -- == -- == == == -- -- -- -- --
  40 -- 51 00 00 00 05 38 00 16 c9 00 00  Error: UNC at LBA = 0x5380016c9 = 22414366409

  Commands leading to the command that caused the error were:
  CR FEATR COUNT  LBA_48  LH LM LL DV DC  Powered_Up_Time  Command/Feature_Name
  -- == -- == -- == == == -- -- -- -- --  ---------------  --------------------
  c8 00 00 00 08 00 05 38 00 16 c7 e5 00     00:17:37.362  READ DMA
  27 00 00 00 00 00 00 00 00 00 00 e0 00     00:17:37.361  READ NATIVE MAX ADDRESS EXT [OBS-ACS-3]
  ec 00 00 00 00 00 00 00 00 00 00 a0 00     00:17:37.358  IDENTIFY DEVICE
  ef 00 03 00 46 00 00 00 00 00 00 a0 00     00:17:37.336  SET FEATURES [Set transfer mode]
  27 00 00 00 00 00 00 00 00 00 00 e0 00     00:17:37.336  READ NATIVE MAX ADDRESS EXT [OBS-ACS-3]

Error 75 [14] occurred at disk power-on lifetime: 6087 hours (253 days + 15 hours)
  When the command that caused the error occurred, the device was active or idle.

  After command completion occurred, registers were:
  ER -- ST COUNT  LBA_48  LH LM LL DV DC
  -- -- -- == -- == == == -- -- -- -- --
  40 -- 51 00 00 00 05 38 00 16 c9 00 00  Error: UNC at LBA = 0x5380016c9 = 22414366409

  Commands leading to the command that caused the error were:
  CR FEATR COUNT  LBA_48  LH LM LL DV DC  Powered_Up_Time  Command/Feature_Name
  -- == -- == -- == == == -- -- -- -- --  ---------------  --------------------
  c8 00 00 00 08 00 05 38 00 16 c7 e5 00     00:17:34.533  READ DMA
  27 00 00 00 00 00 00 00 00 00 00 e0 00     00:17:34.532  READ NATIVE MAX ADDRESS EXT [OBS-ACS-3]
  ec 00 00 00 00 00 00 00 00 00 00 a0 00     00:17:34.529  IDENTIFY DEVICE
  ef 00 03 00 46 00 00 00 00 00 00 a0 00     00:17:34.526  SET FEATURES [Set transfer mode]
  27 00 00 00 00 00 00 00 00 00 00 e0 00     00:17:34.506  READ NATIVE MAX ADDRESS EXT [OBS-ACS-3]

Error 74 [13] occurred at disk power-on lifetime: 6087 hours (253 days + 15 hours)
  When the command that caused the error occurred, the device was active or idle.

  After command completion occurred, registers were:
  ER -- ST COUNT  LBA_48  LH LM LL DV DC
  -- -- -- == -- == == == -- -- -- -- --
  40 -- 51 00 00 00 05 38 00 16 c9 00 00  Error: UNC at LBA = 0x5380016c9 = 22414366409

  Commands leading to the command that caused the error were:
  CR FEATR COUNT  LBA_48  LH LM LL DV DC  Powered_Up_Time  Command/Feature_Name
  -- == -- == -- == == == -- -- -- -- --  ---------------  --------------------
  c8 00 00 00 08 00 05 38 00 16 c7 e5 00     00:17:31.385  READ DMA
  27 00 00 00 00 00 00 00 00 00 00 e0 00     00:17:31.384  READ NATIVE MAX ADDRESS EXT [OBS-ACS-3]
  ec 00 00 00 00 00 00 00 00 00 00 a0 00     00:17:31.381  IDENTIFY DEVICE
  ef 00 03 00 46 00 00 00 00 00 00 a0 00     00:17:31.379  SET FEATURES [Set transfer mode]
  27 00 00 00 00 00 00 00 00 00 00 e0 00     00:17:31.358  READ NATIVE MAX ADDRESS EXT [OBS-ACS-3]

Error 73 [12] occurred at disk power-on lifetime: 6087 hours (253 days + 15 hours)
  When the command that caused the error occurred, the device was active or idle.

  After command completion occurred, registers were:
  ER -- ST COUNT  LBA_48  LH LM LL DV DC
  -- -- -- == -- == == == -- -- -- -- --
  40 -- 51 00 00 00 05 38 00 16 c9 00 00  Error: UNC at LBA = 0x5380016c9 = 22414366409

  Commands leading to the command that caused the error were:
  CR FEATR COUNT  LBA_48  LH LM LL DV DC  Powered_Up_Time  Command/Feature_Name
  -- == -- == -- == == == -- -- -- -- --  ---------------  --------------------
  c8 00 00 00 08 00 05 38 00 16 c7 e5 00     00:17:28.239  READ DMA
  27 00 00 00 00 00 00 00 00 00 00 e0 00     00:17:28.238  READ NATIVE MAX ADDRESS EXT [OBS-ACS-3]
  ec 00 00 00 00 00 00 00 00 00 00 a0 00     00:17:28.235  IDENTIFY DEVICE
  ef 00 03 00 46 00 00 00 00 00 00 a0 00     00:17:28.232  SET FEATURES [Set transfer mode]
  27 00 00 00 00 00 00 00 00 00 00 e0 00     00:17:28.212  READ NATIVE MAX ADDRESS EXT [OBS-ACS-3]

Error 72 [11] occurred at disk power-on lifetime: 6087 hours (253 days + 15 hours)
  When the command that caused the error occurred, the device was active or idle.

  After command completion occurred, registers were:
  ER -- ST COUNT  LBA_48  LH LM LL DV DC
  -- -- -- == -- == == == -- -- -- -- --
  40 -- 51 00 00 00 05 38 00 16 c9 00 00  Error: UNC at LBA = 0x5380016c9 = 22414366409

  Commands leading to the command that caused the error were:
  CR FEATR COUNT  LBA_48  LH LM LL DV DC  Powered_Up_Time  Command/Feature_Name
  -- == -- == -- == == == -- -- -- -- --  ---------------  --------------------
  c8 00 00 00 08 00 05 38 00 16 c7 e5 00     00:17:25.073  READ DMA
  27 00 00 00 00 00 00 00 00 00 00 e0 00     00:17:25.072  READ NATIVE MAX ADDRESS EXT [OBS-ACS-3]
  ec 00 00 00 00 00 00 00 00 00 00 a0 00     00:17:25.069  IDENTIFY DEVICE
  ef 00 03 00 46 00 00 00 00 00 00 a0 00     00:17:25.048  SET FEATURES [Set transfer mode]
  27 00 00 00 00 00 00 00 00 00 00 e0 00     00:17:25.047  READ NATIVE MAX ADDRESS EXT [OBS-ACS-3]

SMART Extended Self-test Log Version: 1 (1 sectors)
No self-tests have been logged.  [To run self-tests, use: smartctl -t]

SMART Selective self-test log data structure revision number 1
 SPAN  MIN_LBA  MAX_LBA  CURRENT_TEST_STATUS
    1        0        0  Not_testing
    2        0        0  Not_testing
    3        0        0  Not_testing
    4        0        0  Not_testing
    5        0        0  Not_testing
Selective self-test flags (0x0):
  After scanning selected spans, do NOT read-scan remainder of disk.
If Selective self-test is pending on power-up, resume after 0 minute delay.

SCT Status Version:                  3
SCT Version (vendor specific):       522 (0x020a)
Device State:                        Active (0)
Current Temperature:                    33 Celsius
Power Cycle Min/Max Temperature:     32/33 Celsius
Lifetime    Min/Max Temperature:     -1/44 Celsius
Under/Over Temperature Limit Count:   0/0

SCT Temperature History Version:     2
Temperature Sampling Period:         1 minute
Temperature Logging Interval:        59 minutes
Min/Max recommended Temperature:     14/55 Celsius
Min/Max Temperature Limit:           10/60 Celsius
Temperature History Size (Index):    128 (86)

SCT Error Recovery Control:
           Read: Disabled
          Write: Disabled

Device Statistics (GP/SMART Log 0x04) not supported

Pending Defects log (GP Log 0x0c) not supported

SATA Phy Event Counters (GP Log 0x11)
ID      Size     Value  Description
0x000a  2            3  Device-to-host register FISes sent due to a COMRESET
0x0001  2            0  Command failed due to ICRC error
0x0003  2            0  R_ERR response for device-to-host data FIS
0x0004  2            0  R_ERR response for host-to-device data FIS
0x0006  2            0  R_ERR response for device-to-host non-data FIS
0x0007  2            0  R_ERR response for host-to-device non-data FIS

