=== START OF INFORMATION SECTION ===
Model Family:     Seagate Momentus SpinPoint M8 (AF)
Device Model:     ST320LM001 HN-M320MBB
Serial Number:    --
LU WWN Device Id: 5 0004cf ...
Firmware Version: 2AR10002
User Capacity:    320 072 933 376 bytes [320 GB]
Sector Sizes:     512 bytes logical, 4096 bytes physical
Rotation Rate:    5400 rpm
Form Factor:      2.5 inches
Device is:        In smartctl database [for details use: -P show]
ATA Version is:   ATA8-ACS T13/1699-D revision 6
SATA Version is:  SATA 3.0, 3.0 Gb/s (current: 3.0 Gb/s)
Local Time is:    Tue Feb 23 07:46:26 2016 MSK
SMART support is: Available - device has SMART capability.
SMART support is: Enabled
AAM feature is:   Disabled
APM feature is:   Disabled
Rd look-ahead is: Enabled
Write cache is:   Enabled
ATA Security is:  Disabled, frozen [SEC2]
Wt Cache Reorder: Enabled

=== START OF READ SMART DATA SECTION ===
SMART overall-health self-assessment test result: PASSED

General SMART Values:
Offline data collection status:  (0x80)	Offline data collection activity
					was never started.
					Auto Offline Data Collection: Enabled.
Self-test execution status:      (   0)	The previous self-test routine completed
					without error or no self-test has ever 
					been run.
Total time to complete Offline 
data collection: 		( 5280) seconds.
Offline data collection
capabilities: 			 (0x5b) SMART execute Offline immediate.
					Auto Offline data collection on/off support.
					Suspend Offline collection upon new
					command.
					Offline surface scan supported.
					Self-test supported.
					No Conveyance Self-test supported.
					Selective Self-test supported.
SMART capabilities:            (0x0003)	Saves SMART data before entering
					power-saving mode.
					Supports SMART auto save timer.
Error logging capability:        (0x01)	Error logging supported.
					General Purpose Logging supported.
Short self-test routine 
recommended polling time: 	 (   2) minutes.
Extended self-test routine
recommended polling time: 	 (  88) minutes.
SCT capabilities: 	       (0x003f)	SCT Status supported.
					SCT Error Recovery Control supported.
					SCT Feature Control supported.
					SCT Data Table supported.

SMART Attributes Data Structure revision number: 16
Vendor Specific SMART Attributes with Thresholds:
ID# ATTRIBUTE_NAME          FLAGS    VALUE WORST THRESH FAIL RAW_VALUE
  1 Raw_Read_Error_Rate     POSR-K   100   100   051    -    37
  2 Throughput_Performance  -OS--K   252   252   000    -    0
  3 Spin_Up_Time            PO---K   091   085   025    -    2857
  4 Start_Stop_Count        -O--CK   094   094   000    -    6277
  5 Reallocated_Sector_Ct   PO--CK   252   252   010    -    0
  7 Seek_Error_Rate         -OSR-K   252   252   051    -    0
  8 Seek_Time_Performance   --S--K   252   252   015    -    0
  9 Power_On_Hours          -O--CK   100   100   000    -    13097
 10 Spin_Retry_Count        -O--CK   252   252   051    -    0
 11 Calibration_Retry_Count -O--CK   100   100   000    -    153
 12 Power_Cycle_Count       -O--CK   095   095   000    -    5174
191 G-Sense_Error_Rate      -O---K   100   100   000    -    158
192 Power-Off_Retract_Count -O---K   252   252   000    -    0
194 Temperature_Celsius     -O----   064   028   000    -    31 (Min/Max 18/72)
195 Hardware_ECC_Recovered  -O-RCK   100   100   000    -    0
196 Reallocated_Event_Count -O--CK   252   252   000    -    0
197 Current_Pending_Sector  -O--CK   252   252   000    -    0
198 Offline_Uncorrectable   ----CK   252   252   000    -    0
199 UDMA_CRC_Error_Count    -OS-CK   100   100   000    -    187
200 Multi_Zone_Error_Rate   -O-R-K   100   100   000    -    87393
223 Load_Retry_Count        -O--CK   100   100   000    -    153
225 Load_Cycle_Count        -O--CK   080   080   000    -    208357
                            ||||||_ K auto-keep
                            |||||__ C event count
                            ||||___ R error rate
                            |||____ S speed/performance
                            ||_____ O updated online
                            |______ P prefailure warning

General Purpose Log Directory Version 1
SMART           Log Directory Version 1 [multi-sector log support]
Address    Access  R/W   Size  Description
0x00       GPL,SL  R/O      1  Log Directory
0x01           SL  R/O      1  Summary SMART error log
0x02           SL  R/O      2  Comprehensive SMART error log
0x03       GPL     R/O      2  Ext. Comprehensive SMART error log
0x06           SL  R/O      1  SMART self-test log
0x07       GPL     R/O      2  Extended self-test log
0x08       GPL     R/O      2  Power Conditions log
0x09           SL  R/W      1  Selective self-test log
0x10       GPL     R/O      1  NCQ Command Error log
0x11       GPL     R/O      1  SATA Phy Event Counters
0x80-0x9f  GPL,SL  R/W     16  Host vendor specific log
0xc0-0xdf  GPL,SL  VS      16  Device vendor specific log
0xe0       GPL,SL  R/W      1  SCT Command/Status
0xe1       GPL,SL  R/W      1  SCT Data Transfer

SMART Extended Comprehensive Error Log Version: 1 (2 sectors)
Device Error Count: 187 (device log contains only the most recent 8 errors)
	CR     = Command Register
	FEATR  = Features Register
	COUNT  = Count (was: Sector Count) Register
	LBA_48 = Upper bytes of LBA High/Mid/Low Registers ]  ATA-8
	LH     = LBA High (was: Cylinder High) Register    ]   LBA
	LM     = LBA Mid (was: Cylinder Low) Register      ] Register
	LL     = LBA Low (was: Sector Number) Register     ]
	DV     = Device (was: Device/Head) Register
	DC     = Device Control Register
	ER     = Error register
	ST     = Status register
Powered_Up_Time is measured from power on, and printed as
DDd+hh:mm:SS.sss where DD=days, hh=hours, mm=minutes,
SS=sec, and sss=millisec. It "wraps" after 49.710 days.

Error 187 [2] occurred at disk power-on lifetime: 12450 hours (518 days + 18 hours)
  When the command that caused the error occurred, the device was active or idle.

  After command completion occurred, registers were:
  ER -- ST COUNT  LBA_48  LH LM LL DV DC
  -- -- -- == -- == == == -- -- -- -- --
  84 -- 51 00 5f 00 00 00 66 b0 40 e0 00  Error: ICRC, ABRT 95 sectors at LBA = 0x0066b040 = 6729792

  Commands leading to the command that caused the error were:
  CR FEATR COUNT  LBA_48  LH LM LL DV DC  Powered_Up_Time  Command/Feature_Name
  -- == -- == -- == == == -- -- -- -- --  ---------------  --------------------
  25 00 00 00 40 00 00 00 66 b0 5f e0 00     00:00:00.747  READ DMA EXT
  25 00 00 00 40 00 00 00 66 b0 1f e0 00     00:00:00.747  READ DMA EXT
  25 00 00 00 40 00 00 00 66 af df e0 00     00:00:00.747  READ DMA EXT
  25 00 00 00 40 00 00 00 66 af 9f e0 00     00:00:00.747  READ DMA EXT
  25 00 00 00 40 00 00 00 66 af 5f e0 00     00:00:00.747  READ DMA EXT

Error 186 [1] occurred at disk power-on lifetime: 12428 hours (517 days + 20 hours)
  When the command that caused the error occurred, the device was active or idle.

  After command completion occurred, registers were:
  ER -- ST COUNT  LBA_48  LH LM LL DV DC
  -- -- -- == -- == == == -- -- -- -- --
  84 -- 51 00 9b 00 00 1f 52 41 c0 e0 00  Error: ICRC, ABRT 155 sectors at LBA = 0x1f5241c0 = 525484480

  Commands leading to the command that caused the error were:
  CR FEATR COUNT  LBA_48  LH LM LL DV DC  Powered_Up_Time  Command/Feature_Name
  -- == -- == -- == == == -- -- -- -- --  ---------------  --------------------
  25 00 00 01 00 00 00 1f 52 41 5b e0 00     00:00:03.100  READ DMA EXT
  25 00 00 00 0b 00 00 1f 52 41 4b e0 00     00:00:03.100  READ DMA EXT
  25 00 00 00 08 00 00 0c 96 d4 1b e0 00     00:00:03.100  READ DMA EXT
  25 00 00 00 08 00 00 0c 96 d4 1b e0 00     00:00:03.100  READ DMA EXT
  25 00 00 00 08 00 00 0c 96 d4 1b e0 00     00:00:03.100  READ DMA EXT

Error 185 [0] occurred at disk power-on lifetime: 12414 hours (517 days + 6 hours)
  When the command that caused the error occurred, the device was active or idle.

  After command completion occurred, registers were:
  ER -- ST COUNT  LBA_48  LH LM LL DV DC
  -- -- -- == -- == == == -- -- -- -- --
  84 -- 51 00 2d 00 00 00 28 60 c0 e0 00  Error: ICRC, ABRT 45 sectors at LBA = 0x002860c0 = 2646208

  Commands leading to the command that caused the error were:
  CR FEATR COUNT  LBA_48  LH LM LL DV DC  Powered_Up_Time  Command/Feature_Name
  -- == -- == -- == == == -- -- -- -- --  ---------------  --------------------
  25 00 00 00 3c 00 00 00 28 60 b1 e0 00     00:00:06.748  READ DMA EXT
  25 00 00 00 40 00 00 00 28 5d c9 e0 00     00:00:06.748  READ DMA EXT
  25 00 00 00 40 00 00 00 28 5c 81 e0 00     00:00:06.748  READ DMA EXT
  25 00 00 00 40 00 00 00 28 5e 09 e0 00     00:00:06.748  READ DMA EXT
  25 00 00 00 40 00 00 00 28 5e 49 e0 00     00:00:06.748  READ DMA EXT

Error 184 [7] occurred at disk power-on lifetime: 12244 hours (510 days + 4 hours)
  When the command that caused the error occurred, the device was active or idle.

  After command completion occurred, registers were:
  ER -- ST COUNT  LBA_48  LH LM LL DV DC
  -- -- -- == -- == == == -- -- -- -- --
  84 -- 51 00 10 00 00 00 35 0d 25 e0 00  Error: ICRC, ABRT 16 sectors at LBA = 0x00350d25 = 3476773

  Commands leading to the command that caused the error were:
  CR FEATR COUNT  LBA_48  LH LM LL DV DC  Powered_Up_Time  Command/Feature_Name
  -- == -- == -- == == == -- -- -- -- --  ---------------  --------------------
  25 00 00 00 10 00 00 00 35 0d 25 e0 00     00:00:00.445  READ DMA EXT
  25 00 00 00 08 00 00 00 35 0b a5 e0 00     00:00:00.445  READ DMA EXT
  25 00 00 00 28 00 00 00 34 f1 91 e0 00     00:00:00.445  READ DMA EXT
  25 00 00 00 28 00 00 00 34 f1 91 e0 00     00:00:00.445  READ DMA EXT
  25 00 00 00 90 00 00 00 34 e9 e1 e0 00     00:00:00.445  READ DMA EXT

Error 183 [6] occurred at disk power-on lifetime: 12244 hours (510 days + 4 hours)
  When the command that caused the error occurred, the device was active or idle.

  After command completion occurred, registers were:
  ER -- ST COUNT  LBA_48  LH LM LL DV DC
  -- -- -- == -- == == == -- -- -- -- --
  84 -- 51 00 51 00 00 00 13 24 00 e0 00  Error: ICRC, ABRT 81 sectors at LBA = 0x00132400 = 1254400

  Commands leading to the command that caused the error were:
  CR FEATR COUNT  LBA_48  LH LM LL DV DC  Powered_Up_Time  Command/Feature_Name
  -- == -- == -- == == == -- -- -- -- --  ---------------  --------------------
  25 00 00 01 00 00 00 00 13 23 51 e0 00     00:00:00.442  READ DMA EXT
  25 00 00 01 00 00 00 00 13 22 51 e0 00     00:00:00.442  READ DMA EXT
  25 00 00 00 08 00 00 00 13 22 49 e0 00     00:00:00.442  READ DMA EXT
  25 00 00 01 00 00 00 00 13 21 49 e0 00     00:00:00.442  READ DMA EXT
  25 00 00 00 b0 00 00 00 13 1f 89 e0 00     00:00:00.442  READ DMA EXT

Error 182 [5] occurred at disk power-on lifetime: 12244 hours (510 days + 4 hours)
  When the command that caused the error occurred, the device was active or idle.

  After command completion occurred, registers were:
  ER -- ST COUNT  LBA_48  LH LM LL DV DC
  -- -- -- == -- == == == -- -- -- -- --
  84 -- 51 00 18 00 00 07 72 bd 97 e0 00  Error: ICRC, ABRT 24 sectors at LBA = 0x0772bd97 = 124960151

  Commands leading to the command that caused the error were:
  CR FEATR COUNT  LBA_48  LH LM LL DV DC  Powered_Up_Time  Command/Feature_Name
  -- == -- == -- == == == -- -- -- -- --  ---------------  --------------------
  25 00 00 00 18 00 00 07 72 bd 97 e0 00     00:00:00.441  READ DMA EXT
  25 00 00 00 e0 00 00 07 72 bb 8f e0 00     00:00:00.441  READ DMA EXT
  25 00 00 00 60 00 00 07 72 bb 2f e0 00     00:00:00.441  READ DMA EXT
  25 00 00 00 60 00 00 07 72 bb 2f e0 00     00:00:00.441  READ DMA EXT
  25 00 00 01 00 00 00 07 72 ba 2f e0 00     00:00:00.441  READ DMA EXT

Error 181 [4] occurred at disk power-on lifetime: 12244 hours (510 days + 4 hours)
  When the command that caused the error occurred, the device was active or idle.

  After command completion occurred, registers were:
  ER -- ST COUNT  LBA_48  LH LM LL DV DC
  -- -- -- == -- == == == -- -- -- -- --
  84 -- 51 00 67 00 00 00 62 75 c0 e0 00  Error: ICRC, ABRT 103 sectors at LBA = 0x006275c0 = 6452672

  Commands leading to the command that caused the error were:
  CR FEATR COUNT  LBA_48  LH LM LL DV DC  Powered_Up_Time  Command/Feature_Name
  -- == -- == -- == == == -- -- -- -- --  ---------------  --------------------
  25 00 00 00 68 00 00 00 62 75 bf e0 00     00:00:00.440  READ DMA EXT
  25 00 00 00 10 00 00 00 62 73 ef e0 00     00:00:00.440  READ DMA EXT
  25 00 00 00 08 00 00 00 62 70 97 e0 00     00:00:00.440  READ DMA EXT
  25 00 00 00 a0 00 00 00 62 6f 57 e0 00     00:00:00.440  READ DMA EXT
  25 00 00 01 00 00 00 00 62 6e 57 e0 00     00:00:00.440  READ DMA EXT

Error 180 [3] occurred at disk power-on lifetime: 12244 hours (510 days + 4 hours)
  When the command that caused the error occurred, the device was active or idle.

  After command completion occurred, registers were:
  ER -- ST COUNT  LBA_48  LH LM LL DV DC
  -- -- -- == -- == == == -- -- -- -- --
  84 -- 51 00 9f 00 00 00 62 37 00 e0 00  Error: ICRC, ABRT 159 sectors at LBA = 0x00623700 = 6436608

  Commands leading to the command that caused the error were:
  CR FEATR COUNT  LBA_48  LH LM LL DV DC  Powered_Up_Time  Command/Feature_Name
  -- == -- == -- == == == -- -- -- -- --  ---------------  --------------------
  25 00 00 01 00 00 00 00 62 36 9f e0 00     00:00:00.440  READ DMA EXT
  25 00 00 01 00 00 00 00 62 35 9f e0 00     00:00:00.440  READ DMA EXT
  25 00 00 00 08 00 00 00 62 31 d7 e0 00     00:00:00.440  READ DMA EXT
  25 00 00 00 30 00 00 00 62 31 9f e0 00     00:00:00.440  READ DMA EXT
  25 00 00 00 20 00 00 00 62 30 7f e0 00     00:00:00.440  READ DMA EXT

SMART Extended Self-test Log Version: 1 (2 sectors)
No self-tests have been logged.  [To run self-tests, use: smartctl -t]

SMART Selective self-test log data structure revision number 0
Note: revision number not 1 implies that no selective self-test has ever been run
 SPAN  MIN_LBA  MAX_LBA  CURRENT_TEST_STATUS
    1        0        0  Completed [00% left] (0-65535)
    2        0        0  Not_testing
    3        0        0  Not_testing
    4        0        0  Not_testing
    5        0        0  Not_testing
Selective self-test flags (0x0):
  After scanning selected spans, do NOT read-scan remainder of disk.
If Selective self-test is pending on power-up, resume after 0 minute delay.

SCT Status Version:                  2
SCT Version (vendor specific):       256 (0x0100)
SCT Support Level:                   1
Device State:                        Active (0)
Current Temperature:                    31 Celsius
Power Cycle Min/Max Temperature:     28/33 Celsius
Lifetime    Min/Max Temperature:     18/72 Celsius
Under/Over Temperature Limit Count:   0/0

SCT Temperature History Version:     2
Temperature Sampling Period:         5 minutes
Temperature Logging Interval:        5 minutes
Min/Max recommended Temperature:     -5/80 Celsius
Min/Max Temperature Limit:           -10/85 Celsius
Temperature History Size (Index):    128 (74)

SCT Error Recovery Control:
           Read: Disabled
          Write: Disabled

Device Statistics (GP Log 0x04) not supported

SATA Phy Event Counters (GP Log 0x11)
ID      Size     Value  Description
0x0001  4            0  Command failed due to ICRC error
0x0002  4            0  R_ERR response for data FIS
0x0003  4            0  R_ERR response for device-to-host data FIS
0x0004  4            0  R_ERR response for host-to-device data FIS
0x0005  4            0  R_ERR response for non-data FIS
0x0006  4            0  R_ERR response for device-to-host non-data FIS
0x0007  4            0  R_ERR response for host-to-device non-data FIS
0x0008  4            0  Device-to-host non-data FIS retries
0x0009  4           13  Transition from drive PhyRdy to drive PhyNRdy
0x000a  4           12  Device-to-host register FISes sent due to a COMRESET
0x000b  4            0  CRC errors within host-to-device FIS
0x000d  4            0  Non-CRC errors within host-to-device FIS
0x000f  4            0  R_ERR response for host-to-device data FIS, CRC
0x0010  4            0  R_ERR response for host-to-device data FIS, non-CRC
0x0012  4            0  R_ERR response for host-to-device non-data FIS, CRC
0x0013  4            0  R_ERR response for host-to-device non-data FIS, non-CRC
0x8e00  4            0  Vendor specific
0x8e01  4            0  Vendor specific
0x8e02  4            0  Vendor specific
0x8e03  4            0  Vendor specific
0x8e04  4            0  Vendor specific
0x8e05  4            0  Vendor specific
0x8e06  4            0  Vendor specific
0x8e07  4            0  Vendor specific
0x8e08  4            0  Vendor specific
0x8e09  4            0  Vendor specific
0x8e0a  4            0  Vendor specific
0x8e0b  4            0  Vendor specific
0x8e0c  4            0  Vendor specific
0x8e0d  4            0  Vendor specific
0x8e0e  4            0  Vendor specific
0x8e0f  4            0  Vendor specific
0x8e10  4            0  Vendor specific
0x8e11  4            0  Vendor specific

