smartctl 7.1 2019-12-30 r5022 [x86_64-linux-5.11.0-43-generic] (local build)
Copyright (C) 2002-19, Bruce Allen, Christian Franke, www.smartmontools.org

=== START OF INFORMATION SECTION ===
Model Family:     Seagate Momentus 7200.4
Device Model:     ST9500420AS
Serial Number:    --
LU WWN Device Id: 5 000c50 ...
Firmware Version: 0002SDM1
User Capacity:    500,107,862,016 bytes [500 GB]
Sector Size:      512 bytes logical/physical
Rotation Rate:    7200 rpm
Device is:        In smartctl database [for details use: -P show]
ATA Version is:   ATA8-ACS T13/1699-D revision 4
SATA Version is:  SATA 2.6, 3.0 Gb/s
Local Time is:    Fri Dec 31 03:13:23 2021 CET
SMART support is: Available - device has SMART capability.
SMART support is: Enabled
AAM level is:     208 (intermediate), recommended: 208
APM level is:     254 (maximum performance)
Rd look-ahead is: Enabled
Write cache is:   Enabled
DSN feature is:   Unavailable
ATA Security is:  Disabled, NOT FROZEN [SEC1]
Wt Cache Reorder: Unknown

=== START OF READ SMART DATA SECTION ===
SMART overall-health self-assessment test result: PASSED
See vendor-specific Attribute list for marginal Attributes.

General SMART Values:
Offline data collection status:  (0x82)	Offline data collection activity
					was completed without error.
					Auto Offline Data Collection: Enabled.
Self-test execution status:      (   0)	The previous self-test routine completed
					without error or no self-test has ever 
					been run.
Total time to complete Offline 
data collection: 		(    0) seconds.
Offline data collection
capabilities: 			 (0x7b) SMART execute Offline immediate.
					Auto Offline data collection on/off support.
					Suspend Offline collection upon new
					command.
					Offline surface scan supported.
					Self-test supported.
					Conveyance Self-test supported.
					Selective Self-test supported.
SMART capabilities:            (0x0003)	Saves SMART data before entering
					power-saving mode.
					Supports SMART auto save timer.
Error logging capability:        (0x01)	Error logging supported.
					General Purpose Logging supported.
Short self-test routine 
recommended polling time: 	 (   2) minutes.
Extended self-test routine
recommended polling time: 	 ( 110) minutes.
Conveyance self-test routine
recommended polling time: 	 (   3) minutes.
SCT capabilities: 	       (0x103f)	SCT Status supported.
					SCT Error Recovery Control supported.
					SCT Feature Control supported.
					SCT Data Table supported.

SMART Attributes Data Structure revision number: 10
Vendor Specific SMART Attributes with Thresholds:
ID# ATTRIBUTE_NAME          FLAGS    VALUE WORST THRESH FAIL RAW_VALUE
  1 Raw_Read_Error_Rate     POSR--   119   095   006    -    204985106
  3 Spin_Up_Time            PO----   096   096   085    -    0
  4 Start_Stop_Count        -O--CK   094   094   020    -    6960
  5 Reallocated_Sector_Ct   PO--CK   100   100   036    -    2
  7 Seek_Error_Rate         POSR--   079   060   030    -    21881836042
  9 Power_On_Hours          -O--CK   075   075   000    -    21980
 10 Spin_Retry_Count        PO--C-   100   100   097    -    0
 12 Power_Cycle_Count       -O--CK   095   037   020    -    5583
184 End-to-End_Error        -O--CK   100   100   099    -    0
187 Reported_Uncorrect      -O--CK   001   001   000    -    613
188 Command_Timeout         -O--CK   100   096   000    -    8590066777
189 High_Fly_Writes         -O-RCK   100   100   000    -    0
190 Airflow_Temperature_Cel -O---K   066   036   045    Past 34 (2 129 38 30 0)
191 G-Sense_Error_Rate      -O--CK   100   100   000    -    3
192 Power-Off_Retract_Count -O--CK   100   100   000    -    225
193 Load_Cycle_Count        -O--CK   001   001   000    -    346977
194 Temperature_Celsius     -O---K   034   064   000    -    34 (0 8 0 0 0)
195 Hardware_ECC_Recovered  -O-RC-   044   031   000    -    204985106
197 Current_Pending_Sector  -O--C-   100   100   000    -    0
198 Offline_Uncorrectable   ----C-   100   100   000    -    0
199 UDMA_CRC_Error_Count    -OSRCK   200   200   000    -    2
240 Head_Flying_Hours       ------   100   253   000    -    18637 (47 189 0)
241 Total_LBAs_Written      ------   100   253   000    -    2179833674
242 Total_LBAs_Read         ------   100   253   000    -    981847340
254 Free_Fall_Sensor        -O--CK   100   100   000    -    0
                            ||||||_ K auto-keep
                            |||||__ C event count
                            ||||___ R error rate
                            |||____ S speed/performance
                            ||_____ O updated online
                            |______ P prefailure warning

General Purpose Log Directory Version 1
SMART           Log Directory Version 1 [multi-sector log support]
Address    Access  R/W   Size  Description
0x00       GPL,SL  R/O      1  Log Directory
0x01       GPL,SL  R/O      1  Summary SMART error log
0x02       GPL,SL  R/O      5  Comprehensive SMART error log
0x03       GPL,SL  R/O      5  Ext. Comprehensive SMART error log
0x06       GPL,SL  R/O      1  SMART self-test log
0x07       GPL,SL  R/O      1  Extended self-test log
0x09       GPL,SL  R/W      1  Selective self-test log
0x10       GPL,SL  R/O      1  NCQ Command Error log
0x11       GPL,SL  R/O      1  SATA Phy Event Counters log
0x21       GPL,SL  R/O      1  Write stream error log
0x22       GPL,SL  R/O      1  Read stream error log
0x80-0x9f  GPL,SL  R/W     16  Host vendor specific log
0xa1       GPL,SL  VS      20  Device vendor specific log
0xa2       GPL     VS    2248  Device vendor specific log
0xa8       GPL,SL  VS      65  Device vendor specific log
0xa9       GPL,SL  VS       1  Device vendor specific log
0xb0       GPL     VS    2864  Device vendor specific log
0xbe-0xbf  GPL     VS   65535  Device vendor specific log
0xe0       GPL,SL  R/W      1  SCT Command/Status
0xe1       GPL,SL  R/W      1  SCT Data Transfer

SMART Extended Comprehensive Error Log Version: 1 (5 sectors)
Device Error Count: 566 (device log contains only the most recent 20 errors)
	CR     = Command Register
	FEATR  = Features Register
	COUNT  = Count (was: Sector Count) Register
	LBA_48 = Upper bytes of LBA High/Mid/Low Registers ]  ATA-8
	LH     = LBA High (was: Cylinder High) Register    ]   LBA
	LM     = LBA Mid (was: Cylinder Low) Register      ] Register
	LL     = LBA Low (was: Sector Number) Register     ]
	DV     = Device (was: Device/Head) Register
	DC     = Device Control Register
	ER     = Error register
	ST     = Status register
Powered_Up_Time is measured from power on, and printed as
DDd+hh:mm:SS.sss where DD=days, hh=hours, mm=minutes,
SS=sec, and sss=millisec. It "wraps" after 49.710 days.

Error 566 [5] occurred at disk power-on lifetime: 19893 hours (828 days + 21 hours)
  When the command that caused the error occurred, the device was active or idle.

  After command completion occurred, registers were:
  ER -- ST COUNT  LBA_48  LH LM LL DV DC
  -- -- -- == -- == == == -- -- -- -- --
  40 -- 51 00 00 00 1a f5 00 a3 6e 00 00  Error: WP at LBA = 0x1af500a36e = 115779609454

  Commands leading to the command that caused the error were:
  CR FEATR COUNT  LBA_48  LH LM LL DV DC  Powered_Up_Time  Command/Feature_Name
  -- == -- == -- == == == -- -- -- -- --  ---------------  --------------------
  61 00 00 01 00 00 24 f7 00 3a 18 40 00     03:25:50.535  WRITE FPDMA QUEUED
  61 00 00 01 00 00 24 f6 00 3a 18 40 00     03:25:50.534  WRITE FPDMA QUEUED
  61 00 00 01 00 00 24 f5 00 3a 18 40 00     03:25:50.534  WRITE FPDMA QUEUED
  61 00 00 01 00 00 24 f4 00 3a 18 40 00     03:25:50.534  WRITE FPDMA QUEUED
  61 00 00 01 00 00 24 f3 00 3a 18 40 00     03:25:50.533  WRITE FPDMA QUEUED

Error 565 [4] occurred at disk power-on lifetime: 19893 hours (828 days + 21 hours)
  When the command that caused the error occurred, the device was active or idle.

  After command completion occurred, registers were:
  ER -- ST COUNT  LBA_48  LH LM LL DV DC
  -- -- -- == -- == == == -- -- -- -- --
  40 -- 51 00 00 00 1a f5 00 a3 6e 00 00  Error: WP at LBA = 0x1af500a36e = 115779609454

  Commands leading to the command that caused the error were:
  CR FEATR COUNT  LBA_48  LH LM LL DV DC  Powered_Up_Time  Command/Feature_Name
  -- == -- == -- == == == -- -- -- -- --  ---------------  --------------------
  61 00 00 01 00 00 24 ef 00 3a 18 40 00     03:25:47.781  WRITE FPDMA QUEUED
  61 00 00 01 00 00 24 ee 00 3a 18 40 00     03:25:47.781  WRITE FPDMA QUEUED
  61 00 00 01 00 00 24 ed 00 3a 18 40 00     03:25:47.781  WRITE FPDMA QUEUED
  61 00 00 01 00 00 24 ec 00 3a 18 40 00     03:25:47.780  WRITE FPDMA QUEUED
  61 00 00 01 00 00 24 eb 00 3a 18 40 00     03:25:47.780  WRITE FPDMA QUEUED

Error 564 [3] occurred at disk power-on lifetime: 19845 hours (826 days + 21 hours)
  When the command that caused the error occurred, the device was active or idle.

  After command completion occurred, registers were:
  ER -- ST COUNT  LBA_48  LH LM LL DV DC
  -- -- -- == -- == == == -- -- -- -- --
  40 -- 51 00 00 00 1a f5 00 a3 6e 00 00  Error: UNC at LBA = 0x1af500a36e = 115779609454

  Commands leading to the command that caused the error were:
  CR FEATR COUNT  LBA_48  LH LM LL DV DC  Powered_Up_Time  Command/Feature_Name
  -- == -- == -- == == == -- -- -- -- --  ---------------  --------------------
  60 00 00 01 00 00 1a ef 00 a3 a0 40 00     17:20:48.632  READ FPDMA QUEUED
  60 00 00 01 00 00 1a ee 00 a3 a0 40 00     17:20:48.600  READ FPDMA QUEUED
  60 00 00 01 00 00 1a ed 00 a3 a0 40 00     17:20:48.597  READ FPDMA QUEUED
  60 00 00 00 30 00 02 d8 00 9e c8 40 00     17:20:48.596  READ FPDMA QUEUED
  60 00 00 01 00 00 1a 87 00 a3 a0 40 00     17:20:48.450  READ FPDMA QUEUED

Error 563 [2] occurred at disk power-on lifetime: 19842 hours (826 days + 18 hours)
  When the command that caused the error occurred, the device was active or idle.

  After command completion occurred, registers were:
  ER -- ST COUNT  LBA_48  LH LM LL DV DC
  -- -- -- == -- == == == -- -- -- -- --
  40 -- 51 00 00 00 1a f5 00 a3 6e 00 00  Error: UNC at LBA = 0x1af500a36e = 115779609454

  Commands leading to the command that caused the error were:
  CR FEATR COUNT  LBA_48  LH LM LL DV DC  Powered_Up_Time  Command/Feature_Name
  -- == -- == -- == == == -- -- -- -- --  ---------------  --------------------
  60 00 00 01 00 00 1a f4 00 a3 a0 40 00     14:47:26.806  READ FPDMA QUEUED
  60 00 00 00 38 00 02 db 00 9e b8 40 00     14:47:26.804  READ FPDMA QUEUED
  60 00 00 01 00 00 1a cb 00 a3 a0 40 00     14:47:26.745  READ FPDMA QUEUED
  60 00 00 01 00 00 1a ca 00 a3 a0 40 00     14:47:26.706  READ FPDMA QUEUED
  61 00 00 01 00 00 0c b5 00 ff 58 40 00     14:47:26.704  WRITE FPDMA QUEUED

Error 562 [1] occurred at disk power-on lifetime: 18172 hours (757 days + 4 hours)
  When the command that caused the error occurred, the device was active or idle.

  After command completion occurred, registers were:
  ER -- ST COUNT  LBA_48  LH LM LL DV DC
  -- -- -- == -- == == == -- -- -- -- --
  40 -- 51 00 00 00 00 75 00 03 47 00 00  Error: UNC at LBA = 0x75000347 = 1962935111

  Commands leading to the command that caused the error were:
  CR FEATR COUNT  LBA_48  LH LM LL DV DC  Powered_Up_Time  Command/Feature_Name
  -- == -- == -- == == == -- -- -- -- --  ---------------  --------------------
  25 00 00 00 08 00 00 75 00 03 40 e0 00     00:00:36.627  READ DMA EXT
  ef 00 03 00 46 00 00 00 00 00 00 e0 00     00:00:36.627  SET FEATURES [Set transfer mode]
  e5 00 00 00 00 00 00 00 00 00 00 e0 00     00:00:36.627  CHECK POWER MODE
  ec 00 00 00 00 00 00 00 00 00 00 e0 00     00:00:36.626  IDENTIFY DEVICE
  ef 00 03 00 00 00 00 00 00 00 00 e0 00     00:00:36.626  SET FEATURES [Set transfer mode]

Error 561 [0] occurred at disk power-on lifetime: 18172 hours (757 days + 4 hours)
  When the command that caused the error occurred, the device was active or idle.

  After command completion occurred, registers were:
  ER -- ST COUNT  LBA_48  LH LM LL DV DC
  -- -- -- == -- == == == -- -- -- -- --
  40 -- 51 00 00 00 00 75 00 03 47 00 00  Error: UNC at LBA = 0x75000347 = 1962935111

  Commands leading to the command that caused the error were:
  CR FEATR COUNT  LBA_48  LH LM LL DV DC  Powered_Up_Time  Command/Feature_Name
  -- == -- == -- == == == -- -- -- -- --  ---------------  --------------------
  25 00 00 00 08 00 00 75 00 03 40 e0 00     00:00:23.247  READ DMA EXT
  25 00 00 00 08 00 00 75 00 03 40 e0 00     00:00:20.098  READ DMA EXT
  ef 00 03 00 46 00 00 00 00 00 00 e0 00     00:00:20.098  SET FEATURES [Set transfer mode]
  e5 00 00 00 00 00 00 00 00 00 00 e0 00     00:00:20.098  CHECK POWER MODE
  ec 00 00 00 00 00 00 00 00 00 00 e0 00     00:00:20.097  IDENTIFY DEVICE

Error 560 [19] occurred at disk power-on lifetime: 18172 hours (757 days + 4 hours)
  When the command that caused the error occurred, the device was active or idle.

  After command completion occurred, registers were:
  ER -- ST COUNT  LBA_48  LH LM LL DV DC
  -- -- -- == -- == == == -- -- -- -- --
  40 -- 51 00 00 00 00 75 00 03 47 00 00  Error: UNC at LBA = 0x75000347 = 1962935111

  Commands leading to the command that caused the error were:
  CR FEATR COUNT  LBA_48  LH LM LL DV DC  Powered_Up_Time  Command/Feature_Name
  -- == -- == -- == == == -- -- -- -- --  ---------------  --------------------
  25 00 00 00 08 00 00 75 00 03 40 e0 00     00:00:20.098  READ DMA EXT
  ef 00 03 00 46 00 00 00 00 00 00 e0 00     00:00:20.098  SET FEATURES [Set transfer mode]
  e5 00 00 00 00 00 00 00 00 00 00 e0 00     00:00:20.098  CHECK POWER MODE
  ec 00 00 00 00 00 00 00 00 00 00 e0 00     00:00:20.097  IDENTIFY DEVICE
  ef 00 03 00 00 00 00 00 00 00 00 e0 00     00:00:20.097  SET FEATURES [Set transfer mode]

Error 559 [18] occurred at disk power-on lifetime: 18172 hours (757 days + 4 hours)
  When the command that caused the error occurred, the device was active or idle.

  After command completion occurred, registers were:
  ER -- ST COUNT  LBA_48  LH LM LL DV DC
  -- -- -- == -- == == == -- -- -- -- --
  40 -- 51 00 00 00 00 75 00 03 47 00 00  Error: UNC at LBA = 0x75000347 = 1962935111

  Commands leading to the command that caused the error were:
  CR FEATR COUNT  LBA_48  LH LM LL DV DC  Powered_Up_Time  Command/Feature_Name
  -- == -- == -- == == == -- -- -- -- --  ---------------  --------------------
  25 00 00 00 08 00 00 75 00 03 40 e0 00     00:00:06.791  READ DMA EXT
  25 00 00 00 08 00 00 75 00 03 30 e0 00     00:00:06.790  READ DMA EXT
  25 00 00 00 08 00 00 75 00 03 28 e0 00     00:00:06.784  READ DMA EXT
  25 00 00 00 08 00 00 08 00 00 10 e0 00     00:00:06.783  READ DMA EXT
  25 00 00 00 08 00 00 ad 00 03 50 e0 00     00:00:06.775  READ DMA EXT

SMART Extended Self-test Log Version: 1 (1 sectors)
No self-tests have been logged.  [To run self-tests, use: smartctl -t]

SMART Selective self-test log data structure revision number 1
 SPAN  MIN_LBA  MAX_LBA  CURRENT_TEST_STATUS
    1        0        0  Not_testing
    2        0        0  Not_testing
    3        0        0  Not_testing
    4        0        0  Not_testing
    5        0        0  Not_testing
Selective self-test flags (0x0):
  After scanning selected spans, do NOT read-scan remainder of disk.
If Selective self-test is pending on power-up, resume after 0 minute delay.

SCT Status Version:                  3
SCT Version (vendor specific):       522 (0x020a)
Device State:                        Active (0)
Current Temperature:                    34 Celsius
Power Cycle Min/Max Temperature:     30/38 Celsius
Lifetime    Min/Max Temperature:      8/65 Celsius
Specified Max Operating Temperature:    38 Celsius
Under/Over Temperature Limit Count:   0/0

SCT Temperature History Version:     2
Temperature Sampling Period:         1 minute
Temperature Logging Interval:        1 minute
Min/Max recommended Temperature:     14/55 Celsius
Min/Max Temperature Limit:           10/60 Celsius
Temperature History Size (Index):    128 (97)

SCT Error Recovery Control:
           Read: Disabled
          Write: Disabled

Device Statistics (GP/SMART Log 0x04) not supported

Pending Defects log (GP Log 0x0c) not supported

SATA Phy Event Counters (GP Log 0x11)
ID      Size     Value  Description
0x000a  2            3  Device-to-host register FISes sent due to a COMRESET
0x0001  2            0  Command failed due to ICRC error
0x0003  2            0  R_ERR response for device-to-host data FIS
0x0004  2            0  R_ERR response for host-to-device data FIS
0x0006  2            0  R_ERR response for device-to-host non-data FIS
0x0007  2            0  R_ERR response for host-to-device non-data FIS

