=== START OF INFORMATION SECTION ===
Model Family:     Maxtor MaXLine III (ATA/133 and SATA/150)
Device Model:     Maxtor 7L300S0
Serial Number:    --
Firmware Version: BANC1G10
User Capacity:    300 089 646 592 bytes [300 GB]
Sector Size:      512 bytes logical/physical
Device is:        In smartctl database [for details use: -P show]
ATA Version is:   ATA/ATAPI-7 T13/1532D revision 0
Local Time is:    Sun Mar 12 15:14:20 2017 MSK
SMART support is: Available - device has SMART capability.
SMART support is: Enabled
AAM level is:     254 (maximum performance), recommended: 192
APM feature is:   Disabled
Rd look-ahead is: Enabled
Write cache is:   Enabled
ATA Security is:  Disabled, NOT FROZEN [SEC1]
Wt Cache Reorder: Unavailable

=== START OF READ SMART DATA SECTION ===
SMART overall-health self-assessment test result: PASSED

General SMART Values:
Offline data collection status:  (0x82)	Offline data collection activity
					was completed without error.
					Auto Offline Data Collection: Enabled.
Self-test execution status:      (   0)	The previous self-test routine completed
					without error or no self-test has ever 
					been run.
Total time to complete Offline 
data collection: 		( 2283) seconds.
Offline data collection
capabilities: 			 (0x5b) SMART execute Offline immediate.
					Auto Offline data collection on/off support.
					Suspend Offline collection upon new
					command.
					Offline surface scan supported.
					Self-test supported.
					No Conveyance Self-test supported.
					Selective Self-test supported.
SMART capabilities:            (0x0003)	Saves SMART data before entering
					power-saving mode.
					Supports SMART auto save timer.
Error logging capability:        (0x01)	Error logging supported.
					General Purpose Logging supported.
Short self-test routine 
recommended polling time: 	 (   2) minutes.
Extended self-test routine
recommended polling time: 	 ( 118) minutes.
SCT capabilities: 	       (0x0021)	SCT Status supported.
					SCT Data Table supported.

SMART Attributes Data Structure revision number: 16
Vendor Specific SMART Attributes with Thresholds:
ID# ATTRIBUTE_NAME          FLAGS    VALUE WORST THRESH FAIL RAW_VALUE
  3 Spin_Up_Time            POS--K   195   181   063    -    19331
  4 Start_Stop_Count        -O--CK   247   247   000    -    12157
  5 Reallocated_Sector_Ct   PO--CK   253   253   063    -    0
  6 Read_Channel_Margin     P-----   253   253   100    -    0
  7 Seek_Error_Rate         -O-R--   253   252   000    -    0
  8 Seek_Time_Performance   POS--K   252   239   187    -    50412
  9 Power_On_Minutes        -O--CK   234   234   000    -    121h+24m
 10 Spin_Retry_Count        PO-R-K   219   214   157    -    33
 11 Calibration_Retry_Count PO-R-K   253   252   223    -    0
 12 Power_Cycle_Count       -O--CK   232   232   000    -    8519
192 Power-Off_Retract_Count -O--CK   253   253   000    -    0
193 Load_Cycle_Count        -O--CK   253   253   000    -    0
194 Temperature_Celsius     -O--CK   029   253   000    -    30
195 Hardware_ECC_Recovered  -O-R--   253   252   000    -    29353
196 Reallocated_Event_Count ---R--   253   253   000    -    0
197 Current_Pending_Sector  ---R--   253   253   000    -    0
198 Offline_Uncorrectable   ---R--   253   253   000    -    0
199 UDMA_CRC_Error_Count    ---R--   163   017   000    -    178
200 Multi_Zone_Error_Rate   -O-R--   253   252   000    -    0
201 Soft_Read_Error_Rate    -O-R--   253   252   000    -    0
202 Data_Address_Mark_Errs  -O-R--   253   252   000    -    0
203 Run_Out_Cancel          PO-R--   253   252   180    -    4
204 Soft_ECC_Correction     -O-R--   253   252   000    -    0
205 Thermal_Asperity_Rate   -O-R--   253   252   000    -    0
207 Spin_High_Current       -O-R-K   220   213   000    -    27
208 Spin_Buzz               -O-R-K   253   252   000    -    0
209 Offline_Seek_Performnce --S--K   241   241   000    -    145
210 Unknown_Attribute       -O--CK   253   252   000    -    0
211 Unknown_Attribute       -O--CK   253   252   000    -    0
212 Unknown_Attribute       -O--CK   253   252   000    -    0
                            ||||||_ K auto-keep
                            |||||__ C event count
                            ||||___ R error rate
                            |||____ S speed/performance
                            ||_____ O updated online
                            |______ P prefailure warning

General Purpose Log Directory Version 1
SMART           Log Directory Version 1 [multi-sector log support]
Address    Access  R/W   Size  Description
0x00       GPL,SL  R/O      1  Log Directory
0x01       GPL,SL  R/O      1  Summary SMART error log
0x02       GPL,SL  R/O      1  Comprehensive SMART error log
0x03       GPL,SL  R/O      4  Ext. Comprehensive SMART error log
0x06       GPL,SL  R/O      1  SMART self-test log
0x09       GPL,SL  R/W      1  Selective self-test log
0x10       GPL,SL  R/O      1  SATA NCQ Queued Error log
0x20       GPL,SL  R/O      1  Streaming performance log [OBS-8]
0x21       GPL,SL  R/O      1  Write stream error log
0x22       GPL,SL  R/O      1  Read stream error log

SMART Extended Comprehensive Error Log Version: 1 (4 sectors)
No Errors Logged

SMART Extended Self-test Log (GP Log 0x07) not supported

SMART Self-test log structure revision number 1
No self-tests have been logged.  [To run self-tests, use: smartctl -t]

SMART Selective self-test log data structure revision number 1
 SPAN  MIN_LBA  MAX_LBA  CURRENT_TEST_STATUS
    1        0        0  Not_testing
    2        0        0  Not_testing
    3        0        0  Not_testing
    4        0        0  Not_testing
    5        0        0  Not_testing
Selective self-test flags (0x0):
  After scanning selected spans, do NOT read-scan remainder of disk.
If Selective self-test is pending on power-up, resume after 0 minute delay.

SCT Status Version:                  2
SCT Version (vendor specific):       1 (0x0001)
SCT Support Level:                   1
Device State:                        Active (0)
Current Temperature:                 30 Celsius
Power Cycle Max Temperature:         30 Celsius
Lifetime    Max Temperature:         62 Celsius

SCT Temperature History Version:     2
Temperature Sampling Period:         1 minute
Temperature Logging Interval:        1 minute
Min/Max recommended Temperature:      0/60 Celsius
Min/Max Temperature Limit:            0/60 Celsius
Temperature History Size (Index):    478 (477)

SCT Error Recovery Control command not supported

Device Statistics (GP/SMART Log 0x04) not supported

SATA Phy Event Counters (GP Log 0x11) not supported



