=== START OF INFORMATION SECTION ===
Model Family:     Toshiba 2.5" HDD MK..52GSX
Device Model:     TOSHIBA MK2552GSX
Serial Number:    --
LU WWN Device Id: 5 000039 ...
Firmware Version: LV010A
User Capacity:    250,058,268,160 bytes [250 GB]
Sector Size:      512 bytes logical/physical
Device is:        In smartctl database [for details use: -P show]
ATA Version is:   ATA8-ACS (minor revision not indicated)
SATA Version is:  SATA 2.6, 1.5 Gb/s
Local Time is:    Sat Nov  3 08:20:56 2018 -03
SMART support is: Available - device has SMART capability.
SMART support is: Enabled
AAM feature is:   Unavailable
APM level is:     254 (maximum performance)
Rd look-ahead is: Enabled
Write cache is:   Enabled
DSN feature is:   Unavailable
ATA Security is:  Disabled, frozen [SEC2]
Wt Cache Reorder: Enabled

=== START OF READ SMART DATA SECTION ===
SMART overall-health self-assessment test result: PASSED

General SMART Values:
Offline data collection status:  (0x00)	Offline data collection activity
					was never started.
					Auto Offline Data Collection: Disabled.
Self-test execution status:      (   0)	The previous self-test routine completed
					without error or no self-test has ever 
					been run.
Total time to complete Offline 
data collection: 		(  120) seconds.
Offline data collection
capabilities: 			 (0x5b) SMART execute Offline immediate.
					Auto Offline data collection on/off support.
					Suspend Offline collection upon new
					command.
					Offline surface scan supported.
					Self-test supported.
					No Conveyance Self-test supported.
					Selective Self-test supported.
SMART capabilities:            (0x0003)	Saves SMART data before entering
					power-saving mode.
					Supports SMART auto save timer.
Error logging capability:        (0x01)	Error logging supported.
					General Purpose Logging supported.
Short self-test routine 
recommended polling time: 	 (   2) minutes.
Extended self-test routine
recommended polling time: 	 ( 118) minutes.
SCT capabilities: 	       (0x0039)	SCT Status supported.
					SCT Error Recovery Control supported.
					SCT Feature Control supported.
					SCT Data Table supported.

SMART Attributes Data Structure revision number: 16
Vendor Specific SMART Attributes with Thresholds:
ID# ATTRIBUTE_NAME          FLAGS    VALUE WORST THRESH FAIL RAW_VALUE
  1 Raw_Read_Error_Rate     PO-R--   100   100   050    -    0
  2 Throughput_Performance  P-S---   100   100   050    -    0
  3 Spin_Up_Time            POS--K   100   100   001    -    1607
  4 Start_Stop_Count        -O--CK   100   100   000    -    1981
  5 Reallocated_Sector_Ct   PO--CK   100   100   050    -    34
  7 Seek_Error_Rate         PO-R--   100   100   050    -    0
  8 Seek_Time_Performance   P-S---   100   100   050    -    0
  9 Power_On_Hours          -O--CK   078   078   000    -    8981
 10 Spin_Retry_Count        PO--CK   139   100   030    -    0
 12 Power_Cycle_Count       -O--CK   100   100   000    -    1759
192 Power-Off_Retract_Count -O--CK   100   100   000    -    368
193 Load_Cycle_Count        -O--CK   089   089   000    -    111761
194 Temperature_Celsius     -O---K   100   100   000    -    72 (Min/Max 21/80)
196 Reallocated_Event_Count -O--CK   100   100   000    -    12
197 Current_Pending_Sector  -O--CK   100   100   000    -    0
198 Offline_Uncorrectable   ----CK   100   100   000    -    0
199 UDMA_CRC_Error_Count    -O--CK   200   200   000    -    0
220 Disk_Shift              -O----   100   100   000    -    55
222 Loaded_Hours            -O--CK   096   096   000    -    1925
223 Load_Retry_Count        -O--CK   100   100   000    -    0
224 Load_Friction           -O---K   100   100   000    -    0
226 Load-in_Time            -OS--K   100   100   000    -    323
240 Head_Flying_Hours       P-----   100   100   001    -    0
                            ||||||_ K auto-keep
                            |||||__ C event count
                            ||||___ R error rate
                            |||____ S speed/performance
                            ||_____ O updated online
                            |______ P prefailure warning

General Purpose Log Directory Version 1
SMART           Log Directory Version 1 [multi-sector log support]
Address    Access  R/W   Size  Description
0x00       GPL,SL  R/O      1  Log Directory
0x01           SL  R/O      1  Summary SMART error log
0x02           SL  R/O     51  Comprehensive SMART error log
0x03       GPL     R/O     64  Ext. Comprehensive SMART error log
0x06           SL  R/O      1  SMART self-test log
0x07       GPL     R/O      1  Extended self-test log
0x09           SL  R/W      1  Selective self-test log
0x10       GPL     R/O      1  NCQ Command Error log
0x11       GPL     R/O      1  SATA Phy Event Counters log
0x80-0x9f  GPL,SL  R/W     16  Host vendor specific log
0xe0       GPL,SL  R/W      1  SCT Command/Status
0xe1       GPL,SL  R/W      1  SCT Data Transfer

SMART Extended Comprehensive Error Log Version: 1 (64 sectors)
Device Error Count: 11
	CR     = Command Register
	FEATR  = Features Register
	COUNT  = Count (was: Sector Count) Register
	LBA_48 = Upper bytes of LBA High/Mid/Low Registers ]  ATA-8
	LH     = LBA High (was: Cylinder High) Register    ]   LBA
	LM     = LBA Mid (was: Cylinder Low) Register      ] Register
	LL     = LBA Low (was: Sector Number) Register     ]
	DV     = Device (was: Device/Head) Register
	DC     = Device Control Register
	ER     = Error register
	ST     = Status register
Powered_Up_Time is measured from power on, and printed as
DDd+hh:mm:SS.sss where DD=days, hh=hours, mm=minutes,
SS=sec, and sss=millisec. It "wraps" after 49.710 days.

Error 11 [10] occurred at disk power-on lifetime: 6185 hours (257 days + 17 hours)
  When the command that caused the error occurred, the device was active or idle.

  After command completion occurred, registers were:
  ER -- ST COUNT  LBA_48  LH LM LL DV DC
  -- -- -- == -- == == == -- -- -- -- --
  40 -- 51 00 01 00 00 16 89 b2 57 e6 00  Error: UNC 1 sectors at LBA = 0x1689b257 = 378122839

  Commands leading to the command that caused the error were:
  CR FEATR COUNT  LBA_48  LH LM LL DV DC  Powered_Up_Time  Command/Feature_Name
  -- == -- == -- == == == -- -- -- -- --  ---------------  --------------------
  25 00 00 00 08 00 00 16 89 b2 50 e0 00     00:38:29.948  READ DMA EXT
  ef 00 03 01 45 00 00 01 00 00 00 a0 00     00:38:29.947  SET FEATURES [Set transfer mode]
  ff ff ff ff ff ff ff ff ff ff ff ff 0c     00:38:29.937  [VENDOR SPECIFIC]
  25 00 00 00 80 00 00 16 89 b2 50 e0 00     00:38:25.761  READ DMA EXT
  25 00 00 00 40 00 00 17 ab d0 f0 e0 00     00:38:25.750  READ DMA EXT

Error 10 [9] occurred at disk power-on lifetime: 6185 hours (257 days + 17 hours)
  When the command that caused the error occurred, the device was active or idle.

  After command completion occurred, registers were:
  ER -- ST COUNT  LBA_48  LH LM LL DV DC
  -- -- -- == -- == == == -- -- -- -- --
  40 -- 51 00 7e 00 00 16 89 b2 52 e6 00  Error: UNC 126 sectors at LBA = 0x1689b252 = 378122834

  Commands leading to the command that caused the error were:
  CR FEATR COUNT  LBA_48  LH LM LL DV DC  Powered_Up_Time  Command/Feature_Name
  -- == -- == -- == == == -- -- -- -- --  ---------------  --------------------
  25 00 00 00 80 00 00 16 89 b2 50 e0 00     00:38:25.761  READ DMA EXT
  25 00 00 00 40 00 00 17 ab d0 f0 e0 00     00:38:25.750  READ DMA EXT
  25 00 00 00 40 00 00 17 ab d0 b0 e0 00     00:38:25.749  READ DMA EXT
  25 00 00 00 40 00 00 17 ab d0 70 e0 00     00:38:25.748  READ DMA EXT
  25 00 00 00 40 00 00 17 ab d0 30 e0 00     00:38:25.747  READ DMA EXT

Error 9 [8] occurred at disk power-on lifetime: 6184 hours (257 days + 16 hours)
  When the command that caused the error occurred, the device was active or idle.

  After command completion occurred, registers were:
  ER -- ST COUNT  LBA_48  LH LM LL DV DC
  -- -- -- == -- == == == -- -- -- -- --
  40 -- 51 00 05 00 00 16 f8 ed 93 e6 00  Error: UNC 5 sectors at LBA = 0x16f8ed93 = 385412499

  Commands leading to the command that caused the error were:
  CR FEATR COUNT  LBA_48  LH LM LL DV DC  Powered_Up_Time  Command/Feature_Name
  -- == -- == -- == == == -- -- -- -- --  ---------------  --------------------
  25 00 00 00 08 00 00 16 f8 ed 90 e0 00     00:25:46.794  READ DMA EXT
  25 00 00 00 10 00 00 16 f8 ef 80 e0 00     00:25:46.793  READ DMA EXT
  25 00 00 00 f0 00 00 16 f8 ee 90 e0 00     00:25:46.790  READ DMA EXT
  25 00 00 00 10 00 00 16 f8 ee 80 e0 00     00:25:46.733  READ DMA EXT
  ef 00 03 01 45 00 00 01 00 00 00 a0 00     00:25:46.732  SET FEATURES [Set transfer mode]

Error 8 [7] occurred at disk power-on lifetime: 6184 hours (257 days + 16 hours)
  When the command that caused the error occurred, the device was active or idle.

  After command completion occurred, registers were:
  ER -- ST COUNT  LBA_48  LH LM LL DV DC
  -- -- -- == -- == == == -- -- -- -- --
  40 -- 51 00 ed 00 00 16 f8 ed 93 e6 00  Error: UNC 237 sectors at LBA = 0x16f8ed93 = 385412499

  Commands leading to the command that caused the error were:
  CR FEATR COUNT  LBA_48  LH LM LL DV DC  Powered_Up_Time  Command/Feature_Name
  -- == -- == -- == == == -- -- -- -- --  ---------------  --------------------
  25 00 00 00 f0 00 00 16 f8 ed 90 e0 00     00:25:42.651  READ DMA EXT
  25 00 00 00 10 00 00 16 f8 ed 80 e0 00     00:25:42.640  READ DMA EXT
  25 00 00 00 f0 00 00 16 f8 ec 90 e0 00     00:25:42.636  READ DMA EXT
  25 00 00 00 10 00 00 16 f8 ec 80 e0 00     00:25:42.625  READ DMA EXT
  25 00 00 00 f0 00 00 16 f8 eb 90 e0 00     00:25:42.622  READ DMA EXT

Error 7 [6] occurred at disk power-on lifetime: 5563 hours (231 days + 19 hours)
  When the command that caused the error occurred, the device was active or idle.

  After command completion occurred, registers were:
  ER -- ST COUNT  LBA_48  LH LM LL DV DC
  -- -- -- == -- == == == -- -- -- -- --
  40 -- 51 00 02 00 00 16 a3 39 b6 e6 00  Error: UNC 2 sectors at LBA = 0x16a339b6 = 379795894

  Commands leading to the command that caused the error were:
  CR FEATR COUNT  LBA_48  LH LM LL DV DC  Powered_Up_Time  Command/Feature_Name
  -- == -- == -- == == == -- -- -- -- --  ---------------  --------------------
  25 00 00 00 08 00 00 16 a3 39 b0 e0 00     14:43:35.545  READ DMA EXT
  25 00 00 00 08 00 00 16 a3 39 a8 e0 00     14:43:35.544  READ DMA EXT
  25 00 00 00 08 00 00 16 a3 39 a0 e0 00     14:43:35.544  READ DMA EXT
  25 00 00 00 08 00 00 16 a3 39 98 e0 00     14:43:35.543  READ DMA EXT
  25 00 00 00 08 00 00 16 a3 39 90 e0 00     14:43:35.543  READ DMA EXT

Error 6 [5] occurred at disk power-on lifetime: 5563 hours (231 days + 19 hours)
  When the command that caused the error occurred, the device was active or idle.

  After command completion occurred, registers were:
  ER -- ST COUNT  LBA_48  LH LM LL DV DC
  -- -- -- == -- == == == -- -- -- -- --
  40 -- 51 00 0a 00 00 16 a3 39 b6 e6 00  Error: UNC 10 sectors at LBA = 0x16a339b6 = 379795894

  Commands leading to the command that caused the error were:
  CR FEATR COUNT  LBA_48  LH LM LL DV DC  Powered_Up_Time  Command/Feature_Name
  -- == -- == -- == == == -- -- -- -- --  ---------------  --------------------
  25 00 00 00 f0 00 00 16 a3 38 d0 e0 00     14:43:31.318  READ DMA EXT
  25 00 00 00 10 00 00 16 a3 38 c0 e0 00     14:43:31.317  READ DMA EXT
  25 00 00 00 f0 00 00 16 a3 37 d0 e0 00     14:43:31.314  READ DMA EXT
  25 00 00 00 10 00 00 16 a3 37 c0 e0 00     14:43:31.313  READ DMA EXT
  25 00 00 00 f0 00 00 16 a3 36 d0 e0 00     14:43:31.298  READ DMA EXT

Error 5 [4] occurred at disk power-on lifetime: 5127 hours (213 days + 15 hours)
  When the command that caused the error occurred, the device was active or idle.

  After command completion occurred, registers were:
  ER -- ST COUNT  LBA_48  LH LM LL DV DC
  -- -- -- == -- == == == -- -- -- -- --
  40 -- 51 00 32 00 00 16 89 b2 5e e6 00  Error: UNC 50 sectors at LBA = 0x1689b25e = 378122846

  Commands leading to the command that caused the error were:
  CR FEATR COUNT  LBA_48  LH LM LL DV DC  Powered_Up_Time  Command/Feature_Name
  -- == -- == -- == == == -- -- -- -- --  ---------------  --------------------
  25 00 00 00 40 00 00 16 89 b2 50 e0 00     07:44:28.360  READ DMA EXT
  25 00 00 00 10 00 00 17 ab d2 20 e0 00     07:44:28.359  READ DMA EXT
  25 00 00 00 f0 00 00 17 ab d1 30 e0 00     07:44:28.355  READ DMA EXT
  25 00 00 00 10 00 00 17 ab d1 20 e0 00     07:44:26.824  READ DMA EXT
  25 00 00 00 f0 00 00 17 ab d0 30 e0 00     07:44:26.788  READ DMA EXT

Error 4 [3] occurred at disk power-on lifetime: 958 hours (39 days + 22 hours)
  When the command that caused the error occurred, the device was active or idle.

  After command completion occurred, registers were:
  ER -- ST COUNT  LBA_48  LH LM LL DV DC
  -- -- -- == -- == == == -- -- -- -- --
  40 -- 51 00 08 00 00 16 ff 18 61 e6 00  Error: UNC 8 sectors at LBA = 0x16ff1861 = 385816673

  Commands leading to the command that caused the error were:
  CR FEATR COUNT  LBA_48  LH LM LL DV DC  Powered_Up_Time  Command/Feature_Name
  -- == -- == -- == == == -- -- -- -- --  ---------------  --------------------
  25 00 00 00 08 00 00 16 ff 18 61 e0 00     01:27:22.223  READ DMA EXT
  35 00 00 00 20 00 00 05 79 d1 c0 e0 00     01:27:22.220  WRITE DMA EXT
  35 00 00 00 08 00 00 00 86 f0 d0 e0 00     01:27:22.219  WRITE DMA EXT
  35 00 00 00 08 00 00 00 5b f4 80 e0 00     01:27:22.219  WRITE DMA EXT
  35 00 00 00 08 00 00 00 5b f4 88 e0 00     01:27:22.218  WRITE DMA EXT

SMART Extended Self-test Log Version: 1 (1 sectors)
Num  Test_Description    Status                  Remaining  LifeTime(hours)  LBA_of_first_error
# 1  Short offline       Completed without error       00%      8980         -
# 2  Short offline       Completed without error       00%      8964         -
# 3  Short offline       Completed without error       00%      8943         -
# 4  Short offline       Completed without error       00%      8919         -
# 5  Short offline       Completed without error       00%      8900         -
# 6  Short offline       Completed without error       00%      8884         -
# 7  Short offline       Completed without error       00%      8867         -
# 8  Short offline       Completed without error       00%      8851         -
# 9  Short offline       Completed without error       00%      8839         -
#10  Short offline       Completed without error       00%      8826         -
#11  Short offline       Completed without error       00%      8811         -
#12  Short offline       Completed without error       00%      8793         -
#13  Short offline       Completed without error       00%      8778         -
#14  Short offline       Completed without error       00%      8761         -
#15  Short offline       Completed without error       00%      8743         -
#16  Short offline       Completed without error       00%      8728         -
#17  Short offline       Completed without error       00%      8717         -
#18  Short offline       Completed without error       00%      8697         -

SMART Selective self-test log data structure revision number 1
 SPAN  MIN_LBA  MAX_LBA  CURRENT_TEST_STATUS
    1        0        0  Not_testing
    2        0        0  Not_testing
    3        0        0  Not_testing
    4        0        0  Not_testing
    5        0        0  Not_testing
Selective self-test flags (0x0):
  After scanning selected spans, do NOT read-scan remainder of disk.
If Selective self-test is pending on power-up, resume after 0 minute delay.

SCT Status Version:                  2
SCT Version (vendor specific):       1 (0x0001)
SCT Support Level:                   1
Device State:                        Active (0)
Current Temperature:                 72 Celsius
Power Cycle Max Temperature:         73 Celsius
Lifetime    Max Temperature:         80 Celsius

SCT Temperature History Version:     2
Temperature Sampling Period:         1 minute
Temperature Logging Interval:        1 minute
Min/Max recommended Temperature:      5/55 Celsius
Min/Max Temperature Limit:            5/55 Celsius
Temperature History Size (Index):    478 (324)

SCT Error Recovery Control:
           Read: Disabled
          Write: Disabled

Device Statistics (GP/SMART Log 0x04) not supported

Pending Defects log (GP Log 0x0c) not supported

SATA Phy Event Counters (GP Log 0x11)
ID      Size     Value  Description
0x0001  4            0  Command failed due to ICRC error
0x0002  4            0  R_ERR response for data FIS
0x0003  4            0  R_ERR response for device-to-host data FIS
0x0004  4            0  R_ERR response for host-to-device data FIS
0x0005  4            0  R_ERR response for non-data FIS
0x0006  4            0  R_ERR response for device-to-host non-data FIS
0x0007  4            0  R_ERR response for host-to-device non-data FIS
0x0008  4            0  Device-to-host non-data FIS retries
0x0009  4        50679  Transition from drive PhyRdy to drive PhyNRdy
0x000a  4            2  Device-to-host register FISes sent due to a COMRESET
0x000b  4            0  CRC errors within host-to-device FIS
0x000d  4            0  Non-CRC errors within host-to-device FIS
0x000f  4            0  R_ERR response for host-to-device data FIS, CRC
0x0010  4            0  R_ERR response for host-to-device data FIS, non-CRC
0x0012  4            0  R_ERR response for host-to-device non-data FIS, CRC
0x0013  4            0  R_ERR response for host-to-device non-data FIS, non-CRC



