smartctl 7.2 2020-12-30 r5155 [x86_64-linux-5.16.7-desktop-1omv4003] (OpenMandriva Lx 7.2-2)
Copyright (C) 2002-20, Bruce Allen, Christian Franke, www.smartmontools.org

=== START OF INFORMATION SECTION ===
Model Family:     Western Digital Scorpio Black
Device Model:     WDC WD2500BEKT-75A25T0
Serial Number:    --
LU WWN Device Id: 5 0014ee ...
Firmware Version: 01.01A01
User Capacity:    250,059,350,016 bytes [250 GB]
Sector Size:      512 bytes logical/physical
Rotation Rate:    7200 rpm
Device is:        In smartctl database [for details use: -P show]
ATA Version is:   ATA8-ACS (minor revision not indicated)
SATA Version is:  SATA 2.6, 3.0 Gb/s
Local Time is:    Mon Jul 25 21:06:04 2022 IST
SMART support is: Available - device has SMART capability.
SMART support is: Enabled
AAM feature is:   Disabled
APM level is:     128 (minimum power consumption without standby)
Rd look-ahead is: Enabled
Write cache is:   Enabled
DSN feature is:   Unavailable
ATA Security is:  Disabled, frozen [SEC2]
Wt Cache Reorder: Enabled

=== START OF READ SMART DATA SECTION ===
SMART overall-health self-assessment test result: PASSED

General SMART Values:
Offline data collection status:  (0x82)	Offline data collection activity
					was completed without error.
					Auto Offline Data Collection: Enabled.
Self-test execution status:      (   0)	The previous self-test routine completed
					without error or no self-test has ever 
					been run.
Total time to complete Offline 
data collection: 		( 4800) seconds.
Offline data collection
capabilities: 			 (0x7b) SMART execute Offline immediate.
					Auto Offline data collection on/off support.
					Suspend Offline collection upon new
					command.
					Offline surface scan supported.
					Self-test supported.
					Conveyance Self-test supported.
					Selective Self-test supported.
SMART capabilities:            (0x0003)	Saves SMART data before entering
					power-saving mode.
					Supports SMART auto save timer.
Error logging capability:        (0x01)	Error logging supported.
					General Purpose Logging supported.
Short self-test routine 
recommended polling time: 	 (   2) minutes.
Extended self-test routine
recommended polling time: 	 (  59) minutes.
Conveyance self-test routine
recommended polling time: 	 (   5) minutes.
SCT capabilities: 	       (0x7037)	SCT Status supported.
					SCT Feature Control supported.
					SCT Data Table supported.

SMART Attributes Data Structure revision number: 16
Vendor Specific SMART Attributes with Thresholds:
ID# ATTRIBUTE_NAME          FLAGS    VALUE WORST THRESH FAIL RAW_VALUE
  1 Raw_Read_Error_Rate     POSR-K   200   200   051    -    646
  3 Spin_Up_Time            POS--K   140   136   021    -    1983
  4 Start_Stop_Count        -O--CK   095   095   000    -    5994
  5 Reallocated_Sector_Ct   PO--CK   200   200   140    -    0
  7 Seek_Error_Rate         -OSR-K   200   200   000    -    0
  9 Power_On_Hours          -O--CK   082   082   000    -    13724
 10 Spin_Retry_Count        -O--CK   100   100   000    -    0
 11 Calibration_Retry_Count -O--CK   100   100   000    -    0
 12 Power_Cycle_Count       -O--CK   095   095   000    -    5988
191 G-Sense_Error_Rate      -O--CK   066   066   000    -    34
192 Power-Off_Retract_Count -O--CK   198   198   000    -    1730
193 Load_Cycle_Count        -O--CK   059   059   000    -    424930
194 Temperature_Celsius     -O---K   108   099   000    -    35
196 Reallocated_Event_Count -O--CK   200   200   000    -    0
197 Current_Pending_Sector  -O--CK   200   200   000    -    0
198 Offline_Uncorrectable   ----CK   200   200   000    -    0
199 UDMA_CRC_Error_Count    -O--CK   200   200   000    -    0
200 Multi_Zone_Error_Rate   ---R--   200   200   000    -    0
240 Head_Flying_Hours       -O--CK   082   082   000    -    13228
241 Total_LBAs_Written      -O--CK   200   200   000    -    9617631245
242 Total_LBAs_Read         -O--CK   200   200   000    -    11722496663
254 Free_Fall_Sensor        -O--CK   200   200   000    -    0
                            ||||||_ K auto-keep
                            |||||__ C event count
                            ||||___ R error rate
                            |||____ S speed/performance
                            ||_____ O updated online
                            |______ P prefailure warning

General Purpose Log Directory Version 1
SMART           Log Directory Version 1 [multi-sector log support]
Address    Access  R/W   Size  Description
0x00       GPL,SL  R/O      1  Log Directory
0x01           SL  R/O      1  Summary SMART error log
0x02           SL  R/O      5  Comprehensive SMART error log
0x03       GPL     R/O      6  Ext. Comprehensive SMART error log
0x06           SL  R/O      1  SMART self-test log
0x07       GPL     R/O      1  Extended self-test log
0x09           SL  R/W      1  Selective self-test log
0x10       GPL     R/O      1  NCQ Command Error log
0x11       GPL     R/O      1  SATA Phy Event Counters log
0x80-0x9f  GPL,SL  R/W     16  Host vendor specific log
0xa0-0xa7  GPL,SL  VS      16  Device vendor specific log
0xa8-0xb7  GPL,SL  VS       1  Device vendor specific log
0xc0       GPL,SL  VS       1  Device vendor specific log
0xc1       GPL     VS      24  Device vendor specific log
0xe0       GPL,SL  R/W      1  SCT Command/Status
0xe1       GPL,SL  R/W      1  SCT Data Transfer

SMART Extended Comprehensive Error Log Version: 1 (6 sectors)
Device Error Count: 1323 (device log contains only the most recent 24 errors)
	CR     = Command Register
	FEATR  = Features Register
	COUNT  = Count (was: Sector Count) Register
	LBA_48 = Upper bytes of LBA High/Mid/Low Registers ]  ATA-8
	LH     = LBA High (was: Cylinder High) Register    ]   LBA
	LM     = LBA Mid (was: Cylinder Low) Register      ] Register
	LL     = LBA Low (was: Sector Number) Register     ]
	DV     = Device (was: Device/Head) Register
	DC     = Device Control Register
	ER     = Error register
	ST     = Status register
Powered_Up_Time is measured from power on, and printed as
DDd+hh:mm:SS.sss where DD=days, hh=hours, mm=minutes,
SS=sec, and sss=millisec. It "wraps" after 49.710 days.

Error 1323 [2] occurred at disk power-on lifetime: 4595 hours (191 days + 11 hours)
  When the command that caused the error occurred, the device was active or idle.

  After command completion occurred, registers were:
  ER -- ST COUNT  LBA_48  LH LM LL DV DC
  -- -- -- == -- == == == -- -- -- -- --
  40 -- 51 00 08 00 00 00 69 69 ed 40 00  Error: UNC at LBA = 0x006969ed = 6908397

  Commands leading to the command that caused the error were:
  CR FEATR COUNT  LBA_48  LH LM LL DV DC  Powered_Up_Time  Command/Feature_Name
  -- == -- == -- == == == -- -- -- -- --  ---------------  --------------------
  60 00 08 00 50 00 00 00 69 69 e8 40 00     00:36:25.409  READ FPDMA QUEUED
  ef 00 90 00 03 00 00 00 00 00 00 a0 00     00:36:25.409  SET FEATURES [Disable SATA feature]
  ef 00 02 00 00 00 00 00 00 00 00 a0 00     00:36:25.409  SET FEATURES [Enable write cache]
  60 00 08 00 48 00 00 00 69 69 e8 40 00     00:36:23.397  READ FPDMA QUEUED
  ef 00 90 00 03 00 00 00 00 00 00 a0 00     00:36:23.397  SET FEATURES [Disable SATA feature]

Error 1322 [1] occurred at disk power-on lifetime: 4595 hours (191 days + 11 hours)
  When the command that caused the error occurred, the device was active or idle.

  After command completion occurred, registers were:
  ER -- ST COUNT  LBA_48  LH LM LL DV DC
  -- -- -- == -- == == == -- -- -- -- --
  40 -- 51 00 08 00 00 00 69 69 ed 40 00  Error: UNC at LBA = 0x006969ed = 6908397

  Commands leading to the command that caused the error were:
  CR FEATR COUNT  LBA_48  LH LM LL DV DC  Powered_Up_Time  Command/Feature_Name
  -- == -- == -- == == == -- -- -- -- --  ---------------  --------------------
  60 00 08 00 48 00 00 00 69 69 e8 40 00     00:36:23.397  READ FPDMA QUEUED
  ef 00 90 00 03 00 00 00 00 00 00 a0 00     00:36:23.397  SET FEATURES [Disable SATA feature]
  ef 00 02 00 00 00 00 00 00 00 00 a0 00     00:36:23.397  SET FEATURES [Enable write cache]
  60 00 08 00 40 00 00 00 69 69 e8 40 00     00:36:21.448  READ FPDMA QUEUED
  ef 00 90 00 03 00 00 00 00 00 00 a0 00     00:36:21.448  SET FEATURES [Disable SATA feature]

Error 1321 [0] occurred at disk power-on lifetime: 4595 hours (191 days + 11 hours)
  When the command that caused the error occurred, the device was active or idle.

  After command completion occurred, registers were:
  ER -- ST COUNT  LBA_48  LH LM LL DV DC
  -- -- -- == -- == == == -- -- -- -- --
  40 -- 51 00 08 00 00 00 69 69 ed 40 00  Error: UNC at LBA = 0x006969ed = 6908397

  Commands leading to the command that caused the error were:
  CR FEATR COUNT  LBA_48  LH LM LL DV DC  Powered_Up_Time  Command/Feature_Name
  -- == -- == -- == == == -- -- -- -- --  ---------------  --------------------
  60 00 08 00 40 00 00 00 69 69 e8 40 00     00:36:21.448  READ FPDMA QUEUED
  ef 00 90 00 03 00 00 00 00 00 00 a0 00     00:36:21.448  SET FEATURES [Disable SATA feature]
  ef 00 02 00 00 00 00 00 00 00 00 a0 00     00:36:21.448  SET FEATURES [Enable write cache]
  60 00 08 00 38 00 00 00 69 69 e8 40 00     00:36:19.457  READ FPDMA QUEUED
  ef 00 90 00 03 00 00 00 00 00 00 a0 00     00:36:19.457  SET FEATURES [Disable SATA feature]

Error 1320 [23] occurred at disk power-on lifetime: 4595 hours (191 days + 11 hours)
  When the command that caused the error occurred, the device was active or idle.

  After command completion occurred, registers were:
  ER -- ST COUNT  LBA_48  LH LM LL DV DC
  -- -- -- == -- == == == -- -- -- -- --
  40 -- 51 00 08 00 00 00 69 69 ed 40 00  Error: UNC at LBA = 0x006969ed = 6908397

  Commands leading to the command that caused the error were:
  CR FEATR COUNT  LBA_48  LH LM LL DV DC  Powered_Up_Time  Command/Feature_Name
  -- == -- == -- == == == -- -- -- -- --  ---------------  --------------------
  60 00 08 00 38 00 00 00 69 69 e8 40 00     00:36:19.457  READ FPDMA QUEUED
  ef 00 90 00 03 00 00 00 00 00 00 a0 00     00:36:19.457  SET FEATURES [Disable SATA feature]
  ef 00 02 00 00 00 00 00 00 00 00 a0 00     00:36:19.457  SET FEATURES [Enable write cache]
  60 00 38 00 30 00 00 00 69 69 e8 40 00     00:36:17.409  READ FPDMA QUEUED
  ef 00 90 00 03 00 00 00 00 00 00 a0 00     00:36:17.409  SET FEATURES [Disable SATA feature]

Error 1319 [22] occurred at disk power-on lifetime: 4595 hours (191 days + 11 hours)
  When the command that caused the error occurred, the device was active or idle.

  After command completion occurred, registers were:
  ER -- ST COUNT  LBA_48  LH LM LL DV DC
  -- -- -- == -- == == == -- -- -- -- --
  40 -- 51 00 38 00 00 00 69 69 ed 40 00  Error: UNC at LBA = 0x006969ed = 6908397

  Commands leading to the command that caused the error were:
  CR FEATR COUNT  LBA_48  LH LM LL DV DC  Powered_Up_Time  Command/Feature_Name
  -- == -- == -- == == == -- -- -- -- --  ---------------  --------------------
  60 00 38 00 30 00 00 00 69 69 e8 40 00     00:36:17.409  READ FPDMA QUEUED
  ef 00 90 00 03 00 00 00 00 00 00 a0 00     00:36:17.409  SET FEATURES [Disable SATA feature]
  ef 00 02 00 00 00 00 00 00 00 00 a0 00     00:36:17.409  SET FEATURES [Enable write cache]
  60 00 08 00 28 00 00 00 69 69 e8 40 00     00:36:15.345  READ FPDMA QUEUED
  ef 00 90 00 03 00 00 00 00 00 00 a0 00     00:36:15.344  SET FEATURES [Disable SATA feature]

Error 1318 [21] occurred at disk power-on lifetime: 4595 hours (191 days + 11 hours)
  When the command that caused the error occurred, the device was active or idle.

  After command completion occurred, registers were:
  ER -- ST COUNT  LBA_48  LH LM LL DV DC
  -- -- -- == -- == == == -- -- -- -- --
  40 -- 51 00 08 00 00 00 69 69 ed 40 00  Error: UNC at LBA = 0x006969ed = 6908397

  Commands leading to the command that caused the error were:
  CR FEATR COUNT  LBA_48  LH LM LL DV DC  Powered_Up_Time  Command/Feature_Name
  -- == -- == -- == == == -- -- -- -- --  ---------------  --------------------
  60 00 08 00 28 00 00 00 69 69 e8 40 00     00:36:15.345  READ FPDMA QUEUED
  ef 00 90 00 03 00 00 00 00 00 00 a0 00     00:36:15.344  SET FEATURES [Disable SATA feature]
  ef 00 02 00 00 00 00 00 00 00 00 a0 00     00:36:15.344  SET FEATURES [Enable write cache]
  60 00 08 00 20 00 00 00 69 69 e8 40 00     00:36:13.280  READ FPDMA QUEUED
  ef 00 90 00 03 00 00 00 00 00 00 a0 00     00:36:13.280  SET FEATURES [Disable SATA feature]

Error 1317 [20] occurred at disk power-on lifetime: 4595 hours (191 days + 11 hours)
  When the command that caused the error occurred, the device was active or idle.

  After command completion occurred, registers were:
  ER -- ST COUNT  LBA_48  LH LM LL DV DC
  -- -- -- == -- == == == -- -- -- -- --
  40 -- 51 00 08 00 00 00 69 69 ed 40 00  Error: UNC at LBA = 0x006969ed = 6908397

  Commands leading to the command that caused the error were:
  CR FEATR COUNT  LBA_48  LH LM LL DV DC  Powered_Up_Time  Command/Feature_Name
  -- == -- == -- == == == -- -- -- -- --  ---------------  --------------------
  60 00 08 00 20 00 00 00 69 69 e8 40 00     00:36:13.280  READ FPDMA QUEUED
  ef 00 90 00 03 00 00 00 00 00 00 a0 00     00:36:13.280  SET FEATURES [Disable SATA feature]
  ef 00 02 00 00 00 00 00 00 00 00 a0 00     00:36:13.280  SET FEATURES [Enable write cache]
  60 00 08 00 18 00 00 00 69 69 e8 40 00     00:36:11.224  READ FPDMA QUEUED
  ef 00 90 00 03 00 00 00 00 00 00 a0 00     00:36:11.224  SET FEATURES [Disable SATA feature]

Error 1316 [19] occurred at disk power-on lifetime: 4595 hours (191 days + 11 hours)
  When the command that caused the error occurred, the device was active or idle.

  After command completion occurred, registers were:
  ER -- ST COUNT  LBA_48  LH LM LL DV DC
  -- -- -- == -- == == == -- -- -- -- --
  40 -- 51 00 08 00 00 00 69 69 ed 40 00  Error: UNC at LBA = 0x006969ed = 6908397

  Commands leading to the command that caused the error were:
  CR FEATR COUNT  LBA_48  LH LM LL DV DC  Powered_Up_Time  Command/Feature_Name
  -- == -- == -- == == == -- -- -- -- --  ---------------  --------------------
  60 00 08 00 18 00 00 00 69 69 e8 40 00     00:36:11.224  READ FPDMA QUEUED
  ef 00 90 00 03 00 00 00 00 00 00 a0 00     00:36:11.224  SET FEATURES [Disable SATA feature]
  ef 00 02 00 00 00 00 00 00 00 00 a0 00     00:36:11.224  SET FEATURES [Enable write cache]
  60 00 08 00 10 00 00 00 69 69 e8 40 00     00:36:09.210  READ FPDMA QUEUED
  ef 00 90 00 03 00 00 00 00 00 00 a0 00     00:36:09.210  SET FEATURES [Disable SATA feature]

SMART Extended Self-test Log Version: 1 (1 sectors)
Num  Test_Description    Status                  Remaining  LifeTime(hours)  LBA_of_first_error
# 1  Short offline       Completed without error       00%     13515         -
# 2  Short offline       Interrupted (host reset)      80%     13515         -
# 3  Short offline       Completed without error       00%     13511         -
# 4  Short offline       Completed without error       00%      9714         -
# 5  Short offline       Completed without error       00%      9713         -
# 6  Short offline       Interrupted (host reset)      10%      4665         -
# 7  Short offline       Completed without error       00%      4665         -
# 8  Short offline       Completed without error       00%         0         -

SMART Selective self-test log data structure revision number 1
 SPAN  MIN_LBA  MAX_LBA  CURRENT_TEST_STATUS
    1        0        0  Not_testing
    2        0        0  Not_testing
    3        0        0  Not_testing
    4        0        0  Not_testing
    5        0        0  Not_testing
Selective self-test flags (0x0):
  After scanning selected spans, do NOT read-scan remainder of disk.
If Selective self-test is pending on power-up, resume after 0 minute delay.

SCT Status Version:                  2
SCT Version (vendor specific):       258 (0x0102)
Device State:                        Active (0)
Current Temperature:                    35 Celsius
Power Cycle Min/Max Temperature:     31/35 Celsius
Lifetime    Min/Max Temperature:     31/45 Celsius
Specified Max Operating Temperature:    27 Celsius
Under/Over Temperature Limit Count:   0/0
Vendor specific:
01 00 00 00 00 00 00 00 00 00 00 00 00 00 00 00
00 00 00 00 00 00 00 00 00 00 00 00 00 00 00 00

SCT Temperature History Version:     2
Temperature Sampling Period:         1 minute
Temperature Logging Interval:        1 minute
Min/Max recommended Temperature:      0/60 Celsius
Min/Max Temperature Limit:           -41/85 Celsius
Temperature History Size (Index):    128 (99)

SCT Error Recovery Control command not supported

Device Statistics (GP/SMART Log 0x04) not supported

Pending Defects log (GP Log 0x0c) not supported

SATA Phy Event Counters (GP Log 0x11)
ID      Size     Value  Description
0x0001  2            0  Command failed due to ICRC error
0x0002  2            0  R_ERR response for data FIS
0x0003  2            0  R_ERR response for device-to-host data FIS
0x0004  2            0  R_ERR response for host-to-device data FIS
0x0005  2            0  R_ERR response for non-data FIS
0x0006  2            0  R_ERR response for device-to-host non-data FIS
0x0007  2            0  R_ERR response for host-to-device non-data FIS
0x000a  2            2  Device-to-host register FISes sent due to a COMRESET
0x000b  2            0  CRC errors within host-to-device FIS
0x8000  4          489  Vendor specific

