=== START OF INFORMATION SECTION ===
Model Family:     Seagate Barracuda 7200.7 and 7200.7 Plus
Device Model:     ST380011A
Serial Number:    --
Firmware Version: 8.01
User Capacity:    80 026 361 856 bytes [80,0 GB]
Sector Size:      512 bytes logical/physical
Device is:        In smartctl database [for details use: -P show]
ATA Version is:   ATA/ATAPI-6 T13/1410D revision 2
Local Time is:    Tue Jan  3 19:17:00 2017 +05
SMART support is: Available - device has SMART capability.
SMART support is: Enabled
AAM feature is:   Unavailable
APM feature is:   Unavailable
Rd look-ahead is: Enabled
Write cache is:   Enabled
ATA Security is:  Disabled, NOT FROZEN [SEC1]
Wt Cache Reorder: Unavailable

=== START OF READ SMART DATA SECTION ===
SMART overall-health self-assessment test result: PASSED

General SMART Values:
Offline data collection status:  (0x82)	Offline data collection activity
					was completed without error.
					Auto Offline Data Collection: Enabled.
Self-test execution status:      (   0)	The previous self-test routine completed
					without error or no self-test has ever 
					been run.
Total time to complete Offline 
data collection: 		(  430) seconds.
Offline data collection
capabilities: 			 (0x5b) SMART execute Offline immediate.
					Auto Offline data collection on/off support.
					Suspend Offline collection upon new
					command.
					Offline surface scan supported.
					Self-test supported.
					No Conveyance Self-test supported.
					Selective Self-test supported.
SMART capabilities:            (0x0003)	Saves SMART data before entering
					power-saving mode.
					Supports SMART auto save timer.
Error logging capability:        (0x01)	Error logging supported.
					General Purpose Logging supported.
Short self-test routine 
recommended polling time: 	 (   1) minutes.
Extended self-test routine
recommended polling time: 	 (  58) minutes.

SMART Attributes Data Structure revision number: 10
Vendor Specific SMART Attributes with Thresholds:
ID# ATTRIBUTE_NAME          FLAGS    VALUE WORST THRESH FAIL RAW_VALUE
  1 Raw_Read_Error_Rate     POSR--   063   049   006    -    228744196
  3 Spin_Up_Time            PO----   098   097   000    -    0
  4 Start_Stop_Count        -O--CK   097   097   020    -    3096
  5 Reallocated_Sector_Ct   PO--CK   100   100   036    -    0
  7 Seek_Error_Rate         POSR--   087   060   030    -    509633833
  9 Power_On_Hours          -O--CK   045   045   000    -    48592
 10 Spin_Retry_Count        PO--C-   100   100   097    -    0
 12 Power_Cycle_Count       -O--CK   090   090   020    -    10538
194 Temperature_Celsius     -O---K   038   053   000    -    38
195 Hardware_ECC_Recovered  -O-RC-   063   048   000    -    228744196
197 Current_Pending_Sector  -O--C-   100   100   000    -    0
198 Offline_Uncorrectable   ----C-   100   100   000    -    0
199 UDMA_CRC_Error_Count    -OSRCK   200   156   000    -    503
200 Multi_Zone_Error_Rate   ------   100   253   000    -    0
202 Data_Address_Mark_Errs  -O--CK   100   253   000    -    0
                            ||||||_ K auto-keep
                            |||||__ C event count
                            ||||___ R error rate
                            |||____ S speed/performance
                            ||_____ O updated online
                            |______ P prefailure warning

General Purpose Log Directory Version 1
SMART           Log Directory Version 1 [multi-sector log support]
Address    Access  R/W   Size  Description
0x00       GPL,SL  R/O      1  Log Directory
0x01       GPL,SL  R/O      1  Summary SMART error log
0x02       GPL,SL  R/O      5  Comprehensive SMART error log
0x03       GPL,SL  R/O      5  Ext. Comprehensive SMART error log
0x06       GPL,SL  R/O      1  SMART self-test log
0x07       GPL,SL  R/O      1  Extended self-test log
0x09       GPL,SL  R/W      1  Selective self-test log
0x20       GPL,SL  R/O      1  Streaming performance log [OBS-8]
0x21       GPL,SL  R/O      1  Write stream error log
0x22       GPL,SL  R/O      1  Read stream error log
0x23       GPL,SL  R/O      1  Delayed sector log [OBS-8]
0x80-0x9f  GPL,SL  R/W     16  Host vendor specific log
0xa0       GPL,SL  VS       1  Device vendor specific log
0xa1       GPL,SL  VS      20  Device vendor specific log
0xa2       GPL,SL  VS     101  Device vendor specific log
0xa8       GPL,SL  VS      20  Device vendor specific log
0xa9       GPL,SL  VS       1  Device vendor specific log
0xff       GPL     -    24064  Reserved

SMART Extended Comprehensive Error Log Version: 1 (5 sectors)
Device Error Count: 857 (device log contains only the most recent 20 errors)
	CR     = Command Register
	FEATR  = Features Register
	COUNT  = Count (was: Sector Count) Register
	LBA_48 = Upper bytes of LBA High/Mid/Low Registers ]  ATA-8
	LH     = LBA High (was: Cylinder High) Register    ]   LBA
	LM     = LBA Mid (was: Cylinder Low) Register      ] Register
	LL     = LBA Low (was: Sector Number) Register     ]
	DV     = Device (was: Device/Head) Register
	DC     = Device Control Register
	ER     = Error register
	ST     = Status register
Powered_Up_Time is measured from power on, and printed as
DDd+hh:mm:SS.sss where DD=days, hh=hours, mm=minutes,
SS=sec, and sss=millisec. It "wraps" after 49.710 days.

Error 857 [16] occurred at disk power-on lifetime: 10852 hours (452 days + 4 hours)
  When the command that caused the error occurred, the device was active or idle.

  After command completion occurred, registers were:
  ER -- ST COUNT  LBA_48  LH LM LL DV DC
  -- -- -- == -- == == == -- -- -- -- --
  84 -- 51 00 01 00 00 00 00 00 00 e0 00  Error: ICRC, ABRT 1 sectors at LBA = 0x00000000 = 0

  Commands leading to the command that caused the error were:
  CR FEATR COUNT  LBA_48  LH LM LL DV DC  Powered_Up_Time  Command/Feature_Name
  -- == -- == -- == == == -- -- -- -- --  ---------------  --------------------
  c8 00 00 00 01 00 00 00 00 00 00 e0 00     00:00:53.868  READ DMA
  c8 00 00 00 01 00 00 00 00 00 00 e0 00     00:00:53.862  READ DMA
  c8 00 00 00 01 00 00 00 00 00 00 e0 00     00:00:53.798  READ DMA
  b0 00 d8 01 00 00 00 4f 00 c2 00 e0 00     00:00:53.797  SMART ENABLE OPERATIONS
  ec 00 00 01 00 00 00 00 00 00 00 e0 00     00:00:45.656  IDENTIFY DEVICE

Error 856 [15] occurred at disk power-on lifetime: 10852 hours (452 days + 4 hours)
  When the command that caused the error occurred, the device was active or idle.

  After command completion occurred, registers were:
  ER -- ST COUNT  LBA_48  LH LM LL DV DC
  -- -- -- == -- == == == -- -- -- -- --
  84 -- 51 00 01 00 00 00 00 00 00 e0 00  Error: ICRC, ABRT 1 sectors at LBA = 0x00000000 = 0

  Commands leading to the command that caused the error were:
  CR FEATR COUNT  LBA_48  LH LM LL DV DC  Powered_Up_Time  Command/Feature_Name
  -- == -- == -- == == == -- -- -- -- --  ---------------  --------------------
  c8 00 00 00 01 00 00 00 00 00 00 e0 00     00:00:16.849  READ DMA
  c8 00 00 00 01 00 00 00 00 00 00 e0 00     00:00:16.841  READ DMA
  f5 00 00 01 00 00 00 00 00 00 00 e0 00     00:00:16.840  SECURITY FREEZE LOCK
  ec 00 d8 01 00 00 00 00 00 00 00 e0 00     00:00:05.429  IDENTIFY DEVICE
  b0 00 d8 01 00 00 00 4f 00 c2 00 e0 00     00:00:00.000  SMART ENABLE OPERATIONS

Error 855 [14] occurred at disk power-on lifetime: 10852 hours (452 days + 4 hours)
  When the command that caused the error occurred, the device was active or idle.

  After command completion occurred, registers were:
  ER -- ST COUNT  LBA_48  LH LM LL DV DC
  -- -- -- == -- == == == -- -- -- -- --
  84 -- 51 00 01 00 00 00 00 00 00 e0 00  Error: ICRC, ABRT 1 sectors at LBA = 0x00000000 = 0

  Commands leading to the command that caused the error were:
  CR FEATR COUNT  LBA_48  LH LM LL DV DC  Powered_Up_Time  Command/Feature_Name
  -- == -- == -- == == == -- -- -- -- --  ---------------  --------------------
  c8 00 00 00 01 00 00 00 00 00 3f e0 00     00:00:53.868  READ DMA
  c8 00 00 00 01 00 00 00 00 00 3f e0 00     00:00:53.862  READ DMA
  c8 00 00 00 01 00 00 00 00 00 00 e0 00     00:00:53.798  READ DMA
  c8 00 00 00 01 00 00 00 00 00 00 e0 00     00:00:53.797  READ DMA
  c8 00 00 00 01 00 00 00 00 00 00 e0 00     00:00:45.656  READ DMA

Error 854 [13] occurred at disk power-on lifetime: 10852 hours (452 days + 4 hours)
  When the command that caused the error occurred, the device was active or idle.

  After command completion occurred, registers were:
  ER -- ST COUNT  LBA_48  LH LM LL DV DC
  -- -- -- == -- == == == -- -- -- -- --
  84 -- 51 00 01 00 00 00 00 00 00 e0 00  Error: ICRC, ABRT 1 sectors at LBA = 0x00000000 = 0

  Commands leading to the command that caused the error were:
  CR FEATR COUNT  LBA_48  LH LM LL DV DC  Powered_Up_Time  Command/Feature_Name
  -- == -- == -- == == == -- -- -- -- --  ---------------  --------------------
  c8 00 00 00 01 00 00 00 00 00 3f e0 00     00:00:53.868  READ DMA
  c8 00 00 00 01 00 00 00 00 00 00 e0 00     00:00:53.862  READ DMA
  c8 00 00 00 01 00 00 00 00 00 00 e0 00     00:00:53.798  READ DMA
  c8 00 00 00 01 00 00 00 00 00 00 e0 00     00:00:53.797  READ DMA
  b0 00 d8 01 00 00 00 4f 00 c2 00 e0 00     00:00:45.656  SMART ENABLE OPERATIONS

Error 853 [12] occurred at disk power-on lifetime: 10852 hours (452 days + 4 hours)
  When the command that caused the error occurred, the device was active or idle.

  After command completion occurred, registers were:
  ER -- ST COUNT  LBA_48  LH LM LL DV DC
  -- -- -- == -- == == == -- -- -- -- --
  84 -- 51 00 01 00 00 00 00 00 00 e0 00  Error: ICRC, ABRT 1 sectors at LBA = 0x00000000 = 0

  Commands leading to the command that caused the error were:
  CR FEATR COUNT  LBA_48  LH LM LL DV DC  Powered_Up_Time  Command/Feature_Name
  -- == -- == -- == == == -- -- -- -- --  ---------------  --------------------
  c8 00 00 00 01 00 00 00 00 00 00 e0 00     00:00:53.868  READ DMA
  c8 00 00 00 01 00 00 00 00 00 00 e0 00     00:00:53.862  READ DMA
  c8 00 00 00 01 00 00 00 00 00 00 e0 00     00:00:53.798  READ DMA
  b0 00 d8 01 00 00 00 4f 00 c2 00 e0 00     00:00:53.797  SMART ENABLE OPERATIONS
  ec 00 00 01 00 00 00 00 00 00 00 e0 00     00:00:45.656  IDENTIFY DEVICE

Error 852 [11] occurred at disk power-on lifetime: 10852 hours (452 days + 4 hours)
  When the command that caused the error occurred, the device was active or idle.

  After command completion occurred, registers were:
  ER -- ST COUNT  LBA_48  LH LM LL DV DC
  -- -- -- == -- == == == -- -- -- -- --
  84 -- 51 00 01 00 00 00 00 00 00 e0 00  Error: ICRC, ABRT 1 sectors at LBA = 0x00000000 = 0

  Commands leading to the command that caused the error were:
  CR FEATR COUNT  LBA_48  LH LM LL DV DC  Powered_Up_Time  Command/Feature_Name
  -- == -- == -- == == == -- -- -- -- --  ---------------  --------------------
  c8 00 00 00 01 00 00 00 00 00 00 e0 00     00:00:16.849  READ DMA
  c8 00 00 00 01 00 00 00 00 00 00 e0 00     00:00:16.841  READ DMA
  f5 00 00 01 00 00 00 00 00 00 00 e0 00     00:00:16.840  SECURITY FREEZE LOCK
  ec 00 d8 01 00 00 00 00 00 00 00 e0 00     00:00:05.429  IDENTIFY DEVICE
  b0 00 d8 01 00 00 00 4f 00 c2 00 e0 00     00:00:00.000  SMART ENABLE OPERATIONS

Error 851 [10] occurred at disk power-on lifetime: 10852 hours (452 days + 4 hours)
  When the command that caused the error occurred, the device was active or idle.

  After command completion occurred, registers were:
  ER -- ST COUNT  LBA_48  LH LM LL DV DC
  -- -- -- == -- == == == -- -- -- -- --
  84 -- 51 00 01 00 00 00 00 00 00 e0 00  Error: ICRC, ABRT 1 sectors at LBA = 0x00000000 = 0

  Commands leading to the command that caused the error were:
  CR FEATR COUNT  LBA_48  LH LM LL DV DC  Powered_Up_Time  Command/Feature_Name
  -- == -- == -- == == == -- -- -- -- --  ---------------  --------------------
  c8 00 00 00 01 00 00 00 00 00 3f e0 00     00:00:53.868  READ DMA
  c8 00 00 00 01 00 00 00 00 00 3f e0 00     00:00:53.862  READ DMA
  c8 00 00 00 01 00 00 00 00 00 00 e0 00     00:00:53.798  READ DMA
  c8 00 00 00 01 00 00 00 00 00 00 e0 00     00:00:53.797  READ DMA
  c8 00 00 00 01 00 00 00 00 00 00 e0 00     00:00:45.656  READ DMA

Error 850 [9] occurred at disk power-on lifetime: 10852 hours (452 days + 4 hours)
  When the command that caused the error occurred, the device was active or idle.

  After command completion occurred, registers were:
  ER -- ST COUNT  LBA_48  LH LM LL DV DC
  -- -- -- == -- == == == -- -- -- -- --
  84 -- 51 00 01 00 00 00 00 00 00 e0 00  Error: ICRC, ABRT 1 sectors at LBA = 0x00000000 = 0

  Commands leading to the command that caused the error were:
  CR FEATR COUNT  LBA_48  LH LM LL DV DC  Powered_Up_Time  Command/Feature_Name
  -- == -- == -- == == == -- -- -- -- --  ---------------  --------------------
  c8 00 00 00 01 00 00 00 00 00 3f e0 00     00:00:53.868  READ DMA
  c8 00 00 00 01 00 00 00 00 00 00 e0 00     00:00:53.862  READ DMA
  c8 00 00 00 01 00 00 00 00 00 00 e0 00     00:00:53.798  READ DMA
  c8 00 00 00 01 00 00 00 00 00 00 e0 00     00:00:53.797  READ DMA
  b0 00 d8 01 00 00 00 4f 00 c2 00 e0 00     00:00:45.656  SMART ENABLE OPERATIONS

SMART Extended Self-test Log Version: 1 (1 sectors)
Num  Test_Description    Status                  Remaining  LifeTime(hours)  LBA_of_first_error
# 1  Extended offline    Completed without error       00%     48355         -

SMART Selective self-test log data structure revision number 1
 SPAN  MIN_LBA  MAX_LBA  CURRENT_TEST_STATUS
    1        0        0  Not_testing
    2        0        0  Not_testing
    3        0        0  Not_testing
    4        0        0  Not_testing
    5        0        0  Not_testing
Selective self-test flags (0x0):
  After scanning selected spans, do NOT read-scan remainder of disk.
If Selective self-test is pending on power-up, resume after 0 minute delay.

SCT Commands not supported

Device Statistics (GP/SMART Log 0x04) not supported

SATA Phy Event Counters (GP Log 0x11) not supported



