=== START OF INFORMATION SECTION ===
Model Family:     SAMSUNG SpinPoint M7
Device Model:     SAMSUNG HM250HI
Serial Number:    --
LU WWN Device Id: 5 0024e9 ...
Firmware Version: 2AC101C4
User Capacity:    250 059 350 016 bytes [250 GB]
Sector Size:      512 bytes logical/physical
Form Factor:      2.5 inches
Device is:        In smartctl database [for details use: -P show]
ATA Version is:   ATA8-ACS T13/1699-D revision 6
SATA Version is:  SATA 2.6, 3.0 Gb/s
Local Time is:    Wed Apr  6 21:51:55 2016 MSK
SMART support is: Available - device has SMART capability.
SMART support is: Enabled
AAM feature is:   Disabled
APM feature is:   Disabled
Rd look-ahead is: Enabled
Write cache is:   Enabled
ATA Security is:  Disabled, frozen [SEC2]
Wt Cache Reorder: Enabled

=== START OF READ SMART DATA SECTION ===
SMART overall-health self-assessment test result: PASSED

General SMART Values:
Offline data collection status:  (0x80)	Offline data collection activity
					was never started.
					Auto Offline Data Collection: Enabled.
Self-test execution status:      (   0)	The previous self-test routine completed
					without error or no self-test has ever 
					been run.
Total time to complete Offline 
data collection: 		( 4200) seconds.
Offline data collection
capabilities: 			 (0x5b) SMART execute Offline immediate.
					Auto Offline data collection on/off support.
					Suspend Offline collection upon new
					command.
					Offline surface scan supported.
					Self-test supported.
					No Conveyance Self-test supported.
					Selective Self-test supported.
SMART capabilities:            (0x0003)	Saves SMART data before entering
					power-saving mode.
					Supports SMART auto save timer.
Error logging capability:        (0x01)	Error logging supported.
					General Purpose Logging supported.
Short self-test routine 
recommended polling time: 	 (   2) minutes.
Extended self-test routine
recommended polling time: 	 (  70) minutes.
SCT capabilities: 	       (0x003f)	SCT Status supported.
					SCT Error Recovery Control supported.
					SCT Feature Control supported.
					SCT Data Table supported.

SMART Attributes Data Structure revision number: 16
Vendor Specific SMART Attributes with Thresholds:
ID# ATTRIBUTE_NAME          FLAGS    VALUE WORST THRESH FAIL RAW_VALUE
  1 Raw_Read_Error_Rate     POSR-K   100   100   051    -    409
  2 Throughput_Performance  -OS--K   056   056   000    -    3809
  3 Spin_Up_Time            PO---K   093   091   025    -    2340
  4 Start_Stop_Count        -O--CK   095   095   000    -    5306
  5 Reallocated_Sector_Ct   PO--CK   252   252   010    -    0
  7 Seek_Error_Rate         -OSR-K   252   252   051    -    0
  8 Seek_Time_Performance   --S--K   252   252   015    -    0
  9 Power_On_Hours          -O--CK   100   100   000    -    4873
 10 Spin_Retry_Count        -O--CK   252   252   051    -    0
 11 Calibration_Retry_Count -O--CK   084   084   000    -    16353
 12 Power_Cycle_Count       -O--CK   098   098   000    -    2951
191 G-Sense_Error_Rate      -O---K   097   097   000    -    32612
192 Power-Off_Retract_Count -O---K   252   252   000    -    0
194 Temperature_Celsius     -O----   058   043   000    -    42 (Min/Max -1/57)
195 Hardware_ECC_Recovered  -O-RCK   100   100   000    -    0
196 Reallocated_Event_Count -O--CK   252   252   000    -    0
197 Current_Pending_Sector  -O--CK   252   252   000    -    0
198 Offline_Uncorrectable   ----CK   252   252   000    -    0
199 UDMA_CRC_Error_Count    -OS-CK   100   100   000    -    10
200 Multi_Zone_Error_Rate   -O-R-K   001   001   000    -    43333
223 Load_Retry_Count        -O--CK   084   084   000    -    16353
225 Load_Cycle_Count        -O--CK   080   080   000    -    202950
                            ||||||_ K auto-keep
                            |||||__ C event count
                            ||||___ R error rate
                            |||____ S speed/performance
                            ||_____ O updated online
                            |______ P prefailure warning

General Purpose Log Directory Version 1
SMART           Log Directory Version 1 [multi-sector log support]
Address    Access  R/W   Size  Description
0x00       GPL,SL  R/O      1  Log Directory
0x01           SL  R/O      1  Summary SMART error log
0x02           SL  R/O      2  Comprehensive SMART error log
0x03       GPL     R/O      2  Ext. Comprehensive SMART error log
0x06           SL  R/O      1  SMART self-test log
0x07       GPL     R/O      2  Extended self-test log
0x09           SL  R/W      1  Selective self-test log
0x10       GPL     R/O      1  NCQ Command Error log
0x11       GPL     R/O      1  SATA Phy Event Counters
0x80-0x9f  GPL,SL  R/W     16  Host vendor specific log
0xbb       GPL     VS       4  Device vendor specific log
0xbc       GPL     VS       2  Device vendor specific log
0xe0       GPL,SL  R/W      1  SCT Command/Status
0xe1       GPL,SL  R/W      1  SCT Data Transfer

SMART Extended Comprehensive Error Log Version: 1 (2 sectors)
Device Error Count: 38 (device log contains only the most recent 8 errors)
	CR     = Command Register
	FEATR  = Features Register
	COUNT  = Count (was: Sector Count) Register
	LBA_48 = Upper bytes of LBA High/Mid/Low Registers ]  ATA-8
	LH     = LBA High (was: Cylinder High) Register    ]   LBA
	LM     = LBA Mid (was: Cylinder Low) Register      ] Register
	LL     = LBA Low (was: Sector Number) Register     ]
	DV     = Device (was: Device/Head) Register
	DC     = Device Control Register
	ER     = Error register
	ST     = Status register
Powered_Up_Time is measured from power on, and printed as
DDd+hh:mm:SS.sss where DD=days, hh=hours, mm=minutes,
SS=sec, and sss=millisec. It "wraps" after 49.710 days.

Error 38 [5] occurred at disk power-on lifetime: 4866 hours (202 days + 18 hours)
  When the command that caused the error occurred, the device was active or idle.

  After command completion occurred, registers were:
  ER -- ST COUNT  LBA_48  LH LM LL DV DC
  -- -- -- == -- == == == -- -- -- -- --
  10 -- 51 00 40 00 00 1d 1c 59 40 e0 00  Error: IDNF 64 sectors at LBA = 0x1d1c5940 = 488397120

  Commands leading to the command that caused the error were:
  CR FEATR COUNT  LBA_48  LH LM LL DV DC  Powered_Up_Time  Command/Feature_Name
  -- == -- == -- == == == -- -- -- -- --  ---------------  --------------------
  25 00 00 00 40 00 00 1d 1c 59 40 e0 00     00:00:00.566  READ DMA EXT
  25 00 00 00 40 00 00 1d 1c 59 00 e0 00     00:00:00.566  READ DMA EXT
  25 00 00 00 40 00 00 1d 1c 58 c0 e0 00     00:00:00.566  READ DMA EXT
  25 00 00 00 40 00 00 1d 1c 58 80 e0 00     00:00:00.566  READ DMA EXT
  25 00 00 00 40 00 00 1d 1c 58 40 e0 00     00:00:00.566  READ DMA EXT

Error 37 [4] occurred at disk power-on lifetime: 4864 hours (202 days + 16 hours)
  When the command that caused the error occurred, the device was active or idle.

  After command completion occurred, registers were:
  ER -- ST COUNT  LBA_48  LH LM LL DV DC
  -- -- -- == -- == == == -- -- -- -- --
  10 -- 51 00 40 00 00 1d 1c 59 40 e0 00  Error: IDNF 64 sectors at LBA = 0x1d1c5940 = 488397120

  Commands leading to the command that caused the error were:
  CR FEATR COUNT  LBA_48  LH LM LL DV DC  Powered_Up_Time  Command/Feature_Name
  -- == -- == -- == == == -- -- -- -- --  ---------------  --------------------
  25 00 00 00 40 00 00 1d 1c 59 40 e0 00     00:00:03.703  READ DMA EXT
  25 00 00 00 40 00 00 1d 1c 59 00 e0 00     00:00:03.703  READ DMA EXT
  25 00 00 00 40 00 00 1d 1c 58 c0 e0 00     00:00:03.703  READ DMA EXT
  25 00 00 00 40 00 00 1d 1c 58 80 e0 00     00:00:03.703  READ DMA EXT
  25 00 00 00 40 00 00 1d 1c 58 40 e0 00     00:00:03.703  READ DMA EXT

Error 36 [3] occurred at disk power-on lifetime: 4864 hours (202 days + 16 hours)
  When the command that caused the error occurred, the device was active or idle.

  After command completion occurred, registers were:
  ER -- ST COUNT  LBA_48  LH LM LL DV DC
  -- -- -- == -- == == == -- -- -- -- --
  10 -- 51 00 40 00 00 1d 1c 59 40 e0 00  Error: IDNF 64 sectors at LBA = 0x1d1c5940 = 488397120

  Commands leading to the command that caused the error were:
  CR FEATR COUNT  LBA_48  LH LM LL DV DC  Powered_Up_Time  Command/Feature_Name
  -- == -- == -- == == == -- -- -- -- --  ---------------  --------------------
  25 00 00 00 40 00 00 1d 1c 59 40 e0 00     00:00:02.842  READ DMA EXT
  25 00 00 00 40 00 00 1d 1c 59 00 e0 00     00:00:02.842  READ DMA EXT
  25 00 00 00 40 00 00 1d 1c 58 c0 e0 00     00:00:02.842  READ DMA EXT
  25 00 00 00 40 00 00 1d 1c 58 80 e0 00     00:00:02.842  READ DMA EXT
  25 00 00 00 40 00 00 1d 1c 58 40 e0 00     00:00:02.842  READ DMA EXT

Error 35 [2] occurred at disk power-on lifetime: 4863 hours (202 days + 15 hours)
  When the command that caused the error occurred, the device was active or idle.

  After command completion occurred, registers were:
  ER -- ST COUNT  LBA_48  LH LM LL DV DC
  -- -- -- == -- == == == -- -- -- -- --
  10 -- 51 00 40 00 00 1d 1c 59 40 e0 00  Error: IDNF 64 sectors at LBA = 0x1d1c5940 = 488397120

  Commands leading to the command that caused the error were:
  CR FEATR COUNT  LBA_48  LH LM LL DV DC  Powered_Up_Time  Command/Feature_Name
  -- == -- == -- == == == -- -- -- -- --  ---------------  --------------------
  25 00 00 00 40 00 00 1d 1c 59 40 e0 00     00:00:00.566  READ DMA EXT
  25 00 00 00 40 00 00 1d 1c 59 00 e0 00     00:00:00.566  READ DMA EXT
  25 00 00 00 40 00 00 1d 1c 58 c0 e0 00     00:00:00.566  READ DMA EXT
  25 00 00 00 40 00 00 1d 1c 58 80 e0 00     00:00:00.566  READ DMA EXT
  25 00 00 00 40 00 00 1d 1c 58 40 e0 00     00:00:00.566  READ DMA EXT

Error 34 [1] occurred at disk power-on lifetime: 4862 hours (202 days + 14 hours)
  When the command that caused the error occurred, the device was active or idle.

  After command completion occurred, registers were:
  ER -- ST COUNT  LBA_48  LH LM LL DV DC
  -- -- -- == -- == == == -- -- -- -- --
  10 -- 51 00 40 00 00 1d 1c 59 40 e0 00  Error: IDNF 64 sectors at LBA = 0x1d1c5940 = 488397120

  Commands leading to the command that caused the error were:
  CR FEATR COUNT  LBA_48  LH LM LL DV DC  Powered_Up_Time  Command/Feature_Name
  -- == -- == -- == == == -- -- -- -- --  ---------------  --------------------
  25 00 00 00 40 00 00 1d 1c 59 40 e0 00     00:00:00.573  READ DMA EXT
  25 00 00 00 40 00 00 1d 1c 59 00 e0 00     00:00:00.573  READ DMA EXT
  25 00 00 00 40 00 00 1d 1c 58 c0 e0 00     00:00:00.573  READ DMA EXT
  25 00 00 00 40 00 00 1d 1c 58 80 e0 00     00:00:00.573  READ DMA EXT
  25 00 00 00 40 00 00 1d 1c 58 40 e0 00     00:00:00.573  READ DMA EXT

Error 33 [0] occurred at disk power-on lifetime: 4859 hours (202 days + 11 hours)
  When the command that caused the error occurred, the device was active or idle.

  After command completion occurred, registers were:
  ER -- ST COUNT  LBA_48  LH LM LL DV DC
  -- -- -- == -- == == == -- -- -- -- --
  84 -- 01 48 d0 00 00 00 00 00 00 40 00  Error: ICRC, ABRT at LBA = 0x00000000 = 0

  Commands leading to the command that caused the error were:
  CR FEATR COUNT  LBA_48  LH LM LL DV DC  Powered_Up_Time  Command/Feature_Name
  -- == -- == -- == == == -- -- -- -- --  ---------------  --------------------
  61 00 00 00 08 00 00 1c a2 4d 60 40 00     00:00:01.331  WRITE FPDMA QUEUED
  61 00 00 00 f8 00 00 1c a2 4c 68 40 00     00:00:01.331  WRITE FPDMA QUEUED
  61 00 00 00 f8 00 00 1c a2 4b 70 40 00     00:00:01.331  WRITE FPDMA QUEUED
  61 00 10 00 f8 00 00 1c a2 4a 78 40 08     00:00:01.331  WRITE FPDMA QUEUED
  61 00 00 00 50 00 00 1c a2 4a 28 40 08     00:00:01.331  WRITE FPDMA QUEUED

Error 32 [7] occurred at disk power-on lifetime: 4859 hours (202 days + 11 hours)
  When the command that caused the error occurred, the device was active or idle.

  After command completion occurred, registers were:
  ER -- ST COUNT  LBA_48  LH LM LL DV DC
  -- -- -- == -- == == == -- -- -- -- --
  84 -- 01 48 d0 00 00 00 00 00 00 40 00  Error: ICRC, ABRT at LBA = 0x00000000 = 0

  Commands leading to the command that caused the error were:
  CR FEATR COUNT  LBA_48  LH LM LL DV DC  Powered_Up_Time  Command/Feature_Name
  -- == -- == -- == == == -- -- -- -- --  ---------------  --------------------
  61 59 59 00 60 00 00 1c a2 49 c8 40 00     00:00:01.331  WRITE FPDMA QUEUED
  61 59 59 00 f8 00 00 1c a2 48 d0 40 00     00:00:01.331  WRITE FPDMA QUEUED
  61 59 59 00 78 00 00 1c a2 48 58 40 00     00:00:01.331  WRITE FPDMA QUEUED
  ef 00 90 00 03 00 00 00 00 00 00 a0 08     00:00:01.331  SET FEATURES [Disable SATA feature]
  ef 00 10 00 02 00 00 00 00 00 00 a0 08     00:00:01.331  SET FEATURES [Enable SATA feature]

Error 31 [6] occurred at disk power-on lifetime: 4859 hours (202 days + 11 hours)
  When the command that caused the error occurred, the device was active or idle.

  After command completion occurred, registers were:
  ER -- ST COUNT  LBA_48  LH LM LL DV DC
  -- -- -- == -- == == == -- -- -- -- --
  84 -- 01 48 58 00 00 00 00 00 00 40 00  Error: ICRC, ABRT at LBA = 0x00000000 = 0

  Commands leading to the command that caused the error were:
  CR FEATR COUNT  LBA_48  LH LM LL DV DC  Powered_Up_Time  Command/Feature_Name
  -- == -- == -- == == == -- -- -- -- --  ---------------  --------------------
  61 00 03 00 78 00 00 1c a2 48 58 40 00     00:00:01.330  WRITE FPDMA QUEUED
  61 00 90 00 20 00 00 1c a2 48 38 40 00     00:00:01.330  WRITE FPDMA QUEUED
  61 00 90 00 20 00 00 1c a2 48 18 40 00     00:00:01.330  WRITE FPDMA QUEUED
  61 00 00 00 08 00 00 1c a2 48 10 40 00     00:00:01.330  WRITE FPDMA QUEUED
  61 00 00 00 08 00 00 1c a2 48 08 40 00     00:00:01.330  WRITE FPDMA QUEUED

SMART Extended Self-test Log Version: 1 (2 sectors)
Num  Test_Description    Status                  Remaining  LifeTime(hours)  LBA_of_first_error
# 1  Extended offline    Completed without error       00%      4441         -

SMART Selective self-test log data structure revision number 0
Note: revision number not 1 implies that no selective self-test has ever been run
 SPAN  MIN_LBA  MAX_LBA  CURRENT_TEST_STATUS
    1        0        0  Completed [00% left] (0-65535)
    2        0        0  Not_testing
    3        0        0  Not_testing
    4        0        0  Not_testing
    5        0        0  Not_testing
Selective self-test flags (0x0):
  After scanning selected spans, do NOT read-scan remainder of disk.
If Selective self-test is pending on power-up, resume after 0 minute delay.

SCT Status Version:                  2
SCT Version (vendor specific):       256 (0x0100)
SCT Support Level:                   1
Device State:                        Active (0)
Current Temperature:                    41 Celsius
Power Cycle Min/Max Temperature:     39/41 Celsius
Lifetime    Min/Max Temperature:      5/62 Celsius
Under/Over Temperature Limit Count:   0/0

SCT Temperature History Version:     2
Temperature Sampling Period:         5 minutes
Temperature Logging Interval:        5 minutes
Min/Max recommended Temperature:     -5/80 Celsius
Min/Max Temperature Limit:           -10/85 Celsius
Temperature History Size (Index):    128 (69)

SCT Error Recovery Control:
           Read: Disabled
          Write: Disabled

Device Statistics (GP Log 0x04) not supported

SATA Phy Event Counters (GP Log 0x11)
ID      Size     Value  Description
0x0001  4            0  Command failed due to ICRC error
0x0002  4            0  R_ERR response for data FIS
0x0003  4            0  R_ERR response for device-to-host data FIS
0x0004  4            0  R_ERR response for host-to-device data FIS
0x0005  4            0  R_ERR response for non-data FIS
0x0006  4            0  R_ERR response for device-to-host non-data FIS
0x0007  4            0  R_ERR response for host-to-device non-data FIS
0x0008  4            0  Device-to-host non-data FIS retries
0x0009  4            5  Transition from drive PhyRdy to drive PhyNRdy
0x000a  4            4  Device-to-host register FISes sent due to a COMRESET
0x000b  4            0  CRC errors within host-to-device FIS
0x000d  4            0  Non-CRC errors within host-to-device FIS
0x000f  4            0  R_ERR response for host-to-device data FIS, CRC
0x0010  4            0  R_ERR response for host-to-device data FIS, non-CRC
0x0012  4            0  R_ERR response for host-to-device non-data FIS, CRC
0x0013  4            0  R_ERR response for host-to-device non-data FIS, non-CRC
0x8e00  4            0  Vendor specific
0x8e01  4            0  Vendor specific
0x8e02  4            0  Vendor specific
0x8e03  4            0  Vendor specific
0x8e04  4            0  Vendor specific
0x8e05  4            0  Vendor specific
0x8e06  4            0  Vendor specific
0x8e07  4            0  Vendor specific
0x8e08  4            0  Vendor specific
0x8e09  4            0  Vendor specific
0x8e0a  4            0  Vendor specific
0x8e0b  4            0  Vendor specific
0x8e0c  4            0  Vendor specific
0x8e0d  4            0  Vendor specific
0x8e0e  4            0  Vendor specific
0x8e0f  4            0  Vendor specific
0x8e10  4            0  Vendor specific
0x8e11  4            0  Vendor specific

