smartctl 7.1 2019-12-30 r5022 [x86_64-linux-5.4.0-28-generic] (local build)
Copyright (C) 2002-19, Bruce Allen, Christian Franke, www.smartmontools.org

=== START OF INFORMATION SECTION ===
Model Family:     Western Digital Blue
Device Model:     WDC WD10EZEX-60ZF5A0
Serial Number:    --
LU WWN Device Id: 5 0014ee ...
Firmware Version: 80.00A80
User Capacity:    1,000,204,886,016 bytes [1.00 TB]
Sector Sizes:     512 bytes logical, 4096 bytes physical
Rotation Rate:    7200 rpm
Form Factor:      3.5 inches
Device is:        In smartctl database [for details use: -P show]
ATA Version is:   ACS-2 (minor revision not indicated)
SATA Version is:  SATA 3.0, 6.0 Gb/s (current: 3.0 Gb/s)
Local Time is:    Wed Apr 29 21:16:52 2020 EEST
SMART support is: Available - device has SMART capability.
SMART support is: Enabled
AAM feature is:   Unavailable
APM feature is:   Unavailable
Rd look-ahead is: Enabled
Write cache is:   Enabled
DSN feature is:   Unavailable
ATA Security is:  Disabled, frozen [SEC2]
Wt Cache Reorder: Enabled

=== START OF READ SMART DATA SECTION ===
SMART overall-health self-assessment test result: PASSED

General SMART Values:
Offline data collection status:  (0x82)	Offline data collection activity
					was completed without error.
					Auto Offline Data Collection: Enabled.
Self-test execution status:      (   0)	The previous self-test routine completed
					without error or no self-test has ever 
					been run.
Total time to complete Offline 
data collection: 		(10740) seconds.
Offline data collection
capabilities: 			 (0x5b) SMART execute Offline immediate.
					Auto Offline data collection on/off support.
					Suspend Offline collection upon new
					command.
					Offline surface scan supported.
					Self-test supported.
					No Conveyance Self-test supported.
					Selective Self-test supported.
SMART capabilities:            (0x0003)	Saves SMART data before entering
					power-saving mode.
					Supports SMART auto save timer.
Error logging capability:        (0x01)	Error logging supported.
					General Purpose Logging supported.
Short self-test routine 
recommended polling time: 	 (   2) minutes.
Extended self-test routine
recommended polling time: 	 ( 124) minutes.
SCT capabilities: 	       (0x30bd)	SCT Status supported.
					SCT Error Recovery Control supported.
					SCT Feature Control supported.
					SCT Data Table supported.

SMART Attributes Data Structure revision number: 16
Vendor Specific SMART Attributes with Thresholds:
ID# ATTRIBUTE_NAME          FLAGS    VALUE WORST THRESH FAIL RAW_VALUE
  1 Raw_Read_Error_Rate     POSR-K   200   200   051    -    1891
  3 Spin_Up_Time            POS--K   174   171   021    -    2291
  4 Start_Stop_Count        -O--CK   097   097   000    -    3460
  5 Reallocated_Sector_Ct   PO--CK   200   200   140    -    0
  7 Seek_Error_Rate         POSR-K   200   200   051    -    0
  9 Power_On_Hours          -O--CK   074   074   000    -    19165
 10 Spin_Retry_Count        PO--CK   100   100   051    -    0
 11 Calibration_Retry_Count -O--CK   100   100   000    -    0
 12 Power_Cycle_Count       -O--CK   097   097   000    -    3432
184 End-to-End_Error        PO--CK   100   100   097    -    0
187 Reported_Uncorrect      -O--CK   100   001   000    -    1889
188 Command_Timeout         -O--CK   100   001   000    -    1793
190 Airflow_Temperature_Cel -O---K   068   057   040    -    32 (Min/Max 31/34)
192 Power-Off_Retract_Count -O--CK   200   200   000    -    118
193 Load_Cycle_Count        -O--CK   199   199   000    -    3341
196 Reallocated_Event_Count -O--CK   200   200   000    -    0
197 Current_Pending_Sector  -O--CK   200   200   000    -    2
198 Offline_Uncorrectable   ----CK   200   200   000    -    2
199 UDMA_CRC_Error_Count    -O--CK   200   200   000    -    0
200 Multi_Zone_Error_Rate   ---R--   200   200   000    -    2
                            ||||||_ K auto-keep
                            |||||__ C event count
                            ||||___ R error rate
                            |||____ S speed/performance
                            ||_____ O updated online
                            |______ P prefailure warning

General Purpose Log Directory Version 1
SMART           Log Directory Version 1 [multi-sector log support]
Address    Access  R/W   Size  Description
0x00       GPL,SL  R/O      1  Log Directory
0x01           SL  R/O      1  Summary SMART error log
0x02           SL  R/O      5  Comprehensive SMART error log
0x03       GPL     R/O      6  Ext. Comprehensive SMART error log
0x06           SL  R/O      1  SMART self-test log
0x07       GPL     R/O      1  Extended self-test log
0x09           SL  R/W      1  Selective self-test log
0x0d       GPL,SL  R/O      8  LPS Mis-alignment log
0x10       GPL     R/O      1  NCQ Command Error log
0x11       GPL     R/O      1  SATA Phy Event Counters log
0x80-0x9f  GPL,SL  R/W     16  Host vendor specific log
0xa0-0xa7  GPL,SL  VS      16  Device vendor specific log
0xa8-0xb5  GPL,SL  VS       1  Device vendor specific log
0xb6       GPL     VS    2396  Device vendor specific log
0xb7       GPL,SL  VS       1  Device vendor specific log
0xbd       GPL,SL  VS       1  Device vendor specific log
0xc0       GPL,SL  VS       1  Device vendor specific log
0xc1       GPL     VS      93  Device vendor specific log
0xe0       GPL,SL  R/W      1  SCT Command/Status
0xe1       GPL,SL  R/W      1  SCT Data Transfer

SMART Extended Comprehensive Error Log Version: 1 (6 sectors)
Device Error Count: 1889 (device log contains only the most recent 24 errors)
	CR     = Command Register
	FEATR  = Features Register
	COUNT  = Count (was: Sector Count) Register
	LBA_48 = Upper bytes of LBA High/Mid/Low Registers ]  ATA-8
	LH     = LBA High (was: Cylinder High) Register    ]   LBA
	LM     = LBA Mid (was: Cylinder Low) Register      ] Register
	LL     = LBA Low (was: Sector Number) Register     ]
	DV     = Device (was: Device/Head) Register
	DC     = Device Control Register
	ER     = Error register
	ST     = Status register
Powered_Up_Time is measured from power on, and printed as
DDd+hh:mm:SS.sss where DD=days, hh=hours, mm=minutes,
SS=sec, and sss=millisec. It "wraps" after 49.710 days.

Error 1889 [16] occurred at disk power-on lifetime: 9493 hours (395 days + 13 hours)
  When the command that caused the error occurred, the device was active or idle.

  After command completion occurred, registers were:
  ER -- ST COUNT  LBA_48  LH LM LL DV DC
  -- -- -- == -- == == == -- -- -- -- --
  40 -- 51 00 00 00 00 01 98 c2 30 40 00  Error: UNC at LBA = 0x0198c230 = 26788400

  Commands leading to the command that caused the error were:
  CR FEATR COUNT  LBA_48  LH LM LL DV DC  Powered_Up_Time  Command/Feature_Name
  -- == -- == -- == == == -- -- -- -- --  ---------------  --------------------
  60 01 00 00 b0 00 00 01 98 c1 c0 40 00     01:32:55.232  READ FPDMA QUEUED
  60 00 08 00 a8 00 00 04 9a 66 d0 40 00     01:32:55.214  READ FPDMA QUEUED
  ea 00 00 00 00 00 00 00 00 00 00 e0 00     01:32:55.080  FLUSH CACHE EXT
  2f 00 00 00 01 00 00 00 00 00 10 e0 00     01:32:55.079  READ LOG EXT
  60 00 20 00 98 00 00 01 98 c2 20 40 00     01:32:53.078  READ FPDMA QUEUED

Error 1888 [15] occurred at disk power-on lifetime: 9493 hours (395 days + 13 hours)
  When the command that caused the error occurred, the device was active or idle.

  After command completion occurred, registers were:
  ER -- ST COUNT  LBA_48  LH LM LL DV DC
  -- -- -- == -- == == == -- -- -- -- --
  40 -- 51 00 00 00 00 01 98 c2 30 40 00  Error: UNC at LBA = 0x0198c230 = 26788400

  Commands leading to the command that caused the error were:
  CR FEATR COUNT  LBA_48  LH LM LL DV DC  Powered_Up_Time  Command/Feature_Name
  -- == -- == -- == == == -- -- -- -- --  ---------------  --------------------
  60 00 20 00 98 00 00 01 98 c2 20 40 00     01:32:53.078  READ FPDMA QUEUED
  61 00 20 00 90 00 00 20 f0 a6 00 40 00     01:32:53.078  WRITE FPDMA QUEUED
  60 00 20 00 88 00 00 01 98 c2 00 40 00     01:32:53.078  READ FPDMA QUEUED
  61 00 20 00 80 00 00 20 f0 a5 e0 40 00     01:32:53.078  WRITE FPDMA QUEUED
  60 00 20 00 78 00 00 01 98 c1 e0 40 00     01:32:53.078  READ FPDMA QUEUED

Error 1887 [14] occurred at disk power-on lifetime: 9492 hours (395 days + 12 hours)
  When the command that caused the error occurred, the device was active or idle.

  After command completion occurred, registers were:
  ER -- ST COUNT  LBA_48  LH LM LL DV DC
  -- -- -- == -- == == == -- -- -- -- --
  40 -- 51 00 00 00 00 01 98 c2 30 40 00  Error: UNC at LBA = 0x0198c230 = 26788400

  Commands leading to the command that caused the error were:
  CR FEATR COUNT  LBA_48  LH LM LL DV DC  Powered_Up_Time  Command/Feature_Name
  -- == -- == -- == == == -- -- -- -- --  ---------------  --------------------
  60 01 00 00 40 00 00 01 98 c1 c0 40 00     01:25:25.349  READ FPDMA QUEUED
  61 00 18 00 38 00 00 1b 19 91 80 40 00     01:25:25.349  WRITE FPDMA QUEUED
  60 00 08 00 30 00 00 02 14 66 70 40 00     01:25:25.341  READ FPDMA QUEUED
  2f 00 00 00 01 00 00 00 00 00 10 e0 00     01:25:25.341  READ LOG EXT
  60 00 20 00 28 00 00 01 98 c2 20 40 00     01:25:23.348  READ FPDMA QUEUED

Error 1886 [13] occurred at disk power-on lifetime: 9492 hours (395 days + 12 hours)
  When the command that caused the error occurred, the device was active or idle.

  After command completion occurred, registers were:
  ER -- ST COUNT  LBA_48  LH LM LL DV DC
  -- -- -- == -- == == == -- -- -- -- --
  40 -- 51 00 00 00 00 01 98 c2 30 40 00  Error: UNC at LBA = 0x0198c230 = 26788400

  Commands leading to the command that caused the error were:
  CR FEATR COUNT  LBA_48  LH LM LL DV DC  Powered_Up_Time  Command/Feature_Name
  -- == -- == -- == == == -- -- -- -- --  ---------------  --------------------
  60 00 20 00 28 00 00 01 98 c2 20 40 00     01:25:23.348  READ FPDMA QUEUED
  61 00 20 00 20 00 00 00 83 83 00 40 00     01:25:23.348  WRITE FPDMA QUEUED
  60 00 20 00 18 00 00 01 98 c2 00 40 00     01:25:23.348  READ FPDMA QUEUED
  61 00 20 00 10 00 00 00 83 82 e0 40 00     01:25:23.348  WRITE FPDMA QUEUED
  60 00 20 00 08 00 00 01 98 c1 e0 40 00     01:25:23.347  READ FPDMA QUEUED

Error 1885 [12] occurred at disk power-on lifetime: 9492 hours (395 days + 12 hours)
  When the command that caused the error occurred, the device was active or idle.

  After command completion occurred, registers were:
  ER -- ST COUNT  LBA_48  LH LM LL DV DC
  -- -- -- == -- == == == -- -- -- -- --
  40 -- 51 00 00 00 00 01 98 c2 30 40 00  Error: WP at LBA = 0x0198c230 = 26788400

  Commands leading to the command that caused the error were:
  CR FEATR COUNT  LBA_48  LH LM LL DV DC  Powered_Up_Time  Command/Feature_Name
  -- == -- == -- == == == -- -- -- -- --  ---------------  --------------------
  61 01 00 00 90 00 00 20 68 7b f8 40 00     01:07:14.346  WRITE FPDMA QUEUED
  61 01 00 00 88 00 00 20 68 7a f8 40 00     01:07:14.346  WRITE FPDMA QUEUED
  61 01 00 00 80 00 00 20 68 79 f8 40 00     01:07:14.345  WRITE FPDMA QUEUED
  61 01 00 00 78 00 00 20 68 78 f8 40 00     01:07:14.345  WRITE FPDMA QUEUED
  61 01 00 00 70 00 00 20 68 77 f8 40 00     01:07:14.344  WRITE FPDMA QUEUED

Error 1884 [11] occurred at disk power-on lifetime: 9492 hours (395 days + 12 hours)
  When the command that caused the error occurred, the device was active or idle.

  After command completion occurred, registers were:
  ER -- ST COUNT  LBA_48  LH LM LL DV DC
  -- -- -- == -- == == == -- -- -- -- --
  40 -- 51 00 00 00 00 01 98 c2 30 40 00  Error: UNC at LBA = 0x0198c230 = 26788400

  Commands leading to the command that caused the error were:
  CR FEATR COUNT  LBA_48  LH LM LL DV DC  Powered_Up_Time  Command/Feature_Name
  -- == -- == -- == == == -- -- -- -- --  ---------------  --------------------
  60 00 20 00 88 00 00 01 98 c2 20 40 00     01:07:11.919  READ FPDMA QUEUED
  61 00 20 00 80 00 00 20 0c ca 80 40 00     01:07:11.919  WRITE FPDMA QUEUED
  60 00 20 00 78 00 00 01 98 c2 00 40 00     01:07:11.919  READ FPDMA QUEUED
  61 00 20 00 70 00 00 20 0c ca 60 40 00     01:07:11.918  WRITE FPDMA QUEUED
  60 00 20 00 68 00 00 01 98 c1 e0 40 00     01:07:11.918  READ FPDMA QUEUED

Error 1883 [10] occurred at disk power-on lifetime: 9491 hours (395 days + 11 hours)
  When the command that caused the error occurred, the device was active or idle.

  After command completion occurred, registers were:
  ER -- ST COUNT  LBA_48  LH LM LL DV DC
  -- -- -- == -- == == == -- -- -- -- --
  40 -- 51 00 00 00 00 01 98 c2 30 40 00  Error: UNC at LBA = 0x0198c230 = 26788400

  Commands leading to the command that caused the error were:
  CR FEATR COUNT  LBA_48  LH LM LL DV DC  Powered_Up_Time  Command/Feature_Name
  -- == -- == -- == == == -- -- -- -- --  ---------------  --------------------
  60 00 08 00 98 00 00 01 98 c2 30 40 00     00:02:39.512  READ FPDMA QUEUED
  60 00 08 00 90 00 00 23 25 73 60 40 00     00:02:39.504  READ FPDMA QUEUED
  60 00 08 00 88 00 00 23 20 4c a8 40 00     00:02:39.493  READ FPDMA QUEUED
  61 00 10 00 80 00 00 04 62 eb b8 40 00     00:02:39.493  WRITE FPDMA QUEUED
  2f 00 00 00 01 00 00 00 00 00 10 e0 00     00:02:39.492  READ LOG EXT

Error 1882 [9] occurred at disk power-on lifetime: 9491 hours (395 days + 11 hours)
  When the command that caused the error occurred, the device was active or idle.

  After command completion occurred, registers were:
  ER -- ST COUNT  LBA_48  LH LM LL DV DC
  -- -- -- == -- == == == -- -- -- -- --
  40 -- 51 00 00 00 00 01 98 c2 30 40 00  Error: UNC at LBA = 0x0198c230 = 26788400

  Commands leading to the command that caused the error were:
  CR FEATR COUNT  LBA_48  LH LM LL DV DC  Powered_Up_Time  Command/Feature_Name
  -- == -- == -- == == == -- -- -- -- --  ---------------  --------------------
  60 00 08 00 78 00 00 01 98 c2 30 40 00     00:02:37.483  READ FPDMA QUEUED
  60 00 08 00 70 00 00 23 28 26 08 40 00     00:02:37.472  READ FPDMA QUEUED
  60 00 08 00 68 00 00 00 bc 99 68 40 00     00:02:37.462  READ FPDMA QUEUED
  61 00 20 00 60 00 00 04 62 eb 28 40 00     00:02:37.462  WRITE FPDMA QUEUED
  2f 00 00 00 01 00 00 00 00 00 10 e0 00     00:02:37.461  READ LOG EXT

SMART Extended Self-test Log Version: 1 (1 sectors)
Num  Test_Description    Status                  Remaining  LifeTime(hours)  LBA_of_first_error
# 1  Short offline       Completed without error       00%     12511         -
# 2  Short offline       Interrupted (host reset)      70%      7464         -
# 3  Short offline       Completed without error       00%      7409         -
# 4  Short offline       Completed without error       00%      7315         -
# 5  Short offline       Completed without error       00%      7206         -
# 6  Short offline       Completed without error       00%      7132         -
# 7  Short offline       Completed without error       00%      7040         -
# 8  Short offline       Completed without error       00%      6957         -
# 9  Short offline       Completed without error       00%      6911         -
#10  Short offline       Completed without error       00%      6762         -
#11  Short offline       Completed without error       00%      6661         -
#12  Short offline       Completed without error       00%      6598         -
#13  Short offline       Completed without error       00%      6551         -
#14  Short offline       Completed without error       00%      6504         -
#15  Extended offline    Interrupted (host reset)      90%         1         -

SMART Selective self-test log data structure revision number 1
 SPAN  MIN_LBA  MAX_LBA  CURRENT_TEST_STATUS
    1        0        0  Not_testing
    2        0        0  Not_testing
    3        0        0  Not_testing
    4        0        0  Not_testing
    5        0        0  Not_testing
Selective self-test flags (0x0):
  After scanning selected spans, do NOT read-scan remainder of disk.
If Selective self-test is pending on power-up, resume after 0 minute delay.

SCT Status Version:                  3
SCT Version (vendor specific):       258 (0x0102)
Device State:                        Active (0)
Current Temperature:                    32 Celsius
Power Cycle Min/Max Temperature:     31/34 Celsius
Lifetime    Min/Max Temperature:     31/43 Celsius
Under/Over Temperature Limit Count:   0/0
Vendor specific:
01 00 00 00 00 00 00 00 00 00 00 00 00 00 00 00
00 00 00 00 00 00 00 00 00 00 00 00 00 00 00 00

SCT Temperature History Version:     2
Temperature Sampling Period:         1 minute
Temperature Logging Interval:        1 minute
Min/Max recommended Temperature:      0/60 Celsius
Min/Max Temperature Limit:           -41/85 Celsius
Temperature History Size (Index):    128 (109)

SCT Error Recovery Control:
           Read:     85 (8.5 seconds)
          Write:     85 (8.5 seconds)

Device Statistics (GP/SMART Log 0x04) not supported

Pending Defects log (GP Log 0x0c) not supported

SATA Phy Event Counters (GP Log 0x11)
ID      Size     Value  Description
0x0001  2            0  Command failed due to ICRC error
0x0002  2            0  R_ERR response for data FIS
0x0003  2            0  R_ERR response for device-to-host data FIS
0x0004  2            0  R_ERR response for host-to-device data FIS
0x0005  2            0  R_ERR response for non-data FIS
0x0006  2            0  R_ERR response for device-to-host non-data FIS
0x0007  2            0  R_ERR response for host-to-device non-data FIS
0x0008  2            0  Device-to-host non-data FIS retries
0x0009  2           21  Transition from drive PhyRdy to drive PhyNRdy
0x000a  2           12  Device-to-host register FISes sent due to a COMRESET
0x000b  2            0  CRC errors within host-to-device FIS
0x000f  2            0  R_ERR response for host-to-device data FIS, CRC
0x0012  2            0  R_ERR response for host-to-device non-data FIS, CRC
0x8000  4        21167  Vendor specific

