=== START OF INFORMATION SECTION ===
Model Family:     Seagate Momentus 5400.7 (AF)
Device Model:     ST9750423AS
Serial Number:    --
LU WWN Device Id: 5 000c50 ...
Firmware Version: 0001SDM1
User Capacity:    750 156 374 016 bytes [750 GB]
Sector Sizes:     512 bytes logical, 4096 bytes physical
Rotation Rate:    5400 rpm
Device is:        In smartctl database [for details use: -P show]
ATA Version is:   ATA8-ACS T13/1699-D revision 4
SATA Version is:  SATA 2.6, 3.0 Gb/s
Local Time is:    Sat Apr 29 11:22:41 2017 +06
SMART support is: Available - device has SMART capability.
SMART support is: Enabled
AAM feature is:   Unavailable
APM level is:     128 (minimum power consumption without standby)
Rd look-ahead is: Enabled
Write cache is:   Enabled
ATA Security is:  Disabled, frozen [SEC2]
Wt Cache Reorder: Enabled

=== START OF READ SMART DATA SECTION ===
SMART overall-health self-assessment test result: PASSED

General SMART Values:
Offline data collection status:  (0x00)	Offline data collection activity
					was never started.
					Auto Offline Data Collection: Disabled.
Self-test execution status:      (   0)	The previous self-test routine completed
					without error or no self-test has ever 
					been run.
Total time to complete Offline 
data collection: 		(    0) seconds.
Offline data collection
capabilities: 			 (0x73) SMART execute Offline immediate.
					Auto Offline data collection on/off support.
					Suspend Offline collection upon new
					command.
					No Offline surface scan supported.
					Self-test supported.
					Conveyance Self-test supported.
					Selective Self-test supported.
SMART capabilities:            (0x0003)	Saves SMART data before entering
					power-saving mode.
					Supports SMART auto save timer.
Error logging capability:        (0x01)	Error logging supported.
					General Purpose Logging supported.
Short self-test routine 
recommended polling time: 	 (   2) minutes.
Extended self-test routine
recommended polling time: 	 ( 183) minutes.
Conveyance self-test routine
recommended polling time: 	 (   3) minutes.
SCT capabilities: 	       (0x303f)	SCT Status supported.
					SCT Error Recovery Control supported.
					SCT Feature Control supported.
					SCT Data Table supported.

SMART Attributes Data Structure revision number: 10
Vendor Specific SMART Attributes with Thresholds:
ID# ATTRIBUTE_NAME          FLAGS    VALUE WORST THRESH FAIL RAW_VALUE
  1 Raw_Read_Error_Rate     POSR--   117   099   006    -    155350064
  3 Spin_Up_Time            PO----   098   098   085    -    0
  4 Start_Stop_Count        -O--CK   096   096   020    -    4688
  5 Reallocated_Sector_Ct   PO--CK   100   100   036    -    0
  7 Seek_Error_Rate         POSR--   083   060   030    -    229064145
  9 Power_On_Hours          -O--CK   087   087   000    -    11818
 10 Spin_Retry_Count        PO--C-   100   100   097    -    0
 12 Power_Cycle_Count       -O--CK   098   098   020    -    2326
184 End-to-End_Error        -O--CK   100   100   099    -    0
187 Reported_Uncorrect      -O--CK   091   091   000    -    9
188 Command_Timeout         -O--CK   100   099   000    -    22
189 High_Fly_Writes         -O-RCK   100   100   000    -    0
190 Airflow_Temperature_Cel -O---K   068   052   045    -    32 (Min/Max 18/35)
191 G-Sense_Error_Rate      -O--CK   100   100   000    -    15
192 Power-Off_Retract_Count -O--CK   100   100   000    -    370
193 Load_Cycle_Count        -O--CK   023   023   000    -    155201
194 Temperature_Celsius     -O---K   032   048   000    -    32 (0 1 0 0 0)
195 Hardware_ECC_Recovered  -O-RC-   117   099   000    -    155350064
197 Current_Pending_Sector  -O--C-   100   100   000    -    0
198 Offline_Uncorrectable   ----C-   100   100   000    -    0
199 UDMA_CRC_Error_Count    -OSRCK   200   200   000    -    0
240 Head_Flying_Hours       ------   100   253   000    -    11099 (222 14 0)
241 Total_LBAs_Written      ------   100   253   000    -    141381687
242 Total_LBAs_Read         ------   100   253   000    -    3711765190
254 Free_Fall_Sensor        -O--CK   100   100   000    -    0
                            ||||||_ K auto-keep
                            |||||__ C event count
                            ||||___ R error rate
                            |||____ S speed/performance
                            ||_____ O updated online
                            |______ P prefailure warning

General Purpose Log Directory Version 1
SMART           Log Directory Version 1 [multi-sector log support]
Address    Access  R/W   Size  Description
0x00       GPL,SL  R/O      1  Log Directory
0x01       GPL,SL  R/O      1  Summary SMART error log
0x02       GPL,SL  R/O      5  Comprehensive SMART error log
0x03       GPL     R/O      5  Ext. Comprehensive SMART error log
0x06       GPL,SL  R/O      1  SMART self-test log
0x07       GPL     R/O      1  Extended self-test log
0x09       GPL,SL  R/W      1  Selective self-test log
0x10       GPL     R/O      1  SATA NCQ Queued Error log
0x11       GPL     R/O      1  SATA Phy Event Counters log
0x21       GPL     R/O      1  Write stream error log
0x22       GPL     R/O      1  Read stream error log
0x80-0x9f  GPL,SL  R/W     16  Host vendor specific log
0xa1       GPL,SL  VS      20  Device vendor specific log
0xa2       GPL     VS    2248  Device vendor specific log
0xa8       GPL,SL  VS      65  Device vendor specific log
0xa9       GPL,SL  VS       1  Device vendor specific log
0xab       GPL     VS       1  Device vendor specific log
0xae       GPL     VS       1  Device vendor specific log
0xb0       GPL     VS    2864  Device vendor specific log
0xbd       GPL     VS     252  Device vendor specific log
0xbe-0xbf  GPL     VS   65535  Device vendor specific log
0xe0       GPL,SL  R/W      1  SCT Command/Status
0xe1       GPL,SL  R/W      1  SCT Data Transfer

SMART Extended Comprehensive Error Log Version: 1 (5 sectors)
Device Error Count: 9
	CR     = Command Register
	FEATR  = Features Register
	COUNT  = Count (was: Sector Count) Register
	LBA_48 = Upper bytes of LBA High/Mid/Low Registers ]  ATA-8
	LH     = LBA High (was: Cylinder High) Register    ]   LBA
	LM     = LBA Mid (was: Cylinder Low) Register      ] Register
	LL     = LBA Low (was: Sector Number) Register     ]
	DV     = Device (was: Device/Head) Register
	DC     = Device Control Register
	ER     = Error register
	ST     = Status register
Powered_Up_Time is measured from power on, and printed as
DDd+hh:mm:SS.sss where DD=days, hh=hours, mm=minutes,
SS=sec, and sss=millisec. It "wraps" after 49.710 days.

Error 9 [8] occurred at disk power-on lifetime: 1836 hours (76 days + 12 hours)
  When the command that caused the error occurred, the device was active or idle.

  After command completion occurred, registers were:
  ER -- ST COUNT  LBA_48  LH LM LL DV DC
  -- -- -- == -- == == == -- -- -- -- --
  40 -- 51 00 00 00 00 07 8c 86 70 00 00  Error: UNC at LBA = 0x078c8670 = 126649968

  Commands leading to the command that caused the error were:
  CR FEATR COUNT  LBA_48  LH LM LL DV DC  Powered_Up_Time  Command/Feature_Name
  -- == -- == -- == == == -- -- -- -- --  ---------------  --------------------
  60 00 00 00 c0 00 00 07 8c 86 00 40 00     00:39:05.773  READ FPDMA QUEUED
  2f 00 00 00 01 00 00 00 00 00 10 40 00     00:39:05.773  READ LOG EXT
  60 00 00 00 c0 00 00 07 8c 86 00 40 00     00:39:03.078  READ FPDMA QUEUED
  61 00 00 00 08 00 00 03 7f f5 40 40 00     00:39:03.078  WRITE FPDMA QUEUED
  ec 00 00 00 00 00 00 00 00 00 00 40 00     00:39:03.077  IDENTIFY DEVICE

Error 8 [7] occurred at disk power-on lifetime: 1836 hours (76 days + 12 hours)
  When the command that caused the error occurred, the device was active or idle.

  After command completion occurred, registers were:
  ER -- ST COUNT  LBA_48  LH LM LL DV DC
  -- -- -- == -- == == == -- -- -- -- --
  40 -- 51 00 00 00 00 07 8c 86 70 00 00  Error: UNC at LBA = 0x078c8670 = 126649968

  Commands leading to the command that caused the error were:
  CR FEATR COUNT  LBA_48  LH LM LL DV DC  Powered_Up_Time  Command/Feature_Name
  -- == -- == -- == == == -- -- -- -- --  ---------------  --------------------
  60 00 00 00 c0 00 00 07 8c 86 00 40 00     00:39:03.078  READ FPDMA QUEUED
  61 00 00 00 08 00 00 03 7f f5 40 40 00     00:39:03.078  WRITE FPDMA QUEUED
  ec 00 00 00 00 00 00 00 00 00 00 40 00     00:39:03.077  IDENTIFY DEVICE
  00 00 00 00 00 00 00 00 00 00 00 00 ff     00:39:02.605  NOP [Abort queued commands]
  60 00 00 00 c0 00 00 07 8c 86 00 40 00     00:38:51.283  READ FPDMA QUEUED

Error 7 [6] occurred at disk power-on lifetime: 1836 hours (76 days + 12 hours)
  When the command that caused the error occurred, the device was active or idle.

  After command completion occurred, registers were:
  ER -- ST COUNT  LBA_48  LH LM LL DV DC
  -- -- -- == -- == == == -- -- -- -- --
  40 -- 51 00 00 00 00 07 8c 86 70 00 00  Error: UNC at LBA = 0x078c8670 = 126649968

  Commands leading to the command that caused the error were:
  CR FEATR COUNT  LBA_48  LH LM LL DV DC  Powered_Up_Time  Command/Feature_Name
  -- == -- == -- == == == -- -- -- -- --  ---------------  --------------------
  60 00 00 00 c0 00 00 07 8c 86 00 40 00     00:38:51.283  READ FPDMA QUEUED
  60 00 00 01 00 00 00 07 8c 85 00 40 00     00:38:51.282  READ FPDMA QUEUED
  61 00 00 00 c0 00 00 06 ba af e0 40 00     00:38:51.281  WRITE FPDMA QUEUED
  60 00 00 00 c0 00 00 07 87 ba c0 40 00     00:38:51.267  READ FPDMA QUEUED
  61 00 00 00 60 00 00 06 ba af 80 40 00     00:38:51.266  WRITE FPDMA QUEUED

Error 6 [5] occurred at disk power-on lifetime: 1808 hours (75 days + 8 hours)
  When the command that caused the error occurred, the device was active or idle.

  After command completion occurred, registers were:
  ER -- ST COUNT  LBA_48  LH LM LL DV DC
  -- -- -- == -- == == == -- -- -- -- --
  40 -- 51 00 00 00 00 07 8c 86 70 00 00  Error: UNC at LBA = 0x078c8670 = 126649968

  Commands leading to the command that caused the error were:
  CR FEATR COUNT  LBA_48  LH LM LL DV DC  Powered_Up_Time  Command/Feature_Name
  -- == -- == -- == == == -- -- -- -- --  ---------------  --------------------
  60 00 00 00 c0 00 00 07 8c 86 00 40 00     01:09:02.074  READ FPDMA QUEUED
  60 00 00 01 00 00 00 07 8c 85 00 40 00     01:09:02.074  READ FPDMA QUEUED
  61 00 00 00 c0 00 00 03 8b 27 18 40 00     01:09:02.073  WRITE FPDMA QUEUED
  60 00 00 00 c0 00 00 07 87 ba c0 40 00     01:09:02.058  READ FPDMA QUEUED
  61 00 00 00 60 00 00 03 8b 26 b8 40 00     01:09:02.057  WRITE FPDMA QUEUED

Error 5 [4] occurred at disk power-on lifetime: 1807 hours (75 days + 7 hours)
  When the command that caused the error occurred, the device was active or idle.

  After command completion occurred, registers were:
  ER -- ST COUNT  LBA_48  LH LM LL DV DC
  -- -- -- == -- == == == -- -- -- -- --
  40 -- 51 00 00 00 00 07 8c 86 70 00 00  Error: UNC at LBA = 0x078c8670 = 126649968

  Commands leading to the command that caused the error were:
  CR FEATR COUNT  LBA_48  LH LM LL DV DC  Powered_Up_Time  Command/Feature_Name
  -- == -- == -- == == == -- -- -- -- --  ---------------  --------------------
  60 00 00 00 80 00 00 07 8b e9 98 40 00     00:32:26.744  READ FPDMA QUEUED
  60 00 00 00 80 00 00 07 8b e9 18 40 00     00:32:26.723  READ FPDMA QUEUED
  60 00 00 00 80 00 00 07 8b e8 98 40 00     00:32:26.721  READ FPDMA QUEUED
  60 00 00 00 80 00 00 07 8b e8 18 40 00     00:32:26.701  READ FPDMA QUEUED
  60 00 00 00 80 00 00 07 8b e7 98 40 00     00:32:26.700  READ FPDMA QUEUED

Error 4 [3] occurred at disk power-on lifetime: 1774 hours (73 days + 22 hours)
  When the command that caused the error occurred, the device was active or idle.

  After command completion occurred, registers were:
  ER -- ST COUNT  LBA_48  LH LM LL DV DC
  -- -- -- == -- == == == -- -- -- -- --
  40 -- 51 00 00 00 00 07 8c 86 70 00 00  Error: WP at LBA = 0x078c8670 = 126649968

  Commands leading to the command that caused the error were:
  CR FEATR COUNT  LBA_48  LH LM LL DV DC  Powered_Up_Time  Command/Feature_Name
  -- == -- == -- == == == -- -- -- -- --  ---------------  --------------------
  61 00 00 00 10 00 00 03 7f f7 58 40 00     00:25:14.647  WRITE FPDMA QUEUED
  61 00 00 00 08 00 00 03 7f f7 30 40 00     00:25:14.647  WRITE FPDMA QUEUED
  61 00 00 00 18 00 00 03 7f f7 00 40 00     00:25:14.647  WRITE FPDMA QUEUED
  61 00 00 00 08 00 00 03 7f f6 90 40 00     00:25:14.646  WRITE FPDMA QUEUED
  61 00 00 00 08 00 00 03 7f f6 58 40 00     00:25:14.646  WRITE FPDMA QUEUED

Error 3 [2] occurred at disk power-on lifetime: 1774 hours (73 days + 22 hours)
  When the command that caused the error occurred, the device was active or idle.

  After command completion occurred, registers were:
  ER -- ST COUNT  LBA_48  LH LM LL DV DC
  -- -- -- == -- == == == -- -- -- -- --
  40 -- 51 00 00 00 00 07 8c 86 70 00 00  Error: WP at LBA = 0x078c8670 = 126649968

  Commands leading to the command that caused the error were:
  CR FEATR COUNT  LBA_48  LH LM LL DV DC  Powered_Up_Time  Command/Feature_Name
  -- == -- == -- == == == -- -- -- -- --  ---------------  --------------------
  61 00 00 00 08 00 00 03 7c a7 00 40 00     00:25:12.037  WRITE FPDMA QUEUED
  61 00 00 00 01 00 00 05 e9 0c 88 40 00     00:25:12.036  WRITE FPDMA QUEUED
  61 00 00 00 08 00 00 03 7b f3 f8 40 00     00:25:12.036  WRITE FPDMA QUEUED
  61 00 00 00 08 00 00 05 e9 fd 90 40 00     00:25:12.035  WRITE FPDMA QUEUED
  61 00 00 00 08 00 00 05 e9 a1 50 40 00     00:25:12.035  WRITE FPDMA QUEUED

Error 2 [1] occurred at disk power-on lifetime: 1774 hours (73 days + 22 hours)
  When the command that caused the error occurred, the device was active or idle.

  After command completion occurred, registers were:
  ER -- ST COUNT  LBA_48  LH LM LL DV DC
  -- -- -- == -- == == == -- -- -- -- --
  40 -- 51 00 00 00 00 07 8c 86 70 00 00  Error: UNC at LBA = 0x078c8670 = 126649968

  Commands leading to the command that caused the error were:
  CR FEATR COUNT  LBA_48  LH LM LL DV DC  Powered_Up_Time  Command/Feature_Name
  -- == -- == -- == == == -- -- -- -- --  ---------------  --------------------
  60 00 00 00 c0 00 00 07 8c 86 00 40 00     00:25:09.474  READ FPDMA QUEUED
  60 00 00 01 00 00 00 07 8c 85 00 40 00     00:25:09.473  READ FPDMA QUEUED
  61 00 00 00 c0 00 00 06 96 4c c0 40 00     00:25:09.472  WRITE FPDMA QUEUED
  60 00 00 00 c0 00 00 07 87 ba c0 40 00     00:25:09.458  READ FPDMA QUEUED
  61 00 00 00 60 00 00 06 96 4c 60 40 00     00:25:09.457  WRITE FPDMA QUEUED

SMART Extended Self-test Log Version: 1 (1 sectors)
No self-tests have been logged.  [To run self-tests, use: smartctl -t]

SMART Selective self-test log data structure revision number 1
 SPAN  MIN_LBA  MAX_LBA  CURRENT_TEST_STATUS
    1        0        0  Not_testing
    2        0        0  Not_testing
    3        0        0  Not_testing
    4        0        0  Not_testing
    5        0        0  Not_testing
Selective self-test flags (0x0):
  After scanning selected spans, do NOT read-scan remainder of disk.
If Selective self-test is pending on power-up, resume after 0 minute delay.

SCT Status Version:                  3
SCT Version (vendor specific):       522 (0x020a)
SCT Support Level:                   1
Device State:                        Active (0)
Current Temperature:                    32 Celsius
Power Cycle Min/Max Temperature:     18/36 Celsius
Lifetime    Min/Max Temperature:      1/48 Celsius
Lifetime    Average Temperature:        31 Celsius
Under/Over Temperature Limit Count:   0/0

SCT Temperature History Version:     2
Temperature Sampling Period:         1 minute
Temperature Logging Interval:        30 minutes
Min/Max recommended Temperature:     14/55 Celsius
Min/Max Temperature Limit:           10/60 Celsius
Temperature History Size (Index):    128 (28)

SCT Error Recovery Control:
           Read: Disabled
          Write: Disabled

Device Statistics (GP/SMART Log 0x04) not supported

SATA Phy Event Counters (GP Log 0x11)
ID      Size     Value  Description
0x000a  2           12  Device-to-host register FISes sent due to a COMRESET
0x0001  2            0  Command failed due to ICRC error
0x0003  2            0  R_ERR response for device-to-host data FIS
0x0004  2            0  R_ERR response for host-to-device data FIS
0x0006  2            0  R_ERR response for device-to-host non-data FIS
0x0007  2            0  R_ERR response for host-to-device non-data FIS

