smartctl 7.3 2022-02-28 r5338 [x86_64-linux-6.1.0-17-amd64] (local build)
Copyright (C) 2002-22, Bruce Allen, Christian Franke, www.smartmontools.org

=== START OF INFORMATION SECTION ===
Model Number:                       TEAM TM8FPK001T
Serial Number:                      --
Firmware Version:                   CRT270FF
PCI Vendor/Subsystem ID:            0xfe19
IEEE OUI Identifier:                0x346f71
Total NVM Capacity:                 1,024,209,543,168 [1.02 TB]
Unallocated NVM Capacity:           0
Controller ID:                      0
NVMe Version:                       1.4
Number of Namespaces:               1
Namespace 1 Size/Capacity:          1,024,209,543,168 [1.02 TB]
Namespace 1 Formatted LBA Size:     512
Namespace 1 IEEE EUI-64:            346f71 ...
Local Time is:                      Wed Apr 17 20:56:55 2024 CDT
Firmware Updates (0x12):            1 Slot, no Reset required
Optional Admin Commands (0x0016):   Format Frmw_DL Self_Test
Optional NVM Commands (0x0016):     Wr_Unc DS_Mngmt Sav/Sel_Feat
Log Page Attributes (0x02):         Cmd_Eff_Lg
Maximum Data Transfer Size:         64 Pages
Warning  Comp. Temp. Threshold:     75 Celsius
Critical Comp. Temp. Threshold:     85 Celsius

Supported Power States
St Op     Max   Active     Idle   RL RT WL WT  Ent_Lat  Ex_Lat
 0 +     4.00W       -        -    0  0  0  0        1       1
 1 +     4.00W       -        -    1  1  1  1       10      10
 2 +     4.00W       -        -    2  2  2  2       50      50
 3 -     0.12W       -        -    3  3  3  3     2000    6000
 4 -   0.0050W       -        -    4  4  4  4     6000   95000

Supported LBA Sizes (NSID 0x1)
Id Fmt  Data  Metadt  Rel_Perf
 0 +     512       0         0

=== START OF SMART DATA SECTION ===
SMART overall-health self-assessment test result: PASSED

SMART/Health Information (NVMe Log 0x02)
Critical Warning:                   0x00
Temperature:                        30 Celsius
Available Spare:                    100%
Available Spare Threshold:          10%
Percentage Used:                    0%
Data Units Read:                    81,429 [41.6 GB]
Data Units Written:                 145,868 [74.6 GB]
Host Read Commands:                 263,333
Host Write Commands:                557,241
Controller Busy Time:               1
Power Cycles:                       43
Power On Hours:                     2
Unsafe Shutdowns:                   40
Media and Data Integrity Errors:    0
Error Information Log Entries:      0
Warning  Comp. Temperature Time:    0
Critical Comp. Temperature Time:    0
Temperature Sensor 1:               32 Celsius
Temperature Sensor 2:               46 Celsius
Temperature Sensor 3:               30 Celsius

Error Information (NVMe Log 0x01, 4 of 4 entries)
No Errors Logged

