smartctl 7.1 2019-12-30 r5022 [x86_64-linux-5.15.0-131-generic] (local build)
Copyright (C) 2002-19, Bruce Allen, Christian Franke, www.smartmontools.org

=== START OF INFORMATION SECTION ===
Model Number:                       Samsung SSD 990 EVO 1TB
Serial Number:                      --
Firmware Version:                   0B2QKXJ7
PCI Vendor/Subsystem ID:            0x144d
IEEE OUI Identifier:                0x002538
Total NVM Capacity:                 1,000,204,886,016 [1.00 TB]
Unallocated NVM Capacity:           0
Controller ID:                      1
Number of Namespaces:               1
Namespace 1 Size/Capacity:          1,000,204,886,016 [1.00 TB]
Namespace 1 Utilization:            292,802,535,424 [292 GB]
Namespace 1 Formatted LBA Size:     512
Namespace 1 IEEE EUI-64:            002538 ...
Local Time is:                      Mon Feb  3 23:52:13 2025 MST
Firmware Updates (0x16):            3 Slots, no Reset required
Optional Admin Commands (0x0017):   Security Format Frmw_DL Self_Test
Optional NVM Commands (0x00df):     Comp Wr_Unc DS_Mngmt Wr_Zero Sav/Sel_Feat Timestmp *Other*
Maximum Data Transfer Size:         128 Pages
Warning  Comp. Temp. Threshold:     85 Celsius
Critical Comp. Temp. Threshold:     85 Celsius

Supported Power States
St Op     Max   Active     Idle   RL RT WL WT  Ent_Lat  Ex_Lat
 0 +     7.47W       -        -    0  0  0  0        0       0
 1 +     7.47W       -        -    1  1  1  1      500     500
 2 +     7.47W       -        -    2  2  2  2     1100    3600
 3 -   0.0800W       -        -    3  3  3  3     3700    2400
 4 -   0.0070W       -        -    4  4  4  4     3700   45000

Supported LBA Sizes (NSID 0x1)
Id Fmt  Data  Metadt  Rel_Perf
 0 +     512       0         0

=== START OF SMART DATA SECTION ===
SMART overall-health self-assessment test result: PASSED

SMART/Health Information (NVMe Log 0x02)
Critical Warning:                   0x00
Temperature:                        41 Celsius
Available Spare:                    100%
Available Spare Threshold:          10%
Percentage Used:                    0%
Data Units Read:                    1,332,421 [682 GB]
Data Units Written:                 1,388,586 [710 GB]
Host Read Commands:                 18,622,930
Host Write Commands:                12,533,460
Controller Busy Time:               241
Power Cycles:                       323
Power On Hours:                     482
Unsafe Shutdowns:                   14
Media and Data Integrity Errors:    0
Error Information Log Entries:      0
Warning  Comp. Temperature Time:    0
Critical Comp. Temperature Time:    0
Temperature Sensor 1:               46 Celsius
Temperature Sensor 2:               41 Celsius

Error Information (NVMe Log 0x01, max 64 entries)
No Errors Logged

