smartctl 7.1 2019-12-30 r5022 [x86_64-linux-5.8.14-arch1-1] (local build)
Copyright (C) 2002-19, Bruce Allen, Christian Franke, www.smartmontools.org

=== START OF INFORMATION SECTION ===
Model Family:     Western Digital AV SATA
Device Model:     WDC WD3200AVJS-63B6A0
Serial Number:    --
LU WWN Device Id: 5 0014ee ...
Firmware Version: 01.03A01
User Capacity:    320,072,933,376 bytes [320 GB]
Sector Size:      512 bytes logical/physical
Device is:        In smartctl database [for details use: -P show]
ATA Version is:   ATA8-ACS (minor revision not indicated)
SATA Version is:  SATA 2.5, 3.0 Gb/s
Local Time is:    Wed Oct 14 20:47:00 2020 IST
SMART support is: Available - device has SMART capability.
SMART support is: Enabled
AAM feature is:   Disabled
APM feature is:   Unavailable
Rd look-ahead is: Enabled
Write cache is:   Enabled
DSN feature is:   Unavailable
ATA Security is:  Disabled, frozen [SEC2]
Wt Cache Reorder: Enabled

=== START OF READ SMART DATA SECTION ===
SMART overall-health self-assessment test result: PASSED

General SMART Values:
Offline data collection status:  (0x00)	Offline data collection activity
					was never started.
					Auto Offline Data Collection: Disabled.
Self-test execution status:      (   0)	The previous self-test routine completed
					without error or no self-test has ever 
					been run.
Total time to complete Offline 
data collection: 		( 5760) seconds.
Offline data collection
capabilities: 			 (0x7b) SMART execute Offline immediate.
					Auto Offline data collection on/off support.
					Suspend Offline collection upon new
					command.
					Offline surface scan supported.
					Self-test supported.
					Conveyance Self-test supported.
					Selective Self-test supported.
SMART capabilities:            (0x0003)	Saves SMART data before entering
					power-saving mode.
					Supports SMART auto save timer.
Error logging capability:        (0x01)	Error logging supported.
					General Purpose Logging supported.
Short self-test routine 
recommended polling time: 	 (   2) minutes.
Extended self-test routine
recommended polling time: 	 (  70) minutes.
Conveyance self-test routine
recommended polling time: 	 (   5) minutes.
SCT capabilities: 	       (0x303f)	SCT Status supported.
					SCT Error Recovery Control supported.
					SCT Feature Control supported.
					SCT Data Table supported.

SMART Attributes Data Structure revision number: 16
Vendor Specific SMART Attributes with Thresholds:
ID# ATTRIBUTE_NAME          FLAGS    VALUE WORST THRESH FAIL RAW_VALUE
  1 Raw_Read_Error_Rate     POSR-K   200   200   051    -    12
  3 Spin_Up_Time            POS--K   158   154   021    -    3058
  4 Start_Stop_Count        -O--CK   089   089   000    -    11172
  5 Reallocated_Sector_Ct   PO--CK   200   200   140    -    0
  7 Seek_Error_Rate         -OSR-K   100   253   000    -    0
  9 Power_On_Hours          -O--CK   047   047   000    -    39278
 10 Spin_Retry_Count        -O--CK   100   100   000    -    0
 11 Calibration_Retry_Count -O--CK   100   100   000    -    0
 12 Power_Cycle_Count       -O--CK   097   097   000    -    3632
192 Power-Off_Retract_Count -O--CK   199   199   000    -    1322
193 Load_Cycle_Count        -O--CK   197   197   000    -    11172
194 Temperature_Celsius     -O---K   113   080   000    -    30
196 Reallocated_Event_Count -O--CK   200   200   000    -    0
197 Current_Pending_Sector  -O--CK   200   200   000    -    0
198 Offline_Uncorrectable   ----CK   100   253   000    -    0
199 UDMA_CRC_Error_Count    -O--CK   200   200   000    -    0
200 Multi_Zone_Error_Rate   ---R--   100   253   000    -    0
                            ||||||_ K auto-keep
                            |||||__ C event count
                            ||||___ R error rate
                            |||____ S speed/performance
                            ||_____ O updated online
                            |______ P prefailure warning

General Purpose Log Directory Version 1
SMART           Log Directory Version 1 [multi-sector log support]
Address    Access  R/W   Size  Description
0x00       GPL,SL  R/O      1  Log Directory
0x01           SL  R/O      1  Summary SMART error log
0x02           SL  R/O      5  Comprehensive SMART error log
0x03       GPL     R/O      6  Ext. Comprehensive SMART error log
0x06           SL  R/O      1  SMART self-test log
0x07       GPL     R/O      1  Extended self-test log
0x09           SL  R/W      1  Selective self-test log
0x10       GPL     R/O      1  NCQ Command Error log
0x11       GPL     R/O      1  SATA Phy Event Counters log
0x21       GPL     R/O      1  Write stream error log
0x22       GPL     R/O      1  Read stream error log
0x80-0x9f  GPL,SL  R/W     16  Host vendor specific log
0xa0-0xa7  GPL,SL  VS      16  Device vendor specific log
0xa8-0xb7  GPL,SL  VS       1  Device vendor specific log
0xc0       GPL,SL  VS       1  Device vendor specific log
0xc1       GPL     VS      24  Device vendor specific log
0xe0       GPL,SL  R/W      1  SCT Command/Status
0xe1       GPL,SL  R/W      1  SCT Data Transfer

SMART Extended Comprehensive Error Log Version: 1 (6 sectors)
Device Error Count: 5259 (device log contains only the most recent 24 errors)
	CR     = Command Register
	FEATR  = Features Register
	COUNT  = Count (was: Sector Count) Register
	LBA_48 = Upper bytes of LBA High/Mid/Low Registers ]  ATA-8
	LH     = LBA High (was: Cylinder High) Register    ]   LBA
	LM     = LBA Mid (was: Cylinder Low) Register      ] Register
	LL     = LBA Low (was: Sector Number) Register     ]
	DV     = Device (was: Device/Head) Register
	DC     = Device Control Register
	ER     = Error register
	ST     = Status register
Powered_Up_Time is measured from power on, and printed as
DDd+hh:mm:SS.sss where DD=days, hh=hours, mm=minutes,
SS=sec, and sss=millisec. It "wraps" after 49.710 days.

Error 5259 [2] occurred at disk power-on lifetime: 37170 hours (1548 days + 18 hours)
  When the command that caused the error occurred, the device was active or idle.

  After command completion occurred, registers were:
  ER -- ST COUNT  LBA_48  LH LM LL DV DC
  -- -- -- == -- == == == -- -- -- -- --
  40 -- 51 00 08 00 12 08 00 ee 00 e0 00  Error: UNC 8 sectors at LBA = 0x120800ee00 = 77443689984

  Commands leading to the command that caused the error were:
  CR FEATR COUNT  LBA_48  LH LM LL DV DC  Powered_Up_Time  Command/Feature_Name
  -- == -- == -- == == == -- -- -- -- --  ---------------  --------------------
  25 00 00 00 08 00 00 12 ee 08 00 e0 08     00:01:57.154  READ DMA EXT
  27 00 00 00 00 00 00 00 00 00 00 e0 08     00:01:57.154  READ NATIVE MAX ADDRESS EXT [OBS-ACS-3]
  ec 00 00 00 00 00 00 00 00 00 00 a0 08     00:01:57.146  IDENTIFY DEVICE
  ef 00 03 00 46 00 00 00 00 00 00 a0 08     00:01:57.146  SET FEATURES [Set transfer mode]
  27 00 00 00 00 00 00 00 00 00 00 e0 08     00:01:57.146  READ NATIVE MAX ADDRESS EXT [OBS-ACS-3]

Error 5258 [1] occurred at disk power-on lifetime: 37170 hours (1548 days + 18 hours)
  When the command that caused the error occurred, the device was active or idle.

  After command completion occurred, registers were:
  ER -- ST COUNT  LBA_48  LH LM LL DV DC
  -- -- -- == -- == == == -- -- -- -- --
  40 -- 51 00 08 00 12 08 00 ee 00 e0 00  Error: UNC 8 sectors at LBA = 0x120800ee00 = 77443689984

  Commands leading to the command that caused the error were:
  CR FEATR COUNT  LBA_48  LH LM LL DV DC  Powered_Up_Time  Command/Feature_Name
  -- == -- == -- == == == -- -- -- -- --  ---------------  --------------------
  25 00 00 00 08 00 00 12 ee 08 00 e0 08     00:01:54.616  READ DMA EXT
  27 00 00 00 00 00 00 00 00 00 00 e0 08     00:01:54.616  READ NATIVE MAX ADDRESS EXT [OBS-ACS-3]
  ec 00 00 00 00 00 00 00 00 00 00 a0 08     00:01:54.608  IDENTIFY DEVICE
  ef 00 03 00 46 00 00 00 00 00 00 a0 08     00:01:54.608  SET FEATURES [Set transfer mode]
  27 00 00 00 00 00 00 00 00 00 00 e0 08     00:01:54.608  READ NATIVE MAX ADDRESS EXT [OBS-ACS-3]

Error 5257 [0] occurred at disk power-on lifetime: 37170 hours (1548 days + 18 hours)
  When the command that caused the error occurred, the device was active or idle.

  After command completion occurred, registers were:
  ER -- ST COUNT  LBA_48  LH LM LL DV DC
  -- -- -- == -- == == == -- -- -- -- --
  40 -- 51 00 08 00 12 08 00 ee 00 e0 00  Error: UNC 8 sectors at LBA = 0x120800ee00 = 77443689984

  Commands leading to the command that caused the error were:
  CR FEATR COUNT  LBA_48  LH LM LL DV DC  Powered_Up_Time  Command/Feature_Name
  -- == -- == -- == == == -- -- -- -- --  ---------------  --------------------
  25 00 00 00 08 00 00 12 ee 08 00 e0 08     00:01:52.398  READ DMA EXT
  27 00 00 00 00 00 00 00 00 00 00 e0 08     00:01:52.398  READ NATIVE MAX ADDRESS EXT [OBS-ACS-3]
  ec 00 00 00 00 00 00 00 00 00 00 a0 08     00:01:52.390  IDENTIFY DEVICE
  ef 00 03 00 46 00 00 00 00 00 00 a0 08     00:01:52.390  SET FEATURES [Set transfer mode]
  27 00 00 00 00 00 00 00 00 00 00 e0 08     00:01:52.390  READ NATIVE MAX ADDRESS EXT [OBS-ACS-3]

Error 5256 [23] occurred at disk power-on lifetime: 37170 hours (1548 days + 18 hours)
  When the command that caused the error occurred, the device was active or idle.

  After command completion occurred, registers were:
  ER -- ST COUNT  LBA_48  LH LM LL DV DC
  -- -- -- == -- == == == -- -- -- -- --
  40 -- 51 00 08 00 12 08 00 ee 00 e0 00  Error: UNC 8 sectors at LBA = 0x120800ee00 = 77443689984

  Commands leading to the command that caused the error were:
  CR FEATR COUNT  LBA_48  LH LM LL DV DC  Powered_Up_Time  Command/Feature_Name
  -- == -- == -- == == == -- -- -- -- --  ---------------  --------------------
  25 00 00 00 08 00 00 12 ee 08 00 e0 08     00:01:50.184  READ DMA EXT
  27 00 00 00 00 00 00 00 00 00 00 e0 08     00:01:50.184  READ NATIVE MAX ADDRESS EXT [OBS-ACS-3]
  ec 00 00 00 00 00 00 00 00 00 00 a0 08     00:01:50.177  IDENTIFY DEVICE
  ef 00 03 00 46 00 00 00 00 00 00 a0 08     00:01:50.177  SET FEATURES [Set transfer mode]
  27 00 00 00 00 00 00 00 00 00 00 e0 08     00:01:50.177  READ NATIVE MAX ADDRESS EXT [OBS-ACS-3]

Error 5255 [22] occurred at disk power-on lifetime: 37170 hours (1548 days + 18 hours)
  When the command that caused the error occurred, the device was active or idle.

  After command completion occurred, registers were:
  ER -- ST COUNT  LBA_48  LH LM LL DV DC
  -- -- -- == -- == == == -- -- -- -- --
  40 -- 51 00 08 00 12 08 00 ee 00 e0 00  Error: UNC 8 sectors at LBA = 0x120800ee00 = 77443689984

  Commands leading to the command that caused the error were:
  CR FEATR COUNT  LBA_48  LH LM LL DV DC  Powered_Up_Time  Command/Feature_Name
  -- == -- == -- == == == -- -- -- -- --  ---------------  --------------------
  25 00 00 00 08 00 00 12 ee 08 00 e0 08     00:01:47.971  READ DMA EXT
  27 00 00 00 00 00 00 00 00 00 00 e0 08     00:01:47.971  READ NATIVE MAX ADDRESS EXT [OBS-ACS-3]
  ec 00 00 00 00 00 00 00 00 00 00 a0 08     00:01:47.963  IDENTIFY DEVICE
  ef 00 03 00 46 00 00 00 00 00 00 a0 08     00:01:47.963  SET FEATURES [Set transfer mode]
  27 00 00 00 00 00 00 00 00 00 00 e0 08     00:01:47.963  READ NATIVE MAX ADDRESS EXT [OBS-ACS-3]

Error 5254 [21] occurred at disk power-on lifetime: 37170 hours (1548 days + 18 hours)
  When the command that caused the error occurred, the device was active or idle.

  After command completion occurred, registers were:
  ER -- ST COUNT  LBA_48  LH LM LL DV DC
  -- -- -- == -- == == == -- -- -- -- --
  40 -- 51 00 08 00 12 08 00 ee 00 e0 00  Error: UNC 8 sectors at LBA = 0x120800ee00 = 77443689984

  Commands leading to the command that caused the error were:
  CR FEATR COUNT  LBA_48  LH LM LL DV DC  Powered_Up_Time  Command/Feature_Name
  -- == -- == -- == == == -- -- -- -- --  ---------------  --------------------
  25 00 00 00 08 00 00 12 ee 08 00 e0 08     00:01:45.582  READ DMA EXT
  ca 00 00 00 08 00 00 00 80 09 00 e0 08     00:01:45.582  WRITE DMA
  ca 00 00 00 08 00 00 00 41 07 a0 e0 08     00:01:45.582  WRITE DMA
  ca 00 00 00 10 00 00 00 40 1e f0 e0 08     00:01:45.581  WRITE DMA
  ca 00 00 00 08 00 00 00 40 1e 28 e0 08     00:01:45.581  WRITE DMA

Error 5253 [20] occurred at disk power-on lifetime: 37170 hours (1548 days + 18 hours)
  When the command that caused the error occurred, the device was active or idle.

  After command completion occurred, registers were:
  ER -- ST COUNT  LBA_48  LH LM LL DV DC
  -- -- -- == -- == == == -- -- -- -- --
  40 -- 51 00 08 00 12 08 00 ee 00 e0 00  Error: UNC 8 sectors at LBA = 0x120800ee00 = 77443689984

  Commands leading to the command that caused the error were:
  CR FEATR COUNT  LBA_48  LH LM LL DV DC  Powered_Up_Time  Command/Feature_Name
  -- == -- == -- == == == -- -- -- -- --  ---------------  --------------------
  25 00 00 00 08 00 00 12 ee 08 00 e0 08     00:01:43.335  READ DMA EXT
  27 00 00 00 00 00 00 00 00 00 00 e0 08     00:01:43.335  READ NATIVE MAX ADDRESS EXT [OBS-ACS-3]
  ec 00 00 00 00 00 00 00 00 00 00 a0 08     00:01:43.327  IDENTIFY DEVICE
  ef 00 03 00 46 00 00 00 00 00 00 a0 08     00:01:43.327  SET FEATURES [Set transfer mode]
  27 00 00 00 00 00 00 00 00 00 00 e0 08     00:01:43.327  READ NATIVE MAX ADDRESS EXT [OBS-ACS-3]

Error 5252 [19] occurred at disk power-on lifetime: 37170 hours (1548 days + 18 hours)
  When the command that caused the error occurred, the device was active or idle.

  After command completion occurred, registers were:
  ER -- ST COUNT  LBA_48  LH LM LL DV DC
  -- -- -- == -- == == == -- -- -- -- --
  40 -- 51 00 08 00 12 08 00 ee 00 e0 00  Error: UNC 8 sectors at LBA = 0x120800ee00 = 77443689984

  Commands leading to the command that caused the error were:
  CR FEATR COUNT  LBA_48  LH LM LL DV DC  Powered_Up_Time  Command/Feature_Name
  -- == -- == -- == == == -- -- -- -- --  ---------------  --------------------
  25 00 00 00 08 00 00 12 ee 08 00 e0 08     00:01:41.118  READ DMA EXT
  27 00 00 00 00 00 00 00 00 00 00 e0 08     00:01:41.118  READ NATIVE MAX ADDRESS EXT [OBS-ACS-3]
  ec 00 00 00 00 00 00 00 00 00 00 a0 08     00:01:41.110  IDENTIFY DEVICE
  ef 00 03 00 46 00 00 00 00 00 00 a0 08     00:01:41.110  SET FEATURES [Set transfer mode]
  27 00 00 00 00 00 00 00 00 00 00 e0 08     00:01:41.110  READ NATIVE MAX ADDRESS EXT [OBS-ACS-3]

SMART Extended Self-test Log Version: 1 (1 sectors)
Num  Test_Description    Status                  Remaining  LifeTime(hours)  LBA_of_first_error
# 1  Short captive       Completed without error       00%     37184         -
# 2  Short offline       Completed without error       00%     34187         -
# 3  Short offline       Completed without error       00%     34157         -
# 4  Short offline       Completed without error       00%     34122         -
# 5  Short offline       Completed without error       00%     34091         -
# 6  Short offline       Completed without error       00%     34050         -
# 7  Short offline       Completed without error       00%     34019         -
# 8  Short offline       Completed without error       00%     33979         -
# 9  Short offline       Completed without error       00%     33948         -
#10  Short offline       Completed without error       00%     33906         -
#11  Short offline       Completed without error       00%     33876         -
#12  Short offline       Completed without error       00%     33844         -
#13  Short offline       Completed without error       00%     33811         -
#14  Short offline       Completed without error       00%     33780         -
#15  Short offline       Completed without error       00%     33739         -
#16  Short offline       Completed without error       00%     33702         -
#17  Short offline       Completed without error       00%     33668         -
#18  Short offline       Completed without error       00%     33636         -

SMART Selective self-test log data structure revision number 1
 SPAN  MIN_LBA  MAX_LBA  CURRENT_TEST_STATUS
    1        0        0  Not_testing
    2        0        0  Not_testing
    3        0        0  Not_testing
    4        0        0  Not_testing
    5        0        0  Not_testing
Selective self-test flags (0x0):
  After scanning selected spans, do NOT read-scan remainder of disk.
If Selective self-test is pending on power-up, resume after 0 minute delay.

SCT Status Version:                  2
SCT Version (vendor specific):       258 (0x0102)
Device State:                        Active (0)
Current Temperature:                    30 Celsius
Power Cycle Min/Max Temperature:     17/30 Celsius
Lifetime    Min/Max Temperature:     29/63 Celsius
Under/Over Temperature Limit Count:   0/0

SCT Temperature History Version:     2
Temperature Sampling Period:         1 minute
Temperature Logging Interval:        1 minute
Min/Max recommended Temperature:      0/60 Celsius
Min/Max Temperature Limit:           -41/85 Celsius
Temperature History Size (Index):    478 (101)

SCT Error Recovery Control:
           Read: Disabled
          Write: Disabled

Device Statistics (GP/SMART Log 0x04) not supported

Pending Defects log (GP Log 0x0c) not supported

SATA Phy Event Counters (GP Log 0x11)
ID      Size     Value  Description
0x0001  2            0  Command failed due to ICRC error
0x0002  2            0  R_ERR response for data FIS
0x0003  2            0  R_ERR response for device-to-host data FIS
0x0004  2            0  R_ERR response for host-to-device data FIS
0x0005  2            0  R_ERR response for non-data FIS
0x0006  2            0  R_ERR response for device-to-host non-data FIS
0x0007  2            0  R_ERR response for host-to-device non-data FIS
0x000a  2            1  Device-to-host register FISes sent due to a COMRESET
0x8000  4         2290  Vendor specific

