smartctl 7.2 2020-12-30 r5155 [x86_64-linux-6.8.0-52-generic] (local build)
Copyright (C) 2002-20, Bruce Allen, Christian Franke, www.smartmontools.org

=== START OF INFORMATION SECTION ===
Device Model:     SSD
Serial Number:    --
LU WWN Device Id: 0 000000 ...
Firmware Version: HP3105A3
User Capacity:    128,035,676,160 bytes [128 GB]
Sector Size:      512 bytes logical/physical
Rotation Rate:    Solid State Device
Form Factor:      2.5 inches
TRIM Command:     Available
Device is:        Not in smartctl database [for details use: -P showall]
ATA Version is:   ACS-2 T13/2015-D revision 3
SATA Version is:  SATA 3.2, 6.0 Gb/s (current: 3.0 Gb/s)
Local Time is:    Wed Jan 29 22:33:22 2025 CET
SMART support is: Available - device has SMART capability.
SMART support is: Enabled
AAM feature is:   Unavailable
APM feature is:   Unavailable
Rd look-ahead is: Enabled
Write cache is:   Enabled
DSN feature is:   Unavailable
ATA Security is:  Disabled, frozen [SEC2]
Wt Cache Reorder: Unavailable

=== START OF READ SMART DATA SECTION ===
SMART overall-health self-assessment test result: PASSED

General SMART Values:
Offline data collection status:  (0x00)	Offline data collection activity
					was never started.
					Auto Offline Data Collection: Disabled.
Total time to complete Offline 
data collection: 		(    0) seconds.
Offline data collection
capabilities: 			 (0x00) 	Offline data collection not supported.
SMART capabilities:            (0x0000)	Automatic saving of SMART data					is not implemented.
Error logging capability:        (0x00)	Error logging supported.
					General Purpose Logging supported.

SMART Attributes Data Structure revision number: 1
Vendor Specific SMART Attributes with Thresholds:
ID# ATTRIBUTE_NAME          FLAGS    VALUE WORST THRESH FAIL RAW_VALUE
  1 Raw_Read_Error_Rate     -O--CK   100   100   050    -    0
  5 Reallocated_Sector_Ct   -O--CK   100   100   050    -    0
  9 Power_On_Hours          -O--CK   100   100   050    -    367
 12 Power_Cycle_Count       -O--CK   100   100   050    -    98
160 Unknown_Attribute       -O--CK   100   100   050    -    0
161 Unknown_Attribute       -O--CK   100   100   050    -    0
163 Unknown_Attribute       -O--CK   100   100   050    -    973
164 Unknown_Attribute       -O--CK   100   100   050    -    0
165 Unknown_Attribute       -O--CK   100   100   050    -    0
166 Unknown_Attribute       -O--CK   100   100   050    -    0
167 Unknown_Attribute       -O--CK   100   100   050    -    0
168 Unknown_Attribute       -O--CK   100   100   050    -    0
169 Unknown_Attribute       -O--CK   100   100   050    -    100
175 Program_Fail_Count_Chip -O--CK   100   100   050    -    50331648
176 Erase_Fail_Count_Chip   -O--CK   100   100   050    -    2
177 Wear_Leveling_Count     -O--CK   100   100   050    -    3888
178 Used_Rsvd_Blk_Cnt_Chip  -O--CK   100   100   050    -    16777216
181 Program_Fail_Cnt_Total  -O--CK   100   100   050    -    0
182 Erase_Fail_Count_Total  -O--CK   100   100   050    -    0
192 Power-Off_Retract_Count -O--CK   100   100   050    -    6
194 Temperature_Celsius     -O--CK   100   100   050    -    38
195 Hardware_ECC_Recovered  -O--CK   100   100   050    -    4
198 Offline_Uncorrectable   -O--CK   100   100   050    -    0
232 Available_Reservd_Space -O--CK   100   100   050    -    0
241 Total_LBAs_Written      -O--CK   100   100   050    -    2971
242 Total_LBAs_Read         -O--CK   100   100   050    -    2228
                            ||||||_ K auto-keep
                            |||||__ C event count
                            ||||___ R error rate
                            |||____ S speed/performance
                            ||_____ O updated online
                            |______ P prefailure warning

General Purpose Log Directory Version 1
SMART           Log Directory Version 1 [multi-sector log support]
Address    Access  R/W   Size  Description
0x00       GPL,SL  R/O      1  Log Directory
0x01       GPL,SL  R/O      1  Summary SMART error log
0x02       GPL,SL  R/O      1  Comprehensive SMART error log
0x03       GPL,SL  R/O      1  Ext. Comprehensive SMART error log
0x04       GPL,SL  R/O      8  Device Statistics log
0x06       GPL,SL  R/O      1  SMART self-test log
0x07       GPL,SL  R/O      1  Extended self-test log
0x09       GPL,SL  R/W      1  Selective self-test log
0x10       GPL,SL  R/O      1  NCQ Command Error log
0x11       GPL,SL  R/O      1  SATA Phy Event Counters log
0x30       GPL,SL  R/O      9  IDENTIFY DEVICE data log
0x80-0x9f  GPL,SL  R/W     16  Host vendor specific log
0xa0       GPL,SL  VS      16  Device vendor specific log
0xe0       GPL,SL  R/W      1  SCT Command/Status
0xe1       GPL,SL  R/W      1  SCT Data Transfer

SMART Extended Comprehensive Error Log Version: 0 (1 sectors)
No Errors Logged

SMART Extended Self-test Log Version: 0 (1 sectors)
No self-tests have been logged.  [To run self-tests, use: smartctl -t]

Selective Self-tests/Logging not supported

SCT Commands not supported

Device Statistics (GP Log 0x04)
Page  Offset Size        Value Flags Description
0x01  =====  =               =  ===  == General Statistics (rev 1) ==
0x01  0x008  4              98  ---  Lifetime Power-On Resets
0x01  0x010  4             367  ---  Power-on Hours
0x01  0x018  6       194707456  ---  Logical Sectors Written
0x01  0x020  6         2757508  ---  Number of Write Commands
0x01  0x028  6       146014208  ---  Logical Sectors Read
0x01  0x030  6         2755664  ---  Number of Read Commands
0x01  =====  =               =  ===  == General Statistics (rev 1) ==
0x01  0x008  4              98  ---  Lifetime Power-On Resets
0x01  0x010  4             367  ---  Power-on Hours
0x01  0x018  6       194707456  ---  Logical Sectors Written
0x01  0x020  6         2757508  ---  Number of Write Commands
0x01  0x028  6       146014208  ---  Logical Sectors Read
0x01  0x030  6         2755664  ---  Number of Read Commands
0x01  =====  =               =  ===  == General Statistics (rev 1) ==
0x01  0x008  4              98  ---  Lifetime Power-On Resets
0x01  0x010  4             367  ---  Power-on Hours
0x01  0x018  6       194707456  ---  Logical Sectors Written
0x01  0x020  6         2757508  ---  Number of Write Commands
0x01  0x028  6       146014208  ---  Logical Sectors Read
0x01  0x030  6         2755664  ---  Number of Read Commands
0x01  =====  =               =  ===  == General Statistics (rev 1) ==
0x01  0x008  4              98  ---  Lifetime Power-On Resets
0x01  0x010  4             367  ---  Power-on Hours
0x01  0x018  6       194707456  ---  Logical Sectors Written
0x01  0x020  6         2757508  ---  Number of Write Commands
0x01  0x028  6       146014208  ---  Logical Sectors Read
0x01  0x030  6         2755664  ---  Number of Read Commands
0x01  =====  =               =  ===  == General Statistics (rev 1) ==
0x01  0x008  4              98  ---  Lifetime Power-On Resets
0x01  0x010  4             367  ---  Power-on Hours
0x01  0x018  6       194707456  ---  Logical Sectors Written
0x01  0x020  6         2757508  ---  Number of Write Commands
0x01  0x028  6       146014208  ---  Logical Sectors Read
0x01  0x030  6         2755664  ---  Number of Read Commands
0x01  =====  =               =  ===  == General Statistics (rev 1) ==
0x01  0x008  4              98  ---  Lifetime Power-On Resets
0x01  0x010  4             367  ---  Power-on Hours
0x01  0x018  6       194707456  ---  Logical Sectors Written
0x01  0x020  6         2757508  ---  Number of Write Commands
0x01  0x028  6       146014208  ---  Logical Sectors Read
0x01  0x030  6         2755664  ---  Number of Read Commands
0x01  =====  =               =  ===  == General Statistics (rev 1) ==
0x01  0x008  4              98  ---  Lifetime Power-On Resets
0x01  0x010  4             367  ---  Power-on Hours
0x01  0x018  6       194707456  ---  Logical Sectors Written
0x01  0x020  6         2757508  ---  Number of Write Commands
0x01  0x028  6       146014208  ---  Logical Sectors Read
0x01  0x030  6         2755664  ---  Number of Read Commands
0x01  =====  =               =  ===  == General Statistics (rev 1) ==
0x01  0x008  4              98  ---  Lifetime Power-On Resets
0x01  0x010  4             367  ---  Power-on Hours
0x01  0x018  6       194707456  ---  Logical Sectors Written
0x01  0x020  6         2757508  ---  Number of Write Commands
0x01  0x028  6       146014208  ---  Logical Sectors Read
0x01  0x030  6         2755664  ---  Number of Read Commands
                                |||_ C monitored condition met
                                ||__ D supports DSN
                                |___ N normalized value

Pending Defects log (GP Log 0x0c) not supported

SATA Phy Event Counters (GP Log 0x11)
ID      Size     Value  Description
0x0001  4            0  Command failed due to ICRC error
0x0009  4          222  Transition from drive PhyRdy to drive PhyNRdy
0x000a  4          424  Device-to-host register FISes sent due to a COMRESET
0x000b  4            0  CRC errors within host-to-device FIS
0x000d  4            0  Non-CRC errors within host-to-device FIS

