smartctl 7.4 2023-08-01 r5530 [x86_64-linux-6.6.9-100.fc38.x86_64] (local build)
Copyright (C) 2002-23, Bruce Allen, Christian Franke, www.smartmontools.org

=== START OF INFORMATION SECTION ===
Model Number:                       PM961 NVMe SAMSUNG 512GB
Serial Number:                      --
Firmware Version:                   CXY74D1Q
PCI Vendor/Subsystem ID:            0x144d
IEEE OUI Identifier:                0x002538
Total NVM Capacity:                 512,110,190,592 [512 GB]
Unallocated NVM Capacity:           0
Controller ID:                      2
NVMe Version:                       1.2
Number of Namespaces:               1
Namespace 1 Size/Capacity:          512,110,190,592 [512 GB]
Namespace 1 Utilization:            423,949,377,536 [423 GB]
Namespace 1 Formatted LBA Size:     512
Namespace 1 IEEE EUI-64:            002538 ...
Local Time is:                      Wed Jan 10 14:03:32 2024 CET
Firmware Updates (0x16):            3 Slots, no Reset required
Optional Admin Commands (0x0017):   Security Format Frmw_DL Self_Test
Optional NVM Commands (0x001f):     Comp Wr_Unc DS_Mngmt Wr_Zero Sav/Sel_Feat
Log Page Attributes (0x02):         Cmd_Eff_Lg
Warning  Comp. Temp. Threshold:     68 Celsius
Critical Comp. Temp. Threshold:     71 Celsius

Supported Power States
St Op     Max   Active     Idle   RL RT WL WT  Ent_Lat  Ex_Lat
 0 +     7.60W       -        -    0  0  0  0        0       0
 1 +     5.00W       -        -    1  1  1  1        0       0
 2 +     3.60W       -        -    2  2  2  2        0       0
 3 -   0.0400W       -        -    3  3  3  3      210    1500
 4 -   0.0050W       -        -    4  4  4  4     2200    6000

Supported LBA Sizes (NSID 0x1)
Id Fmt  Data  Metadt  Rel_Perf
 0 +     512       0         0

=== START OF SMART DATA SECTION ===
SMART overall-health self-assessment test result: PASSED

SMART/Health Information (NVMe Log 0x02)
Critical Warning:                   0x00
Temperature:                        26 Celsius
Available Spare:                    100%
Available Spare Threshold:          50%
Percentage Used:                    2%
Data Units Read:                    55,782,967 [28.5 TB]
Data Units Written:                 37,457,018 [19.1 TB]
Host Read Commands:                 448,775,613
Host Write Commands:                389,354,328
Controller Busy Time:               1,932
Power Cycles:                       2,238
Power On Hours:                     2,853
Unsafe Shutdowns:                   370
Media and Data Integrity Errors:    0
Error Information Log Entries:      8,420
Warning  Comp. Temperature Time:    2263
Critical Comp. Temperature Time:    1219
Temperature Sensor 1:               26 Celsius
Temperature Sensor 2:               31 Celsius

Error Information (NVMe Log 0x01, 16 of 64 entries)
Num   ErrCount  SQId   CmdId  Status  PELoc          LBA  NSID    VS  Message
  0       8420     0  0x0000  0x4004      -            0     0     -  Invalid Field in Command
  1       8419     0  0x0009  0x4016  0x004            0     1     -  Invalid Namespace or Format
  2       8418     0  0x0009  0x4016  0x004            0     1     -  Invalid Namespace or Format
  3       8417     0  0x0009  0x4016  0x004            0     1     -  Invalid Namespace or Format
  4       8416     0  0x0008  0x4004      -            0     0     -  Invalid Field in Command
  5       8415     0  0x0009  0x4016  0x004            0     1     -  Invalid Namespace or Format
  6       8414     0  0x0010  0x4004      -            0     0     -  Invalid Field in Command
  7       8413     0  0x0009  0x4016  0x004            0     1     -  Invalid Namespace or Format
  8       8412     0  0x0009  0x4016  0x004            0     1     -  Invalid Namespace or Format
  9       8411     0  0x0010  0x4004      -            0     0     -  Invalid Field in Command
 10       8410     0  0x0009  0x4016  0x004            0     1     -  Invalid Namespace or Format
 11       8409     0  0x0008  0x4004      -            0     0     -  Invalid Field in Command
 12       8408     0  0x0009  0x4016  0x004            0     1     -  Invalid Namespace or Format
 13       8407     0  0x0008  0x4004      -            0     0     -  Invalid Field in Command
 14       8406     0  0x0009  0x4016  0x004            0     1     -  Invalid Namespace or Format
 15       8405     0  0x500c  0x4004      -            0     0     -  Invalid Field in Command
... (48 entries not read)

Self-test Log (NVMe Log 0x06)
Self-test status: No self-test in progress
Num  Test_Description  Status                       Power_on_Hours  Failing_LBA  NSID Seg SCT Code
 0   Short             Aborted: Self-test command                1            -     -   -   -    -

