smartctl 7.4 2023-08-01 r5530 [x86_64-linux-6.14.0-15-generic] (local build)
Copyright (C) 2002-23, Bruce Allen, Christian Franke, www.smartmontools.org

=== START OF INFORMATION SECTION ===
Model Number:                       APPLE SSD AP0256J
Serial Number:                      --
Firmware Version:                   9.134.01
PCI Vendor/Subsystem ID:            0x106b
IEEE OUI Identifier:                0x000502
Controller ID:                      0
NVMe Version:                       <1.2
Number of Namespaces:               2
Namespace 1 Size/Capacity:          251,000,193,024 [251 GB]
Namespace 1 Formatted LBA Size:     4096
Namespace 1 IEEE EUI-64:            62da47 ...
Local Time is:                      Mon May 12 20:28:02 2025 CDT
Firmware Updates (0x02):            1 Slot
Optional Admin Commands (0x0004):   Frmw_DL
Optional NVM Commands (0x0004):     DS_Mngmt
Maximum Data Transfer Size:         256 Pages

Supported Power States
St Op     Max   Active     Idle   RL RT WL WT  Ent_Lat  Ex_Lat
 0 +     0.00W       -        -    0  0  0  0        0       0

Supported LBA Sizes (NSID 0x1)
Id Fmt  Data  Metadt  Rel_Perf
 0 +    4096       0         0

=== START OF SMART DATA SECTION ===
SMART overall-health self-assessment test result: PASSED

SMART/Health Information (NVMe Log 0x02)
Critical Warning:                   0x00
Temperature:                        41 Celsius
Available Spare:                    81%
Available Spare Threshold:          2%
Percentage Used:                    1%
Data Units Read:                    30,166,459 [15.4 TB]
Data Units Written:                 25,928,507 [13.2 TB]
Host Read Commands:                 246,726,610
Host Write Commands:                243,731,537
Controller Busy Time:               0
Power Cycles:                       26,804
Power On Hours:                     169
Unsafe Shutdowns:                   44
Media and Data Integrity Errors:    0
Error Information Log Entries:      0

Read 1 entries from Error Information Log failed: Invalid Log Page (0x109)



