smartctl 7.2 2020-12-30 r5155 [x86_64-linux-5.10.34-1-MANJARO] (local build)
Copyright (C) 2002-20, Bruce Allen, Christian Franke, www.smartmontools.org

=== START OF INFORMATION SECTION ===
Model Family:     Western Digital AV-GP (AF)
Device Model:     WDC WD10EURX-62C57Y0
Serial Number:    --
LU WWN Device Id: 5 0014ee ...
Firmware Version: 01.01A01
User Capacity:    1,000,442,806,272 bytes [1.00 TB]
Sector Sizes:     512 bytes logical, 4096 bytes physical
Rotation Rate:    5400 rpm
Device is:        In smartctl database [for details use: -P show]
ATA Version is:   ACS-2 (minor revision not indicated)
SATA Version is:  SATA 3.0, 6.0 Gb/s (current: 6.0 Gb/s)
Local Time is:    Sun May 23 16:32:21 2021 IST
SMART support is: Available - device has SMART capability.
SMART support is: Enabled
AAM feature is:   Unavailable
APM feature is:   Unavailable
Rd look-ahead is: Enabled
Write cache is:   Enabled
DSN feature is:   Unavailable
ATA Security is:  Unavailable
Wt Cache Reorder: Unavailable

=== START OF READ SMART DATA SECTION ===
SMART overall-health self-assessment test result: PASSED

General SMART Values:
Offline data collection status:  (0x00)	Offline data collection activity
					was never started.
					Auto Offline Data Collection: Disabled.
Self-test execution status:      (   0)	The previous self-test routine completed
					without error or no self-test has ever 
					been run.
Total time to complete Offline 
data collection: 		(13440) seconds.
Offline data collection
capabilities: 			 (0x7b) SMART execute Offline immediate.
					Auto Offline data collection on/off support.
					Suspend Offline collection upon new
					command.
					Offline surface scan supported.
					Self-test supported.
					Conveyance Self-test supported.
					Selective Self-test supported.
SMART capabilities:            (0x0003)	Saves SMART data before entering
					power-saving mode.
					Supports SMART auto save timer.
Error logging capability:        (0x01)	Error logging supported.
					General Purpose Logging supported.
Short self-test routine 
recommended polling time: 	 (   2) minutes.
Extended self-test routine
recommended polling time: 	 ( 153) minutes.
Conveyance self-test routine
recommended polling time: 	 (   5) minutes.

SMART Attributes Data Structure revision number: 16
Vendor Specific SMART Attributes with Thresholds:
ID# ATTRIBUTE_NAME          FLAGS    VALUE WORST THRESH FAIL RAW_VALUE
  1 Raw_Read_Error_Rate     POSR-K   200   200   051    -    0
  3 Spin_Up_Time            POS--K   136   129   021    -    4200
  4 Start_Stop_Count        -O--CK   100   100   000    -    657
  5 Reallocated_Sector_Ct   PO--CK   200   200   140    -    0
  7 Seek_Error_Rate         -OSR-K   200   200   000    -    0
  9 Power_On_Hours          -O--CK   085   085   000    -    11205
 10 Spin_Retry_Count        -O--CK   100   100   000    -    0
 11 Calibration_Retry_Count -O--CK   100   100   000    -    0
 12 Power_Cycle_Count       -O--CK   100   100   000    -    656
192 Power-Off_Retract_Count -O--CK   200   200   000    -    637
193 Load_Cycle_Count        -O--CK   200   200   000    -    380
194 Temperature_Celsius     -O---K   115   096   000    -    28
196 Reallocated_Event_Count -O--CK   200   200   000    -    0
197 Current_Pending_Sector  -O--CK   200   200   000    -    0
198 Offline_Uncorrectable   ----CK   100   253   000    -    0
199 UDMA_CRC_Error_Count    -O--CK   200   200   000    -    0
200 Multi_Zone_Error_Rate   ---R--   100   253   000    -    0
                            ||||||_ K auto-keep
                            |||||__ C event count
                            ||||___ R error rate
                            |||____ S speed/performance
                            ||_____ O updated online
                            |______ P prefailure warning

General Purpose Log Directory Version 1
SMART           Log Directory Version 1 [multi-sector log support]
Address    Access  R/W   Size  Description
0x00       GPL,SL  R/O      1  Log Directory
0x01           SL  R/O      1  Summary SMART error log
0x02           SL  R/O      5  Comprehensive SMART error log
0x03       GPL     R/O      6  Ext. Comprehensive SMART error log
0x06           SL  R/O      1  SMART self-test log
0x07       GPL     R/O      1  Extended self-test log
0x09           SL  R/W      1  Selective self-test log
0x10       GPL     R/O      1  NCQ Command Error log
0x11       GPL     R/O      1  SATA Phy Event Counters log
0x21       GPL     R/O      1  Write stream error log
0x22       GPL     R/O      1  Read stream error log
0x80-0x9f  GPL,SL  R/W     16  Host vendor specific log
0xa0-0xa7  GPL,SL  VS      16  Device vendor specific log
0xa8-0xb7  GPL,SL  VS       1  Device vendor specific log
0xbd       GPL,SL  VS       1  Device vendor specific log
0xc0       GPL,SL  VS       1  Device vendor specific log
0xc1       GPL     VS      93  Device vendor specific log
0xe0       GPL,SL  R/W      1  SCT Command/Status
0xe1       GPL,SL  R/W      1  SCT Data Transfer

SMART Extended Comprehensive Error Log Version: 1 (6 sectors)
Device Error Count: 586 (device log contains only the most recent 24 errors)
	CR     = Command Register
	FEATR  = Features Register
	COUNT  = Count (was: Sector Count) Register
	LBA_48 = Upper bytes of LBA High/Mid/Low Registers ]  ATA-8
	LH     = LBA High (was: Cylinder High) Register    ]   LBA
	LM     = LBA Mid (was: Cylinder Low) Register      ] Register
	LL     = LBA Low (was: Sector Number) Register     ]
	DV     = Device (was: Device/Head) Register
	DC     = Device Control Register
	ER     = Error register
	ST     = Status register
Powered_Up_Time is measured from power on, and printed as
DDd+hh:mm:SS.sss where DD=days, hh=hours, mm=minutes,
SS=sec, and sss=millisec. It "wraps" after 49.710 days.

Error 586 [9] occurred at disk power-on lifetime: 2557 hours (106 days + 13 hours)
  When the command that caused the error occurred, the device was active or idle.

  After command completion occurred, registers were:
  ER -- ST COUNT  LBA_48  LH LM LL DV DC
  -- -- -- == -- == == == -- -- -- -- --
  10 -- 51 00 01 ff ff ff ff ff ff 40 00  Error: IDNF at LBA = 0xffffffffffff = 281474976710655

  Commands leading to the command that caused the error were:
  CR FEATR COUNT  LBA_48  LH LM LL DV DC  Powered_Up_Time  Command/Feature_Name
  -- == -- == -- == == == -- -- -- -- --  ---------------  --------------------
  24 00 00 00 01 ff ff ff ff ff ff 40 08     00:00:13.130  READ SECTOR(S) EXT
  35 00 00 00 01 00 00 01 ff ff ff 40 08     00:00:13.130  WRITE DMA EXT
  25 00 00 00 01 00 00 0b 00 00 01 40 08     00:00:13.087  READ DMA EXT
  25 00 00 00 02 00 00 00 00 00 0a 40 08     00:00:13.072  READ DMA EXT
  ec 00 00 00 01 00 00 00 00 00 00 40 08     00:00:13.071  IDENTIFY DEVICE

Error 585 [8] occurred at disk power-on lifetime: 2555 hours (106 days + 11 hours)
  When the command that caused the error occurred, the device was active or idle.

  After command completion occurred, registers were:
  ER -- ST COUNT  LBA_48  LH LM LL DV DC
  -- -- -- == -- == == == -- -- -- -- --
  10 -- 51 00 01 ff ff ff ff ff ff 40 00  Error: IDNF at LBA = 0xffffffffffff = 281474976710655

  Commands leading to the command that caused the error were:
  CR FEATR COUNT  LBA_48  LH LM LL DV DC  Powered_Up_Time  Command/Feature_Name
  -- == -- == -- == == == -- -- -- -- --  ---------------  --------------------
  24 00 00 00 01 ff ff ff ff ff ff 40 08     00:00:12.275  READ SECTOR(S) EXT
  35 00 00 00 01 00 00 01 ff ff ff 40 08     00:00:12.274  WRITE DMA EXT
  25 00 00 00 01 00 00 0b 00 00 01 40 08     00:00:12.231  READ DMA EXT
  25 00 00 00 02 00 00 00 00 00 0a 40 08     00:00:12.216  READ DMA EXT
  ec 00 00 00 01 00 00 00 00 00 00 40 08     00:00:12.216  IDENTIFY DEVICE

Error 584 [7] occurred at disk power-on lifetime: 2549 hours (106 days + 5 hours)
  When the command that caused the error occurred, the device was active or idle.

  After command completion occurred, registers were:
  ER -- ST COUNT  LBA_48  LH LM LL DV DC
  -- -- -- == -- == == == -- -- -- -- --
  10 -- 51 00 01 ff ff ff ff ff ff 40 00  Error: IDNF at LBA = 0xffffffffffff = 281474976710655

  Commands leading to the command that caused the error were:
  CR FEATR COUNT  LBA_48  LH LM LL DV DC  Powered_Up_Time  Command/Feature_Name
  -- == -- == -- == == == -- -- -- -- --  ---------------  --------------------
  24 00 00 00 01 ff ff ff ff ff ff 40 08     00:00:12.197  READ SECTOR(S) EXT
  35 00 00 00 01 00 00 01 ff ff ff 40 08     00:00:12.197  WRITE DMA EXT
  25 00 00 00 01 00 00 0b 00 00 01 40 08     00:00:12.154  READ DMA EXT
  25 00 00 00 02 00 00 00 00 00 0a 40 08     00:00:12.139  READ DMA EXT
  ec 00 00 00 01 00 00 00 00 00 00 40 08     00:00:12.138  IDENTIFY DEVICE

Error 583 [6] occurred at disk power-on lifetime: 2548 hours (106 days + 4 hours)
  When the command that caused the error occurred, the device was active or idle.

  After command completion occurred, registers were:
  ER -- ST COUNT  LBA_48  LH LM LL DV DC
  -- -- -- == -- == == == -- -- -- -- --
  10 -- 51 00 01 ff ff ff ff ff ff 40 00  Error: IDNF at LBA = 0xffffffffffff = 281474976710655

  Commands leading to the command that caused the error were:
  CR FEATR COUNT  LBA_48  LH LM LL DV DC  Powered_Up_Time  Command/Feature_Name
  -- == -- == -- == == == -- -- -- -- --  ---------------  --------------------
  24 00 00 00 01 ff ff ff ff ff ff 40 08     00:00:13.763  READ SECTOR(S) EXT
  35 00 00 00 01 00 00 01 ff ff ff 40 08     00:00:13.762  WRITE DMA EXT
  25 00 00 00 01 00 00 0b 00 00 01 40 08     00:00:13.719  READ DMA EXT
  25 00 00 00 02 00 00 00 00 00 0a 40 08     00:00:13.706  READ DMA EXT
  ec 00 00 00 01 00 00 00 00 00 00 40 08     00:00:13.704  IDENTIFY DEVICE

Error 582 [5] occurred at disk power-on lifetime: 2547 hours (106 days + 3 hours)
  When the command that caused the error occurred, the device was active or idle.

  After command completion occurred, registers were:
  ER -- ST COUNT  LBA_48  LH LM LL DV DC
  -- -- -- == -- == == == -- -- -- -- --
  10 -- 51 00 01 ff ff ff ff ff ff 40 00  Error: IDNF at LBA = 0xffffffffffff = 281474976710655

  Commands leading to the command that caused the error were:
  CR FEATR COUNT  LBA_48  LH LM LL DV DC  Powered_Up_Time  Command/Feature_Name
  -- == -- == -- == == == -- -- -- -- --  ---------------  --------------------
  24 00 00 00 01 ff ff ff ff ff ff 40 08     00:00:12.675  READ SECTOR(S) EXT
  35 00 00 00 01 00 00 01 ff ff ff 40 08     00:00:12.674  WRITE DMA EXT
  25 00 00 00 01 00 00 0b 00 00 01 40 08     00:00:12.631  READ DMA EXT
  25 00 00 00 02 00 00 00 00 00 0a 40 08     00:00:12.617  READ DMA EXT
  ec 00 00 00 01 00 00 00 00 00 00 40 08     00:00:12.617  IDENTIFY DEVICE

Error 581 [4] occurred at disk power-on lifetime: 2539 hours (105 days + 19 hours)
  When the command that caused the error occurred, the device was active or idle.

  After command completion occurred, registers were:
  ER -- ST COUNT  LBA_48  LH LM LL DV DC
  -- -- -- == -- == == == -- -- -- -- --
  10 -- 51 00 01 ff ff ff ff ff ff 40 00  Error: IDNF at LBA = 0xffffffffffff = 281474976710655

  Commands leading to the command that caused the error were:
  CR FEATR COUNT  LBA_48  LH LM LL DV DC  Powered_Up_Time  Command/Feature_Name
  -- == -- == -- == == == -- -- -- -- --  ---------------  --------------------
  24 00 00 00 01 ff ff ff ff ff ff 40 08     00:00:12.308  READ SECTOR(S) EXT
  35 00 00 00 01 00 00 01 ff ff ff 40 08     00:00:12.308  WRITE DMA EXT
  25 00 00 00 01 00 00 0b 00 00 01 40 08     00:00:12.265  READ DMA EXT
  25 00 00 00 02 00 00 00 00 00 0a 40 08     00:00:12.250  READ DMA EXT
  ec 00 00 00 01 00 00 00 00 00 00 40 08     00:00:12.249  IDENTIFY DEVICE

Error 580 [3] occurred at disk power-on lifetime: 2533 hours (105 days + 13 hours)
  When the command that caused the error occurred, the device was active or idle.

  After command completion occurred, registers were:
  ER -- ST COUNT  LBA_48  LH LM LL DV DC
  -- -- -- == -- == == == -- -- -- -- --
  10 -- 51 00 01 ff ff ff ff ff ff 40 00  Error: IDNF at LBA = 0xffffffffffff = 281474976710655

  Commands leading to the command that caused the error were:
  CR FEATR COUNT  LBA_48  LH LM LL DV DC  Powered_Up_Time  Command/Feature_Name
  -- == -- == -- == == == -- -- -- -- --  ---------------  --------------------
  24 00 00 00 01 ff ff ff ff ff ff 40 08     00:00:12.131  READ SECTOR(S) EXT
  35 00 00 00 01 00 00 01 ff ff ff 40 08     00:00:12.130  WRITE DMA EXT
  25 00 00 00 01 00 00 0b 00 00 01 40 08     00:00:12.087  READ DMA EXT
  25 00 00 00 02 00 00 00 00 00 0a 40 08     00:00:12.072  READ DMA EXT
  ec 00 00 00 01 00 00 00 00 00 00 40 08     00:00:12.072  IDENTIFY DEVICE

Error 579 [2] occurred at disk power-on lifetime: 2533 hours (105 days + 13 hours)
  When the command that caused the error occurred, the device was active or idle.

  After command completion occurred, registers were:
  ER -- ST COUNT  LBA_48  LH LM LL DV DC
  -- -- -- == -- == == == -- -- -- -- --
  10 -- 51 00 01 ff ff ff ff ff ff 40 00  Error: IDNF at LBA = 0xffffffffffff = 281474976710655

  Commands leading to the command that caused the error were:
  CR FEATR COUNT  LBA_48  LH LM LL DV DC  Powered_Up_Time  Command/Feature_Name
  -- == -- == -- == == == -- -- -- -- --  ---------------  --------------------
  24 00 00 00 01 ff ff ff ff ff ff 40 08     00:00:13.707  READ SECTOR(S) EXT
  35 00 00 00 01 00 00 01 ff ff ff 40 08     00:00:13.707  WRITE DMA EXT
  25 00 00 00 01 00 00 0b 00 00 01 40 08     00:00:13.664  READ DMA EXT
  25 00 00 00 02 00 00 00 00 00 0a 40 08     00:00:13.650  READ DMA EXT
  ec 00 00 00 01 00 00 00 00 00 00 40 08     00:00:13.649  IDENTIFY DEVICE

SMART Extended Self-test Log Version: 1 (1 sectors)
No self-tests have been logged.  [To run self-tests, use: smartctl -t]

SMART Selective self-test log data structure revision number 1
 SPAN  MIN_LBA  MAX_LBA  CURRENT_TEST_STATUS
    1        0        0  Not_testing
    2        0        0  Not_testing
    3        0        0  Not_testing
    4        0        0  Not_testing
    5        0        0  Not_testing
Selective self-test flags (0x0):
  After scanning selected spans, do NOT read-scan remainder of disk.
If Selective self-test is pending on power-up, resume after 0 minute delay.

SCT Commands not supported

Device Statistics (GP/SMART Log 0x04) not supported

Pending Defects log (GP Log 0x0c) not supported

SATA Phy Event Counters (GP Log 0x11)
ID      Size     Value  Description
0x0001  2            0  Command failed due to ICRC error
0x0002  2            0  R_ERR response for data FIS
0x0003  2            0  R_ERR response for device-to-host data FIS
0x0004  2            0  R_ERR response for host-to-device data FIS
0x0005  2            0  R_ERR response for non-data FIS
0x0006  2            0  R_ERR response for device-to-host non-data FIS
0x0007  2            0  R_ERR response for host-to-device non-data FIS
0x0008  2            0  Device-to-host non-data FIS retries
0x0009  2        24765  Transition from drive PhyRdy to drive PhyNRdy
0x000a  2            3  Device-to-host register FISes sent due to a COMRESET
0x000b  2            0  CRC errors within host-to-device FIS
0x000f  2            0  R_ERR response for host-to-device data FIS, CRC
0x0012  2            0  R_ERR response for host-to-device non-data FIS, CRC
0x8000  4       245737  Vendor specific

