smartctl 7.2 2020-12-30 r5155 [x86_64-linux-5.19.0-0.deb11.2-amd64] (local build)
Copyright (C) 2002-20, Bruce Allen, Christian Franke, www.smartmontools.org

=== START OF INFORMATION SECTION ===
Model Number:                       Samsung SSD 970 EVO Plus 500GB
Serial Number:                      --
Firmware Version:                   2B2QEXM7
PCI Vendor/Subsystem ID:            0x144d
IEEE OUI Identifier:                0x002538
Total NVM Capacity:                 500,107,862,016 [500 GB]
Unallocated NVM Capacity:           0
Controller ID:                      4
NVMe Version:                       1.3
Number of Namespaces:               1
Namespace 1 Size/Capacity:          500,107,862,016 [500 GB]
Namespace 1 Utilization:            81,523,724,288 [81.5 GB]
Namespace 1 Formatted LBA Size:     512
Namespace 1 IEEE EUI-64:            002538 ...
Local Time is:                      Tue Nov  1 14:22:14 2022 +05
Firmware Updates (0x16):            3 Slots, no Reset required
Optional Admin Commands (0x0017):   Security Format Frmw_DL Self_Test
Optional NVM Commands (0x005f):     Comp Wr_Unc DS_Mngmt Wr_Zero Sav/Sel_Feat Timestmp
Log Page Attributes (0x03):         S/H_per_NS Cmd_Eff_Lg
Maximum Data Transfer Size:         512 Pages
Warning  Comp. Temp. Threshold:     85 Celsius
Critical Comp. Temp. Threshold:     85 Celsius

Supported Power States
St Op     Max   Active     Idle   RL RT WL WT  Ent_Lat  Ex_Lat
 0 +     7.80W       -        -    0  0  0  0        0       0
 1 +     6.00W       -        -    1  1  1  1        0       0
 2 +     3.40W       -        -    2  2  2  2        0       0
 3 -   0.0700W       -        -    3  3  3  3      210    1200
 4 -   0.0100W       -        -    4  4  4  4     2000    8000

Supported LBA Sizes (NSID 0x1)
Id Fmt  Data  Metadt  Rel_Perf
 0 +     512       0         0

=== START OF SMART DATA SECTION ===
SMART overall-health self-assessment test result: PASSED

SMART/Health Information (NVMe Log 0x02)
Critical Warning:                   0x00
Temperature:                        44 Celsius
Available Spare:                    100%
Available Spare Threshold:          10%
Percentage Used:                    0%
Data Units Read:                    734,141 [375 GB]
Data Units Written:                 940,032 [481 GB]
Host Read Commands:                 77,678,349
Host Write Commands:                3,523,233
Controller Busy Time:               22
Power Cycles:                       21
Power On Hours:                     6
Unsafe Shutdowns:                   12
Media and Data Integrity Errors:    0
Error Information Log Entries:      31
Warning  Comp. Temperature Time:    0
Critical Comp. Temperature Time:    0
Temperature Sensor 1:               44 Celsius
Temperature Sensor 2:               43 Celsius

Error Information (NVMe Log 0x01, 16 of 64 entries)
Num   ErrCount  SQId   CmdId  Status  PELoc          LBA  NSID    VS
  0         31     0  0x1017  0x4004      -            0     0     -



