smartctl 7.1 2019-12-30 r5022 [x86_64-linux-5.10.0-amd64-desktop] (local build)
Copyright (C) 2002-19, Bruce Allen, Christian Franke, www.smartmontools.org

=== START OF INFORMATION SECTION ===
Model Number:                       ADATA SX6000LNP
Serial Number:                      --
Firmware Version:                   SN09843
PCI Vendor/Subsystem ID:            0x1e4b
IEEE OUI Identifier:                0x3a5a27
Total NVM Capacity:                 512,110,190,592 [512 GB]
Unallocated NVM Capacity:           0
Controller ID:                      0
Number of Namespaces:               1
Namespace 1 Size/Capacity:          512,110,190,592 [512 GB]
Namespace 1 Utilization:            1,916,974,080 [1.91 GB]
Namespace 1 Formatted LBA Size:     512
Namespace 1 IEEE EUI-64:            3a5a27 ...
Local Time is:                      Thu Jan  4 09:02:06 2024 CST
Firmware Updates (0x14):            2 Slots, no Reset required
Optional Admin Commands (0x0017):   Security Format Frmw_DL Self_Test
Optional NVM Commands (0x001f):     Comp Wr_Unc DS_Mngmt Wr_Zero Sav/Sel_Feat
Maximum Data Transfer Size:         128 Pages
Warning  Comp. Temp. Threshold:     90 Celsius
Critical Comp. Temp. Threshold:     95 Celsius

Supported Power States
St Op     Max   Active     Idle   RL RT WL WT  Ent_Lat  Ex_Lat
 0 +     6.50W       -        -    0  0  0  0        0       0
 1 +     5.80W       -        -    1  1  1  1        0       0
 2 +     3.60W       -        -    2  2  2  2        0       0
 3 -   0.7460W       -        -    3  3  3  3     5000   10000
 4 -   0.7260W       -        -    4  4  4  4     8000   45000

Supported LBA Sizes (NSID 0x1)
Id Fmt  Data  Metadt  Rel_Perf
 0 +     512       0         0

=== START OF SMART DATA SECTION ===
SMART overall-health self-assessment test result: PASSED

SMART/Health Information (NVMe Log 0x02)
Critical Warning:                   0x00
Temperature:                        37 Celsius
Available Spare:                    100%
Available Spare Threshold:          10%
Percentage Used:                    1%
Data Units Read:                    4,630,757 [2.37 TB]
Data Units Written:                 7,863,201 [4.02 TB]
Host Read Commands:                 41,451,156
Host Write Commands:                178,438,644
Controller Busy Time:               102
Power Cycles:                       396
Power On Hours:                     1,305
Unsafe Shutdowns:                   101
Media and Data Integrity Errors:    0
Error Information Log Entries:      0
Warning  Comp. Temperature Time:    0
Critical Comp. Temperature Time:    0
Temperature Sensor 1:               37 Celsius
Temperature Sensor 2:               30 Celsius

Error Information (NVMe Log 0x01, max 64 entries)
No Errors Logged

