smartctl 7.2 2020-12-30 r5155 [x86_64-linux-5.11.12-1-ck] (local build)
Copyright (C) 2002-20, Bruce Allen, Christian Franke, www.smartmontools.org

=== START OF INFORMATION SECTION ===
Model Family:     Western Digital Caviar Green
Device Model:     WDC WD10EADS-22M2B0
Serial Number:    --
LU WWN Device Id: 5 0014ee ...
Firmware Version: 01.00A01
User Capacity:    1,000,204,886,016 bytes [1.00 TB]
Sector Size:      512 bytes logical/physical
Device is:        In smartctl database [for details use: -P show]
ATA Version is:   ATA8-ACS (minor revision not indicated)
SATA Version is:  SATA 2.6, 3.0 Gb/s
Local Time is:    Sun Apr 11 20:41:48 2021 CEST
SMART support is: Available - device has SMART capability.
SMART support is: Enabled
AAM feature is:   Disabled
APM feature is:   Unavailable
Rd look-ahead is: Enabled
Write cache is:   Enabled
DSN feature is:   Unavailable
ATA Security is:  Disabled, NOT FROZEN [SEC1]
Wt Cache Reorder: Enabled

=== START OF READ SMART DATA SECTION ===
SMART overall-health self-assessment test result: PASSED

General SMART Values:
Offline data collection status:  (0x82)	Offline data collection activity
					was completed without error.
					Auto Offline Data Collection: Enabled.
Self-test execution status:      (   0)	The previous self-test routine completed
					without error or no self-test has ever 
					been run.
Total time to complete Offline 
data collection: 		(20760) seconds.
Offline data collection
capabilities: 			 (0x7b) SMART execute Offline immediate.
					Auto Offline data collection on/off support.
					Suspend Offline collection upon new
					command.
					Offline surface scan supported.
					Self-test supported.
					Conveyance Self-test supported.
					Selective Self-test supported.
SMART capabilities:            (0x0003)	Saves SMART data before entering
					power-saving mode.
					Supports SMART auto save timer.
Error logging capability:        (0x01)	Error logging supported.
					General Purpose Logging supported.
Short self-test routine 
recommended polling time: 	 (   2) minutes.
Extended self-test routine
recommended polling time: 	 ( 239) minutes.
Conveyance self-test routine
recommended polling time: 	 (   5) minutes.
SCT capabilities: 	       (0x3037)	SCT Status supported.
					SCT Feature Control supported.
					SCT Data Table supported.

SMART Attributes Data Structure revision number: 16
Vendor Specific SMART Attributes with Thresholds:
ID# ATTRIBUTE_NAME          FLAGS    VALUE WORST THRESH FAIL RAW_VALUE
  1 Raw_Read_Error_Rate     POSR-K   200   199   051    -    27
  3 Spin_Up_Time            POS--K   108   100   021    -    7575
  4 Start_Stop_Count        -O--CK   090   090   000    -    10688
  5 Reallocated_Sector_Ct   PO--CK   200   200   140    -    0
  7 Seek_Error_Rate         -OSR-K   100   253   000    -    0
  9 Power_On_Hours          -O--CK   074   074   000    -    19335
 10 Spin_Retry_Count        -O--CK   100   100   000    -    0
 11 Calibration_Retry_Count -O--CK   100   100   000    -    0
 12 Power_Cycle_Count       -O--CK   092   092   000    -    8692
192 Power-Off_Retract_Count -O--CK   199   199   000    -    774
193 Load_Cycle_Count        -O--CK   040   040   000    -    480708
194 Temperature_Celsius     -O---K   125   089   000    -    22
196 Reallocated_Event_Count -O--CK   200   200   000    -    0
197 Current_Pending_Sector  -O--CK   200   200   000    -    0
198 Offline_Uncorrectable   ----CK   200   200   000    -    0
199 UDMA_CRC_Error_Count    -O--CK   200   200   000    -    0
200 Multi_Zone_Error_Rate   ---R--   200   200   000    -    0
                            ||||||_ K auto-keep
                            |||||__ C event count
                            ||||___ R error rate
                            |||____ S speed/performance
                            ||_____ O updated online
                            |______ P prefailure warning

General Purpose Log Directory Version 1
SMART           Log Directory Version 1 [multi-sector log support]
Address    Access  R/W   Size  Description
0x00       GPL,SL  R/O      1  Log Directory
0x01           SL  R/O      1  Summary SMART error log
0x02           SL  R/O      5  Comprehensive SMART error log
0x03       GPL     R/O      6  Ext. Comprehensive SMART error log
0x06           SL  R/O      1  SMART self-test log
0x07       GPL     R/O      1  Extended self-test log
0x09           SL  R/W      1  Selective self-test log
0x10       GPL     R/O      1  NCQ Command Error log
0x11       GPL     R/O      1  SATA Phy Event Counters log
0x80-0x9f  GPL,SL  R/W     16  Host vendor specific log
0xa0-0xa7  GPL,SL  VS      16  Device vendor specific log
0xa8-0xb7  GPL,SL  VS       1  Device vendor specific log
0xc0       GPL,SL  VS       1  Device vendor specific log
0xc1       GPL     VS      24  Device vendor specific log
0xe0       GPL,SL  R/W      1  SCT Command/Status
0xe1       GPL,SL  R/W      1  SCT Data Transfer

SMART Extended Comprehensive Error Log Version: 1 (6 sectors)
Device Error Count: 18932 (device log contains only the most recent 24 errors)
	CR     = Command Register
	FEATR  = Features Register
	COUNT  = Count (was: Sector Count) Register
	LBA_48 = Upper bytes of LBA High/Mid/Low Registers ]  ATA-8
	LH     = LBA High (was: Cylinder High) Register    ]   LBA
	LM     = LBA Mid (was: Cylinder Low) Register      ] Register
	LL     = LBA Low (was: Sector Number) Register     ]
	DV     = Device (was: Device/Head) Register
	DC     = Device Control Register
	ER     = Error register
	ST     = Status register
Powered_Up_Time is measured from power on, and printed as
DDd+hh:mm:SS.sss where DD=days, hh=hours, mm=minutes,
SS=sec, and sss=millisec. It "wraps" after 49.710 days.

Error 18932 [19] occurred at disk power-on lifetime: 14876 hours (619 days + 20 hours)
  When the command that caused the error occurred, the device was active or idle.

  After command completion occurred, registers were:
  ER -- ST COUNT  LBA_48  LH LM LL DV DC
  -- -- -- == -- == == == -- -- -- -- --
  40 -- 51 01 00 00 41 00 98 17 29 40 00  Error: UNC at LBA = 0x4100981729 = 279182841641

  Commands leading to the command that caused the error were:
  CR FEATR COUNT  LBA_48  LH LM LL DV DC  Powered_Up_Time  Command/Feature_Name
  -- == -- == -- == == == -- -- -- -- --  ---------------  --------------------
  60 01 00 00 08 00 00 17 41 98 08 40 00     06:43:35.955  READ FPDMA QUEUED
  60 01 00 00 00 00 00 17 41 97 08 40 00     06:43:35.955  READ FPDMA QUEUED
  60 01 00 00 08 00 00 17 41 96 08 40 00     06:43:35.953  READ FPDMA QUEUED
  60 01 00 00 00 00 00 17 41 95 08 40 00     06:43:35.953  READ FPDMA QUEUED
  60 01 00 00 08 00 00 17 41 94 08 40 00     06:43:35.951  READ FPDMA QUEUED

Error 18931 [18] occurred at disk power-on lifetime: 14630 hours (609 days + 14 hours)
  When the command that caused the error occurred, the device was active or idle.

  After command completion occurred, registers were:
  ER -- ST COUNT  LBA_48  LH LM LL DV DC
  -- -- -- == -- == == == -- -- -- -- --
  40 -- 51 00 20 00 c3 00 3b 01 e9 40 00  Error: WP at LBA = 0xc3003b01e9 = 837522489833

  Commands leading to the command that caused the error were:
  CR FEATR COUNT  LBA_48  LH LM LL DV DC  Powered_Up_Time  Command/Feature_Name
  -- == -- == -- == == == -- -- -- -- --  ---------------  --------------------
  61 01 00 00 08 00 00 24 79 57 20 40 00     00:11:57.945  WRITE FPDMA QUEUED
  61 01 00 00 00 00 00 24 79 56 20 40 00     00:11:57.945  WRITE FPDMA QUEUED
  61 01 00 00 f8 00 00 24 79 55 20 40 00     00:11:57.922  WRITE FPDMA QUEUED
  61 01 00 00 f0 00 00 24 79 54 20 40 00     00:11:57.922  WRITE FPDMA QUEUED
  60 00 20 00 e8 00 00 01 c3 3b e0 40 00     00:11:57.922  READ FPDMA QUEUED

Error 18930 [17] occurred at disk power-on lifetime: 14630 hours (609 days + 14 hours)
  When the command that caused the error occurred, the device was active or idle.

  After command completion occurred, registers were:
  ER -- ST COUNT  LBA_48  LH LM LL DV DC
  -- -- -- == -- == == == -- -- -- -- --
  40 -- 51 00 20 00 c3 00 3b 01 e9 40 00  Error: WP at LBA = 0xc3003b01e9 = 837522489833

  Commands leading to the command that caused the error were:
  CR FEATR COUNT  LBA_48  LH LM LL DV DC  Powered_Up_Time  Command/Feature_Name
  -- == -- == -- == == == -- -- -- -- --  ---------------  --------------------
  61 00 20 00 e8 00 00 24 79 54 00 40 00     00:11:55.314  WRITE FPDMA QUEUED
  60 00 20 00 e0 00 00 01 c3 3b e0 40 00     00:11:55.314  READ FPDMA QUEUED
  60 00 08 00 d8 00 00 2b 2e a3 58 40 00     00:11:55.314  READ FPDMA QUEUED
  60 00 10 00 d0 00 00 1b 6a 18 e8 40 00     00:11:55.314  READ FPDMA QUEUED
  60 00 08 00 c8 00 00 1b 69 ee 20 40 00     00:11:55.314  READ FPDMA QUEUED

Error 18929 [16] occurred at disk power-on lifetime: 14630 hours (609 days + 14 hours)
  When the command that caused the error occurred, the device was active or idle.

  After command completion occurred, registers were:
  ER -- ST COUNT  LBA_48  LH LM LL DV DC
  -- -- -- == -- == == == -- -- -- -- --
  40 -- 51 00 20 00 c3 00 3b 01 e9 40 00  Error: WP at LBA = 0xc3003b01e9 = 837522489833

  Commands leading to the command that caused the error were:
  CR FEATR COUNT  LBA_48  LH LM LL DV DC  Powered_Up_Time  Command/Feature_Name
  -- == -- == -- == == == -- -- -- -- --  ---------------  --------------------
  61 00 20 00 18 00 00 24 79 53 e0 40 00     00:11:52.689  WRITE FPDMA QUEUED
  60 00 20 00 10 00 00 01 c3 3b e0 40 00     00:11:52.683  READ FPDMA QUEUED
  61 01 00 00 08 00 00 24 79 4c c0 40 00     00:11:52.682  WRITE FPDMA QUEUED
  61 01 00 00 00 00 00 24 79 4d c0 40 00     00:11:52.682  WRITE FPDMA QUEUED
  61 01 00 00 f8 00 00 24 79 4e c0 40 00     00:11:52.682  WRITE FPDMA QUEUED

Error 18928 [15] occurred at disk power-on lifetime: 14630 hours (609 days + 14 hours)
  When the command that caused the error occurred, the device was active or idle.

  After command completion occurred, registers were:
  ER -- ST COUNT  LBA_48  LH LM LL DV DC
  -- -- -- == -- == == == -- -- -- -- --
  40 -- 51 00 20 00 c3 00 3b 01 e9 40 00  Error: UNC at LBA = 0xc3003b01e9 = 837522489833

  Commands leading to the command that caused the error were:
  CR FEATR COUNT  LBA_48  LH LM LL DV DC  Powered_Up_Time  Command/Feature_Name
  -- == -- == -- == == == -- -- -- -- --  ---------------  --------------------
  60 00 30 00 d0 00 00 35 15 8d 18 40 00     00:11:50.072  READ FPDMA QUEUED
  61 00 20 00 c8 00 00 24 78 f6 e0 40 00     00:11:50.067  WRITE FPDMA QUEUED
  61 00 08 00 c0 00 00 24 79 53 d0 40 00     00:11:50.067  WRITE FPDMA QUEUED
  61 00 20 00 b8 00 00 24 78 f6 e0 40 00     00:11:50.067  WRITE FPDMA QUEUED
  61 00 08 00 a8 00 00 24 79 53 a8 40 00     00:11:50.067  WRITE FPDMA QUEUED

Error 18927 [14] occurred at disk power-on lifetime: 14630 hours (609 days + 14 hours)
  When the command that caused the error occurred, the device was active or idle.

  After command completion occurred, registers were:
  ER -- ST COUNT  LBA_48  LH LM LL DV DC
  -- -- -- == -- == == == -- -- -- -- --
  40 -- 51 00 20 00 c3 00 3b 01 e9 40 00  Error: UNC at LBA = 0xc3003b01e9 = 837522489833

  Commands leading to the command that caused the error were:
  CR FEATR COUNT  LBA_48  LH LM LL DV DC  Powered_Up_Time  Command/Feature_Name
  -- == -- == -- == == == -- -- -- -- --  ---------------  --------------------
  60 00 20 00 f8 00 00 02 97 d9 80 40 00     00:11:47.429  READ FPDMA QUEUED
  61 00 08 00 f0 00 00 02 97 d9 78 40 00     00:11:47.429  WRITE FPDMA QUEUED
  61 00 30 00 e8 00 00 02 97 d9 40 40 00     00:11:47.429  WRITE FPDMA QUEUED
  61 00 20 00 e0 00 00 24 78 f6 e0 40 00     00:11:47.428  WRITE FPDMA QUEUED
  61 00 40 00 d8 00 00 24 79 52 40 40 00     00:11:47.428  WRITE FPDMA QUEUED

Error 18926 [13] occurred at disk power-on lifetime: 14630 hours (609 days + 14 hours)
  When the command that caused the error occurred, the device was active or idle.

  After command completion occurred, registers were:
  ER -- ST COUNT  LBA_48  LH LM LL DV DC
  -- -- -- == -- == == == -- -- -- -- --
  40 -- 51 00 20 00 c3 00 3b 01 e9 40 00  Error: UNC at LBA = 0xc3003b01e9 = 837522489833

  Commands leading to the command that caused the error were:
  CR FEATR COUNT  LBA_48  LH LM LL DV DC  Powered_Up_Time  Command/Feature_Name
  -- == -- == -- == == == -- -- -- -- --  ---------------  --------------------
  60 00 40 00 38 00 00 02 97 d9 40 40 00     00:11:44.786  READ FPDMA QUEUED
  61 00 10 00 30 00 00 02 97 d9 00 40 00     00:11:44.786  WRITE FPDMA QUEUED
  61 00 20 00 28 00 00 24 78 f6 e0 40 00     00:11:44.785  WRITE FPDMA QUEUED
  61 00 20 00 20 00 00 24 79 52 20 40 00     00:11:44.785  WRITE FPDMA QUEUED
  60 00 08 00 18 00 00 32 16 87 10 40 00     00:11:44.776  READ FPDMA QUEUED

Error 18925 [12] occurred at disk power-on lifetime: 14630 hours (609 days + 14 hours)
  When the command that caused the error occurred, the device was active or idle.

  After command completion occurred, registers were:
  ER -- ST COUNT  LBA_48  LH LM LL DV DC
  -- -- -- == -- == == == -- -- -- -- --
  40 -- 51 00 20 00 c3 00 3b 01 e9 40 00  Error: UNC at LBA = 0xc3003b01e9 = 837522489833

  Commands leading to the command that caused the error were:
  CR FEATR COUNT  LBA_48  LH LM LL DV DC  Powered_Up_Time  Command/Feature_Name
  -- == -- == -- == == == -- -- -- -- --  ---------------  --------------------
  60 00 20 00 90 00 00 27 c8 de 18 40 00     00:11:42.003  READ FPDMA QUEUED
  61 00 20 00 88 00 00 24 79 48 60 40 00     00:11:42.003  WRITE FPDMA QUEUED
  61 00 20 00 80 00 00 24 79 48 40 40 00     00:11:42.003  WRITE FPDMA QUEUED
  61 00 20 00 78 00 00 24 78 f6 e0 40 00     00:11:42.003  WRITE FPDMA QUEUED
  60 00 78 00 70 00 00 1b 6a 41 f0 40 00     00:11:42.003  READ FPDMA QUEUED

SMART Extended Self-test Log Version: 1 (1 sectors)
Num  Test_Description    Status                  Remaining  LifeTime(hours)  LBA_of_first_error
# 1  Short offline       Completed without error       00%     16442         -
# 2  Short offline       Completed without error       00%     16263         -
# 3  Short offline       Completed without error       00%     15527         -
# 4  Short offline       Completed without error       00%     15385         -

SMART Selective self-test log data structure revision number 1
 SPAN  MIN_LBA  MAX_LBA  CURRENT_TEST_STATUS
    1        0        0  Not_testing
    2        0        0  Not_testing
    3        0        0  Not_testing
    4        0        0  Not_testing
    5        0        0  Not_testing
Selective self-test flags (0x0):
  After scanning selected spans, do NOT read-scan remainder of disk.
If Selective self-test is pending on power-up, resume after 0 minute delay.

SCT Status Version:                  2
SCT Version (vendor specific):       258 (0x0102)
Device State:                        Active (0)
Current Temperature:                    22 Celsius
Power Cycle Min/Max Temperature:     19/22 Celsius
Lifetime    Min/Max Temperature:     20/58 Celsius
Under/Over Temperature Limit Count:   0/0

SCT Temperature History Version:     2
Temperature Sampling Period:         1 minute
Temperature Logging Interval:        1 minute
Min/Max recommended Temperature:      0/60 Celsius
Min/Max Temperature Limit:           -41/85 Celsius
Temperature History Size (Index):    478 (7)

SCT Error Recovery Control command not supported

Device Statistics (GP/SMART Log 0x04) not supported

Pending Defects log (GP Log 0x0c) not supported

SATA Phy Event Counters (GP Log 0x11)
ID      Size     Value  Description
0x0001  2            0  Command failed due to ICRC error
0x0002  2            0  R_ERR response for data FIS
0x0003  2            0  R_ERR response for device-to-host data FIS
0x0004  2            0  R_ERR response for host-to-device data FIS
0x0005  2            0  R_ERR response for non-data FIS
0x0006  2            0  R_ERR response for device-to-host non-data FIS
0x0007  2            0  R_ERR response for host-to-device non-data FIS
0x000a  2            4  Device-to-host register FISes sent due to a COMRESET
0x000b  2            0  CRC errors within host-to-device FIS
0x8000  4          608  Vendor specific



