smartctl 7.4 2023-08-01 r5530 [x86_64-linux-6.12.6-desktop-1omv2490] (OpenMandriva Lx 7.4-1)
Copyright (C) 2002-23, Bruce Allen, Christian Franke, www.smartmontools.org

=== START OF INFORMATION SECTION ===
Device Model:     SSD 1TB
Serial Number:    --
LU WWN Device Id: 0 000000 ...
Firmware Version: FW210415
User Capacity:    1,000,204,886,016 bytes [1.00 TB]
Sector Size:      512 bytes logical/physical
Rotation Rate:    Solid State Device
Form Factor:      2.5 inches
TRIM Command:     Available
Device is:        Not in smartctl database
ATA Version is:   ACS-2 T13/2015-D revision 3
SATA Version is:  SATA 3.2, 6.0 Gb/s (current: 6.0 Gb/s)
Local Time is:    Wed Jan 22 20:46:43 2025 GMT
SMART support is: Available - device has SMART capability.
SMART support is: Enabled
AAM feature is:   Unavailable
APM feature is:   Unavailable
Rd look-ahead is: Enabled
Write cache is:   Enabled
DSN feature is:   Unavailable
ATA Security is:  Disabled, frozen [SEC2]
Wt Cache Reorder: Unavailable

=== START OF READ SMART DATA SECTION ===
SMART overall-health self-assessment test result: PASSED

General SMART Values:
Offline data collection status:  (0x00)	Offline data collection activity
					was never started.
					Auto Offline Data Collection: Disabled.
Self-test execution status:      (   0)	The previous self-test routine completed
					without error or no self-test has ever 
					been run.
Total time to complete Offline 
data collection: 		(  120) seconds.
Offline data collection
capabilities: 			 (0x5d) SMART execute Offline immediate.
					No Auto Offline data collection support.
					Abort Offline collection upon new
					command.
					Offline surface scan supported.
					Self-test supported.
					No Conveyance Self-test supported.
					Selective Self-test supported.
SMART capabilities:            (0x0002)	Does not save SMART data before
					entering power-saving mode.
					Supports SMART auto save timer.
Error logging capability:        (0x01)	Error logging supported.
					General Purpose Logging supported.
Short self-test routine 
recommended polling time: 	 (   2) minutes.
Extended self-test routine
recommended polling time: 	 (   4) minutes.

SMART Attributes Data Structure revision number: 1
Vendor Specific SMART Attributes with Thresholds:
ID# ATTRIBUTE_NAME          FLAGS    VALUE WORST THRESH FAIL RAW_VALUE
  1 Raw_Read_Error_Rate     -O--CK   100   100   050    -    0
  5 Reallocated_Sector_Ct   -O--CK   100   100   050    -    0
  9 Power_On_Hours          -O--CK   100   100   050    -    5634
 12 Power_Cycle_Count       -O--CK   100   100   050    -    1064
160 Unknown_Attribute       -O--CK   100   100   050    -    0
161 Unknown_Attribute       -O--CK   100   100   050    -    0
163 Unknown_Attribute       -O--CK   100   100   050    -    861
164 Unknown_Attribute       -O--CK   100   100   050    -    162
165 Unknown_Attribute       -O--CK   100   100   050    -    389
166 Unknown_Attribute       -O--CK   100   100   050    -    86
167 Unknown_Attribute       -O--CK   100   100   050    -    152
168 Unknown_Attribute       -O--CK   100   100   050    -    0
169 Unknown_Attribute       -O--CK   100   100   050    -    100
175 Program_Fail_Count_Chip -O--CK   100   100   050    -    454754310
176 Erase_Fail_Count_Chip   -O--CK   100   100   050    -    5124721
177 Wear_Leveling_Count     -O--CK   100   100   050    -    8703169
178 Used_Rsvd_Blk_Cnt_Chip  -O--CK   100   100   050    -    65536
181 Program_Fail_Cnt_Total  -O--CK   100   100   050    -    0
182 Erase_Fail_Count_Total  -O--CK   100   100   050    -    0
192 Power-Off_Retract_Count -O--CK   100   100   050    -    337
194 Temperature_Celsius     -O--CK   100   100   050    -    40
195 Hardware_ECC_Recovered  -O--CK   100   100   050    -    10159
196 Reallocated_Event_Count -O--CK   100   100   050    -    0
197 Current_Pending_Sector  -O--CK   100   100   050    -    2
198 Offline_Uncorrectable   -O--CK   100   100   050    -    0
199 UDMA_CRC_Error_Count    -O--CK   100   100   050    -    0
232 Available_Reservd_Space -O--CK   100   100   050    -    0
241 Total_LBAs_Written      -O--CK   100   100   050    -    813716
242 Total_LBAs_Read         -O--CK   100   100   050    -    728819
249 Unknown_Attribute       -O--CK   100   100   050    -    823393
                            ||||||_ K auto-keep
                            |||||__ C event count
                            ||||___ R error rate
                            |||____ S speed/performance
                            ||_____ O updated online
                            |______ P prefailure warning

General Purpose Log Directory Version 1
SMART           Log Directory Version 1 [multi-sector log support]
Address    Access  R/W   Size  Description
0x00       GPL,SL  R/O      1  Log Directory
0x01       GPL,SL  R/O      1  Summary SMART error log
0x02       GPL,SL  R/O      1  Comprehensive SMART error log
0x03       GPL,SL  R/O      1  Ext. Comprehensive SMART error log
0x04       GPL,SL  R/O      8  Device Statistics log
0x06       GPL,SL  R/O      1  SMART self-test log
0x07       GPL,SL  R/O      1  Extended self-test log
0x09       GPL,SL  R/W      1  Selective self-test log
0x10       GPL,SL  R/O      1  NCQ Command Error log
0x11       GPL,SL  R/O      1  SATA Phy Event Counters log
0x30       GPL,SL  R/O      9  IDENTIFY DEVICE data log
0x80-0x9f  GPL,SL  R/W     16  Host vendor specific log
0xa0       GPL,SL  VS      16  Device vendor specific log
0xe0       GPL,SL  R/W      1  SCT Command/Status
0xe1       GPL,SL  R/W      1  SCT Data Transfer

SMART Extended Comprehensive Error Log Version: 1 (1 sectors)
Device Error Count: 16 (device log contains only the most recent 4 errors)
	CR     = Command Register
	FEATR  = Features Register
	COUNT  = Count (was: Sector Count) Register
	LBA_48 = Upper bytes of LBA High/Mid/Low Registers ]  ATA-8
	LH     = LBA High (was: Cylinder High) Register    ]   LBA
	LM     = LBA Mid (was: Cylinder Low) Register      ] Register
	LL     = LBA Low (was: Sector Number) Register     ]
	DV     = Device (was: Device/Head) Register
	DC     = Device Control Register
	ER     = Error register
	ST     = Status register
Powered_Up_Time is measured from power on, and printed as
DDd+hh:mm:SS.sss where DD=days, hh=hours, mm=minutes,
SS=sec, and sss=millisec. It "wraps" after 49.710 days.

Error 16 [3] occurred at disk power-on lifetime: 5205 hours (216 days + 21 hours)
  When the command that caused the error occurred, the device was in an unknown state.

  After command completion occurred, registers were:
  ER -- ST COUNT  LBA_48  LH LM LL DV DC
  -- -- -- == -- == == == -- -- -- -- --
  04 -- 40 00 68 00 48 a4 00 dc 90 00 00   at LBA = 0x48a400dc90 = 311989165200

  Commands leading to the command that caused the error were:
  CR FEATR COUNT  LBA_48  LH LM LL DV DC  Powered_Up_Time  Command/Feature_Name
  -- == -- == -- == == == -- -- -- -- --  ---------------  --------------------
  61 01 00 00 68 00 48 a4 00 dc 90 40 00     04:22:28.930  WRITE FPDMA QUEUED
  61 01 00 00 60 00 48 a3 00 dc 90 40 00     04:22:28.930  WRITE FPDMA QUEUED
  61 01 00 00 58 00 48 a2 00 dc 90 40 00     04:22:28.930  WRITE FPDMA QUEUED
  61 01 00 00 50 00 48 a1 00 dc 90 40 00     04:22:28.930  WRITE FPDMA QUEUED
  61 01 00 00 48 00 48 a0 00 dc 90 40 00     04:22:28.930  WRITE FPDMA QUEUED

Error 15 [2] occurred at disk power-on lifetime: 2717 hours (113 days + 5 hours)
  When the command that caused the error occurred, the device was in an unknown state.

  After command completion occurred, registers were:
  ER -- ST COUNT  LBA_48  LH LM LL DV DC
  -- -- -- == -- == == == -- -- -- -- --
  04 -- 40 00 c0 00 0f 6a 00 bf 52 00 00   at LBA = 0xf6a00bf52 = 66202943314

  Commands leading to the command that caused the error were:
  CR FEATR COUNT  LBA_48  LH LM LL DV DC  Powered_Up_Time  Command/Feature_Name
  -- == -- == -- == == == -- -- -- -- --  ---------------  --------------------
  60 01 00 00 c0 00 0f 6a 00 bf 52 40 00     02:57:28.030  READ FPDMA QUEUED
  60 01 00 00 b8 00 0f 69 00 bf 52 40 00     02:57:28.030  READ FPDMA QUEUED
  60 01 00 00 b0 00 0f 68 00 bf 52 40 00     02:57:28.030  READ FPDMA QUEUED
  60 01 00 00 a8 00 0f 67 00 bf 52 40 00     02:57:28.030  READ FPDMA QUEUED
  60 01 00 00 a0 00 0f 66 00 bf 52 40 00     02:57:28.030  READ FPDMA QUEUED

Error 14 [1] occurred at disk power-on lifetime: 2690 hours (112 days + 2 hours)
  When the command that caused the error occurred, the device was in an unknown state.

  After command completion occurred, registers were:
  ER -- ST COUNT  LBA_48  LH LM LL DV DC
  -- -- -- == -- == == == -- -- -- -- --
  04 -- 40 00 a8 00 3b ba 00 82 1a 00 00   at LBA = 0x3bba00821a = 256523665946

  Commands leading to the command that caused the error were:
  CR FEATR COUNT  LBA_48  LH LM LL DV DC  Powered_Up_Time  Command/Feature_Name
  -- == -- == -- == == == -- -- -- -- --  ---------------  --------------------
  60 01 00 00 a8 00 3b ba 00 82 1a 40 00     15:45:45.790  READ FPDMA QUEUED
  60 01 00 00 a0 00 3b b9 00 82 1a 40 00     15:45:45.790  READ FPDMA QUEUED
  60 01 00 00 98 00 3b b8 00 82 1a 40 00     15:45:45.790  READ FPDMA QUEUED
  60 01 00 00 90 00 3b b7 00 82 1a 40 00     15:45:45.790  READ FPDMA QUEUED
  60 01 00 00 88 00 3b b6 00 82 1a 40 00     15:45:45.790  READ FPDMA QUEUED

Error 13 [0] occurred at disk power-on lifetime: 2690 hours (112 days + 2 hours)
  When the command that caused the error occurred, the device was in an unknown state.

  After command completion occurred, registers were:
  ER -- ST COUNT  LBA_48  LH LM LL DV DC
  -- -- -- == -- == == == -- -- -- -- --
  04 -- 40 00 78 00 4d b1 00 82 92 00 00   at LBA = 0x4db1008292 = 333682082450

  Commands leading to the command that caused the error were:
  CR FEATR COUNT  LBA_48  LH LM LL DV DC  Powered_Up_Time  Command/Feature_Name
  -- == -- == -- == == == -- -- -- -- --  ---------------  --------------------
  60 01 00 00 78 00 4d b1 00 82 92 40 00     15:06:29.060  READ FPDMA QUEUED
  60 01 00 00 70 00 4d b0 00 82 92 40 00     15:06:29.060  READ FPDMA QUEUED
  60 01 00 00 68 00 4d af 00 82 92 40 00     15:06:29.060  READ FPDMA QUEUED
  60 01 00 00 60 00 4d ae 00 82 92 40 00     15:06:29.060  READ FPDMA QUEUED
  60 01 00 00 58 00 4d ad 00 82 92 40 00     15:06:29.060  READ FPDMA QUEUED

SMART Extended Self-test Log Version: 1 (1 sectors)
Num  Test_Description    Status                  Remaining  LifeTime(hours)  LBA_of_first_error
# 1  Offline             Completed without error       00%      5472         -
# 2  Offline             Self-test routine in progress 10%      5472         -
# 3  Offline             Self-test routine in progress 10%      5472         -
# 4  Offline             Self-test routine in progress 10%      5472         -
# 5  Offline             Self-test routine in progress 10%      5472         -
# 6  Offline             Self-test routine in progress 10%      5472         -
# 7  Offline             Self-test routine in progress 10%      5472         -
# 8  Offline             Self-test routine in progress 10%      5472         -
# 9  Offline             Self-test routine in progress 10%      5472         -
#10  Offline             Self-test routine in progress 10%      5472         -
#11  Offline             Self-test routine in progress 10%      5472         -
#12  Offline             Self-test routine in progress 10%      5472         -
#13  Offline             Self-test routine in progress 10%      5472         -
#14  Offline             Self-test routine in progress 10%      5472         -
#15  Offline             Self-test routine in progress 10%      5472         -
#16  Offline             Self-test routine in progress 10%      5472         -
#17  Offline             Self-test routine in progress 10%      5472         -
#18  Offline             Self-test routine in progress 10%      5472         -
#19  Offline             Self-test routine in progress 10%      5472         -

SMART Selective self-test log data structure revision number 0
Note: revision number not 1 implies that no selective self-test has ever been run
 SPAN  MIN_LBA  MAX_LBA  CURRENT_TEST_STATUS
    1        0        0  Not_testing
    2        0        0  Not_testing
    3        0        0  Not_testing
    4        0        0  Not_testing
    5        0        0  Not_testing
Selective self-test flags (0x0):
  After scanning selected spans, do NOT read-scan remainder of disk.
If Selective self-test is pending on power-up, resume after 0 minute delay.

SCT Commands not supported

Device Statistics (GP Log 0x04)
Page  Offset Size        Value Flags Description
0x01  =====  =               =  ===  == General Statistics (rev 1) ==
0x01  0x008  4            1064  ---  Lifetime Power-On Resets
0x01  0x010  4            5634  ---  Power-on Hours
0x01  0x018  6     53327691776  ---  Logical Sectors Written
0x01  0x020  6       240527019  ---  Number of Write Commands
0x01  0x028  6     47763881984  ---  Logical Sectors Read
0x01  0x030  6       284721212  ---  Number of Read Commands
0x01  =====  =               =  ===  == General Statistics (rev 1) ==
0x01  0x008  4            1064  ---  Lifetime Power-On Resets
0x01  0x010  4            5634  ---  Power-on Hours
0x01  0x018  6     53327691776  ---  Logical Sectors Written
0x01  0x020  6       240527019  ---  Number of Write Commands
0x01  0x028  6     47763881984  ---  Logical Sectors Read
0x01  0x030  6       284721212  ---  Number of Read Commands
0x01  =====  =               =  ===  == General Statistics (rev 1) ==
0x01  0x008  4            1064  ---  Lifetime Power-On Resets
0x01  0x010  4            5634  ---  Power-on Hours
0x01  0x018  6     53327691776  ---  Logical Sectors Written
0x01  0x020  6       240527019  ---  Number of Write Commands
0x01  0x028  6     47763881984  ---  Logical Sectors Read
0x01  0x030  6       284721212  ---  Number of Read Commands
0x01  =====  =               =  ===  == General Statistics (rev 1) ==
0x01  0x008  4            1064  ---  Lifetime Power-On Resets
0x01  0x010  4            5634  ---  Power-on Hours
0x01  0x018  6     53327691776  ---  Logical Sectors Written
0x01  0x020  6       240527019  ---  Number of Write Commands
0x01  0x028  6     47763881984  ---  Logical Sectors Read
0x01  0x030  6       284721212  ---  Number of Read Commands
0x01  =====  =               =  ===  == General Statistics (rev 1) ==
0x01  0x008  4            1064  ---  Lifetime Power-On Resets
0x01  0x010  4            5634  ---  Power-on Hours
0x01  0x018  6     53327691776  ---  Logical Sectors Written
0x01  0x020  6       240527019  ---  Number of Write Commands
0x01  0x028  6     47763881984  ---  Logical Sectors Read
0x01  0x030  6       284721212  ---  Number of Read Commands
0x01  =====  =               =  ===  == General Statistics (rev 1) ==
0x01  0x008  4            1064  ---  Lifetime Power-On Resets
0x01  0x010  4            5634  ---  Power-on Hours
0x01  0x018  6     53327691776  ---  Logical Sectors Written
0x01  0x020  6       240527019  ---  Number of Write Commands
0x01  0x028  6     47763881984  ---  Logical Sectors Read
0x01  0x030  6       284721212  ---  Number of Read Commands
0x01  =====  =               =  ===  == General Statistics (rev 1) ==
0x01  0x008  4            1064  ---  Lifetime Power-On Resets
0x01  0x010  4            5634  ---  Power-on Hours
0x01  0x018  6     53327691776  ---  Logical Sectors Written
0x01  0x020  6       240527019  ---  Number of Write Commands
0x01  0x028  6     47763881984  ---  Logical Sectors Read
0x01  0x030  6       284721212  ---  Number of Read Commands
0x01  =====  =               =  ===  == General Statistics (rev 1) ==
0x01  0x008  4            1064  ---  Lifetime Power-On Resets
0x01  0x010  4            5634  ---  Power-on Hours
0x01  0x018  6     53327691776  ---  Logical Sectors Written
0x01  0x020  6       240527019  ---  Number of Write Commands
0x01  0x028  6     47763881984  ---  Logical Sectors Read
0x01  0x030  6       284721212  ---  Number of Read Commands
                                |||_ C monitored condition met
                                ||__ D supports DSN
                                |___ N normalized value

Pending Defects log (GP Log 0x0c) not supported

SATA Phy Event Counters (GP Log 0x11)
ID      Size     Value  Description
0x0001  4            0  Command failed due to ICRC error
0x0009  4         2693  Transition from drive PhyRdy to drive PhyNRdy
0x000a  4         3969  Device-to-host register FISes sent due to a COMRESET
0x000b  4           19  CRC errors within host-to-device FIS
0x000d  4           19  Non-CRC errors within host-to-device FIS



