=== START OF INFORMATION SECTION ===
Model Family:     Hitachi/HGST Travelstar 5K750
Device Model:     Hitachi HTS547575A9E384
Serial Number:    --
LU WWN Device Id: 5 000cca ...
Firmware Version: JE4OA50A
User Capacity:    750 156 374 016 bytes [750 GB]
Sector Sizes:     512 bytes logical, 4096 bytes physical
Rotation Rate:    5400 rpm
Form Factor:      2.5 inches
Device is:        In smartctl database [for details use: -P show]
ATA Version is:   ATA8-ACS T13/1699-D revision 6
SATA Version is:  SATA 2.6, 3.0 Gb/s
Local Time is:    Sat Jun 17 21:48:11 2017 +09
SMART support is: Available - device has SMART capability.
SMART support is: Enabled
AAM feature is:   Unavailable
APM level is:     128 (minimum power consumption without standby)
Rd look-ahead is: Enabled
Write cache is:   Enabled
ATA Security is:  Disabled, NOT FROZEN [SEC1]
Wt Cache Reorder: Enabled

=== START OF READ SMART DATA SECTION ===
SMART overall-health self-assessment test result: PASSED

General SMART Values:
Offline data collection status:  (0x85)	Offline data collection activity
					was aborted by an interrupting command from host.
					Auto Offline Data Collection: Enabled.
Self-test execution status:      ( 246)	Self-test routine in progress...
					60% of test remaining.
Total time to complete Offline 
data collection: 		(   45) seconds.
Offline data collection
capabilities: 			 (0x51) SMART execute Offline immediate.
					No Auto Offline data collection support.
					Suspend Offline collection upon new
					command.
					No Offline surface scan supported.
					Self-test supported.
					No Conveyance Self-test supported.
					Selective Self-test supported.
SMART capabilities:            (0x0003)	Saves SMART data before entering
					power-saving mode.
					Supports SMART auto save timer.
Error logging capability:        (0x01)	Error logging supported.
					General Purpose Logging supported.
Short self-test routine 
recommended polling time: 	 (   2) minutes.
Extended self-test routine
recommended polling time: 	 ( 177) minutes.
SCT capabilities: 	       (0x003d)	SCT Status supported.
					SCT Error Recovery Control supported.
					SCT Feature Control supported.
					SCT Data Table supported.

SMART Attributes Data Structure revision number: 16
Vendor Specific SMART Attributes with Thresholds:
ID# ATTRIBUTE_NAME          FLAGS    VALUE WORST THRESH FAIL RAW_VALUE
  1 Raw_Read_Error_Rate     POSR-K   100   100   062    -    0
  2 Throughput_Performance  P-S--K   198   100   040    -    127
  3 Spin_Up_Time            PO---K   166   100   033    -    1
  4 Start_Stop_Count        -O--CK   098   098   000    -    4093
  5 Reallocated_Sector_Ct   PO--CK   100   100   005    -    0
  7 Seek_Error_Rate         POSR-K   100   100   067    -    0
  8 Seek_Time_Performance   P-S--K   117   100   040    -    33
  9 Power_On_Hours          -O--CK   095   095   000    -    2369
 10 Spin_Retry_Count        PO--CK   100   100   060    -    0
 12 Power_Cycle_Count       -O--CK   100   100   000    -    1469
183 Runtime_Bad_Block       -O--CK   100   100   000    -    0
184 End-to-End_Error        PO--CK   100   100   097    -    0
187 Reported_Uncorrect      -O--CK   100   100   000    -    47247065088
188 Command_Timeout         -O--CK   100   100   000    -    0
190 Airflow_Temperature_Cel -O---K   053   050   045    -    47 (Min/Max 28/47)
191 G-Sense_Error_Rate      -O--CK   100   100   000    -    115
192 Power-Off_Retract_Count -O--CK   100   100   000    -    1048592
193 Load_Cycle_Count        -O--CK   089   089   000    -    116575
196 Reallocated_Event_Count -O--CK   100   100   000    -    0
197 Current_Pending_Sector  -O--CK   100   100   000    -    0
198 Offline_Uncorrectable   ----CK   100   100   000    -    0
199 UDMA_CRC_Error_Count    -OS-CK   100   100   000    -    0
223 Load_Retry_Count        -O-R-K   100   100   000    -    0
                            ||||||_ K auto-keep
                            |||||__ C event count
                            ||||___ R error rate
                            |||____ S speed/performance
                            ||_____ O updated online
                            |______ P prefailure warning

General Purpose Log Directory Version 1
SMART           Log Directory Version 1 [multi-sector log support]
Address    Access  R/W   Size  Description
0x00       GPL,SL  R/O      1  Log Directory
0x01           SL  R/O      1  Summary SMART error log
0x02           SL  R/O      1  Comprehensive SMART error log
0x03       GPL     R/O      1  Ext. Comprehensive SMART error log
0x06           SL  R/O      1  SMART self-test log
0x07       GPL     R/O      1  Extended self-test log
0x09           SL  R/W      1  Selective self-test log
0x10       GPL     R/O      1  SATA NCQ Queued Error log
0x11       GPL     R/O      1  SATA Phy Event Counters log
0x80-0x9f  GPL,SL  R/W     16  Host vendor specific log
0xe0       GPL,SL  R/W      1  SCT Command/Status
0xe1       GPL,SL  R/W      1  SCT Data Transfer

SMART Extended Comprehensive Error Log Version: 1 (1 sectors)
No Errors Logged

SMART Extended Self-test Log Version: 1 (1 sectors)
Num  Test_Description    Status                  Remaining  LifeTime(hours)  LBA_of_first_error
# 1  Extended offline    Completed without error       00%      2257         -
# 2  Extended offline    Completed without error       00%      2166         -
# 3  Extended offline    Completed without error       00%      2111         -
# 4  Extended offline    Completed without error       00%      1971         -
# 5  Extended offline    Completed without error       00%      1949         -
# 6  Extended offline    Completed without error       00%      1886         -
# 7  Extended offline    Completed without error       00%      1850         -
# 8  Extended offline    Completed without error       00%      1816         -
# 9  Extended offline    Interrupted (host reset)      90%      1706         -
#10  Extended offline    Completed without error       00%      1516         -
#11  Extended offline    Completed without error       00%      1485         -
#12  Extended offline    Completed without error       00%      1366         -
#13  Extended offline    Completed without error       00%      1311         -
#14  Extended offline    Completed without error       00%      1220         -
#15  Extended offline    Completed without error       00%      1191         -
#16  Extended offline    Completed without error       00%      1163         -
#17  Extended offline    Interrupted (host reset)      90%      1105         -
#18  Extended offline    Completed without error       00%      1045         -
#19  Extended offline    Interrupted (host reset)      90%       998         -

SMART Selective self-test log data structure revision number 1
 SPAN  MIN_LBA  MAX_LBA  CURRENT_TEST_STATUS
    1        0        0  Not_testing
    2        0        0  Not_testing
    3        0        0  Not_testing
    4        0        0  Not_testing
    5        0        0  Not_testing
Selective self-test flags (0x0):
  After scanning selected spans, do NOT read-scan remainder of disk.
If Selective self-test is pending on power-up, resume after 0 minute delay.

SCT Status Version:                  3
SCT Version (vendor specific):       256 (0x0100)
SCT Support Level:                   1
Device State:                        DST executing in background (3)
Current Temperature:                    47 Celsius
Power Cycle Min/Max Temperature:     28/47 Celsius
Lifetime    Min/Max Temperature:     16/50 Celsius
Lifetime    Average Temperature:        36 Celsius
Under/Over Temperature Limit Count:   0/0

SCT Temperature History Version:     2
Temperature Sampling Period:         1 minute
Temperature Logging Interval:        1 minute
Min/Max recommended Temperature:      0/60 Celsius
Min/Max Temperature Limit:           -40/65 Celsius
Temperature History Size (Index):    128 (28)

SCT Error Recovery Control:
           Read:     85 (8,5 seconds)
          Write:     85 (8,5 seconds)

Device Statistics (GP/SMART Log 0x04) not supported

SATA Phy Event Counters (GP Log 0x11)
ID      Size     Value  Description
0x0001  2            0  Command failed due to ICRC error
0x0002  2            0  R_ERR response for data FIS
0x0003  2            0  R_ERR response for device-to-host data FIS
0x0004  2            0  R_ERR response for host-to-device data FIS
0x0005  2            0  R_ERR response for non-data FIS
0x0006  2            0  R_ERR response for device-to-host non-data FIS
0x0007  2            0  R_ERR response for host-to-device non-data FIS
0x0009  2            3  Transition from drive PhyRdy to drive PhyNRdy
0x000a  2            0  Device-to-host register FISes sent due to a COMRESET
0x000b  2            0  CRC errors within host-to-device FIS
0x000d  2            0  Non-CRC errors within host-to-device FIS

