smartctl 7.1 2019-12-30 r5022 [x86_64-linux-5.11.0-27-generic] (local build)
Copyright (C) 2002-19, Bruce Allen, Christian Franke, www.smartmontools.org

=== START OF INFORMATION SECTION ===
Model Family:     HGST Travelstar 5K1000
Device Model:     HGST HTS541010A9E680
Serial Number:    --
LU WWN Device Id: 5 000cca ...
Firmware Version: JA0OA710
User Capacity:    1,000,204,886,016 bytes [1.00 TB]
Sector Sizes:     512 bytes logical, 4096 bytes physical
Rotation Rate:    5400 rpm
Form Factor:      2.5 inches
Device is:        In smartctl database [for details use: -P show]
ATA Version is:   ACS-2, ATA8-ACS T13/1699-D revision 6
SATA Version is:  SATA 3.0, 6.0 Gb/s (current: 6.0 Gb/s)
Local Time is:    Wed Sep  1 14:18:05 2021 CEST
SMART support is: Available - device has SMART capability.
SMART support is: Enabled
AAM feature is:   Unavailable
APM level is:     254 (maximum performance)
Rd look-ahead is: Enabled
Write cache is:   Enabled
DSN feature is:   Unavailable
ATA Security is:  Disabled, NOT FROZEN [SEC1]
Wt Cache Reorder: Enabled

=== START OF READ SMART DATA SECTION ===
SMART overall-health self-assessment test result: PASSED

General SMART Values:
Offline data collection status:  (0x00)	Offline data collection activity
					was never started.
					Auto Offline Data Collection: Disabled.
Self-test execution status:      (   0)	The previous self-test routine completed
					without error or no self-test has ever 
					been run.
Total time to complete Offline 
data collection: 		(   45) seconds.
Offline data collection
capabilities: 			 (0x5b) SMART execute Offline immediate.
					Auto Offline data collection on/off support.
					Suspend Offline collection upon new
					command.
					Offline surface scan supported.
					Self-test supported.
					No Conveyance Self-test supported.
					Selective Self-test supported.
SMART capabilities:            (0x0003)	Saves SMART data before entering
					power-saving mode.
					Supports SMART auto save timer.
Error logging capability:        (0x01)	Error logging supported.
					General Purpose Logging supported.
Short self-test routine 
recommended polling time: 	 (   2) minutes.
Extended self-test routine
recommended polling time: 	 ( 258) minutes.
SCT capabilities: 	       (0x003d)	SCT Status supported.
					SCT Error Recovery Control supported.
					SCT Feature Control supported.
					SCT Data Table supported.

SMART Attributes Data Structure revision number: 16
Vendor Specific SMART Attributes with Thresholds:
ID# ATTRIBUTE_NAME          FLAGS    VALUE WORST THRESH FAIL RAW_VALUE
  1 Raw_Read_Error_Rate     POSR-K   100   100   062    -    0
  2 Throughput_Performance  P-S--K   100   100   040    -    0
  3 Spin_Up_Time            PO---K   169   100   033    -    1
  4 Start_Stop_Count        -O--CK   091   091   000    -    14865
  5 Reallocated_Sector_Ct   PO--CK   100   100   005    -    0
  7 Seek_Error_Rate         POSR-K   100   100   067    -    0
  8 Seek_Time_Performance   P-S--K   100   100   040    -    0
  9 Power_On_Hours          -O--CK   081   081   000    -    8346
 10 Spin_Retry_Count        PO--CK   100   100   060    -    0
 12 Power_Cycle_Count       -O--CK   098   098   000    -    3367
183 Runtime_Bad_Block       -O--CK   100   100   000    -    0
184 End-to-End_Error        PO--CK   100   100   097    -    0
187 Reported_Uncorrect      -O--CK   100   100   000    -    17180131333
188 Command_Timeout         -O--CK   100   100   000    -    146039177217
190 Airflow_Temperature_Cel -O---K   068   054   045    -    32 (Min/Max 19/33)
191 G-Sense_Error_Rate      -O--CK   079   079   000    -    5460
192 Power-Off_Retract_Count -O--CK   099   099   000    -    13107400
193 Load_Cycle_Count        -O--CK   095   095   000    -    58467
196 Reallocated_Event_Count -O--CK   100   100   000    -    0
197 Current_Pending_Sector  -O--CK   100   100   000    -    0
198 Offline_Uncorrectable   ----CK   100   100   000    -    0
199 UDMA_CRC_Error_Count    -OS-CK   100   100   000    -    0
223 Load_Retry_Count        -O-R-K   100   100   000    -    0
                            ||||||_ K auto-keep
                            |||||__ C event count
                            ||||___ R error rate
                            |||____ S speed/performance
                            ||_____ O updated online
                            |______ P prefailure warning

General Purpose Log Directory Version 1
SMART           Log Directory Version 1 [multi-sector log support]
Address    Access  R/W   Size  Description
0x00       GPL,SL  R/O      1  Log Directory
0x01           SL  R/O      1  Summary SMART error log
0x02           SL  R/O      1  Comprehensive SMART error log
0x03       GPL     R/O      1  Ext. Comprehensive SMART error log
0x06           SL  R/O      1  SMART self-test log
0x07       GPL     R/O      1  Extended self-test log
0x09           SL  R/W      1  Selective self-test log
0x10       GPL     R/O      1  NCQ Command Error log
0x11       GPL     R/O      1  SATA Phy Event Counters log
0x80-0x9f  GPL,SL  R/W     16  Host vendor specific log
0xe0       GPL,SL  R/W      1  SCT Command/Status
0xe1       GPL,SL  R/W      1  SCT Data Transfer

SMART Extended Comprehensive Error Log Version: 1 (1 sectors)
Device Error Count: 5 (device log contains only the most recent 4 errors)
	CR     = Command Register
	FEATR  = Features Register
	COUNT  = Count (was: Sector Count) Register
	LBA_48 = Upper bytes of LBA High/Mid/Low Registers ]  ATA-8
	LH     = LBA High (was: Cylinder High) Register    ]   LBA
	LM     = LBA Mid (was: Cylinder Low) Register      ] Register
	LL     = LBA Low (was: Sector Number) Register     ]
	DV     = Device (was: Device/Head) Register
	DC     = Device Control Register
	ER     = Error register
	ST     = Status register
Powered_Up_Time is measured from power on, and printed as
DDd+hh:mm:SS.sss where DD=days, hh=hours, mm=minutes,
SS=sec, and sss=millisec. It "wraps" after 49.710 days.

Error 5 [0] occurred at disk power-on lifetime: 6165 hours (256 days + 21 hours)
  When the command that caused the error occurred, the device was active or idle.

  After command completion occurred, registers were:
  ER -- ST COUNT  LBA_48  LH LM LL DV DC
  -- -- -- == -- == == == -- -- -- -- --
  40 -- 41 01 00 00 00 37 83 88 78 07 00  Error: WP at LBA = 0x37838878 = 931367032

  Commands leading to the command that caused the error were:
  CR FEATR COUNT  LBA_48  LH LM LL DV DC  Powered_Up_Time  Command/Feature_Name
  -- == -- == -- == == == -- -- -- -- --  ---------------  --------------------
  61 00 a8 00 30 00 00 15 f0 ee 88 40 00     01:30:04.821  WRITE FPDMA QUEUED
  61 00 a8 00 28 00 00 15 f0 ed e0 40 00     01:30:04.820  WRITE FPDMA QUEUED
  61 00 a8 00 20 00 00 15 f0 ed 38 40 00     01:30:04.819  WRITE FPDMA QUEUED
  61 00 a8 00 18 00 00 15 f0 ec 90 40 00     01:30:04.819  WRITE FPDMA QUEUED
  61 00 a8 00 10 00 00 15 f0 eb e8 40 00     01:30:04.818  WRITE FPDMA QUEUED

Error 4 [3] occurred at disk power-on lifetime: 6165 hours (256 days + 21 hours)
  When the command that caused the error occurred, the device was active or idle.

  After command completion occurred, registers were:
  ER -- ST COUNT  LBA_48  LH LM LL DV DC
  -- -- -- == -- == == == -- -- -- -- --
  40 -- 41 01 00 00 00 35 12 ac 88 05 00  Error: WP at LBA = 0x3512ac88 = 890416264

  Commands leading to the command that caused the error were:
  CR FEATR COUNT  LBA_48  LH LM LL DV DC  Powered_Up_Time  Command/Feature_Name
  -- == -- == -- == == == -- -- -- -- --  ---------------  --------------------
  61 00 a8 00 28 00 00 2b 2e 46 f0 40 00     01:28:35.828  WRITE FPDMA QUEUED
  61 00 a8 00 20 00 00 2b 2e 46 48 40 00     01:28:35.827  WRITE FPDMA QUEUED
  61 00 a8 00 18 00 00 2b 2e 45 a0 40 00     01:28:35.826  WRITE FPDMA QUEUED
  61 00 a8 00 10 00 00 2b 2e 44 f8 40 00     01:28:35.825  WRITE FPDMA QUEUED
  61 00 a8 00 08 00 00 2b 2e 44 50 40 00     01:28:35.825  WRITE FPDMA QUEUED

Error 3 [2] occurred at disk power-on lifetime: 6165 hours (256 days + 21 hours)
  When the command that caused the error occurred, the device was active or idle.

  After command completion occurred, registers were:
  ER -- ST COUNT  LBA_48  LH LM LL DV DC
  -- -- -- == -- == == == -- -- -- -- --
  40 -- 41 01 00 00 00 32 aa 09 88 02 00  Error: WP at LBA = 0x32aa0988 = 850004360

  Commands leading to the command that caused the error were:
  CR FEATR COUNT  LBA_48  LH LM LL DV DC  Powered_Up_Time  Command/Feature_Name
  -- == -- == -- == == == -- -- -- -- --  ---------------  --------------------
  61 00 a8 00 b0 00 00 2d c0 63 b8 40 00     01:20:15.154  WRITE FPDMA QUEUED
  61 00 a8 00 a8 00 00 2d c0 63 10 40 00     01:20:15.153  WRITE FPDMA QUEUED
  61 00 a8 00 a0 00 00 2d c0 62 68 40 00     01:20:15.152  WRITE FPDMA QUEUED
  61 00 a8 00 98 00 00 2d c0 61 c0 40 00     01:20:15.151  WRITE FPDMA QUEUED
  61 00 a8 00 90 00 00 2d c0 61 18 40 00     01:20:15.150  WRITE FPDMA QUEUED

Error 2 [1] occurred at disk power-on lifetime: 6165 hours (256 days + 21 hours)
  When the command that caused the error occurred, the device was active or idle.

  After command completion occurred, registers were:
  ER -- ST COUNT  LBA_48  LH LM LL DV DC
  -- -- -- == -- == == == -- -- -- -- --
  40 -- 41 01 00 00 00 32 84 af 88 02 00  Error: WP at LBA = 0x3284af88 = 847556488

  Commands leading to the command that caused the error were:
  CR FEATR COUNT  LBA_48  LH LM LL DV DC  Powered_Up_Time  Command/Feature_Name
  -- == -- == -- == == == -- -- -- -- --  ---------------  --------------------
  61 00 a8 00 90 00 00 2d 9a 5e d8 40 00     01:19:45.371  WRITE FPDMA QUEUED
  61 00 a8 00 88 00 00 2d 9a 5e 30 40 00     01:19:45.370  WRITE FPDMA QUEUED
  61 00 a8 00 80 00 00 2d 9a 5d 88 40 00     01:19:45.369  WRITE FPDMA QUEUED
  61 00 a8 00 78 00 00 2d 9a 5c e0 40 00     01:19:45.368  WRITE FPDMA QUEUED
  61 00 a8 00 70 00 00 2d 9a 5c 38 40 00     01:19:45.367  WRITE FPDMA QUEUED

SMART Extended Self-test Log Version: 1 (1 sectors)
Num  Test_Description    Status                  Remaining  LifeTime(hours)  LBA_of_first_error
# 1  Short offline       Completed without error       00%      6161         -
# 2  Short offline       Completed without error       00%        90         -
# 3  Short offline       Interrupted (host reset)      20%        57         -
# 4  Short offline       Completed without error       00%        25         -
# 5  Short offline       Interrupted (host reset)      30%        22         -

SMART Selective self-test log data structure revision number 1
 SPAN  MIN_LBA  MAX_LBA  CURRENT_TEST_STATUS
    1        0        0  Not_testing
    2        0        0  Not_testing
    3        0        0  Not_testing
    4        0        0  Not_testing
    5        0        0  Not_testing
Selective self-test flags (0x0):
  After scanning selected spans, do NOT read-scan remainder of disk.
If Selective self-test is pending on power-up, resume after 0 minute delay.

SCT Status Version:                  3
SCT Version (vendor specific):       256 (0x0100)
Device State:                        Active (0)
Current Temperature:                    32 Celsius
Power Cycle Min/Max Temperature:     19/33 Celsius
Lifetime    Min/Max Temperature:      9/46 Celsius
Specified Max Operating Temperature:    32 Celsius
Under/Over Temperature Limit Count:   0/0

SCT Temperature History Version:     2
Temperature Sampling Period:         1 minute
Temperature Logging Interval:        1 minute
Min/Max recommended Temperature:      0/60 Celsius
Min/Max Temperature Limit:           -40/65 Celsius
Temperature History Size (Index):    128 (72)

SCT Error Recovery Control:
           Read:     85 (8.5 seconds)
          Write:     85 (8.5 seconds)

Device Statistics (GP/SMART Log 0x04) not supported

Pending Defects log (GP Log 0x0c) not supported

SATA Phy Event Counters (GP Log 0x11)
ID      Size     Value  Description
0x0001  2            0  Command failed due to ICRC error
0x0002  2            0  R_ERR response for data FIS
0x0003  2            0  R_ERR response for device-to-host data FIS
0x0004  2            0  R_ERR response for host-to-device data FIS
0x0005  2            0  R_ERR response for non-data FIS
0x0006  2            0  R_ERR response for device-to-host non-data FIS
0x0007  2            0  R_ERR response for host-to-device non-data FIS
0x0009  2           64  Transition from drive PhyRdy to drive PhyNRdy
0x000a  2            0  Device-to-host register FISes sent due to a COMRESET
0x000b  2            0  CRC errors within host-to-device FIS
0x000d  2            0  Non-CRC errors within host-to-device FIS



