smartctl 7.2 2021-09-14 r5237 [x86_64-linux-5.17.1-1-default] (SUSE RPM)
Copyright (C) 2002-20, Bruce Allen, Christian Franke, www.smartmontools.org

=== START OF INFORMATION SECTION ===
Model Family:     HGST Travelstar 5K1000
Device Model:     HGST HTS541010A9E680
Serial Number:    --
LU WWN Device Id: 5 000cca ...
Firmware Version: JA0OA560
User Capacity:    1,000,204,886,016 bytes [1.00 TB]
Sector Sizes:     512 bytes logical, 4096 bytes physical
Rotation Rate:    5400 rpm
Form Factor:      2.5 inches
Device is:        In smartctl database [for details use: -P show]
ATA Version is:   ATA8-ACS T13/1699-D revision 6
SATA Version is:  SATA 2.6, 6.0 Gb/s (current: 3.0 Gb/s)
Local Time is:    Fri Apr  8 13:04:22 2022 CEST
SMART support is: Available - device has SMART capability.
SMART support is: Enabled
AAM feature is:   Unavailable
APM level is:     1 (minimum power consumption with standby)
Rd look-ahead is: Enabled
Write cache is:   Enabled
DSN feature is:   Unavailable
ATA Security is:  Disabled, NOT FROZEN [SEC1]
Wt Cache Reorder: Unknown

=== START OF READ SMART DATA SECTION ===
SMART Status not supported: Incomplete response, ATA output registers missing
SMART overall-health self-assessment test result: PASSED
Warning: This result is based on an Attribute check.

General SMART Values:
Offline data collection status:  (0x00)	Offline data collection activity
					was never started.
					Auto Offline Data Collection: Disabled.
Self-test execution status:      (   0)	The previous self-test routine completed
					without error or no self-test has ever 
					been run.
Total time to complete Offline 
data collection: 		(   45) seconds.
Offline data collection
capabilities: 			 (0x5b) SMART execute Offline immediate.
					Auto Offline data collection on/off support.
					Suspend Offline collection upon new
					command.
					Offline surface scan supported.
					Self-test supported.
					No Conveyance Self-test supported.
					Selective Self-test supported.
SMART capabilities:            (0x0003)	Saves SMART data before entering
					power-saving mode.
					Supports SMART auto save timer.
Error logging capability:        (0x01)	Error logging supported.
					General Purpose Logging supported.
Short self-test routine 
recommended polling time: 	 (   2) minutes.
Extended self-test routine
recommended polling time: 	 ( 244) minutes.
SCT capabilities: 	       (0x003d)	SCT Status supported.
					SCT Error Recovery Control supported.
					SCT Feature Control supported.
					SCT Data Table supported.

SMART Attributes Data Structure revision number: 16
Vendor Specific SMART Attributes with Thresholds:
ID# ATTRIBUTE_NAME          FLAGS    VALUE WORST THRESH FAIL RAW_VALUE
  1 Raw_Read_Error_Rate     PO-R--   100   100   062    -    0
  2 Throughput_Performance  P-S---   100   100   040    -    0
  3 Spin_Up_Time            POS---   227   227   033    -    1
  4 Start_Stop_Count        -O--C-   001   001   000    -    527625
  5 Reallocated_Sector_Ct   PO--CK   100   100   005    -    0
  7 Seek_Error_Rate         PO-R--   100   100   067    -    0
  8 Seek_Time_Performance   P-S---   100   100   040    -    0
  9 Power_On_Hours          -O--C-   007   007   000    -    40869
 10 Spin_Retry_Count        PO--C-   100   100   060    -    0
 12 Power_Cycle_Count       -O--CK   097   097   000    -    4779
191 G-Sense_Error_Rate      -O-R--   100   100   000    -    0
192 Power-Off_Retract_Count -O--CK   098   098   000    -    498
193 Load_Cycle_Count        -O--C-   001   001   000    -    1015218
194 Temperature_Celsius     -O----   200   200   000    -    30 (Min/Max 12/53)
196 Reallocated_Event_Count -O--CK   100   100   000    -    0
197 Current_Pending_Sector  -O---K   100   100   000    -    0
198 Offline_Uncorrectable   ---R--   100   100   000    -    0
199 UDMA_CRC_Error_Count    -O-R--   200   200   000    -    11
223 Load_Retry_Count        -O-R--   100   100   000    -    0
                            ||||||_ K auto-keep
                            |||||__ C event count
                            ||||___ R error rate
                            |||____ S speed/performance
                            ||_____ O updated online
                            |______ P prefailure warning

General Purpose Log Directory Version 1
SMART           Log Directory Version 1 [multi-sector log support]
Address    Access  R/W   Size  Description
0x00       GPL,SL  R/O      1  Log Directory
0x01           SL  R/O      1  Summary SMART error log
0x02           SL  R/O      1  Comprehensive SMART error log
0x03       GPL     R/O      1  Ext. Comprehensive SMART error log
0x06           SL  R/O      1  SMART self-test log
0x07       GPL     R/O      1  Extended self-test log
0x09           SL  R/W      1  Selective self-test log
0x10       GPL     R/O      1  NCQ Command Error log
0x11       GPL     R/O      1  SATA Phy Event Counters log
0x80-0x9f  GPL,SL  R/W     16  Host vendor specific log
0xe0       GPL,SL  R/W      1  SCT Command/Status
0xe1       GPL,SL  R/W      1  SCT Data Transfer

SMART Extended Comprehensive Error Log Version: 1 (1 sectors)
Device Error Count: 11 (device log contains only the most recent 4 errors)
	CR     = Command Register
	FEATR  = Features Register
	COUNT  = Count (was: Sector Count) Register
	LBA_48 = Upper bytes of LBA High/Mid/Low Registers ]  ATA-8
	LH     = LBA High (was: Cylinder High) Register    ]   LBA
	LM     = LBA Mid (was: Cylinder Low) Register      ] Register
	LL     = LBA Low (was: Sector Number) Register     ]
	DV     = Device (was: Device/Head) Register
	DC     = Device Control Register
	ER     = Error register
	ST     = Status register
Powered_Up_Time is measured from power on, and printed as
DDd+hh:mm:SS.sss where DD=days, hh=hours, mm=minutes,
SS=sec, and sss=millisec. It "wraps" after 49.710 days.

Error 11 [2] occurred at disk power-on lifetime: 37783 hours (1574 days + 7 hours)
  When the command that caused the error occurred, the device was active or idle.

  After command completion occurred, registers were:
  ER -- ST COUNT  LBA_48  LH LM LL DV DC
  -- -- -- == -- == == == -- -- -- -- --
  84 -- 51 00 01 00 00 33 e9 d3 cf 03 00  Error: ICRC, ABRT 1 sectors at LBA = 0x33e9d3cf = 870962127

  Commands leading to the command that caused the error were:
  CR FEATR COUNT  LBA_48  LH LM LL DV DC  Powered_Up_Time  Command/Feature_Name
  -- == -- == -- == == == -- -- -- -- --  ---------------  --------------------
  35 00 00 00 f0 00 00 33 e9 d2 e0 40 00     11:36:34.685  WRITE DMA EXT
  35 00 00 00 f0 00 00 33 e9 d1 f0 40 00     11:36:34.681  WRITE DMA EXT
  25 00 00 00 f0 00 00 3d 24 2a d0 40 00     11:36:34.678  READ DMA EXT
  35 00 00 00 f0 00 00 33 e9 d1 00 40 00     11:36:34.675  WRITE DMA EXT
  25 00 00 00 f0 00 00 3d 24 29 e0 40 00     11:36:34.671  READ DMA EXT

Error 10 [1] occurred at disk power-on lifetime: 16643 hours (693 days + 11 hours)
  When the command that caused the error occurred, the device was active or idle.

  After command completion occurred, registers were:
  ER -- ST COUNT  LBA_48  LH LM LL DV DC
  -- -- -- == -- == == == -- -- -- -- --
  84 -- 51 00 71 00 00 3a 38 fb 97 0a 00  Error: ICRC, ABRT 113 sectors at LBA = 0x3a38fb97 = 976812951

  Commands leading to the command that caused the error were:
  CR FEATR COUNT  LBA_48  LH LM LL DV DC  Powered_Up_Time  Command/Feature_Name
  -- == -- == -- == == == -- -- -- -- --  ---------------  --------------------
  25 00 d0 00 80 00 00 3a 38 fb 88 6a 00     00:02:14.375  READ DMA EXT
  25 00 d0 00 80 00 00 3a 38 fb 08 6a 00     00:02:14.374  READ DMA EXT
  25 00 d0 00 80 00 00 3a 38 fa 88 6a 00     00:02:14.372  READ DMA EXT
  25 00 d0 00 80 00 00 3a 38 fa 08 6a 00     00:02:14.370  READ DMA EXT
  25 00 d0 00 80 00 00 3a 38 f9 88 6a 00     00:02:14.368  READ DMA EXT

Error 9 [0] occurred at disk power-on lifetime: 16619 hours (692 days + 11 hours)
  When the command that caused the error occurred, the device was active or idle.

  After command completion occurred, registers were:
  ER -- ST COUNT  LBA_48  LH LM LL DV DC
  -- -- -- == -- == == == -- -- -- -- --
  84 -- 51 00 41 00 00 00 60 42 ff 00 00  Error: ICRC, ABRT 65 sectors at LBA = 0x006042ff = 6308607

  Commands leading to the command that caused the error were:
  CR FEATR COUNT  LBA_48  LH LM LL DV DC  Powered_Up_Time  Command/Feature_Name
  -- == -- == -- == == == -- -- -- -- --  ---------------  --------------------
  25 00 d0 00 80 00 00 00 60 42 c0 40 00     00:00:04.791  READ DMA EXT
  25 00 d0 00 80 00 00 00 60 42 40 40 00     00:00:04.789  READ DMA EXT
  25 00 d0 00 80 00 00 00 60 41 c0 40 00     00:00:04.787  READ DMA EXT
  25 00 d0 00 80 00 00 00 60 41 40 40 00     00:00:04.785  READ DMA EXT
  25 00 d0 00 80 00 00 00 60 40 c0 40 00     00:00:04.783  READ DMA EXT

Error 8 [3] occurred at disk power-on lifetime: 16522 hours (688 days + 10 hours)
  When the command that caused the error occurred, the device was active or idle.

  After command completion occurred, registers were:
  ER -- ST COUNT  LBA_48  LH LM LL DV DC
  -- -- -- == -- == == == -- -- -- -- --
  84 -- 51 00 41 00 00 57 95 69 1f 07 00  Error: ICRC, ABRT 65 sectors at LBA = 0x5795691f = 1469409567

  Commands leading to the command that caused the error were:
  CR FEATR COUNT  LBA_48  LH LM LL DV DC  Powered_Up_Time  Command/Feature_Name
  -- == -- == -- == == == -- -- -- -- --  ---------------  --------------------
  25 00 d0 00 80 00 00 57 95 68 e0 47 00     00:32:33.996  READ DMA EXT
  25 00 d0 00 80 00 00 57 95 68 60 47 00     00:32:33.994  READ DMA EXT
  25 00 d0 00 80 00 00 57 95 67 e0 47 00     00:32:33.992  READ DMA EXT
  25 00 d0 00 80 00 00 57 95 67 60 47 00     00:32:33.991  READ DMA EXT
  25 00 d0 00 80 00 00 57 95 66 e0 47 00     00:32:33.989  READ DMA EXT

SMART Extended Self-test Log Version: 1 (1 sectors)
Num  Test_Description    Status                  Remaining  LifeTime(hours)  LBA_of_first_error
# 1  Short offline       Completed without error       00%     40860         -
# 2  Short offline       Completed without error       00%     40823         -
# 3  Short offline       Completed without error       00%     40799         -
# 4  Extended offline    Completed without error       00%     40777         -
# 5  Short offline       Completed without error       00%     40751         -
# 6  Short offline       Completed without error       00%     40727         -
# 7  Short offline       Completed without error       00%     40703         -
# 8  Short offline       Completed without error       00%     40679         -
# 9  Short offline       Completed without error       00%     40669         -
#10  Short offline       Completed without error       00%     40645         -
#11  Short offline       Completed without error       00%     40629         -
#12  Short offline       Completed without error       00%     40621         -
#13  Short offline       Completed without error       00%     40598         -
#14  Short offline       Completed without error       00%     40574         -
#15  Short offline       Completed without error       00%     40551         -
#16  Short offline       Completed without error       00%     40527         -
#17  Short offline       Completed without error       00%     40503         -
#18  Short offline       Completed without error       00%     40479         -
#19  Short offline       Completed without error       00%     40455         -

SMART Selective self-test log data structure revision number 1
 SPAN  MIN_LBA  MAX_LBA  CURRENT_TEST_STATUS
    1        0        0  Not_testing
    2        0        0  Not_testing
    3        0        0  Not_testing
    4        0        0  Not_testing
    5        0        0  Not_testing
Selective self-test flags (0x0):
  After scanning selected spans, do NOT read-scan remainder of disk.
If Selective self-test is pending on power-up, resume after 0 minute delay.

SCT Status Version:                  3
SCT Version (vendor specific):       256 (0x0100)
Device State:                        Active (0)
Current Temperature:                    30 Celsius
Power Cycle Min/Max Temperature:     26/31 Celsius
Lifetime    Min/Max Temperature:     12/53 Celsius
Specified Max Operating Temperature:    30 Celsius
Under/Over Temperature Limit Count:   0/0

SCT Temperature History Version:     2
Temperature Sampling Period:         1 minute
Temperature Logging Interval:        1 minute
Min/Max recommended Temperature:      0/60 Celsius
Min/Max Temperature Limit:           -40/65 Celsius
Temperature History Size (Index):    128 (87)

SMART WRITE LOG does not return COUNT and LBA_LOW register
SCT (Get) Error Recovery Control command failed

Device Statistics (GP/SMART Log 0x04) not supported

Pending Defects log (GP Log 0x0c) not supported

SATA Phy Event Counters (GP Log 0x11)
ID      Size     Value  Description
0x0001  2            0  Command failed due to ICRC error
0x0002  2            0  R_ERR response for data FIS
0x0003  2            0  R_ERR response for device-to-host data FIS
0x0004  2            0  R_ERR response for host-to-device data FIS
0x0005  2            0  R_ERR response for non-data FIS
0x0006  2            0  R_ERR response for device-to-host non-data FIS
0x0007  2            0  R_ERR response for host-to-device non-data FIS
0x0009  2            5  Transition from drive PhyRdy to drive PhyNRdy
0x000a  2            5  Device-to-host register FISes sent due to a COMRESET
0x000b  2            0  CRC errors within host-to-device FIS
0x000d  2            0  Non-CRC errors within host-to-device FIS

