=== START OF INFORMATION SECTION ===
Model Number:                       SSSTC CL1-8D256-HP
Serial Number:                      --
Firmware Version:                   L183
PCI Vendor ID:                      0x1e95
PCI Vendor Subsystem ID:            0x126f
IEEE OUI Identifier:                0x38f601
Total NVM Capacity:                 256,060,514,304 [256 GB]
Unallocated NVM Capacity:           0
Controller ID:                      1
Number of Namespaces:               1
Namespace 1 Size/Capacity:          256,060,514,304 [256 GB]
Namespace 1 Formatted LBA Size:     512
Namespace 1 IEEE EUI-64:            38f601 ...
Local Time is:                      Tue Mar 14 23:49:54 2023 CET
Firmware Updates (0x14):            2 Slots, no Reset required
Optional Admin Commands (0x0017):   Security Format Frmw_DL Self_Test
Optional NVM Commands (0x001f):     Comp Wr_Unc DS_Mngmt Wr_Zero Sav/Sel_Feat
Maximum Data Transfer Size:         64 Pages
Warning  Comp. Temp. Threshold:     84 Celsius
Critical Comp. Temp. Threshold:     85 Celsius

Supported Power States
St Op     Max   Active     Idle   RL RT WL WT  Ent_Lat  Ex_Lat
 0 +     3.50W       -        -    0  0  0  0        0       0
 1 +     2.10W       -        -    1  1  1  1        0       0
 2 +     1.65W       -        -    2  2  2  2        0       0
 3 -   0.0500W       -        -    3  3  3  3     5000    5000
 4 -   0.0050W       -        -    4  4  4  4     5000   20000

Supported LBA Sizes (NSID 0x1)
Id Fmt  Data  Metadt  Rel_Perf
 0 +     512       0         0

=== START OF SMART DATA SECTION ===
SMART overall-health self-assessment test result: PASSED

SMART/Health Information (NVMe Log 0x02)
Critical Warning:                   0x00
Temperature:                        29 Celsius
Available Spare:                    100%
Available Spare Threshold:          5%
Percentage Used:                    0%
Data Units Read:                    1,410,812 [722 GB]
Data Units Written:                 2,898,759 [1.48 TB]
Host Read Commands:                 15,186,277
Host Write Commands:                18,548,632
Controller Busy Time:               214
Power Cycles:                       231
Power On Hours:                     1,595
Unsafe Shutdowns:                   137
Media and Data Integrity Errors:    0
Error Information Log Entries:      0
Warning  Comp. Temperature Time:    0
Critical Comp. Temperature Time:    0
Temperature Sensor 1:               29 Celsius

Error Information (NVMe Log 0x01, max 64 entries)
No Errors Logged

