smartctl 7.2 2020-12-30 r5155 [x86_64-linux-5.15.0-119-generic] (local build)
Copyright (C) 2002-20, Bruce Allen, Christian Franke, www.smartmontools.org

=== START OF INFORMATION SECTION ===
Model Number:                       SKHynix_HFS512GEJ4X112N
Serial Number:                      --
Firmware Version:                   51040C31
PCI Vendor/Subsystem ID:            0x1c5c
IEEE OUI Identifier:                0xace42e
Controller ID:                      1
NVMe Version:                       1.4
Number of Namespaces:               1
Namespace 1 Size/Capacity:          512,110,190,592 [512 GB]
Namespace 1 Formatted LBA Size:     512
Namespace 1 IEEE EUI-64:            ace42e ...
Local Time is:                      Wed Aug 28 18:21:38 2024 CEST
Firmware Updates (0x16):            3 Slots, no Reset required
Optional Admin Commands (0x0017):   Security Format Frmw_DL Self_Test
Optional NVM Commands (0x005f):     Comp Wr_Unc DS_Mngmt Wr_Zero Sav/Sel_Feat Timestmp
Log Page Attributes (0x1e):         Cmd_Eff_Lg Ext_Get_Lg Telmtry_Lg Pers_Ev_Lg
Maximum Data Transfer Size:         64 Pages
Warning  Comp. Temp. Threshold:     86 Celsius
Critical Comp. Temp. Threshold:     87 Celsius

Supported Power States
St Op     Max   Active     Idle   RL RT WL WT  Ent_Lat  Ex_Lat
 0 +   4.5000W       -        -    0  0  0  0      100     100
 1 +   3.0000W       -        -    1  1  1  1      200     200
 2 +   0.6000W       -        -    2  2  2  2      400     400
 3 -   0.0150W       -        -    3  3  3  3     2000    2000
 4 -   0.0030W       -        -    4  4  4  4     5000   10000

Supported LBA Sizes (NSID 0x1)
Id Fmt  Data  Metadt  Rel_Perf
 0 +     512       0         0

=== START OF SMART DATA SECTION ===
SMART overall-health self-assessment test result: PASSED

SMART/Health Information (NVMe Log 0x02)
Critical Warning:                   0x00
Temperature:                        39 Celsius
Available Spare:                    100%
Available Spare Threshold:          10%
Percentage Used:                    0%
Data Units Read:                    1,025,830 [525 GB]
Data Units Written:                 1,510,040 [773 GB]
Host Read Commands:                 12,131,042
Host Write Commands:                15,552,374
Controller Busy Time:               364
Power Cycles:                       70
Power On Hours:                     110
Unsafe Shutdowns:                   19
Media and Data Integrity Errors:    0
Error Information Log Entries:      0
Warning  Comp. Temperature Time:    0
Critical Comp. Temperature Time:    0
Temperature Sensor 1:               42 Celsius
Temperature Sensor 2:               39 Celsius

Error Information (NVMe Log 0x01, 16 of 256 entries)
No Errors Logged

