smartctl 7.1 2019-12-30 r5022 [x86_64-linux-5.7.9-1-MANJARO] (local build)
Copyright (C) 2002-19, Bruce Allen, Christian Franke, www.smartmontools.org

=== START OF INFORMATION SECTION ===
Model Family:     Western Digital Red
Device Model:     WDC WD60EFRX-68MYMN1
Serial Number:    --
LU WWN Device Id: 5 0014ee ...
Firmware Version: 82.00A82
User Capacity:    6,001,175,126,016 bytes [6.00 TB]
Sector Sizes:     512 bytes logical, 4096 bytes physical
Rotation Rate:    5700 rpm
Device is:        In smartctl database [for details use: -P show]
ATA Version is:   ACS-2, ACS-3 T13/2161-D revision 3b
SATA Version is:  SATA 3.1, 6.0 Gb/s (current: 6.0 Gb/s)
Local Time is:    Sat Jul 25 19:00:49 2020 CEST
SMART support is: Available - device has SMART capability.
SMART support is: Enabled
AAM feature is:   Unavailable
APM feature is:   Unavailable
Rd look-ahead is: Enabled
Write cache is:   Enabled
DSN feature is:   Unavailable
ATA Security is:  Disabled, frozen [SEC2]
Wt Cache Reorder: Enabled

=== START OF READ SMART DATA SECTION ===
SMART overall-health self-assessment test result: PASSED

General SMART Values:
Offline data collection status:  (0x00)	Offline data collection activity
					was never started.
					Auto Offline Data Collection: Disabled.
Self-test execution status:      (   0)	The previous self-test routine completed
					without error or no self-test has ever 
					been run.
Total time to complete Offline 
data collection: 		( 8144) seconds.
Offline data collection
capabilities: 			 (0x7b) SMART execute Offline immediate.
					Auto Offline data collection on/off support.
					Suspend Offline collection upon new
					command.
					Offline surface scan supported.
					Self-test supported.
					Conveyance Self-test supported.
					Selective Self-test supported.
SMART capabilities:            (0x0003)	Saves SMART data before entering
					power-saving mode.
					Supports SMART auto save timer.
Error logging capability:        (0x01)	Error logging supported.
					General Purpose Logging supported.
Short self-test routine 
recommended polling time: 	 (   2) minutes.
Extended self-test routine
recommended polling time: 	 ( 735) minutes.
Conveyance self-test routine
recommended polling time: 	 (   5) minutes.
SCT capabilities: 	       (0x303d)	SCT Status supported.
					SCT Error Recovery Control supported.
					SCT Feature Control supported.
					SCT Data Table supported.

SMART Attributes Data Structure revision number: 16
Vendor Specific SMART Attributes with Thresholds:
ID# ATTRIBUTE_NAME          FLAGS    VALUE WORST THRESH FAIL RAW_VALUE
  1 Raw_Read_Error_Rate     POSR-K   200   198   051    -    0
  3 Spin_Up_Time            POS--K   196   192   021    -    9183
  4 Start_Stop_Count        -O--CK   097   097   000    -    3942
  5 Reallocated_Sector_Ct   PO--CK   200   200   140    -    0
  7 Seek_Error_Rate         -OSR-K   200   200   000    -    0
  9 Power_On_Hours          -O--CK   053   053   000    -    34897
 10 Spin_Retry_Count        -O--CK   100   100   000    -    0
 11 Calibration_Retry_Count -O--CK   100   100   000    -    0
 12 Power_Cycle_Count       -O--CK   100   100   000    -    877
192 Power-Off_Retract_Count -O--CK   200   200   000    -    11
193 Load_Cycle_Count        -O--CK   192   192   000    -    25646
194 Temperature_Celsius     -O---K   118   108   000    -    34
196 Reallocated_Event_Count -O--CK   200   200   000    -    0
197 Current_Pending_Sector  -O--CK   200   200   000    -    0
198 Offline_Uncorrectable   ----CK   100   253   000    -    0
199 UDMA_CRC_Error_Count    -O--CK   200   200   000    -    0
200 Multi_Zone_Error_Rate   ---R--   100   253   000    -    0
                            ||||||_ K auto-keep
                            |||||__ C event count
                            ||||___ R error rate
                            |||____ S speed/performance
                            ||_____ O updated online
                            |______ P prefailure warning

General Purpose Log Directory Version 1
SMART           Log Directory Version 1 [multi-sector log support]
Address    Access  R/W   Size  Description
0x00       GPL,SL  R/O      1  Log Directory
0x01           SL  R/O      1  Summary SMART error log
0x02           SL  R/O      5  Comprehensive SMART error log
0x03       GPL     R/O      6  Ext. Comprehensive SMART error log
0x06           SL  R/O      1  SMART self-test log
0x07       GPL     R/O      1  Extended self-test log
0x09           SL  R/W      1  Selective self-test log
0x10       GPL     R/O      1  NCQ Command Error log
0x11       GPL     R/O      1  SATA Phy Event Counters log
0x21       GPL     R/O      1  Write stream error log
0x22       GPL     R/O      1  Read stream error log
0x30       GPL,SL  R/O      9  IDENTIFY DEVICE data log
0x80-0x9f  GPL,SL  R/W     16  Host vendor specific log
0xa0-0xa7  GPL,SL  VS      16  Device vendor specific log
0xa8-0xb6  GPL,SL  VS       1  Device vendor specific log
0xb7       GPL,SL  VS      40  Device vendor specific log
0xbd       GPL,SL  VS       1  Device vendor specific log
0xc0       GPL,SL  VS       1  Device vendor specific log
0xc1       GPL     VS      93  Device vendor specific log
0xe0       GPL,SL  R/W      1  SCT Command/Status
0xe1       GPL,SL  R/W      1  SCT Data Transfer

SMART Extended Comprehensive Error Log Version: 1 (6 sectors)
Device Error Count: 136 (device log contains only the most recent 24 errors)
	CR     = Command Register
	FEATR  = Features Register
	COUNT  = Count (was: Sector Count) Register
	LBA_48 = Upper bytes of LBA High/Mid/Low Registers ]  ATA-8
	LH     = LBA High (was: Cylinder High) Register    ]   LBA
	LM     = LBA Mid (was: Cylinder Low) Register      ] Register
	LL     = LBA Low (was: Sector Number) Register     ]
	DV     = Device (was: Device/Head) Register
	DC     = Device Control Register
	ER     = Error register
	ST     = Status register
Powered_Up_Time is measured from power on, and printed as
DDd+hh:mm:SS.sss where DD=days, hh=hours, mm=minutes,
SS=sec, and sss=millisec. It "wraps" after 49.710 days.

Error 136 [15] occurred at disk power-on lifetime: 33612 hours (1400 days + 12 hours)
  When the command that caused the error occurred, the device was active or idle.

  After command completion occurred, registers were:
  ER -- ST COUNT  LBA_48  LH LM LL DV DC
  -- -- -- == -- == == == -- -- -- -- --
  40 -- 51 00 08 00 00 69 8a 4b f0 e0 00  Error: UNC 8 sectors at LBA = 0x698a4bf0 = 1770671088

  Commands leading to the command that caused the error were:
  CR FEATR COUNT  LBA_48  LH LM LL DV DC  Powered_Up_Time  Command/Feature_Name
  -- == -- == -- == == == -- -- -- -- --  ---------------  --------------------
  25 00 00 00 08 00 00 69 8a 4b f0 e0 00     02:04:51.535  READ DMA EXT
  ea 00 00 00 00 59 0a c8 00 00 00 e0 00     02:04:50.845  FLUSH CACHE EXT
  35 00 00 00 08 00 00 00 59 0a c0 e0 00     02:04:50.833  WRITE DMA EXT
  35 00 00 00 38 00 00 00 5a 33 c0 e0 00     02:04:50.833  WRITE DMA EXT
  35 00 00 01 00 00 00 7d 86 b8 f0 e0 00     02:04:50.833  WRITE DMA EXT

Error 135 [14] occurred at disk power-on lifetime: 33612 hours (1400 days + 12 hours)
  When the command that caused the error occurred, the device was active or idle.

  After command completion occurred, registers were:
  ER -- ST COUNT  LBA_48  LH LM LL DV DC
  -- -- -- == -- == == == -- -- -- -- --
  40 -- 51 00 08 00 00 69 8a 4b f0 e0 00  Error: UNC 8 sectors at LBA = 0x698a4bf0 = 1770671088

  Commands leading to the command that caused the error were:
  CR FEATR COUNT  LBA_48  LH LM LL DV DC  Powered_Up_Time  Command/Feature_Name
  -- == -- == -- == == == -- -- -- -- --  ---------------  --------------------
  25 00 00 00 08 00 00 69 8a 4b f0 e0 00     02:04:47.171  READ DMA EXT
  25 00 00 00 08 00 00 69 8a 4b c0 e0 00     02:04:47.170  READ DMA EXT
  25 00 00 00 04 00 00 69 8a 4c 70 e0 00     02:04:47.170  READ DMA EXT
  25 00 00 00 08 00 00 69 8a 4c 68 e0 00     02:04:47.170  READ DMA EXT
  25 00 00 00 08 00 00 69 8a 4c 60 e0 00     02:04:47.170  READ DMA EXT

Error 134 [13] occurred at disk power-on lifetime: 33612 hours (1400 days + 12 hours)
  When the command that caused the error occurred, the device was active or idle.

  After command completion occurred, registers were:
  ER -- ST COUNT  LBA_48  LH LM LL DV DC
  -- -- -- == -- == == == -- -- -- -- --
  40 -- 51 00 08 00 00 69 8a 4b f0 e0 00  Error: UNC 8 sectors at LBA = 0x698a4bf0 = 1770671088

  Commands leading to the command that caused the error were:
  CR FEATR COUNT  LBA_48  LH LM LL DV DC  Powered_Up_Time  Command/Feature_Name
  -- == -- == -- == == == -- -- -- -- --  ---------------  --------------------
  25 00 00 00 08 00 00 69 8a 4b f0 e0 00     02:04:43.296  READ DMA EXT
  35 00 00 00 28 00 00 0d d0 5b b0 e0 00     02:04:43.293  WRITE DMA EXT
  35 00 00 00 40 00 00 06 34 cf 10 e0 00     02:04:43.293  WRITE DMA EXT
  35 00 00 01 00 00 00 06 34 ce 10 e0 00     02:04:43.293  WRITE DMA EXT
  35 00 00 00 80 00 00 14 38 34 40 e0 00     02:04:43.293  WRITE DMA EXT

Error 133 [12] occurred at disk power-on lifetime: 33612 hours (1400 days + 12 hours)
  When the command that caused the error occurred, the device was active or idle.

  After command completion occurred, registers were:
  ER -- ST COUNT  LBA_48  LH LM LL DV DC
  -- -- -- == -- == == == -- -- -- -- --
  40 -- 51 00 08 00 00 69 8a 4b f0 e0 00  Error: UNC 8 sectors at LBA = 0x698a4bf0 = 1770671088

  Commands leading to the command that caused the error were:
  CR FEATR COUNT  LBA_48  LH LM LL DV DC  Powered_Up_Time  Command/Feature_Name
  -- == -- == -- == == == -- -- -- -- --  ---------------  --------------------
  25 00 00 00 08 00 00 69 8a 4b f0 e0 00     02:04:39.351  READ DMA EXT
  25 00 00 00 08 00 00 69 8a 4b e8 e0 00     02:04:39.351  READ DMA EXT
  25 00 00 00 08 00 00 69 8a 4b e0 e0 00     02:04:39.351  READ DMA EXT
  25 00 00 00 08 00 00 69 8a 4b d8 e0 00     02:04:39.350  READ DMA EXT
  25 00 00 00 08 00 00 69 8a 4b d0 e0 00     02:04:39.350  READ DMA EXT

Error 132 [11] occurred at disk power-on lifetime: 33612 hours (1400 days + 12 hours)
  When the command that caused the error occurred, the device was active or idle.

  After command completion occurred, registers were:
  ER -- ST COUNT  LBA_48  LH LM LL DV DC
  -- -- -- == -- == == == -- -- -- -- --
  40 -- 51 00 80 00 00 69 8a 4b f0 e0 00  Error: UNC 128 sectors at LBA = 0x698a4bf0 = 1770671088

  Commands leading to the command that caused the error were:
  CR FEATR COUNT  LBA_48  LH LM LL DV DC  Powered_Up_Time  Command/Feature_Name
  -- == -- == -- == == == -- -- -- -- --  ---------------  --------------------
  25 00 00 00 80 00 00 69 8a 4b c0 e0 00     02:04:35.298  READ DMA EXT
  25 00 00 00 08 00 00 69 8a 4b b8 e0 00     02:04:35.298  READ DMA EXT
  25 00 00 00 08 00 00 69 8a 4b b0 e0 00     02:04:35.298  READ DMA EXT
  25 00 00 00 08 00 00 69 8a 4b a8 e0 00     02:04:35.298  READ DMA EXT
  25 00 00 00 08 00 00 69 8a 4b a0 e0 00     02:04:35.298  READ DMA EXT

Error 131 [10] occurred at disk power-on lifetime: 33612 hours (1400 days + 12 hours)
  When the command that caused the error occurred, the device was active or idle.

  After command completion occurred, registers were:
  ER -- ST COUNT  LBA_48  LH LM LL DV DC
  -- -- -- == -- == == == -- -- -- -- --
  40 -- 51 00 b4 00 00 69 8a 4b f0 e0 00  Error: UNC 180 sectors at LBA = 0x698a4bf0 = 1770671088

  Commands leading to the command that caused the error were:
  CR FEATR COUNT  LBA_48  LH LM LL DV DC  Powered_Up_Time  Command/Feature_Name
  -- == -- == -- == == == -- -- -- -- --  ---------------  --------------------
  25 00 00 00 b4 00 00 69 8a 4b c0 e0 00     02:04:30.661  READ DMA EXT
  25 00 00 01 00 00 00 69 8a 4a c0 e0 00     02:04:30.661  READ DMA EXT
  25 00 00 00 40 00 00 69 8a 4a 80 e0 00     02:04:30.661  READ DMA EXT
  25 00 00 00 80 00 00 69 8a 4a 00 e0 00     02:04:30.660  READ DMA EXT
  25 00 00 00 80 00 00 69 8a 49 80 e0 00     02:04:30.660  READ DMA EXT

Error 130 [9] occurred at disk power-on lifetime: 33612 hours (1400 days + 12 hours)
  When the command that caused the error occurred, the device was active or idle.

  After command completion occurred, registers were:
  ER -- ST COUNT  LBA_48  LH LM LL DV DC
  -- -- -- == -- == == == -- -- -- -- --
  40 -- 51 00 ec 00 00 69 8a 4b f0 e0 00  Error: UNC 236 sectors at LBA = 0x698a4bf0 = 1770671088

  Commands leading to the command that caused the error were:
  CR FEATR COUNT  LBA_48  LH LM LL DV DC  Powered_Up_Time  Command/Feature_Name
  -- == -- == -- == == == -- -- -- -- --  ---------------  --------------------
  25 00 00 00 ec 00 00 69 8a 4b 88 e0 00     02:04:26.469  READ DMA EXT
  25 00 00 01 00 00 00 69 8a 4a 88 e0 00     02:04:26.469  READ DMA EXT
  25 00 00 01 00 00 00 69 8a 49 88 e0 00     02:04:26.468  READ DMA EXT
  25 00 00 01 00 00 00 69 8a 48 88 e0 00     02:04:26.468  READ DMA EXT
  25 00 00 00 48 00 00 69 8a 48 40 e0 00     02:04:26.468  READ DMA EXT

Error 129 [8] occurred at disk power-on lifetime: 33612 hours (1400 days + 12 hours)
  When the command that caused the error occurred, the device was active or idle.

  After command completion occurred, registers were:
  ER -- ST COUNT  LBA_48  LH LM LL DV DC
  -- -- -- == -- == == == -- -- -- -- --
  40 -- 51 00 ec 00 00 69 8a 4b f0 e0 00  Error: UNC 236 sectors at LBA = 0x698a4bf0 = 1770671088

  Commands leading to the command that caused the error were:
  CR FEATR COUNT  LBA_48  LH LM LL DV DC  Powered_Up_Time  Command/Feature_Name
  -- == -- == -- == == == -- -- -- -- --  ---------------  --------------------
  25 00 00 00 ec 00 00 69 8a 4b 88 e0 00     02:04:22.077  READ DMA EXT
  25 00 00 01 00 00 00 69 8a 4a 88 e0 00     02:04:22.076  READ DMA EXT
  25 00 00 01 00 00 00 69 8a 49 88 e0 00     02:04:22.076  READ DMA EXT
  25 00 00 01 00 00 00 69 8a 48 88 e0 00     02:04:22.076  READ DMA EXT
  25 00 00 01 00 00 00 69 8a 47 88 e0 00     02:04:22.075  READ DMA EXT

SMART Extended Self-test Log Version: 1 (1 sectors)
No self-tests have been logged.  [To run self-tests, use: smartctl -t]

SMART Selective self-test log data structure revision number 1
 SPAN  MIN_LBA  MAX_LBA  CURRENT_TEST_STATUS
    1        0        0  Not_testing
    2        0        0  Not_testing
    3        0        0  Not_testing
    4        0        0  Not_testing
    5        0        0  Not_testing
Selective self-test flags (0x0):
  After scanning selected spans, do NOT read-scan remainder of disk.
If Selective self-test is pending on power-up, resume after 0 minute delay.

SCT Status Version:                  3
SCT Version (vendor specific):       258 (0x0102)
Device State:                        Active (0)
Current Temperature:                    34 Celsius
Power Cycle Min/Max Temperature:     20/35 Celsius
Lifetime    Min/Max Temperature:      2/44 Celsius
Under/Over Temperature Limit Count:   0/0
Vendor specific:
00 01 00 00 00 00 00 00 00 00 00 00 00 00 00 00
00 00 00 00 00 00 00 00 00 00 00 00 00 00 00 00

SCT Temperature History Version:     2
Temperature Sampling Period:         1 minute
Temperature Logging Interval:        1 minute
Min/Max recommended Temperature:      0/60 Celsius
Min/Max Temperature Limit:           -41/85 Celsius
Temperature History Size (Index):    478 (331)

SCT Error Recovery Control:
           Read:     70 (7.0 seconds)
          Write:     70 (7.0 seconds)

Device Statistics (GP/SMART Log 0x04) not supported

Pending Defects log (GP Log 0x0c) not supported

SATA Phy Event Counters (GP Log 0x11)
ID      Size     Value  Description
0x0001  2            0  Command failed due to ICRC error
0x0002  2            0  R_ERR response for data FIS
0x0003  2            0  R_ERR response for device-to-host data FIS
0x0004  2            0  R_ERR response for host-to-device data FIS
0x0005  2            0  R_ERR response for non-data FIS
0x0006  2            0  R_ERR response for device-to-host non-data FIS
0x0007  2            0  R_ERR response for host-to-device non-data FIS
0x0008  2            0  Device-to-host non-data FIS retries
0x0009  2            3  Transition from drive PhyRdy to drive PhyNRdy
0x000a  2            5  Device-to-host register FISes sent due to a COMRESET
0x000b  2            0  CRC errors within host-to-device FIS
0x000f  2            0  R_ERR response for host-to-device data FIS, CRC
0x0012  2            0  R_ERR response for host-to-device non-data FIS, CRC
0x8000  4        16238  Vendor specific

