smartctl 7.3 2022-02-28 r5338 [x86_64-linux-6.1.0-32-amd64] (local build)
Copyright (C) 2002-22, Bruce Allen, Christian Franke, www.smartmontools.org

=== START OF INFORMATION SECTION ===
Model Number:                       SAMSUNG MZVL4512HBLU-00BTW
Serial Number:                      --
Firmware Version:                   HXC70W1Q
PCI Vendor/Subsystem ID:            0x144d
IEEE OUI Identifier:                0x002538
Controller ID:                      7
NVMe Version:                       1.4
Number of Namespaces:               1
Namespace 1 Size/Capacity:          512,110,190,592 [512 GB]
Namespace 1 Utilization:            22,192,635,904 [22.1 GB]
Namespace 1 Formatted LBA Size:     512
Namespace 1 IEEE EUI-64:            002538 ...
Local Time is:                      Sun Apr  6 08:14:14 2025 PDT
Firmware Updates (0x16):            3 Slots, no Reset required
Optional Admin Commands (0x0017):   Security Format Frmw_DL Self_Test
Optional NVM Commands (0x005e):     Wr_Unc DS_Mngmt Wr_Zero Sav/Sel_Feat Timestmp
Log Page Attributes (0x0f):         S/H_per_NS Cmd_Eff_Lg Ext_Get_Lg Telmtry_Lg
Maximum Data Transfer Size:         32 Pages
Warning  Comp. Temp. Threshold:     81 Celsius
Critical Comp. Temp. Threshold:     85 Celsius

Supported Power States
St Op     Max   Active     Idle   RL RT WL WT  Ent_Lat  Ex_Lat
 0 +     7.00W       -        -    0  0  0  0        0       0
 1 +     7.00W       -        -    1  1  1  1        0       0
 2 +     7.00W       -        -    2  2  2  2        0       0
 3 -   0.0600W       -        -    3  3  3  3      200    2800
 4 -   0.0050W       -        -    4  4  4  4     4000   19000

Supported LBA Sizes (NSID 0x1)
Id Fmt  Data  Metadt  Rel_Perf
 0 -     512       0         0
 1 -    4096       0         0

=== START OF SMART DATA SECTION ===
SMART overall-health self-assessment test result: PASSED

SMART/Health Information (NVMe Log 0x02)
Critical Warning:                   0x00
Temperature:                        40 Celsius
Available Spare:                    100%
Available Spare Threshold:          10%
Percentage Used:                    4%
Data Units Read:                    37,655,168 [19.2 TB]
Data Units Written:                 28,313,998 [14.4 TB]
Host Read Commands:                 479,807,016
Host Write Commands:                416,642,271
Controller Busy Time:               382
Power Cycles:                       1,097
Power On Hours:                     2,951
Unsafe Shutdowns:                   143
Media and Data Integrity Errors:    0
Error Information Log Entries:      0
Warning  Comp. Temperature Time:    0
Critical Comp. Temperature Time:    0
Temperature Sensor 1:               40 Celsius

Error Information (NVMe Log 0x01, 16 of 64 entries)
No Errors Logged

