smartctl 7.4 2023-08-01 r5530 [x86_64-linux-6.12.10-arch1-1] (local build)
Copyright (C) 2002-23, Bruce Allen, Christian Franke, www.smartmontools.org

=== START OF INFORMATION SECTION ===
Model Number:                       CT1000T700SSD5
Serial Number:                      --
Firmware Version:                   PACR5101
PCI Vendor/Subsystem ID:            0xc0a9
IEEE OUI Identifier:                0x00a075
Controller ID:                      0
NVMe Version:                       2.0
Number of Namespaces:               1
Namespace 1 Size/Capacity:          1,000,204,886,016 [1.00 TB]
Namespace 1 Formatted LBA Size:     512
Namespace 1 IEEE EUI-64:            00a075 ...
Local Time is:                      Wed Jan 29 12:33:41 2025 WET
Firmware Updates (0x12):            1 Slot, no Reset required
Optional Admin Commands (0x0017):   Security Format Frmw_DL Self_Test
Optional NVM Commands (0x005e):     Wr_Unc DS_Mngmt Wr_Zero Sav/Sel_Feat Timestmp
Log Page Attributes (0x3e):         Cmd_Eff_Lg Ext_Get_Lg Telmtry_Lg Pers_Ev_Lg Log0_FISE_MI
Maximum Data Transfer Size:         128 Pages
Warning  Comp. Temp. Threshold:     87 Celsius
Critical Comp. Temp. Threshold:     89 Celsius

Supported Power States
St Op     Max   Active     Idle   RL RT WL WT  Ent_Lat  Ex_Lat
 0 +    11.50W       -        -    0  0  0  0      800    1000
 1 +     8.00W       -        -    0  0  0  0      800    1000
 2 +     6.00W       -        -    0  0  0  0      800    1000
 3 -   0.1440W       -        -    0  0  0  0     3000    3000
 4 -   0.1440W       -        -    0  0  0  0     3000    3000

Supported LBA Sizes (NSID 0x1)
Id Fmt  Data  Metadt  Rel_Perf
 0 +     512       0         1
 1 -    4096       0         0

=== START OF SMART DATA SECTION ===
SMART overall-health self-assessment test result: PASSED

SMART/Health Information (NVMe Log 0x02)
Critical Warning:                   0x00
Temperature:                        60 Celsius
Available Spare:                    96%
Available Spare Threshold:          5%
Percentage Used:                    1%
Data Units Read:                    10,181,350 [5.21 TB]
Data Units Written:                 26,631,521 [13.6 TB]
Host Read Commands:                 141,759,587
Host Write Commands:                558,996,624
Controller Busy Time:               720
Power Cycles:                       526
Power On Hours:                     2,668
Unsafe Shutdowns:                   144
Media and Data Integrity Errors:    0
Error Information Log Entries:      0
Warning  Comp. Temperature Time:    0
Critical Comp. Temperature Time:    0
Thermal Temp. 1 Transition Count:   1
Thermal Temp. 1 Total Time:         2647

Error Information (NVMe Log 0x01, 16 of 16 entries)
No Errors Logged

Read Self-test Log failed: Invalid Field in Command (0x002)



