=== START OF INFORMATION SECTION ===
Model Family:     Seagate Maxtor DiamondMax 21
Device Model:     MAXTOR STM3250310AS
Serial Number:    --
Firmware Version: 4.AAA
User Capacity:    250 059 350 016 bytes [250 GB]
Sector Size:      512 bytes logical/physical
Device is:        In smartctl database [for details use: -P show]
ATA Version is:   ATA/ATAPI-7 (minor revision not indicated)
Local Time is:    Sat Jul 15 08:47:09 2017 CEST
SMART support is: Available - device has SMART capability.
SMART support is: Enabled
AAM feature is:   Unavailable
APM feature is:   Unavailable
Rd look-ahead is: Enabled
Write cache is:   Enabled
ATA Security is:  Disabled, frozen [SEC2]
Wt Cache Reorder: Unavailable

=== START OF READ SMART DATA SECTION ===
SMART overall-health self-assessment test result: PASSED

General SMART Values:
Offline data collection status:  (0x82)	Offline data collection activity
					was completed without error.
					Auto Offline Data Collection: Enabled.
Self-test execution status:      (   0)	The previous self-test routine completed
					without error or no self-test has ever 
					been run.
Total time to complete Offline 
data collection: 		(  430) seconds.
Offline data collection
capabilities: 			 (0x5b) SMART execute Offline immediate.
					Auto Offline data collection on/off support.
					Suspend Offline collection upon new
					command.
					Offline surface scan supported.
					Self-test supported.
					No Conveyance Self-test supported.
					Selective Self-test supported.
SMART capabilities:            (0x0003)	Saves SMART data before entering
					power-saving mode.
					Supports SMART auto save timer.
Error logging capability:        (0x01)	Error logging supported.
					General Purpose Logging supported.
Short self-test routine 
recommended polling time: 	 (   1) minutes.
Extended self-test routine
recommended polling time: 	 (  92) minutes.

SMART Attributes Data Structure revision number: 10
Vendor Specific SMART Attributes with Thresholds:
ID# ATTRIBUTE_NAME          FLAGS    VALUE WORST THRESH FAIL RAW_VALUE
  1 Raw_Read_Error_Rate     POSR--   100   253   006    -    0
  3 Spin_Up_Time            PO----   097   097   000    -    0
  4 Start_Stop_Count        -O--CK   089   089   020    -    11495
  5 Reallocated_Sector_Ct   PO--CK   100   100   036    -    10
  7 Seek_Error_Rate         POSR--   083   060   030    -    229187504
  9 Power_On_Hours          -O--CK   089   089   000    -    10449
 10 Spin_Retry_Count        PO--C-   100   100   097    -    0
 12 Power_Cycle_Count       -O--CK   063   063   020    -    38731
187 Reported_Uncorrect      -O--CK   001   001   000    -    3835
189 High_Fly_Writes         -O-RCK   100   100   000    -    0
190 Airflow_Temperature_Cel -O---K   065   046   045    -    35 (Min/Max 15/54)
194 Temperature_Celsius     -O---K   035   054   000    -    35 (0 15 0 0 0)
195 Hardware_ECC_Recovered  -O-RC-   069   053   000    -    4960891
197 Current_Pending_Sector  -O--C-   100   055   000    -    0
198 Offline_Uncorrectable   ----C-   100   055   000    -    0
199 UDMA_CRC_Error_Count    -OSRCK   200   001   000    -    2658
200 Multi_Zone_Error_Rate   ------   100   253   000    -    0
202 Data_Address_Mark_Errs  -O--CK   100   253   000    -    0
                            ||||||_ K auto-keep
                            |||||__ C event count
                            ||||___ R error rate
                            |||____ S speed/performance
                            ||_____ O updated online
                            |______ P prefailure warning

General Purpose Log Directory Version 1
SMART           Log Directory Version 1 [multi-sector log support]
Address    Access  R/W   Size  Description
0x00       GPL,SL  R/O      1  Log Directory
0x01       GPL,SL  R/O      1  Summary SMART error log
0x02       GPL,SL  R/O      5  Comprehensive SMART error log
0x03       GPL,SL  R/O      5  Ext. Comprehensive SMART error log
0x06       GPL,SL  R/O      1  SMART self-test log
0x07       GPL,SL  R/O      1  Extended self-test log
0x09       GPL,SL  R/W      1  Selective self-test log
0x10       GPL,SL  R/O      1  SATA NCQ Queued Error log
0x11       GPL,SL  R/O      1  SATA Phy Event Counters log
0x20       GPL,SL  R/O      1  Streaming performance log [OBS-8]
0x21       GPL,SL  R/O      1  Write stream error log
0x22       GPL,SL  R/O      1  Read stream error log
0x23       GPL,SL  R/O      1  Delayed sector log [OBS-8]
0x80-0x9f  GPL,SL  R/W     16  Host vendor specific log
0xa0       GPL,SL  VS       1  Device vendor specific log
0xa1       GPL,SL  VS      20  Device vendor specific log
0xa2       GPL,SL  VS     101  Device vendor specific log
0xa8       GPL,SL  VS      20  Device vendor specific log
0xa9       GPL,SL  VS       1  Device vendor specific log
0xe0       GPL,SL  R/W      1  SCT Command/Status
0xe1       GPL,SL  R/W      1  SCT Data Transfer
0xff       GPL     -    23040  Reserved

SMART Extended Comprehensive Error Log Version: 1 (5 sectors)
Device Error Count: 6891 (device log contains only the most recent 20 errors)
	CR     = Command Register
	FEATR  = Features Register
	COUNT  = Count (was: Sector Count) Register
	LBA_48 = Upper bytes of LBA High/Mid/Low Registers ]  ATA-8
	LH     = LBA High (was: Cylinder High) Register    ]   LBA
	LM     = LBA Mid (was: Cylinder Low) Register      ] Register
	LL     = LBA Low (was: Sector Number) Register     ]
	DV     = Device (was: Device/Head) Register
	DC     = Device Control Register
	ER     = Error register
	ST     = Status register
Powered_Up_Time is measured from power on, and printed as
DDd+hh:mm:SS.sss where DD=days, hh=hours, mm=minutes,
SS=sec, and sss=millisec. It "wraps" after 49.710 days.

Error 6891 [10] occurred at disk power-on lifetime: 10386 hours (432 days + 18 hours)
  When the command that caused the error occurred, the device was active or idle.

  After command completion occurred, registers were:
  ER -- ST COUNT  LBA_48  LH LM LL DV DC
  -- -- -- == -- == == == -- -- -- -- --
  10 -- 51 00 40 00 0d 30 00 1a aa e0 00  Error: IDNF 64 sectors at LBA = 0xd30001aaa = 56639888042

  Commands leading to the command that caused the error were:
  CR FEATR COUNT  LBA_48  LH LM LL DV DC  Powered_Up_Time  Command/Feature_Name
  -- == -- == -- == == == -- -- -- -- --  ---------------  --------------------
  25 00 00 00 40 00 1d 59 00 1c 41 e0 00     00:09:26.412  READ DMA EXT
  25 00 00 00 40 00 1d 59 00 1c 01 e0 00     00:09:26.412  READ DMA EXT
  25 00 00 00 40 00 1d 58 00 1c c1 e0 00     00:09:26.411  READ DMA EXT
  25 00 00 00 40 00 1d 58 00 1c 81 e0 00     00:09:26.411  READ DMA EXT
  25 00 00 00 40 00 1d 58 00 1c 41 e0 00     00:09:26.410  READ DMA EXT

Error 6890 [9] occurred at disk power-on lifetime: 10384 hours (432 days + 16 hours)
  When the command that caused the error occurred, the device was active or idle.

  After command completion occurred, registers were:
  ER -- ST COUNT  LBA_48  LH LM LL DV DC
  -- -- -- == -- == == == -- -- -- -- --
  10 -- 51 00 40 00 0d 30 00 1a a8 e0 00  Error: IDNF 64 sectors at LBA = 0xd30001aa8 = 56639888040

  Commands leading to the command that caused the error were:
  CR FEATR COUNT  LBA_48  LH LM LL DV DC  Powered_Up_Time  Command/Feature_Name
  -- == -- == -- == == == -- -- -- -- --  ---------------  --------------------
  25 00 00 00 40 00 1d 59 00 1c 41 e0 00     00:12:55.384  READ DMA EXT
  25 00 00 00 08 00 12 2a 00 5f d9 e0 00     00:12:55.383  READ DMA EXT
  25 00 00 00 40 00 12 fc 00 46 89 e0 00     00:12:55.383  READ DMA EXT
  25 00 00 00 40 00 10 4b 00 eb f9 e0 00     00:12:55.382  READ DMA EXT
  25 00 00 00 23 00 0d f0 00 0c d9 e0 00     00:12:55.382  READ DMA EXT

Error 6889 [8] occurred at disk power-on lifetime: 10375 hours (432 days + 7 hours)
  When the command that caused the error occurred, the device was active or idle.

  After command completion occurred, registers were:
  ER -- ST COUNT  LBA_48  LH LM LL DV DC
  -- -- -- == -- == == == -- -- -- -- --
  10 -- 51 00 40 00 0d 30 00 1a a9 e0 00  Error: IDNF 64 sectors at LBA = 0xd30001aa9 = 56639888041

  Commands leading to the command that caused the error were:
  CR FEATR COUNT  LBA_48  LH LM LL DV DC  Powered_Up_Time  Command/Feature_Name
  -- == -- == -- == == == -- -- -- -- --  ---------------  --------------------
  25 00 00 00 40 00 1d 59 00 1c 41 e0 00     00:13:16.738  READ DMA EXT
  35 00 00 00 01 00 13 9b 00 1d ee e0 00     00:13:16.738  WRITE DMA EXT
  25 00 00 00 40 00 1d 59 00 1c 01 e0 00     00:13:16.737  READ DMA EXT
  25 00 00 00 40 00 1d 58 00 1c c1 e0 00     00:13:16.737  READ DMA EXT
  35 00 00 00 01 00 13 9b 00 1d ed e0 00     00:13:16.737  WRITE DMA EXT

Error 6888 [7] occurred at disk power-on lifetime: 10388 hours (432 days + 20 hours)
  When the command that caused the error occurred, the device was active or idle.

  After command completion occurred, registers were:
  ER -- ST COUNT  LBA_48  LH LM LL DV DC
  -- -- -- == -- == == == -- -- -- -- --
  10 -- 51 00 40 00 0d 30 00 1a b2 e0 00  Error: IDNF 64 sectors at LBA = 0xd30001ab2 = 56639888050

  Commands leading to the command that caused the error were:
  CR FEATR COUNT  LBA_48  LH LM LL DV DC  Powered_Up_Time  Command/Feature_Name
  -- == -- == -- == == == -- -- -- -- --  ---------------  --------------------
  25 00 00 00 40 00 1d 59 00 1c 41 e0 00     01:53:09.576  READ DMA EXT
  25 00 00 00 40 00 1d 59 00 1c 01 e0 00     01:53:09.576  READ DMA EXT
  25 00 00 00 40 00 1d 58 00 1c c1 e0 00     01:53:09.575  READ DMA EXT
  25 00 00 00 40 00 1d 58 00 1c 81 e0 00     01:53:09.575  READ DMA EXT
  25 00 00 00 40 00 1d 58 00 1c 41 e0 00     01:53:09.583  READ DMA EXT

Error 6887 [6] occurred at disk power-on lifetime: 10386 hours (432 days + 18 hours)
  When the command that caused the error occurred, the device was active or idle.

  After command completion occurred, registers were:
  ER -- ST COUNT  LBA_48  LH LM LL DV DC
  -- -- -- == -- == == == -- -- -- -- --
  10 -- 51 00 40 00 0d 30 00 1a aa e0 00  Error: IDNF 64 sectors at LBA = 0xd30001aaa = 56639888042

  Commands leading to the command that caused the error were:
  CR FEATR COUNT  LBA_48  LH LM LL DV DC  Powered_Up_Time  Command/Feature_Name
  -- == -- == -- == == == -- -- -- -- --  ---------------  --------------------
  25 00 00 00 40 00 1d 59 00 1c 41 e0 00     00:09:26.412  READ DMA EXT
  25 00 00 00 40 00 1d 59 00 1c 01 e0 00     00:09:26.412  READ DMA EXT
  25 00 00 00 40 00 1d 58 00 1c c1 e0 00     00:09:26.411  READ DMA EXT
  25 00 00 00 40 00 1d 58 00 1c 81 e0 00     00:09:26.411  READ DMA EXT
  25 00 00 00 40 00 1d 58 00 1c 41 e0 00     00:09:26.410  READ DMA EXT

Error 6886 [5] occurred at disk power-on lifetime: 10384 hours (432 days + 16 hours)
  When the command that caused the error occurred, the device was active or idle.

  After command completion occurred, registers were:
  ER -- ST COUNT  LBA_48  LH LM LL DV DC
  -- -- -- == -- == == == -- -- -- -- --
  10 -- 51 00 40 00 0d 30 00 1a a8 e0 00  Error: IDNF 64 sectors at LBA = 0xd30001aa8 = 56639888040

  Commands leading to the command that caused the error were:
  CR FEATR COUNT  LBA_48  LH LM LL DV DC  Powered_Up_Time  Command/Feature_Name
  -- == -- == -- == == == -- -- -- -- --  ---------------  --------------------
  25 00 00 00 40 00 1d 59 00 1c 41 e0 00     00:12:55.384  READ DMA EXT
  25 00 00 00 08 00 12 2a 00 5f d9 e0 00     00:12:55.383  READ DMA EXT
  25 00 00 00 40 00 12 fc 00 46 89 e0 00     00:12:55.383  READ DMA EXT
  25 00 00 00 40 00 10 4b 00 eb f9 e0 00     00:12:55.382  READ DMA EXT
  25 00 00 00 23 00 0d f0 00 0c d9 e0 00     00:12:55.382  READ DMA EXT

Error 6885 [4] occurred at disk power-on lifetime: 10375 hours (432 days + 7 hours)
  When the command that caused the error occurred, the device was active or idle.

  After command completion occurred, registers were:
  ER -- ST COUNT  LBA_48  LH LM LL DV DC
  -- -- -- == -- == == == -- -- -- -- --
  10 -- 51 00 40 00 0d 30 00 1a a9 e0 00  Error: IDNF 64 sectors at LBA = 0xd30001aa9 = 56639888041

  Commands leading to the command that caused the error were:
  CR FEATR COUNT  LBA_48  LH LM LL DV DC  Powered_Up_Time  Command/Feature_Name
  -- == -- == -- == == == -- -- -- -- --  ---------------  --------------------
  25 00 00 00 40 00 1d 59 00 1c 41 e0 00     00:13:16.738  READ DMA EXT
  35 00 00 00 01 00 13 9b 00 1d ee e0 00     00:13:16.738  WRITE DMA EXT
  25 00 00 00 40 00 1d 59 00 1c 01 e0 00     00:13:16.737  READ DMA EXT
  25 00 00 00 40 00 1d 58 00 1c c1 e0 00     00:13:16.737  READ DMA EXT
  35 00 00 00 01 00 13 9b 00 1d ed e0 00     00:13:16.737  WRITE DMA EXT

Error 6884 [3] occurred at disk power-on lifetime: 10388 hours (432 days + 20 hours)
  When the command that caused the error occurred, the device was active or idle.

  After command completion occurred, registers were:
  ER -- ST COUNT  LBA_48  LH LM LL DV DC
  -- -- -- == -- == == == -- -- -- -- --
  10 -- 51 00 40 00 0d 30 00 1a b2 e0 00  Error: IDNF 64 sectors at LBA = 0xd30001ab2 = 56639888050

  Commands leading to the command that caused the error were:
  CR FEATR COUNT  LBA_48  LH LM LL DV DC  Powered_Up_Time  Command/Feature_Name
  -- == -- == -- == == == -- -- -- -- --  ---------------  --------------------
  25 00 00 00 40 00 1d 59 00 1c 41 e0 00     01:53:09.576  READ DMA EXT
  25 00 00 00 40 00 1d 59 00 1c 01 e0 00     01:53:09.576  READ DMA EXT
  25 00 00 00 40 00 1d 58 00 1c c1 e0 00     01:53:09.575  READ DMA EXT
  25 00 00 00 40 00 1d 58 00 1c 81 e0 00     01:53:09.575  READ DMA EXT
  25 00 00 00 40 00 1d 58 00 1c 41 e0 00     01:53:09.583  READ DMA EXT

SMART Extended Self-test Log Version: 1 (1 sectors)

SMART Selective self-test log data structure revision number 1
 SPAN  MIN_LBA  MAX_LBA  CURRENT_TEST_STATUS
    1        0        0  Not_testing
    2        0        0  Not_testing
    3        0        0  Not_testing
    4        0        0  Not_testing
    5        0        0  Not_testing
Selective self-test flags (0x0):
  After scanning selected spans, do NOT read-scan remainder of disk.
If Selective self-test is pending on power-up, resume after 0 minute delay.

SCT Commands not supported

Device Statistics (GP/SMART Log 0x04) not supported

SATA Phy Event Counters (GP Log 0x11)
ID      Size     Value  Description
0x000a  2            7  Device-to-host register FISes sent due to a COMRESET
0x0001  2            0  Command failed due to ICRC error
0x0003  2            0  R_ERR response for device-to-host data FIS
0x0004  2            0  R_ERR response for host-to-device data FIS
0x0006  2            0  R_ERR response for device-to-host non-data FIS
0x0007  2            0  R_ERR response for host-to-device non-data FIS
0x0009  2           14  Transition from drive PhyRdy to drive PhyNRdy
0x8002  2            0  Vendor specific
0x8003  2            8  Vendor specific
0x8004  2            0  Vendor specific

