smartctl 7.1 2019-12-30 r5022 [x86_64-linux-5.11.0-27-generic] (local build)
Copyright (C) 2002-19, Bruce Allen, Christian Franke, www.smartmontools.org

=== START OF INFORMATION SECTION ===
Device Model:     HGST HTS545050A7E660
Serial Number:    --
LU WWN Device Id: 5 000cca ...
Firmware Version: GG2ZBG00
User Capacity:    500,107,862,016 bytes [500 GB]
Sector Sizes:     512 bytes logical, 4096 bytes physical
Rotation Rate:    5400 rpm
Form Factor:      2.5 inches
Device is:        Not in smartctl database [for details use: -P showall]
ATA Version is:   ATA8-ACS T13/1699-D revision 6
SATA Version is:  SATA 2.6, 6.0 Gb/s (current: 1.5 Gb/s)
Local Time is:    Wed Aug 25 15:17:54 2021 CEST
SMART support is: Available - device has SMART capability.
SMART support is: Enabled
AAM feature is:   Unavailable
APM level is:     128 (minimum power consumption without standby)
Rd look-ahead is: Enabled
Write cache is:   Disabled
DSN feature is:   Unavailable
ATA Security is:  Disabled, NOT FROZEN [SEC1]
Wt Cache Reorder: Enabled

=== START OF READ SMART DATA SECTION ===
SMART overall-health self-assessment test result: FAILED!
Drive failure expected in less than 24 hours. SAVE ALL DATA.
See vendor-specific Attribute list for failed Attributes.

General SMART Values:
Offline data collection status:  (0x00)	Offline data collection activity
					was never started.
					Auto Offline Data Collection: Disabled.
Self-test execution status:      (   0)	The previous self-test routine completed
					without error or no self-test has ever 
					been run.
Total time to complete Offline 
data collection: 		(   45) seconds.
Offline data collection
capabilities: 			 (0x5b) SMART execute Offline immediate.
					Auto Offline data collection on/off support.
					Suspend Offline collection upon new
					command.
					Offline surface scan supported.
					Self-test supported.
					No Conveyance Self-test supported.
					Selective Self-test supported.
SMART capabilities:            (0x0003)	Saves SMART data before entering
					power-saving mode.
					Supports SMART auto save timer.
Error logging capability:        (0x01)	Error logging supported.
					General Purpose Logging supported.
Short self-test routine 
recommended polling time: 	 (   2) minutes.
Extended self-test routine
recommended polling time: 	 ( 112) minutes.
SCT capabilities: 	       (0x003d)	SCT Status supported.
					SCT Error Recovery Control supported.
					SCT Feature Control supported.
					SCT Data Table supported.

SMART Attributes Data Structure revision number: 16
Vendor Specific SMART Attributes with Thresholds:
ID# ATTRIBUTE_NAME          FLAGS    VALUE WORST THRESH FAIL RAW_VALUE
  1 Raw_Read_Error_Rate     PO-R--   086   086   062    -    4456493
  2 Throughput_Performance  P-S---   100   100   040    -    0
  3 Spin_Up_Time            POS---   217   217   033    -    0
  4 Start_Stop_Count        -O--C-   096   096   000    -    6605
  5 Reallocated_Sector_Ct   PO--CK   001   001   005    NOW  0
  7 Seek_Error_Rate         PO-R--   100   100   067    -    0
  8 Seek_Time_Performance   P-S---   100   100   040    -    0
  9 Power_On_Hours          -O--C-   062   062   000    -    17055
 10 Spin_Retry_Count        PO--C-   100   100   060    -    0
 12 Power_Cycle_Count       -O--CK   097   097   000    -    6180
191 G-Sense_Error_Rate      -O-R--   100   100   000    -    0
192 Power-Off_Retract_Count -O--CK   099   099   000    -    295
193 Load_Cycle_Count        -O--C-   008   008   000    -    924485
194 Temperature_Celsius     -O----   200   200   000    -    30 (Min/Max 5/50)
196 Reallocated_Event_Count -O--CK   001   001   000    -    2510
197 Current_Pending_Sector  -O---K   091   091   000    -    440
198 Offline_Uncorrectable   ---R--   100   100   000    -    0
199 UDMA_CRC_Error_Count    -O-R--   200   200   000    -    3
223 Load_Retry_Count        -O-R--   100   100   000    -    0
                            ||||||_ K auto-keep
                            |||||__ C event count
                            ||||___ R error rate
                            |||____ S speed/performance
                            ||_____ O updated online
                            |______ P prefailure warning

General Purpose Log Directory Version 1
SMART           Log Directory Version 1 [multi-sector log support]
Address    Access  R/W   Size  Description
0x00       GPL,SL  R/O      1  Log Directory
0x01           SL  R/O      1  Summary SMART error log
0x02           SL  R/O      1  Comprehensive SMART error log
0x03       GPL     R/O      1  Ext. Comprehensive SMART error log
0x06           SL  R/O      1  SMART self-test log
0x07       GPL     R/O      1  Extended self-test log
0x09           SL  R/W      1  Selective self-test log
0x10       GPL     R/O      1  NCQ Command Error log
0x11       GPL     R/O      1  SATA Phy Event Counters log
0x80-0x9f  GPL,SL  R/W     16  Host vendor specific log
0xe0       GPL,SL  R/W      1  SCT Command/Status
0xe1       GPL,SL  R/W      1  SCT Data Transfer

SMART Extended Comprehensive Error Log Version: 1 (1 sectors)
Device Error Count: 57175 (device log contains only the most recent 4 errors)
	CR     = Command Register
	FEATR  = Features Register
	COUNT  = Count (was: Sector Count) Register
	LBA_48 = Upper bytes of LBA High/Mid/Low Registers ]  ATA-8
	LH     = LBA High (was: Cylinder High) Register    ]   LBA
	LM     = LBA Mid (was: Cylinder Low) Register      ] Register
	LL     = LBA Low (was: Sector Number) Register     ]
	DV     = Device (was: Device/Head) Register
	DC     = Device Control Register
	ER     = Error register
	ST     = Status register
Powered_Up_Time is measured from power on, and printed as
DDd+hh:mm:SS.sss where DD=days, hh=hours, mm=minutes,
SS=sec, and sss=millisec. It "wraps" after 49.710 days.

Error 57175 [2] occurred at disk power-on lifetime: 17033 hours (709 days + 17 hours)
  When the command that caused the error occurred, the device was active or idle.

  After command completion occurred, registers were:
  ER -- ST COUNT  LBA_48  LH LM LL DV DC
  -- -- -- == -- == == == -- -- -- -- --
  40 -- 51 00 08 00 00 29 0c cb f0 09 00  Error: UNC 8 sectors at LBA = 0x290ccbf0 = 688704496

  Commands leading to the command that caused the error were:
  CR FEATR COUNT  LBA_48  LH LM LL DV DC  Powered_Up_Time  Command/Feature_Name
  -- == -- == -- == == == -- -- -- -- --  ---------------  --------------------
  25 00 da 00 08 00 00 29 0c cb f0 40 00     01:26:07.740  READ DMA EXT
  25 00 da 00 08 00 00 29 0c cb f0 40 00     01:26:04.439  READ DMA EXT
  25 00 da 00 08 00 00 29 0c cb d0 40 00     01:26:04.397  READ DMA EXT
  25 00 da 00 08 00 00 2c d7 d4 88 40 00     01:26:04.383  READ DMA EXT
  25 00 da 00 08 00 00 2c d7 ce 08 40 00     01:26:04.378  READ DMA EXT

Error 57174 [1] occurred at disk power-on lifetime: 17033 hours (709 days + 17 hours)
  When the command that caused the error occurred, the device was active or idle.

  After command completion occurred, registers were:
  ER -- ST COUNT  LBA_48  LH LM LL DV DC
  -- -- -- == -- == == == -- -- -- -- --
  40 -- 51 00 08 00 00 29 0c cb f0 09 00  Error: UNC 8 sectors at LBA = 0x290ccbf0 = 688704496

  Commands leading to the command that caused the error were:
  CR FEATR COUNT  LBA_48  LH LM LL DV DC  Powered_Up_Time  Command/Feature_Name
  -- == -- == -- == == == -- -- -- -- --  ---------------  --------------------
  25 00 da 00 08 00 00 29 0c cb f0 40 00     01:26:04.439  READ DMA EXT
  25 00 da 00 08 00 00 29 0c cb d0 40 00     01:26:04.397  READ DMA EXT
  25 00 da 00 08 00 00 2c d7 d4 88 40 00     01:26:04.383  READ DMA EXT
  25 00 da 00 08 00 00 2c d7 ce 08 40 00     01:26:04.378  READ DMA EXT
  25 00 da 00 08 00 00 2c d7 cc 28 40 00     01:26:04.366  READ DMA EXT

Error 57173 [0] occurred at disk power-on lifetime: 17033 hours (709 days + 17 hours)
  When the command that caused the error occurred, the device was active or idle.

  After command completion occurred, registers were:
  ER -- ST COUNT  LBA_48  LH LM LL DV DC
  -- -- -- == -- == == == -- -- -- -- --
  40 -- 51 00 08 00 00 29 0e 64 e8 09 00  Error: UNC 8 sectors at LBA = 0x290e64e8 = 688809192

  Commands leading to the command that caused the error were:
  CR FEATR COUNT  LBA_48  LH LM LL DV DC  Powered_Up_Time  Command/Feature_Name
  -- == -- == -- == == == -- -- -- -- --  ---------------  --------------------
  25 00 da 00 08 00 00 29 0e 64 e8 40 00     01:24:42.449  READ DMA EXT
  25 00 da 00 08 00 00 29 0e 64 e8 40 00     01:24:39.188  READ DMA EXT
  25 00 da 00 08 00 00 29 0e 64 e0 40 00     01:24:39.171  READ DMA EXT
  25 00 da 00 08 00 00 2e ed ca 80 40 00     01:24:39.162  READ DMA EXT
  25 00 da 00 08 00 00 2e ed c9 a8 40 00     01:24:39.160  READ DMA EXT

Error 57172 [3] occurred at disk power-on lifetime: 17033 hours (709 days + 17 hours)
  When the command that caused the error occurred, the device was active or idle.

  After command completion occurred, registers were:
  ER -- ST COUNT  LBA_48  LH LM LL DV DC
  -- -- -- == -- == == == -- -- -- -- --
  40 -- 51 00 08 00 00 29 0e 64 e8 09 00  Error: UNC 8 sectors at LBA = 0x290e64e8 = 688809192

  Commands leading to the command that caused the error were:
  CR FEATR COUNT  LBA_48  LH LM LL DV DC  Powered_Up_Time  Command/Feature_Name
  -- == -- == -- == == == -- -- -- -- --  ---------------  --------------------
  25 00 da 00 08 00 00 29 0e 64 e8 40 00     01:24:39.188  READ DMA EXT
  25 00 da 00 08 00 00 29 0e 64 e0 40 00     01:24:39.171  READ DMA EXT
  25 00 da 00 08 00 00 2e ed ca 80 40 00     01:24:39.162  READ DMA EXT
  25 00 da 00 08 00 00 2e ed c9 a8 40 00     01:24:39.160  READ DMA EXT
  25 00 da 00 08 00 00 29 0e 63 e8 40 00     01:24:39.132  READ DMA EXT

SMART Extended Self-test Log Version: 1 (1 sectors)
No self-tests have been logged.  [To run self-tests, use: smartctl -t]

SMART Selective self-test log data structure revision number 1
 SPAN  MIN_LBA  MAX_LBA  CURRENT_TEST_STATUS
    1        0        0  Not_testing
    2        0        0  Not_testing
    3        0        0  Not_testing
    4        0        0  Not_testing
    5        0        0  Not_testing
Selective self-test flags (0x0):
  After scanning selected spans, do NOT read-scan remainder of disk.
If Selective self-test is pending on power-up, resume after 0 minute delay.

SCT Status Version:                  3
SCT Version (vendor specific):       256 (0x0100)
Device State:                        Active (0)
Current Temperature:                    30 Celsius
Power Cycle Min/Max Temperature:     21/30 Celsius
Lifetime    Min/Max Temperature:      5/50 Celsius
Specified Max Operating Temperature:    30 Celsius
Under/Over Temperature Limit Count:   0/0

SCT Temperature History Version:     2
Temperature Sampling Period:         1 minute
Temperature Logging Interval:        1 minute
Min/Max recommended Temperature:      0/60 Celsius
Min/Max Temperature Limit:           -40/65 Celsius
Temperature History Size (Index):    128 (64)

SCT Error Recovery Control:
           Read: Disabled
          Write: Disabled

Device Statistics (GP/SMART Log 0x04) not supported

Pending Defects log (GP Log 0x0c) not supported

SATA Phy Event Counters (GP Log 0x11)
ID      Size     Value  Description
0x0001  2            0  Command failed due to ICRC error
0x0002  2            0  R_ERR response for data FIS
0x0003  2            0  R_ERR response for device-to-host data FIS
0x0004  2            0  R_ERR response for host-to-device data FIS
0x0005  2            0  R_ERR response for non-data FIS
0x0006  2            0  R_ERR response for device-to-host non-data FIS
0x0007  2            0  R_ERR response for host-to-device non-data FIS
0x0009  2            1  Transition from drive PhyRdy to drive PhyNRdy
0x000a  2            0  Device-to-host register FISes sent due to a COMRESET
0x000b  2            0  CRC errors within host-to-device FIS
0x000d  2            0  Non-CRC errors within host-to-device FIS

