smartctl 7.4 2023-08-01 r5530 [x86_64-linux-6.14.0-29-generic] (local build)
Copyright (C) 2002-23, Bruce Allen, Christian Franke, www.smartmontools.org

=== START OF INFORMATION SECTION ===
Model Number:                       SAMSUNG MZVLW256HEHP-000L2
Serial Number:                      --
Firmware Version:                   4L1QCXB7
PCI Vendor/Subsystem ID:            0x144d
IEEE OUI Identifier:                0x002538
Total NVM Capacity:                 256,060,514,304 [256 GB]
Unallocated NVM Capacity:           0
Controller ID:                      2
NVMe Version:                       1.2
Number of Namespaces:               1
Namespace 1 Size/Capacity:          256,060,514,304 [256 GB]
Namespace 1 Utilization:            97,267,396,608 [97.2 GB]
Namespace 1 Formatted LBA Size:     512
Namespace 1 IEEE EUI-64:            002538 ...
Local Time is:                      Wed Dec  3 23:13:50 2025 UTC
Firmware Updates (0x16):            3 Slots, no Reset required
Optional Admin Commands (0x0017):   Security Format Frmw_DL Self_Test
Optional NVM Commands (0x001f):     Comp Wr_Unc DS_Mngmt Wr_Zero Sav/Sel_Feat
Log Page Attributes (0x03):         S/H_per_NS Cmd_Eff_Lg
Warning  Comp. Temp. Threshold:     69 Celsius
Critical Comp. Temp. Threshold:     72 Celsius

Supported Power States
St Op     Max   Active     Idle   RL RT WL WT  Ent_Lat  Ex_Lat
 0 +     7.60W       -        -    0  0  0  0        0       0
 1 +     6.00W       -        -    1  1  1  1        0       0
 2 +     5.10W       -        -    2  2  2  2        0       0
 3 -   0.0400W       -        -    3  3  3  3      210    1500
 4 -   0.0050W       -        -    4  4  4  4     2200    6000

Supported LBA Sizes (NSID 0x1)
Id Fmt  Data  Metadt  Rel_Perf
 0 +     512       0         0

=== START OF SMART DATA SECTION ===
SMART overall-health self-assessment test result: PASSED

SMART/Health Information (NVMe Log 0x02)
Critical Warning:                   0x00
Temperature:                        34 Celsius
Available Spare:                    100%
Available Spare Threshold:          10%
Percentage Used:                    2%
Data Units Read:                    18,151,701 [9.29 TB]
Data Units Written:                 17,495,048 [8.95 TB]
Host Read Commands:                 416,580,505
Host Write Commands:                227,393,122
Controller Busy Time:               965
Power Cycles:                       5,269
Power On Hours:                     974
Unsafe Shutdowns:                   50
Media and Data Integrity Errors:    0
Error Information Log Entries:      1,264
Warning  Comp. Temperature Time:    0
Critical Comp. Temperature Time:    0
Temperature Sensor 1:               34 Celsius
Temperature Sensor 2:               41 Celsius

Error Information (NVMe Log 0x01, 16 of 64 entries)
Num   ErrCount  SQId   CmdId  Status  PELoc          LBA  NSID    VS  Message
  0       1264     0  0x3016  0x4004      -            0     0     -  Invalid Field in Command
  1       1263     0  0x0008  0x4004      -            0     0     -  Invalid Field in Command
  2       1262     0  0x0008  0x4004      -            0     0     -  Invalid Field in Command
  3       1261     0  0x0008  0x4004      -            0     0     -  Invalid Field in Command
  4       1260     0  0x0008  0x4004      -            0     0     -  Invalid Field in Command
  5       1259     0  0x0008  0x4004      -            0     0     -  Invalid Field in Command
  6       1258     0  0x0008  0x4004      -            0     0     -  Invalid Field in Command
  7       1257     0  0x0008  0x4004      -            0     0     -  Invalid Field in Command
  8       1256     0  0x0008  0x4004      -            0     0     -  Invalid Field in Command
  9       1255     0  0x0008  0x4004      -            0     0     -  Invalid Field in Command
 10       1254     0  0x0008  0x4004      -            0     0     -  Invalid Field in Command
 11       1253     0  0x0008  0x4004      -            0     0     -  Invalid Field in Command
 12       1252     0  0x0008  0x4004      -            0     0     -  Invalid Field in Command
 13       1251     0  0x0008  0x4004      -            0     0     -  Invalid Field in Command
 14       1250     0  0x0008  0x4004      -            0     0     -  Invalid Field in Command
 15       1249     0  0x0008  0x4004      -            0     0     -  Invalid Field in Command
... (48 entries not read)

Self-test Log (NVMe Log 0x06)
Self-test status: No self-test in progress
No Self-tests Logged

