smartctl 7.4 2023-08-01 r5530 [x86_64-linux-6.14.3-arch1-1] (local build)
Copyright (C) 2002-23, Bruce Allen, Christian Franke, www.smartmontools.org

=== START OF INFORMATION SECTION ===
Model Number:                       KBG50ZNT512G LS KIOXIA
Serial Number:                      --
Firmware Version:                   0107ANLS
PCI Vendor/Subsystem ID:            0x1e0f
IEEE OUI Identifier:                0x8ce38e
Total NVM Capacity:                 512,110,190,592 [512 GB]
Unallocated NVM Capacity:           0
Controller ID:                      0
NVMe Version:                       1.4
Number of Namespaces:               1
Namespace 1 Size/Capacity:          512,110,190,592 [512 GB]
Namespace 1 Formatted LBA Size:     512
Namespace 1 IEEE EUI-64:            8ce38e ...
Local Time is:                      Tue Apr 22 14:26:32 2025 JST
Firmware Updates (0x14):            2 Slots, no Reset required
Optional Admin Commands (0x001f):   Security Format Frmw_DL NS_Mngmt Self_Test
Optional NVM Commands (0x00df):     Comp Wr_Unc DS_Mngmt Wr_Zero Sav/Sel_Feat Timestmp Verify
Log Page Attributes (0x0e):         Cmd_Eff_Lg Ext_Get_Lg Telmtry_Lg
Maximum Data Transfer Size:         512 Pages
Warning  Comp. Temp. Threshold:     78 Celsius
Critical Comp. Temp. Threshold:     82 Celsius
Namespace 1 Features (0x02):        NA_Fields

Supported Power States
St Op     Max   Active     Idle   RL RT WL WT  Ent_Lat  Ex_Lat
 0 +     4.10W       -        -    0  0  0  0        1       1
 1 +     3.00W       -        -    1  1  1  1        1       1
 2 +     1.90W       -        -    2  2  2  2        1       1
 3 -   0.0500W       -        -    3  3  3  3      800    1000
 4 -   0.0030W       -        -    4  4  4  4     3000   32000

Supported LBA Sizes (NSID 0x1)
Id Fmt  Data  Metadt  Rel_Perf
 0 +     512       0         2
 1 -    4096       0         1

=== START OF SMART DATA SECTION ===
SMART overall-health self-assessment test result: PASSED

SMART/Health Information (NVMe Log 0x02)
Critical Warning:                   0x00
Temperature:                        37 Celsius
Available Spare:                    100%
Available Spare Threshold:          10%
Percentage Used:                    7%
Data Units Read:                    91,404,560 [46.7 TB]
Data Units Written:                 55,303,148 [28.3 TB]
Host Read Commands:                 1,678,675,505
Host Write Commands:                751,307,091
Controller Busy Time:               3,102
Power Cycles:                       306,694
Power On Hours:                     16,651
Unsafe Shutdowns:                   301
Media and Data Integrity Errors:    0
Error Information Log Entries:      48
Warning  Comp. Temperature Time:    55
Critical Comp. Temperature Time:    1
Temperature Sensor 1:               37 Celsius
Thermal Temp. 1 Transition Count:   33
Thermal Temp. 1 Total Time:         7923

Error Information (NVMe Log 0x01, 16 of 256 entries)
No Errors Logged

Self-test Log (NVMe Log 0x06)
Self-test status: No self-test in progress
Num  Test_Description  Status                       Power_on_Hours  Failing_LBA  NSID Seg SCT Code
 0   Short             Completed without error                5393            -     -   -   -    -

