smartctl 7.4 2023-08-01 r5530 [x86_64-linux-6.6.2-zen1-1-zen] (local build)
Copyright (C) 2002-23, Bruce Allen, Christian Franke, www.smartmontools.org

=== START OF INFORMATION SECTION ===
Model Family:     Seagate Momentus XT
Device Model:     ST95005620AS
Serial Number:    --
LU WWN Device Id: 5 000c50 ...
Firmware Version: SD28
User Capacity:    500,107,862,016 bytes [500 GB]
Sector Size:      512 bytes logical/physical
Rotation Rate:    7200 rpm
Form Factor:      2.5 inches
Device is:        In smartctl database 7.3/5528
ATA Version is:   ATA8-ACS T13/1699-D revision 4
SATA Version is:  SATA 2.6, 3.0 Gb/s
Local Time is:    Thu Nov 23 22:43:09 2023 -03
SMART support is: Available - device has SMART capability.
SMART support is: Enabled
AAM level is:     254 (maximum performance), recommended: 254
APM level is:     128 (minimum power consumption without standby)
Rd look-ahead is: Enabled
Write cache is:   Enabled
DSN feature is:   Unavailable
ATA Security is:  Disabled, frozen [SEC2]
Wt Cache Reorder: Unavailable

=== START OF READ SMART DATA SECTION ===
SMART overall-health self-assessment test result: PASSED
See vendor-specific Attribute list for marginal Attributes.

General SMART Values:
Offline data collection status:  (0x00)	Offline data collection activity
					was never started.
					Auto Offline Data Collection: Disabled.
Self-test execution status:      (   0)	The previous self-test routine completed
					without error or no self-test has ever 
					been run.
Total time to complete Offline 
data collection: 		(  625) seconds.
Offline data collection
capabilities: 			 (0x73) SMART execute Offline immediate.
					Auto Offline data collection on/off support.
					Suspend Offline collection upon new
					command.
					No Offline surface scan supported.
					Self-test supported.
					Conveyance Self-test supported.
					Selective Self-test supported.
SMART capabilities:            (0x0003)	Saves SMART data before entering
					power-saving mode.
					Supports SMART auto save timer.
Error logging capability:        (0x01)	Error logging supported.
					General Purpose Logging supported.
Short self-test routine 
recommended polling time: 	 (   1) minutes.
Extended self-test routine
recommended polling time: 	 ( 104) minutes.
Conveyance self-test routine
recommended polling time: 	 (   2) minutes.
SCT capabilities: 	       (0x1001)	SCT Status supported.

SMART Attributes Data Structure revision number: 10
Vendor Specific SMART Attributes with Thresholds:
ID# ATTRIBUTE_NAME          FLAGS    VALUE WORST THRESH FAIL RAW_VALUE
  1 Raw_Read_Error_Rate     POSR--   114   099   006    -    72348037
  3 Spin_Up_Time            PO----   097   096   000    -    0
  4 Start_Stop_Count        -O--CK   089   089   020    -    12135
  5 Reallocated_Sector_Ct   PO--CK   098   098   036    -    45
  7 Seek_Error_Rate         POSR--   084   060   030    -    13767711672
  9 Power_On_Hours          -O--CK   070   070   000    -    26975
 10 Spin_Retry_Count        PO--C-   100   100   097    -    0
 12 Power_Cycle_Count       -O--CK   091   091   020    -    9387
184 End-to-End_Error        -O--CK   091   091   099    NOW  9
187 Reported_Uncorrect      -O--CK   050   050   000    -    50
188 Command_Timeout         -O--CK   100   253   000    -    0
189 High_Fly_Writes         -O-RCK   100   100   000    -    0
190 Airflow_Temperature_Cel -O---K   062   043   045    Past 38 (Min/Max 31/41 #15)
191 G-Sense_Error_Rate      -O--CK   100   100   000    -    0
192 Power-Off_Retract_Count -O--CK   100   100   000    -    1244
193 Load_Cycle_Count        -O--CK   009   009   000    -    183549
194 Temperature_Celsius     -O---K   038   057   000    -    38 (128 0 0 0 0)
195 Hardware_ECC_Recovered  -O-RC-   045   036   000    -    72348037
197 Current_Pending_Sector  -O--C-   100   100   000    -    0
198 Offline_Uncorrectable   ----C-   100   100   000    -    0
199 UDMA_CRC_Error_Count    -OSRCK   200   200   000    -    0
                            ||||||_ K auto-keep
                            |||||__ C event count
                            ||||___ R error rate
                            |||____ S speed/performance
                            ||_____ O updated online
                            |______ P prefailure warning

General Purpose Log Directory Version 1
SMART           Log Directory Version 1 [multi-sector log support]
Address    Access  R/W   Size  Description
0x00       GPL,SL  R/O      1  Log Directory
0x01           SL  R/O      1  Summary SMART error log
0x02           SL  R/O      5  Comprehensive SMART error log
0x03       GPL     R/O      5  Ext. Comprehensive SMART error log
0x06           SL  R/O      1  SMART self-test log
0x07       GPL     R/O      1  Extended self-test log
0x09           SL  R/W      1  Selective self-test log
0x10       GPL     R/O      1  NCQ Command Error log
0x11       GPL     R/O      1  SATA Phy Event Counters log
0x21       GPL     R/O      1  Write stream error log
0x22       GPL     R/O      1  Read stream error log
0x80-0x9f  GPL,SL  R/W     16  Host vendor specific log
0xa1       GPL,SL  VS      20  Device vendor specific log
0xa2       GPL     VS    2248  Device vendor specific log
0xa8       GPL,SL  VS      65  Device vendor specific log
0xa9       GPL,SL  VS       1  Device vendor specific log
0xb0       GPL     VS    2864  Device vendor specific log
0xbd       GPL     VS       1  Device vendor specific log
0xbe-0xbf  GPL     VS   65535  Device vendor specific log
0xe0       GPL,SL  R/W      1  SCT Command/Status
0xe1       GPL,SL  R/W      1  SCT Data Transfer

SMART Extended Comprehensive Error Log Version: 1 (5 sectors)
Device Error Count: 44 (device log contains only the most recent 20 errors)
	CR     = Command Register
	FEATR  = Features Register
	COUNT  = Count (was: Sector Count) Register
	LBA_48 = Upper bytes of LBA High/Mid/Low Registers ]  ATA-8
	LH     = LBA High (was: Cylinder High) Register    ]   LBA
	LM     = LBA Mid (was: Cylinder Low) Register      ] Register
	LL     = LBA Low (was: Sector Number) Register     ]
	DV     = Device (was: Device/Head) Register
	DC     = Device Control Register
	ER     = Error register
	ST     = Status register
Powered_Up_Time is measured from power on, and printed as
DDd+hh:mm:SS.sss where DD=days, hh=hours, mm=minutes,
SS=sec, and sss=millisec. It "wraps" after 49.710 days.

Error 44 [3] occurred at disk power-on lifetime: 5379 hours (224 days + 3 hours)
  When the command that caused the error occurred, the device was active or idle.

  After command completion occurred, registers were:
  ER -- ST COUNT  LBA_48  LH LM LL DV DC
  -- -- -- == -- == == == -- -- -- -- --
  40 -- 51 00 08 00 00 14 d8 a2 d5 51 00  Error: UNC 8 sectors at LBA = 0x15d8a2d5 = 366518997

  Commands leading to the command that caused the error were:
  CR FEATR COUNT  LBA_48  LH LM LL DV DC  Powered_Up_Time  Command/Feature_Name
  -- == -- == -- == == == -- -- -- -- --  ---------------  --------------------
  25 00 00 00 08 00 00 14 d8 a2 d0 00 00  6d+13:20:53.947  READ DMA EXT
  ea 00 00 00 00 00 00 cf 00 00 00 a0 00  6d+13:17:48.771  FLUSH CACHE EXT
  25 00 00 00 08 00 00 14 d8 a2 c8 00 00  6d+13:17:46.418  READ DMA EXT
  35 00 00 00 08 00 00 00 5e b3 90 00 00  6d+13:17:41.920  WRITE DMA EXT
  25 00 00 00 08 00 00 14 d8 a2 c0 00 00  6d+13:17:39.414  READ DMA EXT

Error 43 [2] occurred at disk power-on lifetime: 5379 hours (224 days + 3 hours)
  When the command that caused the error occurred, the device was active or idle.

  After command completion occurred, registers were:
  ER -- ST COUNT  LBA_48  LH LM LL DV DC
  -- -- -- == -- == == == -- -- -- -- --
  40 -- 51 01 00 00 00 14 d8 a2 d5 51 00  Error: UNC 256 sectors at LBA = 0x15d8a2d5 = 366518997

  Commands leading to the command that caused the error were:
  CR FEATR COUNT  LBA_48  LH LM LL DV DC  Powered_Up_Time  Command/Feature_Name
  -- == -- == -- == == == -- -- -- -- --  ---------------  --------------------
  25 00 00 01 00 00 00 14 d8 a2 40 00 00  5d+13:14:20.371  READ DMA EXT
  35 00 00 00 98 00 00 14 d8 a1 a8 00 00  5d+13:14:11.494  WRITE DMA EXT
  35 00 00 01 00 00 00 14 d8 a0 a8 00 00  5d+13:14:02.512  WRITE DMA EXT
  35 00 00 01 00 00 00 14 d8 9f a8 00 00  5d+13:13:53.487  WRITE DMA EXT
  35 00 00 01 00 00 00 14 d8 9e a8 00 00  5d+13:13:44.034  WRITE DMA EXT

Error 42 [1] occurred at disk power-on lifetime: 4153 hours (173 days + 1 hours)
  When the command that caused the error occurred, the device was active or idle.

  After command completion occurred, registers were:
  ER -- ST COUNT  LBA_48  LH LM LL DV DC
  -- -- -- == -- == == == -- -- -- -- --
  40 -- 51 00 04 00 00 00 b5 8b c1 51 00  Error: UNC 4 sectors at LBA = 0x01b58bc1 = 28675009

  Commands leading to the command that caused the error were:
  CR FEATR COUNT  LBA_48  LH LM LL DV DC  Powered_Up_Time  Command/Feature_Name
  -- == -- == -- == == == -- -- -- -- --  ---------------  --------------------
  25 00 00 00 04 00 00 00 b5 8b c0 00 00 12d+07:25:00.410  READ DMA EXT
  35 00 00 00 08 00 00 00 63 4d f8 00 00 12d+07:24:46.563  WRITE DMA EXT
  35 00 00 00 18 00 00 00 62 b3 90 00 00 12d+07:24:31.609  WRITE DMA EXT
  35 00 00 00 08 00 00 00 5e b3 98 00 00 12d+07:24:23.481  WRITE DMA EXT
  25 00 00 00 40 00 00 00 55 91 20 00 00 12d+07:20:53.256  READ DMA EXT

Error 41 [0] occurred at disk power-on lifetime: 4153 hours (173 days + 1 hours)
  When the command that caused the error occurred, the device was active or idle.

  After command completion occurred, registers were:
  ER -- ST COUNT  LBA_48  LH LM LL DV DC
  -- -- -- == -- == == == -- -- -- -- --
  40 -- 51 00 04 00 00 00 b5 8b c1 51 00  Error: UNC 4 sectors at LBA = 0x01b58bc1 = 28675009

  Commands leading to the command that caused the error were:
  CR FEATR COUNT  LBA_48  LH LM LL DV DC  Powered_Up_Time  Command/Feature_Name
  -- == -- == -- == == == -- -- -- -- --  ---------------  --------------------
  25 00 00 00 04 00 00 00 b5 8b c0 00 00 11d+20:26:14.511  READ DMA EXT
  35 00 00 00 07 00 00 00 70 db e8 00 00 11d+20:26:08.968  WRITE DMA EXT
  35 00 00 00 08 00 00 00 63 38 08 00 00 11d+20:25:55.590  WRITE DMA EXT
  35 00 00 00 08 00 00 00 62 b3 80 00 00 11d+20:25:42.975  WRITE DMA EXT
  25 00 00 00 40 00 00 00 2f e8 52 00 00 11d+20:07:45.676  READ DMA EXT

Error 40 [19] occurred at disk power-on lifetime: 5379 hours (224 days + 3 hours)
  When the command that caused the error occurred, the device was active or idle.

  After command completion occurred, registers were:
  ER -- ST COUNT  LBA_48  LH LM LL DV DC
  -- -- -- == -- == == == -- -- -- -- --
  40 -- 51 00 08 00 00 14 d8 a2 d5 51 00  Error: UNC 8 sectors at LBA = 0x15d8a2d5 = 366518997

  Commands leading to the command that caused the error were:
  CR FEATR COUNT  LBA_48  LH LM LL DV DC  Powered_Up_Time  Command/Feature_Name
  -- == -- == -- == == == -- -- -- -- --  ---------------  --------------------
  25 00 00 00 08 00 00 14 d8 a2 d0 00 00  6d+13:20:53.947  READ DMA EXT
  ea 00 00 00 00 00 00 cf 00 00 00 a0 00  6d+13:17:48.771  FLUSH CACHE EXT
  25 00 00 00 08 00 00 14 d8 a2 c8 00 00  6d+13:17:46.418  READ DMA EXT
  35 00 00 00 08 00 00 00 5e b3 90 00 00  6d+13:17:41.920  WRITE DMA EXT
  25 00 00 00 08 00 00 14 d8 a2 c0 00 00  6d+13:17:39.414  READ DMA EXT

Error 39 [18] occurred at disk power-on lifetime: 5379 hours (224 days + 3 hours)
  When the command that caused the error occurred, the device was active or idle.

  After command completion occurred, registers were:
  ER -- ST COUNT  LBA_48  LH LM LL DV DC
  -- -- -- == -- == == == -- -- -- -- --
  40 -- 51 01 00 00 00 14 d8 a2 d5 51 00  Error: UNC 256 sectors at LBA = 0x15d8a2d5 = 366518997

  Commands leading to the command that caused the error were:
  CR FEATR COUNT  LBA_48  LH LM LL DV DC  Powered_Up_Time  Command/Feature_Name
  -- == -- == -- == == == -- -- -- -- --  ---------------  --------------------
  25 00 00 01 00 00 00 14 d8 a2 40 00 00  5d+13:14:20.371  READ DMA EXT
  35 00 00 00 98 00 00 14 d8 a1 a8 00 00  5d+13:14:11.494  WRITE DMA EXT
  35 00 00 01 00 00 00 14 d8 a0 a8 00 00  5d+13:14:02.512  WRITE DMA EXT
  35 00 00 01 00 00 00 14 d8 9f a8 00 00  5d+13:13:53.487  WRITE DMA EXT
  35 00 00 01 00 00 00 14 d8 9e a8 00 00  5d+13:13:44.034  WRITE DMA EXT

Error 38 [17] occurred at disk power-on lifetime: 4153 hours (173 days + 1 hours)
  When the command that caused the error occurred, the device was active or idle.

  After command completion occurred, registers were:
  ER -- ST COUNT  LBA_48  LH LM LL DV DC
  -- -- -- == -- == == == -- -- -- -- --
  40 -- 51 00 04 00 00 00 b5 8b c1 51 00  Error: UNC 4 sectors at LBA = 0x01b58bc1 = 28675009

  Commands leading to the command that caused the error were:
  CR FEATR COUNT  LBA_48  LH LM LL DV DC  Powered_Up_Time  Command/Feature_Name
  -- == -- == -- == == == -- -- -- -- --  ---------------  --------------------
  25 00 00 00 04 00 00 00 b5 8b c0 00 00 12d+07:25:00.410  READ DMA EXT
  35 00 00 00 08 00 00 00 63 4d f8 00 00 12d+07:24:46.563  WRITE DMA EXT
  35 00 00 00 18 00 00 00 62 b3 90 00 00 12d+07:24:31.609  WRITE DMA EXT
  35 00 00 00 08 00 00 00 5e b3 98 00 00 12d+07:24:23.481  WRITE DMA EXT
  25 00 00 00 40 00 00 00 55 91 20 00 00 12d+07:20:53.256  READ DMA EXT

Error 37 [16] occurred at disk power-on lifetime: 4153 hours (173 days + 1 hours)
  When the command that caused the error occurred, the device was active or idle.

  After command completion occurred, registers were:
  ER -- ST COUNT  LBA_48  LH LM LL DV DC
  -- -- -- == -- == == == -- -- -- -- --
  40 -- 51 00 04 00 00 00 b5 8b c1 51 00  Error: UNC 4 sectors at LBA = 0x01b58bc1 = 28675009

  Commands leading to the command that caused the error were:
  CR FEATR COUNT  LBA_48  LH LM LL DV DC  Powered_Up_Time  Command/Feature_Name
  -- == -- == -- == == == -- -- -- -- --  ---------------  --------------------
  25 00 00 00 04 00 00 00 b5 8b c0 00 00 11d+20:26:14.511  READ DMA EXT
  35 00 00 00 07 00 00 00 70 db e8 00 00 11d+20:26:08.968  WRITE DMA EXT
  35 00 00 00 08 00 00 00 63 38 08 00 00 11d+20:25:55.590  WRITE DMA EXT
  35 00 00 00 08 00 00 00 62 b3 80 00 00 11d+20:25:42.975  WRITE DMA EXT
  25 00 00 00 40 00 00 00 2f e8 52 00 00 11d+20:07:45.676  READ DMA EXT

SMART Extended Self-test Log Version: 1 (1 sectors)
Num  Test_Description    Status                  Remaining  LifeTime(hours)  LBA_of_first_error
# 1  Short offline       Completed without error       00%     16987         -
# 2  Short offline       Completed without error       00%     16987         -
# 3  Short offline       Completed without error       00%     14534         -
# 4  Extended offline    Completed: read failure       60%     14527         417508776
# 5  Extended offline    Interrupted (host reset)      00%     14523         -
# 6  Extended offline    Interrupted (host reset)      00%     14521         -
# 7  Extended offline    Interrupted (host reset)      00%     14513         -
# 8  Extended offline    Interrupted (host reset)      00%     14511         -
# 9  Extended offline    Interrupted (host reset)      00%     14510         -
#10  Extended offline    Completed without error       00%     14507         -
#11  Short offline       Completed without error       00%     14503         -
#12  Extended offline    Aborted by host               90%     14503         -
#13  Extended offline    Interrupted (host reset)      00%     14500         -
#14  Extended offline    Aborted by host               30%     14499         -
#15  Extended offline    Interrupted (host reset)      70%     14497         -
#16  Extended offline    Interrupted (host reset)      00%     14492         -
#17  Extended offline    Aborted by host               90%     14492         -
#18  Extended offline    Aborted by host               80%     14492         -
#19  Extended offline    Interrupted (host reset)      00%     14490         -

SMART Selective self-test log data structure revision number 1
 SPAN  MIN_LBA  MAX_LBA  CURRENT_TEST_STATUS
    1        0        0  Not_testing
    2        0        0  Not_testing
    3        0        0  Not_testing
    4        0        0  Not_testing
    5        0        0  Not_testing
Selective self-test flags (0x0):
  After scanning selected spans, do NOT read-scan remainder of disk.
If Selective self-test is pending on power-up, resume after 0 minute delay.

SCT Status Version:                  3
SCT Version (vendor specific):       522 (0x020a)
Device State:                        Active (0)
Current Temperature:                    38 Celsius
Power Cycle Min/Max Temperature:     30/41 Celsius
Lifetime    Min/Max Temperature:     22/57 Celsius
Under/Over Temperature Limit Count:   0/4

SCT Data Table command not supported

SCT Error Recovery Control command not supported

Device Statistics (GP/SMART Log 0x04) not supported

Pending Defects log (GP Log 0x0c) not supported

SATA Phy Event Counters (GP Log 0x11)
ID      Size     Value  Description
0x000a  2            3  Device-to-host register FISes sent due to a COMRESET
0x0001  2            0  Command failed due to ICRC error
0x0003  2            0  R_ERR response for device-to-host data FIS
0x0004  2            0  R_ERR response for host-to-device data FIS
0x0006  2            0  R_ERR response for device-to-host non-data FIS
0x0007  2            0  R_ERR response for host-to-device non-data FIS

