smartctl 7.4 2023-08-01 r5530 [x86_64-linux-6.6.46] (local build)
Copyright (C) 2002-23, Bruce Allen, Christian Franke, www.smartmontools.org

=== START OF INFORMATION SECTION ===
Model Family:     Seagate Momentus 7200.3
Device Model:     ST9320421ASG
Serial Number:    --
LU WWN Device Id: 5 000c50 ...
Firmware Version: DE16
User Capacity:    320,072,933,376 bytes [320 GB]
Sector Size:      512 bytes logical/physical
Rotation Rate:    7200 rpm
Device is:        In smartctl database 7.3/5387
ATA Version is:   ATA8-ACS T13/1699-D revision 4
SATA Version is:  SATA 2.6, 3.0 Gb/s
Local Time is:    Fri Jul  4 14:48:06 2025 PDT
SMART support is: Available - device has SMART capability.
SMART support is: Enabled
AAM level is:     208 (intermediate), recommended: 208
APM level is:     128 (minimum power consumption without standby)
Rd look-ahead is: Enabled
Write cache is:   Enabled
DSN feature is:   Unavailable
ATA Security is:  Disabled, frozen [SEC2]
Wt Cache Reorder: Unknown

=== START OF READ SMART DATA SECTION ===
SMART overall-health self-assessment test result: PASSED
See vendor-specific Attribute list for marginal Attributes.

General SMART Values:
Offline data collection status:  (0x00)	Offline data collection activity
					was never started.
					Auto Offline Data Collection: Disabled.
Self-test execution status:      (   0)	The previous self-test routine completed
					without error or no self-test has ever 
					been run.
Total time to complete Offline 
data collection: 		(    0) seconds.
Offline data collection
capabilities: 			 (0x73) SMART execute Offline immediate.
					Auto Offline data collection on/off support.
					Suspend Offline collection upon new
					command.
					No Offline surface scan supported.
					Self-test supported.
					Conveyance Self-test supported.
					Selective Self-test supported.
SMART capabilities:            (0x0003)	Saves SMART data before entering
					power-saving mode.
					Supports SMART auto save timer.
Error logging capability:        (0x01)	Error logging supported.
					General Purpose Logging supported.
Short self-test routine 
recommended polling time: 	 (   1) minutes.
Extended self-test routine
recommended polling time: 	 (  95) minutes.
Conveyance self-test routine
recommended polling time: 	 (   2) minutes.
SCT capabilities: 	       (0x103f)	SCT Status supported.
					SCT Error Recovery Control supported.
					SCT Feature Control supported.
					SCT Data Table supported.

SMART Attributes Data Structure revision number: 10
Vendor Specific SMART Attributes with Thresholds:
ID# ATTRIBUTE_NAME          FLAGS    VALUE WORST THRESH FAIL RAW_VALUE
  1 Raw_Read_Error_Rate     POSR--   093   084   006    -    134178434
  3 Spin_Up_Time            PO----   100   096   085    -    0
  4 Start_Stop_Count        -O--CK   095   095   020    -    5286
  5 Reallocated_Sector_Ct   PO--CK   099   099   036    -    74
  7 Seek_Error_Rate         POSR--   054   051   030    -    2645865101728
  9 Power_On_Hours          -O--CK   088   088   000    -    11175
 10 Spin_Retry_Count        PO--C-   100   100   097    -    230
 12 Power_Cycle_Count       -O--CK   096   037   020    -    4763
184 End-to-End_Error        -O--CK   100   100   099    -    0
187 Reported_Uncorrect      -O--CK   001   001   000    -    21997
188 Command_Timeout         -O--CK   100   099   000    -    43
189 High_Fly_Writes         -O-RCK   001   001   000    -    4766
190 Airflow_Temperature_Cel -O---K   066   043   045    Past 34 (0 13 36 27 0)
191 G-Sense_Error_Rate      -O--CK   100   100   000    -    0
192 Power-Off_Retract_Count -O--CK   100   100   000    -    1442
193 Load_Cycle_Count        -O--CK   027   027   000    -    147932
194 Temperature_Celsius     -O---K   034   058   000    -    34
195 Hardware_ECC_Recovered  -O-RC-   050   030   000    -    134178434
197 Current_Pending_Sector  -O--C-   100   100   000    -    2
198 Offline_Uncorrectable   ----C-   100   100   000    -    2
199 UDMA_CRC_Error_Count    -OSRCK   200   200   000    -    0
240 Head_Flying_Hours       ------   100   253   000    -    11781 (48 153 0)
241 Total_LBAs_Written      ------   100   253   000    -    3064721637
242 Total_LBAs_Read         ------   100   253   000    -    3282290611
254 Free_Fall_Sensor        -O--CK   001   001   000    -    997
                            ||||||_ K auto-keep
                            |||||__ C event count
                            ||||___ R error rate
                            |||____ S speed/performance
                            ||_____ O updated online
                            |______ P prefailure warning

General Purpose Log Directory Version 1
SMART           Log Directory Version 1 [multi-sector log support]
Address    Access  R/W   Size  Description
0x00       GPL,SL  R/O      1  Log Directory
0x01       GPL,SL  R/O      1  Summary SMART error log
0x02       GPL,SL  R/O      5  Comprehensive SMART error log
0x03       GPL,SL  R/O      5  Ext. Comprehensive SMART error log
0x06       GPL,SL  R/O      1  SMART self-test log
0x07       GPL,SL  R/O      1  Extended self-test log
0x09       GPL,SL  R/W      1  Selective self-test log
0x10       GPL,SL  R/O      1  NCQ Command Error log
0x11       GPL,SL  R/O      1  SATA Phy Event Counters log
0x21       GPL,SL  R/O      1  Write stream error log
0x22       GPL,SL  R/O      1  Read stream error log
0x80-0x9f  GPL,SL  R/W     16  Host vendor specific log
0xa1       GPL,SL  VS      20  Device vendor specific log
0xa2       GPL     VS    2248  Device vendor specific log
0xa8       GPL,SL  VS      20  Device vendor specific log
0xa9       GPL,SL  VS       1  Device vendor specific log
0xb0       GPL     VS    2819  Device vendor specific log
0xbe-0xbf  GPL     VS   65535  Device vendor specific log
0xe0       GPL,SL  R/W      1  SCT Command/Status
0xe1       GPL,SL  R/W      1  SCT Data Transfer

SMART Extended Comprehensive Error Log Version: 1 (5 sectors)
Device Error Count: 21634 (device log contains only the most recent 20 errors)
	CR     = Command Register
	FEATR  = Features Register
	COUNT  = Count (was: Sector Count) Register
	LBA_48 = Upper bytes of LBA High/Mid/Low Registers ]  ATA-8
	LH     = LBA High (was: Cylinder High) Register    ]   LBA
	LM     = LBA Mid (was: Cylinder Low) Register      ] Register
	LL     = LBA Low (was: Sector Number) Register     ]
	DV     = Device (was: Device/Head) Register
	DC     = Device Control Register
	ER     = Error register
	ST     = Status register
Powered_Up_Time is measured from power on, and printed as
DDd+hh:mm:SS.sss where DD=days, hh=hours, mm=minutes,
SS=sec, and sss=millisec. It "wraps" after 49.710 days.

Error 21634 [13] occurred at disk power-on lifetime: 5009 hours (208 days + 17 hours)
  When the command that caused the error occurred, the device was active or idle.

  After command completion occurred, registers were:
  ER -- ST COUNT  LBA_48  LH LM LL DV DC
  -- -- -- == -- == == == -- -- -- -- --
  40 -- 51 00 00 00 03 5a 00 4b b6 00 00  Error: UNC at LBA = 0x35a004bb6 = 14394870710

  Commands leading to the command that caused the error were:
  CR FEATR COUNT  LBA_48  LH LM LL DV DC  Powered_Up_Time  Command/Feature_Name
  -- == -- == -- == == == -- -- -- -- --  ---------------  --------------------
  60 00 00 00 20 00 00 7e 00 42 f0 40 00     00:07:17.271  READ FPDMA QUEUED
  60 00 00 00 10 00 03 5a 00 4b a8 40 00     00:07:17.265  READ FPDMA QUEUED
  60 00 00 00 18 00 00 4d 00 3c b0 40 00     00:07:17.262  READ FPDMA QUEUED
  60 00 00 00 38 00 00 9f 00 36 88 40 00     00:07:17.244  READ FPDMA QUEUED
  61 00 00 00 08 00 00 76 00 bf b8 40 00     00:07:17.237  WRITE FPDMA QUEUED

Error 21633 [12] occurred at disk power-on lifetime: 5009 hours (208 days + 17 hours)
  When the command that caused the error occurred, the device was active or idle.

  After command completion occurred, registers were:
  ER -- ST COUNT  LBA_48  LH LM LL DV DC
  -- -- -- == -- == == == -- -- -- -- --
  40 -- 51 00 00 00 03 5a 00 4b b6 00 00  Error: UNC at LBA = 0x35a004bb6 = 14394870710

  Commands leading to the command that caused the error were:
  CR FEATR COUNT  LBA_48  LH LM LL DV DC  Powered_Up_Time  Command/Feature_Name
  -- == -- == -- == == == -- -- -- -- --  ---------------  --------------------
  60 00 00 00 28 00 03 72 00 75 c0 40 00     00:07:11.155  READ FPDMA QUEUED
  60 00 00 00 10 00 00 02 00 36 28 40 00     00:07:11.143  READ FPDMA QUEUED
  60 00 00 00 03 00 00 7e 00 3a 20 40 00     00:07:11.142  READ FPDMA QUEUED
  60 00 00 00 01 00 00 42 00 30 e0 40 00     00:07:11.141  READ FPDMA QUEUED
  60 00 00 00 83 00 00 7d 00 3a a0 40 00     00:07:11.132  READ FPDMA QUEUED

Error 21632 [11] occurred at disk power-on lifetime: 5009 hours (208 days + 17 hours)
  When the command that caused the error occurred, the device was active or idle.

  After command completion occurred, registers were:
  ER -- ST COUNT  LBA_48  LH LM LL DV DC
  -- -- -- == -- == == == -- -- -- -- --
  40 -- 51 00 00 00 03 5a 00 4b b6 00 00  Error: UNC at LBA = 0x35a004bb6 = 14394870710

  Commands leading to the command that caused the error were:
  CR FEATR COUNT  LBA_48  LH LM LL DV DC  Powered_Up_Time  Command/Feature_Name
  -- == -- == -- == == == -- -- -- -- --  ---------------  --------------------
  60 00 00 00 20 00 00 a6 00 17 66 40 00     00:07:07.964  READ FPDMA QUEUED
  61 00 00 00 40 00 03 ca 00 24 a0 40 00     00:07:07.961  WRITE FPDMA QUEUED
  61 00 00 00 08 00 00 2d 00 0d a8 40 00     00:07:07.960  WRITE FPDMA QUEUED
  60 00 00 00 10 00 00 45 00 3b 18 40 00     00:07:07.960  READ FPDMA QUEUED
  60 00 00 00 08 00 01 cf 00 53 60 40 00     00:07:07.959  READ FPDMA QUEUED

Error 21631 [10] occurred at disk power-on lifetime: 5009 hours (208 days + 17 hours)
  When the command that caused the error occurred, the device was active or idle.

  After command completion occurred, registers were:
  ER -- ST COUNT  LBA_48  LH LM LL DV DC
  -- -- -- == -- == == == -- -- -- -- --
  40 -- 51 00 00 00 03 5a 00 4b b6 00 00  Error: UNC at LBA = 0x35a004bb6 = 14394870710

  Commands leading to the command that caused the error were:
  CR FEATR COUNT  LBA_48  LH LM LL DV DC  Powered_Up_Time  Command/Feature_Name
  -- == -- == -- == == == -- -- -- -- --  ---------------  --------------------
  60 00 00 00 b8 00 02 81 00 a9 00 40 00     00:07:04.821  READ FPDMA QUEUED
  60 00 00 00 10 00 03 5a 00 4b b0 40 00     00:07:04.821  READ FPDMA QUEUED
  60 00 00 00 08 00 04 68 00 97 e8 40 00     00:07:04.820  READ FPDMA QUEUED
  60 00 00 00 40 00 00 99 00 17 2a 40 00     00:07:04.819  READ FPDMA QUEUED
  60 00 00 00 10 00 00 cd 00 3a 80 40 00     00:07:04.818  READ FPDMA QUEUED

Error 21630 [9] occurred at disk power-on lifetime: 5009 hours (208 days + 17 hours)
  When the command that caused the error occurred, the device was active or idle.

  After command completion occurred, registers were:
  ER -- ST COUNT  LBA_48  LH LM LL DV DC
  -- -- -- == -- == == == -- -- -- -- --
  40 -- 51 00 00 00 03 5a 00 4b b6 00 00  Error: UNC at LBA = 0x35a004bb6 = 14394870710

  Commands leading to the command that caused the error were:
  CR FEATR COUNT  LBA_48  LH LM LL DV DC  Powered_Up_Time  Command/Feature_Name
  -- == -- == -- == == == -- -- -- -- --  ---------------  --------------------
  60 00 00 00 10 00 00 13 00 0a f8 40 00     00:07:01.942  READ FPDMA QUEUED
  61 00 00 00 08 00 05 fe 00 ec 60 40 00     00:07:01.941  WRITE FPDMA QUEUED
  60 00 00 00 b8 00 02 81 00 a9 00 40 00     00:07:01.940  READ FPDMA QUEUED
  60 00 00 00 10 00 00 25 00 36 28 40 00     00:07:01.940  READ FPDMA QUEUED
  60 00 00 00 10 00 03 5a 00 4b b0 40 00     00:07:01.939  READ FPDMA QUEUED

Error 21629 [8] occurred at disk power-on lifetime: 5009 hours (208 days + 17 hours)
  When the command that caused the error occurred, the device was active or idle.

  After command completion occurred, registers were:
  ER -- ST COUNT  LBA_48  LH LM LL DV DC
  -- -- -- == -- == == == -- -- -- -- --
  40 -- 51 00 00 00 03 5a 00 4b b6 00 00  Error: UNC at LBA = 0x35a004bb6 = 14394870710

  Commands leading to the command that caused the error were:
  CR FEATR COUNT  LBA_48  LH LM LL DV DC  Powered_Up_Time  Command/Feature_Name
  -- == -- == -- == == == -- -- -- -- --  ---------------  --------------------
  60 00 00 00 10 00 00 24 00 36 f8 40 00     00:06:58.868  READ FPDMA QUEUED
  60 00 00 00 08 00 02 4e 00 a9 c8 40 00     00:06:58.868  READ FPDMA QUEUED
  60 00 00 00 10 00 03 5a 00 4b a8 40 00     00:06:58.868  READ FPDMA QUEUED
  2f 00 00 00 01 00 00 00 00 00 10 e0 00     00:06:58.867  READ LOG EXT
  60 00 00 00 10 00 00 24 00 36 f8 40 00     00:06:56.098  READ FPDMA QUEUED

Error 21628 [7] occurred at disk power-on lifetime: 5009 hours (208 days + 17 hours)
  When the command that caused the error occurred, the device was active or idle.

  After command completion occurred, registers were:
  ER -- ST COUNT  LBA_48  LH LM LL DV DC
  -- -- -- == -- == == == -- -- -- -- --
  40 -- 51 00 00 00 03 5a 00 4b b6 00 00  Error: UNC at LBA = 0x35a004bb6 = 14394870710

  Commands leading to the command that caused the error were:
  CR FEATR COUNT  LBA_48  LH LM LL DV DC  Powered_Up_Time  Command/Feature_Name
  -- == -- == -- == == == -- -- -- -- --  ---------------  --------------------
  60 00 00 00 10 00 00 24 00 36 f8 40 00     00:06:56.098  READ FPDMA QUEUED
  60 00 00 00 08 00 02 4e 00 a9 c8 40 00     00:06:56.098  READ FPDMA QUEUED
  60 00 00 00 10 00 03 5a 00 4b a8 40 00     00:06:56.090  READ FPDMA QUEUED
  60 00 00 00 10 00 03 5a 00 4b a8 40 00     00:06:56.090  READ FPDMA QUEUED
  60 00 00 00 18 00 00 26 00 36 28 40 00     00:06:56.087  READ FPDMA QUEUED

Error 21627 [6] occurred at disk power-on lifetime: 5009 hours (208 days + 17 hours)
  When the command that caused the error occurred, the device was active or idle.

  After command completion occurred, registers were:
  ER -- ST COUNT  LBA_48  LH LM LL DV DC
  -- -- -- == -- == == == -- -- -- -- --
  40 -- 51 00 00 00 03 5a 00 4b b6 00 00  Error: UNC at LBA = 0x35a004bb6 = 14394870710

  Commands leading to the command that caused the error were:
  CR FEATR COUNT  LBA_48  LH LM LL DV DC  Powered_Up_Time  Command/Feature_Name
  -- == -- == -- == == == -- -- -- -- --  ---------------  --------------------
  60 00 00 00 20 00 03 5a 00 4b b0 40 00     00:06:50.246  READ FPDMA QUEUED
  2f 00 00 00 01 00 00 00 00 00 10 e0 00     00:06:50.246  READ LOG EXT
  60 00 00 00 10 00 03 5a 00 4b b0 40 00     00:06:47.430  READ FPDMA QUEUED
  2f 00 00 00 01 00 00 00 00 00 10 e0 00     00:06:47.429  READ LOG EXT
  60 00 00 00 18 00 03 5a 00 4b a8 40 00     00:06:44.590  READ FPDMA QUEUED

SMART Extended Self-test Log Version: 1 (1 sectors)
Num  Test_Description    Status                  Remaining  LifeTime(hours)  LBA_of_first_error
# 1  Extended offline    Completed: read failure       90%      3167         367545652
# 2  Extended offline    Completed: read failure       90%      3167         367545652
# 3  Short offline       Completed without error       00%      2598         -
# 4  Short offline       Completed without error       00%       795         -
# 5  Short offline       Completed without error       00%        37         -
# 6  Extended offline    Completed without error       00%        35         -
# 7  Short offline       Completed without error       00%        33         -
# 8  Extended offline    Completed without error       00%        33         -
# 9  Short offline       Completed without error       00%        31         -
#10  Short offline       Completed without error       00%        31         -
#11  Extended offline    Completed without error       00%        29         -
#12  Short offline       Completed without error       00%        27         -
#13  Extended offline    Completed without error       00%        27         -
#14  Short offline       Completed without error       00%        26         -
#15  Extended offline    Completed without error       00%        13         -
#16  Extended offline    Aborted by host               40%        12         -
#17  Short offline       Completed without error       00%        11         -

SMART Selective self-test log data structure revision number 1
 SPAN  MIN_LBA  MAX_LBA  CURRENT_TEST_STATUS
    1        0        0  Not_testing
    2        0        0  Not_testing
    3        0        0  Not_testing
    4        0        0  Not_testing
    5        0        0  Not_testing
Selective self-test flags (0x0):
  After scanning selected spans, do NOT read-scan remainder of disk.
If Selective self-test is pending on power-up, resume after 0 minute delay.

SCT Status Version:                  3
SCT Version (vendor specific):       522 (0x020a)
Device State:                        Active (0)
Current Temperature:                    35 Celsius
Power Cycle Min/Max Temperature:     27/35 Celsius
Lifetime    Min/Max Temperature:      0/57 Celsius
Specified Max Operating Temperature:    37 Celsius
Under/Over Temperature Limit Count:   0/0

SCT Temperature History Version:     2
Temperature Sampling Period:         10 minutes
Temperature Logging Interval:        11 minutes
Min/Max recommended Temperature:     14/55 Celsius
Min/Max Temperature Limit:           10/60 Celsius
Temperature History Size (Index):    128 (51)

SCT Error Recovery Control:
           Read: Disabled
          Write: Disabled

Device Statistics (GP/SMART Log 0x04) not supported

Pending Defects log (GP Log 0x0c) not supported

SATA Phy Event Counters (GP Log 0x11)
ID      Size     Value  Description
0x000a  2            2  Device-to-host register FISes sent due to a COMRESET
0x0001  2            0  Command failed due to ICRC error
0x0003  2            0  R_ERR response for device-to-host data FIS
0x0004  2            0  R_ERR response for host-to-device data FIS
0x0006  2            0  R_ERR response for device-to-host non-data FIS
0x0007  2            0  R_ERR response for host-to-device non-data FIS

