smartctl 7.5 2025-04-30 r5714 [x86_64-linux-6.15.11-xanmod1] (local build)
Copyright (C) 2002-25, Bruce Allen, Christian Franke, www.smartmontools.org

=== START OF INFORMATION SECTION ===
Model Number:                       INTEL SSDPEKKW512G7
Serial Number:                      --
Firmware Version:                   PSF100C
PCI Vendor/Subsystem ID:            0x8086
IEEE OUI Identifier:                0x5cd2e4
Controller ID:                      1
NVMe Version:                       1.2
Number of Namespaces:               1
Namespace 1 Size/Capacity:          512,110,190,592 [512 GB]
Namespace 1 Formatted LBA Size:     512
Local Time is:                      Sat Sep  6 14:48:15 2025 CDT
Firmware Updates (0x12):            1 Slot, no Reset required
Optional Admin Commands (0x0006):   Format Frmw_DL
Optional NVM Commands (0x001e):     Wr_Unc DS_Mngmt Wr_Zero Sav/Sel_Feat
Log Page Attributes (0x03):         S/H_per_NS Cmd_Eff_Lg
Maximum Data Transfer Size:         32 Pages
Warning  Comp. Temp. Threshold:     70 Celsius
Critical Comp. Temp. Threshold:     80 Celsius

Supported Power States
St Op     Max   Active     Idle   RL RT WL WT  Ent_Lat  Ex_Lat
 0 +     9.00W       -        -    0  0  0  0        5       5
 1 +     4.60W       -        -    1  1  1  1       30      30
 2 +     3.80W       -        -    2  2  2  2       30      30
 3 -   0.0700W       -        -    3  3  3  3    10000     300
 4 -   0.0050W       -        -    4  4  4  4     2000   10000

Supported LBA Sizes (NSID 0x1)
Id Fmt  Data  Metadt  Rel_Perf
 0 +     512       0         0

=== START OF SMART DATA SECTION ===
SMART overall-health self-assessment test result: PASSED

SMART/Health Information (NVMe Log 0x02, NSID 0x1)
Critical Warning:                   0x00
Temperature:                        38 Celsius
Available Spare:                    100%
Available Spare Threshold:          10%
Percentage Used:                    8%
Data Units Read:                    48,436,871 [24.7 TB]
Data Units Written:                 95,196,533 [48.7 TB]
Host Read Commands:                 513,193,705
Host Write Commands:                822,578,747
Controller Busy Time:               7,183
Power Cycles:                       4,289
Power On Hours:                     23,830
Unsafe Shutdowns:                   77
Media and Data Integrity Errors:    1
Error Information Log Entries:      1
Warning  Comp. Temperature Time:    52
Critical Comp. Temperature Time:    0

Error Information (NVMe Log 0x01, 16 of 64 entries)
Num   ErrCount  SQId   CmdId  Status  PELoc          LBA  NSID    VS  Message
  0          1     1  0x0000  0x0286      -            0     1     -  Unknown Command Specific Status 0x43

Self-tests not supported



