smartctl 7.5 2025-04-30 r5714 [x86_64-linux-6.12.62-1-MANJARO] (local build)
Copyright (C) 2002-25, Bruce Allen, Christian Franke, www.smartmontools.org

=== START OF INFORMATION SECTION ===
Model Number:                       KINGSTON SNVS2000G
Serial Number:                      --
Firmware Version:                   S8442105
PCI Vendor/Subsystem ID:            0x2646
IEEE OUI Identifier:                0x0026b7
Controller ID:                      1
NVMe Version:                       1.3
Number of Namespaces:               1
Namespace 1 Size/Capacity:          2,000,398,934,016 [2.00 TB]
Namespace 1 Formatted LBA Size:     512
Namespace 1 IEEE EUI-64:            0026b7 ...
Local Time is:                      Tue Dec 16 15:42:29 2025 EET
Firmware Updates (0x12):            1 Slot, no Reset required
Optional Admin Commands (0x0016):   Format Frmw_DL Self_Test
Optional NVM Commands (0x005f):     Comp Wr_Unc DS_Mngmt Wr_Zero Sav/Sel_Feat Timestmp
Log Page Attributes (0x03):         S/H_per_NS Cmd_Eff_Lg
Maximum Data Transfer Size:         64 Pages
Warning  Comp. Temp. Threshold:     85 Celsius
Critical Comp. Temp. Threshold:     90 Celsius

Supported Power States
St Op     Max   Active     Idle   RL RT WL WT  Ent_Lat  Ex_Lat
 0 +     6.00W       -        -    0  0  0  0        0       0
 1 +     3.00W       -        -    1  1  1  1        0       0
 2 +     1.50W       -        -    2  2  2  2        0       0
 3 -   0.0250W       -        -    3  3  3  3     8000    3000
 4 -   0.0040W       -        -    4  4  4  4    25000   25000

Supported LBA Sizes (NSID 0x1)
Id Fmt  Data  Metadt  Rel_Perf
 0 +     512       0         0

=== START OF SMART DATA SECTION ===
SMART overall-health self-assessment test result: PASSED

SMART/Health Information (NVMe Log 0x02, NSID 0x1)
Critical Warning:                   0x00
Temperature:                        35 Celsius
Available Spare:                    100%
Available Spare Threshold:          10%
Percentage Used:                    1%
Data Units Read:                    76,652,378 [39.2 TB]
Data Units Written:                 18,223,993 [9.33 TB]
Host Read Commands:                 319,283,694
Host Write Commands:                87,323,190
Controller Busy Time:               11,722
Power Cycles:                       977
Power On Hours:                     11,819
Unsafe Shutdowns:                   86
Media and Data Integrity Errors:    0
Error Information Log Entries:      0
Warning  Comp. Temperature Time:    115
Critical Comp. Temperature Time:    9

Error Information (NVMe Log 0x01, 16 of 64 entries)
No Errors Logged

Self-test Log (NVMe Log 0x06, NSID 0xffffffff)
Self-test status: No self-test in progress
No Self-tests Logged

