smartctl 7.4 2023-08-01 r5530 [x86_64-linux-6.14.0-desktop-3omv2590] (OpenMandriva Lx 7.4-1)
Copyright (C) 2002-23, Bruce Allen, Christian Franke, www.smartmontools.org

=== START OF INFORMATION SECTION ===
Model Number:                       KINGSTON SNVS2000G
Serial Number:                      --
Firmware Version:                   EDFK5N0B
PCI Vendor/Subsystem ID:            0x2646
IEEE OUI Identifier:                0x0026b7
Total NVM Capacity:                 2,000,398,934,016 [2.00 TB]
Unallocated NVM Capacity:           0
Controller ID:                      1
NVMe Version:                       1.3
Number of Namespaces:               1
Namespace 1 Size/Capacity:          2,000,398,934,016 [2.00 TB]
Namespace 1 Formatted LBA Size:     512
Namespace 1 IEEE EUI-64:            0026b7 ...
Local Time is:                      Fri Mar 28 17:22:05 2025 CET
Firmware Updates (0x12):            1 Slot, no Reset required
Optional Admin Commands (0x0017):   Security Format Frmw_DL Self_Test
Optional NVM Commands (0x005e):     Wr_Unc DS_Mngmt Wr_Zero Sav/Sel_Feat Timestmp
Log Page Attributes (0x0e):         Cmd_Eff_Lg Ext_Get_Lg Telmtry_Lg
Maximum Data Transfer Size:         64 Pages
Warning  Comp. Temp. Threshold:     70 Celsius
Critical Comp. Temp. Threshold:     85 Celsius

Supported Power States
St Op     Max   Active     Idle   RL RT WL WT  Ent_Lat  Ex_Lat
 0 +     3.50W       -        -    0  0  0  0        0       0
 1 +     1.90W       -        -    1  1  1  1        0       0
 2 +     1.50W       -        -    2  2  2  2        0       0
 3 -   0.0700W       -        -    3  3  3  3     5000    1900
 4 -   0.0025W       -        -    4  4  4  4    13000  100000

Supported LBA Sizes (NSID 0x1)
Id Fmt  Data  Metadt  Rel_Perf
 0 +     512       0         1
 1 -    4096       0         0

=== START OF SMART DATA SECTION ===
SMART overall-health self-assessment test result: PASSED

SMART/Health Information (NVMe Log 0x02)
Critical Warning:                   0x00
Temperature:                        29 Celsius
Available Spare:                    100%
Available Spare Threshold:          10%
Percentage Used:                    10%
Data Units Read:                    241,034,871 [123 TB]
Data Units Written:                 206,645,126 [105 TB]
Host Read Commands:                 952,941,226
Host Write Commands:                598,952,150
Controller Busy Time:               12,056
Power Cycles:                       1,680
Power On Hours:                     19,648
Unsafe Shutdowns:                   133
Media and Data Integrity Errors:    0
Error Information Log Entries:      31,685
Warning  Comp. Temperature Time:    0
Critical Comp. Temperature Time:    0
Temperature Sensor 1:               46 Celsius
Temperature Sensor 2:               68 Celsius
Thermal Temp. 1 Transition Count:   2
Thermal Temp. 1 Total Time:         384

Error Information (NVMe Log 0x01, 16 of 16 entries)
Num   ErrCount  SQId   CmdId  Status  PELoc          LBA  NSID    VS  Message
  0      31685     0  0x3014  0x4005      -            0     0     -  Invalid Field in Command
  1      31684     0  0x2017  0x4004      -            0     0     -  Invalid Field in Command
  2      31683     0  0x2015  0x4004      -            0     0     -  Invalid Field in Command
  3      31682     0  0x2014  0x4004      -            0     0     -  Invalid Field in Command
  4      31681     0  0xa001  0x4004  0x004            0     1     -  Invalid Field in Command
  5      31680     0  0xa000  0x4004  0x004            0     1     -  Invalid Field in Command
  6      31679     0  0x001c  0x4005  0x028            0     0     -  Invalid Field in Command

Read Self-test Log failed: Invalid Field in Command (0x2002)



