smartctl 7.2 2020-12-30 r5155 [x86_64-linux-5.19.0-76051900-generic] (local build)
Copyright (C) 2002-20, Bruce Allen, Christian Franke, www.smartmontools.org

=== START OF INFORMATION SECTION ===
Model Number:                       HFM256GDJTNG-8310A
Serial Number:                      --
Firmware Version:                   80002C00
PCI Vendor/Subsystem ID:            0x1c5c
IEEE OUI Identifier:                0xace42e
Controller ID:                      1
NVMe Version:                       1.2
Number of Namespaces:               1
Namespace 1 Size/Capacity:          256,060,514,304 [256 GB]
Namespace 1 Formatted LBA Size:     512
Local Time is:                      Wed Sep 21 22:46:41 2022 IST
Firmware Updates (0x16):            3 Slots, no Reset required
Optional Admin Commands (0x0017):   Security Format Frmw_DL Self_Test
Optional NVM Commands (0x0016):     Wr_Unc DS_Mngmt Sav/Sel_Feat
Log Page Attributes (0x02):         Cmd_Eff_Lg
Maximum Data Transfer Size:         64 Pages
Warning  Comp. Temp. Threshold:     81 Celsius
Critical Comp. Temp. Threshold:     82 Celsius
Namespace 1 Features (0x02):        NA_Fields

Supported Power States
St Op     Max   Active     Idle   RL RT WL WT  Ent_Lat  Ex_Lat
 0 +   3.5000W       -        -    0  0  0  0        5       5
 1 +   2.4000W       -        -    1  1  1  1       30      30
 2 +   1.9000W       -        -    2  2  2  2      100     100
 3 -   0.0350W       -        -    3  3  3  3     1000    1000
 4 -   0.0035W       -        -    3  3  3  3     1000    5000

Supported LBA Sizes (NSID 0x1)
Id Fmt  Data  Metadt  Rel_Perf
 0 +     512       0         0
 1 -    4096       0         0

=== START OF SMART DATA SECTION ===
SMART overall-health self-assessment test result: PASSED

SMART/Health Information (NVMe Log 0x02)
Critical Warning:                   0x00
Temperature:                        41 Celsius
Available Spare:                    100%
Available Spare Threshold:          10%
Percentage Used:                    5%
Data Units Read:                    28,404,087 [14.5 TB]
Data Units Written:                 35,151,170 [17.9 TB]
Host Read Commands:                 457,918,338
Host Write Commands:                578,580,892
Controller Busy Time:               1,982
Power Cycles:                       3,210
Power On Hours:                     1,045
Unsafe Shutdowns:                   135
Media and Data Integrity Errors:    0
Error Information Log Entries:      0
Warning  Comp. Temperature Time:    0
Critical Comp. Temperature Time:    0
Temperature Sensor 1:               41 Celsius
Temperature Sensor 2:               44 Celsius

Error Information (NVMe Log 0x01, 16 of 256 entries)
No Errors Logged



