smartctl 7.3 2022-02-28 r5338 [x86_64-linux-6.2.0-25-generic] (local build)
Copyright (C) 2002-22, Bruce Allen, Christian Franke, www.smartmontools.org

=== START OF INFORMATION SECTION ===
Model Number:                       APPLE SSD AP0128H
Serial Number:                      --
Firmware Version:                   7.844.01
PCI Vendor/Subsystem ID:            0x106b
IEEE OUI Identifier:                0x000000
Controller ID:                      0
NVMe Version:                       <1.2
Number of Namespaces:               1
Namespace 1 Size/Capacity:          121,332,826,112 [121 GB]
Namespace 1 Formatted LBA Size:     4096
Namespace 1 IEEE EUI-64:            4db52b ...
Local Time is:                      Thu Jul 20 18:55:08 2023 BST
Firmware Updates (0x04):            2 Slots
Optional Admin Commands (0x0004):   Frmw_DL
Optional NVM Commands (0x0004):     DS_Mngmt
Maximum Data Transfer Size:         64 Pages

Supported Power States
St Op     Max   Active     Idle   RL RT WL WT  Ent_Lat  Ex_Lat
 0 +     0.00W       -        -    0  0  0  0        0       0

Supported LBA Sizes (NSID 0x1)
Id Fmt  Data  Metadt  Rel_Perf
 0 +    4096       0         0

=== START OF SMART DATA SECTION ===
SMART overall-health self-assessment test result: PASSED

SMART/Health Information (NVMe Log 0x02)
Critical Warning:                   0x00
Temperature:                        35 Celsius
Available Spare:                    100%
Available Spare Threshold:          0%
Percentage Used:                    17%
Data Units Read:                    83,745,674 [42.8 TB]
Data Units Written:                 51,592,365 [26.4 TB]
Host Read Commands:                 1,227,228,063
Host Write Commands:                489,453,423
Controller Busy Time:               0
Power Cycles:                       3,354
Power On Hours:                     580
Unsafe Shutdowns:                   168
Media and Data Integrity Errors:    0
Error Information Log Entries:      0

Error Information (NVMe Log 0x01, 1 of 1 entries)
No Errors Logged

