=== START OF INFORMATION SECTION ===
Model Number:                       ADATA SX6000PNP
Serial Number:                      --
Firmware Version:                   V9002s16
PCI Vendor/Subsystem ID:            0x10ec
IEEE OUI Identifier:                0x00e04c
Controller ID:                      1
Number of Namespaces:               1
Namespace 1 Size/Capacity:          512,110,190,592 [512 GB]
Namespace 1 Formatted LBA Size:     512
Local Time is:                      Tue May 26 10:55:54 2020 MSK
Firmware Updates (0x02):            1 Slot
Optional Admin Commands (0x0007):   Security Format Frmw_DL
Optional NVM Commands (0x0014):     DS_Mngmt Sav/Sel_Feat
Maximum Data Transfer Size:         32 Pages
Warning  Comp. Temp. Threshold:     118 Celsius
Critical Comp. Temp. Threshold:     150 Celsius

Supported Power States
St Op     Max   Active     Idle   RL RT WL WT  Ent_Lat  Ex_Lat
 0 +     8.00W       -        -    0  0  0  0        0       0
 1 +     4.00W       -        -    1  1  1  1        0       0
 2 +     3.00W       -        -    2  2  2  2        0       0
 3 -   0.0128W       -        -    3  3  3  3     4000    8000
 4 -   0.0080W       -        -    4  4  4  4     8000   30000

Supported LBA Sizes (NSID 0x1)
Id Fmt  Data  Metadt  Rel_Perf
 0 +     512       0         0

=== START OF SMART DATA SECTION ===
SMART overall-health self-assessment test result: PASSED

SMART/Health Information (NVMe Log 0x02)
Critical Warning:                   0x00
Temperature:                        32 Celsius
Available Spare:                    100%
Available Spare Threshold:          32%
Percentage Used:                    0%
Data Units Read:                    1,888,842 [967 GB]
Data Units Written:                 807,374 [413 GB]
Host Read Commands:                 15,406,686
Host Write Commands:                4,189,419
Controller Busy Time:               0
Power Cycles:                       29
Power On Hours:                     6
Unsafe Shutdowns:                   9
Media and Data Integrity Errors:    0
Error Information Log Entries:      0
Warning  Comp. Temperature Time:    0
Critical Comp. Temperature Time:    0

Error Information (NVMe Log 0x01, max 8 entries)
Num   ErrCount  SQId   CmdId  Status  PELoc          LBA  NSID    VS
  0          1     0  0x0000  0x0000  0x000            0     0     -
  6 1219368206019409473     0  0x0000  0x0000  0x000            0     0     -

