smartctl 7.4 2023-08-01 r5530 [x86_64-linux-6.8.0-53-generic] (local build)
Copyright (C) 2002-23, Bruce Allen, Christian Franke, www.smartmontools.org

=== START OF INFORMATION SECTION ===
Model Number:                       SPCC M.2 PCIe SSD
Serial Number:                      --
Firmware Version:                   ECFM12.2
PCI Vendor/Subsystem ID:            0x1987
IEEE OUI Identifier:                0x6479a7
Total NVM Capacity:                 256,060,514,304 [256 GB]
Unallocated NVM Capacity:           0
Controller ID:                      1
NVMe Version:                       1.3
Number of Namespaces:               1
Namespace 1 Size/Capacity:          256,060,514,304 [256 GB]
Namespace 1 Formatted LBA Size:     512
Namespace 1 IEEE EUI-64:            6479a7 ...
Local Time is:                      Wed Feb 12 19:17:25 2025 PST
Firmware Updates (0x12):            1 Slot, no Reset required
Optional Admin Commands (0x0007):   Security Format Frmw_DL
Optional NVM Commands (0x0054):     DS_Mngmt Sav/Sel_Feat Timestmp
Log Page Attributes (0x0c):         Ext_Get_Lg Telmtry_Lg
Maximum Data Transfer Size:         512 Pages
Warning  Comp. Temp. Threshold:     70 Celsius
Critical Comp. Temp. Threshold:     90 Celsius

Supported Power States
St Op     Max   Active     Idle   RL RT WL WT  Ent_Lat  Ex_Lat
 0 +     6.80W       -        -    0  0  0  0        0       0
 1 +     5.74W       -        -    1  1  1  1        0       0
 2 +     5.21W       -        -    2  2  2  2        0       0
 3 -   0.0490W       -        -    3  3  3  3     2000    2000
 4 -   0.0018W       -        -    4  4  4  4    25000   25000

Supported LBA Sizes (NSID 0x1)
Id Fmt  Data  Metadt  Rel_Perf
 0 +     512       0         2
 1 -    4096       0         1

=== START OF SMART DATA SECTION ===
SMART overall-health self-assessment test result: PASSED

SMART/Health Information (NVMe Log 0x02)
Critical Warning:                   0x00
Temperature:                        19 Celsius
Available Spare:                    100%
Available Spare Threshold:          5%
Percentage Used:                    5%
Data Units Read:                    28,446,756 [14.5 TB]
Data Units Written:                 20,870,453 [10.6 TB]
Host Read Commands:                 539,333,312
Host Write Commands:                325,815,139
Controller Busy Time:               1,566
Power Cycles:                       1,181
Power On Hours:                     29,039
Unsafe Shutdowns:                   347
Media and Data Integrity Errors:    0
Error Information Log Entries:      1,667
Warning  Comp. Temperature Time:    0
Critical Comp. Temperature Time:    0

Error Information (NVMe Log 0x01, 16 of 63 entries)
Num   ErrCount  SQId   CmdId  Status  PELoc          LBA  NSID    VS  Message
  0       1667     0  0x0019  0x4004  0x028            0     0     -  Invalid Field in Command
  1       1666     0  0x0013  0x4004  0x004            0     1     -  Invalid Field in Command
  2       1665     0  0x0011  0x4004  0x028            0     0     -  Invalid Field in Command
  3       1664     0  0x0013  0x4004  0x004            0     1     -  Invalid Field in Command
  4       1663     0  0x0018  0x4004  0x028            0     0     -  Invalid Field in Command
  5       1662     0  0x0013  0x4004  0x004            0     1     -  Invalid Field in Command
  6       1661     0  0x0008  0x4004  0x028            0     0     -  Invalid Field in Command
  7       1660     0  0x0015  0x4004  0x004            0     1     -  Invalid Field in Command
  8       1659     0  0x0007  0x4004      -            0     0     -  Invalid Field in Command
  9       1658     0  0x0000  0x4004  0x028            0     0     -  Invalid Field in Command
 10       1657     0  0x0013  0x4004  0x004            0     1     -  Invalid Field in Command
 11       1656     0  0x0008  0x4004  0x028            0     0     -  Invalid Field in Command
 12       1655     0  0x0013  0x4004  0x004            0     1     -  Invalid Field in Command
 13       1654     0  0x0005  0x4004  0x028            0     0     -  Invalid Field in Command
 14       1653     0  0x0013  0x4004  0x004            0     1     -  Invalid Field in Command
 15       1652     0  0x1010  0x4004  0x028            0     0     -  Invalid Field in Command
... (47 entries not read)

Self-tests not supported



