=== START OF INFORMATION SECTION ===
Model Family:     Seagate Momentus 7200.3
Device Model:     ST9160411AS
Serial Number:    --
LU WWN Device Id: 5 000c50 ...
Firmware Version: HP15
User Capacity:    160 041 885 696 bytes [160 GB]
Sector Size:      512 bytes logical/physical
Rotation Rate:    7200 rpm
Device is:        In smartctl database [for details use: -P show]
ATA Version is:   ATA8-ACS T13/1699-D revision 4
SATA Version is:  SATA 2.6, 3.0 Gb/s
Local Time is:    Thu Mar  2 17:19:13 2017 MSK
SMART support is: Available - device has SMART capability.
SMART support is: Enabled
AAM feature is:   Unavailable
APM level is:     128 (minimum power consumption without standby)
Rd look-ahead is: Enabled
Write cache is:   Enabled
ATA Security is:  Disabled, frozen [SEC2]
Wt Cache Reorder: Unknown

=== START OF READ SMART DATA SECTION ===
SMART overall-health self-assessment test result: PASSED
See vendor-specific Attribute list for marginal Attributes.

General SMART Values:
Offline data collection status:  (0x00)	Offline data collection activity
					was never started.
					Auto Offline Data Collection: Disabled.
Self-test execution status:      (   0)	The previous self-test routine completed
					without error or no self-test has ever 
					been run.
Total time to complete Offline 
data collection: 		(    0) seconds.
Offline data collection
capabilities: 			 (0x53) SMART execute Offline immediate.
					Auto Offline data collection on/off support.
					Suspend Offline collection upon new
					command.
					No Offline surface scan supported.
					Self-test supported.
					No Conveyance Self-test supported.
					Selective Self-test supported.
SMART capabilities:            (0x0003)	Saves SMART data before entering
					power-saving mode.
					Supports SMART auto save timer.
Error logging capability:        (0x01)	Error logging supported.
					General Purpose Logging supported.
Short self-test routine 
recommended polling time: 	 (   2) minutes.
Extended self-test routine
recommended polling time: 	 (  46) minutes.
SCT capabilities: 	       (0x103f)	SCT Status supported.
					SCT Error Recovery Control supported.
					SCT Feature Control supported.
					SCT Data Table supported.

SMART Attributes Data Structure revision number: 10
Vendor Specific SMART Attributes with Thresholds:
ID# ATTRIBUTE_NAME          FLAGS    VALUE WORST THRESH FAIL RAW_VALUE
  1 Raw_Read_Error_Rate     POSR--   115   099   006    -    92191522
  3 Spin_Up_Time            -O----   100   098   000    -    0
  4 Start_Stop_Count        PO--CK   098   098   020    -    2188
  5 Reallocated_Sector_Ct   PO--CK   100   100   036    -    0
  7 Seek_Error_Rate         POSR--   084   060   030    -    256165737
  9 Power_On_Hours          -O--CK   087   087   000    -    12233
 10 Spin_Retry_Count        PO--C-   100   100   097    -    22
 12 Power_Cycle_Count       PO--CK   098   037   020    -    2155
184 End-to-End_Error        PO--CK   100   100   097    -    0
187 Reported_Uncorrect      -O--CK   095   095   000    -    5
188 Command_Timeout         -O--CK   100   100   000    -    0
189 High_Fly_Writes         -O-RCK   100   100   000    -    0
190 Airflow_Temperature_Cel -O---K   060   037   045    Past 40 (Min/Max 25/40 #905)
191 G-Sense_Error_Rate      -O--CK   100   100   000    -    0
192 Power-Off_Retract_Count -O--CK   100   100   000    -    73
193 Load_Cycle_Count        -O--CK   092   092   000    -    16214
194 Temperature_Celsius     -O---K   040   063   000    -    40 (0 4 0 0 0)
195 Hardware_ECC_Recovered  -O-RC-   049   040   000    -    92191522
196 Reallocated_Event_Count PO--CK   100   100   036    -    0
197 Current_Pending_Sector  -O--C-   100   100   000    -    0
198 Offline_Uncorrectable   ----C-   100   100   000    -    0
199 UDMA_CRC_Error_Count    -OSRCK   200   200   000    -    0
254 Free_Fall_Sensor        -O--CK   100   100   000    -    0
                            ||||||_ K auto-keep
                            |||||__ C event count
                            ||||___ R error rate
                            |||____ S speed/performance
                            ||_____ O updated online
                            |______ P prefailure warning

General Purpose Log Directory Version 1
SMART           Log Directory Version 1 [multi-sector log support]
Address    Access  R/W   Size  Description
0x00       GPL,SL  R/O      1  Log Directory
0x01       GPL,SL  R/O      1  Summary SMART error log
0x02       GPL,SL  R/O      5  Comprehensive SMART error log
0x03       GPL,SL  R/O      5  Ext. Comprehensive SMART error log
0x06       GPL,SL  R/O      1  SMART self-test log
0x07       GPL,SL  R/O      1  Extended self-test log
0x09       GPL,SL  R/W      1  Selective self-test log
0x10       GPL,SL  R/O      1  SATA NCQ Queued Error log
0x11       GPL,SL  R/O      1  SATA Phy Event Counters log
0x21       GPL,SL  R/O      1  Write stream error log
0x22       GPL,SL  R/O      1  Read stream error log
0x80-0x9f  GPL,SL  R/W     16  Host vendor specific log
0xa1       GPL,SL  VS      20  Device vendor specific log
0xa2       GPL     VS    2248  Device vendor specific log
0xa8       GPL,SL  VS      20  Device vendor specific log
0xa9       GPL,SL  VS       1  Device vendor specific log
0xb0       GPL     VS    2819  Device vendor specific log
0xbe-0xbf  GPL     VS   65535  Device vendor specific log
0xe0       GPL,SL  R/W      1  SCT Command/Status
0xe1       GPL,SL  R/W      1  SCT Data Transfer

SMART Extended Comprehensive Error Log Version: 1 (5 sectors)
Device Error Count: 5
	CR     = Command Register
	FEATR  = Features Register
	COUNT  = Count (was: Sector Count) Register
	LBA_48 = Upper bytes of LBA High/Mid/Low Registers ]  ATA-8
	LH     = LBA High (was: Cylinder High) Register    ]   LBA
	LM     = LBA Mid (was: Cylinder Low) Register      ] Register
	LL     = LBA Low (was: Sector Number) Register     ]
	DV     = Device (was: Device/Head) Register
	DC     = Device Control Register
	ER     = Error register
	ST     = Status register
Powered_Up_Time is measured from power on, and printed as
DDd+hh:mm:SS.sss where DD=days, hh=hours, mm=minutes,
SS=sec, and sss=millisec. It "wraps" after 49.710 days.

Error 5 [4] occurred at disk power-on lifetime: 10134 hours (422 days + 6 hours)
  When the command that caused the error occurred, the device was active or idle.

  After command completion occurred, registers were:
  ER -- ST COUNT  LBA_48  LH LM LL DV DC
  -- -- -- == -- == == == -- -- -- -- --
  40 -- 51 00 00 00 00 be 00 02 44 00 00  Error: UNC at LBA = 0xbe000244 = 3187671620

  Commands leading to the command that caused the error were:
  CR FEATR COUNT  LBA_48  LH LM LL DV DC  Powered_Up_Time  Command/Feature_Name
  -- == -- == -- == == == -- -- -- -- --  ---------------  --------------------
  25 00 00 00 08 00 00 be 00 02 3f e0 00     00:03:00.062  READ DMA EXT
  35 00 00 00 08 00 00 00 00 00 df e0 00     00:03:00.061  WRITE DMA EXT
  25 00 00 00 01 00 00 00 00 00 00 e0 00     00:03:00.060  READ DMA EXT
  25 00 00 00 08 00 08 a1 00 3f f7 e0 00     00:03:00.060  READ DMA EXT
  35 00 00 00 80 00 02 4d 00 19 77 e0 00     00:03:00.059  WRITE DMA EXT

Error 4 [3] occurred at disk power-on lifetime: 10134 hours (422 days + 6 hours)
  When the command that caused the error occurred, the device was active or idle.

  After command completion occurred, registers were:
  ER -- ST COUNT  LBA_48  LH LM LL DV DC
  -- -- -- == -- == == == -- -- -- -- --
  40 -- 51 00 00 00 00 be 00 02 44 00 00  Error: UNC at LBA = 0xbe000244 = 3187671620

  Commands leading to the command that caused the error were:
  CR FEATR COUNT  LBA_48  LH LM LL DV DC  Powered_Up_Time  Command/Feature_Name
  -- == -- == -- == == == -- -- -- -- --  ---------------  --------------------
  25 00 00 00 08 00 00 be 00 02 3f e0 00     00:02:57.326  READ DMA EXT
  35 00 00 00 10 00 00 41 00 00 a7 e0 00     00:02:57.323  WRITE DMA EXT
  25 00 00 00 03 00 08 a1 00 3f ff e0 00     00:02:57.322  READ DMA EXT
  25 00 00 00 20 00 08 14 00 30 a7 e0 00     00:02:57.319  READ DMA EXT
  35 00 00 00 08 00 08 f3 00 24 9f e0 00     00:02:57.319  WRITE DMA EXT

Error 3 [2] occurred at disk power-on lifetime: 10134 hours (422 days + 6 hours)
  When the command that caused the error occurred, the device was active or idle.

  After command completion occurred, registers were:
  ER -- ST COUNT  LBA_48  LH LM LL DV DC
  -- -- -- == -- == == == -- -- -- -- --
  40 -- 51 00 00 00 00 be 00 02 44 00 00  Error: UNC at LBA = 0xbe000244 = 3187671620

  Commands leading to the command that caused the error were:
  CR FEATR COUNT  LBA_48  LH LM LL DV DC  Powered_Up_Time  Command/Feature_Name
  -- == -- == -- == == == -- -- -- -- --  ---------------  --------------------
  25 00 00 00 08 00 00 be 00 02 3f e0 00     00:02:54.465  READ DMA EXT
  35 00 00 00 08 00 00 00 00 00 cf e0 00     00:02:54.463  WRITE DMA EXT
  25 00 00 00 01 00 00 00 00 00 00 e0 00     00:02:54.463  READ DMA EXT
  25 00 00 00 08 00 08 a1 00 3f f7 e0 00     00:02:54.463  READ DMA EXT
  35 00 00 00 08 00 08 b6 00 3c ef e0 00     00:02:54.462  WRITE DMA EXT

Error 2 [1] occurred at disk power-on lifetime: 10134 hours (422 days + 6 hours)
  When the command that caused the error occurred, the device was active or idle.

  After command completion occurred, registers were:
  ER -- ST COUNT  LBA_48  LH LM LL DV DC
  -- -- -- == -- == == == -- -- -- -- --
  40 -- 51 00 00 00 00 be 00 02 44 00 00  Error: UNC at LBA = 0xbe000244 = 3187671620

  Commands leading to the command that caused the error were:
  CR FEATR COUNT  LBA_48  LH LM LL DV DC  Powered_Up_Time  Command/Feature_Name
  -- == -- == -- == == == -- -- -- -- --  ---------------  --------------------
  25 00 00 00 08 00 00 be 00 02 3f e0 00     00:02:51.703  READ DMA EXT
  35 00 00 00 08 00 00 00 00 00 d7 e0 00     00:02:51.701  WRITE DMA EXT
  25 00 00 00 01 00 00 00 00 00 00 e0 00     00:02:51.695  READ DMA EXT
  25 00 00 00 03 00 08 a1 00 3f ff e0 00     00:02:51.694  READ DMA EXT
  25 00 00 00 10 00 08 13 00 30 87 e0 00     00:02:51.694  READ DMA EXT

Error 1 [0] occurred at disk power-on lifetime: 10134 hours (422 days + 6 hours)
  When the command that caused the error occurred, the device was active or idle.

  After command completion occurred, registers were:
  ER -- ST COUNT  LBA_48  LH LM LL DV DC
  -- -- -- == -- == == == -- -- -- -- --
  40 -- 51 00 00 00 00 be 00 02 44 00 00  Error: UNC at LBA = 0xbe000244 = 3187671620

  Commands leading to the command that caused the error were:
  CR FEATR COUNT  LBA_48  LH LM LL DV DC  Powered_Up_Time  Command/Feature_Name
  -- == -- == -- == == == -- -- -- -- --  ---------------  --------------------
  25 00 00 00 2b 00 00 be 00 02 3f e0 00     00:02:48.714  READ DMA EXT
  25 00 00 00 03 00 08 a1 00 3f ff e0 00     00:02:48.714  READ DMA EXT
  25 00 00 00 40 00 08 75 00 2f 7f e0 00     00:02:48.713  READ DMA EXT
  25 00 00 00 08 00 00 e9 00 46 97 e0 00     00:02:48.701  READ DMA EXT
  25 00 00 00 08 00 00 be 00 02 37 e0 00     00:02:48.687  READ DMA EXT

SMART Extended Self-test Log Version: 1 (1 sectors)
Num  Test_Description    Status                  Remaining  LifeTime(hours)  LBA_of_first_error
# 1  Short offline       Completed without error       00%     11631         -
# 2  Short offline       Completed without error       00%         1         -
# 3  Extended offline    Interrupted (host reset)      00%         1         -

SMART Selective self-test log data structure revision number 1
 SPAN  MIN_LBA  MAX_LBA  CURRENT_TEST_STATUS
    1        0        0  Not_testing
    2        0        0  Not_testing
    3        0        0  Not_testing
    4        0        0  Not_testing
    5        0        0  Not_testing
Selective self-test flags (0x0):
  After scanning selected spans, do NOT read-scan remainder of disk.
If Selective self-test is pending on power-up, resume after 0 minute delay.

SCT Status Version:                  3
SCT Version (vendor specific):       522 (0x020a)
SCT Support Level:                   1
Device State:                        Active (0)
Current Temperature:                    37 Celsius
Power Cycle Min/Max Temperature:     25/37 Celsius
Lifetime    Min/Max Temperature:      4/62 Celsius
Under/Over Temperature Limit Count:   0/2

SCT Temperature History Version:     2
Temperature Sampling Period:         10 minutes
Temperature Logging Interval:        59 minutes
Min/Max recommended Temperature:      0/ 0 Celsius
Min/Max Temperature Limit:            0/ 0 Celsius
Temperature History Size (Index):    128 (43)

SCT Error Recovery Control:
           Read: Disabled
          Write: Disabled

Device Statistics (GP/SMART Log 0x04) not supported

SATA Phy Event Counters (GP Log 0x11)
ID      Size     Value  Description
0x000a  2            4  Device-to-host register FISes sent due to a COMRESET
0x0001  2            0  Command failed due to ICRC error
0x0003  2            0  R_ERR response for device-to-host data FIS
0x0004  2            0  R_ERR response for host-to-device data FIS
0x0006  2            0  R_ERR response for device-to-host non-data FIS
0x0007  2            0  R_ERR response for host-to-device non-data FIS

