smartctl 7.2 2020-12-30 r5155 [x86_64-linux-5.10.0-16-amd64] (local build)
Copyright (C) 2002-20, Bruce Allen, Christian Franke, www.smartmontools.org

=== START OF INFORMATION SECTION ===
Model Number:                       ADATA SX8000NP
Serial Number:                      --
Firmware Version:                   C2.3.7a
PCI Vendor/Subsystem ID:            0x126f
IEEE OUI Identifier:                0x000000
Controller ID:                      1
NVMe Version:                       1.2
Number of Namespaces:               1
Namespace 1 Size/Capacity:          128,035,676,160 [128 GB]
Namespace 1 Formatted LBA Size:     512
Local Time is:                      Fri Aug 12 12:22:16 2022 MSK
Firmware Updates (0x12):            1 Slot, no Reset required
Optional Admin Commands (0x0017):   Security Format Frmw_DL Self_Test
Optional NVM Commands (0x001d):     Comp DS_Mngmt Wr_Zero Sav/Sel_Feat
Log Page Attributes (0x03):         S/H_per_NS Cmd_Eff_Lg
Maximum Data Transfer Size:         32 Pages
Warning  Comp. Temp. Threshold:     62 Celsius
Critical Comp. Temp. Threshold:     72 Celsius
Namespace 1 Features (0x04):        Dea/Unw_Error

Supported Power States
St Op     Max   Active     Idle   RL RT WL WT  Ent_Lat  Ex_Lat
 0 +     9.00W       -        -    0  0  0  0        5       5
 1 +     4.60W       -        -    1  1  1  1       30      30
 2 +     3.80W       -        -    2  2  2  2       30      30
 3 -   0.0700W       -        -    3  3  3  3    30000   10000
 4 -   0.0050W       -        -    4  4  4  4    50000   10000

Supported LBA Sizes (NSID 0x1)
Id Fmt  Data  Metadt  Rel_Perf
 0 +     512       0         0

=== START OF SMART DATA SECTION ===
SMART overall-health self-assessment test result: PASSED

SMART/Health Information (NVMe Log 0x02)
Critical Warning:                   0x00
Temperature:                        52 Celsius
Available Spare:                    100%
Available Spare Threshold:          10%
Percentage Used:                    33%
Data Units Read:                    7,371,560 [3.77 TB]
Data Units Written:                 40,892,124 [20.9 TB]
Host Read Commands:                 92,197,844
Host Write Commands:                950,610,815
Controller Busy Time:               9,515
Power Cycles:                       390
Power On Hours:                     21,033
Unsafe Shutdowns:                   342
Media and Data Integrity Errors:    0
Error Information Log Entries:      3,016
Warning  Comp. Temperature Time:    57
Critical Comp. Temperature Time:    0

Error Information (NVMe Log 0x01, 16 of 64 entries)
Num   ErrCount  SQId   CmdId  Status  PELoc          LBA  NSID    VS
  0       3016     0  0x0000  0x4004      -            0     1     -
  1       3015     0  0x0000  0x4004      -            0     1     -
  2       3014     0  0x0000  0x4004      -            0     1     -
  3       3013     0  0x0000  0x4004      -            0     1     -
  4       3012     0  0x0000  0x4004      -            0     1     -
  5       3011     0  0x0000  0x4004      -            0     1     -
  6       3010     0  0x0000  0x4004      -            0     1     -
  7       3009     0  0x0000  0x4004      -            0     1     -
  8       3008     0  0x0000  0x4004      -            0     1     -
  9       3007     0  0x0000  0x4004      -            0     1     -
 10       3006     0  0x0000  0x4004      -            0     1     -
 11       3005     0  0x0000  0x4004      -            0     1     -
 12       3004     0  0x0000  0x4004      -            0     1     -
 13       3003     0  0x0000  0x4004      -            0     1     -
 14       3002     0  0x0000  0x4004      -            0     1     -
 15       3001     0  0x0000  0x4004      -            0     1     -
... (48 entries not read)



