=== START OF INFORMATION SECTION ===
Model Family:     Toshiba 3.5" DT01ACA... Desktop HDD
Device Model:     TOSHIBA DT01ACA100
Serial Number:    --
LU WWN Device Id: 5 000039 ...
Firmware Version: MS2OA750
User Capacity:    1,000,204,886,016 bytes [1.00 TB]
Sector Sizes:     512 bytes logical, 4096 bytes physical
Rotation Rate:    7200 rpm
Form Factor:      3.5 inches
Device is:        In smartctl database [for details use: -P show]
ATA Version is:   ATA8-ACS T13/1699-D revision 4
SATA Version is:  SATA 3.0, 6.0 Gb/s (current: 6.0 Gb/s)
Local Time is:    Tue Feb  4 14:09:05 2020 MSK
SMART support is: Available - device has SMART capability.
SMART support is: Enabled
AAM feature is:   Unavailable
APM feature is:   Disabled
Rd look-ahead is: Enabled
Write cache is:   Enabled
DSN feature is:   Unavailable
ATA Security is:  Disabled, frozen [SEC2]
Wt Cache Reorder: Enabled

=== START OF READ SMART DATA SECTION ===
SMART overall-health self-assessment test result: PASSED

General SMART Values:
Offline data collection status:  (0x84)	Offline data collection activity
					was suspended by an interrupting command from host.
					Auto Offline Data Collection: Enabled.
Self-test execution status:      (   0)	The previous self-test routine completed
					without error or no self-test has ever 
					been run.
Total time to complete Offline 
data collection: 		( 7264) seconds.
Offline data collection
capabilities: 			 (0x5b) SMART execute Offline immediate.
					Auto Offline data collection on/off support.
					Suspend Offline collection upon new
					command.
					Offline surface scan supported.
					Self-test supported.
					No Conveyance Self-test supported.
					Selective Self-test supported.
SMART capabilities:            (0x0003)	Saves SMART data before entering
					power-saving mode.
					Supports SMART auto save timer.
Error logging capability:        (0x01)	Error logging supported.
					General Purpose Logging supported.
Short self-test routine 
recommended polling time: 	 (   1) minutes.
Extended self-test routine
recommended polling time: 	 ( 121) minutes.
SCT capabilities: 	       (0x003d)	SCT Status supported.
					SCT Error Recovery Control supported.
					SCT Feature Control supported.
					SCT Data Table supported.

SMART Attributes Data Structure revision number: 16
Vendor Specific SMART Attributes with Thresholds:
ID# ATTRIBUTE_NAME          FLAGS    VALUE WORST THRESH FAIL RAW_VALUE
  1 Raw_Read_Error_Rate     PO-R--   100   100   016    -    0
  2 Throughput_Performance  P-S---   142   142   054    -    71
  3 Spin_Up_Time            POS---   127   127   024    -    180 (Average 180)
  4 Start_Stop_Count        -O--C-   100   100   000    -    3672
  5 Reallocated_Sector_Ct   PO--CK   100   100   005    -    0
  7 Seek_Error_Rate         PO-R--   100   100   067    -    0
  8 Seek_Time_Performance   P-S---   110   110   020    -    36
  9 Power_On_Hours          -O--C-   099   099   000    -    13301
 10 Spin_Retry_Count        PO--C-   100   100   060    -    0
 12 Power_Cycle_Count       -O--CK   100   100   000    -    764
192 Power-Off_Retract_Count -O--CK   097   097   000    -    3701
193 Load_Cycle_Count        -O--C-   097   097   000    -    3701
194 Temperature_Celsius     -O----   153   153   000    -    39 (Min/Max 14/48)
196 Reallocated_Event_Count -O--CK   100   100   000    -    0
197 Current_Pending_Sector  -O---K   100   100   000    -    0
198 Offline_Uncorrectable   ---R--   100   100   000    -    0
199 UDMA_CRC_Error_Count    -O-R--   200   200   000    -    2467442
                            ||||||_ K auto-keep
                            |||||__ C event count
                            ||||___ R error rate
                            |||____ S speed/performance
                            ||_____ O updated online
                            |______ P prefailure warning

General Purpose Log Directory Version 1
SMART           Log Directory Version 1 [multi-sector log support]
Address    Access  R/W   Size  Description
0x00       GPL,SL  R/O      1  Log Directory
0x01           SL  R/O      1  Summary SMART error log
0x03       GPL     R/O      1  Ext. Comprehensive SMART error log
0x04       GPL     R/O      7  Device Statistics log
0x06           SL  R/O      1  SMART self-test log
0x07       GPL     R/O      1  Extended self-test log
0x08       GPL     R/O      2  Power Conditions log
0x09           SL  R/W      1  Selective self-test log
0x10       GPL     R/O      1  NCQ Command Error log
0x11       GPL     R/O      1  SATA Phy Event Counters log
0x20       GPL     R/O      1  Streaming performance log [OBS-8]
0x21       GPL     R/O      1  Write stream error log
0x22       GPL     R/O      1  Read stream error log
0x80-0x9f  GPL,SL  R/W     16  Host vendor specific log
0xe0       GPL,SL  R/W      1  SCT Command/Status
0xe1       GPL,SL  R/W      1  SCT Data Transfer

SMART Extended Comprehensive Error Log Version: 1 (1 sectors)
Device Error Count: 65535 (device log contains only the most recent 4 errors)
	CR     = Command Register
	FEATR  = Features Register
	COUNT  = Count (was: Sector Count) Register
	LBA_48 = Upper bytes of LBA High/Mid/Low Registers ]  ATA-8
	LH     = LBA High (was: Cylinder High) Register    ]   LBA
	LM     = LBA Mid (was: Cylinder Low) Register      ] Register
	LL     = LBA Low (was: Sector Number) Register     ]
	DV     = Device (was: Device/Head) Register
	DC     = Device Control Register
	ER     = Error register
	ST     = Status register
Powered_Up_Time is measured from power on, and printed as
DDd+hh:mm:SS.sss where DD=days, hh=hours, mm=minutes,
SS=sec, and sss=millisec. It "wraps" after 49.710 days.

Error 65535 [3] occurred at disk power-on lifetime: 3762 hours (156 days + 18 hours)
  When the command that caused the error occurred, the device was active or idle.

  After command completion occurred, registers were:
  ER -- ST COUNT  LBA_48  LH LM LL DV DC
  -- -- -- == -- == == == -- -- -- -- --
  84 -- 51 00 01 00 00 00 64 06 47 00 00  Error: ICRC, ABRT 1 sectors at LBA = 0x00640647 = 6555207

  Commands leading to the command that caused the error were:
  CR FEATR COUNT  LBA_48  LH LM LL DV DC  Powered_Up_Time  Command/Feature_Name
  -- == -- == -- == == == -- -- -- -- --  ---------------  --------------------
  35 00 00 00 08 00 00 00 64 06 40 e0 00     07:15:16.778  WRITE DMA EXT
  35 00 00 00 08 00 00 00 5e ad f8 e0 00     07:15:16.778  WRITE DMA EXT
  35 00 00 00 08 00 00 00 90 14 df e0 00     07:15:16.777  WRITE DMA EXT
  35 00 00 00 08 00 00 00 90 14 d7 e0 00     07:15:16.777  WRITE DMA EXT
  35 00 00 00 06 00 00 00 90 14 d1 e0 00     07:15:16.777  WRITE DMA EXT

Error 65534 [2] occurred at disk power-on lifetime: 3762 hours (156 days + 18 hours)
  When the command that caused the error occurred, the device was active or idle.

  After command completion occurred, registers were:
  ER -- ST COUNT  LBA_48  LH LM LL DV DC
  -- -- -- == -- == == == -- -- -- -- --
  84 -- 51 00 01 00 00 00 5f f4 0f 00 00  Error: ICRC, ABRT 1 sectors at LBA = 0x005ff40f = 6288399

  Commands leading to the command that caused the error were:
  CR FEATR COUNT  LBA_48  LH LM LL DV DC  Powered_Up_Time  Command/Feature_Name
  -- == -- == -- == == == -- -- -- -- --  ---------------  --------------------
  35 00 00 00 08 00 00 00 5f f4 08 e0 00     07:14:45.917  WRITE DMA EXT
  35 00 00 00 08 00 00 00 62 ad e0 e0 00     07:14:43.136  WRITE DMA EXT
  35 00 00 00 08 00 00 00 62 af c8 e0 00     07:14:43.136  WRITE DMA EXT
  35 00 00 00 08 00 00 00 62 ae 48 e0 00     07:14:43.136  WRITE DMA EXT
  35 00 00 00 10 00 00 00 62 ae 00 e0 00     07:14:43.136  WRITE DMA EXT

Error 65533 [1] occurred at disk power-on lifetime: 3762 hours (156 days + 18 hours)
  When the command that caused the error occurred, the device was active or idle.

  After command completion occurred, registers were:
  ER -- ST COUNT  LBA_48  LH LM LL DV DC
  -- -- -- == -- == == == -- -- -- -- --
  84 -- 51 00 01 00 00 00 5a 4b 7f 00 00  Error: ICRC, ABRT 1 sectors at LBA = 0x005a4b7f = 5917567

  Commands leading to the command that caused the error were:
  CR FEATR COUNT  LBA_48  LH LM LL DV DC  Powered_Up_Time  Command/Feature_Name
  -- == -- == -- == == == -- -- -- -- --  ---------------  --------------------
  35 00 00 00 28 00 00 00 5a 4b 58 e0 00     07:14:39.143  WRITE DMA EXT
  35 00 00 00 01 00 00 00 17 c3 60 e0 00     07:14:38.910  WRITE DMA EXT
  ea 00 00 00 00 5e ad ff 00 00 00 a0 00     07:14:32.369  FLUSH CACHE EXT
  35 00 00 00 08 00 00 00 5e ad f8 e0 00     07:14:32.368  WRITE DMA EXT
  35 00 00 00 70 00 00 00 f7 e2 68 e0 00     07:14:32.368  WRITE DMA EXT

Error 65532 [0] occurred at disk power-on lifetime: 3762 hours (156 days + 18 hours)
  When the command that caused the error occurred, the device was active or idle.

  After command completion occurred, registers were:
  ER -- ST COUNT  LBA_48  LH LM LL DV DC
  -- -- -- == -- == == == -- -- -- -- --
  84 -- 51 00 10 00 00 1e 86 77 10 0e 00  Error: ICRC, ABRT 16 sectors at LBA = 0x1e867710 = 512128784

  Commands leading to the command that caused the error were:
  CR FEATR COUNT  LBA_48  LH LM LL DV DC  Powered_Up_Time  Command/Feature_Name
  -- == -- == -- == == == -- -- -- -- --  ---------------  --------------------
  35 00 00 00 20 00 00 1e 86 77 00 e0 00     07:14:31.358  WRITE DMA EXT
  35 00 00 00 08 00 00 00 63 de 38 e0 00     07:14:31.358  WRITE DMA EXT
  35 00 00 00 20 00 00 1e 86 77 00 e0 00     07:14:31.358  WRITE DMA EXT
  35 00 00 00 20 00 00 1e 88 76 c0 e0 00     07:14:31.257  WRITE DMA EXT
  25 00 00 00 20 00 00 00 5b fe 00 e0 00     07:14:31.187  READ DMA EXT

SMART Extended Self-test Log Version: 1 (1 sectors)
No self-tests have been logged.  [To run self-tests, use: smartctl -t]

SMART Selective self-test log data structure revision number 1
 SPAN  MIN_LBA  MAX_LBA  CURRENT_TEST_STATUS
    1        0        0  Not_testing
    2        0        0  Not_testing
    3        0        0  Not_testing
    4        0        0  Not_testing
    5        0        0  Not_testing
Selective self-test flags (0x0):
  After scanning selected spans, do NOT read-scan remainder of disk.
If Selective self-test is pending on power-up, resume after 0 minute delay.

SCT Status Version:                  3
SCT Version (vendor specific):       256 (0x0100)
SCT Support Level:                   1
Device State:                        SMART Off-line Data Collection executing in background (4)
Current Temperature:                    39 Celsius
Power Cycle Min/Max Temperature:     22/40 Celsius
Lifetime    Min/Max Temperature:     14/48 Celsius
Under/Over Temperature Limit Count:   0/0

SCT Temperature History Version:     2
Temperature Sampling Period:         1 minute
Temperature Logging Interval:        1 minute
Min/Max recommended Temperature:      0/60 Celsius
Min/Max Temperature Limit:           -40/70 Celsius
Temperature History Size (Index):    128 (32)

SCT Error Recovery Control:
           Read: Disabled
          Write: Disabled

Device Statistics (GP Log 0x04)
Page  Offset Size        Value Flags Description
0x01  =====  =               =  ===  == General Statistics (rev 1) ==
0x01  0x008  4             764  ---  Lifetime Power-On Resets
0x01  0x010  4           13301  ---  Power-on Hours
0x01  0x018  6     15971911179  ---  Logical Sectors Written
0x01  0x020  6       252375998  ---  Number of Write Commands
0x01  0x028  6    556666395913  ---  Logical Sectors Read
0x01  0x030  6       322344401  ---  Number of Read Commands
0x03  =====  =               =  ===  == Rotating Media Statistics (rev 1) ==
0x03  0x008  4           12328  ---  Spindle Motor Power-on Hours
0x03  0x010  4           12328  ---  Head Flying Hours
0x03  0x018  4            3701  ---  Head Load Events
0x03  0x020  4               0  ---  Number of Reallocated Logical Sectors
0x03  0x028  4              24  ---  Read Recovery Attempts
0x03  0x030  4               7  ---  Number of Mechanical Start Failures
0x04  =====  =               =  ===  == General Errors Statistics (rev 1) ==
0x04  0x008  4              50  ---  Number of Reported Uncorrectable Errors
0x04  0x010  4             116  ---  Resets Between Cmd Acceptance and Completion
0x05  =====  =               =  ===  == Temperature Statistics (rev 1) ==
0x05  0x008  1              39  ---  Current Temperature
0x05  0x010  1              37  N--  Average Short Term Temperature
0x05  0x018  1              34  N--  Average Long Term Temperature
0x05  0x020  1              48  ---  Highest Temperature
0x05  0x028  1              14  ---  Lowest Temperature
0x05  0x030  1              47  N--  Highest Average Short Term Temperature
0x05  0x038  1              25  N--  Lowest Average Short Term Temperature
0x05  0x040  1              43  N--  Highest Average Long Term Temperature
0x05  0x048  1              25  N--  Lowest Average Long Term Temperature
0x05  0x050  4               0  ---  Time in Over-Temperature
0x05  0x058  1              60  ---  Specified Maximum Operating Temperature
0x05  0x060  4               0  ---  Time in Under-Temperature
0x05  0x068  1               0  ---  Specified Minimum Operating Temperature
0x06  =====  =               =  ===  == Transport Statistics (rev 1) ==
0x06  0x008  4            2251  ---  Number of Hardware Resets
0x06  0x010  4            1466  ---  Number of ASR Events
0x06  0x018  4         2467442  ---  Number of Interface CRC Errors
                                |||_ C monitored condition met
                                ||__ D supports DSN
                                |___ N normalized value

Pending Defects log (GP Log 0x0c) not supported

SATA Phy Event Counters (GP Log 0x11)
ID      Size     Value  Description
0x0001  2            0  Command failed due to ICRC error
0x0002  2            0  R_ERR response for data FIS
0x0003  2            0  R_ERR response for device-to-host data FIS
0x0004  2            0  R_ERR response for host-to-device data FIS
0x0005  2            0  R_ERR response for non-data FIS
0x0006  2            0  R_ERR response for device-to-host non-data FIS
0x0007  2            0  R_ERR response for host-to-device non-data FIS
0x0009  2           38  Transition from drive PhyRdy to drive PhyNRdy
0x000a  2           38  Device-to-host register FISes sent due to a COMRESET
0x000b  2            0  CRC errors within host-to-device FIS
0x000d  2            0  Non-CRC errors within host-to-device FIS



