smartctl 7.2 2020-12-30 r5155 [x86_64-linux-6.5.0-3-amd64] (local build)
Copyright (C) 2002-20, Bruce Allen, Christian Franke, www.smartmontools.org

=== START OF INFORMATION SECTION ===
Model Family:     Western Digital Scorpio Blue Serial ATA (AF)
Device Model:     WDC WD10JPVT-75A1YT0
Serial Number:    --
LU WWN Device Id: 5 0014ee ...
Firmware Version: 01.01A01
User Capacity:    1,000,204,886,016 bytes [1.00 TB]
Sector Sizes:     512 bytes logical, 4096 bytes physical
Rotation Rate:    5400 rpm
Device is:        In smartctl database [for details use: -P show]
ATA Version is:   ATA8-ACS (minor revision not indicated)
SATA Version is:  SATA 3.0, 3.0 Gb/s (current: 3.0 Gb/s)
Local Time is:    Sat Nov  9 12:16:00 2024 PST
SMART support is: Available - device has SMART capability.
SMART support is: Enabled
AAM feature is:   Unavailable
APM level is:     254 (maximum performance)
Rd look-ahead is: Enabled
Write cache is:   Enabled
DSN feature is:   Unavailable
ATA Security is:  Disabled, frozen [SEC2]
Wt Cache Reorder: Enabled

=== START OF READ SMART DATA SECTION ===
SMART overall-health self-assessment test result: PASSED

General SMART Values:
Offline data collection status:  (0x00)	Offline data collection activity
					was never started.
					Auto Offline Data Collection: Disabled.
Self-test execution status:      (   0)	The previous self-test routine completed
					without error or no self-test has ever 
					been run.
Total time to complete Offline 
data collection: 		(18000) seconds.
Offline data collection
capabilities: 			 (0x7b) SMART execute Offline immediate.
					Auto Offline data collection on/off support.
					Suspend Offline collection upon new
					command.
					Offline surface scan supported.
					Self-test supported.
					Conveyance Self-test supported.
					Selective Self-test supported.
SMART capabilities:            (0x0003)	Saves SMART data before entering
					power-saving mode.
					Supports SMART auto save timer.
Error logging capability:        (0x01)	Error logging supported.
					General Purpose Logging supported.
Short self-test routine 
recommended polling time: 	 (   2) minutes.
Extended self-test routine
recommended polling time: 	 ( 196) minutes.
Conveyance self-test routine
recommended polling time: 	 (   5) minutes.
SCT capabilities: 	       (0x70b5)	SCT Status supported.
					SCT Feature Control supported.
					SCT Data Table supported.

SMART Attributes Data Structure revision number: 16
Vendor Specific SMART Attributes with Thresholds:
ID# ATTRIBUTE_NAME          FLAGS    VALUE WORST THRESH FAIL RAW_VALUE
  1 Raw_Read_Error_Rate     POSR-K   200   200   051    -    1255
  3 Spin_Up_Time            POS--K   176   175   021    -    2175
  4 Start_Stop_Count        -O--CK   099   099   000    -    1697
  5 Reallocated_Sector_Ct   PO--CK   200   200   140    -    0
  7 Seek_Error_Rate         -OSR-K   200   200   000    -    0
  9 Power_On_Hours          -O--CK   077   077   000    -    16957
 10 Spin_Retry_Count        -O--CK   100   100   000    -    0
 11 Calibration_Retry_Count -O--CK   100   100   000    -    0
 12 Power_Cycle_Count       -O--CK   099   099   000    -    1697
191 G-Sense_Error_Rate      -O--CK   065   065   000    -    35
192 Power-Off_Retract_Count -O--CK   200   200   000    -    126
193 Load_Cycle_Count        -O--CK   198   198   000    -    8102
194 Temperature_Celsius     -O---K   106   092   000    -    41
196 Reallocated_Event_Count -O--CK   200   200   000    -    0
197 Current_Pending_Sector  -O--CK   200   200   000    -    0
198 Offline_Uncorrectable   ----CK   100   253   000    -    0
199 UDMA_CRC_Error_Count    -O--CK   200   200   000    -    0
200 Multi_Zone_Error_Rate   ---R--   100   253   000    -    0
240 Head_Flying_Hours       -O--CK   077   077   000    -    16812
241 Total_LBAs_Written      -O--CK   200   200   000    -    19695837229
242 Total_LBAs_Read         -O--CK   200   200   000    -    35854891646
254 Free_Fall_Sensor        -O--CK   200   200   000    -    0
                            ||||||_ K auto-keep
                            |||||__ C event count
                            ||||___ R error rate
                            |||____ S speed/performance
                            ||_____ O updated online
                            |______ P prefailure warning

General Purpose Log Directory Version 1
SMART           Log Directory Version 1 [multi-sector log support]
Address    Access  R/W   Size  Description
0x00       GPL,SL  R/O      1  Log Directory
0x01           SL  R/O      1  Summary SMART error log
0x02           SL  R/O      5  Comprehensive SMART error log
0x03       GPL     R/O      6  Ext. Comprehensive SMART error log
0x06           SL  R/O      1  SMART self-test log
0x07       GPL     R/O      1  Extended self-test log
0x09           SL  R/W      1  Selective self-test log
0x10       GPL     R/O      1  NCQ Command Error log
0x11       GPL     R/O      1  SATA Phy Event Counters log
0x80-0x9f  GPL,SL  R/W     16  Host vendor specific log
0xa0-0xa7  GPL,SL  VS      16  Device vendor specific log
0xa8-0xb7  GPL,SL  VS       1  Device vendor specific log
0xbd       GPL,SL  VS       1  Device vendor specific log
0xc0       GPL,SL  VS       1  Device vendor specific log
0xc1       GPL     VS      93  Device vendor specific log
0xe0       GPL,SL  R/W      1  SCT Command/Status
0xe1       GPL,SL  R/W      1  SCT Data Transfer

SMART Extended Comprehensive Error Log Version: 1 (6 sectors)
Device Error Count: 1240 (device log contains only the most recent 24 errors)
	CR     = Command Register
	FEATR  = Features Register
	COUNT  = Count (was: Sector Count) Register
	LBA_48 = Upper bytes of LBA High/Mid/Low Registers ]  ATA-8
	LH     = LBA High (was: Cylinder High) Register    ]   LBA
	LM     = LBA Mid (was: Cylinder Low) Register      ] Register
	LL     = LBA Low (was: Sector Number) Register     ]
	DV     = Device (was: Device/Head) Register
	DC     = Device Control Register
	ER     = Error register
	ST     = Status register
Powered_Up_Time is measured from power on, and printed as
DDd+hh:mm:SS.sss where DD=days, hh=hours, mm=minutes,
SS=sec, and sss=millisec. It "wraps" after 49.710 days.

Error 1240 [15] occurred at disk power-on lifetime: 16175 hours (673 days + 23 hours)
  When the command that caused the error occurred, the device was active or idle.

  After command completion occurred, registers were:
  ER -- ST COUNT  LBA_48  LH LM LL DV DC
  -- -- -- == -- == == == -- -- -- -- --
  40 -- 51 00 00 00 00 52 01 10 c0 40 00  Error: UNC at LBA = 0x520110c0 = 1375801536

  Commands leading to the command that caused the error were:
  CR FEATR COUNT  LBA_48  LH LM LL DV DC  Powered_Up_Time  Command/Feature_Name
  -- == -- == -- == == == -- -- -- -- --  ---------------  --------------------
  60 00 08 00 58 00 00 52 01 10 c0 40 08     01:14:46.580  READ FPDMA QUEUED
  ef 00 10 00 03 00 00 00 00 00 00 a0 08     01:14:46.573  SET FEATURES [Enable SATA feature]
  ef 00 10 00 02 00 00 00 00 00 00 a0 08     01:14:46.572  SET FEATURES [Enable SATA feature]
  27 00 00 00 00 00 00 00 00 00 00 e0 08     01:14:46.572  READ NATIVE MAX ADDRESS EXT [OBS-ACS-3]
  ec 00 00 00 00 00 00 00 00 00 00 a0 08     01:14:46.571  IDENTIFY DEVICE

Error 1239 [14] occurred at disk power-on lifetime: 16175 hours (673 days + 23 hours)
  When the command that caused the error occurred, the device was active or idle.

  After command completion occurred, registers were:
  ER -- ST COUNT  LBA_48  LH LM LL DV DC
  -- -- -- == -- == == == -- -- -- -- --
  40 -- 51 00 00 00 00 52 01 10 c0 40 00  Error: UNC at LBA = 0x520110c0 = 1375801536

  Commands leading to the command that caused the error were:
  CR FEATR COUNT  LBA_48  LH LM LL DV DC  Powered_Up_Time  Command/Feature_Name
  -- == -- == -- == == == -- -- -- -- --  ---------------  --------------------
  60 00 08 00 88 00 00 52 01 10 c0 40 08     01:14:43.802  READ FPDMA QUEUED
  ef 00 10 00 03 00 00 00 00 00 00 a0 08     01:14:43.783  SET FEATURES [Enable SATA feature]
  ef 00 10 00 02 00 00 00 00 00 00 a0 08     01:14:43.782  SET FEATURES [Enable SATA feature]
  27 00 00 00 00 00 00 00 00 00 00 e0 08     01:14:43.782  READ NATIVE MAX ADDRESS EXT [OBS-ACS-3]
  ec 00 00 00 00 00 00 00 00 00 00 a0 08     01:14:43.780  IDENTIFY DEVICE

Error 1238 [13] occurred at disk power-on lifetime: 16175 hours (673 days + 23 hours)
  When the command that caused the error occurred, the device was active or idle.

  After command completion occurred, registers were:
  ER -- ST COUNT  LBA_48  LH LM LL DV DC
  -- -- -- == -- == == == -- -- -- -- --
  40 -- 51 00 00 00 00 52 01 10 b8 40 00  Error: UNC at LBA = 0x520110b8 = 1375801528

  Commands leading to the command that caused the error were:
  CR FEATR COUNT  LBA_48  LH LM LL DV DC  Powered_Up_Time  Command/Feature_Name
  -- == -- == -- == == == -- -- -- -- --  ---------------  --------------------
  60 00 08 00 60 00 00 52 01 10 b8 40 08     01:14:40.979  READ FPDMA QUEUED
  ef 00 10 00 03 00 00 00 00 00 00 a0 08     01:14:40.973  SET FEATURES [Enable SATA feature]
  ef 00 10 00 02 00 00 00 00 00 00 a0 08     01:14:40.972  SET FEATURES [Enable SATA feature]
  27 00 00 00 00 00 00 00 00 00 00 e0 08     01:14:40.972  READ NATIVE MAX ADDRESS EXT [OBS-ACS-3]
  ec 00 00 00 00 00 00 00 00 00 00 a0 08     01:14:40.971  IDENTIFY DEVICE

Error 1237 [12] occurred at disk power-on lifetime: 16175 hours (673 days + 23 hours)
  When the command that caused the error occurred, the device was active or idle.

  After command completion occurred, registers were:
  ER -- ST COUNT  LBA_48  LH LM LL DV DC
  -- -- -- == -- == == == -- -- -- -- --
  40 -- 51 00 00 00 00 52 01 10 b8 40 00  Error: UNC at LBA = 0x520110b8 = 1375801528

  Commands leading to the command that caused the error were:
  CR FEATR COUNT  LBA_48  LH LM LL DV DC  Powered_Up_Time  Command/Feature_Name
  -- == -- == -- == == == -- -- -- -- --  ---------------  --------------------
  60 00 08 00 78 00 00 52 01 10 b8 40 08     01:14:38.172  READ FPDMA QUEUED
  60 00 08 00 70 00 00 52 01 10 b0 40 08     01:14:38.156  READ FPDMA QUEUED
  60 00 18 00 38 00 00 53 81 0f 70 40 08     01:14:38.072  READ FPDMA QUEUED
  60 00 68 00 30 00 00 53 81 0f 00 40 08     01:14:38.072  READ FPDMA QUEUED
  60 00 18 00 28 00 00 53 81 0e 08 40 08     01:14:38.072  READ FPDMA QUEUED

Error 1236 [11] occurred at disk power-on lifetime: 16175 hours (673 days + 23 hours)
  When the command that caused the error occurred, the device was active or idle.

  After command completion occurred, registers were:
  ER -- ST COUNT  LBA_48  LH LM LL DV DC
  -- -- -- == -- == == == -- -- -- -- --
  40 -- 51 00 00 00 00 52 01 10 b8 40 00  Error: UNC at LBA = 0x520110b8 = 1375801528

  Commands leading to the command that caused the error were:
  CR FEATR COUNT  LBA_48  LH LM LL DV DC  Powered_Up_Time  Command/Feature_Name
  -- == -- == -- == == == -- -- -- -- --  ---------------  --------------------
  60 00 20 00 00 00 00 53 81 09 40 40 08     01:14:35.216  READ FPDMA QUEUED
  60 00 10 00 f0 00 00 52 01 21 30 40 08     01:14:35.211  READ FPDMA QUEUED
  60 00 28 00 e8 00 00 52 01 21 00 40 08     01:14:35.211  READ FPDMA QUEUED
  60 00 08 00 e0 00 00 52 01 20 78 40 08     01:14:35.211  READ FPDMA QUEUED
  60 00 10 00 d8 00 00 52 01 20 58 40 08     01:14:35.210  READ FPDMA QUEUED

Error 1235 [10] occurred at disk power-on lifetime: 16175 hours (673 days + 23 hours)
  When the command that caused the error occurred, the device was active or idle.

  After command completion occurred, registers were:
  ER -- ST COUNT  LBA_48  LH LM LL DV DC
  -- -- -- == -- == == == -- -- -- -- --
  40 -- 51 00 00 00 00 52 01 16 f0 40 00  Error: UNC at LBA = 0x520116f0 = 1375803120

  Commands leading to the command that caused the error were:
  CR FEATR COUNT  LBA_48  LH LM LL DV DC  Powered_Up_Time  Command/Feature_Name
  -- == -- == -- == == == -- -- -- -- --  ---------------  --------------------
  60 00 08 00 c0 00 00 52 01 16 f0 40 08     01:14:00.966  READ FPDMA QUEUED
  ef 00 10 00 03 00 00 00 00 00 00 a0 08     01:14:00.960  SET FEATURES [Enable SATA feature]
  ef 00 10 00 02 00 00 00 00 00 00 a0 08     01:14:00.959  SET FEATURES [Enable SATA feature]
  27 00 00 00 00 00 00 00 00 00 00 e0 08     01:14:00.959  READ NATIVE MAX ADDRESS EXT [OBS-ACS-3]
  ec 00 00 00 00 00 00 00 00 00 00 a0 08     01:14:00.958  IDENTIFY DEVICE

Error 1234 [9] occurred at disk power-on lifetime: 16175 hours (673 days + 23 hours)
  When the command that caused the error occurred, the device was active or idle.

  After command completion occurred, registers were:
  ER -- ST COUNT  LBA_48  LH LM LL DV DC
  -- -- -- == -- == == == -- -- -- -- --
  40 -- 51 00 00 00 00 52 01 16 f0 40 00  Error: UNC at LBA = 0x520116f0 = 1375803120

  Commands leading to the command that caused the error were:
  CR FEATR COUNT  LBA_48  LH LM LL DV DC  Powered_Up_Time  Command/Feature_Name
  -- == -- == -- == == == -- -- -- -- --  ---------------  --------------------
  60 00 08 00 50 00 00 52 01 16 f0 40 08     01:13:58.161  READ FPDMA QUEUED
  ef 00 10 00 03 00 00 00 00 00 00 a0 08     01:13:58.131  SET FEATURES [Enable SATA feature]
  ef 00 10 00 02 00 00 00 00 00 00 a0 08     01:13:58.130  SET FEATURES [Enable SATA feature]
  27 00 00 00 00 00 00 00 00 00 00 e0 08     01:13:58.130  READ NATIVE MAX ADDRESS EXT [OBS-ACS-3]
  ec 00 00 00 00 00 00 00 00 00 00 a0 08     01:13:58.129  IDENTIFY DEVICE

Error 1233 [8] occurred at disk power-on lifetime: 16175 hours (673 days + 23 hours)
  When the command that caused the error occurred, the device was active or idle.

  After command completion occurred, registers were:
  ER -- ST COUNT  LBA_48  LH LM LL DV DC
  -- -- -- == -- == == == -- -- -- -- --
  40 -- 51 00 00 00 00 52 01 16 e8 40 00  Error: UNC at LBA = 0x520116e8 = 1375803112

  Commands leading to the command that caused the error were:
  CR FEATR COUNT  LBA_48  LH LM LL DV DC  Powered_Up_Time  Command/Feature_Name
  -- == -- == -- == == == -- -- -- -- --  ---------------  --------------------
  60 00 08 00 c8 00 00 52 01 16 e8 40 08     01:13:55.384  READ FPDMA QUEUED
  ef 00 10 00 03 00 00 00 00 00 00 a0 08     01:13:55.378  SET FEATURES [Enable SATA feature]
  ef 00 10 00 02 00 00 00 00 00 00 a0 08     01:13:55.377  SET FEATURES [Enable SATA feature]
  27 00 00 00 00 00 00 00 00 00 00 e0 08     01:13:55.377  READ NATIVE MAX ADDRESS EXT [OBS-ACS-3]
  ec 00 00 00 00 00 00 00 00 00 00 a0 08     01:13:55.376  IDENTIFY DEVICE

SMART Extended Self-test Log Version: 1 (1 sectors)
Num  Test_Description    Status                  Remaining  LifeTime(hours)  LBA_of_first_error
# 1  Short offline       Completed without error       00%     13740         -
# 2  Short offline       Completed: read failure       90%      8544         943987096
# 3  Short offline       Completed: read failure       90%      8544         943987096
# 4  Short offline       Completed: read failure       90%      8544         943987096
# 5  Short offline       Completed without error       00%      7684         -
# 6  Short offline       Interrupted (host reset)      80%      1347         -
# 7  Short offline       Completed without error       00%       464         -
# 8  Selective offline   Completed without error       00%       464         -
# 9  Conveyance offline  Completed without error       00%       464         -
#10  Conveyance offline  Completed without error       00%       463         -
#11  Short offline       Completed without error       00%       463         -
#12  Short offline       Completed without error       00%         3         -

SMART Selective self-test log data structure revision number 1
 SPAN  MIN_LBA  MAX_LBA  CURRENT_TEST_STATUS
    1        0        0  Not_testing
    2        0        0  Not_testing
    3        0        0  Not_testing
    4        0        0  Not_testing
    5        0        0  Not_testing
Selective self-test flags (0x0):
  After scanning selected spans, do NOT read-scan remainder of disk.
If Selective self-test is pending on power-up, resume after 0 minute delay.

SCT Status Version:                  3
SCT Version (vendor specific):       258 (0x0102)
Device State:                        Active (0)
Current Temperature:                    41 Celsius
Power Cycle Min/Max Temperature:     24/48 Celsius
Lifetime    Min/Max Temperature:     23/55 Celsius
Specified Max Operating Temperature:    32 Celsius
Under/Over Temperature Limit Count:   0/0
Vendor specific:
01 00 00 00 00 00 00 00 00 00 00 00 00 00 00 00
00 00 00 00 00 00 00 00 00 00 00 00 00 00 00 00

SCT Temperature History Version:     2
Temperature Sampling Period:         1 minute
Temperature Logging Interval:        1 minute
Min/Max recommended Temperature:      0/60 Celsius
Min/Max Temperature Limit:           -41/85 Celsius
Temperature History Size (Index):    128 (70)

SCT Error Recovery Control command not supported

Device Statistics (GP/SMART Log 0x04) not supported

Pending Defects log (GP Log 0x0c) not supported

SATA Phy Event Counters (GP Log 0x11)
ID      Size     Value  Description
0x0001  2            0  Command failed due to ICRC error
0x0002  2            0  R_ERR response for data FIS
0x0003  2            0  R_ERR response for device-to-host data FIS
0x0004  2            0  R_ERR response for host-to-device data FIS
0x0005  2            0  R_ERR response for non-data FIS
0x0006  2            0  R_ERR response for device-to-host non-data FIS
0x0007  2            0  R_ERR response for host-to-device non-data FIS
0x0008  2            0  Device-to-host non-data FIS retries
0x0009  2        28600  Transition from drive PhyRdy to drive PhyNRdy
0x000a  2            3  Device-to-host register FISes sent due to a COMRESET
0x000b  2            0  CRC errors within host-to-device FIS
0x000f  2            0  R_ERR response for host-to-device data FIS, CRC
0x0012  2            0  R_ERR response for host-to-device non-data FIS, CRC
0x8000  4        95426  Vendor specific

