smartctl 7.5 2025-04-30 r5714 [x86_64-linux-6.16.8-zen2-1-zen] (local build)
Copyright (C) 2002-25, Bruce Allen, Christian Franke, www.smartmontools.org

=== START OF INFORMATION SECTION ===
Model Number:                       Samsung 980 PRO with Heatsink 2TB
Serial Number:                      --
Firmware Version:                   5B2QGXA7
PCI Vendor/Subsystem ID:            0x144d
IEEE OUI Identifier:                0x002538
Total NVM Capacity:                 2,000,398,934,016 [2.00 TB]
Unallocated NVM Capacity:           0
Controller ID:                      6
NVMe Version:                       1.3
Number of Namespaces:               1
Namespace 1 Size/Capacity:          2,000,398,934,016 [2.00 TB]
Namespace 1 Utilization:            1,526,328,434,688 [1.52 TB]
Namespace 1 Formatted LBA Size:     512
Namespace 1 IEEE EUI-64:            002538 ...
Local Time is:                      Tue Sep 23 11:19:29 2025 PDT
Firmware Updates (0x16):            3 Slots, no Reset required
Optional Admin Commands (0x0017):   Security Format Frmw_DL Self_Test
Optional NVM Commands (0x0057):     Comp Wr_Unc DS_Mngmt Sav/Sel_Feat Timestmp
Log Page Attributes (0x0f):         S/H_per_NS Cmd_Eff_Lg Ext_Get_Lg Telmtry_Lg
Maximum Data Transfer Size:         128 Pages
Warning  Comp. Temp. Threshold:     82 Celsius
Critical Comp. Temp. Threshold:     85 Celsius

Supported Power States
St Op     Max   Active     Idle   RL RT WL WT  Ent_Lat  Ex_Lat
 0 +     8.49W       -        -    0  0  0  0        0       0
 1 +     4.48W       -        -    1  1  1  1        0     200
 2 +     3.18W       -        -    2  2  2  2        0    1000
 3 -   0.0400W       -        -    3  3  3  3     2000    1200
 4 -   0.0050W       -        -    4  4  4  4      500    9500

Supported LBA Sizes (NSID 0x1)
Id Fmt  Data  Metadt  Rel_Perf
 0 +     512       0         0

=== START OF SMART DATA SECTION ===
SMART overall-health self-assessment test result: PASSED

SMART/Health Information (NVMe Log 0x02, NSID 0x1)
Critical Warning:                   0x00
Temperature:                        51 Celsius
Available Spare:                    100%
Available Spare Threshold:          10%
Percentage Used:                    5%
Data Units Read:                    418,280,595 [214 TB]
Data Units Written:                 238,459,326 [122 TB]
Host Read Commands:                 3,592,864,230
Host Write Commands:                3,537,019,234
Controller Busy Time:               95,203
Power Cycles:                       998
Power On Hours:                     13,023
Unsafe Shutdowns:                   691
Media and Data Integrity Errors:    0
Error Information Log Entries:      0
Warning  Comp. Temperature Time:    0
Critical Comp. Temperature Time:    0
Temperature Sensor 1:               51 Celsius
Temperature Sensor 2:               58 Celsius

Error Information (NVMe Log 0x01, 16 of 64 entries)
No Errors Logged

Self-test Log (NVMe Log 0x06, NSID 0xffffffff)
Self-test status: Extended self-test in progress (15% completed)
Num  Test_Description  Status                       Power_on_Hours  Failing_LBA  NSID Seg SCT Code
 0   Short             Completed without error               13022            -     -   -   -    -
 1   Short             Completed without error               13019            -     -   -   -    -
 2   Short             Completed without error               13016            -     -   -   -    -
 3   Extended          Completed without error               13012            -     -   -   -    -
 4   Short             Completed without error               13011            -     -   -   -    -
 5   Short             Aborted: Controller Reset             13009            -     -   -   -    -
 6   Short             Completed without error               12964            -     -   -   -    -
 7   Short             Completed without error               12959            -     -   -   -    -
 8   Short             Completed without error               12955            -     -   -   -    -
 9   Short             Completed without error               12944            -     -   -   -    -
10   Extended          Completed without error               12940            -     -   -   -    -
11   Short             Completed without error               12940            -     -   -   -    -
12   Short             Completed without error               12934            -     -   -   -    -
13   Short             Completed without error               12927            -     -   -   -    -
14   Short             Completed without error               12920            -     -   -   -    -
15   Short             Completed without error               12916            -     -   -   -    -
16   Short             Completed without error               12911            -     -   -   -    -
17   Short             Completed without error               12895            -     -   -   -    -
18   Extended          Completed without error               12887            -     -   -   -    -
19   Short             Completed without error               12886            -     -   -   -    -



