smartctl 7.4 2023-08-01 r5530 [x86_64-linux-6.4.11-desktop-1omv2390] (OpenMandriva Lx 7.4-1)
Copyright (C) 2002-23, Bruce Allen, Christian Franke, www.smartmontools.org

=== START OF INFORMATION SECTION ===
Model Family:     Seagate Barracuda 7200.14 (AF)
Device Model:     ST1000DM003-1CH162
Serial Number:    --
LU WWN Device Id: 5 000c50 ...
Firmware Version: CC46
User Capacity:    1,000,204,886,016 bytes [1.00 TB]
Sector Sizes:     512 bytes logical, 4096 bytes physical
Rotation Rate:    7200 rpm
Form Factor:      3.5 inches
Device is:        In smartctl database
ATA Version is:   ATA8-ACS T13/1699-D revision 4
SATA Version is:  SATA 3.0, 6.0 Gb/s (current: 6.0 Gb/s)
Local Time is:    Sat Apr  6 20:15:53 2024 MSK
SMART support is: Available - device has SMART capability.
SMART support is: Enabled
AAM feature is:   Unavailable
APM level is:     128 (minimum power consumption without standby)
Rd look-ahead is: Enabled
Write cache is:   Enabled
DSN feature is:   Unavailable
ATA Security is:  Disabled, frozen [SEC2]
Wt Cache Reorder: Unavailable

=== START OF READ SMART DATA SECTION ===
SMART overall-health self-assessment test result: PASSED
See vendor-specific Attribute list for marginal Attributes.

General SMART Values:
Offline data collection status:  (0x00)	Offline data collection activity
					was never started.
					Auto Offline Data Collection: Disabled.
Self-test execution status:      (   0)	The previous self-test routine completed
					without error or no self-test has ever 
					been run.
Total time to complete Offline 
data collection: 		(  584) seconds.
Offline data collection
capabilities: 			 (0x73) SMART execute Offline immediate.
					Auto Offline data collection on/off support.
					Suspend Offline collection upon new
					command.
					No Offline surface scan supported.
					Self-test supported.
					Conveyance Self-test supported.
					Selective Self-test supported.
SMART capabilities:            (0x0003)	Saves SMART data before entering
					power-saving mode.
					Supports SMART auto save timer.
Error logging capability:        (0x01)	Error logging supported.
					General Purpose Logging supported.
Short self-test routine 
recommended polling time: 	 (   1) minutes.
Extended self-test routine
recommended polling time: 	 ( 110) minutes.
Conveyance self-test routine
recommended polling time: 	 (   2) minutes.
SCT capabilities: 	       (0x3085)	SCT Status supported.

SMART Attributes Data Structure revision number: 10
Vendor Specific SMART Attributes with Thresholds:
ID# ATTRIBUTE_NAME          FLAGS    VALUE WORST THRESH FAIL RAW_VALUE
  1 Raw_Read_Error_Rate     POSR--   117   092   006    -    133967584
  3 Spin_Up_Time            PO----   097   097   000    -    0
  4 Start_Stop_Count        -O--CK   090   090   020    -    10839
  5 Reallocated_Sector_Ct   PO--CK   100   100   010    -    0
  7 Seek_Error_Rate         POSR--   072   060   030    -    150945824560
  9 Power_On_Hours          -O--CK   081   081   000    -    16656
 10 Spin_Retry_Count        PO--C-   100   100   097    -    0
 12 Power_Cycle_Count       -O--CK   091   091   020    -    10126
183 Runtime_Bad_Block       -O--CK   100   100   000    -    0
184 End-to-End_Error        -O--CK   001   001   099    NOW  889
187 Reported_Uncorrect      -O--CK   001   001   000    -    462
188 Command_Timeout         -O--CK   100   095   000    -    4 4 200
189 High_Fly_Writes         -O-RCK   100   100   000    -    0
190 Airflow_Temperature_Cel -O---K   073   054   045    -    27 (Min/Max 21/27)
191 G-Sense_Error_Rate      -O--CK   100   100   000    -    0
192 Power-Off_Retract_Count -O--CK   100   100   000    -    433
193 Load_Cycle_Count        -O--CK   077   077   000    -    47630
194 Temperature_Celsius     -O---K   027   046   000    -    27 (0 15 0 0 0)
197 Current_Pending_Sector  -O--C-   100   100   000    -    0
198 Offline_Uncorrectable   ----C-   100   100   000    -    0
199 UDMA_CRC_Error_Count    -OSRCK   200   198   000    -    7522
240 Head_Flying_Hours       ------   100   253   000    -    15774h+33m+48.324s
241 Total_LBAs_Written      ------   100   253   000    -    67492447605
242 Total_LBAs_Read         ------   100   253   000    -    151059730005
                            ||||||_ K auto-keep
                            |||||__ C event count
                            ||||___ R error rate
                            |||____ S speed/performance
                            ||_____ O updated online
                            |______ P prefailure warning

General Purpose Log Directory Version 1
SMART           Log Directory Version 1 [multi-sector log support]
Address    Access  R/W   Size  Description
0x00       GPL,SL  R/O      1  Log Directory
0x01           SL  R/O      1  Summary SMART error log
0x02           SL  R/O      5  Comprehensive SMART error log
0x03       GPL     R/O      5  Ext. Comprehensive SMART error log
0x06           SL  R/O      1  SMART self-test log
0x07       GPL     R/O      1  Extended self-test log
0x09           SL  R/W      1  Selective self-test log
0x10       GPL     R/O      1  NCQ Command Error log
0x11       GPL     R/O      1  SATA Phy Event Counters log
0x21       GPL     R/O      1  Write stream error log
0x22       GPL     R/O      1  Read stream error log
0x80-0x9f  GPL,SL  R/W     16  Host vendor specific log
0xa1       GPL,SL  VS      20  Device vendor specific log
0xa2       GPL     VS    4496  Device vendor specific log
0xa8       GPL,SL  VS     129  Device vendor specific log
0xa9       GPL,SL  VS       1  Device vendor specific log
0xab       GPL     VS       1  Device vendor specific log
0xb0       GPL     VS    5176  Device vendor specific log
0xbe-0xbf  GPL     VS   65535  Device vendor specific log
0xc0       GPL,SL  VS       1  Device vendor specific log
0xc1       GPL,SL  VS      10  Device vendor specific log
0xc4       GPL,SL  VS       5  Device vendor specific log
0xe0       GPL,SL  R/W      1  SCT Command/Status
0xe1       GPL,SL  R/W      1  SCT Data Transfer

SMART Extended Comprehensive Error Log Version: 1 (5 sectors)
Device Error Count: 921 (device log contains only the most recent 20 errors)
	CR     = Command Register
	FEATR  = Features Register
	COUNT  = Count (was: Sector Count) Register
	LBA_48 = Upper bytes of LBA High/Mid/Low Registers ]  ATA-8
	LH     = LBA High (was: Cylinder High) Register    ]   LBA
	LM     = LBA Mid (was: Cylinder Low) Register      ] Register
	LL     = LBA Low (was: Sector Number) Register     ]
	DV     = Device (was: Device/Head) Register
	DC     = Device Control Register
	ER     = Error register
	ST     = Status register
Powered_Up_Time is measured from power on, and printed as
DDd+hh:mm:SS.sss where DD=days, hh=hours, mm=minutes,
SS=sec, and sss=millisec. It "wraps" after 49.710 days.

Error 921 [0] occurred at disk power-on lifetime: 3184 hours (132 days + 16 hours)
  When the command that caused the error occurred, the device was active or idle.

  After command completion occurred, registers were:
  ER -- ST COUNT  LBA_48  LH LM LL DV DC
  -- -- -- == -- == == == -- -- -- -- --
  40 -- 51 00 00 00 00 00 2a 39 ee 00 00  Error: UNC at LBA = 0x002a39ee = 2767342

  Commands leading to the command that caused the error were:
  CR FEATR COUNT  LBA_48  LH LM LL DV DC  Powered_Up_Time  Command/Feature_Name
  -- == -- == -- == == == -- -- -- -- --  ---------------  --------------------
  60 00 00 00 02 00 00 00 2a 39 ee 40 00     00:26:29.963  READ FPDMA QUEUED
  2f 00 00 00 01 00 00 00 00 00 10 00 00     00:26:29.923  READ LOG EXT
  60 00 00 00 02 00 00 00 2a 39 ee 40 00     00:26:27.001  READ FPDMA QUEUED
  2f 00 00 00 01 00 00 00 00 00 10 00 00     00:26:26.948  READ LOG EXT
  60 00 00 00 02 00 00 00 2a 39 ee 40 00     00:26:24.087  READ FPDMA QUEUED

Error 920 [19] occurred at disk power-on lifetime: 3184 hours (132 days + 16 hours)
  When the command that caused the error occurred, the device was active or idle.

  After command completion occurred, registers were:
  ER -- ST COUNT  LBA_48  LH LM LL DV DC
  -- -- -- == -- == == == -- -- -- -- --
  40 -- 51 00 00 00 00 00 2a 39 ee 00 00  Error: UNC at LBA = 0x002a39ee = 2767342

  Commands leading to the command that caused the error were:
  CR FEATR COUNT  LBA_48  LH LM LL DV DC  Powered_Up_Time  Command/Feature_Name
  -- == -- == -- == == == -- -- -- -- --  ---------------  --------------------
  60 00 00 00 02 00 00 00 2a 39 ee 40 00     00:26:29.963  READ FPDMA QUEUED
  2f 00 00 00 01 00 00 00 00 00 10 00 00     00:26:29.923  READ LOG EXT
  60 00 00 00 02 00 00 00 2a 39 ee 40 00     00:26:27.001  READ FPDMA QUEUED
  2f 00 00 00 01 00 00 00 00 00 10 00 00     00:26:26.948  READ LOG EXT
  60 00 00 00 02 00 00 00 2a 39 ee 40 00     00:26:24.087  READ FPDMA QUEUED

Error 919 [18] occurred at disk power-on lifetime: 3184 hours (132 days + 16 hours)
  When the command that caused the error occurred, the device was active or idle.

  After command completion occurred, registers were:
  ER -- ST COUNT  LBA_48  LH LM LL DV DC
  -- -- -- == -- == == == -- -- -- -- --
  40 -- 51 00 00 00 00 00 2a 39 ee 00 00  Error: UNC at LBA = 0x002a39ee = 2767342

  Commands leading to the command that caused the error were:
  CR FEATR COUNT  LBA_48  LH LM LL DV DC  Powered_Up_Time  Command/Feature_Name
  -- == -- == -- == == == -- -- -- -- --  ---------------  --------------------
  60 00 00 00 02 00 00 00 2a 39 ee 40 00     00:26:27.001  READ FPDMA QUEUED
  2f 00 00 00 01 00 00 00 00 00 10 00 00     00:26:26.948  READ LOG EXT
  60 00 00 00 02 00 00 00 2a 39 ee 40 00     00:26:24.087  READ FPDMA QUEUED
  2f 00 00 00 01 00 00 00 00 00 10 00 00     00:26:24.053  READ LOG EXT
  60 00 00 00 02 00 00 00 2a 39 ee 40 00     00:26:21.175  READ FPDMA QUEUED

Error 918 [17] occurred at disk power-on lifetime: 3184 hours (132 days + 16 hours)
  When the command that caused the error occurred, the device was active or idle.

  After command completion occurred, registers were:
  ER -- ST COUNT  LBA_48  LH LM LL DV DC
  -- -- -- == -- == == == -- -- -- -- --
  40 -- 51 00 00 00 00 00 2a 39 ee 00 00  Error: UNC at LBA = 0x002a39ee = 2767342

  Commands leading to the command that caused the error were:
  CR FEATR COUNT  LBA_48  LH LM LL DV DC  Powered_Up_Time  Command/Feature_Name
  -- == -- == -- == == == -- -- -- -- --  ---------------  --------------------
  60 00 00 00 02 00 00 00 2a 39 ee 40 00     00:26:27.001  READ FPDMA QUEUED
  2f 00 00 00 01 00 00 00 00 00 10 00 00     00:26:26.948  READ LOG EXT
  60 00 00 00 02 00 00 00 2a 39 ee 40 00     00:26:24.087  READ FPDMA QUEUED
  2f 00 00 00 01 00 00 00 00 00 10 00 00     00:26:24.053  READ LOG EXT
  60 00 00 00 02 00 00 00 2a 39 ee 40 00     00:26:21.175  READ FPDMA QUEUED

Error 917 [16] occurred at disk power-on lifetime: 3184 hours (132 days + 16 hours)
  When the command that caused the error occurred, the device was active or idle.

  After command completion occurred, registers were:
  ER -- ST COUNT  LBA_48  LH LM LL DV DC
  -- -- -- == -- == == == -- -- -- -- --
  40 -- 51 00 00 00 00 00 2a 39 ee 00 00  Error: UNC at LBA = 0x002a39ee = 2767342

  Commands leading to the command that caused the error were:
  CR FEATR COUNT  LBA_48  LH LM LL DV DC  Powered_Up_Time  Command/Feature_Name
  -- == -- == -- == == == -- -- -- -- --  ---------------  --------------------
  60 00 00 00 02 00 00 00 2a 39 ee 40 00     00:26:24.087  READ FPDMA QUEUED
  2f 00 00 00 01 00 00 00 00 00 10 00 00     00:26:24.053  READ LOG EXT
  60 00 00 00 02 00 00 00 2a 39 ee 40 00     00:26:21.175  READ FPDMA QUEUED
  2f 00 00 00 01 00 00 00 00 00 10 00 00     00:26:21.127  READ LOG EXT
  60 00 00 00 02 00 00 00 2a 39 ee 40 00     00:26:18.278  READ FPDMA QUEUED

Error 916 [15] occurred at disk power-on lifetime: 3184 hours (132 days + 16 hours)
  When the command that caused the error occurred, the device was active or idle.

  After command completion occurred, registers were:
  ER -- ST COUNT  LBA_48  LH LM LL DV DC
  -- -- -- == -- == == == -- -- -- -- --
  40 -- 51 00 00 00 00 00 2a 39 ee 00 00  Error: UNC at LBA = 0x002a39ee = 2767342

  Commands leading to the command that caused the error were:
  CR FEATR COUNT  LBA_48  LH LM LL DV DC  Powered_Up_Time  Command/Feature_Name
  -- == -- == -- == == == -- -- -- -- --  ---------------  --------------------
  60 00 00 00 02 00 00 00 2a 39 ee 40 00     00:26:24.087  READ FPDMA QUEUED
  2f 00 00 00 01 00 00 00 00 00 10 00 00     00:26:24.053  READ LOG EXT
  60 00 00 00 02 00 00 00 2a 39 ee 40 00     00:26:21.175  READ FPDMA QUEUED
  2f 00 00 00 01 00 00 00 00 00 10 00 00     00:26:21.127  READ LOG EXT
  60 00 00 00 02 00 00 00 2a 39 ee 40 00     00:26:18.278  READ FPDMA QUEUED

Error 915 [14] occurred at disk power-on lifetime: 3184 hours (132 days + 16 hours)
  When the command that caused the error occurred, the device was active or idle.

  After command completion occurred, registers were:
  ER -- ST COUNT  LBA_48  LH LM LL DV DC
  -- -- -- == -- == == == -- -- -- -- --
  40 -- 51 00 00 00 00 00 2a 39 ee 00 00  Error: UNC at LBA = 0x002a39ee = 2767342

  Commands leading to the command that caused the error were:
  CR FEATR COUNT  LBA_48  LH LM LL DV DC  Powered_Up_Time  Command/Feature_Name
  -- == -- == -- == == == -- -- -- -- --  ---------------  --------------------
  60 00 00 00 02 00 00 00 2a 39 ee 40 00     00:26:21.175  READ FPDMA QUEUED
  2f 00 00 00 01 00 00 00 00 00 10 00 00     00:26:21.127  READ LOG EXT
  60 00 00 00 02 00 00 00 2a 39 ee 40 00     00:26:18.278  READ FPDMA QUEUED
  2f 00 00 00 01 00 00 00 00 00 10 00 00     00:26:18.243  READ LOG EXT
  60 00 00 00 02 00 00 00 2a 39 ee 40 00     00:26:15.382  READ FPDMA QUEUED

Error 914 [13] occurred at disk power-on lifetime: 3184 hours (132 days + 16 hours)
  When the command that caused the error occurred, the device was active or idle.

  After command completion occurred, registers were:
  ER -- ST COUNT  LBA_48  LH LM LL DV DC
  -- -- -- == -- == == == -- -- -- -- --
  40 -- 51 00 00 00 00 00 2a 39 ee 00 00  Error: UNC at LBA = 0x002a39ee = 2767342

  Commands leading to the command that caused the error were:
  CR FEATR COUNT  LBA_48  LH LM LL DV DC  Powered_Up_Time  Command/Feature_Name
  -- == -- == -- == == == -- -- -- -- --  ---------------  --------------------
  60 00 00 00 02 00 00 00 2a 39 ee 40 00     00:26:21.175  READ FPDMA QUEUED
  2f 00 00 00 01 00 00 00 00 00 10 00 00     00:26:21.127  READ LOG EXT
  60 00 00 00 02 00 00 00 2a 39 ee 40 00     00:26:18.278  READ FPDMA QUEUED
  2f 00 00 00 01 00 00 00 00 00 10 00 00     00:26:18.243  READ LOG EXT
  60 00 00 00 02 00 00 00 2a 39 ee 40 00     00:26:15.382  READ FPDMA QUEUED

SMART Extended Self-test Log Version: 1 (1 sectors)
No self-tests have been logged.  [To run self-tests, use: smartctl -t]

SMART Selective self-test log data structure revision number 1
 SPAN  MIN_LBA  MAX_LBA  CURRENT_TEST_STATUS
    1        0        0  Not_testing
    2        0        0  Not_testing
    3        0        0  Not_testing
    4        0        0  Not_testing
    5        0        0  Not_testing
Selective self-test flags (0x0):
  After scanning selected spans, do NOT read-scan remainder of disk.
If Selective self-test is pending on power-up, resume after 0 minute delay.

SCT Status Version:                  3
SCT Version (vendor specific):       522 (0x020a)
Device State:                        Active (0)
Current Temperature:                    24 Celsius
Power Cycle Min/Max Temperature:     21/24 Celsius
Lifetime    Min/Max Temperature:     15/45 Celsius
Under/Over Temperature Limit Count:   0/0

SCT Data Table command not supported

SCT Error Recovery Control command not supported

Device Statistics (GP/SMART Log 0x04) not supported

Pending Defects log (GP Log 0x0c) not supported

SATA Phy Event Counters (GP Log 0x11)
ID      Size     Value  Description
0x000a  2            3  Device-to-host register FISes sent due to a COMRESET
0x0001  2            0  Command failed due to ICRC error
0x0003  2            0  R_ERR response for device-to-host data FIS
0x0004  2            0  R_ERR response for host-to-device data FIS
0x0006  2            0  R_ERR response for device-to-host non-data FIS
0x0007  2            0  R_ERR response for host-to-device non-data FIS

