=== START OF INFORMATION SECTION ===
Model Family:     Seagate Barracuda 7200.14 (AF)
Device Model:     ST1000DM003-1CH162
Serial Number:    --
LU WWN Device Id: 5 000c50 ...
Firmware Version: CC44
User Capacity:    1 000 204 886 016 bytes [1,00 TB]
Sector Sizes:     512 bytes logical, 4096 bytes physical
Rotation Rate:    7200 rpm
Form Factor:      3.5 inches
Device is:        In smartctl database [for details use: -P show]
ATA Version is:   ATA8-ACS T13/1699-D revision 4
SATA Version is:  SATA 3.0, 6.0 Gb/s (current: 6.0 Gb/s)
Local Time is:    Mon Jul 10 00:49:43 2017 MSK
SMART support is: Available - device has SMART capability.
SMART support is: Enabled
AAM feature is:   Unavailable
APM level is:     128 (minimum power consumption without standby)
Rd look-ahead is: Enabled
Write cache is:   Enabled
ATA Security is:  Disabled, frozen [SEC2]
Wt Cache Reorder: Unavailable

=== START OF READ SMART DATA SECTION ===
SMART overall-health self-assessment test result: PASSED

General SMART Values:
Offline data collection status:  (0x00)	Offline data collection activity
					was never started.
					Auto Offline Data Collection: Disabled.
Self-test execution status:      (   0)	The previous self-test routine completed
					without error or no self-test has ever 
					been run.
Total time to complete Offline 
data collection: 		(  584) seconds.
Offline data collection
capabilities: 			 (0x73) SMART execute Offline immediate.
					Auto Offline data collection on/off support.
					Suspend Offline collection upon new
					command.
					No Offline surface scan supported.
					Self-test supported.
					Conveyance Self-test supported.
					Selective Self-test supported.
SMART capabilities:            (0x0003)	Saves SMART data before entering
					power-saving mode.
					Supports SMART auto save timer.
Error logging capability:        (0x01)	Error logging supported.
					General Purpose Logging supported.
Short self-test routine 
recommended polling time: 	 (   1) minutes.
Extended self-test routine
recommended polling time: 	 ( 108) minutes.
Conveyance self-test routine
recommended polling time: 	 (   2) minutes.
SCT capabilities: 	       (0x3085)	SCT Status supported.

SMART Attributes Data Structure revision number: 10
Vendor Specific SMART Attributes with Thresholds:
ID# ATTRIBUTE_NAME          FLAGS    VALUE WORST THRESH FAIL RAW_VALUE
  1 Raw_Read_Error_Rate     POSR--   118   095   006    -    200916616
  3 Spin_Up_Time            PO----   097   097   000    -    0
  4 Start_Stop_Count        -O--CK   098   098   020    -    2274
  5 Reallocated_Sector_Ct   PO--CK   100   100   010    -    0
  7 Seek_Error_Rate         POSR--   082   060   030    -    22357656568
  9 Power_On_Hours          -O--CK   076   076   000    -    21725
 10 Spin_Retry_Count        PO--C-   100   100   097    -    0
 12 Power_Cycle_Count       -O--CK   098   098   020    -    2095
183 Runtime_Bad_Block       -O--CK   095   095   000    -    5
184 End-to-End_Error        -O--CK   100   100   099    -    0
187 Reported_Uncorrect      -O--CK   001   001   000    -    185
188 Command_Timeout         -O--CK   100   099   000    -    18 18 27
189 High_Fly_Writes         -O-RCK   097   097   000    -    3
190 Airflow_Temperature_Cel -O---K   072   051   045    -    28 (0 2 31 20 0)
191 G-Sense_Error_Rate      -O--CK   100   100   000    -    0
192 Power-Off_Retract_Count -O--CK   100   100   000    -    125
193 Load_Cycle_Count        -O--CK   096   096   000    -    9167
194 Temperature_Celsius     -O---K   028   049   000    -    28 (128 0 0 0 0)
197 Current_Pending_Sector  -O--C-   100   100   000    -    0
198 Offline_Uncorrectable   ----C-   100   100   000    -    0
199 UDMA_CRC_Error_Count    -OSRCK   200   200   000    -    234
240 Head_Flying_Hours       ------   100   253   000    -    21644h+58m+24.323s
241 Total_LBAs_Written      ------   100   253   000    -    169149751019
242 Total_LBAs_Read         ------   100   253   000    -    227309358877
                            ||||||_ K auto-keep
                            |||||__ C event count
                            ||||___ R error rate
                            |||____ S speed/performance
                            ||_____ O updated online
                            |______ P prefailure warning

General Purpose Log Directory Version 1
SMART           Log Directory Version 1 [multi-sector log support]
Address    Access  R/W   Size  Description
0x00       GPL,SL  R/O      1  Log Directory
0x01           SL  R/O      1  Summary SMART error log
0x02           SL  R/O      5  Comprehensive SMART error log
0x03       GPL     R/O      5  Ext. Comprehensive SMART error log
0x06           SL  R/O      1  SMART self-test log
0x07       GPL     R/O      1  Extended self-test log
0x09           SL  R/W      1  Selective self-test log
0x10       GPL     R/O      1  SATA NCQ Queued Error log
0x11       GPL     R/O      1  SATA Phy Event Counters log
0x21       GPL     R/O      1  Write stream error log
0x22       GPL     R/O      1  Read stream error log
0x80-0x9f  GPL,SL  R/W     16  Host vendor specific log
0xa1       GPL,SL  VS      20  Device vendor specific log
0xa2       GPL     VS    4496  Device vendor specific log
0xa8       GPL,SL  VS     129  Device vendor specific log
0xa9       GPL,SL  VS       1  Device vendor specific log
0xab       GPL     VS       1  Device vendor specific log
0xb0       GPL     VS    5176  Device vendor specific log
0xbd       GPL     VS     512  Device vendor specific log
0xbe-0xbf  GPL     VS   65535  Device vendor specific log
0xc0       GPL,SL  VS       1  Device vendor specific log
0xc1       GPL,SL  VS      10  Device vendor specific log
0xc4       GPL,SL  VS       5  Device vendor specific log
0xe0       GPL,SL  R/W      1  SCT Command/Status
0xe1       GPL,SL  R/W      1  SCT Data Transfer

SMART Extended Comprehensive Error Log Version: 1 (5 sectors)
Device Error Count: 185 (device log contains only the most recent 20 errors)
	CR     = Command Register
	FEATR  = Features Register
	COUNT  = Count (was: Sector Count) Register
	LBA_48 = Upper bytes of LBA High/Mid/Low Registers ]  ATA-8
	LH     = LBA High (was: Cylinder High) Register    ]   LBA
	LM     = LBA Mid (was: Cylinder Low) Register      ] Register
	LL     = LBA Low (was: Sector Number) Register     ]
	DV     = Device (was: Device/Head) Register
	DC     = Device Control Register
	ER     = Error register
	ST     = Status register
Powered_Up_Time is measured from power on, and printed as
DDd+hh:mm:SS.sss where DD=days, hh=hours, mm=minutes,
SS=sec, and sss=millisec. It "wraps" after 49.710 days.

Error 185 [4] occurred at disk power-on lifetime: 11820 hours (492 days + 12 hours)
  When the command that caused the error occurred, the device was active or idle.

  After command completion occurred, registers were:
  ER -- ST COUNT  LBA_48  LH LM LL DV DC
  -- -- -- == -- == == == -- -- -- -- --
  40 -- 51 00 00 00 00 49 a1 9c c8 00 00  Error: WP at LBA = 0x49a19cc8 = 1235328200

  Commands leading to the command that caused the error were:
  CR FEATR COUNT  LBA_48  LH LM LL DV DC  Powered_Up_Time  Command/Feature_Name
  -- == -- == -- == == == -- -- -- -- --  ---------------  --------------------
  61 00 00 01 00 00 00 5a 40 0f c0 40 00     01:40:27.920  WRITE FPDMA QUEUED
  61 00 00 01 00 00 00 5a 40 0e c0 40 00     01:40:27.920  WRITE FPDMA QUEUED
  61 00 00 01 00 00 00 5a 40 0d c0 40 00     01:40:27.920  WRITE FPDMA QUEUED
  61 00 00 01 00 00 00 5a 40 0c c0 40 00     01:40:27.920  WRITE FPDMA QUEUED
  61 00 00 01 00 00 00 5a 40 0b c0 40 00     01:40:27.920  WRITE FPDMA QUEUED

Error 184 [3] occurred at disk power-on lifetime: 11820 hours (492 days + 12 hours)
  When the command that caused the error occurred, the device was active or idle.

  After command completion occurred, registers were:
  ER -- ST COUNT  LBA_48  LH LM LL DV DC
  -- -- -- == -- == == == -- -- -- -- --
  40 -- 51 00 00 00 00 49 a1 9c c8 00 00  Error: UNC at LBA = 0x49a19cc8 = 1235328200

  Commands leading to the command that caused the error were:
  CR FEATR COUNT  LBA_48  LH LM LL DV DC  Powered_Up_Time  Command/Feature_Name
  -- == -- == -- == == == -- -- -- -- --  ---------------  --------------------
  60 00 00 00 40 00 00 00 14 34 62 40 00     01:40:22.913  READ FPDMA QUEUED
  61 00 00 01 00 00 00 45 6f 74 68 40 00     01:40:22.913  WRITE FPDMA QUEUED
  61 00 00 00 08 00 00 0c f2 28 88 40 00     01:40:22.913  WRITE FPDMA QUEUED
  61 00 00 00 08 00 00 00 66 de e8 40 00     01:40:22.913  WRITE FPDMA QUEUED
  60 00 00 01 00 00 00 3c f9 35 10 40 00     01:40:22.913  READ FPDMA QUEUED

Error 183 [2] occurred at disk power-on lifetime: 11820 hours (492 days + 12 hours)
  When the command that caused the error occurred, the device was active or idle.

  After command completion occurred, registers were:
  ER -- ST COUNT  LBA_48  LH LM LL DV DC
  -- -- -- == -- == == == -- -- -- -- --
  40 -- 51 00 00 00 00 49 a1 9c c8 00 00  Error: WP at LBA = 0x49a19cc8 = 1235328200

  Commands leading to the command that caused the error were:
  CR FEATR COUNT  LBA_48  LH LM LL DV DC  Powered_Up_Time  Command/Feature_Name
  -- == -- == -- == == == -- -- -- -- --  ---------------  --------------------
  61 00 00 00 08 00 00 00 29 f2 f8 40 00     01:40:17.731  WRITE FPDMA QUEUED
  61 00 00 00 08 00 00 00 11 3a d0 40 00     01:40:17.730  WRITE FPDMA QUEUED
  61 00 00 00 08 00 00 00 0d 10 d8 40 00     01:40:17.730  WRITE FPDMA QUEUED
  61 00 00 00 68 00 00 1d f3 66 90 40 00     01:40:17.730  WRITE FPDMA QUEUED
  61 00 00 01 00 00 00 1d f3 65 90 40 00     01:40:17.730  WRITE FPDMA QUEUED

Error 182 [1] occurred at disk power-on lifetime: 11820 hours (492 days + 12 hours)
  When the command that caused the error occurred, the device was active or idle.

  After command completion occurred, registers were:
  ER -- ST COUNT  LBA_48  LH LM LL DV DC
  -- -- -- == -- == == == -- -- -- -- --
  40 -- 51 00 00 00 00 49 a1 9c c8 00 00  Error: WP at LBA = 0x49a19cc8 = 1235328200

  Commands leading to the command that caused the error were:
  CR FEATR COUNT  LBA_48  LH LM LL DV DC  Powered_Up_Time  Command/Feature_Name
  -- == -- == -- == == == -- -- -- -- --  ---------------  --------------------
  61 00 00 00 a0 00 00 62 46 4f a0 40 00     01:40:12.730  WRITE FPDMA QUEUED
  61 00 00 01 00 00 00 62 46 4e a0 40 00     01:40:12.730  WRITE FPDMA QUEUED
  61 00 00 01 00 00 00 62 46 4d a0 40 00     01:40:12.730  WRITE FPDMA QUEUED
  61 00 00 01 00 00 00 62 46 4c a0 40 00     01:40:12.730  WRITE FPDMA QUEUED
  61 00 00 01 00 00 00 62 46 4b a0 40 00     01:40:12.730  WRITE FPDMA QUEUED

Error 181 [0] occurred at disk power-on lifetime: 11820 hours (492 days + 12 hours)
  When the command that caused the error occurred, the device was active or idle.

  After command completion occurred, registers were:
  ER -- ST COUNT  LBA_48  LH LM LL DV DC
  -- -- -- == -- == == == -- -- -- -- --
  40 -- 51 00 00 00 00 49 a1 9c c8 00 00  Error: UNC at LBA = 0x49a19cc8 = 1235328200

  Commands leading to the command that caused the error were:
  CR FEATR COUNT  LBA_48  LH LM LL DV DC  Powered_Up_Time  Command/Feature_Name
  -- == -- == -- == == == -- -- -- -- --  ---------------  --------------------
  60 00 00 00 80 00 00 49 a1 9c 60 40 00     01:40:07.818  READ FPDMA QUEUED
  60 00 00 00 40 00 00 00 1b 1b 52 40 00     01:40:07.766  READ FPDMA QUEUED
  61 00 00 00 08 00 00 00 0d 53 30 40 00     01:40:07.766  WRITE FPDMA QUEUED
  61 00 00 00 b8 00 00 57 db 30 18 40 00     01:40:07.766  WRITE FPDMA QUEUED
  61 00 00 00 08 00 00 00 6f 8b c0 40 00     01:40:07.766  WRITE FPDMA QUEUED

Error 180 [19] occurred at disk power-on lifetime: 11820 hours (492 days + 12 hours)
  When the command that caused the error occurred, the device was active or idle.

  After command completion occurred, registers were:
  ER -- ST COUNT  LBA_48  LH LM LL DV DC
  -- -- -- == -- == == == -- -- -- -- --
  40 -- 51 00 00 00 00 49 a1 9c c8 00 00  Error: UNC at LBA = 0x49a19cc8 = 1235328200

  Commands leading to the command that caused the error were:
  CR FEATR COUNT  LBA_48  LH LM LL DV DC  Powered_Up_Time  Command/Feature_Name
  -- == -- == -- == == == -- -- -- -- --  ---------------  --------------------
  60 00 00 00 08 00 00 07 2a b4 20 40 00     01:40:02.742  READ FPDMA QUEUED
  60 00 00 00 28 00 00 00 0f d5 1a 40 00     01:40:02.742  READ FPDMA QUEUED
  60 00 00 00 08 00 00 1e 94 a0 f8 40 00     01:40:02.742  READ FPDMA QUEUED
  60 00 00 01 00 00 00 1e 94 9f f8 40 00     01:40:02.742  READ FPDMA QUEUED
  60 00 00 00 07 00 00 00 13 b2 ed 40 00     01:40:02.742  READ FPDMA QUEUED

Error 179 [18] occurred at disk power-on lifetime: 11820 hours (492 days + 12 hours)
  When the command that caused the error occurred, the device was active or idle.

  After command completion occurred, registers were:
  ER -- ST COUNT  LBA_48  LH LM LL DV DC
  -- -- -- == -- == == == -- -- -- -- --
  40 -- 51 00 00 00 00 49 a1 9c c8 00 00  Error: UNC at LBA = 0x49a19cc8 = 1235328200

  Commands leading to the command that caused the error were:
  CR FEATR COUNT  LBA_48  LH LM LL DV DC  Powered_Up_Time  Command/Feature_Name
  -- == -- == -- == == == -- -- -- -- --  ---------------  --------------------
  60 00 00 00 08 00 00 02 55 b1 f0 40 00     01:39:57.641  READ FPDMA QUEUED
  60 00 00 01 00 00 00 4a f0 cb 90 40 00     01:39:57.641  READ FPDMA QUEUED
  60 00 00 00 08 00 00 49 a1 9c 68 40 00     01:39:57.641  READ FPDMA QUEUED
  60 00 00 00 18 00 00 00 38 af e4 40 00     01:39:57.641  READ FPDMA QUEUED
  61 00 00 00 08 00 00 00 6b 84 a0 40 00     01:39:57.641  WRITE FPDMA QUEUED

Error 178 [17] occurred at disk power-on lifetime: 11820 hours (492 days + 12 hours)
  When the command that caused the error occurred, the device was active or idle.

  After command completion occurred, registers were:
  ER -- ST COUNT  LBA_48  LH LM LL DV DC
  -- -- -- == -- == == == -- -- -- -- --
  40 -- 51 00 00 00 00 49 a1 9c c8 00 00  Error: UNC at LBA = 0x49a19cc8 = 1235328200

  Commands leading to the command that caused the error were:
  CR FEATR COUNT  LBA_48  LH LM LL DV DC  Powered_Up_Time  Command/Feature_Name
  -- == -- == -- == == == -- -- -- -- --  ---------------  --------------------
  60 00 00 00 08 00 00 00 0d 53 08 40 00     01:39:52.378  READ FPDMA QUEUED
  61 00 00 00 10 00 00 00 6a e0 e0 40 00     01:39:52.378  WRITE FPDMA QUEUED
  61 00 00 00 08 00 00 00 6b 1a 18 40 00     01:39:52.378  WRITE FPDMA QUEUED
  61 00 00 00 08 00 00 00 a2 78 b8 40 00     01:39:52.378  WRITE FPDMA QUEUED
  61 00 00 00 08 00 00 00 66 df 70 40 00     01:39:52.378  WRITE FPDMA QUEUED

SMART Extended Self-test Log Version: 1 (1 sectors)
No self-tests have been logged.  [To run self-tests, use: smartctl -t]

SMART Selective self-test log data structure revision number 1
 SPAN  MIN_LBA  MAX_LBA  CURRENT_TEST_STATUS
    1        0        0  Not_testing
    2        0        0  Not_testing
    3        0        0  Not_testing
    4        0        0  Not_testing
    5        0        0  Not_testing
Selective self-test flags (0x0):
  After scanning selected spans, do NOT read-scan remainder of disk.
If Selective self-test is pending on power-up, resume after 0 minute delay.

SCT Status Version:                  3
SCT Version (vendor specific):       522 (0x020a)
SCT Support Level:                   1
Device State:                        Active (0)
Current Temperature:                    29 Celsius
Power Cycle Min/Max Temperature:     20/31 Celsius
Lifetime    Min/Max Temperature:      3/49 Celsius
Under/Over Temperature Limit Count:   0/0

SCT Data Table command not supported

SCT Error Recovery Control command not supported

Device Statistics (GP/SMART Log 0x04) not supported

SATA Phy Event Counters (GP Log 0x11)
ID      Size     Value  Description
0x000a  2           15  Device-to-host register FISes sent due to a COMRESET
0x0001  2            0  Command failed due to ICRC error
0x0003  2            0  R_ERR response for device-to-host data FIS
0x0004  2            0  R_ERR response for host-to-device data FIS
0x0006  2            0  R_ERR response for device-to-host non-data FIS
0x0007  2            0  R_ERR response for host-to-device non-data FIS

