smartctl 7.4 2023-08-01 r5530 [x86_64-linux-6.5.4-zen2-1-zen] (local build)
Copyright (C) 2002-23, Bruce Allen, Christian Franke, www.smartmontools.org

=== START OF INFORMATION SECTION ===
Model Family:     HGST Travelstar 7K1000
Device Model:     HGST HTS721010A9E630
Serial Number:    --
LU WWN Device Id: 5 000cca ...
Firmware Version: JB0OA3J0
User Capacity:    1,000,204,886,016 bytes [1.00 TB]
Sector Sizes:     512 bytes logical, 4096 bytes physical
Rotation Rate:    7200 rpm
Form Factor:      2.5 inches
Device is:        In smartctl database 7.3/5528
ATA Version is:   ATA8-ACS T13/1699-D revision 6
SATA Version is:  SATA 3.0, 6.0 Gb/s (current: 6.0 Gb/s)
Local Time is:    Wed Sep 27 06:08:17 2023 +0330
SMART support is: Available - device has SMART capability.
SMART support is: Enabled
AAM feature is:   Unavailable
APM level is:     128 (minimum power consumption without standby)
Rd look-ahead is: Enabled
Write cache is:   Enabled
DSN feature is:   Unavailable
ATA Security is:  Disabled, frozen [SEC2]
Wt Cache Reorder: Enabled

=== START OF READ SMART DATA SECTION ===
SMART overall-health self-assessment test result: PASSED

General SMART Values:
Offline data collection status:  (0x00)	Offline data collection activity
					was never started.
					Auto Offline Data Collection: Disabled.
Self-test execution status:      (   0)	The previous self-test routine completed
					without error or no self-test has ever 
					been run.
Total time to complete Offline 
data collection: 		(   45) seconds.
Offline data collection
capabilities: 			 (0x5b) SMART execute Offline immediate.
					Auto Offline data collection on/off support.
					Suspend Offline collection upon new
					command.
					Offline surface scan supported.
					Self-test supported.
					No Conveyance Self-test supported.
					Selective Self-test supported.
SMART capabilities:            (0x0003)	Saves SMART data before entering
					power-saving mode.
					Supports SMART auto save timer.
Error logging capability:        (0x01)	Error logging supported.
					General Purpose Logging supported.
Short self-test routine 
recommended polling time: 	 (   2) minutes.
Extended self-test routine
recommended polling time: 	 ( 174) minutes.
SCT capabilities: 	       (0x003d)	SCT Status supported.
					SCT Error Recovery Control supported.
					SCT Feature Control supported.
					SCT Data Table supported.

SMART Attributes Data Structure revision number: 16
Vendor Specific SMART Attributes with Thresholds:
ID# ATTRIBUTE_NAME          FLAGS    VALUE WORST THRESH FAIL RAW_VALUE
  1 Raw_Read_Error_Rate     PO-R--   100   100   062    -    0
  2 Throughput_Performance  P-S---   100   100   040    -    0
  3 Spin_Up_Time            POS---   131   131   033    -    1
  4 Start_Stop_Count        -O--C-   085   085   000    -    24547
  5 Reallocated_Sector_Ct   PO--CK   100   100   005    -    0
  7 Seek_Error_Rate         PO-R--   100   100   067    -    0
  8 Seek_Time_Performance   P-S---   100   100   040    -    0
  9 Power_On_Hours          -O--C-   034   034   000    -    29209
 10 Spin_Retry_Count        PO--C-   100   100   060    -    0
 12 Power_Cycle_Count       -O--CK   095   095   000    -    9123
191 G-Sense_Error_Rate      -O-R--   100   100   000    -    0
192 Power-Off_Retract_Count -O--CK   095   095   000    -    1055
193 Load_Cycle_Count        -O--C-   001   001   000    -    1648216
194 Temperature_Celsius     -O----   166   166   000    -    36 (Min/Max 10/51)
196 Reallocated_Event_Count -O--CK   100   100   000    -    0
197 Current_Pending_Sector  -O---K   100   100   000    -    0
198 Offline_Uncorrectable   ---R--   100   100   000    -    0
199 UDMA_CRC_Error_Count    -O-R--   200   200   000    -    15
223 Load_Retry_Count        -O-R--   100   100   000    -    0
                            ||||||_ K auto-keep
                            |||||__ C event count
                            ||||___ R error rate
                            |||____ S speed/performance
                            ||_____ O updated online
                            |______ P prefailure warning

General Purpose Log Directory Version 1
SMART           Log Directory Version 1 [multi-sector log support]
Address    Access  R/W   Size  Description
0x00       GPL,SL  R/O      1  Log Directory
0x01           SL  R/O      1  Summary SMART error log
0x02           SL  R/O      1  Comprehensive SMART error log
0x03       GPL     R/O      1  Ext. Comprehensive SMART error log
0x06           SL  R/O      1  SMART self-test log
0x07       GPL     R/O      1  Extended self-test log
0x09           SL  R/W      1  Selective self-test log
0x10       GPL     R/O      1  NCQ Command Error log
0x11       GPL     R/O      1  SATA Phy Event Counters log
0x80-0x9f  GPL,SL  R/W     16  Host vendor specific log
0xe0       GPL,SL  R/W      1  SCT Command/Status
0xe1       GPL,SL  R/W      1  SCT Data Transfer

SMART Extended Comprehensive Error Log Version: 1 (1 sectors)
Device Error Count: 15 (device log contains only the most recent 4 errors)
	CR     = Command Register
	FEATR  = Features Register
	COUNT  = Count (was: Sector Count) Register
	LBA_48 = Upper bytes of LBA High/Mid/Low Registers ]  ATA-8
	LH     = LBA High (was: Cylinder High) Register    ]   LBA
	LM     = LBA Mid (was: Cylinder Low) Register      ] Register
	LL     = LBA Low (was: Sector Number) Register     ]
	DV     = Device (was: Device/Head) Register
	DC     = Device Control Register
	ER     = Error register
	ST     = Status register
Powered_Up_Time is measured from power on, and printed as
DDd+hh:mm:SS.sss where DD=days, hh=hours, mm=minutes,
SS=sec, and sss=millisec. It "wraps" after 49.710 days.

Error 15 [2] occurred at disk power-on lifetime: 24097 hours (1004 days + 1 hours)
  When the command that caused the error occurred, the device was active or idle.

  After command completion occurred, registers were:
  ER -- ST COUNT  LBA_48  LH LM LL DV DC
  -- -- -- == -- == == == -- -- -- -- --
  84 -- 51 00 00 00 00 00 00 00 00 00 00

  Commands leading to the command that caused the error were:
  CR FEATR COUNT  LBA_48  LH LM LL DV DC  Powered_Up_Time  Command/Feature_Name
  -- == -- == -- == == == -- -- -- -- --  ---------------  --------------------
  ec 00 00 00 01 00 00 00 00 00 00 00 00     00:00:00.353  IDENTIFY DEVICE
  00 cf f7 00 01 00 00 00 00 00 01 a0 ff  2d+03:25:38.900  NOP [Reserved subcommand] [OBS-ACS-2]
  00 cf f7 00 01 00 00 00 00 00 01 a0 ff  2d+03:25:38.830  NOP [Reserved subcommand] [OBS-ACS-2]

Error 14 [1] occurred at disk power-on lifetime: 24097 hours (1004 days + 1 hours)
  When the command that caused the error occurred, the device was active or idle.

  After command completion occurred, registers were:
  ER -- ST COUNT  LBA_48  LH LM LL DV DC
  -- -- -- == -- == == == -- -- -- -- --
  84 -- 51 00 81 00 00 59 81 8c cf 09 00  Error: ICRC, ABRT at LBA = 0x59818ccf = 1501662415

  Commands leading to the command that caused the error were:
  CR FEATR COUNT  LBA_48  LH LM LL DV DC  Powered_Up_Time  Command/Feature_Name
  -- == -- == -- == == == -- -- -- -- --  ---------------  --------------------
  60 01 00 00 08 00 00 59 81 8c 50 40 00     00:19:36.252  READ FPDMA QUEUED
  60 01 00 00 00 00 00 59 81 8b 50 40 00     00:19:36.250  READ FPDMA QUEUED
  60 01 00 00 08 00 00 59 81 8a 50 40 00     00:19:36.249  READ FPDMA QUEUED
  60 01 00 00 00 00 00 59 81 89 50 40 00     00:19:36.248  READ FPDMA QUEUED
  60 01 00 00 08 00 00 59 81 88 50 40 00     00:19:36.245  READ FPDMA QUEUED

Error 13 [0] occurred at disk power-on lifetime: 24097 hours (1004 days + 1 hours)
  When the command that caused the error occurred, the device was active or idle.

  After command completion occurred, registers were:
  ER -- ST COUNT  LBA_48  LH LM LL DV DC
  -- -- -- == -- == == == -- -- -- -- --
  84 -- 51 00 41 00 00 59 7f ce a7 09 00  Error: ICRC, ABRT at LBA = 0x597fcea7 = 1501548199

  Commands leading to the command that caused the error were:
  CR FEATR COUNT  LBA_48  LH LM LL DV DC  Powered_Up_Time  Command/Feature_Name
  -- == -- == -- == == == -- -- -- -- --  ---------------  --------------------
  60 01 00 00 00 00 00 59 7f ce e8 40 00     00:19:35.121  READ FPDMA QUEUED
  60 01 00 00 08 00 00 59 7f cd e8 40 00     00:19:35.120  READ FPDMA QUEUED
  60 01 00 00 00 00 00 59 7f cc e8 40 00     00:19:35.111  READ FPDMA QUEUED
  60 01 00 00 08 00 00 59 7f cb e8 40 00     00:19:35.107  READ FPDMA QUEUED
  60 01 00 00 00 00 00 59 7f ca e8 40 00     00:19:35.107  READ FPDMA QUEUED

Error 12 [3] occurred at disk power-on lifetime: 24097 hours (1004 days + 1 hours)
  When the command that caused the error occurred, the device was active or idle.

  After command completion occurred, registers were:
  ER -- ST COUNT  LBA_48  LH LM LL DV DC
  -- -- -- == -- == == == -- -- -- -- --
  84 -- 51 00 00 00 00 00 00 00 00 00 00

  Commands leading to the command that caused the error were:
  CR FEATR COUNT  LBA_48  LH LM LL DV DC  Powered_Up_Time  Command/Feature_Name
  -- == -- == -- == == == -- -- -- -- --  ---------------  --------------------
  ec 00 00 00 01 00 00 00 00 00 00 00 00     00:00:56.040  IDENTIFY DEVICE
  ec 00 00 00 01 00 00 00 00 00 01 00 ff     00:00:56.026  IDENTIFY DEVICE
  ec 00 00 00 00 00 00 00 00 00 00 00 ff     00:00:55.956  IDENTIFY DEVICE
  ec 00 00 00 01 00 00 00 00 00 00 00 00     00:00:55.935  IDENTIFY DEVICE
  ec 00 00 00 01 00 00 00 00 00 01 00 ff     00:00:55.921  IDENTIFY DEVICE

SMART Extended Self-test Log Version: 1 (1 sectors)
Num  Test_Description    Status                  Remaining  LifeTime(hours)  LBA_of_first_error
# 1  Short offline       Completed without error       00%     29197         -
# 2  Short offline       Completed without error       00%     29169         -
# 3  Short offline       Completed without error       00%     29142         -
# 4  Short offline       Completed without error       00%     29088         -
# 5  Short offline       Completed without error       00%     29024         -
# 6  Short offline       Completed without error       00%     28825         -
# 7  Short offline       Completed without error       00%     28738         -
# 8  Short offline       Completed without error       00%     28633         -
# 9  Short offline       Completed without error       00%     28616         -
#10  Short offline       Completed without error       00%     28590         -
#11  Short offline       Completed without error       00%     28549         -
#12  Short offline       Completed without error       00%     28518         -
#13  Short offline       Completed without error       00%     28424         -
#14  Short offline       Completed without error       00%     28411         -
#15  Short offline       Completed without error       00%     28386         -
#16  Short offline       Completed without error       00%     28339         -
#17  Short offline       Completed without error       00%     28225         -
#18  Short offline       Completed without error       00%     28099         -
#19  Short offline       Completed without error       00%     28092         -

SMART Selective self-test log data structure revision number 1
 SPAN  MIN_LBA  MAX_LBA  CURRENT_TEST_STATUS
    1        0        0  Not_testing
    2        0        0  Not_testing
    3        0        0  Not_testing
    4        0        0  Not_testing
    5        0        0  Not_testing
Selective self-test flags (0x0):
  After scanning selected spans, do NOT read-scan remainder of disk.
If Selective self-test is pending on power-up, resume after 0 minute delay.

SCT Status Version:                  3
SCT Version (vendor specific):       256 (0x0100)
Device State:                        Active (0)
Current Temperature:                    36 Celsius
Power Cycle Min/Max Temperature:     29/41 Celsius
Lifetime    Min/Max Temperature:     10/51 Celsius
Specified Max Operating Temperature:    33 Celsius
Under/Over Temperature Limit Count:   0/0

SCT Temperature History Version:     2
Temperature Sampling Period:         1 minute
Temperature Logging Interval:        1 minute
Min/Max recommended Temperature:      0/60 Celsius
Min/Max Temperature Limit:           -40/65 Celsius
Temperature History Size (Index):    128 (11)

SCT Error Recovery Control:
           Read: Disabled
          Write: Disabled

Device Statistics (GP/SMART Log 0x04) not supported

Pending Defects log (GP Log 0x0c) not supported

SATA Phy Event Counters (GP Log 0x11)
ID      Size     Value  Description
0x0001  2            0  Command failed due to ICRC error
0x0002  2            0  R_ERR response for data FIS
0x0003  2            0  R_ERR response for device-to-host data FIS
0x0004  2            0  R_ERR response for host-to-device data FIS
0x0005  2            0  R_ERR response for non-data FIS
0x0006  2            0  R_ERR response for device-to-host non-data FIS
0x0007  2            0  R_ERR response for host-to-device non-data FIS
0x0009  2        65535+ Transition from drive PhyRdy to drive PhyNRdy
0x000a  2           11  Device-to-host register FISes sent due to a COMRESET
0x000b  2            0  CRC errors within host-to-device FIS
0x000d  2            0  Non-CRC errors within host-to-device FIS



