smartctl 7.2 2020-12-30 r5155 [x86_64-linux-5.10.14-desktop-1omv4002] (OpenMandriva Lx 7.2-2)
Copyright (C) 2002-20, Bruce Allen, Christian Franke, www.smartmontools.org

=== START OF INFORMATION SECTION ===
Model Family:     HGST Travelstar 7K1000
Device Model:     HGST HTS721010A9E630
Serial Number:    --
LU WWN Device Id: 5 000cca ...
Firmware Version: JB0OA3T0
User Capacity:    1,000,204,886,016 bytes [1.00 TB]
Sector Sizes:     512 bytes logical, 4096 bytes physical
Rotation Rate:    7200 rpm
Form Factor:      2.5 inches
Device is:        In smartctl database [for details use: -P show]
ATA Version is:   ACS-2, ATA8-ACS T13/1699-D revision 6
SATA Version is:  SATA 3.0, 6.0 Gb/s (current: 6.0 Gb/s)
Local Time is:    Mon Sep 20 21:05:47 2021 CEST
SMART support is: Available - device has SMART capability.
SMART support is: Enabled
AAM feature is:   Unavailable
APM level is:     128 (minimum power consumption without standby)
Rd look-ahead is: Enabled
Write cache is:   Enabled
DSN feature is:   Unavailable
ATA Security is:  Disabled, frozen [SEC2]
Wt Cache Reorder: Enabled

=== START OF READ SMART DATA SECTION ===
SMART overall-health self-assessment test result: PASSED

General SMART Values:
Offline data collection status:  (0x00)	Offline data collection activity
					was never started.
					Auto Offline Data Collection: Disabled.
Self-test execution status:      (   0)	The previous self-test routine completed
					without error or no self-test has ever 
					been run.
Total time to complete Offline 
data collection: 		(   45) seconds.
Offline data collection
capabilities: 			 (0x51) SMART execute Offline immediate.
					No Auto Offline data collection support.
					Suspend Offline collection upon new
					command.
					No Offline surface scan supported.
					Self-test supported.
					No Conveyance Self-test supported.
					Selective Self-test supported.
SMART capabilities:            (0x0003)	Saves SMART data before entering
					power-saving mode.
					Supports SMART auto save timer.
Error logging capability:        (0x01)	Error logging supported.
					General Purpose Logging supported.
Short self-test routine 
recommended polling time: 	 (   2) minutes.
Extended self-test routine
recommended polling time: 	 ( 171) minutes.
SCT capabilities: 	       (0x003d)	SCT Status supported.
					SCT Error Recovery Control supported.
					SCT Feature Control supported.
					SCT Data Table supported.

SMART Attributes Data Structure revision number: 16
Vendor Specific SMART Attributes with Thresholds:
ID# ATTRIBUTE_NAME          FLAGS    VALUE WORST THRESH FAIL RAW_VALUE
  1 Raw_Read_Error_Rate     POSR-K   100   094   062    -    0
  2 Throughput_Performance  P-S--K   100   100   040    -    0
  3 Spin_Up_Time            PO---K   120   100   033    -    2
  4 Start_Stop_Count        -O--CK   059   059   000    -    65604
  5 Reallocated_Sector_Ct   PO--CK   100   100   005    -    0
  7 Seek_Error_Rate         POSR-K   100   100   067    -    0
  8 Seek_Time_Performance   P-S--K   100   100   040    -    0
  9 Power_On_Hours          -O--CK   093   093   000    -    3083
 10 Spin_Retry_Count        PO--CK   100   100   060    -    0
 12 Power_Cycle_Count       -O--CK   099   099   000    -    2613
183 Runtime_Bad_Block       -O--CK   100   100   000    -    0
184 End-to-End_Error        PO--CK   100   100   097    -    0
187 Reported_Uncorrect      -O--CK   100   100   000    -    128849477632
188 Command_Timeout         -O--CK   100   099   000    -    1
190 Airflow_Temperature_Cel -O---K   068   047   045    -    32 (Min/Max 22/33)
191 G-Sense_Error_Rate      -O--CK   100   100   000    -    171
192 Power-Off_Retract_Count -O--CK   100   100   000    -    7209070
193 Load_Cycle_Count        -O--CK   088   088   000    -    120840
196 Reallocated_Event_Count -O--CK   100   100   000    -    0
197 Current_Pending_Sector  -O--CK   100   100   000    -    0
198 Offline_Uncorrectable   ----CK   100   100   000    -    0
199 UDMA_CRC_Error_Count    -OS-CK   100   100   000    -    0
223 Load_Retry_Count        -O-R-K   100   100   000    -    0
                            ||||||_ K auto-keep
                            |||||__ C event count
                            ||||___ R error rate
                            |||____ S speed/performance
                            ||_____ O updated online
                            |______ P prefailure warning

General Purpose Log Directory Version 1
SMART           Log Directory Version 1 [multi-sector log support]
Address    Access  R/W   Size  Description
0x00       GPL,SL  R/O      1  Log Directory
0x01           SL  R/O      1  Summary SMART error log
0x02           SL  R/O      1  Comprehensive SMART error log
0x03       GPL     R/O      1  Ext. Comprehensive SMART error log
0x06           SL  R/O      1  SMART self-test log
0x07       GPL     R/O      1  Extended self-test log
0x09           SL  R/W      1  Selective self-test log
0x10       GPL     R/O      1  NCQ Command Error log
0x11       GPL     R/O      1  SATA Phy Event Counters log
0x80-0x9f  GPL,SL  R/W     16  Host vendor specific log
0xe0       GPL,SL  R/W      1  SCT Command/Status
0xe1       GPL,SL  R/W      1  SCT Data Transfer

SMART Extended Comprehensive Error Log Version: 1 (1 sectors)
No Errors Logged

SMART Extended Self-test Log Version: 1 (1 sectors)
Num  Test_Description    Status                  Remaining  LifeTime(hours)  LBA_of_first_error
# 1  Short offline       Completed without error       00%      2940         -
# 2  Short offline       Completed without error       00%      2934         -
# 3  Short offline       Completed without error       00%      2926         -
# 4  Short offline       Completed without error       00%      2924         -
# 5  Short offline       Interrupted (host reset)      60%      2921         -
# 6  Short offline       Completed without error       00%      2919         -
# 7  Short offline       Completed without error       00%      2913         -
# 8  Short offline       Completed without error       00%      2863         -
# 9  Short offline       Completed without error       00%      2811         -
#10  Short offline       Completed without error       00%      2809         -
#11  Short offline       Completed without error       00%      2801         -
#12  Short offline       Completed without error       00%      2721         -
#13  Short offline       Completed without error       00%      2718         -
#14  Short offline       Completed without error       00%      2715         -
#15  Extended offline    Interrupted (host reset)      80%      2713         -
#16  Short offline       Completed without error       00%      2705         -
#17  Short offline       Completed without error       00%      2702         -
#18  Short offline       Completed without error       00%      2701         -
#19  Short offline       Completed without error       00%      2701         -

SMART Selective self-test log data structure revision number 1
 SPAN  MIN_LBA  MAX_LBA  CURRENT_TEST_STATUS
    1        0        0  Not_testing
    2        0        0  Not_testing
    3        0        0  Not_testing
    4        0        0  Not_testing
    5        0        0  Not_testing
Selective self-test flags (0x0):
  After scanning selected spans, do NOT read-scan remainder of disk.
If Selective self-test is pending on power-up, resume after 0 minute delay.

SCT Status Version:                  3
SCT Version (vendor specific):       256 (0x0100)
Device State:                        Active (0)
Current Temperature:                    33 Celsius
Power Cycle Min/Max Temperature:     22/33 Celsius
Lifetime    Min/Max Temperature:     13/53 Celsius
Specified Max Operating Temperature:    35 Celsius
Under/Over Temperature Limit Count:   0/0

SCT Temperature History Version:     2
Temperature Sampling Period:         1 minute
Temperature Logging Interval:        1 minute
Min/Max recommended Temperature:      0/60 Celsius
Min/Max Temperature Limit:           -40/65 Celsius
Temperature History Size (Index):    128 (15)

SCT Error Recovery Control:
           Read:     85 (8.5 seconds)
          Write:     85 (8.5 seconds)

Device Statistics (GP/SMART Log 0x04) not supported

Pending Defects log (GP Log 0x0c) not supported

SATA Phy Event Counters (GP Log 0x11)
ID      Size     Value  Description
0x0001  2            0  Command failed due to ICRC error
0x0002  2            0  R_ERR response for data FIS
0x0003  2            0  R_ERR response for device-to-host data FIS
0x0004  2            0  R_ERR response for host-to-device data FIS
0x0005  2            0  R_ERR response for non-data FIS
0x0006  2            0  R_ERR response for device-to-host non-data FIS
0x0007  2            0  R_ERR response for host-to-device non-data FIS
0x0009  2          224  Transition from drive PhyRdy to drive PhyNRdy
0x000a  2           11  Device-to-host register FISes sent due to a COMRESET
0x000b  2            0  CRC errors within host-to-device FIS
0x000d  2            0  Non-CRC errors within host-to-device FIS

