smartctl 7.1 2019-12-30 r5022 [x86_64-linux-5.11.0-38-generic] (local build)
Copyright (C) 2002-19, Bruce Allen, Christian Franke, www.smartmontools.org

=== START OF INFORMATION SECTION ===
Model Family:     Seagate Barracuda 7200.11
Device Model:     ST3500620AS
Serial Number:    --
LU WWN Device Id: 5 000c50 ...
Firmware Version: HP24
User Capacity:    500,107,862,016 bytes [500 GB]
Sector Size:      512 bytes logical/physical
Rotation Rate:    7200 rpm
Device is:        In smartctl database [for details use: -P show]
ATA Version is:   ATA8-ACS T13/1699-D revision 4
SATA Version is:  SATA 2.6, 3.0 Gb/s
Local Time is:    Sat Oct 30 15:57:43 2021 BST

==> WARNING: There are known problems with these drives,
see the following Seagate web pages:
http://knowledge.seagate.com/articles/en_US/FAQ/207931en
http://knowledge.seagate.com/articles/en_US/FAQ/207951en
http://knowledge.seagate.com/articles/en_US/FAQ/207957en

SMART support is: Available - device has SMART capability.
SMART support is: Enabled
AAM feature is:   Unavailable
APM feature is:   Unavailable
Rd look-ahead is: Enabled
Write cache is:   Enabled
DSN feature is:   Unavailable
ATA Security is:  Unavailable
Wt Cache Reorder: Unknown

=== START OF READ SMART DATA SECTION ===
SMART overall-health self-assessment test result: PASSED

General SMART Values:
Offline data collection status:  (0x82)	Offline data collection activity
					was completed without error.
					Auto Offline Data Collection: Enabled.
Self-test execution status:      (   0)	The previous self-test routine completed
					without error or no self-test has ever 
					been run.
Total time to complete Offline 
data collection: 		(  642) seconds.
Offline data collection
capabilities: 			 (0x5b) SMART execute Offline immediate.
					Auto Offline data collection on/off support.
					Suspend Offline collection upon new
					command.
					Offline surface scan supported.
					Self-test supported.
					No Conveyance Self-test supported.
					Selective Self-test supported.
SMART capabilities:            (0x0003)	Saves SMART data before entering
					power-saving mode.
					Supports SMART auto save timer.
Error logging capability:        (0x01)	Error logging supported.
					General Purpose Logging supported.
Short self-test routine 
recommended polling time: 	 (   2) minutes.
Extended self-test routine
recommended polling time: 	 ( 122) minutes.
SCT capabilities: 	       (0x103f)	SCT Status supported.
					SCT Error Recovery Control supported.
					SCT Feature Control supported.
					SCT Data Table supported.

SMART Attributes Data Structure revision number: 10
Vendor Specific SMART Attributes with Thresholds:
ID# ATTRIBUTE_NAME          FLAGS    VALUE WORST THRESH FAIL RAW_VALUE
  1 Raw_Read_Error_Rate     POSR--   112   099   006    -    50108935
  3 Spin_Up_Time            -O----   094   089   000    -    0
  4 Start_Stop_Count        PO--CK   092   092   020    -    9032
  5 Reallocated_Sector_Ct   PO--CK   100   100   036    -    0
  7 Seek_Error_Rate         POSR--   069   060   030    -    305596501856
  9 Power_On_Hours          -O--CK   080   080   000    -    17580
 10 Spin_Retry_Count        PO--C-   100   100   097    -    133
 12 Power_Cycle_Count       PO--CK   093   037   020    -    7745
184 End-to-End_Error        PO--CK   100   100   097    -    0
187 Reported_Uncorrect      -O--CK   100   100   000    -    0
188 Command_Timeout         -O--CK   100   099   000    -    21
189 High_Fly_Writes         -O-RCK   096   096   000    -    4
190 Airflow_Temperature_Cel -O---K   069   046   045    -    31 (Min/Max 18/31)
194 Temperature_Celsius     -O---K   031   054   000    -    31 (0 12 0 0 0)
195 Hardware_ECC_Recovered  -O-RC-   026   023   000    -    50108935
196 Reallocated_Event_Count PO--CK   100   100   036    -    0
197 Current_Pending_Sector  -O--C-   100   100   000    -    0
198 Offline_Uncorrectable   ----C-   100   100   000    -    0
199 UDMA_CRC_Error_Count    -OSRCK   200   200   000    -    0
                            ||||||_ K auto-keep
                            |||||__ C event count
                            ||||___ R error rate
                            |||____ S speed/performance
                            ||_____ O updated online
                            |______ P prefailure warning

General Purpose Log Directory Version 1
SMART           Log Directory Version 1 [multi-sector log support]
Address    Access  R/W   Size  Description
0x00       GPL,SL  R/O      1  Log Directory
0x01       GPL,SL  R/O      1  Summary SMART error log
0x02       GPL,SL  R/O      5  Comprehensive SMART error log
0x03       GPL,SL  R/O      5  Ext. Comprehensive SMART error log
0x06       GPL,SL  R/O      1  SMART self-test log
0x07       GPL,SL  R/O      1  Extended self-test log
0x09       GPL,SL  R/W      1  Selective self-test log
0x10       GPL,SL  R/O      1  NCQ Command Error log
0x11       GPL,SL  R/O      1  SATA Phy Event Counters log
0x21       GPL,SL  R/O      1  Write stream error log
0x22       GPL,SL  R/O      1  Read stream error log
0x80-0x9f  GPL,SL  R/W     16  Host vendor specific log
0xa1       GPL,SL  VS      20  Device vendor specific log
0xa2       GPL     VS    2248  Device vendor specific log
0xa8       GPL,SL  VS      20  Device vendor specific log
0xa9       GPL,SL  VS       1  Device vendor specific log
0xb0       GPL     VS    2819  Device vendor specific log
0xbe-0xbf  GPL     VS   65535  Device vendor specific log
0xe0       GPL,SL  R/W      1  SCT Command/Status
0xe1       GPL,SL  R/W      1  SCT Data Transfer

SMART Extended Comprehensive Error Log Version: 1 (5 sectors)
Device Error Count: 6
	CR     = Command Register
	FEATR  = Features Register
	COUNT  = Count (was: Sector Count) Register
	LBA_48 = Upper bytes of LBA High/Mid/Low Registers ]  ATA-8
	LH     = LBA High (was: Cylinder High) Register    ]   LBA
	LM     = LBA Mid (was: Cylinder Low) Register      ] Register
	LL     = LBA Low (was: Sector Number) Register     ]
	DV     = Device (was: Device/Head) Register
	DC     = Device Control Register
	ER     = Error register
	ST     = Status register
Powered_Up_Time is measured from power on, and printed as
DDd+hh:mm:SS.sss where DD=days, hh=hours, mm=minutes,
SS=sec, and sss=millisec. It "wraps" after 49.710 days.

Error 6 [5] occurred at disk power-on lifetime: 12438 hours (518 days + 6 hours)
  When the command that caused the error occurred, the device was active or idle.

  After command completion occurred, registers were:
  ER -- ST COUNT  LBA_48  LH LM LL DV DC
  -- -- -- == -- == == == -- -- -- -- --
  40 -- 51 00 00 00 0b 3f 00 d0 87 00 00  Error: UNC at LBA = 0xb3f00d087 = 48301658247

  Commands leading to the command that caused the error were:
  CR FEATR COUNT  LBA_48  LH LM LL DV DC  Powered_Up_Time  Command/Feature_Name
  -- == -- == -- == == == -- -- -- -- --  ---------------  --------------------
  60 00 00 00 08 00 0b 3f 00 d0 87 40 00     00:01:20.315  READ FPDMA QUEUED
  60 00 00 00 80 00 0b 40 00 d0 0f 40 00     00:01:20.313  READ FPDMA QUEUED
  60 00 00 00 80 00 0b 3f 00 d0 8f 40 00     00:01:20.284  READ FPDMA QUEUED
  2f 00 00 00 01 00 00 00 00 00 10 28 00     00:01:20.202  READ LOG EXT
  60 00 00 00 08 00 0b 3f 00 d0 87 40 00     00:01:17.330  READ FPDMA QUEUED

Error 5 [4] occurred at disk power-on lifetime: 12438 hours (518 days + 6 hours)
  When the command that caused the error occurred, the device was active or idle.

  After command completion occurred, registers were:
  ER -- ST COUNT  LBA_48  LH LM LL DV DC
  -- -- -- == -- == == == -- -- -- -- --
  40 -- 51 00 00 00 0b 3f 00 d0 87 00 00  Error: UNC at LBA = 0xb3f00d087 = 48301658247

  Commands leading to the command that caused the error were:
  CR FEATR COUNT  LBA_48  LH LM LL DV DC  Powered_Up_Time  Command/Feature_Name
  -- == -- == -- == == == -- -- -- -- --  ---------------  --------------------
  60 00 00 00 08 00 0b 3f 00 d0 87 40 00     00:01:17.330  READ FPDMA QUEUED
  60 00 00 00 08 00 0b 3f 00 d0 7f 40 00     00:01:17.329  READ FPDMA QUEUED
  60 00 00 00 08 00 0b 3f 00 d0 77 40 00     00:01:17.327  READ FPDMA QUEUED
  60 00 00 00 10 00 0f a8 00 ff 00 40 00     00:01:17.326  READ FPDMA QUEUED
  60 00 00 00 08 00 0b 3f 00 d0 6f 40 00     00:01:17.326  READ FPDMA QUEUED

Error 4 [3] occurred at disk power-on lifetime: 12438 hours (518 days + 6 hours)
  When the command that caused the error occurred, the device was active or idle.

  After command completion occurred, registers were:
  ER -- ST COUNT  LBA_48  LH LM LL DV DC
  -- -- -- == -- == == == -- -- -- -- --
  40 -- 51 00 00 00 0b 3f 00 d0 87 00 00  Error: UNC at LBA = 0xb3f00d087 = 48301658247

  Commands leading to the command that caused the error were:
  CR FEATR COUNT  LBA_48  LH LM LL DV DC  Powered_Up_Time  Command/Feature_Name
  -- == -- == -- == == == -- -- -- -- --  ---------------  --------------------
  60 00 00 01 00 00 0b 42 00 d0 57 40 00     00:01:14.374  READ FPDMA QUEUED
  60 00 00 01 00 00 0b 41 00 d0 57 40 00     00:01:14.374  READ FPDMA QUEUED
  60 00 00 01 00 00 0b 40 00 d0 57 40 00     00:01:14.374  READ FPDMA QUEUED
  60 00 00 01 00 00 0b 3f 00 d0 57 40 00     00:01:14.366  READ FPDMA QUEUED
  60 00 00 00 08 00 0b 3f 00 d0 4f 40 00     00:01:14.329  READ FPDMA QUEUED

Error 3 [2] occurred at disk power-on lifetime: 12438 hours (518 days + 6 hours)
  When the command that caused the error occurred, the device was active or idle.

  After command completion occurred, registers were:
  ER -- ST COUNT  LBA_48  LH LM LL DV DC
  -- -- -- == -- == == == -- -- -- -- --
  40 -- 51 00 00 00 0b 3f 00 d0 87 00 00  Error: UNC at LBA = 0xb3f00d087 = 48301658247

  Commands leading to the command that caused the error were:
  CR FEATR COUNT  LBA_48  LH LM LL DV DC  Powered_Up_Time  Command/Feature_Name
  -- == -- == -- == == == -- -- -- -- --  ---------------  --------------------
  60 00 00 00 08 00 0b 3d 00 d0 5f 40 00     00:01:11.421  READ FPDMA QUEUED
  60 00 00 00 08 00 0b 3d 00 d0 57 40 00     00:01:11.399  READ FPDMA QUEUED
  60 00 00 01 00 00 0b 42 00 d0 57 40 00     00:01:11.329  READ FPDMA QUEUED
  60 00 00 01 00 00 0b 41 00 d0 57 40 00     00:01:11.329  READ FPDMA QUEUED
  60 00 00 01 00 00 0b 40 00 d0 57 40 00     00:01:11.329  READ FPDMA QUEUED

Error 2 [1] occurred at disk power-on lifetime: 12438 hours (518 days + 6 hours)
  When the command that caused the error occurred, the device was active or idle.

  After command completion occurred, registers were:
  ER -- ST COUNT  LBA_48  LH LM LL DV DC
  -- -- -- == -- == == == -- -- -- -- --
  40 -- 51 00 00 00 0b 3f 00 d0 87 00 00  Error: UNC at LBA = 0xb3f00d087 = 48301658247

  Commands leading to the command that caused the error were:
  CR FEATR COUNT  LBA_48  LH LM LL DV DC  Powered_Up_Time  Command/Feature_Name
  -- == -- == -- == == == -- -- -- -- --  ---------------  --------------------
  60 00 00 01 00 00 0b 40 00 d0 57 40 00     00:01:08.460  READ FPDMA QUEUED
  60 00 00 00 08 00 0b 3b 00 d0 5f 40 00     00:01:08.453  READ FPDMA QUEUED
  60 00 00 00 08 00 0b 3b 00 d0 57 40 00     00:01:08.448  READ FPDMA QUEUED
  60 00 00 01 00 00 0b 42 00 d0 57 40 00     00:01:08.329  READ FPDMA QUEUED
  60 00 00 01 00 00 0b 41 00 d0 57 40 00     00:01:08.329  READ FPDMA QUEUED

Error 1 [0] occurred at disk power-on lifetime: 12438 hours (518 days + 6 hours)
  When the command that caused the error occurred, the device was active or idle.

  After command completion occurred, registers were:
  ER -- ST COUNT  LBA_48  LH LM LL DV DC
  -- -- -- == -- == == == -- -- -- -- --
  40 -- 51 00 00 00 0b 3f 00 d0 87 00 00  Error: UNC at LBA = 0xb3f00d087 = 48301658247

  Commands leading to the command that caused the error were:
  CR FEATR COUNT  LBA_48  LH LM LL DV DC  Powered_Up_Time  Command/Feature_Name
  -- == -- == -- == == == -- -- -- -- --  ---------------  --------------------
  60 00 00 01 00 00 0b 40 00 d0 57 40 00     00:01:05.596  READ FPDMA QUEUED
  60 00 00 01 00 00 0b 13 00 c4 57 40 00     00:01:01.452  READ FPDMA QUEUED
  60 00 00 01 00 00 0b 42 00 c3 57 40 00     00:01:00.833  READ FPDMA QUEUED
  60 00 00 01 00 00 0b 41 00 c3 57 40 00     00:01:00.832  READ FPDMA QUEUED
  60 00 00 01 00 00 0b 40 00 c3 57 40 00     00:01:00.832  READ FPDMA QUEUED

SMART Extended Self-test Log Version: 1 (1 sectors)
Num  Test_Description    Status                  Remaining  LifeTime(hours)  LBA_of_first_error
# 1  Short offline       Completed without error       00%     16844         -

SMART Selective self-test log data structure revision number 1
 SPAN  MIN_LBA  MAX_LBA  CURRENT_TEST_STATUS
    1        0        0  Not_testing
    2        0        0  Not_testing
    3        0        0  Not_testing
    4        0        0  Not_testing
    5        0        0  Not_testing
Selective self-test flags (0x0):
  After scanning selected spans, do NOT read-scan remainder of disk.
If Selective self-test is pending on power-up, resume after 0 minute delay.

SCT Status Version:                  3
SCT Version (vendor specific):       522 (0x020a)
Device State:                        Active (0)
Current Temperature:                    31 Celsius
Power Cycle Min/Max Temperature:     18/31 Celsius
Lifetime    Min/Max Temperature:     12/53 Celsius
Under/Over Temperature Limit Count:   0/34

SCT Temperature History Version:     2
Temperature Sampling Period:         1 minute
Temperature Logging Interval:        1 minute
Min/Max recommended Temperature:      0/ 0 Celsius
Min/Max Temperature Limit:            0/ 0 Celsius
Temperature History Size (Index):    128 (117)

SCT Error Recovery Control:
           Read: Disabled
          Write: Disabled

Device Statistics (GP/SMART Log 0x04) not supported

Pending Defects log (GP Log 0x0c) not supported

SATA Phy Event Counters (GP Log 0x11)
ID      Size     Value  Description
0x000a  2            3  Device-to-host register FISes sent due to a COMRESET
0x0001  2            0  Command failed due to ICRC error
0x0003  2            0  R_ERR response for device-to-host data FIS
0x0004  2            0  R_ERR response for host-to-device data FIS
0x0006  2            0  R_ERR response for device-to-host non-data FIS
0x0007  2            0  R_ERR response for host-to-device non-data FIS

