=== START OF INFORMATION SECTION ===
Model Family:     Toshiba 2.5" HDD MK..56GSY
Device Model:     TOSHIBA MK3256GSY
Serial Number:    --
LU WWN Device Id: 5 000039 ...
Firmware Version: LH013C
User Capacity:    320 072 933 376 bytes [320 GB]
Sector Size:      512 bytes logical/physical
Rotation Rate:    7200 rpm
Form Factor:      2.5 inches
Device is:        In smartctl database [for details use: -P show]
ATA Version is:   ATA8-ACS (minor revision not indicated)
SATA Version is:  SATA 2.6, 3.0 Gb/s
Local Time is:    Fri Feb 10 10:59:33 2017 +04
SMART support is: Available - device has SMART capability.
SMART support is: Enabled
AAM feature is:   Unavailable
APM level is:     128 (minimum power consumption without standby)
Rd look-ahead is: Enabled
Write cache is:   Enabled
ATA Security is:  Disabled, frozen [SEC2]
Write SCT (Get) Feature Control Command failed: scsi error badly formed scsi parameters
Wt Cache Reorder: Unknown (SCT Feature Control command failed)

=== START OF READ SMART DATA SECTION ===
SMART overall-health self-assessment test result: PASSED
See vendor-specific Attribute list for marginal Attributes.

General SMART Values:
Offline data collection status:  (0x00)	Offline data collection activity
					was never started.
					Auto Offline Data Collection: Disabled.
Self-test execution status:      (   0)	The previous self-test routine completed
					without error or no self-test has ever 
					been run.
Total time to complete Offline 
data collection: 		(  120) seconds.
Offline data collection
capabilities: 			 (0x51) SMART execute Offline immediate.
					No Auto Offline data collection support.
					Suspend Offline collection upon new
					command.
					No Offline surface scan supported.
					Self-test supported.
					No Conveyance Self-test supported.
					Selective Self-test supported.
SMART capabilities:            (0x0003)	Saves SMART data before entering
					power-saving mode.
					Supports SMART auto save timer.
Error logging capability:        (0x01)	Error logging supported.
					General Purpose Logging supported.
Short self-test routine 
recommended polling time: 	 (   2) minutes.
Extended self-test routine
recommended polling time: 	 (  79) minutes.
SCT capabilities: 	       (0x0033)	SCT Status supported.
					SCT Feature Control supported.
					SCT Data Table supported.

SMART Attributes Data Structure revision number: 16
Vendor Specific SMART Attributes with Thresholds:
ID# ATTRIBUTE_NAME          FLAGS    VALUE WORST THRESH FAIL RAW_VALUE
  1 Raw_Read_Error_Rate     POSR--   100   100   050    -    0
  2 Throughput_Performance  POS---   100   100   050    -    0
  3 Spin_Up_Time            PO----   100   100   002    -    2199
  4 Start_Stop_Count        -O--CK   100   100   000    -    4249
  5 Reallocated_Sector_Ct   PO--CK   100   100   010    -    9
  7 Seek_Error_Rate         POSR--   100   100   050    -    0
  8 Seek_Time_Performance   P-S---   100   100   050    -    0
  9 Power_On_Minutes        -O--CK   084   084   000    -    110h+41m
 10 Spin_Retry_Count        PO--C-   184   100   030    -    0
 12 Power_Cycle_Count       -O--CK   100   100   000    -    4182
183 Runtime_Bad_Block       -O---K   100   100   001    -    0
184 End-to-End_Error        PO--CK   100   100   097    -    0
185 Unknown_Attribute       -O--CK   100   100   001    -    65535
187 Reported_Uncorrect      -O--CK   001   001   000    -    5150
188 Command_Timeout         -O--CK   100   100   000    -    0
189 High_Fly_Writes         -O-RCK   100   100   001    -    0
190 Airflow_Temperature_Cel -O---K   057   038   045    Past 43 (Min/Max 22/43)
191 G-Sense_Error_Rate      -O--CK   100   100   000    -    542
192 Power-Off_Retract_Count -O--CK   100   100   000    -    8519810
193 Load_Cycle_Count        -O--CK   089   089   000    -    118430
196 Reallocated_Event_Count -O--CK   100   100   000    -    9
197 Current_Pending_Sector  -O--C-   100   100   000    -    0
199 UDMA_CRC_Error_Count    -OSRCK   200   200   000    -    0
                            ||||||_ K auto-keep
                            |||||__ C event count
                            ||||___ R error rate
                            |||____ S speed/performance
                            ||_____ O updated online
                            |______ P prefailure warning

General Purpose Log Directory Version 1
SMART           Log Directory Version 1 [multi-sector log support]
Address    Access  R/W   Size  Description
0x00       GPL,SL  R/O      1  Log Directory
0x01           SL  R/O      1  Summary SMART error log
0x02           SL  R/O     51  Comprehensive SMART error log
0x03       GPL     R/O     64  Ext. Comprehensive SMART error log
0x06           SL  R/O      1  SMART self-test log
0x07       GPL     R/O      1  Extended self-test log
0x09           SL  R/W      1  Selective self-test log
0x10       GPL     R/O      1  SATA NCQ Queued Error log
0x11       GPL     R/O      1  SATA Phy Event Counters log
0x80-0x9f  GPL,SL  R/W     16  Host vendor specific log
0xe0       GPL,SL  R/W      1  SCT Command/Status
0xe1       GPL,SL  R/W      1  SCT Data Transfer

SMART Extended Comprehensive Error Log Version: 1 (64 sectors)
Device Error Count: 11414 (device log contains only the most recent 256 errors)
	CR     = Command Register
	FEATR  = Features Register
	COUNT  = Count (was: Sector Count) Register
	LBA_48 = Upper bytes of LBA High/Mid/Low Registers ]  ATA-8
	LH     = LBA High (was: Cylinder High) Register    ]   LBA
	LM     = LBA Mid (was: Cylinder Low) Register      ] Register
	LL     = LBA Low (was: Sector Number) Register     ]
	DV     = Device (was: Device/Head) Register
	DC     = Device Control Register
	ER     = Error register
	ST     = Status register
Powered_Up_Time is measured from power on, and printed as
DDd+hh:mm:SS.sss where DD=days, hh=hours, mm=minutes,
SS=sec, and sss=millisec. It "wraps" after 49.710 days.

Error 11414 [149] occurred at disk power-on lifetime: 2428 hours (101 days + 4 hours)
  When the command that caused the error occurred, the device was active or idle.

  After command completion occurred, registers were:
  ER -- ST COUNT  LBA_48  LH LM LL DV DC
  -- -- -- == -- == == == -- -- -- -- --
  40 -- 41 00 92 00 00 02 ec 82 b4 40 00  Error: UNC at LBA = 0x02ec82b4 = 49054388

  Commands leading to the command that caused the error were:
  CR FEATR COUNT  LBA_48  LH LM LL DV DC  Powered_Up_Time  Command/Feature_Name
  -- == -- == -- == == == -- -- -- -- --  ---------------  --------------------
  60 00 20 00 98 00 00 1a 01 e9 c0 40 00     00:00:45.295  READ FPDMA QUEUED
  60 00 20 00 90 00 00 02 ec 82 a0 40 00     00:00:45.284  READ FPDMA QUEUED
  60 00 20 00 88 00 00 1a 01 e9 a0 40 00     00:00:45.283  READ FPDMA QUEUED
  ec 00 00 00 00 00 00 00 00 00 00 40 00     00:00:45.277  IDENTIFY DEVICE
  aa aa aa aa aa aa aa aa aa aa aa aa ff     00:00:42.120  [RESERVED]

Error 11413 [148] occurred at disk power-on lifetime: 2428 hours (101 days + 4 hours)
  When the command that caused the error occurred, the device was active or idle.

  After command completion occurred, registers were:
  ER -- ST COUNT  LBA_48  LH LM LL DV DC
  -- -- -- == -- == == == -- -- -- -- --
  40 -- 41 00 72 00 00 02 ec 82 b4 40 00  Error: UNC at LBA = 0x02ec82b4 = 49054388

  Commands leading to the command that caused the error were:
  CR FEATR COUNT  LBA_48  LH LM LL DV DC  Powered_Up_Time  Command/Feature_Name
  -- == -- == -- == == == -- -- -- -- --  ---------------  --------------------
  60 00 20 00 78 00 00 1a 01 e9 a0 40 00     00:00:42.120  READ FPDMA QUEUED
  60 00 20 00 70 00 00 02 ec 82 a0 40 00     00:00:42.110  READ FPDMA QUEUED
  60 00 20 00 68 00 00 1a 01 e9 80 40 00     00:00:42.108  READ FPDMA QUEUED
  ec 00 00 00 00 00 00 00 00 00 00 40 00     00:00:42.102  IDENTIFY DEVICE
  aa aa aa aa aa aa aa aa aa aa aa aa ff     00:00:38.945  [RESERVED]

Error 11412 [147] occurred at disk power-on lifetime: 2428 hours (101 days + 4 hours)
  When the command that caused the error occurred, the device was active or idle.

  After command completion occurred, registers were:
  ER -- ST COUNT  LBA_48  LH LM LL DV DC
  -- -- -- == -- == == == -- -- -- -- --
  40 -- 41 00 52 00 00 02 ec 82 b4 40 00  Error: UNC at LBA = 0x02ec82b4 = 49054388

  Commands leading to the command that caused the error were:
  CR FEATR COUNT  LBA_48  LH LM LL DV DC  Powered_Up_Time  Command/Feature_Name
  -- == -- == -- == == == -- -- -- -- --  ---------------  --------------------
  60 00 20 00 58 00 00 1a 01 e9 80 40 00     00:00:38.945  READ FPDMA QUEUED
  60 00 20 00 50 00 00 02 ec 82 a0 40 00     00:00:38.916  READ FPDMA QUEUED
  60 00 20 00 48 00 00 1a 01 93 00 40 00     00:00:38.915  READ FPDMA QUEUED
  ec 00 00 00 00 00 00 00 00 00 00 40 00     00:00:38.909  IDENTIFY DEVICE
  aa aa aa aa aa aa aa aa aa aa aa aa ff     00:00:35.754  [RESERVED]

Error 11411 [146] occurred at disk power-on lifetime: 2428 hours (101 days + 4 hours)
  When the command that caused the error occurred, the device was active or idle.

  After command completion occurred, registers were:
  ER -- ST COUNT  LBA_48  LH LM LL DV DC
  -- -- -- == -- == == == -- -- -- -- --
  40 -- 41 00 32 00 00 02 ec 82 b4 40 00  Error: UNC at LBA = 0x02ec82b4 = 49054388

  Commands leading to the command that caused the error were:
  CR FEATR COUNT  LBA_48  LH LM LL DV DC  Powered_Up_Time  Command/Feature_Name
  -- == -- == -- == == == -- -- -- -- --  ---------------  --------------------
  60 00 20 00 38 00 00 1a 01 93 00 40 00     00:00:35.754  READ FPDMA QUEUED
  60 00 20 00 30 00 00 02 ec 82 a0 40 00     00:00:35.752  READ FPDMA QUEUED
  60 00 20 00 28 00 00 19 ff c9 00 40 00     00:00:35.752  READ FPDMA QUEUED
  2f 00 00 00 01 00 00 00 00 00 10 40 00     00:00:32.626  READ LOG EXT
  60 00 20 00 18 00 00 02 ec 82 a0 40 00     00:00:32.626  READ FPDMA QUEUED

Error 11410 [145] occurred at disk power-on lifetime: 2428 hours (101 days + 4 hours)
  When the command that caused the error occurred, the device was active or idle.

  After command completion occurred, registers were:
  ER -- ST COUNT  LBA_48  LH LM LL DV DC
  -- -- -- == -- == == == -- -- -- -- --
  40 -- 41 00 1a 00 00 02 ec 82 b4 40 00  Error: UNC at LBA = 0x02ec82b4 = 49054388

  Commands leading to the command that caused the error were:
  CR FEATR COUNT  LBA_48  LH LM LL DV DC  Powered_Up_Time  Command/Feature_Name
  -- == -- == -- == == == -- -- -- -- --  ---------------  --------------------
  60 00 20 00 18 00 00 02 ec 82 a0 40 00     00:00:32.626  READ FPDMA QUEUED
  60 00 20 00 10 00 00 19 ff c9 00 40 00     00:00:32.626  READ FPDMA QUEUED
  61 00 08 00 08 00 00 00 0a d9 00 40 00     00:00:32.626  WRITE FPDMA QUEUED
  61 00 02 00 00 00 00 00 06 40 f0 40 00     00:00:32.626  WRITE FPDMA QUEUED
  61 00 08 00 f8 00 00 00 0a d0 50 40 00     00:00:32.625  WRITE FPDMA QUEUED

Error 11409 [144] occurred at disk power-on lifetime: 2428 hours (101 days + 4 hours)
  When the command that caused the error occurred, the device was active or idle.

  After command completion occurred, registers were:
  ER -- ST COUNT  LBA_48  LH LM LL DV DC
  -- -- -- == -- == == == -- -- -- -- --
  40 -- 41 00 9a 00 00 02 ec 82 b4 40 00  Error: UNC at LBA = 0x02ec82b4 = 49054388

  Commands leading to the command that caused the error were:
  CR FEATR COUNT  LBA_48  LH LM LL DV DC  Powered_Up_Time  Command/Feature_Name
  -- == -- == -- == == == -- -- -- -- --  ---------------  --------------------
  60 00 20 00 a0 00 00 19 ff c9 00 40 00     00:00:29.227  READ FPDMA QUEUED
  60 00 20 00 98 00 00 02 ec 82 a0 40 00     00:00:29.224  READ FPDMA QUEUED
  61 00 08 00 90 00 00 00 62 1c 30 40 00     00:00:29.217  WRITE FPDMA QUEUED
  60 00 64 00 88 00 00 00 07 16 78 40 00     00:00:29.216  READ FPDMA QUEUED
  60 00 01 00 80 00 00 00 07 16 cc 40 00     00:00:29.215  READ FPDMA QUEUED

Error 11408 [143] occurred at disk power-on lifetime: 2427 hours (101 days + 3 hours)
  When the command that caused the error occurred, the device was active or idle.

  After command completion occurred, registers were:
  ER -- ST COUNT  LBA_48  LH LM LL DV DC
  -- -- -- == -- == == == -- -- -- -- --
  40 -- 41 00 d2 00 00 02 ec 82 b4 40 00  Error: UNC at LBA = 0x02ec82b4 = 49054388

  Commands leading to the command that caused the error were:
  CR FEATR COUNT  LBA_48  LH LM LL DV DC  Powered_Up_Time  Command/Feature_Name
  -- == -- == -- == == == -- -- -- -- --  ---------------  --------------------
  60 00 20 00 d8 00 00 19 ff c9 00 40 00     00:01:03.791  READ FPDMA QUEUED
  60 00 20 00 d0 00 00 02 ec 82 a0 40 00     00:01:03.790  READ FPDMA QUEUED
  60 00 20 00 c8 00 00 19 ff 72 e0 40 00     00:01:03.789  READ FPDMA QUEUED
  2f 00 00 00 01 00 00 00 00 00 10 40 00     00:01:00.689  READ LOG EXT
  60 00 20 00 b8 00 00 02 ec 82 a0 40 00     00:01:00.689  READ FPDMA QUEUED

Error 11407 [142] occurred at disk power-on lifetime: 2427 hours (101 days + 3 hours)
  When the command that caused the error occurred, the device was active or idle.

  After command completion occurred, registers were:
  ER -- ST COUNT  LBA_48  LH LM LL DV DC
  -- -- -- == -- == == == -- -- -- -- --
  40 -- 41 00 ba 00 00 02 ec 82 b4 40 00  Error: UNC at LBA = 0x02ec82b4 = 49054388

  Commands leading to the command that caused the error were:
  CR FEATR COUNT  LBA_48  LH LM LL DV DC  Powered_Up_Time  Command/Feature_Name
  -- == -- == -- == == == -- -- -- -- --  ---------------  --------------------
  60 00 20 00 b8 00 00 02 ec 82 a0 40 00     00:01:00.689  READ FPDMA QUEUED
  60 00 20 00 b0 00 00 19 ff 72 e0 40 00     00:01:00.689  READ FPDMA QUEUED
  61 00 08 00 a8 00 00 00 0a d9 00 40 00     00:01:00.688  WRITE FPDMA QUEUED
  61 00 02 00 a0 00 00 00 06 40 e8 40 00     00:01:00.688  WRITE FPDMA QUEUED
  61 00 08 00 98 00 00 00 0a d0 50 40 00     00:01:00.688  WRITE FPDMA QUEUED

SMART Extended Self-test Log Version: 1 (1 sectors)
No self-tests have been logged.  [To run self-tests, use: smartctl -t]

SMART Selective self-test log data structure revision number 1
 SPAN  MIN_LBA  MAX_LBA  CURRENT_TEST_STATUS
    1        0        0  Not_testing
    2        0        0  Not_testing
    3        0        0  Not_testing
    4        0        0  Not_testing
    5        0        0  Not_testing
Selective self-test flags (0x0):
  After scanning selected spans, do NOT read-scan remainder of disk.
If Selective self-test is pending on power-up, resume after 0 minute delay.

SCT Status Version:                  2
SCT Version (vendor specific):       1 (0x0001)
SCT Support Level:                   1
Device State:                        Active (0)
Current Temperature:                    43 Celsius
Power Cycle Min/Max Temperature:     22/43 Celsius
Lifetime    Min/Max Temperature:      3/62 Celsius
Under/Over Temperature Limit Count:   0/884

SCT Temperature History Version:     2
Temperature Sampling Period:         1 minute
Temperature Logging Interval:        1 minute
Min/Max recommended Temperature:      5/55 Celsius
Min/Max Temperature Limit:            5/55 Celsius
Temperature History Size (Index):    478 (330)

SCT Error Recovery Control command not supported

Device Statistics (GP/SMART Log 0x04) not supported

SATA Phy Event Counters (GP Log 0x11)
ID      Size     Value  Description
0x0001  4            0  Command failed due to ICRC error
0x0008  4            0  Device-to-host non-data FIS retries
0x000a  4            0  Device-to-host register FISes sent due to a COMRESET
0x000b  4            0  CRC errors within host-to-device FIS
0x000d  4            0  Non-CRC errors within host-to-device FIS

