=== START OF INFORMATION SECTION ===
Model Family:     Seagate Barracuda Green (AF)
Device Model:     ST1500DL003-9VT16L
Serial Number:    --
LU WWN Device Id: 5 000c50 ...
Firmware Version: CC32
User Capacity:    1.500.301.910.016 bytes [1,50 TB]
Sector Size:      512 bytes logical/physical
Rotation Rate:    5900 rpm
Device is:        In smartctl database [for details use: -P show]
ATA Version is:   ATA8-ACS T13/1699-D revision 4
SATA Version is:  SATA 3.0, 6.0 Gb/s (current: 6.0 Gb/s)
Local Time is:    Sun May 29 23:45:15 2016 CEST
SMART support is: Available - device has SMART capability.
SMART support is: Enabled
AAM level is:     0 (vendor specific), recommended: 254
APM feature is:   Unavailable
Rd look-ahead is: Enabled
Write cache is:   Enabled
ATA Security is:  Disabled, frozen [SEC2]
Wt Cache Reorder: Enabled

=== START OF READ SMART DATA SECTION ===
SMART overall-health self-assessment test result: PASSED

General SMART Values:
Offline data collection status:  (0x82)	Offline data collection activity
					was completed without error.
					Auto Offline Data Collection: Enabled.
Self-test execution status:      (   0)	The previous self-test routine completed
					without error or no self-test has ever 
					been run.
Total time to complete Offline 
data collection: 		(  623) seconds.
Offline data collection
capabilities: 			 (0x7b) SMART execute Offline immediate.
					Auto Offline data collection on/off support.
					Suspend Offline collection upon new
					command.
					Offline surface scan supported.
					Self-test supported.
					Conveyance Self-test supported.
					Selective Self-test supported.
SMART capabilities:            (0x0003)	Saves SMART data before entering
					power-saving mode.
					Supports SMART auto save timer.
Error logging capability:        (0x01)	Error logging supported.
					General Purpose Logging supported.
Short self-test routine 
recommended polling time: 	 (   1) minutes.
Extended self-test routine
recommended polling time: 	 ( 281) minutes.
Conveyance self-test routine
recommended polling time: 	 (   2) minutes.
SCT capabilities: 	       (0x30b7)	SCT Status supported.
					SCT Feature Control supported.
					SCT Data Table supported.

SMART Attributes Data Structure revision number: 10
Vendor Specific SMART Attributes with Thresholds:
ID# ATTRIBUTE_NAME          FLAGS    VALUE WORST THRESH FAIL RAW_VALUE
  1 Raw_Read_Error_Rate     POSR--   105   099   006    -    18936
  3 Spin_Up_Time            PO----   093   092   000    -    0
  4 Start_Stop_Count        -O--CK   099   099   020    -    1549
  5 Reallocated_Sector_Ct   PO--CK   100   100   036    -    0
  7 Seek_Error_Rate         POSR--   078   060   030    -    8723013442
  9 Power_On_Hours          -O--CK   095   095   000    -    5155
 10 Spin_Retry_Count        PO--C-   100   100   097    -    0
 12 Power_Cycle_Count       -O--CK   099   099   020    -    1477
183 Runtime_Bad_Block       -O--CK   100   100   000    -    0
184 End-to-End_Error        -O--CK   100   100   099    -    0
187 Reported_Uncorrect      -O--CK   086   086   000    -    14
188 Command_Timeout         -O--CK   100   093   000    -    17180131854
189 High_Fly_Writes         -O-RCK   100   100   000    -    0
190 Airflow_Temperature_Cel -O---K   060   054   045    -    40 (Min/Max 38/40)
191 G-Sense_Error_Rate      -O--CK   100   100   000    -    0
192 Power-Off_Retract_Count -O--CK   100   100   000    -    373
193 Load_Cycle_Count        -O--CK   100   100   000    -    1603
194 Temperature_Celsius     -O---K   040   046   000    -    40 (0 11 0 0 0)
195 Hardware_ECC_Recovered  -O-RC-   028   012   000    -    18936
197 Current_Pending_Sector  -O--C-   100   100   000    -    0
198 Offline_Uncorrectable   ----C-   100   100   000    -    0
199 UDMA_CRC_Error_Count    -OSRCK   200   200   000    -    0
240 Head_Flying_Hours       ------   100   253   000    -    5224 (126 77 0)
241 Total_LBAs_Written      ------   100   253   000    -    2945170255
242 Total_LBAs_Read         ------   100   253   000    -    4055984453
                            ||||||_ K auto-keep
                            |||||__ C event count
                            ||||___ R error rate
                            |||____ S speed/performance
                            ||_____ O updated online
                            |______ P prefailure warning

General Purpose Log Directory Version 1
SMART           Log Directory Version 1 [multi-sector log support]
Address    Access  R/W   Size  Description
0x00       GPL,SL  R/O      1  Log Directory
0x01           SL  R/O      1  Summary SMART error log
0x02           SL  R/O      5  Comprehensive SMART error log
0x03       GPL     R/O      5  Ext. Comprehensive SMART error log
0x06           SL  R/O      1  SMART self-test log
0x07       GPL     R/O      1  Extended self-test log
0x09           SL  R/W      1  Selective self-test log
0x10       GPL     R/O      1  SATA NCQ Queued Error log
0x11       GPL     R/O      1  SATA Phy Event Counters log
0x21       GPL     R/O      1  Write stream error log
0x22       GPL     R/O      1  Read stream error log
0x80-0x9f  GPL,SL  R/W     16  Host vendor specific log
0xa1       GPL,SL  VS      20  Device vendor specific log
0xa2       GPL     VS    2248  Device vendor specific log
0xa8       GPL,SL  VS      20  Device vendor specific log
0xa9       GPL,SL  VS       1  Device vendor specific log
0xab       GPL     VS       1  Device vendor specific log
0xb0       GPL     VS    2819  Device vendor specific log
0xbd       GPL     VS     252  Device vendor specific log
0xbe-0xbf  GPL     VS   65535  Device vendor specific log
0xc0       GPL,SL  VS       1  Device vendor specific log
0xe0       GPL,SL  R/W      1  SCT Command/Status
0xe1       GPL,SL  R/W      1  SCT Data Transfer

SMART Extended Comprehensive Error Log Version: 1 (5 sectors)
Device Error Count: 13
	CR     = Command Register
	FEATR  = Features Register
	COUNT  = Count (was: Sector Count) Register
	LBA_48 = Upper bytes of LBA High/Mid/Low Registers ]  ATA-8
	LH     = LBA High (was: Cylinder High) Register    ]   LBA
	LM     = LBA Mid (was: Cylinder Low) Register      ] Register
	LL     = LBA Low (was: Sector Number) Register     ]
	DV     = Device (was: Device/Head) Register
	DC     = Device Control Register
	ER     = Error register
	ST     = Status register
Powered_Up_Time is measured from power on, and printed as
DDd+hh:mm:SS.sss where DD=days, hh=hours, mm=minutes,
SS=sec, and sss=millisec. It "wraps" after 49.710 days.

Error 13 [12] occurred at disk power-on lifetime: 2240 hours (93 days + 8 hours)
  When the command that caused the error occurred, the device was active or idle.

  After command completion occurred, registers were:
  ER -- ST COUNT  LBA_48  LH LM LL DV DC
  -- -- -- == -- == == == -- -- -- -- --
  40 -- 51 00 00 00 00 02 a4 50 a8 00 00  Error: UNC at LBA = 0x02a450a8 = 44322984

  Commands leading to the command that caused the error were:
  CR FEATR COUNT  LBA_48  LH LM LL DV DC  Powered_Up_Time  Command/Feature_Name
  -- == -- == -- == == == -- -- -- -- --  ---------------  --------------------
  25 00 03 00 80 00 00 02 a4 50 30 40 00     00:02:06.067  READ DMA EXT
  25 00 03 00 08 00 00 02 a4 50 a0 40 00     00:02:06.067  READ DMA EXT
  25 00 03 00 80 00 00 02 a4 50 b0 40 00     00:02:06.066  READ DMA EXT
  25 00 03 00 80 00 00 02 a4 50 30 40 00     00:02:02.722  READ DMA EXT
  25 00 03 00 80 00 00 02 a4 50 20 40 00     00:02:02.711  READ DMA EXT

Error 12 [11] occurred at disk power-on lifetime: 2240 hours (93 days + 8 hours)
  When the command that caused the error occurred, the device was active or idle.

  After command completion occurred, registers were:
  ER -- ST COUNT  LBA_48  LH LM LL DV DC
  -- -- -- == -- == == == -- -- -- -- --
  40 -- 51 00 00 00 00 02 a4 50 a8 00 00  Error: UNC at LBA = 0x02a450a8 = 44322984

  Commands leading to the command that caused the error were:
  CR FEATR COUNT  LBA_48  LH LM LL DV DC  Powered_Up_Time  Command/Feature_Name
  -- == -- == -- == == == -- -- -- -- --  ---------------  --------------------
  25 00 03 00 80 00 00 02 a4 50 30 40 00     00:02:02.722  READ DMA EXT
  25 00 03 00 80 00 00 02 a4 50 20 40 00     00:02:02.711  READ DMA EXT
  25 00 03 00 80 00 00 02 a4 50 b0 40 00     00:02:02.571  READ DMA EXT
  25 00 03 00 80 00 00 02 a4 50 30 40 00     00:01:59.256  READ DMA EXT
  25 00 03 00 80 00 00 02 a2 76 b0 40 00     00:01:58.619  READ DMA EXT

Error 11 [10] occurred at disk power-on lifetime: 2240 hours (93 days + 8 hours)
  When the command that caused the error occurred, the device was active or idle.

  After command completion occurred, registers were:
  ER -- ST COUNT  LBA_48  LH LM LL DV DC
  -- -- -- == -- == == == -- -- -- -- --
  40 -- 51 00 00 00 00 02 a4 50 a8 00 00  Error: UNC at LBA = 0x02a450a8 = 44322984

  Commands leading to the command that caused the error were:
  CR FEATR COUNT  LBA_48  LH LM LL DV DC  Powered_Up_Time  Command/Feature_Name
  -- == -- == -- == == == -- -- -- -- --  ---------------  --------------------
  25 00 03 00 80 00 00 02 a4 50 30 40 00     00:01:59.256  READ DMA EXT
  25 00 03 00 80 00 00 02 a2 76 b0 40 00     00:01:58.619  READ DMA EXT
  25 00 03 00 80 00 00 02 a2 76 30 40 00     00:01:58.609  READ DMA EXT
  25 00 03 00 80 00 00 00 63 27 b0 40 00     00:01:58.590  READ DMA EXT
  25 00 03 00 80 00 00 00 63 27 30 40 00     00:01:58.582  READ DMA EXT

Error 10 [9] occurred at disk power-on lifetime: 1718 hours (71 days + 14 hours)
  When the command that caused the error occurred, the device was active or idle.

  After command completion occurred, registers were:
  ER -- ST COUNT  LBA_48  LH LM LL DV DC
  -- -- -- == -- == == == -- -- -- -- --
  40 -- 51 00 00 00 00 02 a4 50 a8 00 00  Error: UNC at LBA = 0x02a450a8 = 44322984

  Commands leading to the command that caused the error were:
  CR FEATR COUNT  LBA_48  LH LM LL DV DC  Powered_Up_Time  Command/Feature_Name
  -- == -- == -- == == == -- -- -- -- --  ---------------  --------------------
  25 00 00 00 80 00 00 02 a4 50 a0 40 00     00:03:00.908  READ DMA EXT
  35 00 00 01 00 00 00 02 a4 4f a0 40 00     00:03:00.906  WRITE DMA EXT
  35 00 00 01 00 00 00 02 a4 4e a0 40 00     00:03:00.905  WRITE DMA EXT
  25 00 00 00 80 00 00 02 a4 50 20 40 00     00:03:00.903  READ DMA EXT
  25 00 00 00 80 00 00 02 a4 4f a0 40 00     00:03:00.902  READ DMA EXT

Error 9 [8] occurred at disk power-on lifetime: 1718 hours (71 days + 14 hours)
  When the command that caused the error occurred, the device was active or idle.

  After command completion occurred, registers were:
  ER -- ST COUNT  LBA_48  LH LM LL DV DC
  -- -- -- == -- == == == -- -- -- -- --
  40 -- 51 00 00 00 00 02 a4 50 a8 00 00  Error: UNC at LBA = 0x02a450a8 = 44322984

  Commands leading to the command that caused the error were:
  CR FEATR COUNT  LBA_48  LH LM LL DV DC  Powered_Up_Time  Command/Feature_Name
  -- == -- == -- == == == -- -- -- -- --  ---------------  --------------------
  25 00 00 00 80 00 00 02 a4 50 a0 40 00     00:02:20.238  READ DMA EXT
  25 00 00 00 80 00 00 02 a4 50 20 40 00     00:02:20.236  READ DMA EXT
  25 00 00 00 80 00 00 02 a4 4f a0 40 00     00:02:20.235  READ DMA EXT
  25 00 00 00 80 00 00 02 a4 4f 20 40 00     00:02:20.235  READ DMA EXT
  25 00 00 00 80 00 00 02 a4 4e a0 40 00     00:02:20.234  READ DMA EXT

Error 8 [7] occurred at disk power-on lifetime: 1577 hours (65 days + 17 hours)
  When the command that caused the error occurred, the device was active or idle.

  After command completion occurred, registers were:
  ER -- ST COUNT  LBA_48  LH LM LL DV DC
  -- -- -- == -- == == == -- -- -- -- --
  40 -- 51 00 00 00 00 02 a4 50 a8 00 00  Error: UNC at LBA = 0x02a450a8 = 44322984

  Commands leading to the command that caused the error were:
  CR FEATR COUNT  LBA_48  LH LM LL DV DC  Powered_Up_Time  Command/Feature_Name
  -- == -- == -- == == == -- -- -- -- --  ---------------  --------------------
  25 00 00 01 00 00 00 02 a4 50 30 e0 00     00:21:31.515  READ DMA EXT
  35 00 00 00 08 00 00 01 89 c2 68 e0 00     00:21:31.514  WRITE DMA EXT
  35 00 00 00 08 00 00 00 63 32 58 e0 00     00:21:31.514  WRITE DMA EXT
  35 00 00 00 08 00 00 02 a4 76 e8 e0 00     00:21:31.514  WRITE DMA EXT
  25 00 00 00 80 00 00 02 a4 50 20 e0 00     00:21:31.513  READ DMA EXT

Error 7 [6] occurred at disk power-on lifetime: 1577 hours (65 days + 17 hours)
  When the command that caused the error occurred, the device was active or idle.

  After command completion occurred, registers were:
  ER -- ST COUNT  LBA_48  LH LM LL DV DC
  -- -- -- == -- == == == -- -- -- -- --
  40 -- 51 00 00 00 00 02 a4 50 a8 00 00  Error: UNC at LBA = 0x02a450a8 = 44322984

  Commands leading to the command that caused the error were:
  CR FEATR COUNT  LBA_48  LH LM LL DV DC  Powered_Up_Time  Command/Feature_Name
  -- == -- == -- == == == -- -- -- -- --  ---------------  --------------------
  25 00 00 01 00 00 00 02 a4 50 30 e0 00     00:21:28.100  READ DMA EXT
  25 00 00 01 00 00 00 02 a4 4f 30 e0 00     00:21:28.099  READ DMA EXT
  25 00 00 01 00 00 00 02 a4 4e 30 e0 00     00:21:28.097  READ DMA EXT
  25 00 00 01 00 00 00 02 a3 df 30 e0 00     00:21:27.962  READ DMA EXT
  25 00 00 01 00 00 00 02 a3 de 30 e0 00     00:21:27.954  READ DMA EXT

Error 6 [5] occurred at disk power-on lifetime: 1182 hours (49 days + 6 hours)
  When the command that caused the error occurred, the device was active or idle.

  After command completion occurred, registers were:
  ER -- ST COUNT  LBA_48  LH LM LL DV DC
  -- -- -- == -- == == == -- -- -- -- --
  40 -- 51 00 00 00 00 02 a4 50 a8 00 00  Error: UNC at LBA = 0x02a450a8 = 44322984

  Commands leading to the command that caused the error were:
  CR FEATR COUNT  LBA_48  LH LM LL DV DC  Powered_Up_Time  Command/Feature_Name
  -- == -- == -- == == == -- -- -- -- --  ---------------  --------------------
  25 00 00 00 01 00 00 02 a4 50 a8 e0 00     03:53:21.831  READ DMA EXT
  35 00 00 00 08 00 00 02 a2 76 b8 e0 00     03:53:21.830  WRITE DMA EXT
  35 00 00 00 08 00 00 00 03 dc 48 e0 00     03:53:21.830  WRITE DMA EXT
  ea 00 00 00 00 a4 50 a7 00 00 00 a0 00     03:53:21.803  FLUSH CACHE EXT
  25 00 00 00 08 00 00 02 a4 50 a0 e0 00     03:53:21.688  READ DMA EXT

SMART Extended Self-test Log Version: 1 (1 sectors)
No self-tests have been logged.  [To run self-tests, use: smartctl -t]

SMART Selective self-test log data structure revision number 1
 SPAN  MIN_LBA  MAX_LBA  CURRENT_TEST_STATUS
    1        0        0  Not_testing
    2        0        0  Not_testing
    3        0        0  Not_testing
    4        0        0  Not_testing
    5        0        0  Not_testing
Selective self-test flags (0x0):
  After scanning selected spans, do NOT read-scan remainder of disk.
If Selective self-test is pending on power-up, resume after 0 minute delay.

SCT Status Version:                  3
SCT Version (vendor specific):       522 (0x020a)
SCT Support Level:                   1
Device State:                        Active (0)
Current Temperature:                    40 Celsius
Power Cycle Min/Max Temperature:     38/40 Celsius
Lifetime    Min/Max Temperature:     11/46 Celsius
Under/Over Temperature Limit Count:   0/0

SCT Temperature History Version:     2
Temperature Sampling Period:         1 minute
Temperature Logging Interval:        59 minutes
Min/Max recommended Temperature:     14/55 Celsius
Min/Max Temperature Limit:           10/60 Celsius
Temperature History Size (Index):    128 (73)

SCT Error Recovery Control command not supported

Device Statistics (GP/SMART Log 0x04) not supported

SATA Phy Event Counters (GP Log 0x11)
ID      Size     Value  Description
0x000a  2            6  Device-to-host register FISes sent due to a COMRESET
0x0001  2            0  Command failed due to ICRC error
0x0003  2            0  R_ERR response for device-to-host data FIS
0x0004  2            0  R_ERR response for host-to-device data FIS
0x0006  2            0  R_ERR response for device-to-host non-data FIS
0x0007  2            0  R_ERR response for host-to-device non-data FIS

