=== START OF INFORMATION SECTION ===
Model Family:     Seagate Barracuda 7200.14 (AF)
Device Model:     ST2000DM001-9YN164
Serial Number:    --
LU WWN Device Id: 5 000c50 ...
Firmware Version: CC4B
User Capacity:    2,000,398,934,016 bytes [2.00 TB]
Sector Sizes:     512 bytes logical, 4096 bytes physical
Rotation Rate:    7200 rpm
Device is:        In smartctl database [for details use: -P show]
ATA Version is:   ATA8-ACS T13/1699-D revision 4
SATA Version is:  SATA 3.0, 6.0 Gb/s (current: 6.0 Gb/s)
Local Time is:    Wed Sep 26 20:43:13 2018 UTC

==> WARNING: A firmware update for this drive may be available,
see the following Seagate web pages:
http://knowledge.seagate.com/articles/en_US/FAQ/207931en
http://knowledge.seagate.com/articles/en_US/FAQ/223651en

SMART support is: Available - device has SMART capability.
SMART support is: Enabled
AAM feature is:   Unavailable
APM level is:     254 (maximum performance)
Rd look-ahead is: Enabled
Write cache is:   Enabled
DSN feature is:   Unavailable
ATA Security is:  Disabled, frozen [SEC2]
Wt Cache Reorder: Unavailable

=== START OF READ SMART DATA SECTION ===
SMART overall-health self-assessment test result: PASSED

General SMART Values:
Offline data collection status:  (0x82)	Offline data collection activity
					was completed without error.
					Auto Offline Data Collection: Enabled.
Self-test execution status:      (   0)	The previous self-test routine completed
					without error or no self-test has ever 
					been run.
Total time to complete Offline 
data collection: 		(  617) seconds.
Offline data collection
capabilities: 			 (0x7b) SMART execute Offline immediate.
					Auto Offline data collection on/off support.
					Suspend Offline collection upon new
					command.
					Offline surface scan supported.
					Self-test supported.
					Conveyance Self-test supported.
					Selective Self-test supported.
SMART capabilities:            (0x0003)	Saves SMART data before entering
					power-saving mode.
					Supports SMART auto save timer.
Error logging capability:        (0x01)	Error logging supported.
					General Purpose Logging supported.
Short self-test routine 
recommended polling time: 	 (   1) minutes.
Extended self-test routine
recommended polling time: 	 ( 270) minutes.
Conveyance self-test routine
recommended polling time: 	 (   2) minutes.
SCT capabilities: 	       (0x3085)	SCT Status supported.

SMART Attributes Data Structure revision number: 10
Vendor Specific SMART Attributes with Thresholds:
ID# ATTRIBUTE_NAME          FLAGS    VALUE WORST THRESH FAIL RAW_VALUE
  1 Raw_Read_Error_Rate     POSR--   118   097   006    -    180939272
  3 Spin_Up_Time            PO----   094   092   000    -    0
  4 Start_Stop_Count        -O--CK   098   098   020    -    2100
  5 Reallocated_Sector_Ct   PO--CK   097   097   036    -    5016
  7 Seek_Error_Rate         POSR--   082   060   030    -    196195797
  9 Power_On_Hours          -O--CK   052   052   000    -    42879
 10 Spin_Retry_Count        PO--C-   100   100   097    -    0
 12 Power_Cycle_Count       -O--CK   100   100   020    -    768
183 Runtime_Bad_Block       -O--CK   099   099   000    -    1
184 End-to-End_Error        -O--CK   100   100   099    -    0
187 Reported_Uncorrect      -O--CK   041   041   000    -    59
188 Command_Timeout         -O--CK   100   099   000    -    5 5 5
189 High_Fly_Writes         -O-RCK   044   044   000    -    56
190 Airflow_Temperature_Cel -O---K   052   049   045    -    48 (Min/Max 24/48)
191 G-Sense_Error_Rate      -O--CK   100   100   000    -    0
192 Power-Off_Retract_Count -O--CK   100   100   000    -    173
193 Load_Cycle_Count        -O--CK   099   099   000    -    2108
194 Temperature_Celsius     -O---K   048   051   000    -    48 (0 13 0 0 0)
197 Current_Pending_Sector  -O--C-   096   093   000    -    664
198 Offline_Uncorrectable   ----C-   096   093   000    -    664
199 UDMA_CRC_Error_Count    -OSRCK   200   200   000    -    0
240 Head_Flying_Hours       ------   100   253   000    -    42466h+20m+20.753s
241 Total_LBAs_Written      ------   100   253   000    -    260133349189234
242 Total_LBAs_Read         ------   100   253   000    -    13101328584081
                            ||||||_ K auto-keep
                            |||||__ C event count
                            ||||___ R error rate
                            |||____ S speed/performance
                            ||_____ O updated online
                            |______ P prefailure warning

General Purpose Log Directory Version 1
SMART           Log Directory Version 1 [multi-sector log support]
Address    Access  R/W   Size  Description
0x00       GPL,SL  R/O      1  Log Directory
0x01           SL  R/O      1  Summary SMART error log
0x02           SL  R/O      5  Comprehensive SMART error log
0x03       GPL     R/O      5  Ext. Comprehensive SMART error log
0x06           SL  R/O      1  SMART self-test log
0x07       GPL     R/O      1  Extended self-test log
0x09           SL  R/W      1  Selective self-test log
0x10       GPL     R/O      1  NCQ Command Error log
0x11       GPL     R/O      1  SATA Phy Event Counters log
0x21       GPL     R/O      1  Write stream error log
0x22       GPL     R/O      1  Read stream error log
0x80-0x9f  GPL,SL  R/W     16  Host vendor specific log
0xa1       GPL,SL  VS      20  Device vendor specific log
0xa2       GPL     VS    4496  Device vendor specific log
0xa8       GPL,SL  VS      20  Device vendor specific log
0xa9       GPL,SL  VS       1  Device vendor specific log
0xab       GPL     VS       1  Device vendor specific log
0xb0       GPL     VS    5067  Device vendor specific log
0xbd       GPL     VS     512  Device vendor specific log
0xbe-0xbf  GPL     VS   65535  Device vendor specific log
0xc0       GPL,SL  VS       1  Device vendor specific log
0xe0       GPL,SL  R/W      1  SCT Command/Status
0xe1       GPL,SL  R/W      1  SCT Data Transfer

SMART Extended Comprehensive Error Log Version: 1 (5 sectors)
Device Error Count: 17
	CR     = Command Register
	FEATR  = Features Register
	COUNT  = Count (was: Sector Count) Register
	LBA_48 = Upper bytes of LBA High/Mid/Low Registers ]  ATA-8
	LH     = LBA High (was: Cylinder High) Register    ]   LBA
	LM     = LBA Mid (was: Cylinder Low) Register      ] Register
	LL     = LBA Low (was: Sector Number) Register     ]
	DV     = Device (was: Device/Head) Register
	DC     = Device Control Register
	ER     = Error register
	ST     = Status register
Powered_Up_Time is measured from power on, and printed as
DDd+hh:mm:SS.sss where DD=days, hh=hours, mm=minutes,
SS=sec, and sss=millisec. It "wraps" after 49.710 days.

Error 17 [16] occurred at disk power-on lifetime: 41813 hours (1742 days + 5 hours)
  When the command that caused the error occurred, the device was active or idle.

  After command completion occurred, registers were:
  ER -- ST COUNT  LBA_48  LH LM LL DV DC
  -- -- -- == -- == == == -- -- -- -- --
  40 -- 51 00 00 00 00 9f 0d 9e a0 00 00  Error: UNC at LBA = 0x9f0d9ea0 = 2668469920

  Commands leading to the command that caused the error were:
  CR FEATR COUNT  LBA_48  LH LM LL DV DC  Powered_Up_Time  Command/Feature_Name
  -- == -- == -- == == == -- -- -- -- --  ---------------  --------------------
  60 00 00 00 08 00 00 9f 0d 9e a0 40 00  5d+03:41:40.357  READ FPDMA QUEUED
  60 00 00 00 08 00 00 9f 0d 9e 98 40 00  5d+03:41:40.340  READ FPDMA QUEUED
  61 00 00 00 08 00 00 9f 0d 9e 98 40 00  5d+03:41:40.340  WRITE FPDMA QUEUED
  ea 00 00 00 00 00 00 00 00 00 00 a0 00  5d+03:41:40.336  FLUSH CACHE EXT
  ec 00 00 00 00 00 00 00 00 00 00 00 00  5d+03:41:40.328  IDENTIFY DEVICE

Error 16 [15] occurred at disk power-on lifetime: 41813 hours (1742 days + 5 hours)
  When the command that caused the error occurred, the device was active or idle.

  After command completion occurred, registers were:
  ER -- ST COUNT  LBA_48  LH LM LL DV DC
  -- -- -- == -- == == == -- -- -- -- --
  40 -- 51 00 00 00 00 9f 0d 9e 98 00 00  Error: UNC at LBA = 0x9f0d9e98 = 2668469912

  Commands leading to the command that caused the error were:
  CR FEATR COUNT  LBA_48  LH LM LL DV DC  Powered_Up_Time  Command/Feature_Name
  -- == -- == -- == == == -- -- -- -- --  ---------------  --------------------
  60 00 00 00 08 00 00 9f 0d 9e 98 40 00  5d+03:41:37.164  READ FPDMA QUEUED
  60 00 00 00 08 00 00 9f 0d 9e 90 40 00  5d+03:41:37.163  READ FPDMA QUEUED
  60 00 00 00 08 00 00 9f 0d 9e 88 40 00  5d+03:41:37.163  READ FPDMA QUEUED
  60 00 00 00 08 00 00 9f 0d 9e 80 40 00  5d+03:41:37.163  READ FPDMA QUEUED
  60 00 00 00 08 00 00 9f 0d 9e 78 40 00  5d+03:41:37.163  READ FPDMA QUEUED

Error 15 [14] occurred at disk power-on lifetime: 41813 hours (1742 days + 5 hours)
  When the command that caused the error occurred, the device was active or idle.

  After command completion occurred, registers were:
  ER -- ST COUNT  LBA_48  LH LM LL DV DC
  -- -- -- == -- == == == -- -- -- -- --
  40 -- 51 00 00 00 00 9f 0d 9e 98 00 00  Error: UNC at LBA = 0x9f0d9e98 = 2668469912

  Commands leading to the command that caused the error were:
  CR FEATR COUNT  LBA_48  LH LM LL DV DC  Powered_Up_Time  Command/Feature_Name
  -- == -- == -- == == == -- -- -- -- --  ---------------  --------------------
  60 00 00 04 00 00 00 9f 0d b7 60 40 00  5d+03:41:33.442  READ FPDMA QUEUED
  60 00 00 04 00 00 00 9f 0d b3 60 40 00  5d+03:41:33.442  READ FPDMA QUEUED
  60 00 00 04 00 00 00 9f 0d af 60 40 00  5d+03:41:33.442  READ FPDMA QUEUED
  60 00 00 04 00 00 00 9f 0d ab 60 40 00  5d+03:41:33.442  READ FPDMA QUEUED
  60 00 00 04 00 00 00 9f 0d a7 60 40 00  5d+03:41:33.442  READ FPDMA QUEUED

Error 14 [13] occurred at disk power-on lifetime: 41813 hours (1742 days + 5 hours)
  When the command that caused the error occurred, the device was active or idle.

  After command completion occurred, registers were:
  ER -- ST COUNT  LBA_48  LH LM LL DV DC
  -- -- -- == -- == == == -- -- -- -- --
  40 -- 51 00 00 00 00 9f 0d 4d 40 00 00  Error: WP at LBA = 0x9f0d4d40 = 2668449088

  Commands leading to the command that caused the error were:
  CR FEATR COUNT  LBA_48  LH LM LL DV DC  Powered_Up_Time  Command/Feature_Name
  -- == -- == -- == == == -- -- -- -- --  ---------------  --------------------
  61 00 00 00 b0 00 00 00 20 b5 10 40 00  5d+03:41:32.486  WRITE FPDMA QUEUED
  61 00 00 00 10 00 00 00 1f 82 08 40 00  5d+03:41:30.602  WRITE FPDMA QUEUED
  60 00 00 00 08 00 00 9f 0d 4d 40 40 00  5d+03:41:30.309  READ FPDMA QUEUED
  60 00 00 00 08 00 00 9f 0d 4d 38 40 00  5d+03:41:30.309  READ FPDMA QUEUED
  60 00 00 00 08 00 00 9f 0d 4d 30 40 00  5d+03:41:30.309  READ FPDMA QUEUED

Error 13 [12] occurred at disk power-on lifetime: 41813 hours (1742 days + 5 hours)
  When the command that caused the error occurred, the device was active or idle.

  After command completion occurred, registers were:
  ER -- ST COUNT  LBA_48  LH LM LL DV DC
  -- -- -- == -- == == == -- -- -- -- --
  40 -- 51 00 00 00 00 9f 0d 2b 88 00 00  Error: UNC at LBA = 0x9f0d2b88 = 2668440456

  Commands leading to the command that caused the error were:
  CR FEATR COUNT  LBA_48  LH LM LL DV DC  Powered_Up_Time  Command/Feature_Name
  -- == -- == -- == == == -- -- -- -- --  ---------------  --------------------
  60 00 00 00 08 00 00 9f 0d 2b 88 40 00  5d+03:41:27.089  READ FPDMA QUEUED
  60 00 00 00 08 00 00 9f 0d 2b 80 40 00  5d+03:41:27.088  READ FPDMA QUEUED
  60 00 00 00 08 00 00 9f 0d 2b 78 40 00  5d+03:41:27.088  READ FPDMA QUEUED
  60 00 00 00 08 00 00 9f 0d 2b 70 40 00  5d+03:41:27.088  READ FPDMA QUEUED
  60 00 00 00 08 00 00 9f 0d 2b 68 40 00  5d+03:41:27.088  READ FPDMA QUEUED

Error 12 [11] occurred at disk power-on lifetime: 41813 hours (1742 days + 5 hours)
  When the command that caused the error occurred, the device was active or idle.

  After command completion occurred, registers were:
  ER -- ST COUNT  LBA_48  LH LM LL DV DC
  -- -- -- == -- == == == -- -- -- -- --
  40 -- 51 00 00 00 00 9f 0d 08 00 00 00  Error: UNC at LBA = 0x9f0d0800 = 2668431360

  Commands leading to the command that caused the error were:
  CR FEATR COUNT  LBA_48  LH LM LL DV DC  Powered_Up_Time  Command/Feature_Name
  -- == -- == -- == == == -- -- -- -- --  ---------------  --------------------
  60 00 00 00 08 00 00 9f 0d 08 00 40 00  5d+03:41:23.870  READ FPDMA QUEUED
  60 00 00 00 08 00 00 9f 0d 07 f8 40 00  5d+03:41:23.870  READ FPDMA QUEUED
  60 00 00 00 08 00 00 9f 0d 07 f0 40 00  5d+03:41:23.869  READ FPDMA QUEUED
  60 00 00 00 08 00 00 9f 0d 07 e8 40 00  5d+03:41:23.869  READ FPDMA QUEUED
  60 00 00 00 08 00 00 9f 0d 07 e0 40 00  5d+03:41:23.869  READ FPDMA QUEUED

Error 11 [10] occurred at disk power-on lifetime: 41813 hours (1742 days + 5 hours)
  When the command that caused the error occurred, the device was active or idle.

  After command completion occurred, registers were:
  ER -- ST COUNT  LBA_48  LH LM LL DV DC
  -- -- -- == -- == == == -- -- -- -- --
  40 -- 51 00 00 00 00 9f 0d 4d 40 00 00  Error: WP at LBA = 0x9f0d4d40 = 2668449088

  Commands leading to the command that caused the error were:
  CR FEATR COUNT  LBA_48  LH LM LL DV DC  Powered_Up_Time  Command/Feature_Name
  -- == -- == -- == == == -- -- -- -- --  ---------------  --------------------
  61 00 00 00 78 00 00 00 20 b3 20 40 00  5d+03:41:20.380  WRITE FPDMA QUEUED
  60 00 00 04 00 00 00 9f 0d 77 60 40 00  5d+03:41:20.318  READ FPDMA QUEUED
  60 00 00 04 00 00 00 9f 0d 73 60 40 00  5d+03:41:20.318  READ FPDMA QUEUED
  60 00 00 04 00 00 00 9f 0d 6f 60 40 00  5d+03:41:20.318  READ FPDMA QUEUED
  60 00 00 04 00 00 00 9f 0d 6b 60 40 00  5d+03:41:20.318  READ FPDMA QUEUED

Error 10 [9] occurred at disk power-on lifetime: 41813 hours (1742 days + 5 hours)
  When the command that caused the error occurred, the device was active or idle.

  After command completion occurred, registers were:
  ER -- ST COUNT  LBA_48  LH LM LL DV DC
  -- -- -- == -- == == == -- -- -- -- --
  40 -- 51 00 00 00 00 9f 0c ff 70 00 00  Error: UNC at LBA = 0x9f0cff70 = 2668429168

  Commands leading to the command that caused the error were:
  CR FEATR COUNT  LBA_48  LH LM LL DV DC  Powered_Up_Time  Command/Feature_Name
  -- == -- == -- == == == -- -- -- -- --  ---------------  --------------------
  60 00 00 00 08 00 00 9f 0c ff 70 40 00  5d+03:41:17.147  READ FPDMA QUEUED
  61 00 00 00 08 00 00 00 1c 0a 88 40 00  5d+03:41:17.147  WRITE FPDMA QUEUED
  61 00 00 00 08 00 00 00 10 79 58 40 00  5d+03:41:17.147  WRITE FPDMA QUEUED
  61 00 00 00 08 00 00 00 08 01 00 40 00  5d+03:41:17.147  WRITE FPDMA QUEUED
  60 00 00 00 08 00 00 9f 0c ff 68 40 00  5d+03:41:17.147  READ FPDMA QUEUED

SMART Extended Self-test Log Version: 1 (1 sectors)
No self-tests have been logged.  [To run self-tests, use: smartctl -t]

SMART Selective self-test log data structure revision number 1
 SPAN  MIN_LBA  MAX_LBA  CURRENT_TEST_STATUS
    1        0        0  Not_testing
    2        0        0  Not_testing
    3        0        0  Not_testing
    4        0        0  Not_testing
    5        0        0  Not_testing
Selective self-test flags (0x0):
  After scanning selected spans, do NOT read-scan remainder of disk.
If Selective self-test is pending on power-up, resume after 0 minute delay.

SCT Status Version:                  3
SCT Version (vendor specific):       522 (0x020a)
SCT Support Level:                   1
Device State:                        Active (0)
Current Temperature:                    48 Celsius
Power Cycle Min/Max Temperature:     24/48 Celsius
Lifetime    Min/Max Temperature:     13/50 Celsius
Under/Over Temperature Limit Count:   0/0

SCT Data Table command not supported

SCT Error Recovery Control command not supported

Device Statistics (GP/SMART Log 0x04) not supported

Pending Defects log (GP Log 0x0c) not supported

SATA Phy Event Counters (GP Log 0x11)
ID      Size     Value  Description
0x000a  2           14  Device-to-host register FISes sent due to a COMRESET
0x0001  2            0  Command failed due to ICRC error
0x0003  2            0  R_ERR response for device-to-host data FIS
0x0004  2            0  R_ERR response for host-to-device data FIS
0x0006  2            0  R_ERR response for device-to-host non-data FIS
0x0007  2            0  R_ERR response for host-to-device non-data FIS

