smartctl 7.2 2020-12-30 r5155 [x86_64-linux-6.2.6-76060206-generic] (local build)
Copyright (C) 2002-20, Bruce Allen, Christian Franke, www.smartmontools.org

=== START OF INFORMATION SECTION ===
Model Number:                       Lexar SSD NM800PRO 1TB
Serial Number:                      --
Firmware Version:                   3.7.F.V
PCI Vendor/Subsystem ID:            0x1d97
IEEE OUI Identifier:                0xcaf25b
Total NVM Capacity:                 1,024,209,543,168 [1.02 TB]
Unallocated NVM Capacity:           0
Controller ID:                      0
NVMe Version:                       1.4
Number of Namespaces:               1
Namespace 1 Size/Capacity:          1,024,209,543,168 [1.02 TB]
Namespace 1 Formatted LBA Size:     512
Namespace 1 IEEE EUI-64:            caf25b ...
Local Time is:                      Thu May 11 13:12:21 2023 CEST
Firmware Updates (0x0e):            7 Slots
Optional Admin Commands (0x0017):   Security Format Frmw_DL Self_Test
Optional NVM Commands (0x0014):     DS_Mngmt Sav/Sel_Feat
Log Page Attributes (0x0e):         Cmd_Eff_Lg Ext_Get_Lg Telmtry_Lg
Maximum Data Transfer Size:         512 Pages
Warning  Comp. Temp. Threshold:     90 Celsius
Critical Comp. Temp. Threshold:     95 Celsius

Supported Power States
St Op     Max   Active     Idle   RL RT WL WT  Ent_Lat  Ex_Lat
 0 +     3.50W       -        -    0  0  0  0        5       5
 1 +     3.30W       -        -    1  1  1  1       50     100
 2 +     2.80W       -        -    2  2  2  2       50     200
 3 -   0.1500W       -        -    3  3  3  3      500    5000
 4 -   0.0080W       -        -    4  4  4  4     2000   60000

Supported LBA Sizes (NSID 0x1)
Id Fmt  Data  Metadt  Rel_Perf
 0 +     512       0         0

=== START OF SMART DATA SECTION ===
SMART overall-health self-assessment test result: PASSED

SMART/Health Information (NVMe Log 0x02)
Critical Warning:                   0x00
Temperature:                        38 Celsius
Available Spare:                    100%
Available Spare Threshold:          25%
Percentage Used:                    0%
Data Units Read:                    1,660,449 [850 GB]
Data Units Written:                 1,646,753 [843 GB]
Host Read Commands:                 12,833,476
Host Write Commands:                12,476,013
Controller Busy Time:               0
Power Cycles:                       18
Power On Hours:                     3
Unsafe Shutdowns:                   0
Media and Data Integrity Errors:    0
Error Information Log Entries:      0
Warning  Comp. Temperature Time:    0
Critical Comp. Temperature Time:    0
Temperature Sensor 1:               50 Celsius
Temperature Sensor 2:               40 Celsius
Temperature Sensor 3:               38 Celsius
Thermal Temp. 2 Transition Count:   16

Read 16 entries from Error Information Log failed: NVMe Status 0x13

