smartctl 7.2 2020-12-30 r5155 [x86_64-linux-5.10.0-23-amd64] (local build)
Copyright (C) 2002-20, Bruce Allen, Christian Franke, www.smartmontools.org

=== START OF INFORMATION SECTION ===
Model Number:                       Dell Ent NVMe AGN MU AIC 1.6TB
Serial Number:                      --
Firmware Version:                   2.0.2
PCI Vendor ID:                      0x144d
PCI Vendor Subsystem ID:            0x1028
IEEE OUI Identifier:                0x002538
Total NVM Capacity:                 1,600,321,314,816 [1.60 TB]
Unallocated NVM Capacity:           0
Controller ID:                      65
NVMe Version:                       1.3
Number of Namespaces:               32
Namespace 1 Size/Capacity:          1,600,321,314,816 [1.60 TB]
Namespace 1 Formatted LBA Size:     512
Namespace 1 IEEE EUI-64:            002538 ...
Local Time is:                      Sun Jul 23 16:11:21 2023 CEST
Firmware Updates (0x17):            3 Slots, Slot 1 R/O, no Reset required
Optional Admin Commands (0x005e):   Format Frmw_DL NS_Mngmt Self_Test MI_Snd/Rec
Optional NVM Commands (0x007f):     Comp Wr_Unc DS_Mngmt Wr_Zero Sav/Sel_Feat Resv Timestmp
Log Page Attributes (0x0e):         Cmd_Eff_Lg Ext_Get_Lg Telmtry_Lg
Maximum Data Transfer Size:         256 Pages
Warning  Comp. Temp. Threshold:     70 Celsius
Critical Comp. Temp. Threshold:     77 Celsius

Supported Power States
St Op     Max   Active     Idle   RL RT WL WT  Ent_Lat  Ex_Lat
 0 +    25.00W   14.00W       -    0  0  0  0      180     180

Supported LBA Sizes (NSID 0x1)
Id Fmt  Data  Metadt  Rel_Perf
 0 -     512       0         1
 1 -     512       8         3
 2 -    4096       0         0
 3 -    4096       8         2
 4 -    4096      64         3

=== START OF SMART DATA SECTION ===
SMART overall-health self-assessment test result: PASSED

SMART/Health Information (NVMe Log 0x02)
Critical Warning:                   0x00
Temperature:                        48 Celsius
Available Spare:                    100%
Available Spare Threshold:          10%
Percentage Used:                    1%
Data Units Read:                    8,944,898 [4.57 TB]
Data Units Written:                 529,086,043 [270 TB]
Host Read Commands:                 109,951,296
Host Write Commands:                3,253,244,011
Controller Busy Time:               3,073
Power Cycles:                       10
Power On Hours:                     10,368
Unsafe Shutdowns:                   5
Media and Data Integrity Errors:    0
Error Information Log Entries:      0
Warning  Comp. Temperature Time:    0
Critical Comp. Temperature Time:    0
Temperature Sensor 1:               48 Celsius
Temperature Sensor 2:               47 Celsius
Temperature Sensor 3:               46 Celsius

Error Information (NVMe Log 0x01, 16 of 256 entries)
No Errors Logged

