=== START OF INFORMATION SECTION ===
Model Family:     Western Digital Blue
Device Model:     WDC WD5000AAKX-001CA0
Serial Number:    --
LU WWN Device Id: 5 0014ee ...
Firmware Version: 15.01H15
User Capacity:    500 107 862 016 bytes [500 GB]
Sector Size:      512 bytes logical/physical
Device is:        In smartctl database [for details use: -P show]
ATA Version is:   ATA8-ACS (minor revision not indicated)
SATA Version is:  SATA 3.0, 6.0 Gb/s (current: 3.0 Gb/s)
Local Time is:    Wed Apr  5 07:49:07 2017 +05
SMART support is: Available - device has SMART capability.
SMART support is: Enabled
AAM feature is:   Unavailable
APM feature is:   Unavailable
Rd look-ahead is: Enabled
Write cache is:   Enabled
ATA Security is:  Disabled, NOT FROZEN [SEC1]
Wt Cache Reorder: Enabled

=== START OF READ SMART DATA SECTION ===
SMART overall-health self-assessment test result: PASSED

General SMART Values:
Offline data collection status:  (0x82)	Offline data collection activity
					was completed without error.
					Auto Offline Data Collection: Enabled.
Self-test execution status:      (   0)	The previous self-test routine completed
					without error or no self-test has ever 
					been run.
Total time to complete Offline 
data collection: 		( 9180) seconds.
Offline data collection
capabilities: 			 (0x7b) SMART execute Offline immediate.
					Auto Offline data collection on/off support.
					Suspend Offline collection upon new
					command.
					Offline surface scan supported.
					Self-test supported.
					Conveyance Self-test supported.
					Selective Self-test supported.
SMART capabilities:            (0x0003)	Saves SMART data before entering
					power-saving mode.
					Supports SMART auto save timer.
Error logging capability:        (0x01)	Error logging supported.
					General Purpose Logging supported.
Short self-test routine 
recommended polling time: 	 (   2) minutes.
Extended self-test routine
recommended polling time: 	 (  93) minutes.
Conveyance self-test routine
recommended polling time: 	 (   5) minutes.
SCT capabilities: 	       (0x3037)	SCT Status supported.
					SCT Feature Control supported.
					SCT Data Table supported.

SMART Attributes Data Structure revision number: 16
Vendor Specific SMART Attributes with Thresholds:
ID# ATTRIBUTE_NAME          FLAGS    VALUE WORST THRESH FAIL RAW_VALUE
  1 Raw_Read_Error_Rate     POSR-K   197   197   051    -    24630
  3 Spin_Up_Time            POS--K   138   136   021    -    4075
  4 Start_Stop_Count        -O--CK   100   100   000    -    784
  5 Reallocated_Sector_Ct   PO--CK   200   200   140    -    0
  7 Seek_Error_Rate         -OSR-K   100   253   000    -    0
  9 Power_On_Hours          -O--CK   091   091   000    -    6580
 10 Spin_Retry_Count        -O--CK   100   100   000    -    0
 11 Calibration_Retry_Count -O--CK   100   100   000    -    0
 12 Power_Cycle_Count       -O--CK   100   100   000    -    781
192 Power-Off_Retract_Count -O--CK   200   200   000    -    78
193 Load_Cycle_Count        -O--CK   200   200   000    -    705
194 Temperature_Celsius     -O---K   112   078   000    -    31
196 Reallocated_Event_Count -O--CK   200   200   000    -    0
197 Current_Pending_Sector  -O--CK   200   200   000    -    0
198 Offline_Uncorrectable   ----CK   200   200   000    -    0
199 UDMA_CRC_Error_Count    -O--CK   200   200   000    -    0
200 Multi_Zone_Error_Rate   ---R--   200   200   000    -    0
                            ||||||_ K auto-keep
                            |||||__ C event count
                            ||||___ R error rate
                            |||____ S speed/performance
                            ||_____ O updated online
                            |______ P prefailure warning

General Purpose Log Directory Version 1
SMART           Log Directory Version 1 [multi-sector log support]
Address    Access  R/W   Size  Description
0x00       GPL,SL  R/O      1  Log Directory
0x01           SL  R/O      1  Summary SMART error log
0x02           SL  R/O      5  Comprehensive SMART error log
0x03       GPL     R/O      6  Ext. Comprehensive SMART error log
0x06           SL  R/O      1  SMART self-test log
0x07       GPL     R/O      1  Extended self-test log
0x09           SL  R/W      1  Selective self-test log
0x10       GPL     R/O      1  SATA NCQ Queued Error log
0x11       GPL     R/O      1  SATA Phy Event Counters log
0x80-0x9f  GPL,SL  R/W     16  Host vendor specific log
0xa0-0xa7  GPL,SL  VS      16  Device vendor specific log
0xa8-0xb5  GPL,SL  VS       1  Device vendor specific log
0xb6       GPL     VS       1  Device vendor specific log
0xb7       GPL,SL  VS       1  Device vendor specific log
0xbd       GPL,SL  VS       1  Device vendor specific log
0xc0       GPL,SL  VS       1  Device vendor specific log
0xc1       GPL     VS      24  Device vendor specific log
0xe0       GPL,SL  R/W      1  SCT Command/Status
0xe1       GPL,SL  R/W      1  SCT Data Transfer

SMART Extended Comprehensive Error Log Version: 1 (6 sectors)
Device Error Count: 24630 (device log contains only the most recent 24 errors)
	CR     = Command Register
	FEATR  = Features Register
	COUNT  = Count (was: Sector Count) Register
	LBA_48 = Upper bytes of LBA High/Mid/Low Registers ]  ATA-8
	LH     = LBA High (was: Cylinder High) Register    ]   LBA
	LM     = LBA Mid (was: Cylinder Low) Register      ] Register
	LL     = LBA Low (was: Sector Number) Register     ]
	DV     = Device (was: Device/Head) Register
	DC     = Device Control Register
	ER     = Error register
	ST     = Status register
Powered_Up_Time is measured from power on, and printed as
DDd+hh:mm:SS.sss where DD=days, hh=hours, mm=minutes,
SS=sec, and sss=millisec. It "wraps" after 49.710 days.

Error 24630 [5] occurred at disk power-on lifetime: 6412 hours (267 days + 4 hours)
  When the command that caused the error occurred, the device was active or idle.

  After command completion occurred, registers were:
  ER -- ST COUNT  LBA_48  LH LM LL DV DC
  -- -- -- == -- == == == -- -- -- -- --
  01 -- 51 00 00 00 00 02 52 9e fa 40 00  Error: AMNF at LBA = 0x02529efa = 38969082

  Commands leading to the command that caused the error were:
  CR FEATR COUNT  LBA_48  LH LM LL DV DC  Powered_Up_Time  Command/Feature_Name
  -- == -- == -- == == == -- -- -- -- --  ---------------  --------------------
  60 00 08 00 08 00 00 02 52 9e f8 40 08     08:32:28.645  READ FPDMA QUEUED
  60 00 08 00 00 00 00 02 52 9e f0 40 08     08:32:28.645  READ FPDMA QUEUED
  60 00 08 00 f0 00 00 02 52 9e e8 40 08     08:32:28.645  READ FPDMA QUEUED
  60 00 08 00 e8 00 00 02 52 9e e0 40 08     08:32:28.645  READ FPDMA QUEUED
  60 00 08 00 e0 00 00 02 52 9e d8 40 08     08:32:28.645  READ FPDMA QUEUED

Error 24629 [4] occurred at disk power-on lifetime: 6412 hours (267 days + 4 hours)
  When the command that caused the error occurred, the device was active or idle.

  After command completion occurred, registers were:
  ER -- ST COUNT  LBA_48  LH LM LL DV DC
  -- -- -- == -- == == == -- -- -- -- --
  01 -- 51 00 00 00 00 02 52 9e fa 40 00  Error: AMNF at LBA = 0x02529efa = 38969082

  Commands leading to the command that caused the error were:
  CR FEATR COUNT  LBA_48  LH LM LL DV DC  Powered_Up_Time  Command/Feature_Name
  -- == -- == -- == == == -- -- -- -- --  ---------------  --------------------
  60 02 00 00 70 00 00 02 52 9e 00 40 08     08:32:26.619  READ FPDMA QUEUED
  60 02 00 00 68 00 00 02 52 9c 00 40 08     08:32:26.616  READ FPDMA QUEUED
  60 02 00 00 60 00 00 02 52 9a 00 40 08     08:32:26.614  READ FPDMA QUEUED
  60 02 00 00 58 00 00 02 52 98 00 40 08     08:32:26.612  READ FPDMA QUEUED
  60 02 00 00 50 00 00 02 52 96 00 40 08     08:32:26.610  READ FPDMA QUEUED

Error 24628 [3] occurred at disk power-on lifetime: 6395 hours (266 days + 11 hours)
  When the command that caused the error occurred, the device was active or idle.

  After command completion occurred, registers were:
  ER -- ST COUNT  LBA_48  LH LM LL DV DC
  -- -- -- == -- == == == -- -- -- -- --
  01 -- 51 00 00 00 00 02 52 9e fa 40 00  Error: AMNF at LBA = 0x02529efa = 38969082

  Commands leading to the command that caused the error were:
  CR FEATR COUNT  LBA_48  LH LM LL DV DC  Powered_Up_Time  Command/Feature_Name
  -- == -- == -- == == == -- -- -- -- --  ---------------  --------------------
  60 00 40 00 88 00 00 02 52 9e f8 40 00     01:24:04.080  READ FPDMA QUEUED
  60 01 00 00 80 00 00 03 b9 2e 68 40 00     01:24:04.080  READ FPDMA QUEUED
  60 01 00 00 78 00 00 03 b9 2d 68 40 00     01:24:04.080  READ FPDMA QUEUED
  60 01 00 00 70 00 00 03 b9 2c 68 40 00     01:24:04.080  READ FPDMA QUEUED
  60 01 00 00 68 00 00 03 b9 2b 68 40 00     01:24:04.079  READ FPDMA QUEUED

Error 24627 [2] occurred at disk power-on lifetime: 6395 hours (266 days + 11 hours)
  When the command that caused the error occurred, the device was active or idle.

  After command completion occurred, registers were:
  ER -- ST COUNT  LBA_48  LH LM LL DV DC
  -- -- -- == -- == == == -- -- -- -- --
  01 -- 51 00 00 00 00 02 52 9e fa 40 00  Error: AMNF at LBA = 0x02529efa = 38969082

  Commands leading to the command that caused the error were:
  CR FEATR COUNT  LBA_48  LH LM LL DV DC  Powered_Up_Time  Command/Feature_Name
  -- == -- == -- == == == -- -- -- -- --  ---------------  --------------------
  60 00 40 00 38 00 00 02 52 9e f8 40 00     01:24:02.065  READ FPDMA QUEUED
  60 00 40 00 30 00 00 00 24 a8 64 40 00     01:24:02.065  READ FPDMA QUEUED
  60 01 00 00 28 00 00 03 b9 29 68 40 00     01:24:02.065  READ FPDMA QUEUED
  60 01 00 00 20 00 00 03 b9 2a 68 40 00     01:24:02.065  READ FPDMA QUEUED
  60 01 00 00 18 00 00 03 b9 2b 68 40 00     01:24:02.064  READ FPDMA QUEUED

Error 24626 [1] occurred at disk power-on lifetime: 6395 hours (266 days + 11 hours)
  When the command that caused the error occurred, the device was active or idle.

  After command completion occurred, registers were:
  ER -- ST COUNT  LBA_48  LH LM LL DV DC
  -- -- -- == -- == == == -- -- -- -- --
  01 -- 51 00 00 00 00 02 52 9e fa 40 00  Error: AMNF at LBA = 0x02529efa = 38969082

  Commands leading to the command that caused the error were:
  CR FEATR COUNT  LBA_48  LH LM LL DV DC  Powered_Up_Time  Command/Feature_Name
  -- == -- == -- == == == -- -- -- -- --  ---------------  --------------------
  60 01 00 00 b0 00 00 03 b9 2b 68 40 00     01:24:00.054  READ FPDMA QUEUED
  60 01 00 00 a8 00 00 03 b9 2a 68 40 00     01:24:00.054  READ FPDMA QUEUED
  60 01 00 00 a0 00 00 03 b9 29 68 40 00     01:24:00.054  READ FPDMA QUEUED
  60 00 40 00 98 00 00 02 52 9e f8 40 00     01:24:00.034  READ FPDMA QUEUED
  60 01 00 00 90 00 00 03 bb b8 68 40 00     01:24:00.034  READ FPDMA QUEUED

Error 24625 [0] occurred at disk power-on lifetime: 6395 hours (266 days + 11 hours)
  When the command that caused the error occurred, the device was active or idle.

  After command completion occurred, registers were:
  ER -- ST COUNT  LBA_48  LH LM LL DV DC
  -- -- -- == -- == == == -- -- -- -- --
  01 -- 51 00 00 00 00 02 52 9e fa 40 00  Error: AMNF at LBA = 0x02529efa = 38969082

  Commands leading to the command that caused the error were:
  CR FEATR COUNT  LBA_48  LH LM LL DV DC  Powered_Up_Time  Command/Feature_Name
  -- == -- == -- == == == -- -- -- -- --  ---------------  --------------------
  60 00 40 00 48 00 00 02 52 9e f8 40 00     01:23:58.019  READ FPDMA QUEUED
  60 00 40 00 40 00 00 00 24 a8 64 40 00     01:23:58.019  READ FPDMA QUEUED
  60 01 00 00 38 00 00 03 bb b1 68 40 00     01:23:58.019  READ FPDMA QUEUED
  60 01 00 00 30 00 00 03 bb b2 68 40 00     01:23:58.019  READ FPDMA QUEUED
  60 01 00 00 28 00 00 03 bb b3 68 40 00     01:23:58.018  READ FPDMA QUEUED

Error 24624 [23] occurred at disk power-on lifetime: 6395 hours (266 days + 11 hours)
  When the command that caused the error occurred, the device was active or idle.

  After command completion occurred, registers were:
  ER -- ST COUNT  LBA_48  LH LM LL DV DC
  -- -- -- == -- == == == -- -- -- -- --
  01 -- 51 00 00 00 00 02 52 9e fa 40 00  Error: AMNF at LBA = 0x02529efa = 38969082

  Commands leading to the command that caused the error were:
  CR FEATR COUNT  LBA_48  LH LM LL DV DC  Powered_Up_Time  Command/Feature_Name
  -- == -- == -- == == == -- -- -- -- --  ---------------  --------------------
  60 01 00 00 d0 00 00 03 bb b3 68 40 00     01:23:56.007  READ FPDMA QUEUED
  60 01 00 00 c8 00 00 03 bb b2 68 40 00     01:23:56.007  READ FPDMA QUEUED
  60 01 00 00 c0 00 00 03 bb b1 68 40 00     01:23:56.007  READ FPDMA QUEUED
  61 00 08 00 b8 00 00 00 00 09 90 40 00     01:23:55.987  WRITE FPDMA QUEUED
  60 00 40 00 b0 00 00 00 24 a8 64 40 00     01:23:55.987  READ FPDMA QUEUED

Error 24623 [22] occurred at disk power-on lifetime: 6395 hours (266 days + 11 hours)
  When the command that caused the error occurred, the device was active or idle.

  After command completion occurred, registers were:
  ER -- ST COUNT  LBA_48  LH LM LL DV DC
  -- -- -- == -- == == == -- -- -- -- --
  01 -- 51 00 00 00 00 02 52 9e fa 40 00  Error: AMNF at LBA = 0x02529efa = 38969082

  Commands leading to the command that caused the error were:
  CR FEATR COUNT  LBA_48  LH LM LL DV DC  Powered_Up_Time  Command/Feature_Name
  -- == -- == -- == == == -- -- -- -- --  ---------------  --------------------
  61 00 08 00 e8 00 00 00 00 09 a8 40 00     01:23:53.911  WRITE FPDMA QUEUED
  61 00 10 00 e0 00 00 02 fb a7 30 40 00     01:23:53.894  WRITE FPDMA QUEUED
  60 00 40 00 d8 00 00 00 0e d0 dc 40 00     01:23:53.894  READ FPDMA QUEUED
  60 01 00 00 d0 00 00 08 1b 1c 40 40 00     01:23:53.894  READ FPDMA QUEUED
  60 01 00 00 c8 00 00 08 1b 1b 40 40 00     01:23:53.894  READ FPDMA QUEUED

SMART Extended Self-test Log Version: 1 (1 sectors)
Num  Test_Description    Status                  Remaining  LifeTime(hours)  LBA_of_first_error
# 1  Extended offline    Completed without error       00%      6004         -
# 2  Extended offline    Completed without error       00%      5838         -
# 3  Extended offline    Completed without error       00%      5688         -
# 4  Extended offline    Completed without error       00%      5586         -
# 5  Extended offline    Completed without error       00%      5435         -
# 6  Extended offline    Completed without error       00%      5289         -
# 7  Extended offline    Completed without error       00%      5130         -
# 8  Extended offline    Completed without error       00%      5010         -
# 9  Extended offline    Interrupted (host reset)      50%      4912         -
#10  Extended offline    Completed without error       00%      4753         -
#11  Extended offline    Completed without error       00%      4639         -
#12  Extended offline    Completed without error       00%      4501         -
#13  Extended offline    Completed without error       00%      4334         -
#14  Extended offline    Completed without error       00%      4138         -
#15  Extended offline    Completed without error       00%      3971         -
#16  Extended offline    Completed without error       00%      3840         -
#17  Extended offline    Completed without error       00%      3645         -
#18  Extended offline    Completed without error       00%      3499         -

SMART Selective self-test log data structure revision number 1
 SPAN  MIN_LBA  MAX_LBA  CURRENT_TEST_STATUS
    1        0        0  Not_testing
    2        0        0  Not_testing
    3        0        0  Not_testing
    4        0        0  Not_testing
    5        0        0  Not_testing
Selective self-test flags (0x0):
  After scanning selected spans, do NOT read-scan remainder of disk.
If Selective self-test is pending on power-up, resume after 0 minute delay.

SCT Status Version:                  3
SCT Version (vendor specific):       258 (0x0102)
SCT Support Level:                   1
Device State:                        Active (0)
Current Temperature:                    30 Celsius
Power Cycle Min/Max Temperature:     28/30 Celsius
Lifetime    Min/Max Temperature:      0/66 Celsius
Under/Over Temperature Limit Count:   0/0

SCT Temperature History Version:     2
Temperature Sampling Period:         1 minute
Temperature Logging Interval:        1 minute
Min/Max recommended Temperature:      0/60 Celsius
Min/Max Temperature Limit:           -41/85 Celsius
Temperature History Size (Index):    478 (347)

SCT Error Recovery Control command not supported

Device Statistics (GP/SMART Log 0x04) not supported

SATA Phy Event Counters (GP Log 0x11)
ID      Size     Value  Description
0x0001  2            0  Command failed due to ICRC error
0x0002  2            0  R_ERR response for data FIS
0x0003  2            0  R_ERR response for device-to-host data FIS
0x0004  2            0  R_ERR response for host-to-device data FIS
0x0005  2            0  R_ERR response for non-data FIS
0x0006  2            0  R_ERR response for device-to-host non-data FIS
0x0007  2            0  R_ERR response for host-to-device non-data FIS
0x000a  2            3  Device-to-host register FISes sent due to a COMRESET
0x000b  2            0  CRC errors within host-to-device FIS
0x8000  4          241  Vendor specific

