=== START OF INFORMATION SECTION ===
Model Family:     Western Digital Caviar Blue (SATA 6Gb/s)
Device Model:     WDC WD5000AAKX-001CA0
Serial Number:    --
LU WWN Device Id: 5 0014ee ...
Firmware Version: 15.01H15
User Capacity:    500 107 862 016 bytes [500 GB]
Sector Size:      512 bytes logical/physical
Device is:        In smartctl database [for details use: -P show]
ATA Version is:   ATA8-ACS (minor revision not indicated)
SATA Version is:  SATA 3.0, 6.0 Gb/s (current: 3.0 Gb/s)
Local Time is:    Tue Feb  9 15:26:56 2016 MSK
SMART support is: Available - device has SMART capability.
SMART support is: Enabled
AAM feature is:   Disabled
APM feature is:   Unavailable
Rd look-ahead is: Enabled
Write cache is:   Enabled
ATA Security is:  Disabled, frozen [SEC2]
Wt Cache Reorder: Enabled

=== START OF READ SMART DATA SECTION ===
SMART overall-health self-assessment test result: PASSED

General SMART Values:
Offline data collection status:  (0x82)	Offline data collection activity
					was completed without error.
					Auto Offline Data Collection: Enabled.
Self-test execution status:      (   0)	The previous self-test routine completed
					without error or no self-test has ever 
					been run.
Total time to complete Offline 
data collection: 		( 8460) seconds.
Offline data collection
capabilities: 			 (0x7b) SMART execute Offline immediate.
					Auto Offline data collection on/off support.
					Suspend Offline collection upon new
					command.
					Offline surface scan supported.
					Self-test supported.
					Conveyance Self-test supported.
					Selective Self-test supported.
SMART capabilities:            (0x0003)	Saves SMART data before entering
					power-saving mode.
					Supports SMART auto save timer.
Error logging capability:        (0x01)	Error logging supported.
					General Purpose Logging supported.
Short self-test routine 
recommended polling time: 	 (   2) minutes.
Extended self-test routine
recommended polling time: 	 (  86) minutes.
Conveyance self-test routine
recommended polling time: 	 (   5) minutes.
SCT capabilities: 	       (0x3037)	SCT Status supported.
					SCT Feature Control supported.
					SCT Data Table supported.

SMART Attributes Data Structure revision number: 16
Vendor Specific SMART Attributes with Thresholds:
ID# ATTRIBUTE_NAME          FLAGS    VALUE WORST THRESH FAIL RAW_VALUE
  1 Raw_Read_Error_Rate     POSR-K   200   200   051    -    67
  3 Spin_Up_Time            POS--K   143   142   021    -    3850
  4 Start_Stop_Count        -O--CK   099   099   000    -    1614
  5 Reallocated_Sector_Ct   PO--CK   200   200   140    -    2
  7 Seek_Error_Rate         -OSR-K   100   253   000    -    0
  9 Power_On_Hours          -O--CK   086   086   000    -    10622
 10 Spin_Retry_Count        -O--CK   100   100   000    -    0
 11 Calibration_Retry_Count -O--CK   100   100   000    -    0
 12 Power_Cycle_Count       -O--CK   099   099   000    -    1585
192 Power-Off_Retract_Count -O--CK   200   200   000    -    304
193 Load_Cycle_Count        -O--CK   200   200   000    -    1309
194 Temperature_Celsius     -O---K   112   103   000    -    31
196 Reallocated_Event_Count -O--CK   199   199   000    -    1
197 Current_Pending_Sector  -O--CK   200   200   000    -    0
198 Offline_Uncorrectable   ----CK   200   200   000    -    0
199 UDMA_CRC_Error_Count    -O--CK   200   200   000    -    0
200 Multi_Zone_Error_Rate   ---R--   200   200   000    -    1
                            ||||||_ K auto-keep
                            |||||__ C event count
                            ||||___ R error rate
                            |||____ S speed/performance
                            ||_____ O updated online
                            |______ P prefailure warning

General Purpose Log Directory Version 1
SMART           Log Directory Version 1 [multi-sector log support]
Address    Access  R/W   Size  Description
0x00       GPL,SL  R/O      1  Log Directory
0x01           SL  R/O      1  Summary SMART error log
0x02           SL  R/O      5  Comprehensive SMART error log
0x03       GPL     R/O      6  Ext. Comprehensive SMART error log
0x06           SL  R/O      1  SMART self-test log
0x07       GPL     R/O      1  Extended self-test log
0x09           SL  R/W      1  Selective self-test log
0x10       GPL     R/O      1  NCQ Command Error log
0x11       GPL     R/O      1  SATA Phy Event Counters
0x80-0x9f  GPL,SL  R/W     16  Host vendor specific log
0xa0-0xa7  GPL,SL  VS      16  Device vendor specific log
0xa8-0xb5  GPL,SL  VS       1  Device vendor specific log
0xb6       GPL     VS       1  Device vendor specific log
0xb7       GPL,SL  VS       1  Device vendor specific log
0xc0       GPL,SL  VS       1  Device vendor specific log
0xc1       GPL     VS      24  Device vendor specific log
0xe0       GPL,SL  R/W      1  SCT Command/Status
0xe1       GPL,SL  R/W      1  SCT Data Transfer

SMART Extended Comprehensive Error Log Version: 1 (6 sectors)
Device Error Count: 27 (device log contains only the most recent 24 errors)
	CR     = Command Register
	FEATR  = Features Register
	COUNT  = Count (was: Sector Count) Register
	LBA_48 = Upper bytes of LBA High/Mid/Low Registers ]  ATA-8
	LH     = LBA High (was: Cylinder High) Register    ]   LBA
	LM     = LBA Mid (was: Cylinder Low) Register      ] Register
	LL     = LBA Low (was: Sector Number) Register     ]
	DV     = Device (was: Device/Head) Register
	DC     = Device Control Register
	ER     = Error register
	ST     = Status register
Powered_Up_Time is measured from power on, and printed as
DDd+hh:mm:SS.sss where DD=days, hh=hours, mm=minutes,
SS=sec, and sss=millisec. It "wraps" after 49.710 days.

Error 27 [2] occurred at disk power-on lifetime: 9417 hours (392 days + 9 hours)
  When the command that caused the error occurred, the device was active or idle.

  After command completion occurred, registers were:
  ER -- ST COUNT  LBA_48  LH LM LL DV DC
  -- -- -- == -- == == == -- -- -- -- --
  40 -- 51 00 40 00 00 05 16 70 47 e0 00  Error: UNC 64 sectors at LBA = 0x05167047 = 85356615

  Commands leading to the command that caused the error were:
  CR FEATR COUNT  LBA_48  LH LM LL DV DC  Powered_Up_Time  Command/Feature_Name
  -- == -- == -- == == == -- -- -- -- --  ---------------  --------------------
  25 00 00 00 40 00 00 05 16 70 2f e0 00     05:49:01.739  READ DMA EXT
  25 00 00 00 40 00 00 05 16 6f ef e0 00     05:49:01.738  READ DMA EXT
  25 00 00 00 40 00 00 05 16 6f af e0 00     05:49:01.738  READ DMA EXT
  25 00 00 00 40 00 00 05 16 6f 6f e0 00     05:49:01.738  READ DMA EXT
  25 00 00 00 40 00 00 05 16 6f 2f e0 00     05:49:01.737  READ DMA EXT

Error 26 [1] occurred at disk power-on lifetime: 9283 hours (386 days + 19 hours)
  When the command that caused the error occurred, the device was active or idle.

  After command completion occurred, registers were:
  ER -- ST COUNT  LBA_48  LH LM LL DV DC
  -- -- -- == -- == == == -- -- -- -- --
  40 -- 51 00 08 00 00 05 16 80 28 e0 00  Error: UNC 8 sectors at LBA = 0x05168028 = 85360680

  Commands leading to the command that caused the error were:
  CR FEATR COUNT  LBA_48  LH LM LL DV DC  Powered_Up_Time  Command/Feature_Name
  -- == -- == -- == == == -- -- -- -- --  ---------------  --------------------
  25 00 00 00 08 00 00 05 16 80 27 e0 00     03:16:17.198  READ DMA EXT
  25 00 00 00 10 00 00 06 b5 c0 df e0 00     03:16:17.193  READ DMA EXT
  25 00 00 00 08 00 00 06 01 6a c7 e0 00     03:16:17.184  READ DMA EXT
  25 00 00 00 20 00 00 05 16 df af e0 00     03:16:17.176  READ DMA EXT
  25 00 00 00 08 00 00 05 16 80 1f e0 00     03:16:17.176  READ DMA EXT

Error 25 [0] occurred at disk power-on lifetime: 9283 hours (386 days + 19 hours)
  When the command that caused the error occurred, the device was active or idle.

  After command completion occurred, registers were:
  ER -- ST COUNT  LBA_48  LH LM LL DV DC
  -- -- -- == -- == == == -- -- -- -- --
  40 -- 51 00 20 00 00 05 16 80 28 e0 00  Error: UNC 32 sectors at LBA = 0x05168028 = 85360680

  Commands leading to the command that caused the error were:
  CR FEATR COUNT  LBA_48  LH LM LL DV DC  Powered_Up_Time  Command/Feature_Name
  -- == -- == -- == == == -- -- -- -- --  ---------------  --------------------
  25 00 00 00 20 00 00 05 16 80 0f e0 00     03:16:15.394  READ DMA EXT
  25 00 00 00 20 00 00 05 16 7e cf e0 00     03:16:15.384  READ DMA EXT
  25 00 00 00 60 00 00 09 d4 87 3f e0 00     03:16:15.371  READ DMA EXT
  35 00 00 00 60 00 00 09 cc 28 c7 e0 00     03:16:15.371  WRITE DMA EXT
  35 00 00 00 40 00 00 07 2d 4b 6f e0 00     03:16:15.371  WRITE DMA EXT

Error 24 [23] occurred at disk power-on lifetime: 9275 hours (386 days + 11 hours)
  When the command that caused the error occurred, the device was active or idle.

  After command completion occurred, registers were:
  ER -- ST COUNT  LBA_48  LH LM LL DV DC
  -- -- -- == -- == == == -- -- -- -- --
  40 -- 51 00 08 00 00 05 16 80 28 e0 00  Error: UNC 8 sectors at LBA = 0x05168028 = 85360680

  Commands leading to the command that caused the error were:
  CR FEATR COUNT  LBA_48  LH LM LL DV DC  Powered_Up_Time  Command/Feature_Name
  -- == -- == -- == == == -- -- -- -- --  ---------------  --------------------
  25 00 00 00 08 00 00 05 16 80 27 e0 00     02:52:42.421  READ DMA EXT
  25 00 00 00 08 00 00 05 16 80 1f e0 00     02:52:42.421  READ DMA EXT
  25 00 00 00 08 00 00 05 16 80 17 e0 00     02:52:42.421  READ DMA EXT
  25 00 00 00 08 00 00 05 16 80 0f e0 00     02:52:42.370  READ DMA EXT
  25 00 00 00 20 00 00 06 8c 85 ef e0 00     02:52:42.320  READ DMA EXT

Error 23 [22] occurred at disk power-on lifetime: 9275 hours (386 days + 11 hours)
  When the command that caused the error occurred, the device was active or idle.

  After command completion occurred, registers were:
  ER -- ST COUNT  LBA_48  LH LM LL DV DC
  -- -- -- == -- == == == -- -- -- -- --
  40 -- 51 00 20 00 00 05 16 80 28 e0 00  Error: UNC 32 sectors at LBA = 0x05168028 = 85360680

  Commands leading to the command that caused the error were:
  CR FEATR COUNT  LBA_48  LH LM LL DV DC  Powered_Up_Time  Command/Feature_Name
  -- == -- == -- == == == -- -- -- -- --  ---------------  --------------------
  25 00 00 00 20 00 00 05 16 80 0f e0 00     02:52:40.686  READ DMA EXT
  35 00 00 00 08 00 00 04 3b 95 d7 e0 00     02:52:40.685  WRITE DMA EXT
  25 00 00 00 08 00 00 05 16 df bf e0 00     02:52:40.685  READ DMA EXT
  35 00 00 00 08 00 00 04 3b 85 d7 e0 00     02:52:40.684  WRITE DMA EXT
  25 00 00 00 08 00 00 05 16 df c7 e0 00     02:52:40.684  READ DMA EXT

Error 22 [21] occurred at disk power-on lifetime: 9160 hours (381 days + 16 hours)
  When the command that caused the error occurred, the device was active or idle.

  After command completion occurred, registers were:
  ER -- ST COUNT  LBA_48  LH LM LL DV DC
  -- -- -- == -- == == == -- -- -- -- --
  40 -- 51 00 08 00 00 05 16 80 28 e0 00  Error: UNC 8 sectors at LBA = 0x05168028 = 85360680

  Commands leading to the command that caused the error were:
  CR FEATR COUNT  LBA_48  LH LM LL DV DC  Powered_Up_Time  Command/Feature_Name
  -- == -- == -- == == == -- -- -- -- --  ---------------  --------------------
  25 00 00 00 08 00 00 05 16 80 27 e0 00     03:15:52.933  READ DMA EXT
  25 00 00 00 08 00 00 05 16 80 1f e0 00     03:15:52.933  READ DMA EXT
  25 00 00 00 08 00 00 05 16 80 17 e0 00     03:15:52.933  READ DMA EXT
  25 00 00 00 08 00 00 05 16 80 0f e0 00     03:15:52.881  READ DMA EXT
  35 00 00 00 08 00 00 03 db e5 5f e0 00     03:15:52.848  WRITE DMA EXT

Error 21 [20] occurred at disk power-on lifetime: 9160 hours (381 days + 16 hours)
  When the command that caused the error occurred, the device was active or idle.

  After command completion occurred, registers were:
  ER -- ST COUNT  LBA_48  LH LM LL DV DC
  -- -- -- == -- == == == -- -- -- -- --
  40 -- 51 00 20 00 00 05 16 80 28 e0 00  Error: UNC 32 sectors at LBA = 0x05168028 = 85360680

  Commands leading to the command that caused the error were:
  CR FEATR COUNT  LBA_48  LH LM LL DV DC  Powered_Up_Time  Command/Feature_Name
  -- == -- == -- == == == -- -- -- -- --  ---------------  --------------------
  25 00 00 00 20 00 00 05 16 80 0f e0 00     03:15:51.196  READ DMA EXT
  35 00 00 00 08 00 00 05 16 7d 2f e0 00     03:15:51.195  WRITE DMA EXT
  25 00 00 00 08 00 00 05 50 d0 c7 e0 00     03:15:51.195  READ DMA EXT
  35 00 00 00 20 00 00 09 cb 12 cf e0 00     03:15:51.195  WRITE DMA EXT
  35 00 00 00 20 00 00 09 9c 72 8f e0 00     03:15:51.195  WRITE DMA EXT

Error 20 [19] occurred at disk power-on lifetime: 9148 hours (381 days + 4 hours)
  When the command that caused the error occurred, the device was active or idle.

  After command completion occurred, registers were:
  ER -- ST COUNT  LBA_48  LH LM LL DV DC
  -- -- -- == -- == == == -- -- -- -- --
  40 -- 51 00 08 00 00 05 16 80 28 e0 00  Error: UNC 8 sectors at LBA = 0x05168028 = 85360680

  Commands leading to the command that caused the error were:
  CR FEATR COUNT  LBA_48  LH LM LL DV DC  Powered_Up_Time  Command/Feature_Name
  -- == -- == -- == == == -- -- -- -- --  ---------------  --------------------
  25 00 00 00 08 00 00 05 16 80 27 e0 00     03:47:28.963  READ DMA EXT
  25 00 00 00 08 00 00 05 16 80 1f e0 00     03:47:28.958  READ DMA EXT
  25 00 00 00 08 00 00 05 16 80 17 e0 00     03:47:28.950  READ DMA EXT
  ea 00 00 00 00 ac 82 ce 00 00 00 e0 00     03:47:28.899  FLUSH CACHE EXT
  35 00 00 00 08 00 00 03 ac 82 c7 e0 00     03:47:28.896  WRITE DMA EXT

SMART Extended Self-test Log Version: 1 (1 sectors)
No self-tests have been logged.  [To run self-tests, use: smartctl -t]

SMART Selective self-test log data structure revision number 1
 SPAN  MIN_LBA  MAX_LBA  CURRENT_TEST_STATUS
    1        0        0  Not_testing
    2        0        0  Not_testing
    3        0        0  Not_testing
    4        0        0  Not_testing
    5        0        0  Not_testing
Selective self-test flags (0x0):
  After scanning selected spans, do NOT read-scan remainder of disk.
If Selective self-test is pending on power-up, resume after 0 minute delay.

SCT Status Version:                  3
SCT Version (vendor specific):       258 (0x0102)
SCT Support Level:                   1
Device State:                        Active (0)
Current Temperature:                    31 Celsius
Power Cycle Min/Max Temperature:     23/31 Celsius
Lifetime    Min/Max Temperature:     23/40 Celsius
Under/Over Temperature Limit Count:   0/0

SCT Temperature History Version:     2
Temperature Sampling Period:         1 minute
Temperature Logging Interval:        1 minute
Min/Max recommended Temperature:      0/60 Celsius
Min/Max Temperature Limit:           -41/85 Celsius
Temperature History Size (Index):    478 (131)

SCT Error Recovery Control command not supported

Device Statistics (GP Log 0x04) not supported

SATA Phy Event Counters (GP Log 0x11)
ID      Size     Value  Description
0x0001  2            0  Command failed due to ICRC error
0x0002  2            0  R_ERR response for data FIS
0x0003  2            0  R_ERR response for device-to-host data FIS
0x0004  2            0  R_ERR response for host-to-device data FIS
0x0005  2            0  R_ERR response for non-data FIS
0x0006  2            0  R_ERR response for device-to-host non-data FIS
0x0007  2            0  R_ERR response for host-to-device non-data FIS
0x000a  2            5  Device-to-host register FISes sent due to a COMRESET
0x000b  2            0  CRC errors within host-to-device FIS
0x8000  4         6856  Vendor specific

