smartctl 7.4 2023-08-01 r5530 [x86_64-linux-6.1.57-gentoo] (local build)
Copyright (C) 2002-23, Bruce Allen, Christian Franke, www.smartmontools.org

=== START OF INFORMATION SECTION ===
Model Number:                       TS1TMTE400S
Serial Number:                      --
Firmware Version:                   V0804S3
PCI Vendor/Subsystem ID:            0x1d79
IEEE OUI Identifier:                0x7c3548
Controller ID:                      1
NVMe Version:                       1.3
Number of Namespaces:               1
Namespace 1 Size/Capacity:          1,024,209,543,168 [1.02 TB]
Namespace 1 Formatted LBA Size:     512
Namespace 1 IEEE EUI-64:            7c3548 ...
Local Time is:                      Fri Nov 10 23:19:45 2023 CET
Firmware Updates (0x12):            1 Slot, no Reset required
Optional Admin Commands (0x0007):   Security Format Frmw_DL
Optional NVM Commands (0x0015):     Comp DS_Mngmt Sav/Sel_Feat
Log Page Attributes (0x03):         S/H_per_NS Cmd_Eff_Lg
Maximum Data Transfer Size:         64 Pages
Warning  Comp. Temp. Threshold:     110 Celsius
Critical Comp. Temp. Threshold:     115 Celsius

Supported Power States
St Op     Max   Active     Idle   RL RT WL WT  Ent_Lat  Ex_Lat
 0 +     6.00W       -        -    0  0  0  0    15000       0
 1 +     3.00W       -        -    1  1  1  1    15000       0
 2 +     1.50W       -        -    2  2  2  2    15000       0
 3 -   0.0450W       -        -    3  3  3  3    15000   15000
 4 -   0.0040W       -        -    4  4  4  4    25000   25000

Supported LBA Sizes (NSID 0x1)
Id Fmt  Data  Metadt  Rel_Perf
 0 +     512       0         0

=== START OF SMART DATA SECTION ===
SMART overall-health self-assessment test result: PASSED

SMART/Health Information (NVMe Log 0x02)
Critical Warning:                   0x00
Temperature:                        29 Celsius
Available Spare:                    100%
Available Spare Threshold:          10%
Percentage Used:                    0%
Data Units Read:                    39,071 [20.0 GB]
Data Units Written:                 92,427 [47.3 GB]
Host Read Commands:                 184,420
Host Write Commands:                317,330
Controller Busy Time:               5
Power Cycles:                       540
Power On Hours:                     396
Unsafe Shutdowns:                   46
Media and Data Integrity Errors:    0
Error Information Log Entries:      0
Warning  Comp. Temperature Time:    0
Critical Comp. Temperature Time:    0

Error Information (NVMe Log 0x01, 16 of 64 entries)
No Errors Logged

Self-tests not supported

