smartctl 7.4 2023-08-01 r5530 [x86_64-linux-6.14.2-desktop-3omv2590] (OpenMandriva Lx 7.4-1)
Copyright (C) 2002-23, Bruce Allen, Christian Franke, www.smartmontools.org

=== START OF INFORMATION SECTION ===
Model Family:     Western Digital Scorpio Black
Device Model:     WDC WD3200BEKT-60V5T1
Serial Number:    --
LU WWN Device Id: 5 0014ee ...
Firmware Version: 12.01A12
User Capacity:    320,072,933,376 bytes [320 GB]
Sector Size:      512 bytes logical/physical
Rotation Rate:    7200 rpm
Device is:        In smartctl database
ATA Version is:   ATA8-ACS (minor revision not indicated)
SATA Version is:  SATA 2.5, 3.0 Gb/s
Local Time is:    Fri May 30 19:43:35 2025 EEST
SMART support is: Available - device has SMART capability.
SMART support is: Enabled
AAM feature is:   Unavailable
APM level is:     128 (minimum power consumption without standby)
Rd look-ahead is: Enabled
Write cache is:   Enabled
DSN feature is:   Unavailable
ATA Security is:  Disabled, NOT FROZEN [SEC1]
Wt Cache Reorder: Enabled

=== START OF READ SMART DATA SECTION ===
SMART overall-health self-assessment test result: PASSED
See vendor-specific Attribute list for marginal Attributes.

General SMART Values:
Offline data collection status:  (0x00)	Offline data collection activity
					was never started.
					Auto Offline Data Collection: Disabled.
Self-test execution status:      (   0)	The previous self-test routine completed
					without error or no self-test has ever 
					been run.
Total time to complete Offline 
data collection: 		( 7560) seconds.
Offline data collection
capabilities: 			 (0x51) SMART execute Offline immediate.
					No Auto Offline data collection support.
					Suspend Offline collection upon new
					command.
					No Offline surface scan supported.
					Self-test supported.
					No Conveyance Self-test supported.
					Selective Self-test supported.
SMART capabilities:            (0x0003)	Saves SMART data before entering
					power-saving mode.
					Supports SMART auto save timer.
Error logging capability:        (0x01)	Error logging supported.
					General Purpose Logging supported.
Short self-test routine 
recommended polling time: 	 (   2) minutes.
Extended self-test routine
recommended polling time: 	 (  91) minutes.
SCT capabilities: 	       (0x303f)	SCT Status supported.
					SCT Error Recovery Control supported.
					SCT Feature Control supported.
					SCT Data Table supported.

SMART Attributes Data Structure revision number: 16
Vendor Specific SMART Attributes with Thresholds:
ID# ATTRIBUTE_NAME          FLAGS    VALUE WORST THRESH FAIL RAW_VALUE
  1 Raw_Read_Error_Rate     POSR-K   200   200   051    -    198
  3 Spin_Up_Time            POS--K   177   176   021    -    2133
  4 Start_Stop_Count        -O--CK   042   042   000    -    58784
  5 Reallocated_Sector_Ct   PO--CK   200   200   140    -    0
  7 Seek_Error_Rate         POSR-K   100   253   051    -    0
  9 Power_On_Hours          -O--CK   058   058   000    -    30896
 10 Spin_Retry_Count        PO--CK   100   100   051    -    0
 11 Calibration_Retry_Count -O--CK   100   100   000    -    0
 12 Power_Cycle_Count       -O--CK   090   090   000    -    10729
184 End-to-End_Error        PO--CK   100   100   097    -    0
187 Reported_Uncorrect      -O--CK   100   001   000    -    468
188 Command_Timeout         -O--CK   100   044   000    -    154621182054
190 Airflow_Temperature_Cel -O---K   070   036   040    Past 30
191 G-Sense_Error_Rate      -O--CK   072   072   000    -    28
192 Power-Off_Retract_Count -O--CK   200   200   000    -    134
193 Load_Cycle_Count        -O--CK   001   001   000    -    817483
194 Temperature_Celsius     -O---K   117   083   000    -    30
196 Reallocated_Event_Count -O--CK   200   200   000    -    0
197 Current_Pending_Sector  -O--CK   200   200   000    -    2
198 Offline_Uncorrectable   ----CK   100   253   000    -    0
199 UDMA_CRC_Error_Count    -O--CK   200   200   000    -    0
200 Multi_Zone_Error_Rate   P--R--   100   253   051    -    0
                            ||||||_ K auto-keep
                            |||||__ C event count
                            ||||___ R error rate
                            |||____ S speed/performance
                            ||_____ O updated online
                            |______ P prefailure warning

General Purpose Log Directory Version 1
SMART           Log Directory Version 1 [multi-sector log support]
Address    Access  R/W   Size  Description
0x00       GPL,SL  R/O      1  Log Directory
0x01           SL  R/O      1  Summary SMART error log
0x02           SL  R/O      5  Comprehensive SMART error log
0x03       GPL     R/O      6  Ext. Comprehensive SMART error log
0x06           SL  R/O      1  SMART self-test log
0x07       GPL     R/O      1  Extended self-test log
0x09           SL  R/W      1  Selective self-test log
0x10       GPL     R/O      1  NCQ Command Error log
0x11       GPL     R/O      1  SATA Phy Event Counters log
0x80-0x9f  GPL,SL  R/W     16  Host vendor specific log
0xa0-0xa7  GPL,SL  VS      16  Device vendor specific log
0xa8-0xb7  GPL,SL  VS       1  Device vendor specific log
0xc0       GPL,SL  VS       1  Device vendor specific log
0xc1       GPL     VS      24  Device vendor specific log
0xe0       GPL,SL  R/W      1  SCT Command/Status
0xe1       GPL,SL  R/W      1  SCT Data Transfer

SMART Extended Comprehensive Error Log Version: 1 (6 sectors)
Device Error Count: 476 (device log contains only the most recent 24 errors)
	CR     = Command Register
	FEATR  = Features Register
	COUNT  = Count (was: Sector Count) Register
	LBA_48 = Upper bytes of LBA High/Mid/Low Registers ]  ATA-8
	LH     = LBA High (was: Cylinder High) Register    ]   LBA
	LM     = LBA Mid (was: Cylinder Low) Register      ] Register
	LL     = LBA Low (was: Sector Number) Register     ]
	DV     = Device (was: Device/Head) Register
	DC     = Device Control Register
	ER     = Error register
	ST     = Status register
Powered_Up_Time is measured from power on, and printed as
DDd+hh:mm:SS.sss where DD=days, hh=hours, mm=minutes,
SS=sec, and sss=millisec. It "wraps" after 49.710 days.

Error 476 [19] occurred at disk power-on lifetime: 30874 hours (1286 days + 10 hours)
  When the command that caused the error occurred, the device was active or idle.

  After command completion occurred, registers were:
  ER -- ST COUNT  LBA_48  LH LM LL DV DC
  -- -- -- == -- == == == -- -- -- -- --
  40 -- 51 00 00 00 00 7f 00 1a 01 40 00  Error: UNC at LBA = 0x7f001a01 = 2130713089

  Commands leading to the command that caused the error were:
  CR FEATR COUNT  LBA_48  LH LM LL DV DC  Powered_Up_Time  Command/Feature_Name
  -- == -- == -- == == == -- -- -- -- --  ---------------  --------------------
  60 00 20 00 88 00 00 00 1a 7f 00 40 00     00:13:15.734  READ FPDMA QUEUED
  60 00 08 00 80 00 00 06 1c 87 b0 40 00     00:13:15.734  READ FPDMA QUEUED
  60 00 40 00 78 00 00 07 e3 bc 20 40 00     00:13:15.734  READ FPDMA QUEUED
  60 00 10 00 70 00 00 01 6c 2f 10 40 00     00:13:15.734  READ FPDMA QUEUED
  60 00 20 00 68 00 00 00 3f ab 80 40 00     00:13:15.733  READ FPDMA QUEUED

Error 475 [18] occurred at disk power-on lifetime: 30874 hours (1286 days + 10 hours)
  When the command that caused the error occurred, the device was active or idle.

  After command completion occurred, registers were:
  ER -- ST COUNT  LBA_48  LH LM LL DV DC
  -- -- -- == -- == == == -- -- -- -- --
  40 -- 51 00 00 00 00 7f 00 1a 01 40 00  Error: UNC at LBA = 0x7f001a01 = 2130713089

  Commands leading to the command that caused the error were:
  CR FEATR COUNT  LBA_48  LH LM LL DV DC  Powered_Up_Time  Command/Feature_Name
  -- == -- == -- == == == -- -- -- -- --  ---------------  --------------------
  60 00 20 00 b0 00 00 00 1a 7f 00 40 00     00:13:12.788  READ FPDMA QUEUED
  60 00 20 00 a8 00 00 00 68 0f c0 40 00     00:13:12.788  READ FPDMA QUEUED
  61 01 00 00 a0 00 00 05 5f 71 40 40 00     00:13:12.788  WRITE FPDMA QUEUED
  61 01 00 00 98 00 00 05 5f 72 40 40 00     00:13:12.788  WRITE FPDMA QUEUED
  61 01 00 00 90 00 00 05 5f 73 40 40 00     00:13:12.788  WRITE FPDMA QUEUED

Error 474 [17] occurred at disk power-on lifetime: 30874 hours (1286 days + 10 hours)
  When the command that caused the error occurred, the device was active or idle.

  After command completion occurred, registers were:
  ER -- ST COUNT  LBA_48  LH LM LL DV DC
  -- -- -- == -- == == == -- -- -- -- --
  40 -- 51 00 00 00 00 7f 00 1a 01 40 00  Error: UNC at LBA = 0x7f001a01 = 2130713089

  Commands leading to the command that caused the error were:
  CR FEATR COUNT  LBA_48  LH LM LL DV DC  Powered_Up_Time  Command/Feature_Name
  -- == -- == -- == == == -- -- -- -- --  ---------------  --------------------
  60 00 20 00 20 00 00 00 68 0f c0 40 00     00:13:10.315  READ FPDMA QUEUED
  61 00 08 00 18 00 00 00 67 ff 80 40 00     00:13:10.314  WRITE FPDMA QUEUED
  61 00 20 00 10 00 00 11 c7 94 20 40 00     00:13:10.314  WRITE FPDMA QUEUED
  61 00 20 00 08 00 00 11 de 02 80 40 00     00:13:10.313  WRITE FPDMA QUEUED
  60 00 20 00 00 00 00 00 1a 7f 00 40 00     00:13:10.299  READ FPDMA QUEUED

Error 473 [16] occurred at disk power-on lifetime: 30874 hours (1286 days + 10 hours)
  When the command that caused the error occurred, the device was active or idle.

  After command completion occurred, registers were:
  ER -- ST COUNT  LBA_48  LH LM LL DV DC
  -- -- -- == -- == == == -- -- -- -- --
  40 -- 51 00 00 00 00 7f 00 1a 01 40 00  Error: UNC at LBA = 0x7f001a01 = 2130713089

  Commands leading to the command that caused the error were:
  CR FEATR COUNT  LBA_48  LH LM LL DV DC  Powered_Up_Time  Command/Feature_Name
  -- == -- == -- == == == -- -- -- -- --  ---------------  --------------------
  60 00 40 00 a0 00 00 00 65 e3 c0 40 00     00:13:07.805  READ FPDMA QUEUED
  60 00 20 00 98 00 00 04 46 41 40 40 00     00:13:07.805  READ FPDMA QUEUED
  61 00 08 00 90 00 00 00 64 3f f0 40 00     00:13:07.805  WRITE FPDMA QUEUED
  60 00 20 00 88 00 00 00 3f ab 80 40 00     00:13:07.805  READ FPDMA QUEUED
  61 00 08 00 80 00 00 04 46 41 30 40 00     00:13:07.805  WRITE FPDMA QUEUED

Error 472 [15] occurred at disk power-on lifetime: 30874 hours (1286 days + 10 hours)
  When the command that caused the error occurred, the device was active or idle.

  After command completion occurred, registers were:
  ER -- ST COUNT  LBA_48  LH LM LL DV DC
  -- -- -- == -- == == == -- -- -- -- --
  40 -- 51 00 00 00 00 7f 00 1a 01 40 00  Error: UNC at LBA = 0x7f001a01 = 2130713089

  Commands leading to the command that caused the error were:
  CR FEATR COUNT  LBA_48  LH LM LL DV DC  Powered_Up_Time  Command/Feature_Name
  -- == -- == -- == == == -- -- -- -- --  ---------------  --------------------
  60 00 40 00 b8 00 00 07 e3 bc 20 40 00     00:13:05.483  READ FPDMA QUEUED
  60 00 08 00 b0 00 00 07 e4 1c a8 40 00     00:13:05.477  READ FPDMA QUEUED
  61 00 20 00 a0 00 00 11 de 02 60 40 00     00:13:05.444  WRITE FPDMA QUEUED
  61 00 20 00 90 00 00 11 de 02 40 40 00     00:13:05.429  WRITE FPDMA QUEUED
  61 00 20 00 88 00 00 11 de 02 20 40 00     00:13:05.418  WRITE FPDMA QUEUED

Error 471 [14] occurred at disk power-on lifetime: 30874 hours (1286 days + 10 hours)
  When the command that caused the error occurred, the device was active or idle.

  After command completion occurred, registers were:
  ER -- ST COUNT  LBA_48  LH LM LL DV DC
  -- -- -- == -- == == == -- -- -- -- --
  40 -- 51 00 00 00 00 7f 00 1a 01 40 00  Error: WP at LBA = 0x7f001a01 = 2130713089

  Commands leading to the command that caused the error were:
  CR FEATR COUNT  LBA_48  LH LM LL DV DC  Powered_Up_Time  Command/Feature_Name
  -- == -- == -- == == == -- -- -- -- --  ---------------  --------------------
  61 00 60 00 70 00 00 11 de 01 00 40 00     00:13:03.074  WRITE FPDMA QUEUED
  61 00 08 00 68 00 00 11 21 ee 78 40 00     00:13:03.074  WRITE FPDMA QUEUED
  61 00 07 00 60 00 00 05 8e 9f c0 40 00     00:13:03.074  WRITE FPDMA QUEUED
  61 00 38 00 58 00 00 05 5f 69 e8 40 00     00:13:03.073  WRITE FPDMA QUEUED
  61 01 00 00 50 00 00 05 5f 68 e8 40 00     00:13:03.072  WRITE FPDMA QUEUED

Error 470 [13] occurred at disk power-on lifetime: 30874 hours (1286 days + 10 hours)
  When the command that caused the error occurred, the device was active or idle.

  After command completion occurred, registers were:
  ER -- ST COUNT  LBA_48  LH LM LL DV DC
  -- -- -- == -- == == == -- -- -- -- --
  40 -- 51 00 00 00 00 7f 00 1a 01 40 00  Error: WP at LBA = 0x7f001a01 = 2130713089

  Commands leading to the command that caused the error were:
  CR FEATR COUNT  LBA_48  LH LM LL DV DC  Powered_Up_Time  Command/Feature_Name
  -- == -- == -- == == == -- -- -- -- --  ---------------  --------------------
  61 00 08 00 d8 00 00 00 06 a5 58 40 00     00:13:00.528  WRITE FPDMA QUEUED
  61 00 08 00 d0 00 00 00 64 40 00 40 00     00:13:00.527  WRITE FPDMA QUEUED
  61 00 50 00 c8 00 00 00 65 e3 30 40 00     00:13:00.527  WRITE FPDMA QUEUED
  61 00 20 00 c0 00 00 11 c7 94 20 40 00     00:13:00.526  WRITE FPDMA QUEUED
  61 00 40 00 b8 00 00 11 de 00 c0 40 00     00:13:00.526  WRITE FPDMA QUEUED

Error 469 [12] occurred at disk power-on lifetime: 30874 hours (1286 days + 10 hours)
  When the command that caused the error occurred, the device was active or idle.

  After command completion occurred, registers were:
  ER -- ST COUNT  LBA_48  LH LM LL DV DC
  -- -- -- == -- == == == -- -- -- -- --
  40 -- 51 00 00 00 00 7f 00 1a 01 40 00  Error: UNC at LBA = 0x7f001a01 = 2130713089

  Commands leading to the command that caused the error were:
  CR FEATR COUNT  LBA_48  LH LM LL DV DC  Powered_Up_Time  Command/Feature_Name
  -- == -- == -- == == == -- -- -- -- --  ---------------  --------------------
  60 00 20 00 f0 00 00 00 1a 7f 00 40 00     00:12:58.036  READ FPDMA QUEUED
  60 00 40 00 e8 00 00 07 e4 1c 60 40 00     00:12:58.036  READ FPDMA QUEUED
  61 01 00 00 e0 00 00 05 5f 60 58 40 00     00:12:58.035  WRITE FPDMA QUEUED
  61 01 00 00 d8 00 00 05 5f 61 58 40 00     00:12:58.035  WRITE FPDMA QUEUED
  61 01 00 00 d0 00 00 05 5f 62 58 40 00     00:12:58.035  WRITE FPDMA QUEUED

SMART Extended Self-test Log Version: 1 (1 sectors)
Num  Test_Description    Status                  Remaining  LifeTime(hours)  LBA_of_first_error
# 1  Short offline       Completed without error       00%     18090         -

SMART Selective self-test log data structure revision number 1
 SPAN  MIN_LBA  MAX_LBA  CURRENT_TEST_STATUS
    1        0        0  Not_testing
    2        0        0  Not_testing
    3        0        0  Not_testing
    4        0        0  Not_testing
    5        0        0  Not_testing
Selective self-test flags (0x0):
  After scanning selected spans, do NOT read-scan remainder of disk.
If Selective self-test is pending on power-up, resume after 0 minute delay.

SCT Status Version:                  2
SCT Version (vendor specific):       258 (0x0102)
Device State:                        Active (0)
Current Temperature:                    30 Celsius
Power Cycle Min/Max Temperature:     24/30 Celsius
Lifetime    Min/Max Temperature:     25/64 Celsius
Under/Over Temperature Limit Count:   0/0
Vendor specific:
01 00 00 00 00 00 00 00 00 00 00 00 00 00 00 00
00 00 00 00 00 00 00 00 00 00 00 00 00 00 00 00

SCT Temperature History Version:     2
Temperature Sampling Period:         1 minute
Temperature Logging Interval:        1 minute
Min/Max recommended Temperature:      0/60 Celsius
Min/Max Temperature Limit:           -41/85 Celsius
Temperature History Size (Index):    128 (58)

SCT Error Recovery Control:
           Read:     85 (8.5 seconds)
          Write:     85 (8.5 seconds)

Device Statistics (GP/SMART Log 0x04) not supported

Pending Defects log (GP Log 0x0c) not supported

SATA Phy Event Counters (GP Log 0x11)
ID      Size     Value  Description
0x0001  2            0  Command failed due to ICRC error
0x0002  2            0  R_ERR response for data FIS
0x0003  2            0  R_ERR response for device-to-host data FIS
0x0004  2            0  R_ERR response for host-to-device data FIS
0x0005  2            0  R_ERR response for non-data FIS
0x0006  2            0  R_ERR response for device-to-host non-data FIS
0x0007  2            0  R_ERR response for host-to-device non-data FIS
0x000a  2            3  Device-to-host register FISes sent due to a COMRESET
0x8000  4          462  Vendor specific

