=== START OF INFORMATION SECTION ===
Device Model:     ADATA SP920SS
Serial Number:    --
LU WWN Device Id: 5 707c18 ...
Firmware Version: 1.08
User Capacity:    128 035 675 648 bytes [128 GB]
Sector Size:      512 bytes logical/physical
Rotation Rate:    Solid State Device
Device is:        Not in smartctl database [for details use: -P showall]
ATA Version is:   ACS-2, ACS-3 T13/2161-D revision 3b
SATA Version is:  SATA 3.0, 6.0 Gb/s (current: 3.0 Gb/s)
Local Time is:    Fri Jun 10 17:11:44 2016 MSK
SMART support is: Available - device has SMART capability.
SMART support is: Enabled
AAM feature is:   Unavailable
APM level is:     0 (reserved)
Rd look-ahead is: Enabled
Write cache is:   Enabled
ATA Security is:  Disabled, frozen [SEC2]
Wt Cache Reorder: Unavailable

=== START OF READ SMART DATA SECTION ===
SMART overall-health self-assessment test result: PASSED

General SMART Values:
Offline data collection status:  (0x80)	Offline data collection activity
					was never started.
					Auto Offline Data Collection: Enabled.
Self-test execution status:      (   0)	The previous self-test routine completed
					without error or no self-test has ever 
					been run.
Total time to complete Offline 
data collection: 		(    0) seconds.
Offline data collection
capabilities: 			 (0x15) SMART execute Offline immediate.
					No Auto Offline data collection support.
					Abort Offline collection upon new
					command.
					No Offline surface scan supported.
					Self-test supported.
					No Conveyance Self-test supported.
					No Selective Self-test supported.
SMART capabilities:            (0x0003)	Saves SMART data before entering
					power-saving mode.
					Supports SMART auto save timer.
Error logging capability:        (0x01)	Error logging supported.
					General Purpose Logging supported.
Short self-test routine 
recommended polling time: 	 (   2) minutes.
Extended self-test routine
recommended polling time: 	 (  10) minutes.

SMART Attributes Data Structure revision number: 10
Vendor Specific SMART Attributes with Thresholds:
ID# ATTRIBUTE_NAME          FLAGS    VALUE WORST THRESH FAIL RAW_VALUE
  1 Raw_Read_Error_Rate     POSR--   100   100   000    -    1135
  5 Reallocated_Sector_Ct   PO--CK   100   100   003    -    0
  9 Power_On_Hours          -O--CK   100   100   000    -    1771
 12 Power_Cycle_Count       -O--CK   100   100   000    -    251
174 Unknown_Attribute       ----CK   100   100   000    -    34
177 Wear_Leveling_Count     ------   100   100   000    -    0
187 Reported_Uncorrect      -O--CK   100   100   000    -    0
194 Temperature_Celsius     -O---K   046   054   000    -    46 (Min/Max 0/54)
195 Hardware_ECC_Recovered  --SRC-   100   100   000    -    1
231 Temperature_Celsius     PO--C-   100   100   010    -    0
233 Media_Wearout_Indicator ------   000   000   000    -    618613
234 Unknown_Attribute       -O--CK   000   000   000    -    788708
241 Total_LBAs_Written      -O--CK   000   000   000    -    565983
242 Total_LBAs_Read         -O--CK   000   000   000    -    703589
                            ||||||_ K auto-keep
                            |||||__ C event count
                            ||||___ R error rate
                            |||____ S speed/performance
                            ||_____ O updated online
                            |______ P prefailure warning

General Purpose Log Directory Version 1
SMART           Log Directory Version 1 [multi-sector log support]
Address    Access  R/W   Size  Description
0x00       GPL,SL  R/O      1  Log Directory
0x01           SL  R/O      1  Summary SMART error log
0x02           SL  R/O      2  Comprehensive SMART error log
0x03       GPL     R/O      1  Ext. Comprehensive SMART error log
0x04       GPL     R/O      8  Device Statistics log
0x06           SL  R/O      1  SMART self-test log
0x07       GPL     R/O      1  Extended self-test log
0x10       GPL     R/O      1  NCQ Command Error log
0x11       GPL     R/O      1  SATA Phy Event Counters
0x80-0x9f  GPL,SL  R/W     16  Host vendor specific log

SMART Extended Comprehensive Error Log Version: 1 (1 sectors)
No Errors Logged

SMART Extended Self-test Log Version: 1 (1 sectors)
No self-tests have been logged.  [To run self-tests, use: smartctl -t]

Selective Self-tests/Logging not supported

SCT Commands not supported

Device Statistics (GP Log 0x04)
Page Offset Size         Value  Description
  1  =====  =                =  == General Statistics (rev 2) ==
  1  0x008  4              251  Lifetime Power-On Resets
  1  0x018  6    1131941986567  Logical Sectors Written
  1  0x020  6            51763  Number of Write Commands
  1  0x028  6    1407147050226  Logical Sectors Read
  1  0x030  6            58316  Number of Read Commands
  7  =====  =                =  == Solid State Device Statistics (rev 1) ==
  7  0x008  1                0  Percentage Used Endurance Indicator

SATA Phy Event Counters (GP Log 0x11)
ID      Size     Value  Description
0x0001  4            0  Command failed due to ICRC error
0x0002  4            0  R_ERR response for data FIS
0x0005  4            0  R_ERR response for non-data FIS
0x000a  4            5  Device-to-host register FISes sent due to a COMRESET



