smartctl 7.3 2022-02-28 r5338 [x86_64-linux-6.2.10-300.fc38.x86_64] (local build)
Copyright (C) 2002-22, Bruce Allen, Christian Franke, www.smartmontools.org

=== START OF INFORMATION SECTION ===
Model Family:     Hitachi/HGST Travelstar Z5K500
Device Model:     HGST HTS545050A7E680
Serial Number:    --
LU WWN Device Id: 5 000cca ...
Firmware Version: GR2OA3E0
User Capacity:    500,107,862,016 bytes [500 GB]
Sector Sizes:     512 bytes logical, 4096 bytes physical
Rotation Rate:    5400 rpm
Form Factor:      2.5 inches
Device is:        In smartctl database 7.3/5417
ATA Version is:   ATA8-ACS T13/1699-D revision 6
SATA Version is:  SATA 2.6, 3.0 Gb/s (current: 3.0 Gb/s)
Local Time is:    Sun Apr  9 09:13:13 2023 +03
SMART support is: Available - device has SMART capability.
SMART support is: Enabled
AAM feature is:   Unavailable
APM level is:     128 (minimum power consumption without standby)
Rd look-ahead is: Enabled
Write cache is:   Enabled
DSN feature is:   Unavailable
ATA Security is:  Disabled, frozen [SEC2]
Wt Cache Reorder: Enabled

=== START OF READ SMART DATA SECTION ===
SMART overall-health self-assessment test result: PASSED

General SMART Values:
Offline data collection status:  (0x00)	Offline data collection activity
					was never started.
					Auto Offline Data Collection: Disabled.
Self-test execution status:      (   0)	The previous self-test routine completed
					without error or no self-test has ever 
					been run.
Total time to complete Offline 
data collection: 		(   45) seconds.
Offline data collection
capabilities: 			 (0x5b) SMART execute Offline immediate.
					Auto Offline data collection on/off support.
					Suspend Offline collection upon new
					command.
					Offline surface scan supported.
					Self-test supported.
					No Conveyance Self-test supported.
					Selective Self-test supported.
SMART capabilities:            (0x0003)	Saves SMART data before entering
					power-saving mode.
					Supports SMART auto save timer.
Error logging capability:        (0x01)	Error logging supported.
					General Purpose Logging supported.
Short self-test routine 
recommended polling time: 	 (   2) minutes.
Extended self-test routine
recommended polling time: 	 ( 118) minutes.
SCT capabilities: 	       (0x003d)	SCT Status supported.
					SCT Error Recovery Control supported.
					SCT Feature Control supported.
					SCT Data Table supported.

SMART Attributes Data Structure revision number: 16
Vendor Specific SMART Attributes with Thresholds:
ID# ATTRIBUTE_NAME          FLAGS    VALUE WORST THRESH FAIL RAW_VALUE
  1 Raw_Read_Error_Rate     PO-R--   100   100   062    -    0
  2 Throughput_Performance  P-S---   100   100   040    -    0
  3 Spin_Up_Time            POS---   214   214   033    -    1
  4 Start_Stop_Count        -O--C-   099   099   000    -    2267
  5 Reallocated_Sector_Ct   PO--CK   100   100   005    -    0
  7 Seek_Error_Rate         PO-R--   100   100   067    -    0
  8 Seek_Time_Performance   P-S---   100   100   040    -    0
  9 Power_On_Hours          -O--C-   095   095   000    -    2244
 10 Spin_Retry_Count        PO--C-   100   100   060    -    0
 12 Power_Cycle_Count       -O--CK   100   100   000    -    1250
191 G-Sense_Error_Rate      -O-R--   100   100   000    -    0
192 Power-Off_Retract_Count -O--CK   100   100   000    -    99
193 Load_Cycle_Count        -O--C-   092   092   000    -    80089
194 Temperature_Celsius     -O----   176   176   000    -    34 (Min/Max 10/48)
196 Reallocated_Event_Count -O--CK   100   100   000    -    1
197 Current_Pending_Sector  -O---K   100   100   000    -    0
198 Offline_Uncorrectable   ---R--   100   100   000    -    0
199 UDMA_CRC_Error_Count    -O-R--   200   200   000    -    327
223 Load_Retry_Count        -O-R--   100   100   000    -    0
                            ||||||_ K auto-keep
                            |||||__ C event count
                            ||||___ R error rate
                            |||____ S speed/performance
                            ||_____ O updated online
                            |______ P prefailure warning

General Purpose Log Directory Version 1
SMART           Log Directory Version 1 [multi-sector log support]
Address    Access  R/W   Size  Description
0x00       GPL,SL  R/O      1  Log Directory
0x01           SL  R/O      1  Summary SMART error log
0x02           SL  R/O      1  Comprehensive SMART error log
0x03       GPL     R/O      1  Ext. Comprehensive SMART error log
0x06           SL  R/O      1  SMART self-test log
0x07       GPL     R/O      1  Extended self-test log
0x09           SL  R/W      1  Selective self-test log
0x10       GPL     R/O      1  NCQ Command Error log
0x11       GPL     R/O      1  SATA Phy Event Counters log
0x80-0x9f  GPL,SL  R/W     16  Host vendor specific log
0xe0       GPL,SL  R/W      1  SCT Command/Status
0xe1       GPL,SL  R/W      1  SCT Data Transfer

SMART Extended Comprehensive Error Log Version: 1 (1 sectors)
Device Error Count: 339 (device log contains only the most recent 4 errors)
	CR     = Command Register
	FEATR  = Features Register
	COUNT  = Count (was: Sector Count) Register
	LBA_48 = Upper bytes of LBA High/Mid/Low Registers ]  ATA-8
	LH     = LBA High (was: Cylinder High) Register    ]   LBA
	LM     = LBA Mid (was: Cylinder Low) Register      ] Register
	LL     = LBA Low (was: Sector Number) Register     ]
	DV     = Device (was: Device/Head) Register
	DC     = Device Control Register
	ER     = Error register
	ST     = Status register
Powered_Up_Time is measured from power on, and printed as
DDd+hh:mm:SS.sss where DD=days, hh=hours, mm=minutes,
SS=sec, and sss=millisec. It "wraps" after 49.710 days.

Error 339 [2] occurred at disk power-on lifetime: 2227 hours (92 days + 19 hours)
  When the command that caused the error occurred, the device was active or idle.

  After command completion occurred, registers were:
  ER -- ST COUNT  LBA_48  LH LM LL DV DC
  -- -- -- == -- == == == -- -- -- -- --
  40 -- 51 00 08 00 00 09 f8 8e 50 09 00  Error: UNC at LBA = 0x09f88e50 = 167284304

  Commands leading to the command that caused the error were:
  CR FEATR COUNT  LBA_48  LH LM LL DV DC  Powered_Up_Time  Command/Feature_Name
  -- == -- == -- == == == -- -- -- -- --  ---------------  --------------------
  60 00 08 00 78 00 00 09 f8 8e 50 40 00     02:11:05.783  READ FPDMA QUEUED
  61 02 c0 00 68 00 00 18 80 2e 40 40 00     02:11:05.783  WRITE FPDMA QUEUED
  61 02 c0 00 60 00 00 18 80 36 40 40 00     02:11:05.783  WRITE FPDMA QUEUED
  ef 00 10 00 03 00 00 00 00 00 00 a0 00     02:11:05.782  SET FEATURES [Enable SATA feature]
  ef 00 10 00 02 00 00 00 00 00 00 a0 00     02:11:05.782  SET FEATURES [Enable SATA feature]

Error 338 [1] occurred at disk power-on lifetime: 2227 hours (92 days + 19 hours)
  When the command that caused the error occurred, the device was active or idle.

  After command completion occurred, registers were:
  ER -- ST COUNT  LBA_48  LH LM LL DV DC
  -- -- -- == -- == == == -- -- -- -- --
  40 -- 51 00 08 00 00 09 f8 8e 50 09 00  Error: WP at LBA = 0x09f88e50 = 167284304

  Commands leading to the command that caused the error were:
  CR FEATR COUNT  LBA_48  LH LM LL DV DC  Powered_Up_Time  Command/Feature_Name
  -- == -- == -- == == == -- -- -- -- --  ---------------  --------------------
  61 02 c0 00 b0 00 00 18 80 36 40 40 00     02:11:04.680  WRITE FPDMA QUEUED
  61 02 c0 00 a8 00 00 18 80 2e 40 40 00     02:11:04.680  WRITE FPDMA QUEUED
  61 05 40 00 a0 00 00 18 80 29 00 40 00     02:11:04.680  WRITE FPDMA QUEUED
  61 05 40 00 98 00 00 18 80 31 00 40 00     02:11:04.680  WRITE FPDMA QUEUED
  60 00 08 00 08 00 00 09 f8 8e 50 40 00     02:11:02.238  READ FPDMA QUEUED

Error 337 [0] occurred at disk power-on lifetime: 2227 hours (92 days + 19 hours)
  When the command that caused the error occurred, the device was active or idle.

  After command completion occurred, registers were:
  ER -- ST COUNT  LBA_48  LH LM LL DV DC
  -- -- -- == -- == == == -- -- -- -- --
  40 -- 51 04 10 00 00 09 f8 97 f0 09 00  Error: UNC at LBA = 0x09f897f0 = 167286768

  Commands leading to the command that caused the error were:
  CR FEATR COUNT  LBA_48  LH LM LL DV DC  Powered_Up_Time  Command/Feature_Name
  -- == -- == -- == == == -- -- -- -- --  ---------------  --------------------
  60 0a 00 00 20 00 00 09 f8 92 00 40 00     02:10:58.529  READ FPDMA QUEUED
  61 05 40 00 18 00 00 18 80 21 00 40 00     02:10:58.529  WRITE FPDMA QUEUED
  61 05 40 00 10 00 00 18 80 19 00 40 00     02:10:58.529  WRITE FPDMA QUEUED
  61 02 c0 00 08 00 00 18 80 1e 40 40 00     02:10:58.529  WRITE FPDMA QUEUED
  61 02 c0 00 00 00 00 18 80 26 40 40 00     02:10:58.529  WRITE FPDMA QUEUED

Error 336 [3] occurred at disk power-on lifetime: 2227 hours (92 days + 19 hours)
  When the command that caused the error occurred, the device was active or idle.

  After command completion occurred, registers were:
  ER -- ST COUNT  LBA_48  LH LM LL DV DC
  -- -- -- == -- == == == -- -- -- -- --
  40 -- 51 03 b0 00 00 09 f8 8e 50 09 00  Error: UNC at LBA = 0x09f88e50 = 167284304

  Commands leading to the command that caused the error were:
  CR FEATR COUNT  LBA_48  LH LM LL DV DC  Powered_Up_Time  Command/Feature_Name
  -- == -- == -- == == == -- -- -- -- --  ---------------  --------------------
  60 06 00 00 48 00 00 09 f8 8c 00 40 00     02:10:54.735  READ FPDMA QUEUED
  60 0a 00 00 40 00 00 09 f8 82 00 40 00     02:10:54.724  READ FPDMA QUEUED
  60 06 00 00 38 00 00 09 f8 7c 00 40 00     02:10:54.718  READ FPDMA QUEUED
  60 0a 00 00 30 00 00 09 f8 72 00 40 00     02:10:54.706  READ FPDMA QUEUED
  60 06 00 00 28 00 00 09 f8 6c 00 40 00     02:10:54.699  READ FPDMA QUEUED

SMART Extended Self-test Log Version: 1 (1 sectors)
No self-tests have been logged.  [To run self-tests, use: smartctl -t]

SMART Selective self-test log data structure revision number 1
 SPAN  MIN_LBA  MAX_LBA  CURRENT_TEST_STATUS
    1        0        0  Not_testing
    2        0        0  Not_testing
    3        0        0  Not_testing
    4        0        0  Not_testing
    5        0        0  Not_testing
Selective self-test flags (0x0):
  After scanning selected spans, do NOT read-scan remainder of disk.
If Selective self-test is pending on power-up, resume after 0 minute delay.

SCT Status Version:                  3
SCT Version (vendor specific):       256 (0x0100)
Device State:                        Active (0)
Current Temperature:                    34 Celsius
Power Cycle Min/Max Temperature:     32/34 Celsius
Lifetime    Min/Max Temperature:     10/48 Celsius
Specified Max Operating Temperature:    34 Celsius
Under/Over Temperature Limit Count:   0/0

SCT Temperature History Version:     2
Temperature Sampling Period:         1 minute
Temperature Logging Interval:        1 minute
Min/Max recommended Temperature:      0/60 Celsius
Min/Max Temperature Limit:           -40/65 Celsius
Temperature History Size (Index):    128 (119)

SCT Error Recovery Control:
           Read: Disabled
          Write: Disabled

Device Statistics (GP/SMART Log 0x04) not supported

Pending Defects log (GP Log 0x0c) not supported

SATA Phy Event Counters (GP Log 0x11)
ID      Size     Value  Description
0x0001  2            0  Command failed due to ICRC error
0x0002  2            0  R_ERR response for data FIS
0x0003  2            0  R_ERR response for device-to-host data FIS
0x0004  2            0  R_ERR response for host-to-device data FIS
0x0005  2            0  R_ERR response for non-data FIS
0x0006  2            0  R_ERR response for device-to-host non-data FIS
0x0007  2            0  R_ERR response for host-to-device non-data FIS
0x0009  2         2547  Transition from drive PhyRdy to drive PhyNRdy
0x000a  2           17  Device-to-host register FISes sent due to a COMRESET
0x000b  2            0  CRC errors within host-to-device FIS
0x000d  2            0  Non-CRC errors within host-to-device FIS



