smartctl 7.2 2020-12-30 r5155 [x86_64-linux-5.11.0-16-generic] (local build)
Copyright (C) 2002-20, Bruce Allen, Christian Franke, www.smartmontools.org

=== START OF INFORMATION SECTION ===
Model Family:     Fujitsu MHW BH
Device Model:     FUJITSU MHW2160BH
Serial Number:    --
LU WWN Device Id: 5 00000e ...
Firmware Version: 0000001C
User Capacity:    160,041,885,696 bytes [160 GB]
Sector Size:      512 bytes logical/physical
Device is:        In smartctl database [for details use: -P show]
ATA Version is:   ATA8-ACS T13/1699-D revision 3b
SATA Version is:  SATA 2.5, 1.5 Gb/s
Local Time is:    Tue Sep 14 06:36:06 2021 UTC
SMART support is: Available - device has SMART capability.
SMART support is: Enabled
AAM level is:     192 (intermediate), recommended: 254
APM feature is:   Disabled
Rd look-ahead is: Enabled
Write cache is:   Enabled
DSN feature is:   Unavailable
ATA Security is:  Disabled, frozen [SEC2]
Wt Cache Reorder: Enabled

=== START OF READ SMART DATA SECTION ===
SMART overall-health self-assessment test result: PASSED

General SMART Values:
Offline data collection status:  (0x00)	Offline data collection activity
					was never started.
					Auto Offline Data Collection: Disabled.
Self-test execution status:      (   0)	The previous self-test routine completed
					without error or no self-test has ever 
					been run.
Total time to complete Offline 
data collection: 		(  649) seconds.
Offline data collection
capabilities: 			 (0x7b) SMART execute Offline immediate.
					Auto Offline data collection on/off support.
					Suspend Offline collection upon new
					command.
					Offline surface scan supported.
					Self-test supported.
					Conveyance Self-test supported.
					Selective Self-test supported.
SMART capabilities:            (0x0003)	Saves SMART data before entering
					power-saving mode.
					Supports SMART auto save timer.
Error logging capability:        (0x01)	Error logging supported.
					General Purpose Logging supported.
Short self-test routine 
recommended polling time: 	 (   2) minutes.
Extended self-test routine
recommended polling time: 	 (  92) minutes.
Conveyance self-test routine
recommended polling time: 	 (   2) minutes.
SCT capabilities: 	       (0x003d)	SCT Status supported.
					SCT Error Recovery Control supported.
					SCT Feature Control supported.
					SCT Data Table supported.

SMART Attributes Data Structure revision number: 16
Vendor Specific SMART Attributes with Thresholds:
ID# ATTRIBUTE_NAME          FLAGS    VALUE WORST THRESH FAIL RAW_VALUE
  1 Raw_Read_Error_Rate     POSR--   100   100   046    -    50930
  2 Throughput_Performance  P-S---   100   100   030    -    38928384
  3 Spin_Up_Time            PO----   100   100   025    -    1
  4 Start_Stop_Count        -O--CK   099   099   000    -    4789
  5 Reallocated_Sector_Ct   PO--CK   100   100   024    -    0 (2000 0)
  7 Seek_Error_Rate         POSR--   100   100   047    -    2677
  8 Seek_Time_Performance   P-S---   100   100   019    -    0
  9 Power_On_Hours          -O--CK   029   029   000    -    35776
 10 Spin_Retry_Count        PO--C-   100   100   020    -    0
 12 Power_Cycle_Count       -O--CK   100   100   000    -    2350
192 Power-Off_Retract_Count -O--CK   100   100   000    -    195
193 Load_Cycle_Count        -O--CK   090   090   000    -    207074
194 Temperature_Celsius     -O---K   100   100   000    -    27 (Min/Max 16/58)
195 Hardware_ECC_Recovered  -O-RC-   100   100   000    -    7
196 Reallocated_Event_Count -O--CK   100   100   000    -    0 (0 6890)
197 Current_Pending_Sector  -O--C-   100   100   000    -    0
198 Offline_Uncorrectable   ----C-   100   100   000    -    0
199 UDMA_CRC_Error_Count    -OSRCK   200   200   000    -    0
200 Multi_Zone_Error_Rate   POSR--   100   100   060    -    2905
203 Run_Out_Cancel          -O----   100   100   000    -    2628538729179
240 Head_Flying_Hours       -OSRCK   200   200   000    -    0
                            ||||||_ K auto-keep
                            |||||__ C event count
                            ||||___ R error rate
                            |||____ S speed/performance
                            ||_____ O updated online
                            |______ P prefailure warning

General Purpose Log Directory Version 1
SMART           Log Directory Version 1 [multi-sector log support]
Address    Access  R/W   Size  Description
0x00       GPL,SL  R/O      1  Log Directory
0x01       GPL,SL  R/O      1  Summary SMART error log
0x02       GPL,SL  R/O     51  Comprehensive SMART error log
0x03       GPL,SL  R/O     64  Ext. Comprehensive SMART error log
0x06       GPL,SL  R/O      1  SMART self-test log
0x07       GPL,SL  R/O      2  Extended self-test log
0x09       GPL,SL  R/W      1  Selective self-test log
0x10       GPL,SL  R/O      1  NCQ Command Error log
0x11       GPL,SL  R/O      1  SATA Phy Event Counters log
0x80-0x9f  GPL,SL  R/W     16  Host vendor specific log
0xa1       GPL,SL  VS       1  Device vendor specific log

SMART Extended Comprehensive Error Log Version: 1 (64 sectors)
Device Error Count: 2
	CR     = Command Register
	FEATR  = Features Register
	COUNT  = Count (was: Sector Count) Register
	LBA_48 = Upper bytes of LBA High/Mid/Low Registers ]  ATA-8
	LH     = LBA High (was: Cylinder High) Register    ]   LBA
	LM     = LBA Mid (was: Cylinder Low) Register      ] Register
	LL     = LBA Low (was: Sector Number) Register     ]
	DV     = Device (was: Device/Head) Register
	DC     = Device Control Register
	ER     = Error register
	ST     = Status register
Powered_Up_Time is measured from power on, and printed as
DDd+hh:mm:SS.sss where DD=days, hh=hours, mm=minutes,
SS=sec, and sss=millisec. It "wraps" after 49.710 days.

Error 2 [1] occurred at disk power-on lifetime: 30731 hours (1280 days + 11 hours)
  When the command that caused the error occurred, the device was active or idle.

  After command completion occurred, registers were:
  ER -- ST COUNT  LBA_48  LH LM LL DV DC
  -- -- -- == -- == == == -- -- -- -- --
  84 -- 51 02 18 00 00 03 11 dc 00 e0 00  Error: ICRC, ABRT 536 sectors at LBA = 0x0311dc00 = 51502080

  Commands leading to the command that caused the error were:
  CR FEATR COUNT  LBA_48  LH LM LL DV DC  Powered_Up_Time  Command/Feature_Name
  -- == -- == -- == == == -- -- -- -- --  ---------------  --------------------
  35 00 00 02 98 00 00 03 11 db 80 e0 00     13:12:08.102  WRITE DMA EXT
  ca 00 00 00 20 11 d9 6f 11 da 68 e3 00     13:12:08.101  WRITE DMA
  35 00 00 01 a8 00 00 03 11 d7 c8 e0 00     13:12:08.099  WRITE DMA EXT
  ca 00 00 00 08 11 d1 af 11 d1 c0 e3 00     13:12:08.098  WRITE DMA
  ca 00 00 00 10 11 d0 df 11 d1 a0 e3 00     13:12:08.098  WRITE DMA

Error 1 [0] occurred at disk power-on lifetime: 30160 hours (1256 days + 16 hours)
  When the command that caused the error occurred, the device was active or idle.

  After command completion occurred, registers were:
  ER -- ST COUNT  LBA_48  LH LM LL DV DC
  -- -- -- == -- == == == -- -- -- -- --
  84 -- 51 00 00 00 00 00 91 07 ff e0 00  Error: ICRC, ABRT at LBA = 0x009107ff = 9504767

  Commands leading to the command that caused the error were:
  CR FEATR COUNT  LBA_48  LH LM LL DV DC  Powered_Up_Time  Command/Feature_Name
  -- == -- == -- == == == -- -- -- -- --  ---------------  --------------------
  35 00 00 04 00 00 00 00 91 04 00 e0 00     07:05:17.977  WRITE DMA EXT
  35 00 00 0a 00 00 00 00 90 fa 00 e0 00     07:05:17.949  WRITE DMA EXT
  35 00 00 0a 00 00 00 00 90 f0 00 e0 00     07:05:17.922  WRITE DMA EXT
  35 00 00 0a 00 00 00 00 90 e6 00 e0 00     07:05:17.894  WRITE DMA EXT
  35 00 00 0a 00 00 00 00 90 dc 00 e0 00     07:05:17.867  WRITE DMA EXT

SMART Extended Self-test Log Version: 1 (2 sectors)
Num  Test_Description    Status                  Remaining  LifeTime(hours)  LBA_of_first_error
# 1  Short offline       Completed without error       00%     31388         -
# 2  Short offline       Completed without error       00%     31364         -
# 3  Short offline       Completed without error       00%     30157         -
# 4  Extended offline    Completed without error       00%     30155         -
# 5  Short offline       Completed without error       00%     30114         -
# 6  Short offline       Completed without error       00%     30084         -
# 7  Short offline       Completed without error       00%     30058         -
# 8  Short offline       Completed without error       00%     30046         -
# 9  Short offline       Completed without error       00%     29946         -
#10  Short offline       Completed without error       00%     29909         -
#11  Short offline       Completed without error       00%     29886         -
#12  Short offline       Completed without error       00%     29861         -
#13  Short offline       Completed without error       00%      2220         -
#14  Short offline       Completed without error       00%         0         -

SMART Selective self-test log data structure revision number 1
 SPAN  MIN_LBA  MAX_LBA  CURRENT_TEST_STATUS
    1        0        0  Not_testing
    2        0        0  Not_testing
    3        0        0  Not_testing
    4        0        0  Not_testing
    5        0        0  Not_testing
Selective self-test flags (0x0):
  After scanning selected spans, do NOT read-scan remainder of disk.
If Selective self-test is pending on power-up, resume after 0 minute delay.

SCT Status Version:                  2
SCT Version (vendor specific):       0 (0x0000)
Device State:                        Active (0)
Current Temperature:                    27 Celsius
Power Cycle Min/Max Temperature:     --/29 Celsius
Lifetime    Min/Max Temperature:     --/58 Celsius

SCT Temperature History Version:     2
Temperature Sampling Period:         1 minute
Temperature Logging Interval:        1 minute
Min/Max recommended Temperature:      5/60 Celsius
Min/Max Temperature Limit:           -40/65 Celsius
Temperature History Size (Index):    128 (48)

SCT Error Recovery Control:
           Read: Disabled
          Write: Disabled

Device Statistics (GP/SMART Log 0x04) not supported

Pending Defects log (GP Log 0x0c) not supported

SATA Phy Event Counters (GP Log 0x11)
ID      Size     Value  Description
0x0001  4            0  Command failed due to ICRC error
0x0002  4            0  R_ERR response for data FIS
0x0003  4            0  R_ERR response for device-to-host data FIS
0x0004  4            0  R_ERR response for host-to-device data FIS
0x0005  4            0  R_ERR response for non-data FIS
0x0006  4            0  R_ERR response for device-to-host non-data FIS
0x0008  4            0  Device-to-host non-data FIS retries
0x0009  4            1  Transition from drive PhyRdy to drive PhyNRdy
0x000a  4            1  Device-to-host register FISes sent due to a COMRESET
0x000b  4            0  CRC errors within host-to-device FIS
0x000d  4            0  Non-CRC errors within host-to-device FIS
0x000f  4            0  R_ERR response for host-to-device data FIS, CRC
0x0010  4            0  R_ERR response for host-to-device data FIS, non-CRC



