smartctl 7.2 2020-12-30 r5155 [x86_64-linux-5.10.14-desktop-1omv4002] (OpenMandriva Lx 7.2-2)
Copyright (C) 2002-20, Bruce Allen, Christian Franke, www.smartmontools.org

=== START OF INFORMATION SECTION ===
Model Family:     Seagate Momentus 5400.4
Device Model:     ST9250827AS
Serial Number:    --
LU WWN Device Id: 5 000c50 ...
Firmware Version: 3.AAA
User Capacity:    250,059,350,016 bytes [250 GB]
Sector Size:      512 bytes logical/physical
Rotation Rate:    5400 rpm
Device is:        In smartctl database [for details use: -P show]
ATA Version is:   ATA8-ACS T13/1699-D revision 4
SATA Version is:  SATA 2.6, 1.5 Gb/s
Local Time is:    Tue Mar 23 16:28:19 2021 UTC
SMART support is: Available - device has SMART capability.
SMART support is: Enabled
AAM feature is:   Unavailable
APM level is:     254 (maximum performance)
Rd look-ahead is: Enabled
Write cache is:   Enabled
DSN feature is:   Unavailable
ATA Security is:  Disabled, frozen [SEC2]
Wt Cache Reorder: Unavailable

=== START OF READ SMART DATA SECTION ===
SMART overall-health self-assessment test result: PASSED

General SMART Values:
Offline data collection status:  (0x82)	Offline data collection activity
					was completed without error.
					Auto Offline Data Collection: Enabled.
Self-test execution status:      ( 117)	The previous self-test completed having
					the read element of the test failed.
Total time to complete Offline 
data collection: 		(  426) seconds.
Offline data collection
capabilities: 			 (0x5b) SMART execute Offline immediate.
					Auto Offline data collection on/off support.
					Suspend Offline collection upon new
					command.
					Offline surface scan supported.
					Self-test supported.
					No Conveyance Self-test supported.
					Selective Self-test supported.
SMART capabilities:            (0x0003)	Saves SMART data before entering
					power-saving mode.
					Supports SMART auto save timer.
Error logging capability:        (0x01)	Error logging supported.
					No General Purpose Logging support.
Short self-test routine 
recommended polling time: 	 (   1) minutes.
Extended self-test routine
recommended polling time: 	 (  92) minutes.
SCT capabilities: 	       (0x0001)	SCT Status supported.

SMART Attributes Data Structure revision number: 10
Vendor Specific SMART Attributes with Thresholds:
ID# ATTRIBUTE_NAME          FLAGS    VALUE WORST THRESH FAIL RAW_VALUE
  1 Raw_Read_Error_Rate     POSR--   100   253   006    -    0
  3 Spin_Up_Time            PO----   099   099   000    -    0
  4 Start_Stop_Count        -O--CK   087   087   020    -    13386
  5 Reallocated_Sector_Ct   PO--CK   052   052   036    -    1922
  7 Seek_Error_Rate         POSR--   086   060   030    -    443685208
  9 Power_On_Hours          -O--CK   079   079   000    -    19015
 10 Spin_Retry_Count        PO--C-   100   100   034    -    0
 12 Power_Cycle_Count       -O--CK   088   088   020    -    12954
187 Reported_Uncorrect      -O--CK   001   001   000    -    2660
189 High_Fly_Writes         -O-RCK   001   001   000    -    770
190 Airflow_Temperature_Cel -O---K   060   046   045    -    40 (Min/Max 13/54)
191 G-Sense_Error_Rate      -O--CK   100   100   000    -    111
192 Power-Off_Retract_Count -O--CK   099   099   000    -    3176
193 Load_Cycle_Count        -O---K   001   001   000    -    382895
194 Temperature_Celsius     -O-RC-   040   054   000    -    40 (0 13 0 0 0)
195 Hardware_ECC_Recovered  -O--C-   054   042   000    -    66840628
197 Current_Pending_Sector  ----C-   097   058   000    -    66
198 Offline_Uncorrectable   -OSRCK   097   058   000    -    66
199 UDMA_CRC_Error_Count    ------   200   200   000    -    21
200 Multi_Zone_Error_Rate   -O--CK   100   253   000    -    0
202 Data_Address_Mark_Errs  ------   100   253   000    -    0
                            ||||||_ K auto-keep
                            |||||__ C event count
                            ||||___ R error rate
                            |||____ S speed/performance
                            ||_____ O updated online
                            |______ P prefailure warning

General Purpose Log Directory not supported

SMART Log Directory Version 1 [multi-sector log support]
Address    Access  R/W   Size  Description
0x00           SL  R/O      1  Log Directory
0x01           SL  R/O      1  Summary SMART error log
0x02           SL  R/O      5  Comprehensive SMART error log
0x03           SL  R/O      5  Ext. Comprehensive SMART error log
0x06           SL  R/O      1  SMART self-test log
0x07           SL  R/O      1  Extended self-test log
0x09           SL  R/W      1  Selective self-test log
0x10           SL  R/O      1  NCQ Command Error log
0x11           SL  R/O      1  SATA Phy Event Counters log
0x20           SL  R/O      1  Streaming performance log [OBS-8]
0x21           SL  R/O      1  Write stream error log
0x22           SL  R/O      1  Read stream error log
0x23           SL  R/O      1  Delayed sector log [OBS-8]
0x80-0x9f      SL  R/W     16  Host vendor specific log
0xa0           SL  VS       1  Device vendor specific log
0xa1           SL  VS      20  Device vendor specific log
0xa2           SL  VS     101  Device vendor specific log
0xa8           SL  VS      20  Device vendor specific log
0xa9           SL  VS       1  Device vendor specific log
0xe0           SL  R/W      1  SCT Command/Status
0xe1           SL  R/W      1  SCT Data Transfer

SMART Extended Comprehensive Error Log (GP Log 0x03) not supported

SMART Error Log Version: 1
ATA Error Count: 2722 (device log contains only the most recent five errors)
	CR = Command Register [HEX]
	FR = Features Register [HEX]
	SC = Sector Count Register [HEX]
	SN = Sector Number Register [HEX]
	CL = Cylinder Low Register [HEX]
	CH = Cylinder High Register [HEX]
	DH = Device/Head Register [HEX]
	DC = Device Command Register [HEX]
	ER = Error register [HEX]
	ST = Status register [HEX]
Powered_Up_Time is measured from power on, and printed as
DDd+hh:mm:SS.sss where DD=days, hh=hours, mm=minutes,
SS=sec, and sss=millisec. It "wraps" after 49.710 days.

Error 2722 occurred at disk power-on lifetime: 18631 hours (776 days + 7 hours)
  When the command that caused the error occurred, the device was active or idle.

  After command completion occurred, registers were:
  ER ST SC SN CL CH DH
  -- -- -- -- -- -- --
  40 51 00 b5 47 d1 e0  Error: UNC at LBA = 0x00d147b5 = 13715381

  Commands leading to the command that caused the error were:
  CR FR SC SN CL CH DH DC   Powered_Up_Time  Command/Feature_Name
  -- -- -- -- -- -- -- --  ----------------  --------------------
  25 20 3b 80 47 d1 e0 00      00:28:47.807  READ DMA EXT
  25 20 39 c7 71 4c e0 00      00:28:47.799  READ DMA EXT
  25 20 07 c0 71 4c e0 00      00:28:47.798  READ DMA EXT
  25 20 01 3f 00 00 e0 00      00:28:47.784  READ DMA EXT
  25 20 3f 00 00 00 e0 00      00:28:47.784  READ DMA EXT

Error 2721 occurred at disk power-on lifetime: 18631 hours (776 days + 7 hours)
  When the command that caused the error occurred, the device was active or idle.

  After command completion occurred, registers were:
  ER ST SC SN CL CH DH
  -- -- -- -- -- -- --
  40 51 00 b5 47 d1 e0  Error: UNC at LBA = 0x00d147b5 = 13715381

  Commands leading to the command that caused the error were:
  CR FR SC SN CL CH DH DC   Powered_Up_Time  Command/Feature_Name
  -- -- -- -- -- -- -- --  ----------------  --------------------
  25 20 3b 80 47 d1 e0 00      00:28:37.951  READ DMA EXT
  25 20 39 c7 71 4c e0 00      00:28:37.951  READ DMA EXT
  25 20 07 c0 71 4c e0 00      00:28:37.951  READ DMA EXT
  25 20 07 39 71 4d e0 00      00:28:37.950  READ DMA EXT
  25 20 39 00 71 4d e0 00      00:28:37.950  READ DMA EXT

Error 2720 occurred at disk power-on lifetime: 18629 hours (776 days + 5 hours)
  When the command that caused the error occurred, the device was active or idle.

  After command completion occurred, registers were:
  ER ST SC SN CL CH DH
  -- -- -- -- -- -- --
  40 51 00 b5 47 d1 e0  Error: UNC at LBA = 0x00d147b5 = 13715381

  Commands leading to the command that caused the error were:
  CR FR SC SN CL CH DH DC   Powered_Up_Time  Command/Feature_Name
  -- -- -- -- -- -- -- --  ----------------  --------------------
  25 20 3b 80 47 d1 e0 00      00:00:26.370  READ DMA EXT
  25 20 39 c7 71 4c e0 00      00:00:26.370  READ DMA EXT
  25 20 07 c0 71 4c e0 00      00:00:26.354  READ DMA EXT
  25 20 01 3f 00 00 e0 00      00:00:26.353  READ DMA EXT
  25 20 3f 00 00 00 e0 00      00:00:26.345  READ DMA EXT

Error 2719 occurred at disk power-on lifetime: 18629 hours (776 days + 5 hours)
  When the command that caused the error occurred, the device was active or idle.

  After command completion occurred, registers were:
  ER ST SC SN CL CH DH
  -- -- -- -- -- -- --
  40 51 00 b5 47 d1 e0  Error: UNC at LBA = 0x00d147b5 = 13715381

  Commands leading to the command that caused the error were:
  CR FR SC SN CL CH DH DC   Powered_Up_Time  Command/Feature_Name
  -- -- -- -- -- -- -- --  ----------------  --------------------
  25 20 3b 80 47 d1 e0 00      00:00:16.405  READ DMA EXT
  25 20 39 c7 71 4c e0 00      00:00:16.405  READ DMA EXT
  25 20 07 c0 71 4c e0 00      00:00:16.410  READ DMA EXT
  25 20 07 39 71 4d e0 00      00:00:16.409  READ DMA EXT
  25 20 39 00 71 4d e0 00      00:00:16.409  READ DMA EXT

Error 2718 occurred at disk power-on lifetime: 18629 hours (776 days + 5 hours)
  When the command that caused the error occurred, the device was active or idle.

  After command completion occurred, registers were:
  ER ST SC SN CL CH DH
  -- -- -- -- -- -- --
  40 51 00 b5 47 d1 e0  Error: UNC at LBA = 0x00d147b5 = 13715381

  Commands leading to the command that caused the error were:
  CR FR SC SN CL CH DH DC   Powered_Up_Time  Command/Feature_Name
  -- -- -- -- -- -- -- --  ----------------  --------------------
  25 20 3b 80 47 d1 e0 00      00:53:50.619  READ DMA EXT
  25 20 39 c7 71 4c e0 00      00:53:50.619  READ DMA EXT
  25 20 07 c0 71 4c e0 00      00:53:52.797  READ DMA EXT
  25 20 32 4e 8f 50 e0 00      00:53:52.797  READ DMA EXT
  25 20 0e 40 8f 50 e0 00      00:53:52.796  READ DMA EXT

SMART Extended Self-test Log (GP Log 0x07) not supported

SMART Self-test log structure revision number 1
Num  Test_Description    Status                  Remaining  LifeTime(hours)  LBA_of_first_error
# 1  Short offline       Completed: read failure       50%     18967         488334043
# 2  Extended offline    Interrupted (host reset)      90%     18955         -
# 3  Short offline       Completed: read failure       50%     18906         488334043
# 4  Short offline       Completed: read failure       40%     18905         488334043
# 5  Short offline       Completed: read failure       50%     18899         488334043
# 6  Short offline       Completed: read failure       40%     18897         488334043
# 7  Short offline       Completed: read failure       50%     18892         488334043
# 8  Short offline       Completed: read failure       50%     18891         488334043
# 9  Short offline       Completed: read failure       50%     18884         488334043
#10  Short offline       Completed: read failure       50%     18879         488334043
#11  Short offline       Completed: read failure       50%     18874         488334043
#12  Extended offline    Completed: read failure       90%     18730         483477429
#13  Short offline       Completed: read failure       90%     18705         483477429
#14  Short offline       Completed: read failure       90%     18701         483477429
#15  Short offline       Completed: read failure       50%     18283         488334043
#16  Short offline       Completed: read failure       50%     18240         488334043
#17  Extended offline    Completed: read failure       80%     18232         122949568
#18  Short offline       Completed: read failure       50%     18205         488334043
#19  Short offline       Completed: read failure       50%     18193         488334043
#20  Short offline       Completed: read failure       50%     17972         488334043
#21  Short offline       Completed: read failure       90%     16655         470026048

SMART Selective self-test log data structure revision number 1
 SPAN  MIN_LBA  MAX_LBA  CURRENT_TEST_STATUS
    1        0        0  Not_testing
    2        0        0  Not_testing
    3        0        0  Not_testing
    4        0        0  Not_testing
    5        0        0  Not_testing
Selective self-test flags (0x0):
  After scanning selected spans, do NOT read-scan remainder of disk.
If Selective self-test is pending on power-up, resume after 0 minute delay.

SCT Status Version:                  3
SCT Version (vendor specific):       521 (0x0209)
Device State:                        Active (0)
Current Temperature:                    40 Celsius
Power Cycle Min/Max Temperature:     --/ 0 Celsius
Lifetime    Min/Max Temperature:     --/ 0 Celsius

SCT Data Table command not supported

SCT Error Recovery Control command not supported

Device Statistics (GP/SMART Log 0x04) not supported

Pending Defects log (GP Log 0x0c) not supported

SATA Phy Event Counters (GP Log 0x11)
ID      Size     Value  Description
0x000a  2           13  Device-to-host register FISes sent due to a COMRESET
0x0001  2            0  Command failed due to ICRC error
0x0003  2            0  R_ERR response for device-to-host data FIS
0x0004  2            0  R_ERR response for host-to-device data FIS
0x0006  2            0  R_ERR response for device-to-host non-data FIS
0x0007  2            0  R_ERR response for host-to-device non-data FIS
0x0009  2        65535+ Transition from drive PhyRdy to drive PhyNRdy
0x8002  2        65535+ Vendor specific
0x8003  2        65535+ Vendor specific
0x8004  2            0  Vendor specific

