=== START OF INFORMATION SECTION ===
Model Family:     Western Digital Scorpio Blue Serial ATA (AF)
Device Model:     WDC WD2500BPVT-22ZEST0
Serial Number:    --
LU WWN Device Id: 5 0014ee ...
Firmware Version: 01.01A01
User Capacity:    250 059 350 016 bytes [250 GB]
Sector Sizes:     512 bytes logical, 4096 bytes physical
Rotation Rate:    5400 rpm
Device is:        In smartctl database [for details use: -P show]
ATA Version is:   ATA8-ACS (minor revision not indicated)
SATA Version is:  SATA 2.6, 3.0 Gb/s
Local Time is:    Thu Feb 18 14:21:36 2016 MSK
SMART support is: Available - device has SMART capability.
SMART support is: Enabled
AAM feature is:   Disabled
APM level is:     96 (intermediate level with standby)
Rd look-ahead is: Enabled
Write cache is:   Enabled
ATA Security is:  Disabled, frozen [SEC2]
Wt Cache Reorder: Enabled

=== START OF READ SMART DATA SECTION ===
SMART overall-health self-assessment test result: PASSED

General SMART Values:
Offline data collection status:  (0x80)	Offline data collection activity
					was never started.
					Auto Offline Data Collection: Enabled.
Self-test execution status:      (   0)	The previous self-test routine completed
					without error or no self-test has ever 
					been run.
Total time to complete Offline 
data collection: 		( 7200) seconds.
Offline data collection
capabilities: 			 (0x7b) SMART execute Offline immediate.
					Auto Offline data collection on/off support.
					Suspend Offline collection upon new
					command.
					Offline surface scan supported.
					Self-test supported.
					Conveyance Self-test supported.
					Selective Self-test supported.
SMART capabilities:            (0x0003)	Saves SMART data before entering
					power-saving mode.
					Supports SMART auto save timer.
Error logging capability:        (0x01)	Error logging supported.
					General Purpose Logging supported.
Short self-test routine 
recommended polling time: 	 (   2) minutes.
Extended self-test routine
recommended polling time: 	 (  86) minutes.
Conveyance self-test routine
recommended polling time: 	 (   5) minutes.
SCT capabilities: 	       (0x7035)	SCT Status supported.
					SCT Feature Control supported.
					SCT Data Table supported.

SMART Attributes Data Structure revision number: 16
Vendor Specific SMART Attributes with Thresholds:
ID# ATTRIBUTE_NAME          FLAGS    VALUE WORST THRESH FAIL RAW_VALUE
  1 Raw_Read_Error_Rate     POSR-K   200   200   051    -    0
  3 Spin_Up_Time            POS--K   156   132   021    -    1200
  4 Start_Stop_Count        -O--CK   093   093   000    -    7327
  5 Reallocated_Sector_Ct   PO--CK   200   200   140    -    0
  7 Seek_Error_Rate         -OSR-K   200   200   000    -    0
  9 Power_On_Hours          -O--CK   089   089   000    -    8571
 10 Spin_Retry_Count        -O--CK   100   100   000    -    0
 11 Calibration_Retry_Count -O--CK   100   100   000    -    0
 12 Power_Cycle_Count       -O--CK   097   097   000    -    3882
191 G-Sense_Error_Rate      -O--CK   001   001   000    -    28104
192 Power-Off_Retract_Count -O--CK   200   200   000    -    88
193 Load_Cycle_Count        -O--CK   144   144   000    -    170309
194 Temperature_Celsius     -O---K   103   096   000    -    40
196 Reallocated_Event_Count -O--CK   200   200   000    -    0
197 Current_Pending_Sector  -O--CK   200   200   000    -    0
198 Offline_Uncorrectable   ----CK   100   253   000    -    0
199 UDMA_CRC_Error_Count    -O--CK   200   200   000    -    0
200 Multi_Zone_Error_Rate   ---R--   100   253   000    -    0
                            ||||||_ K auto-keep
                            |||||__ C event count
                            ||||___ R error rate
                            |||____ S speed/performance
                            ||_____ O updated online
                            |______ P prefailure warning

General Purpose Log Directory Version 1
SMART           Log Directory Version 1 [multi-sector log support]
Address    Access  R/W   Size  Description
0x00       GPL,SL  R/O      1  Log Directory
0x01           SL  R/O      1  Summary SMART error log
0x02           SL  R/O      5  Comprehensive SMART error log
0x03       GPL     R/O      6  Ext. Comprehensive SMART error log
0x06           SL  R/O      1  SMART self-test log
0x07       GPL     R/O      1  Extended self-test log
0x09           SL  R/W      1  Selective self-test log
0x10       GPL     R/O      1  NCQ Command Error log
0x11       GPL     R/O      1  SATA Phy Event Counters
0x80-0x9f  GPL,SL  R/W     16  Host vendor specific log
0xa0-0xa7  GPL,SL  VS      16  Device vendor specific log
0xa8-0xb7  GPL,SL  VS       1  Device vendor specific log
0xbd       GPL,SL  VS       1  Device vendor specific log
0xc0       GPL,SL  VS       1  Device vendor specific log
0xc1       GPL     VS      93  Device vendor specific log
0xe0       GPL,SL  R/W      1  SCT Command/Status
0xe1       GPL,SL  R/W      1  SCT Data Transfer

SMART Extended Comprehensive Error Log Version: 1 (6 sectors)
Device Error Count: 1007 (device log contains only the most recent 24 errors)
	CR     = Command Register
	FEATR  = Features Register
	COUNT  = Count (was: Sector Count) Register
	LBA_48 = Upper bytes of LBA High/Mid/Low Registers ]  ATA-8
	LH     = LBA High (was: Cylinder High) Register    ]   LBA
	LM     = LBA Mid (was: Cylinder Low) Register      ] Register
	LL     = LBA Low (was: Sector Number) Register     ]
	DV     = Device (was: Device/Head) Register
	DC     = Device Control Register
	ER     = Error register
	ST     = Status register
Powered_Up_Time is measured from power on, and printed as
DDd+hh:mm:SS.sss where DD=days, hh=hours, mm=minutes,
SS=sec, and sss=millisec. It "wraps" after 49.710 days.

Error 1007 [22] occurred at disk power-on lifetime: 6159 hours (256 days + 15 hours)
  When the command that caused the error occurred, the device was active or idle.

  After command completion occurred, registers were:
  ER -- ST COUNT  LBA_48  LH LM LL DV DC
  -- -- -- == -- == == == -- -- -- -- --
  04 -- 61 0c 45 00 00 00 00 00 00 e0 00  Device Fault; Error: ABRT

  Commands leading to the command that caused the error were:
  CR FEATR COUNT  LBA_48  LH LM LL DV DC  Powered_Up_Time  Command/Feature_Name
  -- == -- == -- == == == -- -- -- -- --  ---------------  --------------------
  ef 00 03 00 45 00 00 00 00 00 00 e0 00     00:06:25.375  SET FEATURES [Set transfer mode]
  ef 00 03 00 0c 00 00 00 00 00 00 e0 00     00:06:25.375  SET FEATURES [Set transfer mode]
  b0 00 da 00 00 00 00 00 c2 4f 00 e0 00     00:06:25.266  SMART RETURN STATUS
  ec 00 00 00 00 00 00 00 00 00 00 e0 00     00:06:25.264  IDENTIFY DEVICE
  b0 00 d8 00 00 00 00 00 c2 4f 00 e0 00     00:06:23.835  SMART ENABLE OPERATIONS

Error 1006 [21] occurred at disk power-on lifetime: 6159 hours (256 days + 15 hours)
  When the command that caused the error occurred, the device was active or idle.

  After command completion occurred, registers were:
  ER -- ST COUNT  LBA_48  LH LM LL DV DC
  -- -- -- == -- == == == -- -- -- -- --
  04 -- 61 00 0c 00 00 00 00 00 00 e0 00  Device Fault; Error: ABRT

  Commands leading to the command that caused the error were:
  CR FEATR COUNT  LBA_48  LH LM LL DV DC  Powered_Up_Time  Command/Feature_Name
  -- == -- == -- == == == -- -- -- -- --  ---------------  --------------------
  ef 00 03 00 0c 00 00 00 00 00 00 e0 00     00:06:25.375  SET FEATURES [Set transfer mode]
  b0 00 da 00 00 00 00 00 c2 4f 00 e0 00     00:06:25.266  SMART RETURN STATUS
  ec 00 00 00 00 00 00 00 00 00 00 e0 00     00:06:25.264  IDENTIFY DEVICE
  b0 00 d8 00 00 00 00 00 c2 4f 00 e0 00     00:06:23.835  SMART ENABLE OPERATIONS
  ec 00 00 00 00 00 00 00 00 00 00 e0 00     00:06:23.833  IDENTIFY DEVICE

Error 1005 [20] occurred at disk power-on lifetime: 6159 hours (256 days + 15 hours)
  When the command that caused the error occurred, the device was active or idle.

  After command completion occurred, registers were:
  ER -- ST COUNT  LBA_48  LH LM LL DV DC
  -- -- -- == -- == == == -- -- -- -- --
  04 -- 61 00 01 00 00 05 30 c0 60 40 00  Device Fault; Error: ABRT at LBA = 0x0530c060 = 87081056

  Commands leading to the command that caused the error were:
  CR FEATR COUNT  LBA_48  LH LM LL DV DC  Powered_Up_Time  Command/Feature_Name
  -- == -- == -- == == == -- -- -- -- --  ---------------  --------------------
  60 00 80 00 58 00 00 02 57 f6 88 40 00     00:06:14.551  READ FPDMA QUEUED
  2f 00 00 00 01 00 00 00 00 00 10 40 00     00:06:14.551  READ LOG EXT
  61 01 00 00 98 00 00 05 ec 9e 58 40 00     00:06:14.407  WRITE FPDMA QUEUED
  2f 00 00 00 01 00 00 00 00 00 10 40 00     00:06:14.406  READ LOG EXT
  61 01 00 00 d8 00 00 05 ec a6 58 40 00     00:06:14.263  WRITE FPDMA QUEUED

Error 1004 [19] occurred at disk power-on lifetime: 6159 hours (256 days + 15 hours)
  When the command that caused the error occurred, the device was active or idle.

  After command completion occurred, registers were:
  ER -- ST COUNT  LBA_48  LH LM LL DV DC
  -- -- -- == -- == == == -- -- -- -- --
  04 -- 61 00 01 00 00 05 30 c0 60 40 00  Device Fault; Error: ABRT at LBA = 0x0530c060 = 87081056

  Commands leading to the command that caused the error were:
  CR FEATR COUNT  LBA_48  LH LM LL DV DC  Powered_Up_Time  Command/Feature_Name
  -- == -- == -- == == == -- -- -- -- --  ---------------  --------------------
  61 01 00 00 98 00 00 05 ec 9e 58 40 00     00:06:14.407  WRITE FPDMA QUEUED
  2f 00 00 00 01 00 00 00 00 00 10 40 00     00:06:14.406  READ LOG EXT
  61 01 00 00 d8 00 00 05 ec a6 58 40 00     00:06:14.263  WRITE FPDMA QUEUED
  2f 00 00 00 01 00 00 00 00 00 10 40 00     00:06:14.262  READ LOG EXT
  61 01 00 00 18 00 00 05 ec 9c 58 40 00     00:06:14.118  WRITE FPDMA QUEUED

Error 1003 [18] occurred at disk power-on lifetime: 6159 hours (256 days + 15 hours)
  When the command that caused the error occurred, the device was active or idle.

  After command completion occurred, registers were:
  ER -- ST COUNT  LBA_48  LH LM LL DV DC
  -- -- -- == -- == == == -- -- -- -- --
  04 -- 61 00 01 00 00 05 30 c0 60 40 00  Device Fault; Error: ABRT at LBA = 0x0530c060 = 87081056

  Commands leading to the command that caused the error were:
  CR FEATR COUNT  LBA_48  LH LM LL DV DC  Powered_Up_Time  Command/Feature_Name
  -- == -- == -- == == == -- -- -- -- --  ---------------  --------------------
  61 01 00 00 d8 00 00 05 ec a6 58 40 00     00:06:14.263  WRITE FPDMA QUEUED
  2f 00 00 00 01 00 00 00 00 00 10 40 00     00:06:14.262  READ LOG EXT
  61 01 00 00 18 00 00 05 ec 9c 58 40 00     00:06:14.118  WRITE FPDMA QUEUED
  2f 00 00 00 01 00 00 00 00 00 10 40 00     00:06:14.118  READ LOG EXT
  61 00 10 00 58 00 00 02 32 aa 48 40 00     00:06:13.974  WRITE FPDMA QUEUED

Error 1002 [17] occurred at disk power-on lifetime: 6159 hours (256 days + 15 hours)
  When the command that caused the error occurred, the device was active or idle.

  After command completion occurred, registers were:
  ER -- ST COUNT  LBA_48  LH LM LL DV DC
  -- -- -- == -- == == == -- -- -- -- --
  04 -- 61 00 01 00 00 05 30 c0 60 40 00  Device Fault; Error: ABRT at LBA = 0x0530c060 = 87081056

  Commands leading to the command that caused the error were:
  CR FEATR COUNT  LBA_48  LH LM LL DV DC  Powered_Up_Time  Command/Feature_Name
  -- == -- == -- == == == -- -- -- -- --  ---------------  --------------------
  61 01 00 00 18 00 00 05 ec 9c 58 40 00     00:06:14.118  WRITE FPDMA QUEUED
  2f 00 00 00 01 00 00 00 00 00 10 40 00     00:06:14.118  READ LOG EXT
  61 00 10 00 58 00 00 02 32 aa 48 40 00     00:06:13.974  WRITE FPDMA QUEUED
  2f 00 00 00 01 00 00 00 00 00 10 40 00     00:06:13.973  READ LOG EXT
  61 00 10 00 98 00 00 02 51 fe 68 40 00     00:06:13.830  WRITE FPDMA QUEUED

Error 1001 [16] occurred at disk power-on lifetime: 6159 hours (256 days + 15 hours)
  When the command that caused the error occurred, the device was active or idle.

  After command completion occurred, registers were:
  ER -- ST COUNT  LBA_48  LH LM LL DV DC
  -- -- -- == -- == == == -- -- -- -- --
  04 -- 61 00 01 00 00 05 30 c0 60 40 00  Device Fault; Error: ABRT at LBA = 0x0530c060 = 87081056

  Commands leading to the command that caused the error were:
  CR FEATR COUNT  LBA_48  LH LM LL DV DC  Powered_Up_Time  Command/Feature_Name
  -- == -- == -- == == == -- -- -- -- --  ---------------  --------------------
  61 00 10 00 58 00 00 02 32 aa 48 40 00     00:06:13.974  WRITE FPDMA QUEUED
  2f 00 00 00 01 00 00 00 00 00 10 40 00     00:06:13.973  READ LOG EXT
  61 00 10 00 98 00 00 02 51 fe 68 40 00     00:06:13.830  WRITE FPDMA QUEUED
  2f 00 00 00 01 00 00 00 00 00 10 40 00     00:06:13.829  READ LOG EXT
  60 00 40 00 d8 00 00 02 31 69 73 40 00     00:06:13.686  READ FPDMA QUEUED

Error 1000 [15] occurred at disk power-on lifetime: 6159 hours (256 days + 15 hours)
  When the command that caused the error occurred, the device was active or idle.

  After command completion occurred, registers were:
  ER -- ST COUNT  LBA_48  LH LM LL DV DC
  -- -- -- == -- == == == -- -- -- -- --
  04 -- 61 00 01 00 00 05 30 c0 60 40 00  Device Fault; Error: ABRT at LBA = 0x0530c060 = 87081056

  Commands leading to the command that caused the error were:
  CR FEATR COUNT  LBA_48  LH LM LL DV DC  Powered_Up_Time  Command/Feature_Name
  -- == -- == -- == == == -- -- -- -- --  ---------------  --------------------
  61 00 10 00 98 00 00 02 51 fe 68 40 00     00:06:13.830  WRITE FPDMA QUEUED
  2f 00 00 00 01 00 00 00 00 00 10 40 00     00:06:13.829  READ LOG EXT
  60 00 40 00 d8 00 00 02 31 69 73 40 00     00:06:13.686  READ FPDMA QUEUED
  2f 00 00 00 01 00 00 00 00 00 10 40 00     00:06:13.685  READ LOG EXT
  61 01 00 00 18 00 00 05 ec a7 58 40 00     00:06:13.541  WRITE FPDMA QUEUED

SMART Extended Self-test Log Version: 1 (1 sectors)
No self-tests have been logged.  [To run self-tests, use: smartctl -t]

SMART Selective self-test log data structure revision number 1
 SPAN  MIN_LBA  MAX_LBA  CURRENT_TEST_STATUS
    1        0        0  Not_testing
    2        0        0  Not_testing
    3        0        0  Not_testing
    4        0        0  Not_testing
    5        0        0  Not_testing
Selective self-test flags (0x0):
  After scanning selected spans, do NOT read-scan remainder of disk.
If Selective self-test is pending on power-up, resume after 0 minute delay.

SCT Status Version:                  3
SCT Version (vendor specific):       258 (0x0102)
SCT Support Level:                   1
Device State:                        Active (0)
Current Temperature:                    40 Celsius
Power Cycle Min/Max Temperature:     27/41 Celsius
Lifetime    Min/Max Temperature:     15/48 Celsius
Under/Over Temperature Limit Count:   0/0

SCT Temperature History Version:     2
Temperature Sampling Period:         1 minute
Temperature Logging Interval:        1 minute
Min/Max recommended Temperature:      0/60 Celsius
Min/Max Temperature Limit:           -41/85 Celsius
Temperature History Size (Index):    128 (28)

SCT Error Recovery Control command not supported

Device Statistics (GP Log 0x04) not supported

SATA Phy Event Counters (GP Log 0x11)
ID      Size     Value  Description
0x0001  2            0  Command failed due to ICRC error
0x0002  2            0  R_ERR response for data FIS
0x0003  2            0  R_ERR response for device-to-host data FIS
0x0004  2            0  R_ERR response for host-to-device data FIS
0x0005  2            0  R_ERR response for non-data FIS
0x0006  2            0  R_ERR response for device-to-host non-data FIS
0x0007  2            0  R_ERR response for host-to-device non-data FIS
0x000a  2            4  Device-to-host register FISes sent due to a COMRESET
0x000b  2            0  CRC errors within host-to-device FIS
0x8000  4         4489  Vendor specific

