smartctl 7.2 2020-12-30 r5155 [x86_64-linux-5.18.10-76051810-generic] (local build)
Copyright (C) 2002-20, Bruce Allen, Christian Franke, www.smartmontools.org

=== START OF INFORMATION SECTION ===
Model Number:                       THNSN5128GPU7 TOSHIBA
Serial Number:                      --
Firmware Version:                   57MB4102
PCI Vendor/Subsystem ID:            0x1179
IEEE OUI Identifier:                0x0d0800
Controller ID:                      0
NVMe Version:                       <1.2
Number of Namespaces:               1
Namespace 1 Size/Capacity:          128,035,676,160 [128 GB]
Namespace 1 Formatted LBA Size:     512
Namespace 1 IEEE EUI-64:            00080d ...
Local Time is:                      Sat Jul 30 08:43:50 2022 CEST
Firmware Updates (0x02):            1 Slot
Optional Admin Commands (0x0006):   Format Frmw_DL
Optional NVM Commands (0x000e):     Wr_Unc DS_Mngmt Wr_Zero
Warning  Comp. Temp. Threshold:     78 Celsius
Critical Comp. Temp. Threshold:     82 Celsius

Supported Power States
St Op     Max   Active     Idle   RL RT WL WT  Ent_Lat  Ex_Lat
 0 +     6.00W       -        -    0  0  0  0        0       0
 1 +     2.40W       -        -    1  1  1  1        0       0
 2 +     1.90W       -        -    2  2  2  2        0       0
 3 -   0.1600W       -        -    3  3  3  3     1000    1000
 4 -   0.0120W       -        -    4  4  4  4     5000   10000
 5 -   0.0060W       -        -    5  5  5  5   100000   50000

Supported LBA Sizes (NSID 0x1)
Id Fmt  Data  Metadt  Rel_Perf
 0 +     512       0         2
 1 -    4096       0         1

=== START OF SMART DATA SECTION ===
SMART overall-health self-assessment test result: PASSED

SMART/Health Information (NVMe Log 0x02)
Critical Warning:                   0x00
Temperature:                        50 Celsius
Available Spare:                    100%
Available Spare Threshold:          10%
Percentage Used:                    15%
Data Units Read:                    3,750,106 [1.92 TB]
Data Units Written:                 30,205,880 [15.4 TB]
Host Read Commands:                 97,768,893
Host Write Commands:                3,505,367,597
Controller Busy Time:               0
Power Cycles:                       128
Power On Hours:                     474
Unsafe Shutdowns:                   65
Media and Data Integrity Errors:    0
Error Information Log Entries:      0
Warning  Comp. Temperature Time:    1693
Critical Comp. Temperature Time:    0
Temperature Sensor 1:               50 Celsius

Error Information (NVMe Log 0x01, 16 of 128 entries)
No Errors Logged

