smartctl 7.5 2025-04-30 r5714 [x86_64-linux-6.12.41-1-MANJARO] (local build)
Copyright (C) 2002-25, Bruce Allen, Christian Franke, www.smartmontools.org

=== START OF INFORMATION SECTION ===
Model Family:     Western Digital Caviar Green
Device Model:     WDC WD10EADX-22TDHB0
Serial Number:    --
LU WWN Device Id: 5 0014ee ...
Firmware Version: 77.04D77
User Capacity:    1,000,204,886,016 bytes [1.00 TB]
Sector Size:      512 bytes logical/physical
Device is:        In smartctl database 7.5/5706
ATA Version is:   ATA8-ACS (minor revision not indicated)
SATA Version is:  SATA 3.0, 6.0 Gb/s (current: 3.0 Gb/s)
Local Time is:    Sun Aug 24 21:16:18 2025 PDT
SMART support is: Available - device has SMART capability.
SMART support is: Enabled
AAM feature is:   Disabled
APM feature is:   Unavailable
Rd look-ahead is: Enabled
Write cache is:   Enabled
DSN feature is:   Unavailable
ATA Security is:  Disabled, frozen [SEC2]

=== START OF READ SMART DATA SECTION ===
SMART overall-health self-assessment test result: PASSED

General SMART Values:
Offline data collection status:  (0x84)	Offline data collection activity
					was suspended by an interrupting command from host.
					Auto Offline Data Collection: Enabled.
Self-test execution status:      (   0)	The previous self-test routine completed
					without error or no self-test has ever 
					been run.
Total time to complete Offline 
data collection: 		(21180) seconds.
Offline data collection
capabilities: 			 (0x7b) SMART execute Offline immediate.
					Auto Offline data collection on/off support.
					Suspend Offline collection upon new
					command.
					Offline surface scan supported.
					Self-test supported.
					Conveyance Self-test supported.
					Selective Self-test supported.
SMART capabilities:            (0x0003)	Saves SMART data before entering
					power-saving mode.
					Supports SMART auto save timer.
Error logging capability:        (0x01)	Error logging supported.
					General Purpose Logging supported.
Short self-test routine 
recommended polling time: 	 (   2) minutes.
Extended self-test routine
recommended polling time: 	 ( 244) minutes.
Conveyance self-test routine
recommended polling time: 	 (   5) minutes.
SCT capabilities: 	       (0x3037)	SCT Status supported.
					SCT Feature Control supported.
					SCT Data Table supported.

SMART Attributes Data Structure revision number: 16
Vendor Specific SMART Attributes with Thresholds:
ID# ATTRIBUTE_NAME          FLAGS    VALUE WORST THRESH FAIL RAW_VALUE
  1 Raw_Read_Error_Rate     POSR-K   200   200   051    -    0
  3 Spin_Up_Time            POS--K   214   181   021    -    5291
  4 Start_Stop_Count        -O--CK   093   093   000    -    7997
  5 Reallocated_Sector_Ct   PO--CK   200   200   140    -    0
  7 Seek_Error_Rate         -OSR-K   100   253   000    -    0
  9 Power_On_Hours          -O--CK   021   021   000    -    57691
 10 Spin_Retry_Count        -O--CK   100   100   000    -    0
 11 Calibration_Retry_Count -O--CK   100   100   000    -    0
 12 Power_Cycle_Count       -O--CK   093   093   000    -    7924
192 Power-Off_Retract_Count -O--CK   200   200   000    -    345
193 Load_Cycle_Count        -O--CK   001   001   000    -    1017172
194 Temperature_Celsius     -O---K   103   094   000    -    44
196 Reallocated_Event_Count -O--CK   200   200   000    -    0
197 Current_Pending_Sector  -O--CK   200   200   000    -    0
198 Offline_Uncorrectable   ----CK   200   200   000    -    0
199 UDMA_CRC_Error_Count    -O--CK   200   200   000    -    0
200 Multi_Zone_Error_Rate   ---R--   200   200   000    -    0
                            ||||||_ K auto-keep
                            |||||__ C event count
                            ||||___ R error rate
                            |||____ S speed/performance
                            ||_____ O updated online
                            |______ P prefailure warning

General Purpose Log Directory Version 1
SMART           Log Directory Version 1 [multi-sector log support]
Address    Access  R/W   Size  Description
0x00       GPL,SL  R/O      1  Log Directory
0x01           SL  R/O      1  Summary SMART error log
0x02           SL  R/O      5  Comprehensive SMART error log
0x03       GPL     R/O      6  Ext. Comprehensive SMART error log
0x06           SL  R/O      1  SMART self-test log
0x07       GPL     R/O      1  Extended self-test log
0x09           SL  R/W      1  Selective self-test log
0x10       GPL     R/O      1  NCQ Command Error log
0x11       GPL     R/O      1  SATA Phy Event Counters log
0x80-0x9f  GPL,SL  R/W     16  Host vendor specific log
0xa0-0xa7  GPL,SL  VS      16  Device vendor specific log
0xa8-0xb7  GPL,SL  VS       1  Device vendor specific log
0xc0       GPL,SL  VS       1  Device vendor specific log
0xc1       GPL     VS      24  Device vendor specific log
0xe0       GPL,SL  R/W      1  SCT Command/Status
0xe1       GPL,SL  R/W      1  SCT Data Transfer

SMART Extended Comprehensive Error Log Version: 1 (6 sectors)
Device Error Count: 7
	CR     = Command Register
	FEATR  = Features Register
	COUNT  = Count (was: Sector Count) Register
	LBA_48 = Upper bytes of LBA High/Mid/Low Registers ]  ATA-8
	LH     = LBA High (was: Cylinder High) Register    ]   LBA
	LM     = LBA Mid (was: Cylinder Low) Register      ] Register
	LL     = LBA Low (was: Sector Number) Register     ]
	DV     = Device (was: Device/Head) Register
	DC     = Device Control Register
	ER     = Error register
	ST     = Status register
Powered_Up_Time is measured from power on, and printed as
DDd+hh:mm:SS.sss where DD=days, hh=hours, mm=minutes,
SS=sec, and sss=millisec. It "wraps" after 49.710 days.

Error 7 [6] occurred at disk power-on lifetime: 21797 hours (908 days + 5 hours)
  When the command that caused the error occurred, the device was active or idle.

  After command completion occurred, registers were:
  ER -- ST COUNT  LBA_48  LH LM LL DV DC
  -- -- -- == -- == == == -- -- -- -- --
  40 -- 51 00 08 00 48 00 f5 33 20 40 00  Error: UNC 8 sectors at LBA = 0x4800f53320 = 309253714720

  Commands leading to the command that caused the error were:
  CR FEATR COUNT  LBA_48  LH LM LL DV DC  Powered_Up_Time  Command/Feature_Name
  -- == -- == -- == == == -- -- -- -- --  ---------------  --------------------
  25 00 00 00 08 00 48 00 f5 33 20 40 00     00:00:26.677  READ DMA EXT
  25 00 00 00 08 00 48 00 f5 33 20 40 00     00:00:24.399  READ DMA EXT
  25 00 00 00 08 00 36 00 12 02 40 40 00     00:00:24.399  READ DMA EXT
  25 00 00 00 08 00 36 00 12 02 38 40 00     00:00:24.399  READ DMA EXT
  25 00 00 00 08 00 37 00 b5 02 58 40 00     00:00:24.392  READ DMA EXT

Error 6 [5] occurred at disk power-on lifetime: 21797 hours (908 days + 5 hours)
  When the command that caused the error occurred, the device was active or idle.

  After command completion occurred, registers were:
  ER -- ST COUNT  LBA_48  LH LM LL DV DC
  -- -- -- == -- == == == -- -- -- -- --
  40 -- 51 00 08 00 48 00 f5 33 20 40 00  Error: UNC 8 sectors at LBA = 0x4800f53320 = 309253714720

  Commands leading to the command that caused the error were:
  CR FEATR COUNT  LBA_48  LH LM LL DV DC  Powered_Up_Time  Command/Feature_Name
  -- == -- == -- == == == -- -- -- -- --  ---------------  --------------------
  25 00 00 00 08 00 48 00 f5 33 20 40 00     00:00:24.399  READ DMA EXT
  25 00 00 00 08 00 36 00 12 02 40 40 00     00:00:24.399  READ DMA EXT
  25 00 00 00 08 00 36 00 12 02 38 40 00     00:00:24.399  READ DMA EXT
  25 00 00 00 08 00 37 00 b5 02 58 40 00     00:00:24.392  READ DMA EXT
  25 00 00 00 08 00 37 00 af 02 90 40 00     00:00:24.383  READ DMA EXT

Error 5 [4] occurred at disk power-on lifetime: 21780 hours (907 days + 12 hours)
  When the command that caused the error occurred, the device was active or idle.

  After command completion occurred, registers were:
  ER -- ST COUNT  LBA_48  LH LM LL DV DC
  -- -- -- == -- == == == -- -- -- -- --
  40 -- 51 01 00 00 37 00 ae 02 98 40 00  Error: UNC 256 sectors at LBA = 0x3700ae0298 = 236234605208

  Commands leading to the command that caused the error were:
  CR FEATR COUNT  LBA_48  LH LM LL DV DC  Powered_Up_Time  Command/Feature_Name
  -- == -- == -- == == == -- -- -- -- --  ---------------  --------------------
  25 d8 00 01 00 00 37 00 ae 02 98 40 00     00:00:35.034  READ DMA EXT
  25 d8 00 01 00 00 37 00 ad 02 98 40 00     00:00:35.033  READ DMA EXT
  25 d8 00 01 00 00 37 00 ac 02 98 40 00     00:00:35.033  READ DMA EXT
  25 d8 00 01 00 00 37 00 ab 02 98 40 00     00:00:35.032  READ DMA EXT
  25 d8 00 01 00 00 37 00 aa 02 98 40 00     00:00:35.032  READ DMA EXT

Error 4 [3] occurred at disk power-on lifetime: 21780 hours (907 days + 12 hours)
  When the command that caused the error occurred, the device was active or idle.

  After command completion occurred, registers were:
  ER -- ST COUNT  LBA_48  LH LM LL DV DC
  -- -- -- == -- == == == -- -- -- -- --
  40 -- 51 00 08 00 37 00 af 02 88 40 00  Error: UNC 8 sectors at LBA = 0x3700af0288 = 236234670728

  Commands leading to the command that caused the error were:
  CR FEATR COUNT  LBA_48  LH LM LL DV DC  Powered_Up_Time  Command/Feature_Name
  -- == -- == -- == == == -- -- -- -- --  ---------------  --------------------
  25 d8 00 00 08 00 37 00 af 02 88 40 00     00:00:28.262  READ DMA EXT
  25 d8 00 00 08 00 37 00 af 02 88 40 00     00:00:25.986  READ DMA EXT
  25 d8 00 00 08 00 37 00 af 02 88 40 00     00:00:23.711  READ DMA EXT
  25 d8 00 00 08 00 37 00 af 02 88 40 00     00:00:21.438  READ DMA EXT
  25 d8 00 00 08 00 37 00 e2 02 10 40 00     00:00:21.428  READ DMA EXT

Error 3 [2] occurred at disk power-on lifetime: 21780 hours (907 days + 12 hours)
  When the command that caused the error occurred, the device was active or idle.

  After command completion occurred, registers were:
  ER -- ST COUNT  LBA_48  LH LM LL DV DC
  -- -- -- == -- == == == -- -- -- -- --
  40 -- 51 00 08 00 37 00 af 02 88 40 00  Error: UNC 8 sectors at LBA = 0x3700af0288 = 236234670728

  Commands leading to the command that caused the error were:
  CR FEATR COUNT  LBA_48  LH LM LL DV DC  Powered_Up_Time  Command/Feature_Name
  -- == -- == -- == == == -- -- -- -- --  ---------------  --------------------
  25 d8 00 00 08 00 37 00 af 02 88 40 00     00:00:25.986  READ DMA EXT
  25 d8 00 00 08 00 37 00 af 02 88 40 00     00:00:23.711  READ DMA EXT
  25 d8 00 00 08 00 37 00 af 02 88 40 00     00:00:21.438  READ DMA EXT
  25 d8 00 00 08 00 37 00 e2 02 10 40 00     00:00:21.428  READ DMA EXT
  25 d8 00 00 08 00 37 00 ff 02 b8 40 00     00:00:21.428  READ DMA EXT

Error 2 [1] occurred at disk power-on lifetime: 21780 hours (907 days + 12 hours)
  When the command that caused the error occurred, the device was active or idle.

  After command completion occurred, registers were:
  ER -- ST COUNT  LBA_48  LH LM LL DV DC
  -- -- -- == -- == == == -- -- -- -- --
  40 -- 51 00 08 00 37 00 af 02 88 40 00  Error: UNC 8 sectors at LBA = 0x3700af0288 = 236234670728

  Commands leading to the command that caused the error were:
  CR FEATR COUNT  LBA_48  LH LM LL DV DC  Powered_Up_Time  Command/Feature_Name
  -- == -- == -- == == == -- -- -- -- --  ---------------  --------------------
  25 d8 00 00 08 00 37 00 af 02 88 40 00     00:00:23.711  READ DMA EXT
  25 d8 00 00 08 00 37 00 af 02 88 40 00     00:00:21.438  READ DMA EXT
  25 d8 00 00 08 00 37 00 e2 02 10 40 00     00:00:21.428  READ DMA EXT
  25 d8 00 00 08 00 37 00 ff 02 b8 40 00     00:00:21.428  READ DMA EXT
  25 d8 00 00 08 00 37 00 ff 02 60 40 00     00:00:21.428  READ DMA EXT

Error 1 [0] occurred at disk power-on lifetime: 21780 hours (907 days + 12 hours)
  When the command that caused the error occurred, the device was active or idle.

  After command completion occurred, registers were:
  ER -- ST COUNT  LBA_48  LH LM LL DV DC
  -- -- -- == -- == == == -- -- -- -- --
  40 -- 51 00 08 00 37 00 af 02 88 40 00  Error: UNC 8 sectors at LBA = 0x3700af0288 = 236234670728

  Commands leading to the command that caused the error were:
  CR FEATR COUNT  LBA_48  LH LM LL DV DC  Powered_Up_Time  Command/Feature_Name
  -- == -- == -- == == == -- -- -- -- --  ---------------  --------------------
  25 d8 00 00 08 00 37 00 af 02 88 40 00     00:00:21.438  READ DMA EXT
  25 d8 00 00 08 00 37 00 e2 02 10 40 00     00:00:21.428  READ DMA EXT
  25 d8 00 00 08 00 37 00 ff 02 b8 40 00     00:00:21.428  READ DMA EXT
  25 d8 00 00 08 00 37 00 ff 02 60 40 00     00:00:21.428  READ DMA EXT
  25 d8 00 00 08 00 38 00 02 02 60 40 00     00:00:21.428  READ DMA EXT

SMART Extended Self-test Log Version: 1 (1 sectors)
No self-tests have been logged.  [To run self-tests, use: smartctl -t]

SMART Selective self-test log data structure revision number 1
 SPAN  MIN_LBA  MAX_LBA  CURRENT_TEST_STATUS
    1        0        0  Not_testing
    2        0        0  Not_testing
    3        0        0  Not_testing
    4        0        0  Not_testing
    5        0        0  Not_testing
Selective self-test flags (0x0):
  After scanning selected spans, do NOT read-scan remainder of disk.
If Selective self-test is pending on power-up, resume after 0 minute delay.

SCT Status Version:                  2
SCT Version (vendor specific):       258 (0x0102)
Device State:                        Active (0)
Current Temperature:                    44 Celsius
Power Cycle Min/Max Temperature:     44/44 Celsius
Lifetime    Min/Max Temperature:     43/54 Celsius
Under/Over Temperature Limit Count:   0/0

SCT Temperature History Version:     2
Temperature Sampling Period:         1 minute
Temperature Logging Interval:        1 minute
Min/Max recommended Temperature:      0/60 Celsius
Min/Max Temperature Limit:           -41/85 Celsius
Temperature History Size (Index):    478 (135)

SCT Error Recovery Control command not supported

Device Statistics (GP/SMART Log 0x04) not supported

Pending Defects log (GP Log 0x0c) not supported

SATA Phy Event Counters (GP Log 0x11)
ID      Size     Value  Description
0x0001  2            0  Command failed due to ICRC error
0x0002  2            0  R_ERR response for data FIS
0x0003  2            0  R_ERR response for device-to-host data FIS
0x0004  2            0  R_ERR response for host-to-device data FIS
0x0005  2            0  R_ERR response for non-data FIS
0x0006  2            0  R_ERR response for device-to-host non-data FIS
0x0007  2            0  R_ERR response for host-to-device non-data FIS
0x000a  2            1  Device-to-host register FISes sent due to a COMRESET
0x000b  2            0  CRC errors within host-to-device FIS
0x8000  4         1632  Vendor specific

