smartctl 7.3 2022-02-28 r5338 [x86_64-linux-6.0.5-100.fc35.x86_64] (local build)
Copyright (C) 2002-22, Bruce Allen, Christian Franke, www.smartmontools.org

=== START OF INFORMATION SECTION ===
Model Number:                       ADATA SX8100NP
Serial Number:                      --
Firmware Version:                   VB411D39
PCI Vendor/Subsystem ID:            0x10ec
IEEE OUI Identifier:                0x00e04c
Controller ID:                      1
NVMe Version:                       1.3
Number of Namespaces:               1
Namespace 1 Size/Capacity:          512,110,190,592 [512 GB]
Namespace 1 Formatted LBA Size:     512
Local Time is:                      Thu Aug  3 14:01:37 2023 EDT
Firmware Updates (0x0e):            7 Slots
Optional Admin Commands (0x0007):   Security Format Frmw_DL
Optional NVM Commands (0x0004):     DS_Mngmt
Log Page Attributes (0x02):         Cmd_Eff_Lg
Maximum Data Transfer Size:         64 Pages
Warning  Comp. Temp. Threshold:     118 Celsius
Critical Comp. Temp. Threshold:     150 Celsius

Supported Power States
St Op     Max   Active     Idle   RL RT WL WT  Ent_Lat  Ex_Lat
 0 +     8.00W       -        -    0  0  0  0        0       0
 1 +     4.00W       -        -    1  1  1  1        0       0
 2 +     3.00W       -        -    2  2  2  2        0       0
 3 -   0.0128W       -        -    3  3  3  3     4000    8000
 4 -   0.0080W       -        -    4  4  4  4     8000   30000

Supported LBA Sizes (NSID 0x1)
Id Fmt  Data  Metadt  Rel_Perf
 0 +     512       0         0

=== START OF SMART DATA SECTION ===
SMART overall-health self-assessment test result: PASSED

SMART/Health Information (NVMe Log 0x02)
Critical Warning:                   0x00
Temperature:                        39 Celsius
Available Spare:                    100%
Available Spare Threshold:          32%
Percentage Used:                    11%
Data Units Read:                    124,054,849 [63.5 TB]
Data Units Written:                 91,346,507 [46.7 TB]
Host Read Commands:                 0
Host Write Commands:                0
Controller Busy Time:               0
Power Cycles:                       2,078
Power On Hours:                     3,769
Unsafe Shutdowns:                   96
Media and Data Integrity Errors:    0
Error Information Log Entries:      0
Warning  Comp. Temperature Time:    0
Critical Comp. Temperature Time:    0

Error Information (NVMe Log 0x01, 8 of 8 entries)
Num   ErrCount  SQId   CmdId  Status  PELoc          LBA  NSID    VS
  0 1734326027880771952 11208  0x2401  0xe460 0x2103 7587514935370059776 117457208     -
  1 1920847810779810209 34976  0x8428  0x4090 0xa4db 2622282490888450112 1119884005  0x60
  2 18648370094556480  1280  0x3c20  0x1c00  0x510 2342035172228341122 3229915160  0x0c
  3 9809274076871315632  2128  0x00d0  0x2311 0x1425 9970978955902124225 1107562768  0x32
  4 13841268652087261569  9456  0x0254  0x0430 0xb4e0 10019419436496459602 539109572  0x02
  5 1830827676152645650 12553  0x2570  0xc104 0xa040 16007767961232361701 2382367756  0xe6
  6 90655498548093060 17408  0xf212  0x0c00  0x600 586183878836912266 3779070566     -
  7 12020688506222549136     9  0xcc01  0x2c02 0x2c00 7590255863883311372 948570136  0x1a



