smartctl 7.1 2019-12-30 r5022 [x86_64-linux-5.4.0-100-generic] (local build)
Copyright (C) 2002-19, Bruce Allen, Christian Franke, www.smartmontools.org

=== START OF INFORMATION SECTION ===
Model Number:                       Samsung SSD 970 EVO 1TB
Serial Number:                      --
Firmware Version:                   2B2QEXE7
PCI Vendor/Subsystem ID:            0x144d
IEEE OUI Identifier:                0x002538
Total NVM Capacity:                 1,000,204,886,016 [1.00 TB]
Unallocated NVM Capacity:           0
Controller ID:                      4
Number of Namespaces:               1
Namespace 1 Size/Capacity:          1,000,204,886,016 [1.00 TB]
Namespace 1 Utilization:            176,172,089,344 [176 GB]
Namespace 1 Formatted LBA Size:     512
Namespace 1 IEEE EUI-64:            002538 ...
Local Time is:                      Mon Feb 28 10:17:42 2022 CET
Firmware Updates (0x16):            3 Slots, no Reset required
Optional Admin Commands (0x0017):   Security Format Frmw_DL Self_Test
Optional NVM Commands (0x005f):     Comp Wr_Unc DS_Mngmt Wr_Zero Sav/Sel_Feat Timestmp
Maximum Data Transfer Size:         512 Pages
Warning  Comp. Temp. Threshold:     85 Celsius
Critical Comp. Temp. Threshold:     85 Celsius

Supported Power States
St Op     Max   Active     Idle   RL RT WL WT  Ent_Lat  Ex_Lat
 0 +     6.20W       -        -    0  0  0  0        0       0
 1 +     4.30W       -        -    1  1  1  1        0       0
 2 +     2.10W       -        -    2  2  2  2        0       0
 3 -   0.0400W       -        -    3  3  3  3      210    1200
 4 -   0.0050W       -        -    4  4  4  4     2000    8000

Supported LBA Sizes (NSID 0x1)
Id Fmt  Data  Metadt  Rel_Perf
 0 +     512       0         0

=== START OF SMART DATA SECTION ===
SMART overall-health self-assessment test result: PASSED

SMART/Health Information (NVMe Log 0x02)
Critical Warning:                   0x00
Temperature:                        38 Celsius
Available Spare:                    100%
Available Spare Threshold:          10%
Percentage Used:                    3%
Data Units Read:                    83,577,763 [42.7 TB]
Data Units Written:                 95,653,351 [48.9 TB]
Host Read Commands:                 667,425,537
Host Write Commands:                654,914,293
Controller Busy Time:               2,851
Power Cycles:                       2,840
Power On Hours:                     8,273
Unsafe Shutdowns:                   911
Media and Data Integrity Errors:    0
Error Information Log Entries:      5,934
Warning  Comp. Temperature Time:    0
Critical Comp. Temperature Time:    0
Temperature Sensor 1:               38 Celsius
Temperature Sensor 2:               45 Celsius

Error Information (NVMe Log 0x01, max 64 entries)
No Errors Logged



