smartctl 7.2 2020-12-30 r5155 [x86_64-linux-5.16.5-1-MANJARO] (local build)
Copyright (C) 2002-20, Bruce Allen, Christian Franke, www.smartmontools.org

=== START OF INFORMATION SECTION ===
Model Number:                       KINGSTON SKC3000S512G
Serial Number:                      --
Firmware Version:                   EIFK31.6
PCI Vendor/Subsystem ID:            0x2646
IEEE OUI Identifier:                0x0026b7
Total NVM Capacity:                 512,110,190,592 [512 GB]
Unallocated NVM Capacity:           0
Controller ID:                      1
NVMe Version:                       1.4
Number of Namespaces:               1
Namespace 1 Size/Capacity:          512,110,190,592 [512 GB]
Namespace 1 Formatted LBA Size:     512
Namespace 1 IEEE EUI-64:            0026b7 ...
Local Time is:                      Fri Feb  4 17:36:06 2022 MST
Firmware Updates (0x12):            1 Slot, no Reset required
Optional Admin Commands (0x0017):   Security Format Frmw_DL Self_Test
Optional NVM Commands (0x005d):     Comp DS_Mngmt Wr_Zero Sav/Sel_Feat Timestmp
Log Page Attributes (0x08):         Telmtry_Lg
Maximum Data Transfer Size:         512 Pages
Warning  Comp. Temp. Threshold:     84 Celsius
Critical Comp. Temp. Threshold:     89 Celsius

Supported Power States
St Op     Max   Active     Idle   RL RT WL WT  Ent_Lat  Ex_Lat
 0 +     8.80W       -        -    0  0  0  0        0       0
 1 +     7.10W       -        -    1  1  1  1        0       0
 2 +     5.20W       -        -    2  2  2  2        0       0
 3 -   0.0620W       -        -    3  3  3  3     2500    7500
 4 -   0.0620W       -        -    4  4  4  4     2500    7500

Supported LBA Sizes (NSID 0x1)
Id Fmt  Data  Metadt  Rel_Perf
 0 +     512       0         2
 1 -    4096       0         1

=== START OF SMART DATA SECTION ===
SMART overall-health self-assessment test result: PASSED

SMART/Health Information (NVMe Log 0x02)
Critical Warning:                   0x00
Temperature:                        29 Celsius
Available Spare:                    100%
Available Spare Threshold:          10%
Percentage Used:                    2%
Data Units Read:                    48,423,917 [24.7 TB]
Data Units Written:                 20,155,332 [10.3 TB]
Host Read Commands:                 171,545,555
Host Write Commands:                101,737,832
Controller Busy Time:               466
Power Cycles:                       36
Power On Hours:                     1,038
Unsafe Shutdowns:                   18
Media and Data Integrity Errors:    0
Error Information Log Entries:      2,566,209
Warning  Comp. Temperature Time:    0
Critical Comp. Temperature Time:    0
Temperature Sensor 2:               53 Celsius

Error Information (NVMe Log 0x01, 16 of 63 entries)
Num   ErrCount  SQId   CmdId  Status  PELoc          LBA  NSID    VS
  0    2566209     0  0x900a  0x4004 0x102c            0     0     -
  1    2566208     0  0x9009  0x4004 0x102c            0     0     -
  2    2566207     0  0x1004  0x4004 0x102c            0     0     -
  3    2566206     0  0x0007  0x4004 0x102c            0     0     -
  4    2566205     0  0x5002  0x4004 0x102c            0     0     -
  5    2566204     0  0x5001  0x4004 0x102c            0     0     -
  6    2566203     0  0x3003  0x4004 0x102c            0     0     -
  7    2566202     0  0x3002  0x4004 0x102c            0     0     -
  8    2566201     0  0x700b  0x4004 0x102c            0     0     -
  9    2566200     0  0x700a  0x4004 0x102c            0     0     -
 10    2566199     0  0x2000  0x4004 0x102c            0     0     -
 11    2566198     0  0x1003  0x4004 0x102c            0     0     -
 12    2566197     0  0xf005  0x4004 0x102c            0     0     -
 13    2566196     0  0xf004  0x4004 0x102c            0     0     -
 14    2566195     0  0xd006  0x4004 0x102c            0     0     -
 15    2566194     0  0xd005  0x4004 0x102c            0     0     -
... (47 entries not read)



