smartctl 7.4 2023-08-01 r5530 [x86_64-linux-6.12.13-generic-4rosa13-x86_64] (local build)
Copyright (C) 2002-23, Bruce Allen, Christian Franke, www.smartmontools.org

=== START OF INFORMATION SECTION ===
Model Number:                       KINGSTON SKC3000S512G
Serial Number:                      --
Firmware Version:                   EIFK51.2
PCI Vendor/Subsystem ID:            0x2646
IEEE OUI Identifier:                0x0026b7
Total NVM Capacity:                 512,110,190,592 [512 GB]
Unallocated NVM Capacity:           0
Controller ID:                      1
NVMe Version:                       1.4
Number of Namespaces:               1
Namespace 1 Size/Capacity:          512,110,190,592 [512 GB]
Namespace 1 Formatted LBA Size:     512
Namespace 1 IEEE EUI-64:            0026b7 ...
Local Time is:                      Thu May 22 04:42:52 2025 MSK
Firmware Updates (0x12):            1 Slot, no Reset required
Optional Admin Commands (0x0017):   Security Format Frmw_DL Self_Test
Optional NVM Commands (0x005d):     Comp DS_Mngmt Wr_Zero Sav/Sel_Feat Timestmp
Log Page Attributes (0x0c):         Ext_Get_Lg Telmtry_Lg
Maximum Data Transfer Size:         512 Pages
Warning  Comp. Temp. Threshold:     84 Celsius
Critical Comp. Temp. Threshold:     89 Celsius

Supported Power States
St Op     Max   Active     Idle   RL RT WL WT  Ent_Lat  Ex_Lat
 0 +     8.80W       -        -    0  0  0  0        0       0
 1 +     7.10W       -        -    1  1  1  1        0       0
 2 +     5.20W       -        -    2  2  2  2        0       0
 3 -   0.0620W       -        -    3  3  3  3     2500    7500
 4 -   0.0620W       -        -    4  4  4  4     2500    7500

Supported LBA Sizes (NSID 0x1)
Id Fmt  Data  Metadt  Rel_Perf
 0 +     512       0         2
 1 -    4096       0         1

=== START OF SMART DATA SECTION ===
SMART overall-health self-assessment test result: PASSED

SMART/Health Information (NVMe Log 0x02)
Critical Warning:                   0x00
Temperature:                        36 Celsius
Available Spare:                    100%
Available Spare Threshold:          10%
Percentage Used:                    1%
Data Units Read:                    9,150,341 [4.68 TB]
Data Units Written:                 15,018,887 [7.68 TB]
Host Read Commands:                 68,582,340
Host Write Commands:                47,595,626
Controller Busy Time:               395
Power Cycles:                       348
Power On Hours:                     720
Unsafe Shutdowns:                   117
Media and Data Integrity Errors:    0
Error Information Log Entries:      500
Warning  Comp. Temperature Time:    0
Critical Comp. Temperature Time:    0
Temperature Sensor 2:               68 Celsius

Error Information (NVMe Log 0x01, 16 of 63 entries)
Num   ErrCount  SQId   CmdId  Status  PELoc          LBA  NSID    VS  Message
  0        500     0  0x0008  0x4004  0x028            0     0     -  Invalid Field in Command
  1        499     0  0x0017  0x4004      -            0     0     -  Invalid Field in Command

Read Self-test Log failed: Invalid Field in Command (0x2002)



