smartctl 7.1 2019-12-30 r5022 [x86_64-linux-5.19.0-17.2-liquorix-amd64] (local build)
Copyright (C) 2002-19, Bruce Allen, Christian Franke, www.smartmontools.org

=== START OF INFORMATION SECTION ===
Model Number:                       Samsung SSD 960 EVO 500GB
Serial Number:                      --
Firmware Version:                   3B7QCXE7
PCI Vendor/Subsystem ID:            0x144d
IEEE OUI Identifier:                0x002538
Total NVM Capacity:                 500,107,862,016 [500 GB]
Unallocated NVM Capacity:           0
Controller ID:                      2
Number of Namespaces:               1
Namespace 1 Size/Capacity:          500,107,862,016 [500 GB]
Namespace 1 Utilization:            451,673,239,552 [451 GB]
Namespace 1 Formatted LBA Size:     512
Namespace 1 IEEE EUI-64:            002538 ...
Local Time is:                      Sun May  7 00:29:02 2023 CEST
Firmware Updates (0x16):            3 Slots, no Reset required
Optional Admin Commands (0x0007):   Security Format Frmw_DL
Optional NVM Commands (0x001f):     Comp Wr_Unc DS_Mngmt Wr_Zero Sav/Sel_Feat
Maximum Data Transfer Size:         512 Pages
Warning  Comp. Temp. Threshold:     83 Celsius
Critical Comp. Temp. Threshold:     85 Celsius

Supported Power States
St Op     Max   Active     Idle   RL RT WL WT  Ent_Lat  Ex_Lat
 0 +     6.04W       -        -    0  0  0  0        0       0
 1 +     5.09W       -        -    1  1  1  1        0       0
 2 +     4.08W       -        -    2  2  2  2        0       0
 3 -   0.0400W       -        -    3  3  3  3      210    1500
 4 -   0.0050W       -        -    4  4  4  4     2200    6000

Supported LBA Sizes (NSID 0x1)
Id Fmt  Data  Metadt  Rel_Perf
 0 +     512       0         0

=== START OF SMART DATA SECTION ===
SMART overall-health self-assessment test result: PASSED

SMART/Health Information (NVMe Log 0x02)
Critical Warning:                   0x00
Temperature:                        33 Celsius
Available Spare:                    100%
Available Spare Threshold:          10%
Percentage Used:                    2%
Data Units Read:                    17,910,491 [9.17 TB]
Data Units Written:                 36,017,383 [18.4 TB]
Host Read Commands:                 204,794,413
Host Write Commands:                884,829,412
Controller Busy Time:               2,310
Power Cycles:                       929
Power On Hours:                     31,200
Unsafe Shutdowns:                   644
Media and Data Integrity Errors:    0
Error Information Log Entries:      1,749
Warning  Comp. Temperature Time:    0
Critical Comp. Temperature Time:    0
Temperature Sensor 1:               33 Celsius
Temperature Sensor 2:               42 Celsius

Error Information (NVMe Log 0x01, max 64 entries)
Num   ErrCount  SQId   CmdId  Status  PELoc          LBA  NSID    VS
  0       1749     0  0x6013  0x4004      -            0     0     -
  1       1748     0  0x500c  0x4004      -            0     0     -
  2       1747     0  0xb018  0x4004      -            0     0     -
  3       1746     0  0x200e  0x4004      -            0     0     -
  4       1745     0  0x000d  0x4004      -            0     0     -
  5       1744     0  0x1007  0x4004      -            0     0     -
  6       1743     0  0x001b  0x4004      -            0     0     -
  7       1742     0  0x0014  0x4004      -            0     0     -
  8       1741     0  0x001b  0x421a  0x028            0     0     -
  9       1740     0  0x0007  0x4004      -            0     0     -
 10       1739     0  0x0018  0x4004      -            0     0     -
 11       1738     0  0x001b  0x421a  0x028            0     0     -
 12       1737     0  0x0007  0x4004      -            0     0     -
 13       1736     0  0x0014  0x4004      -            0     0     -
 14       1735     0  0x001b  0x421a  0x028            0     0     -
 15       1734     0  0x0007  0x4004      -            0     0     -
... (48 entries not shown)



