smartctl 7.1 2019-12-30 r5022 [x86_64-linux-5.7.10-21-tkg-pds] (local build)
Copyright (C) 2002-19, Bruce Allen, Christian Franke, www.smartmontools.org

=== START OF INFORMATION SECTION ===
Model Family:     Seagate Momentus 7200.5
Device Model:     ST9750420AS
Serial Number:    --
LU WWN Device Id: 5 000c50 ...
Firmware Version: 0001SDM5
User Capacity:    750,156,374,016 bytes [750 GB]
Sector Sizes:     512 bytes logical, 4096 bytes physical
Rotation Rate:    7200 rpm
Device is:        In smartctl database [for details use: -P show]
ATA Version is:   ATA8-ACS T13/1699-D revision 4
SATA Version is:  SATA 2.6, 3.0 Gb/s
Local Time is:    Fri Aug  7 12:12:10 2020 CEST
SMART support is: Available - device has SMART capability.
SMART support is: Enabled
AAM feature is:   Unavailable
APM level is:     128 (minimum power consumption without standby)
Rd look-ahead is: Enabled
Write cache is:   Enabled
DSN feature is:   Unavailable
ATA Security is:  Disabled, NOT FROZEN [SEC1]
Wt Cache Reorder: Enabled

=== START OF READ SMART DATA SECTION ===
SMART overall-health self-assessment test result: PASSED

General SMART Values:
Offline data collection status:  (0x00)	Offline data collection activity
					was never started.
					Auto Offline Data Collection: Disabled.
Self-test execution status:      (   0)	The previous self-test routine completed
					without error or no self-test has ever 
					been run.
Total time to complete Offline 
data collection: 		(    0) seconds.
Offline data collection
capabilities: 			 (0x73) SMART execute Offline immediate.
					Auto Offline data collection on/off support.
					Suspend Offline collection upon new
					command.
					No Offline surface scan supported.
					Self-test supported.
					Conveyance Self-test supported.
					Selective Self-test supported.
SMART capabilities:            (0x0003)	Saves SMART data before entering
					power-saving mode.
					Supports SMART auto save timer.
Error logging capability:        (0x01)	Error logging supported.
					General Purpose Logging supported.
Short self-test routine 
recommended polling time: 	 (   2) minutes.
Extended self-test routine
recommended polling time: 	 ( 147) minutes.
Conveyance self-test routine
recommended polling time: 	 (   3) minutes.
SCT capabilities: 	       (0x303f)	SCT Status supported.
					SCT Error Recovery Control supported.
					SCT Feature Control supported.
					SCT Data Table supported.

SMART Attributes Data Structure revision number: 10
Vendor Specific SMART Attributes with Thresholds:
ID# ATTRIBUTE_NAME          FLAGS    VALUE WORST THRESH FAIL RAW_VALUE
  1 Raw_Read_Error_Rate     POSR--   114   099   006    -    62337784
  3 Spin_Up_Time            PO----   098   097   085    -    0
  4 Start_Stop_Count        -O--CK   093   093   020    -    7580
  5 Reallocated_Sector_Ct   PO--CK   100   100   036    -    0
  7 Seek_Error_Rate         POSR--   081   060   030    -    148241734
  9 Power_On_Hours          -O--CK   074   074   000    -    23365
 10 Spin_Retry_Count        PO--C-   100   100   097    -    0
 12 Power_Cycle_Count       -O--CK   097   097   020    -    3374
184 End-to-End_Error        -O--CK   100   100   099    -    0
187 Reported_Uncorrect      -O--CK   096   096   000    -    4
188 Command_Timeout         -O--CK   100   098   000    -    4295032881
189 High_Fly_Writes         -O-RCK   100   100   000    -    0
190 Airflow_Temperature_Cel -O---K   065   046   045    -    35 (Min/Max 27/35)
191 G-Sense_Error_Rate      -O--CK   100   100   000    -    24
192 Power-Off_Retract_Count -O--CK   098   098   000    -    4022
193 Load_Cycle_Count        -O--CK   005   005   000    -    190090
194 Temperature_Celsius     -O---K   035   054   000    -    35 (0 10 0 0 0)
195 Hardware_ECC_Recovered  -O-RC-   114   099   000    -    62337784
197 Current_Pending_Sector  -O--C-   100   100   000    -    0
198 Offline_Uncorrectable   ----C-   100   100   000    -    0
199 UDMA_CRC_Error_Count    -OSRCK   200   200   000    -    5
240 Head_Flying_Hours       ------   100   253   000    -    12396 (200 13 0)
241 Total_LBAs_Written      ------   100   253   000    -    1499012673
242 Total_LBAs_Read         ------   100   253   000    -    3567555987
254 Free_Fall_Sensor        -O--CK   100   100   000    -    0
                            ||||||_ K auto-keep
                            |||||__ C event count
                            ||||___ R error rate
                            |||____ S speed/performance
                            ||_____ O updated online
                            |______ P prefailure warning

General Purpose Log Directory Version 1
SMART           Log Directory Version 1 [multi-sector log support]
Address    Access  R/W   Size  Description
0x00       GPL,SL  R/O      1  Log Directory
0x01       GPL,SL  R/O      1  Summary SMART error log
0x02       GPL,SL  R/O      5  Comprehensive SMART error log
0x03       GPL     R/O      5  Ext. Comprehensive SMART error log
0x06       GPL,SL  R/O      1  SMART self-test log
0x07       GPL     R/O      1  Extended self-test log
0x09       GPL,SL  R/W      1  Selective self-test log
0x10       GPL     R/O      1  NCQ Command Error log
0x11       GPL     R/O      1  SATA Phy Event Counters log
0x21       GPL     R/O      1  Write stream error log
0x22       GPL     R/O      1  Read stream error log
0x80-0x9f  GPL,SL  R/W     16  Host vendor specific log
0xa1       GPL,SL  VS      20  Device vendor specific log
0xa2       GPL     VS    2248  Device vendor specific log
0xa8       GPL,SL  VS      65  Device vendor specific log
0xa9       GPL,SL  VS       1  Device vendor specific log
0xab       GPL     VS       1  Device vendor specific log
0xae       GPL     VS       1  Device vendor specific log
0xb0       GPL     VS    2864  Device vendor specific log
0xbd       GPL     VS     252  Device vendor specific log
0xbe-0xbf  GPL     VS   65535  Device vendor specific log
0xe0       GPL,SL  R/W      1  SCT Command/Status
0xe1       GPL,SL  R/W      1  SCT Data Transfer

SMART Extended Comprehensive Error Log Version: 1 (5 sectors)
Device Error Count: 4
	CR     = Command Register
	FEATR  = Features Register
	COUNT  = Count (was: Sector Count) Register
	LBA_48 = Upper bytes of LBA High/Mid/Low Registers ]  ATA-8
	LH     = LBA High (was: Cylinder High) Register    ]   LBA
	LM     = LBA Mid (was: Cylinder Low) Register      ] Register
	LL     = LBA Low (was: Sector Number) Register     ]
	DV     = Device (was: Device/Head) Register
	DC     = Device Control Register
	ER     = Error register
	ST     = Status register
Powered_Up_Time is measured from power on, and printed as
DDd+hh:mm:SS.sss where DD=days, hh=hours, mm=minutes,
SS=sec, and sss=millisec. It "wraps" after 49.710 days.

Error 4 [3] occurred at disk power-on lifetime: 3240 hours (135 days + 0 hours)
  When the command that caused the error occurred, the device was active or idle.

  After command completion occurred, registers were:
  ER -- ST COUNT  LBA_48  LH LM LL DV DC
  -- -- -- == -- == == == -- -- -- -- --
  40 -- 51 00 00 00 00 00 32 5a 68 00 00  Error: UNC at LBA = 0x00325a68 = 3299944

  Commands leading to the command that caused the error were:
  CR FEATR COUNT  LBA_48  LH LM LL DV DC  Powered_Up_Time  Command/Feature_Name
  -- == -- == -- == == == -- -- -- -- --  ---------------  --------------------
  25 03 03 00 08 00 00 00 32 5a 68 40 00     00:24:36.639  READ DMA EXT
  25 03 03 00 08 00 00 00 32 5a 60 40 00     00:24:36.637  READ DMA EXT
  25 03 03 00 08 00 00 00 32 5a 58 40 00     00:24:36.637  READ DMA EXT
  25 03 03 00 08 00 00 00 32 5a 50 40 00     00:24:36.636  READ DMA EXT
  25 03 03 00 08 00 00 00 32 5a 48 40 00     00:24:36.635  READ DMA EXT

Error 3 [2] occurred at disk power-on lifetime: 3240 hours (135 days + 0 hours)
  When the command that caused the error occurred, the device was active or idle.

  After command completion occurred, registers were:
  ER -- ST COUNT  LBA_48  LH LM LL DV DC
  -- -- -- == -- == == == -- -- -- -- --
  40 -- 51 00 00 00 00 00 32 5a 68 00 00  Error: UNC at LBA = 0x00325a68 = 3299944

  Commands leading to the command that caused the error were:
  CR FEATR COUNT  LBA_48  LH LM LL DV DC  Powered_Up_Time  Command/Feature_Name
  -- == -- == -- == == == -- -- -- -- --  ---------------  --------------------
  25 03 03 00 f0 00 00 00 32 59 e8 40 00     00:24:33.358  READ DMA EXT
  25 03 03 00 10 00 00 00 32 59 d8 40 00     00:24:33.357  READ DMA EXT
  25 03 03 00 f0 00 00 00 32 58 e8 40 00     00:24:33.353  READ DMA EXT
  25 03 03 00 10 00 00 00 32 58 d8 40 00     00:24:33.353  READ DMA EXT
  25 03 03 00 f0 00 00 00 32 57 e8 40 00     00:24:33.350  READ DMA EXT

Error 2 [1] occurred at disk power-on lifetime: 3239 hours (134 days + 23 hours)
  When the command that caused the error occurred, the device was active or idle.

  After command completion occurred, registers were:
  ER -- ST COUNT  LBA_48  LH LM LL DV DC
  -- -- -- == -- == == == -- -- -- -- --
  40 -- 51 00 00 00 00 00 32 5a 68 00 00  Error: UNC at LBA = 0x00325a68 = 3299944

  Commands leading to the command that caused the error were:
  CR FEATR COUNT  LBA_48  LH LM LL DV DC  Powered_Up_Time  Command/Feature_Name
  -- == -- == -- == == == -- -- -- -- --  ---------------  --------------------
  25 03 03 00 08 00 00 00 32 5a 68 40 00     00:04:03.103  READ DMA EXT
  25 03 03 00 08 00 00 00 32 5a 60 40 00     00:04:03.100  READ DMA EXT
  25 03 03 00 08 00 00 00 32 5a 58 40 00     00:04:03.100  READ DMA EXT
  25 03 03 00 08 00 00 00 32 5a 50 40 00     00:04:03.099  READ DMA EXT
  25 03 03 00 08 00 00 00 32 5a 48 40 00     00:04:03.099  READ DMA EXT

Error 1 [0] occurred at disk power-on lifetime: 3239 hours (134 days + 23 hours)
  When the command that caused the error occurred, the device was active or idle.

  After command completion occurred, registers were:
  ER -- ST COUNT  LBA_48  LH LM LL DV DC
  -- -- -- == -- == == == -- -- -- -- --
  40 -- 51 00 00 00 00 00 32 5a 68 00 00  Error: UNC at LBA = 0x00325a68 = 3299944

  Commands leading to the command that caused the error were:
  CR FEATR COUNT  LBA_48  LH LM LL DV DC  Powered_Up_Time  Command/Feature_Name
  -- == -- == -- == == == -- -- -- -- --  ---------------  --------------------
  25 03 03 00 f0 00 00 00 2b 5e e0 40 00     00:03:52.541  READ DMA EXT
  25 03 03 00 f0 00 00 00 2b 38 e0 40 00     00:03:52.197  READ DMA EXT
  25 03 03 00 f0 00 00 00 2b 00 e0 40 00     00:03:51.732  READ DMA EXT
  25 03 03 00 f0 00 00 00 2a d9 e0 40 00     00:03:51.409  READ DMA EXT
  25 03 03 00 f0 00 00 00 2a 98 e0 40 00     00:03:50.913  READ DMA EXT

SMART Extended Self-test Log Version: 1 (1 sectors)
Num  Test_Description    Status                  Remaining  LifeTime(hours)  LBA_of_first_error
# 1  Short offline       Completed without error       00%     12603         -
# 2  Short offline       Completed without error       00%      8460         -
# 3  Extended offline    Completed without error       00%      8097         -
# 4  Short offline       Completed without error       00%      8093         -
# 5  Short offline       Completed without error       00%      8078         -
# 6  Short offline       Completed without error       00%      8060         -
# 7  Short offline       Completed without error       00%      8043         -
# 8  Short offline       Completed without error       00%      8027         -
# 9  Short offline       Completed without error       00%      8010         -
#10  Short offline       Completed without error       00%      7994         -
#11  Extended offline    Completed without error       00%      7981         -
#12  Short offline       Completed without error       00%      7978         -
#13  Short offline       Completed without error       00%      7963         -
#14  Short offline       Completed without error       00%      7946         -
#15  Short offline       Completed without error       00%      7930         -
#16  Short offline       Completed without error       00%      7913         -
#17  Short offline       Completed without error       00%      7897         -
#18  Short offline       Completed without error       00%      7884         -
#19  Extended offline    Completed without error       00%      7875         -

SMART Selective self-test log data structure revision number 1
 SPAN  MIN_LBA  MAX_LBA  CURRENT_TEST_STATUS
    1        0        0  Not_testing
    2        0        0  Not_testing
    3        0        0  Not_testing
    4        0        0  Not_testing
    5        0        0  Not_testing
Selective self-test flags (0x0):
  After scanning selected spans, do NOT read-scan remainder of disk.
If Selective self-test is pending on power-up, resume after 0 minute delay.

SCT Status Version:                  3
SCT Version (vendor specific):       522 (0x020a)
Device State:                        Active (0)
Current Temperature:                    35 Celsius
Power Cycle Min/Max Temperature:     27/35 Celsius
Lifetime    Min/Max Temperature:     10/51 Celsius
Specified Max Operating Temperature:    35 Celsius
Under/Over Temperature Limit Count:   0/0

SCT Temperature History Version:     2
Temperature Sampling Period:         1 minute
Temperature Logging Interval:        30 minutes
Min/Max recommended Temperature:     14/55 Celsius
Min/Max Temperature Limit:           10/60 Celsius
Temperature History Size (Index):    128 (13)

SCT Error Recovery Control:
           Read: Disabled
          Write: Disabled

Device Statistics (GP/SMART Log 0x04) not supported

Pending Defects log (GP Log 0x0c) not supported

SATA Phy Event Counters (GP Log 0x11)
ID      Size     Value  Description
0x000a  2            1  Device-to-host register FISes sent due to a COMRESET
0x0001  2            0  Command failed due to ICRC error
0x0003  2            0  R_ERR response for device-to-host data FIS
0x0004  2            0  R_ERR response for host-to-device data FIS
0x0006  2            0  R_ERR response for device-to-host non-data FIS
0x0007  2            0  R_ERR response for host-to-device non-data FIS



