smartctl 7.4 2023-08-01 r5530 [x86_64-linux-6.6.2-desktop-1omv2390] (OpenMandriva Lx 7.4-1)
Copyright (C) 2002-23, Bruce Allen, Christian Franke, www.smartmontools.org

=== START OF INFORMATION SECTION ===
Model Number:                       SAMSUNG MZVLQ512HBLU-00BH1
Serial Number:                      --
Firmware Version:                   HPS1NFAV
PCI Vendor/Subsystem ID:            0x144d
IEEE OUI Identifier:                0x002538
Total NVM Capacity:                 512,110,190,592 [512 GB]
Unallocated NVM Capacity:           0
Controller ID:                      5
NVMe Version:                       1.4
Number of Namespaces:               1
Namespace 1 Size/Capacity:          512,110,190,592 [512 GB]
Namespace 1 Utilization:            41,053,052,928 [41.0 GB]
Namespace 1 Formatted LBA Size:     512
Namespace 1 IEEE EUI-64:            002538 ...
Local Time is:                      Fri Feb  2 04:43:26 2024 EST
Firmware Updates (0x16):            3 Slots, no Reset required
Optional Admin Commands (0x0017):   Security Format Frmw_DL Self_Test
Optional NVM Commands (0x005f):     Comp Wr_Unc DS_Mngmt Wr_Zero Sav/Sel_Feat Timestmp
Log Page Attributes (0x0f):         S/H_per_NS Cmd_Eff_Lg Ext_Get_Lg Telmtry_Lg
Maximum Data Transfer Size:         512 Pages
Warning  Comp. Temp. Threshold:     81 Celsius
Critical Comp. Temp. Threshold:     85 Celsius
Namespace 1 Features (0x10):        NP_Fields

Supported Power States
St Op     Max   Active     Idle   RL RT WL WT  Ent_Lat  Ex_Lat
 0 +     5.36W       -        -    0  0  0  0        0       0
 1 +     4.47W       -        -    1  1  1  1        0       0
 2 +     2.23W       -        -    2  2  2  2        0     500
 3 -   0.0500W       -        -    3  3  3  3      210    1200
 4 -   0.0050W       -        -    4  4  4  4     1000    9000

Supported LBA Sizes (NSID 0x1)
Id Fmt  Data  Metadt  Rel_Perf
 0 +     512       0         0
 1 -    4096       0         0

=== START OF SMART DATA SECTION ===
SMART overall-health self-assessment test result: PASSED

SMART/Health Information (NVMe Log 0x02)
Critical Warning:                   0x00
Temperature:                        22 Celsius
Available Spare:                    100%
Available Spare Threshold:          5%
Percentage Used:                    1%
Data Units Read:                    7,313,036 [3.74 TB]
Data Units Written:                 9,386,648 [4.80 TB]
Host Read Commands:                 90,594,170
Host Write Commands:                98,481,152
Controller Busy Time:               314
Power Cycles:                       721
Power On Hours:                     206
Unsafe Shutdowns:                   193
Media and Data Integrity Errors:    0
Error Information Log Entries:      0
Warning  Comp. Temperature Time:    150
Critical Comp. Temperature Time:    0
Temperature Sensor 1:               22 Celsius

Error Information (NVMe Log 0x01, 16 of 64 entries)
No Errors Logged

Self-test Log (NVMe Log 0x06)
Self-test status: No self-test in progress
Num  Test_Description  Status                       Power_on_Hours  Failing_LBA  NSID Seg SCT Code
 0   Short             Aborted: Self-test command               23            -     -   -   -    -

