smartctl 7.1 2019-12-30 r5022 [x86_64-linux-5.0.0-32-generic] (local build)
Copyright (C) 2002-19, Bruce Allen, Christian Franke, www.smartmontools.org

=== START OF INFORMATION SECTION ===
Model Family:     Western Digital Green
Device Model:     WDC WD20EARX-00ZUDB0
Serial Number:    --
LU WWN Device Id: 5 0014ee ...
Firmware Version: 80.00A80
User Capacity:    2,000,398,934,016 bytes [2.00 TB]
Sector Sizes:     512 bytes logical, 4096 bytes physical
Rotation Rate:    5400 rpm
Device is:        In smartctl database [for details use: -P show]
ATA Version is:   ATA8-ACS (minor revision not indicated)
SATA Version is:  SATA 3.0, 6.0 Gb/s (current: 6.0 Gb/s)
Local Time is:    Tue Mar  3 15:21:50 2020 PST
SMART support is: Available - device has SMART capability.
SMART support is: Enabled
AAM feature is:   Unavailable
APM feature is:   Unavailable
Rd look-ahead is: Enabled
Write cache is:   Enabled
DSN feature is:   Unavailable
ATA Security is:  Disabled, frozen [SEC2]
Wt Cache Reorder: Enabled

=== START OF READ SMART DATA SECTION ===
SMART overall-health self-assessment test result: PASSED

General SMART Values:
Offline data collection status:  (0x84)	Offline data collection activity
					was suspended by an interrupting command from host.
					Auto Offline Data Collection: Enabled.
Self-test execution status:      (   0)	The previous self-test routine completed
					without error or no self-test has ever 
					been run.
Total time to complete Offline 
data collection: 		(40200) seconds.
Offline data collection
capabilities: 			 (0x7b) SMART execute Offline immediate.
					Auto Offline data collection on/off support.
					Suspend Offline collection upon new
					command.
					Offline surface scan supported.
					Self-test supported.
					Conveyance Self-test supported.
					Selective Self-test supported.
SMART capabilities:            (0x0003)	Saves SMART data before entering
					power-saving mode.
					Supports SMART auto save timer.
Error logging capability:        (0x01)	Error logging supported.
					General Purpose Logging supported.
Short self-test routine 
recommended polling time: 	 (   2) minutes.
Extended self-test routine
recommended polling time: 	 ( 387) minutes.
Conveyance self-test routine
recommended polling time: 	 (   5) minutes.
SCT capabilities: 	       (0x3035)	SCT Status supported.
					SCT Feature Control supported.
					SCT Data Table supported.

SMART Attributes Data Structure revision number: 16
Vendor Specific SMART Attributes with Thresholds:
ID# ATTRIBUTE_NAME          FLAGS    VALUE WORST THRESH FAIL RAW_VALUE
  1 Raw_Read_Error_Rate     POSR-K   200   200   051    -    59
  3 Spin_Up_Time            POS--K   253   225   021    -    5683
  4 Start_Stop_Count        -O--CK   095   095   000    -    5823
  5 Reallocated_Sector_Ct   PO--CK   200   200   140    -    0
  7 Seek_Error_Rate         -OSR-K   200   200   000    -    0
  9 Power_On_Hours          -O--CK   056   056   000    -    32804
 10 Spin_Retry_Count        -O--CK   100   100   000    -    0
 11 Calibration_Retry_Count -O--CK   100   100   000    -    0
 12 Power_Cycle_Count       -O--CK   095   095   000    -    5803
192 Power-Off_Retract_Count -O--CK   193   193   000    -    5674
193 Load_Cycle_Count        -O--CK   001   001   000    -    906372
194 Temperature_Celsius     -O---K   099   092   000    -    51
196 Reallocated_Event_Count -O--CK   200   200   000    -    0
197 Current_Pending_Sector  -O--CK   200   197   000    -    0
198 Offline_Uncorrectable   ----CK   200   197   000    -    0
199 UDMA_CRC_Error_Count    -O--CK   200   200   000    -    17
200 Multi_Zone_Error_Rate   ---R--   200   199   000    -    0
                            ||||||_ K auto-keep
                            |||||__ C event count
                            ||||___ R error rate
                            |||____ S speed/performance
                            ||_____ O updated online
                            |______ P prefailure warning

General Purpose Log Directory Version 1
SMART           Log Directory Version 1 [multi-sector log support]
Address    Access  R/W   Size  Description
0x00       GPL,SL  R/O      1  Log Directory
0x01           SL  R/O      1  Summary SMART error log
0x02           SL  R/O      5  Comprehensive SMART error log
0x03       GPL     R/O      6  Ext. Comprehensive SMART error log
0x06           SL  R/O      1  SMART self-test log
0x07       GPL     R/O      1  Extended self-test log
0x09           SL  R/W      1  Selective self-test log
0x10       GPL     R/O      1  NCQ Command Error log
0x11       GPL     R/O      1  SATA Phy Event Counters log
0x80-0x9f  GPL,SL  R/W     16  Host vendor specific log
0xa0-0xa7  GPL,SL  VS      16  Device vendor specific log
0xa8-0xb5  GPL,SL  VS       1  Device vendor specific log
0xb6       GPL     VS       1  Device vendor specific log
0xb7       GPL,SL  VS       1  Device vendor specific log
0xbd       GPL,SL  VS       1  Device vendor specific log
0xc0       GPL,SL  VS       1  Device vendor specific log
0xc1       GPL     VS      93  Device vendor specific log
0xe0       GPL,SL  R/W      1  SCT Command/Status
0xe1       GPL,SL  R/W      1  SCT Data Transfer

SMART Extended Comprehensive Error Log Version: 1 (6 sectors)
Device Error Count: 280 (device log contains only the most recent 24 errors)
	CR     = Command Register
	FEATR  = Features Register
	COUNT  = Count (was: Sector Count) Register
	LBA_48 = Upper bytes of LBA High/Mid/Low Registers ]  ATA-8
	LH     = LBA High (was: Cylinder High) Register    ]   LBA
	LM     = LBA Mid (was: Cylinder Low) Register      ] Register
	LL     = LBA Low (was: Sector Number) Register     ]
	DV     = Device (was: Device/Head) Register
	DC     = Device Control Register
	ER     = Error register
	ST     = Status register
Powered_Up_Time is measured from power on, and printed as
DDd+hh:mm:SS.sss where DD=days, hh=hours, mm=minutes,
SS=sec, and sss=millisec. It "wraps" after 49.710 days.

Error 280 [15] occurred at disk power-on lifetime: 26468 hours (1102 days + 20 hours)
  When the command that caused the error occurred, the device was active or idle.

  After command completion occurred, registers were:
  ER -- ST COUNT  LBA_48  LH LM LL DV DC
  -- -- -- == -- == == == -- -- -- -- --
  40 -- 51 00 00 00 00 00 50 0d e0 40 00  Error: UNC at LBA = 0x00500de0 = 5246432

  Commands leading to the command that caused the error were:
  CR FEATR COUNT  LBA_48  LH LM LL DV DC  Powered_Up_Time  Command/Feature_Name
  -- == -- == -- == == == -- -- -- -- --  ---------------  --------------------
  60 00 08 00 28 00 00 2e 9c 46 78 40 00     00:06:25.780  READ FPDMA QUEUED
  60 00 08 00 20 00 00 00 f5 bd c8 40 00     00:06:25.776  READ FPDMA QUEUED
  60 00 08 00 18 00 00 00 50 0d e0 40 00     00:06:25.776  READ FPDMA QUEUED
  60 00 20 00 10 00 00 00 17 85 fb 40 00     00:06:25.772  READ FPDMA QUEUED
  60 00 08 00 08 00 00 00 62 af 20 40 00     00:06:25.768  READ FPDMA QUEUED

Error 279 [14] occurred at disk power-on lifetime: 26468 hours (1102 days + 20 hours)
  When the command that caused the error occurred, the device was active or idle.

  After command completion occurred, registers were:
  ER -- ST COUNT  LBA_48  LH LM LL DV DC
  -- -- -- == -- == == == -- -- -- -- --
  40 -- 51 00 00 00 00 00 50 0d e0 40 00  Error: UNC at LBA = 0x00500de0 = 5246432

  Commands leading to the command that caused the error were:
  CR FEATR COUNT  LBA_48  LH LM LL DV DC  Powered_Up_Time  Command/Feature_Name
  -- == -- == -- == == == -- -- -- -- --  ---------------  --------------------
  60 00 20 00 b8 00 00 00 14 40 10 40 00     00:06:23.039  READ FPDMA QUEUED
  61 00 58 00 b0 00 00 00 5d 8e 70 40 00     00:06:23.039  WRITE FPDMA QUEUED
  61 00 28 00 a8 00 00 00 03 0e 18 40 00     00:06:23.039  WRITE FPDMA QUEUED
  61 00 08 00 a0 00 00 00 26 cb d8 40 00     00:06:23.038  WRITE FPDMA QUEUED
  60 00 08 00 98 00 00 00 63 7d b0 40 00     00:06:23.030  READ FPDMA QUEUED

Error 278 [13] occurred at disk power-on lifetime: 26468 hours (1102 days + 20 hours)
  When the command that caused the error occurred, the device was active or idle.

  After command completion occurred, registers were:
  ER -- ST COUNT  LBA_48  LH LM LL DV DC
  -- -- -- == -- == == == -- -- -- -- --
  40 -- 51 00 00 00 00 00 50 0d e0 40 00  Error: WP at LBA = 0x00500de0 = 5246432

  Commands leading to the command that caused the error were:
  CR FEATR COUNT  LBA_48  LH LM LL DV DC  Powered_Up_Time  Command/Feature_Name
  -- == -- == -- == == == -- -- -- -- --  ---------------  --------------------
  61 00 08 00 d8 00 00 00 5d 8e 70 40 00     00:06:20.217  WRITE FPDMA QUEUED
  61 00 08 00 d0 00 00 00 26 cb d8 40 00     00:06:20.216  WRITE FPDMA QUEUED
  61 00 08 00 c8 00 00 00 5d 8d e0 40 00     00:06:20.208  WRITE FPDMA QUEUED
  60 00 08 00 c0 00 00 0b 10 b2 c0 40 00     00:06:20.208  READ FPDMA QUEUED
  60 00 08 00 b8 00 00 00 50 0d e0 40 00     00:06:20.208  READ FPDMA QUEUED

Error 277 [12] occurred at disk power-on lifetime: 26468 hours (1102 days + 20 hours)
  When the command that caused the error occurred, the device was active or idle.

  After command completion occurred, registers were:
  ER -- ST COUNT  LBA_48  LH LM LL DV DC
  -- -- -- == -- == == == -- -- -- -- --
  40 -- 51 00 00 00 00 00 50 0d e0 40 00  Error: UNC at LBA = 0x00500de0 = 5246432

  Commands leading to the command that caused the error were:
  CR FEATR COUNT  LBA_48  LH LM LL DV DC  Powered_Up_Time  Command/Feature_Name
  -- == -- == -- == == == -- -- -- -- --  ---------------  --------------------
  60 00 08 00 00 00 00 00 92 30 e8 40 00     00:06:17.485  READ FPDMA QUEUED
  60 00 08 00 f8 00 00 00 50 0d e0 40 00     00:06:17.475  READ FPDMA QUEUED
  60 00 40 00 f0 00 00 00 1b 31 e2 40 00     00:06:17.468  READ FPDMA QUEUED
  60 00 20 00 e8 00 00 00 1c 03 47 40 00     00:06:17.462  READ FPDMA QUEUED
  60 00 3a 00 e0 00 00 00 0e 52 00 40 00     00:06:17.455  READ FPDMA QUEUED

Error 276 [11] occurred at disk power-on lifetime: 26468 hours (1102 days + 20 hours)
  When the command that caused the error occurred, the device was active or idle.

  After command completion occurred, registers were:
  ER -- ST COUNT  LBA_48  LH LM LL DV DC
  -- -- -- == -- == == == -- -- -- -- --
  40 -- 51 00 00 00 00 00 50 0d e0 40 00  Error: UNC at LBA = 0x00500de0 = 5246432

  Commands leading to the command that caused the error were:
  CR FEATR COUNT  LBA_48  LH LM LL DV DC  Powered_Up_Time  Command/Feature_Name
  -- == -- == -- == == == -- -- -- -- --  ---------------  --------------------
  60 00 30 00 58 00 00 00 14 4f 58 40 00     00:06:14.728  READ FPDMA QUEUED
  60 00 10 00 50 00 00 00 14 3d 98 40 00     00:06:14.728  READ FPDMA QUEUED
  60 00 30 00 48 00 00 00 14 46 a8 40 00     00:06:14.728  READ FPDMA QUEUED
  60 00 30 00 40 00 00 00 14 41 c8 40 00     00:06:14.727  READ FPDMA QUEUED
  60 00 18 00 38 00 00 00 14 3e 60 40 00     00:06:14.726  READ FPDMA QUEUED

Error 275 [10] occurred at disk power-on lifetime: 26468 hours (1102 days + 20 hours)
  When the command that caused the error occurred, the device was active or idle.

  After command completion occurred, registers were:
  ER -- ST COUNT  LBA_48  LH LM LL DV DC
  -- -- -- == -- == == == -- -- -- -- --
  40 -- 51 00 00 00 00 00 50 0d e0 40 00  Error: WP at LBA = 0x00500de0 = 5246432

  Commands leading to the command that caused the error were:
  CR FEATR COUNT  LBA_48  LH LM LL DV DC  Powered_Up_Time  Command/Feature_Name
  -- == -- == -- == == == -- -- -- -- --  ---------------  --------------------
  61 00 18 00 60 00 00 00 03 fd e8 40 00     00:06:11.227  WRITE FPDMA QUEUED
  60 00 40 00 58 00 00 00 28 00 08 40 00     00:06:11.218  READ FPDMA QUEUED
  60 00 f8 00 50 00 00 23 f9 90 20 40 00     00:06:11.218  READ FPDMA QUEUED
  60 00 08 00 48 00 00 1a 79 28 88 40 00     00:06:11.218  READ FPDMA QUEUED
  60 00 08 00 40 00 00 2e 9c 47 c0 40 00     00:06:11.218  READ FPDMA QUEUED

Error 274 [9] occurred at disk power-on lifetime: 26468 hours (1102 days + 20 hours)
  When the command that caused the error occurred, the device was active or idle.

  After command completion occurred, registers were:
  ER -- ST COUNT  LBA_48  LH LM LL DV DC
  -- -- -- == -- == == == -- -- -- -- --
  40 -- 51 00 00 00 00 00 50 0d e0 40 00  Error: WP at LBA = 0x00500de0 = 5246432

  Commands leading to the command that caused the error were:
  CR FEATR COUNT  LBA_48  LH LM LL DV DC  Powered_Up_Time  Command/Feature_Name
  -- == -- == -- == == == -- -- -- -- --  ---------------  --------------------
  61 00 10 00 78 00 00 00 5d 8e 70 40 00     00:06:08.365  WRITE FPDMA QUEUED
  61 00 08 00 70 00 00 00 03 fd e8 40 00     00:06:08.365  WRITE FPDMA QUEUED
  60 00 08 00 68 00 00 00 7d 7a d0 40 00     00:06:08.365  READ FPDMA QUEUED
  60 00 80 00 60 00 00 1a 79 28 08 40 00     00:06:08.365  READ FPDMA QUEUED
  60 00 08 00 58 00 00 00 27 fb 28 40 00     00:06:08.365  READ FPDMA QUEUED

Error 273 [8] occurred at disk power-on lifetime: 26468 hours (1102 days + 20 hours)
  When the command that caused the error occurred, the device was active or idle.

  After command completion occurred, registers were:
  ER -- ST COUNT  LBA_48  LH LM LL DV DC
  -- -- -- == -- == == == -- -- -- -- --
  40 -- 51 00 00 00 00 00 50 0d e0 40 00  Error: WP at LBA = 0x00500de0 = 5246432

  Commands leading to the command that caused the error were:
  CR FEATR COUNT  LBA_48  LH LM LL DV DC  Powered_Up_Time  Command/Feature_Name
  -- == -- == -- == == == -- -- -- -- --  ---------------  --------------------
  61 00 08 00 38 00 00 00 5d 8e 78 40 00     00:06:05.442  WRITE FPDMA QUEUED
  61 01 00 00 f8 00 00 00 4f bd 60 40 00     00:06:05.442  WRITE FPDMA QUEUED
  60 00 08 00 f0 00 00 00 50 0d e0 40 00     00:06:05.442  READ FPDMA QUEUED
  60 00 80 00 e8 00 00 1a 79 26 10 40 00     00:06:05.442  READ FPDMA QUEUED
  60 00 08 00 d8 00 00 00 34 2a a2 40 00     00:06:05.442  READ FPDMA QUEUED

SMART Extended Self-test Log Version: 1 (1 sectors)
Num  Test_Description    Status                  Remaining  LifeTime(hours)  LBA_of_first_error
# 1  Short offline       Completed without error       00%     30623         -
# 2  Extended offline    Completed without error       00%     28381         -
# 3  Conveyance offline  Completed: read failure       90%     23112         733589568
# 4  Short offline       Completed: read failure       10%     23089         733589568
# 5  Short offline       Completed: read failure       90%     23083         733589568
# 6  Short offline       Completed: read failure       90%     19373         9272312
# 7  Short offline       Completed: read failure       10%     19373         9272318
# 8  Short offline       Completed: read failure       10%     19372         9272318
# 9  Extended offline    Completed: read failure       90%     19346         3916680
#10  Short offline       Completed: read failure       90%     19080         4664
#11  Short offline       Completed without error       00%     18443         -
#12  Conveyance offline  Completed without error       00%     18389         -
8 of 8 failed self-tests are outdated by newer successful extended offline self-test # 2

SMART Selective self-test log data structure revision number 1
 SPAN  MIN_LBA  MAX_LBA  CURRENT_TEST_STATUS
    1        0        0  Not_testing
    2        0        0  Not_testing
    3        0        0  Not_testing
    4        0        0  Not_testing
    5        0        0  Not_testing
Selective self-test flags (0x0):
  After scanning selected spans, do NOT read-scan remainder of disk.
If Selective self-test is pending on power-up, resume after 0 minute delay.

SCT Status Version:                  3
SCT Version (vendor specific):       258 (0x0102)
Device State:                        Active (0)
Current Temperature:                    51 Celsius
Power Cycle Min/Max Temperature:     49/51 Celsius
Lifetime    Min/Max Temperature:     47/58 Celsius
Under/Over Temperature Limit Count:   0/0

SCT Temperature History Version:     2
Temperature Sampling Period:         1 minute
Temperature Logging Interval:        1 minute
Min/Max recommended Temperature:      0/60 Celsius
Min/Max Temperature Limit:           -41/85 Celsius
Temperature History Size (Index):    478 (361)

SCT Error Recovery Control command not supported

Device Statistics (GP/SMART Log 0x04) not supported

Pending Defects log (GP Log 0x0c) not supported

SATA Phy Event Counters (GP Log 0x11)
ID      Size     Value  Description
0x0001  2            0  Command failed due to ICRC error
0x0002  2            0  R_ERR response for data FIS
0x0003  2            0  R_ERR response for device-to-host data FIS
0x0004  2            0  R_ERR response for host-to-device data FIS
0x0005  2            0  R_ERR response for non-data FIS
0x0006  2            0  R_ERR response for device-to-host non-data FIS
0x0007  2            0  R_ERR response for host-to-device non-data FIS
0x0008  2            0  Device-to-host non-data FIS retries
0x0009  2           14  Transition from drive PhyRdy to drive PhyNRdy
0x000a  2           11  Device-to-host register FISes sent due to a COMRESET
0x000b  2            0  CRC errors within host-to-device FIS
0x000f  2            0  R_ERR response for host-to-device data FIS, CRC
0x0012  2            0  R_ERR response for host-to-device non-data FIS, CRC
0x8000  4         5454  Vendor specific

