smartctl 7.2 2020-12-30 r5155 [x86_64-linux-5.15.0-79-generic] (local build)
Copyright (C) 2002-20, Bruce Allen, Christian Franke, www.smartmontools.org

=== START OF INFORMATION SECTION ===
Model Family:     Seagate Samsung SpinPoint M8 (AF)
Device Model:     ST1000LM024 HN-M101MBB
Serial Number:    --
LU WWN Device Id: 5 0004cf ...
Firmware Version: 2BA30001
User Capacity:    1,000,204,886,016 bytes [1.00 TB]
Sector Size:      512 bytes logical/physical
Rotation Rate:    5400 rpm
Form Factor:      2.5 inches
Device is:        In smartctl database [for details use: -P show]
ATA Version is:   ATA8-ACS T13/1699-D revision 6
SATA Version is:  SATA 3.0, 6.0 Gb/s (current: 6.0 Gb/s)
Local Time is:    Sun Aug 20 18:56:54 2023 -03
SMART support is: Available - device has SMART capability.
SMART support is: Enabled
AAM feature is:   Disabled
APM level is:     254 (maximum performance)
Rd look-ahead is: Enabled
Write cache is:   Enabled
DSN feature is:   Unavailable
ATA Security is:  Disabled, NOT FROZEN [SEC1]
Wt Cache Reorder: Enabled

=== START OF READ SMART DATA SECTION ===
SMART overall-health self-assessment test result: PASSED

General SMART Values:
Offline data collection status:  (0x00)	Offline data collection activity
					was never started.
					Auto Offline Data Collection: Disabled.
Self-test execution status:      ( 121)	The previous self-test completed having
					the read element of the test failed.
Total time to complete Offline 
data collection: 		(13440) seconds.
Offline data collection
capabilities: 			 (0x5b) SMART execute Offline immediate.
					Auto Offline data collection on/off support.
					Suspend Offline collection upon new
					command.
					Offline surface scan supported.
					Self-test supported.
					No Conveyance Self-test supported.
					Selective Self-test supported.
SMART capabilities:            (0x0003)	Saves SMART data before entering
					power-saving mode.
					Supports SMART auto save timer.
Error logging capability:        (0x01)	Error logging supported.
					General Purpose Logging supported.
Short self-test routine 
recommended polling time: 	 (   2) minutes.
Extended self-test routine
recommended polling time: 	 ( 224) minutes.
SCT capabilities: 	       (0x003f)	SCT Status supported.
					SCT Error Recovery Control supported.
					SCT Feature Control supported.
					SCT Data Table supported.

SMART Attributes Data Structure revision number: 16
Vendor Specific SMART Attributes with Thresholds:
ID# ATTRIBUTE_NAME          FLAGS    VALUE WORST THRESH FAIL RAW_VALUE
  1 Raw_Read_Error_Rate     POSR-K   100   100   051    -    3557
  2 Throughput_Performance  -OS--K   252   252   000    -    0
  3 Spin_Up_Time            PO---K   092   081   025    -    2522
  4 Start_Stop_Count        -O--CK   098   098   000    -    2507
  5 Reallocated_Sector_Ct   PO--CK   252   252   010    -    0
  7 Seek_Error_Rate         -OSR-K   252   252   051    -    0
  8 Seek_Time_Performance   --S--K   252   252   015    -    0
  9 Power_On_Hours          -O--CK   100   100   000    -    8598
 10 Spin_Retry_Count        -O--CK   252   252   051    -    0
 11 Calibration_Retry_Count -O--CK   100   100   000    -    227
 12 Power_Cycle_Count       -O--CK   099   099   000    -    2004
 13 Read_Soft_Error_Rate    -O-RCK   100   100   000    -    0
181 Program_Fail_Cnt_Total  -O---K   096   096   000    -    91768138
191 G-Sense_Error_Rate      -O---K   100   100   000    -    117
192 Power-Off_Retract_Count -O---K   252   252   000    -    0
193 Load_Cycle_Count        -O--CK   088   088   000    -    128308
194 Temperature_Celsius     -O----   063   046   000    -    37 (Min/Max 14/54)
195 Hardware_ECC_Recovered  -O-RCK   100   100   000    -    0
196 Reallocated_Event_Count -O--CK   252   252   000    -    0
197 Current_Pending_Sector  -O--CK   100   100   000    -    12
198 Offline_Uncorrectable   ----CK   252   252   000    -    0
199 UDMA_CRC_Error_Count    -OS-CK   200   200   000    -    0
200 Multi_Zone_Error_Rate   -O-R-K   100   100   000    -    4924
240 Head_Flying_Hours       -O--CK   100   100   000    -    8350
241 Total_LBAs_Written      -O--CK   099   094   000    -    2607426
242 Total_LBAs_Read         -O--CK   097   093   000    -    4450424
254 Free_Fall_Sensor        -O--CK   252   252   000    -    0
                            ||||||_ K auto-keep
                            |||||__ C event count
                            ||||___ R error rate
                            |||____ S speed/performance
                            ||_____ O updated online
                            |______ P prefailure warning

General Purpose Log Directory Version 1
SMART           Log Directory Version 1 [multi-sector log support]
Address    Access  R/W   Size  Description
0x00       GPL,SL  R/O      1  Log Directory
0x01           SL  R/O      1  Summary SMART error log
0x02           SL  R/O      2  Comprehensive SMART error log
0x03       GPL     R/O      2  Ext. Comprehensive SMART error log
0x06           SL  R/O      1  SMART self-test log
0x07       GPL     R/O      2  Extended self-test log
0x08       GPL     R/O      2  Power Conditions log
0x09           SL  R/W      1  Selective self-test log
0x10       GPL     R/O      1  NCQ Command Error log
0x11       GPL     R/O      1  SATA Phy Event Counters log
0x80-0x9f  GPL,SL  R/W     16  Host vendor specific log
0xc0-0xdf  GPL,SL  VS      16  Device vendor specific log
0xe0       GPL,SL  R/W      1  SCT Command/Status
0xe1       GPL,SL  R/W      1  SCT Data Transfer

SMART Extended Comprehensive Error Log Version: 1 (2 sectors)
Device Error Count: 1741 (device log contains only the most recent 8 errors)
	CR     = Command Register
	FEATR  = Features Register
	COUNT  = Count (was: Sector Count) Register
	LBA_48 = Upper bytes of LBA High/Mid/Low Registers ]  ATA-8
	LH     = LBA High (was: Cylinder High) Register    ]   LBA
	LM     = LBA Mid (was: Cylinder Low) Register      ] Register
	LL     = LBA Low (was: Sector Number) Register     ]
	DV     = Device (was: Device/Head) Register
	DC     = Device Control Register
	ER     = Error register
	ST     = Status register
Powered_Up_Time is measured from power on, and printed as
DDd+hh:mm:SS.sss where DD=days, hh=hours, mm=minutes,
SS=sec, and sss=millisec. It "wraps" after 49.710 days.

Error 1741 [4] occurred at disk power-on lifetime: 8597 hours (358 days + 5 hours)
  When the command that caused the error occurred, the device was active or idle.

  After command completion occurred, registers were:
  ER -- ST COUNT  LBA_48  LH LM LL DV DC
  -- -- -- == -- == == == -- -- -- -- --
  40 -- 41 00 08 00 00 4b 8c 0c 28 40 00  Error: UNC at LBA = 0x4b8c0c28 = 1267469352

  Commands leading to the command that caused the error were:
  CR FEATR COUNT  LBA_48  LH LM LL DV DC  Powered_Up_Time  Command/Feature_Name
  -- == -- == -- == == == -- -- -- -- --  ---------------  --------------------
  60 00 00 00 08 00 00 4b 8c 0c 28 40 08     00:00:00.490  READ FPDMA QUEUED
  61 00 00 02 10 00 00 57 9e 5f 98 40 08     00:00:00.494  WRITE FPDMA QUEUED
  60 00 00 01 00 00 00 05 ab ed b8 40 08     00:00:00.494  READ FPDMA QUEUED
  61 00 00 00 08 00 00 3c d0 09 30 40 08     00:00:00.494  WRITE FPDMA QUEUED
  61 00 00 00 08 00 00 39 11 3f 00 40 08     00:00:00.494  WRITE FPDMA QUEUED

Error 1740 [3] occurred at disk power-on lifetime: 8597 hours (358 days + 5 hours)
  When the command that caused the error occurred, the device was active or idle.

  After command completion occurred, registers were:
  ER -- ST COUNT  LBA_48  LH LM LL DV DC
  -- -- -- == -- == == == -- -- -- -- --
  40 -- 41 00 08 00 00 4b 8c 0c 28 40 00  Error: UNC at LBA = 0x4b8c0c28 = 1267469352

  Commands leading to the command that caused the error were:
  CR FEATR COUNT  LBA_48  LH LM LL DV DC  Powered_Up_Time  Command/Feature_Name
  -- == -- == -- == == == -- -- -- -- --  ---------------  --------------------
  60 00 00 00 08 00 00 4b 8c 0c 28 40 08     00:00:00.490  READ FPDMA QUEUED
  61 00 00 01 b8 00 00 3a 15 3a 48 40 08     00:00:00.491  WRITE FPDMA QUEUED
  61 00 00 00 18 00 00 38 91 43 00 40 08     00:00:00.491  WRITE FPDMA QUEUED
  61 00 00 00 08 00 00 38 91 42 d8 40 08     00:00:00.491  WRITE FPDMA QUEUED
  61 00 00 00 08 00 00 38 91 42 a8 40 08     00:00:00.491  WRITE FPDMA QUEUED

Error 1739 [2] occurred at disk power-on lifetime: 8597 hours (358 days + 5 hours)
  When the command that caused the error occurred, the device was active or idle.

  After command completion occurred, registers were:
  ER -- ST COUNT  LBA_48  LH LM LL DV DC
  -- -- -- == -- == == == -- -- -- -- --
  40 -- 41 00 90 00 00 4b 8c 0c 28 40 00  Error: UNC at LBA = 0x4b8c0c28 = 1267469352

  Commands leading to the command that caused the error were:
  CR FEATR COUNT  LBA_48  LH LM LL DV DC  Powered_Up_Time  Command/Feature_Name
  -- == -- == -- == == == -- -- -- -- --  ---------------  --------------------
  60 00 00 01 00 00 00 4b 8c 0c b8 40 08     00:00:00.461  READ FPDMA QUEUED
  60 00 00 01 00 00 00 4b 8c 0b b8 40 08     00:00:00.457  READ FPDMA QUEUED
  60 00 00 00 d0 00 00 04 c2 ba 00 40 08     00:00:00.458  READ FPDMA QUEUED
  60 00 00 01 00 00 00 4b 8c 0b b8 40 08     00:00:00.458  READ FPDMA QUEUED
  60 00 00 01 00 00 00 4b 8c 0a b8 40 08     00:00:00.458  READ FPDMA QUEUED

Error 1738 [1] occurred at disk power-on lifetime: 8595 hours (358 days + 3 hours)
  When the command that caused the error occurred, the device was active or idle.

  After command completion occurred, registers were:
  ER -- ST COUNT  LBA_48  LH LM LL DV DC
  -- -- -- == -- == == == -- -- -- -- --
  40 -- 51 00 08 00 00 53 04 1a 38 e0 00  Error: UNC 8 sectors at LBA = 0x53041a38 = 1392777784

  Commands leading to the command that caused the error were:
  CR FEATR COUNT  LBA_48  LH LM LL DV DC  Powered_Up_Time  Command/Feature_Name
  -- == -- == -- == == == -- -- -- -- --  ---------------  --------------------
  25 00 00 00 08 00 00 53 04 1a 38 e0 00     00:00:12.055  READ DMA EXT
  c8 00 00 00 20 00 00 00 bf a2 00 e6 00     00:00:12.055  READ DMA
  35 00 00 00 80 00 00 3e e4 67 00 e0 00     00:00:12.055  WRITE DMA EXT
  35 00 00 00 08 00 00 28 c5 97 60 e0 00     00:00:12.055  WRITE DMA EXT
  47 00 00 00 01 00 00 00 00 00 00 e0 00     00:00:12.055  READ LOG DMA EXT

Error 1737 [0] occurred at disk power-on lifetime: 8595 hours (358 days + 3 hours)
  When the command that caused the error occurred, the device was active or idle.

  After command completion occurred, registers were:
  ER -- ST COUNT  LBA_48  LH LM LL DV DC
  -- -- -- == -- == == == -- -- -- -- --
  40 -- 51 00 08 00 00 53 04 1a 38 e0 00  Error: UNC 8 sectors at LBA = 0x53041a38 = 1392777784

  Commands leading to the command that caused the error were:
  CR FEATR COUNT  LBA_48  LH LM LL DV DC  Powered_Up_Time  Command/Feature_Name
  -- == -- == -- == == == -- -- -- -- --  ---------------  --------------------
  25 00 00 00 08 00 00 53 04 1a 38 e0 00     00:00:12.051  READ DMA EXT
  c8 00 00 00 08 00 00 00 bf a1 f8 e6 00     00:00:12.051  READ DMA
  47 00 00 00 01 00 00 00 00 00 00 e0 00     00:00:12.051  READ LOG DMA EXT
  27 00 00 00 00 00 00 00 00 00 00 e0 00     00:00:12.051  READ NATIVE MAX ADDRESS EXT [OBS-ACS-3]
  ec 00 00 00 00 00 00 00 00 00 00 a0 00     00:00:12.051  IDENTIFY DEVICE

Error 1736 [7] occurred at disk power-on lifetime: 8595 hours (358 days + 3 hours)
  When the command that caused the error occurred, the device was active or idle.

  After command completion occurred, registers were:
  ER -- ST COUNT  LBA_48  LH LM LL DV DC
  -- -- -- == -- == == == -- -- -- -- --
  40 -- 51 00 08 00 00 53 04 1a 38 e0 00  Error: UNC 8 sectors at LBA = 0x53041a38 = 1392777784

  Commands leading to the command that caused the error were:
  CR FEATR COUNT  LBA_48  LH LM LL DV DC  Powered_Up_Time  Command/Feature_Name
  -- == -- == -- == == == -- -- -- -- --  ---------------  --------------------
  25 00 00 00 08 00 00 53 04 1a 38 e0 00     00:00:12.049  READ DMA EXT
  25 00 00 00 08 00 00 53 04 1a 30 e0 00     00:00:12.049  READ DMA EXT
  25 00 00 00 08 00 00 53 04 1a 28 e0 00     00:00:12.049  READ DMA EXT
  25 00 00 00 08 00 00 53 04 1a 20 e0 00     00:00:12.049  READ DMA EXT
  25 00 00 00 08 00 00 53 04 1a 18 e0 00     00:00:12.049  READ DMA EXT

Error 1735 [6] occurred at disk power-on lifetime: 8595 hours (358 days + 3 hours)
  When the command that caused the error occurred, the device was active or idle.

  After command completion occurred, registers were:
  ER -- ST COUNT  LBA_48  LH LM LL DV DC
  -- -- -- == -- == == == -- -- -- -- --
  40 -- 51 00 40 00 00 53 04 1a 38 e0 00  Error: UNC 64 sectors at LBA = 0x53041a38 = 1392777784

  Commands leading to the command that caused the error were:
  CR FEATR COUNT  LBA_48  LH LM LL DV DC  Powered_Up_Time  Command/Feature_Name
  -- == -- == -- == == == -- -- -- -- --  ---------------  --------------------
  25 00 00 01 00 00 00 53 04 19 78 e0 00     00:00:12.046  READ DMA EXT
  25 00 00 01 00 00 00 53 04 18 78 e0 00     00:00:12.046  READ DMA EXT
  25 00 00 01 00 00 00 53 04 17 78 e0 00     00:00:12.046  READ DMA EXT
  25 00 00 01 00 00 00 53 04 16 78 e0 00     00:00:12.046  READ DMA EXT
  25 00 00 01 00 00 00 53 04 15 78 e0 00     00:00:12.046  READ DMA EXT

Error 1734 [5] occurred at disk power-on lifetime: 8593 hours (358 days + 1 hours)
  When the command that caused the error occurred, the device was active or idle.

  After command completion occurred, registers were:
  ER -- ST COUNT  LBA_48  LH LM LL DV DC
  -- -- -- == -- == == == -- -- -- -- --
  40 -- 51 00 08 00 00 4b 7c 11 c8 e0 00  Error: UNC 8 sectors at LBA = 0x4b7c11c8 = 1266422216

  Commands leading to the command that caused the error were:
  CR FEATR COUNT  LBA_48  LH LM LL DV DC  Powered_Up_Time  Command/Feature_Name
  -- == -- == -- == == == -- -- -- -- --  ---------------  --------------------
  25 00 00 00 08 00 00 4b 7c 11 c8 e0 00     00:00:05.277  READ DMA EXT
  35 00 00 00 20 00 00 20 52 2a 90 e0 00     00:00:05.277  WRITE DMA EXT
  25 00 00 00 08 00 00 1f d1 d3 50 e0 00     00:00:05.277  READ DMA EXT
  35 00 00 00 20 00 00 20 14 5d b8 e0 00     00:00:05.277  WRITE DMA EXT
  35 00 00 00 08 00 00 20 52 2a 88 e0 00     00:00:05.277  WRITE DMA EXT

SMART Extended Self-test Log Version: 1 (2 sectors)
Num  Test_Description    Status                  Remaining  LifeTime(hours)  LBA_of_first_error
# 1  Short offline       Completed: read failure       90%      7691         514860986
# 2  Short offline       Completed: read failure       90%      7690         514860986
# 3  Short offline       Completed: read failure       90%      7558         514860986
# 4  Short offline       Completed: read failure       90%      7556         514860986
# 5  Extended offline    Completed: read failure       80%      7556         514860986
# 6  Extended offline    Completed: read failure       80%      7555         514860986
# 7  Extended offline    Aborted by host               90%      7554         -
# 8  Short offline       Completed: read failure       90%      7554         514860986
# 9  Short offline       Completed: read failure       90%      7550         514860986
#10  Short offline       Completed: read failure       90%      7550         514860985
#11  Short offline       Completed: read failure       90%      7550         514860984
#12  Short offline       Completed: read failure       90%      7550         514860983
#13  Short offline       Completed: read failure       90%      7550         514860982
#14  Short offline       Completed: read failure       90%      7550         514860981
#15  Short offline       Completed: read failure       90%      7550         514860980
#16  Short offline       Completed: read failure       90%      7550         514860979
#17  Short offline       Completed: read failure       90%      7550         514860978
#18  Short offline       Completed: read failure       90%      7550         514860977
#19  Short offline       Completed: read failure       90%      7550         514860976
#20  Short offline       Completed: read failure       90%      7550         514860975
#21  Short offline       Completed: read failure       90%      7550         514860974

SMART Selective self-test log data structure revision number 0
Note: revision number not 1 implies that no selective self-test has ever been run
 SPAN  MIN_LBA  MAX_LBA  CURRENT_TEST_STATUS
    1        0        0  Completed_read_failure [90% left] (0-65535)
    2        0        0  Not_testing
    3        0        0  Not_testing
    4        0        0  Not_testing
    5        0        0  Not_testing
Selective self-test flags (0x0):
  After scanning selected spans, do NOT read-scan remainder of disk.
If Selective self-test is pending on power-up, resume after 0 minute delay.

SCT Status Version:                  2
SCT Version (vendor specific):       256 (0x0100)
Device State:                        Active (0)
Current Temperature:                    37 Celsius
Power Cycle Min/Max Temperature:     26/37 Celsius
Lifetime    Min/Max Temperature:     14/55 Celsius
Specified Max Operating Temperature:    80 Celsius
Under/Over Temperature Limit Count:   0/0

SCT Temperature History Version:     2
Temperature Sampling Period:         5 minutes
Temperature Logging Interval:        5 minutes
Min/Max recommended Temperature:     -5/80 Celsius
Min/Max Temperature Limit:           -10/85 Celsius
Temperature History Size (Index):    128 (120)

SCT Error Recovery Control:
           Read: Disabled
          Write: Disabled

Device Statistics (GP/SMART Log 0x04) not supported

Pending Defects log (GP Log 0x0c) not supported

SATA Phy Event Counters (GP Log 0x11)
ID      Size     Value  Description
0x0001  4            0  Command failed due to ICRC error
0x0002  4            0  R_ERR response for data FIS
0x0003  4            0  R_ERR response for device-to-host data FIS
0x0004  4            0  R_ERR response for host-to-device data FIS
0x0005  4            0  R_ERR response for non-data FIS
0x0006  4            0  R_ERR response for device-to-host non-data FIS
0x0007  4            0  R_ERR response for host-to-device non-data FIS
0x0008  4            0  Device-to-host non-data FIS retries
0x0009  4            4  Transition from drive PhyRdy to drive PhyNRdy
0x000a  4            3  Device-to-host register FISes sent due to a COMRESET
0x000b  4            0  CRC errors within host-to-device FIS
0x000d  4            0  Non-CRC errors within host-to-device FIS
0x000f  4            0  R_ERR response for host-to-device data FIS, CRC
0x0010  4            0  R_ERR response for host-to-device data FIS, non-CRC
0x0012  4            0  R_ERR response for host-to-device non-data FIS, CRC
0x0013  4            0  R_ERR response for host-to-device non-data FIS, non-CRC
0x8e00  4            0  Vendor specific
0x8e01  4            0  Vendor specific
0x8e02  4            0  Vendor specific
0x8e03  4            0  Vendor specific
0x8e04  4            0  Vendor specific
0x8e05  4            0  Vendor specific
0x8e06  4        30945  Vendor specific
0x8e07  4       136275  Vendor specific
0x8e08  4           16  Vendor specific
0x8e09  4        39858  Vendor specific
0x8e0a  4       137058  Vendor specific
0x8e0b  4    264041600  Vendor specific
0x8e0c  4       357855  Vendor specific
0x8e0d  4        39858  Vendor specific
0x8e0e  4        35307  Vendor specific
0x8e0f  4     75274752  Vendor specific
0x8e10  4       141228  Vendor specific
0x8e11  4            2  Vendor specific

