smartctl 7.2 2020-12-30 r5155 [x86_64-linux-5.10.74-generic-2rosa2021.1-x86_64] (local build)
Copyright (C) 2002-20, Bruce Allen, Christian Franke, www.smartmontools.org

=== START OF INFORMATION SECTION ===
Model Family:     Seagate Samsung SpinPoint M8 (AF)
Device Model:     ST1000LM024 HN-M101MBB
Serial Number:    --
LU WWN Device Id: 5 0004cf ...
Firmware Version: 2BA30001
User Capacity:    1,000,204,886,016 bytes [1.00 TB]
Sector Sizes:     512 bytes logical, 4096 bytes physical
Rotation Rate:    5400 rpm
Form Factor:      2.5 inches
Device is:        In smartctl database [for details use: -P show]
ATA Version is:   ATA8-ACS T13/1699-D revision 6
SATA Version is:  SATA 3.0, 6.0 Gb/s (current: 1.5 Gb/s)
Local Time is:    Sun Jun  1 14:55:50 2025 MSK
SMART support is: Available - device has SMART capability.
SMART support is: Enabled
AAM feature is:   Disabled
APM feature is:   Disabled
Rd look-ahead is: Enabled
Write cache is:   Enabled
DSN feature is:   Unavailable
ATA Security is:  Disabled, frozen [SEC2]
Wt Cache Reorder: Enabled

=== START OF READ SMART DATA SECTION ===
SMART overall-health self-assessment test result: PASSED

General SMART Values:
Offline data collection status:  (0x80)	Offline data collection activity
					was never started.
					Auto Offline Data Collection: Enabled.
Self-test execution status:      (   0)	The previous self-test routine completed
					without error or no self-test has ever 
					been run.
Total time to complete Offline 
data collection: 		(12720) seconds.
Offline data collection
capabilities: 			 (0x5b) SMART execute Offline immediate.
					Auto Offline data collection on/off support.
					Suspend Offline collection upon new
					command.
					Offline surface scan supported.
					Self-test supported.
					No Conveyance Self-test supported.
					Selective Self-test supported.
SMART capabilities:            (0x0003)	Saves SMART data before entering
					power-saving mode.
					Supports SMART auto save timer.
Error logging capability:        (0x01)	Error logging supported.
					General Purpose Logging supported.
Short self-test routine 
recommended polling time: 	 (   2) minutes.
Extended self-test routine
recommended polling time: 	 ( 212) minutes.
SCT capabilities: 	       (0x003f)	SCT Status supported.
					SCT Error Recovery Control supported.
					SCT Feature Control supported.
					SCT Data Table supported.

SMART Attributes Data Structure revision number: 16
Vendor Specific SMART Attributes with Thresholds:
ID# ATTRIBUTE_NAME          FLAGS    VALUE WORST THRESH FAIL RAW_VALUE
  1 Raw_Read_Error_Rate     POSR-K   100   100   051    -    2
  2 Throughput_Performance  -OS--K   252   252   000    -    0
  3 Spin_Up_Time            PO---K   093   092   025    -    2418
  4 Start_Stop_Count        -O--CK   099   099   000    -    1049
  5 Reallocated_Sector_Ct   PO--CK   252   252   010    -    0
  7 Seek_Error_Rate         -OSR-K   252   252   051    -    0
  8 Seek_Time_Performance   --S--K   252   252   015    -    0
  9 Power_On_Hours          -O--CK   100   100   000    -    3673
 10 Spin_Retry_Count        -O--CK   252   252   051    -    0
 12 Power_Cycle_Count       -O--CK   099   099   000    -    1043
191 G-Sense_Error_Rate      -O---K   100   100   000    -    111
192 Power-Off_Retract_Count -O---K   100   100   000    -    49
194 Temperature_Celsius     -O----   064   054   000    -    30 (Min/Max 12/47)
195 Hardware_ECC_Recovered  -O-RCK   100   100   000    -    0
196 Reallocated_Event_Count -O--CK   252   252   000    -    0
197 Current_Pending_Sector  -O--CK   252   252   000    -    0
198 Offline_Uncorrectable   ----CK   252   252   000    -    0
199 UDMA_CRC_Error_Count    -OS-CK   100   100   000    -    512
200 Multi_Zone_Error_Rate   -O-R-K   100   100   000    -    14039
223 Load_Retry_Count        -O--CK   100   100   000    -    63
225 Load_Cycle_Count        -O--CK   081   081   000    -    193407
                            ||||||_ K auto-keep
                            |||||__ C event count
                            ||||___ R error rate
                            |||____ S speed/performance
                            ||_____ O updated online
                            |______ P prefailure warning

General Purpose Log Directory Version 1
SMART           Log Directory Version 1 [multi-sector log support]
Address    Access  R/W   Size  Description
0x00       GPL,SL  R/O      1  Log Directory
0x01           SL  R/O      1  Summary SMART error log
0x02           SL  R/O      2  Comprehensive SMART error log
0x03       GPL     R/O      2  Ext. Comprehensive SMART error log
0x06           SL  R/O      1  SMART self-test log
0x07       GPL     R/O      2  Extended self-test log
0x08       GPL     R/O      2  Power Conditions log
0x09           SL  R/W      1  Selective self-test log
0x10       GPL     R/O      1  NCQ Command Error log
0x11       GPL     R/O      1  SATA Phy Event Counters log
0x80-0x9f  GPL,SL  R/W     16  Host vendor specific log
0xc0-0xdf  GPL,SL  VS      16  Device vendor specific log
0xe0       GPL,SL  R/W      1  SCT Command/Status
0xe1       GPL,SL  R/W      1  SCT Data Transfer

SMART Extended Comprehensive Error Log Version: 1 (2 sectors)
Device Error Count: 518 (device log contains only the most recent 8 errors)
	CR     = Command Register
	FEATR  = Features Register
	COUNT  = Count (was: Sector Count) Register
	LBA_48 = Upper bytes of LBA High/Mid/Low Registers ]  ATA-8
	LH     = LBA High (was: Cylinder High) Register    ]   LBA
	LM     = LBA Mid (was: Cylinder Low) Register      ] Register
	LL     = LBA Low (was: Sector Number) Register     ]
	DV     = Device (was: Device/Head) Register
	DC     = Device Control Register
	ER     = Error register
	ST     = Status register
Powered_Up_Time is measured from power on, and printed as
DDd+hh:mm:SS.sss where DD=days, hh=hours, mm=minutes,
SS=sec, and sss=millisec. It "wraps" after 49.710 days.

Error 518 [5] occurred at disk power-on lifetime: 3673 hours (153 days + 1 hours)
  When the command that caused the error occurred, the device was active or idle.

  After command completion occurred, registers were:
  ER -- ST COUNT  LBA_48  LH LM LL DV DC
  -- -- -- == -- == == == -- -- -- -- --
  84 -- 51 02 78 00 00 14 e6 d6 c0 40 00  Error: ICRC, ABRT 632 sectors at LBA = 0x14e6d6c0 = 350672576

  Commands leading to the command that caused the error were:
  CR FEATR COUNT  LBA_48  LH LM LL DV DC  Powered_Up_Time  Command/Feature_Name
  -- == -- == -- == == == -- -- -- -- --  ---------------  --------------------
  25 00 00 05 00 00 00 14 e6 d4 38 40 00     00:00:01.677  READ DMA EXT
  25 00 00 00 40 00 00 14 e6 d3 f8 40 00     00:00:01.677  READ DMA EXT
  25 00 00 00 c0 00 00 14 e3 e5 ec 40 00     00:00:01.677  READ DMA EXT
  25 00 00 00 40 00 00 14 e3 e5 ac 40 00     00:00:01.677  READ DMA EXT
  25 00 00 01 00 00 00 14 e3 e6 ac 40 00     00:00:01.677  READ DMA EXT

Error 517 [4] occurred at disk power-on lifetime: 3673 hours (153 days + 1 hours)
  When the command that caused the error occurred, the device was active or idle.

  After command completion occurred, registers were:
  ER -- ST COUNT  LBA_48  LH LM LL DV DC
  -- -- -- == -- == == == -- -- -- -- --
  84 -- 51 00 b8 00 00 14 e6 dd 80 40 00  Error: ICRC, ABRT 184 sectors at LBA = 0x14e6dd80 = 350674304

  Commands leading to the command that caused the error were:
  CR FEATR COUNT  LBA_48  LH LM LL DV DC  Powered_Up_Time  Command/Feature_Name
  -- == -- == -- == == == -- -- -- -- --  ---------------  --------------------
  25 00 00 05 00 00 00 14 e6 d9 38 40 00     00:00:01.674  READ DMA EXT
  25 00 00 05 00 00 00 14 e6 d4 38 40 00     00:00:01.674  READ DMA EXT
  25 00 00 00 40 00 00 14 e6 d3 f8 40 00     00:00:01.674  READ DMA EXT
  25 00 00 00 c0 00 00 14 e3 e5 ec 40 00     00:00:01.674  READ DMA EXT
  25 00 00 00 40 00 00 14 e3 e5 ac 40 00     00:00:01.674  READ DMA EXT

Error 516 [3] occurred at disk power-on lifetime: 3673 hours (153 days + 1 hours)
  When the command that caused the error occurred, the device was active or idle.

  After command completion occurred, registers were:
  ER -- ST COUNT  LBA_48  LH LM LL DV DC
  -- -- -- == -- == == == -- -- -- -- --
  84 -- 51 01 f8 00 00 14 e6 d7 40 40 00  Error: ICRC, ABRT 504 sectors at LBA = 0x14e6d740 = 350672704

  Commands leading to the command that caused the error were:
  CR FEATR COUNT  LBA_48  LH LM LL DV DC  Powered_Up_Time  Command/Feature_Name
  -- == -- == -- == == == -- -- -- -- --  ---------------  --------------------
  25 00 00 05 00 00 00 14 e6 d4 38 40 00     00:00:01.662  READ DMA EXT
  25 00 00 00 40 00 00 14 e6 d3 f8 40 00     00:00:01.662  READ DMA EXT
  25 00 00 00 c0 00 00 14 e3 e5 ec 40 00     00:00:01.662  READ DMA EXT
  25 00 00 00 40 00 00 14 e3 e5 ac 40 00     00:00:01.662  READ DMA EXT
  25 00 00 01 00 00 00 14 e3 e6 ac 40 00     00:00:01.662  READ DMA EXT

Error 515 [2] occurred at disk power-on lifetime: 3673 hours (153 days + 1 hours)
  When the command that caused the error occurred, the device was active or idle.

  After command completion occurred, registers were:
  ER -- ST COUNT  LBA_48  LH LM LL DV DC
  -- -- -- == -- == == == -- -- -- -- --
  84 -- 51 03 b8 00 00 14 e6 ee 80 40 00  Error: ICRC, ABRT 952 sectors at LBA = 0x14e6ee80 = 350678656

  Commands leading to the command that caused the error were:
  CR FEATR COUNT  LBA_48  LH LM LL DV DC  Powered_Up_Time  Command/Feature_Name
  -- == -- == -- == == == -- -- -- -- --  ---------------  --------------------
  25 00 00 05 00 00 00 14 e6 ed 38 40 00     00:00:01.655  READ DMA EXT
  25 00 00 05 00 00 00 14 e6 e8 38 40 00     00:00:01.655  READ DMA EXT
  25 00 00 05 00 00 00 14 e6 e3 38 40 00     00:00:01.655  READ DMA EXT
  25 00 00 05 00 00 00 14 e6 de 38 40 00     00:00:01.654  READ DMA EXT
  25 00 00 05 00 00 00 14 e6 d9 38 40 00     00:00:01.654  READ DMA EXT

Error 514 [1] occurred at disk power-on lifetime: 3673 hours (153 days + 1 hours)
  When the command that caused the error occurred, the device was active or idle.

  After command completion occurred, registers were:
  ER -- ST COUNT  LBA_48  LH LM LL DV DC
  -- -- -- == -- == == == -- -- -- -- --
  84 -- 51 01 b8 00 00 14 e6 dc 80 40 00  Error: ICRC, ABRT 440 sectors at LBA = 0x14e6dc80 = 350674048

  Commands leading to the command that caused the error were:
  CR FEATR COUNT  LBA_48  LH LM LL DV DC  Powered_Up_Time  Command/Feature_Name
  -- == -- == -- == == == -- -- -- -- --  ---------------  --------------------
  25 00 00 05 00 00 00 14 e6 d9 38 40 00     00:00:01.636  READ DMA EXT
  25 00 00 05 00 00 00 14 e6 d4 38 40 00     00:00:01.636  READ DMA EXT
  25 00 00 00 40 00 00 14 e6 d3 f8 40 00     00:00:01.636  READ DMA EXT
  25 00 00 00 c0 00 00 14 e3 e5 ec 40 00     00:00:01.636  READ DMA EXT
  25 00 00 00 40 00 00 14 e3 e5 ac 40 00     00:00:01.636  READ DMA EXT

Error 513 [0] occurred at disk power-on lifetime: 3673 hours (153 days + 1 hours)
  When the command that caused the error occurred, the device was active or idle.

  After command completion occurred, registers were:
  ER -- ST COUNT  LBA_48  LH LM LL DV DC
  -- -- -- == -- == == == -- -- -- -- --
  84 -- 51 00 78 00 00 14 dd 9f c0 40 00  Error: ICRC, ABRT 120 sectors at LBA = 0x14dd9fc0 = 350068672

  Commands leading to the command that caused the error were:
  CR FEATR COUNT  LBA_48  LH LM LL DV DC  Powered_Up_Time  Command/Feature_Name
  -- == -- == -- == == == -- -- -- -- --  ---------------  --------------------
  25 00 00 05 00 00 00 14 dd 9b 38 40 00     00:00:01.606  READ DMA EXT
  25 00 00 00 40 00 00 14 dd 9a f8 40 00     00:00:01.606  READ DMA EXT
  25 00 00 00 40 00 00 14 dd ad 38 40 00     00:00:01.606  READ DMA EXT
  25 00 00 00 40 00 00 14 de 3d 38 40 00     00:00:01.606  READ DMA EXT
  25 00 00 00 40 00 00 14 de 2d 78 40 00     00:00:01.606  READ DMA EXT

Error 512 [7] occurred at disk power-on lifetime: 3311 hours (137 days + 23 hours)
  When the command that caused the error occurred, the device was active or idle.

  After command completion occurred, registers were:
  ER -- ST COUNT  LBA_48  LH LM LL DV DC
  -- -- -- == -- == == == -- -- -- -- --
  84 -- 41 00 60 00 00 08 5f 03 a0 40 00  Error: ICRC, ABRT at LBA = 0x085f03a0 = 140444576

  Commands leading to the command that caused the error were:
  CR FEATR COUNT  LBA_48  LH LM LL DV DC  Powered_Up_Time  Command/Feature_Name
  -- == -- == -- == == == -- -- -- -- --  ---------------  --------------------
  60 00 00 00 60 00 00 08 5f 03 b0 40 00     00:00:06.750  READ FPDMA QUEUED
  60 00 00 00 88 00 00 08 5f 04 18 40 00     00:00:06.763  READ FPDMA QUEUED
  60 00 00 00 70 00 00 08 5f 03 a0 40 00     00:00:06.763  READ FPDMA QUEUED
  60 00 00 00 e8 00 00 06 91 3b b8 40 00     00:00:06.763  READ FPDMA QUEUED
  60 00 00 00 10 00 00 06 91 3b a0 40 00     00:00:06.763  READ FPDMA QUEUED

Error 511 [6] occurred at disk power-on lifetime: 3310 hours (137 days + 22 hours)
  When the command that caused the error occurred, the device was active or idle.

  After command completion occurred, registers were:
  ER -- ST COUNT  LBA_48  LH LM LL DV DC
  -- -- -- == -- == == == -- -- -- -- --
  84 -- 41 00 08 00 00 01 dc 47 20 40 00  Error: ICRC, ABRT at LBA = 0x01dc4720 = 31213344

  Commands leading to the command that caused the error were:
  CR FEATR COUNT  LBA_48  LH LM LL DV DC  Powered_Up_Time  Command/Feature_Name
  -- == -- == -- == == == -- -- -- -- --  ---------------  --------------------
  60 00 00 00 08 00 00 01 dc 47 20 40 00     00:00:04.483  READ FPDMA QUEUED
  2f 00 00 00 01 00 00 00 00 00 10 e0 00     00:00:04.484  READ LOG EXT
  60 00 00 00 08 00 00 01 dc 47 20 40 00     00:00:04.484  READ FPDMA QUEUED
  60 00 00 00 08 00 00 00 3e f4 68 40 00     00:00:04.484  READ FPDMA QUEUED
  60 00 00 00 08 00 00 06 6a fc b0 40 00     00:00:04.484  READ FPDMA QUEUED

SMART Extended Self-test Log Version: 1 (2 sectors)
No self-tests have been logged.  [To run self-tests, use: smartctl -t]

SMART Selective self-test log data structure revision number 0
Note: revision number not 1 implies that no selective self-test has ever been run
 SPAN  MIN_LBA  MAX_LBA  CURRENT_TEST_STATUS
    1        0        0  Completed [00% left] (0-65535)
    2        0        0  Not_testing
    3        0        0  Not_testing
    4        0        0  Not_testing
    5        0        0  Not_testing
Selective self-test flags (0x0):
  After scanning selected spans, do NOT read-scan remainder of disk.
If Selective self-test is pending on power-up, resume after 0 minute delay.

SCT Status Version:                  2
SCT Version (vendor specific):       256 (0x0100)
Device State:                        Active (0)
Current Temperature:                    30 Celsius
Power Cycle Min/Max Temperature:     28/31 Celsius
Lifetime    Min/Max Temperature:     12/46 Celsius
Specified Max Operating Temperature:    80 Celsius
Under/Over Temperature Limit Count:   0/0

SCT Temperature History Version:     2
Temperature Sampling Period:         5 minutes
Temperature Logging Interval:        5 minutes
Min/Max recommended Temperature:     -5/80 Celsius
Min/Max Temperature Limit:           -10/85 Celsius
Temperature History Size (Index):    128 (118)

SCT Error Recovery Control:
           Read: Disabled
          Write: Disabled

Device Statistics (GP/SMART Log 0x04) not supported

Pending Defects log (GP Log 0x0c) not supported

SATA Phy Event Counters (GP Log 0x11)
ID      Size     Value  Description
0x0001  4            0  Command failed due to ICRC error
0x0002  4            8  R_ERR response for data FIS
0x0003  4            0  R_ERR response for device-to-host data FIS
0x0004  4            8  R_ERR response for host-to-device data FIS
0x0005  4           30  R_ERR response for non-data FIS
0x0006  4            0  R_ERR response for device-to-host non-data FIS
0x0007  4           30  R_ERR response for host-to-device non-data FIS
0x0008  4            0  Device-to-host non-data FIS retries
0x0009  4           26  Transition from drive PhyRdy to drive PhyNRdy
0x000a  4           26  Device-to-host register FISes sent due to a COMRESET
0x000b  4           31  CRC errors within host-to-device FIS
0x000d  4            7  Non-CRC errors within host-to-device FIS
0x000f  4            5  R_ERR response for host-to-device data FIS, CRC
0x0010  4            3  R_ERR response for host-to-device data FIS, non-CRC
0x0012  4           26  R_ERR response for host-to-device non-data FIS, CRC
0x0013  4            4  R_ERR response for host-to-device non-data FIS, non-CRC
0x8e00  4            0  Vendor specific
0x8e01  4            0  Vendor specific
0x8e02  4           38  Vendor specific
0x8e03  4           28  Vendor specific
0x8e04  4            5  Vendor specific
0x8e05  4            9  Vendor specific
0x8e06  4        74302  Vendor specific
0x8e07  4       682429  Vendor specific
0x8e08  4          119  Vendor specific
0x8e09  4      1297346  Vendor specific
0x8e0a  4      1727399  Vendor specific
0x8e0b  4   1347953581  Vendor specific
0x8e0c  4      1580425  Vendor specific
0x8e0d  4      1297338  Vendor specific
0x8e0e  4       150372  Vendor specific
0x8e0f  4     78383616  Vendor specific
0x8e10  4       601615  Vendor specific
0x8e11  4           38  Vendor specific



