smartctl 7.4 2023-08-01 r5530 [x86_64-linux-6.6.7-203.fsync.fc38.x86_64] (local build)
Copyright (C) 2002-23, Bruce Allen, Christian Franke, www.smartmontools.org

=== START OF INFORMATION SECTION ===
Model Family:     Seagate Samsung SpinPoint M8 (AF)
Device Model:     ST1000LM024 HN-M101MBB
Serial Number:    --
LU WWN Device Id: 5 0004cf ...
Firmware Version: 2BA30001
User Capacity:    1,000,204,886,016 bytes [1.00 TB]
Sector Sizes:     512 bytes logical, 4096 bytes physical
Rotation Rate:    5400 rpm
Form Factor:      2.5 inches
Device is:        In smartctl database 7.3/5528
ATA Version is:   ATA8-ACS T13/1699-D revision 6
SATA Version is:  SATA 3.0, 6.0 Gb/s (current: 6.0 Gb/s)
Local Time is:    Fri Dec 22 13:14:25 2023 CET
SMART support is: Available - device has SMART capability.
SMART support is: Enabled
AAM feature is:   Disabled
APM level is:     128 (minimum power consumption without standby)
Rd look-ahead is: Enabled
Write cache is:   Enabled
DSN feature is:   Unavailable
ATA Security is:  Disabled, frozen [SEC2]
Wt Cache Reorder: Enabled

=== START OF READ SMART DATA SECTION ===
SMART overall-health self-assessment test result: PASSED

General SMART Values:
Offline data collection status:  (0x00)	Offline data collection activity
					was never started.
					Auto Offline Data Collection: Disabled.
Self-test execution status:      ( 121)	The previous self-test completed having
					the read element of the test failed.
Total time to complete Offline 
data collection: 		(13380) seconds.
Offline data collection
capabilities: 			 (0x5b) SMART execute Offline immediate.
					Auto Offline data collection on/off support.
					Suspend Offline collection upon new
					command.
					Offline surface scan supported.
					Self-test supported.
					No Conveyance Self-test supported.
					Selective Self-test supported.
SMART capabilities:            (0x0003)	Saves SMART data before entering
					power-saving mode.
					Supports SMART auto save timer.
Error logging capability:        (0x01)	Error logging supported.
					General Purpose Logging supported.
Short self-test routine 
recommended polling time: 	 (   2) minutes.
Extended self-test routine
recommended polling time: 	 ( 223) minutes.
SCT capabilities: 	       (0x003f)	SCT Status supported.
					SCT Error Recovery Control supported.
					SCT Feature Control supported.
					SCT Data Table supported.

SMART Attributes Data Structure revision number: 16
Vendor Specific SMART Attributes with Thresholds:
ID# ATTRIBUTE_NAME          FLAGS    VALUE WORST THRESH FAIL RAW_VALUE
  1 Raw_Read_Error_Rate     POSR-K   100   100   051    -    818
  2 Throughput_Performance  -OS--K   252   252   000    -    0
  3 Spin_Up_Time            PO---K   092   089   025    -    2529
  4 Start_Stop_Count        -O--CK   097   097   000    -    3176
  5 Reallocated_Sector_Ct   PO--CK   252   252   010    -    0
  7 Seek_Error_Rate         -OSR-K   252   252   051    -    0
  8 Seek_Time_Performance   --S--K   252   252   015    -    0
  9 Power_On_Hours          -O--CK   100   100   000    -    15480
 10 Spin_Retry_Count        -O--CK   252   252   051    -    0
 11 Calibration_Retry_Count -O--CK   100   100   000    -    283
 12 Power_Cycle_Count       -O--CK   097   097   000    -    3196
191 G-Sense_Error_Rate      -O---K   100   100   000    -    1127
192 Power-Off_Retract_Count -O---K   252   252   000    -    0
194 Temperature_Celsius     -O----   064   046   000    -    31 (Min/Max 13/54)
195 Hardware_ECC_Recovered  -O-RCK   100   100   000    -    0
196 Reallocated_Event_Count -O--CK   252   252   000    -    0
197 Current_Pending_Sector  -O--CK   252   100   000    -    0
198 Offline_Uncorrectable   ----CK   252   252   000    -    0
199 UDMA_CRC_Error_Count    -OS-CK   100   100   000    -    151
200 Multi_Zone_Error_Rate   -O-R-K   100   100   000    -    12171
223 Load_Retry_Count        -O--CK   100   100   000    -    283
225 Load_Cycle_Count        -O--CK   075   075   000    -    261640
                            ||||||_ K auto-keep
                            |||||__ C event count
                            ||||___ R error rate
                            |||____ S speed/performance
                            ||_____ O updated online
                            |______ P prefailure warning

General Purpose Log Directory Version 1
SMART           Log Directory Version 1 [multi-sector log support]
Address    Access  R/W   Size  Description
0x00       GPL,SL  R/O      1  Log Directory
0x01           SL  R/O      1  Summary SMART error log
0x02           SL  R/O      2  Comprehensive SMART error log
0x03       GPL     R/O      2  Ext. Comprehensive SMART error log
0x06           SL  R/O      1  SMART self-test log
0x07       GPL     R/O      2  Extended self-test log
0x08       GPL     R/O      2  Power Conditions log
0x09           SL  R/W      1  Selective self-test log
0x10       GPL     R/O      1  NCQ Command Error log
0x11       GPL     R/O      1  SATA Phy Event Counters log
0x80-0x9f  GPL,SL  R/W     16  Host vendor specific log
0xc0-0xdf  GPL,SL  VS      16  Device vendor specific log
0xe0       GPL,SL  R/W      1  SCT Command/Status
0xe1       GPL,SL  R/W      1  SCT Data Transfer

SMART Extended Comprehensive Error Log Version: 1 (2 sectors)
Device Error Count: 1974 (device log contains only the most recent 8 errors)
	CR     = Command Register
	FEATR  = Features Register
	COUNT  = Count (was: Sector Count) Register
	LBA_48 = Upper bytes of LBA High/Mid/Low Registers ]  ATA-8
	LH     = LBA High (was: Cylinder High) Register    ]   LBA
	LM     = LBA Mid (was: Cylinder Low) Register      ] Register
	LL     = LBA Low (was: Sector Number) Register     ]
	DV     = Device (was: Device/Head) Register
	DC     = Device Control Register
	ER     = Error register
	ST     = Status register
Powered_Up_Time is measured from power on, and printed as
DDd+hh:mm:SS.sss where DD=days, hh=hours, mm=minutes,
SS=sec, and sss=millisec. It "wraps" after 49.710 days.

Error 1974 [5] occurred at disk power-on lifetime: 6999 hours (291 days + 15 hours)
  When the command that caused the error occurred, the device was active or idle.

  After command completion occurred, registers were:
  ER -- ST COUNT  LBA_48  LH LM LL DV DC
  -- -- -- == -- == == == -- -- -- -- --
  40 -- 51 00 00 00 00 00 00 00 00 40 00  Error: 

  Commands leading to the command that caused the error were:
  CR FEATR COUNT  LBA_48  LH LM LL DV DC  Powered_Up_Time  Command/Feature_Name
  -- == -- == -- == == == -- -- -- -- --  ---------------  --------------------
  00 00 00 00 00 00 00 00 00 00 00 00 00     00:00:00.359  NOP [Abort queued commands]
  61 00 00 00 20 00 00 74 6c 7b c8 40 00     00:00:00.456  WRITE FPDMA QUEUED
  61 00 00 00 20 00 00 74 6c 7b a8 40 00     00:00:00.456  WRITE FPDMA QUEUED
  61 00 00 00 20 00 00 74 6c 7b 88 40 00     00:00:00.456  WRITE FPDMA QUEUED
  61 00 00 00 20 00 00 74 6c 7b 68 40 00     00:00:00.456  WRITE FPDMA QUEUED

Error 1973 [4] occurred at disk power-on lifetime: 6999 hours (291 days + 15 hours)
  When the command that caused the error occurred, the device was active or idle.

  After command completion occurred, registers were:
  ER -- ST COUNT  LBA_48  LH LM LL DV DC
  -- -- -- == -- == == == -- -- -- -- --
  40 -- 51 00 00 00 00 00 c2 4f 00 00 00  Error: 

  Commands leading to the command that caused the error were:
  CR FEATR COUNT  LBA_48  LH LM LL DV DC  Powered_Up_Time  Command/Feature_Name
  -- == -- == -- == == == -- -- -- -- --  ---------------  --------------------
  00 00 da 00 00 00 00 00 00 00 00 00 00     00:00:00.316  NOP [Reserved subcommand] [OBS-ACS-2]
  61 00 00 00 20 00 00 74 6c 77 08 40 00     00:00:00.424  WRITE FPDMA QUEUED
  61 00 00 00 20 00 00 74 6c 76 e8 40 00     00:00:00.424  WRITE FPDMA QUEUED
  61 00 00 00 20 00 00 74 6c 76 c8 40 00     00:00:00.424  WRITE FPDMA QUEUED
  61 00 00 00 20 00 00 74 6c 76 a8 40 00     00:00:00.424  WRITE FPDMA QUEUED

Error 1972 [3] occurred at disk power-on lifetime: 6999 hours (291 days + 15 hours)
  When the command that caused the error occurred, the device was active or idle.

  After command completion occurred, registers were:
  ER -- ST COUNT  LBA_48  LH LM LL DV DC
  -- -- -- == -- == == == -- -- -- -- --
  40 -- 51 00 00 00 00 00 00 00 00 40 00  Error: 

  Commands leading to the command that caused the error were:
  CR FEATR COUNT  LBA_48  LH LM LL DV DC  Powered_Up_Time  Command/Feature_Name
  -- == -- == -- == == == -- -- -- -- --  ---------------  --------------------
  00 00 00 00 00 00 00 00 00 00 00 00 00     00:00:00.296  NOP [Abort queued commands]
  61 00 00 00 20 00 00 74 6c 75 68 40 00     00:00:00.392  WRITE FPDMA QUEUED
  61 00 00 00 20 00 00 74 6c 75 48 40 00     00:00:00.392  WRITE FPDMA QUEUED
  61 00 00 00 20 00 00 74 6c 75 28 40 00     00:00:00.392  WRITE FPDMA QUEUED
  61 00 00 00 20 00 00 74 6c 75 08 40 00     00:00:00.392  WRITE FPDMA QUEUED

Error 1971 [2] occurred at disk power-on lifetime: 6999 hours (291 days + 15 hours)
  When the command that caused the error occurred, the device was active or idle.

  After command completion occurred, registers were:
  ER -- ST COUNT  LBA_48  LH LM LL DV DC
  -- -- -- == -- == == == -- -- -- -- --
  40 -- 51 00 00 00 00 00 00 00 00 40 00  Error: 

  Commands leading to the command that caused the error were:
  CR FEATR COUNT  LBA_48  LH LM LL DV DC  Powered_Up_Time  Command/Feature_Name
  -- == -- == -- == == == -- -- -- -- --  ---------------  --------------------
  00 00 00 00 00 00 00 00 00 00 00 00 00     00:00:00.209  NOP [Abort queued commands]
  61 00 00 00 20 00 00 74 6c 70 08 40 00     00:00:00.359  WRITE FPDMA QUEUED
  61 00 00 00 20 00 00 74 6c 6f e8 40 00     00:00:00.359  WRITE FPDMA QUEUED
  61 00 00 00 20 00 00 74 6c 6f c8 40 00     00:00:00.359  WRITE FPDMA QUEUED
  61 00 00 00 20 00 00 74 6c 6f a8 40 00     00:00:00.359  WRITE FPDMA QUEUED

Error 1970 [1] occurred at disk power-on lifetime: 6999 hours (291 days + 15 hours)
  When the command that caused the error occurred, the device was active or idle.

  After command completion occurred, registers were:
  ER -- ST COUNT  LBA_48  LH LM LL DV DC
  -- -- -- == -- == == == -- -- -- -- --
  40 -- 51 00 00 00 00 00 00 00 00 00 00  Error: 

  Commands leading to the command that caused the error were:
  CR FEATR COUNT  LBA_48  LH LM LL DV DC  Powered_Up_Time  Command/Feature_Name
  -- == -- == -- == == == -- -- -- -- --  ---------------  --------------------
  00 00 02 00 00 00 00 00 00 00 00 00 00     00:00:00.112  NOP [Reserved subcommand] [OBS-ACS-2]
  61 00 00 00 08 00 00 00 07 28 d8 40 00     00:00:00.264  WRITE FPDMA QUEUED
  ea 00 00 00 00 00 00 00 00 00 00 40 00     00:00:00.264  FLUSH CACHE EXT
  b0 00 da 00 00 00 00 00 c2 4f 00 00 00     00:00:00.252  SMART RETURN STATUS
  b0 00 d2 00 f1 00 00 00 c2 4f 00 00 00     00:00:00.252  SMART ENABLE/DISABLE ATTRIBUTE AUTOSAVE

Error 1969 [0] occurred at disk power-on lifetime: 6999 hours (291 days + 15 hours)
  When the command that caused the error occurred, the device was active or idle.

  After command completion occurred, registers were:
  ER -- ST COUNT  LBA_48  LH LM LL DV DC
  -- -- -- == -- == == == -- -- -- -- --
  84 -- 41 00 38 00 00 00 06 40 80 40 00  Error: ICRC, ABRT at LBA = 0x00064080 = 409728

  Commands leading to the command that caused the error were:
  CR FEATR COUNT  LBA_48  LH LM LL DV DC  Powered_Up_Time  Command/Feature_Name
  -- == -- == -- == == == -- -- -- -- --  ---------------  --------------------
  60 00 00 00 08 00 00 00 06 40 b0 40 00     00:00:00.110  READ FPDMA QUEUED
  60 00 00 00 08 00 00 00 06 40 b0 40 00     00:00:00.116  READ FPDMA QUEUED
  60 00 00 00 08 00 00 00 06 40 a8 40 00     00:00:00.116  READ FPDMA QUEUED
  60 00 00 00 08 00 00 00 06 40 a0 40 00     00:00:00.116  READ FPDMA QUEUED
  60 00 00 00 08 00 00 00 06 40 98 40 00     00:00:00.116  READ FPDMA QUEUED

Error 1968 [7] occurred at disk power-on lifetime: 6999 hours (291 days + 15 hours)
  When the command that caused the error occurred, the device was active or idle.

  After command completion occurred, registers were:
  ER -- ST COUNT  LBA_48  LH LM LL DV DC
  -- -- -- == -- == == == -- -- -- -- --
  84 -- 41 00 10 00 00 00 3c 48 e8 40 00  Error: ICRC, ABRT at LBA = 0x003c48e8 = 3950824

  Commands leading to the command that caused the error were:
  CR FEATR COUNT  LBA_48  LH LM LL DV DC  Powered_Up_Time  Command/Feature_Name
  -- == -- == -- == == == -- -- -- -- --  ---------------  --------------------
  60 00 00 00 10 00 00 00 3c 48 e8 40 00     00:00:00.110  READ FPDMA QUEUED
  60 00 00 00 10 00 00 00 3c 48 e8 40 00     00:00:00.115  READ FPDMA QUEUED
  60 00 00 00 08 00 00 74 6c 6d 88 40 00     00:00:00.115  READ FPDMA QUEUED
  60 00 00 00 01 00 00 00 3c 48 d8 40 00     00:00:00.115  READ FPDMA QUEUED
  60 00 00 00 08 00 00 74 6d 0d a8 40 00     00:00:00.115  READ FPDMA QUEUED

Error 1967 [6] occurred at disk power-on lifetime: 6999 hours (291 days + 15 hours)
  When the command that caused the error occurred, the device was active or idle.

  After command completion occurred, registers were:
  ER -- ST COUNT  LBA_48  LH LM LL DV DC
  -- -- -- == -- == == == -- -- -- -- --
  84 -- 41 00 01 00 00 74 6c 6d 8a 40 00  Error: ICRC, ABRT at LBA = 0x746c6d8a = 1953262986

  Commands leading to the command that caused the error were:
  CR FEATR COUNT  LBA_48  LH LM LL DV DC  Powered_Up_Time  Command/Feature_Name
  -- == -- == -- == == == -- -- -- -- --  ---------------  --------------------
  60 00 00 00 01 00 00 74 6c 6d 8a 40 00     00:00:00.110  READ FPDMA QUEUED
  60 00 00 00 01 00 00 74 6c 6d 8a 40 00     00:00:00.113  READ FPDMA QUEUED
  60 00 00 00 08 00 00 74 6c 6d 20 40 00     00:00:00.112  READ FPDMA QUEUED
  60 00 00 00 08 00 00 74 6c 6d 80 40 00     00:00:00.112  READ FPDMA QUEUED
  60 00 00 00 01 00 00 00 00 00 01 40 00     00:00:00.112  READ FPDMA QUEUED

SMART Extended Self-test Log Version: 1 (2 sectors)
Num  Test_Description    Status                  Remaining  LifeTime(hours)  LBA_of_first_error
# 1  Short offline       Completed: read failure       90%      6999         343023064
# 2  Offline             Completed without error       00%         0         -

SMART Selective self-test log data structure revision number 0
Note: revision number not 1 implies that no selective self-test has ever been run
 SPAN  MIN_LBA  MAX_LBA  CURRENT_TEST_STATUS
    1        0        0  Completed_read_failure [90% left] (0-65535)
    2        0        0  Not_testing
    3        0        0  Not_testing
    4        0        0  Not_testing
    5        0        0  Not_testing
Selective self-test flags (0x0):
  After scanning selected spans, do NOT read-scan remainder of disk.
If Selective self-test is pending on power-up, resume after 0 minute delay.

SCT Status Version:                  2
SCT Version (vendor specific):       256 (0x0100)
Device State:                        Active (0)
Current Temperature:                    31 Celsius
Power Cycle Min/Max Temperature:     22/32 Celsius
Lifetime    Min/Max Temperature:     14/54 Celsius
Specified Max Operating Temperature:    80 Celsius
Under/Over Temperature Limit Count:   0/0

SCT Temperature History Version:     2
Temperature Sampling Period:         5 minutes
Temperature Logging Interval:        5 minutes
Min/Max recommended Temperature:     -5/80 Celsius
Min/Max Temperature Limit:           -10/85 Celsius
Temperature History Size (Index):    128 (108)

SCT Error Recovery Control:
           Read: Disabled
          Write: Disabled

Device Statistics (GP/SMART Log 0x04) not supported

Pending Defects log (GP Log 0x0c) not supported

SATA Phy Event Counters (GP Log 0x11)
ID      Size     Value  Description
0x0001  4            0  Command failed due to ICRC error
0x0002  4            0  R_ERR response for data FIS
0x0003  4            0  R_ERR response for device-to-host data FIS
0x0004  4            0  R_ERR response for host-to-device data FIS
0x0005  4            0  R_ERR response for non-data FIS
0x0006  4            0  R_ERR response for device-to-host non-data FIS
0x0007  4            0  R_ERR response for host-to-device non-data FIS
0x0008  4            0  Device-to-host non-data FIS retries
0x0009  4            2  Transition from drive PhyRdy to drive PhyNRdy
0x000a  4            1  Device-to-host register FISes sent due to a COMRESET
0x000b  4            0  CRC errors within host-to-device FIS
0x000d  4            0  Non-CRC errors within host-to-device FIS
0x000f  4            0  R_ERR response for host-to-device data FIS, CRC
0x0010  4            0  R_ERR response for host-to-device data FIS, non-CRC
0x0012  4            0  R_ERR response for host-to-device non-data FIS, CRC
0x0013  4            0  R_ERR response for host-to-device non-data FIS, non-CRC
0x8e00  4            0  Vendor specific
0x8e01  4            0  Vendor specific
0x8e02  4            0  Vendor specific
0x8e03  4            0  Vendor specific
0x8e04  4            0  Vendor specific
0x8e05  4            0  Vendor specific
0x8e06  4            0  Vendor specific
0x8e07  4            0  Vendor specific
0x8e08  4            0  Vendor specific
0x8e09  4            0  Vendor specific
0x8e0a  4            0  Vendor specific
0x8e0b  4            0  Vendor specific
0x8e0c  4            0  Vendor specific
0x8e0d  4            0  Vendor specific
0x8e0e  4            0  Vendor specific
0x8e0f  4            0  Vendor specific
0x8e10  4            0  Vendor specific
0x8e11  4            0  Vendor specific



