smartctl 7.2 2020-12-30 r5155 [x86_64-linux-5.16.7-desktop-1omv4003] (OpenMandriva Lx 7.2-2)
Copyright (C) 2002-20, Bruce Allen, Christian Franke, www.smartmontools.org

=== START OF INFORMATION SECTION ===
Model Family:     Toshiba 2.5" HDD MK..75GSX
Device Model:     TOSHIBA MK3275GSX
Serial Number:    --
LU WWN Device Id: 5 000039 ...
Firmware Version: GT001M
User Capacity:    320,072,933,376 bytes [320 GB]
Sector Size:      512 bytes logical/physical
Rotation Rate:    5400 rpm
Form Factor:      2.5 inches
Device is:        In smartctl database [for details use: -P show]
ATA Version is:   ATA8-ACS (minor revision not indicated)
SATA Version is:  SATA 2.6, 3.0 Gb/s (current: 3.0 Gb/s)
Local Time is:    Tue Nov  1 15:46:51 2022 GMT
SMART support is: Available - device has SMART capability.
SMART support is: Enabled
AAM feature is:   Unavailable
APM level is:     128 (minimum power consumption without standby)
Rd look-ahead is: Enabled
Write cache is:   Enabled
DSN feature is:   Unavailable
ATA Security is:  Disabled, frozen [SEC2]
Wt Cache Reorder: Enabled

=== START OF READ SMART DATA SECTION ===
SMART overall-health self-assessment test result: PASSED

General SMART Values:
Offline data collection status:  (0x82)	Offline data collection activity
					was completed without error.
					Auto Offline Data Collection: Enabled.
Self-test execution status:      (   0)	The previous self-test routine completed
					without error or no self-test has ever 
					been run.
Total time to complete Offline 
data collection: 		(  120) seconds.
Offline data collection
capabilities: 			 (0x5b) SMART execute Offline immediate.
					Auto Offline data collection on/off support.
					Suspend Offline collection upon new
					command.
					Offline surface scan supported.
					Self-test supported.
					No Conveyance Self-test supported.
					Selective Self-test supported.
SMART capabilities:            (0x0003)	Saves SMART data before entering
					power-saving mode.
					Supports SMART auto save timer.
Error logging capability:        (0x01)	Error logging supported.
					General Purpose Logging supported.
Short self-test routine 
recommended polling time: 	 (   2) minutes.
Extended self-test routine
recommended polling time: 	 ( 105) minutes.
SCT capabilities: 	       (0x003d)	SCT Status supported.
					SCT Error Recovery Control supported.
					SCT Feature Control supported.
					SCT Data Table supported.

SMART Attributes Data Structure revision number: 16
Vendor Specific SMART Attributes with Thresholds:
ID# ATTRIBUTE_NAME          FLAGS    VALUE WORST THRESH FAIL RAW_VALUE
  1 Raw_Read_Error_Rate     PO-R--   100   100   050    -    0
  2 Throughput_Performance  P-S---   100   100   050    -    0
  3 Spin_Up_Time            POS--K   100   100   001    -    1118
  4 Start_Stop_Count        -O--CK   100   100   000    -    5393
  5 Reallocated_Sector_Ct   PO--CK   100   100   050    -    0
  7 Seek_Error_Rate         PO-R--   100   100   050    -    0
  8 Seek_Time_Performance   P-S---   100   100   050    -    0
  9 Power_On_Hours          -O--CK   051   051   000    -    19675
 10 Spin_Retry_Count        PO--CK   207   100   030    -    0
 12 Power_Cycle_Count       -O--CK   100   100   000    -    5223
191 G-Sense_Error_Rate      -O--CK   100   100   000    -    2265
192 Power-Off_Retract_Count -O--CK   100   100   000    -    285
193 Load_Cycle_Count        -O--CK   078   078   000    -    221993
194 Temperature_Celsius     -O---K   100   100   000    -    34 (Min/Max 8/59)
196 Reallocated_Event_Count -O--CK   100   100   000    -    0
197 Current_Pending_Sector  -O--CK   100   100   000    -    0
198 Offline_Uncorrectable   ----CK   100   100   000    -    0
199 UDMA_CRC_Error_Count    -O--CK   200   200   000    -    0
220 Disk_Shift              -O----   100   100   000    -    65
222 Loaded_Hours            -O--CK   067   067   000    -    13212
223 Load_Retry_Count        -O--CK   100   100   000    -    0
224 Load_Friction           -O---K   100   100   000    -    0
226 Load-in_Time            -OS--K   100   100   000    -    355
240 Head_Flying_Hours       P-----   100   100   001    -    0
                            ||||||_ K auto-keep
                            |||||__ C event count
                            ||||___ R error rate
                            |||____ S speed/performance
                            ||_____ O updated online
                            |______ P prefailure warning

General Purpose Log Directory Version 1
SMART           Log Directory Version 1 [multi-sector log support]
Address    Access  R/W   Size  Description
0x00       GPL,SL  R/O      1  Log Directory
0x01           SL  R/O      1  Summary SMART error log
0x02           SL  R/O     51  Comprehensive SMART error log
0x03       GPL     R/O     64  Ext. Comprehensive SMART error log
0x06           SL  R/O      1  SMART self-test log
0x07       GPL     R/O      1  Extended self-test log
0x09           SL  R/W      1  Selective self-test log
0x10       GPL     R/O      1  NCQ Command Error log
0x11       GPL     R/O      1  SATA Phy Event Counters log
0x80-0x9f  GPL,SL  R/W     16  Host vendor specific log
0xe0       GPL,SL  R/W      1  SCT Command/Status
0xe1       GPL,SL  R/W      1  SCT Data Transfer

SMART Extended Comprehensive Error Log Version: 1 (64 sectors)
Device Error Count: 65535 (device log contains only the most recent 256 errors)
	CR     = Command Register
	FEATR  = Features Register
	COUNT  = Count (was: Sector Count) Register
	LBA_48 = Upper bytes of LBA High/Mid/Low Registers ]  ATA-8
	LH     = LBA High (was: Cylinder High) Register    ]   LBA
	LM     = LBA Mid (was: Cylinder Low) Register      ] Register
	LL     = LBA Low (was: Sector Number) Register     ]
	DV     = Device (was: Device/Head) Register
	DC     = Device Control Register
	ER     = Error register
	ST     = Status register
Powered_Up_Time is measured from power on, and printed as
DDd+hh:mm:SS.sss where DD=days, hh=hours, mm=minutes,
SS=sec, and sss=millisec. It "wraps" after 49.710 days.

Error 65535 [146] occurred at disk power-on lifetime: 8686 hours (361 days + 22 hours)
  When the command that caused the error occurred, the device was active or idle.

  After command completion occurred, registers were:
  ER -- ST COUNT  LBA_48  LH LM LL DV DC
  -- -- -- == -- == == == -- -- -- -- --
  40 -- 41 00 0a 00 00 00 2d ed 98 60 00  Error: UNC at LBA = 0x002ded98 = 3009944

  Commands leading to the command that caused the error were:
  CR FEATR COUNT  LBA_48  LH LM LL DV DC  Powered_Up_Time  Command/Feature_Name
  -- == -- == -- == == == -- -- -- -- --  ---------------  --------------------
  60 00 08 00 b8 00 00 00 f5 3a c8 40 00     00:16:15.118  READ FPDMA QUEUED
  60 00 08 00 b0 00 00 00 f5 3a c0 40 00     00:16:15.115  READ FPDMA QUEUED
  60 00 08 00 a0 00 00 00 f5 3a b8 40 00     00:16:15.112  READ FPDMA QUEUED
  60 00 08 00 88 00 00 00 f5 3a b0 40 00     00:16:15.108  READ FPDMA QUEUED
  60 00 08 00 80 00 00 00 f5 3a a8 40 00     00:16:15.105  READ FPDMA QUEUED

Error 65534 [145] occurred at disk power-on lifetime: 8686 hours (361 days + 22 hours)
  When the command that caused the error occurred, the device was active or idle.

  After command completion occurred, registers were:
  ER -- ST COUNT  LBA_48  LH LM LL DV DC
  -- -- -- == -- == == == -- -- -- -- --
  40 -- 41 00 52 00 00 00 2d ed 98 60 00  Error: WP at LBA = 0x002ded98 = 3009944

  Commands leading to the command that caused the error were:
  CR FEATR COUNT  LBA_48  LH LM LL DV DC  Powered_Up_Time  Command/Feature_Name
  -- == -- == -- == == == -- -- -- -- --  ---------------  --------------------
  61 00 08 00 58 00 00 00 62 c9 f8 40 00     00:16:10.982  WRITE FPDMA QUEUED
  60 00 20 00 50 00 00 00 2d ed 80 40 00     00:16:10.979  READ FPDMA QUEUED
  60 00 10 00 48 00 00 12 ad f8 00 40 00     00:16:10.979  READ FPDMA QUEUED
  60 00 30 00 40 00 00 02 0d 06 30 40 00     00:16:10.979  READ FPDMA QUEUED
  61 00 08 00 38 00 00 00 1a b8 50 40 00     00:16:10.979  WRITE FPDMA QUEUED

Error 65533 [144] occurred at disk power-on lifetime: 8686 hours (361 days + 22 hours)
  When the command that caused the error occurred, the device was active or idle.

  After command completion occurred, registers were:
  ER -- ST COUNT  LBA_48  LH LM LL DV DC
  -- -- -- == -- == == == -- -- -- -- --
  40 -- 41 00 ba 00 00 00 2d ed 98 60 00  Error: WP at LBA = 0x002ded98 = 3009944

  Commands leading to the command that caused the error were:
  CR FEATR COUNT  LBA_48  LH LM LL DV DC  Powered_Up_Time  Command/Feature_Name
  -- == -- == -- == == == -- -- -- -- --  ---------------  --------------------
  61 00 08 00 38 00 00 00 68 6a f8 40 00     00:16:06.857  WRITE FPDMA QUEUED
  61 00 08 00 08 00 00 00 6a 32 18 40 00     00:16:06.857  WRITE FPDMA QUEUED
  61 00 01 00 00 00 00 07 7c 88 00 40 00     00:16:06.856  WRITE FPDMA QUEUED
  61 00 08 00 f8 00 00 00 68 6a f0 40 00     00:16:06.856  WRITE FPDMA QUEUED
  61 00 08 00 f0 00 00 07 7c 99 f8 40 00     00:16:06.855  WRITE FPDMA QUEUED

Error 65532 [143] occurred at disk power-on lifetime: 8686 hours (361 days + 22 hours)
  When the command that caused the error occurred, the device was active or idle.

  After command completion occurred, registers were:
  ER -- ST COUNT  LBA_48  LH LM LL DV DC
  -- -- -- == -- == == == -- -- -- -- --
  40 -- 41 00 b2 00 00 00 2d ed 98 60 00  Error: UNC at LBA = 0x002ded98 = 3009944

  Commands leading to the command that caused the error were:
  CR FEATR COUNT  LBA_48  LH LM LL DV DC  Powered_Up_Time  Command/Feature_Name
  -- == -- == -- == == == -- -- -- -- --  ---------------  --------------------
  60 00 04 00 90 00 00 0c 20 12 40 40 00     00:16:02.774  READ FPDMA QUEUED
  61 00 80 00 88 00 00 02 de e2 68 40 00     00:16:02.771  WRITE FPDMA QUEUED
  60 00 40 00 80 00 00 00 15 e9 1a 40 00     00:16:02.758  READ FPDMA QUEUED
  60 00 03 00 50 00 00 00 0e 48 f0 40 00     00:16:02.757  READ FPDMA QUEUED
  60 00 1f 00 40 00 00 00 0e 48 ba 40 00     00:16:02.757  READ FPDMA QUEUED

Error 65531 [142] occurred at disk power-on lifetime: 8686 hours (361 days + 22 hours)
  When the command that caused the error occurred, the device was active or idle.

  After command completion occurred, registers were:
  ER -- ST COUNT  LBA_48  LH LM LL DV DC
  -- -- -- == -- == == == -- -- -- -- --
  40 -- 41 00 ba 00 00 00 2d ed 98 60 00  Error: WP at LBA = 0x002ded98 = 3009944

  Commands leading to the command that caused the error were:
  CR FEATR COUNT  LBA_48  LH LM LL DV DC  Powered_Up_Time  Command/Feature_Name
  -- == -- == -- == == == -- -- -- -- --  ---------------  --------------------
  61 00 08 00 d8 00 00 00 0d 33 a8 40 00     00:15:58.502  WRITE FPDMA QUEUED
  61 00 08 00 d0 00 00 00 68 6a f0 40 00     00:15:58.502  WRITE FPDMA QUEUED
  61 00 01 00 c8 00 00 12 99 2b 40 40 00     00:15:58.501  WRITE FPDMA QUEUED
  61 00 08 00 c0 00 00 00 0d 33 a8 40 00     00:15:58.501  WRITE FPDMA QUEUED
  61 00 08 00 b0 00 00 00 68 6a f8 40 00     00:15:58.500  WRITE FPDMA QUEUED

Error 65530 [141] occurred at disk power-on lifetime: 8686 hours (361 days + 22 hours)
  When the command that caused the error occurred, the device was active or idle.

  After command completion occurred, registers were:
  ER -- ST COUNT  LBA_48  LH LM LL DV DC
  -- -- -- == -- == == == -- -- -- -- --
  40 -- 41 00 c2 00 00 00 2d ed 98 60 00  Error: UNC at LBA = 0x002ded98 = 3009944

  Commands leading to the command that caused the error were:
  CR FEATR COUNT  LBA_48  LH LM LL DV DC  Powered_Up_Time  Command/Feature_Name
  -- == -- == -- == == == -- -- -- -- --  ---------------  --------------------
  60 00 30 00 e0 00 00 00 bf d7 22 40 00     00:15:54.467  READ FPDMA QUEUED
  60 00 20 00 d8 00 00 00 0f 4a f3 40 00     00:15:54.441  READ FPDMA QUEUED
  60 00 08 00 d0 00 00 00 23 3f fa 40 00     00:15:54.429  READ FPDMA QUEUED
  60 00 40 00 c8 00 00 00 0f 48 02 40 00     00:15:54.427  READ FPDMA QUEUED
  60 00 20 00 c0 00 00 00 2d ed 80 40 00     00:15:54.412  READ FPDMA QUEUED

Error 65529 [140] occurred at disk power-on lifetime: 8686 hours (361 days + 22 hours)
  When the command that caused the error occurred, the device was active or idle.

  After command completion occurred, registers were:
  ER -- ST COUNT  LBA_48  LH LM LL DV DC
  -- -- -- == -- == == == -- -- -- -- --
  40 -- 41 00 02 00 00 00 2d ed 98 60 00  Error: UNC at LBA = 0x002ded98 = 3009944

  Commands leading to the command that caused the error were:
  CR FEATR COUNT  LBA_48  LH LM LL DV DC  Powered_Up_Time  Command/Feature_Name
  -- == -- == -- == == == -- -- -- -- --  ---------------  --------------------
  60 00 10 00 f8 00 00 00 23 41 9a 40 00     00:15:50.341  READ FPDMA QUEUED
  60 00 20 00 d8 00 00 00 15 ec 06 40 00     00:15:50.332  READ FPDMA QUEUED
  60 00 08 00 c8 00 00 00 29 e9 f0 40 00     00:15:50.319  READ FPDMA QUEUED
  60 00 08 00 c0 00 00 00 0e 2e 50 40 00     00:15:50.319  READ FPDMA QUEUED
  60 00 08 00 a8 00 00 00 0c 9f 50 40 00     00:15:50.319  READ FPDMA QUEUED

Error 65528 [139] occurred at disk power-on lifetime: 8686 hours (361 days + 22 hours)
  When the command that caused the error occurred, the device was active or idle.

  After command completion occurred, registers were:
  ER -- ST COUNT  LBA_48  LH LM LL DV DC
  -- -- -- == -- == == == -- -- -- -- --
  40 -- 41 00 da 00 00 00 2d ed 98 60 00  Error: UNC at LBA = 0x002ded98 = 3009944

  Commands leading to the command that caused the error were:
  CR FEATR COUNT  LBA_48  LH LM LL DV DC  Powered_Up_Time  Command/Feature_Name
  -- == -- == -- == == == -- -- -- -- --  ---------------  --------------------
  60 00 40 00 08 00 00 00 29 eb 9b 40 00     00:15:46.095  READ FPDMA QUEUED
  60 00 03 00 00 00 00 00 0e 2e b4 40 00     00:15:46.094  READ FPDMA QUEUED
  60 00 08 00 f8 00 00 00 f5 3a 98 40 00     00:15:46.093  READ FPDMA QUEUED
  60 00 06 00 f0 00 00 00 0e 2e b7 40 00     00:15:46.093  READ FPDMA QUEUED
  60 00 28 00 e8 00 00 00 0e 2e 52 40 00     00:15:46.091  READ FPDMA QUEUED

SMART Extended Self-test Log Version: 1 (1 sectors)
No self-tests have been logged.  [To run self-tests, use: smartctl -t]

SMART Selective self-test log data structure revision number 1
 SPAN  MIN_LBA  MAX_LBA  CURRENT_TEST_STATUS
    1        0        0  Not_testing
    2        0        0  Not_testing
    3        0        0  Not_testing
    4        0        0  Not_testing
    5        0        0  Not_testing
Selective self-test flags (0x0):
  After scanning selected spans, do NOT read-scan remainder of disk.
If Selective self-test is pending on power-up, resume after 0 minute delay.

SCT Status Version:                  2
SCT Version (vendor specific):       1 (0x0001)
Device State:                        Active (0)
Current Temperature:                    33 Celsius
Power Cycle Min/Max Temperature:     33/34 Celsius
Lifetime    Min/Max Temperature:      8/59 Celsius
Under/Over Temperature Limit Count:   0/23

SCT Temperature History Version:     2
Temperature Sampling Period:         1 minute
Temperature Logging Interval:        1 minute
Min/Max recommended Temperature:      5/55 Celsius
Min/Max Temperature Limit:            5/55 Celsius
Temperature History Size (Index):    478 (250)

SCT Error Recovery Control:
           Read: Disabled
          Write: Disabled

Device Statistics (GP/SMART Log 0x04) not supported

Pending Defects log (GP Log 0x0c) not supported

SATA Phy Event Counters (GP Log 0x11)
ID      Size     Value  Description
0x0001  4            0  Command failed due to ICRC error
0x0002  4            0  R_ERR response for data FIS
0x0003  4            0  R_ERR response for device-to-host data FIS
0x0004  4            0  R_ERR response for host-to-device data FIS
0x0005  4            0  R_ERR response for non-data FIS
0x0006  4            0  R_ERR response for device-to-host non-data FIS
0x0007  4            0  R_ERR response for host-to-device non-data FIS
0x0008  4            0  Device-to-host non-data FIS retries
0x0009  4           36  Transition from drive PhyRdy to drive PhyNRdy
0x000a  4            8  Device-to-host register FISes sent due to a COMRESET
0x000b  4            0  CRC errors within host-to-device FIS
0x000d  4            0  Non-CRC errors within host-to-device FIS
0x000f  4            0  R_ERR response for host-to-device data FIS, CRC
0x0010  4            0  R_ERR response for host-to-device data FIS, non-CRC
0x0012  4            0  R_ERR response for host-to-device non-data FIS, CRC
0x0013  4            0  R_ERR response for host-to-device non-data FIS, non-CRC

