smartctl 7.1 2019-12-30 r5022 [x86_64-linux-5.4.0-91-generic] (local build)
Copyright (C) 2002-19, Bruce Allen, Christian Franke, www.smartmontools.org

=== START OF INFORMATION SECTION ===
Model Number:                       SK hynix BC711 HFM512GD3JX013N
Serial Number:                      --
Firmware Version:                   HPS1
PCI Vendor/Subsystem ID:            0x1c5c
IEEE OUI Identifier:                0xace42e
Total NVM Capacity:                 512,110,190,592 [512 GB]
Unallocated NVM Capacity:           0
Controller ID:                      1
Number of Namespaces:               1
Namespace 1 Size/Capacity:          512,110,190,592 [512 GB]
Namespace 1 Formatted LBA Size:     512
Namespace 1 IEEE EUI-64:            ace42e ...
Local Time is:                      Sat Mar 12 19:07:23 2022 UTC
Firmware Updates (0x16):            3 Slots, no Reset required
Optional Admin Commands (0x001f):   Security Format Frmw_DL NS_Mngmt Self_Test
Optional NVM Commands (0x005f):     Comp Wr_Unc DS_Mngmt Wr_Zero Sav/Sel_Feat Timestmp
Maximum Data Transfer Size:         64 Pages
Warning  Comp. Temp. Threshold:     84 Celsius
Critical Comp. Temp. Threshold:     85 Celsius
Namespace 1 Features (0x02):        NA_Fields

Supported Power States
St Op     Max   Active     Idle   RL RT WL WT  Ent_Lat  Ex_Lat
 0 +   6.3000W       -        -    0  0  0  0        5       5
 1 +   2.4000W       -        -    1  1  1  1       30      30
 2 +   1.9000W       -        -    2  2  2  2      100     100
 3 -   0.0500W       -        -    3  3  3  3     1000    1000
 4 -   0.0040W       -        -    3  3  3  3     1000    9000

Supported LBA Sizes (NSID 0x1)
Id Fmt  Data  Metadt  Rel_Perf
 0 +     512       0         0
 1 -    4096       0         0

=== START OF SMART DATA SECTION ===
SMART overall-health self-assessment test result: PASSED

SMART/Health Information (NVMe Log 0x02)
Critical Warning:                   0x00
Temperature:                        33 Celsius
Available Spare:                    100%
Available Spare Threshold:          5%
Percentage Used:                    0%
Data Units Read:                    68,957 [35.3 GB]
Data Units Written:                 106,674 [54.6 GB]
Host Read Commands:                 2,074,581
Host Write Commands:                892,723
Controller Busy Time:               1
Power Cycles:                       34
Power On Hours:                     8
Unsafe Shutdowns:                   5
Media and Data Integrity Errors:    0
Error Information Log Entries:      0
Warning  Comp. Temperature Time:    0
Critical Comp. Temperature Time:    0
Temperature Sensor 1:               33 Celsius
Temperature Sensor 2:               37 Celsius

Error Information (NVMe Log 0x01, max 256 entries)
No Errors Logged

