smartctl 7.2 2021-01-17 r5171 [x86_64-linux-5.12.6-300.fc34.x86_64] (local build)
Copyright (C) 2002-20, Bruce Allen, Christian Franke, www.smartmontools.org

=== START OF INFORMATION SECTION ===
Model Family:     WD Blue / Red / Green SSDs
Device Model:     WDC WDS500G2B0A-00SM50
Serial Number:    --
LU WWN Device Id: 5 001b44 ...
Firmware Version: X61190WD
User Capacity:    500,107,862,016 bytes [500 GB]
Sector Size:      512 bytes logical/physical
Rotation Rate:    Solid State Device
Form Factor:      2.5 inches
TRIM Command:     Available, deterministic, zeroed
Device is:        In smartctl database [for details use: -P show]
ATA Version is:   ACS-4 T13/BSR INCITS 529 revision 5
SATA Version is:  SATA 3.3, 6.0 Gb/s (current: 6.0 Gb/s)
Local Time is:    Thu May 27 20:26:49 2021 CST
SMART support is: Available - device has SMART capability.
SMART support is: Enabled
AAM feature is:   Unavailable
APM level is:     128 (minimum power consumption without standby)
Rd look-ahead is: Enabled
Write cache is:   Enabled
DSN feature is:   Unavailable
ATA Security is:  Disabled, frozen [SEC2]
Wt Cache Reorder: Unavailable

=== START OF READ SMART DATA SECTION ===
SMART overall-health self-assessment test result: PASSED

General SMART Values:
Offline data collection status:  (0x00)	Offline data collection activity
					was never started.
					Auto Offline Data Collection: Disabled.
Self-test execution status:      (   0)	The previous self-test routine completed
					without error or no self-test has ever 
					been run.
Total time to complete Offline 
data collection: 		(    0) seconds.
Offline data collection
capabilities: 			 (0x11) SMART execute Offline immediate.
					No Auto Offline data collection support.
					Suspend Offline collection upon new
					command.
					No Offline surface scan supported.
					Self-test supported.
					No Conveyance Self-test supported.
					No Selective Self-test supported.
SMART capabilities:            (0x0003)	Saves SMART data before entering
					power-saving mode.
					Supports SMART auto save timer.
Error logging capability:        (0x01)	Error logging supported.
					General Purpose Logging supported.
Short self-test routine 
recommended polling time: 	 (   2) minutes.
Extended self-test routine
recommended polling time: 	 (  10) minutes.

SMART Attributes Data Structure revision number: 4
Vendor Specific SMART Attributes with Thresholds:
ID# ATTRIBUTE_NAME          FLAGS    VALUE WORST THRESH FAIL RAW_VALUE
  5 Reallocated_Sector_Ct   -O--CK   100   100   ---    -    0
  9 Power_On_Hours          -O--CK   100   100   ---    -    2675
 12 Power_Cycle_Count       -O--CK   100   100   ---    -    2717
165 Block_Erase_Count       -O--CK   100   100   ---    -    73072182032
166 Minimum_PE_Cycles_TLC   -O--CK   100   100   ---    -    5
167 Max_Bad_Blocks_per_Die  -O--CK   100   100   ---    -    27
168 Maximum_PE_Cycles_TLC   -O--CK   100   100   ---    -    13
169 Total_Bad_Blocks        -O--CK   100   100   ---    -    273
170 Grown_Bad_Blocks        -O--CK   100   100   ---    -    0
171 Program_Fail_Count      -O--CK   100   100   ---    -    0
172 Erase_Fail_Count        -O--CK   100   100   ---    -    0
173 Average_PE_Cycles_TLC   -O--CK   100   100   ---    -    7
174 Unexpected_Power_Loss   -O--CK   100   100   ---    -    182
184 End-to-End_Error        -O--CK   100   100   ---    -    0
187 Reported_Uncorrect      -O--CK   100   100   ---    -    0
188 Command_Timeout         -O--CK   100   100   ---    -    2
194 Temperature_Celsius     -O---K   072   043   ---    -    28 (Min/Max 14/43)
199 UDMA_CRC_Error_Count    -O--CK   100   100   ---    -    0
230 Media_Wearout_Indicator -O--CK   100   100   ---    -    0x013800460138
232 Available_Reservd_Space PO--CK   100   100   004    -    100
233 NAND_GB_Written_TLC     -O--CK   100   100   ---    -    3964
234 NAND_GB_Written_SLC     -O--CK   100   100   ---    -    9513
241 Host_Writes_GiB         ----CK   253   253   ---    -    7509
242 Host_Reads_GiB          ----CK   253   253   ---    -    2406
244 Temp_Throttle_Status    -O--CK   000   100   ---    -    0
                            ||||||_ K auto-keep
                            |||||__ C event count
                            ||||___ R error rate
                            |||____ S speed/performance
                            ||_____ O updated online
                            |______ P prefailure warning

General Purpose Log Directory Version 1
SMART           Log Directory Version 1 [multi-sector log support]
Address    Access  R/W   Size  Description
0x00       GPL,SL  R/O      1  Log Directory
0x01           SL  R/O      1  Summary SMART error log
0x02           SL  R/O      2  Comprehensive SMART error log
0x03       GPL     R/O      1  Ext. Comprehensive SMART error log
0x04       GPL,SL  R/O      8  Device Statistics log
0x06           SL  R/O      1  SMART self-test log
0x07       GPL     R/O      1  Extended self-test log
0x10       GPL     R/O      1  NCQ Command Error log
0x11       GPL     R/O      1  SATA Phy Event Counters log
0x30       GPL,SL  R/O      9  IDENTIFY DEVICE data log
0x80-0x9f  GPL,SL  R/W     16  Host vendor specific log
0xde       GPL     VS       8  Device vendor specific log

SMART Extended Comprehensive Error Log Version: 1 (1 sectors)
No Errors Logged

SMART Extended Self-test Log Version: 1 (1 sectors)
Num  Test_Description    Status                  Remaining  LifeTime(hours)  LBA_of_first_error
# 1  Short offline       Completed without error       00%      1718         -
# 2  Short offline       Interrupted (host reset)      00%      1713         -
# 3  Short offline       Interrupted (host reset)      00%      1713         -
# 4  Short offline       Completed without error       00%      1683         -
# 5  Short offline       Completed without error       00%      1682         -
# 6  Short offline       Interrupted (host reset)      00%      1680         -
# 7  Short offline       Completed without error       00%      1334         -
# 8  Short offline       Completed without error       00%      1330         -
# 9  Short offline       Interrupted (host reset)      00%      1325         -
#10  Short offline       Completed without error       00%      1280         -
#11  Short offline       Completed without error       00%      1271         -
#12  Short offline       Completed without error       00%      1254         -
#13  Short offline       Completed without error       00%      1230         -
#14  Short offline       Completed without error       00%       902         -
#15  Short offline       Completed without error       00%       196         -
#16  Short offline       Completed without error       00%       124         -
#17  Short offline       Completed without error       00%        68         -
#18  Short offline       Aborted by host               00%        43         -
#19  Short offline       Completed without error       00%        21         -

Selective Self-tests/Logging not supported

SCT Commands not supported

Device Statistics (GP Log 0x04)
Page  Offset Size        Value Flags Description
0x01  =====  =               =  ===  == General Statistics (rev 1) ==
0x01  0x008  4            2717  ---  Lifetime Power-On Resets
0x01  0x010  4               0  ---  Power-on Hours
0x01  0x018  6     15748143946  ---  Logical Sectors Written
0x01  0x020  6       119841399  ---  Number of Write Commands
0x01  0x028  6      5045992597  ---  Logical Sectors Read
0x01  0x030  6       123123311  ---  Number of Read Commands
0x07  =====  =               =  ===  == Solid State Device Statistics (rev 1) ==
0x07  0x008  1               0  N--  Percentage Used Endurance Indicator
                                |||_ C monitored condition met
                                ||__ D supports DSN
                                |___ N normalized value

Pending Defects log (GP Log 0x0c) not supported

SATA Phy Event Counters (GP Log 0x11)
ID      Size     Value  Description
0x0001  4            0  Command failed due to ICRC error
0x0002  4            0  R_ERR response for data FIS
0x0005  4            0  R_ERR response for non-data FIS
0x000a  4           11  Device-to-host register FISes sent due to a COMRESET

