smartctl 7.3 2022-02-28 r5338 [x86_64-linux-5.19.0-31-generic] (local build)
Copyright (C) 2002-22, Bruce Allen, Christian Franke, www.smartmontools.org

=== START OF INFORMATION SECTION ===
Model Family:     JMicron/Maxiotek based SSDs
Device Model:     ADATA SP600
Serial Number:    --
Firmware Version: 1.2
User Capacity:    128,035,676,160 bytes [128 GB]
Sector Size:      512 bytes logical/physical
Rotation Rate:    Solid State Device
Form Factor:      2.5 inches
TRIM Command:     Available
Device is:        In smartctl database 7.3/5319
ATA Version is:   ACS-2 (minor revision not indicated)
SATA Version is:  SATA 3.0, 6.0 Gb/s (current: 3.0 Gb/s)
Local Time is:    Thu Feb 16 15:40:16 2023 CST
SMART support is: Available - device has SMART capability.
SMART support is: Enabled
AAM feature is:   Unavailable
APM feature is:   Unavailable
Rd look-ahead is: Enabled
Write cache is:   Enabled
DSN feature is:   Unavailable
ATA Security is:  Disabled, frozen [SEC2]
Wt Cache Reorder: Enabled

=== START OF READ SMART DATA SECTION ===
SMART overall-health self-assessment test result: PASSED

General SMART Values:
Offline data collection status:  (0x00)	Offline data collection activity
					was never started.
					Auto Offline Data Collection: Disabled.
Self-test execution status:      (   0)	The previous self-test routine completed
					without error or no self-test has ever 
					been run.
Total time to complete Offline 
data collection: 		(   32) seconds.
Offline data collection
capabilities: 			 (0x5b) SMART execute Offline immediate.
					Auto Offline data collection on/off support.
					Suspend Offline collection upon new
					command.
					Offline surface scan supported.
					Self-test supported.
					No Conveyance Self-test supported.
					Selective Self-test supported.
SMART capabilities:            (0x0003)	Saves SMART data before entering
					power-saving mode.
					Supports SMART auto save timer.
Error logging capability:        (0x01)	Error logging supported.
					General Purpose Logging supported.
Short self-test routine 
recommended polling time: 	 (   1) minutes.
Extended self-test routine
recommended polling time: 	 (   1) minutes.
SCT capabilities: 	       (0x0039)	SCT Status supported.
					SCT Error Recovery Control supported.
					SCT Feature Control supported.
					SCT Data Table supported.

SMART Attributes Data Structure revision number: 16
Vendor Specific SMART Attributes with Thresholds:
ID# ATTRIBUTE_NAME          FLAGS    VALUE WORST THRESH FAIL RAW_VALUE
  1 Raw_Read_Error_Rate     -O-R--   100   100   000    -    0
  2 Throughput_Performance  P-S---   100   100   050    -    0
  3 Unknown_JMF_Attribute   POS---   100   100   050    -    0
  5 Reallocated_Sector_Ct   PO--C-   100   100   050    -    0
  7 Unknown_JMF_Attribute   PO-R--   100   100   050    -    0
  8 Unknown_JMF_Attribute   P-S---   100   100   050    -    0
  9 Power_On_Hours          -O--C-   100   100   000    -    11284
 10 Unknown_JMF_Attribute   PO--C-   100   100   050    -    0
 12 Power_Cycle_Count       -O--C-   100   100   000    -    4776
167 Unknown_JMF_Attribute   -O---K   100   100   000    -    0
168 SATA_Phy_Error_Count    -O--C-   100   100   000    -    2
169 Unknown_JMF_Attribute   PO--C-   100   100   010    -    0
173 Erase_Count             -O--C-   191   191   000    -    0 0 0
175 Bad_Cluster_Table_Count PO--C-   100   100   010    -    0
192 Unexpect_Power_Loss_Ct  -O--C-   100   100   000    -    158
194 Temperature_Celsius     PO---K   050   050   030    -    50 (Min/Max 28/50)
197 Current_Pending_Sector  -O--C-   100   100   000    -    0
240 Unknown_JMF_Attribute   PO--C-   100   100   050    -    0
                            ||||||_ K auto-keep
                            |||||__ C event count
                            ||||___ R error rate
                            |||____ S speed/performance
                            ||_____ O updated online
                            |______ P prefailure warning

General Purpose Log Directory Version 1
SMART           Log Directory Version 1 [multi-sector log support]
Address    Access  R/W   Size  Description
0x00       GPL,SL  R/O      1  Log Directory
0x01           SL  R/O      1  Summary SMART error log
0x02           SL  R/O     51  Comprehensive SMART error log
0x03       GPL     R/O     64  Ext. Comprehensive SMART error log
0x06           SL  R/O      1  SMART self-test log
0x07       GPL     R/O      1  Extended self-test log
0x09           SL  R/W      1  Selective self-test log
0x10       GPL     R/O      1  NCQ Command Error log
0x11       GPL     R/O      1  SATA Phy Event Counters log
0x80-0x9f  GPL,SL  R/W     16  Host vendor specific log
0xe0       GPL,SL  R/W      1  SCT Command/Status
0xe1       GPL,SL  R/W      1  SCT Data Transfer

SMART Extended Comprehensive Error Log Version: 1 (64 sectors)
Device Error Count: 288 (device log contains only the most recent 256 errors)
	CR     = Command Register
	FEATR  = Features Register
	COUNT  = Count (was: Sector Count) Register
	LBA_48 = Upper bytes of LBA High/Mid/Low Registers ]  ATA-8
	LH     = LBA High (was: Cylinder High) Register    ]   LBA
	LM     = LBA Mid (was: Cylinder Low) Register      ] Register
	LL     = LBA Low (was: Sector Number) Register     ]
	DV     = Device (was: Device/Head) Register
	DC     = Device Control Register
	ER     = Error register
	ST     = Status register
Powered_Up_Time is measured from power on, and printed as
DDd+hh:mm:SS.sss where DD=days, hh=hours, mm=minutes,
SS=sec, and sss=millisec. It "wraps" after 49.710 days.

Error 288 [31] occurred at disk power-on lifetime: 5544 hours (231 days + 0 hours)
  When the command that caused the error occurred, the device was active or idle.

  After command completion occurred, registers were:
  ER -- ST COUNT  LBA_48  LH LM LL DV DC
  -- -- -- == -- == == == -- -- -- -- --
  84 -- 51 00 01 00 00 00 00 00 10 e0 00  Error: ICRC, ABRT at LBA = 0x00000010 = 16

  Commands leading to the command that caused the error were:
  CR FEATR COUNT  LBA_48  LH LM LL DV DC  Powered_Up_Time  Command/Feature_Name
  -- == -- == -- == == == -- -- -- -- --  ---------------  --------------------
  60 00 0c 00 10 00 00 00 a2 3e 80 40 00     00:02:28.900  READ FPDMA QUEUED
  60 00 08 00 08 00 00 00 73 28 48 40 00     00:02:28.900  READ FPDMA QUEUED
  60 00 08 00 f8 00 00 00 b4 21 78 40 00     00:02:28.900  READ FPDMA QUEUED
  60 00 0e 00 f0 00 00 00 3a 2e 01 40 00     00:02:28.900  READ FPDMA QUEUED
  60 00 20 00 e8 00 00 00 3a 2d e1 40 00     00:02:28.900  READ FPDMA QUEUED

Error 287 [30] occurred at disk power-on lifetime: 5544 hours (231 days + 0 hours)
  When the command that caused the error occurred, the device was active or idle.

  After command completion occurred, registers were:
  ER -- ST COUNT  LBA_48  LH LM LL DV DC
  -- -- -- == -- == == == -- -- -- -- --
  00 -- 7f 00 00 00 00 00 00 00 00 00 00  Device Fault; Error:  at LBA = 0x00000000 = 0

  Commands leading to the command that caused the error were:
  CR FEATR COUNT  LBA_48  LH LM LL DV DC  Powered_Up_Time  Command/Feature_Name
  -- == -- == -- == == == -- -- -- -- --  ---------------  --------------------
  60 00 08 00 20 00 00 00 73 0d c0 40 00     00:01:56.400  READ FPDMA QUEUED
  60 00 08 00 18 00 00 00 6c 45 20 40 00     00:01:56.400  READ FPDMA QUEUED
  60 00 20 00 10 00 00 00 ba 35 9d 40 00     00:01:56.400  READ FPDMA QUEUED
  60 00 04 00 08 00 00 00 ba 50 01 40 00     00:01:56.400  READ FPDMA QUEUED
  61 00 08 00 f8 00 00 00 25 d3 68 40 00     00:01:56.400  WRITE FPDMA QUEUED

Error 286 [29] occurred at disk power-on lifetime: 5544 hours (231 days + 0 hours)
  When the command that caused the error occurred, the device was active or idle.

  After command completion occurred, registers were:
  ER -- ST COUNT  LBA_48  LH LM LL DV DC
  -- -- -- == -- == == == -- -- -- -- --
  00 -- 7f 00 00 00 00 00 00 00 00 00 00  Device Fault; Error:  at LBA = 0x00000000 = 0

  Commands leading to the command that caused the error were:
  CR FEATR COUNT  LBA_48  LH LM LL DV DC  Powered_Up_Time  Command/Feature_Name
  -- == -- == -- == == == -- -- -- -- --  ---------------  --------------------
  60 00 08 00 08 00 00 00 75 35 b0 40 00     00:01:23.300  READ FPDMA QUEUED
  60 00 08 00 f8 00 00 00 0e fe 20 40 00     00:01:23.300  READ FPDMA QUEUED
  60 00 08 00 f0 00 00 00 0e fd f8 40 00     00:01:23.300  READ FPDMA QUEUED
  60 00 20 00 e8 00 00 00 0e fd 78 40 00     00:01:23.300  READ FPDMA QUEUED
  60 00 08 00 b0 00 00 00 0e 38 10 40 00     00:01:23.300  READ FPDMA QUEUED

Error 285 [28] occurred at disk power-on lifetime: 5544 hours (231 days + 0 hours)
  When the command that caused the error occurred, the device was active or idle.

  After command completion occurred, registers were:
  ER -- ST COUNT  LBA_48  LH LM LL DV DC
  -- -- -- == -- == == == -- -- -- -- --
  84 -- 51 00 01 00 00 00 00 00 10 e0 00  Error: ICRC, ABRT at LBA = 0x00000010 = 16

  Commands leading to the command that caused the error were:
  CR FEATR COUNT  LBA_48  LH LM LL DV DC  Powered_Up_Time  Command/Feature_Name
  -- == -- == -- == == == -- -- -- -- --  ---------------  --------------------
  61 00 80 00 e8 00 00 05 72 60 78 40 00     00:00:21.000  WRITE FPDMA QUEUED
  61 01 00 00 e0 00 00 05 72 5f 78 40 00     00:00:21.000  WRITE FPDMA QUEUED
  61 00 80 00 d8 00 00 06 0d 29 08 40 00     00:00:21.000  WRITE FPDMA QUEUED
  61 01 00 00 d0 00 00 06 0d 28 08 40 00     00:00:21.000  WRITE FPDMA QUEUED
  61 01 00 00 c8 00 00 06 0d 27 08 40 00     00:00:21.000  WRITE FPDMA QUEUED

Error 284 [27] occurred at disk power-on lifetime: 5544 hours (231 days + 0 hours)
  When the command that caused the error occurred, the device was active or idle.

  After command completion occurred, registers were:
  ER -- ST COUNT  LBA_48  LH LM LL DV DC
  -- -- -- == -- == == == -- -- -- -- --
  84 -- 51 00 01 00 00 00 00 00 10 e0 00  Error: ICRC, ABRT at LBA = 0x00000010 = 16

  Commands leading to the command that caused the error were:
  CR FEATR COUNT  LBA_48  LH LM LL DV DC  Powered_Up_Time  Command/Feature_Name
  -- == -- == -- == == == -- -- -- -- --  ---------------  --------------------
  60 00 0c 00 10 00 00 00 a2 3e 80 40 00     00:02:28.900  READ FPDMA QUEUED
  60 00 08 00 08 00 00 00 73 28 48 40 00     00:02:28.900  READ FPDMA QUEUED
  60 00 08 00 f8 00 00 00 b4 21 78 40 00     00:02:28.900  READ FPDMA QUEUED
  60 00 0e 00 f0 00 00 00 3a 2e 01 40 00     00:02:28.900  READ FPDMA QUEUED
  60 00 20 00 e8 00 00 00 3a 2d e1 40 00     00:02:28.900  READ FPDMA QUEUED

Error 283 [26] occurred at disk power-on lifetime: 5544 hours (231 days + 0 hours)
  When the command that caused the error occurred, the device was active or idle.

  After command completion occurred, registers were:
  ER -- ST COUNT  LBA_48  LH LM LL DV DC
  -- -- -- == -- == == == -- -- -- -- --
  00 -- 7f 00 00 00 00 00 00 00 00 00 00  Device Fault; Error:  at LBA = 0x00000000 = 0

  Commands leading to the command that caused the error were:
  CR FEATR COUNT  LBA_48  LH LM LL DV DC  Powered_Up_Time  Command/Feature_Name
  -- == -- == -- == == == -- -- -- -- --  ---------------  --------------------
  60 00 08 00 20 00 00 00 73 0d c0 40 00     00:01:56.400  READ FPDMA QUEUED
  60 00 08 00 18 00 00 00 6c 45 20 40 00     00:01:56.400  READ FPDMA QUEUED
  60 00 20 00 10 00 00 00 ba 35 9d 40 00     00:01:56.400  READ FPDMA QUEUED
  60 00 04 00 08 00 00 00 ba 50 01 40 00     00:01:56.400  READ FPDMA QUEUED
  61 00 08 00 f8 00 00 00 25 d3 68 40 00     00:01:56.400  WRITE FPDMA QUEUED

Error 282 [25] occurred at disk power-on lifetime: 5544 hours (231 days + 0 hours)
  When the command that caused the error occurred, the device was active or idle.

  After command completion occurred, registers were:
  ER -- ST COUNT  LBA_48  LH LM LL DV DC
  -- -- -- == -- == == == -- -- -- -- --
  00 -- 7f 00 00 00 00 00 00 00 00 00 00  Device Fault; Error:  at LBA = 0x00000000 = 0

  Commands leading to the command that caused the error were:
  CR FEATR COUNT  LBA_48  LH LM LL DV DC  Powered_Up_Time  Command/Feature_Name
  -- == -- == -- == == == -- -- -- -- --  ---------------  --------------------
  60 00 08 00 08 00 00 00 75 35 b0 40 00     00:01:23.300  READ FPDMA QUEUED
  60 00 08 00 f8 00 00 00 0e fe 20 40 00     00:01:23.300  READ FPDMA QUEUED
  60 00 08 00 f0 00 00 00 0e fd f8 40 00     00:01:23.300  READ FPDMA QUEUED
  60 00 20 00 e8 00 00 00 0e fd 78 40 00     00:01:23.300  READ FPDMA QUEUED
  60 00 08 00 b0 00 00 00 0e 38 10 40 00     00:01:23.300  READ FPDMA QUEUED

Error 281 [24] occurred at disk power-on lifetime: 5544 hours (231 days + 0 hours)
  When the command that caused the error occurred, the device was active or idle.

  After command completion occurred, registers were:
  ER -- ST COUNT  LBA_48  LH LM LL DV DC
  -- -- -- == -- == == == -- -- -- -- --
  84 -- 51 00 01 00 00 00 00 00 10 e0 00  Error: ICRC, ABRT at LBA = 0x00000010 = 16

  Commands leading to the command that caused the error were:
  CR FEATR COUNT  LBA_48  LH LM LL DV DC  Powered_Up_Time  Command/Feature_Name
  -- == -- == -- == == == -- -- -- -- --  ---------------  --------------------
  61 00 80 00 e8 00 00 05 72 60 78 40 00     00:00:21.000  WRITE FPDMA QUEUED
  61 01 00 00 e0 00 00 05 72 5f 78 40 00     00:00:21.000  WRITE FPDMA QUEUED
  61 00 80 00 d8 00 00 06 0d 29 08 40 00     00:00:21.000  WRITE FPDMA QUEUED
  61 01 00 00 d0 00 00 06 0d 28 08 40 00     00:00:21.000  WRITE FPDMA QUEUED
  61 01 00 00 c8 00 00 06 0d 27 08 40 00     00:00:21.000  WRITE FPDMA QUEUED

SMART Extended Self-test Log Version: 1 (1 sectors)
No self-tests have been logged.  [To run self-tests, use: smartctl -t]

SMART Selective self-test log data structure revision number 1
 SPAN  MIN_LBA  MAX_LBA  CURRENT_TEST_STATUS
    1        0        0  Not_testing
    2        0        0  Not_testing
    3        0        0  Not_testing
    4        0        0  Not_testing
    5        0        0  Not_testing
Selective self-test flags (0x0):
  After scanning selected spans, do NOT read-scan remainder of disk.
If Selective self-test is pending on power-up, resume after 0 minute delay.

SCT Status Version:                  3
SCT Version (vendor specific):       1 (0x0001)
Device State:                        Active (0)
Current Temperature:                     0 Celsius
Power Cycle Min/Max Temperature:     --/ 0 Celsius
Lifetime    Min/Max Temperature:     --/ 0 Celsius

SCT Temperature History Version:     2
Temperature Sampling Period:         1 minute
Temperature Logging Interval:        1 minute
Min/Max recommended Temperature:     -127/127 Celsius
Min/Max Temperature Limit:           -127/127 Celsius
Temperature History Size (Index):    478 (150)

SCT Error Recovery Control:
           Read:     70 (7.0 seconds)
          Write:     70 (7.0 seconds)

Device Statistics (GP/SMART Log 0x04) not supported

Pending Defects log (GP Log 0x0c) not supported

SATA Phy Event Counters (GP Log 0x11)
ID      Size     Value  Description
0x0001  2            2  Command failed due to ICRC error
0x0003  2            0  R_ERR response for device-to-host data FIS
0x0004  2            0  R_ERR response for host-to-device data FIS
0x0006  2            0  R_ERR response for device-to-host non-data FIS
0x0007  2            0  R_ERR response for host-to-device non-data FIS
0x0008  2            0  Device-to-host non-data FIS retries
0x0009  4            0  Transition from drive PhyRdy to drive PhyNRdy
0x000a  4            4  Device-to-host register FISes sent due to a COMRESET
0x000f  2            0  R_ERR response for host-to-device data FIS, CRC
0x0010  2            0  R_ERR response for host-to-device data FIS, non-CRC
0x0012  2            0  R_ERR response for host-to-device non-data FIS, CRC
0x0013  2            0  R_ERR response for host-to-device non-data FIS, non-CRC



