smartctl 7.1 2019-12-30 r5022 [x86_64-linux-5.15.0-41-generic] (local build)
Copyright (C) 2002-19, Bruce Allen, Christian Franke, www.smartmontools.org

=== START OF INFORMATION SECTION ===
Model Family:     Western Digital Black
Device Model:     WDC WD1003FZEX-00MK2A0
Serial Number:    --
LU WWN Device Id: 5 0014ee ...
Firmware Version: 01.01A01
User Capacity:    1,000,204,886,016 bytes [1.00 TB]
Sector Sizes:     512 bytes logical, 4096 bytes physical
Rotation Rate:    7200 rpm
Device is:        In smartctl database [for details use: -P show]
ATA Version is:   ACS-2, ACS-3 T13/2161-D revision 3b
SATA Version is:  SATA 3.1, 6.0 Gb/s (current: 6.0 Gb/s)
Local Time is:    Thu Jul 21 17:35:04 2022 -03
SMART support is: Available - device has SMART capability.
SMART support is: Enabled
AAM feature is:   Unavailable
APM feature is:   Unavailable
Rd look-ahead is: Enabled
Write cache is:   Enabled
DSN feature is:   Unavailable
ATA Security is:  Disabled, frozen [SEC2]
Wt Cache Reorder: Enabled

=== START OF READ SMART DATA SECTION ===
SMART overall-health self-assessment test result: PASSED

General SMART Values:
Offline data collection status:  (0x82)	Offline data collection activity
					was completed without error.
					Auto Offline Data Collection: Enabled.
Self-test execution status:      (   0)	The previous self-test routine completed
					without error or no self-test has ever 
					been run.
Total time to complete Offline 
data collection: 		(10740) seconds.
Offline data collection
capabilities: 			 (0x7b) SMART execute Offline immediate.
					Auto Offline data collection on/off support.
					Suspend Offline collection upon new
					command.
					Offline surface scan supported.
					Self-test supported.
					Conveyance Self-test supported.
					Selective Self-test supported.
SMART capabilities:            (0x0003)	Saves SMART data before entering
					power-saving mode.
					Supports SMART auto save timer.
Error logging capability:        (0x01)	Error logging supported.
					General Purpose Logging supported.
Short self-test routine 
recommended polling time: 	 (   2) minutes.
Extended self-test routine
recommended polling time: 	 ( 112) minutes.
Conveyance self-test routine
recommended polling time: 	 (   5) minutes.
SCT capabilities: 	       (0x3035)	SCT Status supported.
					SCT Feature Control supported.
					SCT Data Table supported.

SMART Attributes Data Structure revision number: 16
Vendor Specific SMART Attributes with Thresholds:
ID# ATTRIBUTE_NAME          FLAGS    VALUE WORST THRESH FAIL RAW_VALUE
  1 Raw_Read_Error_Rate     POSR-K   200   200   051    -    72
  3 Spin_Up_Time            POS--K   174   172   021    -    2300
  4 Start_Stop_Count        -O--CK   098   098   000    -    2409
  5 Reallocated_Sector_Ct   PO--CK   200   200   140    -    1
  7 Seek_Error_Rate         -OSR-K   200   200   000    -    0
  9 Power_On_Hours          -O--CK   055   055   000    -    32956
 10 Spin_Retry_Count        -O--CK   100   100   000    -    0
 11 Calibration_Retry_Count -O--CK   100   100   000    -    0
 12 Power_Cycle_Count       -O--CK   100   100   000    -    278
192 Power-Off_Retract_Count -O--CK   200   200   000    -    104
193 Load_Cycle_Count        -O--CK   200   200   000    -    2369
194 Temperature_Celsius     -O---K   112   092   000    -    31
196 Reallocated_Event_Count -O--CK   199   199   000    -    1
197 Current_Pending_Sector  -O--CK   200   200   000    -    13
198 Offline_Uncorrectable   ----CK   200   200   000    -    9
199 UDMA_CRC_Error_Count    -O--CK   200   200   000    -    0
200 Multi_Zone_Error_Rate   ---R--   200   200   000    -    25
                            ||||||_ K auto-keep
                            |||||__ C event count
                            ||||___ R error rate
                            |||____ S speed/performance
                            ||_____ O updated online
                            |______ P prefailure warning

General Purpose Log Directory Version 1
SMART           Log Directory Version 1 [multi-sector log support]
Address    Access  R/W   Size  Description
0x00       GPL,SL  R/O      1  Log Directory
0x01           SL  R/O      1  Summary SMART error log
0x02           SL  R/O      5  Comprehensive SMART error log
0x03       GPL     R/O      6  Ext. Comprehensive SMART error log
0x06           SL  R/O      1  SMART self-test log
0x07       GPL     R/O      1  Extended self-test log
0x09           SL  R/W      1  Selective self-test log
0x10       GPL     R/O      1  NCQ Command Error log
0x11       GPL     R/O      1  SATA Phy Event Counters log
0x80-0x9f  GPL,SL  R/W     16  Host vendor specific log
0xa0-0xa7  GPL,SL  VS      16  Device vendor specific log
0xa8-0xb7  GPL,SL  VS       1  Device vendor specific log
0xbd       GPL,SL  VS       1  Device vendor specific log
0xc0       GPL,SL  VS       1  Device vendor specific log
0xc1       GPL     VS      93  Device vendor specific log
0xe0       GPL,SL  R/W      1  SCT Command/Status
0xe1       GPL,SL  R/W      1  SCT Data Transfer

SMART Extended Comprehensive Error Log Version: 1 (6 sectors)
Device Error Count: 51 (device log contains only the most recent 24 errors)
	CR     = Command Register
	FEATR  = Features Register
	COUNT  = Count (was: Sector Count) Register
	LBA_48 = Upper bytes of LBA High/Mid/Low Registers ]  ATA-8
	LH     = LBA High (was: Cylinder High) Register    ]   LBA
	LM     = LBA Mid (was: Cylinder Low) Register      ] Register
	LL     = LBA Low (was: Sector Number) Register     ]
	DV     = Device (was: Device/Head) Register
	DC     = Device Control Register
	ER     = Error register
	ST     = Status register
Powered_Up_Time is measured from power on, and printed as
DDd+hh:mm:SS.sss where DD=days, hh=hours, mm=minutes,
SS=sec, and sss=millisec. It "wraps" after 49.710 days.

Error 51 [2] occurred at disk power-on lifetime: 32866 hours (1369 days + 10 hours)
  When the command that caused the error occurred, the device was active or idle.

  After command completion occurred, registers were:
  ER -- ST COUNT  LBA_48  LH LM LL DV DC
  -- -- -- == -- == == == -- -- -- -- --
  40 -- 51 00 00 00 00 18 e4 5f 18 40 00  Error: UNC at LBA = 0x18e45f18 = 417619736

  Commands leading to the command that caused the error were:
  CR FEATR COUNT  LBA_48  LH LM LL DV DC  Powered_Up_Time  Command/Feature_Name
  -- == -- == -- == == == -- -- -- -- --  ---------------  --------------------
  60 01 00 00 20 00 00 18 e4 64 e0 40 00 32d+01:54:10.312  READ FPDMA QUEUED
  60 01 00 00 18 00 00 18 e4 63 e0 40 00 32d+01:54:10.312  READ FPDMA QUEUED
  60 01 00 00 10 00 00 18 e4 62 e0 40 00 32d+01:54:10.312  READ FPDMA QUEUED
  60 01 00 00 08 00 00 18 e4 61 e0 40 00 32d+01:54:10.312  READ FPDMA QUEUED
  60 01 00 00 f8 00 00 18 e4 60 e0 40 00 32d+01:54:10.312  READ FPDMA QUEUED

Error 50 [1] occurred at disk power-on lifetime: 32866 hours (1369 days + 10 hours)
  When the command that caused the error occurred, the device was active or idle.

  After command completion occurred, registers were:
  ER -- ST COUNT  LBA_48  LH LM LL DV DC
  -- -- -- == -- == == == -- -- -- -- --
  40 -- 51 00 00 00 00 18 e4 5f 18 40 00  Error: UNC at LBA = 0x18e45f18 = 417619736

  Commands leading to the command that caused the error were:
  CR FEATR COUNT  LBA_48  LH LM LL DV DC  Powered_Up_Time  Command/Feature_Name
  -- == -- == -- == == == -- -- -- -- --  ---------------  --------------------
  60 01 00 00 d8 00 00 18 e4 64 e0 40 00 32d+01:53:37.431  READ FPDMA QUEUED
  60 01 00 00 d0 00 00 18 e4 63 e0 40 00 32d+01:53:37.431  READ FPDMA QUEUED
  60 01 00 00 c8 00 00 18 e4 62 e0 40 00 32d+01:53:37.431  READ FPDMA QUEUED
  60 01 00 00 c0 00 00 18 e4 61 e0 40 00 32d+01:53:37.431  READ FPDMA QUEUED
  60 01 00 00 b8 00 00 18 e4 60 e0 40 00 32d+01:53:37.431  READ FPDMA QUEUED

Error 49 [0] occurred at disk power-on lifetime: 32866 hours (1369 days + 10 hours)
  When the command that caused the error occurred, the device was active or idle.

  After command completion occurred, registers were:
  ER -- ST COUNT  LBA_48  LH LM LL DV DC
  -- -- -- == -- == == == -- -- -- -- --
  40 -- 51 00 01 00 00 04 15 d3 50 40 00  Error: UNC at LBA = 0x0415d350 = 68539216

  Commands leading to the command that caused the error were:
  CR FEATR COUNT  LBA_48  LH LM LL DV DC  Powered_Up_Time  Command/Feature_Name
  -- == -- == -- == == == -- -- -- -- --  ---------------  --------------------
  60 01 00 00 78 00 00 04 15 d2 a8 40 00 32d+01:53:16.966  READ FPDMA QUEUED
  60 01 00 00 70 00 00 04 15 d1 a8 40 00 32d+01:53:16.945  READ FPDMA QUEUED
  60 01 00 00 68 00 00 04 15 d0 a8 40 00 32d+01:53:16.945  READ FPDMA QUEUED
  60 00 08 00 60 00 00 04 15 d0 c8 40 00 32d+01:53:16.945  READ FPDMA QUEUED
  60 00 01 00 58 00 00 29 d0 f3 d8 40 00 32d+01:53:16.937  READ FPDMA QUEUED

Error 48 [23] occurred at disk power-on lifetime: 32765 hours (1365 days + 5 hours)
  When the command that caused the error occurred, the device was active or idle.

  After command completion occurred, registers were:
  ER -- ST COUNT  LBA_48  LH LM LL DV DC
  -- -- -- == -- == == == -- -- -- -- --
  40 -- 51 00 00 00 00 18 e4 5f 18 40 00  Error: UNC at LBA = 0x18e45f18 = 417619736

  Commands leading to the command that caused the error were:
  CR FEATR COUNT  LBA_48  LH LM LL DV DC  Powered_Up_Time  Command/Feature_Name
  -- == -- == -- == == == -- -- -- -- --  ---------------  --------------------
  60 01 00 00 28 00 00 18 e4 64 e0 40 00 27d+20:37:21.985  READ FPDMA QUEUED
  60 01 00 00 20 00 00 18 e4 63 e0 40 00 27d+20:37:21.985  READ FPDMA QUEUED
  60 01 00 00 18 00 00 18 e4 62 e0 40 00 27d+20:37:21.985  READ FPDMA QUEUED
  60 01 00 00 10 00 00 18 e4 61 e0 40 00 27d+20:37:21.985  READ FPDMA QUEUED
  60 01 00 00 08 00 00 18 e4 60 e0 40 00 27d+20:37:21.985  READ FPDMA QUEUED

Error 47 [22] occurred at disk power-on lifetime: 32765 hours (1365 days + 5 hours)
  When the command that caused the error occurred, the device was active or idle.

  After command completion occurred, registers were:
  ER -- ST COUNT  LBA_48  LH LM LL DV DC
  -- -- -- == -- == == == -- -- -- -- --
  40 -- 51 00 00 00 00 18 e4 5f 18 40 00  Error: UNC at LBA = 0x18e45f18 = 417619736

  Commands leading to the command that caused the error were:
  CR FEATR COUNT  LBA_48  LH LM LL DV DC  Powered_Up_Time  Command/Feature_Name
  -- == -- == -- == == == -- -- -- -- --  ---------------  --------------------
  60 01 00 00 30 00 00 18 e4 64 e0 40 00 27d+20:36:49.559  READ FPDMA QUEUED
  60 01 00 00 28 00 00 18 e4 63 e0 40 00 27d+20:36:49.559  READ FPDMA QUEUED
  60 01 00 00 20 00 00 18 e4 62 e0 40 00 27d+20:36:49.559  READ FPDMA QUEUED
  60 01 00 00 18 00 00 18 e4 61 e0 40 00 27d+20:36:49.559  READ FPDMA QUEUED
  60 01 00 00 10 00 00 18 e4 60 e0 40 00 27d+20:36:49.559  READ FPDMA QUEUED

Error 46 [21] occurred at disk power-on lifetime: 32765 hours (1365 days + 5 hours)
  When the command that caused the error occurred, the device was active or idle.

  After command completion occurred, registers were:
  ER -- ST COUNT  LBA_48  LH LM LL DV DC
  -- -- -- == -- == == == -- -- -- -- --
  40 -- 51 00 01 00 00 04 15 d3 50 40 00  Error: UNC at LBA = 0x0415d350 = 68539216

  Commands leading to the command that caused the error were:
  CR FEATR COUNT  LBA_48  LH LM LL DV DC  Powered_Up_Time  Command/Feature_Name
  -- == -- == -- == == == -- -- -- -- --  ---------------  --------------------
  60 01 00 00 60 00 00 04 15 d2 a8 40 00 27d+20:36:29.802  READ FPDMA QUEUED
  60 01 00 00 58 00 00 04 15 d1 a8 40 00 27d+20:36:29.782  READ FPDMA QUEUED
  60 01 00 00 50 00 00 04 15 d0 a8 40 00 27d+20:36:29.782  READ FPDMA QUEUED
  60 00 08 00 48 00 00 04 15 d0 c8 40 00 27d+20:36:29.781  READ FPDMA QUEUED
  60 00 01 00 40 00 00 29 d0 f3 d8 40 00 27d+20:36:29.773  READ FPDMA QUEUED

Error 45 [20] occurred at disk power-on lifetime: 32651 hours (1360 days + 11 hours)
  When the command that caused the error occurred, the device was active or idle.

  After command completion occurred, registers were:
  ER -- ST COUNT  LBA_48  LH LM LL DV DC
  -- -- -- == -- == == == -- -- -- -- --
  40 -- 51 00 00 00 00 18 e4 5f 18 40 00  Error: UNC at LBA = 0x18e45f18 = 417619736

  Commands leading to the command that caused the error were:
  CR FEATR COUNT  LBA_48  LH LM LL DV DC  Powered_Up_Time  Command/Feature_Name
  -- == -- == -- == == == -- -- -- -- --  ---------------  --------------------
  60 01 00 00 f8 00 00 18 e4 64 e0 40 00 23d+03:17:09.572  READ FPDMA QUEUED
  60 01 00 00 f0 00 00 18 e4 63 e0 40 00 23d+03:17:09.572  READ FPDMA QUEUED
  60 01 00 00 e8 00 00 18 e4 62 e0 40 00 23d+03:17:09.572  READ FPDMA QUEUED
  60 01 00 00 e0 00 00 18 e4 61 e0 40 00 23d+03:17:09.572  READ FPDMA QUEUED
  60 01 00 00 d8 00 00 18 e4 60 e0 40 00 23d+03:17:09.572  READ FPDMA QUEUED

Error 44 [19] occurred at disk power-on lifetime: 32651 hours (1360 days + 11 hours)
  When the command that caused the error occurred, the device was active or idle.

  After command completion occurred, registers were:
  ER -- ST COUNT  LBA_48  LH LM LL DV DC
  -- -- -- == -- == == == -- -- -- -- --
  40 -- 51 00 00 00 00 18 e4 5f 18 40 00  Error: UNC at LBA = 0x18e45f18 = 417619736

  Commands leading to the command that caused the error were:
  CR FEATR COUNT  LBA_48  LH LM LL DV DC  Powered_Up_Time  Command/Feature_Name
  -- == -- == -- == == == -- -- -- -- --  ---------------  --------------------
  60 01 00 00 58 00 00 18 e4 64 e0 40 00 23d+02:58:43.884  READ FPDMA QUEUED
  60 01 00 00 50 00 00 18 e4 63 e0 40 00 23d+02:58:43.884  READ FPDMA QUEUED
  60 01 00 00 48 00 00 18 e4 62 e0 40 00 23d+02:58:43.884  READ FPDMA QUEUED
  60 01 00 00 40 00 00 18 e4 61 e0 40 00 23d+02:58:43.884  READ FPDMA QUEUED
  60 01 00 00 38 00 00 18 e4 60 e0 40 00 23d+02:58:43.884  READ FPDMA QUEUED

SMART Extended Self-test Log Version: 1 (1 sectors)
No self-tests have been logged.  [To run self-tests, use: smartctl -t]

SMART Selective self-test log data structure revision number 1
 SPAN  MIN_LBA  MAX_LBA  CURRENT_TEST_STATUS
    1        0        0  Not_testing
    2        0        0  Not_testing
    3        0        0  Not_testing
    4        0        0  Not_testing
    5        0        0  Not_testing
Selective self-test flags (0x0):
  After scanning selected spans, do NOT read-scan remainder of disk.
If Selective self-test is pending on power-up, resume after 0 minute delay.

SCT Status Version:                  3
SCT Version (vendor specific):       258 (0x0102)
Device State:                        Active (0)
Current Temperature:                    31 Celsius
Power Cycle Min/Max Temperature:     19/34 Celsius
Lifetime    Min/Max Temperature:     14/51 Celsius
Under/Over Temperature Limit Count:   0/0
Vendor specific:
00 01 00 00 00 00 00 00 00 00 00 00 00 00 00 00
00 00 00 00 00 00 00 00 00 00 00 00 00 00 00 00

SCT Temperature History Version:     2
Temperature Sampling Period:         1 minute
Temperature Logging Interval:        1 minute
Min/Max recommended Temperature:      0/60 Celsius
Min/Max Temperature Limit:           -41/85 Celsius
Temperature History Size (Index):    478 (192)

SCT Error Recovery Control command not supported

Device Statistics (GP/SMART Log 0x04) not supported

Pending Defects log (GP Log 0x0c) not supported

SATA Phy Event Counters (GP Log 0x11)
ID      Size     Value  Description
0x0001  2            0  Command failed due to ICRC error
0x0002  2            0  R_ERR response for data FIS
0x0003  2            0  R_ERR response for device-to-host data FIS
0x0004  2            0  R_ERR response for host-to-device data FIS
0x0005  2            0  R_ERR response for non-data FIS
0x0006  2            0  R_ERR response for device-to-host non-data FIS
0x0007  2            0  R_ERR response for host-to-device non-data FIS
0x0008  2            0  Device-to-host non-data FIS retries
0x0009  2           85  Transition from drive PhyRdy to drive PhyNRdy
0x000a  2           87  Device-to-host register FISes sent due to a COMRESET
0x000b  2            0  CRC errors within host-to-device FIS
0x000f  2            0  R_ERR response for host-to-device data FIS, CRC
0x0012  2            0  R_ERR response for host-to-device non-data FIS, CRC
0x8000  4      3097043  Vendor specific

