smartctl 7.2 2020-12-30 r5155 [x86_64-linux-5.15.0-101-generic] (local build)
Copyright (C) 2002-20, Bruce Allen, Christian Franke, www.smartmontools.org

=== START OF INFORMATION SECTION ===
Model Family:     Western Digital Caviar Blue EIDE
Device Model:     WDC WD3200AAJB-00WGA0
Serial Number:    --
LU WWN Device Id: 5 0014ee ...
Firmware Version: 00.02C01
User Capacity:    320,072,933,376 bytes [320 GB]
Sector Size:      512 bytes logical/physical
Device is:        In smartctl database [for details use: -P show]
ATA Version is:   ATA8-ACS (minor revision not indicated)
Transport Type:   Parallel, ATA8-APT
Local Time is:    Sun Mar 24 18:57:19 2024 EDT
SMART support is: Available - device has SMART capability.
SMART support is: Enabled
AAM feature is:   Disabled
APM feature is:   Unavailable
Rd look-ahead is: Enabled
Write cache is:   Enabled
DSN feature is:   Unavailable
ATA Security is:  Disabled, NOT FROZEN [SEC1]
Write SCT (Get) Feature Control Command failed: Read of ATA output registers not implemented [JMicron]
Wt Cache Reorder: Unknown (SCT Feature Control command failed)

=== START OF READ SMART DATA SECTION ===
SMART overall-health self-assessment test result: PASSED
See vendor-specific Attribute list for marginal Attributes.

General SMART Values:
Offline data collection status:  (0x84)	Offline data collection activity
					was suspended by an interrupting command from host.
					Auto Offline Data Collection: Enabled.
Self-test execution status:      (   0)	The previous self-test routine completed
					without error or no self-test has ever 
					been run.
Total time to complete Offline 
data collection: 		( 8760) seconds.
Offline data collection
capabilities: 			 (0x7b) SMART execute Offline immediate.
					Auto Offline data collection on/off support.
					Suspend Offline collection upon new
					command.
					Offline surface scan supported.
					Self-test supported.
					Conveyance Self-test supported.
					Selective Self-test supported.
SMART capabilities:            (0x0003)	Saves SMART data before entering
					power-saving mode.
					Supports SMART auto save timer.
Error logging capability:        (0x01)	Error logging supported.
					General Purpose Logging supported.
Short self-test routine 
recommended polling time: 	 (   2) minutes.
Extended self-test routine
recommended polling time: 	 ( 104) minutes.
Conveyance self-test routine
recommended polling time: 	 (   5) minutes.
SCT capabilities: 	       (0x203f)	SCT Status supported.
					SCT Error Recovery Control supported.
					SCT Feature Control supported.
					SCT Data Table supported.

SMART Attributes Data Structure revision number: 16
Vendor Specific SMART Attributes with Thresholds:
ID# ATTRIBUTE_NAME          FLAGS    VALUE WORST THRESH FAIL RAW_VALUE
  1 Raw_Read_Error_Rate     POSR--   200   200   051    -    0
  3 Spin_Up_Time            PO----   153   150   021    -    5325
  4 Start_Stop_Count        -O--CK   099   099   000    -    1380
  5 Reallocated_Sector_Ct   PO--CK   200   200   140    -    0
  7 Seek_Error_Rate         -OSR--   200   200   051    -    0
  9 Power_On_Hours          -O--CK   059   059   000    -    30199
 10 Spin_Retry_Count        -O--C-   100   100   051    -    0
 11 Calibration_Retry_Count -O--C-   100   100   051    -    0
 12 Power_Cycle_Count       -O--CK   100   100   000    -    724
192 Power-Off_Retract_Count -O--CK   200   200   000    -    273
193 Load_Cycle_Count        -O--CK   200   200   000    -    1193
194 Temperature_Celsius     -O---K   103   093   000    -    44
196 Reallocated_Event_Count -O--CK   200   200   000    -    0
197 Current_Pending_Sector  -O--C-   200   199   000    -    0
198 Offline_Uncorrectable   ----C-   200   200   000    -    0
199 UDMA_CRC_Error_Count    -OSRCK   200   200   000    -    0
200 Multi_Zone_Error_Rate   ---R--   189   001   051    Past 713
                            ||||||_ K auto-keep
                            |||||__ C event count
                            ||||___ R error rate
                            |||____ S speed/performance
                            ||_____ O updated online
                            |______ P prefailure warning

ATA_READ_LOG_EXT (addr=0x00:0x00, page=0, n=1) failed: 48-bit ATA commands not implemented [JMicron]
Read GP Log Directory failed

SMART Log Directory Version 1 [multi-sector log support]
Address    Access  R/W   Size  Description
0x00           SL  R/O      1  Log Directory
0x01           SL  R/O      1  Summary SMART error log
0x02           SL  R/O      5  Comprehensive SMART error log
0x06           SL  R/O      1  SMART self-test log
0x09           SL  R/W      1  Selective self-test log
0x80-0x9f      SL  R/W     16  Host vendor specific log
0xa0-0xa7      SL  VS      16  Device vendor specific log
0xa8-0xb7      SL  VS       1  Device vendor specific log
0xc0           SL  VS       1  Device vendor specific log
0xe0           SL  R/W      1  SCT Command/Status
0xe1           SL  R/W      1  SCT Data Transfer

SMART Extended Comprehensive Error Log (GP Log 0x03) not supported

SMART Error Log Version: 1
ATA Error Count: 3
	CR = Command Register [HEX]
	FR = Features Register [HEX]
	SC = Sector Count Register [HEX]
	SN = Sector Number Register [HEX]
	CL = Cylinder Low Register [HEX]
	CH = Cylinder High Register [HEX]
	DH = Device/Head Register [HEX]
	DC = Device Command Register [HEX]
	ER = Error register [HEX]
	ST = Status register [HEX]
Powered_Up_Time is measured from power on, and printed as
DDd+hh:mm:SS.sss where DD=days, hh=hours, mm=minutes,
SS=sec, and sss=millisec. It "wraps" after 49.710 days.

Error 3 occurred at disk power-on lifetime: 29124 hours (1213 days + 12 hours)
  When the command that caused the error occurred, the device was active or idle.

  After command completion occurred, registers were:
  ER ST SC SN CL CH DH
  -- -- -- -- -- -- --
  01 51 f0 3f db 85 e0  Error: AMNF 240 sectors at LBA = 0x0085db3f = 8772415

  Commands leading to the command that caused the error were:
  CR FR SC SN CL CH DH DC   Powered_Up_Time  Command/Feature_Name
  -- -- -- -- -- -- -- --  ----------------  --------------------
  25 03 f0 3f db 85 04 00      13:56:32.295  READ DMA EXT
  25 03 f0 3f db 85 04 00      13:56:23.699  READ DMA EXT
  25 03 f0 3f db 85 04 00      13:56:09.799  READ DMA EXT
  ef 03 45 00 00 00 00 00      13:56:09.785  SET FEATURES [Set transfer mode]
  ef 03 0c 00 00 00 00 00      13:56:09.785  SET FEATURES [Set transfer mode]

Error 2 occurred at disk power-on lifetime: 29124 hours (1213 days + 12 hours)
  When the command that caused the error occurred, the device was active or idle.

  After command completion occurred, registers were:
  ER ST SC SN CL CH DH
  -- -- -- -- -- -- --
  01 51 f0 3f db 85 e0  Error: AMNF 240 sectors at LBA = 0x0085db3f = 8772415

  Commands leading to the command that caused the error were:
  CR FR SC SN CL CH DH DC   Powered_Up_Time  Command/Feature_Name
  -- -- -- -- -- -- -- --  ----------------  --------------------
  25 03 f0 3f db 85 04 00      13:56:23.699  READ DMA EXT
  25 03 f0 3f db 85 04 00      13:56:09.799  READ DMA EXT
  ef 03 45 00 00 00 00 00      13:56:09.785  SET FEATURES [Set transfer mode]
  ef 03 0c 00 00 00 00 00      13:56:09.785  SET FEATURES [Set transfer mode]
  ec 03 a5 5a aa 55 00 00      13:56:09.771  IDENTIFY DEVICE

Error 1 occurred at disk power-on lifetime: 29124 hours (1213 days + 12 hours)
  When the command that caused the error occurred, the device was active or idle.

  After command completion occurred, registers were:
  ER ST SC SN CL CH DH
  -- -- -- -- -- -- --
  01 51 f0 3f db 85 e0  Error: AMNF 240 sectors at LBA = 0x0085db3f = 8772415

  Commands leading to the command that caused the error were:
  CR FR SC SN CL CH DH DC   Powered_Up_Time  Command/Feature_Name
  -- -- -- -- -- -- -- --  ----------------  --------------------
  25 03 f0 3f db 85 04 00      13:56:09.799  READ DMA EXT
  ef 03 45 00 00 00 00 00      13:56:09.785  SET FEATURES [Set transfer mode]
  ef 03 0c 00 00 00 00 00      13:56:09.785  SET FEATURES [Set transfer mode]
  ec 03 a5 5a aa 55 00 00      13:56:09.771  IDENTIFY DEVICE
  ef 03 45 00 00 00 00 00      13:56:07.126  SET FEATURES [Set transfer mode]

SMART Extended Self-test Log (GP Log 0x07) not supported

SMART Self-test log structure revision number 1
No self-tests have been logged.  [To run self-tests, use: smartctl -t]

SMART Selective self-test log data structure revision number 1
 SPAN  MIN_LBA  MAX_LBA  CURRENT_TEST_STATUS
    1        0        0  Not_testing
    2        0        0  Not_testing
    3        0        0  Not_testing
    4        0        0  Not_testing
    5        0        0  Not_testing
Selective self-test flags (0x0):
  After scanning selected spans, do NOT read-scan remainder of disk.
If Selective self-test is pending on power-up, resume after 0 minute delay.

SCT Status Version:                  2
SCT Version (vendor specific):       258 (0x0102)
Device State:                        SMART Off-line Data Collection executing in background (4)
Current Temperature:                    44 Celsius
Power Cycle Min/Max Temperature:     15/44 Celsius
Lifetime    Min/Max Temperature:     15/54 Celsius
Under/Over Temperature Limit Count:   0/0

SCT Temperature History Version:     2
Temperature Sampling Period:         1 minute
Temperature Logging Interval:        1 minute
Min/Max recommended Temperature:      0/60 Celsius
Min/Max Temperature Limit:            1/85 Celsius
Temperature History Size (Index):    128 (61)

Write SCT (Get) Error Recovery Control Command failed: Read of ATA output registers not implemented [JMicron]
SCT (Get) Error Recovery Control command failed

Device Statistics (GP/SMART Log 0x04) not supported

Pending Defects log (GP Log 0x0c) not supported

SATA Phy Event Counters (GP Log 0x11) not supported

