smartctl 7.3 2022-02-28 r5338 [x86_64-linux-5.15.55-1-MANJARO] (local build)
Copyright (C) 2002-22, Bruce Allen, Christian Franke, www.smartmontools.org

=== START OF INFORMATION SECTION ===
Model Family:     Hitachi Travelstar 5K250
Device Model:     HTS542516K9A300
Serial Number:    --
LU WWN Device Id: 5 000cca ...
Firmware Version: BBCOC3EP
User Capacity:    160,041,885,696 bytes [160 GB]
Sector Size:      512 bytes logical/physical
Device is:        In smartctl database 7.3/5319
ATA Version is:   ATA8-ACS T13/1699-D revision 3f
SATA Version is:  SATA 2.5, 3.0 Gb/s
Local Time is:    Sat Jul 23 15:06:30 2022 -03
SMART support is: Available - device has SMART capability.
SMART support is: Enabled
AAM feature is:   Disabled
APM level is:     128 (minimum power consumption without standby)
Rd look-ahead is: Enabled
Write cache is:   Enabled
DSN feature is:   Unavailable
ATA Security is:  Disabled, NOT FROZEN [SEC1]
Wt Cache Reorder: Enabled

=== START OF READ SMART DATA SECTION ===
SMART overall-health self-assessment test result: PASSED

General SMART Values:
Offline data collection status:  (0x00)	Offline data collection activity
					was never started.
					Auto Offline Data Collection: Disabled.
Self-test execution status:      (   0)	The previous self-test routine completed
					without error or no self-test has ever 
					been run.
Total time to complete Offline 
data collection: 		(  645) seconds.
Offline data collection
capabilities: 			 (0x5b) SMART execute Offline immediate.
					Auto Offline data collection on/off support.
					Suspend Offline collection upon new
					command.
					Offline surface scan supported.
					Self-test supported.
					No Conveyance Self-test supported.
					Selective Self-test supported.
SMART capabilities:            (0x0003)	Saves SMART data before entering
					power-saving mode.
					Supports SMART auto save timer.
Error logging capability:        (0x01)	Error logging supported.
					General Purpose Logging supported.
Short self-test routine 
recommended polling time: 	 (   2) minutes.
Extended self-test routine
recommended polling time: 	 (  75) minutes.
SCT capabilities: 	       (0x003d)	SCT Status supported.
					SCT Error Recovery Control supported.
					SCT Feature Control supported.
					SCT Data Table supported.

SMART Attributes Data Structure revision number: 16
Vendor Specific SMART Attributes with Thresholds:
ID# ATTRIBUTE_NAME          FLAGS    VALUE WORST THRESH FAIL RAW_VALUE
  1 Raw_Read_Error_Rate     PO-R--   100   100   062    -    0
  2 Throughput_Performance  P-S---   100   100   040    -    0
  3 Spin_Up_Time            POS---   253   253   033    -    2
  4 Start_Stop_Count        -O--C-   097   097   000    -    5501
  5 Reallocated_Sector_Ct   PO--CK   100   100   005    -    0
  7 Seek_Error_Rate         PO-R--   100   100   067    -    0
  8 Seek_Time_Performance   P-S---   100   100   040    -    0
  9 Power_On_Hours          -O--C-   060   060   000    -    17956
 10 Spin_Retry_Count        PO--C-   100   100   060    -    0
 12 Power_Cycle_Count       -O--CK   098   098   000    -    4358
191 G-Sense_Error_Rate      -O-R--   100   100   000    -    0
192 Power-Off_Retract_Count -O--CK   099   099   000    -    379
193 Load_Cycle_Count        -O--C-   088   088   000    -    127738
194 Temperature_Celsius     -O----   177   177   000    -    31 (Min/Max 17/56)
196 Reallocated_Event_Count -O--CK   100   100   000    -    59
197 Current_Pending_Sector  -O---K   100   100   000    -    0
198 Offline_Uncorrectable   ---R--   100   100   000    -    0
199 UDMA_CRC_Error_Count    -O-R--   200   200   000    -    1
223 Load_Retry_Count        -O-R--   100   100   000    -    0
                            ||||||_ K auto-keep
                            |||||__ C event count
                            ||||___ R error rate
                            |||____ S speed/performance
                            ||_____ O updated online
                            |______ P prefailure warning

General Purpose Log Directory Version 1
SMART           Log Directory Version 1 [multi-sector log support]
Address    Access  R/W   Size  Description
0x00       GPL,SL  R/O      1  Log Directory
0x01           SL  R/O      1  Summary SMART error log
0x02           SL  R/O      1  Comprehensive SMART error log
0x03       GPL     R/O      1  Ext. Comprehensive SMART error log
0x06           SL  R/O      1  SMART self-test log
0x07       GPL     R/O      1  Extended self-test log
0x09           SL  R/W      1  Selective self-test log
0x10       GPL     R/O      1  NCQ Command Error log
0x11       GPL     R/O      1  SATA Phy Event Counters log
0x80-0x9f  GPL,SL  R/W     16  Host vendor specific log

SMART Extended Comprehensive Error Log Version: 1 (1 sectors)
Device Error Count: 1855 (device log contains only the most recent 4 errors)
	CR     = Command Register
	FEATR  = Features Register
	COUNT  = Count (was: Sector Count) Register
	LBA_48 = Upper bytes of LBA High/Mid/Low Registers ]  ATA-8
	LH     = LBA High (was: Cylinder High) Register    ]   LBA
	LM     = LBA Mid (was: Cylinder Low) Register      ] Register
	LL     = LBA Low (was: Sector Number) Register     ]
	DV     = Device (was: Device/Head) Register
	DC     = Device Control Register
	ER     = Error register
	ST     = Status register
Powered_Up_Time is measured from power on, and printed as
DDd+hh:mm:SS.sss where DD=days, hh=hours, mm=minutes,
SS=sec, and sss=millisec. It "wraps" after 49.710 days.

Error 1855 [2] occurred at disk power-on lifetime: 15065 hours (627 days + 17 hours)
  When the command that caused the error occurred, the device was active or idle.

  After command completion occurred, registers were:
  ER -- ST COUNT  LBA_48  LH LM LL DV DC
  -- -- -- == -- == == == -- -- -- -- --
  40 -- 51 00 08 37 91 08 b8 9d 18 e8 00  Error: UNC 8 sectors at LBA = 0x379108b89d18 = 61096056102168

  Commands leading to the command that caused the error were:
  CR FEATR COUNT  LBA_48  LH LM LL DV DC  Powered_Up_Time  Command/Feature_Name
  -- == -- == -- == == == -- -- -- -- --  ---------------  --------------------
  c8 00 00 00 08 37 91 47 b8 9d 18 e8 08     10:10:06.100  READ DMA
  ea 00 00 00 00 00 00 0a 37 91 47 a0 08     10:10:06.100  FLUSH CACHE EXT
  ca 00 00 00 08 37 91 3f 37 91 40 ea 08     10:10:06.100  WRITE DMA
  ea 00 00 00 00 00 00 0a 37 91 3f a0 08     10:10:06.100  FLUSH CACHE EXT
  ca 00 00 00 50 f9 f4 ff 37 90 f0 ea 08     10:10:06.100  WRITE DMA

Error 1854 [1] occurred at disk power-on lifetime: 15065 hours (627 days + 17 hours)
  When the command that caused the error occurred, the device was active or idle.

  After command completion occurred, registers were:
  ER -- ST COUNT  LBA_48  LH LM LL DV DC
  -- -- -- == -- == == == -- -- -- -- --
  40 -- 51 00 08 37 0f 08 b8 9d 18 e8 00  Error: UNC 8 sectors at LBA = 0x370f08b89d18 = 60537710353688

  Commands leading to the command that caused the error were:
  CR FEATR COUNT  LBA_48  LH LM LL DV DC  Powered_Up_Time  Command/Feature_Name
  -- == -- == -- == == == -- -- -- -- --  ---------------  --------------------
  c8 00 00 00 08 37 0f 6f b8 9d 18 e8 08     10:03:48.600  READ DMA
  ea 00 00 00 00 00 00 0a 37 0f 6f a0 08     10:03:48.600  FLUSH CACHE EXT
  ca 00 00 00 08 37 0f 67 37 0f 68 ea 08     10:03:48.600  WRITE DMA
  ea 00 00 00 00 00 00 0a 37 0f 67 a0 08     10:03:48.500  FLUSH CACHE EXT
  ca 00 00 00 50 c4 7f 17 37 0f 18 ea 08     10:03:48.500  WRITE DMA

Error 1853 [0] occurred at disk power-on lifetime: 15065 hours (627 days + 17 hours)
  When the command that caused the error occurred, the device was active or idle.

  After command completion occurred, registers were:
  ER -- ST COUNT  LBA_48  LH LM LL DV DC
  -- -- -- == -- == == == -- -- -- -- --
  40 -- 51 00 08 36 61 08 b8 9d 18 e8 00  Error: UNC 8 sectors at LBA = 0x366108b89d18 = 59790386044184

  Commands leading to the command that caused the error were:
  CR FEATR COUNT  LBA_48  LH LM LL DV DC  Powered_Up_Time  Command/Feature_Name
  -- == -- == -- == == == -- -- -- -- --  ---------------  --------------------
  c8 00 00 00 08 36 61 0f b8 9d 18 e8 08     09:56:21.800  READ DMA
  ea 00 00 00 00 00 00 0a 36 61 0f a0 08     09:56:21.700  FLUSH CACHE EXT
  ca 00 00 00 08 36 61 07 36 61 08 ea 08     09:56:21.700  WRITE DMA
  ea 00 00 00 00 00 00 0a 36 61 07 a0 08     09:56:21.700  FLUSH CACHE EXT
  ca 00 00 00 60 1c b1 87 36 60 a8 ea 08     09:56:21.700  WRITE DMA

Error 1852 [3] occurred at disk power-on lifetime: 15065 hours (627 days + 17 hours)
  When the command that caused the error occurred, the device was active or idle.

  After command completion occurred, registers were:
  ER -- ST COUNT  LBA_48  LH LM LL DV DC
  -- -- -- == -- == == == -- -- -- -- --
  40 -- 51 00 68 00 00 08 b8 9d 18 e8 00  Error: UNC 104 sectors at LBA = 0x08b89d18 = 146316568

  Commands leading to the command that caused the error were:
  CR FEATR COUNT  LBA_48  LH LM LL DV DC  Powered_Up_Time  Command/Feature_Name
  -- == -- == -- == == == -- -- -- -- --  ---------------  --------------------
  c8 00 00 00 80 36 33 4f b8 9d 00 e8 08     09:56:01.000  READ DMA
  ca 00 00 01 08 00 00 00 36 33 48 ea 08     09:56:01.000  WRITE DMA
  ea 00 00 00 01 00 00 00 00 00 00 a0 08     09:56:01.000  FLUSH CACHE EXT
  ec 00 00 00 01 1d a0 9f 00 00 00 00 08     09:56:00.900  IDENTIFY DEVICE
  ca 00 00 00 08 1c db 1f 1d a0 98 ed 08     09:56:00.900  WRITE DMA

SMART Extended Self-test Log Version: 1 (1 sectors)
No self-tests have been logged.  [To run self-tests, use: smartctl -t]

SMART Selective self-test log data structure revision number 1
 SPAN  MIN_LBA  MAX_LBA  CURRENT_TEST_STATUS
    1        0        0  Not_testing
    2        0        0  Not_testing
    3        0        0  Not_testing
    4        0        0  Not_testing
    5        0        0  Not_testing
Selective self-test flags (0x0):
  After scanning selected spans, do NOT read-scan remainder of disk.
If Selective self-test is pending on power-up, resume after 0 minute delay.

SCT Status Version:                  3
SCT Version (vendor specific):       256 (0x0100)
Device State:                        Active (0)
Current Temperature:                    31 Celsius
Power Cycle Min/Max Temperature:     27/33 Celsius
Lifetime    Min/Max Temperature:     17/56 Celsius
Specified Max Operating Temperature:    34 Celsius
Under/Over Temperature Limit Count:   0/0

Unexpected SCT status 0x0000 (action_code=5, function_code=0)
Read SCT Temperature History failed

SCT Error Recovery Control:
           Read: Disabled
          Write: Disabled

Device Statistics (GP/SMART Log 0x04) not supported

Pending Defects log (GP Log 0x0c) not supported

SATA Phy Event Counters (GP Log 0x11)
ID      Size     Value  Description
0x0001  2            0  Command failed due to ICRC error
0x0009  2            0  Transition from drive PhyRdy to drive PhyNRdy
0x000a  2            0  Device-to-host register FISes sent due to a COMRESET
0x000b  2            0  CRC errors within host-to-device FIS
0x000d  2            0  Non-CRC errors within host-to-device FIS

