smartctl 7.2 2020-12-30 r5155 [x86_64-linux-5.10.74-generic-2rosa2021.1-x86_64] (local build)
Copyright (C) 2002-20, Bruce Allen, Christian Franke, www.smartmontools.org

=== START OF INFORMATION SECTION ===
Model Family:     Western Digital Caviar Green (AF)
Device Model:     WDC WD7500AARS-003BB1
Serial Number:    --
LU WWN Device Id: 5 0014ee ...
Firmware Version: 80.00A80
User Capacity:    750,155,292,160 bytes [750 GB]
Sector Size:      512 bytes logical/physical
Device is:        In smartctl database [for details use: -P show]
ATA Version is:   ATA8-ACS (minor revision not indicated)
SATA Version is:  SATA 2.6, 3.0 Gb/s
Local Time is:    Fri May 20 18:54:40 2022 MSK
SMART support is: Available - device has SMART capability.
SMART support is: Enabled
AAM level is:     128 (quiet), recommended: 128
APM feature is:   Unavailable
Rd look-ahead is: Enabled
Write cache is:   Enabled
DSN feature is:   Unavailable
ATA Security is:  Disabled, frozen [SEC2]
Wt Cache Reorder: Enabled

=== START OF READ SMART DATA SECTION ===
SMART overall-health self-assessment test result: PASSED

General SMART Values:
Offline data collection status:  (0x84)	Offline data collection activity
					was suspended by an interrupting command from host.
					Auto Offline Data Collection: Enabled.
Self-test execution status:      (   0)	The previous self-test routine completed
					without error or no self-test has ever 
					been run.
Total time to complete Offline 
data collection: 		(16260) seconds.
Offline data collection
capabilities: 			 (0x7b) SMART execute Offline immediate.
					Auto Offline data collection on/off support.
					Suspend Offline collection upon new
					command.
					Offline surface scan supported.
					Self-test supported.
					Conveyance Self-test supported.
					Selective Self-test supported.
SMART capabilities:            (0x0003)	Saves SMART data before entering
					power-saving mode.
					Supports SMART auto save timer.
Error logging capability:        (0x01)	Error logging supported.
					General Purpose Logging supported.
Short self-test routine 
recommended polling time: 	 (   2) minutes.
Extended self-test routine
recommended polling time: 	 ( 160) minutes.
Conveyance self-test routine
recommended polling time: 	 (   5) minutes.
SCT capabilities: 	       (0x3035)	SCT Status supported.
					SCT Feature Control supported.
					SCT Data Table supported.

SMART Attributes Data Structure revision number: 16
Vendor Specific SMART Attributes with Thresholds:
ID# ATTRIBUTE_NAME          FLAGS    VALUE WORST THRESH FAIL RAW_VALUE
  1 Raw_Read_Error_Rate     POSR-K   190   186   051    -    23415
  3 Spin_Up_Time            POS--K   131   129   021    -    6408
  4 Start_Stop_Count        -O--CK   098   098   000    -    2093
  5 Reallocated_Sector_Ct   PO--CK   200   200   140    -    2
  7 Seek_Error_Rate         -OSR-K   200   200   000    -    0
  9 Power_On_Hours          -O--CK   082   082   000    -    13697
 10 Spin_Retry_Count        -O--CK   100   100   000    -    0
 11 Calibration_Retry_Count -O--CK   100   100   000    -    0
 12 Power_Cycle_Count       -O--CK   099   099   000    -    1990
192 Power-Off_Retract_Count -O--CK   200   200   000    -    682
193 Load_Cycle_Count        -O--CK   026   026   000    -    523983
194 Temperature_Celsius     -O---K   112   102   000    -    35
196 Reallocated_Event_Count -O--CK   198   198   000    -    2
197 Current_Pending_Sector  -O--CK   200   195   000    -    0
198 Offline_Uncorrectable   ----CK   200   196   000    -    0
199 UDMA_CRC_Error_Count    -O--CK   200   200   000    -    0
200 Multi_Zone_Error_Rate   ---R--   200   199   000    -    2
                            ||||||_ K auto-keep
                            |||||__ C event count
                            ||||___ R error rate
                            |||____ S speed/performance
                            ||_____ O updated online
                            |______ P prefailure warning

General Purpose Log Directory Version 1
SMART           Log Directory Version 1 [multi-sector log support]
Address    Access  R/W   Size  Description
0x00       GPL,SL  R/O      1  Log Directory
0x01           SL  R/O      1  Summary SMART error log
0x02           SL  R/O      5  Comprehensive SMART error log
0x03       GPL     R/O      6  Ext. Comprehensive SMART error log
0x06           SL  R/O      1  SMART self-test log
0x07       GPL     R/O      1  Extended self-test log
0x09           SL  R/W      1  Selective self-test log
0x10       GPL     R/O      1  NCQ Command Error log
0x11       GPL     R/O      1  SATA Phy Event Counters log
0x80-0x9f  GPL,SL  R/W     16  Host vendor specific log
0xa0-0xa7  GPL,SL  VS      16  Device vendor specific log
0xa8-0xb7  GPL,SL  VS       1  Device vendor specific log
0xc0       GPL,SL  VS       1  Device vendor specific log
0xc1       GPL     VS      93  Device vendor specific log
0xe0       GPL,SL  R/W      1  SCT Command/Status
0xe1       GPL,SL  R/W      1  SCT Data Transfer

SMART Extended Comprehensive Error Log Version: 1 (6 sectors)
Device Error Count: 36877 (device log contains only the most recent 24 errors)
	CR     = Command Register
	FEATR  = Features Register
	COUNT  = Count (was: Sector Count) Register
	LBA_48 = Upper bytes of LBA High/Mid/Low Registers ]  ATA-8
	LH     = LBA High (was: Cylinder High) Register    ]   LBA
	LM     = LBA Mid (was: Cylinder Low) Register      ] Register
	LL     = LBA Low (was: Sector Number) Register     ]
	DV     = Device (was: Device/Head) Register
	DC     = Device Control Register
	ER     = Error register
	ST     = Status register
Powered_Up_Time is measured from power on, and printed as
DDd+hh:mm:SS.sss where DD=days, hh=hours, mm=minutes,
SS=sec, and sss=millisec. It "wraps" after 49.710 days.

Error 36877 [12] occurred at disk power-on lifetime: 10322 hours (430 days + 2 hours)
  When the command that caused the error occurred, the device was active or idle.

  After command completion occurred, registers were:
  ER -- ST COUNT  LBA_48  LH LM LL DV DC
  -- -- -- == -- == == == -- -- -- -- --
  04 -- 51 00 01 00 00 00 00 00 00 a0 00  Error: ABRT

  Commands leading to the command that caused the error were:
  CR FEATR COUNT  LBA_48  LH LM LL DV DC  Powered_Up_Time  Command/Feature_Name
  -- == -- == -- == == == -- -- -- -- --  ---------------  --------------------
  b0 00 d6 00 01 00 00 00 c2 4f e0 a0 00     01:04:26.813  SMART WRITE LOG
  b0 00 d6 00 01 00 00 00 c2 4f e0 a0 00     01:04:26.813  SMART WRITE LOG
  b0 00 d6 00 01 00 00 00 c2 4f e0 a0 00     01:04:26.812  SMART WRITE LOG
  b0 00 d0 00 01 00 00 00 c2 4f 01 a0 00     01:03:59.774  SMART READ DATA
  b0 00 d0 00 01 00 00 00 c2 4f 01 a0 00     01:02:57.657  SMART READ DATA

Error 36876 [11] occurred at disk power-on lifetime: 10322 hours (430 days + 2 hours)
  When the command that caused the error occurred, the device was active or idle.

  After command completion occurred, registers were:
  ER -- ST COUNT  LBA_48  LH LM LL DV DC
  -- -- -- == -- == == == -- -- -- -- --
  04 -- 51 00 01 00 00 00 00 00 00 a0 00  Error: ABRT

  Commands leading to the command that caused the error were:
  CR FEATR COUNT  LBA_48  LH LM LL DV DC  Powered_Up_Time  Command/Feature_Name
  -- == -- == -- == == == -- -- -- -- --  ---------------  --------------------
  b0 00 d6 00 01 00 00 00 c2 4f e0 a0 00     01:04:26.813  SMART WRITE LOG
  b0 00 d6 00 01 00 00 00 c2 4f e0 a0 00     01:04:26.812  SMART WRITE LOG
  b0 00 d0 00 01 00 00 00 c2 4f 01 a0 00     01:03:59.774  SMART READ DATA
  b0 00 d0 00 01 00 00 00 c2 4f 01 a0 00     01:02:57.657  SMART READ DATA
  b0 00 d0 00 01 00 00 00 c2 4f 01 a0 00     01:01:55.498  SMART READ DATA

Error 36875 [10] occurred at disk power-on lifetime: 10322 hours (430 days + 2 hours)
  When the command that caused the error occurred, the device was doing SMART Offline or Self-test.

  After command completion occurred, registers were:
  ER -- ST COUNT  LBA_48  LH LM LL DV DC
  -- -- -- == -- == == == -- -- -- -- --
  04 -- 51 00 01 00 00 00 00 00 00 a0 00  Error: ABRT

  Commands leading to the command that caused the error were:
  CR FEATR COUNT  LBA_48  LH LM LL DV DC  Powered_Up_Time  Command/Feature_Name
  -- == -- == -- == == == -- -- -- -- --  ---------------  --------------------
  b0 00 d6 00 01 00 00 00 c2 4f e0 a0 00     01:04:26.812  SMART WRITE LOG
  b0 00 d0 00 01 00 00 00 c2 4f 01 a0 00     01:03:59.774  SMART READ DATA
  b0 00 d0 00 01 00 00 00 c2 4f 01 a0 00     01:02:57.657  SMART READ DATA
  b0 00 d0 00 01 00 00 00 c2 4f 01 a0 00     01:01:55.498  SMART READ DATA
  b0 00 d0 00 01 00 00 00 c2 4f 01 a0 00     01:00:53.531  SMART READ DATA

Error 36874 [9] occurred at disk power-on lifetime: 6737 hours (280 days + 17 hours)
  When the command that caused the error occurred, the device was active or idle.

  After command completion occurred, registers were:
  ER -- ST COUNT  LBA_48  LH LM LL DV DC
  -- -- -- == -- == == == -- -- -- -- --
  40 -- 51 00 00 00 00 00 39 28 80 40 00  Error: UNC at LBA = 0x00392880 = 3745920

  Commands leading to the command that caused the error were:
  CR FEATR COUNT  LBA_48  LH LM LL DV DC  Powered_Up_Time  Command/Feature_Name
  -- == -- == -- == == == -- -- -- -- --  ---------------  --------------------
  60 01 00 00 f8 00 00 00 39 2f 00 40 00     00:02:59.909  READ FPDMA QUEUED
  60 01 00 00 f0 00 00 00 39 2e 00 40 00     00:02:59.909  READ FPDMA QUEUED
  60 01 00 00 e8 00 00 00 39 2d 00 40 00     00:02:59.909  READ FPDMA QUEUED
  60 01 00 00 e0 00 00 00 39 2c 00 40 00     00:02:59.909  READ FPDMA QUEUED
  60 01 00 00 d8 00 00 00 39 2b 00 40 00     00:02:59.909  READ FPDMA QUEUED

Error 36873 [8] occurred at disk power-on lifetime: 6737 hours (280 days + 17 hours)
  When the command that caused the error occurred, the device was active or idle.

  After command completion occurred, registers were:
  ER -- ST COUNT  LBA_48  LH LM LL DV DC
  -- -- -- == -- == == == -- -- -- -- --
  40 -- 51 00 00 00 00 00 37 00 a8 40 00  Error: UNC at LBA = 0x003700a8 = 3604648

  Commands leading to the command that caused the error were:
  CR FEATR COUNT  LBA_48  LH LM LL DV DC  Powered_Up_Time  Command/Feature_Name
  -- == -- == -- == == == -- -- -- -- --  ---------------  --------------------
  60 01 00 00 c8 00 00 00 37 07 00 40 00     00:02:56.323  READ FPDMA QUEUED
  60 01 00 00 c0 00 00 00 37 06 00 40 00     00:02:56.323  READ FPDMA QUEUED
  60 01 00 00 b8 00 00 00 37 05 00 40 00     00:02:56.323  READ FPDMA QUEUED
  60 01 00 00 b0 00 00 00 37 04 00 40 00     00:02:56.323  READ FPDMA QUEUED
  60 01 00 00 a8 00 00 00 37 03 00 40 00     00:02:56.323  READ FPDMA QUEUED

Error 36872 [7] occurred at disk power-on lifetime: 6737 hours (280 days + 17 hours)
  When the command that caused the error occurred, the device was active or idle.

  After command completion occurred, registers were:
  ER -- ST COUNT  LBA_48  LH LM LL DV DC
  -- -- -- == -- == == == -- -- -- -- --
  40 -- 51 00 00 00 00 00 33 00 b8 40 00  Error: UNC at LBA = 0x003300b8 = 3342520

  Commands leading to the command that caused the error were:
  CR FEATR COUNT  LBA_48  LH LM LL DV DC  Powered_Up_Time  Command/Feature_Name
  -- == -- == -- == == == -- -- -- -- --  ---------------  --------------------
  60 01 00 00 60 00 00 00 33 07 00 40 00     00:02:52.163  READ FPDMA QUEUED
  60 01 00 00 58 00 00 00 33 06 00 40 00     00:02:52.162  READ FPDMA QUEUED
  60 01 00 00 50 00 00 00 33 05 00 40 00     00:02:52.162  READ FPDMA QUEUED
  60 01 00 00 48 00 00 00 33 04 00 40 00     00:02:52.162  READ FPDMA QUEUED
  60 01 00 00 40 00 00 00 33 03 00 40 00     00:02:52.162  READ FPDMA QUEUED

Error 36871 [6] occurred at disk power-on lifetime: 6737 hours (280 days + 17 hours)
  When the command that caused the error occurred, the device was active or idle.

  After command completion occurred, registers were:
  ER -- ST COUNT  LBA_48  LH LM LL DV DC
  -- -- -- == -- == == == -- -- -- -- --
  40 -- 51 00 00 00 00 00 32 80 d0 40 00  Error: UNC at LBA = 0x003280d0 = 3309776

  Commands leading to the command that caused the error were:
  CR FEATR COUNT  LBA_48  LH LM LL DV DC  Powered_Up_Time  Command/Feature_Name
  -- == -- == -- == == == -- -- -- -- --  ---------------  --------------------
  60 01 00 00 d8 00 00 00 32 87 00 40 00     00:02:49.119  READ FPDMA QUEUED
  60 01 00 00 d0 00 00 00 32 86 00 40 00     00:02:49.119  READ FPDMA QUEUED
  60 01 00 00 c8 00 00 00 32 85 00 40 00     00:02:49.119  READ FPDMA QUEUED
  60 01 00 00 c0 00 00 00 32 84 00 40 00     00:02:49.119  READ FPDMA QUEUED
  60 01 00 00 b8 00 00 00 32 83 00 40 00     00:02:49.119  READ FPDMA QUEUED

Error 36870 [5] occurred at disk power-on lifetime: 6737 hours (280 days + 17 hours)
  When the command that caused the error occurred, the device was active or idle.

  After command completion occurred, registers were:
  ER -- ST COUNT  LBA_48  LH LM LL DV DC
  -- -- -- == -- == == == -- -- -- -- --
  40 -- 51 00 00 00 00 00 2e b8 88 40 00  Error: UNC at LBA = 0x002eb888 = 3061896

  Commands leading to the command that caused the error were:
  CR FEATR COUNT  LBA_48  LH LM LL DV DC  Powered_Up_Time  Command/Feature_Name
  -- == -- == -- == == == -- -- -- -- --  ---------------  --------------------
  60 01 00 00 40 00 00 00 2e bf 00 40 00     00:02:45.044  READ FPDMA QUEUED
  60 01 00 00 38 00 00 00 2e be 00 40 00     00:02:45.044  READ FPDMA QUEUED
  60 01 00 00 30 00 00 00 2e bd 00 40 00     00:02:45.044  READ FPDMA QUEUED
  60 01 00 00 28 00 00 00 2e bc 00 40 00     00:02:45.044  READ FPDMA QUEUED
  60 01 00 00 20 00 00 00 2e bb 00 40 00     00:02:45.044  READ FPDMA QUEUED

SMART Extended Self-test Log Version: 1 (1 sectors)
Num  Test_Description    Status                  Remaining  LifeTime(hours)  LBA_of_first_error
# 1  Short offline       Completed without error       00%     11744         -
# 2  Short offline       Completed without error       00%      8561         -
# 3  Short offline       Completed without error       00%      8538         -
# 4  Short offline       Completed without error       00%      8459         -
# 5  Short offline       Completed without error       00%      6752         -
# 6  Short offline       Completed: read failure       90%      6660         161568
# 7  Short offline       Completed: read failure       90%      6599         158216
# 8  Extended captive    Interrupted (host reset)      90%      6399         -
# 9  Short captive       Interrupted (host reset)      90%      6399         -
#10  Selective offline   Completed: read failure       90%      6399         194584
#11  Extended offline    Completed: read failure       90%      6399         194584
#12  Short offline       Completed: read failure       90%      6399         194584
#13  Short offline       Completed without error       00%      5508         -
#14  Short offline       Completed without error       00%      5500         -
#15  Short offline       Completed without error       00%      5492         -

SMART Selective self-test log data structure revision number 1
 SPAN  MIN_LBA  MAX_LBA  CURRENT_TEST_STATUS
    1        0        0  Not_testing
    2        0        0  Not_testing
    3        0        0  Not_testing
    4        0        0  Not_testing
    5        0        0  Not_testing
Selective self-test flags (0x0):
  After scanning selected spans, do NOT read-scan remainder of disk.
If Selective self-test is pending on power-up, resume after 0 minute delay.

SCT Status Version:                  3
SCT Version (vendor specific):       258 (0x0102)
Device State:                        Active (0)
Current Temperature:                    35 Celsius
Power Cycle Min/Max Temperature:     26/36 Celsius
Lifetime    Min/Max Temperature:     26/45 Celsius
Under/Over Temperature Limit Count:   0/0

SCT Temperature History Version:     2
Temperature Sampling Period:         1 minute
Temperature Logging Interval:        1 minute
Min/Max recommended Temperature:      0/60 Celsius
Min/Max Temperature Limit:           -41/85 Celsius
Temperature History Size (Index):    478 (272)

SCT Error Recovery Control command not supported

Device Statistics (GP/SMART Log 0x04) not supported

Pending Defects log (GP Log 0x0c) not supported

SATA Phy Event Counters (GP Log 0x11)
ID      Size     Value  Description
0x0001  2            0  Command failed due to ICRC error
0x0002  2            0  R_ERR response for data FIS
0x0003  2            0  R_ERR response for device-to-host data FIS
0x0004  2            0  R_ERR response for host-to-device data FIS
0x0005  2            0  R_ERR response for non-data FIS
0x0006  2            0  R_ERR response for device-to-host non-data FIS
0x0007  2            0  R_ERR response for host-to-device non-data FIS
0x000a  2            2  Device-to-host register FISes sent due to a COMRESET
0x000b  2            0  CRC errors within host-to-device FIS
0x8000  4         2780  Vendor specific



