smartctl 7.4 2023-08-01 r5530 [x86_64-linux-6.6.11-200.fc39.x86_64] (local build)
Copyright (C) 2002-23, Bruce Allen, Christian Franke, www.smartmontools.org

=== START OF INFORMATION SECTION ===
Model Number:                       SAMSUNG MZVL21T0HCLR-00B00
Serial Number:                      --
Firmware Version:                   GXA7601Q
PCI Vendor/Subsystem ID:            0x144d
IEEE OUI Identifier:                0x002538
Total NVM Capacity:                 1,024,209,543,168 [1.02 TB]
Unallocated NVM Capacity:           0
Controller ID:                      6
NVMe Version:                       1.3
Number of Namespaces:               1
Namespace 1 Size/Capacity:          1,024,209,543,168 [1.02 TB]
Namespace 1 Utilization:            143,804,481,536 [143 GB]
Namespace 1 Formatted LBA Size:     512
Namespace 1 IEEE EUI-64:            002538 ...
Local Time is:                      Sat Jan 20 01:04:31 2024 CST
Firmware Updates (0x16):            3 Slots, no Reset required
Optional Admin Commands (0x0017):   Security Format Frmw_DL Self_Test
Optional NVM Commands (0x0057):     Comp Wr_Unc DS_Mngmt Sav/Sel_Feat Timestmp
Log Page Attributes (0x0e):         Cmd_Eff_Lg Ext_Get_Lg Telmtry_Lg
Maximum Data Transfer Size:         128 Pages
Warning  Comp. Temp. Threshold:     81 Celsius
Critical Comp. Temp. Threshold:     85 Celsius

Supported Power States
St Op     Max   Active     Idle   RL RT WL WT  Ent_Lat  Ex_Lat
 0 +     8.37W       -        -    0  0  0  0        0       0
 1 +     8.37W       -        -    1  1  1  1        0     200
 2 +     8.37W       -        -    2  2  2  2        0     200
 3 -   0.0500W       -        -    3  3  3  3     2000    1200
 4 -   0.0050W       -        -    4  4  4  4      500    9500

Supported LBA Sizes (NSID 0x1)
Id Fmt  Data  Metadt  Rel_Perf
 0 +     512       0         0

=== START OF SMART DATA SECTION ===
SMART overall-health self-assessment test result: PASSED

SMART/Health Information (NVMe Log 0x02)
Critical Warning:                   0x00
Temperature:                        43 Celsius
Available Spare:                    100%
Available Spare Threshold:          10%
Percentage Used:                    0%
Data Units Read:                    20,636,565 [10.5 TB]
Data Units Written:                 14,682,501 [7.51 TB]
Host Read Commands:                 300,065,572
Host Write Commands:                209,954,732
Controller Busy Time:               960
Power Cycles:                       1,128
Power On Hours:                     412
Unsafe Shutdowns:                   243
Media and Data Integrity Errors:    0
Error Information Log Entries:      0
Warning  Comp. Temperature Time:    0
Critical Comp. Temperature Time:    0
Temperature Sensor 1:               43 Celsius
Temperature Sensor 2:               44 Celsius

Error Information (NVMe Log 0x01, 16 of 64 entries)
No Errors Logged

Read Self-test Log failed: Invalid Field in Command (0x002)



