smartctl 7.5 2025-04-30 r5714 [x86_64-linux-6.18.0-1-MANJARO] (local build)
Copyright (C) 2002-25, Bruce Allen, Christian Franke, www.smartmontools.org

=== START OF INFORMATION SECTION ===
Model Number:                       Force MP510
Serial Number:                      --
Firmware Version:                   ECFM13.2
PCI Vendor/Subsystem ID:            0x1987
IEEE OUI Identifier:                0x6479a7
Total NVM Capacity:                 4,000,787,030,016 [4.00 TB]
Unallocated NVM Capacity:           0
Controller ID:                      1
NVMe Version:                       1.3
Number of Namespaces:               1
Namespace 1 Size/Capacity:          4,000,787,030,016 [4.00 TB]
Namespace 1 Formatted LBA Size:     512
Namespace 1 IEEE EUI-64:            6479a7 ...
Local Time is:                      Sun Dec  7 12:18:38 2025 ACDT
Firmware Updates (0x12):            1 Slot, no Reset required
Optional Admin Commands (0x0017):   Security Format Frmw_DL Self_Test
Optional NVM Commands (0x005d):     Comp DS_Mngmt Wr_Zero Sav/Sel_Feat Timestmp
Log Page Attributes (0x08):         Telmtry_Lg
Maximum Data Transfer Size:         512 Pages
Warning  Comp. Temp. Threshold:     75 Celsius
Critical Comp. Temp. Threshold:     80 Celsius

Supported Power States
St Op     Max   Active     Idle   RL RT WL WT  Ent_Lat  Ex_Lat
 0 +    15.33W       -        -    0  0  0  0        0       0
 1 +     9.65W       -        -    1  1  1  1        0       0
 2 +     6.82W       -        -    2  2  2  2        0       0
 3 -   0.0490W       -        -    3  3  3  3     2000    2000
 4 -   0.0018W       -        -    4  4  4  4    25000   25000

Supported LBA Sizes (NSID 0x1)
Id Fmt  Data  Metadt  Rel_Perf
 0 +     512       0         2
 1 -    4096       0         1

=== START OF SMART DATA SECTION ===
SMART overall-health self-assessment test result: PASSED

SMART/Health Information (NVMe Log 0x02, NSID 0xffffffff)
Critical Warning:                   0x00
Temperature:                        39 Celsius
Available Spare:                    100%
Available Spare Threshold:          5%
Percentage Used:                    1%
Data Units Read:                    63,548,377 [32.5 TB]
Data Units Written:                 86,228,092 [44.1 TB]
Host Read Commands:                 242,193,781
Host Write Commands:                155,897,706
Controller Busy Time:               2,797
Power Cycles:                       849
Power On Hours:                     21,208
Unsafe Shutdowns:                   129
Media and Data Integrity Errors:    0
Error Information Log Entries:      5,705
Warning  Comp. Temperature Time:    0
Critical Comp. Temperature Time:    0
Thermal Temp. 1 Transition Count:   221
Thermal Temp. 2 Transition Count:   113
Thermal Temp. 1 Total Time:         93711
Thermal Temp. 2 Total Time:         124484

Error Information (NVMe Log 0x01, 16 of 63 entries)
Num   ErrCount  SQId   CmdId  Status  PELoc          LBA  NSID    VS  Message
  0       5705     0  0x001c  0x4004  0x028            0     0     -  Invalid Field in Command

Self-test Log (NVMe Log 0x06, NSID 0xffffffff)
Self-test status: No self-test in progress
Num  Test_Description  Status                       Power_on_Hours  Failing_LBA  NSID Seg SCT Code
 0   Short             Aborted: Self-test command            21047            -     -   -   -    -
 1   Short             Completed without error               21047            -     -   -   -    -
 2   Short             Completed without error               18632            -     -   -   -    -
 3   Short             Completed without error               17946            -     -   -   -    -
 4   Short             Aborted: Self-test command            14978            -     -   -   -    -
 5   Short             Aborted: Self-test command            13374            -     -   -   -    -
 6   Short             Aborted: Self-test command            13374            -     -   -   -    -
 7   Short             Completed without error               12670            -     -   -   -    -
 8   Short             Aborted: Self-test command                0            -     -   -   -    -
 9   Short             Aborted: Self-test command                0            -     -   -   -    -



