smartctl 7.3 2022-02-28 r5338 [x86_64-linux-6.3.5-zen1-1-zen] (local build)
Copyright (C) 2002-22, Bruce Allen, Christian Franke, www.smartmontools.org

=== START OF INFORMATION SECTION ===
Model Number:                       E12-256G-PHISON-SSD-B3-BB1
Serial Number:                      --
Firmware Version:                   ECFM12A1
PCI Vendor/Subsystem ID:            0x1987
IEEE OUI Identifier:                0x6479a7
Total NVM Capacity:                 256,060,514,304 [256 GB]
Unallocated NVM Capacity:           0
Controller ID:                      1
NVMe Version:                       1.3
Number of Namespaces:               1
Namespace 1 Size/Capacity:          256,060,514,304 [256 GB]
Namespace 1 Formatted LBA Size:     512
Namespace 1 IEEE EUI-64:            6479a7 ...
Local Time is:                      Sat Jun  3 09:08:14 2023 CEST
Firmware Updates (0x12):            1 Slot, no Reset required
Optional Admin Commands (0x0017):   Security Format Frmw_DL Self_Test
Optional NVM Commands (0x005d):     Comp DS_Mngmt Wr_Zero Sav/Sel_Feat Timestmp
Log Page Attributes (0x0c):         Ext_Get_Lg Telmtry_Lg
Maximum Data Transfer Size:         512 Pages
Warning  Comp. Temp. Threshold:     70 Celsius
Critical Comp. Temp. Threshold:     90 Celsius

Supported Power States
St Op     Max   Active     Idle   RL RT WL WT  Ent_Lat  Ex_Lat
 0 +     6.80W       -        -    0  0  0  0        0       0
 1 +     5.74W       -        -    1  1  1  1        0       0
 2 +     5.21W       -        -    2  2  2  2        0       0
 3 -   0.0490W       -        -    3  3  3  3     2000    2000
 4 -   0.0018W       -        -    4  4  4  4    25000   25000

Supported LBA Sizes (NSID 0x1)
Id Fmt  Data  Metadt  Rel_Perf
 0 +     512       0         2
 1 -    4096       0         1

=== START OF SMART DATA SECTION ===
SMART overall-health self-assessment test result: PASSED

SMART/Health Information (NVMe Log 0x02)
Critical Warning:                   0x00
Temperature:                        20 Celsius
Available Spare:                    100%
Available Spare Threshold:          5%
Percentage Used:                    11%
Data Units Read:                    23,460,212 [12.0 TB]
Data Units Written:                 21,473,295 [10.9 TB]
Host Read Commands:                 389,486,137
Host Write Commands:                465,357,909
Controller Busy Time:               1,303
Power Cycles:                       2,353
Power On Hours:                     10,018
Unsafe Shutdowns:                   69
Media and Data Integrity Errors:    0
Error Information Log Entries:      2,656
Warning  Comp. Temperature Time:    278
Critical Comp. Temperature Time:    0

Error Information (NVMe Log 0x01, 16 of 63 entries)
Num   ErrCount  SQId   CmdId  Status  PELoc          LBA  NSID    VS
  0       2656     0  0x001c  0x4004  0x028            0     0     -
  1       2655     0  0x0004  0x4004  0x028            0     0     -
  2       2654     0  0x0018  0x4004  0x028            0     0     -
  3       2653     0  0x0008  0x4004  0x028            0     0     -
  4       2652     0  0x3013  0x4004  0x028            0     0     -
  5       2651     0  0x0008  0x4004  0x028            0     0     -
  6       2650     0  0x0000  0x4004  0x028            0     0     -
  7       2649     0  0x0014  0x4004  0x028            0     0     -
  8       2648     0  0x300a  0x4004  0x028            0     0     -
  9       2647     0  0x0004  0x4004  0x028            0     0     -
 10       2646     0  0x0008  0x4004  0x028            0     0     -
 11       2645     0  0x301b  0x4004  0x028            0     0     -
 12       2644     0  0x301b  0x4004  0x028            0     0     -
 13       2643     0  0x0014  0x4004  0x028            0     0     -
 14       2642     0  0x0016  0x4004  0x028            0     0     -
 15       2641     0  0x101d  0x4004  0x028            0     0     -
... (47 entries not read)



