smartctl 7.4 2023-08-01 r5530 [x86_64-linux-6.12.11-204.nobara.fc41.x86_64] (local build)
Copyright (C) 2002-23, Bruce Allen, Christian Franke, www.smartmontools.org

=== START OF INFORMATION SECTION ===
Model Number:                       PNY CS2130 4TB SSD
Serial Number:                      --
Firmware Version:                   CS213531
PCI Vendor/Subsystem ID:            0x1987
IEEE OUI Identifier:                0x6479a7
Total NVM Capacity:                 4,000,787,030,016 [4.00 TB]
Unallocated NVM Capacity:           0
Controller ID:                      1
NVMe Version:                       1.3
Number of Namespaces:               1
Namespace 1 Size/Capacity:          4,000,787,030,016 [4.00 TB]
Namespace 1 Formatted LBA Size:     512
Namespace 1 IEEE EUI-64:            6479a7 ...
Local Time is:                      Sun Feb  2 11:44:06 2025 CST
Firmware Updates (0x12):            1 Slot, no Reset required
Optional Admin Commands (0x0017):   Security Format Frmw_DL Self_Test
Optional NVM Commands (0x005d):     Comp DS_Mngmt Wr_Zero Sav/Sel_Feat Timestmp
Log Page Attributes (0x08):         Telmtry_Lg
Maximum Data Transfer Size:         512 Pages
Warning  Comp. Temp. Threshold:     75 Celsius
Critical Comp. Temp. Threshold:     80 Celsius

Supported Power States
St Op     Max   Active     Idle   RL RT WL WT  Ent_Lat  Ex_Lat
 0 +    10.84W       -        -    0  0  0  0        0       0
 1 +     7.41W       -        -    1  1  1  1        0       0
 2 +     5.69W       -        -    2  2  2  2        0       0
 3 -   0.0490W       -        -    3  3  3  3     2000    2000
 4 -   0.0018W       -        -    4  4  4  4    25000   25000

Supported LBA Sizes (NSID 0x1)
Id Fmt  Data  Metadt  Rel_Perf
 0 +     512       0         2
 1 -    4096       0         1

=== START OF SMART DATA SECTION ===
SMART overall-health self-assessment test result: PASSED

SMART/Health Information (NVMe Log 0x02)
Critical Warning:                   0x00
Temperature:                        29 Celsius
Available Spare:                    100%
Available Spare Threshold:          5%
Percentage Used:                    2%
Data Units Read:                    102,092,938 [52.2 TB]
Data Units Written:                 66,802,573 [34.2 TB]
Host Read Commands:                 587,581,193
Host Write Commands:                623,159,707
Controller Busy Time:               3,392
Power Cycles:                       1,243
Power On Hours:                     12,439
Unsafe Shutdowns:                   118
Media and Data Integrity Errors:    0
Error Information Log Entries:      3,168
Warning  Comp. Temperature Time:    2
Critical Comp. Temperature Time:    0
Thermal Temp. 1 Transition Count:   108
Thermal Temp. 2 Transition Count:   34
Thermal Temp. 1 Total Time:         37739
Thermal Temp. 2 Total Time:         29254

Error Information (NVMe Log 0x01, 16 of 63 entries)
Num   ErrCount  SQId   CmdId  Status  PELoc          LBA  NSID    VS  Message
  0       3168     0  0x2014  0x4004  0x004            0     1     -  Invalid Field in Command
  1       3167     0  0x201d  0x4004  0x004            0     1     -  Invalid Field in Command
  2       3166     0  0x001c  0x4004  0x028            0     0     -  Invalid Field in Command

Read Self-test Log failed: Invalid Field in Command (0x2002)

