smartctl 7.2 2020-12-30 r5155 [x86_64-linux-5.11.2-1-MANJARO] (local build)
Copyright (C) 2002-20, Bruce Allen, Christian Franke, www.smartmontools.org

=== START OF INFORMATION SECTION ===
Model Number:                       ADATA SX6000NP
Serial Number:                      --
Firmware Version:                   V6005-ac
PCI Vendor/Subsystem ID:            0x10ec
IEEE OUI Identifier:                0x00e04c
Controller ID:                      22273
NVMe Version:                       1.2
Number of Namespaces:               1
Namespace 1 Size/Capacity:          128,035,676,160 [128 GB]
Namespace 1 Formatted LBA Size:     512
Local Time is:                      Thu Mar 18 17:28:00 2021 CET
Firmware Updates (0x0e):            7 Slots
Optional Admin Commands (0x0006):   Format Frmw_DL
Optional NVM Commands (0x0004):     DS_Mngmt
Log Page Attributes (0x03):         S/H_per_NS Cmd_Eff_Lg
Maximum Data Transfer Size:         32 Pages
Warning  Comp. Temp. Threshold:     118 Celsius
Critical Comp. Temp. Threshold:     150 Celsius

Supported Power States
St Op     Max   Active     Idle   RL RT WL WT  Ent_Lat  Ex_Lat
 0 +    50.00W       -        -    0  0  0  0        0       0

Supported LBA Sizes (NSID 0x1)
Id Fmt  Data  Metadt  Rel_Perf
 0 +     512       0         0

=== START OF SMART DATA SECTION ===
SMART overall-health self-assessment test result: PASSED

SMART/Health Information (NVMe Log 0x02)
Critical Warning:                   0x00
Temperature:                        67 Celsius
Available Spare:                    100%
Available Spare Threshold:          32%
Percentage Used:                    13%
Data Units Read:                    7,290,542 [3.73 TB]
Data Units Written:                 14,268,110 [7.30 TB]
Host Read Commands:                 158,390,970
Host Write Commands:                107,019,462
Controller Busy Time:               0
Power Cycles:                       1,511
Power On Hours:                     15,287
Unsafe Shutdowns:                   278
Media and Data Integrity Errors:    0
Error Information Log Entries:      0
Warning  Comp. Temperature Time:    0
Critical Comp. Temperature Time:    0

Error Information (NVMe Log 0x01, 8 of 8 entries)
No Errors Logged



