=== START OF INFORMATION SECTION ===
Model Family:     Western Digital Scorpio Blue Serial ATA
Device Model:     WDC WD2500BEVT-80A23T0
Serial Number:    --
LU WWN Device Id: 5 0014ee ...
Firmware Version: 01.01A01
User Capacity:    250 059 350 016 bytes [250 GB]
Sector Size:      512 bytes logical/physical
Rotation Rate:    5400 rpm
Device is:        In smartctl database [for details use: -P show]
ATA Version is:   ATA8-ACS (minor revision not indicated)
SATA Version is:  SATA 2.6, 3.0 Gb/s
Local Time is:    Wed May 17 21:28:22 2017 EEST
SMART support is: Available - device has SMART capability.
SMART support is: Enabled
AAM feature is:   Disabled
APM level is:     96 (intermediate level with standby)
Rd look-ahead is: Enabled
Write cache is:   Disabled
ATA Security is:  Disabled, NOT FROZEN [SEC1]
Wt Cache Reorder: Enabled

=== START OF READ SMART DATA SECTION ===
SMART overall-health self-assessment test result: PASSED

General SMART Values:
Offline data collection status:  (0x84)	Offline data collection activity
					was suspended by an interrupting command from host.
					Auto Offline Data Collection: Enabled.
Self-test execution status:      (   0)	The previous self-test routine completed
					without error or no self-test has ever 
					been run.
Total time to complete Offline 
data collection: 		( 6960) seconds.
Offline data collection
capabilities: 			 (0x7b) SMART execute Offline immediate.
					Auto Offline data collection on/off support.
					Suspend Offline collection upon new
					command.
					Offline surface scan supported.
					Self-test supported.
					Conveyance Self-test supported.
					Selective Self-test supported.
SMART capabilities:            (0x0003)	Saves SMART data before entering
					power-saving mode.
					Supports SMART auto save timer.
Error logging capability:        (0x01)	Error logging supported.
					General Purpose Logging supported.
Short self-test routine 
recommended polling time: 	 (   2) minutes.
Extended self-test routine
recommended polling time: 	 (  84) minutes.
Conveyance self-test routine
recommended polling time: 	 (   5) minutes.
SCT capabilities: 	       (0x7037)	SCT Status supported.
					SCT Feature Control supported.
					SCT Data Table supported.

SMART Attributes Data Structure revision number: 16
Vendor Specific SMART Attributes with Thresholds:
ID# ATTRIBUTE_NAME          FLAGS    VALUE WORST THRESH FAIL RAW_VALUE
  1 Raw_Read_Error_Rate     POSR-K   200   200   051    -    99
  3 Spin_Up_Time            POS--K   154   128   021    -    1300
  4 Start_Stop_Count        -O--CK   036   036   000    -    64266
  5 Reallocated_Sector_Ct   PO--CK   149   149   140    -    561
  7 Seek_Error_Rate         -OSR-K   200   200   000    -    0
  9 Power_On_Hours          -O--CK   093   093   000    -    5505
 10 Spin_Retry_Count        -O--CK   100   100   000    -    0
 11 Calibration_Retry_Count -O--CK   100   100   000    -    0
 12 Power_Cycle_Count       -O--CK   099   099   000    -    1388
191 G-Sense_Error_Rate      -O--CK   001   001   000    -    1578
192 Power-Off_Retract_Count -O--CK   200   200   000    -    388
193 Load_Cycle_Count        -O--CK   001   001   000    -    875440
194 Temperature_Celsius     -O---K   108   081   000    -    35
196 Reallocated_Event_Count -O--CK   180   150   000    -    20
197 Current_Pending_Sector  -O--CK   199   191   000    -    54
198 Offline_Uncorrectable   ----CK   200   191   000    -    0
199 UDMA_CRC_Error_Count    -O--CK   200   200   000    -    0
200 Multi_Zone_Error_Rate   ---R--   178   178   000    -    2234
                            ||||||_ K auto-keep
                            |||||__ C event count
                            ||||___ R error rate
                            |||____ S speed/performance
                            ||_____ O updated online
                            |______ P prefailure warning

General Purpose Log Directory Version 1
SMART           Log Directory Version 1 [multi-sector log support]
Address    Access  R/W   Size  Description
0x00       GPL,SL  R/O      1  Log Directory
0x01           SL  R/O      1  Summary SMART error log
0x02           SL  R/O      5  Comprehensive SMART error log
0x03       GPL     R/O      6  Ext. Comprehensive SMART error log
0x06           SL  R/O      1  SMART self-test log
0x07       GPL     R/O      1  Extended self-test log
0x09           SL  R/W      1  Selective self-test log
0x10       GPL     R/O      1  SATA NCQ Queued Error log
0x11       GPL     R/O      1  SATA Phy Event Counters log
0x80-0x9f  GPL,SL  R/W     16  Host vendor specific log
0xa0-0xa7  GPL,SL  VS      16  Device vendor specific log
0xa8-0xb7  GPL,SL  VS       1  Device vendor specific log
0xbd       GPL,SL  VS       1  Device vendor specific log
0xc0       GPL,SL  VS       1  Device vendor specific log
0xc1       GPL     VS      24  Device vendor specific log
0xe0       GPL,SL  R/W      1  SCT Command/Status
0xe1       GPL,SL  R/W      1  SCT Data Transfer

SMART Extended Comprehensive Error Log Version: 1 (6 sectors)
Device Error Count: 10782 (device log contains only the most recent 24 errors)
	CR     = Command Register
	FEATR  = Features Register
	COUNT  = Count (was: Sector Count) Register
	LBA_48 = Upper bytes of LBA High/Mid/Low Registers ]  ATA-8
	LH     = LBA High (was: Cylinder High) Register    ]   LBA
	LM     = LBA Mid (was: Cylinder Low) Register      ] Register
	LL     = LBA Low (was: Sector Number) Register     ]
	DV     = Device (was: Device/Head) Register
	DC     = Device Control Register
	ER     = Error register
	ST     = Status register
Powered_Up_Time is measured from power on, and printed as
DDd+hh:mm:SS.sss where DD=days, hh=hours, mm=minutes,
SS=sec, and sss=millisec. It "wraps" after 49.710 days.

Error 10782 [5] occurred at disk power-on lifetime: 5492 hours (228 days + 20 hours)
  When the command that caused the error occurred, the device was active or idle.

  After command completion occurred, registers were:
  ER -- ST COUNT  LBA_48  LH LM LL DV DC
  -- -- -- == -- == == == -- -- -- -- --
  40 -- 51 01 00 00 00 0e ca 2c 33 40 00  Error: WP at LBA = 0x0eca2c33 = 248130611

  Commands leading to the command that caused the error were:
  CR FEATR COUNT  LBA_48  LH LM LL DV DC  Powered_Up_Time  Command/Feature_Name
  -- == -- == -- == == == -- -- -- -- --  ---------------  --------------------
  61 01 00 00 48 00 00 18 67 0c 48 40 00     00:38:42.036  WRITE FPDMA QUEUED
  61 01 00 00 40 00 00 18 67 0b 48 40 00     00:38:42.035  WRITE FPDMA QUEUED
  61 01 00 00 38 00 00 18 67 0a 48 40 00     00:38:42.034  WRITE FPDMA QUEUED
  61 01 00 00 30 00 00 18 67 09 48 40 00     00:38:42.034  WRITE FPDMA QUEUED
  61 01 00 00 28 00 00 18 67 08 48 40 00     00:38:42.033  WRITE FPDMA QUEUED

Error 10781 [4] occurred at disk power-on lifetime: 5492 hours (228 days + 20 hours)
  When the command that caused the error occurred, the device was active or idle.

  After command completion occurred, registers were:
  ER -- ST COUNT  LBA_48  LH LM LL DV DC
  -- -- -- == -- == == == -- -- -- -- --
  40 -- 51 01 00 00 00 0e ca 2c 33 40 00  Error: WP at LBA = 0x0eca2c33 = 248130611

  Commands leading to the command that caused the error were:
  CR FEATR COUNT  LBA_48  LH LM LL DV DC  Powered_Up_Time  Command/Feature_Name
  -- == -- == -- == == == -- -- -- -- --  ---------------  --------------------
  61 00 08 00 50 00 00 00 8c f1 a8 40 00     00:38:38.881  WRITE FPDMA QUEUED
  61 00 08 00 48 00 00 00 6a f7 f0 40 00     00:38:38.881  WRITE FPDMA QUEUED
  61 00 08 00 40 00 00 00 66 bd e0 40 00     00:38:38.881  WRITE FPDMA QUEUED
  61 01 00 00 78 00 00 18 67 00 48 40 00     00:38:38.880  WRITE FPDMA QUEUED
  61 01 00 00 70 00 00 18 66 ff 48 40 00     00:38:38.880  WRITE FPDMA QUEUED

Error 10780 [3] occurred at disk power-on lifetime: 5492 hours (228 days + 20 hours)
  When the command that caused the error occurred, the device was active or idle.

  After command completion occurred, registers were:
  ER -- ST COUNT  LBA_48  LH LM LL DV DC
  -- -- -- == -- == == == -- -- -- -- --
  40 -- 51 01 00 00 00 0e ca 2c 33 40 00  Error: WP at LBA = 0x0eca2c33 = 248130611

  Commands leading to the command that caused the error were:
  CR FEATR COUNT  LBA_48  LH LM LL DV DC  Powered_Up_Time  Command/Feature_Name
  -- == -- == -- == == == -- -- -- -- --  ---------------  --------------------
  61 01 00 00 e8 00 00 18 66 fb 48 40 00     00:38:35.584  WRITE FPDMA QUEUED
  61 01 00 00 e0 00 00 18 66 fa 48 40 00     00:38:35.583  WRITE FPDMA QUEUED
  61 01 00 00 d8 00 00 18 66 f9 48 40 00     00:38:35.582  WRITE FPDMA QUEUED
  61 01 00 00 d0 00 00 18 66 f8 48 40 00     00:38:35.582  WRITE FPDMA QUEUED
  61 01 00 00 c8 00 00 18 66 f7 48 40 00     00:38:35.582  WRITE FPDMA QUEUED

Error 10779 [2] occurred at disk power-on lifetime: 5492 hours (228 days + 20 hours)
  When the command that caused the error occurred, the device was active or idle.

  After command completion occurred, registers were:
  ER -- ST COUNT  LBA_48  LH LM LL DV DC
  -- -- -- == -- == == == -- -- -- -- --
  40 -- 51 01 00 00 00 0e ca 2c 33 40 00  Error: WP at LBA = 0x0eca2c33 = 248130611

  Commands leading to the command that caused the error were:
  CR FEATR COUNT  LBA_48  LH LM LL DV DC  Powered_Up_Time  Command/Feature_Name
  -- == -- == -- == == == -- -- -- -- --  ---------------  --------------------
  61 01 00 00 30 00 00 18 66 e3 48 40 00     00:38:32.471  WRITE FPDMA QUEUED
  61 01 00 00 28 00 00 18 66 e2 48 40 00     00:38:32.470  WRITE FPDMA QUEUED
  61 01 00 00 20 00 00 18 66 e1 48 40 00     00:38:32.469  WRITE FPDMA QUEUED
  61 01 00 00 18 00 00 18 66 e0 48 40 00     00:38:32.468  WRITE FPDMA QUEUED
  61 01 00 00 10 00 00 18 66 df 48 40 00     00:38:32.468  WRITE FPDMA QUEUED

Error 10778 [1] occurred at disk power-on lifetime: 5492 hours (228 days + 20 hours)
  When the command that caused the error occurred, the device was active or idle.

  After command completion occurred, registers were:
  ER -- ST COUNT  LBA_48  LH LM LL DV DC
  -- -- -- == -- == == == -- -- -- -- --
  40 -- 51 01 00 00 00 0e ca 2c 33 40 00  Error: WP at LBA = 0x0eca2c33 = 248130611

  Commands leading to the command that caused the error were:
  CR FEATR COUNT  LBA_48  LH LM LL DV DC  Powered_Up_Time  Command/Feature_Name
  -- == -- == -- == == == -- -- -- -- --  ---------------  --------------------
  61 01 00 00 c8 00 00 18 66 d2 48 40 00     00:38:29.318  WRITE FPDMA QUEUED
  61 01 00 00 c0 00 00 18 66 d1 48 40 00     00:38:29.317  WRITE FPDMA QUEUED
  61 01 00 00 b8 00 00 18 66 d0 48 40 00     00:38:29.310  WRITE FPDMA QUEUED
  61 01 00 00 b0 00 00 18 66 cf 48 40 00     00:38:29.310  WRITE FPDMA QUEUED
  60 00 80 00 a8 00 00 04 44 74 60 40 00     00:38:29.310  READ FPDMA QUEUED

Error 10777 [0] occurred at disk power-on lifetime: 5492 hours (228 days + 20 hours)
  When the command that caused the error occurred, the device was active or idle.

  After command completion occurred, registers were:
  ER -- ST COUNT  LBA_48  LH LM LL DV DC
  -- -- -- == -- == == == -- -- -- -- --
  40 -- 51 01 00 00 00 0e ca 2c 33 40 00  Error: WP at LBA = 0x0eca2c33 = 248130611

  Commands leading to the command that caused the error were:
  CR FEATR COUNT  LBA_48  LH LM LL DV DC  Powered_Up_Time  Command/Feature_Name
  -- == -- == -- == == == -- -- -- -- --  ---------------  --------------------
  61 01 00 00 e8 00 00 18 66 d0 48 40 00     00:38:26.293  WRITE FPDMA QUEUED
  61 01 00 00 e0 00 00 18 66 cf 48 40 00     00:38:26.293  WRITE FPDMA QUEUED
  60 00 80 00 d8 00 00 04 44 74 60 40 00     00:38:26.293  READ FPDMA QUEUED
  60 00 80 00 d0 00 00 04 44 73 60 40 00     00:38:26.292  READ FPDMA QUEUED
  60 01 00 00 c8 00 00 0e ca 2c 60 40 00     00:38:26.291  READ FPDMA QUEUED

Error 10776 [23] occurred at disk power-on lifetime: 5482 hours (228 days + 10 hours)
  When the command that caused the error occurred, the device was active or idle.

  After command completion occurred, registers were:
  ER -- ST COUNT  LBA_48  LH LM LL DV DC
  -- -- -- == -- == == == -- -- -- -- --
  40 -- 51 00 60 00 00 0e e2 ac cd 40 00  Error: UNC at LBA = 0x0ee2accd = 249736397

  Commands leading to the command that caused the error were:
  CR FEATR COUNT  LBA_48  LH LM LL DV DC  Powered_Up_Time  Command/Feature_Name
  -- == -- == -- == == == -- -- -- -- --  ---------------  --------------------
  60 00 08 00 80 00 00 0e e2 ac 90 40 00     00:29:56.133  READ FPDMA QUEUED
  60 01 00 00 78 00 00 0f 00 be 58 40 00     00:29:56.133  READ FPDMA QUEUED
  61 01 00 00 70 00 00 11 45 1a c8 40 00     00:29:56.132  WRITE FPDMA QUEUED
  61 01 00 00 68 00 00 11 45 19 c8 40 00     00:29:56.132  WRITE FPDMA QUEUED
  61 01 00 00 60 00 00 0f 2c dc a0 40 00     00:29:56.132  WRITE FPDMA QUEUED

Error 10775 [22] occurred at disk power-on lifetime: 5482 hours (228 days + 10 hours)
  When the command that caused the error occurred, the device was active or idle.

  After command completion occurred, registers were:
  ER -- ST COUNT  LBA_48  LH LM LL DV DC
  -- -- -- == -- == == == -- -- -- -- --
  40 -- 51 00 68 00 00 0e e2 ac cd 40 00  Error: WP at LBA = 0x0ee2accd = 249736397

  Commands leading to the command that caused the error were:
  CR FEATR COUNT  LBA_48  LH LM LL DV DC  Powered_Up_Time  Command/Feature_Name
  -- == -- == -- == == == -- -- -- -- --  ---------------  --------------------
  61 01 00 00 48 00 00 02 67 cd 70 40 00     00:29:52.993  WRITE FPDMA QUEUED
  61 01 00 00 40 00 00 02 67 cc 70 40 00     00:29:52.992  WRITE FPDMA QUEUED
  61 01 00 00 38 00 00 02 67 cb 70 40 00     00:29:52.992  WRITE FPDMA QUEUED
  61 01 00 00 30 00 00 02 67 ca 70 40 00     00:29:52.991  WRITE FPDMA QUEUED
  61 01 00 00 28 00 00 02 67 c9 70 40 00     00:29:52.991  WRITE FPDMA QUEUED

SMART Extended Self-test Log Version: 1 (1 sectors)
No self-tests have been logged.  [To run self-tests, use: smartctl -t]

SMART Selective self-test log data structure revision number 1
 SPAN  MIN_LBA  MAX_LBA  CURRENT_TEST_STATUS
    1        0        0  Not_testing
    2        0        0  Not_testing
    3        0        0  Not_testing
    4        0        0  Not_testing
    5        0        0  Not_testing
Selective self-test flags (0x0):
  After scanning selected spans, do NOT read-scan remainder of disk.
If Selective self-test is pending on power-up, resume after 0 minute delay.

SCT Status Version:                  3
SCT Version (vendor specific):       258 (0x0102)
SCT Support Level:                   1
Device State:                        Active (0)
Current Temperature:                    35 Celsius
Power Cycle Min/Max Temperature:     25/35 Celsius
Lifetime    Min/Max Temperature:     26/62 Celsius
Under/Over Temperature Limit Count:   0/0
Vendor specific:
01 00 00 00 00 00 00 00 00 00 00 00 00 00 00 00
00 00 00 00 00 00 00 00 00 00 00 00 00 00 00 00

SCT Temperature History Version:     2
Temperature Sampling Period:         1 minute
Temperature Logging Interval:        1 minute
Min/Max recommended Temperature:      0/60 Celsius
Min/Max Temperature Limit:           -41/85 Celsius
Temperature History Size (Index):    128 (83)

SCT Error Recovery Control command not supported

Device Statistics (GP/SMART Log 0x04) not supported

SATA Phy Event Counters (GP Log 0x11)
ID      Size     Value  Description
0x0001  2            0  Command failed due to ICRC error
0x0002  2            0  R_ERR response for data FIS
0x0003  2            0  R_ERR response for device-to-host data FIS
0x0004  2            0  R_ERR response for host-to-device data FIS
0x0005  2            0  R_ERR response for non-data FIS
0x0006  2            0  R_ERR response for device-to-host non-data FIS
0x0007  2            0  R_ERR response for host-to-device non-data FIS
0x000a  2            2  Device-to-host register FISes sent due to a COMRESET
0x000b  2            0  CRC errors within host-to-device FIS
0x8000  4         1431  Vendor specific

