smartctl 7.5 2025-04-30 r5714 [x86_64-linux-6.15.8-200.fc42.x86_64] (local build)
Copyright (C) 2002-25, Bruce Allen, Christian Franke, www.smartmontools.org

=== START OF INFORMATION SECTION ===
Model Number:                       INTEL SSDPEKNW010T8
Serial Number:                      --
Firmware Version:                   004C
PCI Vendor/Subsystem ID:            0x8086
IEEE OUI Identifier:                0x5cd2e4
Controller ID:                      1
NVMe Version:                       1.3
Number of Namespaces:               1
Namespace 1 Size/Capacity:          1,024,209,543,168 [1.02 TB]
Namespace 1 Formatted LBA Size:     512
Local Time is:                      Mon Aug  4 10:24:32 2025 CEST
Firmware Updates (0x14):            2 Slots, no Reset required
Optional Admin Commands (0x0017):   Security Format Frmw_DL Self_Test
Optional NVM Commands (0x005f):     Comp Wr_Unc DS_Mngmt Wr_Zero Sav/Sel_Feat Timestmp
Log Page Attributes (0x0f):         S/H_per_NS Cmd_Eff_Lg Ext_Get_Lg Telmtry_Lg
Maximum Data Transfer Size:         32 Pages
Warning  Comp. Temp. Threshold:     77 Celsius
Critical Comp. Temp. Threshold:     80 Celsius

Supported Power States
St Op     Max   Active     Idle   RL RT WL WT  Ent_Lat  Ex_Lat
 0 +     4.00W       -        -    0  0  0  0        0       0
 1 +     3.00W       -        -    1  1  1  1        0       0
 2 +     2.20W       -        -    2  2  2  2        0       0
 3 -   0.0300W       -        -    3  3  3  3     5000    5000
 4 -   0.0040W       -        -    4  4  4  4     5000    9000

Supported LBA Sizes (NSID 0x1)
Id Fmt  Data  Metadt  Rel_Perf
 0 +     512       0         0

=== START OF SMART DATA SECTION ===
SMART overall-health self-assessment test result: PASSED

SMART/Health Information (NVMe Log 0x02, NSID 0x1)
Critical Warning:                   0x00
Temperature:                        35 Celsius
Available Spare:                    100%
Available Spare Threshold:          10%
Percentage Used:                    1%
Data Units Read:                    9,722,997 [4.97 TB]
Data Units Written:                 14,799,887 [7.57 TB]
Host Read Commands:                 77,394,283
Host Write Commands:                219,550,514
Controller Busy Time:               1,649
Power Cycles:                       785
Power On Hours:                     503
Unsafe Shutdowns:                   181
Media and Data Integrity Errors:    0
Error Information Log Entries:      0
Warning  Comp. Temperature Time:    0
Critical Comp. Temperature Time:    0

Error Information (NVMe Log 0x01, 16 of 256 entries)
No Errors Logged

Self-test Log (NVMe Log 0x06, NSID 0xffffffff)
Self-test status: No self-test in progress
Num  Test_Description  Status                       Power_on_Hours  Failing_LBA  NSID Seg SCT Code
 0   Short             Completed without error                 428            -     -   -   -    -
 1   Extended          Completed without error                 403            -     -   -   -    -
 2   Short             Completed without error                 403            -     -   -   -    -
 3   Short             Aborted: Controller Reset               237            -     -   -   -    -
 4   Short             Completed without error                 233            -     -   -   -    -
 5   Extended          Completed without error                 166            -     -   -   -    -
 6   Short             Completed without error                 166            -     -   -   -    -
 7   Short             Completed without error                 166            -     -   -   -    -

