smartctl 7.4 2023-08-01 r5530 [x86_64-linux-6.10.0-desktop-1omv2490] (OpenMandriva Lx 7.4-1)
Copyright (C) 2002-23, Bruce Allen, Christian Franke, www.smartmontools.org

=== START OF INFORMATION SECTION ===
Model Number:                       Micron 2200S NVMe 512GB
Serial Number:                      --
Firmware Version:                   22001070
PCI Vendor/Subsystem ID:            0x1344
IEEE OUI Identifier:                0x00a075
Controller ID:                      0
NVMe Version:                       1.2.1
Number of Namespaces:               1
Namespace 1 Size/Capacity:          512,110,190,592 [512 GB]
Namespace 1 Formatted LBA Size:     512
Namespace 1 IEEE EUI-64:            00a075 ...
Local Time is:                      Fri Sep  6 19:21:16 2024 BST
Firmware Updates (0x02):            1 Slot
Optional Admin Commands (0x0017):   Security Format Frmw_DL Self_Test
Optional NVM Commands (0x0017):     Comp Wr_Unc DS_Mngmt Sav/Sel_Feat
Log Page Attributes (0x02):         Cmd_Eff_Lg
Maximum Data Transfer Size:         128 Pages
Warning  Comp. Temp. Threshold:     82 Celsius
Critical Comp. Temp. Threshold:     85 Celsius

Supported Power States
St Op     Max   Active     Idle   RL RT WL WT  Ent_Lat  Ex_Lat
 0 +     8.25W       -        -    0  0  0  0        0       0
 1 +     2.40W       -        -    1  1  1  1        0       0
 2 +     1.90W       -        -    2  2  2  2        0       0
 3 -   0.0800W       -        -    3  3  3  3    10000    2500
 4 -   0.0050W       -        -    4  4  4  4    50000  175000

Supported LBA Sizes (NSID 0x1)
Id Fmt  Data  Metadt  Rel_Perf
 0 +     512       0         0

=== START OF SMART DATA SECTION ===
SMART overall-health self-assessment test result: PASSED

SMART/Health Information (NVMe Log 0x02)
Critical Warning:                   0x00
Temperature:                        43 Celsius
Available Spare:                    100%
Available Spare Threshold:          50%
Percentage Used:                    4%
Data Units Read:                    9,160,026 [4.68 TB]
Data Units Written:                 13,417,590 [6.86 TB]
Host Read Commands:                 51,980,069
Host Write Commands:                74,839,896
Controller Busy Time:               1,775
Power Cycles:                       1,121
Power On Hours:                     782
Unsafe Shutdowns:                   78
Media and Data Integrity Errors:    0
Error Information Log Entries:      4,762
Warning  Comp. Temperature Time:    8
Critical Comp. Temperature Time:    0
Temperature Sensor 1:               43 Celsius
Temperature Sensor 2:               46 Celsius

Error Information (NVMe Log 0x01, 16 of 256 entries)
Num   ErrCount  SQId   CmdId  Status  PELoc          LBA  NSID    VS  Message
  0       4762     0  0x0018  0x8004  0x000            0     0     -  Invalid Field in Command

Read Self-test Log failed: Invalid Namespace or Format (0x00b)



