smartctl 7.1 2019-12-30 r5022 [x86_64-linux-5.13.0-40-generic] (local build)
Copyright (C) 2002-19, Bruce Allen, Christian Franke, www.smartmontools.org

=== START OF INFORMATION SECTION ===
Model Number:                       Micron 2200S NVMe 512GB
Serial Number:                      --
Firmware Version:                   22001050
PCI Vendor/Subsystem ID:            0x1344
IEEE OUI Identifier:                0x00a075
Controller ID:                      0
Number of Namespaces:               1
Namespace 1 Size/Capacity:          512,110,190,592 [512 GB]
Namespace 1 Formatted LBA Size:     512
Namespace 1 IEEE EUI-64:            00a075 ...
Local Time is:                      Sat May 14 11:25:43 2022 CEST
Firmware Updates (0x02):            1 Slot
Optional Admin Commands (0x0017):   Security Format Frmw_DL Self_Test
Optional NVM Commands (0x0017):     Comp Wr_Unc DS_Mngmt Sav/Sel_Feat
Maximum Data Transfer Size:         128 Pages
Warning  Comp. Temp. Threshold:     82 Celsius
Critical Comp. Temp. Threshold:     85 Celsius

Supported Power States
St Op     Max   Active     Idle   RL RT WL WT  Ent_Lat  Ex_Lat
 0 +     8.25W       -        -    0  0  0  0        0       0
 1 +     2.40W       -        -    1  1  1  1        0       0
 2 +     1.90W       -        -    2  2  2  2        0       0
 3 -   0.0800W       -        -    3  3  3  3    10000    2500
 4 -   0.0050W       -        -    4  4  4  4    50000  175000

Supported LBA Sizes (NSID 0x1)
Id Fmt  Data  Metadt  Rel_Perf
 0 +     512       0         0

=== START OF SMART DATA SECTION ===
SMART overall-health self-assessment test result: PASSED

SMART/Health Information (NVMe Log 0x02)
Critical Warning:                   0x00
Temperature:                        37 Celsius
Available Spare:                    100%
Available Spare Threshold:          50%
Percentage Used:                    1%
Data Units Read:                    1,347,080 [689 GB]
Data Units Written:                 5,786,882 [2.96 TB]
Host Read Commands:                 17,778,421
Host Write Commands:                102,164,217
Controller Busy Time:               1,820
Power Cycles:                       413
Power On Hours:                     5,358
Unsafe Shutdowns:                   54
Media and Data Integrity Errors:    0
Error Information Log Entries:      95
Warning  Comp. Temperature Time:    0
Critical Comp. Temperature Time:    0
Temperature Sensor 1:               37 Celsius
Temperature Sensor 2:               39 Celsius

Error Information (NVMe Log 0x01, max 256 entries)
Num   ErrCount  SQId   CmdId  Status  PELoc          LBA  NSID    VS
  0         95     0  0x400e  0x8004  0x000            0     0     -

