smartctl 7.4 2023-08-01 r5530 [x86_64-linux-6.11.0-26-generic] (local build)
Copyright (C) 2002-23, Bruce Allen, Christian Franke, www.smartmontools.org

=== START OF INFORMATION SECTION ===
Model Number:                       Micron 2200S NVMe 512GB
Serial Number:                      --
Firmware Version:                   22001050
PCI Vendor/Subsystem ID:            0x1344
IEEE OUI Identifier:                0x00a075
Controller ID:                      0
NVMe Version:                       1.2.1
Number of Namespaces:               1
Namespace 1 Size/Capacity:          512,110,190,592 [512 GB]
Namespace 1 Formatted LBA Size:     512
Namespace 1 IEEE EUI-64:            00a075 ...
Local Time is:                      Sat Jun 28 14:39:29 2025 CST
Firmware Updates (0x02):            1 Slot
Optional Admin Commands (0x0017):   Security Format Frmw_DL Self_Test
Optional NVM Commands (0x0017):     Comp Wr_Unc DS_Mngmt Sav/Sel_Feat
Log Page Attributes (0x02):         Cmd_Eff_Lg
Maximum Data Transfer Size:         128 Pages
Warning  Comp. Temp. Threshold:     82 Celsius
Critical Comp. Temp. Threshold:     85 Celsius

Supported Power States
St Op     Max   Active     Idle   RL RT WL WT  Ent_Lat  Ex_Lat
 0 +     8.25W       -        -    0  0  0  0        0       0
 1 +     2.40W       -        -    1  1  1  1        0       0
 2 +     1.90W       -        -    2  2  2  2        0       0
 3 -   0.0800W       -        -    3  3  3  3    10000    2500
 4 -   0.0050W       -        -    4  4  4  4    50000  175000

Supported LBA Sizes (NSID 0x1)
Id Fmt  Data  Metadt  Rel_Perf
 0 +     512       0         0

=== START OF SMART DATA SECTION ===
SMART overall-health self-assessment test result: PASSED

SMART/Health Information (NVMe Log 0x02)
Critical Warning:                   0x00
Temperature:                        50 Celsius
Available Spare:                    100%
Available Spare Threshold:          50%
Percentage Used:                    27%
Data Units Read:                    136,781,443 [70.0 TB]
Data Units Written:                 116,861,638 [59.8 TB]
Host Read Commands:                 5,499,339,508
Host Write Commands:                3,977,561,467
Controller Busy Time:               99,994
Power Cycles:                       72,958
Power On Hours:                     20,130
Unsafe Shutdowns:                   155
Media and Data Integrity Errors:    0
Error Information Log Entries:      197
Warning  Comp. Temperature Time:    10
Critical Comp. Temperature Time:    0
Temperature Sensor 1:               50 Celsius
Temperature Sensor 2:               53 Celsius

Error Information (NVMe Log 0x01, 16 of 256 entries)
No Errors Logged

Read Self-test Log failed: Invalid Namespace or Format (0x00b)



