smartctl 7.2 2020-12-30 r5155 [x86_64-linux-5.10.14-desktop-1omv4002] (OpenMandriva Lx 7.2-2)
Copyright (C) 2002-20, Bruce Allen, Christian Franke, www.smartmontools.org

=== START OF INFORMATION SECTION ===
Model Family:     Western Digital Caviar Blue (SATA)
Device Model:     WDC WD3200AAKS-61L9A0
Serial Number:    --
LU WWN Device Id: 5 0014ee ...
Firmware Version: 01.03E01
User Capacity:    320,072,933,376 bytes [320 GB]
Sector Size:      512 bytes logical/physical
Device is:        In smartctl database [for details use: -P show]
ATA Version is:   ATA8-ACS (minor revision not indicated)
SATA Version is:  SATA 2.5, 3.0 Gb/s
Local Time is:    Mon Apr 26 17:44:01 2021 AST
SMART support is: Available - device has SMART capability.
SMART support is: Enabled
AAM level is:     128 (quiet), recommended: 128
APM feature is:   Unavailable
Rd look-ahead is: Enabled
Write cache is:   Enabled
DSN feature is:   Unavailable
ATA Security is:  Disabled, frozen [SEC2]
Wt Cache Reorder: Enabled

=== START OF READ SMART DATA SECTION ===
SMART overall-health self-assessment test result: PASSED

General SMART Values:
Offline data collection status:  (0x84)	Offline data collection activity
					was suspended by an interrupting command from host.
					Auto Offline Data Collection: Enabled.
Self-test execution status:      (   0)	The previous self-test routine completed
					without error or no self-test has ever 
					been run.
Total time to complete Offline 
data collection: 		( 6000) seconds.
Offline data collection
capabilities: 			 (0x7b) SMART execute Offline immediate.
					Auto Offline data collection on/off support.
					Suspend Offline collection upon new
					command.
					Offline surface scan supported.
					Self-test supported.
					Conveyance Self-test supported.
					Selective Self-test supported.
SMART capabilities:            (0x0003)	Saves SMART data before entering
					power-saving mode.
					Supports SMART auto save timer.
Error logging capability:        (0x01)	Error logging supported.
					General Purpose Logging supported.
Short self-test routine 
recommended polling time: 	 (   2) minutes.
Extended self-test routine
recommended polling time: 	 (  73) minutes.
Conveyance self-test routine
recommended polling time: 	 (   5) minutes.
SCT capabilities: 	       (0x3037)	SCT Status supported.
					SCT Feature Control supported.
					SCT Data Table supported.

SMART Attributes Data Structure revision number: 16
Vendor Specific SMART Attributes with Thresholds:
ID# ATTRIBUTE_NAME          FLAGS    VALUE WORST THRESH FAIL RAW_VALUE
  1 Raw_Read_Error_Rate     POSR-K   200   200   051    -    2781
  3 Spin_Up_Time            POS--K   135   133   021    -    4250
  4 Start_Stop_Count        -O--CK   099   099   000    -    1444
  5 Reallocated_Sector_Ct   PO--CK   199   199   140    -    1
  7 Seek_Error_Rate         -OSR-K   200   200   000    -    0
  9 Power_On_Hours          -O--CK   090   090   000    -    7719
 10 Spin_Retry_Count        -O--CK   100   100   000    -    0
 11 Calibration_Retry_Count -O--CK   100   100   000    -    0
 12 Power_Cycle_Count       -O--CK   099   099   000    -    1094
192 Power-Off_Retract_Count -O--CK   200   200   000    -    624
193 Load_Cycle_Count        -O--CK   200   200   000    -    1444
194 Temperature_Celsius     -O---K   108   092   000    -    35
196 Reallocated_Event_Count -O--CK   199   199   000    -    1
197 Current_Pending_Sector  -O--CK   200   200   000    -    1
198 Offline_Uncorrectable   ----CK   200   200   000    -    0
199 UDMA_CRC_Error_Count    -O--CK   200   200   000    -    0
200 Multi_Zone_Error_Rate   ---R--   200   200   000    -    6
                            ||||||_ K auto-keep
                            |||||__ C event count
                            ||||___ R error rate
                            |||____ S speed/performance
                            ||_____ O updated online
                            |______ P prefailure warning

General Purpose Log Directory Version 1
SMART           Log Directory Version 1 [multi-sector log support]
Address    Access  R/W   Size  Description
0x00       GPL,SL  R/O      1  Log Directory
0x01           SL  R/O      1  Summary SMART error log
0x02           SL  R/O      5  Comprehensive SMART error log
0x03       GPL     R/O      6  Ext. Comprehensive SMART error log
0x06           SL  R/O      1  SMART self-test log
0x07       GPL     R/O      1  Extended self-test log
0x09           SL  R/W      1  Selective self-test log
0x10       GPL     R/O      1  NCQ Command Error log
0x11       GPL     R/O      1  SATA Phy Event Counters log
0x21       GPL     R/O      1  Write stream error log
0x22       GPL     R/O      1  Read stream error log
0x80-0x9f  GPL,SL  R/W     16  Host vendor specific log
0xa0-0xa7  GPL,SL  VS      16  Device vendor specific log
0xa8-0xb7  GPL,SL  VS       1  Device vendor specific log
0xbd       GPL,SL  VS       1  Device vendor specific log
0xc0       GPL,SL  VS       1  Device vendor specific log
0xc1       GPL     VS      24  Device vendor specific log
0xe0       GPL,SL  R/W      1  SCT Command/Status
0xe1       GPL,SL  R/W      1  SCT Data Transfer

SMART Extended Comprehensive Error Log Version: 1 (6 sectors)
Device Error Count: 2650 (device log contains only the most recent 24 errors)
	CR     = Command Register
	FEATR  = Features Register
	COUNT  = Count (was: Sector Count) Register
	LBA_48 = Upper bytes of LBA High/Mid/Low Registers ]  ATA-8
	LH     = LBA High (was: Cylinder High) Register    ]   LBA
	LM     = LBA Mid (was: Cylinder Low) Register      ] Register
	LL     = LBA Low (was: Sector Number) Register     ]
	DV     = Device (was: Device/Head) Register
	DC     = Device Control Register
	ER     = Error register
	ST     = Status register
Powered_Up_Time is measured from power on, and printed as
DDd+hh:mm:SS.sss where DD=days, hh=hours, mm=minutes,
SS=sec, and sss=millisec. It "wraps" after 49.710 days.

Error 2650 [9] occurred at disk power-on lifetime: 6295 hours (262 days + 7 hours)
  When the command that caused the error occurred, the device was active or idle.

  After command completion occurred, registers were:
  ER -- ST COUNT  LBA_48  LH LM LL DV DC
  -- -- -- == -- == == == -- -- -- -- --
  40 -- 51 04 00 00 06 69 00 5f 10 e0 00  Error: UNC 1024 sectors at LBA = 0x669005f10 = 27531435792

  Commands leading to the command that caused the error were:
  CR FEATR COUNT  LBA_48  LH LM LL DV DC  Powered_Up_Time  Command/Feature_Name
  -- == -- == -- == == == -- -- -- -- --  ---------------  --------------------
  25 00 00 04 00 00 06 69 00 5f 10 e0 08     00:55:19.106  READ DMA EXT
  25 00 00 04 00 00 06 65 00 5f 10 e0 08     00:55:19.034  READ DMA EXT
  25 00 00 04 00 00 06 61 00 5f 10 e0 08     00:55:19.030  READ DMA EXT
  25 00 00 04 00 00 06 5d 00 5f 10 e0 08     00:55:19.024  READ DMA EXT
  25 00 00 04 00 00 06 59 00 5f 10 e0 08     00:55:19.020  READ DMA EXT

Error 2649 [8] occurred at disk power-on lifetime: 6289 hours (262 days + 1 hours)
  When the command that caused the error occurred, the device was active or idle.

  After command completion occurred, registers were:
  ER -- ST COUNT  LBA_48  LH LM LL DV DC
  -- -- -- == -- == == == -- -- -- -- --
  40 -- 51 00 08 00 06 6c 00 5f db e6 00  Error: UNC 8 sectors at LBA = 0x66e005fdb = 27615322075

  Commands leading to the command that caused the error were:
  CR FEATR COUNT  LBA_48  LH LM LL DV DC  Powered_Up_Time  Command/Feature_Name
  -- == -- == -- == == == -- -- -- -- --  ---------------  --------------------
  c8 00 00 00 08 00 06 6c 00 5f d8 e6 08  1d+02:35:43.752  READ DMA
  27 00 00 00 00 00 00 00 00 00 00 e0 08  1d+02:35:43.752  READ NATIVE MAX ADDRESS EXT [OBS-ACS-3]
  ec 00 00 00 00 00 00 00 00 00 00 a0 08  1d+02:35:43.749  IDENTIFY DEVICE
  ef 00 03 00 46 00 00 00 00 00 00 a0 08  1d+02:35:43.749  SET FEATURES [Set transfer mode]
  27 00 00 00 00 00 00 00 00 00 00 e0 08  1d+02:35:43.749  READ NATIVE MAX ADDRESS EXT [OBS-ACS-3]

Error 2648 [7] occurred at disk power-on lifetime: 6289 hours (262 days + 1 hours)
  When the command that caused the error occurred, the device was active or idle.

  After command completion occurred, registers were:
  ER -- ST COUNT  LBA_48  LH LM LL DV DC
  -- -- -- == -- == == == -- -- -- -- --
  40 -- 51 00 08 00 06 6c 00 5f db e6 00  Error: UNC 8 sectors at LBA = 0x66e005fdb = 27615322075

  Commands leading to the command that caused the error were:
  CR FEATR COUNT  LBA_48  LH LM LL DV DC  Powered_Up_Time  Command/Feature_Name
  -- == -- == -- == == == -- -- -- -- --  ---------------  --------------------
  c8 00 00 00 08 00 06 6c 00 5f d8 e6 08  1d+02:35:41.214  READ DMA
  27 00 00 00 00 00 00 00 00 00 00 e0 08  1d+02:35:41.214  READ NATIVE MAX ADDRESS EXT [OBS-ACS-3]
  ec 00 00 00 00 00 00 00 00 00 00 a0 08  1d+02:35:41.211  IDENTIFY DEVICE
  ef 00 03 00 46 00 00 00 00 00 00 a0 08  1d+02:35:41.211  SET FEATURES [Set transfer mode]
  27 00 00 00 00 00 00 00 00 00 00 e0 08  1d+02:35:41.210  READ NATIVE MAX ADDRESS EXT [OBS-ACS-3]

Error 2647 [6] occurred at disk power-on lifetime: 6289 hours (262 days + 1 hours)
  When the command that caused the error occurred, the device was active or idle.

  After command completion occurred, registers were:
  ER -- ST COUNT  LBA_48  LH LM LL DV DC
  -- -- -- == -- == == == -- -- -- -- --
  40 -- 51 00 08 00 06 6c 00 5f db e6 00  Error: UNC 8 sectors at LBA = 0x66e005fdb = 27615322075

  Commands leading to the command that caused the error were:
  CR FEATR COUNT  LBA_48  LH LM LL DV DC  Powered_Up_Time  Command/Feature_Name
  -- == -- == -- == == == -- -- -- -- --  ---------------  --------------------
  c8 00 00 00 08 00 06 6c 00 5f d8 e6 08  1d+02:35:38.956  READ DMA
  c8 00 00 00 08 00 06 6c 00 5f d0 e6 08  1d+02:35:38.955  READ DMA
  c8 00 00 00 08 00 06 6c 00 5f c8 e6 08  1d+02:35:38.955  READ DMA
  c8 00 00 00 08 00 06 6c 00 5f c0 e6 08  1d+02:35:38.955  READ DMA
  c8 00 00 00 08 00 06 6c 00 5f b8 e6 08  1d+02:35:38.954  READ DMA

Error 2646 [5] occurred at disk power-on lifetime: 6289 hours (262 days + 1 hours)
  When the command that caused the error occurred, the device was active or idle.

  After command completion occurred, registers were:
  ER -- ST COUNT  LBA_48  LH LM LL DV DC
  -- -- -- == -- == == == -- -- -- -- --
  40 -- 51 00 08 00 06 6c 00 5f db e6 00  Error: UNC 8 sectors at LBA = 0x66e005fdb = 27615322075

  Commands leading to the command that caused the error were:
  CR FEATR COUNT  LBA_48  LH LM LL DV DC  Powered_Up_Time  Command/Feature_Name
  -- == -- == -- == == == -- -- -- -- --  ---------------  --------------------
  c8 00 00 00 08 00 06 6c 00 5f d8 e6 08  1d+02:32:02.008  READ DMA
  c8 00 00 00 80 00 07 e5 00 57 08 e7 08  1d+02:32:02.007  READ DMA
  c8 00 00 00 80 00 07 e4 00 57 88 e7 08  1d+02:32:02.007  READ DMA
  c8 00 00 00 00 00 07 e3 00 57 88 e7 08  1d+02:32:02.006  READ DMA
  c8 00 00 00 90 00 07 e2 00 57 f8 e7 08  1d+02:32:01.994  READ DMA

Error 2645 [4] occurred at disk power-on lifetime: 6289 hours (262 days + 1 hours)
  When the command that caused the error occurred, the device was active or idle.

  After command completion occurred, registers were:
  ER -- ST COUNT  LBA_48  LH LM LL DV DC
  -- -- -- == -- == == == -- -- -- -- --
  40 -- 51 00 08 00 06 6c 00 5f db e6 00  Error: UNC 8 sectors at LBA = 0x66e005fdb = 27615322075

  Commands leading to the command that caused the error were:
  CR FEATR COUNT  LBA_48  LH LM LL DV DC  Powered_Up_Time  Command/Feature_Name
  -- == -- == -- == == == -- -- -- -- --  ---------------  --------------------
  c8 00 00 00 08 00 06 6c 00 5f d8 e6 08  1d+02:31:59.572  READ DMA
  ca 00 00 00 c8 00 00 34 00 00 78 e0 08  1d+02:31:59.571  WRITE DMA
  ca 00 00 00 90 00 00 33 00 00 d8 e0 08  1d+02:31:59.571  WRITE DMA
  ca 00 00 00 38 00 00 33 00 00 68 e0 08  1d+02:31:59.570  WRITE DMA
  ca 00 00 00 70 00 00 32 00 00 f0 e0 08  1d+02:31:59.570  WRITE DMA

Error 2644 [3] occurred at disk power-on lifetime: 6289 hours (262 days + 1 hours)
  When the command that caused the error occurred, the device was active or idle.

  After command completion occurred, registers were:
  ER -- ST COUNT  LBA_48  LH LM LL DV DC
  -- -- -- == -- == == == -- -- -- -- --
  40 -- 51 00 08 00 06 6c 00 5f db e6 00  Error: UNC 8 sectors at LBA = 0x66e005fdb = 27615322075

  Commands leading to the command that caused the error were:
  CR FEATR COUNT  LBA_48  LH LM LL DV DC  Powered_Up_Time  Command/Feature_Name
  -- == -- == -- == == == -- -- -- -- --  ---------------  --------------------
  c8 00 00 00 08 00 06 6c 00 5f d8 e6 08  1d+02:31:57.321  READ DMA
  ca 00 00 00 10 00 00 2f 00 00 40 e0 08  1d+02:31:57.321  WRITE DMA
  ca 00 00 00 08 00 00 2b 00 00 88 e0 08  1d+02:31:57.321  WRITE DMA
  ca 00 00 00 08 00 00 2b 00 00 68 e0 08  1d+02:31:57.320  WRITE DMA
  ca 00 00 00 08 00 09 ea 00 9e e0 e9 08  1d+02:31:57.320  WRITE DMA

Error 2643 [2] occurred at disk power-on lifetime: 6289 hours (262 days + 1 hours)
  When the command that caused the error occurred, the device was active or idle.

  After command completion occurred, registers were:
  ER -- ST COUNT  LBA_48  LH LM LL DV DC
  -- -- -- == -- == == == -- -- -- -- --
  40 -- 51 00 08 00 06 6c 00 5f db e6 00  Error: UNC 8 sectors at LBA = 0x66e005fdb = 27615322075

  Commands leading to the command that caused the error were:
  CR FEATR COUNT  LBA_48  LH LM LL DV DC  Powered_Up_Time  Command/Feature_Name
  -- == -- == -- == == == -- -- -- -- --  ---------------  --------------------
  c8 00 00 00 08 00 06 6c 00 5f d8 e6 08  1d+02:31:55.053  READ DMA
  c8 00 00 00 08 00 06 6c 00 5f d0 e6 08  1d+02:31:55.053  READ DMA
  c8 00 00 00 08 00 06 6c 00 5f c8 e6 08  1d+02:31:55.052  READ DMA
  c8 00 00 00 08 00 06 6c 00 5f c0 e6 08  1d+02:31:55.052  READ DMA
  c8 00 00 00 08 00 06 6c 00 5f b8 e6 08  1d+02:31:55.052  READ DMA

SMART Extended Self-test Log Version: 1 (1 sectors)
Num  Test_Description    Status                  Remaining  LifeTime(hours)  LBA_of_first_error
# 1  Short offline       Completed without error       00%      7487         -
# 2  Short offline       Completed without error       00%      7464         -
# 3  Short offline       Completed without error       00%      7449         -
# 4  Short offline       Completed without error       00%      7428         -
# 5  Short offline       Completed: read failure       90%      7404         106917083
# 6  Short offline       Completed without error       00%      7396         -
# 7  Short offline       Completed: read failure       90%      7375         106917083
# 8  Short offline       Completed: read failure       90%      6869         106917083
# 9  Short offline       Completed: read failure       90%      6845         106917083
#10  Short offline       Completed without error       00%      6821         -
#11  Short offline       Completed without error       00%      6797         -
#12  Short offline       Completed without error       00%      6777         -
#13  Short offline       Completed: read failure       90%      6768         106917083
#14  Short offline       Completed without error       00%      6754         -
#15  Short offline       Completed without error       00%      6730         -
#16  Short offline       Completed without error       00%      6706         -
#17  Short offline       Completed without error       00%      6701         -
#18  Short offline       Completed without error       00%      6699         -

SMART Selective self-test log data structure revision number 1
 SPAN  MIN_LBA  MAX_LBA  CURRENT_TEST_STATUS
    1        0        0  Not_testing
    2        0        0  Not_testing
    3        0        0  Not_testing
    4        0        0  Not_testing
    5        0        0  Not_testing
Selective self-test flags (0x0):
  After scanning selected spans, do NOT read-scan remainder of disk.
If Selective self-test is pending on power-up, resume after 0 minute delay.

SCT Status Version:                  2
SCT Version (vendor specific):       258 (0x0102)
Device State:                        SMART Off-line Data Collection executing in background (4)
Current Temperature:                    35 Celsius
Power Cycle Min/Max Temperature:     29/35 Celsius
Lifetime    Min/Max Temperature:     29/51 Celsius
Under/Over Temperature Limit Count:   0/0

SCT Temperature History Version:     2
Temperature Sampling Period:         1 minute
Temperature Logging Interval:        1 minute
Min/Max recommended Temperature:      0/60 Celsius
Min/Max Temperature Limit:           -41/85 Celsius
Temperature History Size (Index):    478 (331)

SCT Error Recovery Control command not supported

Device Statistics (GP/SMART Log 0x04) not supported

Pending Defects log (GP Log 0x0c) not supported

SATA Phy Event Counters (GP Log 0x11)
ID      Size     Value  Description
0x0001  2            0  Command failed due to ICRC error
0x0002  2            0  R_ERR response for data FIS
0x0003  2            0  R_ERR response for device-to-host data FIS
0x0004  2            0  R_ERR response for host-to-device data FIS
0x0005  2            0  R_ERR response for non-data FIS
0x0006  2            0  R_ERR response for device-to-host non-data FIS
0x0007  2            0  R_ERR response for host-to-device non-data FIS
0x000a  2            1  Device-to-host register FISes sent due to a COMRESET
0x8000  4         1399  Vendor specific

