smartctl 7.1 2019-12-30 r5022 [x86_64-linux-5.9.1-1-MANJARO] (local build)
Copyright (C) 2002-19, Bruce Allen, Christian Franke, www.smartmontools.org

=== START OF INFORMATION SECTION ===
Model Family:     SAMSUNG SpinPoint S250
Device Model:     SAMSUNG HD250HJ
Serial Number:    --
LU WWN Device Id: 5 0000f0 ...
Firmware Version: FH100-06
User Capacity:    250,059,350,016 bytes [250 GB]
Sector Size:      512 bytes logical/physical
Device is:        In smartctl database [for details use: -P show]
ATA Version is:   ATA/ATAPI-7, ATA8-ACS T13/1699-D revision 3b
Local Time is:    Tue Nov  3 19:48:41 2020 -03
SMART support is: Available - device has SMART capability.
SMART support is: Enabled
AAM feature is:   Disabled
APM level is:     254 (maximum performance)
Rd look-ahead is: Enabled
Write cache is:   Enabled
DSN feature is:   Unavailable
ATA Security is:  Disabled, frozen [SEC2]
Wt Cache Reorder: Enabled

=== START OF READ SMART DATA SECTION ===
SMART overall-health self-assessment test result: PASSED

General SMART Values:
Offline data collection status:  (0x02)	Offline data collection activity
					was completed without error.
					Auto Offline Data Collection: Disabled.
Self-test execution status:      (   0)	The previous self-test routine completed
					without error or no self-test has ever 
					been run.
Total time to complete Offline 
data collection: 		( 3697) seconds.
Offline data collection
capabilities: 			 (0x5b) SMART execute Offline immediate.
					Auto Offline data collection on/off support.
					Suspend Offline collection upon new
					command.
					Offline surface scan supported.
					Self-test supported.
					No Conveyance Self-test supported.
					Selective Self-test supported.
SMART capabilities:            (0x0003)	Saves SMART data before entering
					power-saving mode.
					Supports SMART auto save timer.
Error logging capability:        (0x01)	Error logging supported.
					General Purpose Logging supported.
Short self-test routine 
recommended polling time: 	 (   2) minutes.
Extended self-test routine
recommended polling time: 	 (  62) minutes.
SCT capabilities: 	       (0x003f)	SCT Status supported.
					SCT Error Recovery Control supported.
					SCT Feature Control supported.
					SCT Data Table supported.

SMART Attributes Data Structure revision number: 16
Vendor Specific SMART Attributes with Thresholds:
ID# ATTRIBUTE_NAME          FLAGS    VALUE WORST THRESH FAIL RAW_VALUE
  1 Raw_Read_Error_Rate     POSR--   253   098   051    -    0
  3 Spin_Up_Time            POS---   253   253   025    -    4416
  4 Start_Stop_Count        -O--CK   071   071   000    -    29705
  5 Reallocated_Sector_Ct   PO--CK   100   100   010    -    1
  7 Seek_Error_Rate         POSR--   253   253   051    -    0
  8 Seek_Time_Performance   P-S--K   253   253   015    -    0
  9 Power_On_Hours          -O--CK   100   100   000    -    48901
 10 Spin_Retry_Count        PO--CK   253   253   051    -    0
 11 Calibration_Retry_Count -O--C-   253   100   000    -    0
 12 Power_Cycle_Count       -O--CK   085   085   000    -    16067
 13 Read_Soft_Error_Rate    -OSR--   100   100   000    -    5154
184 End-to-End_Error        PO--CK   253   253   099    -    0
187 Reported_Uncorrect      -O--CK   253   253   000    -    1638400
188 Command_Timeout         -O--CK   253   253   000    -    0
190 Airflow_Temperature_Cel -O---K   157   070   000    -    27 (Min/Max 10/56)
194 Temperature_Celsius     -O---K   151   070   000    -    29 (Min/Max 10/56)
195 Hardware_ECC_Recovered  -O-RC-   100   100   000    -    5154
196 Reallocated_Event_Count -O--CK   100   100   000    -    1
197 Current_Pending_Sector  -O--C-   253   253   000    -    0
198 Offline_Uncorrectable   ----CK   253   253   000    -    0
199 UDMA_CRC_Error_Count    -OSRCK   200   200   000    -    0
200 Multi_Zone_Error_Rate   -O-R--   253   100   000    -    0
201 Soft_Read_Error_Rate    -O-R--   253   100   000    -    0
202 Data_Address_Mark_Errs  -O--CK   100   100   000    -    64
                            ||||||_ K auto-keep
                            |||||__ C event count
                            ||||___ R error rate
                            |||____ S speed/performance
                            ||_____ O updated online
                            |______ P prefailure warning

General Purpose Log Directory Version 1
SMART           Log Directory Version 1 [multi-sector log support]
Address    Access  R/W   Size  Description
0x00       GPL,SL  R/O      1  Log Directory
0x01           SL  R/O      1  Summary SMART error log
0x02           SL  R/O      2  Comprehensive SMART error log
0x03       GPL     R/O      2  Ext. Comprehensive SMART error log
0x06           SL  R/O      1  SMART self-test log
0x10       GPL     R/O      1  NCQ Command Error log
0x11       GPL     R/O      1  SATA Phy Event Counters log
0x80-0x9f  GPL,SL  R/W     16  Host vendor specific log
0xe0       GPL,SL  R/W      1  SCT Command/Status
0xe1       GPL,SL  R/W      1  SCT Data Transfer

SMART Extended Comprehensive Error Log Version: 1 (2 sectors)
Device Error Count: 32393 (device log contains only the most recent 8 errors)
	CR     = Command Register
	FEATR  = Features Register
	COUNT  = Count (was: Sector Count) Register
	LBA_48 = Upper bytes of LBA High/Mid/Low Registers ]  ATA-8
	LH     = LBA High (was: Cylinder High) Register    ]   LBA
	LM     = LBA Mid (was: Cylinder Low) Register      ] Register
	LL     = LBA Low (was: Sector Number) Register     ]
	DV     = Device (was: Device/Head) Register
	DC     = Device Control Register
	ER     = Error register
	ST     = Status register
Powered_Up_Time is measured from power on, and printed as
DDd+hh:mm:SS.sss where DD=days, hh=hours, mm=minutes,
SS=sec, and sss=millisec. It "wraps" after 49.710 days.

Error 32393 [0] occurred at disk power-on lifetime: 1765 hours (73 days + 13 hours)
  When the command that caused the error occurred, the device was in a reserved state.

  After command completion occurred, registers were:
  ER -- ST COUNT  LBA_48  LH LM LL DV DC
  -- -- -- == -- == == == -- -- -- -- --
  f0 -- 32 6c 4c 58 a2 51 6c 00 e0 81 00

  Commands leading to the command that caused the error were:
  CR FEATR COUNT  LBA_48  LH LM LL DV DC  Powered_Up_Time  Command/Feature_Name
  -- == -- == -- == == == -- -- -- -- --  ---------------  --------------------
  9b 5b a3 00 01 e0 4c 00 6c f0 00 c8 9b 25d+15:09:52.859  [RESERVED]
  08 4b f0 e0 6c 00 5b 5d 01 a3 c8 00 00 39d+00:19:08.532  DEVICE RESET
  5d 5b a3 00 01 e9 9e 08 89 50 00 c8 5d     00:00:00.347  TRUSTED RECEIVE DMA
  00 00 00 00 40 00 df 00 72 03 01 00 20 39d+00:09:10.986  NOP [Abort queued commands]
  a1 00 60 e0 00 7e 88 00 6c a2 51 2d 80 12d+10:17:20.128  IDENTIFY PACKET DEVICE

Error 32392 [7] occurred at disk power-on lifetime: 9074 hours (378 days + 2 hours)
  When the command that caused the error occurred, the device was in a reserved state.

  After command completion occurred, registers were:
  ER -- ST COUNT  LBA_48  LH LM LL DV DC
  -- -- -- == -- == == == -- -- -- -- --
  40 -- 00 38 07 40 a3 e5 00 00 0e 61 08   at LBA = 0x40a3e500000e = 71072665829390

  Commands leading to the command that caused the error were:
  CR FEATR COUNT  LBA_48  LH LM LL DV DC  Powered_Up_Time  Command/Feature_Name
  -- == -- == -- == == == -- -- -- -- --  ---------------  --------------------
  34 07 40 0e 38 61 00 00 40 a3 e5 00 08 26d+09:48:21.400  WRITE SECTORS(S) EXT
  34 00 02 00 00 ef 00 00 a0 00 00 00 00 26d+09:48:21.400  WRITE SECTORS(S) EXT
  34 00 00 00 00 27 00 00 e0 00 00 00 00  3d+02:33:55.480  WRITE SECTORS(S) EXT
  f5 00 00 00 00 ec 00 00 a0 00 00 00 10     00:00:00.024  SECURITY FREEZE LOCK
  00 00 13 01 80 08 00 20 40 00 04 dd a1     00:00:48.121  NOP [Reserved subcommand] [OBS-ACS-2]

Error 32391 [6] occurred at disk power-on lifetime: 9076 hours (378 days + 4 hours)
  When the command that caused the error occurred, the device was in a vendor specific state.

  After command completion occurred, registers were:
  ER -- ST COUNT  LBA_48  LH LM LL DV DC
  -- -- -- == -- == == == -- -- -- -- --
  60 -- 00 38 0b 40 00 03 00 00 00 60 88

  Commands leading to the command that caused the error were:
  CR FEATR COUNT  LBA_48  LH LM LL DV DC  Powered_Up_Time  Command/Feature_Name
  -- == -- == -- == == == -- -- -- -- --  ---------------  --------------------
  bd 00 02 00 00 ef 00 00 a0 00 00 00 00  1d+13:16:57.752  [RESERVED]
  bd 00 00 00 00 27 00 00 e0 00 00 00 00  3d+02:33:55.480  [RESERVED]
  bd 00 00 00 00 ec 00 00 a0 00 00 00 10     00:00:00.024  [RESERVED]
  bd 00 06 00 00 ef 00 00 00 00 00 00 00     00:00:00.024  [RESERVED]
  00 00 13 01 80 08 00 20 40 00 04 dc a1  3d+02:34:43.577  NOP [Reserved subcommand] [OBS-ACS-2]

Error 32390 [5] occurred at disk power-on lifetime: 9076 hours (378 days + 4 hours)
  When the command that caused the error occurred, the device was in a vendor specific state.

  After command completion occurred, registers were:
  ER -- ST COUNT  LBA_48  LH LM LL DV DC
  -- -- -- == -- == == == -- -- -- -- --
  b8 -- 00 00 16 40 a3 e3 00 00 0e 61 50

  Commands leading to the command that caused the error were:
  CR FEATR COUNT  LBA_48  LH LM LL DV DC  Powered_Up_Time  Command/Feature_Name
  -- == -- == -- == == == -- -- -- -- --  ---------------  --------------------
  46 16 b8 0e 00 61 00 00 40 a3 e3 00 50 45d+01:11:54.136  [RESERVED]
  46 00 02 00 00 ef 00 00 a0 00 00 00 00 45d+01:11:54.136  [RESERVED]
  46 00 00 00 00 27 00 00 e0 00 00 00 00  3d+02:33:55.480  [RESERVED]
  46 00 00 00 00 ec 00 00 a0 00 00 00 10     00:00:00.024  [RESERVED]
  00 00 13 01 80 08 00 20 40 00 04 e3 a0     00:00:48.121  NOP [Reserved subcommand] [OBS-ACS-2]

Error 32389 [4] occurred at disk power-on lifetime: 9073 hours (378 days + 1 hours)
  When the command that caused the error occurred, the device was in a reserved state.

  After command completion occurred, registers were:
  ER -- ST COUNT  LBA_48  LH LM LL DV DC
  -- -- -- == -- == == == -- -- -- -- --
  00 -- 00 78 1e 40 a3 ef 00 00 0e 61 30

  Commands leading to the command that caused the error were:
  CR FEATR COUNT  LBA_48  LH LM LL DV DC  Powered_Up_Time  Command/Feature_Name
  -- == -- == -- == == == -- -- -- -- --  ---------------  --------------------
  87 1e 00 0e 78 61 00 00 40 a3 ef 00 30 40d+09:21:00.952  CFA TRANSLATE SECTOR [VS IF NO CFA]
  87 00 02 00 00 ef 00 00 a0 00 00 00 00 40d+09:21:00.952  CFA TRANSLATE SECTOR [VS IF NO CFA]
  87 00 00 00 00 27 00 00 e0 00 00 00 00  3d+02:33:55.480  CFA TRANSLATE SECTOR [VS IF NO CFA]
  87 00 00 00 00 ec 00 00 a0 00 00 00 10     00:00:00.024  CFA TRANSLATE SECTOR [VS IF NO CFA]
  7e 11 89 11 91 00 00 11 01 c9 b1 01 11     00:00:00.000  SEEK [RET-4]

Error 32388 [3] occurred at disk power-on lifetime: 25408 hours (1058 days + 16 hours)
  When the command that caused the error occurred, the device was in a reserved state.

  After command completion occurred, registers were:
  ER -- ST COUNT  LBA_48  LH LM LL DV DC
  -- -- -- == -- == == == -- -- -- -- --
  00 -- 00 00 00 00 00 00 00 00 00 00 00

  Commands leading to the command that caused the error were:
  CR FEATR COUNT  LBA_48  LH LM LL DV DC  Powered_Up_Time  Command/Feature_Name
  -- == -- == -- == == == -- -- -- -- --  ---------------  --------------------
  00 00 13 01 80 00 00 20 40 00 40 01 a1     00:00:28.195  NOP [Reserved subcommand] [OBS-ACS-2]

Error 32387 [2] occurred at disk power-on lifetime: 8828 hours (367 days + 20 hours)
  When the command that caused the error occurred, the device was doing SMART Offline or Self-test.

  After command completion occurred, registers were:
  ER -- ST COUNT  LBA_48  LH LM LL DV DC
  -- -- -- == -- == == == -- -- -- -- --
  39 -- 18 c8 e4 00 00 12 00 06 ef 00 2d

  Commands leading to the command that caused the error were:
  CR FEATR COUNT  LBA_48  LH LM LL DV DC  Powered_Up_Time  Command/Feature_Name
  -- == -- == -- == == == -- -- -- -- --  ---------------  --------------------
  06 00 00 00 00 ef e4 2c c8 39 18 12 06  4d+15:50:53.184  DATA SET MANAGEMENT
  2b e4 39 ef c8 00 00 06 00 00 12 18 2a  3d+16:15:04.420  READ STREAM
  14 01 80 60 40 00 00 00 02 40 00 03 00  4d+15:50:53.184  RECALIBRATE [RET-4]
  78 00 00 00 84 00 e5 b7 51 05 40 a2 4c  3d+14:48:08.575  ACCESSIBLE MAX ADDRESS CONFIGURATION
  b7 e5 05 da c8 00 00 4c 00 00 5b 40 b6 17d+20:04:24.933  [RESERVED FOR COMPACTFLASH ASSOCIATION]

Error 32386 [1] occurred at disk power-on lifetime: 16384 hours (682 days + 16 hours)
  When the command that caused the error occurred, the device was in an unknown state.

  After command completion occurred, registers were:
  ER -- ST COUNT  LBA_48  LH LM LL DV DC
  -- -- -- == -- == == == -- -- -- -- --
  c8 -- 05 5b da 40 00 00 00 00 4c b4 e5  Error: 

  Commands leading to the command that caused the error were:
  CR FEATR COUNT  LBA_48  LH LM LL DV DC  Powered_Up_Time  Command/Feature_Name
  -- == -- == -- == == == -- -- -- -- --  ---------------  --------------------
  00 60 40 00 00 e1 00 00 03 01 40 6d 01  1d+02:33:53.408  NOP [Reserved subcommand] [OBS-ACS-2]
  79 00 84 e9 f8 78 00 e7 a2 51 06 64 00 24d+20:31:28.161  SEEK [RET-4]
  e7 e5 c8 99 b9 e9 00 00 f8 00 01 06 e7     07:27:31.813  FLUSH CACHE
  00 00 00 e7 f8 99 e5 e7 b9 c8 06 01 00  1d+08:12:11.136  NOP [Abort queued commands]
  e7 e5 c8 99 b9 e6 00 00 f8 00 01 06 e7     07:27:31.813  FLUSH CACHE

SMART Extended Self-test Log (GP Log 0x07) not supported

SMART Self-test log structure revision number 1
Num  Test_Description    Status                  Remaining  LifeTime(hours)  LBA_of_first_error
# 1  Short offline       Completed without error       00%     36460         -
# 2  Short offline       Completed without error       00%     36344         -
# 3  Short offline       Completed without error       00%     35925         -

SMART Selective self-test log data structure revision number 0
Note: revision number not 1 implies that no selective self-test has ever been run
 SPAN  MIN_LBA  MAX_LBA  CURRENT_TEST_STATUS
    1        0        0  Not_testing
    2        0        0  Not_testing
    3        0        0  Not_testing
    4        0        0  Not_testing
    5        0        0  Not_testing
Selective self-test flags (0x0):
  After scanning selected spans, do NOT read-scan remainder of disk.
If Selective self-test is pending on power-up, resume after 0 minute delay.

SCT Status Version:                  2
SCT Version (vendor specific):       256 (0x0100)
Device State:                        Active (0)
Current Temperature:                    29 Celsius
Power Cycle Min/Max Temperature:     22/29 Celsius
Lifetime    Min/Max Temperature:     11/57 Celsius
Under/Over Temperature Limit Count:   0/0

SCT Temperature History Version:     2
Temperature Sampling Period:         1 minute
Temperature Logging Interval:        1 minute
Min/Max recommended Temperature:     -4/72 Celsius
Min/Max Temperature Limit:           -9/77 Celsius
Temperature History Size (Index):    128 (42)

SCT Error Recovery Control:
           Read: Disabled
          Write: Disabled

Device Statistics (GP/SMART Log 0x04) not supported

Pending Defects log (GP Log 0x0c) not supported

SATA Phy Event Counters (GP Log 0x11)
ID      Size     Value  Description
0x0001  2            0  Command failed due to ICRC error
0x0002  2            0  R_ERR response for data FIS
0x0003  2            0  R_ERR response for device-to-host data FIS
0x0004  2            0  R_ERR response for host-to-device data FIS
0x0005  2            0  R_ERR response for non-data FIS
0x0006  2            0  R_ERR response for device-to-host non-data FIS
0x0007  2            0  R_ERR response for host-to-device non-data FIS
0x0008  2            0  Device-to-host non-data FIS retries
0x0009  2            0  Transition from drive PhyRdy to drive PhyNRdy
0x000a  2            2  Device-to-host register FISes sent due to a COMRESET
0x000b  2            0  CRC errors within host-to-device FIS
0x000d  2            0  Non-CRC errors within host-to-device FIS
0x000f  2            0  R_ERR response for host-to-device data FIS, CRC
0x0010  2            0  R_ERR response for host-to-device data FIS, non-CRC
0x0012  2            0  R_ERR response for host-to-device non-data FIS, CRC
0x0013  2            0  R_ERR response for host-to-device non-data FIS, non-CRC
0x8001  2            0  Vendor specific



