smartctl 7.5 2025-04-30 r5714 [x86_64-linux-6.14.9-300.fc42.x86_64] (local build)
Copyright (C) 2002-25, Bruce Allen, Christian Franke, www.smartmontools.org

=== START OF INFORMATION SECTION ===
Model Number:                       BC901 NVMe SK hynix 1024GB
Serial Number:                      --
Firmware Version:                   51005151
PCI Vendor/Subsystem ID:            0x1c5c
IEEE OUI Identifier:                0xace42e
Controller ID:                      1
NVMe Version:                       1.4
Number of Namespaces:               1
Namespace 1 Size/Capacity:          1,024,209,543,168 [1.02 TB]
Namespace 1 Formatted LBA Size:     512
Namespace 1 IEEE EUI-64:            ace42e ...
Local Time is:                      Fri Jun  6 16:22:19 2025 +07
Firmware Updates (0x16):            3 Slots, no Reset required
Optional Admin Commands (0x0017):   Security Format Frmw_DL Self_Test
Optional NVM Commands (0x00df):     Comp Wr_Unc DS_Mngmt Wr_Zero Sav/Sel_Feat Timestmp Verify
Log Page Attributes (0x1e):         Cmd_Eff_Lg Ext_Get_Lg Telmtry_Lg Pers_Ev_Lg
Maximum Data Transfer Size:         64 Pages
Warning  Comp. Temp. Threshold:     83 Celsius
Critical Comp. Temp. Threshold:     85 Celsius

Supported Power States
St Op     Max   Active     Idle   RL RT WL WT  Ent_Lat  Ex_Lat
 0 +   4.5000W       -        -    0  0  0  0      100     100
 1 +   3.0000W       -        -    1  1  1  1      200     200
 2 +   0.6000W       -        -    2  2  2  2      400     400
 3 -   0.0150W       -        -    3  3  3  3     2000    2000
 4 -   0.0030W       -        -    4  4  4  4     5000   10000

Supported LBA Sizes (NSID 0x1)
Id Fmt  Data  Metadt  Rel_Perf
 0 +     512       0         0

=== START OF SMART DATA SECTION ===
SMART overall-health self-assessment test result: PASSED

SMART/Health Information (NVMe Log 0x02, NSID 0xffffffff)
Critical Warning:                   0x00
Temperature:                        46 Celsius
Available Spare:                    100%
Available Spare Threshold:          50%
Percentage Used:                    0%
Data Units Read:                    17,061,280 [8.73 TB]
Data Units Written:                 17,503,472 [8.96 TB]
Host Read Commands:                 254,089,019
Host Write Commands:                369,738,725
Controller Busy Time:               8,040
Power Cycles:                       347
Power On Hours:                     4,154
Unsafe Shutdowns:                   35
Media and Data Integrity Errors:    0
Error Information Log Entries:      0
Warning  Comp. Temperature Time:    0
Critical Comp. Temperature Time:    0
Temperature Sensor 1:               46 Celsius
Temperature Sensor 2:               52 Celsius
Thermal Temp. 1 Transition Count:   137
Thermal Temp. 2 Transition Count:   18

Error Information (NVMe Log 0x01, 16 of 256 entries)
No Errors Logged

Self-test Log (NVMe Log 0x06, NSID 0xffffffff)
Self-test status: No self-test in progress
Num  Test_Description  Status                       Power_on_Hours  Failing_LBA  NSID Seg SCT Code
 0   Short             Completed without error                4054            -     -   -   -    -
 1   Short             Completed without error                3740            -     -   -   -    -
 2   Short             Completed without error                3269            -     -   -   -    -
 3   Short             Completed without error                2954            -     -   -   -    -
 4   Short             Completed without error                2686            -     -   -   -    -
 5   Short             Completed without error                2320            -     -   -   -    -
 6   Short             Completed without error                2040            -     -   -   -    -
 7   Short             Completed without error                1761            -     -   -   -    -
 8   Short             Completed without error                1454            -     -   -   -    -
 9   Short             Completed without error                1109            -     -   -   -    -
10   Short             Completed without error                 619            -     -   -   -    -
11   Short             Completed without error                 197            -     -   -   -    -
12   Short             Completed without error                   2            -     -   -   -    -

