smartctl 7.2 2020-12-30 r5155 [x86_64-linux-5.10.102-std-def-alt1] (ALT Sisyphus 7.2-alt1)
Copyright (C) 2002-20, Bruce Allen, Christian Franke, www.smartmontools.org

=== START OF INFORMATION SECTION ===
Model Family:     Western Digital Caviar Blue (SATA)
Device Model:     WDC WD3200AAKS-00V1A0
Serial Number:    --
LU WWN Device Id: 5 0014ee ...
Firmware Version: 05.01D05
User Capacity:    320,071,851,520 bytes [320 GB]
Sector Size:      512 bytes logical/physical
Device is:        In smartctl database [for details use: -P show]
ATA Version is:   ATA8-ACS (minor revision not indicated)
SATA Version is:  SATA 2.6, 3.0 Gb/s
Local Time is:    Tue Apr 12 16:25:14 2022 MSK
SMART support is: Available - device has SMART capability.
SMART support is: Enabled
AAM level is:     254 (maximum performance), recommended: 128
APM feature is:   Unavailable
Rd look-ahead is: Enabled
Write cache is:   Enabled
DSN feature is:   Unavailable
ATA Security is:  Disabled, frozen [SEC2]
Wt Cache Reorder: Enabled

=== START OF READ SMART DATA SECTION ===
SMART overall-health self-assessment test result: PASSED

General SMART Values:
Offline data collection status:  (0x84)	Offline data collection activity
					was suspended by an interrupting command from host.
					Auto Offline Data Collection: Enabled.
Self-test execution status:      (   0)	The previous self-test routine completed
					without error or no self-test has ever 
					been run.
Total time to complete Offline 
data collection: 		( 6360) seconds.
Offline data collection
capabilities: 			 (0x7b) SMART execute Offline immediate.
					Auto Offline data collection on/off support.
					Suspend Offline collection upon new
					command.
					Offline surface scan supported.
					Self-test supported.
					Conveyance Self-test supported.
					Selective Self-test supported.
SMART capabilities:            (0x0003)	Saves SMART data before entering
					power-saving mode.
					Supports SMART auto save timer.
Error logging capability:        (0x01)	Error logging supported.
					General Purpose Logging supported.
Short self-test routine 
recommended polling time: 	 (   2) minutes.
Extended self-test routine
recommended polling time: 	 (  77) minutes.
Conveyance self-test routine
recommended polling time: 	 (   5) minutes.
SCT capabilities: 	       (0x303f)	SCT Status supported.
					SCT Error Recovery Control supported.
					SCT Feature Control supported.
					SCT Data Table supported.

SMART Attributes Data Structure revision number: 16
Vendor Specific SMART Attributes with Thresholds:
ID# ATTRIBUTE_NAME          FLAGS    VALUE WORST THRESH FAIL RAW_VALUE
  1 Raw_Read_Error_Rate     POSR-K   200   200   051    -    0
  3 Spin_Up_Time            POS--K   143   141   021    -    3850
  4 Start_Stop_Count        -O--CK   098   098   000    -    2457
  5 Reallocated_Sector_Ct   PO--CK   200   200   140    -    0
  7 Seek_Error_Rate         -OSR-K   200   200   000    -    0
  9 Power_On_Hours          -O--CK   074   074   000    -    19636
 10 Spin_Retry_Count        -O--CK   100   100   000    -    0
 11 Calibration_Retry_Count -O--CK   100   100   000    -    0
 12 Power_Cycle_Count       -O--CK   098   098   000    -    2402
192 Power-Off_Retract_Count -O--CK   200   200   000    -    619
193 Load_Cycle_Count        -O--CK   200   200   000    -    1837
194 Temperature_Celsius     -O---K   104   087   000    -    39
196 Reallocated_Event_Count -O--CK   200   200   000    -    0
197 Current_Pending_Sector  -O--CK   200   200   000    -    0
198 Offline_Uncorrectable   ----CK   200   200   000    -    0
199 UDMA_CRC_Error_Count    -O--CK   200   200   000    -    161
200 Multi_Zone_Error_Rate   ---R--   200   200   000    -    0
                            ||||||_ K auto-keep
                            |||||__ C event count
                            ||||___ R error rate
                            |||____ S speed/performance
                            ||_____ O updated online
                            |______ P prefailure warning

General Purpose Log Directory Version 1
SMART           Log Directory Version 1 [multi-sector log support]
Address    Access  R/W   Size  Description
0x00       GPL,SL  R/O      1  Log Directory
0x01           SL  R/O      1  Summary SMART error log
0x02           SL  R/O      5  Comprehensive SMART error log
0x03       GPL     R/O      6  Ext. Comprehensive SMART error log
0x06           SL  R/O      1  SMART self-test log
0x07       GPL     R/O      1  Extended self-test log
0x09           SL  R/W      1  Selective self-test log
0x10       GPL     R/O      1  NCQ Command Error log
0x11       GPL     R/O      1  SATA Phy Event Counters log
0x80-0x9f  GPL,SL  R/W     16  Host vendor specific log
0xa0-0xa7  GPL,SL  VS      16  Device vendor specific log
0xa8-0xb5  GPL,SL  VS       1  Device vendor specific log
0xb6       GPL     VS       1  Device vendor specific log
0xb7       GPL,SL  VS       1  Device vendor specific log
0xc0       GPL,SL  VS       1  Device vendor specific log
0xc1       GPL     VS      24  Device vendor specific log
0xe0       GPL,SL  R/W      1  SCT Command/Status
0xe1       GPL,SL  R/W      1  SCT Data Transfer

SMART Extended Comprehensive Error Log Version: 1 (6 sectors)
Device Error Count: 180 (device log contains only the most recent 24 errors)
	CR     = Command Register
	FEATR  = Features Register
	COUNT  = Count (was: Sector Count) Register
	LBA_48 = Upper bytes of LBA High/Mid/Low Registers ]  ATA-8
	LH     = LBA High (was: Cylinder High) Register    ]   LBA
	LM     = LBA Mid (was: Cylinder Low) Register      ] Register
	LL     = LBA Low (was: Sector Number) Register     ]
	DV     = Device (was: Device/Head) Register
	DC     = Device Control Register
	ER     = Error register
	ST     = Status register
Powered_Up_Time is measured from power on, and printed as
DDd+hh:mm:SS.sss where DD=days, hh=hours, mm=minutes,
SS=sec, and sss=millisec. It "wraps" after 49.710 days.

Error 180 [11] occurred at disk power-on lifetime: 858 hours (35 days + 18 hours)
  When the command that caused the error occurred, the device was active or idle.

  After command completion occurred, registers were:
  ER -- ST COUNT  LBA_48  LH LM LL DV DC
  -- -- -- == -- == == == -- -- -- -- --
  40 -- 51 00 08 00 00 a8 00 60 3f e0 00  Error: UNC 8 sectors at LBA = 0xa800603f = 2818596927

  Commands leading to the command that caused the error were:
  CR FEATR COUNT  LBA_48  LH LM LL DV DC  Powered_Up_Time  Command/Feature_Name
  -- == -- == -- == == == -- -- -- -- --  ---------------  --------------------
  25 00 00 00 08 00 00 a8 00 60 3f e0 08     00:15:33.926  READ DMA EXT
  25 00 00 00 08 00 00 a8 00 60 3f e0 08     00:15:32.051  READ DMA EXT
  25 00 00 00 08 00 00 fc 00 04 cf e0 08     00:15:32.048  READ DMA EXT
  25 00 00 00 08 00 00 cc 00 05 df e0 08     00:15:32.034  READ DMA EXT
  25 00 00 00 08 00 00 c6 00 06 87 e0 08     00:15:32.029  READ DMA EXT

Error 179 [10] occurred at disk power-on lifetime: 858 hours (35 days + 18 hours)
  When the command that caused the error occurred, the device was in an unknown state.

  After command completion occurred, registers were:
  ER -- ST COUNT  LBA_48  LH LM LL DV DC
  -- -- -- == -- == == == -- -- -- -- --
  40 -- 51 00 08 00 00 a8 00 60 3f e0 00  Error: UNC 8 sectors at LBA = 0xa800603f = 2818596927

  Commands leading to the command that caused the error were:
  CR FEATR COUNT  LBA_48  LH LM LL DV DC  Powered_Up_Time  Command/Feature_Name
  -- == -- == -- == == == -- -- -- -- --  ---------------  --------------------
  25 00 00 00 08 00 00 a8 00 60 3f e0 08     00:15:32.051  READ DMA EXT
  25 00 00 00 08 00 00 fc 00 04 cf e0 08     00:15:32.048  READ DMA EXT
  25 00 00 00 08 00 00 cc 00 05 df e0 08     00:15:32.034  READ DMA EXT
  25 00 00 00 08 00 00 c6 00 06 87 e0 08     00:15:32.029  READ DMA EXT
  25 00 00 00 08 00 00 c1 00 06 af e0 08     00:15:32.007  READ DMA EXT

Error 178 [9] occurred at disk power-on lifetime: 858 hours (35 days + 18 hours)
  When the command that caused the error occurred, the device was active or idle.

  After command completion occurred, registers were:
  ER -- ST COUNT  LBA_48  LH LM LL DV DC
  -- -- -- == -- == == == -- -- -- -- --
  40 -- 51 00 08 00 00 a8 00 60 3f e0 00  Error: UNC 8 sectors at LBA = 0xa800603f = 2818596927

  Commands leading to the command that caused the error were:
  CR FEATR COUNT  LBA_48  LH LM LL DV DC  Powered_Up_Time  Command/Feature_Name
  -- == -- == -- == == == -- -- -- -- --  ---------------  --------------------
  25 00 00 00 08 00 00 a8 00 60 3f e0 08     00:00:55.360  READ DMA EXT
  25 00 00 00 08 00 00 a8 00 60 3f e0 08     00:00:53.477  READ DMA EXT
  25 00 00 00 08 00 13 5a 00 5a cf e0 08     00:00:53.457  READ DMA EXT
  25 00 00 00 08 00 00 29 00 60 e7 e0 08     00:00:53.452  READ DMA EXT
  25 00 00 00 08 00 00 1b 00 60 7f e0 08     00:00:53.451  READ DMA EXT

Error 177 [8] occurred at disk power-on lifetime: 858 hours (35 days + 18 hours)
  When the command that caused the error occurred, the device was active or idle.

  After command completion occurred, registers were:
  ER -- ST COUNT  LBA_48  LH LM LL DV DC
  -- -- -- == -- == == == -- -- -- -- --
  40 -- 51 00 08 00 00 a8 00 60 3f e0 00  Error: UNC 8 sectors at LBA = 0xa800603f = 2818596927

  Commands leading to the command that caused the error were:
  CR FEATR COUNT  LBA_48  LH LM LL DV DC  Powered_Up_Time  Command/Feature_Name
  -- == -- == -- == == == -- -- -- -- --  ---------------  --------------------
  25 00 00 00 08 00 00 a8 00 60 3f e0 08     00:00:53.477  READ DMA EXT
  25 00 00 00 08 00 13 5a 00 5a cf e0 08     00:00:53.457  READ DMA EXT
  25 00 00 00 08 00 00 29 00 60 e7 e0 08     00:00:53.452  READ DMA EXT
  25 00 00 00 08 00 00 1b 00 60 7f e0 08     00:00:53.451  READ DMA EXT
  25 00 00 00 08 00 00 2c 00 60 2f e0 08     00:00:53.445  READ DMA EXT

Error 176 [7] occurred at disk power-on lifetime: 858 hours (35 days + 18 hours)
  When the command that caused the error occurred, the device was active or idle.

  After command completion occurred, registers were:
  ER -- ST COUNT  LBA_48  LH LM LL DV DC
  -- -- -- == -- == == == -- -- -- -- --
  40 -- 51 00 08 00 00 a8 00 60 3f e0 00  Error: UNC 8 sectors at LBA = 0xa800603f = 2818596927

  Commands leading to the command that caused the error were:
  CR FEATR COUNT  LBA_48  LH LM LL DV DC  Powered_Up_Time  Command/Feature_Name
  -- == -- == -- == == == -- -- -- -- --  ---------------  --------------------
  25 da d8 00 08 00 00 a8 00 60 3f e0 00     00:05:26.730  READ DMA EXT
  25 da d8 00 08 00 00 a8 00 60 3f e0 00     00:05:24.847  READ DMA EXT
  25 da d8 00 08 00 13 5a 00 5a cf e0 00     00:05:24.827  READ DMA EXT
  25 da d8 00 08 00 00 29 00 60 e7 e0 00     00:05:24.826  READ DMA EXT
  25 da d8 00 08 00 00 1b 00 60 7f e0 00     00:05:24.826  READ DMA EXT

Error 175 [6] occurred at disk power-on lifetime: 858 hours (35 days + 18 hours)
  When the command that caused the error occurred, the device was active or idle.

  After command completion occurred, registers were:
  ER -- ST COUNT  LBA_48  LH LM LL DV DC
  -- -- -- == -- == == == -- -- -- -- --
  40 -- 51 00 08 00 00 a8 00 60 3f e0 00  Error: UNC 8 sectors at LBA = 0xa800603f = 2818596927

  Commands leading to the command that caused the error were:
  CR FEATR COUNT  LBA_48  LH LM LL DV DC  Powered_Up_Time  Command/Feature_Name
  -- == -- == -- == == == -- -- -- -- --  ---------------  --------------------
  25 da d8 00 08 00 00 a8 00 60 3f e0 00     00:05:24.847  READ DMA EXT
  25 da d8 00 08 00 13 5a 00 5a cf e0 00     00:05:24.827  READ DMA EXT
  25 da d8 00 08 00 00 29 00 60 e7 e0 00     00:05:24.826  READ DMA EXT
  25 da d8 00 08 00 00 1b 00 60 7f e0 00     00:05:24.826  READ DMA EXT
  25 da d8 00 08 00 00 2c 00 60 2f e0 00     00:05:24.826  READ DMA EXT

Error 174 [5] occurred at disk power-on lifetime: 858 hours (35 days + 18 hours)
  When the command that caused the error occurred, the device was active or idle.

  After command completion occurred, registers were:
  ER -- ST COUNT  LBA_48  LH LM LL DV DC
  -- -- -- == -- == == == -- -- -- -- --
  40 -- 51 00 08 00 00 a8 00 60 3f e0 00  Error: UNC 8 sectors at LBA = 0xa800603f = 2818596927

  Commands leading to the command that caused the error were:
  CR FEATR COUNT  LBA_48  LH LM LL DV DC  Powered_Up_Time  Command/Feature_Name
  -- == -- == -- == == == -- -- -- -- --  ---------------  --------------------
  25 da d8 00 08 00 00 a8 00 60 3f e0 00     00:04:41.768  READ DMA EXT
  25 da d8 00 08 00 00 a8 00 60 3f e0 00     00:04:39.885  READ DMA EXT
  25 da d8 00 08 00 13 5a 00 5a cf e0 00     00:04:39.864  READ DMA EXT
  25 da d8 00 08 00 00 29 00 60 e7 e0 00     00:04:39.864  READ DMA EXT
  25 da d8 00 08 00 00 1b 00 60 7f e0 00     00:04:39.864  READ DMA EXT

Error 173 [4] occurred at disk power-on lifetime: 858 hours (35 days + 18 hours)
  When the command that caused the error occurred, the device was active or idle.

  After command completion occurred, registers were:
  ER -- ST COUNT  LBA_48  LH LM LL DV DC
  -- -- -- == -- == == == -- -- -- -- --
  40 -- 51 00 08 00 00 a8 00 60 3f e0 00  Error: UNC 8 sectors at LBA = 0xa800603f = 2818596927

  Commands leading to the command that caused the error were:
  CR FEATR COUNT  LBA_48  LH LM LL DV DC  Powered_Up_Time  Command/Feature_Name
  -- == -- == -- == == == -- -- -- -- --  ---------------  --------------------
  25 da d8 00 08 00 00 a8 00 60 3f e0 00     00:04:39.885  READ DMA EXT
  25 da d8 00 08 00 13 5a 00 5a cf e0 00     00:04:39.864  READ DMA EXT
  25 da d8 00 08 00 00 29 00 60 e7 e0 00     00:04:39.864  READ DMA EXT
  25 da d8 00 08 00 00 1b 00 60 7f e0 00     00:04:39.864  READ DMA EXT
  25 da d8 00 08 00 00 2c 00 60 2f e0 00     00:04:39.864  READ DMA EXT

SMART Extended Self-test Log Version: 1 (1 sectors)
Num  Test_Description    Status                  Remaining  LifeTime(hours)  LBA_of_first_error
# 1  Short offline       Completed without error       00%     19443         -

SMART Selective self-test log data structure revision number 1
 SPAN  MIN_LBA  MAX_LBA  CURRENT_TEST_STATUS
    1        0        0  Not_testing
    2        0        0  Not_testing
    3        0        0  Not_testing
    4        0        0  Not_testing
    5        0        0  Not_testing
Selective self-test flags (0x0):
  After scanning selected spans, do NOT read-scan remainder of disk.
If Selective self-test is pending on power-up, resume after 0 minute delay.

SCT Status Version:                  2
SCT Version (vendor specific):       258 (0x0102)
Device State:                        SMART Off-line Data Collection executing in background (4)
Current Temperature:                    39 Celsius
Power Cycle Min/Max Temperature:     25/40 Celsius
Lifetime    Min/Max Temperature:     39/56 Celsius
Under/Over Temperature Limit Count:   0/0

SCT Temperature History Version:     2
Temperature Sampling Period:         1 minute
Temperature Logging Interval:        1 minute
Min/Max recommended Temperature:      0/60 Celsius
Min/Max Temperature Limit:           -41/85 Celsius
Temperature History Size (Index):    478 (467)

SCT Error Recovery Control:
           Read: Disabled
          Write: Disabled

Device Statistics (GP/SMART Log 0x04) not supported

Pending Defects log (GP Log 0x0c) not supported

SATA Phy Event Counters (GP Log 0x11)
ID      Size     Value  Description
0x0001  2            0  Command failed due to ICRC error
0x0002  2            0  R_ERR response for data FIS
0x0003  2            0  R_ERR response for device-to-host data FIS
0x0004  2            0  R_ERR response for host-to-device data FIS
0x0005  2            0  R_ERR response for non-data FIS
0x0006  2            0  R_ERR response for device-to-host non-data FIS
0x0007  2            0  R_ERR response for host-to-device non-data FIS
0x000a  2            2  Device-to-host register FISes sent due to a COMRESET
0x000b  2            0  CRC errors within host-to-device FIS
0x8000  4        25942  Vendor specific

