smartctl 7.4 2023-08-01 r5530 [x86_64-linux-6.1.90] (local build)
Copyright (C) 2002-23, Bruce Allen, Christian Franke, www.smartmontools.org

=== START OF INFORMATION SECTION ===
Model Number:                       GIGABYTE GP-GSM2NE3256GNTD
Serial Number:                      --
Firmware Version:                   EDFM00.5
PCI Vendor/Subsystem ID:            0x1987
IEEE OUI Identifier:                0x6479a7
Total NVM Capacity:                 256,060,514,304 [256 GB]
Unallocated NVM Capacity:           0
Controller ID:                      1
NVMe Version:                       1.3
Number of Namespaces:               1
Namespace 1 Size/Capacity:          256,060,514,304 [256 GB]
Namespace 1 Formatted LBA Size:     512
Namespace 1 IEEE EUI-64:            6479a7 ...
Local Time is:                      Sat May 25 22:56:46 2024 CEST
Firmware Updates (0x12):            1 Slot, no Reset required
Optional Admin Commands (0x0017):   Security Format Frmw_DL Self_Test
Optional NVM Commands (0x005e):     Wr_Unc DS_Mngmt Wr_Zero Sav/Sel_Feat Timestmp
Log Page Attributes (0x0e):         Cmd_Eff_Lg Ext_Get_Lg Telmtry_Lg
Maximum Data Transfer Size:         64 Pages
Warning  Comp. Temp. Threshold:     85 Celsius
Critical Comp. Temp. Threshold:     95 Celsius

Supported Power States
St Op     Max   Active     Idle   RL RT WL WT  Ent_Lat  Ex_Lat
 0 +     4.50W       -        -    0  0  0  0        0       0
 1 +     2.70W       -        -    1  1  1  1        0       0
 2 +     2.16W       -        -    2  2  2  2        0       0
 3 -   0.0700W       -        -    3  3  3  3     1000    1000
 4 -   0.0020W       -        -    4  4  4  4     5000   45000

Supported LBA Sizes (NSID 0x1)
Id Fmt  Data  Metadt  Rel_Perf
 0 +     512       0         1
 1 -    4096       0         0

=== START OF SMART DATA SECTION ===
SMART overall-health self-assessment test result: PASSED

SMART/Health Information (NVMe Log 0x02)
Critical Warning:                   0x00
Temperature:                        34 Celsius
Available Spare:                    100%
Available Spare Threshold:          5%
Percentage Used:                    23%
Data Units Read:                    207,234,156 [106 TB]
Data Units Written:                 72,742,944 [37.2 TB]
Host Read Commands:                 3,259,406,521
Host Write Commands:                1,258,664,424
Controller Busy Time:               9,320
Power Cycles:                       1,505
Power On Hours:                     10,746
Unsafe Shutdowns:                   121
Media and Data Integrity Errors:    0
Error Information Log Entries:      8,658,570
Warning  Comp. Temperature Time:    0
Critical Comp. Temperature Time:    0
Temperature Sensor 1:               60 Celsius

Error Information (NVMe Log 0x01, 16 of 16 entries)
Num   ErrCount  SQId   CmdId  Status  PELoc          LBA  NSID    VS  Message
  0    8658570     0  0x4009  0x4005      -            0     0     -  Invalid Field in Command
  1    8658569     0  0x100d  0x4004      -            0     0     -  Invalid Field in Command
  2    8658568     0  0x6017  0x4004      -            0     0     -  Invalid Field in Command
  3    8658567     0  0x6016  0x4004      -            0     0     -  Invalid Field in Command
  4    8658566     0  0x200a  0x4004      -            0     0     -  Invalid Field in Command
  5    8658565     0  0x100a  0x4004      -            0     0     -  Invalid Field in Command
  6    8658564     0  0x5016  0x4004      -            0     0     -  Invalid Field in Command
  7    8658563     0  0x3010  0x4004      -            0     0     -  Invalid Field in Command
  8    8658562     0  0x2010  0x4004      -            0     0     -  Invalid Field in Command
  9    8658561     0  0x000a  0x4005      -            0     0     -  Invalid Field in Command
 10    8658560     0  0x1010  0x4005      -            0     0     -  Invalid Field in Command
 11    8658559     0  0x0010  0x4005      -            0     0     -  Invalid Field in Command
 12    8658558     0  0xf010  0x4005      -            0     0     -  Invalid Field in Command
 13    8658557     0  0x4016  0x4005      -            0     0     -  Invalid Field in Command
 14    8658556     0  0xf00a  0x4005      -            0     0     -  Invalid Field in Command
 15    8658555     0  0x3016  0x4005      -            0     0     -  Invalid Field in Command

Read Self-test Log failed: Invalid Field in Command (0x2002)



