smartctl 7.1 2019-12-30 r5022 [x86_64-linux-5.5.3-14-tkg-pds] (local build)
Copyright (C) 2002-19, Bruce Allen, Christian Franke, www.smartmontools.org

=== START OF INFORMATION SECTION ===
Model Number:                       XPG GAMMIX S5
Serial Number:                      --
Firmware Version:                   V9001b31
PCI Vendor/Subsystem ID:            0x10ec
IEEE OUI Identifier:                0x00e04c
Controller ID:                      1
Number of Namespaces:               1
Namespace 1 Size/Capacity:          256,060,514,304 [256 GB]
Namespace 1 Formatted LBA Size:     512
Namespace 1 IEEE EUI-64:            525433 ...
Local Time is:                      Sun Mar  1 15:24:17 2020 EET
Firmware Updates (0x02):            1 Slot
Optional Admin Commands (0x0006):   Format Frmw_DL
Optional NVM Commands (0x0014):     DS_Mngmt Sav/Sel_Feat
Maximum Data Transfer Size:         32 Pages
Warning  Comp. Temp. Threshold:     118 Celsius
Critical Comp. Temp. Threshold:     150 Celsius

Supported Power States
St Op     Max   Active     Idle   RL RT WL WT  Ent_Lat  Ex_Lat
 0 +    50.00W       -        -    0  0  0  0        0       0

Supported LBA Sizes (NSID 0x1)
Id Fmt  Data  Metadt  Rel_Perf
 0 +     512       0         0

=== START OF SMART DATA SECTION ===
SMART overall-health self-assessment test result: PASSED

SMART/Health Information (NVMe Log 0x02)
Critical Warning:                   0x00
Temperature:                        41 Celsius
Available Spare:                    100%
Available Spare Threshold:          32%
Percentage Used:                    2%
Data Units Read:                    13,568,976 [6.94 TB]
Data Units Written:                 7,741,228 [3.96 TB]
Host Read Commands:                 122,320,592
Host Write Commands:                74,692,348
Controller Busy Time:               0
Power Cycles:                       375
Power On Hours:                     2,039
Unsafe Shutdowns:                   29
Media and Data Integrity Errors:    0
Error Information Log Entries:      0
Warning  Comp. Temperature Time:    0
Critical Comp. Temperature Time:    0

Error Information (NVMe Log 0x01, max 8 entries)
Num   ErrCount  SQId   CmdId  Status  PELoc          LBA  NSID    VS
  0          1     0  0x0000  0x0000  0x000            0     0     -
  6 1219368206019409473     0  0x0000  0x0000  0x000            0     0     -



