smartctl 7.1 2019-12-30 r5022 [x86_64-linux-5.4.0-67-generic] (local build)
Copyright (C) 2002-19, Bruce Allen, Christian Franke, www.smartmontools.org

=== START OF INFORMATION SECTION ===
Model Number:                       PLEXTOR PX-1TM8PeY
Serial Number:                      --
Firmware Version:                   1.05
PCI Vendor ID:                      0x14a4
PCI Vendor Subsystem ID:            0x1b4b
IEEE OUI Identifier:                0x002303
Total NVM Capacity:                 1,024,209,543,168 [1.02 TB]
Unallocated NVM Capacity:           0
Controller ID:                      1
Number of Namespaces:               1
Namespace 1 Size/Capacity:          1,024,209,543,168 [1.02 TB]
Namespace 1 Utilization:            0
Namespace 1 Formatted LBA Size:     512
Namespace 1 IEEE EUI-64:            002303 ...
Local Time is:                      Mon Mar 15 22:03:02 2021 UTC
Firmware Updates (0x14):            2 Slots, no Reset required
Optional Admin Commands (0x001f):   Security Format Frmw_DL NS_Mngmt Self_Test
Optional NVM Commands (0x001f):     Comp Wr_Unc DS_Mngmt Wr_Zero Sav/Sel_Feat
Maximum Data Transfer Size:         32 Pages
Warning  Comp. Temp. Threshold:     85 Celsius
Critical Comp. Temp. Threshold:     95 Celsius

Supported Power States
St Op     Max   Active     Idle   RL RT WL WT  Ent_Lat  Ex_Lat
 0 +     8.00W       -        -    0  0  0  0        0       0
 1 +     4.00W       -        -    1  1  1  1        5       5
 2 +     2.10W       -        -    2  2  2  2        5       5
 3 -   0.1000W       -        -    3  3  3  3     5000    5000
 4 -   0.0100W       -        -    4  4  4  4    50000  100000

Supported LBA Sizes (NSID 0x1)
Id Fmt  Data  Metadt  Rel_Perf
 0 -     512       0         0

=== START OF SMART DATA SECTION ===
SMART overall-health self-assessment test result: PASSED

SMART/Health Information (NVMe Log 0x02)
Critical Warning:                   0x00
Temperature:                        31 Celsius
Available Spare:                    100%
Available Spare Threshold:          0%
Percentage Used:                    7%
Data Units Read:                    11,351,946 [5.81 TB]
Data Units Written:                 60,577,582 [31.0 TB]
Host Read Commands:                 73,252,873
Host Write Commands:                585,609,758
Controller Busy Time:               96,504
Power Cycles:                       57
Power On Hours:                     1,687
Unsafe Shutdowns:                   39
Media and Data Integrity Errors:    0
Error Information Log Entries:      0
Warning  Comp. Temperature Time:    0
Critical Comp. Temperature Time:    0
Temperature Sensor 1:               31 Celsius

Error Information (NVMe Log 0x01, max 64 entries)
No Errors Logged

