smartctl 7.2 2020-12-30 r5155 [x86_64-linux-5.16.7-desktop-1omv4003] (OpenMandriva Lx 7.2-2)
Copyright (C) 2002-20, Bruce Allen, Christian Franke, www.smartmontools.org

=== START OF INFORMATION SECTION ===
Model Number:                       PM991a NVMe Samsung 256GB
Serial Number:                      --
Firmware Version:                   26300039
PCI Vendor/Subsystem ID:            0x144d
IEEE OUI Identifier:                0x002538
Total NVM Capacity:                 256,060,514,304 [256 GB]
Unallocated NVM Capacity:           0
Controller ID:                      5
NVMe Version:                       1.4
Number of Namespaces:               1
Namespace 1 Size/Capacity:          256,060,514,304 [256 GB]
Namespace 1 Utilization:            90,882,281,472 [90.8 GB]
Namespace 1 Formatted LBA Size:     512
Local Time is:                      Mon Jul 25 09:40:00 2022 BST
Firmware Updates (0x16):            3 Slots, no Reset required
Optional Admin Commands (0x0017):   Security Format Frmw_DL Self_Test
Optional NVM Commands (0x005f):     Comp Wr_Unc DS_Mngmt Wr_Zero Sav/Sel_Feat Timestmp
Log Page Attributes (0x1e):         Cmd_Eff_Lg Ext_Get_Lg Telmtry_Lg Pers_Ev_Lg
Maximum Data Transfer Size:         512 Pages
Warning  Comp. Temp. Threshold:     83 Celsius
Critical Comp. Temp. Threshold:     85 Celsius
Namespace 1 Features (0x10):        NP_Fields

Supported Power States
St Op     Max   Active     Idle   RL RT WL WT  Ent_Lat  Ex_Lat
 0 +     5.12W       -        -    0  0  0  0        0       0
 1 +     3.59W       -        -    1  1  1  1        0       0
 2 +     2.92W       -        -    2  2  2  2        0     500
 3 -   0.0500W       -        -    3  3  3  3      210    1200
 4 -   0.0050W       -        -    4  4  4  4     1000    9000

Supported LBA Sizes (NSID 0x1)
Id Fmt  Data  Metadt  Rel_Perf
 0 +     512       0         0

=== START OF SMART DATA SECTION ===
SMART overall-health self-assessment test result: PASSED

SMART/Health Information (NVMe Log 0x02)
Critical Warning:                   0x00
Temperature:                        25 Celsius
Available Spare:                    100%
Available Spare Threshold:          50%
Percentage Used:                    1%
Data Units Read:                    11,332,395 [5.80 TB]
Data Units Written:                 8,456,130 [4.32 TB]
Host Read Commands:                 145,825,677
Host Write Commands:                111,478,775
Controller Busy Time:               754
Power Cycles:                       203
Power On Hours:                     1,269
Unsafe Shutdowns:                   19
Media and Data Integrity Errors:    0
Error Information Log Entries:      0
Warning  Comp. Temperature Time:    0
Critical Comp. Temperature Time:    0
Temperature Sensor 1:               25 Celsius
Thermal Temp. 1 Transition Count:   60
Thermal Temp. 1 Total Time:         31

Error Information (NVMe Log 0x01, 16 of 64 entries)
No Errors Logged

